frame.number,_ws.col.Time,_ws.col.Source,_ws.col.Destination,_ws.col.Protocol,frame.len,_ws.col.Info
"1","0.000000000","136.147.56.129","192.168.1.118","TCP","66","443 → 40662 [ACK] Seq=1 Ack=1 Win=4926 Len=0 TSval=620720288 TSecr=3038292392"
"2","0.043019712","136.147.56.129","192.168.1.118","TCP","1414","[TCP segment of a reassembled PDU]"
"3","0.044461437","136.147.56.129","192.168.1.118","TLSv1.2","207","Application Data"
"4","0.044582775","136.147.56.129","192.168.1.118","TCP","7738","[TCP segment of a reassembled PDU]"
"5","0.044643175","136.147.56.129","192.168.1.118","TCP","423","443 → 40662 [PSH, ACK] Seq=9162 Ack=1 Win=4926 Len=357 TSval=620720340 TSecr=3038292392 [TCP segment of a reassembled PDU]"
"6","0.045581100","192.168.1.118","136.147.56.129","TCP","66","40662 → 443 [ACK] Seq=1 Ack=9519 Win=53838 Len=0 TSval=3038292514 TSecr=620720338"
"7","0.051427850","192.168.1.118","136.147.56.129","TCP","74","40664 → 443 [SYN] Seq=0 Win=64240 Len=0 MSS=1460 SACK_PERM=1 TSval=3038292519 TSecr=0 WS=128"
"8","0.111793625","136.147.56.129","192.168.1.118","TCP","1414","443 → 40662 [ACK] Seq=9519 Ack=1 Win=4926 Len=1348 TSval=620720407 TSecr=3038292514 [TCP segment of a reassembled PDU]"
"9","0.113478612","136.147.56.129","192.168.1.118","TLSv1.2","10668","Application Data, Application Data, Application Data"
"10","0.113917062","192.168.1.118","136.147.56.129","TCP","66","40662 → 443 [ACK] Seq=1 Ack=21469 Win=49876 Len=0 TSval=3038292582 TSecr=620720407"
"11","0.122560312","136.147.56.129","192.168.1.118","TCP","74","443 → 40664 [SYN, ACK] Seq=0 Ack=1 Win=4380 Len=0 MSS=1360 TSval=620720415 TSecr=3038292519 SACK_PERM=1"
"12","0.122746275","192.168.1.118","136.147.56.129","TCP","66","40664 → 443 [ACK] Seq=1 Ack=1 Win=64240 Len=0 TSval=3038292591 TSecr=620720415"
"13","0.178498162","192.168.1.118","136.147.56.129","TLSv1","583","Client Hello"
"14","0.180191725","192.168.1.118","209.18.47.62","DNS","77","Standard query 0x4428 A c1.sfdcstatic.com"
"15","0.181584362","192.168.1.118","209.18.47.62","DNS","77","Standard query 0x38a5 A c1.sfdcstatic.com"
"16","0.181862625","192.168.1.118","209.18.47.62","DNS","77","Standard query 0x04d0 A c1.sfdcstatic.com"
"17","0.184315412","192.168.1.118","209.18.47.62","DNS","77","Standard query 0x4c2e A c1.sfdcstatic.com"
"18","0.189867500","192.168.1.118","209.18.47.62","DNS","77","Standard query 0x98dc A c1.sfdcstatic.com"
"19","0.204296375","136.147.56.129","192.168.1.118","TCP","1414","443 → 40662 [ACK] Seq=21469 Ack=1 Win=4926 Len=1348 TSval=620720501 TSecr=3038292582 [TCP segment of a reassembled PDU]"
"20","0.204778512","136.147.56.129","192.168.1.118","TLSv1.2","1290","Application Data"
"21","0.204828275","192.168.1.118","136.147.56.129","TCP","66","40662 → 443 [ACK] Seq=1 Ack=24041 Win=62008 Len=0 TSval=3038292673 TSecr=620720501"
"22","0.216698650","209.18.47.62","192.168.1.118","DNS","168","Standard query response 0x38a5 A c1.sfdcstatic.com CNAME c.sfdcstatic.com.edgekey.net CNAME e4745.b.akamaiedge.net A 104.102.83.39"
"23","0.216985700","192.168.1.118","209.18.47.62","DNS","77","Standard query 0x784c AAAA c1.sfdcstatic.com"
"24","0.218250937","209.18.47.62","192.168.1.118","DNS","168","Standard query response 0x04d0 A c1.sfdcstatic.com CNAME c.sfdcstatic.com.edgekey.net CNAME e4745.b.akamaiedge.net A 104.102.83.39"
"25","0.218406625","192.168.1.118","209.18.47.62","DNS","77","Standard query 0x38a2 AAAA c1.sfdcstatic.com"
"26","0.221644112","209.18.47.62","192.168.1.118","DNS","168","Standard query response 0x4428 A c1.sfdcstatic.com CNAME c.sfdcstatic.com.edgekey.net CNAME e4745.b.akamaiedge.net A 104.102.83.39"
"27","0.221828600","192.168.1.118","209.18.47.62","DNS","77","Standard query 0xb861 AAAA c1.sfdcstatic.com"
"28","0.230776337","209.18.47.62","192.168.1.118","DNS","168","Standard query response 0x4c2e A c1.sfdcstatic.com CNAME c.sfdcstatic.com.edgekey.net CNAME e4745.b.akamaiedge.net A 104.64.212.198"
"29","0.231010050","192.168.1.118","209.18.47.62","DNS","77","Standard query 0x8c54 AAAA c1.sfdcstatic.com"
"30","0.238722062","209.18.47.62","192.168.1.118","DNS","168","Standard query response 0x98dc A c1.sfdcstatic.com CNAME c.sfdcstatic.com.edgekey.net CNAME e4745.b.akamaiedge.net A 104.64.212.198"
"31","0.238927637","192.168.1.118","209.18.47.62","DNS","77","Standard query 0x50b2 AAAA c1.sfdcstatic.com"
"32","0.239703825","209.18.47.62","192.168.1.118","DNS","210","Standard query response 0x38a2 AAAA c1.sfdcstatic.com CNAME c.sfdcstatic.com.edgekey.net CNAME e4745.b.akamaiedge.net SOA n0b.akamaiedge.net"
"33","0.239739075","209.18.47.62","192.168.1.118","DNS","210","Standard query response 0x784c AAAA c1.sfdcstatic.com CNAME c.sfdcstatic.com.edgekey.net CNAME e4745.b.akamaiedge.net SOA n0b.akamaiedge.net"
"34","0.239769237","209.18.47.62","192.168.1.118","DNS","210","Standard query response 0xb861 AAAA c1.sfdcstatic.com CNAME c.sfdcstatic.com.edgekey.net CNAME e4745.b.akamaiedge.net SOA n0b.akamaiedge.net"
"35","0.240344975","192.168.1.118","104.102.83.39","TCP","74","34604 → 443 [SYN] Seq=0 Win=64240 Len=0 MSS=1460 SACK_PERM=1 TSval=2052261063 TSecr=0 WS=128"
"36","0.240458525","192.168.1.118","104.102.83.39","TCP","74","34606 → 443 [SYN] Seq=0 Win=64240 Len=0 MSS=1460 SACK_PERM=1 TSval=2052261064 TSecr=0 WS=128"
"37","0.240534950","192.168.1.118","104.102.83.39","TCP","74","34608 → 443 [SYN] Seq=0 Win=64240 Len=0 MSS=1460 SACK_PERM=1 TSval=2052261064 TSecr=0 WS=128"
"38","0.240610037","192.168.1.118","104.102.83.39","TCP","74","34610 → 443 [SYN] Seq=0 Win=64240 Len=0 MSS=1460 SACK_PERM=1 TSval=2052261064 TSecr=0 WS=128"
"39","0.240685137","192.168.1.118","104.102.83.39","TCP","74","34612 → 443 [SYN] Seq=0 Win=64240 Len=0 MSS=1460 SACK_PERM=1 TSval=2052261064 TSecr=0 WS=128"
"40","0.244668512","209.18.47.62","192.168.1.118","DNS","210","Standard query response 0x8c54 AAAA c1.sfdcstatic.com CNAME c.sfdcstatic.com.edgekey.net CNAME e4745.b.akamaiedge.net SOA n0b.akamaiedge.net"
"41","0.250057312","192.168.1.104","255.255.255.255","UDP","217","49154 → 6666 Len=175"
"42","0.258582787","209.18.47.62","192.168.1.118","DNS","210","Standard query response 0x50b2 AAAA c1.sfdcstatic.com CNAME c.sfdcstatic.com.edgekey.net CNAME e4745.b.akamaiedge.net SOA n0b.akamaiedge.net"
"43","0.264976387","136.147.56.129","192.168.1.118","TCP","66","443 → 40664 [ACK] Seq=1 Ack=518 Win=4597 Len=0 TSval=620720555 TSecr=3038292647"
"44","0.265910687","136.147.56.129","192.168.1.118","TLSv1.2","4110","Server Hello"
"45","0.265970450","192.168.1.118","136.147.56.129","TCP","66","40664 → 443 [ACK] Seq=518 Ack=4045 Win=60196 Len=0 TSval=3038292734 TSecr=620720558"
"46","0.266640587","104.102.83.39","192.168.1.118","TCP","74","443 → 34608 [SYN, ACK] Seq=0 Ack=1 Win=28960 Len=0 MSS=1460 SACK_PERM=1 TSval=177423884 TSecr=2052261064 WS=128"
"47","0.266717950","192.168.1.118","104.102.83.39","TCP","66","34608 → 443 [ACK] Seq=1 Ack=1 Win=64256 Len=0 TSval=2052261090 TSecr=177423884"
"48","0.267431737","104.102.83.39","192.168.1.118","TCP","74","443 → 34604 [SYN, ACK] Seq=0 Ack=1 Win=28960 Len=0 MSS=1460 SACK_PERM=1 TSval=177423884 TSecr=2052261063 WS=128"
"49","0.267490412","192.168.1.118","104.102.83.39","TCP","66","34604 → 443 [ACK] Seq=1 Ack=1 Win=64256 Len=0 TSval=2052261091 TSecr=177423884"
"50","0.267532075","104.102.83.39","192.168.1.118","TCP","74","443 → 34612 [SYN, ACK] Seq=0 Ack=1 Win=28960 Len=0 MSS=1460 SACK_PERM=1 TSval=177423884 TSecr=2052261064 WS=128"
"51","0.267588062","192.168.1.118","104.102.83.39","TCP","66","34612 → 443 [ACK] Seq=1 Ack=1 Win=64256 Len=0 TSval=2052261091 TSecr=177423884"
"52","0.267627325","104.102.83.39","192.168.1.118","TCP","74","443 → 34610 [SYN, ACK] Seq=0 Ack=1 Win=28960 Len=0 MSS=1460 SACK_PERM=1 TSval=177423884 TSecr=2052261064 WS=128"
"53","0.267682750","192.168.1.118","104.102.83.39","TCP","66","34610 → 443 [ACK] Seq=1 Ack=1 Win=64256 Len=0 TSval=2052261091 TSecr=177423884"
"54","0.268710025","104.102.83.39","192.168.1.118","TCP","74","443 → 34606 [SYN, ACK] Seq=0 Ack=1 Win=28960 Len=0 MSS=1460 SACK_PERM=1 TSval=177423884 TSecr=2052261064 WS=128"
"55","0.268766700","192.168.1.118","104.102.83.39","TCP","66","34606 → 443 [ACK] Seq=1 Ack=1 Win=64256 Len=0 TSval=2052261092 TSecr=177423884"
"56","0.284201850","192.168.1.118","104.102.83.39","TLSv1","583","Client Hello"
"57","0.300160500","104.102.83.39","192.168.1.118","TCP","66","443 → 34608 [ACK] Seq=1 Ack=518 Win=30080 Len=0 TSval=177423919 TSecr=2052261107"
"58","0.300645250","192.168.1.118","104.102.83.39","TLSv1","583","Client Hello"
"59","0.302146037","104.102.83.39","192.168.1.118","TLSv1.2","1514","Server Hello"
"60","0.302221512","192.168.1.118","104.102.83.39","TCP","66","34608 → 443 [ACK] Seq=518 Ack=1449 Win=63104 Len=0 TSval=2052261125 TSecr=177423920"
"61","0.307048487","104.102.83.39","192.168.1.118","TLSv1.2","1891","Certificate, Server Key Exchange, Server Hello Done"
"62","0.307116212","192.168.1.118","104.102.83.39","TCP","66","34608 → 443 [ACK] Seq=518 Ack=3274 Win=61312 Len=0 TSval=2052261130 TSecr=177423920"
"63","0.317088250","192.168.1.118","104.102.83.39","TLSv1","583","Client Hello"
"64","0.323408025","104.102.83.39","192.168.1.118","TCP","66","443 → 34610 [ACK] Seq=1 Ack=518 Win=30080 Len=0 TSval=177423939 TSecr=2052261124"
"65","0.324607675","104.102.83.39","192.168.1.118","TLSv1.2","3339","Server Hello, Certificate, Server Key Exchange, Server Hello Done"
"66","0.324690962","192.168.1.118","104.102.83.39","TCP","66","34610 → 443 [ACK] Seq=518 Ack=3274 Win=61056 Len=0 TSval=2052261148 TSecr=177423941"
"67","0.327002375","136.147.56.129","192.168.1.118","TLSv1.2","1108","Certificate, Server Key Exchange, Server Hello Done"
"68","0.327079250","192.168.1.118","136.147.56.129","TCP","66","40664 → 443 [ACK] Seq=518 Ack=5087 Win=62008 Len=0 TSval=3038292795 TSecr=620720625"
"69","0.333523750","192.168.1.118","104.102.83.39","TLSv1","583","Client Hello"
"70","0.335773812","104.102.83.39","192.168.1.118","TCP","66","443 → 34612 [ACK] Seq=1 Ack=518 Win=30080 Len=0 TSval=177423954 TSecr=2052261140"
"71","0.341205600","104.102.83.39","192.168.1.118","TLSv1.2","1514","Server Hello"
"72","0.341286062","192.168.1.118","104.102.83.39","TCP","66","34612 → 443 [ACK] Seq=518 Ack=1449 Win=63104 Len=0 TSval=2052261164 TSecr=177423959"
"73","0.342151625","104.102.83.39","192.168.1.118","TLSv1.2","1891","Certificate, Server Key Exchange, Server Hello Done"
"74","0.342237162","192.168.1.118","104.102.83.39","TCP","66","34612 → 443 [ACK] Seq=518 Ack=3274 Win=61312 Len=0 TSval=2052261165 TSecr=177423959"
"75","0.349959875","192.168.1.118","104.102.83.39","TLSv1","583","Client Hello"
"76","0.351734212","104.102.83.39","192.168.1.118","TCP","66","443 → 34604 [ACK] Seq=1 Ack=518 Win=30080 Len=0 TSval=177423970 TSecr=2052261157"
"77","0.352021862","192.168.1.118","104.102.83.39","TLSv1.2","192","Client Key Exchange, Change Cipher Spec, Encrypted Handshake Message"
"78","0.353922525","192.168.1.118","104.102.83.39","TLSv1.2","192","Client Key Exchange, Change Cipher Spec, Encrypted Handshake Message"
"79","0.355805487","192.168.1.118","104.102.83.39","TLSv1.2","192","Client Key Exchange, Change Cipher Spec, Encrypted Handshake Message"
"80","0.364540362","104.102.83.39","192.168.1.118","TLSv1.2","1514","Server Hello"
"81","0.364629300","192.168.1.118","104.102.83.39","TCP","66","34604 → 443 [ACK] Seq=518 Ack=1449 Win=63104 Len=0 TSval=2052261188 TSecr=177423982"
"82","0.365489812","104.102.83.39","192.168.1.118","TLSv1.2","1891","Certificate, Server Key Exchange, Server Hello Done"
"83","0.365579237","192.168.1.118","104.102.83.39","TCP","66","34604 → 443 [ACK] Seq=518 Ack=3274 Win=61312 Len=0 TSval=2052261189 TSecr=177423982"
"84","0.366285000","104.102.83.39","192.168.1.118","TCP","66","443 → 34606 [ACK] Seq=1 Ack=518 Win=30080 Len=0 TSval=177423985 TSecr=2052261173"
"85","0.366381075","192.168.1.118","192.168.1.102","TCP","176","44768 → 8009 [PSH, ACK] Seq=1 Ack=1 Win=501 Len=110 TSval=2259028601 TSecr=5355065 [TCP segment of a reassembled PDU]"
"86","0.368596137","192.168.1.118","136.147.56.129","TLSv1.2","192","Client Key Exchange, Change Cipher Spec, Encrypted Handshake Message"
"87","0.369552550","104.102.83.39","192.168.1.118","TLSv1.2","117","Change Cipher Spec, Encrypted Handshake Message"
"88","0.369649837","192.168.1.118","104.102.83.39","TCP","66","34608 → 443 [ACK] Seq=644 Ack=3325 Win=64128 Len=0 TSval=2052261193 TSecr=177423987"
"89","0.370521012","192.168.1.118","104.102.83.39","TLSv1.2","192","Client Key Exchange, Change Cipher Spec, Encrypted Handshake Message"
"90","0.370823137","192.168.1.118","104.102.83.39","TLSv1.2","309","Application Data"
"91","0.388046562","192.168.1.102","192.168.1.118","TCP","176","8009 → 44768 [PSH, ACK] Seq=1 Ack=111 Win=294 Len=110 TSval=5355566 TSecr=2259028601 [TCP segment of a reassembled PDU]"
"92","0.388123275","192.168.1.118","192.168.1.102","TCP","66","44768 → 8009 [ACK] Seq=111 Ack=111 Win=501 Len=0 TSval=2259028623 TSecr=5355566"
"93","0.389798500","104.102.83.39","192.168.1.118","TLSv1.2","3339","Server Hello, Certificate, Server Key Exchange, Server Hello Done"
"94","0.389861112","192.168.1.118","104.102.83.39","TCP","66","34606 → 443 [ACK] Seq=518 Ack=3274 Win=61056 Len=0 TSval=2052261213 TSecr=177423989"
"95","0.389935725","104.102.83.39","192.168.1.118","TLSv1.2","117","Change Cipher Spec, Encrypted Handshake Message"
"96","0.389997800","104.102.83.39","192.168.1.118","TLSv1.2","117","Change Cipher Spec, Encrypted Handshake Message"
"97","0.391914312","192.168.1.118","104.102.83.39","TLSv1.2","192","Client Key Exchange, Change Cipher Spec, Encrypted Handshake Message"
"98","0.392229887","192.168.1.118","104.102.83.39","TLSv1.2","296","Application Data"
"99","0.392447187","192.168.1.118","104.102.83.39","TLSv1.2","305","Application Data"
"100","0.396750312","104.102.83.39","192.168.1.118","TLSv1.2","117","Change Cipher Spec, Encrypted Handshake Message"
"101","0.399635587","192.168.1.118","104.102.83.39","TLSv1.2","336","Application Data"
"102","0.402339025","104.102.83.39","192.168.1.118","TCP","1514","[TCP segment of a reassembled PDU]"
"103","0.404990712","104.102.83.39","192.168.1.118","TCP","5858","443 → 34608 [ACK] Seq=4773 Ack=887 Win=31104 Len=5792 TSval=177424016 TSecr=2052261194 [TCP segment of a reassembled PDU]"
"104","0.405180325","104.102.83.39","192.168.1.118","TLSv1.2","10202","Application Data [TCP segment of a reassembled PDU]"
"105","0.405291075","104.102.83.39","192.168.1.118","TCP","5858","443 → 34608 [ACK] Seq=20701 Ack=887 Win=31104 Len=5792 TSval=177424017 TSecr=2052261194 [TCP segment of a reassembled PDU]"
"106","0.405376137","192.168.1.118","104.102.83.39","TCP","66","34608 → 443 [ACK] Seq=887 Ack=20701 Win=46848 Len=0 TSval=2052261228 TSecr=177424016"
"107","0.406684812","192.168.1.118","104.102.83.39","TCP","66","34608 → 443 [ACK] Seq=887 Ack=26493 Win=41088 Len=0 TSval=2052261230 TSecr=177424017"
"108","0.408674687","104.102.83.39","192.168.1.118","TCP","66","443 → 34606 [ACK] Seq=3274 Ack=644 Win=30080 Len=0 TSval=177424025 TSecr=2052261215"
"109","0.409366212","104.102.83.39","192.168.1.118","TLSv1.2","117","Change Cipher Spec, Encrypted Handshake Message"
"110","0.419931037","104.102.83.39","192.168.1.118","TCP","1514","[TCP segment of a reassembled PDU]"
"111","0.420731475","104.102.83.39","192.168.1.118","TLSv1.2","2188","Application Data"
"112","0.421602362","104.102.83.39","192.168.1.118","TCP","1514","443 → 34608 [ACK] Seq=26493 Ack=887 Win=31104 Len=1448 TSval=177424039 TSecr=2052261228 [TCP segment of a reassembled PDU]"
"113","0.422849250","104.102.83.39","192.168.1.118","TCP","4410","443 → 34608 [ACK] Seq=27941 Ack=887 Win=31104 Len=4344 TSval=177424039 TSecr=2052261228 [TCP segment of a reassembled PDU]"
"114","0.422905962","192.168.1.118","104.102.83.39","TCP","66","34608 → 443 [ACK] Seq=887 Ack=32285 Win=56960 Len=0 TSval=2052261246 TSecr=177424039"
"115","0.422973600","104.102.83.39","192.168.1.118","TCP","2962","443 → 34608 [ACK] Seq=32285 Ack=887 Win=31104 Len=2896 TSval=177424039 TSecr=2052261230 [TCP segment of a reassembled PDU]"
"116","0.424847087","104.102.83.39","192.168.1.118","TLSv1.2","13098","Application Data, Application Data"
"117","0.426021512","104.102.83.39","192.168.1.118","TCP","4410","443 → 34608 [ACK] Seq=48213 Ack=887 Win=31104 Len=4344 TSval=177424040 TSecr=2052261230 [TCP segment of a reassembled PDU]"
"118","0.426049625","104.102.83.39","192.168.1.118","TCP","1514","443 → 34608 [ACK] Seq=52557 Ack=887 Win=31104 Len=1448 TSval=177424041 TSecr=2052261230 [TCP segment of a reassembled PDU]"
"119","0.427087562","104.102.83.39","192.168.1.118","TLSv1.2","1514","Application Data [TCP segment of a reassembled PDU]"
"120","0.427132650","104.102.83.39","192.168.1.118","TCP","2962","443 → 34608 [ACK] Seq=55453 Ack=887 Win=31104 Len=2896 TSval=177424042 TSecr=2052261230 [TCP segment of a reassembled PDU]"
"121","0.428578512","104.102.83.39","192.168.1.118","TLSv1.2","6149","Application Data"
"122","0.428646862","104.102.83.39","192.168.1.118","TCP","1514","443 → 34608 [ACK] Seq=58349 Ack=887 Win=31104 Len=1448 TSval=177424043 TSecr=2052261230 [TCP segment of a reassembled PDU]"
"123","0.429419475","104.102.83.39","192.168.1.118","TCP","1514","443 → 34608 [ACK] Seq=59797 Ack=887 Win=31104 Len=1448 TSval=177424043 TSecr=2052261230 [TCP segment of a reassembled PDU]"
"124","0.429480487","104.102.83.39","192.168.1.118","TCP","2962","443 → 34608 [ACK] Seq=61245 Ack=887 Win=31104 Len=2896 TSval=177424044 TSecr=2052261230 [TCP segment of a reassembled PDU]"
"125","0.429970925","104.102.83.39","192.168.1.118","TCP","1514","443 → 34608 [ACK] Seq=64141 Ack=887 Win=31104 Len=1448 TSval=177424045 TSecr=2052261230 [TCP segment of a reassembled PDU]"
"126","0.430741987","104.102.83.39","192.168.1.118","TLSv1.2","1514","Application Data [TCP segment of a reassembled PDU]"
"127","0.432164425","192.168.1.118","104.102.83.39","TLSv1.2","320","Application Data"
"128","0.432259637","192.168.1.118","104.102.83.39","TCP","66","34608 → 443 [ACK] Seq=887 Ack=67037 Win=64128 Len=0 TSval=2052261255 TSecr=177424039"
"129","0.432716162","136.147.56.129","192.168.1.118","TCP","66","443 → 40664 [ACK] Seq=5087 Ack=644 Win=4723 Len=0 TSval=620720731 TSecr=3038292837"
"130","0.433627237","192.168.1.118","104.102.83.39","TCP","66","34610 → 443 [ACK] Seq=874 Ack=6895 Win=60672 Len=0 TSval=2052261257 TSecr=177424038"
"131","0.433935737","192.168.1.118","104.102.83.39","TCP","66","34612 → 443 [ACK] Seq=883 Ack=9408 Win=58112 Len=0 TSval=2052261257 TSecr=177424045"
"132","0.434752950","192.168.1.118","209.18.47.62","DNS","80","Standard query 0x38b3 A fonts.googleapis.com"
"133","0.436030312","104.102.83.39","192.168.1.118","TCP","1514","[TCP segment of a reassembled PDU]"
"134","0.436938675","104.102.83.39","192.168.1.118","TLSv1.2","1243","Application Data"
"135","0.436986650","136.147.56.129","192.168.1.118","TLSv1.2","72","Change Cipher Spec"
"136","0.437034575","192.168.1.118","136.147.56.129","TCP","66","40664 → 443 [ACK] Seq=644 Ack=5093 Win=63356 Len=0 TSval=3038292905 TSecr=620720731"
"137","0.437084375","136.147.56.129","192.168.1.118","TLSv1.2","111","Encrypted Handshake Message"
"138","0.437128425","192.168.1.118","136.147.56.129","TCP","66","40664 → 443 [ACK] Seq=644 Ack=5138 Win=63356 Len=0 TSval=3038292905 TSecr=620720731"
"139","0.437866125","104.102.83.39","192.168.1.118","TCP","1514","443 → 34608 [ACK] Seq=67037 Ack=887 Win=31104 Len=1448 TSval=177424055 TSecr=2052261246 [TCP segment of a reassembled PDU]"
"140","0.439889175","104.102.83.39","192.168.1.118","TCP","2962","443 → 34608 [ACK] Seq=68485 Ack=887 Win=31104 Len=2896 TSval=177424055 TSecr=2052261246 [TCP segment of a reassembled PDU]"
"141","0.439948387","192.168.1.118","104.102.83.39","TCP","66","34608 → 443 [ACK] Seq=887 Ack=71381 Win=72832 Len=0 TSval=2052261263 TSecr=177424055"
"142","0.440700850","104.102.83.39","192.168.1.118","TCP","1514","443 → 34608 [ACK] Seq=71381 Ack=887 Win=31104 Len=1448 TSval=177424055 TSecr=2052261246 [TCP segment of a reassembled PDU]"
"143","0.442684475","104.102.83.39","192.168.1.118","TCP","2962","443 → 34608 [ACK] Seq=72829 Ack=887 Win=31104 Len=2896 TSval=177424055 TSecr=2052261246 [TCP segment of a reassembled PDU]"
"144","0.442771750","192.168.1.118","104.102.83.39","TCP","66","34608 → 443 [ACK] Seq=887 Ack=75725 Win=81536 Len=0 TSval=2052261266 TSecr=177424055"
"145","0.442839962","104.102.83.39","192.168.1.118","TCP","2962","443 → 34608 [PSH, ACK] Seq=75725 Ack=887 Win=31104 Len=2896 TSval=177424056 TSecr=2052261246 [TCP segment of a reassembled PDU]"
"146","0.442908250","192.168.1.118","104.102.83.39","TCP","66","34608 → 443 [ACK] Seq=887 Ack=78621 Win=87296 Len=0 TSval=2052261266 TSecr=177424056"
"147","0.444957100","104.102.83.39","192.168.1.118","TCP","2962","443 → 34608 [ACK] Seq=78621 Ack=887 Win=31104 Len=2896 TSval=177424057 TSecr=2052261246 [TCP segment of a reassembled PDU]"
"148","0.445038325","192.168.1.118","104.102.83.39","TCP","66","34608 → 443 [ACK] Seq=887 Ack=81517 Win=93056 Len=0 TSval=2052261268 TSecr=177424057"
"149","0.445107450","104.102.83.39","192.168.1.118","TLSv1.2","2962","Application Data [TCP segment of a reassembled PDU]"
"150","0.445157575","192.168.1.118","104.102.83.39","TCP","66","34608 → 443 [ACK] Seq=887 Ack=84413 Win=98944 Len=0 TSval=2052261268 TSecr=177424058"
"151","0.457036750","104.102.83.39","192.168.1.118","TCP","1514","443 → 34608 [ACK] Seq=84413 Ack=887 Win=31104 Len=1448 TSval=177424075 TSecr=2052261268 [TCP segment of a reassembled PDU]"
"152","0.457779950","104.102.83.39","192.168.1.118","TCP","2962","443 → 34608 [ACK] Seq=85861 Ack=887 Win=31104 Len=2896 TSval=177424075 TSecr=2052261268 [TCP segment of a reassembled PDU]"
"153","0.457824625","192.168.1.118","104.102.83.39","TCP","66","34608 → 443 [ACK] Seq=887 Ack=88757 Win=107648 Len=0 TSval=2052261281 TSecr=177424075"
"154","0.459370337","104.102.83.39","192.168.1.118","TCP","8754","443 → 34608 [ACK] Seq=88757 Ack=887 Win=31104 Len=8688 TSval=177424075 TSecr=2052261268 [TCP segment of a reassembled PDU]"
"155","0.459434525","192.168.1.118","104.102.83.39","TCP","66","34608 → 443 [ACK] Seq=887 Ack=97445 Win=124928 Len=0 TSval=2052261283 TSecr=177424075"
"156","0.461091137","104.102.83.39","192.168.1.118","TLSv1.2","4410","Application Data [TCP segment of a reassembled PDU]"
"157","0.461143162","192.168.1.118","104.102.83.39","TCP","66","34608 → 443 [ACK] Seq=887 Ack=101789 Win=133632 Len=0 TSval=2052261284 TSecr=177424075"
"158","0.461198675","104.102.83.39","192.168.1.118","TLSv1.2","5858","Application Data [TCP segment of a reassembled PDU]"
"159","0.461219150","192.168.1.118","104.102.83.39","TCP","66","34608 → 443 [ACK] Seq=887 Ack=107581 Win=145280 Len=0 TSval=2052261284 TSecr=177424076"
"160","0.462891762","104.102.83.39","192.168.1.118","TCP","8754","443 → 34608 [ACK] Seq=107581 Ack=887 Win=31104 Len=8688 TSval=177424076 TSecr=2052261268 [TCP segment of a reassembled PDU]"
"161","0.462948125","192.168.1.118","104.102.83.39","TCP","66","34608 → 443 [ACK] Seq=887 Ack=116269 Win=162560 Len=0 TSval=2052261286 TSecr=177424076"
"162","0.465166737","104.102.83.39","192.168.1.118","TCP","5858","443 → 34608 [ACK] Seq=116269 Ack=887 Win=31104 Len=5792 TSval=177424078 TSecr=2052261268 [TCP segment of a reassembled PDU]"
"163","0.465226362","192.168.1.118","104.102.83.39","TCP","66","34608 → 443 [ACK] Seq=887 Ack=122061 Win=174208 Len=0 TSval=2052261288 TSecr=177424078"
"164","0.465333762","104.102.83.39","192.168.1.118","TLSv1.2","8545","Application Data"
"165","0.465376387","104.102.83.39","192.168.1.118","TLSv1.2","4410","Application Data [TCP segment of a reassembled PDU]"
"166","0.467690125","104.102.83.39","192.168.1.118","TCP","1514","443 → 34608 [ACK] Seq=126405 Ack=887 Win=31104 Len=1448 TSval=177424079 TSecr=2052261268 [TCP segment of a reassembled PDU]"
"167","0.467730800","104.102.83.39","192.168.1.118","TCP","1514","443 → 34608 [ACK] Seq=127853 Ack=887 Win=31104 Len=1448 TSval=177424080 TSecr=2052261268 [TCP segment of a reassembled PDU]"
"168","0.467835937","104.102.83.39","192.168.1.118","TLSv1.2","10202","Application Data [TCP segment of a reassembled PDU]"
"169","0.467883162","209.18.47.62","192.168.1.118","DNS","96","Standard query response 0x38b3 A fonts.googleapis.com A 172.217.10.74"
"170","0.467925962","104.102.83.39","192.168.1.118","TCP","8754","443 → 34608 [ACK] Seq=139437 Ack=887 Win=31104 Len=8688 TSval=177424081 TSecr=2052261268 [TCP segment of a reassembled PDU]"
"171","0.468027425","192.168.1.118","209.18.47.62","DNS","80","Standard query 0x0c6b AAAA fonts.googleapis.com"
"172","0.468825737","104.102.83.39","192.168.1.118","TLSv1.2","2139","Application Data, Application Data"
"173","0.475942600","192.168.1.118","136.147.56.129","TLSv1.2","307","Application Data"
"174","0.476032450","192.168.1.118","104.102.83.39","TCP","66","34604 → 443 [ACK] Seq=914 Ack=5950 Win=61568 Len=0 TSval=2052261299 TSecr=177424051"
"175","0.476291537","192.168.1.118","104.102.83.39","TCP","66","34606 → 443 [ACK] Seq=898 Ack=11804 Win=55680 Len=0 TSval=2052261299 TSecr=177424080"
"176","0.477179537","192.168.1.118","104.102.83.39","TCP","66","34608 → 443 [ACK] Seq=887 Ack=150198 Win=146176 Len=0 TSval=2052261300 TSecr=177424079"
"177","0.478386450","192.168.1.118","104.102.83.39","TLSv1.2","307","Application Data"
"178","0.478500925","192.168.1.118","104.102.83.39","TLSv1.2","305","Application Data"
"179","0.484824250","209.18.47.62","192.168.1.118","DNS","108","Standard query response 0x0c6b AAAA fonts.googleapis.com AAAA 2607:f8b0:4006:810::200a"
"180","0.502625062","104.102.83.39","192.168.1.118","TLSv1.2","671","Application Data"
"181","0.503501450","104.102.83.39","192.168.1.118","TLSv1.2","2533","Application Data"
"182","0.539746062","136.147.56.129","192.168.1.118","TCP","66","443 → 40664 [ACK] Seq=5138 Ack=885 Win=4964 Len=0 TSval=620720837 TSecr=3038292944"
"183","0.542907600","192.168.1.118","104.102.83.39","TCP","66","34604 → 443 [ACK] Seq=1155 Ack=6555 Win=63616 Len=0 TSval=2052261366 TSecr=177424117"
"184","0.543895550","192.168.1.118","104.102.83.39","TCP","66","34606 → 443 [ACK] Seq=1137 Ack=14271 Win=61696 Len=0 TSval=2052261367 TSecr=177424117"
"185","0.559972700","192.168.1.118","172.217.10.74","TCP","74","33410 → 443 [SYN] Seq=0 Win=64240 Len=0 MSS=1460 SACK_PERM=1 TSval=3133213083 TSecr=0 WS=128"
"186","0.560397362","192.168.1.118","104.102.83.39","TLSv1.2","293","Application Data"
"187","0.560496437","192.168.1.118","104.102.83.39","TLSv1.2","317","Application Data"
"188","0.563259237","192.168.1.118","104.102.83.39","TLSv1.2","340","Application Data"
"189","0.595510137","172.217.10.74","192.168.1.118","TCP","74","443 → 33410 [SYN, ACK] Seq=0 Ack=1 Win=60192 Len=0 MSS=1380 SACK_PERM=1 TSval=4167107938 TSecr=3133213083 WS=256"
"190","0.595659462","192.168.1.118","172.217.10.74","TCP","66","33410 → 443 [ACK] Seq=1 Ack=1 Win=64256 Len=0 TSval=3133213119 TSecr=4167107938"
"191","0.598284587","104.102.83.39","192.168.1.118","TCP","1514","[TCP segment of a reassembled PDU]"
"192","0.598424750","192.168.1.118","104.102.83.39","TCP","66","34604 → 443 [ACK] Seq=1382 Ack=8003 Win=63104 Len=0 TSval=2052261421 TSecr=177424215"
"193","0.606382862","104.102.83.39","192.168.1.118","TLSv1.2","3180","Application Data"
"194","0.606509325","192.168.1.118","104.102.83.39","TCP","66","34604 → 443 [ACK] Seq=1382 Ack=11117 Win=60032 Len=0 TSval=2052261430 TSecr=177424215"
"195","0.661746962","104.102.83.39","192.168.1.118","TLSv1.2","871","Application Data"
"196","0.664550712","104.102.83.39","192.168.1.118","TLSv1.2","23234","Application Data"
"197","0.664720262","192.168.1.118","104.102.83.39","TCP","66","34606 → 443 [ACK] Seq=1388 Ack=37439 Win=40960 Len=0 TSval=2052261488 TSecr=177424246"
"198","0.667011737","104.102.83.39","192.168.1.118","TLSv1.2","5364","Application Data"
"199","0.667148437","136.147.56.129","192.168.1.118","TLSv1.2","1285","Application Data"
"200","0.697614762","192.168.1.118","172.217.10.74","TLSv1","583","Client Hello"
"201","0.697924250","192.168.1.118","104.102.83.39","TCP","66","34606 → 443 [ACK] Seq=1388 Ack=42737 Win=35712 Len=0 TSval=2052261521 TSecr=177424247"
"202","0.702038900","192.168.1.118","104.102.83.39","TCP","66","34610 → 443 [ACK] Seq=1148 Ack=7700 Win=64128 Len=0 TSval=2052261525 TSecr=177424244"
"203","0.708146062","192.168.1.118","136.147.56.129","TCP","66","40664 → 443 [ACK] Seq=885 Ack=6357 Win=63356 Len=0 TSval=3038293176 TSecr=620720948"
"204","0.720165175","172.217.10.74","192.168.1.118","TCP","66","443 → 33410 [ACK] Seq=1 Ack=518 Win=61440 Len=0 TSval=4167108058 TSecr=3133213221"
"205","0.726753550","172.217.10.74","192.168.1.118","TLSv1.2","2958","Server Hello, Certificate, Server Key Exchange, Server Hello Done"
"206","0.726810000","192.168.1.118","172.217.10.74","TCP","66","33410 → 443 [ACK] Seq=518 Ack=2893 Win=61440 Len=0 TSval=3133213250 TSecr=4167108065"
"207","0.758447500","192.168.1.118","172.217.10.74","TLSv1.2","192","Client Key Exchange, Change Cipher Spec, Encrypted Handshake Message"
"208","0.776894362","172.217.10.74","192.168.1.118","TLSv1.2","117","Change Cipher Spec, Encrypted Handshake Message"
"209","0.777314587","192.168.1.118","172.217.10.74","TLSv1.2","338","Application Data"
"210","0.814062537","172.217.10.74","192.168.1.118","TCP","66","443 → 33410 [ACK] Seq=2944 Ack=916 Win=62464 Len=0 TSval=4167108159 TSecr=3133213300"
"211","0.822395025","172.217.10.74","192.168.1.118","TLSv1.2","1096","Application Data"
"212","0.831796550","172.217.10.74","192.168.1.118","TLSv1.2","127","Application Data"
"213","0.831852912","172.217.10.74","192.168.1.118","TLSv1.2","100","Application Data"
"214","0.831999062","192.168.1.118","172.217.10.74","TCP","66","33410 → 443 [ACK] Seq=916 Ack=4069 Win=64128 Len=0 TSval=3133213355 TSecr=4167108170"
"215","0.853755700","192.168.1.118","209.18.47.62","DNS","82","Standard query 0xa8a9 A secure2.sfdcstatic.com"
"216","0.876640650","209.18.47.62","192.168.1.118","DNS","179","Standard query response 0xa8a9 A secure2.sfdcstatic.com CNAME secure2.sfdcstatic.com.edgekey.net CNAME e4745.b.akamaiedge.net A 104.64.212.198"
"217","0.877040962","192.168.1.118","209.18.47.62","DNS","82","Standard query 0x585f AAAA secure2.sfdcstatic.com"
"218","0.894385575","209.18.47.62","192.168.1.118","DNS","221","Standard query response 0x585f AAAA secure2.sfdcstatic.com CNAME secure2.sfdcstatic.com.edgekey.net CNAME e4745.b.akamaiedge.net SOA n0b.akamaiedge.net"
"219","0.898762212","192.168.1.118","104.64.212.198","TCP","74","40116 → 443 [SYN] Seq=0 Win=64240 Len=0 MSS=1460 SACK_PERM=1 TSval=2961706464 TSecr=0 WS=128"
"220","0.905179550","192.168.1.118","136.147.56.129","TLSv1.2","385","Application Data"
"221","0.914164812","192.168.1.118","104.102.83.39","TLSv1.2","313","Application Data"
"222","0.923214350","192.168.1.118","104.102.83.39","TLSv1.2","315","Application Data"
"223","0.932310512","192.168.1.118","104.102.83.39","TLSv1.2","317","Application Data"
"224","0.941943000","192.168.1.118","104.102.83.39","TLSv1.2","316","Application Data"
"225","0.945266900","104.64.212.198","192.168.1.118","TCP","74","443 → 40116 [SYN, ACK] Seq=0 Ack=1 Win=28960 Len=0 MSS=1460 SACK_PERM=1 TSval=1460753052 TSecr=2961706464 WS=128"
"226","0.945458012","192.168.1.118","104.64.212.198","TCP","66","40116 → 443 [ACK] Seq=1 Ack=1 Win=64256 Len=0 TSval=2961706511 TSecr=1460753052"
"227","0.948569262","104.102.83.39","192.168.1.118","TLSv1.2","1093","Application Data"
"228","0.948714800","192.168.1.118","104.102.83.39","TCP","66","34606 → 443 [ACK] Seq=1637 Ack=43764 Win=63104 Len=0 TSval=2052261772 TSecr=177424563"
"229","0.948821400","104.102.83.39","192.168.1.118","TLSv1.2","1043","Application Data"
"230","0.948945387","192.168.1.118","104.102.83.39","TCP","66","34604 → 443 [ACK] Seq=1629 Ack=12094 Win=63232 Len=0 TSval=2052261772 TSecr=177424563"
"231","0.964231050","192.168.1.118","104.64.212.198","TLSv1","583","Client Hello"
"232","0.968759075","192.168.1.118","104.102.83.39","TLSv1.2","316","Application Data"
"233","0.968827350","104.102.83.39","192.168.1.118","TLSv1.2","1123","Application Data"
"234","0.969637237","104.102.83.39","192.168.1.118","TLSv1.2","1062","Application Data"
"235","0.969681525","192.168.1.118","104.102.83.39","TCP","66","34610 → 443 [ACK] Seq=1398 Ack=8696 Win=63232 Len=0 TSval=2052261793 TSecr=177424584"
"236","0.983103437","192.168.1.118","104.102.83.39","TLSv1.2","318","Application Data"
"237","0.990582737","136.147.56.129","192.168.1.118","TCP","66","443 → 40662 [ACK] Seq=24041 Ack=320 Win=5245 Len=0 TSval=620721285 TSecr=3038293373"
"238","0.993388762","104.64.212.198","192.168.1.118","TCP","66","443 → 40116 [ACK] Seq=1 Ack=518 Win=30080 Len=0 TSval=1460753100 TSecr=2961706529"
"239","0.997382687","104.102.83.39","192.168.1.118","TLSv1.2","904","Application Data"
"240","0.998477937","104.64.212.198","192.168.1.118","TLSv1.2","3339","Server Hello, Certificate, Server Key Exchange, Server Hello Done"
"241","0.998552375","192.168.1.118","104.64.212.198","TCP","66","40116 → 443 [ACK] Seq=518 Ack=3274 Win=61056 Len=0 TSval=2961706564 TSecr=1460753103"
"242","1.001830725","192.168.1.118","104.64.212.198","TLSv1.2","192","Client Key Exchange, Change Cipher Spec, Encrypted Handshake Message"
"243","1.004991262","104.102.83.39","192.168.1.118","TLSv1.2","1051","Application Data"
"244","1.010155125","192.168.1.118","104.102.83.39","TCP","66","34608 → 443 [ACK] Seq=1138 Ack=151255 Win=177152 Len=0 TSval=2052261833 TSecr=177424579"
"245","1.031849612","192.168.1.118","104.102.83.39","TLSv1.2","316","Application Data"
"246","1.032086525","192.168.1.118","104.102.83.39","TLSv1.2","315","Application Data"
"247","1.035483562","104.64.212.198","192.168.1.118","TLSv1.2","117","Change Cipher Spec, Encrypted Handshake Message"
"248","1.036391687","192.168.1.118","104.64.212.198","TLSv1.2","305","Application Data"
"249","1.036571362","192.168.1.118","104.102.83.39","TLSv1.2","316","Application Data"
"250","1.036674425","192.168.1.118","104.102.83.39","TLSv1.2","315","Application Data"
"251","1.069662550","104.64.212.198","192.168.1.118","TLSv1.2","414","Application Data"
"252","1.072354412","192.168.1.118","209.18.47.62","DNS","76","Standard query 0xfcc1 A a.sfdcstatic.com"
"253","1.078123700","104.102.83.39","192.168.1.118","TLSv1.2","1056","Application Data"
"254","1.078221512","192.168.1.118","104.102.83.39","TCP","66","34608 → 443 [ACK] Seq=1388 Ack=152245 Win=179968 Len=0 TSval=2052261901 TSecr=177424692"
"255","1.079077775","104.102.83.39","192.168.1.118","TLSv1.2","1100","Application Data"
"256","1.080469225","104.102.83.39","192.168.1.118","TLSv1.2","1017","Application Data"
"257","1.084464987","104.102.83.39","192.168.1.118","TLSv1.2","1061","Application Data"
"258","1.084536512","192.168.1.118","104.102.83.39","TCP","66","34610 → 443 [ACK] Seq=1647 Ack=9691 Win=63232 Len=0 TSval=2052261908 TSecr=177424703"
"259","1.088625412","209.18.47.62","192.168.1.118","DNS","167","Standard query response 0xfcc1 A a.sfdcstatic.com CNAME a.sfdcstatic.com.edgekey.net CNAME e4745.b.akamaiedge.net A 104.102.83.39"
"260","1.088832912","192.168.1.118","209.18.47.62","DNS","76","Standard query 0x0090 AAAA a.sfdcstatic.com"
"261","1.106835075","136.147.56.129","192.168.1.118","TCP","1414","[TCP segment of a reassembled PDU]"
"262","1.107784150","136.147.56.129","192.168.1.118","TLSv1.2","123","Application Data"
"263","1.107859937","192.168.1.118","136.147.56.129","TCP","66","40662 → 443 [ACK] Seq=320 Ack=25446 Win=64704 Len=0 TSval=3038293576 TSecr=620721404"
"264","1.111928612","192.168.1.118","104.64.212.198","TCP","66","40116 → 443 [ACK] Seq=883 Ack=3673 Win=64128 Len=0 TSval=2961706677 TSecr=1460753178"
"265","1.119937125","192.168.1.118","104.102.83.39","TCP","66","34606 → 443 [ACK] Seq=2138 Ack=45783 Win=69888 Len=0 TSval=2052261943 TSecr=177424693"
"266","1.120934687","192.168.1.118","104.102.83.39","TCP","66","34604 → 443 [ACK] Seq=2129 Ack=13883 Win=63232 Len=0 TSval=2052261944 TSecr=177424698"
"267","1.127494862","209.18.47.62","192.168.1.118","DNS","209","Standard query response 0x0090 AAAA a.sfdcstatic.com CNAME a.sfdcstatic.com.edgekey.net CNAME e4745.b.akamaiedge.net SOA n0b.akamaiedge.net"
"268","1.185145125","192.168.1.118","104.102.83.39","TCP","74","34618 → 443 [SYN] Seq=0 Win=64240 Len=0 MSS=1460 SACK_PERM=1 TSval=2052262008 TSecr=0 WS=128"
"269","1.201195087","104.102.83.39","192.168.1.118","TCP","74","443 → 34618 [SYN, ACK] Seq=0 Ack=1 Win=28960 Len=0 MSS=1460 SACK_PERM=1 TSval=177424820 TSecr=2052262008 WS=128"
"270","1.201285125","192.168.1.118","104.102.83.39","TCP","66","34618 → 443 [ACK] Seq=1 Ack=1 Win=64256 Len=0 TSval=2052262024 TSecr=177424820"
"271","1.250394225","192.168.1.118","104.102.83.39","TLSv1","583","Client Hello"
"272","1.273417062","104.102.83.39","192.168.1.118","TCP","66","443 → 34618 [ACK] Seq=1 Ack=518 Win=30080 Len=0 TSval=177424891 TSecr=2052262073"
"273","1.284326325","104.102.83.39","192.168.1.118","TLSv1.2","1514","Server Hello"
"274","1.284425825","192.168.1.118","104.102.83.39","TCP","66","34618 → 443 [ACK] Seq=518 Ack=1449 Win=63104 Len=0 TSval=2052262107 TSecr=177424893"
"275","1.285840262","104.102.83.39","192.168.1.118","TLSv1.2","1891","Certificate, Server Key Exchange, Server Hello Done"
"276","1.285914500","192.168.1.118","104.102.83.39","TCP","66","34618 → 443 [ACK] Seq=518 Ack=3274 Win=61312 Len=0 TSval=2052262109 TSecr=177424893"
"277","1.290165500","192.168.1.118","104.102.83.39","TLSv1.2","192","Client Key Exchange, Change Cipher Spec, Encrypted Handshake Message"
"278","1.312848800","104.102.83.39","192.168.1.118","TLSv1.2","117","Change Cipher Spec, Encrypted Handshake Message"
"279","1.313318500","192.168.1.118","104.102.83.39","TLSv1.2","327","Application Data"
"280","1.349659575","104.102.83.39","192.168.1.118","TCP","1514","[TCP segment of a reassembled PDU]"
"281","1.351193350","104.102.83.39","192.168.1.118","TLSv1.2","4802","Application Data"
"282","1.351316637","192.168.1.118","104.102.83.39","TCP","66","34618 → 443 [ACK] Seq=905 Ack=9509 Win=64128 Len=0 TSval=2052262174 TSecr=177424964"
"283","3.220148962","192.168.1.104","255.255.255.255","UDP","217","49154 → 6666 Len=175"
"284","3.327035575","Cisco-Li_5b:1c:ce","IntelCor_b7:52:73","ARP","42","Who has 192.168.1.118? Tell 192.168.1.1"
"285","3.327099462","IntelCor_b7:52:73","Cisco-Li_5b:1c:ce","ARP","42","192.168.1.118 is at dc:fb:48:b7:52:73"
"286","4.125462200","IntelCor_b7:52:73","Broadcast","ARP","60","Who has 192.168.1.1? Tell 192.168.1.118"
"287","4.131080450","Cisco-Li_5b:1c:ce","IntelCor_b7:52:73","ARP","42","192.168.1.1 is at 58:6d:8f:5b:1c:ce"
"288","5.392647050","192.168.1.118","192.168.1.102","TCP","176","44768 → 8009 [PSH, ACK] Seq=111 Ack=111 Win=501 Len=110 TSval=2259033628 TSecr=5355566 [TCP segment of a reassembled PDU]"
"289","5.400055825","192.168.1.102","192.168.1.118","TCP","176","8009 → 44768 [PSH, ACK] Seq=111 Ack=221 Win=294 Len=110 TSval=5356069 TSecr=2259033628 [TCP segment of a reassembled PDU]"
"290","5.400240550","192.168.1.118","192.168.1.102","TCP","66","44768 → 8009 [ACK] Seq=221 Ack=221 Win=501 Len=0 TSval=2259033635 TSecr=5356069"
"291","6.190043900","192.168.1.104","255.255.255.255","UDP","217","49154 → 6666 Len=175"
"292","9.261515587","192.168.1.104","255.255.255.255","UDP","217","49154 → 6666 Len=175"
