frame.number,_ws.col.Time,_ws.col.Source,_ws.col.Destination,_ws.col.Protocol,frame.len,_ws.col.Info
"1","0.000000000","209.18.47.62","192.168.1.118","DNS","182","Standard query response 0x9fad AAAA contentgrid.homedepot-static.com SOA ns-cloud-c1.googledomains.com"
"2","0.001229325","209.18.47.62","192.168.1.118","DNS","182","Standard query response 0xebec AAAA contentgrid.homedepot-static.com SOA ns-cloud-c1.googledomains.com"
"3","0.004998487","192.168.1.118","35.227.209.247","TLSv1","583","Client Hello"
"4","0.005219237","192.168.1.118","35.186.208.48","TCP","74","39756 → 443 [SYN] Seq=0 Win=64240 Len=0 MSS=1460 SACK_PERM=1 TSval=4272718507 TSecr=0 WS=128"
"5","0.005315012","192.168.1.118","35.186.208.48","TCP","74","39758 → 443 [SYN] Seq=0 Win=64240 Len=0 MSS=1460 SACK_PERM=1 TSval=4272718507 TSecr=0 WS=128"
"6","0.005401650","192.168.1.118","35.186.208.48","TCP","74","39760 → 443 [SYN] Seq=0 Win=64240 Len=0 MSS=1460 SACK_PERM=1 TSval=4272718507 TSecr=0 WS=128"
"7","0.005487500","192.168.1.118","35.186.208.48","TCP","74","39762 → 443 [SYN] Seq=0 Win=64240 Len=0 MSS=1460 SACK_PERM=1 TSval=4272718507 TSecr=0 WS=128"
"8","0.005571875","192.168.1.118","35.186.208.48","TCP","74","39764 → 443 [SYN] Seq=0 Win=64240 Len=0 MSS=1460 SACK_PERM=1 TSval=4272718507 TSecr=0 WS=128"
"9","0.023343525","192.168.1.118","104.92.229.234","TLSv1","583","Client Hello"
"10","0.028683112","192.168.1.118","104.92.229.234","TCP","66","44280 → 443 [ACK] Seq=1 Ack=1 Win=501 Len=0 TSval=3660334308 TSecr=3574423463"
"11","0.031916462","35.186.208.48","192.168.1.118","TCP","74","443 → 39758 [SYN, ACK] Seq=0 Ack=1 Win=60192 Len=0 MSS=1380 SACK_PERM=1 TSval=3641778226 TSecr=4272718507 WS=256"
"12","0.032024550","192.168.1.118","35.186.208.48","TCP","66","39758 → 443 [ACK] Seq=1 Ack=1 Win=64256 Len=0 TSval=4272718533 TSecr=3641778226"
"13","0.035416125","35.186.208.48","192.168.1.118","TCP","74","443 → 39756 [SYN, ACK] Seq=0 Ack=1 Win=60192 Len=0 MSS=1380 SACK_PERM=1 TSval=2758202750 TSecr=4272718507 WS=256"
"14","0.035484250","192.168.1.118","35.186.208.48","TCP","66","39756 → 443 [ACK] Seq=1 Ack=1 Win=64256 Len=0 TSval=4272718537 TSecr=2758202750"
"15","0.035529825","35.186.208.48","192.168.1.118","TCP","74","443 → 39764 [SYN, ACK] Seq=0 Ack=1 Win=60192 Len=0 MSS=1380 SACK_PERM=1 TSval=650969805 TSecr=4272718507 WS=256"
"16","0.035590125","192.168.1.118","35.186.208.48","TCP","66","39764 → 443 [ACK] Seq=1 Ack=1 Win=64256 Len=0 TSval=4272718537 TSecr=650969805"
"17","0.035647175","35.186.208.48","192.168.1.118","TCP","74","443 → 39760 [SYN, ACK] Seq=0 Ack=1 Win=60192 Len=0 MSS=1380 SACK_PERM=1 TSval=2742962254 TSecr=4272718507 WS=256"
"18","0.035708187","192.168.1.118","35.186.208.48","TCP","66","39760 → 443 [ACK] Seq=1 Ack=1 Win=64256 Len=0 TSval=4272718537 TSecr=2742962254"
"19","0.038885450","35.186.208.48","192.168.1.118","TCP","74","443 → 39762 [SYN, ACK] Seq=0 Ack=1 Win=60192 Len=0 MSS=1380 SACK_PERM=1 TSval=1929431998 TSecr=4272718507 WS=256"
"20","0.038969512","192.168.1.118","35.186.208.48","TCP","66","39762 → 443 [ACK] Seq=1 Ack=1 Win=64256 Len=0 TSval=4272718540 TSecr=1929431998"
"21","0.039029750","35.227.209.247","192.168.1.118","TCP","66","443 → 34552 [ACK] Seq=1 Ack=518 Win=240 Len=0 TSval=1386538018 TSecr=3536490014"
"22","0.039165225","35.227.209.247","192.168.1.118","TLSv1.2","6198","Server Hello, Certificate, Server Key Exchange, Server Hello Done"
"23","0.039227750","192.168.1.118","35.227.209.247","TCP","66","34552 → 443 [ACK] Seq=518 Ack=6133 Win=455 Len=0 TSval=3536490049 TSecr=1386538019"
"24","0.039713262","192.168.1.118","104.92.229.234","TLSv1","583","Client Hello"
"25","0.046561225","104.92.229.234","192.168.1.118","TCP","66","443 → 44284 [ACK] Seq=1 Ack=518 Win=235 Len=0 TSval=3574423518 TSecr=3660334303"
"26","0.048571800","104.92.229.234","192.168.1.118","TLSv1.2","3663","Server Hello, Certificate, Server Key Exchange, Server Hello Done"
"27","0.048660062","192.168.1.118","104.92.229.234","TCP","66","44284 → 443 [ACK] Seq=518 Ack=3598 Win=474 Len=0 TSval=3660334328 TSecr=3574423519"
"28","0.056111550","192.168.1.118","104.92.229.234","TLSv1","583","Client Hello"
"29","0.056936075","192.168.1.118","104.92.229.234","TLSv1.2","1311","Application Data"
"30","0.059378650","192.168.1.118","35.227.209.247","TLSv1.2","192","Client Key Exchange, Change Cipher Spec, Encrypted Handshake Message"
"31","0.062104950","104.92.229.234","192.168.1.118","TCP","66","443 → 44286 [ACK] Seq=1 Ack=518 Win=235 Len=0 TSval=3574423540 TSecr=3660334319"
"32","0.063428775","104.92.229.234","192.168.1.118","TLSv1.2","1514","Server Hello"
"33","0.063510075","192.168.1.118","104.92.229.234","TCP","66","44286 → 443 [ACK] Seq=518 Ack=1449 Win=493 Len=0 TSval=3660334343 TSecr=3574423541"
"34","0.068905962","104.92.229.234","192.168.1.118","TLSv1.2","2215","Certificate, Server Key Exchange, Server Hello Done"
"35","0.068995025","192.168.1.118","104.92.229.234","TCP","66","44286 → 443 [ACK] Seq=518 Ack=3598 Win=477 Len=0 TSval=3660334348 TSecr=3574423541"
"36","0.075745337","192.168.1.118","35.186.208.48","TLSv1","583","Client Hello"
"37","0.079732325","104.92.229.234","192.168.1.118","TCP","66","443 → 44288 [ACK] Seq=1 Ack=518 Win=235 Len=0 TSval=3574423559 TSecr=3660334335"
"38","0.082435112","104.92.229.234","192.168.1.118","TLSv1.2","1514","Server Hello"
"39","0.082515400","192.168.1.118","104.92.229.234","TCP","66","44288 → 443 [ACK] Seq=518 Ack=1449 Win=493 Len=0 TSval=3660334362 TSecr=3574423560"
"40","0.084319837","104.92.229.234","192.168.1.118","TLSv1.2","2215","Certificate, Server Key Exchange, Server Hello Done"
"41","0.084405162","192.168.1.118","104.92.229.234","TCP","66","44288 → 443 [ACK] Seq=518 Ack=3598 Win=477 Len=0 TSval=3660334364 TSecr=3574423560"
"42","0.084484887","35.227.209.247","192.168.1.118","TLSv1.2","117","Change Cipher Spec, Encrypted Handshake Message"
"43","0.085568200","192.168.1.118","239.255.255.250","SSDP","218","M-SEARCH * HTTP/1.1 "
"44","0.092615362","192.168.1.118","35.186.208.48","TLSv1","583","Client Hello"
"45","0.093542350","104.92.229.234","192.168.1.118","TCP","1514","[TCP segment of a reassembled PDU]"
"46","0.093684612","192.168.1.118","104.92.229.234","TCP","66","44280 → 443 [ACK] Seq=1246 Ack=1449 Win=493 Len=0 TSval=3660334373 TSecr=3574423570"
"47","0.097687625","104.92.229.234","192.168.1.118","TCP","5858","443 → 44280 [ACK] Seq=1449 Ack=1246 Win=258 Len=5792 TSval=3574423570 TSecr=3660334336 [TCP segment of a reassembled PDU]"
"48","0.097768712","192.168.1.118","104.92.229.234","TCP","66","44280 → 443 [ACK] Seq=1246 Ack=7241 Win=448 Len=0 TSval=3660334377 TSecr=3574423570"
"49","0.099305162","104.92.229.234","192.168.1.118","TCP","4410","443 → 44280 [ACK] Seq=7241 Ack=1246 Win=258 Len=4344 TSval=3574423570 TSecr=3660334336 [TCP segment of a reassembled PDU]"
"50","0.099378637","192.168.1.118","104.92.229.234","TCP","66","44280 → 443 [ACK] Seq=1246 Ack=11585 Win=415 Len=0 TSval=3660334379 TSecr=3574423570"
"51","0.100471612","35.186.208.48","192.168.1.118","TCP","66","443 → 39756 [ACK] Seq=1 Ack=518 Win=61440 Len=0 TSval=2758202810 TSecr=4272718577"
"52","0.100677937","104.92.229.234","192.168.1.118","TLSv1.2","11650","Application Data [TCP segment of a reassembled PDU]"
"53","0.100754050","192.168.1.118","104.92.229.234","TCP","66","44280 → 443 [ACK] Seq=1246 Ack=23169 Win=325 Len=0 TSval=3660334380 TSecr=3574423570"
"54","0.103925675","35.186.208.48","192.168.1.118","TLSv1.2","6198","Server Hello, Certificate, Server Key Exchange, Server Hello Done"
"55","0.103998200","192.168.1.118","35.186.208.48","TCP","66","39756 → 443 [ACK] Seq=518 Ack=6133 Win=58240 Len=0 TSval=4272718605 TSecr=2758202811"
"56","0.109098925","192.168.1.118","35.186.208.48","TLSv1","583","Client Hello"
"57","0.109110862","104.92.229.234","192.168.1.118","TCP","1514","443 → 44280 [ACK] Seq=23169 Ack=1246 Win=258 Len=1448 TSval=3574423587 TSecr=3660334379 [TCP segment of a reassembled PDU]"
"58","0.109189162","192.168.1.118","104.92.229.234","TCP","66","44280 → 443 [ACK] Seq=1246 Ack=24617 Win=314 Len=0 TSval=3660334389 TSecr=3574423587"
"59","0.115822500","104.92.229.234","192.168.1.118","TLSv1.2","8754","Application Data [TCP segment of a reassembled PDU]"
"60","0.115989612","104.92.229.234","192.168.1.118","TLSv1.2","1514","Application Data [TCP segment of a reassembled PDU]"
"61","0.118898062","35.186.208.48","192.168.1.118","TCP","66","443 → 39758 [ACK] Seq=1 Ack=518 Win=61440 Len=0 TSval=3641778303 TSecr=4272718594"
"62","0.119019125","104.92.229.234","192.168.1.118","TCP","2962","443 → 44280 [ACK] Seq=34753 Ack=1246 Win=258 Len=2896 TSval=3574423588 TSecr=3660334379 [TCP segment of a reassembled PDU]"
"63","0.119070650","35.186.208.48","192.168.1.118","TLSv1.2","2902","Server Hello"
"64","0.119143112","192.168.1.118","35.186.208.48","TCP","66","39758 → 443 [ACK] Seq=518 Ack=2837 Win=61440 Len=0 TSval=4272718620 TSecr=3641778305"
"65","0.119338262","35.186.208.48","192.168.1.118","TLSv1.2","3362","Certificate, Server Key Exchange, Server Hello Done"
"66","0.119423150","192.168.1.118","35.186.208.48","TCP","66","39758 → 443 [ACK] Seq=518 Ack=6133 Win=58240 Len=0 TSval=4272718621 TSecr=3641778305"
"67","0.121317975","104.92.229.234","192.168.1.118","TCP","1514","443 → 44280 [ACK] Seq=37649 Ack=1246 Win=258 Len=1448 TSval=3574423599 TSecr=3660334380 [TCP segment of a reassembled PDU]"
"68","0.123407050","104.92.229.234","192.168.1.118","TCP","4410","443 → 44280 [ACK] Seq=39097 Ack=1246 Win=258 Len=4344 TSval=3574423599 TSecr=3660334380 [TCP segment of a reassembled PDU]"
"69","0.124693000","192.168.1.118","35.227.209.247","TCP","66","34552 → 443 [ACK] Seq=644 Ack=6184 Win=501 Len=0 TSval=3536490134 TSecr=1386538069"
"70","0.125632950","192.168.1.118","35.186.208.48","TLSv1","583","Client Hello"
"71","0.127390300","104.92.229.234","192.168.1.118","TCP","1514","443 → 44280 [ACK] Seq=43441 Ack=1246 Win=258 Len=1448 TSval=3574423599 TSecr=3660334380 [TCP segment of a reassembled PDU]"
"72","0.128777312","104.92.229.234","192.168.1.118","TCP","1514","443 → 44280 [ACK] Seq=44889 Ack=1246 Win=258 Len=1448 TSval=3574423599 TSecr=3660334380 [TCP segment of a reassembled PDU]"
"73","0.130480975","35.186.208.48","192.168.1.118","TCP","66","443 → 39760 [ACK] Seq=1 Ack=518 Win=61440 Len=0 TSval=2742962353 TSecr=4272718610"
"74","0.130537437","104.92.229.234","192.168.1.118","TCP","2962","443 → 44280 [ACK] Seq=46337 Ack=1246 Win=258 Len=2896 TSval=3574423599 TSecr=3660334380 [TCP segment of a reassembled PDU]"
"75","0.131758875","35.186.208.48","192.168.1.118","TLSv1.2","1484","Server Hello"
"76","0.131826562","192.168.1.118","35.186.208.48","TCP","66","39760 → 443 [ACK] Seq=518 Ack=1419 Win=63104 Len=0 TSval=4272718633 TSecr=2742962354"
"77","0.134818212","35.186.208.48","192.168.1.118","TLSv1.2","4780","Certificate, Server Key Exchange, Server Hello Done"
"78","0.134892737","192.168.1.118","35.186.208.48","TCP","66","39760 → 443 [ACK] Seq=518 Ack=6133 Win=58496 Len=0 TSval=4272718636 TSecr=2742962354"
"79","0.138845212","104.92.229.234","192.168.1.118","TCP","1514","443 → 44280 [ACK] Seq=49233 Ack=1246 Win=258 Len=1448 TSval=3574423603 TSecr=3660334380 [TCP segment of a reassembled PDU]"
"80","0.138900250","104.92.229.234","192.168.1.118","TLSv1.2","1514","Application Data [TCP segment of a reassembled PDU]"
"81","0.143166987","192.168.1.118","35.186.208.48","TLSv1","583","Client Hello"
"82","0.145232062","192.168.1.118","104.92.229.234","TLSv1.2","192","Client Key Exchange, Change Cipher Spec, Encrypted Handshake Message"
"83","0.147176100","192.168.1.118","104.92.229.234","TLSv1.2","192","Client Key Exchange, Change Cipher Spec, Encrypted Handshake Message"
"84","0.149112862","192.168.1.118","104.92.229.234","TLSv1.2","192","Client Key Exchange, Change Cipher Spec, Encrypted Handshake Message"
"85","0.150004875","192.168.1.118","104.92.229.234","TCP","66","44280 → 443 [ACK] Seq=1246 Ack=52129 Win=100 Len=0 TSval=3660334429 TSecr=3574423587"
"86","0.151308337","192.168.1.118","35.227.209.247","TLSv1.2","294","Application Data"
"87","0.153691275","192.168.1.118","35.186.208.48","TLSv1.2","192","Client Key Exchange, Change Cipher Spec, Encrypted Handshake Message"
"88","0.156050975","192.168.1.118","35.186.208.48","TLSv1.2","192","Client Key Exchange, Change Cipher Spec, Encrypted Handshake Message"
"89","0.157147637","35.186.208.48","192.168.1.118","TCP","66","443 → 39762 [ACK] Seq=1 Ack=518 Win=61440 Len=0 TSval=1929432118 TSecr=4272718627"
"90","0.158391312","192.168.1.118","35.186.208.48","TLSv1.2","192","Client Key Exchange, Change Cipher Spec, Encrypted Handshake Message"
"91","0.158540762","192.168.1.118","104.92.229.234","TCP","66","[TCP Window Update] 44280 → 443 [ACK] Seq=1246 Ack=52129 Win=208 Len=0 TSval=3660334438 TSecr=3574423587"
"92","0.159887200","35.186.208.48","192.168.1.118","TLSv1.2","6198","Server Hello, Certificate, Server Key Exchange, Server Hello Done"
"93","0.159953900","192.168.1.118","35.186.208.48","TCP","66","39762 → 443 [ACK] Seq=518 Ack=6133 Win=58240 Len=0 TSval=4272718661 TSecr=1929432119"
"94","0.165697900","104.92.229.234","192.168.1.118","TCP","1514","[TCP Spurious Retransmission] 443 → 44280 [ACK] Seq=24617 Ack=1246 Win=258 Len=1448 TSval=3574423644 TSecr=3660334389[Reassembly error, protocol TCP: New fragment overlaps old data (retransmission?)]"
"95","0.165764375","192.168.1.118","104.92.229.234","TCP","78","[TCP Dup ACK 85#1] 44280 → 443 [ACK] Seq=1246 Ack=52129 Win=208 Len=0 TSval=3660334445 TSecr=3574423587 SLE=24617 SRE=26065"
"96","0.180311450","104.92.229.234","192.168.1.118","TLSv1.2","117","Change Cipher Spec, Encrypted Handshake Message"
"97","0.180404050","192.168.1.118","104.92.229.234","TCP","66","44284 → 443 [ACK] Seq=644 Ack=3649 Win=501 Len=0 TSval=3660334460 TSecr=3574423648"
"98","0.182856875","35.186.208.48","192.168.1.118","TCP","66","443 → 39764 [ACK] Seq=1 Ack=518 Win=61440 Len=0 TSval=650969943 TSecr=4272718644"
"99","0.183031262","35.186.208.48","192.168.1.118","TLSv1.2","6198","Server Hello, Certificate, Server Key Exchange, Server Hello Done"
"100","0.183113250","192.168.1.118","35.186.208.48","TCP","66","39764 → 443 [ACK] Seq=518 Ack=6133 Win=58240 Len=0 TSval=4272718684 TSecr=650969945"
"101","0.201730950","192.168.1.118","104.92.229.234","TCP","66","[TCP Window Update] 44280 → 443 [ACK] Seq=1246 Ack=52129 Win=501 Len=0 TSval=3660334481 TSecr=3574423587"
"102","0.204384275","192.168.1.118","35.186.208.48","TLSv1.2","192","Client Key Exchange, Change Cipher Spec, Encrypted Handshake Message"
"103","0.206800962","192.168.1.118","35.186.208.48","TLSv1.2","192","Client Key Exchange, Change Cipher Spec, Encrypted Handshake Message"
"104","0.207118350","192.168.1.118","104.92.229.234","TLSv1.2","1291","Application Data"
"105","0.216125787","35.186.208.48","192.168.1.118","TLSv1.2","526","[TCP Spurious Retransmission] , Ignored Unknown Record"
"106","0.216217837","192.168.1.118","35.186.208.48","TCP","78","[TCP Dup ACK 93#1] 39762 → 443 [ACK] Seq=644 Ack=6133 Win=64128 Len=0 TSval=4272718718 TSecr=1929432183 SLE=5673 SRE=6133"
"107","0.222292937","104.92.229.234","192.168.1.118","TLSv1.2","117","Change Cipher Spec, Encrypted Handshake Message"
"108","0.222383312","192.168.1.118","104.92.229.234","TCP","66","44286 → 443 [ACK] Seq=644 Ack=3649 Win=501 Len=0 TSval=3660334502 TSecr=3574423701"
"109","0.229707225","104.92.229.234","192.168.1.118","TCP","1514","443 → 44280 [ACK] Seq=52129 Ack=1246 Win=258 Len=1448 TSval=3574423707 TSecr=3660334438 [TCP segment of a reassembled PDU]"
"110","0.229787237","192.168.1.118","104.92.229.234","TCP","66","44280 → 443 [ACK] Seq=1246 Ack=53577 Win=524 Len=0 TSval=3660334509 TSecr=3574423707"
"111","0.231835275","104.92.229.234","192.168.1.118","TLSv1.2","117","Change Cipher Spec, Encrypted Handshake Message"
"112","0.231927787","192.168.1.118","104.92.229.234","TCP","66","44288 → 443 [ACK] Seq=644 Ack=3649 Win=501 Len=0 TSval=3660334511 TSecr=3574423708"
"113","0.232008175","35.186.208.48","192.168.1.118","TLSv1.2","117","Change Cipher Spec, Encrypted Handshake Message"
"114","0.232093812","192.168.1.118","35.186.208.48","TCP","66","39756 → 443 [ACK] Seq=644 Ack=6184 Win=64128 Len=0 TSval=4272718733 TSecr=2758202948"
"115","0.232167975","35.186.208.48","192.168.1.118","TLSv1.2","117","Change Cipher Spec, Encrypted Handshake Message"
"116","0.232251262","35.186.208.48","192.168.1.118","TLSv1.2","117","Change Cipher Spec, Encrypted Handshake Message"
"117","0.232348800","104.92.229.234","192.168.1.118","TCP","2962","443 → 44280 [ACK] Seq=53577 Ack=1246 Win=258 Len=2896 TSval=3574423707 TSecr=3660334438 [TCP segment of a reassembled PDU]"
"118","0.232423250","192.168.1.118","104.92.229.234","TCP","66","44280 → 443 [ACK] Seq=1246 Ack=56473 Win=569 Len=0 TSval=3660334512 TSecr=3574423707"
"119","0.235157312","192.168.1.118","35.186.208.48","TLSv1.2","321","Application Data"
"120","0.235360825","35.186.208.48","192.168.1.118","TLSv1.2","117","Change Cipher Spec, Encrypted Handshake Message"
"121","0.235420100","192.168.1.118","35.186.208.48","TLSv1.2","353","Application Data"
"122","0.235474737","192.168.1.118","35.186.208.48","TCP","66","39762 → 443 [ACK] Seq=644 Ack=6184 Win=64128 Len=0 TSval=4272718737 TSecr=1929432197"
"123","0.235567162","35.227.209.247","192.168.1.118","TLSv1.2","1484","Application Data"
"124","0.235667475","192.168.1.118","35.186.208.48","TLSv1.2","326","Application Data"
"125","0.235694162","192.168.1.118","35.227.209.247","TCP","66","34552 → 443 [ACK] Seq=872 Ack=7602 Win=493 Len=0 TSval=3536490245 TSecr=1386538216"
"126","0.235803562","35.227.209.247","192.168.1.118","TLSv1.2","2902","Application Data, Application Data"
"127","0.235885462","192.168.1.118","35.186.208.48","TLSv1.2","324","Application Data"
"128","0.235900737","192.168.1.118","35.227.209.247","TCP","66","34552 → 443 [ACK] Seq=872 Ack=10438 Win=471 Len=0 TSval=3536490245 TSecr=1386538216"
"129","0.235988162","104.92.229.234","192.168.1.118","TCP","1514","443 → 44280 [ACK] Seq=56473 Ack=1246 Win=258 Len=1448 TSval=3574423707 TSecr=3660334438 [TCP segment of a reassembled PDU]"
"130","0.236062287","192.168.1.118","104.92.229.234","TCP","66","44280 → 443 [ACK] Seq=1246 Ack=57921 Win=592 Len=0 TSval=3660334515 TSecr=3574423707"
"131","0.236107450","35.227.209.247","192.168.1.118","TLSv1.2","1484","Application Data"
"132","0.236161262","192.168.1.118","104.92.229.234","TLSv1.2","1292","Application Data"
"133","0.236179200","192.168.1.118","35.227.209.247","TCP","66","34552 → 443 [ACK] Seq=872 Ack=11856 Win=460 Len=0 TSval=3536490246 TSecr=1386538216"
"134","0.236347262","35.186.208.48","192.168.1.118","TLSv1.2","117","Change Cipher Spec, Encrypted Handshake Message"
"135","0.236404912","192.168.1.118","104.92.229.234","TLSv1.2","1358","Application Data"
"136","0.236446537","35.227.209.247","192.168.1.118","TLSv1.2","1484","Application Data"
"137","0.236521000","192.168.1.118","35.227.209.247","TCP","66","34552 → 443 [ACK] Seq=872 Ack=13274 Win=449 Len=0 TSval=3536490246 TSecr=1386538216"
"138","0.236652350","35.227.209.247","192.168.1.118","TLSv1.2","2902","Application Data, Application Data"
"139","0.236738612","192.168.1.118","35.227.209.247","TCP","66","34552 → 443 [ACK] Seq=872 Ack=16110 Win=427 Len=0 TSval=3536490246 TSecr=1386538218"
"140","0.237246212","192.168.1.118","35.186.208.48","TLSv1.2","333","Application Data"
"141","0.241568050","35.227.209.247","192.168.1.118","TLSv1.2","2902","Application Data, Application Data"
"142","0.241646112","192.168.1.118","35.227.209.247","TCP","66","34552 → 443 [ACK] Seq=872 Ack=18946 Win=405 Len=0 TSval=3536490251 TSecr=1386538219"
"143","0.241730675","35.227.209.247","192.168.1.118","TLSv1.2","344","Application Data"
"144","0.241748550","192.168.1.118","35.227.209.247","TCP","66","34552 → 443 [ACK] Seq=872 Ack=19224 Win=403 Len=0 TSval=3536490251 TSecr=1386538221"
"145","0.241769012","104.92.229.234","192.168.1.118","TCP","2962","443 → 44280 [ACK] Seq=57921 Ack=1246 Win=258 Len=2896 TSval=3574423707 TSecr=3660334481 [TCP segment of a reassembled PDU]"
"146","0.241789212","192.168.1.118","104.92.229.234","TCP","66","44280 → 443 [ACK] Seq=1246 Ack=60817 Win=637 Len=0 TSval=3660334521 TSecr=3574423707"
"147","0.241802412","104.92.229.234","192.168.1.118","TCP","1514","443 → 44280 [ACK] Seq=60817 Ack=1246 Win=258 Len=1448 TSval=3574423709 TSecr=3660334481 [TCP segment of a reassembled PDU]"
"148","0.241818825","192.168.1.118","104.92.229.234","TCP","66","44280 → 443 [ACK] Seq=1246 Ack=62265 Win=660 Len=0 TSval=3660334521 TSecr=3574423709"
"149","0.244943150","104.92.229.234","192.168.1.118","TCP","1514","443 → 44280 [ACK] Seq=62265 Ack=1246 Win=258 Len=1448 TSval=3574423709 TSecr=3660334481 [TCP segment of a reassembled PDU]"
"150","0.244963612","192.168.1.118","104.92.229.234","TCP","66","44280 → 443 [ACK] Seq=1246 Ack=63713 Win=682 Len=0 TSval=3660334524 TSecr=3574423709"
"151","0.244982737","104.92.229.234","192.168.1.118","TLSv1.2","1554","Application Data"
"152","0.245003062","192.168.1.118","104.92.229.234","TCP","66","44280 → 443 [ACK] Seq=1246 Ack=65201 Win=705 Len=0 TSval=3660334524 TSecr=3574423712"
"153","0.245039325","104.92.229.234","192.168.1.118","TCP","2962","[TCP segment of a reassembled PDU]"
"154","0.253700900","192.168.1.118","104.92.229.234","TCP","66","44284 → 443 [ACK] Seq=1869 Ack=6545 Win=479 Len=0 TSval=3660334533 TSecr=3574423721"
"155","0.253866150","104.92.229.234","192.168.1.118","TCP","4410","443 → 44284 [ACK] Seq=6545 Ack=1869 Win=258 Len=4344 TSval=3574423721 TSecr=3660334486 [TCP segment of a reassembled PDU]"
"156","0.254283637","104.92.229.234","192.168.1.118","TLSv1.2","1888","Application Data"
"157","0.254292025","192.168.1.118","104.92.229.234","TCP","66","44284 → 443 [ACK] Seq=1869 Ack=10889 Win=501 Len=0 TSval=3660334534 TSecr=3574423721"
"158","0.254379175","192.168.1.118","104.92.229.234","TCP","66","44284 → 443 [ACK] Seq=1869 Ack=12711 Win=501 Len=0 TSval=3660334534 TSecr=3574423721"
"159","0.257293687","35.186.208.48","192.168.1.118","TLSv1.2","1484","Application Data"
"160","0.260233937","35.186.208.48","192.168.1.118","TLSv1.2","2902","Application Data, Application Data"
"161","0.260299887","35.186.208.48","192.168.1.118","TLSv1.2","1484","Application Data"
"162","0.260343137","35.186.208.48","192.168.1.118","TLSv1.2","1484","Application Data"
"163","0.260693925","35.186.208.48","192.168.1.118","TLSv1.2","1484","Application Data"
"164","0.260740512","35.186.208.48","192.168.1.118","TLSv1.2","1484","Application Data"
"165","0.260768350","35.186.208.48","192.168.1.118","TLSv1.2","2902","Application Data, Application Data"
"166","0.264227837","35.186.208.48","192.168.1.118","TLSv1.2","2902","Application Data, Application Data"
"167","0.264313587","35.186.208.48","192.168.1.118","TLSv1.2","2902","Application Data, Application Data"
"168","0.265879700","35.186.208.48","192.168.1.118","TLSv1.2","1484","Application Data"
"169","0.265960612","35.186.208.48","192.168.1.118","TLSv1.2","2902","Application Data, Application Data"
"170","0.266969150","35.186.208.48","192.168.1.118","TLSv1.2","1484","Application Data"
"171","0.267008287","35.186.208.48","192.168.1.118","TLSv1.2","1484","Application Data"
"172","0.267043350","35.186.208.48","192.168.1.118","TLSv1.2","2902","Application Data, Application Data"
"173","0.267073975","35.186.208.48","192.168.1.118","TLSv1.2","2902","Application Data, Application Data"
"174","0.267091587","35.186.208.48","192.168.1.118","TLSv1.2","2902","Application Data, Application Data"
"175","0.267979625","35.186.208.48","192.168.1.118","TLSv1.2","1484","Application Data"
"176","0.274880687","35.186.208.48","192.168.1.118","TLSv1.2","1484","Application Data"
"177","0.274928200","35.186.208.48","192.168.1.118","TLSv1.2","2902","Application Data, Application Data"
"178","0.274941962","35.186.208.48","192.168.1.118","TLSv1.2","1484","Application Data"
"179","0.276524750","35.186.208.48","192.168.1.118","TLSv1.2","1484","Application Data"
"180","0.276556900","35.186.208.48","192.168.1.118","TLSv1.2","1484","Application Data"
"181","0.277768312","35.186.208.48","192.168.1.118","TLSv1.2","1484","Application Data"
"182","0.277812600","35.186.208.48","192.168.1.118","TLSv1.2","2902","Application Data, Application Data"
"183","0.277839550","104.92.229.234","192.168.1.118","TLSv1.2","823","Application Data"
"184","0.277861900","35.186.208.48","192.168.1.118","TLSv1.2","2902","Application Data, Application Data"
"185","0.277872787","35.186.208.48","192.168.1.118","TLSv1.2","2902","Application Data, Application Data"
"186","0.277882912","35.186.208.48","192.168.1.118","TLSv1.2","2902","Application Data, Application Data"
"187","0.280786437","35.186.208.48","192.168.1.118","TLSv1.2","2902","Application Data, Application Data"
"188","0.282469850","35.186.208.48","192.168.1.118","TLSv1.2","2902","Application Data, Application Data"
"189","0.282480462","35.186.208.48","192.168.1.118","TLSv1.2","2902","Application Data, Application Data"
"190","0.283607350","35.186.208.48","192.168.1.118","TLSv1.2","2902","Application Data, Application Data"
"191","0.283639662","35.186.208.48","192.168.1.118","TLSv1.2","2902","Application Data, Application Data"
"192","0.283653550","35.186.208.48","192.168.1.118","TLSv1.2","2902","Application Data, Application Data"
"193","0.293755125","192.168.1.118","35.186.208.48","TCP","66","39756 → 443 [ACK] Seq=899 Ack=21782 Win=48640 Len=0 TSval=4272718795 TSecr=2758202976"
"194","0.293967337","192.168.1.118","35.186.208.48","TCP","66","39758 → 443 [ACK] Seq=931 Ack=20364 Win=50048 Len=0 TSval=4272718795 TSecr=3641778453"
"195","0.294080850","192.168.1.118","35.186.208.48","TCP","66","39760 → 443 [ACK] Seq=904 Ack=21782 Win=48640 Len=0 TSval=4272718795 TSecr=2742962480"
"196","0.294198575","192.168.1.118","35.186.208.48","TCP","66","39762 → 443 [ACK] Seq=902 Ack=18946 Win=51456 Len=0 TSval=4272718796 TSecr=1929432223"
"197","0.294305125","192.168.1.118","35.186.208.48","TCP","66","39764 → 443 [ACK] Seq=911 Ack=21782 Win=48640 Len=0 TSval=4272718796 TSecr=650970032"
"198","0.298543437","35.186.208.48","192.168.1.118","TLSv1.2","2902","Application Data, Application Data"
"199","0.298616387","35.186.208.48","192.168.1.118","TLSv1.2","2902","Application Data, Application Data"
"200","0.298669237","35.186.208.48","192.168.1.118","TLSv1.2","2902","Application Data, Application Data"
"201","0.298704862","35.186.208.48","192.168.1.118","TLSv1.2","2902","Application Data, Application Data"
"202","0.298740050","35.186.208.48","192.168.1.118","TLSv1.2","2902","Application Data, Application Data"
"203","0.298798700","104.92.229.234","192.168.1.118","TLSv1.2","8861","Application Data"
"204","0.298843837","35.186.208.48","192.168.1.118","TLSv1.2","2902","Application Data, Application Data"
"205","0.298881662","35.186.208.48","192.168.1.118","TLSv1.2","2902","Application Data, Application Data"
"206","0.298917287","35.186.208.48","192.168.1.118","TLSv1.2","2902","Application Data, Application Data"
"207","0.298947550","35.186.208.48","192.168.1.118","TLSv1.2","2902","Application Data, Application Data"
"208","0.298979375","35.186.208.48","192.168.1.118","TLSv1.2","2902","Application Data, Application Data"
"209","0.299004637","35.186.208.48","192.168.1.118","TLSv1.2","2902","Application Data, Application Data"
"210","0.299024300","35.186.208.48","192.168.1.118","TLSv1.2","2902","Application Data, Application Data"
"211","0.299040162","35.186.208.48","192.168.1.118","TLSv1.2","1484","Application Data"
"212","0.299055037","35.186.208.48","192.168.1.118","TLSv1.2","1484","Application Data"
"213","0.299071012","35.186.208.48","192.168.1.118","TLSv1.2","1484","Application Data"
"214","0.299428512","192.168.1.118","35.186.208.48","TCP","66","39756 → 443 [ACK] Seq=899 Ack=28872 Win=41600 Len=0 TSval=4272718801 TSecr=2758202985"
"215","0.299739225","192.168.1.118","35.186.208.48","TCP","66","39758 → 443 [ACK] Seq=931 Ack=28872 Win=41600 Len=0 TSval=4272718801 TSecr=3641778459"
"216","0.299806975","192.168.1.118","35.186.208.48","TCP","66","39760 → 443 [ACK] Seq=904 Ack=28872 Win=41600 Len=0 TSval=4272718801 TSecr=2742962488"
"217","0.299861587","192.168.1.118","35.186.208.48","TCP","66","39762 → 443 [ACK] Seq=902 Ack=27454 Win=43008 Len=0 TSval=4272718801 TSecr=1929432231"
"218","0.299914500","192.168.1.118","35.186.208.48","TCP","66","39764 → 443 [ACK] Seq=911 Ack=28872 Win=41600 Len=0 TSval=4272718801 TSecr=650970040"
"219","0.299979437","192.168.1.118","104.92.229.234","TCP","66","44286 → 443 [ACK] Seq=1870 Ack=12444 Win=433 Len=0 TSval=3660334579 TSecr=3574423747"
"220","0.302336512","35.186.208.48","192.168.1.118","TLSv1.2","2902","Application Data, Application Data"
"221","0.302641662","192.168.1.118","35.186.208.48","TCP","66","39762 → 443 [ACK] Seq=902 Ack=30290 Win=40192 Len=0 TSval=4272718804 TSecr=1929432238"
"222","0.302865525","192.168.1.118","35.227.209.247","TLSv1.2","285","Application Data"
"223","0.318468575","35.186.208.48","192.168.1.118","TLSv1.2","2902","Application Data, Application Data"
"224","0.318545600","192.168.1.118","35.186.208.48","TCP","66","39762 → 443 [ACK] Seq=902 Ack=33126 Win=61056 Len=0 TSval=4272718820 TSecr=1929432275"
"225","0.318602587","35.186.208.48","192.168.1.118","TLSv1.2","2902","Application Data, Application Data"
"226","0.318679637","192.168.1.118","35.186.208.48","TCP","66","39764 → 443 [ACK] Seq=911 Ack=31708 Win=61056 Len=0 TSval=4272718820 TSecr=650970083"
"227","0.319666987","192.168.1.118","104.92.229.234","TCP","66","44288 → 443 [ACK] Seq=1936 Ack=4406 Win=501 Len=0 TSval=3660334599 TSecr=3574423741"
"228","0.319922725","35.186.208.48","192.168.1.118","TLSv1.2","2902","Application Data, Application Data"
"229","0.319979000","192.168.1.118","35.186.208.48","TCP","66","39758 → 443 [ACK] Seq=931 Ack=31708 Win=61056 Len=0 TSval=4272718821 TSecr=3641778503"
"230","0.320021000","35.186.208.48","192.168.1.118","TLSv1.2","2902","Application Data, Application Data"
"231","0.320075775","192.168.1.118","35.186.208.48","TCP","66","39760 → 443 [ACK] Seq=904 Ack=31708 Win=61056 Len=0 TSval=4272718821 TSecr=2742962532"
"232","0.320110587","35.186.208.48","192.168.1.118","TLSv1.2","2902","Application Data, Application Data"
"233","0.320165012","192.168.1.118","35.186.208.48","TCP","66","39756 → 443 [ACK] Seq=899 Ack=31708 Win=61056 Len=0 TSval=4272718822 TSecr=2758203028"
"234","0.320197975","35.186.208.48","192.168.1.118","TLSv1.2","1484","Application Data"
"235","0.323830187","35.186.208.48","192.168.1.118","TLSv1.2","1484","Application Data"
"236","0.323869362","35.186.208.48","192.168.1.118","TLSv1.2","2902","Application Data, Application Data"
"237","0.323920150","192.168.1.118","35.186.208.48","TCP","66","39762 → 443 [ACK] Seq=902 Ack=35962 Win=69760 Len=0 TSval=4272718825 TSecr=1929432276"
"238","0.323958250","35.186.208.48","192.168.1.118","TLSv1.2","1484","Application Data"
"239","0.324223637","192.168.1.118","35.186.208.48","TCP","66","39758 → 443 [ACK] Seq=931 Ack=34544 Win=64128 Len=0 TSval=4272718826 TSecr=3641778504"
"240","0.325481950","35.186.208.48","192.168.1.118","TLSv1.2","1484","Application Data"
"241","0.325537350","192.168.1.118","35.186.208.48","TCP","66","39764 → 443 [ACK] Seq=911 Ack=34544 Win=66944 Len=0 TSval=4272718827 TSecr=650970084"
"242","0.325574150","35.186.208.48","192.168.1.118","TLSv1.2","2902","Application Data, Application Data"
"243","0.325646812","192.168.1.118","35.186.208.48","TCP","66","39760 → 443 [ACK] Seq=904 Ack=34544 Win=69760 Len=0 TSval=4272718827 TSecr=2742962533"
"244","0.325681037","35.186.208.48","192.168.1.118","TLSv1.2","1484","Application Data"
"245","0.326556500","35.186.208.48","192.168.1.118","TLSv1.2","1484","Application Data"
"246","0.326614062","192.168.1.118","35.186.208.48","TCP","66","39756 → 443 [ACK] Seq=899 Ack=34544 Win=69760 Len=0 TSval=4272718828 TSecr=2758203029"
"247","0.326675275","35.186.208.48","192.168.1.118","TLSv1.2","2902","Application Data, Application Data"
"248","0.326731050","192.168.1.118","35.186.208.48","TCP","66","39758 → 443 [ACK] Seq=931 Ack=37380 Win=69760 Len=0 TSval=4272718828 TSecr=3641778506"
"249","0.326765837","35.186.208.48","192.168.1.118","TLSv1.2","2902","Application Data, Application Data"
"250","0.326819287","192.168.1.118","35.186.208.48","TCP","66","39762 → 443 [ACK] Seq=902 Ack=38798 Win=75520 Len=0 TSval=4272718828 TSecr=1929432279"
"251","0.326853962","35.186.208.48","192.168.1.118","TLSv1.2","2902","Application Data, Application Data"
"252","0.326909712","192.168.1.118","35.186.208.48","TCP","66","39764 → 443 [ACK] Seq=911 Ack=37380 Win=72704 Len=0 TSval=4272718828 TSecr=650970086"
"253","0.332293837","35.186.208.48","192.168.1.118","TLSv1.2","1484","Application Data"
"254","0.335127775","35.186.208.48","192.168.1.118","TLSv1.2","1484","Application Data"
"255","0.335177212","192.168.1.118","35.186.208.48","TCP","66","39760 → 443 [ACK] Seq=904 Ack=37380 Win=75520 Len=0 TSval=4272718837 TSecr=2742962535"
"256","0.335211875","35.186.208.48","192.168.1.118","TLSv1.2","2902","Application Data, Application Data"
"257","0.335259350","192.168.1.118","35.186.208.48","TCP","66","39756 → 443 [ACK] Seq=899 Ack=37380 Win=75520 Len=0 TSval=4272718837 TSecr=2758203031"
"258","0.335289650","35.186.208.48","192.168.1.118","TLSv1.2","1484","Application Data"
"259","0.336780612","35.186.208.48","192.168.1.118","TLSv1.2","1484","Application Data"
"260","0.336831162","192.168.1.118","35.186.208.48","TCP","66","39758 → 443 [ACK] Seq=931 Ack=40216 Win=75520 Len=0 TSval=4272718838 TSecr=3641778507"
"261","0.336862850","35.186.208.48","192.168.1.118","TLSv1.2","2902","Application Data, Application Data"
"262","0.336914037","192.168.1.118","35.186.208.48","TCP","66","39762 → 443 [ACK] Seq=902 Ack=41634 Win=81152 Len=0 TSval=4272718838 TSecr=1929432281"
"263","0.337913012","35.186.208.48","192.168.1.118","TLSv1.2","2902","Application Data, Application Data"
"264","0.337977825","192.168.1.118","35.186.208.48","TCP","66","39764 → 443 [ACK] Seq=911 Ack=40216 Win=78336 Len=0 TSval=4272718839 TSecr=650970088"
"265","0.338019550","35.186.208.48","192.168.1.118","TLSv1.2","2902","Application Data, Application Data"
"266","0.338082275","192.168.1.118","35.186.208.48","TCP","66","39760 → 443 [ACK] Seq=904 Ack=40216 Win=81152 Len=0 TSval=4272718839 TSecr=2742962537"
"267","0.338121687","35.186.208.48","192.168.1.118","TLSv1.2","2902","Application Data, Application Data"
"268","0.338181962","192.168.1.118","35.186.208.48","TCP","66","39756 → 443 [ACK] Seq=899 Ack=40216 Win=81152 Len=0 TSval=4272718840 TSecr=2758203033"
"269","0.338220400","35.186.208.48","192.168.1.118","TLSv1.2","1484","Application Data [TCP segment of a reassembled PDU]"
"270","0.357998925","35.186.208.48","192.168.1.118","TLSv1.2","1484","Application Data [TCP segment of a reassembled PDU]"
"271","0.358078650","192.168.1.118","35.186.208.48","TCP","66","39758 → 443 [ACK] Seq=931 Ack=43052 Win=81152 Len=0 TSval=4272718859 TSecr=3641778509"
"272","0.358228162","35.186.208.48","192.168.1.118","TLSv1.2","2902","Application Data, Application Data"
"273","0.358305662","192.168.1.118","35.186.208.48","TCP","66","39758 → 443 [ACK] Seq=931 Ack=45888 Win=86784 Len=0 TSval=4272718860 TSecr=3641778510"
"274","0.358389087","35.186.208.48","192.168.1.118","TLSv1.2","2902","Application Data, Application Data"
"275","0.358468537","192.168.1.118","35.186.208.48","TCP","66","39762 → 443 [ACK] Seq=902 Ack=44470 Win=86784 Len=0 TSval=4272718860 TSecr=1929432283"
"276","0.358548225","35.186.208.48","192.168.1.118","TLSv1.2","2902","Application Data, Application Data"
"277","0.358647450","192.168.1.118","35.186.208.48","TCP","66","39764 → 443 [ACK] Seq=911 Ack=43052 Win=83968 Len=0 TSval=4272718860 TSecr=650970090"
"278","0.358745725","35.186.208.48","192.168.1.118","TLSv1.2","2902","Application Data, Application Data"
"279","0.358800887","192.168.1.118","35.186.208.48","TCP","66","39760 → 443 [ACK] Seq=904 Ack=43052 Win=86784 Len=0 TSval=4272718860 TSecr=2742962539"
"280","0.358847950","35.186.208.48","192.168.1.118","TLSv1.2","2902","Application Data, Application Data"
"281","0.358892162","192.168.1.118","35.186.208.48","TCP","66","39756 → 443 [ACK] Seq=899 Ack=43052 Win=86784 Len=0 TSval=4272718860 TSecr=2758203035"
"282","0.358940875","35.186.208.48","192.168.1.118","TLSv1.2","2902","Application Data, Application Data"
"283","0.358986887","192.168.1.118","35.186.208.48","TCP","66","39758 → 443 [ACK] Seq=931 Ack=48724 Win=92544 Len=0 TSval=4272718860 TSecr=3641778512"
"284","0.359035175","35.186.208.48","192.168.1.118","TLSv1.2","2902","Application Data, Application Data"
"285","0.359085687","192.168.1.118","35.186.208.48","TCP","66","39762 → 443 [ACK] Seq=902 Ack=47306 Win=92544 Len=0 TSval=4272718860 TSecr=1929432285"
"286","0.359127050","35.186.208.48","192.168.1.118","TLSv1.2","2902","Application Data, Application Data"
"287","0.359173712","192.168.1.118","35.186.208.48","TCP","66","39764 → 443 [ACK] Seq=911 Ack=45888 Win=89728 Len=0 TSval=4272718861 TSecr=650970092"
"288","0.359227225","35.186.208.48","192.168.1.118","TLSv1.2","2902","Application Data, Application Data"
"289","0.359272737","192.168.1.118","35.186.208.48","TCP","66","39760 → 443 [ACK] Seq=904 Ack=45888 Win=92544 Len=0 TSval=4272718861 TSecr=2742962541"
"290","0.359321037","35.186.208.48","192.168.1.118","TLSv1.2","2902","Application Data, Application Data"
"291","0.359365987","192.168.1.118","35.186.208.48","TCP","66","39756 → 443 [ACK] Seq=899 Ack=45888 Win=92544 Len=0 TSval=4272718861 TSecr=2758203037"
"292","0.359413650","35.186.208.48","192.168.1.118","TLSv1.2","2902","Application Data, Application Data"
"293","0.359458862","192.168.1.118","35.186.208.48","TCP","66","39758 → 443 [ACK] Seq=931 Ack=51560 Win=98176 Len=0 TSval=4272718861 TSecr=3641778513"
"294","0.359488125","35.186.208.48","192.168.1.118","TLSv1.2","2902","Application Data, Application Data"
"295","0.359532112","192.168.1.118","35.186.208.48","TCP","66","39762 → 443 [ACK] Seq=902 Ack=50142 Win=98176 Len=0 TSval=4272718861 TSecr=1929432287"
"296","0.359561112","35.186.208.48","192.168.1.118","TLSv1.2","2902","Application Data, Application Data"
"297","0.359606912","192.168.1.118","35.186.208.48","TCP","66","39764 → 443 [ACK] Seq=911 Ack=48724 Win=95360 Len=0 TSval=4272718861 TSecr=650970094"
"298","0.359652975","35.186.208.48","192.168.1.118","TLSv1.2","2902","Application Data, Application Data"
"299","0.359699875","192.168.1.118","35.186.208.48","TCP","66","39760 → 443 [ACK] Seq=904 Ack=48724 Win=98176 Len=0 TSval=4272718861 TSecr=2742962543"
"300","0.359729187","35.186.208.48","192.168.1.118","TLSv1.2","2902","Application Data, Application Data"
"301","0.359774512","192.168.1.118","35.186.208.48","TCP","66","39756 → 443 [ACK] Seq=899 Ack=48724 Win=98176 Len=0 TSval=4272718861 TSecr=2758203039"
"302","0.359900812","35.186.208.48","192.168.1.118","TLSv1.2","2902","Application Data, Application Data"
"303","0.359946737","192.168.1.118","35.186.208.48","TCP","66","39758 → 443 [ACK] Seq=931 Ack=54396 Win=103808 Len=0 TSval=4272718861 TSecr=3641778515"
"304","0.360003100","35.186.208.48","192.168.1.118","TLSv1.2","2902","Application Data, Application Data"
"305","0.360048025","192.168.1.118","35.186.208.48","TCP","66","39758 → 443 [ACK] Seq=931 Ack=57232 Win=109568 Len=0 TSval=4272718861 TSecr=3641778517"
"306","0.375344137","35.186.208.48","192.168.1.118","TLSv1.2","2902","Application Data, Application Data"
"307","0.375423525","192.168.1.118","35.186.208.48","TCP","66","39762 → 443 [ACK] Seq=902 Ack=52978 Win=103808 Len=0 TSval=4272718877 TSecr=1929432289"
"308","0.375483287","35.186.208.48","192.168.1.118","TLSv1.2","2902","Application Data, Application Data"
"309","0.375520562","192.168.1.118","35.186.208.48","TCP","66","39764 → 443 [ACK] Seq=911 Ack=51560 Win=100992 Len=0 TSval=4272718877 TSecr=650970096"
"310","0.375543400","35.186.208.48","192.168.1.118","TLSv1.2","1484","Application Data"
