frame.number,_ws.col.Time,_ws.col.Source,_ws.col.Destination,_ws.col.Protocol,frame.len,_ws.col.Info
"1","0.000000000","199.232.37.224","192.168.1.118","TCP","1418","[TCP segment of a reassembled PDU]"
"2","0.002825575","199.232.37.224","192.168.1.118","TLSv1.2","5474","Application Data, Application Data, Application Data, Application Data, Application Data, Application Data"
"3","0.003758350","192.168.1.118","199.232.37.224","TCP","66","40408 → 443 [ACK] Seq=1 Ack=6761 Win=449 Len=0 TSval=1344184620 TSecr=271924258"
"4","0.003864263","199.232.37.224","192.168.1.118","TLSv1.2","6826","Application Data, Application Data, Application Data, Application Data, Application Data"
"5","0.003886750","199.232.37.224","192.168.1.118","TLSv1.2","1418","Application Data [TCP segment of a reassembled PDU]"
"6","0.004932688","192.168.1.118","199.232.37.224","TCP","66","40408 → 443 [ACK] Seq=1 Ack=14873 Win=386 Len=0 TSval=1344184622 TSecr=271924258"
"7","0.015610038","192.168.1.118","199.232.37.224","TCP","74","40430 → 443 [SYN] Seq=0 Win=64240 Len=0 MSS=1460 SACK_PERM=1 TSval=1344184632 TSecr=0 WS=128"
"8","0.015765938","192.168.1.118","199.232.37.224","TCP","74","40432 → 443 [SYN] Seq=0 Win=64240 Len=0 MSS=1460 SACK_PERM=1 TSval=1344184632 TSecr=0 WS=128"
"9","0.015864575","192.168.1.118","199.232.37.224","TCP","74","40434 → 443 [SYN] Seq=0 Win=64240 Len=0 MSS=1460 SACK_PERM=1 TSval=1344184633 TSecr=0 WS=128"
"10","0.015953763","192.168.1.118","199.232.37.224","TCP","74","40436 → 443 [SYN] Seq=0 Win=64240 Len=0 MSS=1460 SACK_PERM=1 TSval=1344184633 TSecr=0 WS=128"
"11","0.023014975","199.232.37.224","192.168.1.118","TLSv1.2","1418","Application Data [TCP segment of a reassembled PDU]"
"12","0.025918438","199.232.37.224","192.168.1.118","TLSv1.2","5474","Application Data, Application Data, Application Data, Application Data, Application Data, Application Data, Application Data"
"13","0.026032275","199.232.37.224","192.168.1.118","TLSv1.2","4122","Application Data, Application Data, Application Data"
"14","0.030391138","192.168.1.118","199.232.37.224","TCP","66","40408 → 443 [ACK] Seq=1 Ack=25689 Win=302 Len=0 TSval=1344184647 TSecr=271924290"
"15","0.030999463","199.232.37.224","192.168.1.118","TLSv1.2","1418","Application Data [TCP segment of a reassembled PDU]"
"16","0.033773588","199.232.37.224","192.168.1.118","TLSv1.2","4122","Application Data, Application Data"
"17","0.036033088","199.232.37.224","192.168.1.118","TLSv1.2","2770","Application Data, Application Data"
"18","0.038663613","199.232.37.224","192.168.1.118","TCP","74","443 → 40430 [SYN, ACK] Seq=0 Ack=1 Win=27040 Len=0 MSS=1364 SACK_PERM=1 TSval=2812562347 TSecr=1344184632 WS=512"
"19","0.038748863","192.168.1.118","199.232.37.224","TCP","66","40430 → 443 [ACK] Seq=1 Ack=1 Win=64256 Len=0 TSval=1344184655 TSecr=2812562347"
"20","0.038789463","199.232.37.224","192.168.1.118","TCP","74","443 → 40434 [SYN, ACK] Seq=0 Ack=1 Win=27040 Len=0 MSS=1364 SACK_PERM=1 TSval=2811617791 TSecr=1344184633 WS=512"
"21","0.038813288","192.168.1.118","199.232.37.224","TCP","66","40434 → 443 [ACK] Seq=1 Ack=1 Win=64256 Len=0 TSval=1344184655 TSecr=2811617791"
"22","0.038829550","199.232.37.224","192.168.1.118","TCP","74","443 → 40432 [SYN, ACK] Seq=0 Ack=1 Win=27040 Len=0 MSS=1364 SACK_PERM=1 TSval=2813477501 TSecr=1344184632 WS=512"
"23","0.038851925","192.168.1.118","199.232.37.224","TCP","66","40432 → 443 [ACK] Seq=1 Ack=1 Win=64256 Len=0 TSval=1344184655 TSecr=2813477501"
"24","0.038867550","199.232.37.224","192.168.1.118","TCP","74","443 → 40436 [SYN, ACK] Seq=0 Ack=1 Win=27040 Len=0 MSS=1364 SACK_PERM=1 TSval=2998864493 TSecr=1344184633 WS=512"
"25","0.038889388","192.168.1.118","199.232.37.224","TCP","66","40436 → 443 [ACK] Seq=1 Ack=1 Win=64256 Len=0 TSval=1344184656 TSecr=2998864493"
"26","0.040184138","199.232.37.224","192.168.1.118","TLSv1.2","2770","Application Data, Application Data"
"27","0.041722188","192.168.1.118","199.232.37.224","TCP","66","40408 → 443 [ACK] Seq=1 Ack=36505 Win=218 Len=0 TSval=1344184658 TSecr=271924292"
"28","0.041825800","199.232.37.224","192.168.1.118","TLSv1.2","1418","Application Data, Application Data, Application Data, Application Data"
"29","0.044188263","199.232.37.224","192.168.1.118","TCP","1418","443 → 40408 [ACK] Seq=37857 Ack=1 Win=57 Len=1352 TSval=271924293 TSecr=1344184622 [TCP segment of a reassembled PDU]"
"30","0.045710100","199.232.37.224","192.168.1.118","TLSv1.2","2770","Application Data, Application Data"
"31","0.047889438","199.232.37.224","192.168.1.118","TLSv1.2","1418","Application Data [TCP segment of a reassembled PDU]"
"32","0.055216900","199.232.37.224","192.168.1.118","TLSv1.2","1418","Application Data [TCP segment of a reassembled PDU]"
"33","0.057987788","199.232.37.224","192.168.1.118","TLSv1.2","1935","Application Data, Application Data, Application Data, Application Data"
"34","0.058631438","192.168.1.118","199.232.37.224","TLSv1","583","Client Hello"
"35","0.075220875","192.168.1.118","199.232.37.224","TLSv1","583","Client Hello"
"36","0.082477400","192.168.1.118","199.232.37.224","TCP","66","40408 → 443 [ACK] Seq=1 Ack=46486 Win=141 Len=0 TSval=1344184699 TSecr=271924293"
"37","0.100971625","192.168.1.118","199.232.37.224","TLSv1","583","Client Hello"
"38","0.117228425","192.168.1.118","199.232.37.224","TLSv1","583","Client Hello"
"39","0.119096875","192.168.1.118","209.18.47.62","DNS","76","Standard query 0x30c2 A i.etsystatic.com"
"40","0.119403988","192.168.1.118","209.18.47.62","DNS","76","Standard query 0xc49a A i.etsystatic.com"
"41","0.141305813","192.168.1.118","209.18.47.62","DNS","76","Standard query 0x4c8c A i.etsystatic.com"
"42","0.142494388","192.168.1.118","209.18.47.62","DNS","76","Standard query 0x308f A i.etsystatic.com"
"43","0.143462488","192.168.1.118","209.18.47.62","DNS","76","Standard query 0x2c5e A i.etsystatic.com"
"44","0.165503663","192.168.1.118","209.18.47.62","DNS","73","Standard query 0xd4e6 A blog.etsy.com"
"45","0.166282150","192.168.1.118","209.18.47.62","DNS","73","Standard query 0x3c6c A blog.etsy.com"
"46","0.167449438","192.168.1.118","209.18.47.62","DNS","73","Standard query 0x2c7b A blog.etsy.com"
"47","0.168757200","199.232.37.224","192.168.1.118","TCP","66","443 → 40430 [ACK] Seq=1 Ack=518 Win=28160 Len=0 TSval=2812562380 TSecr=1344184675"
"48","0.174837488","199.232.37.224","192.168.1.118","TLSv1.2","3751","Server Hello, Certificate, Server Key Exchange, Server Hello Done"
"49","0.174928713","192.168.1.118","199.232.37.224","TCP","66","40430 → 443 [ACK] Seq=518 Ack=3686 Win=60672 Len=0 TSval=1344184792 TSecr=2812562380"
"50","0.179174038","192.168.1.118","199.232.37.224","TLSv1.2","192","Client Key Exchange, Change Cipher Spec, Encrypted Handshake Message"
"51","0.194760650","192.168.1.118","199.232.37.224","TCP","66","[TCP Window Update] 40408 → 443 [ACK] Seq=1 Ack=46486 Win=483 Len=0 TSval=1344184811 TSecr=271924293"
"52","0.229587038","199.232.37.224","192.168.1.118","TCP","66","443 → 40432 [ACK] Seq=1 Ack=518 Win=28160 Len=0 TSval=2813477550 TSecr=1344184692"
"53","0.234471650","199.232.37.224","192.168.1.118","TLSv1.2","1418","Server Hello"
"54","0.234575825","192.168.1.118","199.232.37.224","TCP","66","40432 → 443 [ACK] Seq=518 Ack=1353 Win=63104 Len=0 TSval=1344184851 TSecr=2813477550"
"55","0.235720050","199.232.37.224","192.168.1.118","TLSv1.2","2399","Certificate, Server Key Exchange, Server Hello Done"
"56","0.235817800","192.168.1.118","199.232.37.224","TCP","66","40432 → 443 [ACK] Seq=518 Ack=3686 Win=61056 Len=0 TSval=1344184852 TSecr=2813477550"
"57","0.239138863","192.168.1.118","199.232.37.224","TLSv1.2","192","Client Key Exchange, Change Cipher Spec, Encrypted Handshake Message"
"58","0.239193163","209.18.47.62","192.168.1.118","DNS","167","Standard query response 0x308f A i.etsystatic.com CNAME i.etsystatic.com.edgekey.net CNAME e8634.f.akamaiedge.net A 23.32.171.112"
"59","0.239308263","209.18.47.62","192.168.1.118","DNS","125","Standard query response 0x30c2 A i.etsystatic.com CNAME etsy.map.fastly.net A 199.232.37.224"
"60","0.239402488","209.18.47.62","192.168.1.118","DNS","167","Standard query response 0x4c8c A i.etsystatic.com CNAME i.etsystatic.com.edgekey.net CNAME e8634.f.akamaiedge.net A 23.32.171.112"
"61","0.239675638","192.168.1.118","209.18.47.62","DNS","76","Standard query 0x301f AAAA i.etsystatic.com"
"62","0.239875038","192.168.1.118","209.18.47.62","DNS","76","Standard query 0xf880 AAAA i.etsystatic.com"
"63","0.240029400","192.168.1.118","209.18.47.62","DNS","76","Standard query 0x0c25 AAAA i.etsystatic.com"
"64","0.250400875","209.18.47.62","192.168.1.118","DNS","125","Standard query response 0x2c5e A i.etsystatic.com CNAME etsy.map.fastly.net A 199.232.37.224"
"65","0.250544863","209.18.47.62","192.168.1.118","DNS","167","Standard query response 0xc49a A i.etsystatic.com CNAME i.etsystatic.com.edgekey.net CNAME e8634.f.akamaiedge.net A 23.32.171.112"
"66","0.250631400","199.232.37.224","192.168.1.118","TCP","66","443 → 40434 [ACK] Seq=1 Ack=518 Win=28160 Len=0 TSval=2811617841 TSecr=1344184718"
"67","0.250719538","199.232.37.224","192.168.1.118","TCP","66","443 → 40436 [ACK] Seq=1 Ack=518 Win=28160 Len=0 TSval=2998864694 TSecr=1344184734"
"68","0.250836250","199.232.37.224","192.168.1.118","TLSv1.2","2770","Server Hello"
"69","0.250921200","192.168.1.118","199.232.37.224","TCP","66","40436 → 443 [ACK] Seq=518 Ack=2705 Win=61568 Len=0 TSval=1344184868 TSecr=2998864695"
"70","0.250985563","199.232.37.224","192.168.1.118","TLSv1.2","1047","Certificate, Server Key Exchange, Server Hello Done"
"71","0.251048725","192.168.1.118","199.232.37.224","TCP","66","40436 → 443 [ACK] Seq=518 Ack=3686 Win=60672 Len=0 TSval=1344184868 TSecr=2998864696"
"72","0.251160713","199.232.37.224","192.168.1.118","TLSv1.2","3751","Server Hello, Certificate, Server Key Exchange, Server Hello Done"
"73","0.251230100","192.168.1.118","199.232.37.224","TCP","66","40434 → 443 [ACK] Seq=518 Ack=3686 Win=60672 Len=0 TSval=1344184868 TSecr=2811617841"
"74","0.251568013","192.168.1.118","209.18.47.62","DNS","76","Standard query 0x00bd AAAA i.etsystatic.com"
"75","0.251788288","192.168.1.118","209.18.47.62","DNS","76","Standard query 0x3c3e AAAA i.etsystatic.com"
"76","0.253599338","192.168.1.118","199.232.37.224","TLSv1.2","192","Client Key Exchange, Change Cipher Spec, Encrypted Handshake Message"
"77","0.254466138","209.18.47.62","192.168.1.118","DNS","89","Standard query response 0xd4e6 A blog.etsy.com A 104.196.190.179"
"78","0.254816800","192.168.1.118","209.18.47.62","DNS","73","Standard query 0x78d8 AAAA blog.etsy.com"
"79","0.255527363","192.168.1.118","199.232.37.224","TLSv1.2","192","Client Key Exchange, Change Cipher Spec, Encrypted Handshake Message"
"80","0.264594225","209.18.47.62","192.168.1.118","DNS","89","Standard query response 0x2c7b A blog.etsy.com A 104.196.190.179"
"81","0.264831275","192.168.1.118","209.18.47.62","DNS","73","Standard query 0x08f4 AAAA blog.etsy.com"
"82","0.266368300","209.18.47.62","192.168.1.118","DNS","89","Standard query response 0x3c6c A blog.etsy.com A 104.196.190.179"
"83","0.266501950","192.168.1.118","209.18.47.62","DNS","73","Standard query 0x0cd4 AAAA blog.etsy.com"
"84","0.271516125","199.232.37.224","192.168.1.118","TCP","66","443 → 40430 [ACK] Seq=3686 Ack=644 Win=28160 Len=0 TSval=2812562405 TSecr=1344184796"
"85","0.271593925","199.232.37.224","192.168.1.118","TLSv1.2","117","Change Cipher Spec, Encrypted Handshake Message"
"86","0.272470700","192.168.1.118","199.232.37.224","TLSv1.2","792","Application Data"
"87","0.278985013","209.18.47.62","192.168.1.118","DNS","209","Standard query response 0x301f AAAA i.etsystatic.com CNAME i.etsystatic.com.edgekey.net CNAME e8634.f.akamaiedge.net SOA n0f.akamaiedge.net"
"88","0.279645275","192.168.1.118","23.32.171.112","TCP","74","43924 → 443 [SYN] Seq=0 Win=64240 Len=0 MSS=1460 SACK_PERM=1 TSval=2039871030 TSecr=0 WS=128"
"89","0.279758563","192.168.1.118","23.32.171.112","TCP","74","43926 → 443 [SYN] Seq=0 Win=64240 Len=0 MSS=1460 SACK_PERM=1 TSval=2039871030 TSecr=0 WS=128"
"90","0.279878513","192.168.1.118","23.32.171.112","TCP","74","43928 → 443 [SYN] Seq=0 Win=64240 Len=0 MSS=1460 SACK_PERM=1 TSval=2039871031 TSecr=0 WS=128"
"91","0.279952463","192.168.1.118","23.32.171.112","TCP","74","43930 → 443 [SYN] Seq=0 Win=64240 Len=0 MSS=1460 SACK_PERM=1 TSval=2039871031 TSecr=0 WS=128"
"92","0.280024375","192.168.1.118","23.32.171.112","TCP","74","43932 → 443 [SYN] Seq=0 Win=64240 Len=0 MSS=1460 SACK_PERM=1 TSval=2039871031 TSecr=0 WS=128"
"93","0.282363600","209.18.47.62","192.168.1.118","DNS","209","Standard query response 0x0c25 AAAA i.etsystatic.com CNAME i.etsystatic.com.edgekey.net CNAME e8634.f.akamaiedge.net SOA n0f.akamaiedge.net"
"94","0.282448888","209.18.47.62","192.168.1.118","DNS","167","Standard query response 0x00bd AAAA i.etsystatic.com CNAME etsy.map.fastly.net SOA ns1.fastly.net"
"95","0.282521738","209.18.47.62","192.168.1.118","DNS","167","Standard query response 0xf880 AAAA i.etsystatic.com CNAME etsy.map.fastly.net SOA ns1.fastly.net"
"96","0.282593400","209.18.47.62","192.168.1.118","DNS","138","Standard query response 0x78d8 AAAA blog.etsy.com SOA dns1.p03.nsone.net"
"97","0.282659700","199.232.37.224","192.168.1.118","TLSv1.2","117","Change Cipher Spec, Encrypted Handshake Message"
"98","0.282735588","199.232.37.224","192.168.1.118","TLSv1.2","117","Change Cipher Spec, Encrypted Handshake Message"
"99","0.282810825","209.18.47.62","192.168.1.118","DNS","209","Standard query response 0x3c3e AAAA i.etsystatic.com CNAME i.etsystatic.com.edgekey.net CNAME e8634.f.akamaiedge.net SOA n0f.akamaiedge.net"
"100","0.282881013","199.232.37.224","192.168.1.118","TLSv1.2","117","Change Cipher Spec, Encrypted Handshake Message"
"101","0.283092325","192.168.1.118","199.232.37.224","TLSv1.2","912","Application Data"
"102","0.283409913","192.168.1.118","199.232.37.224","TLSv1.2","621","Application Data"
"103","0.283652675","192.168.1.118","199.232.37.224","TLSv1.2","664","Application Data"
"104","0.284916050","192.168.1.118","104.196.190.179","TCP","74","46648 → 443 [SYN] Seq=0 Win=64240 Len=0 MSS=1460 SACK_PERM=1 TSval=3701335393 TSecr=0 WS=128"
"105","0.285023175","192.168.1.118","104.196.190.179","TCP","74","46650 → 443 [SYN] Seq=0 Win=64240 Len=0 MSS=1460 SACK_PERM=1 TSval=3701335393 TSecr=0 WS=128"
"106","0.285100475","192.168.1.118","104.196.190.179","TCP","74","46652 → 443 [SYN] Seq=0 Win=64240 Len=0 MSS=1460 SACK_PERM=1 TSval=3701335393 TSecr=0 WS=128"
"107","0.297442013","209.18.47.62","192.168.1.118","DNS","138","Standard query response 0x08f4 AAAA blog.etsy.com SOA dns1.p03.nsone.net"
"108","0.300314000","209.18.47.62","192.168.1.118","DNS","138","Standard query response 0x0cd4 AAAA blog.etsy.com SOA dns1.p03.nsone.net"
"109","0.300402488","199.232.37.224","192.168.1.118","TLSv1.2","2770","Application Data, Application Data"
"110","0.301026888","192.168.1.118","199.232.37.224","TCP","66","40430 → 443 [ACK] Seq=1370 Ack=6441 Win=61440 Len=0 TSval=1344184918 TSecr=2812562412"
"111","0.301459613","199.232.37.224","192.168.1.118","TLSv1.2","10882","Application Data, Application Data, Application Data, Application Data, Application Data, Application Data, Application Data, Application Data"
"112","0.301630038","192.168.1.118","199.232.37.224","TCP","66","40430 → 443 [ACK] Seq=1370 Ack=17257 Win=50688 Len=0 TSval=1344184918 TSecr=2812562412"
"113","0.307979375","23.32.171.112","192.168.1.118","TCP","74","443 → 43930 [SYN, ACK] Seq=0 Ack=1 Win=28960 Len=0 MSS=1460 SACK_PERM=1 TSval=1808567419 TSecr=2039871031 WS=128"
"114","0.308091425","192.168.1.118","23.32.171.112","TCP","66","43930 → 443 [ACK] Seq=1 Ack=1 Win=64256 Len=0 TSval=2039871059 TSecr=1808567419"
"115","0.311398113","23.32.171.112","192.168.1.118","TCP","74","443 → 43928 [SYN, ACK] Seq=0 Ack=1 Win=28960 Len=0 MSS=1460 SACK_PERM=1 TSval=1808567419 TSecr=2039871031 WS=128"
"116","0.311484450","192.168.1.118","23.32.171.112","TCP","66","43928 → 443 [ACK] Seq=1 Ack=1 Win=64256 Len=0 TSval=2039871062 TSecr=1808567419"
"117","0.311605425","199.232.37.224","192.168.1.118","TLSv1.2","5474","Application Data, Application Data, Application Data, Application Data"
"118","0.312525500","23.32.171.112","192.168.1.118","TCP","74","443 → 43932 [SYN, ACK] Seq=0 Ack=1 Win=28960 Len=0 MSS=1460 SACK_PERM=1 TSval=1808567419 TSecr=2039871031 WS=128"
"119","0.312620150","192.168.1.118","23.32.171.112","TCP","66","43932 → 443 [ACK] Seq=1 Ack=1 Win=64256 Len=0 TSval=2039871063 TSecr=1808567419"
"120","0.312709025","23.32.171.112","192.168.1.118","TCP","74","443 → 43924 [SYN, ACK] Seq=0 Ack=1 Win=28960 Len=0 MSS=1460 SACK_PERM=1 TSval=1808567419 TSecr=2039871030 WS=128"
"121","0.312800988","192.168.1.118","23.32.171.112","TCP","66","43924 → 443 [ACK] Seq=1 Ack=1 Win=64256 Len=0 TSval=2039871063 TSecr=1808567419"
"122","0.312901263","23.32.171.112","192.168.1.118","TCP","74","443 → 43926 [SYN, ACK] Seq=0 Ack=1 Win=28960 Len=0 MSS=1460 SACK_PERM=1 TSval=1808567419 TSecr=2039871030 WS=128"
"123","0.312992900","192.168.1.118","23.32.171.112","TCP","66","43926 → 443 [ACK] Seq=1 Ack=1 Win=64256 Len=0 TSval=2039871064 TSecr=1808567419"
"124","0.313110450","199.232.37.224","192.168.1.118","TLSv1.2","8178","Application Data, Application Data, Application Data, Application Data, Application Data, Application Data"
"125","0.317136938","199.232.37.224","192.168.1.118","TLSv1.2","934","Application Data, Application Data"
"126","0.318298313","199.232.37.224","192.168.1.118","TLSv1.2","1418","Application Data"
"127","0.321167525","199.232.37.224","192.168.1.118","TLSv1.2","5474","Application Data, Application Data, Application Data, Application Data"
"128","0.321575475","199.232.37.224","192.168.1.118","TLSv1.2","5474","Application Data, Application Data, Application Data, Application Data"
"129","0.324395888","199.232.37.224","192.168.1.118","TLSv1.2","1081","Application Data, Application Data"
"130","0.324593188","199.232.37.224","192.168.1.118","TLSv1.2","6826","Application Data, Application Data, Application Data, Application Data, Application Data"
"131","0.324805263","199.232.37.224","192.168.1.118","TLSv1.2","1418","Application Data [TCP segment of a reassembled PDU]"
"132","0.327452363","199.232.37.224","192.168.1.118","TLSv1.2","9530","Application Data, Application Data, Application Data, Application Data, Application Data, Application Data"
"133","0.329547038","199.232.37.224","192.168.1.118","TLSv1.2","2770","Application Data, Application Data"
"134","0.330819300","199.232.37.224","192.168.1.118","TLSv1.2","6826","Application Data, Application Data, Application Data, Application Data, Application Data"
"135","0.332191625","192.168.1.118","23.32.171.112","TLSv1","583","Client Hello"
"136","0.332838038","104.196.190.179","192.168.1.118","TCP","66","443 → 46652 [SYN, ACK] Seq=0 Ack=1 Win=28400 Len=0 MSS=1420 SACK_PERM=1 WS=512"
"137","0.332912338","192.168.1.118","104.196.190.179","TCP","54","46652 → 443 [ACK] Seq=1 Ack=1 Win=64256 Len=0"
"138","0.335240650","104.196.190.179","192.168.1.118","TCP","66","443 → 46650 [SYN, ACK] Seq=0 Ack=1 Win=28400 Len=0 MSS=1420 SACK_PERM=1 WS=512"
"139","0.335287025","192.168.1.118","104.196.190.179","TCP","54","46650 → 443 [ACK] Seq=1 Ack=1 Win=64256 Len=0"
"140","0.336690200","104.196.190.179","192.168.1.118","TCP","66","443 → 46648 [SYN, ACK] Seq=0 Ack=1 Win=28400 Len=0 MSS=1420 SACK_PERM=1 WS=512"
"141","0.336713313","192.168.1.118","104.196.190.179","TCP","54","46648 → 443 [ACK] Seq=1 Ack=1 Win=64256 Len=0"
"142","0.347362113","23.32.171.112","192.168.1.118","TCP","66","443 → 43930 [ACK] Seq=1 Ack=518 Win=30080 Len=0 TSval=1808567461 TSecr=2039871083"
"143","0.349676525","192.168.1.118","23.32.171.112","TLSv1","583","Client Hello"
"144","0.352360225","192.168.1.118","199.232.37.224","TCP","66","40432 → 443 [ACK] Seq=1490 Ack=17257 Win=50688 Len=0 TSval=1344184969 TSecr=2813477569"
"145","0.353022888","23.32.171.112","192.168.1.118","TLSv1.2","1514","Server Hello"
"146","0.353052788","192.168.1.118","23.32.171.112","TCP","66","43930 → 443 [ACK] Seq=518 Ack=1449 Win=63104 Len=0 TSval=2039871104 TSecr=1808567463"
"147","0.355711113","23.32.171.112","192.168.1.118","TLSv1.2","1849","Certificate, Server Key Exchange, Server Hello Done"
"148","0.355770975","192.168.1.118","23.32.171.112","TCP","66","43930 → 443 [ACK] Seq=518 Ack=3232 Win=61440 Len=0 TSval=2039871106 TSecr=1808567463"
"149","0.357360863","192.168.1.118","199.232.37.224","TCP","66","40434 → 443 [ACK] Seq=1199 Ack=4605 Win=63360 Len=0 TSval=1344184974 TSecr=2811617861"
"150","0.360356338","192.168.1.118","199.232.37.224","TCP","66","40436 → 443 [ACK] Seq=1242 Ack=16920 Win=51072 Len=0 TSval=1344184977 TSecr=2998864776"
"151","0.365375113","192.168.1.118","199.232.37.224","TCP","66","40430 → 443 [ACK] Seq=1370 Ack=44297 Win=23680 Len=0 TSval=1344184982 TSecr=2812562419"
"152","0.366620000","192.168.1.118","23.32.171.112","TLSv1","583","Client Hello"
"153","0.371902325","23.32.171.112","192.168.1.118","TCP","66","443 → 43932 [ACK] Seq=1 Ack=518 Win=30080 Len=0 TSval=1808567485 TSecr=2039871100"
"154","0.375553088","23.32.171.112","192.168.1.118","TLSv1.2","1514","Server Hello"
"155","0.375625963","192.168.1.118","23.32.171.112","TCP","66","43932 → 443 [ACK] Seq=518 Ack=1449 Win=63104 Len=0 TSval=2039871126 TSecr=1808567487"
"156","0.380246038","23.32.171.112","192.168.1.118","TLSv1.2","1849","Certificate, Server Key Exchange, Server Hello Done"
"157","0.380323025","192.168.1.118","23.32.171.112","TCP","66","43932 → 443 [ACK] Seq=518 Ack=3232 Win=61440 Len=0 TSval=2039871131 TSecr=1808567487"
"158","0.383127825","192.168.1.118","23.32.171.112","TLSv1","583","Client Hello"
"159","0.383368338","199.232.37.224","192.168.1.118","TLSv1.2","5474","Application Data, Application Data, Application Data, Application Data"
"160","0.383446025","192.168.1.118","199.232.37.224","TCP","66","40432 → 443 [ACK] Seq=1490 Ack=22665 Win=45312 Len=0 TSval=1344185000 TSecr=2813477587"
"161","0.384976625","199.232.37.224","192.168.1.118","TLSv1.2","2770","Application Data, Application Data"
"162","0.385049025","192.168.1.118","199.232.37.224","TCP","66","40432 → 443 [ACK] Seq=1490 Ack=25369 Win=42624 Len=0 TSval=1344185002 TSecr=2813477587"
"163","0.385365363","199.232.37.224","192.168.1.118","TLSv1.2","8178","Application Data, Application Data, Application Data, Application Data, Application Data"
"164","0.388911875","199.232.37.224","192.168.1.118","TLSv1.2","4122","Application Data, Application Data, Application Data"
"165","0.389058675","199.232.37.224","192.168.1.118","TLSv1.2","4122","Application Data, Application Data, Application Data"
"166","0.391775313","199.232.37.224","192.168.1.118","TLSv1.2","8178","Application Data, Application Data, Application Data, Application Data, Application Data, Application Data"
"167","0.392043700","199.232.37.224","192.168.1.118","TLSv1.2","5474","Application Data, Application Data, Application Data"
"168","0.396575850","23.32.171.112","192.168.1.118","TCP","66","443 → 43924 [ACK] Seq=1 Ack=518 Win=30080 Len=0 TSval=1808567500 TSecr=2039871117"
"169","0.396714375","23.32.171.112","192.168.1.118","TLSv1.2","3297","Server Hello, Certificate, Server Key Exchange, Server Hello Done"
"170","0.396796438","192.168.1.118","23.32.171.112","TCP","66","43924 → 443 [ACK] Seq=518 Ack=3232 Win=61056 Len=0 TSval=2039871147 TSecr=1808567503"
"171","0.396859138","199.232.37.224","192.168.1.118","TLSv1.2","1418","Application Data [TCP segment of a reassembled PDU]"
"172","0.396908225","199.232.37.224","192.168.1.118","TLSv1.2","2770","Application Data, Application Data"
"173","0.398065000","199.232.37.224","192.168.1.118","TLSv1.2","2770","Application Data, Application Data"
"174","0.399672663","192.168.1.118","104.196.190.179","TLSv1","571","Client Hello"
"175","0.402112213","199.232.37.224","192.168.1.118","TLSv1.2","1418","Application Data [TCP segment of a reassembled PDU]"
"176","0.409071013","199.232.37.224","192.168.1.118","TLSv1.2","1418","Application Data [TCP segment of a reassembled PDU]"
"177","0.410445913","199.232.37.224","192.168.1.118","TLSv1.2","1418","Application Data [TCP segment of a reassembled PDU]"
"178","0.412219363","199.232.37.224","192.168.1.118","TLSv1.2","1418","Application Data [TCP segment of a reassembled PDU]"
"179","0.414921088","23.32.171.112","192.168.1.118","TCP","66","443 → 43926 [ACK] Seq=1 Ack=518 Win=30080 Len=0 TSval=1808567528 TSecr=2039871134"
"180","0.416173150","192.168.1.118","104.196.190.179","TLSv1","571","Client Hello"
"181","0.417426763","23.32.171.112","192.168.1.118","TLSv1.2","1514","Server Hello"
"182","0.417508113","192.168.1.118","23.32.171.112","TCP","66","43926 → 443 [ACK] Seq=518 Ack=1449 Win=63104 Len=0 TSval=2039871168 TSecr=1808567529"
"183","0.419701725","23.32.171.112","192.168.1.118","TLSv1.2","1849","Certificate, Server Key Exchange, Server Hello Done"
"184","0.419786713","192.168.1.118","23.32.171.112","TCP","66","43926 → 443 [ACK] Seq=518 Ack=3232 Win=61440 Len=0 TSval=2039871170 TSecr=1808567529"
"185","0.419870500","199.232.37.224","192.168.1.118","TLSv1.2","1418","Application Data [TCP segment of a reassembled PDU]"
"186","0.419952288","192.168.1.118","199.232.37.224","TCP","66","40432 → 443 [ACK] Seq=1490 Ack=45649 Win=22400 Len=0 TSval=1344185037 TSecr=2813477587"
"187","0.421792113","199.232.37.224","192.168.1.118","TLSv1.2","2770","Application Data, Application Data"
"188","0.424673938","199.232.37.224","192.168.1.118","TLSv1.2","1184","Application Data, Application Data"
"189","0.429383463","192.168.1.118","199.232.37.224","TCP","66","40430 → 443 [ACK] Seq=1370 Ack=67281 Win=768 Len=0 TSval=1344185046 TSecr=2812562434"
"190","0.433298675","192.168.1.118","104.196.190.179","TLSv1","571","Client Hello"
"191","0.433596450","192.168.1.118","199.232.37.224","TCP","66","40432 → 443 [ACK] Seq=1490 Ack=49471 Win=18688 Len=0 TSval=1344185050 TSecr=2813477596"
"192","0.441779800","104.196.190.179","192.168.1.118","TCP","54","443 → 46648 [ACK] Seq=1 Ack=518 Win=29696 Len=0"
"193","0.443402825","104.196.190.179","192.168.1.118","TLSv1.2","1474","Server Hello"
"194","0.443450813","192.168.1.118","104.196.190.179","TCP","54","46648 → 443 [ACK] Seq=518 Ack=1421 Win=63104 Len=0"
"195","0.445164000","104.196.190.179","192.168.1.118","TLSv1.2","1769","Certificate, Server Key Exchange, Server Hello Done"
"196","0.445195713","192.168.1.118","104.196.190.179","TCP","54","46648 → 443 [ACK] Seq=518 Ack=3136 Win=61440 Len=0"
"197","0.452774400","192.168.1.118","23.32.171.112","TLSv1","583","Client Hello"
"198","0.454834625","192.168.1.118","23.32.171.112","TLSv1.2","192","Client Key Exchange, Change Cipher Spec, Encrypted Handshake Message"
"199","0.456847050","104.196.190.179","192.168.1.118","TCP","54","443 → 46650 [ACK] Seq=1 Ack=518 Win=29696 Len=0"
"200","0.458251700","192.168.1.118","23.32.171.112","TLSv1.2","192","Client Key Exchange, Change Cipher Spec, Encrypted Handshake Message"
"201","0.460302225","192.168.1.118","23.32.171.112","TLSv1.2","192","Client Key Exchange, Change Cipher Spec, Encrypted Handshake Message"
"202","0.461414688","104.196.190.179","192.168.1.118","TLSv1.2","3189","Server Hello, Certificate, Server Key Exchange, Server Hello Done"
"203","0.461465188","192.168.1.118","104.196.190.179","TCP","54","46650 → 443 [ACK] Seq=518 Ack=3136 Win=61184 Len=0"
"204","0.462350988","192.168.1.118","23.32.171.112","TLSv1.2","192","Client Key Exchange, Change Cipher Spec, Encrypted Handshake Message"
"205","0.464479038","192.168.1.118","104.196.190.179","TLSv1.2","180","Client Key Exchange, Change Cipher Spec, Encrypted Handshake Message"
"206","0.466777638","192.168.1.118","104.196.190.179","TLSv1.2","180","Client Key Exchange, Change Cipher Spec, Encrypted Handshake Message"
"207","0.472004000","104.196.190.179","192.168.1.118","TCP","54","443 → 46652 [ACK] Seq=1 Ack=518 Win=29696 Len=0"
"208","0.473867463","104.196.190.179","192.168.1.118","TLSv1.2","1474","Server Hello"
"209","0.473900613","192.168.1.118","104.196.190.179","TCP","54","46652 → 443 [ACK] Seq=518 Ack=1421 Win=63104 Len=0"
"210","0.479997813","104.196.190.179","192.168.1.118","TLSv1.2","1769","Certificate, Server Key Exchange, Server Hello Done"
"211","0.480041775","192.168.1.118","104.196.190.179","TCP","54","46652 → 443 [ACK] Seq=518 Ack=3136 Win=61440 Len=0"
"212","0.480873363","23.32.171.112","192.168.1.118","TCP","66","443 → 43928 [ACK] Seq=1 Ack=518 Win=30080 Len=0 TSval=1808567591 TSecr=2039871203"
"213","0.480896688","23.32.171.112","192.168.1.118","TLSv1.2","117","Change Cipher Spec, Encrypted Handshake Message"
"214","0.480917588","192.168.1.118","23.32.171.112","TCP","66","43930 → 443 [ACK] Seq=644 Ack=3283 Win=64128 Len=0 TSval=2039871232 TSecr=1808567591"
"215","0.480934725","23.32.171.112","192.168.1.118","TLSv1.2","117","Change Cipher Spec, Encrypted Handshake Message"
"216","0.480953525","192.168.1.118","23.32.171.112","TCP","66","43932 → 443 [ACK] Seq=644 Ack=3283 Win=64128 Len=0 TSval=2039871232 TSecr=1808567591"
"217","0.482823163","23.32.171.112","192.168.1.118","TLSv1.2","3297","Server Hello, Certificate, Server Key Exchange, Server Hello Done"
"218","0.482844650","192.168.1.118","23.32.171.112","TCP","66","43928 → 443 [ACK] Seq=518 Ack=3232 Win=61056 Len=0 TSval=2039871233 TSecr=1808567593"
"219","0.485475325","192.168.1.118","23.32.171.112","TLSv1.2","192","Client Key Exchange, Change Cipher Spec, Encrypted Handshake Message"
"220","0.485757800","192.168.1.118","23.32.171.112","TLSv1.2","305","Application Data"
"221","0.485968838","192.168.1.118","23.32.171.112","TLSv1.2","315","Application Data"
"222","0.488036375","192.168.1.118","104.196.190.179","TLSv1.2","180","Client Key Exchange, Change Cipher Spec, Encrypted Handshake Message"
"223","0.492459450","23.32.171.112","192.168.1.118","TLSv1.2","117","Change Cipher Spec, Encrypted Handshake Message"
"224","0.492537063","192.168.1.118","23.32.171.112","TCP","66","43926 → 443 [ACK] Seq=644 Ack=3283 Win=64128 Len=0 TSval=2039871243 TSecr=1808567605"
"225","0.493752463","23.32.171.112","192.168.1.118","TLSv1.2","117","Change Cipher Spec, Encrypted Handshake Message"
"226","0.493776425","192.168.1.118","23.32.171.112","TCP","66","43924 → 443 [ACK] Seq=644 Ack=3283 Win=64128 Len=0 TSval=2039871244 TSecr=1808567605"
"227","0.509742938","192.168.1.118","192.168.1.102","TCP","176","44768 → 8009 [PSH, ACK] Seq=1 Ack=1 Win=501 Len=110 TSval=2259128936 TSecr=5365098 [TCP segment of a reassembled PDU]"
"228","0.510606138","192.168.1.118","23.32.171.112","TLSv1.2","313","Application Data"
"229","0.510835238","192.168.1.118","23.32.171.112","TLSv1.2","310","Application Data"
"230","0.510997513","23.32.171.112","192.168.1.118","TCP","1514","[TCP segment of a reassembled PDU]"
"231","0.515484538","23.32.171.112","192.168.1.118","TCP","2962","443 → 43932 [ACK] Seq=4731 Ack=893 Win=31104 Len=2896 TSval=1808567622 TSecr=2039871237 [TCP segment of a reassembled PDU]"
"232","0.517157300","23.32.171.112","192.168.1.118","TCP","5858","443 → 43932 [ACK] Seq=7627 Ack=893 Win=31104 Len=5792 TSval=1808567622 TSecr=2039871237 [TCP segment of a reassembled PDU]"
"233","0.518187588","23.32.171.112","192.168.1.118","TLSv1.2","10406","Application Data, Application Data"
"234","0.518232925","23.32.171.112","192.168.1.118","TLSv1.2","117","Change Cipher Spec, Encrypted Handshake Message"
"235","0.518283788","23.32.171.112","192.168.1.118","TCP","1514","[TCP segment of a reassembled PDU]"
"236","0.522316350","192.168.1.118","23.32.171.112","TLSv1.2","305","Application Data"
"237","0.522486950","192.168.1.118","23.32.171.112","TCP","66","43932 → 443 [ACK] Seq=893 Ack=23759 Win=43776 Len=0 TSval=2039871273 TSecr=1808567622"
"238","0.522523200","23.32.171.112","192.168.1.118","TCP","5858","443 → 43930 [ACK] Seq=4731 Ack=883 Win=31104 Len=5792 TSval=1808567623 TSecr=2039871236 [TCP segment of a reassembled PDU]"
"239","0.523184738","192.168.1.118","23.32.171.112","TCP","66","43930 → 443 [ACK] Seq=883 Ack=10523 Win=64128 Len=0 TSval=2039871274 TSecr=1808567623"
"240","0.524185525","23.32.171.112","192.168.1.118","TCP","5858","443 → 43930 [ACK] Seq=10523 Ack=883 Win=31104 Len=5792 TSval=1808567623 TSecr=2039871236 [TCP segment of a reassembled PDU]"
"241","0.524812750","192.168.1.118","23.32.171.112","TCP","66","43930 → 443 [ACK] Seq=883 Ack=16315 Win=64128 Len=0 TSval=2039871275 TSecr=1808567623"
"242","0.525033500","192.168.1.118","23.32.171.112","TLSv1.2","309","Application Data"
"243","0.525682850","104.196.190.179","192.168.1.118","TLSv1.2","105","Change Cipher Spec, Encrypted Handshake Message"
"244","0.525718888","23.32.171.112","192.168.1.118","TLSv1.2","10202","Application Data [TCP segment of a reassembled PDU]"
"245","0.527650238","104.196.190.179","192.168.1.118","TLSv1.2","105","Change Cipher Spec, Encrypted Handshake Message"
"246","0.527696550","104.196.190.179","192.168.1.118","TLSv1.2","105","Change Cipher Spec, Encrypted Handshake Message"
"247","0.528947388","192.168.1.102","192.168.1.118","TCP","176","8009 → 44768 [PSH, ACK] Seq=1 Ack=111 Win=294 Len=110 TSval=5365600 TSecr=2259128936 [TCP segment of a reassembled PDU]"
"248","0.529022263","192.168.1.118","192.168.1.102","TCP","66","44768 → 8009 [ACK] Seq=111 Ack=111 Win=501 Len=0 TSval=2259128956 TSecr=5365600"
"249","0.534362050","23.32.171.112","192.168.1.118","TCP","1514","[TCP segment of a reassembled PDU]"
"250","0.538040200","23.32.171.112","192.168.1.118","TCP","5858","443 → 43924 [ACK] Seq=4731 Ack=891 Win=31104 Len=5792 TSval=1808567646 TSecr=2039871261 [TCP segment of a reassembled PDU]"
"251","0.539188575","23.32.171.112","192.168.1.118","TLSv1.2","8385","Application Data"
"252","0.542503450","192.168.1.118","23.32.171.112","TCP","66","43930 → 443 [ACK] Seq=883 Ack=26451 Win=54016 Len=0 TSval=2039871293 TSecr=1808567623"
"253","0.542712675","192.168.1.118","23.32.171.112","TCP","66","43924 → 443 [ACK] Seq=891 Ack=18842 Win=48640 Len=0 TSval=2039871293 TSecr=1808567646"
"254","0.543149800","192.168.1.118","104.196.190.179","TLSv1.2","660","Application Data"
"255","0.543398125","192.168.1.118","104.196.190.179","TLSv1.2","656","Application Data"
"256","0.543607588","192.168.1.118","104.196.190.179","TLSv1.2","658","Application Data"
"257","0.549025263","23.32.171.112","192.168.1.118","TCP","2962","[TCP segment of a reassembled PDU]"
"258","0.550763350","23.32.171.112","192.168.1.118","TCP","5858","443 → 43926 [ACK] Seq=6179 Ack=888 Win=31104 Len=5792 TSval=1808567648 TSecr=2039871261 [TCP segment of a reassembled PDU]"
"259","0.552228375","23.32.171.112","192.168.1.118","TLSv1.2","13924","Application Data, Application Data"
"260","0.554363500","192.168.1.118","199.232.37.224","TCP","66","[TCP Window Update] 40430 → 443 [ACK] Seq=1370 Ack=67281 Win=22912 Len=0 TSval=1344185171 TSecr=2812562434"
"261","0.554571650","23.32.171.112","192.168.1.118","TLSv1.2","5858","Application Data [TCP segment of a reassembled PDU]"
"262","0.554642788","192.168.1.118","23.32.171.112","TCP","66","43930 → 443 [ACK] Seq=883 Ack=32243 Win=56960 Len=0 TSval=2039871305 TSecr=1808567651"
"263","0.554768263","192.168.1.118","23.32.171.112","TCP","66","43926 → 443 [ACK] Seq=888 Ack=25829 Win=41600 Len=0 TSval=2039871305 TSecr=1808567648"
"264","0.555092288","192.168.1.118","23.32.171.112","TLSv1.2","310","Application Data"
"265","0.556229875","23.32.171.112","192.168.1.118","TCP","5858","443 → 43930 [ACK] Seq=32243 Ack=883 Win=31104 Len=5792 TSval=1808567651 TSecr=2039871275 [TCP segment of a reassembled PDU]"
"266","0.556290250","192.168.1.118","23.32.171.112","TCP","66","43930 → 443 [ACK] Seq=883 Ack=38035 Win=75776 Len=0 TSval=2039871307 TSecr=1808567651"
"267","0.557538613","23.32.171.112","192.168.1.118","TLSv1.2","10202","Application Data [TCP segment of a reassembled PDU]"
"268","0.557602900","192.168.1.118","23.32.171.112","TCP","66","43930 → 443 [ACK] Seq=883 Ack=48171 Win=96000 Len=0 TSval=2039871308 TSecr=1808567651"
"269","0.561505775","23.32.171.112","192.168.1.118","TCP","1514","443 → 43930 [ACK] Seq=48171 Ack=883 Win=31104 Len=1448 TSval=1808567651 TSecr=2039871275 [TCP segment of a reassembled PDU]"
"270","0.564152988","192.168.1.118","23.32.171.112","TLSv1.2","309","Application Data"
"271","0.564324963","23.32.171.112","192.168.1.118","TCP","2962","443 → 43930 [ACK] Seq=49619 Ack=883 Win=31104 Len=2896 TSval=1808567651 TSecr=2039871275 [TCP segment of a reassembled PDU]"
"272","0.564419588","192.168.1.118","23.32.171.112","TCP","66","43930 → 443 [ACK] Seq=883 Ack=52515 Win=104704 Len=0 TSval=2039871315 TSecr=1808567651"
"273","0.565972200","23.32.171.112","192.168.1.118","TCP","1514","[TCP segment of a reassembled PDU]"
"274","0.568484063","23.32.171.112","192.168.1.118","TCP","1514","443 → 43928 [ACK] Seq=4731 Ack=883 Win=31104 Len=1448 TSval=1808567652 TSecr=2039871273 [TCP segment of a reassembled PDU]"
"275","0.568530100","23.32.171.112","192.168.1.118","TCP","7306","[TCP segment of a reassembled PDU]"
"276","0.568784425","23.32.171.112","192.168.1.118","TCP","8754","443 → 43932 [ACK] Seq=30999 Ack=1136 Win=32256 Len=8688 TSval=1808567656 TSecr=2039871276 [TCP segment of a reassembled PDU]"
"277","0.572698313","23.32.171.112","192.168.1.118","TLSv1.2","5858","Application Data [TCP segment of a reassembled PDU]"
"278","0.573429425","192.168.1.118","23.32.171.112","TCP","66","43928 → 443 [ACK] Seq=883 Ack=6179 Win=61312 Len=0 TSval=2039871324 TSecr=1808567652"
"279","0.573571300","192.168.1.118","23.32.171.112","TCP","66","43932 → 443 [ACK] Seq=1136 Ack=45479 Win=64128 Len=0 TSval=2039871324 TSecr=1808567656"
"280","0.574427963","23.32.171.112","192.168.1.118","TLSv1.2","4410","Application Data [TCP segment of a reassembled PDU]"
"281","0.574509150","192.168.1.118","23.32.171.112","TCP","66","43932 → 443 [ACK] Seq=1136 Ack=49823 Win=72832 Len=0 TSval=2039871325 TSecr=1808567656"
"282","0.574561300","23.32.171.112","192.168.1.118","TCP","2962","443 → 43928 [ACK] Seq=6179 Ack=883 Win=31104 Len=2896 TSval=1808567652 TSecr=2039871273 [TCP segment of a reassembled PDU]"
"283","0.575108463","192.168.1.118","23.32.171.112","TCP","66","43928 → 443 [ACK] Seq=883 Ack=9075 Win=64128 Len=0 TSval=2039871326 TSecr=1808567652"
"284","0.575572513","23.32.171.112","192.168.1.118","TCP","2962","443 → 43932 [ACK] Seq=49823 Ack=1136 Win=32256 Len=2896 TSval=1808567657 TSecr=2039871276 [TCP segment of a reassembled PDU]"
"285","0.575648988","192.168.1.118","23.32.171.112","TCP","66","43932 → 443 [ACK] Seq=1136 Ack=52719 Win=78592 Len=0 TSval=2039871326 TSecr=1808567657"
"286","0.575700188","23.32.171.112","192.168.1.118","TCP","2962","443 → 43928 [ACK] Seq=9075 Ack=883 Win=31104 Len=2896 TSval=1808567652 TSecr=2039871273 [TCP segment of a reassembled PDU]"
"287","0.575751788","23.32.171.112","192.168.1.118","TLSv1.2","2962","Application Data [TCP segment of a reassembled PDU]"
"288","0.575820875","192.168.1.118","23.32.171.112","TCP","66","43930 → 443 [ACK] Seq=883 Ack=55411 Win=110464 Len=0 TSval=2039871326 TSecr=1808567674"
"289","0.576882350","23.32.171.112","192.168.1.118","TCP","2962","443 → 43930 [ACK] Seq=55411 Ack=883 Win=31104 Len=2896 TSval=1808567674 TSecr=2039871293 [TCP segment of a reassembled PDU]"
"290","0.576958200","192.168.1.118","23.32.171.112","TCP","66","43930 → 443 [ACK] Seq=883 Ack=58307 Win=116224 Len=0 TSval=2039871328 TSecr=1808567674"
"291","0.589157888","192.168.1.118","23.32.171.112","TCP","66","43928 → 443 [ACK] Seq=883 Ack=11971 Win=64128 Len=0 TSval=2039871340 TSecr=1808567652"
"292","0.591550950","23.32.171.112","192.168.1.118","TLSv1.2","5167","Application Data"
"293","0.591629225","192.168.1.118","23.32.171.112","TCP","66","43930 → 443 [ACK] Seq=883 Ack=63408 Win=126464 Len=0 TSval=2039871342 TSecr=1808567674"
"294","0.591744850","23.32.171.112","192.168.1.118","TCP","2962","443 → 43928 [ACK] Seq=11971 Ack=883 Win=31104 Len=2896 TSval=1808567661 TSecr=2039871273 [TCP segment of a reassembled PDU]"
"295","0.592921700","23.32.171.112","192.168.1.118","TCP","2962","443 → 43928 [ACK] Seq=14867 Ack=883 Win=31104 Len=2896 TSval=1808567670 TSecr=2039871273 [TCP segment of a reassembled PDU]"
"296","0.593049263","23.32.171.112","192.168.1.118","TLSv1.2","2962","Application Data [TCP segment of a reassembled PDU]"
"297","0.593102525","104.196.190.179","192.168.1.118","TCP","1474","[TCP segment of a reassembled PDU]"
"298","0.597028500","104.196.190.179","192.168.1.118","TCP","8574","443 → 46652 [ACK] Seq=4607 Ack=1248 Win=30720 Len=8520 [TCP segment of a reassembled PDU]"
"299","0.597831488","192.168.1.118","23.32.171.112","TCP","66","43928 → 443 [ACK] Seq=883 Ack=20659 Win=55552 Len=0 TSval=2039871348 TSecr=1808567661"
"300","0.598209638","192.168.1.118","104.196.190.179","TCP","54","46652 → 443 [ACK] Seq=1248 Ack=13127 Win=54272 Len=0"
"301","0.598672088","104.196.190.179","192.168.1.118","TCP","1474","443 → 46652 [ACK] Seq=13127 Ack=1248 Win=30720 Len=1420 [TCP segment of a reassembled PDU]"
"302","0.598722013","104.196.190.179","192.168.1.118","TCP","5734","[TCP segment of a reassembled PDU]"
"303","0.598876550","192.168.1.118","104.196.190.179","TCP","54","46650 → 443 [ACK] Seq=1246 Ack=8867 Win=58496 Len=0"
"304","0.600038788","104.196.190.179","192.168.1.118","TCP","7154","443 → 46650 [ACK] Seq=8867 Ack=1246 Win=30720 Len=7100 [TCP segment of a reassembled PDU]"
"305","0.600246650","192.168.1.118","23.32.171.112","TLSv1.2","310","Application Data"
"306","0.600614725","192.168.1.118","104.196.190.179","TCP","54","46650 → 443 [ACK] Seq=1246 Ack=15967 Win=64128 Len=0"
"307","0.603403688","104.196.190.179","192.168.1.118","TLSv1.2","3687","Application Data"
"308","0.603514688","104.196.190.179","192.168.1.118","TCP","2894","[TCP segment of a reassembled PDU]"
"309","0.605012838","104.196.190.179","192.168.1.118","TCP","2894","443 → 46648 [ACK] Seq=6027 Ack=1250 Win=30720 Len=2840 [TCP segment of a reassembled PDU]"
"310","0.606257488","104.196.190.179","192.168.1.118","TLSv1.2","10787","Application Data"
"311","0.606388588","104.196.190.179","192.168.1.118","TCP","1474","443 → 46652 [ACK] Seq=14547 Ack=1248 Win=30720 Len=1420 [TCP segment of a reassembled PDU]"
"312","0.606463900","192.168.1.118","104.196.190.179","TCP","54","46652 → 443 [ACK] Seq=1248 Ack=15967 Win=63104 Len=0"
"313","0.615179625","192.168.1.118","104.196.190.179","TCP","54","46648 → 443 [ACK] Seq=1250 Ack=19600 Win=47744 Len=0"
"314","0.615399563","104.196.190.179","192.168.1.118","TCP","1474","443 → 46652 [ACK] Seq=15967 Ack=1248 Win=30720 Len=1420 [TCP segment of a reassembled PDU]"
"315","0.615441475","104.196.190.179","192.168.1.118","TCP","2894","[TCP segment of a reassembled PDU]"
"316","0.615446488","192.168.1.118","104.196.190.179","TCP","54","46650 → 443 [ACK] Seq=1246 Ack=19600 Win=64128 Len=0"
"317","0.615472250","104.196.190.179","192.168.1.118","TCP","1474","[TCP segment of a reassembled PDU]"
"318","0.615944400","192.168.1.118","104.196.190.179","TCP","54","46650 → 443 [ACK] Seq=1246 Ack=22440 Win=61312 Len=0"
"319","0.616771488","104.196.190.179","192.168.1.118","TLSv1.2","639","Application Data"
"320","0.616827350","192.168.1.118","104.196.190.179","TCP","54","46652 → 443 [ACK] Seq=1248 Ack=17972 Win=63104 Len=0"
"321","0.616927488","23.32.171.112","192.168.1.118","TCP","2962","443 → 43928 [ACK] Seq=20659 Ack=883 Win=31104 Len=2896 TSval=1808567688 TSecr=2039871273 [TCP segment of a reassembled PDU]"
"322","0.616986838","192.168.1.118","23.32.171.112","TCP","66","43928 → 443 [ACK] Seq=883 Ack=23555 Win=61056 Len=0 TSval=2039871368 TSecr=1808567688"
"323","0.617055225","104.196.190.179","192.168.1.118","TCP","1474","443 → 46648 [ACK] Seq=21020 Ack=1250 Win=30720 Len=1420 [TCP segment of a reassembled PDU]"
"324","0.617108913","192.168.1.118","104.196.190.179","TCP","54","46648 → 443 [ACK] Seq=1250 Ack=22440 Win=63104 Len=0"
"325","0.617145963","23.32.171.112","192.168.1.118","TCP","2962","443 → 43928 [ACK] Seq=23555 Ack=883 Win=31104 Len=2896 TSval=1808567697 TSecr=2039871273 [TCP segment of a reassembled PDU]"
"326","0.618149600","23.32.171.112","192.168.1.118","TCP","1514","[TCP Out-Of-Order] 443 → 43930 [ACK] Seq=26451 Ack=883 Win=31104 Len=1448 TSval=1808567721 TSecr=2039871293[Reassembly error, protocol TCP: New fragment overlaps old data (retransmission?)]"
"327","0.618225088","192.168.1.118","23.32.171.112","TCP","78","[TCP Dup ACK 293#1] 43930 → 443 [ACK] Seq=1127 Ack=63408 Win=126464 Len=0 TSval=2039871369 TSecr=1808567674 SLE=26451 SRE=27899"
"328","0.622981838","192.168.1.118","199.232.37.224","TCP","66","[TCP Window Update] 40430 → 443 [ACK] Seq=1370 Ack=67281 Win=58112 Len=0 TSval=1344185240 TSecr=2812562434"
"329","0.623296688","192.168.1.118","23.32.171.112","TCP","66","43928 → 443 [ACK] Seq=883 Ack=26451 Win=64128 Len=0 TSval=2039871374 TSecr=1808567697"
"330","0.640042213","192.168.1.118","199.232.37.224","TCP","66","[TCP Window Update] 40432 → 443 [ACK] Seq=1490 Ack=49471 Win=63104 Len=0 TSval=1344185257 TSecr=2813477596"
"331","0.667507288","199.232.37.224","192.168.1.118","TLSv1.2","1418","Application Data [TCP segment of a reassembled PDU]"
"332","0.667591500","192.168.1.118","199.232.37.224","TCP","66","40430 → 443 [ACK] Seq=1370 Ack=68633 Win=64128 Len=0 TSval=1344185284 TSecr=2812562505"
"333","0.675281738","199.232.37.224","192.168.1.118","TLSv1.2","5474","Application Data, Application Data, Application Data, Application Data"
"334","0.675438613","192.168.1.118","199.232.37.224","TCP","66","40430 → 443 [ACK] Seq=1370 Ack=74041 Win=64128 Len=0 TSval=1344185292 TSecr=2812562505"
"335","0.675679813","199.232.37.224","192.168.1.118","TLSv1.2","5474","Application Data, Application Data, Application Data, Application Data"
"336","0.675771963","192.168.1.118","199.232.37.224","TCP","66","40430 → 443 [ACK] Seq=1370 Ack=79449 Win=64128 Len=0 TSval=1344185292 TSecr=2812562505"
"337","0.678306875","199.232.37.224","192.168.1.118","TLSv1.2","7177","Application Data, Application Data, Application Data, Application Data, Application Data, Application Data"
"338","0.678361738","192.168.1.118","199.232.37.224","TCP","66","40430 → 443 [ACK] Seq=1370 Ack=86560 Win=58112 Len=0 TSval=1344185295 TSecr=2812562505"
"339","0.678404250","23.32.171.112","192.168.1.118","TCP","1514","[TCP segment of a reassembled PDU]"
"340","0.679904825","23.32.171.112","192.168.1.118","TCP","1514","443 → 43926 [ACK] Seq=27277 Ack=1131 Win=32256 Len=1448 TSval=1808567782 TSecr=2039871315 [TCP segment of a reassembled PDU]"
"341","0.681145188","23.32.171.112","192.168.1.118","TCP","11650","443 → 43926 [ACK] Seq=28725 Ack=1131 Win=32256 Len=11584 TSval=1808567782 TSecr=2039871315 [TCP segment of a reassembled PDU]"
"342","0.685821988","192.168.1.118","23.32.171.112","TCP","66","43926 → 443 [ACK] Seq=1131 Ack=40309 Win=64128 Len=0 TSval=2039871436 TSecr=1808567782"
"343","0.686043313","23.32.171.112","192.168.1.118","TLSv1.2","5858","Application Data [TCP segment of a reassembled PDU]"
"344","0.686090650","192.168.1.118","23.32.171.112","TCP","66","43926 → 443 [ACK] Seq=1131 Ack=46101 Win=75776 Len=0 TSval=2039871437 TSecr=1808567782"
"345","0.686112488","23.32.171.112","192.168.1.118","TCP","1514","[TCP segment of a reassembled PDU]"
"346","0.687636250","23.32.171.112","192.168.1.118","TCP","1514","443 → 43924 [ACK] Seq=20290 Ack=1135 Win=32256 Len=1448 TSval=1808567783 TSecr=2039871306 [TCP segment of a reassembled PDU]"
"347","0.687727925","192.168.1.118","23.32.171.112","TCP","66","43924 → 443 [ACK] Seq=1135 Ack=21738 Win=64128 Len=0 TSval=2039871438 TSecr=1808567783"
"348","0.689165863","23.32.171.112","192.168.1.118","TCP","13098","443 → 43924 [ACK] Seq=21738 Ack=1135 Win=32256 Len=13032 TSval=1808567783 TSecr=2039871306 [TCP segment of a reassembled PDU]"
"349","0.691654225","23.32.171.112","192.168.1.118","TLSv1.2","1514","Application Data [TCP segment of a reassembled PDU]"
"350","0.694494313","23.32.171.112","192.168.1.118","TCP","2962","443 → 43924 [ACK] Seq=36218 Ack=1135 Win=32256 Len=2896 TSval=1808567783 TSecr=2039871306 [TCP segment of a reassembled PDU]"
"351","0.696156388","23.32.171.112","192.168.1.118","TLSv1.2","2947","Application Data"
"352","0.696201175","23.32.171.112","192.168.1.118","TCP","2962","443 → 43926 [ACK] Seq=46101 Ack=1131 Win=32256 Len=2896 TSval=1808567782 TSecr=2039871315 [TCP segment of a reassembled PDU]"
"353","0.696234613","192.168.1.118","23.32.171.112","TCP","66","43926 → 443 [ACK] Seq=1131 Ack=48997 Win=81536 Len=0 TSval=2039871447 TSecr=1808567782"
"354","0.697348213","23.32.171.112","192.168.1.118","TLSv1.2","1983","Application Data"
"355","0.697378238","192.168.1.118","23.32.171.112","TCP","66","43926 → 443 [ACK] Seq=1131 Ack=50914 Win=85376 Len=0 TSval=2039871448 TSecr=1808567782"
"356","0.697402513","192.168.1.118","23.32.171.112","TCP","66","43924 → 443 [ACK] Seq=1135 Ack=41995 Win=43904 Len=0 TSval=2039871448 TSecr=1808567783"
"357","0.697424538","23.32.171.112","192.168.1.118","TCP","2962","[TCP segment of a reassembled PDU]"
"358","0.697453325","192.168.1.118","23.32.171.112","TCP","66","43926 → 443 [ACK] Seq=1131 Ack=53810 Win=91136 Len=0 TSval=2039871448 TSecr=1808567785"
"359","0.697472250","23.32.171.112","192.168.1.118","TLSv1.2","1141","Application Data"
"360","0.697537550","23.32.171.112","192.168.1.118","TLSv1.2","5858","Application Data [TCP segment of a reassembled PDU]"
"361","0.697568625","192.168.1.118","23.32.171.112","TCP","66","43928 → 443 [ACK] Seq=883 Ack=32243 Win=75776 Len=0 TSval=2039871448 TSecr=1808567794"
"362","0.697586475","23.32.171.112","192.168.1.118","TCP","1514","443 → 43932 [ACK] Seq=52719 Ack=1136 Win=32256 Len=1448 TSval=1808567794 TSecr=2039871326 [TCP segment of a reassembled PDU]"
"363","0.700015700","23.32.171.112","192.168.1.118","TCP","1514","443 → 43932 [ACK] Seq=54167 Ack=1136 Win=32256 Len=1448 TSval=1808567794 TSecr=2039871326 [TCP segment of a reassembled PDU]"
"364","0.700059138","192.168.1.118","23.32.171.112","TCP","66","43932 → 443 [ACK] Seq=1136 Ack=55615 Win=84480 Len=0 TSval=2039871451 TSecr=1808567794"
"365","0.700085063","23.32.171.112","192.168.1.118","TCP","1514","443 → 43928 [ACK] Seq=32243 Ack=883 Win=31104 Len=1448 TSval=1808567794 TSecr=2039871374 [TCP segment of a reassembled PDU]"
"366","0.701718075","23.32.171.112","192.168.1.118","TCP","4410","443 → 43928 [ACK] Seq=33691 Ack=883 Win=31104 Len=4344 TSval=1808567794 TSecr=2039871374 [TCP segment of a reassembled PDU]"
"367","0.701767775","192.168.1.118","23.32.171.112","TCP","66","43928 → 443 [ACK] Seq=883 Ack=38035 Win=87296 Len=0 TSval=2039871452 TSecr=1808567794"
"368","0.701795338","23.32.171.112","192.168.1.118","TCP","2962","443 → 43932 [ACK] Seq=55615 Ack=1136 Win=32256 Len=2896 TSval=1808567794 TSecr=2039871326 [TCP segment of a reassembled PDU]"
"369","0.701839400","192.168.1.118","23.32.171.112","TCP","66","43932 → 443 [ACK] Seq=1136 Ack=58511 Win=90240 Len=0 TSval=2039871452 TSecr=1808567794"
"370","0.702671638","192.168.1.118","23.32.171.112","TLSv1.2","307","Application Data"
"371","0.702801038","192.168.1.118","23.32.171.112","TLSv1.2","310","Application Data"
"372","0.702994013","23.32.171.112","192.168.1.118","TLSv1.2","855","Application Data"
"373","0.703115863","23.32.171.112","192.168.1.118","TLSv1.2","11650","Application Data [TCP segment of a reassembled PDU]"
"374","0.703160813","192.168.1.118","23.32.171.112","TCP","66","43928 → 443 [ACK] Seq=883 Ack=49619 Win=110464 Len=0 TSval=2039871454 TSecr=1808567794"
"375","0.708070288","192.168.1.118","23.32.171.112","TLSv1.2","310","Application Data"
"376","0.712126263","23.32.171.112","192.168.1.118","TLSv1.2","4410","Application Data [TCP segment of a reassembled PDU]"
"377","0.712184513","192.168.1.118","23.32.171.112","TCP","66","43928 → 443 [ACK] Seq=883 Ack=53963 Win=119168 Len=0 TSval=2039871463 TSecr=1808567794"
"378","0.712220525","104.196.190.179","192.168.1.118","TCP","1474","443 → 46648 [ACK] Seq=22440 Ack=1250 Win=30720 Len=1420 [TCP segment of a reassembled PDU]"
"379","0.713786000","23.32.171.112","192.168.1.118","TCP","2962","443 → 43928 [ACK] Seq=53963 Ack=883 Win=31104 Len=2896 TSval=1808567794 TSecr=2039871374 [TCP segment of a reassembled PDU]"
"380","0.713846013","192.168.1.118","23.32.171.112","TCP","66","43928 → 443 [ACK] Seq=883 Ack=56859 Win=124928 Len=0 TSval=2039871464 TSecr=1808567794"
"381","0.713884200","23.32.171.112","192.168.1.118","TCP","1514","[TCP segment of a reassembled PDU]"
"382","0.713957500","192.168.1.118","23.32.171.112","TCP","66","43930 → 443 [ACK] Seq=1127 Ack=64856 Win=129408 Len=0 TSval=2039871465 TSecr=1808567795"
"383","0.714992050","23.32.171.112","192.168.1.118","TCP","11650","443 → 43930 [ACK] Seq=64856 Ack=1127 Win=32256 Len=11584 TSval=1808567795 TSecr=2039871351 [TCP segment of a reassembled PDU]"
"384","0.715059888","192.168.1.118","23.32.171.112","TCP","66","43930 → 443 [ACK] Seq=1127 Ack=76440 Win=152576 Len=0 TSval=2039871466 TSecr=1808567795"
"385","0.721512200","23.32.171.112","192.168.1.118","TLSv1.2","5858","Application Data [TCP segment of a reassembled PDU]"
"386","0.721587025","192.168.1.118","23.32.171.112","TCP","66","43930 → 443 [ACK] Seq=1127 Ack=82232 Win=164096 Len=0 TSval=2039871472 TSecr=1808567795"
"387","0.723174463","23.32.171.112","192.168.1.118","TCP","4410","443 → 43930 [ACK] Seq=82232 Ack=1127 Win=32256 Len=4344 TSval=1808567795 TSecr=2039871351 [TCP segment of a reassembled PDU]"
"388","0.723239088","192.168.1.118","23.32.171.112","TCP","66","43930 → 443 [ACK] Seq=1127 Ack=86576 Win=172800 Len=0 TSval=2039871474 TSecr=1808567795"
"389","0.723996563","104.196.190.179","192.168.1.118","TCP","639","[TCP Spurious Retransmission] 443 → 46652 [PSH, ACK] Seq=17387 Ack=1248 Win=30720 Len=585[Reassembly error, protocol TCP: New fragment overlaps old data (retransmission?)]"
"390","0.724065175","192.168.1.118","104.196.190.179","TCP","66","[TCP Window Update] 46652 → 443 [ACK] Seq=1248 Ack=17972 Win=64128 Len=0 SLE=17387 SRE=17972"
"391","0.724186625","23.32.171.112","192.168.1.118","TLSv1.2","2962","Application Data [TCP segment of a reassembled PDU]"
"392","0.724251500","192.168.1.118","23.32.171.112","TCP","66","43930 → 443 [ACK] Seq=1127 Ack=89472 Win=171520 Len=0 TSval=2039871475 TSecr=1808567795"
"393","0.724292763","23.32.171.112","192.168.1.118","TLSv1.2","834","Application Data"
"394","0.724380038","192.168.1.118","23.32.171.112","TCP","66","43930 → 443 [ACK] Seq=1127 Ack=90240 Win=170752 Len=0 TSval=2039871475 TSecr=1808567799"
"395","0.724451125","104.196.190.179","192.168.1.118","TLSv1.2","1859","Application Data"
"396","0.724581475","104.196.190.179","192.168.1.118","TCP","4314","443 → 46648 [ACK] Seq=23860 Ack=1250 Win=30720 Len=4260 [TCP segment of a reassembled PDU]"
"397","0.725404888","192.168.1.118","104.196.190.179","TCP","54","46648 → 443 [ACK] Seq=1250 Ack=28120 Win=64128 Len=0"
"398","0.725483663","192.168.1.118","104.196.190.179","TCP","54","46650 → 443 [ACK] Seq=1246 Ack=24245 Win=64128 Len=0"
"399","0.727437825","104.196.190.179","192.168.1.118","TCP","1474","443 → 46648 [ACK] Seq=28120 Ack=1250 Win=30720 Len=1420 [TCP segment of a reassembled PDU]"
"400","0.728832700","192.168.1.118","23.32.171.112","TLSv1.2","310","Application Data"
"401","0.729125888","104.196.190.179","192.168.1.118","TCP","2894","443 → 46648 [ACK] Seq=29540 Ack=1250 Win=30720 Len=2840 [TCP segment of a reassembled PDU]"
"402","0.732572800","192.168.1.118","104.196.190.179","TCP","54","46648 → 443 [ACK] Seq=1250 Ack=32380 Win=64128 Len=0"
"403","0.732809238","104.196.190.179","192.168.1.118","TLSv1.2","5734","Application Data [TCP segment of a reassembled PDU]"
"404","0.733304563","104.196.190.179","192.168.1.118","TCP","14254","443 → 46648 [ACK] Seq=38060 Ack=1250 Win=30720 Len=14200 [TCP segment of a reassembled PDU]"
"405","0.735275588","192.168.1.118","104.196.190.179","TCP","54","46648 → 443 [ACK] Seq=1250 Ack=52260 Win=44288 Len=0"
"406","0.735503988","104.196.190.179","192.168.1.118","TLSv1.2","5734","Application Data [TCP segment of a reassembled PDU]"
"407","0.735589738","192.168.1.118","104.196.190.179","TCP","54","46648 → 443 [ACK] Seq=1250 Ack=57940 Win=56960 Len=0"
"408","0.739317738","104.196.190.179","192.168.1.118","TCP","2894","443 → 46648 [ACK] Seq=57940 Ack=1250 Win=30720 Len=2840 [TCP segment of a reassembled PDU]"
"409","0.739420200","192.168.1.118","104.196.190.179","TCP","54","46648 → 443 [ACK] Seq=1250 Ack=60780 Win=61056 Len=0"
"410","0.739470313","23.32.171.112","192.168.1.118","TCP","2962","443 → 43928 [ACK] Seq=56859 Ack=883 Win=31104 Len=2896 TSval=1808567845 TSecr=2039871464 [TCP segment of a reassembled PDU]"
"411","0.739544075","192.168.1.118","23.32.171.112","TCP","66","43928 → 443 [ACK] Seq=883 Ack=59755 Win=130816 Len=0 TSval=2039871490 TSecr=1808567845"
"412","0.739756825","23.32.171.112","192.168.1.118","TLSv1.2","5472","Application Data"
"413","0.739837263","192.168.1.118","23.32.171.112","TCP","66","43928 → 443 [ACK] Seq=883 Ack=65161 Win=141568 Len=0 TSval=2039871490 TSecr=1808567845"
"414","0.739990738","23.32.171.112","192.168.1.118","TCP","2962","[TCP segment of a reassembled PDU]"
"415","0.740085588","192.168.1.118","23.32.171.112","TCP","66","43926 → 443 [ACK] Seq=1375 Ack=57781 Win=99840 Len=0 TSval=2039871491 TSecr=1808567846"
"416","0.740132388","23.32.171.112","192.168.1.118","TCP","2962","[TCP segment of a reassembled PDU]"
"417","0.740719963","192.168.1.118","23.32.171.112","TCP","66","43924 → 443 [ACK] Seq=1376 Ack=44891 Win=64128 Len=0 TSval=2039871491 TSecr=1808567846"
"418","0.741973600","23.32.171.112","192.168.1.118","TCP","1514","[TCP segment of a reassembled PDU]"
"419","0.743559188","192.168.1.118","23.32.171.112","TLSv1.2","317","Application Data"
"420","0.743818113","23.32.171.112","192.168.1.118","TCP","2962","443 → 43932 [ACK] Seq=60748 Ack=1380 Win=33280 Len=2896 TSval=1808567846 TSecr=2039871459 [TCP segment of a reassembled PDU]"
"421","0.743877488","192.168.1.118","23.32.171.112","TCP","66","43932 → 443 [ACK] Seq=1380 Ack=63644 Win=101760 Len=0 TSval=2039871495 TSecr=1808567846"
"422","0.743915325","23.32.171.112","192.168.1.118","TCP","2962","443 → 43924 [ACK] Seq=44891 Ack=1376 Win=33280 Len=2896 TSval=1808567846 TSecr=2039871453 [TCP segment of a reassembled PDU]"
"423","0.743970238","192.168.1.118","23.32.171.112","TCP","66","43924 → 443 [ACK] Seq=1376 Ack=47787 Win=69888 Len=0 TSval=2039871495 TSecr=1808567846"
"424","0.744005438","23.32.171.112","192.168.1.118","TCP","2962","443 → 43926 [ACK] Seq=57781 Ack=1375 Win=33280 Len=2896 TSval=1808567846 TSecr=2039871453 [TCP segment of a reassembled PDU]"
"425","0.744060125","192.168.1.118","23.32.171.112","TCP","66","43926 → 443 [ACK] Seq=1375 Ack=60677 Win=105600 Len=0 TSval=2039871495 TSecr=1808567846"
"426","0.745129875","23.32.171.112","192.168.1.118","TCP","4410","443 → 43932 [ACK] Seq=63644 Ack=1380 Win=33280 Len=4344 TSval=1808567846 TSecr=2039871459 [TCP segment of a reassembled PDU]"
"427","0.745188088","192.168.1.118","23.32.171.112","TCP","66","43932 → 443 [ACK] Seq=1380 Ack=67988 Win=110464 Len=0 TSval=2039871496 TSecr=1808567846"
"428","0.745225700","23.32.171.112","192.168.1.118","TCP","2962","443 → 43924 [ACK] Seq=47787 Ack=1376 Win=33280 Len=2896 TSval=1808567846 TSecr=2039871453 [TCP segment of a reassembled PDU]"
"429","0.745287238","192.168.1.118","23.32.171.112","TCP","66","43924 → 443 [ACK] Seq=1376 Ack=50683 Win=75776 Len=0 TSval=2039871496 TSecr=1808567846"
"430","0.745322425","23.32.171.112","192.168.1.118","TCP","2962","443 → 43926 [ACK] Seq=60677 Ack=1375 Win=33280 Len=2896 TSval=1808567846 TSecr=2039871453 [TCP segment of a reassembled PDU]"
"431","0.745403175","192.168.1.118","23.32.171.112","TCP","66","43926 → 443 [ACK] Seq=1375 Ack=63573 Win=111488 Len=0 TSval=2039871496 TSecr=1808567846"
"432","0.748858963","23.32.171.112","192.168.1.118","TCP","2962","443 → 43926 [ACK] Seq=63573 Ack=1375 Win=33280 Len=2896 TSval=1808567848 TSecr=2039871453 [TCP segment of a reassembled PDU]"
"433","0.748916763","192.168.1.118","23.32.171.112","TCP","66","43926 → 443 [ACK] Seq=1375 Ack=66469 Win=117248 Len=0 TSval=2039871500 TSecr=1808567848"
"434","0.748952888","23.32.171.112","192.168.1.118","TCP","2962","443 → 43924 [ACK] Seq=50683 Ack=1376 Win=33280 Len=2896 TSval=1808567846 TSecr=2039871453 [TCP segment of a reassembled PDU]"
"435","0.749007263","192.168.1.118","23.32.171.112","TCP","66","43924 → 443 [ACK] Seq=1376 Ack=53579 Win=81536 Len=0 TSval=2039871500 TSecr=1808567846"
"436","0.749147388","23.32.171.112","192.168.1.118","TCP","2962","443 → 43932 [ACK] Seq=67988 Ack=1380 Win=33280 Len=2896 TSval=1808567848 TSecr=2039871459 [TCP segment of a reassembled PDU]"
"437","0.749203925","192.168.1.118","23.32.171.112","TCP","66","43932 → 443 [ACK] Seq=1380 Ack=70884 Win=116224 Len=0 TSval=2039871500 TSecr=1808567848"
"438","0.750822363","23.32.171.112","192.168.1.118","TCP","2962","443 → 43926 [ACK] Seq=66469 Ack=1375 Win=33280 Len=2896 TSval=1808567851 TSecr=2039871453 [TCP segment of a reassembled PDU]"
"439","0.750880763","192.168.1.118","23.32.171.112","TCP","66","43926 → 443 [ACK] Seq=1375 Ack=69365 Win=123008 Len=0 TSval=2039871502 TSecr=1808567851"
"440","0.752065463","23.32.171.112","192.168.1.118","TCP","2962","443 → 43924 [ACK] Seq=53579 Ack=1376 Win=33280 Len=2896 TSval=1808567851 TSecr=2039871453 [TCP segment of a reassembled PDU]"
"441","0.752123863","192.168.1.118","23.32.171.112","TCP","66","43924 → 443 [ACK] Seq=1376 Ack=56475 Win=87296 Len=0 TSval=2039871503 TSecr=1808567851"
"442","0.753075475","23.32.171.112","192.168.1.118","TCP","2962","443 → 43932 [ACK] Seq=70884 Ack=1380 Win=33280 Len=2896 TSval=1808567856 TSecr=2039871459 [TCP segment of a reassembled PDU]"
"443","0.753132625","192.168.1.118","23.32.171.112","TCP","66","43932 → 443 [ACK] Seq=1380 Ack=73780 Win=122112 Len=0 TSval=2039871504 TSecr=1808567856"
"444","0.755571925","23.32.171.112","192.168.1.118","TCP","1514","443 → 43926 [ACK] Seq=69365 Ack=1375 Win=33280 Len=1448 TSval=1808567855 TSecr=2039871453 [TCP segment of a reassembled PDU]"
"445","0.757005600","23.32.171.112","192.168.1.118","TLSv1.2","1514","Application Data [TCP segment of a reassembled PDU]"
"446","0.757055713","192.168.1.118","23.32.171.112","TCP","66","43926 → 443 [ACK] Seq=1375 Ack=72261 Win=128768 Len=0 TSval=2039871508 TSecr=1808567855"
"447","0.757088763","23.32.171.112","192.168.1.118","TCP","1514","443 → 43932 [ACK] Seq=73780 Ack=1380 Win=33280 Len=1448 TSval=1808567856 TSecr=2039871459 [TCP segment of a reassembled PDU]"
"448","0.758917625","23.32.171.112","192.168.1.118","TLSv1.2","1514","Application Data [TCP segment of a reassembled PDU]"
"449","0.758968550","192.168.1.118","23.32.171.112","TCP","66","43932 → 443 [ACK] Seq=1380 Ack=76676 Win=127872 Len=0 TSval=2039871510 TSecr=1808567856"
"450","0.759003138","23.32.171.112","192.168.1.118","TCP","1514","443 → 43924 [ACK] Seq=56475 Ack=1376 Win=33280 Len=1448 TSval=1808567855 TSecr=2039871453 [TCP segment of a reassembled PDU]"
"451","0.769207838","23.32.171.112","192.168.1.118","TLSv1.2","1514","Application Data [TCP segment of a reassembled PDU]"
"452","0.769272525","192.168.1.118","23.32.171.112","TCP","66","43924 → 443 [ACK] Seq=1376 Ack=59371 Win=93056 Len=0 TSval=2039871520 TSecr=1808567855"
"453","0.769315313","23.32.171.112","192.168.1.118","TCP","1514","443 → 43926 [ACK] Seq=72261 Ack=1375 Win=33280 Len=1448 TSval=1808567859 TSecr=2039871453 [TCP segment of a reassembled PDU]"
"454","0.770392675","23.32.171.112","192.168.1.118","TCP","1514","443 → 43926 [ACK] Seq=73709 Ack=1375 Win=33280 Len=1448 TSval=1808567859 TSecr=2039871453 [TCP segment of a reassembled PDU]"
"455","0.770458213","192.168.1.118","23.32.171.112","TCP","66","43926 → 443 [ACK] Seq=1375 Ack=75157 Win=134656 Len=0 TSval=2039871521 TSecr=1808567859"
"456","0.770500188","23.32.171.112","192.168.1.118","TCP","1514","443 → 43932 [ACK] Seq=76676 Ack=1380 Win=33280 Len=1448 TSval=1808567860 TSecr=2039871459 [TCP segment of a reassembled PDU]"
"457","0.777610850","23.32.171.112","192.168.1.118","TCP","1514","443 → 43932 [ACK] Seq=78124 Ack=1380 Win=33280 Len=1448 TSval=1808567860 TSecr=2039871459 [TCP segment of a reassembled PDU]"
"458","0.777675750","192.168.1.118","23.32.171.112","TCP","66","43932 → 443 [ACK] Seq=1380 Ack=79572 Win=133632 Len=0 TSval=2039871528 TSecr=1808567860"
"459","0.777719863","23.32.171.112","192.168.1.118","TCP","2962","443 → 43924 [ACK] Seq=59371 Ack=1376 Win=33280 Len=2896 TSval=1808567860 TSecr=2039871453 [TCP segment of a reassembled PDU]"
"460","0.777805263","192.168.1.118","23.32.171.112","TCP","66","43924 → 443 [ACK] Seq=1376 Ack=62267 Win=98944 Len=0 TSval=2039871528 TSecr=1808567860"
"461","0.777845200","23.32.171.112","192.168.1.118","TCP","1514","443 → 43926 [ACK] Seq=75157 Ack=1375 Win=33280 Len=1448 TSval=1808567862 TSecr=2039871453 [TCP segment of a reassembled PDU]"
"462","0.779302163","23.32.171.112","192.168.1.118","TCP","1514","443 → 43926 [ACK] Seq=76605 Ack=1375 Win=33280 Len=1448 TSval=1808567862 TSecr=2039871453 [TCP segment of a reassembled PDU]"
"463","0.779374400","192.168.1.118","23.32.171.112","TCP","66","43926 → 443 [ACK] Seq=1375 Ack=78053 Win=140416 Len=0 TSval=2039871530 TSecr=1808567862"
"464","0.779408188","104.196.190.179","192.168.1.118","TCP","4314","443 → 46648 [ACK] Seq=60780 Ack=1250 Win=30720 Len=4260 [TCP segment of a reassembled PDU]"
"465","0.779441538","23.32.171.112","192.168.1.118","TCP","2962","443 → 43932 [ACK] Seq=79572 Ack=1380 Win=33280 Len=2896 TSval=1808567864 TSecr=2039871459 [TCP segment of a reassembled PDU]"
"466","0.779482288","192.168.1.118","23.32.171.112","TCP","66","43932 → 443 [ACK] Seq=1380 Ack=82468 Win=139392 Len=0 TSval=2039871530 TSecr=1808567864"
"467","0.779652300","104.196.190.179","192.168.1.118","TCP","1474","443 → 46648 [ACK] Seq=65040 Ack=1250 Win=30720 Len=1420 [TCP segment of a reassembled PDU]"
"468","0.779683650","23.32.171.112","192.168.1.118","TLSv1.2","2962","Application Data [TCP segment of a reassembled PDU]"
"469","0.779710275","23.32.171.112","192.168.1.118","TCP","2962","443 → 43924 [ACK] Seq=62267 Ack=1376 Win=33280 Len=2896 TSval=1808567864 TSecr=2039871453 [TCP segment of a reassembled PDU]"
"470","0.779748888","192.168.1.118","23.32.171.112","TCP","66","43924 → 443 [ACK] Seq=1376 Ack=65163 Win=104704 Len=0 TSval=2039871530 TSecr=1808567864"
"471","0.779776400","23.32.171.112","192.168.1.118","TCP","1514","443 → 43932 [ACK] Seq=82468 Ack=1380 Win=33280 Len=1448 TSval=1808567868 TSecr=2039871459 [TCP segment of a reassembled PDU]"
"472","0.781211438","192.168.1.118","104.196.190.179","TCP","54","46648 → 443 [ACK] Seq=1250 Ack=66460 Win=64128 Len=0"
"473","0.781323888","192.168.1.118","23.32.171.112","TCP","66","43926 → 443 [ACK] Seq=1375 Ack=80949 Win=138880 Len=0 TSval=2039871532 TSecr=1808567866"
"474","0.784947875","23.32.171.112","192.168.1.118","TLSv1.2","151","Application Data"
"475","0.785041750","23.32.171.112","192.168.1.118","TLSv1.2","1514","Application Data [TCP segment of a reassembled PDU]"
"476","0.785094088","192.168.1.118","23.32.171.112","TCP","66","43932 → 443 [ACK] Seq=1380 Ack=85364 Win=145280 Len=0 TSval=2039871536 TSecr=1808567868"
"477","0.785132200","23.32.171.112","192.168.1.118","TLSv1.2","2962","Application Data [TCP segment of a reassembled PDU]"
"478","0.785176525","192.168.1.118","23.32.171.112","TCP","66","43924 → 443 [ACK] Seq=1376 Ack=68059 Win=110464 Len=0 TSval=2039871536 TSecr=1808567869"
"479","0.785204125","23.32.171.112","192.168.1.118","TCP","1514","[TCP segment of a reassembled PDU]"
"480","0.786661513","23.32.171.112","192.168.1.118","TCP","1514","443 → 43928 [ACK] Seq=66609 Ack=1134 Win=32256 Len=1448 TSval=1808567879 TSecr=2039871494 [TCP segment of a reassembled PDU]"
"481","0.786708325","192.168.1.118","23.32.171.112","TCP","66","43928 → 443 [ACK] Seq=1134 Ack=68057 Win=147328 Len=0 TSval=2039871537 TSecr=1808567879"
"482","0.786738275","23.32.171.112","192.168.1.118","TCP","2962","443 → 43932 [ACK] Seq=85364 Ack=1380 Win=33280 Len=2896 TSval=1808567872 TSecr=2039871459 [TCP segment of a reassembled PDU]"
"483","0.786781638","192.168.1.118","23.32.171.112","TCP","66","43932 → 443 [ACK] Seq=1380 Ack=88260 Win=151040 Len=0 TSval=2039871537 TSecr=1808567872"
"484","0.786808800","23.32.171.112","192.168.1.118","TCP","2962","[TCP segment of a reassembled PDU]"
"485","0.786863825","192.168.1.118","23.32.171.112","TCP","66","43930 → 443 [ACK] Seq=1371 Ack=93136 Win=177664 Len=0 TSval=2039871537 TSecr=1808567881"
"486","0.786891675","23.32.171.112","192.168.1.118","TCP","2962","443 → 43924 [ACK] Seq=68059 Ack=1376 Win=33280 Len=2896 TSval=1808567873 TSecr=2039871453 [TCP segment of a reassembled PDU]"
"487","0.786934663","192.168.1.118","23.32.171.112","TCP","66","43924 → 443 [ACK] Seq=1376 Ack=70955 Win=116224 Len=0 TSval=2039871538 TSecr=1808567873"
"488","0.787080313","23.32.171.112","192.168.1.118","TCP","2962","443 → 43928 [ACK] Seq=68057 Ack=1134 Win=32256 Len=2896 TSval=1808567879 TSecr=2039871494 [TCP segment of a reassembled PDU]"
"489","0.787126363","192.168.1.118","23.32.171.112","TCP","66","43928 → 443 [ACK] Seq=1134 Ack=70953 Win=153088 Len=0 TSval=2039871538 TSecr=1808567879"
"490","0.787159325","23.32.171.112","192.168.1.118","TCP","2962","443 → 43930 [ACK] Seq=93136 Ack=1371 Win=33280 Len=2896 TSval=1808567881 TSecr=2039871479 [TCP segment of a reassembled PDU]"
"491","0.787774075","192.168.1.118","23.32.171.112","TCP","66","43930 → 443 [ACK] Seq=1371 Ack=96032 Win=174848 Len=0 TSval=2039871538 TSecr=1808567881"
"492","0.791142538","23.32.171.112","192.168.1.118","TCP","2962","443 → 43932 [ACK] Seq=88260 Ack=1380 Win=33280 Len=2896 TSval=1808567876 TSecr=2039871459 [TCP segment of a reassembled PDU]"
"493","0.791190613","192.168.1.118","23.32.171.112","TCP","66","43932 → 443 [ACK] Seq=1380 Ack=91156 Win=156800 Len=0 TSval=2039871542 TSecr=1808567876"
"494","0.791213325","23.32.171.112","192.168.1.118","TCP","1514","443 → 43924 [ACK] Seq=70955 Ack=1376 Win=33280 Len=1448 TSval=1808567878 TSecr=2039871503 [TCP segment of a reassembled PDU]"
"495","0.791232938","23.32.171.112","192.168.1.118","TCP","1514","443 → 43930 [ACK] Seq=96032 Ack=1371 Win=33280 Len=1448 TSval=1808567881 TSecr=2039871479 [TCP segment of a reassembled PDU]"
"496","0.792829038","23.32.171.112","192.168.1.118","TCP","1514","443 → 43930 [ACK] Seq=97480 Ack=1371 Win=33280 Len=1448 TSval=1808567881 TSecr=2039871479 [TCP segment of a reassembled PDU]"
"497","0.792863413","192.168.1.118","23.32.171.112","TCP","66","43930 → 443 [ACK] Seq=1371 Ack=98928 Win=179712 Len=0 TSval=2039871544 TSecr=1808567881"
"498","0.792884725","23.32.171.112","192.168.1.118","TCP","2962","443 → 43932 [ACK] Seq=91156 Ack=1380 Win=33280 Len=2896 TSval=1808567880 TSecr=2039871504 [TCP segment of a reassembled PDU]"
"499","0.792916288","192.168.1.118","23.32.171.112","TCP","66","43932 → 443 [ACK] Seq=1380 Ack=94052 Win=162560 Len=0 TSval=2039871544 TSecr=1808567880"
"500","0.792936288","23.32.171.112","192.168.1.118","TCP","2962","443 → 43928 [ACK] Seq=70953 Ack=1134 Win=32256 Len=2896 TSval=1808567879 TSecr=2039871494 [TCP segment of a reassembled PDU]"
"501","0.792968250","192.168.1.118","23.32.171.112","TCP","66","43928 → 443 [ACK] Seq=1134 Ack=73849 Win=158848 Len=0 TSval=2039871544 TSecr=1808567879"
"502","0.792988013","23.32.171.112","192.168.1.118","TCP","2962","443 → 43924 [ACK] Seq=72403 Ack=1376 Win=33280 Len=2896 TSval=1808567878 TSecr=2039871503 [TCP segment of a reassembled PDU]"
"503","0.793022538","192.168.1.118","23.32.171.112","TCP","66","43924 → 443 [ACK] Seq=1376 Ack=75299 Win=124928 Len=0 TSval=2039871544 TSecr=1808567878"
"504","0.793127575","23.32.171.112","192.168.1.118","TLSv1.2","2024","Application Data"
"505","0.793165275","23.32.171.112","192.168.1.118","TCP","2962","443 → 43930 [ACK] Seq=98928 Ack=1371 Win=33280 Len=2896 TSval=1808567882 TSecr=2039871479 [TCP segment of a reassembled PDU]"
"506","0.793190063","23.32.171.112","192.168.1.118","TCP","1514","443 → 43930 [ACK] Seq=101824 Ack=1371 Win=33280 Len=1448 TSval=1808567885 TSecr=2039871479 [TCP segment of a reassembled PDU]"
"507","0.793788038","192.168.1.118","23.32.171.112","TCP","66","43932 → 443 [ACK] Seq=1380 Ack=96010 Win=162560 Len=0 TSval=2039871544 TSecr=1808567883"
"508","0.793992488","192.168.1.118","23.32.171.112","TCP","66","43930 → 443 [ACK] Seq=1371 Ack=103272 Win=179712 Len=0 TSval=2039871545 TSecr=1808567882"
"509","0.795940413","23.32.171.112","192.168.1.118","TLSv1.2","1378","Application Data"
"510","0.795984625","23.32.171.112","192.168.1.118","TCP","1514","443 → 43930 [ACK] Seq=103272 Ack=1371 Win=33280 Len=1448 TSval=1808567885 TSecr=2039871479 [TCP segment of a reassembled PDU]"
"511","0.796004325","23.32.171.112","192.168.1.118","TCP","1514","443 → 43928 [ACK] Seq=73849 Ack=1134 Win=32256 Len=1448 TSval=1808567882 TSecr=2039871494 [TCP segment of a reassembled PDU]"
"512","0.798490263","23.32.171.112","192.168.1.118","TCP","1514","443 → 43928 [ACK] Seq=75297 Ack=1134 Win=32256 Len=1448 TSval=1808567882 TSecr=2039871494 [TCP segment of a reassembled PDU]"
"513","0.798523500","192.168.1.118","23.32.171.112","TCP","66","43928 → 443 [ACK] Seq=1134 Ack=76745 Win=164736 Len=0 TSval=2039871549 TSecr=1808567882"
"514","0.798546400","104.196.190.179","192.168.1.118","TCP","1474","443 → 46648 [ACK] Seq=66460 Ack=1250 Win=30720 Len=1420 [TCP segment of a reassembled PDU]"
"515","0.800201038","23.32.171.112","192.168.1.118","TLSv1.2","2962","Application Data [TCP segment of a reassembled PDU]"
"516","0.800240713","104.196.190.179","192.168.1.118","TLSv1.2","4314","Application Data [TCP segment of a reassembled PDU]"
"517","0.800276025","192.168.1.118","104.196.190.179","TCP","54","46648 → 443 [ACK] Seq=1250 Ack=72140 Win=75520 Len=0"
"518","0.800300213","23.32.171.112","192.168.1.118","TCP","2962","443 → 43930 [ACK] Seq=107616 Ack=1371 Win=33280 Len=2896 TSval=1808567891 TSecr=2039871479 [TCP segment of a reassembled PDU]"
"519","0.800408300","23.32.171.112","192.168.1.118","TLSv1.2","2250","Application Data"
"520","0.800440900","192.168.1.118","23.32.171.112","TCP","66","43928 → 443 [ACK] Seq=1134 Ack=78929 Win=169088 Len=0 TSval=2039871551 TSecr=1808567887"
"521","0.800501363","104.196.190.179","192.168.1.118","TCP","4314","443 → 46648 [ACK] Seq=72140 Ack=1250 Win=30720 Len=4260 [TCP segment of a reassembled PDU]"
"522","0.800538650","192.168.1.118","104.196.190.179","TCP","54","46648 → 443 [ACK] Seq=1250 Ack=76400 Win=83968 Len=0"
"523","0.800559188","23.32.171.112","192.168.1.118","TCP","2962","443 → 43930 [ACK] Seq=110512 Ack=1371 Win=33280 Len=2896 TSval=1808567894 TSecr=2039871479 [TCP segment of a reassembled PDU]"
"524","0.800803763","192.168.1.118","23.32.171.112","TCP","66","43930 → 443 [ACK] Seq=1371 Ack=113408 Win=169600 Len=0 TSval=2039871551 TSecr=1808567885"
"525","0.805135013","23.32.171.112","192.168.1.118","TLSv1.2","2732","Application Data, Application Data"
"526","0.805190188","192.168.1.118","23.32.171.112","TCP","66","43930 → 443 [ACK] Seq=1371 Ack=116074 Win=177664 Len=0 TSval=2039871556 TSecr=1808567897"
"527","0.805255738","104.196.190.179","192.168.1.118","TCP","2894","443 → 46648 [ACK] Seq=76400 Ack=1250 Win=30720 Len=2840 [TCP segment of a reassembled PDU]"
"528","0.805301275","192.168.1.118","104.196.190.179","TCP","54","46648 → 443 [ACK] Seq=1250 Ack=79240 Win=89728 Len=0"
"529","0.805416463","104.196.190.179","192.168.1.118","TLSv1.2","1255","Application Data"
"530","0.825434600","192.168.1.118","23.32.171.112","TCP","66","43926 → 443 [ACK] Seq=1375 Ack=81034 Win=140416 Len=0 TSval=2039871576 TSecr=1808567873"
"531","0.836419938","192.168.1.118","23.32.171.112","TCP","66","43924 → 443 [ACK] Seq=1376 Ack=76611 Win=127872 Len=0 TSval=2039871587 TSecr=1808567885"
"532","0.846357475","192.168.1.118","104.196.190.179","TCP","54","46648 → 443 [ACK] Seq=1250 Ack=80441 Win=92544 Len=0"
"533","2.049291963","192.168.1.104","255.255.255.255","UDP","217","49154 → 6666 Len=175"
"534","2.559594900","192.168.1.118","142.250.31.188","TCP","66","34334 → 443 [ACK] Seq=1 Ack=1 Win=501 Len=0 TSval=3106720882 TSecr=409761803"
"535","2.584903013","142.250.31.188","192.168.1.118","TCP","66","[TCP ACKed unseen segment] 443 → 34334 [ACK] Seq=1 Ack=2 Win=253 Len=0 TSval=409806862 TSecr=3106540214"
"536","4.125175188","IntelCor_b7:52:73","Broadcast","ARP","60","Who has 192.168.1.1? Tell 192.168.1.118"
"537","4.140094588","Cisco-Li_5b:1c:ce","IntelCor_b7:52:73","ARP","42","192.168.1.1 is at 58:6d:8f:5b:1c:ce"
"538","5.019213675","192.168.1.104","255.255.255.255","UDP","217","49154 → 6666 Len=175"
"539","5.533589038","192.168.1.118","192.168.1.102","TCP","176","44768 → 8009 [PSH, ACK] Seq=111 Ack=111 Win=501 Len=110 TSval=2259133960 TSecr=5365600 [TCP segment of a reassembled PDU]"
"540","5.537970550","192.168.1.100","224.0.0.251","MDNS","414","Standard query 0x0000 PTR _googlecast._tcp.local, "QM" question PTR _homekit._tcp.local, "QM" question PTR _uscan._tcp.local, "QM" question PTR _ptp._tcp.local, "QM" question PTR _ippusb._tcp.local, "QM" question PTR _scanner._tcp.local, "QM" question PTR _ipp._tcp.local, "QM" question PTR _pdl-datastream._tcp.local, "QM" question PTR _uscans._tcp.local, "QM" question PTR _ipps._tcp.local, "QM" question PTR _printer._tcp.local, "QM" question PTR _airplay._tcp.local, "QM" question PTR _raop._tcp.local, "QM" question PTR _airport._tcp.local, "QM" question PTR _companion-link._tcp.local, "QM" question PTR _rdlink._tcp.local, "QM" question TXT Google-Home-Mini-2c3f16b2da5c4b6fd6cfbfba61c12490._googlecast._tcp.local, "QM" question PTR Google-Home-Mini-2c3f16b2da5c4b6fd6cfbfba61c12490._googlecast._tcp.local PTR cjqg._companion-link._tcp.local OPT"
"541","5.543374938","192.168.1.102","192.168.1.118","TCP","176","8009 → 44768 [PSH, ACK] Seq=111 Ack=221 Win=294 Len=110 TSval=5366103 TSecr=2259133960 [TCP segment of a reassembled PDU]"
"542","5.543517150","192.168.1.118","192.168.1.102","TCP","66","44768 → 8009 [ACK] Seq=221 Ack=221 Win=501 Len=0 TSval=2259133970 TSecr=5366103"
"543","5.633241250","192.168.1.102","224.0.0.251","MDNS","183","Standard query response 0x0000 SRV, cache flush 0 0 8009 2c3f16b2-da5c-4b6f-d6cf-bfba61c12490.local"
"544","7.989648800","192.168.1.104","255.255.255.255","UDP","217","49154 → 6666 Len=175"
