frame.number,_ws.col.Time,_ws.col.Source,_ws.col.Destination,_ws.col.Protocol,frame.len,_ws.col.Info
"1","0.000000000","192.168.1.118","192.168.1.102","TCP","176","44768 → 8009 [PSH, ACK] Seq=1 Ack=1 Win=501 Len=110 TSval=2258827776 TSecr=5334982 [TCP segment of a reassembled PDU]"
"2","0.011541737","192.168.1.102","192.168.1.118","TCP","176","8009 → 44768 [PSH, ACK] Seq=1 Ack=111 Win=294 Len=110 TSval=5335484 TSecr=2258827776 [TCP segment of a reassembled PDU]"
"3","0.011649212","192.168.1.118","192.168.1.102","TCP","66","44768 → 8009 [ACK] Seq=111 Ack=111 Win=501 Len=0 TSval=2258827787 TSecr=5335484"
"4","0.312487850","172.217.10.142","192.168.1.118","TLSv1.2","1484","Application Data"
"5","0.313187025","172.217.10.142","192.168.1.118","TLSv1.2","1484","Application Data"
"6","0.313302162","192.168.1.118","172.217.10.142","TCP","66","42240 → 443 [ACK] Seq=1 Ack=2837 Win=493 Len=0 TSval=3606880871 TSecr=923369667"
"7","0.314164812","172.217.10.142","192.168.1.118","TLSv1.2","1484","Application Data"
"8","0.317396900","172.217.10.142","192.168.1.118","TLSv1.2","2902","Application Data, Application Data"
"9","0.317575375","172.217.10.142","192.168.1.118","TLSv1.2","2902","Application Data, Application Data"
"10","0.317689912","172.217.10.142","192.168.1.118","TLSv1.2","2902","Application Data, Application Data"
"11","0.317796925","172.217.10.142","192.168.1.118","TLSv1.2","2902","Application Data, Application Data"
"12","0.317907662","172.217.10.142","192.168.1.118","TLSv1.2","2902","Application Data, Application Data"
"13","0.318105100","192.168.1.118","172.217.10.142","TCP","66","42240 → 443 [ACK] Seq=1 Ack=18435 Win=372 Len=0 TSval=3606880876 TSecr=923369667"
"14","0.318223862","172.217.10.142","192.168.1.118","TLSv1.2","2902","Application Data, Application Data"
"15","0.318367762","172.217.10.142","192.168.1.118","TLSv1.2","2902","Application Data, Application Data"
"16","0.318564287","172.217.10.142","192.168.1.118","TLSv1.2","1484","Application Data [TCP segment of a reassembled PDU]"
"17","0.318823287","192.168.1.118","172.217.10.142","TCP","66","42240 → 443 [ACK] Seq=1 Ack=25525 Win=317 Len=0 TSval=3606880876 TSecr=923369680"
"18","0.333349637","172.217.10.142","192.168.1.118","TLSv1.2","1484","Application Data [TCP segment of a reassembled PDU]"
"19","0.335437875","172.217.10.142","192.168.1.118","TLSv1.2","1484","Application Data [TCP segment of a reassembled PDU]"
"20","0.335532950","172.217.10.142","192.168.1.118","TLSv1.2","2902","Application Data, Application Data"
"21","0.335592300","172.217.10.142","192.168.1.118","TLSv1.2","2902","Application Data, Application Data"
"22","0.340380100","192.168.1.118","172.217.10.142","TCP","66","42240 → 443 [ACK] Seq=1 Ack=34033 Win=251 Len=0 TSval=3606880898 TSecr=923369740"
"23","0.342006275","192.168.1.118","209.18.47.62","DNS","71","Standard query 0xb502 A i.ytimg.com"
"24","0.342538650","192.168.1.118","209.18.47.62","DNS","71","Standard query 0x4d6b A i.ytimg.com"
"25","0.343580412","192.168.1.118","209.18.47.62","DNS","71","Standard query 0x85de A i.ytimg.com"
"26","0.344023487","192.168.1.118","209.18.47.62","DNS","71","Standard query 0xb5e2 A i.ytimg.com"
"27","0.345240100","192.168.1.118","209.18.47.62","DNS","71","Standard query 0x3158 A i.ytimg.com"
"28","0.354765125","172.217.10.142","192.168.1.118","TLSv1.2","2902","Application Data, Application Data"
"29","0.361759800","172.217.10.142","192.168.1.118","TLSv1.2","2902","Application Data, Application Data"
"30","0.361876162","172.217.10.142","192.168.1.118","TLSv1.2","2902","Application Data, Application Data"
"31","0.361967737","172.217.10.142","192.168.1.118","TLSv1.2","2902","Application Data, Application Data"
"32","0.362020987","172.217.10.142","192.168.1.118","TLSv1.2","1484","Application Data [TCP segment of a reassembled PDU]"
"33","0.362053962","172.217.10.142","192.168.1.118","TLSv1.2","248","Application Data, Application Data"
"34","0.366362525","192.168.1.118","172.217.10.142","TCP","66","42240 → 443 [ACK] Seq=1 Ack=46977 Win=150 Len=0 TSval=3606880924 TSecr=923369745"
"35","0.371510150","209.18.47.62","192.168.1.118","DNS","87","Standard query response 0xb502 A i.ytimg.com A 172.217.10.54"
"36","0.371808200","192.168.1.118","209.18.47.62","DNS","71","Standard query 0xd910 AAAA i.ytimg.com"
"37","0.378767662","209.18.47.62","192.168.1.118","DNS","87","Standard query response 0x4d6b A i.ytimg.com A 172.217.12.182"
"38","0.378888075","209.18.47.62","192.168.1.118","DNS","87","Standard query response 0x85de A i.ytimg.com A 172.217.12.150"
"39","0.379178150","192.168.1.118","209.18.47.62","DNS","71","Standard query 0xb9db AAAA i.ytimg.com"
"40","0.379488562","192.168.1.118","209.18.47.62","DNS","71","Standard query 0xd9b6 AAAA i.ytimg.com"
"41","0.426722987","192.168.1.118","209.18.47.62","DNS","75","Standard query 0x9190 A www.gstatic.com"
"42","0.438729787","192.168.1.118","209.18.47.62","DNS","73","Standard query 0x75bc A yt3.ggpht.com"
"43","0.466763450","192.168.1.118","209.18.47.62","DNS","73","Standard query 0x09bc A yt3.ggpht.com"
"44","0.467628287","192.168.1.118","209.18.47.62","DNS","73","Standard query 0xcd81 A yt3.ggpht.com"
"45","0.477768800","209.18.47.62","192.168.1.118","DNS","87","Standard query response 0xb5e2 A i.ytimg.com A 172.217.10.118"
"46","0.479100487","192.168.1.118","209.18.47.62","DNS","71","Standard query 0xe5c4 AAAA i.ytimg.com"
"47","0.482223200","209.18.47.62","192.168.1.118","DNS","87","Standard query response 0x3158 A i.ytimg.com A 172.217.6.214"
"48","0.482300862","209.18.47.62","192.168.1.118","DNS","99","Standard query response 0xd910 AAAA i.ytimg.com AAAA 2607:f8b0:4006:803::2016"
"49","0.482346462","209.18.47.62","192.168.1.118","DNS","99","Standard query response 0xb9db AAAA i.ytimg.com AAAA 2607:f8b0:4006:81a::2016"
"50","0.482501337","192.168.1.118","209.18.47.62","DNS","71","Standard query 0x5db2 AAAA i.ytimg.com"
"51","0.484247912","192.168.1.118","172.217.10.142","TCP","66","[TCP Window Update] 42240 → 443 [ACK] Seq=1 Ack=46977 Win=501 Len=0 TSval=3606881042 TSecr=923369745"
"52","0.484497650","192.168.1.118","172.217.10.54","TCP","74","33888 → 443 [SYN] Seq=0 Win=64240 Len=0 MSS=1460 SACK_PERM=1 TSval=1762906396 TSecr=0 WS=128"
"53","0.484707950","192.168.1.118","172.217.10.54","TCP","74","33890 → 443 [SYN] Seq=0 Win=64240 Len=0 MSS=1460 SACK_PERM=1 TSval=1762906396 TSecr=0 WS=128"
"54","0.484788612","192.168.1.118","172.217.10.54","TCP","74","33892 → 443 [SYN] Seq=0 Win=64240 Len=0 MSS=1460 SACK_PERM=1 TSval=1762906396 TSecr=0 WS=128"
"55","0.484863787","192.168.1.118","172.217.10.54","TCP","74","33894 → 443 [SYN] Seq=0 Win=64240 Len=0 MSS=1460 SACK_PERM=1 TSval=1762906397 TSecr=0 WS=128"
"56","0.484938325","192.168.1.118","172.217.10.54","TCP","74","33896 → 443 [SYN] Seq=0 Win=64240 Len=0 MSS=1460 SACK_PERM=1 TSval=1762906397 TSecr=0 WS=128"
"57","0.517856625","209.18.47.62","192.168.1.118","DNS","91","Standard query response 0x9190 A www.gstatic.com A 172.217.9.227"
"58","0.518090412","192.168.1.118","209.18.47.62","DNS","75","Standard query 0x292b AAAA www.gstatic.com"
"59","0.519506750","209.18.47.62","192.168.1.118","DNS","99","Standard query response 0xd9b6 AAAA i.ytimg.com AAAA 2607:f8b0:4006:819::2016"
"60","0.519568937","209.18.47.62","192.168.1.118","DNS","134","Standard query response 0x75bc A yt3.ggpht.com CNAME photos-ugc.l.googleusercontent.com A 172.217.3.97"
"61","0.519633362","209.18.47.62","192.168.1.118","DNS","99","Standard query response 0xe5c4 AAAA i.ytimg.com AAAA 2607:f8b0:4006:811::2016"
"62","0.519686175","209.18.47.62","192.168.1.118","DNS","134","Standard query response 0x09bc A yt3.ggpht.com CNAME photos-ugc.l.googleusercontent.com A 172.217.6.193"
"63","0.519746725","209.18.47.62","192.168.1.118","DNS","134","Standard query response 0xcd81 A yt3.ggpht.com CNAME photos-ugc.l.googleusercontent.com A 172.217.10.129"
"64","0.519805912","172.217.10.54","192.168.1.118","TCP","74","443 → 33894 [SYN, ACK] Seq=0 Ack=1 Win=60192 Len=0 MSS=1380 SACK_PERM=1 TSval=3212697888 TSecr=1762906397 WS=256"
"65","0.519905237","192.168.1.118","172.217.10.54","TCP","66","33894 → 443 [ACK] Seq=1 Ack=1 Win=64256 Len=0 TSval=1762906432 TSecr=3212697888"
"66","0.519964962","172.217.10.54","192.168.1.118","TCP","74","443 → 33888 [SYN, ACK] Seq=0 Ack=1 Win=60192 Len=0 MSS=1380 SACK_PERM=1 TSval=3143539733 TSecr=1762906396 WS=256"
"67","0.520043587","192.168.1.118","172.217.10.54","TCP","66","33888 → 443 [ACK] Seq=1 Ack=1 Win=64256 Len=0 TSval=1762906432 TSecr=3143539733"
"68","0.520096387","172.217.10.54","192.168.1.118","TCP","74","443 → 33896 [SYN, ACK] Seq=0 Ack=1 Win=60192 Len=0 MSS=1380 SACK_PERM=1 TSval=2303124083 TSecr=1762906397 WS=256"
"69","0.520169450","192.168.1.118","172.217.10.54","TCP","66","33896 → 443 [ACK] Seq=1 Ack=1 Win=64256 Len=0 TSval=1762906432 TSecr=2303124083"
"70","0.520221625","172.217.10.54","192.168.1.118","TCP","74","443 → 33892 [SYN, ACK] Seq=0 Ack=1 Win=60192 Len=0 MSS=1380 SACK_PERM=1 TSval=3143539733 TSecr=1762906396 WS=256"
"71","0.520296762","192.168.1.118","172.217.10.54","TCP","66","33892 → 443 [ACK] Seq=1 Ack=1 Win=64256 Len=0 TSval=1762906432 TSecr=3143539733"
"72","0.520368712","172.217.10.54","192.168.1.118","TCP","74","443 → 33890 [SYN, ACK] Seq=0 Ack=1 Win=60192 Len=0 MSS=1380 SACK_PERM=1 TSval=1473486648 TSecr=1762906396 WS=256"
"73","0.520441125","192.168.1.118","172.217.10.54","TCP","66","33890 → 443 [ACK] Seq=1 Ack=1 Win=64256 Len=0 TSval=1762906432 TSecr=1473486648"
"74","0.520494150","209.18.47.62","192.168.1.118","DNS","99","Standard query response 0x5db2 AAAA i.ytimg.com AAAA 2607:f8b0:4006:804::2016"
"75","0.520758862","192.168.1.118","209.18.47.62","DNS","73","Standard query 0xbd7a AAAA yt3.ggpht.com"
"76","0.522012400","192.168.1.118","209.18.47.62","DNS","73","Standard query 0x0dac AAAA yt3.ggpht.com"
"77","0.523665337","192.168.1.118","209.18.47.62","DNS","73","Standard query 0xb904 AAAA yt3.ggpht.com"
"78","0.536875950","192.168.1.118","172.217.10.54","TLSv1","583","Client Hello"
"79","0.538283037","209.18.47.62","192.168.1.118","DNS","103","Standard query response 0x292b AAAA www.gstatic.com AAAA 2607:f8b0:4006:801::2003"
"80","0.545272687","209.18.47.62","192.168.1.118","DNS","146","Standard query response 0x0dac AAAA yt3.ggpht.com CNAME photos-ugc.l.googleusercontent.com AAAA 2607:f8b0:4006:804::2001"
"81","0.546844962","209.18.47.62","192.168.1.118","DNS","146","Standard query response 0xbd7a AAAA yt3.ggpht.com CNAME photos-ugc.l.googleusercontent.com AAAA 2607:f8b0:4006:818::2001"
"82","0.546915750","209.18.47.62","192.168.1.118","DNS","146","Standard query response 0xb904 AAAA yt3.ggpht.com CNAME photos-ugc.l.googleusercontent.com AAAA 2607:f8b0:4006:812::2001"
"83","0.553370650","192.168.1.118","172.217.10.54","TLSv1","583","Client Hello"
"84","0.556690450","172.217.10.54","192.168.1.118","TCP","66","443 → 33888 [ACK] Seq=1 Ack=518 Win=61440 Len=0 TSval=3143539778 TSecr=1762906448"
"85","0.566247037","172.217.10.54","192.168.1.118","TLSv1.2","3137","Server Hello, Certificate, Server Key Exchange, Server Hello Done"
"86","0.566304400","192.168.1.118","172.217.10.54","TCP","66","33888 → 443 [ACK] Seq=518 Ack=3072 Win=61312 Len=0 TSval=1762906478 TSecr=3143539786"
"87","0.569765275","192.168.1.118","172.217.10.54","TLSv1","583","Client Hello"
"88","0.569803787","172.217.10.54","192.168.1.118","TCP","66","443 → 33890 [ACK] Seq=1 Ack=518 Win=61440 Len=0 TSval=1473486708 TSecr=1762906465"
"89","0.578649950","172.217.10.54","192.168.1.118","TLSv1.2","1484","Server Hello"
"90","0.578736100","192.168.1.118","172.217.10.54","TCP","66","33890 → 443 [ACK] Seq=518 Ack=1419 Win=63104 Len=0 TSval=1762906490 TSecr=1473486716"
"91","0.580267575","172.217.10.54","192.168.1.118","TLSv1.2","1719","Certificate, Server Key Exchange, Server Hello Done"
"92","0.580337087","192.168.1.118","172.217.10.54","TCP","66","33890 → 443 [ACK] Seq=518 Ack=3072 Win=61568 Len=0 TSval=1762906492 TSecr=1473486716"
"93","0.587354887","192.168.1.118","172.217.10.54","TLSv1","583","Client Hello"
"94","0.589966725","172.217.10.54","192.168.1.118","TCP","66","443 → 33892 [ACK] Seq=1 Ack=518 Win=61440 Len=0 TSval=3143539813 TSecr=1762906481"
"95","0.599464587","172.217.10.54","192.168.1.118","SSL","1484","[TCP Previous segment not captured] , Continuation Data"
"96","0.599533075","192.168.1.118","172.217.10.54","TCP","78","[TCP Dup ACK 71#1] 33892 → 443 [ACK] Seq=518 Ack=1 Win=64256 Len=0 TSval=1762906511 TSecr=3143539813 SLE=1419 SRE=2837"
"97","0.602017512","172.217.10.54","192.168.1.118","SSL","301","Continuation Data"
"98","0.602076775","192.168.1.118","172.217.10.54","TCP","78","[TCP Dup ACK 71#2] 33892 → 443 [ACK] Seq=518 Ack=1 Win=64256 Len=0 TSval=1762906514 TSecr=3143539813 SLE=1419 SRE=3072"
"99","0.602120950","172.217.10.54","192.168.1.118","TLSv1.2","1484","[TCP Fast Retransmission] , Server Hello"
"100","0.602138350","192.168.1.118","172.217.10.54","TCP","66","33892 → 443 [ACK] Seq=518 Ack=3072 Win=61312 Len=0 TSval=1762906514 TSecr=3143539821"
"101","0.604519325","192.168.1.118","172.217.10.54","TLSv1","583","Client Hello"
"102","0.604737137","192.168.1.118","172.217.9.227","TCP","74","44470 → 443 [SYN] Seq=0 Win=64240 Len=0 MSS=1460 SACK_PERM=1 TSval=346584779 TSecr=0 WS=128"
"103","0.604828800","192.168.1.118","172.217.3.97","TCP","74","37596 → 443 [SYN] Seq=0 Win=64240 Len=0 MSS=1460 SACK_PERM=1 TSval=2664462510 TSecr=0 WS=128"
"104","0.604909075","192.168.1.118","172.217.3.97","TCP","74","37598 → 443 [SYN] Seq=0 Win=64240 Len=0 MSS=1460 SACK_PERM=1 TSval=2664462511 TSecr=0 WS=128"
"105","0.604985787","192.168.1.118","172.217.3.97","TCP","74","37600 → 443 [SYN] Seq=0 Win=64240 Len=0 MSS=1460 SACK_PERM=1 TSval=2664462511 TSecr=0 WS=128"
"106","0.607039487","192.168.1.118","172.217.10.54","TLSv1.2","192","Client Key Exchange, Change Cipher Spec, Encrypted Handshake Message"
"107","0.608935675","192.168.1.118","172.217.10.54","TLSv1.2","192","Client Key Exchange, Change Cipher Spec, Encrypted Handshake Message"
"108","0.609778475","172.217.10.54","192.168.1.118","TCP","66","443 → 33894 [ACK] Seq=1 Ack=518 Win=61440 Len=0 TSval=3212697984 TSecr=1762906499"
"109","0.610842000","192.168.1.118","172.217.10.54","TLSv1.2","192","Client Key Exchange, Change Cipher Spec, Encrypted Handshake Message"
"110","0.615468100","172.217.10.54","192.168.1.118","TLSv1.2","1484","Server Hello"
"111","0.615509912","192.168.1.118","172.217.10.54","TCP","66","33894 → 443 [ACK] Seq=518 Ack=1419 Win=63104 Len=0 TSval=1762906527 TSecr=3212697991"
"112","0.619405837","172.217.10.54","192.168.1.118","TLSv1.2","1484","Certificate [TCP segment of a reassembled PDU]"
"113","0.619421875","192.168.1.118","172.217.10.54","TCP","66","33894 → 443 [ACK] Seq=518 Ack=2837 Win=63104 Len=0 TSval=1762906531 TSecr=3212697991"
"114","0.619432675","172.217.10.54","192.168.1.118","TLSv1.2","301","Server Key Exchange, Server Hello Done"
"115","0.619447350","192.168.1.118","172.217.10.54","TCP","66","33894 → 443 [ACK] Seq=518 Ack=3072 Win=62976 Len=0 TSval=1762906531 TSecr=3212697992"
"116","0.622050487","192.168.1.118","172.217.10.54","TLSv1.2","192","Client Key Exchange, Change Cipher Spec, Encrypted Handshake Message"
"117","0.624760312","172.217.10.54","192.168.1.118","TCP","1484","[TCP Out-Of-Order] 443 → 33892 [ACK] Seq=1 Ack=518 Win=61440 Len=1418 TSval=3143539847 TSecr=1762906511"
"118","0.624791325","192.168.1.118","172.217.10.54","TCP","78","[TCP Dup ACK 100#1] 33892 → 443 [ACK] Seq=644 Ack=3072 Win=64128 Len=0 TSval=1762906536 TSecr=3143539821 SLE=1 SRE=1419"
"119","0.635968962","172.217.3.97","192.168.1.118","TCP","74","443 → 37598 [SYN, ACK] Seq=0 Ack=1 Win=60192 Len=0 MSS=1380 SACK_PERM=1 TSval=2151417354 TSecr=2664462511 WS=256"
"120","0.636054950","192.168.1.118","172.217.3.97","TCP","66","37598 → 443 [ACK] Seq=1 Ack=1 Win=64256 Len=0 TSval=2664462542 TSecr=2151417354"
"121","0.637354550","172.217.10.54","192.168.1.118","TCP","66","443 → 33896 [ACK] Seq=1 Ack=518 Win=61440 Len=0 TSval=2303124209 TSecr=1762906516"
"122","0.638275775","172.217.3.97","192.168.1.118","TCP","74","443 → 37596 [SYN, ACK] Seq=0 Ack=1 Win=60192 Len=0 MSS=1380 SACK_PERM=1 TSval=1267694206 TSecr=2664462510 WS=256"
"123","0.638349737","192.168.1.118","172.217.3.97","TCP","66","37596 → 443 [ACK] Seq=1 Ack=1 Win=64256 Len=0 TSval=2664462544 TSecr=1267694206"
"124","0.638391950","172.217.9.227","192.168.1.118","TCP","74","443 → 44470 [SYN, ACK] Seq=0 Ack=1 Win=60192 Len=0 MSS=1380 SACK_PERM=1 TSval=75424085 TSecr=346584779 WS=256"
"125","0.638447025","192.168.1.118","172.217.9.227","TCP","66","44470 → 443 [ACK] Seq=1 Ack=1 Win=64256 Len=0 TSval=346584813 TSecr=75424085"
"126","0.643643850","172.217.10.54","192.168.1.118","TLSv1.2","1484","Server Hello"
"127","0.643699162","192.168.1.118","172.217.10.54","TCP","66","33896 → 443 [ACK] Seq=518 Ack=1419 Win=63104 Len=0 TSval=1762906555 TSecr=2303124216"
"128","0.645360600","172.217.10.54","192.168.1.118","TLSv1.2","1719","Certificate, Server Key Exchange, Server Hello Done"
"129","0.645419050","192.168.1.118","172.217.10.54","TCP","66","33896 → 443 [ACK] Seq=518 Ack=3072 Win=61568 Len=0 TSval=1762906557 TSecr=2303124216"
"130","0.646760387","172.217.3.97","192.168.1.118","TCP","74","443 → 37600 [SYN, ACK] Seq=0 Ack=1 Win=60192 Len=0 MSS=1380 SACK_PERM=1 TSval=2151417363 TSecr=2664462511 WS=256"
"131","0.646836262","192.168.1.118","172.217.3.97","TCP","66","37600 → 443 [ACK] Seq=1 Ack=1 Win=64256 Len=0 TSval=2664462552 TSecr=2151417363"
"132","0.646890912","172.217.10.54","192.168.1.118","TLSv1.2","117","Change Cipher Spec, Encrypted Handshake Message"
"133","0.646949687","172.217.10.54","192.168.1.118","TLSv1.2","117","Change Cipher Spec, Encrypted Handshake Message"
"134","0.647006450","192.168.1.118","172.217.10.54","TCP","66","33892 → 443 [ACK] Seq=644 Ack=3123 Win=64128 Len=0 TSval=1762906559 TSecr=3143539869"
"135","0.647056662","172.217.10.54","192.168.1.118","TLSv1.2","117","Change Cipher Spec, Encrypted Handshake Message"
"136","0.647113100","192.168.1.118","172.217.10.54","TCP","66","33888 → 443 [ACK] Seq=644 Ack=3123 Win=64128 Len=0 TSval=1762906559 TSecr=3143539869"
"137","0.653409000","192.168.1.118","172.217.3.97","TLSv1","583","Client Hello"
"138","0.661647450","172.217.10.54","192.168.1.118","TLSv1.2","117","Change Cipher Spec, Encrypted Handshake Message"
"139","0.669865712","192.168.1.118","172.217.3.97","TLSv1","583","Client Hello"
"140","0.670209700","192.168.1.118","172.217.10.54","TLSv1.2","363","Application Data"
"141","0.670314825","172.217.3.97","192.168.1.118","TCP","66","443 → 37598 [ACK] Seq=1 Ack=518 Win=61440 Len=0 TSval=2151417388 TSecr=2664462559"
"142","0.670465112","192.168.1.118","172.217.10.54","TLSv1.2","363","Application Data"
"143","0.670673025","192.168.1.118","172.217.10.54","TLSv1.2","363","Application Data"
"144","0.670876050","192.168.1.118","172.217.10.54","TLSv1.2","363","Application Data"
"145","0.672760412","192.168.1.118","172.217.10.54","TLSv1.2","192","Client Key Exchange, Change Cipher Spec, Encrypted Handshake Message"
"146","0.677111037","172.217.3.97","192.168.1.118","TLSv1.2","1484","Server Hello"
"147","0.677194600","192.168.1.118","172.217.3.97","TCP","66","37598 → 443 [ACK] Seq=518 Ack=1419 Win=63104 Len=0 TSval=2664462583 TSecr=2151417394"
"148","0.679172137","172.217.3.97","192.168.1.118","TLSv1.2","3882","Certificate, Server Key Exchange, Server Hello Done"
"149","0.679261475","192.168.1.118","172.217.3.97","TCP","66","37598 → 443 [ACK] Seq=518 Ack=5235 Win=59392 Len=0 TSval=2664462585 TSecr=2151417394"
"150","0.686623800","172.217.3.97","192.168.1.118","TCP","66","443 → 37600 [ACK] Seq=1 Ack=518 Win=61440 Len=0 TSval=2151417405 TSecr=2664462575"
"151","0.687864675","172.217.10.54","192.168.1.118","TLSv1.2","1484","Application Data"
"152","0.689033150","192.168.1.118","172.217.9.227","TLSv1","583","Client Hello"
"153","0.689551362","172.217.10.54","192.168.1.118","TLSv1.2","2902","Application Data, Application Data"
"154","0.690597162","172.217.10.54","192.168.1.118","TLSv1.2","2902","Application Data, Application Data"
"155","0.690708387","172.217.10.54","192.168.1.118","TLSv1.2","2451","Application Data, Application Data"
"156","0.690790725","172.217.10.54","192.168.1.118","TLSv1.2","1484","Application Data"
"157","0.690880975","172.217.10.54","192.168.1.118","TLSv1.2","1484","Application Data"
"158","0.695003700","172.217.10.54","192.168.1.118","TLSv1.2","2902","Application Data, Application Data"
"159","0.695114612","172.217.10.54","192.168.1.118","TLSv1.2","2902","Application Data, Application Data"
"160","0.695222162","172.217.10.54","192.168.1.118","TLSv1.2","2902","Application Data, Application Data"
"161","0.696698312","172.217.10.54","192.168.1.118","TLSv1.2","4816","Application Data, Application Data, Application Data, Application Data"
"162","0.696787787","172.217.10.54","192.168.1.118","TLSv1.2","1484","Application Data"
"163","0.696904337","172.217.10.54","192.168.1.118","TLSv1.2","2902","Application Data, Application Data"
"164","0.697041250","172.217.10.54","192.168.1.118","TLSv1.2","4320","Application Data, Application Data, Application Data"
"165","0.699078525","172.217.10.54","192.168.1.118","TLSv1.2","1260","Application Data"
"166","0.699155750","172.217.10.54","192.168.1.118","TLSv1.2","1903","Application Data, Application Data"
"167","0.699237525","172.217.3.97","192.168.1.118","TLSv1.2","2902","Server Hello"
"168","0.699298312","192.168.1.118","172.217.3.97","TCP","66","37600 → 443 [ACK] Seq=518 Ack=2837 Win=61440 Len=0 TSval=2664462605 TSecr=2151417412"
"169","0.699446950","172.217.3.97","192.168.1.118","TLSv1.2","2463","Certificate, Server Key Exchange, Server Hello Done"
"170","0.699509287","192.168.1.118","172.217.3.97","TCP","66","37600 → 443 [ACK] Seq=518 Ack=5234 Win=59136 Len=0 TSval=2664462605 TSecr=2151417412"
"171","0.699567187","172.217.10.54","192.168.1.118","TLSv1.2","117","Change Cipher Spec, Encrypted Handshake Message"
"172","0.705572812","192.168.1.118","172.217.3.97","TLSv1","583","Client Hello"
"173","0.707934525","192.168.1.118","172.217.3.97","TLSv1.2","192","Client Key Exchange, Change Cipher Spec, Encrypted Handshake Message"
"174","0.710244737","192.168.1.118","172.217.3.97","TLSv1.2","192","Client Key Exchange, Change Cipher Spec, Encrypted Handshake Message"
"175","0.714813112","192.168.1.118","172.217.10.54","TCP","66","33888 → 443 [ACK] Seq=941 Ack=12598 Win=54656 Len=0 TSval=1762906626 TSecr=3143539910"
"176","0.715195425","192.168.1.118","172.217.10.54","TCP","66","33890 → 443 [ACK] Seq=941 Ack=12127 Win=55168 Len=0 TSval=1762906627 TSecr=1473486826"
"177","0.715351725","192.168.1.118","172.217.10.54","TCP","66","33892 → 443 [ACK] Seq=941 Ack=12050 Win=55296 Len=0 TSval=1762906627 TSecr=3143539911"
"178","0.715469700","192.168.1.118","172.217.10.54","TCP","66","33894 → 443 [ACK] Seq=941 Ack=12825 Win=54528 Len=0 TSval=1762906627 TSecr=3212698067"
"179","0.715827937","192.168.1.118","172.217.10.54","TLSv1.2","363","Application Data"
"180","0.722674312","172.217.9.227","192.168.1.118","TCP","66","443 → 44470 [ACK] Seq=1 Ack=518 Win=61440 Len=0 TSval=75424170 TSecr=346584864"
"181","0.726543762","192.168.1.118","172.217.10.54","TLSv1.2","363","Application Data"
"182","0.726676937","192.168.1.118","172.217.10.54","TLSv1.2","363","Application Data"
"183","0.726787400","192.168.1.118","172.217.10.54","TLSv1.2","363","Application Data"
"184","0.726878375","192.168.1.118","172.217.10.54","TLSv1.2","363","Application Data"
"185","0.730845512","172.217.9.227","192.168.1.118","TLSv1.2","1484","Server Hello"
"186","0.730929275","192.168.1.118","172.217.9.227","TCP","66","44470 → 443 [ACK] Seq=518 Ack=1419 Win=63104 Len=0 TSval=346584906 TSecr=75424176"
"187","0.731849512","172.217.9.227","192.168.1.118","TLSv1.2","1307","Certificate, Server Key Exchange, Server Hello Done"
"188","0.731927037","192.168.1.118","172.217.9.227","TCP","66","44470 → 443 [ACK] Seq=518 Ack=2660 Win=61952 Len=0 TSval=346584907 TSecr=75424176"
"189","0.732006100","172.217.3.97","192.168.1.118","TLSv1.2","117","Change Cipher Spec, Encrypted Handshake Message"
"190","0.732604525","172.217.3.97","192.168.1.118","TLSv1.2","117","Change Cipher Spec, Encrypted Handshake Message"
"191","0.732691312","172.217.3.97","192.168.1.118","TCP","66","443 → 37596 [ACK] Seq=1 Ack=518 Win=61440 Len=0 TSval=1267694300 TSecr=2664462611"
"192","0.734526212","192.168.1.118","172.217.9.227","TLSv1.2","192","Client Key Exchange, Change Cipher Spec, Encrypted Handshake Message"
"193","0.734899800","192.168.1.118","172.217.3.97","TLSv1.2","339","Application Data"
"194","0.735204200","192.168.1.118","172.217.3.97","TLSv1.2","409","Application Data"
"195","0.738490937","172.217.3.97","192.168.1.118","TLSv1.2","1484","Server Hello"
"196","0.738571812","192.168.1.118","172.217.3.97","TCP","66","37596 → 443 [ACK] Seq=518 Ack=1419 Win=63104 Len=0 TSval=2664462644 TSecr=1267694307"
"197","0.742622162","172.217.3.97","192.168.1.118","TCP","2902","443 → 37596 [ACK] Seq=1419 Ack=518 Win=61440 Len=2836 TSval=1267694307 TSecr=2664462611 [TCP segment of a reassembled PDU]"
"198","0.742697887","192.168.1.118","172.217.3.97","TCP","66","37596 → 443 [ACK] Seq=518 Ack=4255 Win=61056 Len=0 TSval=2664462648 TSecr=1267694307"
"199","0.745597550","172.217.3.97","192.168.1.118","TLSv1.2","1045","Certificate, Server Key Exchange, Server Hello Done"
"200","0.745672475","192.168.1.118","172.217.3.97","TCP","66","37596 → 443 [ACK] Seq=518 Ack=5234 Win=63104 Len=0 TSval=2664462651 TSecr=1267694307"
"201","0.747834325","172.217.10.54","192.168.1.118","TLSv1.2","1484","Application Data"
"202","0.747971637","172.217.10.54","192.168.1.118","TLSv1.2","2902","Application Data, Application Data"
"203","0.748103787","172.217.10.54","192.168.1.118","TLSv1.2","3526","Application Data, Application Data, Application Data"
"204","0.749402137","172.217.10.54","192.168.1.118","TLSv1.2","1484","Application Data"
"205","0.749522087","172.217.10.54","192.168.1.118","TLSv1.2","2902","Application Data, Application Data"
"206","0.749940100","192.168.1.118","172.217.3.97","TLSv1.2","192","Client Key Exchange, Change Cipher Spec, Encrypted Handshake Message"
"207","0.750051037","192.168.1.118","172.217.10.54","TCP","66","33888 → 443 [ACK] Seq=1238 Ack=16852 Win=59904 Len=0 TSval=1762906662 TSecr=3143539969"
"208","0.750519162","192.168.1.118","172.217.10.54","TCP","66","33896 → 443 [ACK] Seq=941 Ack=10837 Win=56448 Len=0 TSval=1762906662 TSecr=2303124314"
"209","0.752152937","172.217.10.54","192.168.1.118","TLSv1.2","2902","Application Data, Application Data"
"210","0.752971250","192.168.1.118","172.217.10.54","TCP","66","33888 → 443 [ACK] Seq=1238 Ack=19688 Win=57088 Len=0 TSval=1762906665 TSecr=3143539972"
"211","0.753458937","172.217.10.54","192.168.1.118","TLSv1.2","2651","Application Data, Application Data"
"212","0.755188137","172.217.9.227","192.168.1.118","TCP","66","443 → 44470 [ACK] Seq=2660 Ack=644 Win=61440 Len=0 TSval=75424205 TSecr=346584909"
"213","0.755932725","192.168.1.118","172.217.10.54","TCP","66","33888 → 443 [ACK] Seq=1238 Ack=22273 Win=54528 Len=0 TSval=1762906668 TSecr=3143539974"
"214","0.755977250","172.217.9.227","192.168.1.118","TLSv1.2","117","Change Cipher Spec, Encrypted Handshake Message"
"215","0.756357387","192.168.1.118","172.217.9.227","TLSv1.2","390","Application Data"
"216","0.757910700","172.217.10.54","192.168.1.118","TLSv1.2","1484","Application Data"
"217","0.758009162","172.217.3.97","192.168.1.118","TLSv1.2","1484","Application Data"
"218","0.758127837","172.217.3.97","192.168.1.118","TLSv1.2","2902","Application Data, Application Data"
"219","0.759003750","192.168.1.118","172.217.3.97","TCP","66","37598 → 443 [ACK] Seq=917 Ack=9540 Win=59904 Len=0 TSval=2664462665 TSecr=2151417474"
"220","0.760733425","172.217.3.97","192.168.1.118","TLSv1.2","2069","Application Data, Application Data"
"221","0.760822112","172.217.3.97","192.168.1.118","TLSv1.2","1484","Application Data"
"222","0.760917737","172.217.3.97","192.168.1.118","TLSv1.2","1484","Application Data"
"223","0.761015662","172.217.3.97","192.168.1.118","TLSv1.2","1682","Application Data, Application Data"
"224","0.761118875","172.217.10.54","192.168.1.118","TLSv1.2","2902","Application Data, Application Data"
"225","0.761199787","172.217.10.54","192.168.1.118","TLSv1.2","1484","Application Data"
"226","0.761316500","172.217.10.54","192.168.1.118","TLSv1.2","2902","Application Data, Application Data"
"227","0.762416412","192.168.1.118","172.217.3.97","TCP","66","37598 → 443 [ACK] Seq=917 Ack=11543 Win=57984 Len=0 TSval=2664462668 TSecr=2151417474"
"228","0.762518012","192.168.1.118","172.217.3.97","TCP","66","37600 → 443 [ACK] Seq=987 Ack=9737 Win=59776 Len=0 TSval=2664462668 TSecr=2151417474"
"229","0.762664450","192.168.1.118","172.217.10.54","TCP","66","33890 → 443 [ACK] Seq=1238 Ack=16381 Win=59904 Len=0 TSval=1762906674 TSecr=1473486895"
"230","0.762664850","172.217.10.54","192.168.1.118","TLSv1.2","1584","Application Data, Application Data"
"231","0.762714837","172.217.10.54","192.168.1.118","TCP","66","443 → 33892 [ACK] Seq=12050 Ack=1238 Win=63488 Len=0 TSval=3143539983 TSecr=1762906638"
"232","0.762751825","172.217.10.54","192.168.1.118","TLSv1.2","2902","Application Data, Application Data"
"233","0.762798362","192.168.1.118","172.217.10.54","TCP","66","33894 → 443 [ACK] Seq=1238 Ack=19915 Win=57088 Len=0 TSval=1762906674 TSecr=3212698134"
"234","0.762947837","192.168.1.118","172.217.10.54","TLSv1.2","442","Application Data"
"235","0.763047050","192.168.1.118","172.217.10.54","TLSv1.2","363","Application Data"
"236","0.763170450","192.168.1.118","172.217.10.54","TCP","66","33890 → 443 [ACK] Seq=1238 Ack=17899 Win=58496 Len=0 TSval=1762906675 TSecr=1473486898"
"237","0.770082912","172.217.10.54","192.168.1.118","TLSv1.2","159","Application Data"
"238","0.770132650","172.217.3.97","192.168.1.118","TLSv1.2","117","Change Cipher Spec, Encrypted Handshake Message"
"239","0.771037450","172.217.10.54","192.168.1.118","TLSv1.2","1484","Application Data"
"240","0.771688275","192.168.1.118","172.217.3.97","TLSv1.2","338","Application Data"
"241","0.772218762","192.168.1.118","172.217.10.54","TLSv1.2","363","Application Data"
"242","0.772366787","172.217.10.54","192.168.1.118","TLSv1.2","2902","Application Data, Application Data"
"243","0.772476675","192.168.1.118","172.217.10.54","TCP","66","33892 → 443 [ACK] Seq=1238 Ack=16304 Win=61056 Len=0 TSval=1762906684 TSecr=3143539994"
"244","0.774050050","172.217.10.54","192.168.1.118","TLSv1.2","1484","Application Data"
"245","0.775254012","192.168.1.118","172.217.10.54","TLSv1.2","363","Application Data"
"246","0.779195275","172.217.10.54","192.168.1.118","TLSv1.2","1484","Application Data"
"247","0.779266237","192.168.1.118","172.217.10.54","TCP","66","33892 → 443 [ACK] Seq=1238 Ack=19140 Win=63104 Len=0 TSval=1762906691 TSecr=3143539997"
"248","0.780770537","172.217.10.54","192.168.1.118","TLSv1.2","1787","Application Data, Application Data"
"249","0.782383812","192.168.1.118","172.217.10.54","TCP","66","33892 → 443 [ACK] Seq=1238 Ack=20861 Win=61440 Len=0 TSval=1762906694 TSecr=3143539999"
"250","0.784879537","192.168.1.118","172.217.10.54","TLSv1.2","363","Application Data"
"251","0.786307100","172.217.9.227","192.168.1.118","TLSv1.2","469","Application Data"
"252","0.789788875","172.217.10.54","192.168.1.118","TLSv1.2","1484","Application Data"
"253","0.792184362","172.217.10.54","192.168.1.118","TLSv1.2","1484","Application Data"
"254","0.792307400","172.217.10.54","192.168.1.118","TLSv1.2","2902","Application Data, Application Data"
"255","0.792416262","172.217.10.54","192.168.1.118","TLSv1.2","1484","Application Data"
"256","0.792578375","172.217.10.54","192.168.1.118","TLSv1.2","1484","Application Data"
"257","0.792674737","192.168.1.118","172.217.10.54","TCP","66","33888 → 443 [ACK] Seq=1614 Ack=26527 Win=59904 Len=0 TSval=1762906704 TSecr=3143540010"
"258","0.792732825","172.217.10.54","192.168.1.118","TLSv1.2","2902","Application Data, Application Data"
"259","0.792786687","172.217.10.54","192.168.1.118","TLSv1.2","2902","Application Data, Application Data"
"260","0.792868662","192.168.1.118","172.217.10.54","TCP","66","33896 → 443 [ACK] Seq=1238 Ack=17927 Win=57088 Len=0 TSval=1762906705 TSecr=2303124359"
"261","0.792955775","192.168.1.118","172.217.10.54","TCP","66","33888 → 443 [ACK] Seq=1614 Ack=29363 Win=57088 Len=0 TSval=1762906705 TSecr=3143540013"
"262","0.794800687","172.217.10.54","192.168.1.118","TLSv1.2","1085","Application Data"
"263","0.794886700","172.217.10.54","192.168.1.118","TLSv1.2","1380","Application Data"
"264","0.797020812","172.217.3.97","192.168.1.118","TLSv1.2","1484","Application Data"
"265","0.797313500","192.168.1.118","239.255.255.250","SSDP","218","M-SEARCH * HTTP/1.1 "
"266","0.799674550","172.217.3.97","192.168.1.118","TLSv1.2","2902","Application Data, Application Data"
"267","0.799785250","172.217.3.97","192.168.1.118","TLSv1.2","1567","Application Data, Application Data"
"268","0.799868337","172.217.10.54","192.168.1.118","TLSv1.2","1484","Application Data"
"269","0.799963675","172.217.10.54","192.168.1.118","TLSv1.2","1484","Application Data"
"270","0.800060500","172.217.10.54","192.168.1.118","TLSv1.2","1484","Application Data"
"271","0.800970500","192.168.1.118","172.217.3.97","TCP","66","37596 → 443 [ACK] Seq=916 Ack=11040 Win=58496 Len=0 TSval=2664462707 TSecr=1267694367"
"272","0.801075237","192.168.1.118","172.217.10.54","TCP","66","33890 → 443 [ACK] Seq=1535 Ack=20735 Win=61312 Len=0 TSval=1762906713 TSecr=1473486935"
"273","0.801475525","192.168.1.118","172.217.10.54","TLSv1.2","363","Application Data"
"274","0.801577437","192.168.1.118","172.217.10.54","TLSv1.2","363","Application Data"
"275","0.804264987","172.217.10.54","192.168.1.118","TLSv1.2","1484","Application Data"
"276","0.804373387","172.217.10.54","192.168.1.118","TLSv1.2","1484","Application Data"
"277","0.804494087","172.217.10.54","192.168.1.118","TLSv1.2","2902","Application Data, Application Data"
"278","0.804597712","172.217.10.54","192.168.1.118","TLSv1.2","2902","Application Data, Application Data"
"279","0.804659112","192.168.1.118","172.217.10.54","TCP","66","33894 → 443 [ACK] Seq=1535 Ack=24262 Win=61056 Len=0 TSval=1762906716 TSecr=3212698175"
"280","0.804739550","192.168.1.118","172.217.10.54","TCP","66","33892 → 443 [ACK] Seq=1535 Ack=25115 Win=61056 Len=0 TSval=1762906716 TSecr=3143540020"
"281","0.804775462","172.217.10.54","192.168.1.118","TLSv1.2","2902","Application Data, Application Data"
"282","0.807148937","192.168.1.118","172.217.10.54","TCP","66","33890 → 443 [ACK] Seq=1535 Ack=24989 Win=61056 Len=0 TSval=1762906719 TSecr=1473486936"
"283","0.807299200","172.217.10.54","192.168.1.118","TLSv1.2","2902","Application Data, Application Data"
"284","0.807351187","192.168.1.118","172.217.10.54","TCP","66","33894 → 443 [ACK] Seq=1535 Ack=27098 Win=61056 Len=0 TSval=1762906719 TSecr=3212698178"
"285","0.807650875","172.217.10.54","192.168.1.118","TLSv1.2","2902","Application Data, Application Data"
"286","0.807684725","192.168.1.118","172.217.10.54","TCP","66","33892 → 443 [ACK] Seq=1535 Ack=27951 Win=61056 Len=0 TSval=1762906719 TSecr=3143540023"
"287","0.807706050","172.217.10.54","192.168.1.118","TLSv1.2","110","Application Data"
"288","0.807740412","172.217.10.54","192.168.1.118","TLSv1.2","2902","Application Data, Application Data"
"289","0.807772525","192.168.1.118","172.217.10.54","TCP","66","33890 → 443 [ACK] Seq=1535 Ack=27825 Win=61056 Len=0 TSval=1762906719 TSecr=1473486941"
"290","0.807793237","172.217.10.54","192.168.1.118","TLSv1.2","259","Application Data"
"291","0.807817475","172.217.10.54","192.168.1.118","TLSv1.2","2902","Application Data, Application Data"
"292","0.810247537","192.168.1.118","172.217.10.54","TCP","66","33894 → 443 [ACK] Seq=1535 Ack=29934 Win=58240 Len=0 TSval=1762906722 TSecr=3212698180"
"293","0.812949250","172.217.10.54","192.168.1.118","TLSv1.2","1415","Application Data"
"294","0.815520750","192.168.1.118","172.217.10.54","TLSv1.2","363","Application Data"
"295","0.815650012","192.168.1.118","172.217.10.54","TLSv1.2","363","Application Data"
"296","0.818036250","192.168.1.118","172.217.10.54","TLSv1.2","363","Application Data"
"297","0.828359350","192.168.1.118","172.217.9.227","TCP","66","44470 → 443 [ACK] Seq=968 Ack=3114 Win=64128 Len=0 TSval=346585003 TSecr=75424235"
"298","0.832974400","172.217.10.54","192.168.1.118","TLSv1.2","1484","Application Data"
"299","0.833982650","172.217.10.54","192.168.1.118","TLSv1.2","1484","Application Data"
"300","0.834082075","172.217.10.54","192.168.1.118","TLSv1.2","1484","Application Data"
"301","0.834925100","172.217.10.54","192.168.1.118","TLSv1.2","1484","Application Data"
"302","0.835000412","172.217.10.54","192.168.1.118","TLSv1.2","1484","Application Data"
"303","0.836104887","192.168.1.118","172.217.10.54","TCP","66","33888 → 443 [ACK] Seq=1911 Ack=34636 Win=59904 Len=0 TSval=1762906748 TSecr=3143540055"
"304","0.836361062","192.168.1.118","172.217.10.54","TCP","66","33896 → 443 [ACK] Seq=1535 Ack=22077 Win=63104 Len=0 TSval=1762906748 TSecr=2303124405"
"305","0.838173362","172.217.10.54","192.168.1.118","TLSv1.2","1484","Application Data"
"306","0.839343650","172.217.10.54","192.168.1.118","TLSv1.2","2135","Application Data, Application Data"
"307","0.839411012","192.168.1.118","172.217.10.54","TCP","66","33888 → 443 [ACK] Seq=1911 Ack=36705 Win=61056 Len=0 TSval=1762906751 TSecr=3143540058"
"308","0.840216475","172.217.10.54","192.168.1.118","TLSv1.2","2902","Application Data, Application Data"
"309","0.841519700","192.168.1.118","172.217.10.54","TCP","66","33896 → 443 [ACK] Seq=1535 Ack=26331 Win=61056 Len=0 TSval=1762906753 TSecr=2303124405"
"310","0.841701800","172.217.10.54","192.168.1.118","TLSv1.2","2902","Application Data, Application Data"
"311","0.841780225","192.168.1.118","172.217.10.54","TCP","66","33896 → 443 [ACK] Seq=1535 Ack=29167 Win=61056 Len=0 TSval=1762906753 TSecr=2303124410"
"312","0.844181575","192.168.1.118","172.217.10.54","TLSv1.2","363","Application Data"
"313","0.846051675","172.217.10.54","192.168.1.118","TLSv1.2","563","Application Data"
"314","0.846133075","172.217.10.54","192.168.1.118","TLSv1.2","1484","Application Data"
"315","0.846236900","172.217.10.54","192.168.1.118","TLSv1.2","1484","Application Data"
"316","0.846521475","192.168.1.118","172.217.10.54","TCP","66","33890 → 443 [ACK] Seq=1832 Ack=30854 Win=61312 Len=0 TSval=1762906758 TSecr=1473486980"
"317","0.848204600","172.217.10.54","192.168.1.118","TLSv1.2","1484","Application Data"
"318","0.848286337","172.217.10.54","192.168.1.118","TLSv1.2","843","Application Data"
"319","0.848385237","172.217.10.54","192.168.1.118","TCP","66","443 → 33892 [ACK] Seq=27995 Ack=1832 Win=65792 Len=0 TSval=3143540069 TSecr=1762906727"
"320","0.849342487","172.217.10.54","192.168.1.118","TLSv1.2","1484","Application Data"
"321","0.849466650","172.217.10.54","192.168.1.118","TLSv1.2","2902","Application Data, Application Data"
"322","0.849566137","192.168.1.118","172.217.10.54","TCP","66","33890 → 443 [ACK] Seq=1832 Ack=33049 Win=61056 Len=0 TSval=1762906761 TSecr=1473486980"
"323","0.849674212","192.168.1.118","172.217.10.54","TCP","66","33892 → 443 [ACK] Seq=1832 Ack=32249 Win=59904 Len=0 TSval=1762906761 TSecr=3143540069"
"324","0.849915500","192.168.1.118","172.217.10.54","TLSv1.2","363","Application Data"
"325","0.850252775","172.217.10.54","192.168.1.118","TLSv1.2","1484","Application Data"
"326","0.852554137","192.168.1.118","172.217.10.54","TLSv1.2","363","Application Data"
"327","0.854173300","172.217.10.54","192.168.1.118","TLSv1.2","1079","Application Data"
"328","0.854233250","192.168.1.118","172.217.10.54","TCP","66","33892 → 443 [ACK] Seq=1832 Ack=34680 Win=63104 Len=0 TSval=1762906766 TSecr=3143540073"
"329","0.855833425","172.217.10.54","192.168.1.118","TLSv1.2","1484","Application Data"
"330","0.855926375","172.217.10.54","192.168.1.118","TLSv1.2","2902","Application Data, Application Data"
"331","0.856960412","172.217.10.54","192.168.1.118","TLSv1.2","2902","Application Data, Application Data"
"332","0.857436312","192.168.1.118","172.217.10.54","TCP","66","33894 → 443 [ACK] Seq=1832 Ack=38373 Win=57088 Len=0 TSval=1762906769 TSecr=3212698229"
"333","0.857853325","192.168.1.118","172.217.10.54","TLSv1.2","363","Application Data"
"334","0.857986175","172.217.10.54","192.168.1.118","TLSv1.2","1845","Application Data, Application Data"
"335","0.860297250","192.168.1.118","172.217.10.54","TCP","66","33894 → 443 [ACK] Seq=1832 Ack=40152 Win=55424 Len=0 TSval=1762906772 TSecr=3212698235"
"336","0.867730262","192.168.1.118","172.217.10.54","TLSv1.2","363","Application Data"
"337","0.887832087","172.217.10.54","192.168.1.118","TLSv1.2","1484","Application Data"
"338","0.894633812","172.217.10.54","192.168.1.118","TLSv1.2","1484","Application Data"
"339","0.894690125","172.217.10.54","192.168.1.118","TLSv1.2","2902","Application Data, Application Data"
"340","0.894708987","172.217.10.54","192.168.1.118","TLSv1.2","1484","Application Data"
"341","0.894740350","172.217.10.54","192.168.1.118","TLSv1.2","1484","Application Data"
"342","0.894773275","172.217.10.54","192.168.1.118","TLSv1.2","2825","Application Data, Application Data"
"343","0.894789000","172.217.10.54","192.168.1.118","TCP","66","443 → 33888 [ACK] Seq=36705 Ack=2208 Win=66816 Len=0 TSval=3143540098 TSecr=1762906756"
"344","0.894808062","172.217.10.54","192.168.1.118","TLSv1.2","2902","Application Data, Application Data"
"345","0.894829825","172.217.10.54","192.168.1.118","TLSv1.2","2902","Application Data, Application Data"
"346","0.894853250","172.217.10.54","192.168.1.118","TLSv1.2","2902","Application Data, Application Data"
"347","0.894862562","172.217.10.54","192.168.1.118","TLSv1.2","1309","Application Data"
"348","0.894877737","172.217.10.54","192.168.1.118","TLSv1.2","1484","Application Data"
"349","0.896212062","192.168.1.118","172.217.10.54","TCP","66","33896 → 443 [ACK] Seq=1832 Ack=36677 Win=57216 Len=0 TSval=1762906808 TSecr=2303124443"
"350","0.896432587","172.217.10.54","192.168.1.118","TLSv1.2","2902","Application Data, Application Data"
"351","0.896453687","192.168.1.118","172.217.10.54","TCP","66","33890 → 443 [ACK] Seq=2129 Ack=47054 Win=50176 Len=0 TSval=1762906808 TSecr=1473487009"
"352","0.896471325","172.217.10.54","192.168.1.118","TLSv1.2","2902","Application Data, Application Data"
"353","0.896510737","192.168.1.118","172.217.10.54","TCP","66","33892 → 443 [ACK] Seq=2129 Ack=41770 Win=57088 Len=0 TSval=1762906808 TSecr=3143540105"
"354","0.897759450","172.217.10.54","192.168.1.118","TLSv1.2","1484","Application Data"
"355","0.897796300","172.217.10.54","192.168.1.118","TLSv1.2","2902","Application Data, Application Data"
"356","0.897830475","172.217.10.54","192.168.1.118","TLSv1.2","2902","Application Data, Application Data"
"357","0.897846575","172.217.10.54","192.168.1.118","TLSv1.2","1484","Application Data"
"358","0.897876562","172.217.10.54","192.168.1.118","TLSv1.2","2902","Application Data, Application Data"
"359","0.897894150","172.217.10.54","192.168.1.118","TLSv1.2","2902","Application Data, Application Data"
"360","0.897912962","172.217.10.54","192.168.1.118","TLSv1.2","2348","Application Data, Application Data"
"361","0.898813350","192.168.1.118","172.217.10.54","TCP","66","33888 → 443 [ACK] Seq=2208 Ack=43795 Win=57088 Len=0 TSval=1762906810 TSecr=3143540109"
"362","0.899102387","192.168.1.118","172.217.10.54","TCP","66","33892 → 443 [ACK] Seq=2129 Ack=46888 Win=52096 Len=0 TSval=1762906811 TSecr=3143540111"
"363","0.899163450","192.168.1.118","172.217.10.54","TCP","66","33894 → 443 [ACK] Seq=2129 Ack=44406 Win=59904 Len=0 TSval=1762906811 TSecr=3212698266"
"364","0.902947637","172.217.10.54","192.168.1.118","TLSv1.2","1745","Application Data, Application Data"
"365","0.903012587","172.217.10.54","192.168.1.118","TLSv1.2","2250","Application Data, Application Data"
"366","0.903044075","192.168.1.118","172.217.10.54","TCP","66","33894 → 443 [ACK] Seq=2129 Ack=46590 Win=61056 Len=0 TSval=1762906815 TSecr=3212698269"
"367","0.904756400","192.168.1.118","172.217.10.54","TCP","66","33888 → 443 [ACK] Seq=2208 Ack=45474 Win=55424 Len=0 TSval=1762906816 TSecr=3143540113"
"368","0.905062525","192.168.1.118","172.217.10.54","TLSv1.2","363","Application Data"
"369","0.908260275","192.168.1.118","172.217.10.54","TLSv1.2","442","Application Data"
"370","0.961720912","172.217.10.54","192.168.1.118","TLSv1.2","1484","Application Data"
"371","0.963313112","172.217.10.54","192.168.1.118","TLSv1.2","1484","Application Data"
"372","0.963433400","172.217.10.54","192.168.1.118","TLSv1.2","2902","Application Data, Application Data"
"373","0.963521162","172.217.10.54","192.168.1.118","TLSv1.2","2902","Application Data, Application Data"
"374","0.963847437","192.168.1.118","172.217.10.54","TCP","66","33896 → 443 [ACK] Seq=2129 Ack=40931 Win=59904 Len=0 TSval=1762906875 TSecr=2303124534"
"375","0.964056937","192.168.1.118","172.217.10.54","TCP","66","33888 → 443 [ACK] Seq=2584 Ack=49728 Win=59904 Len=0 TSval=1762906876 TSecr=3143540184"
"376","0.966464675","172.217.10.54","192.168.1.118","TLSv1.2","2902","Application Data, Application Data"
"377","0.966546562","192.168.1.118","172.217.10.54","TCP","66","33888 → 443 [ACK] Seq=2584 Ack=52564 Win=61056 Len=0 TSval=1762906878 TSecr=3143540187"
"378","0.966613337","172.217.10.54","192.168.1.118","TLSv1.2","2902","Application Data, Application Data"
"379","0.966678437","192.168.1.118","172.217.10.54","TCP","66","33896 → 443 [ACK] Seq=2129 Ack=43767 Win=61056 Len=0 TSval=1762906878 TSecr=2303124537"
"380","0.968497212","172.217.10.54","192.168.1.118","TLSv1.2","2902","Application Data, Application Data"
"381","0.968544500","172.217.10.54","192.168.1.118","TLSv1.2","1484","Application Data"
"382","0.968968050","192.168.1.118","172.217.10.54","TCP","66","33888 → 443 [ACK] Seq=2584 Ack=55400 Win=58240 Len=0 TSval=1762906881 TSecr=3143540189"
"383","0.973999687","172.217.10.54","192.168.1.118","TLSv1.2","1700","Application Data, Application Data"
"384","0.974079250","192.168.1.118","172.217.10.54","TCP","66","33888 → 443 [ACK] Seq=2584 Ack=57034 Win=61056 Len=0 TSval=1762906886 TSecr=3143540191"
"385","0.974162000","172.217.10.54","192.168.1.118","TLSv1.2","1484","Application Data"
"386","0.974225125","192.168.1.118","172.217.10.54","TCP","66","33896 → 443 [ACK] Seq=2129 Ack=46603 Win=63104 Len=0 TSval=1762906886 TSecr=2303124539"
"387","0.974266562","172.217.10.54","192.168.1.118","TLSv1.2","923","Application Data"
"388","1.014397687","192.168.1.118","172.217.10.54","TCP","66","33896 → 443 [ACK] Seq=2129 Ack=47460 Win=64128 Len=0 TSval=1762906926 TSecr=2303124542"
"389","1.336662500","192.168.1.102","224.0.0.251","MDNS","81","Standard query 0x0000 PTR _googlerpc._tcp.local, "QM" question"
"390","1.338070925","192.168.1.102","224.0.0.251","MDNS","91","Standard query 0x0000 SRV googlerpc._googlerpc._tcp.local, "QM" question"
"391","1.340977175","192.168.1.102","224.0.0.251","MDNS","220","Standard query response 0x0000 PTR googlerpc._googlerpc._tcp.local TXT, cache flush SRV, cache flush 0 0 8012 2c3f16b2-da5c-4b6f-d6cf-bfba61c12490.local A, cache flush 192.168.1.102"
"392","1.343505175","192.168.1.102","224.0.0.251","MDNS","158","Standard query response 0x0000 SRV, cache flush 0 0 8012 2c3f16b2-da5c-4b6f-d6cf-bfba61c12490.local A, cache flush 192.168.1.102"
"393","1.344726825","192.168.1.102","224.0.0.251","MDNS","82","Standard query 0x0000 PTR _googlezone._tcp.local, "QM" question"
"394","2.669669225","192.168.1.104","255.255.255.255","UDP","217","49154 → 6666 Len=175"
"395","2.770027862","Cisco-Li_5b:1c:ce","Broadcast","ARP","42","Who has 192.168.1.101? Tell 192.168.1.1"
"396","4.818312225","Cisco-Li_5b:1c:ce","Broadcast","ARP","42","Who has 192.168.1.101? Tell 192.168.1.1"
"397","5.014584725","192.168.1.118","192.168.1.102","TCP","176","44768 → 8009 [PSH, ACK] Seq=111 Ack=111 Win=501 Len=110 TSval=2258832790 TSecr=5335484 [TCP segment of a reassembled PDU]"
"398","5.019076962","192.168.1.102","192.168.1.118","TCP","176","8009 → 44768 [PSH, ACK] Seq=111 Ack=221 Win=294 Len=110 TSval=5335985 TSecr=2258832790 [TCP segment of a reassembled PDU]"
"399","5.019199287","192.168.1.118","192.168.1.102","TCP","66","44768 → 8009 [ACK] Seq=221 Ack=221 Win=501 Len=0 TSval=2258832795 TSecr=5335985"
"400","5.638928075","192.168.1.104","255.255.255.255","UDP","217","49154 → 6666 Len=175"
"401","8.710401000","192.168.1.104","255.255.255.255","UDP","217","49154 → 6666 Len=175"
