frame.number,_ws.col.Time,_ws.col.Source,_ws.col.Destination,_ws.col.Protocol,frame.len,_ws.col.Info
"1","0.000000000","Cisco-Li_5b:1c:ce","Broadcast","ARP","42","Who has 192.168.1.101? Tell 192.168.1.1"
"2","0.228648675","192.168.1.118","192.168.1.102","TCP","176","44768 → 8009 [PSH, ACK] Seq=1 Ack=1 Win=501 Len=110 TSval=2258888016 TSecr=5341006 [TCP segment of a reassembled PDU]"
"3","0.232677500","192.168.1.102","192.168.1.118","TCP","176","8009 → 44768 [PSH, ACK] Seq=1 Ack=111 Win=294 Len=110 TSval=5341507 TSecr=2258888016 [TCP segment of a reassembled PDU]"
"4","0.232891312","192.168.1.118","192.168.1.102","TCP","66","44768 → 8009 [ACK] Seq=111 Ack=111 Win=501 Len=0 TSval=2258888020 TSecr=5341507"
"5","0.614275662","199.232.37.140","192.168.1.118","TLSv1.2","1409","Application Data, Application Data, Application Data, Application Data"
"6","0.615880812","199.232.37.140","192.168.1.118","TLSv1.2","6173","Application Data, Application Data, Application Data, Application Data, Application Data, Application Data, Application Data"
"7","0.615984312","199.232.37.140","192.168.1.118","TLSv1.2","2770","Application Data, Application Data"
"8","0.616123887","199.232.37.140","192.168.1.118","TLSv1.2","2770","Application Data, Application Data"
"9","0.616160225","199.232.37.140","192.168.1.118","TLSv1.2","1418","Application Data, Application Data, Application Data, Application Data"
"10","0.616727775","192.168.1.118","199.232.37.140","TCP","66","40282 → 443 [ACK] Seq=1 Ack=14211 Win=390 Len=0 TSval=1503502940 TSecr=2787373454"
"11","0.632218862","199.232.37.140","192.168.1.118","TLSv1.2","1418","Application Data [TCP segment of a reassembled PDU]"
"12","0.637610212","199.232.37.140","192.168.1.118","TLSv1.2","16290","Application Data, Application Data, Application Data, Application Data, Application Data, Application Data, Application Data, Application Data, Application Data, Application Data, Application Data, Application Data, Application Data, Application Data, Application Data, Application Data, Application Data, Application Data, Application Data, Application Data"
"13","0.638386400","192.168.1.118","199.232.37.140","TCP","66","40282 → 443 [ACK] Seq=1 Ack=31787 Win=356 Len=0 TSval=1503502961 TSecr=2787373483"
"14","0.642674337","199.232.37.140","192.168.1.118","TLSv1.2","10882","Application Data, Application Data, Application Data, Application Data, Application Data, Application Data, Application Data, Application Data, Application Data, Application Data"
"15","0.645883050","192.168.1.118","199.232.37.140","TCP","66","40282 → 443 [ACK] Seq=1 Ack=42603 Win=272 Len=0 TSval=1503502969 TSecr=2787373483"
"16","0.654974412","192.168.1.118","209.18.47.62","DNS","80","Standard query 0xe1ec A www.redditstatic.com"
"17","0.661512125","199.232.37.140","192.168.1.118","TLSv1.2","1418","Application Data [TCP segment of a reassembled PDU]"
"18","0.668187637","199.232.37.140","192.168.1.118","TLSv1.2","10882","Application Data, Application Data, Application Data, Application Data, Application Data, Application Data, Application Data, Application Data, Application Data, Application Data, Application Data, Application Data"
"19","0.668568562","199.232.37.140","192.168.1.118","TLSv1.2","10882","Application Data, Application Data, Application Data, Application Data, Application Data, Application Data, Application Data, Application Data"
"20","0.669328862","192.168.1.118","199.232.37.140","TCP","66","40282 → 443 [ACK] Seq=1 Ack=65587 Win=93 Len=0 TSval=1503502992 TSecr=2787373489"
"21","0.672812462","199.232.37.140","192.168.1.118","TLSv1.2","8178","Application Data, Application Data, Application Data, Application Data, Application Data, Application Data, Application Data, Application Data, Application Data"
"22","0.673088925","199.232.37.140","192.168.1.118","TLSv1.2","1418","Application Data [TCP segment of a reassembled PDU]"
"23","0.673174712","199.232.37.140","192.168.1.118","TLSv1.2","1149","Application Data, Application Data"
"24","0.674037087","192.168.1.118","199.232.37.140","TCP","66","40282 → 443 [ACK] Seq=1 Ack=76134 Win=11 Len=0 TSval=1503502997 TSecr=2787373489"
"25","0.695278125","209.18.47.62","192.168.1.118","DNS","131","Standard query response 0xe1ec A www.redditstatic.com CNAME reddit.map.fastly.net A 199.232.37.140"
"26","0.695484325","192.168.1.118","209.18.47.62","DNS","80","Standard query 0x91e3 AAAA www.redditstatic.com"
"27","0.696329775","199.232.37.140","192.168.1.118","TLSv1.2","1423","Application Data"
"28","0.699824650","192.168.1.118","199.232.37.140","TCP","66","40282 → 443 [ACK] Seq=1 Ack=77491 Win=1 Len=0 TSval=1503503023 TSecr=2787373499"
"29","0.700940837","192.168.1.118","199.232.37.140","TCP","66","[TCP Window Update] 40282 → 443 [ACK] Seq=1 Ack=77491 Win=269 Len=0 TSval=1503503024 TSecr=2787373499"
"30","0.716188750","209.18.47.62","192.168.1.118","DNS","173","Standard query response 0x91e3 AAAA www.redditstatic.com CNAME reddit.map.fastly.net SOA ns1.fastly.net"
"31","0.717106475","192.168.1.118","199.232.37.140","TCP","74","40304 → 443 [SYN] Seq=0 Win=64240 Len=0 MSS=1460 SACK_PERM=1 TSval=1503503040 TSecr=0 WS=128"
"32","0.746383775","192.168.1.118","199.232.37.140","TCP","74","40306 → 443 [SYN] Seq=0 Win=64240 Len=0 MSS=1460 SACK_PERM=1 TSval=1503503069 TSecr=0 WS=128"
"33","0.746524387","192.168.1.118","199.232.37.140","TCP","74","40308 → 443 [SYN] Seq=0 Win=64240 Len=0 MSS=1460 SACK_PERM=1 TSval=1503503070 TSecr=0 WS=128"
"34","0.747194562","192.168.1.118","199.232.37.140","TCP","74","40310 → 443 [SYN] Seq=0 Win=64240 Len=0 MSS=1460 SACK_PERM=1 TSval=1503503070 TSecr=0 WS=128"
"35","0.747716000","192.168.1.118","209.18.47.62","DNS","84","Standard query 0x55a1 A a.thumbs.redditmedia.com"
"36","0.748801125","192.168.1.118","209.18.47.62","DNS","75","Standard query 0x915a A preview.redd.it"
"37","0.749723725","192.168.1.118","209.18.47.62","DNS","75","Standard query 0x7d48 A preview.redd.it"
"38","0.750866937","192.168.1.118","209.18.47.62","DNS","75","Standard query 0x05d5 A preview.redd.it"
"39","0.751938300","192.168.1.118","209.18.47.62","DNS","75","Standard query 0xb9c8 A preview.redd.it"
"40","0.752422962","199.232.37.140","192.168.1.118","TLSv1.2","1418","Application Data [TCP segment of a reassembled PDU]"
"41","0.754751125","199.232.37.140","192.168.1.118","TLSv1.2","4122","Application Data, Application Data, Application Data"
"42","0.754877037","192.168.1.118","199.232.37.140","TCP","66","40282 → 443 [ACK] Seq=1 Ack=82899 Win=484 Len=0 TSval=1503503078 TSecr=2787373513"
"43","0.755598162","199.232.37.140","192.168.1.118","TLSv1.2","9530","Application Data, Application Data, Application Data, Application Data, Application Data, Application Data, Application Data"
"44","0.755982662","192.168.1.118","199.232.37.140","TCP","66","40282 → 443 [ACK] Seq=1 Ack=92363 Win=411 Len=0 TSval=1503503079 TSecr=2787373513"
"45","0.758062012","199.232.37.140","192.168.1.118","TLSv1.2","2770","Application Data, Application Data"
"46","0.758181062","199.232.37.140","192.168.1.118","TLSv1.2","12229","Application Data, Application Data, Application Data, Application Data, Application Data, Application Data, Application Data, Application Data, Application Data"
"47","0.758214237","199.232.37.140","192.168.1.118","TLSv1.2","1418","Application Data [TCP segment of a reassembled PDU]"
"48","0.762786475","199.232.37.140","192.168.1.118","TCP","74","443 → 40304 [SYN, ACK] Seq=0 Ack=1 Win=27040 Len=0 MSS=1364 SACK_PERM=1 TSval=1116710222 TSecr=1503503040 WS=512"
"49","0.762887162","192.168.1.118","199.232.37.140","TCP","66","40304 → 443 [ACK] Seq=1 Ack=1 Win=64256 Len=0 TSval=1503503086 TSecr=1116710222"
"50","0.762925900","199.232.37.140","192.168.1.118","TLSv1.2","2770","Application Data, Application Data"
"51","0.767478112","199.232.37.140","192.168.1.118","TCP","74","443 → 40308 [SYN, ACK] Seq=0 Ack=1 Win=27040 Len=0 MSS=1364 SACK_PERM=1 TSval=2814395091 TSecr=1503503070 WS=512"
"52","0.767520625","192.168.1.118","199.232.37.140","TCP","66","40308 → 443 [ACK] Seq=1 Ack=1 Win=64256 Len=0 TSval=1503503091 TSecr=2814395091"
"53","0.767548250","199.232.37.140","192.168.1.118","TCP","74","443 → 40306 [SYN, ACK] Seq=0 Ack=1 Win=27040 Len=0 MSS=1364 SACK_PERM=1 TSval=512350682 TSecr=1503503069 WS=512"
"54","0.767585387","192.168.1.118","199.232.37.140","TCP","66","40306 → 443 [ACK] Seq=1 Ack=1 Win=64256 Len=0 TSval=1503503091 TSecr=512350682"
"55","0.768817812","192.168.1.118","199.232.37.140","TCP","66","40282 → 443 [ACK] Seq=1 Ack=111286 Win=264 Len=0 TSval=1503503092 TSecr=2787373513"
"56","0.775339075","209.18.47.62","192.168.1.118","DNS","126","Standard query response 0x7d48 A preview.redd.it CNAME reddit.map.fastly.net A 199.232.37.140"
"57","0.775410387","209.18.47.62","192.168.1.118","DNS","135","Standard query response 0x55a1 A a.thumbs.redditmedia.com CNAME reddit.map.fastly.net A 199.232.37.140"
"58","0.775442862","209.18.47.62","192.168.1.118","DNS","126","Standard query response 0xb9c8 A preview.redd.it CNAME reddit.map.fastly.net A 199.232.37.140"
"59","0.775474187","209.18.47.62","192.168.1.118","DNS","126","Standard query response 0x915a A preview.redd.it CNAME reddit.map.fastly.net A 199.232.37.140"
"60","0.775504912","209.18.47.62","192.168.1.118","DNS","126","Standard query response 0x05d5 A preview.redd.it CNAME reddit.map.fastly.net A 199.232.37.140"
"61","0.775537225","199.232.37.140","192.168.1.118","TCP","74","443 → 40310 [SYN, ACK] Seq=0 Ack=1 Win=27040 Len=0 MSS=1364 SACK_PERM=1 TSval=2812430909 TSecr=1503503070 WS=512"
"62","0.775606437","192.168.1.118","199.232.37.140","TCP","66","40310 → 443 [ACK] Seq=1 Ack=1 Win=64256 Len=0 TSval=1503503099 TSecr=2812430909"
"63","0.775745337","192.168.1.118","209.18.47.62","DNS","75","Standard query 0xc594 AAAA preview.redd.it"
"64","0.775831862","192.168.1.118","209.18.47.62","DNS","84","Standard query 0x1957 AAAA a.thumbs.redditmedia.com"
"65","0.775949925","192.168.1.118","209.18.47.62","DNS","75","Standard query 0xf1b9 AAAA preview.redd.it"
"66","0.776043550","192.168.1.118","209.18.47.62","DNS","75","Standard query 0xedae AAAA preview.redd.it"
"67","0.776133400","192.168.1.118","209.18.47.62","DNS","75","Standard query 0x8d95 AAAA preview.redd.it"
"68","0.780571800","199.232.37.140","192.168.1.118","TLSv1.2","1418","Application Data [TCP segment of a reassembled PDU]"
"69","0.782218000","199.232.37.140","192.168.1.118","TLSv1.2","8178","Application Data, Application Data, Application Data, Application Data, Application Data"
"70","0.783817250","199.232.37.140","192.168.1.118","TLSv1.2","2770","Application Data, Application Data"
"71","0.783919612","199.232.37.140","192.168.1.118","TLSv1.2","9158","Application Data, Application Data, Application Data, Application Data, Application Data, Application Data, Application Data, Application Data, Application Data"
"72","0.786086750","192.168.1.118","199.232.37.140","TLSv1","583","Client Hello"
"73","0.793658187","209.18.47.62","192.168.1.118","DNS","171","Standard query response 0xc594 AAAA preview.redd.it CNAME reddit.map.fastly.net SOA ns1.fastly.net"
"74","0.794567300","209.18.47.62","192.168.1.118","DNS","177","Standard query response 0x1957 AAAA a.thumbs.redditmedia.com CNAME reddit.map.fastly.net SOA ns1.fastly.net"
"75","0.794607825","209.18.47.62","192.168.1.118","DNS","171","Standard query response 0x8d95 AAAA preview.redd.it CNAME reddit.map.fastly.net SOA ns1.fastly.net"
"76","0.795348875","209.18.47.62","192.168.1.118","DNS","171","Standard query response 0xf1b9 AAAA preview.redd.it CNAME reddit.map.fastly.net SOA ns1.fastly.net"
"77","0.795390225","209.18.47.62","192.168.1.118","DNS","171","Standard query response 0xedae AAAA preview.redd.it CNAME reddit.map.fastly.net SOA ns1.fastly.net"
"78","0.802596737","192.168.1.118","199.232.37.140","TLSv1","583","Client Hello"
"79","0.805404737","199.232.37.140","192.168.1.118","TCP","66","443 → 40304 [ACK] Seq=1 Ack=518 Win=28160 Len=0 TSval=1116710236 TSecr=1503503109"
"80","0.808478950","199.232.37.140","192.168.1.118","TLSv1.2","1418","Server Hello"
"81","0.808540925","192.168.1.118","199.232.37.140","TCP","66","40304 → 443 [ACK] Seq=518 Ack=1353 Win=63104 Len=0 TSval=1503503132 TSecr=1116710236"
"82","0.809980062","199.232.37.140","192.168.1.118","TLSv1.2","1952","Certificate, Server Key Exchange, Server Hello Done"
"83","0.810032750","192.168.1.118","199.232.37.140","TCP","66","40304 → 443 [ACK] Seq=518 Ack=3239 Win=61312 Len=0 TSval=1503503133 TSecr=1116710236"
"84","0.818899387","199.232.37.140","192.168.1.118","TCP","66","443 → 40306 [ACK] Seq=1 Ack=518 Win=28160 Len=0 TSval=512350696 TSecr=1503503126"
"85","0.819217812","192.168.1.118","199.232.37.140","TLSv1","583","Client Hello"
"86","0.819423187","192.168.1.118","199.232.37.140","TCP","74","40312 → 443 [SYN] Seq=0 Win=64240 Len=0 MSS=1460 SACK_PERM=1 TSval=1503503143 TSecr=0 WS=128"
"87","0.819505512","192.168.1.118","199.232.37.140","TCP","74","40314 → 443 [SYN] Seq=0 Win=64240 Len=0 MSS=1460 SACK_PERM=1 TSval=1503503143 TSecr=0 WS=128"
"88","0.819579737","192.168.1.118","199.232.37.140","TCP","74","40316 → 443 [SYN] Seq=0 Win=64240 Len=0 MSS=1460 SACK_PERM=1 TSval=1503503143 TSecr=0 WS=128"
"89","0.819981125","199.232.37.140","192.168.1.118","TLSv1.2","3304","Server Hello, Certificate, Server Key Exchange, Server Hello Done"
"90","0.820044275","192.168.1.118","199.232.37.140","TCP","66","40306 → 443 [ACK] Seq=518 Ack=3239 Win=61056 Len=0 TSval=1503503143 TSecr=512350696"
"91","0.820886412","192.168.1.118","199.232.37.140","TCP","66","40282 → 443 [ACK] Seq=1 Ack=132546 Win=98 Len=0 TSval=1503503144 TSecr=2787373520"
"92","0.836010775","192.168.1.118","199.232.37.140","TLSv1","583","Client Hello"
"93","0.836204087","192.168.1.118","199.232.37.140","TCP","74","40318 → 443 [SYN] Seq=0 Win=64240 Len=0 MSS=1460 SACK_PERM=1 TSval=1503503159 TSecr=0 WS=128"
"94","0.836620275","192.168.1.118","199.232.37.140","TCP","74","40320 → 443 [SYN] Seq=0 Win=64240 Len=0 MSS=1460 SACK_PERM=1 TSval=1503503160 TSecr=0 WS=128"
"95","0.837450587","192.168.1.118","209.18.47.62","DNS","82","Standard query 0xf1ad A styles.redditmedia.com"
"96","0.838330612","192.168.1.118","209.18.47.62","DNS","82","Standard query 0x3db4 A styles.redditmedia.com"
"97","0.839158962","192.168.1.118","209.18.47.62","DNS","84","Standard query 0x9132 A b.thumbs.redditmedia.com"
"98","0.839259350","192.168.1.118","199.232.37.140","TLSv1.2","192","Client Key Exchange, Change Cipher Spec, Encrypted Handshake Message"
"99","0.839459325","192.168.1.118","199.232.37.140","TCP","74","40322 → 443 [SYN] Seq=0 Win=64240 Len=0 MSS=1460 SACK_PERM=1 TSval=1503503163 TSecr=0 WS=128"
"100","0.841389900","192.168.1.118","199.232.37.140","TLSv1.2","192","Client Key Exchange, Change Cipher Spec, Encrypted Handshake Message"
"101","0.841452175","199.232.37.140","192.168.1.118","TCP","74","443 → 40312 [SYN, ACK] Seq=0 Ack=1 Win=27040 Len=0 MSS=1364 SACK_PERM=1 TSval=858585426 TSecr=1503503143 WS=512"
"102","0.841550512","192.168.1.118","199.232.37.140","TCP","66","40312 → 443 [ACK] Seq=1 Ack=1 Win=64256 Len=0 TSval=1503503165 TSecr=858585426"
"103","0.852339375","199.232.37.140","192.168.1.118","TCP","74","443 → 40316 [SYN, ACK] Seq=0 Ack=1 Win=27040 Len=0 MSS=1364 SACK_PERM=1 TSval=274182978 TSecr=1503503143 WS=512"
"104","0.852438912","192.168.1.118","199.232.37.140","TCP","66","40316 → 443 [ACK] Seq=1 Ack=1 Win=64256 Len=0 TSval=1503503176 TSecr=274182978"
"105","0.852510425","199.232.37.140","192.168.1.118","TCP","66","443 → 40308 [ACK] Seq=1 Ack=518 Win=28160 Len=0 TSval=2814395111 TSecr=1503503142"
"106","0.852584187","199.232.37.140","192.168.1.118","TCP","74","443 → 40314 [SYN, ACK] Seq=0 Ack=1 Win=27040 Len=0 MSS=1364 SACK_PERM=1 TSval=2812426252 TSecr=1503503143 WS=512"
"107","0.852675575","192.168.1.118","199.232.37.140","TCP","66","40314 → 443 [ACK] Seq=1 Ack=1 Win=64256 Len=0 TSval=1503503176 TSecr=2812426252"
"108","0.852788412","199.232.37.140","192.168.1.118","TLSv1.2","3304","Server Hello, Certificate, Server Key Exchange, Server Hello Done"
"109","0.852886037","192.168.1.118","199.232.37.140","TCP","66","40308 → 443 [ACK] Seq=518 Ack=3239 Win=61056 Len=0 TSval=1503503176 TSecr=2814395112"
"110","0.855658162","199.232.37.140","192.168.1.118","TCP","74","443 → 40318 [SYN, ACK] Seq=0 Ack=1 Win=27040 Len=0 MSS=1364 SACK_PERM=1 TSval=274875844 TSecr=1503503159 WS=512"
"111","0.855755650","192.168.1.118","199.232.37.140","TCP","66","40318 → 443 [ACK] Seq=1 Ack=1 Win=64256 Len=0 TSval=1503503179 TSecr=274875844"
"112","0.857123437","199.232.37.140","192.168.1.118","TCP","74","443 → 40320 [SYN, ACK] Seq=0 Ack=1 Win=27040 Len=0 MSS=1364 SACK_PERM=1 TSval=3252696708 TSecr=1503503160 WS=512"
"113","0.857219325","192.168.1.118","199.232.37.140","TCP","66","40320 → 443 [ACK] Seq=1 Ack=1 Win=64256 Len=0 TSval=1503503180 TSecr=3252696708"
"114","0.857289187","199.232.37.140","192.168.1.118","TCP","66","443 → 40310 [ACK] Seq=1 Ack=518 Win=28160 Len=0 TSval=2812430931 TSecr=1503503159"
"115","0.858856450","199.232.37.140","192.168.1.118","TLSv1.2","3304","Server Hello, Certificate, Server Key Exchange, Server Hello Done"
"116","0.858927650","192.168.1.118","199.232.37.140","TCP","66","40310 → 443 [ACK] Seq=518 Ack=3239 Win=61056 Len=0 TSval=1503503182 TSecr=2812430931"
"117","0.864128937","209.18.47.62","192.168.1.118","DNS","135","Standard query response 0x9132 A b.thumbs.redditmedia.com CNAME reddit.map.fastly.net A 199.232.37.140"
"118","0.864385275","192.168.1.118","209.18.47.62","DNS","84","Standard query 0xe967 AAAA b.thumbs.redditmedia.com"
"119","0.866317512","192.168.1.118","199.232.37.140","TLSv1","583","Client Hello"
"120","0.869955862","209.18.47.62","192.168.1.118","DNS","133","Standard query response 0x3db4 A styles.redditmedia.com CNAME reddit.map.fastly.net A 199.232.37.140"
"121","0.870041050","199.232.37.140","192.168.1.118","TLSv1.2","117","Change Cipher Spec, Encrypted Handshake Message"
"122","0.870119637","209.18.47.62","192.168.1.118","DNS","133","Standard query response 0xf1ad A styles.redditmedia.com CNAME reddit.map.fastly.net A 199.232.37.140"
"123","0.870197762","199.232.37.140","192.168.1.118","TLSv1.2","117","Change Cipher Spec, Encrypted Handshake Message"
"124","0.870269212","199.232.37.140","192.168.1.118","TCP","74","443 → 40322 [SYN, ACK] Seq=0 Ack=1 Win=27040 Len=0 MSS=1364 SACK_PERM=1 TSval=1378166465 TSecr=1503503163 WS=512"
"125","0.870363300","192.168.1.118","199.232.37.140","TCP","66","40322 → 443 [ACK] Seq=1 Ack=1 Win=64256 Len=0 TSval=1503503193 TSecr=1378166465"
"126","0.870567212","192.168.1.118","209.18.47.62","DNS","82","Standard query 0x016b AAAA styles.redditmedia.com"
"127","0.870781375","192.168.1.118","209.18.47.62","DNS","82","Standard query 0x3d6a AAAA styles.redditmedia.com"
"128","0.880743650","209.18.47.62","192.168.1.118","DNS","177","Standard query response 0xe967 AAAA b.thumbs.redditmedia.com CNAME reddit.map.fastly.net SOA ns1.fastly.net"
"129","0.881968375","199.232.37.140","192.168.1.118","TCP","66","443 → 40312 [ACK] Seq=1 Ack=518 Win=28160 Len=0 TSval=858585436 TSecr=1503503189"
"130","0.882825400","192.168.1.118","199.232.37.140","TLSv1","583","Client Hello"
"131","0.883095212","199.232.37.140","192.168.1.118","TLSv1.2","1418","Server Hello"
"132","0.883180037","192.168.1.118","199.232.37.140","TCP","66","40312 → 443 [ACK] Seq=518 Ack=1353 Win=63104 Len=0 TSval=1503503206 TSecr=858585436"
"133","0.887828937","199.232.37.140","192.168.1.118","TLSv1.2","2080","Certificate, Server Key Exchange, Server Hello Done"
"134","0.887946100","192.168.1.118","199.232.37.140","TCP","66","40312 → 443 [ACK] Seq=518 Ack=3367 Win=61184 Len=0 TSval=1503503211 TSecr=858585436"
"135","0.893934175","209.18.47.62","192.168.1.118","DNS","175","Standard query response 0x3d6a AAAA styles.redditmedia.com CNAME reddit.map.fastly.net SOA ns1.fastly.net"
"136","0.895510725","209.18.47.62","192.168.1.118","DNS","175","Standard query response 0x016b AAAA styles.redditmedia.com CNAME reddit.map.fastly.net SOA ns1.fastly.net"
"137","0.899431687","192.168.1.118","199.232.37.140","TLSv1","583","Client Hello"
"138","0.899925037","199.232.37.140","192.168.1.118","TCP","66","443 → 40314 [ACK] Seq=1 Ack=518 Win=28160 Len=0 TSval=2812426267 TSecr=1503503206"
"139","0.901456875","192.168.1.118","199.232.37.140","TLSv1.2","192","Client Key Exchange, Change Cipher Spec, Encrypted Handshake Message"
"140","0.902900275","199.232.37.140","192.168.1.118","TLSv1.2","1418","Server Hello"
"141","0.902986287","192.168.1.118","199.232.37.140","TCP","66","40314 → 443 [ACK] Seq=518 Ack=1353 Win=63104 Len=0 TSval=1503503226 TSecr=2812426267"
"142","0.907570387","199.232.37.140","192.168.1.118","TLSv1.2","2080","Certificate, Server Key Exchange, Server Hello Done"
"143","0.907655050","192.168.1.118","199.232.37.140","TCP","66","40314 → 443 [ACK] Seq=518 Ack=3367 Win=61184 Len=0 TSval=1503503231 TSecr=2812426267"
"144","0.910893375","192.168.1.118","199.232.37.140","TCP","66","40306 → 443 [ACK] Seq=644 Ack=3290 Win=64128 Len=0 TSval=1503503234 TSecr=512350709"
"145","0.910976287","192.168.1.118","199.232.37.140","TCP","66","40304 → 443 [ACK] Seq=644 Ack=3290 Win=64128 Len=0 TSval=1503503234 TSecr=1116710251"
"146","0.917951187","192.168.1.118","199.232.37.140","TLSv1","583","Client Hello"
"147","0.918156912","192.168.1.118","199.232.37.140","TCP","74","40324 → 443 [SYN] Seq=0 Win=64240 Len=0 MSS=1460 SACK_PERM=1 TSval=1503503241 TSecr=0 WS=128"
"148","0.921089650","199.232.37.140","192.168.1.118","TCP","66","443 → 40316 [ACK] Seq=1 Ack=518 Win=28160 Len=0 TSval=274182997 TSecr=1503503223"
"149","0.922666925","199.232.37.140","192.168.1.118","TLSv1.2","117","Change Cipher Spec, Encrypted Handshake Message"
"150","0.922758100","192.168.1.118","199.232.37.140","TCP","66","40310 → 443 [ACK] Seq=644 Ack=3290 Win=64128 Len=0 TSval=1503503246 TSecr=2812430946"
"151","0.922927562","199.232.37.140","192.168.1.118","TLSv1.2","3432","Server Hello, Certificate, Server Key Exchange, Server Hello Done"
"152","0.923009112","192.168.1.118","199.232.37.140","TCP","66","40316 → 443 [ACK] Seq=518 Ack=3367 Win=60928 Len=0 TSval=1503503246 TSecr=274182997"
"153","0.934611025","192.168.1.118","199.232.37.140","TLSv1","583","Client Hello"
"154","0.934811162","192.168.1.118","199.232.37.140","TCP","74","40326 → 443 [SYN] Seq=0 Win=64240 Len=0 MSS=1460 SACK_PERM=1 TSval=1503503258 TSecr=0 WS=128"
"155","0.934925462","192.168.1.118","199.232.37.140","TCP","74","40328 → 443 [SYN] Seq=0 Win=64240 Len=0 MSS=1460 SACK_PERM=1 TSval=1503503258 TSecr=0 WS=128"
"156","0.935497362","192.168.1.118","199.232.37.140","TLSv1.2","256","Application Data"
"157","0.940040812","199.232.37.140","192.168.1.118","TCP","66","443 → 40318 [ACK] Seq=1 Ack=518 Win=28160 Len=0 TSval=274875865 TSecr=1503503241"
"158","0.946860387","199.232.37.140","192.168.1.118","TLSv1.2","3432","Server Hello, Certificate, Server Key Exchange, Server Hello Done"
"159","0.946943575","192.168.1.118","199.232.37.140","TCP","66","40318 → 443 [ACK] Seq=518 Ack=3367 Win=60928 Len=0 TSval=1503503270 TSecr=274875865"
"160","0.950107875","199.232.37.140","192.168.1.118","TCP","74","443 → 40324 [SYN, ACK] Seq=0 Ack=1 Win=27040 Len=0 MSS=1364 SACK_PERM=1 TSval=2812426279 TSecr=1503503241 WS=512"
"161","0.950236287","192.168.1.118","199.232.37.140","TCP","66","40324 → 443 [ACK] Seq=1 Ack=1 Win=64256 Len=0 TSval=1503503273 TSecr=2812426279"
"162","0.951919175","192.168.1.118","199.232.37.140","TLSv1","583","Client Hello"
"163","0.952250900","192.168.1.118","199.232.37.140","TLSv1.2","272","Application Data"
"164","0.954146125","192.168.1.118","199.232.37.140","TLSv1.2","192","Client Key Exchange, Change Cipher Spec, Encrypted Handshake Message"
"165","0.956073375","192.168.1.118","199.232.37.140","TLSv1.2","192","Client Key Exchange, Change Cipher Spec, Encrypted Handshake Message"
"166","0.958014525","192.168.1.118","199.232.37.140","TLSv1.2","192","Client Key Exchange, Change Cipher Spec, Encrypted Handshake Message"
"167","0.959873412","192.168.1.118","199.232.37.140","TLSv1.2","192","Client Key Exchange, Change Cipher Spec, Encrypted Handshake Message"
"168","0.960151375","192.168.1.118","199.232.37.140","TLSv1.2","279","Application Data"
"169","0.961149225","199.232.37.140","192.168.1.118","TCP","74","443 → 40328 [SYN, ACK] Seq=0 Ack=1 Win=27040 Len=0 MSS=1364 SACK_PERM=1 TSval=274183008 TSecr=1503503258 WS=512"
"170","0.961264487","192.168.1.118","199.232.37.140","TCP","66","40328 → 443 [ACK] Seq=1 Ack=1 Win=64256 Len=0 TSval=1503503284 TSecr=274183008"
"171","0.961986025","192.168.1.118","199.232.37.140","TLSv1.2","192","Client Key Exchange, Change Cipher Spec, Encrypted Handshake Message"
"172","0.965939350","199.232.37.140","192.168.1.118","TLSv1.2","5474","Application Data, Application Data, Application Data, Application Data"
"173","0.966084562","192.168.1.118","199.232.37.140","TCP","66","40304 → 443 [ACK] Seq=834 Ack=8698 Win=58752 Len=0 TSval=1503503289 TSecr=1116710275"
"174","0.968051987","199.232.37.140","192.168.1.118","TCP","66","443 → 40320 [ACK] Seq=1 Ack=518 Win=28160 Len=0 TSval=3252696734 TSecr=1503503258"
"175","0.968127437","199.232.37.140","192.168.1.118","TLSv1.2","4175","Application Data, Application Data, Application Data, Application Data"
"176","0.968167525","192.168.1.118","199.232.37.140","TCP","66","40304 → 443 [ACK] Seq=834 Ack=12807 Win=54656 Len=0 TSval=1503503291 TSecr=1116710275"
"177","0.968204975","199.232.37.140","192.168.1.118","TCP","74","443 → 40326 [SYN, ACK] Seq=0 Ack=1 Win=27040 Len=0 MSS=1364 SACK_PERM=1 TSval=2814347995 TSecr=1503503258 WS=512"
"178","0.968254487","192.168.1.118","199.232.37.140","TCP","66","40326 → 443 [ACK] Seq=1 Ack=1 Win=64256 Len=0 TSval=1503503291 TSecr=2814347995"
"179","0.968292800","199.232.37.140","192.168.1.118","TLSv1.2","3432","Server Hello, Certificate, Server Key Exchange, Server Hello Done"
"180","0.968316062","192.168.1.118","199.232.37.140","TCP","66","40320 → 443 [ACK] Seq=518 Ack=3367 Win=60928 Len=0 TSval=1503503291 TSecr=3252696734"
"181","0.971968650","199.232.37.140","192.168.1.118","TCP","66","443 → 40322 [ACK] Seq=1 Ack=518 Win=28160 Len=0 TSval=1378166571 TSecr=1503503275"
"182","0.972047225","199.232.37.140","192.168.1.118","TLSv1.2","2937","Application Data, Application Data, Application Data"
"183","0.972091987","192.168.1.118","199.232.37.140","TCP","66","40306 → 443 [ACK] Seq=850 Ack=6161 Win=61312 Len=0 TSval=1503503295 TSecr=512350735"
"184","0.977050212","199.232.37.140","192.168.1.118","TLSv1.2","3336","Server Hello, Certificate, Server Key Exchange, Server Hello Done"
"185","0.977095962","192.168.1.118","199.232.37.140","TCP","66","40322 → 443 [ACK] Seq=518 Ack=3271 Win=61056 Len=0 TSval=1503503300 TSecr=1378166572"
"186","0.983472850","192.168.1.118","199.232.37.140","TLSv1","583","Client Hello"
"187","0.985465312","192.168.1.118","199.232.37.140","TLSv1.2","192","Client Key Exchange, Change Cipher Spec, Encrypted Handshake Message"
"188","0.985691387","199.232.37.140","192.168.1.118","TLSv1.2","117","Change Cipher Spec, Encrypted Handshake Message"
"189","0.987153512","199.232.37.140","192.168.1.118","TLSv1.2","745","Application Data, Application Data"
"190","0.987195275","199.232.37.140","192.168.1.118","TLSv1.2","117","Change Cipher Spec, Encrypted Handshake Message"
"191","0.987234150","192.168.1.118","199.232.37.140","TCP","66","40308 → 443 [ACK] Seq=644 Ack=3290 Win=64128 Len=0 TSval=1503503310 TSecr=2814395148"
"192","0.987269962","199.232.37.140","192.168.1.118","TLSv1.2","117","Change Cipher Spec, Encrypted Handshake Message"
"193","0.987307975","192.168.1.118","199.232.37.140","TCP","66","40314 → 443 [ACK] Seq=644 Ack=3418 Win=64128 Len=0 TSval=1503503310 TSecr=2812426288"
"194","0.988421612","199.232.37.140","192.168.1.118","TLSv1.2","117","Change Cipher Spec, Encrypted Handshake Message"
"195","0.988459600","192.168.1.118","199.232.37.140","TCP","66","40312 → 443 [ACK] Seq=644 Ack=3418 Win=64128 Len=0 TSval=1503503312 TSecr=858585462"
"196","0.991373275","199.232.37.140","192.168.1.118","TLSv1.2","117","Change Cipher Spec, Encrypted Handshake Message"
"197","1.000466962","199.232.37.140","192.168.1.118","TCP","66","443 → 40324 [ACK] Seq=1 Ack=518 Win=28160 Len=0 TSval=2812426292 TSecr=1503503307"
"198","1.002290137","192.168.1.118","199.232.37.140","TLSv1","583","Client Hello"
"199","1.004352675","199.232.37.140","192.168.1.118","TLSv1.2","117","Change Cipher Spec, Encrypted Handshake Message"
"200","1.004439812","199.232.37.140","192.168.1.118","TLSv1.2","3314","Server Hello, Certificate, Server Key Exchange, Server Hello Done"
"201","1.004496612","192.168.1.118","199.232.37.140","TCP","66","40324 → 443 [ACK] Seq=518 Ack=3249 Win=61056 Len=0 TSval=1503503328 TSecr=2812426292"
"202","1.024052425","Cisco-Li_5b:1c:ce","Broadcast","ARP","42","Who has 192.168.1.101? Tell 192.168.1.1"
"203","1.024856050","199.232.37.140","192.168.1.118","TCP","66","443 → 40326 [ACK] Seq=1 Ack=518 Win=28160 Len=0 TSval=2814348010 TSecr=1503503325"
"204","1.025126725","192.168.1.118","199.232.37.140","TLSv1","583","Client Hello"
"205","1.025873800","192.168.1.118","199.232.37.140","TCP","66","40316 → 443 [ACK] Seq=644 Ack=3418 Win=64128 Len=0 TSval=1503503349 TSecr=274183014"
"206","1.026872887","199.232.37.140","192.168.1.118","TLSv1.2","3336","Server Hello, Certificate, Server Key Exchange, Server Hello Done"
"207","1.026904925","192.168.1.118","199.232.37.140","TCP","66","40326 → 443 [ACK] Seq=518 Ack=3271 Win=61056 Len=0 TSval=1503503350 TSecr=2814348011"
"208","1.027862537","192.168.1.118","199.232.37.140","TCP","66","40310 → 443 [ACK] Seq=857 Ack=3969 Win=63488 Len=0 TSval=1503503351 TSecr=2812430963"
"209","1.031857600","192.168.1.118","199.232.37.140","TCP","66","40318 → 443 [ACK] Seq=644 Ack=3418 Win=64128 Len=0 TSval=1503503355 TSecr=274875877"
"210","1.039790050","192.168.1.118","199.232.37.140","TLSv1.2","192","Client Key Exchange, Change Cipher Spec, Encrypted Handshake Message"
"211","1.040211912","192.168.1.118","199.232.37.140","TLSv1.2","280","Application Data"
"212","1.040430050","192.168.1.118","199.232.37.140","TLSv1.2","371","Application Data"
"213","1.040624500","192.168.1.118","199.232.37.140","TLSv1.2","375","Application Data"
"214","1.040817862","192.168.1.118","199.232.37.140","TLSv1.2","371","Application Data"
"215","1.041150787","192.168.1.118","199.232.37.140","TLSv1.2","341","Application Data"
"216","1.042994050","192.168.1.118","199.232.37.140","TLSv1.2","192","Client Key Exchange, Change Cipher Spec, Encrypted Handshake Message"
"217","1.043263875","192.168.1.118","199.232.37.140","TLSv1.2","341","Application Data"
"218","1.045084400","192.168.1.118","199.232.37.140","TLSv1.2","192","Client Key Exchange, Change Cipher Spec, Encrypted Handshake Message"
"219","1.045316400","192.168.1.118","199.232.37.140","TCP","74","40330 → 443 [SYN] Seq=0 Win=64240 Len=0 MSS=1460 SACK_PERM=1 TSval=1503503368 TSecr=0 WS=128"
"220","1.045714625","192.168.1.118","199.232.37.140","TCP","74","40332 → 443 [SYN] Seq=0 Win=64240 Len=0 MSS=1460 SACK_PERM=1 TSval=1503503369 TSecr=0 WS=128"
"221","1.045820375","192.168.1.118","199.232.37.140","TCP","74","40334 → 443 [SYN] Seq=0 Win=64240 Len=0 MSS=1460 SACK_PERM=1 TSval=1503503369 TSecr=0 WS=128"
"222","1.046417000","192.168.1.118","209.18.47.62","DNS","77","Standard query 0x5141 A s.redditmedia.com"
"223","1.055974512","199.232.37.140","192.168.1.118","TCP","66","443 → 40328 [ACK] Seq=1 Ack=518 Win=28160 Len=0 TSval=274183032 TSecr=1503503348"
"224","1.058064450","199.232.37.140","192.168.1.118","TLSv1.2","1418","Server Hello"
"225","1.058136550","192.168.1.118","199.232.37.140","TCP","66","40328 → 443 [ACK] Seq=518 Ack=1353 Win=63104 Len=0 TSval=1503503381 TSecr=274183032"
"226","1.059550412","199.232.37.140","192.168.1.118","TLSv1.2","1962","Certificate, Server Key Exchange, Server Hello Done"
"227","1.059626975","192.168.1.118","199.232.37.140","TCP","66","40328 → 443 [ACK] Seq=518 Ack=3249 Win=61312 Len=0 TSval=1503503383 TSecr=274183032"
"228","1.061612837","192.168.1.118","199.232.37.140","TLSv1.2","192","Client Key Exchange, Change Cipher Spec, Encrypted Handshake Message"
"229","1.065877275","199.232.37.140","192.168.1.118","TLSv1.2","117","Change Cipher Spec, Encrypted Handshake Message"
"230","1.065969700","192.168.1.118","199.232.37.140","TCP","66","40322 → 443 [ACK] Seq=644 Ack=3322 Win=64128 Len=0 TSval=1503503389 TSecr=1378166666"
"231","1.066292462","192.168.1.118","199.232.37.140","TLSv1.2","295","Application Data"
"232","1.067912262","192.168.1.118","199.232.37.140","TCP","66","[TCP Window Update] 40282 → 443 [ACK] Seq=1 Ack=132546 Win=310 Len=0 TSval=1503503391 TSecr=2787373520"
"233","1.074193875","199.232.37.140","192.168.1.118","TLSv1.2","2770","Application Data, Application Data"
"234","1.074292487","192.168.1.118","199.232.37.140","TCP","66","40316 → 443 [ACK] Seq=949 Ack=6122 Win=61440 Len=0 TSval=1503503397 TSecr=274183035"
"235","1.076323812","199.232.37.140","192.168.1.118","TLSv1.2","2770","Application Data, Application Data"
"236","1.076418200","192.168.1.118","199.232.37.140","TCP","66","40308 → 443 [ACK] Seq=858 Ack=5994 Win=61440 Len=0 TSval=1503503400 TSecr=2814395168"
"237","1.080453862","199.232.37.140","192.168.1.118","TLSv1.2","827","Application Data, Application Data"
"238","1.080529250","192.168.1.118","199.232.37.140","TCP","66","40316 → 443 [ACK] Seq=949 Ack=6883 Win=63104 Len=0 TSval=1503503404 TSecr=274183035"
"239","1.080616550","199.232.37.140","192.168.1.118","TLSv1.2","1418","Application Data [TCP segment of a reassembled PDU]"
"240","1.080688400","192.168.1.118","199.232.37.140","TCP","66","40308 → 443 [ACK] Seq=858 Ack=7346 Win=63104 Len=0 TSval=1503503404 TSecr=2814395168"
"241","1.081895212","199.232.37.140","192.168.1.118","TLSv1.2","1267","Application Data, Application Data"
"242","1.081970887","192.168.1.118","199.232.37.140","TCP","66","40308 → 443 [ACK] Seq=858 Ack=8547 Win=63104 Len=0 TSval=1503503405 TSecr=2814395168"
"243","1.082068962","199.232.37.140","192.168.1.118","TLSv1.2","1418","Application Data"
"244","1.082161012","192.168.1.118","199.232.37.140","TCP","66","40314 → 443 [ACK] Seq=953 Ack=4770 Win=63104 Len=0 TSval=1503503405 TSecr=2812426308"
"245","1.082713300","192.168.1.118","199.232.37.140","TLSv1.2","376","Application Data"
"246","1.085191187","199.232.37.140","192.168.1.118","TLSv1.2","1845","Application Data, Application Data"
"247","1.085270850","192.168.1.118","199.232.37.140","TCP","66","40314 → 443 [ACK] Seq=953 Ack=6549 Win=61440 Len=0 TSval=1503503408 TSecr=2812426308"
"248","1.085347737","199.232.37.140","192.168.1.118","TCP","74","443 → 40330 [SYN, ACK] Seq=0 Ack=1 Win=27040 Len=0 MSS=1364 SACK_PERM=1 TSval=275613166 TSecr=1503503368 WS=512"
"249","1.085475787","192.168.1.118","199.232.37.140","TCP","66","40330 → 443 [ACK] Seq=1 Ack=1 Win=64256 Len=0 TSval=1503503409 TSecr=275613166"
"250","1.085607237","199.232.37.140","192.168.1.118","TLSv1.2","4122","Application Data, Application Data, Application Data"
"251","1.085701125","192.168.1.118","199.232.37.140","TCP","66","40318 → 443 [ACK] Seq=919 Ack=7474 Win=60160 Len=0 TSval=1503503409 TSecr=274875897"
"252","1.086018937","199.232.37.140","192.168.1.118","TLSv1.2","117","Change Cipher Spec, Encrypted Handshake Message"
"253","1.086173312","199.232.37.140","192.168.1.118","TCP","74","443 → 40332 [SYN, ACK] Seq=0 Ack=1 Win=27040 Len=0 MSS=1364 SACK_PERM=1 TSval=2811391828 TSecr=1503503369 WS=512"
"254","1.086291862","192.168.1.118","199.232.37.140","TCP","66","40332 → 443 [ACK] Seq=1 Ack=1 Win=64256 Len=0 TSval=1503503409 TSecr=2811391828"
"255","1.086377550","199.232.37.140","192.168.1.118","TLSv1.2","3326","Application Data, Application Data, Application Data"
"256","1.086469625","192.168.1.118","199.232.37.140","TCP","66","40312 → 443 [ACK] Seq=949 Ack=6678 Win=60928 Len=0 TSval=1503503410 TSecr=858585482"
"257","1.086555000","199.232.37.140","192.168.1.118","TLSv1.2","9530","Application Data, Application Data, Application Data, Application Data, Application Data, Application Data, Application Data"
"258","1.086644250","192.168.1.118","199.232.37.140","TCP","66","40318 → 443 [ACK] Seq=919 Ack=16938 Win=50816 Len=0 TSval=1503503410 TSecr=274875897"
"259","1.086692437","199.232.37.140","192.168.1.118","TLSv1.2","1418","Application Data"
"260","1.086893887","199.232.37.140","192.168.1.118","TCP","74","443 → 40334 [SYN, ACK] Seq=0 Ack=1 Win=27040 Len=0 MSS=1364 SACK_PERM=1 TSval=3251947105 TSecr=1503503369 WS=512"
"261","1.086962912","192.168.1.118","199.232.37.140","TCP","66","40334 → 443 [ACK] Seq=1 Ack=1 Win=64256 Len=0 TSval=1503503410 TSecr=3251947105"
"262","1.087032412","199.232.37.140","192.168.1.118","TLSv1.2","5474","Application Data, Application Data, Application Data, Application Data"
"263","1.088361887","199.232.37.140","192.168.1.118","TLSv1.2","117","Change Cipher Spec, Encrypted Handshake Message"
"264","1.088418125","209.18.47.62","192.168.1.118","DNS","128","Standard query response 0x5141 A s.redditmedia.com CNAME reddit.map.fastly.net A 199.232.37.140"
"265","1.088479425","199.232.37.140","192.168.1.118","TLSv1.2","117","Change Cipher Spec, Encrypted Handshake Message"
"266","1.088520137","199.232.37.140","192.168.1.118","TLSv1.2","6826","Application Data, Application Data, Application Data, Application Data, Application Data"
"267","1.088736625","192.168.1.118","209.18.47.62","DNS","77","Standard query 0x1589 AAAA s.redditmedia.com"
"268","1.091694787","199.232.37.140","192.168.1.118","TLSv1.2","1418","Application Data"
"269","1.094169925","199.232.37.140","192.168.1.118","TLSv1.2","5474","Application Data, Application Data, Application Data, Application Data"
"270","1.094342350","199.232.37.140","192.168.1.118","TLSv1.2","6826","Application Data, Application Data, Application Data, Application Data, Application Data"
"271","1.101687475","192.168.1.118","199.232.37.140","TLSv1","583","Client Hello"
"272","1.115584800","209.18.47.62","192.168.1.118","DNS","170","Standard query response 0x1589 AAAA s.redditmedia.com CNAME reddit.map.fastly.net SOA ns1.fastly.net"
"273","1.118232825","192.168.1.118","199.232.37.140","TLSv1","583","Client Hello"
"274","1.118506312","199.232.37.140","192.168.1.118","TLSv1.2","21698","Application Data, Application Data, Application Data, Application Data, Application Data, Application Data, Application Data, Application Data, Application Data, Application Data, Application Data, Application Data, Application Data, Application Data, Application Data"
"275","1.126901575","192.168.1.118","199.232.37.140","TCP","66","40320 → 443 [ACK] Seq=919 Ack=16938 Win=50688 Len=0 TSval=1503503450 TSecr=3252696761"
"276","1.127014862","192.168.1.118","199.232.37.140","TCP","66","40326 → 443 [ACK] Seq=644 Ack=3322 Win=64128 Len=0 TSval=1503503450 TSecr=2814348022"
"277","1.127280000","199.232.37.140","192.168.1.118","TLSv1.2","3989","Application Data, Application Data, Application Data, Application Data"
"278","1.127360437","199.232.37.140","192.168.1.118","TLSv1.2","5474","Application Data, Application Data, Application Data, Application Data"
"279","1.128425475","199.232.37.140","192.168.1.118","TCP","66","443 → 40330 [ACK] Seq=1 Ack=518 Win=28160 Len=0 TSval=275613180 TSecr=1503503425"
"280","1.128562100","199.232.37.140","192.168.1.118","TLSv1.2","3336","Server Hello, Certificate, Server Key Exchange, Server Hello Done"
"281","1.128640450","192.168.1.118","199.232.37.140","TCP","66","40330 → 443 [ACK] Seq=518 Ack=3271 Win=61056 Len=0 TSval=1503503452 TSecr=275613180"
"282","1.128900937","192.168.1.118","199.232.37.140","TCP","66","40328 → 443 [ACK] Seq=644 Ack=3300 Win=64128 Len=0 TSval=1503503452 TSecr=274183039"
"283","1.128981137","192.168.1.118","199.232.37.140","TCP","66","40324 → 443 [ACK] Seq=644 Ack=3300 Win=64128 Len=0 TSval=1503503452 TSecr=2812426309"
"284","1.131890737","192.168.1.118","199.232.37.140","TCP","66","40322 → 443 [ACK] Seq=873 Ack=16842 Win=50688 Len=0 TSval=1503503455 TSecr=1378166691"
"285","1.134763050","192.168.1.118","199.232.37.140","TLSv1","583","Client Hello"
"286","1.134883162","192.168.1.118","199.232.37.140","TCP","66","40316 → 443 [ACK] Seq=1259 Ack=10806 Win=60288 Len=0 TSval=1503503458 TSecr=274183046"
"287","1.135235650","192.168.1.118","199.232.37.140","TCP","66","40318 → 443 [ACK] Seq=919 Ack=43978 Win=23808 Len=0 TSval=1503503458 TSecr=274875907"
"288","1.135573812","192.168.1.118","199.232.37.140","TLSv1.2","293","Application Data"
"289","1.135920400","192.168.1.118","199.232.37.140","TLSv1.2","295","Application Data"
"290","1.136151975","192.168.1.118","199.232.37.140","TLSv1.2","293","Application Data"
"291","1.138035712","192.168.1.118","199.232.37.140","TLSv1.2","192","Client Key Exchange, Change Cipher Spec, Encrypted Handshake Message"
"292","1.138301575","192.168.1.118","199.232.37.140","TCP","74","40336 → 443 [SYN] Seq=0 Win=64240 Len=0 MSS=1460 SACK_PERM=1 TSval=1503503461 TSecr=0 WS=128"
"293","1.141315562","192.168.1.118","199.232.37.140","TLSv1.2","373","Application Data"
"294","1.143637350","192.168.1.118","199.232.37.140","TLSv1.2","377","Application Data"
"295","1.143761350","192.168.1.118","199.232.37.140","TLSv1.2","376","Application Data"
"296","1.146397675","199.232.37.140","192.168.1.118","TLSv1.2","1418","Application Data [TCP segment of a reassembled PDU]"
"297","1.146486412","192.168.1.118","199.232.37.140","TCP","66","40320 → 443 [ACK] Seq=919 Ack=18290 Win=49408 Len=0 TSval=1503503470 TSecr=3252696780"
"298","1.153677062","199.232.37.140","192.168.1.118","TLSv1.2","8178","Application Data, Application Data, Application Data, Application Data, Application Data"
"299","1.153757725","192.168.1.118","199.232.37.140","TCP","66","40320 → 443 [ACK] Seq=919 Ack=26402 Win=52864 Len=0 TSval=1503503477 TSecr=3252696780"
"300","1.153968525","199.232.37.140","192.168.1.118","TCP","66","443 → 40332 [ACK] Seq=1 Ack=518 Win=28160 Len=0 TSval=2811391847 TSecr=1503503441"
"301","1.154174350","199.232.37.140","192.168.1.118","TLSv1.2","3336","Server Hello, Certificate, Server Key Exchange, Server Hello Done"
"302","1.154255400","192.168.1.118","199.232.37.140","TCP","66","40332 → 443 [ACK] Seq=518 Ack=3271 Win=61056 Len=0 TSval=1503503477 TSecr=2811391848"
"303","1.154345800","199.232.37.140","192.168.1.118","TLSv1.2","8178","Application Data, Application Data, Application Data, Application Data, Application Data, Application Data"
"304","1.154427362","192.168.1.118","199.232.37.140","TCP","66","40320 → 443 [ACK] Seq=919 Ack=34514 Win=44800 Len=0 TSval=1503503478 TSecr=3252696780"
"305","1.155589387","199.232.37.140","192.168.1.118","TLSv1.2","1418","Application Data [TCP segment of a reassembled PDU]"
"306","1.155646562","199.232.37.140","192.168.1.118","TLSv1.2","1418","Application Data [TCP segment of a reassembled PDU]"
"307","1.155721562","192.168.1.118","199.232.37.140","TCP","66","40320 → 443 [ACK] Seq=919 Ack=35866 Win=43520 Len=0 TSval=1503503479 TSecr=3252696780"
"308","1.156287987","199.232.37.140","192.168.1.118","TLSv1.2","13586","Application Data, Application Data, Application Data, Application Data, Application Data, Application Data, Application Data, Application Data, Application Data, Application Data"
"309","1.156352487","199.232.37.140","192.168.1.118","TLSv1.2","5474","Application Data, Application Data, Application Data, Application Data"
"310","1.156421112","192.168.1.118","199.232.37.140","TCP","66","40322 → 443 [ACK] Seq=873 Ack=22250 Win=56960 Len=0 TSval=1503503480 TSecr=1378166752"
"311","1.156814837","192.168.1.118","199.232.37.140","TLSv1.2","192","Client Key Exchange, Change Cipher Spec, Encrypted Handshake Message"
"312","1.157003387","192.168.1.118","199.232.37.140","TCP","66","40318 → 443 [ACK] Seq=919 Ack=58850 Win=8960 Len=0 TSval=1503503480 TSecr=274875918"
"313","1.157684812","199.232.37.140","192.168.1.118","TLSv1.2","2248","Application Data, Application Data"
"314","1.157787912","199.232.37.140","192.168.1.118","TLSv1.2","4122","Application Data, Application Data, Application Data"
"315","1.157865025","192.168.1.118","199.232.37.140","TCP","66","40322 → 443 [ACK] Seq=873 Ack=26306 Win=52992 Len=0 TSval=1503503481 TSecr=1378166752"
"316","1.158344750","199.232.37.140","192.168.1.118","TLSv1.2","6826","Application Data, Application Data, Application Data, Application Data"
"317","1.158410950","192.168.1.118","199.232.37.140","TCP","66","40322 → 443 [ACK] Seq=873 Ack=33066 Win=46336 Len=0 TSval=1503503482 TSecr=1378166752"
"318","1.158447975","199.232.37.140","192.168.1.118","TLSv1.2","8178","Application Data, Application Data, Application Data, Application Data, Application Data, Application Data"
"319","1.158521750","192.168.1.118","199.232.37.140","TCP","66","40326 → 443 [ACK] Seq=873 Ack=11434 Win=56064 Len=0 TSval=1503503482 TSecr=2814348043"
"320","1.158833375","192.168.1.118","199.232.37.140","TCP","66","40318 → 443 [ACK] Seq=919 Ack=61032 Win=6784 Len=0 TSval=1503503482 TSecr=274875918"
"321","1.159873437","199.232.37.140","192.168.1.118","TLSv1.2","1418","Application Data [TCP segment of a reassembled PDU]"
"322","1.159932475","192.168.1.118","199.232.37.140","TCP","66","40326 → 443 [ACK] Seq=873 Ack=12786 Win=54784 Len=0 TSval=1503503483 TSecr=2814348043"
"323","1.160454012","199.232.37.140","192.168.1.118","TCP","74","443 → 40336 [SYN, ACK] Seq=0 Ack=1 Win=27040 Len=0 MSS=1364 SACK_PERM=1 TSval=272678504 TSecr=1503503461 WS=512"
"324","1.160552787","192.168.1.118","199.232.37.140","TCP","66","40336 → 443 [ACK] Seq=1 Ack=1 Win=64256 Len=0 TSval=1503503484 TSecr=272678504"
"325","1.160650512","199.232.37.140","192.168.1.118","TCP","66","443 → 40334 [ACK] Seq=1 Ack=518 Win=28160 Len=0 TSval=3251947126 TSecr=1503503458"
"326","1.160757812","199.232.37.140","192.168.1.118","TLSv1.2","4122","Application Data, Application Data, Application Data"
"327","1.160820975","192.168.1.118","199.232.37.140","TCP","66","40326 → 443 [ACK] Seq=873 Ack=16842 Win=50816 Len=0 TSval=1503503484 TSecr=2814348043"
"328","1.160876737","199.232.37.140","192.168.1.118","TLSv1.2","13586","Application Data, Application Data, Application Data, Application Data, Application Data, Application Data, Application Data, Application Data, Application Data, Application Data"
"329","1.160953537","192.168.1.118","199.232.37.140","TCP","66","40324 → 443 [ACK] Seq=871 Ack=16820 Win=50688 Len=0 TSval=1503503484 TSecr=2812426330"
"330","1.162021150","199.232.37.140","192.168.1.118","TLSv1.2","2770","Application Data, Application Data"
"331","1.162096112","192.168.1.118","199.232.37.140","TCP","66","40328 → 443 [ACK] Seq=871 Ack=6004 Win=61440 Len=0 TSval=1503503485 TSecr=274183056"
"332","1.162458787","199.232.37.140","192.168.1.118","TLSv1.2","117","Change Cipher Spec, Encrypted Handshake Message"
"333","1.162563825","199.232.37.140","192.168.1.118","TLSv1.2","3336","Server Hello, Certificate, Server Key Exchange, Server Hello Done"
"334","1.162624012","192.168.1.118","199.232.37.140","TCP","66","40334 → 443 [ACK] Seq=518 Ack=3271 Win=61056 Len=0 TSval=1503503486 TSecr=3251947126"
"335","1.162709375","199.232.37.140","192.168.1.118","TLSv1.2","10882","Application Data, Application Data, Application Data, Application Data, Application Data, Application Data, Application Data, Application Data"
"336","1.162776387","192.168.1.118","199.232.37.140","TCP","66","40328 → 443 [ACK] Seq=871 Ack=16820 Win=50688 Len=0 TSval=1503503486 TSecr=274183056"
"337","1.162812975","199.232.37.140","192.168.1.118","TLSv1.2","2770","Application Data, Application Data"
"338","1.162894250","192.168.1.118","199.232.37.140","TCP","66","40320 → 443 [ACK] Seq=919 Ack=38570 Win=40832 Len=0 TSval=1503503486 TSecr=3252696780"
"339","1.164036362","199.232.37.140","192.168.1.118","TLSv1.2","5474","Application Data, Application Data, Application Data, Application Data"
"340","1.164097575","192.168.1.118","199.232.37.140","TCP","66","40322 → 443 [ACK] Seq=873 Ack=38474 Win=47616 Len=0 TSval=1503503487 TSecr=1378166752"
"341","1.164135875","199.232.37.140","192.168.1.118","TLSv1.2","2770","Application Data, Application Data"
"342","1.165640125","199.232.37.140","192.168.1.118","TLSv1.2","1418","Application Data [TCP segment of a reassembled PDU]"
"343","1.166762200","199.232.37.140","192.168.1.118","TLSv1.2","1418","Application Data [TCP segment of a reassembled PDU]"
"344","1.166788075","199.232.37.140","192.168.1.118","TLSv1.2","2770","Application Data, Application Data"
"345","1.166824837","192.168.1.118","199.232.37.140","TCP","66","40322 → 443 [ACK] Seq=873 Ack=41178 Win=44928 Len=0 TSval=1503503490 TSecr=1378166756"
"346","1.170945600","199.232.37.140","192.168.1.118","TLSv1.2","1418","Application Data [TCP segment of a reassembled PDU]"
"347","1.170985025","192.168.1.118","199.232.37.140","TCP","66","40322 → 443 [ACK] Seq=873 Ack=42530 Win=43648 Len=0 TSval=1503503494 TSecr=1378166761"
"348","1.173521525","199.232.37.140","192.168.1.118","TLSv1.2","1418","Application Data [TCP segment of a reassembled PDU]"
"349","1.173563837","192.168.1.118","199.232.37.140","TCP","66","40322 → 443 [ACK] Seq=873 Ack=43882 Win=42368 Len=0 TSval=1503503497 TSecr=1378166761"
"350","1.177441475","192.168.1.118","199.232.37.140","TLSv1","583","Client Hello"
"351","1.179441712","192.168.1.118","199.232.37.140","TLSv1.2","192","Client Key Exchange, Change Cipher Spec, Encrypted Handshake Message"
"352","1.179600187","192.168.1.118","199.232.37.140","TCP","66","[TCP Window Update] 40318 → 443 [ACK] Seq=919 Ack=61032 Win=64128 Len=0 TSval=1503503503 TSecr=274875918"
"353","1.179713175","192.168.1.118","199.232.37.140","TCP","66","40320 → 443 [ACK] Seq=919 Ack=43978 Win=64128 Len=0 TSval=1503503503 TSecr=3252696781"
"354","1.180199000","192.168.1.118","199.232.37.140","TLSv1.2","295","Application Data"
"355","1.197458887","199.232.37.140","192.168.1.118","TLSv1.2","1418","Application Data"
"356","1.197543087","192.168.1.118","199.232.37.140","TCP","66","40314 → 443 [ACK] Seq=1260 Ack=7901 Win=63104 Len=0 TSval=1503503521 TSecr=2812426338"
"357","1.204293400","199.232.37.140","192.168.1.118","TLSv1.2","1229","Application Data, Application Data"
"358","1.204370237","192.168.1.118","199.232.37.140","TCP","66","40314 → 443 [ACK] Seq=1260 Ack=9064 Win=63104 Len=0 TSval=1503503527 TSecr=2812426338"
"359","1.204487437","199.232.37.140","192.168.1.118","TLSv1.2","1418","Application Data [TCP segment of a reassembled PDU]"
"360","1.204561850","192.168.1.118","199.232.37.140","TCP","66","40328 → 443 [ACK] Seq=871 Ack=18172 Win=63104 Len=0 TSval=1503503528 TSecr=274183067"
"361","1.213922850","199.232.37.140","192.168.1.118","TLSv1.2","372","Application Data"
"362","1.213999212","192.168.1.118","199.232.37.140","TCP","66","40328 → 443 [ACK] Seq=871 Ack=18478 Win=63104 Len=0 TSval=1503503537 TSecr=274183067"
"363","1.214087000","199.232.37.140","192.168.1.118","TLSv1.2","1418","Application Data [TCP segment of a reassembled PDU]"
"364","1.214164800","192.168.1.118","199.232.37.140","TCP","66","40320 → 443 [ACK] Seq=919 Ack=45330 Win=66816 Len=0 TSval=1503503537 TSecr=3252696793"
"365","1.214277800","199.232.37.140","192.168.1.118","TLSv1.2","1418","Application Data [TCP segment of a reassembled PDU]"
"366","1.214351800","192.168.1.118","199.232.37.140","TCP","66","40322 → 443 [ACK] Seq=873 Ack=45234 Win=66816 Len=0 TSval=1503503537 TSecr=1378166797"
"367","1.214576562","199.232.37.140","192.168.1.118","TLSv1.2","3944","Application Data, Application Data, Application Data, Application Data"
"368","1.214671025","192.168.1.118","199.232.37.140","TCP","66","40312 → 443 [ACK] Seq=1260 Ack=10556 Win=60288 Len=0 TSval=1503503538 TSecr=858585515"
"369","1.214738925","199.232.37.140","192.168.1.118","TLSv1.2","654","Application Data"
"370","1.214864025","199.232.37.140","192.168.1.118","TLSv1.2","3359","Application Data, Application Data, Application Data"
"371","1.214971087","199.232.37.140","192.168.1.118","TCP","66","443 → 40332 [ACK] Seq=3271 Ack=644 Win=28160 Len=0 TSval=2811391861 TSecr=1503503480"
"372","1.215057375","199.232.37.140","192.168.1.118","TLSv1.2","117","Change Cipher Spec, Encrypted Handshake Message"
"373","1.215108575","199.232.37.140","192.168.1.118","TLSv1.2","5474","Application Data, Application Data, Application Data, Application Data"
"374","1.215181887","192.168.1.118","199.232.37.140","TCP","66","40326 → 443 [ACK] Seq=873 Ack=22250 Win=56960 Len=0 TSval=1503503538 TSecr=2814348055"
"375","1.215230125","199.232.37.140","192.168.1.118","TLSv1.2","5474","Application Data, Application Data, Application Data, Application Data"
"376","1.215308125","192.168.1.118","199.232.37.140","TCP","66","40322 → 443 [ACK] Seq=873 Ack=50642 Win=70144 Len=0 TSval=1503503538 TSecr=1378166797"
"377","1.215357162","199.232.37.140","192.168.1.118","TLSv1.2","16290","Application Data, Application Data, Application Data, Application Data, Application Data, Application Data, Application Data, Application Data, Application Data, Application Data, Application Data"
"378","1.215446137","192.168.1.118","199.232.37.140","TCP","66","40324 → 443 [ACK] Seq=871 Ack=33044 Win=40576 Len=0 TSval=1503503539 TSecr=2812426341"
"379","1.215493037","199.232.37.140","192.168.1.118","TLSv1.2","5474","Application Data, Application Data, Application Data, Application Data"
"380","1.215572600","192.168.1.118","199.232.37.140","TCP","66","40320 → 443 [ACK] Seq=919 Ack=50738 Win=77696 Len=0 TSval=1503503539 TSecr=3252696793"
"381","1.221276650","192.168.1.118","199.232.37.140","TLSv1.2","295","Application Data"
"382","1.221485550","192.168.1.118","199.232.37.140","TCP","66","40316 → 443 [ACK] Seq=1569 Ack=14687 Win=60288 Len=0 TSval=1503503545 TSecr=274183067"
"383","1.229525087","199.232.37.140","192.168.1.118","TCP","66","443 → 40336 [ACK] Seq=1 Ack=518 Win=28160 Len=0 TSval=272678516 TSecr=1503503501"
"384","1.229597775","199.232.37.140","192.168.1.118","TLSv1.2","2770","Application Data, Application Data"
"385","1.229633625","192.168.1.118","199.232.37.140","TCP","66","40324 → 443 [ACK] Seq=871 Ack=35748 Win=37888 Len=0 TSval=1503503553 TSecr=2812426341"
"386","1.229725200","199.232.37.140","192.168.1.118","TLSv1.2","3314","Server Hello, Certificate, Server Key Exchange, Server Hello Done"
"387","1.229747487","192.168.1.118","199.232.37.140","TCP","66","40336 → 443 [ACK] Seq=518 Ack=3249 Win=61056 Len=0 TSval=1503503553 TSecr=272678516"
"388","1.229797350","199.232.37.140","192.168.1.118","TLSv1.2","2770","Application Data, Application Data"
"389","1.229817725","192.168.1.118","199.232.37.140","TCP","66","40322 → 443 [ACK] Seq=873 Ack=53346 Win=75648 Len=0 TSval=1503503553 TSecr=1378166798"
"390","1.229864087","199.232.37.140","192.168.1.118","TLSv1.2","2770","Application Data, Application Data"
"391","1.229884800","192.168.1.118","199.232.37.140","TCP","66","40326 → 443 [ACK] Seq=873 Ack=24954 Win=61056 Len=0 TSval=1503503553 TSecr=2814348055"
"392","1.229896912","199.232.37.140","192.168.1.118","TLSv1.2","2770","Application Data, Application Data"
"393","1.229916487","192.168.1.118","199.232.37.140","TCP","66","40320 → 443 [ACK] Seq=919 Ack=53442 Win=83072 Len=0 TSval=1503503553 TSecr=3252696793"
"394","1.229928762","199.232.37.140","192.168.1.118","TLSv1.2","2770","Application Data, Application Data"
"395","1.229941612","199.232.37.140","192.168.1.118","TLSv1.2","2770","Application Data, Application Data"
"396","1.229960887","192.168.1.118","199.232.37.140","TCP","66","40324 → 443 [ACK] Seq=871 Ack=38452 Win=35200 Len=0 TSval=1503503553 TSecr=2812426341"
"397","1.231147587","192.168.1.118","199.232.37.140","TCP","66","40322 → 443 [ACK] Seq=873 Ack=56050 Win=72960 Len=0 TSval=1503503554 TSecr=1378166799"
"398","1.233237637","192.168.1.118","199.232.37.140","TLSv1.2","192","Client Key Exchange, Change Cipher Spec, Encrypted Handshake Message"
"399","1.234280325","199.232.37.140","192.168.1.118","TLSv1.2","2770","Application Data, Application Data"
"400","1.234325012","192.168.1.118","199.232.37.140","TCP","66","40320 → 443 [ACK] Seq=919 Ack=56146 Win=88448 Len=0 TSval=1503503557 TSecr=3252696794"
"401","1.234903462","199.232.37.140","192.168.1.118","TLSv1.2","2770","Application Data, Application Data"
"402","1.234971550","199.232.37.140","192.168.1.118","TLSv1.2","2770","Application Data, Application Data"
"403","1.235012762","192.168.1.118","199.232.37.140","TCP","66","40320 → 443 [ACK] Seq=919 Ack=58850 Win=93952 Len=0 TSval=1503503558 TSecr=3252696794"
"404","1.235067225","199.232.37.140","192.168.1.118","TLSv1.2","5474","Application Data, Application Data, Application Data"
"405","1.235110237","192.168.1.118","199.232.37.140","TCP","66","40326 → 443 [ACK] Seq=873 Ack=30362 Win=55680 Len=0 TSval=1503503558 TSecr=2814348055"
"406","1.235136737","199.232.37.140","192.168.1.118","TLSv1.2","2770","Application Data, Application Data"
"407","1.235163375","199.232.37.140","192.168.1.118","TLSv1.2","2770","Application Data, Application Data"
"408","1.235185600","199.232.37.140","192.168.1.118","TLSv1.2","2770","Application Data, Application Data"
"409","1.235226312","192.168.1.118","199.232.37.140","TCP","66","40320 → 443 [ACK] Seq=919 Ack=61554 Win=99328 Len=0 TSval=1503503558 TSecr=3252696795"
"410","1.235312600","192.168.1.118","199.232.37.140","TCP","66","40322 → 443 [ACK] Seq=873 Ack=61458 Win=67584 Len=0 TSval=1503503558 TSecr=1378166801"
"411","1.235464987","192.168.1.118","199.232.37.140","TCP","66","40324 → 443 [ACK] Seq=871 Ack=41156 Win=32512 Len=0 TSval=1503503559 TSecr=2812426342"
"412","1.239383175","199.232.37.140","192.168.1.118","TLSv1.2","2770","Application Data, Application Data"
"413","1.239414750","199.232.37.140","192.168.1.118","TLSv1.2","2770","Application Data, Application Data"
"414","1.239452137","192.168.1.118","199.232.37.140","TCP","66","40324 → 443 [ACK] Seq=871 Ack=43860 Win=61056 Len=0 TSval=1503503563 TSecr=2812426343"
"415","1.239619987","199.232.37.140","192.168.1.118","TLSv1.2","117","Change Cipher Spec, Encrypted Handshake Message"
"416","1.239725387","199.232.37.140","192.168.1.118","TLSv1.2","2770","Application Data, Application Data"
"417","1.239767887","192.168.1.118","199.232.37.140","TCP","66","40320 → 443 [ACK] Seq=919 Ack=64258 Win=104704 Len=0 TSval=1503503563 TSecr=3252696795"
"418","1.239795250","199.232.37.140","192.168.1.118","TLSv1.2","2770","Application Data, Application Data"
"419","1.239849025","192.168.1.118","199.232.37.140","TCP","66","40326 → 443 [ACK] Seq=873 Ack=33066 Win=61056 Len=0 TSval=1503503563 TSecr=2814348056"
"420","1.239875737","199.232.37.140","192.168.1.118","TLSv1.2","2770","Application Data, Application Data"
"421","1.239902250","199.232.37.140","192.168.1.118","TLSv1.2","6826","Application Data, Application Data, Application Data, Application Data, Application Data"
"422","1.240152137","192.168.1.118","199.232.37.140","TCP","66","40322 → 443 [ACK] Seq=873 Ack=66866 Win=62208 Len=0 TSval=1503503563 TSecr=1378166805"
"423","1.240349312","192.168.1.118","199.232.37.140","TCP","66","40330 → 443 [ACK] Seq=873 Ack=10082 Win=57472 Len=0 TSval=1503503563 TSecr=275613202"
"424","1.240730450","192.168.1.118","199.232.37.140","TLSv1.2","295","Application Data"
"425","1.241153900","199.232.37.140","192.168.1.118","TLSv1.2","1859","Application Data, Application Data"
"426","1.241217600","199.232.37.140","192.168.1.118","TLSv1.2","1187","Application Data, Application Data"
"427","1.241268450","192.168.1.118","199.232.37.140","TCP","66","40326 → 443 [ACK] Seq=873 Ack=34187 Win=60032 Len=0 TSval=1503503564 TSecr=2814348057"
"428","1.241380750","199.232.37.140","192.168.1.118","TLSv1.2","2770","Application Data [TCP segment of a reassembled PDU]"
"429","1.241442600","199.232.37.140","192.168.1.118","TLSv1.2","5474","Application Data, Application Data, Application Data"
"430","1.241481637","199.232.37.140","192.168.1.118","TLSv1.2","2770","Application Data, Application Data"
"431","1.241672250","199.232.37.140","192.168.1.118","TLSv1.2","4122","Application Data, Application Data, Application Data"
"432","1.241710275","199.232.37.140","192.168.1.118","TLSv1.2","2770","Application Data, Application Data"
"433","1.242601800","192.168.1.118","199.232.37.140","TCP","66","40322 → 443 [ACK] Seq=873 Ack=74978 Win=54144 Len=0 TSval=1503503566 TSecr=1378166809"
"434","1.242733137","192.168.1.118","199.232.37.140","TCP","66","40320 → 443 [ACK] Seq=919 Ack=73722 Win=97024 Len=0 TSval=1503503566 TSecr=3252696796"
"435","1.242832675","192.168.1.118","199.232.37.140","TCP","66","40330 → 443 [ACK] Seq=873 Ack=11875 Win=55680 Len=0 TSval=1503503566 TSecr=275613202"
"436","1.243892537","199.232.37.140","192.168.1.118","TLSv1.2","1418","Application Data [TCP segment of a reassembled PDU]"
"437","1.243928200","199.232.37.140","192.168.1.118","TLSv1.2","2770","Application Data, Application Data"
"438","1.244358550","192.168.1.118","199.232.37.140","TCP","66","40322 → 443 [ACK] Seq=873 Ack=77682 Win=51456 Len=0 TSval=1503503567 TSecr=1378166816"
"439","1.249227475","199.232.37.140","192.168.1.118","TLSv1.2","2770","Application Data, Application Data"
"440","1.249280687","192.168.1.118","199.232.37.140","TCP","66","40320 → 443 [ACK] Seq=919 Ack=77778 Win=110080 Len=0 TSval=1503503572 TSecr=3252696797"
"441","1.249332387","199.232.37.140","192.168.1.118","TLSv1.2","2770","Application Data, Application Data"
"442","1.249382612","192.168.1.118","199.232.37.140","TCP","66","40322 → 443 [ACK] Seq=873 Ack=80386 Win=81024 Len=0 TSval=1503503573 TSecr=1378166818"
"443","1.249415212","199.232.37.140","192.168.1.118","TLSv1.2","2770","Application Data, Application Data"
"444","1.249463712","192.168.1.118","199.232.37.140","TCP","66","40320 → 443 [ACK] Seq=919 Ack=80482 Win=115584 Len=0 TSval=1503503573 TSecr=3252696799"
"445","1.249635337","199.232.37.140","192.168.1.118","TLSv1.2","2770","Application Data, Application Data"
"446","1.249686212","192.168.1.118","199.232.37.140","TCP","66","40322 → 443 [ACK] Seq=873 Ack=83090 Win=86400 Len=0 TSval=1503503573 TSecr=1378166820"
"447","1.249742275","199.232.37.140","192.168.1.118","TLSv1.2","1418","Application Data [TCP segment of a reassembled PDU]"
"448","1.249792337","192.168.1.118","199.232.37.140","TCP","66","40322 → 443 [ACK] Seq=873 Ack=84442 Win=89088 Len=0 TSval=1503503573 TSecr=1378166823"
"449","1.249866150","199.232.37.140","192.168.1.118","TLSv1.2","1874","Application Data [TCP segment of a reassembled PDU]"
"450","1.249918425","192.168.1.118","199.232.37.140","TCP","66","40322 → 443 [ACK] Seq=873 Ack=86250 Win=92672 Len=0 TSval=1503503573 TSecr=1378166825"
"451","1.249957112","199.232.37.140","192.168.1.118","TLSv1.2","2770","Application Data, Application Data"
"452","1.250006412","192.168.1.118","199.232.37.140","TCP","66","40320 → 443 [ACK] Seq=919 Ack=83186 Win=119552 Len=0 TSval=1503503573 TSecr=3252696799"
"453","1.252954237","199.232.37.140","192.168.1.118","TLSv1.2","6826","Application Data, Application Data, Application Data, Application Data, Application Data"
"454","1.253031300","199.232.37.140","192.168.1.118","TLSv1.2","202","Application Data"
"455","1.253085737","192.168.1.118","199.232.37.140","TCP","66","40322 → 443 [ACK] Seq=873 Ack=86386 Win=95488 Len=0 TSval=1503503576 TSecr=1378166836"
"456","1.253136712","199.232.37.140","192.168.1.118","TLSv1.2","5474","Application Data, Application Data, Application Data, Application Data"
"457","1.253196662","199.232.37.140","192.168.1.118","TLSv1.2","2770","Application Data, Application Data"
"458","1.253257187","199.232.37.140","192.168.1.118","TLSv1.2","5186","Application Data, Application Data, Application Data, Application Data"
"459","1.253676450","192.168.1.118","199.232.37.140","TCP","66","40320 → 443 [ACK] Seq=919 Ack=103178 Win=99584 Len=0 TSval=1503503577 TSecr=3252696800"
"460","1.259813987","199.232.37.140","192.168.1.118","TLSv1.2","1418","Application Data [TCP segment of a reassembled PDU]"
"461","1.259933150","199.232.37.140","192.168.1.118","TLSv1.2","2770","Application Data, Application Data"
"462","1.259969987","199.232.37.140","192.168.1.118","TLSv1.2","1418","Application Data"
"463","1.260184337","199.232.37.140","192.168.1.118","TLSv1.2","6517","Application Data, Application Data, Application Data, Application Data, Application Data, Application Data"
"464","1.260342637","199.232.37.140","192.168.1.118","TLSv1.2","8178","Application Data, Application Data, Application Data, Application Data, Application Data, Application Data"
"465","1.260388412","199.232.37.140","192.168.1.118","TLSv1.2","1418","Application Data [TCP segment of a reassembled PDU]"
"466","1.262237300","199.232.37.140","192.168.1.118","TLSv1.2","5474","Application Data, Application Data, Application Data, Application Data"
"467","1.262407462","199.232.37.140","192.168.1.118","TLSv1.2","1418","Application Data [TCP segment of a reassembled PDU]"
"468","1.263212687","199.232.37.140","192.168.1.118","TLSv1.2","117","Change Cipher Spec, Encrypted Handshake Message"
"469","1.263285275","199.232.37.140","192.168.1.118","TLSv1.2","5474","Application Data, Application Data, Application Data"
"470","1.263346962","199.232.37.140","192.168.1.118","TLSv1.2","4122","Application Data, Application Data, Application Data"
"471","1.267144050","199.232.37.140","192.168.1.118","TLSv1.2","4122","Application Data, Application Data, Application Data"
"472","1.267189087","199.232.37.140","192.168.1.118","TLSv1.2","1418","Application Data [TCP segment of a reassembled PDU]"
"473","1.267342650","199.232.37.140","192.168.1.118","TLSv1.2","4122","Application Data, Application Data, Application Data"
"474","1.268772600","199.232.37.140","192.168.1.118","TLSv1.2","4122","Application Data, Application Data, Application Data"
"475","1.268864150","199.232.37.140","192.168.1.118","TLSv1.2","2770","Application Data, Application Data"
"476","1.270507375","199.232.37.140","192.168.1.118","TLSv1.2","5474","Application Data, Application Data, Application Data, Application Data"
"477","1.270700412","199.232.37.140","192.168.1.118","TLSv1.2","5474","Application Data, Application Data, Application Data, Application Data"
"478","1.279186987","199.232.37.140","192.168.1.118","TLSv1.2","2770","Application Data, Application Data"
"479","1.279242737","199.232.37.140","192.168.1.118","TLSv1.2","1028","Application Data, Application Data"
"480","1.279292850","199.232.37.140","192.168.1.118","TLSv1.2","2770","Application Data, Application Data"
"481","1.300916675","192.168.1.118","199.232.37.140","TCP","66","40332 → 443 [ACK] Seq=873 Ack=11125 Win=56448 Len=0 TSval=1503503624 TSecr=2811391873"
"482","1.301021437","192.168.1.118","199.232.37.140","TCP","66","40324 → 443 [ACK] Seq=871 Ack=93494 Win=11520 Len=0 TSval=1503503624 TSecr=2812426353"
"483","1.303894812","192.168.1.118","199.232.37.140","TCP","66","40336 → 443 [ACK] Seq=644 Ack=3300 Win=64128 Len=0 TSval=1503503627 TSecr=272678530"
"484","1.311898837","192.168.1.118","199.232.37.140","TCP","66","40334 → 443 [ACK] Seq=873 Ack=16842 Win=50688 Len=0 TSval=1503503635 TSecr=3251947155"
"485","1.345454325","199.232.37.140","192.168.1.118","TLSv1.2","1418","Application Data [TCP segment of a reassembled PDU]"
"486","1.345593287","192.168.1.118","199.232.37.140","TCP","66","40334 → 443 [ACK] Seq=873 Ack=18194 Win=49408 Len=0 TSval=1503503669 TSecr=3251947174"
"487","1.354170050","192.168.1.118","199.232.37.140","TCP","66","[TCP Window Update] 40324 → 443 [ACK] Seq=871 Ack=93494 Win=64128 Len=0 TSval=1503503677 TSecr=2812426353"
"488","1.354464125","199.232.37.140","192.168.1.118","TLSv1.2","5474","Application Data, Application Data, Application Data, Application Data"
"489","1.354611875","192.168.1.118","199.232.37.140","TCP","66","40334 → 443 [ACK] Seq=873 Ack=23602 Win=44032 Len=0 TSval=1503503678 TSecr=3251947174"
"490","1.354808187","199.232.37.140","192.168.1.118","TLSv1.2","1418","Application Data [TCP segment of a reassembled PDU]"
"491","1.354906287","192.168.1.118","199.232.37.140","TLSv1.2","331","Application Data"
"492","1.354936450","192.168.1.118","199.232.37.140","TCP","66","40334 → 443 [ACK] Seq=873 Ack=24954 Win=42752 Len=0 TSval=1503503678 TSecr=3251947174"
"493","1.356948975","199.232.37.140","192.168.1.118","TLSv1.2","8178","Application Data, Application Data, Application Data, Application Data, Application Data"
"494","1.357219075","199.232.37.140","192.168.1.118","TLSv1.2","5474","Application Data, Application Data, Application Data, Application Data"
"495","1.358698550","199.232.37.140","192.168.1.118","TLSv1.2","1418","Application Data [TCP segment of a reassembled PDU]"
"496","1.359579437","199.232.37.140","192.168.1.118","TLSv1.2","1418","Application Data [TCP segment of a reassembled PDU]"
"497","1.362733712","199.232.37.140","192.168.1.118","TLSv1.2","1418","Application Data [TCP segment of a reassembled PDU]"
"498","1.363798900","199.232.37.140","192.168.1.118","TLSv1.2","1418","Application Data [TCP segment of a reassembled PDU]"
"499","1.368505987","199.232.37.140","192.168.1.118","TLSv1.2","1418","Application Data [TCP segment of a reassembled PDU]"
"500","1.368948137","192.168.1.118","199.232.37.140","TCP","66","40334 → 443 [ACK] Seq=873 Ack=45234 Win=22528 Len=0 TSval=1503503692 TSecr=3251947174"
"501","1.369708850","199.232.37.140","192.168.1.118","TLSv1.2","1418","Application Data [TCP segment of a reassembled PDU]"
"502","1.372036700","199.232.37.140","192.168.1.118","TLSv1.2","1418","Application Data [TCP segment of a reassembled PDU]"
"503","1.381176075","199.232.37.140","192.168.1.118","TLSv1.2","525","Application Data"
"504","1.381249750","192.168.1.118","199.232.37.140","TCP","66","40336 → 443 [ACK] Seq=909 Ack=3759 Win=63744 Len=0 TSval=1503503704 TSecr=272678560"
"505","1.381290312","199.232.37.140","192.168.1.118","TLSv1.2","97","Encrypted Alert"
"506","1.381306112","192.168.1.118","199.232.37.140","TCP","66","40336 → 443 [ACK] Seq=909 Ack=3790 Win=63744 Len=0 TSval=1503503704 TSecr=272678560"
"507","1.381321937","199.232.37.140","192.168.1.118","TCP","66","443 → 40336 [FIN, ACK] Seq=3790 Ack=909 Win=29184 Len=0 TSval=272678560 TSecr=1503503678"
"508","1.381345737","199.232.37.140","192.168.1.118","TLSv1.2","5474","Application Data, Application Data, Application Data, Application Data"
"509","1.381419100","199.232.37.140","192.168.1.118","TLSv1.2","4122","Application Data, Application Data, Application Data"
"510","1.383517525","199.232.37.140","192.168.1.118","TLSv1.2","2770","Application Data, Application Data"
"511","1.390907787","199.232.37.140","192.168.1.118","TLSv1.2","1418","Application Data [TCP segment of a reassembled PDU]"
"512","1.391906075","199.232.37.140","192.168.1.118","TLSv1.2","2770","Application Data, Application Data"
"513","1.393132925","199.232.37.140","192.168.1.118","TLSv1.2","2319","Application Data, Application Data"
"514","1.401100437","192.168.1.118","199.232.37.140","TLSv1.2","97","Encrypted Alert"
"515","1.402925387","192.168.1.118","199.232.37.140","TCP","66","40336 → 443 [RST, ACK] Seq=940 Ack=3791 Win=64128 Len=0 TSval=1503503726 TSecr=272678560"
"516","1.403574925","192.168.1.118","199.232.37.140","TCP","66","40334 → 443 [ACK] Seq=873 Ack=66415 Win=1408 Len=0 TSval=1503503727 TSecr=3251947179"
"517","1.404424025","192.168.1.118","199.232.37.140","TLSv1.2","336","Application Data"
"518","1.406727012","192.168.1.118","199.232.37.140","TCP","66","[TCP Window Update] 40334 → 443 [ACK] Seq=873 Ack=66415 Win=24960 Len=0 TSval=1503503730 TSecr=3251947179"
"519","1.410103925","192.168.1.118","199.232.37.140","TCP","66","[TCP Window Update] 40334 → 443 [ACK] Seq=873 Ack=66415 Win=60160 Len=0 TSval=1503503733 TSecr=3251947179"
"520","1.432465275","199.232.37.140","192.168.1.118","TCP","54","443 → 40336 [RST] Seq=3791 Win=0 Len=0"
"521","1.437182775","199.232.37.140","192.168.1.118","TLSv1.2","1418","Application Data"
"522","1.437257387","192.168.1.118","199.232.37.140","TCP","66","40328 → 443 [ACK] Seq=1141 Ack=19830 Win=63104 Len=0 TSval=1503503760 TSecr=274183127"
"523","1.439065200","199.232.37.140","192.168.1.118","TLSv1.2","6826","Application Data, Application Data, Application Data, Application Data, Application Data"
"524","1.439087537","192.168.1.118","199.232.37.140","TCP","66","40328 → 443 [ACK] Seq=1141 Ack=26590 Win=56448 Len=0 TSval=1503503762 TSecr=274183127"
"525","1.442744450","199.232.37.140","192.168.1.118","TLSv1.2","2770","Application Data, Application Data"
"526","1.442770087","192.168.1.118","199.232.37.140","TCP","66","40328 → 443 [ACK] Seq=1141 Ack=29294 Win=53760 Len=0 TSval=1503503766 TSecr=274183127"
"527","1.442842587","199.232.37.140","192.168.1.118","TLSv1.2","3649","Application Data, Application Data, Application Data"
"528","1.442860925","192.168.1.118","199.232.37.140","TCP","66","40328 → 443 [ACK] Seq=1141 Ack=32877 Win=50304 Len=0 TSval=1503503766 TSecr=274183127"
"529","1.489277675","192.168.1.118","199.232.37.140","TLSv1.2","249","Application Data"
"530","1.506659662","199.232.37.140","192.168.1.118","TLSv1.2","1150","Application Data, Application Data"
"531","1.506732250","192.168.1.118","199.232.37.140","TCP","66","40304 → 443 [ACK] Seq=1017 Ack=13891 Win=63104 Len=0 TSval=1503503830 TSecr=1116710411"
"532","2.664356287","192.168.1.104","255.255.255.255","UDP","217","49154 → 6666 Len=175"
"533","4.612144037","192.168.1.100","224.0.0.251","MDNS","414","Standard query 0x0000 PTR _googlecast._tcp.local, "QM" question PTR _homekit._tcp.local, "QM" question PTR _uscan._tcp.local, "QM" question PTR _ptp._tcp.local, "QM" question PTR _ippusb._tcp.local, "QM" question PTR _scanner._tcp.local, "QM" question PTR _ipp._tcp.local, "QM" question PTR _pdl-datastream._tcp.local, "QM" question PTR _uscans._tcp.local, "QM" question PTR _ipps._tcp.local, "QM" question PTR _printer._tcp.local, "QM" question PTR _airplay._tcp.local, "QM" question PTR _raop._tcp.local, "QM" question PTR _airport._tcp.local, "QM" question PTR _companion-link._tcp.local, "QM" question PTR _rdlink._tcp.local, "QM" question TXT Google-Home-Mini-2c3f16b2da5c4b6fd6cfbfba61c12490._googlecast._tcp.local, "QM" question PTR Google-Home-Mini-2c3f16b2da5c4b6fd6cfbfba61c12490._googlecast._tcp.local PTR cjqg._companion-link._tcp.local OPT"
"534","4.712955450","192.168.1.102","224.0.0.251","MDNS","183","Standard query response 0x0000 SRV, cache flush 0 0 8009 2c3f16b2-da5c-4b6f-d6cf-bfba61c12490.local"
"535","5.238246512","192.168.1.118","192.168.1.102","TCP","176","44768 → 8009 [PSH, ACK] Seq=111 Ack=111 Win=501 Len=110 TSval=2258893025 TSecr=5341507 [TCP segment of a reassembled PDU]"
"536","5.283550400","192.168.1.102","192.168.1.118","TCP","176","8009 → 44768 [PSH, ACK] Seq=111 Ack=221 Win=294 Len=110 TSval=5342009 TSecr=2258893025 [TCP segment of a reassembled PDU]"
"537","5.283738237","192.168.1.118","192.168.1.102","TCP","66","44768 → 8009 [ACK] Seq=221 Ack=221 Win=501 Len=0 TSval=2258893071 TSecr=5342009"
"538","5.633973162","192.168.1.104","255.255.255.255","UDP","217","49154 → 6666 Len=175"
"539","7.476477962","192.168.1.103","224.0.0.251","MDNS","139","Standard query 0x0000 PTR _companion-link._tcp.local, "QU" question PTR _sleep-proxy._udp.local, "QU" question OPT"
"540","7.680412475","Apple_53:af:45","Broadcast","ARP","42","Who has 192.168.1.103? Tell 192.168.1.100"
"541","8.399049912","192.168.1.103","224.0.0.251","IGMPv2","46","Membership Report group 224.0.0.251"
"542","8.502368712","192.168.1.103","224.0.0.251","MDNS","158","Standard query 0x0000 PTR _companion-link._tcp.local, "QM" question PTR _sleep-proxy._udp.local, "QM" question PTR cjqg._companion-link._tcp.local OPT"
"543","8.609928037","192.168.1.104","255.255.255.255","UDP","217","49154 → 6666 Len=175"
