frame.number,_ws.col.Time,_ws.col.Source,_ws.col.Destination,_ws.col.Protocol,frame.len,_ws.col.Info
"1","0.000000000","192.168.1.118","31.13.71.7","TCP","66","35584 → 443 [ACK] Seq=1 Ack=1 Win=51 Len=0 TSval=1093098569 TSecr=3473189905"
"2","0.001998925","192.168.1.118","31.13.71.7","TCP","66","35586 → 443 [ACK] Seq=1 Ack=1 Win=368 Len=0 TSval=1093098571 TSecr=3344985386"
"3","0.003764325","31.13.71.7","192.168.1.118","SSL","107","[TCP Spurious Retransmission] , Continuation Data"
"4","0.003826063","192.168.1.118","31.13.71.7","TCP","78","[TCP Dup ACK 1#1] 35584 → 443 [ACK] Seq=1 Ack=1 Win=51 Len=0 TSval=1093098572 TSecr=3473189970 SLE=4294967256 SRE=1"
"5","0.006000225","192.168.1.118","31.13.71.36","TCP","66","37364 → 443 [ACK] Seq=1 Ack=1 Win=501 Len=0 TSval=2512394394 TSecr=3043301162"
"6","0.007375163","192.168.1.102","192.168.1.118","TCP","176","8009 → 42902 [PSH, ACK] Seq=1 Ack=1 Win=277 Len=110 TSval=5063699 TSecr=2816788435 [TCP segment of a reassembled PDU]"
"7","0.007453750","192.168.1.118","192.168.1.102","TCP","66","42902 → 8009 [ACK] Seq=1 Ack=111 Win=501 Len=0 TSval=2816788509 TSecr=5063699"
"8","0.009812713","31.13.71.7","192.168.1.118","SSL","107","[TCP Spurious Retransmission] , Continuation Data"
"9","0.009879663","192.168.1.118","31.13.71.7","TCP","78","[TCP Dup ACK 2#1] 35586 → 443 [ACK] Seq=1 Ack=1 Win=368 Len=0 TSval=1093098579 TSecr=3344985458 SLE=4294967256 SRE=1"
"10","0.022618350","192.168.1.118","31.13.71.7","TCP","66","[TCP Window Update] 35584 → 443 [ACK] Seq=1 Ack=1 Win=501 Len=0 TSval=1093098591 TSecr=3473189970"
"11","0.023847575","192.168.1.118","31.13.71.36","TLSv1.2","363","Application Data"
"12","0.024243013","192.168.1.118","31.13.71.7","TLSv1.2","303","Application Data"
"13","0.028293725","192.168.1.118","31.13.71.7","TCP","66","35582 → 443 [ACK] Seq=1 Ack=1 Win=179 Len=0 TSval=1093098597 TSecr=641432418"
"14","0.057680238","31.13.71.7","192.168.1.118","TCP","1206","443 → 35582 [PSH, ACK] Seq=1 Ack=1 Win=121 Len=1140 TSval=641432553 TSecr=1093098597"
"15","0.059383300","31.13.71.7","192.168.1.118","TLSv1.2","1495","Application Data"
"16","0.059441150","31.13.71.7","192.168.1.118","TLSv1.2","708","Application Data"
"17","0.062541675","31.13.71.7","192.168.1.118","TCP","5618","[TCP segment of a reassembled PDU]"
"18","0.064208888","31.13.71.7","192.168.1.118","TLSv1.2","2543","Application Data"
"19","0.064261825","31.13.71.7","192.168.1.118","TCP","1454","[TCP segment of a reassembled PDU]"
"20","0.064554963","31.13.71.7","192.168.1.118","TLSv1.2","6707","Application Data"
"21","0.064580450","31.13.71.7","192.168.1.118","TCP","1454","[TCP segment of a reassembled PDU]"
"22","0.069039413","31.13.71.7","192.168.1.118","TCP","4230","443 → 35588 [ACK] Seq=18089 Ack=238 Win=121 Len=4164 TSval=2338524354 TSecr=1093098593 [TCP segment of a reassembled PDU]"
"23","0.069096913","31.13.71.7","192.168.1.118","TCP","1454","443 → 35588 [ACK] Seq=22253 Ack=238 Win=121 Len=1388 TSval=2338524355 TSecr=1093098593 [TCP segment of a reassembled PDU]"
"24","0.069249475","31.13.71.7","192.168.1.118","TLSv1.2","3271","Application Data, Application Data"
"25","0.069271488","31.13.71.7","192.168.1.118","TLSv1.2","1495","Application Data"
"26","0.070534488","31.13.71.36","192.168.1.118","TLSv1.2","671","Application Data"
"27","0.070605263","192.168.1.118","31.13.71.36","TCP","66","37364 → 443 [ACK] Seq=298 Ack=606 Win=497 Len=0 TSval=2512394458 TSecr=3043301281"
"28","0.097995900","192.168.1.118","31.13.71.7","TCP","66","35582 → 443 [ACK] Seq=1 Ack=2570 Win=159 Len=0 TSval=1093098667 TSecr=641432553"
"29","0.099992275","192.168.1.118","31.13.71.7","TCP","66","35588 → 443 [ACK] Seq=238 Ack=28275 Win=281 Len=0 TSval=1093098669 TSecr=2338524354"
"30","0.217599588","192.168.1.118","31.13.71.7","TLSv1.2","277","Application Data"
"31","0.222292363","192.168.1.118","31.13.71.7","TCP","66","[TCP Window Update] 35582 → 443 [ACK] Seq=1 Ack=2570 Win=416 Len=0 TSval=1093098791 TSecr=641432553"
"32","0.231072613","192.168.1.118","209.18.47.62","DNS","69","Standard query 0xfe7c A fbcdn.net"
"33","0.236209225","31.13.71.7","192.168.1.118","TLSv1.2","645","Application Data"
"34","0.236285575","192.168.1.118","31.13.71.7","TCP","66","35586 → 443 [ACK] Seq=212 Ack=580 Win=497 Len=0 TSval=1093098805 TSecr=3344985682"
"35","0.237849375","31.13.71.7","192.168.1.118","TLSv1.2","616","Application Data"
"36","0.237903625","192.168.1.118","31.13.71.7","TCP","66","35586 → 443 [ACK] Seq=212 Ack=1130 Win=493 Len=0 TSval=1093098807 TSecr=3344985682"
"37","0.266484463","209.18.47.62","192.168.1.118","DNS","85","Standard query response 0xfe7c A fbcdn.net A 31.13.71.36"
"38","0.267141450","192.168.1.118","209.18.47.62","DNS","69","Standard query 0x42be AAAA fbcdn.net"
"39","0.297295438","209.18.47.62","192.168.1.118","DNS","97","Standard query response 0x42be AAAA fbcdn.net AAAA 2a03:2880:f112:83:face:b00c:0:25de"
"40","0.476298288","192.168.1.118","31.13.71.36","TCP","74","37366 → 443 [SYN] Seq=0 Win=64240 Len=0 MSS=1460 SACK_PERM=1 TSval=2512394864 TSecr=0 WS=128"
"41","0.490358238","31.13.71.36","192.168.1.118","TCP","74","443 → 37366 [SYN, ACK] Seq=0 Ack=1 Win=27760 Len=0 MSS=1400 SACK_PERM=1 TSval=3046589010 TSecr=2512394864 WS=256"
"42","0.490453200","192.168.1.118","31.13.71.36","TCP","66","37366 → 443 [ACK] Seq=1 Ack=1 Win=64256 Len=0 TSval=2512394878 TSecr=3046589010"
"43","0.569869400","192.168.1.118","31.13.71.36","TLSv1","583","Client Hello"
"44","0.577725025","192.168.1.118","31.13.71.7","TLSv1.2","277","Application Data"
"45","0.581658725","192.168.1.118","31.13.71.7","TLSv1.2","277","Application Data"
"46","0.588030138","31.13.71.36","192.168.1.118","TCP","66","443 → 37366 [ACK] Seq=1 Ack=518 Win=28928 Len=0 TSval=3046589109 TSecr=2512394958"
"47","0.591514738","31.13.71.36","192.168.1.118","TLSv1.2","1454","Server Hello"
"48","0.591582825","192.168.1.118","31.13.71.36","TCP","66","37366 → 443 [ACK] Seq=518 Ack=1389 Win=63104 Len=0 TSval=2512394979 TSecr=3046589111"
"49","0.592176363","192.168.1.118","31.13.71.7","TLSv1.2","277","Application Data"
"50","0.593263700","31.13.71.36","192.168.1.118","TLSv1.2","2001","Certificate, Server Key Exchange, Server Hello Done"
"51","0.593317200","192.168.1.118","31.13.71.36","TCP","66","37366 → 443 [ACK] Seq=518 Ack=3324 Win=61184 Len=0 TSval=2512394981 TSecr=3046589111"
"52","0.595488563","31.13.71.7","192.168.1.118","TLSv1.2","647","Application Data"
"53","0.595562713","192.168.1.118","31.13.71.7","TCP","66","35582 → 443 [ACK] Seq=212 Ack=3151 Win=523 Len=0 TSval=1093099164 TSecr=641433091"
"54","0.595851875","192.168.1.118","31.13.71.36","TLSv1.2","192","Client Key Exchange, Change Cipher Spec, Encrypted Handshake Message"
"55","0.597795025","31.13.71.7","192.168.1.118","TCP","4230","[TCP segment of a reassembled PDU]"
"56","0.597866700","192.168.1.118","31.13.71.7","TCP","66","35582 → 443 [ACK] Seq=212 Ack=7315 Win=588 Len=0 TSval=1093099167 TSecr=641433091"
"57","0.606184550","31.13.71.7","192.168.1.118","TLSv1.2","647","Application Data"
"58","0.606261750","192.168.1.118","31.13.71.7","TCP","66","35584 → 443 [ACK] Seq=212 Ack=582 Win=523 Len=0 TSval=1093099175 TSecr=3473190564"
"59","0.606302250","31.13.71.7","192.168.1.118","TCP","2842","443 → 35582 [ACK] Seq=7315 Ack=212 Win=126 Len=2776 TSval=641433091 TSecr=1093099146 [TCP segment of a reassembled PDU]"
"60","0.606320713","192.168.1.118","31.13.71.7","TCP","66","35582 → 443 [ACK] Seq=212 Ack=10091 Win=631 Len=0 TSval=1093099175 TSecr=641433091"
"61","0.606334250","31.13.71.7","192.168.1.118","TCP","2842","[TCP segment of a reassembled PDU]"
"62","0.606352025","192.168.1.118","31.13.71.7","TCP","66","35584 → 443 [ACK] Seq=212 Ack=3358 Win=566 Len=0 TSval=1093099175 TSecr=3473190564"
"63","0.607850375","31.13.71.7","192.168.1.118","TCP","4230","443 → 35584 [ACK] Seq=3358 Ack=212 Win=121 Len=4164 TSval=3473190564 TSecr=1093099150 [TCP segment of a reassembled PDU]"
"64","0.607909588","192.168.1.118","31.13.71.7","TCP","66","35584 → 443 [ACK] Seq=212 Ack=7522 Win=631 Len=0 TSval=1093099177 TSecr=3473190564"
"65","0.608992975","31.13.71.7","192.168.1.118","TLSv1.2","5618","Application Data [TCP segment of a reassembled PDU]"
"66","0.609046138","192.168.1.118","31.13.71.7","TCP","66","35582 → 443 [ACK] Seq=212 Ack=15643 Win=718 Len=0 TSval=1093099178 TSecr=641433091"
"67","0.609070638","31.13.71.7","192.168.1.118","TLSv1.2","5618","Application Data [TCP segment of a reassembled PDU]"
"68","0.609087825","192.168.1.118","31.13.71.7","TCP","66","35584 → 443 [ACK] Seq=212 Ack=13074 Win=718 Len=0 TSval=1093099178 TSecr=3473190564"
"69","0.611146350","31.13.71.7","192.168.1.118","TLSv1.2","525","Application Data"
"70","0.611208950","192.168.1.118","31.13.71.7","TCP","66","35582 → 443 [ACK] Seq=212 Ack=16102 Win=740 Len=0 TSval=1093099180 TSecr=641433092"
"71","0.611247288","31.13.71.7","192.168.1.118","TLSv1.2","1495","Application Data"
"72","0.611268000","192.168.1.118","31.13.71.7","TCP","66","35582 → 443 [ACK] Seq=212 Ack=17531 Win=762 Len=0 TSval=1093099180 TSecr=641433092"
"73","0.611289538","31.13.71.7","192.168.1.118","TLSv1.2","729","Application Data"
"74","0.611306338","192.168.1.118","31.13.71.7","TCP","66","35584 → 443 [ACK] Seq=212 Ack=13737 Win=740 Len=0 TSval=1093099180 TSecr=3473190565"
"75","0.611321900","31.13.71.7","192.168.1.118","TLSv1.2","1495","Application Data"
"76","0.611336413","192.168.1.118","31.13.71.7","TCP","66","35584 → 443 [ACK] Seq=212 Ack=15166 Win=762 Len=0 TSval=1093099180 TSecr=3473190565"
"77","0.616448350","31.13.71.7","192.168.1.118","TLSv1.2","646","Application Data"
"78","0.616523188","192.168.1.118","31.13.71.7","TCP","66","35586 → 443 [ACK] Seq=423 Ack=1710 Win=497 Len=0 TSval=1093099185 TSecr=3344986063"
"79","0.618741838","31.13.71.7","192.168.1.118","TLSv1.2","1691","Application Data"
"80","0.618811650","192.168.1.118","31.13.71.7","TCP","66","35586 → 443 [ACK] Seq=423 Ack=3335 Win=485 Len=0 TSval=1093099187 TSecr=3344986063"
"81","0.618853763","31.13.71.7","192.168.1.118","TLSv1.2","1495","Application Data"
"82","0.618868838","192.168.1.118","31.13.71.7","TCP","66","35586 → 443 [ACK] Seq=423 Ack=4764 Win=474 Len=0 TSval=1093099188 TSecr=3344986063"
"83","0.629115575","31.13.71.36","192.168.1.118","TLSv1.2","117","Change Cipher Spec, Encrypted Handshake Message"
"84","0.632300000","192.168.1.118","31.13.71.36","TLSv1.2","264","Application Data"
"85","0.658544388","31.13.71.36","192.168.1.118","TLSv1.2","535","Application Data"
"86","0.671623363","192.168.1.118","31.13.71.7","TLSv1.2","277","Application Data"
"87","0.676412288","192.168.1.118","209.18.47.62","DNS","69","Standard query 0xcef9 A fbsbx.com"
"88","0.689063425","31.13.71.7","192.168.1.118","TLSv1.2","647","Application Data"
"89","0.689141913","192.168.1.118","31.13.71.7","TCP","66","35582 → 443 [ACK] Seq=423 Ack=18112 Win=784 Len=0 TSval=1093099258 TSecr=641433183"
"90","0.692519675","31.13.71.7","192.168.1.118","TCP","5618","[TCP segment of a reassembled PDU]"
"91","0.692587963","192.168.1.118","31.13.71.7","TCP","66","35582 → 443 [ACK] Seq=423 Ack=23664 Win=871 Len=0 TSval=1093099261 TSecr=641433183"
"92","0.694159813","31.13.71.7","192.168.1.118","TCP","1454","443 → 35582 [ACK] Seq=23664 Ack=423 Win=130 Len=1388 TSval=641433183 TSecr=1093099240 [TCP segment of a reassembled PDU]"
"93","0.694206550","192.168.1.118","31.13.71.7","TCP","66","35582 → 443 [ACK] Seq=423 Ack=25052 Win=892 Len=0 TSval=1093099263 TSecr=641433183"
"94","0.694241638","31.13.71.7","192.168.1.118","TLSv1.2","2842","Application Data [TCP segment of a reassembled PDU]"
"95","0.694260888","192.168.1.118","31.13.71.7","TCP","66","35582 → 443 [ACK] Seq=423 Ack=27828 Win=936 Len=0 TSval=1093099263 TSecr=641433184"
"96","0.694471550","31.13.71.7","192.168.1.118","TLSv1.2","8345","Application Data, Application Data"
"97","0.694496950","192.168.1.118","31.13.71.7","TCP","66","35582 → 443 [ACK] Seq=423 Ack=36107 Win=1065 Len=0 TSval=1093099263 TSecr=641433184"
"98","0.696904963","31.13.71.7","192.168.1.118","TLSv1.2","1495","Application Data"
"99","0.696985250","192.168.1.118","31.13.71.7","TCP","66","35582 → 443 [ACK] Seq=423 Ack=37536 Win=1087 Len=0 TSval=1093099266 TSecr=641433184"
"100","0.698968675","192.168.1.118","31.13.71.36","TCP","66","37366 → 443 [ACK] Seq=842 Ack=3844 Win=64128 Len=0 TSval=2512395087 TSecr=3046589179"
"101","0.699041100","209.18.47.62","192.168.1.118","DNS","85","Standard query response 0xcef9 A fbsbx.com A 31.13.71.36"
"102","0.699157975","192.168.1.118","209.18.47.62","DNS","69","Standard query 0x02b6 AAAA fbsbx.com"
"103","0.719861038","209.18.47.62","192.168.1.118","DNS","97","Standard query response 0x02b6 AAAA fbsbx.com AAAA 2a03:2880:f112:83:face:b00c:0:25de"
"104","0.877596250","192.168.1.118","31.13.71.36","TCP","74","37368 → 443 [SYN] Seq=0 Win=64240 Len=0 MSS=1460 SACK_PERM=1 TSval=2512395265 TSecr=0 WS=128"
"105","0.905309800","31.13.71.36","192.168.1.118","TCP","74","443 → 37368 [SYN, ACK] Seq=0 Ack=1 Win=27760 Len=0 MSS=1400 SACK_PERM=1 TSval=1607743469 TSecr=2512395265 WS=256"
"106","0.905405963","192.168.1.118","31.13.71.36","TCP","66","37368 → 443 [ACK] Seq=1 Ack=1 Win=64256 Len=0 TSval=2512395293 TSecr=1607743469"
"107","1.050401150","192.168.1.118","31.13.71.36","TLSv1","583","Client Hello"
"108","1.079785975","31.13.71.36","192.168.1.118","TCP","66","443 → 37368 [ACK] Seq=1 Ack=518 Win=28928 Len=0 TSval=1607743639 TSecr=2512395438"
"109","1.081597763","31.13.71.36","192.168.1.118","TLSv1.2","2842","Server Hello"
"110","1.081662900","192.168.1.118","31.13.71.36","TCP","66","37368 → 443 [ACK] Seq=518 Ack=2777 Win=61568 Len=0 TSval=2512395469 TSecr=1607743641"
"111","1.087008450","31.13.71.36","192.168.1.118","TLSv1.2","613","Certificate, Server Key Exchange, Server Hello Done"
"112","1.087074388","192.168.1.118","31.13.71.36","TCP","66","37368 → 443 [ACK] Seq=518 Ack=3324 Win=61056 Len=0 TSval=2512395475 TSecr=1607743641"
"113","1.170757750","192.168.1.118","31.13.71.36","TLSv1.2","192","Client Key Exchange, Change Cipher Spec, Encrypted Handshake Message"
"114","1.185213050","31.13.71.36","192.168.1.118","TLSv1.2","117","Change Cipher Spec, Encrypted Handshake Message"
"115","1.185287850","192.168.1.118","31.13.71.36","TCP","66","37368 → 443 [ACK] Seq=644 Ack=3375 Win=64128 Len=0 TSval=2512395573 TSecr=1607743749"
"116","1.189684813","192.168.1.118","31.13.71.36","TLSv1.2","262","Application Data"
"117","1.244572175","31.13.71.36","192.168.1.118","TLSv1.2","542","Application Data"
"118","1.247300788","192.168.1.118","209.18.47.62","DNS","80","Standard query 0x9aee A connect.facebook.net"
"119","1.275369388","209.18.47.62","192.168.1.118","DNS","128","Standard query response 0x9aee A connect.facebook.net CNAME scontent.xx.fbcdn.net A 31.13.71.7"
"120","1.279795975","192.168.1.118","209.18.47.62","DNS","80","Standard query 0xaa9e AAAA connect.facebook.net"
"121","1.284989475","192.168.1.118","31.13.71.36","TCP","66","37368 → 443 [ACK] Seq=840 Ack=3851 Win=64128 Len=0 TSval=2512395673 TSecr=1607743808"
"122","1.305100050","209.18.47.62","192.168.1.118","DNS","140","Standard query response 0xaa9e AAAA connect.facebook.net CNAME scontent.xx.fbcdn.net AAAA 2a03:2880:f012:8:face:b00c:0:1"
"123","1.312864750","192.168.1.118","31.13.71.7","TCP","74","35596 → 443 [SYN] Seq=0 Win=64240 Len=0 MSS=1460 SACK_PERM=1 TSval=1093099881 TSecr=0 WS=128"
"124","1.340110913","31.13.71.7","192.168.1.118","TCP","74","443 → 35596 [SYN, ACK] Seq=0 Ack=1 Win=27760 Len=0 MSS=1400 SACK_PERM=1 TSval=2141545459 TSecr=1093099881 WS=256"
"125","1.340206375","192.168.1.118","31.13.71.7","TCP","66","35596 → 443 [ACK] Seq=1 Ack=1 Win=64256 Len=0 TSval=1093099909 TSecr=2141545459"
"126","1.383000588","192.168.1.118","31.13.71.7","TLSv1","583","Client Hello"
"127","1.400192375","31.13.71.7","192.168.1.118","TCP","66","443 → 35596 [ACK] Seq=1 Ack=518 Win=28928 Len=0 TSval=2141545521 TSecr=1093099952"
"128","1.403225450","31.13.71.7","192.168.1.118","TLSv1.2","1454","Server Hello"
"129","1.403292563","192.168.1.118","31.13.71.7","TCP","66","35596 → 443 [ACK] Seq=518 Ack=1389 Win=63104 Len=0 TSval=1093099972 TSecr=2141545521"
"130","1.406968263","31.13.71.7","192.168.1.118","TLSv1.2","1771","Certificate, Server Key Exchange, Server Hello Done"
"131","1.407033200","192.168.1.118","31.13.71.7","TCP","66","35596 → 443 [ACK] Seq=518 Ack=3094 Win=61440 Len=0 TSval=1093099976 TSecr=2141545521"
"132","1.409283050","192.168.1.118","31.13.71.7","TLSv1.2","192","Client Key Exchange, Change Cipher Spec, Encrypted Handshake Message"
"133","1.444193000","31.13.71.7","192.168.1.118","TCP","383","[TCP Spurious Retransmission] 443 → 35596 [PSH, ACK] Seq=2777 Ack=518 Win=28928 Len=317 TSval=2141545565 TSecr=1093099952[Reassembly error, protocol TCP: New fragment overlaps old data (retransmission?)]"
"134","1.444262600","192.168.1.118","31.13.71.7","TCP","78","[TCP Dup ACK 131#1] 35596 → 443 [ACK] Seq=644 Ack=3094 Win=64128 Len=0 TSval=1093100013 TSecr=2141545565 SLE=2777 SRE=3094"
"135","1.450612713","31.13.71.7","192.168.1.118","TLSv1.2","117","Change Cipher Spec, Encrypted Handshake Message"
"136","1.450685913","192.168.1.118","31.13.71.7","TCP","66","35596 → 443 [ACK] Seq=644 Ack=3145 Win=64128 Len=0 TSval=1093100019 TSecr=2141545572"
"137","1.451094263","192.168.1.118","31.13.71.7","TLSv1.2","269","Application Data"
"138","1.471057963","31.13.71.7","192.168.1.118","TLSv1.2","1327","Application Data"
"139","1.473962150","31.13.71.7","192.168.1.118","TLSv1.2","151","Application Data"
"140","1.474167650","192.168.1.118","31.13.71.7","TCP","66","35596 → 443 [ACK] Seq=847 Ack=4491 Win=64128 Len=0 TSval=1093100043 TSecr=2141545591"
"141","2.030550125","192.168.1.118","31.13.71.36","TLSv1.2","351","Application Data"
"142","2.047261275","31.13.71.36","192.168.1.118","TCP","66","443 → 37352 [ACK] Seq=1 Ack=286 Win=121 Len=0 TSval=1591185370 TSecr=2512396418"
"143","2.089374350","fe80::1cc7:6d9a:a312:7e8f","ff02::fb","MDNS","547","Standard query 0x0000 PTR _googlecast._tcp.local, "QM" question PTR _homekit._tcp.local, "QM" question PTR _uscan._tcp.local, "QM" question PTR _ptp._tcp.local, "QM" question PTR _ippusb._tcp.local, "QM" question PTR _scanner._tcp.local, "QM" question PTR _ipp._tcp.local, "QM" question PTR _pdl-datastream._tcp.local, "QM" question PTR _uscans._tcp.local, "QM" question PTR _ipps._tcp.local, "QM" question PTR _printer._tcp.local, "QM" question PTR _airplay._tcp.local, "QM" question PTR _raop._tcp.local, "QM" question PTR _airport._tcp.local, "QM" question PTR _rdlink._tcp.local, "QM" question PTR _companion-link._tcp.local, "QM" question PTR _afpovertcp._tcp.local, "QM" question PTR _rfb._tcp.local, "QM" question PTR _adisk._tcp.local, "QM" question PTR _apple-mobdev._tcp.local, "QM" question PTR 8ed307c3._sub._apple-mobdev2._tcp.local, "QM" question PTR _apple-pairable._tcp.local, "QM" question PTR Google-Home-Mini-2c3f16b2da5c4b6fd6cfbfba61c12490._googlecast._tcp.local PTR cjqg._companion-link._tcp.local OPT"
"144","2.094493213","192.168.1.100","224.0.0.251","MDNS","527","Standard query 0x0000 PTR _googlecast._tcp.local, "QM" question PTR _homekit._tcp.local, "QM" question PTR _uscan._tcp.local, "QM" question PTR _ptp._tcp.local, "QM" question PTR _ippusb._tcp.local, "QM" question PTR _scanner._tcp.local, "QM" question PTR _ipp._tcp.local, "QM" question PTR _pdl-datastream._tcp.local, "QM" question PTR _uscans._tcp.local, "QM" question PTR _ipps._tcp.local, "QM" question PTR _printer._tcp.local, "QM" question PTR _airplay._tcp.local, "QM" question PTR _raop._tcp.local, "QM" question PTR _airport._tcp.local, "QM" question PTR _rdlink._tcp.local, "QM" question PTR _companion-link._tcp.local, "QM" question PTR _afpovertcp._tcp.local, "QM" question PTR _rfb._tcp.local, "QM" question PTR _adisk._tcp.local, "QM" question PTR _apple-mobdev._tcp.local, "QM" question PTR 8ed307c3._sub._apple-mobdev2._tcp.local, "QM" question PTR _apple-pairable._tcp.local, "QM" question PTR Google-Home-Mini-2c3f16b2da5c4b6fd6cfbfba61c12490._googlecast._tcp.local PTR cjqg._companion-link._tcp.local OPT"
"145","2.097166725","192.168.1.104","255.255.255.255","UDP","217","49154 → 6666 Len=175"
"146","2.105431775","31.13.71.36","192.168.1.118","TCP","1454","[TCP segment of a reassembled PDU]"
"147","2.107888450","31.13.71.36","192.168.1.118","TLSv1.2","486","Application Data, Application Data"
"148","2.107979638","192.168.1.118","31.13.71.36","TCP","66","37352 → 443 [ACK] Seq=286 Ack=1809 Win=545 Len=0 TSval=2512396496 TSecr=1591185427"
"149","2.108020800","31.13.71.36","192.168.1.118","TLSv1.2","1311","Application Data"
"150","2.108037100","31.13.71.36","192.168.1.118","TLSv1.2","1311","Application Data"
"151","2.108052800","192.168.1.118","31.13.71.36","TCP","66","37352 → 443 [ACK] Seq=286 Ack=4299 Win=586 Len=0 TSval=2512396496 TSecr=1591185427"
"152","2.108075088","31.13.71.36","192.168.1.118","TLSv1.2","2556","Application Data, Application Data"
"153","2.108091063","192.168.1.118","31.13.71.36","TCP","66","37352 → 443 [ACK] Seq=286 Ack=6789 Win=625 Len=0 TSval=2512396496 TSecr=1591185427"
"154","2.113689975","31.13.71.36","192.168.1.118","TLSv1.2","2842","Application Data, Application Data"
"155","2.113755338","192.168.1.118","31.13.71.36","TCP","66","37352 → 443 [ACK] Seq=286 Ack=9565 Win=668 Len=0 TSval=2512396501 TSecr=1591185427"
"156","2.113795150","31.13.71.36","192.168.1.118","TLSv1.2","2842","Application Data, Application Data"
"157","2.113811113","192.168.1.118","31.13.71.36","TCP","66","37352 → 443 [ACK] Seq=286 Ack=12341 Win=711 Len=0 TSval=2512396501 TSecr=1591185428"
"158","2.113960538","31.13.71.36","192.168.1.118","TLSv1.2","5618","Application Data, Application Data, Application Data, Application Data"
"159","2.113985338","192.168.1.118","31.13.71.36","TCP","66","37352 → 443 [ACK] Seq=286 Ack=17893 Win=798 Len=0 TSval=2512396502 TSecr=1591185429"
"160","2.114006325","31.13.71.36","192.168.1.118","TLSv1.2","2842","Application Data, Application Data, Application Data"
"161","2.114025488","192.168.1.118","31.13.71.36","TCP","66","37352 → 443 [ACK] Seq=286 Ack=20669 Win=841 Len=0 TSval=2512396502 TSecr=1591185430"
"162","2.128108900","31.13.71.36","192.168.1.118","TLSv1.2","2842","Application Data, Application Data"
"163","2.128180238","192.168.1.118","31.13.71.36","TCP","66","37352 → 443 [ACK] Seq=286 Ack=23445 Win=885 Len=0 TSval=2512396516 TSecr=1591185431"
"164","2.128220488","31.13.71.36","192.168.1.118","TLSv1.2","2842","Application Data, Application Data"
"165","2.128236400","192.168.1.118","31.13.71.36","TCP","66","37352 → 443 [ACK] Seq=286 Ack=26221 Win=928 Len=0 TSval=2512396516 TSecr=1591185432"
"166","2.129020513","31.13.71.36","192.168.1.118","TLSv1.2","5618","Application Data, Application Data, Application Data, Application Data, Application Data"
"167","2.129067425","192.168.1.118","31.13.71.36","TCP","66","37352 → 443 [ACK] Seq=286 Ack=31773 Win=1015 Len=0 TSval=2512396517 TSecr=1591185433"
"168","2.129103275","31.13.71.36","192.168.1.118","TLSv1.2","2842","Application Data, Application Data"
"169","2.129120063","192.168.1.118","31.13.71.36","TCP","66","37352 → 443 [ACK] Seq=286 Ack=34549 Win=1058 Len=0 TSval=2512396517 TSecr=1591185434"
"170","2.129141275","31.13.71.36","192.168.1.118","TLSv1.2","2842","Application Data, Application Data"
"171","2.129152675","31.13.71.36","192.168.1.118","TLSv1.2","618","Application Data"
"172","2.131917000","192.168.1.118","31.13.71.36","TCP","66","37352 → 443 [ACK] Seq=286 Ack=37877 Win=1032 Len=0 TSval=2512396520 TSecr=1591185435"
"173","2.145736563","192.168.1.118","31.13.71.7","TLSv1.2","289","Application Data"
"174","2.152067538","192.168.1.118","31.13.71.36","TLSv1.2","390","Application Data"
"175","2.170801238","31.13.71.7","192.168.1.118","TLSv1.2","1317","Application Data"
"176","2.170878125","192.168.1.118","31.13.71.7","TCP","66","35582 → 443 [ACK] Seq=646 Ack=38787 Win=1109 Len=0 TSval=1093100740 TSecr=641434666"
"177","2.184181313","31.13.71.7","192.168.1.118","TLSv1.2","1168","Application Data"
"178","2.184248500","192.168.1.118","31.13.71.7","TCP","66","35582 → 443 [ACK] Seq=646 Ack=39889 Win=1131 Len=0 TSval=1093100753 TSecr=641434666"
"179","2.185793963","31.13.71.36","192.168.1.118","TLSv1.2","671","Application Data"
"180","2.185860875","192.168.1.118","31.13.71.36","TCP","66","37364 → 443 [ACK] Seq=622 Ack=1211 Win=497 Len=0 TSval=2512396574 TSecr=3043303392"
"181","2.193188938","192.168.1.118","31.13.71.36","TLSv1.2","279","Application Data"
"182","2.219606138","192.168.1.118","31.13.71.7","TLSv1.2","292","Application Data"
"183","2.239078000","31.13.71.7","192.168.1.118","TLSv1.2","1168","[TCP Spurious Retransmission] , Application Data"
"184","2.239152288","192.168.1.118","31.13.71.7","TCP","78","[TCP Dup ACK 178#1] 35582 → 443 [ACK] Seq=872 Ack=39889 Win=1131 Len=0 TSval=1093100808 TSecr=641434729 SLE=38787 SRE=39889"
"185","2.277113525","31.13.71.7","192.168.1.118","TLSv1.2","645","Application Data"
"186","2.277190213","192.168.1.118","31.13.71.7","TCP","66","35582 → 443 [ACK] Seq=872 Ack=40468 Win=1152 Len=0 TSval=1093100846 TSecr=641434773"
"187","2.278852525","31.13.71.7","192.168.1.118","TLSv1.2","1019","Application Data"
"188","2.278894900","192.168.1.118","31.13.71.7","TCP","66","35582 → 443 [ACK] Seq=872 Ack=41421 Win=1174 Len=0 TSval=1093100848 TSecr=641434773"
"189","2.288012325","31.13.71.36","192.168.1.118","TLSv1.2","535","Application Data"
"190","2.288086738","192.168.1.118","31.13.71.36","TCP","66","37366 → 443 [ACK] Seq=1055 Ack=4313 Win=63744 Len=0 TSval=2512396676 TSecr=3046590808"
"191","2.330399388","192.168.1.118","31.13.71.36","TLSv1.2","277","Application Data"
"192","2.356029288","31.13.71.36","192.168.1.118","TLSv1.2","542","Application Data"
"193","2.356108025","192.168.1.118","31.13.71.36","TCP","66","37368 → 443 [ACK] Seq=1051 Ack=4327 Win=63744 Len=0 TSval=2512396744 TSecr=1607744920"
"194","2.463708050","192.168.1.118","31.13.71.7","TLSv1.2","334","Application Data"
"195","2.483755550","31.13.71.7","192.168.1.118","TLSv1.2","1327","Application Data"
"196","2.490714025","31.13.71.7","192.168.1.118","TLSv1.2","151","Application Data"
"197","2.524001300","192.168.1.118","31.13.71.7","TCP","66","35596 → 443 [ACK] Seq=1115 Ack=5837 Win=62848 Len=0 TSval=1093101093 TSecr=2141546604"
"198","2.538894863","31.13.71.7","192.168.1.118","TLSv1.2","151","[TCP Spurious Retransmission] , Application Data"
"199","2.538974638","192.168.1.118","31.13.71.7","TCP","78","[TCP Dup ACK 197#1] 35596 → 443 [ACK] Seq=1115 Ack=5837 Win=62848 Len=0 TSval=1093101108 TSecr=2141546659 SLE=5752 SRE=5837"
"200","5.010650763","192.168.1.118","192.168.1.102","TCP","176","42902 → 8009 [PSH, ACK] Seq=1 Ack=111 Win=501 Len=110 TSval=2816793512 TSecr=5063699 [TCP segment of a reassembled PDU]"
"201","5.088689475","192.168.1.102","192.168.1.118","TCP","176","8009 → 42902 [PSH, ACK] Seq=111 Ack=111 Win=277 Len=110 TSval=5064204 TSecr=2816793512 [TCP segment of a reassembled PDU]"
"202","5.088776925","192.168.1.118","192.168.1.102","TCP","66","42902 → 8009 [ACK] Seq=111 Ack=221 Win=501 Len=0 TSval=2816793590 TSecr=5064204"
"203","5.154989975","192.168.1.104","255.255.255.255","UDP","217","49154 → 6666 Len=175"
"204","5.358648713","192.168.1.103","224.0.0.251","MDNS","112","Standard query 0x0000 PTR _sleep-proxy._udp.local, "QU" question OPT"
"205","5.459125063","192.168.1.103","224.0.0.2","IGMPv2","46","Leave Group 224.0.0.251"
"206","5.460479538","192.168.1.103","224.0.0.251","IGMPv2","46","Membership Report group 224.0.0.251"
"207","6.386579300","fe80::144e:ae0c:17ca:d785","ff02::fb","MDNS","132","Standard query 0x0000 PTR _sleep-proxy._udp.local, "QM" question OPT"
"208","7.097213225","Cisco-Li_5b:1c:ce","IntelCor_b7:52:73","ARP","42","Who has 192.168.1.118? Tell 192.168.1.1"
"209","7.097248475","IntelCor_b7:52:73","Cisco-Li_5b:1c:ce","ARP","42","192.168.1.118 is at dc:fb:48:b7:52:73"
"210","8.123001900","192.168.1.103","224.0.0.251","MDNS","150","Standard query 0x0000 PTR _companion-link._tcp.local, "QU" question TXT cjqg._companion-link._tcp.local, "QU" question PTR _sleep-proxy._udp.local, "QM" question OPT"
"211","8.127874200","fe80::144e:ae0c:17ca:d785","ff02::fb","MDNS","170","Standard query 0x0000 PTR _companion-link._tcp.local, "QU" question TXT cjqg._companion-link._tcp.local, "QU" question PTR _sleep-proxy._udp.local, "QM" question OPT"
