frame.number,_ws.col.Time,_ws.col.Source,_ws.col.Destination,_ws.col.Protocol,frame.len,_ws.col.Info
"1","0.000000000","199.232.37.224","192.168.1.118","TLSv1.2","3751","Server Hello, Certificate, Server Key Exchange, Server Hello Done"
"2","0.000065750","192.168.1.118","199.232.37.224","TCP","66","42190 → 443 [ACK] Seq=1 Ack=3686 Win=474 Len=0 TSval=1345384343 TSecr=4203148454"
"3","0.000109900","199.232.37.224","192.168.1.118","TCP","66","443 → 42192 [ACK] Seq=1 Ack=1 Win=55 Len=0 TSval=3145959400 TSecr=1345384313"
"4","0.002698537","199.232.37.224","192.168.1.118","TLSv1.2","1418","Server Hello"
"5","0.002763037","192.168.1.118","199.232.37.224","TCP","66","42192 → 443 [ACK] Seq=1 Ack=1353 Win=493 Len=0 TSval=1345384346 TSecr=3145959400"
"6","0.002849725","199.232.37.224","192.168.1.118","TLSv1.2","2399","Certificate, Server Key Exchange, Server Hello Done"
"7","0.002873612","192.168.1.118","199.232.37.224","TCP","66","42192 → 443 [ACK] Seq=1 Ack=3686 Win=475 Len=0 TSval=1345384346 TSecr=3145959400"
"8","0.006598712","192.168.1.118","199.232.37.224","TLSv1","583","Client Hello"
"9","0.007166525","192.168.1.118","209.18.47.62","DNS","76","Standard query 0x0906 A i.etsystatic.com"
"10","0.007439962","192.168.1.118","209.18.47.62","DNS","76","Standard query 0x2d9d A i.etsystatic.com"
"11","0.011016500","192.168.1.118","199.232.37.224","TLSv1.2","192","Client Key Exchange, Change Cipher Spec, Encrypted Handshake Message"
"12","0.012957137","192.168.1.118","199.232.37.224","TLSv1.2","192","Client Key Exchange, Change Cipher Spec, Encrypted Handshake Message"
"13","0.022097975","192.168.1.118","209.18.47.62","DNS","76","Standard query 0x41c4 A i.etsystatic.com"
"14","0.022558337","192.168.1.118","209.18.47.62","DNS","76","Standard query 0x61d4 A i.etsystatic.com"
"15","0.028934725","199.232.37.224","192.168.1.118","TCP","66","443 → 42194 [ACK] Seq=1 Ack=1 Win=55 Len=0 TSval=3143960348 TSecr=1345384331"
"16","0.029903800","199.232.37.224","192.168.1.118","TLSv1.2","3751","Server Hello, Certificate, Server Key Exchange, Server Hello Done"
"17","0.029947337","192.168.1.118","199.232.37.224","TCP","66","42194 → 443 [ACK] Seq=1 Ack=3686 Win=474 Len=0 TSval=1345384373 TSecr=3143960348"
"18","0.036740750","199.232.37.224","192.168.1.118","TCP","66","443 → 42196 [ACK] Seq=1 Ack=518 Win=55 Len=0 TSval=2813852754 TSecr=1345384350"
"19","0.039941550","192.168.1.118","199.232.37.224","TLSv1.2","192","Client Key Exchange, Change Cipher Spec, Encrypted Handshake Message"
"20","0.041488712","192.168.1.118","209.18.47.62","DNS","76","Standard query 0x413a A i.etsystatic.com"
"21","0.045695075","199.232.37.224","192.168.1.118","TLSv1.2","1418","Server Hello"
"22","0.045754212","192.168.1.118","199.232.37.224","TCP","66","42196 → 443 [ACK] Seq=518 Ack=1353 Win=493 Len=0 TSval=1345384389 TSecr=2813852754"
"23","0.046643612","199.232.37.224","192.168.1.118","TLSv1.2","2399","Certificate, Server Key Exchange, Server Hello Done"
"24","0.046696600","192.168.1.118","199.232.37.224","TCP","66","42196 → 443 [ACK] Seq=518 Ack=3686 Win=475 Len=0 TSval=1345384390 TSecr=2813852754"
"25","0.046751275","209.18.47.62","192.168.1.118","DNS","167","Standard query response 0x41c4 A i.etsystatic.com CNAME i.etsystatic.com.edgekey.net CNAME e8634.f.akamaiedge.net A 173.223.57.41"
"26","0.046820425","209.18.47.62","192.168.1.118","DNS","125","Standard query response 0x2d9d A i.etsystatic.com CNAME etsy.map.fastly.net A 199.232.37.224"
"27","0.046893762","209.18.47.62","192.168.1.118","DNS","125","Standard query response 0x61d4 A i.etsystatic.com CNAME etsy.map.fastly.net A 199.232.37.224"
"28","0.046959962","199.232.37.224","192.168.1.118","TLSv1.2","117","Change Cipher Spec, Encrypted Handshake Message"
"29","0.047025200","199.232.37.224","192.168.1.118","TLSv1.2","117","Change Cipher Spec, Encrypted Handshake Message"
"30","0.047330550","192.168.1.118","209.18.47.62","DNS","76","Standard query 0x0919 AAAA i.etsystatic.com"
"31","0.047529325","192.168.1.118","209.18.47.62","DNS","76","Standard query 0x218c AAAA i.etsystatic.com"
"32","0.047719700","192.168.1.118","209.18.47.62","DNS","76","Standard query 0x4571 AAAA i.etsystatic.com"
"33","0.048829250","209.18.47.62","192.168.1.118","DNS","167","Standard query response 0x0906 A i.etsystatic.com CNAME i.etsystatic.com.edgekey.net CNAME e8634.f.akamaiedge.net A 173.223.57.41"
"34","0.049036612","192.168.1.118","209.18.47.62","DNS","76","Standard query 0x99f4 AAAA i.etsystatic.com"
"35","0.050408862","192.168.1.118","199.232.37.224","TLSv1.2","792","Application Data"
"36","0.050876625","192.168.1.118","199.232.37.224","TLSv1.2","912","Application Data"
"37","0.052932800","192.168.1.118","199.232.37.224","TLSv1.2","192","Client Key Exchange, Change Cipher Spec, Encrypted Handshake Message"
"38","0.060343150","192.168.1.118","209.18.47.62","DNS","73","Standard query 0xcdbd A blog.etsy.com"
"39","0.061138337","192.168.1.118","209.18.47.62","DNS","73","Standard query 0x09c7 A blog.etsy.com"
"40","0.063928962","209.18.47.62","192.168.1.118","DNS","167","Standard query response 0x0919 AAAA i.etsystatic.com CNAME etsy.map.fastly.net SOA ns1.fastly.net"
"41","0.064364625","192.168.1.118","199.232.37.224","TCP","74","42198 → 443 [SYN] Seq=0 Win=64240 Len=0 MSS=1460 SACK_PERM=1 TSval=1345384408 TSecr=0 WS=128"
"42","0.064474975","192.168.1.118","199.232.37.224","TCP","74","42200 → 443 [SYN] Seq=0 Win=64240 Len=0 MSS=1460 SACK_PERM=1 TSval=1345384408 TSecr=0 WS=128"
"43","0.064548575","192.168.1.118","199.232.37.224","TCP","74","42202 → 443 [SYN] Seq=0 Win=64240 Len=0 MSS=1460 SACK_PERM=1 TSval=1345384408 TSecr=0 WS=128"
"44","0.064640212","192.168.1.118","199.232.37.224","TCP","74","42204 → 443 [SYN] Seq=0 Win=64240 Len=0 MSS=1460 SACK_PERM=1 TSval=1345384408 TSecr=0 WS=128"
"45","0.066316737","192.168.1.118","209.18.47.62","DNS","73","Standard query 0xb5a1 A blog.etsy.com"
"46","0.068693287","192.168.1.118","199.232.37.224","TCP","74","42206 → 443 [SYN] Seq=0 Win=64240 Len=0 MSS=1460 SACK_PERM=1 TSval=1345384412 TSecr=0 WS=128"
"47","0.077840737","209.18.47.62","192.168.1.118","DNS","167","Standard query response 0x413a A i.etsystatic.com CNAME i.etsystatic.com.edgekey.net CNAME e8634.f.akamaiedge.net A 173.223.57.41"
"48","0.077921550","199.232.37.224","192.168.1.118","TLSv1.2","117","Change Cipher Spec, Encrypted Handshake Message"
"49","0.078126975","192.168.1.118","209.18.47.62","DNS","76","Standard query 0x6164 AAAA i.etsystatic.com"
"50","0.078732787","199.232.37.224","192.168.1.118","TLSv1.2","1418","Application Data"
"51","0.079380775","192.168.1.118","199.232.37.224","TCP","66","42168 → 443 [ACK] Seq=1 Ack=1 Win=429 Len=0 TSval=1345384423 TSecr=211158392"
"52","0.079506362","199.232.37.224","192.168.1.118","TLSv1.2","2770","Application Data, Application Data"
"53","0.079907487","192.168.1.118","199.232.37.224","TCP","66","42190 → 443 [ACK] Seq=853 Ack=7793 Win=470 Len=0 TSval=1345384423 TSecr=4203148477"
"54","0.080369712","192.168.1.118","199.232.37.224","TLSv1.2","621","Application Data"
"55","0.080989762","199.232.37.224","192.168.1.118","TLSv1.2","9530","Application Data, Application Data, Application Data, Application Data, Application Data, Application Data, Application Data"
"56","0.081882800","192.168.1.118","199.232.37.224","TCP","66","42190 → 443 [ACK] Seq=853 Ack=17257 Win=397 Len=0 TSval=1345384425 TSecr=4203148477"
"57","0.091100025","192.168.1.103","224.0.0.251","IGMPv2","46","Membership Report group 224.0.0.251"
"58","0.093401287","199.232.37.224","192.168.1.118","TCP","74","443 → 42200 [SYN, ACK] Seq=0 Ack=1 Win=43264 Len=0 MSS=1364 SACK_PERM=1 TSval=3463893940 TSecr=1345384408 WS=512"
"59","0.093534650","192.168.1.118","199.232.37.224","TCP","66","42200 → 443 [ACK] Seq=1 Ack=1 Win=64256 Len=0 TSval=1345384437 TSecr=3463893940"
"60","0.093663862","199.232.37.224","192.168.1.118","TCP","74","443 → 42202 [SYN, ACK] Seq=0 Ack=1 Win=27040 Len=0 MSS=1364 SACK_PERM=1 TSval=276723123 TSecr=1345384408 WS=512"
"61","0.093779250","192.168.1.118","199.232.37.224","TCP","66","42202 → 443 [ACK] Seq=1 Ack=1 Win=64256 Len=0 TSval=1345384437 TSecr=276723123"
"62","0.093863300","199.232.37.224","192.168.1.118","TLSv1.2","117","Change Cipher Spec, Encrypted Handshake Message"
"63","0.093950975","199.232.37.224","192.168.1.118","TCP","74","443 → 42198 [SYN, ACK] Seq=0 Ack=1 Win=27040 Len=0 MSS=1364 SACK_PERM=1 TSval=2811986154 TSecr=1345384408 WS=512"
"64","0.094058050","192.168.1.118","199.232.37.224","TCP","66","42198 → 443 [ACK] Seq=1 Ack=1 Win=64256 Len=0 TSval=1345384437 TSecr=2811986154"
"65","0.094143300","209.18.47.62","192.168.1.118","DNS","167","Standard query response 0x218c AAAA i.etsystatic.com CNAME etsy.map.fastly.net SOA ns1.fastly.net"
"66","0.094210575","199.232.37.224","192.168.1.118","TLSv1.2","13586","Application Data, Application Data, Application Data, Application Data, Application Data, Application Data, Application Data, Application Data, Application Data, Application Data"
"67","0.098748712","209.18.47.62","192.168.1.118","DNS","209","Standard query response 0x4571 AAAA i.etsystatic.com CNAME i.etsystatic.com.edgekey.net CNAME e8634.f.akamaiedge.net SOA n0f.akamaiedge.net"
"68","0.098868087","209.18.47.62","192.168.1.118","DNS","89","Standard query response 0x09c7 A blog.etsy.com A 104.196.190.179"
"69","0.098973900","209.18.47.62","192.168.1.118","DNS","89","Standard query response 0xcdbd A blog.etsy.com A 104.196.190.179"
"70","0.099070750","209.18.47.62","192.168.1.118","DNS","183","Standard query response 0x99f4 AAAA i.etsystatic.com CNAME i.etsystatic.com.edgekey.net SOA ns1.fastly.net"
"71","0.099394650","199.232.37.224","192.168.1.118","TCP","74","443 → 42204 [SYN, ACK] Seq=0 Ack=1 Win=27040 Len=0 MSS=1364 SACK_PERM=1 TSval=663656552 TSecr=1345384408 WS=512"
"72","0.099546725","192.168.1.118","199.232.37.224","TCP","66","42204 → 443 [ACK] Seq=1 Ack=1 Win=64256 Len=0 TSval=1345384443 TSecr=663656552"
"73","0.099643075","192.168.1.118","199.232.37.224","TCP","66","42192 → 443 [ACK] Seq=973 Ack=17257 Win=396 Len=0 TSval=1345384443 TSecr=3145959421"
"74","0.100119050","192.168.1.118","199.232.37.224","TLSv1.2","664","Application Data"
"75","0.106141000","192.168.1.118","209.18.47.62","DNS","73","Standard query 0x356e AAAA blog.etsy.com"
"76","0.106235112","192.168.1.118","209.18.47.62","DNS","73","Standard query 0x3977 AAAA blog.etsy.com"
"77","0.108807637","209.18.47.62","192.168.1.118","DNS","209","Standard query response 0x6164 AAAA i.etsystatic.com CNAME i.etsystatic.com.edgekey.net CNAME e8634.f.akamaiedge.net SOA n0f.akamaiedge.net"
"78","0.110341362","199.232.37.224","192.168.1.118","TLSv1.2","1418","Application Data [TCP segment of a reassembled PDU]"
"79","0.111082637","199.232.37.224","192.168.1.118","TLSv1.2","4122","Application Data, Application Data, Application Data"
"80","0.112485612","199.232.37.224","192.168.1.118","TLSv1.2","2770","Application Data, Application Data"
"81","0.112528937","199.232.37.224","192.168.1.118","TLSv1.2","5474","Application Data, Application Data, Application Data"
"82","0.112544237","199.232.37.224","192.168.1.118","TLSv1.2","1418","Application Data [TCP segment of a reassembled PDU]"
"83","0.114384487","199.232.37.224","192.168.1.118","TLSv1.2","2770","Application Data, Application Data"
"84","0.114461962","209.18.47.62","192.168.1.118","DNS","89","Standard query response 0xb5a1 A blog.etsy.com A 104.196.190.179"
"85","0.114525112","199.232.37.224","192.168.1.118","TCP","74","443 → 42206 [SYN, ACK] Seq=0 Ack=1 Win=27040 Len=0 MSS=1364 SACK_PERM=1 TSval=3252306958 TSecr=1345384412 WS=512"
"86","0.114575300","192.168.1.118","199.232.37.224","TCP","66","42206 → 443 [ACK] Seq=1 Ack=1 Win=64256 Len=0 TSval=1345384458 TSecr=3252306958"
"87","0.114622262","199.232.37.224","192.168.1.118","TLSv1.2","936","Application Data, Application Data"
"88","0.114641712","199.232.37.224","192.168.1.118","TLSv1.2","9530","Application Data, Application Data, Application Data, Application Data, Application Data, Application Data, Application Data"
"89","0.114754587","192.168.1.118","209.18.47.62","DNS","73","Standard query 0x612f AAAA blog.etsy.com"
"90","0.120133437","192.168.1.118","199.232.37.224","TLSv1","583","Client Hello"
"91","0.138675937","192.168.1.118","199.232.37.224","TLSv1","583","Client Hello"
"92","0.141463925","209.18.47.62","192.168.1.118","DNS","138","Standard query response 0x3977 AAAA blog.etsy.com SOA dns1.p03.nsone.net"
"93","0.150662975","192.168.1.118","199.232.37.224","TCP","66","42190 → 443 [ACK] Seq=853 Ack=44297 Win=186 Len=0 TSval=1345384494 TSecr=4203148484"
"94","0.150833012","199.232.37.224","192.168.1.118","TLSv1.2","2770","Application Data, Application Data"
"95","0.151362112","209.18.47.62","192.168.1.118","DNS","138","Standard query response 0x612f AAAA blog.etsy.com SOA dns1.p03.nsone.net"
"96","0.151564150","199.232.37.224","192.168.1.118","TCP","66","443 → 42198 [ACK] Seq=1 Ack=518 Win=28160 Len=0 TSval=2811986169 TSecr=1345384463"
"97","0.151666800","199.232.37.224","192.168.1.118","TLSv1.2","13586","Application Data, Application Data, Application Data, Application Data, Application Data, Application Data, Application Data, Application Data, Application Data"
"98","0.151708712","199.232.37.224","192.168.1.118","TLSv1.2","2770","Server Hello"
"99","0.151757600","192.168.1.118","199.232.37.224","TCP","66","42198 → 443 [ACK] Seq=518 Ack=2705 Win=61568 Len=0 TSval=1345384495 TSecr=2811986169"
"100","0.151886375","199.232.37.224","192.168.1.118","TLSv1.2","1047","Certificate, Server Key Exchange, Server Hello Done"
"101","0.151936562","192.168.1.118","199.232.37.224","TCP","66","42198 → 443 [ACK] Seq=518 Ack=3686 Win=60672 Len=0 TSval=1345384495 TSecr=2811986169"
"102","0.151990687","209.18.47.62","192.168.1.118","DNS","138","Standard query response 0x356e AAAA blog.etsy.com SOA dns1.p03.nsone.net"
"103","0.153333950","199.232.37.224","192.168.1.118","TLSv1.2","13249","Application Data, Application Data, Application Data, Application Data, Application Data, Application Data, Application Data, Application Data, Application Data, Application Data, Application Data"
"104","0.153467087","199.232.37.224","192.168.1.118","TLSv1.2","5474","Application Data, Application Data, Application Data, Application Data"
"105","0.154046862","199.232.37.224","192.168.1.118","TLSv1.2","5474","Application Data, Application Data, Application Data, Application Data"
"106","0.155248675","192.168.1.118","199.232.37.224","TLSv1","583","Client Hello"
"107","0.155657950","192.168.1.118","199.232.37.224","TCP","66","42194 → 443 [ACK] Seq=682 Ack=4607 Win=495 Len=0 TSval=1345384499 TSecr=3143960372"
"108","0.162884712","199.232.37.224","192.168.1.118","TCP","66","443 → 42200 [ACK] Seq=1 Ack=518 Win=43008 Len=0 TSval=3463894018 TSecr=1345384482"
"109","0.163683037","199.232.37.224","192.168.1.118","TLSv1.2","3751","Server Hello, Certificate, Server Key Exchange, Server Hello Done"
"110","0.163732812","192.168.1.118","199.232.37.224","TCP","66","42200 → 443 [ACK] Seq=518 Ack=3686 Win=60672 Len=0 TSval=1345384507 TSecr=3463894019"
"111","0.165917475","199.232.37.224","192.168.1.118","TLSv1.2","1418","Application Data [TCP segment of a reassembled PDU]"
"112","0.166807250","199.232.37.224","192.168.1.118","TLSv1.2","2770","Application Data, Application Data"
"113","0.166892450","199.232.37.224","192.168.1.118","TLSv1.2","1418","Application Data [TCP segment of a reassembled PDU]"
"114","0.168448775","199.232.37.224","192.168.1.118","TLSv1.2","10882","Application Data, Application Data, Application Data, Application Data, Application Data, Application Data, Application Data, Application Data"
"115","0.169478600","199.232.37.224","192.168.1.118","TLSv1.2","6826","Application Data, Application Data, Application Data, Application Data"
"116","0.171664275","192.168.1.118","199.232.37.224","TLSv1","583","Client Hello"
"117","0.171875312","192.168.1.118","104.196.190.179","TCP","74","34072 → 443 [SYN] Seq=0 Win=64240 Len=0 MSS=1460 SACK_PERM=1 TSval=3702535006 TSecr=0 WS=128"
"118","0.171961262","192.168.1.118","104.196.190.179","TCP","74","34074 → 443 [SYN] Seq=0 Win=64240 Len=0 MSS=1460 SACK_PERM=1 TSval=3702535006 TSecr=0 WS=128"
"119","0.172037800","192.168.1.118","104.196.190.179","TCP","74","34076 → 443 [SYN] Seq=0 Win=64240 Len=0 MSS=1460 SACK_PERM=1 TSval=3702535006 TSecr=0 WS=128"
"120","0.172145975","192.168.1.118","199.232.37.224","TCP","66","42190 → 443 [ACK] Seq=853 Ack=67281 Win=7 Len=0 TSval=1345384516 TSecr=4203148499"
"121","0.172309937","192.168.1.118","199.232.37.224","TCP","66","42192 → 443 [ACK] Seq=973 Ack=44297 Win=185 Len=0 TSval=1345384516 TSecr=3145959436"
"122","0.172690112","192.168.1.118","199.232.37.224","TCP","66","42196 → 443 [ACK] Seq=1242 Ack=16920 Win=399 Len=0 TSval=1345384516 TSecr=2813852781"
"123","0.184152675","199.232.37.224","192.168.1.118","TCP","66","443 → 42202 [ACK] Seq=1 Ack=518 Win=28160 Len=0 TSval=276723147 TSecr=1345384499"
"124","0.185125012","199.232.37.224","192.168.1.118","TLSv1.2","3751","Server Hello, Certificate, Server Key Exchange, Server Hello Done"
"125","0.185208812","192.168.1.118","199.232.37.224","TCP","66","42202 → 443 [ACK] Seq=518 Ack=3686 Win=60672 Len=0 TSval=1345384529 TSecr=276723147"
"126","0.189182800","192.168.1.118","199.232.37.224","TLSv1","583","Client Hello"
"127","0.191231737","192.168.1.118","199.232.37.224","TLSv1.2","192","Client Key Exchange, Change Cipher Spec, Encrypted Handshake Message"
"128","0.193144062","192.168.1.118","199.232.37.224","TLSv1.2","192","Client Key Exchange, Change Cipher Spec, Encrypted Handshake Message"
"129","0.195039300","192.168.1.118","199.232.37.224","TLSv1.2","192","Client Key Exchange, Change Cipher Spec, Encrypted Handshake Message"
"130","0.241097000","199.232.37.224","192.168.1.118","TCP","66","443 → 42204 [ACK] Seq=1 Ack=518 Win=28160 Len=0 TSval=663656587 TSecr=1345384515"
"131","0.241972037","199.232.37.224","192.168.1.118","TLSv1.2","1418","Application Data [TCP segment of a reassembled PDU]"
"132","0.242156762","199.232.37.224","192.168.1.118","TLSv1.2","3888","Application Data, Application Data, Application Data, Application Data"
"133","0.247176412","192.168.1.118","199.232.37.224","TCP","66","42192 → 443 [ACK] Seq=973 Ack=49471 Win=145 Len=0 TSval=1345384591 TSecr=3145959461"
"134","0.248821462","192.168.1.118","199.232.37.224","TCP","66","[TCP Window Update] 42190 → 443 [ACK] Seq=853 Ack=67281 Win=179 Len=0 TSval=1345384592 TSecr=4203148499"
"135","0.302051587","199.232.37.224","192.168.1.118","TLSv1.2","3751","Server Hello, Certificate, Server Key Exchange, Server Hello Done"
"136","0.302187950","192.168.1.118","199.232.37.224","TCP","66","42204 → 443 [ACK] Seq=518 Ack=3686 Win=60672 Len=0 TSval=1345384645 TSecr=663656587"
"137","0.303833362","199.232.37.224","192.168.1.118","TCP","66","443 → 42202 [ACK] Seq=3686 Ack=644 Win=28160 Len=0 TSval=276723166 TSecr=1345384538"
"138","0.303963437","199.232.37.224","192.168.1.118","TCP","66","443 → 42206 [ACK] Seq=1 Ack=518 Win=28160 Len=0 TSval=3252306994 TSecr=1345384533"
"139","0.304049712","199.232.37.224","192.168.1.118","TLSv1.2","117","Change Cipher Spec, Encrypted Handshake Message"
"140","0.304139625","199.232.37.224","192.168.1.118","TLSv1.2","117","Change Cipher Spec, Encrypted Handshake Message"
"141","0.304209800","199.232.37.224","192.168.1.118","TLSv1.2","117","Change Cipher Spec, Encrypted Handshake Message"
"142","0.304346575","199.232.37.224","192.168.1.118","TLSv1.2","3751","Server Hello, Certificate, Server Key Exchange, Server Hello Done"
"143","0.304442750","192.168.1.118","199.232.37.224","TCP","66","42206 → 443 [ACK] Seq=518 Ack=3686 Win=60672 Len=0 TSval=1345384648 TSecr=3252306994"
"144","0.304545562","104.196.190.179","192.168.1.118","TCP","66","443 → 34072 [SYN, ACK] Seq=0 Ack=1 Win=28400 Len=0 MSS=1420 SACK_PERM=1 WS=512"
"145","0.304716312","192.168.1.118","104.196.190.179","TCP","54","34072 → 443 [ACK] Seq=1 Ack=1 Win=64256 Len=0"
"146","0.304797725","104.196.190.179","192.168.1.118","TCP","66","443 → 34076 [SYN, ACK] Seq=0 Ack=1 Win=28400 Len=0 MSS=1420 SACK_PERM=1 WS=512"
"147","0.304908225","192.168.1.118","104.196.190.179","TCP","54","34076 → 443 [ACK] Seq=1 Ack=1 Win=64256 Len=0"
"148","0.304985712","104.196.190.179","192.168.1.118","TCP","66","443 → 34074 [SYN, ACK] Seq=0 Ack=1 Win=28400 Len=0 MSS=1420 SACK_PERM=1 WS=512"
"149","0.305096800","192.168.1.118","104.196.190.179","TCP","54","34074 → 443 [ACK] Seq=1 Ack=1 Win=64256 Len=0"
"150","0.306031362","192.168.1.118","199.232.37.224","TLSv1.2","192","Client Key Exchange, Change Cipher Spec, Encrypted Handshake Message"
"151","0.322248962","192.168.1.118","104.196.190.179","TLSv1","571","Client Hello"
"152","0.338432050","199.232.37.224","192.168.1.118","TLSv1.2","1418","Application Data [TCP segment of a reassembled PDU]"
"153","0.338581312","192.168.1.118","104.196.190.179","TLSv1","571","Client Hello"
"154","0.342217487","199.232.37.224","192.168.1.118","TLSv1.2","2770","Application Data, Application Data"
"155","0.343202575","199.232.37.224","192.168.1.118","TLSv1.2","15289","Application Data, Application Data, Application Data, Application Data, Application Data, Application Data, Application Data, Application Data, Application Data, Application Data, Application Data, Application Data"
"156","0.343321050","199.232.37.224","192.168.1.118","TLSv1.2","117","Change Cipher Spec, Encrypted Handshake Message"
"157","0.344980287","192.168.1.118","199.232.37.224","TCP","66","42198 → 443 [ACK] Seq=644 Ack=3737 Win=64128 Len=0 TSval=1345384688 TSecr=2811986197"
"158","0.345107987","192.168.1.118","199.232.37.224","TCP","66","42202 → 443 [ACK] Seq=644 Ack=3737 Win=64128 Len=0 TSval=1345384688 TSecr=276723166"
"159","0.345190275","192.168.1.118","199.232.37.224","TCP","66","42200 → 443 [ACK] Seq=644 Ack=3737 Win=64128 Len=0 TSval=1345384689 TSecr=3463894111"
"160","0.354935800","192.168.1.118","104.196.190.179","TLSv1","571","Client Hello"
"161","0.355050737","192.168.1.118","199.232.37.224","TCP","66","42190 → 443 [ACK] Seq=853 Ack=86560 Win=29 Len=0 TSval=1345384698 TSecr=4203148541"
"162","0.357283412","192.168.1.118","199.232.37.224","TLSv1.2","192","Client Key Exchange, Change Cipher Spec, Encrypted Handshake Message"
"163","0.357602212","192.168.1.118","199.232.37.224","TLSv1.2","305","Application Data"
"164","0.357880100","192.168.1.118","199.232.37.224","TLSv1.2","315","Application Data"
"165","0.358113762","192.168.1.118","199.232.37.224","TLSv1.2","313","Application Data"
"166","0.358340862","192.168.1.118","199.232.37.224","TLSv1.2","310","Application Data"
"167","0.360004500","192.168.1.118","199.232.37.224","TCP","66","[TCP Window Update] 42192 → 443 [ACK] Seq=973 Ack=49471 Win=381 Len=0 TSval=1345384703 TSecr=3145959461"
"168","0.363842287","104.196.190.179","192.168.1.118","TCP","54","443 → 34072 [ACK] Seq=1 Ack=518 Win=29696 Len=0"
"169","0.367433537","104.196.190.179","192.168.1.118","TLSv1.2","1474","Server Hello"
"170","0.367550250","192.168.1.118","104.196.190.179","TCP","54","34072 → 443 [ACK] Seq=518 Ack=1421 Win=63104 Len=0"
"171","0.372323487","104.196.190.179","192.168.1.118","TLSv1.2","1769","Certificate, Server Key Exchange, Server Hello Done"
"172","0.372401337","192.168.1.118","104.196.190.179","TCP","54","34072 → 443 [ACK] Seq=518 Ack=3136 Win=61440 Len=0"
"173","0.377381912","192.168.1.118","104.196.190.179","TLSv1.2","180","Client Key Exchange, Change Cipher Spec, Encrypted Handshake Message"
"174","0.379368050","192.168.1.118","199.232.37.224","TCP","66","[TCP Window Update] 42190 → 443 [ACK] Seq=853 Ack=86560 Win=211 Len=0 TSval=1345384723 TSecr=4203148541"
"175","0.380749075","104.196.190.179","192.168.1.118","TCP","54","443 → 34074 [ACK] Seq=1 Ack=518 Win=29696 Len=0"
"176","0.387116500","104.196.190.179","192.168.1.118","TLSv1.2","3189","Server Hello, Certificate, Server Key Exchange, Server Hello Done"
"177","0.387162387","192.168.1.118","104.196.190.179","TCP","54","34074 → 443 [ACK] Seq=518 Ack=3136 Win=61184 Len=0"
"178","0.396458875","192.168.1.118","104.196.190.179","TLSv1.2","180","Client Key Exchange, Change Cipher Spec, Encrypted Handshake Message"
"179","0.403836437","199.232.37.224","192.168.1.118","TLSv1.2","117","Change Cipher Spec, Encrypted Handshake Message"
"180","0.403907112","192.168.1.118","199.232.37.224","TCP","66","42206 → 443 [ACK] Seq=644 Ack=3737 Win=64128 Len=0 TSval=1345384747 TSecr=3252307027"
"181","0.406917750","104.196.190.179","192.168.1.118","TCP","54","443 → 34076 [ACK] Seq=1 Ack=518 Win=29696 Len=0"
"182","0.407028825","104.196.190.179","192.168.1.118","TLSv1.2","3189","Server Hello, Certificate, Server Key Exchange, Server Hello Done"
"183","0.407095950","192.168.1.118","104.196.190.179","TCP","54","34076 → 443 [ACK] Seq=518 Ack=3136 Win=61184 Len=0"
"184","0.407229150","199.232.37.224","192.168.1.118","TLSv1.2","2770","Application Data, Application Data"
"185","0.407309775","192.168.1.118","199.232.37.224","TCP","66","42202 → 443 [ACK] Seq=891 Ack=6441 Win=61440 Len=0 TSval=1345384751 TSecr=276723202"
"186","0.413909675","192.168.1.118","199.232.37.224","TLSv1.2","305","Application Data"
"187","0.414134687","199.232.37.224","192.168.1.118","TLSv1.2","730","Application Data"
"188","0.414216462","192.168.1.118","199.232.37.224","TCP","66","42200 → 443 [ACK] Seq=893 Ack=4401 Win=63488 Len=0 TSval=1345384758 TSecr=3463894257"
"189","0.414293612","199.232.37.224","192.168.1.118","TLSv1.2","10882","Application Data, Application Data, Application Data, Application Data, Application Data, Application Data, Application Data, Application Data"
"190","0.414372800","192.168.1.118","199.232.37.224","TCP","66","42202 → 443 [ACK] Seq=891 Ack=17257 Win=50688 Len=0 TSval=1345384758 TSecr=276723202"
"191","0.414413750","199.232.37.224","192.168.1.118","TLSv1.2","1418","Application Data"
"192","0.414491087","192.168.1.118","199.232.37.224","TCP","66","42198 → 443 [ACK] Seq=883 Ack=5089 Win=63104 Len=0 TSval=1345384758 TSecr=2811986233"
"193","0.415957587","192.168.1.118","104.196.190.179","TLSv1.2","180","Client Key Exchange, Change Cipher Spec, Encrypted Handshake Message"
"194","0.416744575","199.232.37.224","192.168.1.118","TLSv1.2","12234","Application Data, Application Data, Application Data, Application Data, Application Data, Application Data, Application Data, Application Data, Application Data"
"195","0.416826462","192.168.1.118","199.232.37.224","TCP","66","42198 → 443 [ACK] Seq=883 Ack=17257 Win=50944 Len=0 TSval=1345384760 TSecr=2811986233"
"196","0.416869900","199.232.37.224","192.168.1.118","TLSv1.2","9530","Application Data, Application Data, Application Data, Application Data, Application Data, Application Data"
"197","0.416940050","192.168.1.118","199.232.37.224","TCP","66","42200 → 443 [ACK] Seq=893 Ack=13865 Win=54144 Len=0 TSval=1345384760 TSecr=3463894257"
"198","0.436873825","192.168.1.118","199.232.37.224","TCP","66","[TCP Window Update] 42190 → 443 [ACK] Seq=853 Ack=86560 Win=486 Len=0 TSval=1345384780 TSecr=4203148541"
"199","0.456403287","199.232.37.224","192.168.1.118","TLSv1.2","725","Application Data"
"200","0.456854987","199.232.37.224","192.168.1.118","TLSv1.2","2770","Application Data, Application Data"
"201","0.456949450","192.168.1.118","199.232.37.224","TCP","66","42200 → 443 [ACK] Seq=893 Ack=16569 Win=61056 Len=0 TSval=1345384800 TSecr=3463894257"
"202","0.457021762","199.232.37.224","192.168.1.118","TLSv1.2","12234","Application Data, Application Data, Application Data, Application Data, Application Data, Application Data, Application Data, Application Data"
"203","0.457085562","199.232.37.224","192.168.1.118","TLSv1.2","2770","Application Data, Application Data"
"204","0.457155262","192.168.1.118","199.232.37.224","TCP","66","42202 → 443 [ACK] Seq=891 Ack=19961 Win=61056 Len=0 TSval=1345384800 TSecr=276723207"
"205","0.461570662","104.196.190.179","192.168.1.118","TLSv1.2","105","Change Cipher Spec, Encrypted Handshake Message"
"206","0.461979937","199.232.37.224","192.168.1.118","TLSv1.2","2770","Application Data, Application Data"
"207","0.462077950","192.168.1.118","199.232.37.224","TCP","66","42202 → 443 [ACK] Seq=891 Ack=22665 Win=58368 Len=0 TSval=1345384805 TSecr=276723207"
"208","0.462149200","199.232.37.224","192.168.1.118","TLSv1.2","393","Application Data"
"209","0.462222475","192.168.1.118","199.232.37.224","TCP","66","42202 → 443 [ACK] Seq=891 Ack=22992 Win=58112 Len=0 TSval=1345384806 TSecr=276723211"
"210","0.462338962","199.232.37.224","192.168.1.118","TLSv1.2","13586","Application Data, Application Data, Application Data, Application Data, Application Data, Application Data, Application Data, Application Data, Application Data, Application Data"
"211","0.462415125","199.232.37.224","192.168.1.118","TLSv1.2","2770","Application Data, Application Data"
"212","0.462486350","192.168.1.118","199.232.37.224","TCP","66","42200 → 443 [ACK] Seq=893 Ack=19273 Win=58368 Len=0 TSval=1345384806 TSecr=3463894291"
"213","0.463213575","199.232.37.224","192.168.1.118","TLSv1.2","12234","Application Data, Application Data, Application Data, Application Data, Application Data, Application Data, Application Data, Application Data"
"214","0.463314575","192.168.1.118","199.232.37.224","TCP","66","42198 → 443 [ACK] Seq=883 Ack=29425 Win=46720 Len=0 TSval=1345384807 TSecr=2811986242"
"215","0.463592525","199.232.37.224","192.168.1.118","TLSv1.2","9530","Application Data, Application Data, Application Data, Application Data, Application Data, Application Data, Application Data"
"216","0.463719537","192.168.1.118","199.232.37.224","TCP","66","42198 → 443 [ACK] Seq=883 Ack=38889 Win=37376 Len=0 TSval=1345384807 TSecr=2811986242"
"217","0.466799625","192.168.1.118","199.232.37.224","TCP","66","42206 → 443 [ACK] Seq=883 Ack=17257 Win=50688 Len=0 TSval=1345384810 TSecr=3252307037"
"218","0.467264312","192.168.1.118","199.232.37.224","TCP","66","42204 → 443 [ACK] Seq=888 Ack=16564 Win=51328 Len=0 TSval=1345384811 TSecr=663656627"
"219","0.467661837","192.168.1.118","104.196.190.179","TLSv1.2","660","Application Data"
"220","0.478769287","192.168.1.118","199.232.37.224","TLSv1.2","309","Application Data"
"221","0.491844625","104.196.190.179","192.168.1.118","TLSv1.2","105","Change Cipher Spec, Encrypted Handshake Message"
"222","0.492167400","199.232.37.224","192.168.1.118","TLSv1.2","10705","Application Data, Application Data, Application Data, Application Data, Application Data, Application Data, Application Data, Application Data, Application Data"
"223","0.492270662","192.168.1.118","199.232.37.224","TCP","66","42200 → 443 [ACK] Seq=893 Ack=29912 Win=48768 Len=0 TSval=1345384836 TSecr=3463894296"
"224","0.492370075","104.196.190.179","192.168.1.118","TLSv1.2","105","Change Cipher Spec, Encrypted Handshake Message"
"225","0.492439312","199.232.37.224","192.168.1.118","TLSv1.2","5474","Application Data, Application Data, Application Data, Application Data"
"226","0.492518962","192.168.1.118","199.232.37.224","TCP","66","42198 → 443 [ACK] Seq=883 Ack=44297 Win=56704 Len=0 TSval=1345384836 TSecr=2811986242"
"227","0.493934012","192.168.1.118","104.196.190.179","TLSv1.2","656","Application Data"
"228","0.494186850","192.168.1.118","104.196.190.179","TLSv1.2","658","Application Data"
"229","0.509721462","192.168.1.118","199.232.37.224","TLSv1.2","310","Application Data"
"230","0.539525175","199.232.37.224","192.168.1.118","TLSv1.2","1418","Application Data [TCP segment of a reassembled PDU]"
"231","0.540785675","199.232.37.224","192.168.1.118","TLSv1.2","3256","Application Data, Application Data, Application Data"
"232","0.540832425","192.168.1.118","199.232.37.224","TCP","66","42204 → 443 [ACK] Seq=888 Ack=21106 Win=70528 Len=0 TSval=1345384884 TSecr=663656662"
"233","0.540890012","199.232.37.224","192.168.1.118","TLSv1.2","5474","Application Data, Application Data, Application Data, Application Data"
"234","0.540909762","192.168.1.118","199.232.37.224","TCP","66","42206 → 443 [ACK] Seq=883 Ack=22665 Win=56960 Len=0 TSval=1345384884 TSecr=3252307065"
"235","0.546038400","199.232.37.224","192.168.1.118","TLSv1.2","4122","Application Data, Application Data, Application Data"
"236","0.546109687","192.168.1.118","199.232.37.224","TCP","66","42198 → 443 [ACK] Seq=883 Ack=48353 Win=72320 Len=0 TSval=1345384889 TSecr=2811986269"
"237","0.546154287","199.232.37.224","192.168.1.118","TLSv1.2","10882","Application Data, Application Data, Application Data, Application Data, Application Data, Application Data, Application Data"
"238","0.547690925","199.232.37.224","192.168.1.118","TLSv1.2","1455","Application Data, Application Data"
"239","0.547763662","192.168.1.118","199.232.37.224","TCP","66","42198 → 443 [ACK] Seq=883 Ack=49742 Win=75008 Len=0 TSval=1345384891 TSecr=2811986269"
"240","0.547916037","199.232.37.224","192.168.1.118","TLSv1.2","16290","Application Data, Application Data, Application Data, Application Data, Application Data, Application Data, Application Data, Application Data, Application Data, Application Data, Application Data, Application Data"
"241","0.547949962","199.232.37.224","192.168.1.118","TLSv1.2","2770","Application Data, Application Data"
"242","0.548193712","192.168.1.118","199.232.37.224","TCP","66","42206 → 443 [ACK] Seq=883 Ack=33481 Win=46208 Len=0 TSval=1345384892 TSecr=3252307066"
"243","0.548340037","192.168.1.118","199.232.37.224","TCP","66","42202 → 443 [ACK] Seq=1134 Ack=39216 Win=48000 Len=0 TSval=1345384892 TSecr=276723238"
"244","0.548472825","192.168.1.118","199.232.37.224","TCP","66","42200 → 443 [ACK] Seq=1137 Ack=32616 Win=61440 Len=0 TSval=1345384892 TSecr=3463894401"
"245","0.548699162","192.168.1.118","199.232.37.224","TLSv1.2","309","Application Data"
"246","0.549932962","199.232.37.224","192.168.1.118","TLSv1.2","2770","Application Data, Application Data"
"247","0.550723812","199.232.37.224","192.168.1.118","TLSv1.2","12272","Application Data, Application Data, Application Data, Application Data, Application Data, Application Data, Application Data, Application Data, Application Data, Application Data"
"248","0.550804350","199.232.37.224","192.168.1.118","TLSv1.2","2770","Application Data, Application Data"
"249","0.550819687","199.232.37.224","192.168.1.118","TLSv1.2","2770","Application Data, Application Data"
"250","0.551794375","192.168.1.118","199.232.37.224","TCP","66","42206 → 443 [ACK] Seq=883 Ack=36185 Win=43520 Len=0 TSval=1345384895 TSecr=3252307066"
"251","0.551964975","192.168.1.118","199.232.37.224","TCP","66","42202 → 443 [ACK] Seq=1134 Ack=41920 Win=45312 Len=0 TSval=1345384895 TSecr=276723238"
"252","0.552017562","192.168.1.118","199.232.37.224","TCP","66","42200 → 443 [ACK] Seq=1137 Ack=47526 Win=46592 Len=0 TSval=1345384895 TSecr=3463894401"
"253","0.558497650","192.168.1.118","199.232.37.224","TLSv1.2","310","Application Data"
"254","0.565458312","199.232.37.224","192.168.1.118","TLSv1.2","2770","Application Data [TCP segment of a reassembled PDU]"
"255","0.565582687","192.168.1.118","199.232.37.224","TCP","66","42202 → 443 [ACK] Seq=1134 Ack=44624 Win=42624 Len=0 TSval=1345384909 TSecr=276723238"
"256","0.565658350","199.232.37.224","192.168.1.118","TLSv1.2","2770","Application Data, Application Data"
"257","0.565785137","192.168.1.118","199.232.37.224","TCP","66","42202 → 443 [ACK] Seq=1134 Ack=47328 Win=39936 Len=0 TSval=1345384909 TSecr=276723239"
"258","0.565848137","199.232.37.224","192.168.1.118","TLSv1.2","2770","Application Data, Application Data"
"259","0.565912912","192.168.1.118","199.232.37.224","TCP","66","42206 → 443 [ACK] Seq=883 Ack=38889 Win=61056 Len=0 TSval=1345384909 TSecr=3252307066"
"260","0.565963587","199.232.37.224","192.168.1.118","TLSv1.2","2770","Application Data, Application Data"
"261","0.566002875","104.196.190.179","192.168.1.118","TCP","11414","[TCP segment of a reassembled PDU]"
"262","0.568596237","192.168.1.118","104.196.190.179","TCP","54","34072 → 443 [ACK] Seq=1250 Ack=14547 Win=52864 Len=0"
"263","0.568743512","192.168.1.118","199.232.37.224","TCP","66","42202 → 443 [ACK] Seq=1134 Ack=50032 Win=37248 Len=0 TSval=1345384912 TSecr=276723240"
"264","0.568918525","192.168.1.118","199.232.37.224","TLSv1.2","307","Application Data"
"265","0.570544012","104.196.190.179","192.168.1.118","TLSv1.2","5107","Application Data"
"266","0.570636850","192.168.1.118","104.196.190.179","TCP","54","34072 → 443 [ACK] Seq=1250 Ack=19600 Win=56960 Len=0"
"267","0.570812437","104.196.190.179","192.168.1.118","TCP","9994","[TCP segment of a reassembled PDU]"
"268","0.570981312","104.196.190.179","192.168.1.118","TLSv1.2","4899","Application Data"
"269","0.571049825","104.196.190.179","192.168.1.118","TCP","1474","[TCP segment of a reassembled PDU]"
"270","0.572570262","104.196.190.179","192.168.1.118","TLSv1.2","15047","Application Data"
"271","0.572721612","199.232.37.224","192.168.1.118","TLSv1.2","2770","Application Data, Application Data"
"272","0.572775550","192.168.1.118","199.232.37.224","TCP","66","42202 → 443 [ACK] Seq=1134 Ack=52736 Win=52864 Len=0 TSval=1345384916 TSecr=276723241"
"273","0.572810562","199.232.37.224","192.168.1.118","TLSv1.2","649","Application Data, Application Data"
"274","0.572849275","199.232.37.224","192.168.1.118","TLSv1.2","2770","Application Data, Application Data"
"275","0.572930625","192.168.1.118","199.232.37.224","TCP","66","42206 → 443 [ACK] Seq=883 Ack=41593 Win=58368 Len=0 TSval=1345384916 TSecr=3252307067"
"276","0.573235625","192.168.1.118","104.196.190.179","TCP","54","34074 → 443 [ACK] Seq=1246 Ack=19600 Win=47744 Len=0"
"277","0.573446475","192.168.1.118","104.196.190.179","TCP","54","34076 → 443 [ACK] Seq=1248 Ack=17972 Win=49408 Len=0"
"278","0.576570687","104.196.190.179","192.168.1.118","TCP","2894","[TCP segment of a reassembled PDU]"
"279","0.576629325","192.168.1.118","104.196.190.179","TCP","54","34072 → 443 [ACK] Seq=1250 Ack=22440 Win=61056 Len=0"
"280","0.576746475","199.232.37.224","192.168.1.118","TLSv1.2","2770","Application Data, Application Data"
"281","0.576776675","199.232.37.224","192.168.1.118","TLSv1.2","1418","Application Data [TCP segment of a reassembled PDU]"
"282","0.576824450","192.168.1.118","199.232.37.224","TCP","66","42206 → 443 [ACK] Seq=883 Ack=44297 Win=55680 Len=0 TSval=1345384920 TSecr=3252307069"
"283","0.576915387","104.196.190.179","192.168.1.118","TCP","2894","[TCP segment of a reassembled PDU]"
"284","0.576958562","192.168.1.118","104.196.190.179","TCP","54","34074 → 443 [ACK] Seq=1246 Ack=22440 Win=61056 Len=0"
"285","0.576987250","199.232.37.224","192.168.1.118","TLSv1.2","2770","Application Data, Application Data"
"286","0.577014737","199.232.37.224","192.168.1.118","TLSv1.2","9530","Application Data, Application Data, Application Data, Application Data, Application Data, Application Data, Application Data"
"287","0.577087387","192.168.1.118","199.232.37.224","TCP","66","42204 → 443 [ACK] Seq=1131 Ack=30570 Win=63104 Len=0 TSval=1345384920 TSecr=663656670"
"288","0.577235187","192.168.1.118","199.232.37.224","TCP","66","42206 → 443 [ACK] Seq=883 Ack=48353 Win=51712 Len=0 TSval=1345384921 TSecr=3252307071"
"289","0.578189287","199.232.37.224","192.168.1.118","TLSv1.2","6826","Application Data, Application Data, Application Data, Application Data, Application Data"
"290","0.578222100","199.232.37.224","192.168.1.118","TLSv1.2","2770","Application Data, Application Data"
"291","0.579566675","192.168.1.118","199.232.37.224","TCP","66","42206 → 443 [ACK] Seq=883 Ack=51057 Win=49024 Len=0 TSval=1345384923 TSecr=3252307072"
"292","0.579737837","192.168.1.118","199.232.37.224","TCP","66","42204 → 443 [ACK] Seq=1131 Ack=37330 Win=56448 Len=0 TSval=1345384923 TSecr=663656670"
"293","0.585332925","192.168.1.118","199.232.37.224","TLSv1.2","310","Application Data"
"294","0.586571200","199.232.37.224","192.168.1.118","TLSv1.2","2770","Application Data, Application Data"
"295","0.586635337","199.232.37.224","192.168.1.118","TLSv1.2","2770","Application Data, Application Data"
"296","0.586691950","192.168.1.118","199.232.37.224","TCP","66","42206 → 443 [ACK] Seq=883 Ack=53761 Win=61056 Len=0 TSval=1345384930 TSecr=3252307073"
"297","0.588090812","192.168.1.118","199.232.37.224","TCP","66","42204 → 443 [ACK] Seq=1131 Ack=40034 Win=53760 Len=0 TSval=1345384931 TSecr=663656670"
"298","0.610441325","192.168.1.103","224.0.0.251","MDNS","158","Standard query 0x0000 PTR _companion-link._tcp.local, "QM" question PTR _sleep-proxy._udp.local, "QM" question PTR cjqg._companion-link._tcp.local OPT"
"299","0.627445237","199.232.37.224","192.168.1.118","TLSv1.2","5474","Application Data, Application Data, Application Data, Application Data"
"300","0.627524550","192.168.1.118","199.232.37.224","TCP","66","42198 → 443 [ACK] Seq=1127 Ack=55150 Win=85888 Len=0 TSval=1345384971 TSecr=2811986279"
"301","0.627718212","199.232.37.224","192.168.1.118","TLSv1.2","16290","Application Data, Application Data, Application Data, Application Data, Application Data, Application Data, Application Data, Application Data, Application Data, Application Data, Application Data"
"302","0.628951362","192.168.1.118","199.232.37.224","TCP","66","42198 → 443 [ACK] Seq=1127 Ack=71374 Win=69760 Len=0 TSval=1345384972 TSecr=2811986279"
"303","0.629918475","199.232.37.224","192.168.1.118","TLSv1.2","499","Application Data, Application Data"
"304","0.630011937","199.232.37.224","192.168.1.118","TLSv1.2","3948","Application Data, Application Data, Application Data, Application Data"
"305","0.630058925","199.232.37.224","192.168.1.118","TLSv1.2","2770","Application Data [TCP segment of a reassembled PDU]"
"306","0.630101200","192.168.1.118","199.232.37.224","TCP","66","42204 → 443 [ACK] Seq=1131 Ack=42738 Win=73344 Len=0 TSval=1345384973 TSecr=663656670"
"307","0.630142375","199.232.37.224","192.168.1.118","TLSv1.2","1418","Application Data [TCP segment of a reassembled PDU]"
"308","0.630222287","199.232.37.224","192.168.1.118","TLSv1.2","1418","Application Data [TCP segment of a reassembled PDU]"
"309","0.630246875","199.232.37.224","192.168.1.118","TLSv1.2","1004","Application Data, Application Data"
"310","0.630346787","199.232.37.224","192.168.1.118","TLSv1.2","9530","Application Data, Application Data, Application Data, Application Data, Application Data, Application Data, Application Data"
"311","0.631484925","192.168.1.118","199.232.37.224","TCP","66","42206 → 443 [ACK] Seq=883 Ack=57643 Win=64128 Len=0 TSval=1345384975 TSecr=3252307074"
"312","0.631592300","192.168.1.118","199.232.37.224","TCP","66","42204 → 443 [ACK] Seq=1131 Ack=46380 Win=73344 Len=0 TSval=1345384975 TSecr=663656671"
"313","0.631719137","192.168.1.118","199.232.37.224","TCP","66","42202 → 443 [ACK] Seq=1378 Ack=62783 Win=64128 Len=0 TSval=1345384975 TSecr=276723254"
"314","0.631976687","199.232.37.224","192.168.1.118","TLSv1.2","6826","Application Data, Application Data, Application Data, Application Data, Application Data"
"315","0.632027587","192.168.1.118","199.232.37.224","TCP","66","42202 → 443 [ACK] Seq=1378 Ack=69543 Win=77696 Len=0 TSval=1345384975 TSecr=276723254"
"316","0.632055500","199.232.37.224","192.168.1.118","TLSv1.2","2770","Application Data, Application Data"
"317","0.632568125","199.232.37.224","192.168.1.118","TLSv1.2","4122","Application Data, Application Data, Application Data"
"318","0.632850900","199.232.37.224","192.168.1.118","TLSv1.2","8178","Application Data, Application Data, Application Data, Application Data, Application Data, Application Data"
"319","0.634783012","192.168.1.118","199.232.37.224","TCP","66","42200 → 443 [ACK] Seq=1378 Ack=62398 Win=50560 Len=0 TSval=1345384978 TSecr=3463894464"
"320","0.636984962","199.232.37.224","192.168.1.118","TLSv1.2","2770","Application Data, Application Data"
"321","0.637028787","199.232.37.224","192.168.1.118","TLSv1.2","2770","Application Data, Application Data"
"322","0.637073150","192.168.1.118","199.232.37.224","TCP","66","42202 → 443 [ACK] Seq=1378 Ack=72247 Win=83072 Len=0 TSval=1345384980 TSecr=276723254"
"323","0.637218287","199.232.37.224","192.168.1.118","TLSv1.2","2770","Application Data [TCP segment of a reassembled PDU]"
"324","0.637264862","192.168.1.118","199.232.37.224","TCP","66","42202 → 443 [ACK] Seq=1378 Ack=74951 Win=88448 Len=0 TSval=1345384981 TSecr=276723254"
"325","0.637290025","199.232.37.224","192.168.1.118","TLSv1.2","92","Application Data"
"326","0.637353475","199.232.37.224","192.168.1.118","TLSv1.2","4122","Application Data, Application Data"
"327","0.637410862","199.232.37.224","192.168.1.118","TLSv1.2","2770","Application Data, Application Data"
"328","0.637463175","199.232.37.224","192.168.1.118","TLSv1.2","2770","Application Data, Application Data"
"329","0.637502125","199.232.37.224","192.168.1.118","TLSv1.2","949","Application Data, Application Data"
"330","0.637543137","104.196.190.179","192.168.1.118","TCP","1474","443 → 34072 [ACK] Seq=22440 Ack=1250 Win=30720 Len=1420 [TCP segment of a reassembled PDU]"
"331","0.638074137","192.168.1.118","199.232.37.224","TCP","66","42200 → 443 [ACK] Seq=1378 Ack=75449 Win=37632 Len=0 TSval=1345384981 TSecr=3463894464"
"332","0.638298500","192.168.1.118","199.232.37.224","TLSv1.2","310","Application Data"
"333","0.640300050","104.196.190.179","192.168.1.118","TLSv1.2","1859","Application Data"
"334","0.640358275","192.168.1.118","104.196.190.179","TCP","54","34074 → 443 [ACK] Seq=1246 Ack=24245 Win=61056 Len=0"
"335","0.640413050","104.196.190.179","192.168.1.118","TCP","4314","443 → 34072 [ACK] Seq=23860 Ack=1250 Win=30720 Len=4260 [TCP segment of a reassembled PDU]"
"336","0.640538062","104.196.190.179","192.168.1.118","TLSv1.2","8574","Application Data [TCP segment of a reassembled PDU]"
"337","0.641973937","192.168.1.118","104.196.190.179","TCP","54","34072 → 443 [ACK] Seq=1250 Ack=36640 Win=46976 Len=0"
"338","0.642559350","192.168.1.118","199.232.37.224","TLSv1.2","310","Application Data"
"339","0.656470600","192.168.1.118","199.232.37.224","TLSv1.2","317","Application Data"
"340","0.678230625","104.196.190.179","192.168.1.118","TCP","5734","443 → 34072 [ACK] Seq=36640 Ack=1250 Win=30720 Len=5680 [TCP segment of a reassembled PDU]"
"341","0.678321075","192.168.1.118","104.196.190.179","TCP","54","34072 → 443 [ACK] Seq=1250 Ack=42320 Win=56960 Len=0"
"342","0.678576975","104.196.190.179","192.168.1.118","TLSv1.2","11414","Application Data [TCP segment of a reassembled PDU]"
"343","0.678756912","199.232.37.224","192.168.1.118","TLSv1.2","5474","Application Data, Application Data, Application Data, Application Data"
"344","0.678848375","192.168.1.118","199.232.37.224","TCP","66","42206 → 443 [ACK] Seq=1127 Ack=63051 Win=75008 Len=0 TSval=1345385022 TSecr=3252307098"
"345","0.678929437","192.168.1.118","199.232.37.224","TCP","66","42202 → 443 [ACK] Seq=1378 Ack=74977 Win=88448 Len=0 TSval=1345385022 TSecr=276723255"
"346","0.680958987","192.168.1.118","104.196.190.179","TCP","54","34072 → 443 [ACK] Seq=1250 Ack=53680 Win=48768 Len=0"
"347","0.681179937","199.232.37.224","192.168.1.118","TLSv1.2","5474","Application Data, Application Data, Application Data, Application Data"
"348","0.681256525","192.168.1.118","199.232.37.224","TCP","66","42206 → 443 [ACK] Seq=1127 Ack=68459 Win=85760 Len=0 TSval=1345385025 TSecr=3252307098"
"349","0.681830050","199.232.37.224","192.168.1.118","TLSv1.2","8178","Application Data, Application Data, Application Data, Application Data, Application Data, Application Data"
"350","0.681906787","192.168.1.118","199.232.37.224","TCP","66","42206 → 443 [ACK] Seq=1127 Ack=76571 Win=102016 Len=0 TSval=1345385025 TSecr=3252307098"
"351","0.681949387","199.232.37.224","192.168.1.118","TLSv1.2","8178","Application Data, Application Data, Application Data, Application Data, Application Data, Application Data"
"352","0.682032137","192.168.1.118","199.232.37.224","TCP","66","42204 → 443 [ACK] Seq=1375 Ack=54492 Win=89600 Len=0 TSval=1345385025 TSecr=663656695"
"353","0.685494062","199.232.37.224","192.168.1.118","TLSv1.2","5474","Application Data, Application Data, Application Data"
"354","0.685546762","192.168.1.118","199.232.37.224","TCP","66","42206 → 443 [ACK] Seq=1127 Ack=81979 Win=112768 Len=0 TSval=1345385029 TSecr=3252307098"
"355","0.685647825","199.232.37.224","192.168.1.118","TLSv1.2","13150","Application Data, Application Data, Application Data, Application Data, Application Data, Application Data, Application Data, Application Data, Application Data, Application Data"
"356","0.685704137","192.168.1.118","199.232.37.224","TCP","66","42204 → 443 [ACK] Seq=1375 Ack=67576 Win=102016 Len=0 TSval=1345385029 TSecr=663656695"
"357","0.685739375","199.232.37.224","192.168.1.118","TLSv1.2","2770","Application Data, Application Data"
"358","0.685783900","192.168.1.118","199.232.37.224","TCP","66","42206 → 443 [ACK] Seq=1127 Ack=84683 Win=118272 Len=0 TSval=1345385029 TSecr=3252307099"
"359","0.687763500","199.232.37.224","192.168.1.118","TLSv1.2","2770","Application Data, Application Data"
"360","0.687809600","192.168.1.118","199.232.37.224","TCP","66","42206 → 443 [ACK] Seq=1127 Ack=87387 Win=123648 Len=0 TSval=1345385031 TSecr=3252307099"
"361","0.687839925","199.232.37.224","192.168.1.118","TLSv1.2","493","Application Data, Application Data"
"362","0.687908250","104.196.190.179","192.168.1.118","TCP","2894","443 → 34072 [ACK] Seq=53680 Ack=1250 Win=30720 Len=2840 [TCP segment of a reassembled PDU]"
"363","0.687951425","192.168.1.118","104.196.190.179","TCP","54","34072 → 443 [ACK] Seq=1250 Ack=56520 Win=61056 Len=0"
"364","0.688062662","104.196.190.179","192.168.1.118","TCP","2894","443 → 34072 [ACK] Seq=56520 Ack=1250 Win=30720 Len=2840 [TCP segment of a reassembled PDU]"
"365","0.688600375","104.196.190.179","192.168.1.118","TCP","1474","443 → 34072 [ACK] Seq=59360 Ack=1250 Win=30720 Len=1420 [TCP segment of a reassembled PDU]"
"366","0.688829487","192.168.1.118","104.196.190.179","TCP","54","34072 → 443 [ACK] Seq=1250 Ack=60780 Win=64128 Len=0"
"367","0.698168100","104.196.190.179","192.168.1.118","TCP","1474","443 → 34072 [ACK] Seq=60780 Ack=1250 Win=30720 Len=1420 [TCP segment of a reassembled PDU]"
"368","0.700826437","104.196.190.179","192.168.1.118","TCP","2894","443 → 34072 [ACK] Seq=62200 Ack=1250 Win=30720 Len=2840 [TCP segment of a reassembled PDU]"
"369","0.700868512","199.232.37.224","192.168.1.118","TLSv1.2","2770","Application Data, Application Data"
"370","0.700950762","192.168.1.118","199.232.37.224","TCP","66","42198 → 443 [ACK] Seq=1378 Ack=74511 Win=91264 Len=0 TSval=1345385044 TSecr=2811986307"
"371","0.700996150","192.168.1.118","104.196.190.179","TCP","54","34072 → 443 [ACK] Seq=1250 Ack=65040 Win=64128 Len=0"
"372","0.701253100","199.232.37.224","192.168.1.118","TLSv1.2","15006","Application Data, Application Data, Application Data, Application Data, Application Data, Application Data, Application Data, Application Data, Application Data, Application Data, Application Data, Application Data"
"373","0.701372350","192.168.1.118","199.232.37.224","TCP","66","42198 → 443 [ACK] Seq=1378 Ack=89451 Win=76416 Len=0 TSval=1345385045 TSecr=2811986307"
"374","0.705255237","104.196.190.179","192.168.1.118","TLSv1.2","5734","Application Data [TCP segment of a reassembled PDU]"
"375","0.706674875","192.168.1.118","104.196.190.179","TCP","54","34072 → 443 [ACK] Seq=1250 Ack=70720 Win=64128 Len=0"
"376","0.721037937","104.196.190.179","192.168.1.118","TCP","5734","443 → 34072 [ACK] Seq=70720 Ack=1250 Win=30720 Len=5680 [TCP segment of a reassembled PDU]"
"377","0.721126800","192.168.1.118","104.196.190.179","TCP","54","34072 → 443 [ACK] Seq=1250 Ack=76400 Win=75520 Len=0"
"378","0.724357075","104.196.190.179","192.168.1.118","TLSv1.2","4095","Application Data"
"379","0.724436087","192.168.1.118","104.196.190.179","TCP","54","34072 → 443 [ACK] Seq=1250 Ack=80441 Win=83584 Len=0"
"380","0.728664000","192.168.1.118","199.232.37.224","TCP","66","42206 → 443 [ACK] Seq=1127 Ack=87814 Win=126336 Len=0 TSval=1345385072 TSecr=3252307100"
"381","1.389421050","192.168.1.118","192.168.1.102","TCP","176","44768 → 8009 [PSH, ACK] Seq=1 Ack=1 Win=501 Len=110 TSval=2260329543 TSecr=5485161 [TCP segment of a reassembled PDU]"
"382","1.398675862","192.168.1.102","192.168.1.118","TCP","176","8009 → 44768 [PSH, ACK] Seq=1 Ack=111 Win=294 Len=110 TSval=5485662 TSecr=2260329543 [TCP segment of a reassembled PDU]"
"383","1.398859700","192.168.1.118","192.168.1.102","TCP","66","44768 → 8009 [ACK] Seq=111 Ack=111 Win=501 Len=0 TSval=2260329552 TSecr=5485662"
"384","2.241079450","192.168.1.104","255.255.255.255","UDP","217","49154 → 6666 Len=175"
"385","5.980417700","IntelCor_b7:52:73","Broadcast","ARP","60","Who has 192.168.1.1? Tell 192.168.1.118"
"386","5.986014887","Cisco-Li_5b:1c:ce","IntelCor_b7:52:73","ARP","42","192.168.1.1 is at 58:6d:8f:5b:1c:ce"
"387","6.035750087","192.168.1.100","224.0.0.251","MDNS","558","Standard query 0x0000 PTR _googlecast._tcp.local, "QU" question PTR _homekit._tcp.local, "QU" question PTR _uscan._tcp.local, "QU" question PTR _ptp._tcp.local, "QU" question PTR _ippusb._tcp.local, "QU" question PTR _scanner._tcp.local, "QU" question PTR _ipp._tcp.local, "QU" question PTR _pdl-datastream._tcp.local, "QU" question PTR _uscans._tcp.local, "QU" question PTR _ipps._tcp.local, "QU" question PTR _printer._tcp.local, "QU" question PTR _airplay._tcp.local, "QU" question PTR _raop._tcp.local, "QU" question PTR _airport._tcp.local, "QU" question PTR _rdlink._tcp.local, "QU" question TXT Google-Home-Mini-2c3f16b2da5c4b6fd6cfbfba61c12490._googlecast._tcp.local, "QU" question PTR _companion-link._tcp.local, "QU" question PTR _apple-mobdev._tcp.local, "QU" question PTR 8ed307c3._sub._apple-mobdev2._tcp.local, "QU" question PTR _apple-pairable._tcp.local, "QU" question ANY cjqg._smb._tcp.local, "QU" question ANY cjqg._companion-link._tcp.local, "QU" question PTR Google-Home-Mini-2c3f16b2da5c4b6fd6cfbfba61c12490._googlecast._tcp.local PTR cjqg._companion-link._tcp.local SRV 0 0 445 cjqg.local SRV 0 0 51016 cjqg.local OPT"
"388","6.048545150","192.168.1.100","224.0.0.251","MDNS","288","Standard query response 0x0000 PTR _smb._tcp.local TXT TXT OPT"
"389","6.341888650","192.168.1.100","224.0.0.251","MDNS","175","Standard query 0x0000 ANY cjqg._smb._tcp.local, "QM" question ANY cjqg._companion-link._tcp.local, "QM" question SRV 0 0 445 cjqg.local SRV 0 0 51016 cjqg.local OPT"
"390","6.403374950","192.168.1.118","192.168.1.102","TCP","176","44768 → 8009 [PSH, ACK] Seq=111 Ack=111 Win=501 Len=110 TSval=2260334557 TSecr=5485662 [TCP segment of a reassembled PDU]"
"391","6.419752950","192.168.1.102","192.168.1.118","TCP","176","8009 → 44768 [PSH, ACK] Seq=111 Ack=221 Win=294 Len=110 TSval=5486164 TSecr=2260334557 [TCP segment of a reassembled PDU]"
"392","6.419886150","192.168.1.118","192.168.1.102","TCP","66","44768 → 8009 [ACK] Seq=221 Ack=221 Win=501 Len=0 TSval=2260334573 TSecr=5486164"
"393","6.644113862","192.168.1.100","224.0.0.251","MDNS","175","Standard query 0x0000 ANY cjqg._smb._tcp.local, "QM" question ANY cjqg._companion-link._tcp.local, "QM" question SRV 0 0 445 cjqg.local SRV 0 0 51016 cjqg.local OPT"
"394","7.055929687","192.168.1.100","224.0.0.251","MDNS","477","Standard query 0x0000 PTR _googlecast._tcp.local, "QM" question PTR _homekit._tcp.local, "QM" question PTR _uscan._tcp.local, "QM" question PTR _ptp._tcp.local, "QM" question PTR _ippusb._tcp.local, "QM" question PTR _scanner._tcp.local, "QM" question PTR _ipp._tcp.local, "QM" question PTR _pdl-datastream._tcp.local, "QM" question PTR _uscans._tcp.local, "QM" question PTR _ipps._tcp.local, "QM" question PTR _printer._tcp.local, "QM" question PTR _airplay._tcp.local, "QM" question PTR _raop._tcp.local, "QM" question PTR _airport._tcp.local, "QM" question PTR _rdlink._tcp.local, "QM" question TXT Google-Home-Mini-2c3f16b2da5c4b6fd6cfbfba61c12490._googlecast._tcp.local, "QM" question PTR _companion-link._tcp.local, "QM" question PTR _apple-mobdev._tcp.local, "QM" question PTR 8ed307c3._sub._apple-mobdev2._tcp.local, "QM" question PTR _apple-pairable._tcp.local, "QM" question PTR cjqg._companion-link._tcp.local OPT"
"395","7.157940150","192.168.1.102","224.0.0.251","MDNS","409","Standard query response 0x0000 PTR Google-Home-Mini-2c3f16b2da5c4b6fd6cfbfba61c12490._googlecast._tcp.local TXT, cache flush SRV, cache flush 0 0 8009 2c3f16b2-da5c-4b6f-d6cf-bfba61c12490.local A, cache flush 192.168.1.102"
"396","7.160341100","192.168.1.102","224.0.0.251","MDNS","183","Standard query response 0x0000 SRV, cache flush 0 0 8009 2c3f16b2-da5c-4b6f-d6cf-bfba61c12490.local"
"397","7.465283825","192.168.1.102","224.0.0.251","MDNS","81","Standard query 0x0000 PTR _googlerpc._tcp.local, "QM" question"
"398","7.466450525","192.168.1.102","224.0.0.251","MDNS","91","Standard query 0x0000 SRV googlerpc._googlerpc._tcp.local, "QM" question"
"399","7.469995312","192.168.1.102","224.0.0.251","MDNS","220","Standard query response 0x0000 PTR googlerpc._googlerpc._tcp.local TXT, cache flush SRV, cache flush 0 0 8012 2c3f16b2-da5c-4b6f-d6cf-bfba61c12490.local A, cache flush 192.168.1.102"
"400","7.472492250","192.168.1.102","224.0.0.251","MDNS","158","Standard query response 0x0000 SRV, cache flush 0 0 8012 2c3f16b2-da5c-4b6f-d6cf-bfba61c12490.local A, cache flush 192.168.1.102"
"401","7.475009562","192.168.1.102","224.0.0.251","MDNS","82","Standard query 0x0000 PTR _googlezone._tcp.local, "QM" question"
"402","8.284499412","192.168.1.104","255.255.255.255","UDP","217","49154 → 6666 Len=175"
