frame.number,_ws.col.Time,_ws.col.Source,_ws.col.Destination,_ws.col.Protocol,frame.len,_ws.col.Info
"1","0.000000000","23.3.118.55","192.168.1.118","SSL","2962","Continuation Data"
"2","0.000070238","192.168.1.118","23.3.118.55","TCP","66","36388 → 443 [ACK] Seq=1 Ack=2897 Win=610 Len=0 TSval=720231789 TSecr=2847573585"
"3","0.001660813","23.3.118.55","192.168.1.118","SSL","7306","Continuation Data"
"4","0.001693450","192.168.1.118","23.3.118.55","TCP","66","36388 → 443 [ACK] Seq=1 Ack=10137 Win=723 Len=0 TSval=720231791 TSecr=2847573585"
"5","0.002842538","23.3.118.55","192.168.1.118","SSL","2962","Continuation Data"
"6","0.002873400","192.168.1.118","23.3.118.55","TCP","66","36388 → 443 [ACK] Seq=1 Ack=13033 Win=768 Len=0 TSval=720231792 TSecr=2847573585"
"7","0.002889975","23.3.118.55","192.168.1.118","TCP","8754","[TCP segment of a reassembled PDU]"
"8","0.003351463","192.168.1.118","23.3.118.55","TCP","66","36404 → 443 [ACK] Seq=1 Ack=8689 Win=434 Len=0 TSval=720231793 TSecr=2847573586"
"9","0.003826200","23.3.118.55","192.168.1.118","TCP","1514","443 → 36404 [ACK] Seq=8689 Ack=1 Win=248 Len=1448 TSval=2847573586 TSecr=720231655 [TCP segment of a reassembled PDU]"
"10","0.009221900","23.3.118.55","192.168.1.118","TCP","2962","443 → 36404 [ACK] Seq=10137 Ack=1 Win=248 Len=2896 TSval=2847573586 TSecr=720231655 [TCP segment of a reassembled PDU]"
"11","0.009262275","192.168.1.118","23.3.118.55","TCP","66","36404 → 443 [ACK] Seq=1 Ack=13033 Win=477 Len=0 TSval=720231798 TSecr=2847573586"
"12","0.010935400","23.3.118.55","192.168.1.118","TLSv1.2","3447","Application Data"
"13","0.011003638","23.3.118.55","192.168.1.118","TCP","2962","[TCP segment of a reassembled PDU]"
"14","0.011803988","192.168.1.118","23.3.118.55","TCP","66","36404 → 443 [ACK] Seq=1 Ack=19310 Win=429 Len=0 TSval=720231801 TSecr=2847573586"
"15","0.012025338","23.3.118.55","192.168.1.118","SSL","1999","Continuation Data"
"16","0.012074175","192.168.1.118","23.3.118.55","TCP","66","36388 → 443 [ACK] Seq=1 Ack=14966 Win=798 Len=0 TSval=720231801 TSecr=2847573585"
"17","0.012175825","23.3.118.55","192.168.1.118","TCP","5858","[TCP segment of a reassembled PDU]"
"18","0.012208838","192.168.1.118","23.3.118.55","TCP","66","36388 → 443 [ACK] Seq=1 Ack=20758 Win=889 Len=0 TSval=720231801 TSecr=2847573585"
"19","0.012234100","23.3.118.55","192.168.1.118","TCP","2962","443 → 36404 [ACK] Seq=19310 Ack=1 Win=248 Len=2896 TSval=2847573586 TSecr=720231655 [TCP segment of a reassembled PDU]"
"20","0.012255863","23.3.118.55","192.168.1.118","TCP","1514","443 → 36388 [ACK] Seq=20758 Ack=1 Win=282 Len=1448 TSval=2847573588 TSecr=720231630 [TCP segment of a reassembled PDU]"
"21","0.013330988","192.168.1.118","23.3.118.55","TCP","66","36404 → 443 [ACK] Seq=1 Ack=22206 Win=407 Len=0 TSval=720231803 TSecr=2847573586"
"22","0.013680538","23.3.118.55","192.168.1.118","TCP","1514","443 → 36388 [ACK] Seq=22206 Ack=1 Win=282 Len=1448 TSval=2847573588 TSecr=720231630 [TCP segment of a reassembled PDU]"
"23","0.013711513","192.168.1.118","23.3.118.55","TCP","66","36388 → 443 [ACK] Seq=1 Ack=23654 Win=911 Len=0 TSval=720231803 TSecr=2847573588"
"24","0.013761263","23.3.118.55","192.168.1.118","TCP","2962","443 → 36388 [ACK] Seq=23654 Ack=1 Win=282 Len=2896 TSval=2847573590 TSecr=720231630 [TCP segment of a reassembled PDU]"
"25","0.013791638","192.168.1.118","23.3.118.55","TCP","66","36388 → 443 [ACK] Seq=1 Ack=26550 Win=947 Len=0 TSval=720231803 TSecr=2847573590"
"26","0.015314838","23.3.118.55","192.168.1.118","TCP","1514","[TCP segment of a reassembled PDU]"
"27","0.017457638","23.3.118.55","192.168.1.118","TCP","2962","443 → 36406 [ACK] Seq=1449 Ack=1 Win=248 Len=2896 TSval=2847573596 TSecr=720231672 [TCP segment of a reassembled PDU]"
"28","0.017620550","23.3.118.55","192.168.1.118","TLSv1.2","12135","Application Data"
"29","0.017662963","23.3.118.55","192.168.1.118","TCP","1514","[TCP segment of a reassembled PDU]"
"30","0.030555938","23.3.118.55","192.168.1.118","TCP","2962","443 → 36406 [ACK] Seq=17862 Ack=1 Win=248 Len=2896 TSval=2847573596 TSecr=720231672 [TCP segment of a reassembled PDU]"
"31","0.032244100","23.3.118.55","192.168.1.118","TCP","1514","443 → 36406 [ACK] Seq=20758 Ack=1 Win=248 Len=1448 TSval=2847573596 TSecr=720231672 [TCP segment of a reassembled PDU]"
"32","0.032278663","23.3.118.55","192.168.1.118","TCP","2962","443 → 36388 [ACK] Seq=26550 Ack=1 Win=282 Len=2896 TSval=2847573595 TSecr=720231630 [TCP segment of a reassembled PDU]"
"33","0.032329250","192.168.1.118","23.3.118.55","TCP","66","36388 → 443 [ACK] Seq=1 Ack=29446 Win=963 Len=0 TSval=720231822 TSecr=2847573595"
"34","0.032363425","23.3.118.55","192.168.1.118","TCP","1514","[TCP segment of a reassembled PDU]"
"35","0.033502638","23.3.118.55","192.168.1.118","TCP","13098","443 → 36408 [ACK] Seq=1449 Ack=1 Win=248 Len=13032 TSval=2847573600 TSecr=720231692 [TCP segment of a reassembled PDU]"
"36","0.037867838","192.168.1.118","23.3.118.55","TCP","66","36406 → 443 [ACK] Seq=1 Ack=22206 Win=328 Len=0 TSval=720231827 TSecr=2847573596"
"37","0.039021875","192.168.1.118","23.3.118.55","TCP","66","36408 → 443 [ACK] Seq=1 Ack=14481 Win=388 Len=0 TSval=720231828 TSecr=2847573600"
"38","0.046936188","23.3.118.55","192.168.1.118","TLSv1.2","1350","Application Data"
"39","0.050176888","23.3.118.55","192.168.1.118","TLSv1.2","2962","Application Data [TCP segment of a reassembled PDU]"
"40","0.050244250","192.168.1.118","23.3.118.55","TCP","66","36388 → 443 [ACK] Seq=1 Ack=32342 Win=963 Len=0 TSval=720231839 TSecr=2847573595"
"41","0.050326900","23.3.118.55","192.168.1.118","TCP","2962","443 → 36388 [ACK] Seq=32342 Ack=1 Win=282 Len=2896 TSval=2847573598 TSecr=720231630 [TCP segment of a reassembled PDU]"
"42","0.051859975","23.3.118.55","192.168.1.118","TCP","2962","443 → 36388 [ACK] Seq=35238 Ack=1 Win=282 Len=2896 TSval=2847573600 TSecr=720231630 [TCP segment of a reassembled PDU]"
"43","0.051914188","23.3.118.55","192.168.1.118","TCP","1514","443 → 36388 [ACK] Seq=38134 Ack=1 Win=282 Len=1448 TSval=2847573603 TSecr=720231630 [TCP segment of a reassembled PDU]"
"44","0.052639500","23.3.118.55","192.168.1.118","TCP","1514","443 → 36388 [ACK] Seq=39582 Ack=1 Win=282 Len=1448 TSval=2847573603 TSecr=720231630 [TCP segment of a reassembled PDU]"
"45","0.052710725","23.3.118.55","192.168.1.118","TLSv1.2","1933","Application Data"
"46","0.052876500","23.3.118.55","192.168.1.118","TLSv1.2","6498","Application Data"
"47","0.056206413","23.3.118.55","192.168.1.118","TCP","5858","443 → 36404 [ACK] Seq=22206 Ack=1 Win=248 Len=5792 TSval=2847573666 TSecr=720231793 [TCP segment of a reassembled PDU]"
"48","0.056289975","192.168.1.118","23.3.118.55","TCP","66","36404 → 443 [ACK] Seq=1 Ack=27998 Win=445 Len=0 TSval=720231845 TSecr=2847573666"
"49","0.057879513","23.3.118.55","192.168.1.118","TLSv1.2","10202","Application Data [TCP segment of a reassembled PDU]"
"50","0.059338875","23.3.118.55","192.168.1.118","TLSv1.2","1051","Application Data"
"51","0.063069288","192.168.1.118","23.3.118.55","TCP","66","36404 → 443 [ACK] Seq=1 Ack=39119 Win=359 Len=0 TSval=720231852 TSecr=2847573666"
"52","0.063611363","23.3.118.55","192.168.1.118","TCP","1514","443 → 36406 [ACK] Seq=22206 Ack=1 Win=248 Len=1448 TSval=2847573676 TSecr=720231827 [TCP segment of a reassembled PDU]"
"53","0.065774075","192.168.1.118","23.3.118.55","TCP","66","36410 → 443 [ACK] Seq=1 Ack=6433 Win=451 Len=0 TSval=720231855 TSecr=2847573614"
"54","0.065973825","23.3.118.55","192.168.1.118","TCP","2962","443 → 36406 [ACK] Seq=23654 Ack=1 Win=248 Len=2896 TSval=2847573676 TSecr=720231827 [TCP segment of a reassembled PDU]"
"55","0.066051125","192.168.1.118","23.3.118.55","TCP","66","36406 → 443 [ACK] Seq=1 Ack=26550 Win=477 Len=0 TSval=720231855 TSecr=2847573676"
"56","0.066133075","192.168.1.118","23.3.118.55","TCP","66","36388 → 443 [ACK] Seq=1 Ack=42897 Win=963 Len=0 TSval=720231855 TSecr=2847573598"
"57","0.067621000","23.3.118.55","192.168.1.118","TCP","1514","443 → 36406 [ACK] Seq=26550 Ack=1 Win=248 Len=1448 TSval=2847573676 TSecr=720231827 [TCP segment of a reassembled PDU]"
"58","0.068875963","192.168.1.118","23.3.118.55","TLSv1.2","839","Application Data"
"59","0.069010650","192.168.1.118","23.3.118.55","TLSv1.2","836","Application Data"
"60","0.069110563","192.168.1.118","23.3.118.55","TLSv1.2","840","Application Data"
"61","0.069206863","192.168.1.118","23.3.118.55","TLSv1.2","834","Application Data"
"62","0.069436925","23.3.118.55","192.168.1.118","TLSv1.2","14546","Application Data [TCP segment of a reassembled PDU]"
"63","0.069898350","23.3.118.55","192.168.1.118","TCP","2962","443 → 36406 [ACK] Seq=42478 Ack=1 Win=248 Len=2896 TSval=2847573676 TSecr=720231827 [TCP segment of a reassembled PDU]"
"64","0.072626425","23.3.118.55","192.168.1.118","TLSv1.2","1383","Application Data"
"65","0.097124250","23.3.118.55","192.168.1.118","TCP","1514","[TCP segment of a reassembled PDU]"
"66","0.099928000","23.3.118.55","192.168.1.118","TCP","1514","443 → 36388 [ACK] Seq=44345 Ack=774 Win=294 Len=1448 TSval=2847573710 TSecr=720231858 [TCP segment of a reassembled PDU]"
"67","0.099959075","192.168.1.118","23.3.118.55","TCP","66","36388 → 443 [ACK] Seq=774 Ack=45793 Win=1009 Len=0 TSval=720231889 TSecr=2847573710"
"68","0.099990188","23.3.118.55","192.168.1.118","TCP","1514","[TCP segment of a reassembled PDU]"
"69","0.101604675","23.3.118.55","192.168.1.118","TCP","1514","443 → 36410 [ACK] Seq=7881 Ack=769 Win=259 Len=1448 TSval=2847573710 TSecr=720231858 [TCP segment of a reassembled PDU]"
"70","0.101615463","23.3.118.55","192.168.1.118","TCP","4410","[TCP segment of a reassembled PDU]"
"71","0.102845875","23.3.118.55","192.168.1.118","TCP","8754","443 → 36410 [ACK] Seq=9329 Ack=769 Win=259 Len=8688 TSval=2847573710 TSecr=720231858 [TCP segment of a reassembled PDU]"
"72","0.102861338","23.3.118.55","192.168.1.118","TCP","4410","443 → 36404 [ACK] Seq=43463 Ack=771 Win=260 Len=4344 TSval=2847573710 TSecr=720231858 [TCP segment of a reassembled PDU]"
"73","0.104749725","23.3.118.55","192.168.1.118","TCP","1514","443 → 36404 [ACK] Seq=47807 Ack=771 Win=260 Len=1448 TSval=2847573710 TSecr=720231858 [TCP segment of a reassembled PDU]"
"74","0.107349275","23.3.118.55","192.168.1.118","TCP","1514","443 → 36404 [ACK] Seq=49255 Ack=771 Win=260 Len=1448 TSval=2847573710 TSecr=720231858 [TCP segment of a reassembled PDU]"
"75","0.107373675","23.3.118.55","192.168.1.118","TCP","1514","443 → 36410 [ACK] Seq=18017 Ack=769 Win=259 Len=1448 TSval=2847573710 TSecr=720231858 [TCP segment of a reassembled PDU]"
"76","0.109056475","23.3.118.55","192.168.1.118","TCP","1514","443 → 36410 [ACK] Seq=19465 Ack=769 Win=259 Len=1448 TSval=2847573710 TSecr=720231858 [TCP segment of a reassembled PDU]"
"77","0.109088438","23.3.118.55","192.168.1.118","TCP","4410","443 → 36404 [ACK] Seq=50703 Ack=771 Win=260 Len=4344 TSval=2847573710 TSecr=720231858 [TCP segment of a reassembled PDU]"
"78","0.109770888","192.168.1.118","23.3.118.55","TCP","66","36406 → 443 [ACK] Seq=1 Ack=46691 Win=320 Len=0 TSval=720231899 TSecr=2847573676"
"79","0.110307050","23.3.118.55","192.168.1.118","TLSv1.2","1999","Application Data"
"80","0.110385475","23.3.118.55","192.168.1.118","TLSv1.2","4410","Application Data [TCP segment of a reassembled PDU]"
"81","0.110405863","23.3.118.55","192.168.1.118","TCP","7306","[TCP segment of a reassembled PDU]"
"82","0.114567188","23.3.118.55","192.168.1.118","TCP","2962","443 → 36410 [ACK] Seq=30086 Ack=769 Win=259 Len=2896 TSval=2847573710 TSecr=720231858 [TCP segment of a reassembled PDU]"
"83","0.116251625","23.3.118.55","192.168.1.118","TCP","2962","443 → 36410 [ACK] Seq=32982 Ack=769 Win=259 Len=2896 TSval=2847573710 TSecr=720231858 [TCP segment of a reassembled PDU]"
"84","0.116272713","23.3.118.55","192.168.1.118","TCP","2962","443 → 36388 [ACK] Seq=45793 Ack=774 Win=294 Len=2896 TSval=2847573710 TSecr=720231858 [TCP segment of a reassembled PDU]"
"85","0.116303338","192.168.1.118","23.3.118.55","TCP","66","36388 → 443 [ACK] Seq=774 Ack=48689 Win=1054 Len=0 TSval=720231906 TSecr=2847573710"
"86","0.117454263","23.3.118.55","192.168.1.118","TCP","2962","443 → 36388 [ACK] Seq=48689 Ack=774 Win=294 Len=2896 TSval=2847573710 TSecr=720231858 [TCP segment of a reassembled PDU]"
"87","0.117500375","192.168.1.118","23.3.118.55","TCP","66","36388 → 443 [ACK] Seq=774 Ack=51585 Win=1099 Len=0 TSval=720231907 TSecr=2847573710"
"88","0.117569988","23.3.118.55","192.168.1.118","TCP","5858","443 → 36404 [ACK] Seq=59391 Ack=771 Win=260 Len=5792 TSval=2847573710 TSecr=720231858 [TCP segment of a reassembled PDU]"
"89","0.117604438","23.3.118.55","192.168.1.118","TCP","2962","443 → 36388 [ACK] Seq=51585 Ack=774 Win=294 Len=2896 TSval=2847573711 TSecr=720231858 [TCP segment of a reassembled PDU]"
"90","0.117643313","192.168.1.118","23.3.118.55","TCP","66","36388 → 443 [ACK] Seq=774 Ack=54481 Win=1144 Len=0 TSval=720231907 TSecr=2847573711"
"91","0.117669825","23.3.118.55","192.168.1.118","TCP","1514","443 → 36404 [ACK] Seq=65183 Ack=771 Win=260 Len=1448 TSval=2847573713 TSecr=720231858 [TCP segment of a reassembled PDU]"
"92","0.125594563","23.3.118.55","192.168.1.118","TCP","1514","443 → 36404 [ACK] Seq=66631 Ack=771 Win=260 Len=1448 TSval=2847573713 TSecr=720231858 [TCP segment of a reassembled PDU]"
"93","0.125640575","23.3.118.55","192.168.1.118","TCP","2962","443 → 36388 [ACK] Seq=54481 Ack=774 Win=294 Len=2896 TSval=2847573715 TSecr=720231858 [TCP segment of a reassembled PDU]"
"94","0.125694275","192.168.1.118","23.3.118.55","TCP","66","36388 → 443 [ACK] Seq=774 Ack=57377 Win=1190 Len=0 TSval=720231915 TSecr=2847573715"
"95","0.125735950","23.3.118.55","192.168.1.118","TCP","1514","443 → 36404 [ACK] Seq=68079 Ack=771 Win=260 Len=1448 TSval=2847573716 TSecr=720231858 [TCP segment of a reassembled PDU]"
"96","0.127236725","23.3.118.55","192.168.1.118","TCP","1514","443 → 36404 [ACK] Seq=69527 Ack=771 Win=260 Len=1448 TSval=2847573716 TSecr=720231858 [TCP segment of a reassembled PDU]"
"97","0.127266738","23.3.118.55","192.168.1.118","TCP","2962","[TCP segment of a reassembled PDU]"
"98","0.128523913","23.3.118.55","192.168.1.118","TCP","11650","443 → 36408 [ACK] Seq=18661 Ack=775 Win=260 Len=11584 TSval=2847573723 TSecr=720231858 [TCP segment of a reassembled PDU]"
"99","0.130513375","23.3.118.55","192.168.1.118","TLSv1.2","2962","Application Data [TCP segment of a reassembled PDU]"
"100","0.133277175","23.3.118.55","192.168.1.118","TLSv1.2","4305","Application Data"
"101","0.133345738","23.3.118.55","192.168.1.118","TLSv1.2","1514","Application Data [TCP segment of a reassembled PDU]"
"102","0.133403150","192.168.1.118","23.3.118.55","TCP","66","36404 → 443 [ACK] Seq=771 Ack=72423 Win=241 Len=0 TSval=720231923 TSecr=2847573710"
"103","0.134942913","23.3.118.55","192.168.1.118","TCP","1514","443 → 36404 [ACK] Seq=72423 Ack=771 Win=260 Len=1448 TSval=2847573719 TSecr=720231858 [TCP segment of a reassembled PDU]"
"104","0.134985338","23.3.118.55","192.168.1.118","TLSv1.2","2962","Application Data [TCP segment of a reassembled PDU]"
"105","0.135042788","192.168.1.118","23.3.118.55","TCP","66","36388 → 443 [ACK] Seq=774 Ack=60273 Win=1205 Len=0 TSval=720231924 TSecr=2847573718"
"106","0.136104050","23.3.118.55","192.168.1.118","TLSv1.2","2962","Application Data [TCP segment of a reassembled PDU]"
"107","0.136190175","23.3.118.55","192.168.1.118","TCP","2962","443 → 36388 [ACK] Seq=60273 Ack=774 Win=294 Len=2896 TSval=2847573722 TSecr=720231858 [TCP segment of a reassembled PDU]"
"108","0.136260788","23.3.118.55","192.168.1.118","TCP","2962","443 → 36404 [ACK] Seq=76767 Ack=771 Win=260 Len=2896 TSval=2847573725 TSecr=720231858 [TCP segment of a reassembled PDU]"
"109","0.136296700","23.3.118.55","192.168.1.118","TCP","2962","443 → 36388 [ACK] Seq=63169 Ack=774 Win=294 Len=2896 TSval=2847573725 TSecr=720231858 [TCP segment of a reassembled PDU]"
"110","0.136875200","23.3.118.55","192.168.1.118","TCP","1514","443 → 36404 [ACK] Seq=79663 Ack=771 Win=260 Len=1448 TSval=2847573728 TSecr=720231858 [TCP segment of a reassembled PDU]"
"111","0.139296863","192.168.1.118","23.3.118.55","TCP","66","36388 → 443 [ACK] Seq=774 Ack=66065 Win=1160 Len=0 TSval=720231928 TSecr=2847573722"
"112","0.139495463","23.3.118.55","192.168.1.118","TCP","2962","443 → 36388 [ACK] Seq=66065 Ack=774 Win=294 Len=2896 TSval=2847573729 TSecr=720231858 [TCP segment of a reassembled PDU]"
"113","0.139551200","192.168.1.118","23.3.118.55","TCP","66","36404 → 443 [ACK] Seq=771 Ack=81111 Win=501 Len=0 TSval=720231929 TSecr=2847573719"
"114","0.139579763","23.3.118.55","192.168.1.118","TCP","2962","443 → 36388 [ACK] Seq=68961 Ack=774 Win=294 Len=2896 TSval=2847573732 TSecr=720231858 [TCP segment of a reassembled PDU]"
"115","0.139721113","192.168.1.118","23.3.118.55","TCP","66","36408 → 443 [ACK] Seq=775 Ack=37380 Win=333 Len=0 TSval=720231929 TSecr=2847573723"
"116","0.139980400","192.168.1.118","23.3.118.55","TCP","66","36410 → 443 [ACK] Seq=769 Ack=35878 Win=271 Len=0 TSval=720231929 TSecr=2847573710"
"117","0.141155788","23.3.118.55","192.168.1.118","TCP","2962","443 → 36388 [ACK] Seq=71857 Ack=774 Win=294 Len=2896 TSval=2847573736 TSecr=720231858 [TCP segment of a reassembled PDU]"
"118","0.141245863","23.3.118.55","192.168.1.118","TLSv1.2","2962","Application Data, Application Data"
"119","0.141451713","23.3.118.55","192.168.1.118","TCP","2962","443 → 36388 [ACK] Seq=77649 Ack=774 Win=294 Len=2896 TSval=2847573743 TSecr=720231907 [TCP segment of a reassembled PDU]"
"120","0.141529425","23.3.118.55","192.168.1.118","TCP","2962","443 → 36388 [ACK] Seq=80545 Ack=774 Win=294 Len=2896 TSval=2847573746 TSecr=720231907 [TCP segment of a reassembled PDU]"
"121","0.141755050","192.168.1.118","23.3.118.55","TCP","66","36388 → 443 [ACK] Seq=774 Ack=83441 Win=1025 Len=0 TSval=720231931 TSecr=2847573729"
"122","0.143647138","192.168.1.118","23.3.118.55","TLSv1.2","846","Application Data"
"123","0.143815850","192.168.1.118","23.3.118.55","TLSv1.2","847","Application Data"
"124","0.144497488","23.3.118.55","192.168.1.118","TCP","1514","443 → 36388 [ACK] Seq=83441 Ack=774 Win=294 Len=1448 TSval=2847573748 TSecr=720231907 [TCP segment of a reassembled PDU]"
"125","0.144726038","23.3.118.55","192.168.1.118","TCP","1514","443 → 36388 [ACK] Seq=84889 Ack=774 Win=294 Len=1448 TSval=2847573748 TSecr=720231907 [TCP segment of a reassembled PDU]"
"126","0.144817150","192.168.1.118","23.3.118.55","TCP","66","36388 → 443 [ACK] Seq=774 Ack=86337 Win=1250 Len=0 TSval=720231934 TSecr=2847573748"
"127","0.144903475","23.3.118.55","192.168.1.118","TCP","2962","443 → 36388 [ACK] Seq=86337 Ack=774 Win=294 Len=2896 TSval=2847573751 TSecr=720231907 [TCP segment of a reassembled PDU]"
"128","0.144967750","192.168.1.118","23.3.118.55","TCP","66","36388 → 443 [ACK] Seq=774 Ack=89233 Win=1295 Len=0 TSval=720231934 TSecr=2847573751"
"129","0.146828750","23.3.118.55","192.168.1.118","TCP","2962","443 → 36388 [ACK] Seq=89233 Ack=774 Win=294 Len=2896 TSval=2847573754 TSecr=720231907 [TCP segment of a reassembled PDU]"
"130","0.146894888","192.168.1.118","23.3.118.55","TCP","66","36388 → 443 [ACK] Seq=774 Ack=92129 Win=1301 Len=0 TSval=720231936 TSecr=2847573754"
"131","0.150155988","23.3.118.55","192.168.1.118","TCP","1514","443 → 36388 [ACK] Seq=92129 Ack=774 Win=294 Len=1448 TSval=2847573756 TSecr=720231907 [TCP segment of a reassembled PDU]"
"132","0.152582713","23.3.118.55","192.168.1.118","TLSv1.2","1514","Application Data [TCP segment of a reassembled PDU]"
"133","0.152652425","23.3.118.55","192.168.1.118","TCP","2962","443 → 36388 [ACK] Seq=95025 Ack=774 Win=294 Len=2896 TSval=2847573759 TSecr=720231907 [TCP segment of a reassembled PDU]"
"134","0.156443663","23.3.118.55","192.168.1.118","TCP","1514","443 → 36388 [ACK] Seq=97921 Ack=774 Win=294 Len=1448 TSval=2847573761 TSecr=720231907 [TCP segment of a reassembled PDU]"
"135","0.159122925","23.3.118.55","192.168.1.118","TCP","1514","443 → 36388 [ACK] Seq=99369 Ack=774 Win=294 Len=1448 TSval=2847573761 TSecr=720231907 [TCP segment of a reassembled PDU]"
"136","0.159204550","23.3.118.55","192.168.1.118","TCP","2962","443 → 36388 [ACK] Seq=100817 Ack=774 Win=294 Len=2896 TSval=2847573764 TSecr=720231915 [TCP segment of a reassembled PDU]"
"137","0.159243888","23.3.118.55","192.168.1.118","TCP","1514","443 → 36388 [ACK] Seq=103713 Ack=774 Win=294 Len=1448 TSval=2847573766 TSecr=720231915 [TCP segment of a reassembled PDU]"
"138","0.159384225","23.3.118.55","192.168.1.118","TCP","1514","443 → 36388 [ACK] Seq=105161 Ack=774 Win=294 Len=1448 TSval=2847573766 TSecr=720231915 [TCP segment of a reassembled PDU]"
"139","0.159419913","23.3.118.55","192.168.1.118","TCP","1514","443 → 36404 [ACK] Seq=81111 Ack=771 Win=260 Len=1448 TSval=2847573771 TSecr=720231929 [TCP segment of a reassembled PDU]"
"140","0.161898525","23.3.118.55","192.168.1.118","TCP","5858","443 → 36404 [ACK] Seq=82559 Ack=771 Win=260 Len=5792 TSval=2847573771 TSecr=720231929 [TCP segment of a reassembled PDU]"
"141","0.161978600","192.168.1.118","23.3.118.55","TCP","66","36404 → 443 [ACK] Seq=771 Ack=88351 Win=614 Len=0 TSval=720231951 TSecr=2847573771"
"142","0.163540763","23.3.118.55","192.168.1.118","TLSv1.2","4410","Application Data [TCP segment of a reassembled PDU]"
"143","0.163619563","192.168.1.118","23.3.118.55","TCP","66","36404 → 443 [ACK] Seq=771 Ack=92695 Win=682 Len=0 TSval=720231953 TSecr=2847573771"
"144","0.164813088","23.3.118.55","192.168.1.118","TCP","11650","443 → 36404 [ACK] Seq=92695 Ack=771 Win=260 Len=11584 TSval=2847573771 TSecr=720231929 [TCP segment of a reassembled PDU]"
"145","0.164897000","192.168.1.118","23.3.118.55","TCP","66","36404 → 443 [ACK] Seq=771 Ack=104279 Win=863 Len=0 TSval=720231954 TSecr=2847573771"
"146","0.165584088","23.3.118.55","192.168.1.118","TCP","1514","443 → 36404 [ACK] Seq=104279 Ack=771 Win=260 Len=1448 TSval=2847573771 TSecr=720231929 [TCP segment of a reassembled PDU]"
"147","0.169604863","23.3.118.55","192.168.1.118","TLSv1.2","5858","Application Data [TCP segment of a reassembled PDU]"
"148","0.169683650","192.168.1.118","23.3.118.55","TCP","66","36404 → 443 [ACK] Seq=771 Ack=111519 Win=976 Len=0 TSval=720231959 TSecr=2847573771"
"149","0.171253075","23.3.118.55","192.168.1.118","TCP","2962","443 → 36388 [ACK] Seq=106609 Ack=774 Win=294 Len=2896 TSval=2847573768 TSecr=720231915 [TCP segment of a reassembled PDU]"
"150","0.171302225","23.3.118.55","192.168.1.118","TCP","1514","443 → 36404 [ACK] Seq=111519 Ack=771 Win=260 Len=1448 TSval=2847573771 TSecr=720231929 [TCP segment of a reassembled PDU]"
"151","0.172456700","23.3.118.55","192.168.1.118","TLSv1.2","4410","Application Data [TCP segment of a reassembled PDU]"
"152","0.172514888","192.168.1.118","23.3.118.55","TCP","66","36404 → 443 [ACK] Seq=771 Ack=117311 Win=1067 Len=0 TSval=720231962 TSecr=2847573771"
"153","0.172638750","23.3.118.55","192.168.1.118","TCP","2962","443 → 36404 [ACK] Seq=117311 Ack=771 Win=260 Len=2896 TSval=2847573774 TSecr=720231929 [TCP segment of a reassembled PDU]"
"154","0.172695525","192.168.1.118","23.3.118.55","TCP","66","36404 → 443 [ACK] Seq=771 Ack=120207 Win=1112 Len=0 TSval=720231962 TSecr=2847573774"
"155","0.172732688","23.3.118.55","192.168.1.118","TLSv1.2","4410","Application Data [TCP segment of a reassembled PDU]"
"156","0.177130388","23.3.118.55","192.168.1.118","TLSv1.2","5858","Application Data [TCP segment of a reassembled PDU]"
"157","0.178791038","23.3.118.55","192.168.1.118","TCP","2962","443 → 36388 [ACK] Seq=119641 Ack=774 Win=294 Len=2896 TSval=2847573780 TSecr=720231934 [TCP segment of a reassembled PDU]"
"158","0.180104563","23.3.118.55","192.168.1.118","TCP","7306","443 → 36388 [ACK] Seq=122537 Ack=774 Win=294 Len=7240 TSval=2847573780 TSecr=720231934 [TCP segment of a reassembled PDU]"
"159","0.180173500","192.168.1.118","23.3.118.55","TCP","66","36388 → 443 [ACK] Seq=774 Ack=129777 Win=1007 Len=0 TSval=720231969 TSecr=2847573756"
"160","0.180210750","23.3.118.55","192.168.1.118","TLSv1.2","5858","Application Data [TCP segment of a reassembled PDU]"
"161","0.180267188","192.168.1.118","23.3.118.55","TCP","66","36410 → 443 [ACK] Seq=769 Ack=41670 Win=592 Len=0 TSval=720231969 TSecr=2847573780"
"162","0.183679938","23.3.118.55","192.168.1.118","TCP","1514","443 → 36388 [ACK] Seq=129777 Ack=774 Win=294 Len=1448 TSval=2847573780 TSecr=720231934 [TCP segment of a reassembled PDU]"
"163","0.187121338","23.3.118.55","192.168.1.118","TLSv1.2","4410","Application Data [TCP segment of a reassembled PDU]"
"164","0.187175400","23.3.118.55","192.168.1.118","TLSv1.2","1514","Application Data [TCP segment of a reassembled PDU]"
"165","0.190017625","23.3.118.55","192.168.1.118","TCP","2962","443 → 36388 [ACK] Seq=135569 Ack=774 Win=294 Len=2896 TSval=2847573780 TSecr=720231934 [TCP segment of a reassembled PDU]"
"166","0.190077188","23.3.118.55","192.168.1.118","TCP","7306","443 → 36410 [ACK] Seq=43118 Ack=769 Win=259 Len=7240 TSval=2847573780 TSecr=720231929 [TCP segment of a reassembled PDU]"
"167","0.190155925","192.168.1.118","23.3.118.55","TCP","66","36410 → 443 [ACK] Seq=769 Ack=50358 Win=727 Len=0 TSval=720231979 TSecr=2847573780"
"168","0.190210625","23.3.118.55","192.168.1.118","TCP","1514","443 → 36388 [ACK] Seq=138465 Ack=774 Win=294 Len=1448 TSval=2847573780 TSecr=720231936 [TCP segment of a reassembled PDU]"
"169","0.190423725","23.3.118.55","192.168.1.118","TCP","1514","443 → 36410 [ACK] Seq=50358 Ack=769 Win=259 Len=1448 TSval=2847573780 TSecr=720231929 [TCP segment of a reassembled PDU]"
"170","0.190476075","23.3.118.55","192.168.1.118","TCP","2962","443 → 36388 [ACK] Seq=139913 Ack=774 Win=294 Len=2896 TSval=2847573780 TSecr=720231936 [TCP segment of a reassembled PDU]"
"171","0.191179025","192.168.1.118","23.3.118.55","TCP","66","36388 → 443 [ACK] Seq=774 Ack=142809 Win=1301 Len=0 TSval=720231980 TSecr=2847573780"
"172","0.195255888","23.3.118.55","192.168.1.118","TCP","7306","443 → 36388 [ACK] Seq=142809 Ack=774 Win=294 Len=7240 TSval=2847573780 TSecr=720231936 [TCP segment of a reassembled PDU]"
"173","0.195337513","192.168.1.118","23.3.118.55","TCP","66","36388 → 443 [ACK] Seq=774 Ack=150049 Win=1414 Len=0 TSval=720231985 TSecr=2847573780"
"174","0.195388588","23.3.118.55","192.168.1.118","TCP","1514","443 → 36410 [ACK] Seq=51806 Ack=769 Win=259 Len=1448 TSval=2847573780 TSecr=720231929 [TCP segment of a reassembled PDU]"
"175","0.195460075","192.168.1.118","23.3.118.55","TCP","66","36410 → 443 [ACK] Seq=769 Ack=53254 Win=773 Len=0 TSval=720231985 TSecr=2847573780"
"176","0.196820263","23.3.118.55","192.168.1.118","TLSv1.2","1514","Application Data [TCP segment of a reassembled PDU]"
"177","0.198164888","23.3.118.55","192.168.1.118","TCP","7306","443 → 36388 [ACK] Seq=151497 Ack=774 Win=294 Len=7240 TSval=2847573780 TSecr=720231936 [TCP segment of a reassembled PDU]"
"178","0.198247225","192.168.1.118","23.3.118.55","TCP","66","36388 → 443 [ACK] Seq=774 Ack=158737 Win=1550 Len=0 TSval=720231987 TSecr=2847573780"
"179","0.198299000","23.3.118.55","192.168.1.118","TCP","4410","443 → 36410 [ACK] Seq=53254 Ack=769 Win=259 Len=4344 TSval=2847573780 TSecr=720231929 [TCP segment of a reassembled PDU]"
"180","0.198373875","192.168.1.118","23.3.118.55","TCP","66","36410 → 443 [ACK] Seq=769 Ack=57598 Win=841 Len=0 TSval=720231988 TSecr=2847573780"
"181","0.203511950","23.3.118.55","192.168.1.118","TLSv1.2","5858","Application Data [TCP segment of a reassembled PDU]"
"182","0.203592825","192.168.1.118","23.3.118.55","TCP","66","36410 → 443 [ACK] Seq=769 Ack=63390 Win=931 Len=0 TSval=720231993 TSecr=2847573780"
"183","0.203870513","23.3.118.55","192.168.1.118","TCP","7242","443 → 36410 [ACK] Seq=63390 Ack=769 Win=259 Len=7176 TSval=2847573780 TSecr=720231929 [TCP segment of a reassembled PDU]"
"184","0.203951813","192.168.1.118","23.3.118.55","TCP","66","36410 → 443 [ACK] Seq=769 Ack=70566 Win=1023 Len=0 TSval=720231993 TSecr=2847573780"
"185","0.204158750","23.3.118.55","192.168.1.118","TLSv1.2","6524","Application Data, Application Data"
"186","0.204237225","192.168.1.118","23.3.118.55","TCP","66","36388 → 443 [ACK] Seq=774 Ack=165195 Win=1650 Len=0 TSval=720231993 TSecr=2847573780"
"187","0.204365025","23.3.118.55","192.168.1.118","TCP","2962","443 → 36404 [ACK] Seq=120207 Ack=771 Win=260 Len=2896 TSval=2847573777 TSecr=720231929 [TCP segment of a reassembled PDU]"
"188","0.204446163","192.168.1.118","23.3.118.55","TCP","66","36404 → 443 [ACK] Seq=771 Ack=123103 Win=1157 Len=0 TSval=720231994 TSecr=2847573777"
"189","0.208681363","192.168.1.118","23.3.118.55","TLSv1.2","848","Application Data"
"190","0.216056513","23.3.118.55","192.168.1.118","TCP","2962","443 → 36404 [ACK] Seq=123103 Ack=771 Win=260 Len=2896 TSval=2847573779 TSecr=720231929 [TCP segment of a reassembled PDU]"
"191","0.216128163","192.168.1.118","23.3.118.55","TCP","66","36404 → 443 [ACK] Seq=771 Ack=125999 Win=1203 Len=0 TSval=720232005 TSecr=2847573779"
"192","0.216178875","23.3.118.55","192.168.1.118","TCP","2962","[TCP segment of a reassembled PDU]"
"193","0.216264363","192.168.1.118","23.3.118.55","TCP","66","36406 → 443 [ACK] Seq=781 Ack=49587 Win=479 Len=0 TSval=720232005 TSecr=2847573788"
"194","0.216561975","23.3.118.55","192.168.1.118","TLSv1.2","13583","Application Data"
"195","0.216635800","192.168.1.118","23.3.118.55","TCP","66","36406 → 443 [ACK] Seq=781 Ack=63104 Win=374 Len=0 TSval=720232006 TSecr=2847573788"
"196","0.216770488","23.3.118.55","192.168.1.118","TCP","2962","[TCP segment of a reassembled PDU]"
"197","0.216841650","192.168.1.118","23.3.118.55","TCP","66","36406 → 443 [ACK] Seq=781 Ack=66000 Win=352 Len=0 TSval=720232006 TSecr=2847573788"
"198","0.222855188","23.3.118.55","192.168.1.118","TCP","5858","443 → 36406 [ACK] Seq=66000 Ack=781 Win=260 Len=5792 TSval=2847573788 TSecr=720231933 [TCP segment of a reassembled PDU]"
"199","0.222923738","192.168.1.118","23.3.118.55","TCP","66","36406 → 443 [ACK] Seq=781 Ack=71792 Win=592 Len=0 TSval=720232012 TSecr=2847573788"
"200","0.223117888","23.3.118.55","192.168.1.118","TLSv1.2","2592","Application Data"
"201","0.223183638","192.168.1.118","23.3.118.55","TCP","66","36406 → 443 [ACK] Seq=781 Ack=74318 Win=631 Len=0 TSval=720232012 TSecr=2847573788"
"202","0.223332613","23.3.118.55","192.168.1.118","TLSv1.2","8754","Application Data [TCP segment of a reassembled PDU]"
"203","0.223408375","192.168.1.118","23.3.118.55","TCP","66","36404 → 443 [ACK] Seq=771 Ack=134687 Win=1338 Len=0 TSval=720232013 TSecr=2847573796"
"204","0.223514238","23.3.118.55","192.168.1.118","TCP","2962","443 → 36404 [ACK] Seq=134687 Ack=771 Win=260 Len=2896 TSval=2847573797 TSecr=720231954 [TCP segment of a reassembled PDU]"
"205","0.223590900","192.168.1.118","23.3.118.55","TCP","66","36404 → 443 [ACK] Seq=771 Ack=137583 Win=1384 Len=0 TSval=720232013 TSecr=2847573797"
"206","0.223639925","23.3.118.55","192.168.1.118","TCP","1514","443 → 36404 [ACK] Seq=137583 Ack=771 Win=260 Len=1448 TSval=2847573799 TSecr=720231954 [TCP segment of a reassembled PDU]"
"207","0.228406838","23.3.118.55","192.168.1.118","TCP","1514","443 → 36404 [ACK] Seq=139031 Ack=771 Win=260 Len=1448 TSval=2847573799 TSecr=720231954 [TCP segment of a reassembled PDU]"
"208","0.228472288","192.168.1.118","23.3.118.55","TCP","66","36404 → 443 [ACK] Seq=771 Ack=140479 Win=1429 Len=0 TSval=720232018 TSecr=2847573799"
"209","0.228567713","23.3.118.55","192.168.1.118","TCP","2962","443 → 36404 [ACK] Seq=140479 Ack=771 Win=260 Len=2896 TSval=2847573801 TSecr=720231962 [TCP segment of a reassembled PDU]"
"210","0.228633588","192.168.1.118","23.3.118.55","TCP","66","36404 → 443 [ACK] Seq=771 Ack=143375 Win=1474 Len=0 TSval=720232018 TSecr=2847573801"
"211","0.228678625","23.3.118.55","192.168.1.118","TCP","1514","443 → 36404 [ACK] Seq=143375 Ack=771 Win=260 Len=1448 TSval=2847573802 TSecr=720231962 [TCP segment of a reassembled PDU]"
"212","0.229722850","192.168.1.118","23.3.118.55","TLSv1.2","824","Application Data"
"213","0.230046038","23.3.118.55","192.168.1.118","TLSv1.2","1038","Application Data"
"214","0.230109375","192.168.1.118","23.3.118.55","TCP","66","36404 → 443 [ACK] Seq=771 Ack=145795 Win=1519 Len=0 TSval=720232019 TSecr=2847573802"
"215","0.230275575","23.3.118.55","192.168.1.118","TLSv1.2","8754","Application Data [TCP segment of a reassembled PDU]"
"216","0.230346425","192.168.1.118","23.3.118.55","TCP","66","36410 → 443 [ACK] Seq=769 Ack=79254 Win=1071 Len=0 TSval=720232020 TSecr=2847573811"
"217","0.231156763","23.3.118.55","192.168.1.118","TCP","2962","443 → 36410 [ACK] Seq=79254 Ack=769 Win=259 Len=2896 TSval=2847573811 TSecr=720231969 [TCP segment of a reassembled PDU]"
"218","0.231207125","23.3.118.55","192.168.1.118","TCP","2962","[TCP segment of a reassembled PDU]"
"219","0.232189763","192.168.1.118","23.3.118.55","TCP","66","36410 → 443 [ACK] Seq=769 Ack=82150 Win=1071 Len=0 TSval=720232021 TSecr=2847573811"
"220","0.232363700","192.168.1.118","23.3.118.55","TCP","66","36408 → 443 [ACK] Seq=1556 Ack=40276 Win=501 Len=0 TSval=720232022 TSecr=2847573812"
"221","0.234640550","23.3.118.55","192.168.1.118","TCP","2962","443 → 36408 [ACK] Seq=40276 Ack=1556 Win=272 Len=2896 TSval=2847573812 TSecr=720231933 [TCP segment of a reassembled PDU]"
"222","0.234707850","192.168.1.118","23.3.118.55","TCP","66","36408 → 443 [ACK] Seq=1556 Ack=43172 Win=546 Len=0 TSval=720232024 TSecr=2847573812"
"223","0.234773525","23.3.118.55","192.168.1.118","TLSv1.2","2962","Application Data [TCP segment of a reassembled PDU]"
"224","0.234810238","192.168.1.118","23.3.118.55","TLSv1.2","854","Application Data"
"225","0.234849938","192.168.1.118","23.3.118.55","TCP","66","36410 → 443 [ACK] Seq=769 Ack=85046 Win=1117 Len=0 TSval=720232024 TSecr=2847573811"
"226","0.236299488","23.3.118.55","192.168.1.118","TCP","2962","443 → 36408 [ACK] Seq=43172 Ack=1556 Win=272 Len=2896 TSval=2847573812 TSecr=720231933 [TCP segment of a reassembled PDU]"
"227","0.236364900","192.168.1.118","23.3.118.55","TCP","66","36408 → 443 [ACK] Seq=1556 Ack=46068 Win=592 Len=0 TSval=720232026 TSecr=2847573812"
"228","0.236405650","23.3.118.55","192.168.1.118","TCP","1514","443 → 36410 [ACK] Seq=85046 Ack=769 Win=259 Len=1448 TSval=2847573811 TSecr=720231969 [TCP segment of a reassembled PDU]"
"229","0.237428650","23.3.118.55","192.168.1.118","TCP","1514","443 → 36410 [ACK] Seq=86494 Ack=769 Win=259 Len=1448 TSval=2847573811 TSecr=720231969 [TCP segment of a reassembled PDU]"
"230","0.237492000","192.168.1.118","23.3.118.55","TCP","66","36410 → 443 [ACK] Seq=769 Ack=87942 Win=1162 Len=0 TSval=720232027 TSecr=2847573811"
"231","0.237636525","23.3.118.55","192.168.1.118","TCP","2962","443 → 36410 [ACK] Seq=87942 Ack=769 Win=259 Len=2896 TSval=2847573813 TSecr=720231969 [TCP segment of a reassembled PDU]"
"232","0.237703063","192.168.1.118","23.3.118.55","TCP","66","36410 → 443 [ACK] Seq=769 Ack=90838 Win=1207 Len=0 TSval=720232027 TSecr=2847573813"
"233","0.237819600","23.3.118.55","192.168.1.118","TCP","2962","443 → 36410 [ACK] Seq=90838 Ack=769 Win=259 Len=2896 TSval=2847573816 TSecr=720231969 [TCP segment of a reassembled PDU]"
"234","0.237884175","192.168.1.118","23.3.118.55","TCP","66","36410 → 443 [ACK] Seq=769 Ack=93734 Win=1252 Len=0 TSval=720232027 TSecr=2847573816"
"235","0.237933925","23.3.118.55","192.168.1.118","TCP","2962","443 → 36408 [ACK] Seq=46068 Ack=1556 Win=272 Len=2896 TSval=2847573812 TSecr=720231933 [TCP segment of a reassembled PDU]"
"236","0.237999650","192.168.1.118","23.3.118.55","TCP","66","36408 → 443 [ACK] Seq=1556 Ack=48964 Win=637 Len=0 TSval=720232027 TSecr=2847573812"
"237","0.238038988","23.3.118.55","192.168.1.118","TCP","1514","443 → 36410 [ACK] Seq=93734 Ack=769 Win=259 Len=1448 TSval=2847573819 TSecr=720231969 [TCP segment of a reassembled PDU]"
"238","0.243113188","23.3.118.55","192.168.1.118","TCP","1514","443 → 36410 [ACK] Seq=95182 Ack=769 Win=259 Len=1448 TSval=2847573819 TSecr=720231969 [TCP segment of a reassembled PDU]"
"239","0.243155250","192.168.1.118","23.3.118.55","TCP","66","36410 → 443 [ACK] Seq=769 Ack=96630 Win=1298 Len=0 TSval=720232032 TSecr=2847573819"
"240","0.243184525","23.3.118.55","192.168.1.118","TCP","4410","443 → 36408 [ACK] Seq=48964 Ack=1556 Win=272 Len=4344 TSval=2847573820 TSecr=720231933 [TCP segment of a reassembled PDU]"
"241","0.243224850","192.168.1.118","23.3.118.55","TCP","66","36408 → 443 [ACK] Seq=1556 Ack=53308 Win=705 Len=0 TSval=720232032 TSecr=2847573820"
"242","0.243323150","23.3.118.55","192.168.1.118","TLSv1.2","1514","Application Data [TCP segment of a reassembled PDU]"
"243","0.245687138","23.3.118.55","192.168.1.118","TLSv1.2","2962","Application Data [TCP segment of a reassembled PDU]"
"244","0.245728025","192.168.1.118","23.3.118.55","TCP","66","36410 → 443 [ACK] Seq=769 Ack=99526 Win=1343 Len=0 TSval=720232035 TSecr=2847573834"
"245","0.245776925","23.3.118.55","192.168.1.118","TCP","2962","443 → 36408 [ACK] Seq=54756 Ack=1556 Win=272 Len=2896 TSval=2847573825 TSecr=720231933 [TCP segment of a reassembled PDU]"
"246","0.245817963","192.168.1.118","23.3.118.55","TCP","66","36408 → 443 [ACK] Seq=1556 Ack=57652 Win=773 Len=0 TSval=720232035 TSecr=2847573820"
"247","0.245844050","23.3.118.55","192.168.1.118","TCP","130","443 → 36410 [ACK] Seq=99526 Ack=769 Win=259 Len=64 TSval=2847573835 TSecr=720231993 [TCP segment of a reassembled PDU]"
"248","0.247337325","23.3.118.55","192.168.1.118","TCP","2962","443 → 36410 [ACK] Seq=99590 Ack=769 Win=259 Len=2896 TSval=2847573835 TSecr=720231993 [TCP segment of a reassembled PDU]"
"249","0.247379788","192.168.1.118","23.3.118.55","TCP","66","36410 → 443 [ACK] Seq=769 Ack=102486 Win=1388 Len=0 TSval=720232037 TSecr=2847573835"
"250","0.247406738","23.3.118.55","192.168.1.118","TCP","1514","443 → 36408 [ACK] Seq=57652 Ack=1556 Win=272 Len=1448 TSval=2847573829 TSecr=720231933 [TCP segment of a reassembled PDU]"
"251","0.248568088","23.3.118.55","192.168.1.118","TCP","2962","443 → 36410 [ACK] Seq=102486 Ack=769 Win=259 Len=2896 TSval=2847573835 TSecr=720231993 [TCP segment of a reassembled PDU]"
"252","0.248625200","192.168.1.118","23.3.118.55","TCP","66","36410 → 443 [ACK] Seq=769 Ack=105382 Win=1433 Len=0 TSval=720232038 TSecr=2847573835"
"253","0.248707500","23.3.118.55","192.168.1.118","TCP","1514","443 → 36408 [ACK] Seq=59100 Ack=1556 Win=272 Len=1448 TSval=2847573829 TSecr=720231933 [TCP segment of a reassembled PDU]"
"254","0.248782600","192.168.1.118","23.3.118.55","TCP","66","36408 → 443 [ACK] Seq=1556 Ack=60548 Win=818 Len=0 TSval=720232038 TSecr=2847573829"
"255","0.248868063","23.3.118.55","192.168.1.118","TCP","2962","443 → 36410 [ACK] Seq=105382 Ack=769 Win=259 Len=2896 TSval=2847573836 TSecr=720231993 [TCP segment of a reassembled PDU]"
"256","0.248924313","192.168.1.118","23.3.118.55","TCP","66","36410 → 443 [ACK] Seq=769 Ack=108278 Win=1479 Len=0 TSval=720232038 TSecr=2847573836"
"257","0.248967800","23.3.118.55","192.168.1.118","TCP","2962","443 → 36408 [ACK] Seq=60548 Ack=1556 Win=272 Len=2896 TSval=2847573833 TSecr=720231933 [TCP segment of a reassembled PDU]"
"258","0.249024263","192.168.1.118","23.3.118.55","TCP","66","36408 → 443 [ACK] Seq=1556 Ack=63444 Win=863 Len=0 TSval=720232038 TSecr=2847573833"
"259","0.249059975","23.3.118.55","192.168.1.118","TCP","1514","443 → 36410 [ACK] Seq=108278 Ack=769 Win=259 Len=1448 TSval=2847573838 TSecr=720231993 [TCP segment of a reassembled PDU]"
"260","0.259835338","23.3.118.55","192.168.1.118","TLSv1.2","1399","Application Data"
"261","0.259898500","23.3.118.55","192.168.1.118","TCP","1514","443 → 36410 [ACK] Seq=109726 Ack=769 Win=259 Len=1448 TSval=2847573838 TSecr=720231993 [TCP segment of a reassembled PDU]"
"262","0.259962838","192.168.1.118","23.3.118.55","TCP","66","36410 → 443 [ACK] Seq=769 Ack=111174 Win=1524 Len=0 TSval=720232049 TSecr=2847573838"
"263","0.261126475","23.3.118.55","192.168.1.118","TCP","2962","443 → 36410 [ACK] Seq=111174 Ack=769 Win=259 Len=2896 TSval=2847573841 TSecr=720231993 [TCP segment of a reassembled PDU]"
"264","0.261194238","192.168.1.118","23.3.118.55","TCP","66","36410 → 443 [ACK] Seq=769 Ack=114070 Win=1569 Len=0 TSval=720232050 TSecr=2847573841"
"265","0.262284600","23.3.118.55","192.168.1.118","TLSv1.2","2962","Application Data [TCP segment of a reassembled PDU]"
"266","0.262349325","192.168.1.118","23.3.118.55","TCP","66","36410 → 443 [ACK] Seq=769 Ack=116966 Win=1614 Len=0 TSval=720232052 TSecr=2847573844"
"267","0.264307338","192.168.1.118","23.3.118.55","TLSv1.2","853","Application Data"
"268","0.265132213","23.3.118.55","192.168.1.118","TCP","2962","443 → 36410 [ACK] Seq=116966 Ack=769 Win=259 Len=2896 TSval=2847573846 TSecr=720231993 [TCP segment of a reassembled PDU]"
"269","0.265196338","192.168.1.118","23.3.118.55","TCP","66","36410 → 443 [ACK] Seq=769 Ack=119862 Win=1660 Len=0 TSval=720232054 TSecr=2847573846"
"270","0.268282263","23.3.118.55","192.168.1.118","TLSv1.2","2834","Application Data"
"271","0.268366475","192.168.1.118","23.3.118.55","TCP","66","36388 → 443 [ACK] Seq=1556 Ack=167963 Win=1694 Len=0 TSval=720232058 TSecr=2847573853"
"272","0.271368863","192.168.1.118","23.3.118.55","TLSv1.2","844","Application Data"
"273","0.288482638","23.3.118.55","192.168.1.118","TLSv1.2","1649","Application Data"
"274","0.288559913","192.168.1.118","23.3.118.55","TCP","66","36410 → 443 [ACK] Seq=769 Ack=121445 Win=1684 Len=0 TSval=720232078 TSecr=2847573849"
"275","0.291578675","192.168.1.118","23.3.118.55","TLSv1.2","893","Application Data"
"276","0.301034525","23.3.118.55","192.168.1.118","TLSv1.2","3156","Application Data"
"277","0.301132238","192.168.1.118","23.3.118.55","TCP","66","36406 → 443 [ACK] Seq=1539 Ack=77408 Win=679 Len=0 TSval=720232090 TSecr=2847573873"
"278","0.301282713","23.3.118.55","192.168.1.118","TLSv1.2","4642","Application Data"
"279","0.301377875","192.168.1.118","23.3.118.55","TCP","66","36404 → 443 [ACK] Seq=1559 Ack=150371 Win=1591 Len=0 TSval=720232091 TSecr=2847573882"
"280","0.307575238","23.3.118.55","192.168.1.118","TLSv1.2","1588","Application Data"
"281","0.307669763","192.168.1.118","23.3.118.55","TCP","66","36408 → 443 [ACK] Seq=2343 Ack=66299 Win=910 Len=0 TSval=720232097 TSecr=2847573913"
"282","0.309989575","23.3.118.55","192.168.1.118","TLSv1.2","1195","Application Data"
"283","0.313840750","192.168.1.118","23.3.118.55","TLSv1.2","832","Application Data"
"284","0.338383363","23.3.118.55","192.168.1.118","TLSv1.2","441","Application Data"
"285","0.345125863","23.3.118.55","192.168.1.118","TCP","5858","[TCP segment of a reassembled PDU]"
"286","0.345282863","192.168.1.118","23.3.118.55","TCP","66","36388 → 443 [ACK] Seq=3100 Ack=174884 Win=1807 Len=0 TSval=720232134 TSecr=2847573953"
"287","0.349877675","23.3.118.55","192.168.1.118","TCP","8754","443 → 36388 [ACK] Seq=174884 Ack=3100 Win=331 Len=8688 TSval=2847573953 TSecr=720232103 [TCP segment of a reassembled PDU]"
"288","0.350020788","192.168.1.118","23.3.118.55","TCP","66","36388 → 443 [ACK] Seq=3100 Ack=183572 Win=1943 Len=0 TSval=720232139 TSecr=2847573953"
"289","0.351412725","23.3.118.55","192.168.1.118","TLSv1.2","1999","Application Data"
"290","0.351553300","192.168.1.118","23.3.118.55","TCP","66","36388 → 443 [ACK] Seq=3100 Ack=185505 Win=1973 Len=0 TSval=720232141 TSecr=2847573953"
"291","0.351663213","23.3.118.55","192.168.1.118","TCP","1514","[TCP segment of a reassembled PDU]"
"292","0.352555425","23.3.118.55","192.168.1.118","TCP","10202","443 → 36388 [ACK] Seq=186953 Ack=3100 Win=331 Len=10136 TSval=2847573953 TSecr=720232103 [TCP segment of a reassembled PDU]"
"293","0.352647925","192.168.1.118","23.3.118.55","TCP","66","36388 → 443 [ACK] Seq=3100 Ack=197089 Win=2037 Len=0 TSval=720232142 TSecr=2847573953"
"294","0.358859113","23.3.118.55","192.168.1.118","TLSv1.2","5858","Application Data [TCP segment of a reassembled PDU]"
"295","0.358967475","23.3.118.55","192.168.1.118","TCP","2962","443 → 36388 [ACK] Seq=202881 Ack=3100 Win=331 Len=2896 TSval=2847573956 TSecr=720232103 [TCP segment of a reassembled PDU]"
"296","0.361577788","23.3.118.55","192.168.1.118","TCP","2962","443 → 36388 [ACK] Seq=205777 Ack=3100 Win=331 Len=2896 TSval=2847573956 TSecr=720232103 [TCP segment of a reassembled PDU]"
"297","0.361661263","23.3.118.55","192.168.1.118","TCP","5858","443 → 36388 [ACK] Seq=208673 Ack=3100 Win=331 Len=5792 TSval=2847573957 TSecr=720232103 [TCP segment of a reassembled PDU]"
"298","0.361818025","23.3.118.55","192.168.1.118","TLSv1.2","4410","Application Data [TCP segment of a reassembled PDU]"
"299","0.362775838","23.3.118.55","192.168.1.118","TCP","1514","443 → 36388 [ACK] Seq=218809 Ack=3100 Win=331 Len=1448 TSval=2847573958 TSecr=720232103 [TCP segment of a reassembled PDU]"
"300","0.365938613","23.3.118.55","192.168.1.118","TCP","5858","443 → 36388 [ACK] Seq=220257 Ack=3100 Win=331 Len=5792 TSval=2847573959 TSecr=720232103 [TCP segment of a reassembled PDU]"
"301","0.366437988","23.3.118.55","192.168.1.118","TLSv1.2","5652","Application Data"
"302","0.378789775","192.168.1.118","23.3.118.55","TCP","66","36410 → 443 [ACK] Seq=1596 Ack=121820 Win=1707 Len=0 TSval=720232168 TSecr=2847573953"
"303","0.399822500","192.168.1.118","23.3.118.55","TCP","66","36388 → 443 [ACK] Seq=3100 Ack=231635 Win=1768 Len=0 TSval=720232189 TSecr=2847573955"
"304","0.492602063","192.168.1.118","209.18.47.62","DNS","84","Standard query 0xba92 A www.googletagmanager.com"
"305","0.492869563","192.168.1.118","209.18.47.62","DNS","75","Standard query 0x922a A www.youtube.com"
"306","0.511950038","209.18.47.62","192.168.1.118","DNS","144","Standard query response 0xba92 A www.googletagmanager.com CNAME www-googletagmanager.l.google.com A 172.217.12.136"
"307","0.512142713","192.168.1.118","209.18.47.62","DNS","84","Standard query 0xe610 AAAA www.googletagmanager.com"
"308","0.522877025","209.18.47.62","192.168.1.118","DNS","333","Standard query response 0x922a A www.youtube.com CNAME youtube-ui.l.google.com A 172.217.11.14 A 172.217.11.46 A 172.217.12.174 A 172.217.12.206 A 142.250.64.110 A 172.217.9.238 A 172.217.10.14 A 172.217.10.46 A 172.217.10.78 A 172.217.3.110 A 172.217.12.142 A 172.217.6.206 A 142.250.64.78 A 172.217.10.238"
"309","0.523087613","192.168.1.118","209.18.47.62","DNS","75","Standard query 0x5635 AAAA www.youtube.com"
"310","0.537236088","209.18.47.62","192.168.1.118","DNS","156","Standard query response 0xe610 AAAA www.googletagmanager.com CNAME www-googletagmanager.l.google.com AAAA 2607:f8b0:4006:819::2008"
"311","0.545628675","209.18.47.62","192.168.1.118","DNS","137","Standard query response 0x5635 AAAA www.youtube.com CNAME youtube-ui.l.google.com AAAA 2607:f8b0:4006:802::200e"
"312","0.579941038","192.168.1.118","192.168.1.102","TCP","176","44768 → 8009 [PSH, ACK] Seq=1 Ack=1 Win=501 Len=110 TSval=2260168241 TSecr=5469029 [TCP segment of a reassembled PDU]"
"313","0.615275400","192.168.1.102","192.168.1.118","TCP","176","8009 → 44768 [PSH, ACK] Seq=1 Ack=111 Win=294 Len=110 TSval=5469534 TSecr=2260168241 [TCP segment of a reassembled PDU]"
"314","0.615347650","192.168.1.118","192.168.1.102","TCP","66","44768 → 8009 [ACK] Seq=111 Ack=111 Win=501 Len=0 TSval=2260168277 TSecr=5469534"
"315","0.648145625","192.168.1.118","172.217.11.14","TCP","74","41566 → 443 [SYN] Seq=0 Win=64240 Len=0 MSS=1460 SACK_PERM=1 TSval=1881771046 TSecr=0 WS=128"
"316","0.648265600","192.168.1.118","172.217.12.136","TCP","74","34826 → 443 [SYN] Seq=0 Win=64240 Len=0 MSS=1460 SACK_PERM=1 TSval=548044559 TSecr=0 WS=128"
"317","0.661916713","172.217.12.136","192.168.1.118","TCP","74","443 → 34826 [SYN, ACK] Seq=0 Ack=1 Win=60192 Len=0 MSS=1380 SACK_PERM=1 TSval=95871990 TSecr=548044559 WS=256"
"318","0.662002863","192.168.1.118","172.217.12.136","TCP","66","34826 → 443 [ACK] Seq=1 Ack=1 Win=64256 Len=0 TSval=548044573 TSecr=95871990"
"319","0.663814575","172.217.11.14","192.168.1.118","TCP","74","443 → 41566 [SYN, ACK] Seq=0 Ack=1 Win=60192 Len=0 MSS=1380 SACK_PERM=1 TSval=858245118 TSecr=1881771046 WS=256"
"320","0.663914888","192.168.1.118","172.217.11.14","TCP","66","41566 → 443 [ACK] Seq=1 Ack=1 Win=64256 Len=0 TSval=1881771062 TSecr=858245118"
"321","0.691777250","192.168.1.118","172.217.11.14","TLSv1","583","Client Hello"
"322","0.706226125","192.168.1.118","172.217.12.136","TLSv1","583","Client Hello"
"323","0.728215925","172.217.12.136","192.168.1.118","TCP","66","443 → 34826 [ACK] Seq=1 Ack=518 Win=61440 Len=0 TSval=95872056 TSecr=548044617"
"324","0.729339675","172.217.11.14","192.168.1.118","TCP","66","443 → 41566 [ACK] Seq=1 Ack=518 Win=61440 Len=0 TSval=858245184 TSecr=1881771090"
"325","0.736937000","192.168.1.104","255.255.255.255","UDP","217","49154 → 6666 Len=175"
"326","0.742776050","172.217.12.136","192.168.1.118","TLSv1.2","1484","Server Hello"
"327","0.742824825","192.168.1.118","172.217.12.136","TCP","66","34826 → 443 [ACK] Seq=518 Ack=1419 Win=63104 Len=0 TSval=548044654 TSecr=95872062"
"328","0.745216175","172.217.12.136","192.168.1.118","TLSv1.2","1521","Certificate, Server Key Exchange, Server Hello Done"
"329","0.745250250","192.168.1.118","172.217.12.136","TCP","66","34826 → 443 [ACK] Seq=518 Ack=2874 Win=62720 Len=0 TSval=548044656 TSecr=95872062"
"330","0.745277700","172.217.11.14","192.168.1.118","TLSv1.2","1484","Server Hello"
"331","0.745296325","192.168.1.118","172.217.11.14","TCP","66","41566 → 443 [ACK] Seq=518 Ack=1419 Win=63104 Len=0 TSval=1881771144 TSecr=858245191"
"332","0.745329288","172.217.11.14","192.168.1.118","TLSv1.2","2425","Certificate, Server Key Exchange, Server Hello Done"
"333","0.745347613","192.168.1.118","172.217.11.14","TCP","66","41566 → 443 [ACK] Seq=518 Ack=3778 Win=60800 Len=0 TSval=1881771144 TSecr=858245191"
"334","0.747811500","192.168.1.118","172.217.11.14","TLSv1.2","192","Client Key Exchange, Change Cipher Spec, Encrypted Handshake Message"
"335","0.749861313","192.168.1.118","172.217.12.136","TLSv1.2","192","Client Key Exchange, Change Cipher Spec, Encrypted Handshake Message"
"336","0.770005700","172.217.12.136","192.168.1.118","TLSv1.2","117","Change Cipher Spec, Encrypted Handshake Message"
"337","0.770472763","192.168.1.118","172.217.12.136","TLSv1.2","267","Application Data"
"338","0.778811463","172.217.11.14","192.168.1.118","TLSv1.2","117","Change Cipher Spec, Encrypted Handshake Message"
"339","0.779309563","192.168.1.118","172.217.11.14","TLSv1.2","318","Application Data"
"340","0.792903325","172.217.12.136","192.168.1.118","TCP","66","443 → 34826 [ACK] Seq=2925 Ack=845 Win=62464 Len=0 TSval=95872121 TSecr=548044682"
"341","0.803518300","172.217.11.14","192.168.1.118","TCP","66","443 → 41566 [ACK] Seq=3829 Ack=896 Win=62464 Len=0 TSval=858245259 TSecr=1881771178"
"342","0.807030500","172.217.12.136","192.168.1.118","TLSv1.2","873","Application Data"
"343","0.807505725","172.217.12.136","192.168.1.118","TLSv1.2","100","Application Data"
"344","0.808237288","192.168.1.118","172.217.12.136","TCP","66","34826 → 443 [ACK] Seq=845 Ack=3766 Win=64128 Len=0 TSval=548044719 TSecr=95872133"
"345","0.942172188","172.217.11.14","192.168.1.118","TLSv1.2","1484","Application Data"
"346","0.946374000","172.217.11.14","192.168.1.118","TLSv1.2","2902","Application Data, Application Data"
"347","0.946588975","172.217.11.14","192.168.1.118","TLSv1.2","5738","Application Data, Application Data, Application Data, Application Data"
"348","0.946826225","172.217.11.14","192.168.1.118","TLSv1.2","2480","Application Data, Application Data"
"349","0.946911413","172.217.11.14","192.168.1.118","TLSv1.2","199","Application Data"
"350","0.946981850","172.217.11.14","192.168.1.118","TLSv1.2","100","Application Data"
"351","0.948354800","192.168.1.118","172.217.11.14","TCP","66","41566 → 443 [ACK] Seq=896 Ack=16336 Win=51712 Len=0 TSval=1881771347 TSecr=858245383"
"352","1.014002913","192.168.1.118","172.217.11.14","TLSv1.2","334","Application Data"
"353","1.029957863","172.217.11.14","192.168.1.118","TCP","66","443 → 41566 [ACK] Seq=16336 Ack=1164 Win=63488 Len=0 TSval=858245485 TSecr=1881771412"
"354","1.044762450","172.217.11.14","192.168.1.118","TLSv1.2","1484","Application Data"
"355","1.051013463","172.217.11.14","192.168.1.118","TLSv1.2","729","Application Data"
"356","1.051293250","192.168.1.118","172.217.11.14","TCP","66","41566 → 443 [ACK] Seq=1164 Ack=18417 Win=63104 Len=0 TSval=1881771449 TSecr=858245499"
"357","1.051417450","192.168.1.118","172.217.11.14","TLSv1.2","97","Encrypted Alert"
"358","1.053251100","192.168.1.118","172.217.11.14","TCP","66","41566 → 443 [FIN, ACK] Seq=1195 Ack=18417 Win=64128 Len=0 TSval=1881771451 TSecr=858245499"
"359","1.079610888","172.217.11.14","192.168.1.118","TCP","66","443 → 41566 [FIN, ACK] Seq=18417 Ack=1196 Win=63488 Len=0 TSval=858245535 TSecr=1881771450"
"360","1.079734263","192.168.1.118","172.217.11.14","TCP","66","41566 → 443 [ACK] Seq=1196 Ack=18418 Win=64128 Len=0 TSval=1881771478 TSecr=858245535"
"361","2.178943563","192.168.1.102","224.0.0.251","MDNS","183","Standard query response 0x0000 SRV, cache flush 0 0 8009 2c3f16b2-da5c-4b6f-d6cf-bfba61c12490.local"
"362","3.808983488","192.168.1.104","255.255.255.255","UDP","217","49154 → 6666 Len=175"
"363","5.617779450","192.168.1.118","192.168.1.102","TCP","176","44768 → 8009 [PSH, ACK] Seq=111 Ack=111 Win=501 Len=110 TSval=2260173279 TSecr=5469534 [TCP segment of a reassembled PDU]"
"364","5.853267638","192.168.1.118","192.168.1.102","TCP","176","[TCP Retransmission] 44768 → 8009 [PSH, ACK] Seq=111 Ack=111 Win=501 Len=110 TSval=2260173514 TSecr=5469534"
"365","5.953910788","192.168.1.102","192.168.1.118","TCP","176","8009 → 44768 [PSH, ACK] Seq=111 Ack=221 Win=294 Len=110 TSval=5470035 TSecr=2260173279 [TCP segment of a reassembled PDU]"
"366","5.954098538","192.168.1.118","192.168.1.102","TCP","66","44768 → 8009 [ACK] Seq=221 Ack=221 Win=501 Len=0 TSval=2260173615 TSecr=5470035"
"367","5.954310525","192.168.1.102","192.168.1.118","TCP","176","[TCP Spurious Retransmission] 8009 → 44768 [PSH, ACK] Seq=111 Ack=221 Win=294 Len=110 TSval=5470060 TSecr=2260173279 [TCP segment of a reassembled PDU]"
"368","5.954398425","192.168.1.118","192.168.1.102","TCP","78","[TCP Dup ACK 366#1] 44768 → 8009 [ACK] Seq=221 Ack=221 Win=501 Len=0 TSval=2260173616 TSecr=5470060 SLE=111 SRE=221"
"369","5.954479238","192.168.1.102","192.168.1.118","TCP","78","[TCP Dup ACK 365#1] 8009 → 44768 [ACK] Seq=221 Ack=221 Win=294 Len=0 TSval=5470068 TSecr=2260173514 SLE=111 SRE=221"
"370","9.238928713","192.168.1.100","224.0.0.251","MDNS","175","Standard query 0x0000 ANY cjqg._smb._tcp.local, "QM" question ANY cjqg._companion-link._tcp.local, "QM" question SRV 0 0 445 cjqg.local SRV 0 0 51016 cjqg.local OPT"
"371","9.954699325","192.168.1.100","224.0.0.251","MDNS","477","Standard query 0x0000 PTR _googlecast._tcp.local, "QM" question PTR _homekit._tcp.local, "QM" question PTR _uscan._tcp.local, "QM" question PTR _ptp._tcp.local, "QM" question PTR _ippusb._tcp.local, "QM" question PTR _scanner._tcp.local, "QM" question PTR _ipp._tcp.local, "QM" question PTR _pdl-datastream._tcp.local, "QM" question PTR _uscans._tcp.local, "QM" question PTR _ipps._tcp.local, "QM" question PTR _printer._tcp.local, "QM" question PTR _airplay._tcp.local, "QM" question PTR _raop._tcp.local, "QM" question PTR _airport._tcp.local, "QM" question PTR _rdlink._tcp.local, "QM" question TXT Google-Home-Mini-2c3f16b2da5c4b6fd6cfbfba61c12490._googlecast._tcp.local, "QM" question PTR _companion-link._tcp.local, "QM" question PTR _apple-mobdev._tcp.local, "QM" question PTR 8ed307c3._sub._apple-mobdev2._tcp.local, "QM" question PTR _apple-pairable._tcp.local, "QM" question PTR cjqg._companion-link._tcp.local OPT"
"372","10.056625975","192.168.1.102","224.0.0.251","MDNS","409","Standard query response 0x0000 PTR Google-Home-Mini-2c3f16b2da5c4b6fd6cfbfba61c12490._googlecast._tcp.local TXT, cache flush SRV, cache flush 0 0 8009 2c3f16b2-da5c-4b6f-d6cf-bfba61c12490.local A, cache flush 192.168.1.102"
"373","10.059160838","192.168.1.102","224.0.0.251","MDNS","183","Standard query response 0x0000 SRV, cache flush 0 0 8009 2c3f16b2-da5c-4b6f-d6cf-bfba61c12490.local"
