frame.number,_ws.col.Time,_ws.col.Source,_ws.col.Destination,_ws.col.Protocol,frame.len,_ws.col.Info
"1","0.000000000","199.232.37.140","192.168.1.118","TLSv1.2","1418","Application Data"
"2","0.003391325","199.232.37.140","192.168.1.118","TLSv1.2","5474","[TCP Previous segment not captured] , Ignored Unknown Record"
"3","0.003526325","199.232.37.140","192.168.1.118","TLSv1.2","2770","Ignored Unknown Record"
"4","0.007615337","199.232.37.140","192.168.1.118","TLSv1.2","5474","Ignored Unknown Record"
"5","0.009293325","199.232.37.140","192.168.1.118","TLSv1.2","1418","Ignored Unknown Record"
"6","0.010283225","199.232.37.140","192.168.1.118","TLSv1.2","1418","Ignored Unknown Record"
"7","0.011935950","199.232.37.140","192.168.1.118","TLSv1.2","1418","Ignored Unknown Record"
"8","0.012862325","199.232.37.140","192.168.1.118","TLSv1.2","1418","Ignored Unknown Record"
"9","0.014803987","199.232.37.140","192.168.1.118","TLSv1.2","1418","Ignored Unknown Record"
"10","0.017205462","199.232.37.140","192.168.1.118","TCP","90","[TCP segment of a reassembled PDU]"
"11","0.019501187","192.168.1.118","199.232.37.140","TCP","66","[TCP ZeroWindow] [TCP ACKed unseen segment] 39626 → 443 [ACK] Seq=1 Ack=28417 Win=0 Len=0 TSval=1243672798 TSecr=291752822"
"12","0.019571562","192.168.1.118","199.232.37.140","TCP","66","[TCP Window Update] 39626 → 443 [ACK] Seq=1 Ack=28417 Win=208 Len=0 TSval=1243672798 TSecr=291752822"
"13","0.035963750","199.232.37.140","192.168.1.118","TCP","1418","443 → 39626 [ACK] Seq=28417 Ack=1 Win=57 Len=1352 TSval=291752831 TSecr=1243672798 [TCP segment of a reassembled PDU]"
"14","0.037205775","199.232.37.140","192.168.1.118","TCP","2770","443 → 39626 [ACK] Seq=29769 Ack=1 Win=57 Len=2704 TSval=291752831 TSecr=1243672798 [TCP segment of a reassembled PDU]"
"15","0.038178212","199.232.37.140","192.168.1.118","TLSv1.2","2770","Encrypted Handshake Message, Ignored Unknown Record"
"16","0.039770925","199.232.37.140","192.168.1.118","TLSv1.2","1418","Ignored Unknown Record"
"17","0.041599850","199.232.37.140","192.168.1.118","TLSv1.2","2770","Ignored Unknown Record"
"18","0.042750087","199.232.37.140","192.168.1.118","TLSv1.2","2770","Ignored Unknown Record"
"19","0.043859725","199.232.37.140","192.168.1.118","TCP","2770","[TCP segment of a reassembled PDU]"
"20","0.044893712","199.232.37.140","192.168.1.118","TCP","2770","443 → 39626 [ACK] Seq=44641 Ack=1 Win=57 Len=2704 TSval=291752832 TSecr=1243672798 [TCP segment of a reassembled PDU]"
"21","0.045038975","192.168.1.118","199.232.37.140","TCP","66","39626 → 443 [ACK] Seq=1 Ack=47345 Win=61 Len=0 TSval=1243672823 TSecr=291752831"
"22","0.046923987","199.232.37.140","192.168.1.118","TCP","2770","443 → 39626 [ACK] Seq=47345 Ack=1 Win=57 Len=2704 TSval=291752832 TSecr=1243672798 [TCP segment of a reassembled PDU]"
"23","0.046979912","199.232.37.140","192.168.1.118","TCP","1418","443 → 39626 [ACK] Seq=50049 Ack=1 Win=57 Len=1352 TSval=291752833 TSecr=1243672798 [TCP segment of a reassembled PDU]"
"24","0.048114775","199.232.37.140","192.168.1.118","TCP","3706","443 → 39626 [ACK] Seq=51401 Ack=1 Win=57 Len=3640 TSval=291752833 TSecr=1243672798 [TCP segment of a reassembled PDU]"
"25","0.051115575","192.168.1.118","199.232.37.140","TCP","66","39626 → 443 [ACK] Seq=1 Ack=55041 Win=1 Len=0 TSval=1243672829 TSecr=291752832"
"26","0.070067300","192.168.1.118","209.18.47.62","DNS","80","Standard query 0x5cb4 A www.redditstatic.com"
"27","0.094134975","209.18.47.62","192.168.1.118","DNS","131","Standard query response 0x5cb4 A www.redditstatic.com CNAME reddit.map.fastly.net A 199.232.37.140"
"28","0.094294737","192.168.1.118","209.18.47.62","DNS","80","Standard query 0xac2c AAAA www.redditstatic.com"
"29","0.131207837","209.18.47.62","192.168.1.118","DNS","173","Standard query response 0xac2c AAAA www.redditstatic.com CNAME reddit.map.fastly.net SOA ns1.fastly.net"
"30","0.137564762","192.168.1.118","199.232.37.140","TCP","74","39648 → 443 [SYN] Seq=0 Win=64240 Len=0 MSS=1460 SACK_PERM=1 TSval=1243672916 TSecr=0 WS=128"
"31","0.151304450","192.168.1.118","199.232.37.140","TCP","66","[TCP Window Update] 39626 → 443 [ACK] Seq=1 Ack=55041 Win=208 Len=0 TSval=1243672929 TSecr=291752832"
"32","0.155613325","199.232.37.140","192.168.1.118","TCP","74","443 → 39648 [SYN, ACK] Seq=0 Ack=1 Win=27040 Len=0 MSS=1364 SACK_PERM=1 TSval=2831446358 TSecr=1243672916 WS=512"
"33","0.155716037","192.168.1.118","199.232.37.140","TCP","66","39648 → 443 [ACK] Seq=1 Ack=1 Win=64256 Len=0 TSval=1243672934 TSecr=2831446358"
"34","0.170711262","199.232.37.140","192.168.1.118","TCP","1418","443 → 39626 [ACK] Seq=55041 Ack=1 Win=57 Len=1352 TSval=291752865 TSecr=1243672929 [TCP segment of a reassembled PDU]"
"35","0.172020075","199.232.37.140","192.168.1.118","TCP","5474","443 → 39626 [ACK] Seq=56393 Ack=1 Win=57 Len=5408 TSval=291752865 TSecr=1243672929 [TCP segment of a reassembled PDU]"
"36","0.172997462","199.232.37.140","192.168.1.118","TCP","1418","443 → 39626 [ACK] Seq=61801 Ack=1 Win=57 Len=1352 TSval=291752865 TSecr=1243672929 [TCP segment of a reassembled PDU]"
"37","0.174213050","199.232.37.140","192.168.1.118","TCP","2770","443 → 39626 [ACK] Seq=63153 Ack=1 Win=57 Len=2704 TSval=291752865 TSecr=1243672929 [TCP segment of a reassembled PDU]"
"38","0.192663687","192.168.1.118","199.232.37.140","TLSv1","583","Client Hello"
"39","0.192784825","192.168.1.118","199.232.37.140","TCP","66","39626 → 443 [ACK] Seq=1 Ack=65857 Win=124 Len=0 TSval=1243672971 TSecr=291752865"
"40","0.201753800","199.232.37.140","192.168.1.118","TCP","2770","443 → 39626 [ACK] Seq=65857 Ack=1 Win=57 Len=2704 TSval=291752865 TSecr=1243672929 [TCP segment of a reassembled PDU]"
"41","0.201812450","199.232.37.140","192.168.1.118","TLSv1.2","2770","Encrypted Heartbeat [TCP segment of a reassembled PDU]"
"42","0.201859250","192.168.1.118","199.232.37.140","TCP","66","39626 → 443 [ACK] Seq=1 Ack=68561 Win=103 Len=0 TSval=1243672980 TSecr=291752865"
"43","0.201873050","199.232.37.140","192.168.1.118","TCP","1834","443 → 39626 [ACK] Seq=71265 Ack=1 Win=57 Len=1768 TSval=291752866 TSecr=1243672929 [TCP segment of a reassembled PDU]"
"44","0.201920025","199.232.37.140","192.168.1.118","TCP","5474","443 → 39626 [ACK] Seq=73033 Ack=1 Win=57 Len=5408 TSval=291752866 TSecr=1243672929 [TCP segment of a reassembled PDU]"
"45","0.201932925","192.168.1.118","199.232.37.140","TCP","66","39626 → 443 [ACK] Seq=1 Ack=73033 Win=69 Len=0 TSval=1243672980 TSecr=291752866"
"46","0.201939287","199.232.37.140","192.168.1.118","TCP","2770","443 → 39626 [ACK] Seq=78441 Ack=1 Win=57 Len=2704 TSval=291752867 TSecr=1243672929 [TCP segment of a reassembled PDU]"
"47","0.202517837","192.168.1.118","199.232.37.140","TCP","66","39626 → 443 [ACK] Seq=1 Ack=81145 Win=6 Len=0 TSval=1243672981 TSecr=291752866"
"48","0.210822787","199.232.37.140","192.168.1.118","TCP","66","443 → 39648 [ACK] Seq=1 Ack=518 Win=28160 Len=0 TSval=2831446372 TSecr=1243672971"
"49","0.212912650","199.232.37.140","192.168.1.118","TLSv1.2","1418","Server Hello"
"50","0.212979737","192.168.1.118","199.232.37.140","TCP","66","39648 → 443 [ACK] Seq=518 Ack=1353 Win=63104 Len=0 TSval=1243672991 TSecr=2831446372"
"51","0.214882175","199.232.37.140","192.168.1.118","TLSv1.2","1952","Certificate, Server Key Exchange, Server Hello Done"
"52","0.214952675","192.168.1.118","199.232.37.140","TCP","66","39648 → 443 [ACK] Seq=518 Ack=3239 Win=61312 Len=0 TSval=1243672993 TSecr=2831446372"
"53","0.222871012","192.168.1.118","199.232.37.140","TLSv1.2","192","Client Key Exchange, Change Cipher Spec, Encrypted Handshake Message"
"54","0.222992137","192.168.1.118","199.232.37.140","TCP","66","[TCP Window Update] 39626 → 443 [ACK] Seq=1 Ack=81145 Win=176 Len=0 TSval=1243673001 TSecr=291752866"
"55","0.273862662","199.232.37.140","192.168.1.118","TLSv1.2","117","Change Cipher Spec, Encrypted Handshake Message"
"56","0.277989987","192.168.1.118","199.232.37.140","TLSv1.2","256","Application Data"
"57","0.279016025","192.168.1.118","199.232.37.140","TCP","74","39650 → 443 [SYN] Seq=0 Win=64240 Len=0 MSS=1460 SACK_PERM=1 TSval=1243673057 TSecr=0 WS=128"
"58","0.282487462","192.168.1.118","199.232.37.140","TCP","74","39652 → 443 [SYN] Seq=0 Win=64240 Len=0 MSS=1460 SACK_PERM=1 TSval=1243673061 TSecr=0 WS=128"
"59","0.282628337","192.168.1.118","199.232.37.140","TCP","74","39654 → 443 [SYN] Seq=0 Win=64240 Len=0 MSS=1460 SACK_PERM=1 TSval=1243673061 TSecr=0 WS=128"
"60","0.284054687","192.168.1.118","209.18.47.62","DNS","75","Standard query 0x84e4 A preview.redd.it"
"61","0.284641612","192.168.1.118","209.18.47.62","DNS","82","Standard query 0x5437 A styles.redditmedia.com"
"62","0.294042875","192.168.1.118","209.18.47.62","DNS","75","Standard query 0x0c1a A preview.redd.it"
"63","0.304282175","199.232.37.140","192.168.1.118","TCP","1418","443 → 39626 [ACK] Seq=81145 Ack=1 Win=57 Len=1352 TSval=291752893 TSecr=1243673001 [TCP segment of a reassembled PDU]"
"64","0.306470550","192.168.1.118","209.18.47.62","DNS","69","Standard query 0x7c98 A i.redd.it"
"65","0.310846337","192.168.1.118","209.18.47.62","DNS","84","Standard query 0xfc81 A b.thumbs.redditmedia.com"
"66","0.310937712","192.168.1.118","199.232.37.140","TCP","74","39656 → 443 [SYN] Seq=0 Win=64240 Len=0 MSS=1460 SACK_PERM=1 TSval=1243673089 TSecr=0 WS=128"
"67","0.313187062","199.232.37.140","192.168.1.118","TCP","14938","443 → 39626 [ACK] Seq=82497 Ack=1 Win=57 Len=14872 TSval=291752893 TSecr=1243673001 [TCP segment of a reassembled PDU]"
"68","0.313239075","199.232.37.140","192.168.1.118","TCP","748","443 → 39626 [PSH, ACK] Seq=97369 Ack=1 Win=57 Len=682 TSval=291752894 TSecr=1243673001 [TCP segment of a reassembled PDU]"
"69","0.315774287","192.168.1.118","209.18.47.62","DNS","75","Standard query 0xc008 A preview.redd.it"
"70","0.335989062","199.232.37.140","192.168.1.118","TLSv1.2","1418","Application Data"
"71","0.344474212","192.168.1.118","199.232.37.140","TCP","66","39626 → 443 [ACK] Seq=1 Ack=98051 Win=44 Len=0 TSval=1243673123 TSecr=291752893"
"72","0.349215225","199.232.37.140","192.168.1.118","TCP","74","443 → 39650 [SYN, ACK] Seq=0 Ack=1 Win=27040 Len=0 MSS=1364 SACK_PERM=1 TSval=2833306112 TSecr=1243673057 WS=512"
"73","0.349308562","192.168.1.118","199.232.37.140","TCP","66","39650 → 443 [ACK] Seq=1 Ack=1 Win=64256 Len=0 TSval=1243673128 TSecr=2833306112"
"74","0.349351662","199.232.37.140","192.168.1.118","TLSv1.2","1418","Application Data [TCP segment of a reassembled PDU]"
"75","0.350271750","199.232.37.140","192.168.1.118","TLSv1.2","2770","Application Data, Application Data"
"76","0.350469012","192.168.1.118","199.232.37.140","TCP","66","39648 → 443 [ACK] Seq=834 Ack=8698 Win=58752 Len=0 TSval=1243673129 TSecr=2831446401"
"77","0.361946262","199.232.37.140","192.168.1.118","TLSv1.2","4176","Application Data, Application Data, Application Data, Application Data"
"78","0.362002525","209.18.47.62","192.168.1.118","DNS","120","Standard query response 0x7c98 A i.redd.it CNAME reddit.map.fastly.net A 199.232.37.140"
"79","0.362035950","209.18.47.62","192.168.1.118","DNS","126","Standard query response 0x0c1a A preview.redd.it CNAME reddit.map.fastly.net A 199.232.37.140"
"80","0.362588387","192.168.1.118","209.18.47.62","DNS","69","Standard query 0xacf3 AAAA i.redd.it"
"81","0.363078662","192.168.1.118","209.18.47.62","DNS","75","Standard query 0x5cf8 AAAA preview.redd.it"
"82","0.363914200","209.18.47.62","192.168.1.118","DNS","135","Standard query response 0xfc81 A b.thumbs.redditmedia.com CNAME reddit.map.fastly.net A 199.232.37.140"
"83","0.363955625","209.18.47.62","192.168.1.118","DNS","126","Standard query response 0x84e4 A preview.redd.it CNAME reddit.map.fastly.net A 199.232.37.140"
"84","0.364044975","192.168.1.118","209.18.47.62","DNS","75","Standard query 0xe88c AAAA preview.redd.it"
"85","0.364092125","192.168.1.118","209.18.47.62","DNS","84","Standard query 0x50c8 AAAA b.thumbs.redditmedia.com"
"86","0.365848325","209.18.47.62","192.168.1.118","DNS","133","Standard query response 0x5437 A styles.redditmedia.com CNAME reddit.map.fastly.net A 199.232.37.140"
"87","0.365895912","199.232.37.140","192.168.1.118","TCP","74","443 → 39654 [SYN, ACK] Seq=0 Ack=1 Win=27040 Len=0 MSS=1364 SACK_PERM=1 TSval=3209250659 TSecr=1243673061 WS=512"
"88","0.365952725","192.168.1.118","199.232.37.140","TCP","66","39654 → 443 [ACK] Seq=1 Ack=1 Win=64256 Len=0 TSval=1243673144 TSecr=3209250659"
"89","0.367550887","192.168.1.118","209.18.47.62","DNS","82","Standard query 0xb028 AAAA styles.redditmedia.com"
"90","0.368042687","199.232.37.140","192.168.1.118","TCP","74","443 → 39656 [SYN, ACK] Seq=0 Ack=1 Win=27040 Len=0 MSS=1364 SACK_PERM=1 TSval=3162818130 TSecr=1243673089 WS=512"
"91","0.368107550","192.168.1.118","199.232.37.140","TCP","66","39656 → 443 [ACK] Seq=1 Ack=1 Win=64256 Len=0 TSval=1243673146 TSecr=3162818130"
"92","0.368128400","199.232.37.140","192.168.1.118","TCP","74","443 → 39652 [SYN, ACK] Seq=0 Ack=1 Win=27040 Len=0 MSS=1364 SACK_PERM=1 TSval=291752907 TSecr=1243673061 WS=512"
"93","0.368154475","192.168.1.118","199.232.37.140","TCP","66","39652 → 443 [ACK] Seq=1 Ack=1 Win=64256 Len=0 TSval=1243673146 TSecr=291752907"
"94","0.375667062","209.18.47.62","192.168.1.118","DNS","126","Standard query response 0xc008 A preview.redd.it CNAME reddit.map.fastly.net A 199.232.37.140"
"95","0.376916025","192.168.1.118","209.18.47.62","DNS","75","Standard query 0x74d5 AAAA preview.redd.it"
"96","0.384360487","192.168.1.118","199.232.37.140","TLSv1","583","Client Hello"
"97","0.402449012","192.168.1.118","199.232.37.140","TCP","66","39648 → 443 [ACK] Seq=834 Ack=12808 Win=54656 Len=0 TSval=1243673181 TSecr=2831446401"
"98","0.423433712","209.18.47.62","192.168.1.118","DNS","171","Standard query response 0x74d5 AAAA preview.redd.it CNAME reddit.map.fastly.net SOA ns1.fastly.net"
"99","0.425704712","209.18.47.62","192.168.1.118","DNS","171","Standard query response 0x5cf8 AAAA preview.redd.it CNAME reddit.map.fastly.net SOA ns1.fastly.net"
"100","0.425751712","209.18.47.62","192.168.1.118","DNS","171","Standard query response 0xe88c AAAA preview.redd.it CNAME reddit.map.fastly.net SOA ns1.fastly.net"
"101","0.425770850","209.18.47.62","192.168.1.118","DNS","177","Standard query response 0x50c8 AAAA b.thumbs.redditmedia.com CNAME reddit.map.fastly.net SOA ns1.fastly.net"
"102","0.425788825","209.18.47.62","192.168.1.118","DNS","165","Standard query response 0xacf3 AAAA i.redd.it CNAME reddit.map.fastly.net SOA ns1.fastly.net"
"103","0.425804387","209.18.47.62","192.168.1.118","DNS","175","Standard query response 0xb028 AAAA styles.redditmedia.com CNAME reddit.map.fastly.net SOA ns1.fastly.net"
"104","0.425821562","199.232.37.140","192.168.1.118","TCP","66","443 → 39650 [ACK] Seq=1 Ack=518 Win=28160 Len=0 TSval=2833306136 TSecr=1243673163"
"105","0.426897587","199.232.37.140","192.168.1.118","TLSv1.2","1418","Server Hello"
"106","0.426953637","192.168.1.118","199.232.37.140","TCP","66","39650 → 443 [ACK] Seq=518 Ack=1353 Win=63104 Len=0 TSval=1243673205 TSecr=2833306136"
"107","0.428493862","199.232.37.140","192.168.1.118","TLSv1.2","1952","Certificate, Server Key Exchange, Server Hello Done"
"108","0.428556587","192.168.1.118","199.232.37.140","TCP","66","39650 → 443 [ACK] Seq=518 Ack=3239 Win=61312 Len=0 TSval=1243673207 TSecr=2833306136"
"109","0.433027875","192.168.1.118","199.232.37.140","TLSv1","583","Client Hello"
"110","0.455125100","199.232.37.140","192.168.1.118","TCP","66","443 → 39652 [ACK] Seq=1 Ack=518 Win=28160 Len=0 TSval=291752936 TSecr=1243673211"
"111","0.457753725","199.232.37.140","192.168.1.118","TLSv1.2","1418","Server Hello"
"112","0.457809587","192.168.1.118","199.232.37.140","TCP","66","39652 → 443 [ACK] Seq=518 Ack=1353 Win=63104 Len=0 TSval=1243673236 TSecr=291752936"
"113","0.458895912","199.232.37.140","192.168.1.118","TLSv1.2","1952","Certificate, Server Key Exchange, Server Hello Done"
"114","0.458951000","192.168.1.118","199.232.37.140","TCP","66","39652 → 443 [ACK] Seq=518 Ack=3239 Win=61312 Len=0 TSval=1243673237 TSecr=291752936"
"115","0.459974900","192.168.1.118","199.232.37.140","TLSv1","583","Client Hello"
"116","0.460282087","192.168.1.118","199.232.37.140","TCP","74","39658 → 443 [SYN] Seq=0 Win=64240 Len=0 MSS=1460 SACK_PERM=1 TSval=1243673238 TSecr=0 WS=128"
"117","0.460374500","192.168.1.118","199.232.37.140","TCP","74","39660 → 443 [SYN] Seq=0 Win=64240 Len=0 MSS=1460 SACK_PERM=1 TSval=1243673239 TSecr=0 WS=128"
"118","0.460511075","192.168.1.118","199.232.37.140","TCP","74","39662 → 443 [SYN] Seq=0 Win=64240 Len=0 MSS=1460 SACK_PERM=1 TSval=1243673239 TSecr=0 WS=128"
"119","0.483600662","199.232.37.140","192.168.1.118","TCP","66","443 → 39654 [ACK] Seq=1 Ack=518 Win=28160 Len=0 TSval=3209250803 TSecr=1243673238"
"120","0.486507137","199.232.37.140","192.168.1.118","TCP","74","443 → 39662 [SYN, ACK] Seq=0 Ack=1 Win=27040 Len=0 MSS=1364 SACK_PERM=1 TSval=2833381471 TSecr=1243673239 WS=512"
"121","0.486602512","192.168.1.118","199.232.37.140","TCP","66","39662 → 443 [ACK] Seq=1 Ack=1 Win=64256 Len=0 TSval=1243673265 TSecr=2833381471"
"122","0.486640850","199.232.37.140","192.168.1.118","TCP","74","443 → 39660 [SYN, ACK] Seq=0 Ack=1 Win=27040 Len=0 MSS=1364 SACK_PERM=1 TSval=3933738290 TSecr=1243673239 WS=512"
"123","0.486665300","192.168.1.118","199.232.37.140","TCP","66","39660 → 443 [ACK] Seq=1 Ack=1 Win=64256 Len=0 TSval=1243673265 TSecr=3933738290"
"124","0.486679275","199.232.37.140","192.168.1.118","TCP","74","443 → 39658 [SYN, ACK] Seq=0 Ack=1 Win=27040 Len=0 MSS=1364 SACK_PERM=1 TSval=3164822246 TSecr=1243673238 WS=512"
"125","0.486701300","192.168.1.118","199.232.37.140","TCP","66","39658 → 443 [ACK] Seq=1 Ack=1 Win=64256 Len=0 TSval=1243673265 TSecr=3164822246"
"126","0.491421512","192.168.1.118","199.232.37.140","TLSv1","583","Client Hello"
"127","0.491562675","199.232.37.140","192.168.1.118","TLSv1.2","3304","Server Hello, Certificate, Server Key Exchange, Server Hello Done"
"128","0.491599875","192.168.1.118","199.232.37.140","TCP","66","39654 → 443 [ACK] Seq=518 Ack=3239 Win=61056 Len=0 TSval=1243673270 TSecr=3209250805"
"129","0.491933512","192.168.1.118","199.232.37.140","TCP","74","39664 → 443 [SYN] Seq=0 Win=64240 Len=0 MSS=1460 SACK_PERM=1 TSval=1243673270 TSecr=0 WS=128"
"130","0.492082500","192.168.1.118","199.232.37.140","TCP","74","39666 → 443 [SYN] Seq=0 Win=64240 Len=0 MSS=1460 SACK_PERM=1 TSval=1243673270 TSecr=0 WS=128"
"131","0.492189762","192.168.1.118","199.232.37.140","TCP","74","39668 → 443 [SYN] Seq=0 Win=64240 Len=0 MSS=1460 SACK_PERM=1 TSval=1243673270 TSecr=0 WS=128"
"132","0.492291400","192.168.1.118","199.232.37.140","TCP","74","39670 → 443 [SYN] Seq=0 Win=64240 Len=0 MSS=1460 SACK_PERM=1 TSval=1243673271 TSecr=0 WS=128"
"133","0.492585362","192.168.1.118","199.232.37.140","TCP","74","39672 → 443 [SYN] Seq=0 Win=64240 Len=0 MSS=1460 SACK_PERM=1 TSval=1243673271 TSecr=0 WS=128"
"134","0.492662350","192.168.1.118","199.232.37.140","TCP","74","39674 → 443 [SYN] Seq=0 Win=64240 Len=0 MSS=1460 SACK_PERM=1 TSval=1243673271 TSecr=0 WS=128"
"135","0.495092325","192.168.1.118","199.232.37.140","TLSv1.2","192","Client Key Exchange, Change Cipher Spec, Encrypted Handshake Message"
"136","0.495302100","192.168.1.118","199.232.37.140","TCP","74","39676 → 443 [SYN] Seq=0 Win=64240 Len=0 MSS=1460 SACK_PERM=1 TSval=1243673274 TSecr=0 WS=128"
"137","0.497254137","192.168.1.118","199.232.37.140","TLSv1.2","192","Client Key Exchange, Change Cipher Spec, Encrypted Handshake Message"
"138","0.499947687","192.168.1.118","199.232.37.140","TLSv1.2","192","Client Key Exchange, Change Cipher Spec, Encrypted Handshake Message"
"139","0.522351537","192.168.1.118","199.232.37.140","TLSv1","583","Client Hello"
"140","0.549108412","199.232.37.140","192.168.1.118","TCP","66","443 → 39656 [ACK] Seq=1 Ack=518 Win=28160 Len=0 TSval=3162818183 TSecr=1243673270"
"141","0.549933662","199.232.37.140","192.168.1.118","TLSv1.2","117","Change Cipher Spec, Encrypted Handshake Message"
"142","0.550001212","192.168.1.118","199.232.37.140","TCP","66","39650 → 443 [ACK] Seq=644 Ack=3290 Win=64128 Len=0 TSval=1243673328 TSecr=2833306167"
"143","0.550042037","199.232.37.140","192.168.1.118","TLSv1.2","117","Change Cipher Spec, Encrypted Handshake Message"
"144","0.550215925","192.168.1.118","199.232.37.140","TLSv1","583","Client Hello"
"145","0.551292387","199.232.37.140","192.168.1.118","TCP","74","443 → 39664 [SYN, ACK] Seq=0 Ack=1 Win=27040 Len=0 MSS=1364 SACK_PERM=1 TSval=293980365 TSecr=1243673270 WS=512"
"146","0.551374400","192.168.1.118","199.232.37.140","TCP","66","39664 → 443 [ACK] Seq=1 Ack=1 Win=64256 Len=0 TSval=1243673330 TSecr=293980365"
"147","0.551429325","199.232.37.140","192.168.1.118","TCP","74","443 → 39668 [SYN, ACK] Seq=0 Ack=1 Win=27040 Len=0 MSS=1364 SACK_PERM=1 TSval=2831446457 TSecr=1243673270 WS=512"
"148","0.551456887","192.168.1.118","199.232.37.140","TCP","66","39668 → 443 [ACK] Seq=1 Ack=1 Win=64256 Len=0 TSval=1243673330 TSecr=2831446457"
"149","0.551472550","199.232.37.140","192.168.1.118","TCP","74","443 → 39670 [SYN, ACK] Seq=0 Ack=1 Win=27040 Len=0 MSS=1364 SACK_PERM=1 TSval=3253578993 TSecr=1243673271 WS=512"
"150","0.551495350","192.168.1.118","199.232.37.140","TCP","66","39670 → 443 [ACK] Seq=1 Ack=1 Win=64256 Len=0 TSval=1243673330 TSecr=3253578993"
"151","0.551510212","199.232.37.140","192.168.1.118","TLSv1.2","117","Change Cipher Spec, Encrypted Handshake Message"
"152","0.551532362","199.232.37.140","192.168.1.118","TCP","74","443 → 39672 [SYN, ACK] Seq=0 Ack=1 Win=27040 Len=0 MSS=1364 SACK_PERM=1 TSval=3164149315 TSecr=1243673271 WS=512"
"153","0.551561887","192.168.1.118","199.232.37.140","TCP","66","39672 → 443 [ACK] Seq=1 Ack=1 Win=64256 Len=0 TSval=1243673330 TSecr=3164149315"
"154","0.554100075","199.232.37.140","192.168.1.118","TCP","74","443 → 39666 [SYN, ACK] Seq=0 Ack=1 Win=27040 Len=0 MSS=1364 SACK_PERM=1 TSval=294790820 TSecr=1243673270 WS=512"
"155","0.554191200","192.168.1.118","199.232.37.140","TCP","66","39666 → 443 [ACK] Seq=1 Ack=1 Win=64256 Len=0 TSval=1243673332 TSecr=294790820"
"156","0.554227862","199.232.37.140","192.168.1.118","TCP","74","443 → 39674 [SYN, ACK] Seq=0 Ack=1 Win=27040 Len=0 MSS=1364 SACK_PERM=1 TSval=3166158130 TSecr=1243673271 WS=512"
"157","0.554251112","192.168.1.118","199.232.37.140","TCP","66","39674 → 443 [ACK] Seq=1 Ack=1 Win=64256 Len=0 TSval=1243673332 TSecr=3166158130"
"158","0.554266462","199.232.37.140","192.168.1.118","TCP","66","443 → 39658 [ACK] Seq=1 Ack=518 Win=28160 Len=0 TSval=3164822263 TSecr=1243673301"
"159","0.554285450","199.232.37.140","192.168.1.118","TCP","74","443 → 39676 [SYN, ACK] Seq=0 Ack=1 Win=27040 Len=0 MSS=1364 SACK_PERM=1 TSval=2832391013 TSecr=1243673274 WS=512"
"160","0.554307175","192.168.1.118","199.232.37.140","TCP","66","39676 → 443 [ACK] Seq=1 Ack=1 Win=64256 Len=0 TSval=1243673333 TSecr=2832391013"
"161","0.554341712","199.232.37.140","192.168.1.118","TLSv1.2","3304","Server Hello, Certificate, Server Key Exchange, Server Hello Done"
"162","0.554361225","192.168.1.118","199.232.37.140","TCP","66","39656 → 443 [ACK] Seq=518 Ack=3239 Win=61056 Len=0 TSval=1243673333 TSecr=3162818183"
"163","0.557639587","199.232.37.140","192.168.1.118","TLSv1.2","3432","Server Hello, Certificate, Server Key Exchange, Server Hello Done"
"164","0.557707962","192.168.1.118","199.232.37.140","TCP","66","39658 → 443 [ACK] Seq=518 Ack=3367 Win=60928 Len=0 TSval=1243673336 TSecr=3164822263"
"165","0.582116937","199.232.37.140","192.168.1.118","TCP","66","443 → 39660 [ACK] Seq=1 Ack=518 Win=28160 Len=0 TSval=3933738314 TSecr=1243673328"
"166","0.583362300","199.232.37.140","192.168.1.118","TLSv1.2","1418","Server Hello"
"167","0.583414975","192.168.1.118","199.232.37.140","TCP","66","39660 → 443 [ACK] Seq=518 Ack=1353 Win=63104 Len=0 TSval=1243673362 TSecr=3933738314"
"168","0.585056462","199.232.37.140","192.168.1.118","TLSv1.2","1984","Certificate, Server Key Exchange, Server Hello Done"
"169","0.585125875","192.168.1.118","199.232.37.140","TCP","66","39660 → 443 [ACK] Seq=518 Ack=3271 Win=61312 Len=0 TSval=1243673363 TSecr=3933738314"
"170","0.590484187","192.168.1.118","199.232.37.140","TCP","66","39652 → 443 [ACK] Seq=644 Ack=3290 Win=64128 Len=0 TSval=1243673369 TSecr=291752960"
"171","0.592461737","192.168.1.118","199.232.37.140","TCP","66","39654 → 443 [ACK] Seq=644 Ack=3290 Win=64128 Len=0 TSval=1243673371 TSecr=3209250870"
"172","0.613247162","192.168.1.118","199.232.37.140","TLSv1","583","Client Hello"
"173","0.621784650","192.168.1.118","199.232.37.140","TLSv1.2","192","Client Key Exchange, Change Cipher Spec, Encrypted Handshake Message"
"174","0.642669950","199.232.37.140","192.168.1.118","TCP","66","443 → 39662 [ACK] Seq=1 Ack=518 Win=28160 Len=0 TSval=2833381510 TSecr=1243673391"
"175","0.647578125","199.232.37.140","192.168.1.118","TLSv1.2","1418","Server Hello"
"176","0.647647075","192.168.1.118","199.232.37.140","TCP","66","39662 → 443 [ACK] Seq=518 Ack=1353 Win=63104 Len=0 TSval=1243673426 TSecr=2833381511"
"177","0.649147162","199.232.37.140","192.168.1.118","TLSv1.2","2080","Certificate, Server Key Exchange, Server Hello Done"
"178","0.649179862","192.168.1.118","199.232.37.140","TCP","66","39662 → 443 [ACK] Seq=518 Ack=3367 Win=61184 Len=0 TSval=1243673427 TSecr=2833381511"
"179","0.654657925","199.232.37.140","192.168.1.118","TLSv1.2","117","Change Cipher Spec, Encrypted Handshake Message"
"180","0.654730925","192.168.1.118","199.232.37.140","TCP","66","39656 → 443 [ACK] Seq=644 Ack=3290 Win=64128 Len=0 TSval=1243673433 TSecr=3162818209"
"181","0.661766775","192.168.1.118","199.232.37.140","TLSv1","583","Client Hello"
"182","0.695598987","199.232.37.140","192.168.1.118","TCP","66","443 → 39664 [ACK] Seq=1 Ack=518 Win=28160 Len=0 TSval=293980402 TSecr=1243673440"
"183","0.697201612","199.232.37.140","192.168.1.118","TLSv1.2","1418","Server Hello"
"184","0.697266587","192.168.1.118","199.232.37.140","TCP","66","39664 → 443 [ACK] Seq=518 Ack=1353 Win=63104 Len=0 TSval=1243673475 TSecr=293980402"
"185","0.698652075","199.232.37.140","192.168.1.118","TLSv1.2","1984","Certificate, Server Key Exchange, Server Hello Done"
"186","0.698719687","192.168.1.118","199.232.37.140","TCP","66","39664 → 443 [ACK] Seq=518 Ack=3271 Win=61312 Len=0 TSval=1243673477 TSecr=293980402"
"187","0.699960350","192.168.1.118","199.232.37.140","TLSv1","583","Client Hello"
"188","0.726633225","199.232.37.140","192.168.1.118","TCP","66","443 → 39666 [ACK] Seq=1 Ack=518 Win=28160 Len=0 TSval=294790865 TSecr=1243673478"
"189","0.728698112","199.232.37.140","192.168.1.118","TLSv1.2","1418","Server Hello"
"190","0.728746075","192.168.1.118","199.232.37.140","TCP","66","39666 → 443 [ACK] Seq=518 Ack=1353 Win=63104 Len=0 TSval=1243673507 TSecr=294790865"
"191","0.731603112","199.232.37.140","192.168.1.118","TLSv1.2","2080","Certificate, Server Key Exchange, Server Hello Done"
"192","0.731673937","192.168.1.118","199.232.37.140","TCP","66","39666 → 443 [ACK] Seq=518 Ack=3367 Win=61184 Len=0 TSval=1243673510 TSecr=294790865"
"193","0.745273900","192.168.1.118","199.232.37.140","TLSv1","583","Client Hello"
"194","0.768340000","192.168.1.118","199.232.37.140","TLSv1","583","Client Hello"
"195","0.772990125","199.232.37.140","192.168.1.118","TCP","66","443 → 39668 [ACK] Seq=1 Ack=518 Win=28160 Len=0 TSval=2831446512 TSecr=1243673523"
"196","0.774195050","199.232.37.140","192.168.1.118","SSL","1984","[TCP Previous segment not captured] , Continuation Data"
"197","0.774253562","192.168.1.118","199.232.37.140","TCP","78","[TCP Dup ACK 148#1] 39668 → 443 [ACK] Seq=518 Ack=1 Win=64256 Len=0 TSval=1243673552 TSecr=2831446512 SLE=1353 SRE=3271"
"198","0.778086487","199.232.37.140","192.168.1.118","TCP","1418","[TCP Out-Of-Order] 443 → 39668 [ACK] Seq=1 Ack=518 Win=28160 Len=1352 TSval=2831446512 TSecr=1243673523"
"199","0.778154050","192.168.1.118","199.232.37.140","TCP","66","39668 → 443 [ACK] Seq=518 Ack=3271 Win=61056 Len=0 TSval=1243673556 TSecr=2831446512"
"200","0.790255937","199.232.37.140","192.168.1.118","TCP","66","443 → 39670 [ACK] Seq=1 Ack=518 Win=28160 Len=0 TSval=3253579054 TSecr=1243673547"
"201","0.793269937","199.232.37.140","192.168.1.118","TLSv1.2","1418","Server Hello"
"202","0.793337712","192.168.1.118","199.232.37.140","TCP","66","39670 → 443 [ACK] Seq=518 Ack=1353 Win=63104 Len=0 TSval=1243673572 TSecr=3253579054"
"203","0.794734537","199.232.37.140","192.168.1.118","TLSv1.2","2080","Certificate, Server Key Exchange, Server Hello Done"
"204","0.794801125","192.168.1.118","199.232.37.140","TCP","66","39670 → 443 [ACK] Seq=518 Ack=3367 Win=61184 Len=0 TSval=1243673573 TSecr=3253579054"
"205","0.847293487","192.168.1.118","199.232.37.140","TLSv1","583","Client Hello"
"206","0.861904475","199.232.37.140","192.168.1.118","TCP","66","443 → 39672 [ACK] Seq=1 Ack=518 Win=28160 Len=0 TSval=3164149393 TSecr=1243673625"
"207","0.869181550","199.232.37.140","192.168.1.118","TLSv1.2","1418","Server Hello"
"208","0.869248725","192.168.1.118","199.232.37.140","TCP","66","39672 → 443 [ACK] Seq=518 Ack=1353 Win=63104 Len=0 TSval=1243673647 TSecr=3164149394"
"209","0.870628550","199.232.37.140","192.168.1.118","TLSv1.2","1962","Certificate, Server Key Exchange, Server Hello Done"
"210","0.870687225","192.168.1.118","199.232.37.140","TCP","66","39672 → 443 [ACK] Seq=518 Ack=3249 Win=61312 Len=0 TSval=1243673649 TSecr=3164149394"
"211","0.896053900","192.168.1.118","199.232.37.140","TLSv1","583","Client Hello"
"212","0.902343187","192.168.1.118","199.232.37.140","TLSv1.2","272","Application Data"
"213","0.922045550","199.232.37.140","192.168.1.118","TCP","66","443 → 39674 [ACK] Seq=1 Ack=518 Win=28160 Len=0 TSval=3166158223 TSecr=1243673674"
"214","0.923492787","192.168.1.118","199.232.37.140","TLSv1","583","Client Hello"
"215","0.923898525","192.168.1.118","199.232.37.140","TLSv1.2","279","Application Data"
"216","0.924122687","192.168.1.118","199.232.37.140","TLSv1.2","280","Application Data"
"217","0.926021000","192.168.1.118","199.232.37.140","TLSv1.2","192","Client Key Exchange, Change Cipher Spec, Encrypted Handshake Message"
"218","0.928006162","199.232.37.140","192.168.1.118","TLSv1.2","3432","Server Hello, Certificate, Server Key Exchange, Server Hello Done"
"219","0.928074862","192.168.1.118","199.232.37.140","TCP","66","39674 → 443 [ACK] Seq=518 Ack=3367 Win=60928 Len=0 TSval=1243673706 TSecr=3166158224"
"220","0.928182625","192.168.1.118","199.232.37.140","TLSv1.2","192","Client Key Exchange, Change Cipher Spec, Encrypted Handshake Message"
"221","0.930688050","192.168.1.118","199.232.37.140","TLSv1.2","192","Client Key Exchange, Change Cipher Spec, Encrypted Handshake Message"
"222","0.931022337","192.168.1.118","199.232.37.140","TLSv1.2","274","Application Data"
"223","0.932783562","199.232.37.140","192.168.1.118","TLSv1.2","1418","Application Data"
"224","0.932861325","192.168.1.118","199.232.37.140","TCP","66","39650 → 443 [ACK] Seq=850 Ack=4642 Win=63104 Len=0 TSval=1243673711 TSecr=2833306263"
"225","0.933800037","192.168.1.118","199.232.37.140","TLSv1.2","192","Client Key Exchange, Change Cipher Spec, Encrypted Handshake Message"
"226","0.934345487","199.232.37.140","192.168.1.118","TLSv1.2","1585","Application Data, Application Data"
"227","0.934429862","192.168.1.118","199.232.37.140","TCP","66","39650 → 443 [ACK] Seq=850 Ack=6161 Win=61696 Len=0 TSval=1243673713 TSecr=2833306263"
"228","0.935792687","192.168.1.118","199.232.37.140","TLSv1.2","192","Client Key Exchange, Change Cipher Spec, Encrypted Handshake Message"
"229","0.938583725","192.168.1.118","199.232.37.140","TLSv1.2","192","Client Key Exchange, Change Cipher Spec, Encrypted Handshake Message"
"230","0.940573000","192.168.1.118","199.232.37.140","TLSv1.2","192","Client Key Exchange, Change Cipher Spec, Encrypted Handshake Message"
"231","0.943282400","192.168.1.118","199.232.37.140","TLSv1.2","192","Client Key Exchange, Change Cipher Spec, Encrypted Handshake Message"
"232","0.945225662","192.168.1.118","199.232.37.140","TLSv1.2","192","Client Key Exchange, Change Cipher Spec, Encrypted Handshake Message"
"233","0.946457800","199.232.37.140","192.168.1.118","TCP","66","443 → 39676 [ACK] Seq=1 Ack=518 Win=28160 Len=0 TSval=2832391112 TSecr=1243673702"
"234","0.953002325","192.168.1.118","199.232.37.140","TCP","74","39678 → 443 [SYN] Seq=0 Win=64240 Len=0 MSS=1460 SACK_PERM=1 TSval=1243673731 TSecr=0 WS=128"
"235","0.953160300","192.168.1.118","199.232.37.140","TCP","74","39680 → 443 [SYN] Seq=0 Win=64240 Len=0 MSS=1460 SACK_PERM=1 TSval=1243673731 TSecr=0 WS=128"
"236","0.953260762","192.168.1.118","199.232.37.140","TCP","74","39682 → 443 [SYN] Seq=0 Win=64240 Len=0 MSS=1460 SACK_PERM=1 TSval=1243673731 TSecr=0 WS=128"
"237","0.957066087","199.232.37.140","192.168.1.118","TLSv1.2","1418","Server Hello"
"238","0.957131500","192.168.1.118","199.232.37.140","TCP","66","39676 → 443 [ACK] Seq=518 Ack=1353 Win=63104 Len=0 TSval=1243673735 TSecr=2832391113"
"239","0.959380112","199.232.37.140","192.168.1.118","TLSv1.2","2080","Certificate, Server Key Exchange, Server Hello Done"
"240","0.959466387","192.168.1.118","199.232.37.140","TCP","66","39676 → 443 [ACK] Seq=518 Ack=3367 Win=61184 Len=0 TSval=1243673738 TSecr=2832391113"
"241","0.959544625","199.232.37.140","192.168.1.118","TLSv1.2","8178","Application Data, Application Data, Application Data, Application Data, Application Data, Application Data"
"242","0.959574512","192.168.1.118","199.232.37.140","TCP","66","39654 → 443 [ACK] Seq=858 Ack=11402 Win=56064 Len=0 TSval=1243673738 TSecr=3209251277"
"243","0.963858225","199.232.37.140","192.168.1.118","TLSv1.2","745","Application Data, Application Data"
"244","0.963933187","192.168.1.118","199.232.37.140","TCP","66","39652 → 443 [ACK] Seq=857 Ack=3969 Win=63488 Len=0 TSval=1243673742 TSecr=291753061"
"245","0.963970600","199.232.37.140","192.168.1.118","TLSv1.2","117","Change Cipher Spec, Encrypted Handshake Message"
"246","0.963991250","192.168.1.118","199.232.37.140","TCP","66","39660 → 443 [ACK] Seq=644 Ack=3322 Win=64128 Len=0 TSval=1243673742 TSecr=3933738408"
"247","0.964007625","199.232.37.140","192.168.1.118","TLSv1.2","117","Change Cipher Spec, Encrypted Handshake Message"
"248","0.964026687","192.168.1.118","199.232.37.140","TCP","66","39662 → 443 [ACK] Seq=644 Ack=3418 Win=64128 Len=0 TSval=1243673742 TSecr=2833381589"
"249","0.964047412","199.232.37.140","192.168.1.118","TLSv1.2","2532","Application Data, Application Data, Application Data"
"250","0.964068125","192.168.1.118","199.232.37.140","TCP","66","39656 → 443 [ACK] Seq=852 Ack=5756 Win=61696 Len=0 TSval=1243673742 TSecr=3162818285"
"251","0.964082700","199.232.37.140","192.168.1.118","TLSv1.2","117","Change Cipher Spec, Encrypted Handshake Message"
"252","0.964102287","192.168.1.118","199.232.37.140","TCP","66","39668 → 443 [ACK] Seq=644 Ack=3322 Win=64128 Len=0 TSval=1243673742 TSecr=2831446559"
"253","0.964117162","199.232.37.140","192.168.1.118","TLSv1.2","117","Change Cipher Spec, Encrypted Handshake Message"
"254","0.964138175","192.168.1.118","199.232.37.140","TCP","66","39666 → 443 [ACK] Seq=644 Ack=3418 Win=64128 Len=0 TSval=1243673742 TSecr=294790923"
"255","0.964152562","199.232.37.140","192.168.1.118","TLSv1.2","117","Change Cipher Spec, Encrypted Handshake Message"
"256","0.964171812","192.168.1.118","199.232.37.140","TCP","66","39658 → 443 [ACK] Seq=644 Ack=3418 Win=64128 Len=0 TSval=1243673742 TSecr=3164822365"
"257","0.964185862","199.232.37.140","192.168.1.118","TLSv1.2","117","Change Cipher Spec, Encrypted Handshake Message"
"258","0.964203962","192.168.1.118","199.232.37.140","TCP","66","39664 → 443 [ACK] Seq=644 Ack=3322 Win=64128 Len=0 TSval=1243673742 TSecr=293980468"
"259","0.964215325","199.232.37.140","192.168.1.118","TLSv1.2","5474","Application Data, Application Data, Application Data, Application Data"
"260","0.964238362","192.168.1.118","199.232.37.140","TCP","66","39654 → 443 [ACK] Seq=858 Ack=16810 Win=50688 Len=0 TSval=1243673742 TSecr=3209251277"
"261","0.966391787","192.168.1.118","199.232.37.140","TLSv1.2","192","Client Key Exchange, Change Cipher Spec, Encrypted Handshake Message"
"262","0.966947237","192.168.1.118","199.232.37.140","TLSv1.2","250","Application Data"
"263","0.967169650","192.168.1.118","199.232.37.140","TLSv1.2","295","Application Data"
"264","0.967367675","192.168.1.118","199.232.37.140","TLSv1.2","376","Application Data"
"265","0.967696025","192.168.1.118","199.232.37.140","TLSv1.2","295","Application Data"
"266","0.967894187","192.168.1.118","199.232.37.140","TLSv1.2","341","Application Data"
"267","0.968090900","192.168.1.118","199.232.37.140","TLSv1.2","295","Application Data"
"268","0.968861575","192.168.1.118","199.232.37.140","TCP","66","[TCP Window Update] 39626 → 443 [ACK] Seq=1 Ack=98051 Win=291 Len=0 TSval=1243673747 TSecr=291752893"
"269","0.991932362","199.232.37.140","192.168.1.118","TLSv1.2","117","Change Cipher Spec, Encrypted Handshake Message"
"270","0.991992537","199.232.37.140","192.168.1.118","TLSv1.2","117","Change Cipher Spec, Encrypted Handshake Message"
"271","0.992029275","192.168.1.118","199.232.37.140","TCP","66","39672 → 443 [ACK] Seq=644 Ack=3300 Win=64128 Len=0 TSval=1243673770 TSecr=3164149420"
"272","0.992066525","199.232.37.140","192.168.1.118","TLSv1.2","117","Change Cipher Spec, Encrypted Handshake Message"
"273","0.992084662","192.168.1.118","199.232.37.140","TCP","66","39670 → 443 [ACK] Seq=644 Ack=3418 Win=64128 Len=0 TSval=1243673770 TSecr=3253579099"
"274","0.992100025","199.232.37.140","192.168.1.118","TCP","74","443 → 39680 [SYN, ACK] Seq=0 Ack=1 Win=27040 Len=0 MSS=1364 SACK_PERM=1 TSval=294071711 TSecr=1243673731 WS=512"
"275","0.992143787","192.168.1.118","199.232.37.140","TCP","66","39680 → 443 [ACK] Seq=1 Ack=1 Win=64256 Len=0 TSval=1243673770 TSecr=294071711"
"276","0.992189975","199.232.37.140","192.168.1.118","TLSv1.2","5474","Application Data, Application Data, Application Data, Application Data"
"277","0.992207300","192.168.1.118","199.232.37.140","TCP","66","39654 → 443 [ACK] Seq=858 Ack=22218 Win=56960 Len=0 TSval=1243673770 TSecr=3209251301"
"278","0.992295337","199.232.37.140","192.168.1.118","TLSv1.2","9720","Application Data, Application Data, Application Data, Application Data, Application Data, Application Data, Application Data"
"279","0.992317262","192.168.1.118","199.232.37.140","TCP","66","39654 → 443 [ACK] Seq=858 Ack=31872 Win=47360 Len=0 TSval=1243673771 TSecr=3209251301"
"280","0.993235425","199.232.37.140","192.168.1.118","TCP","74","443 → 39682 [SYN, ACK] Seq=0 Ack=1 Win=27040 Len=0 MSS=1364 SACK_PERM=1 TSval=294764573 TSecr=1243673731 WS=512"
"281","0.993318500","192.168.1.118","199.232.37.140","TCP","66","39682 → 443 [ACK] Seq=1 Ack=1 Win=64256 Len=0 TSval=1243673772 TSecr=294764573"
"282","0.993350162","199.232.37.140","192.168.1.118","TCP","74","443 → 39678 [SYN, ACK] Seq=0 Ack=1 Win=27040 Len=0 MSS=1364 SACK_PERM=1 TSval=2807262268 TSecr=1243673731 WS=512"
"283","0.993374837","192.168.1.118","199.232.37.140","TCP","66","39678 → 443 [ACK] Seq=1 Ack=1 Win=64256 Len=0 TSval=1243673772 TSecr=2807262268"
"284","0.993574225","192.168.1.118","199.232.37.140","TLSv1.2","293","Application Data"
"285","0.993821275","192.168.1.118","199.232.37.140","TLSv1.2","371","Application Data"
"286","0.994168675","192.168.1.118","199.232.37.140","TLSv1.2","375","Application Data"
"287","0.994844537","199.232.37.140","192.168.1.118","TLSv1.2","3043","Application Data, Application Data, Application Data"
"288","0.994882237","199.232.37.140","192.168.1.118","TLSv1.2","117","Change Cipher Spec, Encrypted Handshake Message"
"289","1.000285112","199.232.37.140","192.168.1.118","TLSv1.2","3628","Application Data, Application Data, Application Data, Application Data"
"290","1.000351812","199.232.37.140","192.168.1.118","TLSv1.2","2770","Application Data, Application Data"
"291","1.000475487","199.232.37.140","192.168.1.118","TLSv1.2","10882","Application Data, Application Data, Application Data, Application Data, Application Data, Application Data, Application Data, Application Data"
"292","1.000491012","199.232.37.140","192.168.1.118","TLSv1.2","4122","Application Data, Application Data, Application Data"
"293","1.004325087","199.232.37.140","192.168.1.118","TLSv1.2","5474","Application Data, Application Data, Application Data, Application Data"
"294","1.004483000","199.232.37.140","192.168.1.118","TLSv1.2","4122","Application Data, Application Data, Application Data"
"295","1.004494625","199.232.37.140","192.168.1.118","TLSv1.2","12234","Application Data, Application Data, Application Data, Application Data, Application Data, Application Data, Application Data, Application Data, Application Data"
"296","1.006622025","199.232.37.140","192.168.1.118","TLSv1.2","1418","Application Data [TCP segment of a reassembled PDU]"
"297","1.006649925","199.232.37.140","192.168.1.118","TLSv1.2","4122","Application Data, Application Data, Application Data"
"298","1.006741462","199.232.37.140","192.168.1.118","TLSv1.2","9530","Application Data, Application Data, Application Data, Application Data, Application Data, Application Data, Application Data"
"299","1.012483437","192.168.1.118","199.232.37.140","TLSv1","583","Client Hello"
"300","1.015259512","199.232.37.140","192.168.1.118","TLSv1.2","1418","Application Data"
"301","1.017334550","199.232.37.140","192.168.1.118","TLSv1.2","1845","Application Data, Application Data"
"302","1.017382675","199.232.37.140","192.168.1.118","TLSv1.2","1418","Application Data"
"303","1.017481975","199.232.37.140","192.168.1.118","TLSv1.2","2032","Application Data, Application Data"
"304","1.017507512","199.232.37.140","192.168.1.118","TLSv1.2","1418","Application Data"
"305","1.019196125","199.232.37.140","192.168.1.118","TLSv1.2","12234","Application Data, Application Data, Application Data, Application Data, Application Data, Application Data, Application Data, Application Data, Application Data"
"306","1.036032487","192.168.1.118","199.232.37.140","TLSv1","583","Client Hello"
"307","1.040473000","192.168.1.118","199.232.37.140","TCP","66","39658 → 443 [ACK] Seq=828 Ack=16938 Win=50688 Len=0 TSval=1243673819 TSecr=3164822374"
"308","1.040526350","192.168.1.118","199.232.37.140","TCP","66","39662 → 443 [ACK] Seq=954 Ack=6980 Win=60672 Len=0 TSval=1243673819 TSecr=2833381598"
"309","1.041453537","192.168.1.118","199.232.37.140","TCP","66","39660 → 443 [ACK] Seq=873 Ack=16842 Win=50688 Len=0 TSval=1243673820 TSecr=3933738418"
"310","1.044025825","199.232.37.140","192.168.1.118","TCP","66","443 → 39678 [ACK] Seq=1 Ack=518 Win=28160 Len=0 TSval=2807262284 TSecr=1243673791"
"311","1.045459225","192.168.1.118","199.232.37.140","TCP","66","39666 → 443 [ACK] Seq=919 Ack=16938 Win=50688 Len=0 TSval=1243673824 TSecr=294790932"
"312","1.045508637","192.168.1.118","199.232.37.140","TCP","66","39664 → 443 [ACK] Seq=873 Ack=6299 Win=61184 Len=0 TSval=1243673824 TSecr=293980476"
"313","1.046856387","199.232.37.140","192.168.1.118","TLSv1.2","1418","Server Hello"
"314","1.046914575","192.168.1.118","199.232.37.140","TCP","66","39678 → 443 [ACK] Seq=518 Ack=1353 Win=63104 Len=0 TSval=1243673825 TSecr=2807262284"
"315","1.047433862","192.168.1.118","199.232.37.140","TCP","66","39668 → 443 [ACK] Seq=873 Ack=16842 Win=50688 Len=0 TSval=1243673826 TSecr=2831446568"
"316","1.047458512","192.168.1.118","199.232.37.140","TCP","66","39676 → 443 [ACK] Seq=644 Ack=3418 Win=64128 Len=0 TSval=1243673826 TSecr=2832391124"
"317","1.048992387","199.232.37.140","192.168.1.118","TLSv1.2","1984","Certificate, Server Key Exchange, Server Hello Done"
"318","1.049059275","192.168.1.118","199.232.37.140","TCP","66","39678 → 443 [ACK] Seq=518 Ack=3271 Win=61312 Len=0 TSval=1243673827 TSecr=2807262284"
"319","1.057976837","199.232.37.140","192.168.1.118","TCP","66","443 → 39680 [ACK] Seq=1 Ack=518 Win=28160 Len=0 TSval=294071730 TSecr=1243673814"
"320","1.058442575","192.168.1.118","199.232.37.140","TCP","66","39670 → 443 [ACK] Seq=953 Ack=6549 Win=61056 Len=0 TSval=1243673837 TSecr=3253579110"
"321","1.060203562","199.232.37.140","192.168.1.118","TLSv1.2","1418","Server Hello"
"322","1.060265600","192.168.1.118","199.232.37.140","TCP","66","39680 → 443 [ACK] Seq=518 Ack=1353 Win=63104 Len=0 TSval=1243673838 TSecr=294071730"
"323","1.061461562","192.168.1.118","199.232.37.140","TCP","66","39674 → 443 [ACK] Seq=949 Ack=6736 Win=60928 Len=0 TSval=1243673840 TSecr=3166158246"
"324","1.061879625","199.232.37.140","192.168.1.118","TLSv1.2","1962","Certificate, Server Key Exchange, Server Hello Done"
"325","1.061919612","192.168.1.118","199.232.37.140","TCP","66","39680 → 443 [ACK] Seq=518 Ack=3249 Win=61312 Len=0 TSval=1243673840 TSecr=294071730"
"326","1.062438337","192.168.1.118","199.232.37.140","TCP","66","39672 → 443 [ACK] Seq=871 Ack=16820 Win=50688 Len=0 TSval=1243673841 TSecr=3164149432"
"327","1.068319937","192.168.1.118","199.232.37.140","TLSv1","583","Client Hello"
"328","1.075348312","192.168.1.118","199.232.37.140","TLSv1.2","374","Application Data"
"329","1.082504537","199.232.37.140","192.168.1.118","TLSv1.2","5474","Application Data, Application Data, Application Data, Application Data"
"330","1.082578925","192.168.1.118","199.232.37.140","TCP","66","39668 → 443 [ACK] Seq=873 Ack=22250 Win=45312 Len=0 TSval=1243673861 TSecr=2831446586"
"331","1.082711825","199.232.37.140","192.168.1.118","TLSv1.2","2770","Application Data, Application Data"
"332","1.082731437","192.168.1.118","199.232.37.140","TCP","66","39668 → 443 [ACK] Seq=873 Ack=24954 Win=42624 Len=0 TSval=1243673861 TSecr=2831446586"
"333","1.082742262","199.232.37.140","192.168.1.118","TLSv1.2","9530","Application Data, Application Data, Application Data, Application Data, Application Data, Application Data, Application Data"
"334","1.082757575","199.232.37.140","192.168.1.118","TLSv1.2","1418","Application Data [TCP segment of a reassembled PDU]"
"335","1.082773000","192.168.1.118","199.232.37.140","TCP","66","39658 → 443 [ACK] Seq=828 Ack=18290 Win=49408 Len=0 TSval=1243673861 TSecr=3164822392"
"336","1.089863275","199.232.37.140","192.168.1.118","TLSv1.2","8178","Application Data, Application Data, Application Data, Application Data, Application Data"
"337","1.089912175","199.232.37.140","192.168.1.118","TLSv1.2","5474","Application Data, Application Data, Application Data"
"338","1.089925025","199.232.37.140","192.168.1.118","TLSv1.2","6826","Application Data, Application Data, Application Data, Application Data, Application Data"
"339","1.089959400","192.168.1.118","199.232.37.140","TCP","66","39658 → 443 [ACK] Seq=828 Ack=25050 Win=42752 Len=0 TSval=1243673868 TSecr=3164822392"
"340","1.090756375","199.232.37.140","192.168.1.118","TLSv1.2","1418","Application Data [TCP segment of a reassembled PDU]"
"341","1.090784700","199.232.37.140","192.168.1.118","TLSv1.2","2770","Application Data, Application Data"
"342","1.093108225","199.232.37.140","192.168.1.118","TLSv1.2","1418","Application Data [TCP segment of a reassembled PDU]"
"343","1.093174400","192.168.1.118","199.232.37.140","TCP","66","39666 → 443 [ACK] Seq=919 Ack=18290 Win=49408 Len=0 TSval=1243673871 TSecr=294790950"
"344","1.093206212","199.232.37.140","192.168.1.118","TLSv1.2","4122","Application Data, Application Data"
"345","1.093311162","199.232.37.140","192.168.1.118","TLSv1.2","4122","Application Data, Application Data, Application Data"
"346","1.093328900","192.168.1.118","199.232.37.140","TCP","66","39666 → 443 [ACK] Seq=919 Ack=22346 Win=45440 Len=0 TSval=1243673872 TSecr=294790950"
"347","1.093338875","199.232.37.140","192.168.1.118","TLSv1.2","8178","Application Data, Application Data, Application Data, Application Data, Application Data, Application Data"
"348","1.093351662","199.232.37.140","192.168.1.118","TLSv1.2","4122","Application Data, Application Data, Application Data"
"349","1.095889375","192.168.1.118","199.232.37.140","TLSv1.2","192","Client Key Exchange, Change Cipher Spec, Encrypted Handshake Message"
"350","1.096053862","199.232.37.140","192.168.1.118","TLSv1.2","5474","Application Data, Application Data, Application Data"
"351","1.096873500","199.232.37.140","192.168.1.118","TLSv1.2","8178","Application Data, Application Data, Application Data, Application Data, Application Data, Application Data"
"352","1.096909037","199.232.37.140","192.168.1.118","TLSv1.2","5474","Application Data, Application Data, Application Data, Application Data"
"353","1.096920587","199.232.37.140","192.168.1.118","TLSv1.2","2770","Application Data, Application Data"
"354","1.100840875","199.232.37.140","192.168.1.118","TLSv1.2","2770","Application Data, Application Data"
"355","1.100890787","199.232.37.140","192.168.1.118","TLSv1.2","2770","Application Data, Application Data"
"356","1.100951112","199.232.37.140","192.168.1.118","TLSv1.2","1418","Application Data [TCP segment of a reassembled PDU]"
"357","1.100986200","199.232.37.140","192.168.1.118","TLSv1.2","1725","Application Data, Application Data"
"358","1.101021612","192.168.1.118","199.232.37.140","TCP","66","39672 → 443 [ACK] Seq=871 Ack=18479 Win=49152 Len=0 TSval=1243673879 TSecr=3164149450"
"359","1.101079250","199.232.37.140","192.168.1.118","TLSv1.2","2770","Application Data, Application Data"
"360","1.101102625","199.232.37.140","192.168.1.118","TLSv1.2","2770","Application Data, Application Data"
"361","1.101111312","199.232.37.140","192.168.1.118","TLSv1.2","1418","Application Data [TCP segment of a reassembled PDU]"
"362","1.101127750","199.232.37.140","192.168.1.118","TLSv1.2","1418","Application Data [TCP segment of a reassembled PDU]"
"363","1.101135875","199.232.37.140","192.168.1.118","TLSv1.2","2770","Application Data, Application Data"
"364","1.101143387","199.232.37.140","192.168.1.118","TLSv1.2","1418","Application Data [TCP segment of a reassembled PDU]"
"365","1.102594275","199.232.37.140","192.168.1.118","TLSv1.2","587","Application Data, Application Data"
"366","1.102640150","199.232.37.140","192.168.1.118","TCP","66","443 → 39682 [ACK] Seq=1 Ack=518 Win=28160 Len=0 TSval=294764602 TSecr=1243673846"
"367","1.102673725","199.232.37.140","192.168.1.118","TLSv1.2","1418","Application Data"
"368","1.102708462","192.168.1.118","199.232.37.140","TCP","66","39676 → 443 [ACK] Seq=952 Ack=4770 Win=63104 Len=0 TSval=1243673881 TSecr=2832391151"
"369","1.105379025","199.232.37.140","192.168.1.118","TLSv1.2","2290","Application Data, Application Data, Application Data"
"370","1.105464212","192.168.1.118","199.232.37.140","TCP","66","39676 → 443 [ACK] Seq=952 Ack=6994 Win=60928 Len=0 TSval=1243673884 TSecr=2832391151"
"371","1.105557975","199.232.37.140","192.168.1.118","TLSv1.2","3336","Server Hello, Certificate, Server Key Exchange, Server Hello Done"
"372","1.105577837","192.168.1.118","199.232.37.140","TCP","66","39682 → 443 [ACK] Seq=518 Ack=3271 Win=61056 Len=0 TSval=1243673884 TSecr=294764603"
"373","1.106794700","192.168.1.118","199.232.37.140","TLSv1.2","192","Client Key Exchange, Change Cipher Spec, Encrypted Handshake Message"
"374","1.106922525","199.232.37.140","192.168.1.118","TLSv1.2","2770","Application Data, Application Data"
"375","1.108533850","199.232.37.140","192.168.1.118","TLSv1.2","2770","Application Data, Application Data"
"376","1.109695700","199.232.37.140","192.168.1.118","TLSv1.2","1418","Application Data [TCP segment of a reassembled PDU]"
"377","1.110897212","199.232.37.140","192.168.1.118","TLSv1.2","1418","Application Data [TCP segment of a reassembled PDU]"
"378","1.113086387","192.168.1.118","199.232.37.140","TLSv1.2","192","Client Key Exchange, Change Cipher Spec, Encrypted Handshake Message"
"379","1.116428812","199.232.37.140","192.168.1.118","TLSv1.2","2770","Application Data, Application Data"
"380","1.120354137","199.232.37.140","192.168.1.118","TLSv1.2","2770","Application Data, Application Data"
"381","1.120428037","199.232.37.140","192.168.1.118","TLSv1.2","2770","Application Data, Application Data"
"382","1.120535325","199.232.37.140","192.168.1.118","TLSv1.2","5474","Application Data, Application Data, Application Data, Application Data"
"383","1.121373712","199.232.37.140","192.168.1.118","TLSv1.2","117","Change Cipher Spec, Encrypted Handshake Message"
"384","1.121459925","192.168.1.118","199.232.37.140","TCP","66","39678 → 443 [ACK] Seq=644 Ack=3322 Win=64128 Len=0 TSval=1243673900 TSecr=2807262302"
"385","1.121521525","199.232.37.140","192.168.1.118","TLSv1.2","2770","Application Data, Application Data"
"386","1.123472087","192.168.1.118","199.232.37.140","TCP","66","39660 → 443 [ACK] Seq=873 Ack=43882 Win=23680 Len=0 TSval=1243673902 TSecr=3933738436"
"387","1.123548825","199.232.37.140","192.168.1.118","TLSv1.2","1418","Application Data [TCP segment of a reassembled PDU]"
"388","1.126493012","192.168.1.118","199.232.37.140","TCP","66","39658 → 443 [ACK] Seq=828 Ack=60202 Win=7680 Len=0 TSval=1243673905 TSecr=3164822392"
"389","1.126731062","192.168.1.118","199.232.37.140","TCP","66","39666 → 443 [ACK] Seq=919 Ack=53442 Win=14464 Len=0 TSval=1243673905 TSecr=294790950"
"390","1.126818750","192.168.1.118","199.232.37.140","TCP","66","39668 → 443 [ACK] Seq=873 Ack=41699 Win=25984 Len=0 TSval=1243673905 TSecr=2831446586"
"391","1.127181925","192.168.1.118","199.232.37.140","TLSv1.2","295","Application Data"
"392","1.127941862","199.232.37.140","192.168.1.118","TLSv1.2","1418","Application Data [TCP segment of a reassembled PDU]"
"393","1.129429662","199.232.37.140","192.168.1.118","TLSv1.2","117","Change Cipher Spec, Encrypted Handshake Message"
"394","1.130733250","199.232.37.140","192.168.1.118","TLSv1.2","117","Change Cipher Spec, Encrypted Handshake Message"
"395","1.130801600","192.168.1.118","199.232.37.140","TCP","66","39680 → 443 [ACK] Seq=644 Ack=3300 Win=64128 Len=0 TSval=1243673909 TSecr=294071748"
"396","1.138694575","192.168.1.118","199.232.37.140","TLSv1.2","348","Application Data"
"397","1.138940012","192.168.1.118","199.232.37.140","TLSv1.2","295","Application Data"
"398","1.139120625","192.168.1.118","199.232.37.140","TLSv1.2","371","Application Data"
"399","1.139216375","192.168.1.118","199.232.37.140","TLSv1.2","341","Application Data"
"400","1.139305737","192.168.1.118","199.232.37.140","TLSv1.2","295","Application Data"
"401","1.145656150","199.232.37.140","192.168.1.118","TLSv1.2","1418","Application Data [TCP segment of a reassembled PDU]"
"402","1.152015312","199.232.37.140","192.168.1.118","TLSv1.2","2770","Application Data, Application Data"
"403","1.152105637","199.232.37.140","192.168.1.118","TLSv1.2","6826","Application Data, Application Data, Application Data, Application Data, Application Data"
"404","1.155185862","199.232.37.140","192.168.1.118","TLSv1.2","3568","Application Data, Application Data, Application Data"
"405","1.160418837","192.168.1.118","199.232.37.140","TCP","66","39660 → 443 [ACK] Seq=873 Ack=58200 Win=9472 Len=0 TSval=1243673939 TSecr=3933738455"
"406","1.161133812","199.232.37.140","192.168.1.118","TLSv1.2","1418","Application Data [TCP segment of a reassembled PDU]"
"407","1.164890937","199.232.37.140","192.168.1.118","TLSv1.2","4122","Application Data, Application Data, Application Data"
"408","1.164942512","199.232.37.140","192.168.1.118","TLSv1.2","1418","Application Data [TCP segment of a reassembled PDU]"
"409","1.164975612","192.168.1.118","199.232.37.140","TCP","66","39666 → 443 [ACK] Seq=919 Ack=56146 Win=11776 Len=0 TSval=1243673943 TSecr=294790961"
"410","1.165112575","199.232.37.140","192.168.1.118","TLSv1.2","1418","Application Data [TCP segment of a reassembled PDU]"
"411","1.165123000","199.232.37.140","192.168.1.118","TLSv1.2","13586","Application Data, Application Data, Application Data, Application Data, Application Data, Application Data, Application Data, Application Data, Application Data, Application Data"
"412","1.165143887","199.232.37.140","192.168.1.118","TLSv1.2","1418","Application Data"
"413","1.168529387","199.232.37.140","192.168.1.118","TLSv1.2","3921","Application Data, Application Data, Application Data, Application Data"
"414","1.168585512","199.232.37.140","192.168.1.118","TLSv1.2","2338","[TCP Window Full] , Application Data [TCP segment of a reassembled PDU]"
"415","1.168686787","199.232.37.140","192.168.1.118","TLSv1.2","10474","Application Data, Application Data, Application Data, Application Data, Application Data, Application Data, Application Data"
"416","1.172758112","192.168.1.118","199.232.37.140","TCP","66","[TCP ZeroWindow] 39658 → 443 [ACK] Seq=828 Ack=67882 Win=0 Len=0 TSval=1243673951 TSecr=3164822415"
"417","1.172887537","192.168.1.118","199.232.37.140","TCP","66","39666 → 443 [ACK] Seq=919 Ack=67906 Win=128 Len=0 TSval=1243673951 TSecr=294790973"
"418","1.172889837","199.232.37.140","192.168.1.118","TLSv1.2","1418","Application Data"
"419","1.172966750","192.168.1.118","199.232.37.140","TCP","66","39674 → 443 [ACK] Seq=1254 Ack=8088 Win=63104 Len=0 TSval=1243673951 TSecr=3166158286"
"420","1.172998412","192.168.1.118","199.232.37.140","TCP","66","39678 → 443 [ACK] Seq=873 Ack=16842 Win=50688 Len=0 TSval=1243673951 TSecr=2807262312"
"421","1.173138200","192.168.1.118","199.232.37.140","TCP","66","39680 → 443 [ACK] Seq=926 Ack=8507 Win=59008 Len=0 TSval=1243673951 TSecr=294071755"
"422","1.176571675","199.232.37.140","192.168.1.118","TLSv1.2","2179","Application Data, Application Data, Application Data"
"423","1.176640112","192.168.1.118","199.232.37.140","TCP","66","39674 → 443 [ACK] Seq=1254 Ack=10201 Win=61056 Len=0 TSval=1243673955 TSecr=3166158286"
"424","1.176705237","199.232.37.140","192.168.1.118","TLSv1.2","6826","Application Data, Application Data, Application Data, Application Data, Application Data"
"425","1.178965762","199.232.37.140","192.168.1.118","TLSv1.2","5474","Application Data, Application Data, Application Data, Application Data"
"426","1.179112812","199.232.37.140","192.168.1.118","TLSv1.2","1418","Application Data [TCP segment of a reassembled PDU]"
"427","1.179122525","199.232.37.140","192.168.1.118","TLSv1.2","13586","Application Data, Application Data, Application Data, Application Data, Application Data, Application Data, Application Data, Application Data, Application Data, Application Data"
"428","1.179177550","192.168.1.118","199.232.37.140","TCP","66","39664 → 443 [ACK] Seq=1102 Ack=19819 Win=50688 Len=0 TSval=1243673957 TSecr=293980521"
"429","1.179207112","199.232.37.140","192.168.1.118","TLSv1.2","1418","Application Data"
"430","1.179226912","192.168.1.118","199.232.37.140","TCP","66","39662 → 443 [ACK] Seq=1229 Ack=8332 Win=63104 Len=0 TSval=1243673957 TSecr=2833381643"
"431","1.182526912","199.232.37.140","192.168.1.118","TLSv1.2","8178","Application Data, Application Data, Application Data, Application Data, Application Data, Application Data"
"432","1.182602837","192.168.1.118","199.232.37.140","TCP","66","39662 → 443 [ACK] Seq=1229 Ack=16444 Win=55040 Len=0 TSval=1243673961 TSecr=2833381643"
"433","1.182700587","199.232.37.140","192.168.1.118","TLSv1.2","4122","Application Data, Application Data, Application Data"
"434","1.182716912","192.168.1.118","199.232.37.140","TCP","66","39662 → 443 [ACK] Seq=1229 Ack=20500 Win=51072 Len=0 TSval=1243673961 TSecr=2833381643"
"435","1.186206162","192.168.1.118","199.232.37.140","TCP","66","39682 → 443 [ACK] Seq=873 Ack=16842 Win=50688 Len=0 TSval=1243673964 TSecr=294764620"
"436","1.197699412","192.168.1.118","199.232.37.140","TCP","66","[TCP Window Update] 39666 → 443 [ACK] Seq=919 Ack=67906 Win=12288 Len=0 TSval=1243673976 TSecr=294790973"
"437","1.197931962","199.232.37.140","192.168.1.118","TLSv1.2","1418","Application Data [TCP segment of a reassembled PDU]"
"438","1.198004550","192.168.1.118","199.232.37.140","TCP","66","39662 → 443 [ACK] Seq=1229 Ack=21852 Win=49792 Len=0 TSval=1243673976 TSecr=2833381649"
"439","1.200636950","199.232.37.140","192.168.1.118","TLSv1.2","4122","Application Data, Application Data, Application Data"
"440","1.200705800","192.168.1.118","199.232.37.140","TCP","66","39662 → 443 [ACK] Seq=1229 Ack=25908 Win=45824 Len=0 TSval=1243673979 TSecr=2833381649"
"441","1.200737512","199.232.37.140","192.168.1.118","TLSv1.2","2770","Application Data, Application Data"
"442","1.200755287","192.168.1.118","199.232.37.140","TCP","66","39664 → 443 [ACK] Seq=1102 Ack=22523 Win=48000 Len=0 TSval=1243673979 TSecr=293980527"
"443","1.204516912","199.232.37.140","192.168.1.118","TLSv1.2","5474","Application Data, Application Data, Application Data"
"444","1.204650425","199.232.37.140","192.168.1.118","TLSv1.2","2181","Application Data, Application Data"
"445","1.204685137","192.168.1.118","199.232.37.140","TCP","66","39664 → 443 [ACK] Seq=1102 Ack=24638 Win=45952 Len=0 TSval=1243673983 TSecr=293980527"
"446","1.204762287","199.232.37.140","192.168.1.118","TLSv1.2","13586","Application Data, Application Data, Application Data, Application Data, Application Data, Application Data, Application Data, Application Data, Application Data, Application Data"
"447","1.206238662","192.168.1.118","199.232.37.140","TCP","66","39662 → 443 [ACK] Seq=1229 Ack=44836 Win=27008 Len=0 TSval=1243673984 TSecr=2833381649"
"448","1.206514100","192.168.1.118","199.232.37.140","TCP","66","[TCP Window Update] 39658 → 443 [ACK] Seq=828 Ack=67882 Win=22912 Len=0 TSval=1243673985 TSecr=3164822415"
"449","1.216391800","199.232.37.140","192.168.1.118","TLSv1.2","2770","Application Data, Application Data"
"450","1.216475237","192.168.1.118","199.232.37.140","TCP","66","39662 → 443 [ACK] Seq=1229 Ack=47540 Win=32384 Len=0 TSval=1243673995 TSecr=2833381649"
"451","1.216594962","199.232.37.140","192.168.1.118","TLSv1.2","8817","Application Data, Application Data, Application Data, Application Data, Application Data, Application Data, Application Data"
"452","1.216616987","192.168.1.118","199.232.37.140","TCP","66","39682 → 443 [ACK] Seq=873 Ack=25593 Win=50816 Len=0 TSval=1243673995 TSecr=294764628"
"453","1.216639062","199.232.37.140","192.168.1.118","TLSv1.2","2311","Application Data, Application Data"
"454","1.216655562","192.168.1.118","199.232.37.140","TCP","66","39678 → 443 [ACK] Seq=873 Ack=19087 Win=61056 Len=0 TSval=1243673995 TSecr=2807262324"
"455","1.218801775","199.232.37.140","192.168.1.118","TLSv1.2","2770","Application Data, Application Data"
"456","1.220359162","192.168.1.118","199.232.37.140","TCP","66","39662 → 443 [ACK] Seq=1229 Ack=50244 Win=64128 Len=0 TSval=1243673999 TSecr=2833381654"
"457","1.220521112","199.232.37.140","192.168.1.118","TLSv1.2","1418","Application Data [TCP segment of a reassembled PDU]"
"458","1.220551525","192.168.1.118","199.232.37.140","TCP","66","39662 → 443 [ACK] Seq=1229 Ack=51596 Win=66816 Len=0 TSval=1243673999 TSecr=2833381654"
"459","1.220582300","199.232.37.140","192.168.1.118","TLSv1.2","4122","Application Data, Application Data, Application Data"
"460","1.220597787","192.168.1.118","199.232.37.140","TCP","66","39662 → 443 [ACK] Seq=1229 Ack=55652 Win=68736 Len=0 TSval=1243673999 TSecr=2833381654"
"461","1.221480825","199.232.37.140","192.168.1.118","TLSv1.2","14938","Application Data, Application Data, Application Data, Application Data, Application Data, Application Data, Application Data, Application Data, Application Data, Application Data"
"462","1.221513775","199.232.37.140","192.168.1.118","TLSv1.2","1418","Application Data [TCP segment of a reassembled PDU]"
"463","1.221693300","192.168.1.118","199.232.37.140","TCP","66","39662 → 443 [ACK] Seq=1229 Ack=70524 Win=53888 Len=0 TSval=1243674000 TSecr=2833381654"
"464","1.224983287","199.232.37.140","192.168.1.118","TLSv1.2","11002","[TCP Window Full] , Application Data, Application Data, Application Data, Application Data, Application Data, Application Data, Application Data, Application Data"
"465","1.225526000","192.168.1.118","199.232.37.140","TCP","66","[TCP ZeroWindow] 39666 → 443 [ACK] Seq=919 Ack=80194 Win=0 Len=0 TSval=1243674004 TSecr=294790987"
"466","1.225629475","192.168.1.118","199.232.37.140","TCP","66","[TCP Window Update] 39668 → 443 [ACK] Seq=873 Ack=41699 Win=64128 Len=0 TSval=1243674004 TSecr=2831446586"
"467","1.226013162","192.168.1.118","199.232.37.140","TCP","66","[TCP Window Update] 39666 → 443 [ACK] Seq=919 Ack=80194 Win=24576 Len=0 TSval=1243674004 TSecr=294790987"
"468","1.228538175","199.232.37.140","192.168.1.118","TLSv1.2","1418","Application Data [TCP segment of a reassembled PDU]"
"469","1.228966575","192.168.1.118","199.232.37.140","TCP","66","39658 → 443 [ACK] Seq=828 Ack=69234 Win=64128 Len=0 TSval=1243674007 TSecr=3164822432"
"470","1.229079350","192.168.1.118","199.232.37.140","TCP","66","[TCP Window Update] 39660 → 443 [ACK] Seq=873 Ack=58200 Win=64128 Len=0 TSval=1243674007 TSecr=3933738455"
"471","1.229926700","199.232.37.140","192.168.1.118","TLSv1.2","5474","Application Data, Application Data, Application Data, Application Data"
"472","1.229979737","192.168.1.118","199.232.37.140","TCP","66","39658 → 443 [ACK] Seq=828 Ack=74642 Win=75008 Len=0 TSval=1243674008 TSecr=3164822432"
"473","1.232206487","199.232.37.140","192.168.1.118","TLSv1.2","2770","Application Data, Application Data"
"474","1.232267412","192.168.1.118","199.232.37.140","TCP","66","39658 → 443 [ACK] Seq=828 Ack=77346 Win=80384 Len=0 TSval=1243674010 TSecr=3164822432"
"475","1.234029075","199.232.37.140","192.168.1.118","TLSv1.2","4122","Application Data, Application Data, Application Data"
"476","1.234089350","192.168.1.118","199.232.37.140","TCP","66","39658 → 443 [ACK] Seq=828 Ack=81402 Win=88448 Len=0 TSval=1243674012 TSecr=3164822432"
"477","1.234121475","199.232.37.140","192.168.1.118","TLSv1.2","1418","Application Data [TCP segment of a reassembled PDU]"
"478","1.234135837","192.168.1.118","199.232.37.140","TCP","66","39658 → 443 [ACK] Seq=828 Ack=82754 Win=91136 Len=0 TSval=1243674012 TSecr=3164822433"
"479","1.234170337","199.232.37.140","192.168.1.118","TLSv1.2","1418","Application Data [TCP segment of a reassembled PDU]"
"480","1.234185837","192.168.1.118","199.232.37.140","TCP","66","39658 → 443 [ACK] Seq=828 Ack=84106 Win=93952 Len=0 TSval=1243674012 TSecr=3164822433"
"481","1.235843375","199.232.37.140","192.168.1.118","TLSv1.2","1850","Application Data [TCP segment of a reassembled PDU]"
"482","1.235906662","192.168.1.118","199.232.37.140","TCP","66","39658 → 443 [ACK] Seq=828 Ack=85890 Win=97408 Len=0 TSval=1243674014 TSecr=3164822433"
"483","1.238359112","199.232.37.140","192.168.1.118","TLSv1.2","2770","Application Data, Application Data"
"484","1.238443812","192.168.1.118","199.232.37.140","TCP","66","39658 → 443 [ACK] Seq=828 Ack=88594 Win=102912 Len=0 TSval=1243674017 TSecr=3164822433"
"485","1.238482787","199.232.37.140","192.168.1.118","TLSv1.2","2266","Application Data, Application Data"
"486","1.238499037","192.168.1.118","199.232.37.140","TCP","66","39658 → 443 [ACK] Seq=828 Ack=90794 Win=107264 Len=0 TSval=1243674017 TSecr=3164822434"
"487","1.239789175","199.232.37.140","192.168.1.118","TLSv1.2","1418","Application Data [TCP segment of a reassembled PDU]"
"488","1.239849812","192.168.1.118","199.232.37.140","TCP","66","39662 → 443 [ACK] Seq=1229 Ack=71876 Win=71424 Len=0 TSval=1243674018 TSecr=2833381659"
"489","1.241589662","199.232.37.140","192.168.1.118","TLSv1.2","4160","Application Data, Application Data, Application Data, Application Data"
"490","1.243994612","192.168.1.118","199.232.37.140","TCP","66","39662 → 443 [ACK] Seq=1229 Ack=75970 Win=70016 Len=0 TSval=1243674022 TSecr=2833381659"
"491","1.245953637","199.232.37.140","192.168.1.118","TLSv1.2","1418","Application Data [TCP segment of a reassembled PDU]"
"492","1.246016687","192.168.1.118","199.232.37.140","TCP","66","39658 → 443 [ACK] Seq=828 Ack=92146 Win=109952 Len=0 TSval=1243674024 TSecr=3164822437"
"493","1.248315487","199.232.37.140","192.168.1.118","TLSv1.2","4122","Application Data, Application Data"
"494","1.248382637","192.168.1.118","199.232.37.140","TCP","66","39658 → 443 [ACK] Seq=828 Ack=96202 Win=118144 Len=0 TSval=1243674027 TSecr=3164822437"
"495","1.248434462","199.232.37.140","192.168.1.118","TLSv1.2","4122","Application Data, Application Data, Application Data"
"496","1.248456762","192.168.1.118","199.232.37.140","TCP","66","39666 → 443 [ACK] Seq=919 Ack=84250 Win=39296 Len=0 TSval=1243674027 TSecr=294790994"
"497","1.253053612","199.232.37.140","192.168.1.118","TLSv1.2","1418","Application Data [TCP segment of a reassembled PDU]"
"498","1.253119612","192.168.1.118","199.232.37.140","TCP","66","39666 → 443 [ACK] Seq=919 Ack=85602 Win=66816 Len=0 TSval=1243674031 TSecr=294790994"
"499","1.253155900","199.232.37.140","192.168.1.118","TLSv1.2","4122","Application Data, Application Data, Application Data"
"500","1.253173887","192.168.1.118","199.232.37.140","TCP","66","39658 → 443 [ACK] Seq=828 Ack=100258 Win=126208 Len=0 TSval=1243674031 TSecr=3164822437"
"501","1.253214887","199.232.37.140","192.168.1.118","TCP","354","443 → 39666 [ACK] Seq=85602 Ack=919 Win=29184 Len=288 TSval=294790995 TSecr=1243674004 [TCP segment of a reassembled PDU]"
"502","1.253229300","192.168.1.118","199.232.37.140","TCP","66","39666 → 443 [ACK] Seq=919 Ack=85890 Win=69504 Len=0 TSval=1243674031 TSecr=294790995"
"503","1.253248250","199.232.37.140","192.168.1.118","TLSv1.2","1418","Application Data [TCP segment of a reassembled PDU]"
"504","1.253262112","192.168.1.118","199.232.37.140","TCP","66","39658 → 443 [ACK] Seq=828 Ack=101610 Win=128896 Len=0 TSval=1243674031 TSecr=3164822437"
"505","1.253271150","199.232.37.140","192.168.1.118","TLSv1.2","2770","Application Data, Application Data"
"506","1.253285450","192.168.1.118","199.232.37.140","TCP","66","39666 → 443 [ACK] Seq=919 Ack=88594 Win=75008 Len=0 TSval=1243674032 TSecr=294790995"
"507","1.265261950","199.232.37.140","192.168.1.118","TLSv1.2","2770","Application Data, Application Data"
"508","1.265327137","192.168.1.118","199.232.37.140","TCP","66","39658 → 443 [ACK] Seq=828 Ack=104314 Win=134272 Len=0 TSval=1243674044 TSecr=3164822437"
"509","1.265364237","199.232.37.140","192.168.1.118","TLSv1.2","2770","Application Data, Application Data"
"510","1.265380987","192.168.1.118","199.232.37.140","TCP","66","39666 → 443 [ACK] Seq=919 Ack=91298 Win=80384 Len=0 TSval=1243674044 TSecr=294790995"
"511","1.265478175","199.232.37.140","192.168.1.118","TLSv1.2","5474","Application Data, Application Data, Application Data, Application Data"
"512","1.265494450","192.168.1.118","199.232.37.140","TCP","66","39658 → 443 [ACK] Seq=828 Ack=109722 Win=142848 Len=0 TSval=1243674044 TSecr=3164822437"
"513","1.265525175","199.232.37.140","192.168.1.118","TLSv1.2","5474","Application Data, Application Data, Application Data, Application Data"
"514","1.265540975","192.168.1.118","199.232.37.140","TCP","66","39666 → 443 [ACK] Seq=919 Ack=96706 Win=91136 Len=0 TSval=1243674044 TSecr=294790995"
"515","1.265550050","199.232.37.140","192.168.1.118","TLSv1.2","5474","Application Data, Application Data, Application Data, Application Data"
"516","1.268684137","192.168.1.118","199.232.37.140","TCP","66","39658 → 443 [ACK] Seq=828 Ack=115130 Win=137472 Len=0 TSval=1243674047 TSecr=3164822438"
"517","1.269195887","199.232.37.140","192.168.1.118","TLSv1.2","1922","Application Data [TCP segment of a reassembled PDU]"
"518","1.269272625","199.232.37.140","192.168.1.118","TLSv1.2","5474","Application Data, Application Data, Application Data, Application Data"
"519","1.269304387","192.168.1.118","199.232.37.140","TCP","66","39666 → 443 [ACK] Seq=919 Ack=102114 Win=102016 Len=0 TSval=1243674048 TSecr=294790996"
"520","1.269325125","199.232.37.140","192.168.1.118","TLSv1.2","2770","Application Data, Application Data"
"521","1.269463512","199.232.37.140","192.168.1.118","TLSv1.2","5474","Application Data, Application Data, Application Data, Application Data"
"522","1.269474337","199.232.37.140","192.168.1.118","TLSv1.2","1418","Application Data [TCP segment of a reassembled PDU]"
"523","1.269488525","192.168.1.118","199.232.37.140","TCP","66","39666 → 443 [ACK] Seq=919 Ack=103466 Win=104704 Len=0 TSval=1243674048 TSecr=294790997"
"524","1.272196762","192.168.1.118","199.232.37.140","TCP","66","39658 → 443 [ACK] Seq=828 Ack=125098 Win=127616 Len=0 TSval=1243674050 TSecr=3164822438"
"525","1.273519287","199.232.37.140","192.168.1.118","TCP","1370","443 → 39666 [ACK] Seq=103466 Ack=919 Win=29184 Len=1304 TSval=294790997 TSecr=1243674004 [TCP segment of a reassembled PDU]"
"526","1.273578012","192.168.1.118","199.232.37.140","TCP","66","39666 → 443 [ACK] Seq=919 Ack=104770 Win=107392 Len=0 TSval=1243674052 TSecr=294790997"
"527","1.273607450","199.232.37.140","192.168.1.118","TLSv1.2","1418","Application Data [TCP segment of a reassembled PDU]"
"528","1.273656500","199.232.37.140","192.168.1.118","TLSv1.2","2215","Application Data, Application Data, Application Data"
"529","1.273698462","199.232.37.140","192.168.1.118","TLSv1.2","5474","Application Data, Application Data, Application Data, Application Data"
"530","1.273714462","192.168.1.118","199.232.37.140","TCP","66","39666 → 443 [ACK] Seq=919 Ack=110178 Win=118272 Len=0 TSval=1243674052 TSecr=294791000"
"531","1.275560250","192.168.1.118","199.232.37.140","TCP","66","39658 → 443 [ACK] Seq=828 Ack=128599 Win=124160 Len=0 TSval=1243674054 TSecr=3164822439"
"532","1.280696137","199.232.37.140","192.168.1.118","TLSv1.2","5474","Application Data, Application Data, Application Data, Application Data"
"533","1.280762075","192.168.1.118","199.232.37.140","TCP","66","39666 → 443 [ACK] Seq=919 Ack=115586 Win=129024 Len=0 TSval=1243674059 TSecr=294791000"
"534","1.280840825","199.232.37.140","192.168.1.118","TLSv1.2","1466","Application Data [TCP segment of a reassembled PDU]"
"535","1.280856637","192.168.1.118","199.232.37.140","TCP","66","39666 → 443 [ACK] Seq=919 Ack=116986 Win=131840 Len=0 TSval=1243674059 TSecr=294791001"
"536","1.280900587","199.232.37.140","192.168.1.118","TLSv1.2","5474","Application Data, Application Data, Application Data, Application Data"
"537","1.280915850","192.168.1.118","199.232.37.140","TCP","66","39666 → 443 [ACK] Seq=919 Ack=122394 Win=142720 Len=0 TSval=1243674059 TSecr=294791001"
"538","1.280936937","199.232.37.140","192.168.1.118","TLSv1.2","2770","Application Data, Application Data"
"539","1.280956300","192.168.1.118","199.232.37.140","TCP","66","39666 → 443 [ACK] Seq=919 Ack=125098 Win=148096 Len=0 TSval=1243674059 TSecr=294791002"
"540","1.280975050","199.232.37.140","192.168.1.118","TLSv1.2","2770","Application Data, Application Data"
"541","1.280989987","192.168.1.118","199.232.37.140","TCP","66","39666 → 443 [ACK] Seq=919 Ack=127802 Win=153472 Len=0 TSval=1243674059 TSecr=294791002"
"542","1.282783137","199.232.37.140","192.168.1.118","TLSv1.2","2770","Application Data, Application Data"
"543","1.282850650","192.168.1.118","199.232.37.140","TCP","66","39666 → 443 [ACK] Seq=919 Ack=130506 Win=158848 Len=0 TSval=1243674061 TSecr=294791002"
"544","1.282886075","199.232.37.140","192.168.1.118","TLSv1.2","1418","Application Data [TCP segment of a reassembled PDU]"
"545","1.282900425","192.168.1.118","199.232.37.140","TCP","66","39666 → 443 [ACK] Seq=919 Ack=131858 Win=161536 Len=0 TSval=1243674061 TSecr=294791003"
"546","1.284193587","199.232.37.140","192.168.1.118","TLSv1.2","1418","Application Data [TCP segment of a reassembled PDU]"
"547","1.284256362","192.168.1.118","199.232.37.140","TCP","66","39666 → 443 [ACK] Seq=919 Ack=133210 Win=164352 Len=0 TSval=1243674062 TSecr=294791003"
"548","1.288709200","199.232.37.140","192.168.1.118","TLSv1.2","5474","Application Data, Application Data, Application Data, Application Data"
"549","1.288776837","192.168.1.118","199.232.37.140","TCP","66","39666 → 443 [ACK] Seq=919 Ack=138618 Win=175104 Len=0 TSval=1243674067 TSecr=294791003"
"550","1.294046275","199.232.37.140","192.168.1.118","TLSv1.2","5474","Application Data, Application Data, Application Data, Application Data"
"551","1.294115112","192.168.1.118","199.232.37.140","TCP","66","39666 → 443 [ACK] Seq=919 Ack=144026 Win=185984 Len=0 TSval=1243674072 TSecr=294791004"
"552","1.294205712","199.232.37.140","192.168.1.118","TLSv1.2","2770","Application Data [TCP segment of a reassembled PDU]"
"553","1.294222350","192.168.1.118","199.232.37.140","TCP","66","39666 → 443 [ACK] Seq=919 Ack=146730 Win=191360 Len=0 TSval=1243674072 TSecr=294791004"
"554","1.294265862","199.232.37.140","192.168.1.118","TLSv1.2","5474","Application Data, Application Data, Application Data, Application Data"
"555","1.294288100","192.168.1.118","199.232.37.140","TCP","66","39666 → 443 [ACK] Seq=919 Ack=152138 Win=202112 Len=0 TSval=1243674073 TSecr=294791005"
"556","1.296293900","199.232.37.140","192.168.1.118","TLSv1.2","1418","Application Data [TCP segment of a reassembled PDU]"
"557","1.296356125","192.168.1.118","199.232.37.140","TCP","66","39666 → 443 [ACK] Seq=919 Ack=153490 Win=204800 Len=0 TSval=1243674075 TSecr=294791005"
"558","1.296423625","199.232.37.140","192.168.1.118","TLSv1.2","4122","Application Data, Application Data, Application Data"
"559","1.296444050","192.168.1.118","199.232.37.140","TCP","66","39666 → 443 [ACK] Seq=919 Ack=157546 Win=212992 Len=0 TSval=1243674075 TSecr=294791005"
"560","1.301436862","199.232.37.140","192.168.1.118","TLSv1.2","1418","Application Data [TCP segment of a reassembled PDU]"
"561","1.301509575","192.168.1.118","199.232.37.140","TCP","66","39666 → 443 [ACK] Seq=919 Ack=158898 Win=215680 Len=0 TSval=1243674080 TSecr=294791005"
"562","1.301561475","199.232.37.140","192.168.1.118","TLSv1.2","4122","Application Data, Application Data, Application Data"
"563","1.301576875","192.168.1.118","199.232.37.140","TCP","66","39666 → 443 [ACK] Seq=919 Ack=162954 Win=223744 Len=0 TSval=1243674080 TSecr=294791006"
"564","1.301642350","199.232.37.140","192.168.1.118","TLSv1.2","6826","Application Data, Application Data, Application Data, Application Data, Application Data"
"565","1.301664112","192.168.1.118","199.232.37.140","TCP","66","39666 → 443 [ACK] Seq=919 Ack=169714 Win=237312 Len=0 TSval=1243674080 TSecr=294791006"
"566","1.301702937","199.232.37.140","192.168.1.118","TLSv1.2","9530","Application Data, Application Data, Application Data, Application Data, Application Data, Application Data, Application Data"
"567","1.301721600","192.168.1.118","199.232.37.140","TCP","66","39666 → 443 [ACK] Seq=919 Ack=179178 Win=256256 Len=0 TSval=1243674080 TSecr=294791007"
"568","1.307302900","199.232.37.140","192.168.1.118","TLSv1.2","5474","Application Data, Application Data, Application Data"
"569","1.307373525","192.168.1.118","199.232.37.140","TCP","66","39666 → 443 [ACK] Seq=919 Ack=184586 Win=267008 Len=0 TSval=1243674086 TSecr=294791007"
"570","1.307507925","199.232.37.140","192.168.1.118","TLSv1.2","6826","Application Data, Application Data, Application Data, Application Data, Application Data"
"571","1.307528250","192.168.1.118","199.232.37.140","TCP","66","39666 → 443 [ACK] Seq=919 Ack=191346 Win=273536 Len=0 TSval=1243674086 TSecr=294791008"
"572","1.311883900","199.232.37.140","192.168.1.118","TLSv1.2","1418","Application Data [TCP segment of a reassembled PDU]"
"573","1.311944037","199.232.37.140","192.168.1.118","TLSv1.2","2770","Application Data, Application Data"
"574","1.311954737","199.232.37.140","192.168.1.118","TLSv1.2","1418","Application Data [TCP segment of a reassembled PDU]"
"575","1.312076662","199.232.37.140","192.168.1.118","TLSv1.2","16290","Application Data, Application Data, Application Data, Application Data, Application Data, Application Data, Application Data, Application Data, Application Data, Application Data, Application Data, Application Data"
"576","1.314332400","199.232.37.140","192.168.1.118","TLSv1.2","5474","Application Data, Application Data, Application Data, Application Data"
"577","1.314466675","199.232.37.140","192.168.1.118","TLSv1.2","8178","Application Data, Application Data, Application Data, Application Data, Application Data"
"578","1.314497500","199.232.37.140","192.168.1.118","TLSv1.2","2770","Application Data, Application Data"
"579","1.316237450","192.168.1.118","199.232.37.140","TCP","66","39666 → 443 [ACK] Seq=919 Ack=229202 Win=235776 Len=0 TSval=1243674094 TSecr=294791008"
"580","1.316388725","199.232.37.140","192.168.1.118","TCP","5474","443 → 39666 [ACK] Seq=229202 Ack=919 Win=29184 Len=5408 TSval=294791011 TSecr=1243674062 [TCP segment of a reassembled PDU]"
"581","1.316516275","199.232.37.140","192.168.1.118","TCP","6826","443 → 39666 [ACK] Seq=234610 Ack=919 Win=29184 Len=6760 TSval=294791011 TSecr=1243674062 [TCP segment of a reassembled PDU]"
"582","1.318910300","192.168.1.118","199.232.37.140","TCP","66","39666 → 443 [ACK] Seq=919 Ack=241370 Win=223616 Len=0 TSval=1243674097 TSecr=294791011"
"583","1.324230250","199.232.37.140","192.168.1.118","TLSv1.2","2770","Application Data [TCP segment of a reassembled PDU]"
"584","1.324285087","199.232.37.140","192.168.1.118","TCP","2770","443 → 39666 [ACK] Seq=244074 Ack=919 Win=29184 Len=2704 TSval=294791012 TSecr=1243674080 [TCP segment of a reassembled PDU]"
"585","1.324429625","199.232.37.140","192.168.1.118","TLSv1.2","16290","Application Data [TCP segment of a reassembled PDU]"
"586","1.326450837","192.168.1.118","199.232.37.140","TCP","66","39666 → 443 [ACK] Seq=919 Ack=263002 Win=201984 Len=0 TSval=1243674105 TSecr=294791011"
"587","1.330924325","199.232.37.140","192.168.1.118","TLSv1.2","20346","Application Data [TCP segment of a reassembled PDU]"
"588","1.330979975","199.232.37.140","192.168.1.118","TCP","1418","443 → 39666 [ACK] Seq=283282 Ack=919 Win=29184 Len=1352 TSval=294791014 TSecr=1243674080 [TCP segment of a reassembled PDU]"
"589","1.333353500","199.232.37.140","192.168.1.118","TCP","2770","443 → 39666 [ACK] Seq=284634 Ack=919 Win=29184 Len=2704 TSval=294791014 TSecr=1243674080 [TCP segment of a reassembled PDU]"
"590","1.333428550","199.232.37.140","192.168.1.118","TCP","2770","443 → 39666 [ACK] Seq=287338 Ack=919 Win=29184 Len=2704 TSval=294791014 TSecr=1243674086 [TCP segment of a reassembled PDU]"
"591","1.333514725","199.232.37.140","192.168.1.118","TLSv1.2","16290","Application Data [TCP segment of a reassembled PDU]"
"592","1.335308650","192.168.1.118","199.232.37.140","TCP","66","39666 → 443 [ACK] Seq=919 Ack=306266 Win=158720 Len=0 TSval=1243674113 TSecr=294791013"
"593","1.335517937","199.232.37.140","192.168.1.118","TLSv1.2","8178","Application Data [TCP segment of a reassembled PDU]"
"594","1.335770462","199.232.37.140","192.168.1.118","TCP","2770","443 → 39666 [ACK] Seq=314378 Ack=919 Win=29184 Len=2704 TSval=294791014 TSecr=1243674086 [TCP segment of a reassembled PDU]"
"595","1.335820837","199.232.37.140","192.168.1.118","TLSv1.2","10882","Application Data [TCP segment of a reassembled PDU]"
"596","1.338345125","192.168.1.118","199.232.37.140","TCP","66","39666 → 443 [ACK] Seq=919 Ack=327898 Win=137088 Len=0 TSval=1243674117 TSecr=294791014"
"597","1.342068462","199.232.37.140","192.168.1.118","TCP","5474","443 → 39666 [ACK] Seq=327898 Ack=919 Win=29184 Len=5408 TSval=294791015 TSecr=1243674086 [TCP segment of a reassembled PDU]"
"598","1.342175675","199.232.37.140","192.168.1.118","TLSv1.2","16290","Application Data [TCP segment of a reassembled PDU]"
"599","1.344513150","199.232.37.140","192.168.1.118","TCP","8178","443 → 39666 [ACK] Seq=349530 Ack=919 Win=29184 Len=8112 TSval=294791016 TSecr=1243674086 [TCP segment of a reassembled PDU]"
"600","1.344634550","199.232.37.140","192.168.1.118","TLSv1.2","2770","Application Data [TCP segment of a reassembled PDU]"
"601","1.344661737","199.232.37.140","192.168.1.118","TLSv1.2","5307","Application Data"
"602","1.346144487","192.168.1.118","199.232.37.140","TCP","66","39666 → 443 [ACK] Seq=919 Ack=365587 Win=99456 Len=0 TSval=1243674124 TSecr=294791015"
"603","1.370335450","fe80::1cc7:6d9a:a312:7e8f","ff02::fb","MDNS","547","Standard query 0x0000 PTR _googlecast._tcp.local, "QM" question PTR _homekit._tcp.local, "QM" question PTR _uscan._tcp.local, "QM" question PTR _ptp._tcp.local, "QM" question PTR _ippusb._tcp.local, "QM" question PTR _scanner._tcp.local, "QM" question PTR _ipp._tcp.local, "QM" question PTR _pdl-datastream._tcp.local, "QM" question PTR _uscans._tcp.local, "QM" question PTR _ipps._tcp.local, "QM" question PTR _printer._tcp.local, "QM" question PTR _airplay._tcp.local, "QM" question PTR _raop._tcp.local, "QM" question PTR _airport._tcp.local, "QM" question PTR _rdlink._tcp.local, "QM" question PTR _companion-link._tcp.local, "QM" question PTR _afpovertcp._tcp.local, "QM" question PTR _rfb._tcp.local, "QM" question PTR _adisk._tcp.local, "QM" question PTR _apple-mobdev._tcp.local, "QM" question PTR 8ed307c3._sub._apple-mobdev2._tcp.local, "QM" question PTR _apple-pairable._tcp.local, "QM" question PTR Google-Home-Mini-2c3f16b2da5c4b6fd6cfbfba61c12490._googlecast._tcp.local PTR cjqg._companion-link._tcp.local OPT"
"604","1.376118750","192.168.1.100","224.0.0.251","MDNS","527","Standard query 0x0000 PTR _googlecast._tcp.local, "QM" question PTR _homekit._tcp.local, "QM" question PTR _uscan._tcp.local, "QM" question PTR _ptp._tcp.local, "QM" question PTR _ippusb._tcp.local, "QM" question PTR _scanner._tcp.local, "QM" question PTR _ipp._tcp.local, "QM" question PTR _pdl-datastream._tcp.local, "QM" question PTR _uscans._tcp.local, "QM" question PTR _ipps._tcp.local, "QM" question PTR _printer._tcp.local, "QM" question PTR _airplay._tcp.local, "QM" question PTR _raop._tcp.local, "QM" question PTR _airport._tcp.local, "QM" question PTR _rdlink._tcp.local, "QM" question PTR _companion-link._tcp.local, "QM" question PTR _afpovertcp._tcp.local, "QM" question PTR _rfb._tcp.local, "QM" question PTR _adisk._tcp.local, "QM" question PTR _apple-mobdev._tcp.local, "QM" question PTR 8ed307c3._sub._apple-mobdev2._tcp.local, "QM" question PTR _apple-pairable._tcp.local, "QM" question PTR Google-Home-Mini-2c3f16b2da5c4b6fd6cfbfba61c12490._googlecast._tcp.local PTR cjqg._companion-link._tcp.local OPT"
"605","1.916510812","192.168.1.118","199.232.37.140","TLSv1.2","249","Application Data"
"606","1.917778612","192.168.1.118","199.232.37.140","TCP","66","[TCP Window Update] 39666 → 443 [ACK] Seq=919 Ack=365587 Win=199808 Len=0 TSval=1243674696 TSecr=294791015"
"607","1.936210587","199.232.37.140","192.168.1.118","TLSv1.2","1151","Application Data, Application Data"
"608","1.936290775","192.168.1.118","199.232.37.140","TCP","66","39648 → 443 [ACK] Seq=1017 Ack=13893 Win=63104 Len=0 TSval=1243674714 TSecr=2831446802"
"609","3.996428550","192.168.1.118","209.18.47.62","DNS","74","Standard query 0xf059 A duckduckgo.com"
"610","4.004874687","192.168.1.118","209.18.47.62","DNS","84","Standard query 0xe093 A staticcdn.duckduckgo.com"
"611","4.015626612","209.18.47.62","192.168.1.118","DNS","90","Standard query response 0xf059 A duckduckgo.com A 23.21.193.169"
"612","4.016152625","192.168.1.118","23.21.193.169","TCP","74","46462 → 443 [SYN] Seq=0 Win=64240 Len=0 MSS=1460 SACK_PERM=1 TSval=1653361768 TSecr=0 WS=128"
"613","4.036348387","209.18.47.62","192.168.1.118","DNS","131","Standard query response 0xe093 A staticcdn.duckduckgo.com CNAME external-content.duckduckgo.com A 23.21.193.199"
"614","4.036878550","192.168.1.118","23.21.193.199","TCP","74","34686 → 443 [SYN] Seq=0 Win=64240 Len=0 MSS=1460 SACK_PERM=1 TSval=186199306 TSecr=0 WS=128"
"615","4.039589425","23.21.193.169","192.168.1.118","TCP","74","443 → 46462 [SYN, ACK] Seq=0 Ack=1 Win=26847 Len=0 MSS=1460 SACK_PERM=1 TSval=2167991336 TSecr=1653361768 WS=128"
"616","4.039696237","192.168.1.118","23.21.193.169","TCP","66","46462 → 443 [ACK] Seq=1 Ack=1 Win=64256 Len=0 TSval=1653361792 TSecr=2167991336"
"617","4.040214837","192.168.1.118","23.21.193.169","TLSv1","583","Client Hello"
"618","4.061849712","23.21.193.199","192.168.1.118","TCP","74","443 → 34686 [SYN, ACK] Seq=0 Ack=1 Win=26847 Len=0 MSS=1460 SACK_PERM=1 TSval=2121805250 TSecr=186199306 WS=128"
"619","4.061964000","192.168.1.118","23.21.193.199","TCP","66","34686 → 443 [ACK] Seq=1 Ack=1 Win=64256 Len=0 TSval=186199331 TSecr=2121805250"
"620","4.062503975","192.168.1.118","23.21.193.199","TLSv1","583","Client Hello"
"621","4.067128200","23.21.193.169","192.168.1.118","TCP","66","443 → 46462 [ACK] Seq=1 Ack=518 Win=28032 Len=0 TSval=2167991343 TSecr=1653361792"
"622","4.069296400","23.21.193.169","192.168.1.118","TLSv1.3","1514","Server Hello, Change Cipher Spec, Application Data"
"623","4.069367687","192.168.1.118","23.21.193.169","TCP","66","46462 → 443 [ACK] Seq=518 Ack=1449 Win=63104 Len=0 TSval=1653361822 TSecr=2167991343"
"624","4.070244575","23.21.193.169","192.168.1.118","TLSv1.3","2440","Application Data, Application Data, Application Data"
"625","4.070294587","192.168.1.118","23.21.193.169","TCP","66","46462 → 443 [ACK] Seq=518 Ack=3823 Win=61056 Len=0 TSval=1653361822 TSecr=2167991343"
"626","4.072956350","192.168.1.118","23.21.193.169","TLSv1.3","146","Change Cipher Spec, Application Data"
"627","4.086646812","192.168.1.118","23.21.193.169","TLSv1.3","590","Application Data, Application Data, Application Data"
"628","4.086876375","23.21.193.199","192.168.1.118","TCP","66","443 → 34686 [ACK] Seq=1 Ack=518 Win=28032 Len=0 TSval=2121805257 TSecr=186199332"
"629","4.088882375","23.21.193.199","192.168.1.118","TLSv1.3","1514","Server Hello, Change Cipher Spec, Application Data"
"630","4.088957275","192.168.1.118","23.21.193.199","TCP","66","34686 → 443 [ACK] Seq=518 Ack=1449 Win=63104 Len=0 TSval=186199358 TSecr=2121805257"
"631","4.089985875","23.21.193.199","192.168.1.118","TLSv1.3","2440","Application Data, Application Data, Application Data"
"632","4.090035825","192.168.1.118","23.21.193.199","TCP","66","34686 → 443 [ACK] Seq=518 Ack=3823 Win=61056 Len=0 TSval=186199359 TSecr=2121805257"
"633","4.092717862","192.168.1.118","23.21.193.199","TLSv1.3","146","Change Cipher Spec, Application Data"
"634","4.095284187","192.168.1.118","23.21.193.199","TLSv1.3","474","Application Data, Application Data"
"635","4.115390525","23.21.193.169","192.168.1.118","TCP","66","443 → 46462 [ACK] Seq=3823 Ack=1122 Win=29056 Len=0 TSval=2167991355 TSecr=1653361825"
"636","4.116769325","23.21.193.169","192.168.1.118","TLSv1.3","353","Application Data"
"637","4.116814837","23.21.193.169","192.168.1.118","TLSv1.3","353","Application Data"
"638","4.116922175","192.168.1.118","23.21.193.169","TCP","66","46462 → 443 [ACK] Seq=1122 Ack=4397 Win=64128 Len=0 TSval=1653361869 TSecr=2167991355"
"639","4.118168562","23.21.193.169","192.168.1.118","TLSv1.3","796","Application Data"
"640","4.118220262","23.21.193.169","192.168.1.118","TLSv1.3","468","Application Data"
"641","4.118351312","192.168.1.118","23.21.193.169","TCP","66","46462 → 443 [ACK] Seq=1122 Ack=5529 Win=64128 Len=0 TSval=1653361871 TSecr=2167991355"
"642","4.119894962","192.168.1.118","23.21.193.169","TLSv1.3","97","Application Data"
"643","4.124796512","23.21.193.199","192.168.1.118","TCP","66","443 → 34686 [ACK] Seq=3823 Ack=1006 Win=29056 Len=0 TSval=2121805266 TSecr=186199362"
"644","4.134222462","23.21.193.199","192.168.1.118","TLSv1.3","369","Application Data"
"645","4.134271575","23.21.193.199","192.168.1.118","TLSv1.3","369","Application Data"
"646","4.134283962","23.21.193.199","192.168.1.118","TLSv1.3","323","Application Data"
"647","4.137118937","192.168.1.118","23.21.193.199","TCP","66","34686 → 443 [ACK] Seq=1006 Ack=4686 Win=64128 Len=0 TSval=186199406 TSecr=2121805266"
"648","4.152468475","192.168.1.118","23.21.193.199","TLSv1.3","97","Application Data"
"649","4.180266162","23.21.193.169","192.168.1.118","TCP","66","443 → 46462 [ACK] Seq=5529 Ack=1153 Win=29056 Len=0 TSval=2167991372 TSecr=1653361872"
"650","4.205663225","23.21.193.199","192.168.1.118","TCP","66","443 → 34686 [ACK] Seq=4686 Ack=1037 Win=29056 Len=0 TSval=2121805287 TSecr=186199422"
"651","4.896586550","192.168.1.118","192.168.1.102","TCP","176","42902 → 8009 [PSH, ACK] Seq=1 Ack=1 Win=501 Len=110 TSval=2816336900 TSecr=5018042 [TCP segment of a reassembled PDU]"
"652","4.905278200","192.168.1.102","192.168.1.118","TCP","176","8009 → 42902 [PSH, ACK] Seq=1 Ack=111 Win=277 Len=110 TSval=5018543 TSecr=2816336900 [TCP segment of a reassembled PDU]"
"653","4.905360062","192.168.1.118","192.168.1.102","TCP","66","42902 → 8009 [ACK] Seq=111 Ack=111 Win=501 Len=0 TSval=2816336909 TSecr=5018543"
"654","5.669105262","192.168.1.104","255.255.255.255","UDP","217","49154 → 6666 Len=175"
"655","8.436015025","192.168.1.100","224.0.0.251","MDNS","600","Standard query 0x0000 PTR _googlecast._tcp.local, "QU" question PTR _homekit._tcp.local, "QU" question PTR _uscan._tcp.local, "QU" question PTR _ptp._tcp.local, "QU" question PTR _ippusb._tcp.local, "QU" question PTR _scanner._tcp.local, "QU" question PTR _ipp._tcp.local, "QU" question PTR _pdl-datastream._tcp.local, "QU" question PTR _uscans._tcp.local, "QU" question PTR _ipps._tcp.local, "QU" question PTR _printer._tcp.local, "QU" question PTR _airplay._tcp.local, "QU" question PTR _raop._tcp.local, "QU" question PTR _airport._tcp.local, "QU" question PTR _rdlink._tcp.local, "QU" question PTR _companion-link._tcp.local, "QU" question PTR _afpovertcp._tcp.local, "QU" question PTR _rfb._tcp.local, "QU" question PTR _adisk._tcp.local, "QU" question PTR _apple-mobdev._tcp.local, "QU" question PTR 8ed307c3._sub._apple-mobdev2._tcp.local, "QU" question PTR _apple-pairable._tcp.local, "QU" question TXT Google-Home-Mini-2c3f16b2da5c4b6fd6cfbfba61c12490._googlecast._tcp.local, "QU" question ANY cjqg._smb._tcp.local, "QU" question ANY cjqg._companion-link._tcp.local, "QU" question PTR Google-Home-Mini-2c3f16b2da5c4b6fd6cfbfba61c12490._googlecast._tcp.local PTR cjqg._companion-link._tcp.local SRV 0 0 445 cjqg.local SRV 0 0 53785 cjqg.local OPT"
"656","8.442001187","fe80::1cc7:6d9a:a312:7e8f","ff02::fb","MDNS","620","Standard query 0x0000 PTR _googlecast._tcp.local, "QU" question PTR _homekit._tcp.local, "QU" question PTR _uscan._tcp.local, "QU" question PTR _ptp._tcp.local, "QU" question PTR _ippusb._tcp.local, "QU" question PTR _scanner._tcp.local, "QU" question PTR _ipp._tcp.local, "QU" question PTR _pdl-datastream._tcp.local, "QU" question PTR _uscans._tcp.local, "QU" question PTR _ipps._tcp.local, "QU" question PTR _printer._tcp.local, "QU" question PTR _airplay._tcp.local, "QU" question PTR _raop._tcp.local, "QU" question PTR _airport._tcp.local, "QU" question PTR _rdlink._tcp.local, "QU" question PTR _companion-link._tcp.local, "QU" question PTR _afpovertcp._tcp.local, "QU" question PTR _rfb._tcp.local, "QU" question PTR _adisk._tcp.local, "QU" question PTR _apple-mobdev._tcp.local, "QU" question PTR 8ed307c3._sub._apple-mobdev2._tcp.local, "QU" question PTR _apple-pairable._tcp.local, "QU" question TXT Google-Home-Mini-2c3f16b2da5c4b6fd6cfbfba61c12490._googlecast._tcp.local, "QU" question ANY cjqg._smb._tcp.local, "QU" question ANY cjqg._companion-link._tcp.local, "QU" question PTR Google-Home-Mini-2c3f16b2da5c4b6fd6cfbfba61c12490._googlecast._tcp.local PTR cjqg._companion-link._tcp.local SRV 0 0 445 cjqg.local SRV 0 0 53785 cjqg.local OPT"
"657","8.445610025","fe80::1cc7:6d9a:a312:7e8f","ff02::fb","MDNS","308","Standard query response 0x0000 PTR _smb._tcp.local TXT TXT OPT"
"658","8.448842987","192.168.1.100","224.0.0.251","MDNS","288","Standard query response 0x0000 PTR _smb._tcp.local TXT TXT OPT"
"659","8.638562362","192.168.1.104","255.255.255.255","UDP","217","49154 → 6666 Len=175"
"660","8.945660862","fe80::1cc7:6d9a:a312:7e8f","ff02::fb","MDNS","195","Standard query 0x0000 ANY cjqg._smb._tcp.local, "QM" question ANY cjqg._companion-link._tcp.local, "QM" question SRV 0 0 445 cjqg.local SRV 0 0 53785 cjqg.local OPT"
"661","9.053388737","192.168.1.100","224.0.0.251","MDNS","175","Standard query 0x0000 ANY cjqg._smb._tcp.local, "QM" question ANY cjqg._companion-link._tcp.local, "QM" question SRV 0 0 445 cjqg.local SRV 0 0 53785 cjqg.local OPT"
"662","9.258490325","fe80::1cc7:6d9a:a312:7e8f","ff02::fb","MDNS","544","Standard query response 0x0000 TXT, cache flush PTR cjqg._smb._tcp.local TXT SRV, cache flush 0 0 445 cjqg.local TXT, cache flush PTR _companion-link._tcp.local PTR cjqg._companion-link._tcp.local SRV, cache flush 0 0 53785 cjqg.local AAAA, cache flush fe80::1cc7:6d9a:a312:7e8f A, cache flush 192.168.1.100 NSEC, cache flush cjqg._smb._tcp.local NSEC, cache flush cjqg._companion-link._tcp.local NSEC, cache flush cjqg.local OPT"
"663","9.263652137","192.168.1.100","224.0.0.251","MDNS","524","Standard query response 0x0000 TXT, cache flush PTR cjqg._smb._tcp.local TXT SRV, cache flush 0 0 445 cjqg.local TXT, cache flush PTR _companion-link._tcp.local PTR cjqg._companion-link._tcp.local SRV, cache flush 0 0 53785 cjqg.local AAAA, cache flush fe80::1cc7:6d9a:a312:7e8f A, cache flush 192.168.1.100 NSEC, cache flush cjqg._smb._tcp.local NSEC, cache flush cjqg._companion-link._tcp.local NSEC, cache flush cjqg.local OPT"
"664","9.460656537","fe80::1cc7:6d9a:a312:7e8f","ff02::fb","MDNS","553","Standard query 0x0000 PTR _googlecast._tcp.local, "QM" question PTR _homekit._tcp.local, "QM" question PTR _uscan._tcp.local, "QM" question PTR _ptp._tcp.local, "QM" question PTR _ippusb._tcp.local, "QM" question PTR _scanner._tcp.local, "QM" question PTR _ipp._tcp.local, "QM" question PTR _pdl-datastream._tcp.local, "QM" question PTR _uscans._tcp.local, "QM" question PTR _ipps._tcp.local, "QM" question PTR _printer._tcp.local, "QM" question PTR _airplay._tcp.local, "QM" question PTR _raop._tcp.local, "QM" question PTR _airport._tcp.local, "QM" question PTR _rdlink._tcp.local, "QM" question PTR _companion-link._tcp.local, "QM" question PTR _afpovertcp._tcp.local, "QM" question PTR _rfb._tcp.local, "QM" question PTR _adisk._tcp.local, "QM" question PTR _apple-mobdev._tcp.local, "QM" question PTR 8ed307c3._sub._apple-mobdev2._tcp.local, "QM" question PTR _apple-pairable._tcp.local, "QM" question TXT Google-Home-Mini-2c3f16b2da5c4b6fd6cfbfba61c12490._googlecast._tcp.local, "QM" question PTR Google-Home-Mini-2c3f16b2da5c4b6fd6cfbfba61c12490._googlecast._tcp.local PTR cjqg._companion-link._tcp.local OPT"
"665","9.558545025","192.168.1.102","224.0.0.251","MDNS","183","Standard query response 0x0000 SRV, cache flush 0 0 8009 2c3f16b2-da5c-4b6f-d6cf-bfba61c12490.local"
