frame.number,_ws.col.Time,_ws.col.Source,_ws.col.Destination,_ws.col.Protocol,frame.len,_ws.col.Info
"1","0.000000000","104.127.70.110","192.168.1.118","SSL","1350","Continuation Data"
"2","0.008956912","104.127.70.110","192.168.1.118","SSL","1514","Continuation Data"
"3","0.009851150","104.127.70.110","192.168.1.118","SSL","4410","Continuation Data"
"4","0.009907125","192.168.1.118","104.127.70.110","TCP","66","36430 → 443 [ACK] Seq=1 Ack=5793 Win=445 Len=0 TSval=4064756549 TSecr=2438037362"
"5","0.011665475","104.127.70.110","192.168.1.118","SSL","11650","Continuation Data"
"6","0.013721912","104.127.70.110","192.168.1.118","SSL","6350","Continuation Data"
"7","0.013864787","104.127.70.110","192.168.1.118","TCP","11650","[TCP segment of a reassembled PDU]"
"8","0.013911412","192.168.1.118","104.127.70.110","TCP","66","36426 → 443 [ACK] Seq=1 Ack=11585 Win=723 Len=0 TSval=4064756553 TSecr=2438037362"
"9","0.015316125","104.127.70.110","192.168.1.118","TCP","66","443 → 36428 [ACK] Seq=1 Ack=1 Win=248 Len=0 TSval=2438037366 TSecr=4064756476"
"10","0.015365137","104.127.70.110","192.168.1.118","TLSv1.2","8754","Application Data [TCP segment of a reassembled PDU]"
"11","0.015399500","192.168.1.118","104.127.70.110","TCP","66","36426 → 443 [ACK] Seq=1 Ack=20273 Win=771 Len=0 TSval=4064756555 TSecr=2438037362"
"12","0.015443700","104.127.70.110","192.168.1.118","TCP","2962","443 → 36426 [ACK] Seq=20273 Ack=1 Win=282 Len=2896 TSval=2438037364 TSecr=4064756478 [TCP segment of a reassembled PDU]"
"13","0.016376650","104.127.70.110","192.168.1.118","TCP","2962","443 → 36426 [ACK] Seq=23169 Ack=1 Win=282 Len=2896 TSval=2438037365 TSecr=4064756478 [TCP segment of a reassembled PDU]"
"14","0.018021075","104.127.70.110","192.168.1.118","TCP","1514","443 → 36426 [ACK] Seq=26065 Ack=1 Win=282 Len=1448 TSval=2438037367 TSecr=4064756478 [TCP segment of a reassembled PDU]"
"15","0.019493225","104.127.70.110","192.168.1.118","TCP","1514","443 → 36426 [ACK] Seq=27513 Ack=1 Win=282 Len=1448 TSval=2438037367 TSecr=4064756478 [TCP segment of a reassembled PDU]"
"16","0.019533212","104.127.70.110","192.168.1.118","TCP","10202","[TCP segment of a reassembled PDU]"
"17","0.021602437","104.127.70.110","192.168.1.118","TCP","5858","443 → 36428 [ACK] Seq=10137 Ack=1 Win=248 Len=5792 TSval=2438037370 TSecr=4064756476 [TCP segment of a reassembled PDU]"
"18","0.021724862","104.127.70.110","192.168.1.118","TLSv1.2","7306","Application Data [TCP segment of a reassembled PDU]"
"19","0.021740937","104.127.70.110","192.168.1.118","TCP","2962","443 → 36426 [ACK] Seq=28961 Ack=1 Win=282 Len=2896 TSval=2438037368 TSecr=4064756478 [TCP segment of a reassembled PDU]"
"20","0.022446187","104.127.70.110","192.168.1.118","TLSv1.2","2962","Application Data [TCP segment of a reassembled PDU]"
"21","0.022478725","104.127.70.110","192.168.1.118","TCP","2962","443 → 36426 [ACK] Seq=34753 Ack=1 Win=282 Len=2896 TSval=2438037371 TSecr=4064756478 [TCP segment of a reassembled PDU]"
"22","0.023236937","104.127.70.110","192.168.1.118","TCP","1514","443 → 36426 [ACK] Seq=37649 Ack=1 Win=282 Len=1448 TSval=2438037373 TSecr=4064756478 [TCP segment of a reassembled PDU]"
"23","0.023799112","104.127.70.110","192.168.1.118","TCP","1514","443 → 36426 [ACK] Seq=39097 Ack=1 Win=282 Len=1448 TSval=2438037373 TSecr=4064756478 [TCP segment of a reassembled PDU]"
"24","0.029293337","104.127.70.110","192.168.1.118","TCP","1514","[TCP segment of a reassembled PDU]"
"25","0.031189437","104.127.70.110","192.168.1.118","TCP","1514","443 → 36434 [ACK] Seq=1449 Ack=1 Win=247 Len=1448 TSval=2438037382 TSecr=4064756515 [TCP segment of a reassembled PDU]"
"26","0.040197175","192.168.1.118","104.127.70.110","TCP","66","36432 → 443 [ACK] Seq=1 Ack=1285 Win=467 Len=0 TSval=4064756580 TSecr=2438037331"
"27","0.041255112","104.127.70.110","192.168.1.118","TCP","1514","443 → 36434 [ACK] Seq=2897 Ack=1 Win=247 Len=1448 TSval=2438037382 TSecr=4064756515 [TCP segment of a reassembled PDU]"
"28","0.042215600","104.127.70.110","192.168.1.118","TCP","1514","443 → 36434 [ACK] Seq=4345 Ack=1 Win=247 Len=1448 TSval=2438037382 TSecr=4064756515 [TCP segment of a reassembled PDU]"
"29","0.048539300","104.127.70.110","192.168.1.118","TCP","1514","443 → 36426 [ACK] Seq=40545 Ack=1 Win=282 Len=1448 TSval=2438037401 TSecr=4064756553 [TCP segment of a reassembled PDU]"
"30","0.048610175","192.168.1.118","104.127.70.110","TCP","66","36426 → 443 [ACK] Seq=1 Ack=41993 Win=602 Len=0 TSval=4064756588 TSecr=2438037364"
"31","0.049769662","104.127.70.110","192.168.1.118","TLSv1.2","2418","Application Data"
"32","0.052199300","192.168.1.118","104.127.70.110","TCP","66","36430 → 443 [ACK] Seq=1 Ack=23661 Win=306 Len=0 TSval=4064756592 TSecr=2438037362"
"33","0.052769662","104.127.70.110","192.168.1.118","TLSv1.2","706","Application Data"
"34","0.060195400","192.168.1.118","104.127.70.110","TCP","66","36428 → 443 [ACK] Seq=1 Ack=23169 Win=320 Len=0 TSval=4064756600 TSecr=2438037370"
"35","0.070200475","192.168.1.118","104.127.70.110","TCP","66","36434 → 443 [ACK] Seq=1 Ack=6433 Win=451 Len=0 TSval=4064756610 TSecr=2438037382"
"36","0.074577912","104.127.70.110","192.168.1.118","TCP","1514","[TCP Spurious Retransmission] 443 → 36426 [ACK] Seq=20273 Ack=1 Win=282 Len=1448 TSval=2438037427 TSecr=4064756555[Reassembly error, protocol TCP: New fragment overlaps old data (retransmission?)]"
"37","0.074642487","192.168.1.118","104.127.70.110","TCP","78","36426 → 443 [ACK] Seq=1 Ack=44345 Win=584 Len=0 TSval=4064756614 TSecr=2438037401 SLE=20273 SRE=21721"
"38","0.080052025","192.168.1.118","104.127.70.110","TLSv1.2","839","Application Data"
"39","0.081347312","192.168.1.118","104.127.70.110","TLSv1.2","836","Application Data"
"40","0.081511012","192.168.1.118","104.127.70.110","TLSv1.2","840","Application Data"
"41","0.093020487","104.127.70.110","192.168.1.118","TCP","1514","443 → 36428 [ACK] Seq=23169 Ack=1 Win=248 Len=1448 TSval=2438037446 TSecr=4064756600 [TCP segment of a reassembled PDU]"
"42","0.093084750","192.168.1.118","104.127.70.110","TCP","66","36428 → 443 [ACK] Seq=1 Ack=24617 Win=493 Len=0 TSval=4064756633 TSecr=2438037446"
"43","0.093795262","104.127.70.110","192.168.1.118","TCP","2962","443 → 36428 [ACK] Seq=24617 Ack=1 Win=248 Len=2896 TSval=2438037446 TSecr=4064756600 [TCP segment of a reassembled PDU]"
"44","0.093820662","192.168.1.118","104.127.70.110","TCP","66","36428 → 443 [ACK] Seq=1 Ack=27513 Win=471 Len=0 TSval=4064756633 TSecr=2438037446"
"45","0.095539700","104.127.70.110","192.168.1.118","TLSv1.2","10202","Application Data [TCP segment of a reassembled PDU]"
"46","0.095573687","192.168.1.118","104.127.70.110","TCP","66","36428 → 443 [ACK] Seq=1 Ack=37649 Win=392 Len=0 TSval=4064756635 TSecr=2438037446"
"47","0.096277250","104.127.70.110","192.168.1.118","TLSv1.2","1536","Application Data"
"48","0.096316762","192.168.1.118","104.127.70.110","TCP","66","36428 → 443 [ACK] Seq=1 Ack=39119 Win=381 Len=0 TSval=4064756636 TSecr=2438037446"
"49","0.109485487","104.127.70.110","192.168.1.118","TCP","1514","[TCP Spurious Retransmission] 443 → 36426 [ACK] Seq=41993 Ack=1 Win=282 Len=1448 TSval=2438037459 TSecr=4064756588[Reassembly error, protocol TCP: New fragment overlaps old data (retransmission?)]"
"50","0.109548875","192.168.1.118","104.127.70.110","TCP","78","[TCP Dup ACK 37#1] 36426 → 443 [ACK] Seq=774 Ack=44345 Win=771 Len=0 TSval=4064756649 TSecr=2438037401 SLE=41993 SRE=43441"
"51","0.115098100","104.127.70.110","192.168.1.118","TCP","1514","[TCP segment of a reassembled PDU]"
"52","0.115200687","192.168.1.118","104.127.70.110","TCP","66","36430 → 443 [ACK] Seq=771 Ack=25109 Win=524 Len=0 TSval=4064756655 TSecr=2438037468"
"53","0.116249650","104.127.70.110","192.168.1.118","TCP","2962","443 → 36430 [ACK] Seq=25109 Ack=771 Win=260 Len=2896 TSval=2438037468 TSecr=4064756621 [TCP segment of a reassembled PDU]"
"54","0.116306737","192.168.1.118","104.127.70.110","TCP","66","36430 → 443 [ACK] Seq=771 Ack=28005 Win=569 Len=0 TSval=4064756656 TSecr=2438037468"
"55","0.117613587","104.127.70.110","192.168.1.118","TCP","10202","443 → 36430 [ACK] Seq=28005 Ack=771 Win=260 Len=10136 TSval=2438037468 TSecr=4064756621 [TCP segment of a reassembled PDU]"
"56","0.117662125","192.168.1.118","104.127.70.110","TCP","66","36430 → 443 [ACK] Seq=771 Ack=38141 Win=727 Len=0 TSval=4064756657 TSecr=2438037468"
"57","0.118796475","104.127.70.110","192.168.1.118","TLSv1.2","5858","Application Data [TCP segment of a reassembled PDU]"
"58","0.118834862","192.168.1.118","104.127.70.110","TCP","66","36430 → 443 [ACK] Seq=771 Ack=43933 Win=818 Len=0 TSval=4064756658 TSecr=2438037468"
"59","0.121397937","104.127.70.110","192.168.1.118","TCP","1514","443 → 36430 [ACK] Seq=43933 Ack=771 Win=260 Len=1448 TSval=2438037468 TSecr=4064756621 [TCP segment of a reassembled PDU]"
"60","0.121446762","192.168.1.118","104.127.70.110","TCP","66","36430 → 443 [ACK] Seq=771 Ack=45381 Win=841 Len=0 TSval=4064756661 TSecr=2438037468"
"61","0.123630000","104.127.70.110","192.168.1.118","TCP","1514","443 → 36430 [ACK] Seq=45381 Ack=771 Win=260 Len=1448 TSval=2438037468 TSecr=4064756621 [TCP segment of a reassembled PDU]"
"62","0.123675937","192.168.1.118","104.127.70.110","TCP","66","36430 → 443 [ACK] Seq=771 Ack=46829 Win=863 Len=0 TSval=4064756663 TSecr=2438037468"
"63","0.128194550","104.127.70.110","192.168.1.118","TCP","1514","443 → 36430 [ACK] Seq=46829 Ack=771 Win=260 Len=1448 TSval=2438037468 TSecr=4064756621 [TCP segment of a reassembled PDU]"
"64","0.128255062","192.168.1.118","104.127.70.110","TCP","66","36430 → 443 [ACK] Seq=771 Ack=48277 Win=886 Len=0 TSval=4064756668 TSecr=2438037468"
"65","0.129074262","104.127.70.110","192.168.1.118","TCP","1514","443 → 36430 [ACK] Seq=48277 Ack=771 Win=260 Len=1448 TSval=2438037468 TSecr=4064756621 [TCP segment of a reassembled PDU]"
"66","0.129109437","192.168.1.118","104.127.70.110","TCP","66","36430 → 443 [ACK] Seq=771 Ack=49725 Win=908 Len=0 TSval=4064756669 TSecr=2438037468"
"67","0.129126387","104.127.70.110","192.168.1.118","TCP","2962","[TCP segment of a reassembled PDU]"
"68","0.129171812","192.168.1.118","104.127.70.110","TCP","66","36432 → 443 [ACK] Seq=775 Ack=4181 Win=479 Len=0 TSval=4064756669 TSecr=2438037480"
"69","0.132943212","104.127.70.110","192.168.1.118","TCP","1514","443 → 36432 [ACK] Seq=4181 Ack=775 Win=260 Len=1448 TSval=2438037480 TSecr=4064756621 [TCP segment of a reassembled PDU]"
"70","0.133003912","192.168.1.118","104.127.70.110","TCP","66","36432 → 443 [ACK] Seq=775 Ack=5629 Win=468 Len=0 TSval=4064756672 TSecr=2438037480"
"71","0.133665375","104.127.70.110","192.168.1.118","TCP","1514","443 → 36432 [ACK] Seq=5629 Ack=775 Win=260 Len=1448 TSval=2438037480 TSecr=4064756621 [TCP segment of a reassembled PDU]"
"72","0.133699912","192.168.1.118","104.127.70.110","TCP","66","36432 → 443 [ACK] Seq=775 Ack=7077 Win=457 Len=0 TSval=4064756673 TSecr=2438037480"
"73","0.133716512","104.127.70.110","192.168.1.118","TCP","2962","443 → 36430 [ACK] Seq=49725 Ack=771 Win=260 Len=2896 TSval=2438037474 TSecr=4064756621 [TCP segment of a reassembled PDU]"
"74","0.133734650","192.168.1.118","104.127.70.110","TCP","66","36430 → 443 [ACK] Seq=771 Ack=52621 Win=954 Len=0 TSval=4064756673 TSecr=2438037474"
"75","0.138578062","104.127.70.110","192.168.1.118","TCP","1514","443 → 36432 [ACK] Seq=7077 Ack=775 Win=260 Len=1448 TSval=2438037480 TSecr=4064756621 [TCP segment of a reassembled PDU]"
"76","0.138638562","192.168.1.118","104.127.70.110","TCP","66","36432 → 443 [ACK] Seq=775 Ack=8525 Win=446 Len=0 TSval=4064756678 TSecr=2438037480"
"77","0.139583700","104.127.70.110","192.168.1.118","TCP","1514","443 → 36432 [ACK] Seq=8525 Ack=775 Win=260 Len=1448 TSval=2438037480 TSecr=4064756621 [TCP segment of a reassembled PDU]"
"78","0.139629700","192.168.1.118","104.127.70.110","TCP","66","36432 → 443 [ACK] Seq=775 Ack=9973 Win=435 Len=0 TSval=4064756679 TSecr=2438037480"
"79","0.139651375","104.127.70.110","192.168.1.118","TCP","1514","443 → 36430 [ACK] Seq=52621 Ack=771 Win=260 Len=1448 TSval=2438037480 TSecr=4064756621 [TCP segment of a reassembled PDU]"
"80","0.139667612","192.168.1.118","104.127.70.110","TCP","66","36430 → 443 [ACK] Seq=771 Ack=54069 Win=976 Len=0 TSval=4064756679 TSecr=2438037480"
"81","0.140384887","104.127.70.110","192.168.1.118","TCP","1514","443 → 36430 [ACK] Seq=54069 Ack=771 Win=260 Len=1448 TSval=2438037480 TSecr=4064756621 [TCP segment of a reassembled PDU]"
"82","0.140411250","192.168.1.118","104.127.70.110","TCP","66","36430 → 443 [ACK] Seq=771 Ack=55517 Win=999 Len=0 TSval=4064756680 TSecr=2438037480"
"83","0.142484125","104.127.70.110","192.168.1.118","TLSv1.2","1514","Application Data [TCP segment of a reassembled PDU]"
"84","0.142537562","192.168.1.118","104.127.70.110","TCP","66","36430 → 443 [ACK] Seq=771 Ack=56965 Win=1022 Len=0 TSval=4064756682 TSecr=2438037490"
"85","0.143501887","104.127.70.110","192.168.1.118","TCP","1514","443 → 36430 [ACK] Seq=56965 Ack=771 Win=260 Len=1448 TSval=2438037490 TSecr=4064756655 [TCP segment of a reassembled PDU]"
"86","0.143540262","192.168.1.118","104.127.70.110","TCP","66","36430 → 443 [ACK] Seq=771 Ack=58413 Win=1044 Len=0 TSval=4064756683 TSecr=2438037490"
"87","0.145794425","104.127.70.110","192.168.1.118","TCP","1514","443 → 36432 [ACK] Seq=9973 Ack=775 Win=260 Len=1448 TSval=2438037484 TSecr=4064756621 [TCP segment of a reassembled PDU]"
"88","0.145847862","192.168.1.118","104.127.70.110","TCP","66","36432 → 443 [ACK] Seq=775 Ack=11421 Win=424 Len=0 TSval=4064756685 TSecr=2438037484"
"89","0.146771400","104.127.70.110","192.168.1.118","TCP","1514","443 → 36432 [ACK] Seq=11421 Ack=775 Win=260 Len=1448 TSval=2438037484 TSecr=4064756621 [TCP segment of a reassembled PDU]"
"90","0.146810050","192.168.1.118","104.127.70.110","TCP","66","36432 → 443 [ACK] Seq=775 Ack=12869 Win=413 Len=0 TSval=4064756686 TSecr=2438037484"
"91","0.146828625","104.127.70.110","192.168.1.118","TLSv1.2","1514","Application Data [TCP segment of a reassembled PDU]"
"92","0.146846575","192.168.1.118","104.127.70.110","TCP","66","36430 → 443 [ACK] Seq=771 Ack=59861 Win=1067 Len=0 TSval=4064756686 TSecr=2438037492"
"93","0.147639075","104.127.70.110","192.168.1.118","TCP","1514","443 → 36430 [ACK] Seq=59861 Ack=771 Win=260 Len=1448 TSval=2438037492 TSecr=4064756657 [TCP segment of a reassembled PDU]"
"94","0.147674662","192.168.1.118","104.127.70.110","TCP","66","36430 → 443 [ACK] Seq=771 Ack=61309 Win=1089 Len=0 TSval=4064756687 TSecr=2438037492"
"95","0.148163025","104.127.70.110","192.168.1.118","TCP","66","443 → 36426 [ACK] Seq=44345 Ack=774 Win=294 Len=0 TSval=2438037501 TSecr=4064756619"
"96","0.151385837","104.127.70.110","192.168.1.118","TCP","2962","443 → 36430 [ACK] Seq=61309 Ack=771 Win=260 Len=2896 TSval=2438037495 TSecr=4064756657 [TCP segment of a reassembled PDU]"
"97","0.151452825","192.168.1.118","104.127.70.110","TCP","66","36430 → 443 [ACK] Seq=771 Ack=64205 Win=1135 Len=0 TSval=4064756691 TSecr=2438037495"
"98","0.154756112","104.127.70.110","192.168.1.118","TCP","2962","443 → 36430 [ACK] Seq=64205 Ack=771 Win=260 Len=2896 TSval=2438037499 TSecr=4064756657 [TCP segment of a reassembled PDU]"
"99","0.154823775","192.168.1.118","104.127.70.110","TCP","66","36430 → 443 [ACK] Seq=771 Ack=67101 Win=1180 Len=0 TSval=4064756694 TSecr=2438037499"
"100","0.154855100","104.127.70.110","192.168.1.118","TCP","2962","443 → 36432 [ACK] Seq=12869 Ack=775 Win=260 Len=2896 TSval=2438037491 TSecr=4064756621 [TCP segment of a reassembled PDU]"
"101","0.154869112","104.127.70.110","192.168.1.118","TCP","2962","[TCP segment of a reassembled PDU]"
"102","0.154886150","192.168.1.118","104.127.70.110","TCP","66","36426 → 443 [ACK] Seq=774 Ack=47241 Win=817 Len=0 TSval=4064756694 TSecr=2438037507"
"103","0.156232887","104.127.70.110","192.168.1.118","TCP","2962","443 → 36426 [ACK] Seq=47241 Ack=774 Win=294 Len=2896 TSval=2438037507 TSecr=4064756619 [TCP segment of a reassembled PDU]"
"104","0.156286412","192.168.1.118","104.127.70.110","TCP","66","36426 → 443 [ACK] Seq=774 Ack=50137 Win=862 Len=0 TSval=4064756696 TSecr=2438037507"
"105","0.158393837","104.127.70.110","192.168.1.118","TCP","2962","443 → 36430 [ACK] Seq=67101 Ack=771 Win=260 Len=2896 TSval=2438037502 TSecr=4064756668 [TCP segment of a reassembled PDU]"
"106","0.158447587","192.168.1.118","104.127.70.110","TCP","66","36430 → 443 [ACK] Seq=771 Ack=69997 Win=1225 Len=0 TSval=4064756698 TSecr=2438037502"
"107","0.158478000","104.127.70.110","192.168.1.118","TCP","5858","443 → 36426 [ACK] Seq=50137 Ack=774 Win=294 Len=5792 TSval=2438037507 TSecr=4064756619 [TCP segment of a reassembled PDU]"
"108","0.158501225","192.168.1.118","104.127.70.110","TCP","66","36426 → 443 [ACK] Seq=774 Ack=55929 Win=867 Len=0 TSval=4064756698 TSecr=2438037507"
"109","0.159382037","104.127.70.110","192.168.1.118","TCP","2962","443 → 36430 [ACK] Seq=69997 Ack=771 Win=260 Len=2896 TSval=2438037505 TSecr=4064756668 [TCP segment of a reassembled PDU]"
"110","0.159426762","192.168.1.118","104.127.70.110","TCP","66","36430 → 443 [ACK] Seq=771 Ack=72893 Win=1270 Len=0 TSval=4064756699 TSecr=2438037505"
"111","0.160526000","104.127.70.110","192.168.1.118","TLSv1.2","2962","Application Data [TCP segment of a reassembled PDU]"
"112","0.160570300","192.168.1.118","104.127.70.110","TCP","66","36430 → 443 [ACK] Seq=771 Ack=75789 Win=1316 Len=0 TSval=4064756700 TSecr=2438037508"
"113","0.160588450","104.127.70.110","192.168.1.118","TCP","2962","443 → 36426 [ACK] Seq=55929 Ack=774 Win=294 Len=2896 TSval=2438037509 TSecr=4064756619 [TCP segment of a reassembled PDU]"
"114","0.160605800","192.168.1.118","104.127.70.110","TCP","66","36426 → 443 [ACK] Seq=774 Ack=58825 Win=845 Len=0 TSval=4064756700 TSecr=2438037509"
"115","0.161828600","104.127.70.110","192.168.1.118","TCP","2962","443 → 36430 [ACK] Seq=75789 Ack=771 Win=260 Len=2896 TSval=2438037511 TSecr=4064756683 [TCP segment of a reassembled PDU]"
"116","0.161884675","192.168.1.118","104.127.70.110","TCP","66","36430 → 443 [ACK] Seq=771 Ack=78685 Win=1361 Len=0 TSval=4064756701 TSecr=2438037511"
"117","0.161917600","104.127.70.110","192.168.1.118","TLSv1.2","2962","Application Data [TCP segment of a reassembled PDU]"
"118","0.163044350","104.127.70.110","192.168.1.118","TLSv1.2","2962","Application Data [TCP segment of a reassembled PDU]"
"119","0.163097100","192.168.1.118","104.127.70.110","TCP","66","36426 → 443 [ACK] Seq=774 Ack=61721 Win=823 Len=0 TSval=4064756703 TSecr=2438037511"
"120","0.163122137","104.127.70.110","192.168.1.118","TCP","2962","443 → 36430 [ACK] Seq=78685 Ack=771 Win=260 Len=2896 TSval=2438037512 TSecr=4064756683 [TCP segment of a reassembled PDU]"
"121","0.163155987","192.168.1.118","104.127.70.110","TCP","66","36430 → 443 [ACK] Seq=771 Ack=81581 Win=1406 Len=0 TSval=4064756703 TSecr=2438037512"
"122","0.166460337","104.127.70.110","192.168.1.118","TCP","2962","443 → 36430 [ACK] Seq=81581 Ack=771 Win=260 Len=2896 TSval=2438037513 TSecr=4064756683 [TCP segment of a reassembled PDU]"
"123","0.166533075","192.168.1.118","104.127.70.110","TCP","66","36430 → 443 [ACK] Seq=771 Ack=84477 Win=1451 Len=0 TSval=4064756706 TSecr=2438037513"
"124","0.166566225","104.127.70.110","192.168.1.118","TCP","2962","443 → 36426 [ACK] Seq=61721 Ack=774 Win=294 Len=2896 TSval=2438037512 TSecr=4064756619 [TCP segment of a reassembled PDU]"
"125","0.166584175","192.168.1.118","104.127.70.110","TCP","66","36426 → 443 [ACK] Seq=774 Ack=64617 Win=801 Len=0 TSval=4064756706 TSecr=2438037512"
"126","0.168596862","104.127.70.110","192.168.1.118","TCP","2962","443 → 36430 [ACK] Seq=84477 Ack=771 Win=260 Len=2896 TSval=2438037514 TSecr=4064756683 [TCP segment of a reassembled PDU]"
"127","0.168649587","104.127.70.110","192.168.1.118","TCP","2962","443 → 36430 [ACK] Seq=87373 Ack=771 Win=260 Len=2896 TSval=2438037516 TSecr=4064756683 [TCP segment of a reassembled PDU]"
"128","0.168676500","104.127.70.110","192.168.1.118","TCP","2962","443 → 36426 [ACK] Seq=64617 Ack=774 Win=294 Len=2896 TSval=2438037514 TSecr=4064756619 [TCP segment of a reassembled PDU]"
"129","0.168708337","192.168.1.118","104.127.70.110","TCP","66","36426 → 443 [ACK] Seq=774 Ack=67513 Win=779 Len=0 TSval=4064756708 TSecr=2438037514"
"130","0.168748662","104.127.70.110","192.168.1.118","TLSv1.2","2962","Application Data [TCP segment of a reassembled PDU]"
"131","0.168758637","104.127.70.110","192.168.1.118","TCP","2962","443 → 36426 [ACK] Seq=67513 Ack=774 Win=294 Len=2896 TSval=2438037516 TSecr=4064756619 [TCP segment of a reassembled PDU]"
"132","0.168772437","192.168.1.118","104.127.70.110","TCP","66","36426 → 443 [ACK] Seq=774 Ack=70409 Win=757 Len=0 TSval=4064756708 TSecr=2438037516"
"133","0.170277850","104.127.70.110","192.168.1.118","TCP","2962","443 → 36430 [ACK] Seq=93165 Ack=771 Win=260 Len=2896 TSval=2438037518 TSecr=4064756683 [TCP segment of a reassembled PDU]"
"134","0.170324050","104.127.70.110","192.168.1.118","TCP","2962","443 → 36426 [ACK] Seq=70409 Ack=774 Win=294 Len=2896 TSval=2438037517 TSecr=4064756619 [TCP segment of a reassembled PDU]"
"135","0.170351537","192.168.1.118","104.127.70.110","TCP","66","36426 → 443 [ACK] Seq=774 Ack=73305 Win=735 Len=0 TSval=4064756710 TSecr=2438037517"
"136","0.170379362","104.127.70.110","192.168.1.118","TCP","2962","443 → 36432 [ACK] Seq=18661 Ack=775 Win=260 Len=2896 TSval=2438037506 TSecr=4064756621 [TCP segment of a reassembled PDU]"
"137","0.170402425","104.127.70.110","192.168.1.118","TCP","2962","443 → 36430 [ACK] Seq=96061 Ack=771 Win=260 Len=2896 TSval=2438037519 TSecr=4064756683 [TCP segment of a reassembled PDU]"
"138","0.172702375","104.127.70.110","192.168.1.118","TLSv1.2","2962","Application Data [TCP segment of a reassembled PDU]"
"139","0.172754687","104.127.70.110","192.168.1.118","TCP","2962","443 → 36426 [ACK] Seq=73305 Ack=774 Win=294 Len=2896 TSval=2438037519 TSecr=4064756619 [TCP segment of a reassembled PDU]"
"140","0.172786000","192.168.1.118","104.127.70.110","TCP","66","36426 → 443 [ACK] Seq=774 Ack=76201 Win=713 Len=0 TSval=4064756712 TSecr=2438037519"
"141","0.172818475","104.127.70.110","192.168.1.118","TCP","2962","443 → 36430 [ACK] Seq=101853 Ack=771 Win=260 Len=2896 TSval=2438037521 TSecr=4064756683 [TCP segment of a reassembled PDU]"
"142","0.173478550","104.127.70.110","192.168.1.118","TLSv1.2","2962","Application Data, Application Data"
"143","0.173508237","192.168.1.118","104.127.70.110","TCP","66","36426 → 443 [ACK] Seq=774 Ack=79097 Win=691 Len=0 TSval=4064756713 TSecr=2438037521"
"144","0.173539575","104.127.70.110","192.168.1.118","TCP","2962","443 → 36426 [ACK] Seq=79097 Ack=774 Win=294 Len=2896 TSval=2438037522 TSecr=4064756619 [TCP segment of a reassembled PDU]"
"145","0.173554687","192.168.1.118","104.127.70.110","TCP","66","36426 → 443 [ACK] Seq=774 Ack=81993 Win=669 Len=0 TSval=4064756713 TSecr=2438037522"
"146","0.174534425","104.127.70.110","192.168.1.118","TCP","1514","443 → 36426 [ACK] Seq=81993 Ack=774 Win=294 Len=1448 TSval=2438037524 TSecr=4064756619 [TCP segment of a reassembled PDU]"
"147","0.174568137","192.168.1.118","104.127.70.110","TCP","66","36426 → 443 [ACK] Seq=774 Ack=83441 Win=658 Len=0 TSval=4064756714 TSecr=2438037524"
"148","0.176084750","104.127.70.110","192.168.1.118","TCP","1514","443 → 36426 [ACK] Seq=83441 Ack=774 Win=294 Len=1448 TSval=2438037524 TSecr=4064756619 [TCP segment of a reassembled PDU]"
"149","0.176126312","192.168.1.118","104.127.70.110","TCP","66","36426 → 443 [ACK] Seq=774 Ack=84889 Win=647 Len=0 TSval=4064756716 TSecr=2438037524"
"150","0.176912625","104.127.70.110","192.168.1.118","TLSv1.2","1409","Application Data"
"151","0.176948687","104.127.70.110","192.168.1.118","TCP","2962","443 → 36426 [ACK] Seq=84889 Ack=774 Win=294 Len=2896 TSval=2438037526 TSecr=4064756619 [TCP segment of a reassembled PDU]"
"152","0.176975200","192.168.1.118","104.127.70.110","TCP","66","36426 → 443 [ACK] Seq=774 Ack=87785 Win=625 Len=0 TSval=4064756716 TSecr=2438037526"
"153","0.178190700","104.127.70.110","192.168.1.118","TCP","1514","443 → 36426 [ACK] Seq=87785 Ack=774 Win=294 Len=1448 TSval=2438037527 TSecr=4064756619 [TCP segment of a reassembled PDU]"
"154","0.178245112","192.168.1.118","104.127.70.110","TCP","66","36426 → 443 [ACK] Seq=774 Ack=89233 Win=614 Len=0 TSval=4064756718 TSecr=2438037527"
"155","0.179153062","104.127.70.110","192.168.1.118","TCP","1514","443 → 36426 [ACK] Seq=89233 Ack=774 Win=294 Len=1448 TSval=2438037527 TSecr=4064756619 [TCP segment of a reassembled PDU]"
"156","0.179193075","104.127.70.110","192.168.1.118","TCP","1514","443 → 36430 [ACK] Seq=104749 Ack=771 Win=260 Len=1448 TSval=2438037531 TSecr=4064756701 [TCP segment of a reassembled PDU]"
"157","0.180966912","104.127.70.110","192.168.1.118","TCP","2962","443 → 36430 [ACK] Seq=106197 Ack=771 Win=260 Len=2896 TSval=2438037531 TSecr=4064756701 [TCP segment of a reassembled PDU]"
"158","0.181091400","104.127.70.110","192.168.1.118","TLSv1.2","10202","Application Data [TCP segment of a reassembled PDU]"
"159","0.183310450","104.127.70.110","192.168.1.118","TCP","5858","443 → 36430 [ACK] Seq=119229 Ack=771 Win=260 Len=5792 TSval=2438037531 TSecr=4064756701 [TCP segment of a reassembled PDU]"
"160","0.183428725","104.127.70.110","192.168.1.118","TLSv1.2","5364","Application Data"
"161","0.183455300","104.127.70.110","192.168.1.118","TCP","2962","443 → 36426 [ACK] Seq=90681 Ack=774 Win=294 Len=2896 TSval=2438037529 TSecr=4064756619 [TCP segment of a reassembled PDU]"
"162","0.183476050","104.127.70.110","192.168.1.118","TLSv1.2","2962","Application Data [TCP segment of a reassembled PDU]"
"163","0.185381512","104.127.70.110","192.168.1.118","TCP","2962","443 → 36426 [ACK] Seq=96473 Ack=774 Win=294 Len=2896 TSval=2438037532 TSecr=4064756703 [TCP segment of a reassembled PDU]"
"164","0.185436387","104.127.70.110","192.168.1.118","TCP","2962","443 → 36426 [ACK] Seq=99369 Ack=774 Win=294 Len=2896 TSval=2438037533 TSecr=4064756703 [TCP segment of a reassembled PDU]"
"165","0.186457562","104.127.70.110","192.168.1.118","TCP","2962","443 → 36426 [ACK] Seq=102265 Ack=774 Win=294 Len=2896 TSval=2438037535 TSecr=4064756703 [TCP segment of a reassembled PDU]"
"166","0.186505600","104.127.70.110","192.168.1.118","TCP","2962","443 → 36426 [ACK] Seq=105161 Ack=774 Win=294 Len=2896 TSval=2438037536 TSecr=4064756703 [TCP segment of a reassembled PDU]"
"167","0.187089612","104.127.70.110","192.168.1.118","TCP","2962","443 → 36426 [ACK] Seq=108057 Ack=774 Win=294 Len=2896 TSval=2438037537 TSecr=4064756703 [TCP segment of a reassembled PDU]"
"168","0.187739387","104.127.70.110","192.168.1.118","TLSv1.2","1514","Application Data [TCP segment of a reassembled PDU]"
"169","0.188552762","104.127.70.110","192.168.1.118","TCP","1514","443 → 36426 [ACK] Seq=112401 Ack=774 Win=294 Len=1448 TSval=2438037538 TSecr=4064756703 [TCP segment of a reassembled PDU]"
"170","0.189203575","104.127.70.110","192.168.1.118","TCP","2962","443 → 36426 [ACK] Seq=113849 Ack=774 Win=294 Len=2896 TSval=2438037539 TSecr=4064756703 [TCP segment of a reassembled PDU]"
"171","0.189825900","104.127.70.110","192.168.1.118","TCP","1514","443 → 36426 [ACK] Seq=116745 Ack=774 Win=294 Len=1448 TSval=2438037541 TSecr=4064756703 [TCP segment of a reassembled PDU]"
"172","0.190474712","104.127.70.110","192.168.1.118","TCP","1514","443 → 36426 [ACK] Seq=118193 Ack=774 Win=294 Len=1448 TSval=2438037541 TSecr=4064756703 [TCP segment of a reassembled PDU]"
"173","0.191202125","104.127.70.110","192.168.1.118","TLSv1.2","1514","Application Data [TCP segment of a reassembled PDU]"
"174","0.192038337","104.127.70.110","192.168.1.118","TCP","1514","443 → 36426 [ACK] Seq=121089 Ack=774 Win=294 Len=1448 TSval=2438037542 TSecr=4064756703 [TCP segment of a reassembled PDU]"
"175","0.192895787","104.127.70.110","192.168.1.118","TCP","2962","443 → 36426 [ACK] Seq=122537 Ack=774 Win=294 Len=2896 TSval=2438037543 TSecr=4064756703 [TCP segment of a reassembled PDU]"
"176","0.195196762","192.168.1.118","104.127.70.110","TCP","66","36432 → 443 [ACK] Seq=775 Ack=22900 Win=335 Len=0 TSval=4064756735 TSecr=2438037491"
"177","0.199650675","104.127.70.110","192.168.1.118","TCP","1514","443 → 36426 [ACK] Seq=125433 Ack=774 Win=294 Len=1448 TSval=2438037551 TSecr=4064756713 [TCP segment of a reassembled PDU]"
"178","0.201322837","104.127.70.110","192.168.1.118","TCP","4410","443 → 36426 [ACK] Seq=126881 Ack=774 Win=294 Len=4344 TSval=2438037551 TSecr=4064756713 [TCP segment of a reassembled PDU]"
"179","0.201401650","104.127.70.110","192.168.1.118","TLSv1.2","10202","Application Data [TCP segment of a reassembled PDU]"
"180","0.202816287","104.127.70.110","192.168.1.118","TCP","10202","443 → 36426 [ACK] Seq=141361 Ack=774 Win=294 Len=10136 TSval=2438037552 TSecr=4064756716 [TCP segment of a reassembled PDU]"
"181","0.209203800","192.168.1.118","104.127.70.110","TCP","66","36430 → 443 [ACK] Seq=771 Ack=130319 Win=1093 Len=0 TSval=4064756749 TSecr=2438037514"
"182","0.209980487","104.127.70.110","192.168.1.118","TLSv1.2","1514","Application Data [TCP segment of a reassembled PDU]"
"183","0.210030812","192.168.1.118","104.127.70.110","TCP","66","36426 → 443 [ACK] Seq=774 Ack=152945 Win=117 Len=0 TSval=4064756749 TSecr=2438037527"
"184","0.210626100","104.127.70.110","192.168.1.118","TCP","1514","443 → 36426 [ACK] Seq=152945 Ack=774 Win=294 Len=1448 TSval=2438037562 TSecr=4064756718 [TCP segment of a reassembled PDU]"
"185","0.243625800","104.127.70.110","192.168.1.118","TCP","1514","443 → 36426 [ACK] Seq=154393 Ack=774 Win=294 Len=1448 TSval=2438037596 TSecr=4064756749 [TCP segment of a reassembled PDU]"
"186","0.243692825","192.168.1.118","104.127.70.110","TCP","66","36426 → 443 [ACK] Seq=774 Ack=155841 Win=95 Len=0 TSval=4064756783 TSecr=2438037562"
"187","0.244776775","104.127.70.110","192.168.1.118","TCP","4410","443 → 36426 [ACK] Seq=155841 Ack=774 Win=294 Len=4344 TSval=2438037596 TSecr=4064756749 [TCP segment of a reassembled PDU]"
"188","0.245953087","104.127.70.110","192.168.1.118","TLSv1.2","6479","Application Data, Application Data"
"189","0.289191737","192.168.1.118","104.127.70.110","TCP","66","36426 → 443 [ACK] Seq=774 Ack=166598 Win=11 Len=0 TSval=4064756829 TSecr=2438037596"
"190","0.315172500","104.127.70.110","192.168.1.118","TCP","1514","[TCP Spurious Retransmission] 443 → 36426 [ACK] Seq=155841 Ack=774 Win=294 Len=1448 TSval=2438037667 TSecr=4064756783[Reassembly error, protocol TCP: New fragment overlaps old data (retransmission?)]"
"191","0.315238125","192.168.1.118","104.127.70.110","TCP","78","[TCP Dup ACK 189#1] 36426 → 443 [ACK] Seq=774 Ack=166598 Win=11 Len=0 TSval=4064756855 TSecr=2438037596 SLE=155841 SRE=157289"
"192","0.359983512","192.168.1.118","104.127.70.110","TCP","66","[TCP Window Update] 36426 → 443 [ACK] Seq=774 Ack=166598 Win=867 Len=0 TSval=4064756899 TSecr=2438037596"
"193","0.362283837","192.168.1.118","104.127.70.110","TLSv1.2","834","Application Data"
"194","0.404232512","104.127.70.110","192.168.1.118","TCP","1514","[TCP segment of a reassembled PDU]"
"195","0.404310987","192.168.1.118","104.127.70.110","TCP","66","36434 → 443 [ACK] Seq=769 Ack=7881 Win=493 Len=0 TSval=4064756944 TSecr=2438037751"
"196","0.405274000","104.127.70.110","192.168.1.118","TCP","4410","443 → 36434 [ACK] Seq=7881 Ack=769 Win=259 Len=4344 TSval=2438037751 TSecr=4064756902 [TCP segment of a reassembled PDU]"
"197","0.405325025","192.168.1.118","104.127.70.110","TCP","66","36434 → 443 [ACK] Seq=769 Ack=12225 Win=460 Len=0 TSval=4064756945 TSecr=2438037751"
"198","0.419579562","104.127.70.110","192.168.1.118","TCP","1514","443 → 36434 [ACK] Seq=12225 Ack=769 Win=259 Len=1448 TSval=2438037751 TSecr=4064756902 [TCP segment of a reassembled PDU]"
"199","0.419646425","192.168.1.118","104.127.70.110","TCP","66","36434 → 443 [ACK] Seq=769 Ack=13673 Win=449 Len=0 TSval=4064756959 TSecr=2438037751"
"200","0.420375650","104.127.70.110","192.168.1.118","TCP","1514","443 → 36434 [ACK] Seq=13673 Ack=769 Win=259 Len=1448 TSval=2438037751 TSecr=4064756902 [TCP segment of a reassembled PDU]"
"201","0.420416562","192.168.1.118","104.127.70.110","TCP","66","36434 → 443 [ACK] Seq=769 Ack=15121 Win=438 Len=0 TSval=4064756960 TSecr=2438037751"
"202","0.430912437","104.127.70.110","192.168.1.118","TCP","1514","443 → 36434 [ACK] Seq=15121 Ack=769 Win=259 Len=1448 TSval=2438037757 TSecr=4064756902 [TCP segment of a reassembled PDU]"
"203","0.430982212","192.168.1.118","104.127.70.110","TCP","66","36434 → 443 [ACK] Seq=769 Ack=16569 Win=427 Len=0 TSval=4064756970 TSecr=2438037757"
"204","0.437562175","192.168.1.118","104.127.70.110","TLSv1.2","846","Application Data"
"205","0.437750050","192.168.1.118","104.127.70.110","TLSv1.2","847","Application Data"
"206","0.440168175","104.127.70.110","192.168.1.118","TCP","1514","443 → 36434 [ACK] Seq=16569 Ack=769 Win=259 Len=1448 TSval=2438037757 TSecr=4064756902 [TCP segment of a reassembled PDU]"
"207","0.440229337","192.168.1.118","104.127.70.110","TCP","66","36434 → 443 [ACK] Seq=769 Ack=18017 Win=493 Len=0 TSval=4064756980 TSecr=2438037757"
"208","0.441272137","104.127.70.110","192.168.1.118","TCP","2962","443 → 36434 [ACK] Seq=18017 Ack=769 Win=259 Len=2896 TSval=2438037770 TSecr=4064756902 [TCP segment of a reassembled PDU]"
"209","0.441329362","192.168.1.118","104.127.70.110","TCP","66","36434 → 443 [ACK] Seq=769 Ack=20913 Win=477 Len=0 TSval=4064756981 TSecr=2438037770"
"210","0.450735625","192.168.1.118","104.127.70.110","TLSv1.2","848","Application Data"
"211","0.454796062","192.168.1.118","104.127.70.110","TLSv1.2","824","Application Data"
"212","0.455219400","104.127.70.110","192.168.1.118","TCP","1514","443 → 36434 [ACK] Seq=20913 Ack=769 Win=259 Len=1448 TSval=2438037783 TSecr=4064756944 [TCP segment of a reassembled PDU]"
"213","0.455259237","192.168.1.118","104.127.70.110","TCP","66","36434 → 443 [ACK] Seq=769 Ack=22361 Win=493 Len=0 TSval=4064756995 TSecr=2438037783"
"214","0.456943762","104.127.70.110","192.168.1.118","TLSv1.2","1514","Application Data [TCP segment of a reassembled PDU]"
"215","0.457006887","192.168.1.118","104.127.70.110","TCP","66","36434 → 443 [ACK] Seq=769 Ack=23809 Win=482 Len=0 TSval=4064756996 TSecr=2438037783"
"216","0.457050012","104.127.70.110","192.168.1.118","TCP","2962","443 → 36434 [ACK] Seq=23809 Ack=769 Win=259 Len=2896 TSval=2438037793 TSecr=4064756944 [TCP segment of a reassembled PDU]"
"217","0.457065225","192.168.1.118","104.127.70.110","TCP","66","36434 → 443 [ACK] Seq=769 Ack=26705 Win=460 Len=0 TSval=4064756997 TSecr=2438037793"
"218","0.461801200","104.127.70.110","192.168.1.118","TCP","1514","443 → 36434 [ACK] Seq=26705 Ack=769 Win=259 Len=1448 TSval=2438037802 TSecr=4064756960 [TCP segment of a reassembled PDU]"
"219","0.461866325","192.168.1.118","104.127.70.110","TCP","66","36434 → 443 [ACK] Seq=769 Ack=28153 Win=493 Len=0 TSval=4064757001 TSecr=2438037802"
"220","0.462572350","104.127.70.110","192.168.1.118","TCP","1514","443 → 36434 [ACK] Seq=28153 Ack=769 Win=259 Len=1448 TSval=2438037802 TSecr=4064756960 [TCP segment of a reassembled PDU]"
"221","0.462608437","192.168.1.118","104.127.70.110","TCP","66","36434 → 443 [ACK] Seq=769 Ack=29601 Win=482 Len=0 TSval=4064757002 TSecr=2438037802"
"222","0.466536687","104.127.70.110","192.168.1.118","TCP","1514","443 → 36434 [ACK] Seq=29601 Ack=769 Win=259 Len=1448 TSval=2438037808 TSecr=4064756960 [TCP segment of a reassembled PDU]"
"223","0.466602300","192.168.1.118","104.127.70.110","TCP","66","36434 → 443 [ACK] Seq=769 Ack=31049 Win=471 Len=0 TSval=4064757006 TSecr=2438037808"
"224","0.467381675","104.127.70.110","192.168.1.118","TCP","66","443 → 36428 [ACK] Seq=39119 Ack=781 Win=260 Len=0 TSval=2438037820 TSecr=4064756977"
"225","0.467423800","104.127.70.110","192.168.1.118","TCP","1514","443 → 36434 [ACK] Seq=31049 Ack=769 Win=259 Len=1448 TSval=2438037808 TSecr=4064756960 [TCP segment of a reassembled PDU]"
"226","0.467451900","192.168.1.118","104.127.70.110","TCP","66","36434 → 443 [ACK] Seq=769 Ack=32497 Win=460 Len=0 TSval=4064757007 TSecr=2438037808"
"227","0.472062362","104.127.70.110","192.168.1.118","TCP","1514","443 → 36434 [ACK] Seq=32497 Ack=769 Win=259 Len=1448 TSval=2438037814 TSecr=4064756980 [TCP segment of a reassembled PDU]"
"228","0.472125137","192.168.1.118","104.127.70.110","TCP","66","36434 → 443 [ACK] Seq=769 Ack=33945 Win=449 Len=0 TSval=4064757012 TSecr=2438037814"
"229","0.473670062","104.127.70.110","192.168.1.118","TCP","1514","443 → 36434 [ACK] Seq=33945 Ack=769 Win=259 Len=1448 TSval=2438037814 TSecr=4064756980 [TCP segment of a reassembled PDU]"
"230","0.473729400","192.168.1.118","104.127.70.110","TCP","66","36434 → 443 [ACK] Seq=769 Ack=35393 Win=493 Len=0 TSval=4064757013 TSecr=2438037814"
"231","0.473761700","104.127.70.110","192.168.1.118","TCP","1514","[TCP segment of a reassembled PDU]"
"232","0.473779675","192.168.1.118","104.127.70.110","TCP","66","36428 → 443 [ACK] Seq=781 Ack=40567 Win=524 Len=0 TSval=4064757013 TSecr=2438037825"
"233","0.475709875","104.127.70.110","192.168.1.118","TCP","14546","443 → 36428 [ACK] Seq=40567 Ack=781 Win=260 Len=14480 TSval=2438037825 TSecr=4064756977 [TCP segment of a reassembled PDU]"
"234","0.475782925","192.168.1.118","104.127.70.110","TCP","66","36428 → 443 [ACK] Seq=781 Ack=55047 Win=750 Len=0 TSval=4064757015 TSecr=2438037825"
"235","0.475815425","104.127.70.110","192.168.1.118","TCP","2962","[TCP segment of a reassembled PDU]"
"236","0.475841500","192.168.1.118","104.127.70.110","TCP","66","36432 → 443 [ACK] Seq=1556 Ack=25796 Win=479 Len=0 TSval=4064757015 TSecr=2438037825"
"237","0.476817037","104.127.70.110","192.168.1.118","TLSv1.2","7306","Application Data [TCP segment of a reassembled PDU]"
"238","0.476874962","192.168.1.118","104.127.70.110","TCP","66","36428 → 443 [ACK] Seq=781 Ack=62287 Win=863 Len=0 TSval=4064757016 TSecr=2438037825"
"239","0.476901125","104.127.70.110","192.168.1.118","TCP","2962","443 → 36432 [ACK] Seq=25796 Ack=1556 Win=272 Len=2896 TSval=2438037825 TSecr=4064756977 [TCP segment of a reassembled PDU]"
"240","0.476920487","192.168.1.118","104.127.70.110","TCP","66","36432 → 443 [ACK] Seq=1556 Ack=28692 Win=457 Len=0 TSval=4064757016 TSecr=2438037825"
"241","0.478698800","104.127.70.110","192.168.1.118","TCP","1514","443 → 36434 [ACK] Seq=35393 Ack=769 Win=259 Len=1448 TSval=2438037819 TSecr=4064756980 [TCP segment of a reassembled PDU]"
"242","0.479964150","104.127.70.110","192.168.1.118","TCP","66","443 → 36426 [ACK] Seq=166598 Ack=1532 Win=306 Len=0 TSval=2438037831 TSecr=4064756994"
"243","0.480027925","104.127.70.110","192.168.1.118","TCP","1514","443 → 36434 [ACK] Seq=36841 Ack=769 Win=259 Len=1448 TSval=2438037819 TSecr=4064756980 [TCP segment of a reassembled PDU]"
"244","0.480042362","104.127.70.110","192.168.1.118","TCP","2962","443 → 36428 [ACK] Seq=62287 Ack=781 Win=260 Len=2896 TSval=2438037825 TSecr=4064756977 [TCP segment of a reassembled PDU]"
"245","0.480071600","192.168.1.118","104.127.70.110","TCP","66","36428 → 443 [ACK] Seq=781 Ack=65183 Win=908 Len=0 TSval=4064757020 TSecr=2438037825"
"246","0.480103625","104.127.70.110","192.168.1.118","TCP","2962","443 → 36432 [ACK] Seq=28692 Ack=1556 Win=272 Len=2896 TSval=2438037825 TSecr=4064756977 [TCP segment of a reassembled PDU]"
"247","0.480121200","192.168.1.118","104.127.70.110","TCP","66","36432 → 443 [ACK] Seq=1556 Ack=31588 Win=546 Len=0 TSval=4064757020 TSecr=2438037825"
"248","0.482081287","192.168.1.118","104.127.70.110","TCP","66","36434 → 443 [ACK] Seq=769 Ack=38289 Win=501 Len=0 TSval=4064757022 TSecr=2438037819"
"249","0.482295587","104.127.70.110","192.168.1.118","TCP","1514","443 → 36428 [ACK] Seq=65183 Ack=781 Win=260 Len=1448 TSval=2438037828 TSecr=4064756977 [TCP segment of a reassembled PDU]"
"250","0.482331375","192.168.1.118","104.127.70.110","TCP","66","36428 → 443 [ACK] Seq=781 Ack=66631 Win=931 Len=0 TSval=4064757022 TSecr=2438037828"
"251","0.483219950","104.127.70.110","192.168.1.118","TLSv1.2","113","Application Data"
"252","0.483274300","192.168.1.118","104.127.70.110","TCP","66","36428 → 443 [ACK] Seq=781 Ack=66678 Win=931 Len=0 TSval=4064757023 TSecr=2438037828"
"253","0.483324062","104.127.70.110","192.168.1.118","TLSv1.2","2962","Application Data [TCP segment of a reassembled PDU]"
"254","0.483337462","104.127.70.110","192.168.1.118","TCP","1514","443 → 36432 [ACK] Seq=31588 Ack=1556 Win=272 Len=1448 TSval=2438037827 TSecr=4064756977 [TCP segment of a reassembled PDU]"
"255","0.483352350","192.168.1.118","104.127.70.110","TCP","66","36432 → 443 [ACK] Seq=1556 Ack=33036 Win=569 Len=0 TSval=4064757023 TSecr=2438037827"
"256","0.483829325","104.127.70.110","192.168.1.118","TCP","1514","443 → 36432 [ACK] Seq=33036 Ack=1556 Win=272 Len=1448 TSval=2438037827 TSecr=4064756977 [TCP segment of a reassembled PDU]"
"257","0.483855887","192.168.1.118","104.127.70.110","TCP","66","36432 → 443 [ACK] Seq=1556 Ack=34484 Win=592 Len=0 TSval=4064757023 TSecr=2438037827"
"258","0.484544175","104.127.70.110","192.168.1.118","TCP","1514","[TCP segment of a reassembled PDU]"
"259","0.484594737","192.168.1.118","104.127.70.110","TCP","66","36426 → 443 [ACK] Seq=1532 Ack=168046 Win=890 Len=0 TSval=4064757024 TSecr=2438037837"
"260","0.485566075","104.127.70.110","192.168.1.118","TLSv1.2","2834","Application Data"
"261","0.485631612","192.168.1.118","104.127.70.110","TCP","66","36430 → 443 [ACK] Seq=1553 Ack=133087 Win=1495 Len=0 TSval=4064757025 TSecr=2438037837"
"262","0.485666212","104.127.70.110","192.168.1.118","TLSv1.2","1708","Application Data"
"263","0.485684112","192.168.1.118","104.127.70.110","TCP","66","36426 → 443 [ACK] Seq=1532 Ack=169688 Win=916 Len=0 TSval=4064757025 TSecr=2438037837"
"264","0.486379537","104.127.70.110","192.168.1.118","TLSv1.2","2962","Application Data [TCP segment of a reassembled PDU]"
"265","0.488507962","104.127.70.110","192.168.1.118","TCP","1514","443 → 36432 [ACK] Seq=34484 Ack=1556 Win=272 Len=1448 TSval=2438037832 TSecr=4064756977 [TCP segment of a reassembled PDU]"
"266","0.488572100","192.168.1.118","104.127.70.110","TCP","66","36432 → 443 [ACK] Seq=1556 Ack=35932 Win=614 Len=0 TSval=4064757028 TSecr=2438037832"
"267","0.489243525","104.127.70.110","192.168.1.118","TCP","1514","443 → 36432 [ACK] Seq=35932 Ack=1556 Win=272 Len=1448 TSval=2438037832 TSecr=4064756977 [TCP segment of a reassembled PDU]"
"268","0.489283650","192.168.1.118","104.127.70.110","TCP","66","36432 → 443 [ACK] Seq=1556 Ack=37380 Win=637 Len=0 TSval=4064757029 TSecr=2438037832"
"269","0.491207550","192.168.1.118","104.127.70.110","TCP","66","36434 → 443 [ACK] Seq=769 Ack=44081 Win=501 Len=0 TSval=4064757031 TSecr=2438037825"
"270","0.491671387","104.127.70.110","192.168.1.118","TCP","2962","443 → 36434 [ACK] Seq=44081 Ack=769 Win=259 Len=2896 TSval=2438037835 TSecr=4064757001 [TCP segment of a reassembled PDU]"
"271","0.491708725","192.168.1.118","104.127.70.110","TCP","66","36434 → 443 [ACK] Seq=769 Ack=46977 Win=546 Len=0 TSval=4064757031 TSecr=2438037835"
"272","0.491734437","104.127.70.110","192.168.1.118","TCP","2962","443 → 36434 [ACK] Seq=46977 Ack=769 Win=259 Len=2896 TSval=2438037839 TSecr=4064757001 [TCP segment of a reassembled PDU]"
"273","0.491754475","192.168.1.118","104.127.70.110","TCP","66","36434 → 443 [ACK] Seq=769 Ack=49873 Win=592 Len=0 TSval=4064757031 TSecr=2438037839"
"274","0.496957575","104.127.70.110","192.168.1.118","TLSv1.2","2962","Application Data [TCP segment of a reassembled PDU]"
"275","0.497022250","192.168.1.118","104.127.70.110","TCP","66","36432 → 443 [ACK] Seq=1556 Ack=40276 Win=682 Len=0 TSval=4064757036 TSecr=2438037836"
"276","0.497055600","104.127.70.110","192.168.1.118","TCP","1514","443 → 36434 [ACK] Seq=49873 Ack=769 Win=259 Len=1448 TSval=2438037842 TSecr=4064757013 [TCP segment of a reassembled PDU]"
"277","0.497074437","192.168.1.118","104.127.70.110","TCP","66","36434 → 443 [ACK] Seq=769 Ack=51321 Win=614 Len=0 TSval=4064757037 TSecr=2438037842"
"278","0.498591262","104.127.70.110","192.168.1.118","TCP","1514","443 → 36434 [ACK] Seq=51321 Ack=769 Win=259 Len=1448 TSval=2438037842 TSecr=4064757013 [TCP segment of a reassembled PDU]"
"279","0.498639837","192.168.1.118","104.127.70.110","TCP","66","36434 → 443 [ACK] Seq=769 Ack=52769 Win=637 Len=0 TSval=4064757038 TSecr=2438037842"
"280","0.498686712","104.127.70.110","192.168.1.118","TCP","2962","443 → 36434 [ACK] Seq=52769 Ack=769 Win=259 Len=2896 TSval=2438037844 TSecr=4064757013 [TCP segment of a reassembled PDU]"
"281","0.498706762","192.168.1.118","104.127.70.110","TCP","66","36434 → 443 [ACK] Seq=769 Ack=55665 Win=682 Len=0 TSval=4064757038 TSecr=2438037844"
"282","0.498737675","104.127.70.110","192.168.1.118","TLSv1.2","2962","Application Data [TCP segment of a reassembled PDU]"
"283","0.498753837","192.168.1.118","104.127.70.110","TCP","66","36434 → 443 [ACK] Seq=769 Ack=58561 Win=727 Len=0 TSval=4064757038 TSecr=2438037845"
"284","0.498773250","104.127.70.110","192.168.1.118","TCP","2962","443 → 36432 [ACK] Seq=40276 Ack=1556 Win=272 Len=2896 TSval=2438037840 TSecr=4064756977 [TCP segment of a reassembled PDU]"
"285","0.498789987","192.168.1.118","104.127.70.110","TCP","66","36432 → 443 [ACK] Seq=1556 Ack=43172 Win=727 Len=0 TSval=4064757038 TSecr=2438037840"
"286","0.498799637","104.127.70.110","192.168.1.118","TCP","2962","443 → 36434 [ACK] Seq=58561 Ack=769 Win=259 Len=2896 TSval=2438037847 TSecr=4064757013 [TCP segment of a reassembled PDU]"
"287","0.498813800","192.168.1.118","104.127.70.110","TCP","66","36434 → 443 [ACK] Seq=769 Ack=61457 Win=773 Len=0 TSval=4064757038 TSecr=2438037847"
"288","0.499806737","104.127.70.110","192.168.1.118","TCP","2962","443 → 36434 [ACK] Seq=61457 Ack=769 Win=259 Len=2896 TSval=2438037848 TSecr=4064757013 [TCP segment of a reassembled PDU]"
"289","0.499855862","192.168.1.118","104.127.70.110","TCP","66","36434 → 443 [ACK] Seq=769 Ack=64353 Win=818 Len=0 TSval=4064757039 TSecr=2438037848"
"290","0.499884425","104.127.70.110","192.168.1.118","TCP","1514","443 → 36434 [ACK] Seq=64353 Ack=769 Win=259 Len=1448 TSval=2438037849 TSecr=4064757013 [TCP segment of a reassembled PDU]"
"291","0.499898875","192.168.1.118","104.127.70.110","TCP","66","36434 → 443 [ACK] Seq=769 Ack=65801 Win=841 Len=0 TSval=4064757039 TSecr=2438037849"
"292","0.500798350","104.127.70.110","192.168.1.118","TCP","1514","443 → 36434 [ACK] Seq=65801 Ack=769 Win=259 Len=1448 TSval=2438037849 TSecr=4064757013 [TCP segment of a reassembled PDU]"
"293","0.500848500","192.168.1.118","104.127.70.110","TCP","66","36434 → 443 [ACK] Seq=769 Ack=67249 Win=863 Len=0 TSval=4064757040 TSecr=2438037849"
"294","0.500874387","104.127.70.110","192.168.1.118","TCP","2962","443 → 36432 [ACK] Seq=43172 Ack=1556 Win=272 Len=2896 TSval=2438037844 TSecr=4064756977 [TCP segment of a reassembled PDU]"
"295","0.500894450","192.168.1.118","104.127.70.110","TCP","66","36432 → 443 [ACK] Seq=1556 Ack=46068 Win=773 Len=0 TSval=4064757040 TSecr=2438037844"
"296","0.502722712","104.127.70.110","192.168.1.118","TCP","2962","443 → 36434 [ACK] Seq=67249 Ack=769 Win=259 Len=2896 TSval=2438037851 TSecr=4064757013 [TCP segment of a reassembled PDU]"
"297","0.502790062","192.168.1.118","104.127.70.110","TCP","66","36434 → 443 [ACK] Seq=769 Ack=70145 Win=908 Len=0 TSval=4064757042 TSecr=2438037851"
"298","0.504628025","104.127.70.110","192.168.1.118","TCP","2962","443 → 36434 [ACK] Seq=70145 Ack=769 Win=259 Len=2896 TSval=2438037852 TSecr=4064757013 [TCP segment of a reassembled PDU]"
"299","0.504684825","192.168.1.118","104.127.70.110","TCP","66","36434 → 443 [ACK] Seq=769 Ack=73041 Win=954 Len=0 TSval=4064757044 TSecr=2438037852"
"300","0.504714825","104.127.70.110","192.168.1.118","TCP","1514","443 → 36434 [ACK] Seq=73041 Ack=769 Win=259 Len=1448 TSval=2438037854 TSecr=4064757013 [TCP segment of a reassembled PDU]"
"301","0.504734450","192.168.1.118","104.127.70.110","TCP","66","36434 → 443 [ACK] Seq=769 Ack=74489 Win=976 Len=0 TSval=4064757044 TSecr=2438037854"
"302","0.507600337","104.127.70.110","192.168.1.118","TLSv1.2","1514","Application Data [TCP segment of a reassembled PDU]"
"303","0.507667625","192.168.1.118","104.127.70.110","TCP","66","36434 → 443 [ACK] Seq=769 Ack=75937 Win=999 Len=0 TSval=4064757047 TSecr=2438037854"
"304","0.507702125","104.127.70.110","192.168.1.118","TCP","2962","443 → 36432 [ACK] Seq=46068 Ack=1556 Win=272 Len=2896 TSval=2438037848 TSecr=4064756977 [TCP segment of a reassembled PDU]"
"305","0.507720137","192.168.1.118","104.127.70.110","TCP","66","36432 → 443 [ACK] Seq=1556 Ack=48964 Win=776 Len=0 TSval=4064757047 TSecr=2438037848"
"306","0.507729912","104.127.70.110","192.168.1.118","TCP","1514","443 → 36434 [ACK] Seq=75937 Ack=769 Win=259 Len=1448 TSval=2438037855 TSecr=4064757013 [TCP segment of a reassembled PDU]"
"307","0.507748150","192.168.1.118","104.127.70.110","TCP","66","36434 → 443 [ACK] Seq=769 Ack=77385 Win=1022 Len=0 TSval=4064757047 TSecr=2438037855"
"308","0.508403962","104.127.70.110","192.168.1.118","TLSv1.2","1399","Application Data"
"309","0.508450625","192.168.1.118","104.127.70.110","TCP","66","36432 → 443 [ACK] Seq=1556 Ack=50297 Win=766 Len=0 TSval=4064757048 TSecr=2438037852"
"310","0.519300500","192.168.1.118","104.127.70.110","TLSv1.2","854","Application Data"
"311","0.519554587","192.168.1.118","104.127.70.110","TLSv1.2","853","Application Data"
"312","0.519660500","192.168.1.118","104.127.70.110","TLSv1.2","844","Application Data"
"313","0.522601137","192.168.1.118","192.168.1.102","TCP","176","42902 → 8009 [PSH, ACK] Seq=1 Ack=1 Win=501 Len=110 TSval=2816412118 TSecr=5025564 [TCP segment of a reassembled PDU]"
"314","0.527063575","192.168.1.102","192.168.1.118","TCP","176","8009 → 42902 [PSH, ACK] Seq=1 Ack=111 Win=277 Len=110 TSval=5026064 TSecr=2816412118 [TCP segment of a reassembled PDU]"
"315","0.527156887","192.168.1.118","192.168.1.102","TCP","66","42902 → 8009 [ACK] Seq=111 Ack=111 Win=501 Len=0 TSval=2816412123 TSecr=5026064"
"316","0.553893425","104.127.70.110","192.168.1.118","TCP","1514","443 → 36434 [ACK] Seq=77385 Ack=769 Win=259 Len=1448 TSval=2438037906 TSecr=4064757047 [TCP segment of a reassembled PDU]"
"317","0.553958062","192.168.1.118","104.127.70.110","TCP","66","36434 → 443 [ACK] Seq=769 Ack=78833 Win=1044 Len=0 TSval=4064757093 TSecr=2438037906"
"318","0.555649975","104.127.70.110","192.168.1.118","TLSv1.2","10202","Application Data [TCP segment of a reassembled PDU]"
"319","0.555714862","192.168.1.118","104.127.70.110","TCP","66","36434 → 443 [ACK] Seq=769 Ack=88969 Win=1203 Len=0 TSval=4064757095 TSecr=2438037906"
"320","0.556425700","104.127.70.110","192.168.1.118","TCP","2962","443 → 36434 [ACK] Seq=88969 Ack=769 Win=259 Len=2896 TSval=2438037906 TSecr=4064757047 [TCP segment of a reassembled PDU]"
"321","0.556464575","192.168.1.118","104.127.70.110","TCP","66","36434 → 443 [ACK] Seq=769 Ack=91865 Win=1248 Len=0 TSval=4064757096 TSecr=2438037906"
"322","0.558296387","104.127.70.110","192.168.1.118","TCP","5858","443 → 36434 [ACK] Seq=91865 Ack=769 Win=259 Len=5792 TSval=2438037906 TSecr=4064757047 [TCP segment of a reassembled PDU]"
"323","0.558361375","192.168.1.118","104.127.70.110","TCP","66","36434 → 443 [ACK] Seq=769 Ack=97657 Win=1338 Len=0 TSval=4064757098 TSecr=2438037906"
"324","0.559443037","104.127.70.110","192.168.1.118","TLSv1.2","15994","Application Data [TCP segment of a reassembled PDU]"
"325","0.559501100","192.168.1.118","104.127.70.110","TCP","66","36434 → 443 [ACK] Seq=769 Ack=113585 Win=1587 Len=0 TSval=4064757099 TSecr=2438037906"
"326","0.559535775","104.127.70.110","192.168.1.118","TCP","1514","443 → 36434 [ACK] Seq=113585 Ack=769 Win=259 Len=1448 TSval=2438037907 TSecr=4064757047 [TCP segment of a reassembled PDU]"
"327","0.559550200","192.168.1.118","104.127.70.110","TCP","66","36434 → 443 [ACK] Seq=769 Ack=115033 Win=1610 Len=0 TSval=4064757099 TSecr=2438037907"
"328","0.561053912","104.127.70.110","192.168.1.118","TLSv1.2","6409","Application Data, Application Data"
"329","0.561114750","192.168.1.118","104.127.70.110","TCP","66","36434 → 443 [ACK] Seq=769 Ack=121376 Win=1709 Len=0 TSval=4064757101 TSecr=2438037907"
"330","0.561196325","104.127.70.110","192.168.1.118","TLSv1.2","4642","Application Data"
"331","0.561225800","192.168.1.118","104.127.70.110","TCP","66","36426 → 443 [ACK] Seq=2320 Ack=174264 Win=987 Len=0 TSval=4064757101 TSecr=2438037910"
"332","0.561241762","104.127.70.110","192.168.1.118","TLSv1.2","1194","Application Data"
"333","0.562864550","104.127.70.110","192.168.1.118","TCP","1514","[TCP segment of a reassembled PDU]"
"334","0.563384837","104.127.70.110","192.168.1.118","TLSv1.2","139","Application Data"
"335","0.563420062","192.168.1.118","104.127.70.110","TCP","66","36428 → 443 [ACK] Seq=1568 Ack=68199 Win=954 Len=0 TSval=4064757103 TSecr=2438037916"
"336","0.604197987","192.168.1.118","104.127.70.110","TCP","66","36430 → 443 [ACK] Seq=2331 Ack=134215 Win=1517 Len=0 TSval=4064757144 TSecr=2438037912"
"337","0.627828487","192.168.1.118","104.127.70.110","TLSv1.2","893","Application Data"
"338","0.668858987","192.168.1.118","104.127.70.110","TLSv1.2","832","Application Data"
"339","0.679462075","104.127.70.110","192.168.1.118","TLSv1.2","441","Application Data"
"340","0.694571100","104.127.70.110","192.168.1.118","TCP","1514","[TCP segment of a reassembled PDU]"
"341","0.697588262","104.127.70.110","192.168.1.118","TCP","2962","443 → 36428 [ACK] Seq=69647 Ack=2334 Win=285 Len=2896 TSval=2438038047 TSecr=4064757208 [TCP segment of a reassembled PDU]"
"342","0.697656862","192.168.1.118","104.127.70.110","TCP","66","36428 → 443 [ACK] Seq=2334 Ack=72543 Win=1022 Len=0 TSval=4064757237 TSecr=2438038047"
"343","0.698845775","104.127.70.110","192.168.1.118","TCP","2962","443 → 36428 [ACK] Seq=72543 Ack=2334 Win=285 Len=2896 TSval=2438038047 TSecr=4064757208 [TCP segment of a reassembled PDU]"
"344","0.698901425","192.168.1.118","104.127.70.110","TCP","66","36428 → 443 [ACK] Seq=2334 Ack=75439 Win=1067 Len=0 TSval=4064757238 TSecr=2438038047"
"345","0.700819950","104.127.70.110","192.168.1.118","TCP","1514","443 → 36428 [ACK] Seq=75439 Ack=2334 Win=285 Len=1448 TSval=2438038047 TSecr=4064757208 [TCP segment of a reassembled PDU]"
"346","0.700875675","104.127.70.110","192.168.1.118","TCP","2962","443 → 36428 [ACK] Seq=76887 Ack=2334 Win=285 Len=2896 TSval=2438038048 TSecr=4064757208 [TCP segment of a reassembled PDU]"
"347","0.700908375","192.168.1.118","104.127.70.110","TCP","66","36428 → 443 [ACK] Seq=2334 Ack=79783 Win=1135 Len=0 TSval=4064757240 TSecr=2438038047"
"348","0.702232525","104.127.70.110","192.168.1.118","TCP","2962","443 → 36428 [ACK] Seq=79783 Ack=2334 Win=285 Len=2896 TSval=2438038049 TSecr=4064757208 [TCP segment of a reassembled PDU]"
"349","0.702290787","192.168.1.118","104.127.70.110","TCP","66","36428 → 443 [ACK] Seq=2334 Ack=82679 Win=1180 Len=0 TSval=4064757242 TSecr=2438038049"
"350","0.702333037","104.127.70.110","192.168.1.118","TLSv1.2","2962","Application Data [TCP segment of a reassembled PDU]"
"351","0.702352012","192.168.1.118","104.127.70.110","TCP","66","36428 → 443 [ACK] Seq=2334 Ack=85575 Win=1225 Len=0 TSval=4064757242 TSecr=2438038050"
"352","0.702369850","104.127.70.110","192.168.1.118","TCP","2962","443 → 36428 [ACK] Seq=85575 Ack=2334 Win=285 Len=2896 TSval=2438038051 TSecr=4064757208 [TCP segment of a reassembled PDU]"
"353","0.702385787","192.168.1.118","104.127.70.110","TCP","66","36428 → 443 [ACK] Seq=2334 Ack=88471 Win=1270 Len=0 TSval=4064757242 TSecr=2438038051"
"354","0.703617037","104.127.70.110","192.168.1.118","TCP","2962","443 → 36428 [ACK] Seq=88471 Ack=2334 Win=285 Len=2896 TSval=2438038053 TSecr=4064757208 [TCP segment of a reassembled PDU]"
"355","0.703680887","192.168.1.118","104.127.70.110","TCP","66","36428 → 443 [ACK] Seq=2334 Ack=91367 Win=1316 Len=0 TSval=4064757243 TSecr=2438038053"
"356","0.704926487","104.127.70.110","192.168.1.118","TCP","2962","443 → 36428 [ACK] Seq=91367 Ack=2334 Win=285 Len=2896 TSval=2438038054 TSecr=4064757208 [TCP segment of a reassembled PDU]"
"357","0.704986787","192.168.1.118","104.127.70.110","TCP","66","36428 → 443 [ACK] Seq=2334 Ack=94263 Win=1361 Len=0 TSval=4064757244 TSecr=2438038054"
"358","0.705020287","104.127.70.110","192.168.1.118","TCP","1514","443 → 36428 [ACK] Seq=94263 Ack=2334 Win=285 Len=1448 TSval=2438038055 TSecr=4064757208 [TCP segment of a reassembled PDU]"
"359","0.705806150","104.127.70.110","192.168.1.118","TCP","1514","443 → 36428 [ACK] Seq=95711 Ack=2334 Win=285 Len=1448 TSval=2438038055 TSecr=4064757208 [TCP segment of a reassembled PDU]"
"360","0.705841062","192.168.1.118","104.127.70.110","TCP","66","36428 → 443 [ACK] Seq=2334 Ack=97159 Win=1406 Len=0 TSval=4064757245 TSecr=2438038055"
"361","0.705894887","104.127.70.110","192.168.1.118","TCP","1514","443 → 36428 [ACK] Seq=97159 Ack=2334 Win=285 Len=1448 TSval=2438038056 TSecr=4064757208 [TCP segment of a reassembled PDU]"
"362","0.706657300","104.127.70.110","192.168.1.118","TCP","1514","443 → 36428 [ACK] Seq=98607 Ack=2334 Win=285 Len=1448 TSval=2438038056 TSecr=4064757208 [TCP segment of a reassembled PDU]"
"363","0.706704500","192.168.1.118","104.127.70.110","TCP","66","36428 → 443 [ACK] Seq=2334 Ack=100055 Win=1451 Len=0 TSval=4064757246 TSecr=2438038056"
"364","0.706734537","104.127.70.110","192.168.1.118","TLSv1.2","1514","Application Data [TCP segment of a reassembled PDU]"
"365","0.707408900","104.127.70.110","192.168.1.118","TCP","1514","443 → 36428 [ACK] Seq=101503 Ack=2334 Win=285 Len=1448 TSval=2438038057 TSecr=4064757208 [TCP segment of a reassembled PDU]"
"366","0.707445562","192.168.1.118","104.127.70.110","TCP","66","36428 → 443 [ACK] Seq=2334 Ack=102951 Win=1497 Len=0 TSval=4064757247 TSecr=2438038057"
"367","0.712580725","104.127.70.110","192.168.1.118","TCP","1514","443 → 36428 [ACK] Seq=102951 Ack=2334 Win=285 Len=1448 TSval=2438038058 TSecr=4064757208 [TCP segment of a reassembled PDU]"
"368","0.714719750","104.127.70.110","192.168.1.118","TCP","1514","443 → 36428 [ACK] Seq=104399 Ack=2334 Win=285 Len=1448 TSval=2438038058 TSecr=4064757208 [TCP segment of a reassembled PDU]"
"369","0.714772725","104.127.70.110","192.168.1.118","TCP","2962","443 → 36428 [ACK] Seq=105847 Ack=2334 Win=285 Len=2896 TSval=2438038059 TSecr=4064757208 [TCP segment of a reassembled PDU]"
"370","0.714781262","104.127.70.110","192.168.1.118","TCP","1514","443 → 36428 [ACK] Seq=108743 Ack=2334 Win=285 Len=1448 TSval=2438038060 TSecr=4064757208 [TCP segment of a reassembled PDU]"
"371","0.714840262","104.127.70.110","192.168.1.118","TCP","1514","443 → 36428 [ACK] Seq=110191 Ack=2334 Win=285 Len=1448 TSval=2438038060 TSecr=4064757208 [TCP segment of a reassembled PDU]"
"372","0.714861500","104.127.70.110","192.168.1.118","TCP","2962","443 → 36428 [ACK] Seq=111639 Ack=2334 Win=285 Len=2896 TSval=2438038062 TSecr=4064757208 [TCP segment of a reassembled PDU]"
"373","0.714884975","104.127.70.110","192.168.1.118","TLSv1.2","2962","Application Data [TCP segment of a reassembled PDU]"
"374","0.720200562","192.168.1.118","104.127.70.110","TCP","66","36426 → 443 [ACK] Seq=3147 Ack=174639 Win=1010 Len=0 TSval=4064757260 TSecr=2438038033"
"375","0.721191537","192.168.1.118","104.127.70.110","TCP","66","36428 → 443 [ACK] Seq=2334 Ack=105847 Win=1542 Len=0 TSval=4064757261 TSecr=2438038058"
"376","0.721231750","192.168.1.118","104.127.70.110","TCP","66","36428 → 443 [ACK] Seq=2334 Ack=108743 Win=1587 Len=0 TSval=4064757261 TSecr=2438038059"
"377","0.721251737","192.168.1.118","104.127.70.110","TCP","66","36428 → 443 [ACK] Seq=2334 Ack=111639 Win=1632 Len=0 TSval=4064757261 TSecr=2438038060"
"378","0.721268850","192.168.1.118","104.127.70.110","TCP","66","36428 → 443 [ACK] Seq=2334 Ack=114535 Win=1678 Len=0 TSval=4064757261 TSecr=2438038062"
"379","0.721286425","192.168.1.118","104.127.70.110","TCP","66","36428 → 443 [ACK] Seq=2334 Ack=117431 Win=1723 Len=0 TSval=4064757261 TSecr=2438038063"
"380","0.746153587","104.127.70.110","192.168.1.118","TCP","1514","443 → 36428 [ACK] Seq=117431 Ack=2334 Win=285 Len=1448 TSval=2438038099 TSecr=4064757237 [TCP segment of a reassembled PDU]"
"381","0.747016712","104.127.70.110","192.168.1.118","TCP","4410","443 → 36428 [ACK] Seq=118879 Ack=2334 Win=285 Len=4344 TSval=2438038099 TSecr=4064757237 [TCP segment of a reassembled PDU]"
"382","0.747072250","192.168.1.118","104.127.70.110","TCP","66","36428 → 443 [ACK] Seq=2334 Ack=123223 Win=1813 Len=0 TSval=4064757287 TSecr=2438038099"
"383","0.748464750","104.127.70.110","192.168.1.118","TLSv1.2","7519","Application Data"
"384","0.748515800","192.168.1.118","104.127.70.110","TCP","66","36428 → 443 [ACK] Seq=2334 Ack=130676 Win=1930 Len=0 TSval=4064757288 TSecr=2438038099"
"385","1.031682787","192.168.1.104","255.255.255.255","UDP","217","49154 → 6666 Len=175"
"386","1.445238850","192.168.1.118","209.18.47.62","DNS","75","Standard query 0xab44 A www.youtube.com"
"387","1.445456875","192.168.1.118","209.18.47.62","DNS","84","Standard query 0x4bee A www.googletagmanager.com"
"388","1.467005400","209.18.47.62","192.168.1.118","DNS","144","Standard query response 0x4bee A www.googletagmanager.com CNAME www-googletagmanager.l.google.com A 172.217.12.200"
"389","1.468455412","209.18.47.62","192.168.1.118","DNS","333","Standard query response 0xab44 A www.youtube.com CNAME youtube-ui.l.google.com A 172.217.9.238 A 172.217.10.14 A 172.217.10.46 A 172.217.10.110 A 172.217.10.142 A 172.217.3.110 A 172.217.12.142 A 142.250.64.78 A 172.217.6.238 A 172.217.10.238 A 172.217.11.46 A 172.217.12.174 A 172.217.12.206 A 142.250.64.110"
"390","1.474835987","192.168.1.118","209.18.47.62","DNS","84","Standard query 0x938d AAAA www.googletagmanager.com"
"391","1.474929987","192.168.1.118","209.18.47.62","DNS","75","Standard query 0x8f44 AAAA www.youtube.com"
"392","1.491548350","209.18.47.62","192.168.1.118","DNS","156","Standard query response 0x938d AAAA www.googletagmanager.com CNAME www-googletagmanager.l.google.com AAAA 2607:f8b0:4006:81b::2008"
"393","1.492188037","209.18.47.62","192.168.1.118","DNS","137","Standard query response 0x8f44 AAAA www.youtube.com CNAME youtube-ui.l.google.com AAAA 2607:f8b0:4006:818::200e"
"394","1.543307525","192.168.1.119","224.0.0.251","MDNS","157","Standard query 0x0000 PTR _homekit._tcp.local, "QU" question PTR _companion-link._tcp.local, "QU" question PTR _airplay._tcp.local, "QU" question PTR _raop._tcp.local, "QU" question OPT"
"395","1.545643700","fe80::1044:3da9:1707:700c","ff02::fb","MDNS","177","Standard query 0x0000 PTR _homekit._tcp.local, "QU" question PTR _companion-link._tcp.local, "QU" question PTR _airplay._tcp.local, "QU" question PTR _raop._tcp.local, "QU" question OPT"
"396","1.759499925","192.168.1.118","172.217.9.238","TCP","74","42104 → 443 [SYN] Seq=0 Win=64240 Len=0 MSS=1460 SACK_PERM=1 TSval=1423743644 TSecr=0 WS=128"
"397","1.759636400","192.168.1.118","172.217.12.200","TCP","74","43478 → 443 [SYN] Seq=0 Win=64240 Len=0 MSS=1460 SACK_PERM=1 TSval=1613382894 TSecr=0 WS=128"
"398","1.796986300","172.217.12.200","192.168.1.118","TCP","74","443 → 43478 [SYN, ACK] Seq=0 Ack=1 Win=60192 Len=0 MSS=1380 SACK_PERM=1 TSval=2298399385 TSecr=1613382894 WS=256"
"399","1.797080250","192.168.1.118","172.217.12.200","TCP","66","43478 → 443 [ACK] Seq=1 Ack=1 Win=64256 Len=0 TSval=1613382932 TSecr=2298399385"
"400","1.798370562","172.217.9.238","192.168.1.118","TCP","74","443 → 42104 [SYN, ACK] Seq=0 Ack=1 Win=60192 Len=0 MSS=1380 SACK_PERM=1 TSval=3042465676 TSecr=1423743644 WS=256"
"401","1.798446275","192.168.1.118","172.217.9.238","TCP","66","42104 → 443 [ACK] Seq=1 Ack=1 Win=64256 Len=0 TSval=1423743683 TSecr=3042465676"
"402","1.925246537","192.168.1.118","172.217.9.238","TLSv1","583","Client Hello"
"403","1.931267887","Cisco-Li_5b:1c:ce","IntelCor_b7:52:73","ARP","42","Who has 192.168.1.118? Tell 192.168.1.1"
"404","1.931300087","IntelCor_b7:52:73","Cisco-Li_5b:1c:ce","ARP","42","192.168.1.118 is at dc:fb:48:b7:52:73"
"405","1.968061687","192.168.1.118","172.217.12.200","TLSv1","583","Client Hello"
"406","1.999842625","172.217.9.238","192.168.1.118","TCP","66","443 → 42104 [ACK] Seq=1 Ack=518 Win=61440 Len=0 TSval=3042465842 TSecr=1423743810"
"407","2.000755975","172.217.9.238","192.168.1.118","TLSv1.2","3842","Server Hello, Certificate, Server Key Exchange, Server Hello Done"
"408","2.000809912","192.168.1.118","172.217.9.238","TCP","66","42104 → 443 [ACK] Seq=518 Ack=3777 Win=60544 Len=0 TSval=1423743885 TSecr=3042465848"
"409","2.006020450","192.168.1.118","172.217.9.238","TLSv1.2","192","Client Key Exchange, Change Cipher Spec, Encrypted Handshake Message"
"410","2.019480212","172.217.9.238","192.168.1.118","TLSv1.2","1006","[TCP Spurious Retransmission] , Ignored Unknown Record"
"411","2.019546012","192.168.1.118","172.217.9.238","TCP","78","[TCP Dup ACK 408#1] 42104 → 443 [ACK] Seq=644 Ack=3777 Win=64128 Len=0 TSval=1423743904 TSecr=3042465896 SLE=2837 SRE=3777"
"412","2.023746437","172.217.12.200","192.168.1.118","TCP","66","443 → 43478 [ACK] Seq=1 Ack=518 Win=61440 Len=0 TSval=2298399609 TSecr=1613383103"
"413","2.030107387","172.217.12.200","192.168.1.118","TLSv1.2","1484","Server Hello"
"414","2.030208212","192.168.1.118","172.217.12.200","TCP","66","43478 → 443 [ACK] Seq=518 Ack=1419 Win=63104 Len=0 TSval=1613383165 TSecr=2298399615"
"415","2.031039437","172.217.12.200","192.168.1.118","TLSv1.2","1521","Certificate, Server Key Exchange, Server Hello Done"
"416","2.031077125","192.168.1.118","172.217.12.200","TCP","66","43478 → 443 [ACK] Seq=518 Ack=2874 Win=61696 Len=0 TSval=1613383166 TSecr=2298399615"
"417","2.040955437","192.168.1.118","172.217.12.200","TLSv1.2","192","Client Key Exchange, Change Cipher Spec, Encrypted Handshake Message"
"418","2.047124700","172.217.9.238","192.168.1.118","TLSv1.2","117","Change Cipher Spec, Encrypted Handshake Message"
"419","2.047209412","192.168.1.118","172.217.9.238","TCP","66","42104 → 443 [ACK] Seq=644 Ack=3828 Win=64128 Len=0 TSval=1423743932 TSecr=3042465912"
"420","2.049546050","192.168.1.118","172.217.9.238","TLSv1.2","278","Application Data"
"421","2.075571487","172.217.12.200","192.168.1.118","TLSv1.2","103","[TCP Spurious Retransmission] , Ignored Unknown Record"
"422","2.075641362","192.168.1.118","172.217.12.200","TCP","78","[TCP Dup ACK 416#1] 43478 → 443 [ACK] Seq=644 Ack=2874 Win=64128 Len=0 TSval=1613383210 TSecr=2298399663 SLE=2837 SRE=2874"
"423","2.101760325","172.217.12.200","192.168.1.118","TLSv1.2","117","Change Cipher Spec, Encrypted Handshake Message"
"424","2.101835000","192.168.1.118","172.217.12.200","TCP","66","43478 → 443 [ACK] Seq=644 Ack=2925 Win=64128 Len=0 TSval=1613383236 TSecr=2298399690"
"425","2.107518825","192.168.1.118","172.217.12.200","TLSv1.2","267","Application Data"
"426","2.107714487","172.217.9.238","192.168.1.118","TCP","66","443 → 42104 [ACK] Seq=3828 Ack=856 Win=62464 Len=0 TSval=3042465986 TSecr=1423743934"
"427","2.127740550","172.217.12.200","192.168.1.118","TCP","66","443 → 43478 [ACK] Seq=2925 Ack=845 Win=62464 Len=0 TSval=2298399716 TSecr=1613383242"
"428","2.138842400","172.217.12.200","192.168.1.118","TLSv1.2","878","Application Data"
"429","2.139367450","172.217.12.200","192.168.1.118","TLSv1.2","100","Application Data"
"430","2.139653462","192.168.1.118","172.217.12.200","TCP","66","43478 → 443 [ACK] Seq=845 Ack=3771 Win=64128 Len=0 TSval=1613383274 TSecr=2298399727"
"431","2.362938587","172.217.9.238","192.168.1.118","TLSv1.2","1484","Application Data"
"432","2.364486750","172.217.9.238","192.168.1.118","TLSv1.2","2902","Application Data, Application Data"
"433","2.364544962","172.217.9.238","192.168.1.118","TLSv1.2","2902","Application Data, Application Data"
"434","2.364567912","172.217.9.238","192.168.1.118","TLSv1.2","2902","Application Data, Application Data"
"435","2.364588687","172.217.9.238","192.168.1.118","TLSv1.2","2902","Application Data, Application Data"
"436","2.364597812","172.217.9.238","192.168.1.118","TLSv1.2","259","Application Data, Application Data"
"437","2.364609537","172.217.9.238","192.168.1.118","TLSv1.2","100","Application Data"
"438","2.364621437","172.217.9.238","192.168.1.118","TCP","100","[TCP Retransmission] 443 → 42104 [PSH, ACK] Seq=16783 Ack=856 Win=62464 Len=34 TSval=3042466218 TSecr=1423743934"
"439","2.364653075","192.168.1.118","172.217.9.238","TCP","78","42104 → 443 [ACK] Seq=856 Ack=16817 Win=51200 Len=0 TSval=1423744249 TSecr=3042466142 SLE=16783 SRE=16817"
"440","2.378070250","192.168.1.118","172.217.9.238","TCP","74","42108 → 443 [SYN] Seq=0 Win=64240 Len=0 MSS=1460 SACK_PERM=1 TSval=1423744263 TSecr=0 WS=128"
"441","2.396541587","172.217.9.238","192.168.1.118","TCP","74","443 → 42108 [SYN, ACK] Seq=0 Ack=1 Win=60192 Len=0 MSS=1380 SACK_PERM=1 TSval=742601174 TSecr=1423744263 WS=256"
"442","2.396637337","192.168.1.118","172.217.9.238","TCP","66","42108 → 443 [ACK] Seq=1 Ack=1 Win=64256 Len=0 TSval=1423744281 TSecr=742601174"
"443","2.448148962","192.168.1.118","172.217.9.238","TLSv1","583","Client Hello"
"444","2.507524862","172.217.9.238","192.168.1.118","TCP","66","443 → 42108 [ACK] Seq=1 Ack=518 Win=61440 Len=0 TSval=742601285 TSecr=1423744333"
"445","2.514047825","172.217.9.238","192.168.1.118","TLSv1.2","1484","Server Hello"
"446","2.514115012","192.168.1.118","172.217.9.238","TCP","66","42108 → 443 [ACK] Seq=518 Ack=1419 Win=63104 Len=0 TSval=1423744399 TSecr=742601291"
"447","2.514923137","172.217.9.238","192.168.1.118","TLSv1.2","2424","Certificate, Server Key Exchange, Server Hello Done"
"448","2.514979350","192.168.1.118","172.217.9.238","TCP","66","42108 → 443 [ACK] Seq=518 Ack=3777 Win=60800 Len=0 TSval=1423744399 TSecr=742601291"
"449","2.521453337","192.168.1.118","172.217.9.238","TLSv1.2","192","Client Key Exchange, Change Cipher Spec, Encrypted Handshake Message"
"450","2.545073175","172.217.9.238","192.168.1.118","TLSv1.2","117","Change Cipher Spec, Encrypted Handshake Message"
"451","2.549900925","192.168.1.118","172.217.9.238","TLSv1.2","314","Application Data"
"452","2.569170287","192.168.1.119","224.0.0.251","MDNS","176","Standard query 0x0000 PTR _homekit._tcp.local, "QM" question PTR _companion-link._tcp.local, "QM" question PTR _airplay._tcp.local, "QM" question PTR _raop._tcp.local, "QM" question PTR cjqg._companion-link._tcp.local OPT"
"453","2.571607150","fe80::1044:3da9:1707:700c","ff02::fb","MDNS","196","Standard query 0x0000 PTR _homekit._tcp.local, "QM" question PTR _companion-link._tcp.local, "QM" question PTR _airplay._tcp.local, "QM" question PTR _raop._tcp.local, "QM" question PTR cjqg._companion-link._tcp.local OPT"
"454","2.576586100","172.217.9.238","192.168.1.118","TLSv1.2","1484","Application Data"
"455","2.578118275","172.217.9.238","192.168.1.118","TLSv1.2","2902","Application Data, Application Data"
"456","2.578201737","172.217.9.238","192.168.1.118","TLSv1.2","5738","Application Data, Application Data, Application Data, Application Data"
"457","2.578233737","172.217.9.238","192.168.1.118","TLSv1.2","2902","Application Data, Application Data"
"458","2.578592737","192.168.1.118","172.217.9.238","TCP","66","42108 → 443 [ACK] Seq=892 Ack=16590 Win=51456 Len=0 TSval=1423744463 TSecr=742601347"
"459","2.583612112","172.217.9.238","192.168.1.118","TLSv1.2","2902","Application Data, Application Data"
"460","2.583715575","192.168.1.118","172.217.9.238","TCP","66","42108 → 443 [ACK] Seq=892 Ack=19426 Win=48640 Len=0 TSval=1423744468 TSecr=742601354"
"461","2.584226787","172.217.9.238","192.168.1.118","TLSv1.2","2902","Application Data, Application Data"
"462","2.585311862","192.168.1.118","172.217.9.238","TCP","66","42108 → 443 [ACK] Seq=892 Ack=22262 Win=45824 Len=0 TSval=1423744470 TSecr=742601358"
"463","2.586025700","172.217.9.238","192.168.1.118","TLSv1.2","1484","Application Data"
"464","2.615643637","172.217.9.238","192.168.1.118","TLSv1.2","1484","Application Data"
"465","2.615707875","192.168.1.118","172.217.9.238","TCP","66","42108 → 443 [ACK] Seq=892 Ack=25098 Win=63104 Len=0 TSval=1423744500 TSecr=742601362"
"466","2.616151550","172.217.9.238","192.168.1.118","TLSv1.2","1484","Application Data"
"467","2.617334787","172.217.9.238","192.168.1.118","TLSv1.2","1484","Application Data"
"468","2.618352737","172.217.9.238","192.168.1.118","TLSv1.2","1484","Application Data"
"469","2.618445037","192.168.1.118","172.217.9.238","TCP","66","42108 → 443 [ACK] Seq=892 Ack=29352 Win=64128 Len=0 TSval=1423744503 TSecr=742601393"
"470","2.620446300","172.217.9.238","192.168.1.118","TLSv1.2","1484","Application Data"
"471","2.622114637","172.217.9.238","192.168.1.118","TLSv1.2","1484","Application Data"
"472","2.622192112","192.168.1.118","172.217.9.238","TCP","66","42108 → 443 [ACK] Seq=892 Ack=32188 Win=69760 Len=0 TSval=1423744507 TSecr=742601397"
"473","2.623335287","172.217.9.238","192.168.1.118","TLSv1.2","1484","Application Data"
"474","2.624861837","172.217.9.238","192.168.1.118","TLSv1.2","1484","Application Data"
"475","2.624920975","192.168.1.118","172.217.9.238","TCP","66","42108 → 443 [ACK] Seq=892 Ack=35024 Win=75520 Len=0 TSval=1423744509 TSecr=742601400"
"476","2.627489125","172.217.9.238","192.168.1.118","TLSv1.2","2902","Application Data, Application Data"
"477","2.627553350","192.168.1.118","172.217.9.238","TCP","66","42108 → 443 [ACK] Seq=892 Ack=37860 Win=81152 Len=0 TSval=1423744512 TSecr=742601402"
"478","2.628317287","172.217.9.238","192.168.1.118","TLSv1.2","2902","Application Data, Application Data"
"479","2.628358137","192.168.1.118","172.217.9.238","TCP","66","42108 → 443 [ACK] Seq=892 Ack=40696 Win=86784 Len=0 TSval=1423744513 TSecr=742601404"
"480","2.629766412","172.217.9.238","192.168.1.118","TLSv1.2","1484","Application Data [TCP segment of a reassembled PDU]"
"481","2.630530750","172.217.9.238","192.168.1.118","TLSv1.2","1484","Application Data [TCP segment of a reassembled PDU]"
"482","2.630577050","192.168.1.118","172.217.9.238","TCP","66","42108 → 443 [ACK] Seq=892 Ack=43532 Win=89344 Len=0 TSval=1423744515 TSecr=742601407"
"483","2.632415025","172.217.9.238","192.168.1.118","TLSv1.2","1484","Application Data [TCP segment of a reassembled PDU]"
"484","2.632870062","172.217.9.238","192.168.1.118","TLSv1.2","1484","Application Data [TCP segment of a reassembled PDU]"
"485","2.634834050","172.217.9.238","192.168.1.118","TLSv1.2","1484","Application Data [TCP segment of a reassembled PDU]"
"486","2.635368937","172.217.9.238","192.168.1.118","TLSv1.2","1484","Application Data [TCP segment of a reassembled PDU]"
"487","2.637428312","172.217.9.238","192.168.1.118","TLSv1.2","1484","Application Data [TCP segment of a reassembled PDU]"
"488","2.638028800","172.217.9.238","192.168.1.118","TLSv1.2","1484","Application Data [TCP segment of a reassembled PDU]"
"489","2.638845250","192.168.1.118","172.217.9.238","TCP","66","42108 → 443 [ACK] Seq=892 Ack=52040 Win=80896 Len=0 TSval=1423744523 TSecr=742601409"
"490","2.642195062","172.217.9.238","192.168.1.118","TLSv1.2","1484","Application Data [TCP segment of a reassembled PDU]"
"491","2.643692625","172.217.9.238","192.168.1.118","TLSv1.2","2902","Application Data, Application Data"
"492","2.644468100","172.217.9.238","192.168.1.118","TLSv1.2","2902","Application Data, Application Data"
"493","2.644935800","192.168.1.118","172.217.9.238","TCP","66","42108 → 443 [ACK] Seq=892 Ack=59130 Win=73856 Len=0 TSval=1423744529 TSecr=742601417"
"494","2.645752687","172.217.9.238","192.168.1.118","TLSv1.2","1484","Application Data [TCP segment of a reassembled PDU]"
"495","2.646370275","172.217.9.238","192.168.1.118","TLSv1.2","1484","Application Data [TCP segment of a reassembled PDU]"
"496","2.646668412","192.168.1.118","172.217.9.238","TCP","66","42108 → 443 [ACK] Seq=892 Ack=61966 Win=71040 Len=0 TSval=1423744531 TSecr=742601423"
"497","2.648231037","172.217.9.238","192.168.1.118","TLSv1.2","1484","Application Data [TCP segment of a reassembled PDU]"
"498","2.648889700","172.217.9.238","192.168.1.118","TLSv1.2","1484","Application Data [TCP segment of a reassembled PDU]"
"499","2.650908287","172.217.9.238","192.168.1.118","TLSv1.2","1484","Application Data [TCP segment of a reassembled PDU]"
"500","2.651515612","192.168.1.118","172.217.9.238","TCP","66","42108 → 443 [ACK] Seq=892 Ack=66220 Win=66816 Len=0 TSval=1423744536 TSecr=742601425"
"501","2.651539962","172.217.9.238","192.168.1.118","TLSv1.2","1484","Application Data [TCP segment of a reassembled PDU]"
"502","2.652816700","172.217.9.238","192.168.1.118","TLSv1.2","1484","Application Data [TCP segment of a reassembled PDU]"
"503","2.653421987","192.168.1.118","172.217.9.238","TCP","66","42108 → 443 [ACK] Seq=892 Ack=69056 Win=64000 Len=0 TSval=1423744538 TSecr=742601428"
"504","2.653500062","172.217.9.238","192.168.1.118","TLSv1.2","1484","Application Data [TCP segment of a reassembled PDU]"
"505","2.655105725","172.217.9.238","192.168.1.118","TLSv1.2","1484","Application Data, Application Data"
"506","2.655189175","192.168.1.118","172.217.9.238","TCP","66","42108 → 443 [ACK] Seq=892 Ack=71892 Win=83200 Len=0 TSval=1423744540 TSecr=742601430"
"507","2.657618962","172.217.9.238","192.168.1.118","TLSv1.2","1484","Application Data [TCP segment of a reassembled PDU]"
"508","2.659948700","172.217.9.238","192.168.1.118","TLSv1.2","2902","Application Data, Application Data"
"509","2.660559800","192.168.1.118","172.217.9.238","TCP","66","42108 → 443 [ACK] Seq=892 Ack=76146 Win=78976 Len=0 TSval=1423744545 TSecr=742601432"
"510","2.669476250","172.217.9.238","192.168.1.118","TLSv1.2","2902","Application Data, Application Data"
"511","2.669535850","172.217.9.238","192.168.1.118","TLSv1.2","2902","Application Data, Application Data"
"512","2.670160300","192.168.1.118","172.217.9.238","TCP","66","42108 → 443 [ACK] Seq=892 Ack=81818 Win=73344 Len=0 TSval=1423744555 TSecr=742601436"
"513","2.672189250","172.217.9.238","192.168.1.118","TLSv1.2","2902","Application Data, Application Data"
"514","2.672257000","192.168.1.118","172.217.9.238","TCP","66","42108 → 443 [ACK] Seq=892 Ack=84654 Win=95360 Len=0 TSval=1423744557 TSecr=742601438"
"515","2.672305512","172.217.9.238","192.168.1.118","TLSv1.2","2902","Application Data, Application Data"
"516","2.672354762","172.217.9.238","192.168.1.118","TLSv1.2","2902","Application Data, Application Data"
"517","2.672375875","172.217.9.238","192.168.1.118","TLSv1.2","2902","Application Data, Application Data"
"518","2.672396687","172.217.9.238","192.168.1.118","TLSv1.2","2902","Application Data, Application Data"
"519","2.672416962","172.217.9.238","192.168.1.118","TLSv1.2","2902","Application Data, Application Data"
"520","2.672465800","172.217.9.238","192.168.1.118","TLSv1.2","5738","Application Data, Application Data, Application Data, Application Data"
"521","2.672520412","192.168.1.118","172.217.9.238","TCP","66","42108 → 443 [ACK] Seq=892 Ack=98834 Win=81280 Len=0 TSval=1423744557 TSecr=742601439"
"522","2.672584687","192.168.1.118","172.217.9.238","TCP","66","42108 → 443 [ACK] Seq=892 Ack=104506 Win=75648 Len=0 TSval=1423744557 TSecr=742601443"
"523","2.674782275","172.217.9.238","192.168.1.118","TLSv1.2","2902","Application Data, Application Data"
"524","2.674845462","172.217.9.238","192.168.1.118","TLSv1.2","2902","Application Data, Application Data"
"525","2.674902275","172.217.9.238","192.168.1.118","TLSv1.2","2902","Application Data, Application Data"
"526","2.674929112","172.217.9.238","192.168.1.118","TLSv1.2","2902","Application Data, Application Data"
"527","2.675838887","172.217.9.238","192.168.1.118","TLSv1.2","2902","Application Data, Application Data"
"528","2.675880587","172.217.9.238","192.168.1.118","TLSv1.2","2902","Application Data, Application Data"
"529","2.675897087","172.217.9.238","192.168.1.118","TLSv1.2","2902","Application Data, Application Data"
"530","2.677232575","172.217.9.238","192.168.1.118","TLSv1.2","2902","Application Data, Application Data"
"531","2.677301787","172.217.9.238","192.168.1.118","TLSv1.2","2902","Application Data, Application Data"
"532","2.677320187","172.217.9.238","192.168.1.118","TLSv1.2","2902","Application Data, Application Data"
"533","2.681492175","192.168.1.118","172.217.9.238","TCP","66","42108 → 443 [ACK] Seq=892 Ack=132866 Win=95360 Len=0 TSval=1423744566 TSecr=742601444"
"534","2.703314187","172.217.9.238","192.168.1.118","TLSv1.2","1484","Application Data [TCP segment of a reassembled PDU]"
"535","2.704315512","172.217.9.238","192.168.1.118","TLSv1.2","4320","Application Data, Application Data, Application Data, Application Data"
"536","2.704346262","172.217.9.238","192.168.1.118","TLSv1.2","1484","Application Data [TCP segment of a reassembled PDU]"
"537","2.704397250","192.168.1.118","172.217.9.238","TCP","66","42108 → 443 [ACK] Seq=892 Ack=138538 Win=106752 Len=0 TSval=1423744589 TSecr=742601479"
"538","2.705118350","172.217.9.238","192.168.1.118","TLSv1.2","1484","Application Data [TCP segment of a reassembled PDU]"
"539","2.705192337","192.168.1.118","172.217.9.238","TCP","66","42108 → 443 [ACK] Seq=892 Ack=141374 Win=112384 Len=0 TSval=1423744590 TSecr=742601480"
"540","2.705242975","172.217.9.238","192.168.1.118","TLSv1.2","4320","Application Data, Application Data, Application Data"
"541","2.705258900","192.168.1.118","172.217.9.238","TCP","66","42108 → 443 [ACK] Seq=892 Ack=145628 Win=120832 Len=0 TSval=1423744590 TSecr=742601481"
"542","2.706494712","172.217.9.238","192.168.1.118","TLSv1.2","1484","Application Data [TCP segment of a reassembled PDU]"
"543","2.706539687","172.217.9.238","192.168.1.118","TLSv1.2","1484","Application Data [TCP segment of a reassembled PDU]"
"544","2.706567100","192.168.1.118","172.217.9.238","TCP","66","42108 → 443 [ACK] Seq=892 Ack=148464 Win=126592 Len=0 TSval=1423744591 TSecr=742601481"
"545","2.713066925","172.217.9.238","192.168.1.118","TLSv1.2","4320","Application Data, Application Data, Application Data"
"546","2.713150350","192.168.1.118","172.217.9.238","TCP","66","42108 → 443 [ACK] Seq=892 Ack=152718 Win=135040 Len=0 TSval=1423744598 TSecr=742601482"
"547","2.719051675","172.217.9.238","192.168.1.118","TLSv1.2","2902","Application Data, Application Data"
"548","2.719115962","192.168.1.118","172.217.9.238","TCP","66","42108 → 443 [ACK] Seq=892 Ack=155554 Win=140672 Len=0 TSval=1423744604 TSecr=742601482"
"549","2.719184950","172.217.9.238","192.168.1.118","TLSv1.2","4320","Application Data, Application Data, Application Data"
"550","2.719205275","192.168.1.118","172.217.9.238","TCP","66","42108 → 443 [ACK] Seq=892 Ack=159808 Win=141312 Len=0 TSval=1423744604 TSecr=742601483"
"551","2.719222987","172.217.9.238","192.168.1.118","TLSv1.2","4320","Application Data, Application Data, Application Data"
"552","2.719249037","172.217.9.238","192.168.1.118","TLSv1.2","8574","Application Data, Application Data, Application Data, Application Data, Application Data, Application Data"
"553","2.719274750","172.217.9.238","192.168.1.118","TLSv1.2","2902","Application Data, Application Data"
"554","2.722266425","192.168.1.118","172.217.9.238","TCP","66","42108 → 443 [ACK] Seq=892 Ack=175406 Win=125824 Len=0 TSval=1423744607 TSecr=742601484"
"555","2.723884087","172.217.9.238","192.168.1.118","TLSv1.2","1484","Application Data [TCP segment of a reassembled PDU]"
"556","2.723944150","172.217.9.238","192.168.1.118","TLSv1.2","5738","Application Data, Application Data, Application Data, Application Data"
"557","2.723980750","172.217.9.238","192.168.1.118","TLSv1.2","4320","Application Data, Application Data, Application Data"
"558","2.724003900","172.217.9.238","192.168.1.118","TLSv1.2","4320","Application Data, Application Data, Application Data"
"559","2.724027975","172.217.9.238","192.168.1.118","TLSv1.2","8574","Application Data, Application Data, Application Data, Application Data, Application Data, Application Data"
"560","2.726658300","172.217.9.238","192.168.1.118","TLSv1.2","4320","Application Data, Application Data, Application Data"
"561","2.726716187","172.217.9.238","192.168.1.118","TLSv1.2","4320","Application Data, Application Data, Application Data"
"562","2.726733437","172.217.9.238","192.168.1.118","TLSv1.2","1484","Application Data [TCP segment of a reassembled PDU]"
"563","2.726806812","172.217.9.238","192.168.1.118","TLSv1.2","4320","Application Data, Application Data, Application Data"
"564","2.726853337","172.217.9.238","192.168.1.118","TLSv1.2","7156","Application Data, Application Data, Application Data, Application Data, Application Data"
"565","2.727949775","192.168.1.118","172.217.9.238","TCP","66","42108 → 443 [ACK] Seq=892 Ack=220782 Win=80512 Len=0 TSval=1423744612 TSecr=742601486"
"566","2.730318262","172.217.9.238","192.168.1.118","TLSv1.2","1484","Application Data [TCP segment of a reassembled PDU]"
"567","2.730393425","172.217.9.238","192.168.1.118","TLSv1.2","4320","Application Data, Application Data, Application Data"
"568","2.730411300","172.217.9.238","192.168.1.118","TLSv1.2","1838","Application Data, Application Data"
"569","2.730435925","172.217.9.238","192.168.1.118","TLSv1.2","8574","Application Data, Application Data, Application Data, Application Data, Application Data, Application Data"
"570","2.730452287","172.217.9.238","192.168.1.118","TLSv1.2","3966","Application Data, Application Data, Application Data"
"571","2.730467162","172.217.9.238","192.168.1.118","TLSv1.2","1484","Application Data [TCP segment of a reassembled PDU]"
"572","2.732393425","172.217.9.238","192.168.1.118","TLSv1.2","2902","Application Data, Application Data"
"573","2.732440450","172.217.9.238","192.168.1.118","TLSv1.2","2902","Application Data, Application Data"
"574","2.732486562","172.217.9.238","192.168.1.118","TLSv1.2","1484","Application Data [TCP segment of a reassembled PDU]"
"575","2.732513025","172.217.9.238","192.168.1.118","TLSv1.2","4320","Application Data, Application Data, Application Data"
"576","2.732540612","172.217.9.238","192.168.1.118","TLSv1.2","4320","Application Data, Application Data, Application Data"
"577","2.732576762","172.217.9.238","192.168.1.118","TLSv1.2","4320","Application Data, Application Data, Application Data"
"578","2.732589475","172.217.9.238","192.168.1.118","TLSv1.2","1484","Application Data [TCP segment of a reassembled PDU]"
"579","2.733657637","192.168.1.118","172.217.9.238","TCP","66","42108 → 443 [ACK] Seq=892 Ack=263322 Win=38016 Len=0 TSval=1423744618 TSecr=742601494"
"580","2.733872375","172.217.9.238","192.168.1.118","TLSv1.2","2902","Application Data, Application Data"
"581","2.733941187","172.217.9.238","192.168.1.118","TLSv1.2","8574","Application Data, Application Data, Application Data, Application Data, Application Data, Application Data, Application Data"
"582","2.737182537","192.168.1.118","172.217.9.238","TCP","66","42108 → 443 [ACK] Seq=892 Ack=274666 Win=26752 Len=0 TSval=1423744622 TSecr=742601508"
"583","2.739778562","172.217.9.238","192.168.1.118","TLSv1.2","1484","Application Data [TCP segment of a reassembled PDU]"
"584","2.740438537","172.217.9.238","192.168.1.118","TLSv1.2","2902","Application Data, Application Data"
"585","2.741469437","172.217.9.238","192.168.1.118","TLSv1.2","4320","Application Data, Application Data, Application Data"
"586","2.742948437","172.217.9.238","192.168.1.118","TLSv1.2","4320","Application Data, Application Data, Application Data"
"587","2.743002050","172.217.9.238","192.168.1.118","TLSv1.2","4320","Application Data, Application Data, Application Data"
"588","2.743469062","192.168.1.118","172.217.9.238","TCP","66","42108 → 443 [ACK] Seq=892 Ack=291682 Win=9856 Len=0 TSval=1423744628 TSecr=742601517"
"589","2.743992137","172.217.9.238","192.168.1.118","TLSv1.2","4320","Application Data, Application Data, Application Data"
"590","2.744024025","172.217.9.238","192.168.1.118","TLSv1.2","1484","Application Data [TCP segment of a reassembled PDU]"
"591","2.744627925","172.217.9.238","192.168.1.118","TLSv1.2","1898","Application Data, Application Data"
"592","2.747796612","192.168.1.118","172.217.9.238","TCP","66","42108 → 443 [ACK] Seq=892 Ack=299186 Win=2432 Len=0 TSval=1423744632 TSecr=742601519"
"593","2.763389987","192.168.1.118","172.217.9.238","TCP","66","[TCP Window Update] 42108 → 443 [ACK] Seq=892 Ack=299186 Win=31104 Len=0 TSval=1423744648 TSecr=742601519"
"594","2.808014962","192.168.1.118","172.217.9.238","TCP","66","[TCP Window Update] 42108 → 443 [ACK] Seq=892 Ack=299186 Win=91264 Len=0 TSval=1423744692 TSecr=742601519"
"595","2.938624812","192.168.1.118","172.217.9.238","TLSv1.2","294","Application Data"
"596","2.974604425","172.217.9.238","192.168.1.118","TCP","66","443 → 42104 [ACK] Seq=16817 Ack=1084 Win=63488 Len=0 TSval=3042466844 TSecr=1423744823"
"597","2.981611975","172.217.9.238","192.168.1.118","TLSv1.2","1484","Application Data"
"598","2.981681887","192.168.1.118","172.217.9.238","TCP","66","42104 → 443 [ACK] Seq=1084 Ack=18235 Win=63104 Len=0 TSval=1423744866 TSecr=3042466859"
"599","2.983875150","172.217.9.238","192.168.1.118","TLSv1.2","729","Application Data"
"600","2.983937975","192.168.1.118","172.217.9.238","TCP","66","42104 → 443 [ACK] Seq=1084 Ack=18898 Win=63104 Len=0 TSval=1423744868 TSecr=3042466859"
"601","4.002956800","192.168.1.104","255.255.255.255","UDP","217","49154 → 6666 Len=175"
"602","4.215338087","fe80::1cc7:6d9a:a312:7e8f","ff02::fb","MDNS","470","Standard query 0x0000 PTR _googlecast._tcp.local, "QM" question PTR _uscan._tcp.local, "QM" question PTR _ptp._tcp.local, "QM" question PTR _ippusb._tcp.local, "QM" question PTR _scanner._tcp.local, "QM" question PTR _ipp._tcp.local, "QM" question PTR _pdl-datastream._tcp.local, "QM" question PTR _uscans._tcp.local, "QM" question PTR _ipps._tcp.local, "QM" question PTR _printer._tcp.local, "QM" question PTR _airport._tcp.local, "QM" question PTR _rdlink._tcp.local, "QM" question PTR _afpovertcp._tcp.local, "QM" question PTR _rfb._tcp.local, "QM" question PTR _adisk._tcp.local, "QM" question PTR _apple-mobdev._tcp.local, "QM" question PTR 8ed307c3._sub._apple-mobdev2._tcp.local, "QM" question PTR _apple-pairable._tcp.local, "QM" question TXT Google-Home-Mini-2c3f16b2da5c4b6fd6cfbfba61c12490._googlecast._tcp.local, "QM" question PTR Google-Home-Mini-2c3f16b2da5c4b6fd6cfbfba61c12490._googlecast._tcp.local OPT"
"603","4.307972925","192.168.1.102","224.0.0.251","MDNS","183","Standard query response 0x0000 SRV, cache flush 0 0 8009 2c3f16b2-da5c-4b6f-d6cf-bfba61c12490.local"
"604","5.529967375","192.168.1.118","192.168.1.102","TCP","176","42902 → 8009 [PSH, ACK] Seq=111 Ack=111 Win=501 Len=110 TSval=2816417125 TSecr=5026064 [TCP segment of a reassembled PDU]"
"605","5.538485350","192.168.1.102","192.168.1.118","TCP","176","8009 → 42902 [PSH, ACK] Seq=111 Ack=221 Win=277 Len=110 TSval=5026565 TSecr=2816417125 [TCP segment of a reassembled PDU]"
"606","5.538582362","192.168.1.118","192.168.1.102","TCP","66","42902 → 8009 [ACK] Seq=221 Ack=221 Win=501 Len=0 TSval=2816417134 TSecr=5026565"
"607","6.240197900","192.168.1.118","142.250.31.188","TCP","66","42160 → 443 [ACK] Seq=1 Ack=1 Win=501 Len=0 TSval=2551645522 TSecr=3849569219"
"608","6.283704612","142.250.31.188","192.168.1.118","TCP","66","[TCP ACKed unseen segment] 443 → 42160 [ACK] Seq=1 Ack=2 Win=253 Len=0 TSval=3849614294 TSecr=2551552559"
"609","7.072834087","192.168.1.104","255.255.255.255","UDP","217","49154 → 6666 Len=175"
"610","8.694417487","192.168.1.118","172.217.7.10","TLSv1.2","97","Encrypted Alert"
"611","8.698317562","192.168.1.118","172.217.7.10","TCP","66","36164 → 443 [FIN, ACK] Seq=32 Ack=1 Win=501 Len=0 TSval=1851189091 TSecr=645688604"
"612","8.699704025","192.168.1.118","209.18.47.62","DNS","79","Standard query 0x3c21 A play.googleapis.com"
"613","8.747205425","192.168.1.118","172.217.7.10","TCP","66","[TCP Retransmission] 36164 → 443 [FIN, ACK] Seq=32 Ack=1 Win=501 Len=0 TSval=1851189140 TSecr=645688604"
"614","8.768118612","172.217.7.10","192.168.1.118","TCP","54","443 → 36164 [RST] Seq=1 Win=0 Len=0"
"615","8.772738000","209.18.47.62","192.168.1.118","DNS","95","Standard query response 0x3c21 A play.googleapis.com A 172.217.12.138"
"616","8.772901550","192.168.1.118","209.18.47.62","DNS","79","Standard query 0x602f AAAA play.googleapis.com"
"617","8.790021112","209.18.47.62","192.168.1.118","DNS","107","Standard query response 0x602f AAAA play.googleapis.com AAAA 2607:f8b0:4006:81b::200a"
"618","8.790629100","192.168.1.118","172.217.12.138","TCP","74","38954 → 443 [SYN] Seq=0 Win=64240 Len=0 MSS=1460 SACK_PERM=1 TSval=305428947 TSecr=0 WS=128"
"619","8.807460012","172.217.12.138","192.168.1.118","TCP","74","443 → 38954 [SYN, ACK] Seq=0 Ack=1 Win=60192 Len=0 MSS=1380 SACK_PERM=1 TSval=3260214006 TSecr=305428947 WS=256"
"620","8.807560037","192.168.1.118","172.217.12.138","TCP","66","38954 → 443 [ACK] Seq=1 Ack=1 Win=64256 Len=0 TSval=305428964 TSecr=3260214006"
"621","8.838354512","192.168.1.118","172.217.12.138","TLSv1","583","Client Hello"
"622","8.857066062","172.217.12.138","192.168.1.118","TCP","66","443 → 38954 [ACK] Seq=1 Ack=518 Win=61440 Len=0 TSval=3260214056 TSecr=305428995"
"623","8.862224262","172.217.12.138","192.168.1.118","TLSv1.2","1484","Server Hello"
"624","8.862298062","192.168.1.118","172.217.12.138","TCP","66","38954 → 443 [ACK] Seq=518 Ack=1419 Win=63104 Len=0 TSval=305429019 TSecr=3260214063"
"625","8.863021175","172.217.12.138","192.168.1.118","TLSv1.2","1540","Certificate, Server Key Exchange, Server Hello Done"
"626","8.863055962","192.168.1.118","172.217.12.138","TCP","66","38954 → 443 [ACK] Seq=518 Ack=2893 Win=62720 Len=0 TSval=305429020 TSecr=3260214063"
"627","8.866933487","192.168.1.118","172.217.12.138","TLSv1.2","192","Client Key Exchange, Change Cipher Spec, Encrypted Handshake Message"
"628","8.885070825","172.217.12.138","192.168.1.118","TLSv1.2","117","Change Cipher Spec, Encrypted Handshake Message"
"629","8.885763925","192.168.1.118","172.217.12.138","TLSv1.2","664","Application Data"
"630","8.886935562","192.168.1.118","172.217.12.138","TLSv1.2","354","Application Data"
"631","8.902778962","172.217.12.138","192.168.1.118","TCP","66","443 → 38954 [ACK] Seq=2944 Ack=1530 Win=63744 Len=0 TSval=3260214103 TSecr=305429042"
"632","8.927396387","172.217.12.138","192.168.1.118","TLSv1.2","861","Application Data"
"633","8.928249412","172.217.12.138","192.168.1.118","TLSv1.2","100","Application Data"
"634","8.928361700","192.168.1.118","172.217.12.138","TCP","66","38954 → 443 [ACK] Seq=1530 Ack=3773 Win=64128 Len=0 TSval=305429085 TSecr=3260214120"
