frame.number,_ws.col.Time,_ws.col.Source,_ws.col.Destination,_ws.col.Protocol,frame.len,_ws.col.Info
"1","0.000000000","192.168.1.118","199.232.37.140","TCP","66","33220 → 443 [ACK] Seq=1 Ack=1 Win=1299 Len=0 TSval=26449645 TSecr=2791146224"
"2","0.010693087","192.168.1.118","199.232.37.140","TLSv1","583","Client Hello"
"3","0.024227336","199.232.37.140","192.168.1.118","TCP","66","443 → 33231 [ACK] Seq=1 Ack=518 Win=55 Len=0 TSval=2792236739 TSecr=26449655"
"4","0.025924495","199.232.37.140","192.168.1.118","TLSv1.2","1418","Server Hello"
"5","0.026020261","192.168.1.118","199.232.37.140","TCP","66","33231 → 443 [ACK] Seq=518 Ack=1353 Win=250 Len=0 TSval=26449671 TSecr=2792236739"
"6","0.027597529","199.232.37.140","192.168.1.118","TLSv1.2","1952","Certificate, Server Key Exchange, Server Hello Done"
"7","0.027667331","192.168.1.118","199.232.37.140","TCP","66","33231 → 443 [ACK] Seq=518 Ack=3239 Win=279 Len=0 TSval=26449672 TSecr=2792236739"
"8","0.031072013","192.168.1.118","199.232.37.140","TLSv1.2","192","Client Key Exchange, Change Cipher Spec, Encrypted Handshake Message"
"9","0.031516228","192.168.1.118","199.232.37.140","TCP","74","33232 → 443 [SYN] Seq=0 Win=29200 Len=0 MSS=1460 SACK_PERM=1 TSval=26449676 TSecr=0 WS=128"
"10","0.031643833","192.168.1.118","199.232.37.140","TCP","74","33233 → 443 [SYN] Seq=0 Win=29200 Len=0 MSS=1460 SACK_PERM=1 TSval=26449676 TSecr=0 WS=128"
"11","0.031714860","192.168.1.118","209.18.47.62","DNS","82","Standard query 0x706d A styles.redditmedia.com"
"12","0.038170586","192.168.1.118","209.18.47.62","DNS","82","Standard query 0xa412 A styles.redditmedia.com"
"13","0.044109719","192.168.1.118","199.232.37.140","TCP","74","33234 → 443 [SYN] Seq=0 Win=29200 Len=0 MSS=1460 SACK_PERM=1 TSval=26449689 TSecr=0 WS=128"
"14","0.044319576","192.168.1.118","209.18.47.62","DNS","82","Standard query 0xc00a A styles.redditmedia.com"
"15","0.044534434","192.168.1.118","209.18.47.62","DNS","75","Standard query 0xd4d0 A preview.redd.it"
"16","0.046766224","199.232.37.140","192.168.1.118","TLSv1.2","1418","Application Data"
"17","0.046842777","192.168.1.118","199.232.37.140","TCP","66","33220 → 443 [ACK] Seq=1 Ack=1353 Win=1373 Len=0 TSval=26449691 TSecr=2791146247"
"18","0.048354980","199.232.37.140","192.168.1.118","TLSv1.2","2475","Application Data, Application Data, Application Data, Application Data"
"19","0.048433370","192.168.1.118","199.232.37.140","TCP","66","33220 → 443 [ACK] Seq=1 Ack=3762 Win=1384 Len=0 TSval=26449693 TSecr=2791146247"
"20","0.051181766","199.232.37.140","192.168.1.118","TLSv1.2","1418","Application Data"
"21","0.051253669","192.168.1.118","199.232.37.140","TCP","66","33220 → 443 [ACK] Seq=1 Ack=5114 Win=1374 Len=0 TSval=26449696 TSecr=2791146248"
"22","0.055656711","199.232.37.140","192.168.1.118","TLSv1.2","903","Application Data, Application Data, Application Data"
"23","0.055740051","192.168.1.118","199.232.37.140","TCP","66","33220 → 443 [ACK] Seq=1 Ack=5951 Win=1368 Len=0 TSval=26449700 TSecr=2791146248"
"24","0.055790590","199.232.37.140","192.168.1.118","TLSv1.2","117","Change Cipher Spec, Encrypted Handshake Message"
"25","0.061612394","192.168.1.118","199.232.37.140","TLSv1.2","256","Application Data"
"26","0.062303606","192.168.1.118","209.18.47.62","DNS","82","Standard query 0xb034 A styles.redditmedia.com"
"27","0.063348142","192.168.1.118","199.232.37.140","TCP","74","33235 → 443 [SYN] Seq=0 Win=29200 Len=0 MSS=1460 SACK_PERM=1 TSval=26449708 TSecr=0 WS=128"
"28","0.063594463","209.18.47.62","192.168.1.118","DNS","133","Standard query response 0xa412 A styles.redditmedia.com CNAME reddit.map.fastly.net A 199.232.37.140"
"29","0.063747806","192.168.1.118","209.18.47.62","DNS","82","Standard query 0x70d0 AAAA styles.redditmedia.com"
"30","0.064141545","192.168.1.118","209.18.47.62","DNS","75","Standard query 0x8063 A preview.redd.it"
"31","0.064402504","192.168.1.118","209.18.47.62","DNS","84","Standard query 0x24c2 A a.thumbs.redditmedia.com"
"32","0.067396259","209.18.47.62","192.168.1.118","DNS","133","Standard query response 0x706d A styles.redditmedia.com CNAME reddit.map.fastly.net A 199.232.37.140"
"33","0.067675556","192.168.1.118","209.18.47.62","DNS","82","Standard query 0xa084 AAAA styles.redditmedia.com"
"34","0.071011836","199.232.37.140","192.168.1.118","TCP","74","443 → 33232 [SYN, ACK] Seq=0 Ack=1 Win=27040 Len=0 MSS=1364 SACK_PERM=1 TSval=3231353604 TSecr=26449676 WS=512"
"35","0.071120127","192.168.1.118","199.232.37.140","TCP","66","33232 → 443 [ACK] Seq=1 Ack=1 Win=29312 Len=0 TSval=26449716 TSecr=3231353604"
"36","0.071169041","199.232.37.140","192.168.1.118","TCP","74","443 → 33233 [SYN, ACK] Seq=0 Ack=1 Win=27040 Len=0 MSS=1364 SACK_PERM=1 TSval=2789294376 TSecr=26449676 WS=512"
"37","0.071198067","192.168.1.118","199.232.37.140","TCP","66","33233 → 443 [ACK] Seq=1 Ack=1 Win=29312 Len=0 TSval=26449716 TSecr=2789294376"
"38","0.073655966","209.18.47.62","192.168.1.118","DNS","133","Standard query response 0xc00a A styles.redditmedia.com CNAME reddit.map.fastly.net A 199.232.37.140"
"39","0.073736443","199.232.37.140","192.168.1.118","TCP","74","443 → 33234 [SYN, ACK] Seq=0 Ack=1 Win=27040 Len=0 MSS=1364 SACK_PERM=1 TSval=3211579154 TSecr=26449689 WS=512"
"40","0.073799221","192.168.1.118","199.232.37.140","TCP","66","33234 → 443 [ACK] Seq=1 Ack=1 Win=29312 Len=0 TSval=26449718 TSecr=3211579154"
"41","0.073953376","192.168.1.118","209.18.47.62","DNS","82","Standard query 0x94c0 AAAA styles.redditmedia.com"
"42","0.081420450","209.18.47.62","192.168.1.118","DNS","126","Standard query response 0xd4d0 A preview.redd.it CNAME reddit.map.fastly.net A 199.232.37.140"
"43","0.081609356","192.168.1.118","209.18.47.62","DNS","75","Standard query 0xbc3d AAAA preview.redd.it"
"44","0.089363740","199.232.37.140","192.168.1.118","TLSv1.2","9530","Application Data, Application Data, Application Data, Application Data, Application Data, Application Data, Application Data"
"45","0.089457919","192.168.1.118","199.232.37.140","TCP","66","33231 → 443 [ACK] Seq=834 Ack=12754 Win=427 Len=0 TSval=26449734 TSecr=2792236752"
"46","0.089498508","199.232.37.140","192.168.1.118","TLSv1.2","120","Application Data"
"47","0.090733776","209.18.47.62","192.168.1.118","DNS","175","Standard query response 0x70d0 AAAA styles.redditmedia.com CNAME reddit.map.fastly.net SOA ns1.fastly.net"
"48","0.090788340","209.18.47.62","192.168.1.118","DNS","135","Standard query response 0x24c2 A a.thumbs.redditmedia.com CNAME reddit.map.fastly.net A 199.232.37.140"
"49","0.090824554","209.18.47.62","192.168.1.118","DNS","133","Standard query response 0xb034 A styles.redditmedia.com CNAME reddit.map.fastly.net A 199.232.37.140"
"50","0.090848205","209.18.47.62","192.168.1.118","DNS","126","Standard query response 0x8063 A preview.redd.it CNAME reddit.map.fastly.net A 199.232.37.140"
"51","0.090871406","199.232.37.140","192.168.1.118","TCP","74","443 → 33235 [SYN, ACK] Seq=0 Ack=1 Win=27040 Len=0 MSS=1364 SACK_PERM=1 TSval=2791146257 TSecr=26449708 WS=512"
"52","0.090929983","192.168.1.118","199.232.37.140","TCP","66","33235 → 443 [ACK] Seq=1 Ack=1 Win=29312 Len=0 TSval=26449735 TSecr=2791146257"
"53","0.091251531","192.168.1.118","209.18.47.62","DNS","82","Standard query 0xa411 AAAA styles.redditmedia.com"
"54","0.091317684","192.168.1.118","209.18.47.62","DNS","84","Standard query 0xd821 AAAA a.thumbs.redditmedia.com"
"55","0.091371798","192.168.1.118","209.18.47.62","DNS","75","Standard query 0x286d AAAA preview.redd.it"
"56","0.093891974","192.168.1.118","199.232.37.140","TLSv1","583","Client Hello"
"57","0.094049942","209.18.47.62","192.168.1.118","DNS","175","Standard query response 0x94c0 AAAA styles.redditmedia.com CNAME reddit.map.fastly.net SOA ns1.fastly.net"
"58","0.096479077","209.18.47.62","192.168.1.118","DNS","175","Standard query response 0xa084 AAAA styles.redditmedia.com CNAME reddit.map.fastly.net SOA ns1.fastly.net"
"59","0.101584343","199.232.37.140","192.168.1.118","TLSv1.2","1418","Application Data"
"60","0.101666733","192.168.1.118","199.232.37.140","TCP","66","33220 → 443 [ACK] Seq=1 Ack=7303 Win=1416 Len=0 TSval=26449746 TSecr=2791146261"
"61","0.104161121","199.232.37.140","192.168.1.118","TLSv1.2","1801","Application Data, Application Data, Application Data, Application Data"
"62","0.104241274","192.168.1.118","199.232.37.140","TCP","66","33220 → 443 [ACK] Seq=1 Ack=9038 Win=1403 Len=0 TSval=26449749 TSecr=2791146261"
"63","0.104293975","209.18.47.62","192.168.1.118","DNS","171","Standard query response 0xbc3d AAAA preview.redd.it CNAME reddit.map.fastly.net SOA ns1.fastly.net"
"64","0.104323764","199.232.37.140","192.168.1.118","TLSv1.2","217","Application Data, Application Data, Application Data"
"65","0.104339852","192.168.1.118","199.232.37.140","TCP","66","33220 → 443 [ACK] Seq=1 Ack=9189 Win=1402 Len=0 TSval=26449749 TSecr=2791146261"
"66","0.108562462","209.18.47.62","192.168.1.118","DNS","177","Standard query response 0xd821 AAAA a.thumbs.redditmedia.com CNAME reddit.map.fastly.net SOA ns1.fastly.net"
"67","0.110669761","209.18.47.62","192.168.1.118","DNS","175","Standard query response 0xa411 AAAA styles.redditmedia.com CNAME reddit.map.fastly.net SOA ns1.fastly.net"
"68","0.111490190","192.168.1.118","199.232.37.140","TLSv1","583","Client Hello"
"69","0.111768249","192.168.1.118","199.232.37.140","TCP","74","33236 → 443 [SYN] Seq=0 Win=29200 Len=0 MSS=1460 SACK_PERM=1 TSval=26449756 TSecr=0 WS=128"
"70","0.111859253","192.168.1.118","199.232.37.140","TCP","74","33237 → 443 [SYN] Seq=0 Win=29200 Len=0 MSS=1460 SACK_PERM=1 TSval=26449756 TSecr=0 WS=128"
"71","0.114138595","209.18.47.62","192.168.1.118","DNS","171","Standard query response 0x286d AAAA preview.redd.it CNAME reddit.map.fastly.net SOA ns1.fastly.net"
"72","0.128761219","192.168.1.118","199.232.37.140","TLSv1","583","Client Hello"
"73","0.129007928","192.168.1.118","199.232.37.140","TCP","66","33231 → 443 [ACK] Seq=834 Ack=12808 Win=427 Len=0 TSval=26449774 TSecr=2792236752"
"74","0.129078593","192.168.1.118","199.232.37.140","TCP","74","33238 → 443 [SYN] Seq=0 Win=29200 Len=0 MSS=1460 SACK_PERM=1 TSval=26449774 TSecr=0 WS=128"
"75","0.129160321","199.232.37.140","192.168.1.118","TCP","66","443 → 33232 [ACK] Seq=1 Ack=518 Win=28160 Len=0 TSval=3231353620 TSecr=26449738"
"76","0.129181809","192.168.1.118","199.232.37.140","TCP","74","33239 → 443 [SYN] Seq=0 Win=29200 Len=0 MSS=1460 SACK_PERM=1 TSval=26449774 TSecr=0 WS=128"
"77","0.131625032","199.232.37.140","192.168.1.118","TLSv1.2","3304","Server Hello, Certificate, Server Key Exchange, Server Hello Done"
"78","0.131709472","192.168.1.118","199.232.37.140","TCP","66","33232 → 443 [ACK] Seq=518 Ack=3239 Win=35712 Len=0 TSval=26449776 TSecr=3231353620"
"79","0.131755786","199.232.37.140","192.168.1.118","TCP","66","443 → 33233 [ACK] Seq=1 Ack=518 Win=28160 Len=0 TSval=2789294393 TSecr=26449756"
"80","0.133275065","199.232.37.140","192.168.1.118","TCP","74","443 → 33236 [SYN, ACK] Seq=0 Ack=1 Win=27040 Len=0 MSS=1364 SACK_PERM=1 TSval=250567226 TSecr=26449756 WS=512"
"81","0.133377981","192.168.1.118","199.232.37.140","TCP","66","33236 → 443 [ACK] Seq=1 Ack=1 Win=29312 Len=0 TSval=26449778 TSecr=250567226"
"82","0.133423532","199.232.37.140","192.168.1.118","TCP","74","443 → 33237 [SYN, ACK] Seq=0 Ack=1 Win=27040 Len=0 MSS=1364 SACK_PERM=1 TSval=4180677374 TSecr=26449756 WS=512"
"83","0.133451283","192.168.1.118","199.232.37.140","TCP","66","33237 → 443 [ACK] Seq=1 Ack=1 Win=29312 Len=0 TSval=26449778 TSecr=4180677374"
"84","0.133474759","199.232.37.140","192.168.1.118","TLSv1.2","166","Application Data, Application Data, Application Data"
"85","0.133499310","192.168.1.118","199.232.37.140","TCP","66","33220 → 443 [ACK] Seq=1 Ack=9289 Win=1402 Len=0 TSval=26449778 TSecr=2791146268"
"86","0.133538724","199.232.37.140","192.168.1.118","TLSv1.2","3304","Server Hello, Certificate, Server Key Exchange, Server Hello Done"
"87","0.133566050","192.168.1.118","199.232.37.140","TCP","66","33233 → 443 [ACK] Seq=518 Ack=3239 Win=35712 Len=0 TSval=26449778 TSecr=2789294393"
"88","0.141503003","199.232.37.140","192.168.1.118","TLSv1.2","1418","Application Data"
"89","0.141586343","192.168.1.118","199.232.37.140","TCP","66","33220 → 443 [ACK] Seq=1 Ack=10641 Win=1392 Len=0 TSval=26449786 TSecr=2791146271"
"90","0.143500660","199.232.37.140","192.168.1.118","TLSv1.2","7140","Application Data, Application Data, Application Data, Application Data, Application Data, Application Data, Application Data"
"91","0.143573713","192.168.1.118","199.232.37.140","TCP","66","33220 → 443 [ACK] Seq=1 Ack=17715 Win=1337 Len=0 TSval=26449788 TSecr=2791146271"
"92","0.147974867","192.168.1.118","199.232.37.140","TLSv1","583","Client Hello"
"93","0.148219400","192.168.1.118","199.232.37.140","TCP","74","33240 → 443 [SYN] Seq=0 Win=29200 Len=0 MSS=1460 SACK_PERM=1 TSval=26449793 TSecr=0 WS=128"
"94","0.148315066","192.168.1.118","199.232.37.140","TCP","74","33241 → 443 [SYN] Seq=0 Win=29200 Len=0 MSS=1460 SACK_PERM=1 TSval=26449793 TSecr=0 WS=128"
"95","0.148445333","192.168.1.118","199.232.37.140","TCP","74","33242 → 443 [SYN] Seq=0 Win=29200 Len=0 MSS=1460 SACK_PERM=1 TSval=26449793 TSecr=0 WS=128"
"96","0.148734056","192.168.1.118","199.232.37.140","TCP","74","33243 → 443 [SYN] Seq=0 Win=29200 Len=0 MSS=1460 SACK_PERM=1 TSval=26449793 TSecr=0 WS=128"
"97","0.151219155","192.168.1.118","199.232.37.140","TLSv1.2","192","Client Key Exchange, Change Cipher Spec, Encrypted Handshake Message"
"98","0.151446476","199.232.37.140","192.168.1.118","TLSv1.2","5445","Application Data, Application Data, Application Data, Application Data, Application Data, Application Data"
"99","0.151529916","192.168.1.118","199.232.37.140","TCP","66","33220 → 443 [ACK] Seq=1 Ack=23094 Win=1295 Len=0 TSval=26449796 TSecr=2791146271"
"100","0.151606894","199.232.37.140","192.168.1.118","TLSv1.2","6826","Application Data, Application Data, Application Data, Application Data, Application Data"
"101","0.153285940","192.168.1.118","199.232.37.140","TLSv1.2","192","Client Key Exchange, Change Cipher Spec, Encrypted Handshake Message"
"102","0.159135157","199.232.37.140","192.168.1.118","TLSv1.2","10104","Application Data, Application Data, Application Data, Application Data, Application Data, Application Data, Application Data, Application Data, Application Data"
"103","0.159235523","199.232.37.140","192.168.1.118","TLSv1.2","8010","Application Data, Application Data, Application Data, Application Data, Application Data, Application Data, Application Data, Application Data"
"104","0.159262662","199.232.37.140","192.168.1.118","TLSv1.2","1418","Application Data, Application Data, Application Data"
"105","0.165158468","199.232.37.140","192.168.1.118","TLSv1.2","193","Application Data, Application Data, Application Data, Application Data"
"106","0.165224995","199.232.37.140","192.168.1.118","TCP","74","443 → 33239 [SYN, ACK] Seq=0 Ack=1 Win=27040 Len=0 MSS=1364 SACK_PERM=1 TSval=3090973961 TSecr=26449774 WS=512"
"107","0.165297085","192.168.1.118","199.232.37.140","TCP","66","33239 → 443 [ACK] Seq=1 Ack=1 Win=29312 Len=0 TSval=26449810 TSecr=3090973961"
"108","0.165346387","199.232.37.140","192.168.1.118","TCP","66","443 → 33234 [ACK] Seq=1 Ack=518 Win=28160 Len=0 TSval=3211579176 TSecr=26449773"
"109","0.165370813","199.232.37.140","192.168.1.118","TCP","74","443 → 33238 [SYN, ACK] Seq=0 Ack=1 Win=27040 Len=0 MSS=1364 SACK_PERM=1 TSval=251245125 TSecr=26449774 WS=512"
"110","0.165399014","192.168.1.118","199.232.37.140","TCP","66","33238 → 443 [ACK] Seq=1 Ack=1 Win=29312 Len=0 TSval=26449810 TSecr=251245125"
"111","0.165437265","199.232.37.140","192.168.1.118","TLSv1.2","3304","Server Hello, Certificate, Server Key Exchange, Server Hello Done"
"112","0.165462854","192.168.1.118","199.232.37.140","TCP","66","33234 → 443 [ACK] Seq=518 Ack=3239 Win=35712 Len=0 TSval=26449810 TSecr=3211579177"
"113","0.167171701","199.232.37.140","192.168.1.118","TCP","74","443 → 33241 [SYN, ACK] Seq=0 Ack=1 Win=27040 Len=0 MSS=1364 SACK_PERM=1 TSval=3229063034 TSecr=26449793 WS=512"
"114","0.167272092","192.168.1.118","199.232.37.140","TCP","66","33241 → 443 [ACK] Seq=1 Ack=1 Win=29312 Len=0 TSval=26449812 TSecr=3229063034"
"115","0.168536611","199.232.37.140","192.168.1.118","TCP","66","443 → 33235 [ACK] Seq=1 Ack=518 Win=28160 Len=0 TSval=2791146277 TSecr=26449792"
"116","0.168601751","199.232.37.140","192.168.1.118","TCP","74","443 → 33240 [SYN, ACK] Seq=0 Ack=1 Win=27040 Len=0 MSS=1364 SACK_PERM=1 TSval=2790511413 TSecr=26449793 WS=512"
"117","0.168656903","192.168.1.118","199.232.37.140","TCP","66","33240 → 443 [ACK] Seq=1 Ack=1 Win=29312 Len=0 TSval=26449813 TSecr=2790511413"
"118","0.168700980","199.232.37.140","192.168.1.118","TCP","74","443 → 33243 [SYN, ACK] Seq=0 Ack=1 Win=27040 Len=0 MSS=1364 SACK_PERM=1 TSval=2792236775 TSecr=26449793 WS=512"
"119","0.168729393","192.168.1.118","199.232.37.140","TCP","66","33243 → 443 [ACK] Seq=1 Ack=1 Win=29312 Len=0 TSval=26449813 TSecr=2792236775"
"120","0.168749606","199.232.37.140","192.168.1.118","TCP","74","443 → 33242 [SYN, ACK] Seq=0 Ack=1 Win=27040 Len=0 MSS=1364 SACK_PERM=1 TSval=1289724858 TSecr=26449793 WS=512"
"121","0.168777482","192.168.1.118","199.232.37.140","TCP","66","33242 → 443 [ACK] Seq=1 Ack=1 Win=29312 Len=0 TSval=26449813 TSecr=1289724858"
"122","0.168798083","199.232.37.140","192.168.1.118","TLSv1.2","117","Change Cipher Spec, Encrypted Handshake Message"
"123","0.170189857","199.232.37.140","192.168.1.118","TLSv1.2","3304","Server Hello, Certificate, Server Key Exchange, Server Hello Done"
"124","0.170272510","192.168.1.118","199.232.37.140","TCP","66","33235 → 443 [ACK] Seq=518 Ack=3239 Win=35712 Len=0 TSval=26449815 TSecr=2791146277"
"125","0.171822926","192.168.1.118","199.232.37.140","TLSv1","583","Client Hello"
"126","0.175617947","199.232.37.140","192.168.1.118","TLSv1.2","117","Change Cipher Spec, Encrypted Handshake Message"
"127","0.188834734","192.168.1.118","199.232.37.140","TLSv1","583","Client Hello"
"128","0.190759714","199.232.37.140","192.168.1.118","TCP","66","443 → 33236 [ACK] Seq=1 Ack=518 Win=28160 Len=0 TSval=250567242 TSecr=26449816"
"129","0.190975097","192.168.1.118","199.232.37.140","TCP","66","33220 → 443 [ACK] Seq=1 Ack=49315 Win=1091 Len=0 TSval=26449836 TSecr=2791146272"
"130","0.191239006","192.168.1.118","199.232.37.140","TLSv1.2","192","Client Key Exchange, Change Cipher Spec, Encrypted Handshake Message"
"131","0.193564825","199.232.37.140","192.168.1.118","TLSv1.2","1418","Server Hello"
"132","0.193650778","192.168.1.118","199.232.37.140","TCP","66","33236 → 443 [ACK] Seq=518 Ack=1353 Win=32000 Len=0 TSval=26449838 TSecr=250567242"
"133","0.195043776","199.232.37.140","192.168.1.118","TLSv1.2","1962","Certificate, Server Key Exchange, Server Hello Done"
"134","0.195126554","192.168.1.118","199.232.37.140","TCP","66","33236 → 443 [ACK] Seq=518 Ack=3249 Win=35712 Len=0 TSval=26449840 TSecr=250567242"
"135","0.208000242","192.168.1.118","199.232.37.140","TCP","66","33232 → 443 [ACK] Seq=644 Ack=3290 Win=35712 Len=0 TSval=26449853 TSecr=3231353630"
"136","0.210314061","199.232.37.140","192.168.1.118","TCP","66","443 → 33237 [ACK] Seq=1 Ack=518 Win=28160 Len=0 TSval=4180677395 TSecr=26449833"
"137","0.211328959","199.232.37.140","192.168.1.118","TLSv1.2","117","Change Cipher Spec, Encrypted Handshake Message"
"138","0.212734158","199.232.37.140","192.168.1.118","TLSv1.2","1418","Server Hello"
"139","0.212812398","192.168.1.118","199.232.37.140","TCP","66","33237 → 443 [ACK] Seq=518 Ack=1353 Win=32000 Len=0 TSval=26449857 TSecr=4180677395"
"140","0.214350627","199.232.37.140","192.168.1.118","TLSv1.2","1962","Certificate, Server Key Exchange, Server Hello Done"
"141","0.214419155","192.168.1.118","199.232.37.140","TCP","66","33237 → 443 [ACK] Seq=518 Ack=3249 Win=35712 Len=0 TSval=26449859 TSecr=4180677395"
"142","0.214968649","192.168.1.118","199.232.37.140","TCP","66","33233 → 443 [ACK] Seq=644 Ack=3290 Win=35712 Len=0 TSval=26449860 TSecr=2789294404"
"143","0.223633240","192.168.1.118","199.232.37.140","TLSv1","583","Client Hello"
"144","0.245927957","199.232.37.140","192.168.1.118","TCP","66","443 → 33238 [ACK] Seq=1 Ack=518 Win=28160 Len=0 TSval=251245146 TSecr=26449868"
"145","0.248870223","199.232.37.140","192.168.1.118","TLSv1.2","3432","Server Hello, Certificate, Server Key Exchange, Server Hello Done"
"146","0.248973551","192.168.1.118","199.232.37.140","TCP","66","33238 → 443 [ACK] Seq=518 Ack=3367 Win=35968 Len=0 TSval=26449894 TSecr=251245146"
"147","0.250982434","192.168.1.118","199.232.37.140","TCP","66","33234 → 443 [ACK] Seq=644 Ack=3290 Win=35712 Len=0 TSval=26449896 TSecr=3211579189"
"148","0.255760989","192.168.1.118","199.232.37.140","TLSv1","583","Client Hello"
"149","0.260817016","192.168.1.118","199.232.37.140","TLSv1.2","192","Client Key Exchange, Change Cipher Spec, Encrypted Handshake Message"
"150","0.271343834","199.232.37.140","192.168.1.118","TCP","66","443 → 33239 [ACK] Seq=1 Ack=518 Win=28160 Len=0 TSval=3090974073 TSecr=26449900"
"151","0.272867013","199.232.37.140","192.168.1.118","TLSv1.2","1418","Server Hello"
"152","0.272963954","192.168.1.118","199.232.37.140","TCP","66","33239 → 443 [ACK] Seq=518 Ack=1353 Win=32000 Len=0 TSval=26449917 TSecr=3090974074"
"153","0.274345139","199.232.37.140","192.168.1.118","TLSv1.2","1962","Certificate, Server Key Exchange, Server Hello Done"
"154","0.274429180","192.168.1.118","199.232.37.140","TCP","66","33239 → 443 [ACK] Seq=518 Ack=3249 Win=35712 Len=0 TSval=26449919 TSecr=3090974074"
"155","0.283388556","192.168.1.118","199.232.37.140","TLSv1","583","Client Hello"
"156","0.286575317","199.232.37.140","192.168.1.118","TLSv1.2","117","Change Cipher Spec, Encrypted Handshake Message"
"157","0.286659120","192.168.1.118","199.232.37.140","TCP","66","33235 → 443 [ACK] Seq=644 Ack=3290 Win=35712 Len=0 TSval=26449931 TSecr=2791146307"
"158","0.301883928","199.232.37.140","192.168.1.118","TCP","66","443 → 33240 [ACK] Seq=1 Ack=518 Win=28160 Len=0 TSval=2790511447 TSecr=26449928"
"159","0.304109044","199.232.37.140","192.168.1.118","TLSv1.2","1418","Server Hello"
"160","0.304198559","192.168.1.118","199.232.37.140","TCP","66","33240 → 443 [ACK] Seq=518 Ack=1353 Win=32000 Len=0 TSval=26449949 TSecr=2790511447"
"161","0.305266509","192.168.1.118","199.232.37.140","TLSv1","583","Client Hello"
"162","0.305589145","199.232.37.140","192.168.1.118","TLSv1.2","2080","Certificate, Server Key Exchange, Server Hello Done"
"163","0.305671611","192.168.1.118","199.232.37.140","TCP","66","33240 → 443 [ACK] Seq=518 Ack=3367 Win=35968 Len=0 TSval=26449950 TSecr=2790511447"
"164","0.322496175","199.232.37.140","192.168.1.118","TCP","66","443 → 33241 [ACK] Seq=1 Ack=518 Win=28160 Len=0 TSval=3229063073 TSecr=26449950"
"165","0.323036906","192.168.1.118","199.232.37.140","TLSv1","583","Client Hello"
"166","0.324619174","199.232.37.140","192.168.1.118","TLSv1.2","3336","Server Hello, Certificate, Server Key Exchange, Server Hello Done"
"167","0.324705502","192.168.1.118","199.232.37.140","TCP","66","33241 → 443 [ACK] Seq=518 Ack=3271 Win=35840 Len=0 TSval=26449969 TSecr=3229063073"
"168","0.345368675","192.168.1.118","199.232.37.140","TLSv1","583","Client Hello"
"169","0.345745588","192.168.1.118","199.232.37.140","TLSv1.2","272","Application Data"
"170","0.345820841","199.232.37.140","192.168.1.118","TCP","66","443 → 33242 [ACK] Seq=1 Ack=518 Win=28160 Len=0 TSval=1289725038 TSecr=26449968"
"171","0.346021310","192.168.1.118","199.232.37.140","TLSv1.2","279","Application Data"
"172","0.347844062","199.232.37.140","192.168.1.118","TLSv1.2","1418","Server Hello"
"173","0.347929365","192.168.1.118","199.232.37.140","TCP","66","33242 → 443 [ACK] Seq=518 Ack=1353 Win=32000 Len=0 TSval=26449992 TSecr=1289725039"
"174","0.348316178","192.168.1.118","199.232.37.140","TLSv1.2","192","Client Key Exchange, Change Cipher Spec, Encrypted Handshake Message"
"175","0.350566632","192.168.1.118","199.232.37.140","TLSv1.2","192","Client Key Exchange, Change Cipher Spec, Encrypted Handshake Message"
"176","0.350900581","192.168.1.118","199.232.37.140","TLSv1.2","274","Application Data"
"177","0.353466209","192.168.1.118","199.232.37.140","TLSv1.2","192","Client Key Exchange, Change Cipher Spec, Encrypted Handshake Message"
"178","0.355518318","192.168.1.118","199.232.37.140","TLSv1.2","192","Client Key Exchange, Change Cipher Spec, Encrypted Handshake Message"
"179","0.355842142","192.168.1.118","199.232.37.140","TLSv1.2","276","Application Data"
"180","0.359134319","192.168.1.118","199.232.37.140","TLSv1.2","192","Client Key Exchange, Change Cipher Spec, Encrypted Handshake Message"
"181","0.361477301","192.168.1.118","199.232.37.140","TLSv1.2","192","Client Key Exchange, Change Cipher Spec, Encrypted Handshake Message"
"182","0.361645457","199.232.37.140","192.168.1.118","TLSv1.2","1984","Certificate, Server Key Exchange, Server Hello Done"
"183","0.361728585","192.168.1.118","199.232.37.140","TCP","66","33242 → 443 [ACK] Seq=518 Ack=3271 Win=35840 Len=0 TSval=26450006 TSecr=1289725039"
"184","0.363805858","192.168.1.118","199.232.37.140","TLSv1.2","192","Client Key Exchange, Change Cipher Spec, Encrypted Handshake Message"
"185","0.365347099","199.232.37.140","192.168.1.118","TCP","66","443 → 33243 [ACK] Seq=1 Ack=518 Win=28160 Len=0 TSval=2792236824 TSecr=26449990"
"186","0.366374748","199.232.37.140","192.168.1.118","TLSv1.2","744","Application Data, Application Data"
"187","0.366451888","192.168.1.118","199.232.37.140","TCP","66","33233 → 443 [ACK] Seq=857 Ack=3968 Win=38400 Len=0 TSval=26450011 TSecr=2789294452"
"188","0.366502552","199.232.37.140","192.168.1.118","TLSv1.2","1418","Application Data"
"189","0.366527991","192.168.1.118","199.232.37.140","TCP","66","33232 → 443 [ACK] Seq=850 Ack=4642 Win=38400 Len=0 TSval=26450011 TSecr=3231353680"
"190","0.368205199","199.232.37.140","192.168.1.118","TLSv1.2","1585","Application Data, Application Data"
"191","0.368283290","192.168.1.118","199.232.37.140","TCP","66","33232 → 443 [ACK] Seq=850 Ack=6161 Win=41472 Len=0 TSval=26450013 TSecr=3231353680"
"192","0.368333941","199.232.37.140","192.168.1.118","TLSv1.2","1418","Server Hello"
"193","0.368360242","192.168.1.118","199.232.37.140","TCP","66","33243 → 443 [ACK] Seq=518 Ack=1353 Win=32000 Len=0 TSval=26450013 TSecr=2792236825"
"194","0.370737788","199.232.37.140","192.168.1.118","TLSv1.2","1962","Certificate, Server Key Exchange, Server Hello Done"
"195","0.370823216","192.168.1.118","199.232.37.140","TCP","66","33243 → 443 [ACK] Seq=518 Ack=3249 Win=35712 Len=0 TSval=26450015 TSecr=2792236825"
"196","0.373350892","192.168.1.118","199.232.37.140","TLSv1.2","192","Client Key Exchange, Change Cipher Spec, Encrypted Handshake Message"
"197","0.374068505","192.168.1.118","199.232.37.140","TCP","74","33244 → 443 [SYN] Seq=0 Win=29200 Len=0 MSS=1460 SACK_PERM=1 TSval=26450019 TSecr=0 WS=128"
"198","0.374265086","192.168.1.118","209.18.47.62","DNS","84","Standard query 0x9c4e A b.thumbs.redditmedia.com"
"199","0.374322401","192.168.1.118","199.232.37.140","TCP","74","33245 → 443 [SYN] Seq=0 Win=29200 Len=0 MSS=1460 SACK_PERM=1 TSval=26450019 TSecr=0 WS=128"
"200","0.374459968","192.168.1.118","209.18.47.62","DNS","84","Standard query 0x384a A b.thumbs.redditmedia.com"
"201","0.375283710","199.232.37.140","192.168.1.118","TLSv1.2","117","Change Cipher Spec, Encrypted Handshake Message"
"202","0.375357125","192.168.1.118","199.232.37.140","TCP","66","33236 → 443 [ACK] Seq=644 Ack=3300 Win=35712 Len=0 TSval=26450020 TSecr=250567288"
"203","0.376063524","192.168.1.118","199.232.37.140","TLSv1.2","292","Application Data"
"204","0.383993202","199.232.37.140","192.168.1.118","TLSv1.2","117","Change Cipher Spec, Encrypted Handshake Message"
"205","0.384080142","192.168.1.118","199.232.37.140","TCP","66","33237 → 443 [ACK] Seq=644 Ack=3300 Win=35712 Len=0 TSval=26450029 TSecr=4180677438"
"206","0.385231583","192.168.1.118","199.232.37.140","TLSv1.2","293","Application Data"
"207","0.385805965","199.232.37.140","192.168.1.118","TLSv1.2","117","Change Cipher Spec, Encrypted Handshake Message"
"208","0.385900256","192.168.1.118","199.232.37.140","TCP","66","33239 → 443 [ACK] Seq=644 Ack=3300 Win=35712 Len=0 TSval=26450030 TSecr=3090974184"
"209","0.385959508","199.232.37.140","192.168.1.118","TLSv1.2","117","Change Cipher Spec, Encrypted Handshake Message"
"210","0.385984522","192.168.1.118","199.232.37.140","TCP","66","33238 → 443 [ACK] Seq=644 Ack=3418 Win=35968 Len=0 TSval=26450031 TSecr=251245180"
"211","0.386018460","199.232.37.140","192.168.1.118","TLSv1.2","2531","Application Data, Application Data, Application Data"
"212","0.386049149","192.168.1.118","199.232.37.140","TCP","66","33234 → 443 [ACK] Seq=852 Ack=5755 Win=40704 Len=0 TSval=26450031 TSecr=3211579232"
"213","0.386068775","199.232.37.140","192.168.1.118","TLSv1.2","117","Change Cipher Spec, Encrypted Handshake Message"
"214","0.386106801","199.232.37.140","192.168.1.118","TLSv1.2","3077","Application Data, Application Data, Application Data"
"215","0.386133527","192.168.1.118","199.232.37.140","TCP","66","33235 → 443 [ACK] Seq=854 Ack=6301 Win=41728 Len=0 TSval=26450031 TSecr=2791146331"
"216","0.386152678","199.232.37.140","192.168.1.118","TLSv1.2","117","Change Cipher Spec, Encrypted Handshake Message"
"217","0.386174978","199.232.37.140","192.168.1.118","TLSv1.2","117","Change Cipher Spec, Encrypted Handshake Message"
"218","0.386199279","192.168.1.118","199.232.37.140","TCP","66","33240 → 443 [ACK] Seq=644 Ack=3418 Win=35968 Len=0 TSval=26450031 TSecr=2790511467"
"219","0.386863352","192.168.1.118","199.232.37.140","TLSv1.2","371","Application Data"
"220","0.387178326","192.168.1.118","199.232.37.140","TLSv1.2","348","Application Data"
"221","0.387509563","192.168.1.118","199.232.37.140","TLSv1.2","370","Application Data"
"222","0.387734595","192.168.1.118","199.232.37.140","TLSv1.2","295","Application Data"
"223","0.387993629","192.168.1.118","199.232.37.140","TLSv1.2","295","Application Data"
"224","0.394907971","209.18.47.62","192.168.1.118","DNS","135","Standard query response 0x9c4e A b.thumbs.redditmedia.com CNAME reddit.map.fastly.net A 199.232.37.140"
"225","0.395091403","192.168.1.118","209.18.47.62","DNS","84","Standard query 0x8c1a AAAA b.thumbs.redditmedia.com"
"226","0.396382798","199.232.37.140","192.168.1.118","TLSv1.2","117","Change Cipher Spec, Encrypted Handshake Message"
"227","0.397668243","199.232.37.140","192.168.1.118","TCP","74","443 → 33244 [SYN, ACK] Seq=0 Ack=1 Win=27040 Len=0 MSS=1364 SACK_PERM=1 TSval=3229835914 TSecr=26450019 WS=512"
"228","0.397771222","192.168.1.118","199.232.37.140","TCP","66","33244 → 443 [ACK] Seq=1 Ack=1 Win=29312 Len=0 TSval=26450042 TSecr=3229835914"
"229","0.397820236","199.232.37.140","192.168.1.118","TLSv1.2","1418","Application Data"
"230","0.398501597","199.232.37.140","192.168.1.118","TLSv1.2","2770","Application Data, Application Data"
"231","0.398551174","192.168.1.118","199.232.37.140","TCP","66","33236 → 443 [ACK] Seq=870 Ack=7356 Win=43904 Len=0 TSval=26450043 TSecr=250567293"
"232","0.400326774","192.168.1.118","199.232.37.140","TLSv1.2","293","Application Data"
"233","0.400566657","199.232.37.140","192.168.1.118","TLSv1.2","2770","Application Data, Application Data"
"234","0.400647197","192.168.1.118","199.232.37.140","TCP","66","33236 → 443 [ACK] Seq=870 Ack=10060 Win=49280 Len=0 TSval=26450045 TSecr=250567293"
"235","0.402402109","199.232.37.140","192.168.1.118","TLSv1.2","1418","Application Data [TCP segment of a reassembled PDU]"
"236","0.404151395","199.232.37.140","192.168.1.118","TLSv1.2","2770","Application Data, Application Data"
"237","0.404234760","192.168.1.118","199.232.37.140","TCP","66","33236 → 443 [ACK] Seq=870 Ack=14116 Win=57344 Len=0 TSval=26450049 TSecr=250567293"
"238","0.410268397","199.232.37.140","192.168.1.118","TLSv1.2","921","Application Data"
"239","0.410333649","199.232.37.140","192.168.1.118","TCP","74","443 → 33245 [SYN, ACK] Seq=0 Ack=1 Win=27040 Len=0 MSS=1364 SACK_PERM=1 TSval=2791189139 TSecr=26450019 WS=512"
"240","0.410402126","192.168.1.118","199.232.37.140","TCP","66","33245 → 443 [ACK] Seq=1 Ack=1 Win=29312 Len=0 TSval=26450055 TSecr=2791189139"
"241","0.411253631","199.232.37.140","192.168.1.118","TLSv1.2","2770","Application Data, Application Data"
"242","0.411328884","192.168.1.118","199.232.37.140","TCP","66","33237 → 443 [ACK] Seq=871 Ack=6004 Win=41216 Len=0 TSval=26450056 TSecr=4180677441"
"243","0.412675531","199.232.37.140","192.168.1.118","TLSv1.2","4122","Application Data, Application Data, Application Data"
"244","0.412749871","192.168.1.118","199.232.37.140","TCP","66","33237 → 443 [ACK] Seq=871 Ack=10060 Win=49280 Len=0 TSval=26450057 TSecr=4180677441"
"245","0.419391166","209.18.47.62","192.168.1.118","DNS","135","Standard query response 0x384a A b.thumbs.redditmedia.com CNAME reddit.map.fastly.net A 199.232.37.140"
"246","0.419464868","209.18.47.62","192.168.1.118","DNS","177","Standard query response 0x8c1a AAAA b.thumbs.redditmedia.com CNAME reddit.map.fastly.net SOA ns1.fastly.net"
"247","0.419559934","199.232.37.140","192.168.1.118","TLSv1.2","6826","Application Data, Application Data, Application Data, Application Data, Application Data"
"248","0.419618824","192.168.1.118","199.232.37.140","TCP","66","33237 → 443 [ACK] Seq=871 Ack=16820 Win=62848 Len=0 TSval=26450064 TSecr=4180677441"
"249","0.419656875","199.232.37.140","192.168.1.118","TLSv1.2","13586","Application Data, Application Data, Application Data, Application Data, Application Data, Application Data, Application Data, Application Data, Application Data, Application Data"
"250","0.419691751","192.168.1.118","199.232.37.140","TCP","66","33242 → 443 [ACK] Seq=873 Ack=16842 Win=62848 Len=0 TSval=26450064 TSecr=1289725098"
"251","0.419705514","199.232.37.140","192.168.1.118","TLSv1.2","13586","Application Data, Application Data, Application Data, Application Data, Application Data, Application Data, Application Data, Application Data, Application Data, Application Data"
"252","0.419733903","192.168.1.118","199.232.37.140","TCP","66","33239 → 443 [ACK] Seq=926 Ack=16820 Win=62848 Len=0 TSval=26450064 TSecr=3090974208"
"253","0.419747316","199.232.37.140","192.168.1.118","TLSv1.2","13586","Application Data, Application Data, Application Data, Application Data, Application Data, Application Data, Application Data, Application Data, Application Data, Application Data"
"254","0.419776542","192.168.1.118","199.232.37.140","TCP","66","33241 → 443 [ACK] Seq=873 Ack=16842 Win=62848 Len=0 TSval=26450064 TSecr=3229063095"
"255","0.420050739","192.168.1.118","209.18.47.62","DNS","84","Standard query 0x6031 AAAA b.thumbs.redditmedia.com"
"256","0.420737000","192.168.1.118","199.232.37.140","TLSv1","583","Client Hello"
"257","0.421053099","199.232.37.140","192.168.1.118","TLSv1.2","3000","Application Data, Application Data, Application Data"
"258","0.421128064","192.168.1.118","199.232.37.140","TCP","66","33240 → 443 [ACK] Seq=948 Ack=6352 Win=41856 Len=0 TSval=26450066 TSecr=2790511473"
"259","0.421173628","199.232.37.140","192.168.1.118","TLSv1.2","1418","Application Data"
"260","0.421226043","199.232.37.140","192.168.1.118","TLSv1.2","2179","Application Data, Application Data, Application Data"
"261","0.421248231","192.168.1.118","199.232.37.140","TCP","66","33238 → 443 [ACK] Seq=949 Ack=6883 Win=42880 Len=0 TSval=26450066 TSecr=251245187"
"262","0.434249348","199.232.37.140","192.168.1.118","TLSv1.2","1418","Application Data"
"263","0.438303203","199.232.37.140","192.168.1.118","TLSv1.2","5474","Application Data, Application Data, Application Data, Application Data"
"264","0.438387806","192.168.1.118","199.232.37.140","TCP","66","33243 → 443 [ACK] Seq=871 Ack=10060 Win=49280 Len=0 TSval=26450083 TSecr=2792236840"
"265","0.438459946","192.168.1.118","199.232.37.140","TLSv1","583","Client Hello"
"266","0.438481409","199.232.37.140","192.168.1.118","TLSv1.2","1418","Application Data [TCP segment of a reassembled PDU]"
"267","0.438536673","199.232.37.140","192.168.1.118","TLSv1.2","5474","Application Data, Application Data, Application Data, Application Data"
"268","0.438559837","192.168.1.118","199.232.37.140","TCP","66","33243 → 443 [ACK] Seq=871 Ack=16820 Win=62848 Len=0 TSval=26450083 TSecr=2792236840"
"269","0.439877995","192.168.1.118","199.232.37.140","TCP","74","33246 → 443 [SYN] Seq=0 Win=29200 Len=0 MSS=1460 SACK_PERM=1 TSval=26450084 TSecr=0 WS=128"
"270","0.440042601","192.168.1.118","199.232.37.140","TCP","74","33247 → 443 [SYN] Seq=0 Win=29200 Len=0 MSS=1460 SACK_PERM=1 TSval=26450085 TSecr=0 WS=128"
"271","0.450003312","192.168.1.118","199.232.37.140","TCP","66","33236 → 443 [ACK] Seq=870 Ack=14971 Win=60032 Len=0 TSval=26450095 TSecr=250567293"
"272","0.451516403","199.232.37.140","192.168.1.118","TLSv1.2","1418","Application Data [TCP segment of a reassembled PDU]"
"273","0.455088615","199.232.37.140","192.168.1.118","TLSv1.2","372","Application Data"
"274","0.455158555","192.168.1.118","199.232.37.140","TCP","66","33237 → 443 [ACK] Seq=871 Ack=18478 Win=68224 Len=0 TSval=26450100 TSecr=4180677455"
"275","0.457334781","199.232.37.140","192.168.1.118","TLSv1.2","1223","Application Data, Application Data"
"276","0.457432460","199.232.37.140","192.168.1.118","TLSv1.2","5474","Application Data, Application Data, Application Data, Application Data"
"277","0.457471974","192.168.1.118","199.232.37.140","TCP","66","33241 → 443 [ACK] Seq=873 Ack=22250 Win=73600 Len=0 TSval=26450102 TSecr=3229063106"
"278","0.457510487","199.232.37.140","192.168.1.118","TLSv1.2","1418","Application Data [TCP segment of a reassembled PDU]"
"279","0.459467218","199.232.37.140","192.168.1.118","TLSv1.2","1418","Application Data [TCP segment of a reassembled PDU]"
"280","0.459545859","192.168.1.118","199.232.37.140","TCP","66","33243 → 443 [ACK] Seq=871 Ack=19524 Win=68224 Len=0 TSval=26450104 TSecr=2792236847"
"281","0.460516605","199.232.37.140","192.168.1.118","TLSv1.2","1697","Application Data, Application Data"
"282","0.460581457","192.168.1.118","199.232.37.140","TCP","66","33242 → 443 [ACK] Seq=873 Ack=18473 Win=66048 Len=0 TSval=26450105 TSecr=1289725146"
"283","0.460631884","199.232.37.140","192.168.1.118","TLSv1.2","5474","Application Data, Application Data, Application Data, Application Data"
"284","0.460656548","192.168.1.118","199.232.37.140","TCP","66","33241 → 443 [ACK] Seq=873 Ack=27658 Win=84480 Len=0 TSval=26450105 TSecr=3229063106"
"285","0.460677236","199.232.37.140","192.168.1.118","TCP","74","443 → 33246 [SYN, ACK] Seq=0 Ack=1 Win=27040 Len=0 MSS=1364 SACK_PERM=1 TSval=641185526 TSecr=26450084 WS=512"
"286","0.460732588","192.168.1.118","199.232.37.140","TCP","66","33246 → 443 [ACK] Seq=1 Ack=1 Win=29312 Len=0 TSval=26450105 TSecr=641185526"
"287","0.460757914","199.232.37.140","192.168.1.118","TLSv1.2","4122","Application Data, Application Data"
"288","0.460784352","192.168.1.118","199.232.37.140","TCP","66","33241 → 443 [ACK] Seq=873 Ack=31714 Win=92544 Len=0 TSval=26450105 TSecr=3229063107"
"289","0.460800090","199.232.37.140","192.168.1.118","TCP","66","443 → 33244 [ACK] Seq=1 Ack=518 Win=28160 Len=0 TSval=3229835929 TSecr=26450065"
"290","0.460819841","199.232.37.140","192.168.1.118","TCP","66","443 → 33245 [ACK] Seq=1 Ack=518 Win=28160 Len=0 TSval=2791189154 TSecr=26450083"
"291","0.460838354","199.232.37.140","192.168.1.118","TCP","74","443 → 33247 [SYN, ACK] Seq=0 Ack=1 Win=27040 Len=0 MSS=1364 SACK_PERM=1 TSval=2751144090 TSecr=26450085 WS=512"
"292","0.460865480","192.168.1.118","199.232.37.140","TCP","66","33247 → 443 [ACK] Seq=1 Ack=1 Win=29312 Len=0 TSval=26450105 TSecr=2751144090"
"293","0.460890518","199.232.37.140","192.168.1.118","TLSv1.2","2770","Server Hello"
"294","0.460912544","192.168.1.118","199.232.37.140","TCP","66","33244 → 443 [ACK] Seq=518 Ack=2705 Win=34688 Len=0 TSval=26450105 TSecr=3229835930"
"295","0.462645442","199.232.37.140","192.168.1.118","TLSv1.2","610","Certificate, Server Key Exchange, Server Hello Done"
"296","0.462722145","192.168.1.118","199.232.37.140","TCP","66","33244 → 443 [ACK] Seq=518 Ack=3249 Win=37376 Len=0 TSval=26450107 TSecr=3229835930"
"297","0.462779722","199.232.37.140","192.168.1.118","TLSv1.2","3336","Server Hello, Certificate, Server Key Exchange, Server Hello Done"
"298","0.462804260","192.168.1.118","199.232.37.140","TCP","66","33245 → 443 [ACK] Seq=518 Ack=3271 Win=35840 Len=0 TSval=26450107 TSecr=2791189154"
"299","0.462822611","209.18.47.62","192.168.1.118","DNS","177","Standard query response 0x6031 AAAA b.thumbs.redditmedia.com CNAME reddit.map.fastly.net SOA ns1.fastly.net"
"300","0.464009627","199.232.37.140","192.168.1.118","TLSv1.2","2770","Application Data, Application Data"
"301","0.464073267","192.168.1.118","199.232.37.140","TCP","66","33241 → 443 [ACK] Seq=873 Ack=34418 Win=98048 Len=0 TSval=26450109 TSecr=3229063107"
"302","0.464106793","199.232.37.140","192.168.1.118","TLSv1.2","2770","Application Data, Application Data"
"303","0.464125981","192.168.1.118","199.232.37.140","TCP","66","33243 → 443 [ACK] Seq=871 Ack=22228 Win=73600 Len=0 TSval=26450109 TSecr=2792236847"
"304","0.471839851","199.232.37.140","192.168.1.118","TLSv1.2","1418","Application Data [TCP segment of a reassembled PDU]"
"305","0.473137547","199.232.37.140","192.168.1.118","TLSv1.2","1418","Application Data [TCP segment of a reassembled PDU]"
"306","0.473217450","192.168.1.118","199.232.37.140","TCP","66","33241 → 443 [ACK] Seq=873 Ack=37122 Win=103424 Len=0 TSval=26450118 TSecr=3229063107"
"307","0.473257264","199.232.37.140","192.168.1.118","TLSv1.2","2770","Application Data, Application Data"
"308","0.473279414","192.168.1.118","199.232.37.140","TCP","66","33243 → 443 [ACK] Seq=871 Ack=24932 Win=78976 Len=0 TSval=26450118 TSecr=2792236849"
"309","0.477495149","199.232.37.140","192.168.1.118","TLSv1.2","1333","Application Data"
"310","0.477557627","199.232.37.140","192.168.1.118","TLSv1.2","2770","Application Data, Application Data"
"311","0.477601178","192.168.1.118","199.232.37.140","TCP","66","33241 → 443 [ACK] Seq=873 Ack=39826 Win=108800 Len=0 TSval=26450122 TSecr=3229063108"
"312","0.478860222","199.232.37.140","192.168.1.118","TLSv1.2","736","Application Data, Application Data"
"313","0.479795517","192.168.1.118","199.232.37.140","TLSv1","583","Client Hello"
"314","0.481504990","199.232.37.140","192.168.1.118","TCP","66","[TCP Dup ACK 289#1] 443 → 33244 [ACK] Seq=3249 Ack=518 Win=28160 Len=0 TSval=3229835936 TSecr=26450107"
"315","0.481946705","192.168.1.118","199.232.37.140","TLSv1.2","192","Client Key Exchange, Change Cipher Spec, Encrypted Handshake Message"
"316","0.497005995","192.168.1.118","199.232.37.140","TCP","66","33239 → 443 [ACK] Seq=926 Ack=17977 Win=65536 Len=0 TSval=26450142 TSecr=3090974256"
"317","0.498952400","192.168.1.118","199.232.37.140","TLSv1","583","Client Hello"
"318","0.499486544","199.232.37.140","192.168.1.118","TCP","66","443 → 33246 [ACK] Seq=1 Ack=518 Win=28160 Len=0 TSval=641185537 TSecr=26450124"
"319","0.501336734","192.168.1.118","199.232.37.140","TLSv1.2","192","Client Key Exchange, Change Cipher Spec, Encrypted Handshake Message"
"320","0.503906986","199.232.37.140","192.168.1.118","TLSv1.2","117","Change Cipher Spec, Encrypted Handshake Message"
"321","0.505298522","192.168.1.118","199.232.37.140","TLSv1.2","348","Application Data"
"322","0.505392938","199.232.37.140","192.168.1.118","TLSv1.2","3336","Server Hello, Certificate, Server Key Exchange, Server Hello Done"
"323","0.505461453","192.168.1.118","199.232.37.140","TCP","66","33246 → 443 [ACK] Seq=518 Ack=3271 Win=35840 Len=0 TSval=26450150 TSecr=641185537"
"324","0.507807435","192.168.1.118","199.232.37.140","TLSv1.2","192","Client Key Exchange, Change Cipher Spec, Encrypted Handshake Message"
"325","0.517001595","192.168.1.118","199.232.37.140","TCP","66","33243 → 443 [ACK] Seq=871 Ack=26199 Win=81664 Len=0 TSval=26450162 TSecr=2792236849"
"326","0.517989179","192.168.1.118","199.232.37.140","TCP","66","33241 → 443 [ACK] Seq=873 Ack=40496 Win=111488 Len=0 TSval=26450163 TSecr=3229063111"
"327","0.521262681","199.232.37.140","192.168.1.118","TCP","66","443 → 33247 [ACK] Seq=1 Ack=518 Win=28160 Len=0 TSval=2751144107 TSecr=26450143"
"328","0.522347382","199.232.37.140","192.168.1.118","TLSv1.2","117","Change Cipher Spec, Encrypted Handshake Message"
"329","0.522409234","199.232.37.140","192.168.1.118","TLSv1.2","1418","Server Hello"
"330","0.522453548","192.168.1.118","199.232.37.140","TCP","66","33247 → 443 [ACK] Seq=518 Ack=1353 Win=32000 Len=0 TSval=26450167 TSecr=2751144107"
"331","0.523615651","192.168.1.118","199.232.37.140","TLSv1.2","295","Application Data"
"332","0.523976989","199.232.37.140","192.168.1.118","TLSv1.2","1984","Certificate, Server Key Exchange, Server Hello Done"
"333","0.524053416","192.168.1.118","199.232.37.140","TCP","66","33247 → 443 [ACK] Seq=518 Ack=3271 Win=35840 Len=0 TSval=26450169 TSecr=2751144107"
"334","0.530290447","192.168.1.118","199.232.37.140","TLSv1.2","192","Client Key Exchange, Change Cipher Spec, Encrypted Handshake Message"
"335","0.543349217","199.232.37.140","192.168.1.118","TLSv1.2","117","Change Cipher Spec, Encrypted Handshake Message"
"336","0.543451883","199.232.37.140","192.168.1.118","TLSv1.2","5474","Application Data, Application Data, Application Data, Application Data"
"337","0.543501647","192.168.1.118","199.232.37.140","TCP","66","33244 → 443 [ACK] Seq=926 Ack=8708 Win=48128 Len=0 TSval=26450188 TSecr=3229835950"
"338","0.543592013","199.232.37.140","192.168.1.118","TLSv1.2","1485","Application Data, Application Data"
"339","0.543616176","192.168.1.118","199.232.37.140","TCP","66","33244 → 443 [ACK] Seq=926 Ack=10127 Win=51072 Len=0 TSval=26450188 TSecr=3229835950"
"340","0.544373928","192.168.1.118","199.232.37.140","TLSv1.2","295","Application Data"
"341","0.563315303","199.232.37.140","192.168.1.118","TLSv1.2","1418","Application Data"
"342","0.567619316","199.232.37.140","192.168.1.118","TLSv1.2","5474","Application Data, Application Data, Application Data, Application Data"
"343","0.567707669","192.168.1.118","199.232.37.140","TCP","66","33245 → 443 [ACK] Seq=873 Ack=10082 Win=49280 Len=0 TSval=26450212 TSecr=2791189180"
"344","0.567803760","199.232.37.140","192.168.1.118","TLSv1.2","3287","Application Data, Application Data, Application Data"
"345","0.567827548","192.168.1.118","199.232.37.140","TCP","66","33245 → 443 [ACK] Seq=873 Ack=13303 Win=55808 Len=0 TSval=26450212 TSecr=2791189180"
"346","0.567848449","199.232.37.140","192.168.1.118","TLSv1.2","117","Change Cipher Spec, Encrypted Handshake Message"
"347","0.569176171","192.168.1.118","199.232.37.140","TLSv1.2","295","Application Data"
"348","0.579761541","199.232.37.140","192.168.1.118","TLSv1.2","1418","Application Data"
"349","0.583574224","199.232.37.140","192.168.1.118","TLSv1.2","5474","Application Data, Application Data, Application Data, Application Data"
"350","0.583663440","192.168.1.118","199.232.37.140","TCP","66","33246 → 443 [ACK] Seq=873 Ack=10082 Win=49280 Len=0 TSval=26450228 TSecr=641185557"
"351","0.583778157","199.232.37.140","192.168.1.118","TLSv1.2","6826","Application Data, Application Data, Application Data, Application Data, Application Data"
"352","0.583805158","192.168.1.118","199.232.37.140","TCP","66","33246 → 443 [ACK] Seq=873 Ack=16842 Win=62848 Len=0 TSval=26450228 TSecr=641185557"
"353","0.586531340","199.232.37.140","192.168.1.118","TLSv1.2","1418","Application Data"
"354","0.588230750","199.232.37.140","192.168.1.118","TLSv1.2","8178","Application Data, Application Data, Application Data, Application Data, Application Data, Application Data"
"355","0.588314003","192.168.1.118","199.232.37.140","TCP","66","33247 → 443 [ACK] Seq=873 Ack=12786 Win=54784 Len=0 TSval=26450233 TSecr=2751144123"
"356","0.599906259","199.232.37.140","192.168.1.118","TLSv1.2","4122","Application Data, Application Data, Application Data"
"357","0.600008587","192.168.1.118","199.232.37.140","TCP","66","33247 → 443 [ACK] Seq=873 Ack=16842 Win=62848 Len=0 TSval=26450245 TSecr=2751144123"
"358","0.616709547","199.232.37.140","192.168.1.118","TLSv1.2","5474","Application Data, Application Data, Application Data, Application Data"
"359","0.616797587","192.168.1.118","199.232.37.140","TCP","66","33246 → 443 [ACK] Seq=873 Ack=22250 Win=73600 Len=0 TSval=26450261 TSecr=641185562"
"360","0.618353529","199.232.37.140","192.168.1.118","TLSv1.2","8178","Application Data, Application Data, Application Data, Application Data, Application Data"
"361","0.618433782","192.168.1.118","199.232.37.140","TCP","66","33246 → 443 [ACK] Seq=873 Ack=30362 Win=89856 Len=0 TSval=26450263 TSecr=641185562"
"362","0.618468658","199.232.37.140","192.168.1.118","TLSv1.2","1418","Application Data [TCP segment of a reassembled PDU]"
"363","0.618525510","199.232.37.140","192.168.1.118","TLSv1.2","6826","Application Data, Application Data, Application Data, Application Data, Application Data"
"364","0.618550011","192.168.1.118","199.232.37.140","TCP","66","33247 → 443 [ACK] Seq=873 Ack=23602 Win=76416 Len=0 TSval=26450263 TSecr=2751144129"
"365","0.620942457","199.232.37.140","192.168.1.118","TLSv1.2","5474","Application Data, Application Data, Application Data"
"366","0.621025123","192.168.1.118","199.232.37.140","TCP","66","33247 → 443 [ACK] Seq=873 Ack=29010 Win=87168 Len=0 TSval=26450266 TSecr=2751144129"
"367","0.622547801","199.232.37.140","192.168.1.118","TLSv1.2","5474","Application Data, Application Data, Application Data, Application Data"
"368","0.622622279","192.168.1.118","199.232.37.140","TCP","66","33247 → 443 [ACK] Seq=873 Ack=34418 Win=98048 Len=0 TSval=26450267 TSecr=2751144129"
"369","0.622708782","199.232.37.140","192.168.1.118","TLSv1.2","5474","Application Data, Application Data, Application Data, Application Data"
"370","0.622734633","192.168.1.118","199.232.37.140","TCP","66","33246 → 443 [ACK] Seq=873 Ack=37122 Win=103424 Len=0 TSval=26450267 TSecr=641185564"
"371","0.622762646","199.232.37.140","192.168.1.118","TLSv1.2","2770","Application Data, Application Data"
"372","0.622782922","192.168.1.118","199.232.37.140","TCP","66","33246 → 443 [ACK] Seq=873 Ack=39826 Win=108800 Len=0 TSval=26450267 TSecr=641185565"
"373","0.622799935","199.232.37.140","192.168.1.118","TLSv1.2","1418","Application Data [TCP segment of a reassembled PDU]"
"374","0.622814110","199.232.37.140","192.168.1.118","TLSv1.2","1418","Application Data [TCP segment of a reassembled PDU]"
"375","0.624130719","199.232.37.140","192.168.1.118","TLSv1.2","2770","Application Data, Application Data"
"376","0.624211772","192.168.1.118","199.232.37.140","TCP","66","33246 → 443 [ACK] Seq=873 Ack=43882 Win=116864 Len=0 TSval=26450269 TSecr=641185566"
"377","0.647391733","199.232.37.140","192.168.1.118","TLSv1.2","1418","Application Data [TCP segment of a reassembled PDU]"
"378","0.650108028","199.232.37.140","192.168.1.118","TLSv1.2","1418","Application Data [TCP segment of a reassembled PDU]"
"379","0.650187368","192.168.1.118","199.232.37.140","TCP","66","33246 → 443 [ACK] Seq=873 Ack=46586 Win=116992 Len=0 TSval=26450295 TSecr=641185572"
"380","0.650227695","199.232.37.140","192.168.1.118","TLSv1.2","4122","Application Data, Application Data, Application Data"
"381","0.650257546","192.168.1.118","199.232.37.140","TCP","66","33247 → 443 [ACK] Seq=873 Ack=39826 Win=108800 Len=0 TSval=26450295 TSecr=2751144129"
"382","0.651769836","199.232.37.140","192.168.1.118","TLSv1.2","4122","Application Data, Application Data, Application Data"
"383","0.651850339","192.168.1.118","199.232.37.140","TCP","66","33247 → 443 [ACK] Seq=873 Ack=43882 Win=116864 Len=0 TSval=26450296 TSecr=2751144137"
"384","0.651919354","199.232.37.140","192.168.1.118","TLSv1.2","8178","Application Data, Application Data, Application Data, Application Data, Application Data, Application Data"
"385","0.651974268","199.232.37.140","192.168.1.118","TLSv1.2","4122","Application Data, Application Data, Application Data"
"386","0.657624541","199.232.37.140","192.168.1.118","TLSv1.2","1418","Application Data [TCP segment of a reassembled PDU]"
"387","0.657721845","199.232.37.140","192.168.1.118","TLSv1.2","4122","Application Data, Application Data, Application Data"
"388","0.659329251","199.232.37.140","192.168.1.118","TLSv1.2","6826","Application Data, Application Data, Application Data, Application Data"
"389","0.659387453","199.232.37.140","192.168.1.118","TLSv1.2","1418","Application Data [TCP segment of a reassembled PDU]"
"390","0.659439592","199.232.37.140","192.168.1.118","TLSv1.2","8178","Application Data, Application Data, Application Data, Application Data, Application Data, Application Data"
"391","0.664326776","199.232.37.140","192.168.1.118","TLSv1.2","2770","Application Data, Application Data"
"392","0.664417154","199.232.37.140","192.168.1.118","TLSv1.2","2770","Application Data, Application Data"
"393","0.666005884","199.232.37.140","192.168.1.118","TLSv1.2","2770","Application Data, Application Data"
"394","0.666113463","199.232.37.140","192.168.1.118","TLSv1.2","10882","Application Data, Application Data, Application Data, Application Data, Application Data, Application Data, Application Data, Application Data"
"395","0.666155465","199.232.37.140","192.168.1.118","TLSv1.2","2770","Application Data [TCP segment of a reassembled PDU]"
"396","0.668806320","199.232.37.140","192.168.1.118","TLSv1.2","5474","Application Data, Application Data, Application Data, Application Data"
"397","0.670425677","199.232.37.140","192.168.1.118","TLSv1.2","5474","Application Data, Application Data, Application Data, Application Data"
"398","0.670537493","199.232.37.140","192.168.1.118","TLSv1.2","10882","Application Data, Application Data, Application Data, Application Data, Application Data, Application Data, Application Data, Application Data"
"399","0.672561601","199.232.37.140","192.168.1.118","TLSv1.2","1418","Application Data [TCP segment of a reassembled PDU]"
"400","0.672634229","199.232.37.140","192.168.1.118","TLSv1.2","4122","Application Data, Application Data, Application Data"
"401","0.672702806","199.232.37.140","192.168.1.118","TLSv1.2","2770","Application Data, Application Data"
"402","0.680777026","199.232.37.140","192.168.1.118","TLSv1.2","1418","Application Data [TCP segment of a reassembled PDU]"
"403","0.685580045","199.232.37.140","192.168.1.118","TLSv1.2","1418","Application Data [TCP segment of a reassembled PDU]"
"404","0.685645859","199.232.37.140","192.168.1.118","TLSv1.2","4122","Application Data, Application Data, Application Data"
"405","0.685683748","192.168.1.118","199.232.37.140","TCP","66","33247 → 443 [ACK] Seq=873 Ack=81738 Win=79104 Len=0 TSval=26450330 TSecr=2751144137"
"406","0.687204126","199.232.37.140","192.168.1.118","TLSv1.2","6826","Application Data, Application Data, Application Data, Application Data, Application Data"
"407","0.687302042","199.232.37.140","192.168.1.118","TLSv1.2","8178","Application Data, Application Data, Application Data, Application Data, Application Data, Application Data"
"408","0.687315980","199.232.37.140","192.168.1.118","TLSv1.2","1418","Application Data [TCP segment of a reassembled PDU]"
"409","0.691797375","199.232.37.140","192.168.1.118","TLSv1.2","1418","Application Data [TCP segment of a reassembled PDU]"
"410","0.700949457","199.232.37.140","192.168.1.118","TLSv1.2","1418","Application Data [TCP segment of a reassembled PDU]"
"411","0.703864622","199.232.37.140","192.168.1.118","TLSv1.2","8178","Application Data, Application Data, Application Data, Application Data, Application Data, Application Data"
"412","0.703980139","192.168.1.118","199.232.37.140","TCP","66","33246 → 443 [ACK] Seq=873 Ack=103370 Win=60288 Len=0 TSval=26450349 TSecr=641185572"
"413","0.704099530","199.232.37.140","192.168.1.118","TLSv1.2","5474","Application Data, Application Data, Application Data"
"414","0.711199291","199.232.37.140","192.168.1.118","TLSv1.2","5474","Application Data, Application Data, Application Data, Application Data"
"415","0.711331483","199.232.37.140","192.168.1.118","TLSv1.2","6093","Application Data, Application Data, Application Data, Application Data, Application Data, Application Data"
"416","0.722079722","199.232.37.140","192.168.1.118","TLSv1.2","1418","Application Data [TCP segment of a reassembled PDU]"
"417","0.723668703","199.232.37.140","192.168.1.118","TLSv1.2","4122","Application Data, Application Data"
"418","0.725098778","199.232.37.140","192.168.1.118","TLSv1.2","2770","Application Data, Application Data"
"419","0.725139167","199.232.37.140","192.168.1.118","TLSv1.2","78","Application Data"
"420","0.726999707","192.168.1.118","199.232.37.140","TCP","66","33247 → 443 [ACK] Seq=873 Ack=122917 Win=38016 Len=0 TSval=26450372 TSecr=2751144147"
"421","0.762005907","192.168.1.118","199.232.37.140","TCP","66","33246 → 443 [ACK] Seq=873 Ack=111494 Win=52224 Len=0 TSval=26450407 TSecr=641185593"
"422","0.850453627","192.168.1.104","255.255.255.255","UDP","217","49154 → 6666 Len=175"
"423","0.973704604","192.168.1.118","199.232.37.140","TLSv1.2","249","Application Data"
"424","0.999416203","199.232.37.140","192.168.1.118","TLSv1.2","1151","Application Data, Application Data"
"425","0.999502981","192.168.1.118","199.232.37.140","TCP","66","33231 → 443 [ACK] Seq=1017 Ack=13893 Win=448 Len=0 TSval=26450644 TSecr=2792236982"
"426","1.055082439","192.168.1.118","199.232.37.140","TCP","66","[TCP Window Update] 33247 → 443 [ACK] Seq=873 Ack=122917 Win=87936 Len=0 TSval=26450700 TSecr=2751144147"
"427","1.055461465","192.168.1.118","199.232.37.140","TCP","66","[TCP Window Update] 33246 → 443 [ACK] Seq=873 Ack=111494 Win=116992 Len=0 TSval=26450700 TSecr=641185593"
"428","1.870790388","192.168.1.100","224.0.0.251","MDNS","533","Standard query 0x0000 PTR _uscan._tcp.local, "QM" question PTR _ippusb._tcp.local, "QM" question PTR _uscans._tcp.local, "QM" question PTR _scanner._tcp.local, "QM" question PTR _ipp._tcp.local, "QM" question PTR _ipps._tcp.local, "QM" question PTR _printer._tcp.local, "QM" question PTR _pdl-datastream._tcp.local, "QM" question PTR _ptp._tcp.local, "QM" question PTR _airplay._tcp.local, "QM" question PTR _raop._tcp.local, "QM" question PTR _airport._tcp.local, "QM" question PTR _rdlink._tcp.local, "QM" question PTR _googlecast._tcp.local, "QM" question PTR _homekit._tcp.local, "QM" question PTR _companion-link._tcp.local, "QM" question PTR _apple-mobdev._tcp.local, "QM" question PTR 8ed307c3._sub._apple-mobdev2._tcp.local, "QM" question PTR _apple-pairable._tcp.local, "QM" question PTR _afpovertcp._tcp.local, "QM" question PTR _rfb._tcp.local, "QM" question PTR _adisk._tcp.local, "QM" question TXT Google-Home-Mini-2c3f16b2da5c4b6fd6cfbfba61c12490._googlecast._tcp.local, "QM" question PTR Google-Home-Mini-2c3f16b2da5c4b6fd6cfbfba61c12490._googlecast._tcp.local PTR cjqg._companion-link._tcp.local OPT"
"429","1.910804663","192.168.1.118","192.168.1.102","TCP","176","38457 → 8009 [PSH, ACK] Seq=1 Ack=1 Win=364 Len=110 TSval=26451555 TSecr=5235809 [TCP segment of a reassembled PDU]"
"430","1.932562987","192.168.1.102","192.168.1.118","TCP","176","8009 → 38457 [PSH, ACK] Seq=1 Ack=111 Win=287 Len=110 TSval=5236311 TSecr=26451555 [TCP segment of a reassembled PDU]"
"431","1.932669253","192.168.1.118","192.168.1.102","TCP","66","38457 → 8009 [ACK] Seq=111 Ack=111 Win=364 Len=0 TSval=26451577 TSecr=5236311"
"432","1.972171786","192.168.1.102","224.0.0.251","MDNS","183","Standard query response 0x0000 SRV, cache flush 0 0 8009 2c3f16b2-da5c-4b6f-d6cf-bfba61c12490.local"
"433","3.815384721","192.168.1.104","255.255.255.255","UDP","217","49154 → 6666 Len=175"
"434","6.785237587","192.168.1.104","255.255.255.255","UDP","217","49154 → 6666 Len=175"
"435","6.934260615","192.168.1.118","192.168.1.102","TCP","176","38457 → 8009 [PSH, ACK] Seq=111 Ack=111 Win=364 Len=110 TSval=26456579 TSecr=5236311 [TCP segment of a reassembled PDU]"
"436","6.940720366","192.168.1.102","192.168.1.118","TCP","176","8009 → 38457 [PSH, ACK] Seq=111 Ack=221 Win=287 Len=110 TSval=5236813 TSecr=26456579 [TCP segment of a reassembled PDU]"
"437","6.940824357","192.168.1.118","192.168.1.102","TCP","66","38457 → 8009 [ACK] Seq=221 Ack=221 Win=364 Len=0 TSval=26456585 TSecr=5236813"
"438","7.295192159","142.250.31.188","192.168.1.118","TLSv1.2","519","Application Data"
"439","7.334998053","192.168.1.118","142.250.31.188","TCP","66","33250 → 443 [ACK] Seq=1 Ack=454 Win=1418 Len=0 TSval=26456980 TSecr=2986745053"
"440","7.362321759","142.250.31.188","192.168.1.118","TLSv1.2","521","Application Data"
"441","7.362414087","192.168.1.118","142.250.31.188","TCP","66","33250 → 443 [ACK] Seq=1 Ack=909 Win=1416 Len=0 TSval=26457007 TSecr=2986745185"
"442","8.729521921","192.168.1.103","224.0.0.251","MDNS","139","Standard query 0x0000 PTR _companion-link._tcp.local, "QU" question PTR _sleep-proxy._udp.local, "QU" question OPT"
"443","9.038299203","192.168.1.103","224.0.0.251","IGMPv2","46","Membership Report group 224.0.0.251"
