frame.number,_ws.col.Time,_ws.col.Source,_ws.col.Destination,_ws.col.Protocol,frame.len,_ws.col.Info
"1","0.000000000","199.232.37.164","192.168.1.118","SSL","2770","Continuation Data"
"2","0.007147150","192.168.1.118","199.232.37.164","TCP","66","33020 → 443 [ACK] Seq=1 Ack=2705 Win=428 Len=0 TSval=647126600 TSecr=2817518741"
"3","0.021995238","199.232.37.164","192.168.1.118","SSL","1418","Continuation Data"
"4","0.028825275","199.232.37.164","192.168.1.118","TCP","2770","443 → 33020 [ACK] Seq=4057 Ack=1 Win=57 Len=2704 TSval=2817518741 TSecr=647126537"
"5","0.028887113","192.168.1.118","199.232.37.164","TCP","66","33020 → 443 [ACK] Seq=1 Ack=6761 Win=477 Len=0 TSval=647126622 TSecr=2817518741"
"6","0.031280750","199.232.37.164","192.168.1.118","SSL","213","Continuation Data"
"7","0.031349663","199.232.37.164","192.168.1.118","TLSv1.2","1418","Application Data"
"8","0.036530488","199.232.37.164","192.168.1.118","TLSv1.2","5474","Application Data, Application Data, Application Data, Application Data"
"9","0.036655400","199.232.37.164","192.168.1.118","TLSv1.2","117","Change Cipher Spec, Encrypted Handshake Message"
"10","0.036696263","192.168.1.118","199.232.37.164","TCP","66","33014 → 443 [ACK] Seq=1 Ack=52 Win=501 Len=0 TSval=647126630 TSecr=3918745823"
"11","0.036742450","199.232.37.164","192.168.1.118","TLSv1.2","6826","Application Data, Application Data, Application Data, Application Data"
"12","0.036755975","199.232.37.164","192.168.1.118","SSL","2770","Continuation Data"
"13","0.037539050","199.232.37.164","192.168.1.118","SSL","1034","Continuation Data"
"14","0.037567650","199.232.37.164","192.168.1.118","TLSv1.2","117","Change Cipher Spec, Encrypted Handshake Message"
"15","0.037596913","192.168.1.118","199.232.37.164","TCP","66","33016 → 443 [ACK] Seq=1 Ack=52 Win=501 Len=0 TSval=647126630 TSecr=215694670"
"16","0.072389550","192.168.1.118","199.232.37.164","TCP","66","33018 → 443 [ACK] Seq=1 Ack=13521 Win=396 Len=0 TSval=647126665 TSecr=277574564"
"17","0.077387625","192.168.1.118","199.232.37.164","TCP","66","33020 → 443 [ACK] Seq=1 Ack=10433 Win=449 Len=0 TSval=647126670 TSecr=2817518751"
"18","0.077440375","192.168.1.118","199.232.37.164","TCP","66","33012 → 443 [ACK] Seq=1 Ack=148 Win=493 Len=0 TSval=647126670 TSecr=474039779"
"19","0.128261663","199.232.37.164","192.168.1.118","TLSv1.2","1418","Application Data [TCP segment of a reassembled PDU]"
"20","0.128350038","192.168.1.118","199.232.37.164","TCP","66","33018 → 443 [ACK] Seq=1 Ack=14873 Win=386 Len=0 TSval=647126721 TSecr=277574590"
"21","0.131631375","199.232.37.164","192.168.1.118","TLSv1.2","5474","Application Data, Application Data, Application Data, Application Data"
"22","0.131698038","192.168.1.118","199.232.37.164","TCP","66","33018 → 443 [ACK] Seq=1 Ack=20281 Win=344 Len=0 TSval=647126725 TSecr=277574590"
"23","0.132008000","199.232.37.164","192.168.1.118","TLSv1.2","14938","Application Data, Application Data, Application Data, Application Data, Application Data, Application Data, Application Data, Application Data, Application Data, Application Data, Application Data"
"24","0.132024600","199.232.37.164","192.168.1.118","TLSv1.2","1418","Application Data [TCP segment of a reassembled PDU]"
"25","0.144767513","199.232.37.164","192.168.1.118","TLSv1.2","1418","Application Data [TCP segment of a reassembled PDU]"
"26","0.144829975","199.232.37.164","192.168.1.118","TLSv1.2","2770","Application Data, Application Data"
"27","0.163463675","199.232.37.164","192.168.1.118","TLSv1.2","1418","Application Data [TCP segment of a reassembled PDU]"
"28","0.163534275","192.168.1.118","199.232.37.164","TCP","66","33018 → 443 [ACK] Seq=1 Ack=41913 Win=175 Len=0 TSval=647126756 TSecr=277574590"
"29","0.163576200","199.232.37.164","192.168.1.118","TLSv1.2","822","Application Data"
"30","0.199455050","192.168.1.118","199.232.37.164","TLSv1.2","397","Application Data"
"31","0.199829300","192.168.1.118","199.232.37.164","TLSv1.2","342","Application Data"
"32","0.200879313","192.168.1.118","199.232.37.164","TLSv1.2","350","Application Data"
"33","0.204391650","192.168.1.118","199.232.37.164","TCP","66","33018 → 443 [ACK] Seq=1 Ack=42669 Win=170 Len=0 TSval=647126797 TSecr=277574607"
"34","0.231870013","199.232.37.164","192.168.1.118","TLSv1.2","1418","Application Data"
"35","0.231943350","192.168.1.118","199.232.37.164","TCP","66","33014 → 443 [ACK] Seq=332 Ack=1404 Win=493 Len=0 TSval=647126825 TSecr=3918745879"
"36","0.234606738","199.232.37.164","192.168.1.118","TLSv1.2","1418","Application Data"
"37","0.234676663","192.168.1.118","199.232.37.164","TCP","66","33016 → 443 [ACK] Seq=277 Ack=1404 Win=493 Len=0 TSval=647126828 TSecr=215694723"
"38","0.238456263","199.232.37.164","192.168.1.118","TLSv1.2","5474","Application Data, Application Data, Application Data, Application Data"
"39","0.238523900","192.168.1.118","199.232.37.164","TCP","66","33014 → 443 [ACK] Seq=332 Ack=6812 Win=451 Len=0 TSval=647126831 TSecr=3918745879"
"40","0.238738650","199.232.37.164","192.168.1.118","TLSv1.2","8178","Application Data, Application Data, Application Data, Application Data, Application Data, Application Data"
"41","0.238770700","192.168.1.118","199.232.37.164","TCP","66","33012 → 443 [ACK] Seq=285 Ack=8260 Win=438 Len=0 TSval=647126832 TSecr=474040024"
"42","0.238792300","199.232.37.164","192.168.1.118","TLSv1.2","6826","Application Data, Application Data, Application Data, Application Data"
"43","0.238811125","192.168.1.118","199.232.37.164","TCP","66","33014 → 443 [ACK] Seq=332 Ack=13572 Win=399 Len=0 TSval=647126832 TSecr=3918745879"
"44","0.238819288","199.232.37.164","192.168.1.118","TLSv1.2","1418","Application Data [TCP segment of a reassembled PDU]"
"45","0.238833200","192.168.1.118","199.232.37.164","TCP","66","33012 → 443 [ACK] Seq=285 Ack=9612 Win=428 Len=0 TSval=647126832 TSecr=474040025"
"46","0.245077588","199.232.37.164","192.168.1.118","TLSv1.2","4122","Application Data, Application Data"
"47","0.245147338","192.168.1.118","199.232.37.164","TCP","66","33012 → 443 [ACK] Seq=285 Ack=13668 Win=397 Len=0 TSval=647126838 TSecr=474040025"
"48","0.247530500","199.232.37.164","192.168.1.118","TLSv1.2","1418","Application Data [TCP segment of a reassembled PDU]"
"49","0.247592913","192.168.1.118","199.232.37.164","TCP","66","33014 → 443 [ACK] Seq=332 Ack=14924 Win=389 Len=0 TSval=647126840 TSecr=3918745886"
"50","0.249019313","199.232.37.164","192.168.1.118","TLSv1.2","1418","Application Data [TCP segment of a reassembled PDU]"
"51","0.249068788","192.168.1.118","199.232.37.164","TCP","66","33014 → 443 [ACK] Seq=332 Ack=16276 Win=379 Len=0 TSval=647126842 TSecr=3918745886"
"52","0.251474200","199.232.37.164","192.168.1.118","TLSv1.2","1418","Application Data [TCP segment of a reassembled PDU]"
"53","0.251535763","192.168.1.118","199.232.37.164","TCP","66","33016 → 443 [ACK] Seq=277 Ack=2756 Win=483 Len=0 TSval=647126844 TSecr=215694723"
"54","0.252716925","199.232.37.164","192.168.1.118","TLSv1.2","1418","Application Data [TCP segment of a reassembled PDU]"
"55","0.252766525","192.168.1.118","199.232.37.164","TCP","66","33016 → 443 [ACK] Seq=277 Ack=4108 Win=473 Len=0 TSval=647126846 TSecr=215694723"
"56","0.264735100","199.232.37.164","192.168.1.118","TLSv1.2","1418","Application Data [TCP segment of a reassembled PDU]"
"57","0.264799075","192.168.1.118","199.232.37.164","TCP","66","33016 → 443 [ACK] Seq=277 Ack=5460 Win=463 Len=0 TSval=647126858 TSecr=215694723"
"58","0.265788500","199.232.37.164","192.168.1.118","TLSv1.2","1418","Application Data [TCP segment of a reassembled PDU]"
"59","0.265824738","192.168.1.118","199.232.37.164","TCP","66","33016 → 443 [ACK] Seq=277 Ack=6812 Win=453 Len=0 TSval=647126859 TSecr=215694723"
"60","0.271301125","199.232.37.164","192.168.1.118","TLSv1.2","1418","Application Data [TCP segment of a reassembled PDU]"
"61","0.271378138","192.168.1.118","199.232.37.164","TCP","66","33016 → 443 [ACK] Seq=277 Ack=8164 Win=443 Len=0 TSval=647126864 TSecr=215694723"
"62","0.275437750","199.232.37.164","192.168.1.118","TLSv1.2","1418","Application Data [TCP segment of a reassembled PDU]"
"63","0.275506250","192.168.1.118","199.232.37.164","TCP","66","33016 → 443 [ACK] Seq=277 Ack=9516 Win=433 Len=0 TSval=647126868 TSecr=215694723"
"64","0.276303800","199.232.37.164","192.168.1.118","TLSv1.2","1418","Application Data [TCP segment of a reassembled PDU]"
"65","0.276340875","192.168.1.118","199.232.37.164","TCP","66","33016 → 443 [ACK] Seq=277 Ack=10868 Win=423 Len=0 TSval=647126869 TSecr=215694723"
"66","0.278611075","192.168.1.118","199.232.37.164","TLSv1.2","345","Application Data"
"67","0.278752350","199.232.37.164","192.168.1.118","TLSv1.2","1418","Application Data [TCP segment of a reassembled PDU]"
"68","0.278820838","192.168.1.118","199.232.37.164","TCP","66","33016 → 443 [ACK] Seq=277 Ack=12220 Win=413 Len=0 TSval=647126872 TSecr=215694723"
"69","0.280831363","199.232.37.164","192.168.1.118","TLSv1.2","1418","Application Data [TCP segment of a reassembled PDU]"
"70","0.280901163","192.168.1.118","199.232.37.164","TCP","66","33014 → 443 [ACK] Seq=332 Ack=17628 Win=369 Len=0 TSval=647126874 TSecr=3918745894"
"71","0.284728275","199.232.37.164","192.168.1.118","TLSv1.2","5474","Application Data, Application Data, Application Data, Application Data"
"72","0.284791850","192.168.1.118","199.232.37.164","TCP","66","33014 → 443 [ACK] Seq=332 Ack=23036 Win=445 Len=0 TSval=647126878 TSecr=3918745894"
"73","0.284877213","199.232.37.164","192.168.1.118","TLSv1.2","2770","Application Data, Application Data"
"74","0.284895425","192.168.1.118","199.232.37.164","TCP","66","33014 → 443 [ACK] Seq=332 Ack=25740 Win=424 Len=0 TSval=647126878 TSecr=3918745894"
"75","0.288652038","199.232.37.164","192.168.1.118","TLSv1.2","5474","Application Data, Application Data, Application Data, Application Data"
"76","0.288719163","192.168.1.118","199.232.37.164","TCP","66","33014 → 443 [ACK] Seq=332 Ack=31148 Win=382 Len=0 TSval=647126882 TSecr=3918745894"
"77","0.290357525","199.232.37.164","192.168.1.118","TLSv1.2","13586","Application Data, Application Data, Application Data, Application Data, Application Data, Application Data, Application Data, Application Data, Application Data, Application Data"
"78","0.290421675","199.232.37.164","192.168.1.118","TLSv1.2","1418","Application Data [TCP segment of a reassembled PDU]"
"79","0.290430538","199.232.37.164","192.168.1.118","TLSv1.2","1418","Application Data [TCP segment of a reassembled PDU]"
"80","0.290459650","192.168.1.118","199.232.37.164","TCP","66","33012 → 443 [ACK] Seq=285 Ack=15020 Win=493 Len=0 TSval=647126883 TSecr=474040080"
"81","0.290826213","192.168.1.118","199.232.37.164","TCP","66","33014 → 443 [ACK] Seq=332 Ack=46020 Win=266 Len=0 TSval=647126884 TSecr=3918745894"
"82","0.297681238","199.232.37.164","192.168.1.118","TLSv1.2","4122","Application Data, Application Data, Application Data"
"83","0.297746350","192.168.1.118","199.232.37.164","TCP","66","33012 → 443 [ACK] Seq=285 Ack=19076 Win=462 Len=0 TSval=647126891 TSecr=474040080"
"84","0.297777813","199.232.37.164","192.168.1.118","TLSv1.2","1418","Application Data [TCP segment of a reassembled PDU]"
"85","0.297793675","192.168.1.118","199.232.37.164","TCP","66","33012 → 443 [ACK] Seq=285 Ack=20428 Win=452 Len=0 TSval=647126891 TSecr=474040080"
"86","0.298636050","199.232.37.164","192.168.1.118","TLSv1.2","12234","Application Data, Application Data, Application Data, Application Data, Application Data, Application Data, Application Data, Application Data, Application Data"
"87","0.298693938","192.168.1.118","199.232.37.164","TCP","66","33012 → 443 [ACK] Seq=285 Ack=32596 Win=357 Len=0 TSval=647126892 TSecr=474040080"
"88","0.300352738","199.232.37.164","192.168.1.118","TLSv1.2","2770","Application Data, Application Data"
"89","0.300407250","192.168.1.118","199.232.37.164","TCP","66","33012 → 443 [ACK] Seq=285 Ack=35300 Win=336 Len=0 TSval=647126893 TSecr=474040080"
"90","0.300444438","199.232.37.164","192.168.1.118","TLSv1.2","2770","Application Data, Application Data"
"91","0.300615875","192.168.1.118","199.232.37.164","TCP","66","33012 → 443 [ACK] Seq=285 Ack=38004 Win=315 Len=0 TSval=647126893 TSecr=474040085"
"92","0.302873425","192.168.1.118","199.232.37.164","TCP","66","[TCP Window Update] 33018 → 443 [ACK] Seq=1 Ack=42669 Win=501 Len=0 TSval=647126896 TSecr=277574607"
"93","0.303667750","199.232.37.164","192.168.1.118","TLSv1.2","1418","Application Data [TCP segment of a reassembled PDU]"
"94","0.305054800","199.232.37.164","192.168.1.118","TLSv1.2","1032","Application Data"
"95","0.306181638","199.232.37.164","192.168.1.118","TLSv1.2","1418","Application Data [TCP segment of a reassembled PDU]"
"96","0.309071213","199.232.37.164","192.168.1.118","TLSv1.2","5474","Application Data, Application Data, Application Data"
"97","0.309781300","199.232.37.164","192.168.1.118","TLSv1.2","6826","Application Data, Application Data, Application Data, Application Data, Application Data"
"98","0.309826025","199.232.37.164","192.168.1.118","TLSv1.2","4122","Application Data, Application Data, Application Data"
"99","0.312164725","192.168.1.118","199.232.37.164","TCP","66","33014 → 443 [ACK] Seq=332 Ack=63596 Win=501 Len=0 TSval=647126905 TSecr=3918745900"
"100","0.318505263","192.168.1.118","199.232.37.164","TCP","66","33012 → 443 [ACK] Seq=285 Ack=40322 Win=501 Len=0 TSval=647126911 TSecr=474040090"
"101","0.319127288","192.168.1.118","199.232.37.164","TLSv1.2","348","Application Data"
"102","0.336516450","199.232.37.164","192.168.1.118","TLSv1.2","5474","Application Data, Application Data, Application Data, Application Data"
"103","0.336591813","192.168.1.118","199.232.37.164","TCP","66","33014 → 443 [ACK] Seq=332 Ack=69004 Win=586 Len=0 TSval=647126929 TSecr=3918745900"
"104","0.338131125","199.232.37.164","192.168.1.118","TLSv1.2","6826","Application Data, Application Data, Application Data, Application Data, Application Data"
"105","0.338200688","192.168.1.118","199.232.37.164","TCP","66","33014 → 443 [ACK] Seq=332 Ack=75764 Win=691 Len=0 TSval=647126931 TSecr=3918745900"
"106","0.338277413","199.232.37.164","192.168.1.118","TLSv1.2","9530","Application Data, Application Data, Application Data, Application Data, Application Data, Application Data, Application Data"
"107","0.338304938","192.168.1.118","199.232.37.164","TCP","66","33020 → 443 [ACK] Seq=280 Ack=19897 Win=428 Len=0 TSval=647126931 TSecr=2817518823"
"108","0.339408100","199.232.37.164","192.168.1.118","TCP","1418","443 → 33016 [ACK] Seq=12220 Ack=277 Win=57 Len=1352 TSval=215694723 TSecr=647126793 [TCP segment of a reassembled PDU]"
"109","0.339460150","192.168.1.118","199.232.37.164","TCP","66","33016 → 443 [ACK] Seq=277 Ack=13572 Win=493 Len=0 TSval=647126932 TSecr=215694723"
"110","0.341717713","199.232.37.164","192.168.1.118","TLSv1.2","5474","Application Data, Application Data, Application Data"
"111","0.341786900","192.168.1.118","199.232.37.164","TCP","66","33020 → 443 [ACK] Seq=280 Ack=25305 Win=386 Len=0 TSval=647126935 TSecr=2817518823"
"112","0.341869938","199.232.37.164","192.168.1.118","TLSv1.2","1687","Application Data, Application Data, Application Data"
"113","0.341886638","192.168.1.118","199.232.37.164","TCP","66","33020 → 443 [ACK] Seq=280 Ack=26926 Win=374 Len=0 TSval=647126935 TSecr=2817518823"
"114","0.341916238","199.232.37.164","192.168.1.118","TLSv1.2","4370","Application Data, Application Data, Application Data"
"115","0.341934025","192.168.1.118","199.232.37.164","TCP","66","33014 → 443 [ACK] Seq=332 Ack=80068 Win=759 Len=0 TSval=647126935 TSecr=3918745904"
"116","0.343085388","199.232.37.164","192.168.1.118","TLSv1.2","1418","Application Data [TCP segment of a reassembled PDU]"
"117","0.343141238","192.168.1.118","199.232.37.164","TCP","66","33016 → 443 [ACK] Seq=277 Ack=14924 Win=483 Len=0 TSval=647126936 TSecr=215694736"
"118","0.344168888","199.232.37.164","192.168.1.118","TLSv1.2","1418","Application Data [TCP segment of a reassembled PDU]"
"119","0.344219225","192.168.1.118","199.232.37.164","TCP","66","33016 → 443 [ACK] Seq=277 Ack=16276 Win=473 Len=0 TSval=647126937 TSecr=215694736"
"120","0.345238475","199.232.37.164","192.168.1.118","TLSv1.2","1418","Application Data [TCP segment of a reassembled PDU]"
"121","0.347252513","199.232.37.164","192.168.1.118","TLSv1.2","1418","Application Data [TCP segment of a reassembled PDU]"
"122","0.348107638","199.232.37.164","192.168.1.118","TLSv1.2","1418","Application Data [TCP segment of a reassembled PDU]"
"123","0.351896763","199.232.37.164","192.168.1.118","TLSv1.2","1418","Application Data [TCP segment of a reassembled PDU]"
"124","0.353225650","199.232.37.164","192.168.1.118","TLSv1.2","1418","Application Data [TCP segment of a reassembled PDU]"
"125","0.354860763","199.232.37.164","192.168.1.118","TLSv1.2","1418","Application Data [TCP segment of a reassembled PDU]"
"126","0.363073813","199.232.37.164","192.168.1.118","TLSv1.2","1418","Application Data [TCP segment of a reassembled PDU]"
"127","0.385386775","192.168.1.118","199.232.37.164","TCP","66","33016 → 443 [ACK] Seq=277 Ack=25740 Win=400 Len=0 TSval=647126978 TSecr=215694736"
"128","0.386900425","199.232.37.164","192.168.1.118","TLSv1.2","1418","Application Data [TCP segment of a reassembled PDU]"
"129","0.407955950","199.232.37.164","192.168.1.118","TLSv1.2","1418","Application Data [TCP segment of a reassembled PDU]"
"130","0.430460425","199.232.37.164","192.168.1.118","TLSv1.2","1418","Application Data [TCP segment of a reassembled PDU]"
"131","0.430528525","192.168.1.118","199.232.37.164","TCP","66","33014 → 443 [ACK] Seq=332 Ack=81420 Win=780 Len=0 TSval=647127023 TSecr=3918745927"
"132","0.433947225","199.232.37.164","192.168.1.118","TLSv1.2","5474","Application Data, Application Data, Application Data, Application Data"
"133","0.434018950","192.168.1.118","199.232.37.164","TCP","66","33014 → 443 [ACK] Seq=332 Ack=86828 Win=864 Len=0 TSval=647127027 TSecr=3918745927"
"134","0.435617188","199.232.37.164","192.168.1.118","TLSv1.2","16290","Application Data, Application Data, Application Data, Application Data, Application Data, Application Data, Application Data, Application Data, Application Data, Application Data, Application Data"
"135","0.435686925","192.168.1.118","199.232.37.164","TCP","66","33014 → 443 [ACK] Seq=332 Ack=103052 Win=1118 Len=0 TSval=647127029 TSecr=3918745927"
"136","0.437384500","192.168.1.118","199.232.37.164","TCP","66","33016 → 443 [ACK] Seq=277 Ack=28444 Win=379 Len=0 TSval=647127030 TSecr=215694736"
"137","0.439060800","192.168.1.118","199.232.37.164","TLSv1.2","363","Application Data"
"138","0.442777500","199.232.37.164","192.168.1.118","TLSv1.2","5474","Application Data, Application Data, Application Data, Application Data"
"139","0.442844025","192.168.1.118","199.232.37.164","TCP","66","33014 → 443 [ACK] Seq=332 Ack=108460 Win=1202 Len=0 TSval=647127036 TSecr=3918745927"
"140","0.442926613","199.232.37.164","192.168.1.118","TLSv1.2","2770","Application Data, Application Data"
"141","0.442942863","192.168.1.118","199.232.37.164","TCP","66","33014 → 443 [ACK] Seq=332 Ack=111164 Win=1244 Len=0 TSval=647127036 TSecr=3918745927"
"142","0.443012838","199.232.37.164","192.168.1.118","TLSv1.2","13586","Application Data, Application Data, Application Data, Application Data, Application Data, Application Data, Application Data, Application Data, Application Data, Application Data"
"143","0.443031813","192.168.1.118","199.232.37.164","TCP","66","33014 → 443 [ACK] Seq=332 Ack=124684 Win=1456 Len=0 TSval=647127036 TSecr=3918745927"
"144","0.445628413","192.168.1.118","199.232.37.164","TLSv1.2","342","Application Data"
"145","0.445793000","199.232.37.164","192.168.1.118","TLSv1.2","4122","[TCP Previous segment not captured] , Ignored Unknown Record"
"146","0.445859663","192.168.1.118","199.232.37.164","TCP","78","[TCP Window Update] 33014 → 443 [ACK] Seq=332 Ack=124684 Win=1519 Len=0 TSval=647127039 TSecr=3918745927 SLE=127388 SRE=131444"
"147","0.445891850","199.232.37.164","192.168.1.118","TLSv1.2","1418","[TCP Previous segment not captured] , Ignored Unknown Record"
"148","0.445909338","192.168.1.118","199.232.37.164","TCP","86","[TCP Window Update] 33014 → 443 [ACK] Seq=332 Ack=124684 Win=1540 Len=0 TSval=647127039 TSecr=3918745927 SLE=132796 SRE=134148 SLE=127388 SRE=131444"
"149","0.447455250","199.232.37.164","192.168.1.118","TLSv1.2","2770","Ignored Unknown Record"
"150","0.447510825","192.168.1.118","199.232.37.164","TCP","86","[TCP Window Update] 33014 → 443 [ACK] Seq=332 Ack=124684 Win=1582 Len=0 TSval=647127040 TSecr=3918745927 SLE=132796 SRE=136852 SLE=127388 SRE=131444"
"151","0.448309875","199.232.37.164","192.168.1.118","TLSv1.2","5474","Ignored Unknown Record"
"152","0.448374738","192.168.1.118","199.232.37.164","TCP","86","[TCP Window Update] 33014 → 443 [ACK] Seq=332 Ack=124684 Win=1667 Len=0 TSval=647127041 TSecr=3918745927 SLE=132796 SRE=142260 SLE=127388 SRE=131444"
"153","0.448429688","199.232.37.164","192.168.1.118","TCP","8178","[TCP segment of a reassembled PDU]"
"154","0.448447725","192.168.1.118","199.232.37.164","TCP","86","[TCP Window Update] 33014 → 443 [ACK] Seq=332 Ack=124684 Win=1794 Len=0 TSval=647127041 TSecr=3918745927 SLE=132796 SRE=150372 SLE=127388 SRE=131444"
"155","0.452459950","199.232.37.164","192.168.1.118","TLSv1.2","10882","Encrypted Heartbeat, Ignored Unknown Record"
"156","0.452528438","192.168.1.118","199.232.37.164","TCP","86","[TCP Window Update] 33014 → 443 [ACK] Seq=332 Ack=124684 Win=1963 Len=0 TSval=647127045 TSecr=3918745927 SLE=132796 SRE=161188 SLE=127388 SRE=131444"
"157","0.454029538","199.232.37.164","192.168.1.118","TLSv1.2","10882","Ignored Unknown Record"
"158","0.454078400","192.168.1.118","199.232.37.164","TCP","86","[TCP Window Update] 33014 → 443 [ACK] Seq=332 Ack=124684 Win=2132 Len=0 TSval=647127047 TSecr=3918745927 SLE=132796 SRE=172004 SLE=127388 SRE=131444"
"159","0.461844238","199.232.37.164","192.168.1.118","TLSv1.2","1418","Application Data [TCP segment of a reassembled PDU]"
"160","0.468569413","199.232.37.164","192.168.1.118","TLSv1.2","1418","Application Data [TCP segment of a reassembled PDU]"
"161","0.468632463","192.168.1.118","199.232.37.164","TCP","66","33016 → 443 [ACK] Seq=277 Ack=31148 Win=493 Len=0 TSval=647127062 TSecr=215694740"
"162","0.469436063","199.232.37.164","192.168.1.118","TLSv1.2","1418","Application Data [TCP segment of a reassembled PDU]"
"163","0.471151350","199.232.37.164","192.168.1.118","TLSv1.2","1418","Application Data [TCP segment of a reassembled PDU]"
"164","0.471205700","192.168.1.118","199.232.37.164","TCP","66","33016 → 443 [ACK] Seq=277 Ack=33852 Win=493 Len=0 TSval=647127064 TSecr=215694740"
"165","0.475726675","199.232.37.164","192.168.1.118","TLSv1.2","1418","Application Data [TCP segment of a reassembled PDU]"
"166","0.476578463","199.232.37.164","192.168.1.118","TLSv1.2","1418","Application Data [TCP segment of a reassembled PDU]"
"167","0.476623775","192.168.1.118","199.232.37.164","TCP","66","33016 → 443 [ACK] Seq=277 Ack=36556 Win=493 Len=0 TSval=647127069 TSecr=215694740"
"168","0.477532888","199.232.37.164","192.168.1.118","TLSv1.2","1418","Application Data [TCP segment of a reassembled PDU]"
"169","0.479090438","199.232.37.164","192.168.1.118","TLSv1.2","1418","Application Data [TCP segment of a reassembled PDU]"
"170","0.479150275","192.168.1.118","199.232.37.164","TCP","66","33016 → 443 [ACK] Seq=277 Ack=39260 Win=493 Len=0 TSval=647127072 TSecr=215694742"
"171","0.481424163","199.232.37.164","192.168.1.118","TLSv1.2","1418","Application Data [TCP segment of a reassembled PDU]"
"172","0.483913713","199.232.37.164","192.168.1.118","TLSv1.2","2279","Ignored Unknown Record"
"173","0.483990375","192.168.1.118","199.232.37.164","TCP","86","[TCP Window Update] 33014 → 443 [ACK] Seq=332 Ack=124684 Win=2166 Len=0 TSval=647127077 TSecr=3918745927 SLE=132796 SRE=174217 SLE=127388 SRE=131444"
"174","0.484054550","199.232.37.164","192.168.1.118","TLSv1.2","2770","Application Data, Application Data"
"175","0.484085688","192.168.1.118","199.232.37.164","TCP","66","33018 → 443 [ACK] Seq=283 Ack=45373 Win=480 Len=0 TSval=647127077 TSecr=277574672"
"176","0.485513825","199.232.37.164","192.168.1.118","TLSv1.2","16290","Application Data, Application Data, Application Data, Application Data, Application Data, Application Data, Application Data, Application Data, Application Data, Application Data, Application Data"
"177","0.485595775","192.168.1.118","199.232.37.164","TCP","66","33018 → 443 [ACK] Seq=283 Ack=61597 Win=755 Len=0 TSval=647127078 TSecr=277574672"
"178","0.488104463","199.232.37.164","192.168.1.118","TLSv1.2","2770","Application Data, Application Data"
"179","0.488169963","192.168.1.118","199.232.37.164","TCP","66","33018 → 443 [ACK] Seq=283 Ack=64301 Win=797 Len=0 TSval=647127081 TSecr=277574672"
"180","0.488207625","199.232.37.164","192.168.1.118","TLSv1.2","2770","Application Data, Application Data"
"181","0.488223125","192.168.1.118","199.232.37.164","TCP","66","33018 → 443 [ACK] Seq=283 Ack=67005 Win=839 Len=0 TSval=647127081 TSecr=277574673"
"182","0.489654400","199.232.37.164","192.168.1.118","TLSv1.2","2770","Application Data, Application Data"
"183","0.489714613","192.168.1.118","199.232.37.164","TCP","66","33018 → 443 [ACK] Seq=283 Ack=69709 Win=881 Len=0 TSval=647127083 TSecr=277574673"
"184","0.489756600","199.232.37.164","192.168.1.118","TLSv1.2","2770","Application Data, Application Data"
"185","0.489775313","192.168.1.118","199.232.37.164","TCP","66","33018 → 443 [ACK] Seq=283 Ack=72413 Win=924 Len=0 TSval=647127083 TSecr=277574674"
"186","0.489800138","199.232.37.164","192.168.1.118","TLSv1.2","3940","Application Data, Application Data, Application Data, Application Data"
"187","0.489817738","192.168.1.118","199.232.37.164","TCP","66","33018 → 443 [ACK] Seq=283 Ack=76287 Win=984 Len=0 TSval=647127083 TSecr=277574675"
"188","0.489865963","199.232.37.164","192.168.1.118","TLSv1.2","5474","Application Data, Application Data, Application Data, Application Data"
"189","0.489895188","192.168.1.118","199.232.37.164","TCP","66","33012 → 443 [ACK] Seq=582 Ack=45730 Win=586 Len=0 TSval=647127083 TSecr=474040261"
"190","0.489904438","199.232.37.164","192.168.1.118","TLSv1.2","1104","Application Data"
"191","0.489918500","192.168.1.118","199.232.37.164","TCP","66","33012 → 443 [ACK] Seq=582 Ack=46768 Win=607 Len=0 TSval=647127083 TSecr=474040262"
"192","0.492907725","199.232.37.164","192.168.1.118","TCP","2770","[TCP Retransmission] 443 → 33014 [ACK] Seq=124684 Ack=332 Win=57 Len=2704 TSval=3918745943 TSecr=647127039"
"193","0.492977225","192.168.1.118","199.232.37.164","TCP","78","33014 → 443 [ACK] Seq=332 Ack=131444 Win=2209 Len=0 TSval=647127086 TSecr=3918745943 SLE=132796 SRE=174217"
"194","0.493015650","199.232.37.164","192.168.1.118","TCP","1418","[TCP Retransmission] 443 → 33014 [ACK] Seq=131444 Ack=332 Win=57 Len=1352 TSval=3918745943 TSecr=647127039"
"195","0.493033913","192.168.1.118","199.232.37.164","TCP","66","33014 → 443 [ACK] Seq=332 Ack=174217 Win=2230 Len=0 TSval=647127086 TSecr=3918745943"
"196","0.493042613","199.232.37.164","192.168.1.118","TLSv1.2","1418","Application Data"
"197","0.493068075","192.168.1.118","199.232.37.164","TCP","66","33020 → 443 [ACK] Seq=556 Ack=28278 Win=493 Len=0 TSval=647127086 TSecr=2817518865"
"198","0.494592075","199.232.37.164","192.168.1.118","TLSv1.2","16290","Application Data, Application Data, Application Data, Application Data, Application Data, Application Data, Application Data, Application Data, Application Data, Application Data, Application Data"
"199","0.494650550","192.168.1.118","199.232.37.164","TCP","66","33020 → 443 [ACK] Seq=556 Ack=44502 Win=367 Len=0 TSval=647127088 TSecr=2817518865"
"200","0.504196338","199.232.37.164","192.168.1.118","TLSv1.2","4122","Application Data, Application Data, Application Data"
"201","0.504265113","192.168.1.118","199.232.37.164","TCP","66","33020 → 443 [ACK] Seq=556 Ack=48558 Win=336 Len=0 TSval=647127097 TSecr=2817518865"
"202","0.504298863","199.232.37.164","192.168.1.118","TLSv1.2","1418","Application Data [TCP segment of a reassembled PDU]"
"203","0.504314788","192.168.1.118","199.232.37.164","TCP","66","33020 → 443 [ACK] Seq=556 Ack=49910 Win=326 Len=0 TSval=647127097 TSecr=2817518866"
"204","0.504626425","199.232.37.164","192.168.1.118","TLSv1.2","1418","Application Data [TCP segment of a reassembled PDU]"
"205","0.504650575","192.168.1.118","199.232.37.164","TCP","66","33020 → 443 [ACK] Seq=556 Ack=51262 Win=316 Len=0 TSval=647127098 TSecr=2817518866"
"206","0.504675813","199.232.37.164","192.168.1.118","TLSv1.2","2770","Application Data, Application Data"
"207","0.504718338","199.232.37.164","192.168.1.118","TLSv1.2","5474","Application Data, Application Data, Application Data, Application Data"
"208","0.505078825","192.168.1.118","199.232.37.164","TCP","66","33020 → 443 [ACK] Seq=556 Ack=59374 Win=253 Len=0 TSval=647127098 TSecr=2817518867"
"209","0.507246950","199.232.37.164","192.168.1.118","TLSv1.2","1418","Application Data [TCP segment of a reassembled PDU]"
"210","0.507306463","192.168.1.118","199.232.37.164","TCP","66","33016 → 443 [ACK] Seq=277 Ack=41964 Win=493 Len=0 TSval=647127100 TSecr=215694769"
"211","0.512426088","199.232.37.164","192.168.1.118","TLSv1.2","1418","Application Data [TCP segment of a reassembled PDU]"
"212","0.515589200","199.232.37.164","192.168.1.118","TLSv1.2","1594","Application Data, Application Data"
"213","0.515657250","192.168.1.118","199.232.37.164","TCP","66","33020 → 443 [ACK] Seq=556 Ack=60902 Win=525 Len=0 TSval=647127109 TSecr=2817518870"
"214","0.516941288","199.232.37.164","192.168.1.118","TLSv1.2","1418","Application Data [TCP segment of a reassembled PDU]"
"215","0.517003850","192.168.1.118","199.232.37.164","TCP","66","33016 → 443 [ACK] Seq=277 Ack=44668 Win=522 Len=0 TSval=647127110 TSecr=215694769"
"216","0.518062025","199.232.37.164","192.168.1.118","TLSv1.2","1418","Application Data [TCP segment of a reassembled PDU]"
"217","0.518117913","192.168.1.118","199.232.37.164","TCP","66","33016 → 443 [ACK] Seq=277 Ack=46020 Win=543 Len=0 TSval=647127111 TSecr=215694769"
"218","0.519818638","199.232.37.164","192.168.1.118","TLSv1.2","1418","Application Data [TCP segment of a reassembled PDU]"
"219","0.519868625","192.168.1.118","199.232.37.164","TCP","66","33016 → 443 [ACK] Seq=277 Ack=47372 Win=565 Len=0 TSval=647127113 TSecr=215694769"
"220","0.523991988","199.232.37.164","192.168.1.118","TLSv1.2","1418","Application Data [TCP segment of a reassembled PDU]"
"221","0.524052363","192.168.1.118","199.232.37.164","TCP","66","33016 → 443 [ACK] Seq=277 Ack=48724 Win=586 Len=0 TSval=647127117 TSecr=215694770"
"222","0.529618038","199.232.37.164","192.168.1.118","TLSv1.2","1418","Application Data [TCP segment of a reassembled PDU]"
"223","0.529681838","192.168.1.118","199.232.37.164","TCP","66","33016 → 443 [ACK] Seq=277 Ack=50076 Win=607 Len=0 TSval=647127123 TSecr=215694770"
"224","0.539444213","199.232.37.164","192.168.1.118","TLSv1.2","1418","Application Data [TCP segment of a reassembled PDU]"
"225","0.539506163","192.168.1.118","199.232.37.164","TCP","66","33016 → 443 [ACK] Seq=277 Ack=51428 Win=628 Len=0 TSval=647127132 TSecr=215694771"
"226","0.542954025","199.232.37.164","192.168.1.118","TLSv1.2","1418","Application Data [TCP segment of a reassembled PDU]"
"227","0.543018725","192.168.1.118","199.232.37.164","TCP","66","33016 → 443 [ACK] Seq=277 Ack=52780 Win=649 Len=0 TSval=647127136 TSecr=215694771"
"228","0.560942163","199.232.37.164","192.168.1.118","TCP","1418","443 → 33016 [ACK] Seq=52780 Ack=277 Win=57 Len=1352 TSval=215694773 TSecr=647126978 [TCP segment of a reassembled PDU]"
"229","0.561009463","192.168.1.118","199.232.37.164","TCP","66","33016 → 443 [ACK] Seq=277 Ack=54132 Win=670 Len=0 TSval=647127154 TSecr=215694773"
"230","0.576343950","199.232.37.164","192.168.1.118","TLSv1.2","1418","Application Data [TCP segment of a reassembled PDU]"
"231","0.576409825","192.168.1.118","199.232.37.164","TCP","66","33016 → 443 [ACK] Seq=277 Ack=55484 Win=691 Len=0 TSval=647127169 TSecr=215694773"
"232","0.580011450","199.232.37.164","192.168.1.118","TLSv1.2","1418","Application Data [TCP segment of a reassembled PDU]"
"233","0.580074363","192.168.1.118","199.232.37.164","TCP","66","33016 → 443 [ACK] Seq=277 Ack=56836 Win=712 Len=0 TSval=647127173 TSecr=215694775"
"234","0.584722800","199.232.37.164","192.168.1.118","TLSv1.2","1418","Application Data [TCP segment of a reassembled PDU]"
"235","0.584784038","192.168.1.118","199.232.37.164","TCP","66","33016 → 443 [ACK] Seq=277 Ack=58188 Win=734 Len=0 TSval=647127178 TSecr=215694775"
"236","0.592623650","199.232.37.164","192.168.1.118","TLSv1.2","1418","Application Data [TCP segment of a reassembled PDU]"
"237","0.592689925","192.168.1.118","199.232.37.164","TCP","66","33016 → 443 [ACK] Seq=277 Ack=59540 Win=755 Len=0 TSval=647127186 TSecr=215694776"
"238","0.593906188","199.232.37.164","192.168.1.118","TLSv1.2","1418","Application Data [TCP segment of a reassembled PDU]"
"239","0.593960075","192.168.1.118","199.232.37.164","TCP","66","33016 → 443 [ACK] Seq=277 Ack=60892 Win=776 Len=0 TSval=647127187 TSecr=215694776"
"240","0.595945775","199.232.37.164","192.168.1.118","TLSv1.2","1418","Application Data [TCP segment of a reassembled PDU]"
"241","0.596002863","192.168.1.118","199.232.37.164","TCP","66","33016 → 443 [ACK] Seq=277 Ack=62244 Win=797 Len=0 TSval=647127189 TSecr=215694778"
"242","0.596766363","199.232.37.164","192.168.1.118","TLSv1.2","1418","Application Data [TCP segment of a reassembled PDU]"
"243","0.596810275","192.168.1.118","199.232.37.164","TCP","66","33016 → 443 [ACK] Seq=277 Ack=63596 Win=818 Len=0 TSval=647127190 TSecr=215694778"
"244","0.615169675","199.232.37.164","192.168.1.118","TLSv1.2","1418","Application Data [TCP segment of a reassembled PDU]"
"245","0.615232213","192.168.1.118","199.232.37.164","TCP","66","33016 → 443 [ACK] Seq=277 Ack=64948 Win=839 Len=0 TSval=647127208 TSecr=215694780"
"246","0.617609825","199.232.37.164","192.168.1.118","TLSv1.2","1418","Application Data [TCP segment of a reassembled PDU]"
"247","0.617669325","192.168.1.118","199.232.37.164","TCP","66","33016 → 443 [ACK] Seq=277 Ack=66300 Win=860 Len=0 TSval=647127211 TSecr=215694780"
"248","0.621867113","199.232.37.164","192.168.1.118","TLSv1.2","1418","Application Data [TCP segment of a reassembled PDU]"
"249","0.621931750","192.168.1.118","199.232.37.164","TCP","66","33016 → 443 [ACK] Seq=277 Ack=67652 Win=881 Len=0 TSval=647127215 TSecr=215694780"
"250","0.629680438","199.232.37.164","192.168.1.118","TLSv1.2","1418","Application Data [TCP segment of a reassembled PDU]"
"251","0.629741738","192.168.1.118","199.232.37.164","TCP","66","33016 → 443 [ACK] Seq=277 Ack=69004 Win=903 Len=0 TSval=647127223 TSecr=215694780"
"252","0.630752550","199.232.37.164","192.168.1.118","TLSv1.2","1418","Application Data [TCP segment of a reassembled PDU]"
"253","0.630794963","192.168.1.118","199.232.37.164","TCP","66","33016 → 443 [ACK] Seq=277 Ack=70356 Win=924 Len=0 TSval=647127224 TSecr=215694790"
"254","0.642799275","199.232.37.164","192.168.1.118","TLSv1.2","1418","Application Data [TCP segment of a reassembled PDU]"
"255","0.642863300","192.168.1.118","199.232.37.164","TCP","66","33016 → 443 [ACK] Seq=277 Ack=71708 Win=945 Len=0 TSval=647127236 TSecr=215694790"
"256","0.647108263","199.232.37.164","192.168.1.118","TLSv1.2","1418","Application Data [TCP segment of a reassembled PDU]"
"257","0.647171763","192.168.1.118","199.232.37.164","TCP","66","33016 → 443 [ACK] Seq=277 Ack=73060 Win=966 Len=0 TSval=647127240 TSecr=215694790"
"258","0.654493888","199.232.37.164","192.168.1.118","TLSv1.2","1418","Application Data [TCP segment of a reassembled PDU]"
"259","0.654556775","192.168.1.118","199.232.37.164","TCP","66","33016 → 443 [ACK] Seq=277 Ack=74412 Win=987 Len=0 TSval=647127247 TSecr=215694790"
"260","0.655391425","199.232.37.164","192.168.1.118","TLSv1.2","1418","Application Data [TCP segment of a reassembled PDU]"
"261","0.655431325","192.168.1.118","199.232.37.164","TCP","66","33016 → 443 [ACK] Seq=277 Ack=75764 Win=1008 Len=0 TSval=647127248 TSecr=215694790"
"262","0.657224300","199.232.37.164","192.168.1.118","TLSv1.2","1418","Application Data [TCP segment of a reassembled PDU]"
"263","0.657285400","192.168.1.118","199.232.37.164","TCP","66","33016 → 443 [ACK] Seq=277 Ack=77116 Win=1029 Len=0 TSval=647127250 TSecr=215694790"
"264","0.658109538","199.232.37.164","192.168.1.118","TLSv1.2","1418","Application Data [TCP segment of a reassembled PDU]"
"265","0.658146438","192.168.1.118","199.232.37.164","TCP","66","33016 → 443 [ACK] Seq=277 Ack=78468 Win=1050 Len=0 TSval=647127251 TSecr=215694791"
"266","0.661407863","199.232.37.164","192.168.1.118","TLSv1.2","1418","Application Data [TCP segment of a reassembled PDU]"
"267","0.661472075","192.168.1.118","199.232.37.164","TCP","66","33016 → 443 [ACK] Seq=277 Ack=79820 Win=1072 Len=0 TSval=647127254 TSecr=215694791"
"268","0.662384375","199.232.37.164","192.168.1.118","TLSv1.2","1418","Application Data [TCP segment of a reassembled PDU]"
"269","0.662410850","192.168.1.118","199.232.37.164","TCP","66","33016 → 443 [ACK] Seq=277 Ack=81172 Win=1093 Len=0 TSval=647127255 TSecr=215694792"
"270","0.673624263","199.232.37.164","192.168.1.118","TLSv1.2","1418","Application Data [TCP segment of a reassembled PDU]"
"271","0.673693863","192.168.1.118","199.232.37.164","TCP","66","33016 → 443 [ACK] Seq=277 Ack=82524 Win=1114 Len=0 TSval=647127267 TSecr=215694792"
"272","0.674426238","199.232.37.164","192.168.1.118","TLSv1.2","1418","Application Data [TCP segment of a reassembled PDU]"
"273","0.674458550","192.168.1.118","199.232.37.164","TCP","66","33016 → 443 [ACK] Seq=277 Ack=83876 Win=1135 Len=0 TSval=647127267 TSecr=215694792"
"274","0.677649538","199.232.37.164","192.168.1.118","TLSv1.2","1418","Application Data [TCP segment of a reassembled PDU]"
"275","0.677711675","192.168.1.118","199.232.37.164","TCP","66","33016 → 443 [ACK] Seq=277 Ack=85228 Win=1156 Len=0 TSval=647127271 TSecr=215694793"
"276","0.678429025","199.232.37.164","192.168.1.118","TLSv1.2","1418","Application Data [TCP segment of a reassembled PDU]"
"277","0.678468488","192.168.1.118","199.232.37.164","TCP","66","33016 → 443 [ACK] Seq=277 Ack=86580 Win=1177 Len=0 TSval=647127271 TSecr=215694793"
"278","0.680520263","199.232.37.164","192.168.1.118","TLSv1.2","1418","Application Data [TCP segment of a reassembled PDU]"
"279","0.680581313","192.168.1.118","199.232.37.164","TCP","66","33016 → 443 [ACK] Seq=277 Ack=87932 Win=1198 Len=0 TSval=647127273 TSecr=215694796"
"280","0.681662388","199.232.37.164","192.168.1.118","TLSv1.2","1418","Application Data [TCP segment of a reassembled PDU]"
"281","0.681702275","192.168.1.118","199.232.37.164","TCP","66","33016 → 443 [ACK] Seq=277 Ack=89284 Win=1219 Len=0 TSval=647127275 TSecr=215694796"
"282","0.683690100","199.232.37.164","192.168.1.118","TLSv1.2","1418","Application Data [TCP segment of a reassembled PDU]"
"283","0.683748688","192.168.1.118","199.232.37.164","TCP","66","33016 → 443 [ACK] Seq=277 Ack=90636 Win=1241 Len=0 TSval=647127277 TSecr=215694796"
"284","0.684468163","199.232.37.164","192.168.1.118","TLSv1.2","1418","Application Data [TCP segment of a reassembled PDU]"
"285","0.684497975","192.168.1.118","199.232.37.164","TCP","66","33016 → 443 [ACK] Seq=277 Ack=91988 Win=1262 Len=0 TSval=647127277 TSecr=215694796"
"286","0.734350738","199.232.37.164","192.168.1.118","TCP","1418","443 → 33016 [ACK] Seq=91988 Ack=277 Win=57 Len=1352 TSval=215694804 TSecr=647127113 [TCP segment of a reassembled PDU]"
"287","0.734418413","192.168.1.118","199.232.37.164","TCP","66","33016 → 443 [ACK] Seq=277 Ack=93340 Win=1283 Len=0 TSval=647127327 TSecr=215694804"
