frame.number,_ws.col.Time,_ws.col.Source,_ws.col.Destination,_ws.col.Protocol,frame.len,_ws.col.Info
"1","0.000000000","172.217.11.54","192.168.1.118","TCP","66","443 → 37764 [ACK] Seq=1 Ack=1 Win=240 Len=0 TSval=619338736 TSecr=2237454739"
"2","0.009227562","172.217.11.54","192.168.1.118","TLSv1.2","1484","Server Hello"
"3","0.009296287","192.168.1.118","172.217.11.54","TCP","66","37764 → 443 [ACK] Seq=1 Ack=1419 Win=493 Len=0 TSval=2237454767 TSecr=619338744"
"4","0.011047675","172.217.11.54","192.168.1.118","TLSv1.2","1719","Certificate, Server Key Exchange, Server Hello Done"
"5","0.011116312","192.168.1.118","172.217.11.54","TCP","66","37764 → 443 [ACK] Seq=1 Ack=3072 Win=481 Len=0 TSval=2237454769 TSecr=619338744"
"6","0.044336975","192.168.1.118","172.217.11.54","TLSv1","583","Client Hello"
"7","0.069844250","172.217.11.54","192.168.1.118","TCP","66","443 → 37766 [ACK] Seq=1 Ack=518 Win=240 Len=0 TSval=619338805 TSecr=2237454802"
"8","0.079136837","172.217.11.54","192.168.1.118","TLSv1.2","1484","Server Hello"
"9","0.079204587","192.168.1.118","172.217.11.54","TCP","66","37766 → 443 [ACK] Seq=518 Ack=1419 Win=493 Len=0 TSval=2237454837 TSecr=619338813"
"10","0.080832775","172.217.11.54","192.168.1.118","TLSv1.2","1719","Certificate, Server Key Exchange, Server Hello Done"
"11","0.080896100","192.168.1.118","172.217.11.54","TCP","66","37766 → 443 [ACK] Seq=518 Ack=3072 Win=481 Len=0 TSval=2237454838 TSecr=619338813"
"12","0.160137525","192.168.1.118","172.217.11.54","TLSv1","583","Client Hello"
"13","0.175391887","172.217.11.54","192.168.1.118","TCP","66","443 → 37768 [ACK] Seq=1 Ack=518 Win=240 Len=0 TSval=2766448632 TSecr=2237454918"
"14","0.182168537","172.217.11.54","192.168.1.118","TLSv1.2","1484","Server Hello"
"15","0.182238237","192.168.1.118","172.217.11.54","TCP","66","37768 → 443 [ACK] Seq=518 Ack=1419 Win=493 Len=0 TSval=2237454940 TSecr=2766448639"
"16","0.184388187","172.217.11.54","192.168.1.118","TLSv1.2","1719","Certificate, Server Key Exchange, Server Hello Done"
"17","0.184458000","192.168.1.118","172.217.11.54","TCP","66","37768 → 443 [ACK] Seq=518 Ack=3072 Win=481 Len=0 TSval=2237454942 TSecr=2766448639"
"18","0.210395625","192.168.1.118","172.217.11.54","TLSv1","583","Client Hello"
"19","0.238516750","192.168.1.118","172.217.11.54","TLSv1","583","Client Hello"
"20","0.239267437","192.168.1.104","255.255.255.255","UDP","217","49154 → 6666 Len=175"
"21","0.246248700","172.217.11.54","192.168.1.118","TCP","66","443 → 37770 [ACK] Seq=1 Ack=518 Win=240 Len=0 TSval=1159890636 TSecr=2237454968"
"22","0.248045262","172.217.11.54","192.168.1.118","TLSv1.2","3137","Server Hello, Certificate, Server Key Exchange, Server Hello Done"
"23","0.248105012","192.168.1.118","172.217.11.54","TCP","66","37770 → 443 [ACK] Seq=518 Ack=3072 Win=479 Len=0 TSval=2237455006 TSecr=1159890643"
"24","0.262272475","172.217.11.54","192.168.1.118","TCP","66","443 → 37772 [ACK] Seq=1 Ack=518 Win=240 Len=0 TSval=4105591923 TSecr=2237454996"
"25","0.270203437","172.217.11.54","192.168.1.118","TLSv1.2","1484","Server Hello"
"26","0.270269750","192.168.1.118","172.217.11.54","TCP","66","37772 → 443 [ACK] Seq=518 Ack=1419 Win=493 Len=0 TSval=2237455028 TSecr=4105591930"
"27","0.293304337","192.168.1.118","172.217.12.195","TLSv1","583","Client Hello"
"28","0.295076087","172.217.11.54","192.168.1.118","TLSv1.2","1719","Certificate, Server Key Exchange, Server Hello Done"
"29","0.295145312","192.168.1.118","172.217.11.54","TCP","66","37772 → 443 [ACK] Seq=518 Ack=3072 Win=481 Len=0 TSval=2237455053 TSecr=4105591930"
"30","0.309344700","192.168.1.118","172.217.11.54","TLSv1.2","192","Client Key Exchange, Change Cipher Spec, Encrypted Handshake Message"
"31","0.313025412","192.168.1.118","172.217.11.54","TLSv1.2","192","Client Key Exchange, Change Cipher Spec, Encrypted Handshake Message"
"32","0.323424875","192.168.1.118","172.217.11.54","TLSv1.2","192","Client Key Exchange, Change Cipher Spec, Encrypted Handshake Message"
"33","0.325732512","192.168.1.118","172.217.11.54","TLSv1.2","192","Client Key Exchange, Change Cipher Spec, Encrypted Handshake Message"
"34","0.343163050","192.168.1.118","172.217.11.54","TLSv1.2","192","Client Key Exchange, Change Cipher Spec, Encrypted Handshake Message"
"35","0.353563575","172.217.11.54","192.168.1.118","TLSv1.2","117","Change Cipher Spec, Encrypted Handshake Message"
"36","0.353645162","192.168.1.118","172.217.11.54","TCP","66","37764 → 443 [ACK] Seq=127 Ack=3123 Win=501 Len=0 TSval=2237455111 TSecr=619339082"
"37","0.355698375","172.217.11.54","192.168.1.118","TLSv1.2","117","Change Cipher Spec, Encrypted Handshake Message"
"38","0.355768225","192.168.1.118","172.217.11.54","TCP","66","37770 → 443 [ACK] Seq=644 Ack=3123 Win=501 Len=0 TSval=2237455113 TSecr=1159890754"
"39","0.355806912","172.217.11.54","192.168.1.118","TLSv1.2","117","Change Cipher Spec, Encrypted Handshake Message"
"40","0.355826262","192.168.1.118","172.217.11.54","TCP","66","37766 → 443 [ACK] Seq=644 Ack=3123 Win=501 Len=0 TSval=2237455113 TSecr=619339082"
"41","0.355841525","172.217.12.195","192.168.1.118","TCP","66","443 → 38016 [ACK] Seq=1 Ack=518 Win=240 Len=0 TSval=2260520198 TSecr=3677824451"
"42","0.355859200","172.217.11.54","192.168.1.118","TLSv1.2","117","Change Cipher Spec, Encrypted Handshake Message"
"43","0.355877350","192.168.1.118","172.217.11.54","TCP","66","37768 → 443 [ACK] Seq=644 Ack=3123 Win=501 Len=0 TSval=2237455113 TSecr=2766448805"
"44","0.355900662","172.217.12.195","192.168.1.118","TLSv1.2","2726","Server Hello, Certificate, Server Key Exchange, Server Hello Done"
"45","0.355916975","192.168.1.118","172.217.12.195","TCP","66","38016 → 443 [ACK] Seq=518 Ack=2661 Win=482 Len=0 TSval=3677824513 TSecr=2260520204"
"46","0.369859475","172.217.11.54","192.168.1.118","TLSv1.2","117","Change Cipher Spec, Encrypted Handshake Message"
"47","0.369928387","192.168.1.118","172.217.11.54","TCP","66","37772 → 443 [ACK] Seq=644 Ack=3123 Win=501 Len=0 TSval=2237455127 TSecr=4105592027"
"48","0.402581300","192.168.1.118","172.217.11.54","TLSv1.2","363","Application Data"
"49","0.403064250","192.168.1.118","172.217.11.54","TLSv1.2","363","Application Data"
"50","0.407449387","192.168.1.118","172.217.11.54","TLSv1.2","363","Application Data"
"51","0.407913612","192.168.1.118","172.217.11.54","TLSv1.2","363","Application Data"
"52","0.408150137","192.168.1.118","172.217.11.54","TLSv1.2","363","Application Data"
"53","0.411841725","192.168.1.118","172.217.12.195","TLSv1.2","192","Client Key Exchange, Change Cipher Spec, Encrypted Handshake Message"
"54","0.420315662","172.217.11.54","192.168.1.118","TLSv1.2","1484","Application Data"
"55","0.420392787","192.168.1.118","172.217.11.54","TCP","66","37764 → 443 [ACK] Seq=424 Ack=4541 Win=493 Len=0 TSval=2237455178 TSecr=619339156"
"56","0.423453900","172.217.11.54","192.168.1.118","TLSv1.2","2902","Application Data, Application Data"
"57","0.423521737","192.168.1.118","172.217.11.54","TCP","66","37764 → 443 [ACK] Seq=424 Ack=7377 Win=471 Len=0 TSval=2237455181 TSecr=619339156"
"58","0.423574812","172.217.11.54","192.168.1.118","TLSv1.2","2902","Application Data, Application Data"
"59","0.423590475","192.168.1.118","172.217.11.54","TCP","66","37764 → 443 [ACK] Seq=424 Ack=10213 Win=449 Len=0 TSval=2237455181 TSecr=619339156"
"60","0.423626800","172.217.11.54","192.168.1.118","TLSv1.2","2451","Application Data, Application Data"
"61","0.423648712","192.168.1.118","172.217.11.54","TCP","66","37764 → 443 [ACK] Seq=424 Ack=12598 Win=431 Len=0 TSval=2237455181 TSecr=619339156"
"62","0.424812112","172.217.11.54","192.168.1.118","TCP","66","443 → 37766 [ACK] Seq=3123 Ack=941 Win=244 Len=0 TSval=619339160 TSecr=2237455161"
"63","0.434649187","172.217.11.54","192.168.1.118","TLSv1.2","1484","Application Data"
"64","0.434741662","192.168.1.118","172.217.11.54","TCP","66","37768 → 443 [ACK] Seq=941 Ack=4541 Win=493 Len=0 TSval=2237455192 TSecr=2766448888"
"65","0.437250712","172.217.11.54","192.168.1.118","TLSv1.2","1484","Application Data"
"66","0.437298962","192.168.1.118","172.217.11.54","TCP","66","37770 → 443 [ACK] Seq=941 Ack=4541 Win=493 Len=0 TSval=2237455195 TSecr=1159890838"
"67","0.437335850","172.217.11.54","192.168.1.118","TLSv1.2","2902","Application Data, Application Data"
"68","0.437351962","192.168.1.118","172.217.11.54","TCP","66","37770 → 443 [ACK] Seq=941 Ack=7377 Win=471 Len=0 TSval=2237455195 TSecr=1159890838"
"69","0.437369037","172.217.11.54","192.168.1.118","TLSv1.2","1484","Application Data"
"70","0.437384075","192.168.1.118","172.217.11.54","TCP","66","37768 → 443 [ACK] Seq=941 Ack=5959 Win=482 Len=0 TSval=2237455195 TSecr=2766448888"
"71","0.438908500","172.217.11.54","192.168.1.118","TLSv1.2","1484","Application Data"
"72","0.438938875","192.168.1.118","172.217.11.54","TCP","66","37768 → 443 [ACK] Seq=941 Ack=7377 Win=471 Len=0 TSval=2237455196 TSecr=2766448888"
"73","0.438972137","172.217.11.54","192.168.1.118","TLSv1.2","2902","Application Data, Application Data"
"74","0.438991937","192.168.1.118","172.217.11.54","TCP","66","37770 → 443 [ACK] Seq=941 Ack=10213 Win=449 Len=0 TSval=2237455197 TSecr=1159890838"
"75","0.439944400","172.217.11.54","192.168.1.118","TLSv1.2","1484","Application Data"
"76","0.439979550","192.168.1.118","172.217.11.54","TCP","66","37768 → 443 [ACK] Seq=941 Ack=8795 Win=460 Len=0 TSval=2237455198 TSecr=2766448888"
"77","0.440003500","172.217.11.54","192.168.1.118","TLSv1.2","1484","Application Data"
"78","0.440055112","172.217.11.54","192.168.1.118","TLSv1.2","2902","Application Data, Application Data"
"79","0.440083187","172.217.11.54","192.168.1.118","TLSv1.2","2902","Application Data, Application Data"
"80","0.440100937","192.168.1.118","172.217.11.54","TCP","66","37768 → 443 [ACK] Seq=941 Ack=11631 Win=438 Len=0 TSval=2237455198 TSecr=2766448888"
"81","0.440110112","172.217.11.54","192.168.1.118","TLSv1.2","2902","Application Data, Application Data"
"82","0.440125975","192.168.1.118","172.217.11.54","TCP","66","37770 → 443 [ACK] Seq=941 Ack=13049 Win=427 Len=0 TSval=2237455198 TSecr=1159890838"
"83","0.445045962","172.217.11.54","192.168.1.118","TLSv1.2","1484","Application Data"
"84","0.450577550","172.217.11.54","192.168.1.118","TLSv1.2","1080","Application Data"
"85","0.450628387","172.217.11.54","192.168.1.118","TLSv1.2","563","Application Data"
"86","0.450666375","192.168.1.118","172.217.11.54","TCP","66","37770 → 443 [ACK] Seq=941 Ack=13546 Win=424 Len=0 TSval=2237455208 TSecr=1159890841"
"87","0.450725700","172.217.11.54","192.168.1.118","TLSv1.2","825","Application Data"
"88","0.450742650","192.168.1.118","172.217.11.54","TCP","66","37768 → 443 [ACK] Seq=941 Ack=12390 Win=433 Len=0 TSval=2237455208 TSecr=2766448892"
"89","0.450761787","172.217.11.54","192.168.1.118","TLSv1.2","1484","Application Data"
"90","0.450779562","192.168.1.118","172.217.11.54","TCP","66","37766 → 443 [ACK] Seq=941 Ack=4541 Win=493 Len=0 TSval=2237455208 TSecr=619339170"
"91","0.450796062","172.217.11.54","192.168.1.118","TLSv1.2","1484","Application Data"
"92","0.450810175","192.168.1.118","172.217.11.54","TCP","66","37766 → 443 [ACK] Seq=941 Ack=5959 Win=482 Len=0 TSval=2237455208 TSecr=619339170"
"93","0.451643137","172.217.11.54","192.168.1.118","TLSv1.2","1484","Application Data"
"94","0.451709750","192.168.1.118","172.217.11.54","TCP","66","37766 → 443 [ACK] Seq=941 Ack=7377 Win=471 Len=0 TSval=2237455209 TSecr=619339170"
"95","0.451771375","172.217.11.54","192.168.1.118","TLSv1.2","5738","Application Data, Application Data, Application Data, Application Data"
"96","0.451789825","192.168.1.118","172.217.11.54","TCP","66","37766 → 443 [ACK] Seq=941 Ack=13049 Win=427 Len=0 TSval=2237455209 TSecr=619339170"
"97","0.451798762","172.217.11.54","192.168.1.118","TLSv1.2","1415","Application Data"
"98","0.451812775","192.168.1.118","172.217.11.54","TCP","66","37766 → 443 [ACK] Seq=941 Ack=14398 Win=417 Len=0 TSval=2237455209 TSecr=619339172"
"99","0.451826950","172.217.12.195","192.168.1.118","TLSv1.2","117","Change Cipher Spec, Encrypted Handshake Message"
"100","0.451849150","192.168.1.118","172.217.12.195","TCP","66","38016 → 443 [ACK] Seq=644 Ack=2712 Win=501 Len=0 TSval=3677824609 TSecr=2260520292"
"101","0.479652587","192.168.1.118","172.217.11.54","TCP","66","37772 → 443 [ACK] Seq=941 Ack=9809 Win=449 Len=0 TSval=2237455237 TSecr=4105592093"
"102","0.481978787","192.168.1.118","172.217.12.195","TLSv1.2","340","Application Data"
"103","0.486775350","192.168.1.118","209.18.47.62","DNS","73","Standard query 0xa4eb A yt3.ggpht.com"
"104","0.505664175","209.18.47.62","192.168.1.118","DNS","134","Standard query response 0xa4eb A yt3.ggpht.com CNAME photos-ugc.l.googleusercontent.com A 142.250.64.97"
"105","0.506885775","172.217.12.195","192.168.1.118","TLSv1.2","1484","Application Data"
"106","0.508537362","172.217.12.195","192.168.1.118","TLSv1.2","1083","Application Data"
"107","0.508732775","192.168.1.118","209.18.47.62","DNS","73","Standard query 0x60df AAAA yt3.ggpht.com"
"108","0.521860825","209.18.47.62","192.168.1.118","DNS","146","Standard query response 0x60df AAAA yt3.ggpht.com CNAME photos-ugc.l.googleusercontent.com AAAA 2607:f8b0:4006:807::2001"
"109","0.547739075","192.168.1.118","172.217.12.195","TCP","66","38016 → 443 [ACK] Seq=918 Ack=5147 Win=482 Len=0 TSval=3677824705 TSecr=2260520358"
"110","0.573377700","192.168.1.118","142.250.64.97","TCP","74","38202 → 443 [SYN] Seq=0 Win=64240 Len=0 MSS=1460 SACK_PERM=1 TSval=379358124 TSecr=0 WS=128"
"111","0.573530600","192.168.1.118","142.250.64.97","TCP","74","38204 → 443 [SYN] Seq=0 Win=64240 Len=0 MSS=1460 SACK_PERM=1 TSval=379358124 TSecr=0 WS=128"
"112","0.581650525","192.168.1.118","172.217.7.14","TCP","66","40406 → 443 [ACK] Seq=1 Ack=1 Win=243 Len=0 TSval=1952354526 TSecr=3272057485"
"113","0.592650750","142.250.64.97","192.168.1.118","TCP","74","443 → 38202 [SYN, ACK] Seq=0 Ack=1 Win=60192 Len=0 MSS=1380 SACK_PERM=1 TSval=3695040734 TSecr=379358124 WS=256"
"114","0.592750575","192.168.1.118","142.250.64.97","TCP","66","38202 → 443 [ACK] Seq=1 Ack=1 Win=64256 Len=0 TSval=379358143 TSecr=3695040734"
"115","0.606059237","142.250.64.97","192.168.1.118","TCP","74","443 → 38204 [SYN, ACK] Seq=0 Ack=1 Win=60192 Len=0 MSS=1380 SACK_PERM=1 TSval=4071464583 TSecr=379358124 WS=256"
"116","0.606151850","192.168.1.118","142.250.64.97","TCP","66","38204 → 443 [ACK] Seq=1 Ack=1 Win=64256 Len=0 TSval=379358157 TSecr=4071464583"
"117","0.624888950","IntelCor_b7:52:73","Broadcast","ARP","60","Who has 192.168.1.1? Tell 192.168.1.118"
"118","0.629020362","Cisco-Li_5b:1c:ce","IntelCor_b7:52:73","ARP","42","192.168.1.1 is at 58:6d:8f:5b:1c:ce"
"119","0.829961575","192.168.1.118","142.250.64.97","TLSv1","583","Client Hello"
"120","0.841995487","142.250.64.97","192.168.1.118","TCP","66","443 → 38202 [ACK] Seq=1 Ack=518 Win=61440 Len=0 TSval=3695040984 TSecr=379358380"
"121","0.850964962","142.250.64.97","192.168.1.118","TLSv1.2","1484","Server Hello"
"122","0.851032750","192.168.1.118","142.250.64.97","TCP","66","38202 → 443 [ACK] Seq=518 Ack=1419 Win=63104 Len=0 TSval=379358402 TSecr=3695040990"
"123","0.855307812","142.250.64.97","192.168.1.118","TLSv1.2","3880","Certificate, Server Key Exchange, Server Hello Done"
"124","0.855377400","192.168.1.118","142.250.64.97","TCP","66","38202 → 443 [ACK] Seq=518 Ack=5233 Win=59392 Len=0 TSval=379358406 TSecr=3695040990"
"125","0.892407262","192.168.1.118","142.250.64.97","TLSv1","583","Client Hello"
"126","0.896697012","192.168.1.118","142.250.64.97","TLSv1.2","192","Client Key Exchange, Change Cipher Spec, Encrypted Handshake Message"
"127","0.911146287","192.168.1.118","172.217.7.14","TLSv1.2","338","Application Data"
"128","0.911274900","192.168.1.118","172.217.11.54","TLSv1.2","363","Application Data"
"129","0.914241737","192.168.1.118","172.217.11.54","TLSv1.2","363","Application Data"
"130","0.914372437","192.168.1.118","172.217.11.54","TLSv1.2","363","Application Data"
"131","0.914464837","192.168.1.118","172.217.11.54","TLSv1.2","363","Application Data"
"132","0.914556587","192.168.1.118","172.217.11.54","TLSv1.2","363","Application Data"
"133","0.918443612","142.250.64.97","192.168.1.118","TLSv1.2","117","Change Cipher Spec, Encrypted Handshake Message"
"134","0.918517362","192.168.1.118","142.250.64.97","TCP","66","38202 → 443 [ACK] Seq=644 Ack=5284 Win=64128 Len=0 TSval=379358469 TSecr=3695041060"
"135","0.919752050","142.250.64.97","192.168.1.118","TCP","66","443 → 38204 [ACK] Seq=1 Ack=518 Win=61440 Len=0 TSval=4071464897 TSecr=379358443"
"136","0.924560550","142.250.64.97","192.168.1.118","TLSv1.2","1484","Server Hello"
"137","0.924628362","192.168.1.118","142.250.64.97","TCP","66","38204 → 443 [ACK] Seq=518 Ack=1419 Win=63104 Len=0 TSval=379358475 TSecr=4071464903"
"138","0.926338662","142.250.64.97","192.168.1.118","TLSv1.2","3881","Certificate, Server Key Exchange, Server Hello Done"
"139","0.926402662","192.168.1.118","142.250.64.97","TCP","66","38204 → 443 [ACK] Seq=518 Ack=5234 Win=59392 Len=0 TSval=379358477 TSecr=4071464903"
"140","0.929270450","172.217.11.54","192.168.1.118","TLSv1.2","1484","Application Data"
"141","0.929345387","192.168.1.118","172.217.11.54","TCP","66","37764 → 443 [ACK] Seq=721 Ack=14016 Win=493 Len=0 TSval=2237455687 TSecr=619339662"
"142","0.929383325","172.217.7.14","192.168.1.118","TLSv1.2","1484","Application Data"
"143","0.929405325","192.168.1.118","172.217.7.14","TCP","66","40402 → 443 [ACK] Seq=273 Ack=1419 Win=493 Len=0 TSval=1952354874 TSecr=4134150391"
"144","0.929425625","172.217.11.54","192.168.1.118","TLSv1.2","1484","Application Data"
"145","0.929443525","192.168.1.118","172.217.11.54","TCP","66","37764 → 443 [ACK] Seq=721 Ack=15434 Win=482 Len=0 TSval=2237455687 TSecr=619339663"
"146","0.931271550","172.217.11.54","192.168.1.118","TLSv1.2","1484","Application Data"
"147","0.931331237","192.168.1.118","172.217.11.54","TCP","66","37764 → 443 [ACK] Seq=721 Ack=16852 Win=471 Len=0 TSval=2237455689 TSecr=619339663"
"148","0.931377325","172.217.7.14","192.168.1.118","TLSv1.2","2552","Application Data, Application Data"
"149","0.931399587","192.168.1.118","172.217.7.14","TCP","66","40402 → 443 [ACK] Seq=273 Ack=3905 Win=474 Len=0 TSval=1952354876 TSecr=4134150392"
"150","0.931417712","172.217.11.54","192.168.1.118","TLSv1.2","1484","Application Data"
"151","0.931433450","192.168.1.118","172.217.11.54","TCP","66","37764 → 443 [ACK] Seq=721 Ack=18270 Win=460 Len=0 TSval=2237455689 TSecr=619339666"
"152","0.932610537","172.217.11.54","192.168.1.118","TLSv1.2","1484","Application Data"
"153","0.932646737","192.168.1.118","172.217.11.54","TCP","66","37764 → 443 [ACK] Seq=721 Ack=19688 Win=449 Len=0 TSval=2237455690 TSecr=619339666"
"154","0.934038062","172.217.11.54","192.168.1.118","TLSv1.2","2902","Application Data, Application Data"
"155","0.934081437","192.168.1.118","172.217.11.54","TCP","66","37764 → 443 [ACK] Seq=721 Ack=22524 Win=427 Len=0 TSval=2237455692 TSecr=619339668"
"156","0.935358837","172.217.11.54","192.168.1.118","TLSv1.2","439","Application Data"
"157","0.935408537","192.168.1.118","172.217.11.54","TCP","66","37764 → 443 [ACK] Seq=721 Ack=22897 Win=425 Len=0 TSval=2237455693 TSecr=619339671"
"158","0.958550725","172.217.11.54","192.168.1.118","TLSv1.2","1484","Application Data"
"159","0.958631475","192.168.1.118","172.217.11.54","TCP","66","37766 → 443 [ACK] Seq=1238 Ack=15816 Win=493 Len=0 TSval=2237455716 TSecr=619339687"
"160","0.960658025","192.168.1.118","142.250.64.97","TLSv1.2","339","Application Data"
"161","0.965658987","172.217.11.54","192.168.1.118","TLSv1.2","2902","Application Data, Application Data"
"162","0.965740825","192.168.1.118","172.217.11.54","TCP","66","37766 → 443 [ACK] Seq=1238 Ack=18652 Win=471 Len=0 TSval=2237455723 TSecr=619339687"
"163","0.965784625","172.217.11.54","192.168.1.118","TLSv1.2","2902","Application Data, Application Data"
"164","0.965801362","192.168.1.118","172.217.11.54","TCP","66","37766 → 443 [ACK] Seq=1238 Ack=21488 Win=449 Len=0 TSval=2237455723 TSecr=619339688"
"165","0.966446537","172.217.11.54","192.168.1.118","TLSv1.2","2902","Application Data, Application Data"
"166","0.966485912","192.168.1.118","172.217.11.54","TCP","66","37766 → 443 [ACK] Seq=1238 Ack=24324 Win=427 Len=0 TSval=2237455724 TSecr=619339690"
"167","0.966524012","172.217.11.54","192.168.1.118","TLSv1.2","2902","Application Data, Application Data"
"168","0.966545837","192.168.1.118","172.217.11.54","TCP","66","37766 → 443 [ACK] Seq=1238 Ack=27160 Win=405 Len=0 TSval=2237455724 TSecr=619339691"
"169","0.966554350","172.217.11.54","192.168.1.118","TLSv1.2","1308","Application Data"
"170","0.966568862","192.168.1.118","172.217.11.54","TCP","66","37766 → 443 [ACK] Seq=1238 Ack=28402 Win=396 Len=0 TSval=2237455724 TSecr=619339693"
"171","0.966582887","142.250.64.97","192.168.1.118","TCP","66","[TCP Dup ACK 135#1] 443 → 38204 [ACK] Seq=5234 Ack=518 Win=61440 Len=0 TSval=4071464938 TSecr=379358477"
"172","0.969391887","172.217.11.54","192.168.1.118","TLSv1.2","1484","Application Data"
"173","0.969452150","172.217.11.54","192.168.1.118","TLSv1.2","1484","Application Data"
"174","0.969492325","192.168.1.118","172.217.11.54","TCP","66","37768 → 443 [ACK] Seq=1238 Ack=13808 Win=493 Len=0 TSval=2237455727 TSecr=2766449419"
"175","0.969530750","172.217.11.54","192.168.1.118","TLSv1.2","1484","Application Data"
"176","0.969550225","192.168.1.118","172.217.11.54","TCP","66","37770 → 443 [ACK] Seq=1238 Ack=14964 Win=493 Len=0 TSval=2237455727 TSecr=1159891369"
"177","0.969566887","172.217.11.54","192.168.1.118","TLSv1.2","1484","Application Data"
"178","0.970995412","192.168.1.118","142.250.64.97","TLSv1.2","192","Client Key Exchange, Change Cipher Spec, Encrypted Handshake Message"
"179","0.971078462","172.217.11.54","192.168.1.118","TLSv1.2","1484","Application Data"
"180","0.971122550","172.217.11.54","192.168.1.118","TLSv1.2","2902","Application Data, Application Data"
"181","0.971145637","192.168.1.118","172.217.11.54","TCP","66","37768 → 443 [ACK] Seq=1238 Ack=16644 Win=471 Len=0 TSval=2237455729 TSecr=2766449420"
"182","0.972082987","172.217.11.54","192.168.1.118","TLSv1.2","2902","Application Data, Application Data"
"183","0.972147900","192.168.1.118","172.217.11.54","TCP","66","37770 → 443 [ACK] Seq=1238 Ack=17800 Win=471 Len=0 TSval=2237455730 TSecr=1159891370"
"184","0.972220712","172.217.11.54","192.168.1.118","TLSv1.2","2408","Application Data, Application Data"
"185","0.972236012","172.217.11.54","192.168.1.118","TLSv1.2","2902","Application Data, Application Data"
"186","0.972252037","192.168.1.118","172.217.11.54","TCP","66","37770 → 443 [ACK] Seq=1238 Ack=20636 Win=449 Len=0 TSval=2237455730 TSecr=1159891373"
"187","0.972260887","172.217.11.54","192.168.1.118","TLSv1.2","2902","Application Data, Application Data"
"188","0.972278137","192.168.1.118","172.217.11.54","TCP","66","37768 → 443 [ACK] Seq=1238 Ack=19480 Win=449 Len=0 TSval=2237455730 TSecr=2766449423"
"189","0.975154050","172.217.11.54","192.168.1.118","TLSv1.2","1845","Application Data, Application Data"
"190","0.975220587","192.168.1.118","172.217.11.54","TCP","66","37770 → 443 [ACK] Seq=1238 Ack=22415 Win=436 Len=0 TSval=2237455733 TSecr=1159891376"
"191","0.975267837","172.217.11.54","192.168.1.118","TLSv1.2","1937","Application Data, Application Data"
"192","0.975286025","192.168.1.118","172.217.11.54","TCP","66","37768 → 443 [ACK] Seq=1238 Ack=21351 Win=435 Len=0 TSval=2237455733 TSecr=2766449427"
"193","0.975480712","192.168.1.118","172.217.11.54","TCP","66","37772 → 443 [ACK] Seq=1238 Ack=16405 Win=450 Len=0 TSval=2237455733 TSecr=4105592624"
"194","0.976531737","192.168.1.118","172.217.7.14","TLSv1.2","331","Application Data"
"195","0.978483037","192.168.1.118","172.217.7.14","TCP","66","40400 → 443 [ACK] Seq=1 Ack=1 Win=501 Len=0 TSval=1952354923 TSecr=3115403722"
"196","0.988177587","142.250.64.97","192.168.1.118","TLSv1.2","1484","Application Data"
"197","0.988254137","192.168.1.118","142.250.64.97","TCP","66","38202 → 443 [ACK] Seq=917 Ack=6702 Win=63104 Len=0 TSval=379358539 TSecr=3695041129"
"198","0.990196437","142.250.64.97","192.168.1.118","TLSv1.2","2153","Application Data, Application Data"
"199","0.990253950","192.168.1.118","142.250.64.97","TCP","66","38202 → 443 [ACK] Seq=917 Ack=8789 Win=61056 Len=0 TSval=379358541 TSecr=3695041129"
"200","0.999649837","142.250.64.97","192.168.1.118","TLSv1.2","117","Change Cipher Spec, Encrypted Handshake Message"
"201","0.999739850","192.168.1.118","142.250.64.97","TCP","66","38204 → 443 [ACK] Seq=644 Ack=5285 Win=64128 Len=0 TSval=379358550 TSecr=4071464973"
"202","1.004482312","172.217.7.14","192.168.1.118","TCP","66","443 → 40378 [ACK] Seq=1 Ack=266 Win=248 Len=0 TSval=957996430 TSecr=1952354921"
"203","1.004539900","172.217.7.14","192.168.1.118","TLSv1.2","787","Application Data"
"204","1.004570812","192.168.1.118","172.217.7.14","TCP","66","40378 → 443 [ACK] Seq=266 Ack=722 Win=523 Len=0 TSval=1952354949 TSecr=957996431"
"205","1.039376587","192.168.1.118","192.168.1.102","TCP","176","33368 → 8009 [PSH, ACK] Seq=1 Ack=1 Win=501 Len=110 TSval=2810897085 TSecr=7283543 [TCP segment of a reassembled PDU]"
"206","1.045036712","192.168.1.102","192.168.1.118","TCP","176","8009 → 33368 [PSH, ACK] Seq=1 Ack=111 Win=294 Len=110 TSval=7284047 TSecr=2810897085 [TCP segment of a reassembled PDU]"
"207","1.045119712","192.168.1.118","192.168.1.102","TCP","66","33368 → 8009 [ACK] Seq=111 Ack=111 Win=501 Len=0 TSval=2810897091 TSecr=7284047"
"208","1.077489650","192.168.1.118","142.250.64.97","TLSv1.2","338","Application Data"
"209","1.077957162","192.168.1.118","172.217.11.54","TLSv1.2","363","Application Data"
"210","1.092284062","192.168.1.118","172.217.7.14","TCP","66","40404 → 443 [ACK] Seq=1 Ack=1 Win=501 Len=0 TSval=1952355037 TSecr=1498886843"
"211","1.092670750","192.168.1.118","172.217.11.54","TLSv1.2","376","Application Data"
"212","1.092811250","192.168.1.118","172.217.11.54","TLSv1.2","363","Application Data"
"213","1.092902925","192.168.1.118","172.217.11.54","TLSv1.2","363","Application Data"
"214","1.097810662","142.250.64.97","192.168.1.118","TLSv1.2","1484","Application Data"
"215","1.097884250","192.168.1.118","142.250.64.97","TCP","66","38204 → 443 [ACK] Seq=916 Ack=6703 Win=63104 Len=0 TSval=379358648 TSecr=4071465075"
"216","1.102776025","192.168.1.118","172.217.7.14","TCP","66","[TCP Window Update] 40406 → 443 [ACK] Seq=1 Ack=1 Win=501 Len=0 TSval=1952355047 TSecr=3272057485"
"217","1.103137075","192.168.1.118","172.217.11.54","TLSv1.2","363","Application Data"
"218","1.104281625","142.250.64.97","192.168.1.118","TLSv1.2","2902","Application Data, Application Data"
"219","1.104345175","192.168.1.118","142.250.64.97","TCP","66","38204 → 443 [ACK] Seq=916 Ack=9539 Win=61056 Len=0 TSval=379358655 TSecr=4071465075"
"220","1.104386050","142.250.64.97","192.168.1.118","TLSv1.2","954","Application Data"
"221","1.104401737","192.168.1.118","142.250.64.97","TCP","66","38204 → 443 [ACK] Seq=916 Ack=10427 Win=60288 Len=0 TSval=379358655 TSecr=4071465075"
"222","1.105596737","172.217.11.54","192.168.1.118","TLSv1.2","1484","Application Data"
"223","1.105663462","192.168.1.118","172.217.11.54","TCP","66","37768 → 443 [ACK] Seq=1535 Ack=22769 Win=493 Len=0 TSval=2237455863 TSecr=2766449556"
"224","1.105723412","172.217.11.54","192.168.1.118","TLSv1.2","1484","Application Data"
"225","1.105740200","192.168.1.118","172.217.11.54","TCP","66","37768 → 443 [ACK] Seq=1535 Ack=24187 Win=482 Len=0 TSval=2237455863 TSecr=2766449557"
"226","1.107669287","172.217.11.54","192.168.1.118","TLSv1.2","1484","Application Data"
"227","1.107751175","192.168.1.118","172.217.11.54","TCP","66","37768 → 443 [ACK] Seq=1535 Ack=25605 Win=493 Len=0 TSval=2237455865 TSecr=2766449557"
"228","1.107790500","172.217.11.54","192.168.1.118","TLSv1.2","1484","Application Data"
"229","1.107807587","192.168.1.118","172.217.11.54","TCP","66","37768 → 443 [ACK] Seq=1535 Ack=27023 Win=482 Len=0 TSval=2237455865 TSecr=2766449560"
"230","1.110385912","172.217.11.54","192.168.1.118","TLSv1.2","1484","Application Data"
"231","1.110447175","192.168.1.118","172.217.11.54","TCP","66","37768 → 443 [ACK] Seq=1535 Ack=28441 Win=493 Len=0 TSval=2237455868 TSecr=2766449560"
"232","1.119599850","192.168.1.118","172.217.3.110","TLSv1.2","275","Application Data"
"233","1.125120587","192.168.1.118","172.217.7.14","TLSv1.2","356","Application Data"
"234","1.132159400","172.217.11.54","192.168.1.118","TLSv1.2","2902","Application Data, Application Data"
"235","1.132224337","192.168.1.118","172.217.11.54","TCP","66","37768 → 443 [ACK] Seq=1535 Ack=31277 Win=477 Len=0 TSval=2237455890 TSecr=2766449564"
"236","1.132256987","172.217.11.54","192.168.1.118","TLSv1.2","760","Application Data"
"237","1.132272662","192.168.1.118","172.217.11.54","TCP","66","37768 → 443 [ACK] Seq=1535 Ack=31971 Win=472 Len=0 TSval=2237455890 TSecr=2766449567"
"238","1.139138887","192.168.1.118","172.217.11.54","TLSv1.2","363","Application Data"
"239","1.139279475","192.168.1.118","172.217.7.14","TLSv1.2","360","Application Data"
"240","1.145186012","172.217.11.54","192.168.1.118","TLSv1.2","1484","Application Data"
"241","1.145261425","192.168.1.118","172.217.11.54","TCP","66","37764 → 443 [ACK] Seq=1031 Ack=24315 Win=493 Len=0 TSval=2237455903 TSecr=619339880"
"242","1.148589500","172.217.11.54","192.168.1.118","TLSv1.2","1484","Application Data"
"243","1.148653487","172.217.11.54","192.168.1.118","TLSv1.2","1484","Application Data"
"244","1.148710025","192.168.1.118","172.217.11.54","TCP","66","37770 → 443 [ACK] Seq=1535 Ack=23833 Win=493 Len=0 TSval=2237455906 TSecr=1159891552"
"245","1.148748850","172.217.11.54","192.168.1.118","TLSv1.2","1484","Application Data"
"246","1.148769412","192.168.1.118","172.217.11.54","TCP","66","37766 → 443 [ACK] Seq=1535 Ack=29820 Win=493 Len=0 TSval=2237455906 TSecr=619339880"
"247","1.148786425","172.217.11.54","192.168.1.118","TLSv1.2","1484","Application Data"
"248","1.148801600","192.168.1.118","172.217.11.54","TCP","66","37766 → 443 [ACK] Seq=1535 Ack=31238 Win=482 Len=0 TSval=2237455906 TSecr=619339881"
"249","1.148944962","172.217.11.54","192.168.1.118","TLSv1.2","989","Application Data"
"250","1.148961037","192.168.1.118","172.217.11.54","TCP","66","37766 → 443 [ACK] Seq=1535 Ack=32161 Win=475 Len=0 TSval=2237455906 TSecr=619339881"
"251","1.148985287","172.217.11.54","192.168.1.118","TLSv1.2","2902","Application Data, Application Data"
"252","1.149001025","192.168.1.118","172.217.11.54","TCP","66","37764 → 443 [ACK] Seq=1031 Ack=27151 Win=477 Len=0 TSval=2237455907 TSecr=619339881"
"253","1.149026500","172.217.11.54","192.168.1.118","TLSv1.2","1484","Application Data"
"254","1.149041025","192.168.1.118","172.217.11.54","TCP","66","37770 → 443 [ACK] Seq=1535 Ack=25251 Win=482 Len=0 TSval=2237455907 TSecr=1159891553"
"255","1.152943675","172.217.11.54","192.168.1.118","TLSv1.2","1484","Application Data"
"256","1.153006275","192.168.1.118","172.217.11.54","TCP","66","37770 → 443 [ACK] Seq=1535 Ack=26669 Win=493 Len=0 TSval=2237455911 TSecr=1159891553"
"257","1.153055437","172.217.11.54","192.168.1.118","TLSv1.2","2902","Application Data, Application Data"
"258","1.153074287","172.217.11.54","192.168.1.118","TLSv1.2","1484","Application Data"
"259","1.153090262","192.168.1.118","172.217.11.54","TCP","66","37764 → 443 [ACK] Seq=1031 Ack=28569 Win=493 Len=0 TSval=2237455911 TSecr=619339884"
"260","1.153673887","172.217.11.54","192.168.1.118","TLSv1.2","2567","Application Data, Application Data"
"261","1.153718262","172.217.11.54","192.168.1.118","TLSv1.2","1484","Application Data"
"262","1.153738937","192.168.1.118","172.217.11.54","TCP","66","37764 → 443 [ACK] Seq=1031 Ack=29987 Win=493 Len=0 TSval=2237455911 TSecr=619339884"
"263","1.153756375","172.217.11.54","192.168.1.118","TLSv1.2","2902","Application Data, Application Data"
"264","1.153772275","192.168.1.118","172.217.11.54","TCP","66","37770 → 443 [ACK] Seq=1535 Ack=29505 Win=471 Len=0 TSval=2237455911 TSecr=1159891556"
"265","1.153864137","192.168.1.118","172.217.11.54","TCP","66","37772 → 443 [ACK] Seq=1535 Ack=23160 Win=449 Len=0 TSval=2237455911 TSecr=4105592808"
"266","1.156895112","192.168.1.118","172.217.11.54","TLSv1.2","376","Application Data"
"267","1.158956250","192.168.1.118","172.217.11.54","TLSv1.2","363","Application Data"
"268","1.159805850","172.217.3.110","192.168.1.118","TLSv1.2","1484","Application Data"
"269","1.159878450","192.168.1.118","172.217.3.110","TCP","66","42002 → 443 [ACK] Seq=210 Ack=1419 Win=493 Len=0 TSval=3208202943 TSecr=1266638134"
"270","1.159916650","172.217.11.54","192.168.1.118","TLSv1.2","651","Application Data"
"271","1.159933137","192.168.1.118","172.217.11.54","TCP","66","37764 → 443 [ACK] Seq=1031 Ack=30572 Win=493 Len=0 TSval=2237455917 TSecr=619339887"
"272","1.161456662","172.217.11.54","192.168.1.118","TLSv1.2","862","Application Data"
"273","1.161514775","192.168.1.118","172.217.11.54","TCP","66","37770 → 443 [ACK] Seq=1535 Ack=30301 Win=493 Len=0 TSval=2237455919 TSecr=1159891559"
"274","1.161559612","172.217.3.110","192.168.1.118","TLSv1.2","2902","Application Data, Application Data"
"275","1.161580287","192.168.1.118","172.217.3.110","TCP","66","42002 → 443 [ACK] Seq=210 Ack=4255 Win=477 Len=0 TSval=3208202945 TSecr=1266638134"
"276","1.161610175","172.217.3.110","192.168.1.118","TLSv1.2","2902","Application Data, Application Data"
"277","1.161625975","192.168.1.118","172.217.3.110","TCP","66","42002 → 443 [ACK] Seq=210 Ack=7091 Win=455 Len=0 TSval=3208202945 TSecr=1266638134"
"278","1.161698637","172.217.7.14","192.168.1.118","TLSv1.2","1484","Application Data"
"279","1.161725075","192.168.1.118","172.217.7.14","TCP","66","40378 → 443 [ACK] Seq=556 Ack=2140 Win=545 Len=0 TSval=1952355106 TSecr=957996586"
"280","1.161740325","172.217.7.14","192.168.1.118","TLSv1.2","1241","Application Data"
"281","1.161758250","192.168.1.118","172.217.7.14","TCP","66","40378 → 443 [ACK] Seq=556 Ack=3315 Win=568 Len=0 TSval=1952355106 TSecr=957996586"
"282","1.161776087","172.217.3.110","192.168.1.118","TLSv1.2","1484","Application Data"
"283","1.161791700","192.168.1.118","172.217.3.110","TCP","66","42002 → 443 [ACK] Seq=210 Ack=8509 Win=444 Len=0 TSval=3208202945 TSecr=1266638138"
"284","1.163452212","192.168.1.118","172.217.11.54","TLSv1.2","363","Application Data"
"285","1.169530537","192.168.1.118","172.217.11.54","TLSv1.2","363","Application Data"
"286","1.173081012","172.217.3.110","192.168.1.118","TLSv1.2","1484","Application Data"
"287","1.173146062","192.168.1.118","172.217.3.110","TCP","66","42002 → 443 [ACK] Seq=210 Ack=9927 Win=493 Len=0 TSval=3208202957 TSecr=1266638138"
"288","1.173192212","172.217.11.54","192.168.1.118","TLSv1.2","1484","Application Data"
"289","1.173219087","172.217.3.110","192.168.1.118","TLSv1.2","2902","Application Data, Application Data"
"290","1.173235137","192.168.1.118","172.217.3.110","TCP","66","42002 → 443 [ACK] Seq=210 Ack=12763 Win=471 Len=0 TSval=3208202957 TSecr=1266638142"
"291","1.175801225","172.217.7.14","192.168.1.118","TLSv1.2","1484","Application Data"
"292","1.175875100","192.168.1.118","172.217.7.14","TCP","66","40400 → 443 [ACK] Seq=295 Ack=1419 Win=493 Len=0 TSval=1952355120 TSecr=3115405336"
"293","1.175922625","172.217.3.110","192.168.1.118","TLSv1.2","2902","Application Data, Application Data"
"294","1.175940775","192.168.1.118","172.217.3.110","TCP","66","42002 → 443 [ACK] Seq=210 Ack=15599 Win=449 Len=0 TSval=3208202959 TSecr=1266638146"
"295","1.175950787","172.217.11.54","192.168.1.118","TLSv1.2","1484","Application Data"
"296","1.177455962","172.217.11.54","192.168.1.118","TLSv1.2","1484","Application Data"
"297","1.177513425","172.217.7.14","192.168.1.118","TLSv1.2","2902","Application Data, Application Data"
"298","1.177548875","192.168.1.118","172.217.7.14","TCP","66","40400 → 443 [ACK] Seq=295 Ack=4255 Win=471 Len=0 TSval=1952355122 TSecr=3115405337"
"299","1.178503887","172.217.7.14","192.168.1.118","TLSv1.2","2902","Application Data, Application Data"
"300","1.178525750","192.168.1.118","172.217.7.14","TCP","66","40400 → 443 [ACK] Seq=295 Ack=7091 Win=449 Len=0 TSval=1952355123 TSecr=3115405339"
"301","1.178553212","172.217.11.54","192.168.1.118","TLSv1.2","1533","Application Data, Application Data"
"302","1.178578925","172.217.7.14","192.168.1.118","TLSv1.2","2902","Application Data, Application Data"
"303","1.178592912","192.168.1.118","172.217.7.14","TCP","66","40400 → 443 [ACK] Seq=295 Ack=9927 Win=427 Len=0 TSval=1952355123 TSecr=3115405340"
"304","1.178604362","172.217.3.110","192.168.1.118","TLSv1.2","2902","Application Data, Application Data"
"305","1.178622262","192.168.1.118","172.217.3.110","TCP","66","42002 → 443 [ACK] Seq=210 Ack=18435 Win=427 Len=0 TSval=3208202962 TSecr=1266638150"
"306","1.178631100","172.217.7.14","192.168.1.118","TLSv1.2","1484","Application Data"
"307","1.178646187","192.168.1.118","172.217.7.14","TCP","66","40400 → 443 [ACK] Seq=295 Ack=11345 Win=416 Len=0 TSval=1952355123 TSecr=3115405342"
"308","1.181179012","172.217.7.14","192.168.1.118","TLSv1.2","1484","Application Data"
"309","1.181243925","192.168.1.118","172.217.7.14","TCP","66","40400 → 443 [ACK] Seq=295 Ack=12763 Win=405 Len=0 TSval=1952355126 TSecr=3115405342"
"310","1.181294112","172.217.7.14","192.168.1.118","TLSv1.2","2902","Application Data, Application Data"
"311","1.181314375","192.168.1.118","172.217.7.14","TCP","66","40400 → 443 [ACK] Seq=295 Ack=15599 Win=383 Len=0 TSval=1952355126 TSecr=3115405344"
"312","1.181323050","172.217.3.110","192.168.1.118","TLSv1.2","1484","Application Data"
"313","1.181339337","192.168.1.118","172.217.3.110","TCP","66","42002 → 443 [ACK] Seq=210 Ack=19853 Win=416 Len=0 TSval=3208202965 TSecr=1266638154"
"314","1.181375412","172.217.7.14","192.168.1.118","TLSv1.2","141","Application Data"
"315","1.181389600","192.168.1.118","172.217.7.14","TCP","66","40400 → 443 [ACK] Seq=295 Ack=15674 Win=383 Len=0 TSval=1952355126 TSecr=3115405346"
"316","1.181408225","172.217.3.110","192.168.1.118","TLSv1.2","1484","Application Data"
"317","1.181423037","192.168.1.118","172.217.3.110","TCP","66","42002 → 443 [ACK] Seq=210 Ack=21271 Win=405 Len=0 TSval=3208202965 TSecr=1266638154"
"318","1.181895312","192.168.1.118","172.217.11.54","TCP","66","37768 → 443 [ACK] Seq=1832 Ack=37692 Win=457 Len=0 TSval=2237455939 TSecr=2766449620"
"319","1.186440612","172.217.3.110","192.168.1.118","TLSv1.2","1484","Application Data"
"320","1.186511800","192.168.1.118","172.217.3.110","TCP","66","42002 → 443 [ACK] Seq=210 Ack=22689 Win=394 Len=0 TSval=3208202970 TSecr=1266638167"
"321","1.187839687","192.168.1.118","172.217.11.54","TLSv1.2","363","Application Data"
"322","1.188104412","172.217.3.110","192.168.1.118","TLSv1.2","1484","Application Data"
"323","1.188166112","192.168.1.118","172.217.3.110","TCP","66","42002 → 443 [ACK] Seq=210 Ack=24107 Win=383 Len=0 TSval=3208202972 TSecr=1266638167"
"324","1.189770200","172.217.11.54","192.168.1.118","TLSv1.2","1484","Application Data"
"325","1.190329287","172.217.11.54","192.168.1.118","TLSv1.2","1484","Application Data"
"326","1.190370912","172.217.11.54","192.168.1.118","TLSv1.2","2902","Application Data, Application Data"
"327","1.190393437","172.217.11.54","192.168.1.118","TLSv1.2","2902","Application Data, Application Data"
"328","1.190418425","172.217.11.54","192.168.1.118","TLSv1.2","2902","Application Data, Application Data"
"329","1.191876175","192.168.1.118","172.217.11.54","TCP","66","37766 → 443 [ACK] Seq=1845 Ack=39251 Win=446 Len=0 TSval=2237455949 TSecr=619339920"
"330","1.192018700","172.217.11.54","192.168.1.118","TLSv1.2","1989","Application Data, Application Data"
"331","1.192043925","192.168.1.118","172.217.11.54","TCP","66","37772 → 443 [ACK] Seq=1832 Ack=27414 Win=477 Len=0 TSval=2237455950 TSecr=4105592847"
"332","1.192523687","192.168.1.118","172.217.11.54","TCP","66","37766 → 443 [ACK] Seq=1845 Ack=41174 Win=431 Len=0 TSval=2237455950 TSecr=619339923"
"333","1.193040087","172.217.11.54","192.168.1.118","TLSv1.2","2902","Application Data, Application Data"
"334","1.193096575","192.168.1.118","172.217.11.54","TCP","66","37772 → 443 [ACK] Seq=1832 Ack=30250 Win=477 Len=0 TSval=2237455951 TSecr=4105592852"
"335","1.193129237","172.217.3.110","192.168.1.118","TLSv1.2","2902","Application Data, Application Data"
"336","1.193146337","192.168.1.118","172.217.3.110","TCP","66","42002 → 443 [ACK] Seq=210 Ack=26943 Win=477 Len=0 TSval=3208202977 TSecr=1266638174"
"337","1.194831100","172.217.11.54","192.168.1.118","TLSv1.2","352","Application Data"
"338","1.194872712","172.217.3.110","192.168.1.118","TLSv1.2","2902","Application Data, Application Data"
"339","1.194902512","192.168.1.118","172.217.3.110","TCP","66","42002 → 443 [ACK] Seq=210 Ack=29779 Win=477 Len=0 TSval=3208202978 TSecr=1266638176"
"340","1.200725162","192.168.1.118","172.217.11.54","TLSv1.2","363","Application Data"
"341","1.204576987","192.168.1.118","172.217.11.54","TLSv1.2","363","Application Data"
"342","1.211055412","172.217.3.110","192.168.1.118","TLSv1.2","2902","Application Data, Application Data"
"343","1.211121175","192.168.1.118","172.217.3.110","TCP","66","42002 → 443 [ACK] Seq=210 Ack=32615 Win=477 Len=0 TSval=3208202995 TSecr=1266638180"
"344","1.211159650","172.217.3.110","192.168.1.118","TLSv1.2","2448","Application Data, Application Data, Application Data"
"345","1.211176587","192.168.1.118","172.217.3.110","TCP","66","42002 → 443 [ACK] Seq=210 Ack=34997 Win=459 Len=0 TSval=3208202995 TSecr=1266638184"
"346","1.242371150","172.217.11.54","192.168.1.118","TLSv1.2","571","[TCP Spurious Retransmission] , Application Data"
"347","1.242441262","192.168.1.118","172.217.11.54","TCP","78","[TCP Dup ACK 332#1] 37766 → 443 [ACK] Seq=2142 Ack=41174 Win=501 Len=0 TSval=2237456000 TSecr=619339978 SLE=40669 SRE=41174"
"348","1.251425687","172.217.11.54","192.168.1.118","TLSv1.2","1484","Application Data"
"349","1.255860112","172.217.11.54","192.168.1.118","TLSv1.2","1484","Application Data"
"350","1.256111912","192.168.1.118","172.217.11.54","TCP","66","37770 → 443 [ACK] Seq=1832 Ack=33137 Win=493 Len=0 TSval=2237456014 TSecr=1159891659"
"351","1.262361587","172.217.11.54","192.168.1.118","TLSv1.2","1484","Application Data"
"352","1.262411400","172.217.7.14","192.168.1.118","TCP","66","[TCP Dup ACK 291#1] 443 → 40400 [ACK] Seq=15674 Ack=295 Win=248 Len=0 TSval=3115405429 TSecr=1952355126"
"353","1.262440062","172.217.11.54","192.168.1.118","TLSv1.2","1484","Application Data"
"354","1.262464062","172.217.11.54","192.168.1.118","TCP","66","443 → 37764 [ACK] Seq=30572 Ack=1328 Win=257 Len=0 TSval=619339991 TSecr=2237455921"
"355","1.262476275","172.217.11.54","192.168.1.118","TLSv1.2","2902","Application Data, Application Data"
"356","1.262538325","172.217.11.54","192.168.1.118","TLSv1.2","2902","Application Data, Application Data"
"357","1.263564312","192.168.1.118","172.217.11.54","TCP","66","37770 → 443 [ACK] Seq=1832 Ack=37391 Win=461 Len=0 TSval=2237456021 TSecr=1159891660"
"358","1.263673487","192.168.1.118","172.217.11.54","TCP","66","37768 → 443 [ACK] Seq=2129 Ack=41946 Win=468 Len=0 TSval=2237456021 TSecr=2766449714"
"359","1.265958725","172.217.11.54","192.168.1.118","TLSv1.2","2902","Application Data, Application Data"
"360","1.266002425","172.217.11.54","192.168.1.118","TLSv1.2","275","Application Data"
"361","1.266010475","172.217.11.54","192.168.1.118","TLSv1.2","2902","Application Data, Application Data"
"362","1.266442437","192.168.1.118","172.217.11.54","TCP","66","37770 → 443 [ACK] Seq=1832 Ack=40436 Win=438 Len=0 TSval=2237456024 TSecr=1159891666"
"363","1.266468925","172.217.11.54","192.168.1.118","TLSv1.2","1484","Application Data"
"364","1.266515637","192.168.1.118","172.217.11.54","TCP","66","37766 → 443 [ACK] Seq=2142 Ack=42592 Win=493 Len=0 TSval=2237456024 TSecr=619339997"
"365","1.266554212","172.217.11.54","192.168.1.118","TLSv1.2","1484","Application Data"
"366","1.266555112","192.168.1.118","172.217.11.54","TCP","66","37768 → 443 [ACK] Seq=2129 Ack=44782 Win=446 Len=0 TSval=2237456024 TSecr=2766449718"
"367","1.266587837","172.217.11.54","192.168.1.118","TLSv1.2","2902","Application Data, Application Data"
"368","1.266606587","192.168.1.118","172.217.11.54","TCP","66","37766 → 443 [ACK] Seq=2142 Ack=45428 Win=471 Len=0 TSval=2237456024 TSecr=619339997"
"369","1.279499625","192.168.1.118","172.217.11.54","TLSv1.2","363","Application Data"
"370","1.297559687","172.217.11.54","192.168.1.118","TLSv1.2","2902","Application Data, Application Data"
"371","1.297627100","192.168.1.118","172.217.11.54","TCP","66","37772 → 443 [ACK] Seq=2129 Ack=34790 Win=477 Len=0 TSval=2237456055 TSecr=4105592925"
"372","1.298520187","172.217.11.54","192.168.1.118","TLSv1.2","2278","Application Data, Application Data"
"373","1.298566862","192.168.1.118","172.217.11.54","TCP","66","37768 → 443 [ACK] Seq=2129 Ack=46994 Win=477 Len=0 TSval=2237456056 TSecr=2766449721"
"374","1.298609075","172.217.11.54","192.168.1.118","TLSv1.2","2902","Application Data, Application Data"
"375","1.298626175","192.168.1.118","172.217.11.54","TCP","66","37766 → 443 [ACK] Seq=2142 Ack=48264 Win=477 Len=0 TSval=2237456056 TSecr=619339999"
"376","1.298636225","172.217.11.54","192.168.1.118","TLSv1.2","1268","Application Data"
"377","1.298651650","192.168.1.118","172.217.11.54","TCP","66","37766 → 443 [ACK] Seq=2142 Ack=49466 Win=468 Len=0 TSval=2237456056 TSecr=619340000"
"378","1.298668100","172.217.11.54","192.168.1.118","TLSv1.2","1484","Application Data"
"379","1.298712325","172.217.11.54","192.168.1.118","TLSv1.2","2902","Application Data, Application Data"
"380","1.302288450","192.168.1.118","172.217.11.54","TCP","66","37764 → 443 [ACK] Seq=1328 Ack=34826 Win=468 Len=0 TSval=2237456060 TSecr=619340001"
"381","1.305477387","192.168.1.118","172.217.11.54","TLSv1.2","363","Application Data"
"382","1.305617050","192.168.1.118","172.217.11.54","TLSv1.2","363","Application Data"
"383","1.308043925","172.217.11.54","192.168.1.118","TLSv1.2","2902","Application Data, Application Data"
"384","1.308108612","192.168.1.118","172.217.11.54","TCP","66","37772 → 443 [ACK] Seq=2129 Ack=37626 Win=477 Len=0 TSval=2237456066 TSecr=4105592930"
"385","1.308140312","172.217.11.54","192.168.1.118","TLSv1.2","2902","Application Data, Application Data"
"386","1.308157537","192.168.1.118","172.217.11.54","TCP","66","37764 → 443 [ACK] Seq=1328 Ack=37662 Win=477 Len=0 TSval=2237456066 TSecr=619340005"
"387","1.308217775","172.217.11.54","192.168.1.118","TLSv1.2","1984","Application Data, Application Data"
"388","1.308244950","172.217.11.54","192.168.1.118","TLSv1.2","2246","Application Data, Application Data"
"389","1.313212212","172.217.11.54","192.168.1.118","TLSv1.2","1484","Application Data"
"390","1.314364287","192.168.1.118","172.217.11.54","TCP","66","37764 → 443 [ACK] Seq=1328 Ack=39842 Win=460 Len=0 TSval=2237456072 TSecr=619340008"
"391","1.314469200","192.168.1.118","172.217.11.54","TCP","66","37772 → 443 [ACK] Seq=2129 Ack=39544 Win=463 Len=0 TSval=2237456072 TSecr=4105592933"
"392","1.319180487","192.168.1.118","172.217.11.54","TLSv1.2","363","Application Data"
"393","1.319315137","192.168.1.118","172.217.11.54","TLSv1.2","363","Application Data"
"394","1.340969225","172.217.11.54","192.168.1.118","TLSv1.2","2902","Application Data, Application Data"
"395","1.341027687","172.217.11.54","192.168.1.118","TLSv1.2","2902","Application Data, Application Data"
"396","1.344312700","192.168.1.118","172.217.11.54","TCP","66","37770 → 443 [ACK] Seq=2129 Ack=47526 Win=446 Len=0 TSval=2237456102 TSecr=1159891718"
"397","1.346717312","172.217.11.54","192.168.1.118","TLSv1.2","2902","Application Data, Application Data"
"398","1.346782350","192.168.1.118","172.217.11.54","TCP","66","37770 → 443 [ACK] Seq=2129 Ack=50362 Win=477 Len=0 TSval=2237456104 TSecr=1159891723"
"399","1.346816137","172.217.11.54","192.168.1.118","TLSv1.2","1149","Application Data"
"400","1.354980075","172.217.11.54","192.168.1.118","TLSv1.2","1484","Application Data"
"401","1.356280425","172.217.11.54","192.168.1.118","TLSv1.2","2902","Application Data, Application Data"
"402","1.357043500","192.168.1.118","172.217.11.54","TCP","66","37766 → 443 [ACK] Seq=2439 Ack=53720 Win=468 Len=0 TSval=2237456115 TSecr=619340090"
"403","1.357872912","192.168.1.118","172.217.11.54","TLSv1.2","363","Application Data"
"404","1.359071687","172.217.11.54","192.168.1.118","TLSv1.2","2902","Application Data, Application Data"
"405","1.360071325","172.217.11.54","192.168.1.118","TLSv1.2","394","Application Data"
"406","1.360367650","192.168.1.118","172.217.11.54","TCP","66","37766 → 443 [ACK] Seq=2439 Ack=56884 Win=444 Len=0 TSval=2237456118 TSecr=619340092"
"407","1.364962575","192.168.1.118","172.217.11.54","TLSv1.2","363","Application Data"
"408","1.365360587","172.217.11.54","192.168.1.118","TLSv1.2","1484","Application Data"
"409","1.374743937","172.217.11.54","192.168.1.118","TLSv1.2","1484","Application Data"
"410","1.374812375","172.217.11.54","192.168.1.118","TLSv1.2","1484","Application Data"
"411","1.374841162","172.217.11.54","192.168.1.118","TLSv1.2","2902","Application Data, Application Data"
"412","1.374865225","172.217.11.54","192.168.1.118","TLSv1.2","2902","Application Data, Application Data"
"413","1.376157175","172.217.11.54","192.168.1.118","TLSv1.2","2902","Application Data, Application Data"
"414","1.376211662","172.217.11.54","192.168.1.118","TLSv1.2","2902","Application Data, Application Data"
"415","1.376221162","172.217.11.54","192.168.1.118","TLSv1.2","1484","Application Data"
"416","1.376617950","192.168.1.118","172.217.11.54","TCP","66","37768 → 443 [ACK] Seq=2426 Ack=52666 Win=461 Len=0 TSval=2237456134 TSecr=2766449819"
"417","1.376759125","192.168.1.118","172.217.11.54","TCP","66","37764 → 443 [ACK] Seq=1625 Ack=46932 Win=446 Len=0 TSval=2237456134 TSecr=619340097"
"418","1.376898625","192.168.1.118","172.217.11.54","TCP","66","37772 → 443 [ACK] Seq=2426 Ack=43798 Win=468 Len=0 TSval=2237456134 TSecr=4105593025"
"419","1.379243887","172.217.11.54","192.168.1.118","TLSv1.2","1788","Application Data, Application Data"
"420","1.379302212","172.217.11.54","192.168.1.118","TLSv1.2","1484","Application Data"
"421","1.379313612","172.217.11.54","192.168.1.118","TLSv1.2","2902","Application Data, Application Data"
"422","1.379601937","172.217.11.54","192.168.1.118","TLSv1.2","2799","Application Data, Application Data"
"423","1.379625912","172.217.11.54","192.168.1.118","TLSv1.2","2134","Application Data, Application Data"
"424","1.381160775","192.168.1.118","172.217.11.54","TCP","66","37768 → 443 [ACK] Seq=2426 Ack=56817 Win=429 Len=0 TSval=2237456139 TSecr=2766449824"
"425","1.381274550","192.168.1.118","172.217.11.54","TCP","66","37764 → 443 [ACK] Seq=1625 Ack=48654 Win=433 Len=0 TSval=2237456139 TSecr=619340104"
"426","1.381328462","192.168.1.118","172.217.11.54","TCP","66","37772 → 443 [ACK] Seq=2426 Ack=48702 Win=430 Len=0 TSval=2237456139 TSecr=4105593030"
"427","1.381863025","172.217.11.54","192.168.1.118","TLSv1.2","1484","Application Data"
"428","1.384710500","172.217.11.54","192.168.1.118","TLSv1.2","2902","Application Data, Application Data"
"429","1.384770925","172.217.11.54","192.168.1.118","TLSv1.2","1484","Application Data"
"430","1.384801087","172.217.11.54","192.168.1.118","TLSv1.2","1484","Application Data"
"431","1.384858512","172.217.11.54","192.168.1.118","TLSv1.2","1484","Application Data"
"432","1.386873800","172.217.11.54","192.168.1.118","TLSv1.2","1484","Application Data"
"433","1.386920050","172.217.11.54","192.168.1.118","TLSv1.2","2902","Application Data, Application Data"
"434","1.386933050","172.217.11.54","192.168.1.118","TLSv1.2","1484","Application Data"
"435","1.391834612","192.168.1.118","172.217.11.54","TCP","66","37770 → 443 [ACK] Seq=2426 Ack=57117 Win=457 Len=0 TSval=2237456149 TSecr=1159891789"
"436","1.392016112","192.168.1.118","172.217.11.54","TCP","66","37766 → 443 [ACK] Seq=2736 Ack=65392 Win=435 Len=0 TSval=2237456150 TSecr=619340117"
"437","1.395940912","172.217.11.54","192.168.1.118","TLSv1.2","1484","Application Data"
"438","1.395994112","172.217.11.54","192.168.1.118","TLSv1.2","2902","Application Data, Application Data"
"439","1.396011475","172.217.11.54","192.168.1.118","TLSv1.2","1484","Application Data"
"440","1.396070425","172.217.11.54","192.168.1.118","TLSv1.2","1484","Application Data"
"441","1.396079662","172.217.11.54","192.168.1.118","TLSv1.2","387","Application Data"
"442","1.396092712","172.217.11.54","192.168.1.118","TLSv1.2","648","Application Data"
"443","1.396145037","192.168.1.118","172.217.11.54","TLSv1.2","363","Application Data"
"444","1.400066062","192.168.1.118","172.217.11.54","TCP","66","37770 → 443 [ACK] Seq=2426 Ack=60535 Win=431 Len=0 TSval=2237456158 TSecr=1159891793"
"445","1.400206950","192.168.1.118","172.217.11.54","TCP","66","37766 → 443 [ACK] Seq=2736 Ack=69967 Win=400 Len=0 TSval=2237456158 TSecr=619340120"
"446","1.410413675","192.168.1.118","172.217.11.54","TLSv1.2","363","Application Data"
"447","1.410555625","192.168.1.118","172.217.11.54","TLSv1.2","363","Application Data"
"448","1.417301850","172.217.11.54","192.168.1.118","TLSv1.2","1484","Application Data"
"449","1.420718287","172.217.11.54","192.168.1.118","TLSv1.2","2902","Application Data, Application Data"
"450","1.422171450","172.217.11.54","192.168.1.118","TLSv1.2","2902","Application Data, Application Data"
"451","1.423754150","172.217.11.54","192.168.1.118","TLSv1.2","2715","Application Data, Application Data"
"452","1.424458100","192.168.1.118","172.217.11.54","TCP","66","37764 → 443 [ACK] Seq=1922 Ack=58393 Win=425 Len=0 TSval=2237456182 TSecr=619340152"
"453","1.440583312","172.217.11.54","192.168.1.118","TLSv1.2","1484","Application Data"
"454","1.443953475","172.217.11.54","192.168.1.118","TLSv1.2","1484","Application Data"
"455","1.444022925","172.217.11.54","192.168.1.118","TLSv1.2","2902","Application Data, Application Data"
"456","1.444054550","172.217.11.54","192.168.1.118","TLSv1.2","2902","Application Data, Application Data"
"457","1.444073375","172.217.11.54","192.168.1.118","TLSv1.2","1484","Application Data"
"458","1.445300425","172.217.11.54","192.168.1.118","TLSv1.2","2373","Application Data, Application Data"
"459","1.445343050","172.217.11.54","192.168.1.118","TLSv1.2","1484","Application Data"
"460","1.445368025","172.217.11.54","192.168.1.118","TLSv1.2","2902","Application Data, Application Data"
"461","1.445810287","192.168.1.118","172.217.11.54","TCP","66","37772 → 443 [ACK] Seq=2723 Ack=52956 Win=468 Len=0 TSval=2237456203 TSecr=4105593094"
"462","1.446120487","192.168.1.118","172.217.11.54","TCP","66","37772 → 443 [ACK] Seq=2723 Ack=55263 Win=450 Len=0 TSval=2237456204 TSecr=4105593099"
"463","1.446292700","192.168.1.118","172.217.11.54","TCP","66","37768 → 443 [ACK] Seq=2723 Ack=66743 Win=424 Len=0 TSval=2237456204 TSecr=2766449889"
"464","1.447317125","172.217.11.54","192.168.1.118","TLSv1.2","2902","Application Data, Application Data"
"465","1.447363525","172.217.11.54","192.168.1.118","TLSv1.2","1396","Application Data"
"466","1.448539937","192.168.1.118","172.217.11.54","TCP","66","37768 → 443 [ACK] Seq=2723 Ack=70909 Win=392 Len=0 TSval=2237456206 TSecr=2766449900"
"467","2.299091750","192.168.1.118","172.217.7.14","TLSv1.2","302","Application Data"
"468","2.324044987","172.217.7.14","192.168.1.118","TLSv1.2","1484","Application Data"
"469","2.324125187","192.168.1.118","172.217.7.14","TCP","66","40378 → 443 [ACK] Seq=792 Ack=4733 Win=590 Len=0 TSval=1952356269 TSecr=957997758"
"470","2.334989737","172.217.7.14","192.168.1.118","TLSv1.2","2902","Application Data, Application Data"
"471","2.335063575","192.168.1.118","172.217.7.14","TCP","66","40378 → 443 [ACK] Seq=792 Ack=7569 Win=634 Len=0 TSval=1952356280 TSecr=957997758"
"472","2.335112587","172.217.7.14","192.168.1.118","TLSv1.2","1484","Application Data"
"473","2.335128225","192.168.1.118","172.217.7.14","TCP","66","40378 → 443 [ACK] Seq=792 Ack=8987 Win=656 Len=0 TSval=1952356280 TSecr=957997760"
"474","2.343984037","172.217.7.14","192.168.1.118","TLSv1.2","1484","Application Data"
"475","2.344054900","192.168.1.118","172.217.7.14","TCP","66","40378 → 443 [ACK] Seq=792 Ack=10405 Win=678 Len=0 TSval=1952356289 TSecr=957997760"
"476","2.344100262","172.217.7.14","192.168.1.118","TLSv1.2","2902","Application Data, Application Data"
"477","2.344117125","192.168.1.118","172.217.7.14","TCP","66","40378 → 443 [ACK] Seq=792 Ack=13241 Win=723 Len=0 TSval=1952356289 TSecr=957997761"
"478","2.344127225","172.217.7.14","192.168.1.118","TLSv1.2","1484","Application Data"
"479","2.344141662","192.168.1.118","172.217.7.14","TCP","66","40378 → 443 [ACK] Seq=792 Ack=14659 Win=745 Len=0 TSval=1952356289 TSecr=957997763"
"480","2.344547025","172.217.7.14","192.168.1.118","TLSv1.2","1484","Application Data"
"481","2.344598500","192.168.1.118","172.217.7.14","TCP","66","40378 → 443 [ACK] Seq=792 Ack=16077 Win=767 Len=0 TSval=1952356289 TSecr=957997763"
"482","2.344641775","172.217.7.14","192.168.1.118","TLSv1.2","2902","Application Data, Application Data"
"483","2.344661150","192.168.1.118","172.217.7.14","TCP","66","40378 → 443 [ACK] Seq=792 Ack=18913 Win=811 Len=0 TSval=1952356289 TSecr=957997765"
"484","2.344703987","172.217.7.14","192.168.1.118","TLSv1.2","1771","Application Data, Application Data"
"485","2.344721612","192.168.1.118","172.217.7.14","TCP","66","40378 → 443 [ACK] Seq=792 Ack=20618 Win=838 Len=0 TSval=1952356289 TSecr=957997767"
"486","2.392156362","172.217.7.14","192.168.1.118","TCP","66","[TCP Dup ACK 468#1] 443 → 40378 [ACK] Seq=20618 Ack=792 Win=257 Len=0 TSval=957997812 TSecr=1952356289"
"487","3.209993575","192.168.1.104","255.255.255.255","UDP","217","49154 → 6666 Len=175"
"488","4.452760712","192.168.1.103","224.0.0.251","MDNS","139","Standard query 0x0000 PTR _companion-link._tcp.local, "QU" question PTR _sleep-proxy._udp.local, "QU" question OPT"
"489","4.845660412","192.168.1.103","224.0.0.2","IGMPv2","46","Leave Group 224.0.0.251"
"490","4.848868400","192.168.1.103","224.0.0.251","IGMPv2","46","Membership Report group 224.0.0.251"
"491","5.460522750","192.168.1.103","224.0.0.251","MDNS","158","Standard query 0x0000 PTR _companion-link._tcp.local, "QM" question PTR _sleep-proxy._udp.local, "QM" question PTR cjqg._companion-link._tcp.local OPT"
"492","5.464500912","fe80::144e:ae0c:17ca:d785","ff02::fb","MDNS","178","Standard query 0x0000 PTR _companion-link._tcp.local, "QM" question PTR _sleep-proxy._udp.local, "QM" question PTR cjqg._companion-link._tcp.local OPT"
"493","5.869779262","Cisco-Li_5b:1c:ce","IntelCor_b7:52:73","ARP","42","Who has 192.168.1.118? Tell 192.168.1.1"
"494","5.869813125","IntelCor_b7:52:73","Cisco-Li_5b:1c:ce","ARP","42","192.168.1.118 is at dc:fb:48:b7:52:73"
"495","6.046633162","192.168.1.118","192.168.1.102","TCP","176","33368 → 8009 [PSH, ACK] Seq=111 Ack=111 Win=501 Len=110 TSval=2810902092 TSecr=7284047 [TCP segment of a reassembled PDU]"
"496","6.073270287","192.168.1.102","192.168.1.118","TCP","176","8009 → 33368 [PSH, ACK] Seq=111 Ack=221 Win=294 Len=110 TSval=7284547 TSecr=2810902092 [TCP segment of a reassembled PDU]"
"497","6.073354900","192.168.1.118","192.168.1.102","TCP","66","33368 → 8009 [ACK] Seq=221 Ack=221 Win=501 Len=0 TSval=2810902119 TSecr=7284547"
"498","6.285126150","192.168.1.104","255.255.255.255","UDP","217","49154 → 6666 Len=175"
"499","7.409872625","192.168.1.1","224.0.0.1","IGMPv2","42","Membership Query, general"
"500","8.435012487","192.168.1.103","224.0.0.251","MDNS","158","Standard query 0x0000 PTR _companion-link._tcp.local, "QM" question PTR _sleep-proxy._udp.local, "QM" question PTR cjqg._companion-link._tcp.local OPT"
"501","8.437411600","fe80::144e:ae0c:17ca:d785","ff02::fb","MDNS","178","Standard query 0x0000 PTR _companion-link._tcp.local, "QM" question PTR _sleep-proxy._udp.local, "QM" question PTR cjqg._companion-link._tcp.local OPT"
"502","9.154487312","fe80::1cc7:6d9a:a312:7e8f","ff02::fb","MDNS","640","Standard query 0x0000 PTR _googlecast._tcp.local, "QU" question PTR _homekit._tcp.local, "QU" question PTR _uscan._tcp.local, "QU" question PTR _ptp._tcp.local, "QU" question PTR _ippusb._tcp.local, "QU" question PTR _scanner._tcp.local, "QU" question PTR _ipp._tcp.local, "QU" question PTR _pdl-datastream._tcp.local, "QU" question PTR _uscans._tcp.local, "QU" question PTR _ipps._tcp.local, "QU" question PTR _printer._tcp.local, "QU" question PTR _airplay._tcp.local, "QU" question PTR _raop._tcp.local, "QU" question PTR _airport._tcp.local, "QU" question PTR _rdlink._tcp.local, "QU" question PTR _companion-link._tcp.local, "QU" question PTR _apple-mobdev._tcp.local, "QU" question PTR 8ed307c3._sub._apple-mobdev2._tcp.local, "QU" question PTR _apple-pairable._tcp.local, "QU" question PTR _afpovertcp._tcp.local, "QU" question PTR _smb._tcp.local, "QU" question PTR _rfb._tcp.local, "QU" question PTR _adisk._tcp.local, "QU" question TXT Google-Home-Mini-2c3f16b2da5c4b6fd6cfbfba61c12490._googlecast._tcp.local, "QU" question ANY cjqg._smb._tcp.local, "QU" question ANY cjqg._companion-link._tcp.local, "QU" question PTR Google-Home-Mini-2c3f16b2da5c4b6fd6cfbfba61c12490._googlecast._tcp.local PTR cjqg._companion-link._tcp.local PTR cjqg._smb._tcp.local SRV 0 0 445 cjqg.local SRV 0 0 51016 cjqg.local OPT"
"503","9.262788425","192.168.1.104","255.255.255.255","UDP","217","49154 → 6666 Len=175"
"504","9.363540762","fe80::1cc7:6d9a:a312:7e8f","ff02::fb","MDNS","195","Standard query 0x0000 ANY cjqg._smb._tcp.local, "QM" question ANY cjqg._companion-link._tcp.local, "QM" question SRV 0 0 445 cjqg.local SRV 0 0 51016 cjqg.local OPT"
"505","9.366038087","192.168.1.100","224.0.0.251","MDNS","175","Standard query 0x0000 ANY cjqg._smb._tcp.local, "QM" question ANY cjqg._companion-link._tcp.local, "QM" question SRV 0 0 445 cjqg.local SRV 0 0 51016 cjqg.local OPT"
"506","9.659054575","fe80::1cc7:6d9a:a312:7e8f","ff02::fb","MDNS","195","Standard query 0x0000 ANY cjqg._smb._tcp.local, "QM" question ANY cjqg._companion-link._tcp.local, "QM" question SRV 0 0 445 cjqg.local SRV 0 0 51016 cjqg.local OPT"
"507","9.663139100","192.168.1.100","224.0.0.251","MDNS","175","Standard query 0x0000 ANY cjqg._smb._tcp.local, "QM" question ANY cjqg._companion-link._tcp.local, "QM" question SRV 0 0 445 cjqg.local SRV 0 0 51016 cjqg.local OPT"
"508","9.866726025","fe80::1cc7:6d9a:a312:7e8f","ff02::fb","MDNS","544","Standard query response 0x0000 TXT, cache flush PTR cjqg._smb._tcp.local TXT SRV, cache flush 0 0 445 cjqg.local TXT, cache flush PTR _companion-link._tcp.local PTR cjqg._companion-link._tcp.local SRV, cache flush 0 0 51016 cjqg.local AAAA, cache flush fe80::1cc7:6d9a:a312:7e8f A, cache flush 192.168.1.100 NSEC, cache flush cjqg._smb._tcp.local NSEC, cache flush cjqg._companion-link._tcp.local NSEC, cache flush cjqg.local OPT"
