frame.number,_ws.col.Time,_ws.col.Source,_ws.col.Destination,_ws.col.Protocol,frame.len,_ws.col.Info
"1","0.000000000","192.168.1.118","104.16.100.29","TLSv1","571","Client Hello"
"2","0.020129325","104.16.100.29","192.168.1.118","TCP","54","443 → 38244 [ACK] Seq=1 Ack=518 Win=66 Len=0"
"3","0.025764525","192.168.1.118","162.125.248.1","TLSv1","583","Client Hello"
"4","0.027615700","104.16.100.29","192.168.1.118","TLSv1.2","1514","Server Hello"
"5","0.027666775","192.168.1.118","104.16.100.29","TCP","54","38244 → 443 [ACK] Seq=518 Ack=1461 Win=493 Len=0"
"6","0.036066400","104.16.100.29","192.168.1.118","TCP","1514","443 → 38244 [PSH, ACK] Seq=1461 Ack=518 Win=66 Len=1460 [TCP segment of a reassembled PDU]"
"7","0.036131587","192.168.1.118","104.16.100.29","TCP","54","38244 → 443 [ACK] Seq=518 Ack=2921 Win=482 Len=0"
"8","0.036183850","104.16.100.29","192.168.1.118","TLSv1.2","600","Certificate, Server Key Exchange, Server Hello Done"
"9","0.036204525","192.168.1.118","104.16.100.29","TCP","54","38244 → 443 [ACK] Seq=518 Ack=3467 Win=478 Len=0"
"10","0.050467737","192.168.1.118","104.16.100.29","TLSv1","571","Client Hello"
"11","0.052259225","162.125.248.1","192.168.1.118","TCP","66","443 → 41336 [ACK] Seq=1 Ack=518 Win=58 Len=0 TSval=2911443264 TSecr=2155715739"
"12","0.055016300","162.125.248.1","192.168.1.118","TLSv1.2","1514","Server Hello"
"13","0.055086262","192.168.1.118","162.125.248.1","TCP","66","41336 → 443 [ACK] Seq=518 Ack=1449 Win=493 Len=0 TSval=2155715768 TSecr=2911443267"
"14","0.056331362","162.125.248.1","192.168.1.118","TLSv1.2","2279","Certificate, Server Key Exchange, Server Hello Done"
"15","0.056391037","192.168.1.118","162.125.248.1","TCP","66","41336 → 443 [ACK] Seq=518 Ack=3662 Win=476 Len=0 TSval=2155715769 TSecr=2911443267"
"16","0.081475512","104.16.100.29","192.168.1.118","TCP","54","443 → 38246 [ACK] Seq=1 Ack=518 Win=66 Len=0"
"17","0.082337662","104.16.100.29","192.168.1.118","TLSv1.2","2974","Server Hello"
"18","0.082388875","192.168.1.118","104.16.100.29","TCP","54","38246 → 443 [ACK] Seq=518 Ack=2921 Win=480 Len=0"
"19","0.082430062","104.16.100.29","192.168.1.118","TLSv1.2","600","Certificate, Server Key Exchange, Server Hello Done"
"20","0.082445587","192.168.1.118","104.16.100.29","TCP","54","38246 → 443 [ACK] Seq=518 Ack=3467 Win=476 Len=0"
"21","0.107899975","192.168.1.118","104.16.100.29","TLSv1","571","Client Hello"
"22","0.136878650","104.16.100.29","192.168.1.118","TCP","54","443 → 38248 [ACK] Seq=1 Ack=518 Win=66 Len=0"
"23","0.137567287","192.168.1.118","104.16.100.29","TLSv1","571","Client Hello"
"24","0.139009900","104.16.100.29","192.168.1.118","TLSv1.2","1514","Server Hello"
"25","0.139055175","192.168.1.118","104.16.100.29","TCP","54","38248 → 443 [ACK] Seq=518 Ack=1461 Win=493 Len=0"
"26","0.139869575","104.16.100.29","192.168.1.118","TCP","1514","443 → 38248 [PSH, ACK] Seq=1461 Ack=518 Win=66 Len=1460 [TCP segment of a reassembled PDU]"
"27","0.139905087","192.168.1.118","104.16.100.29","TCP","54","38248 → 443 [ACK] Seq=518 Ack=2921 Win=482 Len=0"
"28","0.139933787","104.16.100.29","192.168.1.118","TLSv1.2","600","Certificate, Server Key Exchange, Server Hello Done"
"29","0.139951537","192.168.1.118","104.16.100.29","TCP","54","38248 → 443 [ACK] Seq=518 Ack=3467 Win=478 Len=0"
"30","0.161195562","104.16.100.29","192.168.1.118","TCP","54","443 → 38250 [ACK] Seq=1 Ack=518 Win=66 Len=0"
"31","0.169861325","104.16.100.29","192.168.1.118","TLSv1.2","1514","Server Hello"
"32","0.169931550","192.168.1.118","104.16.100.29","TCP","54","38250 → 443 [ACK] Seq=518 Ack=1461 Win=493 Len=0"
"33","0.170444162","192.168.1.118","104.16.100.29","TLSv1","571","Client Hello"
"34","0.170679412","104.16.100.29","192.168.1.118","TCP","1514","443 → 38250 [PSH, ACK] Seq=1461 Ack=518 Win=66 Len=1460 [TCP segment of a reassembled PDU]"
"35","0.170707650","192.168.1.118","104.16.100.29","TCP","54","38250 → 443 [ACK] Seq=518 Ack=2921 Win=482 Len=0"
"36","0.170725762","104.16.100.29","192.168.1.118","TLSv1.2","600","Certificate, Server Key Exchange, Server Hello Done"
"37","0.170743987","192.168.1.118","104.16.100.29","TCP","54","38250 → 443 [ACK] Seq=518 Ack=3467 Win=478 Len=0"
"38","0.176642175","192.168.1.118","104.16.100.29","TLSv1.2","180","Client Key Exchange, Change Cipher Spec, Encrypted Handshake Message"
"39","0.182851012","192.168.1.118","162.125.248.1","TLSv1.2","192","Client Key Exchange, Change Cipher Spec, Encrypted Handshake Message"
"40","0.186914700","192.168.1.118","104.16.100.29","TLSv1.2","180","Client Key Exchange, Change Cipher Spec, Encrypted Handshake Message"
"41","0.188978775","192.168.1.118","104.16.100.29","TLSv1.2","180","Client Key Exchange, Change Cipher Spec, Encrypted Handshake Message"
"42","0.193111925","192.168.1.118","104.16.100.29","TLSv1.2","180","Client Key Exchange, Change Cipher Spec, Encrypted Handshake Message"
"43","0.199520525","104.16.100.29","192.168.1.118","TCP","54","443 → 38252 [ACK] Seq=1 Ack=518 Win=66 Len=0"
"44","0.200938937","162.125.248.1","192.168.1.118","TLSv1.2","117","Change Cipher Spec, Encrypted Handshake Message"
"45","0.200998825","192.168.1.118","162.125.248.1","TCP","66","41336 → 443 [ACK] Seq=644 Ack=3713 Win=501 Len=0 TSval=2155715914 TSecr=2911443412"
"46","0.201960700","192.168.1.118","162.125.248.1","TLSv1.2","244","Application Data"
"47","0.204577337","104.16.100.29","192.168.1.118","TLSv1.2","1514","Server Hello"
"48","0.204643262","192.168.1.118","104.16.100.29","TCP","54","38252 → 443 [ACK] Seq=518 Ack=1461 Win=493 Len=0"
"49","0.219031162","104.16.100.29","192.168.1.118","TLSv1.2","2060","Certificate, Server Key Exchange, Server Hello Done"
"50","0.219100875","192.168.1.118","104.16.100.29","TCP","54","38252 → 443 [ACK] Seq=518 Ack=3467 Win=478 Len=0"
"51","0.219139462","104.16.100.29","192.168.1.118","TCP","54","443 → 38244 [ACK] Seq=3467 Ack=644 Win=66 Len=0"
"52","0.219182225","104.16.100.29","192.168.1.118","TLSv1.2","105","Change Cipher Spec, Encrypted Handshake Message"
"53","0.219201575","192.168.1.118","104.16.100.29","TCP","54","38244 → 443 [ACK] Seq=644 Ack=3518 Win=501 Len=0"
"54","0.219746450","104.16.100.29","192.168.1.118","TCP","54","443 → 38248 [ACK] Seq=3467 Ack=644 Win=66 Len=0"
"55","0.219774362","104.16.100.29","192.168.1.118","TCP","54","443 → 38250 [ACK] Seq=3467 Ack=644 Win=66 Len=0"
"56","0.219789462","104.16.100.29","192.168.1.118","TLSv1.2","105","Change Cipher Spec, Encrypted Handshake Message"
"57","0.219807062","192.168.1.118","104.16.100.29","TCP","54","38248 → 443 [ACK] Seq=644 Ack=3518 Win=501 Len=0"
"58","0.219827537","104.16.100.29","192.168.1.118","TCP","54","443 → 38246 [ACK] Seq=3467 Ack=644 Win=66 Len=0"
"59","0.219842312","104.16.100.29","192.168.1.118","TLSv1.2","105","Change Cipher Spec, Encrypted Handshake Message"
"60","0.219856737","104.16.100.29","192.168.1.118","TLSv1.2","105","Change Cipher Spec, Encrypted Handshake Message"
"61","0.219869712","192.168.1.118","104.16.100.29","TCP","54","38246 → 443 [ACK] Seq=644 Ack=3518 Win=501 Len=0"
"62","0.228209787","192.168.1.118","104.16.100.29","TLSv1.2","234","Application Data"
"63","0.228592287","192.168.1.118","104.16.100.29","TLSv1.2","278","Application Data"
"64","0.228796800","192.168.1.118","104.16.100.29","TLSv1.2","294","Application Data"
"65","0.228998162","192.168.1.118","104.16.100.29","TLSv1.2","277","Application Data"
"66","0.231795675","192.168.1.118","104.16.100.29","TLSv1.2","180","Client Key Exchange, Change Cipher Spec, Encrypted Handshake Message"
"67","0.238734462","162.125.248.1","192.168.1.118","TLSv1.2","412","Application Data"
"68","0.279205212","192.168.1.118","162.125.248.1","TCP","66","41336 → 443 [ACK] Seq=822 Ack=4059 Win=501 Len=0 TSval=2155715992 TSecr=2911443447"
"69","0.290860737","104.16.100.29","192.168.1.118","TCP","54","443 → 38248 [ACK] Seq=3518 Ack=884 Win=67 Len=0"
"70","0.292359462","104.16.100.29","192.168.1.118","TCP","54","443 → 38250 [ACK] Seq=3518 Ack=867 Win=67 Len=0"
"71","0.292411262","104.16.100.29","192.168.1.118","TCP","54","443 → 38252 [ACK] Seq=3467 Ack=644 Win=66 Len=0"
"72","0.292431187","104.16.100.29","192.168.1.118","TCP","54","443 → 38244 [ACK] Seq=3518 Ack=824 Win=67 Len=0"
"73","0.292446387","104.16.100.29","192.168.1.118","TCP","54","443 → 38246 [ACK] Seq=3518 Ack=868 Win=67 Len=0"
"74","0.292461700","104.16.100.29","192.168.1.118","TLSv1.2","105","Change Cipher Spec, Encrypted Handshake Message"
"75","0.292480112","104.16.100.29","192.168.1.118","TLSv1.2","1426","Application Data"
"76","0.292494050","104.16.100.29","192.168.1.118","TLSv1.2","88","Application Data"
"77","0.292510350","104.16.100.29","192.168.1.118","TLSv1.2","1452","Application Data"
"78","0.292525362","104.16.100.29","192.168.1.118","TLSv1.2","1452","Application Data"
"79","0.292541112","104.16.100.29","192.168.1.118","TLSv1.2","1452","Application Data"
"80","0.292556937","104.16.100.29","192.168.1.118","TLSv1.2","1452","Application Data"
"81","0.292571700","104.16.100.29","192.168.1.118","TLSv1.2","1452","Application Data"
"82","0.292586137","104.16.100.29","192.168.1.118","TLSv1.2","1452","Application Data"
"83","0.292601075","104.16.100.29","192.168.1.118","TLSv1.2","1452","Application Data"
"84","0.292623162","104.16.100.29","192.168.1.118","TLSv1.2","2850","Application Data, Application Data"
"85","0.293665212","192.168.1.118","104.16.100.29","TCP","54","38250 → 443 [ACK] Seq=867 Ack=16100 Win=403 Len=0"
"86","0.294037737","104.16.100.29","192.168.1.118","TLSv1.2","524","Application Data, Application Data"
"87","0.294073012","104.16.100.29","192.168.1.118","TLSv1.2","1262","Application Data"
"88","0.294087850","104.16.100.29","192.168.1.118","TLSv1.2","88","Application Data"
"89","0.294134612","104.16.100.29","192.168.1.118","TLSv1.2","1452","Application Data"
"90","0.294171425","104.16.100.29","192.168.1.118","TLSv1.2","1452","Application Data"
"91","0.294199925","104.16.100.29","192.168.1.118","TLSv1.2","1452","Application Data"
"92","0.294213550","104.16.100.29","192.168.1.118","TLSv1.2","259","Application Data"
"93","0.294225937","104.16.100.29","192.168.1.118","TLSv1.2","88","Application Data"
"94","0.296426962","192.168.1.118","104.16.100.29","TLSv1.2","277","Application Data"
"95","0.296674987","192.168.1.118","104.16.100.29","TCP","54","38244 → 443 [ACK] Seq=824 Ack=4924 Win=501 Len=0"
"96","0.296879112","192.168.1.118","104.16.100.29","TCP","54","38248 → 443 [ACK] Seq=884 Ack=7951 Win=467 Len=0"
"97","0.298115962","192.168.1.118","104.16.100.29","TCP","54","38246 → 443 [ACK] Seq=868 Ack=4760 Win=501 Len=0"
"98","0.302361187","192.168.1.118","104.16.100.29","TLSv1.2","281","Application Data"
"99","0.334218025","192.168.1.118","104.16.100.29","TCP","54","38250 → 443 [ACK] Seq=867 Ack=16570 Win=400 Len=0"
"100","0.342120200","104.16.100.29","192.168.1.118","TLSv1.2","88","[TCP Spurious Retransmission] , Application Data"
"101","0.342205362","192.168.1.118","104.16.100.29","TCP","66","[TCP Dup ACK 96#1] 38248 → 443 [ACK] Seq=884 Ack=7951 Win=467 Len=0 SLE=7917 SRE=7951"
"102","0.342955325","104.16.100.29","192.168.1.118","TLSv1.2","524","[TCP Spurious Retransmission] , Application Data, Application Data"
"103","0.343002187","192.168.1.118","104.16.100.29","TCP","66","[TCP Dup ACK 99#1] 38250 → 443 [ACK] Seq=867 Ack=16570 Win=400 Len=0 SLE=16100 SRE=16570"
"104","0.350724050","192.168.1.118","104.16.100.29","TLSv1.2","276","Application Data"
"105","0.353239187","104.16.100.29","192.168.1.118","TLSv1.2","88","[TCP Spurious Retransmission] , Application Data"
"106","0.353316325","192.168.1.118","104.16.100.29","TCP","66","[TCP Dup ACK 95#1] 38244 → 443 [ACK] Seq=1051 Ack=4924 Win=501 Len=0 SLE=4890 SRE=4924"
"107","0.358210700","104.16.100.29","192.168.1.118","TCP","54","443 → 38252 [ACK] Seq=3518 Ack=867 Win=67 Len=0"
"108","0.368439962","192.168.1.118","104.16.100.29","TLSv1.2","280","Application Data"
"109","0.373172312","104.16.100.29","192.168.1.118","TLSv1.2","1393","Application Data"
"110","0.373244450","192.168.1.118","104.16.100.29","TCP","54","38244 → 443 [ACK] Seq=1051 Ack=6263 Win=493 Len=0"
"111","0.377396100","104.16.100.29","192.168.1.118","TLSv1.2","88","Application Data"
"112","0.377460337","192.168.1.118","104.16.100.29","TCP","54","38244 → 443 [ACK] Seq=1051 Ack=6297 Win=493 Len=0"
"113","0.377501637","104.16.100.29","192.168.1.118","TLSv1.2","1452","Application Data"
"114","0.377523300","104.16.100.29","192.168.1.118","TLSv1.2","1452","Application Data"
"115","0.377539537","104.16.100.29","192.168.1.118","TLSv1.2","1452","Application Data"
"116","0.377556525","104.16.100.29","192.168.1.118","TLSv1.2","1514","Application Data"
"117","0.377612412","104.16.100.29","192.168.1.118","TLSv1.2","1390","Application Data"
"118","0.377637150","104.16.100.29","192.168.1.118","TLSv1.2","2850","Application Data, Application Data"
"119","0.377652712","104.16.100.29","192.168.1.118","TLSv1.2","622","Application Data"
"120","0.377665350","104.16.100.29","192.168.1.118","TLSv1.2","88","Application Data"
"121","0.396728025","192.168.1.118","104.16.100.29","TCP","54","38252 → 443 [ACK] Seq=867 Ack=13906 Win=420 Len=0"
"122","0.398420812","192.168.1.118","104.16.100.29","TLSv1.2","305","Application Data"
"123","0.398550587","192.168.1.118","104.16.100.29","TLSv1.2","282","Application Data"
"124","0.399473362","104.16.100.29","192.168.1.118","TLSv1.2","1452","Application Data"
"125","0.400845375","104.16.100.29","192.168.1.118","TLSv1.2","672","Application Data"
"126","0.400872812","104.16.100.29","192.168.1.118","TLSv1.2","88","Application Data"
"127","0.408545850","192.168.1.118","104.16.100.29","TCP","54","38246 → 443 [ACK] Seq=1090 Ack=6810 Win=485 Len=0"
"128","0.419331162","192.168.1.118","104.16.100.29","TLSv1.2","282","Application Data"
"129","0.419974637","192.168.1.118","104.16.100.29","TLSv1.2","293","Application Data"
"130","0.427903462","104.16.100.29","192.168.1.118","TLSv1.2","1452","Application Data"
"131","0.427978712","192.168.1.118","104.16.100.29","TCP","54","38248 → 443 [ACK] Seq=1110 Ack=9349 Win=493 Len=0"
"132","0.429463525","104.16.100.29","192.168.1.118","TLSv1.2","1452","Application Data"
"133","0.429525100","192.168.1.118","104.16.100.29","TCP","54","38248 → 443 [ACK] Seq=1110 Ack=10747 Win=493 Len=0"
"134","0.429567475","104.16.100.29","192.168.1.118","TLSv1.2","1773","Application Data, Application Data"
"135","0.429583300","192.168.1.118","104.16.100.29","TCP","54","38248 → 443 [ACK] Seq=1110 Ack=12466 Win=480 Len=0"
"136","0.429598887","104.16.100.29","192.168.1.118","TLSv1.2","88","Application Data"
"137","0.429612137","192.168.1.118","104.16.100.29","TCP","54","38248 → 443 [ACK] Seq=1110 Ack=12500 Win=480 Len=0"
"138","0.429628550","104.16.100.29","192.168.1.118","TLSv1.2","1452","Application Data"
"139","0.429656025","104.16.100.29","192.168.1.118","TLSv1.2","1452","Application Data"
"140","0.429685625","104.16.100.29","192.168.1.118","TLSv1.2","2832","Application Data, Application Data"
"141","0.430288287","104.16.100.29","192.168.1.118","TLSv1.2","88","Application Data"
"142","0.430385537","192.168.1.118","104.16.100.29","TCP","54","38244 → 443 [ACK] Seq=1302 Ack=11905 Win=458 Len=0"
"143","0.442782500","104.16.100.29","192.168.1.118","TLSv1.2","1452","Application Data"
"144","0.442859875","192.168.1.118","104.16.100.29","TCP","54","38250 → 443 [ACK] Seq=1095 Ack=17968 Win=493 Len=0"
"145","0.444484825","104.16.100.29","192.168.1.118","TLSv1.2","1452","Application Data"
"146","0.444535600","192.168.1.118","104.16.100.29","TCP","54","38250 → 443 [ACK] Seq=1095 Ack=19366 Win=483 Len=0"
"147","0.444577875","104.16.100.29","192.168.1.118","TLSv1.2","2850","Application Data, Application Data"
"148","0.444593337","192.168.1.118","104.16.100.29","TCP","54","38250 → 443 [ACK] Seq=1095 Ack=22162 Win=462 Len=0"
"149","0.444609775","104.16.100.29","192.168.1.118","TLSv1.2","1514","Application Data"
"150","0.444623675","192.168.1.118","104.16.100.29","TCP","54","38250 → 443 [ACK] Seq=1095 Ack=23622 Win=451 Len=0"
"151","0.444677800","104.16.100.29","192.168.1.118","TLSv1.2","1514","Application Data [TCP segment of a reassembled PDU]"
"152","0.444693062","192.168.1.118","104.16.100.29","TCP","54","38250 → 443 [ACK] Seq=1095 Ack=25082 Win=440 Len=0"
"153","0.444713937","104.16.100.29","192.168.1.118","TLSv1.2","2974","Application Data, Application Data"
"154","0.444728675","192.168.1.118","104.16.100.29","TCP","54","38250 → 443 [ACK] Seq=1095 Ack=28002 Win=418 Len=0"
"155","0.444750912","104.16.100.29","192.168.1.118","TLSv1.2","2457","Application Data, Application Data, Application Data"
"156","0.444766100","192.168.1.118","104.16.100.29","TCP","54","38250 → 443 [ACK] Seq=1095 Ack=30405 Win=400 Len=0"
"157","0.460564437","192.168.1.118","104.16.100.29","TLSv1.2","289","Application Data"
"158","0.461885475","192.168.1.118","104.16.100.29","TLSv1.2","293","Application Data"
"159","0.481900775","104.16.100.29","192.168.1.118","TLSv1.2","1136","Application Data"
"160","0.483303375","104.16.100.29","192.168.1.118","TLSv1.2","88","Application Data"
"161","0.483342000","104.16.100.29","192.168.1.118","TLSv1.2","1320","Application Data"
"162","0.483365900","104.16.100.29","192.168.1.118","TLSv1.2","88","Application Data"
"163","0.492764800","192.168.1.118","104.16.100.29","TCP","54","38246 → 443 [ACK] Seq=1318 Ack=7926 Win=501 Len=0"
"164","0.492850887","192.168.1.118","104.16.100.29","TCP","54","38252 → 443 [ACK] Seq=1106 Ack=15206 Win=501 Len=0"
"165","0.493608850","192.168.1.118","104.16.100.29","TLSv1.2","284","Application Data"
"166","0.493729712","192.168.1.118","104.16.100.29","TLSv1.2","293","Application Data"
"167","0.499870500","192.168.1.118","104.16.100.29","TLSv1.2","299","Application Data"
"168","0.510879012","104.16.100.29","192.168.1.118","TLSv1.2","1420","Application Data"
"169","0.511302325","104.16.100.29","192.168.1.118","TLSv1.2","88","Application Data"
"170","0.529231900","104.16.100.29","192.168.1.118","TLSv1.2","1253","Application Data"
"171","0.531396925","192.168.1.118","104.16.100.29","TCP","54","38244 → 443 [ACK] Seq=1537 Ack=13305 Win=501 Len=0"
"172","0.531837075","192.168.1.118","104.16.100.29","TLSv1.2","296","Application Data"
"173","0.532936212","104.16.100.29","192.168.1.118","TLSv1.2","88","Application Data"
"174","0.533362400","192.168.1.118","104.16.100.29","TCP","54","38248 → 443 [ACK] Seq=1349 Ack=13733 Win=501 Len=0"
"175","0.535041775","104.16.100.29","192.168.1.118","TLSv1.2","1452","Application Data"
"176","0.536457625","192.168.1.118","104.16.100.29","TLSv1.2","294","Application Data"
"177","0.544524275","104.16.100.29","192.168.1.118","TLSv1.2","540","Application Data, Application Data"
"178","0.544576287","104.16.100.29","192.168.1.118","TLSv1.2","1345","Application Data"
"179","0.544604287","104.16.100.29","192.168.1.118","TLSv1.2","88","Application Data"
"180","0.544617912","104.16.100.29","192.168.1.118","TLSv1.2","1211","Application Data"
"181","0.544653912","192.168.1.118","104.16.100.29","TCP","54","38250 → 443 [ACK] Seq=1334 Ack=31562 Win=493 Len=0"
"182","0.544692450","104.16.100.29","192.168.1.118","TLSv1.2","88","Application Data"
"183","0.544706375","192.168.1.118","104.16.100.29","TCP","54","38250 → 443 [ACK] Seq=1334 Ack=31596 Win=493 Len=0"
"184","0.551520175","192.168.1.118","104.16.100.29","TCP","54","38246 → 443 [ACK] Seq=1548 Ack=9810 Win=493 Len=0"
"185","0.552139775","192.168.1.118","104.16.100.29","TCP","54","38252 → 443 [ACK] Seq=1351 Ack=16531 Win=501 Len=0"
"186","0.554034450","192.168.1.118","104.16.100.29","TLSv1.2","296","Application Data"
"187","0.554218075","192.168.1.118","104.16.100.29","TLSv1.2","282","Application Data"
"188","0.554310350","192.168.1.118","104.16.100.29","TLSv1.2","315","Application Data"
"189","0.561724175","104.16.100.29","192.168.1.118","TLSv1.2","1452","Application Data"
"190","0.562414025","104.16.100.29","192.168.1.118","TLSv1.2","606","Application Data"
"191","0.562787862","192.168.1.118","104.16.100.29","TCP","54","38244 → 443 [ACK] Seq=1779 Ack=15255 Win=493 Len=0"
"192","0.566592950","104.16.100.29","192.168.1.118","TLSv1.2","88","Application Data"
"193","0.567314000","104.16.100.29","192.168.1.118","TLSv1.2","1342","Application Data"
"194","0.567353600","104.16.100.29","192.168.1.118","TLSv1.2","88","Application Data"
"195","0.571387512","192.168.1.118","104.16.100.29","TCP","54","38248 → 443 [ACK] Seq=1589 Ack=15055 Win=501 Len=0"
"196","0.574910487","192.168.1.118","104.16.100.29","TLSv1.2","313","Application Data"
"197","0.575043112","192.168.1.118","104.16.100.29","TLSv1.2","312","Application Data"
"198","0.603425725","104.16.100.29","192.168.1.118","TLSv1.2","1452","Application Data"
"199","0.604201275","104.16.100.29","192.168.1.118","TLSv1.2","596","Application Data"
"200","0.604235250","104.16.100.29","192.168.1.118","TLSv1.2","88","Application Data"
"201","0.605083137","192.168.1.118","104.16.100.29","TCP","54","38246 → 443 [ACK] Seq=1790 Ack=11784 Win=486 Len=0"
"202","0.605964875","104.16.100.29","192.168.1.118","TLSv1.2","1452","Application Data"
"203","0.606023000","104.16.100.29","192.168.1.118","TLSv1.2","1452","Application Data"
"204","0.606041237","104.16.100.29","192.168.1.118","TLSv1.2","1452","Application Data"
"205","0.608352612","104.16.100.29","192.168.1.118","TLSv1.2","2850","Application Data, Application Data"
"206","0.608410600","104.16.100.29","192.168.1.118","TLSv1.2","2850","Application Data, Application Data"
"207","0.608499837","104.16.100.29","192.168.1.118","TLSv1.2","5646","Application Data, Application Data, Application Data, Application Data"
"208","0.608522500","104.16.100.29","192.168.1.118","TLSv1.2","2974","Application Data, Application Data"
"209","0.608552537","104.16.100.29","192.168.1.118","TLSv1.2","5894","Application Data, Application Data, Application Data, Application Data"
"210","0.610258862","104.16.100.29","192.168.1.118","TLSv1.2","1514","Application Data [TCP segment of a reassembled PDU]"
"211","0.610312862","104.16.100.29","192.168.1.118","TLSv1.2","2974","Application Data, Application Data"
"212","0.610331662","104.16.100.29","192.168.1.118","TLSv1.2","1514","Application Data [TCP segment of a reassembled PDU]"
"213","0.610387775","104.16.100.29","192.168.1.118","TLSv1.2","5894","Application Data, Application Data, Application Data, Application Data"
"214","0.610420987","104.16.100.29","192.168.1.118","TLSv1.2","2974","Application Data, Application Data"
"215","0.610449600","104.16.100.29","192.168.1.118","TLSv1.2","5549","Application Data, Application Data, Application Data, Application Data, Application Data"
"216","0.610470712","104.16.100.29","192.168.1.118","TLSv1.2","2974","Application Data, Application Data"
"217","0.611340375","192.168.1.118","104.16.100.29","TCP","54","38250 → 443 [ACK] Seq=1562 Ack=48868 Win=367 Len=0"
"218","0.611570012","192.168.1.118","104.16.100.29","TCP","54","38252 → 443 [ACK] Seq=1612 Ack=46412 Win=268 Len=0"
"219","0.615211800","104.16.100.29","192.168.1.118","TLSv1.2","2974","Application Data, Application Data"
"220","0.615273950","104.16.100.29","192.168.1.118","TLSv1.2","2974","Application Data, Application Data"
"221","0.615296287","104.16.100.29","192.168.1.118","TLSv1.2","2974","Application Data [TCP segment of a reassembled PDU]"
"222","0.616862650","104.16.100.29","192.168.1.118","TLSv1.2","2974","Application Data [TCP segment of a reassembled PDU]"
"223","0.616931025","104.16.100.29","192.168.1.118","TCP","2974","443 → 38250 [PSH, ACK] Seq=60548 Ack=1562 Win=70 Len=2920 [TCP segment of a reassembled PDU]"
"224","0.616993350","104.16.100.29","192.168.1.118","TLSv1.2","2974","Application Data, Application Data"
"225","0.617015150","104.16.100.29","192.168.1.118","TLSv1.2","2974","Application Data [TCP segment of a reassembled PDU]"
"226","0.617035650","104.16.100.29","192.168.1.118","TCP","2974","443 → 38250 [PSH, ACK] Seq=69308 Ack=1562 Win=70 Len=2920 [TCP segment of a reassembled PDU]"
"227","0.617055387","104.16.100.29","192.168.1.118","TLSv1.2","2974","Application Data [TCP segment of a reassembled PDU]"
"228","0.624941787","104.16.100.29","192.168.1.118","TLSv1.2","2974","Application Data [TCP segment of a reassembled PDU]"
"229","0.625023500","104.16.100.29","192.168.1.118","TCP","2974","443 → 38250 [PSH, ACK] Seq=78068 Ack=1562 Win=70 Len=2920 [TCP segment of a reassembled PDU]"
"230","0.627296287","192.168.1.118","104.16.100.29","TCP","54","38250 → 443 [ACK] Seq=1562 Ack=80988 Win=501 Len=0"
"231","0.627968762","192.168.1.118","104.16.100.29","TLSv1.2","289","Application Data"
"232","0.649009775","104.16.100.29","192.168.1.118","TLSv1.2","1514","Application Data [TCP segment of a reassembled PDU]"
"233","0.650339812","104.16.100.29","192.168.1.118","TCP","1514","443 → 38250 [PSH, ACK] Seq=82448 Ack=1562 Win=70 Len=1460 [TCP segment of a reassembled PDU]"
"234","0.650392975","192.168.1.118","104.16.100.29","TCP","54","38250 → 443 [ACK] Seq=1562 Ack=83908 Win=547 Len=0"
"235","0.650443100","104.16.100.29","192.168.1.118","TLSv1.2","2974","Application Data [TCP segment of a reassembled PDU]"
"236","0.650458525","192.168.1.118","104.16.100.29","TCP","54","38250 → 443 [ACK] Seq=1562 Ack=86828 Win=592 Len=0"
"237","0.650480200","104.16.100.29","192.168.1.118","TCP","2974","443 → 38250 [PSH, ACK] Seq=86828 Ack=1562 Win=70 Len=2920 [TCP segment of a reassembled PDU]"
"238","0.650495912","192.168.1.118","104.16.100.29","TCP","54","38250 → 443 [ACK] Seq=1562 Ack=89748 Win=638 Len=0"
"239","0.650516712","104.16.100.29","192.168.1.118","TLSv1.2","2974","Application Data [TCP segment of a reassembled PDU]"
"240","0.650530962","192.168.1.118","104.16.100.29","TCP","54","38250 → 443 [ACK] Seq=1562 Ack=92668 Win=684 Len=0"
"241","0.651630500","104.16.100.29","192.168.1.118","TLSv1.2","2974","Application Data [TCP segment of a reassembled PDU]"
"242","0.651692387","192.168.1.118","104.16.100.29","TCP","54","38250 → 443 [ACK] Seq=1562 Ack=95588 Win=729 Len=0"
"243","0.652747150","104.16.100.29","192.168.1.118","TLSv1.2","2974","Application Data [TCP segment of a reassembled PDU]"
"244","0.652805300","192.168.1.118","104.16.100.29","TCP","54","38250 → 443 [ACK] Seq=1562 Ack=98508 Win=775 Len=0"
"245","0.652848262","104.16.100.29","192.168.1.118","TCP","2974","443 → 38250 [PSH, ACK] Seq=98508 Ack=1562 Win=70 Len=2920 [TCP segment of a reassembled PDU]"
"246","0.652870075","192.168.1.118","104.16.100.29","TCP","54","38250 → 443 [ACK] Seq=1562 Ack=101428 Win=820 Len=0"
"247","0.654479112","104.16.100.29","192.168.1.118","TLSv1.2","2974","Application Data [TCP segment of a reassembled PDU]"
"248","0.654538875","192.168.1.118","104.16.100.29","TCP","54","38250 → 443 [ACK] Seq=1562 Ack=104348 Win=866 Len=0"
"249","0.655750037","104.16.100.29","192.168.1.118","TLSv1.2","2974","Application Data [TCP segment of a reassembled PDU]"
"250","0.655810550","192.168.1.118","104.16.100.29","TCP","54","38250 → 443 [ACK] Seq=1562 Ack=107268 Win=912 Len=0"
"251","0.655851175","104.16.100.29","192.168.1.118","TCP","2974","443 → 38250 [PSH, ACK] Seq=107268 Ack=1562 Win=70 Len=2920 [TCP segment of a reassembled PDU]"
"252","0.655867587","192.168.1.118","104.16.100.29","TCP","54","38250 → 443 [ACK] Seq=1562 Ack=110188 Win=957 Len=0"
"253","0.655883825","104.16.100.29","192.168.1.118","TLSv1.2","1452","Application Data"
"254","0.657163437","104.16.100.29","192.168.1.118","TLSv1.2","2850","Application Data, Application Data"
"255","0.657213125","104.16.100.29","192.168.1.118","TLSv1.2","2974","Application Data [TCP segment of a reassembled PDU]"
"256","0.657238912","192.168.1.118","104.16.100.29","TCP","54","38250 → 443 [ACK] Seq=1562 Ack=113108 Win=1003 Len=0"
"257","0.657274550","104.16.100.29","192.168.1.118","TLSv1.2","1452","Application Data"
"258","0.657293187","104.16.100.29","192.168.1.118","TCP","1514","443 → 38250 [ACK] Seq=113108 Ack=1562 Win=70 Len=1460 [TCP segment of a reassembled PDU]"
"259","0.664772312","104.16.100.29","192.168.1.118","TLSv1.2","1514","Application Data [TCP segment of a reassembled PDU]"
"260","0.664835975","192.168.1.118","104.16.100.29","TCP","54","38250 → 443 [ACK] Seq=1562 Ack=116028 Win=1049 Len=0"
"261","0.664873187","104.16.100.29","192.168.1.118","TLSv1.2","1452","Application Data"
"262","0.664900475","104.16.100.29","192.168.1.118","TLSv1.2","2974","Application Data, Application Data"
"263","0.664917287","104.16.100.29","192.168.1.118","TLSv1.2","1452","Application Data"
"264","0.664931312","104.16.100.29","192.168.1.118","TLSv1.2","2850","Application Data, Application Data"
"265","0.674593700","104.16.100.29","192.168.1.118","TCP","2974","443 → 38250 [PSH, ACK] Seq=116028 Ack=1562 Win=70 Len=2920 [TCP segment of a reassembled PDU]"
"266","0.674662762","192.168.1.118","104.16.100.29","TCP","54","38250 → 443 [ACK] Seq=1562 Ack=118948 Win=1094 Len=0"
"267","0.674705575","104.16.100.29","192.168.1.118","TLSv1.2","2974","Application Data, Application Data"
"268","0.674729975","104.16.100.29","192.168.1.118","TLSv1.2","2974","Application Data [TCP segment of a reassembled PDU]"
"269","0.674746050","192.168.1.118","104.16.100.29","TCP","54","38250 → 443 [ACK] Seq=1562 Ack=121868 Win=1140 Len=0"
"270","0.674767762","104.16.100.29","192.168.1.118","TLSv1.2","2974","Application Data, Application Data"
"271","0.674793112","104.16.100.29","192.168.1.118","TLSv1.2","2974","Application Data, Application Data"
"272","0.674809062","104.16.100.29","192.168.1.118","TLSv1.2","2974","Application Data [TCP segment of a reassembled PDU]"
"273","0.674822562","192.168.1.118","104.16.100.29","TCP","54","38250 → 443 [ACK] Seq=1562 Ack=124788 Win=1185 Len=0"
"274","0.674838862","104.16.100.29","192.168.1.118","TLSv1.2","2974","Application Data, Application Data"
"275","0.674854550","104.16.100.29","192.168.1.118","TLSv1.2","2974","Application Data, Application Data"
"276","0.674868762","104.16.100.29","192.168.1.118","TCP","2974","443 → 38250 [PSH, ACK] Seq=124788 Ack=1562 Win=70 Len=2920 [TCP segment of a reassembled PDU]"
"277","0.674883550","192.168.1.118","104.16.100.29","TCP","54","38250 → 443 [ACK] Seq=1562 Ack=127708 Win=1231 Len=0"
"278","0.674898362","104.16.100.29","192.168.1.118","TLSv1.2","2974","Application Data, Application Data"
"279","0.674913225","104.16.100.29","192.168.1.118","TLSv1.2","2974","Application Data, Application Data"
"280","0.674928437","104.16.100.29","192.168.1.118","TLSv1.2","2974","Application Data [TCP segment of a reassembled PDU]"
"281","0.674943512","192.168.1.118","104.16.100.29","TCP","54","38250 → 443 [ACK] Seq=1562 Ack=130628 Win=1277 Len=0"
"282","0.674958400","104.16.100.29","192.168.1.118","TLSv1.2","2974","Application Data, Application Data"
"283","0.676291237","104.16.100.29","192.168.1.118","TLSv1.2","2974","Application Data, Application Data"
"284","0.676352187","104.16.100.29","192.168.1.118","TLSv1.2","1514","Application Data [TCP segment of a reassembled PDU]"
"285","0.676429512","104.16.100.29","192.168.1.118","TCP","1514","443 → 38250 [PSH, ACK] Seq=132088 Ack=1562 Win=70 Len=1460 [TCP segment of a reassembled PDU]"
"286","0.676460312","192.168.1.118","104.16.100.29","TCP","54","38250 → 443 [ACK] Seq=1562 Ack=133548 Win=1322 Len=0"
"287","0.676501462","104.16.100.29","192.168.1.118","TLSv1.2","2974","Application Data, Application Data"
"288","0.676524937","104.16.100.29","192.168.1.118","TLSv1.2","2974","Application Data, Application Data"
"289","0.676545037","104.16.100.29","192.168.1.118","TLSv1.2","2974","Application Data [TCP segment of a reassembled PDU]"
"290","0.676560425","192.168.1.118","104.16.100.29","TCP","54","38250 → 443 [ACK] Seq=1562 Ack=136468 Win=1368 Len=0"
"291","0.676581875","104.16.100.29","192.168.1.118","TLSv1.2","2974","Application Data, Application Data"
"292","0.676602662","104.16.100.29","192.168.1.118","TCP","2974","443 → 38250 [PSH, ACK] Seq=136468 Ack=1562 Win=70 Len=2920 [TCP segment of a reassembled PDU]"
"293","0.676618087","192.168.1.118","104.16.100.29","TCP","54","38250 → 443 [ACK] Seq=1562 Ack=139388 Win=1414 Len=0"
"294","0.676639275","104.16.100.29","192.168.1.118","TLSv1.2","2974","Application Data, Application Data"
"295","0.691039700","192.168.1.104","255.255.255.255","UDP","217","49154 → 6666 Len=175"
"296","0.691925475","104.16.100.29","192.168.1.118","TLSv1.2","2974","Application Data, Application Data"
"297","0.691991262","192.168.1.118","104.16.100.29","TCP","54","38248 → 443 [ACK] Seq=1847 Ack=46927 Win=252 Len=0"
"298","0.692036837","104.16.100.29","192.168.1.118","TLSv1.2","2974","Application Data [TCP segment of a reassembled PDU]"
"299","0.692056175","192.168.1.118","104.16.100.29","TCP","54","38250 → 443 [ACK] Seq=1562 Ack=142308 Win=1459 Len=0"
"300","0.692072312","104.16.100.29","192.168.1.118","TLSv1.2","281","Application Data"
"301","0.692090512","104.16.100.29","192.168.1.118","TLSv1.2","1156","Application Data, Application Data"
"302","0.692111425","104.16.100.29","192.168.1.118","TLSv1.2","2862","Application Data [TCP segment of a reassembled PDU]"
"303","0.692127175","192.168.1.118","104.16.100.29","TCP","54","38250 → 443 [ACK] Seq=1562 Ack=145116 Win=1503 Len=0"
"304","0.692162800","104.16.100.29","192.168.1.118","TLSv1.2","1346","Application Data"
"305","0.692191637","104.16.100.29","192.168.1.118","TLSv1.2","88","Application Data"
"306","0.692936512","104.16.100.29","192.168.1.118","TCP","1514","443 → 38250 [ACK] Seq=145116 Ack=1562 Win=70 Len=1460 [TCP segment of a reassembled PDU]"
"307","0.693657925","104.16.100.29","192.168.1.118","TLSv1.2","1514","Application Data [TCP segment of a reassembled PDU]"
"308","0.693710762","192.168.1.118","104.16.100.29","TCP","54","38250 → 443 [ACK] Seq=1562 Ack=148036 Win=1549 Len=0"
"309","0.694658250","104.16.100.29","192.168.1.118","TCP","2974","443 → 38250 [PSH, ACK] Seq=148036 Ack=1562 Win=70 Len=2920 [TCP segment of a reassembled PDU]"
"310","0.694710437","192.168.1.118","104.16.100.29","TCP","54","38250 → 443 [ACK] Seq=1562 Ack=150956 Win=1594 Len=0"
"311","0.694753587","104.16.100.29","192.168.1.118","TLSv1.2","1514","Application Data [TCP segment of a reassembled PDU]"
"312","0.695695800","104.16.100.29","192.168.1.118","TCP","1514","443 → 38250 [PSH, ACK] Seq=152416 Ack=1562 Win=70 Len=1460 [TCP segment of a reassembled PDU]"
"313","0.695746862","104.16.100.29","192.168.1.118","TLSv1.2","2974","Application Data [TCP segment of a reassembled PDU]"
"314","0.699790650","104.16.100.29","192.168.1.118","TCP","1514","443 → 38250 [ACK] Seq=156796 Ack=1562 Win=70 Len=1460 [TCP segment of a reassembled PDU]"
"315","0.701613550","104.16.100.29","192.168.1.118","TCP","1514","443 → 38250 [PSH, ACK] Seq=158256 Ack=1562 Win=70 Len=1460 [TCP segment of a reassembled PDU]"
"316","0.701666812","104.16.100.29","192.168.1.118","TLSv1.2","2974","Application Data [TCP segment of a reassembled PDU]"
"317","0.701687862","104.16.100.29","192.168.1.118","TLSv1.2","1514","Application Data [TCP segment of a reassembled PDU]"
"318","0.701744112","104.16.100.29","192.168.1.118","TCP","1514","443 → 38250 [PSH, ACK] Seq=164096 Ack=1562 Win=70 Len=1460 [TCP segment of a reassembled PDU]"
"319","0.701765675","104.16.100.29","192.168.1.118","TLSv1.2","2974","Application Data [TCP segment of a reassembled PDU]"
"320","0.701797025","104.16.100.29","192.168.1.118","TCP","2974","443 → 38250 [PSH, ACK] Seq=168476 Ack=1562 Win=70 Len=2920 [TCP segment of a reassembled PDU]"
"321","0.701825587","104.16.100.29","192.168.1.118","TLSv1.2","2974","Application Data [TCP segment of a reassembled PDU]"
"322","0.701844500","104.16.100.29","192.168.1.118","TCP","166","443 → 38250 [ACK] Seq=174316 Ack=1562 Win=70 Len=112 [TCP segment of a reassembled PDU]"
"323","0.705209550","192.168.1.118","104.16.100.29","TCP","54","38244 → 443 [ACK] Seq=2038 Ack=38628 Win=319 Len=0"
"324","0.707446525","104.16.100.29","192.168.1.118","TLSv1.2","2974","Application Data [TCP segment of a reassembled PDU]"
"325","0.707508425","104.16.100.29","192.168.1.118","TCP","2974","443 → 38250 [PSH, ACK] Seq=177348 Ack=1562 Win=70 Len=2920 [TCP segment of a reassembled PDU]"
"326","0.707570712","104.16.100.29","192.168.1.118","TLSv1.2","1514","Application Data [TCP segment of a reassembled PDU]"
"327","0.710725262","104.16.100.29","192.168.1.118","TCP","1514","443 → 38250 [PSH, ACK] Seq=181728 Ack=1562 Win=70 Len=1460 [TCP segment of a reassembled PDU]"
"328","0.710787025","104.16.100.29","192.168.1.118","TLSv1.2","2974","Application Data [TCP segment of a reassembled PDU]"
"329","0.710807950","104.16.100.29","192.168.1.118","TCP","1514","443 → 38250 [ACK] Seq=186108 Ack=1562 Win=70 Len=1460 [TCP segment of a reassembled PDU]"
"330","0.710865237","104.16.100.29","192.168.1.118","TCP","1514","443 → 38250 [PSH, ACK] Seq=187568 Ack=1562 Win=70 Len=1460 [TCP segment of a reassembled PDU]"
"331","0.710895550","104.16.100.29","192.168.1.118","TLSv1.2","2974","Application Data [TCP segment of a reassembled PDU]"
"332","0.710916987","104.16.100.29","192.168.1.118","TLSv1.2","2974","Application Data [TCP segment of a reassembled PDU]"
"333","0.710935112","104.16.100.29","192.168.1.118","TLSv1.2","1964","Application Data"
"334","0.732212700","192.168.1.118","104.16.100.29","TCP","54","38248 → 443 [ACK] Seq=1847 Ack=48029 Win=244 Len=0"
"335","0.733196075","192.168.1.118","104.16.100.29","TCP","54","38246 → 443 [ACK] Seq=2025 Ack=13110 Win=491 Len=0"
"336","0.735209150","192.168.1.118","104.16.100.29","TCP","54","38250 → 443 [ACK] Seq=1562 Ack=196778 Win=1237 Len=0"
"337","0.792060337","104.16.100.29","192.168.1.118","TLSv1.2","88","[TCP Spurious Retransmission] , Application Data"
"338","0.792125350","192.168.1.118","104.16.100.29","TCP","66","[TCP Dup ACK 335#1] 38246 → 443 [ACK] Seq=2025 Ack=13110 Win=491 Len=0 SLE=13076 SRE=13110"
"339","0.877005512","192.168.1.118","104.16.100.29","TLSv1.2","283","Application Data"
"340","0.907330912","104.16.100.29","192.168.1.118","TLSv1.2","1238","Application Data"
"341","0.907406450","192.168.1.118","104.16.100.29","TCP","54","38246 → 443 [ACK] Seq=2254 Ack=14294 Win=493 Len=0"
"342","0.908055175","104.16.100.29","192.168.1.118","TLSv1.2","88","Application Data"
"343","0.908094987","192.168.1.118","104.16.100.29","TCP","54","38246 → 443 [ACK] Seq=2254 Ack=14328 Win=493 Len=0"
"344","0.954305937","192.168.1.118","192.168.1.102","TCP","176","33368 → 8009 [PSH, ACK] Seq=1 Ack=1 Win=501 Len=110 TSval=2811178563 TSecr=7311692 [TCP segment of a reassembled PDU]"
"345","0.975268637","192.168.1.102","192.168.1.118","TCP","176","8009 → 33368 [PSH, ACK] Seq=1 Ack=111 Win=294 Len=110 TSval=7312197 TSecr=2811178563 [TCP segment of a reassembled PDU]"
"346","0.975348800","192.168.1.118","192.168.1.102","TCP","66","33368 → 8009 [ACK] Seq=111 Ack=111 Win=501 Len=0 TSval=2811178584 TSecr=7312197"
"347","1.022674337","192.168.1.118","104.16.100.29","TCP","54","[TCP Window Update] 38248 → 443 [ACK] Seq=1847 Ack=48029 Win=501 Len=0"
"348","1.405313175","fe80::1cc7:6d9a:a312:7e8f","ff02::fb","MDNS","577","Standard query 0x0000 PTR _googlecast._tcp.local, "QM" question PTR _homekit._tcp.local, "QM" question PTR _uscan._tcp.local, "QM" question PTR _ptp._tcp.local, "QM" question PTR _ippusb._tcp.local, "QM" question PTR _scanner._tcp.local, "QM" question PTR _ipp._tcp.local, "QM" question PTR _pdl-datastream._tcp.local, "QM" question PTR _uscans._tcp.local, "QM" question PTR _ipps._tcp.local, "QM" question PTR _printer._tcp.local, "QM" question PTR _airplay._tcp.local, "QM" question PTR _raop._tcp.local, "QM" question PTR _airport._tcp.local, "QM" question PTR _rdlink._tcp.local, "QM" question PTR _companion-link._tcp.local, "QM" question PTR _apple-mobdev._tcp.local, "QM" question PTR 8ed307c3._sub._apple-mobdev2._tcp.local, "QM" question PTR _apple-pairable._tcp.local, "QM" question PTR _afpovertcp._tcp.local, "QM" question PTR _smb._tcp.local, "QM" question PTR _rfb._tcp.local, "QM" question PTR _adisk._tcp.local, "QM" question PTR Google-Home-Mini-2c3f16b2da5c4b6fd6cfbfba61c12490._googlecast._tcp.local PTR cjqg._companion-link._tcp.local PTR cjqg._smb._tcp.local OPT"
"349","1.437217925","192.168.1.118","172.253.122.188","TCP","66","42814 → 5228 [ACK] Seq=1 Ack=1 Win=501 Len=0 TSval=3026325219 TSecr=3569132610"
"350","1.465279425","172.253.122.188","192.168.1.118","TCP","66","[TCP ACKed unseen segment] 5228 → 42814 [ACK] Seq=1 Ack=2 Win=257 Len=0 TSval=3569177665 TSecr=3026099467"
"351","4.372278187","192.168.1.100","239.255.255.250","SSDP","217","M-SEARCH * HTTP/1.1 "
"352","5.977057050","192.168.1.118","192.168.1.102","TCP","176","33368 → 8009 [PSH, ACK] Seq=111 Ack=111 Win=501 Len=110 TSval=2811183586 TSecr=7312197 [TCP segment of a reassembled PDU]"
"353","5.986452437","192.168.1.102","192.168.1.118","TCP","176","8009 → 33368 [PSH, ACK] Seq=111 Ack=221 Win=294 Len=110 TSval=7312697 TSecr=2811183586 [TCP segment of a reassembled PDU]"
"354","5.986529862","192.168.1.118","192.168.1.102","TCP","66","33368 → 8009 [ACK] Seq=221 Ack=221 Win=501 Len=0 TSval=2811183596 TSecr=7312697"
"355","6.314822462","192.168.1.100","239.255.255.250","SSDP","217","M-SEARCH * HTTP/1.1 "
"356","6.736950400","192.168.1.104","255.255.255.255","UDP","217","49154 → 6666 Len=175"
"357","7.340535225","192.168.1.100","239.255.255.250","SSDP","217","M-SEARCH * HTTP/1.1 "
"358","8.262815150","192.168.1.118","209.18.47.62","DNS","78","Standard query 0x30ca A www.googleapis.com"
"359","8.280242525","209.18.47.62","192.168.1.118","DNS","334","Standard query response 0x30ca A www.googleapis.com A 172.217.12.170 A 172.217.12.202 A 142.250.64.106 A 172.217.10.10 A 172.217.10.42 A 172.217.10.74 A 172.217.10.138 A 172.217.3.106 A 172.217.12.138 A 172.217.6.202 A 142.250.64.74 A 172.217.6.234 A 172.217.7.10 A 172.217.10.234 A 172.217.11.10 A 172.217.11.42"
"360","8.281558625","192.168.1.118","172.217.12.170","TCP","74","41212 → 443 [SYN] Seq=0 Win=64240 Len=0 MSS=1460 SACK_PERM=1 TSval=4109269507 TSecr=0 WS=128"
"361","8.310782662","172.217.12.170","192.168.1.118","TCP","74","443 → 41212 [SYN, ACK] Seq=0 Ack=1 Win=60192 Len=0 MSS=1380 SACK_PERM=1 TSval=682973747 TSecr=4109269507 WS=256"
"362","8.310883975","192.168.1.118","172.217.12.170","TCP","66","41212 → 443 [ACK] Seq=1 Ack=1 Win=64256 Len=0 TSval=4109269536 TSecr=682973747"
"363","8.311450812","192.168.1.118","172.217.12.170","TLSv1","654","Client Hello"
"364","8.339281050","172.217.12.170","192.168.1.118","TCP","66","443 → 41212 [ACK] Seq=1 Ack=589 Win=61440 Len=0 TSval=682973788 TSecr=4109269536"
"365","8.347050137","172.217.12.170","192.168.1.118","TLSv1.3","278","Server Hello, Change Cipher Spec, Application Data"
"366","8.347125587","192.168.1.118","172.217.12.170","TCP","66","41212 → 443 [ACK] Seq=589 Ack=213 Win=64128 Len=0 TSval=4109269572 TSecr=682973788"
"367","8.360365087","192.168.1.118","172.217.12.170","TLSv1.3","130","Change Cipher Spec, Application Data"
"368","8.366002900","fe80::1cc7:6d9a:a312:7e8f","ff02::fb","MDNS","640","Standard query 0x0000 PTR _googlecast._tcp.local, "QU" question PTR _homekit._tcp.local, "QU" question PTR _uscan._tcp.local, "QU" question PTR _ptp._tcp.local, "QU" question PTR _ippusb._tcp.local, "QU" question PTR _scanner._tcp.local, "QU" question PTR _ipp._tcp.local, "QU" question PTR _pdl-datastream._tcp.local, "QU" question PTR _uscans._tcp.local, "QU" question PTR _ipps._tcp.local, "QU" question PTR _printer._tcp.local, "QU" question PTR _airplay._tcp.local, "QU" question PTR _raop._tcp.local, "QU" question PTR _airport._tcp.local, "QU" question PTR _rdlink._tcp.local, "QU" question PTR _companion-link._tcp.local, "QU" question PTR _apple-mobdev._tcp.local, "QU" question PTR 8ed307c3._sub._apple-mobdev2._tcp.local, "QU" question PTR _apple-pairable._tcp.local, "QU" question PTR _afpovertcp._tcp.local, "QU" question PTR _smb._tcp.local, "QU" question PTR _rfb._tcp.local, "QU" question PTR _adisk._tcp.local, "QU" question TXT Google-Home-Mini-2c3f16b2da5c4b6fd6cfbfba61c12490._googlecast._tcp.local, "QU" question ANY cjqg._smb._tcp.local, "QU" question ANY cjqg._companion-link._tcp.local, "QU" question PTR Google-Home-Mini-2c3f16b2da5c4b6fd6cfbfba61c12490._googlecast._tcp.local PTR cjqg._companion-link._tcp.local PTR cjqg._smb._tcp.local SRV 0 0 445 cjqg.local SRV 0 0 51016 cjqg.local OPT"
"369","8.371861000","fe80::1cc7:6d9a:a312:7e8f","ff02::fb","MDNS","308","Standard query response 0x0000 PTR _smb._tcp.local TXT TXT OPT"
"370","8.377723787","192.168.1.100","224.0.0.251","MDNS","620","Standard query 0x0000 PTR _googlecast._tcp.local, "QU" question PTR _homekit._tcp.local, "QU" question PTR _uscan._tcp.local, "QU" question PTR _ptp._tcp.local, "QU" question PTR _ippusb._tcp.local, "QU" question PTR _scanner._tcp.local, "QU" question PTR _ipp._tcp.local, "QU" question PTR _pdl-datastream._tcp.local, "QU" question PTR _uscans._tcp.local, "QU" question PTR _ipps._tcp.local, "QU" question PTR _printer._tcp.local, "QU" question PTR _airplay._tcp.local, "QU" question PTR _raop._tcp.local, "QU" question PTR _airport._tcp.local, "QU" question PTR _rdlink._tcp.local, "QU" question PTR _companion-link._tcp.local, "QU" question PTR _apple-mobdev._tcp.local, "QU" question PTR 8ed307c3._sub._apple-mobdev2._tcp.local, "QU" question PTR _apple-pairable._tcp.local, "QU" question PTR _afpovertcp._tcp.local, "QU" question PTR _smb._tcp.local, "QU" question PTR _rfb._tcp.local, "QU" question PTR _adisk._tcp.local, "QU" question TXT Google-Home-Mini-2c3f16b2da5c4b6fd6cfbfba61c12490._googlecast._tcp.local, "QU" question ANY cjqg._smb._tcp.local, "QU" question ANY cjqg._companion-link._tcp.local, "QU" question PTR Google-Home-Mini-2c3f16b2da5c4b6fd6cfbfba61c12490._googlecast._tcp.local PTR cjqg._companion-link._tcp.local PTR cjqg._smb._tcp.local SRV 0 0 445 cjqg.local SRV 0 0 51016 cjqg.local OPT"
"371","8.381188487","192.168.1.100","224.0.0.251","MDNS","288","Standard query response 0x0000 PTR _smb._tcp.local TXT TXT OPT"
"372","8.385316162","192.168.1.118","172.217.12.170","TLSv1.3","776","Application Data, Application Data, Application Data"
"373","8.410569987","172.217.12.170","192.168.1.118","TLSv1.3","646","Application Data, Application Data"
"374","8.410976750","192.168.1.118","172.217.12.170","TLSv1.3","97","Application Data"
"375","8.431843812","172.217.12.170","192.168.1.118","TLSv1.3","97","Application Data"
"376","8.442628487","172.217.12.170","192.168.1.118","TLSv1.3","478","Application Data"
"377","8.442819212","192.168.1.118","172.217.12.170","TCP","66","41212 → 443 [ACK] Seq=1394 Ack=1236 Win=64128 Len=0 TSval=4109269668 TSecr=682973854"
"378","8.453347525","172.217.12.170","192.168.1.118","TLSv1.3","644","Application Data"
"379","8.453404562","172.217.12.170","192.168.1.118","TLSv1.3","266","Application Data"
"380","8.453421450","172.217.12.170","192.168.1.118","TLSv1.3","105","Application Data"
"381","8.453544712","192.168.1.118","172.217.12.170","TCP","66","41212 → 443 [ACK] Seq=1394 Ack=2053 Win=64128 Len=0 TSval=4109269679 TSecr=682973882"
"382","8.454942575","172.217.12.170","192.168.1.118","TCP","66","443 → 41212 [ACK] Seq=2053 Ack=1394 Win=62976 Len=0 TSval=682973903 TSecr=4109269636"
"383","8.455889200","192.168.1.118","172.217.12.170","TLSv1.3","105","Application Data"
"384","8.472722100","172.217.12.170","192.168.1.118","TCP","66","443 → 41212 [ACK] Seq=2053 Ack=1433 Win=62976 Len=0 TSval=682973919 TSecr=4109269681"
"385","8.539394350","192.168.1.118","209.18.47.62","DNS","78","Standard query 0xec01 A fcm.googleapis.com"
"386","8.568269775","fe80::1cc7:6d9a:a312:7e8f","ff02::fb","MDNS","195","Standard query 0x0000 ANY cjqg._smb._tcp.local, "QM" question ANY cjqg._companion-link._tcp.local, "QM" question SRV 0 0 445 cjqg.local SRV 0 0 51016 cjqg.local OPT"
"387","8.591164300","209.18.47.62","192.168.1.118","DNS","254","Standard query response 0xec01 A fcm.googleapis.com A 172.217.6.234 A 172.217.7.10 A 172.217.12.170 A 172.217.12.202 A 142.250.64.106 A 172.217.10.10 A 172.217.10.42 A 172.217.3.106 A 172.217.12.138 A 172.217.6.202 A 142.250.64.74"
"388","8.591728162","192.168.1.118","172.217.6.234","TCP","74","40754 → 443 [SYN] Seq=0 Win=64240 Len=0 MSS=1460 SACK_PERM=1 TSval=3339272660 TSecr=0 WS=128"
"389","8.608911850","172.217.6.234","192.168.1.118","TCP","74","443 → 40754 [SYN, ACK] Seq=0 Ack=1 Win=60192 Len=0 MSS=1380 SACK_PERM=1 TSval=1651799084 TSecr=3339272660 WS=256"
"390","8.609014912","192.168.1.118","172.217.6.234","TCP","66","40754 → 443 [ACK] Seq=1 Ack=1 Win=64256 Len=0 TSval=3339272677 TSecr=1651799084"
"391","8.609543487","192.168.1.118","172.217.6.234","TLSv1","583","Client Hello"
"392","8.639238775","172.217.6.234","192.168.1.118","TCP","66","443 → 40754 [ACK] Seq=1 Ack=518 Win=61440 Len=0 TSval=1651799114 TSecr=3339272678"
"393","8.647787025","172.217.6.234","192.168.1.118","TLSv1.3","1484","Server Hello, Change Cipher Spec"
"394","8.647859800","192.168.1.118","172.217.6.234","TCP","66","40754 → 443 [ACK] Seq=518 Ack=1419 Win=63104 Len=0 TSval=3339272716 TSecr=1651799121"
"395","8.649377625","172.217.6.234","192.168.1.118","TLSv1.3","1738","Application Data"
"396","8.649433687","192.168.1.118","172.217.6.234","TCP","66","40754 → 443 [ACK] Seq=518 Ack=3091 Win=61440 Len=0 TSval=3339272717 TSecr=1651799121"
"397","8.657467725","192.168.1.118","172.217.6.234","TLSv1.3","130","Change Cipher Spec, Application Data"
"398","8.658315775","192.168.1.118","172.217.6.234","TLSv1.3","951","Application Data, Application Data, Application Data"
"399","8.669458000","192.168.1.100","224.0.0.251","MDNS","175","Standard query 0x0000 ANY cjqg._smb._tcp.local, "QM" question ANY cjqg._companion-link._tcp.local, "QM" question SRV 0 0 445 cjqg.local SRV 0 0 51016 cjqg.local OPT"
"400","8.683048000","172.217.6.234","192.168.1.118","TCP","66","443 → 40754 [ACK] Seq=3091 Ack=1467 Win=63232 Len=0 TSval=1651799158 TSecr=3339272726"
"401","8.684164300","172.217.6.234","192.168.1.118","TLSv1.3","646","Application Data, Application Data"
"402","8.684213287","172.217.6.234","192.168.1.118","TLSv1.3","97","Application Data"
"403","8.684336587","192.168.1.118","172.217.6.234","TCP","66","40754 → 443 [ACK] Seq=1467 Ack=3702 Win=64128 Len=0 TSval=3339272752 TSecr=1651799158"
"404","8.684602987","192.168.1.118","172.217.6.234","TLSv1.3","97","Application Data"
"405","8.710521162","172.217.6.234","192.168.1.118","TCP","66","443 → 40754 [ACK] Seq=3702 Ack=1498 Win=63232 Len=0 TSval=1651799185 TSecr=3339272753"
"406","8.746443225","172.217.6.234","192.168.1.118","TLSv1.3","516","Application Data"
"407","8.748131675","172.217.6.234","192.168.1.118","TLSv1.3","434","Application Data"
"408","8.748200300","172.217.6.234","192.168.1.118","TLSv1.3","295","Application Data"
"409","8.748215812","172.217.6.234","192.168.1.118","TLSv1.3","105","Application Data"
"410","8.749087887","192.168.1.118","172.217.6.234","TCP","66","40754 → 443 [ACK] Seq=1498 Ack=4788 Win=64128 Len=0 TSval=3339272817 TSecr=1651799220"
"411","8.751164975","192.168.1.118","172.217.6.234","TLSv1.3","105","Application Data"
"412","8.781552712","172.217.6.234","192.168.1.118","TCP","66","443 → 40754 [ACK] Seq=4788 Ack=1537 Win=63232 Len=0 TSval=1651799245 TSecr=3339272819"
"413","8.876160887","fe80::1cc7:6d9a:a312:7e8f","ff02::fb","MDNS","195","Standard query 0x0000 ANY cjqg._smb._tcp.local, "QM" question ANY cjqg._companion-link._tcp.local, "QM" question SRV 0 0 445 cjqg.local SRV 0 0 51016 cjqg.local OPT"
"414","8.878827662","192.168.1.100","224.0.0.251","MDNS","175","Standard query 0x0000 ANY cjqg._smb._tcp.local, "QM" question ANY cjqg._companion-link._tcp.local, "QM" question SRV 0 0 445 cjqg.local SRV 0 0 51016 cjqg.local OPT"
"415","9.082227537","fe80::1cc7:6d9a:a312:7e8f","ff02::fb","MDNS","544","Standard query response 0x0000 TXT, cache flush PTR cjqg._smb._tcp.local TXT SRV, cache flush 0 0 445 cjqg.local TXT, cache flush PTR _companion-link._tcp.local PTR cjqg._companion-link._tcp.local SRV, cache flush 0 0 51016 cjqg.local AAAA, cache flush fe80::1cc7:6d9a:a312:7e8f A, cache flush 192.168.1.100 NSEC, cache flush cjqg._smb._tcp.local NSEC, cache flush cjqg._companion-link._tcp.local NSEC, cache flush cjqg.local OPT"
