frame.number,_ws.col.Time,_ws.col.Source,_ws.col.Destination,_ws.col.Protocol,frame.len,_ws.col.Info
"1","0.000000000","192.168.1.104","255.255.255.255","UDP","217","49154 → 6666 Len=175"
"2","0.024452825","192.168.1.118","104.64.212.198","TLSv1","583","Client Hello"
"3","0.042704238","104.64.212.198","192.168.1.118","TCP","66","443 → 38184 [ACK] Seq=1 Ack=518 Win=235 Len=0 TSval=1551093646 TSecr=3907097377"
"4","0.044485813","104.64.212.198","192.168.1.118","TLSv1.2","1514","Server Hello"
"5","0.044537375","192.168.1.118","104.64.212.198","TCP","66","38184 → 443 [ACK] Seq=518 Ack=1449 Win=493 Len=0 TSval=3907097397 TSecr=1551093648"
"6","0.045954425","104.64.212.198","192.168.1.118","TLSv1.2","1891","Certificate, Server Key Exchange, Server Hello Done"
"7","0.046017488","192.168.1.118","104.64.212.198","TCP","66","38184 → 443 [ACK] Seq=518 Ack=3274 Win=479 Len=0 TSval=3907097399 TSecr=1551093648"
"8","0.088650888","192.168.1.118","104.64.212.198","TLSv1","583","Client Hello"
"9","0.089015700","192.168.1.118","104.64.212.198","TCP","74","38188 → 443 [SYN] Seq=0 Win=64240 Len=0 MSS=1460 SACK_PERM=1 TSval=3907097442 TSecr=0 WS=128"
"10","0.089154288","192.168.1.118","104.64.212.198","TCP","74","38190 → 443 [SYN] Seq=0 Win=64240 Len=0 MSS=1460 SACK_PERM=1 TSval=3907097442 TSecr=0 WS=128"
"11","0.099556875","192.168.1.118","136.147.57.129","TLSv1.2","307","Application Data"
"12","0.101667388","192.168.1.118","104.64.212.198","TLSv1.2","192","Client Key Exchange, Change Cipher Spec, Encrypted Handshake Message"
"13","0.110106788","192.168.1.118","104.64.212.198","TLSv1.2","192","Client Key Exchange, Change Cipher Spec, Encrypted Handshake Message"
"14","0.111372288","104.64.212.198","192.168.1.118","TCP","66","443 → 38186 [ACK] Seq=1 Ack=518 Win=235 Len=0 TSval=1551093717 TSecr=3907097441"
"15","0.112547488","104.64.212.198","192.168.1.118","TCP","74","443 → 38190 [SYN, ACK] Seq=0 Ack=1 Win=28960 Len=0 MSS=1460 SACK_PERM=1 TSval=1551093717 TSecr=3907097442 WS=128"
"16","0.112632775","192.168.1.118","104.64.212.198","TCP","66","38190 → 443 [ACK] Seq=1 Ack=1 Win=64256 Len=0 TSval=3907097465 TSecr=1551093717"
"17","0.112673813","104.64.212.198","192.168.1.118","TLSv1.2","117","Change Cipher Spec, Encrypted Handshake Message"
"18","0.112695988","192.168.1.118","104.64.212.198","TCP","66","38182 → 443 [ACK] Seq=127 Ack=52 Win=501 Len=0 TSval=3907097465 TSecr=1551093718"
"19","0.114696575","104.64.212.198","192.168.1.118","TCP","74","443 → 38188 [SYN, ACK] Seq=0 Ack=1 Win=28960 Len=0 MSS=1460 SACK_PERM=1 TSval=1551093717 TSecr=3907097442 WS=128"
"20","0.114780938","192.168.1.118","104.64.212.198","TCP","66","38188 → 443 [ACK] Seq=1 Ack=1 Win=64256 Len=0 TSval=3907097467 TSecr=1551093717"
"21","0.114823313","104.64.212.198","192.168.1.118","TLSv1.2","1514","Server Hello"
"22","0.114843325","192.168.1.118","104.64.212.198","TCP","66","38186 → 443 [ACK] Seq=518 Ack=1449 Win=493 Len=0 TSval=3907097467 TSecr=1551093718"
"23","0.116756975","104.64.212.198","192.168.1.118","TLSv1.2","1891","Certificate, Server Key Exchange, Server Hello Done"
"24","0.116813488","192.168.1.118","104.64.212.198","TCP","66","38186 → 443 [ACK] Seq=518 Ack=3274 Win=479 Len=0 TSval=3907097469 TSecr=1551093718"
"25","0.129495275","192.168.1.118","104.64.212.198","TLSv1.2","336","Application Data"
"26","0.131569300","192.168.1.118","104.64.212.198","TLSv1.2","192","Client Key Exchange, Change Cipher Spec, Encrypted Handshake Message"
"27","0.133186975","104.64.212.198","192.168.1.118","TLSv1.2","117","Change Cipher Spec, Encrypted Handshake Message"
"28","0.133281263","192.168.1.118","104.64.212.198","TCP","66","38184 → 443 [ACK] Seq=644 Ack=3325 Win=501 Len=0 TSval=3907097486 TSecr=1551093738"
"29","0.154140525","136.147.57.129","192.168.1.118","TCP","66","443 → 40618 [ACK] Seq=1 Ack=242 Win=4964 Len=0 TSval=711060392 TSecr=4227692903"
"30","0.157745038","104.64.212.198","192.168.1.118","TLSv1.2","117","Change Cipher Spec, Encrypted Handshake Message"
"31","0.159026225","104.64.212.198","192.168.1.118","TCP","1514","[TCP segment of a reassembled PDU]"
"32","0.162798150","104.64.212.198","192.168.1.118","TLSv1.2","1243","Application Data"
"33","0.198314950","192.168.1.118","104.64.212.198","TCP","66","38186 → 443 [ACK] Seq=644 Ack=3325 Win=501 Len=0 TSval=3907097551 TSecr=1551093763"
"34","0.199300113","192.168.1.118","104.64.212.198","TCP","66","38182 → 443 [ACK] Seq=397 Ack=2677 Win=481 Len=0 TSval=3907097552 TSecr=1551093764"
"35","0.211954738","192.168.1.118","104.64.212.198","TLSv1","583","Client Hello"
"36","0.226993838","104.64.212.198","192.168.1.118","TCP","66","443 → 38188 [ACK] Seq=1 Ack=518 Win=30080 Len=0 TSval=1551093833 TSecr=3907097565"
"37","0.230763950","104.64.212.198","192.168.1.118","TLSv1.2","1514","Server Hello"
"38","0.230832050","192.168.1.118","104.64.212.198","TCP","66","38188 → 443 [ACK] Seq=518 Ack=1449 Win=63104 Len=0 TSval=3907097583 TSecr=1551093835"
"39","0.232194725","104.64.212.198","192.168.1.118","TLSv1.2","1891","Certificate, Server Key Exchange, Server Hello Done"
"40","0.232277250","192.168.1.118","104.64.212.198","TCP","66","38188 → 443 [ACK] Seq=518 Ack=3274 Win=61312 Len=0 TSval=3907097585 TSecr=1551093835"
"41","0.261750688","192.168.1.118","104.64.212.198","TLSv1","583","Client Hello"
"42","0.262508025","192.168.1.118","104.64.212.198","TLSv1.2","320","Application Data"
"43","0.262761450","192.168.1.118","104.64.212.198","TLSv1.2","309","Application Data"
"44","0.268952888","136.147.57.129","192.168.1.118","TLSv1.2","1313","Application Data"
"45","0.269021575","192.168.1.118","136.147.57.129","TCP","66","40618 → 443 [ACK] Seq=242 Ack=1248 Win=62109 Len=0 TSval=4227693077 TSecr=711060506"
"46","0.276493088","192.168.1.118","104.64.212.198","TLSv1.2","192","Client Key Exchange, Change Cipher Spec, Encrypted Handshake Message"
"47","0.281495613","104.64.212.198","192.168.1.118","TCP","66","443 → 38190 [ACK] Seq=1 Ack=518 Win=30080 Len=0 TSval=1551093887 TSecr=3907097614"
"48","0.283216863","104.64.212.198","192.168.1.118","TCP","1514","[TCP segment of a reassembled PDU]"
"49","0.283307825","192.168.1.118","104.64.212.198","TCP","66","38184 → 443 [ACK] Seq=898 Ack=4773 Win=493 Len=0 TSval=3907097636 TSecr=1551093888"
"50","0.287288963","104.64.212.198","192.168.1.118","TCP","1514","443 → 38184 [ACK] Seq=4773 Ack=898 Win=243 Len=1448 TSval=1551093888 TSecr=3907097615 [TCP segment of a reassembled PDU]"
"51","0.287355775","192.168.1.118","104.64.212.198","TCP","66","38184 → 443 [ACK] Seq=898 Ack=6221 Win=482 Len=0 TSval=3907097640 TSecr=1551093888"
"52","0.287392300","104.64.212.198","192.168.1.118","TCP","2962","[TCP segment of a reassembled PDU]"
"53","0.287420300","192.168.1.118","104.64.212.198","TCP","66","38186 → 443 [ACK] Seq=887 Ack=6221 Win=479 Len=0 TSval=3907097640 TSecr=1551093888"
"54","0.289431575","104.64.212.198","192.168.1.118","TLSv1.2","3339","Server Hello, Certificate, Server Key Exchange, Server Hello Done"
"55","0.289494225","192.168.1.118","104.64.212.198","TCP","66","38190 → 443 [ACK] Seq=518 Ack=3274 Win=61056 Len=0 TSval=3907097642 TSecr=1551093889"
"56","0.293638675","104.64.212.198","192.168.1.118","TLSv1.2","117","Change Cipher Spec, Encrypted Handshake Message"
"57","0.293710725","192.168.1.118","104.64.212.198","TCP","66","38188 → 443 [ACK] Seq=644 Ack=3325 Win=64128 Len=0 TSval=3907097646 TSecr=1551093899"
"58","0.301096613","192.168.1.118","104.64.212.198","TLSv1.2","296","Application Data"
"59","0.303121988","192.168.1.118","104.64.212.198","TLSv1.2","192","Client Key Exchange, Change Cipher Spec, Encrypted Handshake Message"
"60","0.305555375","104.64.212.198","192.168.1.118","TCP","1514","443 → 38184 [ACK] Seq=6221 Ack=898 Win=243 Len=1448 TSval=1551093888 TSecr=3907097615 [TCP segment of a reassembled PDU]"
"61","0.305620200","192.168.1.118","104.64.212.198","TCP","66","38184 → 443 [ACK] Seq=898 Ack=7669 Win=493 Len=0 TSval=3907097658 TSecr=1551093888"
"62","0.306971300","104.64.212.198","192.168.1.118","TCP","1514","443 → 38184 [ACK] Seq=7669 Ack=898 Win=243 Len=1448 TSval=1551093888 TSecr=3907097615 [TCP segment of a reassembled PDU]"
"63","0.307032175","192.168.1.118","104.64.212.198","TCP","66","38184 → 443 [ACK] Seq=898 Ack=9117 Win=482 Len=0 TSval=3907097660 TSecr=1551093888"
"64","0.309192013","104.64.212.198","192.168.1.118","TCP","1514","443 → 38186 [ACK] Seq=6221 Ack=887 Win=243 Len=1448 TSval=1551093888 TSecr=3907097615 [TCP segment of a reassembled PDU]"
"65","0.309274825","192.168.1.118","104.64.212.198","TCP","66","38186 → 443 [ACK] Seq=887 Ack=7669 Win=493 Len=0 TSval=3907097662 TSecr=1551093888"
"66","0.310642438","104.64.212.198","192.168.1.118","TCP","1514","443 → 38186 [ACK] Seq=7669 Ack=887 Win=243 Len=1448 TSval=1551093888 TSecr=3907097615 [TCP segment of a reassembled PDU]"
"67","0.310693600","192.168.1.118","104.64.212.198","TCP","66","38186 → 443 [ACK] Seq=887 Ack=9117 Win=482 Len=0 TSval=3907097663 TSecr=1551093888"
"68","0.313463113","192.168.1.118","104.64.212.198","TLSv1.2","307","Application Data"
"69","0.323480800","104.64.212.198","192.168.1.118","TCP","1514","443 → 38184 [ACK] Seq=9117 Ack=898 Win=243 Len=1448 TSval=1551093888 TSecr=3907097615 [TCP segment of a reassembled PDU]"
"70","0.323544675","192.168.1.118","104.64.212.198","TCP","66","38184 → 443 [ACK] Seq=898 Ack=10565 Win=493 Len=0 TSval=3907097676 TSecr=1551093888"
"71","0.324822938","104.64.212.198","192.168.1.118","TLSv1.2","1258","Application Data"
"72","0.324863188","192.168.1.118","104.64.212.198","TCP","66","38184 → 443 [ACK] Seq=898 Ack=11757 Win=484 Len=0 TSval=3907097677 TSecr=1551093888"
"73","0.328855150","104.64.212.198","192.168.1.118","TLSv1.2","117","Change Cipher Spec, Encrypted Handshake Message"
"74","0.329946388","104.64.212.198","192.168.1.118","TCP","1514","[TCP segment of a reassembled PDU]"
"75","0.333329175","104.64.212.198","192.168.1.118","TLSv1.2","2188","Application Data"
"76","0.334549750","104.64.212.198","192.168.1.118","TCP","1514","443 → 38186 [ACK] Seq=9117 Ack=887 Win=243 Len=1448 TSval=1551093888 TSecr=3907097615 [TCP segment of a reassembled PDU]"
"77","0.334604350","192.168.1.118","104.64.212.198","TCP","66","38186 → 443 [ACK] Seq=887 Ack=10565 Win=493 Len=0 TSval=3907097687 TSecr=1551093888"
"78","0.335939038","104.64.212.198","192.168.1.118","TCP","1514","443 → 38186 [ACK] Seq=10565 Ack=887 Win=243 Len=1448 TSval=1551093888 TSecr=3907097615 [TCP segment of a reassembled PDU]"
"79","0.335988038","192.168.1.118","104.64.212.198","TCP","66","38186 → 443 [ACK] Seq=887 Ack=12013 Win=482 Len=0 TSval=3907097689 TSecr=1551093888"
"80","0.341313375","104.64.212.198","192.168.1.118","TLSv1.2","612","Application Data"
"81","0.341394200","192.168.1.118","104.64.212.198","TCP","66","38182 → 443 [ACK] Seq=638 Ack=3223 Win=497 Len=0 TSval=3907097694 TSecr=1551093946"
"82","0.342481713","192.168.1.118","104.64.212.198","TCP","66","38188 → 443 [ACK] Seq=874 Ack=6895 Win=60672 Len=0 TSval=3907097695 TSecr=1551093935"
"83","0.343071188","192.168.1.118","104.64.212.198","TLSv1.2","305","Application Data"
"84","0.343830713","192.168.1.118","104.64.212.198","TLSv1.2","305","Application Data"
"85","0.343949438","192.168.1.118","104.64.212.198","TLSv1.2","293","Application Data"
"86","0.344043100","192.168.1.118","104.64.212.198","TLSv1.2","317","Application Data"
"87","0.355006475","104.64.212.198","192.168.1.118","TCP","1514","443 → 38186 [ACK] Seq=12013 Ack=887 Win=243 Len=1448 TSval=1551093913 TSecr=3907097640 [TCP segment of a reassembled PDU]"
"88","0.355074000","192.168.1.118","104.64.212.198","TCP","66","38186 → 443 [ACK] Seq=887 Ack=13461 Win=493 Len=0 TSval=3907097708 TSecr=1551093913"
"89","0.356539738","104.64.212.198","192.168.1.118","TCP","1514","443 → 38186 [ACK] Seq=13461 Ack=887 Win=243 Len=1448 TSval=1551093913 TSecr=3907097640 [TCP segment of a reassembled PDU]"
"90","0.356597238","192.168.1.118","104.64.212.198","TCP","66","38186 → 443 [ACK] Seq=887 Ack=14909 Win=482 Len=0 TSval=3907097709 TSecr=1551093913"
"91","0.371484188","104.64.212.198","192.168.1.118","TCP","1514","[TCP segment of a reassembled PDU]"
"92","0.373649575","104.64.212.198","192.168.1.118","TLSv1.2","1026","Application Data"
"93","0.373761038","104.64.212.198","192.168.1.118","TCP","2962","[TCP segment of a reassembled PDU]"
"94","0.373784438","104.64.212.198","192.168.1.118","TCP","2962","[TCP segment of a reassembled PDU]"
"95","0.373801850","104.64.212.198","192.168.1.118","TCP","8754","[TCP segment of a reassembled PDU]"
"96","0.375968538","104.64.212.198","192.168.1.118","TCP","5858","443 → 38188 [ACK] Seq=15583 Ack=1125 Win=32256 Len=5792 TSval=1551093977 TSecr=3907097697 [TCP segment of a reassembled PDU]"
"97","0.376093325","104.64.212.198","192.168.1.118","TLSv1.2","8754","Application Data [TCP segment of a reassembled PDU]"
"98","0.377888850","104.64.212.198","192.168.1.118","TLSv1.2","5334","Application Data, Application Data"
"99","0.377990200","104.64.212.198","192.168.1.118","TLSv1.2","1732","Application Data"
"100","0.378022175","104.64.212.198","192.168.1.118","TCP","2962","443 → 38186 [ACK] Seq=14909 Ack=887 Win=243 Len=2896 TSval=1551093940 TSecr=3907097663 [TCP segment of a reassembled PDU]"
"101","0.378056425","192.168.1.118","104.64.212.198","TCP","66","38186 → 443 [ACK] Seq=887 Ack=17805 Win=460 Len=0 TSval=3907097731 TSecr=1551093940"
"102","0.383080850","104.64.212.198","192.168.1.118","TCP","1514","443 → 38190 [ACK] Seq=6221 Ack=883 Win=31104 Len=1448 TSval=1551093976 TSecr=3907097696 [TCP segment of a reassembled PDU]"
"103","0.383866163","104.64.212.198","192.168.1.118","TCP","1514","443 → 38190 [ACK] Seq=7669 Ack=883 Win=31104 Len=1448 TSval=1551093976 TSecr=3907097696 [TCP segment of a reassembled PDU]"
"104","0.390757125","104.64.212.198","192.168.1.118","TCP","1514","443 → 38186 [ACK] Seq=17805 Ack=887 Win=243 Len=1448 TSval=1551093960 TSecr=3907097663 [TCP segment of a reassembled PDU]"
"105","0.390820788","192.168.1.118","104.64.212.198","TCP","66","38186 → 443 [ACK] Seq=887 Ack=19253 Win=449 Len=0 TSval=3907097743 TSecr=1551093960"
"106","0.391948538","104.64.212.198","192.168.1.118","TLSv1.2","357","Application Data"
"107","0.391994988","104.64.212.198","192.168.1.118","TLSv1.2","1514","Application Data [TCP segment of a reassembled PDU]"
"108","0.392025463","192.168.1.118","104.64.212.198","TCP","66","38186 → 443 [ACK] Seq=887 Ack=20701 Win=438 Len=0 TSval=3907097745 TSecr=1551093960"
"109","0.398662100","104.64.212.198","192.168.1.118","TCP","1514","443 → 38186 [ACK] Seq=20701 Ack=887 Win=243 Len=1448 TSval=1551093981 TSecr=3907097689 [TCP segment of a reassembled PDU]"
"110","0.398734050","192.168.1.118","104.64.212.198","TCP","66","38186 → 443 [ACK] Seq=887 Ack=22149 Win=427 Len=0 TSval=3907097751 TSecr=1551093981"
"111","0.402289175","104.64.212.198","192.168.1.118","TCP","1514","443 → 38186 [ACK] Seq=22149 Ack=887 Win=243 Len=1448 TSval=1551093981 TSecr=3907097689 [TCP segment of a reassembled PDU]"
"112","0.410544150","104.64.212.198","192.168.1.118","TCP","1514","443 → 38186 [ACK] Seq=23597 Ack=887 Win=243 Len=1448 TSval=1551093993 TSecr=3907097708 [TCP segment of a reassembled PDU]"
"113","0.411455438","104.64.212.198","192.168.1.118","TCP","1514","443 → 38186 [ACK] Seq=25045 Ack=887 Win=243 Len=1448 TSval=1551093993 TSecr=3907097708 [TCP segment of a reassembled PDU]"
"114","0.412317775","192.168.1.118","104.64.212.198","TCP","66","38182 → 443 [ACK] Seq=877 Ack=5631 Win=483 Len=0 TSval=3907097765 TSecr=1551093975"
"115","0.414318125","192.168.1.118","104.64.212.198","TCP","66","38188 → 443 [ACK] Seq=1125 Ack=35331 Win=35712 Len=0 TSval=3907097767 TSecr=1551093977"
"116","0.414366863","192.168.1.118","104.64.212.198","TCP","66","38190 → 443 [ACK] Seq=883 Ack=9408 Win=58112 Len=0 TSval=3907097767 TSecr=1551093976"
"117","0.414385588","192.168.1.118","104.64.212.198","TCP","66","38184 → 443 [ACK] Seq=1125 Ack=16319 Win=466 Len=0 TSval=3907097767 TSecr=1551093975"
"118","0.419425750","104.64.212.198","192.168.1.118","TCP","1514","443 → 38186 [ACK] Seq=26493 Ack=887 Win=243 Len=1448 TSval=1551094004 TSecr=3907097708 [TCP segment of a reassembled PDU]"
"119","0.420413850","104.64.212.198","192.168.1.118","TCP","1514","443 → 38186 [ACK] Seq=27941 Ack=887 Win=243 Len=1448 TSval=1551094004 TSecr=3907097708 [TCP segment of a reassembled PDU]"
"120","0.429362863","104.64.212.198","192.168.1.118","TCP","1514","443 → 38186 [ACK] Seq=29389 Ack=887 Win=243 Len=1448 TSval=1551094014 TSecr=3907097708 [TCP segment of a reassembled PDU]"
"121","0.430401300","104.64.212.198","192.168.1.118","TCP","1514","443 → 38186 [ACK] Seq=30837 Ack=887 Win=243 Len=1448 TSval=1551094014 TSecr=3907097708 [TCP segment of a reassembled PDU]"
"122","0.436620125","104.64.212.198","192.168.1.118","TCP","1514","443 → 38186 [ACK] Seq=32285 Ack=887 Win=243 Len=1448 TSval=1551094025 TSecr=3907097708 [TCP segment of a reassembled PDU]"
"123","0.436689713","192.168.1.118","104.64.212.198","TCP","66","38186 → 443 [ACK] Seq=887 Ack=33733 Win=337 Len=0 TSval=3907097789 TSecr=1551093981"
"124","0.438012175","104.64.212.198","192.168.1.118","TCP","1514","443 → 38186 [ACK] Seq=33733 Ack=887 Win=243 Len=1448 TSval=1551094025 TSecr=3907097708 [TCP segment of a reassembled PDU]"
"125","0.443956225","104.64.212.198","192.168.1.118","TLSv1.2","1514","Application Data [TCP segment of a reassembled PDU]"
"126","0.445199950","192.168.1.118","104.64.212.198","TCP","66","38186 → 443 [ACK] Seq=887 Ack=36629 Win=315 Len=0 TSval=3907097798 TSecr=1551094025"
"127","0.447489225","104.64.212.198","192.168.1.118","TLSv1.2","1514","Application Data [TCP segment of a reassembled PDU]"
"128","0.451836275","104.64.212.198","192.168.1.118","TCP","1514","443 → 38186 [ACK] Seq=38077 Ack=887 Win=243 Len=1448 TSval=1551094042 TSecr=3907097751 [TCP segment of a reassembled PDU]"
"129","0.452839513","104.64.212.198","192.168.1.118","TCP","1514","443 → 38186 [ACK] Seq=39525 Ack=887 Win=243 Len=1448 TSval=1551094042 TSecr=3907097751 [TCP segment of a reassembled PDU]"
"130","0.456130375","192.168.1.118","104.64.212.198","TCP","66","38186 → 443 [ACK] Seq=887 Ack=40973 Win=282 Len=0 TSval=3907097809 TSecr=1551094035"
"131","0.458504138","104.64.212.198","192.168.1.118","TCP","1514","443 → 38186 [ACK] Seq=40973 Ack=887 Win=243 Len=1448 TSval=1551094049 TSecr=3907097751 [TCP segment of a reassembled PDU]"
"132","0.459966700","104.64.212.198","192.168.1.118","TCP","1514","443 → 38186 [ACK] Seq=42421 Ack=887 Win=243 Len=1448 TSval=1551094049 TSecr=3907097751 [TCP segment of a reassembled PDU]"
"133","0.466489663","104.64.212.198","192.168.1.118","TCP","1514","443 → 38186 [ACK] Seq=43869 Ack=887 Win=243 Len=1448 TSval=1551094056 TSecr=3907097751 [TCP segment of a reassembled PDU]"
"134","0.467372038","104.64.212.198","192.168.1.118","TCP","1514","443 → 38186 [ACK] Seq=45317 Ack=887 Win=243 Len=1448 TSval=1551094056 TSecr=3907097751 [TCP segment of a reassembled PDU]"
"135","0.470952738","104.64.212.198","192.168.1.118","TCP","1514","443 → 38186 [ACK] Seq=46765 Ack=887 Win=243 Len=1448 TSval=1551094063 TSecr=3907097751 [TCP segment of a reassembled PDU]"
"136","0.471864225","104.64.212.198","192.168.1.118","TCP","1514","443 → 38186 [ACK] Seq=48213 Ack=887 Win=243 Len=1448 TSval=1551094063 TSecr=3907097751 [TCP segment of a reassembled PDU]"
"137","0.475459475","104.64.212.198","192.168.1.118","TCP","1514","443 → 38186 [ACK] Seq=49661 Ack=887 Win=243 Len=1448 TSval=1551094070 TSecr=3907097789 [TCP segment of a reassembled PDU]"
"138","0.476322838","104.64.212.198","192.168.1.118","TCP","1514","443 → 38186 [ACK] Seq=51109 Ack=887 Win=243 Len=1448 TSval=1551094070 TSecr=3907097789 [TCP segment of a reassembled PDU]"
"139","0.480386138","104.64.212.198","192.168.1.118","TCP","1514","443 → 38186 [ACK] Seq=52557 Ack=887 Win=243 Len=1448 TSval=1551094076 TSecr=3907097798 [TCP segment of a reassembled PDU]"
"140","0.485672063","104.64.212.198","192.168.1.118","TLSv1.2","1514","Application Data [TCP segment of a reassembled PDU]"
"141","0.485730125","104.64.212.198","192.168.1.118","TCP","2962","443 → 38186 [ACK] Seq=55453 Ack=887 Win=243 Len=2896 TSval=1551094081 TSecr=3907097809 [TCP segment of a reassembled PDU]"
"142","0.487386363","104.64.212.198","192.168.1.118","TCP","1514","443 → 38186 [ACK] Seq=58349 Ack=887 Win=243 Len=1448 TSval=1551094085 TSecr=3907097809 [TCP segment of a reassembled PDU]"
"143","0.491392050","104.64.212.198","192.168.1.118","TCP","1514","443 → 38186 [ACK] Seq=59797 Ack=887 Win=243 Len=1448 TSval=1551094085 TSecr=3907097809 [TCP segment of a reassembled PDU]"
"144","0.491463063","192.168.1.118","104.64.212.198","TCP","66","38186 → 443 [ACK] Seq=887 Ack=61245 Win=124 Len=0 TSval=3907097844 TSecr=1551094049"
"145","0.493548750","104.64.212.198","192.168.1.118","TCP","2962","443 → 38186 [ACK] Seq=61245 Ack=887 Win=243 Len=2896 TSval=1551094089 TSecr=3907097809 [TCP segment of a reassembled PDU]"
"146","0.495625925","104.64.212.198","192.168.1.118","TCP","1514","443 → 38186 [ACK] Seq=64141 Ack=887 Win=243 Len=1448 TSval=1551094093 TSecr=3907097809 [TCP segment of a reassembled PDU]"
"147","0.496521975","104.64.212.198","192.168.1.118","TLSv1.2","1514","Application Data [TCP segment of a reassembled PDU]"
"148","0.501952475","104.64.212.198","192.168.1.118","TCP","1514","443 → 38186 [ACK] Seq=67037 Ack=887 Win=243 Len=1448 TSval=1551094097 TSecr=3907097809 [TCP segment of a reassembled PDU]"
"149","0.503101013","104.64.212.198","192.168.1.118","TCP","1514","443 → 38186 [ACK] Seq=68485 Ack=887 Win=243 Len=1448 TSval=1551094097 TSecr=3907097809 [TCP segment of a reassembled PDU]"
"150","0.510020175","104.64.212.198","192.168.1.118","TCP","1514","443 → 38186 [ACK] Seq=69933 Ack=887 Win=243 Len=1448 TSval=1551094101 TSecr=3907097809 [TCP segment of a reassembled PDU]"
"151","0.510072175","104.64.212.198","192.168.1.118","TCP","1514","443 → 38186 [ACK] Seq=71381 Ack=887 Win=243 Len=1448 TSval=1551094107 TSecr=3907097844 [TCP segment of a reassembled PDU]"
"152","0.513752775","104.64.212.198","192.168.1.118","TCP","2962","443 → 38186 [ACK] Seq=72829 Ack=887 Win=243 Len=2896 TSval=1551094107 TSecr=3907097844 [TCP segment of a reassembled PDU]"
"153","0.514453150","104.64.212.198","192.168.1.118","TCP","1458","443 → 38186 [ACK] Seq=75725 Ack=887 Win=243 Len=1392 TSval=1551094107 TSecr=3907097844 [TCP segment of a reassembled PDU]"
"154","0.534317675","192.168.1.118","104.64.212.198","TCP","66","[TCP ZeroWindow] 38186 → 443 [ACK] Seq=887 Ack=77117 Win=0 Len=0 TSval=3907097887 TSecr=1551094089"
"155","0.609700500","192.168.1.118","104.64.212.198","TCP","66","[TCP Window Update] 38186 → 443 [ACK] Seq=887 Ack=77117 Win=227 Len=0 TSval=3907097962 TSecr=1551094089"
"156","0.610245200","192.168.1.118","104.64.212.198","TLSv1.2","340","Application Data"
"157","0.621680113","192.168.1.118","209.18.47.62","DNS","80","Standard query 0xdbab A fonts.googleapis.com"
"158","0.623094838","104.64.212.198","192.168.1.118","TCP","1514","443 → 38186 [ACK] Seq=77117 Ack=887 Win=243 Len=1448 TSval=1551094226 TSecr=3907097962 [TCP segment of a reassembled PDU]"
"159","0.624937000","104.64.212.198","192.168.1.118","TCP","122","443 → 38186 [ACK] Seq=78565 Ack=887 Win=243 Len=56 TSval=1551094226 TSecr=3907097962 [TCP segment of a reassembled PDU]"
"160","0.624971575","104.64.212.198","192.168.1.118","TCP","1514","443 → 38186 [ACK] Seq=78621 Ack=887 Win=243 Len=1448 TSval=1551094226 TSecr=3907097962 [TCP segment of a reassembled PDU]"
"161","0.625681588","104.64.212.198","192.168.1.118","TLSv1.2","2962","Application Data [TCP segment of a reassembled PDU]"
"162","0.626426600","104.64.212.198","192.168.1.118","TCP","2962","443 → 38186 [ACK] Seq=82965 Ack=887 Win=243 Len=2896 TSval=1551094226 TSecr=3907097962 [TCP segment of a reassembled PDU]"
"163","0.627184363","104.64.212.198","192.168.1.118","TCP","2962","443 → 38186 [ACK] Seq=85861 Ack=887 Win=243 Len=2896 TSval=1551094226 TSecr=3907097962 [TCP segment of a reassembled PDU]"
"164","0.628153825","104.64.212.198","192.168.1.118","TCP","2962","443 → 38186 [ACK] Seq=88757 Ack=887 Win=243 Len=2896 TSval=1551094226 TSecr=3907097962 [TCP segment of a reassembled PDU]"
"165","0.630807438","104.64.212.198","192.168.1.118","TCP","5858","443 → 38186 [ACK] Seq=91653 Ack=887 Win=243 Len=5792 TSval=1551094226 TSecr=3907097962 [TCP segment of a reassembled PDU]"
"166","0.630908538","104.64.212.198","192.168.1.118","TLSv1.2","2962","Application Data [TCP segment of a reassembled PDU]"
"167","0.634041625","104.64.212.198","192.168.1.118","TCP","4410","443 → 38186 [ACK] Seq=100341 Ack=887 Win=243 Len=4344 TSval=1551094226 TSecr=3907097962 [TCP segment of a reassembled PDU]"
"168","0.635039788","104.64.212.198","192.168.1.118","TCP","1554","443 → 38186 [ACK] Seq=104685 Ack=887 Win=243 Len=1488 TSval=1551094226 TSecr=3907097962 [TCP segment of a reassembled PDU]"
"169","0.635072638","104.64.212.198","192.168.1.118","TLSv1.2","813","Application Data"
"170","0.635116475","192.168.1.118","104.64.212.198","TCP","66","38182 → 443 [ACK] Seq=1151 Ack=6378 Win=496 Len=0 TSval=3907097988 TSecr=1551094228"
"171","0.640546563","209.18.47.62","192.168.1.118","DNS","96","Standard query response 0xdbab A fonts.googleapis.com A 172.217.7.10"
"172","0.640801050","192.168.1.118","209.18.47.62","DNS","80","Standard query 0x97ec AAAA fonts.googleapis.com"
"173","0.661923850","209.18.47.62","192.168.1.118","DNS","108","Standard query response 0x97ec AAAA fonts.googleapis.com AAAA 2607:f8b0:4006:800::200a"
"174","0.663314550","192.168.1.118","104.64.212.198","TCP","66","[TCP ZeroWindow] 38186 → 443 [ACK] Seq=887 Ack=106173 Win=0 Len=0 TSval=3907098016 TSecr=1551094226"
"175","0.715939325","192.168.1.118","104.64.212.198","TCP","66","[TCP Window Update] 38186 → 443 [ACK] Seq=887 Ack=106173 Win=202 Len=0 TSval=3907098069 TSecr=1551094226"
"176","0.717331863","192.168.1.118","172.217.7.10","TCP","74","43888 → 443 [SYN] Seq=0 Win=64240 Len=0 MSS=1460 SACK_PERM=1 TSval=1855432137 TSecr=0 WS=128"
"177","0.721171838","192.168.1.118","104.64.212.198","TCP","66","[TCP Window Update] 38186 → 443 [ACK] Seq=887 Ack=106173 Win=501 Len=0 TSval=3907098074 TSecr=1551094226"
"178","0.743078413","104.64.212.198","192.168.1.118","TLSv1.2","1514","Application Data [TCP segment of a reassembled PDU]"
"179","0.745552700","104.64.212.198","192.168.1.118","TCP","2922","443 → 38186 [PSH, ACK] Seq=107621 Ack=887 Win=243 Len=2856 TSval=1551094345 TSecr=3907098069 [TCP segment of a reassembled PDU]"
"180","0.745620113","192.168.1.118","104.64.212.198","TCP","66","38186 → 443 [ACK] Seq=887 Ack=110477 Win=501 Len=0 TSval=3907098098 TSecr=1551094345"
"181","0.745671788","104.64.212.198","192.168.1.118","TCP","2962","443 → 38186 [ACK] Seq=110477 Ack=887 Win=243 Len=2896 TSval=1551094345 TSecr=3907098069 [TCP segment of a reassembled PDU]"
"182","0.745688238","192.168.1.118","104.64.212.198","TCP","66","38186 → 443 [ACK] Seq=887 Ack=113373 Win=501 Len=0 TSval=3907098098 TSecr=1551094345"
"183","0.745761625","172.217.7.10","192.168.1.118","TCP","74","443 → 43888 [SYN, ACK] Seq=0 Ack=1 Win=60192 Len=0 MSS=1380 SACK_PERM=1 TSval=657186678 TSecr=1855432137 WS=256"
"184","0.745811263","192.168.1.118","172.217.7.10","TCP","66","43888 → 443 [ACK] Seq=1 Ack=1 Win=64256 Len=0 TSval=1855432165 TSecr=657186678"
"185","0.745845425","104.64.212.198","192.168.1.118","TLSv1.2","14546","Application Data [TCP segment of a reassembled PDU]"
"186","0.747139575","104.64.212.198","192.168.1.118","TCP","2962","443 → 38186 [ACK] Seq=127853 Ack=887 Win=243 Len=2896 TSval=1551094345 TSecr=3907098069 [TCP segment of a reassembled PDU]"
"187","0.753072938","104.64.212.198","192.168.1.118","TLSv1.2","1514","Application Data [TCP segment of a reassembled PDU]"
"188","0.754138025","104.64.212.198","192.168.1.118","TCP","4410","443 → 38186 [ACK] Seq=132197 Ack=887 Win=243 Len=4344 TSval=1551094352 TSecr=3907098074 [TCP segment of a reassembled PDU]"
"189","0.755539825","104.64.212.198","192.168.1.118","TCP","1514","443 → 38186 [ACK] Seq=136541 Ack=887 Win=243 Len=1448 TSval=1551094354 TSecr=3907098074 [TCP segment of a reassembled PDU]"
"190","0.756467463","104.64.212.198","192.168.1.118","TCP","1514","443 → 38186 [ACK] Seq=137989 Ack=887 Win=243 Len=1448 TSval=1551094354 TSecr=3907098074 [TCP segment of a reassembled PDU]"
"191","0.758771088","104.64.212.198","192.168.1.118","TCP","1514","443 → 38186 [ACK] Seq=139437 Ack=887 Win=243 Len=1448 TSval=1551094358 TSecr=3907098074 [TCP segment of a reassembled PDU]"
"192","0.765726463","104.64.212.198","192.168.1.118","TCP","1514","443 → 38186 [ACK] Seq=140885 Ack=887 Win=243 Len=1448 TSval=1551094358 TSecr=3907098074 [TCP segment of a reassembled PDU]"
"193","0.786324675","192.168.1.118","104.64.212.198","TCP","66","38186 → 443 [ACK] Seq=887 Ack=142333 Win=307 Len=0 TSval=3907098139 TSecr=1551094345"
"194","0.789084675","104.64.212.198","192.168.1.118","TLSv1.2","7882","Application Data, Application Data"
"195","0.829324413","192.168.1.118","104.64.212.198","TCP","66","38186 → 443 [ACK] Seq=887 Ack=150149 Win=246 Len=0 TSval=3907098182 TSecr=1551094381"
"196","1.014996563","192.168.1.118","104.64.212.198","TCP","66","[TCP Window Update] 38186 → 443 [ACK] Seq=887 Ack=150149 Win=501 Len=0 TSval=3907098368 TSecr=1551094381"
"197","1.062818288","192.168.1.118","172.217.7.10","TLSv1","583","Client Hello"
"198","1.092083500","172.217.7.10","192.168.1.118","TCP","66","443 → 43888 [ACK] Seq=1 Ack=518 Win=61440 Len=0 TSval=657187029 TSecr=1855432482"
"199","1.099675050","172.217.7.10","192.168.1.118","TLSv1.2","1484","Server Hello"
"200","1.099744488","192.168.1.118","172.217.7.10","TCP","66","43888 → 443 [ACK] Seq=518 Ack=1419 Win=63104 Len=0 TSval=1855432519 TSecr=657187036"
"201","1.101109550","172.217.7.10","192.168.1.118","TLSv1.2","1540","Certificate, Server Key Exchange, Server Hello Done"
"202","1.101165100","192.168.1.118","172.217.7.10","TCP","66","43888 → 443 [ACK] Seq=518 Ack=2893 Win=61696 Len=0 TSval=1855432521 TSecr=657187036"
"203","1.216781138","192.168.1.118","172.217.7.10","TLSv1.2","192","Client Key Exchange, Change Cipher Spec, Encrypted Handshake Message"
"204","1.227652475","192.168.1.103","224.0.0.251","MDNS","112","Standard query 0x0000 PTR _sleep-proxy._udp.local, "QU" question OPT"
"205","1.229605738","fe80::144e:ae0c:17ca:d785","ff02::fb","MDNS","132","Standard query 0x0000 PTR _sleep-proxy._udp.local, "QU" question OPT"
"206","1.244195013","172.217.7.10","192.168.1.118","TLSv1.2","117","Change Cipher Spec, Encrypted Handshake Message"
"207","1.244282638","192.168.1.118","172.217.7.10","TCP","66","43888 → 443 [ACK] Seq=644 Ack=2944 Win=64128 Len=0 TSval=1855432664 TSecr=657187183"
"208","1.245574700","192.168.1.118","172.217.7.10","TLSv1.2","338","Application Data"
"209","1.290195825","172.217.7.10","192.168.1.118","TCP","66","443 → 43888 [ACK] Seq=2944 Ack=916 Win=62464 Len=0 TSval=657187223 TSecr=1855432665"
"210","1.299922388","172.217.7.10","192.168.1.118","TLSv1.2","1174","Application Data"
"211","1.300944488","172.217.7.10","192.168.1.118","TLSv1.2","155","Application Data"
"212","1.300984588","172.217.7.10","192.168.1.118","TLSv1.2","100","Application Data"
"213","1.301352238","192.168.1.118","172.217.7.10","TCP","66","43888 → 443 [ACK] Seq=916 Ack=4175 Win=64128 Len=0 TSval=1855432721 TSecr=657187235"
"214","1.361080988","192.168.1.118","209.18.47.62","DNS","82","Standard query 0x5b2a A secure2.sfdcstatic.com"
"215","1.374825588","209.18.47.62","192.168.1.118","DNS","179","Standard query response 0x5b2a A secure2.sfdcstatic.com CNAME secure2.sfdcstatic.com.edgekey.net CNAME e4745.b.akamaiedge.net A 104.64.212.198"
"216","1.380197800","192.168.1.118","209.18.47.62","DNS","82","Standard query 0x2fe8 AAAA secure2.sfdcstatic.com"
"217","1.393585738","209.18.47.62","192.168.1.118","DNS","221","Standard query response 0x2fe8 AAAA secure2.sfdcstatic.com CNAME secure2.sfdcstatic.com.edgekey.net CNAME e4745.b.akamaiedge.net SOA n0b.akamaiedge.net"
"218","1.398087850","192.168.1.118","104.64.212.198","TCP","74","38194 → 443 [SYN] Seq=0 Win=64240 Len=0 MSS=1460 SACK_PERM=1 TSval=3907098751 TSecr=0 WS=128"
"219","1.426860700","192.168.1.118","192.168.1.102","TCP","176","35182 → 8009 [PSH, ACK] Seq=1 Ack=1 Win=501 Len=110 TSval=2820664049 TSecr=6110264 [TCP segment of a reassembled PDU]"
"220","1.436142150","192.168.1.101","224.0.0.251","MDNS","539","Standard query 0x0000 PTR _googlecast._tcp.local, "QM" question PTR _homekit._tcp.local, "QM" question PTR _uscan._tcp.local, "QM" question PTR _ptp._tcp.local, "QM" question PTR _ippusb._tcp.local, "QM" question PTR _scanner._tcp.local, "QM" question PTR _ipp._tcp.local, "QM" question PTR _pdl-datastream._tcp.local, "QM" question PTR _uscans._tcp.local, "QM" question PTR _ipps._tcp.local, "QM" question PTR _printer._tcp.local, "QM" question PTR _airplay._tcp.local, "QM" question PTR _raop._tcp.local, "QM" question PTR _airport._tcp.local, "QM" question PTR _rdlink._tcp.local, "QM" question PTR _companion-link._tcp.local, "QM" question PTR _afpovertcp._tcp.local, "QM" question PTR _rfb._tcp.local, "QM" question PTR _adisk._tcp.local, "QM" question PTR _apple-mobdev._tcp.local, "QM" question PTR 8ed307c3._sub._apple-mobdev2._tcp.local, "QM" question PTR _apple-pairable._tcp.local, "QM" question TXT Google-Home-Mini-2c3f16b2da5c4b6fd6cfbfba61c12490._googlecast._tcp.local, "QM" question PTR Google-Home-Mini-2c3f16b2da5c4b6fd6cfbfba61c12490._googlecast._tcp.local PTR cjqg._companion-link._tcp.local OPT"
"221","1.441543413","fe80::1814:2ecf:2c8a:d90d","ff02::fb","MDNS","559","Standard query 0x0000 PTR _googlecast._tcp.local, "QM" question PTR _homekit._tcp.local, "QM" question PTR _uscan._tcp.local, "QM" question PTR _ptp._tcp.local, "QM" question PTR _ippusb._tcp.local, "QM" question PTR _scanner._tcp.local, "QM" question PTR _ipp._tcp.local, "QM" question PTR _pdl-datastream._tcp.local, "QM" question PTR _uscans._tcp.local, "QM" question PTR _ipps._tcp.local, "QM" question PTR _printer._tcp.local, "QM" question PTR _airplay._tcp.local, "QM" question PTR _raop._tcp.local, "QM" question PTR _airport._tcp.local, "QM" question PTR _rdlink._tcp.local, "QM" question PTR _companion-link._tcp.local, "QM" question PTR _afpovertcp._tcp.local, "QM" question PTR _rfb._tcp.local, "QM" question PTR _adisk._tcp.local, "QM" question PTR _apple-mobdev._tcp.local, "QM" question PTR 8ed307c3._sub._apple-mobdev2._tcp.local, "QM" question PTR _apple-pairable._tcp.local, "QM" question TXT Google-Home-Mini-2c3f16b2da5c4b6fd6cfbfba61c12490._googlecast._tcp.local, "QM" question PTR Google-Home-Mini-2c3f16b2da5c4b6fd6cfbfba61c12490._googlecast._tcp.local PTR cjqg._companion-link._tcp.local OPT"
"222","1.447173138","fe80::1cc7:6d9a:a312:7e8f","ff02::fb","MDNS","539","Standard query 0x0000 PTR _googlecast._tcp.local, "QM" question PTR _homekit._tcp.local, "QM" question PTR _uscan._tcp.local, "QM" question PTR _ptp._tcp.local, "QM" question PTR _ippusb._tcp.local, "QM" question PTR _scanner._tcp.local, "QM" question PTR _ipp._tcp.local, "QM" question PTR _pdl-datastream._tcp.local, "QM" question PTR _uscans._tcp.local, "QM" question PTR _ipps._tcp.local, "QM" question PTR _printer._tcp.local, "QM" question PTR _airplay._tcp.local, "QM" question PTR _raop._tcp.local, "QM" question PTR _airport._tcp.local, "QM" question PTR _rdlink._tcp.local, "QM" question PTR _companion-link._tcp.local, "QM" question PTR _afpovertcp._tcp.local, "QM" question PTR _rfb._tcp.local, "QM" question PTR _adisk._tcp.local, "QM" question PTR _apple-mobdev._tcp.local, "QM" question PTR 8ed307c3._sub._apple-mobdev2._tcp.local, "QM" question PTR _apple-pairable._tcp.local, "QM" question TXT Google-Home-Mini-2c3f16b2da5c4b6fd6cfbfba61c12490._googlecast._tcp.local, "QM" question PTR cjqg._companion-link._tcp.local OPT"
"223","1.452300175","192.168.1.100","224.0.0.251","MDNS","519","Standard query 0x0000 PTR _googlecast._tcp.local, "QM" question PTR _homekit._tcp.local, "QM" question PTR _uscan._tcp.local, "QM" question PTR _ptp._tcp.local, "QM" question PTR _ippusb._tcp.local, "QM" question PTR _scanner._tcp.local, "QM" question PTR _ipp._tcp.local, "QM" question PTR _pdl-datastream._tcp.local, "QM" question PTR _uscans._tcp.local, "QM" question PTR _ipps._tcp.local, "QM" question PTR _printer._tcp.local, "QM" question PTR _airplay._tcp.local, "QM" question PTR _raop._tcp.local, "QM" question PTR _airport._tcp.local, "QM" question PTR _rdlink._tcp.local, "QM" question PTR _companion-link._tcp.local, "QM" question PTR _afpovertcp._tcp.local, "QM" question PTR _rfb._tcp.local, "QM" question PTR _adisk._tcp.local, "QM" question PTR _apple-mobdev._tcp.local, "QM" question PTR 8ed307c3._sub._apple-mobdev2._tcp.local, "QM" question PTR _apple-pairable._tcp.local, "QM" question TXT Google-Home-Mini-2c3f16b2da5c4b6fd6cfbfba61c12490._googlecast._tcp.local, "QM" question PTR cjqg._companion-link._tcp.local OPT"
"224","1.456178288","104.64.212.198","192.168.1.118","TCP","74","443 → 38194 [SYN, ACK] Seq=0 Ack=1 Win=28960 Len=0 MSS=1460 SACK_PERM=1 TSval=1551095044 TSecr=3907098751 WS=128"
"225","1.456301613","192.168.1.118","104.64.212.198","TCP","66","38194 → 443 [ACK] Seq=1 Ack=1 Win=64256 Len=0 TSval=3907098809 TSecr=1551095044"
"226","1.467225338","192.168.1.102","192.168.1.118","TCP","176","8009 → 35182 [PSH, ACK] Seq=1 Ack=111 Win=277 Len=110 TSval=6110767 TSecr=2820664049 [TCP segment of a reassembled PDU]"
"227","1.467319038","192.168.1.118","192.168.1.102","TCP","66","35182 → 8009 [ACK] Seq=111 Ack=111 Win=501 Len=0 TSval=2820664090 TSecr=6110767"
"228","1.503867238","192.168.1.118","104.64.212.198","TLSv1","583","Client Hello"
"229","1.526617100","104.64.212.198","192.168.1.118","TCP","66","443 → 38194 [ACK] Seq=1 Ack=518 Win=30080 Len=0 TSval=1551095131 TSecr=3907098856"
"230","1.528970100","104.64.212.198","192.168.1.118","TLSv1.2","1514","Server Hello"
"231","1.529037713","192.168.1.118","104.64.212.198","TCP","66","38194 → 443 [ACK] Seq=518 Ack=1449 Win=63104 Len=0 TSval=3907098882 TSecr=1551095133"
"232","1.539909038","192.168.1.102","224.0.0.251","MDNS","183","Standard query response 0x0000 SRV, cache flush 0 0 8009 2c3f16b2-da5c-4b6f-d6cf-bfba61c12490.local"
"233","1.543776913","192.168.1.102","224.0.0.251","MDNS","409","Standard query response 0x0000 PTR Google-Home-Mini-2c3f16b2da5c4b6fd6cfbfba61c12490._googlecast._tcp.local TXT, cache flush SRV, cache flush 0 0 8009 2c3f16b2-da5c-4b6f-d6cf-bfba61c12490.local A, cache flush 192.168.1.102"
"234","1.547680825","192.168.1.102","224.0.0.251","MDNS","183","Standard query response 0x0000 SRV, cache flush 0 0 8009 2c3f16b2-da5c-4b6f-d6cf-bfba61c12490.local"
"235","1.551024400","192.168.1.118","136.147.57.129","TLSv1.2","385","Application Data"
"236","1.556838900","104.64.212.198","192.168.1.118","TLSv1.2","1891","Certificate, Server Key Exchange, Server Hello Done"
"237","1.556902825","192.168.1.118","104.64.212.198","TCP","66","38194 → 443 [ACK] Seq=518 Ack=3274 Win=61312 Len=0 TSval=3907098909 TSecr=1551095133"
"238","1.561573388","192.168.1.118","104.64.212.198","TLSv1.2","192","Client Key Exchange, Change Cipher Spec, Encrypted Handshake Message"
"239","1.565204675","192.168.1.118","104.64.212.198","TLSv1.2","313","Application Data"
"240","1.579032513","104.64.212.198","192.168.1.118","TLSv1.2","117","Change Cipher Spec, Encrypted Handshake Message"
"241","1.581104200","192.168.1.118","104.64.212.198","TLSv1.2","305","Application Data"
"242","1.581345988","192.168.1.118","104.64.212.198","TLSv1.2","315","Application Data"
"243","1.586669988","Cisco-Li_5b:1c:ce","IntelCor_b7:52:73","ARP","42","Who has 192.168.1.118? Tell 192.168.1.1"
"244","1.586706550","IntelCor_b7:52:73","Cisco-Li_5b:1c:ce","ARP","42","192.168.1.118 is at dc:fb:48:b7:52:73"
"245","1.587673888","104.64.212.198","192.168.1.118","TLSv1.2","1043","Application Data"
"246","1.587749013","192.168.1.118","104.64.212.198","TCP","66","38182 → 443 [ACK] Seq=1398 Ack=7355 Win=494 Len=0 TSval=3907098940 TSecr=1551095190"
"247","1.598053988","192.168.1.118","104.64.212.198","TLSv1.2","317","Application Data"
"248","1.603860613","104.64.212.198","192.168.1.118","TLSv1.2","414","Application Data"
"249","1.606597525","104.64.212.198","192.168.1.118","TLSv1.2","1093","Application Data"
"250","1.606675463","192.168.1.118","104.64.212.198","TCP","66","38184 → 443 [ACK] Seq=1374 Ack=17346 Win=493 Len=0 TSval=3907098959 TSecr=1551095212"
"251","1.609988163","136.147.57.129","192.168.1.118","TCP","66","443 → 40596 [ACK] Seq=1 Ack=320 Win=5245 Len=0 TSval=711061847 TSecr=4227694359"
"252","1.618238888","192.168.1.118","209.18.47.62","DNS","76","Standard query 0x4bcd A a.sfdcstatic.com"
"253","1.625709400","192.168.1.118","104.64.212.198","TLSv1.2","316","Application Data"
"254","1.627085600","104.64.212.198","192.168.1.118","TLSv1.2","1123","Application Data"
"255","1.646100325","209.18.47.62","192.168.1.118","DNS","167","Standard query response 0x4bcd A a.sfdcstatic.com CNAME a.sfdcstatic.com.edgekey.net CNAME e4745.b.akamaiedge.net A 104.102.83.39"
"256","1.646311575","192.168.1.118","209.18.47.62","DNS","76","Standard query 0x872e AAAA a.sfdcstatic.com"
"257","1.650327675","192.168.1.118","104.64.212.198","TCP","66","38194 → 443 [ACK] Seq=883 Ack=3673 Win=64128 Len=0 TSval=3907099003 TSecr=1551095210"
"258","1.656863950","192.168.1.118","104.64.212.198","TLSv1.2","316","Application Data"
"259","1.663976838","104.64.212.198","192.168.1.118","TLSv1.2","1062","Application Data"
"260","1.680691550","209.18.47.62","192.168.1.118","DNS","209","Standard query response 0x872e AAAA a.sfdcstatic.com CNAME a.sfdcstatic.com.edgekey.net CNAME e4745.b.akamaiedge.net SOA n0b.akamaiedge.net"
"261","1.686508388","192.168.1.118","104.102.83.39","TCP","74","32958 → 443 [SYN] Seq=0 Win=64240 Len=0 MSS=1460 SACK_PERM=1 TSval=3637549134 TSecr=0 WS=128"
"262","1.686731700","192.168.1.118","104.64.212.198","TLSv1.2","318","Application Data"
"263","1.692890425","104.64.212.198","192.168.1.118","TLSv1.2","904","Application Data"
"264","1.702887300","104.102.83.39","192.168.1.118","TCP","74","443 → 32958 [SYN, ACK] Seq=0 Ack=1 Win=28960 Len=0 MSS=1460 SACK_PERM=1 TSval=267764082 TSecr=3637549134 WS=128"
"265","1.702982550","192.168.1.118","104.102.83.39","TCP","66","32958 → 443 [ACK] Seq=1 Ack=1 Win=64256 Len=0 TSval=3637549151 TSecr=267764082"
"266","1.704374138","104.64.212.198","192.168.1.118","TLSv1.2","1038","Application Data"
"267","1.730822125","136.147.57.129","192.168.1.118","TCP","1414","[TCP segment of a reassembled PDU]"
"268","1.733307688","192.168.1.118","104.64.212.198","TCP","66","38182 → 443 [ACK] Seq=1899 Ack=9250 Win=501 Len=0 TSval=3907099086 TSecr=1551095296"
"269","1.735419113","136.147.57.129","192.168.1.118","TLSv1.2","123","Application Data"
"270","1.745314475","192.168.1.118","104.64.212.198","TCP","66","38184 → 443 [ACK] Seq=1876 Ack=19314 Win=494 Len=0 TSval=3907099098 TSecr=1551095309"
"271","1.754640225","192.168.1.118","104.102.83.39","TLSv1","583","Client Hello"
"272","1.755091525","192.168.1.118","136.147.57.129","TCP","66","40596 → 443 [ACK] Seq=320 Ack=1406 Win=62008 Len=0 TSval=4227694563 TSecr=711061965"
"273","1.773372788","104.102.83.39","192.168.1.118","TCP","66","443 → 32958 [ACK] Seq=1 Ack=518 Win=30080 Len=0 TSval=267764151 TSecr=3637549202"
"274","1.774555613","104.102.83.39","192.168.1.118","TLSv1.2","1514","Server Hello"
"275","1.774617763","192.168.1.118","104.102.83.39","TCP","66","32958 → 443 [ACK] Seq=518 Ack=1449 Win=63104 Len=0 TSval=3637549222 TSecr=267764153"
"276","1.775803725","104.102.83.39","192.168.1.118","TLSv1.2","1891","Certificate, Server Key Exchange, Server Hello Done"
"277","1.775868913","192.168.1.118","104.102.83.39","TCP","66","32958 → 443 [ACK] Seq=518 Ack=3274 Win=61312 Len=0 TSval=3637549223 TSecr=267764153"
"278","1.805620875","192.168.1.118","104.102.83.39","TLSv1.2","192","Client Key Exchange, Change Cipher Spec, Encrypted Handshake Message"
"279","1.824105025","104.102.83.39","192.168.1.118","TLSv1.2","117","Change Cipher Spec, Encrypted Handshake Message"
"280","1.828027550","192.168.1.118","104.102.83.39","TLSv1.2","327","Application Data"
"281","1.841780088","fe80::144e:ae0c:17ca:d785","ff02::16","ICMPv6","90","Multicast Listener Report Message v2"
"282","1.847893625","192.168.1.118","104.64.212.198","TLSv1.2","316","Application Data"
"283","1.848031725","192.168.1.118","104.64.212.198","TLSv1.2","315","Application Data"
"284","1.852101363","192.168.1.118","104.64.212.198","TLSv1.2","316","Application Data"
"285","1.852243063","192.168.1.118","104.64.212.198","TLSv1.2","315","Application Data"
"286","1.856477175","104.102.83.39","192.168.1.118","TCP","1514","[TCP segment of a reassembled PDU]"
"287","1.857986413","104.102.83.39","192.168.1.118","TLSv1.2","4802","Application Data"
"288","1.859772500","192.168.1.118","104.102.83.39","TCP","66","32958 → 443 [ACK] Seq=905 Ack=9509 Win=64128 Len=0 TSval=3637549307 TSecr=267764235"
"289","1.870495638","104.64.212.198","192.168.1.118","TLSv1.2","1061","Application Data"
"290","1.870572063","192.168.1.118","104.64.212.198","TCP","66","38188 → 443 [ACK] Seq=1374 Ack=36326 Win=67072 Len=0 TSval=3907099223 TSecr=1551095473"
"291","1.872284375","104.64.212.198","192.168.1.118","TLSv1.2","1100","Application Data"
"292","1.872356813","192.168.1.118","104.64.212.198","TCP","66","38184 → 443 [ACK] Seq=2125 Ack=20348 Win=493 Len=0 TSval=3907099225 TSecr=1551095474"
"293","1.872395913","104.64.212.198","192.168.1.118","TLSv1.2","1056","Application Data"
"294","1.872417338","192.168.1.118","104.64.212.198","TCP","66","38186 → 443 [ACK] Seq=1137 Ack=151139 Win=524 Len=0 TSval=3907099225 TSecr=1551095473"
"295","1.872433125","104.64.212.198","192.168.1.118","TLSv1.2","1017","Application Data"
"296","1.872453125","192.168.1.118","104.64.212.198","TCP","66","38182 → 443 [ACK] Seq=2149 Ack=10201 Win=494 Len=0 TSval=3907099225 TSecr=1551095476"
"297","1.944919025","192.168.1.103","224.0.0.2","IGMPv2","46","Leave Group 224.0.0.251"
"298","1.946505563","192.168.1.103","224.0.0.251","IGMPv2","46","Membership Report group 224.0.0.251"
"299","2.254079038","192.168.1.103","224.0.0.251","MDNS","112","Standard query 0x0000 PTR _sleep-proxy._udp.local, "QM" question OPT"
"300","2.256299138","fe80::144e:ae0c:17ca:d785","ff02::fb","MDNS","132","Standard query 0x0000 PTR _sleep-proxy._udp.local, "QM" question OPT"
"301","2.968986625","192.168.1.104","255.255.255.255","UDP","217","49154 → 6666 Len=175"
"302","4.197722125","192.168.1.103","224.0.0.251","MDNS","150","Standard query 0x0000 PTR _companion-link._tcp.local, "QU" question TXT cjqg._companion-link._tcp.local, "QU" question PTR _sleep-proxy._udp.local, "QM" question OPT"
"303","4.199992950","fe80::144e:ae0c:17ca:d785","ff02::fb","MDNS","170","Standard query 0x0000 PTR _companion-link._tcp.local, "QU" question TXT cjqg._companion-link._tcp.local, "QU" question PTR _sleep-proxy._udp.local, "QM" question OPT"
"304","4.301823638","192.168.1.101","224.0.0.251","MDNS","326","Standard query response 0x0000 TXT TXT, cache flush PTR cjqg._companion-link._tcp.local NSEC, cache flush cjqg._companion-link._tcp.local OPT"
"305","4.305517500","fe80::1814:2ecf:2c8a:d90d","ff02::fb","MDNS","346","Standard query response 0x0000 TXT TXT, cache flush PTR cjqg._companion-link._tcp.local NSEC, cache flush cjqg._companion-link._tcp.local OPT"
"306","4.309414200","fe80::1cc7:6d9a:a312:7e8f","ff02::fb","MDNS","340","Standard query response 0x0000 TXT TXT, cache flush PTR cjqg._companion-link._tcp.local NSEC, cache flush cjqg._companion-link._tcp.local OPT"
"307","4.313297475","192.168.1.100","224.0.0.251","MDNS","320","Standard query response 0x0000 TXT TXT, cache flush PTR cjqg._companion-link._tcp.local NSEC, cache flush cjqg._companion-link._tcp.local OPT"
"308","4.813694463","fe80::144e:ae0c:17ca:d785","ff02::16","ICMPv6","90","Multicast Listener Report Message v2"
"309","5.221378213","192.168.1.103","224.0.0.251","MDNS","134","Standard query 0x0000 PTR _companion-link._tcp.local, "QM" question PTR cjqg._companion-link._tcp.local OPT"
"310","5.223486050","fe80::144e:ae0c:17ca:d785","ff02::fb","MDNS","154","Standard query 0x0000 PTR _companion-link._tcp.local, "QM" question PTR cjqg._companion-link._tcp.local OPT"
"311","6.041517813","192.168.1.104","255.255.255.255","UDP","217","49154 → 6666 Len=175"
"312","6.347497413","192.168.1.102","224.0.0.251","MDNS","81","Standard query 0x0000 PTR _googlerpc._tcp.local, "QM" question"
"313","6.349128375","192.168.1.102","224.0.0.251","MDNS","91","Standard query 0x0000 SRV googlerpc._googlerpc._tcp.local, "QM" question"
"314","6.351787838","192.168.1.102","224.0.0.251","MDNS","220","Standard query response 0x0000 PTR googlerpc._googlerpc._tcp.local TXT, cache flush SRV, cache flush 0 0 8012 2c3f16b2-da5c-4b6f-d6cf-bfba61c12490.local A, cache flush 192.168.1.102"
"315","6.354156600","192.168.1.102","224.0.0.251","MDNS","158","Standard query response 0x0000 SRV, cache flush 0 0 8012 2c3f16b2-da5c-4b6f-d6cf-bfba61c12490.local A, cache flush 192.168.1.102"
"316","6.471112313","192.168.1.118","192.168.1.102","TCP","176","35182 → 8009 [PSH, ACK] Seq=111 Ack=111 Win=501 Len=110 TSval=2820669094 TSecr=6110767 [TCP segment of a reassembled PDU]"
"317","6.491409113","192.168.1.102","192.168.1.118","TCP","176","8009 → 35182 [PSH, ACK] Seq=111 Ack=221 Win=277 Len=110 TSval=6111269 TSecr=2820669094 [TCP segment of a reassembled PDU]"
"318","6.491494775","192.168.1.118","192.168.1.102","TCP","66","35182 → 8009 [ACK] Seq=221 Ack=221 Win=501 Len=0 TSval=2820669114 TSecr=6111269"
"319","7.477584125","192.168.1.103","224.0.0.251","MDNS","112","Standard query 0x0000 PTR _sleep-proxy._udp.local, "QU" question OPT"
"320","7.479611575","fe80::144e:ae0c:17ca:d785","ff02::fb","MDNS","132","Standard query 0x0000 PTR _sleep-proxy._udp.local, "QU" question OPT"
"321","8.036082713","192.168.1.118","239.255.255.250","SSDP","218","M-SEARCH * HTTP/1.1 "
"322","8.194625838","192.168.1.101","224.0.0.251","MDNS","606","Standard query 0x0000 PTR _googlecast._tcp.local, "QU" question PTR _homekit._tcp.local, "QU" question PTR _uscan._tcp.local, "QU" question PTR _ptp._tcp.local, "QU" question PTR _ippusb._tcp.local, "QU" question PTR _scanner._tcp.local, "QU" question PTR _ipp._tcp.local, "QU" question PTR _pdl-datastream._tcp.local, "QU" question PTR _uscans._tcp.local, "QU" question PTR _ipps._tcp.local, "QU" question PTR _printer._tcp.local, "QU" question PTR _airplay._tcp.local, "QU" question PTR _raop._tcp.local, "QU" question PTR _airport._tcp.local, "QU" question PTR _rdlink._tcp.local, "QU" question PTR _companion-link._tcp.local, "QU" question PTR _afpovertcp._tcp.local, "QU" question PTR _rfb._tcp.local, "QU" question PTR _adisk._tcp.local, "QU" question PTR _apple-mobdev._tcp.local, "QU" question PTR 8ed307c3._sub._apple-mobdev2._tcp.local, "QU" question PTR _apple-pairable._tcp.local, "QU" question TXT Google-Home-Mini-2c3f16b2da5c4b6fd6cfbfba61c12490._googlecast._tcp.local, "QU" question ANY cjqg._smb._tcp.local, "QU" question ANY cjqg._companion-link._tcp.local, "QU" question PTR Google-Home-Mini-2c3f16b2da5c4b6fd6cfbfba61c12490._googlecast._tcp.local PTR cjqg._companion-link._tcp.local SRV 0 0 445 cjqg.local SRV 0 0 53785 cjqg.local OPT"
"323","8.200515650","fe80::1814:2ecf:2c8a:d90d","ff02::fb","MDNS","626","Standard query 0x0000 PTR _googlecast._tcp.local, "QU" question PTR _homekit._tcp.local, "QU" question PTR _uscan._tcp.local, "QU" question PTR _ptp._tcp.local, "QU" question PTR _ippusb._tcp.local, "QU" question PTR _scanner._tcp.local, "QU" question PTR _ipp._tcp.local, "QU" question PTR _pdl-datastream._tcp.local, "QU" question PTR _uscans._tcp.local, "QU" question PTR _ipps._tcp.local, "QU" question PTR _printer._tcp.local, "QU" question PTR _airplay._tcp.local, "QU" question PTR _raop._tcp.local, "QU" question PTR _airport._tcp.local, "QU" question PTR _rdlink._tcp.local, "QU" question PTR _companion-link._tcp.local, "QU" question PTR _afpovertcp._tcp.local, "QU" question PTR _rfb._tcp.local, "QU" question PTR _adisk._tcp.local, "QU" question PTR _apple-mobdev._tcp.local, "QU" question PTR 8ed307c3._sub._apple-mobdev2._tcp.local, "QU" question PTR _apple-pairable._tcp.local, "QU" question TXT Google-Home-Mini-2c3f16b2da5c4b6fd6cfbfba61c12490._googlecast._tcp.local, "QU" question ANY cjqg._smb._tcp.local, "QU" question ANY cjqg._companion-link._tcp.local, "QU" question PTR Google-Home-Mini-2c3f16b2da5c4b6fd6cfbfba61c12490._googlecast._tcp.local PTR cjqg._companion-link._tcp.local SRV 0 0 445 cjqg.local SRV 0 0 53785 cjqg.local OPT"
"324","8.203946713","192.168.1.101","224.0.0.251","MDNS","294","Standard query response 0x0000 PTR _smb._tcp.local TXT TXT OPT"
"325","8.207362225","fe80::1814:2ecf:2c8a:d90d","ff02::fb","MDNS","314","Standard query response 0x0000 PTR _smb._tcp.local TXT TXT OPT"
"326","8.213126213","fe80::1cc7:6d9a:a312:7e8f","ff02::fb","MDNS","606","Standard query 0x0000 PTR _googlecast._tcp.local, "QU" question PTR _homekit._tcp.local, "QU" question PTR _uscan._tcp.local, "QU" question PTR _ptp._tcp.local, "QU" question PTR _ippusb._tcp.local, "QU" question PTR _scanner._tcp.local, "QU" question PTR _ipp._tcp.local, "QU" question PTR _pdl-datastream._tcp.local, "QU" question PTR _uscans._tcp.local, "QU" question PTR _ipps._tcp.local, "QU" question PTR _printer._tcp.local, "QU" question PTR _airplay._tcp.local, "QU" question PTR _raop._tcp.local, "QU" question PTR _airport._tcp.local, "QU" question PTR _rdlink._tcp.local, "QU" question PTR _companion-link._tcp.local, "QU" question PTR _afpovertcp._tcp.local, "QU" question PTR _rfb._tcp.local, "QU" question PTR _adisk._tcp.local, "QU" question PTR _apple-mobdev._tcp.local, "QU" question PTR 8ed307c3._sub._apple-mobdev2._tcp.local, "QU" question PTR _apple-pairable._tcp.local, "QU" question TXT Google-Home-Mini-2c3f16b2da5c4b6fd6cfbfba61c12490._googlecast._tcp.local, "QU" question ANY cjqg._smb._tcp.local, "QU" question ANY cjqg._companion-link._tcp.local, "QU" question PTR cjqg._companion-link._tcp.local SRV 0 0 445 cjqg.local SRV 0 0 53785 cjqg.local OPT"
"327","8.216480375","fe80::1cc7:6d9a:a312:7e8f","ff02::fb","MDNS","308","Standard query response 0x0000 PTR _smb._tcp.local TXT TXT OPT"
"328","8.292633900","Google_52:20:d9","Broadcast","ARP","42","Who has 192.168.1.100? Tell 192.168.1.102"
"329","8.293868300","192.168.1.103","224.0.0.2","IGMPv2","46","Leave Group 224.0.0.251"
"330","8.295248050","192.168.1.103","224.0.0.251","IGMPv2","46","Membership Report group 224.0.0.251"
"331","8.396194250","192.168.1.101","224.0.0.251","MDNS","181","Standard query 0x0000 ANY cjqg._smb._tcp.local, "QM" question ANY cjqg._companion-link._tcp.local, "QM" question SRV 0 0 445 cjqg.local SRV 0 0 53785 cjqg.local OPT"
"332","8.398882913","fe80::1814:2ecf:2c8a:d90d","ff02::fb","MDNS","201","Standard query 0x0000 ANY cjqg._smb._tcp.local, "QM" question ANY cjqg._companion-link._tcp.local, "QM" question SRV 0 0 445 cjqg.local SRV 0 0 53785 cjqg.local OPT"
"333","8.401361975","fe80::1cc7:6d9a:a312:7e8f","ff02::fb","MDNS","195","Standard query 0x0000 ANY cjqg._smb._tcp.local, "QM" question ANY cjqg._companion-link._tcp.local, "QM" question SRV 0 0 445 cjqg.local SRV 0 0 53785 cjqg.local OPT"
"334","8.403797038","192.168.1.100","224.0.0.251","MDNS","175","Standard query 0x0000 ANY cjqg._smb._tcp.local, "QM" question ANY cjqg._companion-link._tcp.local, "QM" question SRV 0 0 445 cjqg.local SRV 0 0 53785 cjqg.local OPT"
"335","8.602737913","192.168.1.103","224.0.0.251","MDNS","112","Standard query 0x0000 PTR _sleep-proxy._udp.local, "QM" question OPT"
"336","8.604968650","fe80::144e:ae0c:17ca:d785","ff02::fb","MDNS","132","Standard query 0x0000 PTR _sleep-proxy._udp.local, "QM" question OPT"
"337","8.705877413","192.168.1.101","224.0.0.251","MDNS","181","Standard query 0x0000 ANY cjqg._smb._tcp.local, "QM" question ANY cjqg._companion-link._tcp.local, "QM" question SRV 0 0 445 cjqg.local SRV 0 0 53785 cjqg.local OPT"
"338","8.708720225","fe80::1814:2ecf:2c8a:d90d","ff02::fb","MDNS","201","Standard query 0x0000 ANY cjqg._smb._tcp.local, "QM" question ANY cjqg._companion-link._tcp.local, "QM" question SRV 0 0 445 cjqg.local SRV 0 0 53785 cjqg.local OPT"
"339","9.013905788","192.168.1.101","224.0.0.251","MDNS","530","Standard query response 0x0000 TXT, cache flush PTR cjqg._smb._tcp.local TXT SRV, cache flush 0 0 445 cjqg.local TXT, cache flush PTR _companion-link._tcp.local PTR cjqg._companion-link._tcp.local SRV, cache flush 0 0 53785 cjqg.local AAAA, cache flush fe80::1814:2ecf:2c8a:d90d A, cache flush 192.168.1.101 NSEC, cache flush cjqg._smb._tcp.local NSEC, cache flush cjqg._companion-link._tcp.local NSEC, cache flush cjqg.local OPT"
"340","9.019223525","fe80::1814:2ecf:2c8a:d90d","ff02::fb","MDNS","550","Standard query response 0x0000 TXT, cache flush PTR cjqg._smb._tcp.local TXT SRV, cache flush 0 0 445 cjqg.local TXT, cache flush PTR _companion-link._tcp.local PTR cjqg._companion-link._tcp.local SRV, cache flush 0 0 53785 cjqg.local AAAA, cache flush fe80::1814:2ecf:2c8a:d90d A, cache flush 192.168.1.101 NSEC, cache flush cjqg._smb._tcp.local NSEC, cache flush cjqg._companion-link._tcp.local NSEC, cache flush cjqg.local OPT"
"341","9.024465463","fe80::1cc7:6d9a:a312:7e8f","ff02::fb","MDNS","544","Standard query response 0x0000 TXT, cache flush PTR cjqg._smb._tcp.local TXT SRV, cache flush 0 0 445 cjqg.local TXT, cache flush PTR _companion-link._tcp.local PTR cjqg._companion-link._tcp.local SRV, cache flush 0 0 53785 cjqg.local AAAA, cache flush fe80::1cc7:6d9a:a312:7e8f A, cache flush 192.168.1.100 NSEC, cache flush cjqg._smb._tcp.local NSEC, cache flush cjqg._companion-link._tcp.local NSEC, cache flush cjqg.local OPT"
"342","9.029550313","192.168.1.100","224.0.0.251","MDNS","524","Standard query response 0x0000 TXT, cache flush PTR cjqg._smb._tcp.local TXT SRV, cache flush 0 0 445 cjqg.local TXT, cache flush PTR _companion-link._tcp.local PTR cjqg._companion-link._tcp.local SRV, cache flush 0 0 53785 cjqg.local AAAA, cache flush fe80::1cc7:6d9a:a312:7e8f A, cache flush 192.168.1.100 NSEC, cache flush cjqg._smb._tcp.local NSEC, cache flush cjqg._companion-link._tcp.local NSEC, cache flush cjqg.local OPT"
"343","9.031919263","192.168.1.104","255.255.255.255","UDP","217","49154 → 6666 Len=175"
"344","9.036747250","192.168.1.118","239.255.255.250","SSDP","218","M-SEARCH * HTTP/1.1 "
