frame.number,_ws.col.Time,_ws.col.Source,_ws.col.Destination,_ws.col.Protocol,frame.len,_ws.col.Info
"1","0.000000000","192.168.1.118","45.57.90.1","TCP","66","41040 → 443 [ACK] Seq=1 Ack=1 Win=362 Len=0 TSval=4061119348 TSecr=4061134658"
"2","0.000031963","45.57.90.1","192.168.1.118","TLSv1.2","427","Application Data"
"3","0.000096013","45.57.90.1","192.168.1.118","TLSv1.2","425","Application Data"
"4","0.000137213","45.57.90.1","192.168.1.118","TLSv1.2","429","Application Data"
"5","0.000158550","45.57.90.1","192.168.1.118","TCP","4410","[TCP segment of a reassembled PDU]"
"6","0.001469963","192.168.1.118","45.57.90.1","TCP","66","41046 → 443 [ACK] Seq=1 Ack=4704 Win=465 Len=0 TSval=4061119349 TSecr=3248324710"
"7","0.001704300","45.57.90.1","192.168.1.118","TLSv1.2","426","Application Data"
"8","0.001774438","45.57.90.1","192.168.1.118","TLSv1.2","7169","Application Data"
"9","0.001801038","45.57.90.1","192.168.1.118","TCP","2962","[TCP segment of a reassembled PDU]"
"10","0.002089813","192.168.1.118","45.57.90.1","TCP","66","41042 → 443 [ACK] Seq=1 Ack=3260 Win=477 Len=0 TSval=4061119350 TSecr=1871173999"
"11","0.002171188","192.168.1.118","45.57.90.1","TCP","66","41046 → 443 [ACK] Seq=1 Ack=11807 Win=501 Len=0 TSval=4061119350 TSecr=3248324710"
"12","0.002191138","45.57.90.1","192.168.1.118","TCP","2962","443 → 41042 [ACK] Seq=3260 Ack=1 Win=2050 Len=2896 TSval=1871173999 TSecr=4061119316 [TCP segment of a reassembled PDU]"
"13","0.002227063","192.168.1.118","45.57.90.1","TCP","66","41042 → 443 [ACK] Seq=1 Ack=6156 Win=477 Len=0 TSval=4061119350 TSecr=1871173999"
"14","0.007855425","45.57.90.1","192.168.1.118","TCP","5858","443 → 41042 [ACK] Seq=6156 Ack=1 Win=2050 Len=5792 TSval=1871173999 TSecr=4061119316 [TCP segment of a reassembled PDU]"
"15","0.007936375","45.57.90.1","192.168.1.118","TLSv1.2","5498","Application Data, Application Data"
"16","0.007987388","45.57.90.1","192.168.1.118","TCP","10202","[TCP segment of a reassembled PDU]"
"17","0.009564263","45.57.90.1","192.168.1.118","TCP","1514","443 → 41048 [ACK] Seq=10497 Ack=1 Win=2050 Len=1448 TSval=268270381 TSecr=4061119317 [TCP segment of a reassembled PDU]"
"18","0.015487975","45.57.90.1","192.168.1.118","TLSv1.2","5858","Application Data [TCP segment of a reassembled PDU]"
"19","0.017130200","45.57.90.1","192.168.1.118","TCP","2962","[TCP segment of a reassembled PDU]"
"20","0.018359213","45.57.90.1","192.168.1.118","TLSv1.2","13098","Application Data [TCP segment of a reassembled PDU]"
"21","0.019199488","45.57.90.1","192.168.1.118","TCP","1514","443 → 41044 [ACK] Seq=16290 Ack=1 Win=2050 Len=1448 TSval=3420737046 TSecr=4061119316 [TCP segment of a reassembled PDU]"
"22","0.025943988","192.168.1.118","45.57.90.1","TCP","66","41042 → 443 [ACK] Seq=1 Ack=17380 Win=390 Len=0 TSval=4061119374 TSecr=1871173999"
"23","0.026143975","192.168.1.118","45.57.90.1","TCP","66","41044 → 443 [ACK] Seq=1 Ack=17738 Win=363 Len=0 TSval=4061119374 TSecr=3420737045"
"24","0.026329688","192.168.1.118","45.57.90.1","TCP","66","41048 → 443 [ACK] Seq=1 Ack=17737 Win=363 Len=0 TSval=4061119374 TSecr=268270381"
"25","0.026581625","192.168.1.118","45.57.90.1","TLSv1.2","303","Application Data"
"26","0.026857400","45.57.90.1","192.168.1.118","TLSv1.2","425","Application Data"
"27","0.026938888","45.57.90.1","192.168.1.118","TCP","5858","[TCP segment of a reassembled PDU]"
"28","0.027350088","192.168.1.118","45.57.90.1","TCP","66","41050 → 443 [ACK] Seq=1 Ack=6152 Win=453 Len=0 TSval=4061119375 TSecr=811318346"
"29","0.028508425","45.57.90.1","192.168.1.118","TCP","2962","443 → 41050 [ACK] Seq=6152 Ack=1 Win=2050 Len=2896 TSval=811318346 TSecr=4061119336 [TCP segment of a reassembled PDU]"
"30","0.028569863","192.168.1.118","45.57.90.1","TCP","66","41050 → 443 [ACK] Seq=1 Ack=9048 Win=477 Len=0 TSval=4061119376 TSecr=811318346"
"31","0.029161763","45.57.90.1","192.168.1.118","TLSv1.2","8754","Application Data [TCP segment of a reassembled PDU]"
"32","0.031021325","45.57.90.1","192.168.1.118","SSL","729","Continuation Data"
"33","0.033623875","192.168.1.118","45.57.90.1","TCP","66","41050 → 443 [ACK] Seq=1 Ack=17736 Win=413 Len=0 TSval=4061119381 TSecr=811318346"
"34","0.048004775","45.57.90.1","192.168.1.118","TCP","1514","443 → 41048 [ACK] Seq=17737 Ack=1 Win=2050 Len=1448 TSval=268270436 TSecr=4061119317 [TCP segment of a reassembled PDU]"
"35","0.054906950","45.57.90.1","192.168.1.118","TCP","1514","443 → 41044 [ACK] Seq=17738 Ack=1 Win=2050 Len=1448 TSval=3420737106 TSecr=4061119374 [TCP segment of a reassembled PDU]"
"36","0.059478988","45.57.90.1","192.168.1.118","TCP","5858","443 → 41044 [ACK] Seq=19186 Ack=1 Win=2050 Len=5792 TSval=3420737106 TSecr=4061119374 [TCP segment of a reassembled PDU]"
"37","0.059549713","192.168.1.118","45.57.90.1","TCP","66","41044 → 443 [ACK] Seq=1 Ack=24978 Win=592 Len=0 TSval=4061119407 TSecr=3420737106"
"38","0.061145975","45.57.90.1","192.168.1.118","TCP","2962","443 → 41044 [ACK] Seq=24978 Ack=1 Win=2050 Len=2896 TSval=3420737106 TSecr=4061119374 [TCP segment of a reassembled PDU]"
"39","0.061207913","192.168.1.118","45.57.90.1","TCP","66","41044 → 443 [ACK] Seq=1 Ack=27874 Win=637 Len=0 TSval=4061119409 TSecr=3420737106"
"40","0.061260088","45.57.90.1","192.168.1.118","TCP","1514","443 → 41050 [ACK] Seq=17736 Ack=1 Win=2050 Len=1448 TSval=811318393 TSecr=4061119376 [TCP segment of a reassembled PDU]"
"41","0.062344813","45.57.90.1","192.168.1.118","TLSv1.2","1806","Application Data"
"42","0.062387550","192.168.1.118","45.57.90.1","TCP","66","41050 → 443 [ACK] Seq=1 Ack=20924 Win=461 Len=0 TSval=4061119410 TSecr=811318393"
"43","0.062450663","45.57.90.1","192.168.1.118","TLSv1.2","10202","Application Data [TCP segment of a reassembled PDU]"
"44","0.064262088","192.168.1.118","45.57.90.1","TCP","66","41044 → 443 [ACK] Seq=1 Ack=38010 Win=592 Len=0 TSval=4061119412 TSecr=3420737106"
"45","0.069203125","45.57.90.1","192.168.1.118","TCP","5858","443 → 41044 [ACK] Seq=38010 Ack=1 Win=2050 Len=5792 TSval=3420737106 TSecr=4061119374 [TCP segment of a reassembled PDU]"
"46","0.069289038","192.168.1.118","45.57.90.1","TCP","66","41044 → 443 [ACK] Seq=1 Ack=43802 Win=727 Len=0 TSval=4061119417 TSecr=3420737106"
"47","0.069424575","45.57.90.1","192.168.1.118","TLSv1.2","8754","Application Data [TCP segment of a reassembled PDU]"
"48","0.069440613","45.57.90.1","192.168.1.118","TCP","7306","443 → 41048 [ACK] Seq=19185 Ack=1 Win=2050 Len=7240 TSval=268270442 TSecr=4061119374 [TCP segment of a reassembled PDU]"
"49","0.069461013","192.168.1.118","45.57.90.1","TCP","66","41048 → 443 [ACK] Seq=1 Ack=26425 Win=614 Len=0 TSval=4061119417 TSecr=268270436"
"50","0.071290713","192.168.1.118","45.57.90.1","TCP","66","41040 → 443 [ACK] Seq=1 Ack=664 Win=501 Len=0 TSval=4061119419 TSecr=4061134695"
"51","0.071490350","192.168.1.118","45.57.90.1","TCP","66","41044 → 443 [ACK] Seq=1 Ack=52490 Win=660 Len=0 TSval=4061119419 TSecr=3420737106"
"52","0.071749388","45.57.90.1","192.168.1.118","TCP","1514","443 → 41048 [ACK] Seq=26425 Ack=1 Win=2050 Len=1448 TSval=268270442 TSecr=4061119374 [TCP segment of a reassembled PDU]"
"53","0.074751663","45.57.90.1","192.168.1.118","TLSv1.2","5858","Application Data [TCP segment of a reassembled PDU]"
"54","0.074818513","192.168.1.118","45.57.90.1","TCP","66","41048 → 443 [ACK] Seq=1 Ack=33665 Win=702 Len=0 TSval=4061119422 TSecr=268270442"
"55","0.076397300","45.57.90.1","192.168.1.118","TCP","4410","443 → 41048 [ACK] Seq=33665 Ack=1 Win=2050 Len=4344 TSval=268270442 TSecr=4061119374 [TCP segment of a reassembled PDU]"
"56","0.077519063","192.168.1.118","45.57.90.1","TCP","66","41048 → 443 [ACK] Seq=1 Ack=38009 Win=669 Len=0 TSval=4061119425 TSecr=268270442"
"57","0.077758825","45.57.90.1","192.168.1.118","TLSv1.2","12148","Application Data, Application Data"
"58","0.077874688","192.168.1.118","45.57.90.1","TCP","66","41048 → 443 [ACK] Seq=1 Ack=50091 Win=575 Len=0 TSval=4061119425 TSecr=268270442"
"59","0.089472963","45.57.90.1","192.168.1.118","TLSv1.2","426","Application Data"
"60","0.089554500","45.57.90.1","192.168.1.118","TCP","5858","[TCP segment of a reassembled PDU]"
"61","0.090932425","192.168.1.118","45.57.90.1","TCP","66","41046 → 443 [ACK] Seq=238 Ack=17959 Win=453 Len=0 TSval=4061119439 TSecr=3248324771"
"62","0.091150138","45.57.90.1","192.168.1.118","TLSv1.2","10202","Application Data [TCP segment of a reassembled PDU]"
"63","0.091902050","192.168.1.118","45.57.90.1","TCP","66","41046 → 443 [ACK] Seq=238 Ack=28095 Win=397 Len=0 TSval=4061119440 TSecr=3248324771"
"64","0.092422663","45.57.90.1","192.168.1.118","TCP","5858","443 → 41046 [ACK] Seq=28095 Ack=238 Win=2050 Len=5792 TSval=3248324771 TSecr=4061119374 [TCP segment of a reassembled PDU]"
"65","0.092476288","192.168.1.118","45.57.90.1","TCP","66","41046 → 443 [ACK] Seq=238 Ack=33887 Win=445 Len=0 TSval=4061119440 TSecr=3248324771"
"66","0.096215463","45.57.90.1","192.168.1.118","TCP","5858","443 → 41046 [ACK] Seq=33887 Ack=238 Win=2050 Len=5792 TSval=3248324771 TSecr=4061119374 [TCP segment of a reassembled PDU]"
"67","0.097092275","192.168.1.118","45.57.90.1","TCP","66","41046 → 443 [ACK] Seq=238 Ack=39679 Win=501 Len=0 TSval=4061119445 TSecr=3248324771"
"68","0.097900838","45.57.90.1","192.168.1.118","TCP","1514","443 → 41046 [ACK] Seq=39679 Ack=238 Win=2050 Len=1448 TSval=3248324771 TSecr=4061119374 [TCP segment of a reassembled PDU]"
"69","0.097946713","45.57.90.1","192.168.1.118","TCP","5858","443 → 41044 [ACK] Seq=52490 Ack=1 Win=2050 Len=5792 TSval=3420737131 TSecr=4061119417 [TCP segment of a reassembled PDU]"
"70","0.097980188","192.168.1.118","45.57.90.1","TCP","66","41044 → 443 [ACK] Seq=1 Ack=58282 Win=736 Len=0 TSval=4061119446 TSecr=3420737131"
"71","0.099014088","45.57.90.1","192.168.1.118","TLSv1.2","8754","Application Data [TCP segment of a reassembled PDU]"
"72","0.102209813","192.168.1.118","45.57.90.1","TCP","66","41044 → 443 [ACK] Seq=1 Ack=66970 Win=704 Len=0 TSval=4061119450 TSecr=3420737131"
"73","0.107435700","45.57.90.1","192.168.1.118","TCP","5858","443 → 41044 [ACK] Seq=66970 Ack=1 Win=2050 Len=5792 TSval=3420737131 TSecr=4061119417 [TCP segment of a reassembled PDU]"
"74","0.107500450","192.168.1.118","45.57.90.1","TCP","66","41044 → 443 [ACK] Seq=1 Ack=72762 Win=736 Len=0 TSval=4061119455 TSecr=3420737131"
"75","0.109088325","45.57.90.1","192.168.1.118","TCP","4410","443 → 41044 [ACK] Seq=72762 Ack=1 Win=2050 Len=4344 TSval=3420737131 TSecr=4061119417 [TCP segment of a reassembled PDU]"
"76","0.109131375","192.168.1.118","45.57.90.1","TCP","66","41044 → 443 [ACK] Seq=1 Ack=77106 Win=752 Len=0 TSval=4061119457 TSecr=3420737131"
"77","0.110311438","45.57.90.1","192.168.1.118","TLSv1.2","11650","Application Data [TCP segment of a reassembled PDU]"
"78","0.113405838","45.57.90.1","192.168.1.118","TCP","2962","443 → 41044 [ACK] Seq=88690 Ack=1 Win=2050 Len=2896 TSval=3420737131 TSecr=4061119417 [TCP segment of a reassembled PDU]"
"79","0.116081650","45.57.90.1","192.168.1.118","TCP","5858","443 → 41044 [ACK] Seq=91586 Ack=1 Win=2050 Len=5792 TSval=3420737131 TSecr=4061119417 [TCP segment of a reassembled PDU]"
"80","0.117744813","45.57.90.1","192.168.1.118","TLSv1.2","2962","Application Data [TCP segment of a reassembled PDU]"
"81","0.118938288","45.57.90.1","192.168.1.118","TCP","4410","443 → 41044 [ACK] Seq=100274 Ack=1 Win=2050 Len=4344 TSval=3420737131 TSecr=4061119417 [TCP segment of a reassembled PDU]"
"82","0.119018413","45.57.90.1","192.168.1.118","TCP","8754","443 → 41044 [ACK] Seq=104618 Ack=1 Win=2050 Len=8688 TSval=3420737154 TSecr=4061119419 [TCP segment of a reassembled PDU]"
"83","0.132379888","45.57.90.1","192.168.1.118","TLSv1.2","2962","Application Data [TCP segment of a reassembled PDU]"
"84","0.134054225","45.57.90.1","192.168.1.118","TCP","5858","443 → 41044 [ACK] Seq=116202 Ack=1 Win=2050 Len=5792 TSval=3420737154 TSecr=4061119419 [TCP segment of a reassembled PDU]"
"85","0.135223338","45.57.90.1","192.168.1.118","TCP","1514","443 → 41046 [ACK] Seq=41127 Ack=238 Win=2050 Len=1448 TSval=3248324824 TSecr=4061119440 [TCP segment of a reassembled PDU]"
"86","0.135279688","192.168.1.118","45.57.90.1","TCP","66","41046 → 443 [ACK] Seq=238 Ack=42575 Win=493 Len=0 TSval=4061119483 TSecr=3248324771"
"87","0.151304288","192.168.1.118","45.57.90.1","TCP","66","41044 → 443 [ACK] Seq=1 Ack=121994 Win=402 Len=0 TSval=4061119499 TSecr=3420737131"
"88","0.159478738","45.57.90.1","192.168.1.118","TLSv1.2","30474","Application Data, Application Data"
"89","0.159577800","45.57.90.1","192.168.1.118","TLSv1.2","7286","Application Data"
"90","0.159594775","45.57.90.1","192.168.1.118","TLSv1.2","23234","Application Data, Application Data"
"91","0.168519263","45.57.90.1","192.168.1.118","TCP","1514","443 → 41046 [ACK] Seq=96151 Ack=238 Win=2050 Len=1448 TSval=3248324881 TSecr=4061119483 [TCP segment of a reassembled PDU]"
"92","0.172916213","45.57.90.1","192.168.1.118","TCP","4410","443 → 41046 [ACK] Seq=97599 Ack=238 Win=2050 Len=4344 TSval=3248324881 TSecr=4061119483 [TCP segment of a reassembled PDU]"
"93","0.200299100","192.168.1.118","45.57.90.1","TCP","66","41044 → 443 [ACK] Seq=1 Ack=129214 Win=346 Len=0 TSval=4061119548 TSecr=3420737179"
"94","0.200352550","192.168.1.118","45.57.90.1","TCP","66","41046 → 443 [ACK] Seq=238 Ack=101943 Win=30 Len=0 TSval=4061119548 TSecr=3248324824"
"95","0.215652163","45.57.90.1","192.168.1.118","TCP","1514","[TCP Spurious Retransmission] 443 → 41044 [ACK] Seq=127754 Ack=1 Win=2050 Len=1448 TSval=3420737265 TSecr=4061119499[Reassembly error, protocol TCP: New fragment overlaps old data (retransmission?)]"
"96","0.215718088","192.168.1.118","45.57.90.1","TCP","78","[TCP Dup ACK 93#1] 41044 → 443 [ACK] Seq=1 Ack=129214 Win=346 Len=0 TSval=4061119563 TSecr=3420737179 SLE=127754 SRE=129202"
"97","0.233335675","45.57.90.1","192.168.1.118","TCP","1514","443 → 41046 [ACK] Seq=101943 Ack=238 Win=2050 Len=1448 TSval=3248324950 TSecr=4061119548 [TCP segment of a reassembled PDU]"
"98","0.234745500","45.57.90.1","192.168.1.118","TCP","1514","443 → 41046 [ACK] Seq=103391 Ack=238 Win=2050 Len=1448 TSval=3248324950 TSecr=4061119548 [TCP segment of a reassembled PDU]"
"99","0.274290638","192.168.1.118","45.57.90.1","TCP","66","41046 → 443 [ACK] Seq=238 Ack=104839 Win=8 Len=0 TSval=4061119622 TSecr=3248324950"
"100","0.289782250","45.57.90.1","192.168.1.118","TCP","1090","443 → 41046 [ACK] Seq=104839 Ack=238 Win=2050 Len=1024 TSval=3248325005 TSecr=4061119622 [TCP segment of a reassembled PDU]"
"101","0.330302925","192.168.1.118","45.57.90.1","TCP","66","[TCP ZeroWindow] 41046 → 443 [ACK] Seq=238 Ack=105863 Win=0 Len=0 TSval=4061119678 TSecr=3248325005"
"102","0.335610088","192.168.1.118","45.57.90.1","TCP","66","[TCP Window Update] 41044 → 443 [ACK] Seq=1 Ack=129214 Win=752 Len=0 TSval=4061119683 TSecr=3420737179"
"103","0.336032413","192.168.1.118","45.57.90.1","TCP","66","[TCP Window Update] 41046 → 443 [ACK] Seq=238 Ack=105863 Win=501 Len=0 TSval=4061119684 TSecr=3248325005"
"104","0.356590700","45.57.90.1","192.168.1.118","TCP","1514","443 → 41046 [ACK] Seq=105863 Ack=238 Win=2050 Len=1448 TSval=3248325073 TSecr=4061119684 [TCP segment of a reassembled PDU]"
"105","0.356661950","192.168.1.118","45.57.90.1","TCP","66","41046 → 443 [ACK] Seq=238 Ack=107311 Win=524 Len=0 TSval=4061119704 TSecr=3248325073"
"106","0.361841875","45.57.90.1","192.168.1.118","TLSv1.2","5858","Application Data [TCP segment of a reassembled PDU]"
"107","0.361908725","192.168.1.118","45.57.90.1","TCP","66","41046 → 443 [ACK] Seq=238 Ack=113103 Win=614 Len=0 TSval=4061119710 TSecr=3248325073"
"108","0.362011625","45.57.90.1","192.168.1.118","TCP","2962","443 → 41046 [ACK] Seq=113103 Ack=238 Win=2050 Len=2896 TSval=3248325073 TSecr=4061119684 [TCP segment of a reassembled PDU]"
"109","0.362028063","192.168.1.118","45.57.90.1","TCP","66","41046 → 443 [ACK] Seq=238 Ack=115999 Win=660 Len=0 TSval=4061119710 TSecr=3248325073"
"110","0.367268913","45.57.90.1","192.168.1.118","TCP","5858","443 → 41046 [ACK] Seq=115999 Ack=238 Win=2050 Len=5792 TSval=3248325073 TSecr=4061119684 [TCP segment of a reassembled PDU]"
"111","0.367336025","192.168.1.118","45.57.90.1","TCP","66","41046 → 443 [ACK] Seq=238 Ack=121791 Win=750 Len=0 TSval=4061119715 TSecr=3248325073"
"112","0.368916050","45.57.90.1","192.168.1.118","TCP","4410","443 → 41046 [ACK] Seq=121791 Ack=238 Win=2050 Len=4344 TSval=3248325073 TSecr=4061119684 [TCP segment of a reassembled PDU]"
"113","0.368981000","192.168.1.118","45.57.90.1","TCP","66","41046 → 443 [ACK] Seq=238 Ack=126135 Win=818 Len=0 TSval=4061119717 TSecr=3248325073"
"114","0.370131325","45.57.90.1","192.168.1.118","TLSv1.2","11650","Application Data [TCP segment of a reassembled PDU]"
"115","0.370205788","192.168.1.118","45.57.90.1","TCP","66","41046 → 443 [ACK] Seq=238 Ack=137719 Win=999 Len=0 TSval=4061119718 TSecr=3248325073"
"116","0.372646588","45.57.90.1","192.168.1.118","TCP","1514","443 → 41046 [ACK] Seq=137719 Ack=238 Win=2050 Len=1448 TSval=3248325073 TSecr=4061119684 [TCP segment of a reassembled PDU]"
"117","0.372716625","192.168.1.118","45.57.90.1","TCP","66","41046 → 443 [ACK] Seq=238 Ack=139167 Win=1022 Len=0 TSval=4061119720 TSecr=3248325073"
"118","0.379796288","45.57.90.1","192.168.1.118","TLSv1.2","8754","Application Data [TCP segment of a reassembled PDU]"
"119","0.379866238","192.168.1.118","45.57.90.1","TCP","66","41046 → 443 [ACK] Seq=238 Ack=147855 Win=1157 Len=0 TSval=4061119727 TSecr=3248325073"
"120","0.379990588","45.57.90.1","192.168.1.118","TLSv1.2","1679","Application Data"
"121","0.380007363","192.168.1.118","45.57.90.1","TCP","66","41046 → 443 [ACK] Seq=238 Ack=149468 Win=1183 Len=0 TSval=4061119728 TSecr=3248325073"
"122","0.596862988","192.168.1.118","192.168.1.102","TCP","176","35182 → 8009 [PSH, ACK] Seq=1 Ack=1 Win=501 Len=110 TSval=2820844644 TSecr=6128323 [TCP segment of a reassembled PDU]"
"123","0.603462188","192.168.1.102","192.168.1.118","TCP","176","8009 → 35182 [PSH, ACK] Seq=1 Ack=111 Win=277 Len=110 TSval=6128824 TSecr=2820844644 [TCP segment of a reassembled PDU]"
"124","0.603547400","192.168.1.118","192.168.1.102","TCP","66","35182 → 8009 [ACK] Seq=111 Ack=111 Win=501 Len=0 TSval=2820844651 TSecr=6128824"
"125","1.563853763","192.168.1.104","255.255.255.255","UDP","217","49154 → 6666 Len=175"
"126","4.634087738","192.168.1.104","255.255.255.255","UDP","217","49154 → 6666 Len=175"
"127","5.607714025","192.168.1.118","192.168.1.102","TCP","176","35182 → 8009 [PSH, ACK] Seq=111 Ack=111 Win=501 Len=110 TSval=2820849655 TSecr=6128824 [TCP segment of a reassembled PDU]"
"128","5.618854850","192.168.1.102","192.168.1.118","TCP","176","8009 → 35182 [PSH, ACK] Seq=111 Ack=221 Win=277 Len=110 TSval=6129326 TSecr=2820849655 [TCP segment of a reassembled PDU]"
"129","5.618940613","192.168.1.118","192.168.1.102","TCP","66","35182 → 8009 [ACK] Seq=221 Ack=221 Win=501 Len=0 TSval=2820849667 TSecr=6129326"
"130","6.486199438","192.168.1.101","224.0.0.251","MDNS","606","Standard query 0x0000 PTR _googlecast._tcp.local, "QU" question PTR _homekit._tcp.local, "QU" question PTR _uscan._tcp.local, "QU" question PTR _ptp._tcp.local, "QU" question PTR _ippusb._tcp.local, "QU" question PTR _scanner._tcp.local, "QU" question PTR _ipp._tcp.local, "QU" question PTR _pdl-datastream._tcp.local, "QU" question PTR _uscans._tcp.local, "QU" question PTR _ipps._tcp.local, "QU" question PTR _printer._tcp.local, "QU" question PTR _airplay._tcp.local, "QU" question PTR _raop._tcp.local, "QU" question PTR _airport._tcp.local, "QU" question PTR _rdlink._tcp.local, "QU" question PTR _companion-link._tcp.local, "QU" question PTR _afpovertcp._tcp.local, "QU" question PTR _rfb._tcp.local, "QU" question PTR _adisk._tcp.local, "QU" question PTR _apple-mobdev._tcp.local, "QU" question PTR 8ed307c3._sub._apple-mobdev2._tcp.local, "QU" question PTR _apple-pairable._tcp.local, "QU" question TXT Google-Home-Mini-2c3f16b2da5c4b6fd6cfbfba61c12490._googlecast._tcp.local, "QU" question ANY cjqg._smb._tcp.local, "QU" question ANY cjqg._companion-link._tcp.local, "QU" question PTR Google-Home-Mini-2c3f16b2da5c4b6fd6cfbfba61c12490._googlecast._tcp.local PTR cjqg._companion-link._tcp.local SRV 0 0 445 cjqg.local SRV 0 0 53785 cjqg.local OPT"
"131","6.492298738","fe80::1814:2ecf:2c8a:d90d","ff02::fb","MDNS","626","Standard query 0x0000 PTR _googlecast._tcp.local, "QU" question PTR _homekit._tcp.local, "QU" question PTR _uscan._tcp.local, "QU" question PTR _ptp._tcp.local, "QU" question PTR _ippusb._tcp.local, "QU" question PTR _scanner._tcp.local, "QU" question PTR _ipp._tcp.local, "QU" question PTR _pdl-datastream._tcp.local, "QU" question PTR _uscans._tcp.local, "QU" question PTR _ipps._tcp.local, "QU" question PTR _printer._tcp.local, "QU" question PTR _airplay._tcp.local, "QU" question PTR _raop._tcp.local, "QU" question PTR _airport._tcp.local, "QU" question PTR _rdlink._tcp.local, "QU" question PTR _companion-link._tcp.local, "QU" question PTR _afpovertcp._tcp.local, "QU" question PTR _rfb._tcp.local, "QU" question PTR _adisk._tcp.local, "QU" question PTR _apple-mobdev._tcp.local, "QU" question PTR 8ed307c3._sub._apple-mobdev2._tcp.local, "QU" question PTR _apple-pairable._tcp.local, "QU" question TXT Google-Home-Mini-2c3f16b2da5c4b6fd6cfbfba61c12490._googlecast._tcp.local, "QU" question ANY cjqg._smb._tcp.local, "QU" question ANY cjqg._companion-link._tcp.local, "QU" question PTR Google-Home-Mini-2c3f16b2da5c4b6fd6cfbfba61c12490._googlecast._tcp.local PTR cjqg._companion-link._tcp.local SRV 0 0 445 cjqg.local SRV 0 0 53785 cjqg.local OPT"
"132","6.495500138","192.168.1.101","224.0.0.251","MDNS","294","Standard query response 0x0000 PTR _smb._tcp.local TXT TXT OPT"
"133","6.583582613","fe80::1cc7:6d9a:a312:7e8f","ff02::fb","MDNS","620","Standard query 0x0000 PTR _googlecast._tcp.local, "QU" question PTR _homekit._tcp.local, "QU" question PTR _uscan._tcp.local, "QU" question PTR _ptp._tcp.local, "QU" question PTR _ippusb._tcp.local, "QU" question PTR _scanner._tcp.local, "QU" question PTR _ipp._tcp.local, "QU" question PTR _pdl-datastream._tcp.local, "QU" question PTR _uscans._tcp.local, "QU" question PTR _ipps._tcp.local, "QU" question PTR _printer._tcp.local, "QU" question PTR _airplay._tcp.local, "QU" question PTR _raop._tcp.local, "QU" question PTR _airport._tcp.local, "QU" question PTR _rdlink._tcp.local, "QU" question PTR _companion-link._tcp.local, "QU" question PTR _afpovertcp._tcp.local, "QU" question PTR _rfb._tcp.local, "QU" question PTR _adisk._tcp.local, "QU" question PTR _apple-mobdev._tcp.local, "QU" question PTR 8ed307c3._sub._apple-mobdev2._tcp.local, "QU" question PTR _apple-pairable._tcp.local, "QU" question TXT Google-Home-Mini-2c3f16b2da5c4b6fd6cfbfba61c12490._googlecast._tcp.local, "QU" question ANY cjqg._smb._tcp.local, "QU" question ANY cjqg._companion-link._tcp.local, "QU" question PTR Google-Home-Mini-2c3f16b2da5c4b6fd6cfbfba61c12490._googlecast._tcp.local PTR cjqg._companion-link._tcp.local SRV 0 0 445 cjqg.local SRV 0 0 53785 cjqg.local OPT"
"134","6.586938300","fe80::1cc7:6d9a:a312:7e8f","ff02::fb","MDNS","308","Standard query response 0x0000 PTR _smb._tcp.local TXT TXT OPT"
"135","6.592640063","192.168.1.100","224.0.0.251","MDNS","600","Standard query 0x0000 PTR _googlecast._tcp.local, "QU" question PTR _homekit._tcp.local, "QU" question PTR _uscan._tcp.local, "QU" question PTR _ptp._tcp.local, "QU" question PTR _ippusb._tcp.local, "QU" question PTR _scanner._tcp.local, "QU" question PTR _ipp._tcp.local, "QU" question PTR _pdl-datastream._tcp.local, "QU" question PTR _uscans._tcp.local, "QU" question PTR _ipps._tcp.local, "QU" question PTR _printer._tcp.local, "QU" question PTR _airplay._tcp.local, "QU" question PTR _raop._tcp.local, "QU" question PTR _airport._tcp.local, "QU" question PTR _rdlink._tcp.local, "QU" question PTR _companion-link._tcp.local, "QU" question PTR _afpovertcp._tcp.local, "QU" question PTR _rfb._tcp.local, "QU" question PTR _adisk._tcp.local, "QU" question PTR _apple-mobdev._tcp.local, "QU" question PTR 8ed307c3._sub._apple-mobdev2._tcp.local, "QU" question PTR _apple-pairable._tcp.local, "QU" question TXT Google-Home-Mini-2c3f16b2da5c4b6fd6cfbfba61c12490._googlecast._tcp.local, "QU" question ANY cjqg._smb._tcp.local, "QU" question ANY cjqg._companion-link._tcp.local, "QU" question PTR Google-Home-Mini-2c3f16b2da5c4b6fd6cfbfba61c12490._googlecast._tcp.local PTR cjqg._companion-link._tcp.local SRV 0 0 445 cjqg.local SRV 0 0 53785 cjqg.local OPT"
"136","6.595895938","192.168.1.100","224.0.0.251","MDNS","288","Standard query response 0x0000 PTR _smb._tcp.local TXT TXT OPT"
"137","6.789036313","192.168.1.101","224.0.0.251","MDNS","181","Standard query 0x0000 ANY cjqg._smb._tcp.local, "QM" question ANY cjqg._companion-link._tcp.local, "QM" question SRV 0 0 445 cjqg.local SRV 0 0 53785 cjqg.local OPT"
"138","6.791550725","fe80::1814:2ecf:2c8a:d90d","ff02::fb","MDNS","201","Standard query 0x0000 ANY cjqg._smb._tcp.local, "QM" question ANY cjqg._companion-link._tcp.local, "QM" question SRV 0 0 445 cjqg.local SRV 0 0 53785 cjqg.local OPT"
"139","6.794401475","fe80::1cc7:6d9a:a312:7e8f","ff02::fb","MDNS","195","Standard query 0x0000 ANY cjqg._smb._tcp.local, "QM" question ANY cjqg._companion-link._tcp.local, "QM" question SRV 0 0 445 cjqg.local SRV 0 0 53785 cjqg.local OPT"
"140","6.797522525","192.168.1.100","224.0.0.251","MDNS","175","Standard query 0x0000 ANY cjqg._smb._tcp.local, "QM" question ANY cjqg._companion-link._tcp.local, "QM" question SRV 0 0 445 cjqg.local SRV 0 0 53785 cjqg.local OPT"
"141","6.942512188","IntelCor_b7:52:73","Broadcast","ARP","60","Who has 192.168.1.1? Tell 192.168.1.118"
"142","6.946468188","Cisco-Li_5b:1c:ce","IntelCor_b7:52:73","ARP","42","192.168.1.1 is at 58:6d:8f:5b:1c:ce"
"143","6.990881738","192.168.1.101","224.0.0.251","MDNS","181","Standard query 0x0000 ANY cjqg._smb._tcp.local, "QM" question ANY cjqg._companion-link._tcp.local, "QM" question SRV 0 0 445 cjqg.local SRV 0 0 53785 cjqg.local OPT"
"144","6.993406888","fe80::1814:2ecf:2c8a:d90d","ff02::fb","MDNS","201","Standard query 0x0000 ANY cjqg._smb._tcp.local, "QM" question ANY cjqg._companion-link._tcp.local, "QM" question SRV 0 0 445 cjqg.local SRV 0 0 53785 cjqg.local OPT"
"145","6.996032938","fe80::1cc7:6d9a:a312:7e8f","ff02::fb","MDNS","195","Standard query 0x0000 ANY cjqg._smb._tcp.local, "QM" question ANY cjqg._companion-link._tcp.local, "QM" question SRV 0 0 445 cjqg.local SRV 0 0 53785 cjqg.local OPT"
"146","6.998395200","192.168.1.100","224.0.0.251","MDNS","175","Standard query 0x0000 ANY cjqg._smb._tcp.local, "QM" question ANY cjqg._companion-link._tcp.local, "QM" question SRV 0 0 445 cjqg.local SRV 0 0 53785 cjqg.local OPT"
"147","7.299394438","192.168.1.101","224.0.0.251","MDNS","530","Standard query response 0x0000 TXT, cache flush PTR cjqg._smb._tcp.local TXT SRV, cache flush 0 0 445 cjqg.local TXT, cache flush PTR _companion-link._tcp.local PTR cjqg._companion-link._tcp.local SRV, cache flush 0 0 53785 cjqg.local AAAA, cache flush fe80::1814:2ecf:2c8a:d90d A, cache flush 192.168.1.101 NSEC, cache flush cjqg._smb._tcp.local NSEC, cache flush cjqg._companion-link._tcp.local NSEC, cache flush cjqg.local OPT"
"148","7.505100638","192.168.1.101","224.0.0.251","MDNS","539","Standard query 0x0000 PTR _googlecast._tcp.local, "QM" question PTR _homekit._tcp.local, "QM" question PTR _uscan._tcp.local, "QM" question PTR _ptp._tcp.local, "QM" question PTR _ippusb._tcp.local, "QM" question PTR _scanner._tcp.local, "QM" question PTR _ipp._tcp.local, "QM" question PTR _pdl-datastream._tcp.local, "QM" question PTR _uscans._tcp.local, "QM" question PTR _ipps._tcp.local, "QM" question PTR _printer._tcp.local, "QM" question PTR _airplay._tcp.local, "QM" question PTR _raop._tcp.local, "QM" question PTR _airport._tcp.local, "QM" question PTR _rdlink._tcp.local, "QM" question PTR _companion-link._tcp.local, "QM" question PTR _afpovertcp._tcp.local, "QM" question PTR _rfb._tcp.local, "QM" question PTR _adisk._tcp.local, "QM" question PTR _apple-mobdev._tcp.local, "QM" question PTR 8ed307c3._sub._apple-mobdev2._tcp.local, "QM" question PTR _apple-pairable._tcp.local, "QM" question TXT Google-Home-Mini-2c3f16b2da5c4b6fd6cfbfba61c12490._googlecast._tcp.local, "QM" question PTR Google-Home-Mini-2c3f16b2da5c4b6fd6cfbfba61c12490._googlecast._tcp.local PTR cjqg._companion-link._tcp.local OPT"
"149","7.510480525","fe80::1814:2ecf:2c8a:d90d","ff02::fb","MDNS","559","Standard query 0x0000 PTR _googlecast._tcp.local, "QM" question PTR _homekit._tcp.local, "QM" question PTR _uscan._tcp.local, "QM" question PTR _ptp._tcp.local, "QM" question PTR _ippusb._tcp.local, "QM" question PTR _scanner._tcp.local, "QM" question PTR _ipp._tcp.local, "QM" question PTR _pdl-datastream._tcp.local, "QM" question PTR _uscans._tcp.local, "QM" question PTR _ipps._tcp.local, "QM" question PTR _printer._tcp.local, "QM" question PTR _airplay._tcp.local, "QM" question PTR _raop._tcp.local, "QM" question PTR _airport._tcp.local, "QM" question PTR _rdlink._tcp.local, "QM" question PTR _companion-link._tcp.local, "QM" question PTR _afpovertcp._tcp.local, "QM" question PTR _rfb._tcp.local, "QM" question PTR _adisk._tcp.local, "QM" question PTR _apple-mobdev._tcp.local, "QM" question PTR 8ed307c3._sub._apple-mobdev2._tcp.local, "QM" question PTR _apple-pairable._tcp.local, "QM" question TXT Google-Home-Mini-2c3f16b2da5c4b6fd6cfbfba61c12490._googlecast._tcp.local, "QM" question PTR Google-Home-Mini-2c3f16b2da5c4b6fd6cfbfba61c12490._googlecast._tcp.local PTR cjqg._companion-link._tcp.local OPT"
"150","7.604581550","192.168.1.104","255.255.255.255","UDP","217","49154 → 6666 Len=175"
"151","7.607899000","192.168.1.102","224.0.0.251","MDNS","183","Standard query response 0x0000 SRV, cache flush 0 0 8009 2c3f16b2-da5c-4b6f-d6cf-bfba61c12490.local"
"152","7.612056538","192.168.1.102","224.0.0.251","MDNS","409","Standard query response 0x0000 PTR Google-Home-Mini-2c3f16b2da5c4b6fd6cfbfba61c12490._googlecast._tcp.local TXT, cache flush SRV, cache flush 0 0 8009 2c3f16b2-da5c-4b6f-d6cf-bfba61c12490.local A, cache flush 192.168.1.102"
"153","7.614519713","192.168.1.102","224.0.0.251","MDNS","183","Standard query response 0x0000 SRV, cache flush 0 0 8009 2c3f16b2-da5c-4b6f-d6cf-bfba61c12490.local"
"154","7.705177113","54.201.42.99","192.168.1.118","TLSv1.2","97","Application Data"
"155","7.705567275","192.168.1.118","54.201.42.99","TLSv1.2","101","Application Data"
"156","7.909860563","54.201.42.99","192.168.1.118","TCP","66","443 → 40600 [ACK] Seq=32 Ack=36 Win=118 Len=0 TSval=334811982 TSecr=2621648986"
"157","8.324347325","192.168.1.101","224.0.0.251","MDNS","530","Standard query response 0x0000 TXT, cache flush PTR cjqg._smb._tcp.local TXT SRV, cache flush 0 0 445 cjqg.local TXT, cache flush PTR _companion-link._tcp.local PTR cjqg._companion-link._tcp.local SRV, cache flush 0 0 53785 cjqg.local AAAA, cache flush fe80::1814:2ecf:2c8a:d90d A, cache flush 192.168.1.101 NSEC, cache flush cjqg._smb._tcp.local NSEC, cache flush cjqg._companion-link._tcp.local NSEC, cache flush cjqg.local OPT"
"158","8.329820938","fe80::1814:2ecf:2c8a:d90d","ff02::fb","MDNS","550","Standard query response 0x0000 TXT, cache flush PTR cjqg._smb._tcp.local TXT SRV, cache flush 0 0 445 cjqg.local TXT, cache flush PTR _companion-link._tcp.local PTR cjqg._companion-link._tcp.local SRV, cache flush 0 0 53785 cjqg.local AAAA, cache flush fe80::1814:2ecf:2c8a:d90d A, cache flush 192.168.1.101 NSEC, cache flush cjqg._smb._tcp.local NSEC, cache flush cjqg._companion-link._tcp.local NSEC, cache flush cjqg.local OPT"
"159","9.552690088","192.168.1.101","224.0.0.251","MDNS","617","Standard query response 0x0000 TXT, cache flush PTR _smb._tcp.local PTR cjqg._smb._tcp.local TXT TXT SRV, cache flush 0 0 445 cjqg.local TXT, cache flush PTR _companion-link._tcp.local PTR cjqg._companion-link._tcp.local SRV, cache flush 0 0 53785 cjqg.local AAAA, cache flush fe80::1814:2ecf:2c8a:d90d A, cache flush 192.168.1.101 NSEC, cache flush cjqg._smb._tcp.local NSEC, cache flush cjqg._companion-link._tcp.local NSEC, cache flush cjqg.local OPT"
"160","9.924526113","192.168.1.118","172.253.63.188","TLSv1.2","99","Application Data"
"161","9.943418275","172.253.63.188","192.168.1.118","TCP","66","5228 → 41484 [ACK] Seq=1 Ack=34 Win=248 Len=0 TSval=3878890234 TSecr=2263950365"
"162","9.950920725","172.253.63.188","192.168.1.118","TLSv1.2","99","Application Data"
"163","9.951973688","192.168.1.118","172.253.63.188","TLSv1.2","109","Application Data"
"164","9.988986625","172.253.63.188","192.168.1.118","TCP","66","5228 → 41484 [ACK] Seq=34 Ack=77 Win=248 Len=0 TSval=3878890280 TSecr=2263950393"
