frame.number,_ws.col.Time,_ws.col.Source,_ws.col.Destination,_ws.col.Protocol,frame.len,_ws.col.Info
"1","0.000000000","172.217.10.142","192.168.1.118","TLSv1.2","1484","Application Data"
"2","0.000596400","172.217.10.142","192.168.1.118","TLSv1.2","1484","Application Data"
"3","0.000725650","192.168.1.118","172.217.10.142","TCP","66","40050 → 443 [ACK] Seq=1 Ack=2837 Win=493 Len=0 TSval=3604892886 TSecr=2091331380"
"4","0.001612037","172.217.10.142","192.168.1.118","TLSv1.2","1484","Application Data"
"5","0.006621500","172.217.10.142","192.168.1.118","TLSv1.2","2902","Application Data, Application Data"
"6","0.006775187","172.217.10.142","192.168.1.118","TLSv1.2","2902","Application Data, Application Data"
"7","0.006945487","172.217.10.142","192.168.1.118","TLSv1.2","2902","Application Data, Application Data"
"8","0.007063775","172.217.10.142","192.168.1.118","TLSv1.2","2902","Application Data, Application Data"
"9","0.007174912","172.217.10.142","192.168.1.118","TLSv1.2","2902","Application Data, Application Data"
"10","0.007280275","172.217.10.142","192.168.1.118","TLSv1.2","2902","Application Data, Application Data"
"11","0.007373762","172.217.10.142","192.168.1.118","TLSv1.2","2902","Application Data, Application Data"
"12","0.007666375","172.217.10.142","192.168.1.118","TLSv1.2","2902","Application Data, Application Data"
"13","0.007726662","172.217.10.142","192.168.1.118","TLSv1.2","1484","Application Data [TCP segment of a reassembled PDU]"
"14","0.010227962","192.168.1.118","172.217.10.142","TCP","66","40050 → 443 [ACK] Seq=1 Ack=28361 Win=294 Len=0 TSval=3604892895 TSecr=2091331380"
"15","0.018129475","172.217.10.142","192.168.1.118","TLSv1.2","1484","Application Data [TCP segment of a reassembled PDU]"
"16","0.019094175","172.217.10.142","192.168.1.118","TLSv1.2","1484","Application Data [TCP segment of a reassembled PDU]"
"17","0.032262775","172.217.10.142","192.168.1.118","TLSv1.2","1484","Application Data [TCP segment of a reassembled PDU]"
"18","0.033395875","192.168.1.118","172.217.10.142","TCP","66","40050 → 443 [ACK] Seq=1 Ack=32615 Win=261 Len=0 TSval=3604892918 TSecr=2091331465"
"19","0.035188750","192.168.1.118","209.18.47.62","DNS","71","Standard query 0xf12d A i.ytimg.com"
"20","0.035937100","192.168.1.118","209.18.47.62","DNS","71","Standard query 0x7954 A i.ytimg.com"
"21","0.036693875","192.168.1.118","209.18.47.62","DNS","71","Standard query 0x6531 A i.ytimg.com"
"22","0.037620900","192.168.1.118","209.18.47.62","DNS","71","Standard query 0x457a A i.ytimg.com"
"23","0.038088412","192.168.1.118","209.18.47.62","DNS","71","Standard query 0xd537 A i.ytimg.com"
"24","0.050492000","172.217.10.142","192.168.1.118","TLSv1.2","1484","Application Data [TCP segment of a reassembled PDU]"
"25","0.050658950","172.217.10.142","192.168.1.118","TLSv1.2","2902","Application Data, Application Data"
"26","0.050776037","172.217.10.142","192.168.1.118","TLSv1.2","2902","Application Data, Application Data"
"27","0.050878800","172.217.10.142","192.168.1.118","TLSv1.2","2902","Application Data, Application Data"
"28","0.054677750","172.217.10.142","192.168.1.118","TLSv1.2","2902","Application Data, Application Data"
"29","0.054813550","172.217.10.142","192.168.1.118","TLSv1.2","2699","Application Data, Application Data, Application Data, Application Data"
"30","0.059489637","209.18.47.62","192.168.1.118","DNS","87","Standard query response 0xf12d A i.ytimg.com A 172.217.10.22"
"31","0.059810900","192.168.1.118","209.18.47.62","DNS","71","Standard query 0xa906 AAAA i.ytimg.com"
"32","0.060526675","209.18.47.62","192.168.1.118","DNS","87","Standard query response 0x7954 A i.ytimg.com A 172.217.6.214"
"33","0.060842437","192.168.1.118","209.18.47.62","DNS","71","Standard query 0x9946 AAAA i.ytimg.com"
"34","0.062226950","209.18.47.62","192.168.1.118","DNS","87","Standard query response 0x6531 A i.ytimg.com A 172.217.10.150"
"35","0.062512500","192.168.1.118","209.18.47.62","DNS","71","Standard query 0x7100 AAAA i.ytimg.com"
"36","0.062920250","209.18.47.62","192.168.1.118","DNS","87","Standard query response 0xd537 A i.ytimg.com A 172.217.12.150"
"37","0.063132887","192.168.1.118","209.18.47.62","DNS","71","Standard query 0xf50e AAAA i.ytimg.com"
"38","0.064753000","209.18.47.62","192.168.1.118","DNS","87","Standard query response 0x457a A i.ytimg.com A 172.217.12.150"
"39","0.064966600","192.168.1.118","209.18.47.62","DNS","71","Standard query 0xbd8d AAAA i.ytimg.com"
"40","0.069122300","192.168.1.118","172.217.10.142","TCP","66","40050 → 443 [ACK] Seq=1 Ack=48010 Win=141 Len=0 TSval=3604892954 TSecr=2091331476"
"41","0.075530462","192.168.1.118","192.168.1.102","TCP","176","44768 → 8009 [PSH, ACK] Seq=1 Ack=1 Win=501 Len=110 TSval=2256840179 TSecr=5136220 [TCP segment of a reassembled PDU]"
"42","0.082247837","209.18.47.62","192.168.1.118","DNS","99","Standard query response 0xa906 AAAA i.ytimg.com AAAA 2607:f8b0:4006:802::2016"
"43","0.083553375","209.18.47.62","192.168.1.118","DNS","99","Standard query response 0x9946 AAAA i.ytimg.com AAAA 2607:f8b0:4006:804::2016"
"44","0.086459175","209.18.47.62","192.168.1.118","DNS","99","Standard query response 0x7100 AAAA i.ytimg.com AAAA 2607:f8b0:4006:812::2016"
"45","0.087444037","209.18.47.62","192.168.1.118","DNS","99","Standard query response 0xf50e AAAA i.ytimg.com AAAA 2607:f8b0:4006:819::2016"
"46","0.088577575","209.18.47.62","192.168.1.118","DNS","99","Standard query response 0xbd8d AAAA i.ytimg.com AAAA 2607:f8b0:4006:819::2016"
"47","0.090275025","192.168.1.102","192.168.1.118","TCP","176","8009 → 44768 [PSH, ACK] Seq=1 Ack=111 Win=294 Len=110 TSval=5136721 TSecr=2256840179 [TCP segment of a reassembled PDU]"
"48","0.090372075","192.168.1.118","192.168.1.102","TCP","66","44768 → 8009 [ACK] Seq=111 Ack=111 Win=501 Len=0 TSval=2256840193 TSecr=5136721"
"49","0.100737662","192.168.1.118","172.217.6.214","TCP","74","33132 → 443 [SYN] Seq=0 Win=64240 Len=0 MSS=1460 SACK_PERM=1 TSval=1718298591 TSecr=0 WS=128"
"50","0.100875087","192.168.1.118","172.217.6.214","TCP","74","33134 → 443 [SYN] Seq=0 Win=64240 Len=0 MSS=1460 SACK_PERM=1 TSval=1718298591 TSecr=0 WS=128"
"51","0.100954925","192.168.1.118","172.217.6.214","TCP","74","33136 → 443 [SYN] Seq=0 Win=64240 Len=0 MSS=1460 SACK_PERM=1 TSval=1718298591 TSecr=0 WS=128"
"52","0.101030512","192.168.1.118","172.217.6.214","TCP","74","33138 → 443 [SYN] Seq=0 Win=64240 Len=0 MSS=1460 SACK_PERM=1 TSval=1718298591 TSecr=0 WS=128"
"53","0.101104762","192.168.1.118","172.217.6.214","TCP","74","33140 → 443 [SYN] Seq=0 Win=64240 Len=0 MSS=1460 SACK_PERM=1 TSval=1718298591 TSecr=0 WS=128"
"54","0.115465837","192.168.1.118","172.217.10.142","TCP","66","[TCP Window Update] 40050 → 443 [ACK] Seq=1 Ack=48010 Win=285 Len=0 TSval=3604893001 TSecr=2091331476"
"55","0.115635837","192.168.1.118","209.18.47.62","DNS","75","Standard query 0xd50d A www.gstatic.com"
"56","0.118783625","172.217.6.214","192.168.1.118","TCP","74","443 → 33132 [SYN, ACK] Seq=0 Ack=1 Win=60192 Len=0 MSS=1380 SACK_PERM=1 TSval=1509508129 TSecr=1718298591 WS=256"
"57","0.118841675","192.168.1.118","172.217.6.214","TCP","66","33132 → 443 [ACK] Seq=1 Ack=1 Win=64256 Len=0 TSval=1718298609 TSecr=1509508129"
"58","0.121318975","172.217.6.214","192.168.1.118","TCP","74","443 → 33134 [SYN, ACK] Seq=0 Ack=1 Win=60192 Len=0 MSS=1380 SACK_PERM=1 TSval=3570016020 TSecr=1718298591 WS=256"
"59","0.121345612","192.168.1.118","172.217.6.214","TCP","66","33134 → 443 [ACK] Seq=1 Ack=1 Win=64256 Len=0 TSval=1718298611 TSecr=3570016020"
"60","0.122692112","172.217.6.214","192.168.1.118","TCP","74","443 → 33136 [SYN, ACK] Seq=0 Ack=1 Win=60192 Len=0 MSS=1380 SACK_PERM=1 TSval=1632433016 TSecr=1718298591 WS=256"
"61","0.122717112","192.168.1.118","172.217.6.214","TCP","66","33136 → 443 [ACK] Seq=1 Ack=1 Win=64256 Len=0 TSval=1718298613 TSecr=1632433016"
"62","0.123961450","172.217.6.214","192.168.1.118","TCP","74","443 → 33140 [SYN, ACK] Seq=0 Ack=1 Win=60192 Len=0 MSS=1380 SACK_PERM=1 TSval=256629983 TSecr=1718298591 WS=256"
"63","0.123985587","192.168.1.118","172.217.6.214","TCP","66","33140 → 443 [ACK] Seq=1 Ack=1 Win=64256 Len=0 TSval=1718298614 TSecr=256629983"
"64","0.124003025","172.217.6.214","192.168.1.118","TCP","74","443 → 33138 [SYN, ACK] Seq=0 Ack=1 Win=60192 Len=0 MSS=1380 SACK_PERM=1 TSval=256629983 TSecr=1718298591 WS=256"
"65","0.124026500","192.168.1.118","172.217.6.214","TCP","66","33138 → 443 [ACK] Seq=1 Ack=1 Win=64256 Len=0 TSval=1718298614 TSecr=256629983"
"66","0.139588512","209.18.47.62","192.168.1.118","DNS","91","Standard query response 0xd50d A www.gstatic.com A 172.217.10.227"
"67","0.139701850","192.168.1.118","209.18.47.62","DNS","75","Standard query 0xa9b1 AAAA www.gstatic.com"
"68","0.157299462","192.168.1.118","172.217.6.214","TLSv1","583","Client Hello"
"69","0.157606212","209.18.47.62","192.168.1.118","DNS","103","Standard query response 0xa9b1 AAAA www.gstatic.com AAAA 2607:f8b0:4006:813::2003"
"70","0.174026437","172.217.6.214","192.168.1.118","TCP","66","443 → 33132 [ACK] Seq=1 Ack=518 Win=61440 Len=0 TSval=1509508188 TSecr=1718298647"
"71","0.174523225","192.168.1.118","172.217.6.214","TLSv1","583","Client Hello"
"72","0.181713500","172.217.6.214","192.168.1.118","TLSv1.2","1484","Server Hello"
"73","0.181775150","192.168.1.118","172.217.6.214","TCP","66","33132 → 443 [ACK] Seq=518 Ack=1419 Win=63104 Len=0 TSval=1718298672 TSecr=1509508194"
"74","0.183739412","172.217.6.214","192.168.1.118","TLSv1.2","1719","Certificate, Server Key Exchange, Server Hello Done"
"75","0.183792787","192.168.1.118","172.217.6.214","TCP","66","33132 → 443 [ACK] Seq=518 Ack=3072 Win=61568 Len=0 TSval=1718298674 TSecr=1509508194"
"76","0.191543262","192.168.1.118","172.217.6.214","TLSv1","583","Client Hello"
"77","0.205744650","172.217.6.214","192.168.1.118","TCP","66","443 → 33134 [ACK] Seq=1 Ack=518 Win=61440 Len=0 TSval=3570016110 TSecr=1718298665"
"78","0.208069275","192.168.1.118","172.217.6.214","TLSv1","583","Client Hello"
"79","0.213480787","172.217.6.214","192.168.1.118","TLSv1.2","1484","Server Hello"
"80","0.213566750","192.168.1.118","172.217.6.214","TCP","66","33134 → 443 [ACK] Seq=518 Ack=1419 Win=63104 Len=0 TSval=1718298704 TSecr=3570016117"
"81","0.214983725","172.217.6.214","192.168.1.118","TLSv1.2","1719","Certificate, Server Key Exchange, Server Hello Done"
"82","0.215071150","192.168.1.118","172.217.6.214","TCP","66","33134 → 443 [ACK] Seq=518 Ack=3072 Win=61568 Len=0 TSval=1718298705 TSecr=3570016117"
"83","0.215154225","172.217.6.214","192.168.1.118","TCP","66","443 → 33136 [ACK] Seq=1 Ack=518 Win=61440 Len=0 TSval=1632433108 TSecr=1718298682"
"84","0.222438725","172.217.6.214","192.168.1.118","TLSv1.2","1484","Server Hello"
"85","0.222519112","192.168.1.118","172.217.6.214","TCP","66","33136 → 443 [ACK] Seq=518 Ack=1419 Win=63104 Len=0 TSval=1718298713 TSecr=1632433115"
"86","0.223945400","172.217.6.214","192.168.1.118","TLSv1.2","1719","Certificate, Server Key Exchange, Server Hello Done"
"87","0.224029887","192.168.1.118","172.217.6.214","TCP","66","33136 → 443 [ACK] Seq=518 Ack=3072 Win=61568 Len=0 TSval=1718298714 TSecr=1632433115"
"88","0.224535900","192.168.1.118","172.217.6.214","TLSv1","583","Client Hello"
"89","0.224745112","192.168.1.118","172.217.10.227","TCP","74","35208 → 443 [SYN] Seq=0 Win=64240 Len=0 MSS=1460 SACK_PERM=1 TSval=2808540004 TSecr=0 WS=128"
"90","0.226993750","192.168.1.118","172.217.6.214","TLSv1.2","192","Client Key Exchange, Change Cipher Spec, Encrypted Handshake Message"
"91","0.228876037","192.168.1.118","172.217.6.214","TLSv1.2","192","Client Key Exchange, Change Cipher Spec, Encrypted Handshake Message"
"92","0.230747687","192.168.1.118","172.217.6.214","TLSv1.2","192","Client Key Exchange, Change Cipher Spec, Encrypted Handshake Message"
"93","0.241576150","172.217.6.214","192.168.1.118","TCP","66","443 → 33138 [ACK] Seq=1 Ack=518 Win=61440 Len=0 TSval=256630099 TSecr=1718298698"
"94","0.246143212","172.217.6.214","192.168.1.118","TLSv1.2","1484","Server Hello"
"95","0.246229962","192.168.1.118","172.217.6.214","TCP","66","33138 → 443 [ACK] Seq=518 Ack=1419 Win=63104 Len=0 TSval=1718298736 TSecr=256630106"
"96","0.247020925","192.168.1.118","209.18.47.62","DNS","73","Standard query 0x61e8 A yt3.ggpht.com"
"97","0.249562825","172.217.6.214","192.168.1.118","TLSv1.2","1484","Certificate [TCP segment of a reassembled PDU]"
"98","0.249646937","192.168.1.118","172.217.6.214","TCP","66","33138 → 443 [ACK] Seq=518 Ack=2837 Win=61696 Len=0 TSval=1718298740 TSecr=256630106"
"99","0.249700025","172.217.6.214","192.168.1.118","TLSv1.2","301","Server Key Exchange, Server Hello Done"
"100","0.249779450","192.168.1.118","172.217.6.214","TCP","66","33138 → 443 [ACK] Seq=518 Ack=3072 Win=61568 Len=0 TSval=1718298740 TSecr=256630107"
"101","0.250965162","172.217.6.214","192.168.1.118","TCP","66","443 → 33140 [ACK] Seq=1 Ack=518 Win=61440 Len=0 TSval=256630112 TSecr=1718298715"
"102","0.252766375","172.217.6.214","192.168.1.118","TLSv1.2","117","Change Cipher Spec, Encrypted Handshake Message"
"103","0.252882400","192.168.1.118","172.217.6.214","TCP","66","33132 → 443 [ACK] Seq=644 Ack=3123 Win=64128 Len=0 TSval=1718298743 TSecr=1509508265"
"104","0.252960637","172.217.6.214","192.168.1.118","TLSv1.2","117","Change Cipher Spec, Encrypted Handshake Message"
"105","0.254832962","172.217.10.227","192.168.1.118","TCP","74","443 → 35208 [SYN, ACK] Seq=0 Ack=1 Win=60192 Len=0 MSS=1380 SACK_PERM=1 TSval=3318902609 TSecr=2808540004 WS=256"
"106","0.254992662","192.168.1.118","172.217.10.227","TCP","66","35208 → 443 [ACK] Seq=1 Ack=1 Win=64256 Len=0 TSval=2808540034 TSecr=3318902609"
"107","0.256344275","192.168.1.118","172.217.6.214","TLSv1.2","363","Application Data"
"108","0.256594087","192.168.1.118","172.217.6.214","TLSv1.2","363","Application Data"
"109","0.258325662","172.217.6.214","192.168.1.118","TLSv1.2","117","Change Cipher Spec, Encrypted Handshake Message"
"110","0.258445800","192.168.1.118","172.217.6.214","TLSv1.2","192","Client Key Exchange, Change Cipher Spec, Encrypted Handshake Message"
"111","0.259911612","172.217.6.214","192.168.1.118","TLSv1.2","3137","Server Hello, Certificate, Server Key Exchange, Server Hello Done"
"112","0.259957700","192.168.1.118","172.217.6.214","TCP","66","33140 → 443 [ACK] Seq=518 Ack=3072 Win=61312 Len=0 TSval=1718298750 TSecr=256630120"
"113","0.267572100","209.18.47.62","192.168.1.118","DNS","134","Standard query response 0x61e8 A yt3.ggpht.com CNAME photos-ugc.l.googleusercontent.com A 172.217.10.225"
"114","0.267778525","192.168.1.118","209.18.47.62","DNS","73","Standard query 0x217f AAAA yt3.ggpht.com"
"115","0.274701862","192.168.1.118","172.217.10.227","TLSv1","583","Client Hello"
"116","0.275704537","192.168.1.118","172.217.6.214","TLSv1.2","363","Application Data"
"117","0.275772162","192.168.1.118","209.18.47.62","DNS","73","Standard query 0xb561 A yt3.ggpht.com"
"118","0.276759437","172.217.6.214","192.168.1.118","TLSv1.2","117","Change Cipher Spec, Encrypted Handshake Message"
"119","0.277639987","192.168.1.118","172.217.6.214","TLSv1.2","192","Client Key Exchange, Change Cipher Spec, Encrypted Handshake Message"
"120","0.281336550","172.217.6.214","192.168.1.118","TLSv1.2","1484","Application Data"
"121","0.281458637","172.217.6.214","192.168.1.118","TLSv1.2","2902","Application Data, Application Data"
"122","0.281531275","172.217.6.214","192.168.1.118","TLSv1.2","1484","Application Data"
"123","0.281676262","172.217.6.214","192.168.1.118","TLSv1.2","2902","Application Data, Application Data"
"124","0.281753762","172.217.6.214","192.168.1.118","TLSv1.2","1484","Application Data"
"125","0.281837487","172.217.6.214","192.168.1.118","TLSv1.2","1484","Application Data"
"126","0.283257787","172.217.6.214","192.168.1.118","TLSv1.2","1484","Application Data"
"127","0.283381787","172.217.6.214","192.168.1.118","TLSv1.2","4816","Application Data, Application Data, Application Data, Application Data"
"128","0.283460037","172.217.6.214","192.168.1.118","TLSv1.2","1032","Application Data"
"129","0.283983437","209.18.47.62","192.168.1.118","DNS","146","Standard query response 0x217f AAAA yt3.ggpht.com CNAME photos-ugc.l.googleusercontent.com AAAA 2607:f8b0:4006:813::2001"
"130","0.291065487","192.168.1.118","172.217.6.214","TCP","66","33132 → 443 [ACK] Seq=941 Ack=12597 Win=54656 Len=0 TSval=1718298781 TSecr=1509508290"
"131","0.291239025","192.168.1.118","172.217.6.214","TCP","66","33134 → 443 [ACK] Seq=941 Ack=12127 Win=55168 Len=0 TSval=1718298781 TSecr=3570016182"
"132","0.291640925","192.168.1.118","172.217.6.214","TLSv1.2","363","Application Data"
"133","0.291822475","192.168.1.118","172.217.10.225","TCP","74","43398 → 443 [SYN] Seq=0 Win=64240 Len=0 MSS=1460 SACK_PERM=1 TSval=2859259702 TSecr=0 WS=128"
"134","0.291935287","192.168.1.118","172.217.10.225","TCP","74","43400 → 443 [SYN] Seq=0 Win=64240 Len=0 MSS=1460 SACK_PERM=1 TSval=2859259702 TSecr=0 WS=128"
"135","0.292042925","192.168.1.118","172.217.10.225","TCP","74","43402 → 443 [SYN] Seq=0 Win=64240 Len=0 MSS=1460 SACK_PERM=1 TSval=2859259702 TSecr=0 WS=128"
"136","0.294247187","172.217.10.227","192.168.1.118","TCP","66","443 → 35208 [ACK] Seq=1 Ack=518 Win=61440 Len=0 TSval=3318902651 TSecr=2808540054"
"137","0.304269725","192.168.1.118","172.217.6.214","TLSv1.2","363","Application Data"
"138","0.304415725","192.168.1.118","172.217.6.214","TLSv1.2","363","Application Data"
"139","0.305314150","172.217.10.227","192.168.1.118","TLSv1.2","1484","Server Hello"
"140","0.305408537","192.168.1.118","172.217.10.227","TCP","66","35208 → 443 [ACK] Seq=518 Ack=1419 Win=63104 Len=0 TSval=2808540084 TSecr=3318902657"
"141","0.311132050","172.217.10.227","192.168.1.118","TLSv1.2","1308","Certificate, Server Key Exchange, Server Hello Done"
"142","0.311209175","192.168.1.118","172.217.10.227","TCP","66","35208 → 443 [ACK] Seq=518 Ack=2661 Win=63104 Len=0 TSval=2808540090 TSecr=3318902657"
"143","0.311296587","209.18.47.62","192.168.1.118","DNS","134","Standard query response 0xb561 A yt3.ggpht.com CNAME photos-ugc.l.googleusercontent.com A 172.217.10.129"
"144","0.311401400","172.217.6.214","192.168.1.118","TLSv1.2","117","Change Cipher Spec, Encrypted Handshake Message"
"145","0.311493037","172.217.6.214","192.168.1.118","TLSv1.2","1484","Application Data"
"146","0.311625725","172.217.6.214","192.168.1.118","TLSv1.2","2902","Application Data, Application Data"
"147","0.311759125","172.217.6.214","192.168.1.118","TLSv1.2","4320","Application Data, Application Data, Application Data"
"148","0.311874337","172.217.6.214","192.168.1.118","TLSv1.2","1066","Application Data"
"149","0.312166062","192.168.1.118","209.18.47.62","DNS","73","Standard query 0xc561 AAAA yt3.ggpht.com"
"150","0.313841350","192.168.1.118","172.217.6.214","TCP","66","33136 → 443 [ACK] Seq=941 Ack=12631 Win=54656 Len=0 TSval=1718298804 TSecr=1632433198"
"151","0.314323637","192.168.1.118","172.217.6.214","TLSv1.2","363","Application Data"
"152","0.316445962","192.168.1.118","172.217.10.227","TLSv1.2","192","Client Key Exchange, Change Cipher Spec, Encrypted Handshake Message"
"153","0.317155762","172.217.6.214","192.168.1.118","TLSv1.2","1484","Application Data"
"154","0.320266425","172.217.6.214","192.168.1.118","TLSv1.2","1484","Application Data"
"155","0.320374962","172.217.6.214","192.168.1.118","TLSv1.2","2902","Application Data, Application Data"
"156","0.320502800","172.217.10.225","192.168.1.118","TCP","74","443 → 43402 [SYN, ACK] Seq=0 Ack=1 Win=60192 Len=0 MSS=1380 SACK_PERM=1 TSval=1987272756 TSecr=2859259702 WS=256"
"157","0.320635250","192.168.1.118","172.217.10.225","TCP","66","43402 → 443 [ACK] Seq=1 Ack=1 Win=64256 Len=0 TSval=2859259731 TSecr=1987272756"
"158","0.320702700","172.217.6.214","192.168.1.118","TLSv1.2","2902","Application Data, Application Data"
"159","0.321502175","192.168.1.118","172.217.6.214","TCP","66","33138 → 443 [ACK] Seq=941 Ack=11631 Win=55680 Len=0 TSval=1718298812 TSecr=256630177"
"160","0.322897425","172.217.10.225","192.168.1.118","TCP","74","443 → 43400 [SYN, ACK] Seq=0 Ack=1 Win=60192 Len=0 MSS=1380 SACK_PERM=1 TSval=1987272756 TSecr=2859259702 WS=256"
"161","0.322961287","192.168.1.118","172.217.10.225","TCP","66","43400 → 443 [ACK] Seq=1 Ack=1 Win=64256 Len=0 TSval=2859259733 TSecr=1987272756"
"162","0.323009137","172.217.6.214","192.168.1.118","TLSv1.2","1484","Application Data"
"163","0.323058750","172.217.10.225","192.168.1.118","TCP","74","443 → 43398 [SYN, ACK] Seq=0 Ack=1 Win=60192 Len=0 MSS=1380 SACK_PERM=1 TSval=3022222674 TSecr=2859259702 WS=256"
"164","0.323117787","192.168.1.118","172.217.10.225","TCP","66","43398 → 443 [ACK] Seq=1 Ack=1 Win=64256 Len=0 TSval=2859259733 TSecr=3022222674"
"165","0.323163175","172.217.6.214","192.168.1.118","TLSv1.2","1259","Application Data"
"166","0.323219162","172.217.6.214","192.168.1.118","TLSv1.2","1484","Application Data"
"167","0.323270550","172.217.6.214","192.168.1.118","TLSv1.2","1484","Application Data"
"168","0.323326325","172.217.6.214","192.168.1.118","TLSv1.2","2902","Application Data, Application Data"
"169","0.323386862","172.217.6.214","192.168.1.118","TLSv1.2","2902","Application Data, Application Data"
"170","0.323444712","172.217.6.214","192.168.1.118","TLSv1.2","2902","Application Data, Application Data"
"171","0.323486962","172.217.6.214","192.168.1.118","TLSv1.2","167","Application Data"
"172","0.325677850","209.18.47.62","192.168.1.118","DNS","146","Standard query response 0xc561 AAAA yt3.ggpht.com CNAME photos-ugc.l.googleusercontent.com AAAA 2607:f8b0:4006:812::2001"
"173","0.325730250","172.217.6.214","192.168.1.118","TLSv1.2","2902","Application Data, Application Data"
"174","0.325759300","172.217.6.214","192.168.1.118","TLSv1.2","672","Application Data"
"175","0.337993675","192.168.1.118","172.217.10.225","TLSv1","583","Client Hello"
"176","0.338117562","192.168.1.118","172.217.6.214","TCP","66","33132 → 443 [ACK] Seq=1238 Ack=23129 Win=53632 Len=0 TSval=1718298828 TSecr=1509508333"
"177","0.338269225","192.168.1.118","172.217.6.214","TCP","66","33134 → 443 [ACK] Seq=1238 Ack=17900 Win=58368 Len=0 TSval=1718298828 TSecr=3570016223"
"178","0.344066775","172.217.6.214","192.168.1.118","TLSv1.2","1484","Application Data"
"179","0.345525650","172.217.6.214","192.168.1.118","TLSv1.2","2902","Application Data, Application Data"
"180","0.345675212","172.217.10.227","192.168.1.118","TLSv1.2","117","Change Cipher Spec, Encrypted Handshake Message"
"181","0.345733350","172.217.6.214","192.168.1.118","TLSv1.2","5738","Application Data, Application Data, Application Data, Application Data"
"182","0.346551112","172.217.6.214","192.168.1.118","TLSv1.2","1260","Application Data"
"183","0.354578912","172.217.10.225","192.168.1.118","TCP","66","443 → 43402 [ACK] Seq=1 Ack=518 Win=61440 Len=0 TSval=1987272794 TSecr=2859259748"
"184","0.354917637","192.168.1.118","172.217.10.225","TLSv1","583","Client Hello"
"185","0.361382587","172.217.10.225","192.168.1.118","TLSv1.2","1484","Server Hello"
"186","0.361473587","192.168.1.118","172.217.10.225","TCP","66","43402 → 443 [ACK] Seq=518 Ack=1419 Win=63104 Len=0 TSval=2859259772 TSecr=1987272800"
"187","0.363042300","172.217.10.225","192.168.1.118","TLSv1.2","3880","Certificate, Server Key Exchange, Server Hello Done"
"188","0.363129637","192.168.1.118","172.217.10.225","TCP","66","43402 → 443 [ACK] Seq=518 Ack=5233 Win=59392 Len=0 TSval=2859259773 TSecr=1987272800"
"189","0.363915637","192.168.1.118","172.217.6.214","TCP","66","33138 → 443 [ACK] Seq=941 Ack=12824 Win=54528 Len=0 TSval=1718298854 TSecr=256630179"
"190","0.371419712","192.168.1.118","172.217.10.225","TLSv1","583","Client Hello"
"191","0.373501812","172.217.10.225","192.168.1.118","TCP","66","443 → 43398 [ACK] Seq=1 Ack=518 Win=61440 Len=0 TSval=3022222731 TSecr=2859259765"
"192","0.373833137","192.168.1.118","172.217.10.225","TLSv1.2","192","Client Key Exchange, Change Cipher Spec, Encrypted Handshake Message"
"193","0.377895875","192.168.1.118","172.217.6.214","TCP","66","33140 → 443 [ACK] Seq=941 Ack=14243 Win=53120 Len=0 TSval=1718298868 TSecr=256630204"
"194","0.378327312","192.168.1.118","172.217.10.227","TLSv1.2","390","Application Data"
"195","0.381699175","192.168.1.118","172.217.6.214","TLSv1.2","363","Application Data"
"196","0.383201950","172.217.10.225","192.168.1.118","TLSv1.2","1484","Server Hello"
"197","0.383265087","192.168.1.118","172.217.10.225","TCP","66","43398 → 443 [ACK] Seq=518 Ack=1419 Win=63104 Len=0 TSval=2859259793 TSecr=3022222737"
"198","0.385556487","192.168.1.118","172.217.6.214","TLSv1.2","363","Application Data"
"199","0.385683600","192.168.1.118","172.217.6.214","TLSv1.2","363","Application Data"
"200","0.386843487","172.217.10.225","192.168.1.118","TLSv1.2","3881","Certificate, Server Key Exchange, Server Hello Done"
"201","0.386916187","192.168.1.118","172.217.10.225","TCP","66","43398 → 443 [ACK] Seq=518 Ack=5234 Win=59392 Len=0 TSval=2859259797 TSecr=3022222737"
"202","0.387823550","172.217.6.214","192.168.1.118","TLSv1.2","1260","[TCP Spurious Retransmission] , Application Data"
"203","0.387897412","192.168.1.118","172.217.6.214","TCP","78","[TCP Dup ACK 193#1] 33140 → 443 [ACK] Seq=941 Ack=14243 Win=53120 Len=0 TSval=1718298878 TSecr=256630246 SLE=13049 SRE=14243"
"204","0.390779312","192.168.1.118","172.217.10.225","TLSv1.2","192","Client Key Exchange, Change Cipher Spec, Encrypted Handshake Message"
"205","0.391031687","192.168.1.118","172.217.6.214","TLSv1.2","363","Application Data"
"206","0.394271787","192.168.1.118","172.217.6.214","TLSv1.2","442","Application Data"
"207","0.396503837","172.217.10.225","192.168.1.118","TCP","66","443 → 43400 [ACK] Seq=1 Ack=518 Win=61440 Len=0 TSval=1987272836 TSecr=2859259782"
"208","0.398940737","172.217.10.225","192.168.1.118","TLSv1.2","117","Change Cipher Spec, Encrypted Handshake Message"
"209","0.400948512","192.168.1.118","172.217.10.225","TLSv1.2","338","Application Data"
"210","0.403332875","172.217.10.225","192.168.1.118","TLSv1.2","1484","Server Hello"
"211","0.403415300","192.168.1.118","172.217.10.225","TCP","66","43400 → 443 [ACK] Seq=518 Ack=1419 Win=63104 Len=0 TSval=2859259814 TSecr=1987272842"
"212","0.408974112","172.217.10.225","192.168.1.118","TLSv1.2","3880","Certificate, Server Key Exchange, Server Hello Done"
"213","0.409056950","192.168.1.118","172.217.10.225","TCP","66","43400 → 443 [ACK] Seq=518 Ack=5233 Win=59392 Len=0 TSval=2859259819 TSecr=1987272842"
"214","0.410954112","172.217.6.214","192.168.1.118","TLSv1.2","1484","Application Data"
"215","0.411086112","172.217.6.214","192.168.1.118","TLSv1.2","2902","Application Data, Application Data"
"216","0.411167362","172.217.10.227","192.168.1.118","TLSv1.2","469","Application Data"
"217","0.411303212","172.217.6.214","192.168.1.118","TLSv1.2","2902","Application Data, Application Data"
"218","0.411353337","172.217.6.214","192.168.1.118","TLSv1.2","1380","Application Data"
"219","0.411937475","192.168.1.118","172.217.10.225","TLSv1.2","192","Client Key Exchange, Change Cipher Spec, Encrypted Handshake Message"
"220","0.412048525","192.168.1.118","172.217.6.214","TCP","66","33134 → 443 [ACK] Seq=1535 Ack=26304 Win=55808 Len=0 TSval=1718298902 TSecr=3570016309"
"221","0.418198637","172.217.6.214","192.168.1.118","TLSv1.2","1484","Application Data"
"222","0.419398537","192.168.1.118","172.217.6.214","TLSv1.2","363","Application Data"
"223","0.419895250","172.217.6.214","192.168.1.118","TLSv1.2","1484","Application Data"
"224","0.419993612","172.217.6.214","192.168.1.118","TLSv1.2","1484","Application Data"
"225","0.420084562","192.168.1.118","172.217.6.214","TCP","66","33138 → 443 [ACK] Seq=1238 Ack=14242 Win=63104 Len=0 TSval=1718298910 TSecr=256630275"
"226","0.420194612","172.217.6.214","192.168.1.118","TLSv1.2","2902","Application Data, Application Data"
"227","0.420299425","172.217.6.214","192.168.1.118","TLSv1.2","2902","Application Data, Application Data"
"228","0.420384087","172.217.6.214","192.168.1.118","TLSv1.2","1484","Application Data"
"229","0.420457500","192.168.1.118","172.217.6.214","TCP","66","33138 → 443 [ACK] Seq=1238 Ack=15660 Win=61696 Len=0 TSval=1718298911 TSecr=256630276"
"230","0.420601425","172.217.6.214","192.168.1.118","TLSv1.2","1484","Application Data"
"231","0.420676587","192.168.1.118","172.217.6.214","TCP","66","33138 → 443 [ACK] Seq=1238 Ack=17078 Win=60288 Len=0 TSval=1718298911 TSecr=256630276"
"232","0.420754750","172.217.10.225","192.168.1.118","TLSv1.2","117","Change Cipher Spec, Encrypted Handshake Message"
"233","0.420844725","172.217.6.214","192.168.1.118","TLSv1.2","1484","Application Data"
"234","0.420962550","192.168.1.118","172.217.6.214","TCP","66","33140 → 443 [ACK] Seq=1317 Ack=15661 Win=63104 Len=0 TSval=1718298911 TSecr=256630276"
"235","0.421071937","172.217.6.214","192.168.1.118","TLSv1.2","2902","Application Data, Application Data"
"236","0.421148287","192.168.1.118","172.217.6.214","TCP","66","33140 → 443 [ACK] Seq=1317 Ack=18497 Win=60288 Len=0 TSval=1718298911 TSecr=256630277"
"237","0.421277237","172.217.6.214","192.168.1.118","TLSv1.2","589","Application Data"
"238","0.421377500","172.217.6.214","192.168.1.118","TLSv1.2","2902","Application Data, Application Data"
"239","0.421426412","172.217.6.214","192.168.1.118","TLSv1.2","1484","Application Data"
"240","0.421492437","192.168.1.118","172.217.6.214","TCP","66","33140 → 443 [ACK] Seq=1317 Ack=19915 Win=58880 Len=0 TSval=1718298912 TSecr=256630278"
"241","0.422154850","192.168.1.118","172.217.10.225","TLSv1.2","338","Application Data"
"242","0.422256537","192.168.1.118","172.217.6.214","TCP","66","33136 → 443 [ACK] Seq=1238 Ack=19721 Win=57088 Len=0 TSval=1718298912 TSecr=1632433308"
"243","0.422503937","192.168.1.118","172.217.6.214","TCP","66","33132 → 443 [ACK] Seq=1535 Ack=27906 Win=59392 Len=0 TSval=1718298913 TSecr=1509508429"
"244","0.427479200","192.168.1.118","172.217.6.214","TLSv1.2","363","Application Data"
"245","0.428296800","172.217.6.214","192.168.1.118","TLSv1.2","1797","Application Data, Application Data"
"246","0.428363937","192.168.1.118","172.217.6.214","TCP","66","33136 → 443 [ACK] Seq=1238 Ack=21452 Win=61056 Len=0 TSval=1718298918 TSecr=1632433311"
"247","0.428440212","172.217.6.214","192.168.1.118","TLSv1.2","1484","Application Data"
"248","0.428502050","192.168.1.118","172.217.6.214","TCP","66","33140 → 443 [ACK] Seq=1317 Ack=21333 Win=63104 Len=0 TSval=1718298919 TSecr=256630278"
"249","0.428577262","172.217.6.214","192.168.1.118","TLSv1.2","2256","Application Data, Application Data"
"250","0.428641300","192.168.1.118","172.217.6.214","TCP","66","33140 → 443 [ACK] Seq=1317 Ack=23523 Win=60928 Len=0 TSval=1718298919 TSecr=256630279"
"251","0.428713625","172.217.6.214","192.168.1.118","TLSv1.2","2902","Application Data, Application Data"
"252","0.428779537","192.168.1.118","172.217.6.214","TCP","66","33138 → 443 [ACK] Seq=1238 Ack=19914 Win=61056 Len=0 TSval=1718298919 TSecr=256630278"
"253","0.428874137","172.217.6.214","192.168.1.118","TLSv1.2","2329","Application Data, Application Data"
"254","0.428939937","192.168.1.118","172.217.6.214","TCP","66","33138 → 443 [ACK] Seq=1238 Ack=22177 Win=58880 Len=0 TSval=1718298919 TSecr=256630280"
"255","0.430874087","172.217.10.225","192.168.1.118","TLSv1.2","1484","Application Data"
"256","0.431526075","192.168.1.118","172.217.6.214","TLSv1.2","363","Application Data"
"257","0.432045350","172.217.10.225","192.168.1.118","TLSv1.2","2902","Application Data, Application Data"
"258","0.432133600","172.217.10.225","192.168.1.118","TLSv1.2","1567","Application Data, Application Data"
"259","0.434038237","192.168.1.118","172.217.10.225","TCP","66","43402 → 443 [ACK] Seq=916 Ack=11039 Win=58496 Len=0 TSval=2859259844 TSecr=1987272868"
"260","0.434257675","192.168.1.118","172.217.6.214","TLSv1.2","363","Application Data"
"261","0.434353537","192.168.1.118","172.217.6.214","TLSv1.2","363","Application Data"
"262","0.448097587","172.217.6.214","192.168.1.118","TLSv1.2","1484","Application Data"
"263","0.450390825","172.217.6.214","192.168.1.118","TLSv1.2","2902","Application Data, Application Data"
"264","0.450446725","172.217.10.225","192.168.1.118","TLSv1.2","117","Change Cipher Spec, Encrypted Handshake Message"
"265","0.450525775","172.217.6.214","192.168.1.118","TLSv1.2","2902","Application Data, Application Data"
"266","0.450664325","172.217.6.214","192.168.1.118","TLSv1.2","2902","Application Data, Application Data"
"267","0.450697600","172.217.6.214","192.168.1.118","TLSv1.2","1417","Application Data"
"268","0.450744112","172.217.10.225","192.168.1.118","TLSv1.2","1484","Application Data"
"269","0.450822937","172.217.10.225","192.168.1.118","TLSv1.2","2902","Application Data, Application Data"
"270","0.450911825","172.217.10.225","192.168.1.118","TLSv1.2","2639","Application Data, Application Data"
"271","0.451902950","192.168.1.118","172.217.10.227","TCP","66","35208 → 443 [ACK] Seq=968 Ack=3115 Win=64128 Len=0 TSval=2808540231 TSecr=3318902762"
"272","0.452589587","192.168.1.118","172.217.10.225","TCP","66","43398 → 443 [ACK] Seq=916 Ack=12112 Win=57344 Len=0 TSval=2859259863 TSecr=3022222804"
"273","0.453161437","192.168.1.118","172.217.10.225","TLSv1.2","336","Application Data"
"274","0.453223700","192.168.1.118","172.217.6.214","TCP","66","33134 → 443 [ACK] Seq=1832 Ack=37581 Win=52864 Len=0 TSval=1718298943 TSecr=3570016339"
"275","0.463559425","192.168.1.118","172.217.6.214","TLSv1.2","363","Application Data"
"276","0.463630625","172.217.6.214","192.168.1.118","TLSv1.2","1484","Application Data"
"277","0.466682150","172.217.6.214","192.168.1.118","TLSv1.2","2902","Application Data, Application Data"
"278","0.466755875","172.217.6.214","192.168.1.118","TLSv1.2","2902","Application Data, Application Data"
"279","0.466883125","172.217.6.214","192.168.1.118","TLSv1.2","1484","Application Data"
"280","0.466964950","172.217.6.214","192.168.1.118","TLSv1.2","2902","Application Data, Application Data"
"281","0.467019875","172.217.6.214","192.168.1.118","TLSv1.2","110","Application Data"
"282","0.467098300","172.217.6.214","192.168.1.118","TLSv1.2","2902","Application Data, Application Data"
"283","0.467167562","172.217.6.214","192.168.1.118","TLSv1.2","2902","Application Data, Application Data"
"284","0.467201812","172.217.6.214","192.168.1.118","TLSv1.2","564","Application Data"
"285","0.467249462","172.217.6.214","192.168.1.118","TLSv1.2","1484","Application Data"
"286","0.469125412","192.168.1.118","172.217.6.214","TCP","66","33132 → 443 [ACK] Seq=1832 Ack=35040 Win=57088 Len=0 TSval=1718298959 TSecr=1509508469"
"287","0.469227250","192.168.1.118","172.217.6.214","TCP","66","33136 → 443 [ACK] Seq=1535 Ack=31876 Win=53760 Len=0 TSval=1718298959 TSecr=1632433351"
"288","0.477132475","192.168.1.118","172.217.6.214","TLSv1.2","363","Application Data"
"289","0.479911162","192.168.1.118","172.217.6.214","TLSv1.2","363","Application Data"
"290","0.480083837","172.217.6.214","192.168.1.118","TLSv1.2","1484","Application Data"
"291","0.480208500","172.217.6.214","192.168.1.118","TLSv1.2","2902","Application Data, Application Data"
"292","0.482566425","192.168.1.118","172.217.6.214","TCP","66","33140 → 443 [ACK] Seq=1614 Ack=27777 Win=59904 Len=0 TSval=1718298973 TSecr=256630325"
"293","0.485258925","172.217.6.214","192.168.1.118","TLSv1.2","2902","Application Data, Application Data"
"294","0.485373562","172.217.6.214","192.168.1.118","TLSv1.2","2497","Application Data, Application Data"
"295","0.485453762","192.168.1.118","172.217.6.214","TCP","66","33140 → 443 [ACK] Seq=1614 Ack=30208 Win=61056 Len=0 TSval=1718298976 TSecr=256630326"
"296","0.485524850","172.217.6.214","192.168.1.118","TLSv1.2","842","Application Data"
"297","0.487655687","192.168.1.118","172.217.6.214","TCP","66","33138 → 443 [ACK] Seq=1535 Ack=27207 Win=59136 Len=0 TSval=1718298978 TSecr=256630325"
"298","0.490349637","192.168.1.118","172.217.6.214","TLSv1.2","363","Application Data"
"299","0.493541200","192.168.1.118","172.217.6.214","TLSv1.2","363","Application Data"
"300","0.495591962","172.217.6.214","192.168.1.118","TLSv1.2","1484","Application Data"
"301","0.495718512","172.217.6.214","192.168.1.118","TLSv1.2","2902","Application Data, Application Data"
"302","0.495797612","172.217.10.225","192.168.1.118","TLSv1.2","1484","Application Data"
"303","0.496023725","172.217.10.225","192.168.1.118","TLSv1.2","2902","Application Data, Application Data"
"304","0.496110225","172.217.10.225","192.168.1.118","TLSv1.2","215","Application Data"
"305","0.496217737","172.217.6.214","192.168.1.118","TLSv1.2","2902","Application Data, Application Data"
"306","0.496436725","172.217.6.214","192.168.1.118","TLSv1.2","849","Application Data"
"307","0.498413012","192.168.1.118","172.217.10.225","TCP","66","43400 → 443 [ACK] Seq=914 Ack=9687 Win=59776 Len=0 TSval=2859259909 TSecr=1987272923"
"308","0.498614725","192.168.1.118","172.217.6.214","TCP","66","33134 → 443 [ACK] Seq=2129 Ack=45454 Win=56320 Len=0 TSval=1718298989 TSecr=3570016389"
"309","0.506435212","192.168.1.118","172.217.6.214","TLSv1.2","363","Application Data"
"310","0.514684187","172.217.6.214","192.168.1.118","TLSv1.2","1484","Application Data"
"311","0.515666625","172.217.6.214","192.168.1.118","TLSv1.2","1484","Application Data"
"312","0.515789625","172.217.6.214","192.168.1.118","TLSv1.2","2902","Application Data, Application Data"
"313","0.518662512","192.168.1.118","172.217.6.214","TCP","66","33136 → 443 [ACK] Seq=1832 Ack=36130 Win=61056 Len=0 TSval=1718299009 TSecr=1632433408"
"314","0.521007375","172.217.6.214","192.168.1.118","TLSv1.2","2902","Application Data, Application Data"
"315","0.521120362","172.217.6.214","192.168.1.118","TLSv1.2","2902","Application Data, Application Data"
"316","0.521198862","192.168.1.118","172.217.6.214","TCP","66","33136 → 443 [ACK] Seq=1832 Ack=38966 Win=61056 Len=0 TSval=1718299011 TSecr=1632433410"
"317","0.523253337","192.168.1.118","172.217.6.214","TCP","66","33132 → 443 [ACK] Seq=2129 Ack=39294 Win=61056 Len=0 TSval=1718299013 TSecr=1509508529"
"318","0.523429937","172.217.6.214","192.168.1.118","TLSv1.2","2902","Application Data, Application Data"
"319","0.523506237","192.168.1.118","172.217.6.214","TCP","66","33132 → 443 [ACK] Seq=2129 Ack=42130 Win=61056 Len=0 TSval=1718299014 TSecr=1509508531"
"320","0.523637887","172.217.6.214","192.168.1.118","TLSv1.2","1079","[TCP Spurious Retransmission] , Application Data"
"321","0.523721475","192.168.1.118","172.217.6.214","TCP","78","[TCP Dup ACK 295#1] 33140 → 443 [ACK] Seq=1911 Ack=30208 Win=64128 Len=0 TSval=1718299014 TSecr=256630378 SLE=29195 SRE=30208"
"322","0.523804450","172.217.6.214","192.168.1.118","TLSv1.2","2902","Application Data, Application Data"
"323","0.523907250","192.168.1.118","172.217.6.214","TCP","66","33136 → 443 [ACK] Seq=1832 Ack=41802 Win=61056 Len=0 TSval=1718299014 TSecr=1632433411"
"324","0.524044575","172.217.6.214","192.168.1.118","TLSv1.2","1845","Application Data, Application Data"
"325","0.524139925","172.217.6.214","192.168.1.118","TLSv1.2","2902","Application Data, Application Data"
"326","0.524194412","172.217.6.214","192.168.1.118","TLSv1.2","1309","Application Data"
"327","0.525391925","192.168.1.118","172.217.6.214","TCP","66","33132 → 443 [ACK] Seq=2129 Ack=43909 Win=59392 Len=0 TSval=1718299015 TSecr=1509508533"
"328","0.525583350","192.168.1.118","172.217.6.214","TCP","66","33136 → 443 [ACK] Seq=1832 Ack=45881 Win=57088 Len=0 TSval=1718299016 TSecr=1632433412"
"329","0.527452375","172.217.6.214","192.168.1.118","TLSv1.2","1484","Application Data"
"330","0.529012275","172.217.6.214","192.168.1.118","TLSv1.2","1484","Application Data"
"331","0.529083275","192.168.1.118","172.217.6.214","TCP","66","33140 → 443 [ACK] Seq=1911 Ack=31626 Win=63104 Len=0 TSval=1718299019 TSecr=256630387"
"332","0.529166000","172.217.6.214","192.168.1.118","TLSv1.2","2902","Application Data, Application Data"
"333","0.529231862","192.168.1.118","172.217.6.214","TCP","66","33140 → 443 [ACK] Seq=1911 Ack=34462 Win=60288 Len=0 TSval=1718299019 TSecr=256630387"
"334","0.529311525","172.217.6.214","192.168.1.118","TLSv1.2","2902","Application Data, Application Data"
"335","0.529396987","172.217.6.214","192.168.1.118","TLSv1.2","2902","Application Data, Application Data"
"336","0.529452462","192.168.1.118","172.217.6.214","TCP","66","33140 → 443 [ACK] Seq=1911 Ack=37298 Win=57472 Len=0 TSval=1718299020 TSecr=256630388"
"337","0.530738762","172.217.6.214","192.168.1.118","TLSv1.2","2824","Application Data, Application Data"
"338","0.530836037","172.217.6.214","192.168.1.118","TLSv1.2","2902","Application Data, Application Data"
"339","0.530917050","192.168.1.118","172.217.6.214","TCP","66","33140 → 443 [ACK] Seq=1911 Ack=40134 Win=54656 Len=0 TSval=1718299021 TSecr=256630389"
"340","0.531105600","192.168.1.118","172.217.6.214","TCP","66","33138 → 443 [ACK] Seq=1832 Ack=34219 Win=57216 Len=0 TSval=1718299021 TSecr=256630387"
"341","0.531417425","192.168.1.118","172.217.6.214","TLSv1.2","376","Application Data"
"342","0.533571750","172.217.6.214","192.168.1.118","TLSv1.2","2349","Application Data, Application Data"
"343","0.533636137","192.168.1.118","172.217.6.214","TCP","66","33140 → 443 [ACK] Seq=1911 Ack=42417 Win=52480 Len=0 TSval=1718299024 TSecr=256630391"
"344","0.534181000","192.168.1.118","172.217.6.214","TLSv1.2","442","Application Data"
"345","0.534963950","172.217.6.214","192.168.1.118","TLSv1.2","1484","Application Data"
"346","0.536532362","172.217.6.214","192.168.1.118","TLSv1.2","1484","Application Data"
"347","0.537475650","192.168.1.118","172.217.6.214","TCP","66","33134 → 443 [ACK] Seq=2426 Ack=48290 Win=61312 Len=0 TSval=1718299028 TSecr=3570016439"
"348","0.537757500","192.168.1.118","172.217.6.214","TLSv1.2","433","Application Data"
"349","0.540211675","172.217.6.214","192.168.1.118","TLSv1.2","1484","Application Data"
"350","0.543324525","172.217.6.214","192.168.1.118","TLSv1.2","2251","Application Data, Application Data"
"351","0.545273275","192.168.1.118","172.217.6.214","TCP","66","33134 → 443 [ACK] Seq=2426 Ack=51893 Win=61056 Len=0 TSval=1718299035 TSecr=3570016439"
"352","0.545497950","192.168.1.118","172.217.6.214","TLSv1.2","442","Application Data"
"353","0.548613600","192.168.1.118","172.217.6.214","TLSv1.2","442","Application Data"
"354","0.556444800","172.217.6.214","192.168.1.118","TLSv1.2","1484","Application Data"
"355","0.558090337","172.217.6.214","192.168.1.118","TLSv1.2","1484","Application Data"
"356","0.558232150","172.217.6.214","192.168.1.118","TLSv1.2","2902","Application Data, Application Data"
"357","0.558341150","172.217.6.214","192.168.1.118","TLSv1.2","2902","Application Data, Application Data"
"358","0.559351775","172.217.6.214","192.168.1.118","TLSv1.2","2568","Application Data, Application Data"
"359","0.559459062","172.217.6.214","192.168.1.118","TLSv1.2","2902","Application Data, Application Data"
"360","0.560662787","192.168.1.118","172.217.6.214","TCP","66","33132 → 443 [ACK] Seq=2439 Ack=50999 Win=57088 Len=0 TSval=1718299051 TSecr=1509508571"
"361","0.560910200","192.168.1.118","172.217.6.214","TCP","66","33136 → 443 [ACK] Seq=2208 Ack=52637 Win=57472 Len=0 TSval=1718299051 TSecr=1632433450"
"362","0.562741012","172.217.6.214","192.168.1.118","TLSv1.2","650","Application Data"
"363","0.563967587","172.217.6.214","192.168.1.118","TLSv1.2","1484","Application Data"
"364","0.565007737","172.217.6.214","192.168.1.118","TLSv1.2","2902","Application Data, Application Data"
"365","0.566381087","192.168.1.118","172.217.6.214","TCP","66","33138 → 443 [ACK] Seq=2199 Ack=38473 Win=59904 Len=0 TSval=1718299056 TSecr=256630424"
"366","0.566588237","172.217.6.214","192.168.1.118","TLSv1.2","1484","Application Data"
"367","0.566646962","192.168.1.118","172.217.6.214","TLSv1.2","442","Application Data"
"368","0.566685987","172.217.6.214","192.168.1.118","TLSv1.2","1484","Application Data"
"369","0.566813437","172.217.6.214","192.168.1.118","TLSv1.2","2407","Application Data, Application Data"
"370","0.566944437","172.217.6.214","192.168.1.118","TLSv1.2","2902","Application Data, Application Data"
"371","0.569468912","192.168.1.118","172.217.6.214","TCP","66","33140 → 443 [ACK] Seq=2287 Ack=46176 Win=61056 Len=0 TSval=1718299060 TSecr=256630426"
"372","0.569556300","192.168.1.118","172.217.6.214","TCP","66","33134 → 443 [ACK] Seq=2802 Ack=56147 Win=61056 Len=0 TSval=1718299060 TSecr=3570016470"
"373","0.569718550","192.168.1.118","172.217.6.214","TLSv1.2","442","Application Data"
"374","0.571527437","172.217.6.214","192.168.1.118","TLSv1.2","2902","Application Data, Application Data"
"375","0.571615675","192.168.1.118","172.217.6.214","TCP","66","33138 → 443 [ACK] Seq=2199 Ack=41309 Win=61056 Len=0 TSval=1718299062 TSecr=256630427"
"376","0.571681087","172.217.6.214","192.168.1.118","TLSv1.2","2902","Application Data, Application Data"
"377","0.571753975","192.168.1.118","172.217.6.214","TCP","66","33134 → 443 [ACK] Seq=2802 Ack=58983 Win=61056 Len=0 TSval=1718299062 TSecr=3570016472"
"378","0.572746487","172.217.6.214","192.168.1.118","TLSv1.2","861","Application Data"
"379","0.572831975","172.217.6.214","192.168.1.118","TLSv1.2","373","Application Data"
"380","0.573004862","192.168.1.118","172.217.6.214","TLSv1.2","442","Application Data"
"381","0.578571662","192.168.1.118","172.217.6.214","TLSv1.2","363","Application Data"
"382","0.578700337","192.168.1.118","172.217.6.214","TLSv1.2","363","Application Data"
"383","0.605027987","172.217.6.214","192.168.1.118","TLSv1.2","1484","Application Data"
"384","0.606555412","172.217.6.214","192.168.1.118","TLSv1.2","1484","Application Data"
"385","0.606678562","172.217.6.214","192.168.1.118","TLSv1.2","1484","Application Data"
"386","0.606776100","172.217.6.214","192.168.1.118","TLSv1.2","2902","Application Data, Application Data"
"387","0.606893812","172.217.6.214","192.168.1.118","TLSv1.2","1484","Application Data"
"388","0.608436612","172.217.6.214","192.168.1.118","TLSv1.2","1484","Application Data"
"389","0.608558712","172.217.6.214","192.168.1.118","TLSv1.2","2902","Application Data, Application Data"
"390","0.608650675","172.217.6.214","192.168.1.118","TLSv1.2","1484","Application Data"
"391","0.608796262","172.217.6.214","192.168.1.118","TLSv1.2","1484","Application Data"
"392","0.608928375","172.217.6.214","192.168.1.118","TLSv1.2","2902","Application Data, Application Data"
"393","0.608985862","192.168.1.118","172.217.6.214","TCP","66","33136 → 443 [ACK] Seq=2584 Ack=55473 Win=61312 Len=0 TSval=1718299099 TSecr=1632433499"
"394","0.609058900","192.168.1.118","172.217.6.214","TCP","66","33136 → 443 [ACK] Seq=2584 Ack=58309 Win=58496 Len=0 TSval=1718299099 TSecr=1632433500"
"395","0.609078937","172.217.6.214","192.168.1.118","TLSv1.2","2902","Application Data, Application Data"
"396","0.609130175","172.217.6.214","192.168.1.118","TLSv1.2","2902","Application Data, Application Data"
"397","0.609210487","192.168.1.118","172.217.6.214","TCP","66","33132 → 443 [ACK] Seq=2815 Ack=55837 Win=59904 Len=0 TSval=1718299099 TSecr=1509508619"
"398","0.609339925","192.168.1.118","172.217.6.214","TCP","66","33140 → 443 [ACK] Seq=2663 Ack=53266 Win=57088 Len=0 TSval=1718299099 TSecr=256630466"
"399","0.609398575","192.168.1.118","172.217.6.214","TCP","66","33134 → 443 [ACK] Seq=3099 Ack=63544 Win=59904 Len=0 TSval=1718299100 TSecr=3570016510"
"400","0.609508687","192.168.1.118","172.217.6.214","TCP","66","33136 → 443 [ACK] Seq=2584 Ack=61145 Win=55680 Len=0 TSval=1718299100 TSecr=1632433501"
"401","0.616679712","172.217.6.214","192.168.1.118","TLSv1.2","1930","Application Data, Application Data"
"402","0.616760012","192.168.1.118","172.217.6.214","TCP","66","33140 → 443 [ACK] Seq=2663 Ack=55130 Win=61056 Len=0 TSval=1718299107 TSecr=256630468"
"403","0.616911787","172.217.6.214","192.168.1.118","TLSv1.2","2652","Application Data, Application Data"
"404","0.616986750","192.168.1.118","172.217.6.214","TCP","66","33136 → 443 [ACK] Seq=2584 Ack=63731 Win=61056 Len=0 TSval=1718299107 TSecr=1632433502"
"405","0.617073087","172.217.6.214","192.168.1.118","TLSv1.2","2902","Application Data, Application Data"
"406","0.617147437","192.168.1.118","172.217.6.214","TCP","66","33132 → 443 [ACK] Seq=2815 Ack=58673 Win=61056 Len=0 TSval=1718299107 TSecr=1509508621"
"407","0.617240862","172.217.6.214","192.168.1.118","TLSv1.2","2902","Application Data, Application Data"
"408","0.617316550","192.168.1.118","172.217.6.214","TCP","66","33134 → 443 [ACK] Seq=3099 Ack=66380 Win=61056 Len=0 TSval=1718299107 TSecr=3570016512"
"409","0.617365600","172.217.6.214","192.168.1.118","TLSv1.2","2902","Application Data, Application Data"
"410","0.618277387","192.168.1.118","172.217.6.214","TCP","66","33132 → 443 [ACK] Seq=2815 Ack=61509 Win=58240 Len=0 TSval=1718299108 TSecr=1509508623"
"411","0.670206525","172.217.6.214","192.168.1.118","TLSv1.2","2902","Application Data, Application Data"
"412","0.670274637","192.168.1.118","172.217.6.214","TCP","66","33134 → 443 [ACK] Seq=3099 Ack=69216 Win=61056 Len=0 TSval=1718299160 TSecr=3570016514"
"413","0.670311262","172.217.6.214","192.168.1.118","TLSv1.2","2902","Application Data, Application Data"
"414","0.670330325","192.168.1.118","172.217.6.214","TCP","66","33132 → 443 [ACK] Seq=2815 Ack=64345 Win=61056 Len=0 TSval=1718299160 TSecr=1509508625"
"415","0.670370937","172.217.6.214","192.168.1.118","TLSv1.2","922","Application Data"
"416","0.670400887","172.217.6.214","192.168.1.118","TLSv1.2","2902","Application Data, Application Data"
"417","0.670414025","172.217.6.214","192.168.1.118","TLSv1.2","273","Application Data"
"418","0.670429487","172.217.6.214","192.168.1.118","TLSv1.2","1484","Application Data"
"419","0.670465987","172.217.6.214","192.168.1.118","TLSv1.2","2902","Application Data, Application Data"
"420","0.672553637","192.168.1.118","172.217.6.214","TCP","66","33132 → 443 [ACK] Seq=2815 Ack=67388 Win=58112 Len=0 TSval=1718299163 TSecr=1509508626"
"421","0.672744475","192.168.1.118","172.217.6.214","TCP","66","33138 → 443 [ACK] Seq=2496 Ack=46358 Win=59904 Len=0 TSval=1718299163 TSecr=256630477"
"422","0.674119987","172.217.6.214","192.168.1.118","TLSv1.2","2902","Application Data, Application Data"
"423","0.674192662","172.217.6.214","192.168.1.118","TLSv1.2","2902","Application Data, Application Data"
"424","0.674204762","172.217.6.214","192.168.1.118","TLSv1.2","1218","Application Data"
"425","0.676049050","192.168.1.118","172.217.6.214","TCP","66","33138 → 443 [ACK] Seq=2496 Ack=53182 Win=53120 Len=0 TSval=1718299166 TSecr=256630479"
"426","0.711906237","192.168.1.118","172.217.6.214","TCP","66","33134 → 443 [ACK] Seq=3099 Ack=70072 Win=64128 Len=0 TSval=1718299202 TSecr=3570016516"
"427","1.228823400","192.168.1.101","224.0.0.251","MDNS","82","Standard query 0x0000 PTR _googlecast._tcp.local, "QM" question"
"428","1.234033100","192.168.1.100","224.0.0.251","MDNS","82","Standard query 0x0000 PTR _googlecast._tcp.local, "QM" question"
"429","4.302373862","192.168.1.104","255.255.255.255","UDP","217","49154 → 6666 Len=175"
"430","5.093716012","192.168.1.118","192.168.1.102","TCP","176","44768 → 8009 [PSH, ACK] Seq=111 Ack=111 Win=501 Len=110 TSval=2256845197 TSecr=5136721 [TCP segment of a reassembled PDU]"
"431","5.105146937","192.168.1.102","192.168.1.118","TCP","176","8009 → 44768 [PSH, ACK] Seq=111 Ack=221 Win=294 Len=110 TSval=5137223 TSecr=2256845197 [TCP segment of a reassembled PDU]"
"432","5.105345262","192.168.1.118","192.168.1.102","TCP","66","44768 → 8009 [ACK] Seq=221 Ack=221 Win=501 Len=0 TSval=2256845208 TSecr=5137223"
"433","7.374321475","192.168.1.104","255.255.255.255","UDP","217","49154 → 6666 Len=175"
