frame.number,_ws.col.Time,_ws.col.Source,_ws.col.Destination,_ws.col.Protocol,frame.len,_ws.col.Info
"1","0.000000000","136.147.56.1","192.168.1.118","SSL","1414","Continuation Data"
"2","0.000994725","136.147.56.1","192.168.1.118","SSL","1629","Continuation Data"
"3","0.001038963","192.168.1.118","136.147.56.1","TCP","66","34842 → 443 [ACK] Seq=1 Ack=2912 Win=60660 Len=0 TSval=794408730 TSecr=618731882"
"4","0.009992313","136.147.56.1","192.168.1.118","SSL","1414","Continuation Data"
"5","0.011279950","136.147.56.1","192.168.1.118","SSL","5458","Continuation Data"
"6","0.011757563","192.168.1.118","136.147.56.1","TCP","66","34842 → 443 [ACK] Seq=1 Ack=9652 Win=56616 Len=0 TSval=794408741 TSecr=618731892"
"7","0.012298600","136.147.56.1","192.168.1.118","SSL","2655","Continuation Data"
"8","0.012945538","192.168.1.118","136.147.56.1","TCP","66","34842 → 443 [ACK] Seq=1 Ack=12241 Win=54027 Len=0 TSval=794408742 TSecr=618731892"
"9","0.017200038","136.147.56.1","192.168.1.118","TCP","74","443 → 34844 [SYN, ACK] Seq=0 Ack=1 Win=4380 Len=0 MSS=1360 TSval=618731899 TSecr=794408684 SACK_PERM=1"
"10","0.017290500","192.168.1.118","136.147.56.1","TCP","66","34844 → 443 [ACK] Seq=1 Ack=1 Win=64240 Len=0 TSval=794408746 TSecr=618731899"
"11","0.059026875","136.147.56.1","192.168.1.118","SSL","1414","Continuation Data"
"12","0.065440475","136.147.56.1","192.168.1.118","SSL","2301","Continuation Data"
"13","0.065542863","192.168.1.118","136.147.56.1","TCP","66","34842 → 443 [ACK] Seq=1 Ack=15824 Win=57964 Len=0 TSval=794408794 TSecr=618731941"
"14","0.066492738","192.168.1.118","136.147.56.1","TLSv1","583","Client Hello"
"15","0.067806563","192.168.1.118","209.18.47.62","DNS","77","Standard query 0x029d A c1.sfdcstatic.com"
"16","0.068685775","192.168.1.118","209.18.47.62","DNS","77","Standard query 0x7696 A c1.sfdcstatic.com"
"17","0.070193038","192.168.1.118","209.18.47.62","DNS","77","Standard query 0xf250 A c1.sfdcstatic.com"
"18","0.071127038","192.168.1.118","209.18.47.62","DNS","77","Standard query 0x82b2 A c1.sfdcstatic.com"
"19","0.072429063","192.168.1.118","209.18.47.62","DNS","77","Standard query 0x8a52 A c1.sfdcstatic.com"
"20","0.094318025","209.18.47.62","192.168.1.118","DNS","168","Standard query response 0x82b2 A c1.sfdcstatic.com CNAME c.sfdcstatic.com.edgekey.net CNAME e4745.b.akamaiedge.net A 104.102.83.39"
"21","0.094506563","192.168.1.118","209.18.47.62","DNS","77","Standard query 0xca01 AAAA c1.sfdcstatic.com"
"22","0.096951488","209.18.47.62","192.168.1.118","DNS","168","Standard query response 0x8a52 A c1.sfdcstatic.com CNAME c.sfdcstatic.com.edgekey.net CNAME e4745.b.akamaiedge.net A 104.102.83.39"
"23","0.097778138","209.18.47.62","192.168.1.118","DNS","168","Standard query response 0x029d A c1.sfdcstatic.com CNAME c.sfdcstatic.com.edgekey.net CNAME e4745.b.akamaiedge.net A 104.102.83.39"
"24","0.097844738","209.18.47.62","192.168.1.118","DNS","168","Standard query response 0xf250 A c1.sfdcstatic.com CNAME c.sfdcstatic.com.edgekey.net CNAME e4745.b.akamaiedge.net A 104.64.212.198"
"25","0.097898438","209.18.47.62","192.168.1.118","DNS","168","Standard query response 0x7696 A c1.sfdcstatic.com CNAME c.sfdcstatic.com.edgekey.net CNAME e4745.b.akamaiedge.net A 104.102.83.39"
"26","0.098124350","192.168.1.118","209.18.47.62","DNS","77","Standard query 0xe6e2 AAAA c1.sfdcstatic.com"
"27","0.098319125","192.168.1.118","209.18.47.62","DNS","77","Standard query 0x26c9 AAAA c1.sfdcstatic.com"
"28","0.098447325","192.168.1.118","209.18.47.62","DNS","77","Standard query 0xda40 AAAA c1.sfdcstatic.com"
"29","0.103305275","192.168.1.118","209.18.47.62","DNS","77","Standard query 0xae40 AAAA c1.sfdcstatic.com"
"30","0.122884213","209.18.47.62","192.168.1.118","DNS","210","Standard query response 0xca01 AAAA c1.sfdcstatic.com CNAME c.sfdcstatic.com.edgekey.net CNAME e4745.b.akamaiedge.net SOA n0b.akamaiedge.net"
"31","0.123783088","192.168.1.118","104.102.83.39","TCP","74","46754 → 443 [SYN] Seq=0 Win=64240 Len=0 MSS=1460 SACK_PERM=1 TSval=2050272539 TSecr=0 WS=128"
"32","0.123894688","192.168.1.118","104.102.83.39","TCP","74","46756 → 443 [SYN] Seq=0 Win=64240 Len=0 MSS=1460 SACK_PERM=1 TSval=2050272539 TSecr=0 WS=128"
"33","0.123976463","192.168.1.118","104.102.83.39","TCP","74","46758 → 443 [SYN] Seq=0 Win=64240 Len=0 MSS=1460 SACK_PERM=1 TSval=2050272539 TSecr=0 WS=128"
"34","0.124049875","192.168.1.118","104.102.83.39","TCP","74","46760 → 443 [SYN] Seq=0 Win=64240 Len=0 MSS=1460 SACK_PERM=1 TSval=2050272539 TSecr=0 WS=128"
"35","0.124122650","192.168.1.118","104.102.83.39","TCP","74","46762 → 443 [SYN] Seq=0 Win=64240 Len=0 MSS=1460 SACK_PERM=1 TSval=2050272539 TSecr=0 WS=128"
"36","0.126125875","209.18.47.62","192.168.1.118","DNS","210","Standard query response 0xda40 AAAA c1.sfdcstatic.com CNAME c.sfdcstatic.com.edgekey.net CNAME e4745.b.akamaiedge.net SOA n0b.akamaiedge.net"
"37","0.130594700","209.18.47.62","192.168.1.118","DNS","210","Standard query response 0xae40 AAAA c1.sfdcstatic.com CNAME c.sfdcstatic.com.edgekey.net CNAME e4745.b.akamaiedge.net SOA n0b.akamaiedge.net"
"38","0.131902363","209.18.47.62","192.168.1.118","DNS","210","Standard query response 0xe6e2 AAAA c1.sfdcstatic.com CNAME c.sfdcstatic.com.edgekey.net CNAME e4745.b.akamaiedge.net SOA n0b.akamaiedge.net"
"39","0.131942950","209.18.47.62","192.168.1.118","DNS","210","Standard query response 0x26c9 AAAA c1.sfdcstatic.com CNAME c.sfdcstatic.com.edgekey.net CNAME e4745.b.akamaiedge.net SOA n0b.akamaiedge.net"
"40","0.131976288","136.147.56.1","192.168.1.118","TCP","66","443 → 34844 [ACK] Seq=1 Ack=518 Win=4597 Len=0 TSval=618732010 TSecr=794408795"
"41","0.132045375","136.147.56.1","192.168.1.118","TLSv1.2","4110","Server Hello"
"42","0.132093900","192.168.1.118","136.147.56.1","TCP","66","34844 → 443 [ACK] Seq=518 Ack=4045 Win=60196 Len=0 TSval=794408861 TSecr=618732012"
"43","0.143820250","104.102.83.39","192.168.1.118","TCP","74","443 → 46756 [SYN, ACK] Seq=0 Ack=1 Win=28960 Len=0 MSS=1460 SACK_PERM=1 TSval=175435373 TSecr=2050272539 WS=128"
"44","0.143920138","192.168.1.118","104.102.83.39","TCP","66","46756 → 443 [ACK] Seq=1 Ack=1 Win=64256 Len=0 TSval=2050272559 TSecr=175435373"
"45","0.144737688","104.102.83.39","192.168.1.118","TCP","74","443 → 46754 [SYN, ACK] Seq=0 Ack=1 Win=28960 Len=0 MSS=1460 SACK_PERM=1 TSval=175435373 TSecr=2050272539 WS=128"
"46","0.144826025","192.168.1.118","104.102.83.39","TCP","66","46754 → 443 [ACK] Seq=1 Ack=1 Win=64256 Len=0 TSval=2050272560 TSecr=175435373"
"47","0.151797513","104.102.83.39","192.168.1.118","TCP","74","443 → 46758 [SYN, ACK] Seq=0 Ack=1 Win=28960 Len=0 MSS=1460 SACK_PERM=1 TSval=175435381 TSecr=2050272539 WS=128"
"48","0.151866075","192.168.1.118","104.102.83.39","TCP","66","46758 → 443 [ACK] Seq=1 Ack=1 Win=64256 Len=0 TSval=2050272567 TSecr=175435381"
"49","0.160439763","192.168.1.118","104.102.83.39","TLSv1","583","Client Hello"
"50","0.161987975","104.102.83.39","192.168.1.118","TCP","74","443 → 46760 [SYN, ACK] Seq=0 Ack=1 Win=28960 Len=0 MSS=1460 SACK_PERM=1 TSval=175435392 TSecr=2050272539 WS=128"
"51","0.162079425","192.168.1.118","104.102.83.39","TCP","66","46760 → 443 [ACK] Seq=1 Ack=1 Win=64256 Len=0 TSval=2050272577 TSecr=175435392"
"52","0.169727275","104.102.83.39","192.168.1.118","TCP","74","443 → 46762 [SYN, ACK] Seq=0 Ack=1 Win=28960 Len=0 MSS=1460 SACK_PERM=1 TSval=175435400 TSecr=2050272539 WS=128"
"53","0.169824138","192.168.1.118","104.102.83.39","TCP","66","46762 → 443 [ACK] Seq=1 Ack=1 Win=64256 Len=0 TSval=2050272585 TSecr=175435400"
"54","0.177167925","192.168.1.118","104.102.83.39","TLSv1","583","Client Hello"
"55","0.183198200","104.102.83.39","192.168.1.118","TCP","66","443 → 46756 [ACK] Seq=1 Ack=518 Win=30080 Len=0 TSval=175435412 TSecr=2050272575"
"56","0.184466738","104.102.83.39","192.168.1.118","TLSv1.2","1514","Server Hello"
"57","0.184549538","192.168.1.118","104.102.83.39","TCP","66","46756 → 443 [ACK] Seq=518 Ack=1449 Win=63104 Len=0 TSval=2050272599 TSecr=175435414"
"58","0.185998088","104.102.83.39","192.168.1.118","TLSv1.2","1891","Certificate, Server Key Exchange, Server Hello Done"
"59","0.186084938","192.168.1.118","104.102.83.39","TCP","66","46756 → 443 [ACK] Seq=518 Ack=3274 Win=61312 Len=0 TSval=2050272601 TSecr=175435414"
"60","0.193628213","192.168.1.118","104.102.83.39","TLSv1","583","Client Hello"
"61","0.204274938","104.102.83.39","192.168.1.118","TCP","66","443 → 46758 [ACK] Seq=1 Ack=518 Win=30080 Len=0 TSval=175435433 TSecr=2050272592"
"62","0.206589313","104.102.83.39","192.168.1.118","TLSv1.2","1514","Server Hello"
"63","0.206668625","192.168.1.118","104.102.83.39","TCP","66","46758 → 443 [ACK] Seq=518 Ack=1449 Win=63104 Len=0 TSval=2050272621 TSecr=175435435"
"64","0.210076275","192.168.1.118","104.102.83.39","TLSv1","583","Client Hello"
"65","0.213510425","104.102.83.39","192.168.1.118","TLSv1.2","1891","Certificate, Server Key Exchange, Server Hello Done"
"66","0.213598150","192.168.1.118","104.102.83.39","TCP","66","46758 → 443 [ACK] Seq=518 Ack=3274 Win=61312 Len=0 TSval=2050272628 TSecr=175435435"
"67","0.213685913","136.147.56.1","192.168.1.118","TLSv1.2","1108","Certificate, Server Key Exchange, Server Hello Done"
"68","0.213760050","192.168.1.118","136.147.56.1","TCP","66","34844 → 443 [ACK] Seq=518 Ack=5087 Win=62008 Len=0 TSval=794408943 TSecr=618732096"
"69","0.223317063","104.102.83.39","192.168.1.118","TCP","66","443 → 46760 [ACK] Seq=1 Ack=518 Win=30080 Len=0 TSval=175435443 TSecr=2050272608"
"70","0.223415763","104.102.83.39","192.168.1.118","TLSv1.2","1514","Server Hello"
"71","0.223492513","192.168.1.118","104.102.83.39","TCP","66","46760 → 443 [ACK] Seq=518 Ack=1449 Win=63104 Len=0 TSval=2050272638 TSecr=175435445"
"72","0.224039638","104.102.83.39","192.168.1.118","TLSv1.2","1891","Certificate, Server Key Exchange, Server Hello Done"
"73","0.224123225","192.168.1.118","104.102.83.39","TCP","66","46760 → 443 [ACK] Seq=518 Ack=3274 Win=61312 Len=0 TSval=2050272639 TSecr=175435445"
"74","0.226691188","104.102.83.39","192.168.1.118","TCP","66","443 → 46762 [ACK] Seq=1 Ack=518 Win=30080 Len=0 TSval=175435455 TSecr=2050272625"
"75","0.227097713","192.168.1.118","104.102.83.39","TLSv1","583","Client Hello"
"76","0.229100675","192.168.1.118","104.102.83.39","TLSv1.2","192","Client Key Exchange, Change Cipher Spec, Encrypted Handshake Message"
"77","0.232056325","192.168.1.118","136.147.56.1","TLSv1.2","192","Client Key Exchange, Change Cipher Spec, Encrypted Handshake Message"
"78","0.233378275","104.102.83.39","192.168.1.118","TLSv1.2","1514","Server Hello"
"79","0.233460375","192.168.1.118","104.102.83.39","TCP","66","46762 → 443 [ACK] Seq=518 Ack=1449 Win=63104 Len=0 TSval=2050272648 TSecr=175435457"
"80","0.233974863","192.168.1.118","104.102.83.39","TLSv1.2","192","Client Key Exchange, Change Cipher Spec, Encrypted Handshake Message"
"81","0.234878700","104.102.83.39","192.168.1.118","TLSv1.2","1891","Certificate, Server Key Exchange, Server Hello Done"
"82","0.234964613","192.168.1.118","104.102.83.39","TCP","66","46762 → 443 [ACK] Seq=518 Ack=3274 Win=61312 Len=0 TSval=2050272650 TSecr=175435457"
"83","0.235837363","192.168.1.118","104.102.83.39","TLSv1.2","192","Client Key Exchange, Change Cipher Spec, Encrypted Handshake Message"
"84","0.237706200","192.168.1.118","104.102.83.39","TLSv1.2","192","Client Key Exchange, Change Cipher Spec, Encrypted Handshake Message"
"85","0.244908775","104.102.83.39","192.168.1.118","TCP","66","443 → 46754 [ACK] Seq=1 Ack=518 Win=30080 Len=0 TSval=175435475 TSecr=2050272642"
"86","0.247201788","104.102.83.39","192.168.1.118","TLSv1.2","1514","Server Hello"
"87","0.247248363","192.168.1.118","104.102.83.39","TCP","66","46754 → 443 [ACK] Seq=518 Ack=1449 Win=63104 Len=0 TSval=2050272662 TSecr=175435477"
"88","0.249896775","104.102.83.39","192.168.1.118","TLSv1.2","1891","Certificate, Server Key Exchange, Server Hello Done"
"89","0.249965150","192.168.1.118","104.102.83.39","TCP","66","46754 → 443 [ACK] Seq=518 Ack=3274 Win=61312 Len=0 TSval=2050272665 TSecr=175435477"
"90","0.252627525","192.168.1.118","104.102.83.39","TLSv1.2","192","Client Key Exchange, Change Cipher Spec, Encrypted Handshake Message"
"91","0.264543538","104.102.83.39","192.168.1.118","TLSv1.2","117","Change Cipher Spec, Encrypted Handshake Message"
"92","0.264622875","192.168.1.118","104.102.83.39","TCP","66","46756 → 443 [ACK] Seq=644 Ack=3325 Win=64128 Len=0 TSval=2050272679 TSecr=175435495"
"93","0.265205150","192.168.1.118","104.102.83.39","TLSv1.2","305","Application Data"
"94","0.268806525","104.102.83.39","192.168.1.118","TLSv1.2","117","Change Cipher Spec, Encrypted Handshake Message"
"95","0.269247575","192.168.1.118","104.102.83.39","TLSv1.2","336","Application Data"
"96","0.269619688","104.102.83.39","192.168.1.118","TLSv1.2","117","Change Cipher Spec, Encrypted Handshake Message"
"97","0.270320375","104.102.83.39","192.168.1.118","TLSv1.2","117","Change Cipher Spec, Encrypted Handshake Message"
"98","0.270432963","192.168.1.118","104.102.83.39","TLSv1.2","309","Application Data"
"99","0.270715500","192.168.1.118","104.102.83.39","TLSv1.2","320","Application Data"
"100","0.271031950","104.102.83.39","192.168.1.118","TLSv1.2","117","Change Cipher Spec, Encrypted Handshake Message"
"101","0.271875200","192.168.1.118","104.102.83.39","TLSv1.2","296","Application Data"
"102","0.290771113","104.102.83.39","192.168.1.118","TCP","1514","[TCP segment of a reassembled PDU]"
"103","0.292504388","104.102.83.39","192.168.1.118","TLSv1.2","2691","Application Data"
"104","0.292592275","104.102.83.39","192.168.1.118","TCP","4410","443 → 46756 [ACK] Seq=4773 Ack=883 Win=31104 Len=4344 TSval=175435520 TSecr=2050272680 [TCP segment of a reassembled PDU]"
"105","0.292634300","104.102.83.39","192.168.1.118","TLSv1.2","357","Application Data"
"106","0.293304238","192.168.1.118","104.102.83.39","TCP","66","46758 → 443 [ACK] Seq=914 Ack=5950 Win=61568 Len=0 TSval=2050272708 TSecr=175435520"
"107","0.293979575","192.168.1.118","104.102.83.39","TCP","66","46756 → 443 [ACK] Seq=883 Ack=9408 Win=64128 Len=0 TSval=2050272709 TSecr=175435520"
"108","0.295602725","192.168.1.118","104.102.83.39","TLSv1.2","307","Application Data"
"109","0.295725650","192.168.1.118","104.102.83.39","TLSv1.2","305","Application Data"
"110","0.302980113","104.102.83.39","192.168.1.118","TCP","1514","[TCP segment of a reassembled PDU]"
"111","0.311256400","104.102.83.39","192.168.1.118","TLSv1.2","2188","Application Data"
"112","0.311367638","104.102.83.39","192.168.1.118","TCP","2962","[TCP segment of a reassembled PDU]"
"113","0.311650625","104.102.83.39","192.168.1.118","TCP","8754","443 → 46762 [ACK] Seq=6221 Ack=887 Win=31104 Len=8688 TSval=175435534 TSecr=2050272685 [TCP segment of a reassembled PDU]"
"114","0.311779850","192.168.1.118","104.102.83.39","TCP","66","46762 → 443 [ACK] Seq=887 Ack=14909 Win=52608 Len=0 TSval=2050272727 TSecr=175435534"
"115","0.311862400","104.102.83.39","192.168.1.118","TLSv1.2","8754","Application Data [TCP segment of a reassembled PDU]"
"116","0.311887263","192.168.1.118","104.102.83.39","TCP","66","46754 → 443 [ACK] Seq=874 Ack=6895 Win=64128 Len=0 TSval=2050272727 TSecr=175435532"
"117","0.311952813","192.168.1.118","104.102.83.39","TCP","66","46762 → 443 [ACK] Seq=887 Ack=23597 Win=52864 Len=0 TSval=2050272727 TSecr=175435535"
"118","0.314989500","192.168.1.118","104.102.83.39","TLSv1.2","293","Application Data"
"119","0.325927825","104.102.83.39","192.168.1.118","TCP","2962","443 → 46762 [ACK] Seq=23597 Ack=887 Win=31104 Len=2896 TSval=175435535 TSecr=2050272685 [TCP segment of a reassembled PDU]"
"120","0.326021313","192.168.1.118","104.102.83.39","TCP","66","46762 → 443 [ACK] Seq=887 Ack=26493 Win=61056 Len=0 TSval=2050272741 TSecr=175435535"
"121","0.326080850","104.102.83.39","192.168.1.118","TCP","2962","[TCP segment of a reassembled PDU]"
"122","0.326312875","104.102.83.39","192.168.1.118","TLSv1.2","5649","Application Data"
"123","0.326399138","136.147.56.1","192.168.1.118","TCP","66","443 → 34844 [ACK] Seq=5087 Ack=644 Win=4723 Len=0 TSval=618732190 TSecr=794408961"
"124","0.326480688","136.147.56.1","192.168.1.118","TLSv1.2","72","Change Cipher Spec"
"125","0.326549438","136.147.56.1","192.168.1.118","TLSv1.2","111","Encrypted Handshake Message"
"126","0.326666838","104.102.83.39","192.168.1.118","TLSv1.2","2533","Application Data"
"127","0.326760988","104.102.83.39","192.168.1.118","TLSv1.2","671","Application Data"
"128","0.327454200","104.102.83.39","192.168.1.118","TCP","1514","443 → 46762 [ACK] Seq=26493 Ack=887 Win=31104 Len=1448 TSval=175435556 TSecr=2050272727 [TCP segment of a reassembled PDU]"
"129","0.331548038","104.102.83.39","192.168.1.118","TCP","5858","443 → 46762 [ACK] Seq=27941 Ack=887 Win=31104 Len=5792 TSval=175435556 TSecr=2050272727 [TCP segment of a reassembled PDU]"
"130","0.331888638","104.102.83.39","192.168.1.118","TLSv1.2","13098","Application Data, Application Data"
"131","0.336331163","104.102.83.39","192.168.1.118","TCP","5858","443 → 46762 [ACK] Seq=46765 Ack=887 Win=31104 Len=5792 TSval=175435557 TSecr=2050272727 [TCP segment of a reassembled PDU]"
"132","0.336473063","104.102.83.39","192.168.1.118","TLSv1.2","2962","Application Data [TCP segment of a reassembled PDU]"
"133","0.336550750","104.102.83.39","192.168.1.118","TCP","2962","443 → 46762 [ACK] Seq=55453 Ack=887 Win=31104 Len=2896 TSval=175435559 TSecr=2050272727 [TCP segment of a reassembled PDU]"
"134","0.336590988","104.102.83.39","192.168.1.118","TCP","1514","443 → 46762 [ACK] Seq=58349 Ack=887 Win=31104 Len=1448 TSval=175435560 TSecr=2050272727 [TCP segment of a reassembled PDU]"
"135","0.338104275","104.102.83.39","192.168.1.118","TCP","1514","443 → 46762 [ACK] Seq=59797 Ack=887 Win=31104 Len=1448 TSval=175435560 TSecr=2050272727 [TCP segment of a reassembled PDU]"
"136","0.338197438","104.102.83.39","192.168.1.118","TCP","2962","443 → 46762 [ACK] Seq=61245 Ack=887 Win=31104 Len=2896 TSval=175435561 TSecr=2050272727 [TCP segment of a reassembled PDU]"
"137","0.338245013","104.102.83.39","192.168.1.118","TCP","1514","443 → 46762 [ACK] Seq=64141 Ack=887 Win=31104 Len=1448 TSval=175435562 TSecr=2050272727 [TCP segment of a reassembled PDU]"
"138","0.338412763","104.102.83.39","192.168.1.118","TLSv1.2","4628","Application Data"
"139","0.338462450","104.102.83.39","192.168.1.118","TLSv1.2","1514","Application Data [TCP segment of a reassembled PDU]"
"140","0.340573175","192.168.1.118","136.147.56.1","TCP","66","34844 → 443 [ACK] Seq=644 Ack=5138 Win=63356 Len=0 TSval=794409069 TSecr=618732191"
"141","0.340909013","192.168.1.118","136.147.56.1","TLSv1.2","307","Application Data"
"142","0.340968063","192.168.1.118","104.102.83.39","TCP","66","46760 → 443 [ACK] Seq=898 Ack=11804 Win=55680 Len=0 TSval=2050272756 TSecr=175435535"
"143","0.341747163","192.168.1.118","104.102.83.39","TCP","66","46762 → 443 [ACK] Seq=887 Ack=67037 Win=20608 Len=0 TSval=2050272757 TSecr=175435556"
"144","0.343243925","192.168.1.118","104.102.83.39","TCP","66","46756 → 443 [ACK] Seq=1122 Ack=11875 Win=61696 Len=0 TSval=2050272758 TSecr=175435550"
"145","0.343387350","192.168.1.118","104.102.83.39","TCP","66","46754 → 443 [ACK] Seq=1101 Ack=11457 Win=59648 Len=0 TSval=2050272758 TSecr=175435565"
"146","0.344614238","192.168.1.118","209.18.47.62","DNS","80","Standard query 0x22dd A fonts.googleapis.com"
"147","0.346466875","104.102.83.39","192.168.1.118","TCP","1514","443 → 46762 [ACK] Seq=67037 Ack=887 Win=31104 Len=1448 TSval=175435575 TSecr=2050272741 [TCP segment of a reassembled PDU]"
"148","0.347982363","104.102.83.39","192.168.1.118","TCP","4410","443 → 46762 [ACK] Seq=68485 Ack=887 Win=31104 Len=4344 TSval=175435575 TSecr=2050272741 [TCP segment of a reassembled PDU]"
"149","0.365224825","209.18.47.62","192.168.1.118","DNS","96","Standard query response 0x22dd A fonts.googleapis.com A 172.217.12.202"
"150","0.365490375","192.168.1.118","209.18.47.62","DNS","80","Standard query 0xb65a AAAA fonts.googleapis.com"
"151","0.367235613","192.168.1.118","104.102.83.39","TCP","66","46758 → 443 [ACK] Seq=1155 Ack=6555 Win=64128 Len=0 TSval=2050272782 TSecr=175435550"
"152","0.373501800","104.102.83.39","192.168.1.118","TCP","5858","443 → 46762 [ACK] Seq=72829 Ack=887 Win=31104 Len=5792 TSval=175435594 TSecr=2050272757 [TCP segment of a reassembled PDU]"
"153","0.373733513","104.102.83.39","192.168.1.118","TCP","2962","443 → 46762 [ACK] Seq=78621 Ack=887 Win=31104 Len=2896 TSval=175435594 TSecr=2050272757 [TCP segment of a reassembled PDU]"
"154","0.373848138","104.102.83.39","192.168.1.118","TLSv1.2","2962","Application Data [TCP segment of a reassembled PDU]"
"155","0.373941638","104.102.83.39","192.168.1.118","TCP","2962","443 → 46762 [ACK] Seq=84413 Ack=887 Win=31104 Len=2896 TSval=175435596 TSecr=2050272757 [TCP segment of a reassembled PDU]"
"156","0.377858088","209.18.47.62","192.168.1.118","DNS","108","Standard query response 0xb65a AAAA fonts.googleapis.com AAAA 2607:f8b0:4006:81b::200a"
"157","0.387220888","192.168.1.118","104.102.83.39","TCP","66","46762 → 443 [ACK] Seq=887 Ack=87309 Win=384 Len=0 TSval=2050272802 TSecr=175435575"
"158","0.399006888","136.147.56.1","192.168.1.118","TCP","66","443 → 34844 [ACK] Seq=5138 Ack=885 Win=4964 Len=0 TSval=618732282 TSecr=794409070"
"159","0.401705725","192.168.1.118","104.102.83.39","TCP","66","[TCP Window Update] 46762 → 443 [ACK] Seq=887 Ack=87309 Win=64128 Len=0 TSval=2050272816 TSecr=175435575"
"160","0.403000750","192.168.1.118","172.217.12.202","TCP","74","46214 → 443 [SYN] Seq=0 Win=64240 Len=0 MSS=1460 SACK_PERM=1 TSval=2455496979 TSecr=0 WS=128"
"161","0.403188375","192.168.1.118","104.102.83.39","TLSv1.2","317","Application Data"
"162","0.403289900","192.168.1.118","104.102.83.39","TLSv1.2","340","Application Data"
"163","0.419587300","104.102.83.39","192.168.1.118","TCP","1514","443 → 46762 [ACK] Seq=87309 Ack=887 Win=31104 Len=1448 TSval=175435649 TSecr=2050272816 [TCP segment of a reassembled PDU]"
"164","0.419669800","192.168.1.118","104.102.83.39","TCP","66","46762 → 443 [ACK] Seq=887 Ack=88757 Win=67072 Len=0 TSval=2050272834 TSecr=175435649"
"165","0.420842613","104.102.83.39","192.168.1.118","TCP","4410","443 → 46762 [ACK] Seq=88757 Ack=887 Win=31104 Len=4344 TSval=175435649 TSecr=2050272816 [TCP segment of a reassembled PDU]"
"166","0.420921775","192.168.1.118","104.102.83.39","TCP","66","46762 → 443 [ACK] Seq=887 Ack=93101 Win=75776 Len=0 TSval=2050272836 TSecr=175435649"
"167","0.425494425","104.102.83.39","192.168.1.118","TCP","2962","443 → 46762 [ACK] Seq=93101 Ack=887 Win=31104 Len=2896 TSval=175435649 TSecr=2050272816 [TCP segment of a reassembled PDU]"
"168","0.425609888","192.168.1.118","104.102.83.39","TCP","66","46762 → 443 [ACK] Seq=887 Ack=95997 Win=81536 Len=0 TSval=2050272840 TSecr=175435649"
"169","0.425744263","104.102.83.39","192.168.1.118","TCP","2962","443 → 46762 [ACK] Seq=95997 Ack=887 Win=31104 Len=2896 TSval=175435650 TSecr=2050272816 [TCP segment of a reassembled PDU]"
"170","0.425824225","192.168.1.118","104.102.83.39","TCP","66","46762 → 443 [ACK] Seq=887 Ack=98893 Win=87296 Len=0 TSval=2050272841 TSecr=175435650"
"171","0.425915888","104.102.83.39","192.168.1.118","TLSv1.2","2962","Application Data [TCP segment of a reassembled PDU]"
"172","0.425992625","192.168.1.118","104.102.83.39","TCP","66","46762 → 443 [ACK] Seq=887 Ack=101789 Win=93056 Len=0 TSval=2050272841 TSecr=175435651"
"173","0.426186863","104.102.83.39","192.168.1.118","TCP","2962","443 → 46762 [ACK] Seq=101789 Ack=887 Win=31104 Len=2896 TSval=175435652 TSecr=2050272816 [TCP segment of a reassembled PDU]"
"174","0.426263575","192.168.1.118","104.102.83.39","TCP","66","46762 → 443 [ACK] Seq=887 Ack=104685 Win=98944 Len=0 TSval=2050272841 TSecr=175435652"
"175","0.428127650","104.102.83.39","192.168.1.118","TLSv1.2","2962","Application Data [TCP segment of a reassembled PDU]"
"176","0.428269975","192.168.1.118","104.102.83.39","TCP","66","46762 → 443 [ACK] Seq=887 Ack=107581 Win=104704 Len=0 TSval=2050272843 TSecr=175435652"
"177","0.428380050","104.102.83.39","192.168.1.118","TCP","2962","443 → 46762 [ACK] Seq=107581 Ack=887 Win=31104 Len=2896 TSval=175435653 TSecr=2050272816 [TCP segment of a reassembled PDU]"
"178","0.428458088","192.168.1.118","104.102.83.39","TCP","66","46762 → 443 [ACK] Seq=887 Ack=110477 Win=110464 Len=0 TSval=2050272843 TSecr=175435653"
"179","0.431669713","104.102.83.39","192.168.1.118","TCP","2962","443 → 46762 [ACK] Seq=110477 Ack=887 Win=31104 Len=2896 TSval=175435654 TSecr=2050272816 [TCP segment of a reassembled PDU]"
"180","0.431736500","192.168.1.118","104.102.83.39","TCP","66","46762 → 443 [ACK] Seq=887 Ack=113373 Win=116224 Len=0 TSval=2050272847 TSecr=175435654"
"181","0.431779675","104.102.83.39","192.168.1.118","TCP","2962","443 → 46762 [ACK] Seq=113373 Ack=887 Win=31104 Len=2896 TSval=175435655 TSecr=2050272816 [TCP segment of a reassembled PDU]"
"182","0.431799413","192.168.1.118","104.102.83.39","TCP","66","46762 → 443 [ACK] Seq=887 Ack=116269 Win=122112 Len=0 TSval=2050272847 TSecr=175435655"
"183","0.431861550","104.102.83.39","192.168.1.118","TCP","2962","443 → 46762 [ACK] Seq=116269 Ack=887 Win=31104 Len=2896 TSval=175435656 TSecr=2050272816 [TCP segment of a reassembled PDU]"
"184","0.431878938","192.168.1.118","104.102.83.39","TCP","66","46762 → 443 [ACK] Seq=887 Ack=119165 Win=127872 Len=0 TSval=2050272847 TSecr=175435656"
"185","0.431892200","104.102.83.39","192.168.1.118","TCP","1514","443 → 46762 [ACK] Seq=119165 Ack=887 Win=31104 Len=1448 TSval=175435657 TSecr=2050272816 [TCP segment of a reassembled PDU]"
"186","0.431910113","192.168.1.118","104.102.83.39","TCP","66","46762 → 443 [ACK] Seq=887 Ack=120613 Win=130816 Len=0 TSval=2050272847 TSecr=175435657"
"187","0.438703563","172.217.12.202","192.168.1.118","TCP","74","443 → 46214 [SYN, ACK] Seq=0 Ack=1 Win=60192 Len=0 MSS=1380 SACK_PERM=1 TSval=2946056644 TSecr=2455496979 WS=256"
"188","0.438789488","192.168.1.118","172.217.12.202","TCP","66","46214 → 443 [ACK] Seq=1 Ack=1 Win=64256 Len=0 TSval=2455497015 TSecr=2946056644"
"189","0.438829450","104.102.83.39","192.168.1.118","TCP","1514","443 → 46762 [ACK] Seq=120613 Ack=887 Win=31104 Len=1448 TSval=175435657 TSecr=2050272816 [TCP segment of a reassembled PDU]"
"190","0.438849775","192.168.1.118","104.102.83.39","TCP","66","46762 → 443 [ACK] Seq=887 Ack=122061 Win=133632 Len=0 TSval=2050272854 TSecr=175435657"
"191","0.438864188","104.102.83.39","192.168.1.118","TCP","1514","443 → 46762 [ACK] Seq=122061 Ack=887 Win=31104 Len=1448 TSval=175435658 TSecr=2050272816 [TCP segment of a reassembled PDU]"
"192","0.438884825","192.168.1.118","104.102.83.39","TCP","66","46762 → 443 [ACK] Seq=887 Ack=123509 Win=136576 Len=0 TSval=2050272854 TSecr=175435658"
"193","0.439089900","104.102.83.39","192.168.1.118","TLSv1.2","1514","Application Data [TCP segment of a reassembled PDU]"
"194","0.439106863","192.168.1.118","104.102.83.39","TCP","66","46762 → 443 [ACK] Seq=887 Ack=124957 Win=139392 Len=0 TSval=2050272854 TSecr=175435658"
"195","0.439160625","104.102.83.39","192.168.1.118","TCP","5858","443 → 46762 [ACK] Seq=124957 Ack=887 Win=31104 Len=5792 TSval=175435659 TSecr=2050272816 [TCP segment of a reassembled PDU]"
"196","0.439184025","192.168.1.118","104.102.83.39","TCP","66","46762 → 443 [ACK] Seq=887 Ack=130749 Win=151040 Len=0 TSval=2050272854 TSecr=175435659"
"197","0.439208775","104.102.83.39","192.168.1.118","TLSv1.2","2962","Application Data [TCP segment of a reassembled PDU]"
"198","0.439228088","192.168.1.118","104.102.83.39","TCP","66","46762 → 443 [ACK] Seq=887 Ack=133645 Win=156800 Len=0 TSval=2050272854 TSecr=175435660"
"199","0.439253563","104.102.83.39","192.168.1.118","TCP","2962","443 → 46762 [ACK] Seq=133645 Ack=887 Win=31104 Len=2896 TSval=175435661 TSecr=2050272816 [TCP segment of a reassembled PDU]"
"200","0.439271938","192.168.1.118","104.102.83.39","TCP","66","46762 → 443 [ACK] Seq=887 Ack=136541 Win=162560 Len=0 TSval=2050272854 TSecr=175435661"
"201","0.439297625","104.102.83.39","192.168.1.118","TCP","2962","443 → 46762 [ACK] Seq=136541 Ack=887 Win=31104 Len=2896 TSval=175435662 TSecr=2050272816 [TCP segment of a reassembled PDU]"
"202","0.439316838","192.168.1.118","104.102.83.39","TCP","66","46762 → 443 [ACK] Seq=887 Ack=139437 Win=168448 Len=0 TSval=2050272854 TSecr=175435662"
"203","0.439338750","104.102.83.39","192.168.1.118","TCP","2962","443 → 46762 [ACK] Seq=139437 Ack=887 Win=31104 Len=2896 TSval=175435663 TSecr=2050272816 [TCP segment of a reassembled PDU]"
"204","0.439357313","192.168.1.118","104.102.83.39","TCP","66","46762 → 443 [ACK] Seq=887 Ack=142333 Win=174208 Len=0 TSval=2050272854 TSecr=175435663"
"205","0.441928775","104.102.83.39","192.168.1.118","TCP","2962","[TCP segment of a reassembled PDU]"
"206","0.441962025","192.168.1.118","104.102.83.39","TCP","66","46758 → 443 [ACK] Seq=1406 Ack=9451 Win=61312 Len=0 TSval=2050272857 TSecr=175435666"
"207","0.442579463","104.102.83.39","192.168.1.118","TLSv1.2","17442","Application Data [TCP segment of a reassembled PDU]"
"208","0.442609225","192.168.1.118","104.102.83.39","TCP","66","46758 → 443 [ACK] Seq=1406 Ack=26827 Win=44032 Len=0 TSval=2050272857 TSecr=175435666"
"209","0.442623763","104.102.83.39","192.168.1.118","TCP","2962","443 → 46762 [ACK] Seq=142333 Ack=887 Win=31104 Len=2896 TSval=175435664 TSecr=2050272816 [TCP segment of a reassembled PDU]"
"210","0.442647138","192.168.1.118","104.102.83.39","TCP","66","46762 → 443 [ACK] Seq=887 Ack=145229 Win=179968 Len=0 TSval=2050272857 TSecr=175435664"
"211","0.445505300","104.102.83.39","192.168.1.118","TCP","2962","443 → 46758 [ACK] Seq=26827 Ack=1406 Win=33280 Len=2896 TSval=175435666 TSecr=2050272818 [TCP segment of a reassembled PDU]"
"212","0.445528763","192.168.1.118","104.102.83.39","TCP","66","46758 → 443 [ACK] Seq=1406 Ack=29723 Win=41216 Len=0 TSval=2050272860 TSecr=175435666"
"213","0.445599163","104.102.83.39","192.168.1.118","TCP","2962","443 → 46762 [ACK] Seq=145229 Ack=887 Win=31104 Len=2896 TSval=175435665 TSecr=2050272816 [TCP segment of a reassembled PDU]"
"214","0.445621313","192.168.1.118","104.102.83.39","TCP","66","46762 → 443 [ACK] Seq=887 Ack=148125 Win=185728 Len=0 TSval=2050272860 TSecr=175435665"
"215","0.445645850","104.102.83.39","192.168.1.118","TLSv1.2","2139","Application Data, Application Data"
"216","0.445669250","192.168.1.118","104.102.83.39","TCP","66","46762 → 443 [ACK] Seq=887 Ack=150198 Win=189952 Len=0 TSval=2050272860 TSecr=175435666"
"217","0.445685513","104.102.83.39","192.168.1.118","TLSv1.2","4410","Application Data [TCP segment of a reassembled PDU]"
"218","0.452695000","104.102.83.39","192.168.1.118","TLSv1.2","871","Application Data"
"219","0.459046525","104.102.83.39","192.168.1.118","TLSv1.2","1049","Application Data"
"220","0.486241688","192.168.1.118","104.102.83.39","TCP","66","46758 → 443 [ACK] Seq=1406 Ack=35050 Win=35968 Len=0 TSval=2050272901 TSecr=175435666"
"221","0.494182888","192.168.1.118","104.102.83.39","TCP","66","46760 → 443 [ACK] Seq=1172 Ack=12609 Win=63360 Len=0 TSval=2050272909 TSecr=175435683"
"222","0.497187788","192.168.1.118","172.217.12.202","TLSv1","583","Client Hello"
"223","0.498076850","136.147.56.1","192.168.1.118","TLSv1.2","1313","Application Data"
"224","0.529469400","172.217.12.202","192.168.1.118","TCP","66","443 → 46214 [ACK] Seq=1 Ack=518 Win=61440 Len=0 TSval=2946056749 TSecr=2455497073"
"225","0.536850550","172.217.12.202","192.168.1.118","TLSv1.2","1484","Server Hello"
"226","0.536927363","192.168.1.118","172.217.12.202","TCP","66","46214 → 443 [ACK] Seq=518 Ack=1419 Win=63104 Len=0 TSval=2455497113 TSecr=2946056756"
"227","0.539187088","192.168.1.118","136.147.56.1","TCP","66","34844 → 443 [ACK] Seq=885 Ack=6385 Win=63356 Len=0 TSval=794409268 TSecr=618732378"
"228","0.541666150","172.217.12.202","192.168.1.118","TLSv1.2","1539","Certificate, Server Key Exchange, Server Hello Done"
"229","0.541717313","192.168.1.118","172.217.12.202","TCP","66","46214 → 443 [ACK] Seq=518 Ack=2892 Win=61696 Len=0 TSval=2455497118 TSecr=2946056756"
"230","0.626514538","192.168.1.118","172.217.12.202","TLSv1.2","192","Client Key Exchange, Change Cipher Spec, Encrypted Handshake Message"
"231","0.645305125","172.217.12.202","192.168.1.118","TLSv1.2","117","Change Cipher Spec, Encrypted Handshake Message"
"232","0.645418338","192.168.1.118","172.217.12.202","TCP","66","46214 → 443 [ACK] Seq=644 Ack=2943 Win=64128 Len=0 TSval=2455497221 TSecr=2946056860"
"233","0.683270988","192.168.1.118","172.217.12.202","TLSv1.2","338","Application Data"
"234","0.702325638","172.217.12.202","192.168.1.118","TCP","66","443 → 46214 [ACK] Seq=2943 Ack=916 Win=62464 Len=0 TSval=2946056921 TSecr=2455497259"
"235","0.712475575","172.217.12.202","192.168.1.118","TLSv1.2","977","Application Data"
"236","0.713356763","172.217.12.202","192.168.1.118","TLSv1.2","178","Application Data"
"237","0.713416763","172.217.12.202","192.168.1.118","TLSv1.2","100","Application Data"
"238","0.713681488","192.168.1.118","172.217.12.202","TCP","66","46214 → 443 [ACK] Seq=916 Ack=4000 Win=64128 Len=0 TSval=2455497289 TSecr=2946056932"
"239","0.735109600","192.168.1.118","209.18.47.62","DNS","82","Standard query 0x86f3 A secure2.sfdcstatic.com"
"240","0.756468100","209.18.47.62","192.168.1.118","DNS","179","Standard query response 0x86f3 A secure2.sfdcstatic.com CNAME secure2.sfdcstatic.com.edgekey.net CNAME e4745.b.akamaiedge.net A 104.64.212.198"
"241","0.757070288","192.168.1.118","209.18.47.62","DNS","82","Standard query 0x9e80 AAAA secure2.sfdcstatic.com"
"242","0.774890225","209.18.47.62","192.168.1.118","DNS","221","Standard query response 0x9e80 AAAA secure2.sfdcstatic.com CNAME secure2.sfdcstatic.com.edgekey.net CNAME e4745.b.akamaiedge.net SOA n0b.akamaiedge.net"
"243","0.779239838","192.168.1.118","104.64.212.198","TCP","74","37930 → 443 [SYN] Seq=0 Win=64240 Len=0 MSS=1460 SACK_PERM=1 TSval=2959717936 TSecr=0 WS=128"
"244","0.785299375","192.168.1.118","136.147.56.1","TLSv1.2","385","Application Data"
"245","0.794063400","192.168.1.118","104.102.83.39","TLSv1.2","313","Application Data"
"246","0.799847813","104.64.212.198","192.168.1.118","TCP","74","443 → 37930 [SYN, ACK] Seq=0 Ack=1 Win=28960 Len=0 MSS=1460 SACK_PERM=1 TSval=1458764458 TSecr=2959717936 WS=128"
"247","0.800037788","192.168.1.118","104.64.212.198","TCP","66","37930 → 443 [ACK] Seq=1 Ack=1 Win=64256 Len=0 TSval=2959717957 TSecr=1458764458"
"248","0.813504713","104.102.83.39","192.168.1.118","TLSv1.2","1043","Application Data"
"249","0.813656338","192.168.1.118","104.102.83.39","TCP","66","46758 → 443 [ACK] Seq=1653 Ack=36027 Win=63232 Len=0 TSval=2050273228 TSecr=175436043"
"250","0.818981300","192.168.1.118","104.64.212.198","TLSv1","583","Client Hello"
"251","0.819404813","192.168.1.118","104.102.83.39","TLSv1.2","315","Application Data"
"252","0.829340425","192.168.1.118","104.102.83.39","TLSv1.2","317","Application Data"
"253","0.838652625","192.168.1.118","104.102.83.39","TLSv1.2","316","Application Data"
"254","0.839403613","104.64.212.198","192.168.1.118","TCP","66","443 → 37930 [ACK] Seq=1 Ack=518 Win=30080 Len=0 TSval=1458764499 TSecr=2959717976"
"255","0.842530388","104.102.83.39","192.168.1.118","TLSv1.2","1093","Application Data"
"256","0.844196375","104.64.212.198","192.168.1.118","TLSv1.2","3339","Server Hello, Certificate, Server Key Exchange, Server Hello Done"
"257","0.844332200","192.168.1.118","104.64.212.198","TCP","66","37930 → 443 [ACK] Seq=518 Ack=3274 Win=61056 Len=0 TSval=2959718001 TSecr=1458764500"
"258","0.846335475","192.168.1.118","104.64.212.198","TLSv1.2","192","Client Key Exchange, Change Cipher Spec, Encrypted Handshake Message"
"259","0.848757925","136.147.56.1","192.168.1.118","TCP","66","443 → 34842 [ACK] Seq=15824 Ack=320 Win=5245 Len=0 TSval=618732731 TSecr=794409514"
"260","0.850084838","192.168.1.118","104.102.83.39","TLSv1.2","316","Application Data"
"261","0.853137575","104.102.83.39","192.168.1.118","TLSv1.2","1123","Application Data"
"262","0.853309675","192.168.1.118","104.102.83.39","TCP","66","46760 → 443 [ACK] Seq=1423 Ack=13666 Win=63104 Len=0 TSval=2050273268 TSecr=175436081"
"263","0.861784600","192.168.1.118","104.102.83.39","TLSv1.2","318","Application Data"
"264","0.862646513","104.102.83.39","192.168.1.118","TLSv1.2","1062","Application Data"
"265","0.862801363","192.168.1.118","104.102.83.39","TCP","66","46762 → 443 [ACK] Seq=1137 Ack=151194 Win=192768 Len=0 TSval=2050273278 TSecr=175436092"
"266","0.870917813","104.64.212.198","192.168.1.118","TLSv1.2","117","Change Cipher Spec, Encrypted Handshake Message"
"267","0.872127363","192.168.1.118","104.64.212.198","TLSv1.2","305","Application Data"
"268","0.877622788","104.102.83.39","192.168.1.118","TLSv1.2","904","Application Data"
"269","0.892943863","104.102.83.39","192.168.1.118","TLSv1.2","1051","Application Data"
"270","0.906986013","104.64.212.198","192.168.1.118","TLSv1.2","414","Application Data"
"271","0.909720825","192.168.1.118","104.102.83.39","TLSv1.2","316","Application Data"
"272","0.909853100","192.168.1.118","104.102.83.39","TLSv1.2","315","Application Data"
"273","0.910704588","192.168.1.118","209.18.47.62","DNS","76","Standard query 0x5e0c A a.sfdcstatic.com"
"274","0.914239875","192.168.1.118","104.102.83.39","TLSv1.2","316","Application Data"
"275","0.914467975","192.168.1.118","104.102.83.39","TLSv1.2","315","Application Data"
"276","0.940183213","104.102.83.39","192.168.1.118","TLSv1.2","1017","Application Data"
"277","0.944645438","209.18.47.62","192.168.1.118","DNS","167","Standard query response 0x5e0c A a.sfdcstatic.com CNAME a.sfdcstatic.com.edgekey.net CNAME e4745.b.akamaiedge.net A 104.102.83.39"
"278","0.944835413","192.168.1.118","209.18.47.62","DNS","76","Standard query 0xd6b1 AAAA a.sfdcstatic.com"
"279","0.946273550","104.102.83.39","192.168.1.118","TLSv1.2","1056","Application Data"
"280","0.946353513","192.168.1.118","104.102.83.39","TCP","66","46762 → 443 [ACK] Seq=1387 Ack=152184 Win=195712 Len=0 TSval=2050273361 TSecr=175436176"
"281","0.947201813","192.168.1.118","104.64.212.198","TCP","66","37930 → 443 [ACK] Seq=883 Ack=3673 Win=64128 Len=0 TSval=2959718104 TSecr=1458764565"
"282","0.948028525","104.102.83.39","192.168.1.118","TLSv1.2","1061","Application Data"
"283","0.948093150","104.102.83.39","192.168.1.118","TLSv1.2","1100","Application Data"
"284","0.952454363","136.147.56.1","192.168.1.118","TCP","1414","[TCP segment of a reassembled PDU]"
"285","0.955122663","136.147.56.1","192.168.1.118","TLSv1.2","123","Application Data"
"286","0.955191588","192.168.1.118","136.147.56.1","TCP","66","34842 → 443 [ACK] Seq=320 Ack=17229 Win=63356 Len=0 TSval=794409684 TSecr=618732834"
"287","0.960998600","209.18.47.62","192.168.1.118","DNS","209","Standard query response 0xd6b1 AAAA a.sfdcstatic.com CNAME a.sfdcstatic.com.edgekey.net CNAME e4745.b.akamaiedge.net SOA n0b.akamaiedge.net"
"288","0.981205725","192.168.1.118","104.102.83.39","TCP","66","46758 → 443 [ACK] Seq=2402 Ack=38843 Win=72832 Len=0 TSval=2050273396 TSecr=175436170"
"289","0.988229400","192.168.1.118","104.102.83.39","TCP","66","46760 → 443 [ACK] Seq=1924 Ack=15685 Win=64128 Len=0 TSval=2050273403 TSecr=175436176"
"290","0.988314550","192.168.1.118","104.102.83.39","TCP","66","46754 → 443 [ACK] Seq=1350 Ack=12452 Win=64128 Len=0 TSval=2050273403 TSecr=175436176"
"291","1.077491300","192.168.1.118","104.102.83.39","TCP","74","46768 → 443 [SYN] Seq=0 Win=64240 Len=0 MSS=1460 SACK_PERM=1 TSval=2050273492 TSecr=0 WS=128"
"292","1.096495950","104.102.83.39","192.168.1.118","TCP","74","443 → 46768 [SYN, ACK] Seq=0 Ack=1 Win=28960 Len=0 MSS=1460 SACK_PERM=1 TSval=175436326 TSecr=2050273492 WS=128"
"293","1.096589188","192.168.1.118","104.102.83.39","TCP","66","46768 → 443 [ACK] Seq=1 Ack=1 Win=64256 Len=0 TSval=2050273511 TSecr=175436326"
"294","1.105338563","192.168.1.118","192.168.1.102","TCP","176","44768 → 8009 [PSH, ACK] Seq=1 Ack=1 Win=501 Len=110 TSval=2257040932 TSecr=5156296 [TCP segment of a reassembled PDU]"
"295","1.121563063","192.168.1.118","104.102.83.39","TLSv1","583","Client Hello"
"296","1.136283375","192.168.1.102","192.168.1.118","TCP","176","8009 → 44768 [PSH, ACK] Seq=1 Ack=111 Win=294 Len=110 TSval=5156797 TSecr=2257040932 [TCP segment of a reassembled PDU]"
"297","1.136353500","192.168.1.118","192.168.1.102","TCP","66","44768 → 8009 [ACK] Seq=111 Ack=111 Win=501 Len=0 TSval=2257040963 TSecr=5156797"
"298","1.143658225","104.102.83.39","192.168.1.118","TCP","66","443 → 46768 [ACK] Seq=1 Ack=518 Win=30080 Len=0 TSval=175436372 TSecr=2050273536"
"299","1.145332263","104.102.83.39","192.168.1.118","TLSv1.2","2962","Server Hello"
"300","1.145379088","192.168.1.118","104.102.83.39","TCP","66","46768 → 443 [ACK] Seq=518 Ack=2897 Win=61440 Len=0 TSval=2050273560 TSecr=175436373"
"301","1.145407275","104.102.83.39","192.168.1.118","TLSv1.2","443","Certificate, Server Key Exchange, Server Hello Done"
"302","1.145422300","192.168.1.118","104.102.83.39","TCP","66","46768 → 443 [ACK] Seq=518 Ack=3274 Win=61184 Len=0 TSval=2050273560 TSecr=175436374"
"303","1.147559388","192.168.1.118","104.102.83.39","TLSv1.2","192","Client Key Exchange, Change Cipher Spec, Encrypted Handshake Message"
"304","1.199252063","104.102.83.39","192.168.1.118","TLSv1.2","117","Change Cipher Spec, Encrypted Handshake Message"
"305","1.199751213","192.168.1.118","104.102.83.39","TLSv1.2","327","Application Data"
"306","1.217991925","104.102.83.39","192.168.1.118","TCP","1514","[TCP segment of a reassembled PDU]"
"307","1.220019750","104.102.83.39","192.168.1.118","TLSv1.2","4802","Application Data"
"308","1.220183063","192.168.1.118","104.102.83.39","TCP","66","46768 → 443 [ACK] Seq=905 Ack=9509 Win=64128 Len=0 TSval=2050273635 TSecr=175436447"
"309","2.617075713","192.168.1.104","255.255.255.255","UDP","217","49154 → 6666 Len=175"
"310","4.565117088","192.168.1.101","224.0.0.251","MDNS","414","Standard query 0x0000 PTR _googlecast._tcp.local, "QM" question PTR _homekit._tcp.local, "QM" question PTR _uscan._tcp.local, "QM" question PTR _ptp._tcp.local, "QM" question PTR _ippusb._tcp.local, "QM" question PTR _scanner._tcp.local, "QM" question PTR _ipp._tcp.local, "QM" question PTR _pdl-datastream._tcp.local, "QM" question PTR _uscans._tcp.local, "QM" question PTR _ipps._tcp.local, "QM" question PTR _printer._tcp.local, "QM" question PTR _airplay._tcp.local, "QM" question PTR _raop._tcp.local, "QM" question PTR _airport._tcp.local, "QM" question PTR _companion-link._tcp.local, "QM" question PTR _rdlink._tcp.local, "QM" question PTR Google-Home-Mini-2c3f16b2da5c4b6fd6cfbfba61c12490._googlecast._tcp.local PTR cjqg._companion-link._tcp.local OPT"
"311","5.070977200","192.168.1.118","142.250.31.188","TLSv1.2","100","Application Data"
"312","5.102366725","142.250.31.188","192.168.1.118","TCP","66","5228 → 42388 [ACK] Seq=1 Ack=35 Win=248 Len=0 TSval=3369787237 TSecr=3104634794"
"313","5.114733050","142.250.31.188","192.168.1.118","TLSv1.2","100","Application Data"
"314","5.115728038","192.168.1.118","142.250.31.188","TLSv1.2","110","Application Data"
"315","5.145533513","142.250.31.188","192.168.1.118","TCP","66","5228 → 42388 [ACK] Seq=35 Ack=79 Win=248 Len=0 TSval=3369787282 TSecr=3104634838"
"316","5.587498500","192.168.1.104","255.255.255.255","UDP","217","49154 → 6666 Len=175"
"317","6.140498325","192.168.1.118","192.168.1.102","TCP","176","44768 → 8009 [PSH, ACK] Seq=111 Ack=111 Win=501 Len=110 TSval=2257045967 TSecr=5156797 [TCP segment of a reassembled PDU]"
"318","6.148009838","192.168.1.102","192.168.1.118","TCP","176","8009 → 44768 [PSH, ACK] Seq=111 Ack=221 Win=294 Len=110 TSval=5157301 TSecr=2257045967 [TCP segment of a reassembled PDU]"
"319","6.148222988","192.168.1.118","192.168.1.102","TCP","66","44768 → 8009 [ACK] Seq=221 Ack=221 Win=501 Len=0 TSval=2257045975 TSecr=5157301"
"320","8.659460038","192.168.1.104","255.255.255.255","UDP","217","49154 → 6666 Len=175"
