frame.number,_ws.col.Time,_ws.col.Source,_ws.col.Destination,_ws.col.Protocol,frame.len,_ws.col.Info
"1","0.000000000","192.168.1.118","192.168.1.102","TCP","176","44768 → 8009 [PSH, ACK] Seq=1 Ack=1 Win=501 Len=110 TSval=2256900416 TSecr=5142244 [TCP segment of a reassembled PDU]"
"2","0.011800012","192.168.1.102","192.168.1.118","TCP","176","8009 → 44768 [PSH, ACK] Seq=1 Ack=111 Win=294 Len=110 TSval=5142745 TSecr=2256900416 [TCP segment of a reassembled PDU]"
"3","0.011875900","192.168.1.118","192.168.1.102","TCP","66","44768 → 8009 [ACK] Seq=111 Ack=111 Win=501 Len=0 TSval=2256900428 TSecr=5142745"
"4","0.203288350","199.232.37.140","192.168.1.118","TLSv1.2","1410","Application Data, Application Data, Application Data, Application Data"
"5","0.206053700","199.232.37.140","192.168.1.118","TLSv1.2","6173","Application Data, Application Data, Application Data, Application Data, Application Data, Application Data, Application Data"
"6","0.207282087","192.168.1.118","199.232.37.140","TCP","66","38112 → 443 [ACK] Seq=1 Ack=7452 Win=443 Len=0 TSval=1501515159 TSecr=2813850955"
"7","0.213871225","199.232.37.140","192.168.1.118","TLSv1.2","1418","[TCP Previous segment not captured] , Ignored Unknown Record"
"8","0.213956487","192.168.1.118","199.232.37.140","TCP","78","[TCP Dup ACK 6#1] 38112 → 443 [ACK] Seq=1 Ack=7452 Win=443 Len=0 TSval=1501515166 TSecr=2813850955 SLE=8804 SRE=10156"
"9","0.216463050","199.232.37.140","192.168.1.118","TLSv1.2","2770","Ignored Unknown Record"
"10","0.216548850","192.168.1.118","199.232.37.140","TCP","78","[TCP Dup ACK 6#2] 38112 → 443 [ACK] Seq=1 Ack=7452 Win=443 Len=0 TSval=1501515168 TSecr=2813850955 SLE=8804 SRE=12860"
"11","0.216595787","199.232.37.140","192.168.1.118","TLSv1.2","1418","[TCP Fast Retransmission] , Application Data"
"12","0.216634075","192.168.1.118","199.232.37.140","TCP","66","38112 → 443 [ACK] Seq=1 Ack=12860 Win=401 Len=0 TSval=1501515169 TSecr=2813850963"
"13","0.237017937","199.232.37.140","192.168.1.118","TLSv1.2","1418","Ignored Unknown Record"
"14","0.238939637","199.232.37.140","192.168.1.118","TLSv1.2","4122","Ignored Unknown Record"
"15","0.239035962","192.168.1.118","199.232.37.140","TCP","66","38112 → 443 [ACK] Seq=1 Ack=18268 Win=484 Len=0 TSval=1501515191 TSecr=2813850970"
"16","0.239127437","199.232.37.140","192.168.1.118","TLSv1.2","83","Ignored Unknown Record"
"17","0.256813050","199.232.37.140","192.168.1.118","TLSv1.2","1418","Application Data"
"18","0.256886825","192.168.1.118","199.232.37.140","TCP","66","38112 → 443 [ACK] Seq=1 Ack=19637 Win=522 Len=0 TSval=1501515209 TSecr=2813850970"
"19","0.260752237","199.232.37.140","192.168.1.118","TLSv1.2","5474","Application Data, Application Data, Application Data, Application Data"
"20","0.260970175","192.168.1.118","199.232.37.140","TCP","66","38112 → 443 [ACK] Seq=1 Ack=25045 Win=484 Len=0 TSval=1501515213 TSecr=2813850975"
"21","0.261306375","199.232.37.140","192.168.1.118","TLSv1.2","6072","Application Data, Application Data, Application Data, Application Data, Application Data, Application Data, Application Data"
"22","0.261659950","192.168.1.118","199.232.37.140","TCP","66","38112 → 443 [ACK] Seq=1 Ack=31051 Win=438 Len=0 TSval=1501515214 TSecr=2813850975"
"23","0.271532312","192.168.1.118","209.18.47.62","DNS","80","Standard query 0x1a2c A www.redditstatic.com"
"24","0.286790450","199.232.37.140","192.168.1.118","TLSv1.2","169","Application Data, Application Data, Application Data"
"25","0.295326862","209.18.47.62","192.168.1.118","DNS","131","Standard query response 0x1a2c A www.redditstatic.com CNAME reddit.map.fastly.net A 199.232.37.140"
"26","0.295635525","192.168.1.118","209.18.47.62","DNS","80","Standard query 0x36fe AAAA www.redditstatic.com"
"27","0.310987050","209.18.47.62","192.168.1.118","DNS","173","Standard query response 0x36fe AAAA www.redditstatic.com CNAME reddit.map.fastly.net SOA ns1.fastly.net"
"28","0.312592300","192.168.1.118","199.232.37.140","TCP","74","38114 → 443 [SYN] Seq=0 Win=64240 Len=0 MSS=1460 SACK_PERM=1 TSval=1501515264 TSecr=0 WS=128"
"29","0.326503125","199.232.37.140","192.168.1.118","TLSv1.2","205","Application Data, Application Data, Application Data"
"30","0.326553450","192.168.1.118","199.232.37.140","TCP","66","38112 → 443 [ACK] Seq=1 Ack=31293 Win=532 Len=0 TSval=1501515278 TSecr=2813850982"
"31","0.336614287","199.232.37.140","192.168.1.118","TCP","74","443 → 38114 [SYN, ACK] Seq=0 Ack=1 Win=27040 Len=0 MSS=1364 SACK_PERM=1 TSval=2811929281 TSecr=1501515264 WS=512"
"32","0.336756987","192.168.1.118","199.232.37.140","TCP","66","38114 → 443 [ACK] Seq=1 Ack=1 Win=64256 Len=0 TSval=1501515289 TSecr=2811929281"
"33","0.344792262","199.232.37.140","192.168.1.118","TLSv1.2","183","Application Data, Application Data, Application Data"
"34","0.351947362","199.232.37.140","192.168.1.118","TLSv1.2","1418","Application Data"
"35","0.353870775","199.232.37.140","192.168.1.118","TLSv1.2","2759","Application Data, Application Data, Application Data, Application Data"
"36","0.354136037","192.168.1.118","199.232.37.140","TLSv1","583","Client Hello"
"37","0.354246325","192.168.1.118","199.232.37.140","TCP","66","38112 → 443 [ACK] Seq=1 Ack=35455 Win=500 Len=0 TSval=1501515306 TSecr=2813850997"
"38","0.356466075","199.232.37.140","192.168.1.118","TLSv1.2","2770","Application Data, Application Data"
"39","0.356927700","192.168.1.118","199.232.37.140","TCP","66","38112 → 443 [ACK] Seq=1 Ack=38159 Win=479 Len=0 TSval=1501515309 TSecr=2813850999"
"40","0.358654462","199.232.37.140","192.168.1.118","TLSv1.2","2770","Application Data, Application Data"
"41","0.358817250","192.168.1.118","199.232.37.140","TCP","66","38112 → 443 [ACK] Seq=1 Ack=40863 Win=458 Len=0 TSval=1501515311 TSecr=2813850999"
"42","0.360469712","199.232.37.140","192.168.1.118","TLSv1.2","2770","Application Data, Application Data"
"43","0.361517212","192.168.1.118","199.232.37.140","TCP","66","38112 → 443 [ACK] Seq=1 Ack=43567 Win=437 Len=0 TSval=1501515313 TSecr=2813850999"
"44","0.362363950","199.232.37.140","192.168.1.118","TLSv1.2","2770","Application Data, Application Data"
"45","0.362789787","192.168.1.118","199.232.37.140","TCP","66","38112 → 443 [ACK] Seq=1 Ack=46271 Win=416 Len=0 TSval=1501515315 TSecr=2813850999"
"46","0.364652012","199.232.37.140","192.168.1.118","TLSv1.2","2770","Application Data, Application Data"
"47","0.365149687","192.168.1.118","199.232.37.140","TCP","66","38112 → 443 [ACK] Seq=1 Ack=48975 Win=395 Len=0 TSval=1501515317 TSecr=2813850999"
"48","0.367681087","199.232.37.140","192.168.1.118","TLSv1.2","493","Application Data, Application Data"
"49","0.370233237","199.232.37.140","192.168.1.118","TLSv1.2","2770","Application Data, Application Data"
"50","0.371915125","199.232.37.140","192.168.1.118","TLSv1.2","5474","Application Data, Application Data, Application Data, Application Data"
"51","0.372034712","199.232.37.140","192.168.1.118","TLSv1.2","8178","Application Data, Application Data, Application Data, Application Data, Application Data, Application Data"
"52","0.372132562","199.232.37.140","192.168.1.118","TLSv1.2","5474","Application Data, Application Data, Application Data, Application Data"
"53","0.374814425","192.168.1.118","199.232.37.140","TCP","66","38112 → 443 [ACK] Seq=1 Ack=71034 Win=223 Len=0 TSval=1501515327 TSecr=2813850999"
"54","0.378600612","199.232.37.140","192.168.1.118","TLSv1.2","2770","Application Data, Application Data, Application Data, Application Data, Application Data"
"55","0.378660200","199.232.37.140","192.168.1.118","TCP","66","443 → 38114 [ACK] Seq=1 Ack=518 Win=28160 Len=0 TSval=2811929290 TSecr=1501515306"
"56","0.378723325","199.232.37.140","192.168.1.118","TLSv1.2","1418","Application Data [TCP segment of a reassembled PDU]"
"57","0.378757687","199.232.37.140","192.168.1.118","TLSv1.2","1418","Application Data, Application Data, Application Data, Application Data"
"58","0.380052425","199.232.37.140","192.168.1.118","TLSv1.2","4122","Application Data, Application Data, Application Data, Application Data, Application Data"
"59","0.380235350","199.232.37.140","192.168.1.118","TLSv1.2","8178","Application Data, Application Data, Application Data, Application Data, Application Data, Application Data, Application Data, Application Data, Application Data, Application Data, Application Data, Application Data, Application Data, Application Data"
"60","0.380275175","199.232.37.140","192.168.1.118","TLSv1.2","2770","Server Hello"
"61","0.380339312","192.168.1.118","199.232.37.140","TCP","66","38114 → 443 [ACK] Seq=518 Ack=2705 Win=61568 Len=0 TSval=1501515332 TSecr=2811929290"
"62","0.381472775","192.168.1.118","199.232.37.140","TCP","66","38112 → 443 [ACK] Seq=1 Ack=88610 Win=86 Len=0 TSval=1501515333 TSecr=2813851002"
"63","0.381865087","192.168.1.118","199.232.37.140","TCP","66","[TCP Window Update] 38112 → 443 [ACK] Seq=1 Ack=88610 Win=179 Len=0 TSval=1501515334 TSecr=2813851002"
"64","0.391627775","199.232.37.140","192.168.1.118","TLSv1.2","600","Certificate, Server Key Exchange, Server Hello Done"
"65","0.391694662","192.168.1.118","199.232.37.140","TCP","66","38114 → 443 [ACK] Seq=518 Ack=3239 Win=63104 Len=0 TSval=1501515344 TSecr=2811929290"
"66","0.391769412","199.232.37.140","192.168.1.118","TLSv1.2","367","Application Data, Application Data, Application Data, Application Data, Application Data"
"67","0.391912850","199.232.37.140","192.168.1.118","TLSv1.2","6826","Application Data, Application Data, Application Data, Application Data, Application Data"
"68","0.392141100","199.232.37.140","192.168.1.118","TLSv1.2","3930","Application Data, Application Data, Application Data"
"69","0.392228812","192.168.1.118","199.232.37.140","TCP","66","38112 → 443 [ACK] Seq=1 Ack=99535 Win=321 Len=0 TSval=1501515344 TSecr=2813851004"
"70","0.394209812","192.168.1.118","199.232.37.140","TLSv1.2","192","Client Key Exchange, Change Cipher Spec, Encrypted Handshake Message"
"71","0.404150412","199.232.37.140","192.168.1.118","TLSv1.2","1418","Application Data [TCP segment of a reassembled PDU]"
"72","0.440233762","192.168.1.118","199.232.37.140","TCP","74","38116 → 443 [SYN] Seq=0 Win=64240 Len=0 MSS=1460 SACK_PERM=1 TSval=1501515392 TSecr=0 WS=128"
"73","0.440613150","192.168.1.118","199.232.37.140","TCP","74","38118 → 443 [SYN] Seq=0 Win=64240 Len=0 MSS=1460 SACK_PERM=1 TSval=1501515392 TSecr=0 WS=128"
"74","0.440876975","192.168.1.118","199.232.37.140","TCP","74","38120 → 443 [SYN] Seq=0 Win=64240 Len=0 MSS=1460 SACK_PERM=1 TSval=1501515393 TSecr=0 WS=128"
"75","0.440949575","192.168.1.118","209.18.47.62","DNS","82","Standard query 0xfab4 A styles.redditmedia.com"
"76","0.441937950","192.168.1.118","209.18.47.62","DNS","75","Standard query 0x72e1 A preview.redd.it"
"77","0.442858662","192.168.1.118","209.18.47.62","DNS","75","Standard query 0x06cd A preview.redd.it"
"78","0.445170900","192.168.1.118","199.232.37.140","TCP","66","38112 → 443 [ACK] Seq=1 Ack=100887 Win=532 Len=0 TSval=1501515397 TSecr=2813851012"
"79","0.448754550","192.168.1.118","199.232.37.140","TCP","74","38122 → 443 [SYN] Seq=0 Win=64240 Len=0 MSS=1460 SACK_PERM=1 TSval=1501515401 TSecr=0 WS=128"
"80","0.449826062","192.168.1.118","209.18.47.62","DNS","75","Standard query 0x3636 A preview.redd.it"
"81","0.450388175","192.168.1.118","209.18.47.62","DNS","84","Standard query 0xde4d A a.thumbs.redditmedia.com"
"82","0.450709350","192.168.1.118","209.18.47.62","DNS","75","Standard query 0x065f A preview.redd.it"
"83","0.454965375","192.168.1.118","209.18.47.62","DNS","84","Standard query 0x6e12 A b.thumbs.redditmedia.com"
"84","0.455161800","199.232.37.140","192.168.1.118","TLSv1.2","5474","Application Data, Application Data, Application Data, Application Data, Application Data, Application Data, Application Data"
"85","0.455472950","192.168.1.118","199.232.37.140","TCP","66","38112 → 443 [ACK] Seq=1 Ack=106295 Win=517 Len=0 TSval=1501515407 TSecr=2813851012"
"86","0.456797850","199.232.37.140","192.168.1.118","TLSv1.2","4122","Application Data, Application Data, Application Data"
"87","0.456863137","199.232.37.140","192.168.1.118","TLSv1.2","2770","Application Data [TCP segment of a reassembled PDU]"
"88","0.457244100","199.232.37.140","192.168.1.118","TLSv1.2","9530","Application Data, Application Data, Application Data, Application Data, Application Data, Application Data, Application Data, Application Data, Application Data"
"89","0.457346525","192.168.1.118","199.232.37.140","TCP","66","38112 → 443 [ACK] Seq=1 Ack=122519 Win=391 Len=0 TSval=1501515409 TSecr=2813851012"
"90","0.463412275","199.232.37.140","192.168.1.118","TLSv1.2","4122","Application Data, Application Data, Application Data"
"91","0.463446087","199.232.37.140","192.168.1.118","TLSv1.2","1418","Application Data [TCP segment of a reassembled PDU]"
"92","0.463592475","199.232.37.140","192.168.1.118","TLSv1.2","6593","Application Data, Application Data, Application Data, Application Data, Application Data, Application Data, Application Data, Application Data, Application Data, Application Data, Application Data, Application Data, Application Data"
"93","0.463635787","199.232.37.140","192.168.1.118","TLSv1.2","117","Change Cipher Spec, Encrypted Handshake Message"
"94","0.464924412","192.168.1.118","199.232.37.140","TCP","66","38112 → 443 [ACK] Seq=1 Ack=134454 Win=298 Len=0 TSval=1501515417 TSecr=2813851012"
"95","0.465294562","192.168.1.118","199.232.37.140","TLSv1.2","256","Application Data"
"96","0.466813250","192.168.1.118","209.18.47.62","DNS","75","Standard query 0x1243 A preview.redd.it"
"97","0.468571987","199.232.37.140","192.168.1.118","TCP","74","443 → 38116 [SYN, ACK] Seq=0 Ack=1 Win=27040 Len=0 MSS=1364 SACK_PERM=1 TSval=274378902 TSecr=1501515392 WS=512"
"98","0.468672612","192.168.1.118","199.232.37.140","TCP","66","38116 → 443 [ACK] Seq=1 Ack=1 Win=64256 Len=0 TSval=1501515421 TSecr=274378902"
"99","0.473397050","199.232.37.140","192.168.1.118","TCP","74","443 → 38118 [SYN, ACK] Seq=0 Ack=1 Win=27040 Len=0 MSS=1364 SACK_PERM=1 TSval=273686041 TSecr=1501515392 WS=512"
"100","0.473475250","192.168.1.118","199.232.37.140","TCP","66","38118 → 443 [ACK] Seq=1 Ack=1 Win=64256 Len=0 TSval=1501515425 TSecr=273686041"
"101","0.476899487","209.18.47.62","192.168.1.118","DNS","135","Standard query response 0xde4d A a.thumbs.redditmedia.com CNAME reddit.map.fastly.net A 199.232.37.140"
"102","0.477207087","192.168.1.118","209.18.47.62","DNS","84","Standard query 0xa62c AAAA a.thumbs.redditmedia.com"
"103","0.477972025","209.18.47.62","192.168.1.118","DNS","133","Standard query response 0xfab4 A styles.redditmedia.com CNAME reddit.map.fastly.net A 199.232.37.140"
"104","0.478059450","209.18.47.62","192.168.1.118","DNS","126","Standard query response 0x3636 A preview.redd.it CNAME reddit.map.fastly.net A 199.232.37.140"
"105","0.478161912","209.18.47.62","192.168.1.118","DNS","126","Standard query response 0x72e1 A preview.redd.it CNAME reddit.map.fastly.net A 199.232.37.140"
"106","0.478240000","209.18.47.62","192.168.1.118","DNS","126","Standard query response 0x06cd A preview.redd.it CNAME reddit.map.fastly.net A 199.232.37.140"
"107","0.478317325","209.18.47.62","192.168.1.118","DNS","126","Standard query response 0x065f A preview.redd.it CNAME reddit.map.fastly.net A 199.232.37.140"
"108","0.478395087","199.232.37.140","192.168.1.118","TCP","74","443 → 38120 [SYN, ACK] Seq=0 Ack=1 Win=27040 Len=0 MSS=1364 SACK_PERM=1 TSval=2814263514 TSecr=1501515393 WS=512"
"109","0.478491062","192.168.1.118","199.232.37.140","TCP","66","38120 → 443 [ACK] Seq=1 Ack=1 Win=64256 Len=0 TSval=1501515430 TSecr=2814263514"
"110","0.478557150","199.232.37.140","192.168.1.118","TCP","74","443 → 38122 [SYN, ACK] Seq=0 Ack=1 Win=27040 Len=0 MSS=1364 SACK_PERM=1 TSval=1115550124 TSecr=1501515401 WS=512"
"111","0.478651037","192.168.1.118","199.232.37.140","TCP","66","38122 → 443 [ACK] Seq=1 Ack=1 Win=64256 Len=0 TSval=1501515431 TSecr=1115550124"
"112","0.478865150","192.168.1.118","209.18.47.62","DNS","82","Standard query 0xea16 AAAA styles.redditmedia.com"
"113","0.479079662","192.168.1.118","209.18.47.62","DNS","75","Standard query 0xe2fd AAAA preview.redd.it"
"114","0.479318175","192.168.1.118","209.18.47.62","DNS","75","Standard query 0xde61 AAAA preview.redd.it"
"115","0.479502275","192.168.1.118","209.18.47.62","DNS","75","Standard query 0x1638 AAAA preview.redd.it"
"116","0.479710875","192.168.1.118","209.18.47.62","DNS","75","Standard query 0xa24d AAAA preview.redd.it"
"117","0.484237362","209.18.47.62","192.168.1.118","DNS","126","Standard query response 0x1243 A preview.redd.it CNAME reddit.map.fastly.net A 199.232.37.140"
"118","0.484465250","192.168.1.118","209.18.47.62","DNS","75","Standard query 0xfe21 AAAA preview.redd.it"
"119","0.486374875","192.168.1.118","199.232.37.140","TLSv1","583","Client Hello"
"120","0.486785812","209.18.47.62","192.168.1.118","DNS","135","Standard query response 0x6e12 A b.thumbs.redditmedia.com CNAME reddit.map.fastly.net A 199.232.37.140"
"121","0.487011987","192.168.1.118","209.18.47.62","DNS","84","Standard query 0x6ab7 AAAA b.thumbs.redditmedia.com"
"122","0.493815325","199.232.37.140","192.168.1.118","TLSv1.2","5474","Application Data, Application Data, Application Data, Application Data"
"123","0.493966087","199.232.37.140","192.168.1.118","TLSv1.2","4176","Application Data, Application Data, Application Data, Application Data"
"124","0.503254487","192.168.1.118","199.232.37.140","TLSv1","583","Client Hello"
"125","0.516978575","209.18.47.62","192.168.1.118","DNS","171","Standard query response 0xde61 AAAA preview.redd.it CNAME reddit.map.fastly.net SOA ns1.fastly.net"
"126","0.519640087","192.168.1.118","199.232.37.140","TLSv1","583","Client Hello"
"127","0.522690525","209.18.47.62","192.168.1.118","DNS","171","Standard query response 0xfe21 AAAA preview.redd.it CNAME reddit.map.fastly.net SOA ns1.fastly.net"
"128","0.522774462","209.18.47.62","192.168.1.118","DNS","171","Standard query response 0xe2fd AAAA preview.redd.it CNAME reddit.map.fastly.net SOA ns1.fastly.net"
"129","0.522846662","209.18.47.62","192.168.1.118","DNS","175","Standard query response 0xea16 AAAA styles.redditmedia.com CNAME reddit.map.fastly.net SOA ns1.fastly.net"
"130","0.522915837","209.18.47.62","192.168.1.118","DNS","177","Standard query response 0x6ab7 AAAA b.thumbs.redditmedia.com CNAME reddit.map.fastly.net SOA ns1.fastly.net"
"131","0.522984725","209.18.47.62","192.168.1.118","DNS","177","Standard query response 0xa62c AAAA a.thumbs.redditmedia.com CNAME reddit.map.fastly.net SOA ns1.fastly.net"
"132","0.523055087","209.18.47.62","192.168.1.118","DNS","171","Standard query response 0x1638 AAAA preview.redd.it CNAME reddit.map.fastly.net SOA ns1.fastly.net"
"133","0.523146550","209.18.47.62","192.168.1.118","DNS","171","Standard query response 0xa24d AAAA preview.redd.it CNAME reddit.map.fastly.net SOA ns1.fastly.net"
"134","0.523213087","199.232.37.140","192.168.1.118","TCP","66","443 → 38116 [ACK] Seq=1 Ack=518 Win=28160 Len=0 TSval=274378914 TSecr=1501515438"
"135","0.523330475","199.232.37.140","192.168.1.118","TLSv1.2","3304","Server Hello, Certificate, Server Key Exchange, Server Hello Done"
"136","0.523408700","192.168.1.118","199.232.37.140","TCP","66","38116 → 443 [ACK] Seq=518 Ack=3239 Win=61056 Len=0 TSval=1501515475 TSecr=274378914"
"137","0.534122787","192.168.1.118","199.232.37.140","TCP","66","38114 → 443 [ACK] Seq=834 Ack=12808 Win=54656 Len=0 TSval=1501515486 TSecr=2811929319"
"138","0.536055337","192.168.1.118","199.232.37.140","TLSv1","583","Client Hello"
"139","0.536271812","192.168.1.118","199.232.37.140","TCP","74","38124 → 443 [SYN] Seq=0 Win=64240 Len=0 MSS=1460 SACK_PERM=1 TSval=1501515488 TSecr=0 WS=128"
"140","0.536353687","192.168.1.118","199.232.37.140","TCP","74","38126 → 443 [SYN] Seq=0 Win=64240 Len=0 MSS=1460 SACK_PERM=1 TSval=1501515488 TSecr=0 WS=128"
"141","0.536435000","192.168.1.118","199.232.37.140","TCP","74","38128 → 443 [SYN] Seq=0 Win=64240 Len=0 MSS=1460 SACK_PERM=1 TSval=1501515488 TSecr=0 WS=128"
"142","0.536510100","192.168.1.118","199.232.37.140","TCP","74","38130 → 443 [SYN] Seq=0 Win=64240 Len=0 MSS=1460 SACK_PERM=1 TSval=1501515488 TSecr=0 WS=128"
"143","0.536805475","192.168.1.118","199.232.37.140","TCP","74","38132 → 443 [SYN] Seq=0 Win=64240 Len=0 MSS=1460 SACK_PERM=1 TSval=1501515489 TSecr=0 WS=128"
"144","0.538794412","192.168.1.118","199.232.37.140","TLSv1.2","192","Client Key Exchange, Change Cipher Spec, Encrypted Handshake Message"
"145","0.538976687","192.168.1.118","199.232.37.140","TCP","74","38134 → 443 [SYN] Seq=0 Win=64240 Len=0 MSS=1460 SACK_PERM=1 TSval=1501515491 TSecr=0 WS=128"
"146","0.539064612","192.168.1.118","199.232.37.140","TCP","74","38136 → 443 [SYN] Seq=0 Win=64240 Len=0 MSS=1460 SACK_PERM=1 TSval=1501515491 TSecr=0 WS=128"
"147","0.539190300","192.168.1.118","199.232.37.140","TCP","74","38138 → 443 [SYN] Seq=0 Win=64240 Len=0 MSS=1460 SACK_PERM=1 TSval=1501515491 TSecr=0 WS=128"
"148","0.541333662","199.232.37.140","192.168.1.118","TCP","66","443 → 38118 [ACK] Seq=1 Ack=518 Win=28160 Len=0 TSval=273686057 TSecr=1501515455"
"149","0.543391812","199.232.37.140","192.168.1.118","TLSv1.2","3304","Server Hello, Certificate, Server Key Exchange, Server Hello Done"
"150","0.543475262","192.168.1.118","199.232.37.140","TCP","66","38118 → 443 [ACK] Seq=518 Ack=3239 Win=61056 Len=0 TSval=1501515495 TSecr=273686057"
"151","0.543543275","199.232.37.140","192.168.1.118","TCP","66","443 → 38120 [ACK] Seq=1 Ack=518 Win=28160 Len=0 TSval=2814263530 TSecr=1501515472"
"152","0.545888350","199.232.37.140","192.168.1.118","TLSv1.2","3304","Server Hello, Certificate, Server Key Exchange, Server Hello Done"
"153","0.545965175","192.168.1.118","199.232.37.140","TCP","66","38120 → 443 [ACK] Seq=518 Ack=3239 Win=61056 Len=0 TSval=1501515498 TSecr=2814263531"
"154","0.550495337","192.168.1.118","199.232.37.140","TLSv1.2","192","Client Key Exchange, Change Cipher Spec, Encrypted Handshake Message"
"155","0.552391825","192.168.1.118","199.232.37.140","TLSv1.2","192","Client Key Exchange, Change Cipher Spec, Encrypted Handshake Message"
"156","0.552658150","192.168.1.118","199.232.37.140","TCP","74","38140 → 443 [SYN] Seq=0 Win=64240 Len=0 MSS=1460 SACK_PERM=1 TSval=1501515505 TSecr=0 WS=128"
"157","0.553049662","192.168.1.118","199.232.37.140","TCP","74","38142 → 443 [SYN] Seq=0 Win=64240 Len=0 MSS=1460 SACK_PERM=1 TSval=1501515505 TSecr=0 WS=128"
"158","0.553187012","192.168.1.118","199.232.37.140","TCP","74","38144 → 443 [SYN] Seq=0 Win=64240 Len=0 MSS=1460 SACK_PERM=1 TSval=1501515505 TSecr=0 WS=128"
"159","0.553309050","192.168.1.118","209.18.47.62","DNS","77","Standard query 0x5e0d A s.redditmedia.com"
"160","0.555941387","199.232.37.140","192.168.1.118","TCP","74","443 → 38124 [SYN, ACK] Seq=0 Ack=1 Win=27040 Len=0 MSS=1364 SACK_PERM=1 TSval=3142432642 TSecr=1501515488 WS=512"
"161","0.556001337","192.168.1.118","199.232.37.140","TCP","66","38124 → 443 [ACK] Seq=1 Ack=1 Win=64256 Len=0 TSval=1501515508 TSecr=3142432642"
"162","0.560271062","199.232.37.140","192.168.1.118","TLSv1.2","117","Change Cipher Spec, Encrypted Handshake Message"
"163","0.560305462","199.232.37.140","192.168.1.118","TCP","74","443 → 38126 [SYN, ACK] Seq=0 Ack=1 Win=27040 Len=0 MSS=1364 SACK_PERM=1 TSval=2812155248 TSecr=1501515488 WS=512"
"164","0.560343212","192.168.1.118","199.232.37.140","TCP","66","38126 → 443 [ACK] Seq=1 Ack=1 Win=64256 Len=0 TSval=1501515512 TSecr=2812155248"
"165","0.560365200","199.232.37.140","192.168.1.118","TCP","74","443 → 38134 [SYN, ACK] Seq=0 Ack=1 Win=27040 Len=0 MSS=1364 SACK_PERM=1 TSval=3143763775 TSecr=1501515491 WS=512"
"166","0.560403900","192.168.1.118","199.232.37.140","TCP","66","38134 → 443 [ACK] Seq=1 Ack=1 Win=64256 Len=0 TSval=1501515512 TSecr=3143763775"
"167","0.561394100","199.232.37.140","192.168.1.118","TCP","74","443 → 38132 [SYN, ACK] Seq=0 Ack=1 Win=27040 Len=0 MSS=1364 SACK_PERM=1 TSval=2813898196 TSecr=1501515489 WS=512"
"168","0.561436550","192.168.1.118","199.232.37.140","TCP","66","38132 → 443 [ACK] Seq=1 Ack=1 Win=64256 Len=0 TSval=1501515513 TSecr=2813898196"
"169","0.561462987","199.232.37.140","192.168.1.118","TCP","74","443 → 38136 [SYN, ACK] Seq=0 Ack=1 Win=27040 Len=0 MSS=1364 SACK_PERM=1 TSval=3145772590 TSecr=1501515491 WS=512"
"170","0.561501837","192.168.1.118","199.232.37.140","TCP","66","38136 → 443 [ACK] Seq=1 Ack=1 Win=64256 Len=0 TSval=1501515513 TSecr=3145772590"
"171","0.563570775","199.232.37.140","192.168.1.118","TCP","66","443 → 38122 [ACK] Seq=1 Ack=518 Win=28160 Len=0 TSval=1115550144 TSecr=1501515488"
"172","0.563600412","199.232.37.140","192.168.1.118","TCP","74","443 → 38130 [SYN, ACK] Seq=0 Ack=1 Win=27040 Len=0 MSS=1364 SACK_PERM=1 TSval=2812803357 TSecr=1501515488 WS=512"
"173","0.563637825","192.168.1.118","199.232.37.140","TCP","66","38130 → 443 [ACK] Seq=1 Ack=1 Win=64256 Len=0 TSval=1501515516 TSecr=2812803357"
"174","0.564939212","199.232.37.140","192.168.1.118","TCP","74","443 → 38128 [SYN, ACK] Seq=0 Ack=1 Win=27040 Len=0 MSS=1364 SACK_PERM=1 TSval=2772758293 TSecr=1501515488 WS=512"
"175","0.564974725","192.168.1.118","199.232.37.140","TCP","66","38128 → 443 [ACK] Seq=1 Ack=1 Win=64256 Len=0 TSval=1501515517 TSecr=2772758293"
"176","0.565000250","199.232.37.140","192.168.1.118","TCP","74","443 → 38138 [SYN, ACK] Seq=0 Ack=1 Win=27040 Len=0 MSS=1364 SACK_PERM=1 TSval=3143763775 TSecr=1501515491 WS=512"
"177","0.565035387","192.168.1.118","199.232.37.140","TCP","66","38138 → 443 [ACK] Seq=1 Ack=1 Win=64256 Len=0 TSval=1501515517 TSecr=3143763775"
"178","0.565796825","199.232.37.140","192.168.1.118","TLSv1.2","2770","Server Hello"
"179","0.565823475","192.168.1.118","199.232.37.140","TCP","66","38122 → 443 [ACK] Seq=518 Ack=2705 Win=61568 Len=0 TSval=1501515518 TSecr=1115550144"
"180","0.569112975","199.232.37.140","192.168.1.118","TLSv1.2","600","Certificate, Server Key Exchange, Server Hello Done"
"181","0.569152225","192.168.1.118","199.232.37.140","TCP","66","38122 → 443 [ACK] Seq=518 Ack=3239 Win=61056 Len=0 TSval=1501515521 TSecr=1115550144"
"182","0.573594712","192.168.1.118","199.232.37.140","TLSv1","583","Client Hello"
"183","0.576284487","209.18.47.62","192.168.1.118","DNS","128","Standard query response 0x5e0d A s.redditmedia.com CNAME reddit.map.fastly.net A 199.232.37.140"
"184","0.576437225","192.168.1.118","209.18.47.62","DNS","77","Standard query 0x86ad AAAA s.redditmedia.com"
"185","0.578457837","199.232.37.140","192.168.1.118","TLSv1.2","117","Change Cipher Spec, Encrypted Handshake Message"
"186","0.578677425","199.232.37.140","192.168.1.118","TLSv1.2","117","Change Cipher Spec, Encrypted Handshake Message"
"187","0.578723412","199.232.37.140","192.168.1.118","TCP","74","443 → 38140 [SYN, ACK] Seq=0 Ack=1 Win=27040 Len=0 MSS=1364 SACK_PERM=1 TSval=2812760557 TSecr=1501515505 WS=512"
"188","0.578940537","192.168.1.118","199.232.37.140","TCP","66","38140 → 443 [ACK] Seq=1 Ack=1 Win=64256 Len=0 TSval=1501515531 TSecr=2812760557"
"189","0.581445312","199.232.37.140","192.168.1.118","TCP","74","443 → 38144 [SYN, ACK] Seq=0 Ack=1 Win=27040 Len=0 MSS=1364 SACK_PERM=1 TSval=3127711770 TSecr=1501515505 WS=512"
"190","0.581598650","192.168.1.118","199.232.37.140","TCP","66","38144 → 443 [ACK] Seq=1 Ack=1 Win=64256 Len=0 TSval=1501515533 TSecr=3127711770"
"191","0.581741600","199.232.37.140","192.168.1.118","TCP","74","443 → 38142 [SYN, ACK] Seq=0 Ack=1 Win=27040 Len=0 MSS=1364 SACK_PERM=1 TSval=2810908682 TSecr=1501515505 WS=512"
"192","0.581896050","192.168.1.118","199.232.37.140","TCP","66","38142 → 443 [ACK] Seq=1 Ack=1 Win=64256 Len=0 TSval=1501515534 TSecr=2810908682"
"193","0.591285725","199.232.37.140","192.168.1.118","TCP","66","443 → 38124 [ACK] Seq=1 Ack=518 Win=28160 Len=0 TSval=3142432651 TSecr=1501515525"
"194","0.593785437","199.232.37.140","192.168.1.118","TLSv1.2","1418","Server Hello"
"195","0.593823325","192.168.1.118","199.232.37.140","TCP","66","38124 → 443 [ACK] Seq=518 Ack=1353 Win=63104 Len=0 TSval=1501515546 TSecr=3142432652"
"196","0.595157350","192.168.1.118","199.232.37.140","TLSv1","583","Client Hello"
"197","0.595255800","199.232.37.140","192.168.1.118","TLSv1.2","2080","Certificate, Server Key Exchange, Server Hello Done"
"198","0.595283237","192.168.1.118","199.232.37.140","TCP","66","38124 → 443 [ACK] Seq=518 Ack=3367 Win=61184 Len=0 TSval=1501515547 TSecr=3142432652"
"199","0.597403025","209.18.47.62","192.168.1.118","DNS","170","Standard query response 0x86ad AAAA s.redditmedia.com CNAME reddit.map.fastly.net SOA ns1.fastly.net"
"200","0.601105450","192.168.1.118","199.232.37.140","TCP","66","38116 → 443 [ACK] Seq=644 Ack=3290 Win=64128 Len=0 TSval=1501515553 TSecr=274378924"
"201","0.611789900","192.168.1.118","199.232.37.140","TLSv1","583","Client Hello"
"202","0.619127925","192.168.1.118","199.232.37.140","TCP","66","38120 → 443 [ACK] Seq=644 Ack=3290 Win=64128 Len=0 TSval=1501515571 TSecr=2814263539"
"203","0.619188562","192.168.1.118","199.232.37.140","TCP","66","38118 → 443 [ACK] Seq=644 Ack=3290 Win=64128 Len=0 TSval=1501515571 TSecr=273686068"
"204","0.628201487","192.168.1.118","199.232.37.140","TLSv1","583","Client Hello"
"205","0.628284837","199.232.37.140","192.168.1.118","TCP","66","443 → 38126 [ACK] Seq=1 Ack=518 Win=28160 Len=0 TSval=2812155266 TSecr=1501515547"
"206","0.634488237","199.232.37.140","192.168.1.118","TLSv1.2","1418","Server Hello"
"207","0.634578400","192.168.1.118","199.232.37.140","TCP","66","38126 → 443 [ACK] Seq=518 Ack=1353 Win=63104 Len=0 TSval=1501515586 TSecr=2812155266"
"208","0.635581162","199.232.37.140","192.168.1.118","TLSv1.2","2080","Certificate, Server Key Exchange, Server Hello Done"
"209","0.635668650","192.168.1.118","199.232.37.140","TCP","66","38126 → 443 [ACK] Seq=518 Ack=3367 Win=61184 Len=0 TSval=1501515588 TSecr=2812155266"
"210","0.644951337","192.168.1.118","199.232.37.140","TLSv1","583","Client Hello"
"211","0.645180862","192.168.1.118","199.232.37.140","TCP","74","38146 → 443 [SYN] Seq=0 Win=64240 Len=0 MSS=1460 SACK_PERM=1 TSval=1501515597 TSecr=0 WS=128"
"212","0.657929500","199.232.37.140","192.168.1.118","TCP","66","[TCP Dup ACK 205#1] 443 → 38126 [ACK] Seq=3367 Ack=518 Win=28160 Len=0 TSval=2812155273 TSecr=1501515588"
"213","0.659689762","199.232.37.140","192.168.1.118","TCP","66","443 → 38128 [ACK] Seq=1 Ack=518 Win=28160 Len=0 TSval=2772758318 TSecr=1501515564"
"214","0.659777100","199.232.37.140","192.168.1.118","TCP","66","443 → 38130 [ACK] Seq=1 Ack=518 Win=28160 Len=0 TSval=2812803382 TSecr=1501515580"
"215","0.659906075","199.232.37.140","192.168.1.118","TLSv1.2","3336","Server Hello, Certificate, Server Key Exchange, Server Hello Done"
"216","0.659989200","192.168.1.118","199.232.37.140","TCP","66","38128 → 443 [ACK] Seq=518 Ack=3271 Win=61056 Len=0 TSval=1501515612 TSecr=2772758319"
"217","0.660179600","199.232.37.140","192.168.1.118","TLSv1.2","3432","Server Hello, Certificate, Server Key Exchange, Server Hello Done"
"218","0.660260950","192.168.1.118","199.232.37.140","TCP","66","38130 → 443 [ACK] Seq=518 Ack=3367 Win=60928 Len=0 TSval=1501515612 TSecr=2812803382"
"219","0.661714212","192.168.1.118","199.232.37.140","TLSv1","583","Client Hello"
"220","0.667863237","199.232.37.140","192.168.1.118","TCP","66","443 → 38140 [ACK] Seq=1 Ack=518 Win=28160 Len=0 TSval=2812760580 TSecr=1501515597"
"221","0.668764000","199.232.37.140","192.168.1.118","TCP","74","443 → 38146 [SYN, ACK] Seq=0 Ack=1 Win=27040 Len=0 MSS=1364 SACK_PERM=1 TSval=271367447 TSecr=1501515597 WS=512"
"222","0.668897350","192.168.1.118","199.232.37.140","TCP","66","38146 → 443 [ACK] Seq=1 Ack=1 Win=64256 Len=0 TSval=1501515621 TSecr=271367447"
"223","0.672695900","199.232.37.140","192.168.1.118","TLSv1.2","3336","Server Hello, Certificate, Server Key Exchange, Server Hello Done"
"224","0.672777962","192.168.1.118","199.232.37.140","TCP","66","38140 → 443 [ACK] Seq=518 Ack=3271 Win=61056 Len=0 TSval=1501515625 TSecr=2812760581"
"225","0.678481562","192.168.1.118","199.232.37.140","TLSv1","583","Client Hello"
"226","0.689008775","199.232.37.140","192.168.1.118","TCP","66","443 → 38142 [ACK] Seq=1 Ack=518 Win=28160 Len=0 TSval=2810908710 TSecr=1501515614"
"227","0.690419787","199.232.37.140","192.168.1.118","TLSv1.2","3336","Server Hello, Certificate, Server Key Exchange, Server Hello Done"
"228","0.690502700","192.168.1.118","199.232.37.140","TCP","66","38142 → 443 [ACK] Seq=518 Ack=3271 Win=61056 Len=0 TSval=1501515642 TSecr=2810908710"
"229","0.695034462","192.168.1.118","199.232.37.140","TLSv1","583","Client Hello"
"230","0.695391575","192.168.1.118","199.232.37.140","TLSv1.2","274","Application Data"
"231","0.711697925","192.168.1.118","199.232.37.140","TLSv1","583","Client Hello"
"232","0.712032487","192.168.1.118","199.232.37.140","TLSv1.2","280","Application Data"
"233","0.715688562","199.232.37.140","192.168.1.118","TCP","66","443 → 38144 [ACK] Seq=1 Ack=518 Win=28160 Len=0 TSval=3127711905 TSecr=1501515630"
"234","0.717233187","199.232.37.140","192.168.1.118","TLSv1.2","3336","Server Hello, Certificate, Server Key Exchange, Server Hello Done"
"235","0.717315712","192.168.1.118","199.232.37.140","TCP","66","38144 → 443 [ACK] Seq=518 Ack=3271 Win=61056 Len=0 TSval=1501515669 TSecr=3127711906"
"236","0.722018100","199.232.37.140","192.168.1.118","TCP","66","443 → 38132 [ACK] Seq=1 Ack=518 Win=28160 Len=0 TSval=2813898237 TSecr=1501515647"
"237","0.723177337","199.232.37.140","192.168.1.118","TLSv1.2","1418","Application Data"
"238","0.723272837","192.168.1.118","199.232.37.140","TCP","66","38116 → 443 [ACK] Seq=852 Ack=4642 Win=63104 Len=0 TSval=1501515675 TSecr=274378966"
"239","0.726402350","199.232.37.140","192.168.1.118","TLSv1.2","1179","Application Data, Application Data"
"240","0.726479025","192.168.1.118","199.232.37.140","TCP","66","38116 → 443 [ACK] Seq=852 Ack=5755 Win=62080 Len=0 TSval=1501515678 TSecr=274378966"
"241","0.728383600","192.168.1.118","199.232.37.140","TLSv1","583","Client Hello"
"242","0.728542725","199.232.37.140","192.168.1.118","TLSv1.2","2770","Server Hello"
"243","0.728625225","192.168.1.118","199.232.37.140","TCP","66","38132 → 443 [ACK] Seq=518 Ack=2705 Win=61568 Len=0 TSval=1501515680 TSecr=2813898238"
"244","0.728711975","192.168.1.118","199.232.37.140","TLSv1.2","279","Application Data"
"245","0.730391962","199.232.37.140","192.168.1.118","TLSv1.2","610","Certificate, Server Key Exchange, Server Hello Done"
"246","0.730469725","192.168.1.118","199.232.37.140","TCP","66","38132 → 443 [ACK] Seq=518 Ack=3249 Win=61056 Len=0 TSval=1501515682 TSecr=2813898238"
"247","0.732764837","199.232.37.140","192.168.1.118","TCP","66","443 → 38134 [ACK] Seq=1 Ack=518 Win=28160 Len=0 TSval=3143763819 TSecr=1501515664"
"248","0.735017587","199.232.37.140","192.168.1.118","TLSv1.2","2770","Application Data, Application Data"
"249","0.735122225","192.168.1.118","199.232.37.140","TCP","66","38118 → 443 [ACK] Seq=858 Ack=5994 Win=61440 Len=0 TSval=1501515687 TSecr=273686107"
"250","0.735924462","199.232.37.140","192.168.1.118","TLSv1.2","2770","Application Data, Application Data"
"251","0.735998587","192.168.1.118","199.232.37.140","TCP","66","38118 → 443 [ACK] Seq=858 Ack=8698 Win=58752 Len=0 TSval=1501515688 TSecr=273686107"
"252","0.738368162","199.232.37.140","192.168.1.118","TLSv1.2","2770","Application Data, Application Data"
"253","0.738435875","192.168.1.118","199.232.37.140","TCP","66","38118 → 443 [ACK] Seq=858 Ack=11402 Win=56064 Len=0 TSval=1501515690 TSecr=273686107"
"254","0.740149787","199.232.37.140","192.168.1.118","TLSv1.2","1418","Application Data [TCP segment of a reassembled PDU]"
"255","0.740220975","192.168.1.118","199.232.37.140","TCP","66","38118 → 443 [ACK] Seq=858 Ack=12754 Win=54784 Len=0 TSval=1501515692 TSecr=273686107"
"256","0.742394387","199.232.37.140","192.168.1.118","TLSv1.2","4122","Application Data, Application Data, Application Data"
"257","0.742467850","192.168.1.118","199.232.37.140","TCP","66","38118 → 443 [ACK] Seq=858 Ack=16810 Win=50816 Len=0 TSval=1501515694 TSecr=273686107"
"258","0.745041375","192.168.1.118","199.232.37.140","TLSv1","583","Client Hello"
"259","0.745863637","199.232.37.140","192.168.1.118","TLSv1.2","3432","Server Hello, Certificate, Server Key Exchange, Server Hello Done"
"260","0.745936187","192.168.1.118","199.232.37.140","TCP","66","38134 → 443 [ACK] Seq=518 Ack=3367 Win=60928 Len=0 TSval=1501515698 TSecr=3143763819"
"261","0.747033612","192.168.1.118","199.232.37.140","TLSv1.2","192","Client Key Exchange, Change Cipher Spec, Encrypted Handshake Message"
"262","0.748927862","192.168.1.118","199.232.37.140","TLSv1.2","192","Client Key Exchange, Change Cipher Spec, Encrypted Handshake Message"
"263","0.750824437","192.168.1.118","199.232.37.140","TLSv1.2","192","Client Key Exchange, Change Cipher Spec, Encrypted Handshake Message"
"264","0.752679237","192.168.1.118","199.232.37.140","TLSv1.2","192","Client Key Exchange, Change Cipher Spec, Encrypted Handshake Message"
"265","0.754524737","192.168.1.118","199.232.37.140","TLSv1.2","192","Client Key Exchange, Change Cipher Spec, Encrypted Handshake Message"
"266","0.755645387","199.232.37.140","192.168.1.118","TCP","66","443 → 38136 [ACK] Seq=1 Ack=518 Win=28160 Len=0 TSval=3145772639 TSecr=1501515680"
"267","0.756395425","192.168.1.118","199.232.37.140","TLSv1.2","192","Client Key Exchange, Change Cipher Spec, Encrypted Handshake Message"
"268","0.756891012","199.232.37.140","192.168.1.118","TLSv1.2","744","Application Data, Application Data"
"269","0.756989575","192.168.1.118","199.232.37.140","TCP","66","38120 → 443 [ACK] Seq=857 Ack=3968 Win=63488 Len=0 TSval=1501515709 TSecr=2814263583"
"270","0.757151262","199.232.37.140","192.168.1.118","TLSv1.2","3432","Server Hello, Certificate, Server Key Exchange, Server Hello Done"
"271","0.757229687","192.168.1.118","199.232.37.140","TCP","66","38136 → 443 [ACK] Seq=518 Ack=3367 Win=60928 Len=0 TSval=1501515709 TSecr=3145772639"
"272","0.767152725","199.232.37.140","192.168.1.118","TLSv1.2","1418","Application Data [TCP segment of a reassembled PDU]"
"273","0.767229262","192.168.1.118","199.232.37.140","TCP","66","38118 → 443 [ACK] Seq=858 Ack=18162 Win=49536 Len=0 TSval=1501515719 TSecr=273686115"
"274","0.769500350","199.232.37.140","192.168.1.118","TLSv1.2","4122","Application Data, Application Data, Application Data"
"275","0.769585650","192.168.1.118","199.232.37.140","TCP","66","38118 → 443 [ACK] Seq=858 Ack=22218 Win=45568 Len=0 TSval=1501515721 TSecr=273686115"
"276","0.769712662","199.232.37.140","192.168.1.118","TLSv1.2","4122","Application Data, Application Data"
"277","0.769919375","199.232.37.140","192.168.1.118","TLSv1.2","4122","Application Data, Application Data, Application Data"
"278","0.771410712","199.232.37.140","192.168.1.118","TLSv1.2","1607","Application Data, Application Data"
"279","0.772699287","192.168.1.118","199.232.37.140","TLSv1","583","Client Hello"
"280","0.774703662","192.168.1.118","199.232.37.140","TLSv1.2","192","Client Key Exchange, Change Cipher Spec, Encrypted Handshake Message"
"281","0.776577550","192.168.1.118","199.232.37.140","TLSv1.2","192","Client Key Exchange, Change Cipher Spec, Encrypted Handshake Message"
"282","0.778828900","199.232.37.140","192.168.1.118","TCP","66","443 → 38138 [ACK] Seq=1 Ack=518 Win=28160 Len=0 TSval=3143763829 TSecr=1501515697"
"283","0.778907112","199.232.37.140","192.168.1.118","TLSv1.2","117","Change Cipher Spec, Encrypted Handshake Message"
"284","0.778980575","192.168.1.118","199.232.37.140","TCP","66","38122 → 443 [ACK] Seq=644 Ack=3290 Win=64128 Len=0 TSval=1501515731 TSecr=1115550198"
"285","0.779048962","199.232.37.140","192.168.1.118","TLSv1.2","117","Change Cipher Spec, Encrypted Handshake Message"
"286","0.779144800","192.168.1.118","199.232.37.140","TCP","66","38124 → 443 [ACK] Seq=644 Ack=3418 Win=64128 Len=0 TSval=1501515731 TSecr=3142432697"
"287","0.779251050","199.232.37.140","192.168.1.118","TLSv1.2","3336","Server Hello, Certificate, Server Key Exchange, Server Hello Done"
"288","0.779319725","192.168.1.118","199.232.37.140","TCP","66","38138 → 443 [ACK] Seq=518 Ack=3271 Win=61056 Len=0 TSval=1501515731 TSecr=3143763830"
"289","0.790181400","192.168.1.118","199.232.37.140","TLSv1.2","192","Client Key Exchange, Change Cipher Spec, Encrypted Handshake Message"
"290","0.792235312","192.168.1.118","199.232.37.140","TLSv1.2","192","Client Key Exchange, Change Cipher Spec, Encrypted Handshake Message"
"291","0.792321450","192.168.1.118","199.232.37.140","TCP","66","38118 → 443 [ACK] Seq=858 Ack=31871 Win=35968 Len=0 TSval=1501515744 TSecr=273686115"
"292","0.793977737","199.232.37.140","192.168.1.118","TLSv1.2","117","Change Cipher Spec, Encrypted Handshake Message"
"293","0.794065475","192.168.1.118","199.232.37.140","TCP","66","38126 → 443 [ACK] Seq=644 Ack=3418 Win=64128 Len=0 TSval=1501515746 TSecr=2812155306"
"294","0.794266400","192.168.1.118","199.232.37.140","TLSv1.2","192","Client Key Exchange, Change Cipher Spec, Encrypted Handshake Message"
"295","0.796276612","192.168.1.118","199.232.37.140","TLSv1.2","192","Client Key Exchange, Change Cipher Spec, Encrypted Handshake Message"
"296","0.796559787","192.168.1.118","199.232.37.140","TLSv1.2","272","Application Data"
"297","0.796774212","192.168.1.118","199.232.37.140","TLSv1.2","375","Application Data"
"298","0.796998037","192.168.1.118","199.232.37.140","TLSv1.2","341","Application Data"
"299","0.799976900","192.168.1.118","199.232.37.140","TLSv1.2","280","Application Data"
"300","0.804948162","199.232.37.140","192.168.1.118","TCP","66","443 → 38146 [ACK] Seq=1 Ack=518 Win=28160 Len=0 TSval=271367479 TSecr=1501515725"
"301","0.805040362","199.232.37.140","192.168.1.118","TLSv1.2","117","Change Cipher Spec, Encrypted Handshake Message"
"302","0.805151050","192.168.1.118","199.232.37.140","TCP","66","38140 → 443 [ACK] Seq=644 Ack=3322 Win=64128 Len=0 TSval=1501515757 TSecr=2812760612"
"303","0.805231487","199.232.37.140","192.168.1.118","TLSv1.2","117","Change Cipher Spec, Encrypted Handshake Message"
"304","0.805317362","192.168.1.118","199.232.37.140","TCP","66","38144 → 443 [ACK] Seq=644 Ack=3322 Win=64128 Len=0 TSval=1501515757 TSecr=3127711988"
"305","0.805392062","199.232.37.140","192.168.1.118","TLSv1.2","117","Change Cipher Spec, Encrypted Handshake Message"
"306","0.805476700","192.168.1.118","199.232.37.140","TCP","66","38130 → 443 [ACK] Seq=644 Ack=3418 Win=64128 Len=0 TSval=1501515757 TSecr=2812803416"
"307","0.805551037","199.232.37.140","192.168.1.118","TLSv1.2","117","Change Cipher Spec, Encrypted Handshake Message"
"308","0.805633525","192.168.1.118","199.232.37.140","TCP","66","38128 → 443 [ACK] Seq=644 Ack=3322 Win=64128 Len=0 TSval=1501515757 TSecr=2772758353"
"309","0.805705637","199.232.37.140","192.168.1.118","TLSv1.2","117","Change Cipher Spec, Encrypted Handshake Message"
"310","0.805788850","192.168.1.118","199.232.37.140","TCP","66","38142 → 443 [ACK] Seq=644 Ack=3322 Win=64128 Len=0 TSval=1501515758 TSecr=2810908737"
"311","0.805913225","199.232.37.140","192.168.1.118","TLSv1.2","3314","Server Hello, Certificate, Server Key Exchange, Server Hello Done"
"312","0.805992712","192.168.1.118","199.232.37.140","TCP","66","38146 → 443 [ACK] Seq=518 Ack=3249 Win=61056 Len=0 TSval=1501515758 TSecr=271367479"
"313","0.807945862","192.168.1.118","199.232.37.140","TLSv1.2","295","Application Data"
"314","0.808231700","192.168.1.118","199.232.37.140","TLSv1.2","373","Application Data"
"315","0.808443287","192.168.1.118","199.232.37.140","TLSv1.2","295","Application Data"
"316","0.810339950","192.168.1.118","199.232.37.140","TLSv1.2","192","Client Key Exchange, Change Cipher Spec, Encrypted Handshake Message"
"317","0.810632725","192.168.1.118","199.232.37.140","TLSv1.2","295","Application Data"
"318","0.810850012","192.168.1.118","199.232.37.140","TLSv1.2","295","Application Data"
"319","0.828164337","199.232.37.140","192.168.1.118","TLSv1.2","117","Change Cipher Spec, Encrypted Handshake Message"
"320","0.829006062","192.168.1.118","199.232.37.140","TLSv1.2","373","Application Data"
"321","0.832171650","199.232.37.140","192.168.1.118","TLSv1.2","117","Change Cipher Spec, Encrypted Handshake Message"
"322","0.832260275","192.168.1.118","199.232.37.140","TCP","66","38132 → 443 [ACK] Seq=644 Ack=3300 Win=64128 Len=0 TSval=1501515784 TSecr=2813898261"
"323","0.832406675","199.232.37.140","192.168.1.118","TLSv1.2","5323","Application Data, Application Data, Application Data, Application Data, Application Data"
"324","0.832501937","192.168.1.118","199.232.37.140","TCP","66","38114 → 443 [ACK] Seq=1048 Ack=18065 Win=58880 Len=0 TSval=1501515784 TSecr=2811929402"
"325","0.832668312","199.232.37.140","192.168.1.118","TLSv1.2","3197","Application Data, Application Data, Application Data"
"326","0.832764250","199.232.37.140","192.168.1.118","TLSv1.2","117","Change Cipher Spec, Encrypted Handshake Message"
"327","0.832892925","199.232.37.140","192.168.1.118","TLSv1.2","2937","Application Data, Application Data, Application Data"
"328","0.833058575","199.232.37.140","192.168.1.118","TLSv1.2","5474","Application Data, Application Data, Application Data, Application Data"
"329","0.833760412","192.168.1.118","199.232.37.140","TLSv1.2","293","Application Data"
"330","0.834222837","192.168.1.118","199.232.37.140","TLSv1.2","295","Application Data"
"331","0.834281337","192.168.1.118","199.232.37.140","TCP","66","38122 → 443 [ACK] Seq=850 Ack=6161 Win=61312 Len=0 TSval=1501515786 TSecr=1115550210"
"332","0.834412825","192.168.1.118","199.232.37.140","TCP","66","38124 → 443 [ACK] Seq=953 Ack=6549 Win=61056 Len=0 TSval=1501515786 TSecr=3142432708"
"333","0.834512750","192.168.1.118","199.232.37.140","TCP","66","38126 → 443 [ACK] Seq=919 Ack=8826 Win=58752 Len=0 TSval=1501515786 TSecr=2812155314"
"334","0.841180325","192.168.1.118","199.232.37.140","TLSv1.2","377","Application Data"
"335","0.844825487","199.232.37.140","192.168.1.118","TLSv1.2","117","Change Cipher Spec, Encrypted Handshake Message"
"336","0.844913737","192.168.1.118","199.232.37.140","TCP","66","38134 → 443 [ACK] Seq=644 Ack=3418 Win=64128 Len=0 TSval=1501515797 TSecr=3143763841"
"337","0.844962737","199.232.37.140","192.168.1.118","TLSv1.2","8178","Application Data, Application Data, Application Data, Application Data, Application Data, Application Data"
"338","0.846048687","192.168.1.118","199.232.37.140","TLSv1.2","375","Application Data"
"339","0.846174587","192.168.1.118","199.232.37.140","TCP","66","38126 → 443 [ACK] Seq=919 Ack=16938 Win=52864 Len=0 TSval=1501515798 TSecr=2812155314"
"340","0.846404012","199.232.37.140","192.168.1.118","TLSv1.2","117","Change Cipher Spec, Encrypted Handshake Message"
"341","0.846471175","199.232.37.140","192.168.1.118","TLSv1.2","6826","Application Data, Application Data, Application Data, Application Data, Application Data"
"342","0.846557525","199.232.37.140","192.168.1.118","TLSv1.2","1109","Application Data, Application Data"
"343","0.846579500","199.232.37.140","192.168.1.118","TLSv1.2","2581","Application Data, Application Data, Application Data"
"344","0.847075300","192.168.1.118","199.232.37.140","TCP","66","38130 → 443 [ACK] Seq=951 Ack=5933 Win=61696 Len=0 TSval=1501515799 TSecr=2812803429"
"345","0.847482312","192.168.1.118","199.232.37.140","TLSv1.2","331","Application Data"
"346","0.847537825","192.168.1.118","199.232.37.140","TCP","66","38142 → 443 [ACK] Seq=873 Ack=11125 Win=56448 Len=0 TSval=1501515799 TSecr=2810908749"
"347","0.850437762","199.232.37.140","192.168.1.118","TLSv1.2","6826","Application Data, Application Data, Application Data, Application Data, Application Data"
"348","0.851464450","192.168.1.118","199.232.37.140","TCP","66","38140 → 443 [ACK] Seq=873 Ack=10082 Win=57472 Len=0 TSval=1501515803 TSecr=2812760625"
"349","0.851900425","192.168.1.118","199.232.37.140","TLSv1.2","376","Application Data"
"350","0.855067900","199.232.37.140","192.168.1.118","TLSv1.2","1859","Application Data, Application Data"
"351","0.855427787","192.168.1.118","199.232.37.140","TCP","66","38140 → 443 [ACK] Seq=873 Ack=11875 Win=55680 Len=0 TSval=1501515807 TSecr=2812760625"
"352","0.856185600","199.232.37.140","192.168.1.118","TLSv1.2","5474","Application Data, Application Data, Application Data, Application Data"
"353","0.856970312","192.168.1.118","199.232.37.140","TCP","66","38128 → 443 [ACK] Seq=873 Ack=8730 Win=58752 Len=0 TSval=1501515809 TSecr=2772758366"
"354","0.858623112","199.232.37.140","192.168.1.118","TLSv1.2","2770","Application Data, Application Data"
"355","0.858692075","192.168.1.118","199.232.37.140","TCP","66","38128 → 443 [ACK] Seq=873 Ack=11434 Win=56064 Len=0 TSval=1501515811 TSecr=2772758366"
"356","0.858733750","199.232.37.140","192.168.1.118","TLSv1.2","3324","Application Data, Application Data, Application Data"
"357","0.858762512","199.232.37.140","192.168.1.118","TLSv1.2","5474","Application Data, Application Data, Application Data, Application Data"
"358","0.858817187","192.168.1.118","199.232.37.140","TCP","66","38136 → 443 [ACK] Seq=951 Ack=6676 Win=60928 Len=0 TSval=1501515811 TSecr=3145772663"
"359","0.858947950","192.168.1.118","199.232.37.140","TCP","66","38128 → 443 [ACK] Seq=873 Ack=16842 Win=50688 Len=0 TSval=1501515811 TSecr=2772758366"
"360","0.861956050","199.232.37.140","192.168.1.118","TCP","66","[TCP Dup ACK 340#1] 443 → 38146 [ACK] Seq=3300 Ack=644 Win=28160 Len=0 TSval=271367494 TSecr=1501515762"
"361","0.862004125","199.232.37.140","192.168.1.118","TLSv1.2","2770","Application Data, Application Data"
"362","0.862153300","199.232.37.140","192.168.1.118","TLSv1.2","10882","Application Data, Application Data, Application Data, Application Data, Application Data, Application Data, Application Data, Application Data"
"363","0.862268737","192.168.1.118","199.232.37.140","TCP","66","38144 → 443 [ACK] Seq=873 Ack=16842 Win=50688 Len=0 TSval=1501515814 TSecr=3127712047"
"364","0.862525712","192.168.1.118","199.232.37.140","TLSv1.2","367","Application Data"
"365","0.863466212","199.232.37.140","192.168.1.118","TLSv1.2","5474","Application Data, Application Data, Application Data, Application Data"
"366","0.863507275","192.168.1.118","199.232.37.140","TCP","66","38126 → 443 [ACK] Seq=919 Ack=22346 Win=56960 Len=0 TSval=1501515815 TSecr=2812155324"
"367","0.865638450","199.232.37.140","192.168.1.118","TLSv1.2","2770","Application Data, Application Data"
"368","0.865804275","199.232.37.140","192.168.1.118","TLSv1.2","2770","Application Data [TCP segment of a reassembled PDU]"
"369","0.865815700","192.168.1.118","199.232.37.140","TCP","66","38126 → 443 [ACK] Seq=919 Ack=25050 Win=54272 Len=0 TSval=1501515818 TSecr=2812155324"
"370","0.865820262","199.232.37.140","192.168.1.118","TLSv1.2","10882","Application Data, Application Data, Application Data, Application Data, Application Data, Application Data, Application Data, Application Data"
"371","0.865882650","192.168.1.118","199.232.37.140","TCP","66","38126 → 443 [ACK] Seq=919 Ack=27754 Win=51584 Len=0 TSval=1501515818 TSecr=2812155324"
"372","0.866177887","192.168.1.118","199.232.37.140","TCP","66","38138 → 443 [ACK] Seq=873 Ack=14138 Win=53376 Len=0 TSval=1501515818 TSecr=3143763852"
"373","0.872563025","199.232.37.140","192.168.1.118","TLSv1.2","2770","Application Data, Application Data"
"374","0.872614300","199.232.37.140","192.168.1.118","TLSv1.2","2770","Application Data, Application Data"
"375","0.872722287","199.232.37.140","192.168.1.118","TLSv1.2","1240","Application Data, Application Data"
"376","0.872888125","199.232.37.140","192.168.1.118","TLSv1.2","13586","Application Data, Application Data, Application Data, Application Data, Application Data, Application Data, Application Data, Application Data, Application Data, Application Data"
"377","0.873269062","192.168.1.118","199.232.37.140","TCP","66","38132 → 443 [ACK] Seq=871 Ack=16820 Win=50688 Len=0 TSval=1501515825 TSecr=2813898273"
"378","0.873544837","192.168.1.118","199.232.37.140","TCP","66","38138 → 443 [ACK] Seq=873 Ack=16842 Win=50688 Len=0 TSval=1501515825 TSecr=3143763852"
"379","0.873678725","192.168.1.118","199.232.37.140","TCP","66","38124 → 443 [ACK] Seq=1264 Ack=10427 Win=60288 Len=0 TSval=1501515826 TSecr=3142432719"
"380","0.877342012","192.168.1.118","199.232.37.140","TLSv1.2","377","Application Data"
"381","0.901588837","199.232.37.140","192.168.1.118","TLSv1.2","1418","Application Data [TCP segment of a reassembled PDU]"
"382","0.905377637","199.232.37.140","192.168.1.118","TLSv1.2","4122","Application Data, Application Data, Application Data"
"383","0.905471500","192.168.1.118","199.232.37.140","TCP","66","38126 → 443 [ACK] Seq=919 Ack=33162 Win=75008 Len=0 TSval=1501515857 TSecr=2812155333"
"384","0.905539050","199.232.37.140","192.168.1.118","TLSv1.2","1418","Application Data [TCP segment of a reassembled PDU]"
"385","0.905891962","199.232.37.140","192.168.1.118","TLSv1.2","9530","Application Data, Application Data, Application Data, Application Data, Application Data, Application Data, Application Data"
"386","0.906052700","199.232.37.140","192.168.1.118","TLSv1.2","6594","Application Data, Application Data, Application Data, Application Data, Application Data"
"387","0.906202937","192.168.1.118","199.232.37.140","TCP","66","38128 → 443 [ACK] Seq=873 Ack=34186 Win=38528 Len=0 TSval=1501515858 TSecr=2772758379"
"388","0.911495637","199.232.37.140","192.168.1.118","TLSv1.2","525","Application Data"
"389","0.911590800","199.232.37.140","192.168.1.118","TLSv1.2","97","Encrypted Alert"
"390","0.911683925","199.232.37.140","192.168.1.118","TCP","66","443 → 38146 [FIN, ACK] Seq=3790 Ack=909 Win=29184 Len=0 TSval=271367505 TSecr=1501515799"
"391","0.911798825","199.232.37.140","192.168.1.118","TLSv1.2","3749","Application Data, Application Data, Application Data, Application Data"
"392","0.911940662","199.232.37.140","192.168.1.118","TLSv1.2","3946","Application Data, Application Data, Application Data, Application Data"
"393","0.912241725","199.232.37.140","192.168.1.118","TLSv1.2","5474","Application Data, Application Data, Application Data, Application Data"
"394","0.912325000","192.168.1.118","199.232.37.140","TCP","66","38126 → 443 [ACK] Seq=919 Ack=38570 Win=85760 Len=0 TSval=1501515864 TSecr=2812155333"
"395","0.912740175","192.168.1.118","199.232.37.140","TCP","66","38134 → 443 [ACK] Seq=953 Ack=7101 Win=60544 Len=0 TSval=1501515865 TSecr=3143763861"
"396","0.913078850","192.168.1.118","199.232.37.140","TLSv1.2","97","Encrypted Alert"
"397","0.914817937","192.168.1.118","199.232.37.140","TCP","66","38146 → 443 [RST, ACK] Seq=940 Ack=3791 Win=64128 Len=0 TSval=1501515867 TSecr=271367505"
"398","0.915531537","192.168.1.118","199.232.37.140","TCP","66","38130 → 443 [ACK] Seq=1261 Ack=9813 Win=60288 Len=0 TSval=1501515867 TSecr=2812803442"
"399","0.916671912","192.168.1.118","199.232.37.140","TCP","74","38148 → 443 [SYN] Seq=0 Win=64240 Len=0 MSS=1460 SACK_PERM=1 TSval=1501515869 TSecr=0 WS=128"
"400","0.949156200","199.232.37.140","192.168.1.118","TLSv1.2","3240","Application Data, Application Data, Application Data"
"401","0.949251900","199.232.37.140","192.168.1.118","TLSv1.2","5474","Application Data, Application Data, Application Data, Application Data"
"402","0.949333512","192.168.1.118","199.232.37.140","TCP","66","38126 → 443 [ACK] Seq=919 Ack=43978 Win=96640 Len=0 TSval=1501515901 TSecr=2812155334"
"403","0.949388462","199.232.37.140","192.168.1.118","TLSv1.2","1418","Application Data [TCP segment of a reassembled PDU]"
"404","0.949481400","199.232.37.140","192.168.1.118","TLSv1.2","16290","Application Data, Application Data, Application Data, Application Data, Application Data, Application Data, Application Data, Application Data, Application Data, Application Data, Application Data"
"405","0.949543837","199.232.37.140","192.168.1.118","TLSv1.2","16290","Application Data, Application Data, Application Data, Application Data, Application Data, Application Data, Application Data, Application Data, Application Data, Application Data, Application Data"
"406","0.949598837","199.232.37.140","192.168.1.118","TLSv1.2","2770","Application Data, Application Data"
"407","0.949670650","192.168.1.118","199.232.37.140","TCP","66","38126 → 443 [ACK] Seq=919 Ack=48034 Win=104704 Len=0 TSval=1501515902 TSecr=2812155335"
"408","0.950547775","199.232.37.140","192.168.1.118","TLSv1.2","1418","Application Data [TCP segment of a reassembled PDU]"
"409","0.964832212","199.232.37.140","192.168.1.118","TLSv1.2","4122","Application Data, Application Data, Application Data"
"410","0.964926462","192.168.1.118","199.232.37.140","TCP","66","38126 → 443 [ACK] Seq=919 Ack=53442 Win=109312 Len=0 TSval=1501515917 TSecr=2812155336"
"411","0.965041137","199.232.37.140","192.168.1.118","TLSv1.2","1725","Application Data, Application Data"
"412","0.965150625","192.168.1.118","199.232.37.140","TCP","66","38132 → 443 [ACK] Seq=871 Ack=18479 Win=61056 Len=0 TSval=1501515917 TSecr=2813898286"
"413","0.965239537","199.232.37.140","192.168.1.118","TLSv1.2","2770","Application Data, Application Data"
"414","0.965295362","199.232.37.140","192.168.1.118","TLSv1.2","2770","Application Data, Application Data"
"415","0.965343325","199.232.37.140","192.168.1.118","TLSv1.2","1418","Application Data [TCP segment of a reassembled PDU]"
"416","0.965574562","199.232.37.140","192.168.1.118","TLSv1.2","3744","Application Data, Application Data, Application Data, Application Data"
"417","0.965688762","199.232.37.140","192.168.1.118","TLSv1.2","1418","Application Data [TCP segment of a reassembled PDU]"
"418","0.965740600","199.232.37.140","192.168.1.118","TLSv1.2","1418","Application Data [TCP segment of a reassembled PDU]"
"419","0.968053725","199.232.37.140","192.168.1.118","TLSv1.2","1418","Application Data [TCP segment of a reassembled PDU]"
"420","0.968165087","199.232.37.140","192.168.1.118","TLSv1.2","2248","Application Data, Application Data"
"421","0.968222512","199.232.37.140","192.168.1.118","TLSv1.2","2770","Application Data, Application Data"
"422","0.968466250","199.232.37.140","192.168.1.118","TLSv1.2","2770","Application Data, Application Data"
"423","0.968578812","199.232.37.140","192.168.1.118","TLSv1.2","2770","Application Data, Application Data"
"424","0.968689250","199.232.37.140","192.168.1.118","TLSv1.2","2770","Application Data, Application Data"
"425","0.968785687","199.232.37.140","192.168.1.118","TCP","54","443 → 38146 [RST] Seq=3791 Win=0 Len=0"
"426","0.968853487","199.232.37.140","192.168.1.118","TLSv1.2","2770","Application Data, Application Data"
"427","0.968903025","199.232.37.140","192.168.1.118","TLSv1.2","2770","Application Data, Application Data"
"428","0.981614225","199.232.37.140","192.168.1.118","TCP","74","443 → 38148 [SYN, ACK] Seq=0 Ack=1 Win=27040 Len=0 MSS=1364 SACK_PERM=1 TSval=2812920729 TSecr=1501515869 WS=512"
"429","0.981704225","192.168.1.118","199.232.37.140","TCP","66","38148 → 443 [ACK] Seq=1 Ack=1 Win=64256 Len=0 TSval=1501515934 TSecr=2812920729"
"430","0.990136775","192.168.1.118","199.232.37.140","TCP","66","38138 → 443 [ACK] Seq=873 Ack=43882 Win=23808 Len=0 TSval=1501515942 TSecr=3143763863"
"431","0.990206350","192.168.1.118","199.232.37.140","TCP","66","38144 → 443 [ACK] Seq=873 Ack=43882 Win=23808 Len=0 TSval=1501515942 TSecr=3127712102"
"432","0.990275487","192.168.1.118","199.232.37.140","TCP","66","38136 → 443 [ACK] Seq=1252 Ack=9850 Win=61056 Len=0 TSval=1501515942 TSecr=3145772678"
"433","1.006145937","192.168.1.118","199.232.37.140","TCP","66","38124 → 443 [ACK] Seq=1575 Ack=14105 Win=60544 Len=0 TSval=1501515958 TSecr=3142432733"
"434","1.006230037","192.168.1.118","199.232.37.140","TCP","66","38126 → 443 [ACK] Seq=919 Ack=61032 Win=101760 Len=0 TSval=1501515958 TSecr=2812155337"
"435","1.011593037","199.232.37.140","192.168.1.118","TLSv1.2","1040","[TCP Spurious Retransmission] , Ignored Unknown Record"
"436","1.011675512","192.168.1.118","199.232.37.140","TCP","78","[TCP Dup ACK 433#1] 38124 → 443 [ACK] Seq=1575 Ack=14105 Win=60544 Len=0 TSval=1501515964 TSecr=3142432755 SLE=13131 SRE=14105"
"437","1.025853562","192.168.1.104","255.255.255.255","UDP","217","49154 → 6666 Len=175"
"438","1.042177437","192.168.1.118","199.232.37.140","TLSv1","583","Client Hello"
"439","1.042633587","199.232.37.140","192.168.1.118","TLSv1.2","1418","Application Data [TCP segment of a reassembled PDU]"
"440","1.045055275","199.232.37.140","192.168.1.118","TLSv1.2","1418","Application Data [TCP segment of a reassembled PDU]"
"441","1.045254312","192.168.1.118","199.232.37.140","TCP","66","38144 → 443 [ACK] Seq=873 Ack=46586 Win=21120 Len=0 TSval=1501515997 TSecr=3127712206"
"442","1.048926850","192.168.1.118","199.232.37.140","TCP","66","[TCP Window Update] 38138 → 443 [ACK] Seq=873 Ack=43882 Win=56960 Len=0 TSval=1501516001 TSecr=3143763863"
"443","1.049056737","192.168.1.118","199.232.37.140","TCP","66","[TCP Window Update] 38144 → 443 [ACK] Seq=873 Ack=46586 Win=52864 Len=0 TSval=1501516001 TSecr=3127712206"
"444","1.055544500","199.232.37.140","192.168.1.118","TLSv1.2","1418","Application Data [TCP segment of a reassembled PDU]"
"445","1.055607262","199.232.37.140","192.168.1.118","TLSv1.2","1418","Application Data [TCP segment of a reassembled PDU]"
"446","1.055619300","199.232.37.140","192.168.1.118","TLSv1.2","1418","Application Data [TCP segment of a reassembled PDU]"
"447","1.055648950","192.168.1.118","199.232.37.140","TCP","66","38138 → 443 [ACK] Seq=873 Ack=46586 Win=61056 Len=0 TSval=1501516008 TSecr=3143763889"
"448","1.059369650","199.232.37.140","192.168.1.118","TLSv1.2","2770","Application Data, Application Data"
"449","1.059431362","192.168.1.118","199.232.37.140","TCP","66","38144 → 443 [ACK] Seq=873 Ack=50642 Win=59008 Len=0 TSval=1501516011 TSecr=3127712206"
"450","1.059472462","199.232.37.140","192.168.1.118","TLSv1.2","2770","Application Data, Application Data"
"451","1.059490325","199.232.37.140","192.168.1.118","TLSv1.2","2770","Application Data, Application Data"
"452","1.059505975","199.232.37.140","192.168.1.118","TLSv1.2","6826","Application Data, Application Data, Application Data, Application Data, Application Data"
"453","1.059523837","199.232.37.140","192.168.1.118","TLSv1.2","2770","Application Data, Application Data"
"454","1.059538800","199.232.37.140","192.168.1.118","TLSv1.2","2770","Application Data, Application Data"
"455","1.059553200","199.232.37.140","192.168.1.118","TLSv1.2","2770","Application Data, Application Data"
"456","1.059567600","199.232.37.140","192.168.1.118","TLSv1.2","2770","Application Data, Application Data"
"457","1.059579650","199.232.37.140","192.168.1.118","TLSv1.2","2319","Application Data, Application Data"
"458","1.059592112","199.232.37.140","192.168.1.118","TLSv1.2","2770","Application Data, Application Data"
"459","1.059607200","199.232.37.140","192.168.1.118","TLSv1.2","2770","Application Data, Application Data"
"460","1.059622037","199.232.37.140","192.168.1.118","TLSv1.2","2770","Application Data, Application Data"
"461","1.059633975","199.232.37.140","192.168.1.118","TLSv1.2","1418","Application Data [TCP segment of a reassembled PDU]"
"462","1.068494500","192.168.1.118","199.232.37.140","TCP","66","38138 → 443 [ACK] Seq=873 Ack=65514 Win=64128 Len=0 TSval=1501516020 TSecr=3143763889"
"463","1.068778650","192.168.1.118","199.232.37.140","TCP","66","38144 → 443 [ACK] Seq=873 Ack=66415 Win=43264 Len=0 TSval=1501516021 TSecr=3127712207"
"464","1.071379825","199.232.37.140","192.168.1.118","TCP","66","443 → 38148 [ACK] Seq=1 Ack=518 Win=28160 Len=0 TSval=2812920753 TSecr=1501515994"
"465","1.071455437","199.232.37.140","192.168.1.118","TLSv1.2","3314","Server Hello, Certificate, Server Key Exchange, Server Hello Done"
"466","1.071493475","192.168.1.118","199.232.37.140","TCP","66","38148 → 443 [ACK] Seq=518 Ack=3249 Win=61056 Len=0 TSval=1501516023 TSecr=2812920753"
"467","1.071530487","199.232.37.140","192.168.1.118","TLSv1.2","1418","Application Data [TCP segment of a reassembled PDU]"
"468","1.071555525","192.168.1.118","199.232.37.140","TCP","66","38138 → 443 [ACK] Seq=873 Ack=66866 Win=66816 Len=0 TSval=1501516023 TSecr=3143763894"
"469","1.073557437","192.168.1.118","199.232.37.140","TLSv1.2","192","Client Key Exchange, Change Cipher Spec, Encrypted Handshake Message"
"470","1.088111587","199.232.37.140","192.168.1.118","TLSv1.2","8178","Application Data, Application Data, Application Data, Application Data, Application Data"
"471","1.088184875","192.168.1.118","199.232.37.140","TCP","66","38138 → 443 [ACK] Seq=873 Ack=74978 Win=83072 Len=0 TSval=1501516040 TSecr=3143763904"
"472","1.088273725","199.232.37.140","192.168.1.118","TLSv1.2","2770","Application Data, Application Data"
"473","1.088301312","192.168.1.118","199.232.37.140","TCP","66","38138 → 443 [ACK] Seq=873 Ack=77682 Win=88448 Len=0 TSval=1501516040 TSecr=3143763905"
"474","1.088332500","199.232.37.140","192.168.1.118","TLSv1.2","2770","Application Data, Application Data"
"475","1.088356750","192.168.1.118","199.232.37.140","TCP","66","38138 → 443 [ACK] Seq=873 Ack=80386 Win=93952 Len=0 TSval=1501516040 TSecr=3143763906"
"476","1.089131312","199.232.37.140","192.168.1.118","TLSv1.2","2770","Application Data, Application Data"
"477","1.089199562","192.168.1.118","199.232.37.140","TCP","66","38138 → 443 [ACK] Seq=873 Ack=83090 Win=99328 Len=0 TSval=1501516041 TSecr=3143763907"
"478","1.092589550","199.232.37.140","192.168.1.118","TLSv1.2","1418","Application Data [TCP segment of a reassembled PDU]"
"479","1.092657787","192.168.1.118","199.232.37.140","TCP","66","38138 → 443 [ACK] Seq=873 Ack=84442 Win=102016 Len=0 TSval=1501516045 TSecr=3143763908"
"480","1.093671462","199.232.37.140","192.168.1.118","TLSv1.2","1418","Application Data [TCP segment of a reassembled PDU]"
"481","1.093724837","192.168.1.118","199.232.37.140","TCP","66","38138 → 443 [ACK] Seq=873 Ack=85794 Win=104704 Len=0 TSval=1501516046 TSecr=3143763908"
"482","1.093753725","199.232.37.140","192.168.1.118","TLSv1.2","658","Application Data"
"483","1.093782200","192.168.1.118","199.232.37.140","TCP","66","38138 → 443 [ACK] Seq=873 Ack=86386 Win=107392 Len=0 TSval=1501516046 TSecr=3143763909"
"484","1.119968625","199.232.37.140","192.168.1.118","TLSv1.2","117","Change Cipher Spec, Encrypted Handshake Message"
"485","1.125291850","192.168.1.101","224.0.0.251","MDNS","111","Standard query 0x0000 PTR _googlecast._tcp.local, "QM" question OPT"
"486","1.131973962","192.168.1.100","224.0.0.251","MDNS","169","Standard query 0x0000 PTR _googlecast._tcp.local, "QM" question PTR Google-Home-Mini-2c3f16b2da5c4b6fd6cfbfba61c12490._googlecast._tcp.local OPT"
"487","1.160150325","192.168.1.118","199.232.37.140","TCP","66","38148 → 443 [ACK] Seq=644 Ack=3300 Win=64128 Len=0 TSval=1501516112 TSecr=2812920768"
"488","1.174854150","192.168.1.118","199.232.37.140","TLSv1.2","336","Application Data"
"489","1.175067800","192.168.1.118","199.232.37.140","TLSv1.2","249","Application Data"
"490","1.203489500","199.232.37.140","192.168.1.118","TLSv1.2","1418","Application Data"
"491","1.203566687","192.168.1.118","199.232.37.140","TCP","66","38148 → 443 [ACK] Seq=914 Ack=4652 Win=63104 Len=0 TSval=1501516155 TSecr=2812920788"
"492","1.205692987","199.232.37.140","192.168.1.118","TLSv1.2","8178","Application Data, Application Data, Application Data, Application Data, Application Data, Application Data"
"493","1.205769862","192.168.1.118","199.232.37.140","TCP","66","38148 → 443 [ACK] Seq=914 Ack=12764 Win=55040 Len=0 TSval=1501516158 TSecr=2812920788"
"494","1.205877650","199.232.37.140","192.168.1.118","TLSv1.2","4122","Application Data, Application Data, Application Data"
"495","1.205906425","192.168.1.118","199.232.37.140","TCP","66","38148 → 443 [ACK] Seq=914 Ack=16820 Win=51072 Len=0 TSval=1501516158 TSecr=2812920788"
"496","1.209159850","199.232.37.140","192.168.1.118","TLSv1.2","1151","Application Data, Application Data"
"497","1.209236625","192.168.1.118","199.232.37.140","TCP","66","38114 → 443 [ACK] Seq=1231 Ack=19150 Win=63104 Len=0 TSval=1501516161 TSecr=2811929500"
"498","1.230230875","192.168.1.102","224.0.0.251","MDNS","409","Standard query response 0x0000 PTR Google-Home-Mini-2c3f16b2da5c4b6fd6cfbfba61c12490._googlecast._tcp.local TXT, cache flush SRV, cache flush 0 0 8009 2c3f16b2-da5c-4b6f-d6cf-bfba61c12490.local A, cache flush 192.168.1.102"
"499","1.231531862","199.232.37.140","192.168.1.118","TLSv1.2","945","Application Data"
"500","1.231596512","192.168.1.118","199.232.37.140","TCP","66","38148 → 443 [ACK] Seq=914 Ack=17699 Win=63104 Len=0 TSval=1501516183 TSecr=2812920794"
"501","2.346141425","192.168.1.118","184.72.104.138","TCP","66","38436 → 443 [ACK] Seq=1 Ack=1 Win=501 Len=0 TSval=1592568421 TSecr=2147599320"
"502","2.382897525","184.72.104.138","192.168.1.118","TCP","66","[TCP ACKed unseen segment] 443 → 38436 [ACK] Seq=1 Ack=2 Win=227 Len=0 TSval=2147610585 TSecr=1592430865"
"503","3.485332487","192.168.1.101","224.0.0.251","MDNS","332","Standard query 0x0000 PTR _homekit._tcp.local, "QM" question PTR _uscan._tcp.local, "QM" question PTR _ptp._tcp.local, "QM" question PTR _ippusb._tcp.local, "QM" question PTR _scanner._tcp.local, "QM" question PTR _ipp._tcp.local, "QM" question PTR _pdl-datastream._tcp.local, "QM" question PTR _uscans._tcp.local, "QM" question PTR _ipps._tcp.local, "QM" question PTR _printer._tcp.local, "QM" question PTR _airplay._tcp.local, "QM" question PTR _raop._tcp.local, "QM" question PTR _airport._tcp.local, "QM" question PTR _companion-link._tcp.local, "QM" question PTR _rdlink._tcp.local, "QM" question PTR cjqg._companion-link._tcp.local OPT"
"504","3.995578375","192.168.1.104","255.255.255.255","UDP","217","49154 → 6666 Len=175"
"505","4.237591137","IntelCor_b7:52:73","Broadcast","ARP","60","Who has 192.168.1.1? Tell 192.168.1.118"
"506","4.242209162","Cisco-Li_5b:1c:ce","IntelCor_b7:52:73","ARP","42","192.168.1.1 is at 58:6d:8f:5b:1c:ce"
"507","5.016056837","192.168.1.118","192.168.1.102","TCP","176","44768 → 8009 [PSH, ACK] Seq=111 Ack=111 Win=501 Len=110 TSval=2256905432 TSecr=5142745 [TCP segment of a reassembled PDU]"
"508","5.022559212","192.168.1.102","192.168.1.118","TCP","176","8009 → 44768 [PSH, ACK] Seq=111 Ack=221 Win=294 Len=110 TSval=5143247 TSecr=2256905432 [TCP segment of a reassembled PDU]"
"509","5.022747400","192.168.1.118","192.168.1.102","TCP","66","44768 → 8009 [ACK] Seq=221 Ack=221 Win=501 Len=0 TSval=2256905439 TSecr=5143247"
"510","5.129040737","192.168.1.118","239.255.255.250","SSDP","218","M-SEARCH * HTTP/1.1 "
"511","6.132486300","192.168.1.118","239.255.255.250","SSDP","218","M-SEARCH * HTTP/1.1 "
"512","7.068135475","192.168.1.104","255.255.255.255","UDP","217","49154 → 6666 Len=175"
"513","7.133926287","192.168.1.118","239.255.255.250","SSDP","218","M-SEARCH * HTTP/1.1 "
"514","8.135684412","192.168.1.118","239.255.255.250","SSDP","218","M-SEARCH * HTTP/1.1 "
