frame.number,_ws.col.Time,_ws.col.Source,_ws.col.Destination,_ws.col.Protocol,frame.len,_ws.col.Info
"1","0.000000000","192.168.1.118","104.106.255.95","TCP","66","34470 → 443 [ACK] Seq=1 Ack=1 Win=501 Len=0 TSval=3196505688 TSecr=3698424328"
"2","0.001747138","192.168.1.118","35.186.208.48","TLSv1.2","321","Application Data"
"3","0.001966738","104.106.255.95","192.168.1.118","SSL","7680","Continuation Data"
"4","0.002033188","192.168.1.118","104.106.255.95","TCP","66","34474 → 443 [ACK] Seq=1 Ack=7615 Win=434 Len=0 TSval=3196505690 TSecr=3698424378"
"5","0.004278125","192.168.1.118","35.186.208.48","TLSv1.2","192","Client Key Exchange, Change Cipher Spec, Encrypted Handshake Message"
"6","0.006681288","192.168.1.118","35.186.208.48","TLSv1.2","192","Client Key Exchange, Change Cipher Spec, Encrypted Handshake Message"
"7","0.009055563","192.168.1.118","35.186.208.48","TLSv1.2","192","Client Key Exchange, Change Cipher Spec, Encrypted Handshake Message"
"8","0.011979813","192.168.1.118","35.186.208.48","TLSv1.2","192","Client Key Exchange, Change Cipher Spec, Encrypted Handshake Message"
"9","0.021302313","35.186.208.48","192.168.1.118","TLSv1.2","117","Change Cipher Spec, Encrypted Handshake Message"
"10","0.021393013","192.168.1.118","35.186.208.48","TCP","66","37570 → 443 [ACK] Seq=127 Ack=52 Win=501 Len=0 TSval=4270730250 TSecr=2292835328"
"11","0.023328525","35.186.208.48","192.168.1.118","TLSv1.2","1484","Application Data"
"12","0.023367463","35.186.208.48","192.168.1.118","TLSv1.2","1484","Application Data"
"13","0.023405125","35.186.208.48","192.168.1.118","TLSv1.2","2902","Application Data, Application Data"
"14","0.023443125","35.186.208.48","192.168.1.118","TLSv1.2","2902","Application Data, Application Data"
"15","0.024301013","35.186.208.48","192.168.1.118","TLSv1.2","1484","Application Data"
"16","0.025831238","35.186.208.48","192.168.1.118","TLSv1.2","1484","Application Data"
"17","0.029437925","35.186.208.48","192.168.1.118","TLSv1.2","2902","Application Data, Application Data"
"18","0.033368313","35.186.208.48","192.168.1.118","TLSv1.2","2902","Application Data, Application Data"
"19","0.033455213","35.186.208.48","192.168.1.118","TLSv1.2","2902","Application Data, Application Data"
"20","0.034715500","35.186.208.48","192.168.1.118","TLSv1.2","117","Change Cipher Spec, Encrypted Handshake Message"
"21","0.034816038","192.168.1.118","35.186.208.48","TCP","66","37576 → 443 [ACK] Seq=127 Ack=52 Win=501 Len=0 TSval=4270730263 TSecr=3626001571"
"22","0.034879900","35.186.208.48","192.168.1.118","TLSv1.2","117","Change Cipher Spec, Encrypted Handshake Message"
"23","0.034924638","192.168.1.118","35.186.208.48","TCP","66","37572 → 443 [ACK] Seq=127 Ack=52 Win=501 Len=0 TSval=4270730263 TSecr=3264292268"
"24","0.034955863","35.186.208.48","192.168.1.118","TLSv1.2","2902","Application Data, Application Data"
"25","0.035312900","35.186.208.48","192.168.1.118","TLSv1.2","117","Change Cipher Spec, Encrypted Handshake Message"
"26","0.035361688","192.168.1.118","35.186.208.48","TCP","66","37574 → 443 [ACK] Seq=127 Ack=52 Win=501 Len=0 TSval=4270730264 TSecr=3362024526"
"27","0.063841450","192.168.1.118","35.186.208.48","TCP","66","37568 → 443 [ACK] Seq=256 Ack=22689 Win=324 Len=0 TSval=4270730292 TSecr=183474419"
"28","0.068560738","192.168.1.118","35.186.208.48","TLSv1.2","353","Application Data"
"29","0.068850225","192.168.1.118","35.186.208.48","TLSv1.2","326","Application Data"
"30","0.069078325","192.168.1.118","35.186.208.48","TLSv1.2","324","Application Data"
"31","0.069284138","192.168.1.118","35.186.208.48","TLSv1.2","333","Application Data"
"32","0.080915188","192.168.1.118","35.227.209.247","TLSv1.2","285","Application Data"
"33","0.083603675","35.186.208.48","192.168.1.118","TLSv1.2","1484","Application Data"
"34","0.083682450","192.168.1.118","35.186.208.48","TCP","66","37568 → 443 [ACK] Seq=256 Ack=24107 Win=313 Len=0 TSval=4270730312 TSecr=183474482"
"35","0.085219363","35.186.208.48","192.168.1.118","TLSv1.2","1484","Application Data"
"36","0.085285863","35.186.208.48","192.168.1.118","TLSv1.2","2902","Application Data, Application Data"
"37","0.086164075","192.168.1.118","35.186.208.48","TCP","66","37568 → 443 [ACK] Seq=256 Ack=28361 Win=280 Len=0 TSval=4270730314 TSecr=183474482"
"38","0.086274325","35.186.208.48","192.168.1.118","TLSv1.2","2902","Application Data, Application Data"
"39","0.086327275","192.168.1.118","35.186.208.48","TCP","66","37568 → 443 [ACK] Seq=256 Ack=31197 Win=429 Len=0 TSval=4270730315 TSecr=183474484"
"40","0.091188625","35.186.208.48","192.168.1.118","TLSv1.2","1484","Application Data"
"41","0.094220175","35.186.208.48","192.168.1.118","TLSv1.2","1484","Application Data"
"42","0.094288250","192.168.1.118","35.186.208.48","TCP","66","37568 → 443 [ACK] Seq=256 Ack=34033 Win=523 Len=0 TSval=4270730322 TSecr=183474486"
"43","0.094398613","35.186.208.48","192.168.1.118","TLSv1.2","2902","Application Data, Application Data"
"44","0.094463300","192.168.1.118","35.186.208.48","TCP","66","37568 → 443 [ACK] Seq=256 Ack=36869 Win=568 Len=0 TSval=4270730323 TSecr=183474488"
"45","0.094509475","35.186.208.48","192.168.1.118","TLSv1.2","1484","Application Data [TCP segment of a reassembled PDU]"
"46","0.094570863","192.168.1.118","35.186.208.48","TCP","66","37568 → 443 [ACK] Seq=256 Ack=38287 Win=590 Len=0 TSval=4270730323 TSecr=183474490"
"47","0.097590063","35.186.208.48","192.168.1.118","TLSv1.2","1484","Application Data [TCP segment of a reassembled PDU]"
"48","0.097655313","192.168.1.118","35.186.208.48","TCP","66","37568 → 443 [ACK] Seq=256 Ack=39705 Win=612 Len=0 TSval=4270730326 TSecr=183474490"
"49","0.097749938","35.186.208.48","192.168.1.118","TLSv1.2","2902","Application Data, Application Data"
"50","0.097841613","192.168.1.118","35.186.208.48","TCP","66","37568 → 443 [ACK] Seq=256 Ack=42541 Win=656 Len=0 TSval=4270730326 TSecr=183474491"
"51","0.097921813","35.186.208.48","192.168.1.118","TLSv1.2","2902","Application Data, Application Data"
"52","0.097988088","192.168.1.118","35.186.208.48","TCP","66","37568 → 443 [ACK] Seq=256 Ack=45377 Win=701 Len=0 TSval=4270730326 TSecr=183474493"
"53","0.101132175","35.186.208.48","192.168.1.118","TLSv1.2","2902","Application Data, Application Data"
"54","0.101199300","192.168.1.118","35.186.208.48","TCP","66","37568 → 443 [ACK] Seq=256 Ack=48213 Win=745 Len=0 TSval=4270730329 TSecr=183474495"
"55","0.101290275","35.186.208.48","192.168.1.118","TLSv1.2","2902","Application Data, Application Data"
"56","0.101355463","192.168.1.118","35.186.208.48","TCP","66","37568 → 443 [ACK] Seq=256 Ack=51049 Win=789 Len=0 TSval=4270730330 TSecr=183474496"
"57","0.103439575","35.186.208.48","192.168.1.118","TLSv1.2","2902","Application Data, Application Data"
"58","0.103506500","192.168.1.118","35.186.208.48","TCP","66","37568 → 443 [ACK] Seq=256 Ack=53885 Win=834 Len=0 TSval=4270730332 TSecr=183474498"
"59","0.103589613","35.186.208.48","192.168.1.118","TLSv1.2","2902","Application Data, Application Data"
"60","0.103655100","192.168.1.118","35.186.208.48","TCP","66","37568 → 443 [ACK] Seq=256 Ack=56721 Win=878 Len=0 TSval=4270730332 TSecr=183474500"
"61","0.106328888","35.186.208.48","192.168.1.118","TLSv1.2","1484","Application Data"
"62","0.106417113","35.186.208.48","192.168.1.118","TLSv1.2","2902","Application Data, Application Data"
"63","0.106500450","35.186.208.48","192.168.1.118","TLSv1.2","1484","Application Data"
"64","0.106560413","192.168.1.118","35.186.208.48","TCP","66","37570 → 443 [ACK] Seq=414 Ack=1470 Win=493 Len=0 TSval=4270730335 TSecr=2292835411"
"65","0.106626588","35.186.208.48","192.168.1.118","TLSv1.2","2902","Application Data, Application Data"
"66","0.106677075","192.168.1.118","35.186.208.48","TCP","66","37568 → 443 [ACK] Seq=256 Ack=59557 Win=922 Len=0 TSval=4270730335 TSecr=183474502"
"67","0.106710175","35.186.208.48","192.168.1.118","TLSv1.2","2902","Application Data, Application Data"
"68","0.106742325","35.186.208.48","192.168.1.118","TLSv1.2","1484","Application Data"
"69","0.106803575","192.168.1.118","35.186.208.48","TCP","66","37570 → 443 [ACK] Seq=414 Ack=2888 Win=482 Len=0 TSval=4270730335 TSecr=2292835411"
"70","0.107449300","192.168.1.118","35.186.208.48","TCP","66","37574 → 443 [ACK] Seq=385 Ack=7142 Win=446 Len=0 TSval=4270730336 TSecr=3362024594"
"71","0.107979913","35.186.208.48","192.168.1.118","TLSv1.2","1484","Application Data"
"72","0.108030125","192.168.1.118","35.186.208.48","TCP","66","37570 → 443 [ACK] Seq=414 Ack=4306 Win=493 Len=0 TSval=4270730336 TSecr=2292835411"
"73","0.108114013","35.186.208.48","192.168.1.118","TLSv1.2","1484","Application Data"
"74","0.108201950","35.186.208.48","192.168.1.118","TLSv1.2","2902","Application Data, Application Data"
"75","0.108274638","35.186.208.48","192.168.1.118","TLSv1.2","2902","Application Data, Application Data"
"76","0.108326038","192.168.1.118","35.186.208.48","TCP","66","37570 → 443 [ACK] Seq=414 Ack=7142 Win=471 Len=0 TSval=4270730337 TSecr=2292835411"
"77","0.108359600","35.186.208.48","192.168.1.118","TLSv1.2","2902","Application Data, Application Data"
"78","0.108482975","35.186.208.48","192.168.1.118","TLSv1.2","1484","Application Data"
"79","0.108563325","35.186.208.48","192.168.1.118","TLSv1.2","2902","Application Data, Application Data"
"80","0.108617163","35.186.208.48","192.168.1.118","TLSv1.2","1484","Application Data"
"81","0.108698688","35.227.209.247","192.168.1.118","TLSv1.2","1484","Application Data"
"82","0.108760113","192.168.1.118","35.227.209.247","TCP","66","46700 → 443 [ACK] Seq=220 Ack=1419 Win=493 Len=0 TSval=3534501845 TSecr=1505064798"
"83","0.108842113","35.186.208.48","192.168.1.118","TLSv1.2","2902","Application Data, Application Data"
"84","0.108895288","192.168.1.118","35.186.208.48","TCP","66","37568 → 443 [ACK] Seq=256 Ack=62393 Win=966 Len=0 TSval=4270730337 TSecr=183474503"
"85","0.108929388","35.186.208.48","192.168.1.118","TLSv1.2","1484","Application Data"
"86","0.109325663","192.168.1.118","35.186.208.48","TCP","66","37572 → 443 [ACK] Seq=387 Ack=7142 Win=446 Len=0 TSval=4270730337 TSecr=3264292338"
"87","0.109558738","192.168.1.118","35.186.208.48","TCP","66","37576 → 443 [ACK] Seq=394 Ack=7142 Win=446 Len=0 TSval=4270730338 TSecr=3626001642"
"88","0.113419975","35.186.208.48","192.168.1.118","TLSv1.2","1484","Application Data"
"89","0.113494013","35.227.209.247","192.168.1.118","TLSv1.2","2902","Application Data, Application Data"
"90","0.113543250","192.168.1.118","35.227.209.247","TCP","66","46700 → 443 [ACK] Seq=220 Ack=4255 Win=477 Len=0 TSval=3534501850 TSecr=1505064798"
"91","0.113609125","35.186.208.48","192.168.1.118","TLSv1.2","1484","Application Data"
"92","0.113658388","192.168.1.118","35.186.208.48","TCP","66","37570 → 443 [ACK] Seq=414 Ack=8560 Win=493 Len=0 TSval=4270730342 TSecr=2292835413"
"93","0.113851663","35.186.208.48","192.168.1.118","TLSv1.2","1484","Application Data"
"94","0.113901413","192.168.1.118","35.186.208.48","TCP","66","37570 → 443 [ACK] Seq=414 Ack=9978 Win=493 Len=0 TSval=4270730342 TSecr=2292835413"
"95","0.114002138","35.186.208.48","192.168.1.118","TLSv1.2","1484","Application Data"
"96","0.114050975","192.168.1.118","35.186.208.48","TCP","66","37576 → 443 [ACK] Seq=394 Ack=9978 Win=493 Len=0 TSval=4270730342 TSecr=3626001643"
"97","0.114107838","35.186.208.48","192.168.1.118","TLSv1.2","2902","Application Data, Application Data"
"98","0.114157700","192.168.1.118","35.186.208.48","TCP","66","37574 → 443 [ACK] Seq=385 Ack=9978 Win=477 Len=0 TSval=4270730342 TSecr=3362024596"
"99","0.114220875","35.186.208.48","192.168.1.118","TLSv1.2","2902","Application Data, Application Data"
"100","0.114272800","192.168.1.118","35.186.208.48","TCP","66","37572 → 443 [ACK] Seq=387 Ack=9978 Win=477 Len=0 TSval=4270730342 TSecr=3264292341"
"101","0.114305625","35.186.208.48","192.168.1.118","TLSv1.2","2902","Application Data, Application Data"
"102","0.114353625","192.168.1.118","35.186.208.48","TCP","66","37570 → 443 [ACK] Seq=414 Ack=12814 Win=477 Len=0 TSval=4270730343 TSecr=2292835415"
"103","0.114384963","35.227.209.247","192.168.1.118","TLSv1.2","2902","Application Data, Application Data"
"104","0.114432063","192.168.1.118","35.227.209.247","TCP","66","46700 → 443 [ACK] Seq=220 Ack=7091 Win=477 Len=0 TSval=3534501851 TSecr=1505064800"
"105","0.114463125","35.186.208.48","192.168.1.118","TLSv1.2","2902","Application Data, Application Data"
"106","0.115496038","35.186.208.48","192.168.1.118","TLSv1.2","2902","Application Data, Application Data"
"107","0.115534725","192.168.1.118","35.186.208.48","TCP","66","37570 → 443 [ACK] Seq=414 Ack=15650 Win=455 Len=0 TSval=4270730344 TSecr=2292835416"
"108","0.115561225","35.186.208.48","192.168.1.118","TLSv1.2","2902","Application Data, Application Data"
"109","0.115602638","192.168.1.118","35.186.208.48","TCP","66","37568 → 443 [ACK] Seq=256 Ack=65229 Win=1011 Len=0 TSval=4270730344 TSecr=183474508"
"110","0.115627388","35.227.209.247","192.168.1.118","TLSv1.2","2902","Application Data, Application Data"
"111","0.115664863","192.168.1.118","35.227.209.247","TCP","66","46700 → 443 [ACK] Seq=220 Ack=9927 Win=455 Len=0 TSval=3534501852 TSecr=1505064802"
"112","0.115698563","192.168.1.118","35.186.208.48","TCP","66","37574 → 443 [ACK] Seq=385 Ack=12814 Win=455 Len=0 TSval=4270730344 TSecr=3362024599"
"113","0.115799488","35.186.208.48","192.168.1.118","TLSv1.2","1484","Application Data"
"114","0.115913900","35.186.208.48","192.168.1.118","TLSv1.2","2902","Application Data, Application Data"
"115","0.115939363","35.186.208.48","192.168.1.118","TLSv1.2","2902","Application Data, Application Data"
"116","0.115974775","192.168.1.118","35.186.208.48","TCP","66","37568 → 443 [ACK] Seq=256 Ack=68065 Win=1055 Len=0 TSval=4270730344 TSecr=183474509"
"117","0.116000688","35.186.208.48","192.168.1.118","TLSv1.2","2902","Application Data, Application Data"
"118","0.116019963","192.168.1.118","35.186.208.48","TCP","66","37576 → 443 [ACK] Seq=394 Ack=12814 Win=477 Len=0 TSval=4270730344 TSecr=3626001647"
"119","0.116038188","192.168.1.118","35.186.208.48","TCP","66","37570 → 443 [ACK] Seq=414 Ack=18486 Win=433 Len=0 TSval=4270730344 TSecr=2292835418"
"120","0.116064313","35.186.208.48","192.168.1.118","TLSv1.2","2902","Application Data, Application Data"
"121","0.116096025","35.186.208.48","192.168.1.118","TLSv1.2","1484","Application Data"
"122","0.118028975","192.168.1.118","35.186.208.48","TCP","66","37572 → 443 [ACK] Seq=387 Ack=12814 Win=455 Len=0 TSval=4270730346 TSecr=3264292344"
"123","0.118125300","192.168.1.118","35.186.208.48","TCP","66","37574 → 443 [ACK] Seq=385 Ack=15650 Win=433 Len=0 TSval=4270730346 TSecr=3362024601"
"124","0.118720913","35.186.208.48","192.168.1.118","TLSv1.2","1484","Application Data"
"125","0.118747400","35.227.209.247","192.168.1.118","TLSv1.2","2902","Application Data, Application Data"
"126","0.118795513","192.168.1.118","35.227.209.247","TCP","66","46700 → 443 [ACK] Seq=220 Ack=12763 Win=477 Len=0 TSval=3534501855 TSecr=1505064804"
"127","0.118820950","35.186.208.48","192.168.1.118","TLSv1.2","2902","Application Data, Application Data"
"128","0.118858638","192.168.1.118","35.186.208.48","TCP","66","37568 → 443 [ACK] Seq=256 Ack=70901 Win=1099 Len=0 TSval=4270730347 TSecr=183474510"
"129","0.118883263","35.186.208.48","192.168.1.118","TLSv1.2","1484","Application Data"
"130","0.119203875","35.186.208.48","192.168.1.118","TLSv1.2","1484","Application Data"
"131","0.119241263","192.168.1.118","35.186.208.48","TCP","66","37576 → 443 [ACK] Seq=394 Ack=15650 Win=477 Len=0 TSval=4270730347 TSecr=3626001650"
"132","0.119267038","35.186.208.48","192.168.1.118","TLSv1.2","2902","Application Data, Application Data"
"133","0.119307300","192.168.1.118","35.186.208.48","TCP","66","37570 → 443 [ACK] Seq=414 Ack=21322 Win=411 Len=0 TSval=4270730347 TSecr=2292835420"
"134","0.119330538","35.186.208.48","192.168.1.118","TLSv1.2","1484","Application Data"
"135","0.128231725","35.186.208.48","192.168.1.118","TLSv1.2","1484","Application Data"
"136","0.128289150","192.168.1.118","35.186.208.48","TCP","66","37574 → 443 [ACK] Seq=385 Ack=18486 Win=493 Len=0 TSval=4270730356 TSecr=3362024604"
"137","0.128326800","35.227.209.247","192.168.1.118","TLSv1.2","2902","Application Data, Application Data"
"138","0.128381775","192.168.1.118","35.227.209.247","TCP","66","46700 → 443 [ACK] Seq=220 Ack=15599 Win=477 Len=0 TSval=3534501865 TSecr=1505064806"
"139","0.128418125","35.186.208.48","192.168.1.118","TLSv1.2","2902","Application Data, Application Data"
"140","0.128471488","192.168.1.118","35.186.208.48","TCP","66","37568 → 443 [ACK] Seq=256 Ack=73737 Win=1144 Len=0 TSval=4270730357 TSecr=183474512"
"141","0.128507900","35.186.208.48","192.168.1.118","TLSv1.2","2902","Application Data, Application Data"
"142","0.128563163","192.168.1.118","35.186.208.48","TCP","66","37572 → 443 [ACK] Seq=387 Ack=17068 Win=477 Len=0 TSval=4270730357 TSecr=3264292345"
"143","0.133913138","35.227.209.247","192.168.1.118","TLSv1.2","2902","Application Data, Application Data"
"144","0.133971513","192.168.1.118","35.227.209.247","TCP","66","46700 → 443 [ACK] Seq=220 Ack=18435 Win=477 Len=0 TSval=3534501870 TSecr=1505064808"
"145","0.134010513","35.227.209.247","192.168.1.118","TLSv1.2","637","Application Data"
"146","0.134065688","192.168.1.118","35.227.209.247","TCP","66","46700 → 443 [ACK] Seq=220 Ack=19006 Win=473 Len=0 TSval=3534501870 TSecr=1505064810"
"147","0.134132263","35.186.208.48","192.168.1.118","TLSv1.2","2902","Application Data, Application Data"
"148","0.134188413","192.168.1.118","35.186.208.48","TCP","66","37576 → 443 [ACK] Seq=394 Ack=18486 Win=477 Len=0 TSval=4270730362 TSecr=3626001653"
"149","0.134249525","35.186.208.48","192.168.1.118","TLSv1.2","2902","Application Data, Application Data"
"150","0.134291963","35.186.208.48","192.168.1.118","TLSv1.2","1484","Application Data"
"151","0.134342238","192.168.1.118","35.186.208.48","TCP","66","37570 → 443 [ACK] Seq=414 Ack=22740 Win=493 Len=0 TSval=4270730363 TSecr=2292835422"
"152","0.134378088","35.186.208.48","192.168.1.118","TLSv1.2","2902","Application Data, Application Data"
"153","0.134435738","192.168.1.118","35.186.208.48","TCP","66","37568 → 443 [ACK] Seq=256 Ack=76573 Win=1188 Len=0 TSval=4270730363 TSecr=183474514"
"154","0.134471388","35.186.208.48","192.168.1.118","TLSv1.2","2902","Application Data, Application Data"
"155","0.134524925","192.168.1.118","35.186.208.48","TCP","66","37572 → 443 [ACK] Seq=387 Ack=19904 Win=477 Len=0 TSval=4270730363 TSecr=3264292351"
"156","0.134560388","35.186.208.48","192.168.1.118","TLSv1.2","2902","Application Data, Application Data"
"157","0.134597950","35.186.208.48","192.168.1.118","TLSv1.2","1484","Application Data"
"158","0.135503675","35.186.208.48","192.168.1.118","TLSv1.2","2902","Application Data, Application Data"
"159","0.135544088","35.186.208.48","192.168.1.118","TLSv1.2","1484","Application Data"
"160","0.135573925","35.186.208.48","192.168.1.118","TLSv1.2","1484","Application Data [TCP segment of a reassembled PDU]"
"161","0.135596050","192.168.1.118","35.186.208.48","TCP","66","37572 → 443 [ACK] Seq=387 Ack=22740 Win=455 Len=0 TSval=4270730364 TSecr=3264292354"
"162","0.135636263","192.168.1.118","35.186.208.48","TCP","66","37568 → 443 [ACK] Seq=256 Ack=77991 Win=1210 Len=0 TSval=4270730364 TSecr=183474521"
"163","0.135680925","192.168.1.118","35.186.208.48","TCP","66","37574 → 443 [ACK] Seq=385 Ack=22740 Win=461 Len=0 TSval=4270730364 TSecr=3362024606"
"164","0.135737413","192.168.1.118","35.186.208.48","TCP","66","37576 → 443 [ACK] Seq=394 Ack=22740 Win=444 Len=0 TSval=4270730364 TSecr=3626001656"
"165","0.135863338","35.186.208.48","192.168.1.118","TLSv1.2","1484","Application Data [TCP segment of a reassembled PDU]"
"166","0.135927563","192.168.1.118","35.186.208.48","TCP","66","37568 → 443 [ACK] Seq=256 Ack=79409 Win=1232 Len=0 TSval=4270730364 TSecr=183474521"
"167","0.136011563","35.186.208.48","192.168.1.118","TLSv1.2","2902","Application Data, Application Data"
"168","0.136074563","192.168.1.118","35.186.208.48","TCP","66","37568 → 443 [ACK] Seq=256 Ack=82245 Win=1277 Len=0 TSval=4270730364 TSecr=183474522"
"169","0.136156988","35.186.208.48","192.168.1.118","TLSv1.2","2902","Application Data, Application Data"
"170","0.136213488","192.168.1.118","35.186.208.48","TCP","66","37568 → 443 [ACK] Seq=256 Ack=85081 Win=1321 Len=0 TSval=4270730364 TSecr=183474524"
"171","0.136304600","35.186.208.48","192.168.1.118","TLSv1.2","2902","Application Data, Application Data"
"172","0.136366650","192.168.1.118","35.186.208.48","TCP","66","37568 → 443 [ACK] Seq=256 Ack=87917 Win=1365 Len=0 TSval=4270730365 TSecr=183474525"
"173","0.136446950","35.186.208.48","192.168.1.118","TLSv1.2","2902","Application Data, Application Data"
"174","0.136513775","192.168.1.118","35.186.208.48","TCP","66","37568 → 443 [ACK] Seq=256 Ack=90753 Win=1410 Len=0 TSval=4270730365 TSecr=183474526"
"175","0.136595713","35.186.208.48","192.168.1.118","TLSv1.2","2902","Application Data, Application Data"
"176","0.136651850","192.168.1.118","35.186.208.48","TCP","66","37568 → 443 [ACK] Seq=256 Ack=93589 Win=1454 Len=0 TSval=4270730365 TSecr=183474527"
"177","0.136694163","35.186.208.48","192.168.1.118","TLSv1.2","1484","Application Data [TCP segment of a reassembled PDU]"
"178","0.136753350","192.168.1.118","35.186.208.48","TCP","66","37568 → 443 [ACK] Seq=256 Ack=95007 Win=1476 Len=0 TSval=4270730365 TSecr=183474528"
"179","0.144246238","35.186.208.48","192.168.1.118","TLSv1.2","1484","Application Data [TCP segment of a reassembled PDU]"
"180","0.144289000","192.168.1.118","35.186.208.48","TCP","66","37568 → 443 [ACK] Seq=256 Ack=96425 Win=1498 Len=0 TSval=4270730372 TSecr=183474528"
"181","0.144318675","35.186.208.48","192.168.1.118","TLSv1.2","1484","Application Data [TCP segment of a reassembled PDU]"
"182","0.144362650","192.168.1.118","35.186.208.48","TCP","66","37568 → 443 [ACK] Seq=256 Ack=97843 Win=1520 Len=0 TSval=4270730373 TSecr=183474529"
"183","0.144462063","35.186.208.48","192.168.1.118","TLSv1.2","1484","Application Data [TCP segment of a reassembled PDU]"
"184","0.144505725","192.168.1.118","35.186.208.48","TCP","66","37568 → 443 [ACK] Seq=256 Ack=99261 Win=1543 Len=0 TSval=4270730373 TSecr=183474529"
"185","0.144589875","35.186.208.48","192.168.1.118","TLSv1.2","2902","Application Data, Application Data"
"186","0.144635313","192.168.1.118","35.186.208.48","TCP","66","37568 → 443 [ACK] Seq=256 Ack=102097 Win=1587 Len=0 TSval=4270730373 TSecr=183474530"
"187","0.144769250","35.186.208.48","192.168.1.118","TLSv1.2","2902","Application Data, Application Data"
"188","0.144824650","192.168.1.118","35.186.208.48","TCP","66","37574 → 443 [ACK] Seq=385 Ack=25576 Win=477 Len=0 TSval=4270730373 TSecr=3362024623"
"189","0.144856163","35.186.208.48","192.168.1.118","TLSv1.2","2902","Application Data, Application Data"
"190","0.144901488","192.168.1.118","35.186.208.48","TCP","66","37568 → 443 [ACK] Seq=256 Ack=104933 Win=1631 Len=0 TSval=4270730373 TSecr=183474531"
"191","0.144928400","35.186.208.48","192.168.1.118","TLSv1.2","2902","Application Data, Application Data"
"192","0.144955438","35.186.208.48","192.168.1.118","TLSv1.2","2902","Application Data, Application Data"
"193","0.145010038","192.168.1.118","35.186.208.48","TCP","66","37572 → 443 [ACK] Seq=387 Ack=25576 Win=477 Len=0 TSval=4270730373 TSecr=3264292367"
"194","0.145036450","35.186.208.48","192.168.1.118","TLSv1.2","2902","Application Data, Application Data"
"195","0.145076838","192.168.1.118","35.186.208.48","TCP","66","37576 → 443 [ACK] Seq=394 Ack=25576 Win=477 Len=0 TSval=4270730373 TSecr=3626001670"
"196","0.145103163","35.186.208.48","192.168.1.118","TLSv1.2","1484","Application Data"
"197","0.146001600","192.168.1.118","35.186.208.48","TCP","66","37570 → 443 [ACK] Seq=414 Ack=25576 Win=501 Len=0 TSval=4270730374 TSecr=2292835440"
"198","0.152014513","35.186.208.48","192.168.1.118","TLSv1.2","1484","Application Data"
"199","0.152070463","192.168.1.118","35.186.208.48","TCP","66","37574 → 443 [ACK] Seq=385 Ack=28412 Win=523 Len=0 TSval=4270730380 TSecr=3362024624"
"200","0.152101238","35.186.208.48","192.168.1.118","TLSv1.2","1484","Application Data [TCP segment of a reassembled PDU]"
"201","0.152131075","192.168.1.118","35.186.208.48","TCP","66","37568 → 443 [ACK] Seq=256 Ack=106351 Win=1653 Len=0 TSval=4270730380 TSecr=183474532"
"202","0.152259538","35.186.208.48","192.168.1.118","TLSv1.2","1484","Application Data [TCP segment of a reassembled PDU]"
"203","0.152286825","192.168.1.118","35.186.208.48","TCP","66","37568 → 443 [ACK] Seq=256 Ack=107769 Win=1675 Len=0 TSval=4270730380 TSecr=183474532"
"204","0.152346963","35.186.208.48","192.168.1.118","TLSv1.2","2902","Application Data, Application Data"
"205","0.152374713","192.168.1.118","35.186.208.48","TCP","66","37570 → 443 [ACK] Seq=414 Ack=28412 Win=545 Len=0 TSval=4270730381 TSecr=2292835441"
"206","0.152414888","35.186.208.48","192.168.1.118","TLSv1.2","2902","Application Data, Application Data"
"207","0.152441413","192.168.1.118","35.186.208.48","TCP","66","37568 → 443 [ACK] Seq=256 Ack=110605 Win=1720 Len=0 TSval=4270730381 TSecr=183474533"
"208","0.152462763","35.186.208.48","192.168.1.118","TLSv1.2","2902","Application Data, Application Data"
"209","0.152489988","192.168.1.118","35.186.208.48","TCP","66","37572 → 443 [ACK] Seq=387 Ack=28412 Win=477 Len=0 TSval=4270730381 TSecr=3264292368"
"210","0.152507600","35.186.208.48","192.168.1.118","TLSv1.2","2902","Application Data, Application Data"
"211","0.152532863","192.168.1.118","35.186.208.48","TCP","66","37576 → 443 [ACK] Seq=394 Ack=28412 Win=477 Len=0 TSval=4270730381 TSecr=3626001671"
"212","0.152549938","35.186.208.48","192.168.1.118","TLSv1.2","2902","Application Data, Application Data"
"213","0.152575500","192.168.1.118","35.186.208.48","TCP","66","37574 → 443 [ACK] Seq=385 Ack=31248 Win=568 Len=0 TSval=4270730381 TSecr=3362024625"
"214","0.152595975","35.186.208.48","192.168.1.118","TLSv1.2","2902","Application Data, Application Data"
"215","0.152621475","192.168.1.118","35.186.208.48","TCP","66","37570 → 443 [ACK] Seq=414 Ack=31248 Win=590 Len=0 TSval=4270730381 TSecr=2292835443"
"216","0.152638413","35.186.208.48","192.168.1.118","TLSv1.2","1484","Application Data [TCP segment of a reassembled PDU]"
"217","0.152663713","192.168.1.118","35.186.208.48","TCP","66","37568 → 443 [ACK] Seq=256 Ack=112023 Win=1742 Len=0 TSval=4270730381 TSecr=183474534"
"218","0.164148013","35.186.208.48","192.168.1.118","TLSv1.2","1484","Application Data [TCP segment of a reassembled PDU]"
"219","0.164193638","192.168.1.118","35.186.208.48","TCP","66","37568 → 443 [ACK] Seq=256 Ack=113441 Win=1764 Len=0 TSval=4270730392 TSecr=183474534"
"220","0.164224650","35.186.208.48","192.168.1.118","TLSv1.2","2902","Application Data, Application Data"
"221","0.164269050","192.168.1.118","35.186.208.48","TCP","66","37572 → 443 [ACK] Seq=387 Ack=31248 Win=545 Len=0 TSval=4270730392 TSecr=3264292370"
"222","0.164295050","35.186.208.48","192.168.1.118","TLSv1.2","1484","Application Data"
"223","0.164467800","35.186.208.48","192.168.1.118","TLSv1.2","2902","Application Data, Application Data"
"224","0.164509938","192.168.1.118","35.186.208.48","TCP","66","37568 → 443 [ACK] Seq=256 Ack=116277 Win=1808 Len=0 TSval=4270730393 TSecr=183474535"
"225","0.164571463","35.186.208.48","192.168.1.118","TLSv1.2","1484","Application Data"
"226","0.164612138","192.168.1.118","35.186.208.48","TCP","66","37576 → 443 [ACK] Seq=394 Ack=31248 Win=545 Len=0 TSval=4270730393 TSecr=3626001674"
"227","0.164682713","35.186.208.48","192.168.1.118","TLSv1.2","2902","Application Data, Application Data"
"228","0.164723263","192.168.1.118","35.186.208.48","TCP","66","37574 → 443 [ACK] Seq=385 Ack=34084 Win=612 Len=0 TSval=4270730393 TSecr=3362024627"
"229","0.164749713","35.186.208.48","192.168.1.118","TLSv1.2","2902","Application Data, Application Data"
"230","0.164804600","192.168.1.118","35.186.208.48","TCP","66","37570 → 443 [ACK] Seq=414 Ack=34084 Win=634 Len=0 TSval=4270730393 TSecr=2292835444"
"231","0.164830863","35.186.208.48","192.168.1.118","TLSv1.2","2902","Application Data, Application Data"
"232","0.164872325","192.168.1.118","35.186.208.48","TCP","66","37568 → 443 [ACK] Seq=256 Ack=119113 Win=1853 Len=0 TSval=4270730393 TSecr=183474536"
"233","0.164899675","35.186.208.48","192.168.1.118","TLSv1.2","2902","Application Data, Application Data"
"234","0.164938625","192.168.1.118","35.186.208.48","TCP","66","37576 → 443 [ACK] Seq=394 Ack=34084 Win=590 Len=0 TSval=4270730393 TSecr=3626001676"
"235","0.164963238","35.186.208.48","192.168.1.118","TLSv1.2","1484","Application Data"
"236","0.171360863","35.186.208.48","192.168.1.118","TLSv1.2","1484","Application Data"
"237","0.171402800","192.168.1.118","35.186.208.48","TCP","66","37572 → 443 [ACK] Seq=387 Ack=34084 Win=590 Len=0 TSval=4270730400 TSecr=3264292372"
"238","0.171431925","35.186.208.48","192.168.1.118","TLSv1.2","2902","Application Data, Application Data"
"239","0.171470988","192.168.1.118","35.186.208.48","TCP","66","37568 → 443 [ACK] Seq=256 Ack=121949 Win=1897 Len=0 TSval=4270730400 TSecr=183474537"
"240","0.171496888","35.186.208.48","192.168.1.118","TLSv1.2","1484","Application Data [TCP segment of a reassembled PDU]"
"241","0.171538075","192.168.1.118","35.186.208.48","TCP","66","37570 → 443 [ACK] Seq=414 Ack=35502 Win=656 Len=0 TSval=4270730400 TSecr=2292835446"
"242","0.171682238","35.186.208.48","192.168.1.118","TLSv1.2","1484","Application Data [TCP segment of a reassembled PDU]"
"243","0.171723713","192.168.1.118","35.186.208.48","TCP","66","37570 → 443 [ACK] Seq=414 Ack=36920 Win=678 Len=0 TSval=4270730400 TSecr=2292835446"
"244","0.171804600","35.186.208.48","192.168.1.118","TLSv1.2","2902","Application Data, Application Data"
"245","0.171845525","192.168.1.118","35.186.208.48","TCP","66","37568 → 443 [ACK] Seq=256 Ack=124785 Win=1941 Len=0 TSval=4270730400 TSecr=183474538"
"246","0.171905388","35.186.208.48","192.168.1.118","TLSv1.2","2902","Application Data, Application Data"
"247","0.171945863","192.168.1.118","35.186.208.48","TCP","66","37574 → 443 [ACK] Seq=385 Ack=36920 Win=656 Len=0 TSval=4270730400 TSecr=3362024629"
"248","0.172015163","35.186.208.48","192.168.1.118","TLSv1.2","2902","Application Data, Application Data"
"249","0.172057513","192.168.1.118","35.186.208.48","TCP","66","37570 → 443 [ACK] Seq=414 Ack=39756 Win=723 Len=0 TSval=4270730400 TSecr=2292835447"
"250","0.172086000","35.186.208.48","192.168.1.118","TLSv1.2","2902","Application Data, Application Data"
"251","0.172126213","192.168.1.118","35.186.208.48","TCP","66","37568 → 443 [ACK] Seq=256 Ack=127621 Win=1986 Len=0 TSval=4270730400 TSecr=183474539"
"252","0.172153225","35.186.208.48","192.168.1.118","TLSv1.2","2902","Application Data, Application Data"
"253","0.172193813","192.168.1.118","35.186.208.48","TCP","66","37574 → 443 [ACK] Seq=385 Ack=39756 Win=701 Len=0 TSval=4270730400 TSecr=3362024631"
"254","0.172220325","35.186.208.48","192.168.1.118","TLSv1.2","1484","Application Data"
"255","0.173352400","35.186.208.48","192.168.1.118","TLSv1.2","1484","Application Data"
"256","0.173397525","192.168.1.118","35.186.208.48","TCP","66","37576 → 443 [ACK] Seq=394 Ack=36920 Win=634 Len=0 TSval=4270730402 TSecr=3626001678"
"257","0.173427288","35.186.208.48","192.168.1.118","TLSv1.2","2902","Application Data, Application Data"
"258","0.173470750","192.168.1.118","35.186.208.48","TCP","66","37572 → 443 [ACK] Seq=387 Ack=36920 Win=634 Len=0 TSval=4270730402 TSecr=3264292374"
"259","0.173498350","35.186.208.48","192.168.1.118","TLSv1.2","1484","Application Data [TCP segment of a reassembled PDU]"
"260","0.173542550","192.168.1.118","35.186.208.48","TCP","66","37568 → 443 [ACK] Seq=256 Ack=129039 Win=2008 Len=0 TSval=4270730402 TSecr=183474540"
"261","0.173699775","35.186.208.48","192.168.1.118","TLSv1.2","1484","Application Data [TCP segment of a reassembled PDU]"
"262","0.173745113","192.168.1.118","35.186.208.48","TCP","66","37568 → 443 [ACK] Seq=256 Ack=130457 Win=2030 Len=0 TSval=4270730402 TSecr=183474540"
"263","0.173881625","35.186.208.48","192.168.1.118","TLSv1.2","2902","Application Data, Application Data"
"264","0.173930925","192.168.1.118","35.186.208.48","TCP","66","37570 → 443 [ACK] Seq=414 Ack=42592 Win=767 Len=0 TSval=4270730402 TSecr=2292835449"
"265","0.173966775","35.186.208.48","192.168.1.118","TLSv1.2","2902","Application Data, Application Data"
"266","0.174012075","192.168.1.118","35.186.208.48","TCP","66","37574 → 443 [ACK] Seq=385 Ack=42592 Win=745 Len=0 TSval=4270730402 TSecr=3362024633"
"267","0.174041750","35.186.208.48","192.168.1.118","TLSv1.2","2902","Application Data, Application Data"
"268","0.174084675","192.168.1.118","35.186.208.48","TCP","66","37568 → 443 [ACK] Seq=256 Ack=133293 Win=2074 Len=0 TSval=4270730402 TSecr=183474541"
"269","0.174115238","35.186.208.48","192.168.1.118","TLSv1.2","2902","Application Data, Application Data"
"270","0.174160175","192.168.1.118","35.186.208.48","TCP","66","37576 → 443 [ACK] Seq=394 Ack=39756 Win=678 Len=0 TSval=4270730402 TSecr=3626001680"
"271","0.174189975","35.186.208.48","192.168.1.118","TLSv1.2","2902","Application Data, Application Data"
"272","0.174234325","192.168.1.118","35.186.208.48","TCP","66","37572 → 443 [ACK] Seq=387 Ack=39756 Win=678 Len=0 TSval=4270730402 TSecr=3264292377"
"273","0.174263213","35.186.208.48","192.168.1.118","TLSv1.2","1484","Application Data [TCP segment of a reassembled PDU]"
"274","0.174306688","192.168.1.118","35.186.208.48","TCP","66","37570 → 443 [ACK] Seq=414 Ack=44010 Win=789 Len=0 TSval=4270730402 TSecr=2292835450"
"275","0.178238888","35.186.208.48","192.168.1.118","TLSv1.2","1484","Application Data [TCP segment of a reassembled PDU]"
"276","0.178284563","192.168.1.118","35.186.208.48","TCP","66","37570 → 443 [ACK] Seq=414 Ack=45428 Win=811 Len=0 TSval=4270730406 TSecr=2292835450"
"277","0.178315050","35.186.208.48","192.168.1.118","TLSv1.2","2902","Application Data, Application Data, Application Data"
"278","0.178345325","35.186.208.48","192.168.1.118","TLSv1.2","1484","Application Data [TCP segment of a reassembled PDU]"
"279","0.178559963","35.186.208.48","192.168.1.118","TLSv1.2","2902","Application Data, Application Data"
"280","0.178628763","35.186.208.48","192.168.1.118","TLSv1.2","1484","Application Data [TCP segment of a reassembled PDU]"
"281","0.178676113","192.168.1.118","35.186.208.48","TCP","66","37570 → 443 [ACK] Seq=414 Ack=46846 Win=834 Len=0 TSval=4270730407 TSecr=2292835452"
"282","0.178732488","35.186.208.48","192.168.1.118","TLSv1.2","1484","Application Data [TCP segment of a reassembled PDU]"
"283","0.178792963","192.168.1.118","35.186.208.48","TCP","66","37574 → 443 [ACK] Seq=385 Ack=45428 Win=789 Len=0 TSval=4270730407 TSecr=3362024634"
"284","0.178828888","35.186.208.48","192.168.1.118","TLSv1.2","2902","Application Data, Application Data"
"285","0.178873113","192.168.1.118","35.186.208.48","TCP","66","37576 → 443 [ACK] Seq=394 Ack=42592 Win=723 Len=0 TSval=4270730407 TSecr=3626001683"
"286","0.178901913","35.186.208.48","192.168.1.118","TLSv1.2","2902","Application Data, Application Data"
"287","0.178945738","192.168.1.118","35.186.208.48","TCP","66","37572 → 443 [ACK] Seq=387 Ack=42592 Win=723 Len=0 TSval=4270730407 TSecr=3264292379"
"288","0.178975750","35.186.208.48","192.168.1.118","TLSv1.2","2902","Application Data, Application Data"
"289","0.179005125","35.186.208.48","192.168.1.118","TLSv1.2","2902","Application Data, Application Data"
"290","0.179051688","192.168.1.118","35.186.208.48","TCP","66","37570 → 443 [ACK] Seq=414 Ack=49682 Win=878 Len=0 TSval=4270730407 TSecr=2292835453"
"291","0.179503063","192.168.1.118","35.186.208.48","TCP","66","37568 → 443 [ACK] Seq=256 Ack=141801 Win=2008 Len=0 TSval=4270730408 TSecr=183474542"
"292","0.180157900","35.186.208.48","192.168.1.118","TLSv1.2","1484","Application Data [TCP segment of a reassembled PDU]"
"293","0.180232075","35.186.208.48","192.168.1.118","TLSv1.2","2902","Application Data, Application Data"
"294","0.180306275","35.186.208.48","192.168.1.118","TLSv1.2","2902","Application Data, Application Data"
"295","0.180360725","192.168.1.118","35.186.208.48","TCP","66","37574 → 443 [ACK] Seq=385 Ack=49682 Win=856 Len=0 TSval=4270730409 TSecr=3362024636"
"296","0.180391913","35.186.208.48","192.168.1.118","TLSv1.2","2902","Application Data, Application Data"
"297","0.180420050","35.186.208.48","192.168.1.118","TLSv1.2","1484","Application Data [TCP segment of a reassembled PDU]"
"298","0.180460025","192.168.1.118","35.186.208.48","TCP","66","37570 → 443 [ACK] Seq=414 Ack=51100 Win=900 Len=0 TSval=4270730409 TSecr=2292835454"
"299","0.180652875","35.186.208.48","192.168.1.118","TLSv1.2","2902","Application Data, Application Data"
"300","0.180688313","35.186.208.48","192.168.1.118","TLSv1.2","1484","Application Data [TCP segment of a reassembled PDU]"
"301","0.180730238","192.168.1.118","35.186.208.48","TCP","66","37570 → 443 [ACK] Seq=414 Ack=52518 Win=922 Len=0 TSval=4270730409 TSecr=2292835454"
"302","0.180761100","35.186.208.48","192.168.1.118","TLSv1.2","2902","Application Data, Application Data"
"303","0.180821038","192.168.1.118","35.186.208.48","TCP","66","37576 → 443 [ACK] Seq=394 Ack=45428 Win=767 Len=0 TSval=4270730409 TSecr=3626001685"
"304","0.180850038","35.186.208.48","192.168.1.118","TLSv1.2","2902","Application Data, Application Data"
"305","0.180898513","192.168.1.118","35.186.208.48","TCP","66","37572 → 443 [ACK] Seq=387 Ack=45428 Win=767 Len=0 TSval=4270730409 TSecr=3264292381"
"306","0.180927100","35.186.208.48","192.168.1.118","TLSv1.2","1484","Application Data [TCP segment of a reassembled PDU]"
"307","0.181836063","192.168.1.118","35.186.208.48","TCP","66","37568 → 443 [ACK] Seq=256 Ack=151727 Win=1931 Len=0 TSval=4270730410 TSecr=183474544"
"308","0.182317388","35.186.208.48","192.168.1.118","TLSv1.2","1484","Application Data"
"309","0.182391713","35.186.208.48","192.168.1.118","TLSv1.2","4320","Application Data, Application Data, Application Data"
"310","0.182428600","35.186.208.48","192.168.1.118","TLSv1.2","2902","Application Data, Application Data"
"311","0.182459225","35.186.208.48","192.168.1.118","TLSv1.2","2902","Application Data, Application Data"
"312","0.182502125","192.168.1.118","35.186.208.48","TCP","66","37574 → 443 [ACK] Seq=385 Ack=52518 Win=900 Len=0 TSval=4270730411 TSecr=3362024639"
"313","0.182534213","35.186.208.48","192.168.1.118","TLSv1.2","2902","Application Data, Application Data"
"314","0.182579100","192.168.1.118","35.186.208.48","TCP","66","37572 → 443 [ACK] Seq=387 Ack=48264 Win=811 Len=0 TSval=4270730411 TSecr=3264292383"
"315","0.182734463","35.186.208.48","192.168.1.118","TLSv1.2","2902","Application Data, Application Data"
"316","0.182760800","35.186.208.48","192.168.1.118","TLSv1.2","2902","Application Data, Application Data"
"317","0.182811200","192.168.1.118","35.186.208.48","TCP","66","37574 → 443 [ACK] Seq=385 Ack=55354 Win=916 Len=0 TSval=4270730411 TSecr=3362024641"
"318","0.182834150","35.186.208.48","192.168.1.118","TLSv1.2","2902","Application Data, Application Data"
"319","0.182868913","192.168.1.118","35.186.208.48","TCP","66","37576 → 443 [ACK] Seq=394 Ack=49682 Win=834 Len=0 TSval=4270730411 TSecr=3626001687"
"320","0.184307213","192.168.1.118","35.186.208.48","TCP","66","37568 → 443 [ACK] Seq=256 Ack=155981 Win=1898 Len=0 TSval=4270730412 TSecr=183474547"
"321","0.184409088","192.168.1.118","35.186.208.48","TCP","66","37570 → 443 [ACK] Seq=414 Ack=58190 Win=884 Len=0 TSval=4270730413 TSecr=2292835456"
"322","0.184447988","35.186.208.48","192.168.1.118","TLSv1.2","2902","Application Data, Application Data"
"323","0.184600225","192.168.1.118","35.186.208.48","TCP","66","37570 → 443 [ACK] Seq=414 Ack=61026 Win=862 Len=0 TSval=4270730413 TSecr=2292835459"
