frame.number,_ws.col.Time,_ws.col.Source,_ws.col.Destination,_ws.col.Protocol,frame.len,_ws.col.Info
"1","0.000000000","136.147.57.129","192.168.1.118","TCP","66","443 → 35196 [ACK] Seq=1 Ack=1 Win=4926 Len=0 TSval=619890181 TSecr=4180229570"
"2","0.001358788","192.168.1.118","172.217.10.227","TCP","66","38074 → 80 [ACK] Seq=1 Ack=1 Win=502 Len=0 TSval=2809897798 TSecr=1551434268"
"3","0.019836650","172.217.10.227","192.168.1.118","TCP","54","80 → 38074 [RST] Seq=1 Win=0 Len=0"
"4","0.050715438","136.147.57.129","192.168.1.118","TCP","1414","[TCP segment of a reassembled PDU]"
"5","0.054938550","136.147.57.129","192.168.1.118","TLSv1.2","195","Application Data"
"6","0.055133600","192.168.1.118","136.147.57.129","TCP","66","35196 → 443 [ACK] Seq=1 Ack=1478 Win=63356 Len=0 TSval=4180229688 TSecr=619890228"
"7","0.055168163","136.147.57.129","192.168.1.118","TCP","7642","[TCP segment of a reassembled PDU]"
"8","0.055778500","192.168.1.118","136.147.57.129","TCP","66","35196 → 443 [ACK] Seq=1 Ack=9054 Win=55780 Len=0 TSval=4180229688 TSecr=619890230"
"9","0.058731800","136.147.57.129","192.168.1.118","TCP","531","443 → 35196 [PSH, ACK] Seq=9054 Ack=1 Win=4926 Len=465 TSval=619890230 TSecr=4180229570 [TCP segment of a reassembled PDU]"
"10","0.060572738","192.168.1.118","136.147.57.129","TCP","74","35198 → 443 [SYN] Seq=0 Win=64240 Len=0 MSS=1460 SACK_PERM=1 TSval=4180229693 TSecr=0 WS=128"
"11","0.099665875","192.168.1.118","136.147.57.129","TCP","66","35196 → 443 [ACK] Seq=1 Ack=9519 Win=63356 Len=0 TSval=4180229732 TSecr=619890230"
"12","0.121290700","136.147.57.129","192.168.1.118","TCP","1414","443 → 35196 [ACK] Seq=9519 Ack=1 Win=4926 Len=1348 TSval=619890301 TSecr=4180229688 [TCP segment of a reassembled PDU]"
"13","0.121462650","192.168.1.118","136.147.57.129","TCP","66","35196 → 443 [ACK] Seq=1 Ack=10867 Win=62008 Len=0 TSval=4180229754 TSecr=619890301"
"14","0.124936075","136.147.57.129","192.168.1.118","TCP","1097","443 → 35196 [PSH, ACK] Seq=10867 Ack=1 Win=4926 Len=1031 TSval=619890301 TSecr=4180229688 [TCP segment of a reassembled PDU]"
"15","0.125064113","192.168.1.118","136.147.57.129","TCP","66","35196 → 443 [ACK] Seq=1 Ack=11898 Win=64704 Len=0 TSval=4180229758 TSecr=619890301"
"16","0.125251425","136.147.57.129","192.168.1.118","TLSv1.2","4110","Application Data, Application Data"
"17","0.125382163","192.168.1.118","136.147.57.129","TCP","66","35196 → 443 [ACK] Seq=1 Ack=15942 Win=60660 Len=0 TSval=4180229758 TSecr=619890301"
"18","0.126450088","136.147.57.129","192.168.1.118","TCP","6268","443 → 35196 [PSH, ACK] Seq=15942 Ack=1 Win=4926 Len=6202 TSval=619890301 TSecr=4180229688 [TCP segment of a reassembled PDU]"
"19","0.126596613","192.168.1.118","136.147.57.129","TCP","66","35196 → 443 [ACK] Seq=1 Ack=22144 Win=54458 Len=0 TSval=4180229759 TSecr=619890301"
"20","0.128616725","136.147.57.129","192.168.1.118","TCP","74","443 → 35198 [SYN, ACK] Seq=0 Ack=1 Win=4380 Len=0 MSS=1360 TSval=619890308 TSecr=4180229693 SACK_PERM=1"
"21","0.128831550","192.168.1.118","136.147.57.129","TCP","66","35198 → 443 [ACK] Seq=1 Ack=1 Win=64240 Len=0 TSval=4180229761 TSecr=619890308"
"22","0.159570113","136.147.57.129","192.168.1.118","TCP","1014","443 → 35196 [PSH, ACK] Seq=22144 Ack=1 Win=4926 Len=948 TSval=619890336 TSecr=4180229732 [TCP segment of a reassembled PDU]"
"23","0.159647725","192.168.1.118","136.147.57.129","TCP","66","35196 → 443 [ACK] Seq=1 Ack=23092 Win=64704 Len=0 TSval=4180229792 TSecr=619890336"
"24","0.182424850","136.147.57.129","192.168.1.118","TLSv1.2","1003","Application Data"
"25","0.182557275","192.168.1.118","136.147.57.129","TCP","66","35196 → 443 [ACK] Seq=1 Ack=24029 Win=64704 Len=0 TSval=4180229815 TSecr=619890362"
"26","0.184136538","192.168.1.118","136.147.57.129","TLSv1","583","Client Hello"
"27","0.186026950","192.168.1.118","209.18.47.62","DNS","77","Standard query 0xc775 A c1.sfdcstatic.com"
"28","0.187029338","192.168.1.118","209.18.47.62","DNS","77","Standard query 0xbbfb A c1.sfdcstatic.com"
"29","0.187957788","192.168.1.118","209.18.47.62","DNS","77","Standard query 0x2336 A c1.sfdcstatic.com"
"30","0.188784825","192.168.1.118","209.18.47.62","DNS","77","Standard query 0xeb96 A c1.sfdcstatic.com"
"31","0.188991625","192.168.1.118","209.18.47.62","DNS","77","Standard query 0x2b08 A c1.sfdcstatic.com"
"32","0.204516600","209.18.47.62","192.168.1.118","DNS","168","Standard query response 0xc775 A c1.sfdcstatic.com CNAME c.sfdcstatic.com.edgekey.net CNAME e4745.b.akamaiedge.net A 104.102.83.39"
"33","0.204743000","192.168.1.118","209.18.47.62","DNS","77","Standard query 0x1707 AAAA c1.sfdcstatic.com"
"34","0.210422675","209.18.47.62","192.168.1.118","DNS","168","Standard query response 0x2b08 A c1.sfdcstatic.com CNAME c.sfdcstatic.com.edgekey.net CNAME e4745.b.akamaiedge.net A 104.102.83.39"
"35","0.210760138","192.168.1.118","209.18.47.62","DNS","77","Standard query 0x4f20 AAAA c1.sfdcstatic.com"
"36","0.213998225","209.18.47.62","192.168.1.118","DNS","168","Standard query response 0x2336 A c1.sfdcstatic.com CNAME c.sfdcstatic.com.edgekey.net CNAME e4745.b.akamaiedge.net A 104.102.83.39"
"37","0.214129225","209.18.47.62","192.168.1.118","DNS","168","Standard query response 0xeb96 A c1.sfdcstatic.com CNAME c.sfdcstatic.com.edgekey.net CNAME e4745.b.akamaiedge.net A 104.102.83.39"
"38","0.214201838","209.18.47.62","192.168.1.118","DNS","168","Standard query response 0xbbfb A c1.sfdcstatic.com CNAME c.sfdcstatic.com.edgekey.net CNAME e4745.b.akamaiedge.net A 104.102.83.39"
"39","0.214343025","192.168.1.118","209.18.47.62","DNS","77","Standard query 0x2b32 AAAA c1.sfdcstatic.com"
"40","0.214538938","192.168.1.118","209.18.47.62","DNS","77","Standard query 0x4306 AAAA c1.sfdcstatic.com"
"41","0.214736500","192.168.1.118","209.18.47.62","DNS","77","Standard query 0x5f7a AAAA c1.sfdcstatic.com"
"42","0.220355513","209.18.47.62","192.168.1.118","DNS","210","Standard query response 0x1707 AAAA c1.sfdcstatic.com CNAME c.sfdcstatic.com.edgekey.net CNAME e4745.b.akamaiedge.net SOA n0b.akamaiedge.net"
"43","0.221589038","192.168.1.118","104.102.83.39","TCP","74","33148 → 443 [SYN] Seq=0 Win=64240 Len=0 MSS=1460 SACK_PERM=1 TSval=2051430930 TSecr=0 WS=128"
"44","0.221704625","192.168.1.118","104.102.83.39","TCP","74","33150 → 443 [SYN] Seq=0 Win=64240 Len=0 MSS=1460 SACK_PERM=1 TSval=2051430930 TSecr=0 WS=128"
"45","0.221779988","192.168.1.118","104.102.83.39","TCP","74","33152 → 443 [SYN] Seq=0 Win=64240 Len=0 MSS=1460 SACK_PERM=1 TSval=2051430930 TSecr=0 WS=128"
"46","0.221859838","192.168.1.118","104.102.83.39","TCP","74","33154 → 443 [SYN] Seq=0 Win=64240 Len=0 MSS=1460 SACK_PERM=1 TSval=2051430931 TSecr=0 WS=128"
"47","0.221936375","192.168.1.118","104.102.83.39","TCP","74","33156 → 443 [SYN] Seq=0 Win=64240 Len=0 MSS=1460 SACK_PERM=1 TSval=2051430931 TSecr=0 WS=128"
"48","0.228452163","209.18.47.62","192.168.1.118","DNS","210","Standard query response 0x5f7a AAAA c1.sfdcstatic.com CNAME c.sfdcstatic.com.edgekey.net CNAME e4745.b.akamaiedge.net SOA n0b.akamaiedge.net"
"49","0.229345513","209.18.47.62","192.168.1.118","DNS","210","Standard query response 0x2b32 AAAA c1.sfdcstatic.com CNAME c.sfdcstatic.com.edgekey.net CNAME e4745.b.akamaiedge.net SOA n0b.akamaiedge.net"
"50","0.229374288","209.18.47.62","192.168.1.118","DNS","210","Standard query response 0x4f20 AAAA c1.sfdcstatic.com CNAME c.sfdcstatic.com.edgekey.net CNAME e4745.b.akamaiedge.net SOA n0b.akamaiedge.net"
"51","0.229401013","209.18.47.62","192.168.1.118","DNS","210","Standard query response 0x4306 AAAA c1.sfdcstatic.com CNAME c.sfdcstatic.com.edgekey.net CNAME e4745.b.akamaiedge.net SOA n0b.akamaiedge.net"
"52","0.234887513","104.102.83.39","192.168.1.118","TCP","74","443 → 33148 [SYN, ACK] Seq=0 Ack=1 Win=28960 Len=0 MSS=1460 SACK_PERM=1 TSval=176593747 TSecr=2051430930 WS=128"
"53","0.235001200","192.168.1.118","104.102.83.39","TCP","66","33148 → 443 [ACK] Seq=1 Ack=1 Win=64256 Len=0 TSval=2051430944 TSecr=176593747"
"54","0.242074813","104.102.83.39","192.168.1.118","TCP","74","443 → 33154 [SYN, ACK] Seq=0 Ack=1 Win=28960 Len=0 MSS=1460 SACK_PERM=1 TSval=176593754 TSecr=2051430931 WS=128"
"55","0.242143738","192.168.1.118","104.102.83.39","TCP","66","33154 → 443 [ACK] Seq=1 Ack=1 Win=64256 Len=0 TSval=2051430951 TSecr=176593754"
"56","0.243510200","104.102.83.39","192.168.1.118","TCP","74","443 → 33156 [SYN, ACK] Seq=0 Ack=1 Win=28960 Len=0 MSS=1460 SACK_PERM=1 TSval=176593754 TSecr=2051430931 WS=128"
"57","0.243625888","192.168.1.118","104.102.83.39","TCP","66","33156 → 443 [ACK] Seq=1 Ack=1 Win=64256 Len=0 TSval=2051430952 TSecr=176593754"
"58","0.244913138","104.102.83.39","192.168.1.118","TCP","74","443 → 33150 [SYN, ACK] Seq=0 Ack=1 Win=28960 Len=0 MSS=1460 SACK_PERM=1 TSval=176593754 TSecr=2051430930 WS=128"
"59","0.245019150","192.168.1.118","104.102.83.39","TCP","66","33150 → 443 [ACK] Seq=1 Ack=1 Win=64256 Len=0 TSval=2051430954 TSecr=176593754"
"60","0.245072675","104.102.83.39","192.168.1.118","TCP","74","443 → 33152 [SYN, ACK] Seq=0 Ack=1 Win=28960 Len=0 MSS=1460 SACK_PERM=1 TSval=176593754 TSecr=2051430930 WS=128"
"61","0.245123225","192.168.1.118","104.102.83.39","TCP","66","33152 → 443 [ACK] Seq=1 Ack=1 Win=64256 Len=0 TSval=2051430954 TSecr=176593754"
"62","0.248730613","136.147.57.129","192.168.1.118","TCP","66","443 → 35198 [ACK] Seq=1 Ack=518 Win=4597 Len=0 TSval=619890428 TSecr=4180229817"
"63","0.251974788","192.168.1.118","104.102.83.39","TLSv1","583","Client Hello"
"64","0.256159938","136.147.57.129","192.168.1.118","TLSv1.2","1414","Server Hello"
"65","0.256203550","192.168.1.118","136.147.57.129","TCP","66","35198 → 443 [ACK] Seq=518 Ack=1349 Win=62892 Len=0 TSval=4180229889 TSecr=619890431"
"66","0.261162325","136.147.57.129","192.168.1.118","TCP","2762","443 → 35198 [PSH, ACK] Seq=1349 Ack=518 Win=4597 Len=2696 TSval=619890431 TSecr=4180229817 [TCP segment of a reassembled PDU]"
"67","0.261215650","192.168.1.118","136.147.57.129","TCP","66","35198 → 443 [ACK] Seq=518 Ack=4045 Win=60196 Len=0 TSval=4180229894 TSecr=619890431"
"68","0.268446013","192.168.1.118","104.102.83.39","TLSv1","583","Client Hello"
"69","0.272568863","104.102.83.39","192.168.1.118","TCP","66","443 → 33148 [ACK] Seq=1 Ack=518 Win=30080 Len=0 TSval=176593785 TSecr=2051430961"
"70","0.274376700","104.102.83.39","192.168.1.118","TLSv1.2","1514","Server Hello"
"71","0.274430600","192.168.1.118","104.102.83.39","TCP","66","33148 → 443 [ACK] Seq=518 Ack=1449 Win=63104 Len=0 TSval=2051430983 TSecr=176593786"
"72","0.275806800","104.102.83.39","192.168.1.118","TLSv1.2","1891","Certificate, Server Key Exchange, Server Hello Done"
"73","0.275862863","192.168.1.118","104.102.83.39","TCP","66","33148 → 443 [ACK] Seq=518 Ack=3274 Win=61312 Len=0 TSval=2051430985 TSecr=176593786"
"74","0.284933413","192.168.1.118","104.102.83.39","TLSv1","583","Client Hello"
"75","0.287136625","104.102.83.39","192.168.1.118","TCP","66","443 → 33150 [ACK] Seq=1 Ack=518 Win=30080 Len=0 TSval=176593797 TSecr=2051430977"
"76","0.288706963","104.102.83.39","192.168.1.118","TLSv1.2","3339","Server Hello, Certificate, Server Key Exchange, Server Hello Done"
"77","0.288777838","192.168.1.118","104.102.83.39","TCP","66","33150 → 443 [ACK] Seq=518 Ack=3274 Win=61056 Len=0 TSval=2051430997 TSecr=176593799"
"78","0.301430375","192.168.1.118","104.102.83.39","TLSv1","583","Client Hello"
"79","0.305055038","104.102.83.39","192.168.1.118","TCP","66","443 → 33152 [ACK] Seq=1 Ack=518 Win=30080 Len=0 TSval=176593815 TSecr=2051430994"
"80","0.306503275","104.102.83.39","192.168.1.118","TLSv1.2","3339","Server Hello, Certificate, Server Key Exchange, Server Hello Done"
"81","0.306585613","192.168.1.118","104.102.83.39","TCP","66","33152 → 443 [ACK] Seq=518 Ack=3274 Win=61056 Len=0 TSval=2051431015 TSecr=176593816"
"82","0.315099675","136.147.57.129","192.168.1.118","TLSv1.2","1108","Certificate, Server Key Exchange, Server Hello Done"
"83","0.315188413","192.168.1.118","136.147.57.129","TCP","66","35198 → 443 [ACK] Seq=518 Ack=5087 Win=59154 Len=0 TSval=4180229948 TSecr=619890495"
"84","0.317971238","192.168.1.118","104.102.83.39","TLSv1","583","Client Hello"
"85","0.319402663","104.102.83.39","192.168.1.118","TCP","66","443 → 33154 [ACK] Seq=1 Ack=518 Win=30080 Len=0 TSval=176593831 TSecr=2051431010"
"86","0.320104813","192.168.1.118","136.147.57.129","TLSv1.2","192","Client Key Exchange, Change Cipher Spec, Encrypted Handshake Message"
"87","0.322043613","192.168.1.118","104.102.83.39","TLSv1.2","192","Client Key Exchange, Change Cipher Spec, Encrypted Handshake Message"
"88","0.323914050","192.168.1.118","104.102.83.39","TLSv1.2","192","Client Key Exchange, Change Cipher Spec, Encrypted Handshake Message"
"89","0.325844875","192.168.1.118","104.102.83.39","TLSv1.2","192","Client Key Exchange, Change Cipher Spec, Encrypted Handshake Message"
"90","0.328123800","104.102.83.39","192.168.1.118","TLSv1.2","1514","Server Hello"
"91","0.328204175","192.168.1.118","104.102.83.39","TCP","66","33154 → 443 [ACK] Seq=518 Ack=1449 Win=63104 Len=0 TSval=2051431037 TSecr=176593840"
"92","0.329336988","104.102.83.39","192.168.1.118","TLSv1.2","1891","Certificate, Server Key Exchange, Server Hello Done"
"93","0.329422088","192.168.1.118","104.102.83.39","TCP","66","33154 → 443 [ACK] Seq=518 Ack=3274 Win=61312 Len=0 TSval=2051431038 TSecr=176593840"
"94","0.333932500","192.168.1.118","104.102.83.39","TLSv1.2","192","Client Key Exchange, Change Cipher Spec, Encrypted Handshake Message"
"95","0.337723700","104.102.83.39","192.168.1.118","TCP","66","443 → 33156 [ACK] Seq=1 Ack=518 Win=30080 Len=0 TSval=176593850 TSecr=2051431027"
"96","0.338702663","104.102.83.39","192.168.1.118","TLSv1.2","117","Change Cipher Spec, Encrypted Handshake Message"
"97","0.338792675","192.168.1.118","104.102.83.39","TCP","66","33148 → 443 [ACK] Seq=644 Ack=3325 Win=64128 Len=0 TSval=2051431047 TSecr=176593851"
"98","0.339993850","192.168.1.118","104.102.83.39","TLSv1.2","336","Application Data"
"99","0.340155688","104.102.83.39","192.168.1.118","TLSv1.2","1514","Server Hello"
"100","0.340249963","192.168.1.118","104.102.83.39","TCP","66","33156 → 443 [ACK] Seq=518 Ack=1449 Win=63104 Len=0 TSval=2051431049 TSecr=176593851"
"101","0.341412838","104.102.83.39","192.168.1.118","TLSv1.2","1891","Certificate, Server Key Exchange, Server Hello Done"
"102","0.341499963","192.168.1.118","104.102.83.39","TCP","66","33156 → 443 [ACK] Seq=518 Ack=3274 Win=61312 Len=0 TSval=2051431050 TSecr=176593851"
"103","0.343841775","192.168.1.118","104.102.83.39","TLSv1.2","192","Client Key Exchange, Change Cipher Spec, Encrypted Handshake Message"
"104","0.343910863","104.102.83.39","192.168.1.118","TLSv1.2","117","Change Cipher Spec, Encrypted Handshake Message"
"105","0.345372588","192.168.1.118","104.102.83.39","TLSv1.2","320","Application Data"
"106","0.345395013","104.102.83.39","192.168.1.118","TLSv1.2","117","Change Cipher Spec, Encrypted Handshake Message"
"107","0.345668625","192.168.1.118","104.102.83.39","TLSv1.2","309","Application Data"
"108","0.351097463","104.102.83.39","192.168.1.118","TLSv1.2","117","Change Cipher Spec, Encrypted Handshake Message"
"109","0.351583363","192.168.1.118","104.102.83.39","TLSv1.2","296","Application Data"
"110","0.370962863","104.102.83.39","192.168.1.118","TCP","1514","[TCP segment of a reassembled PDU]"
"111","0.372635038","104.102.83.39","192.168.1.118","TLSv1.2","1243","Application Data"
"112","0.372675163","104.102.83.39","192.168.1.118","TLSv1.2","117","Change Cipher Spec, Encrypted Handshake Message"
"113","0.372724638","104.102.83.39","192.168.1.118","TCP","1514","[TCP segment of a reassembled PDU]"
"114","0.372833050","104.102.83.39","192.168.1.118","TLSv1.2","2188","Application Data"
"115","0.372880625","104.102.83.39","192.168.1.118","TCP","1514","[TCP segment of a reassembled PDU]"
"116","0.373035175","192.168.1.118","104.102.83.39","TCP","66","33148 → 443 [ACK] Seq=914 Ack=5950 Win=64128 Len=0 TSval=2051431082 TSecr=176593880"
"117","0.373653950","192.168.1.118","104.102.83.39","TCP","66","33154 → 443 [ACK] Seq=874 Ack=6895 Win=60672 Len=0 TSval=2051431082 TSecr=176593882"
"118","0.374203025","192.168.1.118","104.102.83.39","TLSv1.2","305","Application Data"
"119","0.374590500","104.102.83.39","192.168.1.118","TCP","13098","443 → 33152 [ACK] Seq=4773 Ack=887 Win=31104 Len=13032 TSval=176593883 TSecr=2051431054 [TCP segment of a reassembled PDU]"
"120","0.374875950","192.168.1.118","104.102.83.39","TCP","66","33152 → 443 [ACK] Seq=887 Ack=17805 Win=64128 Len=0 TSval=2051431084 TSecr=176593883"
"121","0.374906950","104.102.83.39","192.168.1.118","TLSv1.2","7306","Application Data [TCP segment of a reassembled PDU]"
"122","0.375681913","192.168.1.118","104.102.83.39","TCP","66","33152 → 443 [ACK] Seq=887 Ack=25045 Win=56960 Len=0 TSval=2051431084 TSecr=176593883"
"123","0.376785100","192.168.1.118","104.102.83.39","TLSv1.2","307","Application Data"
"124","0.376897450","192.168.1.118","104.102.83.39","TLSv1.2","305","Application Data"
"125","0.378922100","104.102.83.39","192.168.1.118","TCP","1514","443 → 33152 [ACK] Seq=25045 Ack=887 Win=31104 Len=1448 TSval=176593883 TSecr=2051431054 [TCP segment of a reassembled PDU]"
"126","0.379962563","136.147.57.129","192.168.1.118","TCP","66","443 → 35198 [ACK] Seq=5087 Ack=644 Win=4723 Len=0 TSval=619890561 TSecr=4180229953"
"127","0.381771575","136.147.57.129","192.168.1.118","TLSv1.2","72","Change Cipher Spec"
"128","0.382608825","136.147.57.129","192.168.1.118","TLSv1.2","111","Encrypted Handshake Message"
"129","0.389037913","104.102.83.39","192.168.1.118","TCP","1514","[TCP segment of a reassembled PDU]"
"130","0.390496100","104.102.83.39","192.168.1.118","TLSv1.2","7097","Application Data"
"131","0.406832063","192.168.1.118","136.147.57.129","TCP","66","35198 → 443 [ACK] Seq=644 Ack=5138 Win=63356 Len=0 TSval=4180230039 TSecr=619890561"
"132","0.407065888","104.102.83.39","192.168.1.118","TCP","1514","[TCP segment of a reassembled PDU]"
"133","0.407175463","192.168.1.118","136.147.57.129","TLSv1.2","307","Application Data"
"134","0.407236550","192.168.1.118","104.102.83.39","TCP","66","33150 → 443 [ACK] Seq=898 Ack=11804 Win=55680 Len=0 TSval=2051431116 TSecr=176593900"
"135","0.409130588","192.168.1.118","209.18.47.62","DNS","80","Standard query 0x3b55 A fonts.googleapis.com"
"136","0.409438413","104.102.83.39","192.168.1.118","TCP","4410","443 → 33156 [ACK] Seq=4773 Ack=883 Win=31104 Len=4344 TSval=176593917 TSecr=2051431083 [TCP segment of a reassembled PDU]"
"137","0.409507213","104.102.83.39","192.168.1.118","TLSv1.2","357","Application Data"
"138","0.417052588","104.102.83.39","192.168.1.118","TCP","1514","443 → 33152 [ACK] Seq=26493 Ack=887 Win=31104 Len=1448 TSval=176593925 TSecr=2051431084 [TCP segment of a reassembled PDU]"
"139","0.417137625","192.168.1.118","104.102.83.39","TCP","66","33152 → 443 [ACK] Seq=887 Ack=27941 Win=67072 Len=0 TSval=2051431126 TSecr=176593883"
"140","0.421457988","104.102.83.39","192.168.1.118","TCP","5858","443 → 33152 [ACK] Seq=27941 Ack=887 Win=31104 Len=5792 TSval=176593925 TSecr=2051431084 [TCP segment of a reassembled PDU]"
"141","0.421534488","192.168.1.118","104.102.83.39","TCP","66","33152 → 443 [ACK] Seq=887 Ack=33733 Win=78592 Len=0 TSval=2051431130 TSecr=176593925"
"142","0.421723113","104.102.83.39","192.168.1.118","TLSv1.2","4410","Application Data, Application Data"
"143","0.421796313","192.168.1.118","104.102.83.39","TCP","66","33152 → 443 [ACK] Seq=887 Ack=38077 Win=87296 Len=0 TSval=2051431130 TSecr=176593925"
"144","0.421984213","104.102.83.39","192.168.1.118","TCP","11650","443 → 33152 [ACK] Seq=38077 Ack=887 Win=31104 Len=11584 TSval=176593926 TSecr=2051431084 [TCP segment of a reassembled PDU]"
"145","0.422060363","192.168.1.118","104.102.83.39","TCP","66","33152 → 443 [ACK] Seq=887 Ack=49661 Win=110464 Len=0 TSval=2051431131 TSecr=176593926"
"146","0.425077738","104.102.83.39","192.168.1.118","TCP","2962","443 → 33152 [ACK] Seq=49661 Ack=887 Win=31104 Len=2896 TSval=176593926 TSecr=2051431084 [TCP segment of a reassembled PDU]"
"147","0.425143975","192.168.1.118","104.102.83.39","TCP","66","33152 → 443 [ACK] Seq=887 Ack=52557 Win=116224 Len=0 TSval=2051431134 TSecr=176593926"
"148","0.425229263","104.102.83.39","192.168.1.118","TLSv1.2","2962","Application Data [TCP segment of a reassembled PDU]"
"149","0.425284163","104.102.83.39","192.168.1.118","TCP","1514","443 → 33152 [ACK] Seq=55453 Ack=887 Win=31104 Len=1448 TSval=176593930 TSecr=2051431084 [TCP segment of a reassembled PDU]"
"150","0.425657563","192.168.1.118","104.102.83.39","TCP","66","33152 → 443 [ACK] Seq=887 Ack=56901 Win=112000 Len=0 TSval=2051431134 TSecr=176593928"
"151","0.427393538","192.168.1.118","104.102.83.39","TCP","66","33156 → 443 [ACK] Seq=883 Ack=9408 Win=64128 Len=0 TSval=2051431136 TSecr=176593917"
"152","0.427730038","192.168.1.118","104.102.83.39","TLSv1.2","293","Application Data"
"153","0.428010050","104.102.83.39","192.168.1.118","TCP","1514","443 → 33152 [ACK] Seq=56901 Ack=887 Win=31104 Len=1448 TSval=176593930 TSecr=2051431084 [TCP segment of a reassembled PDU]"
"154","0.428122825","104.102.83.39","192.168.1.118","TLSv1.2","2533","Application Data"
"155","0.428183238","104.102.83.39","192.168.1.118","TCP","2962","443 → 33152 [ACK] Seq=58349 Ack=887 Win=31104 Len=2896 TSval=176593932 TSecr=2051431084 [TCP segment of a reassembled PDU]"
"156","0.428426575","192.168.1.118","104.102.83.39","TCP","66","33154 → 443 [ACK] Seq=1113 Ack=9362 Win=61696 Len=0 TSval=2051431137 TSecr=176593936"
"157","0.429948888","192.168.1.118","104.102.83.39","TCP","66","33152 → 443 [ACK] Seq=887 Ack=61245 Win=107776 Len=0 TSval=2051431139 TSecr=176593930"
"158","0.431211338","192.168.1.118","104.102.83.39","TLSv1.2","317","Application Data"
"159","0.431345613","192.168.1.118","104.102.83.39","TLSv1.2","340","Application Data"
"160","0.432204188","209.18.47.62","192.168.1.118","DNS","96","Standard query response 0x3b55 A fonts.googleapis.com A 172.217.12.170"
"161","0.432317463","104.102.83.39","192.168.1.118","TCP","2962","443 → 33152 [ACK] Seq=61245 Ack=887 Win=31104 Len=2896 TSval=176593934 TSecr=2051431084 [TCP segment of a reassembled PDU]"
"162","0.432378400","192.168.1.118","104.102.83.39","TCP","66","33152 → 443 [ACK] Seq=887 Ack=64141 Win=122112 Len=0 TSval=2051431141 TSecr=176593934"
"163","0.432448300","104.102.83.39","192.168.1.118","TLSv1.2","2962","Application Data [TCP segment of a reassembled PDU]"
"164","0.432506013","192.168.1.118","104.102.83.39","TCP","66","33152 → 443 [ACK] Seq=887 Ack=67037 Win=127872 Len=0 TSval=2051431141 TSecr=176593936"
"165","0.432706150","192.168.1.118","209.18.47.62","DNS","80","Standard query 0xebca AAAA fonts.googleapis.com"
"166","0.434380675","104.102.83.39","192.168.1.118","TCP","2962","443 → 33152 [ACK] Seq=67037 Ack=887 Win=31104 Len=2896 TSval=176593938 TSecr=2051431084 [TCP segment of a reassembled PDU]"
"167","0.434442075","192.168.1.118","104.102.83.39","TCP","66","33152 → 443 [ACK] Seq=887 Ack=69933 Win=133632 Len=0 TSval=2051431143 TSecr=176593938"
"168","0.435771138","104.102.83.39","192.168.1.118","TCP","1514","443 → 33152 [ACK] Seq=69933 Ack=887 Win=31104 Len=1448 TSval=176593947 TSecr=2051431126 [TCP segment of a reassembled PDU]"
"169","0.436874363","104.102.83.39","192.168.1.118","TCP","1514","443 → 33152 [ACK] Seq=71381 Ack=887 Win=31104 Len=1448 TSval=176593947 TSecr=2051431126 [TCP segment of a reassembled PDU]"
"170","0.436930613","192.168.1.118","104.102.83.39","TCP","66","33152 → 443 [ACK] Seq=887 Ack=72829 Win=137472 Len=0 TSval=2051431146 TSecr=176593947"
"171","0.438379750","104.102.83.39","192.168.1.118","TLSv1.2","671","Application Data"
"172","0.438455925","104.102.83.39","192.168.1.118","TCP","1514","443 → 33152 [ACK] Seq=72829 Ack=887 Win=31104 Len=1448 TSval=176593947 TSecr=2051431134 [TCP segment of a reassembled PDU]"
"173","0.439876638","104.102.83.39","192.168.1.118","TCP","1514","443 → 33152 [ACK] Seq=74277 Ack=887 Win=31104 Len=1448 TSval=176593947 TSecr=2051431134 [TCP segment of a reassembled PDU]"
"174","0.441577313","104.102.83.39","192.168.1.118","TCP","2962","443 → 33152 [PSH, ACK] Seq=75725 Ack=887 Win=31104 Len=2896 TSval=176593947 TSecr=2051431134 [TCP segment of a reassembled PDU]"
"175","0.441634775","104.102.83.39","192.168.1.118","TCP","1514","443 → 33152 [ACK] Seq=78621 Ack=887 Win=31104 Len=1448 TSval=176593948 TSecr=2051431134 [TCP segment of a reassembled PDU]"
"176","0.442731213","104.102.83.39","192.168.1.118","TCP","1514","443 → 33152 [ACK] Seq=80069 Ack=887 Win=31104 Len=1448 TSval=176593948 TSecr=2051431134 [TCP segment of a reassembled PDU]"
"177","0.442812913","104.102.83.39","192.168.1.118","TLSv1.2","2962","Application Data [TCP segment of a reassembled PDU]"
"178","0.442854338","104.102.83.39","192.168.1.118","TCP","1514","443 → 33152 [ACK] Seq=84413 Ack=887 Win=31104 Len=1448 TSval=176593951 TSecr=2051431134 [TCP segment of a reassembled PDU]"
"179","0.444545025","104.102.83.39","192.168.1.118","TCP","1514","443 → 33152 [ACK] Seq=85861 Ack=887 Win=31104 Len=1448 TSval=176593951 TSecr=2051431134 [TCP segment of a reassembled PDU]"
"180","0.445870463","104.102.83.39","192.168.1.118","TCP","2962","443 → 33152 [ACK] Seq=87309 Ack=887 Win=31104 Len=2896 TSval=176593952 TSecr=2051431134 [TCP segment of a reassembled PDU]"
"181","0.445920988","104.102.83.39","192.168.1.118","TCP","1514","443 → 33152 [ACK] Seq=90205 Ack=887 Win=31104 Len=1448 TSval=176593954 TSecr=2051431134 [TCP segment of a reassembled PDU]"
"182","0.446786163","104.102.83.39","192.168.1.118","TCP","1514","443 → 33152 [ACK] Seq=91653 Ack=887 Win=31104 Len=1448 TSval=176593954 TSecr=2051431134 [TCP segment of a reassembled PDU]"
"183","0.448990013","104.102.83.39","192.168.1.118","TCP","2962","443 → 33152 [ACK] Seq=93101 Ack=887 Win=31104 Len=2896 TSval=176593955 TSecr=2051431134 [TCP segment of a reassembled PDU]"
"184","0.449070250","104.102.83.39","192.168.1.118","TCP","2962","443 → 33152 [ACK] Seq=95997 Ack=887 Win=31104 Len=2896 TSval=176593956 TSecr=2051431134 [TCP segment of a reassembled PDU]"
"185","0.450415413","104.102.83.39","192.168.1.118","TLSv1.2","2962","Application Data [TCP segment of a reassembled PDU]"
"186","0.450465488","104.102.83.39","192.168.1.118","TCP","1514","[TCP segment of a reassembled PDU]"
"187","0.451387050","104.102.83.39","192.168.1.118","TLSv1.2","3180","Application Data"
"188","0.459288213","104.102.83.39","192.168.1.118","TCP","2962","443 → 33152 [ACK] Seq=101789 Ack=887 Win=31104 Len=2896 TSval=176593959 TSecr=2051431134 [TCP segment of a reassembled PDU]"
"189","0.459419100","104.102.83.39","192.168.1.118","TLSv1.2","2962","Application Data [TCP segment of a reassembled PDU]"
"190","0.461449513","209.18.47.62","192.168.1.118","DNS","108","Standard query response 0xebca AAAA fonts.googleapis.com AAAA 2607:f8b0:4006:81a::200a"
"191","0.461542338","104.102.83.39","192.168.1.118","TCP","2962","443 → 33152 [ACK] Seq=107581 Ack=887 Win=31104 Len=2896 TSval=176593962 TSecr=2051431134 [TCP segment of a reassembled PDU]"
"192","0.461650263","104.102.83.39","192.168.1.118","TCP","2962","443 → 33152 [ACK] Seq=110477 Ack=887 Win=31104 Len=2896 TSval=176593963 TSecr=2051431134 [TCP segment of a reassembled PDU]"
"193","0.461738838","104.102.83.39","192.168.1.118","TCP","2962","443 → 33152 [ACK] Seq=113373 Ack=887 Win=31104 Len=2896 TSval=176593965 TSecr=2051431134 [TCP segment of a reassembled PDU]"
"194","0.461936363","104.102.83.39","192.168.1.118","TCP","2962","443 → 33152 [ACK] Seq=116269 Ack=887 Win=31104 Len=2896 TSval=176593966 TSecr=2051431134 [TCP segment of a reassembled PDU]"
"195","0.462126550","104.102.83.39","192.168.1.118","TLSv1.2","8754","Application Data [TCP segment of a reassembled PDU]"
"196","0.462200938","104.102.83.39","192.168.1.118","TCP","1514","443 → 33152 [ACK] Seq=127853 Ack=887 Win=31104 Len=1448 TSval=176593968 TSecr=2051431146 [TCP segment of a reassembled PDU]"
"197","0.470828588","104.102.83.39","192.168.1.118","TLSv1.2","2962","Application Data [TCP segment of a reassembled PDU]"
"198","0.470890900","192.168.1.118","104.102.83.39","TCP","66","33152 → 443 [ACK] Seq=887 Ack=132197 Win=78208 Len=0 TSval=2051431180 TSecr=176593947"
"199","0.470961588","104.102.83.39","192.168.1.118","TCP","1514","443 → 33152 [ACK] Seq=132197 Ack=887 Win=31104 Len=1448 TSval=176593968 TSecr=2051431146 [TCP segment of a reassembled PDU]"
"200","0.471051463","104.102.83.39","192.168.1.118","TLSv1.2","20338","Application Data"
"201","0.471087925","104.102.83.39","192.168.1.118","TCP","8754","443 → 33152 [ACK] Seq=133645 Ack=887 Win=31104 Len=8688 TSval=176593969 TSecr=2051431146 [TCP segment of a reassembled PDU]"
"202","0.471113500","104.102.83.39","192.168.1.118","TLSv1.2","7306","Application Data [TCP segment of a reassembled PDU]"
"203","0.471125013","104.102.83.39","192.168.1.118","TCP","5858","443 → 33152 [ACK] Seq=142333 Ack=887 Win=31104 Len=5792 TSval=176593970 TSecr=2051431146 [TCP segment of a reassembled PDU]"
"204","0.473315525","104.102.83.39","192.168.1.118","TLSv1.2","871","Application Data"
"205","0.473336175","136.147.57.129","192.168.1.118","TCP","66","443 → 35198 [ACK] Seq=5138 Ack=885 Win=4964 Len=0 TSval=619890652 TSecr=4180230040"
"206","0.480319738","192.168.1.118","104.102.83.39","TCP","66","33148 → 443 [ACK] Seq=1155 Ack=6555 Win=63616 Len=0 TSval=2051431189 TSecr=176593947"
"207","0.487681775","104.102.83.39","192.168.1.118","TLSv1.2","1514","Application Data [TCP segment of a reassembled PDU]"
"208","0.488457350","104.102.83.39","192.168.1.118","TLSv1.2","691","Application Data"
"209","0.491319513","192.168.1.118","104.102.83.39","TCP","66","33150 → 443 [ACK] Seq=1125 Ack=16366 Win=59648 Len=0 TSval=2051431200 TSecr=176593961"
"210","0.511379300","192.168.1.118","104.102.83.39","TCP","66","33154 → 443 [ACK] Seq=1364 Ack=36874 Win=36736 Len=0 TSval=2051431220 TSecr=176593971"
"211","0.511469413","192.168.1.118","104.102.83.39","TCP","66","33152 → 443 [ACK] Seq=887 Ack=150198 Win=60288 Len=0 TSval=2051431220 TSecr=176593968"
"212","0.514344950","192.168.1.118","104.102.83.39","TCP","66","33156 → 443 [ACK] Seq=1157 Ack=10213 Win=63360 Len=0 TSval=2051431223 TSecr=176593977"
"213","0.515670575","192.168.1.118","104.102.83.39","TCP","66","[TCP Window Update] 33152 → 443 [ACK] Seq=887 Ack=150198 Win=128384 Len=0 TSval=2051431224 TSecr=176593968"
"214","0.516779563","192.168.1.118","172.217.12.170","TCP","74","44582 → 443 [SYN] Seq=0 Win=64240 Len=0 MSS=1460 SACK_PERM=1 TSval=3438174686 TSecr=0 WS=128"
"215","0.527543513","104.102.83.39","192.168.1.118","TLSv1.2","1049","Application Data"
"216","0.543930325","172.217.12.170","192.168.1.118","TCP","74","443 → 44582 [SYN, ACK] Seq=0 Ack=1 Win=60192 Len=0 MSS=1380 SACK_PERM=1 TSval=2687497401 TSecr=3438174686 WS=256"
"217","0.544079225","192.168.1.118","172.217.12.170","TCP","66","44582 → 443 [ACK] Seq=1 Ack=1 Win=64256 Len=0 TSval=3438174714 TSecr=2687497401"
"218","0.568366550","192.168.1.118","104.102.83.39","TCP","66","33154 → 443 [ACK] Seq=1364 Ack=37857 Win=52864 Len=0 TSval=2051431277 TSecr=176594039"
"219","0.594737425","192.168.1.118","172.217.12.170","TLSv1","583","Client Hello"
"220","0.612599888","172.217.12.170","192.168.1.118","TCP","66","443 → 44582 [ACK] Seq=1 Ack=518 Win=61440 Len=0 TSval=2687497469 TSecr=3438174764"
"221","0.620143200","172.217.12.170","192.168.1.118","TLSv1.2","1484","Server Hello"
"222","0.620273400","192.168.1.118","172.217.12.170","TCP","66","44582 → 443 [ACK] Seq=518 Ack=1419 Win=63104 Len=0 TSval=3438174790 TSecr=2687497476"
"223","0.621116488","172.217.12.170","192.168.1.118","TLSv1.2","1541","Certificate, Server Key Exchange, Server Hello Done"
"224","0.621246050","192.168.1.118","172.217.12.170","TCP","66","44582 → 443 [ACK] Seq=518 Ack=2894 Win=61696 Len=0 TSval=3438174791 TSecr=2687497476"
"225","0.651162563","192.168.1.118","172.217.12.170","TLSv1.2","192","Client Key Exchange, Change Cipher Spec, Encrypted Handshake Message"
"226","0.674614538","172.217.12.170","192.168.1.118","TLSv1.2","117","Change Cipher Spec, Encrypted Handshake Message"
"227","0.715594475","192.168.1.118","172.217.12.170","TCP","66","44582 → 443 [ACK] Seq=644 Ack=2945 Win=64128 Len=0 TSval=3438174885 TSecr=2687497531"
"228","0.731413813","136.147.57.129","192.168.1.118","TLSv1.2","1313","Application Data"
"229","0.742507363","192.168.1.118","172.217.12.170","TLSv1.2","338","Application Data"
"230","0.772356525","192.168.1.118","136.147.57.129","TCP","66","35198 → 443 [ACK] Seq=885 Ack=6385 Win=63356 Len=0 TSval=4180230405 TSecr=619890911"
"231","0.788544150","172.217.12.170","192.168.1.118","TCP","66","443 → 44582 [ACK] Seq=2945 Ack=916 Win=62464 Len=0 TSval=2687497646 TSecr=3438174912"
"232","0.799986400","172.217.12.170","192.168.1.118","TLSv1.2","1006","Application Data"
"233","0.800096125","192.168.1.118","172.217.12.170","TCP","66","44582 → 443 [ACK] Seq=916 Ack=3885 Win=63232 Len=0 TSval=3438174970 TSecr=2687497657"
"234","0.801416175","172.217.12.170","192.168.1.118","TLSv1.2","115","Application Data"
"235","0.801512338","192.168.1.118","172.217.12.170","TCP","66","44582 → 443 [ACK] Seq=916 Ack=3934 Win=64128 Len=0 TSval=3438174971 TSecr=2687497657"
"236","0.801591013","172.217.12.170","192.168.1.118","TLSv1.2","100","Application Data"
"237","0.801647775","192.168.1.118","172.217.12.170","TCP","66","44582 → 443 [ACK] Seq=916 Ack=3968 Win=64128 Len=0 TSval=3438174971 TSecr=2687497657"
"238","0.823736463","192.168.1.118","209.18.47.62","DNS","82","Standard query 0x1b41 A secure2.sfdcstatic.com"
"239","0.840262013","209.18.47.62","192.168.1.118","DNS","179","Standard query response 0x1b41 A secure2.sfdcstatic.com CNAME secure2.sfdcstatic.com.edgekey.net CNAME e4745.b.akamaiedge.net A 104.102.83.39"
"240","0.840700575","192.168.1.118","209.18.47.62","DNS","82","Standard query 0x8fa0 AAAA secure2.sfdcstatic.com"
"241","0.858190963","209.18.47.62","192.168.1.118","DNS","221","Standard query response 0x8fa0 AAAA secure2.sfdcstatic.com CNAME secure2.sfdcstatic.com.edgekey.net CNAME e4745.b.akamaiedge.net SOA n0b.akamaiedge.net"
"242","0.860928400","192.168.1.118","104.102.83.39","TCP","74","33160 → 443 [SYN] Seq=0 Win=64240 Len=0 MSS=1460 SACK_PERM=1 TSval=2051431570 TSecr=0 WS=128"
"243","0.874619338","192.168.1.118","136.147.57.129","TLSv1.2","385","Application Data"
"244","0.875941513","104.102.83.39","192.168.1.118","TCP","74","443 → 33160 [SYN, ACK] Seq=0 Ack=1 Win=28960 Len=0 MSS=1460 SACK_PERM=1 TSval=176594387 TSecr=2051431570 WS=128"
"245","0.876126750","192.168.1.118","104.102.83.39","TCP","66","33160 → 443 [ACK] Seq=1 Ack=1 Win=64256 Len=0 TSval=2051431585 TSecr=176594387"
"246","0.894077550","192.168.1.118","104.102.83.39","TLSv1","583","Client Hello"
"247","0.900538488","192.168.1.118","104.102.83.39","TLSv1.2","313","Application Data"
"248","0.909710325","192.168.1.118","104.102.83.39","TLSv1.2","315","Application Data"
"249","0.911094763","104.102.83.39","192.168.1.118","TCP","66","443 → 33160 [ACK] Seq=1 Ack=518 Win=30080 Len=0 TSval=176594423 TSecr=2051431603"
"250","0.918758438","192.168.1.118","104.102.83.39","TLSv1.2","317","Application Data"
"251","0.919158175","104.102.83.39","192.168.1.118","TLSv1.2","1514","Server Hello"
"252","0.919294750","192.168.1.118","104.102.83.39","TCP","66","33160 → 443 [ACK] Seq=518 Ack=1449 Win=63104 Len=0 TSval=2051431628 TSecr=176594429"
"253","0.921359800","104.102.83.39","192.168.1.118","TLSv1.2","1891","Certificate, Server Key Exchange, Server Hello Done"
"254","0.921456275","192.168.1.118","104.102.83.39","TCP","66","33160 → 443 [ACK] Seq=518 Ack=3274 Win=61312 Len=0 TSval=2051431630 TSecr=176594429"
"255","0.924230975","192.168.1.118","104.102.83.39","TLSv1.2","192","Client Key Exchange, Change Cipher Spec, Encrypted Handshake Message"
"256","0.930697350","192.168.1.118","104.102.83.39","TLSv1.2","316","Application Data"
"257","0.934269063","136.147.57.129","192.168.1.118","TCP","66","443 → 35196 [ACK] Seq=24029 Ack=320 Win=5245 Len=0 TSval=619891113 TSecr=4180230507"
"258","0.938983575","104.102.83.39","192.168.1.118","TLSv1.2","1093","Application Data"
"259","0.939138388","192.168.1.118","104.102.83.39","TCP","66","33150 → 443 [ACK] Seq=1374 Ack=17393 Win=63104 Len=0 TSval=2051431648 TSecr=176594450"
"260","0.940230600","192.168.1.118","104.102.83.39","TLSv1.2","316","Application Data"
"261","0.940752638","104.102.83.39","192.168.1.118","TLSv1.2","117","Change Cipher Spec, Encrypted Handshake Message"
"262","0.944567175","192.168.1.118","104.102.83.39","TLSv1.2","305","Application Data"
"263","0.951122338","192.168.1.118","104.102.83.39","TLSv1.2","318","Application Data"
"264","0.951410938","104.102.83.39","192.168.1.118","TLSv1.2","1062","Application Data"
"265","0.951564275","192.168.1.118","104.102.83.39","TCP","66","33154 → 443 [ACK] Seq=1614 Ack=38853 Win=67072 Len=0 TSval=2051431660 TSecr=176594463"
"266","0.954674463","104.102.83.39","192.168.1.118","TLSv1.2","1043","Application Data"
"267","0.954797350","192.168.1.118","104.102.83.39","TCP","66","33148 → 443 [ACK] Seq=1402 Ack=7532 Win=63232 Len=0 TSval=2051431663 TSecr=176594466"
"268","0.956108550","104.102.83.39","192.168.1.118","TLSv1.2","1123","Application Data"
"269","0.956182300","192.168.1.118","104.102.83.39","TCP","66","33152 → 443 [ACK] Seq=1138 Ack=151255 Win=140288 Len=0 TSval=2051431665 TSecr=176594468"
"270","0.969640125","104.102.83.39","192.168.1.118","TLSv1.2","904","Application Data"
"271","0.970593325","104.102.83.39","192.168.1.118","TLSv1.2","414","Application Data"
"272","0.985680700","192.168.1.118","209.18.47.62","DNS","76","Standard query 0xbff4 A a.sfdcstatic.com"
"273","0.991795563","104.102.83.39","192.168.1.118","TLSv1.2","1051","Application Data"
"274","0.991870088","192.168.1.118","104.102.83.39","TCP","66","33156 → 443 [ACK] Seq=1409 Ack=11198 Win=63232 Len=0 TSval=2051431701 TSecr=176594504"
"275","1.004110563","209.18.47.62","192.168.1.118","DNS","167","Standard query response 0xbff4 A a.sfdcstatic.com CNAME a.sfdcstatic.com.edgekey.net CNAME e4745.b.akamaiedge.net A 104.102.83.39"
"276","1.004285725","192.168.1.118","209.18.47.62","DNS","76","Standard query 0x8ff0 AAAA a.sfdcstatic.com"
"277","1.007466063","192.168.1.118","104.102.83.39","TLSv1.2","316","Application Data"
"278","1.007599363","192.168.1.118","104.102.83.39","TLSv1.2","315","Application Data"
"279","1.011371200","192.168.1.118","104.102.83.39","TCP","66","33160 → 443 [ACK] Seq=883 Ack=3673 Win=64128 Len=0 TSval=2051431720 TSecr=176594478"
"280","1.011602550","192.168.1.118","104.102.83.39","TLSv1.2","316","Application Data"
"281","1.011701050","192.168.1.118","104.102.83.39","TLSv1.2","315","Application Data"
"282","1.021277625","209.18.47.62","192.168.1.118","DNS","209","Standard query response 0x8ff0 AAAA a.sfdcstatic.com CNAME a.sfdcstatic.com.edgekey.net CNAME e4745.b.akamaiedge.net SOA n0b.akamaiedge.net"
"283","1.023856288","192.168.1.118","104.102.83.39","TCP","74","33162 → 443 [SYN] Seq=0 Win=64240 Len=0 MSS=1460 SACK_PERM=1 TSval=2051431732 TSecr=0 WS=128"
"284","1.035124700","136.147.57.129","192.168.1.118","TCP","1414","[TCP segment of a reassembled PDU]"
"285","1.035187163","192.168.1.118","136.147.57.129","TCP","66","35196 → 443 [ACK] Seq=320 Ack=25377 Win=64704 Len=0 TSval=4180230668 TSecr=619891213"
"286","1.037060700","136.147.57.129","192.168.1.118","TLSv1.2","123","Application Data"
"287","1.037084275","192.168.1.118","136.147.57.129","TCP","66","35196 → 443 [ACK] Seq=320 Ack=25434 Win=64704 Len=0 TSval=4180230670 TSecr=619891213"
"288","1.039200075","104.102.83.39","192.168.1.118","TLSv1.2","1061","Application Data"
"289","1.040842938","104.102.83.39","192.168.1.118","TCP","74","443 → 33162 [SYN, ACK] Seq=0 Ack=1 Win=28960 Len=0 MSS=1460 SACK_PERM=1 TSval=176594553 TSecr=2051431732 WS=128"
"290","1.040921488","192.168.1.118","104.102.83.39","TCP","66","33162 → 443 [ACK] Seq=1 Ack=1 Win=64256 Len=0 TSval=2051431750 TSecr=176594553"
"291","1.042335750","104.102.83.39","192.168.1.118","TLSv1.2","1100","Application Data"
"292","1.053933100","104.102.83.39","192.168.1.118","TLSv1.2","1017","Application Data"
"293","1.054002600","192.168.1.118","104.102.83.39","TCP","66","33148 → 443 [ACK] Seq=1652 Ack=8483 Win=63232 Len=0 TSval=2051431763 TSecr=176594565"
"294","1.055283438","104.102.83.39","192.168.1.118","TLSv1.2","1056","Application Data"
"295","1.055357388","192.168.1.118","104.102.83.39","TCP","66","33152 → 443 [ACK] Seq=1388 Ack=152245 Win=143232 Len=0 TSval=2051431764 TSecr=176594566"
"296","1.058333175","192.168.1.118","104.102.83.39","TLSv1","583","Client Hello"
"297","1.079356525","192.168.1.118","104.102.83.39","TCP","66","33154 → 443 [ACK] Seq=1863 Ack=39848 Win=69888 Len=0 TSval=2051431788 TSecr=176594551"
"298","1.082519888","104.102.83.39","192.168.1.118","TCP","66","443 → 33162 [ACK] Seq=1 Ack=518 Win=30080 Len=0 TSval=176594595 TSecr=2051431767"
"299","1.083356100","192.168.1.118","104.102.83.39","TCP","66","33150 → 443 [ACK] Seq=1873 Ack=19265 Win=64128 Len=0 TSval=2051431792 TSecr=176594554"
"300","1.086933963","104.102.83.39","192.168.1.118","TLSv1.2","1514","Server Hello"
"301","1.087003875","192.168.1.118","104.102.83.39","TCP","66","33162 → 443 [ACK] Seq=518 Ack=1449 Win=63104 Len=0 TSval=2051431796 TSecr=176594597"
"302","1.089700725","104.102.83.39","192.168.1.118","TCP","1514","443 → 33162 [ACK] Seq=1449 Ack=518 Win=30080 Len=1448 TSval=176594597 TSecr=2051431767 [TCP segment of a reassembled PDU]"
"303","1.089782325","192.168.1.118","104.102.83.39","TCP","66","33162 → 443 [ACK] Seq=518 Ack=2897 Win=61696 Len=0 TSval=2051431798 TSecr=176594597"
"304","1.089836500","104.102.83.39","192.168.1.118","TLSv1.2","443","Certificate, Server Key Exchange, Server Hello Done"
"305","1.089917500","192.168.1.118","104.102.83.39","TCP","66","33162 → 443 [ACK] Seq=518 Ack=3274 Win=61440 Len=0 TSval=2051431799 TSecr=176594598"
"306","1.131186475","192.168.1.101","224.0.0.251","IGMPv2","60","Membership Report group 224.0.0.251"
"307","1.185624350","192.168.1.118","104.102.83.39","TLSv1.2","192","Client Key Exchange, Change Cipher Spec, Encrypted Handshake Message"
"308","1.203180125","104.102.83.39","192.168.1.118","TLSv1.2","117","Change Cipher Spec, Encrypted Handshake Message"
"309","1.203257363","192.168.1.118","104.102.83.39","TCP","66","33162 → 443 [ACK] Seq=644 Ack=3325 Win=64128 Len=0 TSval=2051431912 TSecr=176594715"
"310","1.218076975","192.168.1.118","104.102.83.39","TLSv1.2","327","Application Data"
"311","1.237233088","104.102.83.39","192.168.1.118","TCP","1514","[TCP segment of a reassembled PDU]"
"312","1.239718125","104.102.83.39","192.168.1.118","TLSv1.2","4802","Application Data"
"313","1.239882563","192.168.1.118","104.102.83.39","TCP","66","33162 → 443 [ACK] Seq=905 Ack=9509 Win=64128 Len=0 TSval=2051431949 TSecr=176594746"
"314","1.646195113","192.168.1.103","224.0.0.251","MDNS","164","Standard query 0x0000 PTR _companion-link._tcp.local, "QM" question TXT cjqg._companion-link._tcp.local, "QU" question PTR _sleep-proxy._udp.local, "QM" question PTR cjqg._companion-link._tcp.local OPT"
"315","1.851364038","192.168.1.101","224.0.0.251","MDNS","231","Standard query response 0x0000 TXT, cache flush NSEC, cache flush cjqg._companion-link._tcp.local OPT"
"316","1.927438238","192.168.1.118","192.168.1.102","TCP","176","44768 → 8009 [PSH, ACK] Seq=1 Ack=1 Win=501 Len=110 TSval=2258200048 TSecr=5272209 [TCP segment of a reassembled PDU]"
"317","1.935792588","192.168.1.102","192.168.1.118","TCP","176","8009 → 44768 [PSH, ACK] Seq=1 Ack=111 Win=294 Len=110 TSval=5272710 TSecr=2258200048 [TCP segment of a reassembled PDU]"
"318","1.935941225","192.168.1.118","192.168.1.102","TCP","66","44768 → 8009 [ACK] Seq=111 Ack=111 Win=501 Len=0 TSval=2258200057 TSecr=5272710"
"319","2.361618050","192.168.1.104","255.255.255.255","UDP","217","49154 → 6666 Len=175"
"320","3.798404013","192.168.1.101","224.0.0.251","MDNS","373","Standard query 0x0000 PTR _googlecast._tcp.local, "QM" question PTR _homekit._tcp.local, "QM" question PTR _uscan._tcp.local, "QM" question PTR _ptp._tcp.local, "QM" question PTR _ippusb._tcp.local, "QM" question PTR _scanner._tcp.local, "QM" question PTR _ipp._tcp.local, "QM" question PTR _pdl-datastream._tcp.local, "QM" question PTR _uscans._tcp.local, "QM" question PTR _ipps._tcp.local, "QM" question PTR _printer._tcp.local, "QM" question PTR _airplay._tcp.local, "QM" question PTR _raop._tcp.local, "QM" question PTR _airport._tcp.local, "QM" question PTR _rdlink._tcp.local, "QM" question PTR Google-Home-Mini-2c3f16b2da5c4b6fd6cfbfba61c12490._googlecast._tcp.local OPT"
"321","3.904440225","192.168.1.100","224.0.0.251","MDNS","367","Standard query 0x0000 PTR _googlecast._tcp.local, "QM" question PTR _homekit._tcp.local, "QM" question PTR _uscan._tcp.local, "QM" question PTR _ptp._tcp.local, "QM" question PTR _ippusb._tcp.local, "QM" question PTR _scanner._tcp.local, "QM" question PTR _ipp._tcp.local, "QM" question PTR _pdl-datastream._tcp.local, "QM" question PTR _uscans._tcp.local, "QM" question PTR _ipps._tcp.local, "QM" question PTR _printer._tcp.local, "QM" question PTR _airplay._tcp.local, "QM" question PTR _raop._tcp.local, "QM" question PTR _airport._tcp.local, "QM" question PTR _rdlink._tcp.local, "QM" question PTR Google-Home-Mini-2c3f16b2da5c4b6fd6cfbfba61c12490._googlecast._tcp.local OPT"
"322","5.332565350","192.168.1.104","255.255.255.255","UDP","217","49154 → 6666 Len=175"
"323","6.940803888","192.168.1.118","192.168.1.102","TCP","176","44768 → 8009 [PSH, ACK] Seq=111 Ack=111 Win=501 Len=110 TSval=2258205061 TSecr=5272710 [TCP segment of a reassembled PDU]"
"324","6.945706450","192.168.1.102","192.168.1.118","TCP","176","8009 → 44768 [PSH, ACK] Seq=111 Ack=221 Win=294 Len=110 TSval=5273211 TSecr=2258205061 [TCP segment of a reassembled PDU]"
"325","6.945874775","192.168.1.118","192.168.1.102","TCP","66","44768 → 8009 [ACK] Seq=221 Ack=221 Win=501 Len=0 TSval=2258205066 TSecr=5273211"
"326","8.246796163","IntelCor_b7:52:73","Cisco-Li_5b:1c:ce","ARP","60","Who has 192.168.1.1? Tell 192.168.1.118"
"327","8.249720925","Cisco-Li_5b:1c:ce","IntelCor_b7:52:73","ARP","42","192.168.1.1 is at 58:6d:8f:5b:1c:ce"
"328","8.407004938","192.168.1.104","255.255.255.255","UDP","217","49154 → 6666 Len=175"
