frame.number,_ws.col.Time,_ws.col.Source,_ws.col.Destination,_ws.col.Protocol,frame.len,_ws.col.Info
"1","0.000000000","192.168.1.118","199.232.37.164","TCP","66","32794 → 443 [ACK] Seq=1 Ack=1 Win=287 Len=0 TSval=1766436416 TSecr=1116527552"
"2","0.006629350","199.232.37.164","192.168.1.118","SSL","2770","Continuation Data"
"3","0.007491787","192.168.1.118","199.232.37.164","TCP","66","32802 → 443 [ACK] Seq=1 Ack=2705 Win=787 Len=0 TSval=1766436424 TSecr=2812515031"
"4","0.008002750","199.232.37.164","192.168.1.118","SSL","2770","Continuation Data"
"5","0.009200825","192.168.1.118","199.232.37.164","TCP","66","32802 → 443 [ACK] Seq=1 Ack=5409 Win=766 Len=0 TSval=1766436425 TSecr=2812515031"
"6","0.009809137","199.232.37.164","192.168.1.118","SSL","2770","Continuation Data"
"7","0.009859387","192.168.1.118","199.232.37.164","TCP","66","32802 → 443 [ACK] Seq=1 Ack=8113 Win=850 Len=0 TSval=1766436426 TSecr=2812515031"
"8","0.011122150","199.232.37.164","192.168.1.118","SSL","2770","Continuation Data"
"9","0.011171337","192.168.1.118","199.232.37.164","TCP","66","32802 → 443 [ACK] Seq=1 Ack=10817 Win=893 Len=0 TSval=1766436427 TSecr=2812515031"
"10","0.014110450","199.232.37.164","192.168.1.118","SSL","1418","Continuation Data"
"11","0.016506037","199.232.37.164","192.168.1.118","SSL","1418","Continuation Data"
"12","0.016525862","192.168.1.118","199.232.37.164","TCP","66","32802 → 443 [ACK] Seq=1 Ack=13521 Win=935 Len=0 TSval=1766436433 TSecr=2812515031"
"13","0.016552737","199.232.37.164","192.168.1.118","SSL","1418","Continuation Data"
"14","0.018007387","199.232.37.164","192.168.1.118","SSL","1418","Continuation Data"
"15","0.018026037","192.168.1.118","199.232.37.164","TCP","66","32800 → 443 [ACK] Seq=1 Ack=2705 Win=522 Len=0 TSval=1766436434 TSecr=1436008044"
"16","0.019505637","199.232.37.164","192.168.1.118","SSL","2770","Continuation Data"
"17","0.019524837","192.168.1.118","199.232.37.164","TCP","66","32800 → 443 [ACK] Seq=1 Ack=5409 Win=565 Len=0 TSval=1766436436 TSecr=1436008044"
"18","0.023164200","199.232.37.164","192.168.1.118","SSL","2770","Continuation Data"
"19","0.023182787","192.168.1.118","199.232.37.164","TCP","66","32800 → 443 [ACK] Seq=1 Ack=8113 Win=607 Len=0 TSval=1766436439 TSecr=1436008044"
"20","0.023350225","199.232.37.164","192.168.1.118","SSL","2770","Continuation Data"
"21","0.023373112","192.168.1.118","199.232.37.164","TCP","66","32800 → 443 [ACK] Seq=1 Ack=10817 Win=649 Len=0 TSval=1766436439 TSecr=1436008044"
"22","0.023399087","199.232.37.164","192.168.1.118","TLSv1.2","11589","Application Data, Application Data, Application Data, Application Data, Application Data, Application Data, Application Data, Application Data, Application Data"
"23","0.023435062","199.232.37.164","192.168.1.118","TCP","4122","443 → 32800 [ACK] Seq=10817 Ack=1 Win=57 Len=4056 TSval=1436008045 TSecr=1766436382"
"24","0.023455225","192.168.1.118","199.232.37.164","TCP","66","32800 → 443 [ACK] Seq=1 Ack=14873 Win=688 Len=0 TSval=1766436440 TSecr=1436008045"
"25","0.024167312","192.168.1.118","199.232.37.164","TCP","66","32798 → 443 [ACK] Seq=1 Ack=11524 Win=411 Len=0 TSval=1766436440 TSecr=2814212421"
"26","0.024970725","199.232.37.164","192.168.1.118","SSL","1418","Continuation Data"
"27","0.024999625","199.232.37.164","192.168.1.118","SSL","2770","Continuation Data"
"28","0.025012250","199.232.37.164","192.168.1.118","SSL","1418","Continuation Data"
"29","0.025245987","192.168.1.118","199.232.37.164","TCP","66","32800 → 443 [ACK] Seq=1 Ack=18929 Win=657 Len=0 TSval=1766436441 TSecr=1436008045"
"30","0.025562662","199.232.37.164","192.168.1.118","SSL","16290","Continuation Data"
"31","0.025599400","192.168.1.118","199.232.37.164","TCP","66","32802 → 443 [ACK] Seq=1 Ack=31097 Win=1209 Len=0 TSval=1766436442 TSecr=2812515034"
"32","0.027484125","199.232.37.164","192.168.1.118","SSL","3738","Continuation Data"
"33","0.027523262","192.168.1.118","199.232.37.164","TCP","66","32796 → 443 [ACK] Seq=1 Ack=3673 Win=461 Len=0 TSval=1766436444 TSecr=2812248239"
"34","0.027569300","199.232.37.164","192.168.1.118","SSL","2174","Continuation Data"
"35","0.027601012","192.168.1.118","199.232.37.164","TCP","66","32794 → 443 [ACK] Seq=1 Ack=2109 Win=477 Len=0 TSval=1766436444 TSecr=1116527561"
"36","0.027625087","199.232.37.164","192.168.1.118","SSL","1418","Continuation Data"
"37","0.027646762","199.232.37.164","192.168.1.118","SSL","2770","Continuation Data"
"38","0.028187462","192.168.1.118","199.232.37.164","TCP","66","32800 → 443 [ACK] Seq=1 Ack=21633 Win=636 Len=0 TSval=1766436444 TSecr=1436008050"
"39","0.029611575","192.168.1.118","199.232.37.164","TLSv1.2","363","Application Data"
"40","0.029737000","192.168.1.118","199.232.37.164","TLSv1.2","351","Application Data"
"41","0.030659712","199.232.37.164","192.168.1.118","TCP","2770","443 → 32802 [ACK] Seq=32449 Ack=1 Win=57 Len=2704 TSval=2812515040 TSecr=1766436426"
"42","0.030692475","192.168.1.118","199.232.37.164","TCP","66","32802 → 443 [ACK] Seq=1 Ack=35153 Win=1273 Len=0 TSval=1766436447 TSecr=2812515034"
"43","0.030783625","199.232.37.164","192.168.1.118","SSL","5474","Continuation Data"
"44","0.030815100","192.168.1.118","199.232.37.164","TCP","66","32802 → 443 [ACK] Seq=1 Ack=40561 Win=1357 Len=0 TSval=1766436447 TSecr=2812515040"
"45","0.031625862","192.168.1.118","199.232.37.164","TLSv1.2","342","Application Data"
"46","0.035084212","199.232.37.164","192.168.1.118","SSL","21698","Continuation Data"
"47","0.035143362","192.168.1.118","199.232.37.164","TCP","66","32802 → 443 [ACK] Seq=1 Ack=62193 Win=1695 Len=0 TSval=1766436451 TSecr=2812515040"
"48","0.036975675","199.232.37.164","192.168.1.118","SSL","5474","Continuation Data"
"49","0.037026875","192.168.1.118","199.232.37.164","TCP","66","32802 → 443 [ACK] Seq=1 Ack=67601 Win=1739 Len=0 TSval=1766436453 TSecr=2812515040"
"50","0.037199875","199.232.37.164","192.168.1.118","SSL","8178","Continuation Data"
"51","0.037337362","199.232.37.164","192.168.1.118","SSL","8178","Continuation Data"
"52","0.040624675","199.232.37.164","192.168.1.118","SSL","8178","Continuation Data"
"53","0.040721600","199.232.37.164","192.168.1.118","SSL","5474","Continuation Data"
"54","0.040828150","199.232.37.164","192.168.1.118","SSL","1418","Continuation Data"
"55","0.040882125","199.232.37.164","192.168.1.118","SSL","5474","Continuation Data"
"56","0.040931037","199.232.37.164","192.168.1.118","SSL","1418","Continuation Data"
"57","0.040976762","192.168.1.118","199.232.37.164","TCP","66","32800 → 443 [ACK] Seq=1 Ack=24337 Win=731 Len=0 TSval=1766436457 TSecr=1436008084"
"58","0.041416462","199.232.37.164","192.168.1.118","SSL","2791","Continuation Data"
"59","0.051883487","199.232.37.164","192.168.1.118","SSL","1418","Continuation Data"
"60","0.057740712","199.232.37.164","192.168.1.118","SSL","10882","Continuation Data"
"61","0.066686000","199.232.37.164","192.168.1.118","SSL","12234","Continuation Data"
"62","0.067749812","199.232.37.164","192.168.1.118","SSL","10882","Continuation Data"
"63","0.067829512","192.168.1.118","199.232.37.164","TCP","66","32802 → 443 [ACK] Seq=1 Ack=137905 Win=1190 Len=0 TSval=1766436484 TSecr=2812515040"
"64","0.068071562","199.232.37.164","192.168.1.118","SSL","31162","Continuation Data"
"65","0.069942137","199.232.37.164","192.168.1.118","SSL","1418","[TCP Previous segment not captured] , Continuation Data"
"66","0.070023937","192.168.1.118","199.232.37.164","TCP","78","32802 → 443 [ACK] Seq=1 Ack=169001 Win=948 Len=0 TSval=1766436486 TSecr=2812515046 SLE=173057 SRE=174409"
"67","0.070202600","199.232.37.164","192.168.1.118","SSL","6826","[TCP Previous segment not captured] , Continuation Data"
"68","0.070287062","192.168.1.118","199.232.37.164","TCP","86","[TCP Dup ACK 66#1] 32802 → 443 [ACK] Seq=1 Ack=169001 Win=948 Len=0 TSval=1766436486 TSecr=2812515046 SLE=177113 SRE=183873 SLE=173057 SRE=174409"
"69","0.070600837","199.232.37.164","192.168.1.118","SSL","13586","Continuation Data"
"70","0.070694575","192.168.1.118","199.232.37.164","TCP","86","[TCP Dup ACK 66#2] 32802 → 443 [ACK] Seq=1 Ack=169001 Win=948 Len=0 TSval=1766436487 TSecr=2812515046 SLE=177113 SRE=197393 SLE=173057 SRE=174409"
"71","0.074100387","199.232.37.164","192.168.1.118","SSL","1713","Continuation Data"
"72","0.074304400","199.232.37.164","192.168.1.118","TCP","6826","[TCP segment of a reassembled PDU]"
"73","0.074505775","199.232.37.164","192.168.1.118","TCP","1418","443 → 32802 [ACK] Seq=205800 Ack=1 Win=57 Len=1352 TSval=2812515046 TSecr=1766436453 [TCP segment of a reassembled PDU]"
"74","0.075206525","192.168.1.118","199.232.37.164","TCP","86","[TCP Dup ACK 66#3] 32802 → 443 [ACK] Seq=1 Ack=169001 Win=948 Len=0 TSval=1766436491 TSecr=2812515046 SLE=177113 SRE=207152 SLE=173057 SRE=174409"
"75","0.077657512","199.232.37.164","192.168.1.118","TLSv1.2","5680","Application Data, Application Data, Application Data, Application Data, Application Data"
"76","0.077803650","199.232.37.164","192.168.1.118","TLSv1.2","6512","Application Data, Application Data, Application Data, Application Data, Application Data"
"77","0.077905812","192.168.1.118","199.232.37.164","TCP","66","32794 → 443 [ACK] Seq=298 Ack=8555 Win=602 Len=0 TSval=1766436494 TSecr=1116527569"
"78","0.078101312","199.232.37.164","192.168.1.118","TCP","2770","443 → 32802 [ACK] Seq=207152 Ack=1 Win=57 Len=2704 TSval=2812515046 TSecr=1766436453 [TCP segment of a reassembled PDU]"
"79","0.078159312","199.232.37.164","192.168.1.118","TLSv1.2","16290","Application Data, Application Data, Application Data, Application Data, Application Data, Application Data, Application Data, Application Data, Application Data, Application Data, Application Data"
"80","0.079283237","199.232.37.164","192.168.1.118","TLSv1.2","5474","Application Data, Application Data, Application Data, Application Data"
"81","0.079432562","199.232.37.164","192.168.1.118","TLSv1.2","5474","Application Data, Application Data, Application Data, Application Data"
"82","0.079535975","192.168.1.118","199.232.37.164","TCP","86","[TCP Dup ACK 66#4] 32802 → 443 [ACK] Seq=1 Ack=169001 Win=948 Len=0 TSval=1766436494 TSecr=2812515046 SLE=177113 SRE=209856 SLE=173057 SRE=174409"
"83","0.082938125","192.168.1.118","199.232.37.164","TCP","66","32800 → 443 [ACK] Seq=1 Ack=27062 Win=730 Len=0 TSval=1766436499 TSecr=1436008084"
"84","0.092023987","199.232.37.164","192.168.1.118","TCP","1418","443 → 32802 [ACK] Seq=209856 Ack=1 Win=57 Len=1352 TSval=2812515055 TSecr=1766436484 [TCP segment of a reassembled PDU]"
"85","0.093102950","192.168.1.118","199.232.37.164","TCP","86","[TCP Dup ACK 66#5] 32802 → 443 [ACK] Seq=1 Ack=169001 Win=948 Len=0 TSval=1766436508 TSecr=2812515046 SLE=177113 SRE=211208 SLE=173057 SRE=174409"
"86","0.093800225","199.232.37.164","192.168.1.118","TLSv1.2","10882","Application Data [TCP segment of a reassembled PDU]"
"87","0.094139987","199.232.37.164","192.168.1.118","TLSv1.2","10882","Application Data [TCP segment of a reassembled PDU]"
"88","0.094883125","192.168.1.118","199.232.37.164","TCP","86","[TCP Dup ACK 66#6] 32802 → 443 [ACK] Seq=1 Ack=169001 Win=948 Len=0 TSval=1766436510 TSecr=2812515046 SLE=177113 SRE=232840 SLE=173057 SRE=174409"
"89","0.098184975","199.232.37.164","192.168.1.118","TCP","5474","443 → 32802 [ACK] Seq=232840 Ack=1 Win=57 Len=5408 TSval=2812515055 TSecr=1766436484 [TCP segment of a reassembled PDU]"
"90","0.098499300","199.232.37.164","192.168.1.118","TLSv1.2","16290","Application Data [TCP segment of a reassembled PDU]"
"91","0.099263237","192.168.1.118","199.232.37.164","TCP","86","[TCP Dup ACK 66#7] 32802 → 443 [ACK] Seq=1 Ack=169001 Win=948 Len=0 TSval=1766436515 TSecr=2812515046 SLE=177113 SRE=254472 SLE=173057 SRE=174409"
"92","0.103855275","199.232.37.164","192.168.1.118","TCP","5474","443 → 32802 [ACK] Seq=254472 Ack=1 Win=57 Len=5408 TSval=2812515055 TSecr=1766436484 [TCP segment of a reassembled PDU]"
"93","0.104228675","199.232.37.164","192.168.1.118","TLSv1.2","16290","Application Data [TCP segment of a reassembled PDU]"
"94","0.104961250","192.168.1.118","199.232.37.164","TCP","86","[TCP Dup ACK 66#8] 32802 → 443 [ACK] Seq=1 Ack=169001 Win=948 Len=0 TSval=1766436520 TSecr=2812515046 SLE=177113 SRE=276104 SLE=173057 SRE=174409"
"95","0.105762412","199.232.37.164","192.168.1.118","TLSv1.2","8178","Application Data [TCP segment of a reassembled PDU]"
"96","0.106059750","199.232.37.164","192.168.1.118","TCP","4122","443 → 32802 [ACK] Seq=284216 Ack=1 Win=57 Len=4056 TSval=2812515055 TSecr=1766436484 [TCP segment of a reassembled PDU]"
"97","0.106152737","199.232.37.164","192.168.1.118","TLSv1.2","1418","[TCP Fast Retransmission] , Ignored Unknown Record"
"98","0.106224000","192.168.1.118","199.232.37.164","TCP","86","32802 → 443 [ACK] Seq=1 Ack=170353 Win=938 Len=0 TSval=1766436522 TSecr=2812515056 SLE=177113 SRE=288272 SLE=173057 SRE=174409"
"99","0.106296975","199.232.37.164","192.168.1.118","TCP","2139","443 → 32802 [ACK] Seq=288272 Ack=1 Win=57 Len=2073 TSval=2812515056 TSecr=1766436486 [TCP segment of a reassembled PDU]"
"100","0.106366750","192.168.1.118","199.232.37.164","TCP","86","[TCP Dup ACK 98#1] 32802 → 443 [ACK] Seq=1 Ack=170353 Win=938 Len=0 TSval=1766436522 TSecr=2812515056 SLE=177113 SRE=290345 SLE=173057 SRE=174409"
"101","0.106474425","199.232.37.164","192.168.1.118","TCP","2770","[TCP Out-Of-Order] 443 → 32802 [ACK] Seq=170353 Ack=1 Win=57 Len=2704 TSval=2812515058 TSecr=1766436486"
"102","0.106551300","192.168.1.118","199.232.37.164","TCP","78","32802 → 443 [ACK] Seq=1 Ack=174409 Win=907 Len=0 TSval=1766436523 TSecr=2812515058 SLE=177113 SRE=290345"
"103","0.106631012","199.232.37.164","192.168.1.118","TCP","2770","[TCP Out-Of-Order] 443 → 32802 [ACK] Seq=174409 Ack=1 Win=57 Len=2704 TSval=2812515058 TSecr=1766436486"
"104","0.106708037","192.168.1.118","199.232.37.164","TCP","66","32802 → 443 [ACK] Seq=1 Ack=290345 Win=2 Len=0 TSval=1766436523 TSecr=2812515058"
"105","0.117964387","192.168.1.118","199.232.37.164","TCP","66","32798 → 443 [ACK] Seq=286 Ack=17138 Win=458 Len=0 TSval=1766436534 TSecr=2814212436"
"106","0.118969337","192.168.1.118","199.232.37.164","TCP","66","32796 → 443 [ACK] Seq=277 Ack=30713 Win=290 Len=0 TSval=1766436535 TSecr=2812248252"
"107","0.158252687","199.232.37.164","192.168.1.118","TLSv1.2","272","[TCP Spurious Retransmission] , Ignored Unknown Record"
"108","0.158385500","192.168.1.118","199.232.37.164","TCP","78","[TCP Dup ACK 105#1] 32798 → 443 [ACK] Seq=286 Ack=17138 Win=458 Len=0 TSval=1766436574 TSecr=2814212458 SLE=16932 SRE=17138"
"109","0.165058025","192.168.1.118","199.232.37.164","TCP","74","32804 → 443 [SYN] Seq=0 Win=64240 Len=0 MSS=1460 SACK_PERM=1 TSval=1766436581 TSecr=0 WS=128"
"110","0.182245200","199.232.37.164","192.168.1.118","TLSv1.2","1418","Application Data [TCP segment of a reassembled PDU]"
"111","0.183381450","199.232.37.164","192.168.1.118","TLSv1.2","4122","Application Data, Application Data, Application Data"
"112","0.185546575","192.168.1.118","199.232.37.164","TCP","66","32796 → 443 [ACK] Seq=277 Ack=36121 Win=248 Len=0 TSval=1766436602 TSecr=2812248284"
"113","0.186394725","192.168.1.118","199.232.37.164","TLSv1.2","356","Application Data"
"114","0.188620600","199.232.37.164","192.168.1.118","TLSv1.2","1418","Application Data [TCP segment of a reassembled PDU]"
"115","0.189384900","199.232.37.164","192.168.1.118","TLSv1.2","242","Application Data"
"116","0.189428587","199.232.37.164","192.168.1.118","TCP","74","443 → 32804 [SYN, ACK] Seq=0 Ack=1 Win=27040 Len=0 MSS=1364 SACK_PERM=1 TSval=2814419333 TSecr=1766436581 WS=512"
"117","0.189497287","192.168.1.118","199.232.37.164","TCP","66","32804 → 443 [ACK] Seq=1 Ack=1 Win=64256 Len=0 TSval=1766436606 TSecr=2814419333"
"118","0.190808637","192.168.1.118","199.232.37.164","TCP","66","[TCP Window Update] 32802 → 443 [ACK] Seq=1 Ack=290345 Win=227 Len=0 TSval=1766436607 TSecr=2812515058"
"119","0.191124550","192.168.1.118","199.232.37.164","TCP","66","32796 → 443 [ACK] Seq=277 Ack=37649 Win=237 Len=0 TSval=1766436607 TSecr=2812248284"
"120","0.209134937","192.168.1.118","199.232.37.164","TLSv1","583","Client Hello"
"121","0.209434462","192.168.1.118","199.232.37.164","TCP","66","[TCP Window Update] 32796 → 443 [ACK] Seq=277 Ack=37649 Win=501 Len=0 TSval=1766436625 TSecr=2812248284"
"122","0.210032825","199.232.37.164","192.168.1.118","TLSv1.2","1418","Application Data"
"123","0.213993900","199.232.37.164","192.168.1.118","TLSv1.2","21698","Application Data, Application Data, Application Data, Application Data, Application Data, Application Data, Application Data, Application Data, Application Data, Application Data, Application Data, Application Data, Application Data, Application Data, Application Data"
"124","0.214074137","192.168.1.118","199.232.37.164","TCP","66","32794 → 443 [ACK] Seq=588 Ack=31539 Win=961 Len=0 TSval=1766436630 TSecr=1116527608"
"125","0.214315062","192.168.1.118","199.232.37.164","TCP","66","[TCP Window Update] 32802 → 443 [ACK] Seq=1 Ack=290345 Win=486 Len=0 TSval=1766436630 TSecr=2812515058"
"126","0.216065187","199.232.37.164","192.168.1.118","TLSv1.2","10882","Application Data, Application Data, Application Data, Application Data, Application Data, Application Data, Application Data, Application Data"
"127","0.216144287","192.168.1.118","199.232.37.164","TCP","66","32794 → 443 [ACK] Seq=588 Ack=42355 Win=1130 Len=0 TSval=1766436632 TSecr=1116527608"
"128","0.216233000","199.232.37.164","192.168.1.118","TLSv1.2","1105","Application Data, Application Data"
"129","0.216323350","199.232.37.164","192.168.1.118","TLSv1.2","9530","Application Data [TCP segment of a reassembled PDU]"
"130","0.216487362","192.168.1.118","199.232.37.164","TCP","66","32802 → 443 [ACK] Seq=1 Ack=299809 Win=413 Len=0 TSval=1766436633 TSecr=2812515086"
"131","0.220963587","192.168.1.118","199.232.37.164","TCP","66","[TCP Window Update] 32802 → 443 [ACK] Seq=1 Ack=299809 Win=889 Len=0 TSval=1766436637 TSecr=2812515086"
"132","0.221074400","199.232.37.164","192.168.1.118","TCP","4122","443 → 32802 [ACK] Seq=299809 Ack=1 Win=57 Len=4056 TSval=2812515086 TSecr=1766436607 [TCP segment of a reassembled PDU]"
"133","0.221114262","192.168.1.118","199.232.37.164","TCP","66","32802 → 443 [ACK] Seq=1 Ack=303865 Win=858 Len=0 TSval=1766436637 TSecr=2812515086"
"134","0.224044737","199.232.37.164","192.168.1.118","TLSv1.2","15602","Application Data [TCP segment of a reassembled PDU]"
"135","0.224281912","192.168.1.118","199.232.37.164","TCP","66","32802 → 443 [ACK] Seq=1 Ack=319401 Win=777 Len=0 TSval=1766436640 TSecr=2812515086"
"136","0.228881550","192.168.1.118","199.232.37.164","TCP","66","[TCP Window Update] 32802 → 443 [ACK] Seq=1 Ack=319401 Win=1739 Len=0 TSval=1766436645 TSecr=2812515086"
"137","0.230084887","199.232.37.164","192.168.1.118","TCP","66","443 → 32804 [ACK] Seq=1 Ack=518 Win=28160 Len=0 TSval=2814419344 TSecr=1766436625"
"138","0.231982437","199.232.37.164","192.168.1.118","TLSv1.2","1418","Server Hello"
"139","0.232029537","192.168.1.118","199.232.37.164","TCP","66","32804 → 443 [ACK] Seq=518 Ack=1353 Win=63104 Len=0 TSval=1766436648 TSecr=2814419344"
"140","0.233604762","199.232.37.164","192.168.1.118","TLSv1.2","4345","Certificate, Server Key Exchange, Server Hello Done"
"141","0.233651025","192.168.1.118","199.232.37.164","TCP","66","32804 → 443 [ACK] Seq=518 Ack=5632 Win=58880 Len=0 TSval=1766436650 TSecr=2814419344"
"142","0.236353775","192.168.1.118","199.232.37.164","TLSv1.2","192","Client Key Exchange, Change Cipher Spec, Encrypted Handshake Message"
"143","0.237687525","199.232.37.164","192.168.1.118","TCP","1418","443 → 32802 [ACK] Seq=319401 Ack=1 Win=57 Len=1352 TSval=2812515092 TSecr=1766436630 [TCP segment of a reassembled PDU]"
"144","0.239482025","199.232.37.164","192.168.1.118","TCP","5474","443 → 32802 [ACK] Seq=320753 Ack=1 Win=57 Len=5408 TSval=2812515092 TSecr=1766436630 [TCP segment of a reassembled PDU]"
"145","0.239541025","192.168.1.118","199.232.37.164","TCP","66","32802 → 443 [ACK] Seq=1 Ack=326161 Win=1844 Len=0 TSval=1766436656 TSecr=2812515092"
"146","0.239668462","199.232.37.164","192.168.1.118","TCP","2737","443 → 32802 [PSH, ACK] Seq=326161 Ack=1 Win=57 Len=2671 TSval=2812515092 TSecr=1766436630 [TCP segment of a reassembled PDU]"
"147","0.239725112","192.168.1.118","199.232.37.164","TCP","66","32802 → 443 [ACK] Seq=1 Ack=328832 Win=1886 Len=0 TSval=1766436656 TSecr=2812515092"
"148","0.239844212","199.232.37.164","192.168.1.118","TLSv1.2","4122","Application Data [TCP segment of a reassembled PDU]"
"149","0.239900912","192.168.1.118","199.232.37.164","TCP","66","32802 → 443 [ACK] Seq=1 Ack=332888 Win=1950 Len=0 TSval=1766436656 TSecr=2812515092"
"150","0.256991125","192.168.1.118","199.232.37.164","TCP","66","32794 → 443 [ACK] Seq=588 Ack=43394 Win=1143 Len=0 TSval=1766436673 TSecr=1116527608"
"151","0.257403875","199.232.37.164","192.168.1.118","TLSv1.2","19731","Application Data [TCP segment of a reassembled PDU]"
"152","0.257496062","192.168.1.118","199.232.37.164","TCP","66","32802 → 443 [ACK] Seq=1 Ack=352553 Win=2257 Len=0 TSval=1766436674 TSecr=2812515092"
"153","0.257598725","199.232.37.164","192.168.1.118","TCP","2770","443 → 32802 [ACK] Seq=352553 Ack=1 Win=57 Len=2704 TSval=2812515092 TSecr=1766436637 [TCP segment of a reassembled PDU]"
"154","0.257675837","192.168.1.118","199.232.37.164","TCP","66","32802 → 443 [ACK] Seq=1 Ack=355257 Win=2299 Len=0 TSval=1766436674 TSecr=2812515092"
"155","0.264640325","199.232.37.164","192.168.1.118","TCP","6826","443 → 32802 [ACK] Seq=355257 Ack=1 Win=57 Len=6760 TSval=2812515092 TSecr=1766436637 [TCP segment of a reassembled PDU]"
"156","0.264762200","192.168.1.118","199.232.37.164","TCP","66","32802 → 443 [ACK] Seq=1 Ack=362017 Win=2405 Len=0 TSval=1766436681 TSecr=2812515092"
"157","0.265283837","199.232.37.164","192.168.1.118","TLSv1.2","31777","Application Data, Application Data"
"158","0.265401787","192.168.1.118","199.232.37.164","TCP","66","32802 → 443 [ACK] Seq=1 Ack=393728 Win=2900 Len=0 TSval=1766436681 TSecr=2812515092"
"159","0.265505775","199.232.37.164","192.168.1.118","TLSv1.2","2770","Application Data [TCP segment of a reassembled PDU]"
"160","0.265581062","192.168.1.118","199.232.37.164","TCP","66","32802 → 443 [ACK] Seq=1 Ack=396432 Win=2942 Len=0 TSval=1766436682 TSecr=2812515092"
"161","0.266603962","199.232.37.164","192.168.1.118","TCP","8178","443 → 32802 [ACK] Seq=396432 Ack=1 Win=57 Len=8112 TSval=2812515092 TSecr=1766436637 [TCP segment of a reassembled PDU]"
"162","0.266650525","192.168.1.118","199.232.37.164","TCP","66","32802 → 443 [ACK] Seq=1 Ack=404544 Win=3069 Len=0 TSval=1766436683 TSecr=2812515092"
"163","0.266782000","199.232.37.164","192.168.1.118","TLSv1.2","8178","Application Data [TCP segment of a reassembled PDU]"
"164","0.266807112","192.168.1.118","199.232.37.164","TCP","66","32802 → 443 [ACK] Seq=1 Ack=412656 Win=3196 Len=0 TSval=1766436683 TSecr=2812515092"
"165","0.266849750","199.232.37.164","192.168.1.118","TCP","5474","443 → 32802 [ACK] Seq=412656 Ack=1 Win=57 Len=5408 TSval=2812515095 TSecr=1766436640 [TCP segment of a reassembled PDU]"
"166","0.266873300","192.168.1.118","199.232.37.164","TCP","66","32802 → 443 [ACK] Seq=1 Ack=418064 Win=3280 Len=0 TSval=1766436683 TSecr=2812515095"
"167","0.269341362","199.232.37.164","192.168.1.118","TLSv1.2","2770","Application Data [TCP segment of a reassembled PDU]"
"168","0.269367537","192.168.1.118","199.232.37.164","TCP","66","32802 → 443 [ACK] Seq=1 Ack=420768 Win=3323 Len=0 TSval=1766436685 TSecr=2812515095"
"169","0.269556962","199.232.37.164","192.168.1.118","TLSv1.2","18994","Application Data [TCP segment of a reassembled PDU]"
"170","0.269588075","192.168.1.118","199.232.37.164","TCP","66","32802 → 443 [ACK] Seq=1 Ack=439696 Win=3618 Len=0 TSval=1766436686 TSecr=2812515095"
"171","0.273081212","199.232.37.164","192.168.1.118","TCP","2770","443 → 32802 [ACK] Seq=439696 Ack=1 Win=57 Len=2704 TSval=2812515095 TSecr=1766436645 [TCP segment of a reassembled PDU]"
"172","0.273105612","192.168.1.118","199.232.37.164","TCP","66","32802 → 443 [ACK] Seq=1 Ack=442400 Win=3661 Len=0 TSval=1766436689 TSecr=2812515095"
"173","0.273302100","199.232.37.164","192.168.1.118","TLSv1.2","18994","Application Data [TCP segment of a reassembled PDU]"
"174","0.273330375","192.168.1.118","199.232.37.164","TCP","66","32802 → 443 [ACK] Seq=1 Ack=461328 Win=3956 Len=0 TSval=1766436689 TSecr=2812515095"
"175","0.276559437","199.232.37.164","192.168.1.118","TCP","5474","443 → 32802 [ACK] Seq=461328 Ack=1 Win=57 Len=5408 TSval=2812515095 TSecr=1766436645 [TCP segment of a reassembled PDU]"
"176","0.276604937","192.168.1.118","199.232.37.164","TCP","66","32802 → 443 [ACK] Seq=1 Ack=466736 Win=4041 Len=0 TSval=1766436693 TSecr=2812515095"
"177","0.276694850","199.232.37.164","192.168.1.118","TLSv1.2","4122","Application Data [TCP segment of a reassembled PDU]"
"178","0.276735112","192.168.1.118","199.232.37.164","TCP","66","32802 → 443 [ACK] Seq=1 Ack=470792 Win=4104 Len=0 TSval=1766436693 TSecr=2812515097"
"179","0.277515050","199.232.37.164","192.168.1.118","TLSv1.2","117","Change Cipher Spec, Encrypted Handshake Message"
"180","0.277561637","199.232.37.164","192.168.1.118","TCP","5474","443 → 32802 [ACK] Seq=470792 Ack=1 Win=57 Len=5408 TSval=2812515097 TSecr=1766436656 [TCP segment of a reassembled PDU]"
"181","0.277599500","192.168.1.118","199.232.37.164","TCP","66","32802 → 443 [ACK] Seq=1 Ack=476200 Win=4189 Len=0 TSval=1766436694 TSecr=2812515097"
"182","0.277638062","199.232.37.164","192.168.1.118","TCP","2770","443 → 32802 [ACK] Seq=476200 Ack=1 Win=57 Len=2704 TSval=2812515100 TSecr=1766436656 [TCP segment of a reassembled PDU]"
"183","0.277678837","192.168.1.118","199.232.37.164","TCP","66","32802 → 443 [ACK] Seq=1 Ack=478904 Win=4231 Len=0 TSval=1766436694 TSecr=2812515100"
"184","0.277901862","192.168.1.118","199.232.37.164","TLSv1.2","375","Application Data"
"185","0.289461937","199.232.37.164","192.168.1.118","TCP","1418","443 → 32802 [ACK] Seq=478904 Ack=1 Win=57 Len=1352 TSval=2812515104 TSecr=1766436693 [TCP segment of a reassembled PDU]"
"186","0.310547112","199.232.37.164","192.168.1.118","TLSv1.2","5474","Application Data [TCP segment of a reassembled PDU]"
"187","0.310625837","192.168.1.118","199.232.37.164","TCP","66","32802 → 443 [ACK] Seq=1 Ack=485664 Win=4337 Len=0 TSval=1766436727 TSecr=2812515104"
"188","0.311070762","199.232.37.164","192.168.1.118","TLSv1.2","16290","Application Data [TCP segment of a reassembled PDU]"
"189","0.311163275","192.168.1.118","199.232.37.164","TCP","66","32802 → 443 [ACK] Seq=1 Ack=501888 Win=4590 Len=0 TSval=1766436727 TSecr=2812515104"
"190","0.318240512","199.232.37.164","192.168.1.118","TCP","5474","443 → 32802 [ACK] Seq=501888 Ack=1 Win=57 Len=5408 TSval=2812515104 TSecr=1766436693 [TCP segment of a reassembled PDU]"
"191","0.318319025","192.168.1.118","199.232.37.164","TCP","66","32802 → 443 [ACK] Seq=1 Ack=507296 Win=4675 Len=0 TSval=1766436734 TSecr=2812515104"
"192","0.318709650","199.232.37.164","192.168.1.118","TLSv1.2","16290","Application Data [TCP segment of a reassembled PDU]"
"193","0.318798187","192.168.1.118","199.232.37.164","TCP","66","32802 → 443 [ACK] Seq=1 Ack=523520 Win=4928 Len=0 TSval=1766436735 TSecr=2812515104"
"194","0.322664762","199.232.37.164","192.168.1.118","TCP","4122","443 → 32802 [ACK] Seq=523520 Ack=1 Win=57 Len=4056 TSval=2812515104 TSecr=1766436693 [TCP segment of a reassembled PDU]"
"195","0.322724412","192.168.1.118","199.232.37.164","TCP","66","32802 → 443 [ACK] Seq=1 Ack=527576 Win=4992 Len=0 TSval=1766436739 TSecr=2812515104"
"196","0.322766237","199.232.37.164","192.168.1.118","TCP","1418","[TCP Previous segment not captured] 443 → 32802 [ACK] Seq=528928 Ack=1 Win=57 Len=1352 TSval=2812515104 TSecr=1766436693 [TCP segment of a reassembled PDU]"
"197","0.322825550","192.168.1.118","199.232.37.164","TCP","78","[TCP Window Update] 32802 → 443 [ACK] Seq=1 Ack=527576 Win=5013 Len=0 TSval=1766436739 TSecr=2812515104 SLE=528928 SRE=530280"
"198","0.323066862","199.232.37.164","192.168.1.118","TCP","4122","[TCP Previous segment not captured] 443 → 32802 [ACK] Seq=532984 Ack=1 Win=57 Len=4056 TSval=2812515104 TSecr=1766436693 [TCP segment of a reassembled PDU] [TCP segment of a reassembled PDU]"
"199","0.323131737","192.168.1.118","199.232.37.164","TCP","86","[TCP Window Update] 32802 → 443 [ACK] Seq=1 Ack=527576 Win=5076 Len=0 TSval=1766436739 TSecr=2812515104 SLE=532984 SRE=537040 SLE=528928 SRE=530280"
"200","0.333575025","199.232.37.164","192.168.1.118","TCP","2770","[TCP Previous segment not captured] 443 → 32802 [ACK] Seq=542448 Ack=1 Win=57 Len=2704 TSval=2812515104 TSecr=1766436693 [TCP segment of a reassembled PDU]"
"201","0.333662212","192.168.1.118","199.232.37.164","TCP","94","[TCP Window Update] 32802 → 443 [ACK] Seq=1 Ack=527576 Win=5118 Len=0 TSval=1766436750 TSecr=2812515104 SLE=542448 SRE=545152 SLE=532984 SRE=537040 SLE=528928 SRE=530280"
"202","0.333741150","199.232.37.164","192.168.1.118","TCP","2770","[TCP Previous segment not captured] 443 → 32802 [ACK] Seq=546504 Ack=1 Win=57 Len=2704 TSval=2812515104 TSecr=1766436693 [TCP segment of a reassembled PDU]"
"203","0.333812762","199.232.37.164","192.168.1.118","TLSv1.2","1418","[TCP Previous segment not captured] , Ignored Unknown Record"
"204","0.333889437","192.168.1.118","199.232.37.164","TCP","94","[TCP Window Update] 32802 → 443 [ACK] Seq=1 Ack=527576 Win=5161 Len=0 TSval=1766436750 TSecr=2812515104 SLE=546504 SRE=549208 SLE=542448 SRE=545152 SLE=532984 SRE=537040"
"205","0.333981787","199.232.37.164","192.168.1.118","TLSv1.2","1418","[TCP Previous segment not captured] , Ignored Unknown Record"
"206","0.334074012","199.232.37.164","192.168.1.118","TLSv1.2","4122","[TCP Previous segment not captured] , Ignored Unknown Record"
"207","0.334154450","192.168.1.118","199.232.37.164","TCP","94","[TCP Window Update] 32802 → 443 [ACK] Seq=1 Ack=527576 Win=5203 Len=0 TSval=1766436750 TSecr=2812515104 SLE=557320 SRE=558672 SLE=553264 SRE=554616 SLE=546504 SRE=549208"
"208","0.336414362","199.232.37.164","192.168.1.118","TLSv1.2","21698","Ignored Unknown Record"
"209","0.337533812","192.168.1.118","199.232.37.164","TCP","94","[TCP Window Update] 32802 → 443 [ACK] Seq=1 Ack=527576 Win=5604 Len=0 TSval=1766436753 TSecr=2812515104 SLE=560024 SRE=585712 SLE=557320 SRE=558672 SLE=553264 SRE=554616"
"210","0.337784137","199.232.37.164","192.168.1.118","TLSv1.2","5474","Ignored Unknown Record"
"211","0.338505137","199.232.37.164","192.168.1.118","TLSv1.2","16290","Ignored Unknown Record"
"212","0.338891675","192.168.1.118","199.232.37.164","TCP","94","[TCP Window Update] 32802 → 443 [ACK] Seq=1 Ack=527576 Win=5942 Len=0 TSval=1766436755 TSecr=2812515104 SLE=560024 SRE=607344 SLE=557320 SRE=558672 SLE=553264 SRE=554616"
"213","0.340820050","199.232.37.164","192.168.1.118","TLSv1.2","13586","Ignored Unknown Record"
"214","0.340930962","199.232.37.164","192.168.1.118","TLSv1.2","8178","Ignored Unknown Record"
"215","0.341878087","192.168.1.118","199.232.37.164","TCP","94","[TCP Window Update] 32802 → 443 [ACK] Seq=1 Ack=527576 Win=6280 Len=0 TSval=1766436757 TSecr=2812515104 SLE=560024 SRE=628976 SLE=557320 SRE=558672 SLE=553264 SRE=554616"
"216","0.342409600","199.232.37.164","192.168.1.118","TLSv1.2","9530","Application Data, Application Data, Application Data, Application Data, Application Data, Application Data, Application Data"
"217","0.343322025","192.168.1.118","199.232.37.164","TCP","66","32804 → 443 [ACK] Seq=953 Ack=15147 Win=54784 Len=0 TSval=1766436759 TSecr=2814419362"
"218","0.346394287","199.232.37.164","192.168.1.118","TLSv1.2","4071","Application Data, Application Data, Application Data, Application Data"
"219","0.346465050","199.232.37.164","192.168.1.118","TLSv1.2","97","Encrypted Alert"
"220","0.346583537","199.232.37.164","192.168.1.118","TLSv1.2","27106","Ignored Unknown Record"
"221","0.346629350","199.232.37.164","192.168.1.118","TLSv1.2","1418","Ignored Unknown Record"
"222","0.347679087","192.168.1.118","199.232.37.164","TCP","94","[TCP Window Update] 32802 → 443 [ACK] Seq=1 Ack=527576 Win=6724 Len=0 TSval=1766436763 TSecr=2812515104 SLE=560024 SRE=657368 SLE=557320 SRE=558672 SLE=553264 SRE=554616"
"223","0.348079537","199.232.37.164","192.168.1.118","TLSv1.2","9530","Ignored Unknown Record"
"224","0.348544862","199.232.37.164","192.168.1.118","TLSv1.2","8178","Ignored Unknown Record"
"225","0.348799537","192.168.1.118","199.232.37.164","TCP","66","32804 → 443 [ACK] Seq=953 Ack=19184 Win=50816 Len=0 TSval=1766436765 TSecr=2814419362"
"226","0.349151325","192.168.1.118","199.232.37.164","TCP","94","[TCP Window Update] 32802 → 443 [ACK] Seq=1 Ack=527576 Win=6998 Len=0 TSval=1766436765 TSecr=2812515104 SLE=560024 SRE=674944 SLE=557320 SRE=558672 SLE=553264 SRE=554616"
"227","0.355000925","192.168.1.118","199.232.37.164","TCP","74","32806 → 443 [SYN] Seq=0 Win=64240 Len=0 MSS=1460 SACK_PERM=1 TSval=1766436771 TSecr=0 WS=128"
"228","0.355125562","192.168.1.118","209.18.47.62","DNS","76","Standard query 0xb723 A typeface.nyt.com"
"229","0.362392700","192.168.1.118","199.232.37.164","TLSv1.2","97","Encrypted Alert"
"230","0.364625875","192.168.1.118","199.232.37.164","TCP","66","32804 → 443 [RST, ACK] Seq=984 Ack=19184 Win=64128 Len=0 TSval=1766436781 TSecr=2814419362"
"231","0.365719787","192.168.1.118","199.232.37.164","TLSv1.2","358","Application Data"
"232","0.381674037","199.232.37.164","192.168.1.118","TLSv1.2","1418","Ignored Unknown Record"
"233","0.382542850","199.232.37.164","192.168.1.118","TLSv1.2","1418","Ignored Unknown Record"
"234","0.382747012","192.168.1.118","199.232.37.164","TCP","94","[TCP Window Update] 32802 → 443 [ACK] Seq=1 Ack=527576 Win=7041 Len=0 TSval=1766436799 TSecr=2812515104 SLE=560024 SRE=677648 SLE=557320 SRE=558672 SLE=553264 SRE=554616"
"235","0.425051450","209.18.47.62","192.168.1.118","DNS","170","Standard query response 0xb723 A typeface.nyt.com CNAME nyt5-assets.prd.map.nytimes.com CNAME nytimes.map.fastly.net A 199.232.37.164"
"236","0.425233837","192.168.1.118","209.18.47.62","DNS","76","Standard query 0x3750 AAAA typeface.nyt.com"
"237","0.427177275","199.232.37.164","192.168.1.118","TLSv1.2","2770","Ignored Unknown Record"
"238","0.427273150","199.232.37.164","192.168.1.118","TCP","1418","[TCP Out-Of-Order] 443 → 32802 [ACK] Seq=527576 Ack=1 Win=57 Len=1352 TSval=2812515130 TSecr=1766436739 [TCP segment of a reassembled PDU]"
"239","0.427365162","192.168.1.118","199.232.37.164","TCP","94","32802 → 443 [ACK] Seq=1 Ack=530280 Win=7104 Len=0 TSval=1766436843 TSecr=2812515130 SLE=560024 SRE=680352 SLE=557320 SRE=558672 SLE=553264 SRE=554616"
"240","0.427485975","199.232.37.164","192.168.1.118","TCP","2770","[TCP Out-Of-Order] 443 → 32802 [ACK] Seq=530280 Ack=1 Win=57 Len=2704 TSval=2812515130 TSecr=1766436739"
"241","0.427559400","192.168.1.118","199.232.37.164","TCP","94","32802 → 443 [ACK] Seq=1 Ack=537040 Win=7146 Len=0 TSval=1766436844 TSecr=2812515130 SLE=560024 SRE=680352 SLE=557320 SRE=558672 SLE=553264 SRE=554616"
"242","0.427604900","199.232.37.164","192.168.1.118","TCP","1418","[TCP Out-Of-Order] 443 → 32802 [ACK] Seq=537040 Ack=1 Win=57 Len=1352 TSval=2812515130 TSecr=1766436750 [TCP segment of a reassembled PDU]"
"243","0.427675537","192.168.1.118","199.232.37.164","TCP","94","32802 → 443 [ACK] Seq=1 Ack=538392 Win=7167 Len=0 TSval=1766436844 TSecr=2812515130 SLE=560024 SRE=680352 SLE=557320 SRE=558672 SLE=553264 SRE=554616"
"244","0.427868112","199.232.37.164","192.168.1.118","TCP","4122","[TCP Out-Of-Order] 443 → 32802 [ACK] Seq=538392 Ack=1 Win=57 Len=4056 TSval=2812515130 TSecr=1766436750 [TCP segment of a reassembled PDU]"
"245","0.427974262","192.168.1.118","199.232.37.164","TCP","94","32802 → 443 [ACK] Seq=1 Ack=545152 Win=7231 Len=0 TSval=1766436844 TSecr=2812515130 SLE=560024 SRE=680352 SLE=557320 SRE=558672 SLE=553264 SRE=554616"
"246","0.428048325","199.232.37.164","192.168.1.118","TCP","1418","[TCP Out-Of-Order] 443 → 32802 [ACK] Seq=545152 Ack=1 Win=57 Len=1352 TSval=2812515130 TSecr=1766436753 [TCP segment of a reassembled PDU]"
"247","0.428119887","192.168.1.118","199.232.37.164","TCP","94","32802 → 443 [ACK] Seq=1 Ack=549208 Win=7252 Len=0 TSval=1766436844 TSecr=2812515130 SLE=560024 SRE=680352 SLE=557320 SRE=558672 SLE=553264 SRE=554616"
"248","0.428198212","199.232.37.164","192.168.1.118","TCP","54","443 → 32804 [RST] Seq=19184 Win=0 Len=0"
"249","0.428302637","199.232.37.164","192.168.1.118","TCP","4122","[TCP Out-Of-Order] 443 → 32802 [ACK] Seq=549208 Ack=1 Win=57 Len=4056 TSval=2812515130 TSecr=1766436755"
"250","0.428380250","192.168.1.118","199.232.37.164","TCP","86","32802 → 443 [ACK] Seq=1 Ack=554616 Win=7315 Len=0 TSval=1766436844 TSecr=2812515130 SLE=560024 SRE=680352 SLE=557320 SRE=558672"
"251","0.428448262","199.232.37.164","192.168.1.118","TCP","2770","[TCP Out-Of-Order] 443 → 32802 [ACK] Seq=554616 Ack=1 Win=57 Len=2704 TSval=2812515130 TSecr=1766436755"
"252","0.428525375","192.168.1.118","199.232.37.164","TCP","78","32802 → 443 [ACK] Seq=1 Ack=558672 Win=7358 Len=0 TSval=1766436845 TSecr=2812515130 SLE=560024 SRE=680352"
"253","0.428584212","199.232.37.164","192.168.1.118","TCP","1418","[TCP Out-Of-Order] 443 → 32802 [ACK] Seq=558672 Ack=1 Win=57 Len=1352 TSval=2812515130 TSecr=1766436755"
"254","0.428665087","192.168.1.118","199.232.37.164","TCP","66","32802 → 443 [ACK] Seq=1 Ack=680352 Win=7379 Len=0 TSval=1766436845 TSecr=2812515130"
"255","0.428815325","199.232.37.164","192.168.1.118","TLSv1.2","9530","Ignored Unknown Record"
"256","0.428888150","192.168.1.118","199.232.37.164","TCP","66","32802 → 443 [ACK] Seq=1 Ack=689816 Win=7527 Len=0 TSval=1766436845 TSecr=2812515130"
"257","0.429130175","199.232.37.164","192.168.1.118","TLSv1.2","4122","Ignored Unknown Record"
"258","0.429200037","192.168.1.118","199.232.37.164","TCP","66","32802 → 443 [ACK] Seq=1 Ack=693872 Win=7590 Len=0 TSval=1766436845 TSecr=2812515130"
"259","0.429337562","199.232.37.164","192.168.1.118","TLSv1.2","6826","Ignored Unknown Record"
"260","0.429406037","192.168.1.118","199.232.37.164","TCP","66","32802 → 443 [ACK] Seq=1 Ack=700632 Win=7696 Len=0 TSval=1766436845 TSecr=2812515130"
"261","0.431466325","199.232.37.164","192.168.1.118","TCP","74","443 → 32806 [SYN, ACK] Seq=0 Ack=1 Win=27040 Len=0 MSS=1364 SACK_PERM=1 TSval=3144751046 TSecr=1766436771 WS=512"
"262","0.431580150","192.168.1.118","199.232.37.164","TCP","66","32806 → 443 [ACK] Seq=1 Ack=1 Win=64256 Len=0 TSval=1766436848 TSecr=3144751046"
"263","0.431657650","199.232.37.164","192.168.1.118","TLSv1.2","5474","Ignored Unknown Record"
"264","0.431724375","192.168.1.118","199.232.37.164","TCP","66","32802 → 443 [ACK] Seq=1 Ack=706040 Win=7780 Len=0 TSval=1766436848 TSecr=2812515130"
"265","0.432045075","199.232.37.164","192.168.1.118","TLSv1.2","9530","Ignored Unknown Record"
"266","0.432117300","192.168.1.118","199.232.37.164","TCP","66","32802 → 443 [ACK] Seq=1 Ack=715504 Win=7928 Len=0 TSval=1766436848 TSecr=2812515130"
"267","0.432236337","199.232.37.164","192.168.1.118","TLSv1.2","5474","Ignored Unknown Record"
"268","0.432304400","192.168.1.118","199.232.37.164","TCP","66","32802 → 443 [ACK] Seq=1 Ack=720912 Win=8012 Len=0 TSval=1766436848 TSecr=2812515130"
"269","0.439851062","199.232.37.164","192.168.1.118","TLSv1.2","5474","Ignored Unknown Record"
"270","0.439893812","192.168.1.118","199.232.37.164","TCP","66","32802 → 443 [ACK] Seq=1 Ack=726320 Win=8097 Len=0 TSval=1766436856 TSecr=2812515130"
"271","0.440089175","199.232.37.164","192.168.1.118","TCP","16290","443 → 32802 [ACK] Seq=726320 Ack=1 Win=57 Len=16224 TSval=2812515130 TSecr=1766436763"
"272","0.440132425","192.168.1.118","199.232.37.164","TCP","66","32802 → 443 [ACK] Seq=1 Ack=742544 Win=8350 Len=0 TSval=1766436856 TSecr=2812515130"
"273","0.446413450","192.168.1.118","199.232.37.164","TLSv1","583","Client Hello"
"274","0.451896687","199.232.37.164","192.168.1.118","TLSv1.2","1418","Ignored Unknown Record"
"275","0.451992587","199.232.37.164","192.168.1.118","TLSv1.2","4122","Ignored Unknown Record"
"276","0.452044575","192.168.1.118","199.232.37.164","TCP","66","32802 → 443 [ACK] Seq=1 Ack=747952 Win=8435 Len=0 TSval=1766436868 TSecr=2812515130"
"277","0.452230875","199.232.37.164","192.168.1.118","TLSv1.2","8178","Ignored Unknown Record"
"278","0.452285225","192.168.1.118","199.232.37.164","TCP","66","32802 → 443 [ACK] Seq=1 Ack=756064 Win=8562 Len=0 TSval=1766436868 TSecr=2812515130"
"279","0.472507387","199.232.37.164","192.168.1.118","TLSv1.2","1301","Application Data, Application Data"
"280","0.472628150","192.168.1.118","199.232.37.164","TCP","66","32794 → 443 [ACK] Seq=880 Ack=44629 Win=1164 Len=0 TSval=1766436889 TSecr=1116527654"
"281","0.472703512","199.232.37.164","192.168.1.118","TLSv1.2","5474","Ignored Unknown Record"
"282","0.472772287","192.168.1.118","199.232.37.164","TCP","66","32802 → 443 [ACK] Seq=1 Ack=761472 Win=8646 Len=0 TSval=1766436889 TSecr=2812515130"
"283","0.472822362","199.232.37.164","192.168.1.118","TLSv1.2","1418","Ignored Unknown Record"
"284","0.477468787","209.18.47.62","192.168.1.118","DNS","212","Standard query response 0x3750 AAAA typeface.nyt.com CNAME nyt5-assets.prd.map.nytimes.com CNAME nytimes.map.fastly.net SOA ns1.fastly.net"
"285","0.477510475","199.232.37.164","192.168.1.118","TLSv1.2","1418","Ignored Unknown Record"
"286","0.477548925","192.168.1.118","199.232.37.164","TCP","66","32802 → 443 [ACK] Seq=1 Ack=764176 Win=8688 Len=0 TSval=1766436894 TSecr=2812515134"
"287","0.477978262","192.168.1.118","199.232.37.164","TCP","74","32808 → 443 [SYN] Seq=0 Win=64240 Len=0 MSS=1460 SACK_PERM=1 TSval=1766436894 TSecr=0 WS=128"
"288","0.478130475","199.232.37.164","192.168.1.118","TLSv1.2","2770","Ignored Unknown Record"
"289","0.478152575","192.168.1.118","199.232.37.164","TCP","66","32802 → 443 [ACK] Seq=1 Ack=766880 Win=8731 Len=0 TSval=1766436894 TSecr=2812515146"
"290","0.486784600","199.232.37.164","192.168.1.118","TLSv1.2","1418","Ignored Unknown Record"
"291","0.499888487","199.232.37.164","192.168.1.118","TLSv1.2","1418","Ignored Unknown Record"
"292","0.499984050","192.168.1.118","199.232.37.164","TCP","66","32802 → 443 [ACK] Seq=1 Ack=769584 Win=8773 Len=0 TSval=1766436916 TSecr=2812515146"
"293","0.503609987","199.232.37.164","192.168.1.118","TLSv1.2","5474","Ignored Unknown Record"
"294","0.503655137","192.168.1.118","199.232.37.164","TCP","66","32802 → 443 [ACK] Seq=1 Ack=774992 Win=8857 Len=0 TSval=1766436920 TSecr=2812515158"
"295","0.503811712","199.232.37.164","192.168.1.118","TLSv1.2","1418","Ignored Unknown Record"
"296","0.510682687","199.232.37.164","192.168.1.118","TLSv1.2","5474","Ignored Unknown Record"
"297","0.510745225","192.168.1.118","199.232.37.164","TCP","66","32802 → 443 [ACK] Seq=1 Ack=781752 Win=8963 Len=0 TSval=1766436927 TSecr=2812515158"
"298","0.510785237","199.232.37.164","192.168.1.118","TLSv1.2","1418","Ignored Unknown Record"
"299","0.510843100","199.232.37.164","192.168.1.118","TLSv1.2","1418","Ignored Unknown Record"
"300","0.510895787","192.168.1.118","199.232.37.164","TCP","66","32802 → 443 [ACK] Seq=1 Ack=784456 Win=9005 Len=0 TSval=1766436927 TSecr=2812515158"
"301","0.511048950","199.232.37.164","192.168.1.118","TLSv1.2","18994","Ignored Unknown Record"
"302","0.511114650","192.168.1.118","199.232.37.164","TCP","66","32802 → 443 [ACK] Seq=1 Ack=803384 Win=9301 Len=0 TSval=1766436927 TSecr=2812515158"
"303","0.519015600","199.232.37.164","192.168.1.118","TLSv1.2","29810","Ignored Unknown Record"
"304","0.519100375","192.168.1.118","199.232.37.164","TCP","66","32802 → 443 [ACK] Seq=1 Ack=833128 Win=9766 Len=0 TSval=1766436935 TSecr=2812515158"
"305","0.520253650","199.232.37.164","192.168.1.118","TLSv1.2","1418","Ignored Unknown Record"
"306","0.523803950","199.232.37.164","192.168.1.118","TLSv1.2","5474","Ignored Unknown Record"
"307","0.523871425","192.168.1.118","199.232.37.164","TCP","66","32802 → 443 [ACK] Seq=1 Ack=839888 Win=9871 Len=0 TSval=1766436940 TSecr=2812515158"
"308","0.524037537","199.232.37.164","192.168.1.118","TLSv1.2","2770","Ignored Unknown Record"
"309","0.524118837","192.168.1.118","199.232.37.164","TCP","66","32802 → 443 [ACK] Seq=1 Ack=842592 Win=9914 Len=0 TSval=1766436940 TSecr=2812515158"
"310","0.526008737","199.232.37.164","192.168.1.118","TLSv1.2","5474","Ignored Unknown Record"
"311","0.526102175","192.168.1.118","199.232.37.164","TCP","66","32802 → 443 [ACK] Seq=1 Ack=848000 Win=9998 Len=0 TSval=1766436942 TSecr=2812515158"
"312","0.527562500","199.232.37.164","192.168.1.118","TLSv1.2","1418","Ignored Unknown Record"
"313","0.530057725","199.232.37.164","192.168.1.118","TLSv1.2","12234","Ignored Unknown Record"
"314","0.530097587","192.168.1.118","199.232.37.164","TCP","66","32802 → 443 [ACK] Seq=1 Ack=861520 Win=10209 Len=0 TSval=1766436946 TSecr=2812515165"
"315","0.532088525","199.232.37.164","192.168.1.118","TLSv1.2","2770","Ignored Unknown Record"
"316","0.532126087","192.168.1.118","199.232.37.164","TCP","66","32802 → 443 [ACK] Seq=1 Ack=864224 Win=10252 Len=0 TSval=1766436948 TSecr=2812515165"
"317","0.532270637","199.232.37.164","192.168.1.118","TCP","74","443 → 32808 [SYN, ACK] Seq=0 Ack=1 Win=27040 Len=0 MSS=1364 SACK_PERM=1 TSval=858402869 TSecr=1766436894 WS=512"
"318","0.532336625","192.168.1.118","199.232.37.164","TCP","66","32808 → 443 [ACK] Seq=1 Ack=1 Win=64256 Len=0 TSval=1766436948 TSecr=858402869"
"319","0.532364150","199.232.37.164","192.168.1.118","TLSv1.2","17642","Ignored Unknown Record"
"320","0.532388937","192.168.1.118","199.232.37.164","TCP","66","32802 → 443 [ACK] Seq=1 Ack=881800 Win=10526 Len=0 TSval=1766436948 TSecr=2812515165"
"321","0.538607212","199.232.37.164","192.168.1.118","TLSv1.2","5474","Ignored Unknown Record"
"322","0.538669100","192.168.1.118","199.232.37.164","TCP","66","32802 → 443 [ACK] Seq=1 Ack=887208 Win=10611 Len=0 TSval=1766436955 TSecr=2812515165"
"323","0.538777037","199.232.37.164","192.168.1.118","TCP","66","443 → 32806 [ACK] Seq=1 Ack=518 Win=28160 Len=0 TSval=3144751081 TSecr=1766436862"
"324","0.538861650","199.232.37.164","192.168.1.118","TLSv1.2","14938","Ignored Unknown Record"
"325","0.538885825","192.168.1.118","199.232.37.164","TCP","66","32802 → 443 [ACK] Seq=1 Ack=902080 Win=10843 Len=0 TSval=1766436955 TSecr=2812515165"
"326","0.540733250","199.232.37.164","192.168.1.118","TLSv1.2","2770","Ignored Unknown Record"
"327","0.540768862","192.168.1.118","199.232.37.164","TCP","66","32802 → 443 [ACK] Seq=1 Ack=904784 Win=10885 Len=0 TSval=1766436957 TSecr=2812515165"
"328","0.540879037","199.232.37.164","192.168.1.118","TLSv1.2","5697","Server Hello, Certificate, Server Key Exchange, Server Hello Done"
"329","0.540901975","192.168.1.118","199.232.37.164","TCP","66","32806 → 443 [ACK] Seq=518 Ack=5632 Win=58752 Len=0 TSval=1766436957 TSecr=3144751082"
"330","0.540930325","199.232.37.164","192.168.1.118","TLSv1.2","5474","Ignored Unknown Record"
"331","0.540946300","192.168.1.118","199.232.37.164","TCP","66","32802 → 443 [ACK] Seq=1 Ack=910192 Win=10970 Len=0 TSval=1766436957 TSecr=2812515165"
"332","0.540978950","199.232.37.164","192.168.1.118","TLSv1.2","6826","Ignored Unknown Record"
"333","0.540995175","192.168.1.118","199.232.37.164","TCP","66","32802 → 443 [ACK] Seq=1 Ack=916952 Win=11076 Len=0 TSval=1766436957 TSecr=2812515168"
"334","0.544321400","199.232.37.164","192.168.1.118","TLSv1.2","5474","Ignored Unknown Record"
"335","0.544367675","192.168.1.118","199.232.37.164","TCP","66","32802 → 443 [ACK] Seq=1 Ack=922360 Win=11160 Len=0 TSval=1766436960 TSecr=2812515168"
"336","0.544471812","199.232.37.164","192.168.1.118","TLSv1.2","16290","Ignored Unknown Record"
"337","0.544491075","192.168.1.118","199.232.37.164","TCP","66","32802 → 443 [ACK] Seq=1 Ack=938584 Win=11414 Len=0 TSval=1766436961 TSecr=2812515168"
"338","0.547180725","192.168.1.118","199.232.37.164","TLSv1","583","Client Hello"
"339","0.547411275","199.232.37.164","192.168.1.118","TLSv1.2","10882","Ignored Unknown Record"
"340","0.547464950","192.168.1.118","199.232.37.164","TCP","66","32802 → 443 [ACK] Seq=1 Ack=949400 Win=11583 Len=0 TSval=1766436964 TSecr=2812515168"
"341","0.549933137","192.168.1.118","199.232.37.164","TLSv1.2","192","Client Key Exchange, Change Cipher Spec, Encrypted Handshake Message"
"342","0.551789737","199.232.37.164","192.168.1.118","TLSv1.2","1418","Ignored Unknown Record"
"343","0.553165687","199.232.37.164","192.168.1.118","TLSv1.2","5474","Ignored Unknown Record"
"344","0.553204162","192.168.1.118","199.232.37.164","TCP","66","32802 → 443 [ACK] Seq=1 Ack=956160 Win=11688 Len=0 TSval=1766436969 TSecr=2812515171"
"345","0.568535575","199.232.37.164","192.168.1.118","TLSv1.2","5474","Ignored Unknown Record"
"346","0.568598200","192.168.1.118","199.232.37.164","TCP","66","32802 → 443 [ACK] Seq=1 Ack=961568 Win=11773 Len=0 TSval=1766436985 TSecr=2812515171"
"347","0.568724375","199.232.37.164","192.168.1.118","TLSv1.2","13586","Ignored Unknown Record"
"348","0.568745350","192.168.1.118","199.232.37.164","TCP","66","32802 → 443 [ACK] Seq=1 Ack=975088 Win=11984 Len=0 TSval=1766436985 TSecr=2812515171"
"349","0.573833200","199.232.37.164","192.168.1.118","TLSv1.2","40626","Ignored Unknown Record"
"350","0.573899187","192.168.1.118","199.232.37.164","TCP","66","32802 → 443 [ACK] Seq=1 Ack=1015648 Win=12618 Len=0 TSval=1766436990 TSecr=2812515171"
"351","0.575913275","199.232.37.164","192.168.1.118","TLSv1.2","2770","Ignored Unknown Record"
"352","0.575956762","192.168.1.118","199.232.37.164","TCP","66","32802 → 443 [ACK] Seq=1 Ack=1018352 Win=12618 Len=0 TSval=1766436992 TSecr=2812515171"
"353","0.576063550","199.232.37.164","192.168.1.118","TLSv1.2","10882","Ignored Unknown Record"
"354","0.576083150","192.168.1.118","199.232.37.164","TCP","66","32802 → 443 [ACK] Seq=1 Ack=1029168 Win=12618 Len=0 TSval=1766436992 TSecr=2812515171"
"355","0.576127637","199.232.37.164","192.168.1.118","TLSv1.2","8178","Ignored Unknown Record"
"356","0.576144250","192.168.1.118","199.232.37.164","TCP","66","32802 → 443 [ACK] Seq=1 Ack=1037280 Win=12618 Len=0 TSval=1766436992 TSecr=2812515172"
"357","0.579310462","199.232.37.164","192.168.1.118","TLSv1.2","5474","Ignored Unknown Record"
"358","0.579368987","192.168.1.118","199.232.37.164","TCP","66","32802 → 443 [ACK] Seq=1 Ack=1042688 Win=12618 Len=0 TSval=1766436995 TSecr=2812515172"
"359","0.579484162","199.232.37.164","192.168.1.118","TCP","66","443 → 32808 [ACK] Seq=1 Ack=518 Win=28160 Len=0 TSval=858402878 TSecr=1766436963"
"360","0.579520250","199.232.37.164","192.168.1.118","TLSv1.2","13586","Ignored Unknown Record"
"361","0.579538962","192.168.1.118","199.232.37.164","TCP","66","32802 → 443 [ACK] Seq=1 Ack=1056208 Win=12618 Len=0 TSval=1766436996 TSecr=2812515172"
"362","0.579549100","199.232.37.164","192.168.1.118","TLSv1.2","1418","Server Hello"
"363","0.579564675","192.168.1.118","199.232.37.164","TCP","66","32808 → 443 [ACK] Seq=518 Ack=1353 Win=63104 Len=0 TSval=1766436996 TSecr=858402878"
"364","0.582776087","199.232.37.164","192.168.1.118","TCP","2770","443 → 32808 [ACK] Seq=1353 Ack=518 Win=28160 Len=2704 TSval=858402878 TSecr=1766436963 [TCP segment of a reassembled PDU]"
"365","0.582796337","192.168.1.118","199.232.37.164","TCP","66","32808 → 443 [ACK] Seq=518 Ack=4057 Win=61056 Len=0 TSval=1766436999 TSecr=858402878"
"366","0.582883412","199.232.37.164","192.168.1.118","TLSv1.2","1641","Certificate, Server Key Exchange, Server Hello Done"
"367","0.582907837","192.168.1.118","199.232.37.164","TCP","66","32808 → 443 [ACK] Seq=518 Ack=5632 Win=59520 Len=0 TSval=1766436999 TSecr=858402878"
"368","0.582935025","199.232.37.164","192.168.1.118","TLSv1.2","117","Change Cipher Spec, Encrypted Handshake Message"
"369","0.583018362","199.232.37.164","192.168.1.118","TLSv1.2","13586","Ignored Unknown Record"
"370","0.583041275","192.168.1.118","199.232.37.164","TCP","66","32802 → 443 [ACK] Seq=1 Ack=1069728 Win=12618 Len=0 TSval=1766436999 TSecr=2812515178"
"371","0.585593475","192.168.1.118","199.232.37.164","TLSv1.2","192","Client Key Exchange, Change Cipher Spec, Encrypted Handshake Message"
"372","0.585911237","192.168.1.118","199.232.37.164","TLSv1.2","440","Application Data"
"373","0.602892475","199.232.37.164","192.168.1.118","TCP","5474","[TCP segment of a reassembled PDU]"
"374","0.602988612","192.168.1.118","199.232.37.164","TCP","66","32802 → 443 [ACK] Seq=1 Ack=1075136 Win=12618 Len=0 TSval=1766437019 TSecr=2812515180"
"375","0.603144437","199.232.37.164","192.168.1.118","TLSv1.2","6826","Change Cipher Spec, Ignored Unknown Record"
"376","0.603185400","192.168.1.118","199.232.37.164","TCP","66","32802 → 443 [ACK] Seq=1 Ack=1081896 Win=12618 Len=0 TSval=1766437019 TSecr=2812515180"
"377","0.614498887","199.232.37.164","192.168.1.118","TLSv1.2","55498","Ignored Unknown Record"
"378","0.614621362","192.168.1.118","199.232.37.164","TCP","66","32802 → 443 [ACK] Seq=1 Ack=1137328 Win=12618 Len=0 TSval=1766437031 TSecr=2812515180"
"379","0.614746900","199.232.37.164","192.168.1.118","TLSv1.2","18994","Ignored Unknown Record"
"380","0.614807425","192.168.1.118","199.232.37.164","TCP","66","32802 → 443 [ACK] Seq=1 Ack=1156256 Win=12618 Len=0 TSval=1766437031 TSecr=2812515184"
"381","0.618122012","199.232.37.164","192.168.1.118","TLSv1.2","5474","Ignored Unknown Record"
"382","0.618169237","192.168.1.118","199.232.37.164","TCP","66","32802 → 443 [ACK] Seq=1 Ack=1161664 Win=12618 Len=0 TSval=1766437034 TSecr=2812515184"
"383","0.618345150","199.232.37.164","192.168.1.118","TLSv1.2","10882","Ignored Unknown Record"
"384","0.618394137","192.168.1.118","199.232.37.164","TCP","66","32802 → 443 [ACK] Seq=1 Ack=1172480 Win=12618 Len=0 TSval=1766437034 TSecr=2812515184"
"385","0.618485587","199.232.37.164","192.168.1.118","TLSv1.2","5474","Ignored Unknown Record"
"386","0.618532437","192.168.1.118","199.232.37.164","TCP","66","32802 → 443 [ACK] Seq=1 Ack=1177888 Win=12618 Len=0 TSval=1766437035 TSecr=2812515184"
"387","0.623128387","192.168.1.104","255.255.255.255","UDP","217","49154 → 6666 Len=175"
"388","0.625196725","199.232.37.164","192.168.1.118","TLSv1.2","117","Change Cipher Spec, Encrypted Handshake Message"
"389","0.625352937","199.232.37.164","192.168.1.118","TLSv1.2","8178","Application Data, Application Data, Application Data, Application Data, Application Data, Application Data"
"390","0.625540887","199.232.37.164","192.168.1.118","TLSv1.2","5474","Application Data, Application Data, Application Data, Application Data"
"391","0.625611462","192.168.1.118","199.232.37.164","TLSv1.2","309","Application Data"
"392","0.625696287","192.168.1.118","199.232.37.164","TCP","66","32806 → 443 [ACK] Seq=1018 Ack=19203 Win=50688 Len=0 TSval=1766437042 TSecr=3144751103"
"393","0.629190050","199.232.37.164","192.168.1.118","TLSv1.2","5474","Ignored Unknown Record"
"394","0.629262237","192.168.1.118","199.232.37.164","TCP","66","32802 → 443 [ACK] Seq=1 Ack=1183296 Win=12618 Len=0 TSval=1766437045 TSecr=2812515189"
"395","0.629480100","199.232.37.164","192.168.1.118","TLSv1.2","8178","Ignored Unknown Record"
"396","0.629542062","192.168.1.118","199.232.37.164","TCP","66","32802 → 443 [ACK] Seq=1 Ack=1191408 Win=12618 Len=0 TSval=1766437046 TSecr=2812515189"
"397","0.632869175","199.232.37.164","192.168.1.118","TLSv1.2","1418","Ignored Unknown Record"
"398","0.635008450","199.232.37.164","192.168.1.118","TLSv1.2","5474","Ignored Unknown Record"
"399","0.635067637","192.168.1.118","199.232.37.164","TCP","66","32802 → 443 [ACK] Seq=1 Ack=1198168 Win=12618 Len=0 TSval=1766437051 TSecr=2812515191"
"400","0.635204062","199.232.37.164","192.168.1.118","TLSv1.2","2770","Ignored Unknown Record"
"401","0.635262275","192.168.1.118","199.232.37.164","TCP","66","32802 → 443 [ACK] Seq=1 Ack=1200872 Win=12618 Len=0 TSval=1766437051 TSecr=2812515191"
"402","0.640101687","199.232.37.164","192.168.1.118","TLSv1.2","5474","Ignored Unknown Record"
"403","0.640160425","192.168.1.118","199.232.37.164","TCP","66","32802 → 443 [ACK] Seq=1 Ack=1206280 Win=12618 Len=0 TSval=1766437056 TSecr=2812515191"
"404","0.640429925","199.232.37.164","192.168.1.118","TLSv1.2","16290","Ignored Unknown Record"
"405","0.640493900","192.168.1.118","199.232.37.164","TCP","66","32802 → 443 [ACK] Seq=1 Ack=1222504 Win=12618 Len=0 TSval=1766437057 TSecr=2812515191"
"406","0.642345600","199.232.37.164","192.168.1.118","TLSv1.2","2770","Ignored Unknown Record"
"407","0.642405875","192.168.1.118","199.232.37.164","TCP","66","32802 → 443 [ACK] Seq=1 Ack=1225208 Win=12618 Len=0 TSval=1766437058 TSecr=2812515191"
"408","0.649142150","199.232.37.164","192.168.1.118","TLSv1.2","55498","Ignored Unknown Record"
"409","0.649273150","192.168.1.118","199.232.37.164","TCP","66","32802 → 443 [ACK] Seq=1 Ack=1280640 Win=12618 Len=0 TSval=1766437065 TSecr=2812515191"
"410","0.649381237","199.232.37.164","192.168.1.118","TLSv1.2","6826","Ignored Unknown Record"
"411","0.649460737","192.168.1.118","199.232.37.164","TCP","66","32802 → 443 [ACK] Seq=1 Ack=1287400 Win=12618 Len=0 TSval=1766437065 TSecr=2812515193"
"412","0.651715487","199.232.37.164","192.168.1.118","TLSv1.2","5474","Ignored Unknown Record"
"413","0.651793162","192.168.1.118","199.232.37.164","TCP","66","32802 → 443 [ACK] Seq=1 Ack=1292808 Win=12618 Len=0 TSval=1766437068 TSecr=2812515193"
"414","0.651880437","199.232.37.164","192.168.1.118","TLSv1.2","2770","Ignored Unknown Record"
"415","0.651982712","192.168.1.118","199.232.37.164","TCP","66","32802 → 443 [ACK] Seq=1 Ack=1295512 Win=12618 Len=0 TSval=1766437068 TSecr=2812515195"
"416","0.652305175","199.232.37.164","192.168.1.118","TLSv1.2","12234","Ignored Unknown Record"
"417","0.652390387","192.168.1.118","199.232.37.164","TCP","66","32802 → 443 [ACK] Seq=1 Ack=1307680 Win=12618 Len=0 TSval=1766437068 TSecr=2812515195"
"418","0.652443137","199.232.37.164","192.168.1.118","TLSv1.2","1418","Application Data [TCP segment of a reassembled PDU]"
"419","0.655264162","199.232.37.164","192.168.1.118","TLSv1.2","8178","Application Data, Application Data, Application Data, Application Data, Application Data, Application Data"
"420","0.655362125","192.168.1.118","199.232.37.164","TCP","66","32806 → 443 [ACK] Seq=1018 Ack=28667 Win=52864 Len=0 TSval=1766437071 TSecr=3144751111"
"421","0.655614162","199.232.37.164","192.168.1.118","TLSv1.2","1590","Application Data, Application Data"
"422","0.655696337","199.232.37.164","192.168.1.118","TLSv1.2","6826","Application Data, Application Data, Application Data, Application Data, Application Data"
"423","0.656618075","192.168.1.118","199.232.37.164","TCP","66","32808 → 443 [ACK] Seq=887 Ack=7207 Win=62720 Len=0 TSval=1766437073 TSecr=858402899"
"424","0.657006837","192.168.1.118","199.232.37.164","TCP","66","32806 → 443 [ACK] Seq=1018 Ack=35427 Win=46208 Len=0 TSval=1766437073 TSecr=3144751111"
"425","0.666834475","199.232.37.164","192.168.1.118","TLSv1.2","2770","Application Data, Application Data"
"426","0.666897675","192.168.1.118","199.232.37.164","TCP","66","32806 → 443 [ACK] Seq=1018 Ack=38131 Win=61056 Len=0 TSval=1766437083 TSecr=3144751111"
"427","0.666950762","199.232.37.164","192.168.1.118","TLSv1.2","5474","Ignored Unknown Record"
"428","0.667002362","192.168.1.118","199.232.37.164","TCP","66","32802 → 443 [ACK] Seq=1 Ack=1313088 Win=12618 Len=0 TSval=1766437083 TSecr=2812515197"
"429","0.672474925","199.232.37.164","192.168.1.118","TLSv1.2","16290","Ignored Unknown Record"
"430","0.672533887","192.168.1.118","199.232.37.164","TCP","66","32802 → 443 [ACK] Seq=1 Ack=1329312 Win=12618 Len=0 TSval=1766437089 TSecr=2812515197"
"431","0.674473625","199.232.37.164","192.168.1.118","TLSv1.2","2770","Ignored Unknown Record"
"432","0.674539025","192.168.1.118","199.232.37.164","TCP","66","32802 → 443 [ACK] Seq=1 Ack=1332016 Win=12618 Len=0 TSval=1766437091 TSecr=2812515197"
"433","0.674573562","199.232.37.164","192.168.1.118","TLSv1.2","2770","Application Data, Application Data"
"434","0.674624575","192.168.1.118","199.232.37.164","TCP","66","32806 → 443 [ACK] Seq=1018 Ack=40835 Win=69504 Len=0 TSval=1766437091 TSecr=3144751111"
"435","0.674893737","199.232.37.164","192.168.1.118","TLSv1.2","2770","Application Data [TCP segment of a reassembled PDU]"
"436","0.674966475","192.168.1.118","199.232.37.164","TCP","66","32806 → 443 [ACK] Seq=1018 Ack=43539 Win=75008 Len=0 TSval=1766437091 TSecr=3144751113"
"437","0.675000675","199.232.37.164","192.168.1.118","TLSv1.2","13586","Ignored Unknown Record"
"438","0.675055812","192.168.1.118","199.232.37.164","TCP","66","32802 → 443 [ACK] Seq=1 Ack=1345536 Win=12618 Len=0 TSval=1766437091 TSecr=2812515201"
"439","0.681967875","199.232.37.164","192.168.1.118","TLSv1.2","5474","Ignored Unknown Record"
"440","0.682039612","192.168.1.118","199.232.37.164","TCP","66","32802 → 443 [ACK] Seq=1 Ack=1350944 Win=12618 Len=0 TSval=1766437098 TSecr=2812515201"
"441","0.682236587","199.232.37.164","192.168.1.118","TLSv1.2","16290","Ignored Unknown Record"
"442","0.682278187","192.168.1.118","199.232.37.164","TCP","66","32802 → 443 [ACK] Seq=1 Ack=1367168 Win=12618 Len=0 TSval=1766437098 TSecr=2812515201"
"443","0.684130550","199.232.37.164","192.168.1.118","TCP","2770","[TCP segment of a reassembled PDU]"
"444","0.684159450","192.168.1.118","199.232.37.164","TCP","66","32802 → 443 [ACK] Seq=1 Ack=1369872 Win=12618 Len=0 TSval=1766437100 TSecr=2812515201"
"445","0.684365400","199.232.37.164","192.168.1.118","TCP","18994","443 → 32802 [ACK] Seq=1369872 Ack=1 Win=57 Len=18928 TSval=2812515201 TSecr=1766437068 [TCP segment of a reassembled PDU]"
"446","0.684400450","192.168.1.118","199.232.37.164","TCP","66","32802 → 443 [ACK] Seq=1 Ack=1388800 Win=12618 Len=0 TSval=1766437100 TSecr=2812515201"
"447","0.688092325","199.232.37.164","192.168.1.118","TCP","2770","443 → 32802 [ACK] Seq=1388800 Ack=1 Win=57 Len=2704 TSval=2812515201 TSecr=1766437068 [TCP segment of a reassembled PDU]"
"448","0.688153250","192.168.1.118","199.232.37.164","TCP","66","32802 → 443 [ACK] Seq=1 Ack=1391504 Win=12618 Len=0 TSval=1766437104 TSecr=2812515201"
"449","0.688316475","199.232.37.164","192.168.1.118","TLSv1.2","16290","Application Data, Ignored Unknown Record"
"450","0.688349912","192.168.1.118","199.232.37.164","TCP","66","32802 → 443 [ACK] Seq=1 Ack=1407728 Win=12618 Len=0 TSval=1766437104 TSecr=2812515201"
"451","0.688368175","199.232.37.164","192.168.1.118","TLSv1.2","2770","Application Data, Application Data"
"452","0.688396225","192.168.1.118","199.232.37.164","TCP","66","32806 → 443 [ACK] Seq=1018 Ack=46243 Win=80384 Len=0 TSval=1766437104 TSecr=3144751114"
"453","0.691158675","199.232.37.164","192.168.1.118","TLSv1.2","9530","Ignored Unknown Record"
"454","0.691188975","192.168.1.118","199.232.37.164","TCP","66","32802 → 443 [ACK] Seq=1 Ack=1417192 Win=12618 Len=0 TSval=1766437107 TSecr=2812515201"
"455","0.693065175","199.232.37.164","192.168.1.118","TLSv1.2","1418","Ignored Unknown Record"
"456","0.695274187","199.232.37.164","192.168.1.118","TLSv1.2","2770","Ignored Unknown Record"
"457","0.695312987","192.168.1.118","199.232.37.164","TCP","66","32802 → 443 [ACK] Seq=1 Ack=1421248 Win=12618 Len=0 TSval=1766437111 TSecr=2812515206"
"458","0.695463387","199.232.37.164","192.168.1.118","TLSv1.2","10882","Ignored Unknown Record"
"459","0.695495162","192.168.1.118","199.232.37.164","TCP","66","32802 → 443 [ACK] Seq=1 Ack=1432064 Win=12618 Len=0 TSval=1766437112 TSecr=2812515206"
"460","0.699628962","199.232.37.164","192.168.1.118","TLSv1.2","2770","Ignored Unknown Record"
"461","0.699672212","192.168.1.118","199.232.37.164","TCP","66","32802 → 443 [ACK] Seq=1 Ack=1434768 Win=12618 Len=0 TSval=1766437116 TSecr=2812515206"
"462","0.707690612","199.232.37.164","192.168.1.118","TLSv1.2","5474","Ignored Unknown Record"
"463","0.707767675","192.168.1.118","199.232.37.164","TCP","66","32802 → 443 [ACK] Seq=1 Ack=1440176 Win=12618 Len=0 TSval=1766437124 TSecr=2812515206"
"464","0.707947712","199.232.37.164","192.168.1.118","TLSv1.2","1418","Application Data [TCP segment of a reassembled PDU]"
"465","0.708069350","199.232.37.164","192.168.1.118","TLSv1.2","16290","Ignored Unknown Record"
"466","0.708120050","192.168.1.118","199.232.37.164","TCP","66","32802 → 443 [ACK] Seq=1 Ack=1456400 Win=12618 Len=0 TSval=1766437124 TSecr=2812515206"
"467","0.708149100","199.232.37.164","192.168.1.118","TLSv1.2","2770","Application Data, Application Data"
"468","0.708195512","192.168.1.118","199.232.37.164","TCP","66","32806 → 443 [ACK] Seq=1018 Ack=50299 Win=88448 Len=0 TSval=1766437124 TSecr=3144751122"
"469","0.733523775","199.232.37.164","192.168.1.118","TLSv1.2","1418","Ignored Unknown Record"
"470","0.733742975","199.232.37.164","192.168.1.118","TLSv1.2","1418","Ignored Unknown Record"
"471","0.733816512","192.168.1.118","199.232.37.164","TCP","66","32802 → 443 [ACK] Seq=1 Ack=1459104 Win=12618 Len=0 TSval=1766437150 TSecr=2812515206"
"472","0.734191125","199.232.37.164","192.168.1.118","TLSv1.2","2770","Application Data, Application Data"
"473","0.734258050","192.168.1.118","199.232.37.164","TCP","66","32806 → 443 [ACK] Seq=1018 Ack=53003 Win=93952 Len=0 TSval=1766437150 TSecr=3144751122"
"474","0.734300975","199.232.37.164","192.168.1.118","TLSv1.2","33866","Ignored Unknown Record"
"475","0.734386437","192.168.1.118","199.232.37.164","TCP","66","32802 → 443 [ACK] Seq=1 Ack=1492904 Win=12618 Len=0 TSval=1766437150 TSecr=2812515207"
"476","0.738394612","199.232.37.164","192.168.1.118","TLSv1.2","4122","Ignored Unknown Record"
"477","0.738461500","192.168.1.118","199.232.37.164","TCP","66","32802 → 443 [ACK] Seq=1 Ack=1496960 Win=12618 Len=0 TSval=1766437154 TSecr=2812515207"
"478","0.738549862","199.232.37.164","192.168.1.118","TLSv1.2","1418","Application Data [TCP segment of a reassembled PDU]"
"479","0.746575112","199.232.37.164","192.168.1.118","TLSv1.2","1418","Application Data [TCP segment of a reassembled PDU]"
"480","0.746645675","192.168.1.118","199.232.37.164","TCP","66","32806 → 443 [ACK] Seq=1018 Ack=55707 Win=99328 Len=0 TSval=1766437163 TSecr=3144751122"
"481","0.746732812","199.232.37.164","192.168.1.118","TLSv1.2","5474","Application Data, Application Data, Application Data, Application Data"
"482","0.746800950","192.168.1.118","199.232.37.164","TCP","66","32806 → 443 [ACK] Seq=1018 Ack=61115 Win=110080 Len=0 TSval=1766437163 TSecr=3144751123"
"483","0.746870100","199.232.37.164","192.168.1.118","TLSv1.2","18994","Ignored Unknown Record"
"484","0.746970412","192.168.1.118","199.232.37.164","TCP","66","32802 → 443 [ACK] Seq=1 Ack=1515888 Win=12618 Len=0 TSval=1766437163 TSecr=2812515207"
"485","0.747084912","199.232.37.164","192.168.1.118","TLSv1.2","2770","Application Data, Application Data"
"486","0.747173450","192.168.1.118","199.232.37.164","TCP","66","32806 → 443 [ACK] Seq=1018 Ack=63819 Win=115584 Len=0 TSval=1766437163 TSecr=3144751124"
"487","0.747215987","199.232.37.164","192.168.1.118","TLSv1.2","12234","Ignored Unknown Record"
"488","0.747290000","192.168.1.118","199.232.37.164","TCP","66","32802 → 443 [ACK] Seq=1 Ack=1528056 Win=12618 Len=0 TSval=1766437163 TSecr=2812515210"
"489","0.750720625","199.232.37.164","192.168.1.118","TLSv1.2","2770","Application Data, Application Data"
"490","0.750825462","192.168.1.118","199.232.37.164","TCP","66","32806 → 443 [ACK] Seq=1018 Ack=66523 Win=120960 Len=0 TSval=1766437167 TSecr=3144751125"
"491","0.750910675","199.232.37.164","192.168.1.118","TLSv1.2","4122","Ignored Unknown Record"
"492","0.751002375","192.168.1.118","199.232.37.164","TCP","66","32802 → 443 [ACK] Seq=1 Ack=1532112 Win=12618 Len=0 TSval=1766437167 TSecr=2812515210"
"493","0.751104225","199.232.37.164","192.168.1.118","TLSv1.2","2770","Application Data, Application Data"
"494","0.751168962","192.168.1.118","199.232.37.164","TCP","66","32806 → 443 [ACK] Seq=1018 Ack=69227 Win=126336 Len=0 TSval=1766437167 TSecr=3144751125"
"495","0.751210812","199.232.37.164","192.168.1.118","TLSv1.2","9530","Ignored Unknown Record"
"496","0.751277687","192.168.1.118","199.232.37.164","TCP","66","32802 → 443 [ACK] Seq=1 Ack=1541576 Win=12618 Len=0 TSval=1766437167 TSecr=2812515211"
"497","0.754406887","199.232.37.164","192.168.1.118","TLSv1.2","2770","Application Data, Application Data"
"498","0.754449562","192.168.1.118","199.232.37.164","TCP","66","32806 → 443 [ACK] Seq=1018 Ack=71931 Win=131712 Len=0 TSval=1766437170 TSecr=3144751126"
"499","0.754505612","199.232.37.164","192.168.1.118","TLSv1.2","1418","Ignored Unknown Record"
"500","0.754532200","199.232.37.164","192.168.1.118","TLSv1.2","4122","Application Data, Application Data, Application Data"
"501","0.754569762","192.168.1.118","199.232.37.164","TCP","66","32806 → 443 [ACK] Seq=1018 Ack=75987 Win=139904 Len=0 TSval=1766437171 TSecr=3144751127"
"502","0.754678662","199.232.37.164","192.168.1.118","TLSv1.2","1418","Application Data [TCP segment of a reassembled PDU]"
"503","0.754735275","199.232.37.164","192.168.1.118","TLSv1.2","2770","Application Data, Application Data"
"504","0.754774925","192.168.1.118","199.232.37.164","TCP","66","32806 → 443 [ACK] Seq=1018 Ack=80043 Win=147968 Len=0 TSval=1766437171 TSecr=3144751127"
"505","0.754847837","199.232.37.164","192.168.1.118","TLSv1.2","5474","Application Data, Application Data, Application Data"
"506","0.754889337","192.168.1.118","199.232.37.164","TCP","66","32806 → 443 [ACK] Seq=1018 Ack=85451 Win=158848 Len=0 TSval=1766437171 TSecr=3144751129"
"507","0.754957062","199.232.37.164","192.168.1.118","TLSv1.2","2770","Application Data, Application Data"
"508","0.754994750","192.168.1.118","199.232.37.164","TCP","66","32806 → 443 [ACK] Seq=1018 Ack=88155 Win=164224 Len=0 TSval=1766437171 TSecr=3144751130"
"509","0.755022525","199.232.37.164","192.168.1.118","TLSv1.2","1418","Application Data [TCP segment of a reassembled PDU]"
"510","0.757393412","199.232.37.164","192.168.1.118","TLSv1.2","5474","Application Data, Application Data, Application Data, Application Data"
"511","0.757436850","192.168.1.118","199.232.37.164","TCP","66","32806 → 443 [ACK] Seq=1018 Ack=94915 Win=177664 Len=0 TSval=1766437173 TSecr=3144751131"
"512","0.757462075","199.232.37.164","192.168.1.118","TLSv1.2","1166","Application Data, Application Data, Encrypted Alert"
"513","0.768731125","199.232.37.164","192.168.1.118","TLSv1.2","1418","Ignored Unknown Record"
"514","0.768787562","192.168.1.118","199.232.37.164","TCP","66","32802 → 443 [ACK] Seq=1 Ack=1544280 Win=12618 Len=0 TSval=1766437185 TSecr=2812515211"
"515","0.773839937","199.232.37.164","192.168.1.118","TLSv1.2","5474","Ignored Unknown Record"
"516","0.773898312","192.168.1.118","199.232.37.164","TCP","66","32802 → 443 [ACK] Seq=1 Ack=1549688 Win=12618 Len=0 TSval=1766437190 TSecr=2812515225"
"517","0.774209600","199.232.37.164","192.168.1.118","TLSv1.2","16290","Ignored Unknown Record"
"518","0.774274625","192.168.1.118","199.232.37.164","TCP","66","32802 → 443 [ACK] Seq=1 Ack=1565912 Win=12618 Len=0 TSval=1766437190 TSecr=2812515225"
"519","0.781227762","199.232.37.164","192.168.1.118","TLSv1.2","5474","Ignored Unknown Record"
"520","0.781307800","192.168.1.118","199.232.37.164","TCP","66","32802 → 443 [ACK] Seq=1 Ack=1571320 Win=12618 Len=0 TSval=1766437197 TSecr=2812515225"
"521","0.781651712","199.232.37.164","192.168.1.118","TLSv1.2","16290","Ignored Unknown Record"
"522","0.781725762","192.168.1.118","199.232.37.164","TCP","66","32802 → 443 [ACK] Seq=1 Ack=1587544 Win=12618 Len=0 TSval=1766437198 TSecr=2812515225"
"523","0.789722350","199.232.37.164","192.168.1.118","TLSv1.2","8178","Ignored Unknown Record"
"524","0.789792175","192.168.1.118","199.232.37.164","TCP","66","32802 → 443 [ACK] Seq=1 Ack=1595656 Win=12618 Len=0 TSval=1766437206 TSecr=2812515225"
"525","0.790039900","199.232.37.164","192.168.1.118","TLSv1.2","6826","Ignored Unknown Record"
"526","0.790105300","192.168.1.118","199.232.37.164","TCP","66","32802 → 443 [ACK] Seq=1 Ack=1602416 Win=12618 Len=0 TSval=1766437206 TSecr=2812515225"
"527","0.790305525","199.232.37.164","192.168.1.118","TLSv1.2","24402","Ignored Unknown Record"
"528","0.790379287","192.168.1.118","199.232.37.164","TCP","66","32802 → 443 [ACK] Seq=1 Ack=1626752 Win=12618 Len=0 TSval=1766437206 TSecr=2812515225"
"529","0.790443125","199.232.37.164","192.168.1.118","TLSv1.2","4122","Ignored Unknown Record"
"530","0.790504375","192.168.1.118","199.232.37.164","TCP","66","32802 → 443 [ACK] Seq=1 Ack=1630808 Win=12618 Len=0 TSval=1766437207 TSecr=2812515225"
"531","0.795643375","199.232.37.164","192.168.1.118","TLSv1.2","5474","Ignored Unknown Record"
"532","0.795709287","192.168.1.118","199.232.37.164","TCP","66","32802 → 443 [ACK] Seq=1 Ack=1636216 Win=12618 Len=0 TSval=1766437212 TSecr=2812515225"
"533","0.796034162","199.232.37.164","192.168.1.118","TLSv1.2","14938","Ignored Unknown Record"
"534","0.796098912","192.168.1.118","199.232.37.164","TCP","66","32802 → 443 [ACK] Seq=1 Ack=1651088 Win=12618 Len=0 TSval=1766437212 TSecr=2812515225"
"535","0.796140825","199.232.37.164","192.168.1.118","TLSv1.2","1418","Ignored Unknown Record"
"536","0.797964600","192.168.1.118","199.232.37.164","TCP","66","32806 → 443 [ACK] Seq=1018 Ack=96016 Win=180480 Len=0 TSval=1766437214 TSecr=3144751132"
"537","0.803972975","199.232.37.164","192.168.1.118","TLSv1.2","2770","Ignored Unknown Record"
"538","0.804026212","192.168.1.118","199.232.37.164","TCP","66","32802 → 443 [ACK] Seq=1 Ack=1655144 Win=12618 Len=0 TSval=1766437220 TSecr=2812515230"
"539","0.804155062","199.232.37.164","192.168.1.118","TLSv1.2","21698","Ignored Unknown Record"
"540","0.804215512","192.168.1.118","199.232.37.164","TCP","66","32802 → 443 [ACK] Seq=1 Ack=1676776 Win=12618 Len=0 TSval=1766437220 TSecr=2812515232"
"541","0.807883462","199.232.37.164","192.168.1.118","TCP","5474","[TCP segment of a reassembled PDU]"
"542","0.807960050","192.168.1.118","199.232.37.164","TCP","66","32802 → 443 [ACK] Seq=1 Ack=1682184 Win=12618 Len=0 TSval=1766437224 TSecr=2812515232"
"543","0.808218850","199.232.37.164","192.168.1.118","TCP","14938","443 → 32802 [ACK] Seq=1682184 Ack=1 Win=57 Len=14872 TSval=2812515232 TSecr=1766437198 [TCP segment of a reassembled PDU]"
"544","0.808278550","192.168.1.118","199.232.37.164","TCP","66","32802 → 443 [ACK] Seq=1 Ack=1697056 Win=12618 Len=0 TSval=1766437224 TSecr=2812515232"
"545","0.813685200","199.232.37.164","192.168.1.118","TCP","1418","443 → 32802 [ACK] Seq=1697056 Ack=1 Win=57 Len=1352 TSval=2812515236 TSecr=1766437207 [TCP segment of a reassembled PDU]"
"546","0.816481175","199.232.37.164","192.168.1.118","TCP","5474","443 → 32802 [ACK] Seq=1698408 Ack=1 Win=57 Len=5408 TSval=2812515236 TSecr=1766437207 [TCP segment of a reassembled PDU]"
"547","0.816548325","192.168.1.118","199.232.37.164","TCP","66","32802 → 443 [ACK] Seq=1 Ack=1703816 Win=12618 Len=0 TSval=1766437233 TSecr=2812515236"
"548","0.816846525","199.232.37.164","192.168.1.118","TCP","13586","443 → 32802 [ACK] Seq=1703816 Ack=1 Win=57 Len=13520 TSval=2812515236 TSecr=1766437207 [TCP segment of a reassembled PDU]"
"549","0.816942337","192.168.1.118","199.232.37.164","TCP","66","32802 → 443 [ACK] Seq=1 Ack=1717336 Win=12618 Len=0 TSval=1766437233 TSecr=2812515236"
"550","0.821734325","199.232.37.164","192.168.1.118","TCP","5474","443 → 32802 [ACK] Seq=1717336 Ack=1 Win=57 Len=5408 TSval=2812515236 TSecr=1766437207 [TCP segment of a reassembled PDU]"
"551","0.821807812","192.168.1.118","199.232.37.164","TCP","66","32802 → 443 [ACK] Seq=1 Ack=1722744 Win=12618 Len=0 TSval=1766437238 TSecr=2812515236"
"552","0.822190662","199.232.37.164","192.168.1.118","TLSv1.2","16290","Change Cipher Spec, Ignored Unknown Record"
"553","0.822281212","192.168.1.118","199.232.37.164","TCP","66","32802 → 443 [ACK] Seq=1 Ack=1738968 Win=12618 Len=0 TSval=1766437238 TSecr=2812515236"
"554","0.827023550","199.232.37.164","192.168.1.118","TLSv1.2","4122","Ignored Unknown Record"
"555","0.827079137","192.168.1.118","199.232.37.164","TCP","66","32802 → 443 [ACK] Seq=1 Ack=1743024 Win=12618 Len=0 TSval=1766437243 TSecr=2812515236"
"556","0.827118337","199.232.37.164","192.168.1.118","TLSv1.2","1418","Ignored Unknown Record"
"557","0.827350587","199.232.37.164","192.168.1.118","TLSv1.2","12234","Ignored Unknown Record"
"558","0.827407300","192.168.1.118","199.232.37.164","TCP","66","32802 → 443 [ACK] Seq=1 Ack=1756544 Win=12618 Len=0 TSval=1766437243 TSecr=2812515236"
"559","0.827499412","199.232.37.164","192.168.1.118","TLSv1.2","4122","Ignored Unknown Record"
"560","0.827549987","192.168.1.118","199.232.37.164","TCP","66","32802 → 443 [ACK] Seq=1 Ack=1760600 Win=12618 Len=0 TSval=1766437244 TSecr=2812515236"
"561","0.828895375","199.232.37.164","192.168.1.118","TLSv1.2","1418","Ignored Unknown Record"
"562","0.829352625","199.232.37.164","192.168.1.118","TLSv1.2","5474","Ignored Unknown Record"
"563","0.829405175","192.168.1.118","199.232.37.164","TCP","66","32802 → 443 [ACK] Seq=1 Ack=1767360 Win=12618 Len=0 TSval=1766437245 TSecr=2812515236"
"564","0.829596737","199.232.37.164","192.168.1.118","TLSv1.2","14938","Ignored Unknown Record"
"565","0.829654800","192.168.1.118","199.232.37.164","TCP","66","32802 → 443 [ACK] Seq=1 Ack=1782232 Win=12618 Len=0 TSval=1766437246 TSecr=2812515239"
"566","0.832520575","199.232.37.164","192.168.1.118","TLSv1.2","5474","Ignored Unknown Record"
"567","0.832580062","192.168.1.118","199.232.37.164","TCP","66","32802 → 443 [ACK] Seq=1 Ack=1787640 Win=12618 Len=0 TSval=1766437249 TSecr=2812515239"
"568","0.832722112","192.168.1.118","199.232.37.164","TLSv1.2","97","Encrypted Alert"
"569","0.832775025","199.232.37.164","192.168.1.118","TLSv1.2","6826","Ignored Unknown Record"
"570","0.832829287","192.168.1.118","199.232.37.164","TCP","66","32802 → 443 [ACK] Seq=1 Ack=1794400 Win=12618 Len=0 TSval=1766437249 TSecr=2812515239"
"571","0.834495025","192.168.1.118","199.232.37.164","TCP","66","32806 → 443 [RST, ACK] Seq=1049 Ack=96016 Win=180480 Len=0 TSval=1766437251 TSecr=3144751132"
"572","0.836034362","199.232.37.164","192.168.1.118","TLSv1.2","9530","Ignored Unknown Record"
"573","0.836099187","192.168.1.118","199.232.37.164","TCP","66","32802 → 443 [ACK] Seq=1 Ack=1803864 Win=12618 Len=0 TSval=1766437252 TSecr=2812515241"
"574","0.839365300","199.232.37.164","192.168.1.118","TLSv1.2","5474","Ignored Unknown Record"
"575","0.839420125","192.168.1.118","199.232.37.164","TCP","66","32802 → 443 [ACK] Seq=1 Ack=1809272 Win=12618 Len=0 TSval=1766437255 TSecr=2812515241"
"576","0.839676887","199.232.37.164","192.168.1.118","TLSv1.2","16290","Ignored Unknown Record"
"577","0.839735150","192.168.1.118","199.232.37.164","TCP","66","32802 → 443 [ACK] Seq=1 Ack=1825496 Win=12618 Len=0 TSval=1766437256 TSecr=2812515241"
"578","0.841501450","199.232.37.164","192.168.1.118","TLSv1.2","9530","Ignored Unknown Record"
"579","0.841557675","192.168.1.118","199.232.37.164","TCP","66","32802 → 443 [ACK] Seq=1 Ack=1834960 Win=12618 Len=0 TSval=1766437258 TSecr=2812515241"
"580","0.843028737","199.232.37.164","192.168.1.118","TLSv1.2","1418","Ignored Unknown Record"
"581","0.844676012","199.232.37.164","192.168.1.118","TCP","4122","443 → 32802 [ACK] Seq=1836312 Ack=1 Win=57 Len=4056 TSval=2812515244 TSecr=1766437249"
"582","0.844730700","192.168.1.118","199.232.37.164","TCP","66","32802 → 443 [ACK] Seq=1 Ack=1840368 Win=12618 Len=0 TSval=1766437261 TSecr=2812515244"
"583","0.848447362","199.232.37.164","192.168.1.118","TLSv1.2","25754","Ignored Unknown Record"
"584","0.848522237","192.168.1.118","199.232.37.164","TCP","66","32802 → 443 [ACK] Seq=1 Ack=1866056 Win=12618 Len=0 TSval=1766437265 TSecr=2812515244"
"585","0.858138937","199.232.37.164","192.168.1.118","TLSv1.2","33866","Ignored Unknown Record"
"586","0.858242487","192.168.1.118","199.232.37.164","TCP","66","32802 → 443 [ACK] Seq=1 Ack=1899856 Win=12618 Len=0 TSval=1766437274 TSecr=2812515244"
"587","0.858395262","199.232.37.164","192.168.1.118","TCP","54","443 → 32806 [RST] Seq=96016 Win=0 Len=0"
"588","0.858523712","199.232.37.164","192.168.1.118","TLSv1.2","29810","Encrypted Heartbeat, Ignored Unknown Record"
"589","0.858611500","192.168.1.118","199.232.37.164","TCP","66","32802 → 443 [ACK] Seq=1 Ack=1929600 Win=12618 Len=0 TSval=1766437275 TSecr=2812515245"
"590","0.860205750","199.232.37.164","192.168.1.118","TCP","8178","[TCP segment of a reassembled PDU]"
"591","0.860275450","192.168.1.118","199.232.37.164","TCP","66","32802 → 443 [ACK] Seq=1 Ack=1937712 Win=12618 Len=0 TSval=1766437276 TSecr=2812515245"
"592","0.860384425","199.232.37.164","192.168.1.118","TCP","4122","443 → 32802 [ACK] Seq=1937712 Ack=1 Win=57 Len=4056 TSval=2812515247 TSecr=1766437258 [TCP segment of a reassembled PDU]"
"593","0.860451250","192.168.1.118","199.232.37.164","TCP","66","32802 → 443 [ACK] Seq=1 Ack=1941768 Win=12618 Len=0 TSval=1766437276 TSecr=2812515247"
"594","0.866746725","199.232.37.164","192.168.1.118","TCP","5474","443 → 32802 [ACK] Seq=1941768 Ack=1 Win=57 Len=5408 TSval=2812515247 TSecr=1766437258 [TCP segment of a reassembled PDU]"
"595","0.866799537","192.168.1.118","199.232.37.164","TCP","66","32802 → 443 [ACK] Seq=1 Ack=1947176 Win=12618 Len=0 TSval=1766437283 TSecr=2812515247"
"596","0.872806412","199.232.37.164","192.168.1.118","TLSv1.2","5474","Encrypted Alert, Ignored Unknown Record"
"597","0.872858862","192.168.1.118","199.232.37.164","TCP","66","32802 → 443 [ACK] Seq=1 Ack=1952584 Win=12618 Len=0 TSval=1766437289 TSecr=2812515250"
"598","0.873134850","199.232.37.164","192.168.1.118","TLSv1.2","16290","Ignored Unknown Record"
"599","0.873192925","192.168.1.118","199.232.37.164","TCP","66","32802 → 443 [ACK] Seq=1 Ack=1968808 Win=12618 Len=0 TSval=1766437289 TSecr=2812515250"
"600","0.876354137","199.232.37.164","192.168.1.118","TLSv1.2","8178","Ignored Unknown Record"
"601","0.876427187","192.168.1.118","199.232.37.164","TCP","66","32802 → 443 [ACK] Seq=1 Ack=1976920 Win=12618 Len=0 TSval=1766437292 TSecr=2812515250"
"602","0.876613250","199.232.37.164","192.168.1.118","TLSv1.2","13586","Ignored Unknown Record"
"603","0.876657675","192.168.1.118","199.232.37.164","TCP","66","32802 → 443 [ACK] Seq=1 Ack=1990440 Win=12618 Len=0 TSval=1766437293 TSecr=2812515250"
"604","0.879422987","199.232.37.164","192.168.1.118","TLSv1.2","20346","Ignored Unknown Record"
"605","0.879504137","192.168.1.118","199.232.37.164","TCP","66","32802 → 443 [ACK] Seq=1 Ack=2010720 Win=12618 Len=0 TSval=1766437296 TSecr=2812515250"
"606","0.881674650","199.232.37.164","192.168.1.118","TLSv1.2","5474","Ignored Unknown Record"
"607","0.881748400","192.168.1.118","199.232.37.164","TCP","66","32802 → 443 [ACK] Seq=1 Ack=2016128 Win=12618 Len=0 TSval=1766437298 TSecr=2812515253"
"608","0.881960975","199.232.37.164","192.168.1.118","TLSv1.2","16290","Ignored Unknown Record"
"609","0.881999625","192.168.1.118","199.232.37.164","TCP","66","32802 → 443 [ACK] Seq=1 Ack=2032352 Win=12618 Len=0 TSval=1766437298 TSecr=2812515253"
"610","0.885992300","199.232.37.164","192.168.1.118","TLSv1.2","5474","Ignored Unknown Record"
"611","0.886068062","192.168.1.118","199.232.37.164","TCP","66","32802 → 443 [ACK] Seq=1 Ack=2037760 Win=12618 Len=0 TSval=1766437302 TSecr=2812515253"
"612","0.886286137","199.232.37.164","192.168.1.118","TLSv1.2","16290","Ignored Unknown Record"
"613","0.886325550","192.168.1.118","199.232.37.164","TCP","66","32802 → 443 [ACK] Seq=1 Ack=2053984 Win=12618 Len=0 TSval=1766437302 TSecr=2812515253"
"614","0.889365850","199.232.37.164","192.168.1.118","TLSv1.2","10882","Ignored Unknown Record"
"615","0.889425475","192.168.1.118","199.232.37.164","TCP","66","32802 → 443 [ACK] Seq=1 Ack=2064800 Win=12618 Len=0 TSval=1766437305 TSecr=2812515254"
"616","0.891950862","199.232.37.164","192.168.1.118","TLSv1.2","16290","Ignored Unknown Record"
"617","0.891971700","192.168.1.118","199.232.37.164","TCP","66","32802 → 443 [ACK] Seq=1 Ack=2081024 Win=12618 Len=0 TSval=1766437308 TSecr=2812515255"
"618","0.893233325","199.232.37.164","192.168.1.118","TLSv1.2","1418","Ignored Unknown Record"
"619","0.894741800","199.232.37.164","192.168.1.118","TLSv1.2","1418","Ignored Unknown Record"
"620","0.894757637","192.168.1.118","199.232.37.164","TCP","66","32802 → 443 [ACK] Seq=1 Ack=2083728 Win=12618 Len=0 TSval=1766437311 TSecr=2812515256"
"621","0.896030087","199.232.37.164","192.168.1.118","TLSv1.2","8178","Ignored Unknown Record"
"622","0.896055337","192.168.1.118","199.232.37.164","TCP","66","32802 → 443 [ACK] Seq=1 Ack=2091840 Win=12618 Len=0 TSval=1766437312 TSecr=2812515256"
"623","0.898701762","199.232.37.164","192.168.1.118","TLSv1.2","4122","Ignored Unknown Record"
"624","0.898728450","192.168.1.118","199.232.37.164","TCP","66","32802 → 443 [ACK] Seq=1 Ack=2095896 Win=12618 Len=0 TSval=1766437315 TSecr=2812515256"
"625","0.904769700","199.232.37.164","192.168.1.118","TLSv1.2","17642","Ignored Unknown Record"
"626","0.904827450","192.168.1.118","199.232.37.164","TCP","66","32802 → 443 [ACK] Seq=1 Ack=2113472 Win=12618 Len=0 TSval=1766437321 TSecr=2812515256"
"627","0.906850200","199.232.37.164","192.168.1.118","TLSv1.2","2770","Ignored Unknown Record"
"628","0.906876225","192.168.1.118","199.232.37.164","TCP","66","32802 → 443 [ACK] Seq=1 Ack=2116176 Win=12618 Len=0 TSval=1766437323 TSecr=2812515256"
"629","0.907071937","199.232.37.164","192.168.1.118","TLSv1.2","18994","Ignored Unknown Record"
"630","0.907104362","192.168.1.118","199.232.37.164","TCP","66","32802 → 443 [ACK] Seq=1 Ack=2135104 Win=12618 Len=0 TSval=1766437323 TSecr=2812515256"
"631","0.913123787","199.232.37.164","192.168.1.118","TLSv1.2","2770","Ignored Unknown Record"
"632","0.913149675","192.168.1.118","199.232.37.164","TCP","66","32802 → 443 [ACK] Seq=1 Ack=2137808 Win=12618 Len=0 TSval=1766437329 TSecr=2812515256"
"633","0.913322550","199.232.37.164","192.168.1.118","TLSv1.2","8178","Ignored Unknown Record"
"634","0.913363425","192.168.1.118","199.232.37.164","TCP","66","32802 → 443 [ACK] Seq=1 Ack=2145920 Win=12618 Len=0 TSval=1766437329 TSecr=2812515256"
"635","0.913474462","199.232.37.164","192.168.1.118","TLSv1.2","10882","Ignored Unknown Record"
"636","0.913517837","192.168.1.118","199.232.37.164","TCP","66","32802 → 443 [ACK] Seq=1 Ack=2156736 Win=12618 Len=0 TSval=1766437330 TSecr=2812515259"
"637","0.917235150","199.232.37.164","192.168.1.118","TLSv1.2","5474","Ignored Unknown Record"
"638","0.917274687","192.168.1.118","199.232.37.164","TCP","66","32802 → 443 [ACK] Seq=1 Ack=2162144 Win=12618 Len=0 TSval=1766437333 TSecr=2812515259"
"639","0.917463287","199.232.37.164","192.168.1.118","TLSv1.2","14938","Ignored Unknown Record"
"640","0.917509050","192.168.1.118","199.232.37.164","TCP","66","32802 → 443 [ACK] Seq=1 Ack=2177016 Win=12618 Len=0 TSval=1766437334 TSecr=2812515259"
"641","0.933306562","199.232.37.164","192.168.1.118","TLSv1.2","1418","Ignored Unknown Record"
"642","0.935385212","199.232.37.164","192.168.1.118","TLSv1.2","5474","Ignored Unknown Record"
"643","0.935455887","192.168.1.118","199.232.37.164","TCP","66","32802 → 443 [ACK] Seq=1 Ack=2183776 Win=12618 Len=0 TSval=1766437351 TSecr=2812515259"
"644","0.935719950","199.232.37.164","192.168.1.118","TLSv1.2","8178","Ignored Unknown Record"
"645","0.935788712","192.168.1.118","199.232.37.164","TCP","66","32802 → 443 [ACK] Seq=1 Ack=2191888 Win=12618 Len=0 TSval=1766437352 TSecr=2812515259"
"646","0.938866712","199.232.37.164","192.168.1.118","TLSv1.2","2770","Ignored Unknown Record"
"647","0.938955325","192.168.1.118","199.232.37.164","TCP","66","32802 → 443 [ACK] Seq=1 Ack=2194592 Win=12618 Len=0 TSval=1766437355 TSecr=2812515259"
"648","0.939024875","199.232.37.164","192.168.1.118","TLSv1.2","2770","Ignored Unknown Record"
"649","0.939089050","192.168.1.118","199.232.37.164","TCP","66","32802 → 443 [ACK] Seq=1 Ack=2197296 Win=12618 Len=0 TSval=1766437355 TSecr=2812515261"
"650","0.939176025","199.232.37.164","192.168.1.118","TLSv1.2","2770","Ignored Unknown Record"
"651","0.939240025","192.168.1.118","199.232.37.164","TCP","66","32802 → 443 [ACK] Seq=1 Ack=2200000 Win=12618 Len=0 TSval=1766437355 TSecr=2812515263"
"652","0.945076425","199.232.37.164","192.168.1.118","TLSv1.2","5474","Ignored Unknown Record"
"653","0.945144650","192.168.1.118","199.232.37.164","TCP","66","32802 → 443 [ACK] Seq=1 Ack=2205408 Win=12618 Len=0 TSval=1766437361 TSecr=2812515263"
"654","0.945421287","199.232.37.164","192.168.1.118","TLSv1.2","5474","Ignored Unknown Record"
"655","0.945489575","192.168.1.118","199.232.37.164","TCP","66","32802 → 443 [ACK] Seq=1 Ack=2210816 Win=12618 Len=0 TSval=1766437362 TSecr=2812515267"
"656","0.952265487","199.232.37.164","192.168.1.118","TLSv1.2","54146","Ignored Unknown Record"
"657","0.952365025","192.168.1.118","199.232.37.164","TCP","66","32802 → 443 [ACK] Seq=1 Ack=2264896 Win=12618 Len=0 TSval=1766437368 TSecr=2812515267"
"658","0.954487675","199.232.37.164","192.168.1.118","TLSv1.2","5474","Ignored Unknown Record"
"659","0.954544225","192.168.1.118","199.232.37.164","TCP","66","32802 → 443 [ACK] Seq=1 Ack=2270304 Win=12618 Len=0 TSval=1766437371 TSecr=2812515267"
"660","0.954702687","199.232.37.164","192.168.1.118","TLSv1.2","5474","Ignored Unknown Record"
"661","0.954756100","192.168.1.118","199.232.37.164","TCP","66","32802 → 443 [ACK] Seq=1 Ack=2275712 Win=12618 Len=0 TSval=1766437371 TSecr=2812515267"
"662","0.954904437","199.232.37.164","192.168.1.118","TLSv1.2","10882","Ignored Unknown Record"
"663","0.954979900","192.168.1.118","199.232.37.164","TCP","66","32802 → 443 [ACK] Seq=1 Ack=2286528 Win=12618 Len=0 TSval=1766437371 TSecr=2812515269"
"664","0.956336000","199.232.37.164","192.168.1.118","TLSv1.2","584","Ignored Unknown Record"
"665","0.997008612","192.168.1.118","199.232.37.164","TCP","66","32802 → 443 [ACK] Seq=1 Ack=2287046 Win=12618 Len=0 TSval=1766437413 TSecr=2812515269"
"666","2.064416037","192.168.1.118","192.168.1.102","TCP","176","44768 → 8009 [PSH, ACK] Seq=1 Ack=1 Win=501 Len=110 TSval=2258159940 TSecr=5268198 [TCP segment of a reassembled PDU]"
"667","2.071840637","192.168.1.102","192.168.1.118","TCP","176","8009 → 44768 [PSH, ACK] Seq=1 Ack=111 Win=294 Len=110 TSval=5268699 TSecr=2258159940 [TCP segment of a reassembled PDU]"
"668","2.072072137","192.168.1.118","192.168.1.102","TCP","66","44768 → 8009 [ACK] Seq=111 Ack=111 Win=501 Len=0 TSval=2258159948 TSecr=5268699"
"669","3.591160375","192.168.1.104","255.255.255.255","UDP","217","49154 → 6666 Len=175"
"670","4.217367075","192.168.1.101","224.0.0.251","MDNS","414","Standard query 0x0000 PTR _googlecast._tcp.local, "QM" question PTR _homekit._tcp.local, "QM" question PTR _uscan._tcp.local, "QM" question PTR _ptp._tcp.local, "QM" question PTR _ippusb._tcp.local, "QM" question PTR _scanner._tcp.local, "QM" question PTR _ipp._tcp.local, "QM" question PTR _pdl-datastream._tcp.local, "QM" question PTR _uscans._tcp.local, "QM" question PTR _ipps._tcp.local, "QM" question PTR _printer._tcp.local, "QM" question PTR _airplay._tcp.local, "QM" question PTR _raop._tcp.local, "QM" question PTR _airport._tcp.local, "QM" question PTR _companion-link._tcp.local, "QM" question PTR _rdlink._tcp.local, "QM" question PTR Google-Home-Mini-2c3f16b2da5c4b6fd6cfbfba61c12490._googlecast._tcp.local PTR cjqg._companion-link._tcp.local OPT"
"671","4.310577900","192.168.1.100","224.0.0.251","MDNS","408","Standard query 0x0000 PTR _googlecast._tcp.local, "QM" question PTR _homekit._tcp.local, "QM" question PTR _uscan._tcp.local, "QM" question PTR _ptp._tcp.local, "QM" question PTR _ippusb._tcp.local, "QM" question PTR _scanner._tcp.local, "QM" question PTR _ipp._tcp.local, "QM" question PTR _pdl-datastream._tcp.local, "QM" question PTR _uscans._tcp.local, "QM" question PTR _ipps._tcp.local, "QM" question PTR _printer._tcp.local, "QM" question PTR _airplay._tcp.local, "QM" question PTR _raop._tcp.local, "QM" question PTR _airport._tcp.local, "QM" question PTR _companion-link._tcp.local, "QM" question PTR _rdlink._tcp.local, "QM" question PTR Google-Home-Mini-2c3f16b2da5c4b6fd6cfbfba61c12490._googlecast._tcp.local PTR cjqg._companion-link._tcp.local OPT"
"672","6.561423225","192.168.1.104","255.255.255.255","UDP","217","49154 → 6666 Len=175"
"673","7.076693387","192.168.1.118","192.168.1.102","TCP","176","44768 → 8009 [PSH, ACK] Seq=111 Ack=111 Win=501 Len=110 TSval=2258164953 TSecr=5268699 [TCP segment of a reassembled PDU]"
"674","7.083094337","192.168.1.102","192.168.1.118","TCP","176","8009 → 44768 [PSH, ACK] Seq=111 Ack=221 Win=294 Len=110 TSval=5269200 TSecr=2258164953 [TCP segment of a reassembled PDU]"
"675","7.083283912","192.168.1.118","192.168.1.102","TCP","66","44768 → 8009 [ACK] Seq=221 Ack=221 Win=501 Len=0 TSval=2258164959 TSecr=5269200"
"676","9.530238862","192.168.1.104","255.255.255.255","UDP","217","49154 → 6666 Len=175"
