frame.number,_ws.col.Time,_ws.col.Source,_ws.col.Destination,_ws.col.Protocol,frame.len,_ws.col.Info
"1","0.000000000","199.232.37.224","192.168.1.118","TCP","1418","[TCP segment of a reassembled PDU]"
"2","0.002950450","199.232.37.224","192.168.1.118","TLSv1.2","266","Application Data, Application Data, Application Data, Application Data, Application Data"
"3","0.003005150","199.232.37.224","192.168.1.118","TLSv1.2","1418","Application Data"
"4","0.003131575","192.168.1.118","199.232.37.224","TCP","66","38952 → 443 [ACK] Seq=1 Ack=2905 Win=479 Len=0 TSval=1343354569 TSecr=2814247532"
"5","0.003711525","199.232.37.224","192.168.1.118","TLSv1.2","2770","Application Data, Application Data"
"6","0.004058638","192.168.1.118","199.232.37.224","TCP","66","38952 → 443 [ACK] Seq=1 Ack=5609 Win=458 Len=0 TSval=1343354569 TSecr=2814247532"
"7","0.007362063","199.232.37.224","192.168.1.118","TLSv1.2","2770","Application Data, Application Data"
"8","0.007876788","192.168.1.118","199.232.37.224","TCP","66","38952 → 443 [ACK] Seq=1 Ack=8313 Win=437 Len=0 TSval=1343354573 TSecr=2814247532"
"9","0.008022000","199.232.37.224","192.168.1.118","TLSv1.2","2770","Application Data, Application Data"
"10","0.008136350","192.168.1.118","199.232.37.224","TCP","66","38952 → 443 [ACK] Seq=1 Ack=11017 Win=416 Len=0 TSval=1343354574 TSecr=2814247532"
"11","0.011634625","199.232.37.224","192.168.1.118","TLSv1.2","764","Application Data, Application Data, Application Data"
"12","0.015378763","199.232.37.224","192.168.1.118","TLSv1.2","1418","Application Data"
"13","0.022134713","199.232.37.224","192.168.1.118","TLSv1.2","1418","Application Data [TCP segment of a reassembled PDU]"
"14","0.024083600","199.232.37.224","192.168.1.118","TLSv1.2","2770","Application Data, Application Data"
"15","0.024251750","199.232.37.224","192.168.1.118","TLSv1.2","1418","Application Data [TCP segment of a reassembled PDU]"
"16","0.024303875","199.232.37.224","192.168.1.118","TLSv1.2","10882","Application Data, Application Data, Application Data, Application Data, Application Data, Application Data, Application Data, Application Data"
"17","0.025850063","192.168.1.118","199.232.37.224","TCP","66","38952 → 443 [ACK] Seq=1 Ack=29291 Win=274 Len=0 TSval=1343354591 TSecr=2814247532"
"18","0.026190463","192.168.1.118","199.232.37.224","TCP","74","38974 → 443 [SYN] Seq=0 Win=64240 Len=0 MSS=1460 SACK_PERM=1 TSval=1343354592 TSecr=0 WS=128"
"19","0.026310538","192.168.1.118","199.232.37.224","TCP","74","38976 → 443 [SYN] Seq=0 Win=64240 Len=0 MSS=1460 SACK_PERM=1 TSval=1343354592 TSecr=0 WS=128"
"20","0.026414438","192.168.1.118","199.232.37.224","TCP","74","38978 → 443 [SYN] Seq=0 Win=64240 Len=0 MSS=1460 SACK_PERM=1 TSval=1343354592 TSecr=0 WS=128"
"21","0.026489988","192.168.1.118","104.102.89.129","TCP","66","45826 → 80 [FIN, ACK] Seq=1 Ack=1 Win=501 Len=0 TSval=1507435352 TSecr=4092805660"
"22","0.026675188","192.168.1.118","199.232.37.224","TCP","74","38980 → 443 [SYN] Seq=0 Win=64240 Len=0 MSS=1460 SACK_PERM=1 TSval=1343354592 TSecr=0 WS=128"
"23","0.032086275","199.232.37.224","192.168.1.118","TLSv1.2","1418","Application Data [TCP segment of a reassembled PDU]"
"24","0.032821000","199.232.37.224","192.168.1.118","TLSv1.2","1418","Application Data [TCP segment of a reassembled PDU]"
"25","0.034161988","199.232.37.224","192.168.1.118","TLSv1.2","1418","Application Data [TCP segment of a reassembled PDU]"
"26","0.034921775","199.232.37.224","192.168.1.118","TLSv1.2","1418","Application Data [TCP segment of a reassembled PDU]"
"27","0.035217438","192.168.1.118","199.232.37.224","TCP","66","38952 → 443 [ACK] Seq=1 Ack=34699 Win=232 Len=0 TSval=1343354601 TSecr=2814247556"
"28","0.039412863","199.232.37.224","192.168.1.118","TLSv1.2","1418","Application Data [TCP segment of a reassembled PDU]"
"29","0.042964863","199.232.37.224","192.168.1.118","TLSv1.2","1418","Application Data, Application Data, Application Data"
"30","0.042995125","192.168.1.118","199.232.37.224","TCP","66","38952 → 443 [ACK] Seq=1 Ack=37403 Win=285 Len=0 TSval=1343354608 TSecr=2814247557"
"31","0.046301375","199.232.37.224","192.168.1.118","TLSv1.2","2770","Application Data, Application Data"
"32","0.050093988","199.232.37.224","192.168.1.118","TLSv1.2","2770","Application Data, Application Data"
"33","0.050174088","199.232.37.224","192.168.1.118","TCP","74","443 → 38974 [SYN, ACK] Seq=0 Ack=1 Win=27040 Len=0 MSS=1364 SACK_PERM=1 TSval=3252549151 TSecr=1343354592 WS=512"
"34","0.050234575","192.168.1.118","199.232.37.224","TCP","66","38974 → 443 [ACK] Seq=1 Ack=1 Win=64256 Len=0 TSval=1343354616 TSecr=3252549151"
"35","0.050265338","199.232.37.224","192.168.1.118","TCP","74","443 → 38976 [SYN, ACK] Seq=0 Ack=1 Win=27040 Len=0 MSS=1364 SACK_PERM=1 TSval=2813152720 TSecr=1343354592 WS=512"
"36","0.050299763","192.168.1.118","199.232.37.224","TCP","66","38976 → 443 [ACK] Seq=1 Ack=1 Win=64256 Len=0 TSval=1343354616 TSecr=2813152720"
"37","0.050334888","199.232.37.224","192.168.1.118","TLSv1.2","3828","Application Data, Application Data, Application Data, Application Data, Application Data"
"38","0.052803775","199.232.37.224","192.168.1.118","TCP","74","443 → 38978 [SYN, ACK] Seq=0 Ack=1 Win=27040 Len=0 MSS=1364 SACK_PERM=1 TSval=2811258041 TSecr=1343354592 WS=512"
"39","0.052837663","192.168.1.118","199.232.37.224","TCP","66","38978 → 443 [ACK] Seq=1 Ack=1 Win=64256 Len=0 TSval=1343354618 TSecr=2811258041"
"40","0.052861400","199.232.37.224","192.168.1.118","TCP","74","443 → 38980 [SYN, ACK] Seq=0 Ack=1 Win=27040 Len=0 MSS=1364 SACK_PERM=1 TSval=3146121954 TSecr=1343354592 WS=512"
"41","0.052893463","192.168.1.118","199.232.37.224","TCP","66","38980 → 443 [ACK] Seq=1 Ack=1 Win=64256 Len=0 TSval=1343354618 TSecr=3146121954"
"42","0.061223650","104.102.89.129","192.168.1.118","TCP","66","80 → 45826 [FIN, ACK] Seq=1 Ack=2 Win=235 Len=0 TSval=4092806425 TSecr=1507435352"
"43","0.061271088","192.168.1.118","104.102.89.129","TCP","66","45826 → 80 [ACK] Seq=2 Ack=2 Win=501 Len=0 TSval=1507435387 TSecr=4092806425"
"44","0.062855438","192.168.1.118","199.232.37.224","TCP","66","38952 → 443 [ACK] Seq=1 Ack=46573 Win=214 Len=0 TSval=1343354628 TSecr=2814247557"
"45","0.079580913","192.168.1.118","199.232.37.224","TLSv1","583","Client Hello"
"46","0.093643750","199.232.37.224","192.168.1.118","TCP","66","443 → 38974 [ACK] Seq=1 Ack=518 Win=28160 Len=0 TSval=3252549164 TSecr=1343354645"
"47","0.096148575","192.168.1.118","199.232.37.224","TLSv1","583","Client Hello"
"48","0.096851438","199.232.37.224","192.168.1.118","TLSv1.2","1418","Server Hello"
"49","0.096936913","192.168.1.118","199.232.37.224","TCP","66","38974 → 443 [ACK] Seq=518 Ack=1353 Win=63104 Len=0 TSval=1343354662 TSecr=3252549164"
"50","0.101642625","199.232.37.224","192.168.1.118","TLSv1.2","2399","Certificate, Server Key Exchange, Server Hello Done"
"51","0.101729050","192.168.1.118","199.232.37.224","TCP","66","38974 → 443 [ACK] Seq=518 Ack=3686 Win=60800 Len=0 TSval=1343354667 TSecr=3252549164"
"52","0.112636413","192.168.1.118","199.232.37.224","TLSv1","583","Client Hello"
"53","0.117756338","199.232.37.224","192.168.1.118","TCP","66","443 → 38976 [ACK] Seq=1 Ack=518 Win=28160 Len=0 TSval=2813152738 TSecr=1343354662"
"54","0.119317175","199.232.37.224","192.168.1.118","TLSv1.2","1418","Server Hello"
"55","0.119397175","192.168.1.118","199.232.37.224","TCP","66","38976 → 443 [ACK] Seq=518 Ack=1353 Win=63104 Len=0 TSval=1343354685 TSecr=2813152739"
"56","0.121182738","199.232.37.224","192.168.1.118","TLSv1.2","2399","Certificate, Server Key Exchange, Server Hello Done"
"57","0.121281763","192.168.1.118","199.232.37.224","TCP","66","38976 → 443 [ACK] Seq=518 Ack=3686 Win=60800 Len=0 TSval=1343354687 TSecr=2813152739"
"58","0.129113875","192.168.1.118","199.232.37.224","TLSv1","583","Client Hello"
"59","0.130377775","192.168.1.118","209.18.47.62","DNS","76","Standard query 0xe270 A i.etsystatic.com"
"60","0.131121563","192.168.1.118","209.18.47.62","DNS","76","Standard query 0x0eb2 A i.etsystatic.com"
"61","0.131878663","192.168.1.118","209.18.47.62","DNS","76","Standard query 0x5ef0 A i.etsystatic.com"
"62","0.132278250","192.168.1.118","199.232.37.224","TLSv1.2","192","Client Key Exchange, Change Cipher Spec, Encrypted Handshake Message"
"63","0.132950388","192.168.1.118","209.18.47.62","DNS","76","Standard query 0x8a54 A i.etsystatic.com"
"64","0.133787663","192.168.1.118","209.18.47.62","DNS","76","Standard query 0xf227 A i.etsystatic.com"
"65","0.134289388","192.168.1.118","199.232.37.224","TLSv1.2","192","Client Key Exchange, Change Cipher Spec, Encrypted Handshake Message"
"66","0.134637713","199.232.37.224","192.168.1.118","TCP","66","443 → 38978 [ACK] Seq=1 Ack=518 Win=28160 Len=0 TSval=2811258063 TSecr=1343354678"
"67","0.137188038","199.232.37.224","192.168.1.118","TLSv1.2","1418","Server Hello"
"68","0.137253088","192.168.1.118","199.232.37.224","TCP","66","38978 → 443 [ACK] Seq=518 Ack=1353 Win=63104 Len=0 TSval=1343354703 TSecr=2811258063"
"69","0.141975125","199.232.37.224","192.168.1.118","TLSv1.2","2399","Certificate, Server Key Exchange, Server Hello Done"
"70","0.142009375","192.168.1.118","199.232.37.224","TCP","66","38978 → 443 [ACK] Seq=518 Ack=3686 Win=60800 Len=0 TSval=1343354707 TSecr=2811258063"
"71","0.151152975","192.168.1.118","199.232.37.224","TLSv1.2","192","Client Key Exchange, Change Cipher Spec, Encrypted Handshake Message"
"72","0.156127413","209.18.47.62","192.168.1.118","DNS","125","Standard query response 0x8a54 A i.etsystatic.com CNAME etsy.map.fastly.net A 199.232.37.224"
"73","0.156316375","192.168.1.118","209.18.47.62","DNS","76","Standard query 0x7eb1 AAAA i.etsystatic.com"
"74","0.157571338","209.18.47.62","192.168.1.118","DNS","125","Standard query response 0xf227 A i.etsystatic.com CNAME etsy.map.fastly.net A 199.232.37.224"
"75","0.157726200","192.168.1.118","209.18.47.62","DNS","76","Standard query 0xd256 AAAA i.etsystatic.com"
"76","0.158970700","209.18.47.62","192.168.1.118","DNS","125","Standard query response 0xe270 A i.etsystatic.com CNAME etsy.map.fastly.net A 199.232.37.224"
"77","0.159025988","199.232.37.224","192.168.1.118","TLSv1.2","117","Change Cipher Spec, Encrypted Handshake Message"
"78","0.159179325","192.168.1.118","209.18.47.62","DNS","76","Standard query 0x52fd AAAA i.etsystatic.com"
"79","0.161889713","192.168.1.118","199.232.37.224","TLSv1.2","792","Application Data"
"80","0.164158300","209.18.47.62","192.168.1.118","DNS","125","Standard query response 0x0eb2 A i.etsystatic.com CNAME etsy.map.fastly.net A 199.232.37.224"
"81","0.164243338","209.18.47.62","192.168.1.118","DNS","125","Standard query response 0x5ef0 A i.etsystatic.com CNAME etsy.map.fastly.net A 199.232.37.224"
"82","0.164310988","199.232.37.224","192.168.1.118","TCP","66","443 → 38980 [ACK] Seq=1 Ack=518 Win=28160 Len=0 TSval=3146121981 TSecr=1343354695"
"83","0.164407138","199.232.37.224","192.168.1.118","TLSv1.2","2770","Server Hello"
"84","0.164472213","192.168.1.118","199.232.37.224","TCP","66","38980 → 443 [ACK] Seq=518 Ack=2705 Win=61568 Len=0 TSval=1343354730 TSecr=3146121981"
"85","0.164710400","192.168.1.118","209.18.47.62","DNS","76","Standard query 0xd26b AAAA i.etsystatic.com"
"86","0.165323613","192.168.1.118","209.18.47.62","DNS","76","Standard query 0x86e8 AAAA i.etsystatic.com"
"87","0.165785025","199.232.37.224","192.168.1.118","TLSv1.2","1047","Certificate, Server Key Exchange, Server Hello Done"
"88","0.165847725","192.168.1.118","199.232.37.224","TCP","66","38980 → 443 [ACK] Seq=518 Ack=3686 Win=60672 Len=0 TSval=1343354731 TSecr=3146121981"
"89","0.170706200","192.168.1.118","199.232.37.224","TLSv1.2","192","Client Key Exchange, Change Cipher Spec, Encrypted Handshake Message"
"90","0.172011150","192.168.1.118","209.18.47.62","DNS","73","Standard query 0xe6c0 A blog.etsy.com"
"91","0.172330950","209.18.47.62","192.168.1.118","DNS","167","Standard query response 0x7eb1 AAAA i.etsystatic.com CNAME etsy.map.fastly.net SOA ns1.fastly.net"
"92","0.173278300","192.168.1.118","209.18.47.62","DNS","73","Standard query 0x3634 A blog.etsy.com"
"93","0.173612600","199.232.37.224","192.168.1.118","TLSv1.2","117","Change Cipher Spec, Encrypted Handshake Message"
"94","0.173754413","192.168.1.118","209.18.47.62","DNS","73","Standard query 0xe65e A blog.etsy.com"
"95","0.175258913","192.168.1.118","199.232.37.224","TLSv1.2","621","Application Data"
"96","0.175475038","192.168.1.118","199.232.37.224","TCP","74","38982 → 443 [SYN] Seq=0 Win=64240 Len=0 MSS=1460 SACK_PERM=1 TSval=1343354741 TSecr=0 WS=128"
"97","0.175613863","192.168.1.118","199.232.37.224","TCP","74","38984 → 443 [SYN] Seq=0 Win=64240 Len=0 MSS=1460 SACK_PERM=1 TSval=1343354741 TSecr=0 WS=128"
"98","0.175866988","192.168.1.118","199.232.37.224","TCP","74","38986 → 443 [SYN] Seq=0 Win=64240 Len=0 MSS=1460 SACK_PERM=1 TSval=1343354741 TSecr=0 WS=128"
"99","0.175942750","192.168.1.118","199.232.37.224","TCP","74","38988 → 443 [SYN] Seq=0 Win=64240 Len=0 MSS=1460 SACK_PERM=1 TSval=1343354741 TSecr=0 WS=128"
"100","0.176013863","192.168.1.118","199.232.37.224","TCP","74","38990 → 443 [SYN] Seq=0 Win=64240 Len=0 MSS=1460 SACK_PERM=1 TSval=1343354741 TSecr=0 WS=128"
"101","0.182319563","209.18.47.62","192.168.1.118","DNS","167","Standard query response 0xd256 AAAA i.etsystatic.com CNAME etsy.map.fastly.net SOA ns1.fastly.net"
"102","0.183318475","209.18.47.62","192.168.1.118","DNS","167","Standard query response 0x52fd AAAA i.etsystatic.com CNAME etsy.map.fastly.net SOA ns1.fastly.net"
"103","0.186400550","209.18.47.62","192.168.1.118","DNS","167","Standard query response 0xd26b AAAA i.etsystatic.com CNAME etsy.map.fastly.net SOA ns1.fastly.net"
"104","0.186453463","209.18.47.62","192.168.1.118","DNS","167","Standard query response 0x86e8 AAAA i.etsystatic.com CNAME etsy.map.fastly.net SOA ns1.fastly.net"
"105","0.186503650","199.232.37.224","192.168.1.118","TLSv1.2","1418","Application Data"
"106","0.191353000","192.168.1.118","199.232.37.224","TCP","66","[TCP Window Update] 38952 → 443 [ACK] Seq=1 Ack=46573 Win=429 Len=0 TSval=1343354757 TSecr=2814247557"
"107","0.191583613","199.232.37.224","192.168.1.118","TLSv1.2","5474","Application Data, Application Data, Application Data, Application Data"
"108","0.191737600","192.168.1.118","199.232.37.224","TCP","66","38974 → 443 [ACK] Seq=1370 Ack=10497 Win=57472 Len=0 TSval=1343354757 TSecr=3252549186"
"109","0.191836363","199.232.37.224","192.168.1.118","TLSv1.2","6826","Application Data, Application Data, Application Data, Application Data, Application Data"
"110","0.193404438","192.168.1.118","199.232.37.224","TCP","66","38974 → 443 [ACK] Seq=1370 Ack=17257 Win=50816 Len=0 TSval=1343354759 TSecr=3252549186"
"111","0.195597688","209.18.47.62","192.168.1.118","DNS","89","Standard query response 0xe6c0 A blog.etsy.com A 104.196.190.179"
"112","0.195667000","199.232.37.224","192.168.1.118","TLSv1.2","117","Change Cipher Spec, Encrypted Handshake Message"
"113","0.195718600","209.18.47.62","192.168.1.118","DNS","89","Standard query response 0xe65e A blog.etsy.com A 104.196.190.179"
"114","0.195773525","199.232.37.224","192.168.1.118","TLSv1.2","933","Application Data, Application Data"
"115","0.195824875","199.232.37.224","192.168.1.118","TLSv1.2","117","Change Cipher Spec, Encrypted Handshake Message"
"116","0.195871350","209.18.47.62","192.168.1.118","DNS","89","Standard query response 0x3634 A blog.etsy.com A 104.196.190.179"
"117","0.195920538","199.232.37.224","192.168.1.118","TCP","74","443 → 38982 [SYN, ACK] Seq=0 Ack=1 Win=27040 Len=0 MSS=1364 SACK_PERM=1 TSval=3144113174 TSecr=1343354741 WS=512"
"118","0.196005988","192.168.1.118","199.232.37.224","TCP","66","38982 → 443 [ACK] Seq=1 Ack=1 Win=64256 Len=0 TSval=1343354761 TSecr=3144113174"
"119","0.196205413","192.168.1.118","209.18.47.62","DNS","73","Standard query 0x3e91 AAAA blog.etsy.com"
"120","0.196351763","192.168.1.118","209.18.47.62","DNS","73","Standard query 0xe665 AAAA blog.etsy.com"
"121","0.196490263","192.168.1.118","209.18.47.62","DNS","73","Standard query 0xaebc AAAA blog.etsy.com"
"122","0.203023725","199.232.37.224","192.168.1.118","TCP","74","443 → 38986 [SYN, ACK] Seq=0 Ack=1 Win=27040 Len=0 MSS=1364 SACK_PERM=1 TSval=3144113178 TSecr=1343354741 WS=512"
"123","0.203114913","192.168.1.118","199.232.37.224","TCP","66","38986 → 443 [ACK] Seq=1 Ack=1 Win=64256 Len=0 TSval=1343354769 TSecr=3144113178"
"124","0.204956575","199.232.37.224","192.168.1.118","TCP","74","443 → 38988 [SYN, ACK] Seq=0 Ack=1 Win=27040 Len=0 MSS=1364 SACK_PERM=1 TSval=2773107696 TSecr=1343354741 WS=512"
"125","0.205019738","192.168.1.118","199.232.37.224","TCP","66","38988 → 443 [ACK] Seq=1 Ack=1 Win=64256 Len=0 TSval=1343354770 TSecr=2773107696"
"126","0.206251088","199.232.37.224","192.168.1.118","TCP","74","443 → 38984 [SYN, ACK] Seq=0 Ack=1 Win=27040 Len=0 MSS=1364 SACK_PERM=1 TSval=2814247598 TSecr=1343354741 WS=512"
"127","0.206330638","192.168.1.118","199.232.37.224","TCP","66","38984 → 443 [ACK] Seq=1 Ack=1 Win=64256 Len=0 TSval=1343354772 TSecr=2814247598"
"128","0.206386088","199.232.37.224","192.168.1.118","TCP","74","443 → 38990 [SYN, ACK] Seq=0 Ack=1 Win=27040 Len=0 MSS=1364 SACK_PERM=1 TSval=2813152760 TSecr=1343354741 WS=512"
"129","0.206458675","192.168.1.118","199.232.37.224","TCP","66","38990 → 443 [ACK] Seq=1 Ack=1 Win=64256 Len=0 TSval=1343354772 TSecr=2813152760"
"130","0.211776075","192.168.1.118","199.232.37.224","TLSv1.2","912","Application Data"
"131","0.212182750","192.168.1.118","199.232.37.224","TLSv1.2","664","Application Data"
"132","0.217436450","199.232.37.224","192.168.1.118","TLSv1.2","1418","Application Data [TCP segment of a reassembled PDU]"
"133","0.228306538","199.232.37.224","192.168.1.118","TLSv1.2","8178","Application Data, Application Data, Application Data, Application Data, Application Data"
"134","0.228637150","209.18.47.62","192.168.1.118","DNS","151","Standard query response 0x3e91 AAAA blog.etsy.com SOA ns-162.awsdns-20.com"
"135","0.228702688","192.168.1.118","199.232.37.224","TLSv1","583","Client Hello"
"136","0.228764275","199.232.37.224","192.168.1.118","TLSv1.2","12234","Application Data, Application Data, Application Data, Application Data, Application Data, Application Data, Application Data, Application Data, Application Data"
"137","0.236592888","192.168.1.118","199.232.37.224","TCP","66","38978 → 443 [ACK] Seq=1199 Ack=4604 Win=63360 Len=0 TSval=1343354802 TSecr=2811258076"
"138","0.239499163","209.18.47.62","192.168.1.118","DNS","151","Standard query response 0xaebc AAAA blog.etsy.com SOA ns-162.awsdns-20.com"
"139","0.239666725","199.232.37.224","192.168.1.118","TLSv1.2","2770","Application Data, Application Data"
"140","0.239783250","199.232.37.224","192.168.1.118","TLSv1.2","2770","Application Data, Application Data"
"141","0.239832900","199.232.37.224","192.168.1.118","TLSv1.2","2770","Application Data, Application Data"
"142","0.240138388","199.232.37.224","192.168.1.118","TLSv1.2","10882","Application Data, Application Data, Application Data, Application Data, Application Data, Application Data, Application Data, Application Data"
"143","0.240195038","199.232.37.224","192.168.1.118","TLSv1.2","1418","Application Data"
"144","0.245452225","192.168.1.118","199.232.37.224","TLSv1","583","Client Hello"
"145","0.257586225","192.168.1.118","199.232.37.224","TCP","66","38974 → 443 [ACK] Seq=1370 Ack=44297 Win=23808 Len=0 TSval=1343354823 TSecr=3252549194"
"146","0.257858113","199.232.37.224","192.168.1.118","TLSv1.2","6826","Application Data, Application Data, Application Data, Application Data, Application Data"
"147","0.258229050","199.232.37.224","192.168.1.118","TLSv1.2","5137","Application Data, Application Data, Application Data, Application Data, Application Data"
"148","0.258316213","209.18.47.62","192.168.1.118","DNS","151","Standard query response 0xe665 AAAA blog.etsy.com SOA ns-162.awsdns-20.com"
"149","0.258398813","199.232.37.224","192.168.1.118","TCP","66","443 → 38986 [ACK] Seq=1 Ack=518 Win=28160 Len=0 TSval=3144113190 TSecr=1343354794"
"150","0.259978313","199.232.37.224","192.168.1.118","TLSv1.2","3751","Server Hello, Certificate, Server Key Exchange, Server Hello Done"
"151","0.260069300","192.168.1.118","199.232.37.224","TCP","66","38986 → 443 [ACK] Seq=518 Ack=3686 Win=60672 Len=0 TSval=1343354825 TSecr=3144113191"
"152","0.262031000","192.168.1.118","199.232.37.224","TLSv1","583","Client Hello"
"153","0.272623975","199.232.37.224","192.168.1.118","TCP","66","443 → 38988 [ACK] Seq=1 Ack=518 Win=28160 Len=0 TSval=2773107713 TSecr=1343354811"
"154","0.276425088","199.232.37.224","192.168.1.118","TLSv1.2","1418","Server Hello"
"155","0.276504625","192.168.1.118","199.232.37.224","TCP","66","38988 → 443 [ACK] Seq=518 Ack=1353 Win=63104 Len=0 TSval=1343354842 TSecr=2773107714"
"156","0.278062663","199.232.37.224","192.168.1.118","TLSv1.2","2399","Certificate, Server Key Exchange, Server Hello Done"
"157","0.278148050","192.168.1.118","199.232.37.224","TCP","66","38988 → 443 [ACK] Seq=518 Ack=3686 Win=60800 Len=0 TSval=1343354844 TSecr=2773107714"
"158","0.278430775","192.168.1.118","199.232.37.224","TLSv1","583","Client Hello"
"159","0.280586725","192.168.1.118","199.232.37.224","TCP","66","38980 → 443 [ACK] Seq=1242 Ack=16920 Win=51072 Len=0 TSval=1343354846 TSecr=3146122000"
"160","0.280678238","192.168.1.118","199.232.37.224","TCP","66","38976 → 443 [ACK] Seq=1490 Ack=17257 Win=50688 Len=0 TSval=1343354846 TSecr=2813152767"
"161","0.282376538","199.232.37.224","192.168.1.118","TLSv1.2","1418","Application Data [TCP segment of a reassembled PDU]"
"162","0.285111663","199.232.37.224","192.168.1.118","TCP","66","443 → 38990 [ACK] Seq=1 Ack=518 Win=28160 Len=0 TSval=2813152779 TSecr=1343354827"
"163","0.285285775","199.232.37.224","192.168.1.118","TLSv1.2","5474","Application Data, Application Data, Application Data, Application Data"
"164","0.285340500","199.232.37.224","192.168.1.118","TLSv1.2","2770","Server Hello"
"165","0.285411850","192.168.1.118","199.232.37.224","TCP","66","38990 → 443 [ACK] Seq=518 Ack=2705 Win=61568 Len=0 TSval=1343354851 TSecr=2813152779"
"166","0.285608313","199.232.37.224","192.168.1.118","TLSv1.2","1047","Certificate, Server Key Exchange, Server Hello Done"
"167","0.285684713","192.168.1.118","199.232.37.224","TCP","66","38990 → 443 [ACK] Seq=518 Ack=3686 Win=60672 Len=0 TSval=1343354851 TSecr=2813152779"
"168","0.285839638","199.232.37.224","192.168.1.118","TLSv1.2","5474","Application Data, Application Data, Application Data, Application Data"
"169","0.294947288","192.168.1.118","199.232.37.224","TLSv1","583","Client Hello"
"170","0.295151250","192.168.1.118","104.196.190.179","TCP","74","45192 → 443 [SYN] Seq=0 Win=64240 Len=0 MSS=1460 SACK_PERM=1 TSval=3700505352 TSecr=0 WS=128"
"171","0.295234925","192.168.1.118","104.196.190.179","TCP","74","45194 → 443 [SYN] Seq=0 Win=64240 Len=0 MSS=1460 SACK_PERM=1 TSval=3700505352 TSecr=0 WS=128"
"172","0.295309100","192.168.1.118","104.196.190.179","TCP","74","45196 → 443 [SYN] Seq=0 Win=64240 Len=0 MSS=1460 SACK_PERM=1 TSval=3700505352 TSecr=0 WS=128"
"173","0.295626138","192.168.1.118","199.232.37.224","TCP","66","38974 → 443 [ACK] Seq=1370 Ack=56465 Win=11648 Len=0 TSval=1343354861 TSecr=3252549210"
"174","0.297971363","192.168.1.118","199.232.37.224","TLSv1.2","192","Client Key Exchange, Change Cipher Spec, Encrypted Handshake Message"
"175","0.299463500","199.232.37.224","192.168.1.118","TLSv1.2","5474","Application Data, Application Data, Application Data, Application Data"
"176","0.299879800","192.168.1.118","199.232.37.224","TLSv1.2","192","Client Key Exchange, Change Cipher Spec, Encrypted Handshake Message"
"177","0.301779763","192.168.1.118","199.232.37.224","TLSv1.2","192","Client Key Exchange, Change Cipher Spec, Encrypted Handshake Message"
"178","0.302738738","199.232.37.224","192.168.1.118","TLSv1.2","2770","Application Data, Application Data"
"179","0.302818500","199.232.37.224","192.168.1.118","TLSv1.2","2770","Application Data [TCP segment of a reassembled PDU]"
"180","0.307341638","199.232.37.224","192.168.1.118","TLSv1.2","1418","Application Data [TCP segment of a reassembled PDU]"
"181","0.307418900","192.168.1.118","199.232.37.224","TCP","66","38976 → 443 [ACK] Seq=1490 Ack=18609 Win=49408 Len=0 TSval=1343354873 TSecr=2813152785"
"182","0.308126363","192.168.1.118","199.232.37.224","TCP","66","38974 → 443 [ACK] Seq=1370 Ack=67281 Win=896 Len=0 TSval=1343354874 TSecr=3252549211"
"183","0.311723263","199.232.37.224","192.168.1.118","TLSv1.2","5474","Application Data, Application Data, Application Data, Application Data"
"184","0.311798163","192.168.1.118","199.232.37.224","TCP","66","38976 → 443 [ACK] Seq=1490 Ack=24017 Win=44032 Len=0 TSval=1343354877 TSecr=2813152785"
"185","0.312131213","199.232.37.224","192.168.1.118","TLSv1.2","16290","Application Data, Application Data, Application Data, Application Data, Application Data, Application Data, Application Data, Application Data, Application Data, Application Data, Application Data"
"186","0.313800400","199.232.37.224","192.168.1.118","TCP","66","443 → 38982 [ACK] Seq=1 Ack=518 Win=28160 Len=0 TSval=3144113203 TSecr=1343354844"
"187","0.313916775","199.232.37.224","192.168.1.118","TLSv1.2","3751","Server Hello, Certificate, Server Key Exchange, Server Hello Done"
"188","0.313985950","192.168.1.118","199.232.37.224","TCP","66","38982 → 443 [ACK] Seq=518 Ack=3686 Win=60672 Len=0 TSval=1343354879 TSecr=3144113204"
"189","0.314039538","199.232.37.224","192.168.1.118","TLSv1.2","4122","Application Data, Application Data, Application Data"
"190","0.321761188","192.168.1.118","199.232.37.224","TCP","66","38976 → 443 [ACK] Seq=1490 Ack=44297 Win=23808 Len=0 TSval=1343354887 TSecr=2813152785"
"191","0.323555338","199.232.37.224","192.168.1.118","TCP","66","443 → 38984 [ACK] Seq=1 Ack=518 Win=28160 Len=0 TSval=2814247626 TSecr=1343354860"
"192","0.323693113","199.232.37.224","192.168.1.118","TLSv1.2","3751","Server Hello, Certificate, Server Key Exchange, Server Hello Done"
"193","0.323772213","192.168.1.118","199.232.37.224","TCP","66","38984 → 443 [ACK] Seq=518 Ack=3686 Win=60672 Len=0 TSval=1343354889 TSecr=2814247626"
"194","0.323852975","199.232.37.224","192.168.1.118","TLSv1.2","117","Change Cipher Spec, Encrypted Handshake Message"
"195","0.323889750","192.168.1.118","199.232.37.224","TLSv1.2","192","Client Key Exchange, Change Cipher Spec, Encrypted Handshake Message"
"196","0.323939288","199.232.37.224","192.168.1.118","TLSv1.2","117","Change Cipher Spec, Encrypted Handshake Message"
"197","0.325582338","199.232.37.224","192.168.1.118","TLSv1.2","4122","Application Data, Application Data, Application Data"
"198","0.325673075","199.232.37.224","192.168.1.118","TLSv1.2","1185","Application Data, Application Data"
"199","0.325745625","199.232.37.224","192.168.1.118","TLSv1.2","117","Change Cipher Spec, Encrypted Handshake Message"
"200","0.325800525","192.168.1.118","199.232.37.224","TLSv1.2","192","Client Key Exchange, Change Cipher Spec, Encrypted Handshake Message"
"201","0.326045838","192.168.1.118","199.232.37.224","TCP","66","38976 → 443 [ACK] Seq=1490 Ack=49472 Win=18688 Len=0 TSval=1343354891 TSecr=2813152790"
"202","0.326550200","192.168.1.118","199.232.37.224","TLSv1.2","305","Application Data"
"203","0.326795088","192.168.1.118","199.232.37.224","TLSv1.2","305","Application Data"
"204","0.327018800","192.168.1.118","199.232.37.224","TLSv1.2","315","Application Data"
"205","0.330678088","104.196.190.179","192.168.1.118","TCP","66","443 → 45192 [SYN, ACK] Seq=0 Ack=1 Win=28400 Len=0 MSS=1420 SACK_PERM=1 WS=512"
"206","0.330793013","192.168.1.118","104.196.190.179","TCP","54","45192 → 443 [ACK] Seq=1 Ack=1 Win=64256 Len=0"
"207","0.332184188","104.196.190.179","192.168.1.118","TCP","66","443 → 45194 [SYN, ACK] Seq=0 Ack=1 Win=28400 Len=0 MSS=1420 SACK_PERM=1 WS=512"
"208","0.332282188","192.168.1.118","104.196.190.179","TCP","54","45194 → 443 [ACK] Seq=1 Ack=1 Win=64256 Len=0"
"209","0.338799613","199.232.37.224","192.168.1.118","TLSv1.2","117","Change Cipher Spec, Encrypted Handshake Message"
"210","0.340862863","104.196.190.179","192.168.1.118","TCP","66","443 → 45196 [SYN, ACK] Seq=0 Ack=1 Win=28400 Len=0 MSS=1420 SACK_PERM=1 WS=512"
"211","0.340974938","192.168.1.118","104.196.190.179","TCP","54","45196 → 443 [ACK] Seq=1 Ack=1 Win=64256 Len=0"
"212","0.352739238","192.168.1.118","104.196.190.179","TLSv1","571","Client Hello"
"213","0.353064063","199.232.37.224","192.168.1.118","TLSv1.2","117","Change Cipher Spec, Encrypted Handshake Message"
"214","0.361005613","199.232.37.224","192.168.1.118","TLSv1.2","13586","Application Data, Application Data, Application Data, Application Data, Application Data, Application Data, Application Data, Application Data, Application Data, Application Data"
"215","0.361083825","199.232.37.224","192.168.1.118","TLSv1.2","5474","Application Data, Application Data, Application Data, Application Data"
"216","0.361144363","199.232.37.224","192.168.1.118","TLSv1.2","2770","Application Data, Application Data"
"217","0.363233325","199.232.37.224","192.168.1.118","TLSv1.2","5474","Application Data, Application Data, Application Data, Application Data"
"218","0.363603950","199.232.37.224","192.168.1.118","TLSv1.2","8178","Application Data, Application Data, Application Data, Application Data, Application Data, Application Data"
"219","0.363664763","199.232.37.224","192.168.1.118","TLSv1.2","5474","Application Data, Application Data, Application Data, Application Data"
"220","0.369252163","192.168.1.118","104.196.190.179","TLSv1","571","Client Hello"
"221","0.379656263","192.168.1.118","199.232.37.224","TCP","66","38982 → 443 [ACK] Seq=644 Ack=3737 Win=64128 Len=0 TSval=1343354945 TSecr=3144113212"
"222","0.389313975","192.168.1.118","104.196.190.179","TLSv1","571","Client Hello"
"223","0.390264563","192.168.1.118","199.232.37.224","TCP","66","38986 → 443 [ACK] Seq=883 Ack=17257 Win=50688 Len=0 TSval=1343354956 TSecr=3144113216"
"224","0.390428275","192.168.1.118","199.232.37.224","TCP","66","38988 → 443 [ACK] Seq=883 Ack=17257 Win=50688 Len=0 TSval=1343354956 TSecr=2773107734"
"225","0.390566775","192.168.1.118","199.232.37.224","TCP","66","38990 → 443 [ACK] Seq=893 Ack=17257 Win=50688 Len=0 TSval=1343354956 TSecr=2813152798"
"226","0.390965188","192.168.1.118","199.232.37.224","TLSv1.2","313","Application Data"
"227","0.391218650","192.168.1.118","199.232.37.224","TLSv1.2","310","Application Data"
"228","0.400433975","104.196.190.179","192.168.1.118","TCP","54","443 → 45192 [ACK] Seq=1 Ack=518 Win=29696 Len=0"
"229","0.401787963","104.196.190.179","192.168.1.118","TLSv1.2","3189","Server Hello, Certificate, Server Key Exchange, Server Hello Done"
"230","0.401826838","192.168.1.118","104.196.190.179","TCP","54","45192 → 443 [ACK] Seq=518 Ack=3136 Win=61184 Len=0"
"231","0.408272388","104.196.190.179","192.168.1.118","TCP","54","443 → 45194 [ACK] Seq=1 Ack=518 Win=29696 Len=0"
"232","0.410399400","199.232.37.224","192.168.1.118","TLSv1.2","2770","Application Data, Application Data"
"233","0.410575225","199.232.37.224","192.168.1.118","TLSv1.2","5474","Application Data, Application Data, Application Data"
"234","0.410602575","199.232.37.224","192.168.1.118","TLSv1.2","2770","Application Data, Application Data"
"235","0.412954175","199.232.37.224","192.168.1.118","TLSv1.2","2770","Application Data, Application Data"
"236","0.413204613","199.232.37.224","192.168.1.118","TLSv1.2","12719","Application Data, Application Data, Application Data, Application Data, Application Data, Application Data, Application Data, Application Data, Application Data, Application Data"
"237","0.413239413","199.232.37.224","192.168.1.118","TLSv1.2","5474","Application Data, Application Data, Application Data"
"238","0.415786900","192.168.1.118","199.232.37.224","TCP","66","38986 → 443 [ACK] Seq=883 Ack=25369 Win=42624 Len=0 TSval=1343354981 TSecr=3144113229"
"239","0.415874075","192.168.1.118","199.232.37.224","TCP","66","38988 → 443 [ACK] Seq=883 Ack=28073 Win=39936 Len=0 TSval=1343354981 TSecr=2773107747"
"240","0.415930363","199.232.37.224","192.168.1.118","TLSv1.2","2770","Application Data, Application Data"
"241","0.415935938","192.168.1.118","199.232.37.224","TCP","66","38990 → 443 [ACK] Seq=893 Ack=29910 Win=38144 Len=0 TSval=1343354981 TSecr=2813152811"
"242","0.416490250","199.232.37.224","192.168.1.118","TLSv1.2","16290","Application Data, Application Data, Application Data, Application Data, Application Data, Application Data, Application Data, Application Data, Application Data, Application Data, Application Data, Application Data"
"243","0.416552538","199.232.37.224","192.168.1.118","TLSv1.2","2770","Application Data, Application Data"
"244","0.417963588","192.168.1.118","104.196.190.179","TLSv1.2","180","Client Key Exchange, Change Cipher Spec, Encrypted Handshake Message"
"245","0.418378563","192.168.1.118","199.232.37.224","TCP","66","38986 → 443 [ACK] Seq=883 Ack=28073 Win=39936 Len=0 TSval=1343354984 TSecr=3144113229"
"246","0.418436500","192.168.1.118","199.232.37.224","TCP","66","38988 → 443 [ACK] Seq=883 Ack=44297 Win=23808 Len=0 TSval=1343354984 TSecr=2773107747"
"247","0.418551950","192.168.1.118","199.232.37.224","TCP","66","38984 → 443 [ACK] Seq=888 Ack=6441 Win=61440 Len=0 TSval=1343354984 TSecr=2814247650"
"248","0.418796725","199.232.37.224","192.168.1.118","TLSv1.2","10882","Application Data, Application Data, Application Data, Application Data, Application Data, Application Data, Application Data, Application Data"
"249","0.419470075","104.196.190.179","192.168.1.118","TLSv1.2","3189","Server Hello, Certificate, Server Key Exchange, Server Hello Done"
"250","0.419538475","192.168.1.118","104.196.190.179","TCP","54","45194 → 443 [ACK] Seq=518 Ack=3136 Win=61184 Len=0"
"251","0.419642250","199.232.37.224","192.168.1.118","TLSv1.2","6826","Application Data, Application Data, Application Data, Application Data, Application Data"
"252","0.419691625","192.168.1.118","199.232.37.224","TCP","66","38982 → 443 [ACK] Seq=891 Ack=10497 Win=57472 Len=0 TSval=1343354985 TSecr=3144113229"
"253","0.423651763","199.232.37.224","192.168.1.118","TLSv1.2","2770","Application Data, Application Data"
"254","0.423691450","192.168.1.118","199.232.37.224","TCP","66","38982 → 443 [ACK] Seq=891 Ack=13201 Win=54784 Len=0 TSval=1343354989 TSecr=3144113229"
"255","0.423823450","199.232.37.224","192.168.1.118","TLSv1.2","5474","Application Data, Application Data, Application Data, Application Data"
"256","0.423889488","199.232.37.224","192.168.1.118","TLSv1.2","4122","Application Data, Application Data, Application Data"
"257","0.423917663","192.168.1.118","199.232.37.224","TCP","66","38982 → 443 [ACK] Seq=891 Ack=17257 Win=50816 Len=0 TSval=1343354989 TSecr=3144113229"
"258","0.423934813","199.232.37.224","192.168.1.118","TLSv1.2","8178","Application Data, Application Data, Application Data, Application Data, Application Data, Application Data"
"259","0.430096963","104.196.190.179","192.168.1.118","TCP","54","443 → 45196 [ACK] Seq=1 Ack=518 Win=29696 Len=0"
"260","0.430121713","199.232.37.224","192.168.1.118","TLSv1.2","2770","Application Data, Application Data"
"261","0.430208250","104.196.190.179","192.168.1.118","TLSv1.2","3189","Server Hello, Certificate, Server Key Exchange, Server Hello Done"
"262","0.430235475","192.168.1.118","104.196.190.179","TCP","54","45196 → 443 [ACK] Seq=518 Ack=3136 Win=61184 Len=0"
"263","0.430588388","192.168.1.118","199.232.37.224","TCP","66","[TCP Window Update] 38974 → 443 [ACK] Seq=1370 Ack=67281 Win=16768 Len=0 TSval=1343354996 TSecr=3252549211"
"264","0.431124000","192.168.1.118","199.232.37.224","TCP","66","38986 → 443 [ACK] Seq=883 Ack=44297 Win=23808 Len=0 TSval=1343354997 TSecr=3144113229"
"265","0.431385588","192.168.1.118","199.232.37.224","TCP","66","38984 → 443 [ACK] Seq=888 Ack=17257 Win=50688 Len=0 TSval=1343354997 TSecr=2814247650"
"266","0.433356600","192.168.1.118","104.196.190.179","TLSv1.2","180","Client Key Exchange, Change Cipher Spec, Encrypted Handshake Message"
"267","0.434197650","199.232.37.224","192.168.1.118","TLSv1.2","1418","Application Data [TCP segment of a reassembled PDU]"
"268","0.435046900","199.232.37.224","192.168.1.118","TLSv1.2","1418","Application Data [TCP segment of a reassembled PDU]"
"269","0.435267163","192.168.1.118","104.196.190.179","TLSv1.2","180","Client Key Exchange, Change Cipher Spec, Encrypted Handshake Message"
"270","0.435886388","192.168.1.118","199.232.37.224","TCP","66","38986 → 443 [ACK] Seq=883 Ack=47001 Win=21120 Len=0 TSval=1343355001 TSecr=3144113236"
"271","0.436584663","199.232.37.224","192.168.1.118","TLSv1.2","1418","Application Data [TCP segment of a reassembled PDU]"
"272","0.438050725","199.232.37.224","192.168.1.118","TLSv1.2","2770","Application Data, Application Data"
"273","0.438500775","192.168.1.118","199.232.37.224","TCP","66","38986 → 443 [ACK] Seq=883 Ack=51057 Win=17152 Len=0 TSval=1343355004 TSecr=3144113236"
"274","0.442503600","199.232.37.224","192.168.1.118","TLSv1.2","1418","Application Data [TCP segment of a reassembled PDU]"
"275","0.443847325","199.232.37.224","192.168.1.118","TLSv1.2","1418","Application Data [TCP segment of a reassembled PDU]"
"276","0.443906275","199.232.37.224","192.168.1.118","TLSv1.2","3947","Application Data, Application Data, Application Data, Application Data"
"277","0.447694150","199.232.37.224","192.168.1.118","TLSv1.2","2770","Application Data, Application Data"
"278","0.455033263","192.168.1.118","199.232.37.224","TCP","66","38986 → 443 [ACK] Seq=883 Ack=57642 Win=10624 Len=0 TSval=1343355020 TSecr=3144113236"
"279","0.455118750","192.168.1.118","199.232.37.224","TCP","66","38988 → 443 [ACK] Seq=883 Ack=47001 Win=21120 Len=0 TSval=1343355021 TSecr=2773107756"
"280","0.459951400","199.232.37.224","192.168.1.118","TLSv1.2","1418","Application Data [TCP segment of a reassembled PDU]"
"281","0.460054963","199.232.37.224","192.168.1.118","TLSv1.2","1455","Application Data, Application Data"
"282","0.460132275","199.232.37.224","192.168.1.118","TLSv1.2","2770","Application Data, Application Data"
"283","0.460182313","199.232.37.224","192.168.1.118","TLSv1.2","1418","Application Data [TCP segment of a reassembled PDU]"
"284","0.460249750","192.168.1.118","199.232.37.224","TCP","66","38982 → 443 [ACK] Seq=891 Ack=18609 Win=49536 Len=0 TSval=1343355026 TSecr=3144113238"
"285","0.461218763","199.232.37.224","192.168.1.118","TLSv1.2","4449","Application Data, Application Data, Application Data, Application Data"
"286","0.461291675","192.168.1.118","199.232.37.224","TCP","66","38982 → 443 [ACK] Seq=891 Ack=22992 Win=45184 Len=0 TSval=1343355027 TSecr=3144113238"
"287","0.461361738","199.232.37.224","192.168.1.118","TLSv1.2","1209","Application Data"
"288","0.463794625","192.168.1.118","199.232.37.224","TCP","66","38988 → 443 [ACK] Seq=883 Ack=49742 Win=18432 Len=0 TSval=1343355029 TSecr=2773107756"
"289","0.463961563","192.168.1.118","199.232.37.224","TCP","66","38984 → 443 [ACK] Seq=888 Ack=21104 Win=46848 Len=0 TSval=1343355029 TSecr=2814247659"
"290","0.466695113","104.196.190.179","192.168.1.118","TLSv1.2","105","Change Cipher Spec, Encrypted Handshake Message"
"291","0.466746000","199.232.37.224","192.168.1.118","TLSv1.2","16290","Application Data, Application Data, Application Data, Application Data, Application Data, Application Data, Application Data, Application Data, Application Data, Application Data, Application Data, Application Data"
"292","0.469747600","104.196.190.179","192.168.1.118","TLSv1.2","105","Change Cipher Spec, Encrypted Handshake Message"
"293","0.470951638","104.196.190.179","192.168.1.118","TLSv1.2","105","Change Cipher Spec, Encrypted Handshake Message"
"294","0.480756200","192.168.1.118","199.232.37.224","TCP","66","38974 → 443 [ACK] Seq=1370 Ack=83505 Win=640 Len=0 TSval=1343355046 TSecr=3252549254"
"295","0.481305563","192.168.1.118","199.232.37.224","TCP","66","[TCP Window Update] 38986 → 443 [ACK] Seq=883 Ack=57642 Win=27008 Len=0 TSval=1343355047 TSecr=3144113236"
"296","0.481815250","192.168.1.118","104.196.190.179","TLSv1.2","660","Application Data"
"297","0.482058163","192.168.1.118","104.196.190.179","TLSv1.2","656","Application Data"
"298","0.482267025","192.168.1.118","104.196.190.179","TLSv1.2","658","Application Data"
"299","0.484230875","192.168.1.118","199.232.37.224","TLSv1.2","309","Application Data"
"300","0.499321413","192.168.1.118","199.232.37.224","TCP","66","[TCP Window Update] 38974 → 443 [ACK] Seq=1370 Ack=83505 Win=20864 Len=0 TSval=1343355065 TSecr=3252549254"
"301","0.501722263","192.168.1.118","199.232.37.224","TLSv1.2","310","Application Data"
"302","0.501852488","192.168.1.118","199.232.37.224","TLSv1.2","309","Application Data"
"303","0.505030613","199.232.37.224","192.168.1.118","TLSv1.2","1418","Application Data"
"304","0.507633400","199.232.37.224","192.168.1.118","TLSv1.2","5474","Application Data, Application Data, Application Data, Application Data"
"305","0.507877200","199.232.37.224","192.168.1.118","TLSv1.2","5474","Application Data, Application Data, Application Data, Application Data"
"306","0.510982788","199.232.37.224","192.168.1.118","TLSv1.2","4122","Application Data, Application Data, Application Data"
"307","0.512033725","199.232.37.224","192.168.1.118","TLSv1.2","2770","Application Data, Application Data"
"308","0.513328725","104.196.190.179","192.168.1.118","TCP","4314","[TCP segment of a reassembled PDU]"
"309","0.515291475","104.196.190.179","192.168.1.118","TCP","5734","443 → 45192 [ACK] Seq=7447 Ack=1250 Win=30720 Len=5680 [TCP segment of a reassembled PDU]"
"310","0.515599075","104.196.190.179","192.168.1.118","TCP","1474","443 → 45192 [ACK] Seq=13127 Ack=1250 Win=30720 Len=1420 [TCP segment of a reassembled PDU]"
"311","0.515651925","104.196.190.179","192.168.1.118","TCP","5734","[TCP segment of a reassembled PDU]"
"312","0.517159463","192.168.1.118","199.232.37.224","TCP","66","[TCP Window Update] 38976 → 443 [ACK] Seq=1490 Ack=49472 Win=56960 Len=0 TSval=1343355083 TSecr=2813152790"
"313","0.517385013","104.196.190.179","192.168.1.118","TCP","5734","443 → 45194 [ACK] Seq=8867 Ack=1246 Win=30720 Len=5680 [TCP segment of a reassembled PDU]"
"314","0.517407563","192.168.1.118","104.196.190.179","TCP","54","45192 → 443 [ACK] Seq=1250 Ack=14547 Win=52864 Len=0"
"315","0.517478088","192.168.1.118","104.196.190.179","TCP","54","45194 → 443 [ACK] Seq=1246 Ack=14547 Win=52864 Len=0"
"316","0.517609188","192.168.1.118","199.232.37.224","TCP","66","38984 → 443 [ACK] Seq=1131 Ack=40032 Win=45312 Len=0 TSval=1343355083 TSecr=2814247674"
"317","0.517933725","104.196.190.179","192.168.1.118","TLSv1.2","5107","Application Data"
"318","0.518015850","192.168.1.118","104.196.190.179","TCP","54","45194 → 443 [ACK] Seq=1246 Ack=19600 Win=56960 Len=0"
"319","0.518189325","199.232.37.224","192.168.1.118","TLSv1.2","3121","Application Data, Application Data, Application Data"
"320","0.518348500","199.232.37.224","192.168.1.118","TLSv1.2","2770","Application Data [TCP segment of a reassembled PDU]"
"321","0.518407663","104.196.190.179","192.168.1.118","TCP","2894","443 → 45192 [ACK] Seq=14547 Ack=1250 Win=30720 Len=2840 [TCP segment of a reassembled PDU]"
"322","0.518479038","192.168.1.118","104.196.190.179","TCP","54","45192 → 443 [ACK] Seq=1250 Ack=17387 Win=61056 Len=0"
"323","0.518553050","104.196.190.179","192.168.1.118","TCP","1474","[TCP segment of a reassembled PDU]"
"324","0.519129225","192.168.1.118","199.232.37.224","TCP","66","38974 → 443 [ACK] Seq=1370 Ack=86560 Win=17920 Len=0 TSval=1343355085 TSecr=3252549269"
"325","0.519618013","192.168.1.118","199.232.37.224","TCP","66","38984 → 443 [ACK] Seq=1131 Ack=42736 Win=42624 Len=0 TSval=1343355085 TSecr=2814247674"
"326","0.521276013","104.196.190.179","192.168.1.118","TCP","1474","443 → 45194 [ACK] Seq=21020 Ack=1246 Win=30720 Len=1420 [TCP segment of a reassembled PDU]"
"327","0.521389963","192.168.1.118","104.196.190.179","TCP","54","45194 → 443 [ACK] Seq=1246 Ack=22440 Win=63104 Len=0"
"328","0.521458613","104.196.190.179","192.168.1.118","TCP","1474","443 → 45192 [ACK] Seq=17387 Ack=1250 Win=30720 Len=1420 [TCP segment of a reassembled PDU]"
"329","0.524430650","104.196.190.179","192.168.1.118","TLSv1.2","847","Application Data"
"330","0.524557438","192.168.1.118","104.196.190.179","TCP","54","45192 → 443 [ACK] Seq=1250 Ack=19600 Win=61056 Len=0"
"331","0.524750863","104.196.190.179","192.168.1.118","TCP","2894","[TCP segment of a reassembled PDU]"
"332","0.524805713","199.232.37.224","192.168.1.118","TLSv1.2","2770","Application Data, Application Data"
"333","0.524850075","104.196.190.179","192.168.1.118","TCP","1474","[TCP segment of a reassembled PDU]"
"334","0.525192425","104.196.190.179","192.168.1.118","TLSv1.2","13419","Application Data"
"335","0.532013513","199.232.37.224","192.168.1.118","TLSv1.2","2770","Application Data, Application Data"
"336","0.532208863","199.232.37.224","192.168.1.118","TLSv1.2","17680","Application Data, Application Data, Application Data, Application Data, Application Data, Application Data, Application Data, Application Data, Application Data, Application Data, Application Data, Application Data, Application Data, Application Data"
"337","0.534528625","199.232.37.224","192.168.1.118","TLSv1.2","2770","Application Data, Application Data"
"338","0.534715600","199.232.37.224","192.168.1.118","TLSv1.2","3352","Application Data, Application Data, Application Data, Application Data"
"339","0.534743138","199.232.37.224","192.168.1.118","TLSv1.2","14938","Application Data, Application Data, Application Data, Application Data, Application Data, Application Data, Application Data, Application Data, Application Data, Application Data, Application Data"
"340","0.536930163","199.232.37.224","192.168.1.118","TLSv1.2","4122","Application Data, Application Data"
"341","0.537955575","192.168.1.118","104.196.190.179","TCP","54","45192 → 443 [ACK] Seq=1250 Ack=22440 Win=58240 Len=0"
"342","0.538203875","192.168.1.118","104.196.190.179","TCP","54","45196 → 443 [ACK] Seq=1248 Ack=17972 Win=49408 Len=0"
"343","0.538419050","192.168.1.118","199.232.37.224","TCP","66","38984 → 443 [ACK] Seq=1131 Ack=51430 Win=34048 Len=0 TSval=1343355104 TSecr=2814247675"
"344","0.538475850","192.168.1.118","199.232.37.224","TCP","66","38990 → 443 [ACK] Seq=1137 Ack=47524 Win=46592 Len=0 TSval=1343355104 TSecr=2813152840"
"345","0.538610488","192.168.1.118","199.232.37.224","TCP","66","38982 → 443 [ACK] Seq=1134 Ack=44624 Win=42496 Len=0 TSval=1343355104 TSecr=3144113259"
"346","0.540469675","199.232.37.224","192.168.1.118","TLSv1.2","1418","Application Data [TCP segment of a reassembled PDU]"
"347","0.541547513","199.232.37.224","192.168.1.118","TLSv1.2","1418","Application Data [TCP segment of a reassembled PDU]"
"348","0.542398613","199.232.37.224","192.168.1.118","TLSv1.2","1004","Application Data, Application Data"
"349","0.544083100","192.168.1.118","199.232.37.224","TCP","66","[TCP Window Update] 38988 → 443 [ACK] Seq=883 Ack=49742 Win=56192 Len=0 TSval=1343355110 TSecr=2773107756"
"350","0.544245900","192.168.1.118","199.232.37.224","TCP","66","38982 → 443 [ACK] Seq=1134 Ack=48266 Win=38912 Len=0 TSval=1343355110 TSecr=3144113260"
"351","0.546203525","104.196.190.179","192.168.1.118","TCP","1474","443 → 45192 [ACK] Seq=22440 Ack=1250 Win=30720 Len=1420 [TCP segment of a reassembled PDU]"
"352","0.547371050","104.196.190.179","192.168.1.118","TLSv1.2","1859","Application Data"
"353","0.547407425","104.196.190.179","192.168.1.118","TCP","1474","443 → 45192 [ACK] Seq=23860 Ack=1250 Win=30720 Len=1420 [TCP segment of a reassembled PDU]"
"354","0.547459900","192.168.1.118","104.196.190.179","TCP","54","45192 → 443 [ACK] Seq=1250 Ack=25280 Win=61056 Len=0"
"355","0.548828563","192.168.1.118","104.196.190.179","TCP","54","45194 → 443 [ACK] Seq=1246 Ack=24245 Win=64128 Len=0"
"356","0.549420125","192.168.1.118","199.232.37.224","TCP","66","[TCP Window Update] 38986 → 443 [ACK] Seq=883 Ack=57642 Win=62208 Len=0 TSval=1343355115 TSecr=3144113236"
"357","0.550713763","192.168.1.118","199.232.37.224","TCP","66","[TCP Window Update] 38974 → 443 [ACK] Seq=1370 Ack=86560 Win=47872 Len=0 TSval=1343355116 TSecr=3252549269"
"358","0.551866938","104.196.190.179","192.168.1.118","TCP","2894","443 → 45192 [ACK] Seq=25280 Ack=1250 Win=30720 Len=2840 [TCP segment of a reassembled PDU]"
"359","0.551949788","192.168.1.118","104.196.190.179","TCP","54","45192 → 443 [ACK] Seq=1250 Ack=28120 Win=61056 Len=0"
"360","0.556334888","104.196.190.179","192.168.1.118","TLSv1.2","8574","Application Data [TCP segment of a reassembled PDU]"
"361","0.556974788","192.168.1.118","104.196.190.179","TCP","54","45192 → 443 [ACK] Seq=1250 Ack=36640 Win=52608 Len=0"
"362","0.557352413","192.168.1.118","199.232.37.224","TLSv1.2","310","Application Data"
"363","0.566020200","104.196.190.179","192.168.1.118","TCP","8574","443 → 45192 [ACK] Seq=36640 Ack=1250 Win=30720 Len=8520 [TCP segment of a reassembled PDU]"
"364","0.566082975","192.168.1.118","104.196.190.179","TCP","54","45192 → 443 [ACK] Seq=1250 Ack=45160 Win=52864 Len=0"
"365","0.567617338","192.168.1.118","199.232.37.224","TLSv1.2","307","Application Data"
"366","0.567744088","192.168.1.118","199.232.37.224","TLSv1.2","310","Application Data"
"367","0.568247200","104.196.190.179","192.168.1.118","TCP","2894","443 → 45192 [ACK] Seq=45160 Ack=1250 Win=30720 Len=2840 [TCP segment of a reassembled PDU]"
"368","0.568302238","192.168.1.118","104.196.190.179","TCP","54","45192 → 443 [ACK] Seq=1250 Ack=48000 Win=61056 Len=0"
"369","0.571150725","104.196.190.179","192.168.1.118","TCP","2894","443 → 45192 [ACK] Seq=48000 Ack=1250 Win=30720 Len=2840 [TCP segment of a reassembled PDU]"
"370","0.573233925","104.196.190.179","192.168.1.118","TLSv1.2","4314","Application Data [TCP segment of a reassembled PDU]"
"371","0.574241013","104.196.190.179","192.168.1.118","TCP","1474","443 → 45192 [ACK] Seq=55100 Ack=1250 Win=30720 Len=1420 [TCP segment of a reassembled PDU]"
"372","0.575959375","192.168.1.118","104.196.190.179","TCP","54","45192 → 443 [ACK] Seq=1250 Ack=56520 Win=52608 Len=0"
"373","0.577695300","104.196.190.179","192.168.1.118","TCP","1474","443 → 45192 [ACK] Seq=56520 Ack=1250 Win=30720 Len=1420 [TCP segment of a reassembled PDU]"
"374","0.580124338","104.196.190.179","192.168.1.118","TCP","4314","443 → 45192 [ACK] Seq=57940 Ack=1250 Win=30720 Len=4260 [TCP segment of a reassembled PDU]"
"375","0.580174125","192.168.1.118","104.196.190.179","TCP","54","45192 → 443 [ACK] Seq=1250 Ack=62200 Win=56960 Len=0"
"376","0.581823350","104.196.190.179","192.168.1.118","TCP","2894","443 → 45192 [ACK] Seq=62200 Ack=1250 Win=30720 Len=2840 [TCP segment of a reassembled PDU]"
"377","0.583116888","104.196.190.179","192.168.1.118","TCP","2894","443 → 45192 [ACK] Seq=65040 Ack=1250 Win=30720 Len=2840 [TCP segment of a reassembled PDU]"
"378","0.584331413","192.168.1.118","104.196.190.179","TCP","54","45192 → 443 [ACK] Seq=1250 Ack=67880 Win=64128 Len=0"
"379","0.584574075","192.168.1.118","199.232.37.224","TLSv1.2","310","Application Data"
"380","0.584671425","192.168.1.118","199.232.37.224","TLSv1.2","310","Application Data"
"381","0.586427313","104.196.190.179","192.168.1.118","TLSv1.2","1474","Application Data [TCP segment of a reassembled PDU]"
"382","0.591965988","104.196.190.179","192.168.1.118","TCP","4314","443 → 45192 [ACK] Seq=69300 Ack=1250 Win=30720 Len=4260 [TCP segment of a reassembled PDU]"
"383","0.592027875","192.168.1.118","104.196.190.179","TCP","54","45192 → 443 [ACK] Seq=1250 Ack=73560 Win=75520 Len=0"
"384","0.592062963","199.232.37.224","192.168.1.118","TLSv1.2","1418","Application Data"
"385","0.592141213","199.232.37.224","192.168.1.118","TLSv1.2","10882","Application Data, Application Data, Application Data, Application Data, Application Data, Application Data, Application Data, Application Data"
"386","0.593908675","192.168.1.118","199.232.37.224","TCP","66","38988 → 443 [ACK] Seq=1127 Ack=61910 Win=51968 Len=0 TSval=1343355159 TSecr=2773107792"
"387","0.596669113","199.232.37.224","192.168.1.118","TLSv1.2","5474","Application Data, Application Data, Application Data, Application Data"
"388","0.596773713","199.232.37.224","192.168.1.118","TLSv1.2","4555","Application Data, Application Data, Application Data, Application Data"
"389","0.597586288","192.168.1.118","199.232.37.224","TCP","66","38988 → 443 [ACK] Seq=1127 Ack=71807 Win=42112 Len=0 TSval=1343355163 TSecr=2773107792"
"390","0.604592088","199.232.37.224","192.168.1.118","TLSv1.2","2770","Application Data, Application Data"
"391","0.604664950","192.168.1.118","199.232.37.224","TCP","66","38986 → 443 [ACK] Seq=1124 Ack=60346 Win=64128 Len=0 TSval=1343355170 TSecr=3144113276"
"392","0.605018850","199.232.37.224","192.168.1.118","TLSv1.2","10882","Application Data, Application Data, Application Data, Application Data, Application Data, Application Data, Application Data, Application Data"
"393","0.605045513","199.232.37.224","192.168.1.118","TLSv1.2","8178","Application Data, Application Data, Application Data, Application Data, Application Data, Application Data"
"394","0.605120000","192.168.1.118","199.232.37.224","TCP","66","38990 → 443 [ACK] Seq=1381 Ack=55636 Win=64128 Len=0 TSval=1343355171 TSecr=2813152858"
"395","0.605291713","192.168.1.118","199.232.37.224","TCP","66","38986 → 443 [ACK] Seq=1124 Ack=71162 Win=56064 Len=0 TSval=1343355171 TSecr=3144113276"
"396","0.607611475","199.232.37.224","192.168.1.118","TLSv1.2","5474","Application Data, Application Data, Application Data, Application Data"
"397","0.607855463","199.232.37.224","192.168.1.118","TLSv1.2","8203","Application Data, Application Data, Application Data, Application Data, Application Data, Application Data"
"398","0.607899888","199.232.37.224","192.168.1.118","TLSv1.2","6826","Application Data, Application Data, Application Data, Application Data, Application Data"
"399","0.608283038","192.168.1.118","199.232.37.224","TCP","66","38986 → 443 [ACK] Seq=1124 Ack=77922 Win=49408 Len=0 TSval=1343355174 TSecr=3144113276"
"400","0.608370300","192.168.1.118","199.232.37.224","TCP","66","38990 → 443 [ACK] Seq=1381 Ack=69181 Win=50688 Len=0 TSval=1343355174 TSecr=2813152858"
"401","0.615363288","199.232.37.224","192.168.1.118","TLSv1.2","5474","Application Data, Application Data, Application Data"
"402","0.615674775","199.232.37.224","192.168.1.118","TLSv1.2","2301","Application Data, Application Data, Application Data"
"403","0.615741288","104.196.190.179","192.168.1.118","TCP","4314","443 → 45192 [ACK] Seq=73560 Ack=1250 Win=30720 Len=4260 [TCP segment of a reassembled PDU]"
"404","0.615776063","192.168.1.118","104.196.190.179","TCP","54","45192 → 443 [ACK] Seq=1250 Ack=77820 Win=83968 Len=0"
"405","0.615806288","199.232.37.224","192.168.1.118","TLSv1.2","9530","Application Data, Application Data, Application Data, Application Data, Application Data, Application Data, Application Data"
"406","0.615834400","192.168.1.118","199.232.37.224","TCP","66","38984 → 443 [ACK] Seq=1375 Ack=60894 Win=76416 Len=0 TSval=1343355181 TSecr=2814247699"
"407","0.618314400","192.168.1.118","199.232.37.224","TCP","66","38986 → 443 [ACK] Seq=1124 Ack=85565 Win=41856 Len=0 TSval=1343355184 TSecr=3144113276"
"408","0.618423175","199.232.37.224","192.168.1.118","TLSv1.2","1418","Application Data [TCP segment of a reassembled PDU]"
"409","0.618435888","104.196.190.179","192.168.1.118","TCP","1474","443 → 45192 [ACK] Seq=77820 Ack=1250 Win=30720 Len=1420 [TCP segment of a reassembled PDU]"
"410","0.618857838","104.196.190.179","192.168.1.118","TLSv1.2","1255","Application Data"
"411","0.618873963","192.168.1.118","104.196.190.179","TCP","54","45192 → 443 [ACK] Seq=1250 Ack=80441 Win=89728 Len=0"
"412","0.618904900","199.232.37.224","192.168.1.118","TLSv1.2","10446","Application Data, Application Data, Application Data, Application Data, Application Data, Application Data, Application Data, Application Data"
"413","0.618950800","199.232.37.224","192.168.1.118","TLSv1.2","6826","Application Data, Application Data, Application Data, Application Data, Application Data"
"414","0.618973025","192.168.1.118","199.232.37.224","TCP","66","38982 → 443 [ACK] Seq=1378 Ack=55026 Win=77696 Len=0 TSval=1343355184 TSecr=3144113281"
"415","0.621508900","192.168.1.118","199.232.37.224","TCP","66","38984 → 443 [ACK] Seq=1375 Ack=72626 Win=64768 Len=0 TSval=1343355187 TSecr=2814247699"
"416","0.621707888","192.168.1.118","199.232.37.224","TLSv1.2","317","Application Data"
"417","0.636280425","199.232.37.224","192.168.1.118","TLSv1.2","2770","Application Data, Application Data"
"418","0.636331200","192.168.1.118","199.232.37.224","TCP","66","38982 → 443 [ACK] Seq=1378 Ack=57730 Win=83072 Len=0 TSval=1343355202 TSecr=3144113281"
"419","0.636747075","199.232.37.224","192.168.1.118","TLSv1.2","6826","Application Data, Application Data, Application Data, Application Data, Application Data"
"420","0.636788475","192.168.1.118","199.232.37.224","TCP","66","38982 → 443 [ACK] Seq=1378 Ack=64490 Win=96640 Len=0 TSval=1343355202 TSecr=3144113281"
"421","0.636858900","199.232.37.224","192.168.1.118","TLSv1.2","5474","Application Data, Application Data, Application Data"
"422","0.636895413","192.168.1.118","199.232.37.224","TCP","66","38982 → 443 [ACK] Seq=1378 Ack=69898 Win=107392 Len=0 TSval=1343355202 TSecr=3144113282"
"423","0.636972625","199.232.37.224","192.168.1.118","TLSv1.2","5474","Application Data, Application Data, Application Data, Application Data"
"424","0.637004463","199.232.37.224","192.168.1.118","TLSv1.2","1418","Application Data [TCP segment of a reassembled PDU]"
"425","0.639035938","192.168.1.118","199.232.37.224","TCP","66","38982 → 443 [ACK] Seq=1378 Ack=76658 Win=100736 Len=0 TSval=1343355204 TSecr=3144113283"
"426","0.648617125","199.232.37.224","192.168.1.118","TLSv1.2","1418","Application Data [TCP segment of a reassembled PDU]"
"427","0.648673350","199.232.37.224","192.168.1.118","TLSv1.2","493","Application Data, Application Data"
"428","0.648785538","192.168.1.118","199.232.37.224","TCP","66","38982 → 443 [ACK] Seq=1378 Ack=78437 Win=99072 Len=0 TSval=1343355214 TSecr=3144113284"
"429","0.677761363","199.232.37.224","192.168.1.118","TLSv1.2","949","[TCP Spurious Retransmission] , Ignored Unknown Record"
"430","0.677863300","192.168.1.118","199.232.37.224","TCP","78","[TCP Window Update] 38986 → 443 [ACK] Seq=1124 Ack=85565 Win=64128 Len=0 TSval=1343355243 TSecr=3144113297 SLE=84682 SRE=85565"
"431","0.682391950","199.232.37.224","192.168.1.118","TLSv1.2","1418","Application Data"
"432","0.685708950","199.232.37.224","192.168.1.118","TLSv1.2","8178","Application Data, Application Data, Application Data, Application Data, Application Data, Application Data"
"433","0.685796075","192.168.1.118","199.232.37.224","TCP","66","38988 → 443 [ACK] Seq=1378 Ack=81271 Win=80384 Len=0 TSval=1343355251 TSecr=2773107815"
"434","0.685992625","199.232.37.224","192.168.1.118","TLSv1.2","2770","Application Data, Application Data"
"435","0.686074363","192.168.1.118","199.232.37.224","TCP","66","38988 → 443 [ACK] Seq=1378 Ack=83975 Win=85760 Len=0 TSval=1343355251 TSecr=2773107815"
"436","0.690158963","199.232.37.224","192.168.1.118","TLSv1.2","5540","Application Data, Application Data, Application Data, Application Data, Application Data"
"437","0.690244600","192.168.1.118","199.232.37.224","TCP","66","38988 → 443 [ACK] Seq=1378 Ack=89449 Win=96768 Len=0 TSval=1343355256 TSecr=2773107815"
"438","2.008864538","192.168.1.118","192.168.1.102","TCP","176","44768 → 8009 [PSH, ACK] Seq=1 Ack=1 Win=501 Len=110 TSval=2258300384 TSecr=5282241 [TCP segment of a reassembled PDU]"
"439","2.014323588","192.168.1.102","192.168.1.118","TCP","176","8009 → 44768 [PSH, ACK] Seq=1 Ack=111 Win=294 Len=110 TSval=5282744 TSecr=2258300384 [TCP segment of a reassembled PDU]"
"440","2.014491813","192.168.1.118","192.168.1.102","TCP","66","44768 → 8009 [ACK] Seq=111 Ack=111 Win=501 Len=0 TSval=2258300390 TSecr=5282744"
"441","3.889574700","Cisco-Li_5b:1c:ce","IntelCor_b7:52:73","ARP","42","Who has 192.168.1.118? Tell 192.168.1.1"
"442","3.889607025","IntelCor_b7:52:73","Cisco-Li_5b:1c:ce","ARP","42","192.168.1.118 is at dc:fb:48:b7:52:73"
"443","4.097030888","192.168.1.104","255.255.255.255","UDP","217","49154 → 6666 Len=175"
"444","4.715817550","192.168.1.101","224.0.0.251","MDNS","420","Standard query 0x0000 PTR _googlecast._tcp.local, "QM" question PTR _homekit._tcp.local, "QM" question PTR _uscan._tcp.local, "QM" question PTR _ptp._tcp.local, "QM" question PTR _ippusb._tcp.local, "QM" question PTR _scanner._tcp.local, "QM" question PTR _ipp._tcp.local, "QM" question PTR _pdl-datastream._tcp.local, "QM" question PTR _uscans._tcp.local, "QM" question PTR _ipps._tcp.local, "QM" question PTR _printer._tcp.local, "QM" question PTR _airplay._tcp.local, "QM" question PTR _raop._tcp.local, "QM" question PTR _airport._tcp.local, "QM" question PTR _companion-link._tcp.local, "QM" question PTR _rdlink._tcp.local, "QM" question TXT Google-Home-Mini-2c3f16b2da5c4b6fd6cfbfba61c12490._googlecast._tcp.local, "QM" question PTR Google-Home-Mini-2c3f16b2da5c4b6fd6cfbfba61c12490._googlecast._tcp.local PTR cjqg._companion-link._tcp.local OPT"
"445","5.018007375","192.168.1.102","224.0.0.251","MDNS","183","Standard query response 0x0000 SRV, cache flush 0 0 8009 2c3f16b2-da5c-4b6f-d6cf-bfba61c12490.local"
"446","5.219222525","192.168.1.118","172.217.3.99","TCP","66","43300 → 80 [ACK] Seq=1 Ack=1 Win=502 Len=0 TSval=4189154561 TSecr=3920939280"
"447","5.233629850","172.217.3.99","192.168.1.118","TCP","66","[TCP ACKed unseen segment] 80 → 43300 [ACK] Seq=1 Ack=2 Win=240 Len=0 TSval=3920984332 TSecr=4189063890"
"448","7.020746038","192.168.1.118","192.168.1.102","TCP","176","44768 → 8009 [PSH, ACK] Seq=111 Ack=111 Win=501 Len=110 TSval=2258305396 TSecr=5282744 [TCP segment of a reassembled PDU]"
"449","7.028095775","192.168.1.102","192.168.1.118","TCP","176","8009 → 44768 [PSH, ACK] Seq=111 Ack=221 Win=294 Len=110 TSval=5283245 TSecr=2258305396 [TCP segment of a reassembled PDU]"
"450","7.028279938","192.168.1.118","192.168.1.102","TCP","66","44768 → 8009 [ACK] Seq=221 Ack=221 Win=501 Len=0 TSval=2258305404 TSecr=5283245"
"451","7.066284925","192.168.1.104","255.255.255.255","UDP","217","49154 → 6666 Len=175"
"452","7.482397625","192.168.1.118","142.250.31.188","TLSv1.2","100","Application Data"
"453","7.520770363","142.250.31.188","192.168.1.118","TCP","66","5228 → 42388 [ACK] Seq=1 Ack=35 Win=248 Len=0 TSval=3371048214 TSecr=3105895754"
"454","7.535698238","142.250.31.188","192.168.1.118","TLSv1.2","100","Application Data"
"455","7.537104588","192.168.1.118","142.250.31.188","TLSv1.2","110","Application Data"
"456","7.568487600","142.250.31.188","192.168.1.118","TCP","66","5228 → 42388 [ACK] Seq=35 Ack=79 Win=248 Len=0 TSval=3371048256 TSecr=3105895809"
"457","8.152454038","IntelCor_b7:52:73","Cisco-Li_5b:1c:ce","ARP","60","Who has 192.168.1.1? Tell 192.168.1.118"
"458","8.154596675","Cisco-Li_5b:1c:ce","IntelCor_b7:52:73","ARP","42","192.168.1.1 is at 58:6d:8f:5b:1c:ce"
