frame.number,_ws.col.Time,_ws.col.Source,_ws.col.Destination,_ws.col.Protocol,frame.len,_ws.col.Info
"1","0.000000000","136.147.56.129","192.168.1.118","SSL","1414","Continuation Data"
"2","0.005052287","136.147.56.129","192.168.1.118","SSL","8154","Continuation Data"
"3","0.005227687","136.147.56.129","192.168.1.118","SSL","2183","Continuation Data"
"4","0.005296550","136.147.56.129","192.168.1.118","TCP","74","443 → 36012 [SYN, ACK] Seq=0 Ack=1 Win=4380 Len=0 MSS=1360 TSval=596843843 TSecr=3014416026 SACK_PERM=1"
"5","0.005433537","192.168.1.118","136.147.56.129","TCP","66","36012 → 443 [ACK] Seq=1 Ack=1 Win=64240 Len=0 TSval=3014416128 TSecr=596843843"
"6","0.025800750","192.168.1.118","136.147.56.129","TCP","66","36010 → 443 [ACK] Seq=1 Ack=11554 Win=48528 Len=0 TSval=3014416149 TSecr=596843839"
"7","0.042705725","192.168.1.118","136.147.56.129","TLSv1","583","Client Hello"
"8","0.043881062","192.168.1.118","209.18.47.62","DNS","77","Standard query 0xc789 A c1.sfdcstatic.com"
"9","0.044771437","192.168.1.118","209.18.47.62","DNS","77","Standard query 0x93cd A c1.sfdcstatic.com"
"10","0.045566150","192.168.1.118","209.18.47.62","DNS","77","Standard query 0x7b4f A c1.sfdcstatic.com"
"11","0.046596375","192.168.1.118","209.18.47.62","DNS","77","Standard query 0x4b66 A c1.sfdcstatic.com"
"12","0.047575412","192.168.1.118","209.18.47.62","DNS","77","Standard query 0x0751 A c1.sfdcstatic.com"
"13","0.092402837","209.18.47.62","192.168.1.118","DNS","168","Standard query response 0xc789 A c1.sfdcstatic.com CNAME c.sfdcstatic.com.edgekey.net CNAME e4745.b.akamaiedge.net A 104.107.48.175"
"14","0.092761912","192.168.1.118","209.18.47.62","DNS","77","Standard query 0x5ff7 AAAA c1.sfdcstatic.com"
"15","0.093425850","209.18.47.62","192.168.1.118","DNS","168","Standard query response 0x0751 A c1.sfdcstatic.com CNAME c.sfdcstatic.com.edgekey.net CNAME e4745.b.akamaiedge.net A 104.107.48.175"
"16","0.093568450","209.18.47.62","192.168.1.118","DNS","168","Standard query response 0x93cd A c1.sfdcstatic.com CNAME c.sfdcstatic.com.edgekey.net CNAME e4745.b.akamaiedge.net A 104.107.48.175"
"17","0.093654000","209.18.47.62","192.168.1.118","DNS","168","Standard query response 0x4b66 A c1.sfdcstatic.com CNAME c.sfdcstatic.com.edgekey.net CNAME e4745.b.akamaiedge.net A 104.107.48.175"
"18","0.093734462","209.18.47.62","192.168.1.118","DNS","168","Standard query response 0x7b4f A c1.sfdcstatic.com CNAME c.sfdcstatic.com.edgekey.net CNAME e4745.b.akamaiedge.net A 104.107.48.175"
"19","0.094095712","192.168.1.118","209.18.47.62","DNS","77","Standard query 0x5b70 AAAA c1.sfdcstatic.com"
"20","0.094339687","192.168.1.118","209.18.47.62","DNS","77","Standard query 0x1774 AAAA c1.sfdcstatic.com"
"21","0.094552637","192.168.1.118","209.18.47.62","DNS","77","Standard query 0x2fa2 AAAA c1.sfdcstatic.com"
"22","0.094764025","192.168.1.118","209.18.47.62","DNS","77","Standard query 0x1b77 AAAA c1.sfdcstatic.com"
"23","0.107882425","136.147.56.129","192.168.1.118","SSL","3023","Continuation Data"
"24","0.107996387","192.168.1.118","136.147.56.129","TCP","66","36010 → 443 [ACK] Seq=1 Ack=14511 Win=57964 Len=0 TSval=3014416231 TSecr=596843972"
"25","0.119233400","136.147.56.129","192.168.1.118","TCP","66","443 → 36012 [ACK] Seq=1 Ack=518 Win=4597 Len=0 TSval=596843992 TSecr=3014416166"
"26","0.119399175","136.147.56.129","192.168.1.118","TLSv1.2","4110","Server Hello"
"27","0.119476750","192.168.1.118","136.147.56.129","TCP","66","36012 → 443 [ACK] Seq=518 Ack=4045 Win=60196 Len=0 TSval=3014416242 TSecr=596843995"
"28","0.123058725","209.18.47.62","192.168.1.118","DNS","210","Standard query response 0x5b70 AAAA c1.sfdcstatic.com CNAME c.sfdcstatic.com.edgekey.net CNAME e4745.b.akamaiedge.net SOA n0b.akamaiedge.net"
"29","0.123156187","209.18.47.62","192.168.1.118","DNS","210","Standard query response 0x5ff7 AAAA c1.sfdcstatic.com CNAME c.sfdcstatic.com.edgekey.net CNAME e4745.b.akamaiedge.net SOA n0b.akamaiedge.net"
"30","0.128535650","209.18.47.62","192.168.1.118","DNS","210","Standard query response 0x1774 AAAA c1.sfdcstatic.com CNAME c.sfdcstatic.com.edgekey.net CNAME e4745.b.akamaiedge.net SOA n0b.akamaiedge.net"
"31","0.128638825","209.18.47.62","192.168.1.118","DNS","210","Standard query response 0x2fa2 AAAA c1.sfdcstatic.com CNAME c.sfdcstatic.com.edgekey.net CNAME e4745.b.akamaiedge.net SOA n0b.akamaiedge.net"
"32","0.133061625","209.18.47.62","192.168.1.118","DNS","210","Standard query response 0x1b77 AAAA c1.sfdcstatic.com CNAME c.sfdcstatic.com.edgekey.net CNAME e4745.b.akamaiedge.net SOA n0b.akamaiedge.net"
"33","0.141613100","192.168.1.118","104.107.48.175","TCP","74","45732 → 443 [SYN] Seq=0 Win=64240 Len=0 MSS=1460 SACK_PERM=1 TSval=1024983886 TSecr=0 WS=128"
"34","0.141725750","192.168.1.118","104.107.48.175","TCP","74","45734 → 443 [SYN] Seq=0 Win=64240 Len=0 MSS=1460 SACK_PERM=1 TSval=1024983886 TSecr=0 WS=128"
"35","0.141802075","192.168.1.118","104.107.48.175","TCP","74","45736 → 443 [SYN] Seq=0 Win=64240 Len=0 MSS=1460 SACK_PERM=1 TSval=1024983886 TSecr=0 WS=128"
"36","0.141880550","192.168.1.118","104.107.48.175","TCP","74","45738 → 443 [SYN] Seq=0 Win=64240 Len=0 MSS=1460 SACK_PERM=1 TSval=1024983886 TSecr=0 WS=128"
"37","0.141981712","192.168.1.118","104.107.48.175","TCP","74","45740 → 443 [SYN] Seq=0 Win=64240 Len=0 MSS=1460 SACK_PERM=1 TSval=1024983886 TSecr=0 WS=128"
"38","0.160010512","104.107.48.175","192.168.1.118","TCP","74","443 → 45732 [SYN, ACK] Seq=0 Ack=1 Win=28960 Len=0 MSS=1460 SACK_PERM=1 TSval=893677998 TSecr=1024983886 WS=128"
"39","0.160104775","192.168.1.118","104.107.48.175","TCP","66","45732 → 443 [ACK] Seq=1 Ack=1 Win=64256 Len=0 TSval=1024983904 TSecr=893677998"
"40","0.165736662","104.107.48.175","192.168.1.118","TCP","74","443 → 45734 [SYN, ACK] Seq=0 Ack=1 Win=28960 Len=0 MSS=1460 SACK_PERM=1 TSval=893678004 TSecr=1024983886 WS=128"
"41","0.165764975","192.168.1.118","104.107.48.175","TCP","66","45734 → 443 [ACK] Seq=1 Ack=1 Win=64256 Len=0 TSval=1024983910 TSecr=893678004"
"42","0.171127912","104.107.48.175","192.168.1.118","TCP","74","443 → 45736 [SYN, ACK] Seq=0 Ack=1 Win=28960 Len=0 MSS=1460 SACK_PERM=1 TSval=893678004 TSecr=1024983886 WS=128"
"43","0.171237325","192.168.1.118","104.107.48.175","TCP","66","45736 → 443 [ACK] Seq=1 Ack=1 Win=64256 Len=0 TSval=1024983915 TSecr=893678004"
"44","0.172578500","104.107.48.175","192.168.1.118","TCP","74","443 → 45738 [SYN, ACK] Seq=0 Ack=1 Win=28960 Len=0 MSS=1460 SACK_PERM=1 TSval=893678004 TSecr=1024983886 WS=128"
"45","0.172689687","192.168.1.118","104.107.48.175","TCP","66","45738 → 443 [ACK] Seq=1 Ack=1 Win=64256 Len=0 TSval=1024983917 TSecr=893678004"
"46","0.172746487","104.107.48.175","192.168.1.118","TCP","74","443 → 45740 [SYN, ACK] Seq=0 Ack=1 Win=28960 Len=0 MSS=1460 SACK_PERM=1 TSval=893678004 TSecr=1024983886 WS=128"
"47","0.172791087","192.168.1.118","104.107.48.175","TCP","66","45740 → 443 [ACK] Seq=1 Ack=1 Win=64256 Len=0 TSval=1024983917 TSecr=893678004"
"48","0.179591800","192.168.1.118","104.107.48.175","TLSv1","583","Client Hello"
"49","0.183327900","136.147.56.129","192.168.1.118","TLSv1.2","1108","Certificate, Server Key Exchange, Server Hello Done"
"50","0.183393912","192.168.1.118","136.147.56.129","TCP","66","36012 → 443 [ACK] Seq=518 Ack=5087 Win=62008 Len=0 TSval=3014416306 TSecr=596844063"
"51","0.196018862","192.168.1.118","104.107.48.175","TLSv1","583","Client Hello"
"52","0.208862875","104.107.48.175","192.168.1.118","TCP","66","443 → 45732 [ACK] Seq=1 Ack=518 Win=30080 Len=0 TSval=893678041 TSecr=1024983924"
"53","0.212414812","192.168.1.118","104.107.48.175","TLSv1","583","Client Hello"
"54","0.215086400","104.107.48.175","192.168.1.118","TLSv1.2","3339","Server Hello, Certificate, Server Key Exchange, Server Hello Done"
"55","0.215154650","192.168.1.118","104.107.48.175","TCP","66","45732 → 443 [ACK] Seq=518 Ack=3274 Win=61056 Len=0 TSval=1024983959 TSecr=893678043"
"56","0.216390262","104.107.48.175","192.168.1.118","TCP","66","443 → 45734 [ACK] Seq=1 Ack=518 Win=30080 Len=0 TSval=893678053 TSecr=1024983940"
"57","0.218449200","104.107.48.175","192.168.1.118","TLSv1.2","1514","Server Hello"
"58","0.218518800","192.168.1.118","104.107.48.175","TCP","66","45734 → 443 [ACK] Seq=518 Ack=1449 Win=63104 Len=0 TSval=1024983963 TSecr=893678055"
"59","0.228832912","192.168.1.118","104.107.48.175","TLSv1","583","Client Hello"
"60","0.230672687","104.107.48.175","192.168.1.118","TLSv1.2","1891","Certificate, Server Key Exchange, Server Hello Done"
"61","0.230760262","192.168.1.118","104.107.48.175","TCP","66","45734 → 443 [ACK] Seq=518 Ack=3274 Win=61312 Len=0 TSval=1024983975 TSecr=893678055"
"62","0.232274862","104.107.48.175","192.168.1.118","TCP","66","443 → 45736 [ACK] Seq=1 Ack=518 Win=30080 Len=0 TSval=893678067 TSecr=1024983956"
"63","0.232413212","104.107.48.175","192.168.1.118","TLSv1.2","3339","Server Hello, Certificate, Server Key Exchange, Server Hello Done"
"64","0.232492100","192.168.1.118","104.107.48.175","TCP","66","45736 → 443 [ACK] Seq=518 Ack=3274 Win=61056 Len=0 TSval=1024983976 TSecr=893678069"
"65","0.245316387","192.168.1.118","104.107.48.175","TLSv1","583","Client Hello"
"66","0.247387975","192.168.1.118","136.147.56.129","TLSv1.2","192","Client Key Exchange, Change Cipher Spec, Encrypted Handshake Message"
"67","0.247519025","104.107.48.175","192.168.1.118","TCP","66","443 → 45738 [ACK] Seq=1 Ack=518 Win=30080 Len=0 TSval=893678082 TSecr=1024983973"
"68","0.249285262","192.168.1.118","104.107.48.175","TLSv1.2","192","Client Key Exchange, Change Cipher Spec, Encrypted Handshake Message"
"69","0.251165137","192.168.1.118","104.107.48.175","TLSv1.2","192","Client Key Exchange, Change Cipher Spec, Encrypted Handshake Message"
"70","0.253057100","192.168.1.118","104.107.48.175","TLSv1.2","192","Client Key Exchange, Change Cipher Spec, Encrypted Handshake Message"
"71","0.253797575","104.107.48.175","192.168.1.118","TLSv1.2","3339","Server Hello, Certificate, Server Key Exchange, Server Hello Done"
"72","0.253882925","192.168.1.118","104.107.48.175","TCP","66","45738 → 443 [ACK] Seq=518 Ack=3274 Win=61056 Len=0 TSval=1024983998 TSecr=893678084"
"73","0.256043650","192.168.1.118","104.107.48.175","TLSv1.2","192","Client Key Exchange, Change Cipher Spec, Encrypted Handshake Message"
"74","0.267121150","104.107.48.175","192.168.1.118","TCP","66","443 → 45740 [ACK] Seq=1 Ack=518 Win=30080 Len=0 TSval=893678104 TSecr=1024983989"
"75","0.278131162","104.107.48.175","192.168.1.118","TLSv1.2","3339","Server Hello, Certificate, Server Key Exchange, Server Hello Done"
"76","0.278212925","192.168.1.118","104.107.48.175","TCP","66","45740 → 443 [ACK] Seq=518 Ack=3274 Win=61056 Len=0 TSval=1024984022 TSecr=893678106"
"77","0.280611937","192.168.1.118","104.107.48.175","TLSv1.2","192","Client Key Exchange, Change Cipher Spec, Encrypted Handshake Message"
"78","0.285341487","104.107.48.175","192.168.1.118","TLSv1.2","117","Change Cipher Spec, Encrypted Handshake Message"
"79","0.285395150","104.107.48.175","192.168.1.118","TLSv1.2","117","Change Cipher Spec, Encrypted Handshake Message"
"80","0.285435287","104.107.48.175","192.168.1.118","TLSv1.2","117","Change Cipher Spec, Encrypted Handshake Message"
"81","0.285473050","104.107.48.175","192.168.1.118","TLSv1.2","117","Change Cipher Spec, Encrypted Handshake Message"
"82","0.285699500","192.168.1.118","104.107.48.175","TLSv1.2","320","Application Data"
"83","0.285986650","192.168.1.118","104.107.48.175","TLSv1.2","309","Application Data"
"84","0.286208825","192.168.1.118","104.107.48.175","TLSv1.2","296","Application Data"
"85","0.287443150","192.168.1.118","104.107.48.175","TLSv1.2","336","Application Data"
"86","0.308180150","136.147.56.129","192.168.1.118","TCP","66","443 → 36012 [ACK] Seq=5087 Ack=644 Win=4723 Len=0 TSval=596844189 TSecr=3014416370"
"87","0.309101537","136.147.56.129","192.168.1.118","TLSv1.2","72","Change Cipher Spec"
"88","0.309186837","192.168.1.118","136.147.56.129","TCP","66","36012 → 443 [ACK] Seq=644 Ack=5093 Win=63356 Len=0 TSval=3014416432 TSecr=596844189"
"89","0.309282262","136.147.56.129","192.168.1.118","TLSv1.2","111","Encrypted Handshake Message"
"90","0.309354675","192.168.1.118","136.147.56.129","TCP","66","36012 → 443 [ACK] Seq=644 Ack=5138 Win=63356 Len=0 TSval=3014416432 TSecr=596844190"
"91","0.309728912","192.168.1.118","136.147.56.129","TLSv1.2","307","Application Data"
"92","0.312810337","104.107.48.175","192.168.1.118","TCP","1514","[TCP segment of a reassembled PDU]"
"93","0.316435225","104.107.48.175","192.168.1.118","TCP","5858","443 → 45734 [ACK] Seq=4773 Ack=898 Win=31104 Len=5792 TSval=893678151 TSecr=1024984030 [TCP segment of a reassembled PDU]"
"94","0.317171725","192.168.1.118","104.107.48.175","TCP","66","45734 → 443 [ACK] Seq=898 Ack=10565 Win=64128 Len=0 TSval=1024984061 TSecr=893678151"
"95","0.318068625","104.107.48.175","192.168.1.118","TLSv1.2","1305","Application Data"
"96","0.318186950","104.107.48.175","192.168.1.118","TCP","2962","[TCP segment of a reassembled PDU]"
"97","0.319039912","104.107.48.175","192.168.1.118","TLSv1.2","18890","Application Data [TCP segment of a reassembled PDU]"
"98","0.319678375","192.168.1.118","104.107.48.175","TCP","66","45736 → 443 [ACK] Seq=887 Ack=25045 Win=42496 Len=0 TSval=1024984064 TSecr=893678151"
"99","0.320736537","104.107.48.175","192.168.1.118","TLSv1.2","3636","Application Data"
"100","0.320811737","104.107.48.175","192.168.1.118","TLSv1.2","117","Change Cipher Spec, Encrypted Handshake Message"
"101","0.320899237","104.107.48.175","192.168.1.118","TLSv1.2","2691","Application Data"
"102","0.320972512","104.107.48.175","192.168.1.118","TCP","1514","443 → 45736 [ACK] Seq=25045 Ack=887 Win=31104 Len=1448 TSval=893678151 TSecr=1024984030 [TCP segment of a reassembled PDU]"
"103","0.321178937","192.168.1.118","104.107.48.175","TCP","66","45732 → 443 [ACK] Seq=914 Ack=5950 Win=61568 Len=0 TSval=1024984065 TSecr=893678156"
"104","0.321533362","192.168.1.118","104.107.48.175","TCP","66","45738 → 443 [ACK] Seq=874 Ack=6895 Win=60672 Len=0 TSval=1024984066 TSecr=893678152"
"105","0.322046087","192.168.1.118","104.107.48.175","TLSv1.2","305","Application Data"
"106","0.323772175","192.168.1.118","104.107.48.175","TLSv1.2","307","Application Data"
"107","0.323898587","192.168.1.118","104.107.48.175","TLSv1.2","305","Application Data"
"108","0.324020612","192.168.1.118","104.107.48.175","TLSv1.2","293","Application Data"
"109","0.345091475","104.107.48.175","192.168.1.118","TCP","1514","443 → 45736 [ACK] Seq=26493 Ack=887 Win=31104 Len=1448 TSval=893678183 TSecr=1024984064 [TCP segment of a reassembled PDU]"
"110","0.345153162","192.168.1.118","104.107.48.175","TCP","66","45736 → 443 [ACK] Seq=887 Ack=27941 Win=63104 Len=0 TSval=1024984089 TSecr=893678151"
"111","0.346992900","104.107.48.175","192.168.1.118","TCP","7306","443 → 45736 [ACK] Seq=27941 Ack=887 Win=31104 Len=7240 TSval=893678183 TSecr=1024984064 [TCP segment of a reassembled PDU]"
"112","0.350839037","104.107.48.175","192.168.1.118","TLSv1.2","2962","Application Data, Application Data"
"113","0.351014325","104.107.48.175","192.168.1.118","TCP","8754","443 → 45736 [ACK] Seq=38077 Ack=887 Win=31104 Len=8688 TSval=893678183 TSecr=1024984064 [TCP segment of a reassembled PDU]"
"114","0.357185275","104.107.48.175","192.168.1.118","TCP","2962","443 → 45736 [ACK] Seq=46765 Ack=887 Win=31104 Len=2896 TSval=893678183 TSecr=1024984064 [TCP segment of a reassembled PDU]"
"115","0.360555562","104.107.48.175","192.168.1.118","TCP","2962","443 → 45736 [ACK] Seq=49661 Ack=887 Win=31104 Len=2896 TSval=893678183 TSecr=1024984064 [TCP segment of a reassembled PDU]"
"116","0.360641987","104.107.48.175","192.168.1.118","TLSv1.2","2962","Application Data [TCP segment of a reassembled PDU]"
"117","0.362664637","104.107.48.175","192.168.1.118","TLSv1.2","6149","Application Data"
"118","0.365192212","104.107.48.175","192.168.1.118","TLSv1.2","671","Application Data"
"119","0.365891400","136.147.56.129","192.168.1.118","TCP","66","443 → 36012 [ACK] Seq=5138 Ack=885 Win=4964 Len=0 TSval=596844247 TSecr=3014416433"
"120","0.371159737","104.107.48.175","192.168.1.118","TCP","1514","443 → 45736 [ACK] Seq=55453 Ack=887 Win=31104 Len=1448 TSval=893678209 TSecr=1024984089 [TCP segment of a reassembled PDU]"
"121","0.372411187","104.107.48.175","192.168.1.118","TCP","2962","443 → 45736 [ACK] Seq=56901 Ack=887 Win=31104 Len=2896 TSval=893678209 TSecr=1024984089 [TCP segment of a reassembled PDU]"
"122","0.373647025","192.168.1.118","104.107.48.175","TCP","66","45736 → 443 [ACK] Seq=887 Ack=59797 Win=64128 Len=0 TSval=1024984118 TSecr=893678183"
"123","0.375122512","192.168.1.118","104.107.48.175","TCP","66","45740 → 443 [ACK] Seq=883 Ack=9408 Win=58112 Len=0 TSval=1024984119 TSecr=893678198"
"124","0.375848237","192.168.1.118","209.18.47.62","DNS","80","Standard query 0xef7b A fonts.googleapis.com"
"125","0.380499825","104.107.48.175","192.168.1.118","TCP","1514","443 → 45736 [ACK] Seq=59797 Ack=887 Win=31104 Len=1448 TSval=893678209 TSecr=1024984089 [TCP segment of a reassembled PDU]"
"126","0.391608087","104.107.48.175","192.168.1.118","TCP","1514","443 → 45736 [ACK] Seq=61245 Ack=887 Win=31104 Len=1448 TSval=893678229 TSecr=1024984118 [TCP segment of a reassembled PDU]"
"127","0.391654187","192.168.1.118","104.107.48.175","TCP","66","45736 → 443 [ACK] Seq=887 Ack=62693 Win=69888 Len=0 TSval=1024984136 TSecr=893678209"
"128","0.393231262","104.107.48.175","192.168.1.118","TCP","2962","443 → 45736 [ACK] Seq=62693 Ack=887 Win=31104 Len=2896 TSval=893678229 TSecr=1024984118 [TCP segment of a reassembled PDU]"
"129","0.393264287","192.168.1.118","104.107.48.175","TCP","66","45736 → 443 [ACK] Seq=887 Ack=65589 Win=75776 Len=0 TSval=1024984137 TSecr=893678229"
"130","0.394607075","104.107.48.175","192.168.1.118","TLSv1.2","1514","Application Data [TCP segment of a reassembled PDU]"
"131","0.395702875","104.107.48.175","192.168.1.118","TCP","2962","[TCP segment of a reassembled PDU]"
"132","0.396842962","104.107.48.175","192.168.1.118","TLSv1.2","1732","Application Data"
"133","0.397986500","104.107.48.175","192.168.1.118","TCP","2962","443 → 45736 [ACK] Seq=67037 Ack=887 Win=31104 Len=2896 TSval=893678230 TSecr=1024984118 [TCP segment of a reassembled PDU]"
"134","0.398025550","192.168.1.118","104.107.48.175","TCP","66","45736 → 443 [ACK] Seq=887 Ack=69933 Win=84480 Len=0 TSval=1024984142 TSecr=893678229"
"135","0.398735812","104.107.48.175","192.168.1.118","TCP","2962","443 → 45736 [ACK] Seq=69933 Ack=887 Win=31104 Len=2896 TSval=893678230 TSecr=1024984118 [TCP segment of a reassembled PDU]"
"136","0.398784187","192.168.1.118","104.107.48.175","TCP","66","45736 → 443 [ACK] Seq=887 Ack=72829 Win=90240 Len=0 TSval=1024984143 TSecr=893678230"
"137","0.403100737","104.107.48.175","192.168.1.118","TLSv1.2","2533","Application Data"
"138","0.403151125","104.107.48.175","192.168.1.118","TCP","2962","443 → 45736 [ACK] Seq=72829 Ack=887 Win=31104 Len=2896 TSval=893678231 TSecr=1024984118 [TCP segment of a reassembled PDU]"
"139","0.403194750","192.168.1.118","104.107.48.175","TCP","66","45736 → 443 [ACK] Seq=887 Ack=75725 Win=96000 Len=0 TSval=1024984147 TSecr=893678231"
"140","0.403250200","104.107.48.175","192.168.1.118","TCP","2962","443 → 45736 [ACK] Seq=75725 Ack=887 Win=31104 Len=2896 TSval=893678232 TSecr=1024984118 [TCP segment of a reassembled PDU]"
"141","0.403294375","192.168.1.118","104.107.48.175","TCP","66","45736 → 443 [ACK] Seq=887 Ack=78621 Win=101760 Len=0 TSval=1024984147 TSecr=893678232"
"142","0.405106175","104.107.48.175","192.168.1.118","TCP","2962","443 → 45736 [ACK] Seq=78621 Ack=887 Win=31104 Len=2896 TSval=893678232 TSecr=1024984118 [TCP segment of a reassembled PDU]"
"143","0.405148637","192.168.1.118","104.107.48.175","TCP","66","45736 → 443 [ACK] Seq=887 Ack=81517 Win=107648 Len=0 TSval=1024984149 TSecr=893678232"
"144","0.405255162","209.18.47.62","192.168.1.118","DNS","96","Standard query response 0xef7b A fonts.googleapis.com A 172.217.12.170"
"145","0.405329437","104.107.48.175","192.168.1.118","TLSv1.2","2962","Application Data [TCP segment of a reassembled PDU]"
"146","0.405374275","192.168.1.118","104.107.48.175","TCP","66","45736 → 443 [ACK] Seq=887 Ack=84413 Win=113408 Len=0 TSval=1024984149 TSecr=893678233"
"147","0.405434300","104.107.48.175","192.168.1.118","TCP","2962","443 → 45736 [ACK] Seq=84413 Ack=887 Win=31104 Len=2896 TSval=893678234 TSecr=1024984118 [TCP segment of a reassembled PDU]"
"148","0.405478200","192.168.1.118","104.107.48.175","TCP","66","45736 → 443 [ACK] Seq=887 Ack=87309 Win=119168 Len=0 TSval=1024984149 TSecr=893678234"
"149","0.405559825","104.107.48.175","192.168.1.118","TCP","5858","443 → 45736 [ACK] Seq=87309 Ack=887 Win=31104 Len=5792 TSval=893678235 TSecr=1024984118 [TCP segment of a reassembled PDU]"
"150","0.405606387","192.168.1.118","104.107.48.175","TCP","66","45736 → 443 [ACK] Seq=887 Ack=93101 Win=130816 Len=0 TSval=1024984150 TSecr=893678235"
"151","0.405667412","104.107.48.175","192.168.1.118","TCP","2962","443 → 45736 [ACK] Seq=93101 Ack=887 Win=31104 Len=2896 TSval=893678236 TSecr=1024984118 [TCP segment of a reassembled PDU]"
"152","0.405712537","192.168.1.118","104.107.48.175","TCP","66","45736 → 443 [ACK] Seq=887 Ack=95997 Win=136576 Len=0 TSval=1024984150 TSecr=893678236"
"153","0.405773625","104.107.48.175","192.168.1.118","TCP","2962","443 → 45736 [ACK] Seq=95997 Ack=887 Win=31104 Len=2896 TSval=893678237 TSecr=1024984118 [TCP segment of a reassembled PDU]"
"154","0.405817425","192.168.1.118","104.107.48.175","TCP","66","45736 → 443 [ACK] Seq=887 Ack=98893 Win=142336 Len=0 TSval=1024984150 TSecr=893678237"
"155","0.405856525","104.107.48.175","192.168.1.118","TLSv1.2","1514","Application Data [TCP segment of a reassembled PDU]"
"156","0.406055162","192.168.1.118","104.107.48.175","TCP","66","45732 → 443 [ACK] Seq=1155 Ack=6555 Win=64128 Len=0 TSval=1024984150 TSecr=893678203"
"157","0.406204275","192.168.1.118","209.18.47.62","DNS","80","Standard query 0x0fc7 AAAA fonts.googleapis.com"
"158","0.415728975","104.107.48.175","192.168.1.118","TCP","4410","443 → 45736 [ACK] Seq=100341 Ack=887 Win=31104 Len=4344 TSval=893678238 TSecr=1024984118 [TCP segment of a reassembled PDU]"
"159","0.415793637","192.168.1.118","104.107.48.175","TCP","66","45736 → 443 [ACK] Seq=887 Ack=104685 Win=153984 Len=0 TSval=1024984160 TSecr=893678238"
"160","0.415830162","104.107.48.175","192.168.1.118","TCP","1514","443 → 45736 [ACK] Seq=104685 Ack=887 Win=31104 Len=1448 TSval=893678239 TSecr=1024984118 [TCP segment of a reassembled PDU]"
"161","0.415972000","104.107.48.175","192.168.1.118","TLSv1.2","1514","Application Data [TCP segment of a reassembled PDU]"
"162","0.416021987","192.168.1.118","104.107.48.175","TCP","66","45736 → 443 [ACK] Seq=887 Ack=107581 Win=159744 Len=0 TSval=1024984160 TSecr=893678239"
"163","0.416084312","104.107.48.175","192.168.1.118","TCP","2962","443 → 45736 [PSH, ACK] Seq=107581 Ack=887 Win=31104 Len=2896 TSval=893678240 TSecr=1024984118 [TCP segment of a reassembled PDU]"
"164","0.416139000","192.168.1.118","104.107.48.175","TCP","66","45736 → 443 [ACK] Seq=887 Ack=110477 Win=165504 Len=0 TSval=1024984160 TSecr=893678240"
"165","0.417262987","104.107.48.175","192.168.1.118","TCP","1514","443 → 45736 [ACK] Seq=110477 Ack=887 Win=31104 Len=1448 TSval=893678255 TSecr=1024984142 [TCP segment of a reassembled PDU]"
"166","0.418788887","104.107.48.175","192.168.1.118","TCP","5858","443 → 45736 [ACK] Seq=111925 Ack=887 Win=31104 Len=5792 TSval=893678255 TSecr=1024984142 [TCP segment of a reassembled PDU]"
"167","0.418846112","192.168.1.118","104.107.48.175","TCP","66","45736 → 443 [ACK] Seq=887 Ack=117717 Win=179968 Len=0 TSval=1024984163 TSecr=893678255"
"168","0.420204200","104.107.48.175","192.168.1.118","TCP","5858","443 → 45736 [ACK] Seq=117717 Ack=887 Win=31104 Len=5792 TSval=893678255 TSecr=1024984142 [TCP segment of a reassembled PDU]"
"169","0.420237237","192.168.1.118","104.107.48.175","TCP","66","45734 → 443 [ACK] Seq=1137 Ack=14271 Win=61696 Len=0 TSval=1024984164 TSecr=893678233"
"170","0.420279062","192.168.1.118","104.107.48.175","TCP","66","45736 → 443 [ACK] Seq=887 Ack=123509 Win=191616 Len=0 TSval=1024984164 TSecr=893678255"
"171","0.420328687","104.107.48.175","192.168.1.118","TLSv1.2","1514","Application Data [TCP segment of a reassembled PDU]"
"172","0.420437012","192.168.1.118","104.107.48.175","TCP","66","45738 → 443 [ACK] Seq=1101 Ack=11457 Win=59648 Len=0 TSval=1024984164 TSecr=893678231"
"173","0.420684762","192.168.1.118","104.107.48.175","TLSv1.2","317","Application Data"
"174","0.420794337","192.168.1.118","104.107.48.175","TLSv1.2","340","Application Data"
"175","0.422859525","104.107.48.175","192.168.1.118","TCP","5858","443 → 45736 [ACK] Seq=124957 Ack=887 Win=31104 Len=5792 TSval=893678256 TSecr=1024984142 [TCP segment of a reassembled PDU]"
"176","0.422933487","192.168.1.118","104.107.48.175","TCP","66","45736 → 443 [ACK] Seq=887 Ack=130749 Win=200960 Len=0 TSval=1024984167 TSecr=893678256"
"177","0.423106237","104.107.48.175","192.168.1.118","TLSv1.2","1514","Application Data [TCP segment of a reassembled PDU]"
"178","0.423157425","104.107.48.175","192.168.1.118","TCP","1514","443 → 45736 [ACK] Seq=132197 Ack=887 Win=31104 Len=1448 TSval=893678257 TSecr=1024984142 [TCP segment of a reassembled PDU]"
"179","0.426195575","104.107.48.175","192.168.1.118","TCP","2962","443 → 45736 [ACK] Seq=133645 Ack=887 Win=31104 Len=2896 TSval=893678257 TSecr=1024984142 [TCP segment of a reassembled PDU]"
"180","0.426311050","104.107.48.175","192.168.1.118","TCP","4410","443 → 45736 [ACK] Seq=136541 Ack=887 Win=31104 Len=4344 TSval=893678258 TSecr=1024984142 [TCP segment of a reassembled PDU]"
"181","0.426424312","104.107.48.175","192.168.1.118","TCP","4410","443 → 45736 [ACK] Seq=140885 Ack=887 Win=31104 Len=4344 TSval=893678259 TSecr=1024984142 [TCP segment of a reassembled PDU]"
"182","0.430155625","104.107.48.175","192.168.1.118","TLSv1.2","5035","Application Data, Application Data"
"183","0.446438375","209.18.47.62","192.168.1.118","DNS","108","Standard query response 0x0fc7 AAAA fonts.googleapis.com AAAA 2607:f8b0:4006:81a::200a"
"184","0.457859412","104.107.48.175","192.168.1.118","TCP","2962","[TCP segment of a reassembled PDU]"
"185","0.457931800","192.168.1.118","104.107.48.175","TCP","66","45732 → 443 [ACK] Seq=1406 Ack=9451 Win=61312 Len=0 TSval=1024984202 TSecr=893678285"
"186","0.463768150","104.107.48.175","192.168.1.118","TLSv1.2","871","Application Data"
"187","0.463851100","104.107.48.175","192.168.1.118","TCP","11650","443 → 45732 [ACK] Seq=9451 Ack=1406 Win=33280 Len=11584 TSval=893678285 TSecr=1024984165 [TCP segment of a reassembled PDU]"
"188","0.463890112","192.168.1.118","104.107.48.175","TCP","66","45732 → 443 [ACK] Seq=1406 Ack=21035 Win=49792 Len=0 TSval=1024984208 TSecr=893678285"
"189","0.463948512","104.107.48.175","192.168.1.118","TLSv1.2","7306","Application Data [TCP segment of a reassembled PDU]"
"190","0.463983087","192.168.1.118","104.107.48.175","TCP","66","45732 → 443 [ACK] Seq=1406 Ack=28275 Win=42624 Len=0 TSval=1024984208 TSecr=893678286"
"191","0.464008350","192.168.1.118","104.107.48.175","TCP","66","45736 → 443 [ACK] Seq=887 Ack=150198 Win=181632 Len=0 TSval=1024984208 TSecr=893678256"
"192","0.465790900","104.107.48.175","192.168.1.118","TLSv1.2","6812","Application Data"
"193","0.465843637","104.107.48.175","192.168.1.118","TCP","1514","[TCP Spurious Retransmission] 443 → 45736 [ACK] Seq=130749 Ack=887 Win=31104 Len=1448 TSval=893678300 TSecr=1024984167[Reassembly error, protocol TCP: New fragment overlaps old data (retransmission?)]"
"194","0.465874062","192.168.1.118","104.107.48.175","TCP","78","[TCP Dup ACK 191#1] 45736 → 443 [ACK] Seq=887 Ack=150198 Win=181632 Len=0 TSval=1024984210 TSecr=893678256 SLE=130749 SRE=132197"
"195","0.481671212","192.168.1.118","172.217.12.170","TCP","74","41386 → 443 [SYN] Seq=0 Win=64240 Len=0 MSS=1460 SACK_PERM=1 TSval=3415128421 TSecr=0 WS=128"
"196","0.481761762","192.168.1.118","104.107.48.175","TCP","66","45732 → 443 [ACK] Seq=1406 Ack=35021 Win=35968 Len=0 TSval=1024984226 TSecr=893678286"
"197","0.504032587","192.168.1.118","104.107.48.175","TCP","66","45734 → 443 [ACK] Seq=1411 Ack=15076 Win=64128 Len=0 TSval=1024984248 TSecr=893678285"
"198","0.504319787","172.217.12.170","192.168.1.118","TCP","74","443 → 41386 [SYN, ACK] Seq=0 Ack=1 Win=60192 Len=0 MSS=1380 SACK_PERM=1 TSval=3525447978 TSecr=3415128421 WS=256"
"199","0.504430312","192.168.1.118","172.217.12.170","TCP","66","41386 → 443 [ACK] Seq=1 Ack=1 Win=64256 Len=0 TSval=3415128443 TSecr=3525447978"
"200","0.571987887","192.168.1.118","172.217.12.170","TLSv1","583","Client Hello"
"201","0.593320650","172.217.12.170","192.168.1.118","TCP","66","443 → 41386 [ACK] Seq=1 Ack=518 Win=61440 Len=0 TSval=3525448063 TSecr=3415128511"
"202","0.599457012","172.217.12.170","192.168.1.118","TLSv1.2","1484","Server Hello"
"203","0.599589112","192.168.1.118","172.217.12.170","TCP","66","41386 → 443 [ACK] Seq=518 Ack=1419 Win=63104 Len=0 TSval=3415128539 TSecr=3525448069"
"204","0.609053887","172.217.12.170","192.168.1.118","TLSv1.2","1541","Certificate, Server Key Exchange, Server Hello Done"
"205","0.609179050","192.168.1.118","172.217.12.170","TCP","66","41386 → 443 [ACK] Seq=518 Ack=2894 Win=61696 Len=0 TSval=3415128548 TSecr=3525448069"
"206","0.618446850","136.147.56.129","192.168.1.118","TLSv1.2","1313","Application Data"
"207","0.620005787","192.168.1.118","172.217.12.170","TLSv1.2","192","Client Key Exchange, Change Cipher Spec, Encrypted Handshake Message"
"208","0.646484975","172.217.12.170","192.168.1.118","TLSv1.2","117","Change Cipher Spec, Encrypted Handshake Message"
"209","0.659120500","192.168.1.118","136.147.56.129","TCP","66","36012 → 443 [ACK] Seq=885 Ack=6385 Win=63356 Len=0 TSval=3014416782 TSecr=596844498"
"210","0.679978587","192.168.1.118","172.217.12.170","TLSv1.2","338","Application Data"
"211","0.705211237","172.217.12.170","192.168.1.118","TCP","66","443 → 41386 [ACK] Seq=2945 Ack=916 Win=62464 Len=0 TSval=3525448177 TSecr=3415128619"
"212","0.713335112","172.217.12.170","192.168.1.118","TLSv1.2","1139","Application Data"
"213","0.714424487","172.217.12.170","192.168.1.118","TLSv1.2","151","Application Data"
"214","0.714488012","172.217.12.170","192.168.1.118","TLSv1.2","100","Application Data"
"215","0.714658987","192.168.1.118","172.217.12.170","TCP","66","41386 → 443 [ACK] Seq=916 Ack=4137 Win=64128 Len=0 TSval=3415128654 TSecr=3525448187"
"216","0.736304412","192.168.1.118","209.18.47.62","DNS","82","Standard query 0x4311 A secure2.sfdcstatic.com"
"217","0.752168100","209.18.47.62","192.168.1.118","DNS","179","Standard query response 0x4311 A secure2.sfdcstatic.com CNAME secure2.sfdcstatic.com.edgekey.net CNAME e4745.b.akamaiedge.net A 104.102.83.39"
"218","0.752534725","192.168.1.118","209.18.47.62","DNS","82","Standard query 0x8bff AAAA secure2.sfdcstatic.com"
"219","0.774351950","209.18.47.62","192.168.1.118","DNS","221","Standard query response 0x8bff AAAA secure2.sfdcstatic.com CNAME secure2.sfdcstatic.com.edgekey.net CNAME e4745.b.akamaiedge.net SOA n0b.akamaiedge.net"
"220","0.776365775","192.168.1.118","104.102.83.39","TCP","74","44300 → 443 [SYN] Seq=0 Win=64240 Len=0 MSS=1460 SACK_PERM=1 TSval=2028385254 TSecr=0 WS=128"
"221","0.786436950","192.168.1.118","136.147.56.129","TLSv1.2","385","Application Data"
"222","0.795282475","192.168.1.118","104.107.48.175","TLSv1.2","313","Application Data"
"223","0.804257837","192.168.1.118","104.107.48.175","TLSv1.2","315","Application Data"
"224","0.810950000","104.102.83.39","192.168.1.118","TCP","74","443 → 44300 [SYN, ACK] Seq=0 Ack=1 Win=28960 Len=0 MSS=1460 SACK_PERM=1 TSval=153548325 TSecr=2028385254 WS=128"
"225","0.811175625","192.168.1.118","104.102.83.39","TCP","66","44300 → 443 [ACK] Seq=1 Ack=1 Win=64256 Len=0 TSval=2028385289 TSecr=153548325"
"226","0.825292862","104.107.48.175","192.168.1.118","TLSv1.2","1043","Application Data"
"227","0.825444350","192.168.1.118","104.107.48.175","TCP","66","45732 → 443 [ACK] Seq=1653 Ack=35998 Win=63232 Len=0 TSval=1024984569 TSecr=893678663"
"228","0.829128800","192.168.1.118","104.102.83.39","TLSv1","583","Client Hello"
"229","0.829550462","192.168.1.118","104.107.48.175","TLSv1.2","317","Application Data"
"230","0.840103562","192.168.1.118","104.107.48.175","TLSv1.2","316","Application Data"
"231","0.846027675","104.102.83.39","192.168.1.118","TCP","66","443 → 44300 [ACK] Seq=1 Ack=518 Win=30080 Len=0 TSval=153548360 TSecr=2028385307"
"232","0.848137887","104.102.83.39","192.168.1.118","TLSv1.2","1514","Server Hello"
"233","0.848270300","192.168.1.118","104.102.83.39","TCP","66","44300 → 443 [ACK] Seq=518 Ack=1449 Win=63104 Len=0 TSval=2028385326 TSecr=153548362"
"234","0.849176300","104.102.83.39","192.168.1.118","TLSv1.2","1891","Certificate, Server Key Exchange, Server Hello Done"
"235","0.849305325","192.168.1.118","104.102.83.39","TCP","66","44300 → 443 [ACK] Seq=518 Ack=3274 Win=61312 Len=0 TSval=2028385327 TSecr=153548362"
"236","0.849371237","192.168.1.118","104.107.48.175","TLSv1.2","316","Application Data"
"237","0.851300962","192.168.1.118","104.102.83.39","TLSv1.2","192","Client Key Exchange, Change Cipher Spec, Encrypted Handshake Message"
"238","0.861096525","136.147.56.129","192.168.1.118","TCP","66","443 → 36010 [ACK] Seq=14511 Ack=320 Win=5245 Len=0 TSval=596844743 TSecr=3014416909"
"239","0.861518400","192.168.1.118","104.107.48.175","TLSv1.2","318","Application Data"
"240","0.871079000","104.102.83.39","192.168.1.118","TLSv1.2","117","Change Cipher Spec, Encrypted Handshake Message"
"241","0.871841275","104.107.48.175","192.168.1.118","TLSv1.2","1093","Application Data"
"242","0.871897087","192.168.1.118","104.107.48.175","TCP","66","45734 → 443 [ACK] Seq=1660 Ack=16103 Win=63104 Len=0 TSval=1024984616 TSecr=893678709"
"243","0.872922550","192.168.1.118","104.102.83.39","TLSv1.2","305","Application Data"
"244","0.881173025","104.107.48.175","192.168.1.118","TLSv1.2","1062","Application Data"
"245","0.881233362","192.168.1.118","104.107.48.175","TCP","66","45736 → 443 [ACK] Seq=1137 Ack=151194 Win=203776 Len=0 TSval=1024984625 TSecr=893678719"
"246","0.883108887","104.107.48.175","192.168.1.118","TLSv1.2","1123","Application Data"
"247","0.887038787","104.107.48.175","192.168.1.118","TLSv1.2","904","Application Data"
"248","0.891858837","104.102.83.39","192.168.1.118","TLSv1.2","414","Application Data"
"249","0.894600375","192.168.1.118","209.18.47.62","DNS","76","Standard query 0x4f86 A a.sfdcstatic.com"
"250","0.903191137","104.107.48.175","192.168.1.118","TLSv1.2","1051","Application Data"
"251","0.910225887","192.168.1.118","104.107.48.175","TLSv1.2","316","Application Data"
"252","0.910362787","192.168.1.118","104.107.48.175","TLSv1.2","315","Application Data"
"253","0.914167637","192.168.1.118","104.107.48.175","TLSv1.2","316","Application Data"
"254","0.914303500","192.168.1.118","104.107.48.175","TLSv1.2","315","Application Data"
"255","0.915949575","209.18.47.62","192.168.1.118","DNS","167","Standard query response 0x4f86 A a.sfdcstatic.com CNAME a.sfdcstatic.com.edgekey.net CNAME e4745.b.akamaiedge.net A 104.107.48.175"
"256","0.916279525","192.168.1.118","209.18.47.62","DNS","76","Standard query 0xf3df AAAA a.sfdcstatic.com"
"257","0.933027387","192.168.1.118","104.102.83.39","TCP","66","44300 → 443 [ACK] Seq=883 Ack=3673 Win=64128 Len=0 TSval=2028385411 TSecr=153548406"
"258","0.935799662","104.107.48.175","192.168.1.118","TLSv1.2","1100","Application Data"
"259","0.941878137","209.18.47.62","192.168.1.118","DNS","209","Standard query response 0xf3df AAAA a.sfdcstatic.com CNAME a.sfdcstatic.com.edgekey.net CNAME e4745.b.akamaiedge.net SOA n0b.akamaiedge.net"
"260","0.942940300","104.107.48.175","192.168.1.118","TLSv1.2","1061","Application Data"
"261","0.943608112","192.168.1.118","104.107.48.175","TCP","74","45746 → 443 [SYN] Seq=0 Win=64240 Len=0 MSS=1460 SACK_PERM=1 TSval=1024984688 TSecr=0 WS=128"
"262","0.944009937","192.168.1.118","104.107.48.175","TCP","66","45740 → 443 [ACK] Seq=1135 Ack=10393 Win=64128 Len=0 TSval=1024984688 TSecr=893678741"
"263","0.945530287","104.107.48.175","192.168.1.118","TLSv1.2","1056","Application Data"
"264","0.954589075","104.107.48.175","192.168.1.118","TLSv1.2","1017","Application Data"
"265","0.960073750","104.107.48.175","192.168.1.118","TCP","74","443 → 45746 [SYN, ACK] Seq=0 Ack=1 Win=28960 Len=0 MSS=1460 SACK_PERM=1 TSval=893678798 TSecr=1024984688 WS=128"
"266","0.960251787","192.168.1.118","104.107.48.175","TCP","66","45746 → 443 [ACK] Seq=1 Ack=1 Win=64256 Len=0 TSval=1024984704 TSecr=893678798"
"267","0.976009137","192.168.1.118","104.107.48.175","TCP","66","45734 → 443 [ACK] Seq=1909 Ack=17137 Win=64128 Len=0 TSval=1024984720 TSecr=893678773"
"268","0.981287912","136.147.56.129","192.168.1.118","TCP","1414","[TCP segment of a reassembled PDU]"
"269","0.982576637","136.147.56.129","192.168.1.118","TLSv1.2","123","Application Data"
"270","0.983996662","192.168.1.118","104.107.48.175","TCP","66","45738 → 443 [ACK] Seq=1600 Ack=13290 Win=64128 Len=0 TSval=1024984728 TSecr=893678780"
"271","0.985994787","192.168.1.118","104.107.48.175","TCP","66","45736 → 443 [ACK] Seq=1387 Ack=152184 Win=206720 Len=0 TSval=1024984730 TSecr=893678782"
"272","0.995018812","192.168.1.118","104.107.48.175","TCP","66","45732 → 443 [ACK] Seq=2154 Ack=38006 Win=69888 Len=0 TSval=1024984739 TSecr=893678792"
"273","1.022017275","192.168.1.118","136.147.56.129","TCP","66","36010 → 443 [ACK] Seq=320 Ack=15916 Win=62008 Len=0 TSval=3014417145 TSecr=596844862"
"274","1.087415662","192.168.1.118","104.107.48.175","TLSv1","583","Client Hello"
"275","1.106275212","104.107.48.175","192.168.1.118","TCP","66","443 → 45746 [ACK] Seq=1 Ack=518 Win=30080 Len=0 TSval=893678945 TSecr=1024984831"
"276","1.108371787","104.107.48.175","192.168.1.118","TLSv1.2","1514","Server Hello"
"277","1.108408337","192.168.1.118","104.107.48.175","TCP","66","45746 → 443 [ACK] Seq=518 Ack=1449 Win=63104 Len=0 TSval=1024984852 TSecr=893678946"
"278","1.109855925","104.107.48.175","192.168.1.118","TLSv1.2","1891","Certificate, Server Key Exchange, Server Hello Done"
"279","1.109884300","192.168.1.118","104.107.48.175","TCP","66","45746 → 443 [ACK] Seq=518 Ack=3274 Win=61312 Len=0 TSval=1024984854 TSecr=893678946"
"280","1.112121900","192.168.1.118","104.107.48.175","TLSv1.2","192","Client Key Exchange, Change Cipher Spec, Encrypted Handshake Message"
"281","1.137677175","104.107.48.175","192.168.1.118","TLSv1.2","117","Change Cipher Spec, Encrypted Handshake Message"
"282","1.138134025","192.168.1.118","104.107.48.175","TLSv1.2","327","Application Data"
"283","1.167406462","104.107.48.175","192.168.1.118","TCP","1514","[TCP segment of a reassembled PDU]"
"284","1.170845912","104.107.48.175","192.168.1.118","TCP","1514","443 → 45746 [ACK] Seq=4773 Ack=905 Win=31104 Len=1448 TSval=893679005 TSecr=1024984882 [TCP segment of a reassembled PDU]"
"285","1.170930187","192.168.1.118","104.107.48.175","TCP","66","45746 → 443 [ACK] Seq=905 Ack=6221 Win=64128 Len=0 TSval=1024984915 TSecr=893679005"
"286","1.174028725","104.107.48.175","192.168.1.118","TLSv1.2","3354","Application Data"
"287","1.174112475","192.168.1.118","104.107.48.175","TCP","66","45746 → 443 [ACK] Seq=905 Ack=9509 Win=64128 Len=0 TSval=1024984918 TSecr=893679005"
"288","2.324061112","Apple_53:af:45","Broadcast","ARP","42","Who has 192.168.1.103? Tell 192.168.1.100"
"289","2.631306412","Apple_53:af:45","Broadcast","ARP","42","Who has 192.168.1.103? Tell 192.168.1.100"
"290","3.524746125","192.168.1.118","192.168.1.102","TCP","176","44768 → 8009 [PSH, ACK] Seq=1 Ack=1 Win=501 Len=110 TSval=2235155415 TSecr=2967719 [TCP segment of a reassembled PDU]"
"291","3.537850787","192.168.1.102","192.168.1.118","TCP","176","8009 → 44768 [PSH, ACK] Seq=1 Ack=111 Win=294 Len=110 TSval=2968221 TSecr=2235155415 [TCP segment of a reassembled PDU]"
"292","3.538064300","192.168.1.118","192.168.1.102","TCP","66","44768 → 8009 [ACK] Seq=111 Ack=111 Win=501 Len=0 TSval=2235155428 TSecr=2968221"
"293","3.653499237","Apple_53:af:45","Broadcast","ARP","42","Who has 192.168.1.103? Tell 192.168.1.100"
"294","3.962630262","Cisco-Li_5b:1c:ce","IntelCor_b7:52:73","ARP","42","Who has 192.168.1.118? Tell 192.168.1.1"
"295","3.962695325","IntelCor_b7:52:73","Cisco-Li_5b:1c:ce","ARP","42","192.168.1.118 is at dc:fb:48:b7:52:73"
"296","4.677234150","Apple_53:af:45","Broadcast","ARP","42","Who has 192.168.1.103? Tell 192.168.1.100"
"297","4.985418287","192.168.1.103","224.0.0.251","MDNS","139","Standard query 0x0000 PTR _companion-link._tcp.local, "QU" question PTR _sleep-proxy._udp.local, "QU" question OPT"
"298","5.190611587","192.168.1.103","224.0.0.251","IGMPv2","46","Membership Report group 224.0.0.251"
"299","5.397990762","192.168.1.102","224.0.0.251","MDNS","183","Standard query response 0x0000 SRV, cache flush 0 0 8009 2c3f16b2-da5c-4b6f-d6cf-bfba61c12490.local"
"300","5.600595575","192.168.1.104","255.255.255.255","UDP","217","49154 → 6666 Len=175"
"301","6.015099962","192.168.1.103","224.0.0.251","MDNS","112","Standard query 0x0000 PTR _sleep-proxy._udp.local, "QM" question OPT"
"302","8.544409637","192.168.1.118","192.168.1.102","TCP","176","44768 → 8009 [PSH, ACK] Seq=111 Ack=111 Win=501 Len=110 TSval=2235160434 TSecr=2968221 [TCP segment of a reassembled PDU]"
"303","8.554352900","192.168.1.102","192.168.1.118","TCP","176","8009 → 44768 [PSH, ACK] Seq=111 Ack=221 Win=294 Len=110 TSval=2968722 TSecr=2235160434 [TCP segment of a reassembled PDU]"
"304","8.554498462","192.168.1.118","192.168.1.102","TCP","66","44768 → 8009 [ACK] Seq=221 Ack=221 Win=501 Len=0 TSval=2235160444 TSecr=2968722"
"305","8.672423562","192.168.1.104","255.255.255.255","UDP","217","49154 → 6666 Len=175"
