frame.number,_ws.col.Time,_ws.col.Source,_ws.col.Destination,_ws.col.Protocol,frame.len,_ws.col.Info
"1","0.000000000","104.102.89.129","192.168.1.118","TCP","1514","[TCP segment of a reassembled PDU]"
"2","0.001015513","104.102.89.129","192.168.1.118","TCP","1514","443 → 43530 [ACK] Seq=1449 Ack=1 Win=243 Len=1448 TSval=354976763 TSecr=1484388553 [TCP segment of a reassembled PDU]"
"3","0.001295338","192.168.1.118","104.102.89.129","TCP","66","43530 → 443 [ACK] Seq=1 Ack=2897 Win=501 Len=0 TSval=1484389060 TSecr=354976763"
"4","0.004689238","104.102.89.129","192.168.1.118","TCP","1514","443 → 43530 [ACK] Seq=2897 Ack=1 Win=243 Len=1448 TSval=354976763 TSecr=1484388553 [TCP segment of a reassembled PDU]"
"5","0.012231888","104.102.89.129","192.168.1.118","TCP","5858","443 → 43530 [ACK] Seq=4345 Ack=1 Win=243 Len=5792 TSval=354976763 TSecr=1484388553 [TCP segment of a reassembled PDU]"
"6","0.012454125","192.168.1.118","104.102.89.129","TCP","66","43530 → 443 [ACK] Seq=1 Ack=10137 Win=501 Len=0 TSval=1484389072 TSecr=354976763"
"7","0.013790513","104.102.89.129","192.168.1.118","TCP","1514","443 → 43530 [ACK] Seq=10137 Ack=1 Win=243 Len=1448 TSval=354976763 TSecr=1484388553 [TCP segment of a reassembled PDU]"
"8","0.015114650","104.102.89.129","192.168.1.118","TLSv1.2","7306","Application Data [TCP segment of a reassembled PDU]"
"9","0.015416238","192.168.1.118","104.102.89.129","TCP","66","43530 → 443 [ACK] Seq=1 Ack=18825 Win=434 Len=0 TSval=1484389075 TSecr=354976763"
"10","0.019134875","104.102.89.129","192.168.1.118","TCP","4410","443 → 43530 [ACK] Seq=18825 Ack=1 Win=243 Len=4344 TSval=354976763 TSecr=1484388553 [TCP segment of a reassembled PDU]"
"11","0.019262788","192.168.1.118","104.102.89.129","TCP","66","43530 → 443 [ACK] Seq=1 Ack=23169 Win=461 Len=0 TSval=1484389078 TSecr=354976763"
"12","0.019348563","104.102.89.129","192.168.1.118","TCP","1514","443 → 43530 [ACK] Seq=23169 Ack=1 Win=243 Len=1448 TSval=354976839 TSecr=1484388553 [TCP segment of a reassembled PDU]"
"13","0.022175000","104.102.89.129","192.168.1.118","TLSv1.2","1514","Application Data [TCP segment of a reassembled PDU]"
"14","0.023230000","104.102.89.129","192.168.1.118","TCP","1514","443 → 43530 [ACK] Seq=26065 Ack=1 Win=243 Len=1448 TSval=354976862 TSecr=1484389060 [TCP segment of a reassembled PDU]"
"15","0.030443950","104.102.89.129","192.168.1.118","TCP","1514","443 → 43530 [ACK] Seq=27513 Ack=1 Win=243 Len=1448 TSval=354976872 TSecr=1484389072 [TCP segment of a reassembled PDU]"
"16","0.031685450","104.102.89.129","192.168.1.118","TCP","2962","443 → 43530 [ACK] Seq=28961 Ack=1 Win=243 Len=2896 TSval=354976872 TSecr=1484389072 [TCP segment of a reassembled PDU]"
"17","0.033145350","104.102.89.129","192.168.1.118","TCP","1514","443 → 43530 [ACK] Seq=31857 Ack=1 Win=243 Len=1448 TSval=354976872 TSecr=1484389072 [TCP segment of a reassembled PDU]"
"18","0.033233963","104.102.89.129","192.168.1.118","TCP","1514","443 → 43530 [ACK] Seq=33305 Ack=1 Win=243 Len=1448 TSval=354976872 TSecr=1484389075 [TCP segment of a reassembled PDU]"
"19","0.034236725","104.102.89.129","192.168.1.118","TCP","2962","443 → 43530 [ACK] Seq=34753 Ack=1 Win=243 Len=2896 TSval=354976872 TSecr=1484389075 [TCP segment of a reassembled PDU]"
"20","0.037039600","104.102.89.129","192.168.1.118","TCP","1514","443 → 43530 [ACK] Seq=37649 Ack=1 Win=243 Len=1448 TSval=354976872 TSecr=1484389075 [TCP segment of a reassembled PDU]"
"21","0.040332075","104.102.89.129","192.168.1.118","TCP","2962","443 → 43530 [ACK] Seq=39097 Ack=1 Win=243 Len=2896 TSval=354976872 TSecr=1484389075 [TCP segment of a reassembled PDU]"
"22","0.041552450","104.102.89.129","192.168.1.118","TLSv1.2","1514","Application Data [TCP segment of a reassembled PDU]"
"23","0.041969113","192.168.1.118","104.102.89.129","TCP","66","43530 → 443 [ACK] Seq=1 Ack=43441 Win=501 Len=0 TSval=1484389101 TSecr=354976839"
"24","0.043008263","192.168.1.118","104.102.89.129","TCP","74","43552 → 443 [SYN] Seq=0 Win=64240 Len=0 MSS=1460 SACK_PERM=1 TSval=1484389102 TSecr=0 WS=128"
"25","0.043150750","192.168.1.118","104.102.89.129","TCP","74","43554 → 443 [SYN] Seq=0 Win=64240 Len=0 MSS=1460 SACK_PERM=1 TSval=1484389102 TSecr=0 WS=128"
"26","0.043218550","104.102.89.129","192.168.1.118","TLSv1.2","1917","Application Data"
"27","0.043245363","192.168.1.118","104.102.89.129","TCP","74","43556 → 443 [SYN] Seq=0 Win=64240 Len=0 MSS=1460 SACK_PERM=1 TSval=1484389102 TSecr=0 WS=128"
"28","0.043340925","192.168.1.118","104.102.89.129","TCP","66","43530 → 443 [ACK] Seq=1 Ack=45292 Win=530 Len=0 TSval=1484389102 TSecr=354976882"
"29","0.043397263","192.168.1.118","104.102.89.129","TCP","74","43558 → 443 [SYN] Seq=0 Win=64240 Len=0 MSS=1460 SACK_PERM=1 TSval=1484389102 TSecr=0 WS=128"
"30","0.044623850","192.168.1.118","209.18.47.62","DNS","76","Standard query 0xe36c A i.etsystatic.com"
"31","0.045539875","192.168.1.118","209.18.47.62","DNS","76","Standard query 0xc78c A i.etsystatic.com"
"32","0.071766113","209.18.47.62","192.168.1.118","DNS","125","Standard query response 0xc78c A i.etsystatic.com CNAME etsy.map.fastly.net A 199.232.37.224"
"33","0.072224900","192.168.1.118","209.18.47.62","DNS","76","Standard query 0xafe9 AAAA i.etsystatic.com"
"34","0.074934088","209.18.47.62","192.168.1.118","DNS","125","Standard query response 0xe36c A i.etsystatic.com CNAME etsy.map.fastly.net A 199.232.37.224"
"35","0.075065013","104.102.89.129","192.168.1.118","TCP","74","443 → 43554 [SYN, ACK] Seq=0 Ack=1 Win=28960 Len=0 MSS=1460 SACK_PERM=1 TSval=354976912 TSecr=1484389102 WS=128"
"36","0.075198288","192.168.1.118","104.102.89.129","TCP","66","43554 → 443 [ACK] Seq=1 Ack=1 Win=64256 Len=0 TSval=1484389134 TSecr=354976912"
"37","0.075287200","104.102.89.129","192.168.1.118","TCP","74","443 → 43558 [SYN, ACK] Seq=0 Ack=1 Win=28960 Len=0 MSS=1460 SACK_PERM=1 TSval=354976912 TSecr=1484389102 WS=128"
"38","0.075385263","192.168.1.118","104.102.89.129","TCP","66","43558 → 443 [ACK] Seq=1 Ack=1 Win=64256 Len=0 TSval=1484389135 TSecr=354976912"
"39","0.075454050","104.102.89.129","192.168.1.118","TCP","74","443 → 43556 [SYN, ACK] Seq=0 Ack=1 Win=28960 Len=0 MSS=1460 SACK_PERM=1 TSval=354976912 TSecr=1484389102 WS=128"
"40","0.075547600","192.168.1.118","104.102.89.129","TCP","66","43556 → 443 [ACK] Seq=1 Ack=1 Win=64256 Len=0 TSval=1484389135 TSecr=354976912"
"41","0.075612638","104.102.89.129","192.168.1.118","TCP","74","443 → 43552 [SYN, ACK] Seq=0 Ack=1 Win=28960 Len=0 MSS=1460 SACK_PERM=1 TSval=354976912 TSecr=1484389102 WS=128"
"42","0.075706938","192.168.1.118","104.102.89.129","TCP","66","43552 → 443 [ACK] Seq=1 Ack=1 Win=64256 Len=0 TSval=1484389135 TSecr=354976912"
"43","0.076011438","192.168.1.118","209.18.47.62","DNS","76","Standard query 0x9fb5 AAAA i.etsystatic.com"
"44","0.100948525","209.18.47.62","192.168.1.118","DNS","209","Standard query response 0xafe9 AAAA i.etsystatic.com CNAME i.etsystatic.com.edgekey.net CNAME e8634.f.akamaiedge.net SOA n0f.akamaiedge.net"
"45","0.114235713","209.18.47.62","192.168.1.118","DNS","167","Standard query response 0x9fb5 AAAA i.etsystatic.com CNAME etsy.map.fastly.net SOA ns1.fastly.net"
"46","0.114984713","192.168.1.118","104.102.89.129","TLSv1","583","Client Hello"
"47","0.131256963","192.168.1.118","104.102.89.129","TLSv1","583","Client Hello"
"48","0.142903863","104.102.89.129","192.168.1.118","TCP","66","443 → 43552 [ACK] Seq=1 Ack=518 Win=30080 Len=0 TSval=354976983 TSecr=1484389174"
"49","0.144513425","104.102.89.129","192.168.1.118","TLSv1.2","3280","Server Hello, Certificate, Server Key Exchange, Server Hello Done"
"50","0.144630225","192.168.1.118","104.102.89.129","TCP","66","43552 → 443 [ACK] Seq=518 Ack=3215 Win=61056 Len=0 TSval=1484389204 TSecr=354976985"
"51","0.151416775","104.102.89.129","192.168.1.118","TCP","66","443 → 43554 [ACK] Seq=1 Ack=518 Win=30080 Len=0 TSval=354976993 TSecr=1484389190"
"52","0.154408525","104.102.89.129","192.168.1.118","TLSv1.2","1514","Server Hello"
"53","0.154453250","192.168.1.118","104.102.89.129","TCP","66","43554 → 443 [ACK] Seq=518 Ack=1449 Win=63104 Len=0 TSval=1484389214 TSecr=354976994"
"54","0.156088063","104.102.89.129","192.168.1.118","TLSv1.2","1832","Certificate, Server Key Exchange, Server Hello Done"
"55","0.156138975","192.168.1.118","104.102.89.129","TCP","66","43554 → 443 [ACK] Seq=518 Ack=3215 Win=61440 Len=0 TSval=1484389215 TSecr=354976994"
"56","0.157141950","192.168.1.118","104.102.89.129","TLSv1","583","Client Hello"
"57","0.179742188","192.168.1.118","104.102.89.129","TLSv1","583","Client Hello"
"58","0.179969150","192.168.1.118","199.232.37.224","TCP","74","35786 → 443 [SYN] Seq=0 Win=64240 Len=0 MSS=1460 SACK_PERM=1 TSval=1320308479 TSecr=0 WS=128"
"59","0.180060275","192.168.1.118","199.232.37.224","TCP","74","35788 → 443 [SYN] Seq=0 Win=64240 Len=0 MSS=1460 SACK_PERM=1 TSval=1320308479 TSecr=0 WS=128"
"60","0.180178988","192.168.1.118","199.232.37.224","TCP","74","35790 → 443 [SYN] Seq=0 Win=64240 Len=0 MSS=1460 SACK_PERM=1 TSval=1320308479 TSecr=0 WS=128"
"61","0.180294650","192.168.1.118","199.232.37.224","TCP","74","35792 → 443 [SYN] Seq=0 Win=64240 Len=0 MSS=1460 SACK_PERM=1 TSval=1320308479 TSecr=0 WS=128"
"62","0.180398175","192.168.1.118","199.232.37.224","TCP","74","35794 → 443 [SYN] Seq=0 Win=64240 Len=0 MSS=1460 SACK_PERM=1 TSval=1320308480 TSecr=0 WS=128"
"63","0.181368313","192.168.1.118","209.18.47.62","DNS","73","Standard query 0x6360 A blog.etsy.com"
"64","0.181855025","192.168.1.118","209.18.47.62","DNS","73","Standard query 0x53c2 A blog.etsy.com"
"65","0.182266825","192.168.1.118","209.18.47.62","DNS","73","Standard query 0x8788 A blog.etsy.com"
"66","0.183519613","192.168.1.118","104.102.89.129","TLSv1.2","192","Client Key Exchange, Change Cipher Spec, Encrypted Handshake Message"
"67","0.185422200","192.168.1.118","104.102.89.129","TLSv1.2","192","Client Key Exchange, Change Cipher Spec, Encrypted Handshake Message"
"68","0.189880900","104.102.89.129","192.168.1.118","TCP","66","443 → 43556 [ACK] Seq=1 Ack=518 Win=30080 Len=0 TSval=354977029 TSecr=1484389216"
"69","0.191717925","104.102.89.129","192.168.1.118","TLSv1.2","2962","Server Hello, Certificate"
"70","0.191813475","192.168.1.118","104.102.89.129","TCP","66","43556 → 443 [ACK] Seq=518 Ack=2897 Win=61440 Len=0 TSval=1484389251 TSecr=354977030"
"71","0.191889263","104.102.89.129","192.168.1.118","TLSv1.2","384","Server Key Exchange, Server Hello Done"
"72","0.191937550","192.168.1.118","104.102.89.129","TCP","66","43556 → 443 [ACK] Seq=518 Ack=3215 Win=61184 Len=0 TSval=1484389251 TSecr=354977031"
"73","0.197101838","192.168.1.118","104.102.89.129","TLSv1.2","192","Client Key Exchange, Change Cipher Spec, Encrypted Handshake Message"
"74","0.201101100","199.232.37.224","192.168.1.118","TCP","74","443 → 35786 [SYN, ACK] Seq=0 Ack=1 Win=27040 Len=0 MSS=1364 SACK_PERM=1 TSval=268273881 TSecr=1320308479 WS=512"
"75","0.201225863","192.168.1.118","199.232.37.224","TCP","66","35786 → 443 [ACK] Seq=1 Ack=1 Win=64256 Len=0 TSval=1320308500 TSecr=268273881"
"76","0.203206025","199.232.37.224","192.168.1.118","TCP","74","443 → 35788 [SYN, ACK] Seq=0 Ack=1 Win=27040 Len=0 MSS=1364 SACK_PERM=1 TSval=3246037951 TSecr=1320308479 WS=512"
"77","0.203328675","192.168.1.118","199.232.37.224","TCP","66","35788 → 443 [ACK] Seq=1 Ack=1 Win=64256 Len=0 TSval=1320308502 TSecr=3246037951"
"78","0.203389988","199.232.37.224","192.168.1.118","TCP","74","443 → 35794 [SYN, ACK] Seq=0 Ack=1 Win=27040 Len=0 MSS=1364 SACK_PERM=1 TSval=2805693955 TSecr=1320308480 WS=512"
"79","0.203449425","192.168.1.118","199.232.37.224","TCP","66","35794 → 443 [ACK] Seq=1 Ack=1 Win=64256 Len=0 TSval=1320308503 TSecr=2805693955"
"80","0.203489700","199.232.37.224","192.168.1.118","TCP","74","443 → 35790 [SYN, ACK] Seq=0 Ack=1 Win=27040 Len=0 MSS=1364 SACK_PERM=1 TSval=2805482674 TSecr=1320308479 WS=512"
"81","0.203543000","192.168.1.118","199.232.37.224","TCP","66","35790 → 443 [ACK] Seq=1 Ack=1 Win=64256 Len=0 TSval=1320308503 TSecr=2805482674"
"82","0.203581100","199.232.37.224","192.168.1.118","TCP","74","443 → 35792 [SYN, ACK] Seq=0 Ack=1 Win=27040 Len=0 MSS=1364 SACK_PERM=1 TSval=3139690421 TSecr=1320308479 WS=512"
"83","0.203634938","192.168.1.118","199.232.37.224","TCP","66","35792 → 443 [ACK] Seq=1 Ack=1 Win=64256 Len=0 TSval=1320308503 TSecr=3139690421"
"84","0.203674963","209.18.47.62","192.168.1.118","DNS","89","Standard query response 0x6360 A blog.etsy.com A 104.196.190.179"
"85","0.203877863","192.168.1.118","209.18.47.62","DNS","73","Standard query 0x7b93 AAAA blog.etsy.com"
"86","0.204617575","104.102.89.129","192.168.1.118","TCP","66","443 → 43558 [ACK] Seq=1 Ack=518 Win=30080 Len=0 TSval=354977043 TSecr=1484389239"
"87","0.207242688","104.102.89.129","192.168.1.118","TLSv1.2","1514","Server Hello"
"88","0.207308150","192.168.1.118","104.102.89.129","TCP","66","43558 → 443 [ACK] Seq=518 Ack=1449 Win=63104 Len=0 TSval=1484389266 TSecr=354977048"
"89","0.208552388","104.102.89.129","192.168.1.118","TLSv1.2","1514","Certificate [TCP segment of a reassembled PDU]"
"90","0.208603088","192.168.1.118","104.102.89.129","TCP","66","43558 → 443 [ACK] Seq=518 Ack=2897 Win=61696 Len=0 TSval=1484389268 TSecr=354977048"
"91","0.208630813","104.102.89.129","192.168.1.118","TLSv1.2","384","Server Key Exchange, Server Hello Done"
"92","0.208673150","192.168.1.118","104.102.89.129","TCP","66","43558 → 443 [ACK] Seq=518 Ack=3215 Win=61440 Len=0 TSval=1484389268 TSecr=354977049"
"93","0.215148088","104.102.89.129","192.168.1.118","TLSv1.2","117","Change Cipher Spec, Encrypted Handshake Message"
"94","0.216179963","209.18.47.62","192.168.1.118","DNS","89","Standard query response 0x53c2 A blog.etsy.com A 104.196.190.179"
"95","0.216270138","209.18.47.62","192.168.1.118","DNS","89","Standard query response 0x8788 A blog.etsy.com A 104.196.190.179"
"96","0.216457563","192.168.1.118","209.18.47.62","DNS","73","Standard query 0x3749 AAAA blog.etsy.com"
"97","0.216580538","192.168.1.118","209.18.47.62","DNS","73","Standard query 0x8bd5 AAAA blog.etsy.com"
"98","0.220583850","192.168.1.118","199.232.37.224","TLSv1","583","Client Hello"
"99","0.236851763","192.168.1.118","199.232.37.224","TLSv1","583","Client Hello"
"100","0.247649763","104.102.89.129","192.168.1.118","TLSv1.2","117","Change Cipher Spec, Encrypted Handshake Message"
"101","0.250459438","209.18.47.62","192.168.1.118","DNS","151","Standard query response 0x7b93 AAAA blog.etsy.com SOA ns-162.awsdns-20.com"
"102","0.251474338","209.18.47.62","192.168.1.118","DNS","151","Standard query response 0x3749 AAAA blog.etsy.com SOA ns-162.awsdns-20.com"
"103","0.252703700","104.102.89.129","192.168.1.118","TCP","66","[TCP Dup ACK 86#1] 443 → 43558 [ACK] Seq=3215 Ack=518 Win=30080 Len=0 TSval=354977094 TSecr=1484389268"
"104","0.252813688","104.102.89.129","192.168.1.118","TCP","66","443 → 43556 [ACK] Seq=3215 Ack=644 Win=30080 Len=0 TSval=354977094 TSecr=1484389256"
"105","0.252959000","199.232.37.224","192.168.1.118","TCP","66","443 → 35786 [ACK] Seq=1 Ack=518 Win=28160 Len=0 TSval=268273894 TSecr=1320308520"
"106","0.253120775","192.168.1.118","199.232.37.224","TLSv1","583","Client Hello"
"107","0.253605763","209.18.47.62","192.168.1.118","DNS","151","Standard query response 0x8bd5 AAAA blog.etsy.com SOA ns-162.awsdns-20.com"
"108","0.256115013","192.168.1.118","104.102.89.129","TCP","66","43552 → 443 [ACK] Seq=644 Ack=3266 Win=64128 Len=0 TSval=1484389315 TSecr=354977051"
"109","0.259068363","199.232.37.224","192.168.1.118","TLSv1.2","3751","Server Hello, Certificate, Server Key Exchange, Server Hello Done"
"110","0.259154475","192.168.1.118","199.232.37.224","TCP","66","35786 → 443 [ACK] Seq=518 Ack=3686 Win=60672 Len=0 TSval=1320308558 TSecr=268273894"
"111","0.260552588","104.102.89.129","192.168.1.118","TLSv1.2","117","Change Cipher Spec, Encrypted Handshake Message"
"112","0.263171525","199.232.37.224","192.168.1.118","TCP","66","443 → 35788 [ACK] Seq=1 Ack=518 Win=28160 Len=0 TSval=3246037966 TSecr=1320308536"
"113","0.263258400","199.232.37.224","192.168.1.118","TLSv1.2","1418","Server Hello"
"114","0.263310775","192.168.1.118","199.232.37.224","TCP","66","35788 → 443 [ACK] Seq=518 Ack=1353 Win=63104 Len=0 TSval=1320308562 TSecr=3246037966"
"115","0.264391588","199.232.37.224","192.168.1.118","TLSv1.2","2399","Certificate, Server Key Exchange, Server Hello Done"
"116","0.264481688","192.168.1.118","199.232.37.224","TCP","66","35788 → 443 [ACK] Seq=518 Ack=3686 Win=60800 Len=0 TSval=1320308564 TSecr=3246037966"
"117","0.269439025","192.168.1.118","199.232.37.224","TLSv1","583","Client Hello"
"118","0.286168013","199.232.37.224","192.168.1.118","TCP","66","443 → 35790 [ACK] Seq=1 Ack=518 Win=28160 Len=0 TSval=2805482695 TSecr=1320308552"
"119","0.286401100","192.168.1.118","199.232.37.224","TLSv1","583","Client Hello"
"120","0.286607100","192.168.1.118","104.196.190.179","TCP","74","41996 → 443 [SYN] Seq=0 Win=64240 Len=0 MSS=1460 SACK_PERM=1 TSval=3677459077 TSecr=0 WS=128"
"121","0.286695750","192.168.1.118","104.196.190.179","TCP","74","41998 → 443 [SYN] Seq=0 Win=64240 Len=0 MSS=1460 SACK_PERM=1 TSval=3677459077 TSecr=0 WS=128"
"122","0.286773000","192.168.1.118","104.196.190.179","TCP","74","42000 → 443 [SYN] Seq=0 Win=64240 Len=0 MSS=1460 SACK_PERM=1 TSval=3677459077 TSecr=0 WS=128"
"123","0.287158725","192.168.1.118","104.102.89.129","TLSv1.2","792","Application Data"
"124","0.287401925","192.168.1.118","104.102.89.129","TLSv1.2","912","Application Data"
"125","0.287620600","192.168.1.118","104.102.89.129","TLSv1.2","621","Application Data"
"126","0.289501163","192.168.1.118","104.102.89.129","TLSv1.2","192","Client Key Exchange, Change Cipher Spec, Encrypted Handshake Message"
"127","0.291336525","192.168.1.118","199.232.37.224","TLSv1.2","192","Client Key Exchange, Change Cipher Spec, Encrypted Handshake Message"
"128","0.292029625","199.232.37.224","192.168.1.118","TLSv1.2","1418","Server Hello"
"129","0.292160713","192.168.1.118","199.232.37.224","TCP","66","35790 → 443 [ACK] Seq=518 Ack=1353 Win=63104 Len=0 TSval=1320308591 TSecr=2805482696"
"130","0.293185013","192.168.1.118","199.232.37.224","TLSv1.2","192","Client Key Exchange, Change Cipher Spec, Encrypted Handshake Message"
"131","0.295216513","199.232.37.224","192.168.1.118","TLSv1.2","2399","Certificate, Server Key Exchange, Server Hello Done"
"132","0.295341713","192.168.1.118","199.232.37.224","TCP","66","35790 → 443 [ACK] Seq=518 Ack=3686 Win=61056 Len=0 TSval=1320308594 TSecr=2805482696"
"133","0.296953350","199.232.37.224","192.168.1.118","TCP","66","[TCP Dup ACK 112#1] 443 → 35788 [ACK] Seq=3686 Ack=518 Win=28160 Len=0 TSval=3246037975 TSecr=1320308564"
"134","0.298151600","199.232.37.224","192.168.1.118","TCP","66","443 → 35792 [ACK] Seq=1 Ack=518 Win=28160 Len=0 TSval=3139690445 TSecr=1320308569"
"135","0.300303388","199.232.37.224","192.168.1.118","TLSv1.2","3751","Server Hello, Certificate, Server Key Exchange, Server Hello Done"
"136","0.300434050","192.168.1.118","199.232.37.224","TCP","66","35792 → 443 [ACK] Seq=518 Ack=3686 Win=60672 Len=0 TSval=1320308600 TSecr=3139690445"
"137","0.303638463","192.168.1.118","199.232.37.224","TLSv1.2","192","Client Key Exchange, Change Cipher Spec, Encrypted Handshake Message"
"138","0.305584450","192.168.1.118","199.232.37.224","TLSv1.2","192","Client Key Exchange, Change Cipher Spec, Encrypted Handshake Message"
"139","0.307055975","199.232.37.224","192.168.1.118","TCP","66","443 → 35794 [ACK] Seq=1 Ack=518 Win=28160 Len=0 TSval=2805693982 TSecr=1320308586"
"140","0.310115388","199.232.37.224","192.168.1.118","TLSv1.2","3751","Server Hello, Certificate, Server Key Exchange, Server Hello Done"
"141","0.310204550","192.168.1.118","199.232.37.224","TCP","66","35794 → 443 [ACK] Seq=518 Ack=3686 Win=60672 Len=0 TSval=1320308609 TSecr=2805693982"
"142","0.310292363","104.102.89.129","192.168.1.118","TCP","1514","[TCP segment of a reassembled PDU]"
"143","0.310349088","192.168.1.118","104.102.89.129","TCP","66","43552 → 443 [ACK] Seq=1370 Ack=4714 Win=63104 Len=0 TSval=1484389369 TSecr=354977150"
"144","0.312872763","192.168.1.118","199.232.37.224","TLSv1.2","192","Client Key Exchange, Change Cipher Spec, Encrypted Handshake Message"
"145","0.318373013","104.102.89.129","192.168.1.118","TLSv1.2","21786","Application Data [TCP segment of a reassembled PDU]"
"146","0.318471088","192.168.1.118","104.102.89.129","TCP","66","43552 → 443 [ACK] Seq=1370 Ack=26434 Win=41472 Len=0 TSval=1484389378 TSecr=354977150"
"147","0.321229275","104.102.89.129","192.168.1.118","TLSv1.2","4706","Application Data"
"148","0.321432363","192.168.1.118","104.102.89.129","TCP","66","43556 → 443 [ACK] Seq=1199 Ack=7906 Win=59520 Len=0 TSval=1484389381 TSecr=354977154"
"149","0.322064000","199.232.37.224","192.168.1.118","TLSv1.2","117","Change Cipher Spec, Encrypted Handshake Message"
"150","0.322176238","199.232.37.224","192.168.1.118","TLSv1.2","117","Change Cipher Spec, Encrypted Handshake Message"
"151","0.324067263","104.102.89.129","192.168.1.118","TCP","1514","[TCP segment of a reassembled PDU]"
"152","0.327128213","104.102.89.129","192.168.1.118","TCP","7306","443 → 43554 [ACK] Seq=4714 Ack=1490 Win=31744 Len=7240 TSval=354977164 TSecr=1484389347 [TCP segment of a reassembled PDU]"
"153","0.327216413","104.102.89.129","192.168.1.118","TCP","1514","443 → 43554 [ACK] Seq=11954 Ack=1490 Win=31744 Len=1448 TSval=354977165 TSecr=1484389347 [TCP segment of a reassembled PDU]"
"154","0.328633275","104.102.89.129","192.168.1.118","TCP","2962","443 → 43554 [ACK] Seq=13402 Ack=1490 Win=31744 Len=2896 TSval=354977165 TSecr=1484389347 [TCP segment of a reassembled PDU]"
"155","0.329314125","104.102.89.129","192.168.1.118","TLSv1.2","8754","Application Data [TCP segment of a reassembled PDU]"
"156","0.331997388","104.196.190.179","192.168.1.118","TCP","66","443 → 41996 [SYN, ACK] Seq=0 Ack=1 Win=28400 Len=0 MSS=1420 SACK_PERM=1 WS=512"
"157","0.332141100","192.168.1.118","104.196.190.179","TCP","54","41996 → 443 [ACK] Seq=1 Ack=1 Win=64256 Len=0"
"158","0.332219813","104.196.190.179","192.168.1.118","TCP","66","443 → 42000 [SYN, ACK] Seq=0 Ack=1 Win=28400 Len=0 MSS=1420 SACK_PERM=1 WS=512"
"159","0.332295713","192.168.1.118","104.196.190.179","TCP","54","42000 → 443 [ACK] Seq=1 Ack=1 Win=64256 Len=0"
"160","0.332349038","104.196.190.179","192.168.1.118","TCP","66","443 → 41998 [SYN, ACK] Seq=0 Ack=1 Win=28400 Len=0 MSS=1420 SACK_PERM=1 WS=512"
"161","0.332420538","192.168.1.118","104.196.190.179","TCP","54","41998 → 443 [ACK] Seq=1 Ack=1 Win=64256 Len=0"
"162","0.332471288","199.232.37.224","192.168.1.118","TLSv1.2","117","Change Cipher Spec, Encrypted Handshake Message"
"163","0.332532725","199.232.37.224","192.168.1.118","TLSv1.2","117","Change Cipher Spec, Encrypted Handshake Message"
"164","0.332630700","104.102.89.129","192.168.1.118","TCP","2962","443 → 43552 [ACK] Seq=26434 Ack=1370 Win=31488 Len=2896 TSval=354977168 TSecr=1484389369 [TCP segment of a reassembled PDU]"
"165","0.332681925","192.168.1.118","104.102.89.129","TCP","66","43552 → 443 [ACK] Seq=1370 Ack=29330 Win=61056 Len=0 TSval=1484389392 TSecr=354977168"
"166","0.332759825","104.102.89.129","192.168.1.118","TCP","1514","443 → 43554 [ACK] Seq=24986 Ack=1490 Win=31744 Len=1448 TSval=354977165 TSecr=1484389347 [TCP segment of a reassembled PDU]"
"167","0.332793725","104.102.89.129","192.168.1.118","TCP","4410","443 → 43552 [ACK] Seq=29330 Ack=1370 Win=31488 Len=4344 TSval=354977169 TSecr=1484389378 [TCP segment of a reassembled PDU]"
"168","0.332868250","192.168.1.118","104.102.89.129","TCP","66","43552 → 443 [ACK] Seq=1370 Ack=33674 Win=56832 Len=0 TSval=1484389392 TSecr=354977169"
"169","0.333723738","104.102.89.129","192.168.1.118","TLSv1.2","7306","Application Data, Application Data"
"170","0.333851288","192.168.1.118","104.102.89.129","TCP","66","43552 → 443 [ACK] Seq=1370 Ack=40914 Win=49664 Len=0 TSval=1484389393 TSecr=354977169"
"171","0.338063188","199.232.37.224","192.168.1.118","TLSv1.2","117","Change Cipher Spec, Encrypted Handshake Message"
"172","0.338185425","104.102.89.129","192.168.1.118","TCP","8754","443 → 43552 [ACK] Seq=40914 Ack=1370 Win=31488 Len=8688 TSval=354977170 TSecr=1484389378 [TCP segment of a reassembled PDU]"
"173","0.338258025","192.168.1.118","104.102.89.129","TCP","66","43552 → 443 [ACK] Seq=1370 Ack=49602 Win=41088 Len=0 TSval=1484389397 TSecr=354977170"
"174","0.339786563","104.102.89.129","192.168.1.118","TCP","2962","443 → 43552 [ACK] Seq=49602 Ack=1370 Win=31488 Len=2896 TSval=354977170 TSecr=1484389378 [TCP segment of a reassembled PDU]"
"175","0.340888425","104.102.89.129","192.168.1.118","TLSv1.2","2962","Application Data [TCP segment of a reassembled PDU]"
"176","0.341055500","104.102.89.129","192.168.1.118","TCP","5858","443 → 43552 [ACK] Seq=55394 Ack=1370 Win=31488 Len=5792 TSval=354977172 TSecr=1484389378 [TCP segment of a reassembled PDU]"
"177","0.341100713","104.102.89.129","192.168.1.118","TCP","1514","443 → 43552 [ACK] Seq=61186 Ack=1370 Win=31488 Len=1448 TSval=354977173 TSecr=1484389378 [TCP segment of a reassembled PDU]"
"178","0.346813163","192.168.1.118","104.102.89.129","TCP","66","43552 → 443 [ACK] Seq=1370 Ack=62634 Win=64128 Len=0 TSval=1484389406 TSecr=354977170"
"179","0.347892288","104.102.89.129","192.168.1.118","TCP","1514","443 → 43552 [ACK] Seq=62634 Ack=1370 Win=31488 Len=1448 TSval=354977173 TSecr=1484389378 [TCP segment of a reassembled PDU]"
"180","0.347973425","192.168.1.118","104.102.89.129","TCP","66","43552 → 443 [ACK] Seq=1370 Ack=64082 Win=67072 Len=0 TSval=1484389407 TSecr=354977173"
"181","0.348043350","104.102.89.129","192.168.1.118","TLSv1.2","2962","Application Data [TCP segment of a reassembled PDU]"
"182","0.348052900","192.168.1.118","104.102.89.129","TCP","66","43554 → 443 [ACK] Seq=1490 Ack=26434 Win=40960 Len=0 TSval=1484389407 TSecr=354977164"
"183","0.348086050","192.168.1.118","104.102.89.129","TCP","66","43552 → 443 [ACK] Seq=1370 Ack=66978 Win=72832 Len=0 TSval=1484389407 TSecr=354977174"
"184","0.349488150","192.168.1.118","199.232.37.224","TLSv1.2","305","Application Data"
"185","0.349753175","192.168.1.118","199.232.37.224","TLSv1.2","305","Application Data"
"186","0.349905713","104.102.89.129","192.168.1.118","TLSv1.2","117","Change Cipher Spec, Encrypted Handshake Message"
"187","0.350000988","192.168.1.118","104.102.89.129","TCP","66","43558 → 443 [ACK] Seq=644 Ack=3266 Win=64128 Len=0 TSval=1484389409 TSecr=354977192"
"188","0.350041075","192.168.1.118","199.232.37.224","TLSv1.2","315","Application Data"
"189","0.350276950","192.168.1.118","199.232.37.224","TLSv1.2","313","Application Data"
"190","0.350506788","192.168.1.118","199.232.37.224","TLSv1.2","310","Application Data"
"191","0.359482288","104.102.89.129","192.168.1.118","TCP","1514","443 → 43552 [ACK] Seq=66978 Ack=1370 Win=31488 Len=1448 TSval=354977199 TSecr=1484389407 [TCP segment of a reassembled PDU]"
"192","0.359587063","192.168.1.118","104.102.89.129","TCP","66","43552 → 443 [ACK] Seq=1370 Ack=68426 Win=75776 Len=0 TSval=1484389419 TSecr=354977199"
"193","0.363406800","104.102.89.129","192.168.1.118","TCP","8754","443 → 43552 [ACK] Seq=68426 Ack=1370 Win=31488 Len=8688 TSval=354977199 TSecr=1484389407 [TCP segment of a reassembled PDU]"
"194","0.363548250","192.168.1.118","104.102.89.129","TCP","66","43552 → 443 [ACK] Seq=1370 Ack=77114 Win=93056 Len=0 TSval=1484389423 TSecr=354977199"
"195","0.364176250","104.102.89.129","192.168.1.118","TCP","1514","443 → 43552 [PSH, ACK] Seq=77114 Ack=1370 Win=31488 Len=1448 TSval=354977199 TSecr=1484389407 [TCP segment of a reassembled PDU]"
"196","0.364303150","192.168.1.118","104.102.89.129","TCP","66","43552 → 443 [ACK] Seq=1370 Ack=78562 Win=96000 Len=0 TSval=1484389423 TSecr=354977199"
"197","0.364448425","104.102.89.129","192.168.1.118","TCP","2962","443 → 43552 [ACK] Seq=78562 Ack=1370 Win=31488 Len=2896 TSval=354977200 TSecr=1484389407 [TCP segment of a reassembled PDU]"
"198","0.364535938","192.168.1.118","104.102.89.129","TCP","66","43552 → 443 [ACK] Seq=1370 Ack=81458 Win=101760 Len=0 TSval=1484389424 TSecr=354977200"
"199","0.366232463","192.168.1.118","104.196.190.179","TLSv1","571","Client Hello"
"200","0.367122000","104.102.89.129","192.168.1.118","TLSv1.2","2962","Application Data [TCP segment of a reassembled PDU]"
"201","0.367261638","192.168.1.118","104.102.89.129","TCP","66","43552 → 443 [ACK] Seq=1370 Ack=84354 Win=107648 Len=0 TSval=1484389426 TSecr=354977201"
"202","0.367332550","104.102.89.129","192.168.1.118","TLSv1.2","146","Application Data"
"203","0.372095825","104.102.89.129","192.168.1.118","TLSv1.2","8754","Application Data [TCP segment of a reassembled PDU]"
"204","0.372626413","104.102.89.129","192.168.1.118","TCP","4410","443 → 43554 [ACK] Seq=35122 Ack=1490 Win=31744 Len=4344 TSval=354977209 TSecr=1484389407 [TCP segment of a reassembled PDU]"
"205","0.375520363","104.102.89.129","192.168.1.118","TLSv1.2","8594","Application Data, Application Data"
"206","0.379873650","199.232.37.224","192.168.1.118","TLSv1.2","1418","Application Data"
"207","0.382518513","192.168.1.118","104.196.190.179","TLSv1","571","Client Hello"
"208","0.382981063","199.232.37.224","192.168.1.118","TLSv1.2","5474","Application Data, Application Data, Application Data, Application Data"
"209","0.384588150","199.232.37.224","192.168.1.118","TLSv1.2","1418","Application Data [TCP segment of a reassembled PDU]"
"210","0.384651850","199.232.37.224","192.168.1.118","TLSv1.2","1418","Application Data"
"211","0.386403100","199.232.37.224","192.168.1.118","TLSv1.2","5474","Application Data, Application Data, Application Data, Application Data"
"212","0.386494488","199.232.37.224","192.168.1.118","TLSv1.2","5474","Application Data, Application Data, Application Data, Application Data"
"213","0.386684900","199.232.37.224","192.168.1.118","TLSv1.2","2770","Application Data, Application Data"
"214","0.390248713","199.232.37.224","192.168.1.118","TLSv1.2","4122","Application Data, Application Data, Application Data"
"215","0.390338425","199.232.37.224","192.168.1.118","TLSv1.2","4122","Application Data, Application Data, Application Data"
"216","0.391885625","199.232.37.224","192.168.1.118","TLSv1.2","4122","Application Data, Application Data, Application Data"
"217","0.393117313","199.232.37.224","192.168.1.118","TLSv1.2","5474","Application Data, Application Data, Application Data, Application Data"
"218","0.393206475","199.232.37.224","192.168.1.118","TLSv1.2","4122","Application Data, Application Data, Application Data"
"219","0.398413325","199.232.37.224","192.168.1.118","TLSv1.2","9530","Application Data, Application Data, Application Data, Application Data, Application Data, Application Data, Application Data"
"220","0.398505075","199.232.37.224","192.168.1.118","TLSv1.2","1418","Application Data"
"221","0.398779538","199.232.37.224","192.168.1.118","TLSv1.2","10882","Application Data, Application Data, Application Data, Application Data, Application Data, Application Data, Application Data, Application Data"
"222","0.398796625","192.168.1.118","104.196.190.179","TLSv1","571","Client Hello"
"223","0.399080963","192.168.1.118","104.102.89.129","TCP","66","43554 → 443 [ACK] Seq=1490 Ack=47994 Win=19456 Len=0 TSval=1484389458 TSecr=354977208"
"224","0.399118575","192.168.1.118","104.102.89.129","TCP","66","[TCP Window Update] 43554 → 443 [ACK] Seq=1490 Ack=47994 Win=39424 Len=0 TSval=1484389458 TSecr=354977208"
"225","0.400185925","199.232.37.224","192.168.1.118","TLSv1.2","1418","Application Data [TCP segment of a reassembled PDU]"
"226","0.400198838","192.168.1.118","104.102.89.129","TLSv1.2","664","Application Data"
"227","0.400275688","192.168.1.118","199.232.37.224","TCP","66","35786 → 443 [ACK] Seq=883 Ack=17257 Win=50688 Len=0 TSval=1320308699 TSecr=268273925"
"228","0.400408225","192.168.1.118","199.232.37.224","TCP","66","35788 → 443 [ACK] Seq=883 Ack=17257 Win=50688 Len=0 TSval=1320308700 TSecr=3246037995"
"229","0.400513525","192.168.1.118","199.232.37.224","TCP","66","35790 → 443 [ACK] Seq=893 Ack=17257 Win=50688 Len=0 TSval=1320308700 TSecr=2805482719"
"230","0.400617375","192.168.1.118","199.232.37.224","TCP","66","35792 → 443 [ACK] Seq=891 Ack=17257 Win=50688 Len=0 TSval=1320308700 TSecr=3139690465"
"231","0.400720388","192.168.1.118","199.232.37.224","TCP","66","35794 → 443 [ACK] Seq=888 Ack=17257 Win=50688 Len=0 TSval=1320308700 TSecr=2805693999"
"232","0.405436425","104.196.190.179","192.168.1.118","TCP","54","443 → 41996 [ACK] Seq=1 Ack=518 Win=29696 Len=0"
"233","0.407269050","104.196.190.179","192.168.1.118","TLSv1.2","3189","Server Hello, Certificate, Server Key Exchange, Server Hello Done"
"234","0.407389188","192.168.1.118","104.196.190.179","TCP","54","41996 → 443 [ACK] Seq=518 Ack=3136 Win=61184 Len=0"
"235","0.407889700","192.168.1.118","104.102.89.129","TCP","66","43552 → 443 [ACK] Seq=1370 Ack=84434 Win=107648 Len=0 TSval=1484389467 TSecr=354977202"
"236","0.459173538","199.232.37.224","192.168.1.118","TLSv1.2","1418","Application Data [TCP segment of a reassembled PDU]"
"237","0.462065200","192.168.1.118","104.196.190.179","TLSv1.2","180","Client Key Exchange, Change Cipher Spec, Encrypted Handshake Message"
"238","0.466872113","199.232.37.224","192.168.1.118","TLSv1.2","4122","Application Data, Application Data, Application Data"
"239","0.466924400","199.232.37.224","192.168.1.118","TLSv1.2","4122","Application Data, Application Data, Application Data"
"240","0.467060138","199.232.37.224","192.168.1.118","TLSv1.2","1418","Application Data [TCP segment of a reassembled PDU]"
"241","0.467074713","199.232.37.224","192.168.1.118","TLSv1.2","6826","Application Data, Application Data, Application Data, Application Data"
"242","0.467087588","199.232.37.224","192.168.1.118","TLSv1.2","5474","Application Data, Application Data, Application Data, Application Data"
"243","0.467210188","192.168.1.118","199.232.37.224","TCP","66","35786 → 443 [ACK] Seq=883 Ack=29425 Win=38528 Len=0 TSval=1320308766 TSecr=268273944"
"244","0.467290675","192.168.1.118","199.232.37.224","TCP","66","35788 → 443 [ACK] Seq=883 Ack=22665 Win=45312 Len=0 TSval=1320308766 TSecr=3246038014"
"245","0.467340963","192.168.1.118","199.232.37.224","TCP","66","35790 → 443 [ACK] Seq=893 Ack=22665 Win=45312 Len=0 TSval=1320308766 TSecr=2805482737"
"246","0.470052675","199.232.37.224","192.168.1.118","TLSv1.2","4122","Application Data, Application Data, Application Data"
"247","0.470098300","199.232.37.224","192.168.1.118","TLSv1.2","1418","Application Data [TCP segment of a reassembled PDU]"
"248","0.471686813","199.232.37.224","192.168.1.118","TLSv1.2","1418","Application Data [TCP segment of a reassembled PDU]"
"249","0.471715125","199.232.37.224","192.168.1.118","TCP","1418","443 → 35790 [ACK] Seq=24017 Ack=893 Win=29184 Len=1352 TSval=2805482737 TSecr=1320308700 [TCP segment of a reassembled PDU]"
"250","0.472528850","199.232.37.224","192.168.1.118","TLSv1.2","4606","Application Data, Application Data, Application Data, Application Data, Application Data"
"251","0.472563400","199.232.37.224","192.168.1.118","TLSv1.2","4449","Application Data, Application Data, Application Data, Application Data"
"252","0.472606300","199.232.37.224","192.168.1.118","TLSv1.2","2770","Application Data [TCP segment of a reassembled PDU]"
"253","0.475965963","199.232.37.224","192.168.1.118","TLSv1.2","2770","Application Data, Application Data"
"254","0.476005338","199.232.37.224","192.168.1.118","TLSv1.2","2770","Application Data, Application Data"
"255","0.477588550","199.232.37.224","192.168.1.118","TLSv1.2","1210","Application Data"
"256","0.477620288","199.232.37.224","192.168.1.118","TLSv1.2","2770","Application Data, Application Data"
"257","0.478846338","199.232.37.224","192.168.1.118","TLSv1.2","6826","Application Data, Application Data, Application Data, Application Data, Application Data"
"258","0.478880638","199.232.37.224","192.168.1.118","TLSv1.2","5474","Application Data, Application Data, Application Data, Application Data"
"259","0.483784125","104.196.190.179","192.168.1.118","TCP","54","443 → 41998 [ACK] Seq=1 Ack=518 Win=29696 Len=0"
"260","0.483849563","199.232.37.224","192.168.1.118","TLSv1.2","1418","Application Data [TCP segment of a reassembled PDU]"
"261","0.483865075","104.196.190.179","192.168.1.118","TLSv1.2","1474","Server Hello"
"262","0.483894225","192.168.1.118","104.196.190.179","TCP","54","41998 → 443 [ACK] Seq=518 Ack=1421 Win=63104 Len=0"
"263","0.485461338","104.196.190.179","192.168.1.118","TLSv1.2","1769","Certificate, Server Key Exchange, Server Hello Done"
"264","0.485515838","192.168.1.118","104.196.190.179","TCP","54","41998 → 443 [ACK] Seq=518 Ack=3136 Win=61440 Len=0"
"265","0.485565638","199.232.37.224","192.168.1.118","TLSv1.2","2770","Application Data, Application Data"
"266","0.485580750","199.232.37.224","192.168.1.118","TLSv1.2","2770","Application Data, Application Data"
"267","0.485849075","104.196.190.179","192.168.1.118","TCP","54","443 → 42000 [ACK] Seq=1 Ack=518 Win=29696 Len=0"
"268","0.485889650","199.232.37.224","192.168.1.118","TLSv1.2","2770","Application Data, Application Data"
"269","0.485900488","199.232.37.224","192.168.1.118","TLSv1.2","2770","Application Data, Application Data"
"270","0.485909550","104.196.190.179","192.168.1.118","TLSv1.2","2894","Server Hello, Certificate"
"271","0.485925100","192.168.1.118","104.196.190.179","TCP","54","42000 → 443 [ACK] Seq=518 Ack=2841 Win=61440 Len=0"
"272","0.491707313","104.196.190.179","192.168.1.118","TLSv1.2","349","Server Key Exchange, Server Hello Done"
"273","0.491777475","192.168.1.118","104.196.190.179","TCP","54","42000 → 443 [ACK] Seq=518 Ack=3136 Win=61184 Len=0"
"274","0.491863138","104.102.89.129","192.168.1.118","TCP","8754","[TCP segment of a reassembled PDU]"
"275","0.491893713","192.168.1.118","104.102.89.129","TCP","66","43558 → 443 [ACK] Seq=1242 Ack=11954 Win=55552 Len=0 TSval=1484389551 TSecr=354977315"
"276","0.492431800","104.102.89.129","192.168.1.118","TLSv1.2","4138","Application Data"
"277","0.492504775","192.168.1.118","104.102.89.129","TCP","66","43558 → 443 [ACK] Seq=1242 Ack=16026 Win=51584 Len=0 TSval=1484389552 TSecr=354977315"
"278","0.498133688","199.232.37.224","192.168.1.118","TLSv1.2","1418","Application Data [TCP segment of a reassembled PDU]"
"279","0.498203713","199.232.37.224","192.168.1.118","TLSv1.2","1418","Application Data [TCP segment of a reassembled PDU]"
"280","0.498278275","199.232.37.224","192.168.1.118","TLSv1.2","4122","Application Data, Application Data, Application Data"
"281","0.498295988","199.232.37.224","192.168.1.118","TLSv1.2","2770","Application Data, Application Data"
"282","0.498356013","199.232.37.224","192.168.1.118","TLSv1.2","1418","Application Data [TCP segment of a reassembled PDU]"
"283","0.501554525","199.232.37.224","192.168.1.118","TLSv1.2","1456","Application Data, Application Data"
"284","0.501651413","199.232.37.224","192.168.1.118","TLSv1.2","6651","Application Data, Application Data, Application Data, Application Data, Application Data, Application Data"
"285","0.501702500","192.168.1.118","199.232.37.224","TCP","66","35786 → 443 [ACK] Seq=883 Ack=57642 Win=10368 Len=0 TSval=1320308801 TSecr=268273944"
"286","0.503494088","104.196.190.179","192.168.1.118","TLSv1.2","105","Change Cipher Spec, Encrypted Handshake Message"
"287","0.503575238","192.168.1.118","104.196.190.179","TCP","54","41996 → 443 [ACK] Seq=644 Ack=3187 Win=64128 Len=0"
"288","0.511095925","192.168.1.118","199.232.37.224","TCP","66","35790 → 443 [ACK] Seq=893 Ack=29909 Win=38144 Len=0 TSval=1320308810 TSecr=2805482737"
"289","0.512181550","192.168.1.118","199.232.37.224","TCP","66","35792 → 443 [ACK] Seq=891 Ack=22992 Win=45056 Len=0 TSval=1320308811 TSecr=3139690484"
"290","0.512908775","192.168.1.118","199.232.37.224","TCP","66","35788 → 443 [ACK] Seq=883 Ack=49743 Win=18304 Len=0 TSval=1320308812 TSecr=3246038014"
"291","0.516894025","192.168.1.118","199.232.37.224","TCP","66","35794 → 443 [ACK] Seq=888 Ack=21105 Win=46848 Len=0 TSval=1320308816 TSecr=2805694018"
"292","0.559616475","192.168.1.118","104.196.190.179","TLSv1.2","660","Application Data"
"293","0.561511850","192.168.1.118","104.196.190.179","TLSv1.2","180","Client Key Exchange, Change Cipher Spec, Encrypted Handshake Message"
"294","0.563327250","192.168.1.118","104.196.190.179","TLSv1.2","180","Client Key Exchange, Change Cipher Spec, Encrypted Handshake Message"
"295","0.578211063","192.168.1.118","199.232.37.224","TLSv1.2","309","Application Data"
"296","0.581588175","192.168.1.118","199.232.37.224","TLSv1.2","309","Application Data"
"297","0.592265350","192.168.1.118","199.232.37.224","TLSv1.2","309","Application Data"
"298","0.594810700","192.168.1.118","199.232.37.224","TCP","66","[TCP Window Update] 35786 → 443 [ACK] Seq=883 Ack=57642 Win=64128 Len=0 TSval=1320308894 TSecr=268273944"
"299","0.595317363","104.196.190.179","192.168.1.118","TCP","1474","[TCP segment of a reassembled PDU]"
"300","0.595469688","192.168.1.118","104.196.190.179","TCP","54","41996 → 443 [ACK] Seq=1250 Ack=4607 Win=63104 Len=0"
"301","0.597940613","192.168.1.118","199.232.37.224","TCP","66","[TCP Window Update] 35788 → 443 [ACK] Seq=883 Ack=49743 Win=64128 Len=0 TSval=1320308897 TSecr=3246038014"
"302","0.608399800","104.196.190.179","192.168.1.118","TCP","8574","443 → 41996 [ACK] Seq=4607 Ack=1250 Win=30720 Len=8520 [TCP segment of a reassembled PDU]"
"303","0.608538688","192.168.1.118","104.196.190.179","TCP","54","41996 → 443 [ACK] Seq=1250 Ack=13127 Win=54656 Len=0"
"304","0.608965613","104.196.190.179","192.168.1.118","TLSv1.2","105","Change Cipher Spec, Encrypted Handshake Message"
"305","0.609061325","192.168.1.118","104.196.190.179","TCP","54","42000 → 443 [ACK] Seq=644 Ack=3187 Win=64128 Len=0"
"306","0.609126038","104.196.190.179","192.168.1.118","TLSv1.2","105","Change Cipher Spec, Encrypted Handshake Message"
"307","0.609211375","192.168.1.118","104.196.190.179","TCP","54","41998 → 443 [ACK] Seq=644 Ack=3187 Win=64128 Len=0"
"308","0.609290738","104.196.190.179","192.168.1.118","TLSv1.2","6527","Application Data"
"309","0.609367175","192.168.1.118","104.196.190.179","TCP","54","41996 → 443 [ACK] Seq=1250 Ack=19600 Win=54912 Len=0"
"310","0.609425075","199.232.37.224","192.168.1.118","TLSv1.2","16290","Application Data, Application Data, Application Data, Application Data, Application Data, Application Data, Application Data, Application Data, Application Data, Application Data, Application Data, Application Data"
"311","0.609529663","192.168.1.118","199.232.37.224","TCP","66","35794 → 443 [ACK] Seq=1131 Ack=37329 Win=48000 Len=0 TSval=1320308909 TSecr=2805694054"
"312","0.612454763","192.168.1.118","104.196.190.179","TLSv1.2","656","Application Data"
"313","0.612711213","192.168.1.118","104.196.190.179","TLSv1.2","658","Application Data"
"314","0.612974200","192.168.1.118","199.232.37.224","TLSv1.2","310","Application Data"
"315","0.616094088","104.196.190.179","192.168.1.118","TCP","2894","[TCP segment of a reassembled PDU]"
"316","0.616200763","192.168.1.118","104.196.190.179","TCP","54","41996 → 443 [ACK] Seq=1250 Ack=22440 Win=61056 Len=0"
"317","0.616260500","199.232.37.224","192.168.1.118","TLSv1.2","2770","Application Data, Application Data"
"318","0.616330388","192.168.1.118","199.232.37.224","TCP","66","35794 → 443 [ACK] Seq=1131 Ack=40033 Win=45312 Len=0 TSval=1320308915 TSecr=2805694054"
"319","0.616368563","199.232.37.224","192.168.1.118","TLSv1.2","2770","Application Data, Application Data"
"320","0.616443613","192.168.1.118","199.232.37.224","TCP","66","35792 → 443 [ACK] Seq=1134 Ack=25696 Win=61440 Len=0 TSval=1320308916 TSecr=3139690522"
"321","0.617697988","199.232.37.224","192.168.1.118","TLSv1.2","4122","Application Data, Application Data, Application Data"
"322","0.617815988","192.168.1.118","199.232.37.224","TCP","66","35792 → 443 [ACK] Seq=1134 Ack=29752 Win=57472 Len=0 TSval=1320308917 TSecr=3139690522"
"323","0.618950088","199.232.37.224","192.168.1.118","TLSv1.2","9530","Application Data, Application Data, Application Data, Application Data, Application Data, Application Data, Application Data"
"324","0.619067475","192.168.1.118","199.232.37.224","TCP","66","35792 → 443 [ACK] Seq=1134 Ack=39216 Win=48128 Len=0 TSval=1320308918 TSecr=3139690522"
"325","0.623632100","192.168.1.118","199.232.37.224","TLSv1.2","307","Application Data"
"326","0.627542450","199.232.37.224","192.168.1.118","TLSv1.2","2770","Application Data [TCP segment of a reassembled PDU]"
"327","0.627658463","192.168.1.118","199.232.37.224","TCP","66","35794 → 443 [ACK] Seq=1131 Ack=42737 Win=42624 Len=0 TSval=1320308927 TSecr=2805694054"
"328","0.627785563","199.232.37.224","192.168.1.118","TLSv1.2","2770","Application Data, Application Data"
"329","0.627889825","192.168.1.118","199.232.37.224","TCP","66","35792 → 443 [ACK] Seq=1134 Ack=41920 Win=45440 Len=0 TSval=1320308927 TSecr=3139690522"
"330","0.627934775","199.232.37.224","192.168.1.118","TLSv1.2","2770","Application Data, Application Data"
"331","0.627982300","199.232.37.224","192.168.1.118","TLSv1.2","1418","Application Data"
"332","0.628591200","192.168.1.118","199.232.37.224","TCP","66","35794 → 443 [ACK] Seq=1131 Ack=45441 Win=39936 Len=0 TSval=1320308928 TSecr=2805694056"
"333","0.629163825","199.232.37.224","192.168.1.118","TLSv1.2","6826","Application Data, Application Data, Application Data, Application Data, Application Data"
"334","0.629280713","192.168.1.118","199.232.37.224","TCP","66","35790 → 443 [ACK] Seq=1136 Ack=38021 Win=77696 Len=0 TSval=1320308928 TSecr=2805482777"
"335","0.630429913","199.232.37.224","192.168.1.118","TLSv1.2","5474","Application Data, Application Data, Application Data, Application Data"
"336","0.630548338","192.168.1.118","199.232.37.224","TCP","66","35790 → 443 [ACK] Seq=1136 Ack=43429 Win=88448 Len=0 TSval=1320308930 TSecr=2805482777"
"337","0.640592450","199.232.37.224","192.168.1.118","TLSv1.2","5474","Application Data, Application Data, Application Data, Application Data"
"338","0.640692013","199.232.37.224","192.168.1.118","TLSv1.2","2770","Application Data [TCP segment of a reassembled PDU]"
"339","0.640778375","192.168.1.118","199.232.37.224","TCP","66","35792 → 443 [ACK] Seq=1134 Ack=44624 Win=61056 Len=0 TSval=1320308940 TSecr=3139690522"
"340","0.640885688","199.232.37.224","192.168.1.118","TLSv1.2","1418","Application Data [TCP segment of a reassembled PDU]"
"341","0.641040588","192.168.1.118","199.232.37.224","TCP","66","35790 → 443 [ACK] Seq=1136 Ack=48837 Win=84608 Len=0 TSval=1320308940 TSecr=2805482777"
"342","0.641755638","199.232.37.224","192.168.1.118","TLSv1.2","1418","Application Data [TCP segment of a reassembled PDU]"
"343","0.641872250","192.168.1.118","199.232.37.224","TCP","66","35794 → 443 [ACK] Seq=1131 Ack=48145 Win=61056 Len=0 TSval=1320308941 TSecr=2805694057"
"344","0.641928750","199.232.37.224","192.168.1.118","TLSv1.2","2770","Application Data, Application Data"
"345","0.642002563","192.168.1.118","199.232.37.224","TCP","66","35792 → 443 [ACK] Seq=1134 Ack=47328 Win=61056 Len=0 TSval=1320308941 TSecr=3139690523"
"346","0.642960375","199.232.37.224","192.168.1.118","TLSv1.2","2770","Application Data [TCP segment of a reassembled PDU]"
"347","0.643086925","199.232.37.224","192.168.1.118","TLSv1.2","2770","Application Data, Application Data"
"348","0.643167750","192.168.1.118","199.232.37.224","TCP","66","35792 → 443 [ACK] Seq=1134 Ack=50032 Win=58368 Len=0 TSval=1320308942 TSecr=3139690524"
"349","0.643225250","199.232.37.224","192.168.1.118","TLSv1.2","2770","Application Data, Application Data"
"350","0.646226388","199.232.37.224","192.168.1.118","TLSv1.2","1003","Application Data, Application Data"
"351","0.646425300","199.232.37.224","192.168.1.118","TLSv1.2","3353","Application Data, Application Data, Application Data, Application Data"
"352","0.646493450","104.196.190.179","192.168.1.118","TCP","2894","443 → 41996 [ACK] Seq=22440 Ack=1250 Win=30720 Len=2840 [TCP segment of a reassembled PDU]"
"353","0.646576988","192.168.1.118","104.196.190.179","TCP","54","41996 → 443 [ACK] Seq=1250 Ack=25280 Win=61056 Len=0"
"354","0.647342213","199.232.37.224","192.168.1.118","TLSv1.2","1418","Application Data [TCP segment of a reassembled PDU]"
"355","0.647429775","192.168.1.118","199.232.37.224","TCP","66","35792 → 443 [ACK] Seq=1134 Ack=51384 Win=57088 Len=0 TSval=1320308947 TSecr=3139690533"
"356","0.647673088","192.168.1.118","199.232.37.224","TCP","66","35794 → 443 [ACK] Seq=1131 Ack=51432 Win=57856 Len=0 TSval=1320308947 TSecr=2805694064"
"357","0.649137688","192.168.1.118","199.232.37.224","TCP","66","35790 → 443 [ACK] Seq=1136 Ack=55182 Win=78336 Len=0 TSval=1320308948 TSecr=2805482777"
"358","0.654839550","199.232.37.224","192.168.1.118","TLSv1.2","1967","Application Data, Application Data, Application Data"
"359","0.654900213","192.168.1.118","199.232.37.224","TCP","66","35792 → 443 [ACK] Seq=1134 Ack=53285 Win=55296 Len=0 TSval=1320308954 TSecr=3139690533"
"360","0.654951288","199.232.37.224","192.168.1.118","TLSv1.2","4122","Application Data, Application Data, Application Data"
"361","0.654981888","192.168.1.118","199.232.37.224","TCP","66","35788 → 443 [ACK] Seq=1127 Ack=53799 Win=72320 Len=0 TSval=1320308954 TSecr=3246038063"
"362","0.655051300","199.232.37.224","192.168.1.118","TLSv1.2","2770","Application Data, Application Data"
"363","0.655067813","192.168.1.118","199.232.37.224","TCP","66","35788 → 443 [ACK] Seq=1127 Ack=56503 Win=77696 Len=0 TSval=1320308954 TSecr=3246038063"
"364","0.658674288","192.168.1.118","199.232.37.224","TLSv1.2","310","Application Data"
"365","0.658814675","199.232.37.224","192.168.1.118","TLSv1.2","5474","Application Data, Application Data, Application Data, Application Data"
"366","0.658868263","192.168.1.118","199.232.37.224","TCP","66","35788 → 443 [ACK] Seq=1127 Ack=61911 Win=88448 Len=0 TSval=1320308958 TSecr=3246038063"
"367","0.660481963","199.232.37.224","192.168.1.118","TLSv1.2","4122","Application Data, Application Data, Application Data"
"368","0.660540225","192.168.1.118","199.232.37.224","TCP","66","35788 → 443 [ACK] Seq=1127 Ack=65967 Win=96640 Len=0 TSval=1320308960 TSecr=3246038063"
"369","0.661665400","199.232.37.224","192.168.1.118","TLSv1.2","12234","Application Data, Application Data, Application Data, Application Data, Application Data, Application Data, Application Data, Application Data, Application Data"
"370","0.661732713","192.168.1.118","199.232.37.224","TCP","66","35786 → 443 [ACK] Seq=1124 Ack=69810 Win=88448 Len=0 TSval=1320308961 TSecr=268273993"
"371","0.664465088","192.168.1.118","199.232.37.224","TLSv1.2","310","Application Data"
"372","0.664615050","192.168.1.118","199.232.37.224","TLSv1.2","310","Application Data"
"373","0.667041200","199.232.37.224","192.168.1.118","TLSv1.2","5474","Application Data, Application Data, Application Data, Application Data"
"374","0.667115175","192.168.1.118","199.232.37.224","TCP","66","35786 → 443 [ACK] Seq=1124 Ack=75218 Win=99328 Len=0 TSval=1320308966 TSecr=268273993"
"375","0.667153325","199.232.37.224","192.168.1.118","TLSv1.2","2770","Application Data, Application Data"
"376","0.667189750","192.168.1.118","199.232.37.224","TCP","66","35788 → 443 [ACK] Seq=1127 Ack=68671 Win=102016 Len=0 TSval=1320308966 TSecr=3246038063"
"377","0.669143075","199.232.37.224","192.168.1.118","TLSv1.2","1418","Application Data [TCP segment of a reassembled PDU]"
"378","0.669225363","199.232.37.224","192.168.1.118","TLSv1.2","1418","Application Data [TCP segment of a reassembled PDU]"
"379","0.669264888","192.168.1.118","199.232.37.224","TCP","66","35788 → 443 [ACK] Seq=1127 Ack=70023 Win=104704 Len=0 TSval=1320308968 TSecr=3246038063"
"380","0.670082363","199.232.37.224","192.168.1.118","TLSv1.2","1851","Application Data, Application Data"
"381","0.670153338","192.168.1.118","199.232.37.224","TCP","66","35788 → 443 [ACK] Seq=1127 Ack=71808 Win=108288 Len=0 TSval=1320308969 TSecr=3246038063"
"382","0.670248638","199.232.37.224","192.168.1.118","TLSv1.2","5474","Application Data, Application Data, Application Data"
"383","0.670275763","192.168.1.118","199.232.37.224","TCP","66","35786 → 443 [ACK] Seq=1124 Ack=81978 Win=112768 Len=0 TSval=1320308969 TSecr=268273993"
"384","0.670294250","104.196.190.179","192.168.1.118","TCP","2894","443 → 41996 [ACK] Seq=25280 Ack=1250 Win=30720 Len=2840 [TCP segment of a reassembled PDU]"
"385","0.670323788","192.168.1.118","104.196.190.179","TCP","54","41996 → 443 [ACK] Seq=1250 Ack=28120 Win=61056 Len=0"
"386","0.675328813","199.232.37.224","192.168.1.118","TLSv1.2","3653","Application Data, Application Data, Application Data, Application Data"
"387","0.675402838","192.168.1.118","199.232.37.224","TCP","66","35786 → 443 [ACK] Seq=1124 Ack=85565 Win=119936 Len=0 TSval=1320308975 TSecr=268273994"
"388","0.675512663","104.196.190.179","192.168.1.118","TLSv1.2","8574","Application Data [TCP segment of a reassembled PDU]"
"389","0.675548613","192.168.1.118","104.196.190.179","TCP","54","41996 → 443 [ACK] Seq=1250 Ack=36640 Win=52864 Len=0"
"390","0.675566325","104.196.190.179","192.168.1.118","TCP","4314","[TCP segment of a reassembled PDU]"
"391","0.675670625","104.196.190.179","192.168.1.118","TCP","5734","443 → 41998 [ACK] Seq=7447 Ack=1246 Win=30720 Len=5680 [TCP segment of a reassembled PDU]"
"392","0.677609888","192.168.1.118","104.196.190.179","TCP","54","41998 → 443 [ACK] Seq=1246 Ack=13127 Win=54272 Len=0"
"393","0.677860613","104.196.190.179","192.168.1.118","TLSv1.2","6527","Application Data"
"394","0.677930150","192.168.1.118","104.196.190.179","TCP","54","41998 → 443 [ACK] Seq=1246 Ack=19600 Win=54912 Len=0"
"395","0.677980500","104.196.190.179","192.168.1.118","TCP","1474","[TCP segment of a reassembled PDU]"
"396","0.679866288","104.196.190.179","192.168.1.118","TCP","1474","443 → 42000 [ACK] Seq=4607 Ack=1248 Win=30720 Len=1420 [TCP segment of a reassembled PDU]"
"397","0.680942938","104.196.190.179","192.168.1.118","TLSv1.2","11999","Application Data"
"398","0.681327088","192.168.1.118","104.196.190.179","TCP","54","42000 → 443 [ACK] Seq=1248 Ack=17972 Win=49408 Len=0"
"399","0.685089775","104.196.190.179","192.168.1.118","TCP","5734","443 → 41996 [ACK] Seq=36640 Ack=1250 Win=30720 Len=5680 [TCP segment of a reassembled PDU]"
"400","0.685175963","192.168.1.118","104.196.190.179","TCP","54","41996 → 443 [ACK] Seq=1250 Ack=42320 Win=56960 Len=0"
"401","0.685225463","104.196.190.179","192.168.1.118","TCP","2894","[TCP segment of a reassembled PDU]"
"402","0.685265938","192.168.1.118","104.196.190.179","TCP","54","41998 → 443 [ACK] Seq=1246 Ack=22440 Win=61056 Len=0"
"403","0.686714025","104.196.190.179","192.168.1.118","TCP","2894","443 → 41996 [ACK] Seq=42320 Ack=1250 Win=30720 Len=2840 [TCP segment of a reassembled PDU]"
"404","0.686799263","192.168.1.118","104.196.190.179","TCP","54","41996 → 443 [ACK] Seq=1250 Ack=45160 Win=61056 Len=0"
"405","0.687406400","104.196.190.179","192.168.1.118","TLSv1.2","8574","Application Data [TCP segment of a reassembled PDU]"
"406","0.687492675","192.168.1.118","104.196.190.179","TCP","54","41996 → 443 [ACK] Seq=1250 Ack=53680 Win=52608 Len=0"
"407","0.688600988","192.168.1.118","199.232.37.224","TLSv1.2","317","Application Data"
"408","0.691156150","104.196.190.179","192.168.1.118","TCP","1474","443 → 41996 [ACK] Seq=53680 Ack=1250 Win=30720 Len=1420 [TCP segment of a reassembled PDU]"
"409","0.691253550","192.168.1.118","104.196.190.179","TCP","54","41996 → 443 [ACK] Seq=1250 Ack=55100 Win=63104 Len=0"
"410","0.694298625","104.196.190.179","192.168.1.118","TCP","4314","443 → 41996 [ACK] Seq=55100 Ack=1250 Win=30720 Len=4260 [TCP segment of a reassembled PDU]"
"411","0.694395313","192.168.1.118","104.196.190.179","TCP","54","41996 → 443 [ACK] Seq=1250 Ack=59360 Win=59008 Len=0"
"412","0.696035363","104.196.190.179","192.168.1.118","TCP","2894","443 → 41996 [ACK] Seq=59360 Ack=1250 Win=30720 Len=2840 [TCP segment of a reassembled PDU]"
"413","0.696133538","192.168.1.118","104.196.190.179","TCP","54","41996 → 443 [ACK] Seq=1250 Ack=62200 Win=61056 Len=0"
"414","0.698972788","104.196.190.179","192.168.1.118","TCP","2894","443 → 41996 [ACK] Seq=62200 Ack=1250 Win=30720 Len=2840 [TCP segment of a reassembled PDU]"
"415","0.699069275","192.168.1.118","104.196.190.179","TCP","54","41996 → 443 [ACK] Seq=1250 Ack=65040 Win=61056 Len=0"
"416","0.702059713","199.232.37.224","192.168.1.118","TLSv1.2","8178","Application Data, Application Data, Application Data, Application Data, Application Data, Application Data"
"417","0.702187063","192.168.1.118","199.232.37.224","TCP","66","35794 → 443 [ACK] Seq=1375 Ack=59544 Win=80384 Len=0 TSval=1320309001 TSecr=2805694079"
"418","0.703378375","199.232.37.224","192.168.1.118","TLSv1.2","6826","Application Data, Application Data, Application Data, Application Data, Application Data"
"419","0.703498400","192.168.1.118","199.232.37.224","TCP","66","35794 → 443 [ACK] Seq=1375 Ack=66304 Win=93952 Len=0 TSval=1320309003 TSecr=2805694079"
"420","0.706310988","199.232.37.224","192.168.1.118","TLSv1.2","1418","Application Data [TCP segment of a reassembled PDU]"
"421","0.706386975","199.232.37.224","192.168.1.118","TLSv1.2","8178","Application Data, Application Data, Application Data, Application Data, Application Data, Application Data"
"422","0.706481788","192.168.1.118","199.232.37.224","TCP","66","35790 → 443 [ACK] Seq=1380 Ack=63294 Win=98944 Len=0 TSval=1320309006 TSecr=2805482798"
"423","0.707801913","199.232.37.224","192.168.1.118","TLSv1.2","2770","Application Data, Application Data"
"424","0.708745738","192.168.1.118","199.232.37.224","TCP","66","35790 → 443 [ACK] Seq=1380 Ack=65998 Win=97792 Len=0 TSval=1320309008 TSecr=2805482798"
"425","0.709233775","199.232.37.224","192.168.1.118","TLSv1.2","5474","Application Data, Application Data, Application Data, Application Data"
"426","0.709322125","104.196.190.179","192.168.1.118","TCP","2894","443 → 41996 [ACK] Seq=65040 Ack=1250 Win=30720 Len=2840 [TCP segment of a reassembled PDU]"
"427","0.709392675","192.168.1.118","104.196.190.179","TCP","54","41996 → 443 [ACK] Seq=1250 Ack=67880 Win=61056 Len=0"
"428","0.709448163","199.232.37.224","192.168.1.118","TLSv1.2","1418","Application Data"
"429","0.711336525","192.168.1.118","199.232.37.224","TCP","66","35790 → 443 [ACK] Seq=1380 Ack=71406 Win=92416 Len=0 TSval=1320309010 TSecr=2805482798"
"430","0.716437863","199.232.37.224","192.168.1.118","TLSv1.2","8178","Application Data, Application Data, Application Data, Application Data, Application Data, Application Data"
"431","0.716536263","192.168.1.118","199.232.37.224","TCP","66","35792 → 443 [ACK] Seq=1378 Ack=62749 Win=83072 Len=0 TSval=1320309016 TSecr=3139690546"
"432","0.717917400","199.232.37.224","192.168.1.118","TLSv1.2","4122","Application Data, Application Data, Application Data"
"433","0.718016738","192.168.1.118","199.232.37.224","TCP","66","35792 → 443 [ACK] Seq=1378 Ack=66805 Win=91136 Len=0 TSval=1320309017 TSecr=3139690546"
"434","0.718963575","199.232.37.224","192.168.1.118","TLSv1.2","4122","Application Data, Application Data, Application Data"
"435","0.719021913","192.168.1.118","199.232.37.224","TCP","66","35792 → 443 [ACK] Seq=1378 Ack=70861 Win=99328 Len=0 TSval=1320309018 TSecr=3139690546"
"436","0.719058275","199.232.37.224","192.168.1.118","TLSv1.2","2770","Application Data, Application Data"
"437","0.719112975","192.168.1.118","199.232.37.224","TCP","66","35794 → 443 [ACK] Seq=1375 Ack=70360 Win=102016 Len=0 TSval=1320309018 TSecr=2805694079"
"438","0.719146213","199.232.37.224","192.168.1.118","TLSv1.2","2770","Application Data, Application Data"
"439","0.719595263","192.168.1.118","199.232.37.224","TCP","66","35790 → 443 [ACK] Seq=1380 Ack=74110 Win=89728 Len=0 TSval=1320309019 TSecr=2805482798"
"440","0.723765475","199.232.37.224","192.168.1.118","TLSv1.2","3686","Application Data, Application Data, Application Data"
"441","0.723904325","192.168.1.118","199.232.37.224","TCP","66","35792 → 443 [ACK] Seq=1378 Ack=74481 Win=106496 Len=0 TSval=1320309023 TSecr=3139690546"
"442","0.723972800","199.232.37.224","192.168.1.118","TLSv1.2","2770","Application Data [TCP segment of a reassembled PDU]"
"443","0.724021488","199.232.37.224","192.168.1.118","TLSv1.2","2770","Application Data [TCP segment of a reassembled PDU]"
"444","0.724074950","192.168.1.118","199.232.37.224","TCP","66","35794 → 443 [ACK] Seq=1375 Ack=73064 Win=107392 Len=0 TSval=1320309023 TSecr=2805694079"
"445","0.725047800","192.168.1.118","199.232.37.224","TCP","66","35790 → 443 [ACK] Seq=1380 Ack=76814 Win=87040 Len=0 TSval=1320309024 TSecr=2805482798"
"446","0.725231913","199.232.37.224","192.168.1.118","TLSv1.2","92","Application Data"
"447","0.725364125","199.232.37.224","192.168.1.118","TLSv1.2","5474","Application Data, Application Data, Application Data, Application Data"
"448","0.725441500","192.168.1.118","199.232.37.224","TCP","66","35790 → 443 [ACK] Seq=1380 Ack=82222 Win=105984 Len=0 TSval=1320309025 TSecr=2805482799"
"449","0.725503613","199.232.37.224","192.168.1.118","TLSv1.2","1418","Application Data [TCP segment of a reassembled PDU]"
"450","0.725675188","199.232.37.224","192.168.1.118","TLSv1.2","1418","Application Data [TCP segment of a reassembled PDU]"
"451","0.725711263","199.232.37.224","192.168.1.118","TLSv1.2","493","Application Data, Application Data"
"452","0.725789363","199.232.37.224","192.168.1.118","TLSv1.2","1418","Application Data"
"453","0.727215963","192.168.1.118","199.232.37.224","TCP","66","35790 → 443 [ACK] Seq=1380 Ack=85353 Win=102912 Len=0 TSval=1320309026 TSecr=2805482800"
"454","0.728130363","199.232.37.224","192.168.1.118","TLSv1.2","1418","Application Data [TCP segment of a reassembled PDU]"
"455","0.728233650","192.168.1.118","199.232.37.224","TCP","66","35788 → 443 [ACK] Seq=1378 Ack=74512 Win=113664 Len=0 TSval=1320309027 TSecr=3246038078"
"456","0.729873625","199.232.37.224","192.168.1.118","TLSv1.2","5474","Application Data, Application Data, Application Data, Application Data"
"457","0.729978513","192.168.1.118","199.232.37.224","TCP","66","35788 → 443 [ACK] Seq=1378 Ack=79920 Win=124544 Len=0 TSval=1320309029 TSecr=3246038078"
"458","0.731538475","199.232.37.224","192.168.1.118","TLSv1.2","9597","Application Data, Application Data, Application Data, Application Data, Application Data, Application Data, Application Data, Application Data"
"459","0.731651838","192.168.1.118","199.232.37.224","TCP","66","35788 → 443 [ACK] Seq=1378 Ack=89451 Win=143616 Len=0 TSval=1320309031 TSecr=3246038078"
"460","0.731752825","104.196.190.179","192.168.1.118","TLSv1.2","1859","Application Data"
"461","0.731817150","192.168.1.118","104.196.190.179","TCP","54","41998 → 443 [ACK] Seq=1246 Ack=24245 Win=61056 Len=0"
"462","0.731932700","104.196.190.179","192.168.1.118","TLSv1.2","1474","Application Data [TCP segment of a reassembled PDU]"
"463","0.731989538","192.168.1.118","104.196.190.179","TCP","54","41996 → 443 [ACK] Seq=1250 Ack=69300 Win=66944 Len=0"
"464","0.736184663","104.196.190.179","192.168.1.118","TCP","8574","443 → 41996 [ACK] Seq=69300 Ack=1250 Win=30720 Len=8520 [TCP segment of a reassembled PDU]"
"465","0.736274025","192.168.1.118","104.196.190.179","TCP","54","41996 → 443 [ACK] Seq=1250 Ack=77820 Win=83968 Len=0"
"466","0.736408063","104.196.190.179","192.168.1.118","TLSv1.2","2675","Application Data"
"467","0.736451175","192.168.1.118","104.196.190.179","TCP","54","41996 → 443 [ACK] Seq=1250 Ack=80441 Win=89216 Len=0"
"468","0.766115125","192.168.1.118","199.232.37.224","TCP","66","35794 → 443 [ACK] Seq=1375 Ack=73090 Win=107392 Len=0 TSval=1320309065 TSecr=2805694080"
"469","1.432026363","192.168.1.104","255.255.255.255","UDP","217","49154 → 6666 Len=175"
"470","3.293462663","192.168.1.118","184.72.104.138","TCP","66","36214 → 443 [ACK] Seq=1 Ack=1 Win=501 Len=0 TSval=1570921062 TSecr=2142162949"
"471","3.322675125","184.72.104.138","192.168.1.118","TCP","66","[TCP ACKed unseen segment] 443 → 36214 [ACK] Seq=1 Ack=2 Win=244 Len=0 TSval=2142174212 TSecr=1570830767"
"472","3.733748100","192.168.1.118","192.168.1.102","TCP","176","44768 → 8009 [PSH, ACK] Seq=1 Ack=1 Win=501 Len=110 TSval=2235255843 TSecr=2977759 [TCP segment of a reassembled PDU]"
"473","3.743967550","192.168.1.102","192.168.1.118","TCP","176","8009 → 44768 [PSH, ACK] Seq=1 Ack=111 Win=294 Len=110 TSval=2978263 TSecr=2235255843 [TCP segment of a reassembled PDU]"
"474","3.744095488","192.168.1.118","192.168.1.102","TCP","66","44768 → 8009 [ACK] Seq=111 Ack=111 Win=501 Len=0 TSval=2235255853 TSecr=2978263"
"475","4.410089200","192.168.1.104","255.255.255.255","UDP","217","49154 → 6666 Len=175"
"476","7.371202363","192.168.1.104","255.255.255.255","UDP","217","49154 → 6666 Len=175"
"477","8.749580750","192.168.1.118","192.168.1.102","TCP","176","44768 → 8009 [PSH, ACK] Seq=111 Ack=111 Win=501 Len=110 TSval=2235260859 TSecr=2978263 [TCP segment of a reassembled PDU]"
"478","8.756634350","192.168.1.102","192.168.1.118","TCP","176","8009 → 44768 [PSH, ACK] Seq=111 Ack=221 Win=294 Len=110 TSval=2978765 TSecr=2235260859 [TCP segment of a reassembled PDU]"
"479","8.756869425","192.168.1.118","192.168.1.102","TCP","66","44768 → 8009 [ACK] Seq=221 Ack=221 Win=501 Len=0 TSval=2235260866 TSecr=2978765"
