frame.number,_ws.col.Time,_ws.col.Source,_ws.col.Destination,_ws.col.Protocol,frame.len,_ws.col.Info
"1","0.000000000","192.168.1.118","224.0.0.251","MDNS","82","Standard query 0x0000 PTR _googlecast._tcp.local, "QM" question"
"2","0.001787537","192.168.1.118","224.0.0.251","MDNS","82","Standard query 0x0000 PTR _googlecast._tcp.local, "QM" question"
"3","0.003454562","192.168.1.118","224.0.0.251","MDNS","88","Standard query 0x0000 PTR _print._sub._ipps._tcp.local, "QM" question"
"4","0.004095000","192.168.1.118","224.0.0.251","MDNS","87","Standard query 0x0000 PTR _print._sub._ipp._tcp.local, "QM" question"
"5","0.005893425","192.168.1.118","224.0.0.251","MDNS","76","Standard query 0x0000 PTR _ipps._tcp.local, "QM" question"
"6","0.007698850","192.168.1.118","224.0.0.251","MDNS","75","Standard query 0x0000 PTR _ipp._tcp.local, "QM" question"
"7","0.152901162","192.168.1.102","224.0.0.251","MDNS","409","Standard query response 0x0000 PTR Google-Home-Mini-2c3f16b2da5c4b6fd6cfbfba61c12490._googlecast._tcp.local TXT, cache flush SRV, cache flush 0 0 8009 2c3f16b2-da5c-4b6f-d6cf-bfba61c12490.local A, cache flush 192.168.1.102"
"8","0.445707650","172.217.12.174","192.168.1.118","TLSv1.2","1484","Application Data"
"9","0.446987487","172.217.12.174","192.168.1.118","TLSv1.2","2902","Application Data, Application Data"
"10","0.447072537","192.168.1.118","172.217.12.174","TCP","66","33048 → 443 [ACK] Seq=1 Ack=4255 Win=477 Len=0 TSval=906225788 TSecr=263117982"
"11","0.448643800","172.217.12.174","192.168.1.118","TLSv1.2","2902","Application Data, Application Data"
"12","0.448703112","192.168.1.118","172.217.12.174","TCP","66","33048 → 443 [ACK] Seq=1 Ack=7091 Win=477 Len=0 TSval=906225790 TSecr=263117984"
"13","0.449511375","172.217.12.174","192.168.1.118","TLSv1.2","2902","Application Data, Application Data"
"14","0.452416162","172.217.12.174","192.168.1.118","TLSv1.2","2902","Application Data, Application Data"
"15","0.455839325","172.217.12.174","192.168.1.118","TLSv1.2","2902","Application Data, Application Data"
"16","0.456937662","172.217.12.174","192.168.1.118","TLSv1.2","2902","Application Data, Application Data"
"17","0.457845887","192.168.1.118","172.217.12.174","TCP","66","33048 → 443 [ACK] Seq=1 Ack=18435 Win=389 Len=0 TSval=906225799 TSecr=263117985"
"18","0.458426225","172.217.12.174","192.168.1.118","TLSv1.2","2902","Application Data, Application Data"
"19","0.462187562","172.217.12.174","192.168.1.118","TLSv1.2","2902","Application Data, Application Data"
"20","0.462205512","172.217.12.174","192.168.1.118","TLSv1.2","1484","Application Data [TCP segment of a reassembled PDU]"
"21","0.463277537","192.168.1.118","172.217.12.174","TCP","66","33048 → 443 [ACK] Seq=1 Ack=25525 Win=334 Len=0 TSval=906225804 TSecr=263117990"
"22","0.463321025","172.217.12.174","192.168.1.118","TLSv1.2","2902","Application Data, Application Data"
"23","0.463348912","172.217.12.174","192.168.1.118","TLSv1.2","2902","Application Data, Application Data"
"24","0.463454400","192.168.1.118","172.217.12.174","TCP","66","33048 → 443 [ACK] Seq=1 Ack=31197 Win=290 Len=0 TSval=906225804 TSecr=263118000"
"25","0.467082712","172.217.12.174","192.168.1.118","TLSv1.2","1484","Application Data [TCP segment of a reassembled PDU]"
"26","0.467824900","172.217.12.174","192.168.1.118","TLSv1.2","1484","Application Data [TCP segment of a reassembled PDU]"
"27","0.472440162","172.217.12.174","192.168.1.118","TLSv1.2","1484","Application Data [TCP segment of a reassembled PDU]"
"28","0.473269937","172.217.12.174","192.168.1.118","TLSv1.2","1484","Application Data [TCP segment of a reassembled PDU]"
"29","0.480184800","172.217.12.174","192.168.1.118","TLSv1.2","1484","Application Data [TCP segment of a reassembled PDU]"
"30","0.481196350","172.217.12.174","192.168.1.118","TLSv1.2","1484","Application Data [TCP segment of a reassembled PDU]"
"31","0.481231912","172.217.12.174","192.168.1.118","TLSv1.2","1484","Application Data [TCP segment of a reassembled PDU]"
"32","0.482106350","172.217.12.174","192.168.1.118","TLSv1.2","1484","Application Data [TCP segment of a reassembled PDU]"
"33","0.483218050","172.217.12.174","192.168.1.118","TLSv1.2","2902","Application Data, Application Data"
"34","0.486839637","172.217.12.174","192.168.1.118","TLSv1.2","652","Application Data, Application Data"
"35","0.506187912","192.168.1.118","172.217.12.174","TCP","66","33048 → 443 [ACK] Seq=1 Ack=45963 Win=175 Len=0 TSval=906225847 TSecr=263118002"
"36","0.507675812","192.168.1.118","209.18.47.62","DNS","71","Standard query 0x964a A i.ytimg.com"
"37","0.511919475","192.168.1.118","209.18.47.62","DNS","71","Standard query 0xdaf0 A i.ytimg.com"
"38","0.512137175","192.168.1.118","209.18.47.62","DNS","71","Standard query 0x02bd A i.ytimg.com"
"39","0.512480500","192.168.1.118","209.18.47.62","DNS","71","Standard query 0x1a60 A i.ytimg.com"
"40","0.512903237","192.168.1.118","209.18.47.62","DNS","71","Standard query 0x4e60 A i.ytimg.com"
"41","0.529681212","209.18.47.62","192.168.1.118","DNS","87","Standard query response 0x02bd A i.ytimg.com A 172.217.6.214"
"42","0.529846550","192.168.1.118","209.18.47.62","DNS","71","Standard query 0xfa4c AAAA i.ytimg.com"
"43","0.531698325","209.18.47.62","192.168.1.118","DNS","87","Standard query response 0xdaf0 A i.ytimg.com A 172.217.12.182"
"44","0.531831237","192.168.1.118","209.18.47.62","DNS","71","Standard query 0x2ebd AAAA i.ytimg.com"
"45","0.534832850","209.18.47.62","192.168.1.118","DNS","87","Standard query response 0x964a A i.ytimg.com A 172.217.12.150"
"46","0.534970337","192.168.1.118","209.18.47.62","DNS","71","Standard query 0xea72 AAAA i.ytimg.com"
"47","0.535602425","209.18.47.62","192.168.1.118","DNS","87","Standard query response 0x1a60 A i.ytimg.com A 172.217.10.118"
"48","0.535644300","209.18.47.62","192.168.1.118","DNS","87","Standard query response 0x4e60 A i.ytimg.com A 172.217.12.150"
"49","0.535766587","192.168.1.118","209.18.47.62","DNS","71","Standard query 0xc692 AAAA i.ytimg.com"
"50","0.535884775","192.168.1.118","209.18.47.62","DNS","71","Standard query 0xfa85 AAAA i.ytimg.com"
"51","0.544539700","209.18.47.62","192.168.1.118","DNS","99","Standard query response 0xfa4c AAAA i.ytimg.com AAAA 2607:f8b0:4006:804::2016"
"52","0.546306162","192.168.1.118","172.217.6.214","TCP","74","45008 → 443 [SYN] Seq=0 Win=64240 Len=0 MSS=1460 SACK_PERM=1 TSval=1696410244 TSecr=0 WS=128"
"53","0.546419512","192.168.1.118","172.217.6.214","TCP","74","45010 → 443 [SYN] Seq=0 Win=64240 Len=0 MSS=1460 SACK_PERM=1 TSval=1696410244 TSecr=0 WS=128"
"54","0.546495212","192.168.1.118","172.217.6.214","TCP","74","45012 → 443 [SYN] Seq=0 Win=64240 Len=0 MSS=1460 SACK_PERM=1 TSval=1696410244 TSecr=0 WS=128"
"55","0.546570950","192.168.1.118","172.217.6.214","TCP","74","45014 → 443 [SYN] Seq=0 Win=64240 Len=0 MSS=1460 SACK_PERM=1 TSval=1696410245 TSecr=0 WS=128"
"56","0.547230850","192.168.1.118","172.217.6.214","TCP","74","45016 → 443 [SYN] Seq=0 Win=64240 Len=0 MSS=1460 SACK_PERM=1 TSval=1696410245 TSecr=0 WS=128"
"57","0.561575287","192.168.1.118","209.18.47.62","DNS","75","Standard query 0xb611 A www.gstatic.com"
"58","0.564668837","209.18.47.62","192.168.1.118","DNS","99","Standard query response 0x2ebd AAAA i.ytimg.com AAAA 2607:f8b0:4006:81a::2016"
"59","0.575703400","192.168.1.118","209.18.47.62","DNS","73","Standard query 0xea14 A yt3.ggpht.com"
"60","0.576957050","172.217.6.214","192.168.1.118","TCP","74","443 → 45008 [SYN, ACK] Seq=0 Ack=1 Win=60192 Len=0 MSS=1380 SACK_PERM=1 TSval=915816772 TSecr=1696410244 WS=256"
"61","0.577115562","192.168.1.118","172.217.6.214","TCP","66","45008 → 443 [ACK] Seq=1 Ack=1 Win=64256 Len=0 TSval=1696410275 TSecr=915816772"
"62","0.578337350","172.217.6.214","192.168.1.118","TCP","74","443 → 45010 [SYN, ACK] Seq=0 Ack=1 Win=60192 Len=0 MSS=1380 SACK_PERM=1 TSval=3548127624 TSecr=1696410244 WS=256"
"63","0.578437700","192.168.1.118","172.217.6.214","TCP","66","45010 → 443 [ACK] Seq=1 Ack=1 Win=64256 Len=0 TSval=1696410276 TSecr=3548127624"
"64","0.579707787","172.217.6.214","192.168.1.118","TCP","74","443 → 45016 [SYN, ACK] Seq=0 Ack=1 Win=60192 Len=0 MSS=1380 SACK_PERM=1 TSval=3548127624 TSecr=1696410245 WS=256"
"65","0.579803712","192.168.1.118","172.217.6.214","TCP","66","45016 → 443 [ACK] Seq=1 Ack=1 Win=64256 Len=0 TSval=1696410278 TSecr=3548127624"
"66","0.579872287","172.217.6.214","192.168.1.118","TCP","74","443 → 45014 [SYN, ACK] Seq=0 Ack=1 Win=60192 Len=0 MSS=1380 SACK_PERM=1 TSval=915816772 TSecr=1696410245 WS=256"
"67","0.579964812","192.168.1.118","172.217.6.214","TCP","66","45014 → 443 [ACK] Seq=1 Ack=1 Win=64256 Len=0 TSval=1696410278 TSecr=915816772"
"68","0.580066450","209.18.47.62","192.168.1.118","DNS","99","Standard query response 0xfa85 AAAA i.ytimg.com AAAA 2607:f8b0:4006:819::2016"
"69","0.580139725","172.217.6.214","192.168.1.118","TCP","74","443 → 45012 [SYN, ACK] Seq=0 Ack=1 Win=60192 Len=0 MSS=1380 SACK_PERM=1 TSval=1407854868 TSecr=1696410244 WS=256"
"70","0.580232212","192.168.1.118","172.217.6.214","TCP","66","45012 → 443 [ACK] Seq=1 Ack=1 Win=64256 Len=0 TSval=1696410278 TSecr=1407854868"
"71","0.580298837","209.18.47.62","192.168.1.118","DNS","99","Standard query response 0xc692 AAAA i.ytimg.com AAAA 2607:f8b0:4006:811::2016"
"72","0.580369425","209.18.47.62","192.168.1.118","DNS","99","Standard query response 0xea72 AAAA i.ytimg.com AAAA 2607:f8b0:4006:819::2016"
"73","0.586080075","209.18.47.62","192.168.1.118","DNS","91","Standard query response 0xb611 A www.gstatic.com A 172.217.12.131"
"74","0.586228875","192.168.1.118","209.18.47.62","DNS","75","Standard query 0xa2fc AAAA www.gstatic.com"
"75","0.594316012","209.18.47.62","192.168.1.118","DNS","134","Standard query response 0xea14 A yt3.ggpht.com CNAME photos-ugc.l.googleusercontent.com A 172.217.10.129"
"76","0.594495925","192.168.1.118","209.18.47.62","DNS","73","Standard query 0x1205 AAAA yt3.ggpht.com"
"77","0.601850450","192.168.1.118","172.217.6.214","TLSv1","583","Client Hello"
"78","0.612091862","209.18.47.62","192.168.1.118","DNS","146","Standard query response 0x1205 AAAA yt3.ggpht.com CNAME photos-ugc.l.googleusercontent.com AAAA 2607:f8b0:4006:812::2001"
"79","0.613218612","209.18.47.62","192.168.1.118","DNS","103","Standard query response 0xa2fc AAAA www.gstatic.com AAAA 2607:f8b0:4006:819::2003"
"80","0.618303525","192.168.1.118","172.217.6.214","TLSv1","583","Client Hello"
"81","0.620254512","172.217.6.214","192.168.1.118","TCP","66","443 → 45016 [ACK] Seq=1 Ack=518 Win=61440 Len=0 TSval=3548127667 TSecr=1696410300"
"82","0.626891387","172.217.6.214","192.168.1.118","TLSv1.2","1484","Server Hello"
"83","0.626988175","192.168.1.118","172.217.6.214","TCP","66","45016 → 443 [ACK] Seq=518 Ack=1419 Win=63104 Len=0 TSval=1696410325 TSecr=3548127674"
"84","0.634700912","192.168.1.118","172.217.6.214","TLSv1","583","Client Hello"
"85","0.637935050","172.217.6.214","192.168.1.118","TLSv1.2","1719","Certificate, Server Key Exchange, Server Hello Done"
"86","0.638059300","192.168.1.118","172.217.6.214","TCP","66","45016 → 443 [ACK] Seq=518 Ack=3072 Win=61568 Len=0 TSval=1696410336 TSecr=3548127674"
"87","0.641444400","172.217.6.214","192.168.1.118","TCP","66","443 → 45008 [ACK] Seq=1 Ack=518 Win=61440 Len=0 TSval=915816832 TSecr=1696410316"
"88","0.649106462","172.217.6.214","192.168.1.118","TLSv1.2","3137","Server Hello, Certificate, Server Key Exchange, Server Hello Done"
"89","0.649188887","192.168.1.118","172.217.6.214","TCP","66","45008 → 443 [ACK] Seq=518 Ack=3072 Win=61312 Len=0 TSval=1696410347 TSecr=915816840"
"90","0.651128650","192.168.1.118","172.217.6.214","TLSv1","583","Client Hello"
"91","0.667559825","192.168.1.118","172.217.6.214","TLSv1","583","Client Hello"
"92","0.667763512","192.168.1.118","172.217.12.131","TCP","74","42846 → 443 [SYN] Seq=0 Win=64240 Len=0 MSS=1460 SACK_PERM=1 TSval=2964733177 TSecr=0 WS=128"
"93","0.667853175","192.168.1.118","172.217.10.129","TCP","74","46168 → 443 [SYN] Seq=0 Win=64240 Len=0 MSS=1460 SACK_PERM=1 TSval=2252818494 TSecr=0 WS=128"
"94","0.667974350","192.168.1.118","172.217.10.129","TCP","74","46170 → 443 [SYN] Seq=0 Win=64240 Len=0 MSS=1460 SACK_PERM=1 TSval=2252818494 TSecr=0 WS=128"
"95","0.670211837","192.168.1.118","172.217.6.214","TLSv1.2","192","Client Key Exchange, Change Cipher Spec, Encrypted Handshake Message"
"96","0.672079300","192.168.1.118","172.217.6.214","TLSv1.2","192","Client Key Exchange, Change Cipher Spec, Encrypted Handshake Message"
"97","0.673446487","172.217.6.214","192.168.1.118","TCP","66","443 → 45010 [ACK] Seq=1 Ack=518 Win=61440 Len=0 TSval=3548127720 TSecr=1696410333"
"98","0.674477262","172.217.6.214","192.168.1.118","TCP","66","443 → 45012 [ACK] Seq=1 Ack=518 Win=61440 Len=0 TSval=1407854963 TSecr=1696410349"
"99","0.679770425","172.217.6.214","192.168.1.118","TLSv1.2","1484","Server Hello"
"100","0.679853812","192.168.1.118","172.217.6.214","TCP","66","45012 → 443 [ACK] Seq=518 Ack=1419 Win=63104 Len=0 TSval=1696410378 TSecr=1407854970"
"101","0.681304187","172.217.6.214","192.168.1.118","TLSv1.2","1719","Certificate, Server Key Exchange, Server Hello Done"
"102","0.681409012","192.168.1.118","172.217.6.214","TCP","66","45012 → 443 [ACK] Seq=518 Ack=3072 Win=61568 Len=0 TSval=1696410379 TSecr=1407854970"
"103","0.682968087","172.217.6.214","192.168.1.118","TLSv1.2","3137","Server Hello, Certificate, Server Key Exchange, Server Hello Done"
"104","0.683042037","192.168.1.118","172.217.6.214","TCP","66","45010 → 443 [ACK] Seq=518 Ack=3072 Win=61312 Len=0 TSval=1696410381 TSecr=3548127727"
"105","0.684560037","192.168.1.118","172.217.6.214","TLSv1.2","192","Client Key Exchange, Change Cipher Spec, Encrypted Handshake Message"
"106","0.686035087","172.217.6.214","192.168.1.118","TCP","66","443 → 45014 [ACK] Seq=1 Ack=518 Win=61440 Len=0 TSval=915816881 TSecr=1696410365"
"107","0.686919112","192.168.1.118","172.217.6.214","TLSv1.2","192","Client Key Exchange, Change Cipher Spec, Encrypted Handshake Message"
"108","0.687178637","172.217.10.129","192.168.1.118","TCP","74","443 → 46168 [SYN, ACK] Seq=0 Ack=1 Win=60192 Len=0 MSS=1380 SACK_PERM=1 TSval=2697825652 TSecr=2252818494 WS=256"
"109","0.687262262","192.168.1.118","172.217.10.129","TCP","66","46168 → 443 [ACK] Seq=1 Ack=1 Win=64256 Len=0 TSval=2252818513 TSecr=2697825652"
"110","0.688603125","172.217.10.129","192.168.1.118","TCP","74","443 → 46170 [SYN, ACK] Seq=0 Ack=1 Win=60192 Len=0 MSS=1380 SACK_PERM=1 TSval=800881082 TSecr=2252818494 WS=256"
"111","0.688658012","192.168.1.118","172.217.10.129","TCP","66","46170 → 443 [ACK] Seq=1 Ack=1 Win=64256 Len=0 TSval=2252818515 TSecr=800881082"
"112","0.688696525","172.217.12.131","192.168.1.118","TCP","74","443 → 42846 [SYN, ACK] Seq=0 Ack=1 Win=60192 Len=0 MSS=1380 SACK_PERM=1 TSval=401216774 TSecr=2964733177 WS=256"
"113","0.688748412","192.168.1.118","172.217.12.131","TCP","66","42846 → 443 [ACK] Seq=1 Ack=1 Win=64256 Len=0 TSval=2964733198 TSecr=401216774"
"114","0.696780500","172.217.6.214","192.168.1.118","TLSv1.2","3137","Server Hello, Certificate, Server Key Exchange, Server Hello Done"
"115","0.696822437","192.168.1.118","172.217.6.214","TCP","66","45014 → 443 [ACK] Seq=518 Ack=3072 Win=61312 Len=0 TSval=1696410395 TSecr=915816888"
"116","0.697600362","172.217.6.214","192.168.1.118","TLSv1.2","117","Change Cipher Spec, Encrypted Handshake Message"
"117","0.698672575","172.217.6.214","192.168.1.118","TLSv1.2","117","Change Cipher Spec, Encrypted Handshake Message"
"118","0.702124700","172.217.6.214","192.168.1.118","TLSv1.2","117","Change Cipher Spec, Encrypted Handshake Message"
"119","0.707607612","172.217.6.214","192.168.1.118","TLSv1.2","117","Change Cipher Spec, Encrypted Handshake Message"
"120","0.712292250","192.168.1.118","172.217.12.131","TLSv1","583","Client Hello"
"121","0.729135950","192.168.1.118","172.217.10.129","TLSv1","583","Client Hello"
"122","0.738078762","192.168.1.118","172.217.6.214","TCP","66","45008 → 443 [ACK] Seq=644 Ack=3123 Win=64128 Len=0 TSval=1696410436 TSecr=915816893"
"123","0.739069262","192.168.1.118","172.217.6.214","TCP","66","45016 → 443 [ACK] Seq=644 Ack=3123 Win=64128 Len=0 TSval=1696410437 TSecr=3548127745"
"124","0.741469825","172.217.12.131","192.168.1.118","TCP","66","443 → 42846 [ACK] Seq=1 Ack=518 Win=61440 Len=0 TSval=401216826 TSecr=2964733221"
"125","0.743064212","192.168.1.118","172.217.6.214","TCP","66","45012 → 443 [ACK] Seq=644 Ack=3123 Win=64128 Len=0 TSval=1696410441 TSecr=1407854994"
"126","0.745830950","192.168.1.118","172.217.10.129","TLSv1","583","Client Hello"
"127","0.746087512","192.168.1.118","172.217.10.129","TCP","74","46172 → 443 [SYN] Seq=0 Win=64240 Len=0 MSS=1460 SACK_PERM=1 TSval=2252818572 TSecr=0 WS=128"
"128","0.746528887","192.168.1.118","172.217.6.214","TLSv1.2","363","Application Data"
"129","0.746747300","192.168.1.118","172.217.6.214","TLSv1.2","363","Application Data"
"130","0.747411325","192.168.1.118","172.217.6.214","TLSv1.2","363","Application Data"
"131","0.747676837","192.168.1.118","172.217.6.214","TLSv1.2","363","Application Data"
"132","0.747808725","172.217.12.131","192.168.1.118","TLSv1.2","1484","Server Hello"
"133","0.747890087","192.168.1.118","172.217.12.131","TCP","66","42846 → 443 [ACK] Seq=518 Ack=1419 Win=63104 Len=0 TSval=2964733257 TSecr=401216832"
"134","0.748882175","172.217.12.131","192.168.1.118","TLSv1.2","1308","Certificate, Server Key Exchange, Server Hello Done"
"135","0.748959112","192.168.1.118","172.217.12.131","TCP","66","42846 → 443 [ACK] Seq=518 Ack=2661 Win=61952 Len=0 TSval=2964733258 TSecr=401216832"
"136","0.749075312","172.217.10.129","192.168.1.118","TCP","66","443 → 46168 [ACK] Seq=1 Ack=518 Win=61440 Len=0 TSval=2697825713 TSecr=2252818555"
"137","0.749558312","192.168.1.118","172.217.6.214","TLSv1.2","192","Client Key Exchange, Change Cipher Spec, Encrypted Handshake Message"
"138","0.751669475","192.168.1.118","172.217.12.131","TLSv1.2","192","Client Key Exchange, Change Cipher Spec, Encrypted Handshake Message"
"139","0.756586575","172.217.10.129","192.168.1.118","TLSv1.2","1484","Server Hello"
"140","0.756668500","192.168.1.118","172.217.10.129","TCP","66","46168 → 443 [ACK] Seq=518 Ack=1419 Win=63104 Len=0 TSval=2252818583 TSecr=2697825720"
"141","0.756716225","192.168.1.118","172.217.12.174","TCP","66","[TCP Window Update] 33048 → 443 [ACK] Seq=1 Ack=45963 Win=501 Len=0 TSval=906226098 TSecr=263118002"
"142","0.758259287","172.217.10.129","192.168.1.118","TLSv1.2","3882","Certificate, Server Key Exchange, Server Hello Done"
"143","0.758346250","192.168.1.118","172.217.10.129","TCP","66","46168 → 443 [ACK] Seq=518 Ack=5235 Win=59392 Len=0 TSval=2252818584 TSecr=2697825720"
"144","0.762047700","192.168.1.118","172.217.10.129","TLSv1.2","192","Client Key Exchange, Change Cipher Spec, Encrypted Handshake Message"
"145","0.769184212","172.217.10.129","192.168.1.118","TCP","66","443 → 46170 [ACK] Seq=1 Ack=518 Win=61440 Len=0 TSval=800881164 TSecr=2252818572"
"146","0.771955862","172.217.6.214","192.168.1.118","TLSv1.2","1484","Application Data"
"147","0.772100587","192.168.1.118","172.217.6.214","TCP","66","45008 → 443 [ACK] Seq=941 Ack=4541 Win=63104 Len=0 TSval=1696410470 TSecr=915816964"
"148","0.772201162","172.217.6.214","192.168.1.118","TLSv1.2","1484","Application Data"
"149","0.772280175","192.168.1.118","172.217.6.214","TCP","66","45008 → 443 [ACK] Seq=941 Ack=5959 Win=61696 Len=0 TSval=1696410470 TSecr=915816964"
"150","0.773898262","172.217.6.214","192.168.1.118","TLSv1.2","1484","Application Data"
"151","0.773976850","192.168.1.118","172.217.6.214","TCP","66","45008 → 443 [ACK] Seq=941 Ack=7377 Win=63104 Len=0 TSval=1696410472 TSecr=915816964"
"152","0.774165412","172.217.6.214","192.168.1.118","TLSv1.2","4740","Application Data, Application Data, Application Data, Application Data"
"153","0.774255912","192.168.1.118","172.217.6.214","TCP","66","45008 → 443 [ACK] Seq=941 Ack=12051 Win=58496 Len=0 TSval=1696410472 TSecr=915816964"
"154","0.774392625","172.217.6.214","192.168.1.118","TLSv1.2","1484","Application Data"
"155","0.774485837","192.168.1.118","172.217.6.214","TCP","66","45016 → 443 [ACK] Seq=941 Ack=4541 Win=63104 Len=0 TSval=1696410472 TSecr=3548127817"
"156","0.774565525","172.217.6.214","192.168.1.118","TLSv1.2","1484","Application Data"
"157","0.774641950","192.168.1.118","172.217.6.214","TCP","66","45016 → 443 [ACK] Seq=941 Ack=5959 Win=61696 Len=0 TSval=1696410473 TSecr=3548127817"
"158","0.774748900","172.217.6.214","192.168.1.118","TLSv1.2","2902","Application Data, Application Data"
"159","0.774835500","192.168.1.118","172.217.6.214","TCP","66","45016 → 443 [ACK] Seq=941 Ack=8795 Win=58880 Len=0 TSval=1696410473 TSecr=3548127817"
"160","0.774919087","172.217.6.214","192.168.1.118","TLSv1.2","1484","Application Data"
"161","0.774993387","192.168.1.118","172.217.6.214","TCP","66","45016 → 443 [ACK] Seq=941 Ack=10213 Win=57472 Len=0 TSval=1696410473 TSecr=3548127817"
"162","0.775125675","172.217.6.214","192.168.1.118","TLSv1.2","2651","Application Data, Application Data"
"163","0.775209200","192.168.1.118","172.217.6.214","TCP","66","45016 → 443 [ACK] Seq=941 Ack=12798 Win=54912 Len=0 TSval=1696410473 TSecr=3548127817"
"164","0.775284587","172.217.6.214","192.168.1.118","TLSv1.2","117","Change Cipher Spec, Encrypted Handshake Message"
"165","0.775368850","192.168.1.118","172.217.6.214","TCP","66","45014 → 443 [ACK] Seq=644 Ack=3123 Win=64128 Len=0 TSval=1696410473 TSecr=915816965"
"166","0.775448325","172.217.6.214","192.168.1.118","TLSv1.2","1484","Application Data"
"167","0.775569887","172.217.6.214","192.168.1.118","TLSv1.2","2902","Application Data, Application Data"
"168","0.775756775","192.168.1.118","172.217.6.214","TCP","66","45010 → 443 [ACK] Seq=941 Ack=7377 Win=59904 Len=0 TSval=1696410474 TSecr=3548127818"
"169","0.776227125","192.168.1.118","172.217.6.214","TLSv1.2","442","Application Data"
"170","0.778729912","172.217.6.214","192.168.1.118","TLSv1.2","3527","Application Data, Application Data, Application Data"
"171","0.778768025","172.217.6.214","192.168.1.118","TLSv1.2","1484","Application Data"
"172","0.778803762","192.168.1.118","172.217.6.214","TCP","66","45012 → 443 [ACK] Seq=941 Ack=4541 Win=63104 Len=0 TSval=1696410477 TSecr=1407855062"
"173","0.778834437","172.217.10.129","192.168.1.118","TCP","74","443 → 46172 [SYN, ACK] Seq=0 Ack=1 Win=60192 Len=0 MSS=1380 SACK_PERM=1 TSval=3641851751 TSecr=2252818572 WS=256"
"174","0.778892637","192.168.1.118","172.217.10.129","TCP","66","46172 → 443 [ACK] Seq=1 Ack=1 Win=64256 Len=0 TSval=2252818605 TSecr=3641851751"
"175","0.778924562","172.217.6.214","192.168.1.118","TLSv1.2","1484","Application Data"
"176","0.778952162","192.168.1.118","172.217.6.214","TCP","66","45012 → 443 [ACK] Seq=941 Ack=5959 Win=61696 Len=0 TSval=1696410477 TSecr=1407855062"
"177","0.779031800","172.217.6.214","192.168.1.118","TLSv1.2","1484","Application Data"
"178","0.779062875","192.168.1.118","172.217.6.214","TCP","66","45012 → 443 [ACK] Seq=941 Ack=7377 Win=60288 Len=0 TSval=1696410477 TSecr=1407855062"
"179","0.779124937","172.217.6.214","192.168.1.118","TLSv1.2","5738","Application Data, Application Data, Application Data, Application Data"
"180","0.779124500","192.168.1.118","172.217.6.214","TCP","66","45010 → 443 [ACK] Seq=941 Ack=10838 Win=56448 Len=0 TSval=1696410477 TSecr=3548127818"
"181","0.779163550","192.168.1.118","172.217.6.214","TCP","66","45012 → 443 [ACK] Seq=941 Ack=13049 Win=54656 Len=0 TSval=1696410477 TSecr=1407855062"
"182","0.779195400","172.217.6.214","192.168.1.118","TLSv1.2","1838","Application Data, Application Data"
"183","0.779225150","192.168.1.118","172.217.6.214","TCP","66","45012 → 443 [ACK] Seq=941 Ack=14821 Win=52992 Len=0 TSval=1696410477 TSecr=1407855064"
"184","0.780599550","172.217.12.131","192.168.1.118","TLSv1.2","117","Change Cipher Spec, Encrypted Handshake Message"
"185","0.780632950","172.217.10.129","192.168.1.118","TLSv1.2","117","Change Cipher Spec, Encrypted Handshake Message"
"186","0.780696812","172.217.10.129","192.168.1.118","TLSv1.2","5299","Server Hello, Certificate, Server Key Exchange, Server Hello Done"
"187","0.780728037","192.168.1.118","172.217.10.129","TCP","66","46170 → 443 [ACK] Seq=518 Ack=5234 Win=59136 Len=0 TSval=2252818607 TSecr=800881171"
"188","0.798274450","192.168.1.118","172.217.10.129","TLSv1","583","Client Hello"
"189","0.798781637","192.168.1.118","172.217.12.131","TLSv1.2","390","Application Data"
"190","0.799140187","192.168.1.118","172.217.10.129","TLSv1.2","338","Application Data"
"191","0.801394762","192.168.1.118","172.217.10.129","TLSv1.2","192","Client Key Exchange, Change Cipher Spec, Encrypted Handshake Message"
"192","0.803504300","172.217.6.214","192.168.1.118","TLSv1.2","1484","Application Data"
"193","0.805060662","172.217.6.214","192.168.1.118","TLSv1.2","2902","Application Data, Application Data"
"194","0.805097325","172.217.6.214","192.168.1.118","TLSv1.2","4799","Application Data, Application Data, Application Data, Application Data"
"195","0.807269487","192.168.1.118","172.217.6.214","TCP","66","45014 → 443 [ACK] Seq=1020 Ack=12110 Win=55168 Len=0 TSval=1696410505 TSecr=915816998"
"196","0.812602200","192.168.1.118","172.217.6.214","TLSv1.2","363","Application Data"
"197","0.812809525","192.168.1.118","172.217.6.214","TLSv1.2","363","Application Data"
"198","0.814996525","172.217.10.129","192.168.1.118","TCP","66","443 → 46172 [ACK] Seq=1 Ack=518 Win=61440 Len=0 TSval=3641851795 TSecr=2252818624"
"199","0.816220987","172.217.12.131","192.168.1.118","TLSv1.2","469","Application Data"
"200","0.818347712","172.217.10.129","192.168.1.118","TLSv1.2","1484","Application Data"
"201","0.818386500","172.217.10.129","192.168.1.118","TLSv1.2","1484","Application Data"
"202","0.818443187","172.217.10.129","192.168.1.118","TLSv1.2","1484","Application Data"
"203","0.818464087","172.217.10.129","192.168.1.118","TLSv1.2","1567","Application Data, Application Data"
"204","0.818472050","192.168.1.118","172.217.6.214","TLSv1.2","363","Application Data"
"205","0.818634000","192.168.1.118","172.217.10.129","TCP","66","46168 → 443 [ACK] Seq=916 Ack=11041 Win=58496 Len=0 TSval=2252818645 TSecr=2697825781"
"206","0.822169025","172.217.10.129","192.168.1.118","TLSv1.2","1484","Server Hello"
"207","0.822201887","192.168.1.118","172.217.10.129","TCP","66","46172 → 443 [ACK] Seq=518 Ack=1419 Win=63104 Len=0 TSval=2252818648 TSecr=3641851802"
"208","0.823683550","172.217.10.129","192.168.1.118","TLSv1.2","3881","Certificate, Server Key Exchange, Server Hello Done"
"209","0.823702987","192.168.1.118","172.217.10.129","TCP","66","46172 → 443 [ACK] Seq=518 Ack=5234 Win=59392 Len=0 TSval=2252818650 TSecr=3641851802"
"210","0.823719312","172.217.10.129","192.168.1.118","TLSv1.2","117","Change Cipher Spec, Encrypted Handshake Message"
"211","0.824817637","192.168.1.118","172.217.10.129","TLSv1.2","336","Application Data"
"212","0.827137900","192.168.1.118","172.217.10.129","TLSv1.2","192","Client Key Exchange, Change Cipher Spec, Encrypted Handshake Message"
"213","0.827351512","192.168.1.118","172.217.6.214","TLSv1.2","442","Application Data"
"214","0.827447262","192.168.1.118","172.217.6.214","TLSv1.2","363","Application Data"
"215","0.836931525","172.217.6.214","192.168.1.118","TLSv1.2","1484","Application Data"
"216","0.839035862","172.217.6.214","192.168.1.118","TLSv1.2","2902","Application Data, Application Data"
"217","0.839116437","172.217.6.214","192.168.1.118","TLSv1.2","1484","Application Data"
"218","0.839149825","172.217.6.214","192.168.1.118","TLSv1.2","1484","Application Data"
"219","0.839199250","172.217.6.214","192.168.1.118","TLSv1.2","2902","Application Data, Application Data"
"220","0.839228500","172.217.6.214","192.168.1.118","TLSv1.2","2902","Application Data, Application Data"
"221","0.839255537","172.217.6.214","192.168.1.118","TLSv1.2","2866","Application Data, Application Data"
"222","0.839296075","172.217.6.214","192.168.1.118","TLSv1.2","2902","Application Data, Application Data"
"223","0.839863750","172.217.6.214","192.168.1.118","TLSv1.2","909","Application Data"
"224","0.840793550","192.168.1.118","172.217.6.214","TCP","66","45016 → 443 [ACK] Seq=1238 Ack=22149 Win=54784 Len=0 TSval=1696410539 TSecr=3548127881"
"225","0.841004937","192.168.1.118","172.217.6.214","TCP","66","45008 → 443 [ACK] Seq=1238 Ack=21941 Win=54272 Len=0 TSval=1696410539 TSecr=915817027"
"226","0.847967387","192.168.1.118","172.217.6.214","TLSv1.2","442","Application Data"
"227","0.848087650","172.217.6.214","192.168.1.118","TLSv1.2","1484","Application Data"
"228","0.850543087","172.217.6.214","192.168.1.118","TLSv1.2","1484","Application Data"
"229","0.850582675","172.217.10.129","192.168.1.118","TLSv1.2","1484","Application Data"
"230","0.850633675","172.217.10.129","192.168.1.118","TLSv1.2","1484","Application Data"
"231","0.850716187","192.168.1.118","172.217.6.214","TLSv1.2","442","Application Data"
"232","0.850807750","192.168.1.118","172.217.10.129","TCP","66","46170 → 443 [ACK] Seq=914 Ack=8121 Win=61312 Len=0 TSval=2252818677 TSecr=800881243"
"233","0.850941675","192.168.1.118","172.217.6.214","TCP","66","45010 → 443 [ACK] Seq=1238 Ack=13674 Win=63104 Len=0 TSval=1696410549 TSecr=3548127895"
"234","0.852839487","172.217.10.129","192.168.1.118","TLSv1.2","1484","Application Data"
"235","0.852915712","172.217.6.214","192.168.1.118","TLSv1.2","2902","Application Data, Application Data"
"236","0.852968875","172.217.10.129","192.168.1.118","TLSv1.2","216","Application Data"
"237","0.853073237","172.217.6.214","192.168.1.118","TLSv1.2","1484","Application Data"
"238","0.853101050","192.168.1.118","172.217.10.129","TCP","66","46170 → 443 [ACK] Seq=914 Ack=9689 Win=59776 Len=0 TSval=2252818679 TSecr=800881243"
"239","0.853141887","192.168.1.118","172.217.6.214","TCP","66","45012 → 443 [ACK] Seq=1317 Ack=16239 Win=63104 Len=0 TSval=1696410551 TSecr=1407855141"
"240","0.853201212","172.217.10.129","192.168.1.118","TLSv1.2","117","Change Cipher Spec, Encrypted Handshake Message"
"241","0.853209212","192.168.1.118","172.217.6.214","TCP","66","45010 → 443 [ACK] Seq=1238 Ack=16510 Win=61056 Len=0 TSval=1696410551 TSecr=3548127896"
"242","0.853269762","172.217.6.214","192.168.1.118","TLSv1.2","2902","Application Data, Application Data"
"243","0.853838200","192.168.1.118","172.217.10.129","TLSv1.2","338","Application Data"
"244","0.853899850","192.168.1.118","172.217.6.214","TCP","66","45010 → 443 [ACK] Seq=1238 Ack=19346 Win=58240 Len=0 TSval=1696410552 TSecr=3548127897"
"245","0.855683250","172.217.6.214","192.168.1.118","TLSv1.2","2902","Application Data, Application Data"
"246","0.855734650","192.168.1.118","172.217.6.214","TCP","66","45012 → 443 [ACK] Seq=1317 Ack=19075 Win=61056 Len=0 TSval=1696410554 TSecr=1407855142"
"247","0.855780537","172.217.6.214","192.168.1.118","TLSv1.2","441","Application Data"
"248","0.856870875","172.217.6.214","192.168.1.118","TLSv1.2","2902","Application Data, Application Data"
"249","0.856921850","192.168.1.118","172.217.6.214","TCP","66","45012 → 443 [ACK] Seq=1317 Ack=21911 Win=61056 Len=0 TSval=1696410555 TSecr=1407855144"
"250","0.856979025","172.217.6.214","192.168.1.118","TLSv1.2","1971","Application Data, Application Data"
"251","0.857048000","192.168.1.118","172.217.6.214","TCP","66","45012 → 443 [ACK] Seq=1317 Ack=23816 Win=59264 Len=0 TSval=1696410555 TSecr=1407855146"
"252","0.858057650","192.168.1.118","172.217.12.131","TCP","66","42846 → 443 [ACK] Seq=968 Ack=3115 Win=64128 Len=0 TSval=2964733367 TSecr=401216902"
"253","0.859474262","172.217.6.214","192.168.1.118","TLSv1.2","1484","Application Data"
"254","0.859797012","192.168.1.118","172.217.6.214","TLSv1.2","363","Application Data"
"255","0.860510150","172.217.6.214","192.168.1.118","TLSv1.2","2902","Application Data, Application Data"
"256","0.862124475","192.168.1.118","172.217.6.214","TCP","66","45014 → 443 [ACK] Seq=1317 Ack=16364 Win=61056 Len=0 TSval=1696410560 TSecr=915817053"
"257","0.862125562","172.217.6.214","192.168.1.118","TLSv1.2","2902","Application Data, Application Data"
"258","0.862196900","192.168.1.118","172.217.6.214","TCP","66","45014 → 443 [ACK] Seq=1317 Ack=19200 Win=58240 Len=0 TSval=1696410560 TSecr=915817055"
"259","0.862387612","192.168.1.118","172.217.6.214","TLSv1.2","363","Application Data"
"260","0.866276162","172.217.6.214","192.168.1.118","TLSv1.2","2221","Application Data, Application Data"
"261","0.866346450","192.168.1.118","172.217.6.214","TCP","66","45014 → 443 [ACK] Seq=1317 Ack=21355 Win=61056 Len=0 TSval=1696410564 TSecr=915817057"
"262","0.867684637","172.217.6.214","192.168.1.118","TLSv1.2","1484","Application Data"
"263","0.868963400","192.168.1.118","172.217.6.214","TLSv1.2","363","Application Data"
"264","0.872192275","172.217.6.214","192.168.1.118","TLSv1.2","1484","Application Data"
"265","0.874105462","172.217.6.214","192.168.1.118","TLSv1.2","1484","Application Data"
"266","0.874176000","172.217.6.214","192.168.1.118","TLSv1.2","1484","Application Data"
"267","0.874276537","172.217.6.214","192.168.1.118","TLSv1.2","2902","Application Data, Application Data"
"268","0.874451750","172.217.6.214","192.168.1.118","TLSv1.2","2902","Application Data, Application Data"
"269","0.874480937","192.168.1.118","172.217.6.214","TCP","66","45016 → 443 [ACK] Seq=1614 Ack=26403 Win=59904 Len=0 TSval=1696410572 TSecr=3548127915"
"270","0.874523600","172.217.6.214","192.168.1.118","TLSv1.2","2305","Application Data, Application Data"
"271","0.874639950","172.217.6.214","192.168.1.118","TLSv1.2","2902","Application Data, Application Data"
"272","0.874688000","172.217.6.214","192.168.1.118","TLSv1.2","1484","Application Data"
"273","0.874736012","192.168.1.118","172.217.6.214","TCP","66","45008 → 443 [ACK] Seq=1614 Ack=31270 Win=54912 Len=0 TSval=1696410573 TSecr=915817062"
"274","0.874830925","192.168.1.118","172.217.6.214","TCP","66","45016 → 443 [ACK] Seq=1614 Ack=30657 Win=55680 Len=0 TSval=1696410573 TSecr=3548127918"
"275","0.877343187","172.217.6.214","192.168.1.118","TLSv1.2","1484","Application Data"
"276","0.878666987","172.217.6.214","192.168.1.118","TLSv1.2","2902","Application Data, Application Data"
"277","0.878764200","172.217.6.214","192.168.1.118","TLSv1.2","2902","Application Data, Application Data"
"278","0.879404850","172.217.6.214","192.168.1.118","TLSv1.2","681","Application Data"
"279","0.880109437","192.168.1.118","172.217.6.214","TCP","66","45016 → 443 [ACK] Seq=1614 Ack=38362 Win=48000 Len=0 TSval=1696410578 TSecr=3548127920"
"280","0.882984212","192.168.1.118","172.217.6.214","TLSv1.2","363","Application Data"
"281","0.884380875","172.217.6.214","192.168.1.118","TLSv1.2","1484","Application Data"
"282","0.885972262","172.217.6.214","192.168.1.118","TLSv1.2","2902","Application Data, Application Data"
"283","0.886083500","172.217.10.129","192.168.1.118","TLSv1.2","1484","Application Data"
"284","0.886218550","172.217.10.129","192.168.1.118","TLSv1.2","2902","Application Data, Application Data"
"285","0.886300887","172.217.10.129","192.168.1.118","TLSv1.2","1318","Application Data"
"286","0.887841200","172.217.6.214","192.168.1.118","TLSv1.2","1484","Application Data"
"287","0.887965687","172.217.6.214","192.168.1.118","TLSv1.2","1484","Application Data"
"288","0.888434000","192.168.1.118","172.217.10.129","TCP","66","46172 → 443 [ACK] Seq=916 Ack=10791 Win=58624 Len=0 TSval=2252818714 TSecr=3641851864"
"289","0.888669712","192.168.1.118","172.217.6.214","TCP","66","45010 → 443 [ACK] Seq=1535 Ack=25393 Win=59008 Len=0 TSval=1696410587 TSecr=3548127930"
"290","0.890972300","172.217.6.214","192.168.1.118","TLSv1.2","1484","Application Data"
"291","0.891048012","172.217.6.214","192.168.1.118","TLSv1.2","1484","Application Data"
"292","0.891186125","172.217.6.214","192.168.1.118","TLSv1.2","1484","Application Data"
"293","0.891269825","172.217.6.214","192.168.1.118","TLSv1.2","1484","Application Data"
"294","0.891358012","172.217.6.214","192.168.1.118","TLSv1.2","2902","Application Data, Application Data"
"295","0.891432237","172.217.6.214","192.168.1.118","TLSv1.2","2451","Application Data, Application Data"
"296","0.891534700","192.168.1.118","172.217.6.214","TCP","66","45010 → 443 [ACK] Seq=1535 Ack=29196 Win=55296 Len=0 TSval=1696410589 TSecr=3548127932"
"297","0.891644175","192.168.1.118","172.217.6.214","TCP","66","45012 → 443 [ACK] Seq=1614 Ack=28070 Win=59904 Len=0 TSval=1696410590 TSecr=1407855176"
"298","0.891783812","192.168.1.118","172.217.6.214","TCP","66","45014 → 443 [ACK] Seq=1614 Ack=25609 Win=61056 Len=0 TSval=1696410590 TSecr=915817079"
"299","0.891944750","192.168.1.118","172.217.6.214","TLSv1.2","363","Application Data"
"300","0.897550137","192.168.1.118","172.217.6.214","TLSv1.2","363","Application Data"
"301","0.901675537","172.217.6.214","192.168.1.118","TLSv1.2","2902","Application Data, Application Data"
"302","0.901747375","192.168.1.118","172.217.6.214","TCP","66","45014 → 443 [ACK] Seq=1614 Ack=28445 Win=61056 Len=0 TSval=1696410600 TSecr=915817082"
"303","0.901817550","172.217.6.214","192.168.1.118","TLSv1.2","2902","Application Data, Application Data"
"304","0.901874862","192.168.1.118","172.217.6.214","TCP","66","45012 → 443 [ACK] Seq=1614 Ack=30906 Win=61056 Len=0 TSval=1696410600 TSecr=1407855179"
"305","0.901934600","172.217.6.214","192.168.1.118","TLSv1.2","2902","Application Data, Application Data"
"306","0.901994287","172.217.6.214","192.168.1.118","TLSv1.2","2902","Application Data, Application Data"
"307","0.902050400","172.217.6.214","192.168.1.118","TLSv1.2","1416","Application Data"
"308","0.902089462","172.217.6.214","192.168.1.118","TLSv1.2","2902","Application Data, Application Data"
"309","0.902159925","192.168.1.118","172.217.6.214","TCP","66","45012 → 443 [ACK] Seq=1614 Ack=35092 Win=56960 Len=0 TSval=1696410600 TSecr=1407855181"
"310","0.902262975","192.168.1.118","172.217.6.214","TCP","66","45014 → 443 [ACK] Seq=1614 Ack=34117 Win=55424 Len=0 TSval=1696410600 TSecr=915817084"
"311","0.902573525","172.217.6.214","192.168.1.118","TLSv1.2","2437","Application Data, Application Data"
"312","0.903973900","172.217.6.214","192.168.1.118","TLSv1.2","1484","Application Data"
"313","0.904865050","172.217.6.214","192.168.1.118","TLSv1.2","2902","Application Data, Application Data"
"314","0.905411412","192.168.1.118","172.217.6.214","TCP","66","45014 → 443 [ACK] Seq=1614 Ack=36488 Win=53120 Len=0 TSval=1696410603 TSecr=915817087"
"315","0.905504937","192.168.1.118","172.217.6.214","TCP","66","45008 → 443 [ACK] Seq=1911 Ack=35524 Win=59904 Len=0 TSval=1696410603 TSecr=915817098"
"316","0.906741125","172.217.6.214","192.168.1.118","TLSv1.2","1484","Application Data"
"317","0.908945250","172.217.6.214","192.168.1.118","TLSv1.2","1484","Application Data"
"318","0.909036225","192.168.1.118","172.217.6.214","TCP","66","45008 → 443 [ACK] Seq=1911 Ack=38360 Win=63104 Len=0 TSval=1696410607 TSecr=915817100"
"319","0.909122262","172.217.6.214","192.168.1.118","TLSv1.2","2902","Application Data, Application Data"
"320","0.911049350","192.168.1.118","172.217.6.214","TCP","66","45008 → 443 [ACK] Seq=1911 Ack=41196 Win=60288 Len=0 TSval=1696410609 TSecr=915817101"
"321","0.911258612","192.168.1.118","172.217.6.214","TLSv1.2","363","Application Data"
"322","0.914116012","192.168.1.118","172.217.6.214","TLSv1.2","363","Application Data"
"323","0.916062212","172.217.6.214","192.168.1.118","TLSv1.2","1484","Application Data"
"324","0.917733212","172.217.6.214","192.168.1.118","TLSv1.2","1484","Application Data"
"325","0.917812600","192.168.1.118","172.217.6.214","TCP","66","45008 → 443 [ACK] Seq=1911 Ack=44032 Win=63104 Len=0 TSval=1696410616 TSecr=915817102"
"326","0.917860750","172.217.6.214","192.168.1.118","TLSv1.2","741","Application Data"
"327","0.917943237","172.217.6.214","192.168.1.118","TLSv1.2","1484","Application Data"
"328","0.918096725","172.217.6.214","192.168.1.118","TLSv1.2","2902","Application Data, Application Data"
"329","0.918871387","192.168.1.118","172.217.6.214","TCP","66","45016 → 443 [ACK] Seq=1911 Ack=42616 Win=62592 Len=0 TSval=1696410617 TSecr=3548127963"
"330","0.921676937","192.168.1.118","172.217.6.214","TLSv1.2","363","Application Data"
"331","0.922241337","172.217.6.214","192.168.1.118","TLSv1.2","2902","Application Data, Application Data"
"332","0.922323737","192.168.1.118","172.217.6.214","TCP","66","45016 → 443 [ACK] Seq=1911 Ack=45452 Win=64640 Len=0 TSval=1696410620 TSecr=3548127965"
"333","0.924405000","172.217.6.214","192.168.1.118","TLSv1.2","2243","Application Data, Application Data"
"334","0.924511000","192.168.1.118","172.217.6.214","TCP","66","45016 → 443 [ACK] Seq=1911 Ack=47629 Win=62464 Len=0 TSval=1696410622 TSecr=3548127966"
"335","0.926073575","172.217.6.214","192.168.1.118","TLSv1.2","1484","Application Data"
"336","0.926198500","172.217.6.214","192.168.1.118","TLSv1.2","2902","Application Data, Application Data"
"337","0.926731437","192.168.1.118","172.217.6.214","TCP","66","45010 → 443 [ACK] Seq=1832 Ack=33450 Win=59904 Len=0 TSval=1696410625 TSecr=3548127972"
"338","0.926999400","172.217.6.214","192.168.1.118","TLSv1.2","2902","Application Data, Application Data"
"339","0.928345200","172.217.6.214","192.168.1.118","TLSv1.2","2902","Application Data, Application Data"
"340","0.929548425","172.217.6.214","192.168.1.118","TLSv1.2","2902","Application Data, Application Data"
"341","0.929879100","192.168.1.118","172.217.6.214","TCP","66","45010 → 443 [ACK] Seq=1832 Ack=41958 Win=51456 Len=0 TSval=1696410628 TSecr=3548127973"
"342","0.930139287","192.168.1.118","172.217.6.214","TLSv1.2","363","Application Data"
"343","0.931296475","172.217.6.214","192.168.1.118","TLSv1.2","2702","Application Data, Application Data"
"344","0.932215175","192.168.1.118","172.217.6.214","TCP","66","45010 → 443 [ACK] Seq=1832 Ack=44594 Win=48896 Len=0 TSval=1696410630 TSecr=3548127977"
"345","0.937497800","172.217.6.214","192.168.1.118","TLSv1.2","1484","Application Data"
"346","0.938454487","172.217.6.214","192.168.1.118","TLSv1.2","2902","Application Data, Application Data"
"347","0.940433600","172.217.6.214","192.168.1.118","TLSv1.2","1484","Application Data"
"348","0.941168762","172.217.6.214","192.168.1.118","TLSv1.2","1484","Application Data"
"349","0.943360150","192.168.1.118","172.217.6.214","TCP","66","45012 → 443 [ACK] Seq=1911 Ack=42182 Win=57088 Len=0 TSval=1696410641 TSecr=1407855228"
"350","0.946114087","192.168.1.118","172.217.6.214","TLSv1.2","363","Application Data"
"351","0.948813400","172.217.6.214","192.168.1.118","TLSv1.2","1484","Application Data"
"352","0.951292000","172.217.6.214","192.168.1.118","TLSv1.2","1484","Application Data"
"353","0.951335900","192.168.1.118","172.217.6.214","TCP","66","45012 → 443 [ACK] Seq=1911 Ack=45018 Win=63104 Len=0 TSval=1696410649 TSecr=1407855233"
"354","0.951392212","172.217.6.214","192.168.1.118","TLSv1.2","2348","Application Data, Application Data"
"355","0.952832225","172.217.6.214","192.168.1.118","TLSv1.2","1484","Application Data"
"356","0.952874262","172.217.6.214","192.168.1.118","TLSv1.2","1484","Application Data"
"357","0.952917300","172.217.6.214","192.168.1.118","TLSv1.2","2902","Application Data, Application Data"
"358","0.952954762","172.217.6.214","192.168.1.118","TLSv1.2","2902","Application Data, Application Data"
"359","0.952989287","172.217.6.214","192.168.1.118","TLSv1.2","1484","Application Data"
"360","0.953132750","192.168.1.118","172.217.6.214","TCP","66","45012 → 443 [ACK] Seq=1911 Ack=47300 Win=60928 Len=0 TSval=1696410651 TSecr=1407855235"
"361","0.953233037","192.168.1.118","172.217.6.214","TCP","66","45014 → 443 [ACK] Seq=1911 Ack=40742 Win=59904 Len=0 TSval=1696410651 TSecr=915817145"
"362","0.953394812","192.168.1.118","172.217.6.214","TCP","66","45008 → 443 [ACK] Seq=2208 Ack=50379 Win=58496 Len=0 TSval=1696410651 TSecr=915817145"
"363","0.954236637","172.217.6.214","192.168.1.118","TLSv1.2","1484","Application Data"
"364","0.954271700","172.217.6.214","192.168.1.118","TLSv1.2","2902","Application Data, Application Data"
"365","0.954289862","172.217.6.214","192.168.1.118","TLSv1.2","1484","Application Data"
"366","0.957000837","172.217.6.214","192.168.1.118","TLSv1.2","1484","Application Data"
"367","0.957099662","172.217.6.214","192.168.1.118","TLSv1.2","2902","Application Data, Application Data"
"368","0.958081350","172.217.6.214","192.168.1.118","TLSv1.2","1754","Application Data, Application Data"
"369","0.958147600","172.217.6.214","192.168.1.118","TLSv1.2","2058","Application Data, Application Data"
"370","0.959131850","172.217.6.214","192.168.1.118","TLSv1.2","1484","Application Data"
"371","0.959424650","192.168.1.118","172.217.6.214","TCP","66","45014 → 443 [ACK] Seq=1911 Ack=45266 Win=55424 Len=0 TSval=1696410657 TSecr=915817148"
"372","0.959516625","192.168.1.118","172.217.6.214","TCP","66","45008 → 443 [ACK] Seq=2208 Ack=59461 Win=49536 Len=0 TSval=1696410657 TSecr=915817147"
"373","0.960133500","172.217.6.214","192.168.1.118","TLSv1.2","2902","Application Data, Application Data"
"374","0.960178712","192.168.1.118","172.217.6.214","TCP","66","45016 → 443 [ACK] Seq=2208 Ack=51883 Win=64640 Len=0 TSval=1696410658 TSecr=3548128006"
"375","0.962333525","172.217.6.214","192.168.1.118","TLSv1.2","2902","Application Data, Application Data"
"376","0.963300350","172.217.6.214","192.168.1.118","TLSv1.2","2902","Application Data, Application Data"
"377","0.963343337","172.217.6.214","192.168.1.118","TLSv1.2","1484","Application Data"
"378","0.963522825","192.168.1.118","172.217.6.214","TCP","66","45016 → 443 [ACK] Seq=2208 Ack=58973 Win=57600 Len=0 TSval=1696410661 TSecr=3548128007"
"379","0.963737237","192.168.1.118","172.217.6.214","TLSv1.2","363","Application Data"
"380","0.964105062","172.217.6.214","192.168.1.118","TLSv1.2","1484","Application Data"
"381","0.968107325","172.217.6.214","192.168.1.118","TLSv1.2","1308","Application Data"
"382","0.969734262","192.168.1.118","172.217.6.214","TCP","66","45016 → 443 [ACK] Seq=2208 Ack=61633 Win=55040 Len=0 TSval=1696410668 TSecr=3548128010"
"383","0.969973525","192.168.1.118","172.217.6.214","TLSv1.2","442","Application Data"
"384","0.975463800","192.168.1.118","172.217.6.214","TLSv1.2","433","Application Data"
"385","0.979061387","192.168.1.118","172.217.6.214","TLSv1.2","442","Application Data"
"386","0.979553762","172.217.6.214","192.168.1.118","TLSv1.2","1484","Application Data"
"387","0.981512550","172.217.6.214","192.168.1.118","TLSv1.2","1484","Application Data"
"388","0.982867250","172.217.6.214","192.168.1.118","TLSv1.2","1484","Application Data"
"389","0.982932900","172.217.6.214","192.168.1.118","TLSv1.2","2902","Application Data, Application Data"
"390","0.982981050","172.217.6.214","192.168.1.118","TLSv1.2","2669","Application Data, Application Data"
"391","0.984130925","192.168.1.118","172.217.6.214","TCP","66","45010 → 443 [ACK] Seq=2129 Ack=54287 Win=54528 Len=0 TSval=1696410682 TSecr=3548128025"
"392","0.985908575","172.217.6.214","192.168.1.118","TLSv1.2","1484","Application Data"
"393","0.985972875","172.217.6.214","192.168.1.118","TLSv1.2","2902","Application Data, Application Data"
"394","0.986562387","192.168.1.118","172.217.6.214","TCP","66","45012 → 443 [ACK] Seq=2208 Ack=51554 Win=59904 Len=0 TSval=1696410684 TSecr=1407855274"
"395","0.986998125","172.217.6.214","192.168.1.118","TLSv1.2","2902","Application Data, Application Data"
"396","0.989286625","192.168.1.118","172.217.6.214","TCP","66","45012 → 443 [ACK] Seq=2208 Ack=54390 Win=57088 Len=0 TSval=1696410687 TSecr=1407855276"
"397","0.989660487","172.217.6.214","192.168.1.118","TLSv1.2","855","Application Data"
"398","0.989705887","172.217.6.214","192.168.1.118","TLSv1.2","1484","Application Data"
"399","0.991378362","172.217.6.214","192.168.1.118","TLSv1.2","2902","Application Data, Application Data"
"400","0.991441062","172.217.6.214","192.168.1.118","TLSv1.2","1484","Application Data"
"401","0.991840200","192.168.1.118","172.217.6.214","TCP","66","45014 → 443 [ACK] Seq=2287 Ack=50938 Win=58496 Len=0 TSval=1696410690 TSecr=915817182"
"402","0.992163037","192.168.1.118","172.217.6.214","TLSv1.2","363","Application Data"
"403","0.992162362","172.217.6.214","192.168.1.118","TLSv1.2","1150","Application Data"
"404","0.993708850","172.217.6.214","192.168.1.118","TLSv1.2","1484","Application Data"
"405","0.993778237","172.217.6.214","192.168.1.118","TLSv1.2","1484","Application Data"
"406","0.994739725","172.217.6.214","192.168.1.118","TLSv1.2","1484","Application Data"
"407","0.994752200","192.168.1.118","172.217.6.214","TCP","66","45016 → 443 [ACK] Seq=2575 Ack=64469 Win=64640 Len=0 TSval=1696410693 TSecr=3548128040"
"408","0.994812700","172.217.6.214","192.168.1.118","TLSv1.2","2902","Application Data, Application Data"
"409","0.995069687","192.168.1.118","172.217.6.214","TLSv1.2","363","Application Data"
"410","0.995158125","192.168.1.118","172.217.6.214","TCP","66","45016 → 443 [ACK] Seq=2575 Ack=68723 Win=60416 Len=0 TSval=1696410693 TSecr=3548128040"
"411","0.997172700","172.217.6.214","192.168.1.118","TLSv1.2","861","Application Data"
"412","1.000309062","192.168.1.118","172.217.6.214","TLSv1.2","363","Application Data"
"413","1.003286612","192.168.1.118","172.217.6.214","TLSv1.2","363","Application Data"
"414","1.003754825","172.217.6.214","192.168.1.118","TLSv1.2","1484","Application Data"
"415","1.003866675","172.217.6.214","192.168.1.118","TLSv1.2","2407","Application Data, Application Data"
"416","1.005212750","192.168.1.118","172.217.6.214","TCP","66","45008 → 443 [ACK] Seq=2584 Ack=63220 Win=60416 Len=0 TSval=1696410703 TSecr=915817192"
"417","1.010081425","192.168.1.118","172.217.6.214","TLSv1.2","363","Application Data"
"418","1.011439037","172.217.6.214","192.168.1.118","TLSv1.2","1484","Application Data"
"419","1.012625800","172.217.6.214","192.168.1.118","TLSv1.2","1484","Application Data"
"420","1.012751837","172.217.6.214","192.168.1.118","TLSv1.2","2902","Application Data, Application Data"
"421","1.013271312","192.168.1.118","172.217.6.214","TCP","66","45012 → 443 [ACK] Seq=2505 Ack=59433 Win=59904 Len=0 TSval=1696410711 TSecr=1407855302"
"422","1.013847525","172.217.6.214","192.168.1.118","TLSv1.2","2902","Application Data, Application Data"
"423","1.013938537","172.217.6.214","192.168.1.118","TLSv1.2","1484","Application Data"
"424","1.015527112","172.217.6.214","192.168.1.118","TLSv1.2","1484","Application Data"
"425","1.015578862","172.217.6.214","192.168.1.118","TLSv1.2","2902","Application Data, Application Data"
"426","1.015734937","192.168.1.118","172.217.6.214","TCP","66","45010 → 443 [ACK] Seq=2426 Ack=61377 Win=57088 Len=0 TSval=1696410714 TSecr=3548128059"
"427","1.015842162","192.168.1.118","172.217.6.214","TCP","66","45012 → 443 [ACK] Seq=2505 Ack=62269 Win=57088 Len=0 TSval=1696410714 TSecr=1407855305"
"428","1.019231575","172.217.6.214","192.168.1.118","TLSv1.2","1257","Application Data"
"429","1.019313900","172.217.6.214","192.168.1.118","TLSv1.2","1123","Application Data"
"430","1.023171300","172.217.6.214","192.168.1.118","TLSv1.2","1484","Application Data"
"431","1.023266100","192.168.1.118","172.217.6.214","TLSv1.2","363","Application Data"
"432","1.023309062","172.217.6.214","192.168.1.118","TLSv1.2","2902","Application Data, Application Data"
"433","1.023395300","192.168.1.118","172.217.6.214","TCP","66","45016 → 443 [ACK] Seq=2872 Ack=73772 Win=62592 Len=0 TSval=1696410721 TSecr=3548128065"
"434","1.023410900","172.217.6.214","192.168.1.118","TLSv1.2","2185","Application Data, Application Data"
"435","1.025121425","172.217.6.214","192.168.1.118","TLSv1.2","1484","Application Data"
"436","1.025242400","172.217.6.214","192.168.1.118","TLSv1.2","2902","Application Data, Application Data"
"437","1.025367512","172.217.6.214","192.168.1.118","TLSv1.2","2902","Application Data, Application Data"
"438","1.025415612","172.217.6.214","192.168.1.118","TLSv1.2","996","Application Data"
"439","1.026076375","192.168.1.118","172.217.6.214","TCP","66","45014 → 443 [ACK] Seq=2584 Ack=60042 Win=56192 Len=0 TSval=1696410724 TSecr=915817214"
"440","1.026272137","192.168.1.118","172.217.6.214","TCP","66","45016 → 443 [ACK] Seq=2872 Ack=75891 Win=60544 Len=0 TSval=1696410724 TSecr=3548128067"
"441","1.028104512","172.217.6.214","192.168.1.118","TLSv1.2","1484","Application Data"
"442","1.029073075","172.217.6.214","192.168.1.118","TLSv1.2","2902","Application Data, Application Data"
"443","1.030130775","172.217.6.214","192.168.1.118","TLSv1.2","2902","Application Data, Application Data"
"444","1.031071337","172.217.6.214","192.168.1.118","TLSv1.2","1996","Application Data, Application Data"
"445","1.031421112","192.168.1.118","172.217.6.214","TCP","66","45008 → 443 [ACK] Seq=2881 Ack=72240 Win=55168 Len=0 TSval=1696410729 TSecr=915817222"
"446","1.059816062","172.217.6.214","192.168.1.118","TLSv1.2","1484","Application Data"
"447","1.060094387","192.168.1.118","172.217.6.214","TCP","66","45012 → 443 [ACK] Seq=2505 Ack=63326 Win=64128 Len=0 TSval=1696410758 TSecr=1407855307"
"448","1.061215725","172.217.6.214","192.168.1.118","TLSv1.2","2902","Application Data, Application Data"
"449","1.061345025","172.217.6.214","192.168.1.118","TLSv1.2","2902","Application Data, Application Data"
"450","1.061422875","172.217.6.214","192.168.1.118","TLSv1.2","1562","Application Data, Application Data"
"451","1.061438787","192.168.1.118","172.217.6.214","TCP","66","45010 → 443 [ACK] Seq=2723 Ack=69658 Win=57088 Len=0 TSval=1696410759 TSecr=3548128092"
"452","1.061513462","192.168.1.118","172.217.6.214","TCP","66","45010 → 443 [ACK] Seq=2723 Ack=71154 Win=55680 Len=0 TSval=1696410759 TSecr=3548128095"
"453","1.845398687","192.168.1.118","192.168.1.102","TCP","176","44768 → 8009 [PSH, ACK] Seq=1 Ack=1 Win=501 Len=110 TSval=2234953156 TSecr=2947493 [TCP segment of a reassembled PDU]"
"454","1.853725037","192.168.1.102","192.168.1.118","TCP","176","8009 → 44768 [PSH, ACK] Seq=1 Ack=111 Win=277 Len=110 TSval=2947994 TSecr=2234953156 [TCP segment of a reassembled PDU]"
"455","1.853895350","192.168.1.118","192.168.1.102","TCP","66","44768 → 8009 [ACK] Seq=111 Ack=111 Win=501 Len=0 TSval=2234953165 TSecr=2947994"
"456","2.198504850","192.168.1.104","255.255.255.255","UDP","217","49154 → 6666 Len=175"
"457","2.329228462","192.168.1.118","172.217.12.202","UDP","75","41616 → 443 Len=33"
"458","2.349476575","172.217.12.202","192.168.1.118","UDP","83","443 → 41616 Len=41"
"459","2.650150275","Cisco-Li_5b:1c:ce","IntelCor_b7:52:73","ARP","42","Who has 192.168.1.118? Tell 192.168.1.1"
"460","2.650217512","IntelCor_b7:52:73","Cisco-Li_5b:1c:ce","ARP","42","192.168.1.118 is at dc:fb:48:b7:52:73"
"461","3.389993600","192.168.1.118","192.168.1.102","TCP","211","44768 → 8009 [PSH, ACK] Seq=111 Ack=111 Win=501 Len=145 TSval=2234954701 TSecr=2947994 [TCP segment of a reassembled PDU]"
"462","3.398079150","192.168.1.102","192.168.1.118","TCP","512","8009 → 44768 [PSH, ACK] Seq=111 Ack=256 Win=294 Len=446 TSval=2948149 TSecr=2234954701 [TCP segment of a reassembled PDU]"
"463","3.398223075","192.168.1.118","192.168.1.102","TCP","66","44768 → 8009 [ACK] Seq=256 Ack=557 Win=498 Len=0 TSval=2234954709 TSecr=2948149"
"464","5.168451437","192.168.1.104","255.255.255.255","UDP","217","49154 → 6666 Len=175"
"465","7.643126075","fe80::defb:48ff:feb7:5273","ff02::2","ICMPv6","70","Router Solicitation from dc:fb:48:b7:52:73"
"466","8.240270025","192.168.1.104","255.255.255.255","UDP","217","49154 → 6666 Len=175"
"467","8.404315325","192.168.1.118","192.168.1.102","TCP","176","44768 → 8009 [PSH, ACK] Seq=256 Ack=557 Win=501 Len=110 TSval=2234959715 TSecr=2948149 [TCP segment of a reassembled PDU]"
"468","8.408797575","192.168.1.102","192.168.1.118","TCP","176","8009 → 44768 [PSH, ACK] Seq=557 Ack=366 Win=294 Len=110 TSval=2948650 TSecr=2234959715 [TCP segment of a reassembled PDU]"
"469","8.408979587","192.168.1.118","192.168.1.102","TCP","66","44768 → 8009 [ACK] Seq=366 Ack=667 Win=501 Len=0 TSval=2234959720 TSecr=2948650"
