frame.number,_ws.col.Time,_ws.col.Source,_ws.col.Destination,_ws.col.Protocol,frame.len,_ws.col.Info
"1","0.000000000","199.232.37.164","192.168.1.118","SSL","1418","Continuation Data"
"2","0.000057837","192.168.1.118","199.232.37.164","TCP","66","45386 → 443 [ACK] Seq=1 Ack=1353 Win=165 Len=0 TSval=1744330084 TSecr=2807783565"
"3","0.001564900","192.168.1.118","199.232.37.164","TCP","66","45384 → 443 [ACK] Seq=1 Ack=1 Win=240 Len=0 TSval=1744330085 TSecr=2805916952"
"4","0.010906687","192.168.1.118","199.232.37.164","TCP","74","45394 → 443 [SYN] Seq=0 Win=64240 Len=0 MSS=1460 SACK_PERM=1 TSval=1744330094 TSecr=0 WS=128"
"5","0.012275112","199.232.37.164","192.168.1.118","SSL","1418","Continuation Data"
"6","0.014873787","199.232.37.164","192.168.1.118","SSL","5474","Continuation Data"
"7","0.015022975","199.232.37.164","192.168.1.118","SSL","13586","Continuation Data"
"8","0.021998350","192.168.1.118","199.232.37.164","TCP","66","45386 → 443 [ACK] Seq=1 Ack=21633 Win=7 Len=0 TSval=1744330105 TSecr=2807783577"
"9","0.022246100","192.168.1.118","199.232.37.164","TLSv1.2","342","Application Data"
"10","0.024240387","199.232.37.164","192.168.1.118","TCP","74","443 → 45394 [SYN, ACK] Seq=0 Ack=1 Win=27040 Len=0 MSS=1364 SACK_PERM=1 TSval=1862040465 TSecr=1744330094 WS=512"
"11","0.024329462","192.168.1.118","199.232.37.164","TCP","66","45394 → 443 [ACK] Seq=1 Ack=1 Win=64256 Len=0 TSval=1744330108 TSecr=1862040465"
"12","0.039778400","192.168.1.118","199.232.37.164","TLSv1","583","Client Hello"
"13","0.041838637","192.168.1.118","199.232.37.164","TCP","66","[TCP Window Update] 45386 → 443 [ACK] Seq=1 Ack=21633 Win=115 Len=0 TSval=1744330125 TSecr=2807783577"
"14","0.042797325","192.168.1.118","199.232.37.164","TLSv1.2","354","Application Data"
"15","0.043652150","192.168.1.118","199.232.37.164","TCP","66","[TCP Window Update] 45384 → 443 [ACK] Seq=1 Ack=1 Win=501 Len=0 TSval=1744330127 TSecr=2805916952"
"16","0.044850075","192.168.1.118","199.232.37.164","TLSv1.2","363","Application Data"
"17","0.046165562","192.168.1.118","199.232.37.164","TLSv1.2","356","Application Data"
"18","0.046547575","199.232.37.164","192.168.1.118","TLSv1.2","1418","Application Data"
"19","0.047395300","192.168.1.118","199.232.37.164","TCP","66","[TCP Window Update] 45386 → 443 [ACK] Seq=1 Ack=21633 Win=358 Len=0 TSval=1744330131 TSecr=2807783577"
"20","0.050076862","199.232.37.164","192.168.1.118","TLSv1.2","5474","Application Data, Application Data, Application Data, Application Data"
"21","0.050196025","199.232.37.164","192.168.1.118","TLSv1.2","8178","Application Data, Application Data, Application Data, Application Data, Application Data"
"22","0.050311162","192.168.1.118","199.232.37.164","TCP","66","45392 → 443 [ACK] Seq=277 Ack=14873 Win=385 Len=0 TSval=1744330134 TSecr=4197079298"
"23","0.053222100","199.232.37.164","192.168.1.118","TLSv1.2","5474","Application Data, Application Data, Application Data, Application Data"
"24","0.053285987","192.168.1.118","199.232.37.164","TCP","66","45392 → 443 [ACK] Seq=277 Ack=20281 Win=445 Len=0 TSval=1744330137 TSecr=4197079298"
"25","0.053381387","199.232.37.164","192.168.1.118","TLSv1.2","6826","Application Data, Application Data, Application Data, Application Data, Application Data"
"26","0.053873625","192.168.1.118","199.232.37.164","TCP","66","45392 → 443 [ACK] Seq=277 Ack=27041 Win=393 Len=0 TSval=1744330137 TSecr=4197079298"
"27","0.061528550","199.232.37.164","192.168.1.118","TCP","66","443 → 45394 [ACK] Seq=1 Ack=518 Win=28160 Len=0 TSval=1862040500 TSecr=1744330123"
"28","0.063826300","199.232.37.164","192.168.1.118","TLSv1.2","5697","Server Hello, Certificate, Server Key Exchange, Server Hello Done"
"29","0.063888525","192.168.1.118","199.232.37.164","TCP","66","45394 → 443 [ACK] Seq=518 Ack=5632 Win=58752 Len=0 TSval=1744330147 TSecr=1862040501"
"30","0.066721212","192.168.1.118","199.232.37.164","TLSv1.2","192","Client Key Exchange, Change Cipher Spec, Encrypted Handshake Message"
"31","0.072264687","199.232.37.164","192.168.1.118","SSL","1418","Continuation Data"
"32","0.077631062","199.232.37.164","192.168.1.118","SSL","2770","Continuation Data"
"33","0.077673687","192.168.1.118","199.232.37.164","TCP","66","45386 → 443 [ACK] Seq=1 Ack=25689 Win=543 Len=0 TSval=1744330161 TSecr=2807783592"
"34","0.077815775","199.232.37.164","192.168.1.118","SSL","9530","Continuation Data"
"35","0.077850712","192.168.1.118","199.232.37.164","TCP","66","45386 → 443 [ACK] Seq=1 Ack=35153 Win=691 Len=0 TSval=1744330161 TSecr=2807783592"
"36","0.077919225","199.232.37.164","192.168.1.118","SSL","9530","Continuation Data"
"37","0.077949987","192.168.1.118","199.232.37.164","TCP","66","45386 → 443 [ACK] Seq=1 Ack=44617 Win=839 Len=0 TSval=1744330161 TSecr=2807783592"
"38","0.091205587","199.232.37.164","192.168.1.118","SSL","2770","Continuation Data"
"39","0.091250400","192.168.1.118","199.232.37.164","TCP","66","45386 → 443 [ACK] Seq=1 Ack=47321 Win=881 Len=0 TSval=1744330175 TSecr=2807783592"
"40","0.091457037","199.232.37.164","192.168.1.118","SSL","18994","Continuation Data"
"41","0.091503812","192.168.1.118","199.232.37.164","TCP","66","45386 → 443 [ACK] Seq=1 Ack=66249 Win=1177 Len=0 TSval=1744330175 TSecr=2807783592"
"42","0.094242812","199.232.37.164","192.168.1.118","TLSv1.2","5474","Application Data, Application Data, Application Data, Application Data"
"43","0.094286787","192.168.1.118","199.232.37.164","TCP","66","45392 → 443 [ACK] Seq=277 Ack=32449 Win=445 Len=0 TSval=1744330178 TSecr=4197079304"
"44","0.094390275","199.232.37.164","192.168.1.118","TLSv1.2","1594","Application Data, Application Data"
"45","0.094433150","192.168.1.118","199.232.37.164","TCP","66","45392 → 443 [ACK] Seq=277 Ack=33977 Win=525 Len=0 TSval=1744330178 TSecr=4197079304"
"46","0.094590537","199.232.37.164","192.168.1.118","TLSv1.2","13586","Application Data, Application Data, Application Data, Application Data, Application Data, Application Data, Application Data, Application Data, Application Data"
"47","0.094648537","192.168.1.118","199.232.37.164","TCP","66","45384 → 443 [ACK] Seq=291 Ack=13521 Win=549 Len=0 TSval=1744330178 TSecr=2805916981"
"48","0.100683950","199.232.37.164","192.168.1.118","TLSv1.2","5474","Application Data, Application Data, Application Data, Application Data"
"49","0.100737812","192.168.1.118","199.232.37.164","TCP","66","45384 → 443 [ACK] Seq=291 Ack=18929 Win=633 Len=0 TSval=1744330184 TSecr=2805916981"
"50","0.100974800","199.232.37.164","192.168.1.118","TLSv1.2","14938","Application Data, Application Data, Application Data, Application Data, Application Data, Application Data, Application Data, Application Data, Application Data, Application Data, Application Data"
"51","0.101040225","199.232.37.164","192.168.1.118","TLSv1.2","1105","Application Data, Application Data"
"52","0.101186187","192.168.1.118","199.232.37.164","TCP","66","45384 → 443 [ACK] Seq=291 Ack=34840 Win=509 Len=0 TSval=1744330185 TSecr=2805916981"
"53","0.110238150","199.232.37.164","192.168.1.118","TLSv1.2","5474","Application Data, Application Data, Application Data, Application Data"
"54","0.110330037","192.168.1.118","199.232.37.164","TCP","66","45390 → 443 [ACK] Seq=298 Ack=5409 Win=586 Len=0 TSval=1744330194 TSecr=3139890248"
"55","0.110461737","199.232.37.164","192.168.1.118","TLSv1.2","1104","Application Data"
"56","0.110549712","192.168.1.118","199.232.37.164","TCP","66","45390 → 443 [ACK] Seq=298 Ack=6447 Win=607 Len=0 TSval=1744330194 TSecr=3139890248"
"57","0.110792187","199.232.37.164","192.168.1.118","TLSv1.2","14938","Application Data, Application Data, Application Data, Application Data, Application Data, Application Data, Application Data, Application Data, Application Data, Application Data"
"58","0.112176512","192.168.1.118","199.232.37.164","TCP","66","45388 → 443 [ACK] Seq=289 Ack=14873 Win=501 Len=0 TSval=1744330196 TSecr=3137891191"
"59","0.115716125","199.232.37.164","192.168.1.118","TLSv1.2","6826","Application Data, Application Data, Application Data, Application Data, Application Data"
"60","0.115819962","192.168.1.118","199.232.37.164","TCP","66","45388 → 443 [ACK] Seq=289 Ack=21633 Win=607 Len=0 TSval=1744330199 TSecr=3137891191"
"61","0.115973025","199.232.37.164","192.168.1.118","TLSv1.2","6826","Application Data, Application Data, Application Data, Application Data, Application Data"
"62","0.116044500","192.168.1.118","199.232.37.164","TCP","66","45388 → 443 [ACK] Seq=289 Ack=28393 Win=712 Len=0 TSval=1744330199 TSecr=3137891192"
"63","0.116185050","199.232.37.164","192.168.1.118","TLSv1.2","1418","Application Data [TCP segment of a reassembled PDU]"
"64","0.116249437","192.168.1.118","199.232.37.164","TCP","66","45388 → 443 [ACK] Seq=289 Ack=29745 Win=734 Len=0 TSval=1744330200 TSecr=3137891192"
"65","0.116384200","199.232.37.164","192.168.1.118","TLSv1.2","6826","Application Data, Application Data, Application Data, Application Data, Application Data"
"66","0.116452800","192.168.1.118","199.232.37.164","TCP","66","45388 → 443 [ACK] Seq=289 Ack=36505 Win=839 Len=0 TSval=1744330200 TSecr=3137891193"
"67","0.159634600","199.232.37.164","192.168.1.118","TLSv1.2","1418","Application Data [TCP segment of a reassembled PDU]"
"68","0.159738000","192.168.1.118","199.232.37.164","TCP","66","45388 → 443 [ACK] Seq=289 Ack=37857 Win=860 Len=0 TSval=1744330243 TSecr=3137891193"
"69","0.159818512","199.232.37.164","192.168.1.118","TLSv1.2","4122","Application Data, Application Data, Application Data"
"70","0.159877975","192.168.1.118","199.232.37.164","TCP","66","45388 → 443 [ACK] Seq=289 Ack=41913 Win=924 Len=0 TSval=1744330243 TSecr=3137891194"
"71","0.159924437","199.232.37.164","192.168.1.118","TLSv1.2","846","Application Data"
"72","0.159973237","192.168.1.118","199.232.37.164","TCP","66","45388 → 443 [ACK] Seq=289 Ack=42693 Win=945 Len=0 TSval=1744330243 TSecr=3137891194"
"73","0.160013537","199.232.37.164","192.168.1.118","TLSv1.2","117","Change Cipher Spec, Encrypted Handshake Message"
"74","0.160135287","199.232.37.164","192.168.1.118","SSL","17642","Continuation Data"
"75","0.160195662","192.168.1.118","199.232.37.164","TCP","66","45386 → 443 [ACK] Seq=1 Ack=83825 Win=1452 Len=0 TSval=1744330244 TSecr=2807783599"
"76","0.160255787","199.232.37.164","192.168.1.118","SSL","1418","Continuation Data"
"77","0.160310187","192.168.1.118","199.232.37.164","TCP","66","45386 → 443 [ACK] Seq=1 Ack=85177 Win=1473 Len=0 TSval=1744330244 TSecr=2807783599"
"78","0.160729537","192.168.1.118","199.232.37.164","TLSv1.2","375","Application Data"
"79","0.161292337","199.232.37.164","192.168.1.118","SSL","2770","Continuation Data"
"80","0.161360262","192.168.1.118","199.232.37.164","TCP","66","45386 → 443 [ACK] Seq=1 Ack=87881 Win=1515 Len=0 TSval=1744330245 TSecr=2807783599"
"81","0.169894012","199.232.37.164","192.168.1.118","SSL","2770","Continuation Data"
"82","0.169928012","192.168.1.118","199.232.37.164","TCP","66","45386 → 443 [ACK] Seq=1 Ack=90585 Win=1557 Len=0 TSval=1744330253 TSecr=2807783599"
"83","0.180334525","199.232.37.164","192.168.1.118","SSL","5474","Continuation Data"
"84","0.180389450","192.168.1.118","199.232.37.164","TCP","66","45386 → 443 [ACK] Seq=1 Ack=95993 Win=1642 Len=0 TSval=1744330264 TSecr=2807783599"
"85","0.180661412","199.232.37.164","192.168.1.118","SSL","16290","Continuation Data"
"86","0.180716050","192.168.1.118","199.232.37.164","TCP","66","45386 → 443 [ACK] Seq=1 Ack=112217 Win=1895 Len=0 TSval=1744330264 TSecr=2807783599"
"87","0.182902812","199.232.37.164","192.168.1.118","SSL","5474","Continuation Data"
"88","0.182955162","192.168.1.118","199.232.37.164","TCP","66","45386 → 443 [ACK] Seq=1 Ack=117625 Win=1980 Len=0 TSval=1744330266 TSecr=2807783599"
"89","0.183126212","199.232.37.164","192.168.1.118","SSL","6826","Continuation Data"
"90","0.183195625","192.168.1.118","199.232.37.164","TCP","66","45386 → 443 [ACK] Seq=1 Ack=124385 Win=2086 Len=0 TSval=1744330267 TSecr=2807783599"
"91","0.183311600","199.232.37.164","192.168.1.118","SSL","9530","Continuation Data"
"92","0.183366862","192.168.1.118","199.232.37.164","TCP","66","45386 → 443 [ACK] Seq=1 Ack=133849 Win=2233 Len=0 TSval=1744330267 TSecr=2807783601"
"93","0.193358312","199.232.37.164","192.168.1.118","SSL","5474","Continuation Data"
"94","0.193440562","192.168.1.118","199.232.37.164","TCP","66","45386 → 443 [ACK] Seq=1 Ack=139257 Win=2318 Len=0 TSval=1744330277 TSecr=2807783601"
"95","0.193626000","199.232.37.164","192.168.1.118","SSL","1418","Continuation Data"
"96","0.193679437","192.168.1.118","199.232.37.164","TCP","66","45386 → 443 [ACK] Seq=1 Ack=140609 Win=2339 Len=0 TSval=1744330277 TSecr=2807783601"
"97","0.203570462","199.232.37.164","192.168.1.118","SSL","5474","Continuation Data"
"98","0.203646575","192.168.1.118","199.232.37.164","TCP","66","45386 → 443 [ACK] Seq=1 Ack=146017 Win=2424 Len=0 TSval=1744330287 TSecr=2807783601"
"99","0.203815437","199.232.37.164","192.168.1.118","SSL","21698","Continuation Data"
"100","0.203893300","192.168.1.118","199.232.37.164","TCP","66","45386 → 443 [ACK] Seq=1 Ack=167649 Win=2762 Len=0 TSval=1744330287 TSecr=2807783601"
"101","0.204047350","199.232.37.164","192.168.1.118","SSL","20346","Continuation Data"
"102","0.204124450","192.168.1.118","199.232.37.164","TCP","66","45386 → 443 [ACK] Seq=1 Ack=187929 Win=3078 Len=0 TSval=1744330288 TSecr=2807783621"
"103","0.212822975","199.232.37.164","192.168.1.118","SSL","5474","Continuation Data"
"104","0.212905212","192.168.1.118","199.232.37.164","TCP","66","45386 → 443 [ACK] Seq=1 Ack=193337 Win=3163 Len=0 TSval=1744330296 TSecr=2807783621"
"105","0.213090512","199.232.37.164","192.168.1.118","SSL","12234","Continuation Data"
"106","0.213131025","192.168.1.118","199.232.37.164","TCP","66","45386 → 443 [ACK] Seq=1 Ack=205505 Win=3353 Len=0 TSval=1744330297 TSecr=2807783621"
"107","0.213197600","199.232.37.164","192.168.1.118","SSL","4122","Continuation Data"
"108","0.213234500","192.168.1.118","199.232.37.164","TCP","66","45386 → 443 [ACK] Seq=1 Ack=209561 Win=3363 Len=0 TSval=1744330297 TSecr=2807783621"
"109","0.225948125","199.232.37.164","192.168.1.118","SSL","1418","Continuation Data"
"110","0.226010912","192.168.1.118","199.232.37.164","TCP","66","45386 → 443 [ACK] Seq=1 Ack=210913 Win=3385 Len=0 TSval=1744330309 TSecr=2807783621"
"111","0.226042462","199.232.37.164","192.168.1.118","TLSv1.2","4122","Application Data, Application Data, Application Data"
"112","0.226115250","199.232.37.164","192.168.1.118","TLSv1.2","9513","Application Data, Application Data, Application Data, Application Data, Application Data, Application Data, Application Data, Application Data, Encrypted Alert"
"113","0.226180962","192.168.1.118","199.232.37.164","TCP","66","45394 → 443 [ACK] Seq=953 Ack=19187 Win=50688 Len=0 TSval=1744330310 TSecr=1862040629"
"114","0.234475000","192.168.1.118","199.232.37.164","TCP","74","45396 → 443 [SYN] Seq=0 Win=64240 Len=0 MSS=1460 SACK_PERM=1 TSval=1744330318 TSecr=0 WS=128"
"115","0.234773762","192.168.1.118","209.18.47.62","DNS","76","Standard query 0xe1ed A typeface.nyt.com"
"116","0.240439875","192.168.1.118","199.232.37.164","TLSv1.2","97","Encrypted Alert"
"117","0.242193462","192.168.1.118","199.232.37.164","TCP","66","45394 → 443 [RST, ACK] Seq=984 Ack=19187 Win=64128 Len=0 TSval=1744330326 TSecr=1862040629"
"118","0.243104100","192.168.1.118","199.232.37.164","TLSv1.2","358","Application Data"
"119","0.253756275","199.232.37.164","192.168.1.118","SSL","1418","Continuation Data"
"120","0.253858525","192.168.1.118","199.232.37.164","TCP","66","45386 → 443 [ACK] Seq=1 Ack=212265 Win=3406 Len=0 TSval=1744330337 TSecr=2807783635"
"121","0.257383537","199.232.37.164","192.168.1.118","SSL","21698","Continuation Data"
"122","0.257466737","192.168.1.118","199.232.37.164","TCP","66","45386 → 443 [ACK] Seq=1 Ack=233897 Win=3606 Len=0 TSval=1744330341 TSecr=2807783635"
"123","0.259631012","199.232.37.164","192.168.1.118","SSL","8178","Continuation Data"
"124","0.259714462","192.168.1.118","199.232.37.164","TCP","66","45386 → 443 [ACK] Seq=1 Ack=242009 Win=3733 Len=0 TSval=1744330343 TSecr=2807783635"
"125","0.260003000","199.232.37.164","192.168.1.118","SSL","13586","Continuation Data"
"126","0.260346975","192.168.1.118","199.232.37.164","TCP","66","45386 → 443 [ACK] Seq=1 Ack=255529 Win=3702 Len=0 TSval=1744330344 TSecr=2807783635"
"127","0.265526100","199.232.37.164","192.168.1.118","SSL","2770","Continuation Data"
"128","0.265574437","192.168.1.118","199.232.37.164","TCP","66","45386 → 443 [ACK] Seq=1 Ack=258233 Win=3775 Len=0 TSval=1744330349 TSecr=2807783635"
"129","0.265672425","199.232.37.164","192.168.1.118","SSL","2770","Continuation Data"
"130","0.265715762","192.168.1.118","199.232.37.164","TCP","66","45386 → 443 [ACK] Seq=1 Ack=260937 Win=3798 Len=0 TSval=1744330349 TSecr=2807783635"
"131","0.265761737","199.232.37.164","192.168.1.118","SSL","1418","[TCP Previous segment not captured] , Continuation Data"
"132","0.265808300","192.168.1.118","199.232.37.164","TCP","78","[TCP Dup ACK 130#1] 45386 → 443 [ACK] Seq=1 Ack=260937 Win=3798 Len=0 TSval=1744330349 TSecr=2807783635 SLE=262289 SRE=263641"
"133","0.265854475","199.232.37.164","192.168.1.118","TCP","1418","[TCP Previous segment not captured]  [TCP segment of a reassembled PDU]"
"134","0.265899237","192.168.1.118","199.232.37.164","TCP","86","[TCP Window Update] 45386 → 443 [ACK] Seq=1 Ack=260937 Win=3820 Len=0 TSval=1744330349 TSecr=2807783635 SLE=264993 SRE=266345 SLE=262289 SRE=263641"
"135","0.265942400","199.232.37.164","192.168.1.118","TCP","1418","[TCP Previous segment not captured] 443 → 45386 [ACK] Seq=270401 Ack=1 Win=57 Len=1352 TSval=2807783635 TSecr=1744330309 [TCP segment of a reassembled PDU]"
"136","0.265985287","192.168.1.118","199.232.37.164","TCP","94","[TCP Dup ACK 130#2] 45386 → 443 [ACK] Seq=1 Ack=260937 Win=3820 Len=0 TSval=1744330349 TSecr=2807783635 SLE=270401 SRE=271753 SLE=264993 SRE=266345 SLE=262289 SRE=263641"
"137","0.266031237","199.232.37.164","192.168.1.118","TCP","1418","[TCP Previous segment not captured] 443 → 45386 [ACK] Seq=273105 Ack=1 Win=57 Len=1352 TSval=2807783635 TSecr=1744330309 [TCP segment of a reassembled PDU]"
"138","0.266074075","192.168.1.118","199.232.37.164","TCP","94","[TCP Dup ACK 130#3] 45386 → 443 [ACK] Seq=1 Ack=260937 Win=3820 Len=0 TSval=1744330350 TSecr=2807783635 SLE=273105 SRE=274457 SLE=270401 SRE=271753 SLE=264993 SRE=266345"
"139","0.266118137","199.232.37.164","192.168.1.118","TCP","1418","[TCP Previous segment not captured] 443 → 45386 [ACK] Seq=282569 Ack=1 Win=57 Len=1352 TSval=2807783635 TSecr=1744330309 [TCP segment of a reassembled PDU], Continuation Data"
"140","0.266161225","192.168.1.118","199.232.37.164","TCP","94","[TCP Dup ACK 130#4] 45386 → 443 [ACK] Seq=1 Ack=260937 Win=3820 Len=0 TSval=1744330350 TSecr=2807783635 SLE=282569 SRE=283921 SLE=273105 SRE=274457 SLE=270401 SRE=271753"
"141","0.266233112","199.232.37.164","192.168.1.118","SSL","4122","[TCP Previous segment not captured] , Continuation Data"
"142","0.266282225","199.232.37.164","192.168.1.118","SSL","1418","[TCP Previous segment not captured] , Continuation Data"
"143","0.266327462","192.168.1.118","199.232.37.164","TCP","94","[TCP Dup ACK 130#5] 45386 → 443 [ACK] Seq=1 Ack=260937 Win=3820 Len=0 TSval=1744330350 TSecr=2807783635 SLE=285273 SRE=289329 SLE=282569 SRE=283921 SLE=273105 SRE=274457"
"144","0.266387987","199.232.37.164","192.168.1.118","SSL","2770","[TCP Previous segment not captured] , Continuation Data"
"145","0.266426850","199.232.37.164","192.168.1.118","SSL","1418","[TCP Previous segment not captured] , Continuation Data"
"146","0.266468562","192.168.1.118","199.232.37.164","TCP","94","[TCP Dup ACK 130#6] 45386 → 443 [ACK] Seq=1 Ack=260937 Win=3820 Len=0 TSval=1744330350 TSecr=2807783635 SLE=294737 SRE=297441 SLE=292033 SRE=293385 SLE=285273 SRE=289329"
"147","0.273270625","199.232.37.164","192.168.1.118","SSL","1418","[TCP Previous segment not captured] , Continuation Data"
"148","0.273326437","199.232.37.164","192.168.1.118","SSL","1418","[TCP Previous segment not captured] , Continuation Data"
"149","0.273372425","192.168.1.118","199.232.37.164","TCP","94","[TCP Dup ACK 130#7] 45386 → 443 [ACK] Seq=1 Ack=260937 Win=3820 Len=0 TSval=1744330357 TSecr=2807783635 SLE=306905 SRE=308257 SLE=300145 SRE=301497 SLE=294737 SRE=297441"
"150","0.273421562","199.232.37.164","192.168.1.118","SSL","1418","[TCP Previous segment not captured] , Continuation Data"
"151","0.273452212","199.232.37.164","192.168.1.118","TCP","1418","[TCP Previous segment not captured] 443 → 45386 [ACK] Seq=315017 Ack=1 Win=57 Len=1352 TSval=2807783635 TSecr=1744330309"
"152","0.273492362","192.168.1.118","199.232.37.164","TCP","94","[TCP Dup ACK 130#8] 45386 → 443 [ACK] Seq=1 Ack=260937 Win=3820 Len=0 TSval=1744330357 TSecr=2807783635 SLE=312313 SRE=313665 SLE=309609 SRE=310961 SLE=306905 SRE=308257"
"153","0.273609175","199.232.37.164","192.168.1.118","SSL","1418","Continuation Data"
"154","0.273658662","199.232.37.164","192.168.1.118","SSL","1418","[TCP Previous segment not captured] , Continuation Data"
"155","0.273701987","192.168.1.118","199.232.37.164","TCP","94","[TCP Dup ACK 130#9] 45386 → 443 [ACK] Seq=1 Ack=260937 Win=3820 Len=0 TSval=1744330357 TSecr=2807783635 SLE=315017 SRE=317721 SLE=312313 SRE=313665 SLE=309609 SRE=310961"
"156","0.273746087","199.232.37.164","192.168.1.118","SSL","1418","[TCP Previous segment not captured] , Continuation Data"
"157","0.273793250","199.232.37.164","192.168.1.118","SSL","1418","[TCP Previous segment not captured] , Continuation Data"
"158","0.273835687","192.168.1.118","199.232.37.164","TCP","94","[TCP Dup ACK 130#10] 45386 → 443 [ACK] Seq=1 Ack=260937 Win=3820 Len=0 TSval=1744330357 TSecr=2807783635 SLE=323129 SRE=324481 SLE=319073 SRE=320425 SLE=315017 SRE=317721"
"159","0.273895662","199.232.37.164","192.168.1.118","SSL","2770","[TCP Previous segment not captured] , Continuation Data"
"160","0.273941537","199.232.37.164","192.168.1.118","SSL","1418","[TCP Previous segment not captured] , Continuation Data"
"161","0.273984662","192.168.1.118","199.232.37.164","TCP","94","[TCP Dup ACK 130#11] 45386 → 443 [ACK] Seq=1 Ack=260937 Win=3820 Len=0 TSval=1744330357 TSecr=2807783635 SLE=329889 SRE=332593 SLE=325833 SRE=327185 SLE=323129 SRE=324481"
"162","0.274032837","199.232.37.164","192.168.1.118","SSL","1418","[TCP Previous segment not captured] , Continuation Data"
"163","0.274078912","199.232.37.164","192.168.1.118","SSL","1418","[TCP Previous segment not captured] , Continuation Data"
"164","0.274120825","192.168.1.118","199.232.37.164","TCP","94","[TCP Dup ACK 130#12] 45386 → 443 [ACK] Seq=1 Ack=260937 Win=3820 Len=0 TSval=1744330358 TSecr=2807783635 SLE=340705 SRE=342057 SLE=338001 SRE=339353 SLE=329889 SRE=332593"
"165","0.274169400","199.232.37.164","192.168.1.118","SSL","1418","[TCP Previous segment not captured] , Continuation Data"
"166","0.274226337","199.232.37.164","192.168.1.118","SSL","2770","[TCP Previous segment not captured] , Continuation Data"
"167","0.274270962","192.168.1.118","199.232.37.164","TCP","94","[TCP Dup ACK 130#13] 45386 → 443 [ACK] Seq=1 Ack=260937 Win=3820 Len=0 TSval=1744330358 TSecr=2807783635 SLE=347465 SRE=348817 SLE=344761 SRE=346113 SLE=340705 SRE=342057"
"168","0.280495562","199.232.37.164","192.168.1.118","TCP","4122","[TCP Previous segment not captured] 443 → 45386 [ACK] Seq=359633 Ack=1 Win=57 Len=4056 TSval=2807783635 TSecr=1744330309"
"169","0.280560112","199.232.37.164","192.168.1.118","SSL","1418","[TCP Previous segment not captured] , Continuation Data"
"170","0.280619062","192.168.1.118","199.232.37.164","TCP","94","[TCP Dup ACK 130#14] 45386 → 443 [ACK] Seq=1 Ack=260937 Win=3820 Len=0 TSval=1744330364 TSecr=2807783635 SLE=359633 SRE=363689 SLE=354225 SRE=356929 SLE=347465 SRE=348817"
"171","0.280746587","199.232.37.164","192.168.1.118","SSL","1418","Continuation Data"
"172","0.280832450","199.232.37.164","192.168.1.118","SSL","2770","[TCP Previous segment not captured] , Continuation Data"
"173","0.280895762","192.168.1.118","199.232.37.164","TCP","94","[TCP Dup ACK 130#15] 45386 → 443 [ACK] Seq=1 Ack=260937 Win=3820 Len=0 TSval=1744330364 TSecr=2807783635 SLE=369097 SRE=371801 SLE=359633 SRE=363689 SLE=354225 SRE=356929"
"174","0.280958712","199.232.37.164","192.168.1.118","SSL","1418","[TCP Previous segment not captured] , Continuation Data"
"175","0.281021112","199.232.37.164","192.168.1.118","SSL","1418","[TCP Previous segment not captured] , Continuation Data"
"176","0.281079512","192.168.1.118","199.232.37.164","TCP","94","[TCP Dup ACK 130#16] 45386 → 443 [ACK] Seq=1 Ack=260937 Win=3820 Len=0 TSval=1744330365 TSecr=2807783635 SLE=379913 SRE=381265 SLE=374505 SRE=377209 SLE=369097 SRE=371801"
"177","0.281179062","199.232.37.164","192.168.1.118","SSL","4122","[TCP Previous segment not captured] , Continuation Data"
"178","0.281290875","199.232.37.164","192.168.1.118","SSL","5474","[TCP Previous segment not captured] , Continuation Data"
"179","0.281354987","192.168.1.118","199.232.37.164","TCP","94","[TCP Dup ACK 130#17] 45386 → 443 [ACK] Seq=1 Ack=260937 Win=3820 Len=0 TSval=1744330365 TSecr=2807783635 SLE=389377 SRE=393433 SLE=382617 SRE=383969 SLE=379913 SRE=381265"
"180","0.282441300","199.232.37.164","192.168.1.118","SSL","4122","Continuation Data"
"181","0.283185787","199.232.37.164","192.168.1.118","SSL","8178","Continuation Data"
"182","0.283537000","192.168.1.118","199.232.37.164","TCP","94","[TCP Dup ACK 130#18] 45386 → 443 [ACK] Seq=1 Ack=260937 Win=3820 Len=0 TSval=1744330367 TSecr=2807783635 SLE=396137 SRE=413713 SLE=389377 SRE=393433 SLE=382617 SRE=383969"
"183","0.288381362","199.232.37.164","192.168.1.118","SSL","10882","Continuation Data"
"184","0.289500237","199.232.37.164","192.168.1.118","SSL","20346","Continuation Data"
"185","0.289625037","192.168.1.118","199.232.37.164","TCP","94","[TCP Dup ACK 130#19] 45386 → 443 [ACK] Seq=1 Ack=260937 Win=3820 Len=0 TSval=1744330373 TSecr=2807783635 SLE=396137 SRE=444809 SLE=389377 SRE=393433 SLE=382617 SRE=383969"
"186","0.291950762","199.232.37.164","192.168.1.118","SSL","2770","Continuation Data"
"187","0.293027437","192.168.1.118","199.232.37.164","TCP","94","[TCP Dup ACK 130#20] 45386 → 443 [ACK] Seq=1 Ack=260937 Win=3820 Len=0 TSval=1744330375 TSecr=2807783635 SLE=396137 SRE=447513 SLE=389377 SRE=393433 SLE=382617 SRE=383969"
"188","0.294882575","199.232.37.164","192.168.1.118","TCP","8178","443 → 45386 [ACK] Seq=447513 Ack=1 Win=57 Len=8112 TSval=2807783635 TSecr=1744330309"
"189","0.295677200","209.18.47.62","192.168.1.118","DNS","170","Standard query response 0xe1ed A typeface.nyt.com CNAME nyt5-assets.prd.map.nytimes.com CNAME nytimes.map.fastly.net A 199.232.37.164"
"190","0.295734175","199.232.37.164","192.168.1.118","TCP","74","443 → 45396 [SYN, ACK] Seq=0 Ack=1 Win=27040 Len=0 MSS=1364 SACK_PERM=1 TSval=2805696367 TSecr=1744330318 WS=512"
"191","0.295798800","192.168.1.118","199.232.37.164","TCP","66","45396 → 443 [ACK] Seq=1 Ack=1 Win=64256 Len=0 TSval=1744330379 TSecr=2805696367"
"192","0.295830500","199.232.37.164","192.168.1.118","TCP","54","443 → 45394 [RST] Seq=19187 Win=0 Len=0"
"193","0.295870625","199.232.37.164","192.168.1.118","TLSv1.2","1299","Application Data, Application Data"
"194","0.295918850","192.168.1.118","199.232.37.164","TCP","66","45388 → 443 [ACK] Seq=581 Ack=43926 Win=966 Len=0 TSval=1744330379 TSecr=3137891242"
"195","0.295950375","199.232.37.164","192.168.1.118","SSL","1418","Continuation Data"
"196","0.296027537","199.232.37.164","192.168.1.118","SSL","4122","Continuation Data"
"197","0.296073287","192.168.1.118","199.232.37.164","TCP","94","[TCP Dup ACK 130#21] 45386 → 443 [ACK] Seq=1 Ack=260937 Win=3820 Len=0 TSval=1744330380 TSecr=2807783635 SLE=396137 SRE=461033 SLE=389377 SRE=393433 SLE=382617 SRE=383969"
"198","0.296216550","192.168.1.118","209.18.47.62","DNS","76","Standard query 0xa19d AAAA typeface.nyt.com"
"199","0.297337212","199.232.37.164","192.168.1.118","SSL","1817","Continuation Data"
"200","0.297540337","199.232.37.164","192.168.1.118","SSL","1418","[TCP Fast Retransmission] , Continuation Data"
"201","0.297581075","192.168.1.118","199.232.37.164","TCP","94","45386 → 443 [ACK] Seq=1 Ack=263641 Win=3799 Len=0 TSval=1744330381 TSecr=2807783647 SLE=396137 SRE=462784 SLE=389377 SRE=393433 SLE=382617 SRE=383969"
"202","0.297620100","199.232.37.164","192.168.1.118","TCP","1418","[TCP Out-Of-Order] 443 → 45386 [ACK] Seq=263641 Ack=1 Win=57 Len=1352 TSval=2807783647 TSecr=1744330349"
"203","0.297662100","192.168.1.118","199.232.37.164","TCP","94","45386 → 443 [ACK] Seq=1 Ack=266345 Win=3778 Len=0 TSval=1744330381 TSecr=2807783647 SLE=396137 SRE=462784 SLE=389377 SRE=393433 SLE=382617 SRE=383969"
"204","0.297724575","199.232.37.164","192.168.1.118","TCP","4122","[TCP Out-Of-Order] 443 → 45386 [ACK] Seq=266345 Ack=1 Win=57 Len=4056 TSval=2807783647 TSecr=1744330350 [TCP segment of a reassembled PDU]"
"205","0.297767225","192.168.1.118","199.232.37.164","TCP","94","45386 → 443 [ACK] Seq=1 Ack=271753 Win=3736 Len=0 TSval=1744330381 TSecr=2807783647 SLE=396137 SRE=462784 SLE=389377 SRE=393433 SLE=382617 SRE=383969"
"206","0.297806012","199.232.37.164","192.168.1.118","TCP","1418","[TCP Out-Of-Order] 443 → 45386 [ACK] Seq=271753 Ack=1 Win=57 Len=1352 TSval=2807783647 TSecr=1744330350 [TCP segment of a reassembled PDU]"
"207","0.297847325","192.168.1.118","199.232.37.164","TCP","94","45386 → 443 [ACK] Seq=1 Ack=274457 Win=3715 Len=0 TSval=1744330381 TSecr=2807783647 SLE=396137 SRE=462784 SLE=389377 SRE=393433 SLE=382617 SRE=383969"
"208","0.297910187","199.232.37.164","192.168.1.118","TCP","5474","[TCP Out-Of-Order] 443 → 45386 [ACK] Seq=274457 Ack=1 Win=57 Len=5408 TSval=2807783647 TSecr=1744330350 [TCP segment of a reassembled PDU]"
"209","0.297949975","192.168.1.118","199.232.37.164","TCP","94","45386 → 443 [ACK] Seq=1 Ack=279865 Win=3673 Len=0 TSval=1744330381 TSecr=2807783647 SLE=396137 SRE=462784 SLE=389377 SRE=393433 SLE=382617 SRE=383969"
"210","0.300473387","199.232.37.164","192.168.1.118","TCP","2770","[TCP Retransmission] 443 → 45386 [ACK] Seq=279865 Ack=1 Win=57 Len=2704 TSval=2807783648 TSecr=1744330357"
"211","0.300528600","192.168.1.118","199.232.37.164","TCP","94","45386 → 443 [ACK] Seq=1 Ack=283921 Win=3642 Len=0 TSval=1744330384 TSecr=2807783648 SLE=396137 SRE=462784 SLE=389377 SRE=393433 SLE=382617 SRE=383969"
"212","0.300570762","199.232.37.164","192.168.1.118","TCP","1418","[TCP Retransmission] 443 → 45386 [ACK] Seq=283921 Ack=1 Win=57 Len=1352 TSval=2807783648 TSecr=1744330357"
"213","0.300609425","192.168.1.118","199.232.37.164","TCP","94","45386 → 443 [ACK] Seq=1 Ack=289329 Win=3600 Len=0 TSval=1744330384 TSecr=2807783648 SLE=396137 SRE=462784 SLE=389377 SRE=393433 SLE=382617 SRE=383969"
"214","0.300639612","199.232.37.164","192.168.1.118","TCP","1418","[TCP Retransmission] 443 → 45386 [ACK] Seq=289329 Ack=1 Win=57 Len=1352 TSval=2807783648 TSecr=1744330357"
"215","0.300677762","192.168.1.118","199.232.37.164","TCP","94","45386 → 443 [ACK] Seq=1 Ack=290681 Win=3590 Len=0 TSval=1744330384 TSecr=2807783648 SLE=396137 SRE=462784 SLE=389377 SRE=393433 SLE=382617 SRE=383969"
"216","0.305410025","199.232.37.164","192.168.1.118","TCP","1418","[TCP Retransmission] 443 → 45386 [ACK] Seq=290681 Ack=1 Win=57 Len=1352 TSval=2807783648 TSecr=1744330357"
"217","0.305455537","192.168.1.118","199.232.37.164","TCP","94","45386 → 443 [ACK] Seq=1 Ack=293385 Win=3569 Len=0 TSval=1744330389 TSecr=2807783648 SLE=396137 SRE=462784 SLE=389377 SRE=393433 SLE=382617 SRE=383969"
"218","0.305498112","199.232.37.164","192.168.1.118","TCP","1418","[TCP Retransmission] 443 → 45386 [ACK] Seq=293385 Ack=1 Win=57 Len=1352 TSval=2807783648 TSecr=1744330357"
"219","0.305551100","192.168.1.118","199.232.37.164","TCP","94","45386 → 443 [ACK] Seq=1 Ack=297441 Win=3538 Len=0 TSval=1744330389 TSecr=2807783648 SLE=396137 SRE=462784 SLE=389377 SRE=393433 SLE=382617 SRE=383969"
"220","0.305591112","199.232.37.164","192.168.1.118","TCP","2770","[TCP Retransmission] 443 → 45386 [ACK] Seq=297441 Ack=1 Win=57 Len=2704 TSval=2807783648 TSecr=1744330357"
"221","0.305632400","192.168.1.118","199.232.37.164","TCP","94","45386 → 443 [ACK] Seq=1 Ack=301497 Win=3507 Len=0 TSval=1744330389 TSecr=2807783648 SLE=396137 SRE=462784 SLE=389377 SRE=393433 SLE=382617 SRE=383969"
"222","0.305751462","199.232.37.164","192.168.1.118","TCP","4122","[TCP Retransmission] 443 → 45386 [ACK] Seq=301497 Ack=1 Win=57 Len=4056 TSval=2807783648 TSecr=1744330357"
"223","0.305791525","192.168.1.118","199.232.37.164","TCP","94","45386 → 443 [ACK] Seq=1 Ack=305553 Win=3476 Len=0 TSval=1744330389 TSecr=2807783648 SLE=396137 SRE=462784 SLE=389377 SRE=393433 SLE=382617 SRE=383969"
"224","0.305830025","199.232.37.164","192.168.1.118","TCP","1418","[TCP Retransmission] 443 → 45386 [ACK] Seq=305553 Ack=1 Win=57 Len=1352 TSval=2807783648 TSecr=1744330358"
"225","0.305871187","192.168.1.118","199.232.37.164","TCP","94","45386 → 443 [ACK] Seq=1 Ack=308257 Win=3455 Len=0 TSval=1744330389 TSecr=2807783648 SLE=396137 SRE=462784 SLE=389377 SRE=393433 SLE=382617 SRE=383969"
"226","0.305896425","199.232.37.164","192.168.1.118","TCP","1418","[TCP Retransmission] 443 → 45386 [ACK] Seq=308257 Ack=1 Win=57 Len=1352 TSval=2807783648 TSecr=1744330358"
"227","0.305933162","192.168.1.118","199.232.37.164","TCP","94","45386 → 443 [ACK] Seq=1 Ack=310961 Win=3434 Len=0 TSval=1744330389 TSecr=2807783648 SLE=396137 SRE=462784 SLE=389377 SRE=393433 SLE=382617 SRE=383969"
"228","0.308686262","199.232.37.164","192.168.1.118","TCP","1418","[TCP Retransmission] 443 → 45386 [ACK] Seq=310961 Ack=1 Win=57 Len=1352 TSval=2807783650 TSecr=1744330358"
"229","0.308727437","192.168.1.118","199.232.37.164","TCP","94","45386 → 443 [ACK] Seq=1 Ack=313665 Win=3413 Len=0 TSval=1744330392 TSecr=2807783650 SLE=396137 SRE=462784 SLE=389377 SRE=393433 SLE=382617 SRE=383969"
"230","0.308767387","199.232.37.164","192.168.1.118","TCP","1418","[TCP Retransmission] 443 → 45386 [ACK] Seq=313665 Ack=1 Win=57 Len=1352 TSval=2807783650 TSecr=1744330358"
"231","0.308808700","192.168.1.118","199.232.37.164","TCP","94","45386 → 443 [ACK] Seq=1 Ack=317721 Win=3382 Len=0 TSval=1744330392 TSecr=2807783650 SLE=396137 SRE=462784 SLE=389377 SRE=393433 SLE=382617 SRE=383969"
"232","0.308845600","199.232.37.164","192.168.1.118","TCP","1418","[TCP Retransmission] 443 → 45386 [ACK] Seq=317721 Ack=1 Win=57 Len=1352 TSval=2807783650 TSecr=1744330364"
"233","0.308886562","192.168.1.118","199.232.37.164","TCP","94","45386 → 443 [ACK] Seq=1 Ack=320425 Win=3361 Len=0 TSval=1744330392 TSecr=2807783650 SLE=396137 SRE=462784 SLE=389377 SRE=393433 SLE=382617 SRE=383969"
"234","0.308909575","199.232.37.164","192.168.1.118","TCP","1418","[TCP Retransmission] 443 → 45386 [ACK] Seq=320425 Ack=1 Win=57 Len=1352 TSval=2807783650 TSecr=1744330364"
"235","0.308947137","192.168.1.118","199.232.37.164","TCP","94","45386 → 443 [ACK] Seq=1 Ack=321777 Win=3351 Len=0 TSval=1744330392 TSecr=2807783650 SLE=396137 SRE=462784 SLE=389377 SRE=393433 SLE=382617 SRE=383969"
"236","0.309039925","199.232.37.164","192.168.1.118","TCP","1418","[TCP Retransmission] 443 → 45386 [ACK] Seq=321777 Ack=1 Win=57 Len=1352 TSval=2807783650 TSecr=1744330364"
"237","0.309081950","192.168.1.118","199.232.37.164","TCP","94","45386 → 443 [ACK] Seq=1 Ack=324481 Win=3330 Len=0 TSval=1744330393 TSecr=2807783650 SLE=396137 SRE=462784 SLE=389377 SRE=393433 SLE=382617 SRE=383969"
"238","0.309126362","199.232.37.164","192.168.1.118","TCP","1418","[TCP Retransmission] 443 → 45386 [ACK] Seq=324481 Ack=1 Win=57 Len=1352 TSval=2807783650 TSecr=1744330364"
"239","0.309167687","192.168.1.118","199.232.37.164","TCP","94","45386 → 443 [ACK] Seq=1 Ack=327185 Win=3309 Len=0 TSval=1744330393 TSecr=2807783650 SLE=396137 SRE=462784 SLE=389377 SRE=393433 SLE=382617 SRE=383969"
"240","0.309217650","199.232.37.164","192.168.1.118","TCP","2770","[TCP Retransmission] 443 → 45386 [ACK] Seq=327185 Ack=1 Win=57 Len=2704 TSval=2807783650 TSecr=1744330364"
"241","0.309258487","192.168.1.118","199.232.37.164","TCP","94","45386 → 443 [ACK] Seq=1 Ack=332593 Win=3267 Len=0 TSval=1744330393 TSecr=2807783650 SLE=396137 SRE=462784 SLE=389377 SRE=393433 SLE=382617 SRE=383969"
"242","0.309295625","199.232.37.164","192.168.1.118","TCP","1418","[TCP Retransmission] 443 → 45386 [ACK] Seq=332593 Ack=1 Win=57 Len=1352 TSval=2807783650 TSecr=1744330364"
"243","0.309336212","192.168.1.118","199.232.37.164","TCP","94","45386 → 443 [ACK] Seq=1 Ack=333945 Win=3257 Len=0 TSval=1744330393 TSecr=2807783650 SLE=396137 SRE=462784 SLE=389377 SRE=393433 SLE=382617 SRE=383969"
"244","0.309357075","199.232.37.164","192.168.1.118","TCP","1418","[TCP Retransmission] 443 → 45386 [PSH, ACK] Seq=333945 Ack=1 Win=57 Len=1352 TSval=2807783650 TSecr=1744330365"
"245","0.309393400","192.168.1.118","199.232.37.164","TCP","94","45386 → 443 [ACK] Seq=1 Ack=335297 Win=3247 Len=0 TSval=1744330393 TSecr=2807783650 SLE=396137 SRE=462784 SLE=389377 SRE=393433 SLE=382617 SRE=383969"
"246","0.309451775","199.232.37.164","192.168.1.118","TCP","2770","[TCP Retransmission] 443 → 45386 [ACK] Seq=335297 Ack=1 Win=57 Len=2704 TSval=2807783650 TSecr=1744330365"
"247","0.309493375","192.168.1.118","199.232.37.164","TCP","94","45386 → 443 [ACK] Seq=1 Ack=339353 Win=3216 Len=0 TSval=1744330393 TSecr=2807783650 SLE=396137 SRE=462784 SLE=389377 SRE=393433 SLE=382617 SRE=383969"
"248","0.309550350","199.232.37.164","192.168.1.118","TCP","1418","[TCP Retransmission] 443 → 45386 [ACK] Seq=339353 Ack=1 Win=57 Len=1352 TSval=2807783650 TSecr=1744330365"
"249","0.309590712","192.168.1.118","199.232.37.164","TCP","94","45386 → 443 [ACK] Seq=1 Ack=342057 Win=3195 Len=0 TSval=1744330393 TSecr=2807783650 SLE=396137 SRE=462784 SLE=389377 SRE=393433 SLE=382617 SRE=383969"
"250","0.309640362","199.232.37.164","192.168.1.118","TCP","2770","[TCP Retransmission] 443 → 45386 [ACK] Seq=342057 Ack=1 Win=57 Len=2704 TSval=2807783650 TSecr=1744330365"
"251","0.309681300","192.168.1.118","199.232.37.164","TCP","94","45386 → 443 [ACK] Seq=1 Ack=346113 Win=3164 Len=0 TSval=1744330393 TSecr=2807783650 SLE=396137 SRE=462784 SLE=389377 SRE=393433 SLE=382617 SRE=383969"
"252","0.309706462","199.232.37.164","192.168.1.118","TCP","1418","[TCP Retransmission] 443 → 45386 [ACK] Seq=346113 Ack=1 Win=57 Len=1352 TSval=2807783650 TSecr=1744330365"
"253","0.309745300","192.168.1.118","199.232.37.164","TCP","94","45386 → 443 [ACK] Seq=1 Ack=348817 Win=3143 Len=0 TSval=1744330393 TSecr=2807783650 SLE=396137 SRE=462784 SLE=389377 SRE=393433 SLE=382617 SRE=383969"
"254","0.310541825","192.168.1.118","199.232.37.164","TLSv1","583","Client Hello"
"255","0.350420225","199.232.37.164","192.168.1.118","TCP","5474","[TCP Retransmission] 443 → 45386 [ACK] Seq=348817 Ack=1 Win=57 Len=5408 TSval=2807783650 TSecr=1744330367"
"256","0.350560912","192.168.1.118","199.232.37.164","TCP","94","45386 → 443 [ACK] Seq=1 Ack=356929 Win=3080 Len=0 TSval=1744330434 TSecr=2807783650 SLE=396137 SRE=462784 SLE=389377 SRE=393433 SLE=382617 SRE=383969"
"257","0.350749950","199.232.37.164","192.168.1.118","TCP","2770","[TCP Retransmission] 443 → 45386 [ACK] Seq=356929 Ack=1 Win=57 Len=2704 TSval=2807783650 TSecr=1744330367"
"258","0.350817325","192.168.1.118","199.232.37.164","TCP","94","45386 → 443 [ACK] Seq=1 Ack=363689 Win=3028 Len=0 TSval=1744330434 TSecr=2807783650 SLE=396137 SRE=462784 SLE=389377 SRE=393433 SLE=382617 SRE=383969"
"259","0.350934625","199.232.37.164","192.168.1.118","TCP","5474","[TCP Retransmission] 443 → 45386 [ACK] Seq=363689 Ack=1 Win=57 Len=5408 TSval=2807783650 TSecr=1744330367"
"260","0.351005362","192.168.1.118","199.232.37.164","TCP","94","45386 → 443 [ACK] Seq=1 Ack=371801 Win=2965 Len=0 TSval=1744330434 TSecr=2807783650 SLE=396137 SRE=462784 SLE=389377 SRE=393433 SLE=382617 SRE=383969"
"261","0.351097662","199.232.37.164","192.168.1.118","TCP","2770","[TCP Retransmission] 443 → 45386 [ACK] Seq=371801 Ack=1 Win=57 Len=2704 TSval=2807783650 TSecr=1744330367"
"262","0.351164812","192.168.1.118","199.232.37.164","TCP","94","45386 → 443 [ACK] Seq=1 Ack=377209 Win=2923 Len=0 TSval=1744330435 TSecr=2807783650 SLE=396137 SRE=462784 SLE=389377 SRE=393433 SLE=382617 SRE=383969"
"263","0.351225350","199.232.37.164","192.168.1.118","TCP","1418","[TCP Retransmission] 443 → 45386 [ACK] Seq=377209 Ack=1 Win=57 Len=1352 TSval=2807783650 TSecr=1744330367"
"264","0.351290212","192.168.1.118","199.232.37.164","TCP","94","45386 → 443 [ACK] Seq=1 Ack=378561 Win=2913 Len=0 TSval=1744330435 TSecr=2807783650 SLE=396137 SRE=462784 SLE=389377 SRE=393433 SLE=382617 SRE=383969"
"265","0.351353550","199.232.37.164","192.168.1.118","TCP","1418","[TCP Retransmission] 443 → 45386 [ACK] Seq=378561 Ack=1 Win=57 Len=1352 TSval=2807783652 TSecr=1744330373"
"266","0.351419162","192.168.1.118","199.232.37.164","TCP","94","45386 → 443 [ACK] Seq=1 Ack=381265 Win=2892 Len=0 TSval=1744330435 TSecr=2807783652 SLE=396137 SRE=462784 SLE=389377 SRE=393433 SLE=382617 SRE=383969"
"267","0.351479275","199.232.37.164","192.168.1.118","TCP","1418","[TCP Retransmission] 443 → 45386 [ACK] Seq=381265 Ack=1 Win=57 Len=1352 TSval=2807783652 TSecr=1744330373"
"268","0.351562537","192.168.1.118","199.232.37.164","TCP","86","45386 → 443 [ACK] Seq=1 Ack=383969 Win=2871 Len=0 TSval=1744330435 TSecr=2807783652 SLE=396137 SRE=462784 SLE=389377 SRE=393433"
"269","0.351607250","199.232.37.164","192.168.1.118","TCP","1418","[TCP Retransmission] 443 → 45386 [ACK] Seq=383969 Ack=1 Win=57 Len=1352 TSval=2807783652 TSecr=1744330373"
"270","0.351667662","192.168.1.118","199.232.37.164","TCP","86","45386 → 443 [ACK] Seq=1 Ack=385321 Win=2861 Len=0 TSval=1744330435 TSecr=2807783652 SLE=396137 SRE=462784 SLE=389377 SRE=393433"
"271","0.353117350","199.232.37.164","192.168.1.118","TCP","4122","[TCP Retransmission] 443 → 45386 [ACK] Seq=385321 Ack=1 Win=57 Len=4056 TSval=2807783652 TSecr=1744330373"
"272","0.353182875","192.168.1.118","199.232.37.164","TCP","78","45386 → 443 [ACK] Seq=1 Ack=393433 Win=2951 Len=0 TSval=1744330437 TSecr=2807783652 SLE=396137 SRE=462784"
"273","0.353265912","209.18.47.62","192.168.1.118","DNS","212","Standard query response 0xa19d AAAA typeface.nyt.com CNAME nyt5-assets.prd.map.nytimes.com CNAME nytimes.map.fastly.net SOA ns1.fastly.net"
"274","0.353336000","199.232.37.164","192.168.1.118","TCP","66","443 → 45396 [ACK] Seq=1 Ack=518 Win=28160 Len=0 TSval=2805696387 TSecr=1744330394"
"275","0.353470662","199.232.37.164","192.168.1.118","TLSv1.2","5697","Server Hello, Certificate, Server Key Exchange, Server Hello Done"
"276","0.353555425","192.168.1.118","199.232.37.164","TCP","66","45396 → 443 [ACK] Seq=518 Ack=5632 Win=58752 Len=0 TSval=1744330437 TSecr=2805696387"
"277","0.353598475","199.232.37.164","192.168.1.118","TCP","2770","[TCP Retransmission] 443 → 45386 [ACK] Seq=393433 Ack=1 Win=57 Len=2704 TSval=2807783652 TSecr=1744330373"
"278","0.353664137","192.168.1.118","199.232.37.164","TCP","66","45386 → 443 [ACK] Seq=1 Ack=462784 Win=3018 Len=0 TSval=1744330437 TSecr=2807783652"
"279","0.354201775","192.168.1.118","199.232.37.164","TCP","74","45398 → 443 [SYN] Seq=0 Win=64240 Len=0 MSS=1460 SACK_PERM=1 TSval=1744330438 TSecr=0 WS=128"
"280","0.356991525","192.168.1.118","199.232.37.164","TLSv1.2","192","Client Key Exchange, Change Cipher Spec, Encrypted Handshake Message"
"281","0.373207850","199.232.37.164","192.168.1.118","TCP","74","443 → 45398 [SYN, ACK] Seq=0 Ack=1 Win=27040 Len=0 MSS=1364 SACK_PERM=1 TSval=2807548273 TSecr=1744330438 WS=512"
"282","0.373330150","192.168.1.118","199.232.37.164","TCP","66","45398 → 443 [ACK] Seq=1 Ack=1 Win=64256 Len=0 TSval=1744330457 TSecr=2807548273"
"283","0.384451775","199.232.37.164","192.168.1.118","TLSv1.2","117","Change Cipher Spec, Encrypted Handshake Message"
"284","0.435571862","192.168.1.118","199.232.37.164","TCP","66","45396 → 443 [ACK] Seq=644 Ack=5683 Win=64128 Len=0 TSval=1744330519 TSecr=2805696401"
"285","0.464715450","192.168.1.118","199.232.37.164","TLSv1","583","Client Hello"
"286","0.465074175","192.168.1.118","199.232.37.164","TLSv1.2","440","Application Data"
"287","0.485121475","199.232.37.164","192.168.1.118","TCP","66","443 → 45398 [ACK] Seq=1 Ack=518 Win=28160 Len=0 TSval=2807548301 TSecr=1744330548"
"288","0.486597712","199.232.37.164","192.168.1.118","TCP","1418","[TCP segment of a reassembled PDU]"
"289","0.486667612","192.168.1.118","199.232.37.164","TCP","66","45396 → 443 [ACK] Seq=1018 Ack=7035 Win=63104 Len=0 TSval=1744330570 TSecr=2805696426"
"290","0.488685750","199.232.37.164","192.168.1.118","TLSv1.2","6826","Application Data, Application Data, Application Data, Application Data, Application Data, Application Data"
"291","0.488761887","192.168.1.118","199.232.37.164","TCP","66","45396 → 443 [ACK] Seq=1018 Ack=13795 Win=56448 Len=0 TSval=1744330572 TSecr=2805696426"
"292","0.490998512","199.232.37.164","192.168.1.118","TLSv1.2","4122","Application Data, Application Data, Application Data"
"293","0.491069412","192.168.1.118","199.232.37.164","TCP","66","45396 → 443 [ACK] Seq=1018 Ack=17851 Win=52480 Len=0 TSval=1744330575 TSecr=2805696426"
"294","0.492163287","199.232.37.164","192.168.1.118","TLSv1.2","1418","Application Data [TCP segment of a reassembled PDU]"
"295","0.492199437","192.168.1.118","199.232.37.164","TCP","66","45396 → 443 [ACK] Seq=1018 Ack=19203 Win=51200 Len=0 TSval=1744330576 TSecr=2805696426"
"296","0.492219025","199.232.37.164","192.168.1.118","TLSv1.2","1418","Server Hello"
"297","0.492237687","192.168.1.118","199.232.37.164","TCP","66","45398 → 443 [ACK] Seq=518 Ack=1353 Win=63104 Len=0 TSval=1744330576 TSecr=2807548301"
"298","0.495883437","199.232.37.164","192.168.1.118","TLSv1.2","4345","Certificate, Server Key Exchange, Server Hello Done"
"299","0.495951112","192.168.1.118","199.232.37.164","TCP","66","45398 → 443 [ACK] Seq=518 Ack=5632 Win=58880 Len=0 TSval=1744330579 TSecr=2807548301"
"300","0.498820787","192.168.1.118","199.232.37.164","TLSv1.2","192","Client Key Exchange, Change Cipher Spec, Encrypted Handshake Message"
"301","0.507780212","199.232.37.164","192.168.1.118","TLSv1.2","1418","Application Data [TCP segment of a reassembled PDU]"
"302","0.507844612","192.168.1.118","199.232.37.164","TCP","66","45396 → 443 [ACK] Seq=1018 Ack=20555 Win=63104 Len=0 TSval=1744330591 TSecr=2805696430"
"303","0.509271337","199.232.37.164","192.168.1.118","TLSv1.2","1418","Application Data [TCP segment of a reassembled PDU]"
"304","0.509335575","192.168.1.118","199.232.37.164","TCP","66","45396 → 443 [ACK] Seq=1018 Ack=21907 Win=61824 Len=0 TSval=1744330593 TSecr=2805696430"
"305","0.518057737","199.232.37.164","192.168.1.118","TLSv1.2","1418","Application Data [TCP segment of a reassembled PDU]"
"306","0.518119312","192.168.1.118","199.232.37.164","TCP","66","45396 → 443 [ACK] Seq=1018 Ack=23259 Win=63104 Len=0 TSval=1744330602 TSecr=2805696433"
"307","0.521172500","199.232.37.164","192.168.1.118","TLSv1.2","5474","Application Data, Application Data, Application Data, Application Data"
"308","0.521230987","192.168.1.118","199.232.37.164","TCP","66","45396 → 443 [ACK] Seq=1018 Ack=28667 Win=67840 Len=0 TSval=1744330605 TSecr=2805696433"
"309","0.521335262","199.232.37.164","192.168.1.118","TLSv1.2","6826","Application Data, Application Data, Application Data, Application Data, Application Data"
"310","0.521354662","192.168.1.118","199.232.37.164","TCP","66","45396 → 443 [ACK] Seq=1018 Ack=35427 Win=61184 Len=0 TSval=1744330605 TSecr=2805696433"
"311","0.522696775","199.232.37.164","192.168.1.118","TLSv1.2","2770","Application Data, Application Data"
"312","0.522726462","192.168.1.118","199.232.37.164","TCP","66","45396 → 443 [ACK] Seq=1018 Ack=38131 Win=58496 Len=0 TSval=1744330606 TSecr=2805696433"
"313","0.526823337","199.232.37.164","192.168.1.118","TLSv1.2","2770","Application Data, Application Data"
"314","0.526839375","192.168.1.118","199.232.37.164","TCP","66","45396 → 443 [ACK] Seq=1018 Ack=40835 Win=71936 Len=0 TSval=1744330610 TSecr=2805696433"
"315","0.528395850","199.232.37.164","192.168.1.118","TCP","66","[TCP Dup ACK 287#1] 443 → 45398 [ACK] Seq=5632 Ack=518 Win=28160 Len=0 TSval=2807548311 TSecr=1744330579"
"316","0.528424287","199.232.37.164","192.168.1.118","TLSv1.2","117","Change Cipher Spec, Encrypted Handshake Message"
"317","0.528439737","199.232.37.164","192.168.1.118","TLSv1.2","2770","Application Data [TCP segment of a reassembled PDU]"
"318","0.528454312","192.168.1.118","199.232.37.164","TCP","66","45396 → 443 [ACK] Seq=1018 Ack=43539 Win=69248 Len=0 TSval=1744330612 TSecr=2805696434"
"319","0.531357150","199.232.37.164","192.168.1.118","TLSv1.2","1418","Application Data [TCP segment of a reassembled PDU]"
"320","0.531379050","192.168.1.118","199.232.37.164","TCP","66","45396 → 443 [ACK] Seq=1018 Ack=44891 Win=67968 Len=0 TSval=1744330615 TSecr=2805696436"
"321","0.532531350","192.168.1.118","199.232.37.164","TLSv1.2","309","Application Data"
"322","0.532717725","199.232.37.164","192.168.1.118","TLSv1.2","1418","Application Data [TCP segment of a reassembled PDU]"
"323","0.534387225","199.232.37.164","192.168.1.118","TLSv1.2","1418","Application Data [TCP segment of a reassembled PDU]"
"324","0.534425637","199.232.37.164","192.168.1.118","TLSv1.2","2770","Application Data, Application Data"
"325","0.535471700","199.232.37.164","192.168.1.118","TLSv1.2","1418","Application Data [TCP segment of a reassembled PDU]"
"326","0.537068300","199.232.37.164","192.168.1.118","TLSv1.2","1418","Application Data [TCP segment of a reassembled PDU]"
"327","0.538316175","199.232.37.164","192.168.1.118","TLSv1.2","1418","Application Data [TCP segment of a reassembled PDU]"
"328","0.539522437","199.232.37.164","192.168.1.118","TLSv1.2","1418","Application Data [TCP segment of a reassembled PDU]"
"329","0.540426837","199.232.37.164","192.168.1.118","TLSv1.2","1418","Application Data [TCP segment of a reassembled PDU]"
"330","0.541852925","199.232.37.164","192.168.1.118","TLSv1.2","2770","Application Data, Application Data"
"331","0.542799050","199.232.37.164","192.168.1.118","TLSv1.2","1418","Application Data [TCP segment of a reassembled PDU]"
"332","0.542985762","192.168.1.118","199.232.37.164","TCP","66","45396 → 443 [ACK] Seq=1018 Ack=61115 Win=61696 Len=0 TSval=1744330626 TSecr=2805696436"
"333","0.551789650","199.232.37.164","192.168.1.118","TLSv1.2","1418","Application Data [TCP segment of a reassembled PDU]"
"334","0.554295612","199.232.37.164","192.168.1.118","TLSv1.2","2770","Application Data, Application Data"
"335","0.554346225","199.232.37.164","192.168.1.118","TLSv1.2","2770","Application Data, Application Data"
"336","0.554401600","199.232.37.164","192.168.1.118","TLSv1.2","5474","Application Data, Application Data, Application Data, Application Data"
"337","0.554449862","199.232.37.164","192.168.1.118","TLSv1.2","1590","Application Data, Application Data"
"338","0.554479512","199.232.37.164","192.168.1.118","TLSv1.2","8178","Application Data, Application Data, Application Data, Application Data, Application Data"
"339","0.554738687","192.168.1.118","199.232.37.164","TCP","66","45398 → 443 [ACK] Seq=887 Ack=7207 Win=62720 Len=0 TSval=1744330638 TSecr=2807548318"
"340","0.554935762","192.168.1.118","199.232.37.164","TCP","66","45396 → 443 [ACK] Seq=1018 Ack=81395 Win=41472 Len=0 TSval=1744330638 TSecr=2805696439"
"341","0.555573362","199.232.37.164","192.168.1.118","TLSv1.2","5474","Application Data, Application Data, Application Data, Application Data"
"342","0.557293812","199.232.37.164","192.168.1.118","TLSv1.2","2770","Application Data, Application Data"
"343","0.558483562","199.232.37.164","192.168.1.118","TLSv1.2","4122","Application Data, Application Data, Application Data"
"344","0.559427287","199.232.37.164","192.168.1.118","TLSv1.2","1418","Application Data [TCP segment of a reassembled PDU]"
"345","0.567154375","192.168.1.118","199.232.37.164","TCP","66","45396 → 443 [ACK] Seq=1018 Ack=94915 Win=28032 Len=0 TSval=1744330651 TSecr=2805696442"
"346","0.578122212","199.232.37.164","192.168.1.118","TLSv1.2","1157","Application Data, Application Data, Encrypted Alert"
"347","0.618579137","192.168.1.118","199.232.37.164","TCP","66","45396 → 443 [ACK] Seq=1018 Ack=96007 Win=71936 Len=0 TSval=1744330702 TSecr=2805696443"
"348","0.629681062","192.168.1.118","199.232.37.164","TLSv1.2","97","Encrypted Alert"
"349","0.631391450","192.168.1.118","199.232.37.164","TCP","66","45396 → 443 [RST, ACK] Seq=1049 Ack=96007 Win=71936 Len=0 TSval=1744330715 TSecr=2805696443"
"350","0.651763975","199.232.37.164","192.168.1.118","TCP","54","443 → 45396 [RST] Seq=96007 Win=0 Len=0"
"351","2.553430225","192.168.1.118","192.168.1.102","TCP","176","44768 → 8009 [PSH, ACK] Seq=1 Ack=1 Win=501 Len=110 TSval=2236054097 TSecr=3057586 [TCP segment of a reassembled PDU]"
"352","2.572793100","192.168.1.102","192.168.1.118","TCP","176","8009 → 44768 [PSH, ACK] Seq=1 Ack=111 Win=294 Len=110 TSval=3058090 TSecr=2236054097 [TCP segment of a reassembled PDU]"
"353","2.572961412","192.168.1.118","192.168.1.102","TCP","66","44768 → 8009 [ACK] Seq=111 Ack=111 Win=501 Len=0 TSval=2236054116 TSecr=3058090"
"354","2.579070637","192.168.1.118","172.217.3.99","TCP","66","41374 → 80 [ACK] Seq=1 Ack=1 Win=502 Len=0 TSval=4166905088 TSecr=2476036325"
"355","2.616577525","172.217.3.99","192.168.1.118","TCP","66","[TCP ACKed unseen segment] 80 → 41374 [ACK] Seq=1 Ack=2 Win=240 Len=0 TSval=2476084260 TSecr=4166857196"
"356","2.967681700","192.168.1.104","255.255.255.255","UDP","217","49154 → 6666 Len=175"
"357","4.503937475","192.168.1.102","224.0.0.251","MDNS","183","Standard query response 0x0000 SRV, cache flush 0 0 8009 2c3f16b2-da5c-4b6f-d6cf-bfba61c12490.local"
"358","5.937682937","192.168.1.104","255.255.255.255","UDP","217","49154 → 6666 Len=175"
"359","7.577489850","192.168.1.118","192.168.1.102","TCP","176","44768 → 8009 [PSH, ACK] Seq=111 Ack=111 Win=501 Len=110 TSval=2236059121 TSecr=3058090 [TCP segment of a reassembled PDU]"
"360","7.595347237","192.168.1.102","192.168.1.118","TCP","176","8009 → 44768 [PSH, ACK] Seq=111 Ack=221 Win=294 Len=110 TSval=3058593 TSecr=2236059121 [TCP segment of a reassembled PDU]"
"361","7.595585762","192.168.1.118","192.168.1.102","TCP","66","44768 → 8009 [ACK] Seq=221 Ack=221 Win=501 Len=0 TSval=2236059139 TSecr=3058593"
"362","8.189763125","192.168.1.119","224.0.0.251","MDNS","176","Standard query 0x0000 PTR _homekit._tcp.local, "QM" question PTR _companion-link._tcp.local, "QM" question PTR _airplay._tcp.local, "QM" question PTR _raop._tcp.local, "QM" question PTR cjqg._companion-link._tcp.local OPT"
"363","8.906318212","192.168.1.1","224.0.0.1","IGMPv2","42","Membership Query, general"
