frame.number,_ws.col.Time,_ws.col.Source,_ws.col.Destination,_ws.col.Protocol,frame.len,_ws.col.Info
"1","0.000000000","192.168.1.118","23.41.246.174","TCP","66","44766 → 443 [ACK] Seq=1 Ack=1 Win=501 Len=0 TSval=454013088 TSecr=310008497"
"2","0.001313150","192.168.1.118","23.41.246.174","TLSv1.2","839","Application Data"
"3","0.001438688","192.168.1.118","23.41.246.174","TLSv1.2","836","Application Data"
"4","0.001533013","192.168.1.118","23.41.246.174","TLSv1.2","840","Application Data"
"5","0.033371938","23.41.246.174","192.168.1.118","TCP","1514","[TCP segment of a reassembled PDU]"
"6","0.036431125","23.41.246.174","192.168.1.118","TCP","5858","443 → 44766 [ACK] Seq=1449 Ack=775 Win=260 Len=5792 TSval=310008547 TSecr=454013090 [TCP segment of a reassembled PDU]"
"7","0.037096575","23.41.246.174","192.168.1.118","TLSv1.2","13098","Application Data [TCP segment of a reassembled PDU]"
"8","0.037140875","23.41.246.174","192.168.1.118","TCP","4410","[TCP segment of a reassembled PDU]"
"9","0.037210713","192.168.1.118","23.41.246.174","TCP","66","44764 → 443 [ACK] Seq=771 Ack=4345 Win=569 Len=0 TSval=454013125 TSecr=310008547"
"10","0.039518563","23.41.246.174","192.168.1.118","TCP","5858","443 → 44764 [ACK] Seq=4345 Ack=771 Win=260 Len=5792 TSval=310008547 TSecr=454013089 [TCP segment of a reassembled PDU]"
"11","0.039571838","192.168.1.118","23.41.246.174","TCP","66","44764 → 443 [ACK] Seq=771 Ack=10137 Win=660 Len=0 TSval=454013128 TSecr=310008547"
"12","0.040170788","23.41.246.174","192.168.1.118","TLSv1.2","1409","Application Data"
"13","0.040206050","23.41.246.174","192.168.1.118","TLSv1.2","10202","Application Data [TCP segment of a reassembled PDU]"
"14","0.040256425","192.168.1.118","23.41.246.174","TCP","66","44764 → 443 [ACK] Seq=771 Ack=20273 Win=818 Len=0 TSval=454013128 TSecr=310008547"
"15","0.040286475","23.41.246.174","192.168.1.118","TCP","5858","[TCP segment of a reassembled PDU]"
"16","0.040343150","192.168.1.118","23.41.246.174","TCP","66","44762 → 443 [ACK] Seq=774 Ack=5793 Win=862 Len=0 TSval=454013128 TSecr=310008547"
"17","0.044048675","23.41.246.174","192.168.1.118","TCP","2962","443 → 44764 [ACK] Seq=20273 Ack=771 Win=260 Len=2896 TSval=310008547 TSecr=454013089 [TCP segment of a reassembled PDU]"
"18","0.044107413","192.168.1.118","23.41.246.174","TCP","66","44764 → 443 [ACK] Seq=771 Ack=23169 Win=863 Len=0 TSval=454013132 TSecr=310008547"
"19","0.044148138","23.41.246.174","192.168.1.118","TCP","2962","443 → 44762 [ACK] Seq=5793 Ack=774 Win=294 Len=2896 TSval=310008547 TSecr=454013089 [TCP segment of a reassembled PDU]"
"20","0.044208725","192.168.1.118","23.41.246.174","TCP","66","44762 → 443 [ACK] Seq=774 Ack=8689 Win=899 Len=0 TSval=454013132 TSecr=310008547"
"21","0.044634413","23.41.246.174","192.168.1.118","TCP","2962","443 → 44764 [ACK] Seq=23169 Ack=771 Win=260 Len=2896 TSval=310008547 TSecr=454013089 [TCP segment of a reassembled PDU]"
"22","0.044694613","192.168.1.118","23.41.246.174","TCP","66","44764 → 443 [ACK] Seq=771 Ack=26065 Win=908 Len=0 TSval=454013133 TSecr=310008547"
"23","0.044806825","23.41.246.174","192.168.1.118","TCP","2962","443 → 44762 [ACK] Seq=8689 Ack=774 Win=294 Len=2896 TSval=310008548 TSecr=454013089 [TCP segment of a reassembled PDU]"
"24","0.044891513","23.41.246.174","192.168.1.118","TCP","2962","443 → 44764 [ACK] Seq=26065 Ack=771 Win=260 Len=2896 TSval=310008548 TSecr=454013089 [TCP segment of a reassembled PDU]"
"25","0.044969538","192.168.1.118","23.41.246.174","TCP","66","44764 → 443 [ACK] Seq=771 Ack=28961 Win=954 Len=0 TSval=454013133 TSecr=310008548"
"26","0.045064475","23.41.246.174","192.168.1.118","TCP","2962","443 → 44762 [ACK] Seq=11585 Ack=774 Win=294 Len=2896 TSval=310008549 TSecr=454013089 [TCP segment of a reassembled PDU]"
"27","0.045139213","23.41.246.174","192.168.1.118","TCP","2962","443 → 44764 [ACK] Seq=28961 Ack=771 Win=260 Len=2896 TSval=310008549 TSecr=454013089 [TCP segment of a reassembled PDU]"
"28","0.045199825","192.168.1.118","23.41.246.174","TCP","66","44764 → 443 [ACK] Seq=771 Ack=31857 Win=999 Len=0 TSval=454013133 TSecr=310008549"
"29","0.045236713","23.41.246.174","192.168.1.118","TLSv1.2","2962","Application Data [TCP segment of a reassembled PDU]"
"30","0.051590188","23.41.246.174","192.168.1.118","TLSv1.2","2962","Application Data [TCP segment of a reassembled PDU]"
"31","0.051654688","192.168.1.118","23.41.246.174","TCP","66","44764 → 443 [ACK] Seq=771 Ack=34753 Win=1044 Len=0 TSval=454013140 TSecr=310008550"
"32","0.051686938","23.41.246.174","192.168.1.118","TCP","2962","443 → 44762 [ACK] Seq=17377 Ack=774 Win=294 Len=2896 TSval=310008551 TSecr=454013089 [TCP segment of a reassembled PDU]"
"33","0.052086575","23.41.246.174","192.168.1.118","TLSv1.2","2962","Application Data [TCP segment of a reassembled PDU]"
"34","0.052113775","192.168.1.118","23.41.246.174","TCP","66","44764 → 443 [ACK] Seq=771 Ack=37649 Win=1089 Len=0 TSval=454013140 TSecr=310008551"
"35","0.052154413","23.41.246.174","192.168.1.118","TCP","2962","443 → 44762 [ACK] Seq=20273 Ack=774 Win=294 Len=2896 TSval=310008552 TSecr=454013089 [TCP segment of a reassembled PDU]"
"36","0.052204200","23.41.246.174","192.168.1.118","TCP","2962","443 → 44764 [ACK] Seq=37649 Ack=771 Win=260 Len=2896 TSval=310008552 TSecr=454013089 [TCP segment of a reassembled PDU]"
"37","0.052233475","192.168.1.118","23.41.246.174","TCP","66","44764 → 443 [ACK] Seq=771 Ack=40545 Win=1135 Len=0 TSval=454013140 TSecr=310008552"
"38","0.052272813","23.41.246.174","192.168.1.118","TCP","2962","443 → 44762 [ACK] Seq=23169 Ack=774 Win=294 Len=2896 TSval=310008553 TSecr=454013089 [TCP segment of a reassembled PDU]"
"39","0.052306338","23.41.246.174","192.168.1.118","TCP","2962","443 → 44764 [ACK] Seq=40545 Ack=771 Win=260 Len=2896 TSval=310008554 TSecr=454013089 [TCP segment of a reassembled PDU]"
"40","0.052335063","192.168.1.118","23.41.246.174","TCP","66","44764 → 443 [ACK] Seq=771 Ack=43441 Win=1180 Len=0 TSval=454013140 TSecr=310008554"
"41","0.052352075","23.41.246.174","192.168.1.118","TCP","2962","443 → 44762 [ACK] Seq=26065 Ack=774 Win=294 Len=2896 TSval=310008554 TSecr=454013089 [TCP segment of a reassembled PDU]"
"42","0.056078500","23.41.246.174","192.168.1.118","TCP","2962","443 → 44764 [ACK] Seq=43441 Ack=771 Win=260 Len=2896 TSval=310008555 TSecr=454013089 [TCP segment of a reassembled PDU]"
"43","0.056106113","192.168.1.118","23.41.246.174","TCP","66","44764 → 443 [ACK] Seq=771 Ack=46337 Win=1225 Len=0 TSval=454013144 TSecr=310008555"
"44","0.056669188","23.41.246.174","192.168.1.118","TCP","2962","443 → 44762 [ACK] Seq=28961 Ack=774 Win=294 Len=2896 TSval=310008555 TSecr=454013089 [TCP segment of a reassembled PDU]"
"45","0.056710175","23.41.246.174","192.168.1.118","TCP","2962","443 → 44764 [ACK] Seq=46337 Ack=771 Win=260 Len=2896 TSval=310008556 TSecr=454013089 [TCP segment of a reassembled PDU]"
"46","0.056738225","192.168.1.118","23.41.246.174","TCP","66","44764 → 443 [ACK] Seq=771 Ack=49233 Win=1270 Len=0 TSval=454013145 TSecr=310008556"
"47","0.056784025","23.41.246.174","192.168.1.118","TLSv1.2","2962","Application Data, Application Data"
"48","0.056824563","23.41.246.174","192.168.1.118","TLSv1.2","2962","Application Data [TCP segment of a reassembled PDU]"
"49","0.056852950","192.168.1.118","23.41.246.174","TCP","66","44764 → 443 [ACK] Seq=771 Ack=52129 Win=1316 Len=0 TSval=454013145 TSecr=310008557"
"50","0.056890863","23.41.246.174","192.168.1.118","TCP","2962","443 → 44762 [ACK] Seq=34753 Ack=774 Win=294 Len=2896 TSval=310008557 TSecr=454013089 [TCP segment of a reassembled PDU]"
"51","0.056934463","23.41.246.174","192.168.1.118","TCP","2962","443 → 44764 [ACK] Seq=52129 Ack=771 Win=260 Len=2896 TSval=310008558 TSecr=454013089 [TCP segment of a reassembled PDU]"
"52","0.056961600","192.168.1.118","23.41.246.174","TCP","66","44764 → 443 [ACK] Seq=771 Ack=55025 Win=1361 Len=0 TSval=454013145 TSecr=310008558"
"53","0.056979213","23.41.246.174","192.168.1.118","TCP","2962","443 → 44762 [ACK] Seq=37649 Ack=774 Win=294 Len=2896 TSval=310008558 TSecr=454013089 [TCP segment of a reassembled PDU]"
"54","0.061067513","23.41.246.174","192.168.1.118","TCP","2962","443 → 44764 [ACK] Seq=55025 Ack=771 Win=260 Len=2896 TSval=310008559 TSecr=454013089 [TCP segment of a reassembled PDU]"
"55","0.061097525","192.168.1.118","23.41.246.174","TCP","66","44764 → 443 [ACK] Seq=771 Ack=57921 Win=1406 Len=0 TSval=454013149 TSecr=310008559"
"56","0.061651425","23.41.246.174","192.168.1.118","TCP","2962","443 → 44764 [PSH, ACK] Seq=57921 Ack=771 Win=260 Len=2896 TSval=310008560 TSecr=454013089 [TCP segment of a reassembled PDU]"
"57","0.061698200","192.168.1.118","23.41.246.174","TCP","66","44764 → 443 [ACK] Seq=771 Ack=60817 Win=1451 Len=0 TSval=454013150 TSecr=310008560"
"58","0.061744800","23.41.246.174","192.168.1.118","TCP","2962","443 → 44762 [ACK] Seq=40545 Ack=774 Win=294 Len=2896 TSval=310008560 TSecr=454013089 [TCP segment of a reassembled PDU]"
"59","0.061814663","23.41.246.174","192.168.1.118","TCP","2962","443 → 44762 [ACK] Seq=43441 Ack=774 Win=294 Len=2896 TSval=310008561 TSecr=454013089 [TCP segment of a reassembled PDU]"
"60","0.061873838","23.41.246.174","192.168.1.118","TCP","2962","443 → 44762 [ACK] Seq=46337 Ack=774 Win=294 Len=2896 TSval=310008562 TSecr=454013089 [TCP segment of a reassembled PDU]"
"61","0.061951688","23.41.246.174","192.168.1.118","TLSv1.2","2962","Application Data [TCP segment of a reassembled PDU]"
"62","0.062016338","23.41.246.174","192.168.1.118","TCP","2962","443 → 44762 [ACK] Seq=52129 Ack=774 Win=294 Len=2896 TSval=310008564 TSecr=454013089 [TCP segment of a reassembled PDU]"
"63","0.062066063","23.41.246.174","192.168.1.118","TCP","2962","443 → 44762 [ACK] Seq=55025 Ack=774 Win=294 Len=2896 TSval=310008565 TSecr=454013089 [TCP segment of a reassembled PDU]"
"64","0.070730613","23.41.246.174","192.168.1.118","TCP","2962","443 → 44762 [ACK] Seq=57921 Ack=774 Win=294 Len=2896 TSval=310008566 TSecr=454013089 [TCP segment of a reassembled PDU]"
"65","0.070788088","23.41.246.174","192.168.1.118","TCP","2962","443 → 44762 [ACK] Seq=60817 Ack=774 Win=294 Len=2896 TSval=310008567 TSecr=454013089 [TCP segment of a reassembled PDU]"
"66","0.071292138","23.41.246.174","192.168.1.118","TCP","2962","443 → 44762 [ACK] Seq=63713 Ack=774 Win=294 Len=2896 TSval=310008568 TSecr=454013089 [TCP segment of a reassembled PDU]"
"67","0.071354888","23.41.246.174","192.168.1.118","TLSv1.2","2962","Application Data [TCP segment of a reassembled PDU]"
"68","0.071474013","23.41.246.174","192.168.1.118","TCP","2962","443 → 44762 [ACK] Seq=69505 Ack=774 Win=294 Len=2896 TSval=310008570 TSecr=454013089 [TCP segment of a reassembled PDU]"
"69","0.071499175","23.41.246.174","192.168.1.118","TLSv1.2","8754","Application Data [TCP segment of a reassembled PDU]"
"70","0.073968725","192.168.1.118","23.41.246.174","TCP","66","44766 → 443 [ACK] Seq=775 Ack=21616 Win=333 Len=0 TSval=454013162 TSecr=310008547"
"71","0.074160425","23.41.246.174","192.168.1.118","TCP","2962","443 → 44764 [ACK] Seq=69505 Ack=771 Win=260 Len=2896 TSval=310008575 TSecr=454013133 [TCP segment of a reassembled PDU]"
"72","0.074225438","23.41.246.174","192.168.1.118","TCP","2962","443 → 44764 [ACK] Seq=72401 Ack=771 Win=260 Len=2896 TSval=310008576 TSecr=454013133 [TCP segment of a reassembled PDU]"
"73","0.075554263","23.41.246.174","192.168.1.118","TLSv1.2","2962","Application Data [TCP segment of a reassembled PDU]"
"74","0.075636488","23.41.246.174","192.168.1.118","TCP","2962","443 → 44764 [ACK] Seq=78193 Ack=771 Win=260 Len=2896 TSval=310008578 TSecr=454013133 [TCP segment of a reassembled PDU]"
"75","0.075796138","23.41.246.174","192.168.1.118","TCP","2962","443 → 44764 [ACK] Seq=81089 Ack=771 Win=260 Len=2896 TSval=310008579 TSecr=454013133 [TCP segment of a reassembled PDU]"
"76","0.075836438","23.41.246.174","192.168.1.118","TLSv1.2","8754","Application Data [TCP segment of a reassembled PDU]"
"77","0.075896400","192.168.1.118","23.41.246.174","TCP","66","44762 → 443 [ACK] Seq=774 Ack=81089 Win=334 Len=0 TSval=454013164 TSecr=310008548"
"78","0.104736500","23.41.246.174","192.168.1.118","TCP","2962","443 → 44764 [ACK] Seq=83985 Ack=771 Win=260 Len=2896 TSval=310008580 TSecr=454013133 [TCP segment of a reassembled PDU]"
"79","0.104815463","192.168.1.118","23.41.246.174","TCP","66","44764 → 443 [ACK] Seq=771 Ack=86881 Win=1248 Len=0 TSval=454013193 TSecr=310008575"
"80","0.104911200","23.41.246.174","192.168.1.118","TCP","2962","443 → 44764 [ACK] Seq=86881 Ack=771 Win=260 Len=2896 TSval=310008581 TSecr=454013133 [TCP segment of a reassembled PDU]"
"81","0.105307000","23.41.246.174","192.168.1.118","TLSv1.2","7306","Application Data [TCP segment of a reassembled PDU]"
"82","0.105445913","23.41.246.174","192.168.1.118","TCP","4410","443 → 44764 [ACK] Seq=97017 Ack=771 Win=260 Len=4344 TSval=310008583 TSecr=454013145 [TCP segment of a reassembled PDU]"
"83","0.105590413","23.41.246.174","192.168.1.118","TCP","4410","443 → 44764 [ACK] Seq=101361 Ack=771 Win=260 Len=4344 TSval=310008584 TSecr=454013145 [TCP segment of a reassembled PDU]"
"84","0.105646738","23.41.246.174","192.168.1.118","TLSv1.2","1088","Application Data"
"85","0.126325900","23.41.246.174","192.168.1.118","TCP","5858","443 → 44762 [ACK] Seq=81089 Ack=774 Win=294 Len=5792 TSval=310008612 TSecr=454013164 [TCP segment of a reassembled PDU]"
"86","0.127121250","23.41.246.174","192.168.1.118","TLSv1.2","17442","Application Data [TCP segment of a reassembled PDU]"
"87","0.136964513","192.168.1.118","23.41.246.174","TCP","66","44762 → 443 [ACK] Seq=774 Ack=104257 Win=899 Len=0 TSval=454013225 TSecr=310008612"
"88","0.137211688","192.168.1.118","23.41.246.174","TCP","66","44764 → 443 [ACK] Seq=771 Ack=106727 Win=1093 Len=0 TSval=454013225 TSecr=310008581"
"89","0.137629863","192.168.1.118","23.41.246.174","TLSv1.2","834","Application Data"
"90","0.137742575","192.168.1.118","23.41.246.174","TLSv1.2","846","Application Data"
"91","0.137810200","23.41.246.174","192.168.1.118","TCP","2962","443 → 44762 [ACK] Seq=104257 Ack=774 Win=294 Len=2896 TSval=310008612 TSecr=454013164 [TCP segment of a reassembled PDU]"
"92","0.137892650","192.168.1.118","23.41.246.174","TCP","66","44762 → 443 [ACK] Seq=774 Ack=107153 Win=945 Len=0 TSval=454013226 TSecr=310008612"
"93","0.139544900","23.41.246.174","192.168.1.118","TLSv1.2","8754","Application Data [TCP segment of a reassembled PDU]"
"94","0.139651650","192.168.1.118","23.41.246.174","TCP","66","44762 → 443 [ACK] Seq=774 Ack=115841 Win=1080 Len=0 TSval=454013228 TSecr=310008612"
"95","0.139886000","23.41.246.174","192.168.1.118","TLSv1.2","6524","Application Data, Application Data"
"96","0.140000250","192.168.1.118","23.41.246.174","TCP","66","44762 → 443 [ACK] Seq=774 Ack=122299 Win=1181 Len=0 TSval=454013228 TSecr=310008612"
"97","0.140668488","192.168.1.118","23.41.246.174","TLSv1.2","847","Application Data"
"98","0.149024875","192.168.1.118","23.41.246.174","TLSv1.2","848","Application Data"
"99","0.152191913","192.168.1.118","23.41.246.174","TLSv1.2","824","Application Data"
"100","0.178164250","23.41.246.174","192.168.1.118","TCP","1514","[TCP segment of a reassembled PDU]"
"101","0.181042638","23.41.246.174","192.168.1.118","TCP","5858","443 → 44770 [ACK] Seq=1449 Ack=781 Win=259 Len=5792 TSval=310008690 TSecr=454013226 [TCP segment of a reassembled PDU]"
"102","0.181530675","23.41.246.174","192.168.1.118","TLSv1.2","9239","Application Data"
"103","0.181721813","23.41.246.174","192.168.1.118","TCP","2962","[TCP segment of a reassembled PDU]"
"104","0.181826275","192.168.1.118","23.41.246.174","TCP","66","44766 → 443 [ACK] Seq=1556 Ack=24512 Win=546 Len=0 TSval=454013270 TSecr=310008690"
"105","0.181892888","23.41.246.174","192.168.1.118","TCP","4410","[TCP segment of a reassembled PDU]"
"106","0.182863200","192.168.1.118","23.41.246.174","TCP","66","44770 → 443 [ACK] Seq=781 Ack=20758 Win=339 Len=0 TSval=454013271 TSecr=310008690"
"107","0.183148913","23.41.246.174","192.168.1.118","TCP","1514","443 → 44770 [ACK] Seq=20758 Ack=781 Win=259 Len=1448 TSval=310008690 TSecr=454013226 [TCP segment of a reassembled PDU]"
"108","0.183202188","23.41.246.174","192.168.1.118","TCP","5858","[TCP segment of a reassembled PDU]"
"109","0.183462338","192.168.1.118","23.41.246.174","TCP","66","44768 → 443 [ACK] Seq=769 Ack=5793 Win=456 Len=0 TSval=454013271 TSecr=310008690"
"110","0.184588275","23.41.246.174","192.168.1.118","TLSv1.2","10687","Application Data"
"111","0.184739700","23.41.246.174","192.168.1.118","TCP","4410","[TCP segment of a reassembled PDU]"
"112","0.185396825","192.168.1.118","23.41.246.174","TCP","66","44768 → 443 [ACK] Seq=769 Ack=20758 Win=340 Len=0 TSval=454013273 TSecr=310008690"
"113","0.195534275","23.41.246.174","192.168.1.118","TCP","1514","443 → 44768 [ACK] Seq=20758 Ack=769 Win=260 Len=1448 TSval=310008690 TSecr=454013226 [TCP segment of a reassembled PDU]"
"114","0.195696438","23.41.246.174","192.168.1.118","TCP","5858","443 → 44768 [ACK] Seq=22206 Ack=769 Win=260 Len=5792 TSval=310008691 TSecr=454013226 [TCP segment of a reassembled PDU]"
"115","0.195776913","192.168.1.118","23.41.246.174","TCP","66","44768 → 443 [ACK] Seq=769 Ack=27998 Win=429 Len=0 TSval=454013284 TSecr=310008690"
"116","0.195832938","23.41.246.174","192.168.1.118","TCP","1514","443 → 44766 [ACK] Seq=24512 Ack=1556 Win=272 Len=1448 TSval=310008690 TSecr=454013229 [TCP segment of a reassembled PDU]"
"117","0.195905338","192.168.1.118","23.41.246.174","TCP","66","44766 → 443 [ACK] Seq=1556 Ack=25960 Win=569 Len=0 TSval=454013284 TSecr=310008690"
"118","0.196185038","23.41.246.174","192.168.1.118","TCP","4410","443 → 44766 [ACK] Seq=25960 Ack=1556 Win=272 Len=4344 TSval=310008690 TSecr=454013229 [TCP segment of a reassembled PDU]"
"119","0.196264000","192.168.1.118","23.41.246.174","TCP","66","44766 → 443 [ACK] Seq=1556 Ack=30304 Win=637 Len=0 TSval=454013284 TSecr=310008690"
"120","0.196423563","23.41.246.174","192.168.1.118","TCP","2962","443 → 44766 [ACK] Seq=30304 Ack=1556 Win=272 Len=2896 TSval=310008691 TSecr=454013229 [TCP segment of a reassembled PDU]"
"121","0.196499850","192.168.1.118","23.41.246.174","TCP","66","44766 → 443 [ACK] Seq=1556 Ack=33200 Win=682 Len=0 TSval=454013285 TSecr=310008691"
"122","0.196611988","23.41.246.174","192.168.1.118","TCP","2962","443 → 44766 [ACK] Seq=33200 Ack=1556 Win=272 Len=2896 TSval=310008692 TSecr=454013229 [TCP segment of a reassembled PDU]"
"123","0.196688463","192.168.1.118","23.41.246.174","TCP","66","44766 → 443 [ACK] Seq=1556 Ack=36096 Win=727 Len=0 TSval=454013285 TSecr=310008692"
"124","0.196755363","23.41.246.174","192.168.1.118","TCP","2962","443 → 44768 [ACK] Seq=27998 Ack=769 Win=260 Len=2896 TSval=310008691 TSecr=454013226 [TCP segment of a reassembled PDU]"
"125","0.196807700","23.41.246.174","192.168.1.118","TCP","1514","443 → 44766 [ACK] Seq=36096 Ack=1556 Win=272 Len=1448 TSval=310008693 TSecr=454013229 [TCP segment of a reassembled PDU]"
"126","0.196874088","192.168.1.118","23.41.246.174","TCP","66","44766 → 443 [ACK] Seq=1556 Ack=37544 Win=750 Len=0 TSval=454013285 TSecr=310008693"
"127","0.197312525","192.168.1.118","23.41.246.174","TCP","66","44768 → 443 [ACK] Seq=769 Ack=30894 Win=501 Len=0 TSval=454013285 TSecr=310008691"
"128","0.207504163","23.41.246.174","192.168.1.118","TLSv1.2","1514","Application Data [TCP segment of a reassembled PDU]"
"129","0.207564000","192.168.1.118","23.41.246.174","TCP","66","44766 → 443 [ACK] Seq=1556 Ack=38992 Win=773 Len=0 TSval=454013296 TSecr=310008693"
"130","0.207608425","23.41.246.174","192.168.1.118","TLSv1.2","2962","Application Data [TCP segment of a reassembled PDU]"
"131","0.207644125","23.41.246.174","192.168.1.118","TCP","1514","443 → 44766 [ACK] Seq=38992 Ack=1556 Win=272 Len=1448 TSval=310008694 TSecr=454013229 [TCP segment of a reassembled PDU]"
"132","0.207694488","192.168.1.118","23.41.246.174","TCP","66","44766 → 443 [ACK] Seq=1556 Ack=40440 Win=795 Len=0 TSval=454013296 TSecr=310008694"
"133","0.207868788","23.41.246.174","192.168.1.118","TCP","1514","443 → 44766 [ACK] Seq=40440 Ack=1556 Win=272 Len=1448 TSval=310008694 TSecr=454013229 [TCP segment of a reassembled PDU]"
"134","0.207942688","192.168.1.118","23.41.246.174","TCP","66","44766 → 443 [ACK] Seq=1556 Ack=41888 Win=818 Len=0 TSval=454013296 TSecr=310008694"
"135","0.208055413","23.41.246.174","192.168.1.118","TCP","2962","443 → 44766 [ACK] Seq=41888 Ack=1556 Win=272 Len=2896 TSval=310008695 TSecr=454013229 [TCP segment of a reassembled PDU]"
"136","0.208112288","192.168.1.118","23.41.246.174","TCP","66","44766 → 443 [ACK] Seq=1556 Ack=44784 Win=863 Len=0 TSval=454013296 TSecr=310008695"
"137","0.208225038","23.41.246.174","192.168.1.118","TLSv1.2","3156","Application Data"
"138","0.208299388","192.168.1.118","23.41.246.174","TCP","66","44762 → 443 [ACK] Seq=1532 Ack=125389 Win=1229 Len=0 TSval=454013296 TSecr=310008700"
"139","0.208364488","23.41.246.174","192.168.1.118","TCP","2962","443 → 44766 [ACK] Seq=44784 Ack=1556 Win=272 Len=2896 TSval=310008696 TSecr=454013229 [TCP segment of a reassembled PDU]"
"140","0.208422138","192.168.1.118","23.41.246.174","TCP","66","44766 → 443 [ACK] Seq=1556 Ack=47680 Win=908 Len=0 TSval=454013296 TSecr=310008696"
"141","0.208458588","23.41.246.174","192.168.1.118","TLSv1.2","1423","Application Data"
"142","0.208512375","192.168.1.118","23.41.246.174","TCP","66","44766 → 443 [ACK] Seq=1556 Ack=49037 Win=931 Len=0 TSval=454013297 TSecr=310008698"
"143","0.208583488","23.41.246.174","192.168.1.118","TLSv1.2","2962","Application Data [TCP segment of a reassembled PDU]"
"144","0.208628288","23.41.246.174","192.168.1.118","TCP","1514","443 → 44768 [ACK] Seq=36686 Ack=769 Win=260 Len=1448 TSval=310008696 TSecr=454013226 [TCP segment of a reassembled PDU]"
"145","0.208794050","192.168.1.118","23.41.246.174","TCP","66","44768 → 443 [ACK] Seq=769 Ack=38134 Win=445 Len=0 TSval=454013297 TSecr=310008691"
"146","0.211141400","23.41.246.174","192.168.1.118","TLSv1.2","2834","Application Data"
"147","0.211215638","192.168.1.118","23.41.246.174","TCP","66","44764 → 443 [ACK] Seq=1553 Ack=109495 Win=1495 Len=0 TSval=454013299 TSecr=310008702"
"148","0.212485800","192.168.1.118","23.41.246.174","TLSv1.2","854","Application Data"
"149","0.212618825","192.168.1.118","23.41.246.174","TLSv1.2","853","Application Data"
"150","0.217328038","23.41.246.174","192.168.1.118","TCP","1514","443 → 44768 [ACK] Seq=38134 Ack=769 Win=260 Len=1448 TSval=310008733 TSecr=454013285 [TCP segment of a reassembled PDU]"
"151","0.219599488","23.41.246.174","192.168.1.118","TCP","5858","443 → 44768 [ACK] Seq=39582 Ack=769 Win=260 Len=5792 TSval=310008733 TSecr=454013285 [TCP segment of a reassembled PDU]"
"152","0.219796700","23.41.246.174","192.168.1.118","TCP","4410","443 → 44768 [ACK] Seq=45374 Ack=769 Win=260 Len=4344 TSval=310008733 TSecr=454013285 [TCP segment of a reassembled PDU]"
"153","0.219836963","23.41.246.174","192.168.1.118","TCP","2962","443 → 44770 [ACK] Seq=22206 Ack=781 Win=259 Len=2896 TSval=310008733 TSecr=454013271 [TCP segment of a reassembled PDU]"
"154","0.219889238","192.168.1.118","23.41.246.174","TCP","66","44770 → 443 [ACK] Seq=781 Ack=25102 Win=477 Len=0 TSval=454013308 TSecr=310008690"
"155","0.219964363","192.168.1.118","23.41.246.174","TCP","66","44768 → 443 [ACK] Seq=769 Ack=49718 Win=501 Len=0 TSval=454013308 TSecr=310008733"
"156","0.220232575","192.168.1.118","23.41.246.174","TLSv1.2","844","Application Data"
"157","0.221399525","23.41.246.174","192.168.1.118","TCP","1514","443 → 44770 [ACK] Seq=25102 Ack=781 Win=259 Len=1448 TSval=310008733 TSecr=454013271 [TCP segment of a reassembled PDU]"
"158","0.222803225","23.41.246.174","192.168.1.118","TLSv1.2","1100","Application Data"
"159","0.222859750","192.168.1.118","23.41.246.174","TCP","66","44770 → 443 [ACK] Seq=781 Ack=27584 Win=546 Len=0 TSval=454013311 TSecr=310008733"
"160","0.223126500","23.41.246.174","192.168.1.118","TLSv1.2","18890","Application Data, Application Data"
"161","0.223212650","23.41.246.174","192.168.1.118","TCP","1514","443 → 44768 [ACK] Seq=68542 Ack=769 Win=260 Len=1448 TSval=310008734 TSecr=454013285 [TCP segment of a reassembled PDU]"
"162","0.224183438","192.168.1.118","23.41.246.174","TCP","66","44768 → 443 [ACK] Seq=769 Ack=69990 Win=343 Len=0 TSval=454013312 TSecr=310008733"
"163","0.226970625","192.168.1.118","23.41.246.174","TLSv1.2","893","Application Data"
"164","0.229131963","23.41.246.174","192.168.1.118","TLSv1.2","6261","Application Data"
"165","0.229212363","192.168.1.118","23.41.246.174","TCP","66","44768 → 443 [ACK] Seq=769 Ack=76185 Win=429 Len=0 TSval=454013317 TSecr=310008734"
"166","0.229432075","23.41.246.174","192.168.1.118","TCP","5858","[TCP segment of a reassembled PDU]"
"167","0.229551388","23.41.246.174","192.168.1.118","TCP","2962","443 → 44768 [ACK] Seq=81977 Ack=769 Win=260 Len=2896 TSval=310008736 TSecr=454013285 [TCP segment of a reassembled PDU]"
"168","0.229612125","23.41.246.174","192.168.1.118","TCP","1514","443 → 44768 [ACK] Seq=84873 Ack=769 Win=260 Len=1448 TSval=310008737 TSecr=454013285 [TCP segment of a reassembled PDU]"
"169","0.230833675","192.168.1.118","23.41.246.174","TCP","66","44768 → 443 [ACK] Seq=769 Ack=86321 Win=350 Len=0 TSval=454013319 TSecr=310008734"
"170","0.232005200","23.41.246.174","192.168.1.118","TCP","1514","443 → 44768 [ACK] Seq=86321 Ack=769 Win=260 Len=1448 TSval=310008737 TSecr=454013285 [TCP segment of a reassembled PDU]"
"171","0.232124550","23.41.246.174","192.168.1.118","TCP","2962","443 → 44768 [ACK] Seq=87769 Ack=769 Win=260 Len=2896 TSval=310008739 TSecr=454013285 [TCP segment of a reassembled PDU]"
"172","0.232200338","192.168.1.118","23.41.246.174","TCP","66","44768 → 443 [ACK] Seq=769 Ack=90665 Win=461 Len=0 TSval=454013320 TSecr=310008737"
"173","0.232311463","23.41.246.174","192.168.1.118","TLSv1.2","2962","Application Data [TCP segment of a reassembled PDU]"
"174","0.232390675","23.41.246.174","192.168.1.118","TCP","1599","443 → 44768 [ACK] Seq=93561 Ack=769 Win=260 Len=1533 TSval=310008741 TSecr=454013297 [TCP segment of a reassembled PDU]"
"175","0.233085188","192.168.1.118","23.41.246.174","TCP","66","44768 → 443 [ACK] Seq=769 Ack=95094 Win=501 Len=0 TSval=454013321 TSecr=310008740"
"176","0.241326413","23.41.246.174","192.168.1.118","TCP","1514","[TCP segment of a reassembled PDU]"
"177","0.242675375","23.41.246.174","192.168.1.118","TLSv1.2","140","Application Data"
"178","0.242738238","192.168.1.118","23.41.246.174","TCP","66","44764 → 443 [ACK] Seq=2340 Ack=111017 Win=1517 Len=0 TSval=454013331 TSecr=310008756"
"179","0.242850163","23.41.246.174","192.168.1.118","TLSv1.2","4642","Application Data"
"180","0.242940863","192.168.1.118","23.41.246.174","TCP","66","44762 → 443 [ACK] Seq=2320 Ack=129965 Win=1301 Len=0 TSval=454013331 TSecr=310008756"
"181","0.253037600","192.168.1.118","23.41.246.174","TLSv1.2","832","Application Data"
"182","0.253706175","23.41.246.174","192.168.1.118","TCP","1514","443 → 44768 [ACK] Seq=95094 Ack=769 Win=260 Len=1448 TSval=310008760 TSecr=454013320 [TCP segment of a reassembled PDU]"
"183","0.255471188","23.41.246.174","192.168.1.118","TCP","5858","443 → 44768 [ACK] Seq=96542 Ack=769 Win=260 Len=5792 TSval=310008760 TSecr=454013320 [TCP segment of a reassembled PDU]"
"184","0.255548150","192.168.1.118","23.41.246.174","TCP","66","44768 → 443 [ACK] Seq=769 Ack=102334 Win=614 Len=0 TSval=454013344 TSecr=310008760"
"185","0.255851175","23.41.246.174","192.168.1.118","TLSv1.2","11565","Application Data [TCP segment of a reassembled PDU]"
"186","0.255964425","192.168.1.118","23.41.246.174","TCP","66","44768 → 443 [ACK] Seq=769 Ack=113833 Win=794 Len=0 TSval=454013344 TSecr=310008760"
"187","0.256054400","23.41.246.174","192.168.1.118","TLSv1.2","1177","Application Data"
"188","0.256138475","23.41.246.174","192.168.1.118","TLSv1.2","1190","Application Data"
"189","0.271528000","23.41.246.174","192.168.1.118","TLSv1.2","441","Application Data"
"190","0.294552438","23.41.246.174","192.168.1.118","TCP","1514","[TCP segment of a reassembled PDU]"
"191","0.297007000","192.168.1.118","23.41.246.174","TCP","66","44766 → 443 [ACK] Seq=2334 Ack=50161 Win=954 Len=0 TSval=454013385 TSecr=310008767"
"192","0.297099963","192.168.1.118","23.41.246.174","TCP","66","44768 → 443 [ACK] Seq=769 Ack=114944 Win=817 Len=0 TSval=454013385 TSecr=310008760"
"193","0.297366625","23.41.246.174","192.168.1.118","TCP","11650","443 → 44762 [ACK] Seq=131413 Ack=3086 Win=331 Len=11584 TSval=310008805 TSecr=454013341 [TCP segment of a reassembled PDU]"
"194","0.297461900","192.168.1.118","23.41.246.174","TCP","66","44762 → 443 [ACK] Seq=3086 Ack=142997 Win=1505 Len=0 TSval=454013385 TSecr=310008805"
"195","0.298266063","23.41.246.174","192.168.1.118","TLSv1.2","3447","Application Data"
"196","0.298347575","192.168.1.118","23.41.246.174","TCP","66","44762 → 443 [ACK] Seq=3086 Ack=146378 Win=1557 Len=0 TSval=454013386 TSecr=310008805"
"197","0.298536725","23.41.246.174","192.168.1.118","TCP","7306","[TCP segment of a reassembled PDU]"
"198","0.298623525","192.168.1.118","23.41.246.174","TCP","66","44762 → 443 [ACK] Seq=3086 Ack=153618 Win=1671 Len=0 TSval=454013387 TSecr=310008805"
"199","0.301965500","23.41.246.174","192.168.1.118","TCP","4410","443 → 44762 [ACK] Seq=153618 Ack=3086 Win=331 Len=4344 TSval=310008805 TSecr=454013341 [TCP segment of a reassembled PDU]"
"200","0.302021600","192.168.1.118","23.41.246.174","TCP","66","44762 → 443 [ACK] Seq=3086 Ack=157962 Win=1738 Len=0 TSval=454013390 TSecr=310008805"
"201","0.302055750","23.41.246.174","192.168.1.118","TCP","1514","443 → 44762 [ACK] Seq=157962 Ack=3086 Win=331 Len=1448 TSval=310008807 TSecr=454013341 [TCP segment of a reassembled PDU]"
"202","0.302213113","23.41.246.174","192.168.1.118","TLSv1.2","4410","Application Data [TCP segment of a reassembled PDU]"
"203","0.302268213","192.168.1.118","23.41.246.174","TCP","66","44762 → 443 [ACK] Seq=3086 Ack=163754 Win=1829 Len=0 TSval=454013390 TSecr=310008807"
"204","0.302367675","23.41.246.174","192.168.1.118","TCP","5858","443 → 44762 [ACK] Seq=163754 Ack=3086 Win=331 Len=5792 TSval=310008808 TSecr=454013341 [TCP segment of a reassembled PDU]"
"205","0.302424288","192.168.1.118","23.41.246.174","TCP","66","44762 → 443 [ACK] Seq=3086 Ack=169546 Win=1919 Len=0 TSval=454013390 TSecr=310008808"
"206","0.302538563","23.41.246.174","192.168.1.118","TCP","5858","443 → 44762 [ACK] Seq=169546 Ack=3086 Win=331 Len=5792 TSval=310008809 TSecr=454013341 [TCP segment of a reassembled PDU]"
"207","0.302606788","192.168.1.118","23.41.246.174","TCP","66","44762 → 443 [ACK] Seq=3086 Ack=175338 Win=2010 Len=0 TSval=454013391 TSecr=310008809"
"208","0.302644200","23.41.246.174","192.168.1.118","TLSv1.2","1514","Application Data [TCP segment of a reassembled PDU]"
"209","0.307650638","23.41.246.174","192.168.1.118","TCP","4410","443 → 44762 [ACK] Seq=176786 Ack=3086 Win=331 Len=4344 TSval=310008810 TSecr=454013341 [TCP segment of a reassembled PDU]"
"210","0.307738200","192.168.1.118","23.41.246.174","TCP","66","44762 → 443 [ACK] Seq=3086 Ack=181130 Win=2100 Len=0 TSval=454013396 TSecr=310008810"
"211","0.307786388","23.41.246.174","192.168.1.118","TCP","1514","443 → 44762 [ACK] Seq=181130 Ack=3086 Win=331 Len=1448 TSval=310008811 TSecr=454013341 [TCP segment of a reassembled PDU]"
"212","0.307970863","23.41.246.174","192.168.1.118","TCP","4410","443 → 44762 [ACK] Seq=182578 Ack=3086 Win=331 Len=4344 TSval=310008811 TSecr=454013341 [TCP segment of a reassembled PDU]"
"213","0.308026138","192.168.1.118","23.41.246.174","TCP","66","44762 → 443 [ACK] Seq=3086 Ack=186922 Win=2191 Len=0 TSval=454013396 TSecr=310008811"
"214","0.308116538","23.41.246.174","192.168.1.118","TLSv1.2","5564","Application Data"
"215","0.308171725","192.168.1.118","23.41.246.174","TCP","66","44762 → 443 [ACK] Seq=3086 Ack=192420 Win=2277 Len=0 TSval=454013396 TSecr=310008812"
"216","0.315942638","192.168.1.118","23.41.246.174","TCP","66","44770 → 443 [ACK] Seq=1608 Ack=27959 Win=569 Len=0 TSval=454013404 TSecr=310008779"
"217","0.503165875","192.168.1.118","209.18.47.62","DNS","75","Standard query 0x9c47 A www.youtube.com"
"218","0.503435788","192.168.1.118","209.18.47.62","DNS","84","Standard query 0xdcbd A www.googletagmanager.com"
"219","0.516809075","209.18.47.62","192.168.1.118","DNS","333","Standard query response 0x9c47 A www.youtube.com CNAME youtube-ui.l.google.com A 172.217.6.238 A 172.217.10.238 A 172.217.11.46 A 172.217.12.174 A 172.217.12.206 A 142.250.64.110 A 172.217.10.14 A 172.217.10.46 A 172.217.10.78 A 172.217.10.110 A 172.217.3.110 A 172.217.12.142 A 172.217.6.206 A 142.250.64.78"
"220","0.517037238","192.168.1.118","209.18.47.62","DNS","75","Standard query 0x1050 AAAA www.youtube.com"
"221","0.518290975","209.18.47.62","192.168.1.118","DNS","144","Standard query response 0xdcbd A www.googletagmanager.com CNAME www-googletagmanager.l.google.com A 172.217.12.136"
"222","0.518957663","192.168.1.118","209.18.47.62","DNS","84","Standard query 0x8c31 AAAA www.googletagmanager.com"
"223","0.531706250","209.18.47.62","192.168.1.118","DNS","137","Standard query response 0x1050 AAAA www.youtube.com CNAME youtube-ui.l.google.com AAAA 2607:f8b0:4006:819::200e"
"224","0.539238813","209.18.47.62","192.168.1.118","DNS","156","Standard query response 0x8c31 AAAA www.googletagmanager.com CNAME www-googletagmanager.l.google.com AAAA 2607:f8b0:4006:819::2008"
"225","0.580617338","192.168.1.118","172.217.6.238","TCP","74","36114 → 443 [SYN] Seq=0 Win=64240 Len=0 MSS=1460 SACK_PERM=1 TSval=298008830 TSecr=0 WS=128"
"226","0.580736400","192.168.1.118","172.217.12.136","TCP","74","44202 → 443 [SYN] Seq=0 Win=64240 Len=0 MSS=1460 SACK_PERM=1 TSval=523908254 TSecr=0 WS=128"
"227","0.605201825","172.217.6.238","192.168.1.118","TCP","74","443 → 36114 [SYN, ACK] Seq=0 Ack=1 Win=60192 Len=0 MSS=1380 SACK_PERM=1 TSval=4020313876 TSecr=298008830 WS=256"
"228","0.605302888","192.168.1.118","172.217.6.238","TCP","66","36114 → 443 [ACK] Seq=1 Ack=1 Win=64256 Len=0 TSval=298008854 TSecr=4020313876"
"229","0.613287213","172.217.12.136","192.168.1.118","TCP","74","443 → 44202 [SYN, ACK] Seq=0 Ack=1 Win=60192 Len=0 MSS=1380 SACK_PERM=1 TSval=3063283255 TSecr=523908254 WS=256"
"230","0.613384863","192.168.1.118","172.217.12.136","TCP","66","44202 → 443 [ACK] Seq=1 Ack=1 Win=64256 Len=0 TSval=523908286 TSecr=3063283255"
"231","0.631635513","192.168.1.118","172.217.6.238","TLSv1","583","Client Hello"
"232","0.647901625","192.168.1.118","172.217.12.136","TLSv1","583","Client Hello"
"233","0.660107413","172.217.6.238","192.168.1.118","TCP","66","443 → 36114 [ACK] Seq=1 Ack=518 Win=61440 Len=0 TSval=4020313931 TSecr=298008881"
"234","0.672083613","172.217.6.238","192.168.1.118","TLSv1.2","1484","Server Hello"
"235","0.672202913","192.168.1.118","172.217.6.238","TCP","66","36114 → 443 [ACK] Seq=518 Ack=1419 Win=63104 Len=0 TSval=298008921 TSecr=4020313937"
"236","0.674087175","172.217.6.238","192.168.1.118","TLSv1.2","2425","Certificate, Server Key Exchange, Server Hello Done"
"237","0.674199175","192.168.1.118","172.217.6.238","TCP","66","36114 → 443 [ACK] Seq=518 Ack=3778 Win=61056 Len=0 TSval=298008923 TSecr=4020313937"
"238","0.674294213","172.217.12.136","192.168.1.118","TCP","66","443 → 44202 [ACK] Seq=1 Ack=518 Win=61440 Len=0 TSval=3063283310 TSecr=523908321"
"239","0.675229963","172.217.12.136","192.168.1.118","TLSv1.2","1484","Server Hello"
"240","0.675348350","192.168.1.118","172.217.12.136","TCP","66","44202 → 443 [ACK] Seq=518 Ack=1419 Win=63104 Len=0 TSval=523908348 TSecr=3063283316"
"241","0.676521250","192.168.1.118","172.217.6.238","TLSv1.2","192","Client Key Exchange, Change Cipher Spec, Encrypted Handshake Message"
"242","0.676559375","172.217.12.136","192.168.1.118","TLSv1.2","1521","Certificate, Server Key Exchange, Server Hello Done"
"243","0.676659563","192.168.1.118","172.217.12.136","TCP","66","44202 → 443 [ACK] Seq=518 Ack=2874 Win=61696 Len=0 TSval=523908350 TSecr=3063283316"
"244","0.678731488","192.168.1.118","172.217.12.136","TLSv1.2","192","Client Key Exchange, Change Cipher Spec, Encrypted Handshake Message"
"245","0.707070638","172.217.12.136","192.168.1.118","TLSv1.2","117","Change Cipher Spec, Encrypted Handshake Message"
"246","0.707526050","192.168.1.118","172.217.12.136","TLSv1.2","267","Application Data"
"247","0.708174763","172.217.6.238","192.168.1.118","TLSv1.2","117","Change Cipher Spec, Encrypted Handshake Message"
"248","0.708609800","192.168.1.118","172.217.6.238","TLSv1.2","318","Application Data"
"249","0.731953113","172.217.12.136","192.168.1.118","TCP","66","443 → 44202 [ACK] Seq=2925 Ack=845 Win=62464 Len=0 TSval=3063283374 TSecr=523908381"
"250","0.739640538","172.217.6.238","192.168.1.118","TCP","66","443 → 36114 [ACK] Seq=3829 Ack=896 Win=62464 Len=0 TSval=4020314011 TSecr=298008958"
"251","0.753664325","172.217.12.136","192.168.1.118","TLSv1.2","952","Application Data"
"252","0.754705688","172.217.12.136","192.168.1.118","TLSv1.2","100","Application Data"
"253","0.755250775","192.168.1.118","172.217.12.136","TCP","66","44202 → 443 [ACK] Seq=845 Ack=3845 Win=64128 Len=0 TSval=523908428 TSecr=3063283384"
"254","0.968124775","172.217.6.238","192.168.1.118","TLSv1.2","1484","Application Data"
"255","0.969178675","172.217.6.238","192.168.1.118","TLSv1.2","2902","Application Data, Application Data"
"256","0.969818525","192.168.1.118","172.217.6.238","TCP","66","36114 → 443 [ACK] Seq=896 Ack=8083 Win=61056 Len=0 TSval=298009219 TSecr=4020314153"
"257","0.970203863","172.217.6.238","192.168.1.118","TLSv1.2","2902","Application Data, Application Data"
"258","0.970335200","192.168.1.118","172.217.6.238","TCP","66","36114 → 443 [ACK] Seq=896 Ack=10919 Win=61056 Len=0 TSval=298009219 TSecr=4020314153"
"259","0.972882488","172.217.6.238","192.168.1.118","TLSv1.2","2902","Application Data, Application Data"
"260","0.973048163","192.168.1.118","172.217.6.238","TCP","66","36114 → 443 [ACK] Seq=896 Ack=13755 Win=61056 Len=0 TSval=298009222 TSecr=4020314153"
"261","0.976601138","172.217.6.238","192.168.1.118","TLSv1.2","2669","Application Data, Application Data"
"262","0.978039713","172.217.6.238","192.168.1.118","TLSv1.2","158","Application Data"
"263","0.978154000","172.217.6.238","192.168.1.118","TLSv1.2","100","Application Data"
"264","0.978222188","172.217.6.238","192.168.1.118","TCP","100","[TCP Retransmission] 443 → 36114 [PSH, ACK] Seq=16450 Ack=896 Win=62464 Len=34 TSval=4020314213 TSecr=298008958"
"265","0.978313100","192.168.1.118","172.217.6.238","TCP","78","36114 → 443 [ACK] Seq=896 Ack=16484 Win=58368 Len=0 TSval=298009227 TSecr=4020314154 SLE=16450 SRE=16484"
"266","1.052010150","192.168.1.118","172.217.6.238","TLSv1.2","334","Application Data"
"267","1.084464788","172.217.6.238","192.168.1.118","TCP","66","443 → 36114 [ACK] Seq=16484 Ack=1164 Win=63488 Len=0 TSval=4020314346 TSecr=298009301"
"268","1.090269513","172.217.6.238","192.168.1.118","TLSv1.2","1484","Application Data"
"269","1.090342888","192.168.1.118","172.217.6.238","TCP","66","36114 → 443 [ACK] Seq=1164 Ack=17902 Win=63104 Len=0 TSval=298009339 TSecr=4020314360"
"270","1.142240788","172.217.6.238","192.168.1.118","TLSv1.2","729","Application Data"
"271","1.142366038","192.168.1.118","172.217.6.238","TCP","66","36114 → 443 [ACK] Seq=1164 Ack=18565 Win=63104 Len=0 TSval=298009391 TSecr=4020314360"
"272","1.142620738","192.168.1.118","172.217.6.238","TLSv1.2","97","Encrypted Alert"
"273","1.144502425","192.168.1.118","172.217.6.238","TCP","66","36114 → 443 [FIN, ACK] Seq=1195 Ack=18565 Win=64128 Len=0 TSval=298009394 TSecr=4020314360"
"274","1.169138613","172.217.6.238","192.168.1.118","TCP","66","443 → 36114 [FIN, ACK] Seq=18565 Ack=1195 Win=63488 Len=0 TSval=4020314441 TSecr=298009392"
"275","1.169307450","192.168.1.118","172.217.6.238","TCP","66","36114 → 443 [ACK] Seq=1196 Ack=18566 Win=64128 Len=0 TSval=298009418 TSecr=4020314441"
"276","1.173141563","172.217.6.238","192.168.1.118","TCP","66","443 → 36114 [ACK] Seq=18566 Ack=1196 Win=63488 Len=0 TSval=4020314442 TSecr=298009394"
"277","1.598549388","Cisco-Li_5b:1c:ce","IntelCor_b7:52:73","ARP","42","Who has 192.168.1.118? Tell 192.168.1.1"
"278","1.598612788","IntelCor_b7:52:73","Cisco-Li_5b:1c:ce","ARP","42","192.168.1.118 is at dc:fb:48:b7:52:73"
"279","2.095804125","192.168.1.104","255.255.255.255","UDP","217","49154 → 6666 Len=175"
"280","2.546602363","192.168.1.118","192.168.1.102","TCP","176","44768 → 8009 [PSH, ACK] Seq=1 Ack=1 Win=501 Len=110 TSval=2236033970 TSecr=3055576 [TCP segment of a reassembled PDU]"
"281","2.556406300","192.168.1.102","192.168.1.118","TCP","176","8009 → 44768 [PSH, ACK] Seq=1 Ack=111 Win=294 Len=110 TSval=3056077 TSecr=2236033970 [TCP segment of a reassembled PDU]"
"282","2.556578413","192.168.1.118","192.168.1.102","TCP","66","44768 → 8009 [ACK] Seq=111 Ack=111 Win=501 Len=0 TSval=2236033980 TSecr=3056077"
"283","2.608419713","192.168.1.103","224.0.0.251","MDNS","158","Standard query 0x0000 PTR _companion-link._tcp.local, "QM" question PTR _sleep-proxy._udp.local, "QM" question PTR cjqg._companion-link._tcp.local OPT"
"284","5.065199250","192.168.1.104","255.255.255.255","UDP","217","49154 → 6666 Len=175"
"285","5.373586525","192.168.1.102","224.0.0.251","MDNS","81","Standard query 0x0000 PTR _googlerpc._tcp.local, "QM" question"
"286","5.374975500","192.168.1.102","224.0.0.251","MDNS","91","Standard query 0x0000 SRV googlerpc._googlerpc._tcp.local, "QM" question"
"287","5.377895700","192.168.1.102","224.0.0.251","MDNS","220","Standard query response 0x0000 PTR googlerpc._googlerpc._tcp.local TXT, cache flush SRV, cache flush 0 0 8012 2c3f16b2-da5c-4b6f-d6cf-bfba61c12490.local A, cache flush 192.168.1.102"
"288","5.380148613","192.168.1.102","224.0.0.251","MDNS","158","Standard query response 0x0000 SRV, cache flush 0 0 8012 2c3f16b2-da5c-4b6f-d6cf-bfba61c12490.local A, cache flush 192.168.1.102"
"289","5.381827450","192.168.1.102","224.0.0.251","MDNS","82","Standard query 0x0000 PTR _googlezone._tcp.local, "QM" question"
"290","5.384848913","192.168.1.102","224.0.0.251","MDNS","268","Standard query response 0x0000 PTR 2c3f16b2-da5c-4b6f-d6cf-bfba61c12490._googlezone._tcp.local TXT, cache flush SRV, cache flush 610 60 10001 2c3f16b2-da5c-4b6f-d6cf-bfba61c12490.local A, cache flush 192.168.1.102"
"291","7.562427088","192.168.1.118","192.168.1.102","TCP","176","44768 → 8009 [PSH, ACK] Seq=111 Ack=111 Win=501 Len=110 TSval=2236038985 TSecr=3056077 [TCP segment of a reassembled PDU]"
"292","7.604336350","192.168.1.102","192.168.1.118","TCP","176","8009 → 44768 [PSH, ACK] Seq=111 Ack=221 Win=294 Len=110 TSval=3056578 TSecr=2236038985 [TCP segment of a reassembled PDU]"
"293","7.604518788","192.168.1.118","192.168.1.102","TCP","66","44768 → 8009 [ACK] Seq=221 Ack=221 Win=501 Len=0 TSval=2236039027 TSecr=3056578"
"294","8.143467825","192.168.1.104","255.255.255.255","UDP","217","49154 → 6666 Len=175"
