frame.number,_ws.col.Time,_ws.col.Source,_ws.col.Destination,_ws.col.Protocol,frame.len,_ws.col.Info
"1","0.000000000","192.168.1.118","104.106.255.95","TCP","66","33454 → 443 [ACK] Seq=1 Ack=1 Win=499 Len=0 TSval=3175557486 TSecr=3677476423"
"2","0.001405825","192.168.1.118","35.186.208.48","TLSv1.2","321","Application Data"
"3","0.001685925","192.168.1.118","35.186.208.48","TLSv1.2","353","Application Data"
"4","0.001719163","192.168.1.118","35.186.208.48","TCP","66","36552 → 443 [ACK] Seq=1 Ack=1 Win=501 Len=0 TSval=4249782028 TSecr=1686132788"
"5","0.001793500","192.168.1.118","35.186.208.48","TCP","66","36554 → 443 [ACK] Seq=1 Ack=1 Win=501 Len=0 TSval=4249782028 TSecr=3618841611"
"6","0.001933763","192.168.1.118","35.186.208.48","TLSv1.2","326","Application Data"
"7","0.002143863","192.168.1.118","35.186.208.48","TLSv1.2","324","Application Data"
"8","0.004535688","192.168.1.118","35.186.208.48","TLSv1.2","192","Client Key Exchange, Change Cipher Spec, Encrypted Handshake Message"
"9","0.004630238","192.168.1.118","104.106.255.95","TCP","66","33458 → 443 [ACK] Seq=1 Ack=1 Win=431 Len=0 TSval=3175557491 TSecr=3677476453"
"10","0.005081588","192.168.1.118","104.106.255.95","TLSv1.2","1292","Application Data"
"11","0.005316400","192.168.1.118","104.106.255.95","TLSv1.2","1358","Application Data"
"12","0.028847975","35.186.208.48","192.168.1.118","TLSv1.2","1484","Application Data"
"13","0.028986188","192.168.1.118","35.186.208.48","TCP","66","36558 → 443 [ACK] Seq=256 Ack=1419 Win=493 Len=0 TSval=4249782055 TSecr=2406950882"
"14","0.031018938","35.186.208.48","192.168.1.118","TLSv1.2","2902","Application Data, Application Data"
"15","0.031136350","192.168.1.118","35.186.208.48","TCP","66","36558 → 443 [ACK] Seq=256 Ack=4255 Win=471 Len=0 TSval=4249782058 TSecr=2406950882"
"16","0.031237263","35.186.208.48","192.168.1.118","TLSv1.2","1484","Application Data"
"17","0.031349975","35.186.208.48","192.168.1.118","TLSv1.2","2902","Application Data, Application Data"
"18","0.031494675","35.186.208.48","192.168.1.118","TLSv1.2","1484","Application Data"
"19","0.031576225","192.168.1.118","35.186.208.48","TCP","66","36554 → 443 [ACK] Seq=259 Ack=1419 Win=493 Len=0 TSval=4249782058 TSecr=3618841672"
"20","0.031669075","35.186.208.48","192.168.1.118","TLSv1.2","2902","Application Data, Application Data"
"21","0.031742613","192.168.1.118","35.186.208.48","TCP","66","36554 → 443 [ACK] Seq=259 Ack=4255 Win=471 Len=0 TSval=4249782058 TSecr=3618841672"
"22","0.031854813","35.186.208.48","192.168.1.118","TLSv1.2","1484","Application Data"
"23","0.031933650","192.168.1.118","35.186.208.48","TCP","66","36552 → 443 [ACK] Seq=261 Ack=1419 Win=493 Len=0 TSval=4249782058 TSecr=1686132848"
"24","0.032024463","35.186.208.48","192.168.1.118","TLSv1.2","2902","Application Data, Application Data"
"25","0.032095425","192.168.1.118","35.186.208.48","TCP","66","36552 → 443 [ACK] Seq=261 Ack=4255 Win=471 Len=0 TSval=4249782059 TSecr=1686132848"
"26","0.032193663","35.186.208.48","192.168.1.118","TLSv1.2","2902","Application Data, Application Data"
"27","0.032237038","35.186.208.48","192.168.1.118","TLSv1.2","2902","Application Data, Application Data"
"28","0.032294450","192.168.1.118","35.186.208.48","TCP","66","36554 → 443 [ACK] Seq=259 Ack=7091 Win=449 Len=0 TSval=4249782059 TSecr=3618841672"
"29","0.032335725","35.186.208.48","192.168.1.118","TLSv1.2","1484","Application Data"
"30","0.032397525","192.168.1.118","35.186.208.48","TCP","66","36552 → 443 [ACK] Seq=261 Ack=5673 Win=460 Len=0 TSval=4249782059 TSecr=1686132848"
"31","0.052112338","192.168.1.118","35.186.208.48","TCP","66","36560 → 443 [ACK] Seq=288 Ack=7091 Win=446 Len=0 TSval=4249782079 TSecr=1630035282"
"32","0.058725975","35.186.208.48","192.168.1.118","TLSv1.2","1484","Application Data"
"33","0.058839625","192.168.1.118","35.186.208.48","TCP","66","36552 → 443 [ACK] Seq=261 Ack=7091 Win=493 Len=0 TSval=4249782085 TSecr=1686132848"
"34","0.059040088","35.186.208.48","192.168.1.118","TLSv1.2","2902","Application Data, Application Data"
"35","0.059119325","192.168.1.118","35.186.208.48","TCP","66","36554 → 443 [ACK] Seq=259 Ack=9927 Win=427 Len=0 TSval=4249782086 TSecr=3618841674"
"36","0.059237575","35.186.208.48","192.168.1.118","TLSv1.2","5738","Application Data, Application Data, Application Data, Application Data"
"37","0.059303400","192.168.1.118","35.186.208.48","TCP","66","36558 → 443 [ACK] Seq=256 Ack=9927 Win=445 Len=0 TSval=4249782086 TSecr=2406950883"
"38","0.059472188","35.186.208.48","192.168.1.118","TLSv1.2","2902","Application Data, Application Data"
"39","0.059540275","192.168.1.118","35.186.208.48","TCP","66","36558 → 443 [ACK] Seq=256 Ack=12763 Win=423 Len=0 TSval=4249782086 TSecr=2406950884"
"40","0.059664613","35.186.208.48","192.168.1.118","TLSv1.2","2902","Application Data, Application Data"
"41","0.059731475","192.168.1.118","35.186.208.48","TCP","66","36552 → 443 [ACK] Seq=261 Ack=9927 Win=471 Len=0 TSval=4249782086 TSecr=1686132850"
"42","0.059802438","35.186.208.48","192.168.1.118","TLSv1.2","2902","Application Data, Application Data"
"43","0.059873138","192.168.1.118","35.186.208.48","TCP","66","36558 → 443 [ACK] Seq=256 Ack=15599 Win=401 Len=0 TSval=4249782086 TSecr=2406950885"
"44","0.059942850","35.186.208.48","192.168.1.118","TLSv1.2","2902","Application Data, Application Data"
"45","0.060034763","35.186.208.48","192.168.1.118","TLSv1.2","2902","Application Data, Application Data"
"46","0.060103625","192.168.1.118","35.186.208.48","TCP","66","36554 → 443 [ACK] Seq=259 Ack=12763 Win=405 Len=0 TSval=4249782087 TSecr=3618841675"
"47","0.060171388","35.186.208.48","192.168.1.118","TLSv1.2","2902","Application Data, Application Data"
"48","0.060235013","192.168.1.118","35.186.208.48","TCP","66","36552 → 443 [ACK] Seq=261 Ack=12763 Win=449 Len=0 TSval=4249782087 TSecr=1686132851"
"49","0.060303775","35.186.208.48","192.168.1.118","TLSv1.2","5738","Application Data, Application Data, Application Data, Application Data"
"50","0.060377000","192.168.1.118","35.186.208.48","TCP","66","36558 → 443 [ACK] Seq=256 Ack=21271 Win=357 Len=0 TSval=4249782087 TSecr=2406950886"
"51","0.060436875","35.186.208.48","192.168.1.118","TLSv1.2","2902","Application Data, Application Data"
"52","0.060551613","35.186.208.48","192.168.1.118","TLSv1.2","2902","Application Data, Application Data"
"53","0.060615500","192.168.1.118","35.186.208.48","TCP","66","36554 → 443 [ACK] Seq=259 Ack=15599 Win=383 Len=0 TSval=4249782087 TSecr=3618841677"
"54","0.060659138","35.186.208.48","192.168.1.118","TLSv1.2","2902","Application Data, Application Data"
"55","0.060729750","192.168.1.118","35.186.208.48","TCP","66","36552 → 443 [ACK] Seq=261 Ack=15599 Win=427 Len=0 TSval=4249782087 TSecr=1686132853"
"56","0.060770263","35.186.208.48","192.168.1.118","TLSv1.2","1484","Application Data"
"57","0.060830513","192.168.1.118","35.186.208.48","TCP","66","36558 → 443 [ACK] Seq=256 Ack=22689 Win=346 Len=0 TSval=4249782087 TSecr=2406950887"
"58","0.060876275","35.186.208.48","192.168.1.118","TLSv1.2","2902","Application Data, Application Data"
"59","0.062689638","192.168.1.118","35.186.208.48","TCP","66","36560 → 443 [ACK] Seq=288 Ack=15599 Win=380 Len=0 TSval=4249782089 TSecr=1630035284"
"60","0.072577350","35.186.208.48","192.168.1.118","TLSv1.2","2902","Application Data, Application Data"
"61","0.072653425","192.168.1.118","35.186.208.48","TCP","66","36554 → 443 [ACK] Seq=259 Ack=18435 Win=477 Len=0 TSval=4249782099 TSecr=3618841678"
"62","0.072714163","35.186.208.48","192.168.1.118","TLSv1.2","2902","Application Data, Application Data"
"63","0.072741850","192.168.1.118","35.186.208.48","TCP","66","36552 → 443 [ACK] Seq=261 Ack=18435 Win=477 Len=0 TSval=4249782099 TSecr=1686132854"
"64","0.072783650","35.186.208.48","192.168.1.118","TLSv1.2","2902","Application Data, Application Data"
"65","0.072800463","192.168.1.118","35.186.208.48","TCP","66","36560 → 443 [ACK] Seq=288 Ack=18435 Win=477 Len=0 TSval=4249782099 TSecr=1630035289"
"66","0.072824975","35.186.208.48","192.168.1.118","TLSv1.2","2902","Application Data, Application Data"
"67","0.072840763","192.168.1.118","35.186.208.48","TCP","66","36554 → 443 [ACK] Seq=259 Ack=21271 Win=455 Len=0 TSval=4249782099 TSecr=3618841679"
"68","0.072857388","35.186.208.48","192.168.1.118","TLSv1.2","2902","Application Data, Application Data"
"69","0.072872288","192.168.1.118","35.186.208.48","TCP","66","36552 → 443 [ACK] Seq=261 Ack=21271 Win=455 Len=0 TSval=4249782099 TSecr=1686132856"
"70","0.072890163","35.186.208.48","192.168.1.118","TLSv1.2","2902","Application Data, Application Data"
"71","0.072908075","104.106.255.95","192.168.1.118","TCP","66","443 → 33460 [ACK] Seq=1 Ack=1227 Win=258 Len=0 TSval=3677476534 TSecr=3175557492"
"72","0.072941238","35.186.208.48","192.168.1.118","TLSv1.2","1484","Application Data"
"73","0.072956513","192.168.1.118","35.186.208.48","TCP","66","36554 → 443 [ACK] Seq=259 Ack=22689 Win=444 Len=0 TSval=4249782099 TSecr=3618841681"
"74","0.072966113","35.186.208.48","192.168.1.118","TLSv1.2","1484","Application Data"
"75","0.072980188","192.168.1.118","35.186.208.48","TCP","66","36552 → 443 [ACK] Seq=261 Ack=22689 Win=444 Len=0 TSval=4249782100 TSecr=1686132857"
"76","0.072989713","35.186.208.48","192.168.1.118","TLSv1.2","1484","Application Data"
"77","0.074389413","192.168.1.118","35.186.208.48","TCP","66","36560 → 443 [ACK] Seq=288 Ack=22689 Win=444 Len=0 TSval=4249782101 TSecr=1630035291"
"78","0.079421688","192.168.1.118","35.227.209.247","TLSv1.2","285","Application Data"
"79","0.091828200","35.186.208.48","192.168.1.118","TLSv1.2","117","Change Cipher Spec, Encrypted Handshake Message"
"80","0.091938975","192.168.1.118","35.186.208.48","TCP","66","36556 → 443 [ACK] Seq=127 Ack=52 Win=501 Len=0 TSval=4249782118 TSecr=1464952102"
"81","0.092055900","35.186.208.48","192.168.1.118","TLSv1.2","2902","Application Data, Application Data"
"82","0.092109325","192.168.1.118","35.186.208.48","TCP","66","36558 → 443 [ACK] Seq=256 Ack=25525 Win=477 Len=0 TSval=4249782119 TSecr=2406950919"
"83","0.092237900","35.186.208.48","192.168.1.118","TLSv1.2","2902","Application Data, Application Data"
"84","0.092287925","192.168.1.118","35.186.208.48","TCP","66","36558 → 443 [ACK] Seq=256 Ack=28361 Win=455 Len=0 TSval=4249782119 TSecr=2406950920"
"85","0.092389850","35.186.208.48","192.168.1.118","TLSv1.2","2902","Application Data, Application Data"
"86","0.092466813","192.168.1.118","35.186.208.48","TCP","66","36552 → 443 [ACK] Seq=261 Ack=25525 Win=477 Len=0 TSval=4249782119 TSecr=1686132886"
"87","0.092540063","35.186.208.48","192.168.1.118","TLSv1.2","5738","Application Data, Application Data, Application Data, Application Data"
"88","0.092592575","192.168.1.118","35.186.208.48","TCP","66","36554 → 443 [ACK] Seq=259 Ack=28361 Win=445 Len=0 TSval=4249782119 TSecr=3618841710"
"89","0.092649850","35.186.208.48","192.168.1.118","TLSv1.2","2902","Application Data, Application Data"
"90","0.092700625","192.168.1.118","35.186.208.48","TCP","66","36558 → 443 [ACK] Seq=256 Ack=31197 Win=433 Len=0 TSval=4249782119 TSecr=2406950921"
"91","0.092734225","35.186.208.48","192.168.1.118","TLSv1.2","2902","Application Data, Application Data"
"92","0.092767288","35.186.208.48","192.168.1.118","TLSv1.2","1484","Application Data"
"93","0.092810550","192.168.1.118","35.186.208.48","TCP","66","36554 → 443 [ACK] Seq=259 Ack=29779 Win=434 Len=0 TSval=4249782119 TSecr=3618841712"
"94","0.093168513","192.168.1.118","35.186.208.48","TCP","66","36552 → 443 [ACK] Seq=261 Ack=28361 Win=501 Len=0 TSval=4249782120 TSecr=1686132887"
"95","0.093597463","192.168.1.118","35.186.208.48","TLSv1.2","333","Application Data"
"96","0.094689338","35.186.208.48","192.168.1.118","TLSv1.2","1484","Application Data"
"97","0.094788075","192.168.1.118","35.186.208.48","TCP","66","36554 → 443 [ACK] Seq=259 Ack=31197 Win=523 Len=0 TSval=4249782121 TSecr=3618841712"
"98","0.094885763","35.186.208.48","192.168.1.118","TLSv1.2","2902","Application Data, Application Data"
"99","0.094942563","192.168.1.118","35.186.208.48","TCP","66","36552 → 443 [ACK] Seq=261 Ack=31197 Win=545 Len=0 TSval=4249782121 TSecr=1686132888"
"100","0.095019850","35.186.208.48","192.168.1.118","TLSv1.2","2902","Application Data, Application Data"
"101","0.095070438","192.168.1.118","35.186.208.48","TCP","66","36554 → 443 [ACK] Seq=259 Ack=34033 Win=568 Len=0 TSval=4249782122 TSecr=3618841713"
"102","0.095142150","104.106.255.95","192.168.1.118","TLSv1.2","823","Application Data"
"103","0.095210075","192.168.1.118","104.106.255.95","TCP","66","33462 → 443 [ACK] Seq=1293 Ack=758 Win=496 Len=0 TSval=3175557582 TSecr=3677476546"
"104","0.095270800","35.186.208.48","192.168.1.118","TLSv1.2","2902","Application Data, Application Data"
"105","0.095321788","192.168.1.118","35.186.208.48","TCP","66","36552 → 443 [ACK] Seq=261 Ack=34033 Win=590 Len=0 TSval=4249782122 TSecr=1686132890"
"106","0.095355188","35.186.208.48","192.168.1.118","TLSv1.2","2902","Application Data, Application Data"
"107","0.095403563","192.168.1.118","35.186.208.48","TCP","66","36554 → 443 [ACK] Seq=259 Ack=36869 Win=612 Len=0 TSval=4249782122 TSecr=3618841715"
"108","0.095435613","35.186.208.48","192.168.1.118","TLSv1.2","1484","Application Data"
"109","0.119936213","35.186.208.48","192.168.1.118","TLSv1.2","1484","Application Data"
"110","0.120050838","192.168.1.118","35.186.208.48","TCP","66","36560 → 443 [ACK] Seq=288 Ack=25525 Win=523 Len=0 TSval=4249782147 TSecr=1630035352"
"111","0.122208475","35.186.208.48","192.168.1.118","TLSv1.2","1484","Application Data"
"112","0.122505975","104.106.255.95","192.168.1.118","TLSv1.2","8861","Application Data"
"113","0.122612913","35.186.208.48","192.168.1.118","TLSv1.2","2902","Application Data, Application Data"
"114","0.122695225","192.168.1.118","35.186.208.48","TCP","66","36560 → 443 [ACK] Seq=288 Ack=29779 Win=590 Len=0 TSval=4249782149 TSecr=1630035356"
"115","0.122811025","35.186.208.48","192.168.1.118","TLSv1.2","2902","Application Data, Application Data"
"116","0.122876113","192.168.1.118","35.186.208.48","TCP","66","36560 → 443 [ACK] Seq=288 Ack=32615 Win=634 Len=0 TSval=4249782149 TSecr=1630035359"
"117","0.122973213","35.186.208.48","192.168.1.118","TLSv1.2","1484","Application Data"
"118","0.123037825","192.168.1.118","35.186.208.48","TCP","66","36558 → 443 [ACK] Seq=256 Ack=32615 Win=523 Len=0 TSval=4249782150 TSecr=2406950959"
"119","0.123087375","35.186.208.48","192.168.1.118","TLSv1.2","2902","Application Data, Application Data"
"120","0.123149600","192.168.1.118","35.186.208.48","TCP","66","36560 → 443 [ACK] Seq=288 Ack=35451 Win=678 Len=0 TSval=4249782150 TSecr=1630035361"
"121","0.123188913","35.186.208.48","192.168.1.118","TLSv1.2","1484","Application Data"
"122","0.123233338","192.168.1.118","104.106.255.95","TCP","66","33460 → 443 [ACK] Seq=1227 Ack=8796 Win=433 Len=0 TSval=3175557610 TSecr=3677476579"
"123","0.123274250","192.168.1.118","35.186.208.48","TCP","66","36558 → 443 [ACK] Seq=256 Ack=34033 Win=545 Len=0 TSval=4249782150 TSecr=2406950965"
"124","0.127737775","35.186.208.48","192.168.1.118","TLSv1.2","4320","Application Data, Application Data, Application Data"
"125","0.127867250","192.168.1.118","35.186.208.48","TCP","66","36558 → 443 [ACK] Seq=256 Ack=38287 Win=612 Len=0 TSval=4249782154 TSecr=2406950965"
"126","0.128047288","35.186.208.48","192.168.1.118","TLSv1.2","2902","Application Data, Application Data"
"127","0.128130025","192.168.1.118","35.186.208.48","TCP","66","36552 → 443 [ACK] Seq=261 Ack=36869 Win=634 Len=0 TSval=4249782155 TSecr=1686132931"
"128","0.128243388","35.186.208.48","192.168.1.118","TLSv1.2","2902","Application Data, Application Data"
"129","0.128323025","192.168.1.118","35.186.208.48","TCP","66","36560 → 443 [ACK] Seq=288 Ack=38287 Win=723 Len=0 TSval=4249782155 TSecr=1630035365"
"130","0.128385163","35.186.208.48","192.168.1.118","TLSv1.2","5738","Application Data, Application Data, Application Data, Application Data"
"131","0.128489513","192.168.1.118","35.186.208.48","TCP","66","36554 → 443 [ACK] Seq=259 Ack=42541 Win=701 Len=0 TSval=4249782155 TSecr=3618841755"
"132","0.128538900","35.186.208.48","192.168.1.118","TLSv1.2","2902","Application Data, Application Data"
"133","0.128612563","192.168.1.118","35.186.208.48","TCP","66","36558 → 443 [ACK] Seq=256 Ack=41123 Win=656 Len=0 TSval=4249782155 TSecr=2406950966"
"134","0.128660613","35.186.208.48","192.168.1.118","TLSv1.2","2902","Application Data, Application Data"
"135","0.128734050","192.168.1.118","35.186.208.48","TCP","66","36552 → 443 [ACK] Seq=261 Ack=39705 Win=678 Len=0 TSval=4249782155 TSecr=1686132932"
"136","0.128780238","35.186.208.48","192.168.1.118","TLSv1.2","1484","Application Data [TCP segment of a reassembled PDU]"
"137","0.147249075","35.227.209.247","192.168.1.118","TLSv1.2","1484","Application Data"
"138","0.147352188","192.168.1.118","35.227.209.247","TCP","66","45684 → 443 [ACK] Seq=220 Ack=1419 Win=493 Len=0 TSval=3513553682 TSecr=1422483892"
"139","0.147426575","35.186.208.48","192.168.1.118","TLSv1.2","2902","Application Data, Application Data"
"140","0.147495575","192.168.1.118","35.186.208.48","TCP","66","36558 → 443 [ACK] Seq=256 Ack=43959 Win=701 Len=0 TSval=4249782174 TSecr=2406950966"
"141","0.147623813","35.227.209.247","192.168.1.118","TLSv1.2","2902","Application Data, Application Data"
"142","0.147666038","192.168.1.118","35.227.209.247","TCP","66","45684 → 443 [ACK] Seq=220 Ack=4255 Win=471 Len=0 TSval=3513553682 TSecr=1422483893"
"143","0.147715825","35.186.208.48","192.168.1.118","TLSv1.2","1484","Application Data [TCP segment of a reassembled PDU]"
"144","0.147756850","192.168.1.118","35.186.208.48","TCP","66","36560 → 443 [ACK] Seq=288 Ack=41123 Win=767 Len=0 TSval=4249782174 TSecr=1630035366"
"145","0.147820975","35.186.208.48","192.168.1.118","TLSv1.2","2902","Application Data, Application Data"
"146","0.147862975","192.168.1.118","35.186.208.48","TCP","66","36558 → 443 [ACK] Seq=256 Ack=46795 Win=745 Len=0 TSval=4249782174 TSecr=2406950967"
"147","0.147917363","35.186.208.48","192.168.1.118","TLSv1.2","2902","Application Data, Application Data"
"148","0.147958513","192.168.1.118","35.186.208.48","TCP","66","36554 → 443 [ACK] Seq=259 Ack=45377 Win=745 Len=0 TSval=4249782174 TSecr=3618841757"
"149","0.147984850","35.186.208.48","192.168.1.118","TLSv1.2","2902","Application Data, Application Data"
"150","0.148028650","192.168.1.118","35.186.208.48","TCP","66","36552 → 443 [ACK] Seq=261 Ack=42541 Win=723 Len=0 TSval=4249782175 TSecr=1686132933"
"151","0.148054150","35.186.208.48","192.168.1.118","TLSv1.2","2902","Application Data, Application Data"
"152","0.148093038","192.168.1.118","35.186.208.48","TCP","66","36560 → 443 [ACK] Seq=288 Ack=43959 Win=811 Len=0 TSval=4249782175 TSecr=1630035367"
"153","0.148119350","35.186.208.48","192.168.1.118","TLSv1.2","2902","Application Data, Application Data"
"154","0.148158013","192.168.1.118","35.186.208.48","TCP","66","36558 → 443 [ACK] Seq=256 Ack=49631 Win=789 Len=0 TSval=4249782175 TSecr=2406950968"
"155","0.176681225","35.186.208.48","192.168.1.118","TLSv1.2","1484","Application Data [TCP segment of a reassembled PDU]"
"156","0.176805700","192.168.1.118","35.186.208.48","TCP","66","36554 → 443 [ACK] Seq=259 Ack=46795 Win=767 Len=0 TSval=4249782203 TSecr=3618841758"
"157","0.176993338","35.227.209.247","192.168.1.118","TLSv1.2","2902","Application Data, Application Data"
"158","0.177072738","192.168.1.118","35.227.209.247","TCP","66","45684 → 443 [ACK] Seq=220 Ack=7091 Win=477 Len=0 TSval=3513553712 TSecr=1422483894"
"159","0.177212900","35.186.208.48","192.168.1.118","TLSv1.2","5738","Application Data, Application Data, Application Data, Application Data"
"160","0.177291750","192.168.1.118","35.186.208.48","TCP","66","36558 → 443 [ACK] Seq=256 Ack=55303 Win=878 Len=0 TSval=4249782204 TSecr=2406950969"
"161","0.177374975","35.186.208.48","192.168.1.118","TLSv1.2","2902","Application Data, Application Data"
"162","0.177477300","192.168.1.118","35.186.208.48","TCP","66","36552 → 443 [ACK] Seq=261 Ack=45377 Win=767 Len=0 TSval=4249782204 TSecr=1686132935"
"163","0.177548075","35.186.208.48","192.168.1.118","TLSv1.2","2902","Application Data, Application Data"
"164","0.177623863","192.168.1.118","35.186.208.48","TCP","66","36554 → 443 [ACK] Seq=259 Ack=49631 Win=811 Len=0 TSval=4249782204 TSecr=3618841759"
"165","0.177706038","35.186.208.48","192.168.1.118","TLSv1.2","2902","Application Data, Application Data"
"166","0.177782375","192.168.1.118","35.186.208.48","TCP","66","36558 → 443 [ACK] Seq=256 Ack=58139 Win=922 Len=0 TSval=4249782204 TSecr=2406950970"
"167","0.177862775","35.186.208.48","192.168.1.118","TLSv1.2","1484","Application Data [TCP segment of a reassembled PDU]"
"168","0.177937525","192.168.1.118","35.186.208.48","TCP","66","36552 → 443 [ACK] Seq=261 Ack=46795 Win=789 Len=0 TSval=4249782204 TSecr=1686132936"
"169","0.178017925","35.186.208.48","192.168.1.118","TLSv1.2","2902","Application Data, Application Data"
"170","0.178099263","192.168.1.118","35.186.208.48","TCP","66","36560 → 443 [ACK] Seq=288 Ack=46795 Win=856 Len=0 TSval=4249782205 TSecr=1630035369"
"171","0.178177950","35.227.209.247","192.168.1.118","TLSv1.2","2902","Application Data, Application Data"
"172","0.178252063","192.168.1.118","35.227.209.247","TCP","66","45684 → 443 [ACK] Seq=220 Ack=9927 Win=477 Len=0 TSval=3513553713 TSecr=1422483895"
"173","0.178331900","35.186.208.48","192.168.1.118","TLSv1.2","2902","Application Data, Application Data"
"174","0.178407250","192.168.1.118","35.186.208.48","TCP","66","36558 → 443 [ACK] Seq=256 Ack=60975 Win=966 Len=0 TSval=4249782205 TSecr=2406950971"
"175","0.178532925","35.186.208.48","192.168.1.118","TLSv1.2","2902","Application Data, Application Data"
"176","0.178610288","192.168.1.118","35.186.208.48","TCP","66","36554 → 443 [ACK] Seq=259 Ack=52467 Win=856 Len=0 TSval=4249782205 TSecr=3618841761"
"177","0.178690963","35.186.208.48","192.168.1.118","TLSv1.2","2902","Application Data, Application Data"
"178","0.178773925","192.168.1.118","35.186.208.48","TCP","66","36552 → 443 [ACK] Seq=261 Ack=49631 Win=834 Len=0 TSval=4249782205 TSecr=1686132937"
"179","0.178853100","35.227.209.247","192.168.1.118","TLSv1.2","2902","Application Data, Application Data"
"180","0.178952250","35.186.208.48","192.168.1.118","TLSv1.2","2902","Application Data, Application Data"
"181","0.179036413","192.168.1.118","35.186.208.48","TCP","66","36560 → 443 [ACK] Seq=288 Ack=49631 Win=900 Len=0 TSval=4249782206 TSecr=1630035371"
"182","0.179116913","35.186.208.48","192.168.1.118","TLSv1.2","2902","Application Data, Application Data"
"183","0.179191413","192.168.1.118","35.186.208.48","TCP","66","36554 → 443 [ACK] Seq=259 Ack=55303 Win=900 Len=0 TSval=4249782206 TSecr=3618841762"
"184","0.179272575","35.186.208.48","192.168.1.118","TLSv1.2","2902","Application Data, Application Data"
"185","0.179353488","192.168.1.118","35.186.208.48","TCP","66","36552 → 443 [ACK] Seq=261 Ack=52467 Win=878 Len=0 TSval=4249782206 TSecr=1686132938"
"186","0.179436138","35.227.209.247","192.168.1.118","TLSv1.2","2902","Application Data, Application Data"
"187","0.179541363","35.186.208.48","192.168.1.118","TLSv1.2","2902","Application Data, Application Data"
"188","0.179614950","192.168.1.118","35.186.208.48","TCP","66","36560 → 443 [ACK] Seq=288 Ack=52467 Win=944 Len=0 TSval=4249782206 TSecr=1630035373"
"189","0.179696575","35.186.208.48","192.168.1.118","TLSv1.2","2902","Application Data, Application Data"
"190","0.179771313","192.168.1.118","35.186.208.48","TCP","66","36554 → 443 [ACK] Seq=259 Ack=58139 Win=944 Len=0 TSval=4249782206 TSecr=3618841764"
"191","0.179851188","35.186.208.48","192.168.1.118","TLSv1.2","2902","Application Data, Application Data"
"192","0.179927688","192.168.1.118","35.186.208.48","TCP","66","36552 → 443 [ACK] Seq=261 Ack=55303 Win=922 Len=0 TSval=4249782206 TSecr=1686132940"
"193","0.180006975","35.227.209.247","192.168.1.118","TLSv1.2","2902","Application Data, Application Data"
"194","0.180056600","35.227.209.247","192.168.1.118","TLSv1.2","637","Application Data"
"195","0.180116463","35.186.208.48","192.168.1.118","TLSv1.2","2902","Application Data, Application Data"
"196","0.180194163","192.168.1.118","35.186.208.48","TCP","66","36560 → 443 [ACK] Seq=288 Ack=55303 Win=989 Len=0 TSval=4249782207 TSecr=1630035375"
"197","0.180272813","35.186.208.48","192.168.1.118","TLSv1.2","2902","Application Data, Application Data"
"198","0.180346763","192.168.1.118","35.186.208.48","TCP","66","36554 → 443 [ACK] Seq=259 Ack=60975 Win=980 Len=0 TSval=4249782207 TSecr=3618841765"
"199","0.180425700","35.186.208.48","192.168.1.118","TLSv1.2","5738","Application Data, Application Data, Application Data, Application Data"
"200","0.180532100","192.168.1.118","35.186.208.48","TCP","66","36558 → 443 [ACK] Seq=256 Ack=66647 Win=964 Len=0 TSval=4249782207 TSecr=2406950972"
"201","0.180582238","35.186.208.48","192.168.1.118","TLSv1.2","2902","Application Data, Application Data"
"202","0.180663225","192.168.1.118","35.186.208.48","TCP","66","36552 → 443 [ACK] Seq=261 Ack=58139 Win=966 Len=0 TSval=4249782207 TSecr=1686132941"
"203","0.180713788","35.186.208.48","192.168.1.118","TLSv1.2","2902","Application Data, Application Data"
"204","0.180793138","192.168.1.118","35.186.208.48","TCP","66","36560 → 443 [ACK] Seq=288 Ack=58139 Win=996 Len=0 TSval=4249782207 TSecr=1630035376"
"205","0.180840663","35.186.208.48","192.168.1.118","TLSv1.2","2902","Application Data, Application Data"
"206","0.181270513","192.168.1.118","35.186.208.48","TCP","66","36554 → 443 [ACK] Seq=259 Ack=63811 Win=958 Len=0 TSval=4249782208 TSecr=3618841767"
"207","0.181357975","192.168.1.118","35.227.209.247","TCP","66","45684 → 443 [ACK] Seq=220 Ack=19006 Win=407 Len=0 TSval=3513553716 TSecr=1422483897"
"208","0.224664675","35.186.208.48","192.168.1.118","TLSv1.2","2902","Application Data, Application Data"
"209","0.224780775","192.168.1.118","35.186.208.48","TCP","66","36552 → 443 [ACK] Seq=261 Ack=60975 Win=1011 Len=0 TSval=4249782251 TSecr=1686132943"
"210","0.224912613","35.186.208.48","192.168.1.118","TLSv1.2","2902","Application Data, Application Data"
"211","0.224985175","192.168.1.118","35.186.208.48","TCP","66","36554 → 443 [ACK] Seq=259 Ack=66647 Win=1024 Len=0 TSval=4249782251 TSecr=3618841768"
"212","0.225028463","35.186.208.48","192.168.1.118","TLSv1.2","2902","Application Data, Application Data"
"213","0.225091813","192.168.1.118","35.186.208.48","TCP","66","36552 → 443 [ACK] Seq=261 Ack=63811 Win=1055 Len=0 TSval=4249782252 TSecr=1686132944"
"214","0.225132913","35.186.208.48","192.168.1.118","TLSv1.2","1484","Application Data [TCP segment of a reassembled PDU]"
"215","0.230810088","35.186.208.48","192.168.1.118","TLSv1.2","5738","Application Data, Application Data, Application Data, Application Data"
"216","0.230938275","192.168.1.118","35.186.208.48","TCP","66","36558 → 443 [ACK] Seq=256 Ack=72319 Win=1055 Len=0 TSval=4249782257 TSecr=2406950981"
"217","0.231113688","35.186.208.48","192.168.1.118","TLSv1.2","2902","Application Data, Application Data"
"218","0.231195175","192.168.1.118","35.186.208.48","TCP","66","36552 → 443 [ACK] Seq=261 Ack=66647 Win=1060 Len=0 TSval=4249782258 TSecr=1686132946"
"219","0.231310450","35.186.208.48","192.168.1.118","TLSv1.2","2902","Application Data, Application Data"
"220","0.231396700","192.168.1.118","35.186.208.48","TCP","66","36554 → 443 [ACK] Seq=259 Ack=69483 Win=1068 Len=0 TSval=4249782258 TSecr=3618841777"
"221","0.231537263","35.186.208.48","192.168.1.118","TLSv1.2","2902","Application Data, Application Data"
"222","0.231632138","35.186.208.48","192.168.1.118","TLSv1.2","2902","Application Data, Application Data"
"223","0.231706113","192.168.1.118","35.186.208.48","TCP","66","36558 → 443 [ACK] Seq=256 Ack=75155 Win=1060 Len=0 TSval=4249782258 TSecr=2406950982"
"224","0.231755125","35.186.208.48","192.168.1.118","TLSv1.2","2902","Application Data, Application Data"
"225","0.231809725","35.186.208.48","192.168.1.118","TLSv1.2","2902","Application Data, Application Data"
"226","0.232309963","35.186.208.48","192.168.1.118","TLSv1.2","1484","Application Data"
"227","0.232499750","35.186.208.48","192.168.1.118","TLSv1.2","2902","Application Data, Application Data"
"228","0.232635525","35.186.208.48","192.168.1.118","TLSv1.2","2902","Application Data, Application Data"
"229","0.232755075","35.186.208.48","192.168.1.118","TLSv1.2","2902","Application Data, Application Data"
"230","0.232805513","35.186.208.48","192.168.1.118","TLSv1.2","2902","Application Data, Application Data"
"231","0.232845850","35.186.208.48","192.168.1.118","TLSv1.2","2902","Application Data, Application Data"
"232","0.233092875","35.186.208.48","192.168.1.118","TLSv1.2","2902","Application Data, Application Data"
"233","0.233150338","35.186.208.48","192.168.1.118","TLSv1.2","2902","Application Data, Application Data"
"234","0.233194138","35.186.208.48","192.168.1.118","TLSv1.2","1484","Application Data [TCP segment of a reassembled PDU]"
"235","0.236827250","35.186.208.48","192.168.1.118","TLSv1.2","1484","Application Data [TCP segment of a reassembled PDU]"
"236","0.236977675","35.186.208.48","192.168.1.118","TLSv1.2","2902","Application Data, Application Data"
"237","0.237034288","35.186.208.48","192.168.1.118","TLSv1.2","2902","Application Data, Application Data"
"238","0.237078763","35.186.208.48","192.168.1.118","TLSv1.2","1484","Application Data"
"239","0.237239538","35.186.208.48","192.168.1.118","TLSv1.2","1484","Application Data"
"240","0.237349625","35.186.208.48","192.168.1.118","TLSv1.2","2902","Application Data, Application Data"
"241","0.237493700","35.186.208.48","192.168.1.118","TLSv1.2","2902","Application Data, Application Data"
"242","0.237624513","35.186.208.48","192.168.1.118","TLSv1.2","2902","Application Data, Application Data"
"243","0.237723513","35.186.208.48","192.168.1.118","TLSv1.2","1484","Application Data"
"244","0.237771038","35.186.208.48","192.168.1.118","TLSv1.2","2902","Application Data, Application Data"
"245","0.244128863","35.186.208.48","192.168.1.118","TLSv1.2","2902","Application Data, Application Data"
"246","0.244205450","192.168.1.118","35.186.208.48","TCP","66","36560 → 443 [ACK] Seq=288 Ack=62393 Win=1062 Len=0 TSval=4249782271 TSecr=1630035378"
"247","0.244264375","35.186.208.48","192.168.1.118","TLSv1.2","2902","Application Data, Application Data"
"248","0.244301438","35.186.208.48","192.168.1.118","TLSv1.2","2902","Application Data, Application Data"
"249","0.244326750","192.168.1.118","35.186.208.48","TCP","66","36560 → 443 [ACK] Seq=288 Ack=65229 Win=1076 Len=0 TSval=4249782271 TSecr=1630035405"
"250","0.244361388","35.186.208.48","192.168.1.118","TLSv1.2","2902","Application Data, Application Data"
"251","0.244396975","35.186.208.48","192.168.1.118","TLSv1.2","2902","Application Data, Application Data"
"252","0.244427150","35.186.208.48","192.168.1.118","TLSv1.2","2902","Application Data, Application Data"
"253","0.244467350","35.186.208.48","192.168.1.118","TLSv1.2","2902","Application Data, Application Data"
"254","0.244482563","35.186.208.48","192.168.1.118","TLSv1.2","2902","Application Data, Application Data"
"255","0.245793775","35.186.208.48","192.168.1.118","TLSv1.2","1484","Application Data [TCP segment of a reassembled PDU]"
"256","0.246116613","35.186.208.48","192.168.1.118","TLSv1.2","1484","Application Data [TCP segment of a reassembled PDU]"
"257","0.246146513","35.186.208.48","192.168.1.118","TLSv1.2","1484","Application Data [TCP segment of a reassembled PDU]"
"258","0.246209750","35.186.208.48","192.168.1.118","TLSv1.2","2902","Application Data, Application Data"
"259","0.246237425","35.186.208.48","192.168.1.118","TLSv1.2","2221","Application Data, Application Data, Application Data"
"260","0.246262850","35.186.208.48","192.168.1.118","TLSv1.2","2902","Application Data, Application Data"
"261","0.246309538","35.186.208.48","192.168.1.118","TLSv1.2","2902","Application Data, Application Data"
"262","0.246330000","35.186.208.48","192.168.1.118","TLSv1.2","2902","Application Data, Application Data"
"263","0.246347688","35.186.208.48","192.168.1.118","TLSv1.2","2902","Application Data, Application Data"
"264","0.246358775","35.186.208.48","192.168.1.118","TLSv1.2","1484","Application Data [TCP segment of a reassembled PDU]"
"265","0.248873125","35.186.208.48","192.168.1.118","TLSv1.2","1484","Application Data [TCP segment of a reassembled PDU]"
"266","0.248941275","35.186.208.48","192.168.1.118","TLSv1.2","2902","Application Data, Application Data"
"267","0.248963888","35.186.208.48","192.168.1.118","TLSv1.2","2902","Application Data, Application Data"
"268","0.248977613","35.186.208.48","192.168.1.118","TLSv1.2","1484","Application Data [TCP segment of a reassembled PDU]"
"269","0.249069050","35.227.209.247","192.168.1.118","TLSv1.2","637","[TCP Spurious Retransmission] , Application Data"
"270","0.249109113","192.168.1.118","35.227.209.247","TCP","78","[TCP Window Update] 45684 → 443 [ACK] Seq=220 Ack=19006 Win=501 Len=0 TSval=3513553784 TSecr=1422484030 SLE=18435 SRE=19006"
"271","0.249146963","35.186.208.48","192.168.1.118","TLSv1.2","1484","Application Data [TCP segment of a reassembled PDU]"
"272","0.249161500","35.186.208.48","192.168.1.118","TLSv1.2","2902","Application Data, Application Data"
"273","0.249174775","35.186.208.48","192.168.1.118","TLSv1.2","1484","Application Data"
"274","0.252468975","35.186.208.48","192.168.1.118","TLSv1.2","1484","Application Data [TCP segment of a reassembled PDU]"
"275","0.259320150","35.186.208.48","192.168.1.118","TLSv1.2","4320","Application Data, Application Data, Application Data"
"276","0.259390900","35.186.208.48","192.168.1.118","TLSv1.2","2902","Application Data, Application Data"
"277","0.259456988","35.186.208.48","192.168.1.118","TLSv1.2","5738","Application Data, Application Data, Application Data, Application Data"
"278","0.259478063","35.186.208.48","192.168.1.118","TLSv1.2","2902","Application Data, Application Data"
"279","0.259492113","35.186.208.48","192.168.1.118","TLSv1.2","1484","Application Data [TCP segment of a reassembled PDU]"
"280","0.261112050","35.186.208.48","192.168.1.118","TLSv1.2","1484","Application Data [TCP segment of a reassembled PDU]"
"281","0.261187500","35.186.208.48","192.168.1.118","TLSv1.2","2902","Application Data, Application Data"
"282","0.261225888","35.186.208.48","192.168.1.118","TLSv1.2","2902","Application Data, Application Data"
"283","0.261288563","35.186.208.48","192.168.1.118","TLSv1.2","2902","Application Data, Application Data"
"284","0.261304550","35.186.208.48","192.168.1.118","TLSv1.2","658","Application Data"
"285","0.261320900","35.186.208.48","192.168.1.118","TLSv1.2","5738","Application Data, Application Data, Application Data, Application Data"
"286","0.262573763","35.186.208.48","192.168.1.118","TLSv1.2","2902","Application Data, Application Data"
"287","0.262642650","35.186.208.48","192.168.1.118","TLSv1.2","2902","Application Data, Application Data"
"288","0.262668738","35.186.208.48","192.168.1.118","TLSv1.2","1484","Application Data [TCP segment of a reassembled PDU]"
"289","0.272715950","192.168.1.118","35.186.208.48","TCP","66","36556 → 443 [ACK] Seq=394 Ack=24158 Win=313 Len=0 TSval=4249782299 TSecr=1464952179"
"290","0.272791938","192.168.1.118","35.186.208.48","TCP","66","36554 → 443 [ACK] Seq=259 Ack=88654 Win=919 Len=0 TSval=4249782299 TSecr=3618841778"
"291","0.272867438","192.168.1.118","35.186.208.48","TCP","66","36552 → 443 [ACK] Seq=261 Ack=98435 Win=812 Len=0 TSval=4249782299 TSecr=1686132953"
"292","0.273039438","35.186.208.48","192.168.1.118","TLSv1.2","1484","Application Data [TCP segment of a reassembled PDU]"
"293","0.273128050","35.186.208.48","192.168.1.118","TLSv1.2","2902","Application Data, Application Data"
"294","0.273269875","35.186.208.48","192.168.1.118","TLSv1.2","2902","Application Data, Application Data"
"295","0.275364250","35.186.208.48","192.168.1.118","TLSv1.2","2902","Application Data, Application Data"
"296","0.275463338","192.168.1.118","35.186.208.48","TCP","66","36560 → 443 [ACK] Seq=288 Ack=103515 Win=777 Len=0 TSval=4249782302 TSecr=1630035407"
"297","0.275559650","35.186.208.48","192.168.1.118","TLSv1.2","2902","Application Data, Application Data"
"298","0.275649838","35.186.208.48","192.168.1.118","TLSv1.2","2902","Application Data, Application Data"
"299","0.275721800","35.186.208.48","192.168.1.118","TLSv1.2","2902","Application Data, Application Data"
"300","0.278729688","192.168.1.118","35.186.208.48","TCP","66","36558 → 443 [ACK] Seq=256 Ack=120531 Win=706 Len=0 TSval=4249782305 TSecr=2406951004"
"301","0.288673488","35.186.208.48","192.168.1.118","TLSv1.2","1484","Application Data"
"302","0.291776750","35.186.208.48","192.168.1.118","TLSv1.2","1484","Application Data"
"303","0.291841713","35.186.208.48","192.168.1.118","TLSv1.2","1484","Application Data"
"304","0.292899888","35.186.208.48","192.168.1.118","TLSv1.2","1484","Application Data"
"305","0.292982913","35.186.208.48","192.168.1.118","TLSv1.2","2902","Application Data, Application Data"
"306","0.293780200","35.186.208.48","192.168.1.118","TLSv1.2","2902","Application Data, Application Data"
"307","0.294876013","35.186.208.48","192.168.1.118","TLSv1.2","2902","Application Data, Application Data"
"308","0.297355525","35.186.208.48","192.168.1.118","TLSv1.2","1484","Application Data"
"309","0.298676238","35.186.208.48","192.168.1.118","TLSv1.2","1484","Application Data"
"310","0.299866675","35.186.208.48","192.168.1.118","TLSv1.2","2902","Application Data, Application Data"
"311","0.299972850","35.186.208.48","192.168.1.118","TLSv1.2","2902","Application Data, Application Data"
"312","0.308869538","35.186.208.48","192.168.1.118","TLSv1.2","2902","Application Data, Application Data"
"313","0.309008213","192.168.1.118","35.186.208.48","TCP","66","36560 → 443 [ACK] Seq=288 Ack=114859 Win=689 Len=0 TSval=4249782335 TSecr=1630035529"
"314","0.310698113","35.186.208.48","192.168.1.118","TLSv1.2","2902","Application Data, Application Data"
"315","0.310793713","35.186.208.48","192.168.1.118","TLSv1.2","2902","Application Data, Application Data"
"316","0.310853688","35.186.208.48","192.168.1.118","TLSv1.2","1484","Application Data"
"317","0.311058138","35.186.208.48","192.168.1.118","TLSv1.2","1484","Application Data"
"318","0.311165463","35.186.208.48","192.168.1.118","TLSv1.2","2902","Application Data, Application Data"
"319","0.311330575","35.186.208.48","192.168.1.118","TLSv1.2","2902","Application Data, Application Data"
"320","0.311428725","35.186.208.48","192.168.1.118","TLSv1.2","2902","Application Data, Application Data"
"321","0.311507638","35.186.208.48","192.168.1.118","TLSv1.2","2902","Application Data, Application Data"
"322","0.311558363","35.186.208.48","192.168.1.118","TLSv1.2","2902","Application Data, Application Data"
"323","0.313816013","35.186.208.48","192.168.1.118","TLSv1.2","2902","Application Data, Application Data"
"324","0.313923875","35.186.208.48","192.168.1.118","TLSv1.2","1484","Application Data [TCP segment of a reassembled PDU]"
"325","0.324797975","192.168.1.118","35.186.208.48","TCP","66","36558 → 443 [ACK] Seq=256 Ack=127621 Win=651 Len=0 TSval=4249782351 TSecr=2406951166"
"326","0.324892938","192.168.1.118","35.186.208.48","TCP","66","36560 → 443 [ACK] Seq=288 Ack=123367 Win=623 Len=0 TSval=4249782351 TSecr=1630035562"
"327","0.325019075","192.168.1.118","35.186.208.48","TCP","66","36556 → 443 [ACK] Seq=394 Ack=58190 Win=48 Len=0 TSval=4249782352 TSecr=1464952338"
"328","0.325329963","192.168.1.118","104.106.255.95","TLSv1.2","1422","Application Data"
"329","0.330752300","35.186.208.48","192.168.1.118","TLSv1.2","1484","Application Data [TCP segment of a reassembled PDU]"
"330","0.330886800","35.186.208.48","192.168.1.118","TLSv1.2","2902","Application Data, Application Data"
