frame.number,_ws.col.Time,_ws.col.Source,_ws.col.Destination,_ws.col.Protocol,frame.len,_ws.col.Info
"1","0.000000000","162.125.4.1","192.168.1.118","TLSv1.2","139","Application Data"
"2","0.001863225","162.125.4.1","192.168.1.118","TCP","1514","[TCP segment of a reassembled PDU]"
"3","0.001903312","192.168.1.118","162.125.4.1","TCP","66","45682 → 443 [ACK] Seq=1 Ack=1522 Win=493 Len=0 TSval=1396402125 TSecr=348467958"
"4","0.002102575","192.168.1.118","104.16.100.29","TCP","74","41558 → 443 [SYN] Seq=0 Win=64240 Len=0 MSS=1460 SACK_PERM=1 TSval=1463466126 TSecr=0 WS=128"
"5","0.008872812","162.125.4.1","192.168.1.118","TLSv1.2","320","Application Data"
"6","0.008915200","162.125.4.1","192.168.1.118","TLSv1.2","971","Application Data"
"7","0.008935162","162.125.4.1","192.168.1.118","TLSv1.2","109","Application Data"
"8","0.008953050","162.125.4.1","192.168.1.118","TLSv1.2","712","Application Data"
"9","0.009177762","192.168.1.118","162.125.4.1","TCP","66","45682 → 443 [ACK] Seq=1 Ack=3370 Win=479 Len=0 TSval=1396402132 TSecr=348467959"
"10","0.009829412","162.125.4.1","192.168.1.118","TLSv1.2","779","Application Data"
"11","0.011506300","104.16.100.29","192.168.1.118","TCP","54","443 → 41556 [ACK] Seq=1 Ack=1 Win=66 Len=0"
"12","0.012379050","162.125.248.1","192.168.1.118","TCP","66","443 → 40338 [ACK] Seq=1 Ack=1 Win=58 Len=0 TSval=3072541228 TSecr=4079537459"
"13","0.015625450","162.125.248.1","192.168.1.118","TLSv1.2","1514","Server Hello"
"14","0.015666987","192.168.1.118","162.125.248.1","TCP","66","40338 → 443 [ACK] Seq=1 Ack=1449 Win=493 Len=0 TSval=4079537512 TSecr=3072541230"
"15","0.017710412","162.125.248.1","192.168.1.118","TLSv1.2","2279","Certificate, Server Key Exchange, Server Hello Done"
"16","0.017746312","192.168.1.118","162.125.248.1","TCP","66","40338 → 443 [ACK] Seq=1 Ack=3662 Win=476 Len=0 TSval=4079537514 TSecr=3072541230"
"17","0.022950937","192.168.1.118","162.125.248.1","TLSv1.2","192","Client Key Exchange, Change Cipher Spec, Encrypted Handshake Message"
"18","0.023199475","192.168.1.118","104.16.100.29","TCP","74","41560 → 443 [SYN] Seq=0 Win=64240 Len=0 MSS=1460 SACK_PERM=1 TSval=1463466147 TSecr=0 WS=128"
"19","0.023239775","104.16.100.29","192.168.1.118","TLSv1.2","3520","Server Hello, Certificate, Server Key Exchange, Server Hello Done"
"20","0.023295850","192.168.1.118","104.16.100.29","TCP","54","41556 → 443 [ACK] Seq=1 Ack=3467 Win=475 Len=0"
"21","0.023324450","192.168.1.118","104.16.100.29","TCP","74","41562 → 443 [SYN] Seq=0 Win=64240 Len=0 MSS=1460 SACK_PERM=1 TSval=1463466147 TSecr=0 WS=128"
"22","0.023446737","192.168.1.118","104.16.100.29","TCP","74","41564 → 443 [SYN] Seq=0 Win=64240 Len=0 MSS=1460 SACK_PERM=1 TSval=1463466147 TSecr=0 WS=128"
"23","0.025407337","192.168.1.118","104.16.100.29","TLSv1.2","180","Client Key Exchange, Change Cipher Spec, Encrypted Handshake Message"
"24","0.037910650","104.16.100.29","192.168.1.118","TCP","66","443 → 41560 [SYN, ACK] Seq=0 Ack=1 Win=65535 Len=0 MSS=1400 SACK_PERM=1 WS=1024"
"25","0.038027037","192.168.1.118","104.16.100.29","TCP","54","41560 → 443 [ACK] Seq=1 Ack=1 Win=64256 Len=0"
"26","0.043221187","104.16.100.29","192.168.1.118","TCP","66","443 → 41558 [SYN, ACK] Seq=0 Ack=1 Win=65535 Len=0 MSS=1400 SACK_PERM=1 WS=1024"
"27","0.043312212","192.168.1.118","104.16.100.29","TCP","54","41558 → 443 [ACK] Seq=1 Ack=1 Win=64256 Len=0"
"28","0.044571175","162.125.248.1","192.168.1.118","TLSv1.2","117","Change Cipher Spec, Encrypted Handshake Message"
"29","0.047666237","104.16.100.29","192.168.1.118","TCP","54","443 → 41556 [ACK] Seq=3467 Ack=127 Win=66 Len=0"
"30","0.049025050","104.16.100.29","192.168.1.118","TLSv1.2","105","Change Cipher Spec, Encrypted Handshake Message"
"31","0.049089012","104.16.100.29","192.168.1.118","TCP","66","443 → 41562 [SYN, ACK] Seq=0 Ack=1 Win=65535 Len=0 MSS=1400 SACK_PERM=1 WS=1024"
"32","0.049183700","192.168.1.118","104.16.100.29","TCP","54","41562 → 443 [ACK] Seq=1 Ack=1 Win=64256 Len=0"
"33","0.049253675","104.16.100.29","192.168.1.118","TCP","66","443 → 41564 [SYN, ACK] Seq=0 Ack=1 Win=65535 Len=0 MSS=1400 SACK_PERM=1 WS=1024"
"34","0.049367350","192.168.1.118","104.16.100.29","TCP","54","41564 → 443 [ACK] Seq=1 Ack=1 Win=64256 Len=0"
"35","0.050400725","192.168.1.118","162.125.4.1","TCP","66","45682 → 443 [ACK] Seq=1 Ack=4083 Win=501 Len=0 TSval=1396402173 TSecr=348467961"
"36","0.054831687","192.168.1.118","104.16.100.29","TLSv1","571","Client Hello"
"37","0.062517112","162.125.4.1","192.168.1.118","TLSv1.2","2020","Application Data"
"38","0.062601137","192.168.1.118","162.125.4.1","TCP","66","45682 → 443 [ACK] Seq=1 Ack=6037 Win=486 Len=0 TSval=1396402185 TSecr=348468007"
"39","0.062683925","162.125.4.1","192.168.1.118","TLSv1.2","1134","Application Data"
"40","0.062758225","192.168.1.118","162.125.4.1","TCP","66","45682 → 443 [ACK] Seq=1 Ack=7105 Win=478 Len=0 TSval=1396402185 TSecr=348468007"
"41","0.062836087","162.125.4.1","192.168.1.118","TLSv1.2","112","Application Data"
"42","0.062908575","192.168.1.118","162.125.4.1","TCP","66","45682 → 443 [ACK] Seq=1 Ack=7151 Win=478 Len=0 TSval=1396402186 TSecr=348468007"
"43","0.062997787","162.125.4.1","192.168.1.118","TLSv1.2","852","Application Data"
"44","0.063080637","192.168.1.118","162.125.4.1","TCP","66","45682 → 443 [ACK] Seq=1 Ack=7937 Win=472 Len=0 TSval=1396402186 TSecr=348468007"
"45","0.063160300","162.125.4.1","192.168.1.118","TLSv1.2","711","Application Data"
"46","0.063233962","192.168.1.118","162.125.4.1","TCP","66","45682 → 443 [ACK] Seq=1 Ack=8582 Win=467 Len=0 TSval=1396402186 TSecr=348468008"
"47","0.063309950","162.125.4.1","192.168.1.118","TLSv1.2","117","Application Data"
"48","0.063407362","192.168.1.118","162.125.4.1","TCP","66","45682 → 443 [ACK] Seq=1 Ack=8633 Win=467 Len=0 TSval=1396402186 TSecr=348468008"
"49","0.071363962","192.168.1.118","104.16.100.29","TLSv1","571","Client Hello"
"50","0.085406112","192.168.1.118","162.125.248.1","TCP","66","40338 → 443 [ACK] Seq=127 Ack=3713 Win=501 Len=0 TSval=4079537582 TSecr=3072541255"
"51","0.087816375","192.168.1.118","104.16.100.29","TLSv1","571","Client Hello"
"52","0.088837612","192.168.1.118","104.16.100.29","TLSv1.2","234","Application Data"
"53","0.089088800","192.168.1.118","162.125.248.1","TLSv1.2","244","Application Data"
"54","0.092786425","162.125.4.1","192.168.1.118","TLSv1.2","1121","Application Data"
"55","0.092871350","192.168.1.118","162.125.4.1","TCP","66","45682 → 443 [ACK] Seq=1 Ack=9688 Win=524 Len=0 TSval=1396402215 TSecr=348468008"
"56","0.092956887","162.125.4.1","192.168.1.118","TLSv1.2","650","Application Data"
"57","0.093033862","192.168.1.118","162.125.4.1","TCP","66","45682 → 443 [ACK] Seq=1 Ack=10272 Win=546 Len=0 TSval=1396402216 TSecr=348468008"
"58","0.093144200","162.125.4.1","192.168.1.118","TLSv1.2","1956","Application Data"
"59","0.093226250","192.168.1.118","162.125.4.1","TCP","66","45682 → 443 [ACK] Seq=1 Ack=12162 Win=576 Len=0 TSval=1396402216 TSecr=348468013"
"60","0.093322000","162.125.4.1","192.168.1.118","TLSv1.2","1671","Application Data"
"61","0.093430675","192.168.1.118","162.125.4.1","TCP","66","45682 → 443 [ACK] Seq=1 Ack=13767 Win=601 Len=0 TSval=1396402216 TSecr=348468013"
"62","0.093495237","162.125.4.1","192.168.1.118","TLSv1.2","108","Application Data"
"63","0.093572000","162.125.4.1","192.168.1.118","TLSv1.2","1721","Application Data"
"64","0.093645312","192.168.1.118","162.125.4.1","TCP","66","45682 → 443 [ACK] Seq=1 Ack=15464 Win=627 Len=0 TSval=1396402216 TSecr=348468014"
"65","0.093721300","162.125.4.1","192.168.1.118","TLSv1.2","1574","Application Data"
"66","0.093798987","192.168.1.118","162.125.4.1","TCP","66","45682 → 443 [ACK] Seq=1 Ack=16972 Win=650 Len=0 TSval=1396402216 TSecr=348468015"
"67","0.098028550","162.125.4.1","192.168.1.118","TLSv1.2","1514","Application Data"
"68","0.098109687","192.168.1.118","162.125.4.1","TCP","66","45682 → 443 [ACK] Seq=1 Ack=18420 Win=673 Len=0 TSval=1396402221 TSecr=348468054"
"69","0.105393212","192.168.1.118","104.16.100.29","TLSv1","571","Client Hello"
"70","0.121314775","104.16.100.29","192.168.1.118","TCP","54","443 → 41560 [ACK] Seq=1 Ack=518 Win=67584 Len=0"
"71","0.128485787","104.16.100.29","192.168.1.118","TLSv1.2","1514","Server Hello"
"72","0.128516387","192.168.1.118","104.16.100.29","TCP","54","41560 → 443 [ACK] Seq=518 Ack=1461 Win=63104 Len=0"
"73","0.135937812","104.16.100.29","192.168.1.118","TLSv1.2","2060","Certificate, Server Key Exchange, Server Hello Done"
"74","0.136001750","192.168.1.118","104.16.100.29","TCP","54","41560 → 443 [ACK] Seq=518 Ack=3467 Win=61184 Len=0"
"75","0.138077800","192.168.1.118","104.16.100.29","TLSv1.2","180","Client Key Exchange, Change Cipher Spec, Encrypted Handshake Message"
"76","0.138512662","162.125.4.1","192.168.1.118","TLSv1.2","5858","Application Data, Application Data, Application Data, Application Data, Application Data, Application Data"
"77","0.138548325","192.168.1.118","162.125.4.1","TCP","66","45682 → 443 [ACK] Seq=1 Ack=24212 Win=764 Len=0 TSval=1396402261 TSecr=348468092"
"78","0.138579975","162.125.4.1","192.168.1.118","TLSv1.2","2962","Application Data, Application Data, Application Data"
"79","0.138609675","192.168.1.118","162.125.4.1","TCP","66","45682 → 443 [ACK] Seq=1 Ack=27108 Win=809 Len=0 TSval=1396402261 TSecr=348468092"
"80","0.139242525","162.125.4.1","192.168.1.118","TLSv1.2","8754","Application Data, Application Data, Application Data, Application Data, Application Data, Application Data, Application Data, Application Data, Application Data"
"81","0.139280437","192.168.1.118","162.125.4.1","TCP","66","45682 → 443 [ACK] Seq=1 Ack=35796 Win=945 Len=0 TSval=1396402262 TSecr=348468092"
"82","0.151300075","104.16.100.29","192.168.1.118","TCP","54","443 → 41556 [ACK] Seq=3518 Ack=307 Win=67 Len=0"
"83","0.151375162","104.16.100.29","192.168.1.118","TCP","54","443 → 41562 [ACK] Seq=1 Ack=518 Win=67584 Len=0"
"84","0.151416937","104.16.100.29","192.168.1.118","TCP","54","443 → 41564 [ACK] Seq=1 Ack=518 Win=67584 Len=0"
"85","0.151464425","162.125.4.1","192.168.1.118","TLSv1.2","2962","Application Data, Application Data, Application Data"
"86","0.151505587","192.168.1.118","162.125.4.1","TCP","66","45682 → 443 [ACK] Seq=1 Ack=38692 Win=990 Len=0 TSval=1396402274 TSecr=348468101"
"87","0.151590725","162.125.248.1","192.168.1.118","TLSv1.2","412","Application Data"
"88","0.151638000","192.168.1.118","162.125.248.1","TCP","66","40338 → 443 [ACK] Seq=305 Ack=4059 Win=499 Len=0 TSval=4079537648 TSecr=3072541358"
"89","0.151718812","162.125.4.1","192.168.1.118","TLSv1.2","5858","Application Data, Application Data, Application Data, Application Data, Application Data, Application Data"
"90","0.151760062","192.168.1.118","162.125.4.1","TCP","66","45682 → 443 [ACK] Seq=1 Ack=44484 Win=1071 Len=0 TSval=1396402274 TSecr=348468101"
"91","0.153519862","104.16.100.29","192.168.1.118","TLSv1.2","3520","Server Hello, Certificate, Server Key Exchange, Server Hello Done"
"92","0.153562375","192.168.1.118","104.16.100.29","TCP","54","41564 → 443 [ACK] Seq=518 Ack=3467 Win=60800 Len=0"
"93","0.153665600","104.16.100.29","192.168.1.118","SSL","2060","[TCP Previous segment not captured] , Continuation Data"
"94","0.153707300","192.168.1.118","104.16.100.29","TCP","66","[TCP Dup ACK 32#1] 41562 → 443 [ACK] Seq=518 Ack=1 Win=64256 Len=0 SLE=1461 SRE=3467"
"95","0.153753350","162.125.4.1","192.168.1.118","TLSv1.2","1514","Application Data, Application Data, Application Data, Application Data"
"96","0.153780462","104.16.100.29","192.168.1.118","TCP","1514","[TCP Out-Of-Order] 443 → 41562 [ACK] Seq=1 Ack=518 Win=67584 Len=1460"
"97","0.153817462","192.168.1.118","104.16.100.29","TCP","54","41562 → 443 [ACK] Seq=518 Ack=3467 Win=60800 Len=0"
"98","0.155630425","192.168.1.118","104.16.100.29","TLSv1.2","180","Client Key Exchange, Change Cipher Spec, Encrypted Handshake Message"
"99","0.157172575","104.16.100.29","192.168.1.118","TCP","54","443 → 41558 [ACK] Seq=1 Ack=518 Win=67584 Len=0"
"100","0.159222537","104.16.100.29","192.168.1.118","TLSv1.2","3520","Server Hello, Certificate, Server Key Exchange, Server Hello Done"
"101","0.159283750","192.168.1.118","104.16.100.29","TCP","54","41558 → 443 [ACK] Seq=518 Ack=3467 Win=60800 Len=0"
"102","0.159342150","104.16.100.29","192.168.1.118","TLSv1.2","1426","Application Data"
"103","0.159412800","104.16.100.29","192.168.1.118","TLSv1.2","88","Application Data"
"104","0.159452662","192.168.1.118","104.16.100.29","TLSv1.2","180","Client Key Exchange, Change Cipher Spec, Encrypted Handshake Message"
"105","0.161575225","192.168.1.118","104.16.100.29","TLSv1.2","180","Client Key Exchange, Change Cipher Spec, Encrypted Handshake Message"
"106","0.162777912","192.168.1.118","104.16.100.29","TCP","54","41556 → 443 [ACK] Seq=307 Ack=4924 Win=501 Len=0"
"107","0.165073812","192.168.1.118","104.16.100.29","TLSv1.2","281","Application Data"
"108","0.182275125","104.16.100.29","192.168.1.118","TCP","54","443 → 41560 [ACK] Seq=3467 Ack=644 Win=67584 Len=0"
"109","0.190089337","104.16.100.29","192.168.1.118","TLSv1.2","105","Change Cipher Spec, Encrypted Handshake Message"
"110","0.190207075","162.125.4.1","192.168.1.118","TLSv1.2","8754","Application Data, Application Data, Application Data, Application Data, Application Data, Application Data, Application Data, Application Data, Application Data, Application Data, Application Data, Application Data, Application Data, Application Data, Application Data, Application Data, Application Data, Application Data, Application Data, Application Data, Application Data"
"111","0.190258250","192.168.1.118","162.125.4.1","TCP","66","45682 → 443 [ACK] Seq=1 Ack=54620 Win=1071 Len=0 TSval=1396402313 TSecr=348468103"
"112","0.190611150","192.168.1.118","104.16.100.29","TLSv1.2","294","Application Data"
"113","0.197420962","162.125.4.1","192.168.1.118","TLSv1.2","2962","Application Data [TCP segment of a reassembled PDU]"
"114","0.197516912","162.125.4.1","192.168.1.118","TLSv1.2","2519","Application Data, Application Data, Application Data, Application Data, Application Data, Application Data, Application Data"
"115","0.198084587","192.168.1.118","162.125.4.1","TCP","66","45682 → 443 [ACK] Seq=1 Ack=59969 Win=1030 Len=0 TSval=1396402321 TSecr=348468142"
"116","0.216316700","104.16.100.29","192.168.1.118","TLSv1.2","600","[TCP Spurious Retransmission] , Ignored Unknown Record"
"117","0.216450837","192.168.1.118","104.16.100.29","TCP","66","[TCP Dup ACK 97#1] 41562 → 443 [ACK] Seq=644 Ack=3467 Win=64128 Len=0 SLE=2921 SRE=3467"
"118","0.230086912","104.16.100.29","192.168.1.118","TLSv1.2","600","[TCP Spurious Retransmission] , Ignored Unknown Record"
"119","0.230147325","192.168.1.118","104.16.100.29","TCP","66","[TCP Dup ACK 101#1] 41558 → 443 [ACK] Seq=644 Ack=3467 Win=64128 Len=0 SLE=2921 SRE=3467"
"120","0.231380687","104.16.100.29","192.168.1.118","TLSv1.2","88","[TCP Spurious Retransmission] , Application Data"
"121","0.231458912","192.168.1.118","104.16.100.29","TCP","66","[TCP Dup ACK 106#1] 41556 → 443 [ACK] Seq=534 Ack=4924 Win=501 Len=0 SLE=4890 SRE=4924"
"122","0.246974775","104.16.100.29","192.168.1.118","TCP","54","443 → 41560 [ACK] Seq=3518 Ack=884 Win=68608 Len=0"
"123","0.248330525","104.16.100.29","192.168.1.118","TCP","54","443 → 41564 [ACK] Seq=3467 Ack=644 Win=67584 Len=0"
"124","0.248375387","104.16.100.29","192.168.1.118","TLSv1.2","1514","[TCP Spurious Retransmission] , Server Hello"
"125","0.248415175","192.168.1.118","104.16.100.29","TCP","66","[TCP Dup ACK 97#2] 41562 → 443 [ACK] Seq=644 Ack=3467 Win=64128 Len=0 SLE=1 SRE=1461"
"126","0.248452150","104.16.100.29","192.168.1.118","TCP","54","443 → 41562 [ACK] Seq=3467 Ack=644 Win=67584 Len=0"
"127","0.248476762","104.16.100.29","192.168.1.118","TLSv1.2","105","Change Cipher Spec, Encrypted Handshake Message"
"128","0.248896712","192.168.1.118","104.16.100.29","TLSv1.2","277","Application Data"
"129","0.252456975","104.16.100.29","192.168.1.118","TLSv1.2","105","Change Cipher Spec, Encrypted Handshake Message"
"130","0.252480587","192.168.1.118","104.16.100.29","TCP","54","41562 → 443 [ACK] Seq=644 Ack=3518 Win=64128 Len=0"
"131","0.252504962","104.16.100.29","192.168.1.118","TCP","54","443 → 41558 [ACK] Seq=3467 Ack=644 Win=67584 Len=0"
"132","0.252549562","104.16.100.29","192.168.1.118","TCP","54","[TCP Dup ACK 131#1] 443 → 41558 [ACK] Seq=3467 Ack=644 Win=67584 Len=0"
"133","0.252582800","104.16.100.29","192.168.1.118","TLSv1.2","105","Change Cipher Spec, Encrypted Handshake Message"
"134","0.252620325","192.168.1.118","104.16.100.29","TCP","54","41558 → 443 [ACK] Seq=644 Ack=3518 Win=64128 Len=0"
"135","0.253230087","192.168.1.118","104.16.100.29","TLSv1.2","278","Application Data"
"136","0.253523975","192.168.1.118","104.16.100.29","TLSv1.2","277","Application Data"
"137","0.256329725","104.16.100.29","192.168.1.118","TLSv1.2","1392","Application Data"
"138","0.256395562","192.168.1.118","104.16.100.29","TCP","54","41556 → 443 [ACK] Seq=534 Ack=6262 Win=493 Len=0"
"139","0.258706512","104.16.100.29","192.168.1.118","TLSv1.2","88","Application Data"
"140","0.258743125","192.168.1.118","104.16.100.29","TCP","54","41556 → 443 [ACK] Seq=534 Ack=6296 Win=501 Len=0"
"141","0.258785087","104.16.100.29","192.168.1.118","TLSv1.2","1452","Application Data"
"142","0.258826937","104.16.100.29","192.168.1.118","TLSv1.2","1452","Application Data"
"143","0.258868712","104.16.100.29","192.168.1.118","TLSv1.2","642","Application Data"
"144","0.258909762","104.16.100.29","192.168.1.118","TLSv1.2","1076","Application Data"
"145","0.258944562","104.16.100.29","192.168.1.118","TLSv1.2","88","Application Data"
"146","0.259260425","192.168.1.118","104.16.100.29","TCP","54","41560 → 443 [ACK] Seq=884 Ack=7958 Win=59776 Len=0"
"147","0.260670437","192.168.1.118","104.16.100.29","TLSv1.2","276","Application Data"
"148","0.268375625","192.168.1.118","104.16.100.29","TLSv1.2","280","Application Data"
"149","0.289385212","104.16.100.29","192.168.1.118","TCP","54","443 → 41558 [ACK] Seq=3518 Ack=868 Win=68608 Len=0"
"150","0.292322625","104.16.100.29","192.168.1.118","TCP","54","443 → 41562 [ACK] Seq=3518 Ack=867 Win=68608 Len=0"
"151","0.292433950","104.16.100.29","192.168.1.118","TCP","54","443 → 41564 [ACK] Seq=3518 Ack=867 Win=68608 Len=0"
"152","0.292519850","104.16.100.29","192.168.1.118","TLSv1.2","1452","Application Data"
"153","0.292601212","104.16.100.29","192.168.1.118","TLSv1.2","1452","Application Data"
"154","0.292702325","104.16.100.29","192.168.1.118","TLSv1.2","2850","Application Data, Application Data"
"155","0.292955862","104.16.100.29","192.168.1.118","TLSv1.2","4850","Application Data, Application Data, Application Data, Application Data, Application Data"
"156","0.293046912","104.16.100.29","192.168.1.118","TLSv1.2","1452","Application Data"
"157","0.293121912","192.168.1.118","104.16.100.29","TCP","54","41564 → 443 [ACK] Seq=867 Ack=13906 Win=53760 Len=0"
"158","0.293129687","104.16.100.29","192.168.1.118","TLSv1.2","1452","Application Data"
"159","0.293230012","104.16.100.29","192.168.1.118","TLSv1.2","2850","Application Data, Application Data"
"160","0.293314675","104.16.100.29","192.168.1.118","TLSv1.2","1452","Application Data"
"161","0.293439962","104.16.100.29","192.168.1.118","TLSv1.2","1452","Application Data"
"162","0.294199087","192.168.1.118","104.16.100.29","TCP","54","41562 → 443 [ACK] Seq=867 Ack=11906 Win=55808 Len=0"
"163","0.298195612","104.16.100.29","192.168.1.118","TLSv1.2","1452","Application Data"
"164","0.298309187","104.16.100.29","192.168.1.118","TLSv1.2","2850","Application Data, Application Data"
"165","0.298417075","104.16.100.29","192.168.1.118","TLSv1.2","524","Application Data, Application Data"
"166","0.298493162","104.16.100.29","192.168.1.118","TLSv1.2","1260","Application Data"
"167","0.298563125","104.16.100.29","192.168.1.118","TLSv1.2","88","Application Data"
"168","0.298721725","104.16.100.29","192.168.1.118","TLSv1.2","1452","Application Data"
"169","0.298815687","104.16.100.29","192.168.1.118","TLSv1.2","673","Application Data"
"170","0.298887900","104.16.100.29","192.168.1.118","TLSv1.2","88","Application Data"
"171","0.298957000","104.16.100.29","192.168.1.118","TLSv1.2","1452","Application Data"
"172","0.299048112","104.16.100.29","192.168.1.118","TLSv1.2","1452","Application Data"
"173","0.299124225","104.16.100.29","192.168.1.118","TLSv1.2","1452","Application Data"
"174","0.299201300","104.16.100.29","192.168.1.118","TLSv1.2","368","Application Data"
"175","0.299269475","104.16.100.29","192.168.1.118","TLSv1.2","88","Application Data"
"176","0.303823200","192.168.1.118","104.16.100.29","TCP","54","41562 → 443 [ACK] Seq=867 Ack=16570 Win=51200 Len=0"
"177","0.304124812","192.168.1.118","104.16.100.29","TCP","54","41556 → 443 [ACK] Seq=756 Ack=8347 Win=485 Len=0"
"178","0.304383825","192.168.1.118","104.16.100.29","TCP","54","41560 → 443 [ACK] Seq=1110 Ack=12500 Win=59648 Len=0"
"179","0.304585137","192.168.1.118","104.16.100.29","TCP","54","41558 → 443 [ACK] Seq=868 Ack=4758 Win=64128 Len=0"
"180","0.306936100","192.168.1.118","104.16.100.29","TLSv1.2","305","Application Data"
"181","0.330034875","192.168.1.118","104.16.100.29","TLSv1.2","282","Application Data"
"182","0.332792275","192.168.1.118","104.16.100.29","TLSv1.2","282","Application Data"
"183","0.332920987","192.168.1.118","104.16.100.29","TLSv1.2","293","Application Data"
"184","0.339765062","104.16.100.29","192.168.1.118","TLSv1.2","88","[TCP Spurious Retransmission] , Application Data"
"185","0.339872937","192.168.1.118","104.16.100.29","TCP","66","[TCP Dup ACK 179#1] 41558 → 443 [ACK] Seq=1096 Ack=4758 Win=64128 Len=0 SLE=4724 SRE=4758"
"186","0.341915237","192.168.1.118","104.16.100.29","TLSv1.2","289","Application Data"
"187","0.344405125","104.16.100.29","192.168.1.118","TLSv1.2","1452","Application Data"
"188","0.347052137","104.16.100.29","192.168.1.118","TLSv1.2","1452","Application Data"
"189","0.347154462","104.16.100.29","192.168.1.118","TLSv1.2","1452","Application Data"
"190","0.347235775","104.16.100.29","192.168.1.118","TLSv1.2","1433","Application Data"
"191","0.347317712","104.16.100.29","192.168.1.118","TLSv1.2","88","Application Data"
"192","0.348591437","192.168.1.118","104.16.100.29","TCP","54","41556 → 443 [ACK] Seq=1007 Ack=13954 Win=458 Len=0"
"193","0.358209850","192.168.1.118","104.16.100.29","TLSv1.2","293","Application Data"
"194","0.401457500","104.16.100.29","192.168.1.118","TLSv1.2","1319","Application Data"
"195","0.401561525","104.16.100.29","192.168.1.118","TLSv1.2","88","Application Data"
"196","0.401612500","104.16.100.29","192.168.1.118","TLSv1.2","1452","Application Data"
"197","0.401690950","192.168.1.118","104.16.100.29","TCP","54","41558 → 443 [ACK] Seq=1096 Ack=6156 Win=63104 Len=0"
"198","0.401767037","104.16.100.29","192.168.1.118","TLSv1.2","1452","Application Data"
"199","0.401817475","192.168.1.118","104.16.100.29","TCP","54","41558 → 443 [ACK] Seq=1096 Ack=7554 Win=61824 Len=0"
"200","0.401875975","104.16.100.29","192.168.1.118","TLSv1.2","1514","Application Data"
"201","0.401930487","192.168.1.118","104.16.100.29","TCP","54","41558 → 443 [ACK] Seq=1096 Ack=9014 Win=60416 Len=0"
"202","0.402031112","104.16.100.29","192.168.1.118","TLSv1.2","1390","Application Data"
"203","0.402080537","192.168.1.118","104.16.100.29","TCP","54","41558 → 443 [ACK] Seq=1096 Ack=10350 Win=59136 Len=0"
"204","0.402168262","104.16.100.29","192.168.1.118","TLSv1.2","4248","Application Data, Application Data, Application Data"
"205","0.402223812","192.168.1.118","104.16.100.29","TCP","54","41558 → 443 [ACK] Seq=1096 Ack=14544 Win=55040 Len=0"
"206","0.402280562","104.16.100.29","192.168.1.118","TLSv1.2","1135","Application Data"
"207","0.402340575","104.16.100.29","192.168.1.118","TLSv1.2","88","Application Data"
"208","0.402422662","104.16.100.29","192.168.1.118","TLSv1.2","2018","Application Data, Application Data"
"209","0.402477237","192.168.1.118","104.16.100.29","TCP","54","41558 → 443 [ACK] Seq=1096 Ack=16508 Win=53120 Len=0"
"210","0.402547675","104.16.100.29","192.168.1.118","TLSv1.2","2141","Application Data, Application Data"
"211","0.402597200","192.168.1.118","104.16.100.29","TCP","54","41558 → 443 [ACK] Seq=1096 Ack=18595 Win=51072 Len=0"
"212","0.402648725","104.16.100.29","192.168.1.118","TLSv1.2","88","Application Data"
"213","0.402695000","192.168.1.118","104.16.100.29","TCP","54","41558 → 443 [ACK] Seq=1096 Ack=18629 Win=51072 Len=0"
"214","0.403009412","192.168.1.118","104.16.100.29","TCP","54","41564 → 443 [ACK] Seq=1106 Ack=15205 Win=64128 Len=0"
"215","0.403582225","192.168.1.118","104.16.100.29","TCP","54","41560 → 443 [ACK] Seq=1338 Ack=13615 Win=64128 Len=0"
"216","0.407150912","104.16.100.29","192.168.1.118","TCP","54","443 → 41562 [ACK] Seq=16570 Ack=1102 Win=69632 Len=0"
"217","0.407198162","192.168.1.118","104.16.100.29","TLSv1.2","284","Application Data"
"218","0.407236687","104.16.100.29","192.168.1.118","TLSv1.2","1419","Application Data"
"219","0.407298737","104.16.100.29","192.168.1.118","TLSv1.2","88","Application Data"
"220","0.407334750","192.168.1.118","104.16.100.29","TLSv1.2","293","Application Data"
"221","0.408684712","192.168.1.118","104.16.100.29","TCP","54","41562 → 443 [ACK] Seq=1102 Ack=17969 Win=64128 Len=0"
"222","0.417089787","192.168.1.118","104.16.100.29","TLSv1.2","299","Application Data"
"223","0.428133762","104.16.100.29","192.168.1.118","TLSv1.2","88","[TCP Spurious Retransmission] , Application Data"
"224","0.428273925","192.168.1.118","104.16.100.29","TCP","66","[TCP Dup ACK 192#1] 41556 → 443 [ACK] Seq=1246 Ack=13954 Win=501 Len=0 SLE=13920 SRE=13954"
"225","0.430074512","192.168.1.118","104.16.100.29","TLSv1.2","296","Application Data"
"226","0.432530375","104.16.100.29","192.168.1.118","TLSv1.2","88","[TCP Spurious Retransmission] , Application Data"
"227","0.432666100","192.168.1.118","104.16.100.29","TCP","66","[TCP Dup ACK 213#1] 41558 → 443 [ACK] Seq=1338 Ack=18629 Win=64128 Len=0 SLE=18595 SRE=18629"
"228","0.432771675","104.16.100.29","192.168.1.118","TLSv1.2","88","[TCP Spurious Retransmission] , Application Data"
"229","0.432854425","192.168.1.118","104.16.100.29","TCP","66","[TCP Dup ACK 215#1] 41560 → 443 [ACK] Seq=1568 Ack=13615 Win=64128 Len=0 SLE=13581 SRE=13615"
"230","0.466100450","104.16.100.29","192.168.1.118","TLSv1.2","1452","Application Data"
"231","0.466196225","192.168.1.118","104.16.100.29","TCP","54","41560 → 443 [ACK] Seq=1568 Ack=15013 Win=63104 Len=0"
"232","0.466257300","104.16.100.29","192.168.1.118","TLSv1.2","506","Application Data"
"233","0.466290900","192.168.1.118","104.16.100.29","TCP","54","41560 → 443 [ACK] Seq=1568 Ack=15465 Win=63104 Len=0"
"234","0.467035225","104.16.100.29","192.168.1.118","TLSv1.2","88","Application Data"
"235","0.467066175","192.168.1.118","104.16.100.29","TCP","54","41560 → 443 [ACK] Seq=1568 Ack=15499 Win=64128 Len=0"
"236","0.467100300","104.16.100.29","192.168.1.118","TLSv1.2","1344","Application Data"
"237","0.470074412","192.168.1.118","104.16.100.29","TLSv1.2","294","Application Data"
"238","0.473471187","104.16.100.29","192.168.1.118","TLSv1.2","88","Application Data"
"239","0.473523187","104.16.100.29","192.168.1.118","TLSv1.2","1253","Application Data"
"240","0.473581600","192.168.1.118","104.16.100.29","TCP","54","41556 → 443 [ACK] Seq=1246 Ack=15153 Win=493 Len=0"
"241","0.473613475","192.168.1.118","104.16.100.29","TCP","54","41562 → 443 [ACK] Seq=1347 Ack=19293 Win=64128 Len=0"
"242","0.474246475","104.16.100.29","192.168.1.118","TLSv1.2","88","Application Data"
"243","0.474290937","192.168.1.118","104.16.100.29","TCP","54","41556 → 443 [ACK] Seq=1246 Ack=15187 Win=493 Len=0"
"244","0.474339387","104.16.100.29","192.168.1.118","TLSv1.2","1210","Application Data"
"245","0.474888025","192.168.1.118","104.16.100.29","TLSv1.2","296","Application Data"
"246","0.476281612","104.16.100.29","192.168.1.118","TLSv1.2","88","Application Data"
"247","0.476841412","192.168.1.118","104.16.100.29","TCP","54","41564 → 443 [ACK] Seq=1345 Ack=16395 Win=64128 Len=0"
"248","0.477360550","104.16.100.29","192.168.1.118","TLSv1.2","1452","Application Data"
"249","0.477402975","192.168.1.118","104.16.100.29","TLSv1.2","282","Application Data"
"250","0.477433837","192.168.1.118","104.16.100.29","TCP","54","41558 → 443 [ACK] Seq=1338 Ack=20027 Win=63104 Len=0"
"251","0.477485750","104.16.100.29","192.168.1.118","TLSv1.2","605","Application Data"
"252","0.477531125","192.168.1.118","104.16.100.29","TCP","54","41558 → 443 [ACK] Seq=1338 Ack=20578 Win=62592 Len=0"
"253","0.477577562","104.16.100.29","192.168.1.118","TLSv1.2","88","Application Data"
"254","0.477619837","192.168.1.118","104.16.100.29","TCP","54","41558 → 443 [ACK] Seq=1338 Ack=20612 Win=62592 Len=0"
"255","0.478907350","192.168.1.118","104.16.100.29","TLSv1.2","315","Application Data"
"256","0.481882275","192.168.1.118","104.16.100.29","TLSv1.2","313","Application Data"
"257","0.498901550","104.16.100.29","192.168.1.118","TLSv1.2","1341","Application Data"
"258","0.499835175","104.16.100.29","192.168.1.118","TLSv1.2","88","Application Data"
"259","0.499887312","104.16.100.29","192.168.1.118","TLSv1.2","1452","Application Data"
"260","0.499944637","104.16.100.29","192.168.1.118","TLSv1.2","629","Application Data, Application Data"
"261","0.501759587","192.168.1.118","104.16.100.29","TCP","54","41562 → 443 [ACK] Seq=1589 Ack=21266 Win=62208 Len=0"
"262","0.502312587","192.168.1.118","104.16.100.29","TCP","54","41560 → 443 [ACK] Seq=1808 Ack=16820 Win=64128 Len=0"
"263","0.509850912","192.168.1.118","104.16.100.29","TLSv1.2","312","Application Data"
"264","0.509960012","104.16.100.29","192.168.1.118","TLSv1.2","1452","Application Data"
"265","0.513420475","192.168.1.118","104.16.100.29","TLSv1.2","289","Application Data"
"266","0.521923887","104.16.100.29","192.168.1.118","TLSv1.2","1452","Application Data"
"267","0.521974225","104.16.100.29","192.168.1.118","TLSv1.2","1452","Application Data"
"268","0.522000725","104.16.100.29","192.168.1.118","TLSv1.2","2850","Application Data, Application Data"
"269","0.522082062","104.16.100.29","192.168.1.118","TLSv1.2","4248","Application Data, Application Data, Application Data"
"270","0.522101087","104.16.100.29","192.168.1.118","TLSv1.2","2850","Application Data, Application Data"
"271","0.522131837","104.16.100.29","192.168.1.118","TLSv1.2","8442","Application Data, Application Data, Application Data, Application Data, Application Data, Application Data"
"272","0.522154262","104.16.100.29","192.168.1.118","TLSv1.2","5646","Application Data, Application Data, Application Data, Application Data"
"273","0.522191450","104.16.100.29","192.168.1.118","TLSv1.2","19034","Application Data, Application Data, Application Data, Application Data, Application Data, Application Data, Application Data, Application Data, Application Data"
"274","0.522395737","192.168.1.118","104.16.100.29","TCP","54","41556 → 443 [ACK] Seq=1474 Ack=62127 Win=135 Len=0"
"275","0.525448612","104.16.100.29","192.168.1.118","TLSv1.2","3508","Application Data"
"276","0.525509412","104.16.100.29","192.168.1.118","TCP","2974","[TCP segment of a reassembled PDU]"
"277","0.525602412","104.16.100.29","192.168.1.118","TLSv1.2","10868","Application Data, Application Data, Application Data"
"278","0.525622025","104.16.100.29","192.168.1.118","TLSv1.2","1452","Application Data"
"279","0.525647650","104.16.100.29","192.168.1.118","TLSv1.2","1452","Application Data"
"280","0.525670425","104.16.100.29","192.168.1.118","TLSv1.2","1514","Application Data"
"281","0.527902412","104.16.100.29","192.168.1.118","TLSv1.2","1390","Application Data"
"282","0.527919437","104.16.100.29","192.168.1.118","TLSv1.2","1514","Application Data"
"283","0.527963075","192.168.1.118","104.16.100.29","TCP","54","41556 → 443 [ACK] Seq=1474 Ack=79315 Win=353 Len=0"
"284","0.528005662","104.16.100.29","192.168.1.118","TLSv1.2","2788","Application Data, Application Data"
"285","0.528044500","104.16.100.29","192.168.1.118","TLSv1.2","8442","Application Data, Application Data, Application Data, Application Data, Application Data, Application Data"
"286","0.528071100","104.16.100.29","192.168.1.118","TLSv1.2","2974","Application Data, Application Data"
"287","0.528073175","192.168.1.118","104.16.100.29","TCP","54","41564 → 443 [ACK] Seq=1606 Ack=34569 Win=46080 Len=0"
"288","0.528112212","192.168.1.118","104.16.100.29","TCP","54","41564 → 443 [ACK] Seq=1606 Ack=37489 Win=43264 Len=0"
"289","0.534298987","104.16.100.29","192.168.1.118","TLSv1.2","2974","Application Data, Application Data"
"290","0.536304675","192.168.1.118","104.16.100.29","TCP","54","41564 → 443 [ACK] Seq=1606 Ack=40409 Win=40448 Len=0"
"291","0.539193312","104.16.100.29","192.168.1.118","TLSv1.2","5919","Application Data, Application Data, Application Data, Application Data, Application Data"
"292","0.539212925","104.16.100.29","192.168.1.118","TLSv1.2","1452","Application Data"
"293","0.539233487","104.16.100.29","192.168.1.118","TLSv1.2","1452","Application Data"
"294","0.539249325","104.16.100.29","192.168.1.118","TLSv1.2","2850","Application Data, Application Data"
"295","0.539269137","104.16.100.29","192.168.1.118","TLSv1.2","5646","Application Data, Application Data, Application Data, Application Data"
"296","0.539293262","104.16.100.29","192.168.1.118","TLSv1.2","7354","Application Data, Application Data, Application Data, Application Data, Application Data"
"297","0.541040637","192.168.1.118","104.16.100.29","TCP","54","41564 → 443 [ACK] Seq=1606 Ack=46274 Win=34688 Len=0"
"298","0.541134462","192.168.1.118","104.16.100.29","TCP","54","41558 → 443 [ACK] Seq=1597 Ack=39096 Win=45696 Len=0"
"299","0.541159812","104.16.100.29","192.168.1.118","TLSv1.2","2974","Application Data, Application Data"
"300","0.541417012","192.168.1.118","104.16.100.29","TCP","54","41558 → 443 [ACK] Seq=1597 Ack=42016 Win=42880 Len=0"
"301","0.542151175","104.16.100.29","192.168.1.118","TLSv1.2","1993","Application Data, Application Data"
"302","0.542183875","104.16.100.29","192.168.1.118","TLSv1.2","1452","Application Data"
"303","0.542221200","104.16.100.29","192.168.1.118","TLSv1.2","1452","Application Data"
"304","0.542250125","104.16.100.29","192.168.1.118","TLSv1.2","1452","Application Data"
"305","0.542285900","104.16.100.29","192.168.1.118","TLSv1.2","1452","Application Data"
"306","0.542314650","104.16.100.29","192.168.1.118","TLSv1.2","1452","Application Data"
"307","0.542368562","104.16.100.29","192.168.1.118","TLSv1.2","1514","Application Data"
"308","0.542386312","104.16.100.29","192.168.1.118","TLSv1.2","1390","Application Data"
"309","0.542414237","104.16.100.29","192.168.1.118","TLSv1.2","1452","Application Data"
"310","0.542450937","104.16.100.29","192.168.1.118","TLSv1.2","1514","Application Data"
"311","0.542469212","104.16.100.29","192.168.1.118","TLSv1.2","1390","Application Data"
"312","0.542498400","104.16.100.29","192.168.1.118","TLSv1.2","1514","Application Data"
"313","0.542921237","192.168.1.118","104.16.100.29","TCP","54","41558 → 443 [ACK] Seq=1597 Ack=43955 Win=40960 Len=0"
"314","0.542998112","192.168.1.118","104.16.100.29","TCP","54","41560 → 443 [ACK] Seq=2066 Ack=32260 Win=48768 Len=0"
"315","0.548757062","104.16.100.29","192.168.1.118","TLSv1.2","2788","Application Data, Application Data"
"316","0.548818612","104.16.100.29","192.168.1.118","TLSv1.2","1345","Application Data"
"317","0.548855837","104.16.100.29","192.168.1.118","TLSv1.2","88","Application Data"
"318","0.548884487","104.16.100.29","192.168.1.118","TLSv1.2","1514","Application Data"
"319","0.548988500","104.16.100.29","192.168.1.118","TLSv1.2","4186","Application Data, Application Data, Application Data"
"320","0.549030675","104.16.100.29","192.168.1.118","TLSv1.2","1514","Application Data"
"321","0.549047462","104.16.100.29","192.168.1.118","TLSv1.2","1390","Application Data"
"322","0.549082612","104.16.100.29","192.168.1.118","TLSv1.2","1514","Application Data"
"323","0.549130050","104.16.100.29","192.168.1.118","TLSv1.2","5012","Application Data, Application Data, Application Data, Application Data"
"324","0.549567200","192.168.1.118","104.16.100.29","TCP","54","41560 → 443 [ACK] Seq=2066 Ack=49800 Win=31232 Len=0"
"325","0.550029750","192.168.1.118","104.16.100.29","TCP","54","41562 → 443 [ACK] Seq=1824 Ack=22591 Win=64128 Len=0"
"326","0.562253587","104.16.100.29","192.168.1.118","TLSv1.2","2974","Application Data [TCP segment of a reassembled PDU]"
"327","0.562370287","192.168.1.118","104.16.100.29","TCP","54","41556 → 443 [ACK] Seq=1474 Ack=82235 Win=547 Len=0"
"328","0.562709475","104.16.100.29","192.168.1.118","TLSv1.2","20494","Application Data, Application Data, Application Data, Application Data"
"329","0.568497687","104.16.100.29","192.168.1.118","TLSv1.2","5894","Application Data, Application Data"
"330","0.568641225","104.16.100.29","192.168.1.118","TCP","2974","443 → 41556 [PSH, ACK] Seq=108515 Ack=1474 Win=72 Len=2920 [TCP segment of a reassembled PDU]"
"331","0.568839437","104.16.100.29","192.168.1.118","TLSv1.2","13118","Application Data, Application Data, Application Data, Application Data"
"332","0.589252512","104.16.100.29","192.168.1.118","TCP","1514","443 → 41556 [ACK] Seq=124499 Ack=1474 Win=72 Len=1460 [TCP segment of a reassembled PDU]"
"333","0.590202450","104.16.100.29","192.168.1.118","TLSv1.2","2974","Application Data [TCP segment of a reassembled PDU]"
"334","0.591012175","104.16.100.29","192.168.1.118","TLSv1.2","2974","Application Data [TCP segment of a reassembled PDU]"
"335","0.591960700","104.16.100.29","192.168.1.118","TCP","2974","443 → 41556 [ACK] Seq=131799 Ack=1474 Win=72 Len=2920 [TCP segment of a reassembled PDU]"
"336","0.593508700","104.16.100.29","192.168.1.118","TLSv1.2","2974","Application Data [TCP segment of a reassembled PDU]"
"337","0.593593700","192.168.1.118","104.16.100.29","TCP","54","41556 → 443 [ACK] Seq=1474 Ack=137639 Win=115 Len=0"
"338","0.595872475","104.16.100.29","192.168.1.118","TLSv1.2","2974","Application Data [TCP segment of a reassembled PDU]"
"339","0.599517737","104.16.100.29","192.168.1.118","TCP","2974","443 → 41556 [ACK] Seq=140559 Ack=1474 Win=72 Len=2920 [TCP segment of a reassembled PDU]"
"340","0.600117750","104.16.100.29","192.168.1.118","TCP","130","443 → 41556 [PSH, ACK] Seq=143479 Ack=1474 Win=72 Len=76 [TCP segment of a reassembled PDU]"
"341","0.613686337","104.16.100.29","192.168.1.118","TLSv1.2","1514","Application Data [TCP segment of a reassembled PDU]"
"342","0.615456450","104.16.100.29","192.168.1.118","TLSv1.2","7398","Application Data, Application Data"
"343","0.629021712","192.168.1.118","104.16.100.29","TCP","54","[TCP ZeroWindow] 41556 → 443 [ACK] Seq=1474 Ack=152359 Win=0 Len=0"
"344","0.629318075","192.168.1.118","104.16.100.29","TLSv1.2","283","Application Data"
"345","0.631493212","192.168.1.118","104.16.100.29","TCP","54","[TCP Window Update] 41556 → 443 [ACK] Seq=1474 Ack=152359 Win=189 Len=0"
"346","0.633381737","192.168.1.118","104.16.100.29","TCP","54","[TCP Window Update] 41556 → 443 [ACK] Seq=1474 Ack=152359 Win=432 Len=0"
"347","0.635268275","192.168.1.118","104.16.100.29","TCP","54","[TCP Window Update] 41560 → 443 [ACK] Seq=2066 Ack=49800 Win=64128 Len=0"
"348","0.649968187","104.16.100.29","192.168.1.118","TCP","1514","443 → 41556 [ACK] Seq=152359 Ack=1474 Win=72 Len=1460 [TCP segment of a reassembled PDU]"
"349","0.654873650","104.16.100.29","192.168.1.118","TLSv1.2","5894","Application Data [TCP segment of a reassembled PDU]"
"350","0.654938237","192.168.1.118","104.16.100.29","TCP","54","41556 → 443 [ACK] Seq=1474 Ack=159659 Win=661 Len=0"
"351","0.655063125","104.16.100.29","192.168.1.118","TLSv1.2","16070","Application Data, Application Data, Application Data, Application Data"
"352","0.655095800","192.168.1.118","104.16.100.29","TCP","54","41556 → 443 [ACK] Seq=1474 Ack=175675 Win=911 Len=0"
"353","0.667098375","104.16.100.29","192.168.1.118","TLSv1.2","1237","Application Data"
"354","0.667160062","104.16.100.29","192.168.1.118","TLSv1.2","88","Application Data"
"355","0.667200450","104.16.100.29","192.168.1.118","TLSv1.2","4921","Application Data, Application Data"
"356","0.667233425","192.168.1.118","104.16.100.29","TCP","54","41556 → 443 [ACK] Seq=1474 Ack=180542 Win=987 Len=0"
"357","0.667690987","192.168.1.118","104.16.100.29","TCP","54","41562 → 443 [ACK] Seq=2053 Ack=23808 Win=64128 Len=0"
"358","0.734852187","104.16.100.29","192.168.1.118","TLSv1.2","88","[TCP Spurious Retransmission] , Application Data"
"359","0.734932000","192.168.1.118","104.16.100.29","TCP","66","[TCP Dup ACK 357#1] 41562 → 443 [ACK] Seq=2053 Ack=23808 Win=64128 Len=0 SLE=23774 SRE=23808"
"360","2.697673125","192.168.1.104","255.255.255.255","UDP","217","49154 → 6666 Len=175"
"361","2.919396087","192.168.1.118","192.168.1.102","TCP","176","44768 → 8009 [PSH, ACK] Seq=1 Ack=1 Win=501 Len=110 TSval=2236174746 TSecr=3069653 [TCP segment of a reassembled PDU]"
"362","2.968446237","192.168.1.102","192.168.1.118","TCP","176","8009 → 44768 [PSH, ACK] Seq=1 Ack=111 Win=294 Len=110 TSval=3070158 TSecr=2236174746 [TCP segment of a reassembled PDU]"
"363","2.968560762","192.168.1.118","192.168.1.102","TCP","66","44768 → 8009 [ACK] Seq=111 Ack=111 Win=501 Len=0 TSval=2236174795 TSecr=3070158"
"364","4.749142275","192.168.1.100","224.0.0.251","MDNS","563","Standard query 0x0000 PTR _airport._tcp.local, "QM" question PTR _googlecast._tcp.local, "QM" question PTR _homekit._tcp.local, "QM" question PTR _raop._tcp.local, "QM" question PTR _airplay._tcp.local, "QM" question PTR _rdlink._tcp.local, "QM" question PTR _uscans._tcp.local, "QM" question PTR _uscan._tcp.local, "QM" question PTR _ippusb._tcp.local, "QM" question PTR _ipp._tcp.local, "QM" question PTR _scanner._tcp.local, "QM" question PTR _ipps._tcp.local, "QM" question PTR _printer._tcp.local, "QM" question PTR _pdl-datastream._tcp.local, "QM" question PTR _ptp._tcp.local, "QM" question PTR _afpovertcp._tcp.local, "QM" question PTR _smb._tcp.local, "QM" question PTR _rfb._tcp.local, "QM" question PTR _adisk._tcp.local, "QM" question PTR _companion-link._tcp.local, "QM" question PTR _apple-mobdev._tcp.local, "QM" question PTR 8ed307c3._sub._apple-mobdev2._tcp.local, "QM" question PTR _apple-pairable._tcp.local, "QM" question TXT Google-Home-Mini-2c3f16b2da5c4b6fd6cfbfba61c12490._googlecast._tcp.local, "QM" question PTR Google-Home-Mini-2c3f16b2da5c4b6fd6cfbfba61c12490._googlecast._tcp.local PTR cjqg._smb._tcp.local PTR cjqg._companion-link._tcp.local OPT"
"365","4.847529387","192.168.1.102","224.0.0.251","MDNS","183","Standard query response 0x0000 SRV, cache flush 0 0 8009 2c3f16b2-da5c-4b6f-d6cf-bfba61c12490.local"
"366","5.666670387","192.168.1.104","255.255.255.255","UDP","217","49154 → 6666 Len=175"
"367","7.972674137","192.168.1.118","192.168.1.102","TCP","176","44768 → 8009 [PSH, ACK] Seq=111 Ack=111 Win=501 Len=110 TSval=2236179799 TSecr=3070158 [TCP segment of a reassembled PDU]"
"368","7.982257037","192.168.1.102","192.168.1.118","TCP","176","8009 → 44768 [PSH, ACK] Seq=111 Ack=221 Win=294 Len=110 TSval=3070660 TSecr=2236179799 [TCP segment of a reassembled PDU]"
"369","7.982476950","192.168.1.118","192.168.1.102","TCP","66","44768 → 8009 [ACK] Seq=221 Ack=221 Win=501 Len=0 TSval=2236179809 TSecr=3070660"
"370","8.739509675","192.168.1.104","255.255.255.255","UDP","217","49154 → 6666 Len=175"
