frame.number,_ws.col.Time,_ws.col.Source,_ws.col.Destination,_ws.col.Protocol,frame.len,_ws.col.Info
"1","0.000000000","23.14.150.146","192.168.1.118","TCP","1514","[TCP segment of a reassembled PDU]"
"2","0.001496338","23.14.150.146","192.168.1.118","TCP","7306","443 → 40112 [ACK] Seq=1449 Ack=1 Win=319 Len=7240 TSval=1183844205 TSecr=3739677528 [TCP segment of a reassembled PDU]"
"3","0.001557975","192.168.1.118","23.14.150.146","TCP","66","40112 → 443 [ACK] Seq=1 Ack=8689 Win=1083 Len=0 TSval=3739677745 TSecr=1183844205"
"4","0.001603900","23.14.150.146","192.168.1.118","TCP","2962","443 → 40112 [ACK] Seq=8689 Ack=1 Win=319 Len=2896 TSval=1183844207 TSecr=3739677528 [TCP segment of a reassembled PDU]"
"5","0.001621188","192.168.1.118","23.14.150.146","TCP","66","40112 → 443 [ACK] Seq=1 Ack=11585 Win=1129 Len=0 TSval=3739677745 TSecr=1183844207"
"6","0.002861850","23.14.150.146","192.168.1.118","TCP","1514","443 → 40112 [ACK] Seq=11585 Ack=1 Win=319 Len=1448 TSval=1183844209 TSecr=3739677528 [TCP segment of a reassembled PDU]"
"7","0.006023038","23.14.150.146","192.168.1.118","TCP","1514","443 → 40112 [ACK] Seq=13033 Ack=1 Win=319 Len=1448 TSval=1183844209 TSecr=3739677528 [TCP segment of a reassembled PDU]"
"8","0.006106263","192.168.1.118","23.14.150.146","TCP","66","40112 → 443 [ACK] Seq=1 Ack=14481 Win=1174 Len=0 TSval=3739677749 TSecr=1183844209"
"9","0.019897688","23.14.150.146","192.168.1.118","TLSv1.2","2962","Application Data [TCP segment of a reassembled PDU]"
"10","0.019970938","192.168.1.118","23.14.150.146","TCP","66","40112 → 443 [ACK] Seq=1 Ack=17377 Win=1219 Len=0 TSval=3739677763 TSecr=1183844212"
"11","0.020015875","23.14.150.146","192.168.1.118","TCP","2962","443 → 40112 [ACK] Seq=17377 Ack=1 Win=319 Len=2896 TSval=1183844214 TSecr=3739677528 [TCP segment of a reassembled PDU]"
"12","0.020033450","192.168.1.118","23.14.150.146","TCP","66","40112 → 443 [ACK] Seq=1 Ack=20273 Win=1264 Len=0 TSval=3739677763 TSecr=1183844214"
"13","0.030702138","23.14.150.146","192.168.1.118","TCP","2962","443 → 40112 [ACK] Seq=20273 Ack=1 Win=319 Len=2896 TSval=1183844217 TSecr=3739677528 [TCP segment of a reassembled PDU]"
"14","0.030775838","192.168.1.118","23.14.150.146","TCP","66","40112 → 443 [ACK] Seq=1 Ack=23169 Win=1310 Len=0 TSval=3739677774 TSecr=1183844217"
"15","0.030818900","23.14.150.146","192.168.1.118","TCP","2962","443 → 40112 [ACK] Seq=23169 Ack=1 Win=319 Len=2896 TSval=1183844219 TSecr=3739677528 [TCP segment of a reassembled PDU]"
"16","0.030835550","192.168.1.118","23.14.150.146","TCP","66","40112 → 443 [ACK] Seq=1 Ack=26065 Win=1355 Len=0 TSval=3739677774 TSecr=1183844219"
"17","0.030877038","23.14.150.146","192.168.1.118","TCP","2962","443 → 40112 [ACK] Seq=26065 Ack=1 Win=319 Len=2896 TSval=1183844222 TSecr=3739677528 [TCP segment of a reassembled PDU]"
"18","0.030892700","192.168.1.118","23.14.150.146","TCP","66","40112 → 443 [ACK] Seq=1 Ack=28961 Win=1400 Len=0 TSval=3739677774 TSecr=1183844222"
"19","0.030914500","23.14.150.146","192.168.1.118","TCP","2962","443 → 40112 [ACK] Seq=28961 Ack=1 Win=319 Len=2896 TSval=1183844224 TSecr=3739677528 [TCP segment of a reassembled PDU]"
"20","0.030930563","192.168.1.118","23.14.150.146","TCP","66","40112 → 443 [ACK] Seq=1 Ack=31857 Win=1445 Len=0 TSval=3739677774 TSecr=1183844224"
"21","0.030965488","23.14.150.146","192.168.1.118","TLSv1.2","2962","Application Data [TCP segment of a reassembled PDU]"
"22","0.030982525","192.168.1.118","23.14.150.146","TCP","66","40112 → 443 [ACK] Seq=1 Ack=34753 Win=1491 Len=0 TSval=3739677774 TSecr=1183844227"
"23","0.037857938","23.14.150.146","192.168.1.118","TCP","2962","443 → 40112 [ACK] Seq=34753 Ack=1 Win=319 Len=2896 TSval=1183844229 TSecr=3739677528 [TCP segment of a reassembled PDU]"
"24","0.037923975","192.168.1.118","23.14.150.146","TCP","66","40112 → 443 [ACK] Seq=1 Ack=37649 Win=1536 Len=0 TSval=3739677781 TSecr=1183844229"
"25","0.037969038","23.14.150.146","192.168.1.118","TCP","2962","443 → 40112 [ACK] Seq=37649 Ack=1 Win=319 Len=2896 TSval=1183844231 TSecr=3739677528 [TCP segment of a reassembled PDU]"
"26","0.037988713","192.168.1.118","23.14.150.146","TCP","66","40112 → 443 [ACK] Seq=1 Ack=40545 Win=1581 Len=0 TSval=3739677781 TSecr=1183844231"
"27","0.038032650","23.14.150.146","192.168.1.118","TCP","2962","443 → 40112 [ACK] Seq=40545 Ack=1 Win=319 Len=2896 TSval=1183844234 TSecr=3739677528 [TCP segment of a reassembled PDU]"
"28","0.038049588","192.168.1.118","23.14.150.146","TCP","66","40112 → 443 [ACK] Seq=1 Ack=43441 Win=1626 Len=0 TSval=3739677781 TSecr=1183844234"
"29","0.038089388","23.14.150.146","192.168.1.118","TCP","2962","443 → 40112 [ACK] Seq=43441 Ack=1 Win=319 Len=2896 TSval=1183844236 TSecr=3739677528 [TCP segment of a reassembled PDU]"
"30","0.038105225","192.168.1.118","23.14.150.146","TCP","66","40112 → 443 [ACK] Seq=1 Ack=46337 Win=1672 Len=0 TSval=3739677781 TSecr=1183844236"
"31","0.038123950","23.14.150.146","192.168.1.118","TLSv1.2","2962","Application Data [TCP segment of a reassembled PDU]"
"32","0.038140125","192.168.1.118","23.14.150.146","TCP","66","40112 → 443 [ACK] Seq=1 Ack=49233 Win=1717 Len=0 TSval=3739677781 TSecr=1183844239"
"33","0.043221050","23.14.150.146","192.168.1.118","TCP","2962","443 → 40112 [ACK] Seq=49233 Ack=1 Win=319 Len=2896 TSval=1183844241 TSecr=3739677749 [TCP segment of a reassembled PDU]"
"34","0.043290513","192.168.1.118","23.14.150.146","TCP","66","40112 → 443 [ACK] Seq=1 Ack=52129 Win=1762 Len=0 TSval=3739677786 TSecr=1183844241"
"35","0.043337300","23.14.150.146","192.168.1.118","TCP","2962","443 → 40112 [ACK] Seq=52129 Ack=1 Win=319 Len=2896 TSval=1183844243 TSecr=3739677749 [TCP segment of a reassembled PDU]"
"36","0.043354025","192.168.1.118","23.14.150.146","TCP","66","40112 → 443 [ACK] Seq=1 Ack=55025 Win=1807 Len=0 TSval=3739677787 TSecr=1183844243"
"37","0.043384600","23.14.150.146","192.168.1.118","TCP","2962","443 → 40112 [ACK] Seq=55025 Ack=1 Win=319 Len=2896 TSval=1183844244 TSecr=3739677749 [TCP segment of a reassembled PDU]"
"38","0.043399188","192.168.1.118","23.14.150.146","TCP","66","40112 → 443 [ACK] Seq=1 Ack=57921 Win=1853 Len=0 TSval=3739677787 TSecr=1183844244"
"39","0.043418250","23.14.150.146","192.168.1.118","TCP","2962","443 → 40112 [ACK] Seq=57921 Ack=1 Win=319 Len=2896 TSval=1183844246 TSecr=3739677749 [TCP segment of a reassembled PDU]"
"40","0.043434263","192.168.1.118","23.14.150.146","TCP","66","40112 → 443 [ACK] Seq=1 Ack=60817 Win=1898 Len=0 TSval=3739677787 TSecr=1183844246"
"41","0.053910475","23.14.150.146","192.168.1.118","TLSv1.2","1705","Application Data"
"42","0.053980125","192.168.1.118","23.14.150.146","TCP","66","40112 → 443 [ACK] Seq=1 Ack=62456 Win=1923 Len=0 TSval=3739677797 TSecr=1183844249"
"43","0.103213550","192.168.1.104","255.255.255.255","UDP","217","49154 → 6666 Len=175"
"44","0.298194225","192.168.1.118","209.18.47.62","TCP","74","58516 → 853 [SYN] Seq=0 Win=64240 Len=0 MSS=1460 SACK_PERM=1 TSval=942661358 TSecr=0 WS=128"
"45","0.328990300","192.168.1.118","209.18.47.62","DNS","84","Standard query 0x6281 A www.googletagmanager.com"
"46","0.331582425","192.168.1.118","209.18.47.62","DNS","75","Standard query 0xe697 A www.youtube.com"
"47","0.347362400","209.18.47.62","192.168.1.118","DNS","144","Standard query response 0x6281 A www.googletagmanager.com CNAME www-googletagmanager.l.google.com A 172.217.10.232"
"48","0.348408900","209.18.47.62","192.168.1.118","DNS","349","Standard query response 0xe697 A www.youtube.com CNAME youtube-ui.l.google.com A 172.217.9.238 A 172.217.10.14 A 172.217.10.46 A 172.217.10.78 A 172.217.10.110 A 172.217.3.110 A 172.217.12.142 A 172.217.6.206 A 142.250.64.78 A 172.217.6.238 A 172.217.10.238 A 172.217.11.14 A 172.217.11.46 A 172.217.12.174 A 172.217.12.206"
"49","0.349241650","192.168.1.118","209.18.47.62","DNS","84","Standard query 0x0ac8 AAAA www.googletagmanager.com"
"50","0.349341575","192.168.1.118","209.18.47.62","DNS","75","Standard query 0x46f3 AAAA www.youtube.com"
"51","0.364480088","209.18.47.62","192.168.1.118","DNS","156","Standard query response 0x0ac8 AAAA www.googletagmanager.com CNAME www-googletagmanager.l.google.com AAAA 2607:f8b0:4006:813::2008"
"52","0.371554275","209.18.47.62","192.168.1.118","DNS","137","Standard query response 0x46f3 AAAA www.youtube.com CNAME youtube-ui.l.google.com AAAA 2607:f8b0:4006:811::200e"
"53","0.438300063","192.168.1.118","172.217.9.238","TCP","74","44884 → 443 [SYN] Seq=0 Win=64240 Len=0 MSS=1460 SACK_PERM=1 TSval=1426157100 TSecr=0 WS=128"
"54","0.438450963","192.168.1.118","172.217.10.232","TCP","74","38452 → 443 [SYN] Seq=0 Win=64240 Len=0 MSS=1460 SACK_PERM=1 TSval=3448051611 TSecr=0 WS=128"
"55","0.457175863","172.217.9.238","192.168.1.118","TCP","74","443 → 44884 [SYN, ACK] Seq=0 Ack=1 Win=60192 Len=0 MSS=1380 SACK_PERM=1 TSval=742846673 TSecr=1426157100 WS=256"
"56","0.457268025","192.168.1.118","172.217.9.238","TCP","66","44884 → 443 [ACK] Seq=1 Ack=1 Win=64256 Len=0 TSval=1426157119 TSecr=742846673"
"57","0.471964900","172.217.10.232","192.168.1.118","TCP","74","443 → 38452 [SYN, ACK] Seq=0 Ack=1 Win=60192 Len=0 MSS=1380 SACK_PERM=1 TSval=2142917304 TSecr=3448051611 WS=256"
"58","0.472078850","192.168.1.118","172.217.10.232","TCP","66","38452 → 443 [ACK] Seq=1 Ack=1 Win=64256 Len=0 TSval=3448051644 TSecr=2142917304"
"59","0.555613750","192.168.1.118","172.217.9.238","TLSv1","583","Client Hello"
"60","0.577556613","172.217.9.238","192.168.1.118","TCP","66","443 → 44884 [ACK] Seq=1 Ack=518 Win=61440 Len=0 TSval=742846793 TSecr=1426157218"
"61","0.597676325","192.168.1.118","172.217.10.232","TLSv1","583","Client Hello"
"62","0.609455738","172.217.9.238","192.168.1.118","TLSv1.2","1484","Server Hello"
"63","0.609525875","192.168.1.118","172.217.9.238","TCP","66","44884 → 443 [ACK] Seq=518 Ack=1419 Win=63104 Len=0 TSval=1426157272 TSecr=742846800"
"64","0.625079188","172.217.9.238","192.168.1.118","TLSv1.2","2425","Certificate, Server Key Exchange, Server Hello Done"
"65","0.625150325","192.168.1.118","172.217.9.238","TCP","66","44884 → 443 [ACK] Seq=518 Ack=3778 Win=60800 Len=0 TSval=1426157287 TSecr=742846800"
"66","0.628399050","172.217.9.238","192.168.1.118","TCP","1007","[TCP Spurious Retransmission] 443 → 44884 [PSH, ACK] Seq=2837 Ack=518 Win=61440 Len=941 TSval=742846837 TSecr=1426157218[Reassembly error, protocol TCP: New fragment overlaps old data (retransmission?)]"
"67","0.628467113","192.168.1.118","172.217.9.238","TCP","78","[TCP Dup ACK 65#1] 44884 → 443 [ACK] Seq=518 Ack=3778 Win=60800 Len=0 TSval=1426157291 TSecr=742846837 SLE=2837 SRE=3778"
"68","0.630313900","192.168.1.118","172.217.9.238","TLSv1.2","192","Client Key Exchange, Change Cipher Spec, Encrypted Handshake Message"
"69","0.633296975","172.217.10.232","192.168.1.118","TCP","66","443 → 38452 [ACK] Seq=1 Ack=518 Win=61440 Len=0 TSval=2142917472 TSecr=3448051770"
"70","0.641411025","172.217.10.232","192.168.1.118","TLSv1.2","1484","Server Hello"
"71","0.641485138","192.168.1.118","172.217.10.232","TCP","66","38452 → 443 [ACK] Seq=518 Ack=1419 Win=63104 Len=0 TSval=3448051814 TSecr=2142917479"
"72","0.642788425","172.217.10.232","192.168.1.118","TLSv1.2","1521","Certificate, Server Key Exchange, Server Hello Done"
"73","0.642832463","192.168.1.118","172.217.10.232","TCP","66","38452 → 443 [ACK] Seq=518 Ack=2874 Win=62720 Len=0 TSval=3448051815 TSecr=2142917479"
"74","0.651451213","192.168.1.118","172.217.10.232","TLSv1.2","192","Client Key Exchange, Change Cipher Spec, Encrypted Handshake Message"
"75","0.654214763","172.217.9.238","192.168.1.118","TLSv1.2","117","Change Cipher Spec, Encrypted Handshake Message"
"76","0.656603913","192.168.1.118","172.217.9.238","TLSv1.2","278","Application Data"
"77","0.680300763","172.217.10.232","192.168.1.118","TLSv1.2","117","Change Cipher Spec, Encrypted Handshake Message"
"78","0.680751650","192.168.1.118","172.217.10.232","TLSv1.2","267","Application Data"
"79","0.684740563","172.217.9.238","192.168.1.118","TCP","66","443 → 44884 [ACK] Seq=3829 Ack=856 Win=62464 Len=0 TSval=742846896 TSecr=1426157319"
"80","0.707202975","172.217.10.232","192.168.1.118","TCP","66","443 → 38452 [ACK] Seq=2925 Ack=845 Win=62464 Len=0 TSval=2142917547 TSecr=3448051853"
"81","0.724248413","172.217.10.232","192.168.1.118","TLSv1.2","1065","Application Data"
"82","0.724990513","172.217.10.232","192.168.1.118","TLSv1.2","100","Application Data"
"83","0.725778838","192.168.1.118","172.217.10.232","TCP","66","38452 → 443 [ACK] Seq=845 Ack=3958 Win=64128 Len=0 TSval=3448051898 TSecr=2142917563"
"84","0.809236363","192.168.1.118","209.18.47.61","TCP","74","38050 → 853 [SYN] Seq=0 Win=64240 Len=0 MSS=1460 SACK_PERM=1 TSval=3660108834 TSecr=0 WS=128"
"85","1.023157725","172.217.9.238","192.168.1.118","TLSv1.2","1484","Application Data"
"86","1.024947863","172.217.9.238","192.168.1.118","TLSv1.2","2902","Application Data, Application Data"
"87","1.025013963","172.217.9.238","192.168.1.118","TLSv1.2","2902","Application Data, Application Data"
"88","1.025103850","172.217.9.238","192.168.1.118","TLSv1.2","2902","Application Data, Application Data"
"89","1.025129338","172.217.9.238","192.168.1.118","TLSv1.2","2902","Application Data, Application Data"
"90","1.025138475","172.217.9.238","192.168.1.118","TLSv1.2","261","Application Data, Application Data"
"91","1.025150438","172.217.9.238","192.168.1.118","TLSv1.2","100","Application Data"
"92","1.025162400","172.217.9.238","192.168.1.118","TCP","100","[TCP Retransmission] 443 → 44884 [PSH, ACK] Seq=16786 Ack=856 Win=62464 Len=34 TSval=742847235 TSecr=1426157319"
"93","1.025195100","192.168.1.118","172.217.9.238","TCP","78","44884 → 443 [ACK] Seq=856 Ack=16820 Win=51200 Len=0 TSval=1426157687 TSecr=742847169 SLE=16786 SRE=16820"
"94","1.032945338","192.168.1.118","172.217.9.238","TCP","74","44888 → 443 [SYN] Seq=0 Win=64240 Len=0 MSS=1460 SACK_PERM=1 TSval=1426157695 TSecr=0 WS=128"
"95","1.064244625","172.217.9.238","192.168.1.118","TCP","74","443 → 44888 [SYN, ACK] Seq=0 Ack=1 Win=60192 Len=0 MSS=1380 SACK_PERM=1 TSval=1460424033 TSecr=1426157695 WS=256"
"96","1.064340713","192.168.1.118","172.217.9.238","TCP","66","44888 → 443 [ACK] Seq=1 Ack=1 Win=64256 Len=0 TSval=1426157727 TSecr=1460424033"
"97","1.101933325","192.168.1.118","172.217.9.238","TLSv1","583","Client Hello"
"98","1.130218338","172.217.9.238","192.168.1.118","TCP","66","443 → 44888 [ACK] Seq=1 Ack=518 Win=61440 Len=0 TSval=1460424099 TSecr=1426157764"
"99","1.135433263","172.217.9.238","192.168.1.118","TLSv1.2","1484","Server Hello"
"100","1.135498100","192.168.1.118","172.217.9.238","TCP","66","44888 → 443 [ACK] Seq=518 Ack=1419 Win=63104 Len=0 TSval=1426157798 TSecr=1460424106"
"101","1.140056750","172.217.9.238","192.168.1.118","TLSv1.2","2425","Certificate, Server Key Exchange, Server Hello Done"
"102","1.140137450","192.168.1.118","172.217.9.238","TCP","66","44888 → 443 [ACK] Seq=518 Ack=3778 Win=61056 Len=0 TSval=1426157802 TSecr=1460424106"
"103","1.142868925","192.168.1.118","172.217.9.238","TLSv1.2","192","Client Key Exchange, Change Cipher Spec, Encrypted Handshake Message"
"104","1.172783200","172.217.9.238","192.168.1.118","TLSv1.2","117","Change Cipher Spec, Encrypted Handshake Message"
"105","1.173773300","192.168.1.118","172.217.9.238","TLSv1.2","314","Application Data"
"106","1.210465013","172.217.9.238","192.168.1.118","TLSv1.2","1484","Application Data"
"107","1.212468613","172.217.9.238","192.168.1.118","TLSv1.2","2902","Application Data, Application Data"
"108","1.212530600","172.217.9.238","192.168.1.118","TLSv1.2","2902","Application Data, Application Data"
"109","1.212592675","172.217.9.238","192.168.1.118","TLSv1.2","2902","Application Data, Application Data"
"110","1.212620413","172.217.9.238","192.168.1.118","TLSv1.2","2902","Application Data, Application Data"
"111","1.212642288","172.217.9.238","192.168.1.118","TLSv1.2","2902","Application Data, Application Data"
"112","1.212663650","172.217.9.238","192.168.1.118","TLSv1.2","2902","Application Data, Application Data"
"113","1.212675088","172.217.9.238","192.168.1.118","TLSv1.2","1484","Application Data"
"114","1.227797825","192.168.1.118","172.217.9.238","TCP","66","44888 → 443 [ACK] Seq=892 Ack=23681 Win=44288 Len=0 TSval=1426157890 TSecr=1460424173"
"115","1.249104850","172.217.9.238","192.168.1.118","TLSv1.2","1484","Application Data"
"116","1.250210638","172.217.9.238","192.168.1.118","TLSv1.2","1484","Application Data"
"117","1.250257088","192.168.1.118","172.217.9.238","TCP","66","44888 → 443 [ACK] Seq=892 Ack=26517 Win=63104 Len=0 TSval=1426157912 TSecr=1460424219"
"118","1.250294850","172.217.9.238","192.168.1.118","TLSv1.2","1484","Application Data"
"119","1.251699150","172.217.9.238","192.168.1.118","TLSv1.2","1484","Application Data"
"120","1.251757538","192.168.1.118","172.217.9.238","TCP","66","44888 → 443 [ACK] Seq=892 Ack=29353 Win=63104 Len=0 TSval=1426157914 TSecr=1460424220"
"121","1.253164913","172.217.9.238","192.168.1.118","TLSv1.2","2902","Application Data, Application Data"
"122","1.253846325","192.168.1.118","172.217.9.238","TCP","66","44888 → 443 [ACK] Seq=892 Ack=32189 Win=60288 Len=0 TSval=1426157916 TSecr=1460424222"
"123","1.255543988","172.217.9.238","192.168.1.118","TLSv1.2","1484","Application Data"
"124","1.257918538","172.217.9.238","192.168.1.118","TLSv1.2","1484","Application Data"
"125","1.257983500","192.168.1.118","172.217.9.238","TCP","66","44888 → 443 [ACK] Seq=892 Ack=35025 Win=61056 Len=0 TSval=1426157920 TSecr=1460424225"
"126","1.258021388","172.217.9.238","192.168.1.118","TLSv1.2","1484","Application Data"
"127","1.261460125","172.217.9.238","192.168.1.118","TLSv1.2","1484","Application Data"
"128","1.261523625","192.168.1.118","172.217.9.238","TCP","66","44888 → 443 [ACK] Seq=892 Ack=37861 Win=63104 Len=0 TSval=1426157924 TSecr=1460424227"
"129","1.261563050","172.217.9.238","192.168.1.118","TLSv1.2","1484","Application Data"
"130","1.265096375","172.217.9.238","192.168.1.118","TLSv1.2","1484","Application Data [TCP segment of a reassembled PDU]"
"131","1.265163888","172.217.9.238","192.168.1.118","TLSv1.2","2902","Application Data, Application Data"
"132","1.266549863","172.217.9.238","192.168.1.118","TLSv1.2","2902","Application Data, Application Data"
"133","1.266601088","172.217.9.238","192.168.1.118","TLSv1.2","2902","Application Data, Application Data"
"134","1.267857125","172.217.9.238","192.168.1.118","TLSv1.2","2902","Application Data, Application Data"
"135","1.268005750","192.168.1.118","172.217.9.238","TCP","66","44888 → 443 [ACK] Seq=892 Ack=52041 Win=64128 Len=0 TSval=1426157930 TSecr=1460424229"
"136","1.270210600","172.217.9.238","192.168.1.118","TLSv1.2","1484","Application Data [TCP segment of a reassembled PDU]"
"137","1.271721125","172.217.9.238","192.168.1.118","TLSv1.2","2902","Application Data, Application Data"
"138","1.271783425","192.168.1.118","172.217.9.238","TCP","66","44888 → 443 [ACK] Seq=892 Ack=56295 Win=72704 Len=0 TSval=1426157934 TSecr=1460424240"
"139","1.274904338","172.217.9.238","192.168.1.118","TLSv1.2","1484","Application Data [TCP segment of a reassembled PDU]"
"140","1.281561250","172.217.9.238","192.168.1.118","TLSv1.2","1484","Application Data [TCP segment of a reassembled PDU]"
"141","1.281627688","192.168.1.118","172.217.9.238","TCP","66","44888 → 443 [ACK] Seq=892 Ack=59131 Win=78336 Len=0 TSval=1426157944 TSecr=1460424243"
"142","1.281688250","172.217.9.238","192.168.1.118","TLSv1.2","2902","Application Data, Application Data"
"143","1.281708638","192.168.1.118","172.217.9.238","TCP","66","44888 → 443 [ACK] Seq=892 Ack=61967 Win=83968 Len=0 TSval=1426157944 TSecr=1460424245"
"144","1.281718725","172.217.9.238","192.168.1.118","TLSv1.2","1484","Application Data [TCP segment of a reassembled PDU]"
"145","1.281756338","172.217.9.238","192.168.1.118","TLSv1.2","1484","Application Data [TCP segment of a reassembled PDU]"
"146","1.281772400","192.168.1.118","172.217.9.238","TCP","66","44888 → 443 [ACK] Seq=892 Ack=64803 Win=89728 Len=0 TSval=1426157944 TSecr=1460424247"
"147","1.281793438","172.217.9.238","192.168.1.118","TLSv1.2","2902","Application Data, Application Data"
"148","1.281809525","192.168.1.118","172.217.9.238","TCP","66","44888 → 443 [ACK] Seq=892 Ack=67639 Win=95360 Len=0 TSval=1426157944 TSecr=1460424249"
"149","1.281820438","172.217.9.238","192.168.1.118","TLSv1.2","1484","Application Data [TCP segment of a reassembled PDU]"
"150","1.285906750","172.217.9.238","192.168.1.118","TLSv1.2","1484","Application Data [TCP segment of a reassembled PDU]"
"151","1.285972088","192.168.1.118","172.217.9.238","TCP","66","44888 → 443 [ACK] Seq=892 Ack=70475 Win=100992 Len=0 TSval=1426157948 TSecr=1460424251"
"152","1.295910475","172.217.9.238","192.168.1.118","TLSv1.2","2902","Application Data, Application Data, Application Data"
"153","1.295982188","192.168.1.118","172.217.9.238","TCP","66","44888 → 443 [ACK] Seq=892 Ack=73311 Win=106752 Len=0 TSval=1426157958 TSecr=1460424253"
"154","1.296023038","172.217.9.238","192.168.1.118","TLSv1.2","2902","Application Data, Application Data"
"155","1.296039913","192.168.1.118","172.217.9.238","TCP","66","44888 → 443 [ACK] Seq=892 Ack=76147 Win=112384 Len=0 TSval=1426157958 TSecr=1460424255"
"156","1.296125513","172.217.9.238","192.168.1.118","TLSv1.2","2902","Application Data, Application Data"
"157","1.296141338","192.168.1.118","172.217.9.238","TCP","66","44888 → 443 [ACK] Seq=892 Ack=78983 Win=118016 Len=0 TSval=1426157958 TSecr=1460424257"
"158","1.296163613","172.217.9.238","192.168.1.118","TLSv1.2","2902","Application Data, Application Data"
"159","1.296179475","192.168.1.118","172.217.9.238","TCP","66","44888 → 443 [ACK] Seq=892 Ack=81819 Win=123648 Len=0 TSval=1426157958 TSecr=1460424258"
"160","1.296200725","172.217.9.238","192.168.1.118","TLSv1.2","2902","Application Data, Application Data"
"161","1.296216288","192.168.1.118","172.217.9.238","TCP","66","44888 → 443 [ACK] Seq=892 Ack=84655 Win=129408 Len=0 TSval=1426157958 TSecr=1460424260"
"162","1.296237800","172.217.9.238","192.168.1.118","TLSv1.2","2902","Application Data, Application Data"
"163","1.296260675","192.168.1.118","172.217.9.238","TCP","66","44888 → 443 [ACK] Seq=892 Ack=87491 Win=135040 Len=0 TSval=1426157958 TSecr=1460424262"
"164","1.296280213","172.217.9.238","192.168.1.118","TLSv1.2","2902","Application Data, Application Data"
"165","1.296296488","192.168.1.118","172.217.9.238","TCP","66","44888 → 443 [ACK] Seq=892 Ack=90327 Win=140672 Len=0 TSval=1426157958 TSecr=1460424264"
"166","1.298052225","172.217.9.238","192.168.1.118","TLSv1.2","2902","Application Data, Application Data"
"167","1.298137525","192.168.1.118","172.217.9.238","TCP","66","44888 → 443 [ACK] Seq=892 Ack=93163 Win=146432 Len=0 TSval=1426157960 TSecr=1460424265"
"168","1.298179813","172.217.9.238","192.168.1.118","TLSv1.2","2902","Application Data, Application Data"
"169","1.298194650","192.168.1.118","172.217.9.238","TCP","66","44888 → 443 [ACK] Seq=892 Ack=95999 Win=152064 Len=0 TSval=1426157960 TSecr=1460424266"
"170","1.299902638","172.217.9.238","192.168.1.118","TLSv1.2","2902","Application Data, Application Data"
"171","1.299964113","192.168.1.118","172.217.9.238","TCP","66","44888 → 443 [ACK] Seq=892 Ack=98835 Win=157696 Len=0 TSval=1426157962 TSecr=1460424268"
"172","1.300005613","172.217.9.238","192.168.1.118","TLSv1.2","1484","Application Data [TCP segment of a reassembled PDU]"
"173","1.301582363","172.217.9.238","192.168.1.118","TLSv1.2","1484","Application Data [TCP segment of a reassembled PDU]"
"174","1.301649488","192.168.1.118","172.217.9.238","TCP","66","44888 → 443 [ACK] Seq=892 Ack=101671 Win=163456 Len=0 TSval=1426157964 TSecr=1460424269"
"175","1.301691838","172.217.9.238","192.168.1.118","TLSv1.2","2902","Application Data, Application Data"
"176","1.301708388","192.168.1.118","172.217.9.238","TCP","66","44888 → 443 [ACK] Seq=892 Ack=104507 Win=169088 Len=0 TSval=1426157964 TSecr=1460424270"
"177","1.303632375","172.217.9.238","192.168.1.118","TLSv1.2","2902","Application Data, Application Data"
"178","1.303695050","192.168.1.118","172.217.9.238","TCP","66","44888 → 443 [ACK] Seq=892 Ack=107343 Win=174720 Len=0 TSval=1426157966 TSecr=1460424272"
"179","1.313787638","172.217.9.238","192.168.1.118","TLSv1.2","2902","Application Data, Application Data"
"180","1.313853075","192.168.1.118","172.217.9.238","TCP","66","44888 → 443 [ACK] Seq=892 Ack=110179 Win=180480 Len=0 TSval=1426157976 TSecr=1460424273"
"181","1.313895850","172.217.9.238","192.168.1.118","TLSv1.2","2902","Application Data, Application Data"
"182","1.313911038","192.168.1.118","172.217.9.238","TCP","66","44888 → 443 [ACK] Seq=892 Ack=113015 Win=186112 Len=0 TSval=1426157976 TSecr=1460424274"
"183","1.315415588","172.217.9.238","192.168.1.118","TLSv1.2","2902","Application Data, Application Data"
"184","1.315475200","192.168.1.118","172.217.9.238","TCP","66","44888 → 443 [ACK] Seq=892 Ack=115851 Win=191744 Len=0 TSval=1426157978 TSecr=1460424276"
"185","1.315514000","172.217.9.238","192.168.1.118","TLSv1.2","2902","Application Data, Application Data"
"186","1.315528825","192.168.1.118","172.217.9.238","TCP","66","44888 → 443 [ACK] Seq=892 Ack=118687 Win=197504 Len=0 TSval=1426157978 TSecr=1460424277"
"187","1.342353100","172.217.9.238","192.168.1.118","TLSv1.2","1484","Application Data [TCP segment of a reassembled PDU]"
"188","1.344110288","172.217.9.238","192.168.1.118","TLSv1.2","1484","Application Data [TCP segment of a reassembled PDU]"
"189","1.344175613","192.168.1.118","172.217.9.238","TCP","66","44888 → 443 [ACK] Seq=892 Ack=121523 Win=203136 Len=0 TSval=1426158006 TSecr=1460424310"
"190","1.344226725","172.217.9.238","192.168.1.118","TLSv1.2","2902","Application Data, Application Data"
"191","1.344246738","192.168.1.118","172.217.9.238","TCP","66","44888 → 443 [ACK] Seq=892 Ack=124359 Win=208768 Len=0 TSval=1426158006 TSecr=1460424311"
"192","1.344257113","172.217.9.238","192.168.1.118","TLSv1.2","1484","Application Data [TCP segment of a reassembled PDU]"
"193","1.344303575","172.217.9.238","192.168.1.118","TLSv1.2","1484","Application Data [TCP segment of a reassembled PDU]"
"194","1.344320375","192.168.1.118","172.217.9.238","TCP","66","44888 → 443 [ACK] Seq=892 Ack=127195 Win=213248 Len=0 TSval=1426158006 TSecr=1460424312"
"195","1.344339888","172.217.9.238","192.168.1.118","TLSv1.2","2902","Application Data, Application Data"
"196","1.346542700","192.168.1.118","172.217.9.238","TCP","66","44888 → 443 [ACK] Seq=892 Ack=130031 Win=210432 Len=0 TSval=1426158009 TSecr=1460424313"
"197","1.348281338","172.217.9.238","192.168.1.118","TLSv1.2","1484","Application Data [TCP segment of a reassembled PDU]"
"198","1.352203288","172.217.9.238","192.168.1.118","TLSv1.2","1484","Application Data [TCP segment of a reassembled PDU]"
"199","1.352262938","172.217.9.238","192.168.1.118","TLSv1.2","2902","Application Data, Application Data"
"200","1.352277438","172.217.9.238","192.168.1.118","TLSv1.2","1484","Application Data [TCP segment of a reassembled PDU]"
"201","1.352961050","172.217.9.238","192.168.1.118","TLSv1.2","1484","Application Data, Application Data"
"202","1.355564100","192.168.1.118","172.217.9.238","TCP","66","44888 → 443 [ACK] Seq=892 Ack=138539 Win=201984 Len=0 TSval=1426158018 TSecr=1460424317"
"203","1.358809163","172.217.9.238","192.168.1.118","TLSv1.2","2902","Application Data, Application Data"
"204","1.358868013","172.217.9.238","192.168.1.118","TLSv1.2","2902","Application Data, Application Data"
"205","1.358925113","172.217.9.238","192.168.1.118","TLSv1.2","1484","Application Data [TCP segment of a reassembled PDU]"
"206","1.361462900","192.168.1.118","172.217.9.238","TCP","66","44888 → 443 [ACK] Seq=892 Ack=141375 Win=213248 Len=0 TSval=1426158021 TSecr=1460424321"
"207","1.361551813","192.168.1.118","172.217.9.238","TCP","66","44888 → 443 [ACK] Seq=892 Ack=144211 Win=214528 Len=0 TSval=1426158024 TSecr=1460424322"
"208","1.361625463","172.217.9.238","192.168.1.118","TLSv1.2","1484","Application Data [TCP segment of a reassembled PDU]"
"209","1.361694975","192.168.1.118","172.217.9.238","TCP","66","44888 → 443 [ACK] Seq=892 Ack=147047 Win=217344 Len=0 TSval=1426158024 TSecr=1460424323"
"210","1.361744113","172.217.9.238","192.168.1.118","TLSv1.2","2902","Application Data, Application Data"
"211","1.361755525","172.217.9.238","192.168.1.118","TLSv1.2","1484","Application Data [TCP segment of a reassembled PDU]"
"212","1.362323350","172.217.9.238","192.168.1.118","TLSv1.2","1484","Application Data [TCP segment of a reassembled PDU]"
"213","1.362361463","172.217.9.238","192.168.1.118","TLSv1.2","1484","Application Data [TCP segment of a reassembled PDU]"
"214","1.367315613","192.168.1.118","172.217.9.238","TCP","66","44888 → 443 [ACK] Seq=892 Ack=154137 Win=210304 Len=0 TSval=1426158029 TSecr=1460424325"
"215","1.373895138","172.217.9.238","192.168.1.118","TLSv1.2","1484","Application Data [TCP segment of a reassembled PDU]"
"216","1.373949638","172.217.9.238","192.168.1.118","TLSv1.2","2902","Application Data, Application Data"
"217","1.373967113","172.217.9.238","192.168.1.118","TLSv1.2","2902","Application Data, Application Data"
"218","1.375545138","192.168.1.118","172.217.9.238","TCP","66","44888 → 443 [ACK] Seq=892 Ack=161227 Win=203264 Len=0 TSval=1426158036 TSecr=1460424327"
"219","1.379705475","172.217.9.238","192.168.1.118","TLSv1.2","2902","Application Data, Application Data"
"220","1.379761913","172.217.9.238","192.168.1.118","TLSv1.2","2902","Application Data, Application Data"
"221","1.379827138","172.217.9.238","192.168.1.118","TLSv1.2","2902","Application Data, Application Data"
"222","1.379853713","172.217.9.238","192.168.1.118","TLSv1.2","2902","Application Data, Application Data"
"223","1.379876825","172.217.9.238","192.168.1.118","TLSv1.2","2902","Application Data, Application Data"
"224","1.379897575","172.217.9.238","192.168.1.118","TLSv1.2","2902","Application Data, Application Data"
"225","1.379927850","172.217.9.238","192.168.1.118","TLSv1.2","2902","Application Data, Application Data"
"226","1.379946663","172.217.9.238","192.168.1.118","TLSv1.2","2902","Application Data, Application Data"
"227","1.383593188","172.217.9.238","192.168.1.118","TLSv1.2","2902","Application Data, Application Data"
"228","1.383646450","172.217.9.238","192.168.1.118","TLSv1.2","2902","Application Data, Application Data"
"229","1.383697325","172.217.9.238","192.168.1.118","TLSv1.2","2902","Application Data, Application Data"
"230","1.383721300","172.217.9.238","192.168.1.118","TLSv1.2","2902","Application Data, Application Data"
"231","1.383745425","172.217.9.238","192.168.1.118","TLSv1.2","2902","Application Data, Application Data"
"232","1.383776750","172.217.9.238","192.168.1.118","TLSv1.2","2902","Application Data, Application Data"
"233","1.383799213","172.217.9.238","192.168.1.118","TLSv1.2","2902","Application Data, Application Data"
"234","1.383816600","172.217.9.238","192.168.1.118","TLSv1.2","2902","Application Data, Application Data"
"235","1.384496175","192.168.1.118","172.217.9.238","TCP","66","44888 → 443 [ACK] Seq=892 Ack=206603 Win=157952 Len=0 TSval=1426158047 TSecr=1460424332"
"236","1.399817963","172.217.9.238","192.168.1.118","TLSv1.2","2902","Application Data, Application Data"
"237","1.399883250","192.168.1.118","172.217.9.238","TCP","66","44888 → 443 [ACK] Seq=892 Ack=209439 Win=159232 Len=0 TSval=1426158062 TSecr=1460424349"
"238","1.399927750","172.217.9.238","192.168.1.118","TLSv1.2","2902","Application Data, Application Data"
"239","1.399973450","172.217.9.238","192.168.1.118","TLSv1.2","2902","Application Data, Application Data"
"240","1.399996625","172.217.9.238","192.168.1.118","TLSv1.2","2902","Application Data, Application Data"
"241","1.400017275","172.217.9.238","192.168.1.118","TLSv1.2","2902","Application Data, Application Data"
"242","1.400043088","172.217.9.238","192.168.1.118","TLSv1.2","2902","Application Data, Application Data"
"243","1.400928850","192.168.1.118","172.217.9.238","TCP","66","44888 → 443 [ACK] Seq=892 Ack=223619 Win=145152 Len=0 TSval=1426158063 TSecr=1460424350"
"244","1.406177800","172.217.9.238","192.168.1.118","TLSv1.2","2902","Application Data, Application Data"
"245","1.406243838","192.168.1.118","172.217.9.238","TCP","66","44888 → 443 [ACK] Seq=892 Ack=226455 Win=167424 Len=0 TSval=1426158068 TSecr=1460424355"
"246","1.406286263","172.217.9.238","192.168.1.118","TLSv1.2","2902","Application Data, Application Data"
"247","1.406331338","172.217.9.238","192.168.1.118","TLSv1.2","2902","Application Data, Application Data"
"248","1.406353300","172.217.9.238","192.168.1.118","TLSv1.2","2902","Application Data, Application Data"
"249","1.406374263","172.217.9.238","192.168.1.118","TLSv1.2","2902","Application Data, Application Data"
"250","1.406395638","172.217.9.238","192.168.1.118","TLSv1.2","2902","Application Data, Application Data, Application Data"
"251","1.406416125","172.217.9.238","192.168.1.118","TLSv1.2","2902","Application Data, Application Data"
"252","1.406441175","172.217.9.238","192.168.1.118","TLSv1.2","2902","Application Data, Application Data"
"253","1.408838400","192.168.1.118","172.217.9.238","TCP","66","44888 → 443 [ACK] Seq=892 Ack=246307 Win=147584 Len=0 TSval=1426158071 TSecr=1460424356"
"254","1.416431150","172.217.9.238","192.168.1.118","TLSv1.2","2902","Application Data, Application Data"
"255","1.416491050","172.217.9.238","192.168.1.118","TLSv1.2","2902","Application Data, Application Data"
"256","1.416558250","172.217.9.238","192.168.1.118","TLSv1.2","2902","Application Data, Application Data"
"257","1.416576713","172.217.9.238","192.168.1.118","TLSv1.2","2902","Application Data, Application Data"
"258","1.416736413","192.168.1.118","172.217.9.238","TCP","66","44888 → 443 [ACK] Seq=892 Ack=257651 Win=136320 Len=0 TSval=1426158079 TSecr=1460424363"
"259","1.419543175","172.217.9.238","192.168.1.118","TLSv1.2","5738","Application Data, Application Data, Application Data, Application Data"
"260","1.421363188","172.217.9.238","192.168.1.118","TLSv1.2","2902","Application Data, Application Data"
"261","1.421413025","172.217.9.238","192.168.1.118","TLSv1.2","2902","Application Data, Application Data"
"262","1.421478013","172.217.9.238","192.168.1.118","TLSv1.2","1484","Application Data [TCP segment of a reassembled PDU]"
"263","1.421487388","172.217.9.238","192.168.1.118","TLSv1.2","1484","Application Data [TCP segment of a reassembled PDU]"
"264","1.421513713","172.217.9.238","192.168.1.118","TLSv1.2","4320","Application Data, Application Data, Application Data"
"265","1.422384913","192.168.1.118","172.217.9.238","TCP","66","44888 → 443 [ACK] Seq=892 Ack=276085 Win=117888 Len=0 TSval=1426158085 TSecr=1460424387"
"266","1.423093638","172.217.9.238","192.168.1.118","TLSv1.2","8574","Application Data, Application Data, Application Data, Application Data, Application Data, Application Data"
"267","1.423156950","172.217.9.238","192.168.1.118","TLSv1.2","2902","Application Data, Application Data"
"268","1.423366338","192.168.1.118","172.217.9.238","TCP","66","44888 → 443 [ACK] Seq=892 Ack=287429 Win=106624 Len=0 TSval=1426158086 TSecr=1460424391"
"269","1.424749388","172.217.9.238","192.168.1.118","TLSv1.2","1484","Application Data [TCP segment of a reassembled PDU]"
"270","1.424809913","172.217.9.238","192.168.1.118","TLSv1.2","4320","Application Data, Application Data, Application Data"
"271","1.424832850","172.217.9.238","192.168.1.118","TLSv1.2","2902","Application Data, Application Data"
"272","1.426114638","172.217.9.238","192.168.1.118","TLSv1.2","1484","Application Data [TCP segment of a reassembled PDU]"
"273","1.426158600","172.217.9.238","192.168.1.118","TLSv1.2","1898","Application Data, Application Data, Application Data"
"274","1.428964188","192.168.1.118","172.217.9.238","TCP","66","44888 → 443 [ACK] Seq=892 Ack=299187 Win=94976 Len=0 TSval=1426158091 TSecr=1460424392"
"275","1.485745650","192.168.1.118","172.217.9.238","TCP","66","[TCP Window Update] 44888 → 443 [ACK] Seq=892 Ack=299187 Win=196480 Len=0 TSval=1426158148 TSecr=1460424392"
"276","1.579629888","192.168.1.118","172.217.9.238","TLSv1.2","294","Application Data"
"277","1.593728750","172.217.9.238","192.168.1.118","TCP","66","443 → 44884 [ACK] Seq=16820 Ack=1084 Win=63488 Len=0 TSval=742847809 TSecr=1426158242"
"278","1.613323025","172.217.9.238","192.168.1.118","TLSv1.2","1484","Application Data"
"279","1.613395650","192.168.1.118","172.217.9.238","TCP","66","44884 → 443 [ACK] Seq=1084 Ack=18238 Win=63104 Len=0 TSval=1426158276 TSecr=742847823"
"280","1.616684650","172.217.9.238","192.168.1.118","TLSv1.2","729","Application Data"
"281","1.616756550","192.168.1.118","172.217.9.238","TCP","66","44884 → 443 [ACK] Seq=1084 Ack=18901 Win=62464 Len=0 TSval=1426158279 TSecr=742847823"
"282","2.345219563","192.168.1.118","209.18.47.62","TCP","74","[TCP Retransmission] 58516 → 853 [SYN] Seq=0 Win=64240 Len=0 MSS=1460 SACK_PERM=1 TSval=942663405 TSecr=0 WS=128"
"283","2.360232300","192.168.1.101","224.0.0.251","MDNS","533","Standard query 0x0000 PTR _googlecast._tcp.local, "QM" question PTR _homekit._tcp.local, "QM" question PTR _uscan._tcp.local, "QM" question PTR _ptp._tcp.local, "QM" question PTR _ippusb._tcp.local, "QM" question PTR _scanner._tcp.local, "QM" question PTR _ipp._tcp.local, "QM" question PTR _pdl-datastream._tcp.local, "QM" question PTR _uscans._tcp.local, "QM" question PTR _ipps._tcp.local, "QM" question PTR _printer._tcp.local, "QM" question PTR _airplay._tcp.local, "QM" question PTR _raop._tcp.local, "QM" question PTR _airport._tcp.local, "QM" question PTR _rdlink._tcp.local, "QM" question PTR _companion-link._tcp.local, "QM" question PTR _afpovertcp._tcp.local, "QM" question PTR _rfb._tcp.local, "QM" question PTR _adisk._tcp.local, "QM" question PTR _apple-mobdev._tcp.local, "QM" question PTR 8ed307c3._sub._apple-mobdev2._tcp.local, "QM" question PTR _apple-pairable._tcp.local, "QM" question PTR Google-Home-Mini-2c3f16b2da5c4b6fd6cfbfba61c12490._googlecast._tcp.local PTR cjqg._companion-link._tcp.local OPT"
"284","2.370181413","fe80::1cc7:6d9a:a312:7e8f","ff02::fb","MDNS","547","Standard query 0x0000 PTR _googlecast._tcp.local, "QM" question PTR _homekit._tcp.local, "QM" question PTR _uscan._tcp.local, "QM" question PTR _ptp._tcp.local, "QM" question PTR _ippusb._tcp.local, "QM" question PTR _scanner._tcp.local, "QM" question PTR _ipp._tcp.local, "QM" question PTR _pdl-datastream._tcp.local, "QM" question PTR _uscans._tcp.local, "QM" question PTR _ipps._tcp.local, "QM" question PTR _printer._tcp.local, "QM" question PTR _airplay._tcp.local, "QM" question PTR _raop._tcp.local, "QM" question PTR _airport._tcp.local, "QM" question PTR _rdlink._tcp.local, "QM" question PTR _companion-link._tcp.local, "QM" question PTR _afpovertcp._tcp.local, "QM" question PTR _rfb._tcp.local, "QM" question PTR _adisk._tcp.local, "QM" question PTR _apple-mobdev._tcp.local, "QM" question PTR 8ed307c3._sub._apple-mobdev2._tcp.local, "QM" question PTR _apple-pairable._tcp.local, "QM" question PTR Google-Home-Mini-2c3f16b2da5c4b6fd6cfbfba61c12490._googlecast._tcp.local PTR cjqg._companion-link._tcp.local OPT"
"285","2.857221250","192.168.1.118","209.18.47.61","TCP","74","[TCP Retransmission] 38050 → 853 [SYN] Seq=0 Win=64240 Len=0 MSS=1460 SACK_PERM=1 TSval=3660110882 TSecr=0 WS=128"
"286","3.072861625","192.168.1.104","255.255.255.255","UDP","217","49154 → 6666 Len=175"
"287","4.224360013","192.168.1.118","192.168.1.102","TCP","176","46918 → 8009 [PSH, ACK] Seq=1 Ack=1 Win=501 Len=110 TSval=2818830597 TSecr=5921530 [TCP segment of a reassembled PDU]"
"288","4.233737725","192.168.1.102","192.168.1.118","TCP","176","8009 → 46918 [PSH, ACK] Seq=1 Ack=111 Win=277 Len=110 TSval=5922033 TSecr=2818830597 [TCP segment of a reassembled PDU]"
"289","4.233822513","192.168.1.118","192.168.1.102","TCP","66","46918 → 8009 [ACK] Seq=111 Ack=111 Win=501 Len=0 TSval=2818830607 TSecr=5922033"
"290","6.147015125","192.168.1.104","255.255.255.255","UDP","217","49154 → 6666 Len=175"
"291","6.377219825","192.168.1.118","209.18.47.62","TCP","74","[TCP Retransmission] 58516 → 853 [SYN] Seq=0 Win=64240 Len=0 MSS=1460 SACK_PERM=1 TSval=942667437 TSecr=0 WS=128"
"292","6.889211500","192.168.1.118","209.18.47.61","TCP","74","[TCP Retransmission] 38050 → 853 [SYN] Seq=0 Win=64240 Len=0 MSS=1460 SACK_PERM=1 TSval=3660114914 TSecr=0 WS=128"
"293","9.114045663","192.168.1.104","255.255.255.255","UDP","217","49154 → 6666 Len=175"
"294","9.236250050","192.168.1.118","192.168.1.102","TCP","176","46918 → 8009 [PSH, ACK] Seq=111 Ack=111 Win=501 Len=110 TSval=2818835609 TSecr=5922033 [TCP segment of a reassembled PDU]"
"295","9.240298125","192.168.1.102","192.168.1.118","TCP","176","8009 → 46918 [PSH, ACK] Seq=111 Ack=221 Win=277 Len=110 TSval=5922534 TSecr=2818835609 [TCP segment of a reassembled PDU]"
"296","9.240381275","192.168.1.118","192.168.1.102","TCP","66","46918 → 8009 [ACK] Seq=221 Ack=221 Win=501 Len=0 TSval=2818835614 TSecr=5922534"
