frame.number,_ws.col.Time,_ws.col.Source,_ws.col.Destination,_ws.col.Protocol,frame.len,_ws.col.Info
"1","0.000000000","199.232.37.140","192.168.1.118","TLSv1.2","117","Change Cipher Spec, Encrypted Handshake Message"
"2","0.001353809","192.168.1.118","199.232.37.140","TLSv1.2","256","Application Data"
"3","0.020397613","199.232.37.140","192.168.1.118","TLSv1.2","1418","Application Data"
"4","0.022695156","199.232.37.140","192.168.1.118","TLSv1.2","5474","Application Data, Application Data, Application Data, Application Data"
"5","0.022783772","192.168.1.118","199.232.37.140","TCP","66","41786 → 443 [ACK] Seq=191 Ack=6812 Win=385 Len=0 TSval=18968562 TSecr=3889822925"
"6","0.023518073","199.232.37.140","192.168.1.118","TLSv1.2","2770","Application Data, Application Data"
"7","0.023572462","192.168.1.118","199.232.37.140","TCP","66","41786 → 443 [ACK] Seq=191 Ack=9516 Win=427 Len=0 TSval=18968562 TSecr=3889822925"
"8","0.023599838","199.232.37.140","192.168.1.118","TLSv1.2","119","Application Data"
"9","0.041235868","192.168.1.118","199.232.37.140","TCP","74","41787 → 443 [SYN] Seq=0 Win=29200 Len=0 MSS=1460 SACK_PERM=1 TSval=18968580 TSecr=0 WS=128"
"10","0.041367447","192.168.1.118","209.18.47.62","DNS","82","Standard query 0x0a41 A styles.redditmedia.com"
"11","0.041429675","192.168.1.118","199.232.37.140","TCP","74","41788 → 443 [SYN] Seq=0 Win=29200 Len=0 MSS=1460 SACK_PERM=1 TSval=18968580 TSecr=0 WS=128"
"12","0.041540666","192.168.1.118","199.232.37.140","TCP","74","41789 → 443 [SYN] Seq=0 Win=29200 Len=0 MSS=1460 SACK_PERM=1 TSval=18968580 TSecr=0 WS=128"
"13","0.050455153","192.168.1.118","209.18.47.62","DNS","84","Standard query 0xa257 A b.thumbs.redditmedia.com"
"14","0.050751351","192.168.1.118","209.18.47.62","DNS","75","Standard query 0x86d7 A preview.redd.it"
"15","0.061977181","209.18.47.62","192.168.1.118","DNS","133","Standard query response 0x0a41 A styles.redditmedia.com CNAME reddit.map.fastly.net A 199.232.37.140"
"16","0.062171838","192.168.1.118","209.18.47.62","DNS","82","Standard query 0xb61b AAAA styles.redditmedia.com"
"17","0.062689156","192.168.1.118","199.232.37.140","TCP","66","41786 → 443 [ACK] Seq=191 Ack=9569 Win=427 Len=0 TSval=18968602 TSecr=3889822925"
"18","0.067487536","199.232.37.140","192.168.1.118","TCP","74","443 → 41788 [SYN, ACK] Seq=0 Ack=1 Win=27040 Len=0 MSS=1364 SACK_PERM=1 TSval=3120906892 TSecr=18968580 WS=512"
"19","0.067602003","192.168.1.118","199.232.37.140","TCP","66","41788 → 443 [ACK] Seq=1 Ack=1 Win=29312 Len=0 TSval=18968606 TSecr=3120906892"
"20","0.067663918","199.232.37.140","192.168.1.118","TCP","74","443 → 41787 [SYN, ACK] Seq=0 Ack=1 Win=27040 Len=0 MSS=1364 SACK_PERM=1 TSval=247927425 TSecr=18968580 WS=512"
"21","0.067692931","192.168.1.118","199.232.37.140","TCP","66","41787 → 443 [ACK] Seq=1 Ack=1 Win=29312 Len=0 TSval=18968607 TSecr=247927425"
"22","0.067713294","199.232.37.140","192.168.1.118","TCP","74","443 → 41789 [SYN, ACK] Seq=0 Ack=1 Win=27040 Len=0 MSS=1364 SACK_PERM=1 TSval=2789164753 TSecr=18968580 WS=512"
"23","0.067740620","192.168.1.118","199.232.37.140","TCP","66","41789 → 443 [ACK] Seq=1 Ack=1 Win=29312 Len=0 TSval=18968607 TSecr=2789164753"
"24","0.068122346","192.168.1.118","209.18.47.62","DNS","82","Standard query 0x82a6 A styles.redditmedia.com"
"25","0.072915801","209.18.47.62","192.168.1.118","DNS","135","Standard query response 0xa257 A b.thumbs.redditmedia.com CNAME reddit.map.fastly.net A 199.232.37.140"
"26","0.073113121","192.168.1.118","209.18.47.62","DNS","84","Standard query 0x4a49 AAAA b.thumbs.redditmedia.com"
"27","0.077845799","209.18.47.62","192.168.1.118","DNS","126","Standard query response 0x86d7 A preview.redd.it CNAME reddit.map.fastly.net A 199.232.37.140"
"28","0.078032506","192.168.1.118","209.18.47.62","DNS","75","Standard query 0x763f AAAA preview.redd.it"
"29","0.080800590","209.18.47.62","192.168.1.118","DNS","175","Standard query response 0xb61b AAAA styles.redditmedia.com CNAME reddit.map.fastly.net SOA ns1.fastly.net"
"30","0.085639172","192.168.1.118","199.232.37.140","TLSv1","583","Client Hello"
"31","0.087988191","209.18.47.62","192.168.1.118","DNS","133","Standard query response 0x82a6 A styles.redditmedia.com CNAME reddit.map.fastly.net A 199.232.37.140"
"32","0.088173560","192.168.1.118","209.18.47.62","DNS","82","Standard query 0xdee5 AAAA styles.redditmedia.com"
"33","0.103403456","192.168.1.118","199.232.37.140","TLSv1","583","Client Hello"
"34","0.105157292","209.18.47.62","192.168.1.118","DNS","177","Standard query response 0x4a49 AAAA b.thumbs.redditmedia.com CNAME reddit.map.fastly.net SOA ns1.fastly.net"
"35","0.113550924","209.18.47.62","192.168.1.118","DNS","171","Standard query response 0x763f AAAA preview.redd.it CNAME reddit.map.fastly.net SOA ns1.fastly.net"
"36","0.116910804","209.18.47.62","192.168.1.118","DNS","175","Standard query response 0xdee5 AAAA styles.redditmedia.com CNAME reddit.map.fastly.net SOA ns1.fastly.net"
"37","0.117959540","199.232.37.140","192.168.1.118","TCP","66","443 → 41787 [ACK] Seq=1 Ack=518 Win=28160 Len=0 TSval=247927439 TSecr=18968624"
"38","0.118035931","199.232.37.140","192.168.1.118","TLSv1.2","3304","Server Hello, Certificate, Server Key Exchange, Server Hello Done"
"39","0.118079270","192.168.1.118","199.232.37.140","TCP","66","41787 → 443 [ACK] Seq=518 Ack=3239 Win=35712 Len=0 TSval=18968657 TSecr=247927439"
"40","0.120615483","192.168.1.118","199.232.37.140","TLSv1","583","Client Hello"
"41","0.120913169","192.168.1.118","199.232.37.140","TCP","74","41790 → 443 [SYN] Seq=0 Win=29200 Len=0 MSS=1460 SACK_PERM=1 TSval=18968660 TSecr=0 WS=128"
"42","0.121010297","192.168.1.118","199.232.37.140","TCP","74","41791 → 443 [SYN] Seq=0 Win=29200 Len=0 MSS=1460 SACK_PERM=1 TSval=18968660 TSecr=0 WS=128"
"43","0.121092763","192.168.1.118","199.232.37.140","TCP","74","41792 → 443 [SYN] Seq=0 Win=29200 Len=0 MSS=1460 SACK_PERM=1 TSval=18968660 TSecr=0 WS=128"
"44","0.125061001","199.232.37.140","192.168.1.118","TCP","66","443 → 41788 [ACK] Seq=1 Ack=518 Win=28160 Len=0 TSval=3120906907 TSecr=18968642"
"45","0.126993869","199.232.37.140","192.168.1.118","TLSv1.2","3304","Server Hello, Certificate, Server Key Exchange, Server Hello Done"
"46","0.127077535","192.168.1.118","199.232.37.140","TCP","66","41788 → 443 [ACK] Seq=518 Ack=3239 Win=35712 Len=0 TSval=18968666 TSecr=3120906907"
"47","0.131484826","192.168.1.118","199.232.37.140","TCP","74","41793 → 443 [SYN] Seq=0 Win=29200 Len=0 MSS=1460 SACK_PERM=1 TSval=18968670 TSecr=0 WS=128"
"48","0.133936137","192.168.1.118","199.232.37.140","TLSv1.2","192","Client Key Exchange, Change Cipher Spec, Encrypted Handshake Message"
"49","0.136332658","192.168.1.118","199.232.37.140","TLSv1.2","192","Client Key Exchange, Change Cipher Spec, Encrypted Handshake Message"
"50","0.136684771","192.168.1.118","199.232.37.140","TCP","74","41794 → 443 [SYN] Seq=0 Win=29200 Len=0 MSS=1460 SACK_PERM=1 TSval=18968675 TSecr=0 WS=128"
"51","0.136819138","192.168.1.118","199.232.37.140","TCP","74","41795 → 443 [SYN] Seq=0 Win=29200 Len=0 MSS=1460 SACK_PERM=1 TSval=18968676 TSecr=0 WS=128"
"52","0.136922029","192.168.1.118","199.232.37.140","TCP","74","41796 → 443 [SYN] Seq=0 Win=29200 Len=0 MSS=1460 SACK_PERM=1 TSval=18968676 TSecr=0 WS=128"
"53","0.137025170","192.168.1.118","199.232.37.140","TCP","74","41797 → 443 [SYN] Seq=0 Win=29200 Len=0 MSS=1460 SACK_PERM=1 TSval=18968676 TSecr=0 WS=128"
"54","0.141792850","192.168.1.118","199.232.37.140","TCP","74","41798 → 443 [SYN] Seq=0 Win=29200 Len=0 MSS=1460 SACK_PERM=1 TSval=18968681 TSecr=0 WS=128"
"55","0.142427422","192.168.1.118","209.18.47.62","DNS","84","Standard query 0xfe9f A a.thumbs.redditmedia.com"
"56","0.150126591","199.232.37.140","192.168.1.118","TCP","74","443 → 41792 [SYN, ACK] Seq=0 Ack=1 Win=27040 Len=0 MSS=1364 SACK_PERM=1 TSval=2790321242 TSecr=18968660 WS=512"
"57","0.150239495","192.168.1.118","199.232.37.140","TCP","66","41792 → 443 [ACK] Seq=1 Ack=1 Win=29312 Len=0 TSval=18968689 TSecr=2790321242"
"58","0.151510715","199.232.37.140","192.168.1.118","TCP","66","443 → 41789 [ACK] Seq=1 Ack=518 Win=28160 Len=0 TSval=2789164776 TSecr=18968659"
"59","0.151582592","199.232.37.140","192.168.1.118","TCP","74","443 → 41791 [SYN, ACK] Seq=0 Ack=1 Win=27040 Len=0 MSS=1364 SACK_PERM=1 TSval=639269921 TSecr=18968660 WS=512"
"60","0.151639932","192.168.1.118","199.232.37.140","TCP","66","41791 → 443 [ACK] Seq=1 Ack=1 Win=29312 Len=0 TSval=18968690 TSecr=639269921"
"61","0.151694121","199.232.37.140","192.168.1.118","TCP","74","443 → 41790 [SYN, ACK] Seq=0 Ack=1 Win=27040 Len=0 MSS=1364 SACK_PERM=1 TSval=3118902835 TSecr=18968660 WS=512"
"62","0.151719572","192.168.1.118","199.232.37.140","TCP","66","41790 → 443 [ACK] Seq=1 Ack=1 Win=29312 Len=0 TSval=18968691 TSecr=3118902835"
"63","0.153139559","199.232.37.140","192.168.1.118","TLSv1.2","3304","Server Hello, Certificate, Server Key Exchange, Server Hello Done"
"64","0.153222312","192.168.1.118","199.232.37.140","TCP","66","41789 → 443 [ACK] Seq=518 Ack=3239 Win=35712 Len=0 TSval=18968692 TSecr=2789164776"
"65","0.156204229","199.232.37.140","192.168.1.118","TCP","74","443 → 41793 [SYN, ACK] Seq=0 Ack=1 Win=27040 Len=0 MSS=1364 SACK_PERM=1 TSval=1653177063 TSecr=18968670 WS=512"
"66","0.156309458","192.168.1.118","199.232.37.140","TCP","66","41793 → 443 [ACK] Seq=1 Ack=1 Win=29312 Len=0 TSval=18968695 TSecr=1653177063"
"67","0.158802432","199.232.37.140","192.168.1.118","TLSv1.2","117","Change Cipher Spec, Encrypted Handshake Message"
"68","0.159673425","192.168.1.118","199.232.37.140","TCP","66","41775 → 443 [ACK] Seq=1 Ack=1 Win=1142 Len=0 TSval=18968698 TSecr=2787599478"
"69","0.166626081","199.232.37.140","192.168.1.118","TCP","74","443 → 41795 [SYN, ACK] Seq=0 Ack=1 Win=27040 Len=0 MSS=1364 SACK_PERM=1 TSval=3889822960 TSecr=18968676 WS=512"
"70","0.166746985","192.168.1.118","199.232.37.140","TCP","66","41795 → 443 [ACK] Seq=1 Ack=1 Win=29312 Len=0 TSval=18968706 TSecr=3889822960"
"71","0.166798100","199.232.37.140","192.168.1.118","TLSv1.2","117","Change Cipher Spec, Encrypted Handshake Message"
"72","0.166826088","199.232.37.140","192.168.1.118","TCP","74","443 → 41794 [SYN, ACK] Seq=0 Ack=1 Win=27040 Len=0 MSS=1364 SACK_PERM=1 TSval=2788404205 TSecr=18968675 WS=512"
"73","0.166853839","192.168.1.118","199.232.37.140","TCP","66","41794 → 443 [ACK] Seq=1 Ack=1 Win=29312 Len=0 TSval=18968706 TSecr=2788404205"
"74","0.166873740","199.232.37.140","192.168.1.118","TCP","74","443 → 41796 [SYN, ACK] Seq=0 Ack=1 Win=27040 Len=0 MSS=1364 SACK_PERM=1 TSval=3083312141 TSecr=18968676 WS=512"
"75","0.166901703","192.168.1.118","199.232.37.140","TCP","66","41796 → 443 [ACK] Seq=1 Ack=1 Win=29312 Len=0 TSval=18968706 TSecr=3083312141"
"76","0.166920942","199.232.37.140","192.168.1.118","TCP","74","443 → 41797 [SYN, ACK] Seq=0 Ack=1 Win=27040 Len=0 MSS=1364 SACK_PERM=1 TSval=2790733728 TSecr=18968676 WS=512"
"77","0.166947480","192.168.1.118","199.232.37.140","TCP","66","41797 → 443 [ACK] Seq=1 Ack=1 Win=29312 Len=0 TSval=18968706 TSecr=2790733728"
"78","0.166966843","199.232.37.140","192.168.1.118","TCP","74","443 → 41798 [SYN, ACK] Seq=0 Ack=1 Win=27040 Len=0 MSS=1364 SACK_PERM=1 TSval=4178761853 TSecr=18968681 WS=512"
"79","0.166993369","192.168.1.118","199.232.37.140","TCP","66","41798 → 443 [ACK] Seq=1 Ack=1 Win=29312 Len=0 TSval=18968706 TSecr=4178761853"
"80","0.169935422","209.18.47.62","192.168.1.118","DNS","135","Standard query response 0xfe9f A a.thumbs.redditmedia.com CNAME reddit.map.fastly.net A 199.232.37.140"
"81","0.170100903","192.168.1.118","209.18.47.62","DNS","84","Standard query 0x3ad9 AAAA a.thumbs.redditmedia.com"
"82","0.187315430","209.18.47.62","192.168.1.118","DNS","177","Standard query response 0x3ad9 AAAA a.thumbs.redditmedia.com CNAME reddit.map.fastly.net SOA ns1.fastly.net"
"83","0.187318643","192.168.1.118","199.232.37.140","TLSv1","583","Client Hello"
"84","0.187765196","192.168.1.118","199.232.37.140","TLSv1.2","272","Application Data"
"85","0.187994929","192.168.1.118","199.232.37.140","TLSv1.2","274","Application Data"
"86","0.190041176","192.168.1.118","199.232.37.140","TLSv1.2","192","Client Key Exchange, Change Cipher Spec, Encrypted Handshake Message"
"87","0.204821380","199.232.37.140","192.168.1.118","TCP","66","443 → 41793 [ACK] Seq=1 Ack=518 Win=28160 Len=0 TSval=1653177112 TSecr=18968726"
"88","0.206307683","199.232.37.140","192.168.1.118","TLSv1.2","2937","Application Data, Application Data, Application Data"
"89","0.206396998","192.168.1.118","199.232.37.140","TCP","66","41787 → 443 [ACK] Seq=850 Ack=6161 Win=41472 Len=0 TSval=18968745 TSecr=247927461"
"90","0.209189433","199.232.37.140","192.168.1.118","TLSv1.2","2532","Application Data, Application Data, Application Data"
"91","0.209282199","192.168.1.118","199.232.37.140","TCP","66","41788 → 443 [ACK] Seq=852 Ack=5756 Win=40704 Len=0 TSval=18968748 TSecr=3120906928"
"92","0.209331401","199.232.37.140","192.168.1.118","TLSv1.2","1418","Server Hello"
"93","0.209354489","192.168.1.118","199.232.37.140","TCP","66","41793 → 443 [ACK] Seq=518 Ack=1353 Win=32000 Len=0 TSval=18968748 TSecr=1653177113"
"94","0.217841611","199.232.37.140","192.168.1.118","TLSv1.2","1962","Certificate, Server Key Exchange, Server Hello Done"
"95","0.217940315","192.168.1.118","199.232.37.140","TCP","66","41793 → 443 [ACK] Seq=518 Ack=3249 Win=35712 Len=0 TSval=18968757 TSecr=1653177113"
"96","0.219132781","199.232.37.140","192.168.1.118","TLSv1.2","117","Change Cipher Spec, Encrypted Handshake Message"
"97","0.239697639","192.168.1.118","199.232.37.140","TLSv1","583","Client Hello"
"98","0.258711742","192.168.1.118","199.232.37.140","TCP","66","41789 → 443 [ACK] Seq=644 Ack=3290 Win=35712 Len=0 TSval=18968798 TSecr=2789164791"
"99","0.261213442","199.232.37.140","192.168.1.118","TCP","66","443 → 41790 [ACK] Seq=1 Ack=518 Win=28160 Len=0 TSval=3118902863 TSecr=18968778"
"100","0.266581129","199.232.37.140","192.168.1.118","TLSv1.2","1418","Server Hello"
"101","0.266684946","192.168.1.118","199.232.37.140","TCP","66","41790 → 443 [ACK] Seq=518 Ack=1353 Win=32000 Len=0 TSval=18968806 TSecr=3118902863"
"102","0.267157787","192.168.1.118","199.232.37.140","TLSv1","583","Client Hello"
"103","0.268096345","199.232.37.140","192.168.1.118","TLSv1.2","1984","Certificate, Server Key Exchange, Server Hello Done"
"104","0.268182173","192.168.1.118","199.232.37.140","TCP","66","41790 → 443 [ACK] Seq=518 Ack=3271 Win=35840 Len=0 TSval=18968807 TSecr=3118902863"
"105","0.291439262","199.232.37.140","192.168.1.118","TCP","66","443 → 41791 [ACK] Seq=1 Ack=518 Win=28160 Len=0 TSval=639269957 TSecr=18968806"
"106","0.293546336","199.232.37.140","192.168.1.118","TLSv1.2","1418","Server Hello"
"107","0.293627964","192.168.1.118","199.232.37.140","TCP","66","41791 → 443 [ACK] Seq=518 Ack=1353 Win=32000 Len=0 TSval=18968832 TSecr=639269957"
"108","0.294877670","192.168.1.118","199.232.37.140","TLSv1","583","Client Hello"
"109","0.295437152","199.232.37.140","192.168.1.118","TLSv1.2","2080","Certificate, Server Key Exchange, Server Hello Done"
"110","0.295510254","192.168.1.118","199.232.37.140","TCP","66","41791 → 443 [ACK] Seq=518 Ack=3367 Win=35968 Len=0 TSval=18968834 TSecr=639269957"
"111","0.312856074","192.168.1.118","199.232.37.140","TLSv1","583","Client Hello"
"112","0.315952670","199.232.37.140","192.168.1.118","TCP","66","443 → 41792 [ACK] Seq=1 Ack=518 Win=28160 Len=0 TSval=2790321283 TSecr=18968834"
"113","0.317143624","199.232.37.140","192.168.1.118","TLSv1.2","3314","Server Hello, Certificate, Server Key Exchange, Server Hello Done"
"114","0.317221952","192.168.1.118","199.232.37.140","TCP","66","41792 → 443 [ACK] Seq=518 Ack=3249 Win=35712 Len=0 TSval=18968856 TSecr=2790321284"
"115","0.331289994","199.232.37.140","192.168.1.118","TCP","66","443 → 41794 [ACK] Seq=1 Ack=518 Win=28160 Len=0 TSval=2788404249 TSecr=18968852"
"116","0.332810660","199.232.37.140","192.168.1.118","TLSv1.2","1418","Server Hello"
"117","0.332899813","192.168.1.118","199.232.37.140","TCP","66","41794 → 443 [ACK] Seq=518 Ack=1353 Win=32000 Len=0 TSval=18968872 TSecr=2788404249"
"118","0.333089670","192.168.1.118","199.232.37.140","TLSv1","583","Client Hello"
"119","0.334315863","199.232.37.140","192.168.1.118","TLSv1.2","2080","Certificate, Server Key Exchange, Server Hello Done"
"120","0.334394253","192.168.1.118","199.232.37.140","TCP","66","41794 → 443 [ACK] Seq=518 Ack=3367 Win=35968 Len=0 TSval=18968873 TSecr=2788404249"
"121","0.356060649","199.232.37.140","192.168.1.118","TCP","66","443 → 41795 [ACK] Seq=1 Ack=518 Win=28160 Len=0 TSval=3889823010 TSecr=18968872"
"122","0.357547776","192.168.1.118","199.232.37.140","TLSv1","583","Client Hello"
"123","0.368490809","199.232.37.140","192.168.1.118","TLSv1.2","1418","Server Hello"
"124","0.368582649","192.168.1.118","199.232.37.140","TCP","66","41795 → 443 [ACK] Seq=518 Ack=1353 Win=32000 Len=0 TSval=18968907 TSecr=3889823010"
"125","0.370095015","199.232.37.140","192.168.1.118","TLSv1.2","2080","Certificate, Server Key Exchange, Server Hello Done"
"126","0.370178893","192.168.1.118","199.232.37.140","TCP","66","41795 → 443 [ACK] Seq=518 Ack=3367 Win=35968 Len=0 TSval=18968909 TSecr=3889823010"
"127","0.378689928","192.168.1.118","199.232.37.140","TLSv1","583","Client Hello"
"128","0.386060624","199.232.37.140","192.168.1.118","TCP","66","443 → 41796 [ACK] Seq=1 Ack=518 Win=28160 Len=0 TSval=3083312366 TSecr=18968896"
"129","0.387181125","199.232.37.140","192.168.1.118","TLSv1.2","3336","Server Hello, Certificate, Server Key Exchange, Server Hello Done"
"130","0.387260928","192.168.1.118","199.232.37.140","TCP","66","41796 → 443 [ACK] Seq=518 Ack=3271 Win=35840 Len=0 TSval=18968926 TSecr=3083312367"
"131","0.397352219","192.168.1.118","199.232.37.140","TLSv1","583","Client Hello"
"132","0.397632529","192.168.1.118","199.232.37.140","TCP","74","41799 → 443 [SYN] Seq=0 Win=29200 Len=0 MSS=1460 SACK_PERM=1 TSval=18968936 TSecr=0 WS=128"
"133","0.397791234","192.168.1.118","199.232.37.140","TCP","74","41800 → 443 [SYN] Seq=0 Win=29200 Len=0 MSS=1460 SACK_PERM=1 TSval=18968937 TSecr=0 WS=128"
"134","0.397918451","192.168.1.118","199.232.37.140","TCP","74","41801 → 443 [SYN] Seq=0 Win=29200 Len=0 MSS=1460 SACK_PERM=1 TSval=18968937 TSecr=0 WS=128"
"135","0.398031868","192.168.1.118","199.232.37.140","TCP","74","41802 → 443 [SYN] Seq=0 Win=29200 Len=0 MSS=1460 SACK_PERM=1 TSval=18968937 TSecr=0 WS=128"
"136","0.398149559","192.168.1.118","199.232.37.140","TCP","74","41803 → 443 [SYN] Seq=0 Win=29200 Len=0 MSS=1460 SACK_PERM=1 TSval=18968937 TSecr=0 WS=128"
"137","0.398249013","192.168.1.118","199.232.37.140","TCP","74","41804 → 443 [SYN] Seq=0 Win=29200 Len=0 MSS=1460 SACK_PERM=1 TSval=18968937 TSecr=0 WS=128"
"138","0.400379662","199.232.37.140","192.168.1.118","TCP","66","443 → 41797 [ACK] Seq=1 Ack=518 Win=28160 Len=0 TSval=2790733789 TSecr=18968917"
"139","0.401513902","192.168.1.118","199.232.37.140","TLSv1.2","192","Client Key Exchange, Change Cipher Spec, Encrypted Handshake Message"
"140","0.402384532","192.168.1.118","199.232.37.140","TLSv1.2","279","Application Data"
"141","0.404206571","199.232.37.140","192.168.1.118","TLSv1.2","1418","Server Hello"
"142","0.404298437","192.168.1.118","199.232.37.140","TCP","66","41797 → 443 [ACK] Seq=518 Ack=1353 Win=32000 Len=0 TSval=18968943 TSecr=2790733789"
"143","0.404456492","192.168.1.118","199.232.37.140","TLSv1.2","192","Client Key Exchange, Change Cipher Spec, Encrypted Handshake Message"
"144","0.405693961","199.232.37.140","192.168.1.118","TLSv1.2","2080","Certificate, Server Key Exchange, Server Hello Done"
"145","0.405781601","192.168.1.118","199.232.37.140","TCP","66","41797 → 443 [ACK] Seq=518 Ack=3367 Win=35968 Len=0 TSval=18968945 TSecr=2790733789"
"146","0.406842963","192.168.1.118","199.232.37.140","TLSv1.2","192","Client Key Exchange, Change Cipher Spec, Encrypted Handshake Message"
"147","0.413739967","192.168.1.118","199.232.37.140","TLSv1.2","192","Client Key Exchange, Change Cipher Spec, Encrypted Handshake Message"
"148","0.418398630","199.232.37.140","192.168.1.118","TCP","74","443 → 41800 [SYN, ACK] Seq=0 Ack=1 Win=27040 Len=0 MSS=1364 SACK_PERM=1 TSval=3227920392 TSecr=18968937 WS=512"
"149","0.418517210","192.168.1.118","199.232.37.140","TCP","66","41800 → 443 [ACK] Seq=1 Ack=1 Win=29312 Len=0 TSval=18968957 TSecr=3227920392"
"150","0.419087617","192.168.1.118","199.232.37.140","TLSv1.2","192","Client Key Exchange, Change Cipher Spec, Encrypted Handshake Message"
"151","0.420682648","199.232.37.140","192.168.1.118","TCP","74","443 → 41799 [SYN, ACK] Seq=0 Ack=1 Win=27040 Len=0 MSS=1364 SACK_PERM=1 TSval=2788625507 TSecr=18968936 WS=512"
"152","0.420797202","192.168.1.118","199.232.37.140","TCP","66","41799 → 443 [ACK] Seq=1 Ack=1 Win=29312 Len=0 TSval=18968960 TSecr=2788625507"
"153","0.420841041","199.232.37.140","192.168.1.118","TCP","74","443 → 41801 [SYN, ACK] Seq=0 Ack=1 Win=27040 Len=0 MSS=1364 SACK_PERM=1 TSval=2788625507 TSecr=18968937 WS=512"
"154","0.420867642","192.168.1.118","199.232.37.140","TCP","66","41801 → 443 [ACK] Seq=1 Ack=1 Win=29312 Len=0 TSval=18968960 TSecr=2788625507"
"155","0.420885305","199.232.37.140","192.168.1.118","TCP","66","443 → 41798 [ACK] Seq=1 Ack=518 Win=28160 Len=0 TSval=4178761918 TSecr=18968936"
"156","0.420908106","199.232.37.140","192.168.1.118","TCP","74","443 → 41802 [SYN, ACK] Seq=0 Ack=1 Win=27040 Len=0 MSS=1364 SACK_PERM=1 TSval=2787365115 TSecr=18968937 WS=512"
"157","0.420932307","192.168.1.118","199.232.37.140","TCP","66","41802 → 443 [ACK] Seq=1 Ack=1 Win=29312 Len=0 TSval=18968960 TSecr=2787365115"
"158","0.420966508","199.232.37.140","192.168.1.118","TLSv1.2","3432","Server Hello, Certificate, Server Key Exchange, Server Hello Done"
"159","0.420991609","192.168.1.118","199.232.37.140","TCP","66","41798 → 443 [ACK] Seq=518 Ack=3367 Win=35968 Len=0 TSval=18968960 TSecr=4178761918"
"160","0.424271898","192.168.1.118","199.232.37.140","TLSv1.2","192","Client Key Exchange, Change Cipher Spec, Encrypted Handshake Message"
"161","0.426660945","199.232.37.140","192.168.1.118","TCP","74","443 → 41803 [SYN, ACK] Seq=0 Ack=1 Win=27040 Len=0 MSS=1364 SACK_PERM=1 TSval=2790575321 TSecr=18968937 WS=512"
"162","0.426776974","192.168.1.118","199.232.37.140","TCP","66","41803 → 443 [ACK] Seq=1 Ack=1 Win=29312 Len=0 TSval=18968966 TSecr=2790575321"
"163","0.428168110","199.232.37.140","192.168.1.118","TLSv1.2","117","Change Cipher Spec, Encrypted Handshake Message"
"164","0.428250313","192.168.1.118","199.232.37.140","TCP","66","41791 → 443 [ACK] Seq=644 Ack=3418 Win=35968 Len=0 TSval=18968967 TSecr=639269991"
"165","0.428292114","199.232.37.140","192.168.1.118","TLSv1.2","117","Change Cipher Spec, Encrypted Handshake Message"
"166","0.428318128","192.168.1.118","199.232.37.140","TCP","66","41793 → 443 [ACK] Seq=644 Ack=3300 Win=35712 Len=0 TSval=18968967 TSecr=1653177334"
"167","0.428340791","199.232.37.140","192.168.1.118","TLSv1.2","744","Application Data, Application Data"
"168","0.428372054","192.168.1.118","199.232.37.140","TCP","66","41789 → 443 [ACK] Seq=857 Ack=3968 Win=38400 Len=0 TSval=18968967 TSecr=2789164845"
"169","0.428390943","199.232.37.140","192.168.1.118","TLSv1.2","117","Change Cipher Spec, Encrypted Handshake Message"
"170","0.428388205","192.168.1.118","199.232.37.140","TLSv1.2","192","Client Key Exchange, Change Cipher Spec, Encrypted Handshake Message"
"171","0.428436094","192.168.1.118","199.232.37.140","TCP","66","41790 → 443 [ACK] Seq=644 Ack=3322 Win=35840 Len=0 TSval=18968967 TSecr=3118902904"
"172","0.428456207","199.232.37.140","192.168.1.118","TCP","74","443 → 41804 [SYN, ACK] Seq=0 Ack=1 Win=27040 Len=0 MSS=1364 SACK_PERM=1 TSval=251586455 TSecr=18968937 WS=512"
"173","0.428499134","192.168.1.118","199.232.37.140","TCP","66","41804 → 443 [ACK] Seq=1 Ack=1 Win=29312 Len=0 TSval=18968967 TSecr=251586455"
"174","0.434195233","192.168.1.118","199.232.37.140","TLSv1.2","192","Client Key Exchange, Change Cipher Spec, Encrypted Handshake Message"
"175","0.436625043","199.232.37.140","192.168.1.118","TLSv1.2","117","Change Cipher Spec, Encrypted Handshake Message"
"176","0.436724672","192.168.1.118","199.232.37.140","TCP","66","41792 → 443 [ACK] Seq=644 Ack=3300 Win=35712 Len=0 TSval=18968976 TSecr=2790321314"
"177","0.437243015","199.232.37.140","192.168.1.118","TLSv1.2","117","Change Cipher Spec, Encrypted Handshake Message"
"178","0.437288454","192.168.1.118","199.232.37.140","TCP","66","41794 → 443 [ACK] Seq=644 Ack=3418 Win=35968 Len=0 TSval=18968976 TSecr=2788404275"
"179","0.441932392","192.168.1.118","199.232.37.140","TLSv1.2","192","Client Key Exchange, Change Cipher Spec, Encrypted Handshake Message"
"180","0.446316695","199.232.37.140","192.168.1.118","TLSv1.2","117","Change Cipher Spec, Encrypted Handshake Message"
"181","0.446412011","192.168.1.118","199.232.37.140","TCP","66","41795 → 443 [ACK] Seq=644 Ack=3418 Win=35968 Len=0 TSval=18968985 TSecr=3889823032"
"182","0.447134086","199.232.37.140","192.168.1.118","TLSv1.2","117","Change Cipher Spec, Encrypted Handshake Message"
"183","0.447191013","192.168.1.118","199.232.37.140","TCP","66","41796 → 443 [ACK] Seq=644 Ack=3322 Win=35840 Len=0 TSval=18968986 TSecr=3083312432"
"184","0.462709906","199.232.37.140","192.168.1.118","TLSv1.2","117","Change Cipher Spec, Encrypted Handshake Message"
"185","0.474475731","192.168.1.118","199.232.37.140","TLSv1","583","Client Hello"
"186","0.481534303","199.232.37.140","192.168.1.118","TLSv1.2","117","Change Cipher Spec, Encrypted Handshake Message"
"187","0.493536710","192.168.1.118","199.232.37.140","TLSv1","583","Client Hello"
"188","0.502721794","192.168.1.118","199.232.37.140","TCP","66","41797 → 443 [ACK] Seq=644 Ack=3418 Win=35968 Len=0 TSval=18969042 TSecr=2790733804"
"189","0.505285359","199.232.37.140","192.168.1.118","TCP","66","443 → 41799 [ACK] Seq=1 Ack=518 Win=28160 Len=0 TSval=2788625529 TSecr=18969013"
"190","0.510212556","199.232.37.140","192.168.1.118","TLSv1.2","3336","Server Hello, Certificate, Server Key Exchange, Server Hello Done"
"191","0.510309447","192.168.1.118","199.232.37.140","TCP","66","41799 → 443 [ACK] Seq=518 Ack=3271 Win=35840 Len=0 TSval=18969049 TSecr=2788625529"
"192","0.511516239","199.232.37.140","192.168.1.118","TCP","66","443 → 41800 [ACK] Seq=1 Ack=518 Win=28160 Len=0 TSval=3227920415 TSecr=18969032"
"193","0.513523822","199.232.37.140","192.168.1.118","TLSv1.2","1418","Server Hello"
"194","0.513616138","192.168.1.118","199.232.37.140","TCP","66","41800 → 443 [ACK] Seq=518 Ack=1353 Win=32000 Len=0 TSval=18969052 TSecr=3227920415"
"195","0.514114418","192.168.1.118","199.232.37.140","TLSv1","583","Client Hello"
"196","0.514995474","199.232.37.140","192.168.1.118","TLSv1.2","1984","Certificate, Server Key Exchange, Server Hello Done"
"197","0.515082139","192.168.1.118","199.232.37.140","TCP","66","41800 → 443 [ACK] Seq=518 Ack=3271 Win=35840 Len=0 TSval=18969054 TSecr=3227920415"
"198","0.520715361","192.168.1.118","199.232.37.140","TCP","66","41798 → 443 [ACK] Seq=644 Ack=3418 Win=35968 Len=0 TSval=18969060 TSecr=4178761934"
"199","0.531034360","192.168.1.118","199.232.37.140","TLSv1","583","Client Hello"
"200","0.540183630","199.232.37.140","192.168.1.118","TCP","66","443 → 41801 [ACK] Seq=1 Ack=518 Win=28160 Len=0 TSval=2788625538 TSecr=18969053"
"201","0.543338228","199.232.37.140","192.168.1.118","TLSv1.2","1418","Server Hello"
"202","0.543430944","192.168.1.118","199.232.37.140","TCP","66","41801 → 443 [ACK] Seq=518 Ack=1353 Win=32000 Len=0 TSval=18969082 TSecr=2788625538"
"203","0.548712504","192.168.1.118","172.217.12.142","TCP","66","47080 → 443 [ACK] Seq=1 Ack=1 Win=255 Len=0 TSval=18969088 TSecr=1345654658"
"204","0.551741810","199.232.37.140","192.168.1.118","TLSv1.2","1984","Certificate, Server Key Exchange, Server Hello Done"
"205","0.551830663","192.168.1.118","199.232.37.140","TCP","66","41801 → 443 [ACK] Seq=518 Ack=3271 Win=35840 Len=0 TSval=18969091 TSecr=2788625538"
"206","0.551875239","199.232.37.140","192.168.1.118","TCP","66","443 → 41802 [ACK] Seq=1 Ack=518 Win=28160 Len=0 TSval=2787365147 TSecr=18969070"
"207","0.551919403","199.232.37.140","192.168.1.118","TLSv1.2","3314","Server Hello, Certificate, Server Key Exchange, Server Hello Done"
"208","0.551942667","192.168.1.118","199.232.37.140","TCP","66","41802 → 443 [ACK] Seq=518 Ack=3249 Win=35712 Len=0 TSval=18969091 TSecr=2787365147"
"209","0.553979863","192.168.1.118","199.232.37.140","TLSv1","583","Client Hello"
"210","0.572783346","172.217.12.142","192.168.1.118","TCP","66","[TCP ACKed unseen segment] 443 → 47080 [ACK] Seq=1 Ack=2 Win=249 Len=0 TSval=1345699793 TSecr=18878944"
"211","0.574051016","199.232.37.140","192.168.1.118","TCP","66","443 → 41803 [ACK] Seq=1 Ack=518 Win=28160 Len=0 TSval=2790575357 TSecr=18969093"
"212","0.574118105","199.232.37.140","192.168.1.118","TLSv1.2","3336","Server Hello, Certificate, Server Key Exchange, Server Hello Done"
"213","0.574161807","192.168.1.118","199.232.37.140","TCP","66","41803 → 443 [ACK] Seq=518 Ack=3271 Win=35840 Len=0 TSval=18969113 TSecr=2790575358"
"214","0.576025085","192.168.1.118","199.232.37.140","TLSv1","583","Client Hello"
"215","0.584440879","192.168.1.118","199.232.37.140","TLSv1.2","293","Application Data"
"216","0.585401913","192.168.1.118","199.232.37.140","TLSv1.2","295","Application Data"
"217","0.585709224","192.168.1.118","199.232.37.140","TLSv1.2","370","Application Data"
"218","0.585933094","192.168.1.118","199.232.37.140","TLSv1.2","292","Application Data"
"219","0.586182590","192.168.1.118","199.232.37.140","TLSv1.2","367","Application Data"
"220","0.586400398","192.168.1.118","199.232.37.140","TLSv1.2","379","Application Data"
"221","0.586611143","192.168.1.118","199.232.37.140","TLSv1.2","295","Application Data"
"222","0.586846901","192.168.1.118","199.232.37.140","TLSv1.2","375","Application Data"
"223","0.587052196","192.168.1.118","199.232.37.140","TLSv1.2","341","Application Data"
"224","0.589071091","192.168.1.118","199.232.37.140","TLSv1.2","192","Client Key Exchange, Change Cipher Spec, Encrypted Handshake Message"
"225","0.591076574","192.168.1.118","199.232.37.140","TLSv1.2","192","Client Key Exchange, Change Cipher Spec, Encrypted Handshake Message"
"226","0.593472033","192.168.1.118","199.232.37.140","TLSv1.2","192","Client Key Exchange, Change Cipher Spec, Encrypted Handshake Message"
"227","0.595768763","192.168.1.118","199.232.37.140","TLSv1.2","192","Client Key Exchange, Change Cipher Spec, Encrypted Handshake Message"
"228","0.595913543","199.232.37.140","192.168.1.118","TCP","66","443 → 41804 [ACK] Seq=1 Ack=518 Win=28160 Len=0 TSval=251586498 TSecr=18969115"
"229","0.597686605","199.232.37.140","192.168.1.118","TLSv1.2","1418","Server Hello"
"230","0.597779621","192.168.1.118","199.232.37.140","TCP","66","41804 → 443 [ACK] Seq=518 Ack=1353 Win=32000 Len=0 TSval=18969137 TSecr=251586498"
"231","0.597874262","192.168.1.118","199.232.37.140","TLSv1.2","192","Client Key Exchange, Change Cipher Spec, Encrypted Handshake Message"
"232","0.600279683","199.232.37.140","192.168.1.118","TLSv1.2","1984","Certificate, Server Key Exchange, Server Hello Done"
"233","0.600364886","192.168.1.118","199.232.37.140","TCP","66","41804 → 443 [ACK] Seq=518 Ack=3271 Win=35840 Len=0 TSval=18969139 TSecr=251586498"
"234","0.609273611","192.168.1.118","199.232.37.140","TLSv1.2","192","Client Key Exchange, Change Cipher Spec, Encrypted Handshake Message"
"235","0.612708043","199.232.37.140","192.168.1.118","TLSv1.2","1418","Application Data"
"236","0.612808372","192.168.1.118","199.232.37.140","TCP","66","41793 → 443 [ACK] Seq=871 Ack=4652 Win=38400 Len=0 TSval=18969152 TSecr=1653177520"
"237","0.615136853","199.232.37.140","192.168.1.118","TLSv1.2","6826","Application Data, Application Data, Application Data, Application Data, Application Data"
"238","0.615225132","192.168.1.118","199.232.37.140","TCP","66","41793 → 443 [ACK] Seq=871 Ack=11412 Win=51968 Len=0 TSval=18969154 TSecr=1653177520"
"239","0.616983156","199.232.37.140","192.168.1.118","TLSv1.2","5474","Application Data, Application Data, Application Data, Application Data"
"240","0.617063546","192.168.1.118","199.232.37.140","TCP","66","41793 → 443 [ACK] Seq=871 Ack=16820 Win=62848 Len=0 TSval=18969156 TSecr=1653177520"
"241","0.624781366","199.232.37.140","192.168.1.118","TLSv1.2","1418","Application Data [TCP segment of a reassembled PDU]"
"242","0.624866681","192.168.1.118","199.232.37.140","TCP","66","41793 → 443 [ACK] Seq=871 Ack=18172 Win=65536 Len=0 TSval=18969164 TSecr=1653177530"
"243","0.627086597","199.232.37.140","192.168.1.118","TLSv1.2","372","Application Data"
"244","0.627176800","192.168.1.118","199.232.37.140","TCP","66","41793 → 443 [ACK] Seq=871 Ack=18478 Win=68224 Len=0 TSval=18969166 TSecr=1653177530"
"245","0.627244177","199.232.37.140","192.168.1.118","TLSv1.2","3240","Application Data, Application Data, Application Data"
"246","0.627273966","192.168.1.118","199.232.37.140","TCP","66","41794 → 443 [ACK] Seq=945 Ack=6592 Win=42368 Len=0 TSval=18969166 TSecr=2788404322"
"247","0.627298104","199.232.37.140","192.168.1.118","TLSv1.2","2770","Application Data, Application Data"
"248","0.627322905","192.168.1.118","199.232.37.140","TCP","66","41791 → 443 [ACK] Seq=948 Ack=6122 Win=41344 Len=0 TSval=18969166 TSecr=639270040"
"249","0.627382057","199.232.37.140","192.168.1.118","TLSv1.2","1176","Application Data, Application Data"
"250","0.627402958","192.168.1.118","199.232.37.140","TCP","66","41791 → 443 [ACK] Seq=948 Ack=7232 Win=44160 Len=0 TSval=18969166 TSecr=639270040"
"251","0.627419321","199.232.37.140","192.168.1.118","TLSv1.2","117","Change Cipher Spec, Encrypted Handshake Message"
"252","0.627442934","192.168.1.118","199.232.37.140","TCP","66","41800 → 443 [ACK] Seq=644 Ack=3322 Win=35840 Len=0 TSval=18969166 TSecr=3227920443"
"253","0.627458710","199.232.37.140","192.168.1.118","TLSv1.2","117","Change Cipher Spec, Encrypted Handshake Message"
"254","0.627479373","192.168.1.118","199.232.37.140","TCP","66","41801 → 443 [ACK] Seq=644 Ack=3322 Win=35840 Len=0 TSval=18969166 TSecr=2788625558"
"255","0.627495573","199.232.37.140","192.168.1.118","TLSv1.2","117","Change Cipher Spec, Encrypted Handshake Message"
"256","0.627516724","192.168.1.118","199.232.37.140","TCP","66","41802 → 443 [ACK] Seq=644 Ack=3300 Win=35712 Len=0 TSval=18969166 TSecr=2787365166"
"257","0.627547100","199.232.37.140","192.168.1.118","TLSv1.2","3787","Application Data, Application Data, Application Data, Application Data"
"258","0.627569176","192.168.1.118","199.232.37.140","TCP","66","41795 → 443 [ACK] Seq=957 Ack=7139 Win=43392 Len=0 TSval=18969166 TSecr=3889823077"
"259","0.627585189","199.232.37.140","192.168.1.118","TLSv1.2","117","Change Cipher Spec, Encrypted Handshake Message"
"260","0.627615165","199.232.37.140","192.168.1.118","TLSv1.2","2770","Application Data, Application Data"
"261","0.627637366","192.168.1.118","199.232.37.140","TCP","66","41798 → 443 [ACK] Seq=919 Ack=6122 Win=41344 Len=0 TSval=18969166 TSecr=4178761970"
"262","0.629548195","192.168.1.118","199.232.37.140","TLSv1.2","295","Application Data"
"263","0.632789209","192.168.1.118","199.232.37.140","TLSv1.2","295","Application Data"
"264","0.633092282","192.168.1.118","199.232.37.140","TLSv1.2","348","Application Data"
"265","0.633310827","192.168.1.118","199.232.37.140","TLSv1.2","295","Application Data"
"266","0.634267836","199.232.37.140","192.168.1.118","TLSv1.2","2770","Application Data, Application Data"
"267","0.634358539","192.168.1.118","199.232.37.140","TCP","66","41798 → 443 [ACK] Seq=919 Ack=8826 Win=46848 Len=0 TSval=18969173 TSecr=4178761970"
"268","0.634393452","199.232.37.140","192.168.1.118","TLSv1.2","4122","Application Data, Application Data, Application Data"
"269","0.634422441","192.168.1.118","199.232.37.140","TCP","66","41792 → 443 [ACK] Seq=870 Ack=7356 Win=43904 Len=0 TSval=18969173 TSecr=2790321361"
"270","0.634565733","199.232.37.140","192.168.1.118","TLSv1.2","117","Change Cipher Spec, Encrypted Handshake Message"
"271","0.634589947","192.168.1.118","199.232.37.140","TCP","66","41799 → 443 [ACK] Seq=644 Ack=3322 Win=35840 Len=0 TSval=18969173 TSecr=2788625558"
"272","0.634609410","199.232.37.140","192.168.1.118","TLSv1.2","6826","Application Data, Application Data, Application Data, Application Data, Application Data"
"273","0.634634373","192.168.1.118","199.232.37.140","TCP","66","41790 → 443 [ACK] Seq=873 Ack=10082 Win=49280 Len=0 TSval=18969173 TSecr=3118902953"
"274","0.634656799","199.232.37.140","192.168.1.118","TLSv1.2","104","Application Data"
"275","0.634673562","192.168.1.118","199.232.37.140","TCP","66","41790 → 443 [ACK] Seq=873 Ack=10120 Win=49280 Len=0 TSval=18969174 TSecr=3118902953"
"276","0.634686600","199.232.37.140","192.168.1.118","TLSv1.2","1808","Application Data, Application Data"
"277","0.634705676","192.168.1.118","199.232.37.140","TCP","66","41792 → 443 [ACK] Seq=870 Ack=9098 Win=47360 Len=0 TSval=18969174 TSecr=2790321361"
"278","0.634724339","199.232.37.140","192.168.1.118","TLSv1.2","3197","Application Data, Application Data, Application Data"
"279","0.634746227","192.168.1.118","199.232.37.140","TCP","66","41797 → 443 [ACK] Seq=953 Ack=6549 Win=42240 Len=0 TSval=18969174 TSecr=2790733845"
"280","0.634780353","199.232.37.140","192.168.1.118","TLSv1.2","8178","Application Data, Application Data, Application Data, Application Data, Application Data, Application Data"
"281","0.634801592","192.168.1.118","199.232.37.140","TCP","66","41798 → 443 [ACK] Seq=919 Ack=16938 Win=62976 Len=0 TSval=18969174 TSecr=4178761970"
"282","0.634810892","199.232.37.140","192.168.1.118","TLSv1.2","12234","Application Data, Application Data, Application Data, Application Data, Application Data, Application Data, Application Data, Application Data, Application Data"
"283","0.634834680","192.168.1.118","199.232.37.140","TCP","66","41796 → 443 [ACK] Seq=873 Ack=15490 Win=60160 Len=0 TSval=18969174 TSecr=3083312610"
"284","0.636526352","199.232.37.140","192.168.1.118","TLSv1.2","117","Change Cipher Spec, Encrypted Handshake Message"
"285","0.636594267","199.232.37.140","192.168.1.118","TLSv1.2","1418","Application Data [TCP segment of a reassembled PDU]"
"286","0.636630268","192.168.1.118","199.232.37.140","TCP","66","41796 → 443 [ACK] Seq=873 Ack=16842 Win=62848 Len=0 TSval=18969175 TSecr=3083312610"
"287","0.647403808","192.168.1.118","199.232.37.140","TLSv1.2","295","Application Data"
"288","0.648480120","192.168.1.118","199.232.37.140","TLSv1.2","295","Application Data"
"289","0.651815525","199.232.37.140","192.168.1.118","TLSv1.2","1418","Application Data [TCP segment of a reassembled PDU]"
"290","0.651899078","192.168.1.118","199.232.37.140","TCP","66","41798 → 443 [ACK] Seq=919 Ack=18290 Win=65792 Len=0 TSval=18969191 TSecr=4178761976"
"291","0.654311462","199.232.37.140","192.168.1.118","TLSv1.2","5474","Application Data, Application Data, Application Data, Application Data"
"292","0.654399378","192.168.1.118","199.232.37.140","TCP","66","41798 → 443 [ACK] Seq=919 Ack=23698 Win=76544 Len=0 TSval=18969193 TSecr=4178761976"
"293","0.654531832","199.232.37.140","192.168.1.118","TLSv1.2","10882","Application Data, Application Data, Application Data, Application Data, Application Data, Application Data, Application Data"
"294","0.654556083","192.168.1.118","199.232.37.140","TCP","66","41798 → 443 [ACK] Seq=919 Ack=34514 Win=98176 Len=0 TSval=18969193 TSecr=4178761976"
"295","0.654594997","199.232.37.140","192.168.1.118","TLSv1.2","5474","Application Data, Application Data, Application Data, Application Data"
"296","0.654614035","192.168.1.118","199.232.37.140","TCP","66","41798 → 443 [ACK] Seq=919 Ack=39922 Win=109056 Len=0 TSval=18969193 TSecr=4178761976"
"297","0.657706406","199.232.37.140","192.168.1.118","TLSv1.2","4122","Application Data, Application Data, Application Data"
"298","0.657790059","192.168.1.118","199.232.37.140","TCP","66","41798 → 443 [ACK] Seq=919 Ack=43978 Win=117120 Len=0 TSval=18969197 TSecr=4178761976"
"299","0.657829123","199.232.37.140","192.168.1.118","TLSv1.2","4122","Application Data, Application Data, Application Data"
"300","0.657862711","192.168.1.118","199.232.37.140","TCP","66","41802 → 443 [ACK] Seq=926 Ack=7356 Win=43904 Len=0 TSval=18969197 TSecr=2787365173"
"301","0.657943277","199.232.37.140","192.168.1.118","TLSv1.2","2770","Application Data, Application Data"
"302","0.657968703","192.168.1.118","199.232.37.140","TCP","66","41802 → 443 [ACK] Seq=926 Ack=10060 Win=49280 Len=0 TSval=18969197 TSecr=2787365173"
"303","0.657981165","199.232.37.140","192.168.1.118","TLSv1.2","133","Application Data"
"304","0.658042655","199.232.37.140","192.168.1.118","TLSv1.2","9530","Application Data, Application Data, Application Data, Application Data, Application Data, Application Data, Application Data"
"305","0.658070156","192.168.1.118","199.232.37.140","TCP","66","41800 → 443 [ACK] Seq=873 Ack=12786 Win=54784 Len=0 TSval=18969197 TSecr=3227920450"
"306","0.659900858","199.232.37.140","192.168.1.118","TLSv1.2","4122","Application Data, Application Data, Application Data"
"307","0.659983961","192.168.1.118","199.232.37.140","TCP","66","41800 → 443 [ACK] Seq=873 Ack=16842 Win=62848 Len=0 TSval=18969199 TSecr=3227920450"
"308","0.660020887","199.232.37.140","192.168.1.118","TLSv1.2","1418","Application Data"
"309","0.660147454","199.232.37.140","192.168.1.118","TLSv1.2","12234","Application Data, Application Data, Application Data, Application Data, Application Data, Application Data, Application Data, Application Data, Application Data"
"310","0.660174567","192.168.1.118","199.232.37.140","TCP","66","41801 → 443 [ACK] Seq=873 Ack=16842 Win=62848 Len=0 TSval=18969199 TSecr=2788625566"
"311","0.660187555","199.232.37.140","192.168.1.118","TLSv1.2","4122","Application Data, Application Data, Application Data"
"312","0.660213119","192.168.1.118","199.232.37.140","TCP","66","41803 → 443 [ACK] Seq=873 Ack=7378 Win=43904 Len=0 TSval=18969199 TSecr=2790575377"
"313","0.662578564","199.232.37.140","192.168.1.118","TLSv1.2","9530","Application Data, Application Data, Application Data, Application Data, Application Data, Application Data, Application Data"
"314","0.662686305","192.168.1.118","199.232.37.140","TCP","66","41803 → 443 [ACK] Seq=873 Ack=16842 Win=62848 Len=0 TSval=18969202 TSecr=2790575377"
"315","0.664817955","199.232.37.140","192.168.1.118","TLSv1.2","6992","Application Data, Application Data, Application Data, Application Data, Application Data, Application Data"
"316","0.664912021","192.168.1.118","199.232.37.140","TCP","66","41796 → 443 [ACK] Seq=873 Ack=23768 Win=76672 Len=0 TSval=18969204 TSecr=3083312646"
"317","0.677217126","199.232.37.140","192.168.1.118","TLSv1.2","1418","Application Data [TCP segment of a reassembled PDU]"
"318","0.677305404","192.168.1.118","199.232.37.140","TCP","66","41798 → 443 [ACK] Seq=919 Ack=45330 Win=119424 Len=0 TSval=18969216 TSecr=4178761983"
"319","0.678880097","199.232.37.140","192.168.1.118","TLSv1.2","6826","Application Data, Application Data, Application Data, Application Data, Application Data"
"320","0.678970025","192.168.1.118","199.232.37.140","TCP","66","41798 → 443 [ACK] Seq=919 Ack=52090 Win=112768 Len=0 TSval=18969218 TSecr=4178761983"
"321","0.679021389","199.232.37.140","192.168.1.118","TLSv1.2","1418","Application Data [TCP segment of a reassembled PDU]"
"322","0.679040377","192.168.1.118","199.232.37.140","TCP","66","41798 → 443 [ACK] Seq=919 Ack=53442 Win=111488 Len=0 TSval=18969218 TSecr=4178761983"
"323","0.682123023","199.232.37.140","192.168.1.118","TLSv1.2","4915","Application Data, Application Data, Application Data, Application Data"
"324","0.682211176","192.168.1.118","199.232.37.140","TCP","66","41798 → 443 [ACK] Seq=919 Ack=58291 Win=106752 Len=0 TSval=18969221 TSecr=4178761983"
"325","0.682293829","199.232.37.140","192.168.1.118","TLSv1.2","10047","Application Data, Application Data, Application Data, Application Data, Application Data, Application Data, Application Data, Application Data"
"326","0.682332118","192.168.1.118","199.232.37.140","TCP","66","41804 → 443 [ACK] Seq=873 Ack=13303 Win=55808 Len=0 TSval=18969221 TSecr=251586518"
"327","0.682497248","199.232.37.140","192.168.1.118","TLSv1.2","2770","Application Data, Application Data"
"328","0.682527325","192.168.1.118","199.232.37.140","TCP","66","41799 → 443 [ACK] Seq=873 Ack=6026 Win=41216 Len=0 TSval=18969221 TSecr=2788625572"
"329","0.684799479","199.232.37.140","192.168.1.118","TLSv1.2","10882","Application Data, Application Data, Application Data, Application Data, Application Data, Application Data, Application Data, Application Data"
"330","0.684891395","192.168.1.118","199.232.37.140","TCP","66","41799 → 443 [ACK] Seq=873 Ack=16842 Win=62848 Len=0 TSval=18969224 TSecr=2788625572"
"331","0.691162627","199.232.37.140","192.168.1.118","TLSv1.2","1418","Application Data [TCP segment of a reassembled PDU]"
"332","0.694663299","199.232.37.140","192.168.1.118","TLSv1.2","4122","Application Data, Application Data, Application Data"
"333","0.694751677","192.168.1.118","199.232.37.140","TCP","66","41803 → 443 [ACK] Seq=873 Ack=22250 Win=73600 Len=0 TSval=18969234 TSecr=2790575387"
"334","0.694803517","199.232.37.140","192.168.1.118","TLSv1.2","2770","Application Data, Application Data"
"335","0.694822742","192.168.1.118","199.232.37.140","TCP","66","41803 → 443 [ACK] Seq=873 Ack=24954 Win=79104 Len=0 TSval=18969234 TSecr=2790575387"
"336","0.697466947","199.232.37.140","192.168.1.118","TLSv1.2","1697","Application Data, Application Data"
"337","0.697541700","192.168.1.118","199.232.37.140","TCP","66","41800 → 443 [ACK] Seq=873 Ack=18473 Win=66048 Len=0 TSval=18969236 TSecr=3227920460"
"338","0.697591489","199.232.37.140","192.168.1.118","TLSv1.2","4122","Application Data, Application Data"
"339","0.697618815","192.168.1.118","199.232.37.140","TCP","66","41803 → 443 [ACK] Seq=873 Ack=29010 Win=87168 Len=0 TSval=18969236 TSecr=2790575387"
"340","0.697667292","192.168.1.118","199.232.37.140","TCP","66","41802 → 443 [ACK] Seq=926 Ack=10127 Win=49280 Len=0 TSval=18969237 TSecr=2787365173"
"341","0.697721956","199.232.37.140","192.168.1.118","TLSv1.2","2770","Application Data, Application Data"
"342","0.697743982","192.168.1.118","199.232.37.140","TCP","66","41803 → 443 [ACK] Seq=873 Ack=31714 Win=92544 Len=0 TSval=18969237 TSecr=2790575387"
"343","0.697790084","199.232.37.140","192.168.1.118","TLSv1.2","6826","Application Data, Application Data, Application Data, Application Data, Application Data"
"344","0.697812772","192.168.1.118","199.232.37.140","TCP","66","41801 → 443 [ACK] Seq=873 Ack=23602 Win=76416 Len=0 TSval=18969237 TSecr=2788625575"
"345","0.697823510","199.232.37.140","192.168.1.118","TLSv1.2","5474","Application Data, Application Data, Application Data, Application Data"
"346","0.697842498","192.168.1.118","199.232.37.140","TCP","66","41803 → 443 [ACK] Seq=873 Ack=37122 Win=103424 Len=0 TSval=18969237 TSecr=2790575387"
"347","0.701003909","199.232.37.140","192.168.1.118","TLSv1.2","4122","Application Data, Application Data, Application Data"
"348","0.701091949","192.168.1.118","199.232.37.140","TCP","66","41801 → 443 [ACK] Seq=873 Ack=27658 Win=84480 Len=0 TSval=18969240 TSecr=2788625575"
"349","0.701127138","199.232.37.140","192.168.1.118","TLSv1.2","1418","Application Data [TCP segment of a reassembled PDU]"
"350","0.701200903","199.232.37.140","192.168.1.118","TCP","1418","443 → 41801 [PSH, ACK] Seq=27658 Ack=873 Win=29184 Len=1352 TSval=2788625575 TSecr=18969199 [TCP segment of a reassembled PDU]"
"351","0.701262605","199.232.37.140","192.168.1.118","TLSv1.2","5474","Application Data, Application Data, Application Data, Application Data"
"352","0.701283343","192.168.1.118","199.232.37.140","TCP","66","41803 → 443 [ACK] Seq=873 Ack=43882 Win=116864 Len=0 TSval=18969240 TSecr=2790575387"
"353","0.701294131","199.232.37.140","192.168.1.118","TLSv1.2","5474","Application Data, Application Data, Application Data, Application Data"
"354","0.701316595","192.168.1.118","199.232.37.140","TCP","66","41801 → 443 [ACK] Seq=873 Ack=34418 Win=98048 Len=0 TSval=18969240 TSecr=2788625575"
"355","0.701325807","199.232.37.140","192.168.1.118","TLSv1.2","4122","Application Data, Application Data, Application Data"
"356","0.701344433","192.168.1.118","199.232.37.140","TCP","66","41799 → 443 [ACK] Seq=873 Ack=20898 Win=70912 Len=0 TSval=18969240 TSecr=2788625577"
"357","0.703641151","199.232.37.140","192.168.1.118","TLSv1.2","1418","Application Data [TCP segment of a reassembled PDU]"
"358","0.703714429","199.232.37.140","192.168.1.118","TLSv1.2","2770","Application Data, Application Data"
"359","0.703749255","192.168.1.118","199.232.37.140","TCP","66","41801 → 443 [ACK] Seq=873 Ack=37122 Win=103424 Len=0 TSval=18969243 TSecr=2788625575"
"360","0.705889092","199.232.37.140","192.168.1.118","TLSv1.2","1418","Application Data [TCP segment of a reassembled PDU]"
"361","0.705964845","192.168.1.118","199.232.37.140","TCP","66","41799 → 443 [ACK] Seq=873 Ack=23602 Win=76416 Len=0 TSval=18969245 TSecr=2788625577"
"362","0.708153271","199.232.37.140","192.168.1.118","TLSv1.2","8178","Application Data, Application Data, Application Data, Application Data, Application Data"
"363","0.708237724","192.168.1.118","199.232.37.140","TCP","66","41799 → 443 [ACK] Seq=873 Ack=31714 Win=92544 Len=0 TSval=18969247 TSecr=2788625579"
"364","0.708292176","199.232.37.140","192.168.1.118","TLSv1.2","2770","Application Data, Application Data"
"365","0.708312689","192.168.1.118","199.232.37.140","TCP","66","41801 → 443 [ACK] Seq=873 Ack=39826 Win=108800 Len=0 TSval=18969247 TSecr=2788625577"
"366","0.711378809","199.232.37.140","192.168.1.118","TLSv1.2","2770","Application Data, Application Data"
"367","0.711456250","192.168.1.118","199.232.37.140","TCP","66","41799 → 443 [ACK] Seq=873 Ack=34418 Win=98048 Len=0 TSval=18969250 TSecr=2788625579"
"368","0.714433666","199.232.37.140","192.168.1.118","TLSv1.2","2770","Application Data, Application Data"
"369","0.714527720","192.168.1.118","199.232.37.140","TCP","66","41801 → 443 [ACK] Seq=873 Ack=42530 Win=114176 Len=0 TSval=18969253 TSecr=2788625578"
"370","0.714575709","199.232.37.140","192.168.1.118","TLSv1.2","1418","Application Data [TCP segment of a reassembled PDU]"
"371","0.714590434","199.232.37.140","192.168.1.118","TLSv1.2","1418","Application Data [TCP segment of a reassembled PDU]"
"372","0.715296734","199.232.37.140","192.168.1.118","TLSv1.2","1418","Application Data [TCP segment of a reassembled PDU]"
"373","0.715327985","192.168.1.118","199.232.37.140","TCP","66","41803 → 443 [ACK] Seq=873 Ack=46586 Win=117376 Len=0 TSval=18969254 TSecr=2790575392"
"374","0.715344561","199.232.37.140","192.168.1.118","TLSv1.2","1418","Application Data [TCP segment of a reassembled PDU]"
"375","0.716052198","199.232.37.140","192.168.1.118","TLSv1.2","1418","Application Data [TCP segment of a reassembled PDU]"
"376","0.716087124","192.168.1.118","199.232.37.140","TCP","66","41799 → 443 [ACK] Seq=873 Ack=37122 Win=103424 Len=0 TSval=18969255 TSecr=2788625579"
"377","0.716124888","199.232.37.140","192.168.1.118","TLSv1.2","2770","Application Data, Application Data"
"378","0.716149551","192.168.1.118","199.232.37.140","TCP","66","41799 → 443 [ACK] Seq=873 Ack=39826 Win=108800 Len=0 TSval=18969255 TSecr=2788625580"
"379","0.719048390","199.232.37.140","192.168.1.118","TLSv1.2","2770","Application Data, Application Data"
"380","0.720013674","199.232.37.140","192.168.1.118","TLSv1.2","736","Application Data, Application Data"
"381","0.720059401","199.232.37.140","192.168.1.118","TLSv1.2","2770","Application Data, Application Data"
"382","0.721235742","199.232.37.140","192.168.1.118","TLSv1.2","1418","Application Data [TCP segment of a reassembled PDU]"
"383","0.721322607","192.168.1.118","199.232.37.140","TCP","66","41801 → 443 [ACK] Seq=873 Ack=45234 Win=119424 Len=0 TSval=18969260 TSecr=2788625579"
"384","0.722670992","199.232.37.140","192.168.1.118","TLSv1.2","1418","Application Data [TCP segment of a reassembled PDU]"
"385","0.724407903","199.232.37.140","192.168.1.118","TLSv1.2","2770","Application Data, Application Data"
"386","0.724464442","199.232.37.140","192.168.1.118","TLSv1.2","2770","Application Data, Application Data"
"387","0.725834665","199.232.37.140","192.168.1.118","TLSv1.2","2770","Application Data, Application Data"
"388","0.725892380","199.232.37.140","192.168.1.118","TLSv1.2","1418","Application Data [TCP segment of a reassembled PDU]"
"389","0.726791799","199.232.37.140","192.168.1.118","TLSv1.2","1418","Application Data [TCP segment of a reassembled PDU]"
"390","0.726820475","199.232.37.140","192.168.1.118","TLSv1.2","2770","Application Data, Application Data"
"391","0.728474058","199.232.37.140","192.168.1.118","TLSv1.2","2770","Application Data, Application Data"
"392","0.728550473","199.232.37.140","192.168.1.118","TLSv1.2","2770","Application Data, Application Data"
"393","0.728762105","192.168.1.118","199.232.37.140","TCP","66","41801 → 443 [ACK] Seq=873 Ack=54698 Win=110080 Len=0 TSval=18969268 TSecr=2788625583"
"394","0.728872734","192.168.1.118","199.232.37.140","TCP","66","41803 → 443 [ACK] Seq=873 Ack=62810 Win=101248 Len=0 TSval=18969268 TSecr=2790575392"
"395","0.729163707","199.232.37.140","192.168.1.118","TLSv1.2","1418","Application Data [TCP segment of a reassembled PDU]"
"396","0.730686985","199.232.37.140","192.168.1.118","TLSv1.2","1418","Application Data [TCP segment of a reassembled PDU]"
"397","0.730768063","192.168.1.118","199.232.37.140","TCP","66","41803 → 443 [ACK] Seq=873 Ack=65514 Win=121472 Len=0 TSval=18969270 TSecr=2790575396"
"398","0.730808964","199.232.37.140","192.168.1.118","TLSv1.2","2770","Application Data, Application Data"
"399","0.730833115","192.168.1.118","199.232.37.140","TCP","66","41801 → 443 [ACK] Seq=873 Ack=57402 Win=125056 Len=0 TSval=18969270 TSecr=2788625584"
"400","0.733099494","199.232.37.140","192.168.1.118","TLSv1.2","2770","Application Data [TCP segment of a reassembled PDU]"
"401","0.733157422","199.232.37.140","192.168.1.118","TLSv1.2","2770","Application Data, Application Data"
"402","0.733195598","192.168.1.118","199.232.37.140","TCP","66","41801 → 443 [ACK] Seq=873 Ack=60106 Win=127616 Len=0 TSval=18969272 TSecr=2788625584"
"403","0.735170292","199.232.37.140","192.168.1.118","TLSv1.2","2770","Application Data, Application Data"
"404","0.735241694","199.232.37.140","192.168.1.118","TLSv1.2","2770","Application Data, Application Data"
"405","0.735257620","199.232.37.140","192.168.1.118","TLSv1.2","2770","Application Data, Application Data"
"406","0.736667707","199.232.37.140","192.168.1.118","TLSv1.2","5474","Application Data, Application Data, Application Data, Application Data"
"407","0.736729947","199.232.37.140","192.168.1.118","TLSv1.2","2770","Application Data [TCP segment of a reassembled PDU]"
"408","0.736742547","199.232.37.140","192.168.1.118","TLSv1.2","1418","Application Data [TCP segment of a reassembled PDU]"
"409","0.737901338","199.232.37.140","192.168.1.118","TLSv1.2","2770","Application Data, Application Data"
"410","0.737961177","199.232.37.140","192.168.1.118","TLSv1.2","2770","Application Data, Application Data"
"411","0.739132181","199.232.37.140","192.168.1.118","TLSv1.2","2770","Application Data, Application Data"
"412","0.739175645","199.232.37.140","192.168.1.118","TLSv1.2","1418","Application Data [TCP segment of a reassembled PDU]"
"413","0.740323922","199.232.37.140","192.168.1.118","TLSv1.2","2770","Application Data, Application Data"
"414","0.740376112","199.232.37.140","192.168.1.118","TLSv1.2","2770","Application Data, Application Data"
"415","0.743606112","199.232.37.140","192.168.1.118","TLSv1.2","1418","Application Data [TCP segment of a reassembled PDU]"
"416","0.743671152","199.232.37.140","192.168.1.118","TLSv1.2","1418","Application Data [TCP segment of a reassembled PDU]"
"417","0.744468392","192.168.1.118","199.232.37.140","TCP","66","41801 → 443 [ACK] Seq=873 Ack=77682 Win=110080 Len=0 TSval=18969283 TSecr=2788625585"
"418","0.744569371","192.168.1.118","199.232.37.140","TCP","66","41803 → 443 [ACK] Seq=873 Ack=85794 Win=101248 Len=0 TSval=18969283 TSecr=2790575396"
"419","0.745178555","199.232.37.140","192.168.1.118","TLSv1.2","5474","Application Data, Application Data, Application Data, Application Data"
"420","0.745238357","199.232.37.140","192.168.1.118","TLSv1.2","5474","Application Data, Application Data, Application Data, Application Data"
"421","0.745534767","192.168.1.118","199.232.37.140","TCP","66","41801 → 443 [ACK] Seq=873 Ack=83090 Win=104704 Len=0 TSval=18969284 TSecr=2788625587"
"422","0.749709901","192.168.1.118","199.232.37.140","TCP","66","41803 → 443 [ACK] Seq=873 Ack=91202 Win=95872 Len=0 TSval=18969288 TSecr=2790575399"
"423","0.749921758","199.232.37.140","192.168.1.118","TLSv1.2","5474","Application Data, Application Data, Application Data, Application Data"
"424","0.750060751","199.232.37.140","192.168.1.118","TLSv1.2","2770","Application Data, Application Data"
"425","0.750079689","199.232.37.140","192.168.1.118","TLSv1.2","1418","Application Data [TCP segment of a reassembled PDU]"
"426","0.750158129","192.168.1.118","199.232.37.140","TCP","66","41801 → 443 [ACK] Seq=873 Ack=89850 Win=98048 Len=0 TSval=18969289 TSecr=2788625588"
"427","0.750223106","192.168.1.118","199.232.37.140","TCP","66","41803 → 443 [ACK] Seq=873 Ack=93906 Win=93184 Len=0 TSval=18969289 TSecr=2790575400"
"428","0.754380189","199.232.37.140","192.168.1.118","TLSv1.2","2770","Application Data, Application Data"
"429","0.754446967","199.232.37.140","192.168.1.118","TLSv1.2","2770","Application Data, Application Data"
"430","0.755015937","199.232.37.140","192.168.1.118","TLSv1.2","2770","Application Data, Application Data"
"431","0.755077564","199.232.37.140","192.168.1.118","TLSv1.2","6826","Application Data, Application Data, Application Data, Application Data, Application Data"
"432","0.755090239","199.232.37.140","192.168.1.118","TLSv1.2","2770","Application Data, Application Data"
"433","0.756605505","199.232.37.140","192.168.1.118","TLSv1.2","4122","Application Data, Application Data, Application Data"
"434","0.756675082","199.232.37.140","192.168.1.118","TLSv1.2","1418","Application Data [TCP segment of a reassembled PDU]"
"435","0.756803887","199.232.37.140","192.168.1.118","TLSv1.2","8178","Application Data, Application Data, Application Data, Application Data, Application Data"
"436","0.756821612","199.232.37.140","192.168.1.118","TLSv1.2","5474","Application Data, Application Data, Application Data, Application Data"
"437","0.758716804","199.232.37.140","192.168.1.118","TLSv1.2","1418","Application Data [TCP segment of a reassembled PDU]"
"438","0.758773143","199.232.37.140","192.168.1.118","TLSv1.2","4122","Application Data, Application Data"
"439","0.758903235","199.232.37.140","192.168.1.118","TLSv1.2","1430","Application Data, Application Data"
"440","0.758954024","199.232.37.140","192.168.1.118","TLSv1.2","4122","Application Data, Application Data, Application Data"
"441","0.759300724","192.168.1.118","199.232.37.140","TCP","66","41801 → 443 [ACK] Seq=873 Ack=111494 Win=76416 Len=0 TSval=18969298 TSecr=2788625589"
"442","0.759406753","192.168.1.118","199.232.37.140","TCP","66","41803 → 443 [ACK] Seq=873 Ack=119594 Win=67584 Len=0 TSval=18969298 TSecr=2790575400"
"443","0.759700650","192.168.1.118","199.232.37.140","TCP","66","41799 → 443 [ACK] Seq=873 Ack=40496 Win=111488 Len=0 TSval=18969299 TSecr=2788625581"
"444","0.762666229","199.232.37.140","192.168.1.118","TLSv1.2","3389","Application Data, Application Data, Application Data, Application Data"
"445","0.763244512","192.168.1.118","199.232.37.140","TCP","66","41803 → 443 [ACK] Seq=873 Ack=122917 Win=64384 Len=0 TSval=18969302 TSecr=2790575403"
"446","0.855004211","192.168.1.104","255.255.255.255","UDP","217","49154 → 6666 Len=175"
"447","1.121088399","192.168.1.118","199.232.37.140","TLSv1.2","249","Application Data"
"448","1.144358425","199.232.37.140","192.168.1.118","TLSv1.2","1150","Application Data, Application Data"
"449","1.144462504","192.168.1.118","199.232.37.140","TCP","66","41786 → 443 [ACK] Seq=374 Ack=10653 Win=448 Len=0 TSval=18969683 TSecr=3889823206"
"450","1.863360777","192.168.1.118","192.168.1.102","TCP","176","35355 → 8009 [PSH, ACK] Seq=1 Ack=1 Win=364 Len=110 TSval=18970402 TSecr=4469584 [TCP segment of a reassembled PDU]"
"451","1.890920329","192.168.1.102","192.168.1.118","TCP","176","8009 → 35355 [PSH, ACK] Seq=1 Ack=111 Win=287 Len=110 TSval=4470090 TSecr=18970402 [TCP segment of a reassembled PDU]"
"452","1.891020658","192.168.1.118","192.168.1.102","TCP","66","35355 → 8009 [ACK] Seq=111 Ack=111 Win=364 Len=0 TSval=18970430 TSecr=4470090"
"453","1.913579597","192.168.1.100","224.0.0.251","MDNS","563","Standard query 0x0000 PTR _uscan._tcp.local, "QM" question PTR _ippusb._tcp.local, "QM" question PTR _uscans._tcp.local, "QM" question PTR _scanner._tcp.local, "QM" question PTR _ipp._tcp.local, "QM" question PTR _ipps._tcp.local, "QM" question PTR _printer._tcp.local, "QM" question PTR _pdl-datastream._tcp.local, "QM" question PTR _ptp._tcp.local, "QM" question PTR _airplay._tcp.local, "QM" question PTR _raop._tcp.local, "QM" question PTR _airport._tcp.local, "QM" question PTR _rdlink._tcp.local, "QM" question PTR _companion-link._tcp.local, "QM" question PTR _googlecast._tcp.local, "QM" question PTR _apple-mobdev._tcp.local, "QM" question PTR 8ed307c3._sub._apple-mobdev2._tcp.local, "QM" question PTR _apple-pairable._tcp.local, "QM" question TXT Google-Home-Mini-2c3f16b2da5c4b6fd6cfbfba61c12490._googlecast._tcp.local, "QM" question PTR _homekit._tcp.local, "QM" question PTR _afpovertcp._tcp.local, "QM" question PTR _smb._tcp.local, "QM" question PTR _rfb._tcp.local, "QM" question PTR _adisk._tcp.local, "QM" question PTR cjqg._companion-link._tcp.local PTR Google-Home-Mini-2c3f16b2da5c4b6fd6cfbfba61c12490._googlecast._tcp.local PTR cjqg._smb._tcp.local OPT"
"454","2.007119708","192.168.1.102","224.0.0.251","MDNS","183","Standard query response 0x0000 SRV, cache flush 0 0 8009 2c3f16b2-da5c-4b6f-d6cf-bfba61c12490.local"
"455","2.927811306","192.168.1.103","224.0.0.251","MDNS","112","Standard query 0x0000 PTR _sleep-proxy._udp.local, "QM" question OPT"
"456","3.952944747","192.168.1.104","255.255.255.255","UDP","217","49154 → 6666 Len=175"
"457","5.909949452","192.168.1.118","209.18.47.62","DNS","79","Standard query 0x5455 A play.googleapis.com"
"458","5.924020007","209.18.47.62","192.168.1.118","DNS","95","Standard query response 0x5455 A play.googleapis.com A 172.217.11.10"
"459","5.924213114","192.168.1.118","209.18.47.62","DNS","79","Standard query 0x3867 AAAA play.googleapis.com"
"460","5.936024052","209.18.47.62","192.168.1.118","DNS","107","Standard query response 0x3867 AAAA play.googleapis.com AAAA 2607:f8b0:4006:804::200a"
"461","5.936596797","192.168.1.118","172.217.11.10","TCP","74","42332 → 443 [SYN] Seq=0 Win=29200 Len=0 MSS=1460 SACK_PERM=1 TSval=18974475 TSecr=0 WS=128"
"462","5.962052988","172.217.11.10","192.168.1.118","TCP","74","443 → 42332 [SYN, ACK] Seq=0 Ack=1 Win=60192 Len=0 MSS=1380 SACK_PERM=1 TSval=2794677667 TSecr=18974475 WS=256"
"463","5.962180693","192.168.1.118","172.217.11.10","TCP","66","42332 → 443 [ACK] Seq=1 Ack=1 Win=29312 Len=0 TSval=18974501 TSecr=2794677667"
"464","6.002351649","192.168.1.118","172.217.11.10","TLSv1","583","Client Hello"
"465","6.046031202","172.217.11.10","192.168.1.118","TCP","66","443 → 42332 [ACK] Seq=1 Ack=518 Win=61440 Len=0 TSval=2794677747 TSecr=18974541"
"466","6.047144016","172.217.11.10","192.168.1.118","TLSv1.2","1484","Server Hello"
"467","6.047230269","192.168.1.118","172.217.11.10","TCP","66","42332 → 443 [ACK] Seq=518 Ack=1419 Win=32128 Len=0 TSval=18974586 TSecr=2794677753"
"468","6.050561098","172.217.11.10","192.168.1.118","TLSv1.2","1540","Certificate, Server Key Exchange, Server Hello Done"
"469","6.050658602","192.168.1.118","172.217.11.10","TCP","66","42332 → 443 [ACK] Seq=518 Ack=2893 Win=35072 Len=0 TSval=18974589 TSecr=2794677753"
"470","6.054072921","192.168.1.118","172.217.11.10","TLSv1.2","192","Client Key Exchange, Change Cipher Spec, Encrypted Handshake Message"
"471","6.108290931","172.217.11.10","192.168.1.118","TLSv1.2","117","Change Cipher Spec, Encrypted Handshake Message"
"472","6.108843288","192.168.1.118","172.217.11.10","TLSv1.2","646","Application Data"
"473","6.109783159","192.168.1.118","172.217.11.10","TLSv1.2","1136","Application Data"
"474","6.134457710","172.217.11.10","192.168.1.118","TCP","66","443 → 42332 [ACK] Seq=2944 Ack=2294 Win=64768 Len=0 TSval=2794677833 TSecr=18974648"
"475","6.146870619","172.217.11.10","192.168.1.118","TLSv1.2","841","Application Data"
"476","6.147517067","172.217.11.10","192.168.1.118","TLSv1.2","100","Application Data"
"477","6.147614733","192.168.1.118","172.217.11.10","TCP","66","42332 → 443 [ACK] Seq=2294 Ack=3753 Win=37888 Len=0 TSval=18974686 TSecr=2794677852"
"478","6.893308168","192.168.1.118","192.168.1.102","TCP","176","35355 → 8009 [PSH, ACK] Seq=111 Ack=111 Win=364 Len=110 TSval=18975432 TSecr=4470090 [TCP segment of a reassembled PDU]"
"479","6.898537576","192.168.1.102","192.168.1.118","TCP","176","8009 → 35355 [PSH, ACK] Seq=111 Ack=221 Win=287 Len=110 TSval=4470591 TSecr=18975432 [TCP segment of a reassembled PDU]"
"480","6.898663606","192.168.1.118","192.168.1.102","TCP","66","35355 → 8009 [ACK] Seq=221 Ack=221 Win=364 Len=0 TSval=18975437 TSecr=4470591"
"481","6.923895201","192.168.1.104","255.255.255.255","UDP","217","49154 → 6666 Len=175"
"482","8.769174971","192.168.1.100","224.0.0.251","MDNS","620","Standard query 0x0000 PTR _uscan._tcp.local, "QU" question PTR _ippusb._tcp.local, "QU" question PTR _uscans._tcp.local, "QU" question PTR _scanner._tcp.local, "QU" question PTR _ipp._tcp.local, "QU" question PTR _ipps._tcp.local, "QU" question PTR _printer._tcp.local, "QU" question PTR _pdl-datastream._tcp.local, "QU" question PTR _ptp._tcp.local, "QU" question PTR _airplay._tcp.local, "QU" question PTR _raop._tcp.local, "QU" question PTR _airport._tcp.local, "QU" question PTR _rdlink._tcp.local, "QU" question PTR _companion-link._tcp.local, "QU" question PTR _googlecast._tcp.local, "QU" question PTR _apple-mobdev._tcp.local, "QU" question PTR 8ed307c3._sub._apple-mobdev2._tcp.local, "QU" question PTR _apple-pairable._tcp.local, "QU" question TXT Google-Home-Mini-2c3f16b2da5c4b6fd6cfbfba61c12490._googlecast._tcp.local, "QU" question PTR _homekit._tcp.local, "QU" question PTR _afpovertcp._tcp.local, "QU" question PTR _smb._tcp.local, "QU" question PTR _rfb._tcp.local, "QU" question PTR _adisk._tcp.local, "QU" question ANY cjqg._smb._tcp.local, "QU" question ANY cjqg._companion-link._tcp.local, "QU" question PTR cjqg._companion-link._tcp.local PTR Google-Home-Mini-2c3f16b2da5c4b6fd6cfbfba61c12490._googlecast._tcp.local PTR cjqg._smb._tcp.local SRV 0 0 445 cjqg.local SRV 0 0 53222 cjqg.local OPT"
"483","8.979066404","192.168.1.100","224.0.0.251","MDNS","175","Standard query 0x0000 ANY cjqg._smb._tcp.local, "QM" question ANY cjqg._companion-link._tcp.local, "QM" question SRV 0 0 445 cjqg.local SRV 0 0 53222 cjqg.local OPT"
"484","9.178949888","192.168.1.100","224.0.0.251","MDNS","175","Standard query 0x0000 ANY cjqg._smb._tcp.local, "QM" question ANY cjqg._companion-link._tcp.local, "QM" question SRV 0 0 445 cjqg.local SRV 0 0 53222 cjqg.local OPT"
"485","9.490820915","192.168.1.100","224.0.0.251","MDNS","560","Standard query response 0x0000 TXT, cache flush PTR cjqg._smb._tcp.local TXT SRV, cache flush 0 0 445 cjqg.local TXT, cache flush PTR _companion-link._tcp.local PTR cjqg._companion-link._tcp.local SRV, cache flush 0 0 53222 cjqg.local AAAA, cache flush fe80::c65:98ef:d456:4a34 A, cache flush 192.168.1.100 NSEC, cache flush cjqg._smb._tcp.local NSEC, cache flush cjqg._companion-link._tcp.local NSEC, cache flush cjqg.local OPT"
"486","9.553054818","IntelCor_b7:52:73","Broadcast","ARP","60","Who has 192.168.1.1? Tell 192.168.1.118"
"487","9.562247040","Cisco-Li_5b:1c:ce","IntelCor_b7:52:73","ARP","42","192.168.1.1 is at 58:6d:8f:5b:1c:ce"
"488","9.690370249","192.168.1.100","224.0.0.251","MDNS","207","Standard query response 0x0000 PTR _smb._tcp.local TXT OPT"
"489","9.891971155","192.168.1.102","224.0.0.251","MDNS","183","Standard query response 0x0000 SRV, cache flush 0 0 8009 2c3f16b2-da5c-4b6f-d6cf-bfba61c12490.local"
