frame.number,_ws.col.Time,_ws.col.Source,_ws.col.Destination,_ws.col.Protocol,frame.len,_ws.col.Info
"1","0.000000000","199.232.37.140","192.168.1.118","TLSv1.2","169","Application Data, Application Data, Application Data"
"2","0.000076177","192.168.1.118","199.232.37.140","TCP","66","39234 → 443 [ACK] Seq=1 Ack=104 Win=776 Len=0 TSval=14636187 TSecr=1089452540"
"3","0.066223480","192.168.1.118","209.18.47.62","DNS","80","Standard query 0xdcda A www.redditstatic.com"
"4","0.085562319","199.232.37.140","192.168.1.118","TLSv1.2","205","Application Data, Application Data, Application Data"
"5","0.085642960","192.168.1.118","199.232.37.140","TCP","66","39234 → 443 [ACK] Seq=1 Ack=243 Win=776 Len=0 TSval=14636273 TSecr=1089452562"
"6","0.086961793","209.18.47.62","192.168.1.118","DNS","131","Standard query response 0xdcda A www.redditstatic.com CNAME reddit.map.fastly.net A 199.232.37.140"
"7","0.087281004","192.168.1.118","209.18.47.62","DNS","80","Standard query 0x44c1 AAAA www.redditstatic.com"
"8","0.100102291","199.232.37.140","192.168.1.118","TLSv1.2","183","Application Data, Application Data, Application Data"
"9","0.100182781","192.168.1.118","199.232.37.140","TCP","66","39234 → 443 [ACK] Seq=1 Ack=360 Win=776 Len=0 TSval=14636287 TSecr=1089452565"
"10","0.111645532","209.18.47.62","192.168.1.118","DNS","173","Standard query response 0x44c1 AAAA www.redditstatic.com CNAME reddit.map.fastly.net SOA ns1.fastly.net"
"11","0.121778412","192.168.1.118","199.232.37.140","TCP","74","39245 → 443 [SYN] Seq=0 Win=29200 Len=0 MSS=1460 SACK_PERM=1 TSval=14636309 TSecr=0 WS=128"
"12","0.135667198","199.232.37.140","192.168.1.118","TLSv1.2","1418","Application Data"
"13","0.135751238","192.168.1.118","199.232.37.140","TCP","66","39234 → 443 [ACK] Seq=1 Ack=1712 Win=797 Len=0 TSval=14636323 TSecr=1089452574"
"14","0.147164600","199.232.37.140","192.168.1.118","TLSv1.2","2759","Application Data, Application Data, Application Data, Application Data"
"15","0.147247453","192.168.1.118","199.232.37.140","TCP","66","39234 → 443 [ACK] Seq=1 Ack=4405 Win=839 Len=0 TSval=14636334 TSecr=1089452574"
"16","0.150535181","199.232.37.140","192.168.1.118","TLSv1.2","5474","Application Data, Application Data, Application Data, Application Data"
"17","0.150631747","192.168.1.118","199.232.37.140","TCP","66","39234 → 443 [ACK] Seq=1 Ack=9813 Win=924 Len=0 TSval=14636338 TSecr=1089452574"
"18","0.152198351","199.232.37.140","192.168.1.118","TLSv1.2","4122","Application Data, Application Data, Application Data"
"19","0.152277404","192.168.1.118","199.232.37.140","TCP","66","39234 → 443 [ACK] Seq=1 Ack=13869 Win=987 Len=0 TSval=14636339 TSecr=1089452574"
"20","0.152389408","199.232.37.140","192.168.1.118","TLSv1.2","4549","Application Data, Application Data, Application Data, Application Data, Application Data"
"21","0.152412009","192.168.1.118","199.232.37.140","TCP","66","39234 → 443 [ACK] Seq=1 Ack=18352 Win=1057 Len=0 TSval=14636339 TSecr=1089452574"
"22","0.152441497","199.232.37.140","192.168.1.118","TLSv1.2","3011","Application Data, Application Data, Application Data, Application Data, Application Data"
"23","0.152461536","192.168.1.118","199.232.37.140","TCP","66","39234 → 443 [ACK] Seq=1 Ack=21297 Win=1103 Len=0 TSval=14636339 TSecr=1089452577"
"24","0.152480586","199.232.37.140","192.168.1.118","TCP","74","443 → 39245 [SYN, ACK] Seq=0 Ack=1 Win=27040 Len=0 MSS=1364 SACK_PERM=1 TSval=2786597016 TSecr=14636309 WS=512"
"25","0.152533263","192.168.1.118","199.232.37.140","TCP","66","39245 → 443 [ACK] Seq=1 Ack=1 Win=29312 Len=0 TSval=14636339 TSecr=2786597016"
"26","0.175295197","192.168.1.118","199.232.37.140","TLSv1","583","Client Hello"
"27","0.198345554","199.232.37.140","192.168.1.118","TCP","66","443 → 39245 [ACK] Seq=1 Ack=518 Win=28160 Len=0 TSval=2786597029 TSecr=14636362"
"28","0.199628874","199.232.37.140","192.168.1.118","TLSv1.2","1418","Server Hello"
"29","0.199707264","192.168.1.118","199.232.37.140","TCP","66","39245 → 443 [ACK] Seq=518 Ack=1353 Win=32000 Len=0 TSval=14636387 TSecr=2786597029"
"30","0.201382698","199.232.37.140","192.168.1.118","TLSv1.2","1952","Certificate, Server Key Exchange, Server Hello Done"
"31","0.201462201","192.168.1.118","199.232.37.140","TCP","66","39245 → 443 [ACK] Seq=518 Ack=3239 Win=35712 Len=0 TSval=14636388 TSecr=2786597029"
"32","0.207628729","192.168.1.118","199.232.37.140","TLSv1.2","192","Client Key Exchange, Change Cipher Spec, Encrypted Handshake Message"
"33","0.210103416","199.232.37.140","192.168.1.118","TLSv1.2","2770","Application Data, Application Data"
"34","0.210182743","192.168.1.118","199.232.37.140","TCP","66","39234 → 443 [ACK] Seq=1 Ack=24001 Win=1145 Len=0 TSval=14636397 TSecr=1089452592"
"35","0.212820973","199.232.37.140","192.168.1.118","TLSv1.2","2770","Application Data, Application Data"
"36","0.212901864","192.168.1.118","199.232.37.140","TCP","66","39234 → 443 [ACK] Seq=1 Ack=26705 Win=1188 Len=0 TSval=14636400 TSecr=1089452592"
"37","0.217819261","199.232.37.140","192.168.1.118","TLSv1.2","2770","Application Data, Application Data"
"38","0.217899126","192.168.1.118","199.232.37.140","TCP","66","39234 → 443 [ACK] Seq=1 Ack=29409 Win=1230 Len=0 TSval=14636405 TSecr=1089452592"
"39","0.247347757","199.232.37.140","192.168.1.118","TLSv1.2","3932","Application Data, Application Data, Application Data, Application Data, Application Data"
"40","0.247425509","192.168.1.118","199.232.37.140","TCP","66","39234 → 443 [ACK] Seq=1 Ack=33275 Win=1290 Len=0 TSval=14636434 TSecr=1089452592"
"41","0.248797220","199.232.37.140","192.168.1.118","TLSv1.2","117","Change Cipher Spec, Encrypted Handshake Message"
"42","0.249189246","192.168.1.118","199.232.37.140","TLSv1.2","256","Application Data"
"43","0.273060131","199.232.37.140","192.168.1.118","TLSv1.2","1418","Application Data"
"44","0.280902768","199.232.37.140","192.168.1.118","TLSv1.2","2770","Application Data, Application Data"
"45","0.280984384","192.168.1.118","199.232.37.140","TCP","66","39245 → 443 [ACK] Seq=834 Ack=7346 Win=43904 Len=0 TSval=14636468 TSecr=2786597048"
"46","0.281089487","199.232.37.140","192.168.1.118","TLSv1.2","5474","Application Data, Application Data, Application Data, Application Data"
"47","0.281118689","192.168.1.118","199.232.37.140","TCP","66","39245 → 443 [ACK] Seq=834 Ack=12754 Win=54656 Len=0 TSval=14636468 TSecr=2786597048"
"48","0.281128964","199.232.37.140","192.168.1.118","TLSv1.2","119","Application Data"
"49","0.320620984","192.168.1.118","199.232.37.140","TCP","66","39245 → 443 [ACK] Seq=834 Ack=12807 Win=54656 Len=0 TSval=14636508 TSecr=2786597048"
"50","0.363134434","199.232.37.140","192.168.1.118","TLSv1.2","1418","Application Data"
"51","0.363214749","192.168.1.118","199.232.37.140","TCP","66","39234 → 443 [ACK] Seq=1 Ack=34627 Win=1311 Len=0 TSval=14636550 TSecr=1089452631"
"52","0.365292547","199.232.37.140","192.168.1.118","TLSv1.2","3629","Application Data, Application Data, Application Data, Application Data, Application Data"
"53","0.365372612","192.168.1.118","199.232.37.140","TCP","66","39234 → 443 [ACK] Seq=1 Ack=38190 Win=1367 Len=0 TSval=14636552 TSecr=1089452631"
"54","0.401648969","199.232.37.140","192.168.1.118","TLSv1.2","1418","Application Data"
"55","0.401731597","192.168.1.118","199.232.37.140","TCP","66","39234 → 443 [ACK] Seq=1 Ack=39542 Win=1388 Len=0 TSval=14636589 TSecr=1089452639"
"56","0.406436612","199.232.37.140","192.168.1.118","TLSv1.2","7934","Application Data, Application Data, Application Data, Application Data, Application Data, Application Data, Application Data, Application Data"
"57","0.406510790","192.168.1.118","199.232.37.140","TCP","66","39234 → 443 [ACK] Seq=1 Ack=47410 Win=1336 Len=0 TSval=14636593 TSecr=1089452639"
"58","0.422932464","192.168.1.118","199.232.37.140","TLSv1.2","272","Application Data"
"59","0.423303577","192.168.1.118","209.18.47.62","DNS","84","Standard query 0x8480 A b.thumbs.redditmedia.com"
"60","0.423378305","192.168.1.118","199.232.37.140","TCP","74","39246 → 443 [SYN] Seq=0 Win=29200 Len=0 MSS=1460 SACK_PERM=1 TSval=14636610 TSecr=0 WS=128"
"61","0.423418744","199.232.37.140","192.168.1.118","TLSv1.2","1418","Application Data"
"62","0.423465108","192.168.1.118","199.232.37.140","TCP","66","39234 → 443 [ACK] Seq=1 Ack=48762 Win=1409 Len=0 TSval=14636610 TSecr=1089452646"
"63","0.423708854","192.168.1.118","209.18.47.62","DNS","75","Standard query 0x683f A preview.redd.it"
"64","0.428702066","199.232.37.140","192.168.1.118","TLSv1.2","1103","Application Data, Application Data, Application Data"
"65","0.428779594","192.168.1.118","199.232.37.140","TCP","66","39234 → 443 [ACK] Seq=1 Ack=49799 Win=1416 Len=0 TSval=14636616 TSecr=1089452646"
"66","0.436712822","192.168.1.118","199.232.37.140","TCP","74","39247 → 443 [SYN] Seq=0 Win=29200 Len=0 MSS=1460 SACK_PERM=1 TSval=14636624 TSecr=0 WS=128"
"67","0.436878340","192.168.1.118","209.18.47.62","DNS","82","Standard query 0x048b A styles.redditmedia.com"
"68","0.440456303","199.232.37.140","192.168.1.118","TLSv1.2","1418","Application Data"
"69","0.440535430","192.168.1.118","199.232.37.140","TCP","66","39234 → 443 [ACK] Seq=1 Ack=51151 Win=1416 Len=0 TSval=14636627 TSecr=1089452650"
"70","0.442205339","192.168.1.118","209.18.47.62","DNS","84","Standard query 0x54c2 A b.thumbs.redditmedia.com"
"71","0.442505512","199.232.37.140","192.168.1.118","TLSv1.2","3168","Application Data, Application Data, Application Data, Application Data, Application Data"
"72","0.442570552","192.168.1.118","199.232.37.140","TCP","66","39234 → 443 [ACK] Seq=1 Ack=54253 Win=1392 Len=0 TSval=14636630 TSecr=1089452650"
"73","0.442657142","192.168.1.118","209.18.47.62","DNS","75","Standard query 0x947e A preview.redd.it"
"74","0.445141229","209.18.47.62","192.168.1.118","DNS","126","Standard query response 0x683f A preview.redd.it CNAME reddit.map.fastly.net A 199.232.37.140"
"75","0.445316598","192.168.1.118","209.18.47.62","DNS","75","Standard query 0x807a AAAA preview.redd.it"
"76","0.447567464","209.18.47.62","192.168.1.118","DNS","135","Standard query response 0x8480 A b.thumbs.redditmedia.com CNAME reddit.map.fastly.net A 199.232.37.140"
"77","0.448678815","192.168.1.118","209.18.47.62","DNS","84","Standard query 0xc008 AAAA b.thumbs.redditmedia.com"
"78","0.450928882","199.232.37.140","192.168.1.118","TCP","74","443 → 39246 [SYN, ACK] Seq=0 Ack=1 Win=27040 Len=0 MSS=1364 SACK_PERM=1 TSval=247588570 TSecr=14636610 WS=512"
"79","0.451031960","192.168.1.118","199.232.37.140","TCP","66","39246 → 443 [ACK] Seq=1 Ack=1 Win=29312 Len=0 TSval=14636638 TSecr=247588570"
"80","0.456414311","199.232.37.140","192.168.1.118","TLSv1.2","2937","Application Data, Application Data, Application Data"
"81","0.456507964","192.168.1.118","199.232.37.140","TCP","66","39245 → 443 [ACK] Seq=1040 Ack=15678 Win=60416 Len=0 TSval=14636643 TSecr=2786597092"
"82","0.465189856","209.18.47.62","192.168.1.118","DNS","135","Standard query response 0x54c2 A b.thumbs.redditmedia.com CNAME reddit.map.fastly.net A 199.232.37.140"
"83","0.465367812","192.168.1.118","209.18.47.62","DNS","84","Standard query 0x988b AAAA b.thumbs.redditmedia.com"
"84","0.466620768","209.18.47.62","192.168.1.118","DNS","133","Standard query response 0x048b A styles.redditmedia.com CNAME reddit.map.fastly.net A 199.232.37.140"
"85","0.466773136","192.168.1.118","209.18.47.62","DNS","82","Standard query 0x5c1d AAAA styles.redditmedia.com"
"86","0.469302837","209.18.47.62","192.168.1.118","DNS","126","Standard query response 0x947e A preview.redd.it CNAME reddit.map.fastly.net A 199.232.37.140"
"87","0.469377490","199.232.37.140","192.168.1.118","TCP","74","443 → 39247 [SYN, ACK] Seq=0 Ack=1 Win=27040 Len=0 MSS=1364 SACK_PERM=1 TSval=2784797368 TSecr=14636624 WS=512"
"88","0.469443330","192.168.1.118","199.232.37.140","TCP","66","39247 → 443 [ACK] Seq=1 Ack=1 Win=29312 Len=0 TSval=14636656 TSecr=2784797368"
"89","0.469612186","192.168.1.118","209.18.47.62","DNS","75","Standard query 0x24f8 AAAA preview.redd.it"
"90","0.471260581","192.168.1.118","199.232.37.140","TLSv1","583","Client Hello"
"91","0.471803437","209.18.47.62","192.168.1.118","DNS","177","Standard query response 0xc008 AAAA b.thumbs.redditmedia.com CNAME reddit.map.fastly.net SOA ns1.fastly.net"
"92","0.471862214","209.18.47.62","192.168.1.118","DNS","171","Standard query response 0x807a AAAA preview.redd.it CNAME reddit.map.fastly.net SOA ns1.fastly.net"
"93","0.485171893","209.18.47.62","192.168.1.118","DNS","175","Standard query response 0x5c1d AAAA styles.redditmedia.com CNAME reddit.map.fastly.net SOA ns1.fastly.net"
"94","0.486102575","209.18.47.62","192.168.1.118","DNS","177","Standard query response 0x988b AAAA b.thumbs.redditmedia.com CNAME reddit.map.fastly.net SOA ns1.fastly.net"
"95","0.486144789","209.18.47.62","192.168.1.118","DNS","171","Standard query response 0x24f8 AAAA preview.redd.it CNAME reddit.map.fastly.net SOA ns1.fastly.net"
"96","0.489347964","192.168.1.118","199.232.37.140","TLSv1","583","Client Hello"
"97","0.489653887","192.168.1.118","199.232.37.140","TCP","74","39248 → 443 [SYN] Seq=0 Win=29200 Len=0 MSS=1460 SACK_PERM=1 TSval=14636677 TSecr=0 WS=128"
"98","0.489779329","192.168.1.118","199.232.37.140","TCP","74","39249 → 443 [SYN] Seq=0 Win=29200 Len=0 MSS=1460 SACK_PERM=1 TSval=14636677 TSecr=0 WS=128"
"99","0.490376575","192.168.1.118","199.232.37.140","TCP","74","39250 → 443 [SYN] Seq=0 Win=29200 Len=0 MSS=1460 SACK_PERM=1 TSval=14636677 TSecr=0 WS=128"
"100","0.490497179","192.168.1.118","199.232.37.140","TCP","74","39251 → 443 [SYN] Seq=0 Win=29200 Len=0 MSS=1460 SACK_PERM=1 TSval=14636677 TSecr=0 WS=128"
"101","0.490600133","192.168.1.118","199.232.37.140","TCP","74","39252 → 443 [SYN] Seq=0 Win=29200 Len=0 MSS=1460 SACK_PERM=1 TSval=14636678 TSecr=0 WS=128"
"102","0.491727647","199.232.37.140","192.168.1.118","TCP","66","443 → 39246 [ACK] Seq=1 Ack=518 Win=28160 Len=0 TSval=247588581 TSecr=14636658"
"103","0.494243373","199.232.37.140","192.168.1.118","TLSv1.2","3304","Server Hello, Certificate, Server Key Exchange, Server Hello Done"
"104","0.494330238","192.168.1.118","199.232.37.140","TCP","66","39246 → 443 [ACK] Seq=518 Ack=3239 Win=35712 Len=0 TSval=14636681 TSecr=247588582"
"105","0.500093402","192.168.1.118","199.232.37.140","TLSv1.2","192","Client Key Exchange, Change Cipher Spec, Encrypted Handshake Message"
"106","0.505156430","199.232.37.140","192.168.1.118","TLSv1.2","6826","Application Data, Application Data, Application Data, Application Data, Application Data, Application Data"
"107","0.505239657","192.168.1.118","199.232.37.140","TCP","66","39234 → 443 [ACK] Seq=1 Ack=61013 Win=1352 Len=0 TSval=14636692 TSecr=1089452665"
"108","0.505280834","199.232.37.140","192.168.1.118","TLSv1.2","86","Application Data"
"109","0.505301422","192.168.1.118","199.232.37.140","TCP","66","39234 → 443 [ACK] Seq=1 Ack=61033 Win=1352 Len=0 TSval=14636692 TSecr=1089452665"
"110","0.507731095","199.232.37.140","192.168.1.118","TCP","66","443 → 39247 [ACK] Seq=1 Ack=518 Win=28160 Len=0 TSval=2784797379 TSecr=14636676"
"111","0.510302735","199.232.37.140","192.168.1.118","TLSv1.2","1418","Server Hello"
"112","0.510392125","192.168.1.118","199.232.37.140","TCP","66","39247 → 443 [ACK] Seq=518 Ack=1353 Win=32000 Len=0 TSval=14636697 TSecr=2784797379"
"113","0.512642829","199.232.37.140","192.168.1.118","TLSv1.2","1952","Certificate, Server Key Exchange, Server Hello Done"
"114","0.512720269","192.168.1.118","199.232.37.140","TCP","66","39247 → 443 [ACK] Seq=518 Ack=3239 Win=35712 Len=0 TSval=14636700 TSecr=2784797379"
"115","0.514091192","199.232.37.140","192.168.1.118","TCP","74","443 → 39250 [SYN, ACK] Seq=0 Ack=1 Win=27040 Len=0 MSS=1364 SACK_PERM=1 TSval=4176194183 TSecr=14636677 WS=512"
"116","0.514194133","192.168.1.118","199.232.37.140","TCP","66","39250 → 443 [ACK] Seq=1 Ack=1 Win=29312 Len=0 TSval=14636701 TSecr=4176194183"
"117","0.514842394","199.232.37.140","192.168.1.118","TCP","74","443 → 39248 [SYN, ACK] Seq=0 Ack=1 Win=27040 Len=0 MSS=1364 SACK_PERM=1 TSval=3073041860 TSecr=14636677 WS=512"
"118","0.514857394","192.168.1.118","199.232.37.140","TLSv1.2","192","Client Key Exchange, Change Cipher Spec, Encrypted Handshake Message"
"119","0.514911046","192.168.1.118","199.232.37.140","TCP","66","39248 → 443 [ACK] Seq=1 Ack=1 Win=29312 Len=0 TSval=14636702 TSecr=3073041860"
"120","0.514950597","199.232.37.140","192.168.1.118","TCP","74","443 → 39251 [SYN, ACK] Seq=0 Ack=1 Win=27040 Len=0 MSS=1364 SACK_PERM=1 TSval=246084035 TSecr=14636677 WS=512"
"121","0.514979961","192.168.1.118","199.232.37.140","TCP","66","39251 → 443 [ACK] Seq=1 Ack=1 Win=29312 Len=0 TSval=14636702 TSecr=246084035"
"122","0.514999687","199.232.37.140","192.168.1.118","TCP","74","443 → 39249 [SYN, ACK] Seq=0 Ack=1 Win=27040 Len=0 MSS=1364 SACK_PERM=1 TSval=246761926 TSecr=14636677 WS=512"
"123","0.515026037","192.168.1.118","199.232.37.140","TCP","66","39249 → 443 [ACK] Seq=1 Ack=1 Win=29312 Len=0 TSval=14636702 TSecr=246761926"
"124","0.515914969","199.232.37.140","192.168.1.118","TCP","74","443 → 39252 [SYN, ACK] Seq=0 Ack=1 Win=27040 Len=0 MSS=1364 SACK_PERM=1 TSval=2786663077 TSecr=14636678 WS=512"
"125","0.515984971","192.168.1.118","199.232.37.140","TCP","66","39252 → 443 [ACK] Seq=1 Ack=1 Win=29312 Len=0 TSval=14636703 TSecr=2786663077"
"126","0.524698476","199.232.37.140","192.168.1.118","TCP","66","443 → 39246 [ACK] Seq=3239 Ack=644 Win=28160 Len=0 TSval=247588590 TSecr=14636687"
"127","0.527719669","199.232.37.140","192.168.1.118","TLSv1.2","117","Change Cipher Spec, Encrypted Handshake Message"
"128","0.533344216","199.232.37.140","192.168.1.118","TLSv1.2","117","Change Cipher Spec, Encrypted Handshake Message"
"129","0.535122053","199.232.37.140","192.168.1.118","TLSv1.2","1418","Application Data"
"130","0.535209394","192.168.1.118","199.232.37.140","TCP","66","39234 → 443 [ACK] Seq=1 Ack=62385 Win=1416 Len=0 TSval=14636722 TSecr=1089452674"
"131","0.535265683","192.168.1.118","199.232.37.140","TLSv1","583","Client Hello"
"132","0.539579797","199.232.37.140","192.168.1.118","TLSv1.2","2280","Application Data, Application Data, Application Data, Application Data"
"133","0.539660837","192.168.1.118","199.232.37.140","TCP","66","39234 → 443 [ACK] Seq=1 Ack=64599 Win=1399 Len=0 TSval=14636727 TSecr=1089452674"
"134","0.551949242","199.232.37.140","192.168.1.118","TCP","66","443 → 39248 [ACK] Seq=1 Ack=518 Win=28160 Len=0 TSval=3073041898 TSecr=14636722"
"135","0.555926219","199.232.37.140","192.168.1.118","TLSv1.2","3336","Server Hello, Certificate, Server Key Exchange, Server Hello Done"
"136","0.556010372","192.168.1.118","199.232.37.140","TCP","66","39248 → 443 [ACK] Seq=518 Ack=3271 Win=35840 Len=0 TSval=14636743 TSecr=3073041899"
"137","0.564853419","192.168.1.118","199.232.37.140","TLSv1","583","Client Hello"
"138","0.567616341","192.168.1.118","199.232.37.140","TCP","66","39246 → 443 [ACK] Seq=644 Ack=3290 Win=35712 Len=0 TSval=14636755 TSecr=247588590"
"139","0.572618078","192.168.1.118","199.232.37.140","TCP","66","39247 → 443 [ACK] Seq=644 Ack=3290 Win=35712 Len=0 TSval=14636760 TSecr=2784797385"
"140","0.583720129","192.168.1.118","199.232.37.140","TLSv1","583","Client Hello"
"141","0.586097662","199.232.37.140","192.168.1.118","TLSv1.2","1418","Application Data"
"142","0.588183023","199.232.37.140","192.168.1.118","TLSv1.2","1231","Application Data, Application Data, Application Data"
"143","0.588246025","199.232.37.140","192.168.1.118","TCP","66","443 → 39252 [ACK] Seq=1 Ack=518 Win=28160 Len=0 TSval=2786663094 TSecr=14636752"
"144","0.588293664","199.232.37.140","192.168.1.118","TLSv1.2","3432","Server Hello, Certificate, Server Key Exchange, Server Hello Done"
"145","0.588336691","192.168.1.118","199.232.37.140","TCP","66","39252 → 443 [ACK] Seq=518 Ack=3367 Win=35968 Len=0 TSval=14636775 TSecr=2786663094"
"146","0.589441467","199.232.37.140","192.168.1.118","TLSv1.2","217","Application Data, Application Data, Application Data"
"147","0.604306287","192.168.1.118","199.232.37.140","TLSv1","583","Client Hello"
"148","0.604729289","192.168.1.118","199.232.37.140","TLSv1.2","279","Application Data"
"149","0.607702193","199.232.37.140","192.168.1.118","TCP","66","443 → 39249 [ACK] Seq=1 Ack=518 Win=28160 Len=0 TSval=246761950 TSecr=14636771"
"150","0.610091502","199.232.37.140","192.168.1.118","TLSv1.2","1418","Server Hello"
"151","0.610175705","192.168.1.118","199.232.37.140","TCP","66","39249 → 443 [ACK] Seq=518 Ack=1353 Win=32000 Len=0 TSval=14636797 TSecr=246761950"
"152","0.611878677","199.232.37.140","192.168.1.118","TLSv1.2","1984","Certificate, Server Key Exchange, Server Hello Done"
"153","0.611965305","192.168.1.118","199.232.37.140","TCP","66","39249 → 443 [ACK] Seq=518 Ack=3271 Win=35840 Len=0 TSval=14636799 TSecr=246761950"
"154","0.621780561","199.232.37.140","192.168.1.118","TCP","66","443 → 39250 [ACK] Seq=1 Ack=518 Win=28160 Len=0 TSval=4176194210 TSecr=14636791"
"155","0.622829298","199.232.37.140","192.168.1.118","TLSv1.2","744","Application Data, Application Data"
"156","0.622914838","192.168.1.118","199.232.37.140","TCP","66","39246 → 443 [ACK] Seq=857 Ack=3968 Win=38400 Len=0 TSval=14636810 TSecr=247588614"
"157","0.625568181","199.232.37.140","192.168.1.118","TLSv1.2","1418","Server Hello"
"158","0.625660735","192.168.1.118","199.232.37.140","TCP","66","39250 → 443 [ACK] Seq=518 Ack=1353 Win=32000 Len=0 TSval=14636813 TSecr=4176194211"
"159","0.625717561","192.168.1.118","199.232.37.140","TCP","66","39234 → 443 [ACK] Seq=1 Ack=67267 Win=1379 Len=0 TSval=14636813 TSecr=1089452685"
"160","0.627392270","199.232.37.140","192.168.1.118","TLSv1.2","2080","Certificate, Server Key Exchange, Server Hello Done"
"161","0.627476598","192.168.1.118","199.232.37.140","TCP","66","39250 → 443 [ACK] Seq=518 Ack=3367 Win=35968 Len=0 TSval=14636814 TSecr=4176194211"
"162","0.629094805","192.168.1.118","199.232.37.140","TLSv1","583","Client Hello"
"163","0.629470380","192.168.1.118","199.232.37.140","TLSv1.2","274","Application Data"
"164","0.631466613","192.168.1.118","199.232.37.140","TLSv1.2","192","Client Key Exchange, Change Cipher Spec, Encrypted Handshake Message"
"165","0.633690841","192.168.1.118","199.232.37.140","TLSv1.2","192","Client Key Exchange, Change Cipher Spec, Encrypted Handshake Message"
"166","0.642189888","192.168.1.118","199.232.37.140","TLSv1.2","192","Client Key Exchange, Change Cipher Spec, Encrypted Handshake Message"
"167","0.644163170","192.168.1.118","199.232.37.140","TLSv1.2","192","Client Key Exchange, Change Cipher Spec, Encrypted Handshake Message"
"168","0.644524620","192.168.1.118","199.232.37.140","TLSv1.2","276","Application Data"
"169","0.644777691","192.168.1.118","199.232.37.140","TCP","74","39253 → 443 [SYN] Seq=0 Win=29200 Len=0 MSS=1460 SACK_PERM=1 TSval=14636832 TSecr=0 WS=128"
"170","0.644894420","192.168.1.118","199.232.37.140","TCP","74","39254 → 443 [SYN] Seq=0 Win=29200 Len=0 MSS=1460 SACK_PERM=1 TSval=14636832 TSecr=0 WS=128"
"171","0.644995311","192.168.1.118","199.232.37.140","TCP","74","39255 → 443 [SYN] Seq=0 Win=29200 Len=0 MSS=1460 SACK_PERM=1 TSval=14636832 TSecr=0 WS=128"
"172","0.648382167","199.232.37.140","192.168.1.118","TCP","66","443 → 39251 [ACK] Seq=1 Ack=518 Win=28160 Len=0 TSval=246084069 TSecr=14636816"
"173","0.650754813","199.232.37.140","192.168.1.118","TLSv1.2","2531","Application Data, Application Data, Application Data"
"174","0.650846503","192.168.1.118","199.232.37.140","TCP","66","39247 → 443 [ACK] Seq=852 Ack=5755 Win=40704 Len=0 TSval=14636838 TSecr=2784797414"
"175","0.650913068","199.232.37.140","192.168.1.118","TLSv1.2","2770","Server Hello"
"176","0.650939607","192.168.1.118","199.232.37.140","TCP","66","39251 → 443 [ACK] Seq=518 Ack=2705 Win=34688 Len=0 TSval=14636838 TSecr=246084069"
"177","0.651529527","192.168.1.118","199.232.37.140","TCP","74","39256 → 443 [SYN] Seq=0 Win=29200 Len=0 MSS=1460 SACK_PERM=1 TSval=14636838 TSecr=0 WS=128"
"178","0.652184725","192.168.1.118","209.18.47.62","DNS","84","Standard query 0x507a A external-preview.redd.it"
"179","0.652366232","192.168.1.118","209.18.47.62","DNS","84","Standard query 0xf0ff A a.thumbs.redditmedia.com"
"180","0.655771451","192.168.1.118","199.232.37.140","TCP","74","39257 → 443 [SYN] Seq=0 Win=29200 Len=0 MSS=1460 SACK_PERM=1 TSval=14636843 TSecr=0 WS=128"
"181","0.655872329","199.232.37.140","192.168.1.118","TLSv1.2","610","Certificate, Server Key Exchange, Server Hello Done"
"182","0.655956570","192.168.1.118","199.232.37.140","TCP","66","39251 → 443 [ACK] Seq=518 Ack=3249 Win=37376 Len=0 TSval=14636843 TSecr=246084069"
"183","0.656010034","192.168.1.118","199.232.37.140","TCP","74","39258 → 443 [SYN] Seq=0 Win=29200 Len=0 MSS=1460 SACK_PERM=1 TSval=14636843 TSecr=0 WS=128"
"184","0.656113350","192.168.1.118","199.232.37.140","TCP","74","39259 → 443 [SYN] Seq=0 Win=29200 Len=0 MSS=1460 SACK_PERM=1 TSval=14636843 TSecr=0 WS=128"
"185","0.656647957","192.168.1.118","209.18.47.62","DNS","84","Standard query 0xa8d8 A a.thumbs.redditmedia.com"
"186","0.658671265","192.168.1.118","199.232.37.140","TLSv1.2","192","Client Key Exchange, Change Cipher Spec, Encrypted Handshake Message"
"187","0.660637846","199.232.37.140","192.168.1.118","TLSv1.2","117","Change Cipher Spec, Encrypted Handshake Message"
"188","0.660727899","192.168.1.118","199.232.37.140","TCP","66","39252 → 443 [ACK] Seq=644 Ack=3418 Win=35968 Len=0 TSval=14636848 TSecr=2786663114"
"189","0.662105048","199.232.37.140","192.168.1.118","TLSv1.2","117","Change Cipher Spec, Encrypted Handshake Message"
"190","0.662185188","192.168.1.118","199.232.37.140","TCP","66","39248 → 443 [ACK] Seq=644 Ack=3322 Win=35840 Len=0 TSval=14636849 TSecr=3073042008"
"191","0.663039055","192.168.1.118","199.232.37.140","TLSv1.2","295","Application Data"
"192","0.663315365","192.168.1.118","199.232.37.140","TLSv1.2","370","Application Data"
"193","0.665210506","209.18.47.62","192.168.1.118","DNS","135","Standard query response 0x507a A external-preview.redd.it CNAME reddit.map.fastly.net A 199.232.37.140"
"194","0.665366199","192.168.1.118","209.18.47.62","DNS","84","Standard query 0xbcfc AAAA external-preview.redd.it"
"195","0.666147126","199.232.37.140","192.168.1.118","TCP","74","443 → 39256 [SYN, ACK] Seq=0 Ack=1 Win=27040 Len=0 MSS=1364 SACK_PERM=1 TSval=245359818 TSecr=14636838 WS=512"
"196","0.666235442","192.168.1.118","199.232.37.140","TCP","66","39256 → 443 [ACK] Seq=1 Ack=1 Win=29312 Len=0 TSval=14636853 TSecr=245359818"
"197","0.666272618","199.232.37.140","192.168.1.118","TLSv1.2","117","Change Cipher Spec, Encrypted Handshake Message"
"198","0.667382745","192.168.1.118","199.232.37.140","TLSv1.2","295","Application Data"
"199","0.672978403","199.232.37.140","192.168.1.118","TCP","74","443 → 39255 [SYN, ACK] Seq=0 Ack=1 Win=27040 Len=0 MSS=1364 SACK_PERM=1 TSval=3226870468 TSecr=14636832 WS=512"
"200","0.673086844","192.168.1.118","199.232.37.140","TCP","66","39255 → 443 [ACK] Seq=1 Ack=1 Win=29312 Len=0 TSval=14636860 TSecr=3226870468"
"201","0.673130471","199.232.37.140","192.168.1.118","TCP","74","443 → 39254 [SYN, ACK] Seq=0 Ack=1 Win=27040 Len=0 MSS=1364 SACK_PERM=1 TSval=2784811240 TSecr=14636832 WS=512"
"202","0.673156997","192.168.1.118","199.232.37.140","TCP","66","39254 → 443 [ACK] Seq=1 Ack=1 Win=29312 Len=0 TSval=14636860 TSecr=2784811240"
"203","0.673180573","199.232.37.140","192.168.1.118","TCP","74","443 → 39253 [SYN, ACK] Seq=0 Ack=1 Win=27040 Len=0 MSS=1364 SACK_PERM=1 TSval=3207096016 TSecr=14636832 WS=512"
"204","0.673204123","192.168.1.118","199.232.37.140","TCP","66","39253 → 443 [ACK] Seq=1 Ack=1 Win=29312 Len=0 TSval=14636860 TSecr=3207096016"
"205","0.673229437","199.232.37.140","192.168.1.118","TLSv1.2","3077","Application Data, Application Data, Application Data"
"206","0.673265988","192.168.1.118","199.232.37.140","TCP","66","39245 → 443 [ACK] Seq=1250 Ack=18689 Win=66432 Len=0 TSval=14636860 TSecr=2786597146"
"207","0.674753678","199.232.37.140","192.168.1.118","TLSv1.2","117","Change Cipher Spec, Encrypted Handshake Message"
"208","0.674816480","209.18.47.62","192.168.1.118","DNS","135","Standard query response 0xf0ff A a.thumbs.redditmedia.com CNAME reddit.map.fastly.net A 199.232.37.140"
"209","0.674860269","209.18.47.62","192.168.1.118","DNS","135","Standard query response 0xa8d8 A a.thumbs.redditmedia.com CNAME reddit.map.fastly.net A 199.232.37.140"
"210","0.674885320","199.232.37.140","192.168.1.118","TCP","74","443 → 39258 [SYN, ACK] Seq=0 Ack=1 Win=27040 Len=0 MSS=1364 SACK_PERM=1 TSval=249018758 TSecr=14636843 WS=512"
"211","0.674934422","192.168.1.118","199.232.37.140","TCP","66","39258 → 443 [ACK] Seq=1 Ack=1 Win=29312 Len=0 TSval=14636862 TSecr=249018758"
"212","0.674978511","199.232.37.140","192.168.1.118","TCP","74","443 → 39257 [SYN, ACK] Seq=0 Ack=1 Win=27040 Len=0 MSS=1364 SACK_PERM=1 TSval=247497389 TSecr=14636843 WS=512"
"213","0.675005924","192.168.1.118","199.232.37.140","TCP","66","39257 → 443 [ACK] Seq=1 Ack=1 Win=29312 Len=0 TSval=14636862 TSecr=247497389"
"214","0.675025400","199.232.37.140","192.168.1.118","TCP","74","443 → 39259 [SYN, ACK] Seq=0 Ack=1 Win=27040 Len=0 MSS=1364 SACK_PERM=1 TSval=245269984 TSecr=14636843 WS=512"
"215","0.675051788","192.168.1.118","199.232.37.140","TCP","66","39259 → 443 [ACK] Seq=1 Ack=1 Win=29312 Len=0 TSval=14636862 TSecr=245269984"
"216","0.675152579","192.168.1.118","209.18.47.62","DNS","84","Standard query 0x40fb AAAA a.thumbs.redditmedia.com"
"217","0.675210219","192.168.1.118","209.18.47.62","DNS","84","Standard query 0x8cbc AAAA a.thumbs.redditmedia.com"
"218","0.690310797","199.232.37.140","192.168.1.118","TLSv1.2","1418","Application Data"
"219","0.693523360","199.232.37.140","192.168.1.118","TLSv1.2","4122","Application Data, Application Data, Application Data"
"220","0.693620651","192.168.1.118","199.232.37.140","TCP","66","39248 → 443 [ACK] Seq=873 Ack=8730 Win=46592 Len=0 TSval=14636881 TSecr=3073042030"
"221","0.693661739","199.232.37.140","192.168.1.118","TLSv1.2","1418","Application Data"
"222","0.693729892","199.232.37.140","192.168.1.118","TLSv1.2","2528","Application Data, Application Data, Application Data"
"223","0.693752518","192.168.1.118","199.232.37.140","TCP","66","39252 → 443 [ACK] Seq=948 Ack=7232 Win=43648 Len=0 TSval=14636881 TSecr=2786663119"
"224","0.693782694","199.232.37.140","192.168.1.118","TLSv1.2","1455","Application Data, Application Data"
"225","0.693804269","192.168.1.118","199.232.37.140","TCP","66","39248 → 443 [ACK] Seq=873 Ack=10119 Win=49408 Len=0 TSval=14636881 TSecr=3073042030"
"226","0.693824158","199.232.37.140","192.168.1.118","TLSv1.2","117","Change Cipher Spec, Encrypted Handshake Message"
"227","0.696378635","209.18.47.62","192.168.1.118","DNS","180","Standard query response 0xbcfc AAAA external-preview.redd.it CNAME reddit.map.fastly.net SOA ns1.fastly.net"
"228","0.697856136","192.168.1.118","199.232.37.140","TLSv1","583","Client Hello"
"229","0.698059756","199.232.37.140","192.168.1.118","TLSv1.2","4122","Application Data, Application Data, Application Data"
"230","0.698152984","192.168.1.118","199.232.37.140","TCP","74","39260 → 443 [SYN] Seq=0 Win=29200 Len=0 MSS=1460 SACK_PERM=1 TSval=14636885 TSecr=0 WS=128"
"231","0.698170522","192.168.1.118","199.232.37.140","TCP","66","39249 → 443 [ACK] Seq=873 Ack=7378 Win=43904 Len=0 TSval=14636885 TSecr=246761972"
"232","0.702032870","199.232.37.140","192.168.1.118","TLSv1.2","4122","Application Data, Application Data, Application Data"
"233","0.702122061","192.168.1.118","199.232.37.140","TCP","66","39249 → 443 [ACK] Seq=873 Ack=11434 Win=51968 Len=0 TSval=14636889 TSecr=246761972"
"234","0.704145519","199.232.37.140","192.168.1.118","TLSv1.2","5474","Application Data, Application Data, Application Data, Application Data"
"235","0.704230647","192.168.1.118","199.232.37.140","TCP","66","39249 → 443 [ACK] Seq=873 Ack=16842 Win=62848 Len=0 TSval=14636891 TSecr=246761972"
"236","0.705612320","209.18.47.62","192.168.1.118","DNS","177","Standard query response 0x40fb AAAA a.thumbs.redditmedia.com CNAME reddit.map.fastly.net SOA ns1.fastly.net"
"237","0.705666535","209.18.47.62","192.168.1.118","DNS","177","Standard query response 0x8cbc AAAA a.thumbs.redditmedia.com CNAME reddit.map.fastly.net SOA ns1.fastly.net"
"238","0.712381707","199.232.37.140","192.168.1.118","TLSv1.2","166","Application Data, Application Data, Application Data"
"239","0.714618498","192.168.1.118","199.232.37.140","TCP","66","39250 → 443 [ACK] Seq=644 Ack=3418 Win=35968 Len=0 TSval=14636902 TSecr=4176194222"
"240","0.716252618","199.232.37.140","192.168.1.118","TCP","66","443 → 39256 [ACK] Seq=1 Ack=518 Win=28160 Len=0 TSval=245359830 TSecr=14636885"
"241","0.716315032","192.168.1.118","199.232.37.140","TLSv1","583","Client Hello"
"242","0.719662412","199.232.37.140","192.168.1.118","TLSv1.2","5474","Application Data, Application Data, Application Data, Application Data"
"243","0.719749777","192.168.1.118","199.232.37.140","TCP","66","39249 → 443 [ACK] Seq=873 Ack=22250 Win=73600 Len=0 TSval=14636907 TSecr=246761977"
"244","0.720012349","199.232.37.140","192.168.1.118","TLSv1.2","2770","Application Data, Application Data"
"245","0.720040163","192.168.1.118","199.232.37.140","TCP","66","39249 → 443 [ACK] Seq=873 Ack=24954 Win=79104 Len=0 TSval=14636907 TSecr=246761977"
"246","0.720066389","199.232.37.140","192.168.1.118","TLSv1.2","2770","Application Data, Application Data"
"247","0.720086064","192.168.1.118","199.232.37.140","TCP","66","39249 → 443 [ACK] Seq=873 Ack=27658 Win=84480 Len=0 TSval=14636907 TSecr=246761977"
"248","0.725569381","199.232.37.140","192.168.1.118","TLSv1.2","4122","Application Data, Application Data"
"249","0.725654822","192.168.1.118","199.232.37.140","TCP","66","39249 → 443 [ACK] Seq=873 Ack=31714 Win=92544 Len=0 TSval=14636913 TSecr=246761977"
"250","0.725696861","199.232.37.140","192.168.1.118","TCP","74","443 → 39260 [SYN, ACK] Seq=0 Ack=1 Win=27040 Len=0 MSS=1364 SACK_PERM=1 TSval=2787800771 TSecr=14636885 WS=512"
"251","0.725747012","192.168.1.118","199.232.37.140","TCP","66","39260 → 443 [ACK] Seq=1 Ack=1 Win=29312 Len=0 TSval=14636913 TSecr=2787800771"
"252","0.725766751","199.232.37.140","192.168.1.118","TLSv1.2","1418","Server Hello"
"253","0.725786764","192.168.1.118","199.232.37.140","TCP","66","39256 → 443 [ACK] Seq=518 Ack=1353 Win=32000 Len=0 TSval=14636913 TSecr=245359831"
"254","0.725876729","199.232.37.140","192.168.1.118","TLSv1.2","1984","Certificate, Server Key Exchange, Server Hello Done"
"255","0.725897430","192.168.1.118","199.232.37.140","TCP","66","39256 → 443 [ACK] Seq=518 Ack=3271 Win=35840 Len=0 TSval=14636913 TSecr=245359831"
"256","0.725929594","199.232.37.140","192.168.1.118","TLSv1.2","2770","Application Data, Application Data"
"257","0.725948419","192.168.1.118","199.232.37.140","TCP","66","39249 → 443 [ACK] Seq=873 Ack=34418 Win=98048 Len=0 TSval=14636913 TSecr=246761977"
"258","0.728562686","199.232.37.140","192.168.1.118","TLSv1.2","2770","Application Data, Application Data"
"259","0.728639864","192.168.1.118","199.232.37.140","TCP","66","39249 → 443 [ACK] Seq=873 Ack=37122 Win=103424 Len=0 TSval=14636916 TSecr=246761977"
"260","0.728680015","199.232.37.140","192.168.1.118","TLSv1.2","1418","Application Data [TCP segment of a reassembled PDU]"
"261","0.730193080","199.232.37.140","192.168.1.118","TLSv1.2","1418","Application Data [TCP segment of a reassembled PDU]"
"262","0.730266346","192.168.1.118","199.232.37.140","TCP","66","39249 → 443 [ACK] Seq=873 Ack=39826 Win=108800 Len=0 TSval=14636917 TSecr=246761978"
"263","0.733298314","199.232.37.140","192.168.1.118","TLSv1.2","2770","Application Data, Application Data"
"264","0.733388617","192.168.1.118","199.232.37.140","TCP","66","39249 → 443 [ACK] Seq=873 Ack=42530 Win=114176 Len=0 TSval=14636920 TSecr=246761978"
"265","0.733430631","199.232.37.140","192.168.1.118","TLSv1.2","1418","Application Data [TCP segment of a reassembled PDU]"
"266","0.733576524","192.168.1.118","199.232.37.140","TCP","66","39251 → 443 [ACK] Seq=644 Ack=3300 Win=37376 Len=0 TSval=14636921 TSecr=246084078"
"267","0.735394513","199.232.37.140","192.168.1.118","TCP","66","443 → 39257 [ACK] Seq=1 Ack=518 Win=28160 Len=0 TSval=247497404 TSecr=14636903"
"268","0.737093810","199.232.37.140","192.168.1.118","TLSv1.2","3336","Server Hello, Certificate, Server Key Exchange, Server Hello Done"
"269","0.737154312","192.168.1.118","199.232.37.140","TCP","66","39257 → 443 [ACK] Seq=518 Ack=3271 Win=35840 Len=0 TSval=14636924 TSecr=247497405"
"270","0.738490108","192.168.1.118","199.232.37.140","TLSv1","583","Client Hello"
"271","0.746222141","199.232.37.140","192.168.1.118","TLSv1.2","1418","Application Data [TCP segment of a reassembled PDU]"
"272","0.746308682","192.168.1.118","199.232.37.140","TCP","66","39249 → 443 [ACK] Seq=873 Ack=45234 Win=119424 Len=0 TSval=14636933 TSecr=246761979"
"273","0.747375857","199.232.37.140","192.168.1.118","TLSv1.2","1418","Application Data [TCP segment of a reassembled PDU]"
"274","0.749723289","199.232.37.140","192.168.1.118","TLSv1.2","2770","Application Data, Application Data"
"275","0.751591704","192.168.1.118","199.232.37.140","TCP","66","39234 → 443 [ACK] Seq=1 Ack=67367 Win=1416 Len=0 TSval=14636939 TSecr=1089452718"
"276","0.751740285","199.232.37.140","192.168.1.118","TLSv1.2","2770","Application Data, Application Data"
"277","0.752500174","199.232.37.140","192.168.1.118","TLSv1.2","2770","Application Data, Application Data"
"278","0.753658414","199.232.37.140","192.168.1.118","TCP","66","443 → 39258 [ACK] Seq=1 Ack=518 Win=28160 Len=0 TSval=249018777 TSecr=14636925"
"279","0.753737780","199.232.37.140","192.168.1.118","TLSv1.2","2770","Application Data, Application Data"
"280","0.755824015","199.232.37.140","192.168.1.118","TLSv1.2","864","Application Data"
"281","0.755904643","199.232.37.140","192.168.1.118","TLSv1.2","3314","Server Hello, Certificate, Server Key Exchange, Server Hello Done"
"282","0.755952907","192.168.1.118","199.232.37.140","TCP","66","39258 → 443 [ACK] Seq=518 Ack=3249 Win=35712 Len=0 TSval=14636943 TSecr=249018778"
"283","0.757919538","192.168.1.118","199.232.37.140","TLSv1","583","Client Hello"
"284","0.758196748","192.168.1.118","199.232.37.140","TCP","74","39261 → 443 [SYN] Seq=0 Win=29200 Len=0 MSS=1460 SACK_PERM=1 TSval=14636945 TSecr=0 WS=128"
"285","0.758325278","192.168.1.118","199.232.37.140","TCP","66","39249 → 443 [ACK] Seq=873 Ack=58200 Win=106496 Len=0 TSval=14636945 TSecr=246761984"
"286","0.759036340","192.168.1.118","199.232.37.140","TLSv1.2","376","Application Data"
"287","0.759307712","192.168.1.118","199.232.37.140","TLSv1.2","293","Application Data"
"288","0.776865051","192.168.1.118","199.232.37.140","TLSv1","583","Client Hello"
"289","0.791146514","199.232.37.140","192.168.1.118","TCP","66","443 → 39259 [ACK] Seq=1 Ack=518 Win=28160 Len=0 TSval=245270012 TSecr=14636945"
"290","0.794120868","192.168.1.118","199.232.37.140","TLSv1","583","Client Hello"
"291","0.794182658","199.232.37.140","192.168.1.118","TLSv1.2","5474","Application Data, Application Data, Application Data, Application Data"
"292","0.794274473","192.168.1.118","199.232.37.140","TCP","66","39251 → 443 [ACK] Seq=871 Ack=8708 Win=48128 Len=0 TSval=14636981 TSecr=246084104"
"293","0.795829590","199.232.37.140","192.168.1.118","TCP","74","443 → 39261 [SYN, ACK] Seq=0 Ack=1 Win=43264 Len=0 MSS=1364 SACK_PERM=1 TSval=2034798100 TSecr=14636945 WS=512"
"294","0.795935956","192.168.1.118","199.232.37.140","TCP","66","39261 → 443 [ACK] Seq=1 Ack=1 Win=29312 Len=0 TSval=14636983 TSecr=2034798100"
"295","0.795976083","199.232.37.140","192.168.1.118","TLSv1.2","4122","Application Data, Application Data, Application Data"
"296","0.796003371","192.168.1.118","199.232.37.140","TCP","66","39251 → 443 [ACK] Seq=871 Ack=12764 Win=56320 Len=0 TSval=14636983 TSecr=246084104"
"297","0.796479375","199.232.37.140","192.168.1.118","TLSv1.2","3336","Server Hello, Certificate, Server Key Exchange, Server Hello Done"
"298","0.796509751","192.168.1.118","199.232.37.140","TCP","66","39259 → 443 [ACK] Seq=518 Ack=3271 Win=35840 Len=0 TSval=14636983 TSecr=245270012"
"299","0.796539053","199.232.37.140","192.168.1.118","TLSv1.2","4122","Application Data, Application Data, Application Data"
"300","0.796572841","192.168.1.118","199.232.37.140","TCP","66","39251 → 443 [ACK] Seq=871 Ack=16820 Win=64384 Len=0 TSval=14636984 TSecr=246084104"
"301","0.796582379","199.232.37.140","192.168.1.118","TLSv1.2","2770","Application Data, Application Data"
"302","0.796608430","192.168.1.118","199.232.37.140","TCP","66","39250 → 443 [ACK] Seq=954 Ack=6122 Win=41344 Len=0 TSval=14636984 TSecr=4176194252"
"303","0.802145836","199.232.37.140","192.168.1.118","TLSv1.2","923","Application Data, Application Data"
"304","0.802227927","192.168.1.118","199.232.37.140","TCP","66","39250 → 443 [ACK] Seq=954 Ack=6979 Win=44160 Len=0 TSval=14636989 TSecr=4176194252"
"305","0.804265248","199.232.37.140","192.168.1.118","TCP","66","443 → 39253 [ACK] Seq=1 Ack=518 Win=28160 Len=0 TSval=3207096049 TSecr=14636964"
"306","0.804354339","199.232.37.140","192.168.1.118","TLSv1.2","3432","Server Hello, Certificate, Server Key Exchange, Server Hello Done"
"307","0.804394552","192.168.1.118","199.232.37.140","TCP","66","39253 → 443 [ACK] Seq=518 Ack=3367 Win=35968 Len=0 TSval=14636991 TSecr=3207096049"
"308","0.821494151","199.232.37.140","192.168.1.118","TLSv1.2","1418","Application Data [TCP segment of a reassembled PDU]"
"309","0.821595154","192.168.1.118","199.232.37.140","TCP","66","39251 → 443 [ACK] Seq=871 Ack=18172 Win=67072 Len=0 TSval=14637009 TSecr=246084111"
"310","0.828587199","199.232.37.140","192.168.1.118","TLSv1.2","372","Application Data"
"311","0.828667039","192.168.1.118","199.232.37.140","TCP","66","39251 → 443 [ACK] Seq=871 Ack=18478 Win=69760 Len=0 TSval=14637016 TSecr=246084111"
"312","0.828713441","199.232.37.140","192.168.1.118","TCP","66","443 → 39254 [ACK] Seq=1 Ack=518 Win=28160 Len=0 TSval=2784811278 TSecr=14636981"
"313","0.828757368","199.232.37.140","192.168.1.118","TLSv1.2","3432","Server Hello, Certificate, Server Key Exchange, Server Hello Done"
"314","0.828779968","192.168.1.118","199.232.37.140","TCP","66","39254 → 443 [ACK] Seq=518 Ack=3367 Win=35968 Len=0 TSval=14637016 TSecr=2784811278"
"315","0.831767273","192.168.1.118","199.232.37.140","TLSv1","583","Client Hello"
"316","0.834715489","199.232.37.140","192.168.1.118","TLSv1.2","5084","Application Data, Application Data, Application Data, Application Data, Application Data, Application Data"
"317","0.840217769","192.168.1.118","199.232.37.140","TLSv1.2","192","Client Key Exchange, Change Cipher Spec, Encrypted Handshake Message"
"318","0.863992338","199.232.37.140","192.168.1.118","TLSv1.2","117","Change Cipher Spec, Encrypted Handshake Message"
"319","0.864086854","192.168.1.118","199.232.37.140","TCP","66","39256 → 443 [ACK] Seq=644 Ack=3322 Win=35840 Len=0 TSval=14637051 TSecr=245359867"
"320","0.870401075","199.232.37.140","192.168.1.118","TCP","66","443 → 39255 [ACK] Seq=1 Ack=518 Win=28160 Len=0 TSval=3226870517 TSecr=14637019"
"321","0.870484741","199.232.37.140","192.168.1.118","TLSv1.2","1418","Server Hello"
"322","0.870525854","192.168.1.118","199.232.37.140","TCP","66","39255 → 443 [ACK] Seq=518 Ack=1353 Win=32000 Len=0 TSval=14637057 TSecr=3226870518"
"323","0.874620460","192.168.1.118","199.232.37.140","TCP","66","39234 → 443 [ACK] Seq=1 Ack=72385 Win=1377 Len=0 TSval=14637062 TSecr=1089452747"
"324","0.876892702","199.232.37.140","192.168.1.118","TLSv1.2","2080","Certificate, Server Key Exchange, Server Hello Done"
"325","0.876979193","192.168.1.118","199.232.37.140","TCP","66","39255 → 443 [ACK] Seq=518 Ack=3367 Win=35968 Len=0 TSval=14637064 TSecr=3226870518"
"326","0.877344043","192.168.1.118","199.232.37.140","TLSv1","583","Client Hello"
"327","0.877646979","192.168.1.118","199.232.37.140","TCP","74","39262 → 443 [SYN] Seq=0 Win=29200 Len=0 MSS=1460 SACK_PERM=1 TSval=14637065 TSecr=0 WS=128"
"328","0.879716364","192.168.1.118","199.232.37.140","TLSv1.2","192","Client Key Exchange, Change Cipher Spec, Encrypted Handshake Message"
"329","0.885952907","192.168.1.118","199.232.37.140","TLSv1.2","192","Client Key Exchange, Change Cipher Spec, Encrypted Handshake Message"
"330","0.886091449","199.232.37.140","192.168.1.118","TLSv1.2","1418","Application Data"
"331","0.888811394","192.168.1.118","199.232.37.140","TLSv1.2","192","Client Key Exchange, Change Cipher Spec, Encrypted Handshake Message"
"332","0.903133533","192.168.1.100","224.0.0.251","MDNS","548","Standard query 0x0000 PTR _uscan._tcp.local, "QM" question PTR _ippusb._tcp.local, "QM" question PTR _uscans._tcp.local, "QM" question PTR _scanner._tcp.local, "QM" question PTR _ipp._tcp.local, "QM" question PTR _ipps._tcp.local, "QM" question PTR _printer._tcp.local, "QM" question PTR _pdl-datastream._tcp.local, "QM" question PTR _ptp._tcp.local, "QM" question PTR _airplay._tcp.local, "QM" question PTR _raop._tcp.local, "QM" question PTR _airport._tcp.local, "QM" question PTR _rdlink._tcp.local, "QM" question PTR _apple-mobdev._tcp.local, "QM" question PTR 8ed307c3._sub._apple-mobdev2._tcp.local, "QM" question PTR _apple-pairable._tcp.local, "QM" question PTR _companion-link._tcp.local, "QM" question PTR _afpovertcp._tcp.local, "QM" question PTR _smb._tcp.local, "QM" question PTR _rfb._tcp.local, "QM" question PTR _adisk._tcp.local, "QM" question PTR _googlecast._tcp.local, "QM" question TXT Google-Home-Mini-2c3f16b2da5c4b6fd6cfbfba61c12490._googlecast._tcp.local, "QM" question PTR cjqg._companion-link._tcp.local PTR cjqg._smb._tcp.local PTR Google-Home-Mini-2c3f16b2da5c4b6fd6cfbfba61c12490._googlecast._tcp.local OPT"
"333","0.906308382","192.168.1.118","199.232.37.140","TLSv1","583","Client Hello"
"334","0.911141126","192.168.1.118","199.232.37.140","TLSv1.2","192","Client Key Exchange, Change Cipher Spec, Encrypted Handshake Message"
"335","0.913604762","192.168.1.118","199.232.37.140","TLSv1.2","192","Client Key Exchange, Change Cipher Spec, Encrypted Handshake Message"
"336","0.915616333","192.168.1.118","199.232.37.140","TLSv1.2","192","Client Key Exchange, Change Cipher Spec, Encrypted Handshake Message"
"337","0.915815940","199.232.37.140","192.168.1.118","TLSv1.2","5474","Application Data, Application Data, Application Data, Application Data"
"338","0.915906818","192.168.1.118","199.232.37.140","TCP","66","39234 → 443 [ACK] Seq=1 Ack=79145 Win=1325 Len=0 TSval=14637103 TSecr=1089452760"
"339","0.915983320","192.168.1.118","199.232.37.140","TLSv1.2","295","Application Data"
"340","0.917472835","199.232.37.140","192.168.1.118","TLSv1.2","10104","Application Data, Application Data, Application Data, Application Data, Application Data, Application Data, Application Data, Application Data, Application Data"
"341","0.918965575","192.168.1.118","199.232.37.140","TCP","66","39234 → 443 [ACK] Seq=1 Ack=89183 Win=1247 Len=0 TSval=14637106 TSecr=1089452760"
"342","0.922474285","199.232.37.140","192.168.1.118","TCP","74","443 → 39262 [SYN, ACK] Seq=0 Ack=1 Win=27040 Len=0 MSS=1364 SACK_PERM=1 TSval=3117666396 TSecr=14637065 WS=512"
"343","0.922609565","192.168.1.118","199.232.37.140","TCP","66","39262 → 443 [ACK] Seq=1 Ack=1 Win=29312 Len=0 TSval=14637110 TSecr=3117666396"
"344","0.922657941","199.232.37.140","192.168.1.118","TLSv1.2","117","Change Cipher Spec, Encrypted Handshake Message"
"345","0.922686855","192.168.1.118","199.232.37.140","TCP","66","39257 → 443 [ACK] Seq=644 Ack=3322 Win=35840 Len=0 TSval=14637110 TSecr=247497447"
"346","0.922706393","199.232.37.140","192.168.1.118","TCP","66","443 → 39260 [ACK] Seq=1 Ack=518 Win=28160 Len=0 TSval=2787800817 TSecr=14637064"
"347","0.922747770","199.232.37.140","192.168.1.118","TLSv1.2","3432","Server Hello, Certificate, Server Key Exchange, Server Hello Done"
"348","0.922772896","192.168.1.118","199.232.37.140","TCP","66","39260 → 443 [ACK] Seq=518 Ack=3367 Win=35968 Len=0 TSval=14637110 TSecr=2787800818"
"349","0.926610867","199.232.37.140","192.168.1.118","TLSv1.2","117","Change Cipher Spec, Encrypted Handshake Message"
"350","0.926705458","192.168.1.118","199.232.37.140","TCP","66","39258 → 443 [ACK] Seq=644 Ack=3300 Win=35712 Len=0 TSval=14637114 TSecr=249018820"
"351","0.926754460","199.232.37.140","192.168.1.118","TLSv1.2","117","Change Cipher Spec, Encrypted Handshake Message"
"352","0.926778473","192.168.1.118","199.232.37.140","TCP","66","39259 → 443 [ACK] Seq=644 Ack=3322 Win=35840 Len=0 TSval=14637114 TSecr=245270046"
"353","0.932744732","199.232.37.140","192.168.1.118","TCP","66","443 → 39261 [ACK] Seq=1 Ack=518 Win=43008 Len=0 TSval=2034798242 TSecr=14637093"
"354","0.940975520","199.232.37.140","192.168.1.118","TLSv1.2","117","Change Cipher Spec, Encrypted Handshake Message"
"355","0.941067123","192.168.1.118","199.232.37.140","TCP","66","39253 → 443 [ACK] Seq=644 Ack=3418 Win=35968 Len=0 TSval=14637128 TSecr=3207096082"
"356","0.941127763","199.232.37.140","192.168.1.118","TLSv1.2","3336","Server Hello, Certificate, Server Key Exchange, Server Hello Done"
"357","0.941154126","192.168.1.118","199.232.37.140","TCP","66","39261 → 443 [ACK] Seq=518 Ack=3271 Win=35840 Len=0 TSval=14637128 TSecr=2034798243"
"358","0.942685342","192.168.1.118","199.232.37.140","TLSv1.2","192","Client Key Exchange, Change Cipher Spec, Encrypted Handshake Message"
"359","0.943020179","199.232.37.140","192.168.1.118","TLSv1.2","1418","Application Data"
"360","0.943110395","192.168.1.118","199.232.37.140","TCP","66","39256 → 443 [ACK] Seq=873 Ack=4674 Win=38528 Len=0 TSval=14637130 TSecr=245359887"
"361","0.948524434","199.232.37.140","192.168.1.118","TLSv1.2","6826","Application Data, Application Data, Application Data, Application Data, Application Data"
"362","0.948621138","192.168.1.118","199.232.37.140","TCP","66","39256 → 443 [ACK] Seq=873 Ack=11434 Win=51968 Len=0 TSval=14637136 TSecr=245359887"
"363","0.958960962","199.232.37.140","192.168.1.118","TLSv1.2","117","Change Cipher Spec, Encrypted Handshake Message"
"364","0.959047428","192.168.1.118","199.232.37.140","TCP","66","39254 → 443 [ACK] Seq=644 Ack=3418 Win=35968 Len=0 TSval=14637146 TSecr=2784811309"
"365","0.959095254","199.232.37.140","192.168.1.118","TLSv1.2","117","Change Cipher Spec, Encrypted Handshake Message"
"366","0.959117255","199.232.37.140","192.168.1.118","TLSv1.2","5474","Application Data, Application Data, Application Data, Application Data"
"367","0.959144281","192.168.1.118","199.232.37.140","TCP","66","39256 → 443 [ACK] Seq=873 Ack=16842 Win=62848 Len=0 TSval=14637146 TSecr=245359887"
"368","0.961043247","199.232.37.140","192.168.1.118","TLSv1.2","117","Change Cipher Spec, Encrypted Handshake Message"
"369","0.962765033","192.168.1.118","199.232.37.140","TLSv1","583","Client Hello"
"370","0.963137283","192.168.1.118","199.232.37.140","TLSv1.2","295","Application Data"
"371","0.963369866","192.168.1.118","199.232.37.140","TLSv1.2","348","Application Data"
"372","0.963622850","192.168.1.118","199.232.37.140","TLSv1.2","295","Application Data"
"373","0.965598557","192.168.1.118","199.232.37.140","TLSv1.2","192","Client Key Exchange, Change Cipher Spec, Encrypted Handshake Message"
"374","0.965836565","192.168.1.118","199.232.37.140","TLSv1.2","373","Application Data"
"375","0.965950832","192.168.1.118","199.232.37.140","TLSv1.2","371","Application Data"
"376","0.966778498","199.232.37.140","192.168.1.118","TLSv1.2","2770","Application Data, Application Data"
"377","0.966822475","192.168.1.118","199.232.37.140","TLSv1.2","374","Application Data"
"378","0.966883052","192.168.1.118","199.232.37.140","TCP","66","39256 → 443 [ACK] Seq=873 Ack=19546 Win=68224 Len=0 TSval=14637154 TSecr=245359892"
"379","0.967087709","192.168.1.118","199.232.37.140","TLSv1.2","372","Application Data"
"380","0.967317342","192.168.1.118","199.232.37.140","TLSv1.2","370","Application Data"
"381","0.967689693","192.168.1.118","199.232.37.140","TLSv1.2","380","Application Data"
"382","0.970250120","199.232.37.140","192.168.1.118","TLSv1.2","2770","Application Data, Application Data"
"383","0.970334123","192.168.1.118","199.232.37.140","TCP","66","39256 → 443 [ACK] Seq=873 Ack=22250 Win=73600 Len=0 TSval=14637157 TSecr=245359893"
"384","0.979638623","199.232.37.140","192.168.1.118","TLSv1.2","1584","Application Data, Application Data"
"385","0.979728239","192.168.1.118","199.232.37.140","TCP","66","39256 → 443 [ACK] Seq=873 Ack=23768 Win=76672 Len=0 TSval=14637167 TSecr=245359893"
"386","0.982649904","199.232.37.140","192.168.1.118","TCP","66","443 → 39262 [ACK] Seq=1 Ack=518 Win=28160 Len=0 TSval=3117666416 TSecr=14637150"
"387","0.982740569","199.232.37.140","192.168.1.118","TLSv1.2","3336","Server Hello, Certificate, Server Key Exchange, Server Hello Done"
"388","0.982787446","192.168.1.118","199.232.37.140","TCP","66","39262 → 443 [ACK] Seq=518 Ack=3271 Win=35840 Len=0 TSval=14637170 TSecr=3117666416"
"389","0.982857198","199.232.37.140","192.168.1.118","TLSv1.2","5474","Application Data, Application Data, Application Data, Application Data"
"390","0.982885187","192.168.1.118","199.232.37.140","TCP","66","39257 → 443 [ACK] Seq=873 Ack=8730 Win=46592 Len=0 TSval=14637170 TSecr=247497466"
"391","0.982970802","199.232.37.140","192.168.1.118","TLSv1.2","1418","Application Data [TCP segment of a reassembled PDU]"
"392","0.982993616","192.168.1.118","199.232.37.140","TCP","66","39257 → 443 [ACK] Seq=873 Ack=10082 Win=49280 Len=0 TSval=14637170 TSecr=247497466"
"393","0.985339810","199.232.37.140","192.168.1.118","TLSv1.2","6826","Application Data, Application Data, Application Data, Application Data, Application Data"
"394","0.985426426","192.168.1.118","199.232.37.140","TCP","66","39257 → 443 [ACK] Seq=873 Ack=16842 Win=62848 Len=0 TSval=14637172 TSecr=247497466"
"395","0.986374884","192.168.1.118","199.232.37.140","TLSv1.2","192","Client Key Exchange, Change Cipher Spec, Encrypted Handshake Message"
"396","0.996470025","192.168.1.102","224.0.0.251","MDNS","183","Standard query response 0x0000 SRV, cache flush 0 0 8009 2c3f16b2-da5c-4b6f-d6cf-bfba61c12490.local"
"397","0.998151471","199.232.37.140","192.168.1.118","TLSv1.2","1418","Application Data"
"398","1.000806714","199.232.37.140","192.168.1.118","TLSv1.2","5474","Application Data, Application Data, Application Data, Application Data"
"399","1.000887217","192.168.1.118","199.232.37.140","TCP","66","39258 → 443 [ACK] Seq=926 Ack=10060 Win=49280 Len=0 TSval=14637188 TSecr=249018838"
"400","1.000923856","199.232.37.140","192.168.1.118","TLSv1.2","133","Application Data"
"401","1.002459409","199.232.37.140","192.168.1.118","TLSv1.2","3323","Application Data, Application Data, Application Data"
"402","1.002566576","192.168.1.118","199.232.37.140","TCP","66","39250 → 443 [ACK] Seq=1261 Ack=10236 Win=50560 Len=0 TSval=14637189 TSecr=4176194303"
"403","1.002621415","199.232.37.140","192.168.1.118","TLSv1.2","1418","Application Data"
"404","1.003033442","199.232.37.140","192.168.1.118","TLSv1.2","2179","Application Data, Application Data, Application Data"
"405","1.003072331","192.168.1.118","199.232.37.140","TCP","66","39252 → 443 [ACK] Seq=1253 Ack=10697 Win=50560 Len=0 TSval=14637190 TSecr=2786663196"
"406","1.003104807","199.232.37.140","192.168.1.118","TLSv1.2","6826","Application Data, Application Data, Application Data, Application Data, Application Data"
"407","1.003133183","192.168.1.118","199.232.37.140","TCP","66","39259 → 443 [ACK] Seq=873 Ack=10082 Win=49280 Len=0 TSval=14637190 TSecr=245270063"
"408","1.007457684","199.232.37.140","192.168.1.118","TLSv1.2","4122","Application Data, Application Data, Application Data"
"409","1.007536712","192.168.1.118","199.232.37.140","TCP","66","39259 → 443 [ACK] Seq=873 Ack=14138 Win=57472 Len=0 TSval=14637194 TSecr=245270063"
"410","1.007591039","199.232.37.140","192.168.1.118","TLSv1.2","1418","Application Data [TCP segment of a reassembled PDU]"
"411","1.009091792","199.232.37.140","192.168.1.118","TLSv1.2","117","Change Cipher Spec, Encrypted Handshake Message"
"412","1.009177970","199.232.37.140","192.168.1.118","TLSv1.2","1418","Application Data [TCP segment of a reassembled PDU]"
"413","1.009215096","192.168.1.118","199.232.37.140","TCP","66","39259 → 443 [ACK] Seq=873 Ack=16842 Win=62848 Len=0 TSval=14637196 TSecr=245270064"
"414","1.009251547","199.232.37.140","192.168.1.118","TLSv1.2","2770","Application Data, Application Data"
"415","1.009282686","192.168.1.118","199.232.37.140","TCP","66","39255 → 443 [ACK] Seq=948 Ack=6122 Win=41344 Len=0 TSval=14637196 TSecr=3226870550"
"416","1.009540657","199.232.37.140","192.168.1.118","TLSv1.2","994","Application Data, Application Data"
"417","1.009592447","199.232.37.140","192.168.1.118","TLSv1.2","3223","Application Data, Application Data, Application Data"
"418","1.009620660","192.168.1.118","199.232.37.140","TCP","66","39253 → 443 [ACK] Seq=952 Ack=6575 Win=42368 Len=0 TSval=14637197 TSecr=3207096098"
"419","1.009653874","199.232.37.140","192.168.1.118","TLSv1.2","3592","Application Data, Application Data, Application Data, Application Data"
"420","1.009675750","192.168.1.118","199.232.37.140","TCP","66","39254 → 443 [ACK] Seq=950 Ack=6944 Win=43008 Len=0 TSval=14637197 TSecr=2784811322"
"421","1.009697238","199.232.37.140","192.168.1.118","TLSv1.2","1418","Application Data"
"422","1.010339235","192.168.1.118","199.232.37.140","TLSv1.2","295","Application Data"
"423","1.014867056","199.232.37.140","192.168.1.118","TLSv1.2","8178","Application Data, Application Data, Application Data, Application Data, Application Data, Application Data"
"424","1.014948934","192.168.1.118","199.232.37.140","TCP","66","39234 → 443 [ACK] Seq=1 Ack=98647 Win=1336 Len=0 TSval=14637202 TSecr=1089452789"
"425","1.015129203","199.232.37.140","192.168.1.118","TLSv1.2","3211","Application Data, Application Data, Application Data, Application Data"
"426","1.015171842","199.232.37.140","192.168.1.118","TLSv1.2","4321","Application Data, Application Data, Application Data, Application Data, Application Data"
"427","1.015206606","199.232.37.140","192.168.1.118","TLSv1.2","4122","Application Data, Application Data, Application Data"
"428","1.015242732","192.168.1.118","199.232.37.140","TCP","66","39260 → 443 [ACK] Seq=958 Ack=7474 Win=44160 Len=0 TSval=14637202 TSecr=2787800841"
"429","1.015529392","192.168.1.118","199.232.37.140","TCP","66","39234 → 443 [ACK] Seq=1 Ack=106047 Win=1279 Len=0 TSval=14637202 TSecr=1089452789"
"430","1.019452242","199.232.37.140","192.168.1.118","TLSv1.2","8178","Application Data, Application Data, Application Data, Application Data, Application Data, Application Data"
"431","1.019540720","192.168.1.118","199.232.37.140","TCP","66","39260 → 443 [ACK] Seq=958 Ack=15586 Win=60288 Len=0 TSval=14637206 TSecr=2787800841"
"432","1.019659149","199.232.37.140","192.168.1.118","TLSv1.2","1418","Application Data [TCP segment of a reassembled PDU]"
"433","1.040603782","192.168.1.118","199.232.37.140","TCP","66","39258 → 443 [ACK] Seq=926 Ack=10127 Win=49280 Len=0 TSval=14637228 TSecr=249018838"
"434","1.043908023","199.232.37.140","192.168.1.118","TLSv1.2","1418","Application Data"
"435","1.046259055","199.232.37.140","192.168.1.118","TLSv1.2","6826","Application Data, Application Data, Application Data, Application Data, Application Data"
"436","1.046339395","192.168.1.118","199.232.37.140","TCP","66","39234 → 443 [ACK] Seq=1 Ack=114159 Win=1352 Len=0 TSval=14637233 TSecr=1089452801"
"437","1.049612335","192.168.1.118","199.232.37.140","TCP","66","39255 → 443 [ACK] Seq=948 Ack=7050 Win=44160 Len=0 TSval=14637237 TSecr=3226870550"
"438","1.054007376","199.232.37.140","192.168.1.118","TLSv1.2","1666","Application Data, Application Data, Application Data"
"439","1.054086879","192.168.1.118","199.232.37.140","TCP","66","39234 → 443 [ACK] Seq=1 Ack=115759 Win=1400 Len=0 TSval=14637241 TSecr=1089452801"
"440","1.057379319","199.232.37.140","192.168.1.118","TLSv1.2","5474","Application Data, Application Data, Application Data, Application Data"
"441","1.057460509","192.168.1.118","199.232.37.140","TCP","66","39257 → 443 [ACK] Seq=873 Ack=22250 Win=73600 Len=0 TSval=14637244 TSecr=247497484"
"442","1.059039527","199.232.37.140","192.168.1.118","TLSv1.2","2770","Application Data, Application Data"
"443","1.059111080","192.168.1.118","199.232.37.140","TCP","66","39257 → 443 [ACK] Seq=873 Ack=24954 Win=79104 Len=0 TSval=14637246 TSecr=247497484"
"444","1.059147731","199.232.37.140","192.168.1.118","TLSv1.2","1418","Application Data [TCP segment of a reassembled PDU]"
"445","1.059580984","192.168.1.118","199.232.37.140","TCP","66","39260 → 443 [ACK] Seq=958 Ack=16938 Win=62976 Len=0 TSval=14637247 TSecr=2787800841"
"446","1.060202530","199.232.37.140","192.168.1.118","TLSv1.2","6826","Application Data, Application Data, Application Data, Application Data"
"447","1.060260982","192.168.1.118","199.232.37.140","TCP","66","39257 → 443 [ACK] Seq=873 Ack=31714 Win=92544 Len=0 TSval=14637247 TSecr=247497484"
"448","1.060301796","199.232.37.140","192.168.1.118","TLSv1.2","5474","Application Data, Application Data, Application Data, Application Data"
"449","1.060329397","192.168.1.118","199.232.37.140","TCP","66","39259 → 443 [ACK] Seq=873 Ack=23602 Win=76416 Len=0 TSval=14637247 TSecr=245270078"
"450","1.063997388","199.232.37.140","192.168.1.118","TLSv1.2","2770","Application Data, Application Data"
"451","1.064074578","192.168.1.118","199.232.37.140","TCP","66","39259 → 443 [ACK] Seq=873 Ack=26306 Win=81792 Len=0 TSval=14637251 TSecr=245270078"
"452","1.064112292","199.232.37.140","192.168.1.118","TLSv1.2","5474","Application Data, Application Data, Application Data, Application Data"
"453","1.064142118","192.168.1.118","199.232.37.140","TCP","66","39260 → 443 [ACK] Seq=958 Ack=22346 Win=73856 Len=0 TSval=14637251 TSecr=2787800855"
"454","1.065627408","199.232.37.140","192.168.1.118","TLSv1.2","1418","Application Data [TCP segment of a reassembled PDU]"
"455","1.066847138","199.232.37.140","192.168.1.118","TLSv1.2","4122","Application Data, Application Data"
"456","1.066919078","192.168.1.118","199.232.37.140","TCP","66","39259 → 443 [ACK] Seq=873 Ack=31714 Win=92544 Len=0 TSval=14637254 TSecr=245270078"
"457","1.066974880","199.232.37.140","192.168.1.118","TLSv1.2","2770","Application Data, Application Data"
"458","1.066999081","192.168.1.118","199.232.37.140","TCP","66","39260 → 443 [ACK] Seq=958 Ack=25050 Win=79232 Len=0 TSval=14637254 TSecr=2787800855"
"459","1.067027419","199.232.37.140","192.168.1.118","TLSv1.2","2770","Application Data, Application Data"
"460","1.067049195","192.168.1.118","199.232.37.140","TCP","66","39259 → 443 [ACK] Seq=873 Ack=34418 Win=98048 Len=0 TSval=14637254 TSecr=245270078"
"461","1.067062258","199.232.37.140","192.168.1.118","TLSv1.2","2770","Application Data [TCP segment of a reassembled PDU]"
"462","1.067080584","192.168.1.118","199.232.37.140","TCP","66","39260 → 443 [ACK] Seq=958 Ack=27754 Win=84608 Len=0 TSval=14637254 TSecr=2787800855"
"463","1.070849916","199.232.37.140","192.168.1.118","TLSv1.2","1418","Application Data [TCP segment of a reassembled PDU]"
"464","1.070928293","192.168.1.118","199.232.37.140","TCP","66","39260 → 443 [ACK] Seq=958 Ack=29106 Win=87424 Len=0 TSval=14637258 TSecr=2787800855"
"465","1.070977320","199.232.37.140","192.168.1.118","TLSv1.2","2770","Application Data, Application Data"
"466","1.071000471","192.168.1.118","199.232.37.140","TCP","66","39259 → 443 [ACK] Seq=873 Ack=37122 Win=103424 Len=0 TSval=14637258 TSecr=245270078"
"467","1.071014059","199.232.37.140","192.168.1.118","TLSv1.2","1418","Application Data [TCP segment of a reassembled PDU]"
"468","1.071035184","192.168.1.118","199.232.37.140","TCP","66","39260 → 443 [ACK] Seq=958 Ack=30458 Win=90112 Len=0 TSval=14637258 TSecr=2787800855"
"469","1.072508211","199.232.37.140","192.168.1.118","TLSv1.2","1418","Application Data [TCP segment of a reassembled PDU]"
"470","1.072601214","192.168.1.118","199.232.37.140","TCP","66","39260 → 443 [ACK] Seq=958 Ack=31810 Win=92800 Len=0 TSval=14637260 TSecr=2787800855"
"471","1.072637041","199.232.37.140","192.168.1.118","TLSv1.2","2770","Application Data, Application Data"
"472","1.072668729","192.168.1.118","199.232.37.140","TCP","66","39261 → 443 [ACK] Seq=873 Ack=6026 Win=41216 Len=0 TSval=14637260 TSecr=2034798366"
"473","1.073174747","199.232.37.140","192.168.1.118","TLSv1.2","7343","Application Data, Application Data, Application Data, Application Data, Application Data, Application Data"
"474","1.073228924","192.168.1.118","199.232.37.140","TCP","66","39261 → 443 [ACK] Seq=873 Ack=13303 Win=55808 Len=0 TSval=14637260 TSecr=2034798366"
"475","1.073261475","199.232.37.140","192.168.1.118","TLSv1.2","117","Change Cipher Spec, Encrypted Handshake Message"
"476","1.073299976","199.232.37.140","192.168.1.118","TLSv1.2","2770","Application Data, Application Data"
"477","1.073325065","192.168.1.118","199.232.37.140","TCP","66","39257 → 443 [ACK] Seq=873 Ack=34418 Win=98048 Len=0 TSval=14637260 TSecr=247497484"
"478","1.073707716","192.168.1.118","199.232.37.140","TLSv1.2","295","Application Data"
"479","1.076518226","199.232.37.140","192.168.1.118","TLSv1.2","2770","Application Data, Application Data"
"480","1.076610080","192.168.1.118","199.232.37.140","TCP","66","39259 → 443 [ACK] Seq=873 Ack=39826 Win=108800 Len=0 TSval=14637264 TSecr=245270078"
"481","1.076649518","199.232.37.140","192.168.1.118","TLSv1.2","1418","Application Data [TCP segment of a reassembled PDU]"
"482","1.076671832","192.168.1.118","199.232.37.140","TCP","66","39257 → 443 [ACK] Seq=873 Ack=35770 Win=100736 Len=0 TSval=14637264 TSecr=247497484"
"483","1.078157346","199.232.37.140","192.168.1.118","TLSv1.2","1432","Application Data, Application Data, Application Data"
"484","1.078232024","192.168.1.118","199.232.37.140","TCP","66","39234 → 443 [ACK] Seq=1 Ack=117125 Win=1410 Len=0 TSval=14637265 TSecr=1089452805"
"485","1.078290951","199.232.37.140","192.168.1.118","TLSv1.2","1418","Application Data [TCP segment of a reassembled PDU]"
"486","1.078312427","192.168.1.118","199.232.37.140","TCP","66","39257 → 443 [ACK] Seq=873 Ack=37122 Win=103424 Len=0 TSval=14637265 TSecr=247497484"
"487","1.078334577","199.232.37.140","192.168.1.118","TLSv1.2","2770","Application Data, Application Data"
"488","1.078357753","192.168.1.118","199.232.37.140","TCP","66","39260 → 443 [ACK] Seq=958 Ack=34514 Win=98176 Len=0 TSval=14637265 TSecr=2787800855"
"489","1.078371166","199.232.37.140","192.168.1.118","TLSv1.2","2770","Application Data, Application Data"
"490","1.078393405","192.168.1.118","199.232.37.140","TCP","66","39257 → 443 [ACK] Seq=873 Ack=39826 Win=108800 Len=0 TSval=14637265 TSecr=247497485"
"491","1.078466520","199.232.37.140","192.168.1.118","TLSv1.2","2770","Application Data, Application Data"
"492","1.078488395","192.168.1.118","199.232.37.140","TCP","66","39259 → 443 [ACK] Seq=873 Ack=42530 Win=114176 Len=0 TSval=14637265 TSecr=245270078"
"493","1.078505196","199.232.37.140","192.168.1.118","TLSv1.2","4122","Application Data, Application Data, Application Data"
"494","1.078525847","192.168.1.118","199.232.37.140","TCP","66","39257 → 443 [ACK] Seq=873 Ack=43882 Win=116864 Len=0 TSval=14637265 TSecr=247497486"
"495","1.078539160","199.232.37.140","192.168.1.118","TLSv1.2","1418","Application Data [TCP segment of a reassembled PDU]"
"496","1.081219466","199.232.37.140","192.168.1.118","TLSv1.2","180","Application Data, Application Data, Application Data"
"497","1.081293306","199.232.37.140","192.168.1.118","TLSv1.2","2770","Application Data, Application Data"
"498","1.081334895","192.168.1.118","199.232.37.140","TCP","66","39260 → 443 [ACK] Seq=958 Ack=37218 Win=103552 Len=0 TSval=14637268 TSecr=2787800855"
"499","1.081384384","199.232.37.140","192.168.1.118","TLSv1.2","2770","Application Data, Application Data"
"500","1.081411773","192.168.1.118","199.232.37.140","TCP","66","39260 → 443 [ACK] Seq=958 Ack=39922 Win=109056 Len=0 TSval=14637268 TSecr=2787800857"
"501","1.083312314","192.168.1.118","199.232.37.140","TCP","66","39234 → 443 [ACK] Seq=1 Ack=117239 Win=1424 Len=0 TSval=14637270 TSecr=1089452807"
"502","1.087595064","199.232.37.140","192.168.1.118","TLSv1.2","2770","Application Data, Application Data"
"503","1.087676167","192.168.1.118","199.232.37.140","TCP","66","39257 → 443 [ACK] Seq=873 Ack=46586 Win=122368 Len=0 TSval=14637275 TSecr=247497491"
"504","1.087713743","199.232.37.140","192.168.1.118","TLSv1.2","2770","Application Data, Application Data"
"505","1.087733694","192.168.1.118","199.232.37.140","TCP","66","39259 → 443 [ACK] Seq=873 Ack=46586 Win=122368 Len=0 TSval=14637275 TSecr=245270080"
"506","1.087831535","199.232.37.140","192.168.1.118","TLSv1.2","2770","Application Data, Application Data"
"507","1.087854973","192.168.1.118","199.232.37.140","TCP","66","39259 → 443 [ACK] Seq=873 Ack=49290 Win=127744 Len=0 TSval=14637275 TSecr=245270085"
"508","1.087931151","199.232.37.140","192.168.1.118","TLSv1.2","10882","Application Data, Application Data, Application Data, Application Data, Application Data, Application Data, Application Data, Application Data"
"509","1.087960964","192.168.1.118","199.232.37.140","TCP","66","39259 → 443 [ACK] Seq=873 Ack=60106 Win=149376 Len=0 TSval=14637275 TSecr=245270086"
"510","1.091649131","199.232.37.140","192.168.1.118","TLSv1.2","2770","Application Data, Application Data"
"511","1.091728009","192.168.1.118","199.232.37.140","TCP","66","39257 → 443 [ACK] Seq=873 Ack=49290 Win=127744 Len=0 TSval=14637279 TSecr=247497491"
"512","1.091771373","199.232.37.140","192.168.1.118","TLSv1.2","5474","Application Data, Application Data, Application Data, Application Data"
"513","1.091794374","192.168.1.118","199.232.37.140","TCP","66","39259 → 443 [ACK] Seq=873 Ack=65514 Win=160128 Len=0 TSval=14637279 TSecr=245270086"
"514","1.093256637","199.232.37.140","192.168.1.118","TLSv1.2","1418","Application Data [TCP segment of a reassembled PDU]"
"515","1.093326690","192.168.1.118","199.232.37.140","TCP","66","39260 → 443 [ACK] Seq=958 Ack=41274 Win=111744 Len=0 TSval=14637280 TSecr=2787800859"
"516","1.094432778","199.232.37.140","192.168.1.118","TLSv1.2","2770","Application Data, Application Data"
"517","1.094463792","192.168.1.118","199.232.37.140","TCP","66","39260 → 443 [ACK] Seq=958 Ack=43978 Win=117120 Len=0 TSval=14637281 TSecr=2787800862"
"518","1.094482555","199.232.37.140","192.168.1.118","TLSv1.2","2770","Application Data [TCP segment of a reassembled PDU]"
"519","1.094501456","192.168.1.118","199.232.37.140","TCP","66","39259 → 443 [ACK] Seq=873 Ack=68218 Win=165632 Len=0 TSval=14637281 TSecr=245270086"
"520","1.094511631","199.232.37.140","192.168.1.118","TLSv1.2","5474","Application Data, Application Data, Application Data, Application Data"
"521","1.094529944","192.168.1.118","199.232.37.140","TCP","66","39257 → 443 [ACK] Seq=873 Ack=54698 Win=138496 Len=0 TSval=14637281 TSecr=247497491"
"522","1.094539582","199.232.37.140","192.168.1.118","TLSv1.2","1418","Application Data [TCP segment of a reassembled PDU]"
"523","1.094565621","192.168.1.118","199.232.37.140","TCP","66","39260 → 443 [ACK] Seq=958 Ack=45330 Win=119808 Len=0 TSval=14637282 TSecr=2787800862"
"524","1.121101049","199.232.37.140","192.168.1.118","TLSv1.2","1418","Application Data [TCP segment of a reassembled PDU]"
"525","1.121179489","192.168.1.118","199.232.37.140","TCP","66","39260 → 443 [ACK] Seq=958 Ack=46682 Win=122496 Len=0 TSval=14637308 TSecr=2787800862"
"526","1.121245217","199.232.37.140","192.168.1.118","TLSv1.2","2770","Application Data, Application Data"
"527","1.121271643","192.168.1.118","199.232.37.140","TCP","66","39259 → 443 [ACK] Seq=873 Ack=70922 Win=171008 Len=0 TSval=14637308 TSecr=245270086"
"528","1.121281881","199.232.37.140","192.168.1.118","TLSv1.2","1418","Application Data [TCP segment of a reassembled PDU]"
"529","1.121299656","192.168.1.118","199.232.37.140","TCP","66","39257 → 443 [ACK] Seq=873 Ack=56050 Win=141312 Len=0 TSval=14637308 TSecr=247497492"
"530","1.122790408","199.232.37.140","192.168.1.118","TLSv1.2","1418","Application Data [TCP segment of a reassembled PDU]"
"531","1.122866011","192.168.1.118","199.232.37.140","TCP","66","39257 → 443 [ACK] Seq=873 Ack=57402 Win=144000 Len=0 TSval=14637310 TSecr=247497492"
"532","1.122901225","199.232.37.140","192.168.1.118","TLSv1.2","2770","Application Data, Application Data"
"533","1.122929376","192.168.1.118","199.232.37.140","TCP","66","39259 → 443 [ACK] Seq=873 Ack=73626 Win=176384 Len=0 TSval=14637310 TSecr=245270086"
"534","1.124158781","199.232.37.140","192.168.1.118","TLSv1.2","2770","Application Data, Application Data"
"535","1.124226534","192.168.1.118","199.232.37.140","TCP","66","39257 → 443 [ACK] Seq=873 Ack=60106 Win=149376 Len=0 TSval=14637311 TSecr=247497492"
"536","1.124303149","199.232.37.140","192.168.1.118","TLSv1.2","5474","Application Data, Application Data, Application Data, Application Data"
"537","1.124327900","192.168.1.118","199.232.37.140","TCP","66","39257 → 443 [ACK] Seq=873 Ack=65514 Win=160128 Len=0 TSval=14637311 TSecr=247497493"
"538","1.124346313","199.232.37.140","192.168.1.118","TLSv1.2","2770","Application Data, Application Data"
"539","1.124364626","192.168.1.118","199.232.37.140","TCP","66","39260 → 443 [ACK] Seq=958 Ack=49386 Win=127872 Len=0 TSval=14637311 TSecr=2787800862"
"540","1.124393677","199.232.37.140","192.168.1.118","TLSv1.2","2770","Application Data, Application Data"
"541","1.124409615","192.168.1.118","199.232.37.140","TCP","66","39260 → 443 [ACK] Seq=958 Ack=52090 Win=133376 Len=0 TSval=14637311 TSecr=2787800863"
"542","1.124427066","199.232.37.140","192.168.1.118","TLSv1.2","2770","Application Data, Application Data"
"543","1.124443254","192.168.1.118","199.232.37.140","TCP","66","39260 → 443 [ACK] Seq=958 Ack=54794 Win=138752 Len=0 TSval=14637311 TSecr=2787800864"
"544","1.124458592","199.232.37.140","192.168.1.118","TLSv1.2","2770","Application Data, Application Data"
"545","1.124479717","192.168.1.118","199.232.37.140","TCP","66","39260 → 443 [ACK] Seq=958 Ack=57498 Win=144128 Len=0 TSval=14637311 TSecr=2787800865"
"546","1.124492505","199.232.37.140","192.168.1.118","TLSv1.2","5474","Application Data, Application Data, Application Data, Application Data"
"547","1.124513531","192.168.1.118","199.232.37.140","TCP","66","39259 → 443 [ACK] Seq=873 Ack=79034 Win=187264 Len=0 TSval=14637311 TSecr=245270087"
"548","1.124523494","199.232.37.140","192.168.1.118","TLSv1.2","8178","Application Data, Application Data, Application Data, Application Data, Application Data"
"549","1.124556720","192.168.1.118","199.232.37.140","TCP","66","39257 → 443 [ACK] Seq=873 Ack=73626 Win=154624 Len=0 TSval=14637311 TSecr=247497494"
"550","1.124566271","199.232.37.140","192.168.1.118","TLSv1.2","1418","Application Data [TCP segment of a reassembled PDU]"
"551","1.124582646","192.168.1.118","199.232.37.140","TCP","66","39260 → 443 [ACK] Seq=958 Ack=58850 Win=146816 Len=0 TSval=14637312 TSecr=2787800866"
"552","1.128691740","199.232.37.140","192.168.1.118","TLSv1.2","1418","Application Data [TCP segment of a reassembled PDU]"
"553","1.128781956","192.168.1.118","199.232.37.140","TCP","66","39260 → 443 [ACK] Seq=958 Ack=60202 Win=149504 Len=0 TSval=14637316 TSecr=2787800866"
"554","1.128835145","199.232.37.140","192.168.1.118","TLSv1.2","2770","Application Data, Application Data"
"555","1.128854096","192.168.1.118","199.232.37.140","TCP","66","39260 → 443 [ACK] Seq=958 Ack=62906 Win=155008 Len=0 TSval=14637316 TSecr=2787800867"
"556","1.128864958","199.232.37.140","192.168.1.118","TLSv1.2","1418","Application Data [TCP segment of a reassembled PDU]"
"557","1.128881347","192.168.1.118","199.232.37.140","TCP","66","39260 → 443 [ACK] Seq=958 Ack=64258 Win=154624 Len=0 TSval=14637316 TSecr=2787800868"
"558","1.130369886","199.232.37.140","192.168.1.118","TCP","1418","443 → 39260 [ACK] Seq=64258 Ack=958 Win=29184 Len=1352 TSval=2787800868 TSecr=14637254 [TCP segment of a reassembled PDU]"
"559","1.130440201","192.168.1.118","199.232.37.140","TCP","66","39260 → 443 [ACK] Seq=958 Ack=65610 Win=153344 Len=0 TSval=14637317 TSecr=2787800868"
"560","1.130473427","199.232.37.140","192.168.1.118","TLSv1.2","2770","Application Data, Application Data"
"561","1.130492440","192.168.1.118","199.232.37.140","TCP","66","39259 → 443 [ACK] Seq=873 Ack=81738 Win=192640 Len=0 TSval=14637317 TSecr=245270093"
"562","1.131567691","199.232.37.140","192.168.1.118","TLSv1.2","1418","Application Data [TCP segment of a reassembled PDU]"
"563","1.131623155","199.232.37.140","192.168.1.118","TLSv1.2","2770","Application Data, Application Data"
"564","1.131664731","192.168.1.118","199.232.37.140","TCP","66","39257 → 443 [ACK] Seq=873 Ack=76330 Win=151936 Len=0 TSval=14637319 TSecr=247497498"
"565","1.131700533","199.232.37.140","192.168.1.118","TLSv1.2","8178","Application Data, Application Data, Application Data, Application Data, Application Data, Application Data"
"566","1.131732521","192.168.1.118","199.232.37.140","TCP","66","39262 → 443 [ACK] Seq=873 Ack=11434 Win=51968 Len=0 TSval=14637319 TSecr=3117666448"
"567","1.135572518","199.232.37.140","192.168.1.118","TLSv1.2","5474","Application Data, Application Data, Application Data, Application Data"
"568","1.135650008","192.168.1.118","199.232.37.140","TCP","66","39262 → 443 [ACK] Seq=873 Ack=16842 Win=62848 Len=0 TSval=14637323 TSecr=3117666448"
"569","1.137220988","199.232.37.140","192.168.1.118","TLSv1.2","2770","Application Data, Application Data"
"570","1.137298479","192.168.1.118","199.232.37.140","TCP","66","39257 → 443 [ACK] Seq=873 Ack=79034 Win=149248 Len=0 TSval=14637324 TSecr=247497498"
"571","1.137336667","199.232.37.140","192.168.1.118","TLSv1.2","1418","Application Data [TCP segment of a reassembled PDU]"
"572","1.137358393","192.168.1.118","199.232.37.140","TCP","66","39259 → 443 [ACK] Seq=873 Ack=84442 Win=198016 Len=0 TSval=14637324 TSecr=245270093"
"573","1.138372954","199.232.37.140","192.168.1.118","TLSv1.2","4122","Application Data, Application Data, Application Data"
"574","1.138449744","192.168.1.118","199.232.37.140","TCP","66","39259 → 443 [ACK] Seq=873 Ack=88498 Win=206208 Len=0 TSval=14637325 TSecr=245270093"
"575","1.138483670","199.232.37.140","192.168.1.118","TLSv1.2","5474","Application Data, Application Data, Application Data, Application Data"
"576","1.138508346","192.168.1.118","199.232.37.140","TCP","66","39257 → 443 [ACK] Seq=873 Ack=84442 Win=143872 Len=0 TSval=14637325 TSecr=247497498"
"577","1.138520571","199.232.37.140","192.168.1.118","TLSv1.2","2770","Application Data, Application Data"
"578","1.138561173","192.168.1.118","199.232.37.140","TCP","66","39260 → 443 [ACK] Seq=958 Ack=68314 Win=150656 Len=0 TSval=14637325 TSecr=2787800869"
"579","1.142680792","199.232.37.140","192.168.1.118","TLSv1.2","2770","Application Data, Application Data"
"580","1.142765307","192.168.1.118","199.232.37.140","TCP","66","39260 → 443 [ACK] Seq=958 Ack=71018 Win=147968 Len=0 TSval=14637330 TSecr=2787800869"
"581","1.142804246","199.232.37.140","192.168.1.118","TLSv1.2","4122","Application Data, Application Data, Application Data"
"582","1.142830010","192.168.1.118","199.232.37.140","TCP","66","39257 → 443 [ACK] Seq=873 Ack=88498 Win=139904 Len=0 TSval=14637330 TSecr=247497499"
"583","1.142843498","199.232.37.140","192.168.1.118","TLSv1.2","2770","Application Data, Application Data"
"584","1.142866911","192.168.1.118","199.232.37.140","TCP","66","39259 → 443 [ACK] Seq=873 Ack=91202 Win=210048 Len=0 TSval=14637330 TSecr=245270093"
"585","1.144273835","199.232.37.140","192.168.1.118","TLSv1.2","1418","Application Data [TCP segment of a reassembled PDU]"
"586","1.144350963","192.168.1.118","199.232.37.140","TCP","66","39257 → 443 [ACK] Seq=873 Ack=89850 Win=138624 Len=0 TSval=14637331 TSecr=247497499"
"587","1.145432863","199.232.37.140","192.168.1.118","TLSv1.2","2770","Application Data, Application Data"
"588","1.145505691","199.232.37.140","192.168.1.118","TLSv1.2","2770","Application Data, Application Data"
"589","1.145559255","192.168.1.118","199.232.37.140","TCP","66","39260 → 443 [ACK] Seq=958 Ack=73722 Win=145280 Len=0 TSval=14637332 TSecr=2787800870"
"590","1.145591319","199.232.37.140","192.168.1.118","TLSv1.2","2770","Application Data, Application Data"
"591","1.145606244","199.232.37.140","192.168.1.118","TLSv1.2","2770","Application Data, Application Data"
"592","1.149162569","192.168.1.118","199.232.37.140","TCP","66","39257 → 443 [ACK] Seq=873 Ack=92554 Win=135936 Len=0 TSval=14637336 TSecr=247497499"
"593","1.149287611","199.232.37.140","192.168.1.118","TLSv1.2","2770","Application Data, Application Data"
"594","1.149366851","192.168.1.118","199.232.37.140","TCP","66","39260 → 443 [ACK] Seq=958 Ack=76426 Win=142592 Len=0 TSval=14637336 TSecr=2787800870"
"595","1.149402777","199.232.37.140","192.168.1.118","TLSv1.2","2770","Application Data, Application Data"
"596","1.150744587","192.168.1.118","199.232.37.140","TCP","66","39257 → 443 [ACK] Seq=873 Ack=95258 Win=133248 Len=0 TSval=14637338 TSecr=247497500"
"597","1.150927806","199.232.37.140","192.168.1.118","TLSv1.2","4122","Application Data, Application Data, Application Data"
"598","1.150937581","192.168.1.118","199.232.37.140","TCP","66","39259 → 443 [ACK] Seq=873 Ack=96610 Win=204672 Len=0 TSval=14637338 TSecr=245270093"
"599","1.150977082","199.232.37.140","192.168.1.118","TLSv1.2","2770","Application Data, Application Data"
"600","1.151667369","192.168.1.118","199.232.37.140","TCP","66","39259 → 443 [ACK] Seq=873 Ack=100666 Win=200704 Len=0 TSval=14637339 TSecr=245270094"
"601","1.151809136","192.168.1.118","199.232.37.140","TCP","66","39257 → 443 [ACK] Seq=873 Ack=97962 Win=130560 Len=0 TSval=14637339 TSecr=247497500"
"602","1.152085584","199.232.37.140","192.168.1.118","TLSv1.2","1418","Application Data [TCP segment of a reassembled PDU]"
"603","1.152170474","199.232.37.140","192.168.1.118","TLSv1.2","2770","Application Data, Application Data"
"604","1.152216288","192.168.1.118","199.232.37.140","TCP","66","39260 → 443 [ACK] Seq=958 Ack=79130 Win=139904 Len=0 TSval=14637339 TSecr=2787800871"
"605","1.152255340","199.232.37.140","192.168.1.118","TLSv1.2","2770","Application Data, Application Data"
"606","1.152268915","199.232.37.140","192.168.1.118","TLSv1.2","2770","Application Data, Application Data"
"607","1.154221246","192.168.1.118","199.232.37.140","TCP","66","39257 → 443 [ACK] Seq=873 Ack=100666 Win=127872 Len=0 TSval=14637341 TSecr=247497501"
"608","1.154490980","192.168.1.118","199.232.37.140","TCP","66","39259 → 443 [ACK] Seq=873 Ack=104722 Win=196736 Len=0 TSval=14637341 TSecr=245270094"
"609","1.155178829","199.232.37.140","192.168.1.118","TLSv1.2","1418","Application Data [TCP segment of a reassembled PDU]"
"610","1.159360201","199.232.37.140","192.168.1.118","TCP","1418","443 → 39259 [ACK] Seq=106074 Ack=873 Win=29184 Len=1352 TSval=245270095 TSecr=14637281 [TCP segment of a reassembled PDU]"
"611","1.159433816","192.168.1.118","199.232.37.140","TCP","66","39259 → 443 [ACK] Seq=873 Ack=107426 Win=214272 Len=0 TSval=14637346 TSecr=245270095"
"612","1.159481918","199.232.37.140","192.168.1.118","TLSv1.2","2770","Application Data, Application Data"
"613","1.159502456","192.168.1.118","199.232.37.140","TCP","66","39257 → 443 [ACK] Seq=873 Ack=103370 Win=141952 Len=0 TSval=14637346 TSecr=247497501"
"614","1.159528719","199.232.37.140","192.168.1.118","TLSv1.2","2770","Application Data, Application Data"
"615","1.159564070","192.168.1.118","199.232.37.140","TCP","66","39260 → 443 [ACK] Seq=958 Ack=81834 Win=160384 Len=0 TSval=14637346 TSecr=2787800871"
"616","1.159606222","199.232.37.140","192.168.1.118","TLSv1.2","2770","Application Data, Application Data"
"617","1.159632635","199.232.37.140","192.168.1.118","TLSv1.2","5474","Application Data, Application Data, Application Data, Application Data"
"618","1.159647486","199.232.37.140","192.168.1.118","TLSv1.2","2770","Application Data, Application Data"
"619","1.159656124","199.232.37.140","192.168.1.118","TLSv1.2","2770","Application Data [TCP segment of a reassembled PDU]"
"620","1.162772270","192.168.1.118","199.232.37.140","TCP","66","39260 → 443 [ACK] Seq=958 Ack=84538 Win=158720 Len=0 TSval=14637350 TSecr=2787800872"
"621","1.162975115","199.232.37.140","192.168.1.118","TLSv1.2","2770","Application Data, Application Data"
"622","1.163031517","199.232.37.140","192.168.1.118","TLSv1.2","2770","Application Data, Application Data"
"623","1.163181359","192.168.1.118","199.232.37.140","TCP","66","39257 → 443 [ACK] Seq=873 Ack=108778 Win=136576 Len=0 TSval=14637350 TSecr=247497501"
"624","1.163253525","192.168.1.118","199.232.37.140","TCP","66","39259 → 443 [ACK] Seq=873 Ack=115538 Win=207616 Len=0 TSval=14637350 TSecr=245270096"
"625","1.163332477","192.168.1.118","199.232.37.140","TCP","66","39260 → 443 [ACK] Seq=958 Ack=87242 Win=156032 Len=0 TSval=14637350 TSecr=2787800872"
"626","1.164653486","199.232.37.140","192.168.1.118","TLSv1.2","5474","Application Data, Application Data, Application Data, Application Data"
"627","1.164824079","192.168.1.118","199.232.37.140","TCP","66","39259 → 443 [ACK] Seq=873 Ack=120946 Win=202240 Len=0 TSval=14637352 TSecr=245270097"
"628","1.165402900","199.232.37.140","192.168.1.118","TLSv1.2","2037","Application Data, Application Data, Application Data"
"629","1.165469227","199.232.37.140","192.168.1.118","TLSv1.2","1418","Application Data [TCP segment of a reassembled PDU]"
"630","1.165503741","199.232.37.140","192.168.1.118","TLSv1.2","2770","Application Data, Application Data"
"631","1.165516954","199.232.37.140","192.168.1.118","TLSv1.2","78","Application Data"
"632","1.165528967","199.232.37.140","192.168.1.118","TLSv1.2","2770","Application Data, Application Data"
"633","1.166624755","192.168.1.118","199.232.37.140","TCP","66","39260 → 443 [ACK] Seq=958 Ack=91298 Win=152064 Len=0 TSval=14637354 TSecr=2787800873"
"634","1.166953029","192.168.1.118","199.232.37.140","TCP","66","39257 → 443 [ACK] Seq=873 Ack=111494 Win=133888 Len=0 TSval=14637354 TSecr=247497504"
"635","1.167079546","199.232.37.140","192.168.1.118","TLSv1.2","2770","Application Data, Application Data"
"636","1.168701628","192.168.1.118","199.232.37.140","TCP","66","39259 → 443 [ACK] Seq=873 Ack=122917 Win=200320 Len=0 TSval=14637356 TSecr=245270097"
"637","1.168821857","192.168.1.118","199.232.37.140","TCP","66","39260 → 443 [ACK] Seq=958 Ack=94002 Win=149376 Len=0 TSval=14637356 TSecr=2787800875"
"638","1.168882109","199.232.37.140","192.168.1.118","TLSv1.2","2770","Application Data, Application Data"
"639","1.168949099","199.232.37.140","192.168.1.118","TLSv1.2","2770","Application Data, Application Data"
"640","1.169444154","192.168.1.118","199.232.37.140","TCP","66","39260 → 443 [ACK] Seq=958 Ack=99410 Win=144000 Len=0 TSval=14637356 TSecr=2787800875"
"641","1.170669934","199.232.37.140","192.168.1.118","TLSv1.2","2770","Application Data, Application Data"
"642","1.170729461","199.232.37.140","192.168.1.118","TLSv1.2","2770","Application Data, Application Data"
"643","1.170850715","199.232.37.140","192.168.1.118","TLSv1.2","100","Application Data"
"644","1.170892504","199.232.37.140","192.168.1.118","TLSv1.2","5474","Application Data, Application Data, Application Data"
"645","1.170910467","199.232.37.140","192.168.1.118","TLSv1.2","1418","Application Data [TCP segment of a reassembled PDU]"
"646","1.170943294","192.168.1.118","199.232.37.140","TCP","66","39234 → 443 [ACK] Seq=1 Ack=117273 Win=1424 Len=0 TSval=14637358 TSecr=1089452826"
"647","1.171023884","192.168.1.118","199.232.37.140","TCP","66","39260 → 443 [ACK] Seq=958 Ack=111578 Win=131840 Len=0 TSval=14637358 TSecr=2787800875"
"648","1.174956547","199.232.37.140","192.168.1.118","TLSv1.2","5474","Application Data, Application Data, Application Data, Application Data"
"649","1.176619742","199.232.37.140","192.168.1.118","TLSv1.2","1418","Application Data [TCP segment of a reassembled PDU]"
"650","1.176692670","199.232.37.140","192.168.1.118","TLSv1.2","2770","Application Data, Application Data"
"651","1.176819312","192.168.1.118","199.232.37.140","TCP","66","39260 → 443 [ACK] Seq=958 Ack=121042 Win=122496 Len=0 TSval=14637364 TSecr=2787800878"
"652","1.177558700","199.232.37.140","192.168.1.118","TLSv1.2","1697","Application Data, Application Data"
"653","1.177629178","192.168.1.118","199.232.37.140","TCP","66","39262 → 443 [ACK] Seq=873 Ack=18473 Win=66048 Len=0 TSval=14637365 TSecr=3117666460"
"654","1.177678404","199.232.37.140","192.168.1.118","TLSv1.2","5474","Application Data, Application Data, Application Data, Application Data"
"655","1.177720743","199.232.37.140","192.168.1.118","TLSv1.2","4122","Application Data, Application Data, Application Data"
"656","1.177859173","192.168.1.118","199.232.37.140","TCP","66","39260 → 443 [ACK] Seq=958 Ack=130506 Win=113152 Len=0 TSval=14637365 TSecr=2787800879"
"657","1.180707560","199.232.37.140","192.168.1.118","TLSv1.2","4122","Application Data, Application Data, Application Data"
"658","1.180788051","192.168.1.118","199.232.37.140","TCP","66","39260 → 443 [ACK] Seq=958 Ack=134562 Win=117376 Len=0 TSval=14637368 TSecr=2787800881"
"659","1.180827515","199.232.37.140","192.168.1.118","TLSv1.2","1418","Application Data [TCP segment of a reassembled PDU]"
"660","1.182364368","199.232.37.140","192.168.1.118","TLSv1.2","1418","Application Data [TCP segment of a reassembled PDU]"
"661","1.182429971","199.232.37.140","192.168.1.118","TLSv1.2","2770","Application Data, Application Data"
"662","1.182907775","192.168.1.118","199.232.37.140","TCP","66","39260 → 443 [ACK] Seq=958 Ack=139970 Win=112000 Len=0 TSval=14637370 TSecr=2787800881"
"663","1.183185085","199.232.37.140","192.168.1.118","TLSv1.2","2770","Application Data, Application Data"
"664","1.183237874","199.232.37.140","192.168.1.118","TLSv1.2","2770","Application Data [TCP segment of a reassembled PDU]"
"665","1.183263862","199.232.37.140","192.168.1.118","TLSv1.2","2770","Application Data, Application Data"
"666","1.183289501","199.232.37.140","192.168.1.118","TLSv1.2","2770","Application Data, Application Data"
"667","1.183351615","192.168.1.118","199.232.37.140","TCP","66","39260 → 443 [ACK] Seq=958 Ack=150786 Win=148096 Len=0 TSval=14637370 TSecr=2787800882"
"668","1.195474052","199.232.37.140","192.168.1.118","TLSv1.2","1418","Application Data [TCP segment of a reassembled PDU]"
"669","1.199823017","199.232.37.140","192.168.1.118","TLSv1.2","1418","Application Data [TCP segment of a reassembled PDU]"
"670","1.199905457","192.168.1.118","199.232.37.140","TCP","66","39260 → 443 [ACK] Seq=958 Ack=153490 Win=163072 Len=0 TSval=14637387 TSecr=2787800891"
"671","1.199951384","199.232.37.140","192.168.1.118","TLSv1.2","1418","Application Data [TCP segment of a reassembled PDU]"
"672","1.199971197","192.168.1.118","199.232.37.140","TCP","66","39260 → 443 [ACK] Seq=958 Ack=154842 Win=165760 Len=0 TSval=14637387 TSecr=2787800891"
"673","1.202038694","199.232.37.140","192.168.1.118","TLSv1.2","4122","Application Data, Application Data, Application Data"
"674","1.202115635","192.168.1.118","199.232.37.140","TCP","66","39260 → 443 [ACK] Seq=958 Ack=158898 Win=166528 Len=0 TSval=14637389 TSecr=2787800891"
"675","1.202159024","199.232.37.140","192.168.1.118","TLSv1.2","1418","Application Data [TCP segment of a reassembled PDU]"
"676","1.204018301","199.232.37.140","192.168.1.118","TLSv1.2","1418","Application Data [TCP segment of a reassembled PDU]"
"677","1.204087604","199.232.37.140","192.168.1.118","TLSv1.2","2770","Application Data, Application Data"
"678","1.206430298","192.168.1.118","199.232.37.140","TCP","66","39260 → 443 [ACK] Seq=958 Ack=164306 Win=161152 Len=0 TSval=14637393 TSecr=2787800891"
"679","1.209337387","199.232.37.140","192.168.1.118","TLSv1.2","1418","Application Data [TCP segment of a reassembled PDU]"
"680","1.212242264","199.232.37.140","192.168.1.118","TLSv1.2","1418","Application Data [TCP segment of a reassembled PDU]"
"681","1.212317142","199.232.37.140","192.168.1.118","TLSv1.2","2770","Application Data, Application Data"
"682","1.212333417","199.232.37.140","192.168.1.118","TLSv1.2","1418","Application Data [TCP segment of a reassembled PDU]"
"683","1.212407232","199.232.37.140","192.168.1.118","TLSv1.2","1418","Application Data [TCP segment of a reassembled PDU]"
"684","1.212420970","199.232.37.140","192.168.1.118","TLSv1.2","1418","Application Data [TCP segment of a reassembled PDU]"
"685","1.214004476","199.232.37.140","192.168.1.118","TLSv1.2","3262","Application Data, Application Data, Application Data"
"686","1.217026506","192.168.1.118","199.232.37.140","TCP","66","39260 → 443 [ACK] Seq=958 Ack=176966 Win=148608 Len=0 TSval=14637404 TSecr=2787800892"
"687","1.637698304","192.168.1.118","199.232.37.140","TLSv1.2","249","Application Data"
"688","1.653795780","199.232.37.140","192.168.1.118","TLSv1.2","1151","Application Data, Application Data"
"689","1.653908634","192.168.1.118","199.232.37.140","TCP","66","39245 → 443 [ACK] Seq=1433 Ack=19774 Win=69120 Len=0 TSval=14637841 TSecr=2786597393"
"690","4.131111433","192.168.1.118","192.168.1.102","TCP","176","45592 → 8009 [PSH, ACK] Seq=1 Ack=1 Win=387 Len=110 TSval=14640318 TSecr=3442702 [TCP segment of a reassembled PDU]"
"691","4.153350899","192.168.1.102","192.168.1.118","TCP","176","8009 → 45592 [PSH, ACK] Seq=1 Ack=111 Win=299 Len=110 TSval=3443203 TSecr=14640318 [TCP segment of a reassembled PDU]"
"692","4.153453415","192.168.1.118","192.168.1.102","TCP","66","45592 → 8009 [ACK] Seq=111 Ack=111 Win=387 Len=0 TSval=14640340 TSecr=3443203"
"693","5.300839672","IntelCor_b7:52:73","Cisco-Li_5b:1c:ce","ARP","60","Who has 192.168.1.1? Tell 192.168.1.118"
"694","5.306243173","Cisco-Li_5b:1c:ce","IntelCor_b7:52:73","ARP","42","192.168.1.1 is at 58:6d:8f:5b:1c:ce"
"695","5.913080887","192.168.1.104","255.255.255.255","UDP","217","49154 → 6666 Len=175"
"696","8.985892581","192.168.1.104","255.255.255.255","UDP","217","49154 → 6666 Len=175"
"697","9.155242933","192.168.1.118","192.168.1.102","TCP","176","45592 → 8009 [PSH, ACK] Seq=111 Ack=111 Win=387 Len=110 TSval=14645342 TSecr=3443203 [TCP segment of a reassembled PDU]"
"698","9.170039876","192.168.1.102","192.168.1.118","TCP","176","8009 → 45592 [PSH, ACK] Seq=111 Ack=221 Win=299 Len=110 TSval=3443705 TSecr=14645342 [TCP segment of a reassembled PDU]"
"699","9.170136079","192.168.1.118","192.168.1.102","TCP","66","45592 → 8009 [ACK] Seq=221 Ack=221 Win=387 Len=0 TSval=14645357 TSecr=3443705"
"700","9.195814178","192.168.1.100","224.0.0.251","MDNS","534","Standard query 0x0000 PTR _uscan._tcp.local, "QM" question PTR _ippusb._tcp.local, "QM" question PTR _uscans._tcp.local, "QM" question PTR _scanner._tcp.local, "QM" question PTR _ipp._tcp.local, "QM" question PTR _ipps._tcp.local, "QM" question PTR _printer._tcp.local, "QM" question PTR _pdl-datastream._tcp.local, "QM" question PTR _ptp._tcp.local, "QM" question PTR _airplay._tcp.local, "QM" question PTR _raop._tcp.local, "QM" question PTR _airport._tcp.local, "QM" question PTR _rdlink._tcp.local, "QM" question PTR _apple-mobdev._tcp.local, "QM" question PTR 8ed307c3._sub._apple-mobdev2._tcp.local, "QM" question PTR _apple-pairable._tcp.local, "QM" question PTR _companion-link._tcp.local, "QM" question PTR _afpovertcp._tcp.local, "QM" question PTR _smb._tcp.local, "QM" question PTR _rfb._tcp.local, "QM" question PTR _adisk._tcp.local, "QM" question PTR _googlecast._tcp.local, "QM" question TXT Google-Home-Mini-2c3f16b2da5c4b6fd6cfbfba61c12490._googlecast._tcp.local, "QM" question PTR cjqg._companion-link._tcp.local PTR cjqg._smb._tcp.local OPT"
"701","9.293765581","192.168.1.102","224.0.0.251","MDNS","409","Standard query response 0x0000 PTR Google-Home-Mini-2c3f16b2da5c4b6fd6cfbfba61c12490._googlecast._tcp.local TXT, cache flush SRV, cache flush 0 0 8009 2c3f16b2-da5c-4b6f-d6cf-bfba61c12490.local A, cache flush 192.168.1.102"
