frame.number,_ws.col.Time,_ws.col.Source,_ws.col.Destination,_ws.col.Protocol,frame.len,_ws.col.Info
"1","0.000000000","199.232.37.140","192.168.1.118","TLSv1.2","117","Change Cipher Spec, Encrypted Handshake Message"
"2","0.000111354","192.168.1.118","199.232.37.140","TCP","66","38766 → 443 [ACK] Seq=1 Ack=52 Win=280 Len=0 TSval=13649962 TSecr=3022339066"
"3","0.002893926","199.232.37.140","192.168.1.118","TCP","66","443 → 38770 [ACK] Seq=1 Ack=1 Win=55 Len=0 TSval=245113102 TSecr=13649927"
"4","0.002971017","199.232.37.140","192.168.1.118","TLSv1.2","117","Change Cipher Spec, Encrypted Handshake Message"
"5","0.003014368","192.168.1.118","199.232.37.140","TCP","66","38768 → 443 [ACK] Seq=1 Ack=52 Win=280 Len=0 TSval=13649964 TSecr=248034771"
"6","0.003072283","199.232.37.140","192.168.1.118","TLSv1.2","117","Change Cipher Spec, Encrypted Handshake Message"
"7","0.003096909","192.168.1.118","199.232.37.140","TCP","66","38767 → 443 [ACK] Seq=1 Ack=52 Win=279 Len=0 TSval=13649965 TSecr=3098931034"
"8","0.004310464","199.232.37.140","192.168.1.118","TLSv1.2","3336","Server Hello, Certificate, Server Key Exchange, Server Hello Done"
"9","0.004383904","192.168.1.118","199.232.37.140","TCP","66","38770 → 443 [ACK] Seq=1 Ack=3271 Win=280 Len=0 TSval=13649966 TSecr=245113102"
"10","0.004742554","192.168.1.118","199.232.37.140","TLSv1","583","Client Hello"
"11","0.007392046","192.168.1.118","199.232.37.140","TLSv1.2","192","Client Key Exchange, Change Cipher Spec, Encrypted Handshake Message"
"12","0.009667351","192.168.1.118","199.232.37.140","TLSv1.2","192","Client Key Exchange, Change Cipher Spec, Encrypted Handshake Message"
"13","0.010068140","192.168.1.118","199.232.37.140","TLSv1.2","295","Application Data"
"14","0.010305773","192.168.1.118","199.232.37.140","TLSv1.2","348","Application Data"
"15","0.010509793","192.168.1.118","199.232.37.140","TLSv1.2","295","Application Data"
"16","0.041784025","199.232.37.140","192.168.1.118","TLSv1.2","117","Change Cipher Spec, Encrypted Handshake Message"
"17","0.042934428","199.232.37.140","192.168.1.118","TCP","66","443 → 38771 [ACK] Seq=1 Ack=518 Win=55 Len=0 TSval=3887008624 TSecr=13649966"
"18","0.042995855","199.232.37.140","192.168.1.118","TLSv1.2","117","Change Cipher Spec, Encrypted Handshake Message"
"19","0.043027569","199.232.37.140","192.168.1.118","TLSv1.2","1418","Application Data"
"20","0.043212488","192.168.1.118","199.232.37.140","TLSv1.2","380","Application Data"
"21","0.043496247","192.168.1.118","199.232.37.140","TLSv1.2","295","Application Data"
"22","0.045429565","199.232.37.140","192.168.1.118","TLSv1.2","6826","Application Data, Application Data, Application Data, Application Data, Application Data"
"23","0.045520806","192.168.1.118","199.232.37.140","TCP","66","38768 → 443 [ACK] Seq=230 Ack=8164 Win=406 Len=0 TSval=13650007 TSecr=248034782"
"24","0.045559995","199.232.37.140","192.168.1.118","TLSv1.2","1418","Application Data"
"25","0.056640220","199.232.37.140","192.168.1.118","TLSv1.2","2770","Application Data, Application Data"
"26","0.056720735","192.168.1.118","199.232.37.140","TCP","66","38766 → 443 [ACK] Seq=230 Ack=4108 Win=343 Len=0 TSval=13650018 TSecr=3022339109"
"27","0.056762687","199.232.37.140","192.168.1.118","TLSv1.2","2770","Application Data, Application Data"
"28","0.056782837","192.168.1.118","199.232.37.140","TCP","66","38768 → 443 [ACK] Seq=230 Ack=10868 Win=449 Len=0 TSval=13650018 TSecr=248034782"
"29","0.058313629","199.232.37.140","192.168.1.118","TLSv1.2","4122","Application Data, Application Data, Application Data"
"30","0.058404507","192.168.1.118","199.232.37.140","TCP","66","38766 → 443 [ACK] Seq=230 Ack=8164 Win=406 Len=0 TSval=13650020 TSecr=3022339109"
"31","0.059476307","199.232.37.140","192.168.1.118","TLSv1.2","2770","Application Data, Application Data"
"32","0.059546297","192.168.1.118","199.232.37.140","TCP","66","38768 → 443 [ACK] Seq=230 Ack=13572 Win=491 Len=0 TSval=13650021 TSecr=248034782"
"33","0.059577773","199.232.37.140","192.168.1.118","TLSv1.2","5474","Application Data, Application Data, Application Data, Application Data"
"34","0.059604086","192.168.1.118","199.232.37.140","TCP","66","38766 → 443 [ACK] Seq=230 Ack=13572 Win=491 Len=0 TSval=13650021 TSecr=3022339109"
"35","0.059613674","199.232.37.140","192.168.1.118","TLSv1.2","4122","Application Data, Application Data, Application Data"
"36","0.059641150","192.168.1.118","199.232.37.140","TCP","66","38767 → 443 [ACK] Seq=283 Ack=4108 Win=343 Len=0 TSval=13650021 TSecr=3098931045"
"37","0.061582168","199.232.37.140","192.168.1.118","TLSv1.2","2770","Application Data, Application Data"
"38","0.061665883","192.168.1.118","199.232.37.140","TCP","66","38767 → 443 [ACK] Seq=283 Ack=6812 Win=385 Len=0 TSval=13650023 TSecr=3098931045"
"39","0.061699922","199.232.37.140","192.168.1.118","TLSv1.2","133","Application Data"
"40","0.061732298","199.232.37.140","192.168.1.118","TLSv1.2","3336","Server Hello, Certificate, Server Key Exchange, Server Hello Done"
"41","0.061753599","192.168.1.118","199.232.37.140","TCP","66","38771 → 443 [ACK] Seq=518 Ack=3271 Win=280 Len=0 TSval=13650023 TSecr=3887008624"
"42","0.064146345","199.232.37.140","192.168.1.118","TLSv1.2","2770","Application Data, Application Data"
"43","0.064227311","192.168.1.118","199.232.37.140","TCP","66","38768 → 443 [ACK] Seq=230 Ack=16276 Win=533 Len=0 TSval=13650026 TSecr=248034787"
"44","0.064263262","199.232.37.140","192.168.1.118","TLSv1.2","1418","Application Data"
"45","0.066765699","199.232.37.140","192.168.1.118","TLSv1.2","5474","Application Data, Application Data, Application Data, Application Data"
"46","0.066851915","192.168.1.118","199.232.37.140","TCP","66","38769 → 443 [ACK] Seq=441 Ack=6812 Win=387 Len=0 TSval=13650028 TSecr=2786651809"
"47","0.068407182","199.232.37.140","192.168.1.118","TLSv1.2","4122","Application Data, Application Data, Application Data"
"48","0.068482534","192.168.1.118","199.232.37.140","TCP","66","38769 → 443 [ACK] Seq=441 Ack=10868 Win=450 Len=0 TSval=13650030 TSecr=2786651809"
"49","0.069253849","199.232.37.140","192.168.1.118","TLSv1.2","2770","Application Data, Application Data"
"50","0.069301263","192.168.1.118","199.232.37.140","TCP","66","38769 → 443 [ACK] Seq=441 Ack=13572 Win=492 Len=0 TSval=13650031 TSecr=2786651809"
"51","0.069324076","199.232.37.140","192.168.1.118","TLSv1.2","8178","Application Data, Application Data, Application Data, Application Data, Application Data, Application Data"
"52","0.069355803","192.168.1.118","199.232.37.140","TCP","66","38770 → 443 [ACK] Seq=356 Ack=11434 Win=406 Len=0 TSval=13650031 TSecr=245113118"
"53","0.072060285","199.232.37.140","192.168.1.118","TLSv1.2","5474","Application Data, Application Data, Application Data, Application Data"
"54","0.072140550","192.168.1.118","199.232.37.140","TCP","66","38770 → 443 [ACK] Seq=356 Ack=16842 Win=491 Len=0 TSval=13650034 TSecr=245113118"
"55","0.072231691","199.232.37.140","192.168.1.118","TLSv1.2","2770","Application Data, Application Data"
"56","0.072253966","192.168.1.118","199.232.37.140","TCP","66","38768 → 443 [ACK] Seq=230 Ack=18980 Win=575 Len=0 TSval=13650034 TSecr=248034787"
"57","0.074251974","199.232.37.140","192.168.1.118","TLSv1.2","1418","Application Data [TCP segment of a reassembled PDU]"
"58","0.078902524","199.232.37.140","192.168.1.118","TLSv1.2","1418","Application Data [TCP segment of a reassembled PDU]"
"59","0.078986352","192.168.1.118","199.232.37.140","TCP","66","38768 → 443 [ACK] Seq=230 Ack=21684 Win=618 Len=0 TSval=13650040 TSecr=248034787"
"60","0.079025203","199.232.37.140","192.168.1.118","TLSv1.2","4122","Application Data, Application Data, Application Data"
"61","0.079061042","192.168.1.118","199.232.37.140","TCP","66","38766 → 443 [ACK] Seq=230 Ack=17628 Win=554 Len=0 TSval=13650041 TSecr=3022339140"
"62","0.079132120","199.232.37.140","192.168.1.118","TLSv1.2","2770","Application Data, Application Data"
"63","0.079156058","192.168.1.118","199.232.37.140","TCP","66","38766 → 443 [ACK] Seq=230 Ack=20332 Win=597 Len=0 TSval=13650041 TSecr=3022339140"
"64","0.081176266","199.232.37.140","192.168.1.118","TLSv1.2","1418","Application Data [TCP segment of a reassembled PDU]"
"65","0.081256844","199.232.37.140","192.168.1.118","TLSv1.2","4122","Application Data, Application Data"
"66","0.081297845","192.168.1.118","199.232.37.140","TCP","66","38766 → 443 [ACK] Seq=230 Ack=25740 Win=681 Len=0 TSval=13650043 TSecr=3022339140"
"67","0.081383423","199.232.37.140","192.168.1.118","TLSv1.2","2770","Application Data, Application Data"
"68","0.081402224","192.168.1.118","199.232.37.140","TCP","66","38766 → 443 [ACK] Seq=230 Ack=28444 Win=723 Len=0 TSval=13650043 TSecr=3022339140"
"69","0.092047672","199.232.37.140","192.168.1.118","TLSv1.2","1418","Application Data [TCP segment of a reassembled PDU]"
"70","0.093599026","199.232.37.140","192.168.1.118","TLSv1.2","1418","Application Data [TCP segment of a reassembled PDU]"
"71","0.094180934","192.168.1.118","199.232.37.140","TLSv1.2","192","Client Key Exchange, Change Cipher Spec, Encrypted Handshake Message"
"72","0.097595441","199.232.37.140","192.168.1.118","TLSv1.2","1418","Application Data [TCP segment of a reassembled PDU]"
"73","0.097679481","192.168.1.118","199.232.37.140","TCP","66","38768 → 443 [ACK] Seq=230 Ack=24388 Win=660 Len=0 TSval=13650059 TSecr=248034788"
"74","0.097719670","199.232.37.140","192.168.1.118","TLSv1.2","1418","Application Data [TCP segment of a reassembled PDU]"
"75","0.097741446","192.168.1.118","199.232.37.140","TCP","66","38766 → 443 [ACK] Seq=230 Ack=31148 Win=766 Len=0 TSval=13650059 TSecr=3022339140"
"76","0.100481817","199.232.37.140","192.168.1.118","TLSv1.2","1418","Application Data [TCP segment of a reassembled PDU]"
"77","0.101084450","192.168.1.118","199.232.37.140","TCP","66","38767 → 443 [ACK] Seq=283 Ack=6879 Win=385 Len=0 TSval=13650063 TSecr=3098931045"
"78","0.104457731","199.232.37.140","192.168.1.118","TLSv1.2","2770","Application Data, Application Data"
"79","0.104543047","192.168.1.118","199.232.37.140","TCP","66","38766 → 443 [ACK] Seq=230 Ack=35204 Win=829 Len=0 TSval=13650066 TSecr=3022339147"
"80","0.104582010","199.232.37.140","192.168.1.118","TLSv1.2","2770","Application Data [TCP segment of a reassembled PDU]"
"81","0.104607436","192.168.1.118","199.232.37.140","TCP","66","38768 → 443 [ACK] Seq=230 Ack=27092 Win=702 Len=0 TSval=13650066 TSecr=248034790"
"82","0.106136427","199.232.37.140","192.168.1.118","TLSv1.2","1418","Application Data [TCP segment of a reassembled PDU]"
"83","0.106189742","199.232.37.140","192.168.1.118","TLSv1.2","2770","Application Data, Application Data"
"84","0.106226918","192.168.1.118","199.232.37.140","TCP","66","38766 → 443 [ACK] Seq=230 Ack=37908 Win=871 Len=0 TSval=13650068 TSecr=3022339147"
"85","0.107273055","199.232.37.140","192.168.1.118","TLSv1.2","2770","Application Data, Application Data"
"86","0.107339169","192.168.1.118","199.232.37.140","TCP","66","38768 → 443 [ACK] Seq=230 Ack=31148 Win=766 Len=0 TSval=13650069 TSecr=248034791"
"87","0.107373221","199.232.37.140","192.168.1.118","TLSv1.2","9530","Application Data, Application Data, Application Data, Application Data, Application Data, Application Data"
"88","0.107398696","192.168.1.118","199.232.37.140","TCP","66","38769 → 443 [ACK] Seq=441 Ack=23036 Win=640 Len=0 TSval=13650069 TSecr=2786651817"
"89","0.128083858","199.232.37.140","192.168.1.118","TLSv1.2","4122","Application Data, Application Data, Application Data"
"90","0.128163536","192.168.1.118","199.232.37.140","TCP","66","38769 → 443 [ACK] Seq=441 Ack=27092 Win=704 Len=0 TSval=13650090 TSecr=2786651817"
"91","0.128204150","199.232.37.140","192.168.1.118","TLSv1.2","1418","Application Data [TCP segment of a reassembled PDU]"
"92","0.129728891","199.232.37.140","192.168.1.118","TLSv1.2","2770","Application Data, Application Data"
"93","0.129809543","192.168.1.118","199.232.37.140","TCP","66","38769 → 443 [ACK] Seq=441 Ack=31148 Win=767 Len=0 TSval=13650091 TSecr=2786651817"
"94","0.129865633","199.232.37.140","192.168.1.118","TLSv1.2","1418","Application Data [TCP segment of a reassembled PDU]"
"95","0.130609571","199.232.37.140","192.168.1.118","TLSv1.2","2770","Application Data, Application Data"
"96","0.130656335","192.168.1.118","199.232.37.140","TCP","66","38769 → 443 [ACK] Seq=441 Ack=35204 Win=830 Len=0 TSval=13650092 TSecr=2786651817"
"97","0.130724613","199.232.37.140","192.168.1.118","TLSv1.2","1697","Application Data, Application Data"
"98","0.130747301","192.168.1.118","199.232.37.140","TCP","66","38770 → 443 [ACK] Seq=356 Ack=18473 Win=516 Len=0 TSval=13650092 TSecr=245113125"
"99","0.130790140","199.232.37.140","192.168.1.118","TLSv1.2","2770","Application Data, Application Data"
"100","0.130811303","192.168.1.118","199.232.37.140","TCP","66","38768 → 443 [ACK] Seq=230 Ack=33852 Win=808 Len=0 TSval=13650092 TSecr=248034792"
"101","0.130831817","199.232.37.140","192.168.1.118","TLSv1.2","2770","Application Data, Application Data"
"102","0.130853155","192.168.1.118","199.232.37.140","TCP","66","38766 → 443 [ACK] Seq=230 Ack=40612 Win=913 Len=0 TSval=13650092 TSecr=3022339150"
"103","0.130873893","199.232.37.140","192.168.1.118","TLSv1.2","2770","Application Data, Application Data"
"104","0.130893906","192.168.1.118","199.232.37.140","TCP","66","38768 → 443 [ACK] Seq=230 Ack=36556 Win=850 Len=0 TSval=13650092 TSecr=248034794"
"105","0.130915607","199.232.37.140","192.168.1.118","TLSv1.2","5474","Application Data, Application Data, Application Data, Application Data"
"106","0.130936608","192.168.1.118","199.232.37.140","TCP","66","38766 → 443 [ACK] Seq=230 Ack=46020 Win=998 Len=0 TSval=13650092 TSecr=3022339163"
"107","0.130961709","199.232.37.140","192.168.1.118","TLSv1.2","5474","Application Data, Application Data, Application Data, Application Data"
"108","0.130981859","192.168.1.118","199.232.37.140","TCP","66","38768 → 443 [ACK] Seq=230 Ack=41964 Win=935 Len=0 TSval=13650092 TSecr=248034795"
"109","0.131001623","199.232.37.140","192.168.1.118","TLSv1.2","2770","Application Data, Application Data"
"110","0.131021273","192.168.1.118","199.232.37.140","TCP","66","38766 → 443 [ACK] Seq=230 Ack=48724 Win=1040 Len=0 TSval=13650092 TSecr=3022339163"
"111","0.131053199","199.232.37.140","192.168.1.118","TLSv1.2","2770","Application Data, Application Data"
"112","0.131072813","192.168.1.118","199.232.37.140","TCP","66","38768 → 443 [ACK] Seq=230 Ack=44668 Win=977 Len=0 TSval=13650093 TSecr=248034796"
"113","0.131085738","199.232.37.140","192.168.1.118","TLSv1.2","1418","Application Data [TCP segment of a reassembled PDU]"
"114","0.131109451","199.232.37.140","192.168.1.118","TLSv1.2","2770","Application Data, Application Data"
"115","0.131128089","192.168.1.118","199.232.37.140","TCP","66","38766 → 443 [ACK] Seq=230 Ack=51428 Win=1082 Len=0 TSval=13650093 TSecr=3022339166"
"116","0.131146390","199.232.37.140","192.168.1.118","TLSv1.2","2770","Application Data, Application Data"
"117","0.131165453","192.168.1.118","199.232.37.140","TCP","66","38766 → 443 [ACK] Seq=230 Ack=54132 Win=1125 Len=0 TSval=13650093 TSecr=3022339169"
"118","0.131189179","199.232.37.140","192.168.1.118","TLSv1.2","2770","Application Data, Application Data"
"119","0.131208505","192.168.1.118","199.232.37.140","TCP","66","38766 → 443 [ACK] Seq=230 Ack=56836 Win=1167 Len=0 TSval=13650093 TSecr=3022339172"
"120","0.131227768","199.232.37.140","192.168.1.118","TLSv1.2","2770","Application Data, Application Data"
"121","0.131246931","192.168.1.118","199.232.37.140","TCP","66","38766 → 443 [ACK] Seq=230 Ack=59540 Win=1176 Len=0 TSval=13650093 TSecr=3022339174"
"122","0.131270444","199.232.37.140","192.168.1.118","TLSv1.2","5474","Application Data, Application Data, Application Data, Application Data"
"123","0.131302058","192.168.1.118","199.232.37.140","TCP","66","38769 → 443 [ACK] Seq=441 Ack=40612 Win=915 Len=0 TSval=13650093 TSecr=2786651817"
"124","0.131314771","199.232.37.140","192.168.1.118","TLSv1.2","5474","Application Data, Application Data, Application Data, Application Data"
"125","0.131334109","192.168.1.118","199.232.37.140","TCP","66","38768 → 443 [ACK] Seq=230 Ack=51428 Win=1082 Len=0 TSval=13650093 TSecr=248034797"
"126","0.131346397","199.232.37.140","192.168.1.118","TLSv1.2","2770","Application Data, Application Data"
"127","0.131758262","192.168.1.118","199.232.37.140","TCP","66","38766 → 443 [ACK] Seq=230 Ack=62244 Win=1155 Len=0 TSval=13650093 TSecr=3022339176"
"128","0.132320719","199.232.37.140","192.168.1.118","TLSv1.2","117","Change Cipher Spec, Encrypted Handshake Message"
"129","0.132393409","199.232.37.140","192.168.1.118","TLSv1.2","2770","Application Data, Application Data"
"130","0.132434860","192.168.1.118","199.232.37.140","TCP","66","38768 → 443 [ACK] Seq=230 Ack=54132 Win=1125 Len=0 TSval=13650094 TSecr=248034798"
"131","0.133724143","192.168.1.118","199.232.37.140","TLSv1.2","295","Application Data"
"132","0.133951001","199.232.37.140","192.168.1.118","TLSv1.2","5474","Application Data, Application Data, Application Data"
"133","0.134006478","199.232.37.140","192.168.1.118","TLSv1.2","2770","Application Data, Application Data"
"134","0.134062080","192.168.1.118","199.232.37.140","TCP","66","38768 → 443 [ACK] Seq=230 Ack=56836 Win=1125 Len=0 TSval=13650095 TSecr=248034799"
"135","0.134098731","199.232.37.140","192.168.1.118","TLSv1.2","1418","Application Data [TCP segment of a reassembled PDU]"
"136","0.134820731","192.168.1.118","199.232.37.140","TCP","66","38766 → 443 [ACK] Seq=230 Ack=69004 Win=1103 Len=0 TSval=13650096 TSecr=3022339178"
"137","0.135609134","199.232.37.140","192.168.1.118","TLSv1.2","1418","Application Data [TCP segment of a reassembled PDU]"
"138","0.135679161","199.232.37.140","192.168.1.118","TLSv1.2","2770","Application Data, Application Data"
"139","0.135843192","199.232.37.140","192.168.1.118","TLSv1.2","2770","Application Data, Application Data"
"140","0.135859730","199.232.37.140","192.168.1.118","TLSv1.2","1418","Application Data [TCP segment of a reassembled PDU]"
"141","0.135917420","192.168.1.118","199.232.37.140","TCP","66","38766 → 443 [ACK] Seq=230 Ack=74412 Win=1061 Len=0 TSval=13650097 TSecr=3022339180"
"142","0.136000010","192.168.1.118","199.232.37.140","TCP","66","38768 → 443 [ACK] Seq=230 Ack=59540 Win=1104 Len=0 TSval=13650097 TSecr=248034802"
"143","0.137550539","199.232.37.140","192.168.1.118","TLSv1.2","1418","Application Data [TCP segment of a reassembled PDU]"
"144","0.137610916","199.232.37.140","192.168.1.118","TLSv1.2","2770","Application Data, Application Data"
"145","0.137865575","192.168.1.118","199.232.37.140","TCP","66","38768 → 443 [ACK] Seq=230 Ack=62244 Win=1083 Len=0 TSval=13650099 TSecr=248034802"
"146","0.149431493","192.168.1.118","239.255.255.250","SSDP","218","M-SEARCH * HTTP/1.1 "
"147","0.164869133","199.232.37.140","192.168.1.118","TLSv1.2","1418","Application Data [TCP segment of a reassembled PDU]"
"148","0.164949473","192.168.1.118","199.232.37.140","TCP","66","38766 → 443 [ACK] Seq=230 Ack=77116 Win=1230 Len=0 TSval=13650126 TSecr=3022339187"
"149","0.166979544","199.232.37.140","192.168.1.118","TLSv1.2","4122","Application Data, Application Data, Application Data"
"150","0.167072035","192.168.1.118","199.232.37.140","TCP","66","38766 → 443 [ACK] Seq=230 Ack=81172 Win=1294 Len=0 TSval=13650129 TSecr=3022339231"
"151","0.167111636","199.232.37.140","192.168.1.118","TLSv1.2","1418","Application Data [TCP segment of a reassembled PDU]"
"152","0.188179624","199.232.37.140","192.168.1.118","TLSv1.2","4122","Application Data, Application Data, Application Data"
"153","0.188263052","192.168.1.118","199.232.37.140","TCP","66","38769 → 443 [ACK] Seq=441 Ack=46020 Win=999 Len=0 TSval=13650150 TSecr=2786651835"
"154","0.203592288","199.232.37.140","192.168.1.118","TLSv1.2","1418","Application Data [TCP segment of a reassembled PDU]"
"155","0.205140405","199.232.37.140","192.168.1.118","TLSv1.2","1418","Application Data [TCP segment of a reassembled PDU]"
"156","0.205212345","192.168.1.118","199.232.37.140","TCP","66","38769 → 443 [ACK] Seq=441 Ack=48724 Win=1042 Len=0 TSval=13650167 TSecr=2786651835"
"157","0.205283760","199.232.37.140","192.168.1.118","TLSv1.2","10882","Application Data, Application Data, Application Data, Application Data, Application Data, Application Data, Application Data, Application Data"
"158","0.205307448","192.168.1.118","199.232.37.140","TCP","66","38769 → 443 [ACK] Seq=441 Ack=59540 Win=1211 Len=0 TSval=13650167 TSecr=2786651835"
"159","0.205334124","199.232.37.140","192.168.1.118","TLSv1.2","6826","Application Data, Application Data, Application Data, Application Data"
"160","0.205401251","199.232.37.140","192.168.1.118","TLSv1.2","5474","Application Data, Application Data, Application Data"
"161","0.205423702","192.168.1.118","199.232.37.140","TCP","66","38768 → 443 [ACK] Seq=230 Ack=67652 Win=1251 Len=0 TSval=13650167 TSecr=248034812"
"162","0.205440590","199.232.37.140","192.168.1.118","TLSv1.2","5474","Application Data, Application Data, Application Data, Application Data"
"163","0.205461291","192.168.1.118","199.232.37.140","TCP","66","38766 → 443 [ACK] Seq=230 Ack=86580 Win=1378 Len=0 TSval=13650167 TSecr=3022339231"
"164","0.205478779","199.232.37.140","192.168.1.118","TLSv1.2","2770","Application Data, Application Data"
"165","0.205497892","192.168.1.118","199.232.37.140","TCP","66","38768 → 443 [ACK] Seq=230 Ack=70356 Win=1294 Len=0 TSval=13650167 TSecr=248034812"
"166","0.205513955","199.232.37.140","192.168.1.118","TLSv1.2","2770","Application Data, Application Data"
"167","0.205533344","192.168.1.118","199.232.37.140","TCP","66","38766 → 443 [ACK] Seq=230 Ack=89284 Win=1420 Len=0 TSval=13650167 TSecr=3022339232"
"168","0.205554532","199.232.37.140","192.168.1.118","TLSv1.2","2770","Application Data, Application Data"
"169","0.205573332","192.168.1.118","199.232.37.140","TCP","66","38766 → 443 [ACK] Seq=230 Ack=91988 Win=1463 Len=0 TSval=13650167 TSecr=3022339234"
"170","0.205590033","199.232.37.140","192.168.1.118","TLSv1.2","5474","Application Data, Application Data, Application Data, Application Data"
"171","0.205608771","199.232.37.140","192.168.1.118","TLSv1.2","2770","Application Data, Application Data"
"172","0.205625359","192.168.1.118","199.232.37.140","TCP","66","38766 → 443 [ACK] Seq=230 Ack=94692 Win=1505 Len=0 TSval=13650167 TSecr=3022339235"
"173","0.205648523","199.232.37.140","192.168.1.118","TLSv1.2","2770","Application Data, Application Data"
"174","0.205667286","192.168.1.118","199.232.37.140","TCP","66","38766 → 443 [ACK] Seq=230 Ack=97396 Win=1547 Len=0 TSval=13650167 TSecr=3022339237"
"175","0.205687911","199.232.37.140","192.168.1.118","TLSv1.2","2770","Application Data, Application Data"
"176","0.205705987","192.168.1.118","199.232.37.140","TCP","66","38766 → 443 [ACK] Seq=230 Ack=100100 Win=1589 Len=0 TSval=13650167 TSecr=3022339238"
"177","0.205722538","199.232.37.140","192.168.1.118","TLSv1.2","6826","Application Data, Application Data, Application Data, Application Data, Application Data"
"178","0.205744763","199.232.37.140","192.168.1.118","TLSv1.2","17642","Application Data, Application Data, Application Data, Application Data, Application Data, Application Data, Application Data, Application Data, Application Data, Application Data, Application Data, Application Data, Application Data"
"179","0.205761714","199.232.37.140","192.168.1.118","TLSv1.2","2770","Application Data, Application Data"
"180","0.205777690","192.168.1.118","199.232.37.140","TCP","66","38766 → 443 [ACK] Seq=230 Ack=102804 Win=1632 Len=0 TSval=13650167 TSecr=3022339240"
"181","0.205788015","199.232.37.140","192.168.1.118","TLSv1.2","2770","Application Data, Application Data"
"182","0.210546657","199.232.37.140","192.168.1.118","TLSv1.2","5474","Application Data, Application Data, Application Data, Application Data"
"183","0.210725463","199.232.37.140","192.168.1.118","TLSv1.2","10047","Application Data, Application Data, Application Data, Application Data, Application Data, Application Data, Application Data, Application Data"
"184","0.210782027","192.168.1.118","199.232.37.140","TCP","66","38771 → 443 [ACK] Seq=873 Ack=13303 Win=436 Len=0 TSval=13650172 TSecr=3887008657"
"185","0.210825041","199.232.37.140","192.168.1.118","TLSv1.2","5474","Application Data, Application Data, Application Data, Application Data"
"186","0.215628172","199.232.37.140","192.168.1.118","TLSv1.2","2770","Application Data [TCP segment of a reassembled PDU]"
"187","0.215714800","192.168.1.118","199.232.37.140","TCP","66","38766 → 443 [ACK] Seq=230 Ack=105508 Win=1674 Len=0 TSval=13650177 TSecr=3022339241"
"188","0.215754889","199.232.37.140","192.168.1.118","TLSv1.2","2770","Application Data, Application Data"
"189","0.217282055","199.232.37.140","192.168.1.118","TLSv1.2","2770","Application Data, Application Data"
"190","0.217365170","192.168.1.118","199.232.37.140","TCP","66","38766 → 443 [ACK] Seq=230 Ack=108212 Win=1716 Len=0 TSval=13650179 TSecr=3022339243"
"191","0.217402471","199.232.37.140","192.168.1.118","TLSv1.2","1418","Application Data [TCP segment of a reassembled PDU]"
"192","0.218156748","199.232.37.140","192.168.1.118","TLSv1.2","78","Application Data"
"193","0.218208150","199.232.37.140","192.168.1.118","TLSv1.2","1418","Application Data [TCP segment of a reassembled PDU]"
"194","0.218252639","199.232.37.140","192.168.1.118","TLSv1.2","5474","Application Data, Application Data, Application Data, Application Data"
"195","0.218289015","199.232.37.140","192.168.1.118","TLSv1.2","4122","Application Data, Application Data, Application Data"
"196","0.223659503","199.232.37.140","192.168.1.118","TLSv1.2","4122","Application Data, Application Data"
"197","0.223723218","199.232.37.140","192.168.1.118","TLSv1.2","1418","Application Data [TCP segment of a reassembled PDU]"
"198","0.225325574","199.232.37.140","192.168.1.118","TLSv1.2","4122","Application Data, Application Data, Application Data"
"199","0.226365898","199.232.37.140","192.168.1.118","TLSv1.2","2770","Application Data, Application Data"
"200","0.226441175","199.232.37.140","192.168.1.118","TLSv1.2","7445","Application Data, Application Data, Application Data, Application Data, Application Data, Application Data, Application Data"
"201","0.226470814","199.232.37.140","192.168.1.118","TLSv1.2","1418","Application Data [TCP segment of a reassembled PDU]"
"202","0.242353707","199.232.37.140","192.168.1.118","TLSv1.2","4122","Application Data, Application Data, Application Data"
"203","0.242442385","192.168.1.118","199.232.37.140","TCP","66","38769 → 443 [ACK] Seq=441 Ack=100100 Win=895 Len=0 TSval=13650204 TSecr=2786651835"
"204","0.245114204","192.168.1.118","199.232.37.140","TCP","66","38768 → 443 [ACK] Seq=230 Ack=119647 Win=909 Len=0 TSval=13650207 TSecr=248034813"
"205","0.245253746","199.232.37.140","192.168.1.118","TLSv1.2","5474","Application Data, Application Data, Application Data"
"206","0.245294248","199.232.37.140","192.168.1.118","TLSv1.2","1418","Application Data [TCP segment of a reassembled PDU]"
"207","0.247921115","199.232.37.140","192.168.1.118","TLSv1.2","4122","Application Data, Application Data, Application Data"
"208","0.248021606","199.232.37.140","192.168.1.118","TLSv1.2","21698","Application Data, Application Data, Application Data, Application Data, Application Data, Application Data, Application Data, Application Data, Application Data, Application Data, Application Data, Application Data, Application Data, Application Data, Application Data, Application Data"
"209","0.258102796","192.168.1.118","199.232.37.140","TCP","66","38766 → 443 [ACK] Seq=230 Ack=108224 Win=1716 Len=0 TSval=13650220 TSecr=3022339246"
"210","0.263927175","199.232.37.140","192.168.1.118","TLSv1.2","1418","Application Data [TCP segment of a reassembled PDU]"
"211","0.266079775","199.232.37.140","192.168.1.118","TLSv1.2","2770","Application Data, Application Data"
"212","0.266173966","199.232.37.140","192.168.1.118","TLSv1.2","4122","Application Data, Application Data, Application Data"
"213","0.268714442","199.232.37.140","192.168.1.118","TLSv1.2","5474","Application Data, Application Data, Application Data"
"214","0.270366088","199.232.37.140","192.168.1.118","TLSv1.2","2770","Application Data, Application Data"
"215","0.271631882","199.232.37.140","192.168.1.118","TLSv1.2","13586","Application Data, Application Data, Application Data, Application Data, Application Data, Application Data, Application Data, Application Data, Application Data, Application Data"
"216","0.275562357","199.232.37.140","192.168.1.118","TLSv1.2","5474","Application Data, Application Data, Application Data, Application Data"
"217","0.275651085","192.168.1.118","199.232.37.140","TCP","66","38769 → 443 [ACK] Seq=441 Ack=167700 Win=367 Len=0 TSval=13650237 TSecr=2786651845"
"218","0.276061712","199.232.37.140","192.168.1.118","TLSv1.2","5966","Application Data, Application Data, Application Data, Application Data, Application Data"
"219","0.316106776","192.168.1.118","199.232.37.140","TCP","66","38769 → 443 [ACK] Seq=441 Ack=173600 Win=321 Len=0 TSval=13650278 TSecr=2786651860"
"220","0.410840704","192.168.1.118","199.232.37.140","TLSv1.2","249","Application Data"
"221","0.429630824","199.232.37.140","192.168.1.118","TLSv1.2","1151","Application Data, Application Data"
"222","0.429726578","192.168.1.118","199.232.37.140","TCP","66","38752 → 443 [ACK] Seq=184 Ack=1086 Win=448 Len=0 TSval=13650391 TSecr=246602758"
"223","0.488828521","192.168.1.118","199.232.37.140","TCP","66","[TCP Window Update] 38769 → 443 [ACK] Seq=441 Ack=173600 Win=745 Len=0 TSval=13650450 TSecr=2786651860"
"224","1.150984058","192.168.1.118","239.255.255.250","SSDP","218","M-SEARCH * HTTP/1.1 "
"225","1.496253192","192.168.1.100","224.0.0.251","MDNS","388","Standard query 0x0000 PTR _uscan._tcp.local, "QM" question PTR _ippusb._tcp.local, "QM" question PTR _uscans._tcp.local, "QM" question PTR _scanner._tcp.local, "QM" question PTR _ipp._tcp.local, "QM" question PTR _ipps._tcp.local, "QM" question PTR _printer._tcp.local, "QM" question PTR _pdl-datastream._tcp.local, "QM" question PTR _ptp._tcp.local, "QM" question PTR _airplay._tcp.local, "QM" question PTR _raop._tcp.local, "QM" question PTR _airport._tcp.local, "QM" question PTR _rdlink._tcp.local, "QM" question PTR _apple-mobdev._tcp.local, "QM" question PTR 8ed307c3._sub._apple-mobdev2._tcp.local, "QM" question PTR _apple-pairable._tcp.local, "QM" question PTR _companion-link._tcp.local, "QM" question PTR cjqg._companion-link._tcp.local OPT"
"226","1.795672859","Cisco-Li_5b:1c:ce","IntelCor_b7:52:73","ARP","42","Who has 192.168.1.118? Tell 192.168.1.1"
"227","1.795726723","IntelCor_b7:52:73","Cisco-Li_5b:1c:ce","ARP","42","192.168.1.118 is at dc:fb:48:b7:52:73"
"228","2.109027401","192.168.1.104","255.255.255.255","UDP","217","49154 → 6666 Len=175"
"229","4.574759585","192.168.1.118","192.168.1.102","TCP","176","45592 → 8009 [PSH, ACK] Seq=1 Ack=1 Win=387 Len=110 TSval=13654536 TSecr=3344126 [TCP segment of a reassembled PDU]"
"230","4.582417578","192.168.1.102","192.168.1.118","TCP","176","8009 → 45592 [PSH, ACK] Seq=1 Ack=111 Win=299 Len=110 TSval=3344627 TSecr=13654536 [TCP segment of a reassembled PDU]"
"231","4.582520957","192.168.1.118","192.168.1.102","TCP","66","45592 → 8009 [ACK] Seq=111 Ack=111 Win=387 Len=0 TSval=13654544 TSecr=3344627"
"232","5.177928708","192.168.1.104","255.255.255.255","UDP","217","49154 → 6666 Len=175"
"233","5.494316594","192.168.1.118","172.253.63.188","TLSv1.2","99","Application Data"
"234","5.515826834","172.253.63.188","192.168.1.118","TCP","66","5228 → 33746 [ACK] Seq=1 Ack=34 Win=248 Len=0 TSval=3699913372 TSecr=13655456"
"235","5.524425897","172.253.63.188","192.168.1.118","TLSv1.2","100","Application Data"
"236","5.524776097","192.168.1.118","172.253.63.188","TLSv1.2","109","Application Data"
"237","5.558974232","172.253.63.188","192.168.1.118","TCP","66","5228 → 33746 [ACK] Seq=35 Ack=77 Win=248 Len=0 TSval=3699913416 TSecr=13655486"
"238","8.865876394","192.168.1.100","224.0.0.251","MDNS","175","Standard query 0x0000 ANY cjqg._smb._tcp.local, "QM" question ANY cjqg._companion-link._tcp.local, "QM" question SRV 0 0 445 cjqg.local SRV 0 0 53222 cjqg.local OPT"
"239","9.584500807","192.168.1.118","192.168.1.102","TCP","176","45592 → 8009 [PSH, ACK] Seq=111 Ack=111 Win=387 Len=110 TSval=13659546 TSecr=3344627 [TCP segment of a reassembled PDU]"
