frame.number,_ws.col.Time,_ws.col.Source,_ws.col.Destination,_ws.col.Protocol,frame.len,_ws.col.Info
"1","0.000000000","104.18.212.105","192.168.1.118","SSL","768","Continuation Data"
"2","0.000065413","192.168.1.118","104.18.212.105","TCP","66","45608 → 443 [ACK] Seq=1 Ack=715 Win=22 Len=0 SLE=1 SRE=715"
"3","0.009259550","192.168.1.118","104.18.212.105","TCP","54","45602 → 443 [ACK] Seq=1 Ack=1 Win=8 Len=0"
"4","0.012341675","104.18.212.105","192.168.1.118","SSL","1026","[TCP Spurious Retransmission] , Continuation Data"
"5","0.012407025","192.168.1.118","104.18.212.105","TCP","66","[TCP Dup ACK 3#1] 45602 → 443 [ACK] Seq=1 Ack=1 Win=8 Len=0 SLE=4294966325 SRE=1"
"6","0.061794413","192.168.1.118","104.18.212.105","TLSv1","571","Client Hello"
"7","0.062095575","192.168.1.118","104.18.212.105","TCP","54","[TCP Window Update] 45602 → 443 [ACK] Seq=1 Ack=1 Win=501 Len=0"
"8","0.090599063","104.18.212.105","192.168.1.118","TCP","54","443 → 45612 [ACK] Seq=1 Ack=518 Win=66 Len=0"
"9","0.093080313","104.18.212.105","192.168.1.118","TCP","1514","[TCP segment of a reassembled PDU]"
"10","0.093153375","192.168.1.118","104.18.212.105","TCP","54","45602 → 443 [ACK] Seq=1 Ack=1461 Win=524 Len=0"
"11","0.095048200","104.18.212.105","192.168.1.118","TLSv1.2","7366","Application Data, Application Data, Application Data"
"12","0.095091388","192.168.1.118","104.18.212.105","TCP","54","45602 → 443 [ACK] Seq=1 Ack=8773 Win=638 Len=0"
"13","0.097771850","104.18.212.105","192.168.1.118","TLSv1.2","1514","Server Hello"
"14","0.097836300","192.168.1.118","104.18.212.105","TCP","54","45612 → 443 [ACK] Seq=518 Ack=1461 Win=493 Len=0"
"15","0.101436125","104.18.212.105","192.168.1.118","TLSv1.2","2025","Certificate, Server Key Exchange, Server Hello Done"
"16","0.101509488","192.168.1.118","104.18.212.105","TCP","54","45612 → 443 [ACK] Seq=518 Ack=3432 Win=478 Len=0"
"17","0.141263625","104.18.212.105","192.168.1.118","TCP","1514","[TCP segment of a reassembled PDU]"
"18","0.141335600","192.168.1.118","104.18.212.105","TCP","66","45604 → 443 [ACK] Seq=1 Ack=1461 Win=32 Len=0 SLE=2921 SRE=4259"
"19","0.149683100","192.168.1.118","104.18.212.105","TLSv1.2","180","Client Key Exchange, Change Cipher Spec, Encrypted Handshake Message"
"20","0.154065863","192.168.1.118","209.18.47.62","DNS","73","Standard query 0x92b5 A p.typekit.net"
"21","0.154140338","104.18.212.105","192.168.1.118","TCP","1514","443 → 45604 [ACK] Seq=1461 Ack=1 Win=68 Len=1460 [TCP segment of a reassembled PDU]"
"22","0.154222288","192.168.1.118","104.18.212.105","TCP","54","[TCP ACKed unseen segment] 45604 → 443 [ACK] Seq=1 Ack=4259 Win=11 Len=0"
"23","0.168753525","104.18.212.105","192.168.1.118","TCP","54","443 → 45612 [ACK] Seq=3432 Ack=644 Win=66 Len=0"
"24","0.169459238","104.18.212.105","192.168.1.118","TLSv1.2","105","Change Cipher Spec, Encrypted Handshake Message"
"25","0.169499038","192.168.1.118","104.18.212.105","TCP","54","45612 → 443 [ACK] Seq=644 Ack=3483 Win=501 Len=0"
"26","0.174288488","209.18.47.62","192.168.1.118","DNS","164","Standard query response 0x92b5 A p.typekit.net CNAME p.typekit.net-v3.edgekey.net CNAME e6653.dscf.akamaiedge.net A 23.55.213.146"
"27","0.175028638","192.168.1.118","209.18.47.62","DNS","73","Standard query 0xf63a AAAA p.typekit.net"
"28","0.190032275","192.168.1.118","239.255.255.250","SSDP","218","M-SEARCH * HTTP/1.1 "
"29","0.200103275","209.18.47.62","192.168.1.118","DNS","204","Standard query response 0xf63a AAAA p.typekit.net CNAME p.typekit.net-v3.edgekey.net CNAME e6653.dscf.akamaiedge.net AAAA 2600:1400:d:587::19fd AAAA 2600:1400:d:59c::19fd"
"30","0.206852288","192.168.1.118","104.18.212.105","TLSv1.2","330","Application Data"
"31","0.207160588","192.168.1.118","23.55.213.146","TCP","74","44220 → 443 [SYN] Seq=0 Win=64240 Len=0 MSS=1460 SACK_PERM=1 TSval=4078622377 TSecr=0 WS=128"
"32","0.222866950","104.18.212.105","192.168.1.118","TCP","54","443 → 45606 [ACK] Seq=1 Ack=1 Win=67 Len=0"
"33","0.222930613","192.168.1.118","104.18.212.105","TCP","54","[TCP ZeroWindow] [TCP ACKed unseen segment] 45606 → 443 [ACK] Seq=1 Ack=2 Win=0 Len=0"
"34","0.237345300","104.18.212.105","192.168.1.118","TCP","54","443 → 45612 [ACK] Seq=3483 Ack=920 Win=67 Len=0"
"35","0.260593675","104.18.212.105","192.168.1.118","TLSv1.2","1452","Application Data"
"36","0.264647313","104.18.212.105","192.168.1.118","TLSv1.2","1452","Application Data"
"37","0.264700025","104.18.212.105","192.168.1.118","TLSv1.2","1452","Application Data"
"38","0.265437425","104.18.212.105","192.168.1.118","TLSv1.2","2850","Application Data, Application Data"
"39","0.266649575","104.18.212.105","192.168.1.118","TLSv1.2","2974","Application Data, Application Data"
"40","0.267388150","104.18.212.105","192.168.1.118","TLSv1.2","1328","Application Data"
"41","0.267422725","104.18.212.105","192.168.1.118","TLSv1.2","1452","Application Data"
"42","0.269700175","104.18.212.105","192.168.1.118","TLSv1.2","2850","Application Data, Application Data"
"43","0.270402750","104.18.212.105","192.168.1.118","TLSv1.2","2974","Application Data, Application Data"
"44","0.271475650","104.18.212.105","192.168.1.118","TLSv1.2","2726","Application Data, Application Data"
"45","0.273499925","104.18.212.105","192.168.1.118","TLSv1.2","2974","Application Data, Application Data"
"46","0.273629000","104.18.212.105","192.168.1.118","TLSv1.2","2726","Application Data, Application Data"
"47","0.273658163","104.18.212.105","192.168.1.118","TLSv1.2","5646","Application Data, Application Data, Application Data, Application Data"
"48","0.273700913","104.18.212.105","192.168.1.118","TLSv1.2","9785","Application Data, Application Data, Application Data, Application Data, Application Data, Application Data, Application Data"
"49","0.273719338","104.18.212.105","192.168.1.118","TLSv1.2","1514","Application Data"
"50","0.276591625","104.18.212.105","192.168.1.118","TLSv1.2","5894","Application Data, Application Data, Application Data, Application Data"
"51","0.276704075","104.18.212.105","192.168.1.118","TLSv1.2","2974","Application Data, Application Data"
"52","0.277650850","192.168.1.118","104.18.212.105","TCP","54","45612 → 443 [ACK] Seq=920 Ack=55588 Win=94 Len=0"
"53","0.280719400","104.18.212.105","192.168.1.118","TLSv1.2","12077","Application Data, Application Data, Application Data, Application Data, Application Data"
"54","0.280782113","23.55.213.146","192.168.1.118","TCP","74","443 → 44220 [SYN, ACK] Seq=0 Ack=1 Win=28960 Len=0 MSS=1460 SACK_PERM=1 TSval=3355772497 TSecr=4078622377 WS=128"
"55","0.280849438","192.168.1.118","23.55.213.146","TCP","66","44220 → 443 [ACK] Seq=1 Ack=1 Win=64256 Len=0 TSval=4078622451 TSecr=3355772497"
"56","0.299115688","104.18.212.105","192.168.1.118","TCP","397","[TCP Retransmission] 443 → 45612 [ACK] Seq=67268 Ack=920 Win=67 Len=343"
"57","0.321252625","192.168.1.118","104.18.212.105","TCP","66","45612 → 443 [ACK] Seq=920 Ack=67611 Win=1 Len=0 SLE=67268 SRE=67611"
"58","0.408061513","192.168.1.118","23.55.213.146","TLSv1","583","Client Hello"
"59","0.464910675","23.55.213.146","192.168.1.118","TCP","66","443 → 44220 [ACK] Seq=1 Ack=518 Win=30080 Len=0 TSval=3355772691 TSecr=4078622578"
"60","0.469457563","23.55.213.146","192.168.1.118","TLSv1.2","4162","Server Hello"
"61","0.469526200","192.168.1.118","23.55.213.146","TCP","66","44220 → 443 [ACK] Seq=518 Ack=4097 Win=60160 Len=0 TSval=4078622640 TSecr=3355772692"
"62","0.469568450","23.55.213.146","192.168.1.118","TLSv1.2","624","Certificate, Server Key Exchange, Server Hello Done"
"63","0.469584488","192.168.1.118","23.55.213.146","TCP","66","44220 → 443 [ACK] Seq=518 Ack=4655 Win=59648 Len=0 TSval=4078622640 TSecr=3355772694"
"64","0.503020963","192.168.1.118","23.55.213.146","TLSv1.2","192","Client Key Exchange, Change Cipher Spec, Encrypted Handshake Message"
"65","0.536510750","192.168.1.118","104.18.212.105","TCP","54","[TCP Window Update] [TCP ACKed unseen segment] 45606 → 443 [ACK] Seq=1 Ack=2 Win=227 Len=0"
"66","0.537218225","192.168.1.118","104.18.212.105","TCP","54","[TCP Window Update] [TCP ACKed unseen segment] 45604 → 443 [ACK] Seq=1 Ack=4259 Win=262 Len=0"
"67","0.549678863","23.55.213.146","192.168.1.118","TLSv1.2","117","Change Cipher Spec, Encrypted Handshake Message"
"68","0.549994938","192.168.1.118","104.18.212.105","TCP","54","[TCP Window Update] 45608 → 443 [ACK] Seq=1 Ack=715 Win=115 Len=0"
"69","0.550628438","192.168.1.118","23.55.213.146","TLSv1.2","325","Application Data"
"70","0.561756225","104.18.212.105","192.168.1.118","TCP","1514","[TCP Previous segment not captured]  [TCP segment of a reassembled PDU]"
"71","0.564646550","104.18.212.105","192.168.1.118","TLSv1.2","5894","Application Data [TCP segment of a reassembled PDU]"
"72","0.564794550","104.18.212.105","192.168.1.118","TLSv1.2","17574","Application Data, Application Data, Application Data, Application Data"
"73","0.584506263","104.18.212.105","192.168.1.118","TLSv1.2","5894","Application Data, Application Data"
"74","0.584592938","104.18.212.105","192.168.1.118","TCP","1514","443 → 45604 [PSH, ACK] Seq=34919 Ack=1 Win=68 Len=1460 [TCP segment of a reassembled PDU]"
"75","0.584669213","104.18.212.105","192.168.1.118","SSL","16114","[TCP Previous segment not captured] , Continuation Data"
"76","0.590441213","104.18.212.105","192.168.1.118","SSL","5894","Continuation Data"
"77","0.590563838","104.18.212.105","192.168.1.118","SSL","7210","Continuation Data"
"78","0.590582475","104.18.212.105","192.168.1.118","TCP","182","443 → 45612 [PSH, ACK] Seq=67611 Ack=920 Win=67 Len=128 [TCP segment of a reassembled PDU]"
"79","0.590617138","192.168.1.118","104.18.212.105","TCP","54","[TCP ZeroWindow] 45612 → 443 [ACK] Seq=920 Ack=67739 Win=0 Len=0"
"80","0.601047300","104.18.212.105","192.168.1.118","TCP","1514","[TCP Retransmission] 443 → 45604 [ACK] Seq=34919 Ack=1 Win=68 Len=1460"
"81","0.601116663","192.168.1.118","104.18.212.105","TCP","66","[TCP ACKed unseen segment] 45604 → 443 [ACK] Seq=1 Ack=36379 Win=12 Len=0 SLE=34919 SRE=36379"
"82","0.602372550","23.55.213.146","192.168.1.118","TLSv1.2","429","Application Data"
"83","0.610522063","104.18.212.105","192.168.1.118","TCP","1514","443 → 45604 [ACK] Seq=36379 Ack=1 Win=68 Len=1460 [TCP segment of a reassembled PDU]"
"84","0.611180575","104.18.212.105","192.168.1.118","TLSv1.2","130","Application Data [TCP segment of a reassembled PDU]"
"85","0.625260950","192.168.1.118","104.18.212.105","TCP","54","[TCP ZeroWindow] [TCP ACKed unseen segment] 45606 → 443 [ACK] Seq=1 Ack=29058 Win=0 Len=0"
"86","0.639358763","104.18.212.105","192.168.1.118","SSL","1370","[TCP Spurious Retransmission] , Continuation Data"
"87","0.639427963","192.168.1.118","104.18.212.105","TCP","66","[TCP ZeroWindow] 45606 → 443 [ACK] Seq=1 Ack=29058 Win=0 Len=0 SLE=27742 SRE=29058"
"88","0.643252838","192.168.1.118","23.55.213.146","TCP","66","44220 → 443 [ACK] Seq=903 Ack=5069 Win=63872 Len=0 TSval=4078622813 TSecr=3355772832"
"89","0.651258588","192.168.1.118","104.18.212.105","TCP","54","[TCP ZeroWindow] 45604 → 443 [ACK] Seq=1 Ack=37915 Win=0 Len=0"
"90","0.652751875","104.18.212.105","192.168.1.118","TCP","130","[TCP Spurious Retransmission] 443 → 45604 [ACK] Seq=37839 Ack=1 Win=68 Len=76[Reassembly error, protocol TCP: New fragment overlaps old data (retransmission?)]"
"91","0.652808188","192.168.1.118","104.18.212.105","TCP","66","[TCP ZeroWindow] 45604 → 443 [ACK] Seq=1 Ack=37915 Win=0 Len=0 SLE=37839 SRE=37915"
"92","0.665263238","192.168.1.118","104.18.212.105","TCP","54","[TCP Window Update] 45606 → 443 [ACK] Seq=1 Ack=29058 Win=501 Len=0"
"93","0.684669513","104.18.212.105","192.168.1.118","SSL","1514","Continuation Data"
"94","0.684741875","192.168.1.118","104.18.212.105","TCP","54","45606 → 443 [ACK] Seq=1 Ack=30518 Win=524 Len=0"
"95","0.688544125","104.18.212.105","192.168.1.118","SSL","1658","Continuation Data"
"96","0.688618975","192.168.1.118","104.18.212.105","TCP","54","45606 → 443 [ACK] Seq=1 Ack=32122 Win=549 Len=0"
"97","0.688669288","104.18.212.105","192.168.1.118","SSL","4434","Continuation Data"
"98","0.688686425","192.168.1.118","104.18.212.105","TCP","54","45606 → 443 [ACK] Seq=1 Ack=36502 Win=617 Len=0"
"99","0.688781763","104.18.212.105","192.168.1.118","SSL","16114","Continuation Data"
"100","0.688802600","192.168.1.118","104.18.212.105","TCP","54","45606 → 443 [ACK] Seq=1 Ack=52562 Win=751 Len=0"
"101","0.697301538","104.18.212.105","192.168.1.118","SSL","5894","Continuation Data"
"102","0.697401488","104.18.212.105","192.168.1.118","SSL","5894","Continuation Data"
"103","0.697466875","104.18.212.105","192.168.1.118","SSL","11734","Continuation Data"
"104","0.702046975","104.18.212.105","192.168.1.118","SSL","5894","Continuation Data"
"105","0.702182038","104.18.212.105","192.168.1.118","SSL","11478","Continuation Data"
"106","0.719971875","104.18.212.105","192.168.1.118","SSL","3230","Continuation Data"
"107","0.720029863","104.18.212.105","192.168.1.118","SSL","2974","Continuation Data"
"108","0.720127238","104.18.212.105","192.168.1.118","SSL","16114","Continuation Data"
"109","0.729788000","192.168.1.118","104.18.212.105","TCP","54","45606 → 443 [ACK] Seq=1 Ack=115342 Win=261 Len=0"
"110","0.739506313","192.168.1.118","104.18.212.105","TCP","54","[TCP Window Update] 45612 → 443 [ACK] Seq=920 Ack=67739 Win=259 Len=0"
"111","0.741825988","104.18.212.105","192.168.1.118","SSL","13194","Continuation Data"
"112","0.745994713","192.168.1.118","104.18.212.105","TCP","54","45606 → 443 [ACK] Seq=1 Ack=128482 Win=159 Len=0"
"113","0.761777475","104.18.212.105","192.168.1.118","TCP","1514","443 → 45612 [ACK] Seq=67739 Ack=920 Win=67 Len=1460 [TCP segment of a reassembled PDU]"
"114","0.763157488","104.18.212.105","192.168.1.118","TLSv1.2","5894","Application Data, Application Data, Application Data"
"115","0.767451363","104.18.212.105","192.168.1.118","TLSv1.2","3304","Application Data"
"116","0.767513025","104.18.212.105","192.168.1.118","SSL","2974","Continuation Data"
"117","0.767616013","104.18.212.105","192.168.1.118","SSL","10274","Continuation Data"
"118","0.778138663","104.18.212.105","192.168.1.118","SSL","7182","Continuation Data"
"119","0.802259888","192.168.1.118","104.18.212.105","TCP","54","45612 → 443 [ACK] Seq=920 Ack=78289 Win=177 Len=0"
"120","0.808259513","192.168.1.118","104.18.212.105","TCP","54","45606 → 443 [ACK] Seq=1 Ack=148750 Win=1 Len=0"
"121","0.814475100","104.18.212.105","192.168.1.118","TCP","384","[TCP Spurious Retransmission] 443 → 45612 [PSH, ACK] Seq=77959 Ack=920 Win=67 Len=330[Reassembly error, protocol TCP: New fragment overlaps old data (retransmission?)]"
"122","0.814544275","192.168.1.118","104.18.212.105","TCP","66","[TCP Dup ACK 119#1] 45612 → 443 [ACK] Seq=920 Ack=78289 Win=177 Len=0 SLE=77959 SRE=78289"
"123","0.862933988","192.168.1.118","104.18.212.105","TLSv1.2","389","Application Data"
"124","0.863157350","192.168.1.118","104.18.212.105","TCP","54","[TCP Window Update] 45608 → 443 [ACK] Seq=1 Ack=715 Win=310 Len=0"
"125","0.906542375","192.168.1.118","104.18.212.105","TCP","54","[TCP Window Update] 45604 → 443 [ACK] Seq=1 Ack=37915 Win=245 Len=0"
"126","0.912585538","104.18.212.105","192.168.1.118","TCP","1514","[TCP segment of a reassembled PDU]"
"127","0.912668538","192.168.1.118","104.18.212.105","TCP","54","45602 → 443 [ACK] Seq=336 Ack=10233 Win=661 Len=0"
"128","0.914163625","104.18.212.105","192.168.1.118","TLSv1.2","2852","Application Data"
"129","0.914245225","192.168.1.118","104.18.212.105","TCP","54","45602 → 443 [ACK] Seq=336 Ack=13031 Win=705 Len=0"
"130","0.914281150","104.18.212.105","192.168.1.118","TLSv1.2","399","Application Data"
"131","0.914295313","192.168.1.118","104.18.212.105","TCP","54","45602 → 443 [ACK] Seq=336 Ack=13376 Win=727 Len=0"
"132","0.925872738","104.18.212.105","192.168.1.118","TCP","1514","443 → 45604 [ACK] Seq=37915 Ack=1 Win=68 Len=1460 [TCP segment of a reassembled PDU]"
"133","0.925950250","192.168.1.118","104.18.212.105","TCP","54","45604 → 443 [ACK] Seq=1 Ack=39375 Win=234 Len=0"
"134","0.934587963","104.18.212.105","192.168.1.118","TCP","1514","443 → 45604 [PSH, ACK] Seq=39375 Ack=1 Win=68 Len=1460 [TCP segment of a reassembled PDU]"
"135","0.934654888","104.18.212.105","192.168.1.118","TLSv1.2","2974","Application Data [TCP segment of a reassembled PDU]"
"136","0.934672438","104.18.212.105","192.168.1.118","TCP","1514","443 → 45604 [ACK] Seq=43755 Ack=1 Win=68 Len=1460 [TCP segment of a reassembled PDU]"
"137","0.934727550","104.18.212.105","192.168.1.118","TLSv1.2","1514","Application Data [TCP segment of a reassembled PDU]"
"138","0.934748513","104.18.212.105","192.168.1.118","TLSv1.2","2974","Application Data [TCP segment of a reassembled PDU]"
"139","0.934771550","104.18.212.105","192.168.1.118","TCP","2974","443 → 45604 [PSH, ACK] Seq=49595 Ack=1 Win=68 Len=2920 [TCP segment of a reassembled PDU]"
"140","0.953357150","104.18.212.105","192.168.1.118","TLSv1.2","2974","Application Data [TCP segment of a reassembled PDU]"
"141","0.953416738","104.18.212.105","192.168.1.118","TLSv1.2","2974","Application Data [TCP segment of a reassembled PDU]"
"142","0.953957425","104.18.212.105","192.168.1.118","TCP","2974","443 → 45604 [PSH, ACK] Seq=58355 Ack=1 Win=68 Len=2920 [TCP segment of a reassembled PDU]"
"143","0.953985875","104.18.212.105","192.168.1.118","TLSv1.2","2974","Application Data [TCP segment of a reassembled PDU]"
"144","0.954007338","104.18.212.105","192.168.1.118","TLSv1.2","2974","Application Data [TCP segment of a reassembled PDU]"
"145","0.954025775","104.18.212.105","192.168.1.118","TCP","1438","443 → 45604 [ACK] Seq=67115 Ack=1 Win=68 Len=1384 [TCP segment of a reassembled PDU]"
"146","0.975262188","192.168.1.118","104.18.212.105","TCP","54","45604 → 443 [ACK] Seq=1 Ack=68499 Win=7 Len=0"
"147","0.977143088","192.168.1.118","104.18.212.105","TLSv1.2","346","Application Data"
"148","0.990493938","192.168.1.118","104.18.212.105","TCP","54","[TCP Window Update] 45612 → 443 [ACK] Seq=920 Ack=78289 Win=355 Len=0"
"149","0.991095325","192.168.1.118","104.18.212.105","TCP","54","[TCP Window Update] 45606 → 443 [ACK] Seq=1 Ack=148750 Win=147 Len=0"
"150","0.991655138","192.168.1.118","104.18.212.105","TCP","54","[TCP Window Update] 45604 → 443 [ACK] Seq=1 Ack=68499 Win=259 Len=0"
"151","0.996100713","104.18.212.105","192.168.1.118","TCP","1438","[TCP Spurious Retransmission] 443 → 45604 [ACK] Seq=67115 Ack=1 Win=68 Len=1384 [TCP segment of a reassembled PDU]"
"152","0.996167938","192.168.1.118","104.18.212.105","TCP","66","[TCP Dup ACK 146#1] 45604 → 443 [ACK] Seq=1 Ack=68499 Win=259 Len=0 SLE=67115 SRE=68499"
"153","1.004036613","104.18.212.105","192.168.1.118","TCP","1514","443 → 45604 [ACK] Seq=68499 Ack=1 Win=68 Len=1460 [TCP segment of a reassembled PDU]"
"154","1.007938250","104.18.212.105","192.168.1.118","TLSv1.2","1514","Application Data [TCP segment of a reassembled PDU]"
"155","1.007999125","104.18.212.105","192.168.1.118","TLSv1.2","2974","Application Data [TCP segment of a reassembled PDU]"
"156","1.014276025","104.18.212.105","192.168.1.118","TCP","2974","443 → 45604 [PSH, ACK] Seq=74339 Ack=1 Win=68 Len=2920 [TCP segment of a reassembled PDU]"
"157","1.014334750","104.18.212.105","192.168.1.118","TLSv1.2","2974","Application Data [TCP segment of a reassembled PDU]"
"158","1.017169950","104.18.212.105","192.168.1.118","TLSv1.2","2974","Application Data [TCP segment of a reassembled PDU]"
"159","1.017255263","104.18.212.105","192.168.1.118","TCP","2974","443 → 45604 [PSH, ACK] Seq=83099 Ack=1 Win=68 Len=2920 [TCP segment of a reassembled PDU]"
"160","1.018904025","104.18.212.105","192.168.1.118","TLSv1.2","2974","Application Data [TCP segment of a reassembled PDU]"
"161","1.020126700","104.18.212.105","192.168.1.118","SSL","11906","Continuation Data"
"162","1.020179563","104.18.212.105","192.168.1.118","SSL","1514","Continuation Data"
"163","1.024878500","104.18.212.105","192.168.1.118","SSL","5558","Continuation Data"
"164","1.024982638","104.18.212.105","192.168.1.118","TLSv1.2","2734","Application Data, Application Data"
"165","1.035106550","104.18.212.105","192.168.1.118","TCP","1514","[TCP segment of a reassembled PDU]"
"166","1.035182888","192.168.1.118","104.18.212.105","TCP","54","45602 → 443 [ACK] Seq=628 Ack=14836 Win=750 Len=0"
"167","1.036160650","104.18.212.105","192.168.1.118","TLSv1.2","1253","Application Data"
"168","1.036202213","192.168.1.118","104.18.212.105","TCP","54","45602 → 443 [ACK] Seq=628 Ack=16035 Win=773 Len=0"
"169","1.044250925","192.168.1.118","104.18.212.105","TCP","54","45604 → 443 [ACK] Seq=1 Ack=91619 Win=79 Len=0"
"170","1.060243363","192.168.1.118","104.18.212.105","TCP","54","[TCP ZeroWindow] 45606 → 443 [ACK] Seq=1 Ack=167566 Win=0 Len=0"
"171","1.061801125","104.18.212.105","192.168.1.118","TCP","1274","[TCP Spurious Retransmission] 443 → 45604 [PSH, ACK] Seq=90399 Ack=1 Win=68 Len=1220[Reassembly error, protocol TCP: New fragment overlaps old data (retransmission?)]"
"172","1.061860150","192.168.1.118","104.18.212.105","TCP","66","[TCP Dup ACK 169#1] 45604 → 443 [ACK] Seq=1 Ack=91619 Win=79 Len=0 SLE=90399 SRE=91619"
"173","1.190771463","192.168.1.118","104.18.212.105","TCP","54","[TCP Window Update] 45604 → 443 [ACK] Seq=1 Ack=91619 Win=501 Len=0"
"174","1.222503013","192.168.1.118","104.18.212.105","TLSv1.2","389","Application Data"
"175","1.222635938","192.168.1.118","104.18.212.105","TLSv1.2","324","Application Data"
"176","1.227962363","192.168.1.118","104.18.212.105","TCP","54","[TCP Window Update] 45606 → 443 [ACK] Seq=1 Ack=167566 Win=195 Len=0"
"177","1.253099038","104.18.212.105","192.168.1.118","SSL","1514","Continuation Data"
"178","1.254590713","104.18.212.105","192.168.1.118","SSL","1514","Continuation Data"
"179","1.254642888","104.18.212.105","192.168.1.118","SSL","1514","Continuation Data"
"180","1.255796475","104.18.212.105","192.168.1.118","SSL","1514","Continuation Data"
"181","1.257704288","104.18.212.105","192.168.1.118","SSL","2974","Continuation Data"
"182","1.259451375","104.18.212.105","192.168.1.118","SSL","2974","Continuation Data"
"183","1.264644750","104.18.212.105","192.168.1.118","SSL","2974","Continuation Data"
"184","1.264699800","104.18.212.105","192.168.1.118","TCP","1514","[TCP segment of a reassembled PDU]"
"185","1.264742538","192.168.1.118","104.18.212.105","TCP","54","45602 → 443 [ACK] Seq=963 Ack=17495 Win=796 Len=0"
"186","1.270031700","104.18.212.105","192.168.1.118","TLSv1.2","2852","Application Data"
"187","1.270097950","192.168.1.118","104.18.212.105","TCP","54","45602 → 443 [ACK] Seq=963 Ack=20293 Win=840 Len=0"
"188","1.270138625","104.18.212.105","192.168.1.118","TLSv1.2","139","Application Data"
"189","1.270152300","192.168.1.118","104.18.212.105","TCP","54","45602 → 443 [ACK] Seq=963 Ack=20378 Win=840 Len=0"
"190","1.270173175","104.18.212.105","192.168.1.118","SSL","2974","Continuation Data"
"191","1.271422088","104.18.212.105","192.168.1.118","TLSv1.2","3802","Application Data"
"192","1.271464725","192.168.1.118","104.18.212.105","TCP","54","45608 → 443 [ACK] Seq=271 Ack=4463 Win=501 Len=0"
"193","1.271486313","104.18.212.105","192.168.1.118","SSL","2974","Continuation Data"
"194","1.271507113","104.18.212.105","192.168.1.118","SSL","2974","Continuation Data"
"195","1.274474650","104.18.212.105","192.168.1.118","SSL","1654","Continuation Data"
"196","1.293264625","192.168.1.118","104.18.212.105","TCP","54","[TCP ZeroWindow] 45606 → 443 [ACK] Seq=1 Ack=192526 Win=0 Len=0"
"197","1.377058400","192.168.1.118","104.18.212.105","TLSv1.2","323","Application Data"
"198","1.385690575","192.168.1.118","104.18.212.105","TLSv1.2","324","Application Data"
"199","1.406080375","104.18.212.105","192.168.1.118","TCP","1514","[TCP segment of a reassembled PDU]"
"200","1.406157650","192.168.1.118","104.18.212.105","TCP","54","45602 → 443 [ACK] Seq=1232 Ack=21838 Win=862 Len=0"
"201","1.407865725","104.18.212.105","192.168.1.118","TLSv1.2","1721","Application Data"
"202","1.407886775","192.168.1.118","104.18.212.105","TCP","54","45602 → 443 [ACK] Seq=1232 Ack=23505 Win=889 Len=0"
"203","1.437158900","104.18.212.105","192.168.1.118","TCP","1514","[TCP segment of a reassembled PDU]"
"204","1.437247050","192.168.1.118","104.18.212.105","TCP","54","45608 → 443 [ACK] Seq=541 Ack=5923 Win=524 Len=0"
"205","1.439439738","104.18.212.105","192.168.1.118","TLSv1.2","2852","Application Data"
"206","1.439459250","192.168.1.118","104.18.212.105","TCP","54","45608 → 443 [ACK] Seq=541 Ack=8721 Win=568 Len=0"
"207","1.439476363","104.18.212.105","192.168.1.118","TLSv1.2","456","Application Data"
"208","1.439493538","192.168.1.118","104.18.212.105","TCP","54","45608 → 443 [ACK] Seq=541 Ack=9123 Win=590 Len=0"
"209","1.480453138","104.18.212.105","192.168.1.118","TLSv1.2","456","[TCP Spurious Retransmission] , Application Data"
"210","1.480522113","192.168.1.118","104.18.212.105","TCP","66","[TCP Dup ACK 208#1] 45608 → 443 [ACK] Seq=541 Ack=9123 Win=590 Len=0 SLE=8721 SRE=9123"
"211","1.524696450","192.168.1.118","104.18.212.105","TCP","54","[TCP Window Update] 45606 → 443 [ACK] Seq=1 Ack=192526 Win=211 Len=0"
"212","1.551302538","104.18.212.105","192.168.1.118","SSL","250","Continuation Data"
"213","1.551374263","192.168.1.118","104.18.212.105","TCP","54","45606 → 443 [ACK] Seq=1 Ack=192722 Win=210 Len=0"
"214","1.553905675","104.18.212.105","192.168.1.118","TCP","2974","443 → 45606 [PSH, ACK] Seq=192722 Ack=1 Win=67 Len=2920"
"215","1.553985438","104.18.212.105","192.168.1.118","SSL","2974","Continuation Data"
"216","1.559261825","104.18.212.105","192.168.1.118","SSL","2974","Continuation Data"
"217","1.559322813","104.18.212.105","192.168.1.118","SSL","2974","Continuation Data"
"218","1.562027575","104.18.212.105","192.168.1.118","SSL","2974","Continuation Data"
"219","1.562572400","104.18.212.105","192.168.1.118","SSL","2974","Continuation Data"
"220","1.562599600","104.18.212.105","192.168.1.118","SSL","2974","Continuation Data"
"221","1.562628950","104.18.212.105","192.168.1.118","SSL","2974","Continuation Data"
"222","1.563943975","104.18.212.105","192.168.1.118","SSL","2974","Continuation Data"
"223","1.594252650","192.168.1.118","104.18.212.105","TCP","54","45606 → 443 [ACK] Seq=1 Ack=219002 Win=5 Len=0"
"224","1.628844813","192.168.1.118","104.18.212.105","TLSv1.2","326","Application Data"
"225","1.628982350","192.168.1.118","104.18.212.105","TLSv1.2","325","Application Data"
"226","1.629077763","192.168.1.118","104.18.212.105","TLSv1.2","323","Application Data"
"227","1.643747225","192.168.1.118","104.18.212.105","TCP","54","[TCP Window Update] 45606 → 443 [ACK] Seq=1 Ack=219002 Win=176 Len=0"
"228","1.660357013","104.18.212.105","192.168.1.118","SSL","1514","Continuation Data"
"229","1.666933138","104.18.212.105","192.168.1.118","SSL","1514","Continuation Data"
"230","1.666995025","104.18.212.105","192.168.1.118","SSL","2974","Continuation Data"
"231","1.667012675","104.18.212.105","192.168.1.118","SSL","1514","Continuation Data"
"232","1.667146088","104.18.212.105","192.168.1.118","SSL","1514","Continuation Data"
"233","1.667167663","104.18.212.105","192.168.1.118","SSL","2974","Continuation Data"
"234","1.671203188","104.18.212.105","192.168.1.118","SSL","2974","Continuation Data"
"235","1.671259300","104.18.212.105","192.168.1.118","SSL","2974","Continuation Data"
"236","1.673109113","104.18.212.105","192.168.1.118","SSL","2974","Continuation Data"
"237","1.673177663","104.18.212.105","192.168.1.118","SSL","2142","Continuation Data"
"238","1.679676313","104.18.212.105","192.168.1.118","TCP","1514","[TCP segment of a reassembled PDU]"
"239","1.679754438","192.168.1.118","104.18.212.105","TCP","54","45602 → 443 [ACK] Seq=1504 Ack=24965 Win=911 Len=0"
"240","1.682659800","104.18.212.105","192.168.1.118","TLSv1.2","2852","Application Data"
"241","1.682735913","192.168.1.118","104.18.212.105","TCP","54","45602 → 443 [ACK] Seq=1504 Ack=27763 Win=955 Len=0"
"242","1.682779600","104.18.212.105","192.168.1.118","TLSv1.2","924","Application Data"
"243","1.682794138","192.168.1.118","104.18.212.105","TCP","54","45602 → 443 [ACK] Seq=1504 Ack=28633 Win=978 Len=0"
"244","1.688594450","104.18.212.105","192.168.1.118","TCP","1514","[TCP segment of a reassembled PDU]"
"245","1.688670338","192.168.1.118","104.18.212.105","TCP","54","45608 → 443 [ACK] Seq=812 Ack=10583 Win=613 Len=0"
"246","1.693043900","104.18.212.105","192.168.1.118","TLSv1.2","2852","Application Data"
"247","1.693112450","192.168.1.118","104.18.212.105","TCP","54","45608 → 443 [ACK] Seq=812 Ack=13381 Win=657 Len=0"
"248","1.693154525","104.18.212.105","192.168.1.118","TLSv1.2","885","Application Data"
"249","1.693169188","192.168.1.118","104.18.212.105","TCP","54","45608 → 443 [ACK] Seq=812 Ack=14212 Win=680 Len=0"
"250","1.693185963","104.18.212.105","192.168.1.118","TCP","1514","[TCP segment of a reassembled PDU]"
"251","1.693230525","192.168.1.118","104.18.212.105","TCP","54","45612 → 443 [ACK] Seq=1189 Ack=79749 Win=524 Len=0"
"252","1.693292038","104.18.212.105","192.168.1.118","TLSv1.2","2413","Application Data"
"253","1.693309213","192.168.1.118","104.18.212.105","TCP","54","45612 → 443 [ACK] Seq=1189 Ack=82108 Win=561 Len=0"
"254","1.695214075","192.168.1.118","104.18.212.105","TCP","54","[TCP ZeroWindow] 45606 → 443 [ACK] Seq=1 Ack=241530 Win=0 Len=0"
"255","1.847009350","192.168.1.118","104.18.212.105","TCP","54","[TCP Window Update] 45606 → 443 [ACK] Seq=1 Ack=241530 Win=224 Len=0"
"256","1.899322138","104.18.212.105","192.168.1.118","SSL","1514","Continuation Data"
"257","1.901671550","104.18.212.105","192.168.1.118","SSL","1514","Continuation Data"
"258","1.901725488","104.18.212.105","192.168.1.118","SSL","1412","Continuation Data"
"259","1.940256550","192.168.1.118","104.18.212.105","TCP","54","45606 → 443 [ACK] Seq=1 Ack=245808 Win=191 Len=0"
"260","2.033700275","192.168.1.118","104.18.212.105","TCP","54","[TCP Window Update] 45606 → 443 [ACK] Seq=1 Ack=245808 Win=387 Len=0"
"261","2.919947725","192.168.1.104","255.255.255.255","UDP","217","49154 → 6666 Len=175"
"262","3.409255875","192.168.1.118","192.168.1.102","TCP","176","46918 → 8009 [PSH, ACK] Seq=1 Ack=1 Win=501 Len=110 TSval=2818910934 TSecr=5929558 [TCP segment of a reassembled PDU]"
"263","3.418112888","192.168.1.102","192.168.1.118","TCP","176","8009 → 46918 [PSH, ACK] Seq=1 Ack=111 Win=277 Len=110 TSval=5930067 TSecr=2818910934 [TCP segment of a reassembled PDU]"
"264","3.418218550","192.168.1.118","192.168.1.102","TCP","66","46918 → 8009 [ACK] Seq=111 Ack=111 Win=501 Len=0 TSval=2818910943 TSecr=5930067"
"265","4.150308938","192.168.1.101","224.0.0.251","MDNS","539","Standard query 0x0000 PTR _googlecast._tcp.local, "QM" question PTR _homekit._tcp.local, "QM" question PTR _uscan._tcp.local, "QM" question PTR _ptp._tcp.local, "QM" question PTR _ippusb._tcp.local, "QM" question PTR _scanner._tcp.local, "QM" question PTR _ipp._tcp.local, "QM" question PTR _pdl-datastream._tcp.local, "QM" question PTR _uscans._tcp.local, "QM" question PTR _ipps._tcp.local, "QM" question PTR _printer._tcp.local, "QM" question PTR _airplay._tcp.local, "QM" question PTR _raop._tcp.local, "QM" question PTR _airport._tcp.local, "QM" question PTR _rdlink._tcp.local, "QM" question PTR _companion-link._tcp.local, "QM" question PTR _afpovertcp._tcp.local, "QM" question PTR _rfb._tcp.local, "QM" question PTR _adisk._tcp.local, "QM" question PTR _apple-mobdev._tcp.local, "QM" question PTR 8ed307c3._sub._apple-mobdev2._tcp.local, "QM" question PTR _apple-pairable._tcp.local, "QM" question TXT Google-Home-Mini-2c3f16b2da5c4b6fd6cfbfba61c12490._googlecast._tcp.local, "QM" question PTR Google-Home-Mini-2c3f16b2da5c4b6fd6cfbfba61c12490._googlecast._tcp.local PTR cjqg._companion-link._tcp.local OPT"
"266","4.155690475","fe80::1814:2ecf:2c8a:d90d","ff02::fb","MDNS","559","Standard query 0x0000 PTR _googlecast._tcp.local, "QM" question PTR _homekit._tcp.local, "QM" question PTR _uscan._tcp.local, "QM" question PTR _ptp._tcp.local, "QM" question PTR _ippusb._tcp.local, "QM" question PTR _scanner._tcp.local, "QM" question PTR _ipp._tcp.local, "QM" question PTR _pdl-datastream._tcp.local, "QM" question PTR _uscans._tcp.local, "QM" question PTR _ipps._tcp.local, "QM" question PTR _printer._tcp.local, "QM" question PTR _airplay._tcp.local, "QM" question PTR _raop._tcp.local, "QM" question PTR _airport._tcp.local, "QM" question PTR _rdlink._tcp.local, "QM" question PTR _companion-link._tcp.local, "QM" question PTR _afpovertcp._tcp.local, "QM" question PTR _rfb._tcp.local, "QM" question PTR _adisk._tcp.local, "QM" question PTR _apple-mobdev._tcp.local, "QM" question PTR 8ed307c3._sub._apple-mobdev2._tcp.local, "QM" question PTR _apple-pairable._tcp.local, "QM" question TXT Google-Home-Mini-2c3f16b2da5c4b6fd6cfbfba61c12490._googlecast._tcp.local, "QM" question PTR Google-Home-Mini-2c3f16b2da5c4b6fd6cfbfba61c12490._googlecast._tcp.local PTR cjqg._companion-link._tcp.local OPT"
"267","4.161170663","fe80::1cc7:6d9a:a312:7e8f","ff02::fb","MDNS","553","Standard query 0x0000 PTR _googlecast._tcp.local, "QM" question PTR _homekit._tcp.local, "QM" question PTR _uscan._tcp.local, "QM" question PTR _ptp._tcp.local, "QM" question PTR _ippusb._tcp.local, "QM" question PTR _scanner._tcp.local, "QM" question PTR _ipp._tcp.local, "QM" question PTR _pdl-datastream._tcp.local, "QM" question PTR _uscans._tcp.local, "QM" question PTR _ipps._tcp.local, "QM" question PTR _printer._tcp.local, "QM" question PTR _airplay._tcp.local, "QM" question PTR _raop._tcp.local, "QM" question PTR _airport._tcp.local, "QM" question PTR _rdlink._tcp.local, "QM" question PTR _companion-link._tcp.local, "QM" question PTR _afpovertcp._tcp.local, "QM" question PTR _rfb._tcp.local, "QM" question PTR _adisk._tcp.local, "QM" question PTR _apple-mobdev._tcp.local, "QM" question PTR 8ed307c3._sub._apple-mobdev2._tcp.local, "QM" question PTR _apple-pairable._tcp.local, "QM" question TXT Google-Home-Mini-2c3f16b2da5c4b6fd6cfbfba61c12490._googlecast._tcp.local, "QM" question PTR Google-Home-Mini-2c3f16b2da5c4b6fd6cfbfba61c12490._googlecast._tcp.local PTR cjqg._companion-link._tcp.local OPT"
"268","4.250805838","192.168.1.102","224.0.0.251","MDNS","183","Standard query response 0x0000 SRV, cache flush 0 0 8009 2c3f16b2-da5c-4b6f-d6cf-bfba61c12490.local"
"269","4.253383575","192.168.1.102","224.0.0.251","MDNS","183","Standard query response 0x0000 SRV, cache flush 0 0 8009 2c3f16b2-da5c-4b6f-d6cf-bfba61c12490.local"
"270","4.262050438","192.168.1.118","104.18.212.105","TLSv1.2","321","Application Data"
"271","4.289610763","192.168.1.118","104.18.212.105","TLSv1.2","321","Application Data"
"272","4.296391238","104.18.212.105","192.168.1.118","TCP","1514","[TCP segment of a reassembled PDU]"
"273","4.296468488","192.168.1.118","104.18.212.105","TCP","54","45602 → 443 [ACK] Seq=1771 Ack=30093 Win=1001 Len=0"
"274","4.298214213","104.18.212.105","192.168.1.118","TLSv1.2","1266","Application Data"
"275","4.298269825","192.168.1.118","104.18.212.105","TCP","54","45602 → 443 [ACK] Seq=1771 Ack=31305 Win=1023 Len=0"
"276","4.338625738","104.18.212.105","192.168.1.118","TCP","54","443 → 45604 [ACK] Seq=91619 Ack=268 Win=69 Len=0"
"277","4.555529738","104.18.212.105","192.168.1.118","TCP","1514","[TCP segment of a reassembled PDU]"
"278","4.555597350","192.168.1.118","104.18.212.105","TCP","54","45604 → 443 [ACK] Seq=268 Ack=93079 Win=524 Len=0"
"279","4.557074463","104.18.212.105","192.168.1.118","TLSv1.2","571","Application Data"
"280","4.557133113","192.168.1.118","104.18.212.105","TCP","54","45604 → 443 [ACK] Seq=268 Ack=93596 Win=547 Len=0"
"281","4.557171900","104.18.212.105","192.168.1.118","TCP","571","[TCP Spurious Retransmission] 443 → 45604 [PSH, ACK] Seq=93079 Ack=268 Win=69 Len=517[Reassembly error, protocol TCP: New fragment overlaps old data (retransmission?)]"
"282","4.557189075","192.168.1.118","104.18.212.105","TCP","66","[TCP Dup ACK 280#1] 45604 → 443 [ACK] Seq=268 Ack=93596 Win=547 Len=0 SLE=93079 SRE=93596"
"283","4.737048063","192.168.1.118","104.18.212.105","TLSv1.2","341","Application Data"
"284","4.770023388","104.18.212.105","192.168.1.118","TCP","1514","[TCP segment of a reassembled PDU]"
"285","4.770100938","192.168.1.118","104.18.212.105","TCP","54","45602 → 443 [ACK] Seq=2058 Ack=32765 Win=1046 Len=0"
"286","4.771477463","104.18.212.105","192.168.1.118","TLSv1.2","984","Application Data"
"287","4.771551463","192.168.1.118","104.18.212.105","TCP","54","45602 → 443 [ACK] Seq=2058 Ack=33695 Win=1069 Len=0"
"288","5.990942863","192.168.1.104","255.255.255.255","UDP","217","49154 → 6666 Len=175"
"289","8.423160650","192.168.1.118","192.168.1.102","TCP","176","46918 → 8009 [PSH, ACK] Seq=111 Ack=111 Win=501 Len=110 TSval=2818915948 TSecr=5930067 [TCP segment of a reassembled PDU]"
"290","8.447038963","192.168.1.102","192.168.1.118","TCP","176","8009 → 46918 [PSH, ACK] Seq=111 Ack=221 Win=277 Len=110 TSval=5930568 TSecr=2818915948 [TCP segment of a reassembled PDU]"
"291","8.447124013","192.168.1.118","192.168.1.102","TCP","66","46918 → 8009 [ACK] Seq=221 Ack=221 Win=501 Len=0 TSval=2818915972 TSecr=5930568"
