frame.number,_ws.col.Time,_ws.col.Source,_ws.col.Destination,_ws.col.Protocol,frame.len,_ws.col.Info
"1","0.000000000","35.186.208.48","192.168.1.118","SSL","2902","Continuation Data"
"2","0.000080603","192.168.1.118","35.186.208.48","TCP","66","40290 → 443 [ACK] Seq=1 Ack=2837 Win=3293 Len=0 TSval=25093826 TSecr=1057520741"
"3","0.000117154","35.186.208.48","192.168.1.118","SSL","2902","Continuation Data"
"4","0.000136355","192.168.1.118","35.186.208.48","TCP","66","40289 → 443 [ACK] Seq=1 Ack=2837 Win=3307 Len=0 TSval=25093826 TSecr=660544135"
"5","0.001657796","35.186.208.48","192.168.1.118","SSL","5738","Continuation Data"
"6","0.001736111","192.168.1.118","35.186.208.48","TCP","66","40287 → 443 [ACK] Seq=1 Ack=5673 Win=4285 Len=0 TSval=25093828 TSecr=1188024696"
"7","0.001766050","35.186.208.48","192.168.1.118","SSL","1484","Continuation Data"
"8","0.001786350","192.168.1.118","35.186.208.48","TCP","66","40290 → 443 [ACK] Seq=1 Ack=4255 Win=3316 Len=0 TSval=25093828 TSecr=1057520742"
"9","0.001854803","35.186.208.48","192.168.1.118","SSL","2902","Continuation Data"
"10","0.001872941","192.168.1.118","35.186.208.48","TCP","66","40290 → 443 [ACK] Seq=1 Ack=7091 Win=3360 Len=0 TSval=25093828 TSecr=1057520742"
"11","0.001883441","35.186.208.48","192.168.1.118","SSL","5738","Continuation Data"
"12","0.001900129","192.168.1.118","35.186.208.48","TCP","66","40287 → 443 [ACK] Seq=1 Ack=11345 Win=4241 Len=0 TSval=25093828 TSecr=1188024697"
"13","0.001909367","35.186.208.48","192.168.1.118","SSL","1484","Continuation Data"
"14","0.011462139","35.186.208.48","192.168.1.118","SSL","1484","Continuation Data"
"15","0.011543679","192.168.1.118","35.186.208.48","TCP","66","40289 → 443 [ACK] Seq=1 Ack=5673 Win=3307 Len=0 TSval=25093838 TSecr=660544137"
"16","0.011583831","35.186.208.48","192.168.1.118","SSL","4320","Continuation Data"
"17","0.011608669","192.168.1.118","35.186.208.48","TCP","66","40290 → 443 [ACK] Seq=1 Ack=11345 Win=3426 Len=0 TSval=25093838 TSecr=1057520742"
"18","0.013095684","35.186.208.48","192.168.1.118","SSL","3733","Continuation Data"
"19","0.013169699","192.168.1.118","35.186.208.48","TCP","66","40287 → 443 [ACK] Seq=1 Ack=15012 Win=4370 Len=0 TSval=25093839 TSecr=1188024698"
"20","0.013236339","35.186.208.48","192.168.1.118","SSL","4320","Continuation Data"
"21","0.013256852","192.168.1.118","35.186.208.48","TCP","66","40290 → 443 [ACK] Seq=1 Ack=15599 Win=3493 Len=0 TSval=25093839 TSecr=1057520743"
"22","0.013267190","35.186.208.48","192.168.1.118","SSL","2902","Continuation Data"
"23","0.013286128","192.168.1.118","35.186.208.48","TCP","66","40289 → 443 [ACK] Seq=1 Ack=8509 Win=3307 Len=0 TSval=25093839 TSecr=660544138"
"24","0.013373931","35.186.208.48","192.168.1.118","SSL","4320","Continuation Data"
"25","0.013407095","192.168.1.118","35.186.208.48","TCP","66","40290 → 443 [ACK] Seq=1 Ack=19853 Win=3559 Len=0 TSval=25093840 TSecr=1057520744"
"26","0.013420420","35.186.208.48","192.168.1.118","SSL","1484","Continuation Data"
"27","0.013435996","192.168.1.118","35.186.208.48","TCP","66","40290 → 443 [ACK] Seq=1 Ack=21271 Win=3581 Len=0 TSval=25093840 TSecr=1057520745"
"28","0.015168681","192.168.1.118","35.186.208.48","TLSv1.2","314","Application Data"
"29","0.022619892","35.186.208.48","192.168.1.118","SSL","2902","Continuation Data"
"30","0.022701532","192.168.1.118","35.186.208.48","TCP","66","40290 → 443 [ACK] Seq=1 Ack=24107 Win=3626 Len=0 TSval=25093849 TSecr=1057520745"
"31","0.022742021","35.186.208.48","192.168.1.118","SSL","2902","Continuation Data"
"32","0.022761434","192.168.1.118","35.186.208.48","TCP","66","40289 → 443 [ACK] Seq=1 Ack=11345 Win=3307 Len=0 TSval=25093849 TSecr=660544139"
"33","0.024311876","35.186.208.48","192.168.1.118","SSL","4320","Continuation Data"
"34","0.024389279","192.168.1.118","35.186.208.48","TCP","66","40290 → 443 [ACK] Seq=1 Ack=28361 Win=3692 Len=0 TSval=25093851 TSecr=1057520746"
"35","0.024426455","35.186.208.48","192.168.1.118","SSL","2902","Continuation Data"
"36","0.024448781","192.168.1.118","35.186.208.48","TCP","66","40289 → 443 [ACK] Seq=1 Ack=14181 Win=3307 Len=0 TSval=25093851 TSecr=660544141"
"37","0.024536622","35.186.208.48","192.168.1.118","SSL","4320","Continuation Data"
"38","0.024561185","192.168.1.118","35.186.208.48","TCP","66","40290 → 443 [ACK] Seq=1 Ack=32615 Win=3759 Len=0 TSval=25093851 TSecr=1057520746"
"39","0.024608149","35.186.208.48","192.168.1.118","SSL","4320","Continuation Data"
"40","0.024630587","192.168.1.118","35.186.208.48","TCP","66","40290 → 443 [ACK] Seq=1 Ack=36869 Win=3825 Len=0 TSval=25093851 TSecr=1057520747"
"41","0.024651551","35.186.208.48","192.168.1.118","SSL","1484","Continuation Data"
"42","0.033663341","35.186.208.48","192.168.1.118","SSL","1484","Continuation Data"
"43","0.033741444","192.168.1.118","35.186.208.48","TCP","66","40289 → 443 [ACK] Seq=1 Ack=17017 Win=3307 Len=0 TSval=25093860 TSecr=660544142"
"44","0.033783845","35.186.208.48","192.168.1.118","TCP","4320","443 → 40290 [ACK] Seq=36869 Ack=1 Win=252 Len=4254 TSval=1057520748 TSecr=25093636"
"45","0.033808971","192.168.1.118","35.186.208.48","TCP","66","40290 → 443 [ACK] Seq=1 Ack=41123 Win=3892 Len=0 TSval=25093860 TSecr=1057520748"
"46","0.035256109","35.186.208.48","192.168.1.118","SSL","4320","Continuation Data"
"47","0.035347450","192.168.1.118","35.186.208.48","TCP","66","40290 → 443 [ACK] Seq=1 Ack=45377 Win=3958 Len=0 TSval=25093862 TSecr=1057520749"
"48","0.035398814","35.186.208.48","192.168.1.118","SSL","2902","Continuation Data"
"49","0.035421753","192.168.1.118","35.186.208.48","TCP","66","40290 → 443 [ACK] Seq=1 Ack=48213 Win=4002 Len=0 TSval=25093862 TSecr=1057520750"
"50","0.035435441","35.186.208.48","192.168.1.118","SSL","117","Continuation Data"
"51","0.035458604","35.186.208.48","192.168.1.118","SSL","2902","Continuation Data"
"52","0.035480830","192.168.1.118","35.186.208.48","TCP","66","40289 → 443 [ACK] Seq=1 Ack=19853 Win=3307 Len=0 TSval=25093862 TSecr=660544143"
"53","0.035517368","35.186.208.48","192.168.1.118","SSL","2902","Continuation Data"
"54","0.035543082","35.186.208.48","192.168.1.118","SSL","2902","Continuation Data"
"55","0.035603184","192.168.1.118","35.186.208.48","TCP","66","40289 → 443 [ACK] Seq=1 Ack=22689 Win=3285 Len=0 TSval=25093862 TSecr=660544145"
"56","0.035853618","192.168.1.118","35.186.208.48","TCP","66","40289 → 443 [ACK] Seq=1 Ack=25525 Win=3263 Len=0 TSval=25093862 TSecr=660544146"
"57","0.036688209","35.186.208.48","192.168.1.118","SSL","2902","Continuation Data"
"58","0.036771012","192.168.1.118","35.186.208.48","TCP","66","40290 → 443 [ACK] Seq=1 Ack=48264 Win=4002 Len=0 TSval=25093863 TSecr=1057520750"
"59","0.037242879","192.168.1.118","35.186.208.48","TCP","66","40289 → 443 [ACK] Seq=1 Ack=28361 Win=3241 Len=0 TSval=25093863 TSecr=660544148"
"60","0.037474862","192.168.1.118","35.186.208.48","TLSv1.2","319","Application Data"
"61","0.042241891","35.186.208.48","192.168.1.118","SSL","2902","Continuation Data"
"62","0.044119232","35.186.208.48","192.168.1.118","SSL","2650","Continuation Data"
"63","0.045368763","35.186.208.48","192.168.1.118","TLSv1.2","1484","Application Data"
"64","0.045433740","35.186.208.48","192.168.1.118","TLSv1.2","1484","Application Data"
"65","0.045472204","192.168.1.118","35.186.208.48","TCP","66","40288 → 443 [ACK] Seq=1 Ack=2837 Win=3331 Len=0 TSval=25093872 TSecr=3464329869"
"66","0.047500325","35.186.208.48","192.168.1.118","TLSv1.2","1484","Application Data"
"67","0.047573890","35.186.208.48","192.168.1.118","TLSv1.2","1484","Application Data"
"68","0.048633752","35.186.208.48","192.168.1.118","TLSv1.2","2902","Application Data, Application Data"
"69","0.049781405","35.186.208.48","192.168.1.118","TLSv1.2","1484","Application Data"
"70","0.049850345","35.186.208.48","192.168.1.118","TLSv1.2","1484","Application Data"
"71","0.049854620","192.168.1.118","35.186.208.48","TCP","66","40289 → 443 [ACK] Seq=1 Ack=33781 Win=3199 Len=0 TSval=25093876 TSecr=660544149"
"72","0.050200545","192.168.1.118","35.186.208.48","TCP","66","40286 → 443 [ACK] Seq=1 Ack=5673 Win=3328 Len=0 TSval=25093876 TSecr=605553075"
"73","0.050399814","192.168.1.118","35.186.208.48","TCP","66","40288 → 443 [ACK] Seq=1 Ack=5673 Win=3309 Len=0 TSval=25093877 TSecr=3464329869"
"74","0.053760382","35.186.208.48","192.168.1.118","TLSv1.2","2902","Application Data, Application Data"
"75","0.053913462","192.168.1.118","35.186.208.48","TCP","66","40286 → 443 [ACK] Seq=1 Ack=8509 Win=3306 Len=0 TSval=25093880 TSecr=605553076"
"76","0.054721128","35.186.208.48","192.168.1.118","TLSv1.2","1484","Application Data"
"77","0.054774292","35.186.208.48","192.168.1.118","TLSv1.2","1484","Application Data"
"78","0.057470512","35.186.208.48","192.168.1.118","TLSv1.2","1484","Application Data"
"79","0.057552415","192.168.1.118","35.186.208.48","TCP","66","40288 → 443 [ACK] Seq=1 Ack=8509 Win=3331 Len=0 TSval=25093884 TSecr=3464329870"
"80","0.057605729","35.186.208.48","192.168.1.118","TLSv1.2","4320","Application Data, Application Data, Application Data"
"81","0.057928515","35.186.208.48","192.168.1.118","TLSv1.2","2902","Application Data, Application Data"
"82","0.057963266","35.186.208.48","192.168.1.118","TLSv1.2","1484","Application Data"
"83","0.058019206","35.186.208.48","192.168.1.118","TLSv1.2","5738","Application Data, Application Data, Application Data, Application Data"
"84","0.058035606","35.186.208.48","192.168.1.118","TLSv1.2","5738","Application Data, Application Data, Application Data, Application Data"
"85","0.058046457","35.186.208.48","192.168.1.118","TLSv1.2","1484","Application Data"
"86","0.062429285","35.186.208.48","192.168.1.118","TLSv1.2","4320","Application Data, Application Data, Application Data"
"87","0.062500450","35.186.208.48","192.168.1.118","TLSv1.2","2902","Application Data, Application Data"
"88","0.062516813","35.186.208.48","192.168.1.118","TLSv1.2","1484","Application Data"
"89","0.063419532","35.186.208.48","192.168.1.118","TLSv1.2","4320","Application Data, Application Data, Application Data"
"90","0.063488860","35.186.208.48","192.168.1.118","TLSv1.2","2902","Application Data, Application Data"
"91","0.063508548","35.186.208.48","192.168.1.118","TLSv1.2","5738","Application Data, Application Data, Application Data, Application Data"
"92","0.063522561","35.186.208.48","192.168.1.118","TLSv1.2","1484","Application Data"
"93","0.065954696","35.186.208.48","192.168.1.118","TLSv1.2","4320","Application Data, Application Data, Application Data"
"94","0.066019786","35.186.208.48","192.168.1.118","TLSv1.2","1484","Application Data [TCP segment of a reassembled PDU]"
"95","0.066023661","192.168.1.118","35.186.208.48","TCP","66","40286 → 443 [ACK] Seq=1 Ack=38287 Win=3074 Len=0 TSval=25093892 TSecr=605553076"
"96","0.066392611","192.168.1.118","35.186.208.48","TCP","66","40288 → 443 [ACK] Seq=1 Ack=28361 Win=3176 Len=0 TSval=25093893 TSecr=3464329871"
"97","0.066418762","35.186.208.48","192.168.1.118","TLSv1.2","4320","Application Data, Application Data, Application Data"
"98","0.066465114","35.186.208.48","192.168.1.118","TLSv1.2","2902","Application Data, Application Data"
"99","0.066496103","35.186.208.48","192.168.1.118","TLSv1.2","5738","Application Data, Application Data, Application Data, Application Data"
"100","0.066513866","35.186.208.48","192.168.1.118","TLSv1.2","2902","Application Data, Application Data"
"101","0.066525366","35.186.208.48","192.168.1.118","TLSv1.2","1484","Application Data [TCP segment of a reassembled PDU]"
"102","0.066653783","192.168.1.118","35.186.208.48","TLSv1.2","313","Application Data"
"103","0.066713673","192.168.1.118","35.186.208.48","TCP","66","40286 → 443 [ACK] Seq=1 Ack=51049 Win=2975 Len=0 TSval=25093893 TSecr=605553082"
"104","0.066771925","192.168.1.118","35.186.208.48","TCP","66","40288 → 443 [ACK] Seq=1 Ack=34033 Win=3132 Len=0 TSval=25093893 TSecr=3464329876"
"105","0.069985637","35.186.208.48","192.168.1.118","TLSv1.2","4320","Application Data, Application Data, Application Data"
"106","0.070071278","192.168.1.118","35.186.208.48","TCP","66","40286 → 443 [ACK] Seq=1 Ack=55303 Win=3021 Len=0 TSval=25093896 TSecr=605553084"
"107","0.070112542","35.186.208.48","192.168.1.118","TLSv1.2","1484","Application Data [TCP segment of a reassembled PDU]"
"108","0.070463104","35.186.208.48","192.168.1.118","TLSv1.2","4320","Application Data, Application Data, Application Data"
"109","0.070495505","192.168.1.118","35.186.208.48","TCP","66","40288 → 443 [ACK] Seq=1 Ack=39705 Win=3321 Len=0 TSval=25093897 TSecr=3464329878"
"110","0.070530694","35.186.208.48","192.168.1.118","TLSv1.2","5738","Application Data, Application Data, Application Data, Application Data"
"111","0.070565008","35.186.208.48","192.168.1.118","TLSv1.2","2902","Application Data, Application Data"
"112","0.070579446","35.186.208.48","192.168.1.118","TLSv1.2","4320","Application Data, Application Data, Application Data"
"113","0.070773290","192.168.1.118","35.186.208.48","TCP","66","40286 → 443 [ACK] Seq=1 Ack=65229 Win=2944 Len=0 TSval=25093897 TSecr=605553084"
"114","0.070873656","192.168.1.118","35.186.208.48","TCP","66","40288 → 443 [ACK] Seq=1 Ack=42541 Win=3299 Len=0 TSval=25093897 TSecr=3464329879"
"115","0.074557372","35.186.208.48","192.168.1.118","TLSv1.2","1484","Application Data [TCP segment of a reassembled PDU]"
"116","0.074625212","35.186.208.48","192.168.1.118","TLSv1.2","2902","Application Data, Application Data"
"117","0.074676926","192.168.1.118","35.186.208.48","TCP","66","40288 → 443 [ACK] Seq=1 Ack=45377 Win=3331 Len=0 TSval=25093901 TSecr=3464329880"
"118","0.074717603","35.186.208.48","192.168.1.118","TLSv1.2","1484","Application Data [TCP segment of a reassembled PDU]"
"119","0.074738466","192.168.1.118","35.186.208.48","TCP","66","40286 → 443 [ACK] Seq=1 Ack=68065 Win=3350 Len=0 TSval=25093901 TSecr=605553085"
"120","0.075004225","35.186.208.48","192.168.1.118","TLSv1.2","4320","Application Data, Application Data, Application Data"
"121","0.075062802","35.186.208.48","192.168.1.118","TLSv1.2","5738","Application Data, Application Data, Application Data, Application Data"
"122","0.075082653","35.186.208.48","192.168.1.118","TLSv1.2","5738","Application Data, Application Data, Application Data, Application Data"
"123","0.075095804","35.186.208.48","192.168.1.118","TLSv1.2","1484","Application Data [TCP segment of a reassembled PDU]"
"124","0.075211095","192.168.1.118","35.186.208.48","TCP","66","40286 → 443 [ACK] Seq=1 Ack=77991 Win=3273 Len=0 TSval=25093901 TSecr=605553086"
"125","0.075322249","192.168.1.118","35.186.208.48","TCP","66","40288 → 443 [ACK] Seq=1 Ack=52467 Win=3276 Len=0 TSval=25093902 TSecr=3464329881"
"126","0.080045464","35.186.208.48","192.168.1.118","TLSv1.2","1484","Application Data [TCP segment of a reassembled PDU]"
"127","0.080107054","35.186.208.48","192.168.1.118","TLSv1.2","4320","Application Data, Application Data, Application Data"
"128","0.080145418","192.168.1.118","35.186.208.48","TCP","66","40286 → 443 [ACK] Seq=1 Ack=82245 Win=3344 Len=0 TSval=25093906 TSecr=605553088"
"129","0.080472129","35.186.208.48","192.168.1.118","TLSv1.2","1484","Application Data [TCP segment of a reassembled PDU]"
"130","0.080516593","35.186.208.48","192.168.1.118","TLSv1.2","2902","Application Data, Application Data"
"131","0.080541507","192.168.1.118","35.186.208.48","TCP","66","40288 → 443 [ACK] Seq=1 Ack=56721 Win=3331 Len=0 TSval=25093907 TSecr=3464329882"
"132","0.080575970","35.186.208.48","192.168.1.118","TLSv1.2","5738","Application Data, Application Data, Application Data, Application Data"
"133","0.080614822","35.186.208.48","192.168.1.118","TLSv1.2","2902","Application Data, Application Data"
"134","0.080626097","35.186.208.48","192.168.1.118","TLSv1.2","4320","Application Data, Application Data, Application Data"
"135","0.082096124","192.168.1.118","35.186.208.48","TCP","66","40286 → 443 [ACK] Seq=1 Ack=93589 Win=3256 Len=0 TSval=25093908 TSecr=605553088"
"136","0.082231741","192.168.1.118","35.186.208.48","TCP","66","40288 → 443 [ACK] Seq=1 Ack=59557 Win=3309 Len=0 TSval=25093908 TSecr=3464329884"
"137","0.085621197","35.186.208.48","192.168.1.118","TLSv1.2","1484","Application Data [TCP segment of a reassembled PDU]"
"138","0.085678299","35.186.208.48","192.168.1.118","TLSv1.2","2902","Application Data, Application Data"
"139","0.085718738","192.168.1.118","35.186.208.48","TCP","66","40288 → 443 [ACK] Seq=1 Ack=62393 Win=3331 Len=0 TSval=25093912 TSecr=3464329884"
"140","0.085758364","35.186.208.48","192.168.1.118","TLSv1.2","1484","Application Data [TCP segment of a reassembled PDU]"
"141","0.085778940","192.168.1.118","35.186.208.48","TCP","66","40286 → 443 [ACK] Seq=1 Ack=96425 Win=3350 Len=0 TSval=25093912 TSecr=605553090"
"142","0.086092413","35.186.208.48","192.168.1.118","TLSv1.2","2902","Application Data, Application Data"
"143","0.086124065","35.186.208.48","192.168.1.118","TLSv1.2","4320","Application Data, Application Data, Application Data"
"144","0.086180054","35.186.208.48","192.168.1.118","TLSv1.2","4320","Application Data, Application Data, Application Data"
"145","0.086193492","35.186.208.48","192.168.1.118","TLSv1.2","5738","Application Data, Application Data, Application Data, Application Data"
"146","0.086478264","192.168.1.118","35.186.208.48","TCP","66","40286 → 443 [ACK] Seq=1 Ack=106351 Win=3273 Len=0 TSval=25093913 TSecr=605553091"
"147","0.086591931","192.168.1.118","35.186.208.48","TCP","66","40288 → 443 [ACK] Seq=1 Ack=69483 Win=3276 Len=0 TSval=25093913 TSecr=3464329885"
"148","0.089982675","35.186.208.48","192.168.1.118","TLSv1.2","1484","Application Data [TCP segment of a reassembled PDU]"
"149","0.090041189","35.186.208.48","192.168.1.118","TLSv1.2","4320","Application Data, Application Data, Application Data"
"150","0.090462191","35.186.208.48","192.168.1.118","TLSv1.2","1484","Application Data [TCP segment of a reassembled PDU]"
"151","0.090508518","35.186.208.48","192.168.1.118","TLSv1.2","2902","Application Data, Application Data"
"152","0.090541694","35.186.208.48","192.168.1.118","TLSv1.2","2902","Application Data, Application Data"
"153","0.090564932","35.186.208.48","192.168.1.118","TLSv1.2","5738","Application Data, Application Data, Application Data, Application Data"
"154","0.090582771","35.186.208.48","192.168.1.118","TLSv1.2","2902","Application Data, Application Data"
"155","0.090592033","35.186.208.48","192.168.1.118","TLSv1.2","1484","Application Data [TCP segment of a reassembled PDU]"
"156","0.092458924","192.168.1.118","35.186.208.48","TCP","66","40286 → 443 [ACK] Seq=1 Ack=119113 Win=3174 Len=0 TSval=25093919 TSecr=605553093"
"157","0.092776572","192.168.1.118","35.186.208.48","TCP","66","40288 → 443 [ACK] Seq=1 Ack=79409 Win=3199 Len=0 TSval=25093919 TSecr=3464329886"
"158","0.099743854","35.186.208.48","192.168.1.118","TLSv1.2","4320","Application Data, Application Data, Application Data"
"159","0.099827044","192.168.1.118","35.186.208.48","TCP","66","40286 → 443 [ACK] Seq=1 Ack=123367 Win=3344 Len=0 TSval=25093926 TSecr=605553095"
"160","0.099864583","35.186.208.48","192.168.1.118","TLSv1.2","1484","Application Data [TCP segment of a reassembled PDU]"
"161","0.099940361","35.186.208.48","192.168.1.118","TLSv1.2","1484","Application Data [TCP segment of a reassembled PDU]"
"162","0.099961111","192.168.1.118","35.186.208.48","TCP","66","40288 → 443 [ACK] Seq=1 Ack=82245 Win=3331 Len=0 TSval=25093926 TSecr=3464329889"
"163","0.099994137","35.186.208.48","192.168.1.118","TLSv1.2","5738","Application Data, Application Data, Application Data, Application Data"
"164","0.100024164","35.186.208.48","192.168.1.118","TLSv1.2","2902","Application Data, Application Data"
"165","0.100034201","35.186.208.48","192.168.1.118","TLSv1.2","4320","Application Data, Application Data, Application Data"
"166","0.101454714","192.168.1.118","35.186.208.48","TCP","66","40286 → 443 [ACK] Seq=1 Ack=133293 Win=3267 Len=0 TSval=25093928 TSecr=605553096"
"167","0.101707272","192.168.1.118","35.186.208.48","TCP","66","40288 → 443 [ACK] Seq=1 Ack=85081 Win=3309 Len=0 TSval=25093928 TSecr=3464329890"
"168","0.119973124","35.186.208.48","192.168.1.118","TLSv1.2","1484","Application Data, Application Data"
"169","0.120033226","35.186.208.48","192.168.1.118","TLSv1.2","1484","Application Data [TCP segment of a reassembled PDU]"
"170","0.120492192","35.186.208.48","192.168.1.118","TLSv1.2","1484","Application Data [TCP segment of a reassembled PDU]"
"171","0.120535256","192.168.1.118","35.186.208.48","TCP","66","40288 → 443 [ACK] Seq=1 Ack=87917 Win=3331 Len=0 TSval=25093947 TSecr=3464329891"
"172","0.120609672","35.186.208.48","192.168.1.118","TLSv1.2","5738","Application Data, Application Data, Application Data, Application Data"
"173","0.120630072","192.168.1.118","35.186.208.48","TCP","66","40286 → 443 [ACK] Seq=1 Ack=140383 Win=3312 Len=0 TSval=25093947 TSecr=605553097"
"174","0.120667911","35.186.208.48","192.168.1.118","TLSv1.2","5738","Application Data, Application Data, Application Data, Application Data"
"175","0.120684262","35.186.208.48","192.168.1.118","TLSv1.2","5738","Application Data, Application Data, Application Data, Application Data"
"176","0.120694037","35.186.208.48","192.168.1.118","TLSv1.2","1484","Application Data [TCP segment of a reassembled PDU]"
"177","0.121252694","192.168.1.118","35.186.208.48","TCP","66","40288 → 443 [ACK] Seq=1 Ack=95007 Win=3276 Len=0 TSval=25093947 TSecr=3464329892"
"178","0.121906042","192.168.1.118","35.186.208.48","TCP","66","40286 → 443 [ACK] Seq=1 Ack=146055 Win=3268 Len=0 TSval=25093948 TSecr=605553099"
"179","0.125150943","35.186.208.48","192.168.1.118","TLSv1.2","1484","Application Data [TCP segment of a reassembled PDU]"
"180","0.125219695","35.186.208.48","192.168.1.118","TLSv1.2","4320","Application Data, Application Data, Application Data"
"181","0.125259534","192.168.1.118","35.186.208.48","TCP","66","40286 → 443 [ACK] Seq=1 Ack=150309 Win=3344 Len=0 TSval=25093951 TSecr=605553100"
"182","0.125530794","35.186.208.48","192.168.1.118","TLSv1.2","1484","Application Data [TCP segment of a reassembled PDU]"
"183","0.125556695","35.186.208.48","192.168.1.118","TLSv1.2","2088","Application Data, Application Data"
"184","0.125578095","35.186.208.48","192.168.1.118","TLSv1.2","2902","Application Data, Application Data"
"185","0.125602459","192.168.1.118","35.186.208.48","TCP","66","40288 → 443 [ACK] Seq=1 Ack=99261 Win=3331 Len=0 TSval=25093952 TSecr=3464329893"
"186","0.125643723","35.186.208.48","192.168.1.118","TLSv1.2","5738","Application Data, Application Data, Application Data, Application Data"
"187","0.125675661","35.186.208.48","192.168.1.118","TLSv1.2","2902","Application Data, Application Data"
"188","0.125692874","35.186.208.48","192.168.1.118","TLSv1.2","1484","Application Data [TCP segment of a reassembled PDU]"
"189","0.125833429","192.168.1.118","35.186.208.48","TCP","66","40286 → 443 [ACK] Seq=1 Ack=153749 Win=3318 Len=0 TSval=25093952 TSecr=605553100"
"190","0.125956046","192.168.1.118","35.186.208.48","TCP","66","40288 → 443 [ACK] Seq=1 Ack=109187 Win=3254 Len=0 TSval=25093952 TSecr=3464329895"
"191","0.128433508","192.168.1.118","35.186.208.48","TLSv1.2","316","Application Data"
"192","0.136718610","35.186.208.48","192.168.1.118","TLSv1.2","1484","Application Data [TCP segment of a reassembled PDU]"
"193","0.136803838","35.186.208.48","192.168.1.118","TLSv1.2","4320","Application Data, Application Data, Application Data"
"194","0.136847852","192.168.1.118","35.186.208.48","TCP","66","40288 → 443 [ACK] Seq=1 Ack=114859 Win=3305 Len=0 TSval=25093963 TSecr=3464329897"
"195","0.137154951","35.186.208.48","192.168.1.118","TLSv1.2","1484","Application Data [TCP segment of a reassembled PDU]"
"196","0.137187089","35.186.208.48","192.168.1.118","TLSv1.2","2902","Application Data, Application Data"
"197","0.137214615","35.186.208.48","192.168.1.118","TLSv1.2","2902","Application Data, Application Data"
"198","0.137253892","35.186.208.48","192.168.1.118","TLSv1.2","5738","Application Data, Application Data, Application Data, Application Data"
"199","0.137287455","35.186.208.48","192.168.1.118","TLSv1.2","2902","Application Data, Application Data"
"200","0.137321906","35.186.208.48","192.168.1.118","TLSv1.2","1484","Application Data [TCP segment of a reassembled PDU]"
"201","0.137396284","192.168.1.118","35.186.208.48","TCP","66","40288 → 443 [ACK] Seq=1 Ack=131875 Win=3173 Len=0 TSval=25093964 TSecr=3464329898"
"202","0.141073025","35.186.208.48","192.168.1.118","TLSv1.2","4320","Application Data, Application Data, Application Data, Application Data"
"203","0.141140440","35.186.208.48","192.168.1.118","TLSv1.2","1484","Application Data [TCP segment of a reassembled PDU]"
"204","0.141373511","192.168.1.118","35.186.208.48","TCP","66","40288 → 443 [ACK] Seq=1 Ack=137547 Win=3129 Len=0 TSval=25093968 TSecr=3464329903"
"205","0.141504640","35.186.208.48","192.168.1.118","TLSv1.2","1484","Application Data [TCP segment of a reassembled PDU]"
"206","0.141539604","35.186.208.48","192.168.1.118","TLSv1.2","2902","Application Data, Application Data"
"207","0.141578855","192.168.1.118","35.186.208.48","TCP","66","40288 → 443 [ACK] Seq=1 Ack=141801 Win=3257 Len=0 TSval=25093968 TSecr=3464329904"
"208","0.141645033","35.186.208.48","192.168.1.118","TLSv1.2","5738","Application Data, Application Data, Application Data, Application Data"
"209","0.141676271","35.186.208.48","192.168.1.118","TLSv1.2","2902","Application Data, Application Data"
"210","0.141703222","35.186.208.48","192.168.1.118","TLSv1.2","2902","Application Data, Application Data"
"211","0.141722385","35.186.208.48","192.168.1.118","TLSv1.2","1484","Application Data [TCP segment of a reassembled PDU]"
"212","0.141949918","192.168.1.118","35.186.208.48","TCP","66","40288 → 443 [ACK] Seq=1 Ack=154563 Win=3158 Len=0 TSval=25093968 TSecr=3464329906"
"213","0.145467329","35.186.208.48","192.168.1.118","TLSv1.2","3081","Application Data, Application Data, Application Data"
"214","0.145532731","35.186.208.48","192.168.1.118","TLSv1.2","1484","Application Data"
"215","0.145565595","35.186.208.48","192.168.1.118","TLSv1.2","1484","Application Data"
"216","0.145605996","192.168.1.118","35.186.208.48","TCP","66","40287 → 443 [ACK] Seq=249 Ack=17848 Win=4414 Len=0 TSval=25093972 TSecr=1188024900"
"217","0.145771115","35.186.208.48","192.168.1.118","TLSv1.2","1484","Application Data"
"218","0.145808003","35.186.208.48","192.168.1.118","TLSv1.2","5738","Application Data, Application Data, Application Data, Application Data"
"219","0.145826192","192.168.1.118","35.186.208.48","TCP","66","40287 → 443 [ACK] Seq=249 Ack=24938 Win=4496 Len=0 TSval=25093972 TSecr=1188024900"
"220","0.145871106","35.186.208.48","192.168.1.118","TLSv1.2","5738","Application Data, Application Data, Application Data, Application Data"
"221","0.145902457","35.186.208.48","192.168.1.118","TLSv1.2","2902","Application Data, Application Data"
"222","0.148261589","192.168.1.118","35.186.208.48","TCP","66","40288 → 443 [ACK] Seq=1 Ack=157578 Win=3135 Len=0 TSval=25093974 TSecr=3464329909"
"223","0.148674191","192.168.1.118","35.186.208.48","TCP","66","40287 → 443 [ACK] Seq=249 Ack=33446 Win=4430 Len=0 TSval=25093975 TSecr=1188024901"
"224","0.150993060","192.168.1.118","35.186.208.48","TLSv1.2","334","Application Data"
"225","0.151191792","35.186.208.48","192.168.1.118","TLSv1.2","2902","Application Data, Application Data"
"226","0.151264169","35.186.208.48","192.168.1.118","TLSv1.2","2902","Application Data, Application Data"
"227","0.151342047","35.186.208.48","192.168.1.118","TLSv1.2","2902","Application Data, Application Data"
"228","0.151380248","35.186.208.48","192.168.1.118","TLSv1.2","5738","Application Data, Application Data, Application Data, Application Data"
"229","0.151433700","35.186.208.48","192.168.1.118","TLSv1.2","5738","Application Data, Application Data, Application Data, Application Data"
"230","0.151464439","35.186.208.48","192.168.1.118","TLSv1.2","2902","Application Data, Application Data"
"231","0.151891829","192.168.1.118","35.186.208.48","TCP","66","40287 → 443 [ACK] Seq=249 Ack=56134 Win=4253 Len=0 TSval=25093978 TSecr=1188024902"
"232","0.154492045","35.186.208.48","192.168.1.118","TLSv1.2","2902","Application Data, Application Data"
"233","0.154576123","192.168.1.118","35.186.208.48","TCP","66","40287 → 443 [ACK] Seq=249 Ack=58970 Win=4384 Len=0 TSval=25093981 TSecr=1188024906"
"234","0.154624599","35.186.208.48","192.168.1.118","TLSv1.2","2902","Application Data, Application Data"
"235","0.154688564","192.168.1.118","35.186.208.48","TCP","66","40287 → 443 [ACK] Seq=249 Ack=61806 Win=4362 Len=0 TSval=25093981 TSecr=1188024907"
"236","0.154943123","35.186.208.48","192.168.1.118","TLSv1.2","2902","Application Data, Application Data"
"237","0.154989550","35.186.208.48","192.168.1.118","TLSv1.2","5738","Application Data, Application Data, Application Data, Application Data"
"238","0.155039514","35.186.208.48","192.168.1.118","TLSv1.2","5738","Application Data, Application Data, Application Data, Application Data"
"239","0.155065452","35.186.208.48","192.168.1.118","TLSv1.2","2902","Application Data, Application Data"
"240","0.155173406","192.168.1.118","35.186.208.48","TCP","66","40287 → 443 [ACK] Seq=249 Ack=78822 Win=4230 Len=0 TSval=25093981 TSecr=1188024907"
"241","0.158908599","35.186.208.48","192.168.1.118","TLSv1.2","2902","Application Data, Application Data"
"242","0.158992052","192.168.1.118","35.186.208.48","TCP","66","40287 → 443 [ACK] Seq=249 Ack=81658 Win=4557 Len=0 TSval=25093985 TSecr=1188024910"
"243","0.159041604","35.186.208.48","192.168.1.118","TLSv1.2","2902","Application Data, Application Data"
"244","0.159175259","192.168.1.118","35.186.208.48","TCP","66","40287 → 443 [ACK] Seq=249 Ack=84494 Win=4544 Len=0 TSval=25093985 TSecr=1188024911"
"245","0.159351090","35.186.208.48","192.168.1.118","TLSv1.2","2902","Application Data, Application Data"
"246","0.159405679","35.186.208.48","192.168.1.118","TLSv1.2","5738","Application Data, Application Data, Application Data, Application Data"
"247","0.159458606","35.186.208.48","192.168.1.118","TLSv1.2","8574","Application Data, Application Data, Application Data, Application Data, Application Data, Application Data"
"248","0.161197755","192.168.1.118","35.186.208.48","TCP","66","40287 → 443 [ACK] Seq=249 Ack=101510 Win=4412 Len=0 TSval=25093987 TSecr=1188024911"
"249","0.162043484","35.186.208.48","192.168.1.118","TLSv1.2","2902","Application Data, Application Data"
"250","0.162317756","192.168.1.118","35.186.208.48","TCP","66","40287 → 443 [ACK] Seq=249 Ack=104346 Win=4390 Len=0 TSval=25093988 TSecr=1188024913"
"251","0.163559387","35.186.208.48","192.168.1.118","TLSv1.2","5738","Application Data, Application Data, Application Data, Application Data"
"252","0.163647515","35.186.208.48","192.168.1.118","TLSv1.2","1484","Application Data"
"253","0.163689379","35.186.208.48","192.168.1.118","TLSv1.2","2902","Application Data, Application Data"
"254","0.163726793","192.168.1.118","35.186.208.48","TCP","66","40290 → 443 [ACK] Seq=254 Ack=52518 Win=4069 Len=0 TSval=25093990 TSecr=1057520961"
"255","0.163770095","35.186.208.48","192.168.1.118","TLSv1.2","5738","Application Data, Application Data, Application Data, Application Data"
"256","0.163798958","35.186.208.48","192.168.1.118","TLSv1.2","4320","Application Data, Application Data, Application Data"
"257","0.167412585","35.186.208.48","192.168.1.118","TLSv1.2","1484","Application Data [TCP segment of a reassembled PDU]"
"258","0.167491612","35.186.208.48","192.168.1.118","TLSv1.2","4320","Application Data, Application Data, Application Data"
"259","0.167537676","192.168.1.118","35.186.208.48","TCP","66","40290 → 443 [ACK] Seq=254 Ack=56772 Win=4135 Len=0 TSval=25093994 TSecr=1057520962"
"260","0.167591291","35.186.208.48","192.168.1.118","TLSv1.2","2902","Application Data, Application Data"
"261","0.167647243","192.168.1.118","35.186.208.48","TCP","66","40287 → 443 [ACK] Seq=249 Ack=121362 Win=4258 Len=0 TSval=25093994 TSecr=1188024914"
"262","0.167748134","192.168.1.118","35.186.208.48","TCP","66","40287 → 443 [ACK] Seq=249 Ack=124198 Win=4236 Len=0 TSval=25093994 TSecr=1188024917"
"263","0.168433583","35.186.208.48","192.168.1.118","TLSv1.2","2902","Application Data, Application Data"
"264","0.168506423","35.186.208.48","192.168.1.118","TLSv1.2","4320","Application Data, Application Data, Application Data"
"265","0.168544487","192.168.1.118","35.186.208.48","TCP","66","40290 → 443 [ACK] Seq=254 Ack=61026 Win=4202 Len=0 TSval=25093995 TSecr=1057520962"
"266","0.168585376","35.186.208.48","192.168.1.118","TLSv1.2","5738","Application Data, Application Data, Application Data, Application Data"
"267","0.168605239","35.186.208.48","192.168.1.118","TLSv1.2","1484","Application Data"
"268","0.169020416","192.168.1.118","35.186.208.48","TCP","66","40287 → 443 [ACK] Seq=249 Ack=132706 Win=4170 Len=0 TSval=25093995 TSecr=1188024917"
"269","0.172370533","35.186.208.48","192.168.1.118","TLSv1.2","2902","Application Data, Application Data"
"270","0.172459536","192.168.1.118","35.186.208.48","TCP","66","40290 → 443 [ACK] Seq=254 Ack=65280 Win=4268 Len=0 TSval=25093999 TSecr=1057520963"
"271","0.172501738","35.186.208.48","192.168.1.118","TLSv1.2","2902","Application Data, Application Data"
"272","0.172526101","192.168.1.118","35.186.208.48","TCP","66","40287 → 443 [ACK] Seq=249 Ack=135542 Win=4221 Len=0 TSval=25093999 TSecr=1188024919"
"273","0.172826962","35.186.208.48","192.168.1.118","TLSv1.2","2902","Application Data, Application Data"
"274","0.172873676","35.186.208.48","192.168.1.118","TLSv1.2","4320","Application Data, Application Data, Application Data"
"275","0.172900839","192.168.1.118","35.186.208.48","TCP","66","40290 → 443 [ACK] Seq=254 Ack=69534 Win=4335 Len=0 TSval=25093999 TSecr=1057520964"
"276","0.172935028","35.186.208.48","192.168.1.118","TLSv1.2","5738","Application Data, Application Data, Application Data, Application Data"
"277","0.172950166","35.186.208.48","192.168.1.118","TLSv1.2","4320","Application Data, Application Data, Application Data"
"278","0.172970117","192.168.1.118","35.186.208.48","TCP","66","40290 → 443 [ACK] Seq=254 Ack=73788 Win=4401 Len=0 TSval=25093999 TSecr=1057520965"
"279","0.173076845","192.168.1.118","35.186.208.48","TCP","66","40287 → 443 [ACK] Seq=249 Ack=144050 Win=4155 Len=0 TSval=25093999 TSecr=1188024919"
"280","0.175043677","35.186.208.48","192.168.1.118","TLSv1.2","2902","Application Data, Application Data"
"281","0.175119904","192.168.1.118","35.186.208.48","TCP","66","40290 → 443 [ACK] Seq=254 Ack=76624 Win=4445 Len=0 TSval=25094001 TSecr=1057520966"
"282","0.176659496","35.186.208.48","192.168.1.118","TLSv1.2","1484","Application Data"
"283","0.176716748","35.186.208.48","192.168.1.118","TLSv1.2","1484","Application Data [TCP segment of a reassembled PDU]"
"284","0.177963754","35.186.208.48","192.168.1.118","TLSv1.2","2902","Application Data, Application Data"
"285","0.178037244","192.168.1.118","35.186.208.48","TCP","66","40287 → 443 [ACK] Seq=249 Ack=148304 Win=4336 Len=0 TSval=25094004 TSecr=1188024921"
"286","0.178856198","35.186.208.48","192.168.1.118","TLSv1.2","1484","Application Data, Application Data"
"287","0.178890474","35.186.208.48","192.168.1.118","TLSv1.2","1484","Application Data"
"288","0.178920962","192.168.1.118","35.186.208.48","TCP","66","40290 → 443 [ACK] Seq=254 Ack=79460 Win=4490 Len=0 TSval=25094005 TSecr=1057520966"
"289","0.181255969","35.186.208.48","192.168.1.118","TLSv1.2","2902","Application Data, Application Data"
"290","0.181348272","192.168.1.118","35.186.208.48","TCP","66","40290 → 443 [ACK] Seq=254 Ack=82296 Win=4534 Len=0 TSval=25094008 TSecr=1057520967"
"291","0.183269014","35.186.208.48","192.168.1.118","TLSv1.2","2902","Application Data, Application Data"
"292","0.183360343","192.168.1.118","35.186.208.48","TCP","66","40287 → 443 [ACK] Seq=249 Ack=152558 Win=4557 Len=0 TSval=25094010 TSecr=1188024921"
"293","0.184896521","35.186.208.48","192.168.1.118","TLSv1.2","2902","Application Data, Application Data"
"294","0.184978462","192.168.1.118","35.186.208.48","TCP","66","40287 → 443 [ACK] Seq=249 Ack=155394 Win=4557 Len=0 TSval=25094011 TSecr=1188024922"
"295","0.186773850","35.186.208.48","192.168.1.118","TLSv1.2","2902","Application Data, Application Data"
"296","0.186852440","192.168.1.118","35.186.208.48","TCP","66","40290 → 443 [ACK] Seq=254 Ack=85132 Win=4578 Len=0 TSval=25094013 TSecr=1057520967"
"297","0.187706795","35.186.208.48","192.168.1.118","TLSv1.2","1484","Application Data [TCP segment of a reassembled PDU]"
"298","0.187747521","35.186.208.48","192.168.1.118","TLSv1.2","1484","Application Data [TCP segment of a reassembled PDU]"
"299","0.190928870","35.186.208.48","192.168.1.118","TLSv1.2","4320","Application Data, Application Data, Application Data"
"300","0.191007148","35.186.208.48","192.168.1.118","TLSv1.2","4320","Application Data, Application Data, Application Data"
"301","0.191046074","192.168.1.118","35.186.208.48","TCP","66","40290 → 443 [ACK] Seq=254 Ack=90804 Win=4604 Len=0 TSval=25094017 TSecr=1057520967"
"302","0.191099701","35.186.208.48","192.168.1.118","TLSv1.2","5738","Application Data, Application Data, Application Data, Application Data"
"303","0.191307971","35.186.208.48","192.168.1.118","TLSv1.2","4320","Application Data, Application Data, Application Data"
"304","0.191325634","35.186.208.48","192.168.1.118","TLSv1.2","4320","Application Data, Application Data, Application Data"
"305","0.192229466","192.168.1.118","35.186.208.48","TCP","66","40287 → 443 [ACK] Seq=249 Ack=170992 Win=4436 Len=0 TSval=25094018 TSecr=1188024923"
"306","0.192605741","192.168.1.118","35.186.208.48","TCP","66","40290 → 443 [ACK] Seq=254 Ack=95058 Win=4571 Len=0 TSval=25094019 TSecr=1057520969"
"307","0.197676931","35.186.208.48","192.168.1.118","TLSv1.2","1484","Application Data [TCP segment of a reassembled PDU]"
"308","0.197761222","35.186.208.48","192.168.1.118","TLSv1.2","4320","Application Data, Application Data, Application Data"
"309","0.197802061","192.168.1.118","35.186.208.48","TCP","66","40290 → 443 [ACK] Seq=254 Ack=99312 Win=4645 Len=0 TSval=25094024 TSecr=1057520970"
"310","0.197840187","35.186.208.48","192.168.1.118","TLSv1.2","2902","Application Data, Application Data"
"311","0.197862038","192.168.1.118","35.186.208.48","TCP","66","40287 → 443 [ACK] Seq=249 Ack=175246 Win=4557 Len=0 TSval=25094024 TSecr=1188024925"
"312","0.197934778","35.186.208.48","192.168.1.118","TLSv1.2","2902","Application Data, Application Data"
"313","0.197978142","35.186.208.48","192.168.1.118","TLSv1.2","4320","Application Data, Application Data, Application Data"
"314","0.198003468","35.186.208.48","192.168.1.118","TLSv1.2","5738","Application Data, Application Data, Application Data, Application Data"
"315","0.198017831","35.186.208.48","192.168.1.118","TLSv1.2","1484","Application Data [TCP segment of a reassembled PDU]"
"316","0.198048444","192.168.1.118","35.186.208.48","TCP","66","40287 → 443 [ACK] Seq=249 Ack=178082 Win=4535 Len=0 TSval=25094024 TSecr=1188024926"
"317","0.198330067","192.168.1.118","35.186.208.48","TCP","66","40290 → 443 [ACK] Seq=254 Ack=104984 Win=4601 Len=0 TSval=25094025 TSecr=1057520971"
"318","0.198418670","192.168.1.118","35.186.208.48","TCP","66","40287 → 443 [ACK] Seq=249 Ack=183754 Win=4491 Len=0 TSval=25094025 TSecr=1188024927"
"319","0.201323984","35.186.208.48","192.168.1.118","TLSv1.2","5738","Application Data, Application Data, Application Data, Application Data"
"320","0.201408062","192.168.1.118","35.186.208.48","TCP","66","40290 → 443 [ACK] Seq=254 Ack=110656 Win=4636 Len=0 TSval=25094028 TSecr=1057520972"
"321","0.201529279","35.186.208.48","192.168.1.118","TLSv1.2","1484","Application Data [TCP segment of a reassembled PDU]"
"322","0.201569117","35.186.208.48","192.168.1.118","TLSv1.2","5738","Application Data, Application Data, Application Data, Application Data"
