frame.number,_ws.col.Time,_ws.col.Source,_ws.col.Destination,_ws.col.Protocol,frame.len,_ws.col.Info
"1","0.000000000","23.41.7.108","192.168.1.118","TCP","66","443 → 46808 [ACK] Seq=1 Ack=1 Win=235 Len=0 TSval=1265272000 TSecr=2927713834"
"2","0.002971475","23.41.7.108","192.168.1.118","TLSv1.2","1514","Server Hello"
"3","0.003037763","192.168.1.118","23.41.7.108","TCP","66","46808 → 443 [ACK] Seq=1 Ack=1449 Win=493 Len=0 TSval=2927713864 TSecr=1265272003"
"4","0.004497463","23.41.7.108","192.168.1.118","TLSv1.2","1849","Certificate, Server Key Exchange, Server Hello Done"
"5","0.004586625","192.168.1.118","23.41.7.108","TCP","66","46808 → 443 [ACK] Seq=1 Ack=3232 Win=480 Len=0 TSval=2927713866 TSecr=1265272003"
"6","0.009629875","192.168.1.118","23.41.7.108","TLSv1","583","Client Hello"
"7","0.034338450","192.168.1.118","23.41.7.108","TLSv1","583","Client Hello"
"8","0.056254513","fe80::1814:2ecf:2c8a:d90d","ff02::fb","MDNS","553","Standard query 0x0000 PTR _googlecast._tcp.local, "QM" question PTR _homekit._tcp.local, "QM" question PTR _uscan._tcp.local, "QM" question PTR _ptp._tcp.local, "QM" question PTR _ippusb._tcp.local, "QM" question PTR _scanner._tcp.local, "QM" question PTR _ipp._tcp.local, "QM" question PTR _pdl-datastream._tcp.local, "QM" question PTR _uscans._tcp.local, "QM" question PTR _ipps._tcp.local, "QM" question PTR _printer._tcp.local, "QM" question PTR _airplay._tcp.local, "QM" question PTR _raop._tcp.local, "QM" question PTR _airport._tcp.local, "QM" question PTR _rdlink._tcp.local, "QM" question PTR _companion-link._tcp.local, "QM" question PTR _afpovertcp._tcp.local, "QM" question PTR _rfb._tcp.local, "QM" question PTR _adisk._tcp.local, "QM" question PTR _apple-mobdev._tcp.local, "QM" question PTR 8ed307c3._sub._apple-mobdev2._tcp.local, "QM" question PTR _apple-pairable._tcp.local, "QM" question PTR Google-Home-Mini-2c3f16b2da5c4b6fd6cfbfba61c12490._googlecast._tcp.local PTR cjqg._companion-link._tcp.local OPT"
"9","0.056703425","192.168.1.118","23.41.7.108","TLSv1","583","Client Hello"
"10","0.062409513","23.41.7.108","192.168.1.118","TCP","66","443 → 46810 [ACK] Seq=1 Ack=518 Win=235 Len=0 TSval=1265272043 TSecr=2927713871"
"11","0.063589113","23.41.7.108","192.168.1.118","TLSv1.2","3297","Server Hello, Certificate, Server Key Exchange, Server Hello Done"
"12","0.063635013","192.168.1.118","23.41.7.108","TCP","66","46810 → 443 [ACK] Seq=518 Ack=3232 Win=477 Len=0 TSval=2927713925 TSecr=1265272045"
"13","0.067888150","23.41.7.108","192.168.1.118","TCP","66","443 → 46812 [ACK] Seq=1 Ack=518 Win=235 Len=0 TSval=1265272066 TSecr=2927713896"
"14","0.069124000","23.41.7.108","192.168.1.118","TLSv1.2","1514","Server Hello"
"15","0.069178975","192.168.1.118","23.41.7.108","TCP","66","46812 → 443 [ACK] Seq=518 Ack=1449 Win=493 Len=0 TSval=2927713931 TSecr=1265272069"
"16","0.070500175","23.41.7.108","192.168.1.118","TLSv1.2","1849","Certificate, Server Key Exchange, Server Hello Done"
"17","0.070554550","192.168.1.118","23.41.7.108","TCP","66","46812 → 443 [ACK] Seq=518 Ack=3232 Win=480 Len=0 TSval=2927713932 TSecr=1265272069"
"18","0.084351613","192.168.1.118","23.41.7.108","TLSv1","583","Client Hello"
"19","0.090586538","23.41.7.108","192.168.1.118","TCP","66","443 → 46814 [ACK] Seq=1 Ack=518 Win=235 Len=0 TSval=1265272091 TSecr=2927713918"
"20","0.092620975","23.41.7.108","192.168.1.118","TLSv1.2","1514","Server Hello"
"21","0.092680600","192.168.1.118","23.41.7.108","TCP","66","46814 → 443 [ACK] Seq=518 Ack=1449 Win=493 Len=0 TSval=2927713954 TSecr=1265272093"
"22","0.093996963","23.41.7.108","192.168.1.118","TLSv1.2","1849","Certificate, Server Key Exchange, Server Hello Done"
"23","0.094026238","192.168.1.118","23.41.7.108","TCP","66","46814 → 443 [ACK] Seq=518 Ack=3232 Win=480 Len=0 TSval=2927713955 TSecr=1265272093"
"24","0.106926713","192.168.1.118","104.196.190.179","TLSv1","571","Client Hello"
"25","0.115534188","23.41.7.108","192.168.1.118","TCP","66","443 → 46816 [ACK] Seq=1 Ack=518 Win=235 Len=0 TSval=1265272113 TSecr=2927713946"
"26","0.119562813","23.41.7.108","192.168.1.118","TLSv1.2","3297","Server Hello, Certificate, Server Key Exchange, Server Hello Done"
"27","0.119629088","192.168.1.118","23.41.7.108","TCP","66","46816 → 443 [ACK] Seq=518 Ack=3232 Win=477 Len=0 TSval=2927713981 TSecr=1265272115"
"28","0.133963900","192.168.1.118","104.196.190.179","TLSv1","571","Client Hello"
"29","0.151961463","192.168.1.102","224.0.0.251","MDNS","409","Standard query response 0x0000 PTR Google-Home-Mini-2c3f16b2da5c4b6fd6cfbfba61c12490._googlecast._tcp.local TXT, cache flush SRV, cache flush 0 0 8009 2c3f16b2-da5c-4b6f-d6cf-bfba61c12490.local A, cache flush 192.168.1.102"
"30","0.157290925","192.168.1.118","104.196.190.179","TLSv1","571","Client Hello"
"31","0.157416825","fe80::1cc7:6d9a:a312:7e8f","ff02::fb","MDNS","483","Standard query 0x0000 PTR _googlecast._tcp.local, "QM" question PTR _homekit._tcp.local, "QM" question PTR _uscan._tcp.local, "QM" question PTR _ptp._tcp.local, "QM" question PTR _ippusb._tcp.local, "QM" question PTR _scanner._tcp.local, "QM" question PTR _ipp._tcp.local, "QM" question PTR _pdl-datastream._tcp.local, "QM" question PTR _uscans._tcp.local, "QM" question PTR _ipps._tcp.local, "QM" question PTR _printer._tcp.local, "QM" question PTR _airplay._tcp.local, "QM" question PTR _raop._tcp.local, "QM" question PTR _airport._tcp.local, "QM" question PTR _rdlink._tcp.local, "QM" question PTR _companion-link._tcp.local, "QM" question PTR _afpovertcp._tcp.local, "QM" question PTR _rfb._tcp.local, "QM" question PTR _adisk._tcp.local, "QM" question PTR _apple-mobdev._tcp.local, "QM" question PTR 8ed307c3._sub._apple-mobdev2._tcp.local, "QM" question PTR _apple-pairable._tcp.local, "QM" question PTR cjqg._companion-link._tcp.local OPT"
"32","0.158820050","192.168.1.118","104.77.221.67","TLSv1.2","304","Application Data"
"33","0.161091475","192.168.1.118","23.41.7.108","TLSv1.2","192","Client Key Exchange, Change Cipher Spec, Encrypted Handshake Message"
"34","0.162727013","104.196.190.179","192.168.1.118","TCP","54","443 → 40120 [ACK] Seq=1 Ack=518 Win=58 Len=0"
"35","0.163442363","192.168.1.118","23.41.7.108","TLSv1.2","192","Client Key Exchange, Change Cipher Spec, Encrypted Handshake Message"
"36","0.164776050","104.196.190.179","192.168.1.118","TLSv1.2","1474","Server Hello"
"37","0.164836738","192.168.1.118","104.196.190.179","TCP","54","40120 → 443 [ACK] Seq=518 Ack=1421 Win=493 Len=0"
"38","0.166306788","104.196.190.179","192.168.1.118","TLSv1.2","1769","Certificate, Server Key Exchange, Server Hello Done"
"39","0.166363463","192.168.1.118","104.196.190.179","TCP","54","40120 → 443 [ACK] Seq=518 Ack=3136 Win=480 Len=0"
"40","0.166750913","192.168.1.118","23.41.7.108","TLSv1.2","192","Client Key Exchange, Change Cipher Spec, Encrypted Handshake Message"
"41","0.168762513","192.168.1.118","23.41.7.108","TLSv1.2","192","Client Key Exchange, Change Cipher Spec, Encrypted Handshake Message"
"42","0.170718750","192.168.1.118","23.41.7.108","TLSv1.2","192","Client Key Exchange, Change Cipher Spec, Encrypted Handshake Message"
"43","0.173825325","192.168.1.118","104.196.190.179","TLSv1.2","180","Client Key Exchange, Change Cipher Spec, Encrypted Handshake Message"
"44","0.177376838","104.196.190.179","192.168.1.118","TCP","54","443 → 40122 [ACK] Seq=1 Ack=518 Win=58 Len=0"
"45","0.178609525","104.196.190.179","192.168.1.118","TLSv1.2","3189","Server Hello, Certificate, Server Key Exchange, Server Hello Done"
"46","0.178657038","192.168.1.118","104.196.190.179","TCP","54","40122 → 443 [ACK] Seq=518 Ack=3136 Win=478 Len=0"
"47","0.196134813","104.77.221.67","192.168.1.118","TCP","1514","[TCP segment of a reassembled PDU]"
"48","0.196209400","192.168.1.118","104.77.221.67","TCP","66","42956 → 443 [ACK] Seq=239 Ack=1449 Win=493 Len=0 TSval=3720753624 TSecr=733771146"
"49","0.198905025","104.77.221.67","192.168.1.118","TCP","5858","443 → 42956 [ACK] Seq=1449 Ack=239 Win=243 Len=5792 TSval=733771146 TSecr=3720753586 [TCP segment of a reassembled PDU]"
"50","0.198972213","192.168.1.118","104.77.221.67","TCP","66","42956 → 443 [ACK] Seq=239 Ack=7241 Win=448 Len=0 TSval=3720753626 TSecr=733771146"
"51","0.199074338","104.77.221.67","192.168.1.118","TLSv1.2","9239","Application Data"
"52","0.199093388","192.168.1.118","104.77.221.67","TCP","66","42956 → 443 [ACK] Seq=239 Ack=16414 Win=377 Len=0 TSval=3720753626 TSecr=733771146"
"53","0.199125950","104.77.221.67","192.168.1.118","TCP","5858","[TCP segment of a reassembled PDU]"
"54","0.199143138","192.168.1.118","104.77.221.67","TCP","66","42956 → 443 [ACK] Seq=239 Ack=22206 Win=332 Len=0 TSval=3720753626 TSecr=733771146"
"55","0.200878788","23.41.7.108","192.168.1.118","TLSv1.2","117","Change Cipher Spec, Encrypted Handshake Message"
"56","0.200944400","192.168.1.118","23.41.7.108","TCP","66","46810 → 443 [ACK] Seq=644 Ack=3283 Win=501 Len=0 TSval=2927714062 TSecr=1265272201"
"57","0.207676238","23.41.7.108","192.168.1.118","TLSv1.2","117","Change Cipher Spec, Encrypted Handshake Message"
"58","0.207749713","192.168.1.118","23.41.7.108","TCP","66","46816 → 443 [ACK] Seq=644 Ack=3283 Win=501 Len=0 TSval=2927714069 TSecr=1265272208"
"59","0.208493650","23.41.7.108","192.168.1.118","TLSv1.2","117","Change Cipher Spec, Encrypted Handshake Message"
"60","0.208529250","192.168.1.118","23.41.7.108","TCP","66","46814 → 443 [ACK] Seq=644 Ack=3283 Win=501 Len=0 TSval=2927714070 TSecr=1265272208"
"61","0.210767875","23.41.7.108","192.168.1.118","TLSv1.2","117","Change Cipher Spec, Encrypted Handshake Message"
"62","0.210826713","192.168.1.118","23.41.7.108","TCP","66","46808 → 443 [ACK] Seq=127 Ack=3283 Win=501 Len=0 TSval=2927714072 TSecr=1265272210"
"63","0.212361763","23.41.7.108","192.168.1.118","TLSv1.2","117","Change Cipher Spec, Encrypted Handshake Message"
"64","0.212429288","192.168.1.118","23.41.7.108","TCP","66","46812 → 443 [ACK] Seq=644 Ack=3283 Win=501 Len=0 TSval=2927714074 TSecr=1265272211"
"65","0.212469938","104.196.190.179","192.168.1.118","TCP","54","443 → 40124 [ACK] Seq=1 Ack=518 Win=58 Len=0"
"66","0.214052425","104.196.190.179","192.168.1.118","TLSv1.2","3189","Server Hello, Certificate, Server Key Exchange, Server Hello Done"
"67","0.214115850","192.168.1.118","104.196.190.179","TCP","54","40124 → 443 [ACK] Seq=518 Ack=3136 Win=478 Len=0"
"68","0.214157825","104.77.221.67","192.168.1.118","TCP","1514","443 → 42956 [ACK] Seq=22206 Ack=239 Win=243 Len=1448 TSval=733771164 TSecr=3720753624 [TCP segment of a reassembled PDU]"
"69","0.214176000","192.168.1.118","104.77.221.67","TCP","66","42956 → 443 [ACK] Seq=239 Ack=23654 Win=321 Len=0 TSval=3720753642 TSecr=733771164"
"70","0.223041338","104.77.221.67","192.168.1.118","TCP","2962","443 → 42956 [ACK] Seq=23654 Ack=239 Win=243 Len=2896 TSval=733771164 TSecr=3720753624 [TCP segment of a reassembled PDU]"
"71","0.223095475","104.77.221.67","192.168.1.118","TCP","2962","443 → 42956 [ACK] Seq=26550 Ack=239 Win=243 Len=2896 TSval=733771164 TSecr=3720753626 [TCP segment of a reassembled PDU]"
"72","0.223193050","104.77.221.67","192.168.1.118","TLSv1.2","17442","Application Data, Application Data"
"73","0.223895700","104.196.190.179","192.168.1.118","TLSv1.2","105","Change Cipher Spec, Encrypted Handshake Message"
"74","0.223918863","104.77.221.67","192.168.1.118","TCP","1514","443 → 42956 [ACK] Seq=46822 Ack=239 Win=243 Len=1448 TSval=733771164 TSecr=3720753626 [TCP segment of a reassembled PDU]"
"75","0.236135638","104.77.221.67","192.168.1.118","TCP","1514","443 → 42956 [ACK] Seq=48270 Ack=239 Win=243 Len=1448 TSval=733771186 TSecr=3720753642 [TCP segment of a reassembled PDU]"
"76","0.237069688","104.77.221.67","192.168.1.118","TLSv1.2","429","Application Data"
"77","0.263576938","192.168.1.118","104.77.221.67","TCP","66","42956 → 443 [ACK] Seq=239 Ack=50081 Win=115 Len=0 TSval=3720753691 TSecr=733771164"
"78","0.264555238","192.168.1.118","104.196.190.179","TCP","54","40120 → 443 [ACK] Seq=644 Ack=3187 Win=501 Len=0"
"79","0.268182075","104.77.221.67","192.168.1.118","TCP","1514","[TCP Spurious Retransmission] 443 → 42956 [ACK] Seq=23654 Ack=239 Win=243 Len=1448 TSval=733771219 TSecr=3720753642[Reassembly error, protocol TCP: New fragment overlaps old data (retransmission?)]"
"80","0.268246250","192.168.1.118","104.77.221.67","TCP","78","[TCP Dup ACK 77#1] 42956 → 443 [ACK] Seq=239 Ack=50081 Win=115 Len=0 TSval=3720753696 TSecr=733771164 SLE=23654 SRE=25102"
"81","0.287383650","192.168.1.118","23.41.7.108","TLSv1.2","315","Application Data"
"82","0.287693275","192.168.1.118","23.41.7.108","TLSv1.2","313","Application Data"
"83","0.287903450","192.168.1.118","23.41.7.108","TLSv1.2","310","Application Data"
"84","0.288116350","192.168.1.118","23.41.7.108","TLSv1.2","309","Application Data"
"85","0.288339925","192.168.1.118","23.41.7.108","TLSv1.2","318","Application Data"
"86","0.294779825","192.168.1.118","104.196.190.179","TLSv1.2","656","Application Data"
"87","0.297539913","192.168.1.118","104.196.190.179","TLSv1.2","180","Client Key Exchange, Change Cipher Spec, Encrypted Handshake Message"
"88","0.304871775","192.168.1.118","104.196.190.179","TLSv1.2","180","Client Key Exchange, Change Cipher Spec, Encrypted Handshake Message"
"89","0.306086050","192.168.1.118","104.77.221.67","TCP","66","[TCP Window Update] 42956 → 443 [ACK] Seq=239 Ack=50081 Win=259 Len=0 TSval=3720753733 TSecr=733771164"
"90","0.335549025","23.41.7.108","192.168.1.118","TCP","1514","[TCP segment of a reassembled PDU]"
"91","0.335627363","192.168.1.118","23.41.7.108","TCP","66","46814 → 443 [ACK] Seq=887 Ack=4731 Win=493 Len=0 TSval=2927714197 TSecr=1265272335"
"92","0.339294138","23.41.7.108","192.168.1.118","TCP","11650","[TCP segment of a reassembled PDU]"
"93","0.339383925","192.168.1.118","23.41.7.108","TCP","66","46808 → 443 [ACK] Seq=376 Ack=14867 Win=411 Len=0 TSval=2927714201 TSecr=1265272335"
"94","0.339416013","23.41.7.108","192.168.1.118","TCP","1514","443 → 46814 [ACK] Seq=4731 Ack=887 Win=243 Len=1448 TSval=1265272335 TSecr=2927714149 [TCP segment of a reassembled PDU]"
"95","0.339433888","192.168.1.118","23.41.7.108","TCP","66","46814 → 443 [ACK] Seq=887 Ack=6179 Win=482 Len=0 TSval=2927714201 TSecr=1265272335"
"96","0.341817338","23.41.7.108","192.168.1.118","TLSv1.2","5858","Application Data [TCP segment of a reassembled PDU]"
"97","0.341880388","192.168.1.118","23.41.7.108","TCP","66","46808 → 443 [ACK] Seq=376 Ack=20659 Win=366 Len=0 TSval=2927714203 TSecr=1265272335"
"98","0.341978850","23.41.7.108","192.168.1.118","TLSv1.2","3167","Application Data"
"99","0.342000313","192.168.1.118","23.41.7.108","TCP","66","46808 → 443 [ACK] Seq=376 Ack=23760 Win=342 Len=0 TSval=2927714203 TSecr=1265272335"
"100","0.342047588","23.41.7.108","192.168.1.118","TCP","2962","[TCP segment of a reassembled PDU]"
"101","0.342072675","192.168.1.118","23.41.7.108","TCP","66","46816 → 443 [ACK] Seq=896 Ack=6179 Win=479 Len=0 TSval=2927714203 TSecr=1265272335"
"102","0.342081900","23.41.7.108","192.168.1.118","TCP","2962","[TCP segment of a reassembled PDU]"
"103","0.342102150","192.168.1.118","23.41.7.108","TCP","66","46810 → 443 [ACK] Seq=891 Ack=6179 Win=479 Len=0 TSval=2927714203 TSecr=1265272336"
"104","0.342111188","23.41.7.108","192.168.1.118","TCP","2962","[TCP segment of a reassembled PDU]"
"105","0.342130775","192.168.1.118","23.41.7.108","TCP","66","46812 → 443 [ACK] Seq=888 Ack=6179 Win=479 Len=0 TSval=2927714203 TSecr=1265272336"
"106","0.346154100","23.41.7.108","192.168.1.118","TCP","1514","443 → 46812 [ACK] Seq=6179 Ack=888 Win=243 Len=1448 TSval=1265272336 TSecr=2927714149 [TCP segment of a reassembled PDU]"
"107","0.346217138","192.168.1.118","23.41.7.108","TCP","66","46812 → 443 [ACK] Seq=888 Ack=7627 Win=468 Len=0 TSval=2927714208 TSecr=1265272336"
"108","0.353195575","192.168.1.103","224.0.0.2","IGMPv2","46","Leave Group 224.0.0.251"
"109","0.354634525","192.168.1.103","224.0.0.251","IGMPv2","46","Membership Report group 224.0.0.251"
"110","0.359063150","23.41.7.108","192.168.1.118","TCP","1514","443 → 46812 [ACK] Seq=7627 Ack=888 Win=243 Len=1448 TSval=1265272336 TSecr=2927714149 [TCP segment of a reassembled PDU]"
"111","0.359128888","192.168.1.118","23.41.7.108","TCP","66","46812 → 443 [ACK] Seq=888 Ack=9075 Win=457 Len=0 TSval=2927714220 TSecr=1265272336"
"112","0.359165150","23.41.7.108","192.168.1.118","TCP","2962","443 → 46810 [ACK] Seq=6179 Ack=891 Win=243 Len=2896 TSval=1265272336 TSecr=2927714149 [TCP segment of a reassembled PDU]"
"113","0.359183725","192.168.1.118","23.41.7.108","TCP","66","46810 → 443 [ACK] Seq=891 Ack=9075 Win=457 Len=0 TSval=2927714221 TSecr=1265272336"
"114","0.359193738","23.41.7.108","192.168.1.118","TCP","1514","443 → 46814 [ACK] Seq=6179 Ack=887 Win=243 Len=1448 TSval=1265272335 TSecr=2927714149 [TCP segment of a reassembled PDU]"
"115","0.359210613","192.168.1.118","23.41.7.108","TCP","66","46814 → 443 [ACK] Seq=887 Ack=7627 Win=471 Len=0 TSval=2927714221 TSecr=1265272335"
"116","0.359269113","104.196.190.179","192.168.1.118","TLSv1.2","105","Change Cipher Spec, Encrypted Handshake Message"
"117","0.359294513","192.168.1.118","104.196.190.179","TCP","54","40124 → 443 [ACK] Seq=644 Ack=3187 Win=501 Len=0"
"118","0.359306838","23.41.7.108","192.168.1.118","TCP","1514","443 → 46814 [ACK] Seq=7627 Ack=887 Win=243 Len=1448 TSval=1265272335 TSecr=2927714149 [TCP segment of a reassembled PDU]"
"119","0.359320750","192.168.1.118","23.41.7.108","TCP","66","46814 → 443 [ACK] Seq=887 Ack=9075 Win=460 Len=0 TSval=2927714221 TSecr=1265272335"
"120","0.362504788","104.196.190.179","192.168.1.118","TCP","5734","[TCP segment of a reassembled PDU]"
"121","0.362606288","192.168.1.118","104.196.190.179","TCP","54","40120 → 443 [ACK] Seq=1246 Ack=8867 Win=457 Len=0"
"122","0.362712975","104.196.190.179","192.168.1.118","TCP","5734","443 → 40120 [ACK] Seq=8867 Ack=1246 Win=60 Len=5680 [TCP segment of a reassembled PDU]"
"123","0.362732663","192.168.1.118","104.196.190.179","TCP","54","40120 → 443 [ACK] Seq=1246 Ack=14547 Win=413 Len=0"
"124","0.365045013","104.196.190.179","192.168.1.118","TLSv1.2","5107","Application Data"
"125","0.365114150","192.168.1.118","104.196.190.179","TCP","54","40120 → 443 [ACK] Seq=1246 Ack=19600 Win=374 Len=0"
"126","0.365148100","104.196.190.179","192.168.1.118","TLSv1.2","105","Change Cipher Spec, Encrypted Handshake Message"
"127","0.365172425","192.168.1.118","104.196.190.179","TCP","54","40122 → 443 [ACK] Seq=644 Ack=3187 Win=501 Len=0"
"128","0.365200263","23.41.7.108","192.168.1.118","TCP","2962","443 → 46816 [ACK] Seq=6179 Ack=896 Win=243 Len=2896 TSval=1265272335 TSecr=2927714150 [TCP segment of a reassembled PDU]"
"129","0.365219013","192.168.1.118","23.41.7.108","TCP","66","46816 → 443 [ACK] Seq=896 Ack=9075 Win=457 Len=0 TSval=2927714227 TSecr=1265272335"
"130","0.365228338","104.196.190.179","192.168.1.118","TCP","1474","[TCP segment of a reassembled PDU]"
"131","0.365241988","192.168.1.118","104.196.190.179","TCP","54","40120 → 443 [ACK] Seq=1246 Ack=21020 Win=363 Len=0"
"132","0.376067700","104.196.190.179","192.168.1.118","TCP","1474","443 → 40120 [ACK] Seq=21020 Ack=1246 Win=60 Len=1420 [TCP segment of a reassembled PDU]"
"133","0.376134163","192.168.1.118","104.196.190.179","TCP","54","40120 → 443 [ACK] Seq=1246 Ack=22440 Win=352 Len=0"
"134","0.376167913","23.41.7.108","192.168.1.118","TCP","2962","443 → 46812 [ACK] Seq=9075 Ack=888 Win=243 Len=2896 TSval=1265272336 TSecr=2927714149 [TCP segment of a reassembled PDU]"
"135","0.376190338","192.168.1.118","23.41.7.108","TCP","66","46812 → 443 [ACK] Seq=888 Ack=11971 Win=435 Len=0 TSval=2927714238 TSecr=1265272336"
"136","0.376199613","23.41.7.108","192.168.1.118","TCP","1514","443 → 46810 [ACK] Seq=9075 Ack=891 Win=243 Len=1448 TSval=1265272336 TSecr=2927714149 [TCP segment of a reassembled PDU]"
"137","0.376216513","192.168.1.118","23.41.7.108","TCP","66","46810 → 443 [ACK] Seq=891 Ack=10523 Win=446 Len=0 TSval=2927714238 TSecr=1265272336"
"138","0.376304925","23.41.7.108","192.168.1.118","TCP","1514","443 → 46810 [ACK] Seq=10523 Ack=891 Win=243 Len=1448 TSval=1265272336 TSecr=2927714149 [TCP segment of a reassembled PDU]"
"139","0.376320950","192.168.1.118","23.41.7.108","TCP","66","46810 → 443 [ACK] Seq=891 Ack=11971 Win=435 Len=0 TSval=2927714238 TSecr=1265272336"
"140","0.376330588","23.41.7.108","192.168.1.118","TCP","2962","443 → 46814 [ACK] Seq=9075 Ack=887 Win=243 Len=2896 TSval=1265272335 TSecr=2927714149 [TCP segment of a reassembled PDU]"
"141","0.376347950","192.168.1.118","23.41.7.108","TCP","66","46814 → 443 [ACK] Seq=887 Ack=11971 Win=438 Len=0 TSval=2927714238 TSecr=1265272335"
"142","0.376356775","23.41.7.108","192.168.1.118","TCP","2962","443 → 46816 [ACK] Seq=9075 Ack=896 Win=243 Len=2896 TSval=1265272335 TSecr=2927714150 [TCP segment of a reassembled PDU]"
"143","0.376374863","192.168.1.118","23.41.7.108","TCP","66","46816 → 443 [ACK] Seq=896 Ack=11971 Win=435 Len=0 TSval=2927714238 TSecr=1265272335"
"144","0.378753900","23.41.7.108","192.168.1.118","TCP","2962","443 → 46812 [ACK] Seq=11971 Ack=888 Win=243 Len=2896 TSval=1265272346 TSecr=2927714149 [TCP segment of a reassembled PDU]"
"145","0.378819088","192.168.1.118","23.41.7.108","TCP","66","46812 → 443 [ACK] Seq=888 Ack=14867 Win=413 Len=0 TSval=2927714240 TSecr=1265272346"
"146","0.378850975","23.41.7.108","192.168.1.118","TCP","2962","443 → 46810 [ACK] Seq=11971 Ack=891 Win=243 Len=2896 TSval=1265272346 TSecr=2927714149 [TCP segment of a reassembled PDU]"
"147","0.378871475","192.168.1.118","23.41.7.108","TCP","66","46810 → 443 [ACK] Seq=891 Ack=14867 Win=413 Len=0 TSval=2927714240 TSecr=1265272346"
"148","0.378880800","23.41.7.108","192.168.1.118","TCP","2962","443 → 46814 [ACK] Seq=11971 Ack=887 Win=243 Len=2896 TSval=1265272346 TSecr=2927714149 [TCP segment of a reassembled PDU]"
"149","0.378896738","192.168.1.118","23.41.7.108","TCP","66","46814 → 443 [ACK] Seq=887 Ack=14867 Win=416 Len=0 TSval=2927714240 TSecr=1265272346"
"150","0.378905963","23.41.7.108","192.168.1.118","TCP","1514","443 → 46816 [ACK] Seq=11971 Ack=896 Win=243 Len=1448 TSval=1265272349 TSecr=2927714150 [TCP segment of a reassembled PDU]"
"151","0.378921263","192.168.1.118","23.41.7.108","TCP","66","46816 → 443 [ACK] Seq=896 Ack=13419 Win=424 Len=0 TSval=2927714240 TSecr=1265272349"
"152","0.385481163","23.41.7.108","192.168.1.118","TCP","1514","443 → 46816 [ACK] Seq=13419 Ack=896 Win=243 Len=1448 TSval=1265272349 TSecr=2927714150 [TCP segment of a reassembled PDU]"
"153","0.385565175","192.168.1.118","23.41.7.108","TCP","66","46816 → 443 [ACK] Seq=896 Ack=14867 Win=413 Len=0 TSval=2927714247 TSecr=1265272349"
"154","0.385599375","23.41.7.108","192.168.1.118","TCP","2962","443 → 46812 [ACK] Seq=14867 Ack=888 Win=243 Len=2896 TSval=1265272356 TSecr=2927714149 [TCP segment of a reassembled PDU]"
"155","0.385618350","192.168.1.118","23.41.7.108","TCP","66","46812 → 443 [ACK] Seq=888 Ack=17763 Win=391 Len=0 TSval=2927714247 TSecr=1265272356"
"156","0.385627400","23.41.7.108","192.168.1.118","TCP","1514","443 → 46810 [ACK] Seq=14867 Ack=891 Win=243 Len=1448 TSval=1265272357 TSecr=2927714149 [TCP segment of a reassembled PDU]"
"157","0.385643263","192.168.1.118","23.41.7.108","TCP","66","46810 → 443 [ACK] Seq=891 Ack=16315 Win=402 Len=0 TSval=2927714247 TSecr=1265272357"
"158","0.385700388","23.41.7.108","192.168.1.118","TCP","1514","443 → 46810 [ACK] Seq=16315 Ack=891 Win=243 Len=1448 TSval=1265272357 TSecr=2927714149 [TCP segment of a reassembled PDU]"
"159","0.385719688","192.168.1.118","23.41.7.108","TCP","66","46810 → 443 [ACK] Seq=891 Ack=17763 Win=391 Len=0 TSval=2927714247 TSecr=1265272357"
"160","0.389179113","23.41.7.108","192.168.1.118","TCP","2962","443 → 46814 [ACK] Seq=14867 Ack=887 Win=243 Len=2896 TSval=1265272358 TSecr=2927714149 [TCP segment of a reassembled PDU]"
"161","0.389249175","192.168.1.118","23.41.7.108","TCP","66","46814 → 443 [ACK] Seq=887 Ack=17763 Win=394 Len=0 TSval=2927714251 TSecr=1265272358"
"162","0.389282900","23.41.7.108","192.168.1.118","TCP","1514","443 → 46812 [ACK] Seq=17763 Ack=888 Win=243 Len=1448 TSval=1265272367 TSecr=2927714149 [TCP segment of a reassembled PDU]"
"163","0.389300700","192.168.1.118","23.41.7.108","TCP","66","46812 → 443 [ACK] Seq=888 Ack=19211 Win=380 Len=0 TSval=2927714251 TSecr=1265272367"
"164","0.396480950","23.41.7.108","192.168.1.118","TLSv1.2","1143","Application Data"
"165","0.396567350","192.168.1.118","23.41.7.108","TCP","66","46810 → 443 [ACK] Seq=891 Ack=18840 Win=383 Len=0 TSval=2927714258 TSecr=1265272367"
"166","0.396604650","23.41.7.108","192.168.1.118","TLSv1.2","1514","Application Data [TCP segment of a reassembled PDU]"
"167","0.396626550","192.168.1.118","23.41.7.108","TCP","66","46812 → 443 [ACK] Seq=888 Ack=20659 Win=369 Len=0 TSval=2927714258 TSecr=1265272367"
"168","0.397884888","23.41.7.108","192.168.1.118","TCP","2962","443 → 46816 [ACK] Seq=14867 Ack=896 Win=243 Len=2896 TSval=1265272363 TSecr=2927714150 [TCP segment of a reassembled PDU]"
"169","0.397945575","192.168.1.118","23.41.7.108","TCP","66","46816 → 443 [ACK] Seq=896 Ack=17763 Win=391 Len=0 TSval=2927714259 TSecr=1265272363"
"170","0.397971700","23.41.7.108","192.168.1.118","TLSv1.2","2962","Application Data [TCP segment of a reassembled PDU]"
"171","0.397989463","192.168.1.118","23.41.7.108","TCP","66","46814 → 443 [ACK] Seq=887 Ack=20659 Win=372 Len=0 TSval=2927714259 TSecr=1265272369"
"172","0.397998300","23.41.7.108","192.168.1.118","TCP","2962","443 → 46812 [ACK] Seq=20659 Ack=888 Win=243 Len=2896 TSval=1265272377 TSecr=2927714208 [TCP segment of a reassembled PDU]"
"173","0.398014925","192.168.1.118","23.41.7.108","TCP","66","46812 → 443 [ACK] Seq=888 Ack=23555 Win=347 Len=0 TSval=2927714259 TSecr=1265272377"
"174","0.403811900","23.41.7.108","192.168.1.118","TCP","1514","443 → 46812 [ACK] Seq=23555 Ack=888 Win=243 Len=1448 TSval=1265272386 TSecr=2927714208 [TCP segment of a reassembled PDU]"
"175","0.403876850","192.168.1.118","23.41.7.108","TCP","66","46812 → 443 [ACK] Seq=888 Ack=25003 Win=336 Len=0 TSval=2927714265 TSecr=1265272386"
"176","0.405276888","23.41.7.108","192.168.1.118","TLSv1.2","891","Application Data"
"177","0.405335075","192.168.1.118","23.41.7.108","TCP","66","46812 → 443 [ACK] Seq=888 Ack=25828 Win=330 Len=0 TSval=2927714267 TSecr=1265272386"
"178","0.408458863","23.41.7.108","192.168.1.118","TCP","1514","443 → 46814 [ACK] Seq=20659 Ack=887 Win=243 Len=1448 TSval=1265272381 TSecr=2927714201 [TCP segment of a reassembled PDU]"
"179","0.408544888","192.168.1.118","23.41.7.108","TCP","66","46814 → 443 [ACK] Seq=887 Ack=22107 Win=361 Len=0 TSval=2927714270 TSecr=1265272381"
"180","0.411238313","23.41.7.108","192.168.1.118","TCP","1514","443 → 46814 [ACK] Seq=22107 Ack=887 Win=243 Len=1448 TSval=1265272381 TSecr=2927714201 [TCP segment of a reassembled PDU]"
"181","0.411301638","192.168.1.118","23.41.7.108","TCP","66","46814 → 443 [ACK] Seq=887 Ack=23555 Win=350 Len=0 TSval=2927714273 TSecr=1265272381"
"182","0.411334250","104.196.190.179","192.168.1.118","TCP","4314","443 → 40120 [ACK] Seq=22440 Ack=1246 Win=60 Len=4260 [TCP segment of a reassembled PDU]"
"183","0.411432388","23.41.7.108","192.168.1.118","TLSv1.2","1822","Application Data"
"184","0.411450363","192.168.1.118","23.41.7.108","TCP","66","46816 → 443 [ACK] Seq=896 Ack=19519 Win=378 Len=0 TSval=2927714273 TSecr=1265272377"
"185","0.411470775","104.196.190.179","192.168.1.118","TLSv1.2","14254","Application Data [TCP segment of a reassembled PDU]"
"186","0.412257350","104.196.190.179","192.168.1.118","TCP","4314","443 → 40120 [ACK] Seq=40900 Ack=1246 Win=60 Len=4260 [TCP segment of a reassembled PDU]"
"187","0.413993075","104.196.190.179","192.168.1.118","TCP","1474","443 → 40120 [ACK] Seq=45160 Ack=1246 Win=60 Len=1420 [TCP segment of a reassembled PDU]"
"188","0.415430950","104.196.190.179","192.168.1.118","TCP","1474","443 → 40120 [ACK] Seq=46580 Ack=1246 Win=60 Len=1420 [TCP segment of a reassembled PDU]"
"189","0.416547313","23.41.7.108","192.168.1.118","TCP","2962","443 → 46814 [ACK] Seq=23555 Ack=887 Win=243 Len=2896 TSval=1265272394 TSecr=2927714201 [TCP segment of a reassembled PDU]"
"190","0.416612638","192.168.1.118","23.41.7.108","TCP","66","46814 → 443 [ACK] Seq=887 Ack=26451 Win=328 Len=0 TSval=2927714278 TSecr=1265272394"
"191","0.418104400","104.196.190.179","192.168.1.118","TCP","2894","443 → 40120 [ACK] Seq=48000 Ack=1246 Win=60 Len=2840 [TCP segment of a reassembled PDU]"
"192","0.426584613","104.196.190.179","192.168.1.118","TLSv1.2","5734","Application Data [TCP segment of a reassembled PDU]"
"193","0.428178000","23.41.7.108","192.168.1.118","TLSv1.2","2962","Application Data [TCP segment of a reassembled PDU]"
"194","0.428217363","104.196.190.179","192.168.1.118","TCP","5734","443 → 40120 [ACK] Seq=56520 Ack=1246 Win=60 Len=5680 [TCP segment of a reassembled PDU]"
"195","0.430428550","23.41.7.108","192.168.1.118","TCP","1514","443 → 46814 [ACK] Seq=29347 Ack=887 Win=243 Len=1448 TSval=1265272416 TSecr=2927714259 [TCP segment of a reassembled PDU]"
"196","0.435506388","23.41.7.108","192.168.1.118","TCP","1514","443 → 46814 [ACK] Seq=30795 Ack=887 Win=243 Len=1448 TSval=1265272416 TSecr=2927714259 [TCP segment of a reassembled PDU]"
"197","0.437705763","23.41.7.108","192.168.1.118","TCP","1514","443 → 46814 [ACK] Seq=32243 Ack=887 Win=243 Len=1448 TSval=1265272423 TSecr=2927714259 [TCP segment of a reassembled PDU]"
"198","0.438864988","23.41.7.108","192.168.1.118","TCP","1514","443 → 46814 [ACK] Seq=33691 Ack=887 Win=243 Len=1448 TSval=1265272423 TSecr=2927714259 [TCP segment of a reassembled PDU]"
"199","0.444153688","23.41.7.108","192.168.1.118","TCP","1514","443 → 46814 [ACK] Seq=35139 Ack=887 Win=243 Len=1448 TSval=1265272430 TSecr=2927714259 [TCP segment of a reassembled PDU]"
"200","0.445370450","23.41.7.108","192.168.1.118","TCP","1514","443 → 46814 [ACK] Seq=36587 Ack=887 Win=243 Len=1448 TSval=1265272430 TSecr=2927714259 [TCP segment of a reassembled PDU]"
"201","0.455581275","192.168.1.118","104.196.190.179","TCP","54","40120 → 443 [ACK] Seq=1246 Ack=62200 Win=42 Len=0"
"202","0.456439825","fe80::144e:ae0c:17ca:d785","ff02::fb","MDNS","132","Standard query 0x0000 PTR _sleep-proxy._udp.local, "QU" question OPT"
"203","0.458087775","23.41.7.108","192.168.1.118","TLSv1.2","343","Application Data"
"204","0.458158725","192.168.1.118","23.41.7.108","TCP","66","46814 → 443 [ACK] Seq=887 Ack=38312 Win=236 Len=0 TSval=2927714319 TSecr=1265272406"
"205","0.489303763","192.168.1.118","104.196.190.179","TLSv1.2","654","Application Data"
"206","0.489590863","192.168.1.118","104.196.190.179","TLSv1.2","660","Application Data"
"207","0.490135438","192.168.1.118","104.196.190.179","TCP","54","[TCP Window Update] 40120 → 443 [ACK] Seq=1246 Ack=62200 Win=211 Len=0"
"208","0.492375113","192.168.1.118","23.41.7.108","TCP","66","[TCP Window Update] 46814 → 443 [ACK] Seq=887 Ack=38312 Win=501 Len=0 TSval=2927714354 TSecr=1265272406"
"209","0.495098288","192.168.1.118","104.196.190.179","TCP","54","[TCP Window Update] 40120 → 443 [ACK] Seq=1246 Ack=62200 Win=486 Len=0"
"210","0.495488650","192.168.1.118","23.41.7.108","TLSv1.2","317","Application Data"
"211","0.495624638","192.168.1.118","23.41.7.108","TLSv1.2","310","Application Data"
"212","0.495719438","192.168.1.118","23.41.7.108","TLSv1.2","307","Application Data"
"213","0.495812600","192.168.1.118","23.41.7.108","TLSv1.2","310","Application Data"
"214","0.496338138","104.196.190.179","192.168.1.118","TCP","1474","443 → 40120 [ACK] Seq=62200 Ack=1246 Win=60 Len=1420 [TCP segment of a reassembled PDU]"
"215","0.498223613","104.196.190.179","192.168.1.118","TCP","4010","443 → 40120 [ACK] Seq=63620 Ack=1246 Win=60 Len=3956 [TCP segment of a reassembled PDU]"
"216","0.498285713","192.168.1.118","104.196.190.179","TCP","54","40120 → 443 [ACK] Seq=1246 Ack=67576 Win=501 Len=0"
"217","0.499386813","192.168.1.118","23.41.7.108","TLSv1.2","310","Application Data"
"218","0.529772588","104.196.190.179","192.168.1.118","TLSv1.2","1474","Application Data [TCP segment of a reassembled PDU]"
"219","0.529834488","192.168.1.118","104.196.190.179","TCP","54","40120 → 443 [ACK] Seq=1246 Ack=68996 Win=523 Len=0"
"220","0.532131675","104.196.190.179","192.168.1.118","TCP","1474","443 → 40120 [ACK] Seq=68996 Ack=1246 Win=60 Len=1420 [TCP segment of a reassembled PDU]"
"221","0.532196213","192.168.1.118","104.196.190.179","TCP","54","40120 → 443 [ACK] Seq=1246 Ack=70416 Win=545 Len=0"
"222","0.532229275","104.196.190.179","192.168.1.118","TCP","12834","[TCP segment of a reassembled PDU]"
"223","0.532260688","192.168.1.118","104.196.190.179","TCP","54","40124 → 443 [ACK] Seq=1250 Ack=15967 Win=402 Len=0"
"224","0.537172638","104.196.190.179","192.168.1.118","TLSv1.2","3687","Application Data"
"225","0.537239863","192.168.1.118","104.196.190.179","TCP","54","40124 → 443 [ACK] Seq=1250 Ack=19600 Win=374 Len=0"
"226","0.537295563","104.196.190.179","192.168.1.118","TCP","2894","443 → 40120 [ACK] Seq=70416 Ack=1246 Win=60 Len=2840 [TCP segment of a reassembled PDU]"
"227","0.537313250","192.168.1.118","104.196.190.179","TCP","54","40120 → 443 [ACK] Seq=1246 Ack=73256 Win=590 Len=0"
"228","0.537394238","23.41.7.108","192.168.1.118","TCP","2962","[TCP segment of a reassembled PDU]"
"229","0.537421000","104.196.190.179","192.168.1.118","TCP","7154","[TCP segment of a reassembled PDU]"
"230","0.537444350","192.168.1.118","104.196.190.179","TCP","54","40122 → 443 [ACK] Seq=1244 Ack=10287 Win=446 Len=0"
"231","0.537945188","192.168.1.118","23.41.7.108","TCP","66","46814 → 443 [ACK] Seq=1131 Ack=41208 Win=501 Len=0 TSval=2927714399 TSecr=1265272530"
"232","0.546694625","104.196.190.179","192.168.1.118","TLSv1.2","9367","Application Data"
"233","0.546761563","192.168.1.118","104.196.190.179","TCP","54","40122 → 443 [ACK] Seq=1244 Ack=19600 Win=397 Len=0"
"234","0.546826000","23.41.7.108","192.168.1.118","TLSv1.2","11550","Application Data"
"235","0.546856850","192.168.1.118","23.41.7.108","TCP","66","46808 → 443 [ACK] Seq=627 Ack=35244 Win=412 Len=0 TSval=2927714408 TSecr=1265272532"
"236","0.546901700","23.41.7.108","192.168.1.118","TCP","5858","[TCP segment of a reassembled PDU]"
"237","0.546922425","192.168.1.118","23.41.7.108","TCP","66","46810 → 443 [ACK] Seq=1135 Ack=24632 Win=456 Len=0 TSval=2927714408 TSecr=1265272531"
"238","0.546931525","23.41.7.108","192.168.1.118","TCP","5858","[TCP segment of a reassembled PDU]"
"239","0.546952150","192.168.1.118","23.41.7.108","TCP","66","46816 → 443 [ACK] Seq=1140 Ack=25311 Win=456 Len=0 TSval=2927714408 TSecr=1265272530"
"240","0.546961050","104.196.190.179","192.168.1.118","TCP","5734","443 → 40120 [ACK] Seq=73256 Ack=1246 Win=60 Len=5680 [TCP segment of a reassembled PDU]"
"241","0.546978450","192.168.1.118","104.196.190.179","TCP","54","40120 → 443 [ACK] Seq=1246 Ack=78936 Win=679 Len=0"
"242","0.546987388","23.41.7.108","192.168.1.118","TCP","2962","443 → 46814 [ACK] Seq=41208 Ack=1131 Win=252 Len=2896 TSval=1265272530 TSecr=2927714357 [TCP segment of a reassembled PDU]"
"243","0.547003050","192.168.1.118","23.41.7.108","TCP","66","46814 → 443 [ACK] Seq=1131 Ack=44104 Win=546 Len=0 TSval=2927714408 TSecr=1265272530"
"244","0.547011725","104.196.190.179","192.168.1.118","TCP","2894","[TCP segment of a reassembled PDU]"
"245","0.547026913","192.168.1.118","104.196.190.179","TCP","54","40124 → 443 [ACK] Seq=1250 Ack=22440 Win=477 Len=0"
"246","0.547036163","23.41.7.108","192.168.1.118","TCP","4410","[TCP segment of a reassembled PDU]"
"247","0.547050938","104.196.190.179","192.168.1.118","TCP","2894","[TCP segment of a reassembled PDU]"
"248","0.547065188","192.168.1.118","104.196.190.179","TCP","54","40122 → 443 [ACK] Seq=1244 Ack=22440 Win=477 Len=0"
"249","0.547337263","192.168.1.118","23.41.7.108","TCP","66","46812 → 443 [ACK] Seq=1129 Ack=30172 Win=501 Len=0 TSval=2927714409 TSecr=1265272533"
"250","0.550424963","192.168.1.118","23.41.7.108","TLSv1.2","310","Application Data"
"251","0.550618213","104.196.190.179","192.168.1.118","TLSv1.2","1559","Application Data"
"252","0.550681338","192.168.1.118","104.196.190.179","TCP","54","40120 → 443 [ACK] Seq=1246 Ack=80441 Win=702 Len=0"
"253","0.550721400","23.41.7.108","192.168.1.118","TCP","1514","443 → 46812 [ACK] Seq=30172 Ack=1129 Win=252 Len=1448 TSval=1265272533 TSecr=2927714357 [TCP segment of a reassembled PDU]"
"254","0.550738913","192.168.1.118","23.41.7.108","TCP","66","46812 → 443 [ACK] Seq=1129 Ack=31620 Win=524 Len=0 TSval=2927714412 TSecr=1265272533"
"255","0.550748513","23.41.7.108","192.168.1.118","TCP","2962","443 → 46814 [ACK] Seq=44104 Ack=1131 Win=252 Len=2896 TSval=1265272530 TSecr=2927714357 [TCP segment of a reassembled PDU]"
"256","0.550765238","192.168.1.118","23.41.7.108","TCP","66","46814 → 443 [ACK] Seq=1131 Ack=47000 Win=592 Len=0 TSval=2927714412 TSecr=1265272530"
"257","0.550999138","23.41.7.108","192.168.1.118","TCP","2962","443 → 46812 [ACK] Seq=31620 Ack=1129 Win=252 Len=2896 TSval=1265272533 TSecr=2927714357 [TCP segment of a reassembled PDU]"
"258","0.551018575","192.168.1.118","23.41.7.108","TCP","66","46812 → 443 [ACK] Seq=1129 Ack=34516 Win=569 Len=0 TSval=2927714412 TSecr=1265272533"
"259","0.551044625","23.41.7.108","192.168.1.118","TCP","2962","443 → 46814 [ACK] Seq=47000 Ack=1131 Win=252 Len=2896 TSval=1265272532 TSecr=2927714357 [TCP segment of a reassembled PDU]"
"260","0.551060425","192.168.1.118","23.41.7.108","TCP","66","46814 → 443 [ACK] Seq=1131 Ack=49896 Win=637 Len=0 TSval=2927714412 TSecr=1265272532"
"261","0.551072550","23.41.7.108","192.168.1.118","TCP","2962","443 → 46816 [ACK] Seq=25311 Ack=1140 Win=252 Len=2896 TSval=1265272530 TSecr=2927714361 [TCP segment of a reassembled PDU]"
"262","0.551088388","192.168.1.118","23.41.7.108","TCP","66","46816 → 443 [ACK] Seq=1140 Ack=28207 Win=505 Len=0 TSval=2927714412 TSecr=1265272530"
"263","0.551097338","23.41.7.108","192.168.1.118","TCP","2962","443 → 46810 [ACK] Seq=24632 Ack=1135 Win=252 Len=2896 TSval=1265272531 TSecr=2927714357 [TCP segment of a reassembled PDU]"
"264","0.551112625","192.168.1.118","23.41.7.108","TCP","66","46810 → 443 [ACK] Seq=1135 Ack=27528 Win=477 Len=0 TSval=2927714412 TSecr=1265272531"
"265","0.551121525","23.41.7.108","192.168.1.118","TCP","2962","443 → 46812 [ACK] Seq=34516 Ack=1129 Win=252 Len=2896 TSval=1265272535 TSecr=2927714357 [TCP segment of a reassembled PDU]"
"266","0.551135625","192.168.1.118","23.41.7.108","TCP","66","46812 → 443 [ACK] Seq=1129 Ack=37412 Win=614 Len=0 TSval=2927714412 TSecr=1265272535"
"267","0.551144588","23.41.7.108","192.168.1.118","TCP","1514","443 → 46814 [ACK] Seq=49896 Ack=1131 Win=252 Len=1448 TSval=1265272537 TSecr=2927714357 [TCP segment of a reassembled PDU]"
"268","0.558255325","23.41.7.108","192.168.1.118","TCP","1514","443 → 46814 [ACK] Seq=51344 Ack=1131 Win=252 Len=1448 TSval=1265272537 TSecr=2927714357 [TCP segment of a reassembled PDU]"
"269","0.558317250","192.168.1.118","23.41.7.108","TCP","66","46814 → 443 [ACK] Seq=1131 Ack=52792 Win=682 Len=0 TSval=2927714420 TSecr=1265272537"
"270","0.558350588","23.41.7.108","192.168.1.118","TCP","2962","443 → 46816 [ACK] Seq=28207 Ack=1140 Win=252 Len=2896 TSval=1265272534 TSecr=2927714361 [TCP segment of a reassembled PDU]"
"271","0.558367275","192.168.1.118","23.41.7.108","TCP","66","46816 → 443 [ACK] Seq=1140 Ack=31103 Win=505 Len=0 TSval=2927714420 TSecr=1265272534"
"272","0.558376488","23.41.7.108","192.168.1.118","TCP","1514","443 → 46810 [ACK] Seq=27528 Ack=1135 Win=252 Len=1448 TSval=1265272534 TSecr=2927714357 [TCP segment of a reassembled PDU]"
"273","0.558391738","192.168.1.118","23.41.7.108","TCP","66","46810 → 443 [ACK] Seq=1135 Ack=28976 Win=493 Len=0 TSval=2927714420 TSecr=1265272534"
"274","0.558448300","23.41.7.108","192.168.1.118","TCP","1514","443 → 46810 [ACK] Seq=28976 Ack=1135 Win=252 Len=1448 TSval=1265272534 TSecr=2927714357 [TCP segment of a reassembled PDU]"
"275","0.558460525","23.41.7.108","192.168.1.118","TCP","2962","443 → 46812 [ACK] Seq=37412 Ack=1129 Win=252 Len=2896 TSval=1265272540 TSecr=2927714357 [TCP segment of a reassembled PDU]"
"276","0.558476675","192.168.1.118","23.41.7.108","TCP","66","46812 → 443 [ACK] Seq=1129 Ack=40308 Win=660 Len=0 TSval=2927714420 TSecr=1265272540"
"277","0.558485775","23.41.7.108","192.168.1.118","TLSv1.2","2962","Application Data [TCP segment of a reassembled PDU]"
"278","0.558499975","192.168.1.118","23.41.7.108","TCP","66","46814 → 443 [ACK] Seq=1131 Ack=55688 Win=727 Len=0 TSval=2927714420 TSecr=1265272541"
"279","0.560579638","23.41.7.108","192.168.1.118","TLSv1.2","2962","Application Data [TCP segment of a reassembled PDU]"
"280","0.560645275","192.168.1.118","23.41.7.108","TCP","66","46812 → 443 [ACK] Seq=1129 Ack=43204 Win=705 Len=0 TSval=2927714422 TSecr=1265272544"
"281","0.560675900","23.41.7.108","192.168.1.118","TCP","2962","443 → 46816 [ACK] Seq=31103 Ack=1140 Win=252 Len=2896 TSval=1265272540 TSecr=2927714361 [TCP segment of a reassembled PDU]"
"282","0.560693500","192.168.1.118","23.41.7.108","TCP","66","46816 → 443 [ACK] Seq=1140 Ack=33999 Win=505 Len=0 TSval=2927714422 TSecr=1265272540"
"283","0.560768975","23.41.7.108","192.168.1.118","TCP","2962","443 → 46814 [ACK] Seq=55688 Ack=1131 Win=252 Len=2896 TSval=1265272545 TSecr=2927714357 [TCP segment of a reassembled PDU]"
"284","0.560787775","192.168.1.118","23.41.7.108","TCP","66","46814 → 443 [ACK] Seq=1131 Ack=58584 Win=773 Len=0 TSval=2927714422 TSecr=1265272545"
"285","0.560800075","23.41.7.108","192.168.1.118","TCP","2962","443 → 46810 [ACK] Seq=30424 Ack=1135 Win=252 Len=2896 TSval=1265272541 TSecr=2927714357 [TCP segment of a reassembled PDU]"
"286","0.560811538","23.41.7.108","192.168.1.118","TCP","2962","443 → 46812 [ACK] Seq=43204 Ack=1129 Win=252 Len=2896 TSval=1265272549 TSecr=2927714357 [TCP segment of a reassembled PDU]"
"287","0.560825088","192.168.1.118","23.41.7.108","TCP","66","46812 → 443 [ACK] Seq=1129 Ack=46100 Win=750 Len=0 TSval=2927714422 TSecr=1265272549"
"288","0.560834663","23.41.7.108","192.168.1.118","TCP","1514","443 → 46814 [ACK] Seq=58584 Ack=1131 Win=252 Len=1448 TSval=1265272550 TSecr=2927714357 [TCP segment of a reassembled PDU]"
"289","0.564357775","23.41.7.108","192.168.1.118","TCP","1514","443 → 46814 [ACK] Seq=60032 Ack=1131 Win=252 Len=1448 TSval=1265272550 TSecr=2927714357 [TCP segment of a reassembled PDU]"
"290","0.564419813","192.168.1.118","23.41.7.108","TCP","66","46814 → 443 [ACK] Seq=1131 Ack=61480 Win=818 Len=0 TSval=2927714426 TSecr=1265272550"
"291","0.564451875","23.41.7.108","192.168.1.118","TLSv1.2","2962","Application Data [TCP segment of a reassembled PDU]"
"292","0.566404100","23.41.7.108","192.168.1.118","TLSv1.2","2962","Application Data [TCP segment of a reassembled PDU]"
"293","0.566448250","23.41.7.108","192.168.1.118","TCP","2962","443 → 46812 [ACK] Seq=46100 Ack=1129 Win=252 Len=2896 TSval=1265272553 TSecr=2927714357 [TCP segment of a reassembled PDU]"
"294","0.566479875","192.168.1.118","23.41.7.108","TCP","66","46812 → 443 [ACK] Seq=1129 Ack=48996 Win=795 Len=0 TSval=2927714428 TSecr=1265272553"
"295","0.566511613","23.41.7.108","192.168.1.118","TLSv1.2","2962","Application Data [TCP segment of a reassembled PDU]"
"296","0.566557263","192.168.1.118","23.41.7.108","TCP","66","46814 → 443 [ACK] Seq=1131 Ack=64376 Win=863 Len=0 TSval=2927714428 TSecr=1265272554"
"297","0.568648088","23.41.7.108","192.168.1.118","TLSv1.2","2962","Application Data [TCP segment of a reassembled PDU]"
"298","0.568710288","192.168.1.118","23.41.7.108","TCP","66","46812 → 443 [ACK] Seq=1129 Ack=51892 Win=841 Len=0 TSval=2927714430 TSecr=1265272558"
"299","0.569998025","192.168.1.118","23.41.7.108","TCP","66","46810 → 443 [ACK] Seq=1135 Ack=36216 Win=445 Len=0 TSval=2927714431 TSecr=1265272534"
"300","0.570513388","192.168.1.118","23.41.7.108","TCP","66","46816 → 443 [ACK] Seq=1140 Ack=36895 Win=483 Len=0 TSval=2927714432 TSecr=1265272547"
"301","0.570702825","23.41.7.108","192.168.1.118","TLSv1.2","150","Application Data"
"302","0.570765300","23.41.7.108","192.168.1.118","TCP","2962","443 → 46816 [ACK] Seq=36895 Ack=1140 Win=252 Len=2896 TSval=1265272554 TSecr=2927714361 [TCP segment of a reassembled PDU]"
"303","0.570778325","23.41.7.108","192.168.1.118","TCP","2962","443 → 46810 [ACK] Seq=36216 Ack=1135 Win=252 Len=2896 TSval=1265272555 TSecr=2927714357 [TCP segment of a reassembled PDU]"
"304","0.570807900","192.168.1.118","23.41.7.108","TCP","66","46810 → 443 [ACK] Seq=1135 Ack=39112 Win=477 Len=0 TSval=2927714432 TSecr=1265272555"
"305","0.570836363","104.196.190.179","192.168.1.118","TCP","2894","443 → 40124 [ACK] Seq=22440 Ack=1250 Win=60 Len=2840 [TCP segment of a reassembled PDU]"
"306","0.570852700","192.168.1.118","104.196.190.179","TCP","54","40124 → 443 [ACK] Seq=1250 Ack=25280 Win=477 Len=0"
"307","0.570904250","192.168.1.118","23.41.7.108","TCP","66","46816 → 443 [ACK] Seq=1140 Ack=39791 Win=461 Len=0 TSval=2927714432 TSecr=1265272554"
"308","0.572958713","104.196.190.179","192.168.1.118","TCP","2894","443 → 40124 [ACK] Seq=25280 Ack=1250 Win=60 Len=2840 [TCP segment of a reassembled PDU]"
"309","0.573017675","192.168.1.118","104.196.190.179","TCP","54","40124 → 443 [ACK] Seq=1250 Ack=28120 Win=455 Len=0"
"310","0.574698913","23.41.7.108","192.168.1.118","TCP","2962","443 → 46812 [ACK] Seq=51892 Ack=1129 Win=252 Len=2896 TSval=1265272562 TSecr=2927714357 [TCP segment of a reassembled PDU]"
"311","0.574780775","192.168.1.118","23.41.7.108","TCP","66","46812 → 443 [ACK] Seq=1129 Ack=54788 Win=886 Len=0 TSval=2927714436 TSecr=1265272562"
"312","0.574813388","104.196.190.179","192.168.1.118","TCP","2894","443 → 40124 [ACK] Seq=28120 Ack=1250 Win=60 Len=2840 [TCP segment of a reassembled PDU]"
"313","0.574830125","192.168.1.118","104.196.190.179","TCP","54","40124 → 443 [ACK] Seq=1250 Ack=30960 Win=433 Len=0"
"314","0.575958438","192.168.1.118","23.41.7.108","TLSv1.2","317","Application Data"
"315","0.576708063","23.41.7.108","192.168.1.118","TCP","2962","443 → 46816 [ACK] Seq=39791 Ack=1140 Win=252 Len=2896 TSval=1265272561 TSecr=2927714361 [TCP segment of a reassembled PDU]"
"316","0.576771375","192.168.1.118","23.41.7.108","TCP","66","46816 → 443 [ACK] Seq=1140 Ack=42687 Win=505 Len=0 TSval=2927714438 TSecr=1265272561"
"317","0.576800300","104.196.190.179","192.168.1.118","TCP","2894","443 → 40124 [ACK] Seq=30960 Ack=1250 Win=60 Len=2840 [TCP segment of a reassembled PDU]"
"318","0.576816700","192.168.1.118","104.196.190.179","TCP","54","40124 → 443 [ACK] Seq=1250 Ack=33800 Win=477 Len=0"
"319","0.576826200","23.41.7.108","192.168.1.118","TCP","2962","443 → 46810 [ACK] Seq=39112 Ack=1135 Win=252 Len=2896 TSval=1265272562 TSecr=2927714357 [TCP segment of a reassembled PDU]"
"320","0.576843138","192.168.1.118","23.41.7.108","TCP","66","46810 → 443 [ACK] Seq=1135 Ack=42008 Win=477 Len=0 TSval=2927714438 TSecr=1265272562"
"321","0.581693050","23.41.7.108","192.168.1.118","TCP","1514","443 → 46812 [ACK] Seq=54788 Ack=1129 Win=252 Len=1448 TSval=1265272567 TSecr=2927714357 [TCP segment of a reassembled PDU]"
"322","0.581756275","192.168.1.118","23.41.7.108","TCP","66","46812 → 443 [ACK] Seq=1129 Ack=56236 Win=908 Len=0 TSval=2927714443 TSecr=1265272567"
"323","0.581789375","104.196.190.179","192.168.1.118","TLSv1.2","2894","Application Data [TCP segment of a reassembled PDU]"
"324","0.581806025","192.168.1.118","104.196.190.179","TCP","54","40124 → 443 [ACK] Seq=1250 Ack=36640 Win=477 Len=0"
"325","0.583826750","23.41.7.108","192.168.1.118","TLSv1.2","4274","Application Data"
"326","0.583890588","192.168.1.118","23.41.7.108","TCP","66","46812 → 443 [ACK] Seq=1129 Ack=60444 Win=974 Len=0 TSval=2927714445 TSecr=1265272579"
"327","0.583931488","104.196.190.179","192.168.1.118","TCP","1474","443 → 40124 [ACK] Seq=36640 Ack=1250 Win=60 Len=1420 [TCP segment of a reassembled PDU]"
"328","0.583948075","192.168.1.118","104.196.190.179","TCP","54","40124 → 443 [ACK] Seq=1250 Ack=38060 Win=493 Len=0"
"329","0.584039438","104.196.190.179","192.168.1.118","TCP","1474","443 → 40124 [ACK] Seq=38060 Ack=1250 Win=60 Len=1420 [TCP segment of a reassembled PDU]"
"330","0.584056188","192.168.1.118","104.196.190.179","TCP","54","40124 → 443 [ACK] Seq=1250 Ack=39480 Win=482 Len=0"
"331","0.584069700","104.196.190.179","192.168.1.118","TCP","4314","443 → 40122 [ACK] Seq=22440 Ack=1244 Win=60 Len=4260 [TCP segment of a reassembled PDU]"
"332","0.584085900","192.168.1.118","104.196.190.179","TCP","54","40122 → 443 [ACK] Seq=1244 Ack=26700 Win=461 Len=0"
"333","0.584094913","23.41.7.108","192.168.1.118","TCP","11650","[TCP segment of a reassembled PDU]"
"334","0.584124038","192.168.1.118","23.41.7.108","TCP","66","46808 → 443 [ACK] Seq=871 Ack=46828 Win=682 Len=0 TSval=2927714445 TSecr=1265272580"
"335","0.586003788","104.196.190.179","192.168.1.118","TCP","5734","443 → 40122 [ACK] Seq=26700 Ack=1244 Win=60 Len=5680 [TCP segment of a reassembled PDU]"
"336","0.586086850","192.168.1.118","104.196.190.179","TCP","54","40122 → 443 [ACK] Seq=1244 Ack=32380 Win=417 Len=0"
"337","0.586223038","104.196.190.179","192.168.1.118","TLSv1.2","8574","Application Data [TCP segment of a reassembled PDU]"
"338","0.586247638","192.168.1.118","104.196.190.179","TCP","54","40122 → 443 [ACK] Seq=1244 Ack=40900 Win=351 Len=0"
"339","0.586256838","23.41.7.108","192.168.1.118","TLSv1.2","2962","Application Data [TCP segment of a reassembled PDU]"
"340","0.586273450","192.168.1.118","23.41.7.108","TCP","66","46816 → 443 [ACK] Seq=1140 Ack=45583 Win=505 Len=0 TSval=2927714448 TSecr=1265272568"
"341","0.586282688","104.196.190.179","192.168.1.118","TCP","2894","443 → 40124 [ACK] Seq=39480 Ack=1250 Win=60 Len=2840 [TCP segment of a reassembled PDU]"
"342","0.586298938","192.168.1.118","104.196.190.179","TCP","54","40124 → 443 [ACK] Seq=1250 Ack=42320 Win=460 Len=0"
"343","0.586308150","23.41.7.108","192.168.1.118","TLSv1.2","2962","Application Data [TCP segment of a reassembled PDU]"
"344","0.586323338","192.168.1.118","23.41.7.108","TCP","66","46810 → 443 [ACK] Seq=1135 Ack=44904 Win=477 Len=0 TSval=2927714448 TSecr=1265272569"
"345","0.589033850","104.196.190.179","192.168.1.118","TCP","2894","443 → 40122 [ACK] Seq=40900 Ack=1244 Win=60 Len=2840 [TCP segment of a reassembled PDU]"
"346","0.589099000","192.168.1.118","104.196.190.179","TCP","54","40122 → 443 [ACK] Seq=1244 Ack=43740 Win=329 Len=0"
"347","0.589131875","104.196.190.179","192.168.1.118","TCP","2894","443 → 40124 [ACK] Seq=42320 Ack=1250 Win=60 Len=2840 [TCP segment of a reassembled PDU]"
"348","0.589148675","192.168.1.118","104.196.190.179","TCP","54","40124 → 443 [ACK] Seq=1250 Ack=45160 Win=438 Len=0"
"349","0.589197463","104.196.190.179","192.168.1.118","TCP","1474","443 → 40122 [ACK] Seq=43740 Ack=1244 Win=60 Len=1420 [TCP segment of a reassembled PDU]"
"350","0.589219075","192.168.1.118","104.196.190.179","TCP","54","40122 → 443 [ACK] Seq=1244 Ack=45160 Win=318 Len=0"
"351","0.590721500","104.196.190.179","192.168.1.118","TLSv1.2","561","Application Data"
"352","0.590768463","23.41.7.108","192.168.1.118","TCP","2962","443 → 46816 [ACK] Seq=45583 Ack=1140 Win=252 Len=2896 TSval=1265272574 TSecr=2927714361 [TCP segment of a reassembled PDU]"
"353","0.590780788","23.41.7.108","192.168.1.118","TCP","2962","443 → 46808 [ACK] Seq=46828 Ack=871 Win=260 Len=2896 TSval=1265272580 TSecr=2927714412 [TCP segment of a reassembled PDU]"
"354","0.590810500","192.168.1.118","23.41.7.108","TCP","66","46808 → 443 [ACK] Seq=871 Ack=49724 Win=727 Len=0 TSval=2927714452 TSecr=1265272580"
"355","0.593230113","23.41.7.108","192.168.1.118","TLSv1.2","834","Application Data"
"356","0.593296100","104.196.190.179","192.168.1.118","TCP","4314","443 → 40122 [ACK] Seq=45160 Ack=1244 Win=60 Len=4260 [TCP segment of a reassembled PDU]"
"357","0.593372963","104.196.190.179","192.168.1.118","TCP","1474","443 → 40122 [ACK] Seq=49420 Ack=1244 Win=60 Len=1420 [TCP segment of a reassembled PDU]"
"358","0.593382238","23.41.7.108","192.168.1.118","TCP","2962","443 → 46816 [ACK] Seq=48479 Ack=1140 Win=252 Len=2896 TSval=1265272581 TSecr=2927714422 [TCP segment of a reassembled PDU]"
"359","0.597746263","23.41.7.108","192.168.1.118","TLSv1.2","2962","Application Data [TCP segment of a reassembled PDU]"
"360","0.597792825","104.196.190.179","192.168.1.118","TLSv1.2","2894","Application Data [TCP segment of a reassembled PDU]"
"361","0.599806750","104.196.190.179","192.168.1.118","TCP","2894","443 → 40122 [ACK] Seq=53680 Ack=1244 Win=60 Len=2840 [TCP segment of a reassembled PDU]"
"362","0.599851538","23.41.7.108","192.168.1.118","TCP","2962","443 → 46816 [ACK] Seq=51375 Ack=1140 Win=252 Len=2896 TSval=1265272586 TSecr=2927714422 [TCP segment of a reassembled PDU]"
"363","0.599923800","104.196.190.179","192.168.1.118","TCP","2894","443 → 40122 [ACK] Seq=56520 Ack=1244 Win=60 Len=2840 [TCP segment of a reassembled PDU]"
"364","0.601409350","23.41.7.108","192.168.1.118","TLSv1.2","2024","Application Data"
"365","0.601455675","23.41.7.108","192.168.1.118","TCP","2962","443 → 46808 [ACK] Seq=52620 Ack=871 Win=260 Len=2896 TSval=1265272586 TSecr=2927714412 [TCP segment of a reassembled PDU]"
"366","0.601467013","104.196.190.179","192.168.1.118","TCP","2894","443 → 40122 [ACK] Seq=59360 Ack=1244 Win=60 Len=2840 [TCP segment of a reassembled PDU]"
"367","0.605205163","23.41.7.108","192.168.1.118","TCP","1514","[TCP segment of a reassembled PDU]"
"368","0.605425263","192.168.1.118","104.196.190.179","TCP","54","40124 → 443 [ACK] Seq=1250 Ack=45667 Win=501 Len=0"
"369","0.605789050","192.168.1.118","23.41.7.108","TCP","66","46816 → 443 [ACK] Seq=1140 Ack=56229 Win=505 Len=0 TSval=2927714467 TSecr=1265272574"
"370","0.605885488","192.168.1.118","23.41.7.108","TCP","66","46808 → 443 [ACK] Seq=871 Ack=55516 Win=691 Len=0 TSval=2927714467 TSecr=1265272580"
"371","0.606222613","192.168.1.118","104.196.190.179","TCP","54","40122 → 443 [ACK] Seq=1244 Ack=62200 Win=185 Len=0"
"372","0.606464825","23.41.7.108","192.168.1.118","TCP","4410","443 → 46814 [ACK] Seq=65908 Ack=1382 Win=260 Len=4344 TSval=1265272604 TSecr=2927714437 [TCP segment of a reassembled PDU]"
"373","0.606495875","192.168.1.118","23.41.7.108","TCP","66","46814 → 443 [ACK] Seq=1382 Ack=70252 Win=954 Len=0 TSval=2927714468 TSecr=1265272604"
"374","0.606507925","23.41.7.108","192.168.1.118","TCP","2962","443 → 46808 [ACK] Seq=55516 Ack=871 Win=260 Len=2896 TSval=1265272593 TSecr=2927714412 [TCP segment of a reassembled PDU]"
"375","0.608556913","23.41.7.108","192.168.1.118","TCP","1514","443 → 46814 [ACK] Seq=70252 Ack=1382 Win=260 Len=1448 TSval=1265272604 TSecr=2927714437 [TCP segment of a reassembled PDU]"
"376","0.608820850","192.168.1.118","23.41.7.108","TCP","66","46810 → 443 [ACK] Seq=1135 Ack=45672 Win=501 Len=0 TSval=2927714470 TSecr=1265272582"
"377","0.609030363","192.168.1.118","23.41.7.108","TCP","66","46808 → 443 [ACK] Seq=871 Ack=58412 Win=669 Len=0 TSval=2927714470 TSecr=1265272593"
"378","0.609588213","23.41.7.108","192.168.1.118","TCP","1514","443 → 46814 [ACK] Seq=71700 Ack=1382 Win=260 Len=1448 TSval=1265272604 TSecr=2927714437 [TCP segment of a reassembled PDU]"
"379","0.609625938","192.168.1.118","23.41.7.108","TCP","66","46814 → 443 [ACK] Seq=1382 Ack=73148 Win=999 Len=0 TSval=2927714471 TSecr=1265272604"
"380","0.612907363","23.41.7.108","192.168.1.118","TCP","1514","443 → 46814 [ACK] Seq=73148 Ack=1382 Win=260 Len=1448 TSval=1265272605 TSecr=2927714437 [TCP segment of a reassembled PDU]"
"381","0.614778025","23.41.7.108","192.168.1.118","TLSv1.2","2732","Application Data, Application Data"
"382","0.614834750","192.168.1.118","23.41.7.108","TCP","66","46808 → 443 [ACK] Seq=871 Ack=61078 Win=769 Len=0 TSval=2927714476 TSecr=1265272599"
"383","0.614874888","23.41.7.108","192.168.1.118","TCP","1514","443 → 46814 [ACK] Seq=74596 Ack=1382 Win=260 Len=1448 TSval=1265272605 TSecr=2927714437 [TCP segment of a reassembled PDU]"
"384","0.614891950","192.168.1.118","23.41.7.108","TCP","66","46814 → 443 [ACK] Seq=1382 Ack=76044 Win=1044 Len=0 TSval=2927714476 TSecr=1265272605"
"385","0.614908788","23.41.7.108","192.168.1.118","TLSv1.2","2250","Application Data"
"386","0.614923200","192.168.1.118","23.41.7.108","TCP","66","46814 → 443 [ACK] Seq=1382 Ack=78228 Win=1078 Len=0 TSval=2927714476 TSecr=1265272608"
"387","0.619072600","192.168.1.118","104.196.190.179","TCP","54","[TCP Window Update] 40122 → 443 [ACK] Seq=1244 Ack=62200 Win=501 Len=0"
"388","0.621472675","104.196.190.179","192.168.1.118","TCP","1474","443 → 40122 [ACK] Seq=62200 Ack=1244 Win=60 Len=1420 [TCP segment of a reassembled PDU]"
"389","0.629106700","104.196.190.179","192.168.1.118","TCP","1474","443 → 40122 [ACK] Seq=63620 Ack=1244 Win=60 Len=1420 [TCP segment of a reassembled PDU]"
"390","0.634227663","192.168.1.118","104.196.190.179","TCP","54","40122 → 443 [ACK] Seq=1244 Ack=65040 Win=501 Len=0"
"391","0.634398100","104.196.190.179","192.168.1.118","TLSv1.2","5734","Application Data [TCP segment of a reassembled PDU]"
"392","0.634477288","104.196.190.179","192.168.1.118","TLSv1.2","8333","Application Data"
"393","0.644789038","192.168.1.118","104.196.190.179","TCP","54","40122 → 443 [ACK] Seq=1244 Ack=78999 Win=501 Len=0"
"394","1.071612700","fe80::144e:ae0c:17ca:d785","ff02::16","ICMPv6","90","Multicast Listener Report Message v2"
"395","1.480263175","192.168.1.103","224.0.0.251","MDNS","112","Standard query 0x0000 PTR _sleep-proxy._udp.local, "QM" question OPT"
"396","1.482482963","fe80::144e:ae0c:17ca:d785","ff02::fb","MDNS","132","Standard query 0x0000 PTR _sleep-proxy._udp.local, "QM" question OPT"
"397","1.588108563","Cisco-Li_5b:1c:ce","IntelCor_b7:52:73","ARP","42","Who has 192.168.1.118? Tell 192.168.1.1"
"398","1.588145975","IntelCor_b7:52:73","Cisco-Li_5b:1c:ce","ARP","42","192.168.1.118 is at dc:fb:48:b7:52:73"
"399","2.405259888","192.168.1.104","255.255.255.255","UDP","217","49154 → 6666 Len=175"
"400","2.406298488","172.217.3.106","192.168.1.118","TCP","66","443 → 38000 [FIN, ACK] Seq=1 Ack=1 Win=266 Len=0 TSval=624101545 TSecr=3127442816"
"401","2.446615600","192.168.1.118","172.217.3.106","TCP","66","38000 → 443 [ACK] Seq=1 Ack=2 Win=501 Len=0 TSval=3127682878 TSecr=624101545"
"402","2.574461950","192.168.1.118","192.168.1.102","TCP","176","35182 → 8009 [PSH, ACK] Seq=1 Ack=1 Win=501 Len=110 TSval=2820287809 TSecr=6072639 [TCP segment of a reassembled PDU]"
"403","2.585027013","192.168.1.102","192.168.1.118","TCP","176","8009 → 35182 [PSH, ACK] Seq=1 Ack=111 Win=277 Len=110 TSval=6073140 TSecr=2820287809 [TCP segment of a reassembled PDU]"
"404","2.585111288","192.168.1.118","192.168.1.102","TCP","66","35182 → 8009 [ACK] Seq=111 Ack=111 Win=501 Len=0 TSval=2820287819 TSecr=6073140"
"405","3.117599375","fe80::144e:ae0c:17ca:d785","ff02::16","ICMPv6","90","Multicast Listener Report Message v2"
"406","3.733080013","192.168.1.103","224.0.0.251","MDNS","112","Standard query 0x0000 PTR _sleep-proxy._udp.local, "QU" question OPT"
"407","3.735140163","fe80::144e:ae0c:17ca:d785","ff02::fb","MDNS","132","Standard query 0x0000 PTR _sleep-proxy._udp.local, "QU" question OPT"
"408","4.550270950","192.168.1.103","224.0.0.2","IGMPv2","46","Leave Group 224.0.0.251"
"409","4.551787688","192.168.1.103","224.0.0.251","IGMPv2","46","Membership Report group 224.0.0.251"
"410","4.755439250","192.168.1.103","224.0.0.251","MDNS","112","Standard query 0x0000 PTR _sleep-proxy._udp.local, "QM" question OPT"
"411","4.757595600","fe80::144e:ae0c:17ca:d785","ff02::fb","MDNS","132","Standard query 0x0000 PTR _sleep-proxy._udp.local, "QM" question OPT"
"412","4.800469613","192.168.1.118","209.18.47.62","DNS","89","Standard query 0xa838 A clientservices.googleapis.com"
"413","4.826543650","209.18.47.62","192.168.1.118","DNS","105","Standard query response 0xa838 A clientservices.googleapis.com A 172.217.11.3"
"414","4.827146875","192.168.1.118","172.217.11.3","TCP","74","38226 → 443 [SYN] Seq=0 Win=64240 Len=0 MSS=1460 SACK_PERM=1 TSval=117332113 TSecr=0 WS=128"
"415","4.851476200","172.217.11.3","192.168.1.118","TCP","74","443 → 38226 [SYN, ACK] Seq=0 Ack=1 Win=60192 Len=0 MSS=1380 SACK_PERM=1 TSval=3402659775 TSecr=117332113 WS=256"
"416","4.851601738","192.168.1.118","172.217.11.3","TCP","66","38226 → 443 [ACK] Seq=1 Ack=1 Win=64256 Len=0 TSval=117332138 TSecr=3402659775"
"417","4.852143900","192.168.1.118","172.217.11.3","TLSv1","665","Client Hello"
"418","4.867177850","172.217.11.3","192.168.1.118","TCP","66","443 → 38226 [ACK] Seq=1 Ack=600 Win=61440 Len=0 TSval=3402659791 TSecr=117332138"
"419","4.868586925","172.217.11.3","192.168.1.118","TLSv1.3","278","Server Hello, Change Cipher Spec, Application Data"
"420","4.868656700","192.168.1.118","172.217.11.3","TCP","66","38226 → 443 [ACK] Seq=600 Ack=213 Win=64128 Len=0 TSval=117332155 TSecr=3402659791"
"421","4.876122688","192.168.1.118","172.217.11.3","TLSv1.3","130","Change Cipher Spec, Application Data"
"422","4.876920113","192.168.1.118","172.217.11.3","TLSv1.3","158","Application Data"
"423","4.877955188","192.168.1.118","172.217.11.3","TLSv1.3","468","Application Data"
"424","4.878076500","192.168.1.118","172.217.11.3","TCP","1434","[TCP segment of a reassembled PDU]"
"425","4.878086763","192.168.1.118","172.217.11.3","TCP","1434","38226 → 443 [ACK] Seq=2526 Ack=213 Win=64128 Len=1368 TSval=117332164 TSecr=3402659791 [TCP segment of a reassembled PDU]"
"426","4.878093813","192.168.1.118","172.217.11.3","TLSv1.3","213","Application Data"
"427","4.878203575","192.168.1.118","172.217.11.3","TCP","1434","[TCP segment of a reassembled PDU]"
"428","4.878213250","192.168.1.118","172.217.11.3","TCP","1434","38226 → 443 [ACK] Seq=5409 Ack=213 Win=64128 Len=1368 TSval=117332165 TSecr=3402659791 [TCP segment of a reassembled PDU]"
"429","4.878219850","192.168.1.118","172.217.11.3","TLSv1.3","1434","Application Data [TCP segment of a reassembled PDU]"
"430","4.881780625","192.168.1.118","172.217.11.3","TCP","1434","38226 → 443 [ACK] Seq=8145 Ack=213 Win=64128 Len=1368 TSval=117332168 TSecr=3402659791 [TCP segment of a reassembled PDU]"
"431","4.896465563","172.217.11.3","192.168.1.118","TLSv1.3","646","Application Data, Application Data"
"432","4.896598588","192.168.1.118","172.217.11.3","TLSv1.3","1434","Application Data [TCP segment of a reassembled PDU]"
"433","4.896633088","192.168.1.118","172.217.11.3","TCP","1434","38226 → 443 [ACK] Seq=10881 Ack=793 Win=63616 Len=1368 TSval=117332183 TSecr=3402659820 [TCP segment of a reassembled PDU]"
"434","4.896640863","192.168.1.118","172.217.11.3","TLSv1.3","1434","Application Data [TCP segment of a reassembled PDU]"
"435","4.896646600","192.168.1.118","172.217.11.3","TCP","1434","38226 → 443 [ACK] Seq=13617 Ack=793 Win=63616 Len=1368 TSval=117332183 TSecr=3402659820 [TCP segment of a reassembled PDU]"
"436","4.900285700","172.217.11.3","192.168.1.118","TLSv1.3","97","Application Data"
"437","4.906382700","172.217.11.3","192.168.1.118","TCP","66","443 → 38226 [ACK] Seq=824 Ack=3894 Win=68096 Len=0 TSval=3402659830 TSecr=117332164"
"438","4.906475288","192.168.1.118","172.217.11.3","TLSv1.3","1434","Application Data [TCP segment of a reassembled PDU]"
"439","4.906509025","192.168.1.118","172.217.11.3","TCP","1434","38226 → 443 [ACK] Seq=16353 Ack=824 Win=64128 Len=1368 TSval=117332193 TSecr=3402659820 [TCP segment of a reassembled PDU]"
"440","4.906536525","192.168.1.118","172.217.11.3","TLSv1.3","1434","Application Data [TCP segment of a reassembled PDU]"
"441","4.906544100","192.168.1.118","172.217.11.3","TCP","1434","38226 → 443 [ACK] Seq=19089 Ack=824 Win=64128 Len=1368 TSval=117332193 TSecr=3402659820 [TCP segment of a reassembled PDU]"
"442","4.908793888","192.168.1.118","172.217.11.3","TLSv1.3","1434","Application Data [TCP segment of a reassembled PDU]"
"443","4.908825513","192.168.1.118","172.217.11.3","TCP","1434","38226 → 443 [ACK] Seq=21825 Ack=824 Win=64128 Len=1368 TSval=117332195 TSecr=3402659820 [TCP segment of a reassembled PDU]"
"444","4.910197050","172.217.11.3","192.168.1.118","TCP","66","443 → 38226 [ACK] Seq=824 Ack=5409 Win=73728 Len=0 TSval=3402659831 TSecr=117332164"
"445","4.910284400","192.168.1.118","172.217.11.3","TLSv1.3","1434","Application Data [TCP segment of a reassembled PDU]"
"446","4.910311938","192.168.1.118","172.217.11.3","TCP","1434","38226 → 443 [ACK] Seq=24561 Ack=824 Win=64128 Len=1368 TSval=117332197 TSecr=3402659831 [TCP segment of a reassembled PDU]"
"447","4.910318900","192.168.1.118","172.217.11.3","TLSv1.3","1434","Application Data [TCP segment of a reassembled PDU]"
"448","4.910325138","192.168.1.118","172.217.11.3","TCP","1434","38226 → 443 [ACK] Seq=27297 Ack=824 Win=64128 Len=1368 TSval=117332197 TSecr=3402659831 [TCP segment of a reassembled PDU]"
"449","4.910823750","172.217.11.3","192.168.1.118","TCP","66","443 → 38226 [ACK] Seq=824 Ack=8145 Win=79104 Len=0 TSval=3402659833 TSecr=117332165"
"450","4.914341425","192.168.1.118","172.217.11.3","TLSv1.3","1434","Application Data [TCP segment of a reassembled PDU]"
"451","4.914374775","192.168.1.118","172.217.11.3","TCP","1434","38226 → 443 [ACK] Seq=30033 Ack=824 Win=64128 Len=1368 TSval=117332201 TSecr=3402659833 [TCP segment of a reassembled PDU]"
"452","4.914381888","192.168.1.118","172.217.11.3","TLSv1.3","585","Application Data, Application Data"
"453","4.916057913","172.217.11.3","192.168.1.118","TCP","66","443 → 38226 [ACK] Seq=824 Ack=9513 Win=81920 Len=0 TSval=3402659838 TSecr=117332168"
"454","4.917042400","172.217.11.3","192.168.1.118","TCP","66","443 → 38226 [ACK] Seq=824 Ack=10881 Win=84480 Len=0 TSval=3402659840 TSecr=117332183"
"455","4.917834550","172.217.11.3","192.168.1.118","TCP","66","443 → 38226 [ACK] Seq=824 Ack=12249 Win=87296 Len=0 TSval=3402659842 TSecr=117332183"
"456","4.919288925","172.217.11.3","192.168.1.118","TCP","66","443 → 38226 [ACK] Seq=824 Ack=13617 Win=90112 Len=0 TSval=3402659843 TSecr=117332183"
"457","4.920143750","172.217.11.3","192.168.1.118","TCP","66","443 → 38226 [ACK] Seq=824 Ack=14985 Win=92928 Len=0 TSval=3402659844 TSecr=117332183"
"458","4.928127738","172.217.11.3","192.168.1.118","TCP","66","443 → 38226 [ACK] Seq=824 Ack=16353 Win=95488 Len=0 TSval=3402659851 TSecr=117332193"
"459","4.928914013","172.217.11.3","192.168.1.118","TCP","66","443 → 38226 [ACK] Seq=824 Ack=17721 Win=98304 Len=0 TSval=3402659851 TSecr=117332193"
"460","4.928951188","172.217.11.3","192.168.1.118","TCP","66","443 → 38226 [ACK] Seq=824 Ack=19089 Win=101120 Len=0 TSval=3402659852 TSecr=117332193"
"461","4.928965538","172.217.11.3","192.168.1.118","TCP","66","443 → 38226 [ACK] Seq=824 Ack=20457 Win=103680 Len=0 TSval=3402659853 TSecr=117332193"
"462","4.929962900","172.217.11.3","192.168.1.118","TCP","66","443 → 38226 [ACK] Seq=824 Ack=21825 Win=106496 Len=0 TSval=3402659853 TSecr=117332195"
"463","4.930010313","172.217.11.3","192.168.1.118","TCP","66","443 → 38226 [ACK] Seq=824 Ack=23193 Win=109312 Len=0 TSval=3402659853 TSecr=117332195"
"464","4.930029988","172.217.11.3","192.168.1.118","TCP","66","443 → 38226 [ACK] Seq=824 Ack=24561 Win=111872 Len=0 TSval=3402659853 TSecr=117332197"
"465","4.932058738","172.217.11.3","192.168.1.118","TLSv1.3","101","Application Data"
"466","4.932110613","172.217.11.3","192.168.1.118","TCP","66","443 → 38226 [ACK] Seq=859 Ack=27297 Win=117504 Len=0 TSval=3402659854 TSecr=117332197"
"467","4.935510988","172.217.11.3","192.168.1.118","TCP","66","443 → 38226 [ACK] Seq=859 Ack=28665 Win=120064 Len=0 TSval=3402659859 TSecr=117332197"
"468","4.939506700","172.217.11.3","192.168.1.118","TCP","66","443 → 38226 [ACK] Seq=859 Ack=30033 Win=122880 Len=0 TSval=3402659860 TSecr=117332201"
"469","4.939989213","172.217.11.3","192.168.1.118","TCP","66","443 → 38226 [ACK] Seq=859 Ack=31401 Win=125696 Len=0 TSval=3402659861 TSecr=117332201"
"470","4.940018413","172.217.11.3","192.168.1.118","TCP","66","443 → 38226 [ACK] Seq=859 Ack=31920 Win=128256 Len=0 TSval=3402659861 TSecr=117332201"
"471","4.958961900","172.217.11.3","192.168.1.118","TLSv1.3","440","Application Data"
"472","4.959762613","172.217.11.3","192.168.1.118","TLSv1.3","349","Application Data"
"473","4.959797225","172.217.11.3","192.168.1.118","TLSv1.3","339","Application Data"
"474","4.959809688","172.217.11.3","192.168.1.118","TLSv1.3","105","Application Data"
"475","4.959819600","192.168.1.118","172.217.11.3","TCP","66","38226 → 443 [ACK] Seq=31920 Ack=1233 Win=64128 Len=0 TSval=117332246 TSecr=3402659853"
"476","4.961270475","192.168.1.118","172.217.11.3","TCP","66","38226 → 443 [ACK] Seq=31920 Ack=1828 Win=64128 Len=0 TSval=117332248 TSecr=3402659880"
"477","4.962185238","192.168.1.118","172.217.11.3","TLSv1.3","105","Application Data"
"478","4.992987075","172.217.11.3","192.168.1.118","TCP","66","443 → 38226 [ACK] Seq=1828 Ack=31959 Win=128256 Len=0 TSval=3402659915 TSecr=117332249"
"479","6.352209763","192.168.1.118","172.217.11.3","TCP","66","38226 → 443 [FIN, ACK] Seq=31959 Ack=1828 Win=64128 Len=0 TSval=117333639 TSecr=3402659915"
"480","6.375469725","172.217.11.3","192.168.1.118","TCP","66","443 → 38226 [FIN, ACK] Seq=1828 Ack=31960 Win=128256 Len=0 TSval=3402661291 TSecr=117333639"
"481","6.375577075","192.168.1.118","172.217.11.3","TCP","66","38226 → 443 [ACK] Seq=31960 Ack=1829 Win=64128 Len=0 TSval=117333662 TSecr=3402661291"
"482","7.015867650","192.168.1.101","224.0.0.251","MDNS","606","Standard query 0x0000 PTR _googlecast._tcp.local, "QU" question PTR _homekit._tcp.local, "QU" question PTR _uscan._tcp.local, "QU" question PTR _ptp._tcp.local, "QU" question PTR _ippusb._tcp.local, "QU" question PTR _scanner._tcp.local, "QU" question PTR _ipp._tcp.local, "QU" question PTR _pdl-datastream._tcp.local, "QU" question PTR _uscans._tcp.local, "QU" question PTR _ipps._tcp.local, "QU" question PTR _printer._tcp.local, "QU" question PTR _airplay._tcp.local, "QU" question PTR _raop._tcp.local, "QU" question PTR _airport._tcp.local, "QU" question PTR _rdlink._tcp.local, "QU" question PTR _companion-link._tcp.local, "QU" question PTR _afpovertcp._tcp.local, "QU" question PTR _rfb._tcp.local, "QU" question PTR _adisk._tcp.local, "QU" question PTR _apple-mobdev._tcp.local, "QU" question PTR 8ed307c3._sub._apple-mobdev2._tcp.local, "QU" question PTR _apple-pairable._tcp.local, "QU" question TXT Google-Home-Mini-2c3f16b2da5c4b6fd6cfbfba61c12490._googlecast._tcp.local, "QU" question ANY cjqg._smb._tcp.local, "QU" question ANY cjqg._companion-link._tcp.local, "QU" question PTR Google-Home-Mini-2c3f16b2da5c4b6fd6cfbfba61c12490._googlecast._tcp.local PTR cjqg._companion-link._tcp.local SRV 0 0 445 cjqg.local SRV 0 0 53785 cjqg.local OPT"
"483","7.021791588","fe80::1814:2ecf:2c8a:d90d","ff02::fb","MDNS","626","Standard query 0x0000 PTR _googlecast._tcp.local, "QU" question PTR _homekit._tcp.local, "QU" question PTR _uscan._tcp.local, "QU" question PTR _ptp._tcp.local, "QU" question PTR _ippusb._tcp.local, "QU" question PTR _scanner._tcp.local, "QU" question PTR _ipp._tcp.local, "QU" question PTR _pdl-datastream._tcp.local, "QU" question PTR _uscans._tcp.local, "QU" question PTR _ipps._tcp.local, "QU" question PTR _printer._tcp.local, "QU" question PTR _airplay._tcp.local, "QU" question PTR _raop._tcp.local, "QU" question PTR _airport._tcp.local, "QU" question PTR _rdlink._tcp.local, "QU" question PTR _companion-link._tcp.local, "QU" question PTR _afpovertcp._tcp.local, "QU" question PTR _rfb._tcp.local, "QU" question PTR _adisk._tcp.local, "QU" question PTR _apple-mobdev._tcp.local, "QU" question PTR 8ed307c3._sub._apple-mobdev2._tcp.local, "QU" question PTR _apple-pairable._tcp.local, "QU" question TXT Google-Home-Mini-2c3f16b2da5c4b6fd6cfbfba61c12490._googlecast._tcp.local, "QU" question ANY cjqg._smb._tcp.local, "QU" question ANY cjqg._companion-link._tcp.local, "QU" question PTR Google-Home-Mini-2c3f16b2da5c4b6fd6cfbfba61c12490._googlecast._tcp.local PTR cjqg._companion-link._tcp.local SRV 0 0 445 cjqg.local SRV 0 0 53785 cjqg.local OPT"
"484","7.025054788","192.168.1.101","224.0.0.251","MDNS","294","Standard query response 0x0000 PTR _smb._tcp.local TXT TXT OPT"
"485","7.028439838","fe80::1814:2ecf:2c8a:d90d","ff02::fb","MDNS","314","Standard query response 0x0000 PTR _smb._tcp.local TXT TXT OPT"
"486","7.034392163","fe80::1cc7:6d9a:a312:7e8f","ff02::fb","MDNS","620","Standard query 0x0000 PTR _googlecast._tcp.local, "QU" question PTR _homekit._tcp.local, "QU" question PTR _uscan._tcp.local, "QU" question PTR _ptp._tcp.local, "QU" question PTR _ippusb._tcp.local, "QU" question PTR _scanner._tcp.local, "QU" question PTR _ipp._tcp.local, "QU" question PTR _pdl-datastream._tcp.local, "QU" question PTR _uscans._tcp.local, "QU" question PTR _ipps._tcp.local, "QU" question PTR _printer._tcp.local, "QU" question PTR _airplay._tcp.local, "QU" question PTR _raop._tcp.local, "QU" question PTR _airport._tcp.local, "QU" question PTR _rdlink._tcp.local, "QU" question PTR _companion-link._tcp.local, "QU" question PTR _afpovertcp._tcp.local, "QU" question PTR _rfb._tcp.local, "QU" question PTR _adisk._tcp.local, "QU" question PTR _apple-mobdev._tcp.local, "QU" question PTR 8ed307c3._sub._apple-mobdev2._tcp.local, "QU" question PTR _apple-pairable._tcp.local, "QU" question TXT Google-Home-Mini-2c3f16b2da5c4b6fd6cfbfba61c12490._googlecast._tcp.local, "QU" question ANY cjqg._smb._tcp.local, "QU" question ANY cjqg._companion-link._tcp.local, "QU" question PTR Google-Home-Mini-2c3f16b2da5c4b6fd6cfbfba61c12490._googlecast._tcp.local PTR cjqg._companion-link._tcp.local SRV 0 0 445 cjqg.local SRV 0 0 53785 cjqg.local OPT"
"487","7.215098663","192.168.1.101","224.0.0.251","MDNS","181","Standard query 0x0000 ANY cjqg._smb._tcp.local, "QM" question ANY cjqg._companion-link._tcp.local, "QM" question SRV 0 0 445 cjqg.local SRV 0 0 53785 cjqg.local OPT"
"488","7.217605325","fe80::1814:2ecf:2c8a:d90d","ff02::fb","MDNS","201","Standard query 0x0000 ANY cjqg._smb._tcp.local, "QM" question ANY cjqg._companion-link._tcp.local, "QM" question SRV 0 0 445 cjqg.local SRV 0 0 53785 cjqg.local OPT"
"489","7.220555763","fe80::1cc7:6d9a:a312:7e8f","ff02::fb","MDNS","195","Standard query 0x0000 ANY cjqg._smb._tcp.local, "QM" question ANY cjqg._companion-link._tcp.local, "QM" question SRV 0 0 445 cjqg.local SRV 0 0 53785 cjqg.local OPT"
"490","7.222922925","192.168.1.100","224.0.0.251","MDNS","175","Standard query 0x0000 ANY cjqg._smb._tcp.local, "QM" question ANY cjqg._companion-link._tcp.local, "QM" question SRV 0 0 445 cjqg.local SRV 0 0 53785 cjqg.local OPT"
"491","7.520980813","192.168.1.101","224.0.0.251","MDNS","181","Standard query 0x0000 ANY cjqg._smb._tcp.local, "QM" question ANY cjqg._companion-link._tcp.local, "QM" question SRV 0 0 445 cjqg.local SRV 0 0 53785 cjqg.local OPT"
"492","7.523750525","fe80::1814:2ecf:2c8a:d90d","ff02::fb","MDNS","201","Standard query 0x0000 ANY cjqg._smb._tcp.local, "QM" question ANY cjqg._companion-link._tcp.local, "QM" question SRV 0 0 445 cjqg.local SRV 0 0 53785 cjqg.local OPT"
"493","7.586985888","192.168.1.118","192.168.1.102","TCP","176","35182 → 8009 [PSH, ACK] Seq=111 Ack=111 Win=501 Len=110 TSval=2820292821 TSecr=6073140 [TCP segment of a reassembled PDU]"
"494","7.594688588","192.168.1.102","192.168.1.118","TCP","176","8009 → 35182 [PSH, ACK] Seq=111 Ack=221 Win=277 Len=110 TSval=6073641 TSecr=2820292821 [TCP segment of a reassembled PDU]"
"495","7.594773388","192.168.1.118","192.168.1.102","TCP","66","35182 → 8009 [ACK] Seq=221 Ack=221 Win=501 Len=0 TSval=2820292829 TSecr=6073641"
"496","7.729765438","192.168.1.101","224.0.0.251","MDNS","530","Standard query response 0x0000 TXT, cache flush PTR cjqg._smb._tcp.local TXT SRV, cache flush 0 0 445 cjqg.local TXT, cache flush PTR _companion-link._tcp.local PTR cjqg._companion-link._tcp.local SRV, cache flush 0 0 53785 cjqg.local AAAA, cache flush fe80::1814:2ecf:2c8a:d90d A, cache flush 192.168.1.101 NSEC, cache flush cjqg._smb._tcp.local NSEC, cache flush cjqg._companion-link._tcp.local NSEC, cache flush cjqg.local OPT"
"497","7.735711563","fe80::1814:2ecf:2c8a:d90d","ff02::fb","MDNS","550","Standard query response 0x0000 TXT, cache flush PTR cjqg._smb._tcp.local TXT SRV, cache flush 0 0 445 cjqg.local TXT, cache flush PTR _companion-link._tcp.local PTR cjqg._companion-link._tcp.local SRV, cache flush 0 0 53785 cjqg.local AAAA, cache flush fe80::1814:2ecf:2c8a:d90d A, cache flush 192.168.1.101 NSEC, cache flush cjqg._smb._tcp.local NSEC, cache flush cjqg._companion-link._tcp.local NSEC, cache flush cjqg.local OPT"
"498","7.741250575","fe80::1cc7:6d9a:a312:7e8f","ff02::fb","MDNS","544","Standard query response 0x0000 TXT, cache flush PTR cjqg._smb._tcp.local TXT SRV, cache flush 0 0 445 cjqg.local TXT, cache flush PTR _companion-link._tcp.local PTR cjqg._companion-link._tcp.local SRV, cache flush 0 0 53785 cjqg.local AAAA, cache flush fe80::1cc7:6d9a:a312:7e8f A, cache flush 192.168.1.100 NSEC, cache flush cjqg._smb._tcp.local NSEC, cache flush cjqg._companion-link._tcp.local NSEC, cache flush cjqg.local OPT"
"499","7.746340288","192.168.1.100","224.0.0.251","MDNS","524","Standard query response 0x0000 TXT, cache flush PTR cjqg._smb._tcp.local TXT SRV, cache flush 0 0 445 cjqg.local TXT, cache flush PTR _companion-link._tcp.local PTR cjqg._companion-link._tcp.local SRV, cache flush 0 0 53785 cjqg.local AAAA, cache flush fe80::1cc7:6d9a:a312:7e8f A, cache flush 192.168.1.100 NSEC, cache flush cjqg._smb._tcp.local NSEC, cache flush cjqg._companion-link._tcp.local NSEC, cache flush cjqg.local OPT"
"500","7.933420625","192.168.1.101","224.0.0.251","MDNS","539","Standard query 0x0000 PTR _googlecast._tcp.local, "QM" question PTR _homekit._tcp.local, "QM" question PTR _uscan._tcp.local, "QM" question PTR _ptp._tcp.local, "QM" question PTR _ippusb._tcp.local, "QM" question PTR _scanner._tcp.local, "QM" question PTR _ipp._tcp.local, "QM" question PTR _pdl-datastream._tcp.local, "QM" question PTR _uscans._tcp.local, "QM" question PTR _ipps._tcp.local, "QM" question PTR _printer._tcp.local, "QM" question PTR _airplay._tcp.local, "QM" question PTR _raop._tcp.local, "QM" question PTR _airport._tcp.local, "QM" question PTR _rdlink._tcp.local, "QM" question PTR _companion-link._tcp.local, "QM" question PTR _afpovertcp._tcp.local, "QM" question PTR _rfb._tcp.local, "QM" question PTR _adisk._tcp.local, "QM" question PTR _apple-mobdev._tcp.local, "QM" question PTR 8ed307c3._sub._apple-mobdev2._tcp.local, "QM" question PTR _apple-pairable._tcp.local, "QM" question TXT Google-Home-Mini-2c3f16b2da5c4b6fd6cfbfba61c12490._googlecast._tcp.local, "QM" question PTR Google-Home-Mini-2c3f16b2da5c4b6fd6cfbfba61c12490._googlecast._tcp.local PTR cjqg._companion-link._tcp.local OPT"
"501","8.032761425","192.168.1.102","224.0.0.251","MDNS","183","Standard query response 0x0000 SRV, cache flush 0 0 8009 2c3f16b2-da5c-4b6f-d6cf-bfba61c12490.local"
"502","8.035218013","192.168.1.102","224.0.0.251","MDNS","183","Standard query response 0x0000 SRV, cache flush 0 0 8009 2c3f16b2-da5c-4b6f-d6cf-bfba61c12490.local"
"503","8.442626025","192.168.1.104","255.255.255.255","UDP","217","49154 → 6666 Len=175"
"504","8.752309238","192.168.1.101","224.0.0.251","MDNS","530","Standard query response 0x0000 TXT, cache flush PTR cjqg._smb._tcp.local TXT SRV, cache flush 0 0 445 cjqg.local TXT, cache flush PTR _companion-link._tcp.local PTR cjqg._companion-link._tcp.local SRV, cache flush 0 0 53785 cjqg.local AAAA, cache flush fe80::1814:2ecf:2c8a:d90d A, cache flush 192.168.1.101 NSEC, cache flush cjqg._smb._tcp.local NSEC, cache flush cjqg._companion-link._tcp.local NSEC, cache flush cjqg.local OPT"
"505","8.757625275","fe80::1814:2ecf:2c8a:d90d","ff02::fb","MDNS","550","Standard query response 0x0000 TXT, cache flush PTR cjqg._smb._tcp.local TXT SRV, cache flush 0 0 445 cjqg.local TXT, cache flush PTR _companion-link._tcp.local PTR cjqg._companion-link._tcp.local SRV, cache flush 0 0 53785 cjqg.local AAAA, cache flush fe80::1814:2ecf:2c8a:d90d A, cache flush 192.168.1.101 NSEC, cache flush cjqg._smb._tcp.local NSEC, cache flush cjqg._companion-link._tcp.local NSEC, cache flush cjqg.local OPT"
"506","8.763063113","fe80::1cc7:6d9a:a312:7e8f","ff02::fb","MDNS","544","Standard query response 0x0000 TXT, cache flush PTR cjqg._smb._tcp.local TXT SRV, cache flush 0 0 445 cjqg.local TXT, cache flush PTR _companion-link._tcp.local PTR cjqg._companion-link._tcp.local SRV, cache flush 0 0 53785 cjqg.local AAAA, cache flush fe80::1cc7:6d9a:a312:7e8f A, cache flush 192.168.1.100 NSEC, cache flush cjqg._smb._tcp.local NSEC, cache flush cjqg._companion-link._tcp.local NSEC, cache flush cjqg.local OPT"
"507","8.768197625","192.168.1.100","224.0.0.251","MDNS","524","Standard query response 0x0000 TXT, cache flush PTR cjqg._smb._tcp.local TXT SRV, cache flush 0 0 445 cjqg.local TXT, cache flush PTR _companion-link._tcp.local PTR cjqg._companion-link._tcp.local SRV, cache flush 0 0 53785 cjqg.local AAAA, cache flush fe80::1cc7:6d9a:a312:7e8f A, cache flush 192.168.1.100 NSEC, cache flush cjqg._smb._tcp.local NSEC, cache flush cjqg._companion-link._tcp.local NSEC, cache flush cjqg.local OPT"
