frame.number,_ws.col.Time,_ws.col.Source,_ws.col.Destination,_ws.col.Protocol,frame.len,_ws.col.Info
"1","0.000000000","136.147.56.129","192.168.1.118","SSL","1108","Continuation Data"
"2","0.000062337","192.168.1.118","136.147.56.129","TCP","66","46088 → 443 [ACK] Seq=1 Ack=1043 Win=62008 Len=0 TSval=155286336 TSecr=710582411"
"3","0.004708887","104.64.212.198","192.168.1.118","TCP","66","443 → 37414 [ACK] Seq=1 Ack=1 Win=235 Len=0 TSval=1550615775 TSecr=3906619515"
"4","0.006113937","104.64.212.198","192.168.1.118","TLSv1.2","1514","Server Hello"
"5","0.006176262","192.168.1.118","104.64.212.198","TCP","66","37414 → 443 [ACK] Seq=1 Ack=1449 Win=493 Len=0 TSval=3906619535 TSecr=1550615777"
"6","0.009695987","104.64.212.198","192.168.1.118","TLSv1.2","1891","Certificate, Server Key Exchange, Server Hello Done"
"7","0.009765000","192.168.1.118","104.64.212.198","TCP","66","37414 → 443 [ACK] Seq=1 Ack=3274 Win=479 Len=0 TSval=3906619539 TSecr=1550615777"
"8","0.040552100","192.168.1.118","104.64.212.198","TLSv1","583","Client Hello"
"9","0.065708237","104.64.212.198","192.168.1.118","TCP","66","443 → 37416 [ACK] Seq=1 Ack=518 Win=235 Len=0 TSval=1550615837 TSecr=3906619570"
"10","0.070363212","104.64.212.198","192.168.1.118","TLSv1.2","1514","Server Hello"
"11","0.070430187","192.168.1.118","104.64.212.198","TCP","66","37416 → 443 [ACK] Seq=518 Ack=1449 Win=493 Len=0 TSval=3906619600 TSecr=1550615839"
"12","0.073258587","104.64.212.198","192.168.1.118","TLSv1.2","1891","Certificate, Server Key Exchange, Server Hello Done"
"13","0.073324987","192.168.1.118","104.64.212.198","TCP","66","37416 → 443 [ACK] Seq=518 Ack=3274 Win=479 Len=0 TSval=3906619603 TSecr=1550615839"
"14","0.083065912","192.168.1.118","104.64.212.198","TLSv1","583","Client Hello"
"15","0.100415337","104.64.212.198","192.168.1.118","TCP","66","443 → 37418 [ACK] Seq=1 Ack=518 Win=235 Len=0 TSval=1550615871 TSecr=3906619612"
"16","0.106229250","192.168.1.118","104.64.212.198","TLSv1","583","Client Hello"
"17","0.108483987","104.64.212.198","192.168.1.118","TLSv1.2","1514","Server Hello"
"18","0.108550587","192.168.1.118","104.64.212.198","TCP","66","37418 → 443 [ACK] Seq=518 Ack=1449 Win=493 Len=0 TSval=3906619638 TSecr=1550615879"
"19","0.109980287","104.64.212.198","192.168.1.118","TLSv1.2","1891","Certificate, Server Key Exchange, Server Hello Done"
"20","0.110042962","192.168.1.118","104.64.212.198","TCP","66","37418 → 443 [ACK] Seq=518 Ack=3274 Win=479 Len=0 TSval=3906619639 TSecr=1550615879"
"21","0.128848725","104.64.212.198","192.168.1.118","TCP","66","443 → 37420 [ACK] Seq=1 Ack=518 Win=235 Len=0 TSval=1550615901 TSecr=3906619635"
"22","0.129101312","192.168.1.118","104.64.212.198","TLSv1","583","Client Hello"
"23","0.131620737","192.168.1.118","104.64.212.198","TLSv1.2","192","Client Key Exchange, Change Cipher Spec, Encrypted Handshake Message"
"24","0.133985225","192.168.1.118","136.147.56.129","TLSv1.2","192","Client Key Exchange, Change Cipher Spec, Encrypted Handshake Message"
"25","0.135974787","192.168.1.118","104.64.212.198","TLSv1.2","192","Client Key Exchange, Change Cipher Spec, Encrypted Handshake Message"
"26","0.137910487","192.168.1.118","104.64.212.198","TLSv1.2","192","Client Key Exchange, Change Cipher Spec, Encrypted Handshake Message"
"27","0.138031950","104.64.212.198","192.168.1.118","TLSv1.2","1514","Server Hello"
"28","0.138100037","192.168.1.118","104.64.212.198","TCP","66","37420 → 443 [ACK] Seq=518 Ack=1449 Win=493 Len=0 TSval=3906619667 TSecr=1550615908"
"29","0.139434725","104.64.212.198","192.168.1.118","TLSv1.2","1891","Certificate, Server Key Exchange, Server Hello Done"
"30","0.139486850","192.168.1.118","104.64.212.198","TCP","66","37420 → 443 [ACK] Seq=518 Ack=3274 Win=479 Len=0 TSval=3906619669 TSecr=1550615908"
"31","0.144531625","192.168.1.118","104.64.212.198","TLSv1.2","192","Client Key Exchange, Change Cipher Spec, Encrypted Handshake Message"
"32","0.147313325","104.64.212.198","192.168.1.118","TCP","66","443 → 37422 [ACK] Seq=1 Ack=518 Win=235 Len=0 TSval=1550615919 TSecr=3906619658"
"33","0.152201925","104.64.212.198","192.168.1.118","TLSv1.2","1514","Server Hello"
"34","0.152266362","192.168.1.118","104.64.212.198","TCP","66","37422 → 443 [ACK] Seq=518 Ack=1449 Win=493 Len=0 TSval=3906619682 TSecr=1550615921"
"35","0.154084762","104.64.212.198","192.168.1.118","TLSv1.2","1891","Certificate, Server Key Exchange, Server Hello Done"
"36","0.154146025","192.168.1.118","104.64.212.198","TCP","66","37422 → 443 [ACK] Seq=518 Ack=3274 Win=479 Len=0 TSval=3906619683 TSecr=1550615921"
"37","0.154185650","104.64.212.198","192.168.1.118","TLSv1.2","117","Change Cipher Spec, Encrypted Handshake Message"
"38","0.154210787","192.168.1.118","104.64.212.198","TCP","66","37416 → 443 [ACK] Seq=644 Ack=3325 Win=501 Len=0 TSval=3906619684 TSecr=1550615924"
"39","0.154226762","104.64.212.198","192.168.1.118","TLSv1.2","117","Change Cipher Spec, Encrypted Handshake Message"
"40","0.154563337","192.168.1.118","104.64.212.198","TLSv1.2","336","Application Data"
"41","0.154848725","192.168.1.118","104.64.212.198","TLSv1.2","320","Application Data"
"42","0.156750250","192.168.1.118","104.64.212.198","TLSv1.2","192","Client Key Exchange, Change Cipher Spec, Encrypted Handshake Message"
"43","0.159506200","104.64.212.198","192.168.1.118","TLSv1.2","117","Change Cipher Spec, Encrypted Handshake Message"
"44","0.160840612","192.168.1.118","104.64.212.198","TLSv1.2","309","Application Data"
"45","0.165255050","104.64.212.198","192.168.1.118","TLSv1.2","117","Change Cipher Spec, Encrypted Handshake Message"
"46","0.165325100","192.168.1.118","104.64.212.198","TCP","66","37414 → 443 [ACK] Seq=127 Ack=3325 Win=501 Len=0 TSval=3906619695 TSecr=1550615936"
"47","0.166093750","192.168.1.118","104.64.212.198","TLSv1.2","305","Application Data"
"48","0.182492262","104.64.212.198","192.168.1.118","TCP","5858","[TCP segment of a reassembled PDU]"
"49","0.182609687","104.64.212.198","192.168.1.118","TLSv1.2","2706","Application Data"
"50","0.182635100","104.64.212.198","192.168.1.118","TLSv1.2","2691","Application Data"
"51","0.182654862","104.64.212.198","192.168.1.118","TLSv1.2","117","Change Cipher Spec, Encrypted Handshake Message"
"52","0.183059175","192.168.1.118","104.64.212.198","TCP","66","37416 → 443 [ACK] Seq=914 Ack=5950 Win=481 Len=0 TSval=3906619712 TSecr=1550615945"
"53","0.183552187","192.168.1.118","104.64.212.198","TCP","66","37418 → 443 [ACK] Seq=898 Ack=11757 Win=436 Len=0 TSval=3906619713 TSecr=1550615945"
"54","0.184510662","192.168.1.118","104.64.212.198","TLSv1.2","296","Application Data"
"55","0.186325412","192.168.1.118","104.64.212.198","TLSv1.2","307","Application Data"
"56","0.186456337","192.168.1.118","104.64.212.198","TLSv1.2","305","Application Data"
"57","0.197801900","136.147.56.129","192.168.1.118","TCP","66","443 → 46088 [ACK] Seq=1043 Ack=127 Win=4723 Len=0 TSval=710582606 TSecr=155286470"
"58","0.197857625","136.147.56.129","192.168.1.118","TLSv1.2","72","Change Cipher Spec"
"59","0.197889287","192.168.1.118","136.147.56.129","TCP","66","46088 → 443 [ACK] Seq=127 Ack=1049 Win=63356 Len=0 TSval=155286534 TSecr=710582606"
"60","0.197938350","136.147.56.129","192.168.1.118","TLSv1.2","111","Encrypted Handshake Message"
"61","0.197953975","192.168.1.118","136.147.56.129","TCP","66","46088 → 443 [ACK] Seq=127 Ack=1094 Win=63356 Len=0 TSval=155286534 TSecr=710582606"
"62","0.197975925","104.64.212.198","192.168.1.118","TCP","4410","[TCP segment of a reassembled PDU]"
"63","0.198771612","104.64.212.198","192.168.1.118","TCP","1514","443 → 37420 [ACK] Seq=7669 Ack=887 Win=243 Len=1448 TSval=1550615960 TSecr=3906619690 [TCP segment of a reassembled PDU]"
"64","0.205705525","104.64.212.198","192.168.1.118","TCP","1514","443 → 37420 [ACK] Seq=9117 Ack=887 Win=243 Len=1448 TSval=1550615960 TSecr=3906619690 [TCP segment of a reassembled PDU]"
"65","0.208521525","192.168.1.118","136.147.56.129","TLSv1.2","307","Application Data"
"66","0.208640212","192.168.1.118","104.64.212.198","TCP","66","37420 → 443 [ACK] Seq=887 Ack=10565 Win=445 Len=0 TSval=3906619738 TSecr=1550615960"
"67","0.214114787","104.64.212.198","192.168.1.118","TCP","1514","443 → 37420 [ACK] Seq=10565 Ack=887 Win=243 Len=1448 TSval=1550615960 TSecr=3906619690 [TCP segment of a reassembled PDU]"
"68","0.215196837","104.64.212.198","192.168.1.118","TCP","2962","443 → 37420 [ACK] Seq=12013 Ack=887 Win=243 Len=2896 TSval=1550615968 TSecr=3906619690 [TCP segment of a reassembled PDU]"
"69","0.215248687","192.168.1.118","104.64.212.198","TCP","66","37420 → 443 [ACK] Seq=887 Ack=14909 Win=477 Len=0 TSval=3906619745 TSecr=1550615960"
"70","0.225405887","104.64.212.198","192.168.1.118","TCP","2962","443 → 37420 [ACK] Seq=14909 Ack=887 Win=243 Len=2896 TSval=1550615977 TSecr=3906619690 [TCP segment of a reassembled PDU]"
"71","0.225467862","192.168.1.118","104.64.212.198","TCP","66","37420 → 443 [ACK] Seq=887 Ack=17805 Win=477 Len=0 TSval=3906619755 TSecr=1550615977"
"72","0.241455175","104.64.212.198","192.168.1.118","TLSv1.2","6149","Application Data"
"73","0.241778337","104.64.212.198","192.168.1.118","TLSv1.2","2474","Application Data"
"74","0.241805787","104.64.212.198","192.168.1.118","TLSv1.2","2962","Application Data [TCP segment of a reassembled PDU]"
"75","0.241838075","192.168.1.118","104.64.212.198","TCP","66","37420 → 443 [ACK] Seq=887 Ack=20701 Win=477 Len=0 TSval=3906619771 TSecr=1550615986"
"76","0.241872250","104.64.212.198","192.168.1.118","TCP","2962","[TCP segment of a reassembled PDU]"
"77","0.243861525","104.64.212.198","192.168.1.118","TCP","2962","443 → 37420 [ACK] Seq=20701 Ack=887 Win=243 Len=2896 TSval=1550615995 TSecr=3906619690 [TCP segment of a reassembled PDU]"
"78","0.244469112","192.168.1.118","104.64.212.198","TCP","66","37422 → 443 [ACK] Seq=874 Ack=6221 Win=479 Len=0 TSval=3906619774 TSecr=1550616005"
"79","0.244585100","192.168.1.118","104.64.212.198","TCP","66","37414 → 443 [ACK] Seq=366 Ack=9408 Win=454 Len=0 TSval=3906619774 TSecr=1550615997"
"80","0.244645412","104.64.212.198","192.168.1.118","TLSv1.2","740","Application Data"
"81","0.244773100","192.168.1.118","104.64.212.198","TCP","66","37418 → 443 [ACK] Seq=1137 Ack=14165 Win=483 Len=0 TSval=3906619774 TSecr=1550616006"
"82","0.245159287","192.168.1.118","104.64.212.198","TCP","66","37420 → 443 [ACK] Seq=887 Ack=23597 Win=455 Len=0 TSval=3906619774 TSecr=1550615995"
"83","0.246193737","192.168.1.118","104.64.212.198","TLSv1.2","293","Application Data"
"84","0.246327387","192.168.1.118","104.64.212.198","TLSv1.2","317","Application Data"
"85","0.246421925","192.168.1.118","104.64.212.198","TLSv1.2","340","Application Data"
"86","0.249923887","104.64.212.198","192.168.1.118","TCP","1514","443 → 37420 [ACK] Seq=23597 Ack=887 Win=243 Len=1448 TSval=1550616004 TSecr=3906619690 [TCP segment of a reassembled PDU]"
"87","0.254009337","104.64.212.198","192.168.1.118","TCP","1514","443 → 37420 [ACK] Seq=25045 Ack=887 Win=243 Len=1448 TSval=1550616004 TSecr=3906619690 [TCP segment of a reassembled PDU]"
"88","0.254073175","192.168.1.118","104.64.212.198","TCP","66","37420 → 443 [ACK] Seq=887 Ack=26493 Win=477 Len=0 TSval=3906619783 TSecr=1550616004"
"89","0.263885112","104.64.212.198","192.168.1.118","TLSv1.2","612","Application Data"
"90","0.271286887","104.64.212.198","192.168.1.118","TCP","1514","443 → 37420 [ACK] Seq=26493 Ack=887 Win=243 Len=1448 TSval=1550616040 TSecr=3906619774 [TCP segment of a reassembled PDU]"
"91","0.272979375","104.64.212.198","192.168.1.118","TCP","1514","443 → 37420 [ACK] Seq=27941 Ack=887 Win=243 Len=1448 TSval=1550616040 TSecr=3906619774 [TCP segment of a reassembled PDU]"
"92","0.273019850","104.64.212.198","192.168.1.118","TCP","2962","[TCP segment of a reassembled PDU]"
"93","0.275470450","104.64.212.198","192.168.1.118","TLSv1.2","4628","Application Data"
"94","0.275530062","104.64.212.198","192.168.1.118","TCP","1514","443 → 37420 [ACK] Seq=29389 Ack=887 Win=243 Len=1448 TSval=1550616040 TSecr=3906619774 [TCP segment of a reassembled PDU]"
"95","0.275621262","104.64.212.198","192.168.1.118","TCP","1514","443 → 37420 [ACK] Seq=30837 Ack=887 Win=243 Len=1448 TSval=1550616040 TSecr=3906619774 [TCP segment of a reassembled PDU]"
"96","0.281218575","104.64.212.198","192.168.1.118","TCP","2962","443 → 37422 [ACK] Seq=9791 Ack=1125 Win=252 Len=2896 TSval=1550616042 TSecr=3906619776 [TCP segment of a reassembled PDU]"
"97","0.282660212","104.64.212.198","192.168.1.118","TCP","1514","443 → 37420 [ACK] Seq=32285 Ack=887 Win=243 Len=1448 TSval=1550616040 TSecr=3906619774 [TCP segment of a reassembled PDU]"
"98","0.284708050","104.64.212.198","192.168.1.118","TCP","1514","443 → 37420 [ACK] Seq=33733 Ack=887 Win=243 Len=1448 TSval=1550616040 TSecr=3906619774 [TCP segment of a reassembled PDU]"
"99","0.284756362","104.64.212.198","192.168.1.118","TCP","2962","443 → 37422 [ACK] Seq=12687 Ack=1125 Win=252 Len=2896 TSval=1550616042 TSecr=3906619776 [TCP segment of a reassembled PDU]"
"100","0.289004625","192.168.1.118","104.64.212.198","TCP","66","37420 → 443 [ACK] Seq=887 Ack=35181 Win=501 Len=0 TSval=3906619818 TSecr=1550616040"
"101","0.289309325","192.168.1.118","104.64.212.198","TCP","66","37418 → 443 [ACK] Seq=1364 Ack=18727 Win=466 Len=0 TSval=3906619819 TSecr=1550616044"
"102","0.289465325","192.168.1.118","104.64.212.198","TCP","66","37422 → 443 [ACK] Seq=1125 Ack=15583 Win=434 Len=0 TSval=3906619819 TSecr=1550616042"
"103","0.292593512","104.64.212.198","192.168.1.118","TLSv1.2","1514","Application Data [TCP segment of a reassembled PDU]"
"104","0.295003225","104.64.212.198","192.168.1.118","TLSv1.2","1514","Application Data [TCP segment of a reassembled PDU]"
"105","0.295069700","192.168.1.118","104.64.212.198","TCP","66","37420 → 443 [ACK] Seq=887 Ack=38077 Win=546 Len=0 TSval=3906619824 TSecr=1550616045"
"106","0.295101937","104.64.212.198","192.168.1.118","TCP","2962","443 → 37422 [ACK] Seq=15583 Ack=1125 Win=252 Len=2896 TSval=1550616046 TSecr=3906619776 [TCP segment of a reassembled PDU]"
"107","0.295119000","192.168.1.118","104.64.212.198","TCP","66","37422 → 443 [ACK] Seq=1125 Ack=18479 Win=477 Len=0 TSval=3906619824 TSecr=1550616046"
"108","0.299130150","104.64.212.198","192.168.1.118","TCP","1514","443 → 37420 [ACK] Seq=38077 Ack=887 Win=243 Len=1448 TSval=1550616054 TSecr=3906619783 [TCP segment of a reassembled PDU]"
"109","0.301413950","104.64.212.198","192.168.1.118","TLSv1.2","813","Application Data"
"110","0.301489537","104.64.212.198","192.168.1.118","TCP","1514","443 → 37420 [ACK] Seq=39525 Ack=887 Win=243 Len=1448 TSval=1550616054 TSecr=3906619783 [TCP segment of a reassembled PDU]"
"111","0.301523625","192.168.1.118","104.64.212.198","TCP","66","37420 → 443 [ACK] Seq=887 Ack=40973 Win=592 Len=0 TSval=3906619831 TSecr=1550616054"
"112","0.301563037","104.64.212.198","192.168.1.118","TCP","1514","443 → 37422 [ACK] Seq=18479 Ack=1125 Win=252 Len=1448 TSval=1550616055 TSecr=3906619776 [TCP segment of a reassembled PDU]"
"113","0.304638425","192.168.1.118","104.64.212.198","TCP","66","37416 → 443 [ACK] Seq=1155 Ack=6496 Win=501 Len=0 TSval=3906619834 TSecr=1550616026"
"114","0.305374587","136.147.56.129","192.168.1.118","TCP","66","443 → 46088 [ACK] Seq=1094 Ack=368 Win=4964 Len=0 TSval=710582712 TSecr=155286545"
"115","0.305415025","104.64.212.198","192.168.1.118","TCP","1514","443 → 37422 [ACK] Seq=19927 Ack=1125 Win=252 Len=1448 TSval=1550616055 TSecr=3906619776 [TCP segment of a reassembled PDU]"
"116","0.305441025","192.168.1.118","104.64.212.198","TCP","66","37422 → 443 [ACK] Seq=1125 Ack=21375 Win=477 Len=0 TSval=3906619835 TSecr=1550616055"
"117","0.308231287","192.168.1.118","209.18.47.62","DNS","80","Standard query 0x8eba A fonts.googleapis.com"
"118","0.309037787","104.64.212.198","192.168.1.118","TCP","2962","443 → 37420 [ACK] Seq=40973 Ack=887 Win=243 Len=2896 TSval=1550616061 TSecr=3906619783 [TCP segment of a reassembled PDU]"
"119","0.309102650","192.168.1.118","104.64.212.198","TCP","66","37420 → 443 [ACK] Seq=887 Ack=43869 Win=637 Len=0 TSval=3906619838 TSecr=1550616061"
"120","0.317212087","104.64.212.198","192.168.1.118","TLSv1.2","2962","Application Data [TCP segment of a reassembled PDU]"
"121","0.317274287","192.168.1.118","104.64.212.198","TCP","66","37422 → 443 [ACK] Seq=1125 Ack=24271 Win=477 Len=0 TSval=3906619847 TSecr=1550616063"
"122","0.320092575","104.64.212.198","192.168.1.118","TCP","2962","443 → 37420 [ACK] Seq=43869 Ack=887 Win=243 Len=2896 TSval=1550616068 TSecr=3906619783 [TCP segment of a reassembled PDU]"
"123","0.320161000","192.168.1.118","104.64.212.198","TCP","66","37420 → 443 [ACK] Seq=887 Ack=46765 Win=682 Len=0 TSval=3906619849 TSecr=1550616068"
"124","0.320199337","104.64.212.198","192.168.1.118","TCP","2962","443 → 37422 [ACK] Seq=24271 Ack=1125 Win=252 Len=2896 TSval=1550616071 TSecr=3906619776 [TCP segment of a reassembled PDU]"
"125","0.323247250","104.64.212.198","192.168.1.118","TCP","2962","443 → 37420 [ACK] Seq=46765 Ack=887 Win=243 Len=2896 TSval=1550616075 TSecr=3906619783 [TCP segment of a reassembled PDU]"
"126","0.323311975","192.168.1.118","104.64.212.198","TCP","66","37420 → 443 [ACK] Seq=887 Ack=49661 Win=727 Len=0 TSval=3906619853 TSecr=1550616075"
"127","0.324843112","104.64.212.198","192.168.1.118","TCP","1514","443 → 37422 [ACK] Seq=27167 Ack=1125 Win=252 Len=1448 TSval=1550616080 TSecr=3906619776 [TCP segment of a reassembled PDU]"
"128","0.327964950","104.64.212.198","192.168.1.118","TCP","1514","443 → 37422 [ACK] Seq=28615 Ack=1125 Win=252 Len=1448 TSval=1550616080 TSecr=3906619776 [TCP segment of a reassembled PDU]"
"129","0.328012050","104.64.212.198","192.168.1.118","TCP","1514","443 → 37420 [ACK] Seq=49661 Ack=887 Win=243 Len=1448 TSval=1550616090 TSecr=3906619783 [TCP segment of a reassembled PDU]"
"130","0.329145900","104.64.212.198","192.168.1.118","TCP","1514","443 → 37420 [ACK] Seq=51109 Ack=887 Win=243 Len=1448 TSval=1550616090 TSecr=3906619783 [TCP segment of a reassembled PDU]"
"131","0.329203412","192.168.1.118","104.64.212.198","TCP","66","37420 → 443 [ACK] Seq=887 Ack=52557 Win=773 Len=0 TSval=3906619858 TSecr=1550616090"
"132","0.341631525","192.168.1.118","104.64.212.198","TCP","66","37414 → 443 [ACK] Seq=640 Ack=10155 Win=501 Len=0 TSval=3906619871 TSecr=1550616070"
"133","0.342614187","fe80::1814:2ecf:2c8a:d90d","ff02::fb","MDNS","553","Standard query 0x0000 PTR _googlecast._tcp.local, "QM" question PTR _homekit._tcp.local, "QM" question PTR _uscan._tcp.local, "QM" question PTR _ptp._tcp.local, "QM" question PTR _ippusb._tcp.local, "QM" question PTR _scanner._tcp.local, "QM" question PTR _ipp._tcp.local, "QM" question PTR _pdl-datastream._tcp.local, "QM" question PTR _uscans._tcp.local, "QM" question PTR _ipps._tcp.local, "QM" question PTR _printer._tcp.local, "QM" question PTR _airplay._tcp.local, "QM" question PTR _raop._tcp.local, "QM" question PTR _airport._tcp.local, "QM" question PTR _rdlink._tcp.local, "QM" question PTR _companion-link._tcp.local, "QM" question PTR _afpovertcp._tcp.local, "QM" question PTR _rfb._tcp.local, "QM" question PTR _adisk._tcp.local, "QM" question PTR _apple-mobdev._tcp.local, "QM" question PTR 8ed307c3._sub._apple-mobdev2._tcp.local, "QM" question PTR _apple-pairable._tcp.local, "QM" question PTR Google-Home-Mini-2c3f16b2da5c4b6fd6cfbfba61c12490._googlecast._tcp.local PTR cjqg._companion-link._tcp.local OPT"
"134","0.347875975","fe80::1cc7:6d9a:a312:7e8f","ff02::fb","MDNS","547","Standard query 0x0000 PTR _googlecast._tcp.local, "QM" question PTR _homekit._tcp.local, "QM" question PTR _uscan._tcp.local, "QM" question PTR _ptp._tcp.local, "QM" question PTR _ippusb._tcp.local, "QM" question PTR _scanner._tcp.local, "QM" question PTR _ipp._tcp.local, "QM" question PTR _pdl-datastream._tcp.local, "QM" question PTR _uscans._tcp.local, "QM" question PTR _ipps._tcp.local, "QM" question PTR _printer._tcp.local, "QM" question PTR _airplay._tcp.local, "QM" question PTR _raop._tcp.local, "QM" question PTR _airport._tcp.local, "QM" question PTR _rdlink._tcp.local, "QM" question PTR _companion-link._tcp.local, "QM" question PTR _afpovertcp._tcp.local, "QM" question PTR _rfb._tcp.local, "QM" question PTR _adisk._tcp.local, "QM" question PTR _apple-mobdev._tcp.local, "QM" question PTR 8ed307c3._sub._apple-mobdev2._tcp.local, "QM" question PTR _apple-pairable._tcp.local, "QM" question PTR Google-Home-Mini-2c3f16b2da5c4b6fd6cfbfba61c12490._googlecast._tcp.local PTR cjqg._companion-link._tcp.local OPT"
"135","0.354979875","104.64.212.198","192.168.1.118","TCP","1514","443 → 37420 [ACK] Seq=52557 Ack=887 Win=243 Len=1448 TSval=1550616090 TSecr=3906619783 [TCP segment of a reassembled PDU]"
"136","0.360056225","209.18.47.62","192.168.1.118","DNS","96","Standard query response 0x8eba A fonts.googleapis.com A 172.217.10.42"
"137","0.360131062","104.64.212.198","192.168.1.118","TLSv1.2","1514","Application Data [TCP segment of a reassembled PDU]"
"138","0.360180175","192.168.1.118","104.64.212.198","TCP","66","37420 → 443 [ACK] Seq=887 Ack=55453 Win=818 Len=0 TSval=3906619889 TSecr=1550616090"
"139","0.360221537","104.64.212.198","192.168.1.118","TLSv1.2","2962","Application Data [TCP segment of a reassembled PDU]"
"140","0.360240875","192.168.1.118","209.18.47.62","DNS","80","Standard query 0xb27a AAAA fonts.googleapis.com"
"141","0.360284237","192.168.1.118","104.64.212.198","TCP","66","37422 → 443 [ACK] Seq=1125 Ack=32959 Win=410 Len=0 TSval=3906619890 TSecr=1550616071"
"142","0.360296150","104.64.212.198","192.168.1.118","TCP","1514","443 → 37420 [ACK] Seq=55453 Ack=887 Win=243 Len=1448 TSval=1550616097 TSecr=3906619831 [TCP segment of a reassembled PDU]"
"143","0.361741250","104.64.212.198","192.168.1.118","TCP","2962","443 → 37420 [ACK] Seq=56901 Ack=887 Win=243 Len=2896 TSval=1550616097 TSecr=3906619831 [TCP segment of a reassembled PDU]"
"144","0.361811475","192.168.1.118","104.64.212.198","TCP","66","37420 → 443 [ACK] Seq=887 Ack=59797 Win=886 Len=0 TSval=3906619891 TSecr=1550616097"
"145","0.361841762","104.64.212.198","192.168.1.118","TCP","1514","443 → 37422 [ACK] Seq=32959 Ack=1125 Win=252 Len=1448 TSval=1550616098 TSecr=3906619824 [TCP segment of a reassembled PDU]"
"146","0.362750212","104.64.212.198","192.168.1.118","TLSv1.2","990","Application Data"
"147","0.362799862","104.64.212.198","192.168.1.118","TCP","2962","443 → 37420 [ACK] Seq=59797 Ack=887 Win=243 Len=2896 TSval=1550616102 TSecr=3906619838 [TCP segment of a reassembled PDU]"
"148","0.362828550","192.168.1.118","104.64.212.198","TCP","66","37420 → 443 [ACK] Seq=887 Ack=62693 Win=931 Len=0 TSval=3906619892 TSecr=1550616102"
"149","0.362865912","104.64.212.198","192.168.1.118","TCP","2962","443 → 37420 [ACK] Seq=62693 Ack=887 Win=243 Len=2896 TSval=1550616106 TSecr=3906619838 [TCP segment of a reassembled PDU]"
"150","0.362880775","192.168.1.118","104.64.212.198","TCP","66","37420 → 443 [ACK] Seq=887 Ack=65589 Win=976 Len=0 TSval=3906619892 TSecr=1550616106"
"151","0.362902562","104.64.212.198","192.168.1.118","TLSv1.2","2962","Application Data [TCP segment of a reassembled PDU]"
"152","0.362919000","192.168.1.118","104.64.212.198","TCP","66","37420 → 443 [ACK] Seq=887 Ack=68485 Win=1022 Len=0 TSval=3906619892 TSecr=1550616111"
"153","0.362930350","104.64.212.198","192.168.1.118","TCP","1514","443 → 37420 [ACK] Seq=68485 Ack=887 Win=243 Len=1448 TSval=1550616115 TSecr=3906619853 [TCP segment of a reassembled PDU]"
"154","0.366134000","104.64.212.198","192.168.1.118","TCP","1514","443 → 37420 [ACK] Seq=69933 Ack=887 Win=243 Len=1448 TSval=1550616115 TSecr=3906619853 [TCP segment of a reassembled PDU]"
"155","0.366206237","192.168.1.118","104.64.212.198","TCP","66","37420 → 443 [ACK] Seq=887 Ack=71381 Win=1067 Len=0 TSval=3906619895 TSecr=1550616115"
"156","0.366254475","104.64.212.198","192.168.1.118","TCP","2962","443 → 37420 [ACK] Seq=71381 Ack=887 Win=243 Len=2896 TSval=1550616117 TSecr=3906619853 [TCP segment of a reassembled PDU]"
"157","0.366271512","192.168.1.118","104.64.212.198","TCP","66","37420 → 443 [ACK] Seq=887 Ack=74277 Win=1112 Len=0 TSval=3906619896 TSecr=1550616117"
"158","0.366281512","104.64.212.198","192.168.1.118","TCP","1514","443 → 37420 [ACK] Seq=74277 Ack=887 Win=243 Len=1448 TSval=1550616119 TSecr=3906619853 [TCP segment of a reassembled PDU]"
"159","0.367800875","104.64.212.198","192.168.1.118","TCP","1514","443 → 37420 [ACK] Seq=75725 Ack=887 Win=243 Len=1448 TSval=1550616119 TSecr=3906619853 [TCP segment of a reassembled PDU]"
"160","0.367863500","192.168.1.118","104.64.212.198","TCP","66","37420 → 443 [ACK] Seq=887 Ack=77173 Win=1157 Len=0 TSval=3906619897 TSecr=1550616119"
"161","0.367915037","104.64.212.198","192.168.1.118","TCP","2962","443 → 37420 [ACK] Seq=77173 Ack=887 Win=243 Len=2896 TSval=1550616121 TSecr=3906619853 [TCP segment of a reassembled PDU]"
"162","0.367934512","192.168.1.118","104.64.212.198","TCP","66","37420 → 443 [ACK] Seq=887 Ack=80069 Win=1203 Len=0 TSval=3906619897 TSecr=1550616121"
"163","0.368599662","104.64.212.198","192.168.1.118","TCP","1514","443 → 37420 [ACK] Seq=80069 Ack=887 Win=243 Len=1448 TSval=1550616121 TSecr=3906619853 [TCP segment of a reassembled PDU]"
"164","0.368638475","104.64.212.198","192.168.1.118","TLSv1.2","2962","Application Data [TCP segment of a reassembled PDU]"
"165","0.368662825","192.168.1.118","104.64.212.198","TCP","66","37420 → 443 [ACK] Seq=887 Ack=84413 Win=1270 Len=0 TSval=3906619898 TSecr=1550616121"
"166","0.368694737","104.64.212.198","192.168.1.118","TCP","2962","443 → 37420 [ACK] Seq=84413 Ack=887 Win=243 Len=2896 TSval=1550616126 TSecr=3906619853 [TCP segment of a reassembled PDU]"
"167","0.368712500","192.168.1.118","104.64.212.198","TCP","66","37420 → 443 [ACK] Seq=887 Ack=87309 Win=1316 Len=0 TSval=3906619898 TSecr=1550616126"
"168","0.368730762","104.64.212.198","192.168.1.118","TCP","2962","443 → 37420 [ACK] Seq=87309 Ack=887 Win=243 Len=2896 TSval=1550616128 TSecr=3906619853 [TCP segment of a reassembled PDU]"
"169","0.368745687","192.168.1.118","104.64.212.198","TCP","66","37420 → 443 [ACK] Seq=887 Ack=90205 Win=1361 Len=0 TSval=3906619898 TSecr=1550616128"
"170","0.379671587","104.64.212.198","192.168.1.118","TCP","1514","443 → 37420 [ACK] Seq=90205 Ack=887 Win=243 Len=1448 TSval=1550616151 TSecr=3906619858 [TCP segment of a reassembled PDU]"
"171","0.381144062","104.64.212.198","192.168.1.118","TCP","2962","443 → 37420 [ACK] Seq=91653 Ack=887 Win=243 Len=2896 TSval=1550616151 TSecr=3906619858 [TCP segment of a reassembled PDU]"
"172","0.381208525","192.168.1.118","104.64.212.198","TCP","66","37420 → 443 [ACK] Seq=887 Ack=94549 Win=1429 Len=0 TSval=3906619910 TSecr=1550616151"
"173","0.382785925","104.64.212.198","192.168.1.118","TCP","1514","443 → 37420 [ACK] Seq=94549 Ack=887 Win=243 Len=1448 TSval=1550616151 TSecr=3906619858 [TCP segment of a reassembled PDU]"
"174","0.392660375","104.64.212.198","192.168.1.118","TCP","1514","443 → 37420 [ACK] Seq=95997 Ack=887 Win=243 Len=1448 TSval=1550616164 TSecr=3906619898 [TCP segment of a reassembled PDU]"
"175","0.392729225","192.168.1.118","104.64.212.198","TCP","66","37420 → 443 [ACK] Seq=887 Ack=97445 Win=1474 Len=0 TSval=3906619922 TSecr=1550616151"
"176","0.394427000","104.64.212.198","192.168.1.118","TLSv1.2","4410","Application Data [TCP segment of a reassembled PDU]"
"177","0.394492537","192.168.1.118","104.64.212.198","TCP","66","37420 → 443 [ACK] Seq=887 Ack=101789 Win=1542 Len=0 TSval=3906619924 TSecr=1550616164"
"178","0.396528362","104.64.212.198","192.168.1.118","TCP","2962","443 → 37420 [ACK] Seq=101789 Ack=887 Win=243 Len=2896 TSval=1550616164 TSecr=3906619898 [TCP segment of a reassembled PDU]"
"179","0.396611712","192.168.1.118","104.64.212.198","TCP","66","37420 → 443 [ACK] Seq=887 Ack=104685 Win=1587 Len=0 TSval=3906619926 TSecr=1550616164"
"180","0.400491675","104.64.212.198","192.168.1.118","TLSv1.2","5858","Application Data [TCP segment of a reassembled PDU]"
"181","0.400614162","104.64.212.198","192.168.1.118","TCP","2962","443 → 37420 [ACK] Seq=110477 Ack=887 Win=243 Len=2896 TSval=1550616166 TSecr=3906619898 [TCP segment of a reassembled PDU]"
"182","0.402636812","192.168.1.118","104.64.212.198","TCP","66","37422 → 443 [ACK] Seq=1125 Ack=35331 Win=392 Len=0 TSval=3906619932 TSecr=1550616098"
"183","0.403078700","104.64.212.198","192.168.1.118","TCP","2962","443 → 37420 [ACK] Seq=113373 Ack=887 Win=243 Len=2896 TSval=1550616167 TSecr=3906619898 [TCP segment of a reassembled PDU]"
"184","0.403650387","192.168.1.118","104.64.212.198","TCP","66","37420 → 443 [ACK] Seq=887 Ack=116269 Win=1497 Len=0 TSval=3906619933 TSecr=1550616165"
"185","0.404731350","104.64.212.198","192.168.1.118","TCP","2962","443 → 37420 [ACK] Seq=116269 Ack=887 Win=243 Len=2896 TSval=1550616168 TSecr=3906619898 [TCP segment of a reassembled PDU]"
"186","0.404794162","192.168.1.118","104.64.212.198","TCP","66","37420 → 443 [ACK] Seq=887 Ack=119165 Win=1632 Len=0 TSval=3906619934 TSecr=1550616168"
"187","0.404827562","104.64.212.198","192.168.1.118","TCP","1514","443 → 37420 [ACK] Seq=119165 Ack=887 Win=243 Len=1448 TSval=1550616169 TSecr=3906619898 [TCP segment of a reassembled PDU]"
"188","0.405303550","104.64.212.198","192.168.1.118","TCP","1514","443 → 37420 [ACK] Seq=120613 Ack=887 Win=243 Len=1448 TSval=1550616169 TSecr=3906619898 [TCP segment of a reassembled PDU]"
"189","0.405328912","192.168.1.118","104.64.212.198","TCP","66","37420 → 443 [ACK] Seq=887 Ack=122061 Win=1678 Len=0 TSval=3906619935 TSecr=1550616169"
"190","0.405367337","104.64.212.198","192.168.1.118","TLSv1.2","5858","Application Data [TCP segment of a reassembled PDU]"
"191","0.407483625","192.168.1.118","104.64.212.198","TCP","66","37420 → 443 [ACK] Seq=887 Ack=127853 Win=1633 Len=0 TSval=3906619937 TSecr=1550616170"
"192","0.407643287","136.147.56.129","192.168.1.118","TLSv1.2","1313","Application Data"
"193","0.407705837","104.64.212.198","192.168.1.118","TCP","2962","443 → 37420 [ACK] Seq=127853 Ack=887 Win=243 Len=2896 TSval=1550616171 TSecr=3906619898 [TCP segment of a reassembled PDU]"
"194","0.409313075","104.64.212.198","192.168.1.118","TLSv1.2","1514","Application Data [TCP segment of a reassembled PDU]"
"195","0.410086125","209.18.47.62","192.168.1.118","DNS","108","Standard query response 0xb27a AAAA fonts.googleapis.com AAAA 2607:f8b0:4006:803::200a"
"196","0.410121675","104.64.212.198","192.168.1.118","TCP","1514","443 → 37420 [ACK] Seq=132197 Ack=887 Win=243 Len=1448 TSval=1550616172 TSecr=3906619898 [TCP segment of a reassembled PDU]"
"197","0.410152225","104.64.212.198","192.168.1.118","TCP","2962","443 → 37420 [ACK] Seq=133645 Ack=887 Win=243 Len=2896 TSval=1550616173 TSecr=3906619898 [TCP segment of a reassembled PDU]"
"198","0.410174100","104.64.212.198","192.168.1.118","TCP","2962","443 → 37420 [ACK] Seq=136541 Ack=887 Win=243 Len=2896 TSval=1550616174 TSecr=3906619898 [TCP segment of a reassembled PDU]"
"199","0.410192550","104.64.212.198","192.168.1.118","TCP","2962","443 → 37420 [ACK] Seq=139437 Ack=887 Win=243 Len=2896 TSval=1550616175 TSecr=3906619924 [TCP segment of a reassembled PDU]"
"200","0.411676425","192.168.1.118","172.217.10.42","TCP","74","46478 → 443 [SYN] Seq=0 Win=64240 Len=0 MSS=1460 SACK_PERM=1 TSval=2731993954 TSecr=0 WS=128"
"201","0.412220725","192.168.1.118","104.64.212.198","TCP","66","37420 → 443 [ACK] Seq=887 Ack=142333 Win=1520 Len=0 TSval=3906619942 TSecr=1550616171"
"202","0.412470175","104.64.212.198","192.168.1.118","TCP","2962","443 → 37420 [ACK] Seq=142333 Ack=887 Win=243 Len=2896 TSval=1550616176 TSecr=3906619924 [TCP segment of a reassembled PDU]"
"203","0.412534962","192.168.1.118","104.64.212.198","TCP","66","37420 → 443 [ACK] Seq=887 Ack=145229 Win=1712 Len=0 TSval=3906619942 TSecr=1550616176"
"204","0.412586475","104.64.212.198","192.168.1.118","TCP","1514","443 → 37420 [ACK] Seq=145229 Ack=887 Win=243 Len=1448 TSval=1550616177 TSecr=3906619924 [TCP segment of a reassembled PDU]"
"205","0.413104387","104.64.212.198","192.168.1.118","TCP","1514","443 → 37420 [ACK] Seq=146677 Ack=887 Win=243 Len=1448 TSval=1550616177 TSecr=3906619924 [TCP segment of a reassembled PDU]"
"206","0.413126150","104.64.212.198","192.168.1.118","TLSv1.2","2090","Application Data, Application Data"
"207","0.434669762","172.217.10.42","192.168.1.118","TCP","74","443 → 46478 [SYN, ACK] Seq=0 Ack=1 Win=60192 Len=0 MSS=1380 SACK_PERM=1 TSval=299772269 TSecr=2731993954 WS=256"
"208","0.434770537","192.168.1.118","172.217.10.42","TCP","66","46478 → 443 [ACK] Seq=1 Ack=1 Win=64256 Len=0 TSval=2731993977 TSecr=299772269"
"209","0.448633400","192.168.1.118","136.147.56.129","TCP","66","46088 → 443 [ACK] Seq=368 Ack=2341 Win=63356 Len=0 TSval=155286785 TSecr=710582813"
"210","0.453630050","192.168.1.118","104.64.212.198","TCP","66","37420 → 443 [ACK] Seq=887 Ack=150149 Win=1674 Len=0 TSval=3906619983 TSecr=1550616177"
"211","0.493922750","104.64.212.198","192.168.1.118","TCP","1514","[TCP Spurious Retransmission] 443 → 37420 [ACK] Seq=145229 Ack=887 Win=243 Len=1448 TSval=1550616257 TSecr=3906619942[Reassembly error, protocol TCP: New fragment overlaps old data (retransmission?)]"
"212","0.493984787","192.168.1.118","104.64.212.198","TCP","78","[TCP Dup ACK 210#1] 37420 → 443 [ACK] Seq=887 Ack=150149 Win=1674 Len=0 TSval=3906620023 TSecr=1550616177 SLE=145229 SRE=146677"
"213","0.822216787","192.168.1.118","172.217.10.42","TLSv1","583","Client Hello"
"214","0.847349225","192.168.1.104","255.255.255.255","UDP","217","49154 → 6666 Len=175"
"215","0.875960762","172.217.10.42","192.168.1.118","TCP","66","443 → 46478 [ACK] Seq=1 Ack=518 Win=61440 Len=0 TSval=299772712 TSecr=2731994364"
"216","0.883543262","172.217.10.42","192.168.1.118","TLSv1.2","1484","Server Hello"
"217","0.883631537","192.168.1.118","172.217.10.42","TCP","66","46478 → 443 [ACK] Seq=518 Ack=1419 Win=63104 Len=0 TSval=2731994426 TSecr=299772720"
"218","0.887230275","172.217.10.42","192.168.1.118","TLSv1.2","1541","Certificate, Server Key Exchange, Server Hello Done"
"219","0.887295325","192.168.1.118","172.217.10.42","TCP","66","46478 → 443 [ACK] Seq=518 Ack=2894 Win=61696 Len=0 TSval=2731994430 TSecr=299772720"
"220","0.935079650","192.168.1.118","172.217.10.42","TLSv1.2","192","Client Key Exchange, Change Cipher Spec, Encrypted Handshake Message"
"221","0.953377787","172.217.10.42","192.168.1.118","TLSv1.2","117","Change Cipher Spec, Encrypted Handshake Message"
"222","0.953457637","192.168.1.118","172.217.10.42","TCP","66","46478 → 443 [ACK] Seq=644 Ack=2945 Win=64128 Len=0 TSval=2731994496 TSecr=299772790"
"223","1.098538637","192.168.1.118","172.217.10.42","TLSv1.2","338","Application Data"
"224","1.120256575","172.217.10.42","192.168.1.118","TCP","66","443 → 46478 [ACK] Seq=2945 Ack=916 Win=62464 Len=0 TSval=299772957 TSecr=2731994641"
"225","1.134330150","172.217.10.42","192.168.1.118","TLSv1.2","1179","Application Data"
"226","1.134395562","192.168.1.118","172.217.10.42","TCP","66","46478 → 443 [ACK] Seq=916 Ack=4058 Win=63104 Len=0 TSval=2731994677 TSecr=299772968"
"227","1.135694737","172.217.10.42","192.168.1.118","TLSv1.2","175","Application Data"
"228","1.135763325","192.168.1.118","172.217.10.42","TCP","66","46478 → 443 [ACK] Seq=916 Ack=4167 Win=63104 Len=0 TSval=2731994678 TSecr=299772968"
"229","1.135803375","172.217.10.42","192.168.1.118","TLSv1.2","100","Application Data"
"230","1.135817812","192.168.1.118","172.217.10.42","TCP","66","46478 → 443 [ACK] Seq=916 Ack=4201 Win=63104 Len=0 TSval=2731994678 TSecr=299772968"
"231","1.184522400","192.168.1.118","209.18.47.62","DNS","82","Standard query 0xda7e A secure2.sfdcstatic.com"
"232","1.226019837","209.18.47.62","192.168.1.118","DNS","179","Standard query response 0xda7e A secure2.sfdcstatic.com CNAME secure2.sfdcstatic.com.edgekey.net CNAME e4745.b.akamaiedge.net A 104.64.212.198"
"233","1.226907662","192.168.1.118","209.18.47.62","DNS","82","Standard query 0x42fc AAAA secure2.sfdcstatic.com"
"234","1.281188000","209.18.47.62","192.168.1.118","DNS","221","Standard query response 0x42fc AAAA secure2.sfdcstatic.com CNAME secure2.sfdcstatic.com.edgekey.net CNAME e4745.b.akamaiedge.net SOA n0b.akamaiedge.net"
"235","1.290133512","192.168.1.118","104.64.212.198","TCP","74","37426 → 443 [SYN] Seq=0 Win=64240 Len=0 MSS=1460 SACK_PERM=1 TSval=3906620819 TSecr=0 WS=128"
"236","1.315528537","104.64.212.198","192.168.1.118","TCP","74","443 → 37426 [SYN, ACK] Seq=0 Ack=1 Win=28960 Len=0 MSS=1460 SACK_PERM=1 TSval=1550617085 TSecr=3906620819 WS=128"
"237","1.315646212","192.168.1.118","104.64.212.198","TCP","66","37426 → 443 [ACK] Seq=1 Ack=1 Win=64256 Len=0 TSval=3906620845 TSecr=1550617085"
"238","1.352807037","192.168.1.118","104.64.212.198","TLSv1","583","Client Hello"
"239","1.371052600","104.64.212.198","192.168.1.118","TCP","66","443 → 37426 [ACK] Seq=1 Ack=518 Win=30080 Len=0 TSval=1550617143 TSecr=3906620882"
"240","1.374543012","104.64.212.198","192.168.1.118","TLSv1.2","1514","Server Hello"
"241","1.374632100","192.168.1.118","104.64.212.198","TCP","66","37426 → 443 [ACK] Seq=518 Ack=1449 Win=63104 Len=0 TSval=3906620904 TSecr=1550617145"
"242","1.376312287","104.64.212.198","192.168.1.118","TLSv1.2","1891","Certificate, Server Key Exchange, Server Hello Done"
"243","1.376386375","192.168.1.118","104.64.212.198","TCP","66","37426 → 443 [ACK] Seq=518 Ack=3274 Win=61312 Len=0 TSval=3906620906 TSecr=1550617145"
"244","1.379157475","192.168.1.118","104.64.212.198","TLSv1.2","192","Client Key Exchange, Change Cipher Spec, Encrypted Handshake Message"
"245","1.379369950","192.168.1.118","136.147.56.129","TLSv1.2","385","Application Data"
"246","1.395331812","192.168.1.118","104.64.212.198","TLSv1.2","313","Application Data"
"247","1.405868712","104.64.212.198","192.168.1.118","TLSv1.2","117","Change Cipher Spec, Encrypted Handshake Message"
"248","1.408181575","104.64.212.198","192.168.1.118","TLSv1.2","1043","Application Data"
"249","1.408259575","192.168.1.118","104.64.212.198","TCP","66","37416 → 443 [ACK] Seq=1402 Ack=7473 Win=494 Len=0 TSval=3906620938 TSecr=1550617180"
"250","1.411117925","192.168.1.118","104.64.212.198","TLSv1.2","305","Application Data"
"251","1.416660250","192.168.1.118","104.64.212.198","TLSv1.2","315","Application Data"
"252","1.434793912","192.168.1.118","104.64.212.198","TLSv1.2","317","Application Data"
"253","1.442332387","104.64.212.198","192.168.1.118","TLSv1.2","414","Application Data"
"254","1.443466137","104.64.212.198","192.168.1.118","TLSv1.2","1093","Application Data"
"255","1.449737700","136.147.56.129","192.168.1.118","TCP","66","443 → 46086 [ACK] Seq=1 Ack=320 Win=5245 Len=0 TSval=710583859 TSecr=155287716"
"256","1.453930525","192.168.1.118","209.18.47.62","DNS","76","Standard query 0xfa9d A a.sfdcstatic.com"
"257","1.455023962","192.168.1.118","104.64.212.198","TLSv1.2","316","Application Data"
"258","1.465586487","104.64.212.198","192.168.1.118","TLSv1.2","1062","Application Data"
"259","1.469459750","104.64.212.198","192.168.1.118","TLSv1.2","1123","Application Data"
"260","1.473030137","209.18.47.62","192.168.1.118","DNS","167","Standard query response 0xfa9d A a.sfdcstatic.com CNAME a.sfdcstatic.com.edgekey.net CNAME e4745.b.akamaiedge.net A 104.64.212.198"
"261","1.473216050","192.168.1.118","209.18.47.62","DNS","76","Standard query 0x763c AAAA a.sfdcstatic.com"
"262","1.482632687","192.168.1.118","104.64.212.198","TCP","66","37426 → 443 [ACK] Seq=883 Ack=3673 Win=64128 Len=0 TSval=3906621012 TSecr=1550617214"
"263","1.490960600","192.168.1.118","104.64.212.198","TLSv1.2","316","Application Data"
"264","1.497878862","209.18.47.62","192.168.1.118","DNS","209","Standard query response 0x763c AAAA a.sfdcstatic.com CNAME a.sfdcstatic.com.edgekey.net CNAME e4745.b.akamaiedge.net SOA n0b.akamaiedge.net"
"265","1.499803875","192.168.1.118","104.64.212.198","TCP","74","37428 → 443 [SYN] Seq=0 Win=64240 Len=0 MSS=1460 SACK_PERM=1 TSval=3906621029 TSecr=0 WS=128"
"266","1.509648225","192.168.1.118","104.64.212.198","TCP","66","37418 → 443 [ACK] Seq=1615 Ack=19784 Win=501 Len=0 TSval=3906621039 TSecr=1550617241"
"267","1.512527525","192.168.1.118","104.64.212.198","TLSv1.2","318","Application Data"
"268","1.521617350","104.64.212.198","192.168.1.118","TLSv1.2","904","Application Data"
"269","1.522350087","104.64.212.198","192.168.1.118","TCP","74","443 → 37428 [SYN, ACK] Seq=0 Ack=1 Win=28960 Len=0 MSS=1460 SACK_PERM=1 TSval=1550617292 TSecr=3906621029 WS=128"
"270","1.522425025","192.168.1.118","104.64.212.198","TCP","66","37428 → 443 [ACK] Seq=1 Ack=1 Win=64256 Len=0 TSval=3906621052 TSecr=1550617292"
"271","1.545011437","104.64.212.198","192.168.1.118","TLSv1.2","1038","Application Data"
"272","1.545086850","192.168.1.118","104.64.212.198","TCP","66","37418 → 443 [ACK] Seq=1867 Ack=20756 Win=494 Len=0 TSval=3906621074 TSecr=1550617314"
"273","1.552722075","136.147.56.129","192.168.1.118","TCP","1414","[TCP segment of a reassembled PDU]"
"274","1.552789687","192.168.1.118","136.147.56.129","TCP","66","46086 → 443 [ACK] Seq=320 Ack=1349 Win=64704 Len=0 TSval=155287889 TSecr=710583964"
"275","1.553674462","136.147.56.129","192.168.1.118","TLSv1.2","123","Application Data"
"276","1.553725512","192.168.1.118","136.147.56.129","TCP","66","46086 → 443 [ACK] Seq=320 Ack=1406 Win=64704 Len=0 TSval=155287890 TSecr=710583964"
"277","1.560233825","192.168.1.118","104.64.212.198","TLSv1","583","Client Hello"
"278","1.562634725","192.168.1.118","104.64.212.198","TCP","66","37416 → 443 [ACK] Seq=2151 Ack=10334 Win=501 Len=0 TSval=3906621092 TSecr=1550617293"
"279","1.581262225","104.64.212.198","192.168.1.118","TCP","66","443 → 37428 [ACK] Seq=1 Ack=518 Win=30080 Len=0 TSval=1550617353 TSecr=3906621089"
"280","1.584716800","104.64.212.198","192.168.1.118","TLSv1.2","1514","Server Hello"
"281","1.584786525","192.168.1.118","104.64.212.198","TCP","66","37428 → 443 [ACK] Seq=518 Ack=1449 Win=63104 Len=0 TSval=3906621114 TSecr=1550617355"
"282","1.586778912","104.64.212.198","192.168.1.118","TLSv1.2","1891","Certificate, Server Key Exchange, Server Hello Done"
"283","1.586839912","192.168.1.118","104.64.212.198","TCP","66","37428 → 443 [ACK] Seq=518 Ack=3274 Win=61312 Len=0 TSval=3906621116 TSecr=1550617355"
"284","1.596335925","192.168.1.118","104.64.212.198","TLSv1.2","192","Client Key Exchange, Change Cipher Spec, Encrypted Handshake Message"
"285","1.623345912","104.64.212.198","192.168.1.118","TLSv1.2","117","Change Cipher Spec, Encrypted Handshake Message"
"286","1.631756425","192.168.1.118","104.64.212.198","TLSv1.2","327","Application Data"
"287","1.646871475","104.64.212.198","192.168.1.118","TCP","1514","[TCP segment of a reassembled PDU]"
"288","1.647085312","192.168.1.118","104.64.212.198","TLSv1.2","316","Application Data"
"289","1.647264012","192.168.1.118","104.64.212.198","TLSv1.2","315","Application Data"
"290","1.650874650","104.64.212.198","192.168.1.118","TLSv1.2","4802","Application Data"
"291","1.658860162","192.168.1.118","104.64.212.198","TCP","66","37428 → 443 [ACK] Seq=905 Ack=9509 Win=64128 Len=0 TSval=3906621188 TSecr=1550617418"
"292","1.659215650","192.168.1.118","104.64.212.198","TLSv1.2","316","Application Data"
"293","1.659319450","192.168.1.118","104.64.212.198","TLSv1.2","315","Application Data"
"294","1.665405112","104.64.212.198","192.168.1.118","TLSv1.2","1100","Application Data"
"295","1.665482837","192.168.1.118","104.64.212.198","TCP","66","37418 → 443 [ACK] Seq=2116 Ack=21790 Win=493 Len=0 TSval=3906621195 TSecr=1550617437"
"296","1.687071837","104.64.212.198","192.168.1.118","TLSv1.2","1056","Application Data"
"297","1.687149275","192.168.1.118","104.64.212.198","TCP","66","37420 → 443 [ACK] Seq=1137 Ack=151139 Win=1734 Len=0 TSval=3906621216 TSecr=1550617457"
"298","1.691390612","104.64.212.198","192.168.1.118","TLSv1.2","1061","Application Data"
"299","1.691466725","192.168.1.118","104.64.212.198","TCP","66","37422 → 443 [ACK] Seq=1374 Ack=36326 Win=494 Len=0 TSval=3906621221 TSecr=1550617462"
"300","1.699279962","104.64.212.198","192.168.1.118","TLSv1.2","1017","Application Data"
"301","1.699357700","192.168.1.118","104.64.212.198","TCP","66","37416 → 443 [ACK] Seq=2401 Ack=11285 Win=494 Len=0 TSval=3906621229 TSecr=1550617469"
"302","2.645947662","192.168.1.118","192.168.1.102","TCP","176","35182 → 8009 [PSH, ACK] Seq=1 Ack=1 Win=501 Len=110 TSval=2820187445 TSecr=6062601 [TCP segment of a reassembled PDU]"
"303","2.654661812","192.168.1.102","192.168.1.118","TCP","176","8009 → 35182 [PSH, ACK] Seq=1 Ack=111 Win=277 Len=110 TSval=6063104 TSecr=2820187445 [TCP segment of a reassembled PDU]"
"304","2.654749750","192.168.1.118","192.168.1.102","TCP","66","35182 → 8009 [ACK] Seq=111 Ack=111 Win=501 Len=0 TSval=2820187454 TSecr=6063104"
"305","3.815906975","192.168.1.104","255.255.255.255","UDP","217","49154 → 6666 Len=175"
"306","5.665048425","192.168.1.118","172.217.10.227","TCP","66","38680 → 80 [FIN, ACK] Seq=1 Ack=1 Win=502 Len=0 TSval=556000410 TSecr=4270046600"
"307","5.680734137","172.217.10.227","192.168.1.118","TCP","66","80 → 38680 [FIN, ACK] Seq=1 Ack=2 Win=240 Len=0 TSval=4270056153 TSecr=556000410"
"308","5.680818287","192.168.1.118","172.217.10.227","TCP","66","38680 → 80 [ACK] Seq=2 Ack=2 Win=502 Len=0 TSval=556000426 TSecr=4270056153"
"309","5.857474425","192.168.1.118","239.255.255.250","SSDP","218","M-SEARCH * HTTP/1.1 "
"310","6.859065400","192.168.1.118","239.255.255.250","SSDP","218","M-SEARCH * HTTP/1.1 "
"311","6.894047612","192.168.1.104","255.255.255.255","UDP","217","49154 → 6666 Len=175"
"312","7.502009837","192.168.1.101","224.0.0.251","MDNS","181","Standard query 0x0000 ANY cjqg._smb._tcp.local, "QM" question ANY cjqg._companion-link._tcp.local, "QM" question SRV 0 0 445 cjqg.local SRV 0 0 53785 cjqg.local OPT"
"313","7.504667687","fe80::1814:2ecf:2c8a:d90d","ff02::fb","MDNS","201","Standard query 0x0000 ANY cjqg._smb._tcp.local, "QM" question ANY cjqg._companion-link._tcp.local, "QM" question SRV 0 0 445 cjqg.local SRV 0 0 53785 cjqg.local OPT"
"314","7.507443125","fe80::1cc7:6d9a:a312:7e8f","ff02::fb","MDNS","195","Standard query 0x0000 ANY cjqg._smb._tcp.local, "QM" question ANY cjqg._companion-link._tcp.local, "QM" question SRV 0 0 445 cjqg.local SRV 0 0 53785 cjqg.local OPT"
"315","7.606163387","192.168.1.100","224.0.0.251","MDNS","175","Standard query 0x0000 ANY cjqg._smb._tcp.local, "QM" question ANY cjqg._companion-link._tcp.local, "QM" question SRV 0 0 445 cjqg.local SRV 0 0 53785 cjqg.local OPT"
"316","7.656270125","192.168.1.118","192.168.1.102","TCP","176","35182 → 8009 [PSH, ACK] Seq=111 Ack=111 Win=501 Len=110 TSval=2820192456 TSecr=6063104 [TCP segment of a reassembled PDU]"
"317","7.708606350","192.168.1.102","192.168.1.118","TCP","176","8009 → 35182 [PSH, ACK] Seq=111 Ack=221 Win=277 Len=110 TSval=6063606 TSecr=2820192456 [TCP segment of a reassembled PDU]"
"318","7.708690800","192.168.1.118","192.168.1.102","TCP","66","35182 → 8009 [ACK] Seq=221 Ack=221 Win=501 Len=0 TSval=2820192508 TSecr=6063606"
"319","7.809145937","192.168.1.101","224.0.0.251","MDNS","181","Standard query 0x0000 ANY cjqg._smb._tcp.local, "QM" question ANY cjqg._companion-link._tcp.local, "QM" question SRV 0 0 445 cjqg.local SRV 0 0 53785 cjqg.local OPT"
"320","7.811655900","fe80::1814:2ecf:2c8a:d90d","ff02::fb","MDNS","201","Standard query 0x0000 ANY cjqg._smb._tcp.local, "QM" question ANY cjqg._companion-link._tcp.local, "QM" question SRV 0 0 445 cjqg.local SRV 0 0 53785 cjqg.local OPT"
"321","7.815803362","fe80::1cc7:6d9a:a312:7e8f","ff02::fb","MDNS","195","Standard query 0x0000 ANY cjqg._smb._tcp.local, "QM" question ANY cjqg._companion-link._tcp.local, "QM" question SRV 0 0 445 cjqg.local SRV 0 0 53785 cjqg.local OPT"
"322","7.818106237","192.168.1.100","224.0.0.251","MDNS","175","Standard query 0x0000 ANY cjqg._smb._tcp.local, "QM" question ANY cjqg._companion-link._tcp.local, "QM" question SRV 0 0 445 cjqg.local SRV 0 0 53785 cjqg.local OPT"
"323","7.859478875","192.168.1.118","239.255.255.250","SSDP","218","M-SEARCH * HTTP/1.1 "
"324","8.016885162","192.168.1.101","224.0.0.251","MDNS","530","Standard query response 0x0000 TXT, cache flush PTR cjqg._smb._tcp.local TXT SRV, cache flush 0 0 445 cjqg.local TXT, cache flush PTR _companion-link._tcp.local PTR cjqg._companion-link._tcp.local SRV, cache flush 0 0 53785 cjqg.local AAAA, cache flush fe80::1814:2ecf:2c8a:d90d A, cache flush 192.168.1.101 NSEC, cache flush cjqg._smb._tcp.local NSEC, cache flush cjqg._companion-link._tcp.local NSEC, cache flush cjqg.local OPT"
"325","8.321390175","192.168.1.101","224.0.0.251","MDNS","213","Standard query response 0x0000 PTR _smb._tcp.local TXT OPT"
"326","8.324170525","fe80::1814:2ecf:2c8a:d90d","ff02::fb","MDNS","233","Standard query response 0x0000 PTR _smb._tcp.local TXT OPT"
"327","8.326983500","fe80::1cc7:6d9a:a312:7e8f","ff02::fb","MDNS","227","Standard query response 0x0000 PTR _smb._tcp.local TXT OPT"
"328","8.329337537","192.168.1.100","224.0.0.251","MDNS","207","Standard query response 0x0000 PTR _smb._tcp.local TXT OPT"
"329","8.426437825","192.168.1.101","224.0.0.251","MDNS","539","Standard query 0x0000 PTR _googlecast._tcp.local, "QM" question PTR _homekit._tcp.local, "QM" question PTR _uscan._tcp.local, "QM" question PTR _ptp._tcp.local, "QM" question PTR _ippusb._tcp.local, "QM" question PTR _scanner._tcp.local, "QM" question PTR _ipp._tcp.local, "QM" question PTR _pdl-datastream._tcp.local, "QM" question PTR _uscans._tcp.local, "QM" question PTR _ipps._tcp.local, "QM" question PTR _printer._tcp.local, "QM" question PTR _airplay._tcp.local, "QM" question PTR _raop._tcp.local, "QM" question PTR _airport._tcp.local, "QM" question PTR _rdlink._tcp.local, "QM" question PTR _companion-link._tcp.local, "QM" question PTR _afpovertcp._tcp.local, "QM" question PTR _rfb._tcp.local, "QM" question PTR _adisk._tcp.local, "QM" question PTR _apple-mobdev._tcp.local, "QM" question PTR 8ed307c3._sub._apple-mobdev2._tcp.local, "QM" question PTR _apple-pairable._tcp.local, "QM" question TXT Google-Home-Mini-2c3f16b2da5c4b6fd6cfbfba61c12490._googlecast._tcp.local, "QM" question PTR Google-Home-Mini-2c3f16b2da5c4b6fd6cfbfba61c12490._googlecast._tcp.local PTR cjqg._companion-link._tcp.local OPT"
"330","8.511820050","192.168.1.118","172.253.63.188","TLSv1.2","99","Application Data"
"331","8.526794612","192.168.1.102","224.0.0.251","MDNS","183","Standard query response 0x0000 SRV, cache flush 0 0 8009 2c3f16b2-da5c-4b6f-d6cf-bfba61c12490.local"
"332","8.529155925","192.168.1.102","224.0.0.251","MDNS","183","Standard query response 0x0000 SRV, cache flush 0 0 8009 2c3f16b2-da5c-4b6f-d6cf-bfba61c12490.local"
"333","8.533543262","172.253.63.188","192.168.1.118","TCP","66","5228 → 41484 [ACK] Seq=1 Ack=34 Win=248 Len=0 TSval=3878229573 TSecr=2263289704"
"334","8.543938212","172.253.63.188","192.168.1.118","TLSv1.2","99","Application Data"
"335","8.544281012","192.168.1.118","172.253.63.188","TLSv1.2","109","Application Data"
"336","8.574448575","172.253.63.188","192.168.1.118","TCP","66","5228 → 41484 [ACK] Seq=34 Ack=77 Win=248 Len=0 TSval=3878229610 TSecr=2263289737"
"337","8.859795237","192.168.1.118","239.255.255.250","SSDP","218","M-SEARCH * HTTP/1.1 "
