frame.number,_ws.col.Time,_ws.col.Source,_ws.col.Destination,_ws.col.Protocol,frame.len,_ws.col.Info
"1","0.000000000","104.92.229.234","192.168.1.118","SSL","4410","Continuation Data"
"2","0.000070500","192.168.1.118","104.92.229.234","TCP","66","37420 → 443 [ACK] Seq=1 Ack=4345 Win=569 Len=0 TSval=3634897011 TSecr=3544295301"
"3","0.001944375","104.92.229.234","192.168.1.118","SSL","4450","Continuation Data"
"4","0.002007013","192.168.1.118","104.92.229.234","TCP","66","37420 → 443 [ACK] Seq=1 Ack=8729 Win=638 Len=0 TSval=3634897013 TSecr=3544295301"
"5","0.002044325","35.186.208.48","192.168.1.118","TLSv1.2","117","Change Cipher Spec, Encrypted Handshake Message"
"6","0.012330200","192.168.1.118","35.186.208.48","TLSv1.2","353","Application Data"
"7","0.012577263","192.168.1.118","35.186.208.48","TLSv1.2","326","Application Data"
"8","0.026071888","35.186.208.48","192.168.1.118","TLSv1.2","117","Change Cipher Spec, Encrypted Handshake Message"
"9","0.026938788","35.186.208.48","192.168.1.118","TLSv1.2","117","Change Cipher Spec, Encrypted Handshake Message"
"10","0.027034738","35.186.208.48","192.168.1.118","TLSv1.2","117","Change Cipher Spec, Encrypted Handshake Message"
"11","0.030015813","104.92.229.234","192.168.1.118","TCP","4410","[TCP segment of a reassembled PDU]"
"12","0.031956238","104.92.229.234","192.168.1.118","TLSv1.2","4517","Application Data"
"13","0.040014550","104.92.229.234","192.168.1.118","TLSv1.2","823","Application Data"
"14","0.040183475","104.92.229.234","192.168.1.118","TCP","2962","[TCP segment of a reassembled PDU]"
"15","0.042375263","104.92.229.234","192.168.1.118","TCP","5858","443 → 37424 [ACK] Seq=2897 Ack=1 Win=258 Len=5792 TSval=3544295340 TSecr=3634896948 [TCP segment of a reassembled PDU]"
"16","0.042462663","104.92.229.234","192.168.1.118","TLSv1.2","440","Application Data"
"17","0.043369450","192.168.1.118","35.186.208.48","TLSv1.2","321","Application Data"
"18","0.043662225","192.168.1.118","35.186.208.48","TLSv1.2","324","Application Data"
"19","0.043873838","192.168.1.118","35.186.208.48","TLSv1.2","333","Application Data"
"20","0.043930450","192.168.1.118","104.92.229.234","TCP","66","37424 → 443 [ACK] Seq=1 Ack=9063 Win=431 Len=0 TSval=3634897055 TSecr=3544295340"
"21","0.044114513","192.168.1.118","104.92.229.234","TCP","66","37426 → 443 [ACK] Seq=1 Ack=8796 Win=433 Len=0 TSval=3634897055 TSecr=3544295332"
"22","0.051663800","35.186.208.48","192.168.1.118","TLSv1.2","1484","Application Data"
"23","0.051817825","35.186.208.48","192.168.1.118","TLSv1.2","2902","Application Data, Application Data"
"24","0.052512350","192.168.1.118","35.186.208.48","TCP","66","32896 → 443 [ACK] Seq=288 Ack=4255 Win=468 Len=0 TSval=4247281286 TSecr=1135498866"
"25","0.053342900","35.186.208.48","192.168.1.118","TLSv1.2","2902","Application Data, Application Data"
"26","0.054104463","35.186.208.48","192.168.1.118","TLSv1.2","2902","Application Data, Application Data"
"27","0.054613338","192.168.1.118","35.186.208.48","TCP","66","32896 → 443 [ACK] Seq=288 Ack=9927 Win=424 Len=0 TSval=4247281288 TSecr=1135498866"
"28","0.055859025","35.186.208.48","192.168.1.118","TLSv1.2","1484","Application Data"
"29","0.056808375","192.168.1.118","35.227.209.247","TLSv1.2","285","Application Data"
"30","0.057150788","35.186.208.48","192.168.1.118","TLSv1.2","2902","Application Data, Application Data"
"31","0.057306625","35.186.208.48","192.168.1.118","TLSv1.2","2902","Application Data, Application Data"
"32","0.058721600","192.168.1.118","35.186.208.48","TCP","66","32898 → 443 [ACK] Seq=261 Ack=7142 Win=446 Len=0 TSval=4247281292 TSecr=153843551"
"33","0.064925513","35.186.208.48","192.168.1.118","TLSv1.2","2902","Application Data, Application Data"
"34","0.065050113","192.168.1.118","35.186.208.48","TCP","66","32896 → 443 [ACK] Seq=288 Ack=12763 Win=477 Len=0 TSval=4247281298 TSecr=1135498871"
"35","0.065117988","35.186.208.48","192.168.1.118","TLSv1.2","1484","Application Data"
"36","0.066364375","35.186.208.48","192.168.1.118","TLSv1.2","1484","Application Data"
"37","0.066830788","192.168.1.118","35.186.208.48","TCP","66","32896 → 443 [ACK] Seq=288 Ack=15599 Win=455 Len=0 TSval=4247281300 TSecr=1135498873"
"38","0.067138425","35.186.208.48","192.168.1.118","TLSv1.2","2902","Application Data, Application Data"
"39","0.067237450","192.168.1.118","35.186.208.48","TCP","66","32898 → 443 [ACK] Seq=261 Ack=9978 Win=477 Len=0 TSval=4247281300 TSecr=153843555"
"40","0.067287900","35.186.208.48","192.168.1.118","TLSv1.2","1484","Application Data"
"41","0.071715750","35.186.208.48","192.168.1.118","TLSv1.2","1484","Application Data"
"42","0.071810788","192.168.1.118","35.186.208.48","TCP","66","32896 → 443 [ACK] Seq=288 Ack=18435 Win=493 Len=0 TSval=4247281305 TSecr=1135498875"
"43","0.071921025","35.186.208.48","192.168.1.118","TLSv1.2","2902","Application Data, Application Data"
"44","0.071972900","192.168.1.118","35.186.208.48","TCP","66","32898 → 443 [ACK] Seq=261 Ack=12814 Win=477 Len=0 TSval=4247281305 TSecr=153843560"
"45","0.072028488","35.186.208.48","192.168.1.118","TLSv1.2","2902","Application Data, Application Data"
"46","0.072091763","35.186.208.48","192.168.1.118","TLSv1.2","1484","Application Data"
"47","0.072119763","35.186.208.48","192.168.1.118","TLSv1.2","1484","Application Data"
"48","0.072249288","35.186.208.48","192.168.1.118","TLSv1.2","1484","Application Data"
"49","0.072345550","192.168.1.118","35.186.208.48","TCP","66","32896 → 443 [ACK] Seq=288 Ack=22689 Win=460 Len=0 TSval=4247281305 TSecr=1135498877"
"50","0.072548038","192.168.1.118","35.186.208.48","TCP","66","32898 → 443 [ACK] Seq=261 Ack=15650 Win=455 Len=0 TSval=4247281306 TSecr=153843564"
"51","0.080762013","192.168.1.118","104.92.229.234","TCP","66","37428 → 443 [ACK] Seq=1 Ack=758 Win=501 Len=0 TSval=3634897092 TSecr=3544295340"
"52","0.083469138","35.186.208.48","192.168.1.118","TLSv1.2","2902","Application Data, Application Data"
"53","0.083581763","192.168.1.118","35.186.208.48","TCP","66","32898 → 443 [ACK] Seq=261 Ack=18486 Win=477 Len=0 TSval=4247281317 TSecr=153843568"
"54","0.083677538","35.186.208.48","192.168.1.118","TLSv1.2","1484","Application Data"
"55","0.085072900","35.186.208.48","192.168.1.118","TLSv1.2","1484","Application Data"
"56","0.085657150","192.168.1.118","35.186.208.48","TCP","66","32898 → 443 [ACK] Seq=261 Ack=21322 Win=455 Len=0 TSval=4247281319 TSecr=153843572"
"57","0.085712013","35.186.208.48","192.168.1.118","TLSv1.2","1484","Application Data"
"58","0.085869225","35.186.208.48","192.168.1.118","TLSv1.2","2902","Application Data, Application Data"
"59","0.085955025","35.186.208.48","192.168.1.118","TLSv1.2","2902","Application Data, Application Data"
"60","0.085991888","35.186.208.48","192.168.1.118","TLSv1.2","1484","Application Data"
"61","0.086292738","35.186.208.48","192.168.1.118","TLSv1.2","2902","Application Data, Application Data"
"62","0.087286725","192.168.1.118","35.186.208.48","TCP","66","32904 → 443 [ACK] Seq=256 Ack=9978 Win=424 Len=0 TSval=4247281320 TSecr=3377651024"
"63","0.088116100","35.186.208.48","192.168.1.118","TLSv1.2","1484","Application Data"
"64","0.090984700","35.186.208.48","192.168.1.118","TLSv1.2","1484","Application Data"
"65","0.091119388","35.186.208.48","192.168.1.118","TLSv1.2","1484","Application Data"
"66","0.091133388","192.168.1.118","35.186.208.48","TCP","66","32904 → 443 [ACK] Seq=256 Ack=12814 Win=402 Len=0 TSval=4247281324 TSecr=3377651034"
"67","0.091216725","35.186.208.48","192.168.1.118","TLSv1.2","2902","Application Data, Application Data"
"68","0.091257850","35.186.208.48","192.168.1.118","TLSv1.2","2902","Application Data, Application Data"
"69","0.093133063","192.168.1.118","35.186.208.48","TCP","66","32904 → 443 [ACK] Seq=256 Ack=15650 Win=380 Len=0 TSval=4247281326 TSecr=3377651038"
"70","0.093346375","192.168.1.118","35.186.208.48","TCP","66","32900 → 443 [ACK] Seq=259 Ack=4306 Win=477 Len=0 TSval=4247281326 TSecr=889428442"
"71","0.102682000","35.186.208.48","192.168.1.118","TLSv1.2","1484","Application Data"
"72","0.102791850","35.186.208.48","192.168.1.118","TLSv1.2","2902","Application Data, Application Data"
"73","0.102882113","192.168.1.118","35.186.208.48","TCP","66","32900 → 443 [ACK] Seq=259 Ack=7142 Win=477 Len=0 TSval=4247281336 TSecr=889428442"
"74","0.104193725","35.186.208.48","192.168.1.118","TLSv1.2","1484","Application Data"
"75","0.104911825","35.186.208.48","192.168.1.118","TLSv1.2","1484","Application Data"
"76","0.104958650","192.168.1.118","35.186.208.48","TCP","66","32902 → 443 [ACK] Seq=268 Ack=2888 Win=493 Len=0 TSval=4247281338 TSecr=522924328"
"77","0.105063238","35.186.208.48","192.168.1.118","TLSv1.2","2902","Application Data, Application Data"
"78","0.106302963","35.186.208.48","192.168.1.118","TLSv1.2","2902","Application Data, Application Data"
"79","0.106431588","192.168.1.118","35.186.208.48","TCP","66","32900 → 443 [ACK] Seq=259 Ack=9978 Win=477 Len=0 TSval=4247281339 TSecr=889428445"
"80","0.107128300","192.168.1.118","35.186.208.48","TCP","66","32902 → 443 [ACK] Seq=268 Ack=7142 Win=477 Len=0 TSval=4247281340 TSecr=522924328"
"81","0.107998288","35.186.208.48","192.168.1.118","TLSv1.2","1484","Application Data"
"82","0.109748675","35.186.208.48","192.168.1.118","TLSv1.2","1484","Application Data"
"83","0.109877138","192.168.1.118","35.186.208.48","TCP","66","32904 → 443 [ACK] Seq=256 Ack=18486 Win=493 Len=0 TSval=4247281343 TSecr=3377651043"
"84","0.109943175","35.186.208.48","192.168.1.118","TLSv1.2","1484","Application Data"
"85","0.110821538","35.186.208.48","192.168.1.118","TLSv1.2","1484","Application Data"
"86","0.110977463","35.186.208.48","192.168.1.118","TLSv1.2","1484","Application Data"
"87","0.111072050","192.168.1.118","35.186.208.48","TCP","66","32900 → 443 [ACK] Seq=259 Ack=12814 Win=477 Len=0 TSval=4247281344 TSecr=889428449"
"88","0.111142100","35.186.208.48","192.168.1.118","TLSv1.2","2902","Application Data, Application Data"
"89","0.111372213","192.168.1.118","35.186.208.48","TCP","66","32904 → 443 [ACK] Seq=256 Ack=21322 Win=471 Len=0 TSval=4247281344 TSecr=3377651047"
"90","0.122109250","35.186.208.48","192.168.1.118","TLSv1.2","2902","Application Data, Application Data"
"91","0.122190838","192.168.1.118","35.186.208.48","TCP","66","32902 → 443 [ACK] Seq=268 Ack=11396 Win=477 Len=0 TSval=4247281355 TSecr=522924332"
"92","0.122231100","35.186.208.48","192.168.1.118","TLSv1.2","1484","Application Data"
"93","0.123819988","35.186.208.48","192.168.1.118","TLSv1.2","1484","Application Data"
"94","0.123924463","192.168.1.118","35.186.208.48","TCP","66","32896 → 443 [ACK] Seq=288 Ack=25525 Win=523 Len=0 TSval=4247281357 TSecr=1135498915"
"95","0.124329338","35.186.208.48","192.168.1.118","TLSv1.2","2902","Application Data, Application Data"
"96","0.124405575","192.168.1.118","35.186.208.48","TCP","66","32896 → 443 [ACK] Seq=288 Ack=28361 Win=568 Len=0 TSval=4247281357 TSecr=1135498916"
"97","0.124441900","35.186.208.48","192.168.1.118","TLSv1.2","1484","Application Data"
"98","0.126938275","192.168.1.118","35.186.208.48","TCP","66","32898 → 443 [ACK] Seq=261 Ack=22740 Win=501 Len=0 TSval=4247281360 TSecr=153843577"
"99","0.128836213","35.186.208.48","192.168.1.118","TLSv1.2","1484","Application Data"
"100","0.128940150","192.168.1.118","35.186.208.48","TCP","66","32900 → 443 [ACK] Seq=259 Ack=15650 Win=493 Len=0 TSval=4247281362 TSecr=889428452"
"101","0.128995713","35.186.208.48","192.168.1.118","TLSv1.2","1484","Application Data"
"102","0.133386213","35.186.208.48","192.168.1.118","TLSv1.2","2902","Application Data, Application Data"
"103","0.133463375","35.186.208.48","192.168.1.118","TLSv1.2","1484","Application Data"
"104","0.133532325","192.168.1.118","35.186.208.48","TCP","66","32896 → 443 [ACK] Seq=288 Ack=31197 Win=612 Len=0 TSval=4247281367 TSecr=1135498919"
"105","0.133587038","35.186.208.48","192.168.1.118","TLSv1.2","1484","Application Data"
"106","0.133649088","35.186.208.48","192.168.1.118","TLSv1.2","2902","Application Data, Application Data"
"107","0.133701913","192.168.1.118","35.186.208.48","TCP","66","32902 → 443 [ACK] Seq=268 Ack=14232 Win=477 Len=0 TSval=4247281367 TSecr=522924339"
"108","0.133736400","35.186.208.48","192.168.1.118","TLSv1.2","1484","Application Data"
"109","0.134223875","192.168.1.118","35.186.208.48","TCP","66","32900 → 443 [ACK] Seq=259 Ack=19904 Win=461 Len=0 TSval=4247281367 TSecr=889428456"
"110","0.139793150","35.186.208.48","192.168.1.118","TLSv1.2","1484","Application Data"
"111","0.139887700","35.186.208.48","192.168.1.118","TLSv1.2","2902","Application Data, Application Data"
"112","0.139959938","192.168.1.118","35.186.208.48","TCP","66","32902 → 443 [ACK] Seq=268 Ack=17068 Win=477 Len=0 TSval=4247281373 TSecr=522924343"
"113","0.140062975","35.186.208.48","192.168.1.118","TLSv1.2","2902","Application Data, Application Data"
"114","0.140113250","35.186.208.48","192.168.1.118","TLSv1.2","1484","Application Data"
"115","0.140165913","192.168.1.118","35.186.208.48","TCP","66","32900 → 443 [ACK] Seq=259 Ack=22740 Win=523 Len=0 TSval=4247281373 TSecr=889428460"
"116","0.140202713","35.186.208.48","192.168.1.118","TLSv1.2","1484","Application Data"
"117","0.140203025","192.168.1.118","35.186.208.48","TCP","66","32902 → 443 [ACK] Seq=268 Ack=19904 Win=455 Len=0 TSval=4247281373 TSecr=522924347"
"118","0.141360788","35.186.208.48","192.168.1.118","TLSv1.2","1484","Application Data"
"119","0.142225288","192.168.1.118","35.186.208.48","TCP","66","32902 → 443 [ACK] Seq=268 Ack=22740 Win=433 Len=0 TSval=4247281375 TSecr=522924351"
"120","0.143199550","35.186.208.48","192.168.1.118","TLSv1.2","2902","Application Data, Application Data"
"121","0.143302725","192.168.1.118","35.186.208.48","TCP","66","32896 → 443 [ACK] Seq=288 Ack=34033 Win=656 Len=0 TSval=4247281376 TSecr=1135498945"
"122","0.143357350","35.186.208.48","192.168.1.118","TLSv1.2","1484","Application Data"
"123","0.143418250","192.168.1.118","35.186.208.48","TCP","66","32898 → 443 [ACK] Seq=261 Ack=24158 Win=493 Len=0 TSval=4247281376 TSecr=153843628"
"124","0.144258450","35.186.208.48","192.168.1.118","TLSv1.2","1484","Application Data"
"125","0.144377375","192.168.1.118","35.186.208.48","TCP","66","32898 → 443 [ACK] Seq=261 Ack=25576 Win=482 Len=0 TSval=4247281377 TSecr=153843628"
"126","0.144441563","35.186.208.48","192.168.1.118","TLSv1.2","2902","Application Data, Application Data"
"127","0.144508575","192.168.1.118","35.186.208.48","TCP","66","32896 → 443 [ACK] Seq=288 Ack=36869 Win=701 Len=0 TSval=4247281378 TSecr=1135498947"
"128","0.145908225","35.186.208.48","192.168.1.118","TLSv1.2","1484","Application Data"
"129","0.146023413","192.168.1.118","35.186.208.48","TCP","66","32898 → 443 [ACK] Seq=261 Ack=26994 Win=523 Len=0 TSval=4247281379 TSecr=153843630"
"130","0.147681388","35.227.209.247","192.168.1.118","TLSv1.2","1484","Application Data"
"131","0.147781150","35.186.208.48","192.168.1.118","TLSv1.2","1484","Application Data"
"132","0.147860950","192.168.1.118","35.186.208.48","TCP","66","32898 → 443 [ACK] Seq=261 Ack=28412 Win=545 Len=0 TSval=4247281381 TSecr=153843630"
"133","0.148732863","35.227.209.247","192.168.1.118","TLSv1.2","2902","Application Data, Application Data"
"134","0.148871213","35.186.208.48","192.168.1.118","TLSv1.2","2902","Application Data, Application Data"
"135","0.148889675","192.168.1.118","35.227.209.247","TCP","66","42028 → 443 [ACK] Seq=220 Ack=4255 Win=468 Len=0 TSval=3511052890 TSecr=4233313605"
"136","0.148952525","192.168.1.118","35.186.208.48","TCP","66","32896 → 443 [ACK] Seq=288 Ack=39705 Win=745 Len=0 TSval=4247281382 TSecr=1135498949"
"137","0.152192088","35.186.208.48","192.168.1.118","TLSv1.2","2902","Application Data, Application Data"
"138","0.152307513","192.168.1.118","35.186.208.48","TCP","66","32896 → 443 [ACK] Seq=288 Ack=42541 Win=789 Len=0 TSval=4247281385 TSecr=1135498951"
"139","0.152367563","35.227.209.247","192.168.1.118","TLSv1.2","1484","Application Data"
"140","0.153738550","35.227.209.247","192.168.1.118","TLSv1.2","1484","Application Data"
"141","0.153852388","192.168.1.118","35.227.209.247","TCP","66","42028 → 443 [ACK] Seq=220 Ack=7091 Win=493 Len=0 TSval=3511052895 TSecr=4233313608"
"142","0.154226950","35.186.208.48","192.168.1.118","TLSv1.2","2902","Application Data, Application Data"
"143","0.154282888","192.168.1.118","35.186.208.48","TCP","66","32898 → 443 [ACK] Seq=261 Ack=31248 Win=590 Len=0 TSval=4247281387 TSecr=153843634"
"144","0.154317125","35.186.208.48","192.168.1.118","TLSv1.2","1484","Application Data [TCP segment of a reassembled PDU]"
"145","0.158931700","35.186.208.48","192.168.1.118","TLSv1.2","1484","Application Data [TCP segment of a reassembled PDU]"
"146","0.159015275","192.168.1.118","35.186.208.48","TCP","66","32896 → 443 [ACK] Seq=288 Ack=45377 Win=834 Len=0 TSval=4247281392 TSecr=1135498953"
"147","0.159077913","35.227.209.247","192.168.1.118","TLSv1.2","2902","Application Data, Application Data"
"148","0.159140788","35.186.208.48","192.168.1.118","TLSv1.2","1484","Application Data [TCP segment of a reassembled PDU]"
"149","0.159164575","35.227.209.247","192.168.1.118","TLSv1.2","2902","Application Data, Application Data"
"150","0.159181800","35.186.208.48","192.168.1.118","TLSv1.2","1484","Application Data"
"151","0.159213450","192.168.1.118","35.186.208.48","TCP","66","32898 → 443 [ACK] Seq=261 Ack=32666 Win=612 Len=0 TSval=4247281392 TSecr=153843639"
"152","0.160495175","192.168.1.118","35.227.209.247","TCP","66","42028 → 443 [ACK] Seq=220 Ack=12763 Win=449 Len=0 TSval=3511052902 TSecr=4233313610"
"153","0.160778238","35.186.208.48","192.168.1.118","TLSv1.2","1484","Application Data"
"154","0.160864613","192.168.1.118","35.186.208.48","TCP","66","32898 → 443 [ACK] Seq=261 Ack=34084 Win=634 Len=0 TSval=4247281394 TSecr=153843639"
"155","0.160908625","35.186.208.48","192.168.1.118","TLSv1.2","2902","Application Data, Application Data"
"156","0.160950388","192.168.1.118","35.186.208.48","TCP","66","32896 → 443 [ACK] Seq=288 Ack=49631 Win=900 Len=0 TSval=4247281394 TSecr=1135498956"
"157","0.163528813","35.227.209.247","192.168.1.118","TLSv1.2","2902","Application Data, Application Data"
"158","0.163634675","192.168.1.118","35.227.209.247","TCP","66","42028 → 443 [ACK] Seq=220 Ack=15599 Win=477 Len=0 TSval=3511052905 TSecr=4233313615"
"159","0.163678888","35.186.208.48","192.168.1.118","TLSv1.2","2902","Application Data, Application Data"
"160","0.163727838","192.168.1.118","35.186.208.48","TCP","66","32896 → 443 [ACK] Seq=288 Ack=52467 Win=944 Len=0 TSval=4247281397 TSecr=1135498959"
"161","0.168841750","35.227.209.247","192.168.1.118","TLSv1.2","2902","Application Data, Application Data"
"162","0.168946550","192.168.1.118","35.227.209.247","TCP","66","42028 → 443 [ACK] Seq=220 Ack=18435 Win=477 Len=0 TSval=3511052910 TSecr=4233313618"
"163","0.169002100","35.227.209.247","192.168.1.118","TLSv1.2","637","Application Data"
"164","0.169069450","35.186.208.48","192.168.1.118","TLSv1.2","2902","Application Data, Application Data"
"165","0.169124625","192.168.1.118","35.186.208.48","TCP","66","32896 → 443 [ACK] Seq=288 Ack=55303 Win=989 Len=0 TSval=4247281402 TSecr=1135498961"
"166","0.169170063","35.186.208.48","192.168.1.118","TLSv1.2","2902","Application Data, Application Data"
"167","0.169225725","192.168.1.118","35.186.208.48","TCP","66","32898 → 443 [ACK] Seq=261 Ack=36920 Win=678 Len=0 TSval=4247281402 TSecr=153843643"
"168","0.169258238","35.186.208.48","192.168.1.118","TLSv1.2","1484","Application Data [TCP segment of a reassembled PDU]"
"169","0.170482975","35.186.208.48","192.168.1.118","TLSv1.2","1484","Application Data [TCP segment of a reassembled PDU]"
"170","0.170587550","192.168.1.118","35.186.208.48","TCP","66","32896 → 443 [ACK] Seq=288 Ack=58139 Win=1033 Len=0 TSval=4247281404 TSecr=1135498964"
"171","0.172007850","35.186.208.48","192.168.1.118","TLSv1.2","2902","Application Data, Application Data"
"172","0.172113225","192.168.1.118","35.186.208.48","TCP","66","32898 → 443 [ACK] Seq=261 Ack=39756 Win=723 Len=0 TSval=4247281405 TSecr=153843647"
"173","0.173272138","35.186.208.48","192.168.1.118","TLSv1.2","2902","Application Data, Application Data"
"174","0.173376950","192.168.1.118","35.186.208.48","TCP","66","32896 → 443 [ACK] Seq=288 Ack=60975 Win=1077 Len=0 TSval=4247281406 TSecr=1135498966"
"175","0.173467225","35.186.208.48","192.168.1.118","TLSv1.2","2902","Application Data, Application Data"
"176","0.173526638","192.168.1.118","35.186.208.48","TCP","66","32896 → 443 [ACK] Seq=288 Ack=63811 Win=1122 Len=0 TSval=4247281407 TSecr=1135498968"
"177","0.177778463","192.168.1.118","35.186.208.48","TCP","66","32904 → 443 [ACK] Seq=256 Ack=22740 Win=501 Len=0 TSval=4247281411 TSecr=3377651052"
"178","0.177993438","35.186.208.48","192.168.1.118","TLSv1.2","2902","Application Data, Application Data"
"179","0.178064175","192.168.1.118","35.186.208.48","TCP","66","32904 → 443 [ACK] Seq=256 Ack=25576 Win=545 Len=0 TSval=4247281411 TSecr=3377651102"
"180","0.178096763","35.186.208.48","192.168.1.118","TLSv1.2","2902","Application Data, Application Data"
"181","0.178147600","192.168.1.118","35.186.208.48","TCP","66","32898 → 443 [ACK] Seq=261 Ack=42592 Win=767 Len=0 TSval=4247281411 TSecr=153843651"
"182","0.178177313","35.186.208.48","192.168.1.118","TLSv1.2","2902","Application Data, Application Data"
"183","0.178228238","192.168.1.118","35.186.208.48","TCP","66","32900 → 443 [ACK] Seq=259 Ack=25576 Win=568 Len=0 TSval=4247281411 TSecr=889428506"
"184","0.178256613","35.186.208.48","192.168.1.118","TLSv1.2","1484","Application Data [TCP segment of a reassembled PDU]"
"185","0.186203163","35.186.208.48","192.168.1.118","TLSv1.2","1484","Application Data [TCP segment of a reassembled PDU]"
"186","0.186319800","192.168.1.118","35.186.208.48","TCP","66","32896 → 443 [ACK] Seq=288 Ack=66647 Win=1166 Len=0 TSval=4247281419 TSecr=1135498970"
"187","0.186382300","35.186.208.48","192.168.1.118","TLSv1.2","2902","Application Data, Application Data"
"188","0.186476588","192.168.1.118","35.186.208.48","TCP","66","32904 → 443 [ACK] Seq=256 Ack=28412 Win=590 Len=0 TSval=4247281420 TSecr=3377651104"
"189","0.187556888","35.186.208.48","192.168.1.118","TLSv1.2","1484","Application Data"
"190","0.188302350","35.186.208.48","192.168.1.118","TLSv1.2","1484","Application Data"
"191","0.188372250","192.168.1.118","35.186.208.48","TCP","66","32900 → 443 [ACK] Seq=259 Ack=28412 Win=612 Len=0 TSval=4247281421 TSecr=889428507"
"192","0.188413088","35.186.208.48","192.168.1.118","TLSv1.2","2902","Application Data, Application Data"
"193","0.188477563","192.168.1.118","35.186.208.48","TCP","66","32898 → 443 [ACK] Seq=261 Ack=45428 Win=811 Len=0 TSval=4247281422 TSecr=153843655"
"194","0.192829763","35.186.208.48","192.168.1.118","TLSv1.2","2902","Application Data, Application Data"
"195","0.192911250","192.168.1.118","35.186.208.48","TCP","66","32904 → 443 [ACK] Seq=256 Ack=31248 Win=634 Len=0 TSval=4247281426 TSecr=3377651108"
"196","0.192956900","35.186.208.48","192.168.1.118","TLSv1.2","2902","Application Data, Application Data"
"197","0.193019963","192.168.1.118","35.186.208.48","TCP","66","32900 → 443 [ACK] Seq=259 Ack=31248 Win=656 Len=0 TSval=4247281426 TSecr=889428511"
"198","0.193157475","35.186.208.48","192.168.1.118","TLSv1.2","1484","Application Data [TCP segment of a reassembled PDU]"
"199","0.193221325","192.168.1.118","35.186.208.48","TCP","66","32898 → 443 [ACK] Seq=261 Ack=46846 Win=834 Len=0 TSval=4247281426 TSecr=153843659"
"200","0.193306000","35.186.208.48","192.168.1.118","TLSv1.2","2902","Application Data, Application Data"
"201","0.193383275","192.168.1.118","35.186.208.48","TCP","66","32898 → 443 [ACK] Seq=261 Ack=49682 Win=878 Len=0 TSval=4247281426 TSecr=153843661"
"202","0.194964950","35.186.208.48","192.168.1.118","TLSv1.2","1484","Application Data"
"203","0.195079125","192.168.1.118","35.186.208.48","TCP","66","32904 → 443 [ACK] Seq=256 Ack=32666 Win=656 Len=0 TSval=4247281428 TSecr=3377651113"
"204","0.196744088","35.186.208.48","192.168.1.118","TLSv1.2","1484","Application Data"
"205","0.196814475","192.168.1.118","35.186.208.48","TCP","66","32904 → 443 [ACK] Seq=256 Ack=34084 Win=678 Len=0 TSval=4247281430 TSecr=3377651113"
"206","0.196850250","35.186.208.48","192.168.1.118","TLSv1.2","1484","Application Data [TCP segment of a reassembled PDU]"
"207","0.196874275","192.168.1.118","35.186.208.48","TCP","66","32898 → 443 [ACK] Seq=261 Ack=51100 Win=900 Len=0 TSval=4247281430 TSecr=153843665"
"208","0.197616263","35.186.208.48","192.168.1.118","TLSv1.2","1484","Application Data [TCP segment of a reassembled PDU]"
"209","0.197679275","192.168.1.118","35.186.208.48","TCP","66","32898 → 443 [ACK] Seq=261 Ack=52518 Win=922 Len=0 TSval=4247281431 TSecr=153843665"
"210","0.197712325","35.186.208.48","192.168.1.118","TLSv1.2","2902","Application Data, Application Data"
"211","0.197730463","192.168.1.118","35.186.208.48","TCP","66","32904 → 443 [ACK] Seq=256 Ack=36920 Win=723 Len=0 TSval=4247281431 TSecr=3377651117"
"212","0.197740713","35.186.208.48","192.168.1.118","TLSv1.2","1484","Application Data [TCP segment of a reassembled PDU]"
"213","0.197757275","192.168.1.118","35.186.208.48","TCP","66","32898 → 443 [ACK] Seq=261 Ack=53936 Win=944 Len=0 TSval=4247281431 TSecr=153843669"
"214","0.204399163","35.186.208.48","192.168.1.118","TLSv1.2","1484","Application Data [TCP segment of a reassembled PDU]"
"215","0.204469350","192.168.1.118","35.186.208.48","TCP","66","32898 → 443 [ACK] Seq=261 Ack=55354 Win=966 Len=0 TSval=4247281438 TSecr=153843669"
"216","0.204504275","35.186.208.48","192.168.1.118","TLSv1.2","2902","Application Data, Application Data"
"217","0.204528638","192.168.1.118","35.186.208.48","TCP","66","32904 → 443 [ACK] Seq=256 Ack=39756 Win=767 Len=0 TSval=4247281438 TSecr=3377651122"
"218","0.206044175","35.186.208.48","192.168.1.118","TLSv1.2","1484","Application Data"
"219","0.206465863","35.186.208.48","192.168.1.118","TLSv1.2","1484","Application Data"
"220","0.206498875","192.168.1.118","35.186.208.48","TCP","66","32900 → 443 [ACK] Seq=259 Ack=34084 Win=701 Len=0 TSval=4247281440 TSecr=889428527"
"221","0.206528675","35.186.208.48","192.168.1.118","TLSv1.2","2902","Application Data, Application Data"
"222","0.206546800","192.168.1.118","35.186.208.48","TCP","66","32898 → 443 [ACK] Seq=261 Ack=58190 Win=1011 Len=0 TSval=4247281440 TSecr=153843673"
"223","0.209880638","192.168.1.118","35.227.209.247","TCP","66","42028 → 443 [ACK] Seq=220 Ack=19006 Win=501 Len=0 TSval=3511052951 TSecr=4233313620"
"224","0.210141388","35.186.208.48","192.168.1.118","TLSv1.2","2902","Application Data, Application Data"
"225","0.210200538","192.168.1.118","35.186.208.48","TCP","66","32900 → 443 [ACK] Seq=259 Ack=36920 Win=745 Len=0 TSval=4247281443 TSecr=889428528"
"226","0.210224988","35.186.208.48","192.168.1.118","TLSv1.2","2902","Application Data, Application Data"
"227","0.210262850","192.168.1.118","35.186.208.48","TCP","66","32904 → 443 [ACK] Seq=256 Ack=42592 Win=811 Len=0 TSval=4247281443 TSecr=3377651127"
"228","0.210284388","35.186.208.48","192.168.1.118","TLSv1.2","1484","Application Data [TCP segment of a reassembled PDU]"
"229","0.210322175","192.168.1.118","35.186.208.48","TCP","66","32898 → 443 [ACK] Seq=261 Ack=59608 Win=1033 Len=0 TSval=4247281443 TSecr=153843677"
"230","0.211189263","35.186.208.48","192.168.1.118","TLSv1.2","1484","Application Data [TCP segment of a reassembled PDU]"
"231","0.211273200","192.168.1.118","35.186.208.48","TCP","66","32898 → 443 [ACK] Seq=261 Ack=61026 Win=1055 Len=0 TSval=4247281444 TSecr=153843677"
"232","0.211317975","35.186.208.48","192.168.1.118","TLSv1.2","1484","Application Data [TCP segment of a reassembled PDU]"
"233","0.211358325","192.168.1.118","35.186.208.48","TCP","66","32904 → 443 [ACK] Seq=256 Ack=44010 Win=834 Len=0 TSval=4247281444 TSecr=3377651131"
"234","0.214931088","35.186.208.48","192.168.1.118","TLSv1.2","1484","Application Data [TCP segment of a reassembled PDU]"
"235","0.215025563","192.168.1.118","35.186.208.48","TCP","66","32904 → 443 [ACK] Seq=256 Ack=45428 Win=856 Len=0 TSval=4247281448 TSecr=3377651131"
"236","0.215096075","35.186.208.48","192.168.1.118","TLSv1.2","1484","Application Data [TCP segment of a reassembled PDU]"
"237","0.215135725","192.168.1.118","35.186.208.48","TCP","66","32904 → 443 [ACK] Seq=256 Ack=46846 Win=878 Len=0 TSval=4247281448 TSecr=3377651136"
"238","0.215183438","35.186.208.48","192.168.1.118","TLSv1.2","2902","Application Data, Application Data"
"239","0.215226675","192.168.1.118","35.186.208.48","TCP","66","32898 → 443 [ACK] Seq=261 Ack=63862 Win=1060 Len=0 TSval=4247281448 TSecr=153843681"
"240","0.215250375","35.186.208.48","192.168.1.118","TLSv1.2","2902","Application Data, Application Data"
"241","0.215292713","192.168.1.118","35.186.208.48","TCP","66","32904 → 443 [ACK] Seq=256 Ack=49682 Win=883 Len=0 TSval=4247281448 TSecr=3377651138"
"242","0.218480475","35.186.208.48","192.168.1.118","TLSv1.2","2902","Application Data, Application Data"
"243","0.218586163","192.168.1.118","35.186.208.48","TCP","66","32904 → 443 [ACK] Seq=256 Ack=52518 Win=861 Len=0 TSval=4247281452 TSecr=3377651143"
"244","0.218666488","35.186.208.48","192.168.1.118","TLSv1.2","1484","Application Data [TCP segment of a reassembled PDU]"
"245","0.220110863","35.186.208.48","192.168.1.118","TLSv1.2","1484","Application Data [TCP segment of a reassembled PDU]"
"246","0.220208150","192.168.1.118","35.186.208.48","TCP","66","32900 → 443 [ACK] Seq=259 Ack=39756 Win=778 Len=0 TSval=4247281453 TSecr=889428561"
"247","0.220540900","35.186.208.48","192.168.1.118","TLSv1.2","2902","Application Data, Application Data"
"248","0.220626613","192.168.1.118","35.186.208.48","TCP","66","32902 → 443 [ACK] Seq=268 Ack=25576 Win=477 Len=0 TSval=4247281454 TSecr=522924444"
"249","0.220671950","35.186.208.48","192.168.1.118","TLSv1.2","1484","Application Data"
"250","0.225217450","35.186.208.48","192.168.1.118","TLSv1.2","1484","Application Data"
"251","0.225371663","35.186.208.48","192.168.1.118","TLSv1.2","2902","Application Data, Application Data"
"252","0.225436263","35.186.208.48","192.168.1.118","TLSv1.2","2902","Application Data, Application Data"
"253","0.225503825","192.168.1.118","35.186.208.48","TCP","66","32904 → 443 [ACK] Seq=256 Ack=55354 Win=839 Len=0 TSval=4247281459 TSecr=3377651169"
"254","0.225555950","35.186.208.48","192.168.1.118","TLSv1.2","2902","Application Data, Application Data"
"255","0.233424913","35.186.208.48","192.168.1.118","TLSv1.2","2902","Application Data, Application Data"
"256","0.233551538","192.168.1.118","35.186.208.48","TCP","66","32904 → 443 [ACK] Seq=256 Ack=58190 Win=817 Len=0 TSval=4247281467 TSecr=3377651171"
"257","0.236459388","35.186.208.48","192.168.1.118","TLSv1.2","2902","Application Data, Application Data"
"258","0.236541113","35.186.208.48","192.168.1.118","TLSv1.2","1484","Application Data [TCP segment of a reassembled PDU]"
"259","0.236651038","192.168.1.118","35.186.208.48","TCP","66","32904 → 443 [ACK] Seq=256 Ack=59608 Win=806 Len=0 TSval=4247281470 TSecr=3377651175"
"260","0.238021288","35.186.208.48","192.168.1.118","TLSv1.2","1484","Application Data [TCP segment of a reassembled PDU]"
"261","0.238538825","35.186.208.48","192.168.1.118","TLSv1.2","2902","Application Data, Application Data"
"262","0.238614613","35.186.208.48","192.168.1.118","TLSv1.2","1484","Application Data [TCP segment of a reassembled PDU]"
"263","0.240960675","35.186.208.48","192.168.1.118","TLSv1.2","1484","Application Data [TCP segment of a reassembled PDU]"
"264","0.241075725","192.168.1.118","35.186.208.48","TCP","66","32896 → 443 [ACK] Seq=288 Ack=69483 Win=1210 Len=0 TSval=4247281474 TSecr=1135499046"
"265","0.241137713","35.186.208.48","192.168.1.118","TLSv1.2","2902","Application Data, Application Data"
"266","0.242570638","35.186.208.48","192.168.1.118","TLSv1.2","1484","Application Data [TCP segment of a reassembled PDU]"
"267","0.243251713","35.186.208.48","192.168.1.118","TLSv1.2","1484","Application Data [TCP segment of a reassembled PDU]"
"268","0.243321038","35.186.208.48","192.168.1.118","TLSv1.2","2902","Application Data, Application Data"
"269","0.243387613","192.168.1.118","35.186.208.48","TCP","66","32896 → 443 [ACK] Seq=288 Ack=72319 Win=1218 Len=0 TSval=4247281476 TSecr=1135499055"
"270","0.250270950","35.227.209.247","192.168.1.118","TLSv1.2","637","[TCP Spurious Retransmission] , Application Data"
"271","0.250370250","192.168.1.118","35.227.209.247","TCP","78","[TCP Dup ACK 223#1] 42028 → 443 [ACK] Seq=220 Ack=19006 Win=501 Len=0 TSval=3511052991 TSecr=4233313720 SLE=18435 SRE=19006"
"272","0.261852975","192.168.1.118","35.186.208.48","TCP","66","32902 → 443 [ACK] Seq=268 Ack=39756 Win=367 Len=0 TSval=4247281495 TSecr=522924447"
"273","0.263226388","35.186.208.48","192.168.1.118","TLSv1.2","1484","Application Data [TCP segment of a reassembled PDU]"
"274","0.263305100","192.168.1.118","35.186.208.48","TCP","66","32898 → 443 [ACK] Seq=261 Ack=65280 Win=1049 Len=0 TSval=4247281496 TSecr=153843768"
"275","0.268335575","35.186.208.48","192.168.1.118","TLSv1.2","1484","Application Data [TCP segment of a reassembled PDU]"
"276","0.268407663","192.168.1.118","35.186.208.48","TCP","66","32898 → 443 [ACK] Seq=261 Ack=66698 Win=1038 Len=0 TSval=4247281501 TSecr=153843768"
"277","0.268445238","35.186.208.48","192.168.1.118","TLSv1.2","2902","Application Data, Application Data"
"278","0.268477113","192.168.1.118","35.186.208.48","TCP","66","32900 → 443 [ACK] Seq=259 Ack=45428 Win=734 Len=0 TSval=4247281502 TSecr=889428581"
"279","0.268492388","35.186.208.48","192.168.1.118","TLSv1.2","2902","Application Data, Application Data"
"280","0.278984163","192.168.1.118","35.186.208.48","TCP","66","32904 → 443 [ACK] Seq=256 Ack=63862 Win=773 Len=0 TSval=4247281512 TSecr=3377651175"
"281","0.283256238","35.186.208.48","192.168.1.118","TLSv1.2","2902","Application Data, Application Data"
"282","0.283351988","192.168.1.118","35.186.208.48","TCP","66","32902 → 443 [ACK] Seq=268 Ack=42592 Win=345 Len=0 TSval=4247281516 TSecr=522924510"
"283","0.283397788","35.186.208.48","192.168.1.118","TLSv1.2","1484","Application Data [TCP segment of a reassembled PDU]"
"284","0.285929025","35.186.208.48","192.168.1.118","TLSv1.2","1484","Application Data [TCP segment of a reassembled PDU]"
"285","0.286018313","35.186.208.48","192.168.1.118","TLSv1.2","1484","Application Data [TCP segment of a reassembled PDU]"
"286","0.286073175","35.186.208.48","192.168.1.118","TLSv1.2","2902","Application Data, Application Data"
"287","0.286142638","192.168.1.118","35.186.208.48","TCP","66","32902 → 443 [ACK] Seq=268 Ack=45428 Win=323 Len=0 TSval=4247281519 TSecr=522924512"
"288","0.286193300","35.186.208.48","192.168.1.118","TLSv1.2","2902","Application Data, Application Data"
"289","0.286225438","35.186.208.48","192.168.1.118","TLSv1.2","2902","Application Data, Application Data"
"290","0.287301025","35.186.208.48","192.168.1.118","TLSv1.2","1484","Application Data"
"291","0.287401350","192.168.1.118","35.186.208.48","TCP","66","32902 → 443 [ACK] Seq=268 Ack=46846 Win=312 Len=0 TSval=4247281520 TSecr=522924516"
"292","0.289032188","35.186.208.48","192.168.1.118","TLSv1.2","1484","Application Data"
"293","0.289124475","35.186.208.48","192.168.1.118","TLSv1.2","1484","Application Data [TCP segment of a reassembled PDU]"
"294","0.290489513","35.186.208.48","192.168.1.118","TLSv1.2","1484","Application Data [TCP segment of a reassembled PDU]"
"295","0.290553350","35.186.208.48","192.168.1.118","TLSv1.2","2902","Application Data, Application Data"
"296","0.290586650","35.186.208.48","192.168.1.118","TLSv1.2","1484","Application Data [TCP segment of a reassembled PDU]"
"297","0.298048463","35.186.208.48","192.168.1.118","TLSv1.2","1484","Application Data [TCP segment of a reassembled PDU]"
"298","0.298116863","35.186.208.48","192.168.1.118","TLSv1.2","2902","Application Data, Application Data"
"299","0.299701700","35.186.208.48","192.168.1.118","TLSv1.2","1484","Application Data [TCP segment of a reassembled PDU]"
"300","0.300451150","35.186.208.48","192.168.1.118","TLSv1.2","1484","Application Data [TCP segment of a reassembled PDU]"
"301","0.300520400","35.186.208.48","192.168.1.118","TLSv1.2","2902","Application Data, Application Data"
"302","0.300618613","192.168.1.118","35.186.208.48","TCP","66","32896 → 443 [ACK] Seq=288 Ack=83663 Win=1130 Len=0 TSval=4247281534 TSecr=1135499091"
"303","0.301783313","35.186.208.48","192.168.1.118","TLSv1.2","2902","Application Data, Application Data"
"304","0.303928150","35.186.208.48","192.168.1.118","TLSv1.2","2902","Application Data, Application Data"
"305","0.304006963","35.186.208.48","192.168.1.118","TLSv1.2","1484","Application Data [TCP segment of a reassembled PDU]"
"306","0.306343588","35.186.208.48","192.168.1.118","TLSv1.2","1484","Application Data [TCP segment of a reassembled PDU]"
"307","0.306412538","35.186.208.48","192.168.1.118","TLSv1.2","2902","Application Data, Application Data"
"308","0.306448750","35.186.208.48","192.168.1.118","TLSv1.2","1484","Application Data [TCP segment of a reassembled PDU]"
"309","0.310477988","35.186.208.48","192.168.1.118","TLSv1.2","1484","Application Data [TCP segment of a reassembled PDU]"
"310","0.310567688","35.186.208.48","192.168.1.118","TLSv1.2","2902","Application Data, Application Data"
"311","0.312852338","35.186.208.48","192.168.1.118","TLSv1.2","2902","Application Data, Application Data"
"312","0.312943563","35.186.208.48","192.168.1.118","TLSv1.2","2902","Application Data, Application Data"
"313","0.314116213","35.186.208.48","192.168.1.118","TLSv1.2","2902","Application Data, Application Data"
"314","0.318948513","192.168.1.118","35.186.208.48","TCP","66","32896 → 443 [ACK] Seq=288 Ack=89335 Win=1086 Len=0 TSval=4247281552 TSecr=1135499111"
"315","0.319982313","192.168.1.118","35.186.208.48","TCP","66","32898 → 443 [ACK] Seq=261 Ack=83714 Win=906 Len=0 TSval=4247281553 TSecr=153843788"
"316","0.320207175","192.168.1.118","35.186.208.48","TCP","66","32900 → 443 [ACK] Seq=259 Ack=52518 Win=679 Len=0 TSval=4247281553 TSecr=889428628"
"317","0.320451725","192.168.1.118","35.186.208.48","TCP","66","32902 → 443 [ACK] Seq=268 Ack=62444 Win=501 Len=0 TSval=4247281553 TSecr=522924516"
"318","0.321578550","192.168.1.118","104.92.229.234","TLSv1.2","1422","Application Data"
"319","0.333211225","35.186.208.48","192.168.1.118","TLSv1.2","1484","Application Data [TCP segment of a reassembled PDU]"
"320","0.334928913","35.186.208.48","192.168.1.118","TLSv1.2","1484","Application Data [TCP segment of a reassembled PDU]"
"321","0.339501575","35.186.208.48","192.168.1.118","TLSv1.2","2902","Application Data, Application Data"
"322","0.345482113","35.186.208.48","192.168.1.118","TLSv1.2","2902","Application Data, Application Data"
"323","0.345537788","35.186.208.48","192.168.1.118","TLSv1.2","1484","Application Data [TCP segment of a reassembled PDU]"
"324","0.345652150","35.186.208.48","192.168.1.118","TLSv1.2","1484","Application Data [TCP segment of a reassembled PDU]"
"325","0.346231200","192.168.1.118","35.186.208.48","TCP","66","32896 → 443 [ACK] Seq=288 Ack=95007 Win=1042 Len=0 TSval=4247281579 TSecr=1135499166"
"326","0.346316275","192.168.1.118","35.186.208.48","TCP","66","32898 → 443 [ACK] Seq=261 Ack=89386 Win=862 Len=0 TSval=4247281579 TSecr=153843842"
"327","0.359180738","35.186.208.48","192.168.1.118","TLSv1.2","2902","Application Data, Application Data"
"328","0.359245938","192.168.1.118","35.186.208.48","TCP","66","32896 → 443 [ACK] Seq=288 Ack=97843 Win=1250 Len=0 TSval=4247281592 TSecr=1135499169"
"329","0.359278000","35.186.208.48","192.168.1.118","TLSv1.2","1484","Application Data [TCP segment of a reassembled PDU]"
"330","0.360697888","35.186.208.48","192.168.1.118","TLSv1.2","1484","Application Data [TCP segment of a reassembled PDU]"
