frame.number,_ws.col.Time,_ws.col.Source,_ws.col.Destination,_ws.col.Protocol,frame.len,_ws.col.Info
"1","0.000000000","172.217.10.14","192.168.1.118","TLSv1.2","1484","Application Data"
"2","0.006446037","172.217.10.14","192.168.1.118","TLSv1.2","1484","Application Data"
"3","0.006540912","192.168.1.118","172.217.10.14","TCP","66","46462 → 443 [ACK] Seq=1 Ack=2837 Win=493 Len=0 TSval=2023836284 TSecr=3383073176"
"4","0.007619000","172.217.10.14","192.168.1.118","TLSv1.2","1484","Application Data"
"5","0.012211625","172.217.10.14","192.168.1.118","TLSv1.2","2902","Application Data, Application Data"
"6","0.013407137","172.217.10.14","192.168.1.118","TLSv1.2","2902","Application Data, Application Data"
"7","0.014810012","192.168.1.118","172.217.10.14","TCP","66","46462 → 443 [ACK] Seq=1 Ack=9927 Win=445 Len=0 TSval=2023836293 TSecr=3383073176"
"8","0.027575175","172.217.10.14","192.168.1.118","TLSv1.2","2902","Application Data, Application Data"
"9","0.027700200","192.168.1.118","172.217.10.14","TCP","66","46462 → 443 [ACK] Seq=1 Ack=12763 Win=477 Len=0 TSval=2023836305 TSecr=3383073180"
"10","0.028757475","172.217.10.14","192.168.1.118","TLSv1.2","2902","Application Data, Application Data"
"11","0.028882712","192.168.1.118","172.217.10.14","TCP","66","46462 → 443 [ACK] Seq=1 Ack=15599 Win=477 Len=0 TSval=2023836307 TSecr=3383073181"
"12","0.031267362","172.217.10.14","192.168.1.118","TLSv1.2","2902","Application Data, Application Data"
"13","0.031391425","192.168.1.118","172.217.10.14","TCP","66","46462 → 443 [ACK] Seq=1 Ack=18435 Win=477 Len=0 TSval=2023836309 TSecr=3383073182"
"14","0.035590600","172.217.10.14","192.168.1.118","TLSv1.2","2902","Application Data, Application Data"
"15","0.036943075","172.217.10.14","192.168.1.118","TLSv1.2","2902","Application Data, Application Data"
"16","0.046117937","172.217.10.14","192.168.1.118","TLSv1.2","1484","Application Data [TCP segment of a reassembled PDU]"
"17","0.046223050","172.217.10.14","192.168.1.118","TLSv1.2","1484","Application Data [TCP segment of a reassembled PDU]"
"18","0.046320862","172.217.10.14","192.168.1.118","TLSv1.2","2902","Application Data, Application Data"
"19","0.046394437","172.217.10.14","192.168.1.118","TLSv1.2","2902","Application Data, Application Data"
"20","0.047193775","172.217.10.14","192.168.1.118","TLSv1.2","2902","Application Data, Application Data"
"21","0.047314475","172.217.10.14","192.168.1.118","TLSv1.2","2902","Application Data, Application Data"
"22","0.058522962","172.217.10.14","192.168.1.118","TLSv1.2","2902","Application Data, Application Data"
"23","0.058642312","172.217.10.14","192.168.1.118","TLSv1.2","337","Application Data, Application Data"
"24","0.069216700","192.168.1.118","172.217.10.14","TCP","66","46462 → 443 [ACK] Seq=1 Ack=41394 Win=298 Len=0 TSval=2023836347 TSecr=3383073184"
"25","0.070330912","192.168.1.118","209.18.47.62","DNS","71","Standard query 0xf801 A i.ytimg.com"
"26","0.070684012","192.168.1.118","209.18.47.62","DNS","71","Standard query 0xa499 A i.ytimg.com"
"27","0.070850237","192.168.1.118","209.18.47.62","DNS","71","Standard query 0x58f0 A i.ytimg.com"
"28","0.071092737","192.168.1.118","209.18.47.62","DNS","71","Standard query 0x78b6 A i.ytimg.com"
"29","0.071337137","192.168.1.118","209.18.47.62","DNS","71","Standard query 0x38be A i.ytimg.com"
"30","0.106843375","209.18.47.62","192.168.1.118","DNS","87","Standard query response 0xa499 A i.ytimg.com A 172.217.10.150"
"31","0.107280262","192.168.1.118","209.18.47.62","DNS","71","Standard query 0x340c AAAA i.ytimg.com"
"32","0.111215737","209.18.47.62","192.168.1.118","DNS","87","Standard query response 0x58f0 A i.ytimg.com A 172.217.12.182"
"33","0.111360762","209.18.47.62","192.168.1.118","DNS","87","Standard query response 0xf801 A i.ytimg.com A 172.217.12.150"
"34","0.111689912","192.168.1.118","209.18.47.62","DNS","71","Standard query 0x00eb AAAA i.ytimg.com"
"35","0.112039712","192.168.1.118","209.18.47.62","DNS","71","Standard query 0x9cb9 AAAA i.ytimg.com"
"36","0.114338000","209.18.47.62","192.168.1.118","DNS","87","Standard query response 0x38be A i.ytimg.com A 142.250.64.86"
"37","0.114688062","192.168.1.118","209.18.47.62","DNS","71","Standard query 0x1056 AAAA i.ytimg.com"
"38","0.115478275","209.18.47.62","192.168.1.118","DNS","87","Standard query response 0x78b6 A i.ytimg.com A 172.217.12.182"
"39","0.115857762","192.168.1.118","209.18.47.62","DNS","71","Standard query 0xf446 AAAA i.ytimg.com"
"40","0.120863962","192.168.1.118","209.18.47.62","DNS","75","Standard query 0x246d A www.gstatic.com"
"41","0.125929962","209.18.47.62","192.168.1.118","DNS","99","Standard query response 0x340c AAAA i.ytimg.com AAAA 2607:f8b0:4006:812::2016"
"42","0.133578275","192.168.1.118","172.217.10.150","TCP","74","36532 → 443 [SYN] Seq=0 Win=64240 Len=0 MSS=1460 SACK_PERM=1 TSval=121712175 TSecr=0 WS=128"
"43","0.133690700","192.168.1.118","172.217.10.150","TCP","74","36534 → 443 [SYN] Seq=0 Win=64240 Len=0 MSS=1460 SACK_PERM=1 TSval=121712175 TSecr=0 WS=128"
"44","0.133771275","192.168.1.118","172.217.10.150","TCP","74","36536 → 443 [SYN] Seq=0 Win=64240 Len=0 MSS=1460 SACK_PERM=1 TSval=121712176 TSecr=0 WS=128"
"45","0.133851200","192.168.1.118","172.217.10.150","TCP","74","36538 → 443 [SYN] Seq=0 Win=64240 Len=0 MSS=1460 SACK_PERM=1 TSval=121712176 TSecr=0 WS=128"
"46","0.135051300","192.168.1.118","172.217.10.150","TCP","74","36540 → 443 [SYN] Seq=0 Win=64240 Len=0 MSS=1460 SACK_PERM=1 TSval=121712177 TSecr=0 WS=128"
"47","0.135185337","192.168.1.118","209.18.47.62","DNS","73","Standard query 0xac47 A yt3.ggpht.com"
"48","0.149292712","192.168.1.118","209.18.47.62","DNS","73","Standard query 0x2812 A yt3.ggpht.com"
"49","0.169454250","209.18.47.62","192.168.1.118","DNS","99","Standard query response 0x00eb AAAA i.ytimg.com AAAA 2607:f8b0:4006:819::2016"
"50","0.170347600","209.18.47.62","192.168.1.118","DNS","99","Standard query response 0x9cb9 AAAA i.ytimg.com AAAA 2607:f8b0:4006:81a::2016"
"51","0.170388562","209.18.47.62","192.168.1.118","DNS","99","Standard query response 0xf446 AAAA i.ytimg.com AAAA 2607:f8b0:4006:81a::2016"
"52","0.170421512","209.18.47.62","192.168.1.118","DNS","99","Standard query response 0x1056 AAAA i.ytimg.com AAAA 2607:f8b0:4006:806::2016"
"53","0.170452800","209.18.47.62","192.168.1.118","DNS","91","Standard query response 0x246d A www.gstatic.com A 142.250.64.67"
"54","0.171509537","192.168.1.118","209.18.47.62","DNS","75","Standard query 0xd0c6 AAAA www.gstatic.com"
"55","0.188633737","172.217.10.150","192.168.1.118","TCP","74","443 → 36536 [SYN, ACK] Seq=0 Ack=1 Win=60192 Len=0 MSS=1380 SACK_PERM=1 TSval=8842117 TSecr=121712176 WS=256"
"56","0.188755150","192.168.1.118","172.217.10.150","TCP","66","36536 → 443 [ACK] Seq=1 Ack=1 Win=64256 Len=0 TSval=121712231 TSecr=8842117"
"57","0.201190162","172.217.10.150","192.168.1.118","TCP","74","443 → 36538 [SYN, ACK] Seq=0 Ack=1 Win=60192 Len=0 MSS=1380 SACK_PERM=1 TSval=2930093717 TSecr=121712176 WS=256"
"58","0.201341925","192.168.1.118","172.217.10.150","TCP","66","36538 → 443 [ACK] Seq=1 Ack=1 Win=64256 Len=0 TSval=121712243 TSecr=2930093717"
"59","0.201425612","172.217.10.150","192.168.1.118","TCP","74","443 → 36534 [SYN, ACK] Seq=0 Ack=1 Win=60192 Len=0 MSS=1380 SACK_PERM=1 TSval=692005560 TSecr=121712175 WS=256"
"60","0.201511012","192.168.1.118","172.217.10.150","TCP","66","36534 → 443 [ACK] Seq=1 Ack=1 Win=64256 Len=0 TSval=121712243 TSecr=692005560"
"61","0.201569837","172.217.10.150","192.168.1.118","TCP","74","443 → 36532 [SYN, ACK] Seq=0 Ack=1 Win=60192 Len=0 MSS=1380 SACK_PERM=1 TSval=3847263759 TSecr=121712175 WS=256"
"62","0.201650675","192.168.1.118","172.217.10.150","TCP","66","36532 → 443 [ACK] Seq=1 Ack=1 Win=64256 Len=0 TSval=121712243 TSecr=3847263759"
"63","0.202445200","209.18.47.62","192.168.1.118","DNS","103","Standard query response 0xd0c6 AAAA www.gstatic.com AAAA 2607:f8b0:4006:806::2003"
"64","0.202539337","209.18.47.62","192.168.1.118","DNS","134","Standard query response 0xac47 A yt3.ggpht.com CNAME photos-ugc.l.googleusercontent.com A 172.217.10.33"
"65","0.202618075","209.18.47.62","192.168.1.118","DNS","134","Standard query response 0x2812 A yt3.ggpht.com CNAME photos-ugc.l.googleusercontent.com A 142.250.64.97"
"66","0.202682475","172.217.10.150","192.168.1.118","TCP","74","443 → 36540 [SYN, ACK] Seq=0 Ack=1 Win=60192 Len=0 MSS=1380 SACK_PERM=1 TSval=692005574 TSecr=121712177 WS=256"
"67","0.202799237","192.168.1.118","172.217.10.150","TCP","66","36540 → 443 [ACK] Seq=1 Ack=1 Win=64256 Len=0 TSval=121712245 TSecr=692005574"
"68","0.203154737","192.168.1.118","209.18.47.62","DNS","73","Standard query 0xe4ee AAAA yt3.ggpht.com"
"69","0.204162487","192.168.1.118","209.18.47.62","DNS","73","Standard query 0x401c AAAA yt3.ggpht.com"
"70","0.206287700","192.168.1.118","172.217.10.150","TLSv1","583","Client Hello"
"71","0.222602900","192.168.1.118","172.217.10.150","TLSv1","583","Client Hello"
"72","0.222802300","192.168.1.118","142.250.64.67","TCP","74","35488 → 443 [SYN] Seq=0 Win=64240 Len=0 MSS=1460 SACK_PERM=1 TSval=282327822 TSecr=0 WS=128"
"73","0.227295487","209.18.47.62","192.168.1.118","DNS","146","Standard query response 0xe4ee AAAA yt3.ggpht.com CNAME photos-ugc.l.googleusercontent.com AAAA 2607:f8b0:4006:803::2001"
"74","0.228527737","209.18.47.62","192.168.1.118","DNS","146","Standard query response 0x401c AAAA yt3.ggpht.com CNAME photos-ugc.l.googleusercontent.com AAAA 2607:f8b0:4006:807::2001"
"75","0.238180112","172.217.10.150","192.168.1.118","TCP","66","443 → 36536 [ACK] Seq=1 Ack=518 Win=61440 Len=0 TSval=8842172 TSecr=121712248"
"76","0.239192875","192.168.1.118","172.217.10.150","TLSv1","583","Client Hello"
"77","0.246879250","172.217.10.150","192.168.1.118","TLSv1.2","1484","Server Hello"
"78","0.247019162","192.168.1.118","172.217.10.150","TCP","66","36536 → 443 [ACK] Seq=518 Ack=1419 Win=63104 Len=0 TSval=121712289 TSecr=8842179"
"79","0.249378650","172.217.10.150","192.168.1.118","TLSv1.2","1484","Certificate [TCP segment of a reassembled PDU]"
"80","0.249491675","192.168.1.118","172.217.10.150","TCP","66","36536 → 443 [ACK] Seq=518 Ack=2837 Win=61696 Len=0 TSval=121712291 TSecr=8842179"
"81","0.249560750","172.217.10.150","192.168.1.118","TLSv1.2","301","Server Key Exchange, Server Hello Done"
"82","0.249631887","192.168.1.118","172.217.10.150","TCP","66","36536 → 443 [ACK] Seq=518 Ack=3072 Win=61568 Len=0 TSval=121712291 TSecr=8842180"
"83","0.249694962","172.217.10.150","192.168.1.118","TCP","66","443 → 36538 [ACK] Seq=1 Ack=518 Win=61440 Len=0 TSval=2930093781 TSecr=121712264"
"84","0.249924300","142.250.64.67","192.168.1.118","TCP","74","443 → 35488 [SYN, ACK] Seq=0 Ack=1 Win=60192 Len=0 MSS=1380 SACK_PERM=1 TSval=1746392863 TSecr=282327822 WS=256"
"85","0.250036850","192.168.1.118","142.250.64.67","TCP","66","35488 → 443 [ACK] Seq=1 Ack=1 Win=64256 Len=0 TSval=282327849 TSecr=1746392863"
"86","0.255223362","172.217.10.150","192.168.1.118","TLSv1.2","1484","Server Hello"
"87","0.255339625","192.168.1.118","172.217.10.150","TCP","66","36538 → 443 [ACK] Seq=518 Ack=1419 Win=63104 Len=0 TSval=121712297 TSecr=2930093788"
"88","0.255493512","192.168.1.118","172.217.10.150","TLSv1","583","Client Hello"
"89","0.257084162","172.217.10.150","192.168.1.118","TLSv1.2","1719","Certificate, Server Key Exchange, Server Hello Done"
"90","0.257206600","192.168.1.118","172.217.10.150","TCP","66","36538 → 443 [ACK] Seq=518 Ack=3072 Win=61568 Len=0 TSval=121712299 TSecr=2930093788"
"91","0.258032125","172.217.10.150","192.168.1.118","TCP","66","443 → 36540 [ACK] Seq=1 Ack=518 Win=61440 Len=0 TSval=692005634 TSecr=121712281"
"92","0.265494150","172.217.10.150","192.168.1.118","TLSv1.2","1484","Server Hello"
"93","0.265599937","192.168.1.118","172.217.10.150","TCP","66","36540 → 443 [ACK] Seq=518 Ack=1419 Win=63104 Len=0 TSval=121712307 TSecr=692005641"
"94","0.267313437","172.217.10.150","192.168.1.118","TLSv1.2","1719","Certificate, Server Key Exchange, Server Hello Done"
"95","0.267428512","192.168.1.118","172.217.10.150","TCP","66","36540 → 443 [ACK] Seq=518 Ack=3072 Win=61568 Len=0 TSval=121712309 TSecr=692005641"
"96","0.271912900","192.168.1.118","172.217.10.150","TLSv1","583","Client Hello"
"97","0.273937287","192.168.1.118","172.217.10.150","TLSv1.2","192","Client Key Exchange, Change Cipher Spec, Encrypted Handshake Message"
"98","0.275783087","192.168.1.118","172.217.10.150","TLSv1.2","192","Client Key Exchange, Change Cipher Spec, Encrypted Handshake Message"
"99","0.289028262","172.217.10.150","192.168.1.118","TCP","66","443 → 36532 [ACK] Seq=1 Ack=518 Win=61440 Len=0 TSval=3847263863 TSecr=121712297"
"100","0.292011212","192.168.1.118","142.250.64.67","TLSv1","583","Client Hello"
"101","0.292206275","192.168.1.118","172.217.10.33","TCP","74","43404 → 443 [SYN] Seq=0 Win=64240 Len=0 MSS=1460 SACK_PERM=1 TSval=685640370 TSecr=0 WS=128"
"102","0.292285050","192.168.1.118","172.217.10.33","TCP","74","43406 → 443 [SYN] Seq=0 Win=64240 Len=0 MSS=1460 SACK_PERM=1 TSval=685640370 TSecr=0 WS=128"
"103","0.303769200","192.168.1.118","172.217.10.150","TLSv1.2","192","Client Key Exchange, Change Cipher Spec, Encrypted Handshake Message"
"104","0.306272350","172.217.10.150","192.168.1.118","TLSv1.2","1484","Server Hello"
"105","0.306402537","192.168.1.118","172.217.10.150","TCP","66","36532 → 443 [ACK] Seq=518 Ack=1419 Win=63104 Len=0 TSval=121712348 TSecr=3847263871"
"106","0.308718362","172.217.10.150","192.168.1.118","TLSv1.2","1719","Certificate, Server Key Exchange, Server Hello Done"
"107","0.308818225","192.168.1.118","172.217.10.150","TCP","66","36532 → 443 [ACK] Seq=518 Ack=3072 Win=61568 Len=0 TSval=121712351 TSecr=3847263871"
"108","0.308942425","172.217.10.150","192.168.1.118","TCP","66","443 → 36534 [ACK] Seq=1 Ack=518 Win=61440 Len=0 TSval=692005675 TSecr=121712314"
"109","0.309031312","172.217.10.150","192.168.1.118","TLSv1.2","117","Change Cipher Spec, Encrypted Handshake Message"
"110","0.309113350","172.217.10.150","192.168.1.118","TLSv1.2","117","Change Cipher Spec, Encrypted Handshake Message"
"111","0.309244712","172.217.10.150","192.168.1.118","TLSv1.2","3137","Server Hello, Certificate, Server Key Exchange, Server Hello Done"
"112","0.309323100","192.168.1.118","172.217.10.150","TCP","66","36534 → 443 [ACK] Seq=518 Ack=3072 Win=61312 Len=0 TSval=121712351 TSecr=692005682"
"113","0.311488762","192.168.1.118","172.217.10.150","TLSv1.2","192","Client Key Exchange, Change Cipher Spec, Encrypted Handshake Message"
"114","0.311698712","142.250.64.67","192.168.1.118","TCP","66","443 → 35488 [ACK] Seq=1 Ack=518 Win=61440 Len=0 TSval=1746392925 TSecr=282327891"
"115","0.313330287","192.168.1.118","172.217.10.150","TLSv1.2","192","Client Key Exchange, Change Cipher Spec, Encrypted Handshake Message"
"116","0.313471500","172.217.10.33","192.168.1.118","TCP","74","443 → 43404 [SYN, ACK] Seq=0 Ack=1 Win=60192 Len=0 MSS=1380 SACK_PERM=1 TSval=2311488441 TSecr=685640370 WS=256"
"117","0.313614600","192.168.1.118","172.217.10.150","TLSv1.2","363","Application Data"
"118","0.313656937","192.168.1.118","172.217.10.33","TCP","66","43404 → 443 [ACK] Seq=1 Ack=1 Win=64256 Len=0 TSval=685640391 TSecr=2311488441"
"119","0.313835150","192.168.1.118","172.217.10.150","TLSv1.2","363","Application Data"
"120","0.329861162","192.168.1.118","172.217.10.33","TLSv1","583","Client Hello"
"121","0.333131950","142.250.64.67","192.168.1.118","TLSv1.2","2724","Server Hello, Certificate, Server Key Exchange, Server Hello Done"
"122","0.333233225","192.168.1.118","142.250.64.67","TCP","66","35488 → 443 [ACK] Seq=518 Ack=2659 Win=61696 Len=0 TSval=282327932 TSecr=1746392932"
"123","0.333308300","172.217.10.150","192.168.1.118","TLSv1.2","117","Change Cipher Spec, Encrypted Handshake Message"
"124","0.333370312","172.217.10.33","192.168.1.118","TCP","74","443 → 43406 [SYN, ACK] Seq=0 Ack=1 Win=60192 Len=0 MSS=1380 SACK_PERM=1 TSval=1542101550 TSecr=685640370 WS=256"
"125","0.333462437","192.168.1.118","172.217.10.33","TCP","66","43406 → 443 [ACK] Seq=1 Ack=1 Win=64256 Len=0 TSval=685640411 TSecr=1542101550"
"126","0.334294362","172.217.10.150","192.168.1.118","TLSv1.2","117","Change Cipher Spec, Encrypted Handshake Message"
"127","0.334392762","172.217.10.150","192.168.1.118","TLSv1.2","117","Change Cipher Spec, Encrypted Handshake Message"
"128","0.335544512","192.168.1.118","142.250.64.67","TLSv1.2","192","Client Key Exchange, Change Cipher Spec, Encrypted Handshake Message"
"129","0.339692137","172.217.10.150","192.168.1.118","TLSv1.2","1484","Application Data"
"130","0.341958212","172.217.10.150","192.168.1.118","TLSv1.2","2902","Application Data, Application Data"
"131","0.342126887","172.217.10.150","192.168.1.118","TLSv1.2","5738","Application Data, Application Data, Application Data, Application Data"
"132","0.350613500","172.217.10.150","192.168.1.118","TLSv1.2","1484","Application Data"
"133","0.350799525","172.217.10.150","192.168.1.118","TLSv1.2","2902","Application Data, Application Data"
"134","0.350915325","172.217.10.150","192.168.1.118","TLSv1.2","1484","Application Data"
"135","0.351016212","172.217.10.150","192.168.1.118","TLSv1.2","2798","Application Data, Application Data"
"136","0.351094987","172.217.10.150","192.168.1.118","TLSv1.2","750","Application Data"
"137","0.351869687","192.168.1.118","172.217.10.33","TLSv1","583","Client Hello"
"138","0.352231425","192.168.1.118","172.217.10.150","TLSv1.2","363","Application Data"
"139","0.352442275","192.168.1.118","172.217.10.150","TLSv1.2","363","Application Data"
"140","0.352644262","192.168.1.118","172.217.10.150","TLSv1.2","363","Application Data"
"141","0.352690687","192.168.1.118","172.217.10.150","TCP","66","36536 → 443 [ACK] Seq=941 Ack=11527 Win=55808 Len=0 TSval=121712394 TSecr=8842274"
"142","0.352828162","192.168.1.118","172.217.10.150","TCP","66","36538 → 443 [ACK] Seq=941 Ack=13733 Win=53632 Len=0 TSval=121712395 TSecr=2930093872"
"143","0.355846725","172.217.10.33","192.168.1.118","TCP","66","443 → 43404 [ACK] Seq=1 Ack=518 Win=61440 Len=0 TSval=2311488479 TSecr=685640408"
"144","0.359586212","172.217.10.33","192.168.1.118","TLSv1.2","5299","Server Hello, Certificate, Server Key Exchange, Server Hello Done"
"145","0.359700425","192.168.1.118","172.217.10.33","TCP","66","43404 → 443 [ACK] Seq=518 Ack=5234 Win=59136 Len=0 TSval=685640437 TSecr=2311488485"
"146","0.363129362","192.168.1.118","172.217.10.33","TLSv1.2","192","Client Key Exchange, Change Cipher Spec, Encrypted Handshake Message"
"147","0.366007250","192.168.1.118","172.217.10.150","TLSv1.2","363","Application Data"
"148","0.367712225","142.250.64.67","192.168.1.118","TLSv1.2","117","Change Cipher Spec, Encrypted Handshake Message"
"149","0.368949700","192.168.1.118","142.250.64.67","TLSv1.2","390","Application Data"
"150","0.369124662","192.168.1.118","172.217.10.150","TLSv1.2","363","Application Data"
"151","0.369317450","172.217.10.150","192.168.1.118","TLSv1.2","1484","Application Data"
"152","0.375811050","172.217.10.150","192.168.1.118","TLSv1.2","2902","Application Data, Application Data"
"153","0.375985450","172.217.10.150","192.168.1.118","TLSv1.2","1484","Application Data"
"154","0.376076600","172.217.10.150","192.168.1.118","TLSv1.2","2902","Application Data, Application Data"
"155","0.376173487","172.217.10.150","192.168.1.118","TLSv1.2","2902","Application Data, Application Data"
"156","0.376217625","172.217.10.150","192.168.1.118","TLSv1.2","1484","Application Data"
"157","0.377060612","192.168.1.118","172.217.10.150","TCP","66","36540 → 443 [ACK] Seq=941 Ack=5959 Win=61312 Len=0 TSval=121712419 TSecr=692005746"
"158","0.377370100","172.217.10.150","192.168.1.118","TLSv1.2","1484","Application Data"
"159","0.377409950","192.168.1.118","172.217.10.150","TCP","66","36534 → 443 [ACK] Seq=941 Ack=13049 Win=54272 Len=0 TSval=121712419 TSecr=692005746"
"160","0.377519150","172.217.10.150","192.168.1.118","TLSv1.2","2902","Application Data, Application Data"
"161","0.379208675","192.168.1.118","172.217.10.150","TCP","66","36540 → 443 [ACK] Seq=941 Ack=10213 Win=57088 Len=0 TSval=121712421 TSecr=692005746"
"162","0.379404337","172.217.10.150","192.168.1.118","TLSv1.2","2451","Application Data, Application Data"
"163","0.379509062","172.217.10.33","192.168.1.118","TCP","66","443 → 43406 [ACK] Seq=1 Ack=518 Win=61440 Len=0 TSval=1542101596 TSecr=685640430"
"164","0.379589475","172.217.10.150","192.168.1.118","TLSv1.2","258","Application Data"
"165","0.379651275","172.217.10.150","192.168.1.118","TCP","66","443 → 36532 [ACK] Seq=3123 Ack=941 Win=62464 Len=0 TSval=3847263948 TSecr=121712394"
"166","0.379737300","172.217.10.150","192.168.1.118","TLSv1.2","1484","Application Data"
"167","0.379824275","172.217.10.150","192.168.1.118","TLSv1.2","2902","Application Data, Application Data"
"168","0.379926225","172.217.10.150","192.168.1.118","TLSv1.2","1484","Application Data"
"169","0.380099575","172.217.10.150","192.168.1.118","TLSv1.2","4069","Application Data, Application Data, Application Data"
"170","0.380162325","172.217.10.33","192.168.1.118","TLSv1.2","1484","Server Hello"
"171","0.380226987","192.168.1.118","172.217.10.33","TCP","66","43406 → 443 [ACK] Seq=518 Ack=1419 Win=63104 Len=0 TSval=685640458 TSecr=1542101603"
"172","0.381446900","192.168.1.118","172.217.10.150","TCP","66","36540 → 443 [ACK] Seq=941 Ack=12598 Win=54784 Len=0 TSval=121712423 TSecr=692005746"
"173","0.381553687","192.168.1.118","172.217.10.150","TCP","66","36532 → 443 [ACK] Seq=941 Ack=12798 Win=54528 Len=0 TSval=121712423 TSecr=3847263949"
"174","0.381653700","172.217.10.33","192.168.1.118","TLSv1.2","3881","Certificate, Server Key Exchange, Server Hello Done"
"175","0.381761912","192.168.1.118","172.217.10.33","TCP","66","43406 → 443 [ACK] Seq=518 Ack=5234 Win=59392 Len=0 TSval=685640459 TSecr=1542101603"
"176","0.381831637","172.217.10.33","192.168.1.118","TLSv1.2","117","Change Cipher Spec, Encrypted Handshake Message"
"177","0.384131750","192.168.1.118","172.217.10.33","TLSv1.2","192","Client Key Exchange, Change Cipher Spec, Encrypted Handshake Message"
"178","0.384621237","192.168.1.118","172.217.10.33","TLSv1.2","308","Application Data"
"179","0.389108850","192.168.1.118","172.217.10.150","TLSv1.2","363","Application Data"
"180","0.389240875","192.168.1.118","172.217.10.150","TLSv1.2","442","Application Data"
"181","0.393366650","192.168.1.118","172.217.10.150","TLSv1.2","363","Application Data"
"182","0.397967200","142.250.64.67","192.168.1.118","TLSv1.2","469","Application Data"
"183","0.401296237","172.217.10.150","192.168.1.118","TLSv1.2","1484","Application Data"
"184","0.401435162","172.217.10.150","192.168.1.118","TLSv1.2","1484","Application Data"
"185","0.401569625","172.217.10.150","192.168.1.118","TLSv1.2","2902","Application Data, Application Data"
"186","0.401679087","172.217.10.150","192.168.1.118","TLSv1.2","2902","Application Data, Application Data"
"187","0.401786175","172.217.10.150","192.168.1.118","TLSv1.2","1583","Application Data, Application Data"
"188","0.401933575","172.217.10.150","192.168.1.118","TLSv1.2","2902","Application Data, Application Data"
"189","0.402360637","172.217.10.150","192.168.1.118","TLSv1.2","1859","Application Data, Application Data"
"190","0.402447275","172.217.10.33","192.168.1.118","TLSv1.2","117","Change Cipher Spec, Encrypted Handshake Message"
"191","0.403588062","192.168.1.118","172.217.10.33","TLSv1.2","338","Application Data"
"192","0.403670262","192.168.1.118","172.217.10.150","TCP","66","36536 → 443 [ACK] Seq=1238 Ack=17298 Win=58368 Len=0 TSval=121712445 TSecr=8842328"
"193","0.403829200","192.168.1.118","172.217.10.150","TCP","66","36538 → 443 [ACK] Seq=1238 Ack=22616 Win=55296 Len=0 TSval=121712446 TSecr=2930093927"
"194","0.407181612","172.217.10.33","192.168.1.118","TLSv1.2","1484","Application Data"
"195","0.408684400","172.217.10.33","192.168.1.118","TLSv1.2","2136","Application Data, Application Data"
"196","0.409233650","192.168.1.118","172.217.10.33","TCP","66","43404 → 443 [ACK] Seq=886 Ack=8773 Win=60672 Len=0 TSval=685640487 TSecr=2311488534"
"197","0.410292300","172.217.10.150","192.168.1.118","TLSv1.2","1484","Application Data"
"198","0.411923175","172.217.10.150","192.168.1.118","TLSv1.2","1484","Application Data"
"199","0.412066050","172.217.10.150","192.168.1.118","TLSv1.2","1484","Application Data"
"200","0.412368175","192.168.1.118","172.217.10.150","TCP","66","36540 → 443 [ACK] Seq=1238 Ack=15434 Win=61312 Len=0 TSval=121712454 TSecr=692005786"
"201","0.412701037","192.168.1.118","172.217.10.150","TLSv1.2","363","Application Data"
"202","0.412957737","172.217.10.150","192.168.1.118","TLSv1.2","1484","Application Data"
"203","0.413048187","172.217.10.150","192.168.1.118","TLSv1.2","1484","Application Data"
"204","0.413106725","192.168.1.118","172.217.10.150","TCP","66","36534 → 443 [ACK] Seq=1317 Ack=16077 Win=63104 Len=0 TSval=121712455 TSecr=692005786"
"205","0.415041337","172.217.10.150","192.168.1.118","TLSv1.2","1484","Application Data"
"206","0.415657050","192.168.1.118","172.217.10.150","TLSv1.2","363","Application Data"
"207","0.416629075","172.217.10.150","192.168.1.118","TLSv1.2","2902","Application Data, Application Data"
"208","0.418252300","172.217.10.150","192.168.1.118","TLSv1.2","2902","Application Data, Application Data"
"209","0.418482850","192.168.1.118","172.217.10.150","TCP","66","36540 → 443 [ACK] Seq=1238 Ack=19688 Win=61056 Len=0 TSval=121712460 TSecr=692005787"
"210","0.418597037","192.168.1.118","172.217.10.150","TCP","66","36534 → 443 [ACK] Seq=1317 Ack=20331 Win=61056 Len=0 TSval=121712460 TSecr=692005787"
"211","0.418989200","172.217.10.150","192.168.1.118","TCP","66","443 → 36532 [ACK] Seq=12798 Ack=1238 Win=63488 Len=0 TSval=3847263989 TSecr=121712435"
"212","0.419060500","172.217.10.150","192.168.1.118","TLSv1.2","1484","Application Data"
"213","0.423958512","172.217.10.150","192.168.1.118","TLSv1.2","485","Application Data"
"214","0.424060350","192.168.1.118","172.217.10.150","TCP","66","36540 → 443 [ACK] Seq=1238 Ack=21525 Win=63104 Len=0 TSval=121712466 TSecr=692005791"
"215","0.424153225","172.217.10.150","192.168.1.118","TLSv1.2","1484","Application Data"
"216","0.424260425","172.217.10.150","192.168.1.118","TLSv1.2","554","Application Data"
"217","0.424315812","192.168.1.118","172.217.10.150","TCP","66","36534 → 443 [ACK] Seq=1317 Ack=22237 Win=61056 Len=0 TSval=121712466 TSecr=692005792"
"218","0.428432437","172.217.10.150","192.168.1.118","TLSv1.2","1484","Application Data"
"219","0.428553437","172.217.10.150","192.168.1.118","TLSv1.2","2902","Application Data, Application Data"
"220","0.428620925","172.217.10.33","192.168.1.118","TLSv1.2","1484","Application Data"
"221","0.428713462","172.217.10.33","192.168.1.118","TLSv1.2","2902","Application Data, Application Data"
"222","0.428731862","192.168.1.118","172.217.10.150","TCP","66","36532 → 443 [ACK] Seq=1238 Ack=17052 Win=59904 Len=0 TSval=121712470 TSecr=3847264000"
"223","0.428796487","172.217.10.33","192.168.1.118","TLSv1.2","2902","Application Data, Application Data"
"224","0.429063162","192.168.1.118","172.217.10.150","TLSv1.2","363","Application Data"
"225","0.429161900","192.168.1.118","172.217.10.150","TLSv1.2","363","Application Data"
"226","0.429209025","192.168.1.118","172.217.10.33","TCP","66","43406 → 443 [ACK] Seq=916 Ack=12375 Win=57088 Len=0 TSval=685640507 TSecr=1542101652"
"227","0.431492162","172.217.10.33","192.168.1.118","TLSv1.2","1813","Application Data, Application Data"
"228","0.431560250","172.217.10.150","192.168.1.118","TLSv1.2","2902","Application Data, Application Data"
"229","0.431617425","192.168.1.118","172.217.10.33","TCP","66","43406 → 443 [ACK] Seq=916 Ack=14122 Win=55424 Len=0 TSval=685640509 TSecr=1542101655"
"230","0.431709575","192.168.1.118","172.217.10.150","TCP","66","36532 → 443 [ACK] Seq=1238 Ack=19888 Win=57088 Len=0 TSval=121712473 TSecr=3847264003"
"231","0.436167200","172.217.10.150","192.168.1.118","TLSv1.2","2041","Application Data, Application Data"
"232","0.436257950","192.168.1.118","172.217.10.150","TCP","66","36532 → 443 [ACK] Seq=1238 Ack=21863 Win=61056 Len=0 TSval=121712478 TSecr=3847264005"
"233","0.438646387","172.217.10.150","192.168.1.118","TLSv1.2","1484","Application Data"
"234","0.438765837","172.217.10.150","192.168.1.118","TLSv1.2","2902","Application Data, Application Data"
"235","0.438814037","172.217.10.150","192.168.1.118","TLSv1.2","1484","Application Data"
"236","0.438912075","172.217.10.150","192.168.1.118","TLSv1.2","2902","Application Data, Application Data"
"237","0.438980412","172.217.10.150","192.168.1.118","TLSv1.2","2902","Application Data, Application Data"
"238","0.439047600","192.168.1.118","142.250.64.67","TCP","66","35488 → 443 [ACK] Seq=968 Ack=3113 Win=64128 Len=0 TSval=282328038 TSecr=1746393008"
"239","0.439503675","192.168.1.118","172.217.10.150","TCP","66","36536 → 443 [ACK] Seq=1535 Ack=24388 Win=57088 Len=0 TSval=121712481 TSecr=8842368"
"240","0.440590462","192.168.1.118","172.217.10.150","TCP","66","36538 → 443 [ACK] Seq=1535 Ack=26870 Win=59904 Len=0 TSval=121712482 TSecr=2930093968"
"241","0.441308212","192.168.1.118","172.217.10.150","TLSv1.2","363","Application Data"
"242","0.450684212","172.217.10.150","192.168.1.118","TLSv1.2","2902","Application Data, Application Data"
"243","0.450754175","192.168.1.118","172.217.10.150","TCP","66","36536 → 443 [ACK] Seq=1535 Ack=27224 Win=61056 Len=0 TSval=121712493 TSecr=8842371"
"244","0.450789937","172.217.10.150","192.168.1.118","TLSv1.2","2902","Application Data, Application Data"
"245","0.450822287","192.168.1.118","172.217.10.150","TCP","66","36538 → 443 [ACK] Seq=1535 Ack=29706 Win=61056 Len=0 TSval=121712493 TSecr=2930093971"
"246","0.450933562","172.217.10.150","192.168.1.118","TLSv1.2","2902","Application Data, Application Data"
"247","0.450958937","172.217.10.150","192.168.1.118","TLSv1.2","739","Application Data"
"248","0.450990275","172.217.10.150","192.168.1.118","TLSv1.2","2314","Application Data, Application Data"
"249","0.453512075","192.168.1.118","172.217.10.150","TCP","66","36536 → 443 [ACK] Seq=1535 Ack=30733 Win=57600 Len=0 TSval=121712495 TSecr=8842373"
"250","0.453630375","192.168.1.118","172.217.10.150","TCP","66","36538 → 443 [ACK] Seq=1535 Ack=31954 Win=58880 Len=0 TSval=121712495 TSecr=2930093974"
"251","0.458812450","192.168.1.118","172.217.10.150","TLSv1.2","363","Application Data"
"252","0.461434475","192.168.1.118","172.217.10.150","TLSv1.2","363","Application Data"
"253","0.478303812","172.217.10.150","192.168.1.118","TLSv1.2","1484","Application Data"
"254","0.478454000","172.217.10.150","192.168.1.118","TLSv1.2","2902","Application Data, Application Data"
"255","0.478566587","172.217.10.150","192.168.1.118","TLSv1.2","2902","Application Data, Application Data"
"256","0.478668787","172.217.10.150","192.168.1.118","TLSv1.2","2902","Application Data, Application Data"
"257","0.478708925","172.217.10.150","192.168.1.118","TLSv1.2","564","Application Data"
"258","0.478767900","172.217.10.150","192.168.1.118","TLSv1.2","1484","Application Data"
"259","0.479433425","172.217.10.150","192.168.1.118","TLSv1.2","1484","Application Data"
"260","0.479584637","172.217.10.150","192.168.1.118","TLSv1.2","2902","Application Data, Application Data"
"261","0.479682537","172.217.10.150","192.168.1.118","TLSv1.2","2902","Application Data, Application Data"
"262","0.480085637","192.168.1.118","172.217.10.150","TCP","66","36540 → 443 [ACK] Seq=1535 Ack=31949 Win=53760 Len=0 TSval=121712522 TSecr=692005830"
"263","0.480379587","192.168.1.118","172.217.10.150","TCP","66","36534 → 443 [ACK] Seq=1614 Ack=26491 Win=59904 Len=0 TSval=121712522 TSecr=692005851"
"264","0.480506825","192.168.1.118","172.217.10.150","TCP","66","36532 → 443 [ACK] Seq=1535 Ack=26117 Win=64128 Len=0 TSval=121712522 TSecr=3847264050"
"265","0.481113537","172.217.10.150","192.168.1.118","TLSv1.2","1484","Application Data"
"266","0.482111437","172.217.10.150","192.168.1.118","TLSv1.2","2902","Application Data, Application Data"
"267","0.482200125","172.217.10.150","192.168.1.118","TLSv1.2","2902","Application Data, Application Data"
"268","0.482289600","192.168.1.118","172.217.10.150","TCP","66","36532 → 443 [ACK] Seq=1535 Ack=30371 Win=72704 Len=0 TSval=121712524 TSecr=3847264053"
"269","0.482349637","172.217.10.150","192.168.1.118","TLSv1.2","1484","Application Data"
"270","0.482707262","192.168.1.118","172.217.10.150","TCP","66","36534 → 443 [ACK] Seq=1614 Ack=30745 Win=55680 Len=0 TSval=121712524 TSecr=692005854"
"271","0.490410375","192.168.1.118","172.217.10.150","TLSv1.2","363","Application Data"
"272","0.512846375","172.217.10.150","192.168.1.118","TLSv1.2","337","Application Data"
"273","0.512979162","172.217.10.150","192.168.1.118","TLSv1.2","1484","Application Data"
"274","0.513051437","172.217.10.150","192.168.1.118","TLSv1.2","2083","Application Data, Application Data"
"275","0.513129487","192.168.1.118","172.217.10.150","TCP","66","36534 → 443 [ACK] Seq=1614 Ack=34180 Win=59008 Len=0 TSval=121712555 TSecr=692005857"
"276","0.513226612","172.217.10.150","192.168.1.118","TLSv1.2","1484","Application Data"
"277","0.513338625","172.217.10.150","192.168.1.118","TLSv1.2","2902","Application Data, Application Data"
"278","0.514762912","172.217.10.150","192.168.1.118","TLSv1.2","2902","Application Data, Application Data"
"279","0.514841412","172.217.10.150","192.168.1.118","TLSv1.2","1484","Application Data"
"280","0.515464887","192.168.1.118","172.217.10.150","TCP","66","36536 → 443 [ACK] Seq=1832 Ack=39241 Win=55680 Len=0 TSval=121712557 TSecr=8842422"
"281","0.515605212","172.217.10.150","192.168.1.118","TLSv1.2","1252","Application Data"
"282","0.515714450","172.217.10.150","192.168.1.118","TLSv1.2","1484","Application Data"
"283","0.515826200","172.217.10.150","192.168.1.118","TLSv1.2","2902","Application Data, Application Data"
"284","0.515965350","172.217.10.150","192.168.1.118","TLSv1.2","2902","Application Data, Application Data"
"285","0.518295775","192.168.1.118","172.217.10.150","TCP","66","36538 → 443 [ACK] Seq=1832 Ack=39044 Win=57088 Len=0 TSval=121712560 TSecr=2930094033"
"286","0.518492250","192.168.1.118","172.217.10.150","TLSv1.2","363","Application Data"
"287","0.519188050","172.217.10.150","192.168.1.118","TLSv1.2","759","Application Data"
"288","0.520952512","172.217.10.150","192.168.1.118","TLSv1.2","1484","Application Data"
"289","0.521747912","192.168.1.118","172.217.10.150","TLSv1.2","363","Application Data"
"290","0.522591837","172.217.10.150","192.168.1.118","TLSv1.2","2902","Application Data, Application Data"
"291","0.524056025","192.168.1.118","172.217.10.150","TCP","66","36540 → 443 [ACK] Seq=1832 Ack=36203 Win=61056 Len=0 TSval=121712566 TSecr=692005896"
"292","0.527179862","192.168.1.118","172.217.10.150","TLSv1.2","376","Application Data"
"293","0.527309675","192.168.1.118","172.217.10.150","TLSv1.2","363","Application Data"
"294","0.533159762","172.217.10.150","192.168.1.118","TLSv1.2","1676","Application Data, Application Data"
"295","0.533273612","192.168.1.118","172.217.10.150","TCP","66","36540 → 443 [ACK] Seq=1832 Ack=37813 Win=61056 Len=0 TSval=121712575 TSecr=692005899"
"296","0.537320462","192.168.1.118","172.217.10.150","TLSv1.2","363","Application Data"
"297","0.539508937","172.217.10.150","192.168.1.118","TLSv1.2","1484","Application Data"
"298","0.541054512","172.217.10.150","192.168.1.118","TLSv1.2","2902","Application Data, Application Data"
"299","0.541181850","192.168.1.118","172.217.10.150","TCP","66","36532 → 443 [ACK] Seq=1832 Ack=34896 Win=83968 Len=0 TSval=121712583 TSecr=3847264114"
"300","0.546589712","172.217.10.150","192.168.1.118","TLSv1.2","1484","Application Data"
"301","0.548671687","172.217.10.150","192.168.1.118","TLSv1.2","1484","Application Data"
"302","0.548797762","192.168.1.118","172.217.10.150","TCP","66","36532 → 443 [ACK] Seq=1832 Ack=37732 Win=89728 Len=0 TSval=121712591 TSecr=3847264117"
"303","0.548975137","172.217.10.150","192.168.1.118","TLSv1.2","2902","Application Data, Application Data"
"304","0.549051587","192.168.1.118","172.217.10.150","TCP","66","36532 → 443 [ACK] Seq=1832 Ack=40568 Win=95360 Len=0 TSval=121712591 TSecr=3847264120"
"305","0.549097175","172.217.10.150","192.168.1.118","TLSv1.2","184","Application Data"
"306","0.556959800","192.168.1.118","172.217.10.150","TLSv1.2","363","Application Data"
"307","0.559708712","172.217.10.150","192.168.1.118","TLSv1.2","1484","Application Data"
"308","0.562913162","172.217.10.150","192.168.1.118","TLSv1.2","1484","Application Data"
"309","0.562980100","172.217.10.150","192.168.1.118","TLSv1.2","1484","Application Data"
"310","0.563016525","172.217.10.150","192.168.1.118","TLSv1.2","2902","Application Data, Application Data"
"311","0.563397387","172.217.10.150","192.168.1.118","TLSv1.2","2902","Application Data, Application Data"
"312","0.563433987","172.217.10.150","192.168.1.118","TLSv1.2","2902","Application Data, Application Data"
"313","0.565157162","192.168.1.118","172.217.10.150","TCP","66","36534 → 443 [ACK] Seq=1911 Ack=38434 Win=61056 Len=0 TSval=121712607 TSecr=692005936"
"314","0.565256412","192.168.1.118","172.217.10.150","TCP","66","36536 → 443 [ACK] Seq=2142 Ack=44681 Win=59904 Len=0 TSval=121712607 TSecr=8842494"
"315","0.565395300","192.168.1.118","172.217.10.150","TCP","66","36538 → 443 [ACK] Seq=2129 Ack=43991 Win=59904 Len=0 TSval=121712607 TSecr=2930094092"
"316","0.565536062","172.217.10.150","192.168.1.118","TLSv1.2","2902","Application Data, Application Data"
"317","0.565586400","172.217.10.150","192.168.1.118","TLSv1.2","1484","Application Data"
"318","0.565597087","192.168.1.118","172.217.10.150","TCP","66","36536 → 443 [ACK] Seq=2142 Ack=47517 Win=57088 Len=0 TSval=121712607 TSecr=8842495"
"319","0.566658962","172.217.10.150","192.168.1.118","TLSv1.2","1705","Application Data, Application Data"
"320","0.566692550","172.217.10.150","192.168.1.118","TLSv1.2","1988","Application Data, Application Data"
"321","0.566715687","172.217.10.150","192.168.1.118","TLSv1.2","1484","Application Data"
"322","0.566749125","192.168.1.118","172.217.10.150","TCP","66","36534 → 443 [ACK] Seq=1911 Ack=41270 Win=61056 Len=0 TSval=121712609 TSecr=692005939"
"323","0.568223737","172.217.10.150","192.168.1.118","TLSv1.2","1568","Application Data, Application Data"
"324","0.569000237","192.168.1.118","172.217.10.150","TCP","66","36534 → 443 [ACK] Seq=1911 Ack=42772 Win=59648 Len=0 TSval=121712611 TSecr=692005942"
"325","0.569102112","192.168.1.118","172.217.10.150","TCP","66","36536 → 443 [ACK] Seq=2142 Ack=49439 Win=55168 Len=0 TSval=121712611 TSecr=8842497"
"326","0.569156000","192.168.1.118","172.217.10.150","TCP","66","36538 → 443 [ACK] Seq=2129 Ack=45630 Win=58368 Len=0 TSval=121712611 TSecr=2930094095"
"327","0.574678800","192.168.1.118","172.217.10.150","TLSv1.2","363","Application Data"
"328","0.574797962","192.168.1.118","172.217.10.150","TLSv1.2","363","Application Data"
"329","0.579293062","172.217.10.150","192.168.1.118","TLSv1.2","1484","Application Data"
"330","0.582497587","172.217.10.150","192.168.1.118","TLSv1.2","2902","Application Data, Application Data"
"331","0.584460912","192.168.1.118","172.217.10.150","TCP","66","36540 → 443 [ACK] Seq=2129 Ack=42067 Win=61056 Len=0 TSval=121712626 TSecr=692005956"
"332","0.589297625","172.217.10.150","192.168.1.118","TLSv1.2","2902","Application Data, Application Data"
"333","0.589389537","192.168.1.118","172.217.10.150","TCP","66","36540 → 443 [ACK] Seq=2129 Ack=44903 Win=61056 Len=0 TSval=121712631 TSecr=692005959"
"334","0.589463525","172.217.10.150","192.168.1.118","TLSv1.2","2902","Application Data, Application Data"
"335","0.590689575","192.168.1.118","172.217.10.150","TCP","66","36540 → 443 [ACK] Seq=2129 Ack=47739 Win=58240 Len=0 TSval=121712632 TSecr=692005961"
"336","0.592746762","172.217.10.150","192.168.1.118","TLSv1.2","315","Application Data"
"337","0.592844300","172.217.10.150","192.168.1.118","TLSv1.2","1484","Application Data"
"338","0.592974037","172.217.10.150","192.168.1.118","TLSv1.2","2902","Application Data, Application Data"
"339","0.593052637","192.168.1.118","172.217.10.150","TCP","66","36532 → 443 [ACK] Seq=2129 Ack=44940 Win=103808 Len=0 TSval=121712635 TSecr=3847264164"
"340","0.594181162","172.217.10.150","192.168.1.118","TLSv1.2","2902","Application Data, Application Data"
"341","0.594285700","192.168.1.118","172.217.10.150","TCP","66","36532 → 443 [ACK] Seq=2129 Ack=47776 Win=109568 Len=0 TSval=121712636 TSecr=3847264167"
"342","0.603776525","172.217.10.150","192.168.1.118","TLSv1.2","1484","Application Data"
"343","0.607023500","172.217.10.150","192.168.1.118","TLSv1.2","1363","Application Data"
"344","0.607150600","192.168.1.118","172.217.10.150","TCP","66","36532 → 443 [ACK] Seq=2129 Ack=50491 Win=115200 Len=0 TSval=121712649 TSecr=3847264170"
"345","0.607260350","172.217.10.150","192.168.1.118","TLSv1.2","1484","Application Data"
"346","0.608809375","172.217.10.150","192.168.1.118","TLSv1.2","1484","Application Data"
"347","0.609020675","172.217.10.150","192.168.1.118","TLSv1.2","2902","Application Data, Application Data"
"348","0.609125650","172.217.10.150","192.168.1.118","TLSv1.2","2902","Application Data, Application Data"
"349","0.609206700","172.217.10.150","192.168.1.118","TLSv1.2","1484","Application Data"
"350","0.609454925","172.217.10.150","192.168.1.118","TLSv1.2","1484","Application Data"
"351","0.609600525","172.217.10.150","192.168.1.118","TLSv1.2","2902","Application Data, Application Data"
"352","0.609683450","172.217.10.150","192.168.1.118","TLSv1.2","2203","Application Data, Application Data"
"353","0.609740550","172.217.10.150","192.168.1.118","TLSv1.2","2902","Application Data, Application Data"
"354","0.610621512","192.168.1.118","172.217.10.150","TCP","66","36534 → 443 [ACK] Seq=2208 Ack=49862 Win=57088 Len=0 TSval=121712652 TSecr=692005976"
"355","0.610836137","192.168.1.118","172.217.10.150","TCP","66","36536 → 443 [ACK] Seq=2439 Ack=61502 Win=52096 Len=0 TSval=121712653 TSecr=8842534"
"356","0.612304525","172.217.10.150","192.168.1.118","TLSv1.2","1934","Application Data, Application Data"
"357","0.613189350","192.168.1.118","172.217.10.150","TCP","66","36534 → 443 [ACK] Seq=2208 Ack=51730 Win=55296 Len=0 TSval=121712655 TSecr=692005982"
"358","0.633085212","192.168.1.118","172.217.10.150","TCP","66","36540 → 443 [ACK] Seq=2129 Ack=47988 Win=64128 Len=0 TSval=121712675 TSecr=692005963"
"359","1.116632125","192.168.1.104","255.255.255.255","UDP","217","49154 → 6666 Len=175"
"360","3.423802462","192.168.1.118","192.168.1.102","TCP","176","40160 → 8009 [PSH, ACK] Seq=1 Ack=1 Win=501 Len=110 TSval=2233394340 TSecr=2322551 [TCP segment of a reassembled PDU]"
"361","3.430042600","192.168.1.102","192.168.1.118","TCP","176","8009 → 40160 [PSH, ACK] Seq=1 Ack=111 Win=344 Len=110 TSval=2323052 TSecr=2233394340 [TCP segment of a reassembled PDU]"
"362","3.430208212","192.168.1.118","192.168.1.102","TCP","66","40160 → 8009 [ACK] Seq=111 Ack=111 Win=501 Len=0 TSval=2233394346 TSecr=2323052"
"363","4.188614537","192.168.1.104","255.255.255.255","UDP","217","49154 → 6666 Len=175"
"364","5.887631112","IntelCor_b7:52:73","Cisco-Li_5b:1c:ce","ARP","60","Who has 192.168.1.1? Tell 192.168.1.118"
"365","5.891783787","Cisco-Li_5b:1c:ce","IntelCor_b7:52:73","ARP","42","192.168.1.1 is at 58:6d:8f:5b:1c:ce"
"366","7.157928037","192.168.1.104","255.255.255.255","UDP","217","49154 → 6666 Len=175"
"367","8.435282725","192.168.1.118","192.168.1.102","TCP","176","40160 → 8009 [PSH, ACK] Seq=111 Ack=111 Win=501 Len=110 TSval=2233399351 TSecr=2323052 [TCP segment of a reassembled PDU]"
"368","8.440256800","192.168.1.102","192.168.1.118","TCP","176","8009 → 40160 [PSH, ACK] Seq=111 Ack=221 Win=344 Len=110 TSval=2323553 TSecr=2233399351 [TCP segment of a reassembled PDU]"
"369","8.440442112","192.168.1.118","192.168.1.102","TCP","66","40160 → 8009 [ACK] Seq=221 Ack=221 Win=501 Len=0 TSval=2233399356 TSecr=2323553"
