frame.number,_ws.col.Time,_ws.col.Source,_ws.col.Destination,_ws.col.Protocol,frame.len,_ws.col.Info
"1","0.000000000","69.192.109.199","192.168.1.118","TCP","74","443 → 35176 [SYN, ACK] Seq=0 Ack=1 Win=28960 Len=0 MSS=1460 SACK_PERM=1 TSval=691909958 TSecr=106517137 WS=128"
"2","0.000103487","192.168.1.118","69.192.109.199","TCP","66","35176 → 443 [ACK] Seq=1 Ack=1 Win=502 Len=0 TSval=106517172 TSecr=691909958"
"3","0.013197300","69.192.109.199","192.168.1.118","TCP","74","443 → 35178 [SYN, ACK] Seq=0 Ack=1 Win=28960 Len=0 MSS=1460 SACK_PERM=1 TSval=691909967 TSecr=106517138 WS=128"
"4","0.013309975","192.168.1.118","69.192.109.199","TCP","66","35178 → 443 [ACK] Seq=1 Ack=1 Win=502 Len=0 TSval=106517185 TSecr=691909967"
"5","0.016390662","192.168.1.118","69.192.109.199","TLSv1","583","Client Hello"
"6","0.032966325","192.168.1.118","69.192.109.199","TLSv1","583","Client Hello"
"7","0.054628900","69.192.109.199","192.168.1.118","TCP","66","443 → 35178 [ACK] Seq=1 Ack=518 Win=30080 Len=0 TSval=691910013 TSecr=106517205"
"8","0.055809462","69.192.109.199","192.168.1.118","TCP","66","443 → 35176 [ACK] Seq=1 Ack=518 Win=30080 Len=0 TSval=691910013 TSecr=106517189"
"9","0.059553675","69.192.109.199","192.168.1.118","TLSv1.2","2962","Server Hello"
"10","0.059654112","192.168.1.118","69.192.109.199","TCP","66","35178 → 443 [ACK] Seq=518 Ack=2897 Win=480 Len=0 TSval=106517232 TSecr=691910015"
"11","0.060336837","69.192.109.199","192.168.1.118","TLSv1.2","534","Certificate, Server Key Exchange, Server Hello Done"
"12","0.060413725","192.168.1.118","69.192.109.199","TCP","66","35178 → 443 [ACK] Seq=518 Ack=3365 Win=493 Len=0 TSval=106517233 TSecr=691910015"
"13","0.060539462","69.192.109.199","192.168.1.118","TLSv1.2","1514","Server Hello"
"14","0.060619462","192.168.1.118","69.192.109.199","TCP","66","35176 → 443 [ACK] Seq=518 Ack=1449 Win=493 Len=0 TSval=106517233 TSecr=691910015"
"15","0.064971687","192.168.1.118","69.192.109.199","TLSv1.2","192","Client Key Exchange, Change Cipher Spec, Encrypted Handshake Message"
"16","0.069268987","69.192.109.199","192.168.1.118","TLSv1.2","1982","Certificate, Server Key Exchange, Server Hello Done"
"17","0.069337762","192.168.1.118","69.192.109.199","TCP","66","35176 → 443 [ACK] Seq=518 Ack=3365 Win=479 Len=0 TSval=106517241 TSecr=691910015"
"18","0.071386687","192.168.1.118","69.192.109.199","TLSv1.2","192","Client Key Exchange, Change Cipher Spec, Encrypted Handshake Message"
"19","0.093821262","69.192.109.199","192.168.1.118","TLSv1.2","117","Change Cipher Spec, Encrypted Handshake Message"
"20","0.094585550","192.168.1.118","69.192.109.199","TLSv1.2","261","Application Data"
"21","0.099422825","69.192.109.199","192.168.1.118","TLSv1.2","117","Change Cipher Spec, Encrypted Handshake Message"
"22","0.099893562","192.168.1.118","69.192.109.199","TLSv1.2","277","Application Data"
"23","0.114980837","69.192.109.199","192.168.1.118","TCP","1514","[TCP segment of a reassembled PDU]"
"24","0.119527237","69.192.109.199","192.168.1.118","TLSv1.2","613","Application Data"
"25","0.119661812","192.168.1.118","69.192.109.199","TCP","66","35178 → 443 [ACK] Seq=839 Ack=5411 Win=501 Len=0 TSval=106517292 TSecr=691910073"
"26","0.127810675","69.192.109.199","192.168.1.118","TCP","1514","[TCP segment of a reassembled PDU]"
"27","0.129586025","69.192.109.199","192.168.1.118","TCP","8754","443 → 35176 [ACK] Seq=4864 Ack=855 Win=31104 Len=8688 TSval=691910085 TSecr=106517272 [TCP segment of a reassembled PDU]"
"28","0.129824575","69.192.109.199","192.168.1.118","TCP","4410","443 → 35176 [ACK] Seq=13552 Ack=855 Win=31104 Len=4344 TSval=691910085 TSecr=106517272 [TCP segment of a reassembled PDU]"
"29","0.130197500","192.168.1.118","69.192.109.199","TCP","66","35176 → 443 [ACK] Seq=855 Ack=17896 Win=501 Len=0 TSval=106517302 TSecr=691910085"
"30","0.132431100","69.192.109.199","192.168.1.118","TLSv1.2","4514","Application Data, Application Data"
"31","0.132628750","192.168.1.118","69.192.109.199","TCP","66","35176 → 443 [ACK] Seq=855 Ack=22344 Win=467 Len=0 TSval=106517305 TSecr=691910086"
"32","4.396276912","192.168.1.118","192.168.1.102","TCP","176","40160 → 8009 [PSH, ACK] Seq=1 Ack=1 Win=501 Len=110 TSval=2233515039 TSecr=2334620 [TCP segment of a reassembled PDU]"
"33","4.408344400","192.168.1.102","192.168.1.118","TCP","176","8009 → 40160 [PSH, ACK] Seq=1 Ack=111 Win=344 Len=110 TSval=2335122 TSecr=2233515039 [TCP segment of a reassembled PDU]"
"34","4.408555612","192.168.1.118","192.168.1.102","TCP","66","40160 → 8009 [ACK] Seq=111 Ack=111 Win=501 Len=0 TSval=2233515052 TSecr=2335122"
"35","4.473642975","192.168.1.104","255.255.255.255","UDP","217","49154 → 6666 Len=175"
"36","7.443744550","192.168.1.104","255.255.255.255","UDP","217","49154 → 6666 Len=175"
"37","9.414935037","192.168.1.118","192.168.1.102","TCP","176","40160 → 8009 [PSH, ACK] Seq=111 Ack=111 Win=501 Len=110 TSval=2233520058 TSecr=2335122 [TCP segment of a reassembled PDU]"
"38","9.436639187","192.168.1.102","192.168.1.118","TCP","176","8009 → 40160 [PSH, ACK] Seq=111 Ack=221 Win=344 Len=110 TSval=2335624 TSecr=2233520058 [TCP segment of a reassembled PDU]"
"39","9.436805675","192.168.1.118","192.168.1.102","TCP","66","40160 → 8009 [ACK] Seq=221 Ack=221 Win=501 Len=0 TSval=2233520080 TSecr=2335624"
