frame.number,_ws.col.Time,_ws.col.Source,_ws.col.Destination,_ws.col.Protocol,frame.len,_ws.col.Info
"1","0.000000000","136.147.57.1","192.168.1.118","TCP","1414","[TCP segment of a reassembled PDU]"
"2","0.000095050","192.168.1.118","136.147.57.1","TCP","74","35234 → 443 [SYN] Seq=0 Win=64240 Len=0 MSS=1460 SACK_PERM=1 TSval=3266395133 TSecr=0 WS=128"
"3","0.003468337","136.147.57.1","192.168.1.118","TCP","6390","443 → 35232 [PSH, ACK] Seq=1349 Ack=1 Win=4926 Len=6324 TSval=590592199 TSecr=3266395014 [TCP segment of a reassembled PDU]"
"4","0.003527912","136.147.57.1","192.168.1.118","TCP","423","443 → 35232 [PSH, ACK] Seq=7673 Ack=1 Win=4926 Len=357 TSval=590592199 TSecr=3266395014 [TCP segment of a reassembled PDU]"
"5","0.005248250","192.168.1.118","136.147.57.1","TCP","66","35232 → 443 [ACK] Seq=1 Ack=8030 Win=63356 Len=0 TSval=3266395138 TSecr=590592199"
"6","0.121511175","136.147.57.1","192.168.1.118","TCP","1414","443 → 35232 [ACK] Seq=8030 Ack=1 Win=4926 Len=1348 TSval=590592329 TSecr=3266395123 [TCP segment of a reassembled PDU]"
"7","0.122229187","136.147.57.1","192.168.1.118","TCP","1241","443 → 35232 [PSH, ACK] Seq=9378 Ack=1 Win=4926 Len=1175 TSval=590592329 TSecr=3266395123 [TCP segment of a reassembled PDU]"
"8","0.122357012","192.168.1.118","136.147.57.1","TCP","66","35232 → 443 [ACK] Seq=1 Ack=10553 Win=64704 Len=0 TSval=3266395255 TSecr=590592329"
"9","0.122462300","136.147.57.1","192.168.1.118","TCP","74","443 → 35234 [SYN, ACK] Seq=0 Ack=1 Win=4380 Len=0 MSS=1360 TSval=590592329 TSecr=3266395133 SACK_PERM=1"
"10","0.122598825","192.168.1.118","136.147.57.1","TCP","66","35234 → 443 [ACK] Seq=1 Ack=1 Win=64240 Len=0 TSval=3266395255 TSecr=590592329"
"11","0.130065212","136.147.57.1","192.168.1.118","TCP","1414","443 → 35232 [ACK] Seq=10553 Ack=1 Win=4926 Len=1348 TSval=590592338 TSecr=3266395138 [TCP segment of a reassembled PDU]"
"12","0.132891112","136.147.57.1","192.168.1.118","TLSv1.2","6806","Application Data, Application Data"
"13","0.133932562","136.147.57.1","192.168.1.118","TCP","2796","443 → 35232 [PSH, ACK] Seq=18641 Ack=1 Win=4926 Len=2730 TSval=590592338 TSecr=3266395138 [TCP segment of a reassembled PDU]"
"14","0.138989937","192.168.1.118","136.147.57.1","TLSv1","583","Client Hello"
"15","0.139094512","192.168.1.118","136.147.57.1","TCP","66","35232 → 443 [ACK] Seq=1 Ack=21371 Win=53886 Len=0 TSval=3266395272 TSecr=590592338"
"16","0.183876475","192.168.1.118","209.18.47.62","DNS","77","Standard query 0xe585 A c1.sfdcstatic.com"
"17","0.184748150","192.168.1.118","209.18.47.62","DNS","77","Standard query 0xfd4b A c1.sfdcstatic.com"
"18","0.185554237","192.168.1.118","209.18.47.62","DNS","77","Standard query 0x250b A c1.sfdcstatic.com"
"19","0.186523162","192.168.1.118","209.18.47.62","DNS","77","Standard query 0x29b8 A c1.sfdcstatic.com"
"20","0.187170725","136.147.57.1","192.168.1.118","TLSv1.2","1240","Application Data"
"21","0.187699950","192.168.1.118","209.18.47.62","DNS","77","Standard query 0x7919 A c1.sfdcstatic.com"
"22","0.203413575","209.18.47.62","192.168.1.118","DNS","168","Standard query response 0x29b8 A c1.sfdcstatic.com CNAME c.sfdcstatic.com.edgekey.net CNAME e4745.b.akamaiedge.net A 104.102.83.39"
"23","0.204176387","209.18.47.62","192.168.1.118","DNS","168","Standard query response 0x250b A c1.sfdcstatic.com CNAME c.sfdcstatic.com.edgekey.net CNAME e4745.b.akamaiedge.net A 104.102.83.39"
"24","0.204808950","192.168.1.118","209.18.47.62","DNS","77","Standard query 0x3d00 AAAA c1.sfdcstatic.com"
"25","0.204947550","192.168.1.118","209.18.47.62","DNS","77","Standard query 0xd15a AAAA c1.sfdcstatic.com"
"26","0.206801237","209.18.47.62","192.168.1.118","DNS","168","Standard query response 0xfd4b A c1.sfdcstatic.com CNAME c.sfdcstatic.com.edgekey.net CNAME e4745.b.akamaiedge.net A 104.102.83.39"
"27","0.206871950","136.147.57.1","192.168.1.118","TCP","66","443 → 35234 [ACK] Seq=1 Ack=518 Win=4597 Len=0 TSval=590592413 TSecr=3266395272"
"28","0.207870600","192.168.1.118","209.18.47.62","DNS","77","Standard query 0x2982 AAAA c1.sfdcstatic.com"
"29","0.208743875","136.147.57.1","192.168.1.118","TLSv1.2","4110","Server Hello"
"30","0.208819562","192.168.1.118","136.147.57.1","TCP","66","35234 → 443 [ACK] Seq=518 Ack=4045 Win=60196 Len=0 TSval=3266395341 TSecr=590592415"
"31","0.214354300","209.18.47.62","192.168.1.118","DNS","168","Standard query response 0x7919 A c1.sfdcstatic.com CNAME c.sfdcstatic.com.edgekey.net CNAME e4745.b.akamaiedge.net A 104.102.83.39"
"32","0.214567162","192.168.1.118","209.18.47.62","DNS","77","Standard query 0x251e AAAA c1.sfdcstatic.com"
"33","0.216508350","209.18.47.62","192.168.1.118","DNS","168","Standard query response 0xe585 A c1.sfdcstatic.com CNAME c.sfdcstatic.com.edgekey.net CNAME e4745.b.akamaiedge.net A 104.102.83.39"
"34","0.216675937","192.168.1.118","209.18.47.62","DNS","77","Standard query 0x3104 AAAA c1.sfdcstatic.com"
"35","0.225210587","209.18.47.62","192.168.1.118","DNS","210","Standard query response 0xd15a AAAA c1.sfdcstatic.com CNAME c.sfdcstatic.com.edgekey.net CNAME e4745.b.akamaiedge.net SOA n0b.akamaiedge.net"
"36","0.225261137","209.18.47.62","192.168.1.118","DNS","210","Standard query response 0x3d00 AAAA c1.sfdcstatic.com CNAME c.sfdcstatic.com.edgekey.net CNAME e4745.b.akamaiedge.net SOA n0b.akamaiedge.net"
"37","0.225980975","192.168.1.118","104.102.83.39","TCP","74","42078 → 443 [SYN] Seq=0 Win=64240 Len=0 MSS=1460 SACK_PERM=1 TSval=2026823582 TSecr=0 WS=128"
"38","0.226142275","192.168.1.118","104.102.83.39","TCP","74","42080 → 443 [SYN] Seq=0 Win=64240 Len=0 MSS=1460 SACK_PERM=1 TSval=2026823583 TSecr=0 WS=128"
"39","0.226235637","192.168.1.118","104.102.83.39","TCP","74","42082 → 443 [SYN] Seq=0 Win=64240 Len=0 MSS=1460 SACK_PERM=1 TSval=2026823583 TSecr=0 WS=128"
"40","0.226335200","192.168.1.118","104.102.83.39","TCP","74","42084 → 443 [SYN] Seq=0 Win=64240 Len=0 MSS=1460 SACK_PERM=1 TSval=2026823583 TSecr=0 WS=128"
"41","0.226428812","192.168.1.118","104.102.83.39","TCP","74","42086 → 443 [SYN] Seq=0 Win=64240 Len=0 MSS=1460 SACK_PERM=1 TSval=2026823583 TSecr=0 WS=128"
"42","0.228194087","192.168.1.118","136.147.57.1","TCP","66","35232 → 443 [ACK] Seq=1 Ack=22545 Win=64704 Len=0 TSval=3266395361 TSecr=590592393"
"43","0.229327050","209.18.47.62","192.168.1.118","DNS","210","Standard query response 0x2982 AAAA c1.sfdcstatic.com CNAME c.sfdcstatic.com.edgekey.net CNAME e4745.b.akamaiedge.net SOA n0b.akamaiedge.net"
"44","0.233573487","209.18.47.62","192.168.1.118","DNS","210","Standard query response 0x251e AAAA c1.sfdcstatic.com CNAME c.sfdcstatic.com.edgekey.net CNAME e4745.b.akamaiedge.net SOA n0b.akamaiedge.net"
"45","0.244161662","209.18.47.62","192.168.1.118","DNS","210","Standard query response 0x3104 AAAA c1.sfdcstatic.com CNAME c.sfdcstatic.com.edgekey.net CNAME e4745.b.akamaiedge.net SOA n0b.akamaiedge.net"
"46","0.245050887","104.102.83.39","192.168.1.118","TCP","74","443 → 42078 [SYN, ACK] Seq=0 Ack=1 Win=28960 Len=0 MSS=1460 SACK_PERM=1 TSval=147296169 TSecr=2026823582 WS=128"
"47","0.245180612","192.168.1.118","104.102.83.39","TCP","66","42078 → 443 [ACK] Seq=1 Ack=1 Win=64256 Len=0 TSval=2026823602 TSecr=147296169"
"48","0.260271400","104.102.83.39","192.168.1.118","TCP","74","443 → 42082 [SYN, ACK] Seq=0 Ack=1 Win=28960 Len=0 MSS=1460 SACK_PERM=1 TSval=147296179 TSecr=2026823583 WS=128"
"49","0.260415037","192.168.1.118","104.102.83.39","TCP","66","42082 → 443 [ACK] Seq=1 Ack=1 Win=64256 Len=0 TSval=2026823617 TSecr=147296179"
"50","0.260980650","104.102.83.39","192.168.1.118","TCP","74","443 → 42080 [SYN, ACK] Seq=0 Ack=1 Win=28960 Len=0 MSS=1460 SACK_PERM=1 TSval=147296179 TSecr=2026823583 WS=128"
"51","0.261061850","192.168.1.118","104.102.83.39","TCP","66","42080 → 443 [ACK] Seq=1 Ack=1 Win=64256 Len=0 TSval=2026823618 TSecr=147296179"
"52","0.261140225","104.102.83.39","192.168.1.118","TCP","74","443 → 42084 [SYN, ACK] Seq=0 Ack=1 Win=28960 Len=0 MSS=1460 SACK_PERM=1 TSval=147296179 TSecr=2026823583 WS=128"
"53","0.261214225","192.168.1.118","104.102.83.39","TCP","66","42084 → 443 [ACK] Seq=1 Ack=1 Win=64256 Len=0 TSval=2026823618 TSecr=147296179"
"54","0.264019375","104.102.83.39","192.168.1.118","TCP","74","443 → 42086 [SYN, ACK] Seq=0 Ack=1 Win=28960 Len=0 MSS=1460 SACK_PERM=1 TSval=147296179 TSecr=2026823583 WS=128"
"55","0.264121362","192.168.1.118","104.102.83.39","TCP","66","42086 → 443 [ACK] Seq=1 Ack=1 Win=64256 Len=0 TSval=2026823621 TSecr=147296179"
"56","0.273748787","136.147.57.1","192.168.1.118","TLSv1.2","1108","Certificate, Server Key Exchange, Server Hello Done"
"57","0.273819275","192.168.1.118","136.147.57.1","TCP","66","35234 → 443 [ACK] Seq=518 Ack=5087 Win=62008 Len=0 TSval=3266395406 TSecr=590592478"
"58","0.274327575","192.168.1.118","104.102.83.39","TLSv1","583","Client Hello"
"59","0.294323425","192.168.1.118","104.102.83.39","TLSv1","583","Client Hello"
"60","0.295743912","104.102.83.39","192.168.1.118","TCP","66","443 → 42078 [ACK] Seq=1 Ack=518 Win=30080 Len=0 TSval=147296219 TSecr=2026823631"
"61","0.298085475","104.102.83.39","192.168.1.118","TLSv1.2","1514","Server Hello"
"62","0.298250025","192.168.1.118","104.102.83.39","TCP","66","42078 → 443 [ACK] Seq=518 Ack=1449 Win=63104 Len=0 TSval=2026823655 TSecr=147296220"
"63","0.303264825","104.102.83.39","192.168.1.118","TLSv1.2","1891","Certificate, Server Key Exchange, Server Hello Done"
"64","0.303401637","192.168.1.118","104.102.83.39","TCP","66","42078 → 443 [ACK] Seq=518 Ack=3274 Win=61312 Len=0 TSval=2026823660 TSecr=147296220"
"65","0.310715637","192.168.1.118","104.102.83.39","TLSv1","583","Client Hello"
"66","0.312765125","192.168.1.118","136.147.57.1","TLSv1.2","192","Client Key Exchange, Change Cipher Spec, Encrypted Handshake Message"
"67","0.312977125","104.102.83.39","192.168.1.118","TCP","66","443 → 42080 [ACK] Seq=1 Ack=518 Win=30080 Len=0 TSval=147296233 TSecr=2026823651"
"68","0.314417575","104.102.83.39","192.168.1.118","TLSv1.2","3339","Server Hello, Certificate, Server Key Exchange, Server Hello Done"
"69","0.314547612","192.168.1.118","104.102.83.39","TCP","66","42080 → 443 [ACK] Seq=518 Ack=3274 Win=61056 Len=0 TSval=2026823671 TSecr=147296235"
"70","0.329036400","192.168.1.118","104.102.83.39","TLSv1","583","Client Hello"
"71","0.345300450","192.168.1.118","104.102.83.39","TLSv1","583","Client Hello"
"72","0.347303787","192.168.1.118","104.102.83.39","TLSv1.2","192","Client Key Exchange, Change Cipher Spec, Encrypted Handshake Message"
"73","0.349182912","192.168.1.118","104.102.83.39","TLSv1.2","192","Client Key Exchange, Change Cipher Spec, Encrypted Handshake Message"
"74","0.352300012","104.102.83.39","192.168.1.118","TCP","66","443 → 42082 [ACK] Seq=1 Ack=518 Win=30080 Len=0 TSval=147296269 TSecr=2026823667"
"75","0.354405900","104.102.83.39","192.168.1.118","TLSv1.2","3339","Server Hello, Certificate, Server Key Exchange, Server Hello Done"
"76","0.354540012","192.168.1.118","104.102.83.39","TCP","66","42082 → 443 [ACK] Seq=518 Ack=3274 Win=61056 Len=0 TSval=2026823711 TSecr=147296270"
"77","0.354637700","104.102.83.39","192.168.1.118","TCP","66","443 → 42084 [ACK] Seq=1 Ack=518 Win=30080 Len=0 TSval=147296273 TSecr=2026823686"
"78","0.354776962","104.102.83.39","192.168.1.118","TLSv1.2","3339","Server Hello, Certificate, Server Key Exchange, Server Hello Done"
"79","0.354854762","192.168.1.118","104.102.83.39","TCP","66","42084 → 443 [ACK] Seq=518 Ack=3274 Win=61056 Len=0 TSval=2026823711 TSecr=147296275"
"80","0.358800962","192.168.1.118","104.102.83.39","TLSv1.2","192","Client Key Exchange, Change Cipher Spec, Encrypted Handshake Message"
"81","0.360699212","192.168.1.118","104.102.83.39","TLSv1.2","192","Client Key Exchange, Change Cipher Spec, Encrypted Handshake Message"
"82","0.379244537","104.102.83.39","192.168.1.118","TCP","66","443 → 42086 [ACK] Seq=1 Ack=518 Win=30080 Len=0 TSval=147296303 TSecr=2026823702"
"83","0.383141125","104.102.83.39","192.168.1.118","TLSv1.2","1514","Server Hello"
"84","0.383275275","192.168.1.118","104.102.83.39","TCP","66","42086 → 443 [ACK] Seq=518 Ack=1449 Win=63104 Len=0 TSval=2026823740 TSecr=147296304"
"85","0.384071087","104.102.83.39","192.168.1.118","TCP","1514","443 → 42086 [ACK] Seq=1449 Ack=518 Win=30080 Len=1448 TSval=147296304 TSecr=2026823702 [TCP segment of a reassembled PDU]"
"86","0.384236737","192.168.1.118","104.102.83.39","TCP","66","42086 → 443 [ACK] Seq=518 Ack=2897 Win=63104 Len=0 TSval=2026823741 TSecr=147296304"
"87","0.384307100","104.102.83.39","192.168.1.118","TLSv1.2","443","Certificate, Server Key Exchange, Server Hello Done"
"88","0.384381112","192.168.1.118","104.102.83.39","TCP","66","42086 → 443 [ACK] Seq=518 Ack=3274 Win=62848 Len=0 TSval=2026823741 TSecr=147296305"
"89","0.386721275","192.168.1.118","104.102.83.39","TLSv1.2","192","Client Key Exchange, Change Cipher Spec, Encrypted Handshake Message"
"90","0.393296112","136.147.57.1","192.168.1.118","TCP","66","443 → 35234 [ACK] Seq=5087 Ack=644 Win=4723 Len=0 TSval=590592594 TSecr=3266395445"
"91","0.398604712","136.147.57.1","192.168.1.118","TLSv1.2","72","Change Cipher Spec"
"92","0.398714112","136.147.57.1","192.168.1.118","TLSv1.2","111","Encrypted Handshake Message"
"93","0.398781825","104.102.83.39","192.168.1.118","TLSv1.2","117","Change Cipher Spec, Encrypted Handshake Message"
"94","0.398886800","192.168.1.118","104.102.83.39","TCP","66","42078 → 443 [ACK] Seq=644 Ack=3325 Win=64128 Len=0 TSval=2026823755 TSecr=147296314"
"95","0.399283175","192.168.1.118","136.147.57.1","TCP","66","35234 → 443 [ACK] Seq=644 Ack=5138 Win=63356 Len=0 TSval=3266395532 TSecr=590592594"
"96","0.399598775","192.168.1.118","136.147.57.1","TLSv1.2","307","Application Data"
"97","0.399847625","192.168.1.118","104.102.83.39","TLSv1.2","309","Application Data"
"98","0.404855875","104.102.83.39","192.168.1.118","TLSv1.2","117","Change Cipher Spec, Encrypted Handshake Message"
"99","0.404983112","104.102.83.39","192.168.1.118","TLSv1.2","117","Change Cipher Spec, Encrypted Handshake Message"
"100","0.405063687","104.102.83.39","192.168.1.118","TLSv1.2","117","Change Cipher Spec, Encrypted Handshake Message"
"101","0.405351262","192.168.1.118","104.102.83.39","TLSv1.2","336","Application Data"
"102","0.405633825","192.168.1.118","104.102.83.39","TLSv1.2","296","Application Data"
"103","0.405849850","192.168.1.118","104.102.83.39","TLSv1.2","305","Application Data"
"104","0.430890412","104.102.83.39","192.168.1.118","TLSv1.2","117","Change Cipher Spec, Encrypted Handshake Message"
"105","0.431688862","192.168.1.118","104.102.83.39","TLSv1.2","320","Application Data"
"106","0.442440625","104.102.83.39","192.168.1.118","TCP","1514","[TCP segment of a reassembled PDU]"
"107","0.443769200","104.102.83.39","192.168.1.118","TCP","7306","443 → 42078 [ACK] Seq=4773 Ack=887 Win=31104 Len=7240 TSval=147296365 TSecr=2026823756 [TCP segment of a reassembled PDU]"
"108","0.444167612","192.168.1.118","104.102.83.39","TCP","66","42078 → 443 [ACK] Seq=887 Ack=12013 Win=64128 Len=0 TSval=2026823801 TSecr=147296365"
"109","0.445881362","104.102.83.39","192.168.1.118","TLSv1.2","14546","Application Data [TCP segment of a reassembled PDU]"
"110","0.446059237","192.168.1.118","104.102.83.39","TCP","66","42078 → 443 [ACK] Seq=887 Ack=26493 Win=49664 Len=0 TSval=2026823803 TSecr=147296365"
"111","0.451277350","104.102.83.39","192.168.1.118","TCP","1514","[TCP segment of a reassembled PDU]"
"112","0.455739950","104.102.83.39","192.168.1.118","TLSv1.2","7097","Application Data"
"113","0.460251300","104.102.83.39","192.168.1.118","TCP","1514","443 → 42078 [ACK] Seq=26493 Ack=887 Win=31104 Len=1448 TSval=147296383 TSecr=2026823801 [TCP segment of a reassembled PDU]"
"114","0.462416025","104.102.83.39","192.168.1.118","TCP","4410","443 → 42078 [ACK] Seq=27941 Ack=887 Win=31104 Len=4344 TSval=147296383 TSecr=2026823801 [TCP segment of a reassembled PDU]"
"115","0.462542587","192.168.1.118","104.102.83.39","TCP","66","42078 → 443 [ACK] Seq=887 Ack=32285 Win=56960 Len=0 TSval=2026823819 TSecr=147296383"
"116","0.462763012","104.102.83.39","192.168.1.118","TLSv1.2","10202","Application Data, Application Data"
"117","0.464471462","104.102.83.39","192.168.1.118","TCP","2962","443 → 42078 [ACK] Seq=42421 Ack=887 Win=31104 Len=2896 TSval=147296383 TSecr=2026823803 [TCP segment of a reassembled PDU]"
"118","0.465558162","104.102.83.39","192.168.1.118","TCP","2962","443 → 42078 [ACK] Seq=45317 Ack=887 Win=31104 Len=2896 TSval=147296383 TSecr=2026823803 [TCP segment of a reassembled PDU]"
"119","0.466422112","104.102.83.39","192.168.1.118","TCP","1514","443 → 42078 [ACK] Seq=48213 Ack=887 Win=31104 Len=1448 TSval=147296383 TSecr=2026823803 [TCP segment of a reassembled PDU]"
"120","0.466492250","104.102.83.39","192.168.1.118","TCP","1514","443 → 42078 [ACK] Seq=49661 Ack=887 Win=31104 Len=1448 TSval=147296384 TSecr=2026823803 [TCP segment of a reassembled PDU]"
"121","0.467331187","104.102.83.39","192.168.1.118","TCP","2962","443 → 42078 [ACK] Seq=51109 Ack=887 Win=31104 Len=2896 TSval=147296384 TSecr=2026823803 [TCP segment of a reassembled PDU]"
"122","0.471957062","104.102.83.39","192.168.1.118","TLSv1.2","1514","Application Data [TCP segment of a reassembled PDU]"
"123","0.474448287","192.168.1.118","104.102.83.39","TCP","66","42086 → 443 [ACK] Seq=898 Ack=11804 Win=55680 Len=0 TSval=2026823831 TSecr=147296375"
"124","0.475278362","192.168.1.118","104.102.83.39","TCP","66","42078 → 443 [ACK] Seq=887 Ack=55453 Win=33792 Len=0 TSval=2026823832 TSecr=147296383"
"125","0.477816025","192.168.1.118","209.18.47.62","DNS","80","Standard query 0x4992 A fonts.googleapis.com"
"126","0.485040887","104.102.83.39","192.168.1.118","TCP","2962","443 → 42078 [ACK] Seq=55453 Ack=887 Win=31104 Len=2896 TSval=147296385 TSecr=2026823803 [TCP segment of a reassembled PDU]"
"127","0.485962500","104.102.83.39","192.168.1.118","TCP","2962","443 → 42078 [ACK] Seq=58349 Ack=887 Win=31104 Len=2896 TSval=147296386 TSecr=2026823803 [TCP segment of a reassembled PDU]"
"128","0.487966487","104.102.83.39","192.168.1.118","TCP","2962","443 → 42078 [ACK] Seq=61245 Ack=887 Win=31104 Len=2896 TSval=147296387 TSecr=2026823803 [TCP segment of a reassembled PDU]"
"129","0.495430037","104.102.83.39","192.168.1.118","TLSv1.2","2962","Application Data [TCP segment of a reassembled PDU]"
"130","0.499170425","104.102.83.39","192.168.1.118","TCP","2962","443 → 42078 [ACK] Seq=67037 Ack=887 Win=31104 Len=2896 TSval=147296388 TSecr=2026823803 [TCP segment of a reassembled PDU]"
"131","0.499313512","104.102.83.39","192.168.1.118","TCP","2962","443 → 42078 [ACK] Seq=69933 Ack=887 Win=31104 Len=2896 TSval=147296389 TSecr=2026823803 [TCP segment of a reassembled PDU]"
"132","0.499440687","104.102.83.39","192.168.1.118","TCP","5858","443 → 42078 [PSH, ACK] Seq=72829 Ack=887 Win=31104 Len=5792 TSval=147296403 TSecr=2026823819 [TCP segment of a reassembled PDU]"
"133","0.499516325","104.102.83.39","192.168.1.118","TCP","66","443 → 42084 [ACK] Seq=3325 Ack=914 Win=31104 Len=0 TSval=147296404 TSecr=2026823762"
"134","0.499631050","104.102.83.39","192.168.1.118","TCP","66","443 → 42080 [ACK] Seq=3325 Ack=874 Win=31104 Len=0 TSval=147296404 TSecr=2026823762"
"135","0.499754150","136.147.57.1","192.168.1.118","TCP","66","443 → 35234 [ACK] Seq=5138 Ack=885 Win=4964 Len=0 TSval=590592689 TSecr=3266395532"
"136","0.499838650","104.102.83.39","192.168.1.118","TCP","2962","443 → 42078 [ACK] Seq=78621 Ack=887 Win=31104 Len=2896 TSval=147296403 TSecr=2026823819 [TCP segment of a reassembled PDU]"
"137","0.499949812","104.102.83.39","192.168.1.118","TLSv1.2","2962","Application Data [TCP segment of a reassembled PDU]"
"138","0.499997187","104.102.83.39","192.168.1.118","TCP","1514","[TCP segment of a reassembled PDU]"
"139","0.502081425","104.102.83.39","192.168.1.118","TLSv1.2","2188","Application Data"
"140","0.502272700","104.102.83.39","192.168.1.118","TLSv1.2","2691","Application Data"
"141","0.518032625","104.102.83.39","192.168.1.118","TCP","5858","[TCP segment of a reassembled PDU]"
"142","0.518088712","104.102.83.39","192.168.1.118","TLSv1.2","357","Application Data"
"143","0.518118762","209.18.47.62","192.168.1.118","DNS","96","Standard query response 0x4992 A fonts.googleapis.com A 172.217.6.202"
"144","0.518166550","104.102.83.39","192.168.1.118","TCP","2962","443 → 42078 [ACK] Seq=84413 Ack=887 Win=31104 Len=2896 TSval=147296419 TSecr=2026823832 [TCP segment of a reassembled PDU]"
"145","0.518206962","192.168.1.118","104.102.83.39","TCP","66","42078 → 443 [ACK] Seq=887 Ack=87309 Win=2048 Len=0 TSval=2026823875 TSecr=147296385"
"146","0.518325712","192.168.1.118","209.18.47.62","DNS","80","Standard query 0x0912 AAAA fonts.googleapis.com"
"147","0.534511800","192.168.1.118","104.102.83.39","TCP","66","42084 → 443 [ACK] Seq=914 Ack=5950 Win=61568 Len=0 TSval=2026823891 TSecr=147296409"
"148","0.534830300","192.168.1.118","104.102.83.39","TCP","66","[TCP Window Update] 42078 → 443 [ACK] Seq=887 Ack=87309 Win=64128 Len=0 TSval=2026823891 TSecr=147296385"
"149","0.535927912","192.168.1.118","104.102.83.39","TCP","66","42080 → 443 [ACK] Seq=874 Ack=6895 Win=60672 Len=0 TSval=2026823892 TSecr=147296407"
"150","0.536202550","192.168.1.118","104.102.83.39","TCP","66","42082 → 443 [ACK] Seq=883 Ack=9408 Win=58112 Len=0 TSval=2026823893 TSecr=147296409"
"151","0.536461362","192.168.1.118","104.102.83.39","TLSv1.2","307","Application Data"
"152","0.540691475","192.168.1.118","104.102.83.39","TLSv1.2","305","Application Data"
"153","0.540879075","192.168.1.118","104.102.83.39","TLSv1.2","293","Application Data"
"154","0.540968837","192.168.1.118","104.102.83.39","TLSv1.2","317","Application Data"
"155","0.564349637","104.102.83.39","192.168.1.118","TCP","1514","443 → 42078 [ACK] Seq=87309 Ack=887 Win=31104 Len=1448 TSval=147296477 TSecr=2026823891 [TCP segment of a reassembled PDU]"
"156","0.568648137","104.102.83.39","192.168.1.118","TCP","4410","443 → 42078 [ACK] Seq=88757 Ack=887 Win=31104 Len=4344 TSval=147296477 TSecr=2026823891 [TCP segment of a reassembled PDU]"
"157","0.568775587","192.168.1.118","104.102.83.39","TCP","66","42078 → 443 [ACK] Seq=887 Ack=93101 Win=75776 Len=0 TSval=2026823925 TSecr=147296477"
"158","0.568947337","104.102.83.39","192.168.1.118","TCP","5858","443 → 42078 [ACK] Seq=93101 Ack=887 Win=31104 Len=5792 TSval=147296478 TSecr=2026823891 [TCP segment of a reassembled PDU]"
"159","0.569027375","192.168.1.118","104.102.83.39","TCP","66","42078 → 443 [ACK] Seq=887 Ack=98893 Win=87296 Len=0 TSval=2026823926 TSecr=147296478"
"160","0.569179850","104.102.83.39","192.168.1.118","TLSv1.2","2962","Application Data [TCP segment of a reassembled PDU]"
"161","0.569252912","192.168.1.118","104.102.83.39","TCP","66","42078 → 443 [ACK] Seq=887 Ack=101789 Win=93056 Len=0 TSval=2026823926 TSecr=147296479"
"162","0.569399187","104.102.83.39","192.168.1.118","TLSv1.2","5858","Application Data [TCP segment of a reassembled PDU]"
"163","0.569477112","192.168.1.118","104.102.83.39","TCP","66","42078 → 443 [ACK] Seq=887 Ack=107581 Win=104704 Len=0 TSval=2026823926 TSecr=147296480"
"164","0.569582612","104.102.83.39","192.168.1.118","TCP","2962","443 → 42078 [ACK] Seq=107581 Ack=887 Win=31104 Len=2896 TSval=147296481 TSecr=2026823891 [TCP segment of a reassembled PDU]"
"165","0.569655500","192.168.1.118","104.102.83.39","TCP","66","42078 → 443 [ACK] Seq=887 Ack=110477 Win=110464 Len=0 TSval=2026823926 TSecr=147296481"
"166","0.569723425","104.102.83.39","192.168.1.118","TCP","1514","443 → 42078 [ACK] Seq=110477 Ack=887 Win=31104 Len=1448 TSval=147296482 TSecr=2026823891 [TCP segment of a reassembled PDU]"
"167","0.572252200","209.18.47.62","192.168.1.118","DNS","108","Standard query response 0x0912 AAAA fonts.googleapis.com AAAA 2607:f8b0:4006:804::200a"
"168","0.572399600","104.102.83.39","192.168.1.118","TCP","1514","443 → 42078 [ACK] Seq=111925 Ack=887 Win=31104 Len=1448 TSval=147296482 TSecr=2026823891 [TCP segment of a reassembled PDU]"
"169","0.572501637","192.168.1.118","104.102.83.39","TCP","66","42078 → 443 [ACK] Seq=887 Ack=113373 Win=116224 Len=0 TSval=2026823929 TSecr=147296482"
"170","0.572632450","104.102.83.39","192.168.1.118","TCP","2962","443 → 42078 [ACK] Seq=113373 Ack=887 Win=31104 Len=2896 TSval=147296483 TSecr=2026823891 [TCP segment of a reassembled PDU]"
"171","0.572710337","192.168.1.118","104.102.83.39","TCP","66","42078 → 443 [ACK] Seq=887 Ack=116269 Win=122112 Len=0 TSval=2026823929 TSecr=147296483"
"172","0.572859412","104.102.83.39","192.168.1.118","TCP","5858","443 → 42078 [ACK] Seq=116269 Ack=887 Win=31104 Len=5792 TSval=147296484 TSecr=2026823891 [TCP segment of a reassembled PDU]"
"173","0.572934675","192.168.1.118","104.102.83.39","TCP","66","42078 → 443 [ACK] Seq=887 Ack=122061 Win=133632 Len=0 TSval=2026823929 TSecr=147296484"
"174","0.573040625","104.102.83.39","192.168.1.118","TLSv1.2","2962","Application Data [TCP segment of a reassembled PDU]"
"175","0.573152150","192.168.1.118","104.102.83.39","TCP","66","42078 → 443 [ACK] Seq=887 Ack=124957 Win=139392 Len=0 TSval=2026823930 TSecr=147296485"
"176","0.573257200","104.102.83.39","192.168.1.118","TCP","2962","443 → 42078 [ACK] Seq=124957 Ack=887 Win=31104 Len=2896 TSval=147296486 TSecr=2026823891 [TCP segment of a reassembled PDU]"
"177","0.573332662","192.168.1.118","104.102.83.39","TCP","66","42078 → 443 [ACK] Seq=887 Ack=127853 Win=145280 Len=0 TSval=2026823930 TSecr=147296486"
"178","0.573442587","104.102.83.39","192.168.1.118","TCP","2962","443 → 42078 [ACK] Seq=127853 Ack=887 Win=31104 Len=2896 TSval=147296487 TSecr=2026823891 [TCP segment of a reassembled PDU]"
"179","0.573515487","192.168.1.118","104.102.83.39","TCP","66","42078 → 443 [ACK] Seq=887 Ack=130749 Win=151040 Len=0 TSval=2026823930 TSecr=147296487"
"180","0.573620175","104.102.83.39","192.168.1.118","TLSv1.2","2962","Application Data [TCP segment of a reassembled PDU]"
"181","0.573694650","192.168.1.118","104.102.83.39","TCP","66","42078 → 443 [ACK] Seq=887 Ack=133645 Win=156800 Len=0 TSval=2026823930 TSecr=147296488"
"182","0.573970625","104.102.83.39","192.168.1.118","TCP","2962","443 → 42078 [ACK] Seq=133645 Ack=887 Win=31104 Len=2896 TSval=147296488 TSecr=2026823891 [TCP segment of a reassembled PDU]"
"183","0.574047575","192.168.1.118","104.102.83.39","TCP","66","42078 → 443 [ACK] Seq=887 Ack=136541 Win=162560 Len=0 TSval=2026823931 TSecr=147296488"
"184","0.574185337","104.102.83.39","192.168.1.118","TCP","2962","443 → 42078 [ACK] Seq=136541 Ack=887 Win=31104 Len=2896 TSval=147296489 TSecr=2026823891 [TCP segment of a reassembled PDU]"
"185","0.574257550","192.168.1.118","104.102.83.39","TCP","66","42078 → 443 [ACK] Seq=887 Ack=139437 Win=168448 Len=0 TSval=2026823931 TSecr=147296489"
"186","0.574305262","104.102.83.39","192.168.1.118","TCP","1514","443 → 42078 [ACK] Seq=139437 Ack=887 Win=31104 Len=1448 TSval=147296490 TSecr=2026823891 [TCP segment of a reassembled PDU]"
"187","0.574661550","104.102.83.39","192.168.1.118","TCP","1514","443 → 42078 [ACK] Seq=140885 Ack=887 Win=31104 Len=1448 TSval=147296490 TSecr=2026823891 [TCP segment of a reassembled PDU]"
"188","0.574737550","192.168.1.118","104.102.83.39","TCP","66","42078 → 443 [ACK] Seq=887 Ack=142333 Win=174208 Len=0 TSval=2026823931 TSecr=147296490"
"189","0.574849837","104.102.83.39","192.168.1.118","TCP","2962","443 → 42078 [ACK] Seq=142333 Ack=887 Win=31104 Len=2896 TSval=147296491 TSecr=2026823891 [TCP segment of a reassembled PDU]"
"190","0.574924300","192.168.1.118","104.102.83.39","TCP","66","42078 → 443 [ACK] Seq=887 Ack=145229 Win=179968 Len=0 TSval=2026823931 TSecr=147296491"
"191","0.575051425","104.102.83.39","192.168.1.118","TLSv1.2","5035","Application Data, Application Data"
"192","0.575169475","192.168.1.118","104.102.83.39","TCP","66","42078 → 443 [ACK] Seq=887 Ack=150198 Win=189952 Len=0 TSval=2026823932 TSecr=147296492"
"193","0.587620637","104.102.83.39","192.168.1.118","TCP","66","443 → 42084 [ACK] Seq=5950 Ack=1155 Win=32256 Len=0 TSval=147296505 TSecr=2026823893"
"194","0.593571175","104.102.83.39","192.168.1.118","TCP","66","443 → 42080 [ACK] Seq=6895 Ack=1101 Win=32256 Len=0 TSval=147296505 TSecr=2026823897"
"195","0.593677437","104.102.83.39","192.168.1.118","TLSv1.2","2533","Application Data"
"196","0.604564900","104.102.83.39","192.168.1.118","TCP","1514","[TCP segment of a reassembled PDU]"
"197","0.606463537","104.102.83.39","192.168.1.118","TLSv1.2","3180","Application Data"
"198","0.606574525","104.102.83.39","192.168.1.118","TLSv1.2","671","Application Data"
"199","0.610339737","136.147.57.1","192.168.1.118","TLSv1.2","1285","Application Data"
"200","0.613856087","104.102.83.39","192.168.1.118","TCP","1514","[TCP segment of a reassembled PDU]"
"201","0.615433962","104.102.83.39","192.168.1.118","TCP","7306","443 → 42082 [ACK] Seq=10856 Ack=1134 Win=32256 Len=7240 TSval=147296537 TSecr=2026823898 [TCP segment of a reassembled PDU]"
"202","0.617409625","104.102.83.39","192.168.1.118","TCP","5858","443 → 42082 [ACK] Seq=18096 Ack=1134 Win=32256 Len=5792 TSval=147296537 TSecr=2026823898 [TCP segment of a reassembled PDU]"
"203","0.617626487","104.102.83.39","192.168.1.118","TLSv1.2","8754","Application Data [TCP segment of a reassembled PDU]"
"204","0.634416125","192.168.1.118","104.102.83.39","TCP","66","42086 → 443 [ACK] Seq=1137 Ack=14271 Win=61696 Len=0 TSval=2026823991 TSecr=147296505"
"205","0.644190600","192.168.1.118","172.217.6.202","TCP","74","46520 → 443 [SYN] Seq=0 Win=64240 Len=0 MSS=1460 SACK_PERM=1 TSval=654777120 TSecr=0 WS=128"
"206","0.644513375","192.168.1.118","104.102.83.39","TCP","66","42080 → 443 [ACK] Seq=1101 Ack=11457 Win=59648 Len=0 TSval=2026824001 TSecr=147296526"
"207","0.644657312","192.168.1.118","104.102.83.39","TCP","66","42082 → 443 [ACK] Seq=1134 Ack=32576 Win=40960 Len=0 TSval=2026824001 TSecr=147296537"
"208","0.647264600","192.168.1.118","104.102.83.39","TCP","66","42084 → 443 [ACK] Seq=1155 Ack=6555 Win=64128 Len=0 TSval=2026824004 TSecr=147296526"
"209","0.651254762","192.168.1.118","136.147.57.1","TCP","66","35234 → 443 [ACK] Seq=885 Ack=6357 Win=63356 Len=0 TSval=3266395784 TSecr=590592818"
"210","0.668969025","172.217.6.202","192.168.1.118","TCP","74","443 → 46520 [SYN, ACK] Seq=0 Ack=1 Win=60192 Len=0 MSS=1380 SACK_PERM=1 TSval=1398031059 TSecr=654777120 WS=256"
"211","0.669191575","192.168.1.118","172.217.6.202","TCP","66","46520 → 443 [ACK] Seq=1 Ack=1 Win=64256 Len=0 TSval=654777145 TSecr=1398031059"
"212","0.672234900","104.102.83.39","192.168.1.118","TLSv1.2","5364","Application Data"
"213","0.672371262","192.168.1.118","104.102.83.39","TCP","66","42082 → 443 [ACK] Seq=1134 Ack=37874 Win=56960 Len=0 TSval=2026824029 TSecr=147296590"
"214","0.714978837","192.168.1.118","172.217.6.202","TLSv1","583","Client Hello"
"215","0.715304700","192.168.1.118","104.102.83.39","TLSv1.2","340","Application Data"
"216","0.735848812","172.217.6.202","192.168.1.118","TCP","66","443 → 46520 [ACK] Seq=1 Ack=518 Win=61440 Len=0 TSval=1398031129 TSecr=654777191"
"217","0.737160425","104.102.83.39","192.168.1.118","TLSv1.2","871","Application Data"
"218","0.737276387","192.168.1.118","104.102.83.39","TCP","66","42084 → 443 [ACK] Seq=1429 Ack=7360 Win=63360 Len=0 TSval=2026824094 TSecr=147296661"
"219","0.741940425","172.217.6.202","192.168.1.118","TLSv1.2","1484","Server Hello"
"220","0.742041125","192.168.1.118","172.217.6.202","TCP","66","46520 → 443 [ACK] Seq=518 Ack=1419 Win=63104 Len=0 TSval=654777218 TSecr=1398031135"
"221","0.744336862","172.217.6.202","192.168.1.118","TLSv1.2","1540","Certificate, Server Key Exchange, Server Hello Done"
"222","0.744434900","192.168.1.118","172.217.6.202","TCP","66","46520 → 443 [ACK] Seq=518 Ack=2893 Win=61696 Len=0 TSval=654777220 TSecr=1398031135"
"223","0.768950175","192.168.1.118","172.217.6.202","TLSv1.2","192","Client Key Exchange, Change Cipher Spec, Encrypted Handshake Message"
"224","0.785790537","172.217.6.202","192.168.1.118","TLSv1.2","117","Change Cipher Spec, Encrypted Handshake Message"
"225","0.811709012","192.168.1.118","172.217.6.202","TLSv1.2","338","Application Data"
"226","0.839394187","172.217.6.202","192.168.1.118","TCP","66","443 → 46520 [ACK] Seq=2944 Ack=916 Win=62464 Len=0 TSval=1398031228 TSecr=654777287"
"227","0.850129900","172.217.6.202","192.168.1.118","TLSv1.2","975","Application Data"
"228","0.850234162","172.217.6.202","192.168.1.118","TLSv1.2","161","Application Data"
"229","0.850295712","172.217.6.202","192.168.1.118","TLSv1.2","100","Application Data"
"230","0.851122337","192.168.1.118","172.217.6.202","TCP","66","46520 → 443 [ACK] Seq=916 Ack=3982 Win=64128 Len=0 TSval=654777327 TSecr=1398031239"
"231","0.882405362","192.168.1.118","209.18.47.62","DNS","82","Standard query 0x45dd A secure2.sfdcstatic.com"
"232","0.903862262","209.18.47.62","192.168.1.118","DNS","179","Standard query response 0x45dd A secure2.sfdcstatic.com CNAME secure2.sfdcstatic.com.edgekey.net CNAME e4745.b.akamaiedge.net A 104.102.83.39"
"233","0.904128962","192.168.1.118","209.18.47.62","DNS","82","Standard query 0xf59f AAAA secure2.sfdcstatic.com"
"234","0.925299825","209.18.47.62","192.168.1.118","DNS","221","Standard query response 0xf59f AAAA secure2.sfdcstatic.com CNAME secure2.sfdcstatic.com.edgekey.net CNAME e4745.b.akamaiedge.net SOA n0b.akamaiedge.net"
"235","0.926219737","192.168.1.118","104.102.83.39","TCP","74","42090 → 443 [SYN] Seq=0 Win=64240 Len=0 MSS=1460 SACK_PERM=1 TSval=2026824283 TSecr=0 WS=128"
"236","0.932223650","192.168.1.118","136.147.57.1","TLSv1.2","385","Application Data"
"237","0.940814337","192.168.1.118","104.102.83.39","TLSv1.2","313","Application Data"
"238","0.945505650","104.102.83.39","192.168.1.118","TCP","74","443 → 42090 [SYN, ACK] Seq=0 Ack=1 Win=28960 Len=0 MSS=1460 SACK_PERM=1 TSval=147296869 TSecr=2026824283 WS=128"
"239","0.945692675","192.168.1.118","104.102.83.39","TCP","66","42090 → 443 [ACK] Seq=1 Ack=1 Win=64256 Len=0 TSval=2026824302 TSecr=147296869"
"240","0.962810150","192.168.1.118","104.102.83.39","TLSv1","583","Client Hello"
"241","0.966567587","192.168.1.118","104.102.83.39","TLSv1.2","315","Application Data"
"242","0.971791725","104.102.83.39","192.168.1.118","TLSv1.2","1043","Application Data"
"243","0.971943550","192.168.1.118","104.102.83.39","TCP","66","42084 → 443 [ACK] Seq=1676 Ack=8337 Win=63232 Len=0 TSval=2026824328 TSecr=147296890"
"244","0.975589087","192.168.1.118","104.102.83.39","TLSv1.2","317","Application Data"
"245","0.981229225","104.102.83.39","192.168.1.118","TCP","66","443 → 42090 [ACK] Seq=1 Ack=518 Win=30080 Len=0 TSval=147296904 TSecr=2026824319"
"246","0.982913237","104.102.83.39","192.168.1.118","TLSv1.2","1514","Server Hello"
"247","0.983048475","192.168.1.118","104.102.83.39","TCP","66","42090 → 443 [ACK] Seq=518 Ack=1449 Win=63104 Len=0 TSval=2026824340 TSecr=147296906"
"248","0.983965237","104.102.83.39","192.168.1.118","TLSv1.2","1891","Certificate, Server Key Exchange, Server Hello Done"
"249","0.984145412","192.168.1.118","104.102.83.39","TCP","66","42090 → 443 [ACK] Seq=518 Ack=3274 Win=61312 Len=0 TSval=2026824341 TSecr=147296906"
"250","0.987465062","192.168.1.118","104.102.83.39","TLSv1.2","192","Client Key Exchange, Change Cipher Spec, Encrypted Handshake Message"
"251","0.987681800","192.168.1.118","104.102.83.39","TLSv1.2","316","Application Data"
"252","0.996607000","192.168.1.118","104.102.83.39","TLSv1.2","316","Application Data"
"253","0.997330025","136.147.57.1","192.168.1.118","TCP","66","443 → 35232 [ACK] Seq=22545 Ack=320 Win=5245 Len=0 TSval=590593200 TSecr=3266396065"
"254","1.005483525","192.168.1.118","104.102.83.39","TLSv1.2","318","Application Data"
"255","1.057668562","104.102.83.39","192.168.1.118","TLSv1.2","1093","Application Data"
"256","1.057740050","192.168.1.118","104.102.83.39","TCP","66","42086 → 443 [ACK] Seq=1386 Ack=15298 Win=63104 Len=0 TSval=2026824414 TSecr=147296982"
"257","1.061990150","192.168.1.118","104.102.83.39","TLSv1.2","316","Application Data"
"258","1.063679825","104.102.83.39","192.168.1.118","TCP","443","[TCP Spurious Retransmission] 443 → 42090 [PSH, ACK] Seq=2897 Ack=518 Win=30080 Len=377 TSval=147296987 TSecr=2026824319[Reassembly error, protocol TCP: New fragment overlaps old data (retransmission?)]"
"259","1.063756150","192.168.1.118","104.102.83.39","TCP","78","[TCP Dup ACK 249#1] 42090 → 443 [ACK] Seq=644 Ack=3274 Win=64128 Len=0 TSval=2026824420 TSecr=147296987 SLE=2897 SRE=3274"
"260","1.079901350","104.102.83.39","192.168.1.118","TLSv1.2","1062","Application Data"
"261","1.081275175","104.102.83.39","192.168.1.118","TLSv1.2","1123","Application Data"
"262","1.081374562","104.102.83.39","192.168.1.118","TLSv1.2","1017","Application Data"
"263","1.081431362","104.102.83.39","192.168.1.118","TLSv1.2","904","Application Data"
"264","1.081481512","104.102.83.39","192.168.1.118","TLSv1.2","117","Change Cipher Spec, Encrypted Handshake Message"
"265","1.081546912","192.168.1.118","104.102.83.39","TCP","66","42090 → 443 [ACK] Seq=644 Ack=3325 Win=64128 Len=0 TSval=2026824438 TSecr=147297002"
"266","1.081619775","104.102.83.39","192.168.1.118","TLSv1.2","1051","Application Data"
"267","1.081999487","192.168.1.118","104.102.83.39","TLSv1.2","305","Application Data"
"268","1.087719200","192.168.1.118","104.102.83.39","TLSv1.2","315","Application Data"
"269","1.088160975","192.168.1.118","104.102.83.39","TLSv1.2","316","Application Data"
"270","1.088508475","192.168.1.118","104.102.83.39","TLSv1.2","315","Application Data"
"271","1.098749587","136.147.57.1","192.168.1.118","TCP","1414","[TCP segment of a reassembled PDU]"
"272","1.098823325","192.168.1.118","136.147.57.1","TCP","66","35232 → 443 [ACK] Seq=320 Ack=23893 Win=64704 Len=0 TSval=3266396231 TSecr=590593306"
"273","1.099981250","136.147.57.1","192.168.1.118","TLSv1.2","123","Application Data"
"274","1.100050262","192.168.1.118","136.147.57.1","TCP","66","35232 → 443 [ACK] Seq=320 Ack=23950 Win=64704 Len=0 TSval=3266396233 TSecr=590593306"
"275","1.122206337","192.168.1.118","104.102.83.39","TCP","66","42082 → 443 [ACK] Seq=1386 Ack=38859 Win=64128 Len=0 TSval=2026824479 TSecr=147297003"
"276","1.122313850","192.168.1.118","104.102.83.39","TCP","66","42080 → 443 [ACK] Seq=1351 Ack=12295 Win=64128 Len=0 TSval=2026824479 TSecr=147297002"
"277","1.133952600","104.102.83.39","192.168.1.118","TLSv1.2","1100","Application Data"
"278","1.139639700","104.102.83.39","192.168.1.118","TLSv1.2","1061","Application Data"
"279","1.139779600","104.102.83.39","192.168.1.118","TLSv1.2","1056","Application Data"
"280","1.139869787","104.102.83.39","192.168.1.118","TLSv1.2","414","Application Data"
"281","1.174492187","192.168.1.118","104.102.83.39","TCP","66","42084 → 443 [ACK] Seq=2176 Ack=10428 Win=63104 Len=0 TSval=2026824531 TSecr=147297056"
"282","1.180391212","192.168.1.118","104.102.83.39","TCP","66","42090 → 443 [ACK] Seq=883 Ack=3673 Win=63872 Len=0 TSval=2026824537 TSecr=147297056"
"283","1.180509537","192.168.1.118","104.102.83.39","TCP","66","42078 → 443 [ACK] Seq=1386 Ack=152189 Win=195712 Len=0 TSval=2026824537 TSecr=147297056"
"284","1.183389775","192.168.1.118","104.102.83.39","TCP","66","42086 → 443 [ACK] Seq=1886 Ack=17239 Win=63232 Len=0 TSval=2026824540 TSecr=147297056"
"285","1.231709550","192.168.1.118","209.18.47.62","DNS","76","Standard query 0x257c A a.sfdcstatic.com"
"286","1.247330575","209.18.47.62","192.168.1.118","DNS","167","Standard query response 0x257c A a.sfdcstatic.com CNAME a.sfdcstatic.com.edgekey.net CNAME e4745.b.akamaiedge.net A 104.102.83.39"
"287","1.247520450","192.168.1.118","209.18.47.62","DNS","76","Standard query 0x51d8 AAAA a.sfdcstatic.com"
"288","1.260290237","209.18.47.62","192.168.1.118","DNS","209","Standard query response 0x51d8 AAAA a.sfdcstatic.com CNAME a.sfdcstatic.com.edgekey.net CNAME e4745.b.akamaiedge.net SOA n0b.akamaiedge.net"
"289","1.268899200","192.168.1.118","104.102.83.39","TCP","74","42092 → 443 [SYN] Seq=0 Win=64240 Len=0 MSS=1460 SACK_PERM=1 TSval=2026824625 TSecr=0 WS=128"
"290","1.288780737","104.102.83.39","192.168.1.118","TCP","74","443 → 42092 [SYN, ACK] Seq=0 Ack=1 Win=28960 Len=0 MSS=1460 SACK_PERM=1 TSval=147297212 TSecr=2026824625 WS=128"
"291","1.288842687","192.168.1.118","104.102.83.39","TCP","66","42092 → 443 [ACK] Seq=1 Ack=1 Win=64256 Len=0 TSval=2026824645 TSecr=147297212"
"292","1.313748587","192.168.1.118","104.102.83.39","TLSv1","583","Client Hello"
"293","1.332860737","104.102.83.39","192.168.1.118","TCP","66","443 → 42092 [ACK] Seq=1 Ack=518 Win=30080 Len=0 TSval=147297256 TSecr=2026824670"
"294","1.334296675","104.102.83.39","192.168.1.118","TLSv1.2","1514","Server Hello"
"295","1.334398337","192.168.1.118","104.102.83.39","TCP","66","42092 → 443 [ACK] Seq=518 Ack=1449 Win=63104 Len=0 TSval=2026824691 TSecr=147297257"
"296","1.335411825","104.102.83.39","192.168.1.118","TLSv1.2","1891","Certificate, Server Key Exchange, Server Hello Done"
"297","1.335507700","192.168.1.118","104.102.83.39","TCP","66","42092 → 443 [ACK] Seq=518 Ack=3274 Win=61312 Len=0 TSval=2026824692 TSecr=147297257"
"298","1.338068337","192.168.1.118","104.102.83.39","TLSv1.2","192","Client Key Exchange, Change Cipher Spec, Encrypted Handshake Message"
"299","1.368733812","104.102.83.39","192.168.1.118","TLSv1.2","117","Change Cipher Spec, Encrypted Handshake Message"
"300","1.369220812","192.168.1.118","104.102.83.39","TLSv1.2","327","Application Data"
"301","1.390638887","104.102.83.39","192.168.1.118","TCP","1514","[TCP segment of a reassembled PDU]"
"302","1.391969087","104.102.83.39","192.168.1.118","TLSv1.2","4802","Application Data"
"303","1.392176037","192.168.1.118","104.102.83.39","TCP","66","42092 → 443 [ACK] Seq=905 Ack=9509 Win=64128 Len=0 TSval=2026824749 TSecr=147297314"
"304","1.656632650","192.168.1.118","142.250.64.67","TCP","66","46404 → 80 [ACK] Seq=1 Ack=1 Win=502 Len=0 TSval=282529108 TSecr=1296602678"
"305","1.672900750","142.250.64.67","192.168.1.118","TCP","66","[TCP ACKed unseen segment] 80 → 46404 [ACK] Seq=1 Ack=2 Win=240 Len=0 TSval=1296647731 TSecr=282301271"
"306","2.273629450","192.168.1.104","255.255.255.255","UDP","217","49154 → 6666 Len=175"
"307","4.569911937","192.168.1.118","192.168.1.102","TCP","176","40160 → 8009 [PSH, ACK] Seq=1 Ack=1 Win=501 Len=110 TSval=2233595338 TSecr=2342651 [TCP segment of a reassembled PDU]"
"308","4.583969350","192.168.1.102","192.168.1.118","TCP","176","8009 → 40160 [PSH, ACK] Seq=1 Ack=111 Win=344 Len=110 TSval=2343153 TSecr=2233595338 [TCP segment of a reassembled PDU]"
"309","4.584199587","192.168.1.118","192.168.1.102","TCP","66","40160 → 8009 [ACK] Seq=111 Ack=111 Win=501 Len=0 TSval=2233595353 TSecr=2343153"
"310","5.346536650","192.168.1.104","255.255.255.255","UDP","217","49154 → 6666 Len=175"
"311","5.752470012","192.168.1.118","172.253.63.188","TCP","66","36486 → 5228 [ACK] Seq=1 Ack=1 Win=501 Len=0 TSval=2117062362 TSecr=4173908322"
"312","5.778953212","172.253.63.188","192.168.1.118","TCP","66","[TCP ACKed unseen segment] 5228 → 36486 [ACK] Seq=1 Ack=2 Win=253 Len=0 TSval=4173953354 TSecr=2117017353"
"313","6.308998312","IntelCor_b7:52:73","Cisco-Li_5b:1c:ce","ARP","60","Who has 192.168.1.1? Tell 192.168.1.118"
"314","6.324239437","Cisco-Li_5b:1c:ce","IntelCor_b7:52:73","ARP","42","192.168.1.1 is at 58:6d:8f:5b:1c:ce"
"315","8.316687437","192.168.1.104","255.255.255.255","UDP","217","49154 → 6666 Len=175"
