frame.number,_ws.col.Time,_ws.col.Source,_ws.col.Destination,_ws.col.Protocol,frame.len,_ws.col.Info
"1","0.000000000","192.168.1.118","172.217.6.214","TLSv1","583","Client Hello"
"2","0.016642125","172.217.6.214","192.168.1.118","TCP","66","443 → 41804 [ACK] Seq=1 Ack=518 Win=240 Len=0 TSval=4049551849 TSecr=1362858238"
"3","0.023924363","172.217.6.214","192.168.1.118","TLSv1.2","1484","Server Hello"
"4","0.023990513","192.168.1.118","172.217.6.214","TCP","66","41804 → 443 [ACK] Seq=518 Ack=1419 Win=493 Len=0 TSval=1362858262 TSecr=4049551856"
"5","0.025687900","172.217.6.214","192.168.1.118","TLSv1.2","1719","Certificate, Server Key Exchange, Server Hello Done"
"6","0.025755800","192.168.1.118","172.217.6.214","TCP","66","41804 → 443 [ACK] Seq=518 Ack=3072 Win=481 Len=0 TSval=1362858264 TSecr=4049551856"
"7","0.049336363","192.168.1.118","172.217.6.214","TLSv1","583","Client Hello"
"8","0.066602325","172.217.6.214","192.168.1.118","TCP","66","443 → 41806 [ACK] Seq=1 Ack=518 Win=240 Len=0 TSval=3646314640 TSecr=1362858288"
"9","0.076697138","172.217.6.214","192.168.1.118","TLSv1.2","1484","Server Hello"
"10","0.076761125","192.168.1.118","172.217.6.214","TCP","66","41806 → 443 [ACK] Seq=518 Ack=1419 Win=493 Len=0 TSval=1362858315 TSecr=3646314648"
"11","0.079016613","172.217.6.214","192.168.1.118","TLSv1.2","1719","Certificate, Server Key Exchange, Server Hello Done"
"12","0.079076213","192.168.1.118","172.217.6.214","TCP","66","41806 → 443 [ACK] Seq=518 Ack=3072 Win=481 Len=0 TSval=1362858317 TSecr=3646314648"
"13","0.092800088","192.168.1.118","172.217.10.33","TLSv1","583","Client Hello"
"14","0.104204188","192.168.1.118","172.217.6.214","TLSv1.2","192","Client Key Exchange, Change Cipher Spec, Encrypted Handshake Message"
"15","0.111422875","172.217.10.33","192.168.1.118","TCP","66","443 → 36882 [ACK] Seq=1 Ack=518 Win=240 Len=0 TSval=2178663588 TSecr=1116428004"
"16","0.111842938","192.168.1.118","172.217.6.214","TLSv1.2","192","Client Key Exchange, Change Cipher Spec, Encrypted Handshake Message"
"17","0.116885450","192.168.1.118","172.217.6.214","TLSv1.2","192","Client Key Exchange, Change Cipher Spec, Encrypted Handshake Message"
"18","0.118407750","172.217.10.33","192.168.1.118","TLSv1.2","1484","Server Hello"
"19","0.118469675","192.168.1.118","172.217.10.33","TCP","66","36882 → 443 [ACK] Seq=518 Ack=1419 Win=493 Len=0 TSval=1116428030 TSecr=2178663594"
"20","0.120115725","172.217.10.33","192.168.1.118","TLSv1.2","3882","Certificate, Server Key Exchange, Server Hello Done"
"21","0.120179213","192.168.1.118","172.217.10.33","TCP","66","36882 → 443 [ACK] Seq=518 Ack=5235 Win=464 Len=0 TSval=1116428031 TSecr=2178663594"
"22","0.120214013","172.217.6.214","192.168.1.118","TLSv1.2","117","Change Cipher Spec, Encrypted Handshake Message"
"23","0.120238825","192.168.1.118","172.217.6.214","TCP","66","41798 → 443 [ACK] Seq=127 Ack=52 Win=501 Len=0 TSval=1362858359 TSecr=4178949852"
"24","0.122787500","192.168.1.118","172.217.6.214","TLSv1.2","192","Client Key Exchange, Change Cipher Spec, Encrypted Handshake Message"
"25","0.126119338","192.168.1.118","172.217.6.214","TLSv1.2","192","Client Key Exchange, Change Cipher Spec, Encrypted Handshake Message"
"26","0.129467950","172.217.6.214","192.168.1.118","TLSv1.2","117","Change Cipher Spec, Encrypted Handshake Message"
"27","0.129539938","192.168.1.118","172.217.6.214","TCP","66","41800 → 443 [ACK] Seq=127 Ack=52 Win=501 Len=0 TSval=1362858368 TSecr=1708731692"
"28","0.136258063","172.217.6.214","192.168.1.118","TLSv1.2","117","Change Cipher Spec, Encrypted Handshake Message"
"29","0.136327213","192.168.1.118","172.217.6.214","TCP","66","41802 → 443 [ACK] Seq=127 Ack=52 Win=501 Len=0 TSval=1362858375 TSecr=910434081"
"30","0.138162238","172.217.6.214","192.168.1.118","TLSv1.2","117","Change Cipher Spec, Encrypted Handshake Message"
"31","0.138198800","192.168.1.118","172.217.6.214","TCP","66","41804 → 443 [ACK] Seq=644 Ack=3123 Win=501 Len=0 TSval=1362858377 TSecr=4049551969"
"32","0.149639825","172.217.6.214","192.168.1.118","TLSv1.2","117","Change Cipher Spec, Encrypted Handshake Message"
"33","0.149722238","192.168.1.118","172.217.6.214","TCP","66","41806 → 443 [ACK] Seq=644 Ack=3123 Win=501 Len=0 TSval=1362858388 TSecr=3646314722"
"34","0.170838100","192.168.1.118","172.217.10.33","TLSv1.2","192","Client Key Exchange, Change Cipher Spec, Encrypted Handshake Message"
"35","0.172378175","192.168.1.118","172.217.6.214","TLSv1.2","266","Application Data"
"36","0.172642863","192.168.1.118","172.217.6.214","TLSv1.2","266","Application Data"
"37","0.172894375","192.168.1.118","172.217.6.214","TLSv1.2","266","Application Data"
"38","0.175465063","192.168.1.118","172.217.6.214","TLSv1.2","266","Application Data"
"39","0.175922175","192.168.1.118","172.217.6.214","TLSv1.2","266","Application Data"
"40","0.183813288","192.168.1.118","172.217.10.46","TLSv1.2","338","Application Data"
"41","0.186017463","172.217.10.33","192.168.1.118","TLSv1.2","117","Change Cipher Spec, Encrypted Handshake Message"
"42","0.186088863","192.168.1.118","172.217.10.33","TCP","66","36882 → 443 [ACK] Seq=644 Ack=5286 Win=501 Len=0 TSval=1116428097 TSecr=2178663662"
"43","0.191245800","192.168.1.118","209.18.47.62","DNS","75","Standard query 0x1e1d A www.gstatic.com"
"44","0.192557013","172.217.6.214","192.168.1.118","TLSv1.2","1484","Application Data"
"45","0.201280888","172.217.6.214","192.168.1.118","TLSv1.2","1484","Application Data"
"46","0.208373263","172.217.6.214","192.168.1.118","TLSv1.2","1484","Application Data"
"47","0.208439275","172.217.6.214","192.168.1.118","TLSv1.2","1484","Application Data"
"48","0.208481700","192.168.1.118","172.217.6.214","TCP","66","41800 → 443 [ACK] Seq=327 Ack=1470 Win=493 Len=0 TSval=1362858447 TSecr=1708731754"
"49","0.208516963","172.217.6.214","192.168.1.118","TLSv1.2","1484","Application Data"
"50","0.208538588","172.217.6.214","192.168.1.118","TLSv1.2","2902","Application Data, Application Data"
"51","0.208555925","192.168.1.118","172.217.6.214","TCP","66","41800 → 443 [ACK] Seq=327 Ack=4306 Win=471 Len=0 TSval=1362858447 TSecr=1708731754"
"52","0.208569875","172.217.6.214","192.168.1.118","TLSv1.2","2902","Application Data, Application Data"
"53","0.208584363","172.217.6.214","192.168.1.118","TLSv1.2","5738","Application Data, Application Data, Application Data, Application Data"
"54","0.208594325","172.217.6.214","192.168.1.118","TLSv1.2","1484","Application Data"
"55","0.208607113","192.168.1.118","172.217.6.214","TCP","66","41800 → 443 [ACK] Seq=327 Ack=5724 Win=460 Len=0 TSval=1362858447 TSecr=1708731754"
"56","0.208685638","172.217.6.214","192.168.1.118","TLSv1.2","4320","Application Data, Application Data, Application Data"
"57","0.208702950","192.168.1.118","172.217.6.214","TCP","66","41800 → 443 [ACK] Seq=327 Ack=9978 Win=427 Len=0 TSval=1362858447 TSecr=1708731754"
"58","0.208720613","172.217.6.214","192.168.1.118","TLSv1.2","1484","Application Data"
"59","0.208739863","192.168.1.118","172.217.6.214","TCP","66","41798 → 443 [ACK] Seq=327 Ack=1470 Win=493 Len=0 TSval=1362858447 TSecr=4178949926"
"60","0.208755375","172.217.6.214","192.168.1.118","TLSv1.2","5738","Application Data, Application Data, Application Data, Application Data"
"61","0.208772450","172.217.6.214","192.168.1.118","TLSv1.2","2902","Application Data, Application Data"
"62","0.208788663","192.168.1.118","172.217.6.214","TCP","66","41798 → 443 [ACK] Seq=327 Ack=4306 Win=471 Len=0 TSval=1362858447 TSecr=4178949926"
"63","0.208808788","172.217.6.214","192.168.1.118","TLSv1.2","4320","Application Data, Application Data, Application Data"
"64","0.208825175","192.168.1.118","172.217.6.214","TCP","66","41798 → 443 [ACK] Seq=327 Ack=8560 Win=438 Len=0 TSval=1362858447 TSecr=4178949926"
"65","0.212609413","172.217.6.214","192.168.1.118","TLSv1.2","1484","Application Data"
"66","0.212681325","172.217.6.214","192.168.1.118","TLSv1.2","1484","Application Data"
"67","0.212706538","172.217.6.214","192.168.1.118","TLSv1.2","2902","Application Data, Application Data"
"68","0.212731725","172.217.6.214","192.168.1.118","TLSv1.2","1484","Application Data"
"69","0.212761888","192.168.1.118","172.217.6.214","TCP","66","41798 → 443 [ACK] Seq=327 Ack=9978 Win=427 Len=0 TSval=1362858451 TSecr=4178949926"
"70","0.212791325","172.217.6.214","192.168.1.118","TLSv1.2","1484","Application Data"
"71","0.216527413","172.217.6.214","192.168.1.118","TLSv1.2","1484","Application Data"
"72","0.216574738","172.217.6.214","192.168.1.118","TLSv1.2","2902","Application Data, Application Data"
"73","0.216605650","192.168.1.118","172.217.6.214","TCP","66","41798 → 443 [ACK] Seq=327 Ack=12814 Win=405 Len=0 TSval=1362858455 TSecr=4178949927"
"74","0.216635125","172.217.6.214","192.168.1.118","TLSv1.2","1484","Application Data"
"75","0.216733800","172.217.6.214","192.168.1.118","TLSv1.2","2902","Application Data, Application Data"
"76","0.216751263","192.168.1.118","172.217.6.214","TCP","66","41798 → 443 [ACK] Seq=327 Ack=15650 Win=383 Len=0 TSval=1362858455 TSecr=4178949928"
"77","0.216767400","172.217.6.214","192.168.1.118","TLSv1.2","1484","Application Data"
"78","0.216803363","172.217.6.214","192.168.1.118","TLSv1.2","2902","Application Data, Application Data"
"79","0.216819800","192.168.1.118","172.217.6.214","TCP","66","41800 → 443 [ACK] Seq=327 Ack=12814 Win=405 Len=0 TSval=1362858455 TSecr=1708731756"
"80","0.216829600","172.217.6.214","192.168.1.118","TLSv1.2","2902","Application Data, Application Data"
"81","0.216840263","172.217.6.214","192.168.1.118","TLSv1.2","2902","Application Data, Application Data"
"82","0.216848100","172.217.6.214","192.168.1.118","TLSv1.2","2902","Application Data, Application Data"
"83","0.216862750","192.168.1.118","172.217.6.214","TCP","66","41798 → 443 [ACK] Seq=327 Ack=18486 Win=361 Len=0 TSval=1362858455 TSecr=4178949929"
"84","0.216871038","172.217.6.214","192.168.1.118","TLSv1.2","1484","Application Data"
"85","0.226793450","172.217.6.214","192.168.1.118","TLSv1.2","1484","Application Data"
"86","0.226862388","192.168.1.118","172.217.6.214","TCP","66","41806 → 443 [ACK] Seq=844 Ack=18721 Win=380 Len=0 TSval=1362858465 TSecr=3646314766"
"87","0.226891638","172.217.6.214","192.168.1.118","TLSv1.2","2902","Application Data, Application Data"
"88","0.226911025","192.168.1.118","172.217.6.214","TCP","66","41800 → 443 [ACK] Seq=327 Ack=15650 Win=383 Len=0 TSval=1362858465 TSecr=1708731758"
"89","0.226919863","172.217.6.214","192.168.1.118","TLSv1.2","1484","Application Data"
"90","0.226962975","172.217.6.214","192.168.1.118","TLSv1.2","1484","Application Data"
"91","0.227024963","172.217.6.214","192.168.1.118","TLSv1.2","1484","Application Data"
"92","0.227047925","172.217.6.214","192.168.1.118","TLSv1.2","2902","Application Data, Application Data"
"93","0.227059363","172.217.6.214","192.168.1.118","TLSv1.2","1484","Application Data"
"94","0.227075063","192.168.1.118","172.217.6.214","TCP","66","41798 → 443 [ACK] Seq=327 Ack=19904 Win=350 Len=0 TSval=1362858465 TSecr=4178949931"
"95","0.227084913","172.217.6.214","192.168.1.118","TLSv1.2","2902","Application Data, Application Data"
"96","0.227095925","172.217.6.214","192.168.1.118","TLSv1.2","2902","Application Data, Application Data"
"97","0.227110375","192.168.1.118","172.217.6.214","TCP","66","41800 → 443 [ACK] Seq=327 Ack=18486 Win=361 Len=0 TSval=1362858465 TSecr=1708731760"
"98","0.227118863","172.217.6.214","192.168.1.118","TLSv1.2","2902","Application Data, Application Data"
"99","0.227127850","172.217.6.214","192.168.1.118","TLSv1.2","1484","Application Data"
"100","0.238056763","172.217.6.214","192.168.1.118","TLSv1.2","1484","Application Data"
"101","0.238102138","172.217.6.214","192.168.1.118","TLSv1.2","1484","Application Data"
"102","0.238112575","172.217.6.214","192.168.1.118","TLSv1.2","1484","Application Data"
"103","0.238141013","192.168.1.118","172.217.6.214","TCP","66","41802 → 443 [ACK] Seq=327 Ack=19904 Win=346 Len=0 TSval=1362858476 TSecr=910434137"
"104","0.238177513","172.217.6.214","192.168.1.118","TLSv1.2","1484","Application Data"
"105","0.238193763","192.168.1.118","172.217.6.214","TCP","66","41800 → 443 [ACK] Seq=327 Ack=19904 Win=350 Len=0 TSval=1362858477 TSecr=1708731762"
"106","0.238233663","172.217.10.46","192.168.1.118","TLSv1.2","1484","Application Data"
"107","0.238261088","192.168.1.118","172.217.10.46","TCP","66","43666 → 443 [ACK] Seq=273 Ack=1419 Win=493 Len=0 TSval=1322497290 TSecr=2241627773"
"108","0.238283463","172.217.10.46","192.168.1.118","TLSv1.2","2551","Application Data, Application Data"
"109","0.238300550","192.168.1.118","172.217.10.46","TCP","66","43666 → 443 [ACK] Seq=273 Ack=3904 Win=474 Len=0 TSval=1322497290 TSecr=2241627773"
"110","0.238317213","209.18.47.62","192.168.1.118","DNS","91","Standard query response 0x1e1d A www.gstatic.com A 172.217.6.227"
"111","0.238387963","172.217.6.214","192.168.1.118","TLSv1.2","2902","Application Data, Application Data"
"112","0.238405125","192.168.1.118","172.217.6.214","TCP","66","41800 → 443 [ACK] Seq=327 Ack=22740 Win=328 Len=0 TSval=1362858477 TSecr=1708731792"
"113","0.238415963","172.217.6.214","192.168.1.118","TLSv1.2","1484","Application Data"
"114","0.238425925","172.217.6.214","192.168.1.118","TLSv1.2","5738","Application Data, Application Data, Application Data, Application Data"
"115","0.238436538","172.217.6.214","192.168.1.118","TLSv1.2","1484","Application Data"
"116","0.238449038","192.168.1.118","172.217.6.214","TCP","66","41800 → 443 [ACK] Seq=327 Ack=24158 Win=317 Len=0 TSval=1362858477 TSecr=1708731793"
"117","0.241820375","192.168.1.118","209.18.47.62","DNS","75","Standard query 0x1242 AAAA www.gstatic.com"
"118","0.248419825","172.217.6.214","192.168.1.118","TLSv1.2","2902","Application Data, Application Data"
"119","0.248465650","172.217.6.214","192.168.1.118","TLSv1.2","1484","Application Data"
"120","0.248476688","172.217.6.214","192.168.1.118","TLSv1.2","1484","Application Data"
"121","0.248525075","172.217.6.214","192.168.1.118","TLSv1.2","1484","Application Data"
"122","0.248551588","172.217.6.214","192.168.1.118","TLSv1.2","2902","Application Data, Application Data"
"123","0.248574638","172.217.6.214","192.168.1.118","TLSv1.2","2902","Application Data, Application Data"
"124","0.248596575","172.217.6.214","192.168.1.118","TLSv1.2","2902","Application Data, Application Data"
"125","0.248618738","172.217.6.214","192.168.1.118","TLSv1.2","2902","Application Data, Application Data"
"126","0.248629875","172.217.6.214","192.168.1.118","TLSv1.2","2902","Application Data, Application Data"
"127","0.248638588","172.217.6.214","192.168.1.118","TLSv1.2","1484","Application Data"
"128","0.251175525","172.217.6.214","192.168.1.118","TLSv1.2","1484","Application Data [TCP segment of a reassembled PDU]"
"129","0.251233275","172.217.6.214","192.168.1.118","TLSv1.2","2902","Application Data, Application Data"
"130","0.251246025","172.217.6.214","192.168.1.118","TLSv1.2","1484","Application Data [TCP segment of a reassembled PDU]"
"131","0.251316450","172.217.6.214","192.168.1.118","TLSv1.2","1484","Application Data [TCP segment of a reassembled PDU]"
"132","0.251332763","172.217.6.214","192.168.1.118","TLSv1.2","2902","Application Data, Application Data"
"133","0.251341913","172.217.6.214","192.168.1.118","TLSv1.2","1484","Application Data [TCP segment of a reassembled PDU]"
"134","0.252735200","192.168.1.118","172.217.6.214","TCP","66","41804 → 443 [ACK] Seq=844 Ack=22975 Win=346 Len=0 TSval=1362858491 TSecr=4049552025"
"135","0.252818313","172.217.6.214","192.168.1.118","TLSv1.2","629","Application Data, Application Data"
"136","0.252846200","172.217.6.214","192.168.1.118","TLSv1.2","1484","Application Data [TCP segment of a reassembled PDU]"
"137","0.252856325","172.217.6.214","192.168.1.118","TLSv1.2","89","Application Data"
"138","0.255126400","172.217.6.214","192.168.1.118","TLSv1.2","1484","Application Data"
"139","0.256223813","172.217.6.214","192.168.1.118","TLSv1.2","983","Application Data"
"140","0.256261738","192.168.1.118","172.217.6.214","TCP","66","41804 → 443 [ACK] Seq=844 Ack=23892 Win=339 Len=0 TSval=1362858495 TSecr=4049552089"
"141","0.259177888","172.217.10.46","192.168.1.118","TLSv1.2","1133","[TCP Spurious Retransmission] , Application Data"
"142","0.259240338","192.168.1.118","172.217.10.46","TCP","78","[TCP Dup ACK 109#1] 43666 → 443 [ACK] Seq=273 Ack=3904 Win=474 Len=0 TSval=1322497311 TSecr=2241627827 SLE=2837 SRE=3904"
"143","0.261099613","172.217.6.214","192.168.1.118","TLSv1.2","2902","Application Data, Application Data"
"144","0.261162775","192.168.1.118","172.217.6.214","TCP","66","41806 → 443 [ACK] Seq=844 Ack=25811 Win=325 Len=0 TSval=1362858499 TSecr=3646314772"
"145","0.261193175","172.217.6.214","192.168.1.118","TLSv1.2","2902","Application Data, Application Data"
"146","0.262243813","172.217.6.214","192.168.1.118","TLSv1.2","2902","Application Data, Application Data"
"147","0.262265950","172.217.6.214","192.168.1.118","TLSv1.2","2902","Application Data, Application Data"
"148","0.263910538","172.217.6.214","192.168.1.118","TLSv1.2","1529","Application Data, Application Data"
"149","0.263943663","172.217.6.214","192.168.1.118","TLSv1.2","2255","Application Data, Application Data"
"150","0.270340375","209.18.47.62","192.168.1.118","DNS","103","Standard query response 0x1242 AAAA www.gstatic.com AAAA 2607:f8b0:4006:805::2003"
"151","0.278715200","192.168.1.118","172.217.6.214","TCP","66","41798 → 443 [ACK] Seq=327 Ack=42615 Win=173 Len=0 TSval=1362858517 TSecr=4178949964"
"152","0.288730375","192.168.1.118","172.217.6.214","TCP","66","41800 → 443 [ACK] Seq=327 Ack=43155 Win=169 Len=0 TSval=1362858527 TSecr=1708731793"
"153","0.292520438","192.168.1.118","172.217.10.33","TLSv1.2","338","Application Data"
"154","0.292833850","192.168.1.118","172.217.6.214","TCP","66","41802 → 443 [ACK] Seq=327 Ack=29183 Win=274 Len=0 TSval=1362858531 TSecr=910434199"
"155","0.293013925","192.168.1.118","172.217.6.214","TCP","66","41806 → 443 [ACK] Seq=844 Ack=30110 Win=292 Len=0 TSval=1362858531 TSecr=3646314834"
"156","0.293576675","192.168.1.118","172.217.6.227","TCP","74","44266 → 443 [SYN] Seq=0 Win=64240 Len=0 MSS=1460 SACK_PERM=1 TSval=3168051505 TSecr=0 WS=128"
"157","0.315074738","172.217.6.227","192.168.1.118","TCP","74","443 → 44266 [SYN, ACK] Seq=0 Ack=1 Win=60192 Len=0 MSS=1380 SACK_PERM=1 TSval=993292346 TSecr=3168051505 WS=256"
"158","0.315163388","192.168.1.118","172.217.6.227","TCP","66","44266 → 443 [ACK] Seq=1 Ack=1 Win=64256 Len=0 TSval=3168051526 TSecr=993292346"
"159","0.318953913","172.217.10.33","192.168.1.118","TLSv1.2","1484","Application Data"
"160","0.319029300","192.168.1.118","172.217.10.33","TCP","66","36882 → 443 [ACK] Seq=916 Ack=6704 Win=493 Len=0 TSval=1116428230 TSecr=2178663791"
"161","0.319069338","172.217.10.33","192.168.1.118","TLSv1.2","700","Application Data"
"162","0.319084763","192.168.1.118","172.217.10.33","TCP","66","36882 → 443 [ACK] Seq=916 Ack=7338 Win=489 Len=0 TSval=1116428230 TSecr=2178663791"
"163","0.425676900","192.168.1.118","172.217.6.227","TLSv1","583","Client Hello"
"164","0.426200575","192.168.1.118","172.217.10.33","TCP","74","36886 → 443 [SYN] Seq=0 Win=64240 Len=0 MSS=1460 SACK_PERM=1 TSval=1116428337 TSecr=0 WS=128"
"165","0.456698600","172.217.6.227","192.168.1.118","TCP","66","443 → 44266 [ACK] Seq=1 Ack=518 Win=61440 Len=0 TSval=993292483 TSecr=3168051637"
"166","0.458815738","172.217.6.227","192.168.1.118","TLSv1.2","1484","Server Hello"
"167","0.458882625","192.168.1.118","172.217.6.227","TCP","66","44266 → 443 [ACK] Seq=518 Ack=1419 Win=63104 Len=0 TSval=3168051670 TSecr=993292489"
"168","0.460198800","172.217.6.227","192.168.1.118","TLSv1.2","1307","Certificate, Server Key Exchange, Server Hello Done"
"169","0.460251425","192.168.1.118","172.217.6.227","TCP","66","44266 → 443 [ACK] Seq=518 Ack=2660 Win=61952 Len=0 TSval=3168051672 TSecr=993292489"
"170","0.460286750","172.217.10.33","192.168.1.118","TCP","74","443 → 36886 [SYN, ACK] Seq=0 Ack=1 Win=60192 Len=0 MSS=1380 SACK_PERM=1 TSval=2061034637 TSecr=1116428337 WS=256"
"171","0.460338075","192.168.1.118","172.217.10.33","TCP","66","36886 → 443 [ACK] Seq=1 Ack=1 Win=64256 Len=0 TSval=1116428372 TSecr=2061034637"
"172","0.539612675","192.168.1.118","172.217.6.227","TLSv1.2","192","Client Key Exchange, Change Cipher Spec, Encrypted Handshake Message"
"173","0.556933338","192.168.1.118","136.147.57.1","TLSv1.2","97","Encrypted Alert"
"174","0.557003938","192.168.1.118","136.147.57.1","TCP","66","41800 → 443 [FIN, ACK] Seq=32 Ack=1 Win=63356 Len=0 TSval=2874407875 TSecr=694828888"
"175","0.557225088","192.168.1.118","136.147.57.1","TLSv1.2","97","Encrypted Alert"
"176","0.557258788","192.168.1.118","136.147.57.1","TCP","66","41790 → 443 [FIN, ACK] Seq=32 Ack=1 Win=63356 Len=0 TSval=2874407876 TSecr=694828889"
"177","0.560288438","172.217.6.227","192.168.1.118","TLSv1.2","117","Change Cipher Spec, Encrypted Handshake Message"
"178","0.560355188","192.168.1.118","172.217.6.227","TCP","66","44266 → 443 [ACK] Seq=644 Ack=2711 Win=64128 Len=0 TSval=3168051772 TSecr=993292591"
"179","0.591838750","192.168.1.118","172.217.10.33","TLSv1","583","Client Hello"
"180","0.592105388","192.168.1.118","172.217.10.46","TLSv1.2","331","Application Data"
"181","0.592223375","192.168.1.118","172.217.10.33","TLSv1.2","338","Application Data"
"182","0.597427125","192.168.1.118","172.217.6.227","TLSv1.2","340","Application Data"
"183","0.609012325","172.217.10.33","192.168.1.118","TCP","66","443 → 36886 [ACK] Seq=1 Ack=518 Win=61440 Len=0 TSval=2061034786 TSecr=1116428503"
"184","0.610938500","172.217.10.33","192.168.1.118","TLSv1.2","1484","Application Data"
"185","0.611009338","192.168.1.118","172.217.10.33","TCP","66","36882 → 443 [ACK] Seq=1188 Ack=8756 Win=493 Len=0 TSval=1116428522 TSecr=2178664087"
"186","0.615035075","172.217.10.33","192.168.1.118","TLSv1.2","1484","Application Data"
"187","0.615102975","192.168.1.118","172.217.10.33","TCP","66","36882 → 443 [ACK] Seq=1188 Ack=10174 Win=482 Len=0 TSval=1116428526 TSecr=2178664087"
"188","0.615142063","172.217.10.33","192.168.1.118","TLSv1.2","2233","Application Data, Application Data"
"189","0.615158825","192.168.1.118","172.217.10.33","TCP","66","36882 → 443 [ACK] Seq=1188 Ack=12341 Win=466 Len=0 TSval=1116428526 TSecr=2178664087"
"190","0.615171125","136.147.57.1","192.168.1.118","TCP","66","443 → 41800 [ACK] Seq=1 Ack=32 Win=5148 Len=0 TSval=694831439 TSecr=2874407875"
"191","0.622008913","136.147.57.1","192.168.1.118","TCP","66","443 → 41800 [ACK] Seq=1 Ack=33 Win=5148 Len=0 TSval=694831439 TSecr=2874407875"
"192","0.622079113","136.147.57.1","192.168.1.118","TLSv1.2","97","Encrypted Alert"
"193","0.622125250","192.168.1.118","136.147.57.1","TCP","54","41800 → 443 [RST] Seq=33 Win=0 Len=0"
"194","0.622163425","136.147.57.1","192.168.1.118","TCP","66","443 → 41800 [FIN, ACK] Seq=32 Ack=33 Win=5148 Len=0 TSval=694831439 TSecr=2874407875"
"195","0.622180775","192.168.1.118","136.147.57.1","TCP","54","41800 → 443 [RST] Seq=33 Win=0 Len=0"
"196","0.622205413","172.217.10.33","192.168.1.118","TLSv1.2","2902","Server Hello"
"197","0.622233700","192.168.1.118","172.217.10.33","TCP","66","36886 → 443 [ACK] Seq=518 Ack=2837 Win=61440 Len=0 TSval=1116428534 TSecr=2061034793"
"198","0.622278163","172.217.10.33","192.168.1.118","TLSv1.2","2463","Certificate, Server Key Exchange, Server Hello Done"
"199","0.622297375","192.168.1.118","172.217.10.33","TCP","66","36886 → 443 [ACK] Seq=518 Ack=5234 Win=59136 Len=0 TSval=1116428534 TSecr=2061034793"
"200","0.622312500","172.217.10.46","192.168.1.118","TLSv1.2","785","Application Data"
"201","0.622335950","192.168.1.118","172.217.10.46","TCP","66","43662 → 443 [ACK] Seq=266 Ack=720 Win=496 Len=0 TSval=1322497674 TSecr=1435887049"
"202","0.622350038","136.147.57.1","192.168.1.118","TCP","66","443 → 41790 [ACK] Seq=1 Ack=32 Win=6222 Len=0 TSval=694831446 TSecr=2874407876"
"203","0.622369363","136.147.57.1","192.168.1.118","TCP","66","443 → 41790 [ACK] Seq=1 Ack=33 Win=6222 Len=0 TSval=694831446 TSecr=2874407876"
"204","0.622390013","136.147.57.1","192.168.1.118","TLSv1.2","97","Encrypted Alert"
"205","0.622408313","192.168.1.118","136.147.57.1","TCP","54","41790 → 443 [RST] Seq=33 Win=0 Len=0"
"206","0.622425188","136.147.57.1","192.168.1.118","TCP","66","443 → 41790 [FIN, ACK] Seq=32 Ack=33 Win=6222 Len=0 TSval=694831447 TSecr=2874407876"
"207","0.622441238","192.168.1.118","136.147.57.1","TCP","54","41790 → 443 [RST] Seq=33 Win=0 Len=0"
"208","0.622456488","172.217.6.227","192.168.1.118","TLSv1.2","1484","Application Data"
"209","0.622476938","172.217.6.227","192.168.1.118","TLSv1.2","1083","Application Data"
"210","0.635421413","192.168.1.118","172.217.6.227","TCP","66","44266 → 443 [ACK] Seq=918 Ack=5146 Win=61696 Len=0 TSval=3168051847 TSecr=993292651"
"211","0.638031263","192.168.1.118","172.217.10.33","TLSv1.2","192","Client Key Exchange, Change Cipher Spec, Encrypted Handshake Message"
"212","0.660818313","172.217.10.33","192.168.1.118","TLSv1.2","117","Change Cipher Spec, Encrypted Handshake Message"
"213","0.702730325","192.168.1.118","172.217.10.33","TCP","66","36886 → 443 [ACK] Seq=644 Ack=5285 Win=64128 Len=0 TSval=1116428614 TSecr=2061034837"
"214","0.720798513","192.168.1.118","172.217.10.46","TCP","66","43638 → 443 [ACK] Seq=1 Ack=1 Win=501 Len=0 TSval=1322497772 TSecr=3060856544"
"215","0.721949425","192.168.1.118","172.217.10.33","TLSv1.2","336","Application Data"
"216","0.740407438","172.217.10.33","192.168.1.118","TLSv1.2","1484","Application Data"
"217","0.740483363","192.168.1.118","172.217.10.33","TCP","66","36886 → 443 [ACK] Seq=914 Ack=6703 Win=63104 Len=0 TSval=1116428652 TSecr=2061034917"
"218","0.743128375","172.217.10.33","192.168.1.118","TLSv1.2","2902","Application Data, Application Data"
"219","0.743199038","192.168.1.118","172.217.10.33","TCP","66","36886 → 443 [ACK] Seq=914 Ack=9539 Win=60288 Len=0 TSval=1116428654 TSecr=2061034917"
"220","0.743236200","172.217.10.33","192.168.1.118","TLSv1.2","549","Application Data"
"221","0.743251400","192.168.1.118","172.217.10.33","TCP","66","36886 → 443 [ACK] Seq=914 Ack=10022 Win=59904 Len=0 TSval=1116428655 TSecr=2061034917"
"222","0.751958800","192.168.1.118","172.217.10.46","TCP","66","43660 → 443 [ACK] Seq=1 Ack=1 Win=501 Len=0 TSval=1322497803 TSecr=1889251879"
"223","0.752156500","192.168.1.118","172.217.10.46","TCP","66","43664 → 443 [ACK] Seq=1 Ack=1 Win=501 Len=0 TSval=1322497803 TSecr=981992650"
"224","0.752492875","192.168.1.118","172.217.6.214","TLSv1.2","266","Application Data"
"225","0.780163413","172.217.6.214","192.168.1.118","TLSv1.2","1484","Application Data"
"226","0.780245975","192.168.1.118","172.217.6.214","TCP","66","41804 → 443 [ACK] Seq=1044 Ack=25310 Win=493 Len=0 TSval=1362859019 TSecr=4049552612"
"227","0.781862238","172.217.6.214","192.168.1.118","TLSv1.2","2902","Application Data, Application Data"
"228","0.781908138","192.168.1.118","172.217.6.214","TCP","66","41804 → 443 [ACK] Seq=1044 Ack=28146 Win=471 Len=0 TSval=1362859020 TSecr=4049552613"
"229","0.785343950","172.217.6.214","192.168.1.118","TLSv1.2","1484","Application Data"
"230","0.785406400","192.168.1.118","172.217.6.214","TCP","66","41804 → 443 [ACK] Seq=1044 Ack=29564 Win=460 Len=0 TSval=1362859024 TSecr=4049552615"
"231","0.786629950","172.217.6.214","192.168.1.118","TLSv1.2","1484","Application Data"
"232","0.786703888","192.168.1.118","172.217.6.214","TCP","66","41804 → 443 [ACK] Seq=1044 Ack=30982 Win=449 Len=0 TSval=1362859025 TSecr=4049552615"
"233","0.786748850","172.217.6.214","192.168.1.118","TLSv1.2","2902","Application Data, Application Data"
"234","0.786766575","192.168.1.118","172.217.6.214","TCP","66","41804 → 443 [ACK] Seq=1044 Ack=33818 Win=427 Len=0 TSval=1362859025 TSecr=4049552617"
"235","0.787511163","172.217.6.214","192.168.1.118","TLSv1.2","2902","Application Data, Application Data"
"236","0.787549875","192.168.1.118","172.217.6.214","TCP","66","41804 → 443 [ACK] Seq=1044 Ack=36654 Win=405 Len=0 TSval=1362859026 TSecr=4049552619"
"237","0.788713913","172.217.6.214","192.168.1.118","TLSv1.2","1484","Application Data"
"238","0.788774375","192.168.1.118","172.217.6.214","TCP","66","41804 → 443 [ACK] Seq=1044 Ack=38072 Win=394 Len=0 TSval=1362859027 TSecr=4049552621"
"239","0.790104375","172.217.6.214","192.168.1.118","TLSv1.2","1484","Application Data"
"240","0.790157525","192.168.1.118","172.217.6.214","TCP","66","41804 → 443 [ACK] Seq=1044 Ack=39490 Win=383 Len=0 TSval=1362859028 TSecr=4049552621"
"241","0.791626825","172.217.6.214","192.168.1.118","TLSv1.2","2902","Application Data, Application Data"
"242","0.791695050","192.168.1.118","172.217.6.214","TCP","66","41804 → 443 [ACK] Seq=1044 Ack=42326 Win=361 Len=0 TSval=1362859030 TSecr=4049552623"
"243","0.794196638","172.217.6.214","192.168.1.118","TLSv1.2","1484","Application Data"
"244","0.794258763","192.168.1.118","172.217.6.214","TCP","66","41804 → 443 [ACK] Seq=1044 Ack=43744 Win=350 Len=0 TSval=1362859033 TSecr=4049552625"
"245","0.798900088","172.217.6.214","192.168.1.118","TLSv1.2","1484","Application Data"
"246","0.798964113","192.168.1.118","172.217.6.214","TCP","66","41804 → 443 [ACK] Seq=1044 Ack=45162 Win=339 Len=0 TSval=1362859037 TSecr=4049552625"
"247","0.799009500","172.217.6.214","192.168.1.118","TLSv1.2","2902","Application Data, Application Data"
"248","0.801069488","172.217.6.214","192.168.1.118","TLSv1.2","2902","Application Data, Application Data"
"249","0.801120788","172.217.6.214","192.168.1.118","TLSv1.2","2902","Application Data, Application Data"
"250","0.803132613","172.217.6.214","192.168.1.118","TLSv1.2","2773","Application Data, Application Data"
"251","0.825415888","192.168.1.118","172.217.6.214","TCP","66","41804 → 443 [ACK] Seq=1044 Ack=56377 Win=252 Len=0 TSval=1362859064 TSecr=4049552627"
"252","0.827402100","192.168.1.118","172.217.6.214","TLSv1.2","363","Application Data"
"253","0.831159713","192.168.1.118","172.217.6.214","TLSv1.2","363","Application Data"
"254","0.831291725","192.168.1.118","172.217.12.174","TLSv1.2","275","Application Data"
"255","0.835624688","192.168.1.118","172.217.10.46","TLSv1.2","356","Application Data"
"256","0.849700338","192.168.1.118","172.217.6.214","TCP","66","[TCP Window Update] 41798 → 443 [ACK] Seq=327 Ack=42615 Win=501 Len=0 TSval=1362859088 TSecr=4178949964"
"257","0.849945138","192.168.1.118","172.217.6.214","TCP","66","[TCP Window Update] 41800 → 443 [ACK] Seq=327 Ack=43155 Win=501 Len=0 TSval=1362859088 TSecr=1708731793"
"258","0.855459750","192.168.1.118","172.217.6.214","TLSv1.2","363","Application Data"
"259","0.855593863","192.168.1.118","172.217.6.214","TLSv1.2","363","Application Data"
"260","0.862191588","192.168.1.118","172.217.10.46","TLSv1.2","360","Application Data"
"261","0.873240000","192.168.1.118","172.217.6.214","TLSv1.2","363","Application Data"
"262","0.882131163","172.217.6.214","192.168.1.118","TLSv1.2","1484","Application Data"
"263","0.882204588","192.168.1.118","172.217.6.214","TCP","66","41800 → 443 [ACK] Seq=624 Ack=44573 Win=493 Len=0 TSval=1362859120 TSecr=1708732444"
"264","0.884052663","172.217.6.214","192.168.1.118","TLSv1.2","1484","Application Data"
"265","0.884110275","172.217.6.214","192.168.1.118","TLSv1.2","1484","Application Data"
"266","0.884139638","172.217.12.174","192.168.1.118","TLSv1.2","1484","Application Data"
"267","0.884175438","192.168.1.118","172.217.12.174","TCP","66","46048 → 443 [ACK] Seq=210 Ack=1419 Win=493 Len=0 TSval=3776799775 TSecr=3637309415"
"268","0.884219238","172.217.12.174","192.168.1.118","TLSv1.2","1484","Application Data"
"269","0.884237488","192.168.1.118","172.217.12.174","TCP","66","46048 → 443 [ACK] Seq=210 Ack=2837 Win=482 Len=0 TSval=3776799776 TSecr=3637309415"
"270","0.884246413","172.217.6.214","192.168.1.118","TLSv1.2","1484","Application Data"
"271","0.884261688","192.168.1.118","172.217.6.214","TCP","66","41800 → 443 [ACK] Seq=624 Ack=45991 Win=523 Len=0 TSval=1362859123 TSecr=1708732445"
"272","0.887852475","172.217.12.174","192.168.1.118","TLSv1.2","1484","Application Data"
"273","0.887915688","192.168.1.118","172.217.12.174","TCP","66","46048 → 443 [ACK] Seq=210 Ack=4255 Win=471 Len=0 TSval=3776799779 TSecr=3637309415"
"274","0.887966063","172.217.6.214","192.168.1.118","TLSv1.2","1484","Application Data"
"275","0.887987900","192.168.1.118","172.217.6.214","TCP","66","41800 → 443 [ACK] Seq=624 Ack=47409 Win=545 Len=0 TSval=1362859126 TSecr=1708732445"
"276","0.887998963","172.217.12.174","192.168.1.118","TLSv1.2","2902","Application Data, Application Data"
"277","0.888014900","192.168.1.118","172.217.12.174","TCP","66","46048 → 443 [ACK] Seq=210 Ack=7091 Win=449 Len=0 TSval=3776799779 TSecr=3637309415"
"278","0.888054713","172.217.6.214","192.168.1.118","TLSv1.2","2902","Application Data, Application Data"
"279","0.888077950","172.217.6.214","192.168.1.118","TLSv1.2","2902","Application Data, Application Data"
"280","0.888097950","172.217.6.214","192.168.1.118","TLSv1.2","1484","Application Data"
"281","0.888121363","192.168.1.118","172.217.6.214","TCP","66","41798 → 443 [ACK] Seq=624 Ack=44033 Win=493 Len=0 TSval=1362859126 TSecr=4178950617"
"282","0.888141963","172.217.6.214","192.168.1.118","TLSv1.2","2902","Application Data, Application Data"
"283","0.888157850","192.168.1.118","172.217.6.214","TCP","66","41798 → 443 [ACK] Seq=624 Ack=46869 Win=471 Len=0 TSval=1362859126 TSecr=4178950617"
"284","0.888186350","172.217.6.214","192.168.1.118","TLSv1.2","1484","Application Data"
"285","0.888200400","192.168.1.118","172.217.6.214","TCP","66","41800 → 443 [ACK] Seq=624 Ack=48827 Win=568 Len=0 TSval=1362859127 TSecr=1708732447"
"286","0.888209263","172.217.12.174","192.168.1.118","TLSv1.2","1484","Application Data"
"287","0.888224000","192.168.1.118","172.217.12.174","TCP","66","46048 → 443 [ACK] Seq=210 Ack=8509 Win=438 Len=0 TSval=3776799780 TSecr=3637309417"
"288","0.890061400","192.168.1.118","172.217.6.214","TCP","66","41802 → 443 [ACK] Seq=624 Ack=33437 Win=468 Len=0 TSval=1362859128 TSecr=910434826"
"289","0.890249338","192.168.1.118","172.217.6.214","TCP","66","41806 → 443 [ACK] Seq=1141 Ack=34364 Win=468 Len=0 TSval=1362859129 TSecr=3646315456"
"290","0.897513300","172.217.6.214","192.168.1.118","TLSv1.2","1368","Application Data"
"291","0.897564325","172.217.12.174","192.168.1.118","TLSv1.2","1484","Application Data"
"292","0.897602538","192.168.1.118","172.217.12.174","TCP","66","46048 → 443 [ACK] Seq=210 Ack=9927 Win=427 Len=0 TSval=3776799789 TSecr=3637309417"
"293","0.897634313","172.217.6.214","192.168.1.118","TLSv1.2","1484","Application Data"
"294","0.897651175","192.168.1.118","172.217.6.214","TCP","66","41800 → 443 [ACK] Seq=624 Ack=50245 Win=590 Len=0 TSval=1362859136 TSecr=1708732447"
"295","0.897660438","172.217.12.174","192.168.1.118","TLSv1.2","1484","Application Data"
"296","0.897689525","192.168.1.118","172.217.12.174","TCP","66","46048 → 443 [ACK] Seq=210 Ack=11345 Win=416 Len=0 TSval=3776799789 TSecr=3637309419"
"297","0.897768088","172.217.12.174","192.168.1.118","TLSv1.2","1484","Application Data"
"298","0.897785075","192.168.1.118","172.217.12.174","TCP","66","46048 → 443 [ACK] Seq=210 Ack=12763 Win=405 Len=0 TSval=3776799789 TSecr=3637309419"
"299","0.897793925","172.217.6.214","192.168.1.118","TLSv1.2","2902","Application Data, Application Data"
"300","0.897810388","192.168.1.118","172.217.6.214","TCP","66","41798 → 443 [ACK] Seq=624 Ack=49705 Win=545 Len=0 TSval=1362859136 TSecr=4178950619"
"301","0.897819663","172.217.6.214","192.168.1.118","TLSv1.2","2902","Application Data, Application Data"
"302","0.897836363","192.168.1.118","172.217.6.214","TCP","66","41806 → 443 [ACK] Seq=1141 Ack=37200 Win=477 Len=0 TSval=1362859136 TSecr=3646315458"
"303","0.901096963","192.168.1.118","172.217.6.214","TLSv1.2","363","Application Data"
"304","0.904080113","172.217.6.214","192.168.1.118","TLSv1.2","795","Application Data"
"305","0.904139913","192.168.1.118","172.217.6.214","TCP","66","41798 → 443 [ACK] Seq=624 Ack=50434 Win=568 Len=0 TSval=1362859142 TSecr=4178950620"
"306","0.904203313","172.217.6.214","192.168.1.118","TLSv1.2","1115","Application Data"
"307","0.904223963","172.217.12.174","192.168.1.118","TLSv1.2","2902","Application Data, Application Data"
"308","0.904241238","192.168.1.118","172.217.12.174","TCP","66","46048 → 443 [ACK] Seq=210 Ack=15599 Win=477 Len=0 TSval=3776799796 TSecr=3637309420"
"309","0.904260038","172.217.6.214","192.168.1.118","TLSv1.2","2902","Application Data, Application Data"
"310","0.904275925","192.168.1.118","172.217.6.214","TCP","66","41800 → 443 [ACK] Seq=624 Ack=53081 Win=619 Len=0 TSval=1362859143 TSecr=1708732449"
"311","0.904284838","172.217.12.174","192.168.1.118","TLSv1.2","1484","Application Data"
"312","0.904299388","192.168.1.118","172.217.12.174","TCP","66","46048 → 443 [ACK] Seq=210 Ack=17017 Win=466 Len=0 TSval=3776799796 TSecr=3637309422"
"313","0.907150663","192.168.1.118","172.217.6.214","TLSv1.2","363","Application Data"
"314","0.907282200","192.168.1.118","172.217.6.214","TLSv1.2","363","Application Data"
"315","0.912221888","172.217.12.174","192.168.1.118","TLSv1.2","1484","Application Data"
"316","0.912281688","192.168.1.118","172.217.12.174","TCP","66","46048 → 443 [ACK] Seq=210 Ack=18435 Win=493 Len=0 TSval=3776799804 TSecr=3637309422"
"317","0.912320813","172.217.6.214","192.168.1.118","TLSv1.2","2902","Application Data, Application Data"
"318","0.912338250","192.168.1.118","172.217.6.214","TCP","66","41800 → 443 [ACK] Seq=624 Ack=55917 Win=619 Len=0 TSval=1362859151 TSecr=1708732451"
"319","0.912354525","172.217.12.174","192.168.1.118","TLSv1.2","2902","Application Data, Application Data"
"320","0.912369875","192.168.1.118","172.217.12.174","TCP","66","46048 → 443 [ACK] Seq=210 Ack=21271 Win=471 Len=0 TSval=3776799804 TSecr=3637309423"
"321","0.912382713","172.217.6.214","192.168.1.118","TLSv1.2","2902","Application Data, Application Data"
"322","0.912402663","192.168.1.118","172.217.6.214","TCP","66","41800 → 443 [ACK] Seq=624 Ack=58753 Win=597 Len=0 TSval=1362859151 TSecr=1708732453"
"323","0.912411188","172.217.6.214","192.168.1.118","TLSv1.2","1147","Application Data"
"324","0.912424675","192.168.1.118","172.217.6.214","TCP","66","41800 → 443 [ACK] Seq=624 Ack=59834 Win=589 Len=0 TSval=1362859151 TSecr=1708732455"
"325","0.912444400","172.217.10.46","192.168.1.118","TLSv1.2","1484","Application Data"
"326","0.912469625","192.168.1.118","172.217.10.46","TCP","66","43660 → 443 [ACK] Seq=295 Ack=1419 Win=493 Len=0 TSval=1322497964 TSecr=1889253240"
"327","0.912482875","172.217.6.214","192.168.1.118","TLSv1.2","1484","Application Data"
"328","0.912503163","192.168.1.118","172.217.6.214","TCP","66","41804 → 443 [ACK] Seq=1341 Ack=57795 Win=523 Len=0 TSval=1362859151 TSecr=4049552728"
"329","0.912529863","172.217.10.46","192.168.1.118","TLSv1.2","1484","Application Data"
"330","0.912550413","192.168.1.118","172.217.10.46","TCP","66","43638 → 443 [ACK] Seq=291 Ack=1419 Win=493 Len=0 TSval=1322497964 TSecr=3060858124"
"331","0.912566675","172.217.6.214","192.168.1.118","TLSv1.2","2902","Application Data, Application Data"
"332","0.912582100","192.168.1.118","172.217.6.214","TCP","66","41804 → 443 [ACK] Seq=1341 Ack=60631 Win=568 Len=0 TSval=1362859151 TSecr=4049552729"
"333","0.912604463","172.217.10.46","192.168.1.118","TLSv1.2","2902","Application Data, Application Data"
"334","0.912620650","192.168.1.118","172.217.10.46","TCP","66","43660 → 443 [ACK] Seq=295 Ack=4255 Win=471 Len=0 TSval=1322497964 TSecr=1889253240"
"335","0.912633625","172.217.10.46","192.168.1.118","TLSv1.2","1241","Application Data"
"336","0.912650538","192.168.1.118","172.217.10.46","TCP","66","43638 → 443 [ACK] Seq=291 Ack=2594 Win=484 Len=0 TSval=1322497964 TSecr=3060858124"
"337","0.912685350","172.217.10.46","192.168.1.118","TLSv1.2","2902","Application Data, Application Data"
"338","0.912701813","192.168.1.118","172.217.10.46","TCP","66","43660 → 443 [ACK] Seq=295 Ack=7091 Win=449 Len=0 TSval=1322497964 TSecr=1889253241"
"339","0.912717625","172.217.12.174","192.168.1.118","TLSv1.2","1484","Application Data"
"340","0.912732188","192.168.1.118","172.217.12.174","TCP","66","46048 → 443 [ACK] Seq=210 Ack=22689 Win=460 Len=0 TSval=3776799804 TSecr=3637309425"
"341","0.912741550","172.217.10.46","192.168.1.118","TLSv1.2","2902","Application Data, Application Data"
"342","0.912755363","192.168.1.118","172.217.10.46","TCP","66","43660 → 443 [ACK] Seq=295 Ack=9927 Win=427 Len=0 TSval=1322497964 TSecr=1889253242"
"343","0.912976963","172.217.6.214","192.168.1.118","TLSv1.2","2902","Application Data, Application Data"
"344","0.912996000","192.168.1.118","172.217.6.214","TCP","66","41804 → 443 [ACK] Seq=1341 Ack=63467 Win=612 Len=0 TSval=1362859151 TSecr=4049552730"
"345","0.913014200","172.217.10.46","192.168.1.118","TLSv1.2","2902","Application Data, Application Data"
"346","0.913031188","192.168.1.118","172.217.10.46","TCP","66","43660 → 443 [ACK] Seq=295 Ack=12763 Win=405 Len=0 TSval=1322497964 TSecr=1889253243"
"347","0.913046713","172.217.12.174","192.168.1.118","TLSv1.2","2902","Application Data, Application Data"
"348","0.913061613","192.168.1.118","172.217.12.174","TCP","66","46048 → 443 [ACK] Seq=210 Ack=25525 Win=438 Len=0 TSval=3776799804 TSecr=3637309433"
"349","0.913072575","172.217.6.214","192.168.1.118","TLSv1.2","2902","Application Data, Application Data"
"350","0.913087675","192.168.1.118","172.217.6.214","TCP","66","41804 → 443 [ACK] Seq=1341 Ack=66303 Win=656 Len=0 TSval=1362859151 TSecr=4049552732"
"351","0.913096788","172.217.10.46","192.168.1.118","TLSv1.2","2902","Application Data, Application Data"
"352","0.913112650","192.168.1.118","172.217.10.46","TCP","66","43660 → 443 [ACK] Seq=295 Ack=15599 Win=383 Len=0 TSval=1322497964 TSecr=1889253244"
"353","0.913120838","172.217.12.174","192.168.1.118","TLSv1.2","1484","Application Data"
"354","0.913134675","192.168.1.118","172.217.12.174","TCP","66","46048 → 443 [ACK] Seq=210 Ack=26943 Win=427 Len=0 TSval=3776799804 TSecr=3637309434"
"355","0.920116775","172.217.10.46","192.168.1.118","TLSv1.2","140","Application Data"
"356","0.920178088","192.168.1.118","172.217.10.46","TCP","66","43660 → 443 [ACK] Seq=295 Ack=15673 Win=383 Len=0 TSval=1322497971 TSecr=1889253246"
"357","0.920227238","172.217.12.174","192.168.1.118","TLSv1.2","1484","Application Data"
"358","0.920244713","192.168.1.118","172.217.12.174","TCP","66","46048 → 443 [ACK] Seq=210 Ack=28361 Win=416 Len=0 TSval=3776799812 TSecr=3637309434"
"359","0.920259525","172.217.6.214","192.168.1.118","TLSv1.2","2902","Application Data, Application Data"
"360","0.920276863","192.168.1.118","172.217.6.214","TCP","66","41804 → 443 [ACK] Seq=1341 Ack=69139 Win=701 Len=0 TSval=1362859159 TSecr=4049552734"
"361","0.920286475","172.217.12.174","192.168.1.118","TLSv1.2","1484","Application Data"
"362","0.926705888","172.217.6.214","192.168.1.118","TLSv1.2","2437","Application Data, Application Data"
"363","0.926768613","192.168.1.118","172.217.6.214","TCP","66","41804 → 443 [ACK] Seq=1341 Ack=71510 Win=738 Len=0 TSval=1362859165 TSecr=4049552736"
"364","0.926808675","172.217.12.174","192.168.1.118","TLSv1.2","1484","Application Data"
"365","0.926841375","172.217.12.174","192.168.1.118","TLSv1.2","2902","Application Data, Application Data"
"366","0.926854113","172.217.12.174","192.168.1.118","TLSv1.2","1029","Application Data, Application Data"
"367","0.928734238","172.217.6.214","192.168.1.118","TLSv1.2","1484","Application Data"
"368","0.928801925","172.217.6.214","192.168.1.118","TLSv1.2","2902","Application Data, Application Data"
"369","0.928824763","172.217.6.214","192.168.1.118","TLSv1.2","2714","Application Data, Application Data"
"370","0.930034713","192.168.1.118","172.217.12.174","TCP","66","46048 → 443 [ACK] Seq=210 Ack=34996 Win=365 Len=0 TSval=3776799821 TSecr=3637309437"
"371","0.930215688","192.168.1.118","172.217.6.214","TCP","66","41802 → 443 [ACK] Seq=921 Ack=41641 Win=448 Len=0 TSval=1362859169 TSecr=910434864"
"372","0.930473763","192.168.1.118","172.217.6.214","TLSv1.2","363","Application Data"
"373","0.932033675","172.217.6.214","192.168.1.118","TLSv1.2","1484","Application Data"
"374","0.934115013","172.217.6.214","192.168.1.118","TLSv1.2","1484","Application Data"
"375","0.934184375","172.217.6.214","192.168.1.118","TLSv1.2","2902","Application Data, Application Data"
"376","0.934215813","192.168.1.118","172.217.6.214","TCP","66","41798 → 443 [ACK] Seq=921 Ack=54688 Win=573 Len=0 TSval=1362859173 TSecr=4178950665"
"377","0.934253150","172.217.6.214","192.168.1.118","TLSv1.2","1484","Application Data"
"378","0.936116563","172.217.6.214","192.168.1.118","TLSv1.2","2445","Application Data, Application Data"
"379","0.936180488","172.217.6.214","192.168.1.118","TLSv1.2","2902","Application Data, Application Data"
"380","0.936197363","172.217.10.46","192.168.1.118","TCP","66","[TCP Dup ACK 325#1] 443 → 43660 [ACK] Seq=15673 Ack=295 Win=248 Len=0 TSval=1889253279 TSecr=1322497971"
"381","0.936455813","192.168.1.118","172.217.6.214","TCP","66","41798 → 443 [ACK] Seq=921 Ack=57067 Win=555 Len=0 TSval=1362859175 TSecr=4178950667"
"382","0.936529175","192.168.1.118","172.217.6.214","TCP","66","41806 → 443 [ACK] Seq=1438 Ack=43921 Win=457 Len=0 TSval=1362859175 TSecr=3646315505"
"383","0.937131638","172.217.6.214","192.168.1.118","TLSv1.2","1578","Application Data, Application Data"
"384","0.943395113","192.168.1.118","172.217.6.214","TCP","66","41806 → 443 [ACK] Seq=1438 Ack=45433 Win=446 Len=0 TSval=1362859182 TSecr=3646315508"
"385","0.943589163","192.168.1.118","172.217.6.214","TLSv1.2","363","Application Data"
"386","0.943723513","192.168.1.118","172.217.6.214","TLSv1.2","363","Application Data"
"387","0.946762363","192.168.1.118","172.217.6.214","TLSv1.2","363","Application Data"
"388","0.949085150","192.168.1.118","172.217.6.214","TLSv1.2","363","Application Data"
"389","0.961773475","172.217.6.214","192.168.1.118","TLSv1.2","1484","Application Data"
"390","0.963444788","172.217.6.214","192.168.1.118","TLSv1.2","2902","Application Data, Application Data"
"391","0.963507300","192.168.1.118","172.217.6.214","TCP","66","41800 → 443 [ACK] Seq=921 Ack=64088 Win=619 Len=0 TSval=1362859202 TSecr=1708732519"
"392","0.963555175","172.217.6.214","192.168.1.118","TLSv1.2","2902","Application Data, Application Data"
"393","0.963622413","192.168.1.118","172.217.6.214","TCP","66","41800 → 443 [ACK] Seq=921 Ack=66924 Win=597 Len=0 TSval=1362859202 TSecr=1708732521"
"394","0.964896200","172.217.6.214","192.168.1.118","TLSv1.2","2065","Application Data, Application Data"
"395","0.966262275","192.168.1.118","172.217.6.214","TCP","66","41800 → 443 [ACK] Seq=921 Ack=68923 Win=582 Len=0 TSval=1362859205 TSecr=1708732523"
"396","0.966536825","172.217.6.214","192.168.1.118","TLSv1.2","1484","Application Data"
"397","0.966577063","172.217.6.214","192.168.1.118","TLSv1.2","1484","Application Data"
"398","0.967406875","172.217.6.214","192.168.1.118","TLSv1.2","1484","Application Data"
"399","0.967451000","172.217.6.214","192.168.1.118","TLSv1.2","1484","Application Data"
"400","0.967486588","172.217.6.214","192.168.1.118","TLSv1.2","1484","Application Data"
"401","0.967513663","172.217.6.214","192.168.1.118","TLSv1.2","2902","Application Data, Application Data"
"402","0.967542538","192.168.1.118","172.217.6.214","TCP","66","41804 → 443 [ACK] Seq=1638 Ack=75764 Win=804 Len=0 TSval=1362859206 TSecr=4049552794"
"403","0.967578425","172.217.6.214","192.168.1.118","TLSv1.2","1484","Application Data"
"404","0.967600913","172.217.6.214","192.168.1.118","TLSv1.2","2902","Application Data, Application Data"
"405","0.970847713","192.168.1.118","172.217.6.214","TCP","66","41802 → 443 [ACK] Seq=1218 Ack=44477 Win=479 Len=0 TSval=1362859209 TSecr=910434907"
"406","0.971137538","192.168.1.118","172.217.6.214","TCP","66","41798 → 443 [ACK] Seq=1218 Ack=64157 Win=534 Len=0 TSval=1362859209 TSecr=4178950696"
"407","0.973604075","172.217.6.214","192.168.1.118","TLSv1.2","2902","Application Data, Application Data"
"408","0.973653863","172.217.6.214","192.168.1.118","TLSv1.2","472","Application Data"
"409","0.973707375","172.217.6.214","192.168.1.118","TLSv1.2","2902","Application Data, Application Data"
"410","0.973738350","192.168.1.118","172.217.6.214","TCP","66","41804 → 443 [ACK] Seq=1638 Ack=78600 Win=848 Len=0 TSval=1362859212 TSecr=4049552797"
"411","0.973829713","172.217.6.214","192.168.1.118","TLSv1.2","2902","Application Data, Application Data"
"412","0.975963775","192.168.1.118","172.217.6.214","TCP","66","41802 → 443 [ACK] Seq=1218 Ack=50149 Win=445 Len=0 TSval=1362859214 TSecr=910434908"
"413","0.976270088","192.168.1.118","172.217.6.214","TLSv1.2","363","Application Data"
"414","0.976924988","172.217.6.214","192.168.1.118","TLSv1.2","1797","Application Data, Application Data"
"415","0.976972975","192.168.1.118","172.217.6.214","TCP","66","41804 → 443 [ACK] Seq=1638 Ack=80331 Win=875 Len=0 TSval=1362859215 TSecr=4049552798"
"416","0.977010688","172.217.6.214","192.168.1.118","TLSv1.2","2902","Application Data, Application Data"
"417","0.977024163","172.217.6.214","192.168.1.118","TLSv1.2","479","Application Data"
"418","0.977035363","172.217.6.214","192.168.1.118","TLSv1.2","1484","Application Data"
"419","0.977065525","172.217.6.214","192.168.1.118","TLSv1.2","2902","Application Data, Application Data"
"420","0.979838613","192.168.1.118","172.217.6.214","TCP","66","41802 → 443 [ACK] Seq=1218 Ack=53398 Win=420 Len=0 TSval=1362859218 TSecr=910434912"
"421","0.979977200","192.168.1.118","172.217.6.214","TCP","66","41806 → 443 [ACK] Seq=1735 Ack=49687 Win=468 Len=0 TSval=1362859218 TSecr=3646315544"
"422","0.980212850","192.168.1.118","172.217.6.214","TLSv1.2","363","Application Data"
"423","0.982754238","172.217.6.214","192.168.1.118","TLSv1.2","1484","Application Data"
"424","0.983098475","192.168.1.118","172.217.6.214","TLSv1.2","363","Application Data"
"425","0.984765488","172.217.6.214","192.168.1.118","TLSv1.2","2280","Application Data, Application Data"
"426","0.984826838","192.168.1.118","172.217.6.214","TCP","66","41806 → 443 [ACK] Seq=1735 Ack=53319 Win=477 Len=0 TSval=1362859223 TSecr=3646315546"
"427","0.988054050","192.168.1.118","172.217.6.214","TLSv1.2","363","Application Data"
"428","0.988185450","192.168.1.118","172.217.6.214","TLSv1.2","363","Application Data"
"429","1.001694588","172.217.6.214","192.168.1.118","TLSv1.2","1484","Application Data"
"430","1.002932613","172.217.6.214","192.168.1.118","TLSv1.2","1484","Application Data"
"431","1.002985188","172.217.6.214","192.168.1.118","TLSv1.2","1484","Application Data"
"432","1.003008275","172.217.6.214","192.168.1.118","TLSv1.2","1484","Application Data"
"433","1.003039813","192.168.1.118","172.217.6.214","TCP","66","41804 → 443 [ACK] Seq=1935 Ack=83167 Win=920 Len=0 TSval=1362859241 TSecr=4049552834"
"434","1.007107163","172.217.6.214","192.168.1.118","TLSv1.2","1484","Application Data"
"435","1.007165425","172.217.6.214","192.168.1.118","TLSv1.2","2902","Application Data, Application Data"
"436","1.007190813","172.217.6.214","192.168.1.118","TLSv1.2","2406","Application Data, Application Data"
"437","1.008853500","172.217.6.214","192.168.1.118","TLSv1.2","2566","Application Data, Application Data"
"438","1.008907763","172.217.6.214","192.168.1.118","TLSv1.2","2902","Application Data, Application Data"
"439","1.008916338","192.168.1.118","172.217.6.214","TCP","66","41800 → 443 [ACK] Seq=1218 Ack=72681 Win=619 Len=0 TSval=1362859247 TSecr=1708732564"
"440","1.008958175","192.168.1.118","172.217.6.214","TCP","66","41804 → 443 [ACK] Seq=1935 Ack=87421 Win=986 Len=0 TSval=1362859247 TSecr=4049552834"
"441","1.009025863","172.217.6.214","192.168.1.118","TLSv1.2","2902","Application Data, Application Data"
"442","1.009041550","192.168.1.118","172.217.6.214","TCP","66","41804 → 443 [ACK] Seq=1935 Ack=90257 Win=1031 Len=0 TSval=1362859247 TSecr=4049552838"
"443","1.009336588","192.168.1.118","172.217.6.214","TCP","66","41798 → 443 [ACK] Seq=1515 Ack=71317 Win=541 Len=0 TSval=1362859247 TSecr=4178950736"
"444","1.011163425","172.217.6.214","192.168.1.118","TLSv1.2","2902","Application Data, Application Data"
"445","1.011223275","192.168.1.118","172.217.6.214","TCP","66","41804 → 443 [ACK] Seq=1935 Ack=93093 Win=1044 Len=0 TSval=1362859250 TSecr=4049552840"
"446","1.011801038","192.168.1.118","172.217.6.214","TLSv1.2","363","Application Data"
"447","1.015122038","192.168.1.118","172.217.6.214","TLSv1.2","363","Application Data"
"448","1.015952550","172.217.6.214","192.168.1.118","TLSv1.2","964","Application Data"
"449","1.016007513","172.217.6.214","192.168.1.118","TLSv1.2","1484","Application Data"
"450","1.016036463","172.217.6.214","192.168.1.118","TLSv1.2","1484","Application Data"
"451","1.019647925","192.168.1.118","172.217.6.214","TLSv1.2","363","Application Data"
"452","1.028216463","172.217.6.214","192.168.1.118","TLSv1.2","2902","Application Data, Application Data"
"453","1.028273263","172.217.6.214","192.168.1.118","TLSv1.2","2902","Application Data, Application Data"
"454","1.028341900","172.217.6.214","192.168.1.118","TLSv1.2","2902","Application Data, Application Data"
"455","1.028378500","172.217.6.214","192.168.1.118","TLSv1.2","1985","Application Data, Application Data"
"456","1.028393988","172.217.6.214","192.168.1.118","TLSv1.2","2902","Application Data, Application Data"
"457","1.028414250","172.217.6.214","192.168.1.118","TLSv1.2","2902","Application Data, Application Data"
"458","1.028422488","172.217.6.214","192.168.1.118","TLSv1.2","156","Application Data"
"459","1.031339275","192.168.1.118","172.217.6.214","TCP","66","41802 → 443 [ACK] Seq=1515 Ack=63414 Win=423 Len=0 TSval=1362859270 TSecr=910434956"
"460","1.031436350","192.168.1.118","172.217.6.214","TCP","66","41806 → 443 [ACK] Seq=2032 Ack=62328 Win=431 Len=0 TSval=1362859270 TSecr=3646315585"
"461","1.036176025","172.217.6.214","192.168.1.118","TLSv1.2","1484","Application Data"
"462","1.038052000","172.217.6.214","192.168.1.118","TLSv1.2","2902","Application Data, Application Data"
"463","1.038110138","172.217.6.214","192.168.1.118","TLSv1.2","2902","Application Data, Application Data"
"464","1.038166600","192.168.1.118","172.217.6.214","TCP","66","41800 → 443 [ACK] Seq=1515 Ack=79771 Win=587 Len=0 TSval=1362859276 TSecr=1708732594"
"465","1.038175138","172.217.6.214","192.168.1.118","TLSv1.2","2902","Application Data, Application Data"
"466","1.038232088","192.168.1.118","172.217.6.214","TCP","66","41800 → 443 [ACK] Seq=1515 Ack=82607 Win=565 Len=0 TSval=1362859277 TSecr=1708732598"
"467","1.039051738","172.217.6.214","192.168.1.118","TLSv1.2","2539","Application Data, Application Data"
"468","1.040559863","192.168.1.118","172.217.6.214","TCP","66","41800 → 443 [ACK] Seq=1515 Ack=85080 Win=546 Len=0 TSval=1362859279 TSecr=1708732600"
"469","1.065644725","192.168.1.102","224.0.0.251","MDNS","81","Standard query 0x0000 PTR _googlerpc._tcp.local, "QM" question"
"470","1.067272250","192.168.1.102","224.0.0.251","MDNS","91","Standard query 0x0000 SRV googlerpc._googlerpc._tcp.local, "QM" question"
"471","1.071730475","192.168.1.118","72.21.91.29","TCP","66","38622 → 80 [ACK] Seq=1 Ack=1 Win=501 Len=0 TSval=3421395933 TSecr=4245564520"
"472","1.071785100","192.168.1.118","172.217.9.227","TCP","66","38024 → 80 [ACK] Seq=1 Ack=1 Win=501 Len=0 TSval=3269508821 TSecr=3937330629"
"473","1.073548113","192.168.1.102","224.0.0.251","MDNS","158","Standard query response 0x0000 SRV, cache flush 0 0 8012 2c3f16b2-da5c-4b6f-d6cf-bfba61c12490.local A, cache flush 192.168.1.102"
"474","1.078544200","192.168.1.102","224.0.0.251","MDNS","268","Standard query response 0x0000 PTR 2c3f16b2-da5c-4b6f-d6cf-bfba61c12490._googlezone._tcp.local TXT, cache flush SRV, cache flush 610 60 10001 2c3f16b2-da5c-4b6f-d6cf-bfba61c12490.local A, cache flush 192.168.1.102"
"475","1.080963963","172.217.6.214","192.168.1.118","TLSv1.2","1484","Application Data"
"476","1.083199700","172.217.6.214","192.168.1.118","TLSv1.2","2902","Application Data, Application Data"
"477","1.083247838","172.217.6.214","192.168.1.118","TLSv1.2","180","Application Data"
"478","1.083268875","172.217.6.214","192.168.1.118","TLSv1.2","1484","Application Data"
"479","1.083298725","172.217.6.214","192.168.1.118","TLSv1.2","1484","Application Data"
"480","1.083327625","192.168.1.118","172.217.6.214","TCP","66","41804 → 443 [ACK] Seq=2232 Ack=96827 Win=1088 Len=0 TSval=1362859322 TSecr=4049552905"
"481","1.083816750","192.168.1.118","172.217.6.214","TCP","66","41798 → 443 [ACK] Seq=1812 Ack=75685 Win=557 Len=0 TSval=1362859322 TSecr=4178950800"
"482","1.087281450","172.217.6.214","192.168.1.118","TLSv1.2","1484","Application Data"
"483","1.087345088","172.217.6.214","192.168.1.118","TLSv1.2","2902","Application Data, Application Data"
"484","1.087381713","192.168.1.118","172.217.6.214","TCP","66","41804 → 443 [ACK] Seq=2232 Ack=101081 Win=1108 Len=0 TSval=1362859326 TSecr=4049552905"
"485","1.087418738","172.217.6.214","192.168.1.118","TLSv1.2","1646","Application Data, Application Data"
"486","1.088531475","192.168.1.118","172.217.6.214","TCP","66","41804 → 443 [ACK] Seq=2232 Ack=102661 Win=1096 Len=0 TSval=1362859327 TSecr=4049552909"
"487","1.097275775","72.21.91.29","192.168.1.118","TCP","66","[TCP ACKed unseen segment] 80 → 38622 [ACK] Seq=1 Ack=2 Win=152 Len=0 TSval=4245574770 TSecr=3421375522"
"488","1.121786975","172.217.9.227","192.168.1.118","TCP","66","[TCP ACKed unseen segment] 80 → 38024 [ACK] Seq=1 Ack=2 Win=265 Len=0 TSval=3937340881 TSecr=3269447352"
"489","1.574726075","192.168.1.118","136.147.57.1","TLSv1.2","97","Encrypted Alert"
"490","1.574798988","192.168.1.118","136.147.57.1","TCP","66","41798 → 443 [FIN, ACK] Seq=32 Ack=1 Win=63356 Len=0 TSval=2874408893 TSecr=694828887"
"491","1.583723013","192.168.1.118","104.118.9.120","TCP","66","39706 → 443 [ACK] Seq=1 Ack=1 Win=501 Len=0 TSval=3031478082 TSecr=3094259551"
"492","1.590994100","192.168.1.118","172.217.12.164","TLSv1.2","105","Application Data"
"493","1.600478875","104.118.9.120","192.168.1.118","TCP","66","[TCP ACKed unseen segment] 443 → 39706 [ACK] Seq=1 Ack=2 Win=252 Len=0 TSval=3094269788 TSecr=3031437083"
"494","1.608931738","172.217.12.164","192.168.1.118","TLSv1.2","105","Application Data"
"495","1.609003125","192.168.1.118","172.217.12.164","TCP","66","36592 → 443 [ACK] Seq=40 Ack=40 Win=501 Len=0 TSval=2819606609 TSecr=2664346415"
"496","1.635621413","136.147.57.1","192.168.1.118","TCP","66","443 → 41798 [ACK] Seq=1 Ack=32 Win=5148 Len=0 TSval=694832457 TSecr=2874408893"
"497","1.636654650","136.147.57.1","192.168.1.118","TCP","66","443 → 41798 [ACK] Seq=1 Ack=33 Win=5148 Len=0 TSval=694832457 TSecr=2874408893"
"498","1.636720363","136.147.57.1","192.168.1.118","TLSv1.2","97","Encrypted Alert"
"499","1.636767313","192.168.1.118","136.147.57.1","TCP","54","41798 → 443 [RST] Seq=33 Win=0 Len=0"
"500","1.636806400","136.147.57.1","192.168.1.118","TCP","66","443 → 41798 [FIN, ACK] Seq=32 Ack=33 Win=5148 Len=0 TSval=694832457 TSecr=2874408893"
"501","1.636823213","192.168.1.118","136.147.57.1","TCP","54","41798 → 443 [RST] Seq=33 Win=0 Len=0"
"502","2.095716900","192.168.1.118","199.232.36.64","TCP","66","37932 → 443 [ACK] Seq=1 Ack=1 Win=501 Len=0 TSval=4147895125 TSecr=290424840"
"503","2.095758538","192.168.1.118","13.225.218.225","TCP","66","35526 → 80 [ACK] Seq=1 Ack=1 Win=501 Len=0 TSval=446609663 TSecr=1049814770"
"504","2.116522900","199.232.36.64","192.168.1.118","TCP","66","[TCP ACKed unseen segment] 443 → 37932 [ACK] Seq=1 Ack=2 Win=57 Len=0 TSval=290427398 TSecr=4147813238"
"505","2.131597150","13.225.218.225","192.168.1.118","TCP","66","[TCP ACKed unseen segment] 80 → 35526 [ACK] Seq=1 Ack=2 Win=126 Len=0 TSval=1049815795 TSecr=446517430"
"506","2.246732063","192.168.1.118","172.217.10.46","TLSv1.2","302","Application Data"
"507","2.271906000","172.217.10.46","192.168.1.118","TLSv1.2","1484","Application Data"
"508","2.271982838","192.168.1.118","172.217.10.46","TCP","66","43638 → 443 [ACK] Seq=527 Ack=4012 Win=493 Len=0 TSval=1322499323 TSecr=3060859500"
"509","2.273352050","172.217.10.46","192.168.1.118","TLSv1.2","1484","Application Data"
"510","2.273413388","192.168.1.118","172.217.10.46","TCP","66","43638 → 443 [ACK] Seq=527 Ack=5430 Win=482 Len=0 TSval=1322499325 TSecr=3060859500"
"511","2.276005988","172.217.10.46","192.168.1.118","TLSv1.2","1484","Application Data"
"512","2.276071588","192.168.1.118","172.217.10.46","TCP","66","43638 → 443 [ACK] Seq=527 Ack=6848 Win=471 Len=0 TSval=1322499327 TSecr=3060859500"
"513","2.276122538","172.217.10.46","192.168.1.118","TLSv1.2","2902","Application Data, Application Data"
"514","2.276142213","192.168.1.118","172.217.10.46","TCP","66","43638 → 443 [ACK] Seq=527 Ack=9684 Win=449 Len=0 TSval=1322499327 TSecr=3060859502"
"515","2.276932750","172.217.10.46","192.168.1.118","TLSv1.2","2902","Application Data, Application Data"
"516","2.276989813","192.168.1.118","172.217.10.46","TCP","66","43638 → 443 [ACK] Seq=527 Ack=12520 Win=427 Len=0 TSval=1322499328 TSecr=3060859504"
"517","2.279147138","172.217.10.46","192.168.1.118","TLSv1.2","2902","Application Data, Application Data"
"518","2.279207688","192.168.1.118","172.217.10.46","TCP","66","43638 → 443 [ACK] Seq=527 Ack=15356 Win=405 Len=0 TSval=1322499331 TSecr=3060859506"
"519","2.280104038","172.217.10.46","192.168.1.118","TLSv1.2","2902","Application Data, Application Data"
"520","2.280151438","192.168.1.118","172.217.10.46","TCP","66","43638 → 443 [ACK] Seq=527 Ack=18192 Win=383 Len=0 TSval=1322499331 TSecr=3060859508"
"521","2.286791875","172.217.10.46","192.168.1.118","TLSv1.2","1771","Application Data, Application Data"
"522","2.286859363","192.168.1.118","172.217.10.46","TCP","66","43638 → 443 [ACK] Seq=527 Ack=19897 Win=370 Len=0 TSval=1322499338 TSecr=3060859509"
"523","2.397615863","192.168.1.104","255.255.255.255","UDP","217","49154 → 6666 Len=175"
"524","2.591612563","192.168.1.118","13.110.24.13","TLSv1.2","112","Application Data"
"525","2.607722100","fe80::defb:48ff:feb7:5273","ff02::2","ICMPv6","70","Router Solicitation from dc:fb:48:b7:52:73"
"526","2.639121688","13.110.24.13","192.168.1.118","TLSv1.2","112","Application Data"
"527","2.639194613","192.168.1.118","13.110.24.13","TCP","66","35644 → 443 [ACK] Seq=47 Ack=47 Win=501 Len=0 TSval=2599461943 TSecr=3339359787"
"528","3.469412775","192.168.1.118","192.168.1.102","TCP","176","40918 → 8009 [PSH, ACK] Seq=1 Ack=1 Win=501 Len=110 TSval=2814567303 TSecr=4487512 [TCP segment of a reassembled PDU]"
"529","3.500918063","192.168.1.102","192.168.1.118","TCP","176","8009 → 40918 [PSH, ACK] Seq=1 Ack=111 Win=277 Len=110 TSval=4488014 TSecr=2814567303 [TCP segment of a reassembled PDU]"
"530","3.500995513","192.168.1.118","192.168.1.102","TCP","66","40918 → 8009 [ACK] Seq=111 Ack=111 Win=501 Len=0 TSval=2814567334 TSecr=4488014"
"531","5.114462788","192.168.1.118","172.217.3.106","TCP","74","33642 → 443 [SYN] Seq=0 Win=64240 Len=0 MSS=1460 SACK_PERM=1 TSval=2827170530 TSecr=0 WS=128"
"532","5.135109800","172.217.3.106","192.168.1.118","TCP","74","443 → 33642 [SYN, ACK] Seq=0 Ack=1 Win=60192 Len=0 MSS=1380 SACK_PERM=1 TSval=243193399 TSecr=2827170530 WS=256"
"533","5.135303313","192.168.1.118","172.217.3.106","TCP","66","33642 → 443 [ACK] Seq=1 Ack=1 Win=64256 Len=0 TSval=2827170551 TSecr=243193399"
"534","5.167731625","192.168.1.118","136.147.57.1","TCP","66","41744 → 443 [ACK] Seq=1 Ack=1 Win=63356 Len=0 TSval=2874412486 TSecr=694825815"
"535","5.223998775","136.147.57.1","192.168.1.118","TCP","66","[TCP ACKed unseen segment] 443 → 41744 [ACK] Seq=1 Ack=2 Win=8793 Len=0 TSval=694836052 TSecr=2874299962"
"536","5.312558963","192.168.1.118","172.217.3.106","TLSv1","250","Client Hello"
"537","5.332363063","172.217.3.106","192.168.1.118","TCP","66","443 → 33642 [ACK] Seq=1 Ack=185 Win=61440 Len=0 TSval=243193598 TSecr=2827170728"
"538","5.338454875","172.217.3.106","192.168.1.118","TLSv1.2","1484","Server Hello"
"539","5.338617588","192.168.1.118","172.217.3.106","TCP","66","33642 → 443 [ACK] Seq=185 Ack=1419 Win=63104 Len=0 TSval=2827170754 TSecr=243193605"
"540","5.341065125","172.217.3.106","192.168.1.118","TLSv1.2","1482","Certificate, Server Key Exchange, Server Hello Done"
"541","5.341211163","192.168.1.118","172.217.3.106","TCP","66","33642 → 443 [ACK] Seq=185 Ack=2835 Win=61696 Len=0 TSval=2827170756 TSecr=243193605"
"542","5.469388388","192.168.1.104","255.255.255.255","UDP","217","49154 → 6666 Len=175"
"543","5.978941838","Cisco-Li_5b:1c:ce","IntelCor_b7:52:73","ARP","42","Who has 192.168.1.118? Tell 192.168.1.1"
"544","5.978974600","IntelCor_b7:52:73","Cisco-Li_5b:1c:ce","ARP","42","192.168.1.118 is at dc:fb:48:b7:52:73"
"545","6.338463400","192.168.1.118","172.217.3.106","TLSv1.2","159","Client Key Exchange, Change Cipher Spec, Encrypted Handshake Message"
"546","6.359195113","172.217.3.106","192.168.1.118","TLSv1.2","358","New Session Ticket, Change Cipher Spec, Encrypted Handshake Message"
"547","6.359374500","192.168.1.118","172.217.3.106","TLSv1.2","1163","Application Data"
"548","6.384956538","172.217.3.106","192.168.1.118","TCP","66","443 → 33642 [ACK] Seq=3127 Ack=1375 Win=63488 Len=0 TSval=243194649 TSecr=2827171775"
"549","6.404461925","172.217.3.106","192.168.1.118","TLSv1.2","1484","Application Data"
"550","6.406380638","172.217.3.106","192.168.1.118","TLSv1.2","2881","Application Data, Application Data"
"551","6.406452188","172.217.3.106","192.168.1.118","TLSv1.2","1484","Application Data"
"552","6.406471413","172.217.3.106","192.168.1.118","TLSv1.2","1484","Application Data"
"553","6.406595138","172.217.3.106","192.168.1.118","TLSv1.2","1484","Application Data"
"554","6.406615263","172.217.3.106","192.168.1.118","TLSv1.2","232","Application Data"
"555","6.407866863","172.217.3.106","192.168.1.118","TLSv1.2","1484","Application Data"
"556","6.407936813","172.217.3.106","192.168.1.118","TLSv1.2","2853","Application Data, Application Data"
"557","6.408933888","172.217.3.106","192.168.1.118","TLSv1.2","2902","Application Data, Application Data"
"558","6.410273900","172.217.3.106","192.168.1.118","TLSv1.2","1484","Application Data"
"559","6.415267625","192.168.1.118","172.217.3.106","TCP","66","33642 → 443 [ACK] Seq=1375 Ack=20239 Win=46848 Len=0 TSval=2827171830 TSecr=243194671"
"560","6.452192600","172.217.3.106","192.168.1.118","TLSv1.2","1484","Application Data"
"561","6.453801288","172.217.3.106","192.168.1.118","TLSv1.2","1484","Application Data [TCP segment of a reassembled PDU]"
"562","6.453876288","172.217.3.106","192.168.1.118","TLSv1.2","2902","Application Data, Application Data, Application Data"
"563","6.453902500","172.217.3.106","192.168.1.118","TLSv1.2","2902","Application Data, Application Data"
"564","6.454021050","192.168.1.118","172.217.3.106","TCP","66","33642 → 443 [ACK] Seq=1375 Ack=23075 Win=66944 Len=0 TSval=2827171869 TSecr=243194716"
"565","6.455837938","172.217.3.106","192.168.1.118","TLSv1.2","1484","Application Data [TCP segment of a reassembled PDU]"
"566","6.457090825","172.217.3.106","192.168.1.118","TLSv1.2","1484","Application Data [TCP segment of a reassembled PDU]"
"567","6.457150988","172.217.3.106","192.168.1.118","TLSv1.2","1484","Application Data [TCP segment of a reassembled PDU]"
"568","6.457729513","172.217.3.106","192.168.1.118","TLSv1.2","1484","Application Data, Application Data"
"569","6.458894088","172.217.3.106","192.168.1.118","TLSv1.2","2902","Application Data, Application Data"
"570","6.459959438","172.217.3.106","192.168.1.118","TLSv1.2","1484","Application Data, Application Data"
"571","6.460700025","172.217.3.106","192.168.1.118","TLSv1.2","1484","Application Data [TCP segment of a reassembled PDU]"
"572","6.466038988","172.217.3.106","192.168.1.118","TLSv1.2","2902","Application Data, Application Data, Application Data"
"573","6.466113125","172.217.3.106","192.168.1.118","TLSv1.2","2902","Application Data, Application Data"
"574","6.467033975","172.217.3.106","192.168.1.118","TLSv1.2","2902","Application Data, Application Data"
"575","6.467599325","192.168.1.118","172.217.3.106","TCP","66","33642 → 443 [ACK] Seq=1375 Ack=48599 Win=41472 Len=0 TSval=2827171883 TSecr=243194717"
"576","6.468029675","172.217.3.106","192.168.1.118","TLSv1.2","1484","Application Data [TCP segment of a reassembled PDU]"
"577","6.470436213","172.217.3.106","192.168.1.118","TLSv1.2","1484","Application Data [TCP segment of a reassembled PDU]"
"578","6.471516163","172.217.3.106","192.168.1.118","TLSv1.2","2754","Application Data, Application Data, Application Data, Application Data"
"579","6.477496425","192.168.1.118","172.217.3.106","TCP","66","33642 → 443 [ACK] Seq=1375 Ack=54123 Win=35968 Len=0 TSval=2827171893 TSecr=243194734"
"580","7.594009225","192.168.1.118","35.241.35.241","TLSv1.2","105","Application Data"
"581","7.627765863","35.241.35.241","192.168.1.118","TCP","66","443 → 39606 [ACK] Seq=1 Ack=40 Win=248 Len=0 TSval=3786880765 TSecr=3577593195"
"582","7.628698738","35.241.35.241","192.168.1.118","TLSv1.2","105","Application Data"
"583","7.669724700","192.168.1.118","35.241.35.241","TCP","66","39606 → 443 [ACK] Seq=40 Ack=40 Win=501 Len=0 TSval=3577593271 TSecr=3786880765"
"584","7.727726150","192.168.1.118","104.74.65.169","TCP","66","43010 → 443 [ACK] Seq=1 Ack=1 Win=501 Len=0 TSval=705793157 TSecr=312891916"
"585","7.748697088","104.74.65.169","192.168.1.118","TCP","66","[TCP ACKed unseen segment] 443 → 43010 [ACK] Seq=1 Ack=2 Win=252 Len=0 TSval=312902156 TSecr=705762818"
"586","8.438179950","192.168.1.104","255.255.255.255","UDP","217","49154 → 6666 Len=175"
"587","8.502392438","192.168.1.118","192.168.1.102","TCP","176","40918 → 8009 [PSH, ACK] Seq=111 Ack=111 Win=501 Len=110 TSval=2814572336 TSecr=4488014 [TCP segment of a reassembled PDU]"
"588","8.507547663","192.168.1.102","192.168.1.118","TCP","176","8009 → 40918 [PSH, ACK] Seq=111 Ack=221 Win=277 Len=110 TSval=4488518 TSecr=2814572336 [TCP segment of a reassembled PDU]"
"589","8.507624038","192.168.1.118","192.168.1.102","TCP","66","40918 → 8009 [ACK] Seq=221 Ack=221 Win=501 Len=0 TSval=2814572341 TSecr=4488518"
"590","8.563496213","192.168.1.118","136.147.57.1","TLSv1.2","97","[TCP Previous segment not captured] , Encrypted Alert"
"591","8.563570638","192.168.1.118","136.147.57.1","TCP","66","41744 → 443 [FIN, ACK] Seq=33 Ack=1 Win=63356 Len=0 TSval=2874415882 TSecr=694836052"
"592","8.621998800","136.147.57.1","192.168.1.118","TCP","66","[TCP ACKed unseen segment] 443 → 41744 [ACK] Seq=1 Ack=33 Win=8824 Len=0 TSval=694839449 TSecr=2874415882"
"593","8.624743225","136.147.57.1","192.168.1.118","TLSv1.2","97","Encrypted Alert"
"594","8.624834488","192.168.1.118","136.147.57.1","TCP","54","41744 → 443 [RST] Seq=33 Win=0 Len=0"
"595","8.624876850","136.147.57.1","192.168.1.118","TCP","66","443 → 41744 [FIN, ACK] Seq=32 Ack=33 Win=8824 Len=0 TSval=694839450 TSecr=2874415882"
"596","8.624897425","192.168.1.118","136.147.57.1","TCP","54","41744 → 443 [RST] Seq=33 Win=0 Len=0"
"597","8.628780150","136.147.57.1","192.168.1.118","TCP","66","443 → 41744 [ACK] Seq=33 Ack=34 Win=8824 Len=0 TSval=694839456 TSecr=2874415882"
"598","8.628854063","192.168.1.118","136.147.57.1","TCP","54","41744 → 443 [RST] Seq=34 Win=0 Len=0"
"599","9.263731775","192.168.1.118","52.201.150.235","TCP","66","35500 → 443 [ACK] Seq=1 Ack=1 Win=501 Len=0 TSval=2864349627 TSecr=1479310951"
"600","9.263784813","192.168.1.118","23.43.59.146","TCP","66","34554 → 443 [ACK] Seq=1 Ack=1 Win=501 Len=0 TSval=319227885 TSecr=214707423"
"601","9.263803625","192.168.1.118","13.225.221.21","TCP","66","38948 → 443 [ACK] Seq=1 Ack=1 Win=501 Len=0 TSval=819407312 TSecr=1048781785"
"602","9.263821700","192.168.1.118","199.232.36.133","TCP","66","38130 → 443 [ACK] Seq=1 Ack=1 Win=501 Len=0 TSval=1209125628 TSecr=2725900849"
"603","9.284867738","23.43.59.146","192.168.1.118","TCP","66","[TCP ACKed unseen segment] 443 → 34554 [ACK] Seq=1 Ack=2 Win=243 Len=0 TSval=214717665 TSecr=319125606"
"604","9.285940800","199.232.36.133","192.168.1.118","TCP","66","[TCP ACKed unseen segment] 443 → 38130 [ACK] Seq=1 Ack=2 Win=57 Len=0 TSval=2725911090 TSecr=1209105125"
"605","9.285975738","13.225.221.21","192.168.1.118","TCP","66","[TCP ACKed unseen segment] 443 → 38948 [ACK] Seq=1 Ack=2 Win=122 Len=0 TSval=1048782809 TSecr=819304846"
"606","9.291077275","52.201.150.235","192.168.1.118","TCP","66","[TCP ACKed unseen segment] 443 → 35500 [ACK] Seq=1 Ack=2 Win=198 Len=0 TSval=1479321193 TSecr=2864298449"
"607","9.595326688","192.168.1.118","172.217.6.211","TLSv1.2","105","Application Data"
"608","9.595429975","192.168.1.118","142.250.64.83","TLSv1.2","105","Application Data"
"609","9.619983975","172.217.6.211","192.168.1.118","TCP","66","443 → 33656 [ACK] Seq=1 Ack=40 Win=248 Len=0 TSval=591024121 TSecr=580488189"
"610","9.630181450","142.250.64.83","192.168.1.118","TCP","66","443 → 44520 [ACK] Seq=1 Ack=40 Win=248 Len=0 TSval=3017215637 TSecr=3998467732"
"611","9.631439125","172.217.6.211","192.168.1.118","TLSv1.2","105","Application Data"
"612","9.642459488","142.250.64.83","192.168.1.118","TLSv1.2","105","Application Data"
"613","9.671735013","192.168.1.118","172.217.6.211","TCP","66","33656 → 443 [ACK] Seq=40 Ack=40 Win=501 Len=0 TSval=580488265 TSecr=591024134"
"614","9.682723775","192.168.1.118","142.250.64.83","TCP","66","44520 → 443 [ACK] Seq=40 Ack=40 Win=501 Len=0 TSval=3998467819 TSecr=3017215651"
