frame.number,_ws.col.Time,_ws.col.Source,_ws.col.Destination,_ws.col.Protocol,frame.len,_ws.col.Info
"1","0.000000000","192.168.1.118","199.232.37.140","TLSv1","583","Client Hello"
"2","0.000368600","192.168.1.118","199.232.37.140","TCP","74","36444 → 443 [SYN] Seq=0 Win=64240 Len=0 MSS=1460 SACK_PERM=1 TSval=1241965420 TSecr=0 WS=128"
"3","0.000869387","192.168.1.118","199.232.37.140","TCP","74","36446 → 443 [SYN] Seq=0 Win=64240 Len=0 MSS=1460 SACK_PERM=1 TSval=1241965420 TSecr=0 WS=128"
"4","0.001240275","192.168.1.118","199.232.37.140","TCP","74","36448 → 443 [SYN] Seq=0 Win=64240 Len=0 MSS=1460 SACK_PERM=1 TSval=1241965420 TSecr=0 WS=128"
"5","0.004604987","192.168.1.118","199.232.37.140","TLSv1.2","192","Client Key Exchange, Change Cipher Spec, Encrypted Handshake Message"
"6","0.006594487","192.168.1.118","199.232.37.140","TLSv1.2","192","Client Key Exchange, Change Cipher Spec, Encrypted Handshake Message"
"7","0.026651187","199.232.37.140","192.168.1.118","TCP","74","443 → 36444 [SYN, ACK] Seq=0 Ack=1 Win=27040 Len=0 MSS=1364 SACK_PERM=1 TSval=1823589220 TSecr=1241965420 WS=512"
"8","0.026739275","192.168.1.118","199.232.37.140","TCP","66","36444 → 443 [ACK] Seq=1 Ack=1 Win=64256 Len=0 TSval=1241965446 TSecr=1823589220"
"9","0.028481162","199.232.37.140","192.168.1.118","TCP","66","443 → 36430 [ACK] Seq=1 Ack=518 Win=55 Len=0 TSval=1135287989 TSecr=1241965414"
"10","0.033400287","199.232.37.140","192.168.1.118","TLSv1.2","3304","Server Hello, Certificate, Server Key Exchange, Server Hello Done"
"11","0.033463950","192.168.1.118","199.232.37.140","TCP","66","36430 → 443 [ACK] Seq=518 Ack=3239 Win=477 Len=0 TSval=1241965453 TSecr=1135287989"
"12","0.034718612","199.232.37.140","192.168.1.118","TLSv1.2","117","Change Cipher Spec, Encrypted Handshake Message"
"13","0.034779675","192.168.1.118","199.232.37.140","TCP","66","36426 → 443 [ACK] Seq=127 Ack=52 Win=501 Len=0 TSval=1241965454 TSecr=2831080134"
"14","0.034829175","199.232.37.140","192.168.1.118","TCP","74","443 → 36446 [SYN, ACK] Seq=0 Ack=1 Win=27040 Len=0 MSS=1364 SACK_PERM=1 TSval=3932427427 TSecr=1241965420 WS=512"
"15","0.034871862","192.168.1.118","199.232.37.140","TCP","66","36446 → 443 [ACK] Seq=1 Ack=1 Win=64256 Len=0 TSval=1241965454 TSecr=3932427427"
"16","0.036250637","199.232.37.140","192.168.1.118","TLSv1.2","117","Change Cipher Spec, Encrypted Handshake Message"
"17","0.036312537","192.168.1.118","199.232.37.140","TCP","66","36428 → 443 [ACK] Seq=127 Ack=52 Win=501 Len=0 TSval=1241965455 TSecr=530928448"
"18","0.036347337","199.232.37.140","192.168.1.118","TCP","74","443 → 36448 [SYN, ACK] Seq=0 Ack=1 Win=27040 Len=0 MSS=1364 SACK_PERM=1 TSval=3165516306 TSecr=1241965420 WS=512"
"19","0.036387500","192.168.1.118","199.232.37.140","TCP","66","36448 → 443 [ACK] Seq=1 Ack=1 Win=64256 Len=0 TSval=1241965456 TSecr=3165516306"
"20","0.053423125","192.168.1.118","199.232.37.140","TLSv1","583","Client Hello"
"21","0.068727412","199.232.37.140","192.168.1.118","TCP","66","443 → 36432 [ACK] Seq=1 Ack=518 Win=55 Len=0 TSval=294949694 TSecr=1241965473"
"22","0.070920012","199.232.37.140","192.168.1.118","TLSv1.2","1418","Server Hello"
"23","0.070983212","192.168.1.118","199.232.37.140","TCP","66","36432 → 443 [ACK] Seq=518 Ack=1353 Win=493 Len=0 TSval=1241965490 TSecr=294949695"
"24","0.072706875","199.232.37.140","192.168.1.118","TLSv1.2","1984","Certificate, Server Key Exchange, Server Hello Done"
"25","0.072768512","192.168.1.118","199.232.37.140","TCP","66","36432 → 443 [ACK] Seq=518 Ack=3271 Win=479 Len=0 TSval=1241965492 TSecr=294949695"
"26","0.092627037","192.168.1.118","199.232.37.140","TLSv1","583","Client Hello"
"27","0.112341400","199.232.37.140","192.168.1.118","TCP","66","443 → 36434 [ACK] Seq=1 Ack=518 Win=55 Len=0 TSval=294226998 TSecr=1241965512"
"28","0.114662275","199.232.37.140","192.168.1.118","TLSv1.2","3432","Server Hello, Certificate, Server Key Exchange, Server Hello Done"
"29","0.114726200","192.168.1.118","199.232.37.140","TCP","66","36434 → 443 [ACK] Seq=518 Ack=3367 Win=476 Len=0 TSval=1241965534 TSecr=294226999"
"30","0.129084100","192.168.1.118","199.232.37.140","TLSv1","583","Client Hello"
"31","0.153193400","199.232.37.140","192.168.1.118","TCP","66","443 → 36436 [ACK] Seq=1 Ack=518 Win=55 Len=0 TSval=2829969547 TSecr=1241965548"
"32","0.157906950","192.168.1.100","224.0.0.251","MDNS","105","Standard query 0x0000 PTR _googlecast._tcp.local, "QM" question OPT"
"33","0.159913912","fe80::1cc7:6d9a:a312:7e8f","ff02::fb","MDNS","125","Standard query 0x0000 PTR _googlecast._tcp.local, "QM" question OPT"
"34","0.160963062","199.232.37.140","192.168.1.118","TLSv1.2","1418","Server Hello"
"35","0.161019050","192.168.1.118","199.232.37.140","TCP","66","36436 → 443 [ACK] Seq=518 Ack=1353 Win=493 Len=0 TSval=1241965580 TSecr=2829969547"
"36","0.163162087","199.232.37.140","192.168.1.118","TLSv1.2","2080","Certificate, Server Key Exchange, Server Hello Done"
"37","0.163230525","192.168.1.118","199.232.37.140","TCP","66","36436 → 443 [ACK] Seq=518 Ack=3367 Win=478 Len=0 TSval=1241965582 TSecr=2829969547"
"38","0.167306412","192.168.1.118","199.232.37.140","TLSv1","583","Client Hello"
"39","0.188194425","199.232.37.140","192.168.1.118","TCP","66","443 → 36438 [ACK] Seq=1 Ack=518 Win=55 Len=0 TSval=2831769283 TSecr=1241965586"
"40","0.189659925","199.232.37.140","192.168.1.118","TLSv1.2","1418","Server Hello"
"41","0.189720725","192.168.1.118","199.232.37.140","TCP","66","36438 → 443 [ACK] Seq=518 Ack=1353 Win=493 Len=0 TSval=1241965609 TSecr=2831769284"
"42","0.191403375","199.232.37.140","192.168.1.118","TLSv1.2","2080","Certificate, Server Key Exchange, Server Hello Done"
"43","0.191468137","192.168.1.118","199.232.37.140","TCP","66","36438 → 443 [ACK] Seq=518 Ack=3367 Win=478 Len=0 TSval=1241965611 TSecr=2831769284"
"44","0.201761775","192.168.1.118","199.232.37.140","TLSv1","583","Client Hello"
"45","0.224012675","199.232.37.140","192.168.1.118","TCP","66","443 → 36440 [ACK] Seq=1 Ack=518 Win=55 Len=0 TSval=2832023585 TSecr=1241965621"
"46","0.225827425","199.232.37.140","192.168.1.118","TLSv1.2","1418","Server Hello"
"47","0.225890775","192.168.1.118","199.232.37.140","TCP","66","36440 → 443 [ACK] Seq=518 Ack=1353 Win=493 Len=0 TSval=1241965645 TSecr=2832023585"
"48","0.227602762","199.232.37.140","192.168.1.118","TLSv1.2","1984","Certificate, Server Key Exchange, Server Hello Done"
"49","0.227664212","192.168.1.118","199.232.37.140","TCP","66","36440 → 443 [ACK] Seq=518 Ack=3271 Win=479 Len=0 TSval=1241965647 TSecr=2832023585"
"50","0.237999275","192.168.1.118","199.232.37.140","TLSv1","583","Client Hello"
"51","0.244616125","192.168.1.118","199.232.37.140","TLSv1.2","192","Client Key Exchange, Change Cipher Spec, Encrypted Handshake Message"
"52","0.262675012","192.168.1.102","224.0.0.251","MDNS","409","Standard query response 0x0000 PTR Google-Home-Mini-2c3f16b2da5c4b6fd6cfbfba61c12490._googlecast._tcp.local TXT, cache flush SRV, cache flush 0 0 8009 2c3f16b2-da5c-4b6f-d6cf-bfba61c12490.local A, cache flush 192.168.1.102"
"53","0.264119775","199.232.37.140","192.168.1.118","TCP","66","443 → 36442 [ACK] Seq=1 Ack=518 Win=55 Len=0 TSval=2830180855 TSecr=1241965657"
"54","0.273881675","199.232.37.140","192.168.1.118","TLSv1.2","3432","Server Hello, Certificate, Server Key Exchange, Server Hello Done"
"55","0.273949062","192.168.1.118","199.232.37.140","TCP","66","36442 → 443 [ACK] Seq=518 Ack=3367 Win=476 Len=0 TSval=1241965693 TSecr=2830180856"
"56","0.275182400","199.232.37.140","192.168.1.118","TLSv1.2","117","Change Cipher Spec, Encrypted Handshake Message"
"57","0.275248637","192.168.1.118","199.232.37.140","TCP","66","36430 → 443 [ACK] Seq=644 Ack=3290 Win=501 Len=0 TSval=1241965694 TSecr=1135288050"
"58","0.281550137","192.168.1.118","199.232.37.140","TLSv1","583","Client Hello"
"59","0.314416075","192.168.1.118","199.232.37.140","TLSv1","583","Client Hello"
"60","0.316876100","199.232.37.140","192.168.1.118","TCP","66","443 → 36444 [ACK] Seq=1 Ack=518 Win=28160 Len=0 TSval=1823589506 TSecr=1241965701"
"61","0.319300287","199.232.37.140","192.168.1.118","TLSv1.2","3314","Server Hello, Certificate, Server Key Exchange, Server Hello Done"
"62","0.319363762","192.168.1.118","199.232.37.140","TCP","66","36444 → 443 [ACK] Seq=518 Ack=3249 Win=61056 Len=0 TSval=1241965739 TSecr=1823589508"
"63","0.333733237","199.232.37.140","192.168.1.118","TCP","66","443 → 36446 [ACK] Seq=1 Ack=518 Win=28160 Len=0 TSval=3932427502 TSecr=1241965734"
"64","0.335191250","199.232.37.140","192.168.1.118","TLSv1.2","2770","Server Hello"
"65","0.335251587","192.168.1.118","199.232.37.140","TCP","66","36446 → 443 [ACK] Seq=518 Ack=2705 Win=61568 Len=0 TSval=1241965754 TSecr=3932427502"
"66","0.336292712","199.232.37.140","192.168.1.118","TLSv1.2","610","Certificate, Server Key Exchange, Server Hello Done"
"67","0.336334137","192.168.1.118","199.232.37.140","TCP","66","36446 → 443 [ACK] Seq=518 Ack=3249 Win=61056 Len=0 TSval=1241965755 TSecr=3932427502"
"68","0.361836325","192.168.1.118","199.232.37.140","TLSv1","583","Client Hello"
"69","0.362222900","192.168.1.118","199.232.37.140","TLSv1.2","272","Application Data"
"70","0.362443062","192.168.1.118","199.232.37.140","TLSv1.2","279","Application Data"
"71","0.370211487","192.168.1.118","199.232.37.140","TLSv1.2","192","Client Key Exchange, Change Cipher Spec, Encrypted Handshake Message"
"72","0.372287237","192.168.1.118","199.232.37.140","TLSv1.2","192","Client Key Exchange, Change Cipher Spec, Encrypted Handshake Message"
"73","0.374265837","192.168.1.118","199.232.37.140","TLSv1.2","192","Client Key Exchange, Change Cipher Spec, Encrypted Handshake Message"
"74","0.384076300","192.168.1.118","199.232.37.140","TLSv1.2","192","Client Key Exchange, Change Cipher Spec, Encrypted Handshake Message"
"75","0.386115937","192.168.1.118","199.232.37.140","TLSv1.2","192","Client Key Exchange, Change Cipher Spec, Encrypted Handshake Message"
"76","0.388025837","192.168.1.118","199.232.37.140","TLSv1.2","192","Client Key Exchange, Change Cipher Spec, Encrypted Handshake Message"
"77","0.388340100","192.168.1.118","199.232.37.140","TLSv1.2","274","Application Data"
"78","0.392032725","192.168.1.118","199.232.37.140","TLSv1.2","192","Client Key Exchange, Change Cipher Spec, Encrypted Handshake Message"
"79","0.393370437","199.232.37.140","192.168.1.118","TCP","66","443 → 36448 [ACK] Seq=1 Ack=518 Win=28160 Len=0 TSval=3165516396 TSecr=1241965781"
"80","0.394888325","192.168.1.118","199.232.37.140","TLSv1.2","192","Client Key Exchange, Change Cipher Spec, Encrypted Handshake Message"
"81","0.394959250","199.232.37.140","192.168.1.118","TLSv1.2","744","Application Data, Application Data"
"82","0.395031462","192.168.1.118","199.232.37.140","TCP","66","36428 → 443 [ACK] Seq=340 Ack=730 Win=496 Len=0 TSval=1241965814 TSecr=530928538"
"83","0.395071700","199.232.37.140","192.168.1.118","TLSv1.2","1418","Application Data"
"84","0.395093250","192.168.1.118","199.232.37.140","TCP","66","36426 → 443 [ACK] Seq=333 Ack=1404 Win=493 Len=0 TSval=1241965814 TSecr=2831080224"
"85","0.403446500","199.232.37.140","192.168.1.118","TLSv1.2","1585","Application Data, Application Data"
"86","0.403513500","192.168.1.118","199.232.37.140","TCP","66","36426 → 443 [ACK] Seq=333 Ack=2923 Win=482 Len=0 TSval=1241965823 TSecr=2831080224"
"87","0.403567987","199.232.37.140","192.168.1.118","TLSv1.2","3432","Server Hello, Certificate, Server Key Exchange, Server Hello Done"
"88","0.403586975","192.168.1.118","199.232.37.140","TCP","66","36448 → 443 [ACK] Seq=518 Ack=3367 Win=60928 Len=0 TSval=1241965823 TSecr=3165516396"
"89","0.404850287","199.232.37.140","192.168.1.118","TLSv1.2","117","Change Cipher Spec, Encrypted Handshake Message"
"90","0.404904987","192.168.1.118","199.232.37.140","TCP","66","36434 → 443 [ACK] Seq=644 Ack=3418 Win=501 Len=0 TSval=1241965824 TSecr=294227071"
"91","0.404937362","199.232.37.140","192.168.1.118","TLSv1.2","117","Change Cipher Spec, Encrypted Handshake Message"
"92","0.404956950","192.168.1.118","199.232.37.140","TCP","66","36432 → 443 [ACK] Seq=644 Ack=3322 Win=501 Len=0 TSval=1241965824 TSecr=294949777"
"93","0.404971962","199.232.37.140","192.168.1.118","TLSv1.2","117","Change Cipher Spec, Encrypted Handshake Message"
"94","0.404989725","192.168.1.118","199.232.37.140","TCP","66","36438 → 443 [ACK] Seq=644 Ack=3418 Win=501 Len=0 TSval=1241965824 TSecr=2831769336"
"95","0.405003862","199.232.37.140","192.168.1.118","TLSv1.2","117","Change Cipher Spec, Encrypted Handshake Message"
"96","0.405021975","192.168.1.118","199.232.37.140","TCP","66","36436 → 443 [ACK] Seq=644 Ack=3418 Win=501 Len=0 TSval=1241965824 TSecr=2829969609"
"97","0.406339025","192.168.1.118","199.232.37.140","TLSv1.2","192","Client Key Exchange, Change Cipher Spec, Encrypted Handshake Message"
"98","0.407406962","192.168.1.118","199.232.37.140","TLSv1.2","295","Application Data"
"99","0.407697762","192.168.1.118","199.232.37.140","TLSv1.2","375","Application Data"
"100","0.407945562","192.168.1.118","199.232.37.140","TLSv1.2","377","Application Data"
"101","0.408149750","192.168.1.118","199.232.37.140","TLSv1.2","342","Application Data"
"102","0.408463425","192.168.1.118","199.232.37.140","TCP","74","36450 → 443 [SYN] Seq=0 Win=64240 Len=0 MSS=1460 SACK_PERM=1 TSval=1241965828 TSecr=0 WS=128"
"103","0.408564812","199.232.37.140","192.168.1.118","TLSv1.2","117","Change Cipher Spec, Encrypted Handshake Message"
"104","0.408591000","192.168.1.118","199.232.37.140","TCP","74","36452 → 443 [SYN] Seq=0 Win=64240 Len=0 MSS=1460 SACK_PERM=1 TSval=1241965828 TSecr=0 WS=128"
"105","0.408633387","192.168.1.118","199.232.37.140","TCP","66","36442 → 443 [ACK] Seq=644 Ack=3418 Win=501 Len=0 TSval=1241965828 TSecr=2830180891"
"106","0.408669900","199.232.37.140","192.168.1.118","TLSv1.2","117","Change Cipher Spec, Encrypted Handshake Message"
"107","0.408687737","192.168.1.118","199.232.37.140","TCP","74","36454 → 443 [SYN] Seq=0 Win=64240 Len=0 MSS=1460 SACK_PERM=1 TSval=1241965828 TSecr=0 WS=128"
"108","0.408699125","192.168.1.118","199.232.37.140","TCP","66","36440 → 443 [ACK] Seq=644 Ack=3322 Win=501 Len=0 TSval=1241965828 TSecr=2832023630"
"109","0.408730162","199.232.37.140","192.168.1.118","TLSv1.2","2531","Application Data, Application Data, Application Data"
"110","0.408751925","192.168.1.118","199.232.37.140","TCP","66","36430 → 443 [ACK] Seq=852 Ack=5755 Win=482 Len=0 TSval=1241965828 TSecr=1135288083"
"111","0.408788362","192.168.1.118","199.232.37.140","TCP","74","36456 → 443 [SYN] Seq=0 Win=64240 Len=0 MSS=1460 SACK_PERM=1 TSval=1241965828 TSecr=0 WS=128"
"112","0.409453437","192.168.1.118","199.232.37.140","TLSv1.2","295","Application Data"
"113","0.409747737","192.168.1.118","199.232.37.140","TLSv1.2","376","Application Data"
"114","0.411371700","199.232.37.140","192.168.1.118","TLSv1.2","117","Change Cipher Spec, Encrypted Handshake Message"
"115","0.411441162","192.168.1.118","199.232.37.140","TCP","66","36444 → 443 [ACK] Seq=644 Ack=3300 Win=64128 Len=0 TSval=1241965831 TSecr=1823589601"
"116","0.412499287","192.168.1.118","199.232.37.140","TLSv1.2","348","Application Data"
"117","0.421243937","199.232.37.140","192.168.1.118","TLSv1.2","117","Change Cipher Spec, Encrypted Handshake Message"
"118","0.421314587","192.168.1.118","199.232.37.140","TCP","66","36446 → 443 [ACK] Seq=644 Ack=3300 Win=64128 Len=0 TSval=1241965840 TSecr=3932427524"
"119","0.424426900","192.168.1.118","199.232.37.140","TLSv1.2","293","Application Data"
"120","0.426342825","192.168.1.118","199.232.37.140","TCP","66","36402 → 443 [ACK] Seq=1 Ack=1 Win=435 Len=0 TSval=1241965845 TSecr=291256097"
"121","0.429922337","199.232.37.140","192.168.1.118","TLSv1.2","117","Change Cipher Spec, Encrypted Handshake Message"
"122","0.431270137","199.232.37.140","192.168.1.118","TLSv1.2","1418","Application Data"
"123","0.434376412","199.232.37.140","192.168.1.118","TLSv1.2","2598","Application Data, Application Data, Application Data"
"124","0.434429875","199.232.37.140","192.168.1.118","TCP","74","443 → 36454 [SYN, ACK] Seq=0 Ack=1 Win=27040 Len=0 MSS=1364 SACK_PERM=1 TSval=3253723818 TSecr=1241965828 WS=512"
"125","0.434491837","192.168.1.118","199.232.37.140","TCP","66","36454 → 443 [ACK] Seq=1 Ack=1 Win=64256 Len=0 TSval=1241965854 TSecr=3253723818"
"126","0.434536625","199.232.37.140","192.168.1.118","TCP","74","443 → 36450 [SYN, ACK] Seq=0 Ack=1 Win=27040 Len=0 MSS=1364 SACK_PERM=1 TSval=3144349947 TSecr=1241965828 WS=512"
"127","0.434563087","192.168.1.118","199.232.37.140","TCP","66","36450 → 443 [ACK] Seq=1 Ack=1 Win=64256 Len=0 TSval=1241965854 TSecr=3144349947"
"128","0.434581312","199.232.37.140","192.168.1.118","TLSv1.2","2770","Application Data, Application Data"
"129","0.434630025","199.232.37.140","192.168.1.118","TLSv1.2","1040","Application Data, Application Data"
"130","0.434668612","199.232.37.140","192.168.1.118","TLSv1.2","4122","Application Data, Application Data, Application Data"
"131","0.438068062","199.232.37.140","192.168.1.118","TCP","74","443 → 36452 [SYN, ACK] Seq=0 Ack=1 Win=27040 Len=0 MSS=1364 SACK_PERM=1 TSval=2831080233 TSecr=1241965828 WS=512"
"132","0.438156387","192.168.1.118","199.232.37.140","TCP","66","36452 → 443 [ACK] Seq=1 Ack=1 Win=64256 Len=0 TSval=1241965857 TSecr=2831080233"
"133","0.438191500","199.232.37.140","192.168.1.118","TLSv1.2","5474","Application Data, Application Data, Application Data, Application Data"
"134","0.439731437","199.232.37.140","192.168.1.118","TLSv1.2","4122","Application Data, Application Data, Application Data"
"135","0.440655875","199.232.37.140","192.168.1.118","TLSv1.2","10882","Application Data, Application Data, Application Data, Application Data, Application Data, Application Data, Application Data, Application Data"
"136","0.441645600","192.168.1.118","199.232.37.140","TLSv1.2","371","Application Data"
"137","0.442587250","192.168.1.118","199.232.37.140","TCP","66","36434 → 443 [ACK] Seq=953 Ack=7302 Win=471 Len=0 TSval=1241965862 TSecr=294227078"
"138","0.442758662","192.168.1.118","199.232.37.140","TCP","66","36436 → 443 [ACK] Seq=955 Ack=7096 Win=473 Len=0 TSval=1241965862 TSecr=2829969616"
"139","0.442927112","192.168.1.118","199.232.37.140","TCP","66","36438 → 443 [ACK] Seq=920 Ack=14234 Win=417 Len=0 TSval=1241965862 TSecr=2831769344"
"140","0.443025937","192.168.1.118","199.232.37.140","TCP","66","36440 → 443 [ACK] Seq=873 Ack=16842 Win=396 Len=0 TSval=1241965862 TSecr=2832023637"
"141","0.446629375","199.232.37.140","192.168.1.118","TCP","74","443 → 36456 [SYN, ACK] Seq=0 Ack=1 Win=27040 Len=0 MSS=1364 SACK_PERM=1 TSval=294941065 TSecr=1241965828 WS=512"
"142","0.446722537","192.168.1.118","199.232.37.140","TCP","66","36456 → 443 [ACK] Seq=1 Ack=1 Win=64256 Len=0 TSval=1241965866 TSecr=294941065"
"143","0.446768775","199.232.37.140","192.168.1.118","TLSv1.2","2770","Application Data, Application Data"
"144","0.446785150","199.232.37.140","192.168.1.118","TLSv1.2","5474","Application Data, Application Data, Application Data, Application Data"
"145","0.448264900","199.232.37.140","192.168.1.118","TLSv1.2","1418","Application Data [TCP segment of a reassembled PDU]"
"146","0.449214162","199.232.37.140","192.168.1.118","TLSv1.2","6826","Application Data, Application Data, Application Data, Application Data, Application Data"
"147","0.449253737","199.232.37.140","192.168.1.118","TLSv1.2","4122","Application Data, Application Data, Application Data"
"148","0.452367050","199.232.37.140","192.168.1.118","TLSv1.2","5474","Application Data, Application Data, Application Data, Application Data"
"149","0.454023525","199.232.37.140","192.168.1.118","TLSv1.2","2770","Application Data, Application Data"
"150","0.455139375","199.232.37.140","192.168.1.118","TLSv1.2","3628","Application Data, Application Data, Application Data, Application Data"
"151","0.455225050","199.232.37.140","192.168.1.118","TLSv1.2","1418","Application Data [TCP segment of a reassembled PDU]"
"152","0.455239462","199.232.37.140","192.168.1.118","TLSv1.2","8178","Application Data, Application Data, Application Data, Application Data, Application Data, Application Data"
"153","0.458130137","199.232.37.140","192.168.1.118","TLSv1.2","5474","Application Data, Application Data, Application Data, Application Data"
"154","0.466133600","199.232.37.140","192.168.1.118","TLSv1.2","1418","Application Data [TCP segment of a reassembled PDU]"
"155","0.470796637","199.232.37.140","192.168.1.118","TLSv1.2","5474","Application Data, Application Data, Application Data, Application Data"
"156","0.472454525","199.232.37.140","192.168.1.118","TLSv1.2","1418","Application Data [TCP segment of a reassembled PDU]"
"157","0.472496600","199.232.37.140","192.168.1.118","TLSv1.2","1418","Application Data [TCP segment of a reassembled PDU]"
"158","0.473646000","199.232.37.140","192.168.1.118","TLSv1.2","6826","Application Data, Application Data, Application Data, Application Data, Application Data"
"159","0.473679125","199.232.37.140","192.168.1.118","TLSv1.2","6826","Application Data, Application Data, Application Data, Application Data"
"160","0.476184075","192.168.1.118","199.232.37.140","TLSv1","583","Client Hello"
"161","0.476350212","199.232.37.140","192.168.1.118","TLSv1.2","1418","Application Data [TCP segment of a reassembled PDU]"
"162","0.476391325","199.232.37.140","192.168.1.118","TLSv1.2","4122","Application Data, Application Data"
"163","0.476423162","192.168.1.118","199.232.37.140","TCP","66","36438 → 443 [ACK] Seq=920 Ack=29106 Win=301 Len=0 TSval=1241965896 TSecr=2831769344"
"164","0.478023300","199.232.37.140","192.168.1.118","TLSv1.2","2770","Application Data, Application Data"
"165","0.478766575","199.232.37.140","192.168.1.118","TLSv1.2","3383","Application Data, Application Data, Application Data"
"166","0.478837412","199.232.37.140","192.168.1.118","TLSv1.2","4122","Application Data, Application Data, Application Data"
"167","0.478849962","199.232.37.140","192.168.1.118","TLSv1.2","2770","Application Data, Application Data"
"168","0.480636487","199.232.37.140","192.168.1.118","TLSv1.2","2770","Application Data, Application Data"
"169","0.481958850","199.232.37.140","192.168.1.118","TLSv1.2","2770","Application Data, Application Data"
"170","0.487859787","192.168.1.118","199.232.37.140","TCP","66","36444 → 443 [ACK] Seq=926 Ack=16820 Win=50688 Len=0 TSval=1241965907 TSecr=1823589624"
"171","0.488304950","199.232.37.140","192.168.1.118","TLSv1.2","1418","Application Data [TCP segment of a reassembled PDU]"
"172","0.489850812","192.168.1.118","199.232.37.140","TCP","66","36432 → 443 [ACK] Seq=873 Ack=16842 Win=396 Len=0 TSval=1241965909 TSecr=294949785"
"173","0.495859200","192.168.1.118","199.232.37.140","TCP","66","36446 → 443 [ACK] Seq=871 Ack=16820 Win=50688 Len=0 TSval=1241965915 TSecr=3932427530"
"174","0.495908912","192.168.1.118","199.232.37.140","TCP","66","36442 → 443 [ACK] Seq=954 Ack=6980 Win=474 Len=0 TSval=1241965915 TSecr=2830180898"
"175","0.496226175","199.232.37.140","192.168.1.118","TLSv1.2","1418","Application Data [TCP segment of a reassembled PDU]"
"176","0.496263812","192.168.1.118","199.232.37.140","TCP","66","36440 → 443 [ACK] Seq=873 Ack=41178 Win=206 Len=0 TSval=1241965915 TSecr=2832023644"
"177","0.498068487","199.232.37.140","192.168.1.118","TCP","66","443 → 36450 [ACK] Seq=1 Ack=518 Win=28160 Len=0 TSval=3144349964 TSecr=1241965895"
"178","0.498116737","199.232.37.140","192.168.1.118","TLSv1.2","2770","Application Data, Application Data"
"179","0.501261087","199.232.37.140","192.168.1.118","TLSv1.2","3336","Server Hello, Certificate, Server Key Exchange, Server Hello Done"
"180","0.501325600","192.168.1.118","199.232.37.140","TCP","66","36450 → 443 [ACK] Seq=518 Ack=3271 Win=61056 Len=0 TSval=1241965920 TSecr=3144349964"
"181","0.501371687","199.232.37.140","192.168.1.118","TLSv1.2","2770","Application Data, Application Data"
"182","0.501413862","199.232.37.140","192.168.1.118","TLSv1.2","2770","Application Data, Application Data"
"183","0.505025562","199.232.37.140","192.168.1.118","TLSv1.2","1418","Application Data [TCP segment of a reassembled PDU]"
"184","0.508506875","199.232.37.140","192.168.1.118","TLSv1.2","1224","Application Data, Application Data"
"185","0.508573700","192.168.1.118","199.232.37.140","TCP","66","36444 → 443 [ACK] Seq=926 Ack=17978 Win=49536 Len=0 TSval=1241965928 TSecr=1823589697"
"186","0.508615187","199.232.37.140","192.168.1.118","TLSv1.2","2770","Application Data, Application Data"
"187","0.508635187","192.168.1.118","199.232.37.140","TCP","66","36438 → 443 [ACK] Seq=920 Ack=48034 Win=154 Len=0 TSval=1241965928 TSecr=2831769351"
"188","0.510416075","199.232.37.140","192.168.1.118","TLSv1.2","2770","Application Data, Application Data"
"189","0.514182062","199.232.37.140","192.168.1.118","TLSv1.2","1418","Application Data [TCP segment of a reassembled PDU]"
"190","0.518860825","192.168.1.118","199.232.37.140","TCP","66","36448 → 443 [ACK] Seq=949 Ack=6735 Win=60928 Len=0 TSval=1241965938 TSecr=3165516412"
"191","0.519017262","199.232.37.140","192.168.1.118","TLSv1.2","1418","Application Data [TCP segment of a reassembled PDU]"
"192","0.519044712","199.232.37.140","192.168.1.118","TLSv1.2","4122","Application Data, Application Data, Application Data"
"193","0.519067900","192.168.1.118","199.232.37.140","TCP","66","36432 → 443 [ACK] Seq=873 Ack=20898 Win=365 Len=0 TSval=1241965938 TSecr=294949806"
"194","0.519709375","199.232.37.140","192.168.1.118","TLSv1.2","5474","Application Data, Application Data, Application Data, Application Data"
"195","0.524040662","199.232.37.140","192.168.1.118","TLSv1.2","1724","Application Data, Application Data"
"196","0.524110100","192.168.1.118","199.232.37.140","TCP","66","36446 → 443 [ACK] Seq=871 Ack=18478 Win=49152 Len=0 TSval=1241965943 TSecr=3932427547"
"197","0.524161600","199.232.37.140","192.168.1.118","TLSv1.2","6826","Application Data, Application Data, Application Data, Application Data"
"198","0.524212125","199.232.37.140","192.168.1.118","TLSv1.2","1187","Application Data, Application Data"
"199","0.524236000","199.232.37.140","192.168.1.118","TLSv1.2","2770","Application Data, Application Data"
"200","0.525929550","192.168.1.118","199.232.37.140","TLSv1","583","Client Hello"
"201","0.526483625","199.232.37.140","192.168.1.118","TLSv1.2","1418","Application Data [TCP segment of a reassembled PDU]"
"202","0.526533750","199.232.37.140","192.168.1.118","TLSv1.2","1418","Application Data [TCP segment of a reassembled PDU]"
"203","0.526596537","199.232.37.140","192.168.1.118","TLSv1.2","1418","Application Data [TCP segment of a reassembled PDU]"
"204","0.526606262","199.232.37.140","192.168.1.118","TLSv1.2","1418","Application Data [TCP segment of a reassembled PDU]"
"205","0.529089612","199.232.37.140","192.168.1.118","TLSv1.2","1418","Application Data [TCP segment of a reassembled PDU]"
"206","0.529137000","199.232.37.140","192.168.1.118","TLSv1.2","2770","Application Data, Application Data"
"207","0.530059112","199.232.37.140","192.168.1.118","TLSv1.2","1418","Application Data [TCP segment of a reassembled PDU]"
"208","0.533449900","199.232.37.140","192.168.1.118","TLSv1.2","1418","Application Data [TCP segment of a reassembled PDU]"
"209","0.535094600","199.232.37.140","192.168.1.118","TLSv1.2","2770","Application Data, Application Data"
"210","0.535157375","192.168.1.118","199.232.37.140","TCP","66","36440 → 443 [ACK] Seq=873 Ack=53346 Win=111 Len=0 TSval=1241965954 TSecr=2832023651"
"211","0.537480137","199.232.37.140","192.168.1.118","TLSv1.2","2770","Application Data, Application Data"
"212","0.537526037","199.232.37.140","192.168.1.118","TLSv1.2","1418","Application Data [TCP segment of a reassembled PDU]"
"213","0.539112050","199.232.37.140","192.168.1.118","TLSv1.2","1418","Application Data [TCP segment of a reassembled PDU]"
"214","0.539134162","199.232.37.140","192.168.1.118","TCP","1418","443 → 36438 [ACK] Seq=64258 Ack=920 Win=57 Len=1352 TSval=2831769369 TSecr=1241965896 [TCP segment of a reassembled PDU]"
"215","0.541672912","199.232.37.140","192.168.1.118","TLSv1.2","1418","Application Data [TCP segment of a reassembled PDU]"
"216","0.541734950","192.168.1.118","199.232.37.140","TCP","66","36438 → 443 [ACK] Seq=920 Ack=66962 Win=7 Len=0 TSval=1241965961 TSecr=2831769361"
"217","0.543447162","199.232.37.140","192.168.1.118","TLSv1.2","2216","Application Data, Application Data"
"218","0.546840037","199.232.37.140","192.168.1.118","TCP","66","443 → 36452 [ACK] Seq=1 Ack=518 Win=28160 Len=0 TSval=2831080262 TSecr=1241965945"
"219","0.546906850","199.232.37.140","192.168.1.118","TLSv1.2","3314","Server Hello, Certificate, Server Key Exchange, Server Hello Done"
"220","0.546940650","192.168.1.118","199.232.37.140","TCP","66","36452 → 443 [ACK] Seq=518 Ack=3249 Win=61056 Len=0 TSval=1241965966 TSecr=2831080262"
"221","0.559867262","192.168.1.118","199.232.37.140","TCP","66","36432 → 443 [ACK] Seq=873 Ack=34187 Win=262 Len=0 TSval=1241965979 TSecr=294949806"
"222","0.563731762","192.168.1.118","199.232.37.140","TLSv1","583","Client Hello"
"223","0.577859312","192.168.1.118","199.232.37.140","TCP","66","36440 → 443 [ACK] Seq=873 Ack=58200 Win=74 Len=0 TSval=1241965997 TSecr=2832023661"
"224","0.588424162","199.232.37.140","192.168.1.118","TCP","66","443 → 36454 [ACK] Seq=1 Ack=518 Win=28160 Len=0 TSval=3253723976 TSecr=1241965983"
"225","0.590926287","199.232.37.140","192.168.1.118","TLSv1.2","1418","Server Hello"
"226","0.590992537","192.168.1.118","199.232.37.140","TCP","66","36454 → 443 [ACK] Seq=518 Ack=1353 Win=63104 Len=0 TSval=1241966010 TSecr=3253723978"
"227","0.594384425","199.232.37.140","192.168.1.118","TLSv1.2","1984","Certificate, Server Key Exchange, Server Hello Done"
"228","0.594452875","192.168.1.118","199.232.37.140","TCP","66","36454 → 443 [ACK] Seq=518 Ack=3271 Win=61312 Len=0 TSval=1241966014 TSecr=3253723978"
"229","0.599522987","192.168.1.118","199.232.37.140","TLSv1","583","Client Hello"
"230","0.602603337","192.168.1.118","199.232.37.140","TLSv1.2","192","Client Key Exchange, Change Cipher Spec, Encrypted Handshake Message"
"231","0.608784387","192.168.1.118","199.232.37.140","TLSv1.2","192","Client Key Exchange, Change Cipher Spec, Encrypted Handshake Message"
"232","0.622572562","192.168.1.118","199.232.37.140","TLSv1.2","192","Client Key Exchange, Change Cipher Spec, Encrypted Handshake Message"
"233","0.644600200","199.232.37.140","192.168.1.118","TLSv1.2","117","Change Cipher Spec, Encrypted Handshake Message"
"234","0.644671112","192.168.1.118","199.232.37.140","TCP","66","36450 → 443 [ACK] Seq=644 Ack=3322 Win=64128 Len=0 TSval=1241966064 TSecr=3144350001"
"235","0.646027587","199.232.37.140","192.168.1.118","TLSv1.2","117","Change Cipher Spec, Encrypted Handshake Message"
"236","0.646089150","192.168.1.118","199.232.37.140","TCP","66","36452 → 443 [ACK] Seq=644 Ack=3300 Win=64128 Len=0 TSval=1241966065 TSecr=2831080287"
"237","0.646121225","199.232.37.140","192.168.1.118","TCP","66","443 → 36456 [ACK] Seq=1 Ack=518 Win=28160 Len=0 TSval=294941119 TSecr=1241966019"
"238","0.647602625","199.232.37.140","192.168.1.118","TLSv1.2","1418","Server Hello"
"239","0.647657750","192.168.1.118","199.232.37.140","TCP","66","36456 → 443 [ACK] Seq=518 Ack=1353 Win=63104 Len=0 TSval=1241966067 TSecr=294941119"
"240","0.649316437","199.232.37.140","192.168.1.118","TLSv1.2","1984","Certificate, Server Key Exchange, Server Hello Done"
"241","0.649385312","192.168.1.118","199.232.37.140","TCP","66","36456 → 443 [ACK] Seq=518 Ack=3271 Win=61312 Len=0 TSval=1241966069 TSecr=294941119"
"242","0.652055825","192.168.1.118","199.232.37.140","TLSv1.2","295","Application Data"
"243","0.652304875","192.168.1.118","199.232.37.140","TLSv1.2","348","Application Data"
"244","0.655008787","199.232.37.140","192.168.1.118","TLSv1.2","117","Change Cipher Spec, Encrypted Handshake Message"
"245","0.665957787","192.168.1.118","199.232.37.140","TLSv1.2","192","Client Key Exchange, Change Cipher Spec, Encrypted Handshake Message"
"246","0.666234162","192.168.1.118","199.232.37.140","TLSv1.2","371","Application Data"
"247","0.666334687","192.168.1.118","199.232.37.140","TLSv1.2","368","Application Data"
"248","0.666427812","192.168.1.118","199.232.37.140","TLSv1.2","367","Application Data"
"249","0.667148025","192.168.1.118","199.232.37.140","TLSv1.2","295","Application Data"
"250","0.671661450","192.168.1.118","199.232.37.140","TLSv1.2","368","Application Data"
"251","0.677410250","199.232.37.140","192.168.1.118","TLSv1.2","1418","Application Data"
"252","0.681239950","199.232.37.140","192.168.1.118","TLSv1.2","5474","Application Data, Application Data, Application Data, Application Data"
"253","0.681768137","192.168.1.118","199.232.37.140","TCP","66","36450 → 443 [ACK] Seq=873 Ack=10082 Win=57472 Len=0 TSval=1241966101 TSecr=3144350009"
"254","0.681895562","199.232.37.140","192.168.1.118","TLSv1.2","6826","Application Data, Application Data, Application Data, Application Data, Application Data"
"255","0.684831937","192.168.1.118","199.232.37.140","TCP","66","36450 → 443 [ACK] Seq=873 Ack=16842 Win=50816 Len=0 TSval=1241966104 TSecr=3144350009"
"256","0.684998600","199.232.37.140","192.168.1.118","TLSv1.2","5273","Application Data, Application Data, Application Data, Application Data, Application Data"
"257","0.685498950","192.168.1.118","199.232.37.140","TCP","66","36452 → 443 [ACK] Seq=926 Ack=8507 Win=59008 Len=0 TSval=1241966105 TSecr=2831080296"
"258","0.685995175","199.232.37.140","192.168.1.118","TLSv1.2","3830","Application Data, Application Data, Application Data, Application Data"
"259","0.686051362","199.232.37.140","192.168.1.118","TLSv1.2","3368","Application Data, Application Data, Application Data"
"260","0.686087387","192.168.1.118","199.232.37.140","TCP","66","36448 → 443 [ACK] Seq=1254 Ack=10037 Win=60928 Len=0 TSval=1241966105 TSecr=3165516468"
"261","0.687219025","199.232.37.140","192.168.1.118","TLSv1.2","117","Change Cipher Spec, Encrypted Handshake Message"
"262","0.687404537","192.168.1.118","199.232.37.140","TCP","66","[TCP Window Update] 36438 → 443 [ACK] Seq=920 Ack=66962 Win=195 Len=0 TSval=1241966107 TSecr=2831769361"
"263","0.687488062","192.168.1.118","199.232.37.140","TCP","66","[TCP Window Update] 36440 → 443 [ACK] Seq=873 Ack=58200 Win=227 Len=0 TSval=1241966107 TSecr=2832023661"
"264","0.687907850","192.168.1.118","199.232.37.140","TLSv1.2","295","Application Data"
"265","0.688073275","192.168.1.118","199.232.37.140","TCP","66","36434 → 443 [ACK] Seq=1255 Ack=11066 Win=472 Len=0 TSval=1241966107 TSecr=294227141"
"266","0.691111525","199.232.37.140","192.168.1.118","TLSv1.2","3688","Application Data, Application Data, Application Data, Application Data"
"267","0.691202837","192.168.1.118","199.232.37.140","TCP","66","36442 → 443 [ACK] Seq=1256 Ack=10602 Win=473 Len=0 TSval=1241966110 TSecr=2830180961"
"268","0.691253162","199.232.37.140","192.168.1.118","TLSv1.2","1418","Application Data"
"269","0.705130000","192.168.1.118","199.232.37.140","TLSv1.2","342","Application Data"
"270","0.710110737","199.232.37.140","192.168.1.118","TLSv1.2","2614","Application Data, Application Data, Application Data"
"271","0.711817687","199.232.37.140","192.168.1.118","TLSv1.2","6826","Application Data, Application Data, Application Data, Application Data, Application Data"
"272","0.712236525","199.232.37.140","192.168.1.118","TLSv1.2","2311","Application Data, Application Data"
"273","0.712274825","192.168.1.118","199.232.37.140","TCP","66","36450 → 443 [ACK] Seq=873 Ack=19087 Win=61056 Len=0 TSval=1241966131 TSecr=3144350013"
"274","0.712308700","199.232.37.140","192.168.1.118","TLSv1.2","6826","Application Data, Application Data, Application Data, Application Data, Application Data"
"275","0.715652262","192.168.1.118","199.232.37.140","TCP","66","36454 → 443 [ACK] Seq=873 Ack=16842 Win=50688 Len=0 TSval=1241966135 TSecr=3253724078"
"276","0.715860462","192.168.1.118","199.232.37.140","TCP","66","36436 → 443 [ACK] Seq=1256 Ack=10996 Win=477 Len=0 TSval=1241966135 TSecr=2829969680"
"277","0.716141425","199.232.37.140","192.168.1.118","TLSv1.2","2770","Application Data, Application Data"
"278","0.716205887","192.168.1.118","199.232.37.140","TCP","66","36438 → 443 [ACK] Seq=920 Ack=69666 Win=303 Len=0 TSval=1241966135 TSecr=2831769412"
"279","0.717788437","199.232.37.140","192.168.1.118","TLSv1.2","2770","Application Data, Application Data"
"280","0.718524587","199.232.37.140","192.168.1.118","TLSv1.2","5474","Application Data, Application Data, Application Data, Application Data"
"281","0.718566500","199.232.37.140","192.168.1.118","TLSv1.2","4122","Application Data, Application Data, Application Data"
"282","0.721997175","199.232.37.140","192.168.1.118","TLSv1.2","5474","Application Data, Application Data, Application Data, Application Data"
"283","0.723658587","199.232.37.140","192.168.1.118","TLSv1.2","4122","Application Data, Application Data, Application Data"
"284","0.724492875","199.232.37.140","192.168.1.118","TLSv1.2","2770","Application Data, Application Data"
"285","0.724534475","199.232.37.140","192.168.1.118","TLSv1.2","2770","Application Data, Application Data"
"286","0.724545925","199.232.37.140","192.168.1.118","TLSv1.2","4122","Application Data, Application Data, Application Data"
"287","0.724558925","199.232.37.140","192.168.1.118","TLSv1.2","1418","Application Data [TCP segment of a reassembled PDU]"
"288","0.726194887","199.232.37.140","192.168.1.118","TLSv1.2","3394","Application Data, Application Data"
"289","0.735739800","199.232.37.140","192.168.1.118","TLSv1.2","1418","Application Data [TCP segment of a reassembled PDU]"
"290","0.737992475","192.168.1.118","199.232.37.140","TCP","66","36438 → 443 [ACK] Seq=920 Ack=91922 Win=130 Len=0 TSval=1241966157 TSecr=2831769412"
"291","0.738162425","199.232.37.140","192.168.1.118","TLSv1.2","4122","Application Data, Application Data, Application Data"
"292","0.738207575","199.232.37.140","192.168.1.118","TLSv1.2","1418","Application Data [TCP segment of a reassembled PDU]"
"293","0.738221212","192.168.1.118","199.232.37.140","TCP","66","36456 → 443 [ACK] Seq=873 Ack=16842 Win=50688 Len=0 TSval=1241966157 TSecr=294941136"
"294","0.738436800","192.168.1.118","199.232.37.140","TCP","66","36454 → 443 [ACK] Seq=873 Ack=22250 Win=45312 Len=0 TSval=1241966158 TSecr=3253724123"
"295","0.738885100","199.232.37.140","192.168.1.118","TLSv1.2","2770","Application Data, Application Data"
"296","0.738914287","199.232.37.140","192.168.1.118","TLSv1.2","705","Application Data"
"297","0.738925950","199.232.37.140","192.168.1.118","TLSv1.2","1418","Application Data [TCP segment of a reassembled PDU]"
"298","0.739394975","192.168.1.118","199.232.37.140","TCP","66","36438 → 443 [ACK] Seq=920 Ack=94626 Win=109 Len=0 TSval=1241966159 TSecr=2831769420"
"299","0.739516075","192.168.1.118","199.232.37.140","TCP","66","36454 → 443 [ACK] Seq=873 Ack=25593 Win=41984 Len=0 TSval=1241966159 TSecr=3253724123"
"300","0.740747062","192.168.1.118","199.232.37.140","TCP","66","[TCP Window Update] 36438 → 443 [ACK] Seq=920 Ack=94626 Win=268 Len=0 TSval=1241966160 TSecr=2831769420"
"301","0.740868050","192.168.1.118","199.232.37.140","TCP","66","[TCP Window Update] 36440 → 443 [ACK] Seq=873 Ack=58200 Win=501 Len=0 TSval=1241966160 TSecr=2832023661"
"302","0.745258875","199.232.37.140","192.168.1.118","TLSv1.2","5474","Application Data, Application Data, Application Data, Application Data"
"303","0.745414700","199.232.37.140","192.168.1.118","TLSv1.2","8178","Application Data, Application Data, Application Data, Application Data, Application Data, Application Data"
"304","0.745429575","199.232.37.140","192.168.1.118","TLSv1.2","5474","Application Data, Application Data, Application Data, Application Data"
"305","0.746214475","192.168.1.118","199.232.37.140","TCP","66","36438 → 443 [ACK] Seq=920 Ack=100034 Win=226 Len=0 TSval=1241966165 TSecr=2831769420"
"306","0.746440837","192.168.1.118","199.232.37.140","TCP","66","36448 → 443 [ACK] Seq=1530 Ack=23557 Win=50688 Len=0 TSval=1241966166 TSecr=3165516482"
"307","0.750173587","199.232.37.140","192.168.1.118","TLSv1.2","2770","Application Data, Application Data"
"308","0.750225337","199.232.37.140","192.168.1.118","TLSv1.2","2770","Application Data, Application Data"
"309","0.750287862","199.232.37.140","192.168.1.118","TLSv1.2","2770","Application Data, Application Data"
"310","0.754647687","192.168.1.118","199.232.37.140","TCP","66","36438 → 443 [ACK] Seq=920 Ack=108146 Win=163 Len=0 TSval=1241966174 TSecr=2831769420"
"311","0.757690962","199.232.37.140","192.168.1.118","TLSv1.2","1418","Application Data [TCP segment of a reassembled PDU]"
"312","0.760825200","199.232.37.140","192.168.1.118","TLSv1.2","1418","Application Data [TCP segment of a reassembled PDU]"
"313","0.760866625","199.232.37.140","192.168.1.118","TLSv1.2","1418","Application Data [TCP segment of a reassembled PDU]"
"314","0.760936387","199.232.37.140","192.168.1.118","TLSv1.2","3533","Application Data, Application Data, Application Data"
"315","0.760970775","192.168.1.118","199.232.37.140","TCP","66","36456 → 443 [ACK] Seq=873 Ack=21661 Win=56960 Len=0 TSval=1241966180 TSecr=294941147"
"316","0.761014575","199.232.37.140","192.168.1.118","TLSv1.2","2146","Application Data [TCP segment of a reassembled PDU]"
"317","0.762584137","192.168.1.118","199.232.37.140","TCP","66","36438 → 443 [ACK] Seq=920 Ack=112930 Win=126 Len=0 TSval=1241966182 TSecr=2831769426"
"318","0.764418362","199.232.37.140","192.168.1.118","TLSv1.2","5474","Application Data, Application Data, Application Data, Application Data"
"319","0.764515475","199.232.37.140","192.168.1.118","TLSv1.2","1657","Application Data, Application Data"
"320","0.766265950","192.168.1.118","199.232.37.140","TCP","66","36438 → 443 [ACK] Seq=920 Ack=119929 Win=72 Len=0 TSval=1241966185 TSecr=2831769426"
"321","0.782611225","192.168.1.118","199.232.37.140","TCP","66","[TCP Window Update] 36438 → 443 [ACK] Seq=920 Ack=119929 Win=227 Len=0 TSval=1241966202 TSecr=2831769426"
"322","0.784615862","199.232.37.140","192.168.1.118","TLSv1.2","5474","Application Data, Application Data, Application Data, Application Data"
"323","0.784678262","192.168.1.118","199.232.37.140","TCP","66","36448 → 443 [ACK] Seq=1530 Ack=28965 Win=56960 Len=0 TSval=1241966204 TSecr=3165516489"
"324","0.784757250","199.232.37.140","192.168.1.118","TLSv1.2","1418","Application Data [TCP segment of a reassembled PDU]"
"325","0.788631125","199.232.37.140","192.168.1.118","TLSv1.2","5474","Application Data, Application Data, Application Data"
"326","0.788736500","199.232.37.140","192.168.1.118","TLSv1.2","4122","Application Data, Application Data, Application Data"
"327","0.789721687","192.168.1.118","199.232.37.140","TCP","66","36448 → 443 [ACK] Seq=1530 Ack=39781 Win=46208 Len=0 TSval=1241966209 TSecr=3165516489"
"328","0.790087812","199.232.37.140","192.168.1.118","TLSv1.2","2770","Application Data, Application Data"
"329","0.795168162","192.168.1.118","199.232.37.140","TCP","66","36448 → 443 [ACK] Seq=1530 Ack=42485 Win=43520 Len=0 TSval=1241966214 TSecr=3165516489"
"330","0.801001425","199.232.37.140","192.168.1.118","TLSv1.2","1418","Application Data [TCP segment of a reassembled PDU]"
"331","0.803611875","199.232.37.140","192.168.1.118","TLSv1.2","1418","Application Data [TCP segment of a reassembled PDU]"
"332","0.809969800","199.232.37.140","192.168.1.118","TLSv1.2","1418","Application Data [TCP segment of a reassembled PDU]"
"333","0.811961912","199.232.37.140","192.168.1.118","TLSv1.2","1418","Application Data [TCP segment of a reassembled PDU]"
"334","0.816767387","199.232.37.140","192.168.1.118","TLSv1.2","1418","Application Data [TCP segment of a reassembled PDU]"
"335","0.817854125","199.232.37.140","192.168.1.118","TLSv1.2","1418","Application Data [TCP segment of a reassembled PDU]"
"336","0.821135362","192.168.1.118","199.232.37.140","TCP","66","36448 → 443 [ACK] Seq=1530 Ack=50597 Win=35456 Len=0 TSval=1241966240 TSecr=3165516491"
"337","0.825387300","199.232.37.140","192.168.1.118","TLSv1.2","1418","Application Data [TCP segment of a reassembled PDU]"
"338","0.828754175","199.232.37.140","192.168.1.118","TLSv1.2","1418","Application Data [TCP segment of a reassembled PDU]"
"339","0.831012950","199.232.37.140","192.168.1.118","TLSv1.2","1418","Application Data [TCP segment of a reassembled PDU]"
"340","0.831070100","199.232.37.140","192.168.1.118","TLSv1.2","2770","Application Data, Application Data"
"341","0.835236987","199.232.37.140","192.168.1.118","TLSv1.2","1418","Application Data [TCP segment of a reassembled PDU]"
"342","0.835420275","192.168.1.118","199.232.37.140","TCP","66","36448 → 443 [ACK] Seq=1530 Ack=58709 Win=27392 Len=0 TSval=1241966255 TSecr=3165516500"
"343","0.837578625","199.232.37.140","192.168.1.118","TLSv1.2","1418","Application Data [TCP segment of a reassembled PDU]"
"344","0.840772762","199.232.37.140","192.168.1.118","TLSv1.2","2770","Application Data, Application Data"
"345","0.843921437","199.232.37.140","192.168.1.118","TLSv1.2","1418","Application Data [TCP segment of a reassembled PDU]"
"346","0.845260375","199.232.37.140","192.168.1.118","TLSv1.2","1418","Application Data [TCP segment of a reassembled PDU]"
"347","0.845316450","192.168.1.118","199.232.37.140","TCP","66","36448 → 443 [ACK] Seq=1530 Ack=64117 Win=22016 Len=0 TSval=1241966264 TSecr=3165516504"
"348","0.849166112","199.232.37.140","192.168.1.118","TLSv1.2","1418","Application Data [TCP segment of a reassembled PDU]"
"349","0.849330387","192.168.1.118","199.232.37.140","TCP","66","36448 → 443 [ACK] Seq=1530 Ack=66821 Win=19328 Len=0 TSval=1241966268 TSecr=3165516506"
"350","0.849438987","192.168.1.118","199.232.37.140","TCP","66","[TCP Window Update] 36438 → 443 [ACK] Seq=920 Ack=119929 Win=501 Len=0 TSval=1241966269 TSecr=2831769426"
"351","0.851477775","199.232.37.140","192.168.1.118","TLSv1.2","1418","Application Data [TCP segment of a reassembled PDU]"
"352","0.856999237","199.232.37.140","192.168.1.118","TLSv1.2","1418","Application Data [TCP segment of a reassembled PDU]"
"353","0.857063800","192.168.1.118","199.232.37.140","TCP","66","36448 → 443 [ACK] Seq=1530 Ack=69525 Win=30336 Len=0 TSval=1241966276 TSecr=3165516507"
"354","0.858572937","199.232.37.140","192.168.1.118","TLSv1.2","1418","Application Data [TCP segment of a reassembled PDU]"
"355","0.860003487","199.232.37.140","192.168.1.118","TLSv1.2","2770","Application Data [TCP segment of a reassembled PDU]"
"356","0.860075700","192.168.1.118","199.232.37.140","TCP","66","36448 → 443 [ACK] Seq=1530 Ack=73581 Win=26368 Len=0 TSval=1241966279 TSecr=3165516508"
"357","0.862208562","199.232.37.140","192.168.1.118","TLSv1.2","1418","Application Data [TCP segment of a reassembled PDU]"
"358","0.863332750","199.232.37.140","192.168.1.118","TLSv1.2","1418","Application Data [TCP segment of a reassembled PDU]"
"359","0.865315025","199.232.37.140","192.168.1.118","TLSv1.2","1418","Application Data [TCP segment of a reassembled PDU]"
"360","0.866539775","199.232.37.140","192.168.1.118","TLSv1.2","1418","Application Data [TCP segment of a reassembled PDU]"
"361","0.867229500","192.168.1.118","199.232.37.140","TCP","66","36448 → 443 [ACK] Seq=1530 Ack=78989 Win=64128 Len=0 TSval=1241966286 TSecr=3165516511"
"362","0.870649062","199.232.37.140","192.168.1.118","TLSv1.2","1418","Application Data [TCP segment of a reassembled PDU]"
"363","0.876610437","199.232.37.140","192.168.1.118","TLSv1.2","1418","Application Data [TCP segment of a reassembled PDU]"
"364","0.876671350","192.168.1.118","199.232.37.140","TCP","66","36448 → 443 [ACK] Seq=1530 Ack=81693 Win=69504 Len=0 TSval=1241966296 TSecr=3165516513"
"365","0.876702987","199.232.37.140","192.168.1.118","TLSv1.2","1418","Application Data [TCP segment of a reassembled PDU]"
"366","0.880090812","199.232.37.140","192.168.1.118","TLSv1.2","2770","Application Data, Application Data"
"367","0.880153612","192.168.1.118","199.232.37.140","TCP","66","36448 → 443 [ACK] Seq=1530 Ack=85749 Win=77696 Len=0 TSval=1241966299 TSecr=3165516514"
"368","0.880196812","199.232.37.140","192.168.1.118","TLSv1.2","2770","Application Data, Application Data"
"369","0.880212637","192.168.1.118","199.232.37.140","TCP","66","36448 → 443 [ACK] Seq=1530 Ack=88453 Win=78208 Len=0 TSval=1241966299 TSecr=3165516517"
"370","0.882322762","199.232.37.140","192.168.1.118","TLSv1.2","2770","Application Data, Application Data"
"371","0.882382975","192.168.1.118","199.232.37.140","TCP","66","36448 → 443 [ACK] Seq=1530 Ack=91157 Win=83584 Len=0 TSval=1241966302 TSecr=3165516517"
"372","0.882417300","199.232.37.140","192.168.1.118","TLSv1.2","1418","Application Data [TCP segment of a reassembled PDU]"
"373","0.886415550","199.232.37.140","192.168.1.118","TLSv1.2","4122","Application Data, Application Data, Application Data"
"374","0.886477187","192.168.1.118","199.232.37.140","TCP","66","36448 → 443 [ACK] Seq=1530 Ack=96565 Win=94464 Len=0 TSval=1241966306 TSecr=3165516517"
"375","0.888523000","199.232.37.140","192.168.1.118","TLSv1.2","2770","Application Data, Application Data"
"376","0.888586625","192.168.1.118","199.232.37.140","TCP","66","36448 → 443 [ACK] Seq=1530 Ack=99269 Win=96640 Len=0 TSval=1241966308 TSecr=3165516518"
"377","0.894320900","199.232.37.140","192.168.1.118","TLSv1.2","1418","Application Data [TCP segment of a reassembled PDU]"
"378","0.895873150","199.232.37.140","192.168.1.118","TLSv1.2","2770","Application Data, Application Data"
"379","0.895932050","192.168.1.118","199.232.37.140","TCP","66","36448 → 443 [ACK] Seq=1530 Ack=103325 Win=102016 Len=0 TSval=1241966315 TSecr=3165516521"
"380","0.897573125","199.232.37.140","192.168.1.118","TLSv1.2","1418","Application Data [TCP segment of a reassembled PDU]"
"381","0.899593725","199.232.37.140","192.168.1.118","TLSv1.2","2770","Application Data, Application Data"
"382","0.899654437","192.168.1.118","199.232.37.140","TCP","66","36448 → 443 [ACK] Seq=1530 Ack=107381 Win=110208 Len=0 TSval=1241966319 TSecr=3165516521"
"383","0.903611125","199.232.37.140","192.168.1.118","TLSv1.2","2770","Application Data, Application Data"
"384","0.903675400","192.168.1.118","199.232.37.140","TCP","66","36448 → 443 [ACK] Seq=1530 Ack=110085 Win=115584 Len=0 TSval=1241966323 TSecr=3165516521"
"385","0.907531912","199.232.37.140","192.168.1.118","TLSv1.2","2770","Application Data [TCP segment of a reassembled PDU]"
"386","0.907593912","192.168.1.118","199.232.37.140","TCP","66","36448 → 443 [ACK] Seq=1530 Ack=112789 Win=120960 Len=0 TSval=1241966327 TSecr=3165516522"
"387","0.907647900","199.232.37.140","192.168.1.118","TLSv1.2","4122","Application Data, Application Data, Application Data"
"388","0.907664362","192.168.1.118","199.232.37.140","TCP","66","36448 → 443 [ACK] Seq=1530 Ack=116845 Win=129024 Len=0 TSval=1241966327 TSecr=3165516523"
"389","0.918161575","199.232.37.140","192.168.1.118","TLSv1.2","5474","Application Data, Application Data, Application Data, Application Data"
"390","0.918225050","192.168.1.118","199.232.37.140","TCP","66","36448 → 443 [ACK] Seq=1530 Ack=122253 Win=139904 Len=0 TSval=1241966337 TSecr=3165516523"
"391","0.919065012","199.232.37.140","192.168.1.118","TLSv1.2","2770","Application Data, Application Data"
"392","0.919109975","192.168.1.118","199.232.37.140","TCP","66","36448 → 443 [ACK] Seq=1530 Ack=124957 Win=145280 Len=0 TSval=1241966338 TSecr=3165516524"
"393","0.919148512","199.232.37.140","192.168.1.118","TLSv1.2","2770","Application Data, Application Data"
"394","0.919167537","192.168.1.118","199.232.37.140","TCP","66","36448 → 443 [ACK] Seq=1530 Ack=127661 Win=150656 Len=0 TSval=1241966338 TSecr=3165516524"
"395","0.923395900","199.232.37.140","192.168.1.118","TLSv1.2","2770","Application Data, Application Data"
"396","0.923456550","192.168.1.118","199.232.37.140","TCP","66","36448 → 443 [ACK] Seq=1530 Ack=130365 Win=156160 Len=0 TSval=1241966343 TSecr=3165516525"
"397","0.923496962","199.232.37.140","192.168.1.118","TLSv1.2","2770","Application Data, Application Data"
"398","0.923511825","192.168.1.118","199.232.37.140","TCP","66","36448 → 443 [ACK] Seq=1530 Ack=133069 Win=161536 Len=0 TSval=1241966343 TSecr=3165516525"
"399","0.924411612","199.232.37.140","192.168.1.118","TLSv1.2","8178","Application Data, Application Data, Application Data, Application Data, Application Data, Application Data"
"400","0.924462437","192.168.1.118","199.232.37.140","TCP","66","36448 → 443 [ACK] Seq=1530 Ack=141181 Win=177792 Len=0 TSval=1241966344 TSecr=3165516526"
"401","0.928298987","199.232.37.140","192.168.1.118","TLSv1.2","4122","Application Data, Application Data, Application Data"
"402","0.928353662","199.232.37.140","192.168.1.118","TLSv1.2","1418","Application Data [TCP segment of a reassembled PDU]"
"403","0.928659037","192.168.1.118","199.232.37.140","TCP","66","36448 → 443 [ACK] Seq=1530 Ack=146589 Win=172928 Len=0 TSval=1241966348 TSecr=3165516527"
"404","0.928971687","199.232.37.140","192.168.1.118","TLSv1.2","4122","Application Data, Application Data, Application Data"
"405","0.929005550","199.232.37.140","192.168.1.118","TLSv1.2","2770","Application Data [TCP segment of a reassembled PDU]"
"406","0.929237075","192.168.1.118","199.232.37.140","TCP","66","36448 → 443 [ACK] Seq=1530 Ack=153349 Win=166272 Len=0 TSval=1241966348 TSecr=3165516527"
"407","0.935908737","199.232.37.140","192.168.1.118","TLSv1.2","2770","Application Data, Application Data"
"408","0.935959312","199.232.37.140","192.168.1.118","TLSv1.2","2770","Application Data, Application Data"
"409","0.936315600","199.232.37.140","192.168.1.118","TLSv1.2","5474","Application Data, Application Data, Application Data, Application Data"
"410","0.939498450","199.232.37.140","192.168.1.118","TLSv1.2","2770","Application Data, Application Data"
"411","0.939548712","199.232.37.140","192.168.1.118","TLSv1.2","2770","Application Data, Application Data"
"412","0.941170925","199.232.37.140","192.168.1.118","TLSv1.2","4122","Application Data, Application Data, Application Data"
"413","0.941642162","199.232.37.140","192.168.1.118","TLSv1.2","2770","Application Data, Application Data"
"414","0.941679312","199.232.37.140","192.168.1.118","TLSv1.2","2770","Application Data, Application Data"
"415","0.941700437","199.232.37.140","192.168.1.118","TLSv1.2","2770","Application Data, Application Data"
"416","0.941712075","199.232.37.140","192.168.1.118","TLSv1.2","1418","Application Data [TCP segment of a reassembled PDU]"
"417","0.944642312","199.232.37.140","192.168.1.118","TLSv1.2","4122","Application Data, Application Data, Application Data"
"418","0.944681525","199.232.37.140","192.168.1.118","TLSv1.2","1418","Application Data [TCP segment of a reassembled PDU]"
"419","0.946302712","199.232.37.140","192.168.1.118","TLSv1.2","4122","Application Data, Application Data"
"420","0.947148462","199.232.37.140","192.168.1.118","TLSv1.2","10882","Application Data, Application Data, Application Data, Application Data, Application Data, Application Data, Application Data, Application Data"
"421","0.948433812","199.232.37.140","192.168.1.118","TLSv1.2","2258","Application Data, Application Data, Application Data"
"422","0.976865837","192.168.1.118","199.232.37.140","TCP","66","36448 → 443 [ACK] Seq=1530 Ack=205565 Win=114176 Len=0 TSval=1241966396 TSecr=3165516528"
"423","1.292382487","192.168.1.118","199.232.37.140","TLSv1.2","249","Application Data"
"424","1.317365037","199.232.37.140","192.168.1.118","TLSv1.2","1150","Application Data, Application Data"
"425","1.357860837","192.168.1.118","199.232.37.140","TCP","66","36424 → 443 [ACK] Seq=184 Ack=1085 Win=501 Len=0 TSval=1241966777 TSecr=3253724697"
"426","1.593019700","192.168.1.104","255.255.255.255","UDP","217","49154 → 6666 Len=175"
"427","1.593052912","IntelCor_b7:52:73","Broadcast","ARP","60","Who has 192.168.1.1? Tell 192.168.1.118"
"428","1.597987937","Cisco-Li_5b:1c:ce","IntelCor_b7:52:73","ARP","42","192.168.1.1 is at 58:6d:8f:5b:1c:ce"
"429","1.700868125","192.168.1.118","72.21.91.29","TCP","66","38622 → 80 [ACK] Seq=1 Ack=1 Win=501 Len=0 TSval=3421457373 TSecr=4245625959"
"430","1.703010950","192.168.1.100","224.0.0.251","MDNS","519","Standard query 0x0000 PTR _googlecast._tcp.local, "QM" question PTR _homekit._tcp.local, "QM" question PTR _uscan._tcp.local, "QM" question PTR _ptp._tcp.local, "QM" question PTR _ippusb._tcp.local, "QM" question PTR _scanner._tcp.local, "QM" question PTR _ipp._tcp.local, "QM" question PTR _pdl-datastream._tcp.local, "QM" question PTR _uscans._tcp.local, "QM" question PTR _ipps._tcp.local, "QM" question PTR _printer._tcp.local, "QM" question PTR _airplay._tcp.local, "QM" question PTR _raop._tcp.local, "QM" question PTR _airport._tcp.local, "QM" question PTR _rdlink._tcp.local, "QM" question PTR _companion-link._tcp.local, "QM" question PTR _afpovertcp._tcp.local, "QM" question PTR _rfb._tcp.local, "QM" question PTR _adisk._tcp.local, "QM" question PTR _apple-mobdev._tcp.local, "QM" question PTR 8ed307c3._sub._apple-mobdev2._tcp.local, "QM" question PTR _apple-pairable._tcp.local, "QM" question TXT Google-Home-Mini-2c3f16b2da5c4b6fd6cfbfba61c12490._googlecast._tcp.local, "QM" question PTR cjqg._companion-link._tcp.local OPT"
"431","1.743499425","72.21.91.29","192.168.1.118","TCP","66","[TCP ACKed unseen segment] 80 → 38622 [ACK] Seq=1 Ack=2 Win=152 Len=0 TSval=4245636229 TSecr=3421436032"
"432","1.809538112","192.168.1.102","224.0.0.251","MDNS","409","Standard query response 0x0000 PTR Google-Home-Mini-2c3f16b2da5c4b6fd6cfbfba61c12490._googlecast._tcp.local TXT, cache flush SRV, cache flush 0 0 8009 2c3f16b2-da5c-4b6f-d6cf-bfba61c12490.local A, cache flush 192.168.1.102"
"433","1.811895050","192.168.1.102","224.0.0.251","MDNS","183","Standard query response 0x0000 SRV, cache flush 0 0 8009 2c3f16b2-da5c-4b6f-d6cf-bfba61c12490.local"
"434","2.212864375","192.168.1.118","104.118.9.120","TCP","66","39706 → 443 [ACK] Seq=1 Ack=1 Win=501 Len=0 TSval=3031539522 TSecr=3094320988"
"435","2.224701662","104.118.9.120","192.168.1.118","TCP","66","[TCP ACKed unseen segment] 443 → 39706 [ACK] Seq=1 Ack=2 Win=252 Len=0 TSval=3094331223 TSecr=3031437083"
"436","2.919537575","192.168.1.118","192.168.1.102","TCP","176","40918 → 8009 [PSH, ACK] Seq=1 Ack=1 Win=501 Len=110 TSval=2814627564 TSecr=4493539 [TCP segment of a reassembled PDU]"
"437","2.937120325","192.168.1.102","192.168.1.118","TCP","176","8009 → 40918 [PSH, ACK] Seq=1 Ack=111 Win=277 Len=110 TSval=4494040 TSecr=2814627564 [TCP segment of a reassembled PDU]"
"438","2.937199575","192.168.1.118","192.168.1.102","TCP","66","40918 → 8009 [ACK] Seq=111 Ack=111 Win=501 Len=0 TSval=2814627581 TSecr=4494040"
"439","3.286331587","192.168.1.118","172.217.12.131","TLSv1.2","327","Application Data"
"440","3.306580900","172.217.12.131","192.168.1.118","TLSv1.2","435","Application Data"
"441","3.306750325","192.168.1.118","172.217.12.131","TCP","66","49578 → 443 [ACK] Seq=262 Ack=370 Win=499 Len=0 TSval=407870333 TSecr=3909178179"
"442","3.434586325","fe80::1cc7:6d9a:a312:7e8f","ff02::fb","MDNS","125","Standard query 0x0000 PTR _googlecast._tcp.local, "QM" question OPT"
"443","3.436572825","192.168.1.100","224.0.0.251","MDNS","105","Standard query 0x0000 PTR _googlecast._tcp.local, "QM" question OPT"
"444","3.539451387","192.168.1.102","224.0.0.251","MDNS","409","Standard query response 0x0000 PTR Google-Home-Mini-2c3f16b2da5c4b6fd6cfbfba61c12490._googlecast._tcp.local TXT, cache flush SRV, cache flush 0 0 8009 2c3f16b2-da5c-4b6f-d6cf-bfba61c12490.local A, cache flush 192.168.1.102"
"445","4.509133425","192.168.1.118","209.18.47.62","DNS","74","Standard query 0x1e0e A duckduckgo.com"
"446","4.516459662","192.168.1.118","209.18.47.62","DNS","84","Standard query 0xf3f3 A staticcdn.duckduckgo.com"
"447","4.536772787","209.18.47.62","192.168.1.118","DNS","90","Standard query response 0x1e0e A duckduckgo.com A 23.21.193.169"
"448","4.537335900","192.168.1.118","23.21.193.169","TCP","74","43236 → 443 [SYN] Seq=0 Win=64240 Len=0 MSS=1460 SACK_PERM=1 TSval=1651654930 TSecr=0 WS=128"
"449","4.542864437","209.18.47.62","192.168.1.118","DNS","131","Standard query response 0xf3f3 A staticcdn.duckduckgo.com CNAME external-content.duckduckgo.com A 50.16.241.130"
"450","4.543249075","192.168.1.118","50.16.241.130","TCP","74","42008 → 443 [SYN] Seq=0 Win=64240 Len=0 MSS=1460 SACK_PERM=1 TSval=3810578214 TSecr=0 WS=128"
"451","4.580477587","23.21.193.169","192.168.1.118","TCP","74","443 → 43236 [SYN, ACK] Seq=0 Ack=1 Win=26847 Len=0 MSS=1460 SACK_PERM=1 TSval=2166695483 TSecr=1651654930 WS=128"
"452","4.580582362","192.168.1.118","23.21.193.169","TCP","66","43236 → 443 [ACK] Seq=1 Ack=1 Win=64256 Len=0 TSval=1651654974 TSecr=2166695483"
"453","4.581115812","192.168.1.118","23.21.193.169","TLSv1","583","Client Hello"
"454","4.584017700","50.16.241.130","192.168.1.118","TCP","74","443 → 42008 [SYN, ACK] Seq=0 Ack=1 Win=26847 Len=0 MSS=1460 SACK_PERM=1 TSval=2122341515 TSecr=3810578214 WS=128"
"455","4.584126225","192.168.1.118","50.16.241.130","TCP","66","42008 → 443 [ACK] Seq=1 Ack=1 Win=64256 Len=0 TSval=3810578255 TSecr=2122341515"
"456","4.584623037","192.168.1.118","50.16.241.130","TLSv1","583","Client Hello"
"457","4.606957937","50.16.241.130","192.168.1.118","TCP","66","443 → 42008 [ACK] Seq=1 Ack=518 Win=28032 Len=0 TSval=2122341521 TSecr=3810578256"
"458","4.614307875","50.16.241.130","192.168.1.118","TLSv1.3","3888","Server Hello, Change Cipher Spec, Application Data, Application Data, Application Data, Application Data"
"459","4.614381737","192.168.1.118","50.16.241.130","TCP","66","42008 → 443 [ACK] Seq=518 Ack=3823 Win=60544 Len=0 TSval=3810578286 TSecr=2122341521"
"460","4.614421837","23.21.193.169","192.168.1.118","TCP","66","443 → 43236 [ACK] Seq=1 Ack=518 Win=28032 Len=0 TSval=2166695492 TSecr=1651654974"
"461","4.614447450","23.21.193.169","192.168.1.118","TLSv1.3","1514","Server Hello, Change Cipher Spec, Application Data"
"462","4.614463837","192.168.1.118","23.21.193.169","TCP","66","43236 → 443 [ACK] Seq=518 Ack=1449 Win=63104 Len=0 TSval=1651655008 TSecr=2166695493"
"463","4.614508175","23.21.193.169","192.168.1.118","TLSv1.3","2440","Application Data, Application Data, Application Data"
"464","4.614527125","192.168.1.118","23.21.193.169","TCP","66","43236 → 443 [ACK] Seq=518 Ack=3823 Win=60800 Len=0 TSval=1651655008 TSecr=2166695493"
"465","4.627106462","192.168.1.118","50.16.241.130","TLSv1.3","146","Change Cipher Spec, Application Data"
"466","4.643773362","192.168.1.118","23.21.193.169","TLSv1.3","146","Change Cipher Spec, Application Data"
"467","4.648281337","192.168.1.118","50.16.241.130","TLSv1.3","158","Application Data"
"468","4.649179725","192.168.1.118","50.16.241.130","TLSv1.3","382","Application Data"
"469","4.649447987","192.168.1.118","23.21.193.169","TLSv1.3","158","Application Data"
"470","4.649818725","192.168.1.118","23.21.193.169","TLSv1.3","357","Application Data"
"471","4.650701775","192.168.1.118","50.16.241.130","TLSv1.3","488","Application Data, Application Data, Application Data, Application Data"
"472","4.651241625","192.168.1.118","23.21.193.169","TLSv1.3","207","Application Data"
"473","4.654500612","50.16.241.130","192.168.1.118","TLSv1.3","369","Application Data"
"474","4.655585575","50.16.241.130","192.168.1.118","TLSv1.3","369","Application Data"
"475","4.655634625","50.16.241.130","192.168.1.118","TLSv1.3","128","Application Data"
"476","4.655734725","192.168.1.118","50.16.241.130","TCP","66","42008 → 443 [ACK] Seq=1428 Ack=4491 Win=64128 Len=0 TSval=3810578327 TSecr=2122341533"
"477","4.655995850","192.168.1.118","50.16.241.130","TLSv1.3","97","Application Data"
"478","4.679529000","23.21.193.169","192.168.1.118","TLSv1.3","353","Application Data"
"479","4.681310587","23.21.193.169","192.168.1.118","TLSv1.3","353","Application Data"
"480","4.681358925","23.21.193.169","192.168.1.118","TLSv1.3","128","Application Data"
"481","4.681373362","50.16.241.130","192.168.1.118","TCP","66","443 → 42008 [ACK] Seq=4491 Ack=1428 Win=30080 Len=0 TSval=2122341538 TSecr=3810578319"
"482","4.681401437","50.16.241.130","192.168.1.118","TLSv1.3","283","Application Data"
"483","4.681421812","50.16.241.130","192.168.1.118","TLSv1.3","274","Application Data"
"484","4.681436950","50.16.241.130","192.168.1.118","TLSv1.3","273","Application Data"
"485","4.681450850","50.16.241.130","192.168.1.118","TLSv1.3","273","Application Data"
"486","4.681464862","50.16.241.130","192.168.1.118","TLSv1.3","274","Application Data"
"487","4.681473687","192.168.1.118","23.21.193.169","TCP","66","43236 → 443 [ACK] Seq=1122 Ack=4459 Win=64128 Len=0 TSval=1651655075 TSecr=2166695508"
"488","4.681480162","23.21.193.169","192.168.1.118","TCP","66","443 → 43236 [ACK] Seq=4459 Ack=1122 Win=30080 Len=0 TSval=2166695510 TSecr=1651655043"
"489","4.681494312","23.21.193.169","192.168.1.118","TLSv1.3","758","Application Data"
"490","4.681507550","23.21.193.169","192.168.1.118","TLSv1.3","468","Application Data"
"491","4.681688250","192.168.1.118","23.21.193.169","TCP","66","43236 → 443 [ACK] Seq=1122 Ack=5553 Win=64128 Len=0 TSval=1651655075 TSecr=2166695510"
"492","4.682888637","192.168.1.118","23.21.193.169","TLSv1.3","97","Application Data"
"493","4.682982237","192.168.1.118","50.16.241.130","TCP","66","42008 → 443 [ACK] Seq=1459 Ack=5538 Win=64128 Len=0 TSval=3810578354 TSecr=2122341538"
"494","4.748740700","23.21.193.169","192.168.1.118","TCP","66","443 → 43236 [ACK] Seq=5553 Ack=1153 Win=30080 Len=0 TSval=2166695528 TSecr=1651655076"
"495","4.828118787","192.168.1.118","35.241.35.241","TLSv1.2","105","Application Data"
"496","4.849395537","35.241.35.241","192.168.1.118","TLSv1.2","105","Application Data"
"497","4.849464150","192.168.1.118","35.241.35.241","TCP","66","39606 → 443 [ACK] Seq=40 Ack=40 Win=501 Len=0 TSval=3577651262 TSecr=3786938803"
"498","5.602320750","192.168.1.118","172.217.12.206","TCP","1434","[TCP segment of a reassembled PDU]"
"499","5.602360337","192.168.1.118","172.217.12.206","TCP","1434","48714 → 443 [ACK] Seq=1369 Ack=1 Win=501 Len=1368 TSval=316866223 TSecr=232069012 [TCP segment of a reassembled PDU]"
"500","5.602400912","192.168.1.118","172.217.12.206","TCP","1434","48714 → 443 [ACK] Seq=2737 Ack=1 Win=501 Len=1368 TSval=316866223 TSecr=232069012 [TCP segment of a reassembled PDU]"
"501","5.602409925","192.168.1.118","172.217.12.206","TLSv1.2","84","Application Data"
"502","5.626898162","172.217.12.206","192.168.1.118","TCP","66","443 → 48714 [ACK] Seq=1 Ack=1369 Win=436 Len=0 TSval=232079305 TSecr=316866223"
"503","5.633905687","172.217.12.206","192.168.1.118","TCP","66","443 → 48714 [ACK] Seq=1 Ack=2737 Win=447 Len=0 TSval=232079306 TSecr=316866223"
"504","5.633977237","172.217.12.206","192.168.1.118","TCP","66","443 → 48714 [ACK] Seq=1 Ack=4105 Win=458 Len=0 TSval=232079307 TSecr=316866223"
"505","5.633996150","172.217.12.206","192.168.1.118","TCP","66","443 → 48714 [ACK] Seq=1 Ack=4123 Win=458 Len=0 TSval=232079307 TSecr=316866223"
"506","5.686480650","192.168.1.1","224.0.0.1","IGMPv2","42","Membership Query, general"
"507","5.703823725","172.217.12.206","192.168.1.118","TLSv1.2","1484","Application Data"
"508","5.703996562","192.168.1.118","172.217.12.206","TCP","66","48714 → 443 [ACK] Seq=4123 Ack=1419 Win=493 Len=0 TSval=316866325 TSecr=232079390"
"509","5.705543787","172.217.12.206","192.168.1.118","TLSv1.2","1872","Application Data, Application Data"
"510","5.705689050","192.168.1.118","172.217.12.206","TCP","66","48714 → 443 [ACK] Seq=4123 Ack=3225 Win=479 Len=0 TSval=316866327 TSecr=232079391"
"511","5.707135787","172.217.12.206","192.168.1.118","TLSv1.2","1484","Application Data"
"512","5.707274825","192.168.1.118","172.217.12.206","TCP","66","48714 → 443 [ACK] Seq=4123 Ack=4643 Win=468 Len=0 TSval=316866328 TSecr=232079393"
"513","5.708069725","172.217.12.206","192.168.1.118","TLSv1.2","1484","Application Data"
"514","5.708169837","192.168.1.118","172.217.12.206","TCP","66","48714 → 443 [ACK] Seq=4123 Ack=6061 Win=457 Len=0 TSval=316866329 TSecr=232079393"
"515","5.710829837","172.217.12.206","192.168.1.118","TLSv1.2","1484","Application Data"
"516","5.710976000","192.168.1.118","172.217.12.206","TCP","66","48714 → 443 [ACK] Seq=4123 Ack=7479 Win=446 Len=0 TSval=316866332 TSecr=232079397"
"517","5.712497000","172.217.12.206","192.168.1.118","TLSv1.2","1484","Application Data"
"518","5.712624237","192.168.1.118","172.217.12.206","TCP","66","48714 → 443 [ACK] Seq=4123 Ack=8897 Win=435 Len=0 TSval=316866334 TSecr=232079397"
"519","5.714752050","172.217.12.206","192.168.1.118","TLSv1.2","1484","Application Data"
"520","5.714912137","192.168.1.118","172.217.12.206","TCP","66","48714 → 443 [ACK] Seq=4123 Ack=10315 Win=424 Len=0 TSval=316866336 TSecr=232079401"
"521","5.715659800","172.217.12.206","192.168.1.118","TLSv1.2","1484","Application Data"
"522","5.715763050","192.168.1.118","172.217.12.206","TCP","66","48714 → 443 [ACK] Seq=4123 Ack=11733 Win=413 Len=0 TSval=316866337 TSecr=232079401"
"523","5.718490075","172.217.12.206","192.168.1.118","TLSv1.2","870","Application Data, Application Data"
"524","5.718647687","192.168.1.118","172.217.12.206","TCP","66","48714 → 443 [ACK] Seq=4123 Ack=12537 Win=407 Len=0 TSval=316866340 TSecr=232079405"
"525","6.465927662","192.168.1.118","172.217.12.206","TCP","1434","[TCP segment of a reassembled PDU]"
"526","6.465966262","192.168.1.118","172.217.12.206","TCP","1434","48712 → 443 [ACK] Seq=1369 Ack=1 Win=501 Len=1368 TSval=316867087 TSecr=506173804 [TCP segment of a reassembled PDU]"
"527","6.466004687","192.168.1.118","172.217.12.206","TLSv1.2","345","Application Data"
"528","6.480075437","172.217.12.206","192.168.1.118","TCP","66","443 → 48712 [ACK] Seq=1 Ack=1369 Win=347 Len=0 TSval=506195411 TSecr=316867087"
"529","6.488704662","172.217.12.206","192.168.1.118","TCP","66","443 → 48712 [ACK] Seq=1 Ack=2737 Win=357 Len=0 TSval=506195420 TSecr=316867087"
"530","6.489614125","172.217.12.206","192.168.1.118","TCP","66","443 → 48712 [ACK] Seq=1 Ack=3016 Win=368 Len=0 TSval=506195421 TSecr=316867087"
"531","6.548456725","172.217.12.206","192.168.1.118","TLSv1.2","1421","Application Data"
"532","6.548623187","192.168.1.118","172.217.12.206","TCP","66","48712 → 443 [ACK] Seq=3016 Ack=1356 Win=493 Len=0 TSval=316867170 TSecr=506195480"
"533","6.549969537","172.217.12.206","192.168.1.118","TLSv1.2","100","Application Data"
"534","6.550107875","192.168.1.118","172.217.12.206","TCP","66","48712 → 443 [ACK] Seq=3016 Ack=1390 Win=493 Len=0 TSval=316867171 TSecr=506195481"
"535","6.778734987","192.168.1.118","23.21.193.169","TCP","66","43236 → 443 [FIN, ACK] Seq=1153 Ack=5553 Win=64128 Len=0 TSval=1651657172 TSecr=2166695528"
"536","6.783054012","192.168.1.118","50.16.241.130","TCP","66","42008 → 443 [FIN, ACK] Seq=1459 Ack=5538 Win=64128 Len=0 TSval=3810580454 TSecr=2122341538"
"537","6.804663550","23.21.193.169","192.168.1.118","TCP","66","443 → 43236 [FIN, ACK] Seq=5553 Ack=1154 Win=30080 Len=0 TSval=2166696041 TSecr=1651657172"
"538","6.804742837","192.168.1.118","23.21.193.169","TCP","66","43236 → 443 [ACK] Seq=1154 Ack=5554 Win=64128 Len=0 TSval=1651657198 TSecr=2166696041"
"539","6.816151462","50.16.241.130","192.168.1.118","TCP","66","443 → 42008 [FIN, ACK] Seq=5538 Ack=1460 Win=30080 Len=0 TSval=2122342072 TSecr=3810580454"
"540","6.816229237","192.168.1.118","50.16.241.130","TCP","66","42008 → 443 [ACK] Seq=1460 Ack=5539 Win=64128 Len=0 TSval=3810580487 TSecr=2122342072"
"541","6.829222000","192.168.1.118","172.217.6.211","TLSv1.2","105","Application Data"
"542","6.857615125","172.217.6.211","192.168.1.118","TCP","66","443 → 33656 [ACK] Seq=1 Ack=40 Win=248 Len=0 TSval=591082170 TSecr=580546233"
"543","6.887890787","172.217.6.211","192.168.1.118","TLSv1.2","105","Application Data"
"544","6.887952662","192.168.1.118","172.217.6.211","TCP","66","33656 → 443 [ACK] Seq=40 Ack=40 Win=501 Len=0 TSval=580546292 TSecr=591082178"
"545","7.637507325","192.168.1.104","255.255.255.255","UDP","217","49154 → 6666 Len=175"
"546","7.765736750","192.168.1.118","104.16.86.20","TLSv1.2","93","Application Data"
"547","7.765985187","192.168.1.118","52.22.234.69","TLSv1.2","112","Application Data"
"548","7.766426350","192.168.1.118","52.22.234.69","TLSv1.2","97","Encrypted Alert"
"549","7.766725537","192.168.1.118","104.16.86.20","TLSv1.2","78","Application Data"
"550","7.801967775","104.16.86.20","192.168.1.118","TCP","54","443 → 46912 [ACK] Seq=1 Ack=65 Win=67 Len=0"
"551","7.803191100","104.16.86.20","192.168.1.118","TCP","54","443 → 46912 [FIN, ACK] Seq=1 Ack=65 Win=67 Len=0"
"552","7.803261637","192.168.1.118","104.16.86.20","TCP","54","46912 → 443 [ACK] Seq=65 Ack=2 Win=501 Len=0"
"553","7.807508875","52.22.234.69","192.168.1.118","TCP","66","443 → 38784 [ACK] Seq=1 Ack=79 Win=118 Len=0 TSval=34330142 TSecr=2354665797"
"554","7.808558362","52.22.234.69","192.168.1.118","TCP","66","443 → 38784 [FIN, ACK] Seq=1 Ack=79 Win=118 Len=0 TSval=34330142 TSecr=2354665797"
"555","7.808632250","192.168.1.118","52.22.234.69","TCP","66","38784 → 443 [ACK] Seq=79 Ack=2 Win=501 Len=0 TSval=2354665840 TSecr=34330142"
"556","7.829779900","192.168.1.118","142.250.64.83","TLSv1.2","105","Application Data"
"557","7.856585000","142.250.64.83","192.168.1.118","TCP","66","443 → 44520 [ACK] Seq=1 Ack=40 Win=248 Len=0 TSval=3017274676 TSecr=3998526777"
"558","7.866183125","142.250.64.83","192.168.1.118","TLSv1.2","105","Application Data"
"559","7.866246637","192.168.1.118","142.250.64.83","TCP","66","44520 → 443 [ACK] Seq=40 Ack=40 Win=501 Len=0 TSval=3998526813 TSecr=3017274684"
"560","7.939344375","192.168.1.118","192.168.1.102","TCP","176","40918 → 8009 [PSH, ACK] Seq=111 Ack=111 Win=501 Len=110 TSval=2814632583 TSecr=4494040 [TCP segment of a reassembled PDU]"
"561","7.954662712","192.168.1.102","192.168.1.118","TCP","176","8009 → 40918 [PSH, ACK] Seq=111 Ack=221 Win=277 Len=110 TSval=4494543 TSecr=2814632583 [TCP segment of a reassembled PDU]"
"562","7.954742362","192.168.1.118","192.168.1.102","TCP","66","40918 → 8009 [ACK] Seq=221 Ack=221 Win=501 Len=0 TSval=2814632599 TSecr=4494543"
"563","8.356873875","192.168.1.118","104.74.65.169","TCP","66","43010 → 443 [ACK] Seq=1 Ack=1 Win=501 Len=0 TSval=705854597 TSecr=312953354"
"564","8.375598675","104.74.65.169","192.168.1.118","TCP","66","[TCP ACKed unseen segment] 443 → 43010 [ACK] Seq=1 Ack=2 Win=252 Len=0 TSval=312963596 TSecr=705762818"
"565","8.830502800","192.168.1.118","199.232.37.164","TLSv1.2","112","Application Data"
"566","8.848147675","199.232.37.164","192.168.1.118","TLSv1.2","112","Application Data"
"567","8.848221825","192.168.1.118","199.232.37.164","TCP","66","38678 → 443 [ACK] Seq=47 Ack=47 Win=9088 Len=0 TSval=650703047 TSecr=3252270318"
"568","9.072367962","fe80::1cc7:6d9a:a312:7e8f","ff02::fb","MDNS","612","Standard query 0x0000 PTR _googlecast._tcp.local, "QU" question PTR _homekit._tcp.local, "QU" question PTR _uscan._tcp.local, "QU" question PTR _ptp._tcp.local, "QU" question PTR _ippusb._tcp.local, "QU" question PTR _scanner._tcp.local, "QU" question PTR _ipp._tcp.local, "QU" question PTR _pdl-datastream._tcp.local, "QU" question PTR _uscans._tcp.local, "QU" question PTR _ipps._tcp.local, "QU" question PTR _printer._tcp.local, "QU" question PTR _airplay._tcp.local, "QU" question PTR _raop._tcp.local, "QU" question PTR _airport._tcp.local, "QU" question PTR _rdlink._tcp.local, "QU" question PTR _companion-link._tcp.local, "QU" question PTR _afpovertcp._tcp.local, "QU" question PTR _rfb._tcp.local, "QU" question PTR _adisk._tcp.local, "QU" question PTR _apple-mobdev._tcp.local, "QU" question PTR 8ed307c3._sub._apple-mobdev2._tcp.local, "QU" question PTR _apple-pairable._tcp.local, "QU" question SRV Google-Home-Mini-2c3f16b2da5c4b6fd6cfbfba61c12490._googlecast._tcp.local, "QU" question TXT Google-Home-Mini-2c3f16b2da5c4b6fd6cfbfba61c12490._googlecast._tcp.local, "QU" question ANY cjqg._smb._tcp.local, "QU" question ANY cjqg._companion-link._tcp.local, "QU" question PTR cjqg._companion-link._tcp.local SRV 0 0 445 cjqg.local SRV 0 0 53785 cjqg.local OPT"
"569","9.076008150","fe80::1cc7:6d9a:a312:7e8f","ff02::fb","MDNS","308","Standard query response 0x0000 PTR _smb._tcp.local TXT TXT OPT"
"570","9.081795750","192.168.1.100","224.0.0.251","MDNS","592","Standard query 0x0000 PTR _googlecast._tcp.local, "QU" question PTR _homekit._tcp.local, "QU" question PTR _uscan._tcp.local, "QU" question PTR _ptp._tcp.local, "QU" question PTR _ippusb._tcp.local, "QU" question PTR _scanner._tcp.local, "QU" question PTR _ipp._tcp.local, "QU" question PTR _pdl-datastream._tcp.local, "QU" question PTR _uscans._tcp.local, "QU" question PTR _ipps._tcp.local, "QU" question PTR _printer._tcp.local, "QU" question PTR _airplay._tcp.local, "QU" question PTR _raop._tcp.local, "QU" question PTR _airport._tcp.local, "QU" question PTR _rdlink._tcp.local, "QU" question PTR _companion-link._tcp.local, "QU" question PTR _afpovertcp._tcp.local, "QU" question PTR _rfb._tcp.local, "QU" question PTR _adisk._tcp.local, "QU" question PTR _apple-mobdev._tcp.local, "QU" question PTR 8ed307c3._sub._apple-mobdev2._tcp.local, "QU" question PTR _apple-pairable._tcp.local, "QU" question SRV Google-Home-Mini-2c3f16b2da5c4b6fd6cfbfba61c12490._googlecast._tcp.local, "QU" question TXT Google-Home-Mini-2c3f16b2da5c4b6fd6cfbfba61c12490._googlecast._tcp.local, "QU" question ANY cjqg._smb._tcp.local, "QU" question ANY cjqg._companion-link._tcp.local, "QU" question PTR cjqg._companion-link._tcp.local SRV 0 0 445 cjqg.local SRV 0 0 53785 cjqg.local OPT"
"571","9.275433637","fe80::1cc7:6d9a:a312:7e8f","ff02::fb","MDNS","195","Standard query 0x0000 ANY cjqg._smb._tcp.local, "QM" question ANY cjqg._companion-link._tcp.local, "QM" question SRV 0 0 445 cjqg.local SRV 0 0 53785 cjqg.local OPT"
"572","9.375220500","192.168.1.100","224.0.0.251","MDNS","175","Standard query 0x0000 ANY cjqg._smb._tcp.local, "QM" question ANY cjqg._companion-link._tcp.local, "QM" question SRV 0 0 445 cjqg.local SRV 0 0 53785 cjqg.local OPT"
"573","9.480936700","192.168.1.100","224.0.0.251","MDNS","175","Standard query 0x0000 ANY cjqg._smb._tcp.local, "QM" question ANY cjqg._companion-link._tcp.local, "QM" question SRV 0 0 445 cjqg.local SRV 0 0 53785 cjqg.local OPT"
"574","9.483629662","fe80::1cc7:6d9a:a312:7e8f","ff02::fb","MDNS","195","Standard query 0x0000 ANY cjqg._smb._tcp.local, "QM" question ANY cjqg._companion-link._tcp.local, "QM" question SRV 0 0 445 cjqg.local SRV 0 0 53785 cjqg.local OPT"
