frame.number,_ws.col.Time,_ws.col.Source,_ws.col.Destination,_ws.col.Protocol,frame.len,_ws.col.Info
"1","0.000000000","192.168.1.118","104.102.83.39","TLSv1","583","Client Hello"
"2","0.024667975","104.102.83.39","192.168.1.118","TCP","66","443 → 44888 [ACK] Seq=1 Ack=518 Win=235 Len=0 TSval=266384923 TSecr=3636223799"
"3","0.027006988","104.102.83.39","192.168.1.118","TLSv1.2","1514","Server Hello"
"4","0.027072100","192.168.1.118","104.102.83.39","TCP","66","44888 → 443 [ACK] Seq=518 Ack=1449 Win=493 Len=0 TSval=3636223826 TSecr=266384928"
"5","0.028415975","104.102.83.39","192.168.1.118","TLSv1.2","1891","Certificate, Server Key Exchange, Server Hello Done"
"6","0.028468088","192.168.1.118","104.102.83.39","TCP","66","44888 → 443 [ACK] Seq=518 Ack=3274 Win=479 Len=0 TSval=3636223828 TSecr=266384928"
"7","0.041428050","192.168.1.118","104.102.83.39","TLSv1","583","Client Hello"
"8","0.061200888","104.102.83.39","192.168.1.118","TCP","66","443 → 44890 [ACK] Seq=1 Ack=518 Win=235 Len=0 TSval=266384963 TSecr=3636223841"
"9","0.063405038","104.102.83.39","192.168.1.118","TLSv1.2","1514","Server Hello"
"10","0.063470763","192.168.1.118","104.102.83.39","TCP","66","44890 → 443 [ACK] Seq=518 Ack=1449 Win=493 Len=0 TSval=3636223863 TSecr=266384964"
"11","0.064813975","104.102.83.39","192.168.1.118","TLSv1.2","1891","Certificate, Server Key Exchange, Server Hello Done"
"12","0.064869213","192.168.1.118","104.102.83.39","TCP","66","44890 → 443 [ACK] Seq=518 Ack=3274 Win=479 Len=0 TSval=3636223864 TSecr=266384964"
"13","0.068239775","192.168.1.118","104.102.83.39","TLSv1","583","Client Hello"
"14","0.080082725","192.168.1.118","209.18.47.61","TCP","74","38924 → 853 [SYN] Seq=0 Win=64240 Len=0 MSS=1460 SACK_PERM=1 TSval=3660620706 TSecr=0 WS=128"
"15","0.090730588","104.102.83.39","192.168.1.118","TCP","66","443 → 44892 [ACK] Seq=1 Ack=518 Win=235 Len=0 TSval=266384992 TSecr=3636223868"
"16","0.094979575","104.102.83.39","192.168.1.118","TLSv1.2","1514","Server Hello"
"17","0.095051350","192.168.1.118","104.102.83.39","TCP","66","44892 → 443 [ACK] Seq=518 Ack=1449 Win=493 Len=0 TSval=3636223894 TSecr=266384994"
"18","0.096395125","104.102.83.39","192.168.1.118","TLSv1.2","1891","Certificate, Server Key Exchange, Server Hello Done"
"19","0.096454750","192.168.1.118","104.102.83.39","TCP","66","44892 → 443 [ACK] Seq=518 Ack=3274 Win=479 Len=0 TSval=3636223896 TSecr=266384994"
"20","0.104363250","192.168.1.118","104.102.83.39","TLSv1","583","Client Hello"
"21","0.121815450","104.102.83.39","192.168.1.118","TCP","66","443 → 44894 [ACK] Seq=1 Ack=518 Win=235 Len=0 TSval=266385023 TSecr=3636223904"
"22","0.123798888","104.102.83.39","192.168.1.118","TLSv1.2","1514","Server Hello"
"23","0.123863738","192.168.1.118","104.102.83.39","TCP","66","44894 → 443 [ACK] Seq=518 Ack=1449 Win=493 Len=0 TSval=3636223923 TSecr=266385025"
"24","0.128899825","104.102.83.39","192.168.1.118","TLSv1.2","1891","Certificate, Server Key Exchange, Server Hello Done"
"25","0.128973413","192.168.1.118","104.102.83.39","TCP","66","44894 → 443 [ACK] Seq=518 Ack=3274 Win=479 Len=0 TSval=3636223928 TSecr=266385025"
"26","0.129434750","192.168.1.118","104.102.83.39","TLSv1","583","Client Hello"
"27","0.130535138","192.168.1.118","136.147.56.1","TLSv1.2","307","Application Data"
"28","0.132528938","192.168.1.118","104.102.83.39","TLSv1.2","192","Client Key Exchange, Change Cipher Spec, Encrypted Handshake Message"
"29","0.134853625","192.168.1.118","104.102.83.39","TLSv1.2","192","Client Key Exchange, Change Cipher Spec, Encrypted Handshake Message"
"30","0.136820738","192.168.1.118","104.102.83.39","TLSv1.2","192","Client Key Exchange, Change Cipher Spec, Encrypted Handshake Message"
"31","0.138743338","192.168.1.118","104.102.83.39","TLSv1.2","192","Client Key Exchange, Change Cipher Spec, Encrypted Handshake Message"
"32","0.149522413","104.102.83.39","192.168.1.118","TLSv1.2","117","Change Cipher Spec, Encrypted Handshake Message"
"33","0.149592438","192.168.1.118","104.102.83.39","TCP","66","44888 → 443 [ACK] Seq=644 Ack=3325 Win=501 Len=0 TSval=3636223949 TSecr=266385051"
"34","0.152017238","104.102.83.39","192.168.1.118","TCP","66","443 → 44896 [ACK] Seq=1 Ack=518 Win=235 Len=0 TSval=266385051 TSecr=3636223929"
"35","0.152434425","192.168.1.118","104.102.83.39","TLSv1.2","336","Application Data"
"36","0.153162663","104.102.83.39","192.168.1.118","TLSv1.2","3339","Server Hello, Certificate, Server Key Exchange, Server Hello Done"
"37","0.153220413","192.168.1.118","104.102.83.39","TCP","66","44896 → 443 [ACK] Seq=518 Ack=3274 Win=477 Len=0 TSval=3636223953 TSecr=266385053"
"38","0.153259113","104.102.83.39","192.168.1.118","TLSv1.2","117","Change Cipher Spec, Encrypted Handshake Message"
"39","0.153281650","192.168.1.118","104.102.83.39","TCP","66","44892 → 443 [ACK] Seq=644 Ack=3325 Win=501 Len=0 TSval=3636223953 TSecr=266385053"
"40","0.153297838","104.102.83.39","192.168.1.118","TLSv1.2","117","Change Cipher Spec, Encrypted Handshake Message"
"41","0.154212113","192.168.1.118","104.102.83.39","TLSv1.2","309","Application Data"
"42","0.154417788","104.102.83.39","192.168.1.118","TLSv1.2","117","Change Cipher Spec, Encrypted Handshake Message"
"43","0.154457800","192.168.1.118","104.102.83.39","TLSv1.2","296","Application Data"
"44","0.154476675","192.168.1.118","104.102.83.39","TCP","66","44890 → 443 [ACK] Seq=644 Ack=3325 Win=501 Len=0 TSval=3636223954 TSecr=266385053"
"45","0.156751438","192.168.1.118","104.102.83.39","TLSv1.2","192","Client Key Exchange, Change Cipher Spec, Encrypted Handshake Message"
"46","0.157138850","192.168.1.118","104.102.83.39","TLSv1.2","320","Application Data"
"47","0.182963463","104.102.83.39","192.168.1.118","TCP","1514","[TCP segment of a reassembled PDU]"
"48","0.184302100","104.102.83.39","192.168.1.118","TLSv1.2","1243","Application Data"
"49","0.184365325","104.102.83.39","192.168.1.118","TLSv1.2","117","Change Cipher Spec, Encrypted Handshake Message"
"50","0.184388350","104.102.83.39","192.168.1.118","TCP","2962","[TCP segment of a reassembled PDU]"
"51","0.185408313","104.102.83.39","192.168.1.118","TCP","2962","443 → 44892 [ACK] Seq=6221 Ack=887 Win=243 Len=2896 TSval=266385079 TSecr=3636223954 [TCP segment of a reassembled PDU]"
"52","0.186519463","192.168.1.118","104.102.83.39","TCP","66","44888 → 443 [ACK] Seq=914 Ack=5950 Win=481 Len=0 TSval=3636223986 TSecr=266385079"
"53","0.187082850","192.168.1.118","104.102.83.39","TCP","66","44892 → 443 [ACK] Seq=887 Ack=9117 Win=456 Len=0 TSval=3636223986 TSecr=266385079"
"54","0.187629988","192.168.1.118","104.102.83.39","TLSv1.2","305","Application Data"
"55","0.188508200","192.168.1.118","104.102.83.39","TLSv1.2","307","Application Data"
"56","0.191801438","104.102.83.39","192.168.1.118","TCP","1514","[TCP segment of a reassembled PDU]"
"57","0.198905475","136.147.56.1","192.168.1.118","TCP","66","443 → 32794 [ACK] Seq=1 Ack=242 Win=4964 Len=0 TSval=709682934 TSecr=2171519278"
"58","0.198962788","104.102.83.39","192.168.1.118","TCP","1514","443 → 44894 [ACK] Seq=4773 Ack=874 Win=243 Len=1448 TSval=266385091 TSecr=3636223954 [TCP segment of a reassembled PDU]"
"59","0.198976225","104.102.83.39","192.168.1.118","TCP","2962","[TCP segment of a reassembled PDU]"
"60","0.198990925","104.102.83.39","192.168.1.118","TCP","2962","443 → 44892 [ACK] Seq=9117 Ack=887 Win=243 Len=2896 TSval=266385079 TSecr=3636223954 [TCP segment of a reassembled PDU]"
"61","0.199020700","192.168.1.118","104.102.83.39","TCP","66","44892 → 443 [ACK] Seq=887 Ack=12013 Win=477 Len=0 TSval=3636223998 TSecr=266385079"
"62","0.199211425","192.168.1.118","104.102.83.39","TCP","66","44890 → 443 [ACK] Seq=898 Ack=6221 Win=479 Len=0 TSval=3636223999 TSecr=266385091"
"63","0.199332238","192.168.1.118","104.102.83.39","TCP","66","44894 → 443 [ACK] Seq=874 Ack=6221 Win=501 Len=0 TSval=3636223999 TSecr=266385091"
"64","0.204692338","104.102.83.39","192.168.1.118","TLSv1.2","740","Application Data"
"65","0.204752650","104.102.83.39","192.168.1.118","TCP","2962","443 → 44890 [ACK] Seq=6221 Ack=898 Win=243 Len=2896 TSval=266385091 TSecr=3636223956 [TCP segment of a reassembled PDU]"
"66","0.204764175","104.102.83.39","192.168.1.118","TCP","2962","443 → 44892 [ACK] Seq=12013 Ack=887 Win=243 Len=2896 TSval=266385085 TSecr=3636223954 [TCP segment of a reassembled PDU]"
"67","0.204798700","192.168.1.118","104.102.83.39","TCP","66","44892 → 443 [ACK] Seq=887 Ack=14909 Win=477 Len=0 TSval=3636224004 TSecr=266385085"
"68","0.206480625","104.102.83.39","192.168.1.118","TLSv1.2","2706","Application Data"
"69","0.206543425","104.102.83.39","192.168.1.118","TCP","2962","443 → 44892 [ACK] Seq=14909 Ack=887 Win=243 Len=2896 TSval=266385092 TSecr=3636223954 [TCP segment of a reassembled PDU]"
"70","0.207926525","192.168.1.118","104.102.83.39","TCP","66","44890 → 443 [ACK] Seq=898 Ack=11757 Win=501 Len=0 TSval=3636224007 TSecr=266385091"
"71","0.208831850","192.168.1.118","104.102.83.39","TCP","66","44892 → 443 [ACK] Seq=887 Ack=17805 Win=501 Len=0 TSval=3636224008 TSecr=266385092"
"72","0.210013275","192.168.1.118","104.102.83.39","TLSv1.2","305","Application Data"
"73","0.210144563","192.168.1.118","104.102.83.39","TLSv1.2","293","Application Data"
"74","0.215296663","104.102.83.39","192.168.1.118","TCP","1514","443 → 44892 [ACK] Seq=17805 Ack=887 Win=243 Len=1448 TSval=266385098 TSecr=3636223954 [TCP segment of a reassembled PDU]"
"75","0.219309213","104.102.83.39","192.168.1.118","TLSv1.2","612","Application Data"
"76","0.219391550","104.102.83.39","192.168.1.118","TLSv1.2","1514","Application Data [TCP segment of a reassembled PDU]"
"77","0.219404113","104.102.83.39","192.168.1.118","TCP","2962","[TCP segment of a reassembled PDU]"
"78","0.223695238","104.102.83.39","192.168.1.118","TCP","2962","443 → 44892 [ACK] Seq=20701 Ack=887 Win=243 Len=2896 TSval=266385105 TSecr=3636223954 [TCP segment of a reassembled PDU]"
"79","0.224973988","104.102.83.39","192.168.1.118","TCP","2962","443 → 44892 [ACK] Seq=23597 Ack=887 Win=243 Len=2896 TSval=266385111 TSecr=3636223954 [TCP segment of a reassembled PDU]"
"80","0.225017538","104.102.83.39","192.168.1.118","TCP","2962","443 → 44896 [ACK] Seq=6221 Ack=883 Win=243 Len=2896 TSval=266385115 TSecr=3636223987 [TCP segment of a reassembled PDU]"
"81","0.228346938","104.102.83.39","192.168.1.118","TCP","2962","443 → 44892 [ACK] Seq=26493 Ack=887 Win=243 Len=2896 TSval=266385118 TSecr=3636223998 [TCP segment of a reassembled PDU]"
"82","0.238721250","104.102.83.39","192.168.1.118","TCP","2962","443 → 44892 [ACK] Seq=29389 Ack=887 Win=243 Len=2896 TSval=266385122 TSecr=3636223998 [TCP segment of a reassembled PDU]"
"83","0.242326113","104.102.83.39","192.168.1.118","TLSv1.2","357","Application Data"
"84","0.242402575","104.102.83.39","192.168.1.118","TCP","2962","443 → 44892 [ACK] Seq=32285 Ack=887 Win=243 Len=2896 TSval=266385126 TSecr=3636223998 [TCP segment of a reassembled PDU]"
"85","0.242424163","104.102.83.39","192.168.1.118","TLSv1.2","2962","Application Data, Application Data"
"86","0.243539738","104.102.83.39","192.168.1.118","TCP","2962","443 → 44892 [ACK] Seq=38077 Ack=887 Win=243 Len=2896 TSval=266385134 TSecr=3636224004 [TCP segment of a reassembled PDU]"
"87","0.250206350","104.102.83.39","192.168.1.118","TCP","1514","443 → 44892 [ACK] Seq=40973 Ack=887 Win=243 Len=1448 TSval=266385138 TSecr=3636224004 [TCP segment of a reassembled PDU]"
"88","0.250271813","192.168.1.118","104.102.83.39","TCP","66","44892 → 443 [ACK] Seq=887 Ack=42421 Win=309 Len=0 TSval=3636224050 TSecr=266385098"
"89","0.254904975","192.168.1.118","104.102.83.39","TCP","66","44896 → 443 [ACK] Seq=883 Ack=9408 Win=454 Len=0 TSval=3636224054 TSecr=266385115"
"90","0.255313488","104.102.83.39","192.168.1.118","TCP","1514","443 → 44892 [ACK] Seq=42421 Ack=887 Win=243 Len=1448 TSval=266385138 TSecr=3636224004 [TCP segment of a reassembled PDU]"
"91","0.255377938","104.102.83.39","192.168.1.118","TCP","2962","443 → 44892 [ACK] Seq=43869 Ack=887 Win=243 Len=2896 TSval=266385142 TSecr=3636224008 [TCP segment of a reassembled PDU]"
"92","0.255548200","192.168.1.118","104.102.83.39","TCP","66","44892 → 443 [ACK] Seq=887 Ack=46765 Win=276 Len=0 TSval=3636224055 TSecr=266385138"
"93","0.259949625","192.168.1.118","104.102.83.39","TCP","66","44888 → 443 [ACK] Seq=1155 Ack=6496 Win=501 Len=0 TSval=3636224059 TSecr=266385115"
"94","0.268771313","192.168.1.118","104.102.83.39","TLSv1.2","317","Application Data"
"95","0.268951563","192.168.1.118","104.102.83.39","TLSv1.2","340","Application Data"
"96","0.285820850","104.102.83.39","192.168.1.118","TCP","1514","[TCP segment of a reassembled PDU]"
"97","0.286871338","104.102.83.39","192.168.1.118","TLSv1.2","1026","Application Data"
"98","0.299687488","104.102.83.39","192.168.1.118","TCP","1514","443 → 44892 [ACK] Seq=46765 Ack=887 Win=243 Len=1448 TSval=266385200 TSecr=3636224055 [TCP segment of a reassembled PDU]"
"99","0.300972838","104.102.83.39","192.168.1.118","TCP","4410","443 → 44892 [ACK] Seq=48213 Ack=887 Win=243 Len=4344 TSval=266385200 TSecr=3636224055 [TCP segment of a reassembled PDU]"
"100","0.301043463","192.168.1.118","104.102.83.39","TCP","66","44892 → 443 [ACK] Seq=887 Ack=52557 Win=484 Len=0 TSval=3636224100 TSecr=266385200"
"101","0.305471638","104.102.83.39","192.168.1.118","TCP","5858","[TCP segment of a reassembled PDU]"
"102","0.305546663","192.168.1.118","104.102.83.39","TCP","66","44888 → 443 [ACK] Seq=1406 Ack=12288 Win=456 Len=0 TSval=3636224105 TSecr=266385201"
"103","0.305631275","104.102.83.39","192.168.1.118","TLSv1.2","813","Application Data"
"104","0.305668913","104.102.83.39","192.168.1.118","TCP","5858","443 → 44888 [ACK] Seq=12288 Ack=1406 Win=260 Len=5792 TSval=266385201 TSecr=3636224068 [TCP segment of a reassembled PDU]"
"105","0.305689038","192.168.1.118","104.102.83.39","TCP","66","44888 → 443 [ACK] Seq=1406 Ack=18080 Win=411 Len=0 TSval=3636224105 TSecr=266385201"
"106","0.305716238","104.102.83.39","192.168.1.118","TCP","2962","443 → 44888 [ACK] Seq=18080 Ack=1406 Win=260 Len=2896 TSval=266385202 TSecr=3636224068 [TCP segment of a reassembled PDU]"
"107","0.305731150","192.168.1.118","104.102.83.39","TCP","66","44888 → 443 [ACK] Seq=1406 Ack=20976 Win=389 Len=0 TSval=3636224105 TSecr=266385202"
"108","0.309427763","104.102.83.39","192.168.1.118","TLSv1.2","5858","Application Data [TCP segment of a reassembled PDU]"
"109","0.309494500","192.168.1.118","104.102.83.39","TCP","66","44888 → 443 [ACK] Seq=1406 Ack=26768 Win=344 Len=0 TSval=3636224109 TSecr=266385202"
"110","0.309600250","104.102.83.39","192.168.1.118","TLSv1.2","2962","Application Data [TCP segment of a reassembled PDU]"
"111","0.309626175","104.102.83.39","192.168.1.118","TLSv1.2","7306","Application Data [TCP segment of a reassembled PDU]"
"112","0.309637100","104.102.83.39","192.168.1.118","TCP","2962","443 → 44892 [ACK] Seq=55453 Ack=887 Win=243 Len=2896 TSval=266385201 TSecr=3636224055 [TCP segment of a reassembled PDU]"
"113","0.311313250","104.102.83.39","192.168.1.118","TCP","2962","443 → 44892 [ACK] Seq=58349 Ack=887 Win=243 Len=2896 TSval=266385204 TSecr=3636224055 [TCP segment of a reassembled PDU]"
"114","0.311369288","104.102.83.39","192.168.1.118","TCP","2962","443 → 44892 [ACK] Seq=61245 Ack=887 Win=243 Len=2896 TSval=266385206 TSecr=3636224055 [TCP segment of a reassembled PDU]"
"115","0.316648175","104.102.83.39","192.168.1.118","TLSv1.2","2962","Application Data [TCP segment of a reassembled PDU]"
"116","0.317778688","104.102.83.39","192.168.1.118","TCP","2962","443 → 44892 [ACK] Seq=67037 Ack=887 Win=243 Len=2896 TSval=266385210 TSecr=3636224055 [TCP segment of a reassembled PDU]"
"117","0.317816575","104.102.83.39","192.168.1.118","TCP","2962","443 → 44892 [ACK] Seq=69933 Ack=887 Win=243 Len=2896 TSval=266385212 TSecr=3636224055 [TCP segment of a reassembled PDU]"
"118","0.319826688","104.102.83.39","192.168.1.118","TCP","2962","443 → 44892 [ACK] Seq=72829 Ack=887 Win=243 Len=2896 TSval=266385214 TSecr=3636224055 [TCP segment of a reassembled PDU]"
"119","0.321382275","104.102.83.39","192.168.1.118","TCP","2962","443 → 44892 [PSH, ACK] Seq=75725 Ack=887 Win=243 Len=2896 TSval=266385217 TSecr=3636224055 [TCP segment of a reassembled PDU]"
"120","0.322783588","104.102.83.39","192.168.1.118","TCP","1514","443 → 44892 [ACK] Seq=78621 Ack=887 Win=243 Len=1448 TSval=266385219 TSecr=3636224055 [TCP segment of a reassembled PDU]"
"121","0.324703375","104.102.83.39","192.168.1.118","TCP","1514","443 → 44892 [ACK] Seq=80069 Ack=887 Win=243 Len=1448 TSval=266385219 TSecr=3636224055 [TCP segment of a reassembled PDU]"
"122","0.325940775","192.168.1.118","104.102.83.39","TCP","66","44890 → 443 [ACK] Seq=1137 Ack=14165 Win=483 Len=0 TSval=3636224125 TSecr=266385187"
"123","0.330838888","104.102.83.39","192.168.1.118","TLSv1.2","990","Application Data"
"124","0.333551825","104.102.83.39","192.168.1.118","TLSv1.2","5858","Application Data [TCP segment of a reassembled PDU]"
"125","0.334390288","104.102.83.39","192.168.1.118","TCP","2962","443 → 44892 [ACK] Seq=87309 Ack=887 Win=243 Len=2896 TSval=266385230 TSecr=3636224100 [TCP segment of a reassembled PDU]"
"126","0.335401300","104.102.83.39","192.168.1.118","TCP","1514","443 → 44892 [ACK] Seq=90205 Ack=887 Win=243 Len=1448 TSval=266385232 TSecr=3636224100 [TCP segment of a reassembled PDU]"
"127","0.336165275","104.102.83.39","192.168.1.118","TCP","1514","443 → 44892 [ACK] Seq=91653 Ack=887 Win=243 Len=1448 TSval=266385232 TSecr=3636224100 [TCP segment of a reassembled PDU]"
"128","0.337415813","104.102.83.39","192.168.1.118","TCP","2962","443 → 44892 [ACK] Seq=93101 Ack=887 Win=243 Len=2896 TSval=266385234 TSecr=3636224100 [TCP segment of a reassembled PDU]"
"129","0.339368275","104.102.83.39","192.168.1.118","TCP","2962","[TCP segment of a reassembled PDU]"
"130","0.343277425","104.102.83.39","192.168.1.118","TLSv1.2","1732","Application Data"
"131","0.343333963","104.102.83.39","192.168.1.118","TCP","2962","443 → 44892 [ACK] Seq=95997 Ack=887 Win=243 Len=2896 TSval=266385236 TSecr=3636224100 [TCP segment of a reassembled PDU]"
"132","0.343369150","192.168.1.118","104.102.83.39","TCP","66","44892 → 443 [ACK] Seq=887 Ack=98893 Win=122 Len=0 TSval=3636224143 TSecr=266385200"
"133","0.343401538","104.102.83.39","192.168.1.118","TLSv1.2","1514","Application Data [TCP segment of a reassembled PDU]"
"134","0.343447600","104.102.83.39","192.168.1.118","TCP","1514","443 → 44892 [ACK] Seq=100341 Ack=887 Win=243 Len=1448 TSval=266385238 TSecr=3636224100 [TCP segment of a reassembled PDU]"
"135","0.344588900","104.102.83.39","192.168.1.118","TCP","2962","443 → 44892 [ACK] Seq=101789 Ack=887 Win=243 Len=2896 TSval=266385240 TSecr=3636224100 [TCP segment of a reassembled PDU]"
"136","0.345927688","192.168.1.118","104.102.83.39","TCP","66","44896 → 443 [ACK] Seq=1157 Ack=10155 Win=496 Len=0 TSval=3636224145 TSecr=266385201"
"137","0.349942025","192.168.1.118","104.102.83.39","TCP","66","44888 → 443 [ACK] Seq=1406 Ack=34932 Win=281 Len=0 TSval=3636224149 TSecr=266385202"
"138","0.350078463","104.102.83.39","192.168.1.118","TCP","1514","443 → 44892 [ACK] Seq=104685 Ack=887 Win=243 Len=1448 TSval=266385242 TSecr=3636224100 [TCP segment of a reassembled PDU]"
"139","0.351588100","104.102.83.39","192.168.1.118","TLSv1.2","1514","Application Data [TCP segment of a reassembled PDU]"
"140","0.351653400","104.102.83.39","192.168.1.118","TCP","2962","443 → 44892 [ACK] Seq=107581 Ack=887 Win=243 Len=2896 TSval=266385244 TSecr=3636224100 [TCP segment of a reassembled PDU]"
"141","0.368009150","104.102.83.39","192.168.1.118","TCP","1514","443 → 44892 [ACK] Seq=110477 Ack=887 Win=243 Len=1448 TSval=266385268 TSecr=3636224143 [TCP segment of a reassembled PDU]"
"142","0.370089675","104.102.83.39","192.168.1.118","TCP","1514","443 → 44892 [ACK] Seq=111925 Ack=887 Win=243 Len=1448 TSval=266385268 TSecr=3636224143 [TCP segment of a reassembled PDU]"
"143","0.375914925","192.168.1.118","104.102.83.39","TCP","66","44892 → 443 [ACK] Seq=887 Ack=113373 Win=524 Len=0 TSval=3636224175 TSecr=266385238"
"144","0.377439825","192.168.1.118","104.102.83.39","TCP","66","44894 → 443 [ACK] Seq=1101 Ack=11457 Win=466 Len=0 TSval=3636224177 TSecr=266385238"
"145","0.382431588","192.168.1.118","209.18.47.62","DNS","80","Standard query 0xe128 A fonts.googleapis.com"
"146","0.396083188","104.102.83.39","192.168.1.118","TCP","1514","443 → 44892 [ACK] Seq=113373 Ack=887 Win=243 Len=1448 TSval=266385297 TSecr=3636224175 [TCP segment of a reassembled PDU]"
"147","0.397535775","104.102.83.39","192.168.1.118","TCP","5858","443 → 44892 [ACK] Seq=114821 Ack=887 Win=243 Len=5792 TSval=266385297 TSecr=3636224175 [TCP segment of a reassembled PDU]"
"148","0.397602575","192.168.1.118","104.102.83.39","TCP","66","44892 → 443 [ACK] Seq=887 Ack=120613 Win=637 Len=0 TSval=3636224197 TSecr=266385297"
"149","0.399250263","104.102.83.39","192.168.1.118","TLSv1.2","4410","Application Data [TCP segment of a reassembled PDU]"
"150","0.399313025","192.168.1.118","104.102.83.39","TCP","66","44892 → 443 [ACK] Seq=887 Ack=124957 Win=705 Len=0 TSval=3636224199 TSecr=266385297"
"151","0.399344188","104.102.83.39","192.168.1.118","TCP","1514","443 → 44892 [ACK] Seq=124957 Ack=887 Win=243 Len=1448 TSval=266385298 TSecr=3636224175 [TCP segment of a reassembled PDU]"
"152","0.403796263","104.102.83.39","192.168.1.118","TCP","1514","443 → 44892 [ACK] Seq=126405 Ack=887 Win=243 Len=1448 TSval=266385298 TSecr=3636224175 [TCP segment of a reassembled PDU]"
"153","0.403861638","192.168.1.118","104.102.83.39","TCP","66","44892 → 443 [ACK] Seq=887 Ack=127853 Win=750 Len=0 TSval=3636224203 TSecr=266385298"
"154","0.403943613","104.102.83.39","192.168.1.118","TCP","2962","443 → 44892 [ACK] Seq=127853 Ack=887 Win=243 Len=2896 TSval=266385299 TSecr=3636224175 [TCP segment of a reassembled PDU]"
"155","0.403963913","192.168.1.118","104.102.83.39","TCP","66","44892 → 443 [ACK] Seq=887 Ack=130749 Win=795 Len=0 TSval=3636224203 TSecr=266385299"
"156","0.403976325","104.102.83.39","192.168.1.118","TLSv1.2","1514","Application Data [TCP segment of a reassembled PDU]"
"157","0.408240450","209.18.47.62","192.168.1.118","DNS","96","Standard query response 0xe128 A fonts.googleapis.com A 172.217.6.202"
"158","0.408305400","104.102.83.39","192.168.1.118","TCP","4410","443 → 44892 [ACK] Seq=132197 Ack=887 Win=243 Len=4344 TSval=266385300 TSecr=3636224175 [TCP segment of a reassembled PDU]"
"159","0.408351325","192.168.1.118","104.102.83.39","TCP","66","44892 → 443 [ACK] Seq=887 Ack=136541 Win=886 Len=0 TSval=3636224208 TSecr=266385300"
"160","0.408382550","104.102.83.39","192.168.1.118","TCP","1514","443 → 44892 [ACK] Seq=136541 Ack=887 Win=243 Len=1448 TSval=266385301 TSecr=3636224175 [TCP segment of a reassembled PDU]"
"161","0.408433775","104.102.83.39","192.168.1.118","TCP","1514","443 → 44892 [ACK] Seq=137989 Ack=887 Win=243 Len=1448 TSval=266385301 TSecr=3636224175 [TCP segment of a reassembled PDU]"
"162","0.408449688","192.168.1.118","104.102.83.39","TCP","66","44892 → 443 [ACK] Seq=887 Ack=139437 Win=931 Len=0 TSval=3636224208 TSecr=266385301"
"163","0.408467563","104.102.83.39","192.168.1.118","TCP","2962","443 → 44892 [PSH, ACK] Seq=139437 Ack=887 Win=243 Len=2896 TSval=266385302 TSecr=3636224175 [TCP segment of a reassembled PDU]"
"164","0.408483100","192.168.1.118","104.102.83.39","TCP","66","44892 → 443 [ACK] Seq=887 Ack=142333 Win=976 Len=0 TSval=3636224208 TSecr=266385302"
"165","0.408508363","104.102.83.39","192.168.1.118","TCP","2962","443 → 44892 [ACK] Seq=142333 Ack=887 Win=243 Len=2896 TSval=266385303 TSecr=3636224175 [TCP segment of a reassembled PDU]"
"166","0.408524325","192.168.1.118","104.102.83.39","TCP","66","44892 → 443 [ACK] Seq=887 Ack=145229 Win=1022 Len=0 TSval=3636224208 TSecr=266385303"
"167","0.408544288","104.102.83.39","192.168.1.118","TCP","2962","443 → 44892 [ACK] Seq=145229 Ack=887 Win=243 Len=2896 TSval=266385304 TSecr=3636224175 [TCP segment of a reassembled PDU]"
"168","0.408560163","192.168.1.118","104.102.83.39","TCP","66","44892 → 443 [ACK] Seq=887 Ack=148125 Win=1067 Len=0 TSval=3636224208 TSecr=266385304"
"169","0.408639813","192.168.1.118","209.18.47.62","DNS","80","Standard query 0x35f1 AAAA fonts.googleapis.com"
"170","0.409191038","104.102.83.39","192.168.1.118","TLSv1.2","2090","Application Data, Application Data"
"171","0.409228763","192.168.1.118","104.102.83.39","TCP","66","44892 → 443 [ACK] Seq=887 Ack=150149 Win=1098 Len=0 TSval=3636224209 TSecr=266385305"
"172","0.426568725","209.18.47.62","192.168.1.118","DNS","108","Standard query response 0x35f1 AAAA fonts.googleapis.com AAAA 2607:f8b0:4006:804::200a"
"173","0.438721838","136.147.56.1","192.168.1.118","TLSv1.2","1285","Application Data"
"174","0.438784075","192.168.1.118","136.147.56.1","TCP","66","32794 → 443 [ACK] Seq=242 Ack=1220 Win=62137 Len=0 TSval=2171519586 TSecr=709683181"
"175","0.463281338","192.168.1.118","172.217.6.202","TCP","74","41580 → 443 [SYN] Seq=0 Win=64240 Len=0 MSS=1460 SACK_PERM=1 TSval=1868668019 TSecr=0 WS=128"
"176","0.489981525","172.217.6.202","192.168.1.118","TCP","74","443 → 41580 [SYN, ACK] Seq=0 Ack=1 Win=60192 Len=0 MSS=1380 SACK_PERM=1 TSval=113549332 TSecr=1868668019 WS=256"
"177","0.490076038","192.168.1.118","172.217.6.202","TCP","66","41580 → 443 [ACK] Seq=1 Ack=1 Win=64256 Len=0 TSval=1868668045 TSecr=113549332"
"178","0.525448800","192.168.1.104","255.255.255.255","UDP","217","49154 → 6666 Len=175"
"179","0.530327088","192.168.1.101","224.0.0.251","MDNS","533","Standard query 0x0000 PTR _googlecast._tcp.local, "QM" question PTR _homekit._tcp.local, "QM" question PTR _uscan._tcp.local, "QM" question PTR _ptp._tcp.local, "QM" question PTR _ippusb._tcp.local, "QM" question PTR _scanner._tcp.local, "QM" question PTR _ipp._tcp.local, "QM" question PTR _pdl-datastream._tcp.local, "QM" question PTR _uscans._tcp.local, "QM" question PTR _ipps._tcp.local, "QM" question PTR _printer._tcp.local, "QM" question PTR _airplay._tcp.local, "QM" question PTR _raop._tcp.local, "QM" question PTR _airport._tcp.local, "QM" question PTR _rdlink._tcp.local, "QM" question PTR _companion-link._tcp.local, "QM" question PTR _afpovertcp._tcp.local, "QM" question PTR _rfb._tcp.local, "QM" question PTR _adisk._tcp.local, "QM" question PTR _apple-mobdev._tcp.local, "QM" question PTR 8ed307c3._sub._apple-mobdev2._tcp.local, "QM" question PTR _apple-pairable._tcp.local, "QM" question PTR Google-Home-Mini-2c3f16b2da5c4b6fd6cfbfba61c12490._googlecast._tcp.local PTR cjqg._companion-link._tcp.local OPT"
"180","0.535626163","fe80::1814:2ecf:2c8a:d90d","ff02::fb","MDNS","553","Standard query 0x0000 PTR _googlecast._tcp.local, "QM" question PTR _homekit._tcp.local, "QM" question PTR _uscan._tcp.local, "QM" question PTR _ptp._tcp.local, "QM" question PTR _ippusb._tcp.local, "QM" question PTR _scanner._tcp.local, "QM" question PTR _ipp._tcp.local, "QM" question PTR _pdl-datastream._tcp.local, "QM" question PTR _uscans._tcp.local, "QM" question PTR _ipps._tcp.local, "QM" question PTR _printer._tcp.local, "QM" question PTR _airplay._tcp.local, "QM" question PTR _raop._tcp.local, "QM" question PTR _airport._tcp.local, "QM" question PTR _rdlink._tcp.local, "QM" question PTR _companion-link._tcp.local, "QM" question PTR _afpovertcp._tcp.local, "QM" question PTR _rfb._tcp.local, "QM" question PTR _adisk._tcp.local, "QM" question PTR _apple-mobdev._tcp.local, "QM" question PTR 8ed307c3._sub._apple-mobdev2._tcp.local, "QM" question PTR _apple-pairable._tcp.local, "QM" question PTR Google-Home-Mini-2c3f16b2da5c4b6fd6cfbfba61c12490._googlecast._tcp.local PTR cjqg._companion-link._tcp.local OPT"
"181","0.540935075","fe80::1cc7:6d9a:a312:7e8f","ff02::fb","MDNS","547","Standard query 0x0000 PTR _googlecast._tcp.local, "QM" question PTR _homekit._tcp.local, "QM" question PTR _uscan._tcp.local, "QM" question PTR _ptp._tcp.local, "QM" question PTR _ippusb._tcp.local, "QM" question PTR _scanner._tcp.local, "QM" question PTR _ipp._tcp.local, "QM" question PTR _pdl-datastream._tcp.local, "QM" question PTR _uscans._tcp.local, "QM" question PTR _ipps._tcp.local, "QM" question PTR _printer._tcp.local, "QM" question PTR _airplay._tcp.local, "QM" question PTR _raop._tcp.local, "QM" question PTR _airport._tcp.local, "QM" question PTR _rdlink._tcp.local, "QM" question PTR _companion-link._tcp.local, "QM" question PTR _afpovertcp._tcp.local, "QM" question PTR _rfb._tcp.local, "QM" question PTR _adisk._tcp.local, "QM" question PTR _apple-mobdev._tcp.local, "QM" question PTR 8ed307c3._sub._apple-mobdev2._tcp.local, "QM" question PTR _apple-pairable._tcp.local, "QM" question PTR Google-Home-Mini-2c3f16b2da5c4b6fd6cfbfba61c12490._googlecast._tcp.local PTR cjqg._companion-link._tcp.local OPT"
"182","0.546315300","192.168.1.100","224.0.0.251","MDNS","527","Standard query 0x0000 PTR _googlecast._tcp.local, "QM" question PTR _homekit._tcp.local, "QM" question PTR _uscan._tcp.local, "QM" question PTR _ptp._tcp.local, "QM" question PTR _ippusb._tcp.local, "QM" question PTR _scanner._tcp.local, "QM" question PTR _ipp._tcp.local, "QM" question PTR _pdl-datastream._tcp.local, "QM" question PTR _uscans._tcp.local, "QM" question PTR _ipps._tcp.local, "QM" question PTR _printer._tcp.local, "QM" question PTR _airplay._tcp.local, "QM" question PTR _raop._tcp.local, "QM" question PTR _airport._tcp.local, "QM" question PTR _rdlink._tcp.local, "QM" question PTR _companion-link._tcp.local, "QM" question PTR _afpovertcp._tcp.local, "QM" question PTR _rfb._tcp.local, "QM" question PTR _adisk._tcp.local, "QM" question PTR _apple-mobdev._tcp.local, "QM" question PTR 8ed307c3._sub._apple-mobdev2._tcp.local, "QM" question PTR _apple-pairable._tcp.local, "QM" question PTR Google-Home-Mini-2c3f16b2da5c4b6fd6cfbfba61c12490._googlecast._tcp.local PTR cjqg._companion-link._tcp.local OPT"
"183","0.874086025","192.168.1.118","172.217.6.202","TLSv1","583","Client Hello"
"184","0.896508663","172.217.6.202","192.168.1.118","TCP","66","443 → 41580 [ACK] Seq=1 Ack=518 Win=61440 Len=0 TSval=113549739 TSecr=1868668429"
"185","0.902228925","172.217.6.202","192.168.1.118","TLSv1.2","1484","Server Hello"
"186","0.902297700","192.168.1.118","172.217.6.202","TCP","66","41580 → 443 [ACK] Seq=518 Ack=1419 Win=63104 Len=0 TSval=1868668458 TSecr=113549746"
"187","0.904646438","172.217.6.202","192.168.1.118","TLSv1.2","1539","Certificate, Server Key Exchange, Server Hello Done"
"188","0.904706950","192.168.1.118","172.217.6.202","TCP","66","41580 → 443 [ACK] Seq=518 Ack=2892 Win=61696 Len=0 TSval=1868668460 TSecr=113549746"
"189","0.942982000","192.168.1.118","172.217.6.202","TLSv1.2","192","Client Key Exchange, Change Cipher Spec, Encrypted Handshake Message"
"190","0.961272550","172.217.6.202","192.168.1.118","TLSv1.2","117","Change Cipher Spec, Encrypted Handshake Message"
"191","1.001946338","192.168.1.118","172.217.6.202","TCP","66","41580 → 443 [ACK] Seq=644 Ack=2943 Win=64128 Len=0 TSval=1868668557 TSecr=113549806"
"192","1.055337213","192.168.1.118","172.217.6.202","TLSv1.2","338","Application Data"
"193","1.083597438","172.217.6.202","192.168.1.118","TCP","66","443 → 41580 [ACK] Seq=2943 Ack=916 Win=62464 Len=0 TSval=113549927 TSecr=1868668611"
"194","1.096315488","172.217.6.202","192.168.1.118","TLSv1.2","1096","Application Data"
"195","1.096384525","192.168.1.118","172.217.6.202","TCP","66","41580 → 443 [ACK] Seq=916 Ack=3973 Win=63104 Len=0 TSval=1868668652 TSecr=113549939"
"196","1.097731925","172.217.6.202","192.168.1.118","TLSv1.2","181","Application Data"
"197","1.097789225","192.168.1.118","172.217.6.202","TCP","66","41580 → 443 [ACK] Seq=916 Ack=4088 Win=63104 Len=0 TSval=1868668653 TSecr=113549939"
"198","1.097824488","172.217.6.202","192.168.1.118","TLSv1.2","100","Application Data"
"199","1.097838700","192.168.1.118","172.217.6.202","TCP","66","41580 → 443 [ACK] Seq=916 Ack=4122 Win=63104 Len=0 TSval=1868668653 TSecr=113549939"
"200","1.142404938","192.168.1.118","209.18.47.62","DNS","82","Standard query 0x3985 A secure2.sfdcstatic.com"
"201","1.168986050","209.18.47.62","192.168.1.118","DNS","179","Standard query response 0x3985 A secure2.sfdcstatic.com CNAME secure2.sfdcstatic.com.edgekey.net CNAME e4745.b.akamaiedge.net A 104.102.83.39"
"202","1.169431225","192.168.1.118","209.18.47.62","DNS","82","Standard query 0x2da8 AAAA secure2.sfdcstatic.com"
"203","1.196473475","209.18.47.62","192.168.1.118","DNS","221","Standard query response 0x2da8 AAAA secure2.sfdcstatic.com CNAME secure2.sfdcstatic.com.edgekey.net CNAME e4745.b.akamaiedge.net SOA n0b.akamaiedge.net"
"204","1.201139450","192.168.1.118","104.102.83.39","TCP","74","44900 → 443 [SYN] Seq=0 Win=64240 Len=0 MSS=1460 SACK_PERM=1 TSval=3636225000 TSecr=0 WS=128"
"205","1.219731900","104.102.83.39","192.168.1.118","TCP","74","443 → 44900 [SYN, ACK] Seq=0 Ack=1 Win=28960 Len=0 MSS=1460 SACK_PERM=1 TSval=266386121 TSecr=3636225000 WS=128"
"206","1.219835488","192.168.1.118","104.102.83.39","TCP","66","44900 → 443 [ACK] Seq=1 Ack=1 Win=64256 Len=0 TSval=3636225019 TSecr=266386121"
"207","1.266256650","192.168.1.118","104.102.83.39","TLSv1","583","Client Hello"
"208","1.276485538","192.168.1.118","136.147.56.1","TLSv1.2","385","Application Data"
"209","1.283705563","104.102.83.39","192.168.1.118","TCP","66","443 → 44900 [ACK] Seq=1 Ack=518 Win=30080 Len=0 TSval=266386185 TSecr=3636225066"
"210","1.289588175","104.102.83.39","192.168.1.118","TLSv1.2","1514","Server Hello"
"211","1.289657475","192.168.1.118","104.102.83.39","TCP","66","44900 → 443 [ACK] Seq=518 Ack=1449 Win=63104 Len=0 TSval=3636225089 TSecr=266386187"
"212","1.291552138","104.102.83.39","192.168.1.118","TLSv1.2","1891","Certificate, Server Key Exchange, Server Hello Done"
"213","1.291621863","192.168.1.118","104.102.83.39","TCP","66","44900 → 443 [ACK] Seq=518 Ack=3274 Win=61312 Len=0 TSval=3636225091 TSecr=266386187"
"214","1.294517700","192.168.1.118","104.102.83.39","TLSv1.2","192","Client Key Exchange, Change Cipher Spec, Encrypted Handshake Message"
"215","1.295722750","192.168.1.118","104.102.83.39","TLSv1.2","313","Application Data"
"216","1.307408288","192.168.1.118","104.102.83.39","TLSv1.2","315","Application Data"
"217","1.318362375","192.168.1.118","104.102.83.39","TLSv1.2","317","Application Data"
"218","1.323852938","104.102.83.39","192.168.1.118","TCP","66","443 → 44900 [ACK] Seq=3274 Ack=644 Win=30080 Len=0 TSval=266386223 TSecr=3636225093"
"219","1.324713288","104.102.83.39","192.168.1.118","TLSv1.2","117","Change Cipher Spec, Encrypted Handshake Message"
"220","1.324757650","104.102.83.39","192.168.1.118","TLSv1.2","1043","Application Data"
"221","1.324800925","192.168.1.118","104.102.83.39","TCP","66","44888 → 443 [ACK] Seq=1653 Ack=35909 Win=524 Len=0 TSval=3636225124 TSecr=266386225"
"222","1.325265450","192.168.1.118","104.102.83.39","TLSv1.2","305","Application Data"
"223","1.329335513","192.168.1.118","104.102.83.39","TLSv1.2","316","Application Data"
"224","1.341367600","104.102.83.39","192.168.1.118","TLSv1.2","1093","Application Data"
"225","1.341445888","192.168.1.118","104.102.83.39","TCP","66","44890 → 443 [ACK] Seq=1386 Ack=15192 Win=493 Len=0 TSval=3636225141 TSecr=266386237"
"226","1.342754650","136.147.56.1","192.168.1.118","TCP","66","443 → 32792 [ACK] Seq=1 Ack=320 Win=5245 Len=0 TSval=709684081 TSecr=2171520424"
"227","1.345894025","104.102.83.39","192.168.1.118","TLSv1.2","414","Application Data"
"228","1.346647813","192.168.1.118","104.102.83.39","TLSv1.2","316","Application Data"
"229","1.348868088","104.102.83.39","192.168.1.118","TLSv1.2","1123","Application Data"
"230","1.350643563","104.102.83.39","192.168.1.118","TLSv1.2","1062","Application Data"
"231","1.359579225","104.102.83.39","192.168.1.118","TLSv1.2","904","Application Data"
"232","1.376371350","192.168.1.118","209.18.47.62","DNS","76","Standard query 0x0192 A a.sfdcstatic.com"
"233","1.386964513","192.168.1.118","104.102.83.39","TCP","66","44900 → 443 [ACK] Seq=883 Ack=3673 Win=64128 Len=0 TSval=3636225186 TSecr=266386248"
"234","1.389951463","192.168.1.118","104.102.83.39","TCP","66","44892 → 443 [ACK] Seq=1138 Ack=151206 Win=1121 Len=0 TSval=3636225189 TSecr=266386248"
"235","1.390964875","192.168.1.118","104.102.83.39","TCP","66","44888 → 443 [ACK] Seq=1903 Ack=36905 Win=546 Len=0 TSval=3636225190 TSecr=266386252"
"236","1.392080413","209.18.47.62","192.168.1.118","DNS","167","Standard query response 0x0192 A a.sfdcstatic.com CNAME a.sfdcstatic.com.edgekey.net CNAME e4745.b.akamaiedge.net A 104.102.83.39"
"237","1.392235163","192.168.1.118","209.18.47.62","DNS","76","Standard query 0x25c3 AAAA a.sfdcstatic.com"
"238","1.395802488","192.168.1.118","104.102.83.39","TLSv1.2","318","Application Data"
"239","1.399947763","192.168.1.118","104.102.83.39","TCP","66","44890 → 443 [ACK] Seq=1636 Ack=16030 Win=501 Len=0 TSval=3636225199 TSecr=266386261"
"240","1.446781025","136.147.56.1","192.168.1.118","TCP","1414","[TCP segment of a reassembled PDU]"
"241","1.446845088","192.168.1.118","136.147.56.1","TCP","66","32792 → 443 [ACK] Seq=320 Ack=1349 Win=65535 Len=0 TSval=2171520594 TSecr=709684188"
"242","1.448091338","136.147.56.1","192.168.1.118","TLSv1.2","123","Application Data"
"243","1.448151750","192.168.1.118","136.147.56.1","TCP","66","32792 → 443 [ACK] Seq=320 Ack=1406 Win=65535 Len=0 TSval=2171520595 TSecr=709684188"
"244","1.448191438","209.18.47.62","192.168.1.118","DNS","209","Standard query response 0x25c3 AAAA a.sfdcstatic.com CNAME a.sfdcstatic.com.edgekey.net CNAME e4745.b.akamaiedge.net SOA n0b.akamaiedge.net"
"245","1.449256163","192.168.1.118","104.102.83.39","TCP","74","44902 → 443 [SYN] Seq=0 Win=64240 Len=0 MSS=1460 SACK_PERM=1 TSval=3636225249 TSecr=0 WS=128"
"246","1.472821488","104.102.83.39","192.168.1.118","TCP","74","443 → 44902 [SYN, ACK] Seq=0 Ack=1 Win=28960 Len=0 MSS=1460 SACK_PERM=1 TSval=266386372 TSecr=3636225249 WS=128"
"247","1.472944038","192.168.1.118","104.102.83.39","TCP","66","44902 → 443 [ACK] Seq=1 Ack=1 Win=64256 Len=0 TSval=3636225272 TSecr=266386372"
"248","1.483412475","104.102.83.39","192.168.1.118","TLSv1.2","1051","Application Data"
"249","1.483490250","192.168.1.118","104.102.83.39","TCP","66","44888 → 443 [ACK] Seq=2155 Ack=37890 Win=569 Len=0 TSval=3636225283 TSecr=266386383"
"250","1.511824350","192.168.1.118","104.102.83.39","TLSv1","583","Client Hello"
"251","1.528953275","104.102.83.39","192.168.1.118","TCP","66","443 → 44902 [ACK] Seq=1 Ack=518 Win=30080 Len=0 TSval=266386430 TSecr=3636225311"
"252","1.531332300","104.102.83.39","192.168.1.118","TLSv1.2","1514","Server Hello"
"253","1.531399188","192.168.1.118","104.102.83.39","TCP","66","44902 → 443 [ACK] Seq=518 Ack=1449 Win=63104 Len=0 TSval=3636225331 TSecr=266386432"
"254","1.532977725","104.102.83.39","192.168.1.118","TLSv1.2","1891","Certificate, Server Key Exchange, Server Hello Done"
"255","1.533040188","192.168.1.118","104.102.83.39","TCP","66","44902 → 443 [ACK] Seq=518 Ack=3274 Win=61312 Len=0 TSval=3636225332 TSecr=266386432"
"256","1.536866500","192.168.1.118","104.102.83.39","TLSv1.2","192","Client Key Exchange, Change Cipher Spec, Encrypted Handshake Message"
"257","1.537120663","192.168.1.118","104.102.83.39","TLSv1.2","316","Application Data"
"258","1.537226388","192.168.1.118","104.102.83.39","TLSv1.2","315","Application Data"
"259","1.545098388","192.168.1.118","104.102.83.39","TLSv1.2","316","Application Data"
"260","1.545261713","192.168.1.118","104.102.83.39","TLSv1.2","315","Application Data"
"261","1.561765525","104.102.83.39","192.168.1.118","TLSv1.2","117","Change Cipher Spec, Encrypted Handshake Message"
"262","1.563647125","104.102.83.39","192.168.1.118","TLSv1.2","1100","Application Data"
"263","1.563719900","192.168.1.118","104.102.83.39","TCP","66","44890 → 443 [ACK] Seq=1885 Ack=17064 Win=493 Len=0 TSval=3636225363 TSecr=266386464"
"264","1.563978825","192.168.1.118","104.102.83.39","TLSv1.2","327","Application Data"
"265","1.567479238","104.102.83.39","192.168.1.118","TLSv1.2","1056","Application Data"
"266","1.567554938","192.168.1.118","104.102.83.39","TCP","66","44892 → 443 [ACK] Seq=1388 Ack=152196 Win=1144 Len=0 TSval=3636225367 TSecr=266386465"
"267","1.567593588","104.102.83.39","192.168.1.118","TLSv1.2","1017","Application Data"
"268","1.567615338","192.168.1.118","104.102.83.39","TCP","66","44888 → 443 [ACK] Seq=2405 Ack=38841 Win=592 Len=0 TSval=3636225367 TSecr=266386465"
"269","1.567630663","104.102.83.39","192.168.1.118","TLSv1.2","1061","Application Data"
"270","1.607952688","192.168.1.118","104.102.83.39","TCP","66","44894 → 443 [ACK] Seq=1350 Ack=12452 Win=501 Len=0 TSval=3636225407 TSecr=266386464"
"271","1.608631900","104.102.83.39","192.168.1.118","TCP","1514","[TCP segment of a reassembled PDU]"
"272","1.610649225","104.102.83.39","192.168.1.118","TLSv1.2","4802","Application Data"
"273","1.616036438","192.168.1.118","209.18.47.62","TCP","74","59368 → 853 [SYN] Seq=0 Win=64240 Len=0 MSS=1460 SACK_PERM=1 TSval=943175277 TSecr=0 WS=128"
"274","1.648943163","192.168.1.118","104.102.83.39","TCP","66","44902 → 443 [ACK] Seq=905 Ack=9509 Win=57984 Len=0 TSval=3636225448 TSecr=266386507"
"275","2.128051450","192.168.1.118","209.18.47.61","TCP","74","[TCP Retransmission] 38924 → 853 [SYN] Seq=0 Win=64240 Len=0 MSS=1460 SACK_PERM=1 TSval=3660622754 TSecr=0 WS=128"
"276","3.293667050","192.168.1.118","192.168.1.102","TCP","176","46918 → 8009 [PSH, ACK] Seq=1 Ack=1 Win=501 Len=110 TSval=2819342268 TSecr=5972700 [TCP segment of a reassembled PDU]"
"277","3.358547500","192.168.1.102","192.168.1.118","TCP","176","8009 → 46918 [PSH, ACK] Seq=1 Ack=111 Win=277 Len=110 TSval=5973201 TSecr=2819342268 [TCP segment of a reassembled PDU]"
"278","3.358627063","192.168.1.118","192.168.1.102","TCP","66","46918 → 8009 [ACK] Seq=111 Ack=111 Win=501 Len=0 TSval=2819342333 TSecr=5973201"
"279","3.494135263","192.168.1.104","255.255.255.255","UDP","217","49154 → 6666 Len=175"
"280","5.132710300","RealtekS_68:08:d3","Broadcast","ARP","60","Who has 192.168.1.119? Tell 192.168.1.101"
"281","5.648022950","192.168.1.118","209.18.47.62","TCP","74","[TCP Retransmission] 59368 → 853 [SYN] Seq=0 Win=64240 Len=0 MSS=1460 SACK_PERM=1 TSval=943179309 TSecr=0 WS=128"
"282","6.051736625","RealtekS_68:08:d3","Broadcast","ARP","60","Who has 192.168.1.119? Tell 192.168.1.101"
"283","6.160028188","192.168.1.118","209.18.47.61","TCP","74","[TCP Retransmission] 38924 → 853 [SYN] Seq=0 Win=64240 Len=0 MSS=1460 SACK_PERM=1 TSval=3660626786 TSecr=0 WS=128"
"284","6.463804213","192.168.1.104","255.255.255.255","UDP","217","49154 → 6666 Len=175"
"285","6.768847400","RealtekS_68:08:d3","Broadcast","ARP","60","Who has 192.168.1.119? Tell 192.168.1.101"
"286","7.284738338","192.168.1.101","224.0.0.251","MDNS","606","Standard query 0x0000 PTR _googlecast._tcp.local, "QU" question PTR _homekit._tcp.local, "QU" question PTR _uscan._tcp.local, "QU" question PTR _ptp._tcp.local, "QU" question PTR _ippusb._tcp.local, "QU" question PTR _scanner._tcp.local, "QU" question PTR _ipp._tcp.local, "QU" question PTR _pdl-datastream._tcp.local, "QU" question PTR _uscans._tcp.local, "QU" question PTR _ipps._tcp.local, "QU" question PTR _printer._tcp.local, "QU" question PTR _airplay._tcp.local, "QU" question PTR _raop._tcp.local, "QU" question PTR _airport._tcp.local, "QU" question PTR _rdlink._tcp.local, "QU" question PTR _companion-link._tcp.local, "QU" question PTR _afpovertcp._tcp.local, "QU" question PTR _rfb._tcp.local, "QU" question PTR _adisk._tcp.local, "QU" question PTR _apple-mobdev._tcp.local, "QU" question PTR 8ed307c3._sub._apple-mobdev2._tcp.local, "QU" question PTR _apple-pairable._tcp.local, "QU" question TXT Google-Home-Mini-2c3f16b2da5c4b6fd6cfbfba61c12490._googlecast._tcp.local, "QU" question ANY cjqg._smb._tcp.local, "QU" question ANY cjqg._companion-link._tcp.local, "QU" question PTR Google-Home-Mini-2c3f16b2da5c4b6fd6cfbfba61c12490._googlecast._tcp.local PTR cjqg._companion-link._tcp.local SRV 0 0 445 cjqg.local SRV 0 0 53785 cjqg.local OPT"
"287","7.291239075","fe80::1814:2ecf:2c8a:d90d","ff02::fb","MDNS","626","Standard query 0x0000 PTR _googlecast._tcp.local, "QU" question PTR _homekit._tcp.local, "QU" question PTR _uscan._tcp.local, "QU" question PTR _ptp._tcp.local, "QU" question PTR _ippusb._tcp.local, "QU" question PTR _scanner._tcp.local, "QU" question PTR _ipp._tcp.local, "QU" question PTR _pdl-datastream._tcp.local, "QU" question PTR _uscans._tcp.local, "QU" question PTR _ipps._tcp.local, "QU" question PTR _printer._tcp.local, "QU" question PTR _airplay._tcp.local, "QU" question PTR _raop._tcp.local, "QU" question PTR _airport._tcp.local, "QU" question PTR _rdlink._tcp.local, "QU" question PTR _companion-link._tcp.local, "QU" question PTR _afpovertcp._tcp.local, "QU" question PTR _rfb._tcp.local, "QU" question PTR _adisk._tcp.local, "QU" question PTR _apple-mobdev._tcp.local, "QU" question PTR 8ed307c3._sub._apple-mobdev2._tcp.local, "QU" question PTR _apple-pairable._tcp.local, "QU" question TXT Google-Home-Mini-2c3f16b2da5c4b6fd6cfbfba61c12490._googlecast._tcp.local, "QU" question ANY cjqg._smb._tcp.local, "QU" question ANY cjqg._companion-link._tcp.local, "QU" question PTR Google-Home-Mini-2c3f16b2da5c4b6fd6cfbfba61c12490._googlecast._tcp.local PTR cjqg._companion-link._tcp.local SRV 0 0 445 cjqg.local SRV 0 0 53785 cjqg.local OPT"
"288","7.294498175","192.168.1.101","224.0.0.251","MDNS","294","Standard query response 0x0000 PTR _smb._tcp.local TXT TXT OPT"
"289","7.386923388","192.168.1.100","224.0.0.251","MDNS","600","Standard query 0x0000 PTR _googlecast._tcp.local, "QU" question PTR _homekit._tcp.local, "QU" question PTR _uscan._tcp.local, "QU" question PTR _ptp._tcp.local, "QU" question PTR _ippusb._tcp.local, "QU" question PTR _scanner._tcp.local, "QU" question PTR _ipp._tcp.local, "QU" question PTR _pdl-datastream._tcp.local, "QU" question PTR _uscans._tcp.local, "QU" question PTR _ipps._tcp.local, "QU" question PTR _printer._tcp.local, "QU" question PTR _airplay._tcp.local, "QU" question PTR _raop._tcp.local, "QU" question PTR _airport._tcp.local, "QU" question PTR _rdlink._tcp.local, "QU" question PTR _companion-link._tcp.local, "QU" question PTR _afpovertcp._tcp.local, "QU" question PTR _rfb._tcp.local, "QU" question PTR _adisk._tcp.local, "QU" question PTR _apple-mobdev._tcp.local, "QU" question PTR 8ed307c3._sub._apple-mobdev2._tcp.local, "QU" question PTR _apple-pairable._tcp.local, "QU" question TXT Google-Home-Mini-2c3f16b2da5c4b6fd6cfbfba61c12490._googlecast._tcp.local, "QU" question ANY cjqg._smb._tcp.local, "QU" question ANY cjqg._companion-link._tcp.local, "QU" question PTR Google-Home-Mini-2c3f16b2da5c4b6fd6cfbfba61c12490._googlecast._tcp.local PTR cjqg._companion-link._tcp.local SRV 0 0 445 cjqg.local SRV 0 0 53785 cjqg.local OPT"
"290","7.390222425","192.168.1.100","224.0.0.251","MDNS","288","Standard query response 0x0000 PTR _smb._tcp.local TXT TXT OPT"
"291","7.589669813","192.168.1.101","224.0.0.251","MDNS","181","Standard query 0x0000 ANY cjqg._smb._tcp.local, "QM" question ANY cjqg._companion-link._tcp.local, "QM" question SRV 0 0 445 cjqg.local SRV 0 0 53785 cjqg.local OPT"
"292","7.592197350","fe80::1814:2ecf:2c8a:d90d","ff02::fb","MDNS","201","Standard query 0x0000 ANY cjqg._smb._tcp.local, "QM" question ANY cjqg._companion-link._tcp.local, "QM" question SRV 0 0 445 cjqg.local SRV 0 0 53785 cjqg.local OPT"
"293","7.594661975","fe80::1cc7:6d9a:a312:7e8f","ff02::fb","MDNS","195","Standard query 0x0000 ANY cjqg._smb._tcp.local, "QM" question ANY cjqg._companion-link._tcp.local, "QM" question SRV 0 0 445 cjqg.local SRV 0 0 53785 cjqg.local OPT"
"294","7.597050688","192.168.1.100","224.0.0.251","MDNS","175","Standard query 0x0000 ANY cjqg._smb._tcp.local, "QM" question ANY cjqg._companion-link._tcp.local, "QM" question SRV 0 0 445 cjqg.local SRV 0 0 53785 cjqg.local OPT"
"295","7.794573388","192.168.1.101","224.0.0.251","MDNS","181","Standard query 0x0000 ANY cjqg._smb._tcp.local, "QM" question ANY cjqg._companion-link._tcp.local, "QM" question SRV 0 0 445 cjqg.local SRV 0 0 53785 cjqg.local OPT"
"296","7.797063838","fe80::1814:2ecf:2c8a:d90d","ff02::fb","MDNS","201","Standard query 0x0000 ANY cjqg._smb._tcp.local, "QM" question ANY cjqg._companion-link._tcp.local, "QM" question SRV 0 0 445 cjqg.local SRV 0 0 53785 cjqg.local OPT"
"297","7.799538663","fe80::1cc7:6d9a:a312:7e8f","ff02::fb","MDNS","195","Standard query 0x0000 ANY cjqg._smb._tcp.local, "QM" question ANY cjqg._companion-link._tcp.local, "QM" question SRV 0 0 445 cjqg.local SRV 0 0 53785 cjqg.local OPT"
"298","7.802078963","192.168.1.100","224.0.0.251","MDNS","175","Standard query 0x0000 ANY cjqg._smb._tcp.local, "QM" question ANY cjqg._companion-link._tcp.local, "QM" question SRV 0 0 445 cjqg.local SRV 0 0 53785 cjqg.local OPT"
"299","7.899781325","RealtekS_68:08:d3","Broadcast","ARP","60","Who has 192.168.1.119? Tell 192.168.1.101"
"300","8.103293988","192.168.1.101","224.0.0.251","MDNS","530","Standard query response 0x0000 TXT, cache flush PTR cjqg._smb._tcp.local TXT SRV, cache flush 0 0 445 cjqg.local TXT, cache flush PTR _companion-link._tcp.local PTR cjqg._companion-link._tcp.local SRV, cache flush 0 0 53785 cjqg.local AAAA, cache flush fe80::1814:2ecf:2c8a:d90d A, cache flush 192.168.1.101 NSEC, cache flush cjqg._smb._tcp.local NSEC, cache flush cjqg._companion-link._tcp.local NSEC, cache flush cjqg.local OPT"
"301","8.108606300","fe80::1814:2ecf:2c8a:d90d","ff02::fb","MDNS","550","Standard query response 0x0000 TXT, cache flush PTR cjqg._smb._tcp.local TXT SRV, cache flush 0 0 445 cjqg.local TXT, cache flush PTR _companion-link._tcp.local PTR cjqg._companion-link._tcp.local SRV, cache flush 0 0 53785 cjqg.local AAAA, cache flush fe80::1814:2ecf:2c8a:d90d A, cache flush 192.168.1.101 NSEC, cache flush cjqg._smb._tcp.local NSEC, cache flush cjqg._companion-link._tcp.local NSEC, cache flush cjqg.local OPT"
"302","8.113698600","192.168.1.100","224.0.0.251","MDNS","524","Standard query response 0x0000 TXT, cache flush PTR cjqg._smb._tcp.local TXT SRV, cache flush 0 0 445 cjqg.local TXT, cache flush PTR _companion-link._tcp.local PTR cjqg._companion-link._tcp.local SRV, cache flush 0 0 53785 cjqg.local AAAA, cache flush fe80::1cc7:6d9a:a312:7e8f A, cache flush 192.168.1.100 NSEC, cache flush cjqg._smb._tcp.local NSEC, cache flush cjqg._companion-link._tcp.local NSEC, cache flush cjqg.local OPT"
"303","8.305756575","192.168.1.101","224.0.0.251","MDNS","213","Standard query response 0x0000 PTR _smb._tcp.local TXT OPT"
"304","8.308669075","fe80::1814:2ecf:2c8a:d90d","ff02::fb","MDNS","233","Standard query response 0x0000 PTR _smb._tcp.local TXT OPT"
"305","8.311385188","fe80::1cc7:6d9a:a312:7e8f","ff02::fb","MDNS","227","Standard query response 0x0000 PTR _smb._tcp.local TXT OPT"
"306","8.314177950","192.168.1.100","224.0.0.251","MDNS","207","Standard query response 0x0000 PTR _smb._tcp.local TXT OPT"
"307","8.365835750","192.168.1.118","192.168.1.102","TCP","176","46918 → 8009 [PSH, ACK] Seq=111 Ack=111 Win=501 Len=110 TSval=2819347340 TSecr=5973201 [TCP segment of a reassembled PDU]"
"308","8.375395400","192.168.1.102","192.168.1.118","TCP","176","8009 → 46918 [PSH, ACK] Seq=111 Ack=221 Win=277 Len=110 TSval=5973708 TSecr=2819347340 [TCP segment of a reassembled PDU]"
"309","8.375477475","192.168.1.118","192.168.1.102","TCP","66","46918 → 8009 [ACK] Seq=221 Ack=221 Win=501 Len=0 TSval=2819347350 TSecr=5973708"
"310","8.411943475","192.168.1.101","224.0.0.251","MDNS","539","Standard query 0x0000 PTR _googlecast._tcp.local, "QM" question PTR _homekit._tcp.local, "QM" question PTR _uscan._tcp.local, "QM" question PTR _ptp._tcp.local, "QM" question PTR _ippusb._tcp.local, "QM" question PTR _scanner._tcp.local, "QM" question PTR _ipp._tcp.local, "QM" question PTR _pdl-datastream._tcp.local, "QM" question PTR _uscans._tcp.local, "QM" question PTR _ipps._tcp.local, "QM" question PTR _printer._tcp.local, "QM" question PTR _airplay._tcp.local, "QM" question PTR _raop._tcp.local, "QM" question PTR _airport._tcp.local, "QM" question PTR _rdlink._tcp.local, "QM" question PTR _companion-link._tcp.local, "QM" question PTR _afpovertcp._tcp.local, "QM" question PTR _rfb._tcp.local, "QM" question PTR _adisk._tcp.local, "QM" question PTR _apple-mobdev._tcp.local, "QM" question PTR 8ed307c3._sub._apple-mobdev2._tcp.local, "QM" question PTR _apple-pairable._tcp.local, "QM" question TXT Google-Home-Mini-2c3f16b2da5c4b6fd6cfbfba61c12490._googlecast._tcp.local, "QM" question PTR Google-Home-Mini-2c3f16b2da5c4b6fd6cfbfba61c12490._googlecast._tcp.local PTR cjqg._companion-link._tcp.local OPT"
"311","8.417304050","fe80::1814:2ecf:2c8a:d90d","ff02::fb","MDNS","559","Standard query 0x0000 PTR _googlecast._tcp.local, "QM" question PTR _homekit._tcp.local, "QM" question PTR _uscan._tcp.local, "QM" question PTR _ptp._tcp.local, "QM" question PTR _ippusb._tcp.local, "QM" question PTR _scanner._tcp.local, "QM" question PTR _ipp._tcp.local, "QM" question PTR _pdl-datastream._tcp.local, "QM" question PTR _uscans._tcp.local, "QM" question PTR _ipps._tcp.local, "QM" question PTR _printer._tcp.local, "QM" question PTR _airplay._tcp.local, "QM" question PTR _raop._tcp.local, "QM" question PTR _airport._tcp.local, "QM" question PTR _rdlink._tcp.local, "QM" question PTR _companion-link._tcp.local, "QM" question PTR _afpovertcp._tcp.local, "QM" question PTR _rfb._tcp.local, "QM" question PTR _adisk._tcp.local, "QM" question PTR _apple-mobdev._tcp.local, "QM" question PTR 8ed307c3._sub._apple-mobdev2._tcp.local, "QM" question PTR _apple-pairable._tcp.local, "QM" question TXT Google-Home-Mini-2c3f16b2da5c4b6fd6cfbfba61c12490._googlecast._tcp.local, "QM" question PTR Google-Home-Mini-2c3f16b2da5c4b6fd6cfbfba61c12490._googlecast._tcp.local PTR cjqg._companion-link._tcp.local OPT"
"312","8.426417450","fe80::1cc7:6d9a:a312:7e8f","ff02::fb","MDNS","553","Standard query 0x0000 PTR _googlecast._tcp.local, "QM" question PTR _homekit._tcp.local, "QM" question PTR _uscan._tcp.local, "QM" question PTR _ptp._tcp.local, "QM" question PTR _ippusb._tcp.local, "QM" question PTR _scanner._tcp.local, "QM" question PTR _ipp._tcp.local, "QM" question PTR _pdl-datastream._tcp.local, "QM" question PTR _uscans._tcp.local, "QM" question PTR _ipps._tcp.local, "QM" question PTR _printer._tcp.local, "QM" question PTR _airplay._tcp.local, "QM" question PTR _raop._tcp.local, "QM" question PTR _airport._tcp.local, "QM" question PTR _rdlink._tcp.local, "QM" question PTR _companion-link._tcp.local, "QM" question PTR _afpovertcp._tcp.local, "QM" question PTR _rfb._tcp.local, "QM" question PTR _adisk._tcp.local, "QM" question PTR _apple-mobdev._tcp.local, "QM" question PTR 8ed307c3._sub._apple-mobdev2._tcp.local, "QM" question PTR _apple-pairable._tcp.local, "QM" question TXT Google-Home-Mini-2c3f16b2da5c4b6fd6cfbfba61c12490._googlecast._tcp.local, "QM" question PTR Google-Home-Mini-2c3f16b2da5c4b6fd6cfbfba61c12490._googlecast._tcp.local PTR cjqg._companion-link._tcp.local OPT"
"313","8.431606438","192.168.1.100","224.0.0.251","MDNS","533","Standard query 0x0000 PTR _googlecast._tcp.local, "QM" question PTR _homekit._tcp.local, "QM" question PTR _uscan._tcp.local, "QM" question PTR _ptp._tcp.local, "QM" question PTR _ippusb._tcp.local, "QM" question PTR _scanner._tcp.local, "QM" question PTR _ipp._tcp.local, "QM" question PTR _pdl-datastream._tcp.local, "QM" question PTR _uscans._tcp.local, "QM" question PTR _ipps._tcp.local, "QM" question PTR _printer._tcp.local, "QM" question PTR _airplay._tcp.local, "QM" question PTR _raop._tcp.local, "QM" question PTR _airport._tcp.local, "QM" question PTR _rdlink._tcp.local, "QM" question PTR _companion-link._tcp.local, "QM" question PTR _afpovertcp._tcp.local, "QM" question PTR _rfb._tcp.local, "QM" question PTR _adisk._tcp.local, "QM" question PTR _apple-mobdev._tcp.local, "QM" question PTR 8ed307c3._sub._apple-mobdev2._tcp.local, "QM" question PTR _apple-pairable._tcp.local, "QM" question TXT Google-Home-Mini-2c3f16b2da5c4b6fd6cfbfba61c12490._googlecast._tcp.local, "QM" question PTR Google-Home-Mini-2c3f16b2da5c4b6fd6cfbfba61c12490._googlecast._tcp.local PTR cjqg._companion-link._tcp.local OPT"
"314","9.128848638","192.168.1.101","224.0.0.251","MDNS","530","Standard query response 0x0000 TXT, cache flush PTR cjqg._smb._tcp.local TXT SRV, cache flush 0 0 445 cjqg.local TXT, cache flush PTR _companion-link._tcp.local PTR cjqg._companion-link._tcp.local SRV, cache flush 0 0 53785 cjqg.local AAAA, cache flush fe80::1814:2ecf:2c8a:d90d A, cache flush 192.168.1.101 NSEC, cache flush cjqg._smb._tcp.local NSEC, cache flush cjqg._companion-link._tcp.local NSEC, cache flush cjqg.local OPT"
"315","9.134154825","fe80::1814:2ecf:2c8a:d90d","ff02::fb","MDNS","550","Standard query response 0x0000 TXT, cache flush PTR cjqg._smb._tcp.local TXT SRV, cache flush 0 0 445 cjqg.local TXT, cache flush PTR _companion-link._tcp.local PTR cjqg._companion-link._tcp.local SRV, cache flush 0 0 53785 cjqg.local AAAA, cache flush fe80::1814:2ecf:2c8a:d90d A, cache flush 192.168.1.101 NSEC, cache flush cjqg._smb._tcp.local NSEC, cache flush cjqg._companion-link._tcp.local NSEC, cache flush cjqg.local OPT"
"316","9.139399063","fe80::1cc7:6d9a:a312:7e8f","ff02::fb","MDNS","544","Standard query response 0x0000 TXT, cache flush PTR cjqg._smb._tcp.local TXT SRV, cache flush 0 0 445 cjqg.local TXT, cache flush PTR _companion-link._tcp.local PTR cjqg._companion-link._tcp.local SRV, cache flush 0 0 53785 cjqg.local AAAA, cache flush fe80::1cc7:6d9a:a312:7e8f A, cache flush 192.168.1.100 NSEC, cache flush cjqg._smb._tcp.local NSEC, cache flush cjqg._companion-link._tcp.local NSEC, cache flush cjqg.local OPT"
"317","9.144527850","192.168.1.100","224.0.0.251","MDNS","524","Standard query response 0x0000 TXT, cache flush PTR cjqg._smb._tcp.local TXT SRV, cache flush 0 0 445 cjqg.local TXT, cache flush PTR _companion-link._tcp.local PTR cjqg._companion-link._tcp.local SRV, cache flush 0 0 53785 cjqg.local AAAA, cache flush fe80::1cc7:6d9a:a312:7e8f A, cache flush 192.168.1.100 NSEC, cache flush cjqg._smb._tcp.local NSEC, cache flush cjqg._companion-link._tcp.local NSEC, cache flush cjqg.local OPT"
