frame.number,_ws.col.Time,_ws.col.Source,_ws.col.Destination,_ws.col.Protocol,frame.len,_ws.col.Info
"1","0.000000000","192.168.1.118","172.217.12.195","TLSv1","583","Client Hello"
"2","0.004267563","192.168.1.118","209.18.47.62","DNS","73","Standard query 0x9b9d A yt3.ggpht.com"
"3","0.007475738","172.217.10.110","192.168.1.118","SSL","194","Continuation Data"
"4","0.007545038","192.168.1.118","172.217.10.110","TCP","66","[TCP ZeroWindow] 43810 → 443 [ACK] Seq=1 Ack=129 Win=0 Len=0 TSval=2061957032 TSecr=2554077664"
"5","0.021692788","192.168.1.118","172.217.10.22","TLSv1.2","363","Application Data"
"6","0.025988825","192.168.1.118","209.18.47.62","DNS","73","Standard query 0x0713 A yt3.ggpht.com"
"7","0.028107688","172.217.12.195","192.168.1.118","TCP","66","443 → 39982 [ACK] Seq=1 Ack=518 Win=240 Len=0 TSval=3305467608 TSecr=3688197851"
"8","0.032031938","209.18.47.62","192.168.1.118","DNS","134","Standard query response 0x9b9d A yt3.ggpht.com CNAME photos-ugc.l.googleusercontent.com A 172.217.10.129"
"9","0.032182713","192.168.1.118","209.18.47.62","DNS","73","Standard query 0xdb04 AAAA yt3.ggpht.com"
"10","0.033483413","172.217.12.195","192.168.1.118","TLSv1.2","1484","Server Hello"
"11","0.033540625","192.168.1.118","172.217.12.195","TCP","66","39982 → 443 [ACK] Seq=518 Ack=1419 Win=493 Len=0 TSval=3688197885 TSecr=3305467615"
"12","0.034832475","172.217.12.195","192.168.1.118","TLSv1.2","1307","Certificate, Server Key Exchange, Server Hello Done"
"13","0.034888138","192.168.1.118","172.217.12.195","TCP","66","39982 → 443 [ACK] Seq=518 Ack=2660 Win=484 Len=0 TSval=3688197886 TSecr=3305467615"
"14","0.048016363","172.217.10.22","192.168.1.118","TLSv1.2","1484","Application Data"
"15","0.048094150","192.168.1.118","172.217.10.22","TCP","66","47094 → 443 [ACK] Seq=298 Ack=1419 Win=493 Len=0 TSval=2862991438 TSecr=1728945458"
"16","0.049506713","172.217.10.22","192.168.1.118","TLSv1.2","2902","Application Data, Application Data"
"17","0.049564025","192.168.1.118","172.217.10.22","TCP","66","47094 → 443 [ACK] Seq=298 Ack=4255 Win=471 Len=0 TSval=2862991439 TSecr=1728945459"
"18","0.051813113","172.217.10.22","192.168.1.118","TLSv1.2","1484","Application Data"
"19","0.051877563","192.168.1.118","172.217.10.22","TCP","66","47094 → 443 [ACK] Seq=298 Ack=5673 Win=460 Len=0 TSval=2862991441 TSecr=1728945461"
"20","0.055873775","172.217.10.22","192.168.1.118","TLSv1.2","1484","Application Data"
"21","0.055948413","192.168.1.118","172.217.10.22","TCP","66","47094 → 443 [ACK] Seq=298 Ack=7091 Win=449 Len=0 TSval=2862991445 TSecr=1728945461"
"22","0.056790363","172.217.10.22","192.168.1.118","TLSv1.2","1805","Application Data, Application Data"
"23","0.056818988","192.168.1.118","172.217.10.22","TCP","66","47094 → 443 [ACK] Seq=298 Ack=8830 Win=436 Len=0 TSval=2862991446 TSecr=1728945463"
"24","0.062217625","209.18.47.62","192.168.1.118","DNS","146","Standard query response 0xdb04 AAAA yt3.ggpht.com CNAME photos-ugc.l.googleusercontent.com AAAA 2607:f8b0:4006:812::2001"
"25","0.063123650","209.18.47.62","192.168.1.118","DNS","134","Standard query response 0x0713 A yt3.ggpht.com CNAME photos-ugc.l.googleusercontent.com A 172.217.10.33"
"26","0.064565488","192.168.1.118","209.18.47.62","DNS","73","Standard query 0x6fed AAAA yt3.ggpht.com"
"27","0.077366538","192.168.1.118","172.217.12.195","TLSv1.2","192","Client Key Exchange, Change Cipher Spec, Encrypted Handshake Message"
"28","0.078248600","192.168.1.118","172.217.10.129","TCP","74","33082 → 443 [SYN] Seq=0 Win=64240 Len=0 MSS=1460 SACK_PERM=1 TSval=2285105150 TSecr=0 WS=128"
"29","0.078558838","192.168.1.118","172.217.10.129","TCP","74","33084 → 443 [SYN] Seq=0 Win=64240 Len=0 MSS=1460 SACK_PERM=1 TSval=2285105150 TSecr=0 WS=128"
"30","0.078670325","192.168.1.118","172.217.10.129","TCP","74","33086 → 443 [SYN] Seq=0 Win=64240 Len=0 MSS=1460 SACK_PERM=1 TSval=2285105150 TSecr=0 WS=128"
"31","0.094243175","192.168.1.118","172.217.10.22","TLSv1.2","363","Application Data"
"32","0.094384175","192.168.1.118","172.217.10.22","TLSv1.2","363","Application Data"
"33","0.094506863","192.168.1.118","172.217.10.22","TLSv1.2","363","Application Data"
"34","0.097319763","172.217.10.129","192.168.1.118","TCP","74","443 → 33084 [SYN, ACK] Seq=0 Ack=1 Win=60192 Len=0 MSS=1380 SACK_PERM=1 TSval=3677706649 TSecr=2285105150 WS=256"
"35","0.097433075","192.168.1.118","172.217.10.129","TCP","66","33084 → 443 [ACK] Seq=1 Ack=1 Win=64256 Len=0 TSval=2285105169 TSecr=3677706649"
"36","0.098852838","172.217.12.195","192.168.1.118","TLSv1.2","117","Change Cipher Spec, Encrypted Handshake Message"
"37","0.098917413","192.168.1.118","172.217.12.195","TCP","66","39982 → 443 [ACK] Seq=644 Ack=2711 Win=501 Len=0 TSval=3688197950 TSecr=3305467676"
"38","0.098951088","172.217.10.129","192.168.1.118","TCP","74","443 → 33086 [SYN, ACK] Seq=0 Ack=1 Win=60192 Len=0 MSS=1380 SACK_PERM=1 TSval=3062784731 TSecr=2285105150 WS=256"
"39","0.098990438","192.168.1.118","172.217.10.129","TCP","66","33086 → 443 [ACK] Seq=1 Ack=1 Win=64256 Len=0 TSval=2285105170 TSecr=3062784731"
"40","0.099006075","172.217.10.129","192.168.1.118","TCP","74","443 → 33082 [SYN, ACK] Seq=0 Ack=1 Win=60192 Len=0 MSS=1380 SACK_PERM=1 TSval=3573389850 TSecr=2285105150 WS=256"
"41","0.099028150","192.168.1.118","172.217.10.129","TCP","66","33082 → 443 [ACK] Seq=1 Ack=1 Win=64256 Len=0 TSval=2285105170 TSecr=3573389850"
"42","0.100112550","209.18.47.62","192.168.1.118","DNS","146","Standard query response 0x6fed AAAA yt3.ggpht.com CNAME photos-ugc.l.googleusercontent.com AAAA 2607:f8b0:4006:803::2001"
"43","0.112272350","172.217.10.22","192.168.1.118","TLSv1.2","1484","Application Data"
"44","0.112350638","192.168.1.118","172.217.10.22","TCP","66","47088 → 443 [ACK] Seq=298 Ack=1419 Win=493 Len=0 TSval=2862991502 TSecr=1265610705"
"45","0.114699625","172.217.10.22","192.168.1.118","TLSv1.2","1484","Application Data"
"46","0.114775875","192.168.1.118","172.217.10.22","TCP","66","47092 → 443 [ACK] Seq=298 Ack=1419 Win=493 Len=0 TSval=2862991504 TSecr=2454808696"
"47","0.114817000","172.217.10.22","192.168.1.118","TLSv1.2","1484","Application Data"
"48","0.114838450","192.168.1.118","172.217.10.22","TCP","66","47090 → 443 [ACK] Seq=298 Ack=1419 Win=493 Len=0 TSval=2862991504 TSecr=523137379"
"49","0.114863938","172.217.10.22","192.168.1.118","TLSv1.2","2902","Application Data, Application Data"
"50","0.114885075","192.168.1.118","172.217.10.22","TCP","66","47088 → 443 [ACK] Seq=298 Ack=4255 Win=471 Len=0 TSval=2862991504 TSecr=1265610705"
"51","0.114907038","172.217.10.22","192.168.1.118","TLSv1.2","2902","Application Data, Application Data"
"52","0.114923675","192.168.1.118","172.217.10.22","TCP","66","47092 → 443 [ACK] Seq=298 Ack=4255 Win=471 Len=0 TSval=2862991504 TSecr=2454808697"
"53","0.114944100","172.217.10.22","192.168.1.118","TLSv1.2","2902","Application Data, Application Data"
"54","0.114960325","192.168.1.118","172.217.10.22","TCP","66","47090 → 443 [ACK] Seq=298 Ack=4255 Win=471 Len=0 TSval=2862991504 TSecr=523137380"
"55","0.114981588","172.217.10.22","192.168.1.118","TLSv1.2","1584","Application Data, Application Data"
"56","0.114998425","192.168.1.118","172.217.10.22","TCP","66","47088 → 443 [ACK] Seq=298 Ack=5773 Win=460 Len=0 TSval=2862991504 TSecr=1265610708"
"57","0.117557525","172.217.10.22","192.168.1.118","TLSv1.2","587","Application Data"
"58","0.117600913","192.168.1.118","172.217.12.195","TLSv1.2","340","Application Data"
"59","0.117646638","192.168.1.118","172.217.10.22","TCP","66","47092 → 443 [ACK] Seq=298 Ack=4776 Win=467 Len=0 TSval=2862991507 TSecr=2454808699"
"60","0.117699513","172.217.10.22","192.168.1.118","TLSv1.2","2902","Application Data, Application Data"
"61","0.117722463","192.168.1.118","172.217.10.22","TCP","66","47090 → 443 [ACK] Seq=298 Ack=7091 Win=449 Len=0 TSval=2862991507 TSecr=523137382"
"62","0.121189063","172.217.10.22","192.168.1.118","TLSv1.2","397","Application Data"
"63","0.121254700","192.168.1.118","172.217.10.22","TCP","66","47090 → 443 [ACK] Seq=298 Ack=7422 Win=447 Len=0 TSval=2862991511 TSecr=523137384"
"64","0.136734900","172.217.12.195","192.168.1.118","TLSv1.2","1484","Application Data"
"65","0.138232075","172.217.12.195","192.168.1.118","TLSv1.2","1083","Application Data"
"66","0.158248138","192.168.1.118","172.217.10.129","TLSv1","583","Client Hello"
"67","0.177477500","192.168.1.118","172.217.12.195","TCP","66","39982 → 443 [ACK] Seq=918 Ack=5146 Win=482 Len=0 TSval=3688198029 TSecr=3305467719"
"68","0.182029325","172.217.10.129","192.168.1.118","TCP","66","443 → 33082 [ACK] Seq=1 Ack=518 Win=61440 Len=0 TSval=3573389931 TSecr=2285105230"
"69","0.186631575","172.217.10.129","192.168.1.118","TLSv1.2","5300","Server Hello, Certificate, Server Key Exchange, Server Hello Done"
"70","0.186700563","192.168.1.118","172.217.10.129","TCP","66","33082 → 443 [ACK] Seq=518 Ack=5235 Win=59136 Len=0 TSval=2285105258 TSecr=3573389938"
"71","0.190340675","192.168.1.118","172.217.10.129","TLSv1","583","Client Hello"
"72","0.206872313","172.217.12.195","192.168.1.118","TLSv1.2","1083","[TCP Spurious Retransmission] , Application Data"
"73","0.206942213","192.168.1.118","172.217.12.195","TCP","78","[TCP Dup ACK 67#1] 39982 → 443 [ACK] Seq=918 Ack=5146 Win=482 Len=0 TSval=3688198058 TSecr=3305467783 SLE=4129 SRE=5146"
"74","0.226525463","172.217.10.129","192.168.1.118","TLSv1.2","1046","[TCP Spurious Retransmission] , Ignored Unknown Record"
"75","0.226597200","192.168.1.118","172.217.10.129","TCP","78","[TCP Dup ACK 70#1] 33082 → 443 [ACK] Seq=518 Ack=5235 Win=59136 Len=0 TSval=2285105298 TSecr=3573389979 SLE=4255 SRE=5235"
"76","0.229605750","192.168.1.118","172.217.10.129","TLSv1","583","Client Hello"
"77","0.230162163","192.168.1.118","172.217.10.22","TLSv1.2","363","Application Data"
"78","0.236818038","192.168.1.118","172.217.10.129","TLSv1.2","192","Client Key Exchange, Change Cipher Spec, Encrypted Handshake Message"
"79","0.240721513","192.168.1.118","172.217.10.110","TCP","66","43806 → 443 [ACK] Seq=1 Ack=1 Win=501 Len=0 TSval=2061957265 TSecr=17634503"
"80","0.241930375","172.217.10.129","192.168.1.118","TCP","66","443 → 33084 [ACK] Seq=1 Ack=518 Win=61440 Len=0 TSval=3677706797 TSecr=2285105262"
"81","0.249114975","172.217.10.22","192.168.1.118","TLSv1.2","1484","Application Data"
"82","0.249196938","192.168.1.118","172.217.10.22","TCP","66","47096 → 443 [ACK] Seq=298 Ack=1419 Win=493 Len=0 TSval=2862991639 TSecr=2454808834"
"83","0.251118913","172.217.10.22","192.168.1.118","TLSv1.2","2902","Application Data, Application Data"
"84","0.251189825","192.168.1.118","172.217.10.22","TCP","66","47096 → 443 [ACK] Seq=298 Ack=4255 Win=471 Len=0 TSval=2862991641 TSecr=2454808834"
"85","0.251245475","172.217.10.129","192.168.1.118","TLSv1.2","5299","Server Hello, Certificate, Server Key Exchange, Server Hello Done"
"86","0.251266788","192.168.1.118","172.217.10.129","TCP","66","33084 → 443 [ACK] Seq=518 Ack=5234 Win=59136 Len=0 TSval=2285105323 TSecr=3677706804"
"87","0.251285888","172.217.10.22","192.168.1.118","TLSv1.2","1484","Application Data"
"88","0.251300175","192.168.1.118","172.217.10.22","TCP","66","47096 → 443 [ACK] Seq=298 Ack=5673 Win=460 Len=0 TSval=2862991641 TSecr=2454808836"
"89","0.253027388","172.217.10.22","192.168.1.118","TLSv1.2","1484","Application Data"
"90","0.253095575","192.168.1.118","172.217.10.22","TCP","66","47096 → 443 [ACK] Seq=298 Ack=7091 Win=449 Len=0 TSval=2862991643 TSecr=2454808836"
"91","0.253128188","172.217.10.22","192.168.1.118","TLSv1.2","1268","Application Data"
"92","0.253142350","192.168.1.118","172.217.10.22","TCP","66","47096 → 443 [ACK] Seq=298 Ack=8293 Win=440 Len=0 TSval=2862991643 TSecr=2454808838"
"93","0.254484675","172.217.10.129","192.168.1.118","TCP","66","443 → 33086 [ACK] Seq=1 Ack=518 Win=61440 Len=0 TSval=3062784892 TSecr=2285105301"
"94","0.255471213","172.217.10.129","192.168.1.118","TLSv1.2","117","Change Cipher Spec, Encrypted Handshake Message"
"95","0.255521588","192.168.1.118","172.217.10.129","TCP","66","33082 → 443 [ACK] Seq=644 Ack=5286 Win=64128 Len=0 TSval=2285105327 TSecr=3573390011"
"96","0.263172188","172.217.10.129","192.168.1.118","TLSv1.2","1484","Server Hello"
"97","0.263241838","192.168.1.118","172.217.10.129","TCP","66","33086 → 443 [ACK] Seq=518 Ack=1419 Win=63104 Len=0 TSval=2285105335 TSecr=3062784899"
"98","0.264591375","192.168.1.118","172.217.10.129","TLSv1.2","338","Application Data"
"99","0.266890000","192.168.1.118","172.217.10.129","TLSv1.2","192","Client Key Exchange, Change Cipher Spec, Encrypted Handshake Message"
"100","0.267348075","192.168.1.118","172.217.10.22","TLSv1.2","363","Application Data"
"101","0.267805625","192.168.1.118","172.217.10.22","TLSv1.2","363","Application Data"
"102","0.267936588","192.168.1.118","172.217.10.110","TCP","66","[TCP Window Update] 43810 → 443 [ACK] Seq=1 Ack=129 Win=259 Len=0 TSval=2061957292 TSecr=2554077664"
"103","0.269167488","172.217.10.129","192.168.1.118","TLSv1.2","3881","Certificate, Server Key Exchange, Server Hello Done"
"104","0.269231075","192.168.1.118","172.217.10.129","TCP","66","33086 → 443 [ACK] Seq=518 Ack=5234 Win=59392 Len=0 TSval=2285105341 TSecr=3062784899"
"105","0.275444300","172.217.10.110","192.168.1.118","TCP","66","[TCP Keep-Alive] 443 → 43810 [ACK] Seq=128 Ack=1 Win=244 Len=0 TSval=2554077952 TSecr=2061957032"
"106","0.275507625","192.168.1.118","172.217.10.110","TCP","66","[TCP Keep-Alive ACK] 43810 → 443 [ACK] Seq=1 Ack=129 Win=259 Len=0 TSval=2061957300 TSecr=2554077664"
"107","0.276904375","192.168.1.118","172.217.10.129","TLSv1.2","192","Client Key Exchange, Change Cipher Spec, Encrypted Handshake Message"
"108","0.277469888","192.168.1.118","172.217.10.22","TLSv1.2","363","Application Data"
"109","0.277721400","192.168.1.118","172.217.10.22","TLSv1.2","363","Application Data"
"110","0.278510550","172.217.10.129","192.168.1.118","TLSv1.2","1484","Application Data"
"111","0.281454238","172.217.10.129","192.168.1.118","TLSv1.2","2902","Application Data, Application Data"
"112","0.281506300","172.217.10.129","192.168.1.118","TLSv1.2","263","Application Data"
"113","0.282175238","172.217.10.129","192.168.1.118","TLSv1.2","117","Change Cipher Spec, Encrypted Handshake Message"
"114","0.285074500","172.217.10.110","192.168.1.118","SSL","1484","Continuation Data"
"115","0.285148738","192.168.1.118","172.217.10.110","TCP","66","43810 → 443 [ACK] Seq=1 Ack=1547 Win=248 Len=0 TSval=2061957310 TSecr=2554077960"
"116","0.289730663","172.217.10.22","192.168.1.118","TLSv1.2","1484","Application Data"
"117","0.289809063","192.168.1.118","172.217.10.22","TCP","66","47088 → 443 [ACK] Seq=595 Ack=7191 Win=493 Len=0 TSval=2862991679 TSecr=1265610879"
"118","0.289850975","172.217.10.22","192.168.1.118","TLSv1.2","1484","Application Data"
"119","0.289871988","192.168.1.118","172.217.10.22","TCP","66","47092 → 443 [ACK] Seq=595 Ack=6194 Win=493 Len=0 TSval=2862991679 TSecr=2454808871"
"120","0.289888763","172.217.10.110","192.168.1.118","SSL","1484","Continuation Data"
"121","0.289905350","172.217.10.22","192.168.1.118","TLSv1.2","1484","Application Data"
"122","0.289919488","192.168.1.118","172.217.10.22","TCP","66","47088 → 443 [ACK] Seq=595 Ack=8609 Win=482 Len=0 TSval=2862991679 TSecr=1265610880"
"123","0.289973425","172.217.10.22","192.168.1.118","TLSv1.2","1484","Application Data"
"124","0.289988275","192.168.1.118","172.217.10.22","TCP","66","47088 → 443 [ACK] Seq=595 Ack=10027 Win=471 Len=0 TSval=2862991679 TSecr=1265610880"
"125","0.290007775","172.217.10.22","192.168.1.118","TLSv1.2","1484","Application Data"
"126","0.290022025","192.168.1.118","172.217.10.22","TCP","66","47092 → 443 [ACK] Seq=595 Ack=7612 Win=482 Len=0 TSval=2862991679 TSecr=2454808872"
"127","0.292590750","192.168.1.118","172.217.10.129","TCP","66","33082 → 443 [ACK] Seq=916 Ack=9737 Win=59776 Len=0 TSval=2285105364 TSecr=3573390034"
"128","0.293286788","192.168.1.118","172.217.10.129","TLSv1.2","338","Application Data"
"129","0.297764588","172.217.10.22","192.168.1.118","TLSv1.2","1484","Application Data"
"130","0.297832113","192.168.1.118","172.217.10.22","TCP","66","47092 → 443 [ACK] Seq=595 Ack=9030 Win=471 Len=0 TSval=2862991687 TSecr=2454808872"
"131","0.297886988","172.217.10.22","192.168.1.118","TLSv1.2","1533","Application Data, Application Data"
"132","0.297905863","192.168.1.118","172.217.10.22","TCP","66","47088 → 443 [ACK] Seq=595 Ack=11494 Win=460 Len=0 TSval=2862991687 TSecr=1265610882"
"133","0.297916900","172.217.10.110","192.168.1.118","TCP","2902","443 → 43810 [ACK] Seq=2965 Ack=1 Win=244 Len=2836 TSval=2554077961 TSecr=2061957292"
"134","0.297981650","172.217.10.22","192.168.1.118","TLSv1.2","2902","Application Data, Application Data"
"135","0.297998188","192.168.1.118","172.217.10.22","TCP","66","47092 → 443 [ACK] Seq=595 Ack=11866 Win=449 Len=0 TSval=2862991687 TSecr=2454808874"
"136","0.298006725","172.217.10.22","192.168.1.118","TLSv1.2","1418","Application Data"
"137","0.298020663","192.168.1.118","172.217.10.22","TCP","66","47092 → 443 [ACK] Seq=595 Ack=13218 Win=439 Len=0 TSval=2862991687 TSecr=2454808876"
"138","0.298039575","172.217.10.110","192.168.1.118","SSL","2902","Continuation Data"
"139","0.298061738","172.217.10.22","192.168.1.118","TLSv1.2","1484","Application Data"
"140","0.298087425","192.168.1.118","172.217.10.22","TCP","66","47090 → 443 [ACK] Seq=595 Ack=8840 Win=493 Len=0 TSval=2862991688 TSecr=523137564"
"141","0.298103775","172.217.10.22","192.168.1.118","TLSv1.2","1484","Application Data"
"142","0.298125275","192.168.1.118","172.217.10.22","TCP","66","47094 → 443 [ACK] Seq=595 Ack=10248 Win=493 Len=0 TSval=2862991688 TSecr=1728945706"
"143","0.298156150","172.217.10.22","192.168.1.118","TLSv1.2","2902","Application Data, Application Data"
"144","0.298171825","192.168.1.118","172.217.10.22","TCP","66","47090 → 443 [ACK] Seq=595 Ack=11676 Win=471 Len=0 TSval=2862991688 TSecr=523137564"
"145","0.298183388","172.217.10.110","192.168.1.118","SSL","2902","Continuation Data"
"146","0.299707488","192.168.1.118","172.217.10.110","TCP","66","43810 → 443 [ACK] Seq=1 Ack=11473 Win=171 Len=0 TSval=2061957323 TSecr=2554077960"
"147","0.300691163","192.168.1.118","172.217.10.22","TLSv1.2","363","Application Data"
"148","0.302434775","172.217.10.22","192.168.1.118","TLSv1.2","2902","Application Data, Application Data"
"149","0.302506363","192.168.1.118","172.217.10.22","TCP","66","47094 → 443 [ACK] Seq=595 Ack=13084 Win=477 Len=0 TSval=2862991692 TSecr=1728945706"
"150","0.302546063","172.217.10.129","192.168.1.118","TLSv1.2","117","Change Cipher Spec, Encrypted Handshake Message"
"151","0.302581425","172.217.10.110","192.168.1.118","SSL","2902","Continuation Data"
"152","0.302681088","172.217.10.22","192.168.1.118","TLSv1.2","2902","Application Data, Application Data"
"153","0.302697875","192.168.1.118","172.217.10.22","TCP","66","47094 → 443 [ACK] Seq=595 Ack=15920 Win=455 Len=0 TSval=2862991692 TSecr=1728945708"
"154","0.302708375","172.217.10.22","192.168.1.118","TLSv1.2","2902","Application Data, Application Data"
"155","0.302724650","192.168.1.118","172.217.10.22","TCP","66","47090 → 443 [ACK] Seq=595 Ack=14512 Win=477 Len=0 TSval=2862991692 TSecr=523137567"
"156","0.303970025","172.217.10.110","192.168.1.118","SSL","1064","Continuation Data"
"157","0.304019863","172.217.10.22","192.168.1.118","TLSv1.2","934","Application Data"
"158","0.304054563","192.168.1.118","172.217.10.22","TCP","66","47090 → 443 [ACK] Seq=595 Ack=15380 Win=471 Len=0 TSval=2862991693 TSecr=523137569"
"159","0.304105125","172.217.10.22","192.168.1.118","TLSv1.2","2902","Application Data, Application Data"
"160","0.304128800","192.168.1.118","172.217.10.22","TCP","66","47094 → 443 [ACK] Seq=595 Ack=18756 Win=433 Len=0 TSval=2862991694 TSecr=1728945710"
"161","0.304137588","172.217.10.22","192.168.1.118","TLSv1.2","1416","Application Data"
"162","0.304151825","192.168.1.118","172.217.10.22","TCP","66","47094 → 443 [ACK] Seq=595 Ack=20106 Win=423 Len=0 TSval=2862991694 TSecr=1728945712"
"163","0.304172013","172.217.10.110","192.168.1.118","SSL","2902","Continuation Data"
"164","0.305249513","172.217.10.110","192.168.1.118","SSL","1484","Continuation Data"
"165","0.306256563","172.217.10.110","192.168.1.118","SSL","1484","Continuation Data"
"166","0.306478150","192.168.1.118","172.217.10.110","TCP","66","43810 → 443 [ACK] Seq=1 Ack=20979 Win=97 Len=0 TSval=2061957331 TSecr=2554077972"
"167","0.306932338","192.168.1.118","172.217.10.129","TLSv1.2","336","Application Data"
"168","0.308351113","172.217.10.110","192.168.1.118","SSL","1484","Continuation Data"
"169","0.308959125","192.168.1.118","172.217.10.22","TLSv1.2","363","Application Data"
"170","0.309079213","172.217.10.110","192.168.1.118","SSL","1484","Continuation Data"
"171","0.309158925","192.168.1.118","172.217.10.22","TLSv1.2","363","Application Data"
"172","0.309239475","192.168.1.118","172.217.10.110","TCP","66","43810 → 443 [ACK] Seq=1 Ack=23815 Win=75 Len=0 TSval=2061957334 TSecr=2554077984"
"173","0.309778813","192.168.1.118","172.217.10.22","TLSv1.2","363","Application Data"
"174","0.313054600","192.168.1.118","172.217.10.22","TLSv1.2","363","Application Data"
"175","0.314788200","192.168.1.118","172.217.10.110","TCP","66","[TCP Window Update] 43810 → 443 [ACK] Seq=1 Ack=23815 Win=259 Len=0 TSval=2061957339 TSecr=2554077984"
"176","0.317232413","172.217.10.110","192.168.1.118","SSL","1484","Continuation Data"
"177","0.318351913","192.168.1.118","172.217.10.110","TCP","66","43810 → 443 [ACK] Seq=1 Ack=25233 Win=501 Len=0 TSval=2061957343 TSecr=2554077988"
"178","0.318444275","172.217.10.110","192.168.1.118","SSL","1484","Continuation Data"
"179","0.318467775","192.168.1.118","172.217.10.110","TCP","66","43810 → 443 [ACK] Seq=1 Ack=26651 Win=523 Len=0 TSval=2061957343 TSecr=2554077988"
"180","0.318491100","172.217.10.110","192.168.1.118","SSL","2902","Continuation Data"
"181","0.318505900","192.168.1.118","172.217.10.110","TCP","66","43810 → 443 [ACK] Seq=1 Ack=29487 Win=568 Len=0 TSval=2061957343 TSecr=2554077991"
"182","0.320434688","172.217.10.110","192.168.1.118","SSL","1484","Continuation Data"
"183","0.320477563","192.168.1.118","172.217.10.110","TCP","66","43810 → 443 [ACK] Seq=1 Ack=30905 Win=590 Len=0 TSval=2061957345 TSecr=2554077995"
"184","0.321859513","172.217.10.110","192.168.1.118","SSL","1484","Continuation Data"
"185","0.321896838","192.168.1.118","172.217.10.110","TCP","66","43810 → 443 [ACK] Seq=1 Ack=32323 Win=612 Len=0 TSval=2061957346 TSecr=2554077995"
"186","0.329376525","172.217.10.129","192.168.1.118","TLSv1.2","263","[TCP Spurious Retransmission] , Application Data"
"187","0.329466925","192.168.1.118","172.217.10.129","TCP","78","[TCP Window Update] 33082 → 443 [ACK] Seq=916 Ack=9737 Win=64128 Len=0 TSval=2285105401 TSecr=3573390083 SLE=9540 SRE=9737"
"188","0.358648738","172.217.10.110","192.168.1.118","SSL","1484","Continuation Data"
"189","0.358715288","192.168.1.118","172.217.10.110","TCP","66","43810 → 443 [ACK] Seq=1 Ack=33741 Win=634 Len=0 TSval=2061957383 TSecr=2554078033"
"190","0.365386738","172.217.10.22","192.168.1.118","TLSv1.2","1484","Application Data"
"191","0.365469713","192.168.1.118","172.217.10.22","TCP","66","47096 → 443 [ACK] Seq=595 Ack=9711 Win=493 Len=0 TSval=2862991755 TSecr=2454808945"
"192","0.365515763","172.217.10.22","192.168.1.118","TLSv1.2","2902","Application Data, Application Data"
"193","0.365532650","192.168.1.118","172.217.10.22","TCP","66","47096 → 443 [ACK] Seq=595 Ack=12547 Win=471 Len=0 TSval=2862991755 TSecr=2454808946"
"194","0.365544838","172.217.10.110","192.168.1.118","SSL","1484","Continuation Data"
"195","0.365560663","192.168.1.118","172.217.10.110","TCP","66","43810 → 443 [ACK] Seq=1 Ack=35159 Win=656 Len=0 TSval=2061957390 TSecr=2554078033"
"196","0.365627138","172.217.10.22","192.168.1.118","TLSv1.2","1484","Application Data"
"197","0.365649400","172.217.10.22","192.168.1.118","TLSv1.2","1484","Application Data"
"198","0.365677038","172.217.10.22","192.168.1.118","TLSv1.2","1484","Application Data"
"199","0.365701475","172.217.10.22","192.168.1.118","TLSv1.2","2902","Application Data, Application Data"
"200","0.365716600","172.217.10.22","192.168.1.118","TLSv1.2","1484","Application Data"
"201","0.365735388","172.217.10.129","192.168.1.118","TLSv1.2","1484","Application Data"
"202","0.365760300","172.217.10.129","192.168.1.118","TLSv1.2","2902","Application Data, Application Data"
"203","0.365777188","172.217.10.129","192.168.1.118","TLSv1.2","954","Application Data"
"204","0.365787913","172.217.10.110","192.168.1.118","SSL","2902","Continuation Data"
"205","0.365803988","192.168.1.118","172.217.10.110","TCP","66","43810 → 443 [ACK] Seq=1 Ack=37995 Win=701 Len=0 TSval=2061957390 TSecr=2554078035"
"206","0.368268700","192.168.1.118","172.217.10.129","TCP","66","33084 → 443 [ACK] Seq=916 Ack=10427 Win=59008 Len=0 TSval=2285105440 TSecr=3677706916"
"207","0.368880250","192.168.1.118","172.217.10.22","TCP","66","47094 → 443 [ACK] Seq=892 Ack=24360 Win=468 Len=0 TSval=2862991758 TSecr=1728945770"
"208","0.368989138","172.217.10.22","192.168.1.118","TLSv1.2","1484","Application Data"
"209","0.369205688","192.168.1.118","172.217.10.22","TCP","66","47092 → 443 [ACK] Seq=892 Ack=16054 Win=493 Len=0 TSval=2862991759 TSecr=2454808946"
"210","0.370508363","172.217.10.22","192.168.1.118","TLSv1.2","1484","Application Data"
"211","0.370563463","172.217.10.22","192.168.1.118","TLSv1.2","2902","Application Data, Application Data"
"212","0.370588038","172.217.10.22","192.168.1.118","TLSv1.2","2902","Application Data, Application Data"
"213","0.370613125","172.217.10.22","192.168.1.118","TLSv1.2","1484","Application Data"
"214","0.370643450","192.168.1.118","172.217.10.22","TCP","66","47096 → 443 [ACK] Seq=595 Ack=13965 Win=493 Len=0 TSval=2862991760 TSecr=2454808948"
"215","0.370678350","172.217.10.22","192.168.1.118","TLSv1.2","1320","Application Data"
"216","0.370694675","192.168.1.118","172.217.10.22","TCP","66","47096 → 443 [ACK] Seq=595 Ack=15219 Win=484 Len=0 TSval=2862991760 TSecr=2454808948"
"217","0.370711188","172.217.10.129","192.168.1.118","TLSv1.2","1484","Application Data"
"218","0.370749088","172.217.10.129","192.168.1.118","TLSv1.2","1484","Application Data"
"219","0.371038413","192.168.1.118","172.217.10.129","TCP","66","33086 → 443 [ACK] Seq=914 Ack=8121 Win=61312 Len=0 TSval=2285105442 TSecr=3062785000"
"220","0.371224038","192.168.1.118","172.217.10.22","TCP","66","47088 → 443 [ACK] Seq=892 Ack=15748 Win=477 Len=0 TSval=2862991761 TSecr=1265610955"
"221","0.371285763","192.168.1.118","172.217.10.22","TCP","66","47090 → 443 [ACK] Seq=892 Ack=19634 Win=477 Len=0 TSval=2862991761 TSecr=523137629"
"222","0.375828575","192.168.1.118","172.217.10.22","TLSv1.2","363","Application Data"
"223","0.384066900","172.217.10.129","192.168.1.118","TLSv1.2","1484","Application Data"
"224","0.384120500","172.217.10.129","192.168.1.118","TLSv1.2","216","Application Data"
"225","0.384165050","172.217.10.22","192.168.1.118","TLSv1.2","2222","Application Data, Application Data"
"226","0.384200088","192.168.1.118","172.217.10.22","TCP","66","47090 → 443 [ACK] Seq=892 Ack=21790 Win=477 Len=0 TSval=2862991774 TSecr=523137632"
"227","0.384235925","172.217.10.22","192.168.1.118","TLSv1.2","2902","Application Data, Application Data"
"228","0.384253913","192.168.1.118","172.217.10.22","TCP","66","47094 → 443 [ACK] Seq=892 Ack=27196 Win=477 Len=0 TSval=2862991774 TSecr=1728945773"
"229","0.384270788","172.217.10.22","192.168.1.118","TLSv1.2","2902","Application Data, Application Data"
"230","0.384280700","172.217.10.22","192.168.1.118","TLSv1.2","795","Application Data"
"231","0.384290663","172.217.10.22","192.168.1.118","TLSv1.2","2902","Application Data, Application Data"
"232","0.384305200","192.168.1.118","172.217.10.22","TCP","66","47088 → 443 [ACK] Seq=892 Ack=18584 Win=477 Len=0 TSval=2862991774 TSecr=1265610958"
"233","0.384322138","172.217.10.22","192.168.1.118","TLSv1.2","2902","Application Data, Application Data"
"234","0.384335388","172.217.10.22","192.168.1.118","TLSv1.2","1597","Application Data, Application Data"
"235","0.384347138","172.217.10.110","192.168.1.118","SSL","2902","Continuation Data"
"236","0.384361713","192.168.1.118","172.217.10.110","TCP","66","43810 → 443 [ACK] Seq=1 Ack=40831 Win=745 Len=0 TSval=2061957409 TSecr=2554078039"
"237","0.384377863","172.217.10.22","192.168.1.118","TLSv1.2","2902","Application Data, Application Data"
"238","0.384389988","172.217.10.110","192.168.1.118","SSL","2902","Continuation Data"
"239","0.384403600","192.168.1.118","172.217.10.110","TCP","66","43810 → 443 [ACK] Seq=1 Ack=43667 Win=789 Len=0 TSval=2061957409 TSecr=2554078042"
"240","0.384431988","172.217.10.22","192.168.1.118","TLSv1.2","1484","Application Data"
"241","0.385804263","192.168.1.118","172.217.10.129","TCP","66","33086 → 443 [ACK] Seq=914 Ack=9689 Win=61056 Len=0 TSval=2285105457 TSecr=3062785000"
"242","0.385898300","192.168.1.118","172.217.10.22","TCP","66","47088 → 443 [ACK] Seq=892 Ack=22838 Win=444 Len=0 TSval=2862991775 TSecr=1265610960"
"243","0.385963625","172.217.10.22","192.168.1.118","TLSv1.2","1484","Application Data"
"244","0.385990425","172.217.10.22","192.168.1.118","TLSv1.2","2008","Application Data, Application Data"
"245","0.386011763","172.217.10.110","192.168.1.118","SSL","2902","Continuation Data"
"246","0.386035100","192.168.1.118","172.217.10.110","TCP","66","43810 → 443 [ACK] Seq=1 Ack=46503 Win=834 Len=0 TSval=2061957410 TSecr=2554078046"
"247","0.386111300","172.217.10.110","192.168.1.118","SSL","2902","Continuation Data"
"248","0.386126625","192.168.1.118","172.217.10.110","TCP","66","43810 → 443 [ACK] Seq=1 Ack=49339 Win=878 Len=0 TSval=2061957411 TSecr=2554078049"
"249","0.386156963","172.217.10.110","192.168.1.118","SSL","2902","Continuation Data"
"250","0.386174875","192.168.1.118","172.217.10.110","TCP","66","43810 → 443 [ACK] Seq=1 Ack=52175 Win=922 Len=0 TSval=2061957411 TSecr=2554078053"
"251","0.386195950","172.217.10.110","192.168.1.118","SSL","2902","Continuation Data"
"252","0.386213125","192.168.1.118","172.217.10.110","TCP","66","43810 → 443 [ACK] Seq=1 Ack=55011 Win=966 Len=0 TSval=2061957411 TSecr=2554078057"
"253","0.386224475","172.217.10.110","192.168.1.118","SSL","1484","Continuation Data"
"254","0.386238750","192.168.1.118","172.217.10.110","TCP","66","43810 → 443 [ACK] Seq=1 Ack=56429 Win=989 Len=0 TSval=2061957411 TSecr=2554078060"
"255","0.388326175","172.217.10.110","192.168.1.118","SSL","1484","Continuation Data"
"256","0.388385625","192.168.1.118","172.217.10.110","TCP","66","43810 → 443 [ACK] Seq=1 Ack=57847 Win=1011 Len=0 TSval=2061957413 TSecr=2554078060"
"257","0.389630150","172.217.10.110","192.168.1.118","SSL","2902","Continuation Data"
"258","0.389686800","192.168.1.118","172.217.10.110","TCP","66","43810 → 443 [ACK] Seq=1 Ack=60683 Win=1055 Len=0 TSval=2061957414 TSecr=2554078064"
"259","0.392262425","172.217.10.110","192.168.1.118","SSL","1484","Continuation Data"
"260","0.392326000","192.168.1.118","172.217.10.110","TCP","66","43810 → 443 [ACK] Seq=1 Ack=62101 Win=1077 Len=0 TSval=2061957417 TSecr=2554078067"
"261","0.393602613","192.168.1.118","172.217.10.22","TCP","66","47088 → 443 [ACK] Seq=892 Ack=26198 Win=418 Len=0 TSval=2862991783 TSecr=1265610962"
"262","0.393754863","192.168.1.118","172.217.10.22","TCP","66","47092 → 443 [ACK] Seq=892 Ack=21037 Win=461 Len=0 TSval=2862991783 TSecr=2454808947"
"263","0.393819113","192.168.1.118","172.217.10.22","TCP","66","47094 → 443 [ACK] Seq=892 Ack=31563 Win=443 Len=0 TSval=2862991783 TSecr=1728945775"
"264","0.399995450","192.168.1.118","172.217.10.22","TLSv1.2","363","Application Data"
"265","0.402293900","192.168.1.118","172.217.10.22","TLSv1.2","363","Application Data"
"266","0.403576000","192.168.1.118","172.217.10.22","TLSv1.2","376","Application Data"
"267","0.404990375","172.217.10.110","192.168.1.118","TCP","1484","[TCP segment of a reassembled PDU]"
"268","0.405051663","192.168.1.118","172.217.10.110","TCP","66","43810 → 443 [ACK] Seq=1 Ack=63519 Win=1099 Len=0 TSval=2061957429 TSecr=2554078067"
"269","0.405099188","172.217.10.110","192.168.1.118","TCP","2902","443 → 43810 [ACK] Seq=63519 Ack=1 Win=244 Len=2836 TSval=2554078071 TSecr=2061957346 [TCP segment of a reassembled PDU]"
"270","0.405116763","192.168.1.118","172.217.10.110","TCP","66","43810 → 443 [ACK] Seq=1 Ack=66355 Win=1144 Len=0 TSval=2061957430 TSecr=2554078071"
"271","0.406168988","172.217.10.110","192.168.1.118","TCP","2902","443 → 43810 [ACK] Seq=66355 Ack=1 Win=244 Len=2836 TSval=2554078074 TSecr=2061957346 [TCP segment of a reassembled PDU]"
"272","0.406225763","192.168.1.118","172.217.10.110","TCP","66","43810 → 443 [ACK] Seq=1 Ack=69191 Win=1188 Len=0 TSval=2061957431 TSecr=2554078074"
"273","0.406263175","172.217.10.110","192.168.1.118","TCP","2902","443 → 43810 [ACK] Seq=69191 Ack=1 Win=244 Len=2836 TSval=2554078078 TSecr=2061957346 [TCP segment of a reassembled PDU]"
"274","0.406281813","192.168.1.118","172.217.10.110","TCP","66","43810 → 443 [ACK] Seq=1 Ack=72027 Win=1232 Len=0 TSval=2061957431 TSecr=2554078078"
"275","0.409360000","172.217.10.110","192.168.1.118","TCP","2902","443 → 43810 [ACK] Seq=72027 Ack=1 Win=244 Len=2836 TSval=2554078082 TSecr=2061957346 [TCP segment of a reassembled PDU]"
"276","0.409450500","192.168.1.118","172.217.10.110","TCP","66","43810 → 443 [ACK] Seq=1 Ack=74863 Win=1277 Len=0 TSval=2061957434 TSecr=2554078082"
"277","0.410901988","172.217.10.110","192.168.1.118","TCP","2902","443 → 43810 [ACK] Seq=74863 Ack=1 Win=244 Len=2836 TSval=2554078085 TSecr=2061957346 [TCP segment of a reassembled PDU]"
"278","0.410964100","192.168.1.118","172.217.10.110","TCP","66","43810 → 443 [ACK] Seq=1 Ack=77699 Win=1321 Len=0 TSval=2061957435 TSecr=2554078085"
"279","0.412800000","192.168.1.118","172.217.10.22","TLSv1.2","363","Application Data"
"280","0.413107000","172.217.10.110","192.168.1.118","TCP","1484","443 → 43810 [ACK] Seq=77699 Ack=1 Win=244 Len=1418 TSval=2554078089 TSecr=2061957346 [TCP segment of a reassembled PDU]"
"281","0.413145988","192.168.1.118","172.217.10.110","TCP","66","43810 → 443 [ACK] Seq=1 Ack=79117 Win=1343 Len=0 TSval=2061957438 TSecr=2554078089"
"282","0.417967038","172.217.10.110","192.168.1.118","TCP","1484","443 → 43810 [ACK] Seq=79117 Ack=1 Win=244 Len=1418 TSval=2554078089 TSecr=2061957346 [TCP segment of a reassembled PDU]"
"283","0.418029175","192.168.1.118","172.217.10.110","TCP","66","43810 → 443 [ACK] Seq=1 Ack=80535 Win=1365 Len=0 TSval=2061957442 TSecr=2554078089"
"284","0.419586375","172.217.10.129","192.168.1.118","TLSv1.2","216","[TCP Spurious Retransmission] , Application Data"
"285","0.419639850","192.168.1.118","172.217.10.129","TCP","78","[TCP Window Update] 33086 → 443 [ACK] Seq=914 Ack=9689 Win=64128 Len=0 TSval=2285105491 TSecr=3062785053 SLE=9539 SRE=9689"
"286","0.419672650","172.217.10.129","192.168.1.118","TLSv1.2","954","[TCP Spurious Retransmission] , Application Data"
"287","0.419690125","192.168.1.118","172.217.10.129","TCP","78","[TCP Window Update] 33084 → 443 [ACK] Seq=916 Ack=10427 Win=64128 Len=0 TSval=2285105491 TSecr=3677706970 SLE=9539 SRE=10427"
"288","0.419725875","172.217.10.110","192.168.1.118","SSLv2","2902","Encrypted Data [TCP segment of a reassembled PDU]"
"289","0.419747963","192.168.1.118","172.217.10.110","TCP","66","43810 → 443 [ACK] Seq=1 Ack=83371 Win=1410 Len=0 TSval=2061957444 TSecr=2554078092"
"290","0.422181500","172.217.10.110","192.168.1.118","TCP","1484","443 → 43810 [ACK] Seq=83371 Ack=1 Win=244 Len=1418 TSval=2554078096 TSecr=2061957417 [TCP segment of a reassembled PDU]"
"291","0.422246650","192.168.1.118","172.217.10.110","TCP","66","43810 → 443 [ACK] Seq=1 Ack=84789 Win=1432 Len=0 TSval=2061957447 TSecr=2554078096"
"292","0.423951550","172.217.10.22","192.168.1.118","TLSv1.2","1484","Application Data"
"293","0.424020038","172.217.10.22","192.168.1.118","TLSv1.2","2902","Application Data, Application Data"
"294","0.424034550","172.217.10.110","192.168.1.118","TCP","1484","443 → 43810 [ACK] Seq=84789 Ack=1 Win=244 Len=1418 TSval=2554078096 TSecr=2061957417 [TCP segment of a reassembled PDU]"
"295","0.424065550","192.168.1.118","172.217.10.110","TCP","66","43810 → 443 [ACK] Seq=1 Ack=86207 Win=1454 Len=0 TSval=2061957449 TSecr=2554078096"
"296","0.424690363","192.168.1.118","172.217.10.22","TCP","66","47096 → 443 [ACK] Seq=892 Ack=19473 Win=468 Len=0 TSval=2862991814 TSecr=2454809006"
"297","0.474207338","172.217.10.22","192.168.1.118","TLSv1.2","1944","Application Data, Application Data"
"298","0.474277338","192.168.1.118","172.217.10.22","TCP","66","47096 → 443 [ACK] Seq=892 Ack=21351 Win=477 Len=0 TSval=2862991864 TSecr=2454809009"
"299","0.476823138","172.217.10.110","192.168.1.118","TCP","1484","443 → 43810 [ACK] Seq=86207 Ack=1 Win=244 Len=1418 TSval=2554078099 TSecr=2061957417 [TCP segment of a reassembled PDU]"
"300","0.476880613","192.168.1.118","172.217.10.110","TCP","66","43810 → 443 [ACK] Seq=1 Ack=87625 Win=1476 Len=0 TSval=2061957501 TSecr=2554078099"
"301","0.478336738","192.168.1.118","172.217.10.22","TLSv1.2","363","Application Data"
"302","0.481910400","172.217.10.110","192.168.1.118","TCP","1484","443 → 43810 [ACK] Seq=87625 Ack=1 Win=244 Len=1418 TSval=2554078099 TSecr=2061957417 [TCP segment of a reassembled PDU]"
"303","0.481973813","192.168.1.118","172.217.10.110","TCP","66","43810 → 443 [ACK] Seq=1 Ack=89043 Win=1498 Len=0 TSval=2061957506 TSecr=2554078099"
"304","0.482021488","172.217.10.110","192.168.1.118","TCP","2902","443 → 43810 [ACK] Seq=89043 Ack=1 Win=244 Len=2836 TSval=2554078103 TSecr=2061957417 [TCP segment of a reassembled PDU]"
"305","0.482038588","192.168.1.118","172.217.10.110","TCP","66","43810 → 443 [ACK] Seq=1 Ack=91879 Win=1543 Len=0 TSval=2061957506 TSecr=2554078103"
"306","0.482058825","172.217.10.110","192.168.1.118","TCP","1484","443 → 43810 [ACK] Seq=91879 Ack=1 Win=244 Len=1418 TSval=2554078106 TSecr=2061957417 [TCP segment of a reassembled PDU]"
"307","0.482073225","192.168.1.118","172.217.10.110","TCP","66","43810 → 443 [ACK] Seq=1 Ack=93297 Win=1565 Len=0 TSval=2061957507 TSecr=2554078106"
"308","0.482132563","172.217.10.22","192.168.1.118","TLSv1.2","1484","Application Data"
"309","0.482162600","172.217.10.22","192.168.1.118","TLSv1.2","1484","Application Data"
"310","0.482188050","172.217.10.22","192.168.1.118","TLSv1.2","2902","Application Data, Application Data"
"311","0.482210750","172.217.10.22","192.168.1.118","TLSv1.2","2902","Application Data, Application Data"
"312","0.482237350","172.217.10.110","192.168.1.118","TCP","1484","443 → 43810 [ACK] Seq=93297 Ack=1 Win=244 Len=1418 TSval=2554078106 TSecr=2061957417 [TCP segment of a reassembled PDU]"
"313","0.482251925","192.168.1.118","172.217.10.110","TCP","66","43810 → 443 [ACK] Seq=1 Ack=94715 Win=1587 Len=0 TSval=2061957507 TSecr=2554078106"
"314","0.487096325","172.217.10.22","192.168.1.118","TLSv1.2","1484","Application Data"
"315","0.487160163","172.217.10.22","192.168.1.118","TLSv1.2","1484","Application Data"
"316","0.487181638","172.217.10.22","192.168.1.118","TLSv1.2","2902","Application Data, Application Data"
"317","0.487201188","172.217.10.22","192.168.1.118","TLSv1.2","2902","Application Data, Application Data"
"318","0.488097300","172.217.10.22","192.168.1.118","TLSv1.2","2902","Application Data, Application Data"
"319","0.488127888","172.217.10.22","192.168.1.118","TLSv1.2","111","Application Data"
"320","0.488138463","172.217.10.22","192.168.1.118","TLSv1.2","2902","Application Data, Application Data"
"321","0.488152125","172.217.10.22","192.168.1.118","TLSv1.2","1797","Application Data, Application Data"
"322","0.488168413","172.217.10.22","192.168.1.118","TLSv1.2","2902","Application Data, Application Data"
"323","0.488184738","172.217.10.22","192.168.1.118","TLSv1.2","2902","Application Data, Application Data"
"324","0.488193088","172.217.10.22","192.168.1.118","TLSv1.2","997","Application Data"
"325","0.488203600","172.217.10.110","192.168.1.118","SSLv2","2902","Encrypted Data [TCP segment of a reassembled PDU]"
"326","0.488236263","192.168.1.118","172.217.10.110","TCP","66","43810 → 443 [ACK] Seq=1 Ack=97551 Win=1631 Len=0 TSval=2061957513 TSecr=2554078110"
"327","0.488275063","172.217.10.22","192.168.1.118","TLSv1.2","2902","Application Data, Application Data"
"328","0.488284888","172.217.10.22","192.168.1.118","TLSv1.2","260","Application Data"
"329","0.488295325","172.217.10.110","192.168.1.118","TCP","2902","443 → 43810 [ACK] Seq=97551 Ack=1 Win=244 Len=2836 TSval=2554078114 TSecr=2061957447 [TCP segment of a reassembled PDU]"
"330","0.488310200","192.168.1.118","172.217.10.110","TCP","66","43810 → 443 [ACK] Seq=1 Ack=100387 Win=1675 Len=0 TSval=2061957513 TSecr=2554078114"
"331","0.488326088","172.217.10.110","192.168.1.118","TCP","2902","443 → 43810 [ACK] Seq=100387 Ack=1 Win=244 Len=2836 TSval=2554078116 TSecr=2061957447 [TCP segment of a reassembled PDU]"
"332","0.488340600","192.168.1.118","172.217.10.110","TCP","66","43810 → 443 [ACK] Seq=1 Ack=103223 Win=1720 Len=0 TSval=2061957513 TSecr=2554078116"
"333","0.488356300","172.217.10.110","192.168.1.118","TCP","2902","443 → 43810 [ACK] Seq=103223 Ack=1 Win=244 Len=2836 TSval=2554078119 TSecr=2061957449 [TCP segment of a reassembled PDU]"
"334","0.488370888","192.168.1.118","172.217.10.110","TCP","66","43810 → 443 [ACK] Seq=1 Ack=106059 Win=1764 Len=0 TSval=2061957513 TSecr=2554078119"
"335","0.488386975","172.217.10.110","192.168.1.118","SSLv2","2902","Encrypted Data [TCP segment of a reassembled PDU]"
"336","0.488401113","192.168.1.118","172.217.10.110","TCP","66","43810 → 443 [ACK] Seq=1 Ack=108895 Win=1808 Len=0 TSval=2061957513 TSecr=2554078122"
"337","0.488433263","172.217.10.110","192.168.1.118","TCP","2902","443 → 43810 [ACK] Seq=108895 Ack=1 Win=244 Len=2836 TSval=2554078125 TSecr=2061957449 [TCP segment of a reassembled PDU]"
"338","0.488447875","192.168.1.118","172.217.10.110","TCP","66","43810 → 443 [ACK] Seq=1 Ack=111731 Win=1853 Len=0 TSval=2061957513 TSecr=2554078125"
"339","0.488463225","172.217.10.110","192.168.1.118","TCP","2902","443 → 43810 [ACK] Seq=111731 Ack=1 Win=244 Len=2836 TSval=2554078128 TSecr=2061957449 [TCP segment of a reassembled PDU]"
"340","0.488480425","172.217.10.110","192.168.1.118","TCP","2902","443 → 43810 [ACK] Seq=114567 Ack=1 Win=244 Len=2836 TSval=2554078131 TSecr=2061957449 [TCP segment of a reassembled PDU]"
"341","0.490438938","172.217.10.110","192.168.1.118","SSLv2","2902","Encrypted Data [TCP segment of a reassembled PDU]"
"342","0.490503088","172.217.10.110","192.168.1.118","TCP","2902","443 → 43810 [ACK] Seq=120239 Ack=1 Win=244 Len=2836 TSval=2554078136 TSecr=2061957449 [TCP segment of a reassembled PDU]"
"343","0.490596938","172.217.10.110","192.168.1.118","SSLv2","2902","Encrypted Data [TCP segment of a reassembled PDU]"
"344","0.490618638","172.217.10.110","192.168.1.118","TCP","2902","443 → 43810 [ACK] Seq=125911 Ack=1 Win=244 Len=2836 TSval=2554078142 TSecr=2061957449 [TCP segment of a reassembled PDU]"
"345","0.490643938","172.217.10.110","192.168.1.118","TCP","2902","443 → 43810 [ACK] Seq=128747 Ack=1 Win=244 Len=2836 TSval=2554078145 TSecr=2061957449 [TCP segment of a reassembled PDU]"
"346","0.490664713","172.217.10.110","192.168.1.118","SSLv2","2902","Encrypted Data [TCP segment of a reassembled PDU]"
"347","0.490685375","172.217.10.110","192.168.1.118","TCP","2902","443 → 43810 [ACK] Seq=134419 Ack=1 Win=244 Len=2836 TSval=2554078151 TSecr=2061957449 [TCP segment of a reassembled PDU]"
"348","0.490706463","172.217.10.110","192.168.1.118","TCP","2902","443 → 43810 [ACK] Seq=137255 Ack=1 Win=244 Len=2836 TSval=2554078153 TSecr=2061957449 [TCP segment of a reassembled PDU]"
"349","0.493045313","192.168.1.118","172.217.10.110","TCP","66","43810 → 443 [ACK] Seq=1 Ack=140091 Win=1632 Len=0 TSval=2061957517 TSecr=2554078128"
"350","0.495025450","172.217.10.110","192.168.1.118","SSLv2","2902","Encrypted Data [TCP segment of a reassembled PDU]"
"351","0.497533188","192.168.1.118","172.217.10.22","TCP","66","47090 → 443 [ACK] Seq=1189 Ack=30611 Win=433 Len=0 TSval=2862991887 TSecr=523137700"
"352","0.497745375","192.168.1.118","172.217.10.22","TCP","66","47092 → 443 [ACK] Seq=1189 Ack=29058 Win=439 Len=0 TSval=2862991887 TSecr=2454809018"
"353","0.497890613","192.168.1.118","172.217.10.22","TCP","66","47094 → 443 [ACK] Seq=1202 Ack=38698 Win=446 Len=0 TSval=2862991887 TSecr=1728945841"
"354","0.497992488","192.168.1.118","172.217.10.22","TCP","66","47088 → 443 [ACK] Seq=1189 Ack=36318 Win=422 Len=0 TSval=2862991887 TSecr=1265611026"
"355","0.498114113","192.168.1.118","172.217.10.110","TCP","66","43810 → 443 [ACK] Seq=1 Ack=142927 Win=1610 Len=0 TSval=2061957523 TSecr=2554078156"
"356","0.518787800","192.168.1.118","172.217.10.22","TLSv1.2","363","Application Data"
"357","0.518923250","192.168.1.118","172.217.10.22","TLSv1.2","363","Application Data"
"358","0.519071163","172.217.10.110","192.168.1.118","TCP","1484","443 → 43810 [ACK] Seq=142927 Ack=1 Win=244 Len=1418 TSval=2554078193 TSecr=2061957517 [TCP segment of a reassembled PDU]"
"359","0.519776388","192.168.1.118","172.217.10.22","TLSv1.2","363","Application Data"
"360","0.522114788","192.168.1.118","172.217.10.22","TLSv1.2","363","Application Data"
"361","0.525539838","172.217.10.110","192.168.1.118","TCP","1484","443 → 43810 [ACK] Seq=144345 Ack=1 Win=244 Len=1418 TSval=2554078193 TSecr=2061957517 [TCP segment of a reassembled PDU]"
"362","0.527362163","172.217.10.22","192.168.1.118","TLSv1.2","111","[TCP Spurious Retransmission] , Application Data"
"363","0.527447025","192.168.1.118","172.217.10.22","TCP","78","[TCP Dup ACK 353#1] 47094 → 443 [ACK] Seq=1499 Ack=38698 Win=501 Len=0 TSval=2862991917 TSecr=1728945934 SLE=38653 SRE=38698"
"364","0.527487463","172.217.10.22","192.168.1.118","TLSv1.2","260","[TCP Spurious Retransmission] , Application Data"
"365","0.527506025","192.168.1.118","172.217.10.22","TCP","78","[TCP Dup ACK 354#1] 47088 → 443 [ACK] Seq=1486 Ack=36318 Win=501 Len=0 TSval=2862991917 TSecr=1265611119 SLE=36124 SRE=36318"
"366","0.527517113","172.217.10.110","192.168.1.118","TCP","2902","443 → 43810 [ACK] Seq=145763 Ack=1 Win=244 Len=2836 TSval=2554078196 TSecr=2061957517 [TCP segment of a reassembled PDU]"
"367","0.527587963","172.217.10.22","192.168.1.118","TLSv1.2","379","[TCP Spurious Retransmission] , Application Data"
"368","0.527605813","192.168.1.118","172.217.10.22","TCP","78","[TCP Dup ACK 351#1] 47090 → 443 [ACK] Seq=1486 Ack=30611 Win=501 Len=0 TSval=2862991917 TSecr=523137793 SLE=30298 SRE=30611"
"369","0.527628488","172.217.10.110","192.168.1.118","TCP","2902","443 → 43810 [ACK] Seq=148599 Ack=1 Win=244 Len=2836 TSval=2554078201 TSecr=2061957517 [TCP segment of a reassembled PDU]"
"370","0.530655788","172.217.10.22","192.168.1.118","TLSv1.2","1484","Application Data"
"371","0.532541800","172.217.10.22","192.168.1.118","TLSv1.2","2902","Application Data, Application Data"
"372","0.532589775","172.217.10.110","192.168.1.118","TCP","2902","443 → 43810 [ACK] Seq=151435 Ack=1 Win=244 Len=2836 TSval=2554078205 TSecr=2061957517 [TCP segment of a reassembled PDU]"
"373","0.533290325","192.168.1.118","172.217.10.110","TCP","66","43810 → 443 [ACK] Seq=1 Ack=154271 Win=1522 Len=0 TSval=2061957558 TSecr=2554078193"
"374","0.533512025","192.168.1.118","172.217.10.22","TCP","66","47096 → 443 [ACK] Seq=1189 Ack=25605 Win=468 Len=0 TSval=2862991923 TSecr=2454809116"
"375","0.533777000","172.217.10.22","192.168.1.118","TLSv1.2","2568","Application Data, Application Data"
"376","0.534829600","192.168.1.118","172.217.10.22","TCP","66","47096 → 443 [ACK] Seq=1189 Ack=28107 Win=449 Len=0 TSval=2862991924 TSecr=2454809118"
"377","0.536128863","172.217.10.110","192.168.1.118","SSLv2","1484","Encrypted Data [TCP segment of a reassembled PDU]"
"378","0.543173238","172.217.10.22","192.168.1.118","TLSv1.2","1484","Application Data"
"379","0.543247025","172.217.10.22","192.168.1.118","TLSv1.2","2407","Application Data, Application Data"
"380","0.543262438","172.217.10.110","192.168.1.118","TCP","1484","443 → 43810 [ACK] Seq=155689 Ack=1 Win=244 Len=1418 TSval=2554078210 TSecr=2061957517 [TCP segment of a reassembled PDU]"
"381","0.543321300","172.217.10.22","192.168.1.118","TLSv1.2","1484","Application Data"
"382","0.543358075","192.168.1.118","172.217.10.22","TCP","66","47090 → 443 [ACK] Seq=1486 Ack=32029 Win=493 Len=0 TSval=2862991933 TSecr=523137807"
"383","0.543397913","172.217.10.22","192.168.1.118","TLSv1.2","1484","Application Data"
"384","0.543435563","192.168.1.118","172.217.10.22","TCP","66","47094 → 443 [ACK] Seq=1499 Ack=40116 Win=493 Len=0 TSval=2862991933 TSecr=1728945949"
"385","0.543452313","172.217.10.22","192.168.1.118","TLSv1.2","1484","Application Data"
"386","0.543471288","192.168.1.118","172.217.10.22","TCP","66","47088 → 443 [ACK] Seq=1486 Ack=37736 Win=493 Len=0 TSval=2862991933 TSecr=1265611133"
"387","0.543487400","172.217.10.22","192.168.1.118","TLSv1.2","1484","Application Data"
"388","0.543501800","192.168.1.118","172.217.10.22","TCP","66","47090 → 443 [ACK] Seq=1486 Ack=33447 Win=482 Len=0 TSval=2862991933 TSecr=523137807"
"389","0.543523638","172.217.10.22","192.168.1.118","TLSv1.2","2902","Application Data, Application Data"
"390","0.543541038","192.168.1.118","172.217.10.22","TCP","66","47094 → 443 [ACK] Seq=1499 Ack=42952 Win=471 Len=0 TSval=2862991933 TSecr=1728945949"
"391","0.543563188","172.217.10.22","192.168.1.118","TLSv1.2","2902","Application Data, Application Data"
"392","0.543579213","192.168.1.118","172.217.10.22","TCP","66","47088 → 443 [ACK] Seq=1486 Ack=40572 Win=471 Len=0 TSval=2862991933 TSecr=1265611134"
"393","0.543620850","172.217.10.22","192.168.1.118","TLSv1.2","2902","Application Data, Application Data"
"394","0.543636725","192.168.1.118","172.217.10.22","TCP","66","47090 → 443 [ACK] Seq=1486 Ack=36283 Win=460 Len=0 TSval=2862991933 TSecr=523137809"
"395","0.543648000","172.217.10.110","192.168.1.118","TCP","2902","443 → 43810 [ACK] Seq=157107 Ack=1 Win=244 Len=2836 TSval=2554078215 TSecr=2061957517 [TCP segment of a reassembled PDU]"
"396","0.545759400","192.168.1.118","172.217.10.110","TCP","66","43810 → 443 [ACK] Seq=1 Ack=159943 Win=1478 Len=0 TSval=2061957570 TSecr=2554078210"
"397","0.545998475","172.217.10.22","192.168.1.118","TLSv1.2","2280","Application Data, Application Data"
"398","0.546036650","192.168.1.118","172.217.10.22","TCP","66","47090 → 443 [ACK] Seq=1486 Ack=38497 Win=443 Len=0 TSval=2862991935 TSecr=523137811"
"399","0.546055338","172.217.10.22","192.168.1.118","TLSv1.2","2902","Application Data, Application Data"
"400","0.546074163","192.168.1.118","172.217.10.22","TCP","66","47094 → 443 [ACK] Seq=1499 Ack=45788 Win=449 Len=0 TSval=2862991936 TSecr=1728945951"
"401","0.546084525","172.217.10.22","192.168.1.118","TLSv1.2","373","Application Data"
"402","0.546100950","192.168.1.118","172.217.10.22","TCP","66","47094 → 443 [ACK] Seq=1499 Ack=46095 Win=447 Len=0 TSval=2862991936 TSecr=1728945953"
"403","0.546117525","172.217.10.22","192.168.1.118","TLSv1.2","2902","Application Data, Application Data"
"404","0.546135000","192.168.1.118","172.217.10.22","TCP","66","47088 → 443 [ACK] Seq=1486 Ack=43408 Win=449 Len=0 TSval=2862991936 TSecr=1265611136"
"405","0.546151113","172.217.10.22","192.168.1.118","TLSv1.2","1931","Application Data, Application Data"
"406","0.546166575","192.168.1.118","172.217.10.22","TCP","66","47088 → 443 [ACK] Seq=1486 Ack=45273 Win=435 Len=0 TSval=2862991936 TSecr=1265611138"
"407","0.546184513","172.217.10.110","192.168.1.118","TCP","1484","443 → 43810 [ACK] Seq=159943 Ack=1 Win=244 Len=1418 TSval=2554078220 TSecr=2061957517 [TCP segment of a reassembled PDU]"
"408","0.552703400","192.168.1.118","172.217.10.22","TCP","66","47092 → 443 [ACK] Seq=1486 Ack=32817 Win=472 Len=0 TSval=2862991942 TSecr=2454809124"
"409","0.552833925","172.217.10.110","192.168.1.118","TCP","1484","443 → 43810 [ACK] Seq=161361 Ack=1 Win=244 Len=1418 TSval=2554078220 TSecr=2061957517 [TCP segment of a reassembled PDU]"
"410","0.553248000","192.168.1.118","172.217.10.22","TLSv1.2","363","Application Data"
"411","0.553316150","192.168.1.118","172.217.10.110","TCP","66","43810 → 443 [ACK] Seq=1 Ack=162779 Win=1456 Len=0 TSval=2061957578 TSecr=2554078220"
"412","0.556347975","172.217.10.110","192.168.1.118","TCP","2902","443 → 43810 [ACK] Seq=162779 Ack=1 Win=244 Len=2836 TSval=2554078224 TSecr=2061957523 [TCP segment of a reassembled PDU]"
"413","0.556431263","192.168.1.118","172.217.10.110","TCP","66","43810 → 443 [ACK] Seq=1 Ack=165615 Win=1540 Len=0 TSval=2061957581 TSecr=2554078224"
"414","0.556485700","172.217.10.110","192.168.1.118","SSLv2","2902","Encrypted Data [TCP segment of a reassembled PDU]"
"415","0.557872100","172.217.10.110","192.168.1.118","TCP","2902","443 → 43810 [PSH, ACK] Seq=168451 Ack=1 Win=244 Len=2836 TSval=2554078231 TSecr=2061957558 [TCP segment of a reassembled PDU]"
"416","0.559438913","172.217.10.110","192.168.1.118","TCP","1484","443 → 43810 [ACK] Seq=171287 Ack=1 Win=244 Len=1418 TSval=2554078235 TSecr=2061957558 [TCP segment of a reassembled PDU]"
"417","0.560447950","172.217.10.110","192.168.1.118","TCP","1484","443 → 43810 [ACK] Seq=172705 Ack=1 Win=244 Len=1418 TSval=2554078235 TSecr=2061957558 [TCP segment of a reassembled PDU]"
"418","0.562952613","172.217.10.110","192.168.1.118","TCP","1484","443 → 43810 [ACK] Seq=174123 Ack=1 Win=244 Len=1418 TSval=2554078239 TSecr=2061957558 [TCP segment of a reassembled PDU]"
"419","0.564353463","192.168.1.118","172.217.10.110","TCP","66","43810 → 443 [ACK] Seq=1 Ack=175541 Win=1463 Len=0 TSval=2061957589 TSecr=2554078228"
"420","0.565881413","192.168.1.118","172.217.10.22","TLSv1.2","363","Application Data"
"421","0.569591213","172.217.10.110","192.168.1.118","TCP","1484","443 → 43810 [ACK] Seq=175541 Ack=1 Win=244 Len=1418 TSval=2554078239 TSecr=2061957558 [TCP segment of a reassembled PDU]"
"422","0.569653675","172.217.10.110","192.168.1.118","TCP","2902","443 → 43810 [ACK] Seq=176959 Ack=1 Win=244 Len=2836 TSval=2554078242 TSecr=2061957558 [TCP segment of a reassembled PDU]"
"423","0.573935475","172.217.10.110","192.168.1.118","TCP","1484","443 → 43810 [ACK] Seq=179795 Ack=1 Win=244 Len=1418 TSval=2554078246 TSecr=2061957558 [TCP segment of a reassembled PDU]"
"424","0.576520375","172.217.10.110","192.168.1.118","TCP","1484","443 → 43810 [ACK] Seq=181213 Ack=1 Win=244 Len=1418 TSval=2554078246 TSecr=2061957558 [TCP segment of a reassembled PDU]"
"425","0.576579613","172.217.10.110","192.168.1.118","TCP","2902","443 → 43810 [ACK] Seq=182631 Ack=1 Win=244 Len=2836 TSval=2554078249 TSecr=2061957558 [TCP segment of a reassembled PDU]"
"426","0.577957750","172.217.10.22","192.168.1.118","TLSv1.2","1484","Application Data"
"427","0.578016438","172.217.10.22","192.168.1.118","TLSv1.2","1484","Application Data"
"428","0.579603063","172.217.10.22","192.168.1.118","TLSv1.2","1484","Application Data"
"429","0.579674725","172.217.10.110","192.168.1.118","TCP","2902","443 → 43810 [ACK] Seq=185467 Ack=1 Win=244 Len=2836 TSval=2554078253 TSecr=2061957558 [TCP segment of a reassembled PDU]"
"430","0.579686225","172.217.10.22","192.168.1.118","TLSv1.2","2902","Application Data, Application Data"
"431","0.581358638","192.168.1.118","172.217.10.110","TCP","66","43810 → 443 [ACK] Seq=1 Ack=188303 Win=1364 Len=0 TSval=2061957606 TSecr=2554078239"
"432","0.582432738","192.168.1.118","172.217.10.22","TCP","66","47096 → 443 [ACK] Seq=1486 Ack=35197 Win=446 Len=0 TSval=2862991972 TSecr=2454809162"
"433","0.584539200","192.168.1.118","172.217.10.22","TLSv1.2","363","Application Data"
"434","0.584678388","192.168.1.118","172.217.10.22","TLSv1.2","363","Application Data"
"435","0.587422438","172.217.10.22","192.168.1.118","TLSv1.2","2902","Application Data, Application Data"
"436","0.587492625","192.168.1.118","172.217.10.22","TCP","66","47096 → 443 [ACK] Seq=1486 Ack=38033 Win=477 Len=0 TSval=2862991977 TSecr=2454809166"
"437","0.587524513","172.217.10.22","192.168.1.118","TLSv1.2","1234","Application Data"
"438","0.587538800","172.217.10.110","192.168.1.118","TCP","2902","443 → 43810 [ACK] Seq=188303 Ack=1 Win=244 Len=2836 TSval=2554078256 TSecr=2061957558 [TCP segment of a reassembled PDU]"
"439","0.587900100","192.168.1.118","172.217.10.110","TCP","66","43810 → 443 [ACK] Seq=1 Ack=191139 Win=1342 Len=0 TSval=2061957612 TSecr=2554078256"
"440","0.588583088","172.217.10.110","192.168.1.118","TCP","2902","443 → 43810 [ACK] Seq=191139 Ack=1 Win=244 Len=2836 TSval=2554078260 TSecr=2061957589 [TCP segment of a reassembled PDU]"
"441","0.588622100","172.217.10.110","192.168.1.118","SSLv2","1484","Encrypted Data [TCP segment of a reassembled PDU]"
"442","0.589658838","172.217.10.110","192.168.1.118","TCP","1484","443 → 43810 [ACK] Seq=195393 Ack=1 Win=244 Len=1418 TSval=2554078263 TSecr=2061957589 [TCP segment of a reassembled PDU]"
"443","0.591723100","172.217.10.22","192.168.1.118","TLSv1.2","1484","Application Data"
"444","0.593089300","172.217.10.22","192.168.1.118","TLSv1.2","2902","Application Data, Application Data"
"445","0.593136450","172.217.10.110","192.168.1.118","SSLv2","2902","Encrypted Data [TCP segment of a reassembled PDU]"
"446","0.595968888","192.168.1.118","172.217.10.22","TCP","66","47092 → 443 [ACK] Seq=1783 Ack=37071 Win=468 Len=0 TSval=2862991985 TSecr=2454809177"
"447","0.597897688","192.168.1.118","172.217.10.110","TCP","66","43810 → 443 [ACK] Seq=1 Ack=199647 Win=1276 Len=0 TSval=2061957622 TSecr=2554078260"
"448","0.601129400","172.217.10.110","192.168.1.118","SSLv2","1869","Encrypted Data [TCP segment of a reassembled PDU]"
"449","0.601194325","192.168.1.118","172.217.10.110","TCP","66","43810 → 443 [ACK] Seq=1 Ack=201450 Win=1380 Len=0 TSval=2061957626 TSecr=2554078271"
"450","0.601233775","172.217.10.22","192.168.1.118","TLSv1.2","2902","Application Data, Application Data"
"451","0.601250663","192.168.1.118","172.217.10.22","TCP","66","47092 → 443 [ACK] Seq=1783 Ack=39907 Win=477 Len=0 TSval=2862991991 TSecr=2454809180"
"452","0.601274938","172.217.10.22","192.168.1.118","TLSv1.2","2902","Application Data, Application Data"
"453","0.601294175","172.217.10.22","192.168.1.118","TLSv1.2","2471","Application Data, Application Data"
"454","0.601374600","192.168.1.118","172.217.10.22","TCP","66","47092 → 443 [ACK] Seq=1783 Ack=45148 Win=437 Len=0 TSval=2862991991 TSecr=2454809182"
"455","0.622386275","172.217.10.22","192.168.1.118","TLSv1.2","1484","Application Data"
"456","0.624226438","172.217.10.22","192.168.1.118","TLSv1.2","1484","Application Data"
"457","0.624295225","172.217.10.22","192.168.1.118","TLSv1.2","2902","Application Data, Application Data"
"458","0.624314150","172.217.10.22","192.168.1.118","TLSv1.2","1484","Application Data"
"459","0.624370088","172.217.10.22","192.168.1.118","TLSv1.2","1484","Application Data"
"460","0.624400088","172.217.10.22","192.168.1.118","TLSv1.2","2894","Application Data, Application Data"
"461","0.624435938","172.217.10.22","192.168.1.118","TLSv1.2","2902","Application Data, Application Data"
"462","0.625345600","172.217.10.22","192.168.1.118","TLSv1.2","2902","Application Data, Application Data"
"463","0.626176675","172.217.10.22","192.168.1.118","TLSv1.2","922","Application Data"
"464","0.628477300","192.168.1.118","172.217.10.22","TCP","66","47096 → 443 [ACK] Seq=1486 Ack=39201 Win=501 Len=0 TSval=2862992018 TSecr=2454809168"
"465","0.640822450","192.168.1.118","172.217.10.22","TCP","66","47088 → 443 [ACK] Seq=1783 Ack=52355 Win=446 Len=0 TSval=2862992030 TSecr=1265611214"
"466","0.641000400","192.168.1.118","172.217.10.22","TCP","66","47090 → 443 [ACK] Seq=1783 Ack=49279 Win=417 Len=0 TSval=2862992030 TSecr=523137887"
"467","0.672050713","192.168.1.118","172.217.12.142","TLSv1.2","275","Application Data"
"468","0.674639188","192.168.1.118","172.217.10.110","TLSv1.2","356","Application Data"
"469","0.689442600","192.168.1.118","172.217.10.110","TLSv1.2","360","Application Data"
"470","0.697356038","172.217.10.110","192.168.1.118","TCP","66","443 → 43804 [ACK] Seq=1 Ack=291 Win=248 Len=0 TSval=2554078373 TSecr=2061957699"
"471","0.703032913","172.217.12.142","192.168.1.118","TLSv1.2","1484","Application Data"
"472","0.703109900","192.168.1.118","172.217.12.142","TCP","66","39748 → 443 [ACK] Seq=210 Ack=1419 Win=493 Len=0 TSval=393366630 TSecr=3207914208"
"473","0.703160675","172.217.12.142","192.168.1.118","TLSv1.2","2902","Application Data, Application Data"
"474","0.703179863","192.168.1.118","172.217.12.142","TCP","66","39748 → 443 [ACK] Seq=210 Ack=4255 Win=471 Len=0 TSval=393366630 TSecr=3207914208"
"475","0.704673063","172.217.10.110","192.168.1.118","TLSv1.2","1484","Application Data"
"476","0.704734600","192.168.1.118","172.217.10.110","TCP","66","43804 → 443 [ACK] Seq=291 Ack=1419 Win=523 Len=0 TSval=2061957729 TSecr=2554078374"
"477","0.704776200","172.217.10.110","192.168.1.118","TLSv1.2","1241","Application Data"
"478","0.704796888","192.168.1.118","172.217.10.110","TCP","66","43804 → 443 [ACK] Seq=291 Ack=2594 Win=545 Len=0 TSval=2061957729 TSecr=2554078374"
"479","0.704809688","172.217.10.110","192.168.1.118","TLSv1.2","1484","Application Data"
"480","0.704836425","192.168.1.118","172.217.10.110","TCP","66","43806 → 443 [ACK] Seq=295 Ack=1419 Win=493 Len=0 TSval=2061957729 TSecr=17636067"
"481","0.704851900","172.217.10.110","192.168.1.118","TLSv1.2","2902","Application Data, Application Data"
"482","0.704868663","192.168.1.118","172.217.10.110","TCP","66","43806 → 443 [ACK] Seq=295 Ack=4255 Win=471 Len=0 TSval=2061957729 TSecr=17636067"
"483","0.704881350","172.217.12.142","192.168.1.118","TLSv1.2","2902","Application Data, Application Data"
"484","0.704899125","192.168.1.118","172.217.12.142","TCP","66","39748 → 443 [ACK] Seq=210 Ack=7091 Win=449 Len=0 TSval=393366631 TSecr=3207914208"
"485","0.704915400","172.217.12.142","192.168.1.118","TLSv1.2","2902","Application Data, Application Data"
"486","0.704933600","192.168.1.118","172.217.12.142","TCP","66","39748 → 443 [ACK] Seq=210 Ack=9927 Win=427 Len=0 TSval=393366631 TSecr=3207914210"
"487","0.708032500","172.217.10.110","192.168.1.118","TLSv1.2","1484","Application Data"
"488","0.708097463","192.168.1.118","172.217.10.110","TCP","66","43806 → 443 [ACK] Seq=295 Ack=5673 Win=460 Len=0 TSval=2061957733 TSecr=17636068"
"489","0.708138475","172.217.12.142","192.168.1.118","TLSv1.2","2902","Application Data, Application Data"
"490","0.708161625","192.168.1.118","172.217.12.142","TCP","66","39748 → 443 [ACK] Seq=210 Ack=12763 Win=405 Len=0 TSval=393366635 TSecr=3207914212"
"491","0.708170613","172.217.10.110","192.168.1.118","TLSv1.2","1484","[TCP Previous segment not captured] , Application Data"
"492","0.708186088","192.168.1.118","172.217.10.110","TCP","78","[TCP Dup ACK 488#1] 43806 → 443 [ACK] Seq=295 Ack=5673 Win=460 Len=0 TSval=2061957733 TSecr=17636068 SLE=7091 SRE=8509"
"493","0.708248950","172.217.10.110","192.168.1.118","TLSv1.2","1484","Application Data"
"494","0.708266013","192.168.1.118","172.217.10.110","TCP","78","[TCP Dup ACK 488#2] 43806 → 443 [ACK] Seq=295 Ack=5673 Win=460 Len=0 TSval=2061957733 TSecr=17636068 SLE=7091 SRE=9927"
"495","0.708282313","172.217.10.110","192.168.1.118","TLSv1.2","1484","[TCP Fast Retransmission] , Application Data"
"496","0.708299000","192.168.1.118","172.217.10.110","TCP","66","43806 → 443 [ACK] Seq=295 Ack=9927 Win=427 Len=0 TSval=2061957733 TSecr=17636068"
"497","0.708329050","172.217.10.110","192.168.1.118","TLSv1.2","2902","Application Data, Application Data"
"498","0.708345413","192.168.1.118","172.217.10.110","TCP","66","43806 → 443 [ACK] Seq=295 Ack=12763 Win=405 Len=0 TSval=2061957733 TSecr=17636070"
"499","0.708364900","172.217.10.110","192.168.1.118","TLSv1.2","2902","Application Data, Application Data"
"500","0.708379375","192.168.1.118","172.217.10.110","TCP","66","43806 → 443 [ACK] Seq=295 Ack=15599 Win=383 Len=0 TSval=2061957733 TSecr=17636071"
"501","0.708388150","172.217.10.110","192.168.1.118","TLSv1.2","140","Application Data"
"502","0.708402038","192.168.1.118","172.217.10.110","TCP","66","43806 → 443 [ACK] Seq=295 Ack=15673 Win=383 Len=0 TSval=2061957733 TSecr=17636072"
"503","0.708434575","172.217.12.142","192.168.1.118","TLSv1.2","2902","Application Data, Application Data"
"504","0.708452738","192.168.1.118","172.217.12.142","TCP","66","39748 → 443 [ACK] Seq=210 Ack=15599 Win=383 Len=0 TSval=393366635 TSecr=3207914214"
"505","0.708463713","172.217.12.142","192.168.1.118","TLSv1.2","1484","Application Data"
"506","0.708477613","192.168.1.118","172.217.12.142","TCP","66","39748 → 443 [ACK] Seq=210 Ack=17017 Win=372 Len=0 TSval=393366635 TSecr=3207914216"
"507","0.712172100","172.217.12.142","192.168.1.118","TLSv1.2","1484","Application Data"
"508","0.712237600","192.168.1.118","172.217.12.142","TCP","66","39748 → 443 [ACK] Seq=210 Ack=18435 Win=361 Len=0 TSval=393366639 TSecr=3207914216"
"509","0.712290675","172.217.12.142","192.168.1.118","TLSv1.2","2902","Application Data, Application Data"
"510","0.712310463","192.168.1.118","172.217.12.142","TCP","66","39748 → 443 [ACK] Seq=210 Ack=21271 Win=339 Len=0 TSval=393366639 TSecr=3207914217"
"511","0.714513875","172.217.12.142","192.168.1.118","TLSv1.2","1484","Application Data"
"512","0.714575438","192.168.1.118","172.217.12.142","TCP","66","39748 → 443 [ACK] Seq=210 Ack=22689 Win=328 Len=0 TSval=393366641 TSecr=3207914225"
"513","0.717761675","172.217.12.142","192.168.1.118","TLSv1.2","1484","Application Data"
"514","0.717832338","192.168.1.118","172.217.12.142","TCP","66","39748 → 443 [ACK] Seq=210 Ack=24107 Win=317 Len=0 TSval=393366644 TSecr=3207914225"
"515","0.720105738","172.217.12.142","192.168.1.118","TLSv1.2","2902","Application Data, Application Data"
"516","0.720164325","172.217.12.142","192.168.1.118","TLSv1.2","2902","Application Data, Application Data"
"517","0.720853075","192.168.1.118","172.217.12.142","TCP","66","39748 → 443 [ACK] Seq=210 Ack=29779 Win=273 Len=0 TSval=393366647 TSecr=3207914225"
"518","0.726191075","172.217.12.142","192.168.1.118","TLSv1.2","2902","Application Data, Application Data"
"519","0.726257213","192.168.1.118","172.217.12.142","TCP","66","39748 → 443 [ACK] Seq=210 Ack=32615 Win=413 Len=0 TSval=393366653 TSecr=3207914229"
"520","0.726298100","172.217.12.142","192.168.1.118","TLSv1.2","2448","Application Data, Application Data, Application Data"
"521","0.726313638","172.217.10.110","192.168.1.118","TCP","66","[TCP Dup ACK 479#1] 443 → 43806 [ACK] Seq=15673 Ack=295 Win=248 Len=0 TSval=17636089 TSecr=2061957733"
"522","0.726526413","192.168.1.118","172.217.12.142","TCP","66","39748 → 443 [ACK] Seq=210 Ack=34997 Win=395 Len=0 TSval=393366653 TSecr=3207914231"
"523","0.929635563","192.168.1.118","239.255.255.250","SSDP","218","M-SEARCH * HTTP/1.1 "
"524","1.315635263","192.168.1.118","192.168.1.102","TCP","176","35182 → 8009 [PSH, ACK] Seq=1 Ack=1 Win=501 Len=110 TSval=2821271055 TSecr=6170964 [TCP segment of a reassembled PDU]"
"525","1.321299100","192.168.1.102","192.168.1.118","TCP","176","8009 → 35182 [PSH, ACK] Seq=1 Ack=111 Win=277 Len=110 TSval=6171466 TSecr=2821271055 [TCP segment of a reassembled PDU]"
"526","1.321386213","192.168.1.118","192.168.1.102","TCP","66","35182 → 8009 [ACK] Seq=111 Ack=111 Win=501 Len=0 TSval=2821271061 TSecr=6171466"
"527","1.931450975","192.168.1.118","239.255.255.250","SSDP","218","M-SEARCH * HTTP/1.1 "
"528","1.955498975","192.168.1.104","255.255.255.255","UDP","217","49154 → 6666 Len=175"
"529","2.506208150","192.168.1.118","209.18.47.62","DNS","75","Standard query 0x0c95 A www.gstatic.com"
"530","2.526678050","209.18.47.62","192.168.1.118","DNS","91","Standard query response 0x0c95 A www.gstatic.com A 172.217.7.3"
"531","2.527802250","192.168.1.118","172.217.7.3","TCP","74","40070 → 80 [SYN] Seq=0 Win=64240 Len=0 MSS=1460 SACK_PERM=1 TSval=2024626566 TSecr=0 WS=128"
"532","2.548369300","172.217.7.3","192.168.1.118","TCP","74","80 → 40070 [SYN, ACK] Seq=0 Ack=1 Win=60192 Len=0 MSS=1380 SACK_PERM=1 TSval=2804053090 TSecr=2024626566 WS=256"
"533","2.548502163","192.168.1.118","172.217.7.3","TCP","66","40070 → 80 [ACK] Seq=1 Ack=1 Win=64256 Len=0 TSval=2024626587 TSecr=2804053090"
"534","2.549253313","192.168.1.118","172.217.7.3","HTTP","348","GET /generate_204 HTTP/1.1 "
"535","2.549926213","192.168.1.118","172.217.10.110","TLSv1.2","302","Application Data"
"536","2.573162900","172.217.7.3","192.168.1.118","TCP","66","80 → 40070 [ACK] Seq=1 Ack=283 Win=61440 Len=0 TSval=2804053113 TSecr=2024626588"
"537","2.574471125","172.217.7.3","192.168.1.118","HTTP","149","HTTP/1.1 204 No Content "
"538","2.574527250","192.168.1.118","172.217.7.3","TCP","66","40070 → 80 [ACK] Seq=283 Ack=84 Win=64256 Len=0 TSval=2024626613 TSecr=2804053114"
"539","2.576099600","172.217.10.110","192.168.1.118","TLSv1.2","1484","Application Data"
"540","2.576169500","192.168.1.118","172.217.10.110","TCP","66","43804 → 443 [ACK] Seq=527 Ack=4012 Win=568 Len=0 TSval=2061959601 TSecr=2554080251"
"541","2.577624200","172.217.10.110","192.168.1.118","TLSv1.2","1484","Application Data"
"542","2.577692175","192.168.1.118","172.217.10.110","TCP","66","43804 → 443 [ACK] Seq=527 Ack=5430 Win=590 Len=0 TSval=2061959602 TSecr=2554080252"
"543","2.579510725","172.217.10.110","192.168.1.118","TLSv1.2","1484","Application Data"
"544","2.579572438","192.168.1.118","172.217.10.110","TCP","66","43804 → 443 [ACK] Seq=527 Ack=6848 Win=612 Len=0 TSval=2061959604 TSecr=2554080252"
"545","2.579624275","172.217.10.110","192.168.1.118","TLSv1.2","1484","Application Data"
"546","2.579644513","192.168.1.118","172.217.10.110","TCP","66","43804 → 443 [ACK] Seq=527 Ack=8266 Win=634 Len=0 TSval=2061959604 TSecr=2554080253"
"547","2.582207350","172.217.10.110","192.168.1.118","TLSv1.2","1484","Application Data"
"548","2.582270638","192.168.1.118","172.217.10.110","TCP","66","43804 → 443 [ACK] Seq=527 Ack=9684 Win=656 Len=0 TSval=2061959607 TSecr=2554080253"
"549","2.588228050","172.217.10.110","192.168.1.118","TLSv1.2","2902","Application Data, Application Data"
"550","2.588296700","192.168.1.118","172.217.10.110","TCP","66","43804 → 443 [ACK] Seq=527 Ack=12520 Win=701 Len=0 TSval=2061959613 TSecr=2554080254"
"551","2.588338138","172.217.10.110","192.168.1.118","TLSv1.2","2902","Application Data, Application Data"
"552","2.588354963","192.168.1.118","172.217.10.110","TCP","66","43804 → 443 [ACK] Seq=527 Ack=15356 Win=745 Len=0 TSval=2061959613 TSecr=2554080256"
"553","2.588424188","172.217.10.110","192.168.1.118","TLSv1.2","2902","Application Data, Application Data"
"554","2.588440338","192.168.1.118","172.217.10.110","TCP","66","43804 → 443 [ACK] Seq=527 Ack=18192 Win=789 Len=0 TSval=2061959613 TSecr=2554080257"
"555","2.588456625","172.217.10.110","192.168.1.118","TLSv1.2","1771","Application Data, Application Data"
"556","2.588472463","192.168.1.118","172.217.10.110","TCP","66","43804 → 443 [ACK] Seq=527 Ack=19897 Win=776 Len=0 TSval=2061959613 TSecr=2554080258"
"557","2.931904263","192.168.1.118","239.255.255.250","SSDP","218","M-SEARCH * HTTP/1.1 "
"558","3.932053788","192.168.1.118","239.255.255.250","SSDP","218","M-SEARCH * HTTP/1.1 "
"559","4.654624413","192.168.1.118","172.253.63.188","TLSv1.2","99","Application Data"
"560","4.688224913","172.253.63.188","192.168.1.118","TCP","66","5228 → 41484 [ACK] Seq=1 Ack=34 Win=248 Len=0 TSval=3879310673 TSecr=2264370787"
"561","4.697517388","172.253.63.188","192.168.1.118","TLSv1.2","99","Application Data"
"562","4.697865625","192.168.1.118","172.253.63.188","TLSv1.2","109","Application Data"
"563","4.735295775","172.253.63.188","192.168.1.118","TCP","66","5228 → 41484 [ACK] Seq=34 Ack=77 Win=248 Len=0 TSval=3879310719 TSecr=2264370830"
"564","4.924455263","192.168.1.104","255.255.255.255","UDP","217","49154 → 6666 Len=175"
"565","6.326550588","192.168.1.118","192.168.1.102","TCP","176","35182 → 8009 [PSH, ACK] Seq=111 Ack=111 Win=501 Len=110 TSval=2821276066 TSecr=6171466 [TCP segment of a reassembled PDU]"
"566","6.333767413","192.168.1.102","192.168.1.118","TCP","176","8009 → 35182 [PSH, ACK] Seq=111 Ack=221 Win=277 Len=110 TSval=6171967 TSecr=2821276066 [TCP segment of a reassembled PDU]"
"567","6.333853413","192.168.1.118","192.168.1.102","TCP","66","35182 → 8009 [ACK] Seq=221 Ack=221 Win=501 Len=0 TSval=2821276073 TSecr=6171967"
"568","7.895867150","192.168.1.104","255.255.255.255","UDP","217","49154 → 6666 Len=175"
"569","8.819087313","192.168.1.101","224.0.0.251","MDNS","606","Standard query 0x0000 PTR _googlecast._tcp.local, "QU" question PTR _homekit._tcp.local, "QU" question PTR _uscan._tcp.local, "QU" question PTR _ptp._tcp.local, "QU" question PTR _ippusb._tcp.local, "QU" question PTR _scanner._tcp.local, "QU" question PTR _ipp._tcp.local, "QU" question PTR _pdl-datastream._tcp.local, "QU" question PTR _uscans._tcp.local, "QU" question PTR _ipps._tcp.local, "QU" question PTR _printer._tcp.local, "QU" question PTR _airplay._tcp.local, "QU" question PTR _raop._tcp.local, "QU" question PTR _airport._tcp.local, "QU" question PTR _rdlink._tcp.local, "QU" question PTR _companion-link._tcp.local, "QU" question PTR _afpovertcp._tcp.local, "QU" question PTR _rfb._tcp.local, "QU" question PTR _adisk._tcp.local, "QU" question PTR _apple-mobdev._tcp.local, "QU" question PTR 8ed307c3._sub._apple-mobdev2._tcp.local, "QU" question PTR _apple-pairable._tcp.local, "QU" question TXT Google-Home-Mini-2c3f16b2da5c4b6fd6cfbfba61c12490._googlecast._tcp.local, "QU" question ANY cjqg._smb._tcp.local, "QU" question ANY cjqg._companion-link._tcp.local, "QU" question PTR Google-Home-Mini-2c3f16b2da5c4b6fd6cfbfba61c12490._googlecast._tcp.local PTR cjqg._companion-link._tcp.local SRV 0 0 445 cjqg.local SRV 0 0 53785 cjqg.local OPT"
"570","8.923248163","192.168.1.100","224.0.0.251","MDNS","288","Standard query response 0x0000 PTR _smb._tcp.local TXT TXT OPT"
"571","8.924477563","Google_52:20:d9","Broadcast","ARP","42","Who has 192.168.1.100? Tell 192.168.1.102"
"572","9.122589463","192.168.1.101","224.0.0.251","MDNS","181","Standard query 0x0000 ANY cjqg._smb._tcp.local, "QM" question ANY cjqg._companion-link._tcp.local, "QM" question SRV 0 0 445 cjqg.local SRV 0 0 53785 cjqg.local OPT"
"573","9.125022600","fe80::1814:2ecf:2c8a:d90d","ff02::fb","MDNS","201","Standard query 0x0000 ANY cjqg._smb._tcp.local, "QM" question ANY cjqg._companion-link._tcp.local, "QM" question SRV 0 0 445 cjqg.local SRV 0 0 53785 cjqg.local OPT"
"574","9.127534913","fe80::1cc7:6d9a:a312:7e8f","ff02::fb","MDNS","195","Standard query 0x0000 ANY cjqg._smb._tcp.local, "QM" question ANY cjqg._companion-link._tcp.local, "QM" question SRV 0 0 445 cjqg.local SRV 0 0 53785 cjqg.local OPT"
"575","9.129996963","192.168.1.100","224.0.0.251","MDNS","175","Standard query 0x0000 ANY cjqg._smb._tcp.local, "QM" question ANY cjqg._companion-link._tcp.local, "QM" question SRV 0 0 445 cjqg.local SRV 0 0 53785 cjqg.local OPT"
