frame.number,_ws.col.Time,_ws.col.Source,_ws.col.Destination,_ws.col.Protocol,frame.len,_ws.col.Info
"1","0.000000000","199.232.37.164","192.168.1.118","TLSv1.2","1418","Application Data"
"2","0.002671412","199.232.37.164","192.168.1.118","TCP","5474","443 → 34946 [ACK] Seq=1353 Ack=1 Win=64 Len=5408 TSval=2834217743 TSecr=657501197 [TCP segment of a reassembled PDU]"
"3","0.002744975","192.168.1.118","199.232.37.164","TCP","66","34946 → 443 [ACK] Seq=1 Ack=6761 Win=2369 Len=0 TSval=657501242 TSecr=2834217743"
"4","0.002883950","199.232.37.164","192.168.1.118","TLSv1.2","16290","Application Data [TCP segment of a reassembled PDU]"
"5","0.002906375","192.168.1.118","199.232.37.164","TCP","66","34946 → 443 [ACK] Seq=1 Ack=22985 Win=2623 Len=0 TSval=657501242 TSecr=2834217743"
"6","0.005903450","199.232.37.164","192.168.1.118","TCP","5474","443 → 34946 [ACK] Seq=22985 Ack=1 Win=64 Len=5408 TSval=2834217743 TSecr=657501197 [TCP segment of a reassembled PDU]"
"7","0.005975662","192.168.1.118","199.232.37.164","TCP","66","34946 → 443 [ACK] Seq=1 Ack=28393 Win=2707 Len=0 TSval=657501245 TSecr=2834217743"
"8","0.006074587","23.0.204.154","192.168.1.118","SSL","6514","Continuation Data"
"9","0.006095925","192.168.1.118","23.0.204.154","TCP","66","42872 → 443 [ACK] Seq=1 Ack=6449 Win=429 Len=0 TSval=1522686497 TSecr=4213116199"
"10","0.006150675","199.232.37.164","192.168.1.118","TLSv1.2","8178","Application Data [TCP segment of a reassembled PDU]"
"11","0.006169175","192.168.1.118","199.232.37.164","TCP","66","34946 → 443 [ACK] Seq=1 Ack=36505 Win=2834 Len=0 TSval=657501246 TSecr=2834217743"
"12","0.006180037","199.232.37.164","192.168.1.118","TCP","1418","443 → 34946 [ACK] Seq=36505 Ack=1 Win=64 Len=1352 TSval=2834217744 TSecr=657501197 [TCP segment of a reassembled PDU]"
"13","0.013430762","199.232.37.164","192.168.1.118","TCP","5474","443 → 34946 [ACK] Seq=37857 Ack=1 Win=64 Len=5408 TSval=2834217744 TSecr=657501197 [TCP segment of a reassembled PDU]"
"14","0.013522312","192.168.1.118","199.232.37.164","TCP","66","34946 → 443 [ACK] Seq=1 Ack=43265 Win=2940 Len=0 TSval=657501253 TSecr=2834217744"
"15","0.013666387","199.232.37.164","192.168.1.118","TLSv1.2","13586","Application Data [TCP segment of a reassembled PDU]"
"16","0.013694050","192.168.1.118","199.232.37.164","TCP","66","34946 → 443 [ACK] Seq=1 Ack=56785 Win=3151 Len=0 TSval=657501253 TSecr=2834217744"
"17","0.013713937","199.232.37.164","192.168.1.118","TCP","2770","443 → 34946 [ACK] Seq=56785 Ack=1 Win=64 Len=2704 TSval=2834217745 TSecr=657501197 [TCP segment of a reassembled PDU]"
"18","0.013730800","192.168.1.118","199.232.37.164","TCP","66","34946 → 443 [ACK] Seq=1 Ack=59489 Win=3193 Len=0 TSval=657501253 TSecr=2834217745"
"19","0.016750050","199.232.37.164","192.168.1.118","TCP","5474","443 → 34946 [ACK] Seq=59489 Ack=1 Win=64 Len=5408 TSval=2834217745 TSecr=657501197 [TCP segment of a reassembled PDU]"
"20","0.016821037","192.168.1.118","199.232.37.164","TCP","66","34946 → 443 [ACK] Seq=1 Ack=64897 Win=3249 Len=0 TSval=657501256 TSecr=2834217745"
"21","0.016949862","199.232.37.164","192.168.1.118","TLSv1.2","12234","Application Data [TCP segment of a reassembled PDU]"
"22","0.016979250","199.232.37.164","192.168.1.118","TCP","4122","443 → 34946 [ACK] Seq=77065 Ack=1 Win=64 Len=4056 TSval=2834217746 TSecr=657501197 [TCP segment of a reassembled PDU]"
"23","0.019951387","192.168.1.102","192.168.1.118","TCP","176","8009 → 35182 [PSH, ACK] Seq=1 Ack=1 Win=277 Len=110 TSval=6187527 TSecr=2821431649 [TCP segment of a reassembled PDU]"
"24","0.020035312","192.168.1.118","192.168.1.102","TCP","66","35182 → 8009 [ACK] Seq=1 Ack=111 Win=501 Len=0 TSval=2821431704 TSecr=6187527"
"25","0.020086362","199.232.37.164","192.168.1.118","TLSv1.2","5474","Application Data [TCP segment of a reassembled PDU]"
"26","0.020153512","199.232.37.164","192.168.1.118","TCP","6826","443 → 34946 [ACK] Seq=86529 Ack=1 Win=64 Len=6760 TSval=2834217746 TSecr=657501197 [TCP segment of a reassembled PDU]"
"27","0.020203212","199.232.37.164","192.168.1.118","TLSv1.2","8178","Application Data [TCP segment of a reassembled PDU]"
"28","0.024270850","199.232.37.164","192.168.1.118","TCP","5474","443 → 34946 [ACK] Seq=101401 Ack=1 Win=64 Len=5408 TSval=2834217747 TSecr=657501197 [TCP segment of a reassembled PDU]"
"29","0.024397112","199.232.37.164","192.168.1.118","TLSv1.2","14938","Application Data [TCP segment of a reassembled PDU]"
"30","0.024410275","199.232.37.164","192.168.1.118","TLSv1.2","519","Application Data"
"31","0.032091375","199.232.37.164","192.168.1.118","SSL","1418","Continuation Data"
"32","0.032154937","192.168.1.118","199.232.37.164","TCP","66","34948 → 443 [ACK] Seq=1 Ack=1353 Win=1219 Len=0 TSval=657501272 TSecr=1976121474"
"33","0.042345025","199.232.37.164","192.168.1.118","SSL","1418","Continuation Data"
"34","0.042414887","192.168.1.118","199.232.37.164","TCP","66","34948 → 443 [ACK] Seq=1 Ack=2705 Win=1241 Len=0 TSval=657501282 TSecr=1976121474"
"35","0.049451850","199.232.37.164","192.168.1.118","SSL","1418","Continuation Data"
"36","0.049541075","192.168.1.118","199.232.37.164","TCP","66","34948 → 443 [ACK] Seq=1 Ack=4057 Win=1262 Len=0 TSval=657501289 TSecr=1976121478"
"37","0.054430162","199.232.37.164","192.168.1.118","SSL","1418","Continuation Data"
"38","0.054523462","192.168.1.118","199.232.37.164","TCP","66","34948 → 443 [ACK] Seq=1 Ack=5409 Win=1283 Len=0 TSval=657501294 TSecr=1976121478"
"39","0.057546850","192.168.1.118","199.232.37.164","TCP","66","34946 → 443 [ACK] Seq=1 Ack=122134 Win=2802 Len=0 TSval=657501297 TSecr=2834217745"
"40","0.060162862","199.232.37.164","192.168.1.118","SSL","1418","Continuation Data"
"41","0.060227550","192.168.1.118","199.232.37.164","TCP","66","34948 → 443 [ACK] Seq=1 Ack=6761 Win=1304 Len=0 TSval=657501300 TSecr=1976121482"
"42","0.062756112","199.232.37.164","192.168.1.118","SSL","1418","Continuation Data"
"43","0.062817650","192.168.1.118","199.232.37.164","TCP","66","34948 → 443 [ACK] Seq=1 Ack=8113 Win=1325 Len=0 TSval=657501302 TSecr=1976121482"
"44","0.063825787","199.232.37.164","192.168.1.118","SSL","1418","Continuation Data"
"45","0.063870837","192.168.1.118","199.232.37.164","TCP","66","34948 → 443 [ACK] Seq=1 Ack=9465 Win=1346 Len=0 TSval=657501303 TSecr=1976121486"
"46","0.066272725","199.232.37.164","192.168.1.118","SSL","1418","Continuation Data"
"47","0.066336425","192.168.1.118","199.232.37.164","TCP","66","34948 → 443 [ACK] Seq=1 Ack=10817 Win=1367 Len=0 TSval=657501306 TSecr=1976121486"
"48","0.070310300","199.232.37.164","192.168.1.118","SSL","1418","Continuation Data"
"49","0.070382800","192.168.1.118","199.232.37.164","TCP","66","34948 → 443 [ACK] Seq=1 Ack=12169 Win=1388 Len=0 TSval=657501310 TSecr=1976121491"
"50","0.074814687","199.232.37.164","192.168.1.118","SSL","1418","Continuation Data"
"51","0.074881587","192.168.1.118","199.232.37.164","TCP","66","34948 → 443 [ACK] Seq=1 Ack=13521 Win=1410 Len=0 TSval=657501314 TSecr=1976121491"
"52","0.075694712","199.232.37.164","192.168.1.118","SSL","1418","Continuation Data"
"53","0.075738950","192.168.1.118","199.232.37.164","TCP","66","34948 → 443 [ACK] Seq=1 Ack=14873 Win=1431 Len=0 TSval=657501315 TSecr=1976121499"
"54","0.081864275","199.232.37.164","192.168.1.118","SSL","1418","Continuation Data"
"55","0.081928400","192.168.1.118","199.232.37.164","TCP","66","34948 → 443 [ACK] Seq=1 Ack=16225 Win=1452 Len=0 TSval=657501321 TSecr=1976121499"
"56","0.084800475","199.232.37.164","192.168.1.118","SSL","1418","Continuation Data"
"57","0.084872212","192.168.1.118","199.232.37.164","TCP","66","34948 → 443 [ACK] Seq=1 Ack=17577 Win=1473 Len=0 TSval=657501324 TSecr=1976121499"
"58","0.087689837","199.232.37.164","192.168.1.118","SSL","1418","Continuation Data"
"59","0.087756762","192.168.1.118","199.232.37.164","TCP","66","34948 → 443 [ACK] Seq=1 Ack=18929 Win=1494 Len=0 TSval=657501327 TSecr=1976121499"
"60","0.088395875","199.232.37.164","192.168.1.118","SSL","1418","Continuation Data"
"61","0.088435950","192.168.1.118","199.232.37.164","TCP","66","34948 → 443 [ACK] Seq=1 Ack=20281 Win=1515 Len=0 TSval=657501328 TSecr=1976121503"
"62","0.090336462","199.232.37.164","192.168.1.118","SSL","1418","Continuation Data"
"63","0.090400125","192.168.1.118","199.232.37.164","TCP","66","34948 → 443 [ACK] Seq=1 Ack=21633 Win=1536 Len=0 TSval=657501330 TSecr=1976121503"
"64","0.091349787","199.232.37.164","192.168.1.118","SSL","1418","Continuation Data"
"65","0.091398962","192.168.1.118","199.232.37.164","TCP","66","34948 → 443 [ACK] Seq=1 Ack=22985 Win=1557 Len=0 TSval=657501331 TSecr=1976121503"
"66","0.093760775","199.232.37.164","192.168.1.118","SSL","1418","Continuation Data"
"67","0.093826462","192.168.1.118","199.232.37.164","TCP","66","34948 → 443 [ACK] Seq=1 Ack=24337 Win=1579 Len=0 TSval=657501333 TSecr=1976121503"
"68","0.094730000","199.232.37.164","192.168.1.118","SSL","1418","Continuation Data"
"69","0.094771325","192.168.1.118","199.232.37.164","TCP","66","34948 → 443 [ACK] Seq=1 Ack=25689 Win=1600 Len=0 TSval=657501334 TSecr=1976121503"
"70","0.125585787","199.232.37.164","192.168.1.118","SSL","1418","Continuation Data"
"71","0.125656012","192.168.1.118","199.232.37.164","TCP","66","34948 → 443 [ACK] Seq=1 Ack=27041 Win=1621 Len=0 TSval=657501365 TSecr=1976121524"
"72","0.139938637","199.232.37.164","192.168.1.118","SSL","1418","Continuation Data"
"73","0.140013737","192.168.1.118","199.232.37.164","TCP","66","34948 → 443 [ACK] Seq=1 Ack=28393 Win=1642 Len=0 TSval=657501379 TSecr=1976121524"
"74","0.148745125","199.232.37.164","192.168.1.118","SSL","1418","Continuation Data"
"75","0.149587350","199.232.37.164","192.168.1.118","SSL","1418","Continuation Data"
"76","0.152098600","199.232.37.164","192.168.1.118","SSL","1418","Continuation Data"
"77","0.152898987","199.232.37.164","192.168.1.118","SSL","1418","Continuation Data"
"78","0.156840162","199.232.37.164","192.168.1.118","SSL","1418","Continuation Data"
"79","0.157679662","199.232.37.164","192.168.1.118","SSL","1418","Continuation Data"
"80","0.162119850","199.232.37.164","192.168.1.118","SSL","1418","Continuation Data"
"81","0.162793400","199.232.37.164","192.168.1.118","SSL","1418","Continuation Data"
"82","0.164070350","199.232.37.164","192.168.1.118","SSL","1418","Continuation Data"
"83","0.166016637","199.232.37.164","192.168.1.118","SSL","1418","Continuation Data"
"84","0.167099000","199.232.37.164","192.168.1.118","SSL","1418","Continuation Data"
"85","0.168668587","199.232.37.164","192.168.1.118","SSL","1418","Continuation Data"
"86","0.170588525","199.232.37.164","192.168.1.118","SSL","1418","Continuation Data"
"87","0.171551387","199.232.37.164","192.168.1.118","SSL","1418","Continuation Data"
"88","0.172331837","199.232.37.164","192.168.1.118","SSL","1418","Continuation Data"
"89","0.174239037","199.232.37.164","192.168.1.118","SSL","1418","Continuation Data"
"90","0.177325475","199.232.37.164","192.168.1.118","SSL","1418","Continuation Data"
"91","0.178159250","199.232.37.164","192.168.1.118","SSL","1418","Continuation Data"
"92","0.182213450","199.232.37.164","192.168.1.118","SSL","1418","Continuation Data"
"93","0.182279050","192.168.1.118","199.232.37.164","TCP","66","34948 → 443 [ACK] Seq=1 Ack=54081 Win=1442 Len=0 TSval=657501422 TSecr=1976121524"
"94","0.183127112","199.232.37.164","192.168.1.118","SSL","1418","Continuation Data"
"95","0.184728500","199.232.37.164","192.168.1.118","SSL","1418","Continuation Data"
"96","0.185633362","199.232.37.164","192.168.1.118","SSL","1418","Continuation Data"
"97","0.186615362","199.232.37.164","192.168.1.118","SSL","1418","Continuation Data"
"98","0.188446250","199.232.37.164","192.168.1.118","SSL","1418","Continuation Data"
"99","0.190252600","199.232.37.164","192.168.1.118","SSL","1418","Continuation Data"
"100","0.191184550","199.232.37.164","192.168.1.118","SSL","1418","Continuation Data"
"101","0.193500787","199.232.37.164","192.168.1.118","SSL","1418","Continuation Data"
"102","0.194300225","199.232.37.164","192.168.1.118","SSL","1418","Continuation Data"
"103","0.196165137","199.232.37.164","192.168.1.118","SSL","1418","Continuation Data"
"104","0.197957000","199.232.37.164","192.168.1.118","SSL","1418","Continuation Data"
"105","0.199573312","199.232.37.164","192.168.1.118","SSL","1418","Continuation Data"
"106","0.201108337","199.232.37.164","192.168.1.118","SSL","1418","Continuation Data"
"107","0.202143837","199.232.37.164","192.168.1.118","SSL","1418","Continuation Data"
"108","0.204157850","199.232.37.164","192.168.1.118","SSL","1418","Continuation Data"
"109","0.204939237","199.232.37.164","192.168.1.118","SSL","1418","Continuation Data"
"110","0.205798062","199.232.37.164","192.168.1.118","SSL","1418","Continuation Data"
"111","0.207035450","199.232.37.164","192.168.1.118","SSL","1418","Continuation Data"
"112","0.207978300","199.232.37.164","192.168.1.118","SSL","1418","Continuation Data"
"113","0.211203237","199.232.37.164","192.168.1.118","SSL","1418","Continuation Data"
"114","0.217477212","199.232.37.164","192.168.1.118","SSL","1418","Continuation Data"
"115","0.217567262","192.168.1.118","199.232.37.164","TCP","66","34948 → 443 [ACK] Seq=1 Ack=82473 Win=1221 Len=0 TSval=657501457 TSecr=1976121644"
"116","0.218190112","199.232.37.164","192.168.1.118","SSL","1418","Continuation Data"
"117","0.220830525","199.232.37.164","192.168.1.118","SSL","1418","Continuation Data"
"118","0.225350625","199.232.37.164","192.168.1.118","SSL","1418","Continuation Data"
"119","0.226017225","199.232.37.164","192.168.1.118","SSL","1418","Continuation Data"
"120","0.226959400","199.232.37.164","192.168.1.118","SSL","1418","Continuation Data"
"121","0.229093187","199.232.37.164","192.168.1.118","SSL","1418","Continuation Data"
"122","0.230936000","199.232.37.164","192.168.1.118","SSL","1418","Continuation Data"
"123","0.231683087","199.232.37.164","192.168.1.118","SSL","1418","Continuation Data"
"124","0.232360987","199.232.37.164","192.168.1.118","SSL","1418","Continuation Data"
"125","0.234217325","199.232.37.164","192.168.1.118","SSL","1418","Continuation Data"
"126","0.235932737","199.232.37.164","192.168.1.118","SSL","1418","Continuation Data"
"127","0.238145800","199.232.37.164","192.168.1.118","SSL","1418","Continuation Data"
"128","0.239018662","199.232.37.164","192.168.1.118","SSL","1418","Continuation Data"
"129","0.242182150","199.232.37.164","192.168.1.118","SSL","1418","Continuation Data"
"130","0.242920962","199.232.37.164","192.168.1.118","SSL","1418","Continuation Data"
"131","0.245277937","199.232.37.164","192.168.1.118","SSL","1418","Continuation Data"
"132","0.248433675","199.232.37.164","192.168.1.118","SSL","1418","Continuation Data"
"133","0.248532875","192.168.1.118","199.232.37.164","TCP","66","34948 → 443 [ACK] Seq=1 Ack=105457 Win=1042 Len=0 TSval=657501488 TSecr=1976121724"
"134","0.252644487","199.232.37.164","192.168.1.118","SSL","1418","Continuation Data"
"135","0.253568412","199.232.37.164","192.168.1.118","SSL","1418","Continuation Data"
"136","0.254349825","199.232.37.164","192.168.1.118","SSL","1418","Continuation Data"
"137","0.255667187","199.232.37.164","192.168.1.118","SSL","1418","Continuation Data"
"138","0.257572012","199.232.37.164","192.168.1.118","SSL","1418","Continuation Data"
"139","0.258813850","199.232.37.164","192.168.1.118","SSL","1418","Continuation Data"
"140","0.259700975","199.232.37.164","192.168.1.118","SSL","1418","Continuation Data"
"141","0.260553875","199.232.37.164","192.168.1.118","SSL","1418","Continuation Data"
"142","0.265409250","199.232.37.164","192.168.1.118","SSL","1418","Continuation Data"
"143","0.266393775","199.232.37.164","192.168.1.118","SSL","1418","Continuation Data"
"144","0.267186087","199.232.37.164","192.168.1.118","SSL","1418","Continuation Data"
"145","0.267984050","199.232.37.164","192.168.1.118","SSL","1418","Continuation Data"
"146","0.269179225","199.232.37.164","192.168.1.118","SSL","1418","Continuation Data"
"147","0.270356162","199.232.37.164","192.168.1.118","SSL","1418","Continuation Data"
"148","0.271211350","199.232.37.164","192.168.1.118","SSL","1418","Continuation Data"
"149","0.272228612","199.232.37.164","192.168.1.118","SSL","1418","Continuation Data"
"150","0.273209762","199.232.37.164","192.168.1.118","SSL","1418","Continuation Data"
"151","0.274100912","199.232.37.164","192.168.1.118","SSL","1418","Continuation Data"
"152","0.274885850","199.232.37.164","192.168.1.118","SSL","1418","Continuation Data"
"153","0.276356225","199.232.37.164","192.168.1.118","SSL","1418","Continuation Data"
"154","0.284338300","199.232.37.164","192.168.1.118","SSL","1418","Continuation Data"
"155","0.284404837","192.168.1.118","199.232.37.164","TCP","66","34948 → 443 [ACK] Seq=1 Ack=133849 Win=821 Len=0 TSval=657501524 TSecr=1976121877"
"156","0.285180375","199.232.37.164","192.168.1.118","SSL","1418","Continuation Data"
"157","0.286599425","199.232.37.164","192.168.1.118","SSL","1418","Continuation Data"
"158","0.287529137","199.232.37.164","192.168.1.118","SSL","1418","Continuation Data"
"159","0.288363800","199.232.37.164","192.168.1.118","SSL","1418","Continuation Data"
"160","0.289954225","199.232.37.164","192.168.1.118","SSL","1418","Continuation Data"
"161","0.291748300","199.232.37.164","192.168.1.118","SSL","1418","Continuation Data"
"162","0.292422712","199.232.37.164","192.168.1.118","TCP","1418","[TCP segment of a reassembled PDU]"
"163","0.293167250","199.232.37.164","192.168.1.118","TCP","1418","443 → 34948 [ACK] Seq=143313 Ack=1 Win=60 Len=1352 TSval=1976122016 TSecr=657501422 [TCP segment of a reassembled PDU]"
"164","0.295300887","199.232.37.164","192.168.1.118","TCP","1418","443 → 34948 [ACK] Seq=144665 Ack=1 Win=60 Len=1352 TSval=1976122025 TSecr=657501422 [TCP segment of a reassembled PDU]"
"165","0.297153162","199.232.37.164","192.168.1.118","TCP","1418","443 → 34948 [ACK] Seq=146017 Ack=1 Win=60 Len=1352 TSval=1976122025 TSecr=657501422 [TCP segment of a reassembled PDU]"
"166","0.300363200","199.232.37.164","192.168.1.118","TCP","1418","443 → 34948 [ACK] Seq=147369 Ack=1 Win=60 Len=1352 TSval=1976122034 TSecr=657501422 [TCP segment of a reassembled PDU]"
"167","0.301337462","199.232.37.164","192.168.1.118","TCP","1418","443 → 34948 [ACK] Seq=148721 Ack=1 Win=60 Len=1352 TSval=1976122034 TSecr=657501422 [TCP segment of a reassembled PDU]"
"168","0.302393325","199.232.37.164","192.168.1.118","TCP","1418","443 → 34948 [ACK] Seq=150073 Ack=1 Win=60 Len=1352 TSval=1976122044 TSecr=657501422 [TCP segment of a reassembled PDU]"
"169","0.305446425","199.232.37.164","192.168.1.118","TCP","1418","443 → 34948 [ACK] Seq=151425 Ack=1 Win=60 Len=1352 TSval=1976122044 TSecr=657501422 [TCP segment of a reassembled PDU]"
"170","0.306425200","199.232.37.164","192.168.1.118","TCP","1418","443 → 34948 [ACK] Seq=152777 Ack=1 Win=60 Len=1352 TSval=1976122044 TSecr=657501422 [TCP segment of a reassembled PDU]"
"171","0.307143050","199.232.37.164","192.168.1.118","SSLv2","1418","Encrypted Data, Continuation Data"
"172","0.309476650","199.232.37.164","192.168.1.118","SSL","1418","Continuation Data"
"173","0.313315600","199.232.37.164","192.168.1.118","SSL","1418","Continuation Data"
"174","0.314093075","199.232.37.164","192.168.1.118","SSL","1418","Continuation Data"
"175","0.315940712","199.232.37.164","192.168.1.118","SSL","1418","Continuation Data"
"176","0.316003412","192.168.1.118","199.232.37.164","TCP","66","34948 → 443 [ACK] Seq=1 Ack=160889 Win=610 Len=0 TSval=657501555 TSecr=1976122001"
"177","0.319506950","199.232.37.164","192.168.1.118","SSL","1418","Continuation Data"
"178","0.320275762","199.232.37.164","192.168.1.118","SSL","1418","Continuation Data"
"179","0.323645462","199.232.37.164","192.168.1.118","SSL","1418","Continuation Data"
"180","0.328553625","199.232.37.164","192.168.1.118","SSL","1418","Continuation Data"
"181","0.330439725","199.232.37.164","192.168.1.118","SSL","1418","Continuation Data"
"182","0.331242200","199.232.37.164","192.168.1.118","SSL","1418","Continuation Data"
"183","0.333192325","199.232.37.164","192.168.1.118","SSL","1418","Continuation Data"
"184","0.335345250","199.232.37.164","192.168.1.118","SSL","1418","Continuation Data"
"185","0.336795350","199.232.37.164","192.168.1.118","SSL","1418","Continuation Data"
"186","0.338620975","199.232.37.164","192.168.1.118","SSL","1418","Continuation Data"
"187","0.340287250","199.232.37.164","192.168.1.118","SSL","1418","Continuation Data"
"188","0.341328225","199.232.37.164","192.168.1.118","SSL","1418","Continuation Data"
"189","0.352241400","192.168.1.118","199.232.37.164","TCP","66","34948 → 443 [ACK] Seq=1 Ack=177113 Win=484 Len=0 TSval=657501592 TSecr=1976122073"
"190","0.354033037","199.232.37.164","192.168.1.118","SSL","1418","Continuation Data"
"191","0.361422137","199.232.37.164","192.168.1.118","SSL","1418","Continuation Data"
"192","0.362104300","199.232.37.164","192.168.1.118","SSL","1418","Continuation Data"
"193","0.363121800","192.168.1.118","199.232.37.164","TCP","66","34948 → 443 [ACK] Seq=1 Ack=181169 Win=453 Len=0 TSval=657501602 TSecr=1976122127"
"194","0.363272487","199.232.37.164","192.168.1.118","SSL","1418","Continuation Data"
"195","0.369094675","199.232.37.164","192.168.1.118","SSL","1418","Continuation Data"
"196","0.370356412","199.232.37.164","192.168.1.118","SSL","1418","Continuation Data"
"197","0.372500125","199.232.37.164","192.168.1.118","SSL","1418","Continuation Data"
"198","0.373892862","199.232.37.164","192.168.1.118","SSL","1418","Continuation Data"
"199","0.374874350","199.232.37.164","192.168.1.118","SSL","1418","Continuation Data"
"200","0.382030462","199.232.37.164","192.168.1.118","SSL","1418","Continuation Data"
"201","0.388219825","199.232.37.164","192.168.1.118","SSL","1418","Continuation Data"
"202","0.389428512","199.232.37.164","192.168.1.118","SSL","1418","Continuation Data"
"203","0.390275062","199.232.37.164","192.168.1.118","SSL","1418","Continuation Data"
"204","0.396835387","199.232.37.164","192.168.1.118","SSL","1418","Continuation Data"
"205","0.396900287","192.168.1.118","199.232.37.164","TCP","66","34948 → 443 [ACK] Seq=1 Ack=196041 Win=337 Len=0 TSval=657501636 TSecr=1976122135"
"206","0.397572375","199.232.37.164","192.168.1.118","SSL","1418","Continuation Data"
"207","0.402368600","199.232.37.164","192.168.1.118","SSL","1418","Continuation Data"
"208","0.403353625","199.232.37.164","192.168.1.118","SSL","1418","Continuation Data"
"209","0.409031750","199.232.37.164","192.168.1.118","SSL","1418","Continuation Data"
"210","0.409958025","199.232.37.164","192.168.1.118","TCP","1418","[TCP segment of a reassembled PDU]"
"211","0.415784025","199.232.37.164","192.168.1.118","TCP","1418","443 → 34948 [ACK] Seq=202801 Ack=1 Win=60 Len=1352 TSval=1976122198 TSecr=657501602 [TCP segment of a reassembled PDU]"
"212","0.416582300","199.232.37.164","192.168.1.118","TCP","1418","443 → 34948 [ACK] Seq=204153 Ack=1 Win=60 Len=1352 TSval=1976122198 TSecr=657501602 [TCP segment of a reassembled PDU]"
"213","0.422658650","199.232.37.164","192.168.1.118","TCP","1418","443 → 34948 [ACK] Seq=205505 Ack=1 Win=60 Len=1352 TSval=1976122205 TSecr=657501602 [TCP segment of a reassembled PDU]"
"214","0.425800787","199.232.37.164","192.168.1.118","TCP","1418","443 → 34948 [ACK] Seq=206857 Ack=1 Win=60 Len=1352 TSval=1976122205 TSecr=657501602 [TCP segment of a reassembled PDU]"
"215","0.430821775","199.232.37.164","192.168.1.118","TCP","1418","443 → 34948 [ACK] Seq=208209 Ack=1 Win=60 Len=1352 TSval=1976122212 TSecr=657501602 [TCP segment of a reassembled PDU]"
"216","0.430892562","192.168.1.118","199.232.37.164","TCP","66","34948 → 443 [ACK] Seq=1 Ack=209561 Win=232 Len=0 TSval=657501670 TSecr=1976122178"
"217","0.433293475","199.232.37.164","192.168.1.118","TCP","1418","443 → 34948 [ACK] Seq=209561 Ack=1 Win=60 Len=1352 TSval=1976122212 TSecr=657501602 [TCP segment of a reassembled PDU]"
"218","0.436467625","199.232.37.164","192.168.1.118","TCP","1418","443 → 34948 [ACK] Seq=210913 Ack=1 Win=60 Len=1352 TSval=1976122218 TSecr=657501602 [TCP segment of a reassembled PDU]"
"219","0.437226287","199.232.37.164","192.168.1.118","TCP","1418","443 → 34948 [ACK] Seq=212265 Ack=1 Win=60 Len=1352 TSval=1976122218 TSecr=657501602 [TCP segment of a reassembled PDU]"
"220","0.439353037","199.232.37.164","192.168.1.118","TCP","1418","443 → 34948 [ACK] Seq=213617 Ack=1 Win=60 Len=1352 TSval=1976122225 TSecr=657501602 [TCP segment of a reassembled PDU]"
"221","0.440686962","199.232.37.164","192.168.1.118","TCP","1418","443 → 34948 [ACK] Seq=214969 Ack=1 Win=60 Len=1352 TSval=1976122225 TSecr=657501602 [TCP segment of a reassembled PDU]"
"222","0.442272375","199.232.37.164","192.168.1.118","TCP","1418","443 → 34948 [ACK] Seq=216321 Ack=1 Win=60 Len=1352 TSval=1976122231 TSecr=657501636 [TCP segment of a reassembled PDU]"
"223","0.443117562","199.232.37.164","192.168.1.118","TCP","1418","443 → 34948 [ACK] Seq=217673 Ack=1 Win=60 Len=1352 TSval=1976122231 TSecr=657501636 [TCP segment of a reassembled PDU]"
"224","0.449834812","199.232.37.164","192.168.1.118","TCP","1418","443 → 34948 [ACK] Seq=219025 Ack=1 Win=60 Len=1352 TSval=1976122231 TSecr=657501636 [TCP segment of a reassembled PDU]"
"225","0.456571250","199.232.37.164","192.168.1.118","SSLv2","1418","Encrypted Data [TCP segment of a reassembled PDU]"
"226","0.457546700","199.232.37.164","192.168.1.118","TCP","1418","443 → 34948 [ACK] Seq=221729 Ack=1 Win=60 Len=1352 TSval=1976122243 TSecr=657501636 [TCP segment of a reassembled PDU]"
"227","0.460035375","199.232.37.164","192.168.1.118","SSLv2","1418","Encrypted Data [TCP segment of a reassembled PDU]"
"228","0.460766675","199.232.37.164","192.168.1.118","TCP","1418","443 → 34948 [ACK] Seq=224433 Ack=1 Win=60 Len=1352 TSval=1976122243 TSecr=657501636 [TCP segment of a reassembled PDU]"
"229","0.463777037","199.232.37.164","192.168.1.118","TCP","1418","443 → 34948 [ACK] Seq=225785 Ack=1 Win=60 Len=1352 TSval=1976122243 TSecr=657501636 [TCP segment of a reassembled PDU]"
"230","0.463842237","192.168.1.118","199.232.37.164","TCP","66","34948 → 443 [ACK] Seq=1 Ack=227137 Win=95 Len=0 TSval=657501703 TSecr=1976122212"
"231","0.468164375","199.232.37.164","192.168.1.118","SSLv2","1418","Encrypted Data [TCP segment of a reassembled PDU]"
"232","0.468936912","199.232.37.164","192.168.1.118","TCP","1418","443 → 34948 [ACK] Seq=228489 Ack=1 Win=60 Len=1352 TSval=1976122249 TSecr=657501636 [TCP segment of a reassembled PDU]"
"233","0.471245362","199.232.37.164","192.168.1.118","TCP","1418","443 → 34948 [ACK] Seq=229841 Ack=1 Win=60 Len=1352 TSval=1976122255 TSecr=657501670 [TCP segment of a reassembled PDU]"
"234","0.471903312","199.232.37.164","192.168.1.118","TCP","1418","443 → 34948 [ACK] Seq=231193 Ack=1 Win=60 Len=1352 TSval=1976122255 TSecr=657501670 [TCP segment of a reassembled PDU]"
"235","0.475872150","199.232.37.164","192.168.1.118","TCP","1418","443 → 34948 [ACK] Seq=232545 Ack=1 Win=60 Len=1352 TSval=1976122261 TSecr=657501670 [TCP segment of a reassembled PDU]"
"236","0.476651112","199.232.37.164","192.168.1.118","TCP","1418","443 → 34948 [ACK] Seq=233897 Ack=1 Win=60 Len=1352 TSval=1976122261 TSecr=657501670 [TCP segment of a reassembled PDU]"
"237","0.479086987","192.168.1.118","199.232.37.164","TCP","66","34948 → 443 [ACK] Seq=1 Ack=235249 Win=32 Len=0 TSval=657501718 TSecr=1976122249"
"238","0.479536750","192.168.1.118","199.232.37.164","TLSv1.2","337","Application Data"
"239","0.480222137","192.168.1.118","199.232.37.164","TCP","66","34952 → 443 [ACK] Seq=1 Ack=1 Win=379 Len=0 TSval=657501720 TSecr=2837207250"
"240","0.482911662","199.232.37.164","192.168.1.118","TCP","1418","443 → 34948 [ACK] Seq=235249 Ack=1 Win=60 Len=1352 TSval=1976122267 TSecr=657501670 [TCP segment of a reassembled PDU]"
"241","0.484537725","199.232.37.164","192.168.1.118","TCP","1418","443 → 34948 [ACK] Seq=236601 Ack=1 Win=60 Len=1352 TSval=1976122267 TSecr=657501670 [TCP segment of a reassembled PDU]"
"242","0.496964612","199.232.37.164","192.168.1.118","TCP","1418","443 → 34948 [ACK] Seq=237953 Ack=1 Win=60 Len=1352 TSval=1976122293 TSecr=657501718 [TCP segment of a reassembled PDU]"
"243","0.497573700","199.232.37.164","192.168.1.118","TCP","106","443 → 34948 [ACK] Seq=239305 Ack=1 Win=60 Len=40 TSval=1976122293 TSecr=657501718 [TCP segment of a reassembled PDU]"
"244","0.512144150","199.232.37.164","192.168.1.118","TLSv1.2","1418","Application Data"
"245","0.519842200","199.232.37.164","192.168.1.118","TCP","2770","443 → 34950 [ACK] Seq=1353 Ack=272 Win=64 Len=2704 TSval=4225600856 TSecr=657501719 [TCP segment of a reassembled PDU]"
"246","0.519917425","192.168.1.118","199.232.37.164","TCP","66","34950 → 443 [ACK] Seq=272 Ack=4057 Win=2096 Len=0 TSval=657501759 TSecr=4225600856"
"247","0.520012137","199.232.37.164","192.168.1.118","TCP","5474","443 → 34950 [ACK] Seq=4057 Ack=272 Win=64 Len=5408 TSval=4225600856 TSecr=657501719 [TCP segment of a reassembled PDU]"
"248","0.520031050","192.168.1.118","199.232.37.164","TCP","66","34950 → 443 [ACK] Seq=272 Ack=9465 Win=2180 Len=0 TSval=657501759 TSecr=4225600856"
"249","0.521985275","192.168.1.118","199.232.37.164","TCP","66","[TCP ZeroWindow] 34948 → 443 [ACK] Seq=1 Ack=239345 Win=0 Len=0 TSval=657501761 TSecr=1976122267"
"250","0.522341600","199.232.37.164","192.168.1.118","TLSv1.2","13586","Application Data [TCP segment of a reassembled PDU]"
"251","0.522354900","192.168.1.118","199.232.37.164","TLSv1.2","365","Application Data"
"252","0.522840262","199.232.37.164","192.168.1.118","TCP","8178","443 → 34950 [ACK] Seq=22985 Ack=272 Win=64 Len=8112 TSval=4225600856 TSecr=657501719 [TCP segment of a reassembled PDU]"
"253","0.528030275","192.168.1.118","199.232.37.164","TCP","66","34950 → 443 [ACK] Seq=272 Ack=31097 Win=2011 Len=0 TSval=657501767 TSecr=4225600856"
"254","0.528211887","199.232.37.164","192.168.1.118","TLSv1.2","5474","Application Data [TCP segment of a reassembled PDU]"
"255","0.528695625","192.168.1.118","199.232.37.164","TCP","66","34950 → 443 [ACK] Seq=272 Ack=36505 Win=1969 Len=0 TSval=657501768 TSecr=4225600856"
"256","0.528757537","199.232.37.164","192.168.1.118","TLSv1.2","16290","Application Data [TCP segment of a reassembled PDU]"
"257","0.528804050","192.168.1.118","199.232.37.164","TCP","66","34950 → 443 [ACK] Seq=272 Ack=52729 Win=2017 Len=0 TSval=657501768 TSecr=4225600856"
"258","0.528938137","192.168.1.118","199.232.37.164","TLSv1.2","370","Application Data"
"259","0.534100837","199.232.37.164","192.168.1.118","TCP","5474","443 → 34950 [ACK] Seq=52729 Ack=272 Win=64 Len=5408 TSval=4225600856 TSecr=657501719 [TCP segment of a reassembled PDU]"
"260","0.534169725","192.168.1.118","199.232.37.164","TCP","66","34950 → 443 [ACK] Seq=272 Ack=58137 Win=2116 Len=0 TSval=657501774 TSecr=4225600856"
"261","0.534298837","199.232.37.164","192.168.1.118","TLSv1.2","16290","Application Data [TCP segment of a reassembled PDU]"
"262","0.535737587","199.232.37.164","192.168.1.118","TLSv1.2","13586","Application Data [TCP segment of a reassembled PDU]"
"263","0.537961162","199.232.37.164","192.168.1.118","TLSv1.2","12234","Application Data [TCP segment of a reassembled PDU]"
"264","0.542756050","192.168.1.118","199.232.37.164","TCP","66","34950 → 443 [ACK] Seq=272 Ack=100049 Win=1789 Len=0 TSval=657501782 TSecr=4225600856"
"265","0.543866437","192.168.1.118","199.232.37.164","TCP","66","[TCP Window Update] 34948 → 443 [ACK] Seq=1 Ack=239345 Win=256 Len=0 TSval=657501783 TSecr=1976122267"
"266","0.573191075","199.232.37.164","192.168.1.118","TCP","1418","443 → 34950 [ACK] Seq=100049 Ack=272 Win=64 Len=1352 TSval=4225600871 TSecr=657501782 [TCP segment of a reassembled PDU]"
"267","0.575842337","199.232.37.164","192.168.1.118","TCP","5474","443 → 34950 [ACK] Seq=101401 Ack=272 Win=64 Len=5408 TSval=4225600871 TSecr=657501782 [TCP segment of a reassembled PDU]"
"268","0.575916512","192.168.1.118","199.232.37.164","TCP","66","34950 → 443 [ACK] Seq=272 Ack=106809 Win=2286 Len=0 TSval=657501815 TSecr=4225600871"
"269","0.576055750","199.232.37.164","192.168.1.118","TLSv1.2","14938","Application Data [TCP segment of a reassembled PDU]"
"270","0.579182487","199.232.37.164","192.168.1.118","TCP","8178","443 → 34950 [ACK] Seq=121681 Ack=272 Win=64 Len=8112 TSval=4225600871 TSecr=657501782 [TCP segment of a reassembled PDU]"
"271","0.579331100","199.232.37.164","192.168.1.118","TLSv1.2","13586","Application Data [TCP segment of a reassembled PDU]"
"272","0.581582937","199.232.37.164","192.168.1.118","TLSv1.2","5474","Application Data [TCP segment of a reassembled PDU]"
"273","0.581688400","199.232.37.164","192.168.1.118","TLSv1.2","5078","Application Data"
"274","0.586689012","199.232.37.164","192.168.1.118","TCP","1418","443 → 34948 [ACK] Seq=239345 Ack=1 Win=60 Len=1352 TSval=1976122382 TSecr=657501783 [TCP segment of a reassembled PDU]"
"275","0.586890450","199.232.37.164","192.168.1.118","TLSv1.2","1418","Application Data"
"276","0.586937300","192.168.1.118","199.232.37.164","TCP","66","34946 → 443 [ACK] Seq=305 Ack=123486 Win=3270 Len=0 TSval=657501826 TSecr=2834217893"
"277","0.587444850","192.168.1.118","199.232.37.164","TCP","66","34950 → 443 [ACK] Seq=272 Ack=153733 Win=2286 Len=0 TSval=657501827 TSecr=4225600871"
"278","0.592010475","199.232.37.164","192.168.1.118","TCP","5474","443 → 34946 [ACK] Seq=123486 Ack=305 Win=66 Len=5408 TSval=2834217893 TSecr=657501768 [TCP segment of a reassembled PDU]"
"279","0.592079225","192.168.1.118","199.232.37.164","TCP","66","34946 → 443 [ACK] Seq=305 Ack=128894 Win=3355 Len=0 TSval=657501831 TSecr=2834217893"
"280","0.592175837","199.232.37.164","192.168.1.118","TCP","6826","443 → 34946 [ACK] Seq=128894 Ack=305 Win=66 Len=6760 TSval=2834217893 TSecr=657501768 [TCP segment of a reassembled PDU]"
"281","0.592197075","192.168.1.118","199.232.37.164","TCP","66","34946 → 443 [ACK] Seq=305 Ack=135654 Win=3460 Len=0 TSval=657501832 TSecr=2834217893"
"282","0.604078662","199.232.37.164","192.168.1.118","TLSv1.2","5474","Application Data [TCP segment of a reassembled PDU]"
"283","0.604143675","192.168.1.118","199.232.37.164","TCP","66","34946 → 443 [ACK] Seq=305 Ack=141062 Win=3545 Len=0 TSval=657501844 TSecr=2834217893"
"284","0.604281562","199.232.37.164","192.168.1.118","TCP","1418","443 → 34946 [ACK] Seq=141062 Ack=305 Win=66 Len=1352 TSval=2834217893 TSecr=657501768 [TCP segment of a reassembled PDU]"
"285","0.604299562","192.168.1.118","199.232.37.164","TCP","66","34946 → 443 [ACK] Seq=305 Ack=142414 Win=3566 Len=0 TSval=657501844 TSecr=2834217893"
"286","0.604310075","199.232.37.164","192.168.1.118","TLSv1.2","14938","Application Data"
"287","0.604345775","192.168.1.118","199.232.37.164","TCP","66","34944 → 443 [ACK] Seq=300 Ack=14873 Win=1221 Len=0 TSval=657501844 TSecr=2836069768"
"288","0.608323975","199.232.37.164","192.168.1.118","TLSv1.2","4122","Application Data [TCP segment of a reassembled PDU]"
"289","0.608372650","199.232.37.164","192.168.1.118","TCP","1418","443 → 34946 [ACK] Seq=142414 Ack=305 Win=66 Len=1352 TSval=2834217893 TSecr=657501768 [TCP segment of a reassembled PDU]"
"290","0.608405312","192.168.1.118","199.232.37.164","TCP","66","34946 → 443 [ACK] Seq=305 Ack=143766 Win=3587 Len=0 TSval=657501848 TSecr=2834217893"
"291","0.608558425","199.232.37.164","192.168.1.118","TCP","12234","443 → 34946 [ACK] Seq=143766 Ack=305 Win=66 Len=12168 TSval=2834217893 TSecr=657501768 [TCP segment of a reassembled PDU]"
"292","0.608580412","192.168.1.118","199.232.37.164","TCP","66","34946 → 443 [ACK] Seq=305 Ack=155934 Win=3777 Len=0 TSval=657501848 TSecr=2834217893"
"293","0.608590887","199.232.37.164","192.168.1.118","TCP","4122","443 → 34944 [ACK] Seq=18929 Ack=300 Win=64 Len=4056 TSval=2836069768 TSecr=657501762 [TCP segment of a reassembled PDU]"
"294","0.610563437","199.232.37.164","192.168.1.118","TCP","1418","443 → 34948 [ACK] Seq=240697 Ack=1 Win=60 Len=1352 TSval=1976122382 TSecr=657501783 [TCP segment of a reassembled PDU]"
"295","0.611882337","192.168.1.118","199.232.37.164","TCP","66","34948 → 443 [ACK] Seq=1 Ack=242049 Win=235 Len=0 TSval=657501851 TSecr=1976122382"
"296","0.611977687","192.168.1.118","199.232.37.164","TCP","66","34944 → 443 [ACK] Seq=300 Ack=22985 Win=1158 Len=0 TSval=657501851 TSecr=2836069768"
"297","0.612302112","199.232.37.164","192.168.1.118","TCP","4122","443 → 34944 [ACK] Seq=22985 Ack=300 Win=64 Len=4056 TSval=2836069768 TSecr=657501762 [TCP segment of a reassembled PDU]"
"298","0.612322150","199.232.37.164","192.168.1.118","TLSv1.2","6826","Application Data [TCP segment of a reassembled PDU]"
"299","0.612340562","192.168.1.118","199.232.37.164","TCP","66","34946 → 443 [ACK] Seq=305 Ack=162694 Win=3883 Len=0 TSval=657501852 TSecr=2834217893"
"300","0.612852862","199.232.37.164","192.168.1.118","TLSv1.2","2052","Application Data"
"301","0.612880937","199.232.37.164","192.168.1.118","TCP","8178","443 → 34946 [ACK] Seq=162694 Ack=305 Win=66 Len=8112 TSval=2834217893 TSecr=657501768 [TCP segment of a reassembled PDU]"
"302","0.612910762","192.168.1.118","199.232.37.164","TCP","66","34946 → 443 [ACK] Seq=305 Ack=170806 Win=3847 Len=0 TSval=657501852 TSecr=2834217893"
"303","0.614366612","192.168.1.118","199.232.37.164","TCP","66","34944 → 443 [ACK] Seq=300 Ack=27041 Win=1263 Len=0 TSval=657501854 TSecr=2836069768"
"304","0.614453025","192.168.1.118","199.232.37.164","TCP","66","34944 → 443 [ACK] Seq=300 Ack=29027 Win=1263 Len=0 TSval=657501854 TSecr=2836069768"
"305","0.616380250","192.168.1.118","199.232.37.164","TCP","66","[TCP Window Update] 34948 → 443 [ACK] Seq=1 Ack=242049 Win=499 Len=0 TSval=657501856 TSecr=1976122382"
"306","0.616556587","199.232.37.164","192.168.1.118","TLSv1.2","1930","Application Data, Application Data"
"307","0.616586975","192.168.1.118","199.232.37.164","TCP","66","34946 → 443 [ACK] Seq=305 Ack=172670 Win=3912 Len=0 TSval=657501856 TSecr=2834217893"
"308","0.618344875","192.168.1.118","199.232.37.164","TCP","66","[TCP Window Update] 34952 → 443 [ACK] Seq=1 Ack=1 Win=855 Len=0 TSval=657501858 TSecr=2837207250"
"309","0.630591037","199.232.37.164","192.168.1.118","TCP","1418","443 → 34948 [ACK] Seq=242049 Ack=1 Win=60 Len=1352 TSval=1976122382 TSecr=657501783 [TCP segment of a reassembled PDU]"
"310","0.631910762","199.232.37.164","192.168.1.118","SSLv2","1418","Encrypted Data, Encrypted Data"
"311","0.632722625","199.232.37.164","192.168.1.118","TCP","1378","443 → 34948 [PSH, ACK] Seq=244753 Ack=1 Win=60 Len=1312 TSval=1976122382 TSecr=657501783 [TCP segment of a reassembled PDU]"
"312","0.635243850","199.232.37.164","192.168.1.118","TCP","1418","443 → 34948 [ACK] Seq=246065 Ack=1 Win=60 Len=1352 TSval=1976122382 TSecr=657501783 [TCP segment of a reassembled PDU]"
"313","0.636040712","199.232.37.164","192.168.1.118","TCP","1418","443 → 34948 [ACK] Seq=247417 Ack=1 Win=60 Len=1352 TSval=1976122382 TSecr=657501783 [TCP segment of a reassembled PDU]"
"314","0.636939250","199.232.37.164","192.168.1.118","TCP","1418","443 → 34948 [ACK] Seq=248769 Ack=1 Win=60 Len=1352 TSval=1976122382 TSecr=657501783 [TCP segment of a reassembled PDU]"
"315","0.637876912","199.232.37.164","192.168.1.118","TCP","1418","443 → 34948 [ACK] Seq=250121 Ack=1 Win=60 Len=1352 TSval=1976122382 TSecr=657501783 [TCP segment of a reassembled PDU]"
"316","0.638603337","199.232.37.164","192.168.1.118","SSLv2","1418","Encrypted Data [TCP segment of a reassembled PDU]"
"317","0.639420925","199.232.37.164","192.168.1.118","TCP","1418","443 → 34948 [ACK] Seq=252825 Ack=1 Win=60 Len=1352 TSval=1976122389 TSecr=657501783 [TCP segment of a reassembled PDU]"
"318","0.643476187","199.232.37.164","192.168.1.118","TCP","1418","443 → 34948 [ACK] Seq=254177 Ack=1 Win=60 Len=1352 TSval=1976122393 TSecr=657501783 [TCP segment of a reassembled PDU]"
"319","0.644239150","199.232.37.164","192.168.1.118","TCP","1418","443 → 34948 [ACK] Seq=255529 Ack=1 Win=60 Len=1352 TSval=1976122393 TSecr=657501783 [TCP segment of a reassembled PDU]"
