frame.number,_ws.col.Time,_ws.col.Source,_ws.col.Destination,_ws.col.Protocol,frame.len,_ws.col.Info
"1","0.000000000","Cisco-Li_5b:1c:ce","IntelCor_b7:52:73","ARP","42","Who has 192.168.1.118? Tell 192.168.1.1"
"2","0.000057864","IntelCor_b7:52:73","Cisco-Li_5b:1c:ce","ARP","42","192.168.1.118 is at dc:fb:48:b7:52:73"
"3","1.333018253","192.168.1.104","255.255.255.255","UDP","217","49154 → 6666 Len=175"
"4","1.537811146","192.168.1.102","224.0.0.251","MDNS","183","Standard query response 0x0000 SRV, cache flush 0 0 8009 2c3f16b2-da5c-4b6f-d6cf-bfba61c12490.local"
"5","2.896762045","192.168.1.118","192.168.1.102","TCP","176","33923 → 8009 [PSH, ACK] Seq=1 Ack=1 Win=364 Len=110 TSval=18112300 TSecr=4356543 [TCP segment of a reassembled PDU]"
"6","2.903975297","192.168.1.102","192.168.1.118","TCP","176","8009 → 33923 [PSH, ACK] Seq=1 Ack=111 Win=294 Len=110 TSval=4357044 TSecr=18112300 [TCP segment of a reassembled PDU]"
"7","2.904077188","192.168.1.118","192.168.1.102","TCP","66","33923 → 8009 [ACK] Seq=111 Ack=111 Win=364 Len=0 TSval=18112307 TSecr=4357044"
"8","4.405231639","192.168.1.104","255.255.255.255","UDP","217","49154 → 6666 Len=175"
"9","5.737681810","IntelCor_b7:52:73","Broadcast","ARP","60","Who has 192.168.1.1? Tell 192.168.1.118"
"10","5.743089075","Cisco-Li_5b:1c:ce","IntelCor_b7:52:73","ARP","42","192.168.1.1 is at 58:6d:8f:5b:1c:ce"
"11","7.076465891","192.168.1.118","74.125.0.198","TCP","66","38734 → 80 [ACK] Seq=1 Ack=1 Win=432 Len=0 TSval=18116480 TSecr=1334489252"
"12","7.091815566","74.125.0.198","192.168.1.118","TCP","66","[TCP ACKed unseen segment] 80 → 38734 [ACK] Seq=1 Ack=2 Win=261 Len=0 TSval=1334534291 TSecr=18071456"
"13","7.375934160","192.168.1.104","255.255.255.255","UDP","217","49154 → 6666 Len=175"
"14","7.580467968","192.168.1.118","172.217.10.78","TCP","66","45314 → 80 [ACK] Seq=1 Ack=1 Win=260 Len=0 TSval=18116984 TSecr=2176189027"
"15","7.596705099","172.217.10.78","192.168.1.118","TCP","66","[TCP ACKed unseen segment] 80 → 45314 [ACK] Seq=1 Ack=2 Win=244 Len=0 TSval=2176234042 TSecr=18071983"
"16","7.737464588","192.168.1.118","74.125.172.26","TCP","66","36554 → 80 [ACK] Seq=1 Ack=1 Win=577 Len=0 TSval=18117141 TSecr=1918811012"
"17","7.793912888","74.125.172.26","192.168.1.118","TCP","66","[TCP ACKed unseen segment] 80 → 36554 [ACK] Seq=1 Ack=2 Win=261 Len=0 TSval=1918856073 TSecr=18072141"
"18","7.905643886","192.168.1.118","192.168.1.102","TCP","176","33923 → 8009 [PSH, ACK] Seq=111 Ack=111 Win=364 Len=110 TSval=18117309 TSecr=4357044 [TCP segment of a reassembled PDU]"
"19","7.910567596","192.168.1.102","192.168.1.118","TCP","176","8009 → 33923 [PSH, ACK] Seq=111 Ack=221 Win=294 Len=110 TSval=4357545 TSecr=18117309 [TCP segment of a reassembled PDU]"
"20","7.910666299","192.168.1.118","192.168.1.102","TCP","66","33923 → 8009 [ACK] Seq=221 Ack=221 Win=364 Len=0 TSval=18117314 TSecr=4357545"
"21","7.944461970","192.168.1.118","172.217.12.163","TCP","66","34302 → 443 [ACK] Seq=1 Ack=1 Win=451 Len=0 TSval=18117348 TSecr=3108415084"
"22","7.960492206","172.217.12.163","192.168.1.118","TCP","66","[TCP ACKed unseen segment] 443 → 34302 [ACK] Seq=1 Ack=2 Win=304 Len=0 TSval=3108460098 TSecr=18072324"
"23","8.503857810","192.168.1.100","224.0.0.251","MDNS","175","Standard query 0x0000 ANY cjqg._smb._tcp.local, "QM" question ANY cjqg._companion-link._tcp.local, "QM" question SRV 0 0 445 cjqg.local SRV 0 0 53222 cjqg.local OPT"
"24","8.813448746","192.168.1.100","224.0.0.251","MDNS","175","Standard query 0x0000 ANY cjqg._smb._tcp.local, "QM" question ANY cjqg._companion-link._tcp.local, "QM" question SRV 0 0 445 cjqg.local SRV 0 0 53222 cjqg.local OPT"
"25","9.119505982","192.168.1.100","224.0.0.251","MDNS","560","Standard query response 0x0000 TXT, cache flush PTR cjqg._smb._tcp.local TXT SRV, cache flush 0 0 445 cjqg.local TXT, cache flush PTR _companion-link._tcp.local PTR cjqg._companion-link._tcp.local SRV, cache flush 0 0 53222 cjqg.local AAAA, cache flush fe80::c65:98ef:d456:4a34 A, cache flush 192.168.1.100 NSEC, cache flush cjqg._smb._tcp.local NSEC, cache flush cjqg._companion-link._tcp.local NSEC, cache flush cjqg.local OPT"
"26","9.323295902","192.168.1.100","224.0.0.251","MDNS","563","Standard query 0x0000 PTR _uscan._tcp.local, "QM" question PTR _ippusb._tcp.local, "QM" question PTR _uscans._tcp.local, "QM" question PTR _scanner._tcp.local, "QM" question PTR _ipp._tcp.local, "QM" question PTR _ipps._tcp.local, "QM" question PTR _printer._tcp.local, "QM" question PTR _pdl-datastream._tcp.local, "QM" question PTR _ptp._tcp.local, "QM" question PTR _airplay._tcp.local, "QM" question PTR _raop._tcp.local, "QM" question PTR _airport._tcp.local, "QM" question PTR _rdlink._tcp.local, "QM" question PTR _companion-link._tcp.local, "QM" question PTR _googlecast._tcp.local, "QM" question PTR _apple-mobdev._tcp.local, "QM" question PTR 8ed307c3._sub._apple-mobdev2._tcp.local, "QM" question PTR _apple-pairable._tcp.local, "QM" question TXT Google-Home-Mini-2c3f16b2da5c4b6fd6cfbfba61c12490._googlecast._tcp.local, "QM" question PTR _homekit._tcp.local, "QM" question PTR _afpovertcp._tcp.local, "QM" question PTR _smb._tcp.local, "QM" question PTR _rfb._tcp.local, "QM" question PTR _adisk._tcp.local, "QM" question PTR cjqg._companion-link._tcp.local PTR Google-Home-Mini-2c3f16b2da5c4b6fd6cfbfba61c12490._googlecast._tcp.local PTR cjqg._smb._tcp.local OPT"
"27","9.424325675","192.168.1.102","224.0.0.251","MDNS","183","Standard query response 0x0000 SRV, cache flush 0 0 8009 2c3f16b2-da5c-4b6f-d6cf-bfba61c12490.local"
