frame.number,_ws.col.Time,_ws.col.Source,_ws.col.Destination,_ws.col.Protocol,frame.len,_ws.col.Info
"1","0.000000000","192.168.1.104","255.255.255.255","UDP","217","49154 → 6666 Len=175"
"2","0.411669938","142.250.64.78","192.168.1.118","TLSv1.2","1484","Application Data"
"3","0.413399225","142.250.64.78","192.168.1.118","TLSv1.2","1484","Application Data"
"4","0.413521600","192.168.1.118","142.250.64.78","TCP","66","37754 → 443 [ACK] Seq=1 Ack=2837 Win=493 Len=0 TSval=4236588356 TSecr=2670217598"
"5","0.414374113","142.250.64.78","192.168.1.118","TLSv1.2","1484","Application Data"
"6","0.417604975","142.250.64.78","192.168.1.118","TLSv1.2","2902","Application Data, Application Data"
"7","0.417726800","142.250.64.78","192.168.1.118","TLSv1.2","2902","Application Data, Application Data"
"8","0.420411263","142.250.64.78","192.168.1.118","TLSv1.2","2902","Application Data, Application Data"
"9","0.420556975","142.250.64.78","192.168.1.118","TLSv1.2","2902","Application Data, Application Data"
"10","0.420692450","142.250.64.78","192.168.1.118","TLSv1.2","2902","Application Data, Application Data"
"11","0.421561575","192.168.1.118","142.250.64.78","TCP","66","37754 → 443 [ACK] Seq=1 Ack=18435 Win=372 Len=0 TSval=4236588364 TSecr=2670217598"
"12","0.422103338","142.250.64.78","192.168.1.118","TLSv1.2","2902","Application Data, Application Data"
"13","0.422978713","142.250.64.78","192.168.1.118","TLSv1.2","2902","Application Data, Application Data"
"14","0.424768050","142.250.64.78","192.168.1.118","TLSv1.2","1484","Application Data [TCP segment of a reassembled PDU]"
"15","0.426115225","192.168.1.118","142.250.64.78","TCP","66","37754 → 443 [ACK] Seq=1 Ack=25525 Win=317 Len=0 TSval=4236588369 TSecr=2670217605"
"16","0.430555688","142.250.64.78","192.168.1.118","TLSv1.2","1484","Application Data [TCP segment of a reassembled PDU]"
"17","0.432482138","142.250.64.78","192.168.1.118","TLSv1.2","2902","Application Data, Application Data"
"18","0.439830000","142.250.64.78","192.168.1.118","TLSv1.2","1484","Application Data [TCP segment of a reassembled PDU]"
"19","0.442646388","142.250.64.78","192.168.1.118","TLSv1.2","1484","Application Data [TCP segment of a reassembled PDU]"
"20","0.442800450","142.250.64.78","192.168.1.118","TLSv1.2","2902","Application Data, Application Data"
"21","0.442856950","142.250.64.78","192.168.1.118","TLSv1.2","1484","Application Data [TCP segment of a reassembled PDU]"
"22","0.443128050","192.168.1.118","142.250.64.78","TCP","66","37754 → 443 [ACK] Seq=1 Ack=36869 Win=229 Len=0 TSval=4236588386 TSecr=2670217651"
"23","0.443968513","142.250.64.78","192.168.1.118","TLSv1.2","1484","Application Data [TCP segment of a reassembled PDU]"
"24","0.444123125","142.250.64.78","192.168.1.118","TLSv1.2","2902","Application Data, Application Data"
"25","0.444321650","192.168.1.118","142.250.64.78","TCP","66","37754 → 443 [ACK] Seq=1 Ack=41123 Win=196 Len=0 TSval=4236588387 TSecr=2670217660"
"26","0.445483275","192.168.1.118","209.18.47.62","DNS","71","Standard query 0x17ad A i.ytimg.com"
"27","0.446178438","192.168.1.118","209.18.47.62","DNS","71","Standard query 0x4b14 A i.ytimg.com"
"28","0.446345150","192.168.1.118","209.18.47.62","DNS","71","Standard query 0x6388 A i.ytimg.com"
"29","0.446770838","192.168.1.118","209.18.47.62","DNS","71","Standard query 0x3b3f A i.ytimg.com"
"30","0.447343238","192.168.1.118","209.18.47.62","DNS","71","Standard query 0x4351 A i.ytimg.com"
"31","0.455858150","142.250.64.78","192.168.1.118","TLSv1.2","2902","Application Data, Application Data"
"32","0.455933488","142.250.64.78","192.168.1.118","TLSv1.2","2902","Application Data, Application Data"
"33","0.455949713","142.250.64.78","192.168.1.118","TLSv1.2","520","Application Data, Application Data"
"34","0.468385700","209.18.47.62","192.168.1.118","DNS","87","Standard query response 0x4b14 A i.ytimg.com A 172.217.12.150"
"35","0.468743525","192.168.1.118","209.18.47.62","DNS","71","Standard query 0x5707 AAAA i.ytimg.com"
"36","0.469172613","209.18.47.62","192.168.1.118","DNS","87","Standard query response 0x3b3f A i.ytimg.com A 142.250.64.86"
"37","0.469400388","192.168.1.118","209.18.47.62","DNS","71","Standard query 0x174b AAAA i.ytimg.com"
"38","0.474950463","209.18.47.62","192.168.1.118","DNS","87","Standard query response 0x6388 A i.ytimg.com A 172.217.12.182"
"39","0.475158800","192.168.1.118","209.18.47.62","DNS","71","Standard query 0x13e6 AAAA i.ytimg.com"
"40","0.477502663","209.18.47.62","192.168.1.118","DNS","87","Standard query response 0x17ad A i.ytimg.com A 172.217.10.118"
"41","0.477607875","209.18.47.62","192.168.1.118","DNS","87","Standard query response 0x4351 A i.ytimg.com A 172.217.10.54"
"42","0.477845600","192.168.1.118","209.18.47.62","DNS","71","Standard query 0x2b43 AAAA i.ytimg.com"
"43","0.478028150","192.168.1.118","209.18.47.62","DNS","71","Standard query 0xb784 AAAA i.ytimg.com"
"44","0.478136300","192.168.1.118","142.250.64.78","TCP","66","37754 → 443 [ACK] Seq=1 Ack=47249 Win=149 Len=0 TSval=4236588421 TSecr=2670217662"
"45","0.487170675","209.18.47.62","192.168.1.118","DNS","99","Standard query response 0x5707 AAAA i.ytimg.com AAAA 2607:f8b0:4006:819::2016"
"46","0.489245375","209.18.47.62","192.168.1.118","DNS","99","Standard query response 0x174b AAAA i.ytimg.com AAAA 2607:f8b0:4006:806::2016"
"47","0.491278100","192.168.1.118","172.217.12.150","TCP","74","37886 → 443 [SYN] Seq=0 Win=64240 Len=0 MSS=1460 SACK_PERM=1 TSval=476197593 TSecr=0 WS=128"
"48","0.491393500","192.168.1.118","172.217.12.150","TCP","74","37888 → 443 [SYN] Seq=0 Win=64240 Len=0 MSS=1460 SACK_PERM=1 TSval=476197593 TSecr=0 WS=128"
"49","0.491469750","192.168.1.118","172.217.12.150","TCP","74","37890 → 443 [SYN] Seq=0 Win=64240 Len=0 MSS=1460 SACK_PERM=1 TSval=476197593 TSecr=0 WS=128"
"50","0.491545813","192.168.1.118","172.217.12.150","TCP","74","37892 → 443 [SYN] Seq=0 Win=64240 Len=0 MSS=1460 SACK_PERM=1 TSval=476197593 TSecr=0 WS=128"
"51","0.491619200","192.168.1.118","172.217.12.150","TCP","74","37894 → 443 [SYN] Seq=0 Win=64240 Len=0 MSS=1460 SACK_PERM=1 TSval=476197593 TSecr=0 WS=128"
"52","0.494561038","209.18.47.62","192.168.1.118","DNS","99","Standard query response 0x13e6 AAAA i.ytimg.com AAAA 2607:f8b0:4006:81a::2016"
"53","0.495254425","209.18.47.62","192.168.1.118","DNS","99","Standard query response 0x2b43 AAAA i.ytimg.com AAAA 2607:f8b0:4006:811::2016"
"54","0.495330725","209.18.47.62","192.168.1.118","DNS","99","Standard query response 0xb784 AAAA i.ytimg.com AAAA 2607:f8b0:4006:803::2016"
"55","0.505817850","172.217.12.150","192.168.1.118","TCP","74","443 → 37888 [SYN, ACK] Seq=0 Ack=1 Win=60192 Len=0 MSS=1380 SACK_PERM=1 TSval=1080612016 TSecr=476197593 WS=256"
"56","0.505918188","192.168.1.118","172.217.12.150","TCP","66","37888 → 443 [ACK] Seq=1 Ack=1 Win=64256 Len=0 TSval=476197607 TSecr=1080612016"
"57","0.511988388","172.217.12.150","192.168.1.118","TCP","74","443 → 37886 [SYN, ACK] Seq=0 Ack=1 Win=60192 Len=0 MSS=1380 SACK_PERM=1 TSval=3058826996 TSecr=476197593 WS=256"
"58","0.512123463","192.168.1.118","172.217.12.150","TCP","66","37886 → 443 [ACK] Seq=1 Ack=1 Win=64256 Len=0 TSval=476197614 TSecr=3058826996"
"59","0.519282713","172.217.12.150","192.168.1.118","TCP","74","443 → 37892 [SYN, ACK] Seq=0 Ack=1 Win=60192 Len=0 MSS=1380 SACK_PERM=1 TSval=1359002540 TSecr=476197593 WS=256"
"60","0.519416375","192.168.1.118","172.217.12.150","TCP","66","37892 → 443 [ACK] Seq=1 Ack=1 Win=64256 Len=0 TSval=476197621 TSecr=1359002540"
"61","0.520379200","172.217.12.150","192.168.1.118","TCP","74","443 → 37894 [SYN, ACK] Seq=0 Ack=1 Win=60192 Len=0 MSS=1380 SACK_PERM=1 TSval=299568963 TSecr=476197593 WS=256"
"62","0.520529713","192.168.1.118","172.217.12.150","TCP","66","37894 → 443 [ACK] Seq=1 Ack=1 Win=64256 Len=0 TSval=476197622 TSecr=299568963"
"63","0.522346400","172.217.12.150","192.168.1.118","TCP","74","443 → 37890 [SYN, ACK] Seq=0 Ack=1 Win=60192 Len=0 MSS=1380 SACK_PERM=1 TSval=4275072956 TSecr=476197593 WS=256"
"64","0.522495350","192.168.1.118","172.217.12.150","TCP","66","37890 → 443 [ACK] Seq=1 Ack=1 Win=64256 Len=0 TSval=476197624 TSecr=4275072956"
"65","0.532305763","192.168.1.118","172.217.12.150","TLSv1","583","Client Hello"
"66","0.548553750","192.168.1.118","172.217.12.150","TLSv1","583","Client Hello"
"67","0.556297438","172.217.12.150","192.168.1.118","TCP","66","443 → 37886 [ACK] Seq=1 Ack=518 Win=61440 Len=0 TSval=3058827045 TSecr=476197634"
"68","0.563529638","172.217.12.150","192.168.1.118","TLSv1.2","1484","Server Hello"
"69","0.563658613","192.168.1.118","172.217.12.150","TCP","66","37886 → 443 [ACK] Seq=518 Ack=1419 Win=63104 Len=0 TSval=476197665 TSecr=3058827053"
"70","0.564795938","192.168.1.118","172.217.12.150","TLSv1","583","Client Hello"
"71","0.571148138","172.217.12.150","192.168.1.118","TLSv1.2","1719","Certificate, Server Key Exchange, Server Hello Done"
"72","0.571328863","192.168.1.118","172.217.12.150","TCP","66","37886 → 443 [ACK] Seq=518 Ack=3072 Win=61568 Len=0 TSval=476197673 TSecr=3058827053"
"73","0.572034300","172.217.12.150","192.168.1.118","TCP","66","443 → 37888 [ACK] Seq=1 Ack=518 Win=61440 Len=0 TSval=1080612076 TSecr=476197650"
"74","0.574363413","172.217.12.150","192.168.1.118","TLSv1.2","3137","Server Hello, Certificate, Server Key Exchange, Server Hello Done"
"75","0.574464363","192.168.1.118","172.217.12.150","TCP","66","37888 → 443 [ACK] Seq=518 Ack=3072 Win=61312 Len=0 TSval=476197676 TSecr=1080612083"
"76","0.581084913","192.168.1.118","172.217.12.150","TLSv1","583","Client Hello"
"77","0.597352025","192.168.1.118","172.217.12.150","TLSv1","583","Client Hello"
"78","0.598568438","192.168.1.118","209.18.47.62","DNS","75","Standard query 0x0fe1 A www.gstatic.com"
"79","0.599767163","192.168.1.118","172.217.12.150","TLSv1.2","192","Client Key Exchange, Change Cipher Spec, Encrypted Handshake Message"
"80","0.601643813","192.168.1.118","172.217.12.150","TLSv1.2","192","Client Key Exchange, Change Cipher Spec, Encrypted Handshake Message"
"81","0.603263913","172.217.12.150","192.168.1.118","TLSv1.2","301","[TCP Spurious Retransmission] , Ignored Unknown Record"
"82","0.603405738","192.168.1.118","172.217.12.150","TCP","78","[TCP Dup ACK 72#1] 37886 → 443 [ACK] Seq=644 Ack=3072 Win=64128 Len=0 TSval=476197705 TSecr=3058827095 SLE=2837 SRE=3072"
"83","0.612336150","172.217.12.150","192.168.1.118","TCP","66","443 → 37890 [ACK] Seq=1 Ack=518 Win=61440 Len=0 TSval=4275073046 TSecr=476197666"
"84","0.613291225","172.217.12.150","192.168.1.118","TLSv1.2","301","[TCP Spurious Retransmission] , Ignored Unknown Record"
"85","0.613415100","192.168.1.118","172.217.12.150","TCP","78","[TCP Dup ACK 75#1] 37888 → 443 [ACK] Seq=644 Ack=3072 Win=64128 Len=0 TSval=476197715 TSecr=1080612125 SLE=2837 SRE=3072"
"86","0.619074713","172.217.12.150","192.168.1.118","TLSv1.2","3137","Server Hello, Certificate, Server Key Exchange, Server Hello Done"
"87","0.619197313","192.168.1.118","172.217.12.150","TCP","66","37890 → 443 [ACK] Seq=518 Ack=3072 Win=61312 Len=0 TSval=476197721 TSecr=4275073052"
"88","0.620114200","192.168.1.118","209.18.47.62","DNS","73","Standard query 0xefdd A yt3.ggpht.com"
"89","0.624185038","172.217.12.150","192.168.1.118","TCP","66","443 → 37892 [ACK] Seq=1 Ack=518 Win=61440 Len=0 TSval=1359002645 TSecr=476197682"
"90","0.624854188","172.217.12.150","192.168.1.118","TLSv1.2","117","Change Cipher Spec, Encrypted Handshake Message"
"91","0.624949488","192.168.1.118","172.217.12.150","TCP","66","37886 → 443 [ACK] Seq=644 Ack=3123 Win=64128 Len=0 TSval=476197726 TSecr=3058827116"
"92","0.625011563","172.217.12.150","192.168.1.118","TLSv1.2","117","Change Cipher Spec, Encrypted Handshake Message"
"93","0.625056000","192.168.1.118","172.217.12.150","TCP","66","37888 → 443 [ACK] Seq=644 Ack=3123 Win=64128 Len=0 TSval=476197726 TSecr=1080612136"
"94","0.626255300","172.217.12.150","192.168.1.118","TCP","66","443 → 37894 [ACK] Seq=1 Ack=518 Win=61440 Len=0 TSval=299569068 TSecr=476197699"
"95","0.627547425","209.18.47.62","192.168.1.118","DNS","91","Standard query response 0x0fe1 A www.gstatic.com A 172.217.3.99"
"96","0.627771200","192.168.1.118","209.18.47.62","DNS","75","Standard query 0x8faf AAAA www.gstatic.com"
"97","0.632141113","172.217.12.150","192.168.1.118","TLSv1.2","1484","Server Hello"
"98","0.632274313","192.168.1.118","172.217.12.150","TCP","66","37894 → 443 [ACK] Seq=518 Ack=1419 Win=63104 Len=0 TSval=476197734 TSecr=299569075"
"99","0.632326738","192.168.1.118","172.217.12.150","TLSv1.2","363","Application Data"
"100","0.632583238","192.168.1.118","172.217.12.150","TLSv1.2","363","Application Data"
"101","0.633579588","172.217.12.150","192.168.1.118","TLSv1.2","1719","Certificate, Server Key Exchange, Server Hello Done"
"102","0.633687300","192.168.1.118","172.217.12.150","TCP","66","37894 → 443 [ACK] Seq=518 Ack=3072 Win=61568 Len=0 TSval=476197735 TSecr=299569075"
"103","0.633765863","172.217.12.150","192.168.1.118","TLSv1.2","1484","Server Hello"
"104","0.633820038","192.168.1.118","172.217.12.150","TCP","66","37892 → 443 [ACK] Seq=518 Ack=1419 Win=63104 Len=0 TSval=476197735 TSecr=1359002653"
"105","0.634427913","192.168.1.118","172.217.12.150","TLSv1.2","192","Client Key Exchange, Change Cipher Spec, Encrypted Handshake Message"
"106","0.636365325","192.168.1.118","172.217.12.150","TLSv1.2","192","Client Key Exchange, Change Cipher Spec, Encrypted Handshake Message"
"107","0.636775700","172.217.12.150","192.168.1.118","TLSv1.2","1719","Certificate, Server Key Exchange, Server Hello Done"
"108","0.636874900","192.168.1.118","172.217.12.150","TCP","66","37892 → 443 [ACK] Seq=518 Ack=3072 Win=61568 Len=0 TSval=476197738 TSecr=1359002653"
"109","0.636950988","209.18.47.62","192.168.1.118","DNS","134","Standard query response 0xefdd A yt3.ggpht.com CNAME photos-ugc.l.googleusercontent.com A 172.217.10.1"
"110","0.637210163","192.168.1.118","209.18.47.62","DNS","73","Standard query 0x4ba3 AAAA yt3.ggpht.com"
"111","0.638092800","192.168.1.118","209.18.47.62","DNS","73","Standard query 0x6f97 A yt3.ggpht.com"
"112","0.638854750","192.168.1.118","172.217.12.150","TLSv1.2","192","Client Key Exchange, Change Cipher Spec, Encrypted Handshake Message"
"113","0.646984288","209.18.47.62","192.168.1.118","DNS","103","Standard query response 0x8faf AAAA www.gstatic.com AAAA 2607:f8b0:4006:818::2003"
"114","0.650180150","192.168.1.118","172.217.3.99","TCP","74","44834 → 443 [SYN] Seq=0 Win=64240 Len=0 MSS=1460 SACK_PERM=1 TSval=4165194736 TSecr=0 WS=128"
"115","0.655435475","172.217.12.150","192.168.1.118","TLSv1.2","117","Change Cipher Spec, Encrypted Handshake Message"
"116","0.656900838","172.217.12.150","192.168.1.118","TLSv1.2","117","Change Cipher Spec, Encrypted Handshake Message"
"117","0.656998050","172.217.12.150","192.168.1.118","TLSv1.2","117","Change Cipher Spec, Encrypted Handshake Message"
"118","0.659069463","172.217.12.150","192.168.1.118","TLSv1.2","1484","Application Data"
"119","0.659174338","172.217.12.150","192.168.1.118","TLSv1.2","1484","Application Data"
"120","0.660109900","172.217.12.150","192.168.1.118","TLSv1.2","2902","Application Data, Application Data"
"121","0.660875338","192.168.1.118","172.217.12.150","TCP","66","37888 → 443 [ACK] Seq=941 Ack=8795 Win=58496 Len=0 TSval=476197762 TSecr=1080612167"
"122","0.661371088","192.168.1.118","172.217.12.150","TLSv1.2","363","Application Data"
"123","0.661595350","192.168.1.118","172.217.12.150","TLSv1.2","363","Application Data"
"124","0.661806800","192.168.1.118","172.217.12.150","TLSv1.2","363","Application Data"
"125","0.663786263","192.168.1.118","209.18.47.62","DNS","73","Standard query 0x733f A yt3.ggpht.com"
"126","0.664391988","172.217.12.150","192.168.1.118","TLSv1.2","1484","Application Data"
"127","0.667713250","172.217.12.150","192.168.1.118","TLSv1.2","1484","Application Data"
"128","0.667849688","172.217.12.150","192.168.1.118","TLSv1.2","2902","Application Data, Application Data"
"129","0.667931425","172.217.12.150","192.168.1.118","TLSv1.2","2902","Application Data, Application Data"
"130","0.667991050","172.217.12.150","192.168.1.118","TLSv1.2","1484","Application Data"
"131","0.668023900","172.217.12.150","192.168.1.118","TLSv1.2","1233","Application Data"
"132","0.668093900","172.217.12.150","192.168.1.118","TLSv1.2","2450","Application Data, Application Data"
"133","0.668155588","209.18.47.62","192.168.1.118","DNS","146","Standard query response 0x4ba3 AAAA yt3.ggpht.com CNAME photos-ugc.l.googleusercontent.com AAAA 2607:f8b0:4006:802::2001"
"134","0.668245300","209.18.47.62","192.168.1.118","DNS","134","Standard query response 0x6f97 A yt3.ggpht.com CNAME photos-ugc.l.googleusercontent.com A 172.217.10.129"
"135","0.668325750","192.168.1.118","172.217.12.150","TCP","66","37886 → 443 [ACK] Seq=941 Ack=12597 Win=54656 Len=0 TSval=476197770 TSecr=3058827147"
"136","0.668501475","192.168.1.118","172.217.12.150","TCP","66","37888 → 443 [ACK] Seq=941 Ack=12798 Win=54528 Len=0 TSval=476197770 TSecr=1080612167"
"137","0.669464700","192.168.1.118","209.18.47.62","DNS","73","Standard query 0x270d AAAA yt3.ggpht.com"
"138","0.670269588","192.168.1.118","172.217.10.1","TCP","74","37920 → 443 [SYN] Seq=0 Win=64240 Len=0 MSS=1460 SACK_PERM=1 TSval=3765841515 TSecr=0 WS=128"
"139","0.670374988","192.168.1.118","172.217.10.1","TCP","74","37922 → 443 [SYN] Seq=0 Win=64240 Len=0 MSS=1460 SACK_PERM=1 TSval=3765841515 TSecr=0 WS=128"
"140","0.670448225","192.168.1.118","172.217.10.1","TCP","74","37924 → 443 [SYN] Seq=0 Win=64240 Len=0 MSS=1460 SACK_PERM=1 TSval=3765841515 TSecr=0 WS=128"
"141","0.672076000","192.168.1.118","142.250.64.78","TCP","66","[TCP Window Update] 37754 → 443 [ACK] Seq=1 Ack=47249 Win=501 Len=0 TSval=4236588614 TSecr=2670217662"
"142","0.673134400","192.168.1.118","172.217.12.150","TLSv1.2","363","Application Data"
"143","0.675169025","172.217.3.99","192.168.1.118","TCP","74","443 → 44834 [SYN, ACK] Seq=0 Ack=1 Win=60192 Len=0 MSS=1380 SACK_PERM=1 TSval=1209927508 TSecr=4165194736 WS=256"
"144","0.675295663","192.168.1.118","172.217.3.99","TCP","66","44834 → 443 [ACK] Seq=1 Ack=1 Win=64256 Len=0 TSval=4165194761 TSecr=1209927508"
"145","0.685514388","172.217.12.150","192.168.1.118","TLSv1.2","1484","Application Data"
"146","0.687494163","172.217.12.150","192.168.1.118","TLSv1.2","2902","Application Data, Application Data"
"147","0.687598650","172.217.12.150","192.168.1.118","TLSv1.2","2902","Application Data, Application Data"
"148","0.687681150","172.217.12.150","192.168.1.118","TLSv1.2","1484","Application Data"
"149","0.690417000","172.217.12.150","192.168.1.118","TLSv1.2","1484","Application Data"
"150","0.690538563","172.217.12.150","192.168.1.118","TLSv1.2","2902","Application Data, Application Data"
"151","0.690651913","172.217.12.150","192.168.1.118","TLSv1.2","1484","Application Data"
"152","0.690695500","172.217.12.150","192.168.1.118","TLSv1.2","1484","Application Data"
"153","0.690724688","172.217.12.150","192.168.1.118","TLSv1.2","5738","Application Data, Application Data, Application Data, Application Data"
"154","0.691204338","192.168.1.118","172.217.3.99","TLSv1","583","Client Hello"
"155","0.691804950","192.168.1.118","172.217.12.150","TLSv1.2","363","Application Data"
"156","0.691907488","192.168.1.118","172.217.12.150","TCP","66","37890 → 443 [ACK] Seq=941 Ack=13049 Win=54272 Len=0 TSval=476197793 TSecr=4275073121"
"157","0.691954413","172.217.12.150","192.168.1.118","TLSv1.2","2902","Application Data, Application Data"
"158","0.692054775","192.168.1.118","172.217.12.150","TCP","66","37892 → 443 [ACK] Seq=941 Ack=13049 Win=54272 Len=0 TSval=476197793 TSecr=1359002706"
"159","0.692125150","172.217.12.150","192.168.1.118","TLSv1.2","259","Application Data"
"160","0.692174875","172.217.12.150","192.168.1.118","TLSv1.2","5738","Application Data, Application Data, Application Data, Application Data"
"161","0.692192650","192.168.1.118","172.217.12.150","TCP","66","37894 → 443 [ACK] Seq=941 Ack=7377 Win=59904 Len=0 TSval=476197794 TSecr=299569128"
"162","0.692272950","192.168.1.118","172.217.12.150","TCP","66","37894 → 443 [ACK] Seq=941 Ack=13049 Win=54272 Len=0 TSval=476197794 TSecr=299569128"
"163","0.705970550","192.168.1.118","172.217.12.150","TLSv1.2","363","Application Data"
"164","0.722937950","172.217.12.150","192.168.1.118","TLSv1.2","806","Application Data"
"165","0.723038788","172.217.12.150","192.168.1.118","TLSv1.2","1150","Application Data"
"166","0.723103925","209.18.47.62","192.168.1.118","DNS","146","Standard query response 0x270d AAAA yt3.ggpht.com CNAME photos-ugc.l.googleusercontent.com AAAA 2607:f8b0:4006:812::2001"
"167","0.723178188","209.18.47.62","192.168.1.118","DNS","134","Standard query response 0x733f A yt3.ggpht.com CNAME photos-ugc.l.googleusercontent.com A 172.217.10.33"
"168","0.723309550","172.217.12.150","192.168.1.118","TLSv1.2","1484","Application Data"
"169","0.723410200","172.217.10.1","192.168.1.118","TCP","74","443 → 37922 [SYN, ACK] Seq=0 Ack=1 Win=60192 Len=0 MSS=1380 SACK_PERM=1 TSval=4066527222 TSecr=3765841515 WS=256"
"170","0.723527900","192.168.1.118","172.217.10.1","TCP","66","37922 → 443 [ACK] Seq=1 Ack=1 Win=64256 Len=0 TSval=3765841568 TSecr=4066527222"
"171","0.723618025","172.217.10.1","192.168.1.118","TCP","74","443 → 37924 [SYN, ACK] Seq=0 Ack=1 Win=60192 Len=0 MSS=1380 SACK_PERM=1 TSval=4066527222 TSecr=3765841515 WS=256"
"172","0.723717513","192.168.1.118","172.217.10.1","TCP","66","37924 → 443 [ACK] Seq=1 Ack=1 Win=64256 Len=0 TSval=3765841568 TSecr=4066527222"
"173","0.723795763","172.217.12.150","192.168.1.118","TLSv1.2","2902","Application Data, Application Data"
"174","0.723864100","172.217.10.1","192.168.1.118","TCP","74","443 → 37920 [SYN, ACK] Seq=0 Ack=1 Win=60192 Len=0 MSS=1380 SACK_PERM=1 TSval=902268810 TSecr=3765841515 WS=256"
"175","0.723955200","192.168.1.118","172.217.10.1","TCP","66","37920 → 443 [ACK] Seq=1 Ack=1 Win=64256 Len=0 TSval=3765841568 TSecr=902268810"
"176","0.724030150","172.217.12.150","192.168.1.118","TLSv1.2","1484","Application Data"
"177","0.724168775","172.217.12.150","192.168.1.118","TLSv1.2","1484","Application Data"
"178","0.724288488","172.217.12.150","192.168.1.118","TLSv1.2","1576","Application Data, Application Data"
"179","0.725456550","192.168.1.118","209.18.47.62","DNS","73","Standard query 0x0762 AAAA yt3.ggpht.com"
"180","0.731165375","172.217.12.150","192.168.1.118","TLSv1.2","259","[TCP Spurious Retransmission] , Application Data"
"181","0.731272625","192.168.1.118","172.217.12.150","TCP","78","[TCP Dup ACK 163#1] 37890 → 443 [ACK] Seq=1238 Ack=13242 Win=64128 Len=0 TSval=476197833 TSecr=4275073168 SLE=13049 SRE=13242"
"182","0.733030450","172.217.12.150","192.168.1.118","TCP","1150","[TCP Retransmission] 443 → 37894 [PSH, ACK] Seq=13049 Ack=941 Win=62464 Len=1084 TSval=299569176 TSecr=476197763"
"183","0.733103550","192.168.1.118","172.217.12.150","TCP","78","37894 → 443 [ACK] Seq=941 Ack=14133 Win=64128 Len=0 TSval=476197835 TSecr=299569176 SLE=13049 SRE=14133"
"184","0.734729675","172.217.12.150","192.168.1.118","TCP","806","[TCP Retransmission] 443 → 37892 [PSH, ACK] Seq=13049 Ack=941 Win=62464 Len=740 TSval=1359002755 TSecr=476197763"
"185","0.734801750","192.168.1.118","172.217.12.150","TCP","78","37892 → 443 [ACK] Seq=941 Ack=13789 Win=64128 Len=0 TSval=476197836 TSecr=1359002755 SLE=13049 SRE=13789"
"186","0.736607688","172.217.3.99","192.168.1.118","TCP","66","443 → 44834 [ACK] Seq=1 Ack=518 Win=61440 Len=0 TSval=1209927567 TSecr=4165194777"
"187","0.736664725","172.217.12.150","192.168.1.118","TLSv1.2","1484","Application Data"
"188","0.738249188","172.217.12.150","192.168.1.118","TLSv1.2","2902","Application Data, Application Data"
"189","0.739810788","172.217.12.150","192.168.1.118","TLSv1.2","1484","Application Data"
"190","0.739908613","172.217.12.150","192.168.1.118","TLSv1.2","2902","Application Data, Application Data"
"191","0.739936663","172.217.12.150","192.168.1.118","TLSv1.2","217","Application Data"
"192","0.741290738","172.217.3.99","192.168.1.118","TLSv1.2","1484","Server Hello"
"193","0.741375413","192.168.1.118","172.217.3.99","TCP","66","44834 → 443 [ACK] Seq=518 Ack=1419 Win=63104 Len=0 TSval=4165194827 TSecr=1209927574"
"194","0.741737413","192.168.1.118","172.217.10.1","TLSv1","583","Client Hello"
"195","0.751184088","172.217.3.99","192.168.1.118","TLSv1.2","1307","Certificate, Server Key Exchange, Server Hello Done"
"196","0.751311513","192.168.1.118","172.217.3.99","TCP","66","44834 → 443 [ACK] Seq=518 Ack=2660 Win=61952 Len=0 TSval=4165194837 TSecr=1209927574"
"197","0.753743900","172.217.12.150","192.168.1.118","TCP","158","[TCP Retransmission] 443 → 37888 [PSH, ACK] Seq=21306 Ack=1238 Win=63488 Len=92 TSval=1080612260 TSecr=476197775"
"198","0.753851213","192.168.1.118","172.217.12.150","TCP","78","37888 → 443 [ACK] Seq=1238 Ack=21398 Win=55552 Len=0 TSval=476197855 TSecr=1080612206 SLE=21306 SRE=21398"
"199","0.753935063","209.18.47.62","192.168.1.118","DNS","146","Standard query response 0x0762 AAAA yt3.ggpht.com CNAME photos-ugc.l.googleusercontent.com AAAA 2607:f8b0:4006:803::2001"
"200","0.754011663","172.217.12.150","192.168.1.118","TLSv1.2","1484","Application Data"
"201","0.754086275","192.168.1.118","172.217.12.150","TCP","66","37890 → 443 [ACK] Seq=1238 Ack=14660 Win=63104 Len=0 TSval=476197855 TSecr=4275073186"
"202","0.754145375","172.217.12.150","192.168.1.118","TLSv1.2","1484","Application Data"
"203","0.754199163","192.168.1.118","172.217.12.150","TCP","66","37890 → 443 [ACK] Seq=1238 Ack=16078 Win=61696 Len=0 TSval=476197856 TSecr=4275073187"
"204","0.754309013","172.217.12.150","192.168.1.118","TLSv1.2","2902","Application Data, Application Data"
"205","0.754371325","192.168.1.118","172.217.12.150","TCP","66","37890 → 443 [ACK] Seq=1238 Ack=18914 Win=58880 Len=0 TSval=476197856 TSecr=4275073188"
"206","0.755283550","172.217.12.150","192.168.1.118","TLSv1.2","2902","Application Data, Application Data"
"207","0.755351450","192.168.1.118","172.217.12.150","TCP","66","37890 → 443 [ACK] Seq=1238 Ack=21750 Win=56064 Len=0 TSval=476197857 TSecr=4275073189"
"208","0.755385238","172.217.12.150","192.168.1.118","TLSv1.2","441","Application Data"
"209","0.755439188","192.168.1.118","172.217.12.150","TCP","66","37890 → 443 [ACK] Seq=1238 Ack=22125 Win=55808 Len=0 TSval=476197857 TSecr=4275073190"
"210","0.758336438","192.168.1.118","172.217.10.1","TLSv1","583","Client Hello"
"211","0.771532850","172.217.10.1","192.168.1.118","TCP","66","443 → 37920 [ACK] Seq=1 Ack=518 Win=61440 Len=0 TSval=902268885 TSecr=3765841586"
"212","0.774853438","192.168.1.118","172.217.10.1","TLSv1","583","Client Hello"
"213","0.775081688","192.168.1.118","172.217.12.150","TCP","66","37886 → 443 [ACK] Seq=1238 Ack=21256 Win=55552 Len=0 TSval=476197877 TSecr=3058827227"
"214","0.777445288","172.217.10.1","192.168.1.118","TLSv1.2","1484","Server Hello"
"215","0.777545225","192.168.1.118","172.217.10.1","TCP","66","37920 → 443 [ACK] Seq=518 Ack=1419 Win=63104 Len=0 TSval=3765841622 TSecr=902268891"
"216","0.777881775","192.168.1.118","172.217.3.99","TLSv1.2","192","Client Key Exchange, Change Cipher Spec, Encrypted Handshake Message"
"217","0.778727150","172.217.10.1","192.168.1.118","TCP","2902","443 → 37920 [ACK] Seq=1419 Ack=518 Win=61440 Len=2836 TSval=902268891 TSecr=3765841586 [TCP segment of a reassembled PDU]"
"218","0.778823625","192.168.1.118","172.217.10.1","TCP","66","37920 → 443 [ACK] Seq=518 Ack=4255 Win=61056 Len=0 TSval=3765841623 TSecr=902268891"
"219","0.782103450","172.217.10.1","192.168.1.118","TLSv1.2","1046","Certificate, Server Key Exchange, Server Hello Done"
"220","0.782246700","192.168.1.118","172.217.10.1","TCP","66","37920 → 443 [ACK] Seq=518 Ack=5235 Win=60160 Len=0 TSval=3765841627 TSecr=902268891"
"221","0.782357663","172.217.10.1","192.168.1.118","TCP","66","443 → 37922 [ACK] Seq=1 Ack=518 Win=61440 Len=0 TSval=4066527303 TSecr=3765841603"
"222","0.784625563","172.217.10.1","192.168.1.118","TLSv1.2","1484","Server Hello"
"223","0.784739338","192.168.1.118","172.217.10.1","TCP","66","37922 → 443 [ACK] Seq=518 Ack=1419 Win=63104 Len=0 TSval=3765841629 TSecr=4066527310"
"224","0.784839438","192.168.1.118","172.217.10.1","TLSv1.2","192","Client Key Exchange, Change Cipher Spec, Encrypted Handshake Message"
"225","0.785277850","192.168.1.118","172.217.12.150","TLSv1.2","363","Application Data"
"226","0.785386113","192.168.1.118","172.217.12.150","TLSv1.2","442","Application Data"
"227","0.785593975","172.217.10.1","192.168.1.118","TCP","2902","443 → 37922 [ACK] Seq=1419 Ack=518 Win=61440 Len=2836 TSval=4066527310 TSecr=3765841603 [TCP segment of a reassembled PDU]"
"228","0.785693288","192.168.1.118","172.217.10.1","TCP","66","37922 → 443 [ACK] Seq=518 Ack=4255 Win=61056 Len=0 TSval=3765841630 TSecr=4066527310"
"229","0.788369088","172.217.10.1","192.168.1.118","TLSv1.2","1045","Certificate, Server Key Exchange, Server Hello Done"
"230","0.788480238","192.168.1.118","172.217.10.1","TCP","66","37922 → 443 [ACK] Seq=518 Ack=5234 Win=63104 Len=0 TSval=3765841633 TSecr=4066527310"
"231","0.792678588","192.168.1.118","172.217.10.1","TLSv1.2","192","Client Key Exchange, Change Cipher Spec, Encrypted Handshake Message"
"232","0.795982300","192.168.1.118","172.217.12.150","TLSv1.2","363","Application Data"
"233","0.795996113","172.217.12.150","192.168.1.118","TLSv1.2","217","[TCP Spurious Retransmission] , Application Data"
"234","0.796119275","192.168.1.118","172.217.12.150","TCP","78","[TCP Dup ACK 213#1] 37886 → 443 [ACK] Seq=1535 Ack=21256 Win=64128 Len=0 TSval=476197898 TSecr=3058827286 SLE=21105 SRE=21256"
"235","0.796169238","192.168.1.118","172.217.12.150","TLSv1.2","363","Application Data"
"236","0.796292713","192.168.1.118","172.217.12.150","TLSv1.2","363","Application Data"
"237","0.800374300","172.217.3.99","192.168.1.118","TLSv1.2","117","Change Cipher Spec, Encrypted Handshake Message"
"238","0.801253275","192.168.1.118","172.217.3.99","TLSv1.2","390","Application Data"
"239","0.803006613","172.217.10.1","192.168.1.118","TCP","66","443 → 37924 [ACK] Seq=1 Ack=518 Win=61440 Len=0 TSval=4066527327 TSecr=3765841619"
"240","0.807475313","172.217.10.1","192.168.1.118","TLSv1.2","1484","Server Hello"
"241","0.807581950","192.168.1.118","172.217.10.1","TCP","66","37924 → 443 [ACK] Seq=518 Ack=1419 Win=63104 Len=0 TSval=3765841652 TSecr=4066527334"
"242","0.809669550","172.217.10.1","192.168.1.118","TLSv1.2","3881","Certificate, Server Key Exchange, Server Hello Done"
"243","0.809780788","192.168.1.118","172.217.10.1","TCP","66","37924 → 443 [ACK] Seq=518 Ack=5234 Win=59392 Len=0 TSval=3765841654 TSecr=4066527334"
"244","0.812403863","192.168.1.118","172.217.10.1","TLSv1.2","192","Client Key Exchange, Change Cipher Spec, Encrypted Handshake Message"
"245","0.820206338","172.217.12.150","192.168.1.118","TLSv1.2","1484","Application Data"
"246","0.820379088","192.168.1.118","172.217.12.150","TCP","66","37892 → 443 [ACK] Seq=1238 Ack=15207 Win=63104 Len=0 TSval=476197922 TSecr=1359002831"
"247","0.820498350","172.217.12.150","192.168.1.118","TLSv1.2","2902","Application Data, Application Data"
"248","0.820562713","192.168.1.118","172.217.12.150","TCP","66","37892 → 443 [ACK] Seq=1238 Ack=18043 Win=61056 Len=0 TSval=476197922 TSecr=1359002831"
"249","0.820631813","172.217.12.150","192.168.1.118","TLSv1.2","1484","Application Data"
"250","0.820709813","192.168.1.118","172.217.12.150","TCP","66","37894 → 443 [ACK] Seq=1317 Ack=15551 Win=63104 Len=0 TSval=476197922 TSecr=299569253"
"251","0.820795563","172.217.12.150","192.168.1.118","TLSv1.2","2902","Application Data, Application Data"
"252","0.820873238","192.168.1.118","172.217.12.150","TCP","66","37894 → 443 [ACK] Seq=1317 Ack=18387 Win=60288 Len=0 TSval=476197922 TSecr=299569254"
"253","0.820935575","172.217.10.1","192.168.1.118","TLSv1.2","117","Change Cipher Spec, Encrypted Handshake Message"
"254","0.821114788","172.217.12.150","192.168.1.118","TLSv1.2","2902","Application Data, Application Data"
"255","0.821185763","192.168.1.118","172.217.12.150","TCP","66","37892 → 443 [ACK] Seq=1238 Ack=20879 Win=58240 Len=0 TSval=476197923 TSecr=1359002832"
"256","0.821275325","172.217.12.150","192.168.1.118","TLSv1.2","1903","Application Data, Application Data"
"257","0.821345550","192.168.1.118","172.217.12.150","TCP","66","37892 → 443 [ACK] Seq=1238 Ack=22716 Win=56448 Len=0 TSval=476197923 TSecr=1359002834"
"258","0.821412675","172.217.12.150","192.168.1.118","TLSv1.2","2902","Application Data, Application Data"
"259","0.821475250","192.168.1.118","172.217.12.150","TCP","66","37894 → 443 [ACK] Seq=1317 Ack=21223 Win=57472 Len=0 TSval=476197923 TSecr=299569255"
"260","0.821513800","172.217.12.150","192.168.1.118","TLSv1.2","1086","Application Data"
"261","0.821582438","192.168.1.118","172.217.12.150","TCP","66","37894 → 443 [ACK] Seq=1317 Ack=22243 Win=56576 Len=0 TSval=476197923 TSecr=299569257"
"262","0.822617875","192.168.1.118","172.217.10.1","TLSv1.2","338","Application Data"
"263","0.824644650","172.217.10.1","192.168.1.118","TLSv1.2","117","Change Cipher Spec, Encrypted Handshake Message"
"264","0.825456225","192.168.1.118","172.217.10.1","TLSv1.2","338","Application Data"
"265","0.829284613","192.168.1.118","172.217.12.150","TLSv1.2","363","Application Data"
"266","0.829413338","192.168.1.118","172.217.12.150","TLSv1.2","363","Application Data"
"267","0.835055938","172.217.3.99","192.168.1.118","TLSv1.2","469","Application Data"
"268","0.838034513","172.217.12.150","192.168.1.118","TLSv1.2","1484","Application Data"
"269","0.838172225","192.168.1.118","172.217.12.150","TCP","66","37888 → 443 [ACK] Seq=1535 Ack=22816 Win=63104 Len=0 TSval=476197940 TSecr=1080612343"
"270","0.838293488","172.217.12.150","192.168.1.118","TLSv1.2","1484","Application Data"
"271","0.838374800","192.168.1.118","172.217.12.150","TCP","66","37890 → 443 [ACK] Seq=1535 Ack=23543 Win=63104 Len=0 TSval=476197940 TSecr=4275073268"
"272","0.838447250","172.217.12.150","192.168.1.118","TLSv1.2","1484","Application Data"
"273","0.838526150","192.168.1.118","172.217.12.150","TCP","66","37886 → 443 [ACK] Seq=1535 Ack=22674 Win=63104 Len=0 TSval=476197940 TSecr=3058827323"
"274","0.838615313","172.217.12.150","192.168.1.118","TLSv1.2","2902","Application Data, Application Data"
"275","0.838679500","192.168.1.118","172.217.12.150","TCP","66","37888 → 443 [ACK] Seq=1535 Ack=25652 Win=60288 Len=0 TSval=476197940 TSecr=1080612343"
"276","0.838768350","172.217.12.150","192.168.1.118","TLSv1.2","2902","Application Data, Application Data"
"277","0.838834050","192.168.1.118","172.217.12.150","TCP","66","37890 → 443 [ACK] Seq=1535 Ack=26379 Win=60288 Len=0 TSval=476197940 TSecr=4275073269"
"278","0.838926213","172.217.12.150","192.168.1.118","TLSv1.2","2902","Application Data, Application Data"
"279","0.838988050","192.168.1.118","172.217.12.150","TCP","66","37886 → 443 [ACK] Seq=1535 Ack=25510 Win=60288 Len=0 TSval=476197940 TSecr=3058827324"
"280","0.839050475","172.217.10.1","192.168.1.118","TLSv1.2","117","Change Cipher Spec, Encrypted Handshake Message"
"281","0.839217125","172.217.12.150","192.168.1.118","TLSv1.2","2902","Application Data, Application Data"
"282","0.839302575","192.168.1.118","172.217.12.150","TCP","66","37888 → 443 [ACK] Seq=1535 Ack=28488 Win=57472 Len=0 TSval=476197941 TSecr=1080612345"
"283","0.839342313","172.217.12.150","192.168.1.118","TLSv1.2","2902","Application Data, Application Data"
"284","0.839404563","192.168.1.118","172.217.12.150","TCP","66","37886 → 443 [ACK] Seq=1535 Ack=28346 Win=57472 Len=0 TSval=476197941 TSecr=3058827325"
"285","0.839551238","172.217.12.150","192.168.1.118","TLSv1.2","2902","Application Data, Application Data"
"286","0.839617513","192.168.1.118","172.217.12.150","TCP","66","37890 → 443 [ACK] Seq=1535 Ack=29215 Win=57472 Len=0 TSval=476197941 TSecr=4275073270"
"287","0.840363850","192.168.1.118","172.217.10.1","TLSv1.2","336","Application Data"
"288","0.841518100","172.217.12.150","192.168.1.118","TLSv1.2","2313","Application Data, Application Data"
"289","0.841644263","192.168.1.118","172.217.12.150","TCP","66","37888 → 443 [ACK] Seq=1535 Ack=30735 Win=55296 Len=0 TSval=476197943 TSecr=1080612346"
"290","0.841807450","172.217.12.150","192.168.1.118","TLSv1.2","2902","Application Data, Application Data"
"291","0.841877513","192.168.1.118","172.217.12.150","TCP","66","37886 → 443 [ACK] Seq=1535 Ack=31182 Win=54656 Len=0 TSval=476197943 TSecr=3058827326"
"292","0.841973163","172.217.12.150","192.168.1.118","TLSv1.2","2902","Application Data, Application Data"
"293","0.842039638","192.168.1.118","172.217.12.150","TCP","66","37890 → 443 [ACK] Seq=1535 Ack=32051 Win=54656 Len=0 TSval=476197943 TSecr=4275073271"
"294","0.842079088","172.217.12.150","192.168.1.118","TLSv1.2","563","Application Data"
"295","0.842139000","192.168.1.118","172.217.12.150","TCP","66","37890 → 443 [ACK] Seq=1535 Ack=32548 Win=54272 Len=0 TSval=476197944 TSecr=4275073273"
"296","0.842206000","172.217.12.150","192.168.1.118","TLSv1.2","2902","Application Data, Application Data"
"297","0.842308913","192.168.1.118","172.217.12.150","TCP","66","37886 → 443 [ACK] Seq=1535 Ack=34018 Win=51840 Len=0 TSval=476197944 TSecr=3058827328"
"298","0.842345313","172.217.12.150","192.168.1.118","TLSv1.2","739","Application Data"
"299","0.842405413","192.168.1.118","172.217.12.150","TCP","66","37886 → 443 [ACK] Seq=1535 Ack=34691 Win=51200 Len=0 TSval=476197944 TSecr=3058827329"
"300","0.851465650","172.217.10.1","192.168.1.118","TLSv1.2","1484","Application Data"
"301","0.851523075","192.168.1.118","172.217.12.150","TLSv1.2","363","Application Data"
"302","0.851651625","192.168.1.118","172.217.12.150","TLSv1.2","363","Application Data"
"303","0.853869700","172.217.10.1","192.168.1.118","TLSv1.2","2902","Application Data, Application Data"
"304","0.853992350","172.217.10.1","192.168.1.118","TLSv1.2","2189","Application Data, Application Data"
"305","0.857703513","192.168.1.118","172.217.10.1","TCP","66","37920 → 443 [ACK] Seq=916 Ack=11663 Win=57856 Len=0 TSval=3765841702 TSecr=902268960"
"306","0.857950888","192.168.1.118","172.217.12.150","TLSv1.2","363","Application Data"
"307","0.860497338","172.217.10.1","192.168.1.118","TLSv1.2","1484","Application Data"
"308","0.875483963","192.168.1.118","172.217.3.99","TCP","66","44834 → 443 [ACK] Seq=968 Ack=3114 Win=64128 Len=0 TSval=4165194961 TSecr=1209927664"
"309","0.881172213","172.217.10.1","192.168.1.118","TLSv1.2","2902","Application Data, Application Data"
"310","0.881281138","172.217.10.1","192.168.1.118","TLSv1.2","2639","Application Data, Application Data"
"311","0.881403750","172.217.12.150","192.168.1.118","TLSv1.2","1484","Application Data"
"312","0.883844650","192.168.1.118","172.217.10.1","TCP","66","37922 → 443 [ACK] Seq=916 Ack=12112 Win=57344 Len=0 TSval=3765841728 TSecr=4066527383"
"313","0.886058975","172.217.12.150","192.168.1.118","TLSv1.2","1484","Application Data"
"314","0.886153513","172.217.12.150","192.168.1.118","TLSv1.2","1484","Application Data"
"315","0.886269663","172.217.12.150","192.168.1.118","TLSv1.2","2902","Application Data, Application Data"
"316","0.886326513","172.217.12.150","192.168.1.118","TLSv1.2","2902","Application Data, Application Data"
"317","0.886369238","172.217.12.150","192.168.1.118","TLSv1.2","1484","Application Data"
"318","0.886407925","172.217.12.150","192.168.1.118","TLSv1.2","1484","Application Data"
"319","0.886468925","172.217.12.150","192.168.1.118","TLSv1.2","2902","Application Data, Application Data"
"320","0.886515525","172.217.12.150","192.168.1.118","TLSv1.2","1484","Application Data"
"321","0.886535475","192.168.1.118","172.217.12.150","TCP","66","37892 → 443 [ACK] Seq=1535 Ack=26970 Win=59904 Len=0 TSval=476197988 TSecr=1359002901"
"322","0.886701000","192.168.1.118","172.217.12.150","TCP","66","37894 → 443 [ACK] Seq=1614 Ack=26497 Win=61056 Len=0 TSval=476197988 TSecr=299569324"
"323","0.886773638","192.168.1.118","172.217.12.150","TCP","66","37888 → 443 [ACK] Seq=1832 Ack=33571 Win=61312 Len=0 TSval=476197988 TSecr=1080612392"
"324","0.886879100","192.168.1.118","172.217.12.150","TCP","66","37890 → 443 [ACK] Seq=1832 Ack=38220 Win=58496 Len=0 TSval=476197988 TSecr=4275073317"
"325","0.889641888","172.217.12.150","192.168.1.118","TLSv1.2","1484","Application Data"
"326","0.889718663","172.217.10.1","192.168.1.118","TLSv1.2","1484","Application Data"
"327","0.889796050","172.217.10.1","192.168.1.118","TLSv1.2","2902","Application Data, Application Data"
"328","0.889867263","172.217.10.1","192.168.1.118","TLSv1.2","216","Application Data"
"329","0.889994675","172.217.12.150","192.168.1.118","TLSv1.2","2902","Application Data, Application Data"
"330","0.890051450","192.168.1.118","172.217.12.150","TCP","66","37894 → 443 [ACK] Seq=1614 Ack=29333 Win=61056 Len=0 TSval=476197991 TSecr=299569325"
"331","0.890115725","172.217.12.150","192.168.1.118","TLSv1.2","1755","Application Data, Application Data"
"332","0.890160625","172.217.12.150","192.168.1.118","TLSv1.2","2902","Application Data, Application Data"
"333","0.890201088","192.168.1.118","172.217.12.150","TCP","66","37892 → 443 [ACK] Seq=1535 Ack=29806 Win=61056 Len=0 TSval=476197992 TSecr=1359002903"
"334","0.890257738","172.217.12.150","192.168.1.118","TLSv1.2","2902","Application Data, Application Data"
"335","0.890299238","192.168.1.118","172.217.12.150","TCP","66","37890 → 443 [ACK] Seq=1832 Ack=41056 Win=61056 Len=0 TSval=476197992 TSecr=4275073319"
"336","0.890324138","172.217.12.150","192.168.1.118","TLSv1.2","2902","Application Data, Application Data"
"337","0.890345875","172.217.12.150","192.168.1.118","TLSv1.2","1484","Application Data"
"338","0.892025100","172.217.12.150","192.168.1.118","TLSv1.2","1251","Application Data"
"339","0.892097350","172.217.12.150","192.168.1.118","TLSv1.2","759","Application Data"
"340","0.892136088","172.217.12.150","192.168.1.118","TLSv1.2","1484","Application Data"
"341","0.892172738","172.217.12.150","192.168.1.118","TLSv1.2","2082","Application Data, Application Data"
"342","0.892206825","172.217.12.150","192.168.1.118","TLSv1.2","1484","Application Data"
"343","0.892512700","192.168.1.118","172.217.10.1","TCP","66","37924 → 443 [ACK] Seq=914 Ack=9689 Win=59776 Len=0 TSval=3765841737 TSecr=4066527409"
"344","0.892700825","192.168.1.118","172.217.12.150","TCP","66","37892 → 443 [ACK] Seq=1535 Ack=34658 Win=56320 Len=0 TSval=476197994 TSecr=1359002905"
"345","0.892754663","192.168.1.118","172.217.12.150","TCP","66","37894 → 443 [ACK] Seq=1614 Ack=31022 Win=59392 Len=0 TSval=476197994 TSecr=299569327"
"346","0.892809100","192.168.1.118","172.217.12.150","TCP","66","37888 → 443 [ACK] Seq=1832 Ack=38518 Win=59008 Len=0 TSval=476197994 TSecr=1080612393"
"347","0.893569575","172.217.12.150","192.168.1.118","TLSv1.2","2902","Application Data, Application Data"
"348","0.893652800","172.217.12.150","192.168.1.118","TLSv1.2","1675","Application Data, Application Data"
"349","0.895537813","192.168.1.118","172.217.12.150","TCP","66","37886 → 443 [ACK] Seq=1832 Ack=40554 Win=58368 Len=0 TSval=476197997 TSecr=3058827382"
"350","0.899127325","192.168.1.118","172.217.12.150","TLSv1.2","363","Application Data"
"351","0.899285613","192.168.1.118","172.217.12.150","TLSv1.2","363","Application Data"
"352","0.899376963","192.168.1.118","172.217.12.150","TLSv1.2","376","Application Data"
"353","0.902123513","192.168.1.118","172.217.12.150","TLSv1.2","363","Application Data"
"354","0.902289250","192.168.1.118","172.217.12.150","TLSv1.2","363","Application Data"
"355","0.924443563","172.217.12.150","192.168.1.118","TLSv1.2","1484","Application Data"
"356","0.926756788","172.217.12.150","192.168.1.118","TLSv1.2","2902","Application Data, Application Data"
"357","0.926876825","172.217.12.150","192.168.1.118","TLSv1.2","1484","Application Data"
"358","0.927005913","172.217.12.150","192.168.1.118","TLSv1.2","2902","Application Data, Application Data"
"359","0.927082938","172.217.12.150","192.168.1.118","TLSv1.2","1484","Application Data"
"360","0.927196163","172.217.12.150","192.168.1.118","TLSv1.2","2902","Application Data, Application Data"
"361","0.927205350","192.168.1.118","172.217.12.150","TCP","66","37888 → 443 [ACK] Seq=2129 Ack=42772 Win=61056 Len=0 TSval=476198029 TSecr=1080612431"
"362","0.927351350","192.168.1.118","172.217.12.150","TCP","66","37890 → 443 [ACK] Seq=2129 Ack=46495 Win=59904 Len=0 TSval=476198029 TSecr=4275073357"
"363","0.927359038","172.217.12.150","192.168.1.118","TLSv1.2","1484","Application Data"
"364","0.927475675","172.217.12.150","192.168.1.118","TLSv1.2","2902","Application Data, Application Data"
"365","0.927494275","192.168.1.118","172.217.12.150","TCP","66","37894 → 443 [ACK] Seq=1924 Ack=35276 Win=59904 Len=0 TSval=476198029 TSecr=299569363"
"366","0.927568075","172.217.12.150","192.168.1.118","TLSv1.2","2902","Application Data, Application Data"
"367","0.927620813","192.168.1.118","172.217.12.150","TCP","66","37886 → 443 [ACK] Seq=2129 Ack=44808 Win=59904 Len=0 TSval=476198029 TSecr=3058827413"
"368","0.927743888","192.168.1.118","172.217.12.150","TCP","66","37888 → 443 [ACK] Seq=2129 Ack=45608 Win=58240 Len=0 TSval=476198029 TSecr=1080612433"
"369","0.927765313","172.217.12.150","192.168.1.118","TLSv1.2","2902","Application Data, Application Data"
"370","0.927813713","172.217.12.150","192.168.1.118","TLSv1.2","1484","Application Data"
"371","0.927826188","192.168.1.118","172.217.12.150","TCP","66","37894 → 443 [ACK] Seq=1924 Ack=38112 Win=57088 Len=0 TSval=476198029 TSecr=299569365"
"372","0.941901713","172.217.12.150","192.168.1.118","TLSv1.2","1148","Application Data"
"373","0.942003363","192.168.1.118","172.217.12.150","TCP","66","37890 → 443 [ACK] Seq=2129 Ack=48995 Win=63104 Len=0 TSval=476198043 TSecr=4275073359"
"374","0.942142213","172.217.12.150","192.168.1.118","TLSv1.2","1704","Application Data, Application Data"
"375","0.942200088","192.168.1.118","172.217.12.150","TCP","66","37886 → 443 [ACK] Seq=2129 Ack=46446 Win=61056 Len=0 TSval=476198044 TSecr=3058827415"
"376","0.942307825","172.217.12.150","192.168.1.118","TLSv1.2","1989","Application Data, Application Data"
"377","0.942363413","192.168.1.118","172.217.12.150","TCP","66","37894 → 443 [ACK] Seq=1924 Ack=40035 Win=61056 Len=0 TSval=476198044 TSecr=299569367"
"378","0.942423900","172.217.12.150","192.168.1.118","TLSv1.2","2902","Application Data, Application Data"
"379","0.942478813","192.168.1.118","172.217.12.150","TCP","66","37888 → 443 [ACK] Seq=2129 Ack=48444 Win=61056 Len=0 TSval=476198044 TSecr=1080612434"
"380","0.942511050","172.217.12.150","192.168.1.118","TLSv1.2","184","Application Data"
"381","0.942570375","172.217.12.150","192.168.1.118","TLSv1.2","1484","Application Data"
"382","0.942666125","172.217.12.150","192.168.1.118","TLSv1.2","2902","Application Data, Application Data"
"383","0.942766963","172.217.12.150","192.168.1.118","TLSv1.2","2902","Application Data, Application Data"
"384","0.942926950","172.217.12.150","192.168.1.118","TLSv1.2","2902","Application Data, Application Data"
"385","0.942964488","172.217.12.150","192.168.1.118","TLSv1.2","315","Application Data"
"386","0.944983375","192.168.1.118","172.217.12.150","TCP","66","37892 → 443 [ACK] Seq=1832 Ack=44833 Win=54016 Len=0 TSval=476198046 TSecr=1359002952"
"387","0.948047863","192.168.1.118","172.217.12.150","TLSv1.2","363","Application Data"
"388","0.948169138","192.168.1.118","172.217.12.150","TLSv1.2","363","Application Data"
"389","0.948286763","192.168.1.118","172.217.12.150","TLSv1.2","363","Application Data"
"390","0.977764425","172.217.12.150","192.168.1.118","TLSv1.2","1484","Application Data"
"391","0.980545425","172.217.12.150","192.168.1.118","TLSv1.2","1484","Application Data"
"392","0.980714888","172.217.12.150","192.168.1.118","TLSv1.2","2902","Application Data, Application Data"
"393","0.980821638","172.217.12.150","192.168.1.118","TLSv1.2","2902","Application Data, Application Data"
"394","0.980899475","172.217.12.150","192.168.1.118","TLSv1.2","1484","Application Data"
"395","0.981013875","172.217.12.150","192.168.1.118","TLSv1.2","2902","Application Data, Application Data"
"396","0.981160188","172.217.12.150","192.168.1.118","TLSv1.2","2902","Application Data, Application Data"
"397","0.981305600","172.217.12.150","192.168.1.118","TLSv1.2","2902","Application Data, Application Data"
"398","0.981356075","172.217.12.150","192.168.1.118","TLSv1.2","1484","Application Data"
"399","0.981529413","172.217.12.150","192.168.1.118","TLSv1.2","1933","Application Data, Application Data"
"400","0.981584113","172.217.12.150","192.168.1.118","TLSv1.2","1484","Application Data"
"401","0.982445338","172.217.12.150","192.168.1.118","TLSv1.2","2902","Application Data, Application Data"
"402","0.982698063","192.168.1.118","172.217.12.150","TCP","66","37886 → 443 [ACK] Seq=2426 Ack=53536 Win=57088 Len=0 TSval=476198084 TSecr=3058827467"
"403","0.982894213","192.168.1.118","172.217.12.150","TCP","66","37888 → 443 [ACK] Seq=2426 Ack=57519 Win=55296 Len=0 TSval=476198084 TSecr=1080612486"
"404","0.983017350","192.168.1.118","172.217.12.150","TCP","66","37890 → 443 [ACK] Seq=2426 Ack=58921 Win=54272 Len=0 TSval=476198084 TSecr=4275073411"
"405","0.985040175","172.217.12.150","192.168.1.118","TLSv1.2","2781","Application Data, Application Data"
"406","0.985733950","192.168.1.118","172.217.12.150","TCP","66","37886 → 443 [ACK] Seq=2426 Ack=56251 Win=54400 Len=0 TSval=476198087 TSecr=3058827470"
"407","0.986052163","172.217.12.150","192.168.1.118","TLSv1.2","2202","Application Data, Application Data"
"408","0.988136488","192.168.1.118","172.217.12.150","TCP","66","37890 → 443 [ACK] Seq=2426 Ack=61057 Win=52224 Len=0 TSval=476198090 TSecr=4275073416"
"409","1.944929438","192.168.1.118","192.168.1.102","TCP","176","40160 → 8009 [PSH, ACK] Seq=1 Ack=1 Win=501 Len=110 TSval=2234345064 TSecr=2417625 [TCP segment of a reassembled PDU]"
"410","1.954523800","192.168.1.102","192.168.1.118","TCP","176","8009 → 40160 [PSH, ACK] Seq=1 Ack=111 Win=344 Len=110 TSval=2418126 TSecr=2234345064 [TCP segment of a reassembled PDU]"
"411","1.954669813","192.168.1.118","192.168.1.102","TCP","66","40160 → 8009 [ACK] Seq=111 Ack=111 Win=501 Len=0 TSval=2234345074 TSecr=2418126"
"412","2.973568638","192.168.1.104","255.255.255.255","UDP","217","49154 → 6666 Len=175"
"413","3.997474225","192.168.1.100","224.0.0.251","MDNS","82","Standard query 0x0000 PTR _googlecast._tcp.local, "QM" question"
"414","4.101345913","192.168.1.102","224.0.0.251","MDNS","409","Standard query response 0x0000 PTR Google-Home-Mini-2c3f16b2da5c4b6fd6cfbfba61c12490._googlecast._tcp.local TXT, cache flush SRV, cache flush 0 0 8009 2c3f16b2-da5c-4b6f-d6cf-bfba61c12490.local A, cache flush 192.168.1.102"
"415","5.022665900","IntelCor_b7:52:73","Broadcast","ARP","60","Who has 192.168.1.1? Tell 192.168.1.118"
"416","5.041553900","Cisco-Li_5b:1c:ce","IntelCor_b7:52:73","ARP","42","192.168.1.1 is at 58:6d:8f:5b:1c:ce"
"417","5.938798875","192.168.1.104","255.255.255.255","UDP","217","49154 → 6666 Len=175"
"418","6.142404625","Cisco-Li_5b:1c:ce","Broadcast","ARP","42","Who has 192.168.1.100? Tell 192.168.1.1"
"419","6.246644875","192.168.1.100","224.0.0.251","MDNS","138","Standard query 0x0000 PTR _googlecast._tcp.local, "QM" question SRV Google-Home-Mini-2c3f16b2da5c4b6fd6cfbfba61c12490._googlecast._tcp.local, "QM" question"
"420","6.349748800","192.168.1.102","224.0.0.251","MDNS","409","Standard query response 0x0000 PTR Google-Home-Mini-2c3f16b2da5c4b6fd6cfbfba61c12490._googlecast._tcp.local TXT, cache flush SRV, cache flush 0 0 8009 2c3f16b2-da5c-4b6f-d6cf-bfba61c12490.local A, cache flush 192.168.1.102"
"421","6.352359463","192.168.1.102","224.0.0.251","MDNS","199","Standard query response 0x0000 SRV, cache flush 0 0 8009 2c3f16b2-da5c-4b6f-d6cf-bfba61c12490.local A, cache flush 192.168.1.102"
"422","6.959716013","192.168.1.118","192.168.1.102","TCP","176","40160 → 8009 [PSH, ACK] Seq=111 Ack=111 Win=501 Len=110 TSval=2234350079 TSecr=2418126 [TCP segment of a reassembled PDU]"
"423","6.969130500","192.168.1.102","192.168.1.118","TCP","176","8009 → 40160 [PSH, ACK] Seq=111 Ack=221 Win=344 Len=110 TSval=2418627 TSecr=2234350079 [TCP segment of a reassembled PDU]"
"424","6.969329738","192.168.1.118","192.168.1.102","TCP","66","40160 → 8009 [ACK] Seq=221 Ack=221 Win=501 Len=0 TSval=2234350089 TSecr=2418627"
"425","9.012761400","192.168.1.104","255.255.255.255","UDP","217","49154 → 6666 Len=175"
