frame.number,_ws.col.Time,_ws.col.Source,_ws.col.Destination,_ws.col.Protocol,frame.len,_ws.col.Info
"1","0.000000000","192.168.1.104","255.255.255.255","UDP","217","49154 → 6666 Len=175"
"2","0.308026563","192.168.1.118","142.250.64.67","TCP","66","33512 → 80 [ACK] Seq=1 Ack=1 Win=502 Len=0 TSval=283340116 TSecr=3271900896"
"3","0.340528300","142.250.64.67","192.168.1.118","TCP","66","[TCP ACKed unseen segment] 80 → 33512 [ACK] Seq=1 Ack=2 Win=240 Len=0 TSval=3271945958 TSecr=283201525"
"4","1.125270488","199.232.37.140","192.168.1.118","TLSv1.2","1410","Application Data, Application Data, Application Data, Application Data"
"5","1.128240038","199.232.37.140","192.168.1.118","TLSv1.2","6173","Application Data, Application Data, Application Data, Application Data, Application Data, Application Data, Application Data"
"6","1.128459613","199.232.37.140","192.168.1.118","TLSv1.2","5474","Application Data, Application Data, Application Data, Application Data"
"7","1.128866363","192.168.1.118","199.232.37.140","TCP","66","34870 → 443 [ACK] Seq=1 Ack=12860 Win=401 Len=0 TSval=1479018790 TSecr=2806199087"
"8","1.128919263","199.232.37.140","192.168.1.118","TLSv1.2","1418","Application Data, Application Data, Application Data, Application Data"
"9","1.150318538","199.232.37.140","192.168.1.118","TLSv1.2","1418","Application Data [TCP segment of a reassembled PDU]"
"10","1.150443800","192.168.1.118","199.232.37.140","TCP","66","34870 → 443 [ACK] Seq=1 Ack=15564 Win=493 Len=0 TSval=1479018811 TSecr=2806199114"
"11","1.162474963","199.232.37.140","192.168.1.118","TLSv1.2","8178","Application Data, Application Data, Application Data, Application Data, Application Data, Application Data, Application Data, Application Data"
"12","1.162603975","192.168.1.118","199.232.37.140","TCP","66","34870 → 443 [ACK] Seq=1 Ack=23676 Win=624 Len=0 TSval=1479018823 TSecr=2806199119"
"13","1.163903838","199.232.37.140","192.168.1.118","TLSv1.2","7865","Application Data, Application Data, Application Data, Application Data, Application Data, Application Data, Application Data, Application Data, Application Data, Application Data, Application Data, Application Data, Application Data, Application Data, Application Data, Application Data, Application Data, Application Data, Application Data"
"14","1.164182613","192.168.1.118","199.232.37.140","TCP","66","34870 → 443 [ACK] Seq=1 Ack=31475 Win=564 Len=0 TSval=1479018825 TSecr=2806199119"
"15","1.166228513","199.232.37.140","192.168.1.118","TLSv1.2","4111","Application Data, Application Data, Application Data, Application Data, Application Data"
"16","1.166349663","199.232.37.140","192.168.1.118","TLSv1.2","1418","Application Data"
"17","1.166691713","192.168.1.118","199.232.37.140","TCP","66","34870 → 443 [ACK] Seq=1 Ack=36872 Win=522 Len=0 TSval=1479018828 TSecr=2806199123"
"18","1.167585275","199.232.37.140","192.168.1.118","TLSv1.2","1418","Application Data [TCP segment of a reassembled PDU]"
"19","1.176244263","192.168.1.118","209.18.47.62","DNS","80","Standard query 0xe3b4 A www.redditstatic.com"
"20","1.183338463","199.232.37.140","192.168.1.118","TLSv1.2","1418","Application Data [TCP segment of a reassembled PDU]"
"21","1.190937650","192.168.1.118","199.232.37.140","TCP","66","34870 → 443 [ACK] Seq=1 Ack=39576 Win=501 Len=0 TSval=1479018852 TSecr=2806199123"
"22","1.212498500","199.232.37.140","192.168.1.118","TLSv1.2","1418","Application Data [TCP segment of a reassembled PDU]"
"23","1.214454013","199.232.37.140","192.168.1.118","TLSv1.2","4122","Application Data, Application Data, Application Data"
"24","1.214541400","192.168.1.118","199.232.37.140","TCP","66","34870 → 443 [ACK] Seq=1 Ack=44984 Win=672 Len=0 TSval=1479018875 TSecr=2806199133"
"25","1.217655188","199.232.37.140","192.168.1.118","TLSv1.2","1418","Application Data [TCP segment of a reassembled PDU]"
"26","1.220387675","209.18.47.62","192.168.1.118","DNS","131","Standard query response 0xe3b4 A www.redditstatic.com CNAME reddit.map.fastly.net A 199.232.37.140"
"27","1.220585263","199.232.37.140","192.168.1.118","TLSv1.2","8178","Application Data, Application Data, Application Data, Application Data, Application Data, Application Data, Application Data, Application Data, Application Data, Application Data, Application Data"
"28","1.220876875","192.168.1.118","209.18.47.62","DNS","80","Standard query 0x7344 AAAA www.redditstatic.com"
"29","1.222112788","199.232.37.140","192.168.1.118","TLSv1.2","4122","Application Data, Application Data, Application Data"
"30","1.222875188","199.232.37.140","192.168.1.118","TLSv1.2","8178","Application Data, Application Data, Application Data, Application Data, Application Data, Application Data"
"31","1.223841500","192.168.1.118","199.232.37.140","TCP","66","34870 → 443 [ACK] Seq=1 Ack=66616 Win=503 Len=0 TSval=1479018885 TSecr=2806199136"
"32","1.230224863","199.232.37.140","192.168.1.118","TLSv1.2","4122","Application Data, Application Data, Application Data, Application Data, Application Data"
"33","1.230313125","199.232.37.140","192.168.1.118","TCP","66","[TCP Dup ACK 4#1] 443 → 34870 [ACK] Seq=70672 Ack=1 Win=58 Len=0 TSval=2806199136 TSecr=1479018828"
"34","1.230366400","199.232.37.140","192.168.1.118","TLSv1.2","1593","Application Data, Application Data, Application Data"
"35","1.230447075","199.232.37.140","192.168.1.118","TLSv1.2","2770","Application Data, Application Data"
"36","1.230563675","199.232.37.140","192.168.1.118","TLSv1.2","2681","Application Data, Application Data, Application Data, Application Data"
"37","1.230646563","192.168.1.118","199.232.37.140","TCP","66","34870 → 443 [ACK] Seq=1 Ack=77518 Win=418 Len=0 TSval=1479018892 TSecr=2806199136"
"38","1.234226163","209.18.47.62","192.168.1.118","DNS","173","Standard query response 0x7344 AAAA www.redditstatic.com CNAME reddit.map.fastly.net SOA ns1.fastly.net"
"39","1.236472950","192.168.1.118","199.232.37.140","TCP","74","34892 → 443 [SYN] Seq=0 Win=64240 Len=0 MSS=1460 SACK_PERM=1 TSval=1479018897 TSecr=0 WS=128"
"40","1.249673175","199.232.37.140","192.168.1.118","TCP","74","443 → 34892 [SYN, ACK] Seq=0 Ack=1 Win=27040 Len=0 MSS=1364 SACK_PERM=1 TSval=2805137209 TSecr=1479018897 WS=512"
"41","1.249873525","192.168.1.118","199.232.37.140","TCP","66","34892 → 443 [ACK] Seq=1 Ack=1 Win=64256 Len=0 TSval=1479018911 TSecr=2805137209"
"42","1.268912575","192.168.1.118","199.232.37.140","TLSv1","583","Client Hello"
"43","1.280858488","199.232.37.140","192.168.1.118","TLSv1.2","1418","Application Data"
"44","1.282264263","199.232.37.140","192.168.1.118","TLSv1.2","2050","Application Data, Application Data, Application Data, Application Data"
"45","1.282401188","192.168.1.118","199.232.37.140","TCP","66","34870 → 443 [ACK] Seq=1 Ack=80854 Win=528 Len=0 TSval=1479018943 TSecr=2806199152"
"46","1.291228425","199.232.37.140","192.168.1.118","TLSv1.2","1418","Application Data"
"47","1.293233963","199.232.37.140","192.168.1.118","TLSv1.2","4122","Application Data, Application Data, Application Data, Application Data, Application Data"
"48","1.295805213","199.232.37.140","192.168.1.118","TLSv1.2","1032","Application Data, Application Data, Application Data"
"49","1.297871938","199.232.37.140","192.168.1.118","TCP","66","443 → 34892 [ACK] Seq=1 Ack=518 Win=28160 Len=0 TSval=2805137220 TSecr=1479018930"
"50","1.298024500","192.168.1.118","199.232.37.140","TCP","66","34870 → 443 [ACK] Seq=1 Ack=87228 Win=479 Len=0 TSval=1479018959 TSecr=2806199154"
"51","1.298334913","192.168.1.118","199.232.37.140","TCP","74","34894 → 443 [SYN] Seq=0 Win=64240 Len=0 MSS=1460 SACK_PERM=1 TSval=1479018959 TSecr=0 WS=128"
"52","1.299433388","199.232.37.140","192.168.1.118","TLSv1.2","3304","Server Hello, Certificate, Server Key Exchange, Server Hello Done"
"53","1.299565438","192.168.1.118","199.232.37.140","TCP","66","34892 → 443 [ACK] Seq=518 Ack=3239 Win=61056 Len=0 TSval=1479018960 TSecr=2805137221"
"54","1.302197950","192.168.1.118","199.232.37.140","TLSv1.2","192","Client Key Exchange, Change Cipher Spec, Encrypted Handshake Message"
"55","1.302648038","199.232.37.140","192.168.1.118","TLSv1.2","3835","Application Data, Application Data, Application Data, Application Data, Application Data"
"56","1.306202538","192.168.1.118","199.232.37.140","TCP","66","34870 → 443 [ACK] Seq=1 Ack=90997 Win=450 Len=0 TSval=1479018967 TSecr=2806199157"
"57","1.313491063","192.168.1.118","199.232.37.140","TCP","74","34896 → 443 [SYN] Seq=0 Win=64240 Len=0 MSS=1460 SACK_PERM=1 TSval=1479018974 TSecr=0 WS=128"
"58","1.314873288","192.168.1.118","209.18.47.62","DNS","82","Standard query 0x831d A styles.redditmedia.com"
"59","1.315403438","199.232.37.140","192.168.1.118","TLSv1.2","1418","Application Data"
"60","1.315965225","192.168.1.118","209.18.47.62","DNS","82","Standard query 0x572e A styles.redditmedia.com"
"61","1.319607575","199.232.37.140","192.168.1.118","TLSv1.2","1231","Application Data, Application Data, Application Data"
"62","1.320471925","199.232.37.140","192.168.1.118","TCP","74","443 → 34894 [SYN, ACK] Seq=0 Ack=1 Win=27040 Len=0 MSS=1364 SACK_PERM=1 TSval=3138975805 TSecr=1479018959 WS=512"
"63","1.320656913","192.168.1.118","199.232.37.140","TCP","66","34894 → 443 [ACK] Seq=1 Ack=1 Win=64256 Len=0 TSval=1479018982 TSecr=3138975805"
"64","1.322936713","192.168.1.118","199.232.37.140","TCP","66","34870 → 443 [ACK] Seq=1 Ack=93514 Win=431 Len=0 TSval=1479018984 TSecr=2806199160"
"65","1.331298125","199.232.37.140","192.168.1.118","TLSv1.2","117","Change Cipher Spec, Encrypted Handshake Message"
"66","1.336224575","199.232.37.140","192.168.1.118","TLSv1.2","218","Application Data, Application Data, Application Data"
"67","1.337257725","199.232.37.140","192.168.1.118","TLSv1.2","166","Application Data, Application Data, Application Data"
"68","1.339287313","192.168.1.118","199.232.37.140","TLSv1","583","Client Hello"
"69","1.339828925","192.168.1.118","199.232.37.140","TCP","74","34898 → 443 [SYN] Seq=0 Win=64240 Len=0 MSS=1460 SACK_PERM=1 TSval=1479019001 TSecr=0 WS=128"
"70","1.339946500","192.168.1.118","199.232.37.140","TCP","74","34900 → 443 [SYN] Seq=0 Win=64240 Len=0 MSS=1460 SACK_PERM=1 TSval=1479019001 TSecr=0 WS=128"
"71","1.340509038","192.168.1.118","199.232.37.140","TLSv1.2","256","Application Data"
"72","1.340735900","192.168.1.118","209.18.47.62","DNS","84","Standard query 0x2ff1 A b.thumbs.redditmedia.com"
"73","1.341541488","192.168.1.118","209.18.47.62","DNS","75","Standard query 0x9b83 A preview.redd.it"
"74","1.342540738","209.18.47.62","192.168.1.118","DNS","133","Standard query response 0x572e A styles.redditmedia.com CNAME reddit.map.fastly.net A 199.232.37.140"
"75","1.342795300","192.168.1.118","209.18.47.62","DNS","82","Standard query 0x473c AAAA styles.redditmedia.com"
"76","1.343507425","209.18.47.62","192.168.1.118","DNS","133","Standard query response 0x831d A styles.redditmedia.com CNAME reddit.map.fastly.net A 199.232.37.140"
"77","1.343576938","199.232.37.140","192.168.1.118","TCP","74","443 → 34896 [SYN, ACK] Seq=0 Ack=1 Win=27040 Len=0 MSS=1364 SACK_PERM=1 TSval=2805897804 TSecr=1479018974 WS=512"
"78","1.343674525","192.168.1.118","199.232.37.140","TCP","66","34896 → 443 [ACK] Seq=1 Ack=1 Win=64256 Len=0 TSval=1479019005 TSecr=2805897804"
"79","1.343879475","192.168.1.118","209.18.47.62","DNS","82","Standard query 0x8327 AAAA styles.redditmedia.com"
"80","1.347902425","199.232.37.140","192.168.1.118","TLSv1.2","1418","Application Data"
"81","1.347988050","192.168.1.118","199.232.37.140","TCP","66","34870 → 443 [ACK] Seq=1 Ack=95118 Win=592 Len=0 TSval=1479019009 TSecr=2806199166"
"82","1.351643175","199.232.37.140","192.168.1.118","TLSv1.2","5474","Application Data, Application Data, Application Data, Application Data"
"83","1.351804738","199.232.37.140","192.168.1.118","TLSv1.2","1732","Application Data, Application Data, Application Data"
"84","1.351846000","199.232.37.140","192.168.1.118","TLSv1.2","1408","Application Data, Application Data, Application Data"
"85","1.353834763","199.232.37.140","192.168.1.118","TLSv1.2","1418","Application Data"
"86","1.356787938","199.232.37.140","192.168.1.118","TLSv1.2","5474","Application Data, Application Data, Application Data, Application Data"
"87","1.357165463","199.232.37.140","192.168.1.118","TLSv1.2","5474","Application Data, Application Data, Application Data, Application Data"
"88","1.359869413","199.232.37.140","192.168.1.118","TLSv1.2","4690","Application Data, Application Data, Application Data, Application Data, Application Data"
"89","1.359946938","199.232.37.140","192.168.1.118","TLSv1.2","4122","Application Data, Application Data, Application Data"
"90","1.362683800","199.232.37.140","192.168.1.118","TLSv1.2","12234","Application Data, Application Data, Application Data, Application Data, Application Data, Application Data, Application Data, Application Data, Application Data"
"91","1.366165188","199.232.37.140","192.168.1.118","TLSv1.2","646","Application Data, Application Data"
"92","1.366224300","209.18.47.62","192.168.1.118","DNS","135","Standard query response 0x2ff1 A b.thumbs.redditmedia.com CNAME reddit.map.fastly.net A 199.232.37.140"
"93","1.366275025","199.232.37.140","192.168.1.118","TCP","74","443 → 34898 [SYN, ACK] Seq=0 Ack=1 Win=27040 Len=0 MSS=1364 SACK_PERM=1 TSval=2804098081 TSecr=1479019001 WS=512"
"94","1.366339525","192.168.1.118","199.232.37.140","TCP","66","34898 → 443 [ACK] Seq=1 Ack=1 Win=64256 Len=0 TSval=1479019027 TSecr=2804098081"
"95","1.366381850","199.232.37.140","192.168.1.118","TCP","66","443 → 34894 [ACK] Seq=1 Ack=518 Win=28160 Len=0 TSval=3138975815 TSecr=1479019000"
"96","1.366422525","199.232.37.140","192.168.1.118","TLSv1.2","8178","Application Data, Application Data, Application Data, Application Data, Application Data, Application Data"
"97","1.366541050","192.168.1.118","209.18.47.62","DNS","84","Standard query 0x43c6 AAAA b.thumbs.redditmedia.com"
"98","1.367364250","199.232.37.140","192.168.1.118","TLSv1.2","1422","Application Data, Application Data"
"99","1.367431400","199.232.37.140","192.168.1.118","TCP","74","443 → 34900 [SYN, ACK] Seq=0 Ack=1 Win=27040 Len=0 MSS=1364 SACK_PERM=1 TSval=268355543 TSecr=1479019001 WS=512"
"100","1.367513838","192.168.1.118","199.232.37.140","TCP","66","34900 → 443 [ACK] Seq=1 Ack=1 Win=64256 Len=0 TSval=1479019028 TSecr=268355543"
"101","1.367587975","199.232.37.140","192.168.1.118","TLSv1.2","3304","Server Hello, Certificate, Server Key Exchange, Server Hello Done"
"102","1.367622725","192.168.1.118","199.232.37.140","TCP","66","34894 → 443 [ACK] Seq=518 Ack=3239 Win=61056 Len=0 TSval=1479019029 TSecr=3138975815"
"103","1.371227288","199.232.37.140","192.168.1.118","TLSv1.2","782","Application Data, Application Data, Application Data"
"104","1.371301263","192.168.1.118","199.232.37.140","TLSv1","583","Client Hello"
"105","1.371304875","199.232.37.140","192.168.1.118","TLSv1.2","1430","Application Data, Application Data, Application Data"
"106","1.371334438","199.232.37.140","192.168.1.118","TLSv1.2","180","Application Data, Application Data, Application Data"
"107","1.371366800","199.232.37.140","192.168.1.118","TLSv1.2","100","Application Data"
"108","1.375020750","209.18.47.62","192.168.1.118","DNS","126","Standard query response 0x9b83 A preview.redd.it CNAME reddit.map.fastly.net A 199.232.37.140"
"109","1.375105963","209.18.47.62","192.168.1.118","DNS","175","Standard query response 0x473c AAAA styles.redditmedia.com CNAME reddit.map.fastly.net SOA ns1.fastly.net"
"110","1.375141825","209.18.47.62","192.168.1.118","DNS","175","Standard query response 0x8327 AAAA styles.redditmedia.com CNAME reddit.map.fastly.net SOA ns1.fastly.net"
"111","1.375674838","192.168.1.118","209.18.47.62","DNS","75","Standard query 0xc7df AAAA preview.redd.it"
"112","1.387819013","192.168.1.118","199.232.37.140","TLSv1","583","Client Hello"
"113","1.392063500","192.168.1.118","199.232.37.140","TCP","66","34870 → 443 [ACK] Seq=1 Ack=139358 Win=247 Len=0 TSval=1479019053 TSecr=2806199169"
"114","1.396859250","209.18.47.62","192.168.1.118","DNS","177","Standard query response 0x43c6 AAAA b.thumbs.redditmedia.com CNAME reddit.map.fastly.net SOA ns1.fastly.net"
"115","1.398697638","199.232.37.140","192.168.1.118","TCP","66","443 → 34896 [ACK] Seq=1 Ack=518 Win=28160 Len=0 TSval=2805897817 TSecr=1479019032"
"116","1.398869313","199.232.37.140","192.168.1.118","TLSv1.2","3304","Server Hello, Certificate, Server Key Exchange, Server Hello Done"
"117","1.398945075","192.168.1.118","199.232.37.140","TCP","66","34896 → 443 [ACK] Seq=518 Ack=3239 Win=61056 Len=0 TSval=1479019060 TSecr=2805897817"
"118","1.404220788","192.168.1.118","199.232.37.140","TLSv1","583","Client Hello"
"119","1.404605375","209.18.47.62","192.168.1.118","DNS","171","Standard query response 0xc7df AAAA preview.redd.it CNAME reddit.map.fastly.net SOA ns1.fastly.net"
"120","1.405233450","192.168.1.118","199.232.37.140","TCP","66","34892 → 443 [ACK] Seq=834 Ack=12758 Win=54784 Len=0 TSval=1479019066 TSecr=2805137236"
"121","1.405931725","192.168.1.118","209.18.47.62","DNS","75","Standard query 0x1f7e A preview.redd.it"
"122","1.406721725","192.168.1.118","209.18.47.62","DNS","82","Standard query 0xfb65 A styles.redditmedia.com"
"123","1.407370163","192.168.1.118","209.18.47.62","DNS","75","Standard query 0xd367 A preview.redd.it"
"124","1.407406375","192.168.1.118","199.232.37.140","TLSv1.2","192","Client Key Exchange, Change Cipher Spec, Encrypted Handshake Message"
"125","1.407612213","192.168.1.118","199.232.37.140","TCP","74","34902 → 443 [SYN] Seq=0 Win=64240 Len=0 MSS=1460 SACK_PERM=1 TSval=1479019069 TSecr=0 WS=128"
"126","1.409525675","192.168.1.118","199.232.37.140","TLSv1.2","192","Client Key Exchange, Change Cipher Spec, Encrypted Handshake Message"
"127","1.409708925","192.168.1.118","199.232.37.140","TCP","74","34904 → 443 [SYN] Seq=0 Win=64240 Len=0 MSS=1460 SACK_PERM=1 TSval=1479019071 TSecr=0 WS=128"
"128","1.409819438","192.168.1.118","199.232.37.140","TCP","74","34906 → 443 [SYN] Seq=0 Win=64240 Len=0 MSS=1460 SACK_PERM=1 TSval=1479019071 TSecr=0 WS=128"
"129","1.409910500","192.168.1.118","199.232.37.140","TCP","74","34908 → 443 [SYN] Seq=0 Win=64240 Len=0 MSS=1460 SACK_PERM=1 TSval=1479019071 TSecr=0 WS=128"
"130","1.409983688","192.168.1.118","199.232.37.140","TCP","74","34910 → 443 [SYN] Seq=0 Win=64240 Len=0 MSS=1460 SACK_PERM=1 TSval=1479019071 TSecr=0 WS=128"
"131","1.410092313","192.168.1.118","199.232.37.140","TCP","74","34912 → 443 [SYN] Seq=0 Win=64240 Len=0 MSS=1460 SACK_PERM=1 TSval=1479019071 TSecr=0 WS=128"
"132","1.410165263","192.168.1.118","199.232.37.140","TCP","74","34914 → 443 [SYN] Seq=0 Win=64240 Len=0 MSS=1460 SACK_PERM=1 TSval=1479019071 TSecr=0 WS=128"
"133","1.411717588","199.232.37.140","192.168.1.118","TCP","66","443 → 34898 [ACK] Seq=1 Ack=518 Win=28160 Len=0 TSval=2804098094 TSecr=1479019049"
"134","1.413518713","199.232.37.140","192.168.1.118","TLSv1.2","1418","Server Hello"
"135","1.413604875","192.168.1.118","199.232.37.140","TCP","66","34898 → 443 [ACK] Seq=518 Ack=1353 Win=63104 Len=0 TSval=1479019074 TSecr=2804098094"
"136","1.416304738","199.232.37.140","192.168.1.118","TLSv1.2","1952","Certificate, Server Key Exchange, Server Hello Done"
"137","1.416393200","192.168.1.118","199.232.37.140","TCP","66","34898 → 443 [ACK] Seq=518 Ack=3239 Win=61312 Len=0 TSval=1479019077 TSecr=2804098094"
"138","1.419737425","192.168.1.118","199.232.37.140","TLSv1.2","192","Client Key Exchange, Change Cipher Spec, Encrypted Handshake Message"
"139","1.419836325","199.232.37.140","192.168.1.118","TCP","66","443 → 34900 [ACK] Seq=1 Ack=518 Win=28160 Len=0 TSval=268355558 TSecr=1479019065"
"140","1.420030188","192.168.1.118","199.232.37.140","TCP","74","34916 → 443 [SYN] Seq=0 Win=64240 Len=0 MSS=1460 SACK_PERM=1 TSval=1479019081 TSecr=0 WS=128"
"141","1.423522100","199.232.37.140","192.168.1.118","TLSv1.2","1418","Server Hello"
"142","1.423625150","192.168.1.118","199.232.37.140","TCP","66","34900 → 443 [ACK] Seq=518 Ack=1353 Win=63104 Len=0 TSval=1479019085 TSecr=268355558"
"143","1.425586700","199.232.37.140","192.168.1.118","TLSv1.2","1952","Certificate, Server Key Exchange, Server Hello Done"
"144","1.425692775","192.168.1.118","199.232.37.140","TCP","66","34900 → 443 [ACK] Seq=518 Ack=3239 Win=61312 Len=0 TSval=1479019087 TSecr=268355558"
"145","1.428111563","192.168.1.118","199.232.37.140","TLSv1.2","192","Client Key Exchange, Change Cipher Spec, Encrypted Handshake Message"
"146","1.428789663","192.168.1.118","199.232.37.140","TCP","74","34918 → 443 [SYN] Seq=0 Win=64240 Len=0 MSS=1460 SACK_PERM=1 TSval=1479019090 TSecr=0 WS=128"
"147","1.428923738","192.168.1.118","199.232.37.140","TCP","74","34920 → 443 [SYN] Seq=0 Win=64240 Len=0 MSS=1460 SACK_PERM=1 TSval=1479019090 TSecr=0 WS=128"
"148","1.429459125","192.168.1.118","209.18.47.62","DNS","84","Standard query 0x53ef A a.thumbs.redditmedia.com"
"149","1.430256525","192.168.1.118","209.18.47.62","DNS","77","Standard query 0x6365 A s.redditmedia.com"
"150","1.432788988","209.18.47.62","192.168.1.118","DNS","126","Standard query response 0x1f7e A preview.redd.it CNAME reddit.map.fastly.net A 199.232.37.140"
"151","1.433083725","192.168.1.118","209.18.47.62","DNS","75","Standard query 0x3bdc AAAA preview.redd.it"
"152","1.434678900","209.18.47.62","192.168.1.118","DNS","126","Standard query response 0xd367 A preview.redd.it CNAME reddit.map.fastly.net A 199.232.37.140"
"153","1.434983650","192.168.1.118","209.18.47.62","DNS","75","Standard query 0xc7a9 AAAA preview.redd.it"
"154","1.435616150","209.18.47.62","192.168.1.118","DNS","133","Standard query response 0xfb65 A styles.redditmedia.com CNAME reddit.map.fastly.net A 199.232.37.140"
"155","1.435709588","199.232.37.140","192.168.1.118","TCP","66","[TCP Dup ACK 133#1] 443 → 34898 [ACK] Seq=3239 Ack=518 Win=28160 Len=0 TSval=2804098100 TSecr=1479019077"
"156","1.435973638","192.168.1.118","209.18.47.62","DNS","82","Standard query 0xcba6 AAAA styles.redditmedia.com"
"157","1.437788025","199.232.37.140","192.168.1.118","TLSv1.2","117","Change Cipher Spec, Encrypted Handshake Message"
"158","1.437887700","192.168.1.118","199.232.37.140","TCP","66","34894 → 443 [ACK] Seq=644 Ack=3290 Win=64128 Len=0 TSval=1479019099 TSecr=3138975834"
"159","1.437951225","199.232.37.140","192.168.1.118","TLSv1.2","117","Change Cipher Spec, Encrypted Handshake Message"
"160","1.437998500","199.232.37.140","192.168.1.118","TLSv1.2","117","Change Cipher Spec, Encrypted Handshake Message"
"161","1.438042625","199.232.37.140","192.168.1.118","TCP","74","443 → 34906 [SYN, ACK] Seq=0 Ack=1 Win=27040 Len=0 MSS=1364 SACK_PERM=1 TSval=1720107023 TSecr=1479019071 WS=512"
"162","1.438120075","192.168.1.118","199.232.37.140","TCP","66","34906 → 443 [ACK] Seq=1 Ack=1 Win=64256 Len=0 TSval=1479019099 TSecr=1720107023"
"163","1.440769313","192.168.1.118","199.232.37.140","TLSv1.2","279","Application Data"
"164","1.441022688","192.168.1.118","199.232.37.140","TLSv1.2","274","Application Data"
"165","1.441603213","199.232.37.140","192.168.1.118","TCP","74","443 → 34902 [SYN, ACK] Seq=0 Ack=1 Win=27040 Len=0 MSS=1364 SACK_PERM=1 TSval=269078268 TSecr=1479019069 WS=512"
"166","1.441731075","192.168.1.118","199.232.37.140","TCP","66","34902 → 443 [ACK] Seq=1 Ack=1 Win=64256 Len=0 TSval=1479019103 TSecr=269078268"
"167","1.441815963","199.232.37.140","192.168.1.118","TCP","74","443 → 34904 [SYN, ACK] Seq=0 Ack=1 Win=27040 Len=0 MSS=1364 SACK_PERM=1 TSval=3906556010 TSecr=1479019071 WS=512"
"168","1.441878063","192.168.1.118","199.232.37.140","TCP","66","34904 → 443 [ACK] Seq=1 Ack=1 Win=64256 Len=0 TSval=1479019103 TSecr=3906556010"
"169","1.441919825","199.232.37.140","192.168.1.118","TCP","74","443 → 34910 [SYN, ACK] Seq=0 Ack=1 Win=27040 Len=0 MSS=1364 SACK_PERM=1 TSval=2806152120 TSecr=1479019071 WS=512"
"170","1.441978263","192.168.1.118","199.232.37.140","TCP","66","34910 → 443 [ACK] Seq=1 Ack=1 Win=64256 Len=0 TSval=1479019103 TSecr=2806152120"
"171","1.442017963","199.232.37.140","192.168.1.118","TCP","74","443 → 34916 [SYN, ACK] Seq=0 Ack=1 Win=27040 Len=0 MSS=1364 SACK_PERM=1 TSval=3118478431 TSecr=1479019081 WS=512"
"172","1.442078275","192.168.1.118","199.232.37.140","TCP","66","34916 → 443 [ACK] Seq=1 Ack=1 Win=64256 Len=0 TSval=1479019103 TSecr=3118478431"
"173","1.442117925","199.232.37.140","192.168.1.118","TCP","74","443 → 34908 [SYN, ACK] Seq=0 Ack=1 Win=27040 Len=0 MSS=1364 SACK_PERM=1 TSval=2804309381 TSecr=1479019071 WS=512"
"174","1.442176650","192.168.1.118","199.232.37.140","TCP","66","34908 → 443 [ACK] Seq=1 Ack=1 Win=64256 Len=0 TSval=1479019103 TSecr=2804309381"
"175","1.442216238","199.232.37.140","192.168.1.118","TCP","74","443 → 34912 [SYN, ACK] Seq=0 Ack=1 Win=27040 Len=0 MSS=1364 SACK_PERM=1 TSval=3150241754 TSecr=1479019071 WS=512"
"176","1.442274688","192.168.1.118","199.232.37.140","TCP","66","34912 → 443 [ACK] Seq=1 Ack=1 Win=64256 Len=0 TSval=1479019103 TSecr=3150241754"
"177","1.442313950","199.232.37.140","192.168.1.118","TCP","74","443 → 34914 [SYN, ACK] Seq=0 Ack=1 Win=27040 Len=0 MSS=1364 SACK_PERM=1 TSval=2805208717 TSecr=1479019071 WS=512"
"178","1.442372675","192.168.1.118","199.232.37.140","TCP","66","34914 → 443 [ACK] Seq=1 Ack=1 Win=64256 Len=0 TSval=1479019103 TSecr=2805208717"
"179","1.450889038","209.18.47.62","192.168.1.118","DNS","135","Standard query response 0x53ef A a.thumbs.redditmedia.com CNAME reddit.map.fastly.net A 199.232.37.140"
"180","1.451096588","192.168.1.118","209.18.47.62","DNS","84","Standard query 0x47c5 AAAA a.thumbs.redditmedia.com"
"181","1.452543263","209.18.47.62","192.168.1.118","DNS","171","Standard query response 0x3bdc AAAA preview.redd.it CNAME reddit.map.fastly.net SOA ns1.fastly.net"
"182","1.454332700","199.232.37.140","192.168.1.118","TLSv1.2","117","Change Cipher Spec, Encrypted Handshake Message"
"183","1.454444463","209.18.47.62","192.168.1.118","DNS","171","Standard query response 0xc7a9 AAAA preview.redd.it CNAME reddit.map.fastly.net SOA ns1.fastly.net"
"184","1.454517025","209.18.47.62","192.168.1.118","DNS","128","Standard query response 0x6365 A s.redditmedia.com CNAME reddit.map.fastly.net A 199.232.37.140"
"185","1.454597850","209.18.47.62","192.168.1.118","DNS","175","Standard query response 0xcba6 AAAA styles.redditmedia.com CNAME reddit.map.fastly.net SOA ns1.fastly.net"
"186","1.454654913","199.232.37.140","192.168.1.118","TCP","74","443 → 34918 [SYN, ACK] Seq=0 Ack=1 Win=27040 Len=0 MSS=1364 SACK_PERM=1 TSval=3139644893 TSecr=1479019090 WS=512"
"187","1.454793088","192.168.1.118","199.232.37.140","TCP","66","34918 → 443 [ACK] Seq=1 Ack=1 Win=64256 Len=0 TSval=1479019116 TSecr=3139644893"
"188","1.454869988","199.232.37.140","192.168.1.118","TCP","74","443 → 34920 [SYN, ACK] Seq=0 Ack=1 Win=27040 Len=0 MSS=1364 SACK_PERM=1 TSval=3244653381 TSecr=1479019090 WS=512"
"189","1.454952150","192.168.1.118","199.232.37.140","TCP","66","34920 → 443 [ACK] Seq=1 Ack=1 Win=64256 Len=0 TSval=1479019116 TSecr=3244653381"
"190","1.455854625","192.168.1.118","209.18.47.62","DNS","77","Standard query 0xb7a2 AAAA s.redditmedia.com"
"191","1.457236550","192.168.1.118","199.232.37.140","TLSv1","583","Client Hello"
"192","1.457558388","192.168.1.118","199.232.37.140","TLSv1.2","276","Application Data"
"193","1.457796975","192.168.1.118","199.232.37.140","TLSv1.2","272","Application Data"
"194","1.468306613","199.232.37.140","192.168.1.118","TLSv1.2","1418","Application Data"
"195","1.472376400","199.232.37.140","192.168.1.118","TLSv1.2","1179","Application Data, Application Data"
"196","1.472479875","199.232.37.140","192.168.1.118","TLSv1.2","745","Application Data, Application Data"
"197","1.473352975","209.18.47.62","192.168.1.118","DNS","177","Standard query response 0x47c5 AAAA a.thumbs.redditmedia.com CNAME reddit.map.fastly.net SOA ns1.fastly.net"
"198","1.474101138","192.168.1.118","199.232.37.140","TLSv1","583","Client Hello"
"199","1.480410300","209.18.47.62","192.168.1.118","DNS","170","Standard query response 0xb7a2 AAAA s.redditmedia.com CNAME reddit.map.fastly.net SOA ns1.fastly.net"
"200","1.481616625","199.232.37.140","192.168.1.118","TCP","66","443 → 34906 [ACK] Seq=1 Ack=518 Win=28160 Len=0 TSval=1720107069 TSecr=1479019118"
"201","1.483041988","199.232.37.140","192.168.1.118","TLSv1.2","1418","Application Data"
"202","1.489011050","199.232.37.140","192.168.1.118","TLSv1.2","1725","Application Data, Application Data"
"203","1.489159775","199.232.37.140","192.168.1.118","TLSv1.2","2937","Application Data, Application Data, Application Data"
"204","1.489286363","199.232.37.140","192.168.1.118","TLSv1.2","3336","Server Hello, Certificate, Server Key Exchange, Server Hello Done"
"205","1.489368250","192.168.1.118","199.232.37.140","TCP","66","34906 → 443 [ACK] Seq=518 Ack=3271 Win=61056 Len=0 TSval=1479019150 TSecr=1720107071"
"206","1.490598463","192.168.1.118","199.232.37.140","TLSv1","583","Client Hello"
"207","1.491987088","199.232.37.140","192.168.1.118","TCP","66","443 → 34908 [ACK] Seq=1 Ack=518 Win=28160 Len=0 TSval=2804309393 TSecr=1479019135"
"208","1.492114650","199.232.37.140","192.168.1.118","TLSv1.2","3432","Server Hello, Certificate, Server Key Exchange, Server Hello Done"
"209","1.492183425","192.168.1.118","199.232.37.140","TCP","66","34908 → 443 [ACK] Seq=518 Ack=3367 Win=60928 Len=0 TSval=1479019153 TSecr=2804309394"
"210","1.506927288","192.168.1.118","199.232.37.140","TLSv1","583","Client Hello"
"211","1.508857275","192.168.1.118","199.232.37.140","TCP","66","34896 → 443 [ACK] Seq=852 Ack=5755 Win=61696 Len=0 TSval=1479019170 TSecr=2805897834"
"212","1.512193125","199.232.37.140","192.168.1.118","TCP","66","443 → 34910 [ACK] Seq=1 Ack=518 Win=28160 Len=0 TSval=2806152139 TSecr=1479019151"
"213","1.512883063","192.168.1.118","199.232.37.140","TCP","66","34894 → 443 [ACK] Seq=857 Ack=3969 Win=63488 Len=0 TSval=1479019174 TSecr=3138975840"
"214","1.516114000","199.232.37.140","192.168.1.118","TLSv1.2","1418","Server Hello"
"215","1.516246575","192.168.1.118","199.232.37.140","TCP","66","34910 → 443 [ACK] Seq=518 Ack=1353 Win=63104 Len=0 TSval=1479019177 TSecr=2806152139"
"216","1.517868500","199.232.37.140","192.168.1.118","TLSv1.2","2080","Certificate, Server Key Exchange, Server Hello Done"
"217","1.518009300","192.168.1.118","199.232.37.140","TCP","66","34910 → 443 [ACK] Seq=518 Ack=3367 Win=61184 Len=0 TSval=1479019179 TSecr=2806152139"
"218","1.523463400","192.168.1.118","199.232.37.140","TLSv1","583","Client Hello"
"219","1.524029425","192.168.1.118","199.232.37.140","TCP","66","34898 → 443 [ACK] Seq=854 Ack=6301 Win=61184 Len=0 TSval=1479019185 TSecr=2804098111"
"220","1.525653188","199.232.37.140","192.168.1.118","TCP","66","443 → 34912 [ACK] Seq=1 Ack=518 Win=28160 Len=0 TSval=3150241844 TSecr=1479019168"
"221","1.527644500","199.232.37.140","192.168.1.118","TLSv1.2","1418","Server Hello"
"222","1.527785400","192.168.1.118","199.232.37.140","TCP","66","34912 → 443 [ACK] Seq=518 Ack=1353 Win=63104 Len=0 TSval=1479019189 TSecr=3150241845"
"223","1.530029075","192.168.1.118","199.232.37.140","TCP","66","34900 → 443 [ACK] Seq=850 Ack=6161 Win=61312 Len=0 TSval=1479019191 TSecr=268355574"
"224","1.531309663","199.232.37.140","192.168.1.118","TLSv1.2","1962","Certificate, Server Key Exchange, Server Hello Done"
"225","1.531423125","192.168.1.118","199.232.37.140","TCP","66","34912 → 443 [ACK] Seq=518 Ack=3249 Win=61312 Len=0 TSval=1479019192 TSecr=3150241845"
"226","1.540397775","192.168.1.118","199.232.37.140","TLSv1","583","Client Hello"
"227","1.540601850","192.168.1.118","199.232.37.140","TCP","74","34922 → 443 [SYN] Seq=0 Win=64240 Len=0 MSS=1460 SACK_PERM=1 TSval=1479019202 TSecr=0 WS=128"
"228","1.540686138","192.168.1.118","199.232.37.140","TCP","74","34924 → 443 [SYN] Seq=0 Win=64240 Len=0 MSS=1460 SACK_PERM=1 TSval=1479019202 TSecr=0 WS=128"
"229","1.546453213","199.232.37.140","192.168.1.118","TCP","66","[TCP Dup ACK 212#1] 443 → 34910 [ACK] Seq=3367 Ack=518 Win=28160 Len=0 TSval=2806152147 TSecr=1479019179"
"230","1.547434075","199.232.37.140","192.168.1.118","TCP","66","443 → 34914 [ACK] Seq=1 Ack=518 Win=28160 Len=0 TSval=2805208744 TSecr=1479019184"
"231","1.549171250","199.232.37.140","192.168.1.118","TLSv1.2","3432","Server Hello, Certificate, Server Key Exchange, Server Hello Done"
"232","1.549302950","192.168.1.118","199.232.37.140","TCP","66","34914 → 443 [ACK] Seq=518 Ack=3367 Win=60928 Len=0 TSval=1479019210 TSecr=2805208745"
"233","1.557021100","192.168.1.118","199.232.37.140","TLSv1","583","Client Hello"
"234","1.567057088","199.232.37.140","192.168.1.118","TCP","66","443 → 34916 [ACK] Seq=1 Ack=518 Win=28160 Len=0 TSval=3118478463 TSecr=1479019201"
"235","1.568321113","199.232.37.140","192.168.1.118","TCP","74","443 → 34924 [SYN, ACK] Seq=0 Ack=1 Win=27040 Len=0 MSS=1364 SACK_PERM=1 TSval=269078301 TSecr=1479019202 WS=512"
"236","1.568500963","192.168.1.118","199.232.37.140","TCP","66","34924 → 443 [ACK] Seq=1 Ack=1 Win=64256 Len=0 TSval=1479019229 TSecr=269078301"
"237","1.568603938","199.232.37.140","192.168.1.118","TCP","74","443 → 34922 [SYN, ACK] Seq=0 Ack=1 Win=27040 Len=0 MSS=1364 SACK_PERM=1 TSval=656003005 TSecr=1479019202 WS=512"
"238","1.568714825","192.168.1.118","199.232.37.140","TCP","66","34922 → 443 [ACK] Seq=1 Ack=1 Win=64256 Len=0 TSval=1479019230 TSecr=656003005"
"239","1.568845625","199.232.37.140","192.168.1.118","TLSv1.2","1418","Server Hello"
"240","1.568926950","192.168.1.118","199.232.37.140","TCP","66","34916 → 443 [ACK] Seq=518 Ack=1353 Win=63104 Len=0 TSval=1479019230 TSecr=3118478464"
"241","1.569683738","199.232.37.140","192.168.1.118","TLSv1.2","2080","Certificate, Server Key Exchange, Server Hello Done"
"242","1.569865738","192.168.1.118","199.232.37.140","TCP","66","34916 → 443 [ACK] Seq=518 Ack=3367 Win=61184 Len=0 TSval=1479019231 TSecr=3118478464"
"243","1.573384163","192.168.1.118","199.232.37.140","TLSv1","583","Client Hello"
"244","1.575698600","199.232.37.140","192.168.1.118","TCP","66","443 → 34918 [ACK] Seq=1 Ack=518 Win=28160 Len=0 TSval=3139644924 TSecr=1479019218"
"245","1.577913775","199.232.37.140","192.168.1.118","TLSv1.2","1418","Server Hello"
"246","1.578043363","192.168.1.118","199.232.37.140","TCP","66","34918 → 443 [ACK] Seq=518 Ack=1353 Win=63104 Len=0 TSval=1479019239 TSecr=3139644924"
"247","1.580025563","199.232.37.140","192.168.1.118","TLSv1.2","1984","Certificate, Server Key Exchange, Server Hello Done"
"248","1.580133225","192.168.1.118","199.232.37.140","TCP","66","34918 → 443 [ACK] Seq=518 Ack=3271 Win=61312 Len=0 TSval=1479019241 TSecr=3139644924"
"249","1.589931425","192.168.1.118","199.232.37.140","TLSv1","583","Client Hello"
"250","1.602545525","199.232.37.140","192.168.1.118","TCP","66","443 → 34920 [ACK] Seq=1 Ack=518 Win=28160 Len=0 TSval=3244653418 TSecr=1479019234"
"251","1.604618150","199.232.37.140","192.168.1.118","TLSv1.2","3336","Server Hello, Certificate, Server Key Exchange, Server Hello Done"
"252","1.604787413","192.168.1.118","199.232.37.140","TCP","66","34920 → 443 [ACK] Seq=518 Ack=3271 Win=61056 Len=0 TSval=1479019266 TSecr=3244653418"
"253","1.606373950","192.168.1.118","199.232.37.140","TLSv1","583","Client Hello"
"254","1.608362225","192.168.1.118","199.232.37.140","TLSv1.2","192","Client Key Exchange, Change Cipher Spec, Encrypted Handshake Message"
"255","1.610481275","192.168.1.118","199.232.37.140","TLSv1.2","192","Client Key Exchange, Change Cipher Spec, Encrypted Handshake Message"
"256","1.610866675","199.232.37.140","192.168.1.118","TCP","66","443 → 34902 [ACK] Seq=1 Ack=518 Win=28160 Len=0 TSval=269078312 TSecr=1479019251"
"257","1.612390950","192.168.1.118","199.232.37.140","TLSv1.2","192","Client Key Exchange, Change Cipher Spec, Encrypted Handshake Message"
"258","1.613405813","199.232.37.140","192.168.1.118","TLSv1.2","1418","Server Hello"
"259","1.613512663","192.168.1.118","199.232.37.140","TCP","66","34902 → 443 [ACK] Seq=518 Ack=1353 Win=63104 Len=0 TSval=1479019274 TSecr=269078313"
"260","1.614230000","192.168.1.118","199.232.37.140","TLSv1.2","192","Client Key Exchange, Change Cipher Spec, Encrypted Handshake Message"
"261","1.615827288","199.232.37.140","192.168.1.118","TLSv1.2","1962","Certificate, Server Key Exchange, Server Hello Done"
"262","1.615942525","192.168.1.118","199.232.37.140","TCP","66","34902 → 443 [ACK] Seq=518 Ack=3249 Win=61312 Len=0 TSval=1479019277 TSecr=269078313"
"263","1.616060225","192.168.1.118","199.232.37.140","TLSv1.2","192","Client Key Exchange, Change Cipher Spec, Encrypted Handshake Message"
"264","1.617920050","192.168.1.118","199.232.37.140","TLSv1.2","192","Client Key Exchange, Change Cipher Spec, Encrypted Handshake Message"
"265","1.630253988","199.232.37.140","192.168.1.118","TCP","66","443 → 34904 [ACK] Seq=1 Ack=518 Win=28160 Len=0 TSval=3906556059 TSecr=1479019267"
"266","1.630995800","199.232.37.140","192.168.1.118","TLSv1.2","117","Change Cipher Spec, Encrypted Handshake Message"
"267","1.631137338","192.168.1.118","199.232.37.140","TCP","66","34906 → 443 [ACK] Seq=644 Ack=3322 Win=64128 Len=0 TSval=1479019292 TSecr=1720107218"
"268","1.631237413","199.232.37.140","192.168.1.118","TLSv1.2","117","Change Cipher Spec, Encrypted Handshake Message"
"269","1.631324963","192.168.1.118","199.232.37.140","TCP","66","34910 → 443 [ACK] Seq=644 Ack=3418 Win=64128 Len=0 TSval=1479019292 TSecr=2806152169"
"270","1.631817150","199.232.37.140","192.168.1.118","TLSv1.2","117","Change Cipher Spec, Encrypted Handshake Message"
"271","1.631958813","192.168.1.118","199.232.37.140","TCP","66","34908 → 443 [ACK] Seq=644 Ack=3418 Win=64128 Len=0 TSval=1479019293 TSecr=2804309430"
"272","1.634102138","192.168.1.118","199.232.37.140","TLSv1","583","Client Hello"
"273","1.640891200","199.232.37.140","192.168.1.118","TLSv1.2","3314","Server Hello, Certificate, Server Key Exchange, Server Hello Done"
"274","1.641023475","192.168.1.118","199.232.37.140","TCP","66","34904 → 443 [ACK] Seq=518 Ack=3249 Win=61056 Len=0 TSval=1479019302 TSecr=3906556059"
"275","1.642830388","199.232.37.140","192.168.1.118","TLSv1.3","117","Change Cipher Spec, Encrypted Handshake Message"
"276","1.642972325","192.168.1.118","199.232.37.140","TCP","66","34916 → 443 [ACK] Seq=644 Ack=3418 Win=64128 Len=0 TSval=1479019304 TSecr=3118478482"
"277","1.643067888","199.232.37.140","192.168.1.118","TLSv1.2","117","Change Cipher Spec, Encrypted Handshake Message"
"278","1.643156838","192.168.1.118","199.232.37.140","TCP","66","34914 → 443 [ACK] Seq=644 Ack=3418 Win=64128 Len=0 TSval=1479019304 TSecr=2805208768"
"279","1.643231525","199.232.37.140","192.168.1.118","TLSv1.2","117","Change Cipher Spec, Encrypted Handshake Message"
"280","1.643316713","192.168.1.118","199.232.37.140","TCP","66","34912 → 443 [ACK] Seq=644 Ack=3300 Win=64128 Len=0 TSval=1479019304 TSecr=3150241960"
"281","1.650445425","192.168.1.118","199.232.37.140","TLSv1","583","Client Hello"
"282","1.652445488","192.168.1.118","199.232.37.140","TLSv1.2","192","Client Key Exchange, Change Cipher Spec, Encrypted Handshake Message"
"283","1.654343788","192.168.1.118","199.232.37.140","TLSv1.2","192","Client Key Exchange, Change Cipher Spec, Encrypted Handshake Message"
"284","1.660288275","199.232.37.140","192.168.1.118","TCP","66","443 → 34922 [ACK] Seq=1 Ack=518 Win=28160 Len=0 TSval=656003029 TSecr=1479019295"
"285","1.663653163","199.232.37.140","192.168.1.118","TLSv1.2","1418","Server Hello"
"286","1.663817700","192.168.1.118","199.232.37.140","TCP","66","34922 → 443 [ACK] Seq=518 Ack=1353 Win=63104 Len=0 TSval=1479019325 TSecr=656003030"
"287","1.666385138","199.232.37.140","192.168.1.118","TLSv1.2","1984","Certificate, Server Key Exchange, Server Hello Done"
"288","1.666479413","192.168.1.118","199.232.37.140","TCP","66","34922 → 443 [ACK] Seq=518 Ack=3271 Win=61312 Len=0 TSval=1479019327 TSecr=656003030"
"289","1.671515013","199.232.37.140","192.168.1.118","TCP","66","443 → 34924 [ACK] Seq=1 Ack=518 Win=28160 Len=0 TSval=269078327 TSecr=1479019311"
"290","1.675064613","192.168.1.118","199.232.37.140","TLSv1.2","192","Client Key Exchange, Change Cipher Spec, Encrypted Handshake Message"
"291","1.677020238","192.168.1.118","199.232.37.140","TLSv1.2","192","Client Key Exchange, Change Cipher Spec, Encrypted Handshake Message"
"292","1.677097750","199.232.37.140","192.168.1.118","TLSv1.2","1418","Server Hello"
"293","1.677130075","192.168.1.118","199.232.37.140","TCP","66","34924 → 443 [ACK] Seq=518 Ack=1353 Win=63104 Len=0 TSval=1479019338 TSecr=269078328"
"294","1.677398613","192.168.1.118","199.232.37.140","TLSv1.2","295","Application Data"
"295","1.677734375","192.168.1.118","199.232.37.140","TLSv1.2","369","Application Data"
"296","1.677962663","192.168.1.118","199.232.37.140","TLSv1.2","341","Application Data"
"297","1.678161975","192.168.1.118","199.232.37.140","TLSv1.2","293","Application Data"
"298","1.678354013","192.168.1.118","199.232.37.140","TLSv1.2","367","Application Data"
"299","1.678451350","199.232.37.140","192.168.1.118","TLSv1.2","1962","Certificate, Server Key Exchange, Server Hello Done"
"300","1.678484288","192.168.1.118","199.232.37.140","TCP","66","34924 → 443 [ACK] Seq=518 Ack=3249 Win=61312 Len=0 TSval=1479019339 TSecr=269078328"
"301","1.678665763","192.168.1.118","199.232.37.140","TLSv1.3","371","Application Data"
"302","1.680510275","192.168.1.118","199.232.37.140","TLSv1.2","192","Client Key Exchange, Change Cipher Spec, Encrypted Handshake Message"
"303","1.682352713","192.168.1.118","199.232.37.140","TLSv1.2","192","Client Key Exchange, Change Cipher Spec, Encrypted Handshake Message"
"304","1.683437075","199.232.37.140","192.168.1.118","TLSv1.2","117","Change Cipher Spec, Encrypted Handshake Message"
"305","1.683500413","192.168.1.118","199.232.37.140","TCP","66","34920 → 443 [ACK] Seq=644 Ack=3322 Win=64128 Len=0 TSval=1479019344 TSecr=3244653438"
"306","1.686032600","192.168.1.118","199.232.37.140","TLSv1.2","295","Application Data"
"307","1.691814925","199.232.37.140","192.168.1.118","TLSv1.2","117","Change Cipher Spec, Encrypted Handshake Message"
"308","1.691886863","192.168.1.118","199.232.37.140","TCP","66","34918 → 443 [ACK] Seq=644 Ack=3322 Win=64128 Len=0 TSval=1479019353 TSecr=3139644950"
"309","1.692292175","192.168.1.118","199.232.37.140","TLSv1.2","295","Application Data"
"310","1.702600350","192.168.1.118","199.232.37.140","TCP","66","[TCP Window Update] 34870 → 443 [ACK] Seq=1 Ack=139358 Win=578 Len=0 TSval=1479019363 TSecr=2806199169"
"311","1.713184400","199.232.37.140","192.168.1.118","TLSv1.2","1418","Application Data"
"312","1.713302150","192.168.1.118","199.232.37.140","TCP","66","34910 → 443 [ACK] Seq=919 Ack=4770 Win=63104 Len=0 TSval=1479019374 TSecr=2806152189"
"313","1.716632113","199.232.37.140","192.168.1.118","TLSv1.2","5474","Application Data, Application Data, Application Data, Application Data"
"314","1.716728825","192.168.1.118","199.232.37.140","TCP","66","34910 → 443 [ACK] Seq=919 Ack=10178 Win=57728 Len=0 TSval=1479019378 TSecr=2806152189"
"315","1.716914325","199.232.37.140","192.168.1.118","TLSv1.2","4122","Application Data, Application Data, Application Data"
"316","1.716977050","192.168.1.118","199.232.37.140","TCP","66","34910 → 443 [ACK] Seq=919 Ack=14234 Win=53760 Len=0 TSval=1479019378 TSecr=2806152189"
"317","1.722598913","199.232.37.140","192.168.1.118","TLSv1.2","117","Change Cipher Spec, Encrypted Handshake Message"
"318","1.722781913","199.232.37.140","192.168.1.118","TLSv1.2","4233","Application Data, Application Data, Application Data, Application Data"
"319","1.722863188","192.168.1.118","199.232.37.140","TCP","66","34906 → 443 [ACK] Seq=873 Ack=7489 Win=60032 Len=0 TSval=1479019384 TSecr=1720107301"
"320","1.722938738","199.232.37.140","192.168.1.118","TLSv1.2","2770","Application Data, Application Data"
"321","1.722988863","192.168.1.118","199.232.37.140","TCP","66","34910 → 443 [ACK] Seq=919 Ack=16938 Win=61056 Len=0 TSval=1479019384 TSecr=2806152189"
"322","1.723019563","199.232.37.140","192.168.1.118","TLSv1.2","1418","Application Data"
"323","1.723193738","192.168.1.118","199.232.37.140","TLSv1.2","293","Application Data"
"324","1.724096538","199.232.37.140","192.168.1.118","TLSv1.2","4122","Application Data, Application Data, Application Data"
"325","1.724850100","199.232.37.140","192.168.1.118","TLSv1.2","2461","Application Data, Application Data, Application Data"
"326","1.724935788","199.232.37.140","192.168.1.118","TLSv1.2","3768","Application Data, Application Data, Application Data, Application Data"
"327","1.724997388","192.168.1.118","199.232.37.140","TCP","66","34908 → 443 [ACK] Seq=947 Ack=7120 Win=60544 Len=0 TSval=1479019386 TSecr=2804309450"
"328","1.725458038","192.168.1.118","199.232.37.140","TCP","66","34918 → 443 [ACK] Seq=873 Ack=11125 Win=56448 Len=0 TSval=1479019386 TSecr=3139644958"
"329","1.727861888","199.232.37.140","192.168.1.118","TLSv1.3","3979","Application Data, Application Data, Application Data, Application Data"
"330","1.727979200","199.232.37.140","192.168.1.118","TLSv1.2","5474","Application Data, Application Data, Application Data, Application Data"
"331","1.729325788","192.168.1.118","199.232.37.140","TCP","66","34916 → 443 [ACK] Seq=949 Ack=7331 Win=60288 Len=0 TSval=1479019390 TSecr=3118478500"
"332","1.729659750","192.168.1.118","199.232.37.140","TCP","66","34920 → 443 [ACK] Seq=873 Ack=8730 Win=58752 Len=0 TSval=1479019391 TSecr=3244653446"
"333","1.729667825","199.232.37.140","192.168.1.118","TLSv1.2","6826","Application Data, Application Data, Application Data, Application Data, Application Data"
"334","1.729903088","192.168.1.118","199.232.37.140","TCP","66","34920 → 443 [ACK] Seq=873 Ack=15490 Win=52096 Len=0 TSval=1479019391 TSecr=3244653446"
"335","1.730905288","199.232.37.140","192.168.1.118","TLSv1.2","1418","Application Data [TCP segment of a reassembled PDU]"
"336","1.730958925","199.232.37.140","192.168.1.118","TLSv1.2","4122","Application Data, Application Data, Application Data"
"337","1.731553838","192.168.1.118","199.232.37.140","TCP","66","34912 → 443 [ACK] Seq=871 Ack=7356 Win=60160 Len=0 TSval=1479019392 TSecr=3150242033"
"338","1.734039200","199.232.37.140","192.168.1.118","TLSv1.2","1418","Application Data [TCP segment of a reassembled PDU]"
"339","1.734116375","199.232.37.140","192.168.1.118","TLSv1.2","1427","Application Data, Application Data"
"340","1.734171463","192.168.1.118","199.232.37.140","TCP","66","34912 → 443 [ACK] Seq=871 Ack=10069 Win=60288 Len=0 TSval=1479019395 TSecr=3150242033"
"341","1.734258938","199.232.37.140","192.168.1.118","TLSv1.2","3240","Application Data, Application Data, Application Data"
"342","1.734315388","199.232.37.140","192.168.1.118","TLSv1.2","117","Change Cipher Spec, Encrypted Handshake Message"
"343","1.734363525","192.168.1.118","199.232.37.140","TCP","66","34902 → 443 [ACK] Seq=644 Ack=3300 Win=64128 Len=0 TSval=1479019395 TSecr=269078338"
"344","1.734441400","199.232.37.140","192.168.1.118","TLSv1.2","117","Change Cipher Spec, Encrypted Handshake Message"
"345","1.734486813","199.232.37.140","192.168.1.118","TLSv1.2","117","Change Cipher Spec, Encrypted Handshake Message"
"346","1.734520913","199.232.37.140","192.168.1.118","TLSv1.2","2770","Application Data, Application Data"
"347","1.734559725","192.168.1.118","199.232.37.140","TCP","66","34910 → 443 [ACK] Seq=919 Ack=19642 Win=61056 Len=0 TSval=1479019395 TSecr=2806152192"
"348","1.736211238","192.168.1.118","199.232.37.140","TLSv1.2","348","Application Data"
"349","1.736501200","192.168.1.118","199.232.37.140","TCP","66","34914 → 443 [ACK] Seq=945 Ack=6592 Win=61056 Len=0 TSval=1479019397 TSecr=2805208787"
"350","1.736870225","192.168.1.118","199.232.37.140","TLSv1.2","295","Application Data"
"351","1.737080725","192.168.1.118","199.232.37.140","TLSv1.2","331","Application Data"
"352","1.741442863","199.232.37.140","192.168.1.118","TLSv1.2","1418","Application Data [TCP segment of a reassembled PDU]"
"353","1.741529500","192.168.1.118","199.232.37.140","TCP","66","34910 → 443 [ACK] Seq=919 Ack=20994 Win=63104 Len=0 TSval=1479019402 TSecr=2806152196"
"354","1.746037388","199.232.37.140","192.168.1.118","TLSv1.2","4122","Application Data, Application Data, Application Data"
"355","1.746164400","192.168.1.118","199.232.37.140","TCP","66","34910 → 443 [ACK] Seq=919 Ack=25050 Win=59136 Len=0 TSval=1479019407 TSecr=2806152196"
"356","1.746296050","199.232.37.140","192.168.1.118","TLSv1.2","5474","Application Data, Application Data, Application Data"
"357","1.746355888","192.168.1.118","199.232.37.140","TCP","66","34910 → 443 [ACK] Seq=919 Ack=30458 Win=53760 Len=0 TSval=1479019407 TSecr=2806152196"
"358","1.748549250","199.232.37.140","192.168.1.118","TLSv1.2","6826","Application Data, Application Data, Application Data, Application Data, Application Data"
"359","1.748669063","192.168.1.118","199.232.37.140","TCP","66","34910 → 443 [ACK] Seq=919 Ack=37218 Win=71936 Len=0 TSval=1479019410 TSecr=2806152196"
"360","1.752593150","199.232.37.140","192.168.1.118","TLSv1.2","1418","Application Data [TCP segment of a reassembled PDU]"
"361","1.752698088","192.168.1.118","199.232.37.140","TCP","66","34910 → 443 [ACK] Seq=919 Ack=38570 Win=70656 Len=0 TSval=1479019414 TSecr=2806152196"
"362","1.752792450","199.232.37.140","192.168.1.118","TLSv1.2","6826","Application Data, Application Data, Application Data, Application Data, Application Data"
"363","1.752855063","192.168.1.118","199.232.37.140","TCP","66","34920 → 443 [ACK] Seq=873 Ack=23602 Win=54912 Len=0 TSval=1479019414 TSecr=3244653446"
"364","1.754373650","199.232.37.140","192.168.1.118","TLSv1.2","9530","Application Data, Application Data, Application Data, Application Data, Application Data, Application Data"
"365","1.754575775","192.168.1.118","199.232.37.140","TCP","66","34920 → 443 [ACK] Seq=873 Ack=33066 Win=45568 Len=0 TSval=1479019415 TSecr=3244653455"
"366","1.758199775","199.232.37.140","192.168.1.118","TLSv1.2","8178","Application Data, Application Data, Application Data, Application Data, Application Data, Application Data"
"367","1.759275238","192.168.1.118","199.232.37.140","TCP","66","34904 → 443 [ACK] Seq=871 Ack=11412 Win=56064 Len=0 TSval=1479019420 TSecr=3906556088"
"368","1.760171875","199.232.37.140","192.168.1.118","TLSv1.2","5474","Application Data, Application Data, Application Data, Application Data"
"369","1.760234788","199.232.37.140","192.168.1.118","TLSv1.2","1418","Application Data [TCP segment of a reassembled PDU]"
"370","1.760287638","192.168.1.118","199.232.37.140","TCP","66","34910 → 443 [ACK] Seq=919 Ack=39922 Win=74752 Len=0 TSval=1479019421 TSecr=2806152197"
"371","1.760613563","199.232.37.140","192.168.1.118","TLSv1.2","1418","Application Data, Application Data"
"372","1.760659413","192.168.1.118","199.232.37.140","TCP","66","34910 → 443 [ACK] Seq=919 Ack=41274 Win=77440 Len=0 TSval=1479019422 TSecr=2806152197"
"373","1.760738288","199.232.37.140","192.168.1.118","TLSv1.2","2770","Application Data, Application Data"
"374","1.760796525","192.168.1.118","199.232.37.140","TCP","66","34910 → 443 [ACK] Seq=919 Ack=43978 Win=82816 Len=0 TSval=1479019422 TSecr=2806152198"
"375","1.760822850","199.232.37.140","192.168.1.118","TLSv1.2","1418","Application Data [TCP segment of a reassembled PDU]"
"376","1.761090313","192.168.1.118","199.232.37.140","TCP","66","34904 → 443 [ACK] Seq=871 Ack=16820 Win=50688 Len=0 TSval=1479019422 TSecr=3906556088"
"377","1.766157538","199.232.37.140","192.168.1.118","TLSv1.2","1418","Application Data [TCP segment of a reassembled PDU]"
"378","1.766246000","192.168.1.118","199.232.37.140","TCP","66","34920 → 443 [ACK] Seq=873 Ack=35770 Win=63104 Len=0 TSval=1479019427 TSecr=3244653455"
"379","1.766289675","199.232.37.140","192.168.1.118","TLSv1.2","2770","Application Data, Application Data"
"380","1.766333575","192.168.1.118","199.232.37.140","TCP","66","34910 → 443 [ACK] Seq=919 Ack=46682 Win=88192 Len=0 TSval=1479019427 TSecr=2806152200"
"381","1.766359400","199.232.37.140","192.168.1.118","TLSv1.2","4122","Application Data, Application Data, Application Data"
"382","1.766607563","199.232.37.140","192.168.1.118","TLSv1.2","9530","Application Data, Application Data, Application Data, Application Data, Application Data, Application Data, Application Data"
"383","1.766640938","199.232.37.140","192.168.1.118","TLSv1.2","4122","Application Data, Application Data, Application Data"
"384","1.767536250","192.168.1.118","199.232.37.140","TCP","66","34902 → 443 [ACK] Seq=926 Ack=16820 Win=50688 Len=0 TSval=1479019428 TSecr=269078349"
"385","1.767856450","192.168.1.118","199.232.37.140","TCP","66","34910 → 443 [ACK] Seq=919 Ack=50738 Win=86272 Len=0 TSval=1479019429 TSecr=2806152200"
"386","1.770111375","199.232.37.140","192.168.1.118","TLSv1.2","5474","Application Data, Application Data, Application Data, Application Data"
"387","1.772022813","199.232.37.140","192.168.1.118","TLSv1.2","3211","Application Data, Application Data, Application Data"
"388","1.772067625","192.168.1.118","199.232.37.140","TCP","66","34922 → 443 [ACK] Seq=873 Ack=8730 Win=58752 Len=0 TSval=1479019433 TSecr=656003054"
"389","1.772136888","192.168.1.118","199.232.37.140","TCP","66","34922 → 443 [ACK] Seq=873 Ack=11875 Win=55680 Len=0 TSval=1479019433 TSecr=656003054"
"390","1.772160663","199.232.37.140","192.168.1.118","TLSv1.2","525","Application Data"
"391","1.772240988","199.232.37.140","192.168.1.118","TLSv1.2","2770","Application Data, Application Data"
"392","1.772306025","192.168.1.118","199.232.37.140","TCP","66","34910 → 443 [ACK] Seq=919 Ack=53442 Win=92416 Len=0 TSval=1479019433 TSecr=2806152200"
"393","1.772356413","192.168.1.118","199.232.37.140","TLSv1.2","97","Encrypted Alert"
"394","1.772393088","199.232.37.140","192.168.1.118","TLSv1.2","97","Encrypted Alert"
"395","1.772440300","199.232.37.140","192.168.1.118","TCP","66","443 → 34924 [FIN, ACK] Seq=3790 Ack=909 Win=29184 Len=0 TSval=269078350 TSecr=1479019398"
"396","1.772484450","199.232.37.140","192.168.1.118","TLSv1.2","2770","Application Data, Application Data"
"397","1.772512450","199.232.37.140","192.168.1.118","TLSv1.2","2770","Application Data [TCP segment of a reassembled PDU]"
"398","1.774128850","192.168.1.118","199.232.37.140","TCP","66","34924 → 443 [RST, ACK] Seq=940 Ack=3791 Win=64128 Len=0 TSval=1479019435 TSecr=269078350"
"399","1.774236075","192.168.1.118","199.232.37.140","TCP","66","34920 → 443 [ACK] Seq=873 Ack=38474 Win=64128 Len=0 TSval=1479019435 TSecr=3244653455"
"400","1.775618075","192.168.1.118","199.232.37.140","TCP","66","34910 → 443 [ACK] Seq=919 Ack=56146 Win=89728 Len=0 TSval=1479019436 TSecr=2806152201"
"401","1.775924825","192.168.1.118","199.232.37.140","TLSv1.2","336","Application Data"
"402","1.776348388","199.232.37.140","192.168.1.118","TLSv1.2","5474","Application Data, Application Data, Application Data, Application Data"
"403","1.776418375","199.232.37.140","192.168.1.118","TLSv1.2","1418","Application Data [TCP segment of a reassembled PDU]"
"404","1.777813050","192.168.1.118","199.232.37.140","TCP","66","34910 → 443 [ACK] Seq=919 Ack=61554 Win=92416 Len=0 TSval=1479019439 TSecr=2806152201"
"405","1.778282038","199.232.37.140","192.168.1.118","TLSv1.2","5474","Application Data, Application Data, Application Data, Application Data"
"406","1.778385150","192.168.1.118","199.232.37.140","TCP","66","34910 → 443 [ACK] Seq=919 Ack=66962 Win=103296 Len=0 TSval=1479019439 TSecr=2806152202"
"407","1.778466375","199.232.37.140","192.168.1.118","TLSv1.2","1418","Application Data [TCP segment of a reassembled PDU]"
"408","1.778518588","192.168.1.118","199.232.37.140","TCP","66","34920 → 443 [ACK] Seq=873 Ack=41178 Win=69504 Len=0 TSval=1479019439 TSecr=3244653456"
"409","1.778550213","199.232.37.140","192.168.1.118","TLSv1.2","2770","Application Data, Application Data"
"410","1.778599950","192.168.1.118","199.232.37.140","TCP","66","34910 → 443 [ACK] Seq=919 Ack=69666 Win=108672 Len=0 TSval=1479019439 TSecr=2806152203"
"411","1.778930550","199.232.37.140","192.168.1.118","TLSv1.2","4122","Application Data, Application Data, Application Data"
"412","1.778965225","192.168.1.118","199.232.37.140","TCP","66","34910 → 443 [ACK] Seq=919 Ack=73722 Win=116864 Len=0 TSval=1479019440 TSecr=2806152203"
"413","1.785275338","199.232.37.140","192.168.1.118","TLSv1.2","1418","Application Data [TCP segment of a reassembled PDU]"
"414","1.785352100","192.168.1.118","199.232.37.140","TCP","66","34910 → 443 [ACK] Seq=919 Ack=75074 Win=119552 Len=0 TSval=1479019446 TSecr=2806152203"
"415","1.785424538","199.232.37.140","192.168.1.118","TLSv1.2","5474","Application Data, Application Data, Application Data, Application Data"
"416","1.785457088","192.168.1.118","199.232.37.140","TCP","66","34910 → 443 [ACK] Seq=919 Ack=80482 Win=130304 Len=0 TSval=1479019446 TSecr=2806152204"
"417","1.785486963","199.232.37.140","192.168.1.118","TLSv1.2","2770","Application Data, Application Data"
"418","1.785511413","192.168.1.118","199.232.37.140","TCP","66","34910 → 443 [ACK] Seq=919 Ack=83186 Win=130688 Len=0 TSval=1479019446 TSecr=2806152205"
"419","1.786439538","199.232.37.140","192.168.1.118","TLSv1.2","4122","Application Data, Application Data, Application Data"
"420","1.787705663","192.168.1.118","199.232.37.140","TCP","66","34910 → 443 [ACK] Seq=919 Ack=87242 Win=126720 Len=0 TSval=1479019449 TSecr=2806152205"
"421","1.793473338","199.232.37.140","192.168.1.118","TLSv1.2","2770","Application Data, Application Data"
"422","1.793566813","192.168.1.118","199.232.37.140","TCP","66","34920 → 443 [ACK] Seq=873 Ack=43882 Win=75008 Len=0 TSval=1479019454 TSecr=3244653463"
"423","1.793618225","199.232.37.140","192.168.1.118","TLSv1.2","2770","Application Data, Application Data"
"424","1.793666850","192.168.1.118","199.232.37.140","TCP","66","34910 → 443 [ACK] Seq=919 Ack=89946 Win=136064 Len=0 TSval=1479019455 TSecr=2806152207"
"425","1.793697425","199.232.37.140","192.168.1.118","TLSv1.2","2770","Application Data, Application Data"
"426","1.793765175","192.168.1.118","199.232.37.140","TCP","66","34904 → 443 [ACK] Seq=871 Ack=19524 Win=61056 Len=0 TSval=1479019455 TSecr=3906556097"
"427","1.795150488","199.232.37.140","192.168.1.118","TLSv1.2","4122","Application Data, Application Data, Application Data"
"428","1.795923175","199.232.37.140","192.168.1.118","TLSv1.2","5480","Application Data, Application Data, Application Data, Application Data"
"429","1.796006325","199.232.37.140","192.168.1.118","TLSv1.2","1418","Application Data [TCP segment of a reassembled PDU]"
"430","1.796063125","199.232.37.140","192.168.1.118","TLSv1.2","1418","Application Data [TCP segment of a reassembled PDU]"
"431","1.796122250","192.168.1.118","199.232.37.140","TCP","66","34920 → 443 [ACK] Seq=873 Ack=46586 Win=80384 Len=0 TSval=1479019457 TSecr=3244653463"
"432","1.796493975","192.168.1.118","199.232.37.140","TCP","66","34904 → 443 [ACK] Seq=871 Ack=28994 Win=51712 Len=0 TSval=1479019457 TSecr=3906556097"
"433","1.800814525","199.232.37.140","192.168.1.118","TLSv1.2","5792","Application Data, Application Data, Application Data, Application Data, Application Data"
"434","1.800934813","192.168.1.118","199.232.37.140","TCP","66","34910 → 443 [ACK] Seq=919 Ack=95672 Win=147584 Len=0 TSval=1479019462 TSecr=2806152207"
"435","1.801033650","199.232.37.140","192.168.1.118","TLSv1.2","2770","Application Data, Application Data"
"436","1.801100325","192.168.1.118","199.232.37.140","TCP","66","34920 → 443 [ACK] Seq=873 Ack=49290 Win=85760 Len=0 TSval=1479019462 TSecr=3244653463"
"437","1.802038838","199.232.37.140","192.168.1.118","TLSv1.2","1418","Application Data [TCP segment of a reassembled PDU]"
"438","1.802122563","199.232.37.140","192.168.1.118","TLSv1.2","2770","Application Data, Application Data"
"439","1.802188725","192.168.1.118","199.232.37.140","TCP","66","34920 → 443 [ACK] Seq=873 Ack=53346 Win=93952 Len=0 TSval=1479019463 TSecr=3244653463"
"440","1.802332950","199.232.37.140","192.168.1.118","TLSv1.2","1224","Application Data, Application Data"
"441","1.802443538","199.232.37.140","192.168.1.118","TLSv1.2","2770","Application Data, Application Data"
"442","1.802507413","192.168.1.118","199.232.37.140","TCP","66","34920 → 443 [ACK] Seq=873 Ack=56050 Win=99328 Len=0 TSval=1479019463 TSecr=3244653464"
"443","1.802557363","199.232.37.140","192.168.1.118","TLSv1.2","1418","Application Data [TCP segment of a reassembled PDU]"
"444","1.805334200","199.232.37.140","192.168.1.118","TLSv1.2","1418","Application Data [TCP segment of a reassembled PDU]"
"445","1.805450775","192.168.1.118","199.232.37.140","TCP","66","34920 → 443 [ACK] Seq=873 Ack=58754 Win=104704 Len=0 TSval=1479019466 TSecr=3244653465"
"446","1.805568600","199.232.37.140","192.168.1.118","TLSv1.2","2770","Application Data, Application Data"
"447","1.805634513","192.168.1.118","199.232.37.140","TCP","66","34920 → 443 [ACK] Seq=873 Ack=61458 Win=110080 Len=0 TSval=1479019467 TSecr=3244653466"
"448","1.805728538","199.232.37.140","192.168.1.118","TLSv1.2","2770","Application Data, Application Data"
"449","1.805839163","192.168.1.118","199.232.37.140","TCP","66","34920 → 443 [ACK] Seq=873 Ack=64162 Win=115584 Len=0 TSval=1479019467 TSecr=3244653467"
"450","1.809460700","199.232.37.140","192.168.1.118","TLSv1.2","2319","Application Data, Application Data"
"451","1.809578238","192.168.1.118","199.232.37.140","TCP","66","34920 → 443 [ACK] Seq=873 Ack=66415 Win=120064 Len=0 TSval=1479019470 TSecr=3244653468"
"452","1.819232413","199.232.37.140","192.168.1.118","TCP","54","443 → 34924 [RST] Seq=3759 Win=0 Len=0"
"453","1.819333713","199.232.37.140","192.168.1.118","TLSv1.2","8178","Application Data, Application Data, Application Data, Application Data, Application Data, Application Data"
"454","1.820493963","199.232.37.140","192.168.1.118","TLSv1.2","6353","Application Data, Application Data, Application Data, Application Data, Application Data"
"455","1.843171238","192.168.1.118","199.232.37.140","TCP","66","34902 → 443 [ACK] Seq=926 Ack=17978 Win=64128 Len=0 TSval=1479019504 TSecr=269078357"
"456","1.859808425","192.168.1.118","199.232.37.140","TCP","66","34912 → 443 [ACK] Seq=1141 Ack=24468 Win=49792 Len=0 TSval=1479019521 TSecr=3150242126"
"457","1.948048450","192.168.1.118","199.232.37.140","TLSv1.2","249","Application Data"
"458","1.964376800","199.232.37.140","192.168.1.118","TLSv1.2","1151","Application Data, Application Data"
"459","2.005994088","192.168.1.118","199.232.37.140","TCP","66","34892 → 443 [ACK] Seq=1017 Ack=13843 Win=64128 Len=0 TSval=1479019667 TSecr=2805137387"
"460","2.155580975","192.168.1.118","192.168.1.102","TCP","176","40160 → 8009 [PSH, ACK] Seq=1 Ack=1 Win=501 Len=110 TSval=2234405280 TSecr=2423646 [TCP segment of a reassembled PDU]"
"461","2.167611950","192.168.1.102","192.168.1.118","TCP","176","8009 → 40160 [PSH, ACK] Seq=1 Ack=111 Win=344 Len=110 TSval=2424148 TSecr=2234405280 [TCP segment of a reassembled PDU]"
"462","2.167732288","192.168.1.118","192.168.1.102","TCP","66","40160 → 8009 [ACK] Seq=111 Ack=111 Win=501 Len=0 TSval=2234405293 TSecr=2424148"
"463","2.192655438","Cisco-Li_5b:1c:ce","IntelCor_b7:52:73","ARP","42","Who has 192.168.1.118? Tell 192.168.1.1"
"464","2.192717663","IntelCor_b7:52:73","Cisco-Li_5b:1c:ce","ARP","42","192.168.1.118 is at dc:fb:48:b7:52:73"
"465","2.970523500","192.168.1.104","255.255.255.255","UDP","217","49154 → 6666 Len=175"
"466","4.099529775","192.168.1.100","224.0.0.251","MDNS","563","Standard query 0x0000 PTR _airport._tcp.local, "QM" question PTR _googlecast._tcp.local, "QM" question PTR _homekit._tcp.local, "QM" question PTR _raop._tcp.local, "QM" question PTR _airplay._tcp.local, "QM" question PTR _rdlink._tcp.local, "QM" question PTR _uscans._tcp.local, "QM" question PTR _uscan._tcp.local, "QM" question PTR _ippusb._tcp.local, "QM" question PTR _ipp._tcp.local, "QM" question PTR _scanner._tcp.local, "QM" question PTR _ipps._tcp.local, "QM" question PTR _printer._tcp.local, "QM" question PTR _pdl-datastream._tcp.local, "QM" question PTR _ptp._tcp.local, "QM" question PTR _afpovertcp._tcp.local, "QM" question PTR _smb._tcp.local, "QM" question PTR _rfb._tcp.local, "QM" question PTR _adisk._tcp.local, "QM" question PTR _companion-link._tcp.local, "QM" question PTR _apple-mobdev._tcp.local, "QM" question PTR 8ed307c3._sub._apple-mobdev2._tcp.local, "QM" question PTR _apple-pairable._tcp.local, "QM" question TXT Google-Home-Mini-2c3f16b2da5c4b6fd6cfbfba61c12490._googlecast._tcp.local, "QM" question PTR Google-Home-Mini-2c3f16b2da5c4b6fd6cfbfba61c12490._googlecast._tcp.local PTR cjqg._smb._tcp.local PTR cjqg._companion-link._tcp.local OPT"
"467","4.200875438","192.168.1.102","224.0.0.251","MDNS","183","Standard query response 0x0000 SRV, cache flush 0 0 8009 2c3f16b2-da5c-4b6f-d6cf-bfba61c12490.local"
"468","4.201908613","Cisco-Li_5b:1c:ce","Broadcast","ARP","42","Who has 192.168.1.100? Tell 192.168.1.1"
"469","4.404180863","192.168.1.118","172.253.63.188","TCP","66","36486 → 5228 [ACK] Seq=1 Ack=1 Win=501 Len=0 TSval=2117873370 TSecr=4174719314"
"470","4.429260288","172.253.63.188","192.168.1.118","TCP","66","[TCP ACKed unseen segment] 5228 → 36486 [ACK] Seq=1 Ack=2 Win=253 Len=0 TSval=4174764366 TSecr=2117017353"
"471","5.752298825","192.168.1.118","172.217.10.227","UDP","75","36597 → 443 Len=33"
"472","5.797549913","172.217.10.227","192.168.1.118","UDP","67","443 → 36597 Len=25"
"473","5.940150588","192.168.1.104","255.255.255.255","UDP","217","49154 → 6666 Len=175"
"474","7.172675388","192.168.1.118","192.168.1.102","TCP","176","40160 → 8009 [PSH, ACK] Seq=111 Ack=111 Win=501 Len=110 TSval=2234410298 TSecr=2424148 [TCP segment of a reassembled PDU]"
"475","7.178057925","192.168.1.102","192.168.1.118","TCP","176","8009 → 40160 [PSH, ACK] Seq=111 Ack=221 Win=344 Len=110 TSval=2424649 TSecr=2234410298 [TCP segment of a reassembled PDU]"
"476","7.178224213","192.168.1.118","192.168.1.102","TCP","66","40160 → 8009 [ACK] Seq=221 Ack=221 Win=501 Len=0 TSval=2234410303 TSecr=2424649"
"477","8.909312800","192.168.1.104","255.255.255.255","UDP","217","49154 → 6666 Len=175"
