frame.number,_ws.col.Time,_ws.col.Source,_ws.col.Destination,_ws.col.Protocol,frame.len,_ws.col.Info
"1","0.000000000","162.125.248.1","192.168.1.118","TCP","74","443 → 38144 [SYN, ACK] Seq=0 Ack=1 Win=28560 Len=0 MSS=1440 SACK_PERM=1 TSval=3430418253 TSecr=4077989152 WS=512"
"2","0.000088000","192.168.1.118","162.125.248.1","TCP","66","38144 → 443 [ACK] Seq=1 Ack=1 Win=502 Len=0 TSval=4077989175 TSecr=3430418253"
"3","0.002596113","192.168.1.118","104.16.100.29","TLSv1","571","Client Hello"
"4","0.019035250","192.168.1.118","162.125.248.1","TLSv1","583","Client Hello"
"5","0.026060088","104.16.100.29","192.168.1.118","TCP","54","443 → 39358 [ACK] Seq=1 Ack=518 Win=66 Len=0"
"6","0.031044425","104.16.100.29","192.168.1.118","TLSv1.2","1514","Server Hello"
"7","0.031138313","192.168.1.118","104.16.100.29","TCP","54","39358 → 443 [ACK] Seq=518 Ack=1461 Win=493 Len=0"
"8","0.056442975","104.16.100.29","192.168.1.118","TLSv1.2","2060","Certificate, Server Key Exchange, Server Hello Done"
"9","0.056532438","192.168.1.118","104.16.100.29","TCP","54","39358 → 443 [ACK] Seq=518 Ack=3467 Win=478 Len=0"
"10","0.056602688","162.125.248.1","192.168.1.118","TCP","66","443 → 38144 [ACK] Seq=1 Ack=518 Win=29696 Len=0 TSval=3430418295 TSecr=4077989194"
"11","0.056691775","162.125.248.1","192.168.1.118","TLSv1.2","3727","Server Hello, Certificate, Server Key Exchange, Server Hello Done"
"12","0.056739900","192.168.1.118","162.125.248.1","TCP","66","38144 → 443 [ACK] Seq=518 Ack=3662 Win=474 Len=0 TSval=4077989232 TSecr=3430418302"
"13","0.057175400","IntelCor_b7:52:73","Cisco-Li_5b:1c:ce","ARP","60","Who has 192.168.1.1? Tell 192.168.1.118"
"14","0.058846425","192.168.1.118","104.16.100.29","TLSv1.2","180","Client Key Exchange, Change Cipher Spec, Encrypted Handshake Message"
"15","0.060785588","192.168.1.118","162.125.248.1","TLSv1.2","192","Client Key Exchange, Change Cipher Spec, Encrypted Handshake Message"
"16","0.062570038","Cisco-Li_5b:1c:ce","IntelCor_b7:52:73","ARP","42","192.168.1.1 is at 58:6d:8f:5b:1c:ce"
"17","0.076764838","162.125.4.1","192.168.1.118","TLSv1.2","166","Application Data"
"18","0.076866100","192.168.1.118","162.125.4.1","TCP","66","43472 → 443 [ACK] Seq=1 Ack=101 Win=501 Len=0 TSval=1394853878 TSecr=4292779707"
"19","0.079442588","192.168.1.118","104.16.100.29","TCP","74","39362 → 443 [SYN] Seq=0 Win=64240 Len=0 MSS=1460 SACK_PERM=1 TSval=1461917882 TSecr=0 WS=128"
"20","0.079585350","192.168.1.118","104.16.100.29","TCP","74","39364 → 443 [SYN] Seq=0 Win=64240 Len=0 MSS=1460 SACK_PERM=1 TSval=1461917882 TSecr=0 WS=128"
"21","0.087959100","162.125.4.1","192.168.1.118","TLSv1.2","271","Application Data"
"22","0.088072313","192.168.1.118","162.125.4.1","TCP","66","43472 → 443 [ACK] Seq=1 Ack=306 Win=500 Len=0 TSval=1394853889 TSecr=4292779708"
"23","0.088167238","162.125.4.1","192.168.1.118","TLSv1.2","223","Application Data"
"24","0.088230763","192.168.1.118","162.125.4.1","TCP","66","43472 → 443 [ACK] Seq=1 Ack=463 Win=499 Len=0 TSval=1394853890 TSecr=4292779708"
"25","0.088329675","162.125.4.1","192.168.1.118","TLSv1.2","115","Application Data"
"26","0.088391000","192.168.1.118","162.125.4.1","TCP","66","43472 → 443 [ACK] Seq=1 Ack=512 Win=499 Len=0 TSval=1394853890 TSecr=4292779708"
"27","0.088475250","162.125.4.1","192.168.1.118","TLSv1.2","1556","Application Data"
"28","0.088545650","192.168.1.118","162.125.4.1","TCP","66","43472 → 443 [ACK] Seq=1 Ack=2002 Win=488 Len=0 TSval=1394853890 TSecr=4292779708"
"29","0.089097050","104.16.100.29","192.168.1.118","TCP","54","443 → 39358 [ACK] Seq=3467 Ack=644 Win=66 Len=0"
"30","0.089175225","104.16.100.29","192.168.1.118","TLSv1.2","105","Change Cipher Spec, Encrypted Handshake Message"
"31","0.089258275","162.125.248.1","192.168.1.118","TLSv1.2","117","Change Cipher Spec, Encrypted Handshake Message"
"32","0.089550150","192.168.1.118","104.16.100.29","TLSv1.2","234","Application Data"
"33","0.089808425","192.168.1.118","162.125.248.1","TLSv1.2","244","Application Data"
"34","0.096797425","192.168.1.118","104.16.100.29","TCP","74","39366 → 443 [SYN] Seq=0 Win=64240 Len=0 MSS=1460 SACK_PERM=1 TSval=1461917899 TSecr=0 WS=128"
"35","0.096943100","192.168.1.118","104.16.100.29","TCP","74","39368 → 443 [SYN] Seq=0 Win=64240 Len=0 MSS=1460 SACK_PERM=1 TSval=1461917899 TSecr=0 WS=128"
"36","0.114370838","104.16.100.29","192.168.1.118","TCP","66","443 → 39364 [SYN, ACK] Seq=0 Ack=1 Win=65535 Len=0 MSS=1400 SACK_PERM=1 WS=1024"
"37","0.114554163","192.168.1.118","104.16.100.29","TCP","54","39364 → 443 [ACK] Seq=1 Ack=1 Win=64256 Len=0"
"38","0.116186313","104.16.100.29","192.168.1.118","TCP","66","443 → 39362 [SYN, ACK] Seq=0 Ack=1 Win=65535 Len=0 MSS=1400 SACK_PERM=1 WS=1024"
"39","0.116404088","192.168.1.118","104.16.100.29","TCP","54","39362 → 443 [ACK] Seq=1 Ack=1 Win=64256 Len=0"
"40","0.117988775","162.125.4.1","192.168.1.118","TLSv1.2","1095","Application Data"
"41","0.118111288","192.168.1.118","162.125.4.1","TCP","66","43472 → 443 [ACK] Seq=1 Ack=3031 Win=493 Len=0 TSval=1394853919 TSecr=4292779757"
"42","0.123572550","162.125.4.1","192.168.1.118","TLSv1.2","603","Application Data"
"43","0.123674825","192.168.1.118","162.125.4.1","TCP","66","43472 → 443 [ACK] Seq=1 Ack=3568 Win=489 Len=0 TSval=1394853925 TSecr=4292779757"
"44","0.123758263","162.125.4.1","192.168.1.118","TLSv1.2","109","Application Data"
"45","0.123812800","192.168.1.118","162.125.4.1","TCP","66","43472 → 443 [ACK] Seq=1 Ack=3611 Win=489 Len=0 TSval=1394853925 TSecr=4292779757"
"46","0.123872113","162.125.4.1","192.168.1.118","TLSv1.2","1310","Application Data"
"47","0.123924988","192.168.1.118","162.125.4.1","TCP","66","43472 → 443 [ACK] Seq=1 Ack=4855 Win=480 Len=0 TSval=1394853925 TSecr=4292779758"
"48","0.125152800","162.125.4.1","192.168.1.118","TLSv1.2","1598","Application Data"
"49","0.125293288","192.168.1.118","162.125.4.1","TCP","66","43472 → 443 [ACK] Seq=1 Ack=6387 Win=469 Len=0 TSval=1394853927 TSecr=4292779758"
"50","0.125398763","162.125.4.1","192.168.1.118","TLSv1.2","2195","Application Data, Application Data, Application Data"
"51","0.125462325","192.168.1.118","162.125.4.1","TCP","66","43472 → 443 [ACK] Seq=1 Ack=8516 Win=453 Len=0 TSval=1394853927 TSecr=4292779759"
"52","0.125912125","104.16.100.29","192.168.1.118","TCP","54","443 → 39358 [ACK] Seq=3518 Ack=824 Win=67 Len=0"
"53","0.125983650","104.16.100.29","192.168.1.118","TCP","66","443 → 39366 [SYN, ACK] Seq=0 Ack=1 Win=65535 Len=0 MSS=1400 SACK_PERM=1 WS=1024"
"54","0.126085688","192.168.1.118","104.16.100.29","TCP","54","39366 → 443 [ACK] Seq=1 Ack=1 Win=64256 Len=0"
"55","0.131038725","192.168.1.118","104.16.100.29","TLSv1","571","Client Hello"
"56","0.133089950","162.125.4.1","192.168.1.118","TLSv1.2","1895","Application Data, Application Data, Application Data"
"57","0.133200613","192.168.1.118","162.125.4.1","TCP","66","43472 → 443 [ACK] Seq=1 Ack=10345 Win=439 Len=0 TSval=1394853935 TSecr=4292779762"
"58","0.134164825","162.125.248.1","192.168.1.118","TLSv1.2","412","Application Data"
"59","0.134318175","104.16.100.29","192.168.1.118","TLSv1.2","1426","Application Data"
"60","0.134376125","104.16.100.29","192.168.1.118","TLSv1.2","88","Application Data"
"61","0.136920263","104.16.100.29","192.168.1.118","TCP","66","443 → 39368 [SYN, ACK] Seq=0 Ack=1 Win=65535 Len=0 MSS=1400 SACK_PERM=1 WS=1024"
"62","0.137070175","192.168.1.118","104.16.100.29","TCP","54","39368 → 443 [ACK] Seq=1 Ack=1 Win=64256 Len=0"
"63","0.145363225","162.125.4.1","192.168.1.118","TCP","1514","[TCP segment of a reassembled PDU]"
"64","0.145487388","192.168.1.118","162.125.4.1","TCP","66","43472 → 443 [ACK] Seq=1 Ack=11793 Win=428 Len=0 TSval=1394853947 TSecr=4292779781"
"65","0.147328038","192.168.1.118","104.16.100.29","TLSv1","571","Client Hello"
"66","0.148732225","162.125.4.1","192.168.1.118","TLSv1.2","501","Application Data"
"67","0.148869025","192.168.1.118","162.125.4.1","TCP","66","43472 → 443 [ACK] Seq=1 Ack=12228 Win=425 Len=0 TSval=1394853950 TSecr=4292779781"
"68","0.148997713","162.125.4.1","192.168.1.118","TLSv1.2","1673","Application Data"
"69","0.149080463","162.125.4.1","192.168.1.118","TLSv1.2","108","Application Data"
"70","0.149177613","162.125.4.1","192.168.1.118","TLSv1.2","1727","Application Data"
"71","0.149305625","162.125.4.1","192.168.1.118","TLSv1.2","1618","Application Data, Application Data"
"72","0.149406350","162.125.4.1","192.168.1.118","TLSv1.2","1575","Application Data"
"73","0.151979575","162.125.4.1","192.168.1.118","TLSv1.2","1594","Application Data"
"74","0.152094850","162.125.4.1","192.168.1.118","TLSv1.2","108","Application Data"
"75","0.152186300","162.125.4.1","192.168.1.118","TLSv1.2","1643","Application Data"
"76","0.152326213","162.125.4.1","192.168.1.118","TLSv1.2","1610","Application Data"
"77","0.152393950","162.125.4.1","192.168.1.118","TLSv1.2","119","Application Data"
"78","0.152489588","162.125.4.1","192.168.1.118","TCP","1514","[TCP segment of a reassembled PDU]"
"79","0.158939188","104.16.100.29","192.168.1.118","TCP","54","443 → 39364 [ACK] Seq=1 Ack=518 Win=67584 Len=0"
"80","0.161983288","162.125.4.1","192.168.1.118","TLSv1.2","5858","Application Data, Application Data, Application Data, Application Data, Application Data, Application Data"
"81","0.163656825","104.16.100.29","192.168.1.118","TLSv1.2","1514","Server Hello"
"82","0.163757275","192.168.1.118","104.16.100.29","TCP","54","39364 → 443 [ACK] Seq=518 Ack=1461 Win=63104 Len=0"
"83","0.163905063","192.168.1.118","104.16.100.29","TLSv1","571","Client Hello"
"84","0.164018725","192.168.1.118","162.125.4.1","TCP","66","43472 → 443 [ACK] Seq=1 Ack=30583 Win=494 Len=0 TSval=1394853965 TSecr=4292779782"
"85","0.164143413","104.16.100.29","192.168.1.118","TLSv1.2","2060","Certificate, Server Key Exchange, Server Hello Done"
"86","0.164207900","192.168.1.118","104.16.100.29","TCP","54","39364 → 443 [ACK] Seq=518 Ack=3467 Win=61184 Len=0"
"87","0.175528175","192.168.1.118","104.16.100.29","TCP","54","39358 → 443 [ACK] Seq=824 Ack=4924 Win=501 Len=0"
"88","0.175642263","192.168.1.118","162.125.248.1","TCP","66","38144 → 443 [ACK] Seq=822 Ack=4059 Win=501 Len=0 TSval=4077989351 TSecr=3430418383"
"89","0.181125588","192.168.1.118","104.16.100.29","TLSv1","571","Client Hello"
"90","0.183143800","192.168.1.118","104.16.100.29","TLSv1.2","180","Client Key Exchange, Change Cipher Spec, Encrypted Handshake Message"
"91","0.186879000","104.16.100.29","192.168.1.118","TLSv1.2","88","[TCP Spurious Retransmission] , Application Data"
"92","0.187008700","192.168.1.118","104.16.100.29","TCP","66","[TCP Dup ACK 87#1] 39358 → 443 [ACK] Seq=824 Ack=4924 Win=501 Len=0 SLE=4890 SRE=4924"
"93","0.189717663","104.16.100.29","192.168.1.118","TCP","54","443 → 39366 [ACK] Seq=1 Ack=518 Win=67584 Len=0"
"94","0.190023900","162.125.4.1","192.168.1.118","TLSv1.2","11650","Application Data, Application Data, Application Data, Application Data, Application Data, Application Data, Application Data, Application Data, Application Data, Application Data, Application Data, Application Data, Application Data"
"95","0.190368638","192.168.1.118","162.125.4.1","TCP","66","43472 → 443 [ACK] Seq=1 Ack=42167 Win=404 Len=0 TSval=1394853992 TSecr=4292779824"
"96","0.190846863","192.168.1.118","104.16.100.29","TLSv1.2","281","Application Data"
"97","0.191587013","162.125.4.1","192.168.1.118","TLSv1.2","2962","Application Data, Application Data, Application Data"
"98","0.191714913","192.168.1.118","162.125.4.1","TCP","66","43472 → 443 [ACK] Seq=1 Ack=45063 Win=409 Len=0 TSval=1394853993 TSecr=4292779825"
"99","0.191885963","104.16.100.29","192.168.1.118","TLSv1.2","3520","Server Hello, Certificate, Server Key Exchange, Server Hello Done"
"100","0.191972125","192.168.1.118","104.16.100.29","TCP","54","39366 → 443 [ACK] Seq=518 Ack=3467 Win=60800 Len=0"
"101","0.192055638","162.125.4.1","192.168.1.118","TLSv1.2","2962","Application Data, Application Data, Application Data, Application Data, Application Data, Application Data"
"102","0.192121450","162.125.4.1","192.168.1.118","TLSv1.2","1514","Application Data [TCP segment of a reassembled PDU]"
"103","0.193971000","162.125.4.1","192.168.1.118","TLSv1.2","1514","Application Data, Application Data, Application Data, Application Data, Application Data"
"104","0.194070863","162.125.4.1","192.168.1.118","TLSv1.2","2962","Application Data, Application Data, Application Data, Application Data, Application Data, Application Data"
"105","0.194111388","162.125.4.1","192.168.1.118","TLSv1.2","1514","Application Data, Application Data, Application Data, Application Data, Application Data, Application Data"
"106","0.194438200","192.168.1.118","162.125.4.1","TCP","66","43472 → 443 [ACK] Seq=1 Ack=55199 Win=330 Len=0 TSval=1394853996 TSecr=4292779826"
"107","0.195523588","162.125.4.1","192.168.1.118","TLSv1.2","1514","Application Data [TCP segment of a reassembled PDU]"
"108","0.195629063","162.125.4.1","192.168.1.118","TLSv1.2","2962","Application Data, Application Data"
"109","0.195660075","162.125.4.1","192.168.1.118","TLSv1.2","564","Application Data, Application Data, Application Data, Application Data, Application Data"
"110","0.196534838","192.168.1.118","104.16.100.29","TLSv1.2","180","Client Key Exchange, Change Cipher Spec, Encrypted Handshake Message"
"111","0.196637688","192.168.1.118","162.125.4.1","TCP","66","43472 → 443 [ACK] Seq=1 Ack=60041 Win=293 Len=0 TSval=1394853998 TSecr=4292779829"
"112","0.197341513","104.16.100.29","192.168.1.118","TCP","54","443 → 39368 [ACK] Seq=1 Ack=518 Win=67584 Len=0"
"113","0.210980675","104.16.100.29","192.168.1.118","TLSv1.2","1514","Server Hello"
"114","0.211100713","192.168.1.118","104.16.100.29","TCP","54","39368 → 443 [ACK] Seq=518 Ack=1461 Win=63104 Len=0"
"115","0.212706588","104.16.100.29","192.168.1.118","TLSv1.2","2060","Certificate, Server Key Exchange, Server Hello Done"
"116","0.212776838","192.168.1.118","104.16.100.29","TCP","54","39368 → 443 [ACK] Seq=518 Ack=3467 Win=61184 Len=0"
"117","0.212847175","104.16.100.29","192.168.1.118","TCP","54","443 → 39364 [ACK] Seq=3467 Ack=644 Win=67584 Len=0"
"118","0.212917500","104.16.100.29","192.168.1.118","TLSv1.2","105","Change Cipher Spec, Encrypted Handshake Message"
"119","0.212977788","104.16.100.29","192.168.1.118","TCP","54","443 → 39362 [ACK] Seq=1 Ack=518 Win=67584 Len=0"
"120","0.213043625","104.16.100.29","192.168.1.118","TCP","54","443 → 39366 [ACK] Seq=3467 Ack=644 Win=67584 Len=0"
"121","0.213146713","104.16.100.29","192.168.1.118","TLSv1.2","3520","Server Hello, Certificate, Server Key Exchange, Server Hello Done"
"122","0.213212275","192.168.1.118","104.16.100.29","TCP","54","39362 → 443 [ACK] Seq=518 Ack=3467 Win=60800 Len=0"
"123","0.213303288","104.16.100.29","192.168.1.118","TLSv1.2","105","Change Cipher Spec, Encrypted Handshake Message"
"124","0.213997038","104.16.100.29","192.168.1.118","TLSv1.2","1392","Application Data"
"125","0.214080938","192.168.1.118","104.16.100.29","TCP","54","39358 → 443 [ACK] Seq=1051 Ack=6262 Win=493 Len=0"
"126","0.214143963","104.16.100.29","192.168.1.118","TLSv1.2","88","Application Data"
"127","0.214204088","192.168.1.118","104.16.100.29","TCP","54","39358 → 443 [ACK] Seq=1051 Ack=6296 Win=493 Len=0"
"128","0.214848913","192.168.1.118","104.16.100.29","TLSv1.2","180","Client Key Exchange, Change Cipher Spec, Encrypted Handshake Message"
"129","0.217366588","192.168.1.118","104.16.100.29","TLSv1.2","180","Client Key Exchange, Change Cipher Spec, Encrypted Handshake Message"
"130","0.217649538","192.168.1.118","104.16.100.29","TLSv1.2","294","Application Data"
"131","0.217847513","192.168.1.118","104.16.100.29","TLSv1.2","277","Application Data"
"132","0.221938600","192.168.1.118","104.16.100.29","TLSv1.2","276","Application Data"
"133","0.240033863","104.16.100.29","192.168.1.118","TCP","54","443 → 39364 [ACK] Seq=3518 Ack=884 Win=68608 Len=0"
"134","0.242130988","104.16.100.29","192.168.1.118","TCP","54","443 → 39366 [ACK] Seq=3518 Ack=867 Win=68608 Len=0"
"135","0.242201838","104.16.100.29","192.168.1.118","TCP","54","443 → 39368 [ACK] Seq=3467 Ack=644 Win=67584 Len=0"
"136","0.242234350","104.16.100.29","192.168.1.118","TCP","54","443 → 39362 [ACK] Seq=3467 Ack=644 Win=67584 Len=0"
"137","0.242285388","104.16.100.29","192.168.1.118","TLSv1.2","105","Change Cipher Spec, Encrypted Handshake Message"
"138","0.242315150","104.16.100.29","192.168.1.118","TLSv1.2","105","Change Cipher Spec, Encrypted Handshake Message"
"139","0.243078825","192.168.1.118","104.16.100.29","TLSv1.2","278","Application Data"
"140","0.243379650","192.168.1.118","104.16.100.29","TLSv1.2","277","Application Data"
"141","0.248425250","104.16.100.29","192.168.1.118","TLSv1.2","1452","Application Data"
"142","0.249683813","104.16.100.29","192.168.1.118","TLSv1.2","673","Application Data"
"143","0.249755088","104.16.100.29","192.168.1.118","TLSv1.2","88","Application Data"
"144","0.249793050","104.16.100.29","192.168.1.118","TLSv1.2","1452","Application Data"
"145","0.249837563","104.16.100.29","192.168.1.118","TLSv1.2","1452","Application Data"
"146","0.249891913","104.16.100.29","192.168.1.118","TLSv1.2","1657","Application Data, Application Data"
"147","0.249929863","104.16.100.29","192.168.1.118","TLSv1.2","88","Application Data"
"148","0.250120275","192.168.1.118","104.16.100.29","TCP","54","39364 → 443 [ACK] Seq=884 Ack=7951 Win=59776 Len=0"
"149","0.250433788","192.168.1.118","104.16.100.29","TCP","54","39358 → 443 [ACK] Seq=1273 Ack=8347 Win=490 Len=0"
"150","0.250924550","104.16.100.29","192.168.1.118","TLSv1.2","1452","Application Data"
"151","0.255745713","192.168.1.118","104.16.100.29","TLSv1.2","280","Application Data"
"152","0.264460113","192.168.1.118","104.16.100.29","TLSv1.2","305","Application Data"
"153","0.274690975","104.16.100.29","192.168.1.118","TLSv1.2","1452","Application Data"
"154","0.274806063","104.16.100.29","192.168.1.118","TLSv1.2","1452","Application Data"
"155","0.274884088","104.16.100.29","192.168.1.118","TLSv1.2","1452","Application Data"
"156","0.274945888","104.16.100.29","192.168.1.118","TLSv1.2","1452","Application Data"
"157","0.274950625","192.168.1.118","104.16.100.29","TCP","54","39366 → 443 [ACK] Seq=867 Ack=7712 Win=61056 Len=0"
"158","0.275008263","104.16.100.29","192.168.1.118","TLSv1.2","1452","Application Data"
"159","0.275067800","104.16.100.29","192.168.1.118","TLSv1.2","1452","Application Data"
"160","0.275155513","104.16.100.29","192.168.1.118","TLSv1.2","1452","Application Data"
"161","0.275164488","192.168.1.118","104.16.100.29","TCP","54","39366 → 443 [ACK] Seq=867 Ack=13304 Win=55552 Len=0"
"162","0.275305400","104.16.100.29","192.168.1.118","TLSv1.2","1888","Application Data, Application Data"
"163","0.275382388","104.16.100.29","192.168.1.118","TLSv1.2","88","Application Data"
"164","0.275445163","104.16.100.29","192.168.1.118","TCP","54","443 → 39362 [ACK] Seq=3518 Ack=868 Win=68608 Len=0"
"165","0.275530225","104.16.100.29","192.168.1.118","TCP","54","443 → 39368 [ACK] Seq=3518 Ack=867 Win=68608 Len=0"
"166","0.275612875","104.16.100.29","192.168.1.118","TLSv1.2","1260","Application Data"
"167","0.275683263","104.16.100.29","192.168.1.118","TLSv1.2","88","Application Data"
"168","0.275983413","192.168.1.118","104.16.100.29","TCP","54","39366 → 443 [ACK] Seq=867 Ack=16570 Win=52352 Len=0"
"169","0.277028663","192.168.1.118","104.16.100.29","TCP","54","39362 → 443 [ACK] Seq=868 Ack=4758 Win=64128 Len=0"
"170","0.290515638","192.168.1.118","104.16.100.29","TLSv1.2","282","Application Data"
"171","0.300678700","104.16.100.29","192.168.1.118","TLSv1.2","1452","Application Data"
"172","0.300791913","104.16.100.29","192.168.1.118","TLSv1.2","1452","Application Data"
"173","0.300860650","104.16.100.29","192.168.1.118","TLSv1.2","1452","Application Data"
"174","0.300973963","104.16.100.29","192.168.1.118","TLSv1.2","2850","Application Data, Application Data"
"175","0.301064388","104.16.100.29","192.168.1.118","TLSv1.2","2850","Application Data, Application Data"
"176","0.301126888","104.16.100.29","192.168.1.118","TLSv1.2","622","Application Data"
"177","0.301187038","104.16.100.29","192.168.1.118","TLSv1.2","88","Application Data"
"178","0.301364250","104.16.100.29","192.168.1.118","TLSv1.2","88","[TCP Spurious Retransmission] , Application Data"
"179","0.301470388","192.168.1.118","104.16.100.29","TCP","66","[TCP Dup ACK 168#1] 39366 → 443 [ACK] Seq=867 Ack=16570 Win=52352 Len=0 SLE=16536 SRE=16570"
"180","0.310345700","192.168.1.118","104.16.100.29","TCP","54","39368 → 443 [ACK] Seq=867 Ack=13906 Win=53760 Len=0"
"181","0.312217550","192.168.1.118","104.16.100.29","TLSv1.2","282","Application Data"
"182","0.317644225","104.16.100.29","192.168.1.118","TLSv1.2","1452","Application Data"
"183","0.320982838","104.16.100.29","192.168.1.118","TLSv1.2","1452","Application Data"
"184","0.321041938","104.16.100.29","192.168.1.118","TLSv1.2","1452","Application Data"
"185","0.321071100","104.16.100.29","192.168.1.118","TLSv1.2","1433","Application Data"
"186","0.321096763","104.16.100.29","192.168.1.118","TLSv1.2","88","Application Data"
"187","0.321118063","104.16.100.29","192.168.1.118","TLSv1.2","1452","Application Data"
"188","0.321171625","104.16.100.29","192.168.1.118","TLSv1.2","1452","Application Data"
"189","0.321192438","104.16.100.29","192.168.1.118","TLSv1.2","1452","Application Data"
"190","0.321213438","104.16.100.29","192.168.1.118","TLSv1.2","368","Application Data"
"191","0.321231763","104.16.100.29","192.168.1.118","TLSv1.2","88","Application Data"
"192","0.321271463","104.16.100.29","192.168.1.118","TLSv1.2","1452","Application Data"
"193","0.321307150","104.16.100.29","192.168.1.118","TLSv1.2","2039","Application Data, Application Data"
"194","0.321331663","104.16.100.29","192.168.1.118","TLSv1.2","1452","Application Data"
"195","0.321371075","104.16.100.29","192.168.1.118","TLSv1.2","2850","Application Data, Application Data"
"196","0.321397175","104.16.100.29","192.168.1.118","TLSv1.2","1514","Application Data"
"197","0.322114275","104.16.100.29","192.168.1.118","TLSv1.2","1390","Application Data"
"198","0.322182550","104.16.100.29","192.168.1.118","TLSv1.2","3518","Application Data, Application Data, Application Data"
"199","0.322207488","104.16.100.29","192.168.1.118","TLSv1.2","88","Application Data"
"200","0.325828250","192.168.1.118","104.16.100.29","TCP","54","39358 → 443 [ACK] Seq=1499 Ack=12889 Win=466 Len=0"
"201","0.326063913","192.168.1.118","104.16.100.29","TCP","54","39364 → 443 [ACK] Seq=1135 Ack=13558 Win=58624 Len=0"
"202","0.326286175","192.168.1.118","104.16.100.29","TCP","54","39362 → 443 [ACK] Seq=1096 Ack=18629 Win=50304 Len=0"
"203","0.345299725","192.168.1.118","104.16.100.29","TLSv1.2","293","Application Data"
"204","0.347034525","192.168.1.118","104.16.100.29","TLSv1.2","289","Application Data"
"205","0.347162638","192.168.1.118","104.16.100.29","TLSv1.2","293","Application Data"
"206","0.349824213","104.16.100.29","192.168.1.118","TLSv1.2","1135","Application Data"
"207","0.355658213","104.16.100.29","192.168.1.118","TLSv1.2","88","Application Data"
"208","0.356587600","192.168.1.118","104.16.100.29","TCP","54","39366 → 443 [ACK] Seq=1095 Ack=17685 Win=64128 Len=0"
"209","0.361838525","192.168.1.118","104.16.100.29","TLSv1.2","284","Application Data"
"210","0.362005075","192.168.1.118","104.16.100.29","TLSv1.2","293","Application Data"
"211","0.408003100","104.16.100.29","192.168.1.118","TLSv1.2","1319","Application Data"
"212","0.409526525","104.16.100.29","192.168.1.118","TLSv1.2","88","Application Data"
"213","0.409588325","104.16.100.29","192.168.1.118","TLSv1.2","1253","Application Data"
"214","0.409631075","104.16.100.29","192.168.1.118","TLSv1.2","88","Application Data"
"215","0.409658588","104.16.100.29","192.168.1.118","TLSv1.2","1452","Application Data"
"216","0.409692350","104.16.100.29","192.168.1.118","TLSv1.2","506","Application Data"
"217","0.409734613","104.16.100.29","192.168.1.118","TLSv1.2","88","Application Data"
"218","0.409760563","104.16.100.29","192.168.1.118","TLSv1.2","1419","Application Data"
"219","0.409791375","104.16.100.29","192.168.1.118","TLSv1.2","88","Application Data"
"220","0.410563450","192.168.1.118","104.16.100.29","TCP","54","39358 → 443 [ACK] Seq=1738 Ack=14188 Win=501 Len=0"
"221","0.410656050","192.168.1.118","104.16.100.29","TCP","54","39364 → 443 [ACK] Seq=1370 Ack=14957 Win=62848 Len=0"
"222","0.411305350","192.168.1.118","104.16.100.29","TCP","54","39362 → 443 [ACK] Seq=1326 Ack=20513 Win=62336 Len=0"
"223","0.411939763","192.168.1.118","104.16.100.29","TCP","54","39368 → 443 [ACK] Seq=1106 Ack=15139 Win=64128 Len=0"
"224","0.413898288","192.168.1.118","104.16.100.29","TLSv1.2","299","Application Data"
"225","0.414018088","192.168.1.118","104.16.100.29","TLSv1.2","296","Application Data"
"226","0.414104975","192.168.1.118","104.16.100.29","TLSv1.2","294","Application Data"
"227","0.416873088","192.168.1.118","104.16.100.29","TLSv1.2","296","Application Data"
"228","0.439770775","104.16.100.29","192.168.1.118","TCP","54","443 → 39366 [ACK] Seq=17685 Ack=1334 Win=70656 Len=0"
"229","0.440606150","104.16.100.29","192.168.1.118","TLSv1.2","1210","Application Data"
"230","0.440709813","104.16.100.29","192.168.1.118","TLSv1.2","88","Application Data"
"231","0.442110225","192.168.1.118","104.16.100.29","TCP","54","39366 → 443 [ACK] Seq=1334 Ack=18875 Win=64128 Len=0"
"232","0.443348913","192.168.1.118","104.16.100.29","TLSv1.2","282","Application Data"
"233","0.474200113","104.16.100.29","192.168.1.118","TLSv1.2","1452","Application Data"
"234","0.474278363","104.16.100.29","192.168.1.118","TLSv1.2","605","Application Data"
"235","0.474294613","104.16.100.29","192.168.1.118","TLSv1.2","88","Application Data"
"236","0.474306888","104.16.100.29","192.168.1.118","TLSv1.2","1344","Application Data"
"237","0.474324763","104.16.100.29","192.168.1.118","TLSv1.2","88","Application Data"
"238","0.477417788","192.168.1.118","104.16.100.29","TCP","54","39362 → 443 [ACK] Seq=1568 Ack=22496 Win=62208 Len=0"
"239","0.477625875","192.168.1.118","104.16.100.29","TCP","54","39358 → 443 [ACK] Seq=1983 Ack=15512 Win=501 Len=0"
"240","0.478741238","104.16.100.29","192.168.1.118","TLSv1.2","1341","Application Data"
"241","0.478810463","104.16.100.29","192.168.1.118","TLSv1.2","88","Application Data"
"242","0.482381588","192.168.1.118","104.16.100.29","TLSv1.2","315","Application Data"
"243","0.482861388","192.168.1.118","104.16.100.29","TCP","54","39364 → 443 [ACK] Seq=1610 Ack=16278 Win=64128 Len=0"
"244","0.487035075","192.168.1.118","104.16.100.29","TLSv1.2","313","Application Data"
"245","0.487163438","192.168.1.118","104.16.100.29","TLSv1.2","312","Application Data"
"246","0.494656563","104.16.100.29","192.168.1.118","TLSv1.2","88","[TCP Spurious Retransmission] , Application Data"
"247","0.494762888","192.168.1.118","104.16.100.29","TCP","66","[TCP Dup ACK 231#1] 39366 → 443 [ACK] Seq=1562 Ack=18875 Win=64128 Len=0 SLE=18841 SRE=18875"
"248","0.496329763","104.16.100.29","192.168.1.118","TLSv1.2","88","[TCP Spurious Retransmission] , Application Data"
"249","0.496428238","192.168.1.118","104.16.100.29","TCP","66","[TCP Dup ACK 239#1] 39358 → 443 [ACK] Seq=2244 Ack=15512 Win=501 Len=0 SLE=15478 SRE=15512"
"250","0.497334550","104.16.100.29","192.168.1.118","TLSv1.2","88","[TCP Spurious Retransmission] , Application Data"
"251","0.497437313","192.168.1.118","104.16.100.29","TCP","66","[TCP Dup ACK 238#1] 39362 → 443 [ACK] Seq=1827 Ack=22496 Win=64128 Len=0 SLE=22462 SRE=22496"
"252","0.501861975","104.16.100.29","192.168.1.118","TLSv1.2","88","[TCP Spurious Retransmission] , Application Data"
"253","0.501965038","192.168.1.118","104.16.100.29","TCP","66","[TCP Dup ACK 243#1] 39364 → 443 [ACK] Seq=1868 Ack=16278 Win=64128 Len=0 SLE=16244 SRE=16278"
"254","0.528889550","104.16.100.29","192.168.1.118","TCP","54","443 → 39366 [ACK] Seq=18875 Ack=1562 Win=71680 Len=0"
"255","0.533508525","104.16.100.29","192.168.1.118","TLSv1.2","1452","Application Data"
"256","0.533580225","192.168.1.118","104.16.100.29","TCP","54","39362 → 443 [ACK] Seq=1827 Ack=23894 Win=63104 Len=0"
"257","0.546230800","104.16.100.29","192.168.1.118","TLSv1.2","1452","Application Data"
"258","0.546300413","192.168.1.118","104.16.100.29","TCP","54","39362 → 443 [ACK] Seq=1827 Ack=25292 Win=61824 Len=0"
"259","0.546349363","104.16.100.29","192.168.1.118","TLSv1.2","2850","Application Data, Application Data"
"260","0.546369788","192.168.1.118","104.16.100.29","TCP","54","39362 → 443 [ACK] Seq=1827 Ack=28088 Win=59136 Len=0"
"261","0.546386600","104.16.100.29","192.168.1.118","TLSv1.2","2850","Application Data, Application Data"
"262","0.546402625","192.168.1.118","104.16.100.29","TCP","54","39362 → 443 [ACK] Seq=1827 Ack=30884 Win=56448 Len=0"
"263","0.546419938","104.16.100.29","192.168.1.118","TLSv1.2","4248","Application Data, Application Data, Application Data"
"264","0.546435788","192.168.1.118","104.16.100.29","TCP","54","39362 → 443 [ACK] Seq=1827 Ack=35078 Win=52352 Len=0"
"265","0.546458813","104.16.100.29","192.168.1.118","TLSv1.2","8442","Application Data, Application Data, Application Data, Application Data, Application Data, Application Data"
"266","0.546480975","192.168.1.118","104.16.100.29","TCP","54","39362 → 443 [ACK] Seq=1827 Ack=43466 Win=44032 Len=0"
"267","0.546495375","104.16.100.29","192.168.1.118","TLSv1.2","2427","Application Data, Application Data"
"268","0.546508763","104.16.100.29","192.168.1.118","TLSv1.2","1452","Application Data"
"269","0.546528275","104.16.100.29","192.168.1.118","TLSv1.2","595","Application Data"
"270","0.546538300","104.16.100.29","192.168.1.118","TLSv1.2","88","Application Data"
"271","0.546548288","104.16.100.29","192.168.1.118","TLSv1.2","1452","Application Data"
"272","0.546565900","192.168.1.118","104.16.100.29","TCP","54","39358 → 443 [ACK] Seq=2244 Ack=16910 Win=493 Len=0"
"273","0.546578875","104.16.100.29","192.168.1.118","TLSv1.2","1452","Application Data"
"274","0.546592738","192.168.1.118","104.16.100.29","TCP","54","39358 → 443 [ACK] Seq=2244 Ack=18308 Win=483 Len=0"
"275","0.546605250","104.16.100.29","192.168.1.118","TLSv1.2","1452","Application Data"
"276","0.546621438","192.168.1.118","104.16.100.29","TCP","54","39358 → 443 [ACK] Seq=2244 Ack=19706 Win=473 Len=0"
"277","0.546633513","104.16.100.29","192.168.1.118","TLSv1.2","1452","Application Data"
"278","0.546647613","192.168.1.118","104.16.100.29","TCP","54","39358 → 443 [ACK] Seq=2244 Ack=21104 Win=463 Len=0"
"279","0.546659913","104.16.100.29","192.168.1.118","TLSv1.2","1452","Application Data"
"280","0.546675125","192.168.1.118","104.16.100.29","TCP","54","39358 → 443 [ACK] Seq=2244 Ack=22502 Win=453 Len=0"
"281","0.546687100","104.16.100.29","192.168.1.118","TLSv1.2","1452","Application Data"
"282","0.546700738","192.168.1.118","104.16.100.29","TCP","54","39358 → 443 [ACK] Seq=2244 Ack=23900 Win=443 Len=0"
"283","0.546712938","104.16.100.29","192.168.1.118","TLSv1.2","1452","Application Data"
"284","0.546727813","192.168.1.118","104.16.100.29","TCP","54","39358 → 443 [ACK] Seq=2244 Ack=25298 Win=433 Len=0"
"285","0.546739925","104.16.100.29","192.168.1.118","TLSv1.2","1452","Application Data"
"286","0.546753463","192.168.1.118","104.16.100.29","TCP","54","39358 → 443 [ACK] Seq=2244 Ack=26696 Win=423 Len=0"
"287","0.546765913","104.16.100.29","192.168.1.118","TLSv1.2","1452","Application Data"
"288","0.546781313","192.168.1.118","104.16.100.29","TCP","54","39358 → 443 [ACK] Seq=2244 Ack=28094 Win=413 Len=0"
"289","0.546792800","104.16.100.29","192.168.1.118","TLSv1.2","1452","Application Data"
"290","0.546806850","192.168.1.118","104.16.100.29","TCP","54","39358 → 443 [ACK] Seq=2244 Ack=29492 Win=403 Len=0"
"291","0.546819575","104.16.100.29","192.168.1.118","TLSv1.2","1452","Application Data"
"292","0.546834838","192.168.1.118","104.16.100.29","TCP","54","39358 → 443 [ACK] Seq=2244 Ack=30890 Win=393 Len=0"
"293","0.546846263","104.16.100.29","192.168.1.118","TLSv1.2","1452","Application Data"
"294","0.546859738","192.168.1.118","104.16.100.29","TCP","54","39358 → 443 [ACK] Seq=2244 Ack=32288 Win=383 Len=0"
"295","0.546872100","104.16.100.29","192.168.1.118","TLSv1.2","1452","Application Data"
"296","0.546887088","192.168.1.118","104.16.100.29","TCP","54","39358 → 443 [ACK] Seq=2244 Ack=33686 Win=373 Len=0"
"297","0.546898550","104.16.100.29","192.168.1.118","TLSv1.2","1452","Application Data"
"298","0.546912450","192.168.1.118","104.16.100.29","TCP","54","39358 → 443 [ACK] Seq=2244 Ack=35084 Win=363 Len=0"
"299","0.546926975","104.16.100.29","192.168.1.118","TLSv1.2","2850","Application Data, Application Data"
"300","0.546943300","192.168.1.118","104.16.100.29","TCP","54","39358 → 443 [ACK] Seq=2244 Ack=37880 Win=342 Len=0"
"301","0.569149888","104.16.100.29","192.168.1.118","TLSv1.2","4248","Application Data, Application Data, Application Data"
"302","0.569214288","104.16.100.29","192.168.1.118","TLSv1.2","3371","Application Data, Application Data, Application Data"
"303","0.569234188","104.16.100.29","192.168.1.118","TLSv1.2","1452","Application Data"
"304","0.569298413","192.168.1.118","104.16.100.29","TCP","54","39364 → 443 [ACK] Seq=1868 Ack=17676 Win=63104 Len=0"
"305","0.569338325","104.16.100.29","192.168.1.118","TLSv1.2","1452","Application Data"
"306","0.569360075","192.168.1.118","104.16.100.29","TCP","54","39364 → 443 [ACK] Seq=1868 Ack=19074 Win=61824 Len=0"
"307","0.569381425","104.16.100.29","192.168.1.118","TLSv1.2","1452","Application Data"
"308","0.569405863","192.168.1.118","104.16.100.29","TCP","54","39364 → 443 [ACK] Seq=1868 Ack=20472 Win=60544 Len=0"
"309","0.569428188","104.16.100.29","192.168.1.118","TLSv1.2","1452","Application Data"
"310","0.569447513","192.168.1.118","104.16.100.29","TCP","54","39364 → 443 [ACK] Seq=1868 Ack=21870 Win=59264 Len=0"
"311","0.569466638","104.16.100.29","192.168.1.118","TLSv1.2","2850","Application Data, Application Data"
"312","0.569487750","192.168.1.118","104.16.100.29","TCP","54","39364 → 443 [ACK] Seq=1868 Ack=24666 Win=56576 Len=0"
"313","0.569505913","104.16.100.29","192.168.1.118","TLSv1.2","1514","[TCP Previous segment not captured] , Ignored Unknown Record"
"314","0.569524863","192.168.1.118","104.16.100.29","TCP","66","[TCP Dup ACK 312#1] 39364 → 443 [ACK] Seq=1868 Ack=24666 Win=56576 Len=0 SLE=26126 SRE=27586"
"315","0.569544200","104.16.100.29","192.168.1.118","TLSv1.2","2974","[TCP Previous segment not captured] , Ignored Unknown Record"
"316","0.569564263","192.168.1.118","104.16.100.29","TCP","74","[TCP Dup ACK 312#2] 39364 → 443 [ACK] Seq=1868 Ack=24666 Win=56576 Len=0 SLE=34576 SRE=37496 SLE=26126 SRE=27586"
"317","0.569574875","104.16.100.29","192.168.1.118","TLSv1.2","1328","[TCP Previous segment not captured] , Ignored Unknown Record"
"318","0.569593763","192.168.1.118","104.16.100.29","TCP","82","[TCP Dup ACK 312#3] 39364 → 443 [ACK] Seq=1868 Ack=24666 Win=56576 Len=0 SLE=42964 SRE=44238 SLE=34576 SRE=37496 SLE=26126 SRE=27586"
"319","0.569609000","104.16.100.29","192.168.1.118","TLSv1.2","1390","[TCP Previous segment not captured] , Ignored Unknown Record"
"320","0.569630625","192.168.1.118","104.16.100.29","TCP","66","[TCP Dup ACK 231#2] 39366 → 443 [ACK] Seq=1562 Ack=18875 Win=64128 Len=0 SLE=23131 SRE=24467"
"321","0.569648475","104.16.100.29","192.168.1.118","TLSv1.2","1452","Application Data"
"322","0.569668413","192.168.1.118","104.16.100.29","TCP","66","[TCP Dup ACK 231#3] 39366 → 443 [ACK] Seq=1562 Ack=18875 Win=64128 Len=0 SLE=23131 SRE=25865"
"323","0.569689875","104.16.100.29","192.168.1.118","TLSv1.2","5074","Application Data, Application Data, Application Data, Application Data"
"324","0.569711113","192.168.1.118","104.16.100.29","TCP","82","[TCP Dup ACK 312#4] 39364 → 443 [ACK] Seq=1868 Ack=24666 Win=56576 Len=0 SLE=42964 SRE=49258 SLE=34576 SRE=37496 SLE=26126 SRE=27586"
"325","0.569729700","104.16.100.29","192.168.1.118","TLSv1.2","2850","Application Data, Application Data"
"326","0.569749838","192.168.1.118","104.16.100.29","TCP","66","[TCP Dup ACK 231#4] 39366 → 443 [ACK] Seq=1562 Ack=18875 Win=64128 Len=0 SLE=23131 SRE=28661"
"327","0.577283950","104.16.100.29","192.168.1.118","TLSv1.2","5646","Application Data, Application Data, Application Data, Application Data"
"328","0.577376000","192.168.1.118","104.16.100.29","TCP","66","[TCP Dup ACK 231#5] 39366 → 443 [ACK] Seq=1562 Ack=18875 Win=64128 Len=0 SLE=23131 SRE=34253"
"329","0.577521763","104.16.100.29","192.168.1.118","TLSv1.2","9840","Application Data, Application Data, Application Data, Application Data, Application Data, Application Data, Application Data"
"330","0.577565913","192.168.1.118","104.16.100.29","TCP","66","[TCP Dup ACK 231#6] 39366 → 443 [ACK] Seq=1562 Ack=18875 Win=64128 Len=0 SLE=23131 SRE=44039"
"331","0.577620138","104.16.100.29","192.168.1.118","TLSv1.2","2974","Application Data, Application Data"
"332","0.577659663","192.168.1.118","104.16.100.29","TCP","66","[TCP Dup ACK 231#7] 39366 → 443 [ACK] Seq=1562 Ack=18875 Win=64128 Len=0 SLE=23131 SRE=46959"
"333","0.577782438","104.16.100.29","192.168.1.118","TLSv1.2","4434","Application Data, Application Data, Application Data"
"334","0.577823588","192.168.1.118","104.16.100.29","TCP","66","[TCP Dup ACK 231#8] 39366 → 443 [ACK] Seq=1562 Ack=18875 Win=64128 Len=0 SLE=23131 SRE=51339"
"335","0.587573275","192.168.1.118","104.16.100.29","TCP","54","39368 → 443 [ACK] Seq=1348 Ack=17112 Win=62208 Len=0"
"336","0.587666050","192.168.1.118","104.16.100.29","TCP","54","39362 → 443 [ACK] Seq=1827 Ack=45839 Win=41728 Len=0"
"337","0.587767275","104.16.100.29","192.168.1.118","TLSv1.2","1016","Application Data"
"338","0.587848175","192.168.1.118","104.16.100.29","TCP","66","[TCP Dup ACK 231#9] 39366 → 443 [ACK] Seq=1562 Ack=18875 Win=64128 Len=0 SLE=23131 SRE=52301"
"339","0.587968975","104.16.100.29","192.168.1.118","TLSv1.2","4434","Application Data, Application Data"
"340","0.588034925","192.168.1.118","104.16.100.29","TCP","66","[TCP Dup ACK 231#10] 39366 → 443 [ACK] Seq=1562 Ack=18875 Win=64128 Len=0 SLE=23131 SRE=56681"
"341","0.589120775","104.16.100.29","192.168.1.118","TLSv1.2","11734","Application Data, Application Data, Application Data"
"342","0.589294338","192.168.1.118","104.16.100.29","TCP","66","[TCP Dup ACK 231#11] 39366 → 443 [ACK] Seq=1562 Ack=18875 Win=64128 Len=0 SLE=23131 SRE=68361"
"343","0.596482613","192.168.1.118","104.16.100.29","TCP","54","39358 → 443 [ACK] Seq=2244 Ack=45391 Win=284 Len=0"
"344","0.598901538","104.16.100.29","192.168.1.118","TLSv1.2","3822","Application Data"
"345","0.598985200","104.16.100.29","192.168.1.118","TCP","2974","[TCP segment of a reassembled PDU]"
"346","0.599048525","192.168.1.118","104.16.100.29","TCP","66","[TCP Dup ACK 231#12] 39366 → 443 [ACK] Seq=1562 Ack=18875 Win=64128 Len=0 SLE=23131 SRE=75049"
"347","0.606982138","104.16.100.29","192.168.1.118","TLSv1.2","8008","[TCP Window Full] , Application Data, Application Data"
"348","0.607039963","104.16.100.29","192.168.1.118","TLSv1.2","1452","[TCP Fast Retransmission] , Application Data"
"349","0.607075200","192.168.1.118","104.16.100.29","TCP","66","39366 → 443 [ACK] Seq=1562 Ack=20273 Win=62848 Len=0 SLE=23131 SRE=83003"
"350","0.607111000","104.16.100.29","192.168.1.118","TCP","1452","[TCP Out-Of-Order] 443 → 39366 [PSH, ACK] Seq=20273 Ack=1562 Win=71680 Len=1398"
"351","0.607131838","192.168.1.118","104.16.100.29","TCP","66","39366 → 443 [ACK] Seq=1562 Ack=21671 Win=61568 Len=0 SLE=23131 SRE=83003"
"352","0.607148975","104.16.100.29","192.168.1.118","TCP","1514","[TCP Retransmission] 443 → 39364 [ACK] Seq=24666 Ack=1868 Win=72704 Len=1460"
"353","0.607170850","192.168.1.118","104.16.100.29","TCP","74","39364 → 443 [ACK] Seq=1868 Ack=27586 Win=53760 Len=0 SLE=42964 SRE=49258 SLE=34576 SRE=37496"
"354","0.607181075","104.16.100.29","192.168.1.118","TCP","1328","[TCP Retransmission] 443 → 39364 [PSH, ACK] Seq=27586 Ack=1868 Win=72704 Len=1274"
"355","0.607199988","192.168.1.118","104.16.100.29","TCP","74","39364 → 443 [ACK] Seq=1868 Ack=28860 Win=52608 Len=0 SLE=42964 SRE=49258 SLE=34576 SRE=37496"
"356","0.607217188","104.16.100.29","192.168.1.118","TCP","2850","[TCP Retransmission] 443 → 39364 [PSH, ACK] Seq=28860 Ack=1868 Win=72704 Len=2796"
"357","0.607251725","192.168.1.118","104.16.100.29","TCP","74","39364 → 443 [ACK] Seq=1868 Ack=31656 Win=49920 Len=0 SLE=42964 SRE=49258 SLE=34576 SRE=37496"
"358","0.607269338","104.16.100.29","192.168.1.118","TCP","2974","[TCP Retransmission] 443 → 39364 [PSH, ACK] Seq=31656 Ack=1868 Win=72704 Len=2920"
"359","0.607290038","192.168.1.118","104.16.100.29","TCP","66","39364 → 443 [ACK] Seq=1868 Ack=37496 Win=44160 Len=0 SLE=42964 SRE=49258"
"360","0.607317738","104.16.100.29","192.168.1.118","TCP","1514","[TCP Retransmission] 443 → 39364 [ACK] Seq=37496 Ack=1868 Win=72704 Len=1460"
"361","0.607336863","192.168.1.118","104.16.100.29","TCP","66","39364 → 443 [ACK] Seq=1868 Ack=38956 Win=42752 Len=0 SLE=42964 SRE=49258"
"362","0.609835350","104.16.100.29","192.168.1.118","TLSv1.2","967","[TCP Spurious Retransmission] , Ignored Unknown Record"
"363","0.609904725","192.168.1.118","104.16.100.29","TCP","66","[TCP Dup ACK 336#1] 39362 → 443 [ACK] Seq=1827 Ack=45839 Win=41728 Len=0 SLE=44926 SRE=45839"
"364","0.612439163","192.168.1.118","104.16.100.29","TLSv1.2","289","Application Data"
"365","0.617654263","104.16.100.29","192.168.1.118","TLSv1.2","88","[TCP Spurious Retransmission] , Application Data"
"366","0.617720863","192.168.1.118","104.16.100.29","TCP","66","[TCP Dup ACK 335#1] 39368 → 443 [ACK] Seq=1583 Ack=17112 Win=64128 Len=0 SLE=17078 SRE=17112"
"367","0.620069313","192.168.1.118","104.16.100.29","TLSv1.2","283","Application Data"
"368","0.627030663","104.16.100.29","192.168.1.118","TCP","1514","[TCP Out-Of-Order] 443 → 39366 [ACK] Seq=21671 Ack=1562 Win=71680 Len=1460"
"369","0.627101075","192.168.1.118","104.16.100.29","TCP","54","39366 → 443 [ACK] Seq=1562 Ack=83003 Win=256 Len=0"
"370","0.635222000","104.16.100.29","192.168.1.118","TLSv1.2","451","[TCP Spurious Retransmission] , Ignored Unknown Record"
"371","0.635299663","192.168.1.118","104.16.100.29","TCP","66","[TCP Window Update] 39358 → 443 [ACK] Seq=2244 Ack=45391 Win=501 Len=0 SLE=44994 SRE=45391"
"372","0.635336975","104.16.100.29","192.168.1.118","TCP","1142","[TCP Retransmission] 443 → 39364 [PSH, ACK] Seq=38956 Ack=1868 Win=72704 Len=1088"
"373","0.635356900","192.168.1.118","104.16.100.29","TCP","66","39364 → 443 [ACK] Seq=1868 Ack=40044 Win=52480 Len=0 SLE=42964 SRE=49258"
"374","0.635385300","104.16.100.29","192.168.1.118","TCP","2974","[TCP Retransmission] 443 → 39364 [ACK] Seq=40044 Ack=1868 Win=72704 Len=2920"
"375","0.635404788","192.168.1.118","104.16.100.29","TCP","54","39364 → 443 [ACK] Seq=1868 Ack=49258 Win=48768 Len=0"
"376","0.636191238","104.16.100.29","192.168.1.118","TLSv1.2","1345","Application Data"
"377","0.636260938","192.168.1.118","104.16.100.29","TCP","54","39368 → 443 [ACK] Seq=1583 Ack=18403 Win=63104 Len=0"
"378","0.636288313","104.16.100.29","192.168.1.118","TLSv1.2","88","Application Data"
"379","0.636302575","192.168.1.118","104.16.100.29","TCP","54","39368 → 443 [ACK] Seq=1583 Ack=18437 Win=63104 Len=0"
"380","0.642907913","192.168.1.118","104.16.100.29","TCP","54","[TCP Window Update] 39366 → 443 [ACK] Seq=1562 Ack=83003 Win=37632 Len=0"
"381","0.649049088","104.16.100.29","192.168.1.118","TLSv1.2","1237","Application Data"
"382","0.649223275","192.168.1.118","104.16.100.29","TCP","54","39362 → 443 [ACK] Seq=2056 Ack=47022 Win=64128 Len=0"
"383","0.659475275","104.16.100.29","192.168.1.118","TLSv1.2","88","Application Data"
"384","0.659685263","192.168.1.118","104.16.100.29","TCP","54","39362 → 443 [ACK] Seq=2056 Ack=47056 Win=64128 Len=0"
"385","0.669691713","104.16.100.29","192.168.1.118","TCP","1514","443 → 39366 [ACK] Seq=83003 Ack=1562 Win=71680 Len=1460 [TCP segment of a reassembled PDU]"
"386","0.672515038","104.16.100.29","192.168.1.118","TLSv1.2","19034","Application Data, Application Data, Application Data, Application Data, Application Data, Application Data"
"387","0.672599950","192.168.1.118","104.16.100.29","TCP","54","39366 → 443 [ACK] Seq=1562 Ack=103443 Win=102144 Len=0"
"388","0.672718438","104.16.100.29","192.168.1.118","TLSv1.2","4434","Application Data [TCP segment of a reassembled PDU]"
"389","0.672753163","192.168.1.118","104.16.100.29","TCP","54","39366 → 443 [ACK] Seq=1562 Ack=107823 Win=110848 Len=0"
"390","0.678456263","104.16.100.29","192.168.1.118","TLSv1.2","7354","Application Data [TCP segment of a reassembled PDU]"
"391","0.678535700","192.168.1.118","104.16.100.29","TCP","54","39366 → 443 [ACK] Seq=1562 Ack=115123 Win=125440 Len=0"
"392","0.678636263","104.16.100.29","192.168.1.118","TLSv1.2","5566","Application Data, Application Data"
"393","0.678670425","192.168.1.118","104.16.100.29","TCP","54","39366 → 443 [ACK] Seq=1562 Ack=120635 Win=136448 Len=0"
"394","0.701416525","104.16.100.29","192.168.1.118","TLSv1.2","88","[TCP Spurious Retransmission] , Application Data"
"395","0.701477700","192.168.1.118","104.16.100.29","TCP","66","[TCP Dup ACK 384#1] 39362 → 443 [ACK] Seq=2056 Ack=47056 Win=64128 Len=0 SLE=47022 SRE=47056"
"396","0.726024763","104.16.100.29","192.168.1.118","TCP","1514","443 → 39366 [ACK] Seq=120635 Ack=1562 Win=71680 Len=1460 [TCP segment of a reassembled PDU]"
"397","0.726112375","192.168.1.118","104.16.100.29","TCP","54","39366 → 443 [ACK] Seq=1562 Ack=122095 Win=139392 Len=0"
"398","0.741523013","104.16.100.29","192.168.1.118","TLSv1.2","5894","Application Data, Application Data"
"399","0.741626125","192.168.1.118","104.16.100.29","TCP","54","39366 → 443 [ACK] Seq=1562 Ack=127935 Win=151040 Len=0"
"400","0.742191288","104.16.100.29","192.168.1.118","TLSv1.2","17574","Application Data, Application Data, Application Data, Application Data"
"401","0.742279788","192.168.1.118","104.16.100.29","TCP","54","39366 → 443 [ACK] Seq=1562 Ack=145455 Win=186112 Len=0"
"402","0.748309013","104.16.100.29","192.168.1.118","TCP","1842","443 → 39366 [PSH, ACK] Seq=145455 Ack=1562 Win=71680 Len=1788 [TCP segment of a reassembled PDU]"
"403","0.748405563","192.168.1.118","104.16.100.29","TCP","54","39366 → 443 [ACK] Seq=1562 Ack=147243 Win=189696 Len=0"
"404","0.748653425","104.16.100.29","192.168.1.118","TLSv1.2","17574","Application Data, Application Data, Application Data, Application Data, Application Data"
"405","0.748713913","192.168.1.118","104.16.100.29","TCP","54","39366 → 443 [ACK] Seq=1562 Ack=164763 Win=224768 Len=0"
"406","0.748952463","104.16.100.29","192.168.1.118","TCP","2974","443 → 39366 [ACK] Seq=164763 Ack=1562 Win=71680 Len=2920 [TCP segment of a reassembled PDU]"
"407","0.749016388","192.168.1.118","104.16.100.29","TCP","54","39366 → 443 [ACK] Seq=1562 Ack=167683 Win=230528 Len=0"
"408","0.754929463","104.16.100.29","192.168.1.118","TLSv1.2","11734","Application Data, Application Data, Application Data"
"409","0.755009500","192.168.1.118","104.16.100.29","TCP","54","39366 → 443 [ACK] Seq=1562 Ack=179363 Win=253952 Len=0"
"410","0.755106613","104.16.100.29","192.168.1.118","TLSv1.2","4921","Application Data, Application Data"
"411","0.755141463","192.168.1.118","104.16.100.29","TCP","54","39366 → 443 [ACK] Seq=1562 Ack=184230 Win=263680 Len=0"
"412","1.624137775","192.168.1.104","255.255.255.255","UDP","217","49154 → 6666 Len=175"
"413","3.061995688","192.168.1.118","192.168.1.102","TCP","176","40160 → 8009 [PSH, ACK] Seq=1 Ack=1 Win=501 Len=110 TSval=2234626567 TSecr=2445775 [TCP segment of a reassembled PDU]"
"414","3.067853863","192.168.1.102","192.168.1.118","TCP","176","8009 → 40160 [PSH, ACK] Seq=1 Ack=111 Win=344 Len=110 TSval=2446276 TSecr=2234626567 [TCP segment of a reassembled PDU]"
"415","3.068020275","192.168.1.118","192.168.1.102","TCP","66","40160 → 8009 [ACK] Seq=111 Ack=111 Win=501 Len=0 TSval=2234626573 TSecr=2446276"
"416","3.267657613","192.168.1.118","172.217.6.234","UDP","108","34472 → 443 Len=66"
"417","3.671762875","192.168.1.118","151.139.128.14","TCP","66","34882 → 80 [ACK] Seq=1 Ack=1 Win=501 Len=0 TSval=2409116023 TSecr=758048033"
"418","3.671897613","192.168.1.118","151.139.128.14","TCP","66","34880 → 80 [ACK] Seq=1 Ack=1 Win=501 Len=0 TSval=2409116023 TSecr=2175394502"
"419","3.689120888","151.139.128.14","192.168.1.118","TCP","54","80 → 34882 [RST] Seq=1 Win=0 Len=0"
"420","3.690556475","151.139.128.14","192.168.1.118","TCP","54","80 → 34880 [RST] Seq=1 Win=0 Len=0"
"421","4.593923475","192.168.1.104","255.255.255.255","UDP","217","49154 → 6666 Len=175"
"422","6.337359813","192.168.1.100","224.0.0.251","MDNS","557","Standard query 0x0000 PTR _airport._tcp.local, "QM" question PTR _googlecast._tcp.local, "QM" question PTR _homekit._tcp.local, "QM" question PTR _raop._tcp.local, "QM" question PTR _airplay._tcp.local, "QM" question PTR _rdlink._tcp.local, "QM" question PTR _uscans._tcp.local, "QM" question PTR _uscan._tcp.local, "QM" question PTR _ippusb._tcp.local, "QM" question PTR _ipp._tcp.local, "QM" question PTR _scanner._tcp.local, "QM" question PTR _ipps._tcp.local, "QM" question PTR _printer._tcp.local, "QM" question PTR _pdl-datastream._tcp.local, "QM" question PTR _ptp._tcp.local, "QM" question PTR _afpovertcp._tcp.local, "QM" question PTR _smb._tcp.local, "QM" question PTR _rfb._tcp.local, "QM" question PTR _adisk._tcp.local, "QM" question PTR _companion-link._tcp.local, "QM" question PTR _apple-mobdev._tcp.local, "QM" question PTR 8ed307c3._sub._apple-mobdev2._tcp.local, "QM" question PTR _apple-pairable._tcp.local, "QM" question PTR Google-Home-Mini-2c3f16b2da5c4b6fd6cfbfba61c12490._googlecast._tcp.local PTR cjqg._smb._tcp.local PTR cjqg._companion-link._tcp.local OPT"
"423","6.537404250","192.168.1.100","224.0.0.251","IGMPv2","46","Membership Report group 224.0.0.251"
"424","7.561739088","192.168.1.104","255.255.255.255","UDP","217","49154 → 6666 Len=175"
"425","8.072693350","192.168.1.118","192.168.1.102","TCP","176","40160 → 8009 [PSH, ACK] Seq=111 Ack=111 Win=501 Len=110 TSval=2234631578 TSecr=2446276 [TCP segment of a reassembled PDU]"
"426","8.079133625","192.168.1.102","192.168.1.118","TCP","176","8009 → 40160 [PSH, ACK] Seq=111 Ack=221 Win=344 Len=110 TSval=2446778 TSecr=2234631578 [TCP segment of a reassembled PDU]"
"427","8.079356625","192.168.1.118","192.168.1.102","TCP","66","40160 → 8009 [ACK] Seq=221 Ack=221 Win=501 Len=0 TSval=2234631585 TSecr=2446778"
"428","8.688418013","192.168.1.1","224.0.0.251","IGMPv2","46","Membership Report group 224.0.0.251"
"429","9.303760263","192.168.1.118","172.253.63.188","TCP","66","36486 → 5228 [ACK] Seq=1 Ack=1 Win=501 Len=0 TSval=2118098650 TSecr=4174944591"
"430","9.330613775","172.253.63.188","192.168.1.118","TCP","66","[TCP ACKed unseen segment] 5228 → 36486 [ACK] Seq=1 Ack=2 Win=253 Len=0 TSval=4174989650 TSecr=2117917393"
