frame.number,_ws.col.Time,_ws.col.Source,_ws.col.Destination,_ws.col.Protocol,frame.len,_ws.col.Info
"1","0.000000000","23.3.118.55","192.168.1.118","TCP","1514","[TCP segment of a reassembled PDU]"
"2","0.003396925","23.3.118.55","192.168.1.118","TCP","5858","443 → 43578 [ACK] Seq=1449 Ack=1 Win=260 Len=5792 TSval=2817197971 TSecr=694547264 [TCP segment of a reassembled PDU]"
"3","0.005426125","23.3.118.55","192.168.1.118","TLSv1.2","17442","Application Data [TCP segment of a reassembled PDU]"
"4","0.007879812","23.3.118.55","192.168.1.118","TCP","7306","443 → 43578 [ACK] Seq=24617 Ack=1 Win=260 Len=7240 TSval=2817197971 TSecr=694547264 [TCP segment of a reassembled PDU]"
"5","0.007939212","23.3.118.55","192.168.1.118","TLSv1.2","1514","Application Data [TCP segment of a reassembled PDU]"
"6","0.008086075","23.3.118.55","192.168.1.118","TCP","1514","443 → 43578 [ACK] Seq=33305 Ack=1 Win=260 Len=1448 TSval=2817197973 TSecr=694547264 [TCP segment of a reassembled PDU]"
"7","0.008117375","23.3.118.55","192.168.1.118","TLSv1.2","2962","Application Data [TCP segment of a reassembled PDU]"
"8","0.008168850","23.3.118.55","192.168.1.118","TCP","1514","443 → 43578 [ACK] Seq=37649 Ack=1 Win=260 Len=1448 TSval=2817197977 TSecr=694547264 [TCP segment of a reassembled PDU]"
"9","0.014934950","23.3.118.55","192.168.1.118","TCP","66","443 → 43552 [ACK] Seq=1 Ack=1 Win=294 Len=0 TSval=2817197994 TSecr=694547271"
"10","0.031365462","23.3.118.55","192.168.1.118","TCP","1514","[TCP segment of a reassembled PDU]"
"11","0.031468312","192.168.1.118","23.3.118.55","TCP","66","43552 → 443 [ACK] Seq=1 Ack=1449 Win=826 Len=0 TSval=694547330 TSecr=2817198006"
"12","0.033027362","23.3.118.55","192.168.1.118","TCP","7306","443 → 43552 [ACK] Seq=1449 Ack=1 Win=294 Len=7240 TSval=2817198006 TSecr=694547271 [TCP segment of a reassembled PDU]"
"13","0.033135225","192.168.1.118","23.3.118.55","TCP","66","43552 → 443 [ACK] Seq=1 Ack=8689 Win=899 Len=0 TSval=694547331 TSecr=2817198006"
"14","0.033229750","23.3.118.55","192.168.1.118","TCP","2962","443 → 43552 [ACK] Seq=8689 Ack=1 Win=294 Len=2896 TSval=2817198007 TSecr=694547271 [TCP segment of a reassembled PDU]"
"15","0.035142050","23.3.118.55","192.168.1.118","TCP","2962","443 → 43552 [ACK] Seq=11585 Ack=1 Win=294 Len=2896 TSval=2817198008 TSecr=694547271 [TCP segment of a reassembled PDU]"
"16","0.035217675","23.3.118.55","192.168.1.118","TCP","1514","443 → 43552 [ACK] Seq=14481 Ack=1 Win=294 Len=1448 TSval=2817198009 TSecr=694547271 [TCP segment of a reassembled PDU]"
"17","0.035338700","192.168.1.118","23.3.118.55","TCP","66","43578 → 443 [ACK] Seq=1 Ack=39097 Win=196 Len=0 TSval=694547333 TSecr=2817197971"
"18","0.035603725","192.168.1.118","23.3.118.55","TCP","66","43552 → 443 [ACK] Seq=1 Ack=15929 Win=899 Len=0 TSval=694547334 TSecr=2817198007"
"19","0.035771625","192.168.1.118","23.3.118.55","TLSv1.2","834","Application Data"
"20","0.035876550","192.168.1.118","23.3.118.55","TLSv1.2","846","Application Data"
"21","0.037994600","192.168.1.118","23.3.118.55","TCP","66","[TCP Window Update] 43578 → 443 [ACK] Seq=1 Ack=39097 Win=501 Len=0 TSval=694547336 TSecr=2817197971"
"22","0.039775925","23.3.118.55","192.168.1.118","TLSv1.2","1514","Application Data [TCP segment of a reassembled PDU]"
"23","0.039878750","192.168.1.118","23.3.118.55","TCP","66","43552 → 443 [ACK] Seq=1 Ack=17377 Win=922 Len=0 TSval=694547338 TSecr=2817198009"
"24","0.039984700","23.3.118.55","192.168.1.118","TCP","2962","443 → 43552 [ACK] Seq=17377 Ack=1 Win=294 Len=2896 TSval=2817198011 TSecr=694547271 [TCP segment of a reassembled PDU]"
"25","0.040043137","192.168.1.118","23.3.118.55","TCP","66","43552 → 443 [ACK] Seq=1 Ack=20273 Win=967 Len=0 TSval=694547338 TSecr=2817198011"
"26","0.040081312","23.3.118.55","192.168.1.118","TLSv1.2","1409","Application Data"
"27","0.040134587","192.168.1.118","23.3.118.55","TCP","66","43552 → 443 [ACK] Seq=1 Ack=21616 Win=990 Len=0 TSval=694547338 TSecr=2817198013"
"28","0.044561525","192.168.1.118","23.3.118.55","TLSv1.2","847","Application Data"
"29","0.065529887","23.3.118.55","192.168.1.118","TCP","1514","443 → 43578 [ACK] Seq=39097 Ack=1 Win=260 Len=1448 TSval=2817198043 TSecr=694547336 [TCP segment of a reassembled PDU]"
"30","0.069567500","23.3.118.55","192.168.1.118","TLSv1.2","13098","Application Data [TCP segment of a reassembled PDU]"
"31","0.069710337","192.168.1.118","23.3.118.55","TCP","66","43578 → 443 [ACK] Seq=1 Ack=53577 Win=705 Len=0 TSval=694547368 TSecr=2817198043"
"32","0.071015525","23.3.118.55","192.168.1.118","TCP","1514","443 → 43578 [ACK] Seq=53577 Ack=1 Win=260 Len=1448 TSval=2817198043 TSecr=694547336 [TCP segment of a reassembled PDU]"
"33","0.078837575","23.3.118.55","192.168.1.118","TLSv1.2","37714","Application Data, Application Data, Application Data"
"34","0.078978875","192.168.1.118","23.3.118.55","TCP","66","43578 → 443 [ACK] Seq=1 Ack=92673 Win=1316 Len=0 TSval=694547377 TSecr=2817198043"
"35","0.079066350","23.3.118.55","192.168.1.118","TCP","2962","443 → 43578 [ACK] Seq=92673 Ack=1 Win=260 Len=2896 TSval=2817198044 TSecr=694547336 [TCP segment of a reassembled PDU]"
"36","0.079133850","192.168.1.118","23.3.118.55","TCP","66","43578 → 443 [ACK] Seq=1 Ack=95569 Win=1361 Len=0 TSval=694547377 TSecr=2817198044"
"37","0.079192087","23.3.118.55","192.168.1.118","TCP","2962","443 → 43578 [PSH, ACK] Seq=95569 Ack=1 Win=260 Len=2896 TSval=2817198045 TSecr=694547336 [TCP segment of a reassembled PDU]"
"38","0.079256575","192.168.1.118","23.3.118.55","TCP","66","43578 → 443 [ACK] Seq=1 Ack=98465 Win=1406 Len=0 TSval=694547377 TSecr=2817198045"
"39","0.079333737","23.3.118.55","192.168.1.118","TCP","1514","443 → 43578 [ACK] Seq=98465 Ack=1 Win=260 Len=1448 TSval=2817198046 TSecr=694547336 [TCP segment of a reassembled PDU]"
"40","0.092357950","23.3.118.55","192.168.1.118","TCP","1514","443 → 43578 [ACK] Seq=99913 Ack=1 Win=260 Len=1448 TSval=2817198046 TSecr=694547336 [TCP segment of a reassembled PDU]"
"41","0.092460300","192.168.1.118","23.3.118.55","TCP","66","43578 → 443 [ACK] Seq=1 Ack=101361 Win=1451 Len=0 TSval=694547391 TSecr=2817198046"
"42","0.092576500","23.3.118.55","192.168.1.118","TCP","1930","443 → 43578 [ACK] Seq=101361 Ack=1 Win=260 Len=1864 TSval=2817198047 TSecr=694547336 [TCP segment of a reassembled PDU]"
"43","0.092636850","192.168.1.118","23.3.118.55","TCP","66","43578 → 443 [ACK] Seq=1 Ack=103225 Win=1481 Len=0 TSval=694547391 TSecr=2817198047"
"44","0.092793162","23.3.118.55","192.168.1.118","TCP","8754","[TCP segment of a reassembled PDU]"
"45","0.092874175","192.168.1.118","23.3.118.55","TCP","66","43552 → 443 [ACK] Seq=782 Ack=30304 Win=1126 Len=0 TSval=694547391 TSecr=2817198057"
"46","0.092957512","23.3.118.55","192.168.1.118","TCP","2962","443 → 43552 [ACK] Seq=30304 Ack=782 Win=306 Len=2896 TSval=2817198058 TSecr=694547343 [TCP segment of a reassembled PDU]"
"47","0.093020275","192.168.1.118","23.3.118.55","TCP","66","43552 → 443 [ACK] Seq=782 Ack=33200 Win=1171 Len=0 TSval=694547391 TSecr=2817198058"
"48","0.093098737","23.3.118.55","192.168.1.118","TCP","2962","443 → 43552 [ACK] Seq=33200 Ack=782 Win=306 Len=2896 TSval=2817198059 TSecr=694547343 [TCP segment of a reassembled PDU]"
"49","0.093155550","192.168.1.118","23.3.118.55","TCP","66","43552 → 443 [ACK] Seq=782 Ack=36096 Win=1216 Len=0 TSval=694547391 TSecr=2817198059"
"50","0.093251275","23.3.118.55","192.168.1.118","TLSv1.2","2962","Application Data [TCP segment of a reassembled PDU]"
"51","0.093315037","192.168.1.118","23.3.118.55","TCP","66","43552 → 443 [ACK] Seq=782 Ack=38992 Win=1261 Len=0 TSval=694547391 TSecr=2817198060"
"52","0.093354662","23.3.118.55","192.168.1.118","TCP","1514","443 → 43552 [ACK] Seq=38992 Ack=782 Win=306 Len=1448 TSval=2817198061 TSecr=694547343 [TCP segment of a reassembled PDU]"
"53","0.094148612","23.3.118.55","192.168.1.118","TCP","1514","443 → 43552 [ACK] Seq=40440 Ack=782 Win=306 Len=1448 TSval=2817198061 TSecr=694547343 [TCP segment of a reassembled PDU]"
"54","0.094266687","192.168.1.118","23.3.118.55","TCP","66","43552 → 443 [ACK] Seq=782 Ack=41888 Win=1307 Len=0 TSval=694547392 TSecr=2817198061"
"55","0.094368750","23.3.118.55","192.168.1.118","TCP","2962","443 → 43552 [ACK] Seq=41888 Ack=782 Win=306 Len=2896 TSval=2817198063 TSecr=694547343 [TCP segment of a reassembled PDU]"
"56","0.094435225","192.168.1.118","23.3.118.55","TCP","66","43552 → 443 [ACK] Seq=782 Ack=44784 Win=1352 Len=0 TSval=694547393 TSecr=2817198063"
"57","0.094548712","23.3.118.55","192.168.1.118","TCP","2962","443 → 43552 [ACK] Seq=44784 Ack=782 Win=306 Len=2896 TSval=2817198064 TSecr=694547343 [TCP segment of a reassembled PDU]"
"58","0.094604262","192.168.1.118","23.3.118.55","TCP","66","43552 → 443 [ACK] Seq=782 Ack=47680 Win=1397 Len=0 TSval=694547393 TSecr=2817198064"
"59","0.094637412","23.3.118.55","192.168.1.118","TLSv1.2","1399","Application Data"
"60","0.094734275","23.3.118.55","192.168.1.118","TLSv1.2","3518","Application Data"
"61","0.094792375","192.168.1.118","23.3.118.55","TCP","66","43578 → 443 [ACK] Seq=1 Ack=106677 Win=1534 Len=0 TSval=694547393 TSecr=2817198068"
"62","0.099057037","192.168.1.118","23.3.118.55","TLSv1.2","848","Application Data"
"63","0.099194100","192.168.1.118","23.3.118.55","TLSv1.2","824","Application Data"
"64","0.102599062","23.3.118.55","192.168.1.118","TCP","1514","[TCP segment of a reassembled PDU]"
"65","0.104951300","23.3.118.55","192.168.1.118","TLSv1.2","15031","Application Data"
"66","0.105059912","192.168.1.118","23.3.118.55","TCP","66","43574 → 443 [ACK] Seq=1 Ack=16414 Win=735 Len=0 TSval=694547403 TSecr=2817198077"
"67","0.105209725","23.3.118.55","192.168.1.118","TCP","7306","[TCP segment of a reassembled PDU]"
"68","0.105271537","192.168.1.118","23.3.118.55","TCP","66","43574 → 443 [ACK] Seq=1 Ack=23654 Win=848 Len=0 TSval=694547403 TSecr=2817198077"
"69","0.106569337","23.3.118.55","192.168.1.118","TCP","2962","443 → 43574 [ACK] Seq=23654 Ack=1 Win=260 Len=2896 TSval=2817198077 TSecr=694547163 [TCP segment of a reassembled PDU]"
"70","0.106685737","192.168.1.118","23.3.118.55","TCP","66","43574 → 443 [ACK] Seq=1 Ack=26550 Win=893 Len=0 TSval=694547405 TSecr=2817198077"
"71","0.106930937","23.3.118.55","192.168.1.118","TCP","1514","443 → 43574 [ACK] Seq=26550 Ack=1 Win=260 Len=1448 TSval=2817198077 TSecr=694547163 [TCP segment of a reassembled PDU]"
"72","0.107058400","23.3.118.55","192.168.1.118","TLSv1.2","5858","Application Data [TCP segment of a reassembled PDU]"
"73","0.107144575","23.3.118.55","192.168.1.118","TLSv1.2","2962","Application Data [TCP segment of a reassembled PDU]"
"74","0.107157025","192.168.1.118","23.3.118.55","TCP","66","43574 → 443 [ACK] Seq=1 Ack=33790 Win=1007 Len=0 TSval=694547405 TSecr=2817198077"
"75","0.107210387","192.168.1.118","23.3.118.55","TCP","66","43574 → 443 [ACK] Seq=1 Ack=36686 Win=1052 Len=0 TSval=694547405 TSecr=2817198079"
"76","0.107235200","23.3.118.55","192.168.1.118","TCP","2962","443 → 43574 [ACK] Seq=36686 Ack=1 Win=260 Len=2896 TSval=2817198080 TSecr=694547163 [TCP segment of a reassembled PDU]"
"77","0.107300062","192.168.1.118","23.3.118.55","TCP","66","43574 → 443 [ACK] Seq=1 Ack=39582 Win=1097 Len=0 TSval=694547405 TSecr=2817198080"
"78","0.109550387","23.3.118.55","192.168.1.118","TCP","5858","443 → 43574 [ACK] Seq=39582 Ack=1 Win=260 Len=5792 TSval=2817198081 TSecr=694547163 [TCP segment of a reassembled PDU]"
"79","0.109664450","192.168.1.118","23.3.118.55","TCP","66","43574 → 443 [ACK] Seq=1 Ack=45374 Win=1188 Len=0 TSval=694547408 TSecr=2817198081"
"80","0.109755700","23.3.118.55","192.168.1.118","TCP","1514","443 → 43574 [ACK] Seq=45374 Ack=1 Win=260 Len=1448 TSval=2817198082 TSecr=694547163 [TCP segment of a reassembled PDU]"
"81","0.111649750","23.3.118.55","192.168.1.118","TCP","1514","443 → 43574 [ACK] Seq=46822 Ack=1 Win=260 Len=1448 TSval=2817198082 TSecr=694547163 [TCP segment of a reassembled PDU]"
"82","0.111765675","192.168.1.118","23.3.118.55","TCP","66","43574 → 443 [ACK] Seq=1 Ack=48270 Win=1233 Len=0 TSval=694547410 TSecr=2817198082"
"83","0.111885037","23.3.118.55","192.168.1.118","TLSv1.2","2962","Application Data [TCP segment of a reassembled PDU]"
"84","0.111952050","192.168.1.118","23.3.118.55","TCP","66","43574 → 443 [ACK] Seq=1 Ack=51166 Win=1278 Len=0 TSval=694547410 TSecr=2817198083"
"85","0.112083225","23.3.118.55","192.168.1.118","TCP","5858","443 → 43574 [ACK] Seq=51166 Ack=1 Win=260 Len=5792 TSval=2817198084 TSecr=694547163 [TCP segment of a reassembled PDU]"
"86","0.112148112","192.168.1.118","23.3.118.55","TCP","66","43574 → 443 [ACK] Seq=1 Ack=56958 Win=1369 Len=0 TSval=694547410 TSecr=2817198084"
"87","0.112238350","23.3.118.55","192.168.1.118","TCP","2962","443 → 43574 [ACK] Seq=56958 Ack=1 Win=260 Len=2896 TSval=2817198085 TSecr=694547163 [TCP segment of a reassembled PDU]"
"88","0.112301900","192.168.1.118","23.3.118.55","TCP","66","43574 → 443 [ACK] Seq=1 Ack=59854 Win=1414 Len=0 TSval=694547410 TSecr=2817198085"
"89","0.112389575","23.3.118.55","192.168.1.118","TCP","66","443 → 43576 [ACK] Seq=1 Ack=769 Win=260 Len=0 TSval=2817198089 TSecr=694547334"
"90","0.112448787","23.3.118.55","192.168.1.118","TCP","2962","443 → 43574 [ACK] Seq=59854 Ack=1 Win=260 Len=2896 TSval=2817198086 TSecr=694547163 [TCP segment of a reassembled PDU]"
"91","0.112535987","192.168.1.118","23.3.118.55","TCP","66","43574 → 443 [ACK] Seq=1 Ack=62750 Win=1459 Len=0 TSval=694547411 TSecr=2817198086"
"92","0.112735487","23.3.118.55","192.168.1.118","TCP","2962","[TCP segment of a reassembled PDU]"
"93","0.112804512","192.168.1.118","23.3.118.55","TCP","66","43576 → 443 [ACK] Seq=769 Ack=2897 Win=546 Len=0 TSval=694547411 TSecr=2817198090"
"94","0.116084650","23.3.118.55","192.168.1.118","TLSv1.2","13583","Application Data"
"95","0.116212025","192.168.1.118","23.3.118.55","TCP","66","43576 → 443 [ACK] Seq=769 Ack=16414 Win=758 Len=0 TSval=694547414 TSecr=2817198090"
"96","0.116340662","23.3.118.55","192.168.1.118","TCP","2962","[TCP segment of a reassembled PDU]"
"97","0.116406275","192.168.1.118","23.3.118.55","TCP","66","43576 → 443 [ACK] Seq=769 Ack=19310 Win=803 Len=0 TSval=694547415 TSecr=2817198090"
"98","0.117362625","23.3.118.55","192.168.1.118","TCP","66","443 → 43580 [ACK] Seq=1 Ack=781 Win=259 Len=0 TSval=2817198094 TSecr=694547334"
"99","0.117431300","23.3.118.55","192.168.1.118","TCP","5858","443 → 43576 [ACK] Seq=19310 Ack=769 Win=260 Len=5792 TSval=2817198090 TSecr=694547334 [TCP segment of a reassembled PDU]"
"100","0.118635212","192.168.1.118","23.3.118.55","TCP","66","43576 → 443 [ACK] Seq=769 Ack=25102 Win=893 Len=0 TSval=694547417 TSecr=2817198090"
"101","0.119425212","23.3.118.55","192.168.1.118","TCP","2962","443 → 43576 [ACK] Seq=25102 Ack=769 Win=260 Len=2896 TSval=2817198090 TSecr=694547334 [TCP segment of a reassembled PDU]"
"102","0.119524975","192.168.1.118","23.3.118.55","TCP","66","43576 → 443 [ACK] Seq=769 Ack=27998 Win=939 Len=0 TSval=694547418 TSecr=2817198090"
"103","0.120770062","23.3.118.55","192.168.1.118","TCP","2962","443 → 43576 [ACK] Seq=27998 Ack=769 Win=260 Len=2896 TSval=2817198093 TSecr=694547334 [TCP segment of a reassembled PDU]"
"104","0.120843000","192.168.1.118","23.3.118.55","TCP","66","43576 → 443 [ACK] Seq=769 Ack=30894 Win=984 Len=0 TSval=694547419 TSecr=2817198093"
"105","0.122448762","23.3.118.55","192.168.1.118","TCP","1514","[TCP segment of a reassembled PDU]"
"106","0.122535587","192.168.1.118","23.3.118.55","TCP","66","43580 → 443 [ACK] Seq=781 Ack=1449 Win=493 Len=0 TSval=694547421 TSecr=2817198100"
"107","0.124990925","23.3.118.55","192.168.1.118","TCP","14546","443 → 43580 [ACK] Seq=1449 Ack=781 Win=259 Len=14480 TSval=2817198100 TSecr=694547334 [TCP segment of a reassembled PDU]"
"108","0.125072000","192.168.1.118","23.3.118.55","TCP","66","43580 → 443 [ACK] Seq=781 Ack=15929 Win=380 Len=0 TSval=694547423 TSecr=2817198100"
"109","0.125170387","23.3.118.55","192.168.1.118","TLSv1.2","1514","Application Data [TCP segment of a reassembled PDU]"
"110","0.125198287","192.168.1.118","23.3.118.55","TCP","66","43580 → 443 [ACK] Seq=781 Ack=17377 Win=369 Len=0 TSval=694547423 TSecr=2817198100"
"111","0.133700575","23.3.118.55","192.168.1.118","TLSv1.2","10317","Application Data"
"112","0.133795737","192.168.1.118","23.3.118.55","TCP","66","43580 → 443 [ACK] Seq=781 Ack=27628 Win=381 Len=0 TSval=694547432 TSecr=2817198100"
"113","0.133892775","23.3.118.55","192.168.1.118","TLSv1.2","2962","Application Data [TCP segment of a reassembled PDU]"
"114","0.133939762","192.168.1.118","23.3.118.55","TCP","66","43576 → 443 [ACK] Seq=769 Ack=33790 Win=1029 Len=0 TSval=694547432 TSecr=2817198095"
"115","0.134000112","23.3.118.55","192.168.1.118","TLSv1.2","2962","Application Data [TCP segment of a reassembled PDU]"
"116","0.134044775","192.168.1.118","23.3.118.55","TCP","66","43576 → 443 [ACK] Seq=769 Ack=36686 Win=1074 Len=0 TSval=694547432 TSecr=2817198097"
"117","0.135327825","23.3.118.55","192.168.1.118","TCP","2962","443 → 43576 [ACK] Seq=36686 Ack=769 Win=260 Len=2896 TSval=2817198100 TSecr=694547334 [TCP segment of a reassembled PDU]"
"118","0.135422400","192.168.1.118","23.3.118.55","TCP","66","43576 → 443 [ACK] Seq=769 Ack=39582 Win=1120 Len=0 TSval=694547434 TSecr=2817198100"
"119","0.135588787","23.3.118.55","192.168.1.118","TLSv1.2","3156","Application Data"
"120","0.135653912","192.168.1.118","23.3.118.55","TCP","66","43578 → 443 [ACK] Seq=759 Ack=109767 Win=1583 Len=0 TSval=694547434 TSecr=2817198108"
"121","0.135812900","23.3.118.55","192.168.1.118","TCP","2962","443 → 43576 [ACK] Seq=39582 Ack=769 Win=260 Len=2896 TSval=2817198105 TSecr=694547334 [TCP segment of a reassembled PDU]"
"122","0.135858137","192.168.1.118","23.3.118.55","TCP","66","43576 → 443 [ACK] Seq=769 Ack=42478 Win=1165 Len=0 TSval=694547434 TSecr=2817198105"
"123","0.135888287","23.3.118.55","192.168.1.118","TLSv1.2","13098","Application Data, Application Data"
"124","0.135937737","192.168.1.118","23.3.118.55","TCP","66","43574 → 443 [ACK] Seq=1 Ack=75782 Win=1663 Len=0 TSval=694547434 TSecr=2817198108"
"125","0.137082362","192.168.1.118","23.3.118.55","TLSv1.2","854","Application Data"
"126","0.137646975","23.3.118.55","192.168.1.118","TLSv1.2","18890","Application Data [TCP segment of a reassembled PDU]"
"127","0.137750437","192.168.1.118","23.3.118.55","TCP","66","43574 → 443 [ACK] Seq=1 Ack=94606 Win=1957 Len=0 TSval=694547436 TSecr=2817198108"
"128","0.137820637","23.3.118.55","192.168.1.118","TCP","1514","443 → 43576 [ACK] Seq=42478 Ack=769 Win=260 Len=1448 TSval=2817198105 TSecr=694547334 [TCP segment of a reassembled PDU]"
"129","0.137867787","192.168.1.118","23.3.118.55","TCP","66","43576 → 443 [ACK] Seq=769 Ack=43926 Win=1188 Len=0 TSval=694547436 TSecr=2817198105"
"130","0.137986450","23.3.118.55","192.168.1.118","TCP","1514","443 → 43576 [ACK] Seq=43926 Ack=769 Win=260 Len=1448 TSval=2817198105 TSecr=694547334 [TCP segment of a reassembled PDU]"
"131","0.138033737","192.168.1.118","23.3.118.55","TCP","66","43576 → 443 [ACK] Seq=769 Ack=45374 Win=1210 Len=0 TSval=694547436 TSecr=2817198105"
"132","0.138077737","23.3.118.55","192.168.1.118","TCP","1514","443 → 43576 [ACK] Seq=45374 Ack=769 Win=260 Len=1448 TSval=2817198107 TSecr=694547334 [TCP segment of a reassembled PDU]"
"133","0.138121400","192.168.1.118","23.3.118.55","TCP","66","43576 → 443 [ACK] Seq=769 Ack=46822 Win=1233 Len=0 TSval=694547436 TSecr=2817198107"
"134","0.139900800","192.168.1.118","23.3.118.55","TLSv1.2","853","Application Data"
"135","0.140131162","23.3.118.55","192.168.1.118","TCP","1514","443 → 43576 [ACK] Seq=46822 Ack=769 Win=260 Len=1448 TSval=2817198107 TSecr=694547334 [TCP segment of a reassembled PDU]"
"136","0.140224987","192.168.1.118","23.3.118.55","TCP","66","43576 → 443 [ACK] Seq=769 Ack=48270 Win=1255 Len=0 TSval=694547438 TSecr=2817198107"
"137","0.140315362","23.3.118.55","192.168.1.118","TCP","2962","443 → 43576 [ACK] Seq=48270 Ack=769 Win=260 Len=2896 TSval=2817198110 TSecr=694547419 [TCP segment of a reassembled PDU]"
"138","0.140363350","192.168.1.118","23.3.118.55","TCP","66","43576 → 443 [ACK] Seq=769 Ack=51166 Win=1301 Len=0 TSval=694547439 TSecr=2817198110"
"139","0.140444375","23.3.118.55","192.168.1.118","TLSv1.2","2834","Application Data"
"140","0.140536625","192.168.1.118","23.3.118.55","TCP","66","43552 → 443 [ACK] Seq=1564 Ack=51781 Win=1463 Len=0 TSval=694547439 TSecr=2817198116"
"141","0.140571537","23.3.118.55","192.168.1.118","TLSv1.2","2962","Application Data [TCP segment of a reassembled PDU]"
"142","0.140615750","192.168.1.118","23.3.118.55","TCP","66","43576 → 443 [ACK] Seq=769 Ack=54062 Win=1346 Len=0 TSval=694547439 TSecr=2817198111"
"143","0.141505312","23.3.118.55","192.168.1.118","TCP","2962","443 → 43576 [ACK] Seq=54062 Ack=769 Win=260 Len=2896 TSval=2817198113 TSecr=694547419 [TCP segment of a reassembled PDU]"
"144","0.141598300","192.168.1.118","23.3.118.55","TCP","66","43576 → 443 [ACK] Seq=769 Ack=56958 Win=1391 Len=0 TSval=694547440 TSecr=2817198113"
"145","0.141675425","23.3.118.55","192.168.1.118","TCP","2962","443 → 43576 [ACK] Seq=56958 Ack=769 Win=260 Len=2896 TSval=2817198115 TSecr=694547419 [TCP segment of a reassembled PDU]"
"146","0.141720700","192.168.1.118","23.3.118.55","TCP","66","43576 → 443 [ACK] Seq=769 Ack=59854 Win=1436 Len=0 TSval=694547440 TSecr=2817198115"
"147","0.142605150","23.3.118.55","192.168.1.118","TCP","1514","443 → 43576 [ACK] Seq=59854 Ack=769 Win=260 Len=1448 TSval=2817198117 TSecr=694547419 [TCP segment of a reassembled PDU]"
"148","0.142696837","192.168.1.118","23.3.118.55","TCP","66","43576 → 443 [ACK] Seq=769 Ack=61302 Win=1459 Len=0 TSval=694547441 TSecr=2817198117"
"149","0.143708350","23.3.118.55","192.168.1.118","TCP","1514","443 → 43576 [ACK] Seq=61302 Ack=769 Win=260 Len=1448 TSval=2817198117 TSecr=694547419 [TCP segment of a reassembled PDU]"
"150","0.143785262","192.168.1.118","23.3.118.55","TCP","66","43576 → 443 [ACK] Seq=769 Ack=62750 Win=1482 Len=0 TSval=694547442 TSecr=2817198117"
"151","0.146528212","23.3.118.55","192.168.1.118","TCP","2962","443 → 43576 [ACK] Seq=62750 Ack=769 Win=260 Len=2896 TSval=2817198119 TSecr=694547419 [TCP segment of a reassembled PDU]"
"152","0.146602837","192.168.1.118","23.3.118.55","TCP","66","43576 → 443 [ACK] Seq=769 Ack=65646 Win=1527 Len=0 TSval=694547445 TSecr=2817198119"
"153","0.148646637","23.3.118.55","192.168.1.118","TLSv1.2","2962","Application Data [TCP segment of a reassembled PDU]"
"154","0.148722050","192.168.1.118","23.3.118.55","TCP","66","43576 → 443 [ACK] Seq=769 Ack=68542 Win=1572 Len=0 TSval=694547447 TSecr=2817198121"
"155","0.149471312","192.168.1.118","23.3.118.55","TLSv1.2","844","Application Data"
"156","0.150261100","23.3.118.55","192.168.1.118","TCP","2962","443 → 43576 [ACK] Seq=68542 Ack=769 Win=260 Len=2896 TSval=2817198122 TSecr=694547419 [TCP segment of a reassembled PDU]"
"157","0.150334687","192.168.1.118","23.3.118.55","TCP","66","43576 → 443 [ACK] Seq=769 Ack=71438 Win=1617 Len=0 TSval=694547448 TSecr=2817198122"
"158","0.152662925","23.3.118.55","192.168.1.118","TCP","2962","443 → 43576 [ACK] Seq=71438 Ack=769 Win=260 Len=2896 TSval=2817198124 TSecr=694547419 [TCP segment of a reassembled PDU]"
"159","0.152740012","192.168.1.118","23.3.118.55","TCP","66","43576 → 443 [ACK] Seq=769 Ack=74334 Win=1663 Len=0 TSval=694547451 TSecr=2817198124"
"160","0.153875250","23.3.118.55","192.168.1.118","TLSv1.2","2962","Application Data [TCP segment of a reassembled PDU]"
"161","0.153975887","192.168.1.118","23.3.118.55","TCP","66","43576 → 443 [ACK] Seq=769 Ack=77230 Win=1708 Len=0 TSval=694547452 TSecr=2817198126"
"162","0.154031137","23.3.118.55","192.168.1.118","TCP","1514","443 → 43576 [ACK] Seq=77230 Ack=769 Win=260 Len=1448 TSval=2817198128 TSecr=694547419 [TCP segment of a reassembled PDU]"
"163","0.154078225","192.168.1.118","23.3.118.55","TCP","66","43576 → 443 [ACK] Seq=769 Ack=78678 Win=1731 Len=0 TSval=694547452 TSecr=2817198128"
"164","0.154758875","23.3.118.55","192.168.1.118","TCP","1514","443 → 43576 [ACK] Seq=78678 Ack=769 Win=260 Len=1448 TSval=2817198128 TSecr=694547419 [TCP segment of a reassembled PDU]"
"165","0.154808800","192.168.1.118","23.3.118.55","TCP","66","43576 → 443 [ACK] Seq=769 Ack=80126 Win=1753 Len=0 TSval=694547453 TSecr=2817198128"
"166","0.157230875","23.3.118.55","192.168.1.118","TCP","2962","443 → 43576 [ACK] Seq=80126 Ack=769 Win=260 Len=2896 TSval=2817198130 TSecr=694547419 [TCP segment of a reassembled PDU]"
"167","0.157322150","192.168.1.118","23.3.118.55","TCP","66","43576 → 443 [ACK] Seq=769 Ack=83022 Win=1798 Len=0 TSval=694547455 TSecr=2817198130"
"168","0.159421712","23.3.118.55","192.168.1.118","TCP","1514","443 → 43574 [ACK] Seq=94606 Ack=1 Win=260 Len=1448 TSval=2817198137 TSecr=694547411 [TCP segment of a reassembled PDU]"
"169","0.161122200","23.3.118.55","192.168.1.118","TCP","8754","443 → 43574 [ACK] Seq=96054 Ack=1 Win=260 Len=8688 TSval=2817198137 TSecr=694547411 [TCP segment of a reassembled PDU]"
"170","0.161220187","192.168.1.118","23.3.118.55","TCP","66","43574 → 443 [ACK] Seq=1 Ack=104742 Win=2115 Len=0 TSval=694547459 TSecr=2817198137"
"171","0.162902750","23.3.118.55","192.168.1.118","TLSv1.2","3517","Application Data"
"172","0.162994425","192.168.1.118","23.3.118.55","TCP","66","43574 → 443 [ACK] Seq=1 Ack=108193 Win=2169 Len=0 TSval=694547461 TSecr=2817198137"
"173","0.163145612","23.3.118.55","192.168.1.118","TCP","7306","[TCP segment of a reassembled PDU]"
"174","0.163194575","192.168.1.118","23.3.118.55","TCP","66","43574 → 443 [ACK] Seq=1 Ack=115433 Win=2282 Len=0 TSval=694547461 TSecr=2817198137"
"175","0.163253262","23.3.118.55","192.168.1.118","TLSv1.2","2962","Application Data [TCP segment of a reassembled PDU]"
"176","0.163304750","192.168.1.118","23.3.118.55","TCP","66","43574 → 443 [ACK] Seq=1 Ack=118329 Win=2327 Len=0 TSval=694547461 TSecr=2817198138"
"177","0.167664237","23.3.118.55","192.168.1.118","TLSv1.2","4036","Application Data"
"178","0.167757900","192.168.1.118","23.3.118.55","TCP","66","43574 → 443 [ACK] Seq=1 Ack=122299 Win=2389 Len=0 TSval=694547466 TSecr=2817198138"
"179","0.170291025","192.168.1.118","23.3.118.55","TLSv1.2","893","Application Data"
"180","0.170671650","23.3.118.55","192.168.1.118","TCP","1514","443 → 43576 [ACK] Seq=83022 Ack=769 Win=260 Len=1448 TSval=2817198148 TSecr=694547448 [TCP segment of a reassembled PDU]"
"181","0.170764137","192.168.1.118","23.3.118.55","TCP","66","43576 → 443 [ACK] Seq=769 Ack=84470 Win=1821 Len=0 TSval=694547469 TSecr=2817198148"
"182","0.173679762","23.3.118.55","192.168.1.118","TCP","66","443 → 43580 [ACK] Seq=27628 Ack=1568 Win=272 Len=0 TSval=2817198149 TSecr=694547438"
"183","0.173814237","23.3.118.55","192.168.1.118","TLSv1.2","20338","Application Data [TCP segment of a reassembled PDU]"
"184","0.173885262","192.168.1.118","23.3.118.55","TCP","66","43576 → 443 [ACK] Seq=769 Ack=104742 Win=2138 Len=0 TSval=694547472 TSecr=2817198148"
"185","0.180413900","23.3.118.55","192.168.1.118","TLSv1.2","4410","Application Data [TCP segment of a reassembled PDU]"
"186","0.180571500","192.168.1.118","23.3.118.55","TCP","66","43576 → 443 [ACK] Seq=769 Ack=109086 Win=2206 Len=0 TSval=694547479 TSecr=2817198148"
"187","0.180675112","23.3.118.55","192.168.1.118","TCP","2962","443 → 43576 [ACK] Seq=109086 Ack=769 Win=260 Len=2896 TSval=2817198149 TSecr=694547453 [TCP segment of a reassembled PDU]"
"188","0.180745375","192.168.1.118","23.3.118.55","TCP","66","43576 → 443 [ACK] Seq=769 Ack=111982 Win=2251 Len=0 TSval=694547479 TSecr=2817198149"
"189","0.181894262","23.3.118.55","192.168.1.118","TCP","2962","443 → 43576 [ACK] Seq=111982 Ack=769 Win=260 Len=2896 TSval=2817198151 TSecr=694547453 [TCP segment of a reassembled PDU]"
"190","0.182006600","192.168.1.118","23.3.118.55","TCP","66","43576 → 443 [ACK] Seq=769 Ack=114878 Win=2296 Len=0 TSval=694547480 TSecr=2817198151"
"191","0.182069262","23.3.118.55","192.168.1.118","TLSv1.2","201","Application Data"
"192","0.182142262","192.168.1.118","23.3.118.55","TCP","66","43576 → 443 [ACK] Seq=769 Ack=115013 Win=2296 Len=0 TSval=694547480 TSecr=2817198154"
"193","0.182231187","23.3.118.55","192.168.1.118","TCP","1514","[TCP segment of a reassembled PDU]"
"194","0.188045587","23.3.118.55","192.168.1.118","TLSv1.2","3194","Application Data"
"195","0.188159750","192.168.1.118","23.3.118.55","TCP","66","43578 → 443 [ACK] Seq=1547 Ack=114343 Win=1654 Len=0 TSval=694547486 TSecr=2817198159"
"196","0.188905662","23.3.118.55","192.168.1.118","TLSv1.2","1195","Application Data"
"197","0.189020112","23.3.118.55","192.168.1.118","TLSv1.2","1588","Application Data"
"198","0.189084687","23.3.118.55","192.168.1.118","TCP","66","443 → 43574 [ACK] Seq=122299 Ack=828 Win=273 Len=0 TSval=2817198163 TSecr=694547468"
"199","0.212432687","23.3.118.55","192.168.1.118","TLSv1.2","441","Application Data"
"200","0.229876987","192.168.1.118","23.3.118.55","TCP","66","43580 → 443 [ACK] Seq=1568 Ack=29150 Win=490 Len=0 TSval=694547528 TSecr=2817198161"
"201","0.230007650","192.168.1.118","23.3.118.55","TCP","66","43552 → 443 [ACK] Seq=2342 Ack=52910 Win=1486 Len=0 TSval=694547528 TSecr=2817198161"
"202","0.253771125","192.168.1.118","23.3.118.55","TCP","66","43574 → 443 [ACK] Seq=828 Ack=122674 Win=2412 Len=0 TSval=694547552 TSecr=2817198191"
"203","0.305815450","192.168.1.118","23.3.118.55","TLSv1.2","832","Application Data"
"204","0.315027162","192.168.1.118","209.18.47.62","DNS","84","Standard query 0xb078 A www.googletagmanager.com"
"205","0.325848600","192.168.1.118","209.18.47.62","DNS","75","Standard query 0x08a9 A www.youtube.com"
"206","0.338356000","23.3.118.55","192.168.1.118","TCP","1514","[TCP segment of a reassembled PDU]"
"207","0.338434875","192.168.1.118","23.3.118.55","TCP","66","43552 → 443 [ACK] Seq=3108 Ack=54358 Win=1508 Len=0 TSval=694547637 TSecr=2817198315"
"208","0.347160987","23.3.118.55","192.168.1.118","TCP","5858","443 → 43552 [ACK] Seq=54358 Ack=3108 Win=343 Len=5792 TSval=2817198315 TSecr=694547604 [TCP segment of a reassembled PDU]"
"209","0.347228537","192.168.1.118","23.3.118.55","TCP","66","43552 → 443 [ACK] Seq=3108 Ack=60150 Win=1599 Len=0 TSval=694547645 TSecr=2817198315"
"210","0.347341825","23.3.118.55","192.168.1.118","TCP","1514","443 → 43552 [ACK] Seq=60150 Ack=3108 Win=343 Len=1448 TSval=2817198315 TSecr=694547604 [TCP segment of a reassembled PDU]"
"211","0.347357937","192.168.1.118","23.3.118.55","TCP","66","43552 → 443 [ACK] Seq=3108 Ack=61598 Win=1621 Len=0 TSval=694547646 TSecr=2817198315"
"212","0.347381362","23.3.118.55","192.168.1.118","TCP","2962","443 → 43552 [ACK] Seq=61598 Ack=3108 Win=343 Len=2896 TSval=2817198316 TSecr=694547604 [TCP segment of a reassembled PDU]"
"213","0.347403212","192.168.1.118","23.3.118.55","TCP","66","43552 → 443 [ACK] Seq=3108 Ack=64494 Win=1667 Len=0 TSval=694547646 TSecr=2817198316"
"214","0.347424937","23.3.118.55","192.168.1.118","TCP","2962","443 → 43552 [ACK] Seq=64494 Ack=3108 Win=343 Len=2896 TSval=2817198318 TSecr=694547604 [TCP segment of a reassembled PDU]"
"215","0.347440900","192.168.1.118","23.3.118.55","TCP","66","43552 → 443 [ACK] Seq=3108 Ack=67390 Win=1712 Len=0 TSval=694547646 TSecr=2817198318"
"216","0.347459687","23.3.118.55","192.168.1.118","TLSv1.2","2962","Application Data [TCP segment of a reassembled PDU]"
"217","0.347492562","192.168.1.118","23.3.118.55","TCP","66","43552 → 443 [ACK] Seq=3108 Ack=70286 Win=1757 Len=0 TSval=694547646 TSecr=2817198319"
"218","0.350361587","23.3.118.55","192.168.1.118","TCP","2962","443 → 43552 [ACK] Seq=70286 Ack=3108 Win=343 Len=2896 TSval=2817198321 TSecr=694547604 [TCP segment of a reassembled PDU]"
"219","0.350461012","192.168.1.118","23.3.118.55","TCP","66","43552 → 443 [ACK] Seq=3108 Ack=73182 Win=1802 Len=0 TSval=694547649 TSecr=2817198321"
"220","0.352691700","23.3.118.55","192.168.1.118","TCP","2962","443 → 43552 [ACK] Seq=73182 Ack=3108 Win=343 Len=2896 TSval=2817198323 TSecr=694547604 [TCP segment of a reassembled PDU]"
"221","0.352778675","192.168.1.118","23.3.118.55","TCP","66","43552 → 443 [ACK] Seq=3108 Ack=76078 Win=1848 Len=0 TSval=694547651 TSecr=2817198323"
"222","0.352831500","23.3.118.55","192.168.1.118","TCP","2962","443 → 43552 [ACK] Seq=76078 Ack=3108 Win=343 Len=2896 TSval=2817198325 TSecr=694547604 [TCP segment of a reassembled PDU]"
"223","0.352855762","192.168.1.118","23.3.118.55","TCP","66","43552 → 443 [ACK] Seq=3108 Ack=78974 Win=1893 Len=0 TSval=694547651 TSecr=2817198325"
"224","0.353242262","23.3.118.55","192.168.1.118","TCP","2962","443 → 43552 [ACK] Seq=78974 Ack=3108 Win=343 Len=2896 TSval=2817198327 TSecr=694547604 [TCP segment of a reassembled PDU]"
"225","0.353259262","192.168.1.118","23.3.118.55","TCP","66","43552 → 443 [ACK] Seq=3108 Ack=81870 Win=1938 Len=0 TSval=694547651 TSecr=2817198327"
"226","0.358452725","23.3.118.55","192.168.1.118","TCP","1514","443 → 43552 [ACK] Seq=81870 Ack=3108 Win=343 Len=1448 TSval=2817198329 TSecr=694547604 [TCP segment of a reassembled PDU]"
"227","0.358536350","192.168.1.118","23.3.118.55","TCP","66","43552 → 443 [ACK] Seq=3108 Ack=83318 Win=1961 Len=0 TSval=694547657 TSecr=2817198329"
"228","0.360345137","209.18.47.62","192.168.1.118","DNS","144","Standard query response 0xb078 A www.googletagmanager.com CNAME www-googletagmanager.l.google.com A 172.217.6.232"
"229","0.360414212","23.3.118.55","192.168.1.118","TCP","1514","443 → 43552 [ACK] Seq=83318 Ack=3108 Win=343 Len=1448 TSval=2817198329 TSecr=694547604 [TCP segment of a reassembled PDU]"
"230","0.360468525","192.168.1.118","23.3.118.55","TCP","66","43552 → 443 [ACK] Seq=3108 Ack=84766 Win=1983 Len=0 TSval=694547659 TSecr=2817198329"
"231","0.360536462","209.18.47.62","192.168.1.118","DNS","333","Standard query response 0x08a9 A www.youtube.com CNAME youtube-ui.l.google.com A 142.250.64.110 A 172.217.9.238 A 172.217.10.14 A 172.217.10.46 A 172.217.10.110 A 172.217.10.142 A 172.217.3.110 A 172.217.12.142 A 172.217.6.206 A 172.217.6.238 A 172.217.11.14 A 172.217.11.46 A 172.217.12.174 A 172.217.12.206"
"232","0.360574500","23.3.118.55","192.168.1.118","TLSv1.2","2962","Application Data, Application Data"
"233","0.360588737","192.168.1.118","209.18.47.62","DNS","84","Standard query 0xd4c4 AAAA www.googletagmanager.com"
"234","0.360628350","192.168.1.118","23.3.118.55","TCP","66","43552 → 443 [ACK] Seq=3108 Ack=87662 Win=2029 Len=0 TSval=694547659 TSecr=2817198331"
"235","0.360659900","23.3.118.55","192.168.1.118","TCP","2962","443 → 43552 [ACK] Seq=87662 Ack=3108 Win=343 Len=2896 TSval=2817198332 TSecr=694547604 [TCP segment of a reassembled PDU]"
"236","0.360682275","192.168.1.118","23.3.118.55","TCP","66","43552 → 443 [ACK] Seq=3108 Ack=90558 Win=2074 Len=0 TSval=694547659 TSecr=2817198332"
"237","0.360695400","192.168.1.118","209.18.47.62","DNS","75","Standard query 0xe424 AAAA www.youtube.com"
"238","0.361522787","23.3.118.55","192.168.1.118","TCP","2962","443 → 43552 [ACK] Seq=90558 Ack=3108 Win=343 Len=2896 TSval=2817198334 TSecr=694547604 [TCP segment of a reassembled PDU]"
"239","0.361612812","192.168.1.118","23.3.118.55","TCP","66","43552 → 443 [ACK] Seq=3108 Ack=93454 Win=2119 Len=0 TSval=694547660 TSecr=2817198334"
"240","0.364470087","23.3.118.55","192.168.1.118","TCP","2962","443 → 43552 [ACK] Seq=93454 Ack=3108 Win=343 Len=2896 TSval=2817198336 TSecr=694547604 [TCP segment of a reassembled PDU]"
"241","0.364571812","192.168.1.118","23.3.118.55","TCP","66","43552 → 443 [ACK] Seq=3108 Ack=96350 Win=2164 Len=0 TSval=694547663 TSecr=2817198336"
"242","0.365635312","23.3.118.55","192.168.1.118","TCP","2962","443 → 43552 [ACK] Seq=96350 Ack=3108 Win=343 Len=2896 TSval=2817198338 TSecr=694547604 [TCP segment of a reassembled PDU]"
"243","0.365706762","192.168.1.118","23.3.118.55","TCP","66","43552 → 443 [ACK] Seq=3108 Ack=99246 Win=2210 Len=0 TSval=694547664 TSecr=2817198338"
"244","0.365764762","23.3.118.55","192.168.1.118","TCP","2962","443 → 43552 [ACK] Seq=99246 Ack=3108 Win=343 Len=2896 TSval=2817198340 TSecr=694547651 [TCP segment of a reassembled PDU]"
"245","0.365795587","192.168.1.118","23.3.118.55","TCP","66","43552 → 443 [ACK] Seq=3108 Ack=102142 Win=2255 Len=0 TSval=694547664 TSecr=2817198340"
"246","0.367336075","23.3.118.55","192.168.1.118","TLSv1.2","2962","Application Data [TCP segment of a reassembled PDU]"
"247","0.368618962","192.168.1.118","23.3.118.55","TCP","66","43552 → 443 [ACK] Seq=3108 Ack=105038 Win=2237 Len=0 TSval=694547667 TSecr=2817198341"
"248","0.370556875","23.3.118.55","192.168.1.118","TCP","2962","443 → 43552 [ACK] Seq=105038 Ack=3108 Win=343 Len=2896 TSval=2817198343 TSecr=694547651 [TCP segment of a reassembled PDU]"
"249","0.370624525","192.168.1.118","23.3.118.55","TCP","66","43552 → 443 [ACK] Seq=3108 Ack=107934 Win=2300 Len=0 TSval=694547669 TSecr=2817198343"
"250","0.370674537","23.3.118.55","192.168.1.118","TCP","2962","443 → 43552 [ACK] Seq=107934 Ack=3108 Win=343 Len=2896 TSval=2817198344 TSecr=694547651 [TCP segment of a reassembled PDU]"
"251","0.370699900","192.168.1.118","23.3.118.55","TCP","66","43552 → 443 [ACK] Seq=3108 Ack=110830 Win=2345 Len=0 TSval=694547669 TSecr=2817198344"
"252","0.376668412","23.3.118.55","192.168.1.118","TCP","1514","443 → 43552 [ACK] Seq=110830 Ack=3108 Win=343 Len=1448 TSval=2817198345 TSecr=694547651 [TCP segment of a reassembled PDU]"
"253","0.376732062","192.168.1.118","23.3.118.55","TCP","66","43552 → 443 [ACK] Seq=3108 Ack=112278 Win=2368 Len=0 TSval=694547675 TSecr=2817198345"
"254","0.380685950","23.3.118.55","192.168.1.118","TCP","1514","443 → 43552 [ACK] Seq=112278 Ack=3108 Win=343 Len=1448 TSval=2817198345 TSecr=694547651 [TCP segment of a reassembled PDU]"
"255","0.380755862","192.168.1.118","23.3.118.55","TCP","66","43552 → 443 [ACK] Seq=3108 Ack=113726 Win=2391 Len=0 TSval=694547679 TSecr=2817198345"
"256","0.380797550","23.3.118.55","192.168.1.118","TLSv1.2","1822","Application Data"
"257","0.380820775","192.168.1.118","23.3.118.55","TCP","66","43552 → 443 [ACK] Seq=3108 Ack=115482 Win=2418 Len=0 TSval=694547679 TSecr=2817198346"
"258","0.381272512","209.18.47.62","192.168.1.118","DNS","156","Standard query response 0xd4c4 AAAA www.googletagmanager.com CNAME www-googletagmanager.l.google.com AAAA 2607:f8b0:4006:805::2008"
"259","0.381303937","209.18.47.62","192.168.1.118","DNS","137","Standard query response 0xe424 AAAA www.youtube.com CNAME youtube-ui.l.google.com AAAA 2607:f8b0:4006:81a::200e"
"260","0.381926162","192.168.1.118","172.217.6.232","TCP","74","45330 → 443 [SYN] Seq=0 Win=64240 Len=0 MSS=1460 SACK_PERM=1 TSval=2735062355 TSecr=0 WS=128"
"261","0.415853362","172.217.6.232","192.168.1.118","TCP","74","443 → 45330 [SYN, ACK] Seq=0 Ack=1 Win=60192 Len=0 MSS=1380 SACK_PERM=1 TSval=1639148897 TSecr=2735062355 WS=256"
"262","0.416017137","192.168.1.118","172.217.6.232","TCP","66","45330 → 443 [ACK] Seq=1 Ack=1 Win=64256 Len=0 TSval=2735062389 TSecr=1639148897"
"263","0.519556387","192.168.1.118","142.250.64.110","TCP","74","37962 → 443 [SYN] Seq=0 Win=64240 Len=0 MSS=1460 SACK_PERM=1 TSval=2364771961 TSecr=0 WS=128"
"264","0.533962925","192.168.1.118","172.217.6.232","TLSv1","583","Client Hello"
"265","0.542520687","142.250.64.110","192.168.1.118","TCP","74","443 → 37962 [SYN, ACK] Seq=0 Ack=1 Win=60192 Len=0 MSS=1380 SACK_PERM=1 TSval=2578851412 TSecr=2364771961 WS=256"
"266","0.542702612","192.168.1.118","142.250.64.110","TCP","66","37962 → 443 [ACK] Seq=1 Ack=1 Win=64256 Len=0 TSval=2364771984 TSecr=2578851412"
"267","0.565820262","172.217.6.232","192.168.1.118","TCP","66","443 → 45330 [ACK] Seq=1 Ack=518 Win=61440 Len=0 TSval=1639149046 TSecr=2735062507"
"268","0.572344612","172.217.6.232","192.168.1.118","TLSv1.2","1484","Server Hello"
"269","0.572436687","192.168.1.118","172.217.6.232","TCP","66","45330 → 443 [ACK] Seq=518 Ack=1419 Win=63104 Len=0 TSval=2735062546 TSecr=1639149053"
"270","0.575594187","172.217.6.232","192.168.1.118","TLSv1.2","1520","Certificate, Server Key Exchange, Server Hello Done"
"271","0.575667887","192.168.1.118","172.217.6.232","TCP","66","45330 → 443 [ACK] Seq=518 Ack=2873 Win=61696 Len=0 TSval=2735062549 TSecr=1639149053"
"272","0.584504262","192.168.1.118","142.250.64.110","TLSv1","583","Client Hello"
"273","0.586746437","192.168.1.118","172.217.6.232","TLSv1.2","192","Client Key Exchange, Change Cipher Spec, Encrypted Handshake Message"
"274","0.605546137","172.217.6.232","192.168.1.118","TLSv1.2","117","Change Cipher Spec, Encrypted Handshake Message"
"275","0.605938975","192.168.1.118","172.217.6.232","TLSv1.2","267","Application Data"
"276","0.606339275","142.250.64.110","192.168.1.118","TCP","66","443 → 37962 [ACK] Seq=1 Ack=518 Win=61440 Len=0 TSval=2578851481 TSecr=2364772026"
"277","0.612815850","142.250.64.110","192.168.1.118","TLSv1.2","1484","Server Hello"
"278","0.612899962","192.168.1.118","142.250.64.110","TCP","66","37962 → 443 [ACK] Seq=518 Ack=1419 Win=63104 Len=0 TSval=2364772054 TSecr=2578851487"
"279","0.614328337","142.250.64.110","192.168.1.118","TLSv1.2","2425","Certificate, Server Key Exchange, Server Hello Done"
"280","0.614411262","192.168.1.118","142.250.64.110","TCP","66","37962 → 443 [ACK] Seq=518 Ack=3778 Win=61056 Len=0 TSval=2364772056 TSecr=2578851487"
"281","0.619759925","192.168.1.118","142.250.64.110","TLSv1.2","192","Client Key Exchange, Change Cipher Spec, Encrypted Handshake Message"
"282","0.650937175","172.217.6.232","192.168.1.118","TCP","66","443 → 45330 [ACK] Seq=2924 Ack=845 Win=62464 Len=0 TSval=1639149132 TSecr=2735062579"
"283","0.657407700","142.250.64.110","192.168.1.118","TLSv1.2","117","Change Cipher Spec, Encrypted Handshake Message"
"284","0.657907237","192.168.1.118","142.250.64.110","TLSv1.2","325","Application Data"
"285","0.665221675","172.217.6.232","192.168.1.118","TLSv1.2","1067","Application Data"
"286","0.666299100","172.217.6.232","192.168.1.118","TLSv1.2","100","Application Data"
"287","0.666576350","192.168.1.118","172.217.6.232","TCP","66","45330 → 443 [ACK] Seq=845 Ack=3959 Win=64128 Len=0 TSval=2735062640 TSecr=1639149143"
"288","0.677788075","142.250.64.110","192.168.1.118","TCP","66","443 → 37962 [ACK] Seq=3829 Ack=903 Win=62464 Len=0 TSval=2578851553 TSecr=2364772099"
"289","0.954767375","192.168.1.104","255.255.255.255","UDP","217","49154 → 6666 Len=175"
"290","0.954826150","142.250.64.110","192.168.1.118","TLSv1.2","1484","Application Data"
"291","0.957573812","142.250.64.110","192.168.1.118","TLSv1.2","2902","Application Data, Application Data"
"292","0.957653087","142.250.64.110","192.168.1.118","TLSv1.2","2902","Application Data, Application Data"
"293","0.957683100","142.250.64.110","192.168.1.118","TLSv1.2","2902","Application Data, Application Data"
"294","0.957700250","142.250.64.110","192.168.1.118","TLSv1.2","2566","Application Data, Application Data"
"295","0.957714512","142.250.64.110","192.168.1.118","TLSv1.2","147","Application Data"
"296","0.957726612","142.250.64.110","192.168.1.118","TLSv1.2","100","Application Data"
"297","0.957738425","142.250.64.110","192.168.1.118","TCP","100","[TCP Retransmission] 443 → 37962 [PSH, ACK] Seq=16336 Ack=903 Win=62464 Len=34 TSval=2578851814 TSecr=2364772099"
"298","0.957767612","192.168.1.118","142.250.64.110","TCP","78","37962 → 443 [ACK] Seq=903 Ack=16370 Win=51712 Len=0 TSval=2364772399 TSecr=2578851736 SLE=16336 SRE=16370"
"299","1.026271112","192.168.1.118","142.250.64.110","TLSv1.2","341","Application Data"
"300","1.045598625","142.250.64.110","192.168.1.118","TCP","66","443 → 37962 [ACK] Seq=16370 Ack=1178 Win=63488 Len=0 TSval=2578851918 TSecr=2364772467"
"301","1.064064837","142.250.64.110","192.168.1.118","TLSv1.2","1484","Application Data"
"302","1.064126262","192.168.1.118","142.250.64.110","TCP","66","37962 → 443 [ACK] Seq=1178 Ack=17788 Win=63104 Len=0 TSval=2364772505 TSecr=2578851932"
"303","1.068443600","142.250.64.110","192.168.1.118","TLSv1.2","729","Application Data"
"304","1.068541512","192.168.1.118","142.250.64.110","TCP","66","37962 → 443 [ACK] Seq=1178 Ack=18451 Win=63104 Len=0 TSval=2364772510 TSecr=2578851933"
"305","1.068914550","192.168.1.118","142.250.64.110","TLSv1.2","97","Encrypted Alert"
"306","1.070922812","192.168.1.118","142.250.64.110","TCP","66","37962 → 443 [FIN, ACK] Seq=1209 Ack=18451 Win=64128 Len=0 TSval=2364772512 TSecr=2578851933"
"307","1.092881012","142.250.64.110","192.168.1.118","TCP","66","443 → 37962 [FIN, ACK] Seq=18451 Ack=1210 Win=63488 Len=0 TSval=2578851966 TSecr=2364772510"
"308","1.093017387","192.168.1.118","142.250.64.110","TCP","66","37962 → 443 [ACK] Seq=1210 Ack=18452 Win=64128 Len=0 TSval=2364772534 TSecr=2578851966"
"309","2.380091237","192.168.1.118","192.168.1.102","TCP","176","40160 → 8009 [PSH, ACK] Seq=1 Ack=1 Win=501 Len=110 TSval=2234485550 TSecr=2431674 [TCP segment of a reassembled PDU]"
"310","2.386196475","192.168.1.102","192.168.1.118","TCP","176","8009 → 40160 [PSH, ACK] Seq=1 Ack=111 Win=344 Len=110 TSval=2432175 TSecr=2234485550 [TCP segment of a reassembled PDU]"
"311","2.386370237","192.168.1.118","192.168.1.102","TCP","66","40160 → 8009 [ACK] Seq=111 Ack=111 Win=501 Len=0 TSval=2234485556 TSecr=2432175"
"312","5.152721687","192.168.1.102","224.0.0.251","MDNS","183","Standard query response 0x0000 SRV, cache flush 0 0 8009 2c3f16b2-da5c-4b6f-d6cf-bfba61c12490.local"
"313","6.894339275","192.168.1.104","255.255.255.255","UDP","217","49154 → 6666 Len=175"
"314","7.392419537","192.168.1.118","192.168.1.102","TCP","176","40160 → 8009 [PSH, ACK] Seq=111 Ack=111 Win=501 Len=110 TSval=2234490563 TSecr=2432175 [TCP segment of a reassembled PDU]"
"315","7.410723287","192.168.1.102","192.168.1.118","TCP","176","8009 → 40160 [PSH, ACK] Seq=111 Ack=221 Win=344 Len=110 TSval=2432676 TSecr=2234490563 [TCP segment of a reassembled PDU]"
"316","7.410862400","192.168.1.118","192.168.1.102","TCP","66","40160 → 8009 [ACK] Seq=221 Ack=221 Win=501 Len=0 TSval=2234490581 TSecr=2432676"
"317","9.862711812","192.168.1.104","255.255.255.255","UDP","217","49154 → 6666 Len=175"
