frame.number,_ws.col.Time,_ws.col.Source,_ws.col.Destination,_ws.col.Protocol,frame.len,_ws.col.Info
"1","0.000000000","209.18.47.62","192.168.1.118","DNS","133","Standard query response 0x76c6 A styles.redditmedia.com CNAME reddit.map.fastly.net A 199.232.37.140"
"2","0.000161981","192.168.1.118","209.18.47.62","DNS","82","Standard query 0x8e71 AAAA styles.redditmedia.com"
"3","0.002544552","209.18.47.62","192.168.1.118","DNS","126","Standard query response 0xfed6 A preview.redd.it CNAME reddit.map.fastly.net A 199.232.37.140"
"4","0.002631517","209.18.47.62","192.168.1.118","DNS","135","Standard query response 0x6abd A b.thumbs.redditmedia.com CNAME reddit.map.fastly.net A 199.232.37.140"
"5","0.002654768","199.232.37.140","192.168.1.118","TCP","74","443 → 41412 [SYN, ACK] Seq=0 Ack=1 Win=27040 Len=0 MSS=1364 SACK_PERM=1 TSval=251448162 TSecr=18543597 WS=512"
"6","0.002716583","192.168.1.118","199.232.37.140","TCP","66","41412 → 443 [ACK] Seq=1 Ack=1 Win=229 Len=0 TSval=18543634 TSecr=251448162"
"7","0.002758247","199.232.37.140","192.168.1.118","TCP","74","443 → 41411 [SYN, ACK] Seq=0 Ack=1 Win=27040 Len=0 MSS=1364 SACK_PERM=1 TSval=249981906 TSecr=18543597 WS=512"
"8","0.002783448","192.168.1.118","199.232.37.140","TCP","66","41411 → 443 [ACK] Seq=1 Ack=1 Win=229 Len=0 TSval=18543634 TSecr=249981906"
"9","0.002894777","192.168.1.118","209.18.47.62","DNS","75","Standard query 0x1684 AAAA preview.redd.it"
"10","0.002954879","192.168.1.118","209.18.47.62","DNS","84","Standard query 0xba5c AAAA b.thumbs.redditmedia.com"
"11","0.006620307","192.168.1.118","199.232.37.140","TCP","66","41398 → 443 [ACK] Seq=1 Ack=1 Win=1318 Len=0 TSval=18543638 TSecr=2787204509"
"12","0.024534746","209.18.47.62","192.168.1.118","DNS","175","Standard query response 0x8e71 AAAA styles.redditmedia.com CNAME reddit.map.fastly.net SOA ns1.fastly.net"
"13","0.031160578","192.168.1.118","199.232.37.140","TLSv1","583","Client Hello"
"14","0.033784770","209.18.47.62","192.168.1.118","DNS","171","Standard query response 0x1684 AAAA preview.redd.it CNAME reddit.map.fastly.net SOA ns1.fastly.net"
"15","0.041718923","209.18.47.62","192.168.1.118","DNS","177","Standard query response 0xba5c AAAA b.thumbs.redditmedia.com CNAME reddit.map.fastly.net SOA ns1.fastly.net"
"16","0.047746971","199.232.37.140","192.168.1.118","TCP","66","443 → 41410 [ACK] Seq=1 Ack=518 Win=55 Len=0 TSval=2787190711 TSecr=18543662"
"17","0.050060815","199.232.37.140","192.168.1.118","TLSv1.2","1418","Server Hello"
"18","0.050140993","192.168.1.118","199.232.37.140","TCP","66","41410 → 443 [ACK] Seq=518 Ack=1353 Win=250 Len=0 TSval=18543681 TSecr=2787190712"
"19","0.052590716","199.232.37.140","192.168.1.118","TLSv1.2","1952","Certificate, Server Key Exchange, Server Hello Done"
"20","0.052677781","192.168.1.118","199.232.37.140","TCP","66","41410 → 443 [ACK] Seq=518 Ack=3239 Win=279 Len=0 TSval=18543684 TSecr=2787190712"
"21","0.055490480","192.168.1.118","199.232.37.140","TLSv1","583","Client Hello"
"22","0.076528454","192.168.1.118","199.232.37.140","TLSv1","583","Client Hello"
"23","0.077282518","192.168.1.118","199.232.37.140","TCP","74","41413 → 443 [SYN] Seq=0 Win=29200 Len=0 MSS=1460 SACK_PERM=1 TSval=18543708 TSecr=0 WS=128"
"24","0.077373121","192.168.1.118","199.232.37.140","TCP","74","41414 → 443 [SYN] Seq=0 Win=29200 Len=0 MSS=1460 SACK_PERM=1 TSval=18543708 TSecr=0 WS=128"
"25","0.077689044","192.168.1.118","199.232.37.140","TCP","74","41415 → 443 [SYN] Seq=0 Win=29200 Len=0 MSS=1460 SACK_PERM=1 TSval=18543709 TSecr=0 WS=128"
"26","0.079875683","199.232.37.140","192.168.1.118","TCP","66","443 → 41411 [ACK] Seq=1 Ack=518 Win=28160 Len=0 TSval=249981925 TSecr=18543686"
"27","0.080825479","192.168.1.118","199.232.37.140","TLSv1.2","192","Client Key Exchange, Change Cipher Spec, Encrypted Handshake Message"
"28","0.081360585","199.232.37.140","192.168.1.118","TLSv1.2","3304","Server Hello, Certificate, Server Key Exchange, Server Hello Done"
"29","0.081447476","192.168.1.118","199.232.37.140","TCP","66","41411 → 443 [ACK] Seq=518 Ack=3239 Win=279 Len=0 TSval=18543712 TSecr=249981925"
"30","0.090473492","199.232.37.140","192.168.1.118","TCP","66","443 → 41412 [ACK] Seq=1 Ack=518 Win=28160 Len=0 TSval=251448184 TSecr=18543707"
"31","0.091691359","192.168.1.118","199.232.37.140","TLSv1.2","192","Client Key Exchange, Change Cipher Spec, Encrypted Handshake Message"
"32","0.092023608","192.168.1.118","199.232.37.140","TCP","74","41416 → 443 [SYN] Seq=0 Win=29200 Len=0 MSS=1460 SACK_PERM=1 TSval=18543723 TSecr=0 WS=128"
"33","0.093068370","199.232.37.140","192.168.1.118","TLSv1.2","1418","Server Hello"
"34","0.093149598","192.168.1.118","199.232.37.140","TCP","66","41412 → 443 [ACK] Seq=518 Ack=1353 Win=250 Len=0 TSval=18543724 TSecr=251448185"
"35","0.096615107","199.232.37.140","192.168.1.118","TLSv1.2","1952","Certificate, Server Key Exchange, Server Hello Done"
"36","0.096694284","192.168.1.118","199.232.37.140","TCP","66","41412 → 443 [ACK] Seq=518 Ack=3239 Win=279 Len=0 TSval=18543728 TSecr=251448185"
"37","0.099286563","199.232.37.140","192.168.1.118","TCP","74","443 → 41415 [SYN, ACK] Seq=0 Ack=1 Win=27040 Len=0 MSS=1364 SACK_PERM=1 TSval=834384379 TSecr=18543709 WS=512"
"38","0.099395091","192.168.1.118","199.232.37.140","TCP","66","41415 → 443 [ACK] Seq=1 Ack=1 Win=29312 Len=0 TSval=18543730 TSecr=834384379"
"39","0.102507350","199.232.37.140","192.168.1.118","TLSv1.2","117","Change Cipher Spec, Encrypted Handshake Message"
"40","0.103263489","199.232.37.140","192.168.1.118","TCP","74","443 → 41414 [SYN, ACK] Seq=0 Ack=1 Win=27040 Len=0 MSS=1364 SACK_PERM=1 TSval=252170893 TSecr=18543708 WS=512"
"41","0.103352917","192.168.1.118","199.232.37.140","TCP","66","41414 → 443 [ACK] Seq=1 Ack=1 Win=29312 Len=0 TSval=18543734 TSecr=252170893"
"42","0.103400144","199.232.37.140","192.168.1.118","TCP","74","443 → 41413 [SYN, ACK] Seq=0 Ack=1 Win=27040 Len=0 MSS=1364 SACK_PERM=1 TSval=2788225205 TSecr=18543708 WS=512"
"43","0.103428733","192.168.1.118","199.232.37.140","TCP","66","41413 → 443 [ACK] Seq=1 Ack=1 Win=29312 Len=0 TSval=18543734 TSecr=2788225205"
"44","0.110241696","199.232.37.140","192.168.1.118","TLSv1.2","117","Change Cipher Spec, Encrypted Handshake Message"
"45","0.119442706","199.232.37.140","192.168.1.118","TCP","74","443 → 41416 [SYN, ACK] Seq=0 Ack=1 Win=27040 Len=0 MSS=1364 SACK_PERM=1 TSval=3889648639 TSecr=18543723 WS=512"
"46","0.119564685","192.168.1.118","199.232.37.140","TCP","66","41416 → 443 [ACK] Seq=1 Ack=1 Win=29312 Len=0 TSval=18543750 TSecr=3889648639"
"47","0.140530219","192.168.1.118","199.232.37.140","TLSv1","583","Client Hello"
"48","0.140960284","192.168.1.118","199.232.37.140","TLSv1.2","272","Application Data"
"49","0.141183041","192.168.1.118","199.232.37.140","TLSv1.2","274","Application Data"
"50","0.143199037","192.168.1.118","199.232.37.140","TLSv1.2","192","Client Key Exchange, Change Cipher Spec, Encrypted Handshake Message"
"51","0.155926582","199.232.37.140","192.168.1.118","TCP","66","443 → 41415 [ACK] Seq=1 Ack=518 Win=28160 Len=0 TSval=834384393 TSecr=18543771"
"52","0.157805348","199.232.37.140","192.168.1.118","TLSv1.2","1418","Server Hello"
"53","0.157892226","192.168.1.118","199.232.37.140","TCP","66","41415 → 443 [ACK] Seq=518 Ack=1353 Win=32000 Len=0 TSval=18543789 TSecr=834384393"
"54","0.159497495","199.232.37.140","192.168.1.118","TLSv1.2","1962","Certificate, Server Key Exchange, Server Hello Done"
"55","0.159596723","192.168.1.118","199.232.37.140","TCP","66","41415 → 443 [ACK] Seq=518 Ack=3249 Win=35712 Len=0 TSval=18543791 TSecr=834384393"
"56","0.163196412","192.168.1.118","199.232.37.140","TLSv1","583","Client Hello"
"57","0.166061025","199.232.37.140","192.168.1.118","TLSv1.2","117","Change Cipher Spec, Encrypted Handshake Message"
"58","0.166146765","192.168.1.118","199.232.37.140","TCP","66","41412 → 443 [ACK] Seq=644 Ack=3290 Win=279 Len=0 TSval=18543797 TSecr=251448203"
"59","0.167512950","199.232.37.140","192.168.1.118","TLSv1.2","1418","Application Data"
"60","0.168749656","199.232.37.140","192.168.1.118","TLSv1.2","1179","Application Data, Application Data"
"61","0.168822209","192.168.1.118","199.232.37.140","TCP","66","41411 → 443 [ACK] Seq=852 Ack=5755 Win=321 Len=0 TSval=18543800 TSecr=249981948"
"62","0.168886349","199.232.37.140","192.168.1.118","TLSv1.2","2937","Application Data, Application Data, Application Data"
"63","0.168921450","192.168.1.118","199.232.37.140","TCP","66","41410 → 443 [ACK] Seq=850 Ack=6161 Win=324 Len=0 TSval=18543800 TSecr=2787190741"
"64","0.180511230","192.168.1.118","199.232.37.140","TLSv1","583","Client Hello"
"65","0.186038624","199.232.37.140","192.168.1.118","TCP","66","443 → 41413 [ACK] Seq=1 Ack=518 Win=28160 Len=0 TSval=2788225226 TSecr=18543794"
"66","0.187303806","199.232.37.140","192.168.1.118","TLSv1.2","1418","Server Hello"
"67","0.187387284","192.168.1.118","199.232.37.140","TCP","66","41413 → 443 [ACK] Seq=518 Ack=1353 Win=32000 Len=0 TSval=18543818 TSecr=2788225227"
"68","0.188753844","199.232.37.140","192.168.1.118","TLSv1.2","1984","Certificate, Server Key Exchange, Server Hello Done"
"69","0.188831072","192.168.1.118","199.232.37.140","TCP","66","41413 → 443 [ACK] Seq=518 Ack=3271 Win=35840 Len=0 TSval=18543820 TSecr=2788225227"
"70","0.200510030","199.232.37.140","192.168.1.118","TCP","66","443 → 41414 [ACK] Seq=1 Ack=518 Win=28160 Len=0 TSval=252170918 TSecr=18543811"
"71","0.201328596","192.168.1.118","199.232.37.140","TLSv1","583","Client Hello"
"72","0.201678521","192.168.1.118","199.232.37.140","TCP","74","41417 → 443 [SYN] Seq=0 Win=29200 Len=0 MSS=1460 SACK_PERM=1 TSval=18543833 TSecr=0 WS=128"
"73","0.201804888","199.232.37.140","192.168.1.118","TLSv1.2","1418","Server Hello"
"74","0.201855852","192.168.1.118","199.232.37.140","TCP","74","41418 → 443 [SYN] Seq=0 Win=29200 Len=0 MSS=1460 SACK_PERM=1 TSval=18543833 TSecr=0 WS=128"
"75","0.201882978","192.168.1.118","199.232.37.140","TCP","66","41414 → 443 [ACK] Seq=518 Ack=1353 Win=32000 Len=0 TSval=18543833 TSecr=252170918"
"76","0.201974382","192.168.1.118","199.232.37.140","TCP","74","41419 → 443 [SYN] Seq=0 Win=29200 Len=0 MSS=1460 SACK_PERM=1 TSval=18543833 TSecr=0 WS=128"
"77","0.202083885","192.168.1.118","199.232.37.140","TCP","74","41420 → 443 [SYN] Seq=0 Win=29200 Len=0 MSS=1460 SACK_PERM=1 TSval=18543833 TSecr=0 WS=128"
"78","0.202187377","192.168.1.118","199.232.37.140","TCP","74","41421 → 443 [SYN] Seq=0 Win=29200 Len=0 MSS=1460 SACK_PERM=1 TSval=18543833 TSecr=0 WS=128"
"79","0.202295868","192.168.1.118","199.232.37.140","TCP","74","41422 → 443 [SYN] Seq=0 Win=29200 Len=0 MSS=1460 SACK_PERM=1 TSval=18543833 TSecr=0 WS=128"
"80","0.204532009","192.168.1.118","199.232.37.140","TLSv1.2","192","Client Key Exchange, Change Cipher Spec, Encrypted Handshake Message"
"81","0.205136817","192.168.1.118","199.232.37.140","TLSv1.2","279","Application Data"
"82","0.205279022","199.232.37.140","192.168.1.118","TLSv1.2","2080","Certificate, Server Key Exchange, Server Hello Done"
"83","0.205364888","192.168.1.118","199.232.37.140","TCP","66","41414 → 443 [ACK] Seq=518 Ack=3367 Win=35968 Len=0 TSval=18543836 TSecr=252170918"
"84","0.207139212","192.168.1.118","199.232.37.140","TLSv1.2","192","Client Key Exchange, Change Cipher Spec, Encrypted Handshake Message"
"85","0.209287888","192.168.1.118","199.232.37.140","TLSv1.2","192","Client Key Exchange, Change Cipher Spec, Encrypted Handshake Message"
"86","0.219546447","192.168.1.118","199.232.37.140","TCP","74","41423 → 443 [SYN] Seq=0 Win=29200 Len=0 MSS=1460 SACK_PERM=1 TSval=18543850 TSecr=0 WS=128"
"87","0.219742716","192.168.1.118","209.18.47.62","DNS","84","Standard query 0x2ade A a.thumbs.redditmedia.com"
"88","0.219799730","192.168.1.118","199.232.37.140","TCP","74","41424 → 443 [SYN] Seq=0 Win=29200 Len=0 MSS=1460 SACK_PERM=1 TSval=18543851 TSecr=0 WS=128"
"89","0.219911497","192.168.1.118","199.232.37.140","TCP","74","41425 → 443 [SYN] Seq=0 Win=29200 Len=0 MSS=1460 SACK_PERM=1 TSval=18543851 TSecr=0 WS=128"
"90","0.220368463","192.168.1.118","209.18.47.62","DNS","84","Standard query 0xb6be A a.thumbs.redditmedia.com"
"91","0.221731948","199.232.37.140","192.168.1.118","TCP","66","443 → 41416 [ACK] Seq=1 Ack=518 Win=28160 Len=0 TSval=3889648665 TSecr=18543832"
"92","0.223473647","199.232.37.140","192.168.1.118","TLSv1.2","3314","Server Hello, Certificate, Server Key Exchange, Server Hello Done"
"93","0.223565750","192.168.1.118","199.232.37.140","TCP","66","41416 → 443 [ACK] Seq=518 Ack=3249 Win=35712 Len=0 TSval=18543854 TSecr=3889648665"
"94","0.226659708","192.168.1.118","199.232.37.140","TLSv1.2","192","Client Key Exchange, Change Cipher Spec, Encrypted Handshake Message"
"95","0.233002805","199.232.37.140","192.168.1.118","TCP","74","443 → 41420 [SYN, ACK] Seq=0 Ack=1 Win=27040 Len=0 MSS=1364 SACK_PERM=1 TSval=2787402038 TSecr=18543833 WS=512"
"96","0.233112221","192.168.1.118","199.232.37.140","TCP","66","41420 → 443 [ACK] Seq=1 Ack=1 Win=29312 Len=0 TSval=18543864 TSecr=2787402038"
"97","0.234447706","199.232.37.140","192.168.1.118","TLSv1.2","117","Change Cipher Spec, Encrypted Handshake Message"
"98","0.234534021","192.168.1.118","199.232.37.140","TCP","66","41415 → 443 [ACK] Seq=644 Ack=3300 Win=35712 Len=0 TSval=18543865 TSecr=834384412"
"99","0.234588673","199.232.37.140","192.168.1.118","TLSv1.2","744","Application Data, Application Data"
"100","0.234615436","199.232.37.140","192.168.1.118","TLSv1.2","117","Change Cipher Spec, Encrypted Handshake Message"
"101","0.234637525","199.232.37.140","192.168.1.118","TLSv1.2","117","Change Cipher Spec, Encrypted Handshake Message"
"102","0.234657725","199.232.37.140","192.168.1.118","TCP","74","443 → 41418 [SYN, ACK] Seq=0 Ack=1 Win=27040 Len=0 MSS=1364 SACK_PERM=1 TSval=1652479916 TSecr=18543833 WS=512"
"103","0.234698227","192.168.1.118","199.232.37.140","TCP","66","41418 → 443 [ACK] Seq=1 Ack=1 Win=29312 Len=0 TSval=18543866 TSecr=1652479916"
"104","0.234717428","199.232.37.140","192.168.1.118","TCP","74","443 → 41417 [SYN, ACK] Seq=0 Ack=1 Win=27040 Len=0 MSS=1364 SACK_PERM=1 TSval=2788229913 TSecr=18543833 WS=512"
"105","0.234743553","192.168.1.118","199.232.37.140","TCP","66","41417 → 443 [ACK] Seq=1 Ack=1 Win=29312 Len=0 TSval=18543866 TSecr=2788229913"
"106","0.234762267","199.232.37.140","192.168.1.118","TCP","74","443 → 41422 [SYN, ACK] Seq=0 Ack=1 Win=27040 Len=0 MSS=1364 SACK_PERM=1 TSval=2789244777 TSecr=18543833 WS=512"
"107","0.234788505","192.168.1.118","199.232.37.140","TCP","66","41422 → 443 [ACK] Seq=1 Ack=1 Win=29312 Len=0 TSval=18543866 TSecr=2789244777"
"108","0.234808156","199.232.37.140","192.168.1.118","TCP","74","443 → 41419 [SYN, ACK] Seq=0 Ack=1 Win=27040 Len=0 MSS=1364 SACK_PERM=1 TSval=2790194097 TSecr=18543833 WS=512"
"109","0.234832319","192.168.1.118","199.232.37.140","TCP","66","41419 → 443 [ACK] Seq=1 Ack=1 Win=29312 Len=0 TSval=18543866 TSecr=2790194097"
"110","0.234848845","199.232.37.140","192.168.1.118","TCP","74","443 → 41421 [SYN, ACK] Seq=0 Ack=1 Win=27040 Len=0 MSS=1364 SACK_PERM=1 TSval=488149688 TSecr=18543833 WS=512"
"111","0.234871545","192.168.1.118","199.232.37.140","TCP","66","41421 → 443 [ACK] Seq=1 Ack=1 Win=29312 Len=0 TSval=18543866 TSecr=488149688"
"112","0.236203555","192.168.1.118","199.232.37.140","TLSv1.2","293","Application Data"
"113","0.236673084","192.168.1.118","199.232.37.140","TLSv1.2","295","Application Data"
"114","0.236888104","192.168.1.118","199.232.37.140","TLSv1.2","370","Application Data"
"115","0.243178861","209.18.47.62","192.168.1.118","DNS","135","Standard query response 0xb6be A a.thumbs.redditmedia.com CNAME reddit.map.fastly.net A 199.232.37.140"
"116","0.243251839","209.18.47.62","192.168.1.118","DNS","135","Standard query response 0x2ade A a.thumbs.redditmedia.com CNAME reddit.map.fastly.net A 199.232.37.140"
"117","0.243276790","199.232.37.140","192.168.1.118","TCP","74","443 → 41425 [SYN, ACK] Seq=0 Ack=1 Win=27040 Len=0 MSS=1364 SACK_PERM=1 TSval=248416234 TSecr=18543851 WS=512"
"118","0.243337867","192.168.1.118","199.232.37.140","TCP","66","41425 → 443 [ACK] Seq=1 Ack=1 Win=29312 Len=0 TSval=18543874 TSecr=248416234"
"119","0.243381493","199.232.37.140","192.168.1.118","TCP","74","443 → 41423 [SYN, ACK] Seq=0 Ack=1 Win=27040 Len=0 MSS=1364 SACK_PERM=1 TSval=1092509233 TSecr=18543850 WS=512"
"120","0.243408907","192.168.1.118","199.232.37.140","TCP","66","41423 → 443 [ACK] Seq=1 Ack=1 Win=29312 Len=0 TSval=18543874 TSecr=1092509233"
"121","0.243426445","199.232.37.140","192.168.1.118","TCP","74","443 → 41424 [SYN, ACK] Seq=0 Ack=1 Win=27040 Len=0 MSS=1364 SACK_PERM=1 TSval=2788301377 TSecr=18543851 WS=512"
"122","0.243449821","192.168.1.118","199.232.37.140","TCP","66","41424 → 443 [ACK] Seq=1 Ack=1 Win=29312 Len=0 TSval=18543874 TSecr=2788301377"
"123","0.243796295","192.168.1.118","209.18.47.62","DNS","84","Standard query 0x769e AAAA a.thumbs.redditmedia.com"
"124","0.243854772","192.168.1.118","209.18.47.62","DNS","84","Standard query 0x7258 AAAA a.thumbs.redditmedia.com"
"125","0.249587961","199.232.37.140","192.168.1.118","TLSv1.2","117","Change Cipher Spec, Encrypted Handshake Message"
"126","0.256420437","192.168.1.118","199.232.37.140","TLSv1","583","Client Hello"
"127","0.261509315","199.232.37.140","192.168.1.118","TLSv1.2","1418","Application Data"
"128","0.262904964","199.232.37.140","192.168.1.118","TLSv1.2","2770","Application Data, Application Data"
"129","0.262986979","192.168.1.118","199.232.37.140","TCP","66","41415 → 443 [ACK] Seq=871 Ack=7356 Win=43904 Len=0 TSval=18543894 TSecr=834384419"
"130","0.263797420","199.232.37.140","192.168.1.118","TLSv1.2","4122","Application Data, Application Data, Application Data"
"131","0.263869185","192.168.1.118","199.232.37.140","TCP","66","41415 → 443 [ACK] Seq=871 Ack=11412 Win=51968 Len=0 TSval=18543895 TSecr=834384419"
"132","0.263901199","199.232.37.140","192.168.1.118","TLSv1.2","1418","Application Data"
"133","0.268922862","199.232.37.140","192.168.1.118","TLSv1.2","2528","Application Data, Application Data, Application Data"
"134","0.269003965","192.168.1.118","199.232.37.140","TCP","66","41414 → 443 [ACK] Seq=948 Ack=7232 Win=43648 Len=0 TSval=18543900 TSecr=252170933"
"135","0.269111219","199.232.37.140","192.168.1.118","TLSv1.2","6826","Application Data, Application Data, Application Data, Application Data, Application Data"
"136","0.269147408","192.168.1.118","199.232.37.140","TCP","66","41413 → 443 [ACK] Seq=873 Ack=10082 Win=49280 Len=0 TSval=18543900 TSecr=2788225245"
"137","0.269160671","199.232.37.140","192.168.1.118","TLSv1.2","103","Application Data"
"138","0.269182834","209.18.47.62","192.168.1.118","DNS","177","Standard query response 0x7258 AAAA a.thumbs.redditmedia.com CNAME reddit.map.fastly.net SOA ns1.fastly.net"
"139","0.269210647","199.232.37.140","192.168.1.118","TLSv1.2","5474","Application Data, Application Data, Application Data, Application Data"
"140","0.269235923","192.168.1.118","199.232.37.140","TCP","66","41415 → 443 [ACK] Seq=871 Ack=16820 Win=62848 Len=0 TSval=18543900 TSecr=834384419"
"141","0.269970299","209.18.47.62","192.168.1.118","DNS","177","Standard query response 0x769e AAAA a.thumbs.redditmedia.com CNAME reddit.map.fastly.net SOA ns1.fastly.net"
"142","0.270014700","199.232.37.140","192.168.1.118","TCP","66","443 → 41417 [ACK] Seq=1 Ack=518 Win=28160 Len=0 TSval=2788229922 TSecr=18543887"
"143","0.272543751","199.232.37.140","192.168.1.118","TLSv1.2","1418","Server Hello"
"144","0.272641630","192.168.1.118","199.232.37.140","TCP","66","41417 → 443 [ACK] Seq=518 Ack=1353 Win=32000 Len=0 TSval=18543904 TSecr=2788229923"
"145","0.274615299","192.168.1.118","199.232.37.140","TCP","66","41412 → 443 [ACK] Seq=857 Ack=3968 Win=300 Len=0 TSval=18543906 TSecr=251448219"
"146","0.274674338","192.168.1.118","199.232.37.140","TLSv1","583","Client Hello"
"147","0.276328234","199.232.37.140","192.168.1.118","TLSv1.2","2080","Certificate, Server Key Exchange, Server Hello Done"
"148","0.276411562","192.168.1.118","199.232.37.140","TCP","66","41417 → 443 [ACK] Seq=518 Ack=3367 Win=35968 Len=0 TSval=18543907 TSecr=2788229923"
"149","0.277373770","199.232.37.140","192.168.1.118","TLSv1.2","1724","Application Data, Application Data"
"150","0.277428135","192.168.1.118","199.232.37.140","TCP","66","41415 → 443 [ACK] Seq=871 Ack=18478 Win=66176 Len=0 TSval=18543908 TSecr=834384423"
"151","0.289618387","192.168.1.118","199.232.37.140","TCP","66","41416 → 443 [ACK] Seq=644 Ack=3300 Win=35712 Len=0 TSval=18543921 TSecr=3889648671"
"152","0.294271937","192.168.1.118","199.232.37.140","TLSv1","583","Client Hello"
"153","0.307280755","199.232.37.140","192.168.1.118","TCP","66","443 → 41418 [ACK] Seq=1 Ack=518 Win=28160 Len=0 TSval=1652479991 TSecr=18543906"
"154","0.308610626","192.168.1.118","199.232.37.140","TCP","66","41413 → 443 [ACK] Seq=873 Ack=10119 Win=49280 Len=0 TSval=18543940 TSecr=2788225245"
"155","0.308729030","199.232.37.140","192.168.1.118","TLSv1.2","3432","Server Hello, Certificate, Server Key Exchange, Server Hello Done"
"156","0.308766769","192.168.1.118","199.232.37.140","TCP","66","41418 → 443 [ACK] Seq=518 Ack=3367 Win=35968 Len=0 TSval=18543940 TSecr=1652479992"
"157","0.311802763","199.232.37.140","192.168.1.118","TCP","66","443 → 41419 [ACK] Seq=1 Ack=518 Win=28160 Len=0 TSval=2790194117 TSecr=18543925"
"158","0.313412982","192.168.1.118","199.232.37.140","TLSv1","583","Client Hello"
"159","0.315895119","199.232.37.140","192.168.1.118","TLSv1.2","1418","Server Hello"
"160","0.315977459","192.168.1.118","199.232.37.140","TCP","66","41419 → 443 [ACK] Seq=518 Ack=1353 Win=32000 Len=0 TSval=18543947 TSecr=2790194118"
"161","0.322592016","199.232.37.140","192.168.1.118","TLSv1.2","1984","Certificate, Server Key Exchange, Server Hello Done"
"162","0.322683631","192.168.1.118","199.232.37.140","TCP","66","41419 → 443 [ACK] Seq=518 Ack=3271 Win=35840 Len=0 TSval=18543954 TSecr=2790194118"
"163","0.332005670","199.232.37.140","192.168.1.118","TCP","66","443 → 41420 [ACK] Seq=1 Ack=518 Win=28160 Len=0 TSval=2787402064 TSecr=18543944"
"164","0.333176811","192.168.1.118","199.232.37.140","TLSv1","583","Client Hello"
"165","0.338992902","199.232.37.140","192.168.1.118","TLSv1.2","1418","Server Hello"
"166","0.339077030","192.168.1.118","199.232.37.140","TCP","66","41420 → 443 [ACK] Seq=518 Ack=1353 Win=32000 Len=0 TSval=18543970 TSecr=2787402064"
"167","0.342919352","199.232.37.140","192.168.1.118","TLSv1.2","2080","Certificate, Server Key Exchange, Server Hello Done"
"168","0.343010143","192.168.1.118","199.232.37.140","TCP","66","41420 → 443 [ACK] Seq=518 Ack=3367 Win=35968 Len=0 TSval=18543974 TSecr=2787402064"
"169","0.353079333","192.168.1.118","199.232.37.140","TLSv1","583","Client Hello"
"170","0.353358742","192.168.1.118","199.232.37.140","TCP","74","41426 → 443 [SYN] Seq=0 Win=29200 Len=0 MSS=1460 SACK_PERM=1 TSval=18543984 TSecr=0 WS=128"
"171","0.362875513","199.232.37.140","192.168.1.118","TCP","66","443 → 41421 [ACK] Seq=1 Ack=518 Win=28160 Len=0 TSval=488149720 TSecr=18543964"
"172","0.366809401","199.232.37.140","192.168.1.118","TLSv1.2","3432","Server Hello, Certificate, Server Key Exchange, Server Hello Done"
"173","0.366899904","192.168.1.118","199.232.37.140","TCP","66","41421 → 443 [ACK] Seq=518 Ack=3367 Win=35968 Len=0 TSval=18543998 TSecr=488149720"
"174","0.374179659","199.232.37.140","192.168.1.118","TCP","66","[TCP Dup ACK 163#1] 443 → 41420 [ACK] Seq=3367 Ack=518 Win=28160 Len=0 TSval=2787402073 TSecr=18543974"
"175","0.375750589","192.168.1.118","199.232.37.140","TLSv1","583","Client Hello"
"176","0.383994765","199.232.37.140","192.168.1.118","TCP","74","443 → 41426 [SYN, ACK] Seq=0 Ack=1 Win=27040 Len=0 MSS=1364 SACK_PERM=1 TSval=2763172559 TSecr=18543984 WS=512"
"177","0.384104918","192.168.1.118","199.232.37.140","TCP","66","41426 → 443 [ACK] Seq=1 Ack=1 Win=29312 Len=0 TSval=18544015 TSecr=2763172559"
"178","0.385182906","199.232.37.140","192.168.1.118","TCP","66","443 → 41422 [ACK] Seq=1 Ack=518 Win=28160 Len=0 TSval=2789244815 TSecr=18543984"
"179","0.385266209","199.232.37.140","192.168.1.118","TLSv1.2","3314","Server Hello, Certificate, Server Key Exchange, Server Hello Done"
"180","0.385309861","192.168.1.118","199.232.37.140","TCP","66","41422 → 443 [ACK] Seq=518 Ack=3249 Win=35712 Len=0 TSval=18544016 TSecr=2789244815"
"181","0.406342597","192.168.1.118","199.232.37.140","TLSv1","583","Client Hello"
"182","0.425834729","199.232.37.140","192.168.1.118","TCP","66","443 → 41423 [ACK] Seq=1 Ack=518 Win=28160 Len=0 TSval=1092509277 TSecr=18544007"
"183","0.426914617","199.232.37.140","192.168.1.118","TLSv1.2","3336","Server Hello, Certificate, Server Key Exchange, Server Hello Done"
"184","0.426987557","192.168.1.118","199.232.37.140","TCP","66","41423 → 443 [ACK] Seq=518 Ack=3271 Win=35840 Len=0 TSval=18544058 TSecr=1092509277"
"185","0.427034533","199.232.37.140","192.168.1.118","TCP","66","443 → 41424 [ACK] Seq=1 Ack=518 Win=28160 Len=0 TSval=2788301423 TSecr=18544037"
"186","0.428504472","192.168.1.118","199.232.37.140","TLSv1","583","Client Hello"
"187","0.428641115","199.232.37.140","192.168.1.118","TLSv1.2","1418","Server Hello"
"188","0.428726405","192.168.1.118","199.232.37.140","TCP","66","41424 → 443 [ACK] Seq=518 Ack=1353 Win=32000 Len=0 TSval=18544060 TSecr=2788301423"
"189","0.428838509","192.168.1.118","199.232.37.140","TCP","74","41427 → 443 [SYN] Seq=0 Win=29200 Len=0 MSS=1460 SACK_PERM=1 TSval=18544060 TSecr=0 WS=128"
"190","0.429782967","192.168.1.118","199.232.37.140","TLSv1.2","292","Application Data"
"191","0.430347087","199.232.37.140","192.168.1.118","TLSv1.2","1962","Certificate, Server Key Exchange, Server Hello Done"
"192","0.430432615","192.168.1.118","199.232.37.140","TCP","66","41424 → 443 [ACK] Seq=518 Ack=3249 Win=35712 Len=0 TSval=18544061 TSecr=2788301423"
"193","0.431864977","192.168.1.118","199.232.37.140","TLSv1.2","192","Client Key Exchange, Change Cipher Spec, Encrypted Handshake Message"
"194","0.434588998","192.168.1.118","199.232.37.140","TLSv1.2","192","Client Key Exchange, Change Cipher Spec, Encrypted Handshake Message"
"195","0.436686221","192.168.1.118","199.232.37.140","TLSv1.2","192","Client Key Exchange, Change Cipher Spec, Encrypted Handshake Message"
"196","0.438852410","192.168.1.118","199.232.37.140","TLSv1.2","192","Client Key Exchange, Change Cipher Spec, Encrypted Handshake Message"
"197","0.443143097","192.168.1.118","199.232.37.140","TLSv1.2","192","Client Key Exchange, Change Cipher Spec, Encrypted Handshake Message"
"198","0.445205932","192.168.1.118","199.232.37.140","TLSv1.2","192","Client Key Exchange, Change Cipher Spec, Encrypted Handshake Message"
"199","0.455105628","199.232.37.140","192.168.1.118","TCP","66","443 → 41425 [ACK] Seq=1 Ack=518 Win=28160 Len=0 TSval=248416287 TSecr=18544059"
"200","0.456304158","199.232.37.140","192.168.1.118","TLSv1.2","1418","Application Data"
"201","0.456398436","192.168.1.118","199.232.37.140","TCP","66","41416 → 443 [ACK] Seq=870 Ack=4652 Win=38400 Len=0 TSval=18544087 TSecr=3889648723"
"202","0.458633827","199.232.37.140","192.168.1.118","TCP","74","443 → 41427 [SYN, ACK] Seq=0 Ack=1 Win=27040 Len=0 MSS=1364 SACK_PERM=1 TSval=186597565 TSecr=18544060 WS=512"
"203","0.458733030","192.168.1.118","199.232.37.140","TCP","66","41427 → 443 [ACK] Seq=1 Ack=1 Win=29312 Len=0 TSval=18544090 TSecr=186597565"
"204","0.458800870","199.232.37.140","192.168.1.118","TLSv1.2","4511","Application Data, Application Data, Application Data, Application Data"
"205","0.458834496","192.168.1.118","199.232.37.140","TCP","66","41416 → 443 [ACK] Seq=870 Ack=9097 Win=47360 Len=0 TSval=18544090 TSecr=3889648723"
"206","0.458853935","199.232.37.140","192.168.1.118","TLSv1.2","117","Change Cipher Spec, Encrypted Handshake Message"
"207","0.458879273","192.168.1.118","199.232.37.140","TCP","66","41418 → 443 [ACK] Seq=644 Ack=3418 Win=35968 Len=0 TSval=18544090 TSecr=1652480142"
"208","0.462695744","199.232.37.140","192.168.1.118","TLSv1.2","3336","Server Hello, Certificate, Server Key Exchange, Server Hello Done"
"209","0.462782597","192.168.1.118","199.232.37.140","TCP","66","41425 → 443 [ACK] Seq=518 Ack=3271 Win=35840 Len=0 TSval=18544094 TSecr=248416288"
"210","0.462828799","199.232.37.140","192.168.1.118","TLSv1.2","117","Change Cipher Spec, Encrypted Handshake Message"
"211","0.462868838","192.168.1.118","199.232.37.140","TCP","66","41417 → 443 [ACK] Seq=644 Ack=3418 Win=35968 Len=0 TSval=18544094 TSecr=2788229970"
"212","0.464879670","192.168.1.118","199.232.37.140","TLSv1","583","Client Hello"
"213","0.466704009","199.232.37.140","192.168.1.118","TLSv1.2","117","Change Cipher Spec, Encrypted Handshake Message"
"214","0.466795737","192.168.1.118","199.232.37.140","TCP","66","41422 → 443 [ACK] Seq=644 Ack=3300 Win=35712 Len=0 TSval=18544098 TSecr=2789244836"
"215","0.467074522","192.168.1.118","199.232.37.140","TLSv1.2","192","Client Key Exchange, Change Cipher Spec, Encrypted Handshake Message"
"216","0.468040006","199.232.37.140","192.168.1.118","TLSv1.2","117","Change Cipher Spec, Encrypted Handshake Message"
"217","0.468116121","192.168.1.118","199.232.37.140","TCP","66","41420 → 443 [ACK] Seq=644 Ack=3418 Win=35968 Len=0 TSval=18544099 TSecr=2787402097"
"218","0.468156273","199.232.37.140","192.168.1.118","TLSv1.2","117","Change Cipher Spec, Encrypted Handshake Message"
"219","0.468181961","192.168.1.118","199.232.37.140","TCP","66","41421 → 443 [ACK] Seq=644 Ack=3418 Win=35968 Len=0 TSval=18544099 TSecr=488149747"
"220","0.468201349","199.232.37.140","192.168.1.118","TLSv1.2","117","Change Cipher Spec, Encrypted Handshake Message"
"221","0.468225500","192.168.1.118","199.232.37.140","TCP","66","41419 → 443 [ACK] Seq=644 Ack=3322 Win=35840 Len=0 TSval=18544099 TSecr=2790194156"
"222","0.469177571","192.168.1.118","199.232.37.140","TLSv1.2","192","Client Key Exchange, Change Cipher Spec, Encrypted Handshake Message"
"223","0.471203392","192.168.1.118","199.232.37.140","TLSv1.2","192","Client Key Exchange, Change Cipher Spec, Encrypted Handshake Message"
"224","0.488202512","192.168.1.118","199.232.37.140","TLSv1","583","Client Hello"
"225","0.490147717","192.168.1.118","199.232.37.140","TLSv1.2","367","Application Data"
"226","0.490423477","192.168.1.118","199.232.37.140","TLSv1.2","379","Application Data"
"227","0.490679173","192.168.1.118","199.232.37.140","TLSv1.2","295","Application Data"
"228","0.490904281","192.168.1.118","199.232.37.140","TLSv1.2","375","Application Data"
"229","0.491110688","192.168.1.118","199.232.37.140","TLSv1.2","341","Application Data"
"230","0.491316083","192.168.1.118","199.232.37.140","TLSv1.2","293","Application Data"
"231","0.496256044","192.168.1.118","199.232.37.140","TLSv1.2","369","Application Data"
"232","0.505688761","199.232.37.140","192.168.1.118","TLSv1.2","117","Change Cipher Spec, Encrypted Handshake Message"
"233","0.506974856","199.232.37.140","192.168.1.118","TCP","66","443 → 41426 [ACK] Seq=1 Ack=518 Win=28160 Len=0 TSval=2763172589 TSecr=18544096"
"234","0.507049734","199.232.37.140","192.168.1.118","TLSv1.2","117","Change Cipher Spec, Encrypted Handshake Message"
"235","0.507095860","192.168.1.118","199.232.37.140","TCP","66","41423 → 443 [ACK] Seq=644 Ack=3322 Win=35840 Len=0 TSval=18544138 TSecr=1092509298"
"236","0.507142887","199.232.37.140","192.168.1.118","TLSv1.2","117","Change Cipher Spec, Encrypted Handshake Message"
"237","0.507185001","199.232.37.140","192.168.1.118","TLSv1.2","3336","Server Hello, Certificate, Server Key Exchange, Server Hello Done"
"238","0.507209939","192.168.1.118","199.232.37.140","TCP","66","41426 → 443 [ACK] Seq=518 Ack=3271 Win=35840 Len=0 TSval=18544138 TSecr=2763172589"
"239","0.508734318","199.232.37.140","192.168.1.118","TLSv1.2","1418","Application Data"
"240","0.510144292","199.232.37.140","192.168.1.118","TLSv1.2","1845","Application Data, Application Data"
"241","0.510220720","192.168.1.118","199.232.37.140","TCP","66","41420 → 443 [ACK] Seq=953 Ack=6549 Win=42240 Len=0 TSval=18544141 TSecr=2787402108"
"242","0.510281509","199.232.37.140","192.168.1.118","TLSv1.2","3787","Application Data, Application Data, Application Data, Application Data"
"243","0.510315461","192.168.1.118","199.232.37.140","TCP","66","41418 → 443 [ACK] Seq=957 Ack=7139 Win=43392 Len=0 TSval=18544141 TSecr=1652480194"
"244","0.510341499","199.232.37.140","192.168.1.118","TLSv1.2","1418","Application Data"
"245","0.511917404","192.168.1.118","199.232.37.140","TLSv1.2","192","Client Key Exchange, Change Cipher Spec, Encrypted Handshake Message"
"246","0.512256129","192.168.1.118","199.232.37.140","TLSv1.2","295","Application Data"
"247","0.512499912","192.168.1.118","199.232.37.140","TLSv1.2","348","Application Data"
"248","0.512732295","192.168.1.118","199.232.37.140","TLSv1.2","295","Application Data"
"249","0.513575075","199.232.37.140","192.168.1.118","TLSv1.2","1888","Application Data, Application Data"
"250","0.513654015","192.168.1.118","199.232.37.140","TCP","66","41417 → 443 [ACK] Seq=945 Ack=6592 Win=42368 Len=0 TSval=18544145 TSecr=2788229982"
"251","0.513701917","199.232.37.140","192.168.1.118","TLSv1.2","574","Application Data"
"252","0.513796120","199.232.37.140","192.168.1.118","TLSv1.2","12234","Application Data, Application Data, Application Data, Application Data, Application Data, Application Data, Application Data, Application Data"
"253","0.513826371","192.168.1.118","199.232.37.140","TCP","66","41419 → 443 [ACK] Seq=873 Ack=15998 Win=62848 Len=0 TSval=18544145 TSecr=2790194167"
"254","0.515396526","192.168.1.118","199.232.37.140","TLSv1.2","373","Application Data"
"255","0.515582507","199.232.37.140","192.168.1.118","TCP","66","443 → 41427 [ACK] Seq=1 Ack=518 Win=28160 Len=0 TSval=186597579 TSecr=18544119"
"256","0.515593933","192.168.1.118","199.232.37.140","TLSv1.2","341","Application Data"
"257","0.515667298","199.232.37.140","192.168.1.118","TLSv1.2","3336","Server Hello, Certificate, Server Key Exchange, Server Hello Done"
"258","0.515708699","192.168.1.118","199.232.37.140","TCP","66","41427 → 443 [ACK] Seq=518 Ack=3271 Win=35840 Len=0 TSval=18544147 TSecr=186597580"
"259","0.518756956","192.168.1.118","199.232.37.140","TLSv1.2","192","Client Key Exchange, Change Cipher Spec, Encrypted Handshake Message"
"260","0.533153497","199.232.37.140","192.168.1.118","TLSv1.2","1418","Application Data"
"261","0.534333714","199.232.37.140","192.168.1.118","TLSv1.2","4122","Application Data, Application Data, Application Data"
"262","0.534395928","192.168.1.118","199.232.37.140","TCP","66","41422 → 443 [ACK] Seq=871 Ack=8708 Win=46592 Len=0 TSval=18544165 TSecr=2789244853"
"263","0.536741335","199.232.37.140","192.168.1.118","TLSv1.2","2770","Application Data, Application Data"
"264","0.536808388","192.168.1.118","199.232.37.140","TCP","66","41422 → 443 [ACK] Seq=871 Ack=11412 Win=51968 Len=0 TSval=18544168 TSecr=2789244853"
"265","0.536839464","199.232.37.140","192.168.1.118","TLSv1.2","10882","Application Data, Application Data, Application Data, Application Data, Application Data, Application Data, Application Data, Application Data"
"266","0.536871415","192.168.1.118","199.232.37.140","TCP","66","41421 → 443 [ACK] Seq=919 Ack=14234 Win=57600 Len=0 TSval=18544168 TSecr=488149764"
"267","0.538293027","199.232.37.140","192.168.1.118","TLSv1.2","3649","Application Data, Application Data, Application Data, Application Data"
"268","0.538366517","192.168.1.118","199.232.37.140","TCP","66","41414 → 443 [ACK] Seq=1251 Ack=10815 Win=50816 Len=0 TSval=18544169 TSecr=252171001"
"269","0.538401281","199.232.37.140","192.168.1.118","TLSv1.2","2770","Application Data, Application Data"
"270","0.538422057","192.168.1.118","199.232.37.140","TCP","66","41421 → 443 [ACK] Seq=919 Ack=16938 Win=62976 Len=0 TSval=18544169 TSecr=488149764"
"271","0.538432757","199.232.37.140","192.168.1.118","TLSv1.2","5474","Application Data, Application Data, Application Data, Application Data"
"272","0.538453658","192.168.1.118","199.232.37.140","TCP","66","41422 → 443 [ACK] Seq=871 Ack=16820 Win=62848 Len=0 TSval=18544169 TSecr=2789244853"
"273","0.543431570","199.232.37.140","192.168.1.118","TLSv1.2","1418","Application Data [TCP segment of a reassembled PDU]"
"274","0.545280847","199.232.37.140","192.168.1.118","TLSv1.2","5474","Application Data, Application Data, Application Data, Application Data"
"275","0.545352887","192.168.1.118","199.232.37.140","TCP","66","41419 → 443 [ACK] Seq=873 Ack=22758 Win=76416 Len=0 TSval=18544176 TSecr=2790194175"
"276","0.545509642","199.232.37.140","192.168.1.118","TLSv1.2","1076","Application Data, Application Data"
"277","0.545541643","199.232.37.140","192.168.1.118","TLSv1.2","2770","Application Data, Application Data"
"278","0.545586558","192.168.1.118","199.232.37.140","TCP","66","41425 → 443 [ACK] Seq=873 Ack=6026 Win=41216 Len=0 TSval=18544177 TSecr=248416309"
"279","0.550634884","199.232.37.140","192.168.1.118","TLSv1.2","10882","Application Data, Application Data, Application Data, Application Data, Application Data, Application Data, Application Data, Application Data"
"280","0.550707199","192.168.1.118","199.232.37.140","TCP","66","41425 → 443 [ACK] Seq=873 Ack=16842 Win=62848 Len=0 TSval=18544182 TSecr=248416309"
"281","0.550742451","199.232.37.140","192.168.1.118","TLSv1.2","13586","Application Data, Application Data, Application Data, Application Data, Application Data, Application Data, Application Data, Application Data, Application Data, Application Data"
"282","0.550774827","192.168.1.118","199.232.37.140","TCP","66","41418 → 443 [ACK] Seq=1232 Ack=20659 Win=70528 Len=0 TSval=18544182 TSecr=1652480229"
"283","0.552825311","199.232.37.140","192.168.1.118","TLSv1.2","5474","Application Data, Application Data, Application Data, Application Data"
"284","0.552904889","192.168.1.118","199.232.37.140","TCP","66","41422 → 443 [ACK] Seq=871 Ack=22228 Win=73600 Len=0 TSval=18544184 TSecr=2789244855"
"285","0.553022668","199.232.37.140","192.168.1.118","TLSv1.2","3324","Application Data, Application Data, Application Data"
"286","0.553056419","192.168.1.118","199.232.37.140","TCP","66","41417 → 443 [ACK] Seq=1252 Ack=9850 Win=48896 Len=0 TSval=18544184 TSecr=2788229991"
"287","0.553107508","199.232.37.140","192.168.1.118","TLSv1.2","5474","Application Data, Application Data, Application Data, Application Data"
"288","0.553125834","192.168.1.118","199.232.37.140","TCP","66","41422 → 443 [ACK] Seq=871 Ack=27636 Win=84480 Len=0 TSval=18544184 TSecr=2789244856"
"289","0.553135872","199.232.37.140","192.168.1.118","TLSv1.2","6826","Application Data, Application Data, Application Data, Application Data, Application Data"
"290","0.553158510","192.168.1.118","199.232.37.140","TCP","66","41424 → 443 [ACK] Seq=926 Ack=10060 Win=49280 Len=0 TSval=18544184 TSecr=2788301453"
"291","0.555785339","199.232.37.140","192.168.1.118","TLSv1.2","133","Application Data"
"292","0.555904594","199.232.37.140","192.168.1.118","TLSv1.2","117","Change Cipher Spec, Encrypted Handshake Message"
"293","0.555930307","199.232.37.140","192.168.1.118","TLSv1.2","13586","Application Data, Application Data, Application Data, Application Data, Application Data, Application Data, Application Data, Application Data, Application Data, Application Data"
"294","0.555974359","192.168.1.118","199.232.37.140","TCP","66","41423 → 443 [ACK] Seq=873 Ack=16842 Win=62848 Len=0 TSval=18544187 TSecr=1092509309"
"295","0.556343709","192.168.1.118","199.232.37.140","TLSv1.2","295","Application Data"
"296","0.557277692","199.232.37.140","192.168.1.118","TLSv1.2","117","Change Cipher Spec, Encrypted Handshake Message"
"297","0.558248426","192.168.1.118","199.232.37.140","TLSv1.2","295","Application Data"
"298","0.562483711","199.232.37.140","192.168.1.118","TCP","1418","443 → 41422 [ACK] Seq=27636 Ack=871 Win=29184 Len=1352 TSval=2789244860 TSecr=18544184 [TCP segment of a reassembled PDU]"
"299","0.563902874","199.232.37.140","192.168.1.118","TLSv1.2","2770","Application Data, Application Data"
"300","0.563966926","192.168.1.118","199.232.37.140","TCP","66","41422 → 443 [ACK] Seq=871 Ack=31692 Win=92544 Len=0 TSval=18544195 TSecr=2789244860"
"301","0.564011415","199.232.37.140","192.168.1.118","TLSv1.2","2770","Application Data, Application Data"
"302","0.564033741","192.168.1.118","199.232.37.140","TCP","66","41425 → 443 [ACK] Seq=873 Ack=19546 Win=68224 Len=0 TSval=18544195 TSecr=248416314"
"303","0.569080830","199.232.37.140","192.168.1.118","TLSv1.2","2770","Application Data, Application Data"
"304","0.569156370","192.168.1.118","199.232.37.140","TCP","66","41422 → 443 [ACK] Seq=871 Ack=34396 Win=97920 Len=0 TSval=18544200 TSecr=2789244860"
"305","0.571808425","199.232.37.140","192.168.1.118","TLSv1.2","1418","Application Data [TCP segment of a reassembled PDU]"
"306","0.575012062","199.232.37.140","192.168.1.118","TLSv1.2","1418","Application Data [TCP segment of a reassembled PDU]"
"307","0.575097053","192.168.1.118","199.232.37.140","TCP","66","41425 → 443 [ACK] Seq=873 Ack=22250 Win=73600 Len=0 TSval=18544206 TSecr=248416314"
"308","0.578213399","199.232.37.140","192.168.1.118","TLSv1.2","2770","Application Data, Application Data"
"309","0.578298277","192.168.1.118","199.232.37.140","TCP","66","41422 → 443 [ACK] Seq=871 Ack=37100 Win=103296 Len=0 TSval=18544209 TSecr=2789244860"
"310","0.578337904","199.232.37.140","192.168.1.118","TLSv1.2","5474","Application Data, Application Data, Application Data, Application Data"
"311","0.578360767","192.168.1.118","199.232.37.140","TCP","66","41418 → 443 [ACK] Seq=1232 Ack=26067 Win=81280 Len=0 TSval=18544209 TSecr=1652480258"
"312","0.578453433","199.232.37.140","192.168.1.118","TLSv1.2","10882","Application Data, Application Data, Application Data, Application Data, Application Data, Application Data, Application Data"
"313","0.578479659","192.168.1.118","199.232.37.140","TCP","66","41418 → 443 [ACK] Seq=1232 Ack=36883 Win=102912 Len=0 TSval=18544209 TSecr=1652480258"
"314","0.580826666","199.232.37.140","192.168.1.118","TLSv1.2","5474","Application Data, Application Data, Application Data, Application Data"
"315","0.580907594","192.168.1.118","199.232.37.140","TCP","66","41421 → 443 [ACK] Seq=919 Ack=22346 Win=73856 Len=0 TSval=18544212 TSecr=488149774"
"316","0.581055361","199.232.37.140","192.168.1.118","TLSv1.2","12234","Application Data, Application Data, Application Data, Application Data, Application Data, Application Data, Application Data, Application Data"
"317","0.581082437","192.168.1.118","199.232.37.140","TCP","66","41421 → 443 [ACK] Seq=919 Ack=34514 Win=98176 Len=0 TSval=18544212 TSecr=488149774"
"318","0.581119326","199.232.37.140","192.168.1.118","TLSv1.2","4122","Application Data, Application Data, Application Data"
"319","0.581146227","192.168.1.118","199.232.37.140","TCP","66","41421 → 443 [ACK] Seq=919 Ack=38570 Win=106240 Len=0 TSval=18544212 TSecr=488149774"
"320","0.584620511","192.168.1.118","199.232.37.140","TCP","66","41419 → 443 [ACK] Seq=873 Ack=23768 Win=79104 Len=0 TSval=18544216 TSecr=2790194175"
"321","0.584791317","199.232.37.140","192.168.1.118","TLSv1.2","2770","Application Data, Application Data"
"322","0.584827568","192.168.1.118","199.232.37.140","TCP","66","41422 → 443 [ACK] Seq=871 Ack=39804 Win=108800 Len=0 TSval=18544216 TSecr=2789244861"
"323","0.584864195","199.232.37.140","192.168.1.118","TLSv1.2","2770","Application Data, Application Data"
"324","0.584885520","192.168.1.118","199.232.37.140","TCP","66","41422 → 443 [ACK] Seq=871 Ack=42508 Win=114176 Len=0 TSval=18544216 TSecr=2789244862"
"325","0.584910859","199.232.37.140","192.168.1.118","TLSv1.2","5474","Application Data, Application Data, Application Data, Application Data"
"326","0.584939785","192.168.1.118","199.232.37.140","TCP","66","41421 → 443 [ACK] Seq=919 Ack=43978 Win=117120 Len=0 TSval=18544216 TSecr=488149774"
"327","0.584952098","199.232.37.140","192.168.1.118","TLSv1.2","2770","Application Data, Application Data"
"328","0.584973149","192.168.1.118","199.232.37.140","TCP","66","41418 → 443 [ACK] Seq=1232 Ack=39587 Win=108288 Len=0 TSval=18544216 TSecr=1652480258"
"329","0.584986361","199.232.37.140","192.168.1.118","TLSv1.2","2770","Application Data, Application Data"
"330","0.585005212","192.168.1.118","199.232.37.140","TCP","66","41422 → 443 [ACK] Seq=871 Ack=45212 Win=119552 Len=0 TSval=18544216 TSecr=2789244864"
"331","0.585098440","199.232.37.140","192.168.1.118","TLSv1.2","2770","Application Data, Application Data"
"332","0.585121916","192.168.1.118","199.232.37.140","TCP","66","41418 → 443 [ACK] Seq=1232 Ack=42291 Win=113792 Len=0 TSval=18544216 TSecr=1652480258"
"333","0.585134154","199.232.37.140","192.168.1.118","TLSv1.2","2770","Application Data, Application Data"
"334","0.585155217","192.168.1.118","199.232.37.140","TCP","66","41425 → 443 [ACK] Seq=873 Ack=24954 Win=79104 Len=0 TSval=18544216 TSecr=248416314"
"335","0.595627209","192.168.1.118","199.232.37.140","TCP","66","41424 → 443 [ACK] Seq=926 Ack=10127 Win=49280 Len=0 TSval=18544227 TSecr=2788301453"
"336","0.597696569","199.232.37.140","192.168.1.118","TLSv1.2","17642","Application Data, Application Data, Application Data, Application Data, Application Data, Application Data, Application Data, Application Data, Application Data, Application Data, Application Data, Application Data"
"337","0.597783334","192.168.1.118","199.232.37.140","TCP","66","41423 → 443 [ACK] Seq=873 Ack=34418 Win=98048 Len=0 TSval=18544229 TSecr=1092509319"
"338","0.597842924","199.232.37.140","192.168.1.118","TLSv1.2","2770","Application Data, Application Data"
"339","0.597865587","192.168.1.118","199.232.37.140","TCP","66","41418 → 443 [ACK] Seq=1232 Ack=44995 Win=119168 Len=0 TSval=18544229 TSecr=1652480261"
"340","0.597885988","199.232.37.140","192.168.1.118","TLSv1.2","4122","Application Data, Application Data, Application Data"
"341","0.597907514","192.168.1.118","199.232.37.140","TCP","66","41422 → 443 [ACK] Seq=871 Ack=49268 Win=127744 Len=0 TSval=18544229 TSecr=2789244864"
"342","0.597950653","199.232.37.140","192.168.1.118","TLSv1.2","9530","Application Data, Application Data, Application Data, Application Data, Application Data, Application Data, Application Data"
"343","0.597979341","192.168.1.118","199.232.37.140","TCP","66","41423 → 443 [ACK] Seq=873 Ack=43882 Win=116864 Len=0 TSval=18544229 TSecr=1092509319"
"344","0.597991729","199.232.37.140","192.168.1.118","TLSv1.2","2770","Application Data, Application Data"
"345","0.598013630","192.168.1.118","199.232.37.140","TCP","66","41418 → 443 [ACK] Seq=1232 Ack=47699 Win=124544 Len=0 TSval=18544229 TSecr=1652480264"
"346","0.598023780","199.232.37.140","192.168.1.118","TLSv1.2","13586","Application Data, Application Data, Application Data, Application Data, Application Data, Application Data, Application Data, Application Data, Application Data, Application Data"
"347","0.598053519","192.168.1.118","199.232.37.140","TCP","66","41426 → 443 [ACK] Seq=873 Ack=16842 Win=62848 Len=0 TSval=18544229 TSecr=2763172610"
"348","0.598062507","199.232.37.140","192.168.1.118","TLSv1.2","1418","Application Data"
"349","0.602234965","199.232.37.140","192.168.1.118","TLSv1.2","5474","Application Data, Application Data, Application Data, Application Data"
"350","0.602323231","192.168.1.118","199.232.37.140","TCP","66","41427 → 443 [ACK] Seq=873 Ack=10082 Win=49280 Len=0 TSval=18544233 TSecr=186597598"
"351","0.602424822","199.232.37.140","192.168.1.118","TLSv1.2","3287","Application Data, Application Data, Application Data"
"352","0.602446798","192.168.1.118","199.232.37.140","TCP","66","41427 → 443 [ACK] Seq=873 Ack=13303 Win=55808 Len=0 TSval=18544233 TSecr=186597598"
"353","0.602488049","199.232.37.140","192.168.1.118","TLSv1.2","2770","Application Data, Application Data"
"354","0.602511212","192.168.1.118","199.232.37.140","TCP","66","41422 → 443 [ACK] Seq=871 Ack=51972 Win=133120 Len=0 TSval=18544233 TSecr=2789244864"
"355","0.602535313","199.232.37.140","192.168.1.118","TLSv1.2","2770","Application Data, Application Data"
"356","0.602567452","192.168.1.118","199.232.37.140","TCP","66","41422 → 443 [ACK] Seq=871 Ack=54676 Win=138496 Len=0 TSval=18544234 TSecr=2789244865"
"357","0.602591953","199.232.37.140","192.168.1.118","TLSv1.2","2770","Application Data, Application Data"
"358","0.602611441","192.168.1.118","199.232.37.140","TCP","66","41425 → 443 [ACK] Seq=873 Ack=27658 Win=84480 Len=0 TSval=18544234 TSecr=248416316"
"359","0.602626754","199.232.37.140","192.168.1.118","TLSv1.2","2770","Application Data, Application Data"
"360","0.602643104","192.168.1.118","199.232.37.140","TCP","66","41422 → 443 [ACK] Seq=871 Ack=57380 Win=143872 Len=0 TSval=18544234 TSecr=2789244867"
"361","0.602652817","199.232.37.140","192.168.1.118","TCP","1418","443 → 41425 [ACK] Seq=27658 Ack=873 Win=29184 Len=1352 TSval=248416319 TSecr=18544182 [TCP segment of a reassembled PDU]"
"362","0.610650797","199.232.37.140","192.168.1.118","TLSv1.2","2770","Application Data, Application Data"
"363","0.610741288","192.168.1.118","199.232.37.140","TCP","66","41422 → 443 [ACK] Seq=871 Ack=60084 Win=149376 Len=0 TSval=18544242 TSecr=2789244868"
"364","0.610803165","199.232.37.140","192.168.1.118","TLSv1.2","2770","Application Data, Application Data"
"365","0.610825741","192.168.1.118","199.232.37.140","TCP","66","41422 → 443 [ACK] Seq=871 Ack=62788 Win=154752 Len=0 TSval=18544242 TSecr=2789244868"
"366","0.610888231","199.232.37.140","192.168.1.118","TLSv1.2","1418","Application Data [TCP segment of a reassembled PDU]"
"367","0.610910631","192.168.1.118","199.232.37.140","TCP","66","41425 → 443 [ACK] Seq=873 Ack=30362 Win=89856 Len=0 TSval=18544242 TSecr=248416319"
"368","0.610923582","199.232.37.140","192.168.1.118","TLSv1.2","2770","Application Data, Application Data"
"369","0.610938307","199.232.37.140","192.168.1.118","TLSv1.2","2770","Application Data, Application Data"
"370","0.610957845","192.168.1.118","199.232.37.140","TCP","66","41418 → 443 [ACK] Seq=1232 Ack=50403 Win=129920 Len=0 TSval=18544242 TSecr=1652480287"
"371","0.610971571","199.232.37.140","192.168.1.118","TLSv1.2","6826","Application Data, Application Data, Application Data, Application Data, Application Data"
"372","0.610992809","192.168.1.118","199.232.37.140","TCP","66","41421 → 443 [ACK] Seq=919 Ack=50738 Win=130688 Len=0 TSval=18544242 TSecr=488149781"
"373","0.611040273","199.232.37.140","192.168.1.118","TLSv1.2","1418","Application Data [TCP segment of a reassembled PDU]"
"374","0.611068937","199.232.37.140","192.168.1.118","TLSv1.2","1418","Application Data [TCP segment of a reassembled PDU]"
"375","0.611089088","192.168.1.118","199.232.37.140","TCP","66","41421 → 443 [ACK] Seq=919 Ack=53442 Win=136064 Len=0 TSval=18544242 TSecr=488149781"
"376","0.612666430","199.232.37.140","192.168.1.118","TLSv1.2","2770","Application Data, Application Data"
"377","0.612744233","192.168.1.118","199.232.37.140","TCP","66","41421 → 443 [ACK] Seq=919 Ack=56146 Win=141440 Len=0 TSval=18544244 TSecr=488149781"
"378","0.613029230","192.168.1.118","199.232.37.140","TCP","66","41422 → 443 [ACK] Seq=871 Ack=65492 Win=152576 Len=0 TSval=18544244 TSecr=2789244869"
"379","0.615246808","199.232.37.140","192.168.1.118","TLSv1.2","2210","Application Data, Application Data"
"380","0.615334261","192.168.1.118","199.232.37.140","TCP","66","41421 → 443 [ACK] Seq=919 Ack=58290 Win=145792 Len=0 TSval=18544246 TSecr=488149781"
"381","0.615397976","199.232.37.140","192.168.1.118","TLSv1.2","1418","Application Data [TCP segment of a reassembled PDU]"
"382","0.615433302","199.232.37.140","192.168.1.118","TLSv1.2","5474","Application Data, Application Data, Application Data, Application Data"
"383","0.615455065","192.168.1.118","199.232.37.140","TCP","66","41418 → 443 [ACK] Seq=1232 Ack=55811 Win=140800 Len=0 TSval=18544246 TSecr=1652480287"
"384","0.615476141","199.232.37.140","192.168.1.118","TLSv1.2","5474","Application Data, Application Data, Application Data"
"385","0.615498454","199.232.37.140","192.168.1.118","TLSv1.2","2770","Application Data, Application Data"
"386","0.615516267","192.168.1.118","199.232.37.140","TCP","66","41425 → 443 [ACK] Seq=873 Ack=34418 Win=98048 Len=0 TSval=18544246 TSecr=248416321"
"387","0.615529105","199.232.37.140","192.168.1.118","TLSv1.2","1418","Application Data [TCP segment of a reassembled PDU]"
"388","0.617897901","199.232.37.140","192.168.1.118","TLSv1.2","1418","Application Data [TCP segment of a reassembled PDU]"
"389","0.617983066","192.168.1.118","199.232.37.140","TCP","66","41418 → 443 [ACK] Seq=1232 Ack=58515 Win=146176 Len=0 TSval=18544249 TSecr=1652480288"
"390","0.618053731","199.232.37.140","192.168.1.118","TLSv1.2","2770","Application Data, Application Data"
"391","0.618076370","192.168.1.118","199.232.37.140","TCP","66","41418 → 443 [ACK] Seq=1232 Ack=61219 Win=151552 Len=0 TSval=18544249 TSecr=1652480290"
"392","0.618086645","199.232.37.140","192.168.1.118","TLSv1.2","1418","Application Data [TCP segment of a reassembled PDU]"
"393","0.618168698","199.232.37.140","192.168.1.118","TLSv1.2","1418","Application Data [TCP segment of a reassembled PDU]"
"394","0.618203749","199.232.37.140","192.168.1.118","TLSv1.2","2770","Application Data, Application Data"
"395","0.618225550","192.168.1.118","199.232.37.140","TCP","66","41418 → 443 [ACK] Seq=1232 Ack=63923 Win=157056 Len=0 TSval=18544249 TSecr=1652480291"
"396","0.618253476","199.232.37.140","192.168.1.118","TLSv1.2","2770","Application Data, Application Data"
"397","0.618273902","192.168.1.118","199.232.37.140","TCP","66","41418 → 443 [ACK] Seq=1232 Ack=66627 Win=158720 Len=0 TSval=18544249 TSecr=1652480293"
"398","0.618301902","199.232.37.140","192.168.1.118","TLSv1.2","2770","Application Data, Application Data"
"399","0.618320816","199.232.37.140","192.168.1.118","TLSv1.2","2770","Application Data, Application Data"
"400","0.618342241","192.168.1.118","199.232.37.140","TCP","66","41425 → 443 [ACK] Seq=873 Ack=37122 Win=103424 Len=0 TSval=18544249 TSecr=248416323"
"401","0.618355854","199.232.37.140","192.168.1.118","TLSv1.2","2770","Application Data, Application Data"
"402","0.618369242","199.232.37.140","192.168.1.118","TCP","1418","[TCP segment of a reassembled PDU]"
"403","0.618973013","192.168.1.118","199.232.37.140","TCP","66","41422 → 443 [ACK] Seq=871 Ack=76308 Win=141824 Len=0 TSval=18544250 TSecr=2789244870"
"404","0.619193134","192.168.1.118","199.232.37.140","TCP","66","41418 → 443 [ACK] Seq=1232 Ack=70683 Win=154752 Len=0 TSval=18544250 TSecr=1652480295"
"405","0.631484789","199.232.37.140","192.168.1.118","TLSv1.2","2770","Application Data, Application Data"
"406","0.631582067","192.168.1.118","199.232.37.140","TCP","66","41422 → 443 [ACK] Seq=871 Ack=79012 Win=160128 Len=0 TSval=18544262 TSecr=2789244872"
"407","0.631625506","199.232.37.140","192.168.1.118","TLSv1.2","4122","Application Data, Application Data, Application Data"
"408","0.631643757","199.232.37.140","192.168.1.118","TLSv1.2","1418","Application Data [TCP segment of a reassembled PDU]"
"409","0.631716084","199.232.37.140","192.168.1.118","TLSv1.2","1418","Application Data [TCP segment of a reassembled PDU]"
"410","0.631729322","199.232.37.140","192.168.1.118","TLSv1.2","2770","Application Data, Application Data"
"411","0.631745010","199.232.37.140","192.168.1.118","TLSv1.2","2770","Application Data, Application Data"
"412","0.631766274","192.168.1.118","199.232.37.140","TCP","66","41425 → 443 [ACK] Seq=873 Ack=39826 Win=108800 Len=0 TSval=18544263 TSecr=248416325"
"413","0.632588327","192.168.1.118","199.232.37.140","TCP","66","41422 → 443 [ACK] Seq=871 Ack=81716 Win=158720 Len=0 TSval=18544263 TSecr=2789244872"
"414","0.632783609","192.168.1.118","199.232.37.140","TCP","66","41418 → 443 [ACK] Seq=1232 Ack=77443 Win=148096 Len=0 TSval=18544264 TSecr=1652480297"
"415","0.639520470","199.232.37.140","192.168.1.118","TLSv1.2","2770","Application Data, Application Data"
"416","0.639620049","192.168.1.118","199.232.37.140","TCP","66","41418 → 443 [ACK] Seq=1232 Ack=80147 Win=167808 Len=0 TSval=18544271 TSecr=1652480300"
"417","0.639670725","199.232.37.140","192.168.1.118","TLSv1.2","2770","Application Data, Application Data"
"418","0.639689126","199.232.37.140","192.168.1.118","TLSv1.2","2770","Application Data, Application Data"
"419","0.639788454","199.232.37.140","192.168.1.118","TLSv1.2","4122","Application Data, Application Data, Application Data"
"420","0.639817568","199.232.37.140","192.168.1.118","TLSv1.2","2770","Application Data, Application Data"
"421","0.639833481","199.232.37.140","192.168.1.118","TLSv1.2","2770","Application Data, Application Data"
"422","0.639855582","192.168.1.118","199.232.37.140","TCP","66","41425 → 443 [ACK] Seq=873 Ack=42530 Win=114176 Len=0 TSval=18544271 TSecr=248416326"
"423","0.639870532","199.232.37.140","192.168.1.118","TLSv1.2","2770","Application Data, Application Data"
"424","0.639881958","199.232.37.140","192.168.1.118","TLSv1.2","1418","Application Data [TCP segment of a reassembled PDU]"
"425","0.642457010","192.168.1.118","199.232.37.140","TCP","66","41422 → 443 [ACK] Seq=871 Ack=91180 Win=149376 Len=0 TSval=18544273 TSecr=2789244873"
"426","0.643795757","192.168.1.118","199.232.37.140","TCP","66","41418 → 443 [ACK] Seq=1232 Ack=86907 Win=161152 Len=0 TSval=18544275 TSecr=1652480301"
"427","0.651125014","199.232.37.140","192.168.1.118","TLSv1.2","2380","Application Data, Application Data, Application Data"
"428","0.651190204","199.232.37.140","192.168.1.118","TLSv1.2","1418","Application Data [TCP segment of a reassembled PDU]"
"429","0.651215292","199.232.37.140","192.168.1.118","TLSv1.2","2770","Application Data, Application Data"
"430","0.651309620","199.232.37.140","192.168.1.118","TLSv1.2","1697","Application Data, Application Data"
"431","0.651351109","192.168.1.118","199.232.37.140","TCP","66","41426 → 443 [ACK] Seq=873 Ack=18473 Win=66048 Len=0 TSval=18544282 TSecr=2763172620"
"432","0.651425337","199.232.37.140","192.168.1.118","TLSv1.2","2770","Application Data, Application Data"
"433","0.651448525","192.168.1.118","199.232.37.140","TCP","66","41425 → 443 [ACK] Seq=873 Ack=45234 Win=119680 Len=0 TSval=18544282 TSecr=248416328"
"434","0.651462013","199.232.37.140","192.168.1.118","TLSv1.2","2770","Application Data, Application Data"
"435","0.651474676","199.232.37.140","192.168.1.118","TLSv1.2","6826","Application Data, Application Data, Application Data, Application Data, Application Data"
"436","0.651495689","192.168.1.118","199.232.37.140","TCP","66","41423 → 443 [ACK] Seq=873 Ack=50642 Win=130432 Len=0 TSval=18544282 TSecr=1092509330"
"437","0.653363992","199.232.37.140","192.168.1.118","TLSv1.2","1418","Application Data [TCP segment of a reassembled PDU]"
"438","0.653454783","199.232.37.140","192.168.1.118","TLSv1.2","4122","Application Data, Application Data, Application Data"
"439","0.653492972","192.168.1.118","199.232.37.140","TCP","66","41423 → 443 [ACK] Seq=873 Ack=56050 Win=141312 Len=0 TSval=18544284 TSecr=1092509330"
"440","0.653632814","199.232.37.140","192.168.1.118","TLSv1.2","13586","Application Data, Application Data, Application Data, Application Data, Application Data, Application Data, Application Data, Application Data, Application Data"
"441","0.653657927","192.168.1.118","199.232.37.140","TCP","66","41423 → 443 [ACK] Seq=873 Ack=69570 Win=144000 Len=0 TSval=18544285 TSecr=1092509330"
"442","0.653691854","199.232.37.140","192.168.1.118","TLSv1.2","2770","Application Data, Application Data"
"443","0.653882873","192.168.1.118","199.232.37.140","TCP","66","41422 → 443 [ACK] Seq=871 Ack=93494 Win=147072 Len=0 TSval=18544285 TSecr=2789244875"
"444","0.656603430","192.168.1.118","199.232.37.140","TCP","66","41423 → 443 [ACK] Seq=873 Ack=72274 Win=141312 Len=0 TSval=18544287 TSecr=1092509330"
"445","0.656759123","192.168.1.118","199.232.37.140","TCP","66","41418 → 443 [ACK] Seq=1232 Ack=93667 Win=154496 Len=0 TSval=18544288 TSecr=1652480305"
"446","0.660130304","199.232.37.140","192.168.1.118","TLSv1.2","5474","Application Data, Application Data, Application Data, Application Data"
"447","0.660323036","199.232.37.140","192.168.1.118","TLSv1.2","16290","Application Data, Application Data, Application Data, Application Data, Application Data, Application Data, Application Data, Application Data, Application Data, Application Data, Application Data, Application Data"
"448","0.662703519","192.168.1.118","199.232.37.140","TCP","66","41423 → 443 [ACK] Seq=873 Ack=93906 Win=119680 Len=0 TSval=18544294 TSecr=1092509330"
"449","0.662890363","199.232.37.140","192.168.1.118","TLSv1.2","2547","Application Data, Application Data, Application Data"
"450","0.662965666","199.232.37.140","192.168.1.118","TLSv1.2","4122","Application Data, Application Data, Application Data"
"451","0.662981766","199.232.37.140","192.168.1.118","TLSv1.2","1418","Application Data [TCP segment of a reassembled PDU]"
"452","0.663052944","199.232.37.140","192.168.1.118","TLSv1.2","1418","Application Data [TCP segment of a reassembled PDU]"
"453","0.663091770","192.168.1.118","199.232.37.140","TCP","66","41425 → 443 [ACK] Seq=873 Ack=47938 Win=125056 Len=0 TSval=18544294 TSecr=248416329"
"454","0.663130934","199.232.37.140","192.168.1.118","TLSv1.2","1418","Application Data [TCP segment of a reassembled PDU]"
"455","0.663169548","199.232.37.140","192.168.1.118","TLSv1.2","2770","Application Data, Application Data"
"456","0.663190949","192.168.1.118","199.232.37.140","TCP","66","41425 → 443 [ACK] Seq=873 Ack=51994 Win=133120 Len=0 TSval=18544294 TSecr=248416330"
"457","0.663230412","199.232.37.140","192.168.1.118","TLSv1.2","5474","Application Data, Application Data, Application Data, Application Data"
"458","0.663253201","192.168.1.118","199.232.37.140","TCP","66","41425 → 443 [ACK] Seq=873 Ack=57402 Win=144000 Len=0 TSval=18544294 TSecr=248416333"
"459","0.663276514","199.232.37.140","192.168.1.118","TLSv1.2","2770","Application Data, Application Data"
"460","0.663297652","192.168.1.118","199.232.37.140","TCP","66","41425 → 443 [ACK] Seq=873 Ack=60106 Win=149376 Len=0 TSval=18544294 TSecr=248416334"
"461","0.664271424","192.168.1.118","199.232.37.140","TCP","66","41423 → 443 [ACK] Seq=873 Ack=97962 Win=115712 Len=0 TSval=18544295 TSecr=1092509330"
"462","0.664511570","192.168.1.118","199.232.37.140","TCP","66","41418 → 443 [ACK] Seq=1232 Ack=96148 Win=152064 Len=0 TSval=18544295 TSecr=1652480313"
"463","0.668852884","199.232.37.140","192.168.1.118","TLSv1.2","2770","Application Data, Application Data"
"464","0.668940662","192.168.1.118","199.232.37.140","TCP","66","41425 → 443 [ACK] Seq=873 Ack=62810 Win=154752 Len=0 TSval=18544300 TSecr=248416335"
"465","0.668991039","199.232.37.140","192.168.1.118","TLSv1.2","2770","Application Data, Application Data"
"466","0.670796502","199.232.37.140","192.168.1.118","TLSv1.2","2770","Application Data [TCP segment of a reassembled PDU]"
"467","0.670870042","199.232.37.140","192.168.1.118","TLSv1.2","2770","Application Data, Application Data"
"468","0.670894493","199.232.37.140","192.168.1.118","TLSv1.2","2770","Application Data, Application Data"
"469","0.671704597","199.232.37.140","192.168.1.118","TLSv1.2","2770","Application Data, Application Data"
"470","0.671781262","192.168.1.118","199.232.37.140","TCP","66","41425 → 443 [ACK] Seq=873 Ack=73626 Win=144000 Len=0 TSval=18544303 TSecr=248416336"
"471","0.671874590","192.168.1.118","199.232.37.140","TCP","66","41425 → 443 [ACK] Seq=873 Ack=76330 Win=141312 Len=0 TSval=18544303 TSecr=248416340"
"472","0.673771181","199.232.37.140","192.168.1.118","TLSv1.2","9530","Application Data, Application Data, Application Data, Application Data, Application Data, Application Data"
"473","0.675339199","199.232.37.140","192.168.1.118","TLSv1.2","4122","Application Data, Application Data, Application Data"
"474","0.675390251","199.232.37.140","192.168.1.118","TLSv1.2","78","Application Data"
"475","0.675418364","199.232.37.140","192.168.1.118","TLSv1.2","2770","Application Data, Application Data"
"476","0.677385245","192.168.1.118","199.232.37.140","TCP","66","41423 → 443 [ACK] Seq=873 Ack=111494 Win=102272 Len=0 TSval=18544308 TSecr=1092509341"
"477","0.678668165","199.232.37.140","192.168.1.118","TLSv1.2","1418","Application Data [TCP segment of a reassembled PDU]"
"478","0.678830521","192.168.1.118","199.232.37.140","TCP","66","41425 → 443 [ACK] Seq=873 Ack=80386 Win=137344 Len=0 TSval=18544310 TSecr=248416340"
"479","0.681052486","199.232.37.140","192.168.1.118","TLSv1.2","2770","Application Data, Application Data"
"480","0.681126714","199.232.37.140","192.168.1.118","TLSv1.2","2770","Application Data, Application Data"
"481","0.681841526","199.232.37.140","192.168.1.118","TLSv1.2","2770","Application Data, Application Data"
"482","0.683014055","192.168.1.118","199.232.37.140","TCP","66","41425 → 443 [ACK] Seq=873 Ack=88498 Win=129280 Len=0 TSval=18544314 TSecr=248416341"
"483","0.684349614","199.232.37.140","192.168.1.118","TLSv1.2","1418","Application Data [TCP segment of a reassembled PDU]"
"484","0.685353162","199.232.37.140","192.168.1.118","TLSv1.2","1418","Application Data [TCP segment of a reassembled PDU]"
"485","0.685511192","192.168.1.118","199.232.37.140","TCP","66","41425 → 443 [ACK] Seq=873 Ack=91202 Win=126592 Len=0 TSval=18544316 TSecr=248416343"
"486","0.692700356","199.232.37.140","192.168.1.118","TLSv1.2","2770","Application Data, Application Data"
"487","0.692868100","192.168.1.118","199.232.37.140","TCP","66","41425 → 443 [ACK] Seq=873 Ack=93906 Win=123904 Len=0 TSval=18544324 TSecr=248416344"
"488","0.695124966","199.232.37.140","192.168.1.118","TLSv1.2","8178","Application Data, Application Data, Application Data, Application Data, Application Data, Application Data"
"489","0.695208494","199.232.37.140","192.168.1.118","TLSv1.2","4122","Application Data, Application Data, Application Data"
"490","0.696106763","199.232.37.140","192.168.1.118","TCP","1418","443 → 41425 [ACK] Seq=106074 Ack=873 Win=29184 Len=1352 TSval=248416346 TSecr=18544310 [TCP segment of a reassembled PDU]"
"491","0.696171240","199.232.37.140","192.168.1.118","TLSv1.2","2770","Application Data, Application Data"
"492","0.696657595","192.168.1.118","199.232.37.140","TCP","66","41425 → 443 [ACK] Seq=873 Ack=110130 Win=107776 Len=0 TSval=18544328 TSecr=248416345"
"493","0.697058421","199.232.37.140","192.168.1.118","TLSv1.2","2770","Application Data, Application Data"
"494","0.698474721","199.232.37.140","192.168.1.118","TLSv1.2","1418","Application Data [TCP segment of a reassembled PDU]"
"495","0.699473368","199.232.37.140","192.168.1.118","TLSv1.2","1418","Application Data [TCP segment of a reassembled PDU]"
"496","0.699525708","199.232.37.140","192.168.1.118","TLSv1.2","1418","Application Data [TCP segment of a reassembled PDU]"
"497","0.700662998","199.232.37.140","192.168.1.118","TLSv1.2","4122","Application Data, Application Data, Application Data"
"498","0.701209742","192.168.1.118","199.232.37.140","TCP","66","41425 → 443 [ACK] Seq=873 Ack=120946 Win=97024 Len=0 TSval=18544332 TSecr=248416347"
"499","0.701715434","199.232.37.140","192.168.1.118","TLSv1.2","2037","Application Data, Application Data, Application Data"
"500","0.703687128","192.168.1.118","199.232.37.140","TCP","66","41425 → 443 [ACK] Seq=873 Ack=122917 Win=98560 Len=0 TSval=18544335 TSecr=248416348"
"501","0.720198181","192.168.1.118","192.168.1.102","TCP","176","33923 → 8009 [PSH, ACK] Seq=1 Ack=1 Win=364 Len=110 TSval=18544351 TSecr=4399747 [TCP segment of a reassembled PDU]"
"502","0.727587502","192.168.1.102","192.168.1.118","TCP","176","8009 → 33923 [PSH, ACK] Seq=1 Ack=111 Win=294 Len=110 TSval=4400248 TSecr=18544351 [TCP segment of a reassembled PDU]"
"503","0.727689731","192.168.1.118","192.168.1.102","TCP","66","33923 → 8009 [ACK] Seq=111 Ack=111 Win=364 Len=0 TSval=18544359 TSecr=4400248"
"504","1.157150024","192.168.1.118","199.232.37.140","TLSv1.2","249","Application Data"
"505","1.177845948","199.232.37.140","192.168.1.118","TLSv1.2","1151","Application Data, Application Data"
"506","1.177944527","192.168.1.118","199.232.37.140","TCP","66","41409 → 443 [ACK] Seq=184 Ack=1086 Win=448 Len=0 TSval=18544809 TSecr=250675062"
"507","2.113075830","192.168.1.104","255.255.255.255","UDP","217","49154 → 6666 Len=175"
"508","4.468290047","192.168.1.102","224.0.0.251","MDNS","183","Standard query response 0x0000 SRV, cache flush 0 0 8009 2c3f16b2-da5c-4b6f-d6cf-bfba61c12490.local"
"509","5.184038159","192.168.1.118","209.18.47.62","DNS","89","Standard query 0xbe74 A connectivitycheck.gstatic.com"
"510","5.184164126","192.168.1.118","209.18.47.62","DNS","89","Standard query 0x64e6 AAAA connectivitycheck.gstatic.com"
"511","5.185537199","192.168.1.104","255.255.255.255","UDP","217","49154 → 6666 Len=175"
"512","5.205174574","209.18.47.62","192.168.1.118","DNS","105","Standard query response 0xbe74 A connectivitycheck.gstatic.com A 172.217.11.35"
"513","5.208838377","209.18.47.62","192.168.1.118","DNS","117","Standard query response 0x64e6 AAAA connectivitycheck.gstatic.com AAAA 2607:f8b0:4006:815::2003"
"514","5.209352683","192.168.1.118","172.217.11.35","TCP","74","41742 → 443 [SYN] Seq=0 Win=29200 Len=0 MSS=1460 SACK_PERM=1 TSval=18548840 TSecr=0 WS=128"
"515","5.224720133","172.217.11.35","192.168.1.118","TCP","74","443 → 41742 [SYN, ACK] Seq=0 Ack=1 Win=60192 Len=0 MSS=1380 SACK_PERM=1 TSval=3983646659 TSecr=18548840 WS=256"
"516","5.224848363","192.168.1.118","172.217.11.35","TCP","66","41742 → 443 [ACK] Seq=1 Ack=1 Win=29312 Len=0 TSval=18548856 TSecr=3983646659"
"517","5.225482435","192.168.1.118","172.217.11.35","TLSv1","254","Client Hello"
"518","5.250844910","172.217.11.35","192.168.1.118","TCP","66","443 → 41742 [ACK] Seq=1 Ack=189 Win=61440 Len=0 TSval=3983646685 TSecr=18548856"
"519","5.257288798","172.217.11.35","192.168.1.118","TLSv1.2","1484","Server Hello"
"520","5.257383376","192.168.1.118","172.217.11.35","TCP","66","41742 → 443 [ACK] Seq=189 Ack=1419 Win=32128 Len=0 TSval=18548888 TSecr=3983646691"
"521","5.259217541","172.217.11.35","192.168.1.118","TLSv1.2","1279","Certificate, Server Key Exchange, Server Hello Done"
"522","5.259299769","192.168.1.118","172.217.11.35","TCP","66","41742 → 443 [ACK] Seq=189 Ack=2632 Win=34944 Len=0 TSval=18548890 TSecr=3983646691"
"523","5.262412590","192.168.1.118","172.217.11.35","TLSv1.2","151","Client Key Exchange, Change Cipher Spec, Encrypted Handshake Message"
"524","5.274633643","192.168.1.118","172.217.9.238","TCP","66","34455 → 443 [ACK] Seq=1 Ack=1 Win=255 Len=0 TSval=18548906 TSecr=2073284948"
"525","5.279034234","172.217.11.35","192.168.1.118","TLSv1.2","109","Change Cipher Spec, Encrypted Handshake Message"
"526","5.279492313","192.168.1.118","172.217.11.35","TLSv1.2","283","Application Data"
"527","5.291517384","172.217.9.238","192.168.1.118","TCP","66","[TCP ACKed unseen segment] 443 → 34455 [ACK] Seq=1 Ack=2 Win=249 Len=0 TSval=2073329963 TSecr=18503881"
"528","5.301214660","172.217.11.35","192.168.1.118","TLSv1.2","427","Application Data"
"529","5.301824094","192.168.1.118","172.217.11.35","TLSv1.2","89","Encrypted Alert"
"530","5.301973912","192.168.1.118","172.217.11.35","TCP","66","41742 → 443 [FIN, ACK] Seq=514 Ack=3036 Win=37760 Len=0 TSval=18548933 TSecr=3983646736"
"531","5.319112487","172.217.11.35","192.168.1.118","TCP","66","443 → 41742 [FIN, ACK] Seq=3036 Ack=515 Win=62464 Len=0 TSval=3983646753 TSecr=18548933"
"532","5.319210215","192.168.1.118","172.217.11.35","TCP","66","41742 → 443 [ACK] Seq=515 Ack=3037 Win=37760 Len=0 TSval=18548950 TSecr=3983646753"
"533","5.729710807","192.168.1.118","192.168.1.102","TCP","176","33923 → 8009 [PSH, ACK] Seq=111 Ack=111 Win=364 Len=110 TSval=18549361 TSecr=4400248 [TCP segment of a reassembled PDU]"
"534","5.745755656","192.168.1.102","192.168.1.118","TCP","176","8009 → 33923 [PSH, ACK] Seq=111 Ack=221 Win=294 Len=110 TSval=4400751 TSecr=18549361 [TCP segment of a reassembled PDU]"
"535","5.745861097","192.168.1.118","192.168.1.102","TCP","66","33923 → 8009 [ACK] Seq=221 Ack=221 Win=364 Len=0 TSval=18549377 TSecr=4400751"
"536","7.171795053","192.168.1.118","142.250.31.188","TLSv1.2","99","Application Data"
"537","7.191917770","142.250.31.188","192.168.1.118","TCP","66","5228 → 34024 [ACK] Seq=1 Ack=34 Win=248 Len=0 TSval=3513760984 TSecr=18550803"
"538","7.209322217","142.250.31.188","192.168.1.118","TLSv1.2","99","Application Data"
"539","7.209688217","192.168.1.118","142.250.31.188","TLSv1.2","109","Application Data"
"540","7.240497095","142.250.31.188","192.168.1.118","TCP","66","5228 → 34024 [ACK] Seq=34 Ack=77 Win=248 Len=0 TSval=3513761028 TSecr=18550841"
"541","8.155817093","192.168.1.104","255.255.255.255","UDP","217","49154 → 6666 Len=175"
