frame.number,_ws.col.Time,_ws.col.Source,_ws.col.Destination,_ws.col.Protocol,frame.len,_ws.col.Info
"1","0.000000000","72.30.35.9","192.168.1.118","TLSv1.2","117","Change Cipher Spec, Encrypted Handshake Message"
"2","0.000545344","192.168.1.118","72.30.35.9","TLSv1.2","203","Application Data"
"3","0.062091373","72.30.35.9","192.168.1.118","TLSv1.2","1395","Application Data"
"4","0.062967941","72.30.35.9","192.168.1.118","TLSv1.2","248","Application Data"
"5","0.063029856","192.168.1.118","72.30.35.9","TCP","66","41495 → 443 [ACK] Seq=138 Ack=1563 Win=324 Len=0 TSval=18503468 TSecr=678685002"
"6","0.063091845","72.30.35.9","192.168.1.118","TLSv1.2","117","Application Data"
"7","0.084037403","72.30.35.9","192.168.1.118","TLSv1.2","1395","Application Data"
"8","0.084114506","72.30.35.9","192.168.1.118","TLSv1.2","1395","Application Data"
"9","0.084156182","192.168.1.118","72.30.35.9","TCP","66","41495 → 443 [ACK] Seq=138 Ack=4272 Win=367 Len=0 TSval=18503490 TSecr=678685002"
"10","0.084203009","72.30.35.9","192.168.1.118","TLSv1.2","309","Application Data"
"11","0.088627901","192.168.1.118","209.18.47.62","DNS","70","Standard query 0xceb9 A s.yimg.com"
"12","0.088863947","192.168.1.118","209.18.47.62","DNS","70","Standard query 0x9e95 A s.yimg.com"
"13","0.105189331","72.30.35.9","192.168.1.118","TLSv1.2","1395","Application Data"
"14","0.105275572","192.168.1.118","72.30.35.9","TCP","66","41495 → 443 [ACK] Seq=138 Ack=5844 Win=409 Len=0 TSval=18503511 TSecr=678685015"
"15","0.107154337","72.30.35.9","192.168.1.118","TLSv1.2","243","Application Data"
"16","0.107213714","72.30.35.9","192.168.1.118","TLSv1.2","1395","Application Data"
"17","0.107248316","192.168.1.118","72.30.35.9","TCP","66","41495 → 443 [ACK] Seq=138 Ack=7350 Win=450 Len=0 TSval=18503513 TSecr=678685045"
"18","0.107286242","72.30.35.9","192.168.1.118","TLSv1.2","473","Application Data"
"19","0.112121074","209.18.47.62","192.168.1.118","DNS","141","Standard query response 0x9e95 A s.yimg.com CNAME edge.gycpi.b.yahoodns.net A 69.147.82.61 A 69.147.82.60"
"20","0.112306243","192.168.1.118","209.18.47.62","DNS","70","Standard query 0xd6bb AAAA s.yimg.com"
"21","0.114109443","192.168.1.118","209.18.47.62","DNS","70","Standard query 0x7278 A s.yimg.com"
"22","0.114351177","192.168.1.118","209.18.47.62","DNS","70","Standard query 0x42c7 A s.yimg.com"
"23","0.114539333","192.168.1.118","209.18.47.62","DNS","70","Standard query 0xb66c A s.yimg.com"
"24","0.116036611","209.18.47.62","192.168.1.118","DNS","141","Standard query response 0xceb9 A s.yimg.com CNAME edge.gycpi.b.yahoodns.net A 69.147.82.60 A 69.147.82.61"
"25","0.116249781","192.168.1.118","209.18.47.62","DNS","70","Standard query 0x5e0e AAAA s.yimg.com"
"26","0.117065097","72.30.35.9","192.168.1.118","TLSv1.2","279","Application Data, Application Data, Application Data"
"27","0.118034018","192.168.1.118","72.30.35.9","TCP","66","41495 → 443 [ACK] Seq=138 Ack=7970 Win=492 Len=0 TSval=18503523 TSecr=678685045"
"28","0.119894421","72.30.35.9","192.168.1.118","TLSv1.2","251","Application Data"
"29","0.134098630","209.18.47.62","192.168.1.118","DNS","165","Standard query response 0xd6bb AAAA s.yimg.com CNAME edge.gycpi.b.yahoodns.net AAAA 2001:4998:1c:800::1000 AAAA 2001:4998:1c:800::1001"
"30","0.135361587","192.168.1.118","69.147.82.61","TCP","74","37022 → 443 [SYN] Seq=0 Win=29200 Len=0 MSS=1460 SACK_PERM=1 TSval=18503541 TSecr=0 WS=128"
"31","0.135793040","192.168.1.118","69.147.82.61","TCP","74","37023 → 443 [SYN] Seq=0 Win=29200 Len=0 MSS=1460 SACK_PERM=1 TSval=18503541 TSecr=0 WS=128"
"32","0.135882455","192.168.1.118","69.147.82.61","TCP","74","37024 → 443 [SYN] Seq=0 Win=29200 Len=0 MSS=1460 SACK_PERM=1 TSval=18503541 TSecr=0 WS=128"
"33","0.135958695","192.168.1.118","69.147.82.61","TCP","74","37025 → 443 [SYN] Seq=0 Win=29200 Len=0 MSS=1460 SACK_PERM=1 TSval=18503541 TSecr=0 WS=128"
"34","0.136055586","192.168.1.118","69.147.82.61","TCP","74","37026 → 443 [SYN] Seq=0 Win=29200 Len=0 MSS=1460 SACK_PERM=1 TSval=18503541 TSecr=0 WS=128"
"35","0.142464473","209.18.47.62","192.168.1.118","DNS","141","Standard query response 0x42c7 A s.yimg.com CNAME edge.gycpi.b.yahoodns.net A 69.147.82.60 A 69.147.82.61"
"36","0.142658430","192.168.1.118","209.18.47.62","DNS","70","Standard query 0xde1d AAAA s.yimg.com"
"37","0.143910949","209.18.47.62","192.168.1.118","DNS","141","Standard query response 0x7278 A s.yimg.com CNAME edge.gycpi.b.yahoodns.net A 69.147.82.60 A 69.147.82.61"
"38","0.144092280","192.168.1.118","209.18.47.62","DNS","70","Standard query 0x668a AAAA s.yimg.com"
"39","0.147727945","209.18.47.62","192.168.1.118","DNS","141","Standard query response 0xb66c A s.yimg.com CNAME edge.gycpi.b.yahoodns.net A 69.147.82.60 A 69.147.82.61"
"40","0.147917239","192.168.1.118","209.18.47.62","DNS","70","Standard query 0x1268 AAAA s.yimg.com"
"41","0.149174008","209.18.47.62","192.168.1.118","DNS","165","Standard query response 0x5e0e AAAA s.yimg.com CNAME edge.gycpi.b.yahoodns.net AAAA 2001:4998:1c:800::1001 AAAA 2001:4998:1c:800::1000"
"42","0.153118308","69.147.82.61","192.168.1.118","TCP","74","443 → 37023 [SYN, ACK] Seq=0 Ack=1 Win=28960 Len=0 MSS=1460 TSval=2929520508 TSecr=18503541 WS=256"
"43","0.153235713","192.168.1.118","69.147.82.61","TCP","66","37023 → 443 [ACK] Seq=1 Ack=1 Win=29312 Len=0 TSval=18503559 TSecr=2929520508"
"44","0.154546608","69.147.82.61","192.168.1.118","TCP","74","443 → 37025 [SYN, ACK] Seq=0 Ack=1 Win=28960 Len=0 MSS=1460 TSval=2934121808 TSecr=18503541 WS=256"
"45","0.154644824","192.168.1.118","69.147.82.61","TCP","66","37025 → 443 [ACK] Seq=1 Ack=1 Win=29312 Len=0 TSval=18503560 TSecr=2934121808"
"46","0.156450450","69.147.82.61","192.168.1.118","TCP","74","443 → 37022 [SYN, ACK] Seq=0 Ack=1 Win=28960 Len=0 MSS=1460 TSval=2934121809 TSecr=18503541 WS=256"
"47","0.156549329","192.168.1.118","69.147.82.61","TCP","66","37022 → 443 [ACK] Seq=1 Ack=1 Win=29312 Len=0 TSval=18503562 TSecr=2934121809"
"48","0.156591943","69.147.82.61","192.168.1.118","TCP","74","443 → 37024 [SYN, ACK] Seq=0 Ack=1 Win=28960 Len=0 MSS=1460 TSval=2929520508 TSecr=18503541 WS=256"
"49","0.156620094","192.168.1.118","69.147.82.61","TCP","66","37024 → 443 [ACK] Seq=1 Ack=1 Win=29312 Len=0 TSval=18503562 TSecr=2929520508"
"50","0.159138132","192.168.1.118","72.30.35.9","TCP","66","41495 → 443 [ACK] Seq=138 Ack=8155 Win=513 Len=0 TSval=18503565 TSecr=678685059"
"51","0.167654655","209.18.47.62","192.168.1.118","DNS","165","Standard query response 0xde1d AAAA s.yimg.com CNAME edge.gycpi.b.yahoodns.net AAAA 2001:4998:1c:800::1000 AAAA 2001:4998:1c:800::1001"
"52","0.168981776","69.147.82.61","192.168.1.118","TCP","74","443 → 37026 [SYN, ACK] Seq=0 Ack=1 Win=28960 Len=0 MSS=1460 TSval=446442226 TSecr=18503541 WS=256"
"53","0.169096555","192.168.1.118","69.147.82.61","TCP","66","37026 → 443 [ACK] Seq=1 Ack=1 Win=29312 Len=0 TSval=18503574 TSecr=446442226"
"54","0.170439177","209.18.47.62","192.168.1.118","DNS","165","Standard query response 0x668a AAAA s.yimg.com CNAME edge.gycpi.b.yahoodns.net AAAA 2001:4998:1c:800::1000 AAAA 2001:4998:1c:800::1001"
"55","0.171649320","209.18.47.62","192.168.1.118","DNS","165","Standard query response 0x1268 AAAA s.yimg.com CNAME edge.gycpi.b.yahoodns.net AAAA 2001:4998:1c:800::1000 AAAA 2001:4998:1c:800::1001"
"56","0.172992804","192.168.1.118","69.147.82.61","TLSv1","583","Client Hello"
"57","0.175403626","72.30.35.9","192.168.1.118","TLSv1.2","1395","Application Data"
"58","0.175489804","192.168.1.118","72.30.35.9","TCP","66","41495 → 443 [ACK] Seq=138 Ack=9484 Win=533 Len=0 TSval=18503581 TSecr=678685115"
"59","0.178827908","72.30.35.9","192.168.1.118","TLSv1.2","243","Application Data"
"60","0.178917236","192.168.1.118","72.30.35.9","TCP","66","41495 → 443 [ACK] Seq=138 Ack=9661 Win=554 Len=0 TSval=18503584 TSecr=678685115"
"61","0.178964738","72.30.35.9","192.168.1.118","TLSv1.2","1395","Application Data"
"62","0.178984301","192.168.1.118","72.30.35.9","TCP","66","41495 → 443 [ACK] Seq=138 Ack=10990 Win=575 Len=0 TSval=18503584 TSecr=678685115"
"63","0.179004552","72.30.35.9","192.168.1.118","TLSv1.2","243","Application Data"
"64","0.179024915","192.168.1.118","72.30.35.9","TCP","66","41495 → 443 [ACK] Seq=138 Ack=11167 Win=596 Len=0 TSval=18503584 TSecr=678685115"
"65","0.179044303","72.30.35.9","192.168.1.118","TLSv1.2","1395","Application Data"
"66","0.179064192","192.168.1.118","72.30.35.9","TCP","66","41495 → 443 [ACK] Seq=138 Ack=12496 Win=616 Len=0 TSval=18503584 TSecr=678685115"
"67","0.179101343","72.30.35.9","192.168.1.118","TLSv1.2","1395","Application Data"
"68","0.179122094","192.168.1.118","72.30.35.9","TCP","66","41495 → 443 [ACK] Seq=138 Ack=13825 Win=637 Len=0 TSval=18503585 TSecr=678685115"
"69","0.179141319","72.30.35.9","192.168.1.118","TLSv1.2","1395","Application Data"
"70","0.179160045","192.168.1.118","72.30.35.9","TCP","66","41495 → 443 [ACK] Seq=138 Ack=15154 Win=658 Len=0 TSval=18503585 TSecr=678685115"
"71","0.179221760","72.30.35.9","192.168.1.118","TLSv1.2","1395","Application Data"
"72","0.179243760","192.168.1.118","72.30.35.9","TCP","66","41495 → 443 [ACK] Seq=138 Ack=16483 Win=679 Len=0 TSval=18503585 TSecr=678685115"
"73","0.179263224","72.30.35.9","192.168.1.118","TLSv1.2","1395","Application Data"
"74","0.179284524","192.168.1.118","72.30.35.9","TCP","66","41495 → 443 [ACK] Seq=138 Ack=17812 Win=700 Len=0 TSval=18503585 TSecr=678685115"
"75","0.179305838","72.30.35.9","192.168.1.118","TLSv1.2","1395","Application Data"
"76","0.179326426","192.168.1.118","72.30.35.9","TCP","66","41495 → 443 [ACK] Seq=138 Ack=19141 Win=720 Len=0 TSval=18503585 TSecr=678685115"
"77","0.180545718","72.30.35.9","192.168.1.118","TLSv1.2","983","Application Data"
"78","0.180612971","192.168.1.118","72.30.35.9","TCP","66","41495 → 443 [ACK] Seq=138 Ack=20058 Win=741 Len=0 TSval=18503586 TSecr=678685115"
"79","0.191647432","192.168.1.118","69.147.82.61","TLSv1","583","Client Hello"
"80","0.194342376","72.30.35.9","192.168.1.118","TLSv1.2","1514","Application Data"
"81","0.194431292","192.168.1.118","72.30.35.9","TCP","66","41495 → 443 [ACK] Seq=138 Ack=21506 Win=764 Len=0 TSval=18503600 TSecr=678685132"
"82","0.196908929","69.147.82.61","192.168.1.118","TCP","66","443 → 37023 [ACK] Seq=1 Ack=518 Win=30208 Len=0 TSval=2929520547 TSecr=18503578"
"83","0.196997007","69.147.82.61","192.168.1.118","TLSv1.2","4162","Server Hello"
"84","0.197042358","192.168.1.118","69.147.82.61","TCP","66","37023 → 443 [ACK] Seq=518 Ack=4097 Win=37504 Len=0 TSval=18503602 TSecr=2929520547"
"85","0.197101398","69.147.82.61","192.168.1.118","TLSv1.2","663","Certificate, Server Key Exchange, Server Hello Done"
"86","0.197121849","192.168.1.118","69.147.82.61","TCP","66","37023 → 443 [ACK] Seq=518 Ack=4694 Win=40320 Len=0 TSval=18503603 TSecr=2929520547"
"87","0.197138499","72.30.35.9","192.168.1.118","TLSv1.2","1514","Application Data [TCP segment of a reassembled PDU]"
"88","0.197161637","192.168.1.118","72.30.35.9","TCP","66","41495 → 443 [ACK] Seq=138 Ack=22954 Win=786 Len=0 TSval=18503603 TSecr=678685132"
"89","0.208325666","69.147.82.61","192.168.1.118","TCP","66","443 → 37024 [ACK] Seq=1 Ack=518 Win=30208 Len=0 TSval=2929520563 TSecr=18503597"
"90","0.209791967","69.147.82.61","192.168.1.118","TLSv1.2","1514","Server Hello"
"91","0.209878032","192.168.1.118","69.147.82.61","TCP","66","37024 → 443 [ACK] Seq=518 Ack=1449 Win=32128 Len=0 TSval=18503615 TSecr=2929520563"
"92","0.211544053","192.168.1.118","69.147.82.61","TLSv1","583","Client Hello"
"93","0.220188306","69.147.82.61","192.168.1.118","TCP","2714","443 → 37024 [PSH, ACK] Seq=1449 Ack=518 Win=30208 Len=2648 TSval=2929520563 TSecr=18503597 [TCP segment of a reassembled PDU]"
"94","0.220279447","192.168.1.118","69.147.82.61","TCP","66","37024 → 443 [ACK] Seq=518 Ack=4097 Win=37504 Len=0 TSval=18503626 TSecr=2929520563"
"95","0.220391088","72.30.35.9","192.168.1.118","TLSv1.2","6622","Application Data, Application Data, Application Data, Application Data, Application Data, Application Data, Application Data, Application Data, Application Data, Application Data"
"96","0.220417789","192.168.1.118","72.30.35.9","TCP","66","41495 → 443 [ACK] Seq=138 Ack=29510 Win=889 Len=0 TSval=18503626 TSecr=678685149"
"97","0.220439627","69.147.82.61","192.168.1.118","TLSv1.2","664","Certificate, Server Key Exchange, Server Hello Done"
"98","0.220459678","192.168.1.118","69.147.82.61","TCP","66","37024 → 443 [ACK] Seq=518 Ack=4695 Win=40320 Len=0 TSval=18503626 TSecr=2929520563"
"99","0.232417121","192.168.1.118","69.147.82.61","TLSv1","583","Client Hello"
"100","0.232700506","69.147.82.61","192.168.1.118","TCP","66","443 → 37025 [ACK] Seq=1 Ack=518 Win=30208 Len=0 TSval=2934121888 TSecr=18503617"
"101","0.234756828","69.147.82.61","192.168.1.118","TLSv1.2","1514","Server Hello"
"102","0.234841631","192.168.1.118","69.147.82.61","TCP","66","37025 → 443 [ACK] Seq=518 Ack=1449 Win=32128 Len=0 TSval=18503640 TSecr=2934121888"
"103","0.236592880","69.147.82.61","192.168.1.118","TCP","2714","443 → 37025 [PSH, ACK] Seq=1449 Ack=518 Win=30208 Len=2648 TSval=2934121888 TSecr=18503617 [TCP segment of a reassembled PDU]"
"104","0.236675658","192.168.1.118","69.147.82.61","TCP","66","37025 → 443 [ACK] Seq=518 Ack=4097 Win=37504 Len=0 TSval=18503642 TSecr=2934121888"
"105","0.236721759","69.147.82.61","192.168.1.118","TLSv1.2","663","Certificate, Server Key Exchange, Server Hello Done"
"106","0.236742773","192.168.1.118","69.147.82.61","TCP","66","37025 → 443 [ACK] Seq=518 Ack=4694 Win=40320 Len=0 TSval=18503642 TSecr=2934121888"
"107","0.238104295","192.168.1.118","209.18.47.62","DNS","79","Standard query 0x0a8a A clients4.google.com"
"108","0.252970366","192.168.1.118","69.147.82.61","TLSv1","583","Client Hello"
"109","0.255689236","69.147.82.61","192.168.1.118","TCP","66","443 → 37026 [ACK] Seq=1 Ack=518 Win=30208 Len=0 TSval=446442314 TSecr=18503638"
"110","0.256155265","192.168.1.118","69.147.82.61","TLSv1.2","192","Client Key Exchange, Change Cipher Spec, Encrypted Handshake Message"
"111","0.258967313","192.168.1.118","69.147.82.61","TLSv1.2","192","Client Key Exchange, Change Cipher Spec, Encrypted Handshake Message"
"112","0.259189408","69.147.82.61","192.168.1.118","TLSv1.2","4162","Server Hello"
"113","0.259277574","192.168.1.118","69.147.82.61","TCP","66","37026 → 443 [ACK] Seq=518 Ack=4097 Win=37504 Len=0 TSval=18503665 TSecr=446442314"
"114","0.259365014","69.147.82.61","192.168.1.118","TLSv1.2","665","Certificate, Server Key Exchange, Server Hello Done"
"115","0.259388203","192.168.1.118","69.147.82.61","TCP","66","37026 → 443 [ACK] Seq=518 Ack=4696 Win=40320 Len=0 TSval=18503665 TSecr=446442314"
"116","0.261186316","209.18.47.62","192.168.1.118","DNS","119","Standard query response 0x0a8a A clients4.google.com CNAME clients.l.google.com A 172.217.9.238"
"117","0.261609143","192.168.1.118","172.217.9.238","TCP","74","34455 → 443 [SYN] Seq=0 Win=29200 Len=0 MSS=1460 SACK_PERM=1 TSval=18503667 TSecr=0 WS=128"
"118","0.262619591","192.168.1.118","69.147.82.61","TLSv1.2","192","Client Key Exchange, Change Cipher Spec, Encrypted Handshake Message"
"119","0.267253341","192.168.1.118","69.147.82.61","TLSv1.2","192","Client Key Exchange, Change Cipher Spec, Encrypted Handshake Message"
"120","0.270088140","69.147.82.61","192.168.1.118","TCP","66","443 → 37022 [ACK] Seq=1 Ack=518 Win=30208 Len=0 TSval=2934121925 TSecr=18503658"
"121","0.271696946","69.147.82.61","192.168.1.118","TLSv1.2","1514","Server Hello"
"122","0.271781212","192.168.1.118","69.147.82.61","TCP","66","37022 → 443 [ACK] Seq=518 Ack=1449 Win=32128 Len=0 TSval=18503677 TSecr=2934121926"
"123","0.273839471","69.147.82.61","192.168.1.118","TCP","2714","443 → 37022 [PSH, ACK] Seq=1449 Ack=518 Win=30208 Len=2648 TSval=2934121926 TSecr=18503658 [TCP segment of a reassembled PDU]"
"124","0.273929724","192.168.1.118","69.147.82.61","TCP","66","37022 → 443 [ACK] Seq=518 Ack=4097 Win=37504 Len=0 TSval=18503679 TSecr=2934121926"
"125","0.273975688","69.147.82.61","192.168.1.118","TLSv1.2","117","Change Cipher Spec, Encrypted Handshake Message"
"126","0.274004477","192.168.1.118","69.147.82.61","TCP","66","37023 → 443 [ACK] Seq=644 Ack=4745 Win=40320 Len=0 TSval=18503679 TSecr=2929520625"
"127","0.274024478","69.147.82.61","192.168.1.118","TLSv1.2","664","Certificate, Server Key Exchange, Server Hello Done"
"128","0.274044778","192.168.1.118","69.147.82.61","TCP","66","37022 → 443 [ACK] Seq=518 Ack=4695 Win=40320 Len=0 TSval=18503679 TSecr=2934121926"
"129","0.281846464","69.147.82.61","192.168.1.118","TLSv1.2","117","Change Cipher Spec, Encrypted Handshake Message"
"130","0.290006899","192.168.1.118","69.147.82.61","TLSv1.2","192","Client Key Exchange, Change Cipher Spec, Encrypted Handshake Message"
"131","0.290501042","192.168.1.118","69.147.82.61","TLSv1.2","272","Application Data"
"132","0.290812490","192.168.1.118","69.147.82.61","TLSv1.2","275","Application Data"
"133","0.297458298","69.147.82.61","192.168.1.118","TLSv1.2","117","Change Cipher Spec, Encrypted Handshake Message"
"134","0.299042791","192.168.1.118","69.147.82.61","TLSv1.2","271","Application Data"
"135","0.303367079","69.147.82.61","192.168.1.118","TLSv1.2","117","Change Cipher Spec, Encrypted Handshake Message"
"136","0.303437494","172.217.9.238","192.168.1.118","TCP","74","443 → 34455 [SYN, ACK] Seq=0 Ack=1 Win=60192 Len=0 MSS=1380 SACK_PERM=1 TSval=2073284742 TSecr=18503667 WS=256"
"137","0.303532885","192.168.1.118","172.217.9.238","TCP","66","34455 → 443 [ACK] Seq=1 Ack=1 Win=29312 Len=0 TSval=18503709 TSecr=2073284742"
"138","0.303898823","192.168.1.118","69.147.82.61","TLSv1.2","251","Application Data"
"139","0.304147244","192.168.1.118","172.217.9.238","TLSv1","655","Client Hello"
"140","0.310174293","69.147.82.61","192.168.1.118","TLSv1.2","117","Change Cipher Spec, Encrypted Handshake Message"
"141","0.312974228","192.168.1.118","69.147.82.61","TLSv1.2","262","Application Data"
"142","0.319328863","69.147.82.61","192.168.1.118","TLSv1.2","915","Application Data"
"143","0.319397128","69.147.82.61","192.168.1.118","TLSv1.2","1395","Application Data"
"144","0.319429879","192.168.1.118","69.147.82.61","TCP","66","37023 → 443 [ACK] Seq=850 Ack=6923 Win=46080 Len=0 TSval=18503725 TSecr=2929520665"
"145","0.319467793","69.147.82.61","192.168.1.118","TLSv1.2","915","Application Data"
"146","0.319491606","69.147.82.61","192.168.1.118","TLSv1.2","1395","Application Data"
"147","0.319507982","192.168.1.118","69.147.82.61","TCP","66","37024 → 443 [ACK] Seq=853 Ack=6924 Win=46080 Len=0 TSval=18503725 TSecr=2929520665"
"148","0.319530795","69.147.82.61","192.168.1.118","TLSv1.2","307","Application Data"
"149","0.319550583","69.147.82.61","192.168.1.118","TLSv1.2","2327","Application Data, Application Data"
"150","0.319574572","192.168.1.118","69.147.82.61","TCP","66","37024 → 443 [ACK] Seq=853 Ack=9185 Win=50688 Len=0 TSval=18503725 TSecr=2929520665"
"151","0.323691253","192.168.1.118","69.147.82.61","TLSv1.2","290","Application Data"
"152","0.323873235","192.168.1.118","69.147.82.61","TLSv1.2","289","Application Data"
"153","0.341264568","72.30.35.9","192.168.1.118","TLSv1.2","1395","Application Data"
"154","0.341347221","192.168.1.118","72.30.35.9","TCP","66","41495 → 443 [ACK] Seq=138 Ack=30839 Win=911 Len=0 TSval=18503747 TSecr=678685261"
"155","0.347418146","72.30.35.9","192.168.1.118","TLSv1.2","243","Application Data"
"156","0.347505962","192.168.1.118","72.30.35.9","TCP","66","41495 → 443 [ACK] Seq=138 Ack=31016 Win=934 Len=0 TSval=18503753 TSecr=678685261"
"157","0.347554051","72.30.35.9","192.168.1.118","TLSv1.2","1395","Application Data"
"158","0.347573539","192.168.1.118","72.30.35.9","TCP","66","41495 → 443 [ACK] Seq=138 Ack=32345 Win=957 Len=0 TSval=18503753 TSecr=678685261"
"159","0.347591815","72.30.35.9","192.168.1.118","TLSv1.2","1395","Application Data"
"160","0.347607453","192.168.1.118","72.30.35.9","TCP","66","41495 → 443 [ACK] Seq=138 Ack=33674 Win=977 Len=0 TSval=18503753 TSecr=678685261"
"161","0.347623953","72.30.35.9","192.168.1.118","TLSv1.2","391","Application Data"
"162","0.347639366","192.168.1.118","72.30.35.9","TCP","66","41495 → 443 [ACK] Seq=138 Ack=33999 Win=998 Len=0 TSval=18503753 TSecr=678685261"
"163","0.347658817","72.30.35.9","192.168.1.118","TLSv1.2","1395","Application Data"
"164","0.347674855","192.168.1.118","72.30.35.9","TCP","66","41495 → 443 [ACK] Seq=138 Ack=35328 Win=1019 Len=0 TSval=18503753 TSecr=678685261"
"165","0.347691368","72.30.35.9","192.168.1.118","TLSv1.2","309","Application Data"
"166","0.347707869","192.168.1.118","72.30.35.9","TCP","66","41495 → 443 [ACK] Seq=138 Ack=35571 Win=1040 Len=0 TSval=18503753 TSecr=678685261"
"167","0.347725344","72.30.35.9","192.168.1.118","TLSv1.2","1395","Application Data"
"168","0.347740995","192.168.1.118","72.30.35.9","TCP","66","41495 → 443 [ACK] Seq=138 Ack=36900 Win=1060 Len=0 TSval=18503753 TSecr=678685261"
"169","0.349080429","72.30.35.9","192.168.1.118","TLSv1.2","1395","Application Data"
"170","0.349157495","192.168.1.118","72.30.35.9","TCP","66","41495 → 443 [ACK] Seq=138 Ack=38229 Win=1081 Len=0 TSval=18503755 TSecr=678685261"
"171","0.349203884","72.30.35.9","192.168.1.118","TLSv1.2","1395","Application Data"
"172","0.349223759","192.168.1.118","72.30.35.9","TCP","66","41495 → 443 [ACK] Seq=138 Ack=39558 Win=1102 Len=0 TSval=18503755 TSecr=678685261"
"173","0.349246273","72.30.35.9","192.168.1.118","TLSv1.2","1395","Application Data"
"174","0.349265598","192.168.1.118","72.30.35.9","TCP","66","41495 → 443 [ACK] Seq=138 Ack=40887 Win=1123 Len=0 TSval=18503755 TSecr=678685261"
"175","0.349293524","72.30.35.9","192.168.1.118","TLSv1.2","1395","Application Data"
"176","0.349313413","192.168.1.118","72.30.35.9","TCP","66","41495 → 443 [ACK] Seq=138 Ack=42216 Win=1144 Len=0 TSval=18503755 TSecr=678685261"
"177","0.349330038","72.30.35.9","192.168.1.118","TLSv1.2","769","Application Data"
"178","0.349349164","192.168.1.118","72.30.35.9","TCP","66","41495 → 443 [ACK] Seq=138 Ack=42919 Win=1164 Len=0 TSval=18503755 TSecr=678685261"
"179","0.349369089","72.30.35.9","192.168.1.118","TLSv1.2","1395","Application Data"
"180","0.349388140","192.168.1.118","72.30.35.9","TCP","66","41495 → 443 [ACK] Seq=138 Ack=44248 Win=1185 Len=0 TSval=18503755 TSecr=678685261"
"181","0.349413041","69.147.82.61","192.168.1.118","TLSv1.2","914","Application Data"
"182","0.349447942","69.147.82.61","192.168.1.118","TLSv1.2","687","Application Data"
"183","0.349468393","192.168.1.118","69.147.82.61","TCP","66","37025 → 443 [ACK] Seq=849 Ack=6214 Win=46080 Len=0 TSval=18503755 TSecr=2934121979"
"184","0.349488656","69.147.82.61","192.168.1.118","TLSv1.2","935","Application Data"
"185","0.352789997","192.168.1.1","224.0.0.1","IGMPv2","42","Membership Query, general"
"186","0.353519485","192.168.1.118","69.147.82.61","TLSv1.2","290","Application Data"
"187","0.356057824","192.168.1.104","255.255.255.255","UDP","217","49154 → 6666 Len=175"
"188","0.378394743","69.147.82.61","192.168.1.118","TLSv1.2","894","Application Data"
"189","0.378482833","192.168.1.118","69.147.82.61","TCP","66","37026 → 443 [ACK] Seq=829 Ack=6444 Win=46080 Len=0 TSval=18503784 TSecr=446442387"
"190","0.378528473","172.217.9.238","192.168.1.118","TCP","66","443 → 34455 [ACK] Seq=1 Ack=590 Win=61440 Len=0 TSval=2073284784 TSecr=18503710"
"191","0.378557324","172.217.9.238","192.168.1.118","TLSv1.3","278","Server Hello, Change Cipher Spec, Application Data"
"192","0.378591962","192.168.1.118","172.217.9.238","TCP","66","34455 → 443 [ACK] Seq=590 Ack=213 Win=30336 Len=0 TSval=18503784 TSecr=2073284785"
"193","0.378610013","69.147.82.61","192.168.1.118","TLSv1.2","1194","Application Data"
"194","0.378636501","69.147.82.61","192.168.1.118","TLSv1.2","1395","Application Data"
"195","0.378658827","192.168.1.118","69.147.82.61","TCP","66","37022 → 443 [ACK] Seq=840 Ack=7203 Win=46080 Len=0 TSval=18503784 TSecr=2934122000"
"196","0.378679628","69.147.82.61","192.168.1.118","TLSv1.2","938","Application Data"
"197","0.378704691","69.147.82.61","192.168.1.118","TLSv1.2","1271","Application Data"
"198","0.378724317","192.168.1.118","69.147.82.61","TCP","66","37024 → 443 [ACK] Seq=1076 Ack=11262 Win=56448 Len=0 TSval=18503784 TSecr=2929520699"
"199","0.378746293","69.147.82.61","192.168.1.118","TLSv1.2","303","Application Data"
"200","0.378766856","69.147.82.61","192.168.1.118","TLSv1.2","961","Application Data"
"201","0.378790507","69.147.82.61","192.168.1.118","TLSv1.2","1395","Application Data"
"202","0.378810107","192.168.1.118","69.147.82.61","TCP","66","37023 → 443 [ACK] Seq=1074 Ack=9388 Win=54784 Len=0 TSval=18503784 TSecr=2929520699"
"203","0.378889373","69.147.82.61","192.168.1.118","TLSv1.2","2157","Application Data, Application Data"
"204","0.378912848","192.168.1.118","69.147.82.61","TCP","66","37023 → 443 [ACK] Seq=1074 Ack=11479 Win=59008 Len=0 TSval=18503784 TSecr=2929520699"
"205","0.381209616","192.168.1.118","69.147.82.61","TLSv1.2","293","Application Data"
"206","0.381371372","192.168.1.118","69.147.82.61","TLSv1.2","287","Application Data"
"207","0.394458455","192.168.1.118","172.217.9.238","TLSv1.3","130","Change Cipher Spec, Application Data"
"208","0.401900753","192.168.1.118","69.147.82.61","TLSv1.2","286","Application Data"
"209","0.402159050","192.168.1.118","69.147.82.61","TLSv1.2","291","Application Data"
"210","0.412577852","192.168.1.118","172.217.9.238","TLSv1.3","1188","Application Data, Application Data, Application Data"
"211","0.435366612","69.147.82.61","192.168.1.118","TLSv1.2","961","Application Data"
"212","0.442801072","69.147.82.61","192.168.1.118","TLSv1.2","1395","Application Data"
"213","0.442881950","192.168.1.118","69.147.82.61","TCP","66","37025 → 443 [ACK] Seq=1073 Ack=8438 Win=51968 Len=0 TSval=18503848 TSecr=2934122089"
"214","0.442936627","69.147.82.61","192.168.1.118","TLSv1.2","960","Application Data"
"215","0.442969178","69.147.82.61","192.168.1.118","TLSv1.2","1053","Application Data"
"216","0.442986891","192.168.1.118","69.147.82.61","TCP","66","37022 → 443 [ACK] Seq=1061 Ack=9321 Win=54784 Len=0 TSval=18503848 TSecr=2934122089"
"217","0.443009117","69.147.82.61","192.168.1.118","TLSv1.2","2962","Application Data, Application Data"
"218","0.443028530","192.168.1.118","69.147.82.61","TCP","66","37025 → 443 [ACK] Seq=1073 Ack=11334 Win=57728 Len=0 TSval=18503848 TSecr=2934122089"
"219","0.444554546","69.147.82.61","192.168.1.118","TLSv1.2","866","Application Data"
"220","0.444615048","69.147.82.61","192.168.1.118","TLSv1.2","962","Application Data"
"221","0.444645037","69.147.82.61","192.168.1.118","TLSv1.2","1395","Application Data"
"222","0.444678413","192.168.1.118","69.147.82.61","TCP","66","37026 → 443 [ACK] Seq=1056 Ack=8669 Win=51968 Len=0 TSval=18503850 TSecr=446442493"
"223","0.444723114","69.147.82.61","192.168.1.118","TLSv1.2","1514","Application Data"
"224","0.445241045","69.147.82.61","192.168.1.118","TLSv1.2","938","Application Data"
"225","0.445284446","69.147.82.61","192.168.1.118","TLSv1.2","1395","Application Data"
"226","0.445309035","192.168.1.118","69.147.82.61","TCP","66","37024 → 443 [ACK] Seq=1301 Ack=13463 Win=62208 Len=0 TSval=18503851 TSecr=2929520789"
"227","0.445342411","69.147.82.61","192.168.1.118","TLSv1.2","5858","Application Data, Application Data, Application Data, Application Data"
"228","0.445364237","192.168.1.118","69.147.82.61","TCP","66","37026 → 443 [ACK] Seq=1056 Ack=15909 Win=66432 Len=0 TSval=18503851 TSecr=446442493"
"229","0.445373500","69.147.82.61","192.168.1.118","TLSv1.2","1514","Application Data"
"230","0.447789159","69.147.82.61","192.168.1.118","TLSv1.2","961","Application Data"
"231","0.447868662","69.147.82.61","192.168.1.118","TLSv1.2","1395","Application Data"
"232","0.447906826","192.168.1.118","69.147.82.61","TCP","66","37023 → 443 [ACK] Seq=1294 Ack=13703 Win=64768 Len=0 TSval=18503853 TSecr=2929520789"
"233","0.447960340","69.147.82.61","192.168.1.118","TLSv1.2","1514","Application Data"
"234","0.447975053","69.147.82.61","192.168.1.118","TLSv1.2","1514","Application Data [TCP segment of a reassembled PDU]"
"235","0.449458805","69.147.82.61","192.168.1.118","TLSv1.2","1434","Application Data, Application Data"
"236","0.449541595","192.168.1.118","69.147.82.61","TCP","66","37024 → 443 [ACK] Seq=1301 Ack=16279 Win=68096 Len=0 TSval=18503855 TSecr=2929520789"
"237","0.449597147","69.147.82.61","192.168.1.118","TLSv1.2","2155","Application Data, Application Data"
"238","0.449622923","192.168.1.118","69.147.82.61","TCP","66","37023 → 443 [ACK] Seq=1294 Ack=17240 Win=71936 Len=0 TSval=18503855 TSecr=2929520789"
"239","0.449639411","69.147.82.61","192.168.1.118","TLSv1.2","1514","Application Data [TCP segment of a reassembled PDU]"
"240","0.449660862","192.168.1.118","69.147.82.61","TCP","66","37026 → 443 [ACK] Seq=1056 Ack=18805 Win=72192 Len=0 TSval=18503855 TSecr=446442493"
"241","0.449998161","69.147.82.61","192.168.1.118","TLSv1.2","1166","Application Data, Application Data"
"242","0.450027812","172.217.9.238","192.168.1.118","TLSv1.3","646","Application Data, Application Data"
"243","0.450062201","172.217.9.238","192.168.1.118","TLSv1.3","97","Application Data"
"244","0.450101502","192.168.1.118","172.217.9.238","TCP","66","34455 → 443 [ACK] Seq=1776 Ack=824 Win=31488 Len=0 TSval=18503856 TSecr=2073284883"
"245","0.450164980","72.30.35.9","192.168.1.118","TLSv1.2","7306","Application Data, Application Data, Application Data, Application Data, Application Data, Application Data"
"246","0.450186130","192.168.1.118","72.30.35.9","TCP","66","41495 → 443 [ACK] Seq=138 Ack=51488 Win=1298 Len=0 TSval=18503856 TSecr=678685378"
"247","0.450536655","192.168.1.118","172.217.9.238","TLSv1.3","97","Application Data"
"248","0.462085572","72.30.35.9","192.168.1.118","TLSv1.2","5858","Application Data, Application Data, Application Data, Application Data, Application Data, Application Data"
"249","0.462161475","192.168.1.118","72.30.35.9","TCP","66","41495 → 443 [ACK] Seq=138 Ack=57280 Win=1288 Len=0 TSval=18503868 TSecr=678685378"
"250","0.463079569","172.217.9.238","192.168.1.118","TLSv1.3","334","Application Data"
"251","0.463108883","172.217.9.238","192.168.1.118","TLSv1.3","97","Application Data"
"252","0.463124783","172.217.9.238","192.168.1.118","TLSv1.3","105","Application Data"
"253","0.463140084","72.30.35.9","192.168.1.118","TLSv1.2","7306","Application Data, Application Data, Application Data, Application Data, Application Data, Application Data"
"254","0.463160147","192.168.1.118","72.30.35.9","TCP","66","41495 → 443 [ACK] Seq=138 Ack=64520 Win=1232 Len=0 TSval=18503869 TSecr=678685378"
"255","0.463420769","192.168.1.118","172.217.9.238","TCP","66","34455 → 443 [ACK] Seq=1807 Ack=1162 Win=32640 Len=0 TSval=18503869 TSecr=2073284908"
"256","0.475859241","192.168.1.118","172.217.9.238","TLSv1.3","105","Application Data"
"257","0.483800369","192.168.1.118","69.147.82.61","TLSv1.2","288","Application Data"
"258","0.484141369","192.168.1.118","69.147.82.61","TCP","66","37025 → 443 [ACK] Seq=1073 Ack=12134 Win=60672 Len=0 TSval=18503890 TSecr=2934122089"
"259","0.486287394","172.217.9.238","192.168.1.118","TCP","66","443 → 34455 [ACK] Seq=1162 Ack=1807 Win=63744 Len=0 TSval=2073284932 TSecr=18503856"
"260","0.489140044","192.168.1.118","69.147.82.61","TCP","66","37026 → 443 [ACK] Seq=1056 Ack=19905 Win=75136 Len=0 TSval=18503895 TSecr=446442493"
"261","0.493208099","72.30.35.9","192.168.1.118","TLSv1.2","1514","Application Data [TCP segment of a reassembled PDU]"
"262","0.493298014","192.168.1.118","72.30.35.9","TCP","66","41495 → 443 [ACK] Seq=138 Ack=65968 Win=1221 Len=0 TSval=18503899 TSecr=678685430"
"263","0.496713059","72.30.35.9","192.168.1.118","TLSv1.2","8754","Application Data, Application Data, Application Data, Application Data, Application Data, Application Data, Application Data, Application Data"
"264","0.496799049","192.168.1.118","72.30.35.9","TCP","66","41495 → 443 [ACK] Seq=138 Ack=74656 Win=1154 Len=0 TSval=18503902 TSecr=678685430"
"265","0.496972655","72.30.35.9","192.168.1.118","TLSv1.2","2386","Application Data, Application Data"
"266","0.496992256","192.168.1.118","72.30.35.9","TCP","66","41495 → 443 [ACK] Seq=138 Ack=76976 Win=1136 Len=0 TSval=18503902 TSecr=678685430"
"267","0.501005134","172.217.9.238","192.168.1.118","TCP","66","443 → 34455 [ACK] Seq=1162 Ack=1846 Win=63744 Len=0 TSval=2073284948 TSecr=18503881"
"268","0.513169697","69.147.82.61","192.168.1.118","TLSv1.2","938","Application Data"
"269","0.515473428","69.147.82.61","192.168.1.118","TLSv1.2","1395","Application Data"
"270","0.515558093","192.168.1.118","69.147.82.61","TCP","66","37022 → 443 [ACK] Seq=1283 Ack=11522 Win=60672 Len=0 TSval=18503921 TSecr=2934122168"
"271","0.515622471","69.147.82.61","192.168.1.118","TLSv1.2","3734","Application Data, Application Data, Application Data"
"272","0.515648047","192.168.1.118","69.147.82.61","TCP","66","37022 → 443 [ACK] Seq=1283 Ack=15190 Win=67968 Len=0 TSval=18503921 TSecr=2934122168"
"273","0.546668707","192.168.1.118","69.147.82.61","TLSv1.2","285","Application Data"
"274","0.548668715","192.168.1.118","69.147.82.61","TLSv1.2","289","Application Data"
"275","0.548844646","192.168.1.118","69.147.82.61","TLSv1.2","285","Application Data"
"276","0.570910618","69.147.82.61","192.168.1.118","TLSv1.2","961","Application Data"
"277","0.571008622","192.168.1.118","69.147.82.61","TCP","66","37025 → 443 [ACK] Seq=1292 Ack=13029 Win=63488 Len=0 TSval=18503976 TSecr=2934122221"
"278","0.575400538","69.147.82.61","192.168.1.118","TLSv1.2","1395","Application Data"
"279","0.575472303","192.168.1.118","69.147.82.61","TCP","66","37025 → 443 [ACK] Seq=1292 Ack=14358 Win=66432 Len=0 TSval=18503981 TSecr=2934122221"
"280","0.575550093","69.147.82.61","192.168.1.118","TLSv1.2","4410","Application Data, Application Data, Application Data"
"281","0.575576319","192.168.1.118","69.147.82.61","TCP","66","37025 → 443 [ACK] Seq=1292 Ack=18702 Win=75136 Len=0 TSval=18503981 TSecr=2934122221"
"282","0.576281681","69.147.82.61","192.168.1.118","TLSv1.2","1741","Application Data, Application Data"
"283","0.576330658","192.168.1.118","69.147.82.61","TCP","66","37025 → 443 [ACK] Seq=1292 Ack=20377 Win=78464 Len=0 TSval=18503982 TSecr=2934122221"
"284","0.576363146","69.147.82.61","192.168.1.118","TLSv1.2","961","Application Data"
"285","0.576391397","69.147.82.61","192.168.1.118","TLSv1.2","1395","Application Data"
"286","0.576408686","192.168.1.118","69.147.82.61","TCP","66","37023 → 443 [ACK] Seq=1513 Ack=19464 Win=77696 Len=0 TSval=18503982 TSecr=2929520921"
"287","0.576428111","69.147.82.61","192.168.1.118","TLSv1.2","961","Application Data"
"288","0.576450287","69.147.82.61","192.168.1.118","TLSv1.2","1044","Application Data"
"289","0.576465850","192.168.1.118","69.147.82.61","TCP","66","37024 → 443 [ACK] Seq=1524 Ack=18152 Win=73856 Len=0 TSval=18503982 TSecr=2929520921"
"290","0.576482738","69.147.82.61","192.168.1.118","TLSv1.2","771","Application Data"
"291","0.580608158","192.168.1.118","69.147.82.61","TLSv1.2","298","Application Data"
"292","0.580781039","192.168.1.118","69.147.82.61","TLSv1.2","289","Application Data"
"293","0.583882222","192.168.1.118","69.147.82.61","TLSv1.2","286","Application Data"
"294","0.584180645","192.168.1.118","69.147.82.61","TLSv1.2","289","Application Data"
"295","0.611181690","69.147.82.61","192.168.1.118","TLSv1.2","960","Application Data"
"296","0.616084212","69.147.82.61","192.168.1.118","TLSv1.2","961","Application Data"
"297","0.616176565","192.168.1.118","69.147.82.61","TCP","66","37026 → 443 [ACK] Seq=1288 Ack=20800 Win=77952 Len=0 TSval=18504022 TSecr=446442668"
"298","0.616222191","69.147.82.61","192.168.1.118","TLSv1.2","367","Application Data"
"299","0.616242855","69.147.82.61","192.168.1.118","TLSv1.2","1395","Application Data"
"300","0.616260018","192.168.1.118","69.147.82.61","TCP","66","37026 → 443 [ACK] Seq=1288 Ack=22129 Win=80896 Len=0 TSval=18504022 TSecr=446442668"
"301","0.616286094","69.147.82.61","192.168.1.118","TLSv1.2","961","Application Data"
"302","0.616311382","69.147.82.61","192.168.1.118","TLSv1.2","393","Application Data"
"303","0.616326870","69.147.82.61","192.168.1.118","TLSv1.2","937","Application Data"
"304","0.616348058","69.147.82.61","192.168.1.118","TLSv1.2","835","Application Data"
"305","0.616364271","192.168.1.118","69.147.82.61","TCP","66","37024 → 443 [ACK] Seq=1747 Ack=19792 Win=79616 Len=0 TSval=18504022 TSecr=2929520964"
"306","0.616383235","69.147.82.61","192.168.1.118","TLSv1.2","1298","Application Data"
"307","0.616399635","192.168.1.118","69.147.82.61","TCP","66","37026 → 443 [ACK] Seq=1288 Ack=23361 Win=83840 Len=0 TSval=18504022 TSecr=446442668"
"308","0.627699218","192.168.1.118","69.147.82.61","TCP","66","37022 → 443 [ACK] Seq=1506 Ack=16385 Win=73728 Len=0 TSval=18504033 TSecr=2934122264"
"309","0.627865436","192.168.1.118","69.147.82.61","TCP","66","37023 → 443 [ACK] Seq=1733 Ack=21391 Win=86400 Len=0 TSval=18504033 TSecr=2929520964"
"310","0.629829530","192.168.1.118","69.147.82.61","TLSv1.2","290","Application Data"
"311","0.630005624","192.168.1.118","69.147.82.61","TLSv1.2","285","Application Data"
"312","0.630138404","192.168.1.118","69.147.82.61","TLSv1.2","267","Application Data"
"313","0.630236669","192.168.1.118","69.147.82.61","TLSv1.2","264","Application Data"
"314","0.642302829","192.168.1.118","69.147.82.61","TLSv1.2","289","Application Data"
"315","0.646165464","69.147.82.61","192.168.1.118","TLSv1.2","961","Application Data"
"316","0.649588984","69.147.82.61","192.168.1.118","TLSv1.2","1395","Application Data"
"317","0.649671000","192.168.1.118","69.147.82.61","TCP","66","37023 → 443 [ACK] Seq=1934 Ack=23615 Win=92160 Len=0 TSval=18504055 TSecr=2929521000"
"318","0.649726277","69.147.82.61","192.168.1.118","TLSv1.2","962","Application Data"
"319","0.649759253","69.147.82.61","192.168.1.118","TLSv1.2","1395","Application Data"
"320","0.649780628","192.168.1.118","69.147.82.61","TCP","66","37024 → 443 [ACK] Seq=1945 Ack=22017 Win=85376 Len=0 TSval=18504055 TSecr=2929521000"
"321","0.649813392","69.147.82.61","192.168.1.118","TLSv1.2","4410","Application Data, Application Data, Application Data"
"322","0.649831905","192.168.1.118","69.147.82.61","TCP","66","37023 → 443 [ACK] Seq=1934 Ack=27959 Win=100864 Len=0 TSval=18504055 TSecr=2929521000"
"323","0.651964467","69.147.82.61","192.168.1.118","TLSv1.2","961","Application Data"
"324","0.652027082","69.147.82.61","192.168.1.118","TLSv1.2","422","Application Data"
"325","0.652044645","69.147.82.61","192.168.1.118","TLSv1.2","937","Application Data"
"326","0.652078396","69.147.82.61","192.168.1.118","TLSv1.2","952","Application Data"
"327","0.652109635","192.168.1.118","69.147.82.61","TCP","66","37026 → 443 [ACK] Seq=1512 Ack=25118 Win=89600 Len=0 TSval=18504058 TSecr=446442705"
"328","0.652148674","69.147.82.61","192.168.1.118","TLSv1.2","656","Application Data"
"329","0.652166837","69.147.82.61","192.168.1.118","TLSv1.2","773","Application Data"
"330","0.654814580","192.168.1.118","69.147.82.61","TCP","66","37022 → 443 [ACK] Seq=1725 Ack=17636 Win=79488 Len=0 TSval=18504060 TSecr=2934122301"
"331","0.656740897","192.168.1.118","69.147.82.61","TLSv1.2","646","Application Data"
"332","0.656915003","192.168.1.118","69.147.82.61","TLSv1.2","646","Application Data"
"333","0.658733142","192.168.1.118","69.147.82.61","TLSv1.2","641","Application Data"
"334","0.669922008","192.168.1.102","224.0.0.251","IGMPv2","46","Membership Report group 224.0.0.251"
"335","0.674805529","69.147.82.61","192.168.1.118","TLSv1.2","875","Application Data"
"336","0.674899208","192.168.1.118","69.147.82.61","TCP","66","37025 → 443 [ACK] Seq=1515 Ack=21186 Win=81408 Len=0 TSval=18504080 TSecr=2934122315"
"337","0.676438986","69.147.82.61","192.168.1.118","TLSv1.2","915","Application Data"
"338","0.676521852","192.168.1.118","69.147.82.61","TCP","66","37025 → 443 [ACK] Seq=1515 Ack=22035 Win=84224 Len=0 TSval=18504082 TSecr=2934122315"
"339","0.676576579","69.147.82.61","192.168.1.118","TLSv1.2","1559","Application Data, Application Data"
"340","0.676599455","192.168.1.118","69.147.82.61","TCP","66","37025 → 443 [ACK] Seq=1515 Ack=23528 Win=87168 Len=0 TSval=18504082 TSecr=2934122315"
"341","0.677037332","192.168.1.118","69.147.82.61","TLSv1.2","617","Application Data"
"342","0.677615490","192.168.1.118","209.18.47.62","DNS","84","Standard query 0x32e8 A sb.scorecardresearch.com"
"343","0.683574386","192.168.1.118","69.147.82.61","TLSv1.2","617","Application Data"
"344","0.708995101","69.147.82.61","192.168.1.118","TLSv1.2","786","Application Data"
"345","0.711661019","69.147.82.61","192.168.1.118","TLSv1.2","786","Application Data"
"346","0.711738984","209.18.47.62","192.168.1.118","DNS","184","Standard query response 0x32e8 A sb.scorecardresearch.com CNAME sb.scorecardresearch.com.edgekey.net CNAME e1879.e7.akamaiedge.net A 184.25.176.117"
"347","0.711782436","69.147.82.61","192.168.1.118","TLSv1.2","1395","Application Data"
"348","0.711818200","192.168.1.118","69.147.82.61","TCP","66","37026 → 443 [ACK] Seq=2092 Ack=27167 Win=95360 Len=0 TSval=18504117 TSecr=446442767"
"349","0.711864414","69.147.82.61","192.168.1.118","TLSv1.2","1395","Application Data"
"350","0.711884765","192.168.1.118","69.147.82.61","TCP","66","37022 → 443 [ACK] Seq=2305 Ack=19685 Win=85376 Len=0 TSval=18504117 TSecr=2934122364"
"351","0.711913428","69.147.82.61","192.168.1.118","TLSv1.2","1514","Application Data"
"352","0.711925641","69.147.82.61","192.168.1.118","TLSv1.2","1514","Application Data"
"353","0.712016594","192.168.1.118","209.18.47.62","DNS","84","Standard query 0xf26c AAAA sb.scorecardresearch.com"
"354","0.717576701","192.168.1.118","192.168.1.102","TCP","176","33923 → 8009 [PSH, ACK] Seq=1 Ack=1 Win=364 Len=110 TSval=18504123 TSecr=4395724 [TCP segment of a reassembled PDU]"
"355","0.733036917","69.147.82.61","192.168.1.118","TLSv1.2","2962","Application Data, Application Data"
"356","0.733142221","192.168.1.118","69.147.82.61","TCP","66","37022 → 443 [ACK] Seq=2305 Ack=24029 Win=94080 Len=0 TSval=18504139 TSecr=2934122364"
"357","0.733183535","69.147.82.61","192.168.1.118","TLSv1.2","2962","Application Data, Application Data"
"358","0.733207911","192.168.1.118","69.147.82.61","TCP","66","37026 → 443 [ACK] Seq=2092 Ack=31511 Win=104064 Len=0 TSval=18504139 TSecr=446442767"
"359","0.733282051","69.147.82.61","192.168.1.118","TLSv1.2","1514","Application Data [TCP segment of a reassembled PDU]"
"360","0.742864761","69.147.82.61","192.168.1.118","TLSv1.2","1635","Application Data, Application Data"
"361","0.742952727","192.168.1.118","69.147.82.61","TCP","66","37022 → 443 [ACK] Seq=2305 Ack=27046 Win=100096 Len=0 TSval=18504148 TSecr=2934122364"
"362","0.743007454","69.147.82.61","192.168.1.118","TLSv1.2","787","Application Data"
"363","0.743035542","69.147.82.61","192.168.1.118","TLSv1.2","1395","Application Data"
"364","0.743054943","192.168.1.118","69.147.82.61","TCP","66","37023 → 443 [ACK] Seq=2485 Ack=30716 Win=109568 Len=0 TSval=18504148 TSecr=2929521064"
"365","0.743121183","69.147.82.61","192.168.1.118","TLSv1.2","10202","Application Data, Application Data, Application Data, Application Data, Application Data, Application Data, Application Data"
"366","0.743145146","192.168.1.118","69.147.82.61","TCP","66","37023 → 443 [ACK] Seq=2485 Ack=40852 Win=129792 Len=0 TSval=18504149 TSecr=2929521064"
"367","0.743165509","69.147.82.61","192.168.1.118","TLSv1.2","20338","Application Data, Application Data, Application Data, Application Data, Application Data, Application Data, Application Data, Application Data, Application Data, Application Data, Application Data, Application Data, Application Data, Application Data, Application Data"
"368","0.743194223","192.168.1.118","69.147.82.61","TCP","66","37026 → 443 [ACK] Seq=2092 Ack=51783 Win=144000 Len=0 TSval=18504149 TSecr=446442768"
"369","0.743218711","69.147.82.61","192.168.1.118","TLSv1.2","764","Application Data"
"370","0.743248725","69.147.82.61","192.168.1.118","TLSv1.2","760","Application Data"
"371","0.743267988","69.147.82.61","192.168.1.118","TLSv1.2","1395","Application Data"
"372","0.743287101","192.168.1.118","69.147.82.61","TCP","66","37024 → 443 [ACK] Seq=2520 Ack=24630 Win=94080 Len=0 TSval=18504149 TSecr=2929521065"
"373","0.743306614","69.147.82.61","192.168.1.118","TLSv1.2","4410","Application Data, Application Data, Application Data"
"374","0.743326590","192.168.1.118","69.147.82.61","TCP","66","37025 → 443 [ACK] Seq=2066 Ack=28570 Win=98816 Len=0 TSval=18504149 TSecr=2934122365"
"375","0.743353328","69.147.82.61","192.168.1.118","TLSv1.2","8754","Application Data, Application Data, Application Data, Application Data, Application Data, Application Data, Application Data"
"376","0.743379204","192.168.1.118","69.147.82.61","TCP","66","37023 → 443 [ACK] Seq=2485 Ack=49540 Win=147200 Len=0 TSval=18504149 TSecr=2929521065"
"377","0.743391330","69.147.82.61","192.168.1.118","TLSv1.2","1514","Application Data [TCP segment of a reassembled PDU]"
"378","0.743403993","69.147.82.61","192.168.1.118","TLSv1.2","4410","Application Data, Application Data, Application Data"
"379","0.743423693","192.168.1.118","69.147.82.61","TCP","66","37024 → 443 [ACK] Seq=2520 Ack=28974 Win=102784 Len=0 TSval=18504149 TSecr=2929521065"
"380","0.743435281","69.147.82.61","192.168.1.118","TLSv1.2","2962","Application Data, Application Data"
"381","0.743453932","192.168.1.118","69.147.82.61","TCP","66","37025 → 443 [ACK] Seq=2066 Ack=31466 Win=104576 Len=0 TSval=18504149 TSecr=2934122366"
"382","0.750424401","69.147.82.61","192.168.1.118","TLSv1.2","2962","Application Data, Application Data"
"383","0.750510741","192.168.1.118","69.147.82.61","TCP","66","37025 → 443 [ACK] Seq=2066 Ack=34362 Win=110336 Len=0 TSval=18504156 TSecr=2934122366"
"384","0.750550280","69.147.82.61","192.168.1.118","TLSv1.2","2962","Application Data, Application Data"
"385","0.750578256","192.168.1.118","69.147.82.61","TCP","66","37024 → 443 [ACK] Seq=2520 Ack=31870 Win=108544 Len=0 TSval=18504156 TSecr=2929521065"
"386","0.752097834","69.147.82.61","192.168.1.118","TLSv1.2","256","Application Data"
"387","0.752172812","69.147.82.61","192.168.1.118","TLSv1.2","4410","Application Data, Application Data, Application Data, Application Data"
"388","0.752215201","192.168.1.118","69.147.82.61","TCP","66","37025 → 443 [ACK] Seq=2066 Ack=38706 Win=119040 Len=0 TSval=18504158 TSecr=2934122366"
"389","0.752833710","69.147.82.61","192.168.1.118","TLSv1.2","4050","Application Data, Application Data, Application Data, Application Data"
"390","0.752881074","192.168.1.118","69.147.82.61","TCP","66","37025 → 443 [ACK] Seq=2066 Ack=42690 Win=127104 Len=0 TSval=18504158 TSecr=2934122366"
"391","0.752931039","69.147.82.61","192.168.1.118","TLSv1.2","5858","Application Data, Application Data, Application Data, Application Data"
"392","0.754244922","209.18.47.62","192.168.1.118","DNS","227","Standard query response 0xf26c AAAA sb.scorecardresearch.com CNAME sb.scorecardresearch.com.edgekey.net CNAME e1879.e7.akamaiedge.net SOA n0e7.akamaiedge.net"
"393","0.754311249","69.147.82.61","192.168.1.118","TLSv1.2","1514","Application Data, Application Data"
"394","0.756036410","192.168.1.118","184.25.176.117","TCP","74","37662 → 443 [SYN] Seq=0 Win=29200 Len=0 MSS=1460 SACK_PERM=1 TSval=18504161 TSecr=0 WS=128"
"395","0.756310882","192.168.1.118","69.147.82.61","TCP","66","37026 → 443 [ACK] Seq=2092 Ack=60471 Win=135424 Len=0 TSval=18504162 TSecr=446442769"
"396","0.762865524","69.147.82.61","192.168.1.118","TLSv1.2","7306","Application Data, Application Data, Application Data, Application Data, Application Data"
"397","0.764424853","192.168.1.102","192.168.1.118","TCP","176","8009 → 33923 [PSH, ACK] Seq=1 Ack=111 Win=294 Len=110 TSval=4396228 TSecr=18504123 [TCP segment of a reassembled PDU]"
"398","0.764519607","192.168.1.118","192.168.1.102","TCP","66","33923 → 8009 [ACK] Seq=111 Ack=111 Win=364 Len=0 TSval=18504170 TSecr=4396228"
"399","0.769360151","192.168.1.118","69.147.82.61","TCP","66","37026 → 443 [ACK] Seq=2092 Ack=67711 Win=131712 Len=0 TSval=18504175 TSecr=446442812"
"400","0.773510996","69.147.82.61","192.168.1.118","TLSv1.2","1514","Application Data [TCP segment of a reassembled PDU]"
"401","0.779099004","192.168.1.118","69.147.82.61","TLSv1.2","642","Application Data"
"402","0.790167904","69.147.82.61","192.168.1.118","TLSv1.2","4410","Application Data, Application Data, Application Data"
"403","0.790230894","69.147.82.61","192.168.1.118","TLSv1.2","4410","Application Data, Application Data, Application Data"
"404","0.791775411","69.147.82.61","192.168.1.118","TLSv1.2","1514","Application Data [TCP segment of a reassembled PDU]"
"405","0.792107872","192.168.1.118","69.147.82.61","TCP","66","37024 → 443 [ACK] Seq=2520 Ack=32060 Win=111488 Len=0 TSval=18504198 TSecr=2929521065"
"406","0.792974853","69.147.82.61","192.168.1.118","TLSv1.2","11650","Application Data, Application Data, Application Data, Application Data, Application Data, Application Data, Application Data, Application Data, Application Data"
"407","0.793028717","69.147.82.61","192.168.1.118","TLSv1.2","11650","Application Data, Application Data, Application Data, Application Data, Application Data, Application Data, Application Data, Application Data, Application Data"
"408","0.795901142","192.168.1.118","69.147.82.61","TCP","66","37026 → 443 [ACK] Seq=2092 Ack=83639 Win=115840 Len=0 TSval=18504201 TSecr=446442829"
"409","0.796429261","192.168.1.118","69.147.82.61","TCP","66","37023 → 443 [ACK] Seq=2485 Ack=68364 Win=128384 Len=0 TSval=18504202 TSecr=2929521125"
"410","0.796694970","192.168.1.118","69.147.82.61","TLSv1.2","430","Application Data"
"411","0.801486275","69.147.82.61","192.168.1.118","TLSv1.2","5858","Application Data, Application Data, Application Data, Application Data"
"412","0.801556928","69.147.82.61","192.168.1.118","TLSv1.2","5858","Application Data, Application Data, Application Data, Application Data"
"413","0.801611030","69.147.82.61","192.168.1.118","TLSv1.2","11650","Application Data, Application Data, Application Data, Application Data, Application Data, Application Data, Application Data, Application Data, Application Data"
"414","0.801628055","69.147.82.61","192.168.1.118","TLSv1.2","10202","Application Data, Application Data, Application Data, Application Data, Application Data, Application Data, Application Data, Application Data"
"415","0.804851118","69.147.82.61","192.168.1.118","TLSv1.2","2962","Application Data, Application Data"
"416","0.804908058","69.147.82.61","192.168.1.118","TLSv1.2","2962","Application Data, Application Data"
"417","0.806522564","69.147.82.61","192.168.1.118","TLSv1.2","1514","Application Data [TCP segment of a reassembled PDU]"
"418","0.806574691","69.147.82.61","192.168.1.118","TLSv1.2","2962","Application Data, Application Data"
"419","0.807749570","184.25.176.117","192.168.1.118","TCP","74","443 → 37662 [SYN, ACK] Seq=0 Ack=1 Win=28960 Len=0 MSS=1460 SACK_PERM=1 TSval=584141950 TSecr=18504161 WS=128"
"420","0.807856711","192.168.1.118","184.25.176.117","TCP","66","37662 → 443 [ACK] Seq=1 Ack=1 Win=29312 Len=0 TSval=18504213 TSecr=584141950"
"421","0.807908713","69.147.82.61","192.168.1.118","TLSv1.2","1514","Application Data, Application Data"
"422","0.807955602","69.147.82.61","192.168.1.118","TLSv1.2","4410","Application Data, Application Data, Application Data"
"423","0.807973665","69.147.82.61","192.168.1.118","TLSv1.2","5858","Application Data, Application Data, Application Data, Application Data"
"424","0.809490281","192.168.1.118","69.147.82.61","TCP","66","37026 → 443 [ACK] Seq=2092 Ack=114047 Win=85504 Len=0 TSval=18504215 TSecr=446442829"
"425","0.811218504","192.168.1.118","69.147.82.61","TCP","66","37023 → 443 [ACK] Seq=2485 Ack=92980 Win=103808 Len=0 TSval=18504217 TSecr=2929521125"
"426","0.823174685","69.147.82.61","192.168.1.118","TLSv1.2","11650","Application Data, Application Data, Application Data, Application Data, Application Data, Application Data, Application Data, Application Data, Application Data"
"427","0.823275301","69.147.82.61","192.168.1.118","TLSv1.2","14546","Application Data, Application Data, Application Data, Application Data, Application Data, Application Data, Application Data, Application Data, Application Data, Application Data"
"428","0.826157689","69.147.82.61","192.168.1.118","TLSv1.2","766","Application Data"
"429","0.826236379","69.147.82.61","192.168.1.118","TLSv1.2","1395","Application Data"
"430","0.826276193","192.168.1.118","69.147.82.61","TCP","66","37022 → 443 [ACK] Seq=2881 Ack=29075 Win=105856 Len=0 TSval=18504232 TSecr=2934122455"
"431","0.826352883","69.147.82.61","192.168.1.118","TLSv1.2","7306","Application Data, Application Data, Application Data, Application Data, Application Data, Application Data"
"432","0.826377334","192.168.1.118","69.147.82.61","TCP","66","37022 → 443 [ACK] Seq=2881 Ack=36315 Win=120320 Len=0 TSval=18504232 TSecr=2934122455"
"433","0.827587776","69.147.82.61","192.168.1.118","TLSv1.2","2962","Application Data, Application Data"
"434","0.827665792","192.168.1.118","69.147.82.61","TCP","66","37022 → 443 [ACK] Seq=2881 Ack=39211 Win=126080 Len=0 TSval=18504233 TSecr=2934122455"
"435","0.828527747","69.147.82.61","192.168.1.118","TLSv1.2","4622","Application Data, Application Data, Application Data, Application Data"
"436","0.828603787","192.168.1.118","69.147.82.61","TCP","66","37022 → 443 [ACK] Seq=2881 Ack=43767 Win=135296 Len=0 TSval=18504234 TSecr=2934122455"
"437","0.828668439","69.147.82.61","192.168.1.118","TLSv1.2","4410","Application Data, Application Data, Application Data, Application Data"
"438","0.844822130","69.147.82.61","192.168.1.118","TLSv1.2","4410","Application Data, Application Data, Application Data, Application Data"
"439","0.844883069","69.147.82.61","192.168.1.118","TLSv1.2","1514","Application Data [TCP segment of a reassembled PDU]"
"440","0.846462237","69.147.82.61","192.168.1.118","TLSv1.2","1514","Application Data [TCP segment of a reassembled PDU]"
"441","0.846512389","69.147.82.61","192.168.1.118","TLSv1.2","1514","Application Data [TCP segment of a reassembled PDU]"
"442","0.847715481","69.147.82.61","192.168.1.118","TLSv1.2","7306","Application Data, Application Data, Application Data, Application Data, Application Data"
"443","0.847769908","69.147.82.61","192.168.1.118","TLSv1.2","5858","Application Data, Application Data, Application Data, Application Data"
"444","0.848841245","69.147.82.61","192.168.1.118","TLSv1.2","1514","Application Data [TCP segment of a reassembled PDU]"
"445","0.849808717","192.168.1.118","184.25.176.117","TLSv1","583","Client Hello"
"446","0.850428376","192.168.1.118","69.147.82.61","TCP","66","37026 → 443 [ACK] Seq=2092 Ack=153143 Win=46464 Len=0 TSval=18504256 TSecr=446442837"
"447","0.850522642","192.168.1.118","69.147.82.61","TCP","66","37023 → 443 [ACK] Seq=2485 Ack=107460 Win=89344 Len=0 TSval=18504256 TSecr=2929521168"
"448","0.858652801","69.147.82.61","192.168.1.118","TLSv1.2","2962","Application Data, Application Data"
"449","0.858717491","69.147.82.61","192.168.1.118","TLSv1.2","2962","Application Data, Application Data"
"450","0.858811982","69.147.82.61","192.168.1.118","TLSv1.2","2962","Application Data, Application Data, Application Data"
"451","0.858845645","69.147.82.61","192.168.1.118","TLSv1.2","4410","Application Data, Application Data, Application Data, Application Data"
"452","0.858884472","69.147.82.61","192.168.1.118","TLSv1.2","5858","Application Data, Application Data, Application Data, Application Data"
"453","0.858899185","69.147.82.61","192.168.1.118","TLSv1.2","2962","Application Data, Application Data"
"454","0.858979750","192.168.1.118","69.147.82.61","TCP","66","37023 → 443 [ACK] Seq=2485 Ack=117596 Win=79232 Len=0 TSval=18504264 TSecr=2929521168"
"455","0.859810567","69.147.82.61","192.168.1.118","TLSv1.2","1514","Application Data [TCP segment of a reassembled PDU]"
"456","0.864744502","192.168.1.118","69.147.82.61","TCP","66","37026 → 443 [ACK] Seq=2092 Ack=164727 Win=34944 Len=0 TSval=18504270 TSecr=446442872"
"457","0.864951684","69.147.82.61","192.168.1.118","TLSv1.2","1683","Application Data, Application Data"
"458","0.865027549","69.147.82.61","192.168.1.118","TLSv1.2","4410","Application Data, Application Data, Application Data"
"459","0.865128078","192.168.1.118","69.147.82.61","TCP","66","37026 → 443 [ACK] Seq=2092 Ack=166344 Win=33408 Len=0 TSval=18504271 TSecr=446442873"
"460","0.865190218","69.147.82.61","192.168.1.118","TLSv1.2","761","Application Data"
"461","0.865196018","192.168.1.118","69.147.82.61","TCP","66","37023 → 443 [ACK] Seq=2485 Ack=123388 Win=73472 Len=0 TSval=18504271 TSecr=2929521169"
"462","0.865241807","192.168.1.118","69.147.82.61","TCP","66","37024 → 443 [ACK] Seq=2884 Ack=32755 Win=114432 Len=0 TSval=18504271 TSecr=2929521169"
"463","0.865291159","69.147.82.61","192.168.1.118","TLSv1.2","1395","Application Data"
"464","0.865312509","192.168.1.118","69.147.82.61","TCP","66","37024 → 443 [ACK] Seq=2884 Ack=34084 Win=117248 Len=0 TSval=18504271 TSecr=2929521169"
"465","0.865379049","69.147.82.61","192.168.1.118","TLSv1.2","7306","Application Data, Application Data, Application Data, Application Data, Application Data, Application Data"
"466","0.865397112","69.147.82.61","192.168.1.118","TLSv1.2","5858","Application Data, Application Data, Application Data, Application Data, Application Data"
"467","0.865419863","192.168.1.118","69.147.82.61","TCP","66","37024 → 443 [ACK] Seq=2884 Ack=39876 Win=128896 Len=0 TSval=18504271 TSecr=2929521169"
"468","0.874921658","69.147.82.61","192.168.1.118","TLSv1.2","4410","Application Data, Application Data, Application Data"
"469","0.875011336","192.168.1.118","69.147.82.61","TCP","66","37024 → 443 [ACK] Seq=2884 Ack=44220 Win=137600 Len=0 TSval=18504280 TSecr=2929521169"
"470","0.875082514","69.147.82.61","192.168.1.118","TLSv1.2","4410","Application Data, Application Data, Application Data"
"471","0.875107077","192.168.1.118","69.147.82.61","TCP","66","37024 → 443 [ACK] Seq=2884 Ack=48564 Win=146176 Len=0 TSval=18504281 TSecr=2929521170"
"472","0.875225556","69.147.82.61","192.168.1.118","TLSv1.2","7306","Application Data, Application Data, Application Data, Application Data, Application Data, Application Data"
"473","0.875250520","192.168.1.118","69.147.82.61","TCP","66","37024 → 443 [ACK] Seq=2884 Ack=55804 Win=148480 Len=0 TSval=18504281 TSecr=2929521170"
"474","0.875262983","69.147.82.61","192.168.1.118","TLSv1.2","5858","Application Data, Application Data, Application Data, Application Data"
"475","0.877043020","192.168.1.118","69.147.82.61","TCP","66","37023 → 443 [ACK] Seq=2485 Ack=136420 Win=60544 Len=0 TSval=18504282 TSecr=2929521169"
"476","0.877556350","192.168.1.118","69.147.82.61","TLSv1.2","422","Application Data"
"477","0.877694230","69.147.82.61","192.168.1.118","TLSv1.2","1514","Application Data [TCP segment of a reassembled PDU]"
"478","0.882272215","69.147.82.61","192.168.1.118","TLSv1.2","2710","Application Data, Application Data, Application Data"
"479","0.884043752","192.168.1.118","69.147.82.61","TCP","66","37023 → 443 [ACK] Seq=2485 Ack=140512 Win=56576 Len=0 TSval=18504289 TSecr=2929521183"
"480","0.897474860","192.168.1.118","69.147.82.61","TLSv1.2","424","Application Data"
"481","0.904249835","69.147.82.61","192.168.1.118","TLSv1.2","1448","Application Data, Application Data"
"482","0.905676384","69.147.82.61","192.168.1.118","TLSv1.2","764","Application Data"
"483","0.908677077","69.147.82.61","192.168.1.118","TLSv1.2","1395","Application Data"
"484","0.908756330","192.168.1.118","69.147.82.61","TCP","66","37025 → 443 [ACK] Seq=2422 Ack=44717 Win=132864 Len=0 TSval=18504314 TSecr=2934122560"
"485","0.908819019","69.147.82.61","192.168.1.118","TLSv1.2","4410","Application Data, Application Data, Application Data"
"486","0.908839958","192.168.1.118","69.147.82.61","TCP","66","37025 → 443 [ACK] Seq=2422 Ack=49061 Win=141568 Len=0 TSval=18504314 TSecr=2934122560"
"487","0.909152944","69.147.82.61","192.168.1.118","TLSv1.2","2962","Application Data, Application Data"
"488","0.909181482","192.168.1.118","69.147.82.61","TCP","66","37025 → 443 [ACK] Seq=2422 Ack=51957 Win=147328 Len=0 TSval=18504315 TSecr=2934122560"
"489","0.909211021","69.147.82.61","192.168.1.118","TLSv1.2","2962","Application Data, Application Data"
"490","0.909231634","192.168.1.118","69.147.82.61","TCP","66","37025 → 443 [ACK] Seq=2422 Ack=54853 Win=153088 Len=0 TSval=18504315 TSecr=2934122561"
"491","0.913556060","184.25.176.117","192.168.1.118","TCP","66","443 → 37662 [ACK] Seq=1 Ack=518 Win=30080 Len=0 TSval=584142084 TSecr=18504255"
"492","0.913641326","69.147.82.61","192.168.1.118","TLSv1.2","5858","Application Data, Application Data, Application Data, Application Data, Application Data"
"493","0.913686302","192.168.1.118","69.147.82.61","TCP","66","37025 → 443 [ACK] Seq=2422 Ack=60645 Win=156672 Len=0 TSval=18504319 TSecr=2934122561"
"494","0.915228131","69.147.82.61","192.168.1.118","TLSv1.2","4410","Application Data, Application Data, Application Data"
"495","0.916464262","69.147.82.61","192.168.1.118","TLSv1.2","10202","Application Data, Application Data, Application Data, Application Data, Application Data, Application Data, Application Data"
"496","0.916528802","69.147.82.61","192.168.1.118","TLSv1.2","1514","Application Data, Application Data"
"497","0.919811979","69.147.82.61","192.168.1.118","TLSv1.2","298","Application Data"
"498","0.919813642","192.168.1.118","69.147.82.61","TCP","66","37025 → 443 [ACK] Seq=2422 Ack=76573 Win=140800 Len=0 TSval=18504325 TSecr=2934122561"
"499","0.919890519","184.25.176.117","192.168.1.118","TLSv1.2","4162","Server Hello"
"500","0.919940146","192.168.1.118","184.25.176.117","TCP","66","37662 → 443 [ACK] Seq=518 Ack=4097 Win=37504 Len=0 TSval=18504325 TSecr=584142091"
"501","0.919984885","69.147.82.61","192.168.1.118","TLSv1.2","764","Application Data"
"502","0.920014349","69.147.82.61","192.168.1.118","TLSv1.2","1395","Application Data"
"503","0.920036512","192.168.1.118","69.147.82.61","TCP","66","37022 → 443 [ACK] Seq=3239 Ack=45794 Win=141056 Len=0 TSval=18504325 TSecr=2934122571"
"504","0.921309844","69.147.82.61","192.168.1.118","TLSv1.2","9106","Application Data, Application Data, Application Data, Application Data, Application Data, Application Data, Application Data"
"505","0.921375746","192.168.1.118","69.147.82.61","TCP","66","37022 → 443 [ACK] Seq=3239 Ack=54834 Win=159104 Len=0 TSval=18504327 TSecr=2934122571"
"506","0.924325912","192.168.1.118","69.147.82.61","TCP","66","37024 → 443 [ACK] Seq=2884 Ack=57186 Win=160768 Len=0 TSval=18504330 TSecr=2929521258"
"507","0.928957287","184.25.176.117","192.168.1.118","TLSv1.2","1168","Certificate, Server Key Exchange, Server Hello Done"
"508","0.929040890","192.168.1.118","184.25.176.117","TCP","66","37662 → 443 [ACK] Seq=518 Ack=5199 Win=40320 Len=0 TSval=18504334 TSecr=584142098"
"509","0.933805156","192.168.1.118","184.25.176.117","TLSv1.2","192","Client Key Exchange, Change Cipher Spec, Encrypted Handshake Message"
"510","0.934149381","192.168.1.118","69.147.82.61","TLSv1.2","420","Application Data"
"511","0.948317102","192.168.1.118","69.147.82.61","TLSv1.2","418","Application Data"
"512","0.948933561","69.147.82.61","192.168.1.118","TLSv1.2","783","Application Data"
"513","0.951898252","69.147.82.61","192.168.1.118","TLSv1.2","1395","Application Data"
"514","0.951981105","192.168.1.118","69.147.82.61","TCP","66","37024 → 443 [ACK] Seq=3238 Ack=59232 Win=166528 Len=0 TSval=18504357 TSecr=2929521303"
"515","0.952049032","69.147.82.61","192.168.1.118","TLSv1.2","4410","Application Data, Application Data, Application Data"
"516","0.952088946","192.168.1.118","69.147.82.61","TCP","66","37024 → 443 [ACK] Seq=3238 Ack=63576 Win=173056 Len=0 TSval=18504358 TSecr=2929521303"
"517","0.952106459","69.147.82.61","192.168.1.118","TLSv1.2","2252","Application Data, Application Data"
"518","0.954768903","184.25.176.117","192.168.1.118","TLSv1.2","117","Change Cipher Spec, Encrypted Handshake Message"
"519","0.958136596","192.168.1.118","69.147.82.61","TCP","66","[TCP Window Update] 37026 → 443 [ACK] Seq=2092 Ack=166344 Win=71552 Len=0 TSval=18504364 TSecr=446442873"
"520","0.958878821","192.168.1.118","184.25.176.117","TLSv1.2","331","Application Data"
"521","0.959016976","192.168.1.118","69.147.82.61","TCP","66","37024 → 443 [ACK] Seq=3238 Ack=65762 Win=170880 Len=0 TSval=18504364 TSecr=2929521304"
"522","0.959096829","192.168.1.118","69.147.82.61","TCP","66","37025 → 443 [ACK] Seq=2422 Ack=76805 Win=140672 Len=0 TSval=18504365 TSecr=2934122562"
"523","0.977342355","192.168.1.118","69.147.82.61","TLSv1.2","419","Application Data"
"524","0.977497261","192.168.1.118","69.147.82.61","TCP","66","[TCP Window Update] 37023 → 443 [ACK] Seq=2485 Ack=140512 Win=123520 Len=0 TSval=18504383 TSecr=2929521183"
"525","0.987661191","192.168.1.118","69.147.82.61","TLSv1.2","423","Application Data"
"526","1.013820732","69.147.82.61","192.168.1.118","TLSv1.2","762","Application Data"
"527","1.017172499","69.147.82.61","192.168.1.118","TLSv1.2","1028","Application Data"
"528","1.017243939","192.168.1.118","69.147.82.61","TCP","66","37022 → 443 [ACK] Seq=3591 Ack=56492 Win=164864 Len=0 TSval=18504423 TSecr=2934122667"
"529","1.017291216","69.147.82.61","192.168.1.118","TLSv1.2","761","Application Data"
"530","1.017338768","69.147.82.61","192.168.1.118","TLSv1.2","1395","Application Data"
"531","1.017361368","192.168.1.118","69.147.82.61","TCP","66","37024 → 443 [ACK] Seq=3591 Ack=67786 Win=179200 Len=0 TSval=18504423 TSecr=2929521367"
"532","1.017384882","69.147.82.61","192.168.1.118","TLSv1.2","1514","Application Data"
"533","1.017399045","69.147.82.61","192.168.1.118","TLSv1.2","1514","Application Data"
"534","1.018876696","69.147.82.61","192.168.1.118","TLSv1.2","2962","Application Data, Application Data"
"535","1.018962224","192.168.1.118","69.147.82.61","TCP","66","37022 → 443 [ACK] Seq=3591 Ack=60836 Win=173568 Len=0 TSval=18504424 TSecr=2934122667"
"536","1.018999713","69.147.82.61","192.168.1.118","TLSv1.2","1514","Application Data [TCP segment of a reassembled PDU]"
"537","1.020082276","69.147.82.61","192.168.1.118","TLSv1.2","5858","Application Data, Application Data, Application Data, Application Data"
"538","1.020124315","69.147.82.61","192.168.1.118","TLSv1.2","5858","Application Data, Application Data, Application Data, Application Data"
"539","1.020693022","192.168.1.118","69.147.82.61","TCP","66","37022 → 443 [ACK] Seq=3591 Ack=66628 Win=167808 Len=0 TSval=18504426 TSecr=2934122668"
"540","1.020805351","192.168.1.118","69.147.82.61","TCP","66","37024 → 443 [ACK] Seq=3591 Ack=76474 Win=170624 Len=0 TSval=18504426 TSecr=2929521367"
"541","1.030947856","69.147.82.61","192.168.1.118","TLSv1.2","761","Application Data"
"542","1.031043822","192.168.1.118","69.147.82.61","TCP","66","37025 → 443 [ACK] Seq=2779 Ack=77500 Win=167552 Len=0 TSval=18504436 TSecr=2934122668"
"543","1.031104337","69.147.82.61","192.168.1.118","TLSv1.2","1395","Application Data"
"544","1.031126525","192.168.1.118","69.147.82.61","TCP","66","37025 → 443 [ACK] Seq=2779 Ack=78829 Win=170496 Len=0 TSval=18504437 TSecr=2934122668"
"545","1.031181989","69.147.82.61","192.168.1.118","TLSv1.2","7306","Application Data, Application Data, Application Data, Application Data, Application Data, Application Data"
"546","1.031206028","192.168.1.118","69.147.82.61","TCP","66","37024 → 443 [ACK] Seq=3591 Ack=83714 Win=173056 Len=0 TSval=18504437 TSecr=2929521367"
"547","1.031219566","69.147.82.61","192.168.1.118","TLSv1.2","5858","Application Data, Application Data, Application Data, Application Data"
"548","1.031240617","192.168.1.118","69.147.82.61","TCP","66","37022 → 443 [ACK] Seq=3591 Ack=72420 Win=175104 Len=0 TSval=18504437 TSecr=2934122668"
"549","1.031253367","69.147.82.61","192.168.1.118","TLSv1.2","4410","Application Data, Application Data, Application Data, Application Data"
"550","1.031273118","192.168.1.118","69.147.82.61","TCP","66","37025 → 443 [ACK] Seq=2779 Ack=83173 Win=173056 Len=0 TSval=18504437 TSecr=2934122668"
"551","1.031390597","69.147.82.61","192.168.1.118","TLSv1.2","2962","Application Data, Application Data"
"552","1.032408070","192.168.1.118","69.147.82.61","TCP","66","37024 → 443 [ACK] Seq=3591 Ack=86610 Win=170240 Len=0 TSval=18504438 TSecr=2929521367"
"553","1.036055260","69.147.82.61","192.168.1.118","TLSv1.2","2962","Application Data, Application Data"
"554","1.036128450","69.147.82.61","192.168.1.118","TLSv1.2","2962","Application Data, Application Data, Application Data"
"555","1.036924440","192.168.1.118","69.147.82.61","TCP","66","37022 → 443 [ACK] Seq=3591 Ack=75316 Win=172288 Len=0 TSval=18504442 TSecr=2934122668"
"556","1.037050557","192.168.1.118","69.147.82.61","TCP","66","37024 → 443 [ACK] Seq=3591 Ack=89506 Win=167424 Len=0 TSval=18504442 TSecr=2929521367"
"557","1.037310829","192.168.1.118","69.147.82.61","TLSv1.2","423","Application Data"
"558","1.037382944","192.168.1.118","69.147.82.61","TCP","66","[TCP Window Update] 37026 → 443 [ACK] Seq=2092 Ack=166344 Win=144640 Len=0 TSval=18504443 TSecr=446442873"
"559","1.037618002","69.147.82.61","192.168.1.118","TLSv1.2","1301","Application Data, Application Data"
"560","1.037693817","69.147.82.61","192.168.1.118","TLSv1.2","2322","Application Data, Application Data, Application Data"
"561","1.037734656","69.147.82.61","192.168.1.118","TLSv1.2","6303","Application Data, Application Data, Application Data, Application Data, Application Data, Application Data"
"562","1.037763395","184.25.176.117","192.168.1.118","TLSv1.2","716","Application Data"
"563","1.039391414","192.168.1.118","69.147.82.61","TCP","66","37022 → 443 [ACK] Seq=3591 Ack=81553 Win=166144 Len=0 TSval=18504445 TSecr=2934122668"
"564","1.039512444","192.168.1.118","69.147.82.61","TCP","66","37024 → 443 [ACK] Seq=3591 Ack=91762 Win=165248 Len=0 TSval=18504445 TSecr=2929521367"
"565","1.039985510","192.168.1.118","69.147.82.61","TCP","66","37025 → 443 [ACK] Seq=2779 Ack=84408 Win=179200 Len=0 TSval=18504445 TSecr=2934122668"
"566","1.040224243","192.168.1.118","184.25.176.117","TLSv1.2","332","Application Data"
"567","1.041965604","192.168.1.118","69.147.82.61","TLSv1.2","420","Application Data"
"568","1.047208250","192.168.1.118","69.147.82.61","TLSv1.2","427","Application Data"
"569","1.047374319","192.168.1.118","69.147.82.61","TLSv1.2","427","Application Data"
"570","1.055835515","192.168.1.118","69.147.82.61","TLSv1.2","421","Application Data"
"571","1.092529887","69.147.82.61","192.168.1.118","TLSv1.2","761","Application Data"
"572","1.094142831","69.147.82.61","192.168.1.118","TLSv1.2","1395","Application Data"
"573","1.094199333","192.168.1.118","69.147.82.61","TCP","66","37023 → 443 [ACK] Seq=2842 Ack=142536 Win=155904 Len=0 TSval=18504500 TSecr=2929521410"
"574","1.094254534","69.147.82.61","192.168.1.118","TLSv1.2","2180","Application Data, Application Data"
"575","1.094277585","192.168.1.118","69.147.82.61","TCP","66","37023 → 443 [ACK] Seq=2842 Ack=144650 Win=160128 Len=0 TSval=18504500 TSecr=2929521410"
"576","1.100659159","192.168.1.118","69.147.82.61","TLSv1.2","428","Application Data"
"577","1.138080868","69.147.82.61","192.168.1.118","TLSv1.2","761","Application Data"
"578","1.140628707","69.147.82.61","192.168.1.118","TLSv1.2","784","Application Data"
"579","1.140711210","69.147.82.61","192.168.1.118","TLSv1.2","1395","Application Data"
"580","1.140752474","192.168.1.118","69.147.82.61","TCP","66","37023 → 443 [ACK] Seq=3204 Ack=146697 Win=165888 Len=0 TSval=18504546 TSecr=2929521490"
"581","1.140800751","69.147.82.61","192.168.1.118","TLSv1.2","761","Application Data"
"582","1.140825539","69.147.82.61","192.168.1.118","TLSv1.2","1029","Application Data"
"583","1.140846328","192.168.1.118","69.147.82.61","TCP","66","37025 → 443 [ACK] Seq=3133 Ack=86066 Win=179200 Len=0 TSval=18504546 TSecr=2934122791"
"584","1.140861528","69.147.82.61","192.168.1.118","TLSv1.2","1514","Application Data"
"585","1.142302166","69.147.82.61","192.168.1.118","TLSv1.2","1279","Application Data"
"586","1.142367731","69.147.82.61","192.168.1.118","TLSv1.2","1514","Application Data"
"587","1.142386231","69.147.82.61","192.168.1.118","TLSv1.2","2962","Application Data, Application Data"
"588","1.142582163","192.168.1.118","69.147.82.61","TCP","66","37022 → 443 [ACK] Seq=3952 Ack=86592 Win=177280 Len=0 TSval=18504548 TSecr=2934122791"
"589","1.143018616","69.147.82.61","192.168.1.118","TLSv1.2","761","Application Data"
"590","1.143062793","69.147.82.61","192.168.1.118","TLSv1.2","1395","Application Data"
"591","1.143125557","69.147.82.61","192.168.1.118","TLSv1.2","2962","Application Data, Application Data"
"592","1.143141133","69.147.82.61","192.168.1.118","TLSv1.2","1514","Application Data"
"593","1.143152858","69.147.82.61","192.168.1.118","TLSv1.2","2962","Application Data, Application Data"
"594","1.144890294","192.168.1.118","69.147.82.61","TCP","66","37025 → 443 [ACK] Seq=3133 Ack=90410 Win=174976 Len=0 TSval=18504550 TSecr=2934122791"
"595","1.145037574","192.168.1.118","69.147.82.61","TCP","66","37022 → 443 [ACK] Seq=3952 Ack=89488 Win=174464 Len=0 TSval=18504550 TSecr=2934122791"
"596","1.145121227","192.168.1.118","69.147.82.61","TCP","66","37024 → 443 [ACK] Seq=3952 Ack=95234 Win=177536 Len=0 TSval=18504551 TSecr=2929521490"
"597","1.150052700","69.147.82.61","192.168.1.118","TLSv1.2","2962","Application Data, Application Data, Application Data"
"598","1.150250357","69.147.82.61","192.168.1.118","TLSv1.2","1514","Application Data [TCP segment of a reassembled PDU]"
"599","1.150268445","69.147.82.61","192.168.1.118","TLSv1.2","1514","Application Data [TCP segment of a reassembled PDU]"
"600","1.150530417","192.168.1.118","69.147.82.61","TCP","66","37025 → 443 [ACK] Seq=3133 Ack=93306 Win=172160 Len=0 TSval=18504556 TSecr=2934122791"
"601","1.150857328","192.168.1.118","69.147.82.61","TLSv1.2","427","Application Data"
"602","1.164976297","69.147.82.61","192.168.1.118","TLSv1.2","351","Application Data"
"603","1.165055087","192.168.1.118","69.147.82.61","TCP","66","37022 → 443 [ACK] Seq=3952 Ack=91221 Win=181248 Len=0 TSval=18504570 TSecr=2934122791"
"604","1.165116040","69.147.82.61","192.168.1.118","TLSv1.2","1514","Application Data [TCP segment of a reassembled PDU]"
"605","1.165137815","192.168.1.118","69.147.82.61","TCP","66","37024 → 443 [ACK] Seq=3952 Ack=98130 Win=181248 Len=0 TSval=18504571 TSecr=2929521490"
"606","1.165175804","69.147.82.61","192.168.1.118","TLSv1.2","10850","Application Data, Application Data, Application Data, Application Data, Application Data, Application Data, Application Data, Application Data, Application Data"
"607","1.165200605","69.147.82.61","192.168.1.118","TLSv1.2","5858","Application Data, Application Data, Application Data, Application Data"
"608","1.165220118","192.168.1.118","69.147.82.61","TCP","66","37025 → 443 [ACK] Seq=3133 Ack=99098 Win=175104 Len=0 TSval=18504571 TSecr=2934122791"
"609","1.165256707","69.147.82.61","192.168.1.118","TLSv1.2","17028","Application Data, Application Data, Application Data, Application Data, Application Data, Application Data, Application Data, Application Data, Application Data, Application Data, Application Data, Application Data, Application Data, Application Data"
"610","1.165277083","69.147.82.61","192.168.1.118","TLSv1.2","762","Application Data"
"611","1.165336385","69.147.82.61","192.168.1.118","TLSv1.2","23234","Application Data, Application Data, Application Data, Application Data, Application Data, Application Data, Application Data, Application Data, Application Data, Application Data, Application Data, Application Data, Application Data, Application Data, Application Data, Application Data, Application Data"
"612","1.165363998","192.168.1.118","69.147.82.61","TCP","66","37026 → 443 [ACK] Seq=2447 Ack=190208 Win=148480 Len=0 TSval=18504571 TSecr=446443196"
"613","1.167149536","69.147.82.61","192.168.1.118","TLSv1.2","1195","Application Data, Application Data"
"614","1.170016761","192.168.1.118","69.147.82.61","TCP","66","37025 → 443 [ACK] Seq=3133 Ack=116060 Win=158208 Len=0 TSval=18504575 TSecr=2934122792"
"615","1.170276470","192.168.1.118","69.147.82.61","TCP","66","37024 → 443 [ACK] Seq=3952 Ack=108914 Win=170496 Len=0 TSval=18504576 TSecr=2929521491"
"616","1.170746699","184.25.176.117","192.168.1.118","TLSv1.2","404","Application Data"
"617","1.173246262","192.168.1.118","69.147.82.61","TLSv1.2","281","Application Data"
"618","1.173430856","69.147.82.61","192.168.1.118","TLSv1.2","761","Application Data"
"619","1.173527184","69.147.82.61","192.168.1.118","TLSv1.2","3983","Application Data, Application Data, Application Data"
"620","1.173569310","192.168.1.118","69.147.82.61","TCP","66","37023 → 443 [ACK] Seq=3565 Ack=152522 Win=175104 Len=0 TSval=18504579 TSecr=2929521523"
"621","1.174810379","69.147.82.61","192.168.1.118","TLSv1.2","2962","Application Data, Application Data"
"622","1.174876344","69.147.82.61","192.168.1.118","TLSv1.2","1630","Application Data, Application Data"
"623","1.174906745","69.147.82.61","192.168.1.118","TLSv1.2","1921","Application Data, Application Data"
"624","1.176569890","192.168.1.118","69.147.82.61","TCP","66","37023 → 443 [ACK] Seq=3565 Ack=158837 Win=168832 Len=0 TSval=18504582 TSecr=2929521523"
"625","1.200488552","69.147.82.61","192.168.1.118","TLSv1.2","893","Application Data"
"626","1.203364566","69.147.82.61","192.168.1.118","TLSv1.2","1514","Application Data"
"627","1.203450069","69.147.82.61","192.168.1.118","TLSv1.2","5858","Application Data, Application Data, Application Data, Application Data"
"628","1.205283858","192.168.1.118","69.147.82.61","TCP","66","37022 → 443 [ACK] Seq=4167 Ack=99288 Win=174208 Len=0 TSval=18504611 TSecr=2934122855"
"629","1.205502540","69.147.82.61","192.168.1.118","TLSv1.2","5858","Application Data, Application Data, Application Data, Application Data"
"630","1.205897379","192.168.1.118","69.147.82.61","TCP","66","37022 → 443 [ACK] Seq=4167 Ack=105080 Win=168448 Len=0 TSval=18504611 TSecr=2934122856"
"631","1.207147186","192.168.1.118","69.147.82.61","TCP","66","37026 → 443 [ACK] Seq=2447 Ack=191337 Win=147456 Len=0 TSval=18504613 TSecr=446443196"
"632","1.207265790","69.147.82.61","192.168.1.118","TLSv1.2","2962","Application Data, Application Data"
"633","1.208784518","69.147.82.61","192.168.1.118","TLSv1.2","8754","Application Data, Application Data, Application Data, Application Data, Application Data, Application Data, Application Data"
"634","1.208868733","69.147.82.61","192.168.1.118","TLSv1.2","4410","Application Data, Application Data, Application Data"
"635","1.211045872","192.168.1.118","69.147.82.61","TCP","66","37022 → 443 [ACK] Seq=4167 Ack=121008 Win=152576 Len=0 TSval=18504616 TSecr=2934122856"
"636","1.211792423","69.147.82.61","192.168.1.118","TLSv1.2","1514","Application Data [TCP segment of a reassembled PDU]"
"637","1.216141388","192.168.1.118","184.25.176.117","TCP","66","37662 → 443 [ACK] Seq=1175 Ack=6238 Win=46080 Len=0 TSval=18504622 TSecr=584142331"
"638","1.216347133","69.147.82.61","192.168.1.118","TLSv1.2","7306","Application Data, Application Data, Application Data, Application Data, Application Data, Application Data"
"639","1.216534602","192.168.1.118","69.147.82.61","TCP","66","37022 → 443 [ACK] Seq=4167 Ack=129696 Win=144000 Len=0 TSval=18504622 TSecr=2934122857"
"640","1.217994628","69.147.82.61","192.168.1.118","TLSv1.2","1514","Application Data [TCP segment of a reassembled PDU]"
"641","1.219516118","69.147.82.61","192.168.1.118","TLSv1.2","8754","Application Data, Application Data, Application Data, Application Data, Application Data, Application Data"
"642","1.219594221","69.147.82.61","192.168.1.118","TLSv1.2","4410","Application Data, Application Data, Application Data, Application Data"
"643","1.221521051","69.147.82.61","192.168.1.118","TLSv1.2","1514","Application Data [TCP segment of a reassembled PDU]"
"644","1.226202740","69.147.82.61","192.168.1.118","TLSv1.2","8754","Application Data, Application Data, Application Data, Application Data, Application Data, Application Data"
"645","1.227017318","69.147.82.61","192.168.1.118","TLSv1.2","4410","Application Data, Application Data, Application Data, Application Data"
"646","1.228364378","192.168.1.118","69.147.82.61","TCP","66","37022 → 443 [ACK] Seq=4167 Ack=158656 Win=115072 Len=0 TSval=18504634 TSecr=2934122857"
"647","1.228697402","69.147.82.61","192.168.1.118","TLSv1.2","2962","Application Data, Application Data"
"648","1.229110867","192.168.1.118","69.147.82.61","TCP","66","37022 → 443 [ACK] Seq=4167 Ack=161552 Win=112256 Len=0 TSval=18504634 TSecr=2934122881"
"649","1.230357823","69.147.82.61","192.168.1.118","TLSv1.2","2962","Application Data, Application Data"
"650","1.232751557","69.147.82.61","192.168.1.118","TLSv1.2","5858","Application Data, Application Data, Application Data, Application Data"
"651","1.232914562","69.147.82.61","192.168.1.118","TLSv1.2","10202","Application Data, Application Data, Application Data, Application Data, Application Data, Application Data, Application Data, Application Data"
"652","1.233871571","192.168.1.118","69.147.82.61","TCP","66","37022 → 443 [ACK] Seq=4167 Ack=180376 Win=93440 Len=0 TSval=18504639 TSecr=2934122881"
"653","1.234416827","69.147.82.61","192.168.1.118","TLSv1.2","1514","Application Data [TCP segment of a reassembled PDU]"
"654","1.237897999","69.147.82.61","192.168.1.118","TLSv1.2","5858","Application Data, Application Data, Application Data, Application Data"
"655","1.239551007","69.147.82.61","192.168.1.118","TLSv1.2","2962","Application Data, Application Data, Application Data"
"656","1.240287358","192.168.1.118","69.147.82.61","TCP","66","37022 → 443 [ACK] Seq=4167 Ack=190512 Win=83328 Len=0 TSval=18504646 TSecr=2934122882"
"657","1.240714285","69.147.82.61","192.168.1.118","TLSv1.2","13098","Application Data, Application Data, Application Data, Application Data, Application Data, Application Data, Application Data, Application Data, Application Data"
"658","1.242495898","192.168.1.118","69.147.82.61","TCP","66","37022 → 443 [ACK] Seq=4167 Ack=203544 Win=70400 Len=0 TSval=18504648 TSecr=2934122882"
"659","1.245930193","69.147.82.61","192.168.1.118","TLSv1.2","1514","Application Data [TCP segment of a reassembled PDU]"
"660","1.248573910","69.147.82.61","192.168.1.118","TLSv1.2","8754","Application Data, Application Data, Application Data, Application Data, Application Data, Application Data, Application Data"
"661","1.250179842","69.147.82.61","192.168.1.118","TLSv1.2","1514","Application Data [TCP segment of a reassembled PDU]"
"662","1.251399309","69.147.82.61","192.168.1.118","TLSv1.2","4410","Application Data, Application Data, Application Data"
"663","1.251473687","69.147.82.61","192.168.1.118","TLSv1.2","7306","Application Data, Application Data, Application Data, Application Data, Application Data, Application Data"
"664","1.252486910","69.147.82.61","192.168.1.118","TLSv1.2","1514","Application Data [TCP segment of a reassembled PDU]"
"665","1.254795116","192.168.1.118","69.147.82.61","TCP","66","37022 → 443 [ACK] Seq=4167 Ack=228160 Win=45824 Len=0 TSval=18504660 TSecr=2934122883"
"666","1.263747604","69.147.82.61","192.168.1.118","TLSv1.2","5858","Application Data, Application Data, Application Data, Application Data"
"667","1.264436903","69.147.82.61","192.168.1.118","TLSv1.2","2962","Application Data, Application Data"
"668","1.264491593","69.147.82.61","192.168.1.118","TLSv1.2","3690","Application Data, Application Data, Application Data, Application Data"
"669","1.303145458","192.168.1.118","69.147.82.61","TCP","66","37022 → 443 [ACK] Seq=4167 Ack=240472 Win=33536 Len=0 TSval=18504709 TSecr=2934122890"
"670","1.751863062","192.168.1.118","184.25.176.117","TLSv1.2","331","Application Data"
"671","1.780287520","184.25.176.117","192.168.1.118","TLSv1.2","716","Application Data"
"672","1.780390361","192.168.1.118","184.25.176.117","TCP","66","37662 → 443 [ACK] Seq=1440 Ack=6888 Win=49024 Len=0 TSval=18505186 TSecr=584142958"
"673","1.842031768","192.168.1.118","184.25.176.117","TLSv1.2","382","Application Data"
"674","1.844787252","192.168.1.118","69.147.82.61","TCP","66","[TCP Window Update] 37022 → 443 [ACK] Seq=4167 Ack=240472 Win=82688 Len=0 TSval=18505250 TSecr=2934122890"
"675","1.853006052","192.168.1.118","69.147.82.61","TCP","66","[TCP Window Update] 37022 → 443 [ACK] Seq=4167 Ack=240472 Win=178048 Len=0 TSval=18505258 TSecr=2934122890"
"676","1.932434957","184.25.176.117","192.168.1.118","TLSv1.2","351","Application Data"
"677","1.932533773","192.168.1.118","184.25.176.117","TCP","66","37662 → 443 [ACK] Seq=1756 Ack=7173 Win=51968 Len=0 TSval=18505338 TSecr=584143104"
"678","3.425693407","192.168.1.104","255.255.255.255","UDP","217","49154 → 6666 Len=175"
"679","4.553829577","192.168.1.102","224.0.0.251","MDNS","183","Standard query response 0x0000 SRV, cache flush 0 0 8009 2c3f16b2-da5c-4b6f-d6cf-bfba61c12490.local"
"680","5.766257648","192.168.1.118","192.168.1.102","TCP","176","33923 → 8009 [PSH, ACK] Seq=111 Ack=111 Win=364 Len=110 TSval=18509172 TSecr=4396228 [TCP segment of a reassembled PDU]"
"681","5.805776769","192.168.1.102","192.168.1.118","TCP","176","8009 → 33923 [PSH, ACK] Seq=111 Ack=221 Win=294 Len=110 TSval=4396734 TSecr=18509172 [TCP segment of a reassembled PDU]"
"682","5.805867847","192.168.1.118","192.168.1.102","TCP","66","33923 → 8009 [ACK] Seq=221 Ack=221 Win=364 Len=0 TSval=18509211 TSecr=4396734"
"683","6.293960642","192.168.1.1","224.0.0.251","IGMPv2","46","Membership Report group 224.0.0.251"
"684","6.397191530","192.168.1.104","255.255.255.255","UDP","217","49154 → 6666 Len=175"
"685","9.367055059","192.168.1.104","255.255.255.255","UDP","217","49154 → 6666 Len=175"
"686","9.368731880","192.168.1.103","224.0.0.251","MDNS","139","Standard query 0x0000 PTR _companion-link._tcp.local, "QU" question PTR _sleep-proxy._udp.local, "QU" question OPT"
"687","9.774712439","192.168.1.103","224.0.0.251","IGMPv2","46","Membership Report group 224.0.0.251"
