frame.number,_ws.col.Time,_ws.col.Source,_ws.col.Destination,_ws.col.Protocol,frame.len,_ws.col.Info
"1","0.000000000","31.13.71.36","192.168.1.118","TCP","74","443 → 33358 [SYN, ACK] Seq=0 Ack=1 Win=27760 Len=0 MSS=1400 SACK_PERM=1 TSval=788008118 TSecr=2510210600 WS=256"
"2","0.000089575","192.168.1.118","31.13.71.36","TCP","66","33358 → 443 [ACK] Seq=1 Ack=1 Win=502 Len=0 TSval=2510210621 TSecr=788008118"
"3","0.109656525","192.168.1.118","31.13.71.36","TLSv1","583","Client Hello"
"4","0.123811025","192.168.1.118","31.13.71.7","TLSv1.2","277","Application Data"
"5","0.127383187","192.168.1.118","31.13.71.7","TLSv1.2","277","Application Data"
"6","0.132305487","31.13.71.36","192.168.1.118","TCP","66","443 → 33358 [ACK] Seq=1 Ack=518 Win=28928 Len=0 TSval=788008254 TSecr=2510210731"
"7","0.134678037","192.168.1.118","31.13.71.7","TLSv1.2","277","Application Data"
"8","0.134713425","31.13.71.36","192.168.1.118","TLSv1.2","1454","Server Hello"
"9","0.134769937","192.168.1.118","31.13.71.36","TCP","66","33358 → 443 [ACK] Seq=518 Ack=1389 Win=493 Len=0 TSval=2510210756 TSecr=788008255"
"10","0.136291825","31.13.71.36","192.168.1.118","TLSv1.2","2001","Certificate, Server Key Exchange, Server Hello Done"
"11","0.136351787","192.168.1.118","31.13.71.36","TCP","66","33358 → 443 [ACK] Seq=518 Ack=3324 Win=478 Len=0 TSval=2510210757 TSecr=788008255"
"12","0.138953362","192.168.1.118","31.13.71.36","TLSv1.2","192","Client Key Exchange, Change Cipher Spec, Encrypted Handshake Message"
"13","0.146937537","31.13.71.7","192.168.1.118","TLSv1.2","647","Application Data"
"14","0.151899225","31.13.71.7","192.168.1.118","TCP","5618","[TCP segment of a reassembled PDU]"
"15","0.151977412","192.168.1.118","31.13.71.7","TCP","66","45908 → 443 [ACK] Seq=212 Ack=6134 Win=654 Len=0 TSval=1090914954 TSecr=2815951552"
"16","0.152081300","31.13.71.7","192.168.1.118","TLSv1.2","7465","Application Data, Application Data"
"17","0.152103737","192.168.1.118","31.13.71.7","TCP","66","45908 → 443 [ACK] Seq=212 Ack=13533 Win=769 Len=0 TSval=1090914954 TSecr=2815951552"
"18","0.152123700","31.13.71.7","192.168.1.118","TLSv1.2","1495","Application Data"
"19","0.152138362","192.168.1.118","31.13.71.7","TCP","66","45908 → 443 [ACK] Seq=212 Ack=14962 Win=792 Len=0 TSval=1090914954 TSecr=2815951552"
"20","0.158203000","31.13.71.7","192.168.1.118","TLSv1.2","647","Application Data"
"21","0.158277862","192.168.1.118","31.13.71.7","TCP","66","45910 → 443 [ACK] Seq=212 Ack=582 Win=589 Len=0 TSval=1090914960 TSecr=3207499253"
"22","0.162564312","31.13.71.7","192.168.1.118","TLSv1.2","13221","Application Data, Application Data"
"23","0.162630500","192.168.1.118","31.13.71.7","TCP","66","45910 → 443 [ACK] Seq=212 Ack=13737 Win=794 Len=0 TSval=1090914965 TSecr=3207499253"
"24","0.162668212","31.13.71.7","192.168.1.118","TLSv1.2","1495","Application Data"
"25","0.162683637","192.168.1.118","31.13.71.7","TCP","66","45910 → 443 [ACK] Seq=212 Ack=15166 Win=816 Len=0 TSval=1090914965 TSecr=3207499253"
"26","0.162695312","31.13.71.36","192.168.1.118","TLSv1.2","117","Change Cipher Spec, Encrypted Handshake Message"
"27","0.162718187","31.13.71.7","192.168.1.118","TLSv1.2","646","Application Data"
"28","0.162739212","192.168.1.118","31.13.71.7","TCP","66","45912 → 443 [ACK] Seq=212 Ack=581 Win=497 Len=0 TSval=1090914965 TSecr=41759020"
"29","0.162752025","31.13.71.7","192.168.1.118","TLSv1.2","1691","Application Data"
"30","0.162770200","192.168.1.118","31.13.71.7","TCP","66","45912 → 443 [ACK] Seq=212 Ack=2206 Win=485 Len=0 TSval=1090914965 TSecr=41759020"
"31","0.164742937","192.168.1.118","31.13.71.36","TLSv1.2","264","Application Data"
"32","0.167108925","31.13.71.7","192.168.1.118","TLSv1.2","1495","Application Data"
"33","0.167171150","192.168.1.118","31.13.71.7","TCP","66","45912 → 443 [ACK] Seq=212 Ack=3635 Win=474 Len=0 TSval=1090914969 TSecr=41759020"
"34","0.181129450","192.168.1.118","31.13.71.7","TLSv1.2","277","Application Data"
"35","0.200011287","31.13.71.36","192.168.1.118","TLSv1.2","535","Application Data"
"36","0.203002875","31.13.71.7","192.168.1.118","TLSv1.2","647","Application Data"
"37","0.204389962","31.13.71.7","192.168.1.118","TCP","5618","[TCP segment of a reassembled PDU]"
"38","0.204454237","192.168.1.118","31.13.71.7","TCP","66","45908 → 443 [ACK] Seq=423 Ack=21095 Win=900 Len=0 TSval=1090915006 TSecr=2815951608"
"39","0.207070300","31.13.71.7","192.168.1.118","TLSv1.2","5618","Application Data [TCP segment of a reassembled PDU]"
"40","0.207133700","192.168.1.118","31.13.71.7","TCP","66","45908 → 443 [ACK] Seq=423 Ack=26647 Win=987 Len=0 TSval=1090915009 TSecr=2815951608"
"41","0.207238737","31.13.71.7","192.168.1.118","TLSv1.2","6957","Application Data, Application Data"
"42","0.207257900","192.168.1.118","31.13.71.7","TCP","66","45908 → 443 [ACK] Seq=423 Ack=33538 Win=1094 Len=0 TSval=1090915009 TSecr=2815951608"
"43","0.207277637","31.13.71.7","192.168.1.118","TLSv1.2","1495","Application Data"
"44","0.207292212","192.168.1.118","31.13.71.7","TCP","66","45908 → 443 [ACK] Seq=423 Ack=34967 Win=1117 Len=0 TSval=1090915009 TSecr=2815951608"
"45","0.240975650","192.168.1.118","31.13.71.36","TCP","66","33358 → 443 [ACK] Seq=842 Ack=3844 Win=498 Len=0 TSval=2510210862 TSecr=788008316"
"46","0.268926375","72.21.91.29","192.168.1.118","TCP","66","80 → 38622 [ACK] Seq=1 Ack=1 Win=152 Len=0 TSval=4245614845 TSecr=3421375522"
"47","0.268989112","192.168.1.118","72.21.91.29","TCP","66","[TCP ACKed unseen segment] 38622 → 80 [ACK] Seq=1 Ack=2 Win=501 Len=0 TSval=3421436032 TSecr=4245605487"
"48","0.406091575","192.168.1.118","209.18.47.62","DNS","69","Standard query 0xbd92 A fbsbx.com"
"49","0.427013075","209.18.47.62","192.168.1.118","DNS","85","Standard query response 0xbd92 A fbsbx.com A 31.13.71.36"
"50","0.428468612","192.168.1.118","209.18.47.62","DNS","69","Standard query 0x0de7 AAAA fbsbx.com"
"51","0.443511900","209.18.47.62","192.168.1.118","DNS","97","Standard query response 0x0de7 AAAA fbsbx.com AAAA 2a03:2880:f112:83:face:b00c:0:25de"
"52","0.510868425","192.168.1.104","255.255.255.255","UDP","217","49154 → 6666 Len=175"
"53","0.595573650","192.168.1.118","31.13.71.36","TCP","74","33360 → 443 [SYN] Seq=0 Win=64240 Len=0 MSS=1460 SACK_PERM=1 TSval=2510211217 TSecr=0 WS=128"
"54","0.613042312","31.13.71.36","192.168.1.118","TCP","74","443 → 33360 [SYN, ACK] Seq=0 Ack=1 Win=27760 Len=0 MSS=1400 SACK_PERM=1 TSval=10731246 TSecr=2510211217 WS=256"
"55","0.613158862","192.168.1.118","31.13.71.36","TCP","66","33360 → 443 [ACK] Seq=1 Ack=1 Win=64256 Len=0 TSval=2510211234 TSecr=10731246"
"56","0.721369187","192.168.1.118","104.18.252.222","TLSv1.2","93","Application Data"
"57","0.721535687","192.168.1.118","104.20.185.68","TLSv1.2","93","Application Data"
"58","0.727928087","192.168.1.118","31.13.71.36","TLSv1","583","Client Hello"
"59","0.758119300","104.18.252.222","192.168.1.118","TLSv1.2","93","Application Data"
"60","0.758187950","192.168.1.118","104.18.252.222","TCP","54","34468 → 443 [ACK] Seq=40 Ack=40 Win=501 Len=0"
"61","0.763791575","31.13.71.36","192.168.1.118","TCP","66","443 → 33360 [ACK] Seq=1 Ack=518 Win=28928 Len=0 TSval=10731397 TSecr=2510211349"
"62","0.769491075","104.20.185.68","192.168.1.118","TCP","54","443 → 38564 [ACK] Seq=1 Ack=40 Win=80 Len=0"
"63","0.770535025","104.20.185.68","192.168.1.118","TLSv1.2","93","Application Data"
"64","0.770580075","192.168.1.118","104.20.185.68","TCP","54","38564 → 443 [ACK] Seq=40 Ack=40 Win=501 Len=0"
"65","0.775316487","31.13.71.36","192.168.1.118","TLSv1.2","3389","Server Hello, Certificate, Server Key Exchange, Server Hello Done"
"66","0.775382237","192.168.1.118","31.13.71.36","TCP","66","33360 → 443 [ACK] Seq=518 Ack=3324 Win=61056 Len=0 TSval=2510211396 TSecr=10731399"
"67","0.788343362","192.168.1.118","31.13.71.36","TLSv1.2","192","Client Key Exchange, Change Cipher Spec, Encrypted Handshake Message"
"68","0.806624812","31.13.71.36","192.168.1.118","TLSv1.2","117","Change Cipher Spec, Encrypted Handshake Message"
"69","0.807735187","192.168.1.118","31.13.71.36","TLSv1.2","262","Application Data"
"70","0.844634475","31.13.71.36","192.168.1.118","TLSv1.2","542","Application Data"
"71","0.846592375","192.168.1.118","209.18.47.62","DNS","80","Standard query 0xc92f A connect.facebook.net"
"72","0.859251562","209.18.47.62","192.168.1.118","DNS","128","Standard query response 0xc92f A connect.facebook.net CNAME scontent.xx.fbcdn.net A 31.13.71.7"
"73","0.859402112","192.168.1.118","209.18.47.62","DNS","80","Standard query 0x2d23 AAAA connect.facebook.net"
"74","0.874401887","209.18.47.62","192.168.1.118","DNS","140","Standard query response 0x2d23 AAAA connect.facebook.net CNAME scontent.xx.fbcdn.net AAAA 2a03:2880:f012:8:face:b00c:0:1"
"75","0.875538012","192.168.1.118","31.13.71.7","TCP","74","45924 → 443 [SYN] Seq=0 Win=64240 Len=0 MSS=1460 SACK_PERM=1 TSval=1090915678 TSecr=0 WS=128"
"76","0.884984450","192.168.1.118","31.13.71.36","TCP","66","33360 → 443 [ACK] Seq=840 Ack=3851 Win=64128 Len=0 TSval=2510211506 TSecr=10731479"
"77","0.895650662","31.13.71.7","192.168.1.118","TCP","74","443 → 45924 [SYN, ACK] Seq=0 Ack=1 Win=27760 Len=0 MSS=1400 SACK_PERM=1 TSval=2768617820 TSecr=1090915678 WS=256"
"78","0.895746762","192.168.1.118","31.13.71.7","TCP","66","45924 → 443 [ACK] Seq=1 Ack=1 Win=64256 Len=0 TSval=1090915698 TSecr=2768617820"
"79","0.918836787","192.168.1.118","31.13.71.7","TLSv1","583","Client Hello"
"80","0.944456675","31.13.71.7","192.168.1.118","TCP","66","443 → 45924 [ACK] Seq=1 Ack=518 Win=28928 Len=0 TSval=2768617866 TSecr=1090915721"
"81","0.945763125","31.13.71.7","192.168.1.118","TLSv1.2","3159","Server Hello, Certificate, Server Key Exchange, Server Hello Done"
"82","0.945822512","192.168.1.118","31.13.71.7","TCP","66","45924 → 443 [ACK] Seq=518 Ack=3094 Win=61184 Len=0 TSval=1090915748 TSecr=2768617867"
"83","0.948276162","192.168.1.118","31.13.71.7","TLSv1.2","192","Client Key Exchange, Change Cipher Spec, Encrypted Handshake Message"
"84","0.970319687","31.13.71.7","192.168.1.118","TLSv1.2","117","Change Cipher Spec, Encrypted Handshake Message"
"85","0.970776962","192.168.1.118","31.13.71.7","TLSv1.2","269","Application Data"
"86","0.991719912","31.13.71.7","192.168.1.118","TLSv1.2","1223","Application Data"
"87","0.992700562","31.13.71.7","192.168.1.118","TLSv1.2","151","Application Data"
"88","0.992857137","192.168.1.118","31.13.71.7","TCP","66","45924 → 443 [ACK] Seq=847 Ack=4387 Win=64128 Len=0 TSval=1090915795 TSecr=2768617917"
"89","1.130969012","192.168.1.118","72.21.91.29","TCP","66","[TCP Keep-Alive] [TCP ACKed unseen segment] 38622 → 80 [ACK] Seq=0 Ack=2 Win=501 Len=0 TSval=3421436894 TSecr=4245605487"
"90","1.131022712","192.168.1.118","172.217.9.227","TCP","66","38024 → 80 [ACK] Seq=1 Ack=1 Win=501 Len=0 TSval=3269549782 TSecr=3937371596"
"91","1.147434725","172.217.9.227","192.168.1.118","TCP","66","[TCP ACKed unseen segment] 80 → 38024 [ACK] Seq=1 Ack=2 Win=265 Len=0 TSval=3937381825 TSecr=3269447352"
"92","1.148154875","72.21.91.29","192.168.1.118","TCP","66","[TCP Previous segment not captured] 80 → 38622 [ACK] Seq=2 Ack=1 Win=152 Len=0 TSval=4245615723 TSecr=3421436032"
"93","1.228490100","192.168.1.118","172.217.12.138","TCP","74","55016 → 443 [SYN] Seq=0 Win=64240 Len=0 MSS=1460 SACK_PERM=1 TSval=4078960127 TSecr=0 WS=128"
"94","1.232577700","192.168.1.118","172.217.12.138","TCP","74","55018 → 443 [SYN] Seq=0 Win=64240 Len=0 MSS=1460 SACK_PERM=1 TSval=4078960139 TSecr=0 WS=128"
"95","1.247371237","172.217.12.138","192.168.1.118","TCP","74","443 → 55016 [SYN, ACK] Seq=0 Ack=1 Win=60192 Len=0 MSS=1380 SACK_PERM=1 TSval=2256048280 TSecr=4078960127 WS=256"
"96","1.247552250","192.168.1.118","172.217.12.138","TCP","66","55016 → 443 [ACK] Seq=1 Ack=1 Win=64256 Len=0 TSval=4078960154 TSecr=2256048280"
"97","1.256016087","172.217.12.138","192.168.1.118","TCP","74","443 → 55018 [SYN, ACK] Seq=0 Ack=1 Win=60192 Len=0 MSS=1380 SACK_PERM=1 TSval=1693113142 TSecr=4078960139 WS=256"
"98","1.256197362","192.168.1.118","172.217.12.138","TCP","66","55018 → 443 [ACK] Seq=1 Ack=1 Win=64256 Len=0 TSval=4078960162 TSecr=1693113142"
"99","1.265549212","192.168.1.118","172.217.12.138","TCP","74","55020 → 443 [SYN] Seq=0 Win=64240 Len=0 MSS=1460 SACK_PERM=1 TSval=4078960171 TSecr=0 WS=128"
"100","1.267494100","192.168.1.118","172.217.12.138","TLSv1","583","Client Hello"
"101","1.280882112","172.217.12.138","192.168.1.118","TCP","66","443 → 55016 [ACK] Seq=1 Ack=518 Win=61440 Len=0 TSval=2256048315 TSecr=4078960173"
"102","1.284615600","172.217.12.138","192.168.1.118","TCP","74","443 → 55020 [SYN, ACK] Seq=0 Ack=1 Win=60192 Len=0 MSS=1380 SACK_PERM=1 TSval=2256048315 TSecr=4078960171 WS=256"
"103","1.284794212","192.168.1.118","172.217.12.138","TCP","66","55020 → 443 [ACK] Seq=1 Ack=1 Win=64256 Len=0 TSval=4078960191 TSecr=2256048315"
"104","1.288527062","172.217.12.138","192.168.1.118","TLSv1.3","1484","Server Hello, Change Cipher Spec"
"105","1.288671987","192.168.1.118","172.217.12.138","TCP","66","55016 → 443 [ACK] Seq=518 Ack=1419 Win=63104 Len=0 TSval=4078960195 TSecr=2256048322"
"106","1.291585400","172.217.12.138","192.168.1.118","TLSv1.3","1556","Application Data"
"107","1.291739250","192.168.1.118","172.217.12.138","TCP","66","55016 → 443 [ACK] Seq=518 Ack=2909 Win=61696 Len=0 TSval=4078960198 TSecr=2256048322"
"108","1.424851212","192.168.1.118","172.217.12.138","TLSv1","583","Client Hello"
"109","1.425937425","192.168.1.118","172.217.12.138","TLSv1","583","Client Hello"
"110","1.446394912","172.217.12.138","192.168.1.118","TCP","66","443 → 55018 [ACK] Seq=1 Ack=518 Win=61440 Len=0 TSval=1693113332 TSecr=4078960331"
"111","1.452657787","172.217.12.138","192.168.1.118","TLSv1.3","1484","Server Hello, Change Cipher Spec"
"112","1.452807462","192.168.1.118","172.217.12.138","TCP","66","55018 → 443 [ACK] Seq=518 Ack=1419 Win=63104 Len=0 TSval=4078960359 TSecr=1693113338"
"113","1.454280137","172.217.12.138","192.168.1.118","TLSv1.3","1556","Application Data"
"114","1.454422587","192.168.1.118","172.217.12.138","TCP","66","55018 → 443 [ACK] Seq=518 Ack=2909 Win=61696 Len=0 TSval=4078960360 TSecr=1693113338"
"115","1.460623300","172.217.12.138","192.168.1.118","TCP","66","443 → 55020 [ACK] Seq=1 Ack=518 Win=61440 Len=0 TSval=2256048495 TSecr=4078960332"
"116","1.468576087","172.217.12.138","192.168.1.118","TLSv1.3","1484","Server Hello, Change Cipher Spec"
"117","1.469599662","172.217.12.138","192.168.1.118","TLSv1.3","1556","Application Data"
"118","1.469775775","192.168.1.118","172.217.12.138","TCP","66","55020 → 443 [ACK] Seq=518 Ack=1419 Win=62848 Len=0 TSval=4078960376 TSecr=2256048502"
"119","1.469834175","192.168.1.118","172.217.12.138","TCP","66","55020 → 443 [ACK] Seq=518 Ack=2909 Win=61440 Len=0 TSval=4078960376 TSecr=2256048502"
"120","1.537269787","192.168.1.118","172.217.11.10","TLSv1.2","1013","Application Data"
"121","1.559206587","172.217.11.10","192.168.1.118","TCP","66","443 → 57792 [ACK] Seq=1 Ack=948 Win=254 Len=0 TSval=529003853 TSecr=2725158863"
"122","1.579540100","172.217.11.10","192.168.1.118","TLSv1.2","776","Application Data"
"123","1.579701087","192.168.1.118","172.217.11.10","TCP","66","57792 → 443 [ACK] Seq=948 Ack=711 Win=496 Len=0 TSval=2725158906 TSecr=529003872"
"124","1.584117512","172.217.11.10","192.168.1.118","TLSv1.2","197","Application Data"
"125","1.584187837","172.217.11.10","192.168.1.118","TLSv1.2","100","Application Data"
"126","1.584303700","192.168.1.118","172.217.11.10","TCP","66","57792 → 443 [ACK] Seq=948 Ack=842 Win=495 Len=0 TSval=2725158910 TSecr=529003872"
"127","1.584344950","192.168.1.118","172.217.11.10","TCP","66","57792 → 443 [ACK] Seq=948 Ack=876 Win=495 Len=0 TSval=2725158910 TSecr=529003872"
"128","1.597230512","192.168.1.118","31.13.71.36","TLSv1.2","351","Application Data"
"129","1.616367875","31.13.71.36","192.168.1.118","TCP","66","443 → 33344 [ACK] Seq=1 Ack=286 Win=121 Len=0 TSval=1087271779 TSecr=2510212218"
"130","1.641982512","192.168.1.118","104.118.9.120","TCP","66","39706 → 443 [ACK] Seq=1 Ack=1 Win=501 Len=0 TSval=3031519042 TSecr=3094300507"
"131","1.666219300","104.118.9.120","192.168.1.118","TCP","66","[TCP ACKed unseen segment] 443 → 39706 [ACK] Seq=1 Ack=2 Win=252 Len=0 TSval=3094310757 TSecr=3031437083"
"132","1.708061975","31.13.71.36","192.168.1.118","TCP","1454","[TCP segment of a reassembled PDU]"
"133","1.708123200","192.168.1.118","31.13.71.36","TCP","66","33344 → 443 [ACK] Seq=286 Ack=1389 Win=610 Len=0 TSval=2510212329 TSecr=1087271864"
"134","1.711801625","31.13.71.36","192.168.1.118","TLSv1.2","5618","Application Data, Application Data, Application Data"
"135","1.711862950","192.168.1.118","31.13.71.36","TCP","66","33344 → 443 [ACK] Seq=286 Ack=6941 Win=696 Len=0 TSval=2510212333 TSecr=1087271864"
"136","1.711968375","31.13.71.36","192.168.1.118","TCP","5618","443 → 33344 [ACK] Seq=6941 Ack=286 Win=121 Len=5552 TSval=1087271864 TSecr=2510212218 [TCP segment of a reassembled PDU]"
"137","1.711989950","192.168.1.118","31.13.71.36","TCP","66","33344 → 443 [ACK] Seq=286 Ack=12493 Win=783 Len=0 TSval=2510212333 TSecr=1087271864"
"138","1.712012212","31.13.71.36","192.168.1.118","TLSv1.2","2842","Application Data [TCP segment of a reassembled PDU]"
"139","1.712027425","192.168.1.118","31.13.71.36","TCP","66","33344 → 443 [ACK] Seq=286 Ack=15269 Win=826 Len=0 TSval=2510212333 TSecr=1087271865"
"140","1.712049362","31.13.71.36","192.168.1.118","TLSv1.2","2842","Application Data [TCP segment of a reassembled PDU]"
"141","1.712065112","192.168.1.118","31.13.71.36","TCP","66","33344 → 443 [ACK] Seq=286 Ack=18045 Win=870 Len=0 TSval=2510212333 TSecr=1087271866"
"142","1.712086762","31.13.71.36","192.168.1.118","TLSv1.2","2842","Application Data [TCP segment of a reassembled PDU]"
"143","1.712101075","192.168.1.118","31.13.71.36","TCP","66","33344 → 443 [ACK] Seq=286 Ack=20821 Win=913 Len=0 TSval=2510212333 TSecr=1087271867"
"144","1.712119437","31.13.71.36","192.168.1.118","TCP","2842","443 → 33344 [ACK] Seq=20821 Ack=286 Win=121 Len=2776 TSval=1087271868 TSecr=2510212218 [TCP segment of a reassembled PDU]"
"145","1.712135112","192.168.1.118","31.13.71.36","TCP","66","33344 → 443 [ACK] Seq=286 Ack=23597 Win=957 Len=0 TSval=2510212333 TSecr=1087271868"
"146","1.714943762","31.13.71.36","192.168.1.118","TCP","2842","443 → 33344 [ACK] Seq=23597 Ack=286 Win=121 Len=2776 TSval=1087271869 TSecr=2510212218 [TCP segment of a reassembled PDU]"
"147","1.715011962","192.168.1.118","31.13.71.36","TCP","66","33344 → 443 [ACK] Seq=286 Ack=26373 Win=1000 Len=0 TSval=2510212336 TSecr=1087271869"
"148","1.715055212","31.13.71.36","192.168.1.118","TLSv1.2","2842","Application Data [TCP segment of a reassembled PDU]"
"149","1.715070312","192.168.1.118","31.13.71.36","TCP","66","33344 → 443 [ACK] Seq=286 Ack=29149 Win=1043 Len=0 TSval=2510212336 TSecr=1087271870"
"150","1.715123675","31.13.71.36","192.168.1.118","TCP","2842","443 → 33344 [ACK] Seq=29149 Ack=286 Win=121 Len=2776 TSval=1087271871 TSecr=2510212218 [TCP segment of a reassembled PDU]"
"151","1.715140362","192.168.1.118","31.13.71.36","TCP","66","33344 → 443 [ACK] Seq=286 Ack=31925 Win=1087 Len=0 TSval=2510212336 TSecr=1087271871"
"152","1.715167575","31.13.71.36","192.168.1.118","TLSv1.2","2842","Application Data [TCP segment of a reassembled PDU]"
"153","1.715183900","192.168.1.118","31.13.71.36","TCP","66","33344 → 443 [ACK] Seq=286 Ack=34701 Win=1130 Len=0 TSval=2510212336 TSecr=1087271872"
"154","1.715194737","31.13.71.36","192.168.1.118","TLSv1.2","1454","Application Data [TCP segment of a reassembled PDU]"
"155","1.715209762","192.168.1.118","31.13.71.36","TCP","66","33344 → 443 [ACK] Seq=286 Ack=36089 Win=1143 Len=0 TSval=2510212336 TSecr=1087271873"
"156","1.719597312","31.13.71.36","192.168.1.118","TCP","1454","443 → 33344 [ACK] Seq=36089 Ack=286 Win=121 Len=1388 TSval=1087271873 TSecr=2510212218 [TCP segment of a reassembled PDU]"
"157","1.719655937","192.168.1.118","31.13.71.36","TCP","66","33344 → 443 [ACK] Seq=286 Ack=37477 Win=1133 Len=0 TSval=2510212341 TSecr=1087271873"
"158","1.719693375","31.13.71.36","192.168.1.118","TCP","1454","443 → 33344 [ACK] Seq=37477 Ack=286 Win=121 Len=1388 TSval=1087271874 TSecr=2510212218 [TCP segment of a reassembled PDU]"
"159","1.719713312","192.168.1.118","31.13.71.36","TCP","66","33344 → 443 [ACK] Seq=286 Ack=38865 Win=1123 Len=0 TSval=2510212341 TSecr=1087271874"
"160","1.721621525","31.13.71.36","192.168.1.118","TCP","2842","443 → 33344 [ACK] Seq=38865 Ack=286 Win=121 Len=2776 TSval=1087271874 TSecr=2510212218 [TCP segment of a reassembled PDU]"
"161","1.721686675","192.168.1.118","31.13.71.36","TCP","66","33344 → 443 [ACK] Seq=286 Ack=41641 Win=1102 Len=0 TSval=2510212343 TSecr=1087271874"
"162","1.722116187","192.168.1.118","34.95.69.49","TLSv1.2","105","Application Data"
"163","1.722190787","192.168.1.118","204.79.197.200","TLSv1.2","100","Application Data"
"164","1.730597600","31.13.71.36","192.168.1.118","TLSv1.2","2842","Application Data [TCP segment of a reassembled PDU]"
"165","1.730659400","192.168.1.118","31.13.71.36","TCP","66","33344 → 443 [ACK] Seq=286 Ack=44417 Win=1186 Len=0 TSval=2510212352 TSecr=1087271874"
"166","1.738216350","31.13.71.36","192.168.1.118","TCP","1454","443 → 33344 [ACK] Seq=44417 Ack=286 Win=121 Len=1388 TSval=1087271874 TSecr=2510212218 [TCP segment of a reassembled PDU]"
"167","1.738278750","192.168.1.118","31.13.71.36","TCP","66","33344 → 443 [ACK] Seq=286 Ack=45805 Win=1208 Len=0 TSval=2510212359 TSecr=1087271874"
"168","1.738316175","31.13.71.36","192.168.1.118","TCP","1454","443 → 33344 [ACK] Seq=45805 Ack=286 Win=121 Len=1388 TSval=1087271875 TSecr=2510212218 [TCP segment of a reassembled PDU]"
"169","1.738331750","192.168.1.118","31.13.71.36","TCP","66","33344 → 443 [ACK] Seq=286 Ack=47193 Win=1230 Len=0 TSval=2510212359 TSecr=1087271875"
"170","1.739775800","31.13.71.36","192.168.1.118","TLSv1.2","827","Application Data, Application Data"
"171","1.739811450","192.168.1.118","31.13.71.36","TCP","66","33344 → 443 [ACK] Seq=286 Ack=47954 Win=1251 Len=0 TSval=2510212361 TSecr=1087271875"
"172","1.743900525","34.95.69.49","192.168.1.118","TLSv1.2","105","Application Data"
"173","1.743972562","192.168.1.118","34.95.69.49","TCP","66","41816 → 443 [ACK] Seq=40 Ack=40 Win=501 Len=0 TSval=3971086089 TSecr=3234304708"
"174","1.745236112","204.79.197.200","192.168.1.118","TCP","54","443 → 39688 [ACK] Seq=1 Ack=47 Win=1025 Len=0"
"175","1.745276300","204.79.197.200","192.168.1.118","TLSv1.2","100","Application Data"
"176","1.745301662","192.168.1.118","204.79.197.200","TCP","54","39688 → 443 [ACK] Seq=47 Ack=47 Win=501 Len=0"
"177","1.752755187","192.168.1.118","31.13.71.36","TLSv1.2","390","Application Data"
"178","1.783932075","31.13.71.36","192.168.1.118","TLSv1.2","671","Application Data"
"179","1.784005800","192.168.1.118","31.13.71.36","TCP","66","33356 → 443 [ACK] Seq=325 Ack=606 Win=497 Len=0 TSval=2510212405 TSecr=3881597259"
"180","1.787906475","192.168.1.118","31.13.71.36","TLSv1.2","279","Application Data"
"181","1.846169812","fe80::1cc7:6d9a:a312:7e8f","ff02::fb","MDNS","553","Standard query 0x0000 PTR _googlecast._tcp.local, "QM" question PTR _homekit._tcp.local, "QM" question PTR _uscan._tcp.local, "QM" question PTR _ptp._tcp.local, "QM" question PTR _ippusb._tcp.local, "QM" question PTR _scanner._tcp.local, "QM" question PTR _ipp._tcp.local, "QM" question PTR _pdl-datastream._tcp.local, "QM" question PTR _uscans._tcp.local, "QM" question PTR _ipps._tcp.local, "QM" question PTR _printer._tcp.local, "QM" question PTR _airplay._tcp.local, "QM" question PTR _raop._tcp.local, "QM" question PTR _airport._tcp.local, "QM" question PTR _rdlink._tcp.local, "QM" question PTR _companion-link._tcp.local, "QM" question PTR _afpovertcp._tcp.local, "QM" question PTR _rfb._tcp.local, "QM" question PTR _adisk._tcp.local, "QM" question PTR _apple-mobdev._tcp.local, "QM" question PTR 8ed307c3._sub._apple-mobdev2._tcp.local, "QM" question PTR _apple-pairable._tcp.local, "QM" question TXT Google-Home-Mini-2c3f16b2da5c4b6fd6cfbfba61c12490._googlecast._tcp.local, "QM" question PTR Google-Home-Mini-2c3f16b2da5c4b6fd6cfbfba61c12490._googlecast._tcp.local PTR cjqg._companion-link._tcp.local OPT"
"182","1.851324612","192.168.1.100","224.0.0.251","MDNS","533","Standard query 0x0000 PTR _googlecast._tcp.local, "QM" question PTR _homekit._tcp.local, "QM" question PTR _uscan._tcp.local, "QM" question PTR _ptp._tcp.local, "QM" question PTR _ippusb._tcp.local, "QM" question PTR _scanner._tcp.local, "QM" question PTR _ipp._tcp.local, "QM" question PTR _pdl-datastream._tcp.local, "QM" question PTR _uscans._tcp.local, "QM" question PTR _ipps._tcp.local, "QM" question PTR _printer._tcp.local, "QM" question PTR _airplay._tcp.local, "QM" question PTR _raop._tcp.local, "QM" question PTR _airport._tcp.local, "QM" question PTR _rdlink._tcp.local, "QM" question PTR _companion-link._tcp.local, "QM" question PTR _afpovertcp._tcp.local, "QM" question PTR _rfb._tcp.local, "QM" question PTR _adisk._tcp.local, "QM" question PTR _apple-mobdev._tcp.local, "QM" question PTR 8ed307c3._sub._apple-mobdev2._tcp.local, "QM" question PTR _apple-pairable._tcp.local, "QM" question TXT Google-Home-Mini-2c3f16b2da5c4b6fd6cfbfba61c12490._googlecast._tcp.local, "QM" question PTR Google-Home-Mini-2c3f16b2da5c4b6fd6cfbfba61c12490._googlecast._tcp.local PTR cjqg._companion-link._tcp.local OPT"
"183","1.852113275","31.13.71.36","192.168.1.118","TLSv1.2","535","Application Data"
"184","1.852172100","192.168.1.118","31.13.71.36","TCP","66","33358 → 443 [ACK] Seq=1055 Ack=4313 Win=498 Len=0 TSval=2510212473 TSecr=788009956"
"185","1.857509512","192.168.1.118","31.13.71.36","TLSv1.2","277","Application Data"
"186","1.897399050","31.13.71.36","192.168.1.118","TLSv1.2","542","Application Data"
"187","1.897470162","192.168.1.118","31.13.71.36","TCP","66","33360 → 443 [ACK] Seq=1051 Ack=4327 Win=63744 Len=0 TSval=2510212519 TSecr=10732525"
"188","1.943634075","192.168.1.102","224.0.0.251","MDNS","183","Standard query response 0x0000 SRV, cache flush 0 0 8009 2c3f16b2-da5c-4b6f-d6cf-bfba61c12490.local"
"189","2.066315100","192.168.1.118","31.13.71.7","TLSv1.2","334","Application Data"
"190","2.088180862","31.13.71.7","192.168.1.118","TLSv1.2","1223","Application Data"
"191","2.089099700","31.13.71.7","192.168.1.118","TLSv1.2","151","Application Data"
"192","2.095143150","192.168.1.118","31.13.71.7","TCP","66","45924 → 443 [ACK] Seq=1115 Ack=5629 Win=64128 Len=0 TSval=1090916897 TSecr=2768619013"
"193","2.122992900","192.168.1.118","172.217.12.206","TCP","1434","[TCP segment of a reassembled PDU]"
"194","2.123034275","192.168.1.118","172.217.12.206","TCP","1434","48714 → 443 [ACK] Seq=1369 Ack=1 Win=501 Len=1368 TSval=316842835 TSecr=232044765 [TCP segment of a reassembled PDU]"
"195","2.123085125","192.168.1.118","172.217.12.206","TCP","1434","48714 → 443 [ACK] Seq=2737 Ack=1 Win=501 Len=1368 TSval=316842835 TSecr=232044765 [TCP segment of a reassembled PDU]"
"196","2.123094100","192.168.1.118","172.217.12.206","TLSv1.2","281","Application Data"
"197","2.154642375","172.217.12.206","192.168.1.118","TCP","66","443 → 48714 [ACK] Seq=1 Ack=1369 Win=329 Len=0 TSval=232055932 TSecr=316842835"
"198","2.161955112","172.217.12.206","192.168.1.118","TCP","66","443 → 48714 [ACK] Seq=1 Ack=2737 Win=340 Len=0 TSval=232055939 TSecr=316842835"
"199","2.163055350","172.217.12.206","192.168.1.118","TCP","78","[TCP Window Update] 443 → 48714 [ACK] Seq=1 Ack=2737 Win=351 Len=0 TSval=232055939 TSecr=316842835 SLE=4105 SRE=4320"
"200","2.163108375","172.217.12.206","192.168.1.118","TCP","66","443 → 48714 [ACK] Seq=1 Ack=4320 Win=362 Len=0 TSval=232055940 TSecr=316842835"
"201","2.204546062","192.168.1.118","172.217.12.138","TLSv1.3","130","Change Cipher Spec, Application Data"
"202","2.222363562","172.217.12.206","192.168.1.118","TCP","1484","[TCP segment of a reassembled PDU]"
"203","2.222521912","192.168.1.118","172.217.12.206","TCP","66","48714 → 443 [ACK] Seq=4320 Ack=1419 Win=493 Len=0 TSval=316842935 TSecr=232055999"
"204","2.224125612","172.217.12.206","192.168.1.118","TLSv1.2","158","Application Data"
"205","2.224193750","172.217.12.138","192.168.1.118","TLSv1.3","646","Application Data, Application Data"
"206","2.224213025","172.217.12.206","192.168.1.118","TLSv1.2","445","Application Data"
"207","2.224364837","192.168.1.118","172.217.12.206","TCP","66","48714 → 443 [ACK] Seq=4320 Ack=1511 Win=493 Len=0 TSval=316842936 TSecr=232055999"
"208","2.224406337","192.168.1.118","172.217.12.138","TCP","66","55020 → 443 [ACK] Seq=582 Ack=3489 Win=63616 Len=0 TSval=4078961130 TSecr=2256049256"
"209","2.224425987","192.168.1.118","172.217.12.206","TCP","66","48714 → 443 [ACK] Seq=4320 Ack=1890 Win=491 Len=0 TSval=316842936 TSecr=232056001"
"210","2.225649512","172.217.12.206","192.168.1.118","TLSv1.2","100","Application Data"
"211","2.225777912","192.168.1.118","172.217.12.206","TCP","66","48714 → 443 [ACK] Seq=4320 Ack=1924 Win=491 Len=0 TSval=316842938 TSecr=232056001"
"212","2.665976512","192.168.1.118","172.253.122.188","TCP","66","35924 → 5228 [ACK] Seq=1 Ack=1 Win=501 Len=0 TSval=3029753574 TSecr=1324374913"
"213","2.668665050","192.168.1.118","104.18.212.105","TLSv1.2","93","Application Data"
"214","2.669566025","192.168.1.118","104.18.212.105","TLSv1.2","78","Application Data"
"215","2.669624512","192.168.1.118","104.18.212.105","TCP","54","38834 → 443 [FIN, ACK] Seq=64 Ack=1 Win=501 Len=0"
"216","2.684613250","192.168.1.118","192.168.1.102","TCP","176","40918 → 8009 [PSH, ACK] Seq=1 Ack=1 Win=501 Len=110 TSval=2814607420 TSecr=4491525 [TCP segment of a reassembled PDU]"
"217","2.696235912","172.253.122.188","192.168.1.118","TCP","66","[TCP ACKed unseen segment] 5228 → 35924 [ACK] Seq=1 Ack=2 Win=253 Len=0 TSval=1324419960 TSecr=3029572936"
"218","2.701319700","192.168.1.102","192.168.1.118","TCP","176","8009 → 40918 [PSH, ACK] Seq=1 Ack=111 Win=277 Len=110 TSval=4492026 TSecr=2814607420 [TCP segment of a reassembled PDU]"
"219","2.701394325","192.168.1.118","192.168.1.102","TCP","66","40918 → 8009 [ACK] Seq=111 Ack=111 Win=501 Len=0 TSval=2814607436 TSecr=4492026"
"220","2.701434850","104.18.212.105","192.168.1.118","TCP","54","443 → 38834 [ACK] Seq=1 Ack=65 Win=71 Len=0"
"221","2.701476387","104.18.212.105","192.168.1.118","TCP","54","443 → 38834 [FIN, ACK] Seq=1 Ack=65 Win=71 Len=0"
"222","2.701513912","192.168.1.118","104.18.212.105","TCP","54","38834 → 443 [ACK] Seq=65 Ack=2 Win=501 Len=0"
"223","2.722691525","192.168.1.118","199.232.36.193","TLSv1.2","112","Application Data"
"224","2.740352075","199.232.36.193","192.168.1.118","TLSv1.2","112","Application Data"
"225","2.781971787","192.168.1.118","199.232.36.193","TCP","66","34994 → 443 [ACK] Seq=47 Ack=47 Win=899 Len=0 TSval=4214347878 TSecr=293449285"
"226","2.852475087","192.168.1.118","172.217.12.138","TLSv1.3","130","Change Cipher Spec, Application Data"
"227","2.872624050","172.217.12.138","192.168.1.118","TLSv1.3","646","Application Data, Application Data"
"228","2.872782800","192.168.1.118","172.217.12.138","TCP","66","55016 → 443 [ACK] Seq=582 Ack=3489 Win=63616 Len=0 TSval=4078961779 TSecr=2256049907"
"229","3.061605425","192.168.1.118","209.18.47.62","DNS","87","Standard query 0x92ab A playatoms-pa.googleapis.com"
"230","3.088258800","209.18.47.62","192.168.1.118","DNS","103","Standard query response 0x92ab A playatoms-pa.googleapis.com A 172.217.12.138"
"231","3.214122612","192.168.1.118","142.250.31.188","TLSv1.2","99","Application Data"
"232","3.233856625","142.250.31.188","192.168.1.118","TCP","66","5228 → 40324 [ACK] Seq=1 Ack=34 Win=248 Len=0 TSval=3628083767 TSecr=2549835635"
"233","3.249594237","142.250.31.188","192.168.1.118","TLSv1.2","99","Application Data"
"234","3.249907162","192.168.1.118","142.250.31.188","TLSv1.2","109","Application Data"
"235","3.259221637","192.168.1.118","172.217.12.138","TLSv1.3","130","Change Cipher Spec, Application Data"
"236","3.275187062","192.168.1.118","172.217.12.138","TCP","74","55022 → 443 [SYN] Seq=0 Win=64240 Len=0 MSS=1460 SACK_PERM=1 TSval=4078962181 TSecr=0 WS=128"
"237","3.279985087","172.217.12.138","192.168.1.118","TLSv1.3","646","Application Data, Application Data"
"238","3.280717537","142.250.31.188","192.168.1.118","TCP","66","5228 → 40324 [ACK] Seq=34 Ack=77 Win=248 Len=0 TSval=3628083811 TSecr=2549835671"
"239","3.292066175","172.217.12.138","192.168.1.118","TCP","74","443 → 55022 [SYN, ACK] Seq=0 Ack=1 Win=60192 Len=0 MSS=1380 SACK_PERM=1 TSval=426959678 TSecr=4078962181 WS=256"
"240","3.292241675","192.168.1.118","172.217.12.138","TCP","66","55022 → 443 [ACK] Seq=1 Ack=1 Win=64256 Len=0 TSval=4078962198 TSecr=426959678"
"241","3.438218037","192.168.1.118","172.217.12.138","TCP","66","55018 → 443 [ACK] Seq=582 Ack=3489 Win=63616 Len=0 TSval=4078962344 TSecr=1693115163"
"242","3.479126337","192.168.1.104","255.255.255.255","UDP","217","49154 → 6666 Len=175"
"243","3.614865287","192.168.1.118","172.217.12.138","TLSv1","261","Client Hello"
"244","3.643651625","172.217.12.138","192.168.1.118","TCP","66","443 → 55022 [ACK] Seq=1 Ack=196 Win=61440 Len=0 TSval=426960029 TSecr=4078962521"
"245","3.650178625","172.217.12.138","192.168.1.118","TLSv1.2","1484","Server Hello"
"246","3.650327687","192.168.1.118","172.217.12.138","TCP","66","55022 → 443 [ACK] Seq=196 Ack=1419 Win=63104 Len=0 TSval=4078962556 TSecr=426960035"
"247","3.653714950","172.217.12.138","192.168.1.118","TLSv1.2","1477","Certificate, Server Key Exchange, Server Hello Done"
"248","3.653869850","192.168.1.118","172.217.12.138","TCP","66","55022 → 443 [ACK] Seq=196 Ack=2830 Win=61696 Len=0 TSval=4078962560 TSecr=426960035"
"249","3.656862150","192.168.1.118","172.217.12.138","TCP","66","55016 → 443 [FIN, ACK] Seq=582 Ack=3489 Win=64128 Len=0 TSval=4078962563 TSecr=2256049907"
"250","3.657273937","192.168.1.118","172.217.12.138","TCP","66","55018 → 443 [FIN, ACK] Seq=582 Ack=3489 Win=64128 Len=0 TSval=4078962563 TSecr=1693115163"
"251","3.657408087","192.168.1.118","172.217.12.138","TLSv1.3","158","Application Data"
"252","3.657953200","192.168.1.118","172.217.12.138","TLSv1.3","97","Application Data"
"253","3.681630712","172.217.12.138","192.168.1.118","TCP","66","443 → 55016 [FIN, ACK] Seq=3489 Ack=583 Win=61440 Len=0 TSval=2256050716 TSecr=4078962563"
"254","3.681817187","192.168.1.118","172.217.12.138","TCP","66","55016 → 443 [ACK] Seq=583 Ack=3490 Win=64128 Len=0 TSval=4078962588 TSecr=2256050716"
"255","3.683567212","172.217.12.138","192.168.1.118","TCP","66","443 → 55018 [FIN, ACK] Seq=3489 Ack=583 Win=61440 Len=0 TSval=1693115567 TSecr=4078962563"
"256","3.683744812","192.168.1.118","172.217.12.138","TCP","66","55018 → 443 [ACK] Seq=583 Ack=3490 Win=64128 Len=0 TSval=4078962590 TSecr=1693115567"
"257","3.685701125","172.217.12.138","192.168.1.118","TCP","66","443 → 55020 [ACK] Seq=3489 Ack=705 Win=61440 Len=0 TSval=2256050717 TSecr=4078962563"
"258","3.685768700","172.217.12.138","192.168.1.118","TLSv1.3","97","Application Data"
"259","3.723283900","192.168.1.118","172.217.10.136","TLSv1.2","105","Application Data"
"260","3.745605450","172.217.10.136","192.168.1.118","TLSv1.2","105","Application Data"
"261","3.745672887","192.168.1.118","172.217.10.136","TCP","66","38430 → 443 [ACK] Seq=40 Ack=40 Win=4147 Len=0 TSval=33637634 TSecr=1832472589"
"262","3.866234887","192.168.1.118","172.217.12.138","TCP","66","55020 → 443 [ACK] Seq=705 Ack=3520 Win=64128 Len=0 TSval=4078962772 TSecr=2256050717"
"263","3.871227800","192.168.1.118","172.217.12.138","TLSv1.3","618","Application Data"
"264","3.871394662","192.168.1.118","172.217.12.138","TLSv1.3","507","Application Data"
"265","3.871512387","192.168.1.118","172.217.12.138","TLSv1.3","510","Application Data"
"266","3.894223175","172.217.12.138","192.168.1.118","TCP","66","443 → 55020 [ACK] Seq=3520 Ack=1698 Win=63488 Len=0 TSval=2256050928 TSecr=4078962777"
"267","3.898502100","172.217.12.138","192.168.1.118","TCP","66","443 → 55020 [ACK] Seq=3520 Ack=2142 Win=64768 Len=0 TSval=2256050933 TSecr=4078962778"
"268","3.912457237","172.217.12.138","192.168.1.118","TLSv1.3","1418","Application Data"
"269","3.913400262","172.217.12.138","192.168.1.118","TLSv1.3","97","Application Data"
"270","3.913444200","172.217.12.138","192.168.1.118","TLSv1.3","105","Application Data"
"271","3.914278000","172.217.12.138","192.168.1.118","TLSv1.3","97","Application Data"
"272","3.914311725","172.217.12.138","192.168.1.118","TLSv1.3","585","Application Data"
"273","3.917425575","172.217.12.138","192.168.1.118","TLSv1.3","97","Application Data"
"274","3.953036600","192.168.1.118","172.217.12.138","TCP","66","55020 → 443 [ACK] Seq=2142 Ack=5523 Win=62208 Len=0 TSval=4078962859 TSecr=2256050947"
"275","4.411334387","192.168.1.118","172.217.12.206","TCP","1434","[TCP segment of a reassembled PDU]"
"276","4.411371287","192.168.1.118","172.217.12.206","TCP","1434","48714 → 443 [ACK] Seq=5688 Ack=1924 Win=501 Len=1368 TSval=316845123 TSecr=232056001 [TCP segment of a reassembled PDU]"
"277","4.411408712","192.168.1.118","172.217.12.206","TLSv1.2","1202","Application Data"
"278","4.425243937","172.217.12.206","192.168.1.118","TCP","66","443 → 48714 [ACK] Seq=1924 Ack=5688 Win=372 Len=0 TSval=232058202 TSecr=316845123"
"279","4.433354250","172.217.12.206","192.168.1.118","TCP","66","443 → 48714 [ACK] Seq=1924 Ack=7056 Win=383 Len=0 TSval=232058210 TSecr=316845123"
"280","4.434190462","172.217.12.206","192.168.1.118","TCP","66","443 → 48714 [ACK] Seq=1924 Ack=8192 Win=394 Len=0 TSval=232058211 TSecr=316845123"
"281","4.446574225","192.168.1.118","172.217.12.138","TLSv1.3","105","Application Data"
"282","4.451569725","192.168.1.118","209.18.47.62","DNS","85","Standard query 0xd376 A r6---sn-ab5szn7z.gvt1.com"
"283","4.456383075","192.168.1.118","209.18.47.62","DNS","85","Standard query 0xde39 A r3---sn-ab5l6n6e.gvt1.com"
"284","4.465282587","192.168.1.118","209.18.47.62","DNS","85","Standard query 0x9465 A r4---sn-ab5l6nsk.gvt1.com"
"285","4.467815050","172.217.12.138","192.168.1.118","TCP","66","443 → 55020 [ACK] Seq=5523 Ack=2181 Win=64768 Len=0 TSval=2256051500 TSecr=4078963353"
"286","4.476466987","172.217.12.206","192.168.1.118","TCP","1484","[TCP segment of a reassembled PDU]"
"287","4.476621125","192.168.1.118","172.217.12.206","TCP","66","48714 → 443 [ACK] Seq=8192 Ack=3342 Win=493 Len=0 TSval=316845189 TSecr=232058251"
"288","4.478993325","172.217.12.206","192.168.1.118","TLSv1.2","159","Application Data"
"289","4.479070137","172.217.12.206","192.168.1.118","TLSv1.2","1622","Application Data, Application Data"
"290","4.479194962","192.168.1.118","172.217.12.206","TCP","66","48714 → 443 [ACK] Seq=8192 Ack=3435 Win=501 Len=0 TSval=316845191 TSecr=232058251"
"291","4.479236712","192.168.1.118","172.217.12.206","TCP","66","48714 → 443 [ACK] Seq=8192 Ack=4991 Win=489 Len=0 TSval=316845191 TSecr=232058252"
"292","4.479834525","172.217.12.206","192.168.1.118","TLSv1.2","1165","Application Data, Application Data"
"293","4.479864912","209.18.47.62","192.168.1.118","DNS","130","Standard query response 0xd376 A r6---sn-ab5szn7z.gvt1.com CNAME r6.sn-ab5szn7z.gvt1.com A 173.194.31.76"
"294","4.479985825","192.168.1.118","172.217.12.206","TCP","66","48714 → 443 [ACK] Seq=8192 Ack=6090 Win=481 Len=0 TSval=316845192 TSecr=232058255"
"295","4.485537950","209.18.47.62","192.168.1.118","DNS","130","Standard query response 0xde39 A r3---sn-ab5l6n6e.gvt1.com CNAME r3.sn-ab5l6n6e.gvt1.com A 173.194.131.57"
"296","4.486614737","209.18.47.62","192.168.1.118","DNS","130","Standard query response 0x9465 A r4---sn-ab5l6nsk.gvt1.com CNAME r4.sn-ab5l6nsk.gvt1.com A 173.194.31.170"
"297","4.579389487","192.168.1.118","172.217.12.206","TCP","1434","[TCP segment of a reassembled PDU]"
"298","4.579428287","192.168.1.118","172.217.12.206","TCP","1434","48712 → 443 [ACK] Seq=1369 Ack=1 Win=501 Len=1368 TSval=316845291 TSecr=506160876 [TCP segment of a reassembled PDU]"
"299","4.579466850","192.168.1.118","172.217.12.206","TLSv1.2","345","Application Data"
