frame.number,_ws.col.Time,_ws.col.Source,_ws.col.Destination,_ws.col.Protocol,frame.len,_ws.col.Info
"1","0.000000000","192.168.1.118","199.232.37.140","TCP","74","40392 → 443 [SYN] Seq=0 Win=29200 Len=0 MSS=1460 SACK_PERM=1 TSval=16850740 TSecr=0 WS=128"
"2","0.014235836","199.232.37.140","192.168.1.118","TCP","74","443 → 40392 [SYN, ACK] Seq=0 Ack=1 Win=27040 Len=0 MSS=1364 SACK_PERM=1 TSval=250251561 TSecr=16850740 WS=512"
"3","0.014349227","192.168.1.118","199.232.37.140","TCP","66","40392 → 443 [ACK] Seq=1 Ack=1 Win=29312 Len=0 TSval=16850754 TSecr=250251561"
"4","0.029285025","192.168.1.104","255.255.255.255","UDP","217","49154 → 6666 Len=175"
"5","0.053321654","192.168.1.118","199.232.37.140","TLSv1","583","Client Hello"
"6","0.072339194","199.232.37.140","192.168.1.118","TCP","66","443 → 40392 [ACK] Seq=1 Ack=518 Win=28160 Len=0 TSval=250251575 TSecr=16850793"
"7","0.073685829","199.232.37.140","192.168.1.118","TLSv1.2","3304","Server Hello, Certificate, Server Key Exchange, Server Hello Done"
"8","0.073767694","192.168.1.118","199.232.37.140","TCP","66","40392 → 443 [ACK] Seq=518 Ack=3239 Win=35712 Len=0 TSval=16850814 TSecr=250251576"
"9","0.076767662","192.168.1.118","199.232.37.140","TLSv1.2","192","Client Key Exchange, Change Cipher Spec, Encrypted Handshake Message"
"10","0.105774789","199.232.37.140","192.168.1.118","TLSv1.2","117","Change Cipher Spec, Encrypted Handshake Message"
"11","0.113217025","192.168.1.118","199.232.37.140","TLSv1.2","256","Application Data"
"12","0.131710597","199.232.37.140","192.168.1.118","TLSv1.2","1418","Application Data"
"13","0.137853037","199.232.37.140","192.168.1.118","TLSv1.2","8178","Application Data, Application Data, Application Data, Application Data, Application Data, Application Data"
"14","0.137940103","192.168.1.118","199.232.37.140","TCP","66","40392 → 443 [ACK] Seq=834 Ack=12754 Win=54656 Len=0 TSval=16850878 TSecr=250251591"
"15","0.137979142","199.232.37.140","192.168.1.118","TLSv1.2","120","Application Data"
"16","0.139205597","192.168.1.118","199.232.37.140","TCP","66","40381 → 443 [ACK] Seq=1 Ack=1 Win=511 Len=0 TSval=16850879 TSecr=250988808"
"17","0.177521701","192.168.1.118","199.232.37.140","TCP","66","40392 → 443 [ACK] Seq=834 Ack=12808 Win=54656 Len=0 TSval=16850918 TSecr=250251591"
"18","0.192351520","192.168.1.118","199.232.37.140","TLSv1.2","272","Application Data"
"19","0.192584278","192.168.1.118","209.18.47.62","DNS","82","Standard query 0xfe00 A styles.redditmedia.com"
"20","0.192637542","192.168.1.118","199.232.37.140","TCP","74","40393 → 443 [SYN] Seq=0 Win=29200 Len=0 MSS=1460 SACK_PERM=1 TSval=16850933 TSecr=0 WS=128"
"21","0.192761459","192.168.1.118","199.232.37.140","TCP","74","40394 → 443 [SYN] Seq=0 Win=29200 Len=0 MSS=1460 SACK_PERM=1 TSval=16850933 TSecr=0 WS=128"
"22","0.193173011","192.168.1.118","209.18.47.62","DNS","84","Standard query 0x86f0 A b.thumbs.redditmedia.com"
"23","0.193406581","192.168.1.118","209.18.47.62","DNS","75","Standard query 0xbae1 A preview.redd.it"
"24","0.193602838","192.168.1.118","209.18.47.62","DNS","75","Standard query 0x2ecd A preview.redd.it"
"25","0.193781070","192.168.1.118","209.18.47.62","DNS","75","Standard query 0x2621 A preview.redd.it"
"26","0.209727740","199.232.37.140","192.168.1.118","TLSv1.2","1418","Application Data"
"27","0.209820631","192.168.1.118","199.232.37.140","TCP","66","40392 → 443 [ACK] Seq=1040 Ack=14160 Win=57344 Len=0 TSval=16850950 TSecr=250251610"
"28","0.212295655","199.232.37.140","192.168.1.118","TLSv1.2","1585","Application Data, Application Data"
"29","0.212370545","192.168.1.118","199.232.37.140","TCP","66","40392 → 443 [ACK] Seq=1040 Ack=15679 Win=60416 Len=0 TSval=16850952 TSecr=250251610"
"30","0.215967196","192.168.1.118","209.18.47.62","DNS","75","Standard query 0x9ab3 A preview.redd.it"
"31","0.217266729","209.18.47.62","192.168.1.118","DNS","133","Standard query response 0xfe00 A styles.redditmedia.com CNAME reddit.map.fastly.net A 199.232.37.140"
"32","0.217422585","192.168.1.118","209.18.47.62","DNS","82","Standard query 0x46ef AAAA styles.redditmedia.com"
"33","0.218800245","209.18.47.62","192.168.1.118","DNS","126","Standard query response 0x2ecd A preview.redd.it CNAME reddit.map.fastly.net A 199.232.37.140"
"34","0.218864335","209.18.47.62","192.168.1.118","DNS","126","Standard query response 0x2621 A preview.redd.it CNAME reddit.map.fastly.net A 199.232.37.140"
"35","0.218884748","209.18.47.62","192.168.1.118","DNS","135","Standard query response 0x86f0 A b.thumbs.redditmedia.com CNAME reddit.map.fastly.net A 199.232.37.140"
"36","0.218904786","209.18.47.62","192.168.1.118","DNS","126","Standard query response 0xbae1 A preview.redd.it CNAME reddit.map.fastly.net A 199.232.37.140"
"37","0.218926812","199.232.37.140","192.168.1.118","TCP","74","443 → 40393 [SYN, ACK] Seq=0 Ack=1 Win=27040 Len=0 MSS=1364 SACK_PERM=1 TSval=2788821564 TSecr=16850933 WS=512"
"38","0.218986652","192.168.1.118","199.232.37.140","TCP","66","40393 → 443 [ACK] Seq=1 Ack=1 Win=29312 Len=0 TSval=16850959 TSecr=2788821564"
"39","0.219028291","199.232.37.140","192.168.1.118","TCP","74","443 → 40394 [SYN, ACK] Seq=0 Ack=1 Win=27040 Len=0 MSS=1364 SACK_PERM=1 TSval=247329943 TSecr=16850933 WS=512"
"40","0.219053079","192.168.1.118","199.232.37.140","TCP","66","40394 → 443 [ACK] Seq=1 Ack=1 Win=29312 Len=0 TSval=16850959 TSecr=247329943"
"41","0.219910884","192.168.1.118","209.18.47.62","DNS","75","Standard query 0x8297 A preview.redd.it"
"42","0.220182931","192.168.1.118","209.18.47.62","DNS","75","Standard query 0x3ea4 AAAA preview.redd.it"
"43","0.220260584","192.168.1.118","209.18.47.62","DNS","84","Standard query 0x8ac2 AAAA b.thumbs.redditmedia.com"
"44","0.220306048","192.168.1.118","209.18.47.62","DNS","75","Standard query 0xe679 AAAA preview.redd.it"
"45","0.220340412","192.168.1.118","209.18.47.62","DNS","75","Standard query 0xae21 AAAA preview.redd.it"
"46","0.220596383","192.168.1.118","209.18.47.62","DNS","84","Standard query 0x9694 A b.thumbs.redditmedia.com"
"47","0.220725175","192.168.1.118","209.18.47.62","DNS","84","Standard query 0x3eed A external-preview.redd.it"
"48","0.222973729","192.168.1.118","209.18.47.62","DNS","82","Standard query 0x4edf A styles.redditmedia.com"
"49","0.224129519","192.168.1.118","209.18.47.62","DNS","84","Standard query 0x86d0 A b.thumbs.redditmedia.com"
"50","0.240321148","209.18.47.62","192.168.1.118","DNS","175","Standard query response 0x46ef AAAA styles.redditmedia.com CNAME reddit.map.fastly.net SOA ns1.fastly.net"
"51","0.242170726","209.18.47.62","192.168.1.118","DNS","126","Standard query response 0x9ab3 A preview.redd.it CNAME reddit.map.fastly.net A 199.232.37.140"
"52","0.245177943","209.18.47.62","192.168.1.118","DNS","171","Standard query response 0xae21 AAAA preview.redd.it CNAME reddit.map.fastly.net SOA ns1.fastly.net"
"53","0.245677848","192.168.1.118","209.18.47.62","DNS","75","Standard query 0xa654 AAAA preview.redd.it"
"54","0.246302183","209.18.47.62","192.168.1.118","DNS","135","Standard query response 0x9694 A b.thumbs.redditmedia.com CNAME reddit.map.fastly.net A 199.232.37.140"
"55","0.246368698","209.18.47.62","192.168.1.118","DNS","171","Standard query response 0xe679 AAAA preview.redd.it CNAME reddit.map.fastly.net SOA ns1.fastly.net"
"56","0.246391173","209.18.47.62","192.168.1.118","DNS","171","Standard query response 0x3ea4 AAAA preview.redd.it CNAME reddit.map.fastly.net SOA ns1.fastly.net"
"57","0.246409587","209.18.47.62","192.168.1.118","DNS","177","Standard query response 0x8ac2 AAAA b.thumbs.redditmedia.com CNAME reddit.map.fastly.net SOA ns1.fastly.net"
"58","0.246784237","192.168.1.118","209.18.47.62","DNS","84","Standard query 0xbe14 AAAA b.thumbs.redditmedia.com"
"59","0.248227175","209.18.47.62","192.168.1.118","DNS","133","Standard query response 0x4edf A styles.redditmedia.com CNAME reddit.map.fastly.net A 199.232.37.140"
"60","0.248290427","209.18.47.62","192.168.1.118","DNS","126","Standard query response 0x8297 A preview.redd.it CNAME reddit.map.fastly.net A 199.232.37.140"
"61","0.248312941","209.18.47.62","192.168.1.118","DNS","135","Standard query response 0x86d0 A b.thumbs.redditmedia.com CNAME reddit.map.fastly.net A 199.232.37.140"
"62","0.248398581","192.168.1.118","209.18.47.62","DNS","82","Standard query 0x32ab AAAA styles.redditmedia.com"
"63","0.248498247","192.168.1.118","209.18.47.62","DNS","75","Standard query 0xc61c AAAA preview.redd.it"
"64","0.248560287","192.168.1.118","209.18.47.62","DNS","84","Standard query 0x8e88 AAAA b.thumbs.redditmedia.com"
"65","0.249197247","192.168.1.118","199.232.37.140","TLSv1","583","Client Hello"
"66","0.253844547","209.18.47.62","192.168.1.118","DNS","135","Standard query response 0x3eed A external-preview.redd.it CNAME reddit.map.fastly.net A 199.232.37.140"
"67","0.254048079","192.168.1.118","209.18.47.62","DNS","84","Standard query 0xd2bb AAAA external-preview.redd.it"
"68","0.266376523","209.18.47.62","192.168.1.118","DNS","171","Standard query response 0xa654 AAAA preview.redd.it CNAME reddit.map.fastly.net SOA ns1.fastly.net"
"69","0.272860550","209.18.47.62","192.168.1.118","DNS","177","Standard query response 0xbe14 AAAA b.thumbs.redditmedia.com CNAME reddit.map.fastly.net SOA ns1.fastly.net"
"70","0.272923664","209.18.47.62","192.168.1.118","DNS","171","Standard query response 0xc61c AAAA preview.redd.it CNAME reddit.map.fastly.net SOA ns1.fastly.net"
"71","0.272946790","209.18.47.62","192.168.1.118","DNS","175","Standard query response 0x32ab AAAA styles.redditmedia.com CNAME reddit.map.fastly.net SOA ns1.fastly.net"
"72","0.272967316","209.18.47.62","192.168.1.118","DNS","177","Standard query response 0x8e88 AAAA b.thumbs.redditmedia.com CNAME reddit.map.fastly.net SOA ns1.fastly.net"
"73","0.273386931","192.168.1.118","199.232.37.140","TLSv1","583","Client Hello"
"74","0.273691504","192.168.1.118","199.232.37.140","TCP","74","40395 → 443 [SYN] Seq=0 Win=29200 Len=0 MSS=1460 SACK_PERM=1 TSval=16851014 TSecr=0 WS=128"
"75","0.274876520","192.168.1.118","199.232.37.140","TCP","74","40396 → 443 [SYN] Seq=0 Win=29200 Len=0 MSS=1460 SACK_PERM=1 TSval=16851015 TSecr=0 WS=128"
"76","0.275083565","192.168.1.118","199.232.37.140","TCP","74","40397 → 443 [SYN] Seq=0 Win=29200 Len=0 MSS=1460 SACK_PERM=1 TSval=16851015 TSecr=0 WS=128"
"77","0.275164168","192.168.1.118","199.232.37.140","TCP","74","40398 → 443 [SYN] Seq=0 Win=29200 Len=0 MSS=1460 SACK_PERM=1 TSval=16851015 TSecr=0 WS=128"
"78","0.275244846","192.168.1.118","199.232.37.140","TCP","74","40399 → 443 [SYN] Seq=0 Win=29200 Len=0 MSS=1460 SACK_PERM=1 TSval=16851015 TSecr=0 WS=128"
"79","0.275320498","192.168.1.118","199.232.37.140","TCP","74","40400 → 443 [SYN] Seq=0 Win=29200 Len=0 MSS=1460 SACK_PERM=1 TSval=16851015 TSecr=0 WS=128"
"80","0.275405076","192.168.1.118","199.232.37.140","TCP","74","40401 → 443 [SYN] Seq=0 Win=29200 Len=0 MSS=1460 SACK_PERM=1 TSval=16851015 TSecr=0 WS=128"
"81","0.275497792","192.168.1.118","199.232.37.140","TCP","74","40402 → 443 [SYN] Seq=0 Win=29200 Len=0 MSS=1460 SACK_PERM=1 TSval=16851016 TSecr=0 WS=128"
"82","0.275579707","192.168.1.118","199.232.37.140","TCP","74","40403 → 443 [SYN] Seq=0 Win=29200 Len=0 MSS=1460 SACK_PERM=1 TSval=16851016 TSecr=0 WS=128"
"83","0.278878073","199.232.37.140","192.168.1.118","TCP","66","443 → 40393 [ACK] Seq=1 Ack=518 Win=28160 Len=0 TSval=2788821576 TSecr=16850989"
"84","0.278965213","199.232.37.140","192.168.1.118","TLSv1.2","3304","Server Hello, Certificate, Server Key Exchange, Server Hello Done"
"85","0.279004615","192.168.1.118","199.232.37.140","TCP","66","40393 → 443 [ACK] Seq=518 Ack=3239 Win=35712 Len=0 TSval=16851019 TSecr=2788821577"
"86","0.280240471","209.18.47.62","192.168.1.118","DNS","180","Standard query response 0xd2bb AAAA external-preview.redd.it CNAME reddit.map.fastly.net SOA ns1.fastly.net"
"87","0.291098038","199.232.37.140","192.168.1.118","TCP","66","443 → 40394 [ACK] Seq=1 Ack=518 Win=28160 Len=0 TSval=247329961 TSecr=16851013"
"88","0.293326566","192.168.1.118","199.232.37.140","TCP","74","40404 → 443 [SYN] Seq=0 Win=29200 Len=0 MSS=1460 SACK_PERM=1 TSval=16851033 TSecr=0 WS=128"
"89","0.294833781","199.232.37.140","192.168.1.118","TLSv1.2","1418","Server Hello"
"90","0.294916759","192.168.1.118","199.232.37.140","TCP","66","40394 → 443 [ACK] Seq=518 Ack=1353 Win=32000 Len=0 TSval=16851035 TSecr=247329962"
"91","0.296605593","199.232.37.140","192.168.1.118","TCP","1418","443 → 40394 [ACK] Seq=1353 Ack=518 Win=28160 Len=1352 TSval=247329962 TSecr=16851013 [TCP segment of a reassembled PDU]"
"92","0.296679071","192.168.1.118","199.232.37.140","TCP","66","40394 → 443 [ACK] Seq=518 Ack=2705 Win=34688 Len=0 TSval=16851037 TSecr=247329962"
"93","0.297567014","192.168.1.118","199.232.37.140","TLSv1.2","192","Client Key Exchange, Change Cipher Spec, Encrypted Handshake Message"
"94","0.297960378","192.168.1.118","199.232.37.140","TCP","74","40405 → 443 [SYN] Seq=0 Win=29200 Len=0 MSS=1460 SACK_PERM=1 TSval=16851038 TSecr=0 WS=128"
"95","0.297983192","199.232.37.140","192.168.1.118","TLSv1.2","600","Certificate, Server Key Exchange, Server Hello Done"
"96","0.298051606","192.168.1.118","199.232.37.140","TCP","66","40394 → 443 [ACK] Seq=518 Ack=3239 Win=37376 Len=0 TSval=16851038 TSecr=247329962"
"97","0.298093458","199.232.37.140","192.168.1.118","TCP","74","443 → 40395 [SYN, ACK] Seq=0 Ack=1 Win=27040 Len=0 MSS=1364 SACK_PERM=1 TSval=3118976254 TSecr=16851014 WS=512"
"98","0.298144710","192.168.1.118","199.232.37.140","TCP","66","40395 → 443 [ACK] Seq=1 Ack=1 Win=29312 Len=0 TSval=16851038 TSecr=3118976254"
"99","0.300112479","192.168.1.118","199.232.37.140","TLSv1.2","192","Client Key Exchange, Change Cipher Spec, Encrypted Handshake Message"
"100","0.302564827","199.232.37.140","192.168.1.118","TCP","74","443 → 40397 [SYN, ACK] Seq=0 Ack=1 Win=27040 Len=0 MSS=1364 SACK_PERM=1 TSval=1091422852 TSecr=16851015 WS=512"
"101","0.302671556","192.168.1.118","199.232.37.140","TCP","66","40397 → 443 [ACK] Seq=1 Ack=1 Win=29312 Len=0 TSval=16851043 TSecr=1091422852"
"102","0.302717345","199.232.37.140","192.168.1.118","TCP","74","443 → 40402 [SYN, ACK] Seq=0 Ack=1 Win=27040 Len=0 MSS=1364 SACK_PERM=1 TSval=247993038 TSecr=16851016 WS=512"
"103","0.302746871","192.168.1.118","199.232.37.140","TCP","66","40402 → 443 [ACK] Seq=1 Ack=1 Win=29312 Len=0 TSval=16851043 TSecr=247993038"
"104","0.302766584","199.232.37.140","192.168.1.118","TCP","74","443 → 40399 [SYN, ACK] Seq=0 Ack=1 Win=27040 Len=0 MSS=1364 SACK_PERM=1 TSval=3118305350 TSecr=16851015 WS=512"
"105","0.302793197","192.168.1.118","199.232.37.140","TCP","66","40399 → 443 [ACK] Seq=1 Ack=1 Win=29312 Len=0 TSval=16851043 TSecr=3118305350"
"106","0.302812236","199.232.37.140","192.168.1.118","TCP","74","443 → 40401 [SYN, ACK] Seq=0 Ack=1 Win=27040 Len=0 MSS=1364 SACK_PERM=1 TSval=3209066161 TSecr=16851015 WS=512"
"107","0.302838299","192.168.1.118","199.232.37.140","TCP","66","40401 → 443 [ACK] Seq=1 Ack=1 Win=29312 Len=0 TSval=16851043 TSecr=3209066161"
"108","0.302857125","199.232.37.140","192.168.1.118","TCP","74","443 → 40400 [SYN, ACK] Seq=0 Ack=1 Win=27040 Len=0 MSS=1364 SACK_PERM=1 TSval=248732109 TSecr=16851015 WS=512"
"109","0.302882775","192.168.1.118","199.232.37.140","TCP","66","40400 → 443 [ACK] Seq=1 Ack=1 Win=29312 Len=0 TSval=16851043 TSecr=248732109"
"110","0.302901526","199.232.37.140","192.168.1.118","TCP","74","443 → 40396 [SYN, ACK] Seq=0 Ack=1 Win=27040 Len=0 MSS=1364 SACK_PERM=1 TSval=2788633260 TSecr=16851015 WS=512"
"111","0.302931577","192.168.1.118","199.232.37.140","TCP","66","40396 → 443 [ACK] Seq=1 Ack=1 Win=29312 Len=0 TSval=16851043 TSecr=2788633260"
"112","0.302950378","199.232.37.140","192.168.1.118","TCP","74","443 → 40398 [SYN, ACK] Seq=0 Ack=1 Win=27040 Len=0 MSS=1364 SACK_PERM=1 TSval=3101147895 TSecr=16851015 WS=512"
"113","0.302977341","192.168.1.118","199.232.37.140","TCP","66","40398 → 443 [ACK] Seq=1 Ack=1 Win=29312 Len=0 TSval=16851043 TSecr=3101147895"
"114","0.302996254","199.232.37.140","192.168.1.118","TCP","74","443 → 40403 [SYN, ACK] Seq=0 Ack=1 Win=27040 Len=0 MSS=1364 SACK_PERM=1 TSval=2786933624 TSecr=16851016 WS=512"
"115","0.303024193","192.168.1.118","199.232.37.140","TCP","66","40403 → 443 [ACK] Seq=1 Ack=1 Win=29312 Len=0 TSval=16851043 TSecr=2786933624"
"116","0.318419894","199.232.37.140","192.168.1.118","TCP","74","443 → 40404 [SYN, ACK] Seq=0 Ack=1 Win=27040 Len=0 MSS=1364 SACK_PERM=1 TSval=3228072501 TSecr=16851033 WS=512"
"117","0.318540961","192.168.1.118","199.232.37.140","TCP","66","40404 → 443 [ACK] Seq=1 Ack=1 Win=29312 Len=0 TSval=16851059 TSecr=3228072501"
"118","0.319815781","199.232.37.140","192.168.1.118","TLSv1.2","117","Change Cipher Spec, Encrypted Handshake Message"
"119","0.319881808","199.232.37.140","192.168.1.118","TCP","74","443 → 40405 [SYN, ACK] Seq=0 Ack=1 Win=27040 Len=0 MSS=1364 SACK_PERM=1 TSval=250277993 TSecr=16851038 WS=512"
"120","0.319939222","192.168.1.118","199.232.37.140","TCP","66","40405 → 443 [ACK] Seq=1 Ack=1 Win=29312 Len=0 TSval=16851060 TSecr=250277993"
"121","0.320180543","192.168.1.118","199.232.37.140","TLSv1","583","Client Hello"
"122","0.326836039","199.232.37.140","192.168.1.118","TLSv1.2","117","Change Cipher Spec, Encrypted Handshake Message"
"123","0.338216012","192.168.1.118","199.232.37.140","TLSv1","583","Client Hello"
"124","0.345485979","199.232.37.140","192.168.1.118","TCP","66","443 → 40395 [ACK] Seq=1 Ack=518 Win=28160 Len=0 TSval=3118976266 TSecr=16851060"
"125","0.347044896","199.232.37.140","192.168.1.118","TLSv1.2","1418","Server Hello"
"126","0.347124386","192.168.1.118","199.232.37.140","TCP","66","40395 → 443 [ACK] Seq=518 Ack=1353 Win=32000 Len=0 TSval=16851087 TSecr=3118976266"
"127","0.348517648","199.232.37.140","192.168.1.118","TLSv1.2","1984","Certificate, Server Key Exchange, Server Hello Done"
"128","0.348590063","192.168.1.118","199.232.37.140","TCP","66","40395 → 443 [ACK] Seq=518 Ack=3271 Win=35840 Len=0 TSval=16851089 TSecr=3118976266"
"129","0.355865692","192.168.1.118","199.232.37.140","TLSv1","583","Client Hello"
"130","0.359516670","192.168.1.118","199.232.37.140","TCP","66","40393 → 443 [ACK] Seq=644 Ack=3290 Win=35712 Len=0 TSval=16851100 TSecr=2788821589"
"131","0.366512477","192.168.1.118","199.232.37.140","TCP","66","40394 → 443 [ACK] Seq=644 Ack=3290 Win=37376 Len=0 TSval=16851107 TSecr=247329970"
"132","0.369059192","199.232.37.140","192.168.1.118","TCP","66","443 → 40396 [ACK] Seq=1 Ack=518 Win=28160 Len=0 TSval=2788633278 TSecr=16851078"
"133","0.371553054","199.232.37.140","192.168.1.118","TLSv1.2","1418","Server Hello"
"134","0.371634969","192.168.1.118","199.232.37.140","TCP","66","40396 → 443 [ACK] Seq=518 Ack=1353 Win=32000 Len=0 TSval=16851112 TSecr=2788633279"
"135","0.376916592","199.232.37.140","192.168.1.118","TLSv1.2","2080","Certificate, Server Key Exchange, Server Hello Done"
"136","0.376998069","192.168.1.118","199.232.37.140","TCP","66","40396 → 443 [ACK] Seq=518 Ack=3367 Win=35968 Len=0 TSval=16851117 TSecr=2788633279"
"137","0.380078752","192.168.1.118","199.232.37.140","TLSv1","583","Client Hello"
"138","0.387171338","199.232.37.140","192.168.1.118","TCP","66","443 → 40397 [ACK] Seq=1 Ack=518 Win=28160 Len=0 TSval=1091422873 TSecr=16851096"
"139","0.389437742","199.232.37.140","192.168.1.118","TLSv1.2","3432","Server Hello, Certificate, Server Key Exchange, Server Hello Done"
"140","0.389537546","192.168.1.118","199.232.37.140","TCP","66","40397 → 443 [ACK] Seq=518 Ack=3367 Win=35968 Len=0 TSval=16851130 TSecr=1091422873"
"141","0.401733648","192.168.1.118","199.232.37.140","TLSv1","583","Client Hello"
"142","0.411576042","199.232.37.140","192.168.1.118","TCP","66","443 → 40398 [ACK] Seq=1 Ack=518 Win=28160 Len=0 TSval=3101147923 TSecr=16851120"
"143","0.413842746","199.232.37.140","192.168.1.118","TLSv1.2","1418","Server Hello"
"144","0.413930987","192.168.1.118","199.232.37.140","TCP","66","40398 → 443 [ACK] Seq=518 Ack=1353 Win=32000 Len=0 TSval=16851154 TSecr=3101147924"
"145","0.415341824","199.232.37.140","192.168.1.118","TLSv1.2","2080","Certificate, Server Key Exchange, Server Hello Done"
"146","0.415425239","192.168.1.118","199.232.37.140","TCP","66","40398 → 443 [ACK] Seq=518 Ack=3367 Win=35968 Len=0 TSval=16851155 TSecr=3101147924"
"147","0.418832846","192.168.1.118","199.232.37.140","TLSv1","583","Client Hello"
"148","0.422148175","199.232.37.140","192.168.1.118","TCP","66","443 → 40399 [ACK] Seq=1 Ack=518 Win=28160 Len=0 TSval=3118305381 TSecr=16851142"
"149","0.423251563","199.232.37.140","192.168.1.118","TLSv1.2","3432","Server Hello, Certificate, Server Key Exchange, Server Hello Done"
"150","0.423330003","192.168.1.118","199.232.37.140","TCP","66","40399 → 443 [ACK] Seq=518 Ack=3367 Win=35968 Len=0 TSval=16851163 TSecr=3118305382"
"151","0.435912819","192.168.1.118","199.232.37.140","TLSv1","583","Client Hello"
"152","0.439772841","199.232.37.140","192.168.1.118","TCP","66","443 → 40400 [ACK] Seq=1 Ack=518 Win=28160 Len=0 TSval=248732145 TSecr=16851159"
"153","0.445788114","199.232.37.140","192.168.1.118","TLSv1.2","1418","Server Hello"
"154","0.445878568","192.168.1.118","199.232.37.140","TCP","66","40400 → 443 [ACK] Seq=518 Ack=1353 Win=32000 Len=0 TSval=16851186 TSecr=248732145"
"155","0.447292367","199.232.37.140","192.168.1.118","TLSv1.2","2080","Certificate, Server Key Exchange, Server Hello Done"
"156","0.447375120","192.168.1.118","199.232.37.140","TCP","66","40400 → 443 [ACK] Seq=518 Ack=3367 Win=35968 Len=0 TSval=16851187 TSecr=248732145"
"157","0.453266114","192.168.1.118","199.232.37.140","TLSv1","583","Client Hello"
"158","0.462918114","199.232.37.140","192.168.1.118","TCP","66","443 → 40401 [ACK] Seq=1 Ack=518 Win=28160 Len=0 TSval=3209066202 TSecr=16851176"
"159","0.466800900","199.232.37.140","192.168.1.118","TLSv1.2","2770","Server Hello"
"160","0.466888640","192.168.1.118","199.232.37.140","TCP","66","40401 → 443 [ACK] Seq=518 Ack=2705 Win=34688 Len=0 TSval=16851207 TSecr=3209066202"
"161","0.466926267","199.232.37.140","192.168.1.118","TLSv1.2","610","Certificate, Server Key Exchange, Server Hello Done"
"162","0.466947643","192.168.1.118","199.232.37.140","TCP","66","40401 → 443 [ACK] Seq=518 Ack=3249 Win=37376 Len=0 TSval=16851207 TSecr=3209066203"
"163","0.470371262","192.168.1.118","199.232.37.140","TLSv1","583","Client Hello"
"164","0.471421599","199.232.37.140","192.168.1.118","TCP","66","443 → 40402 [ACK] Seq=1 Ack=518 Win=28160 Len=0 TSval=247993081 TSecr=16851193"
"165","0.477771384","199.232.37.140","192.168.1.118","TLSv1.2","1418","Server Hello"
"166","0.477856974","192.168.1.118","199.232.37.140","TCP","66","40402 → 443 [ACK] Seq=518 Ack=1353 Win=32000 Len=0 TSval=16851218 TSecr=247993082"
"167","0.478661728","199.232.37.140","192.168.1.118","TLSv1.2","1984","Certificate, Server Key Exchange, Server Hello Done"
"168","0.478722930","192.168.1.118","199.232.37.140","TCP","66","40402 → 443 [ACK] Seq=518 Ack=3271 Win=35840 Len=0 TSval=16851219 TSecr=247993082"
"169","0.487971741","192.168.1.118","199.232.37.140","TLSv1","583","Client Hello"
"170","0.496877540","199.232.37.140","192.168.1.118","TCP","66","443 → 40405 [ACK] Seq=1 Ack=518 Win=28160 Len=0 TSval=250278038 TSecr=16851210"
"171","0.502050071","199.232.37.140","192.168.1.118","TLSv1.2","3432","Server Hello, Certificate, Server Key Exchange, Server Hello Done"
"172","0.502132399","192.168.1.118","199.232.37.140","TCP","66","40405 → 443 [ACK] Seq=518 Ack=3367 Win=35968 Len=0 TSval=16851242 TSecr=250278038"
"173","0.506707709","199.232.37.140","192.168.1.118","TCP","66","443 → 40403 [ACK] Seq=1 Ack=518 Win=28160 Len=0 TSval=2786933676 TSecr=16851228"
"174","0.511967456","199.232.37.140","192.168.1.118","TLSv1.2","2770","Server Hello"
"175","0.512054346","192.168.1.118","199.232.37.140","TCP","66","40403 → 443 [ACK] Seq=518 Ack=2705 Win=34688 Len=0 TSval=16851252 TSecr=2786933677"
"176","0.513668603","199.232.37.140","192.168.1.118","TLSv1.2","632","Certificate, Server Key Exchange, Server Hello Done"
"177","0.513742555","192.168.1.118","199.232.37.140","TCP","66","40403 → 443 [ACK] Seq=518 Ack=3271 Win=37376 Len=0 TSval=16851254 TSecr=2786933677"
"178","0.531534853","192.168.1.118","199.232.37.140","TLSv1","583","Client Hello"
"179","0.531933504","192.168.1.118","199.232.37.140","TLSv1.2","274","Application Data"
"180","0.532174700","192.168.1.118","199.232.37.140","TLSv1.2","279","Application Data"
"181","0.537969116","192.168.1.118","199.232.37.140","TLSv1.2","192","Client Key Exchange, Change Cipher Spec, Encrypted Handshake Message"
"182","0.543088770","192.168.1.118","199.232.37.140","TLSv1.2","192","Client Key Exchange, Change Cipher Spec, Encrypted Handshake Message"
"183","0.547054696","192.168.1.118","199.232.37.140","TLSv1.2","192","Client Key Exchange, Change Cipher Spec, Encrypted Handshake Message"
"184","0.550457378","192.168.1.118","199.232.37.140","TLSv1.2","192","Client Key Exchange, Change Cipher Spec, Encrypted Handshake Message"
"185","0.551704046","199.232.37.140","192.168.1.118","TCP","66","443 → 40404 [ACK] Seq=1 Ack=518 Win=28160 Len=0 TSval=3228072560 TSecr=16851272"
"186","0.553183948","199.232.37.140","192.168.1.118","TLSv1.2","744","Application Data, Application Data"
"187","0.553266276","192.168.1.118","199.232.37.140","TCP","66","40394 → 443 [ACK] Seq=857 Ack=3968 Win=40064 Len=0 TSval=16851293 TSecr=247330027"
"188","0.553313540","199.232.37.140","192.168.1.118","TLSv1.2","1418","Application Data"
"189","0.553338929","192.168.1.118","199.232.37.140","TCP","66","40393 → 443 [ACK] Seq=852 Ack=4642 Win=38400 Len=0 TSval=16851293 TSecr=2788821648"
"190","0.553783444","199.232.37.140","192.168.1.118","TLSv1.2","1180","Application Data, Application Data"
"191","0.553826183","192.168.1.118","199.232.37.140","TCP","66","40393 → 443 [ACK] Seq=852 Ack=5756 Win=41088 Len=0 TSval=16851294 TSecr=2788821648"
"192","0.555921056","199.232.37.140","192.168.1.118","TLSv1.2","2770","Server Hello"
"193","0.555999197","192.168.1.118","199.232.37.140","TCP","66","40404 → 443 [ACK] Seq=518 Ack=2705 Win=34688 Len=0 TSval=16851296 TSecr=3228072560"
"194","0.558189286","192.168.1.118","199.232.37.140","TLSv1.2","192","Client Key Exchange, Change Cipher Spec, Encrypted Handshake Message"
"195","0.559791454","199.232.37.140","192.168.1.118","TLSv1.2","610","Certificate, Server Key Exchange, Server Hello Done"
"196","0.559868432","192.168.1.118","199.232.37.140","TCP","66","40404 → 443 [ACK] Seq=518 Ack=3249 Win=37376 Len=0 TSval=16851300 TSecr=3228072560"
"197","0.563208662","192.168.1.118","199.232.37.140","TLSv1.2","192","Client Key Exchange, Change Cipher Spec, Encrypted Handshake Message"
"198","0.566099438","192.168.1.118","199.232.37.140","TLSv1.2","192","Client Key Exchange, Change Cipher Spec, Encrypted Handshake Message"
"199","0.568153985","192.168.1.118","199.232.37.140","TLSv1.2","192","Client Key Exchange, Change Cipher Spec, Encrypted Handshake Message"
"200","0.569573322","199.232.37.140","192.168.1.118","TLSv1.2","117","Change Cipher Spec, Encrypted Handshake Message"
"201","0.569662350","192.168.1.118","199.232.37.140","TCP","66","40395 → 443 [ACK] Seq=644 Ack=3322 Win=35840 Len=0 TSval=16851310 TSecr=3118976321"
"202","0.570180968","192.168.1.118","199.232.37.140","TLSv1.2","192","Client Key Exchange, Change Cipher Spec, Encrypted Handshake Message"
"203","0.570422664","199.232.37.140","192.168.1.118","TLSv1.2","117","Change Cipher Spec, Encrypted Handshake Message"
"204","0.570503629","192.168.1.118","199.232.37.140","TCP","66","40398 → 443 [ACK] Seq=644 Ack=3418 Win=35968 Len=0 TSval=16851311 TSecr=3101147963"
"205","0.570539218","199.232.37.140","192.168.1.118","TLSv1.2","117","Change Cipher Spec, Encrypted Handshake Message"
"206","0.570564219","192.168.1.118","199.232.37.140","TCP","66","40396 → 443 [ACK] Seq=644 Ack=3418 Win=35968 Len=0 TSval=16851311 TSecr=2788633329"
"207","0.571884403","199.232.37.140","192.168.1.118","TLSv1.2","117","Change Cipher Spec, Encrypted Handshake Message"
"208","0.571970581","192.168.1.118","199.232.37.140","TCP","66","40397 → 443 [ACK] Seq=644 Ack=3418 Win=35968 Len=0 TSval=16851312 TSecr=1091422920"
"209","0.572593928","192.168.1.118","199.232.37.140","TLSv1.2","192","Client Key Exchange, Change Cipher Spec, Encrypted Handshake Message"
"210","0.573018255","192.168.1.118","199.232.37.140","TCP","74","40406 → 443 [SYN] Seq=0 Win=29200 Len=0 MSS=1460 SACK_PERM=1 TSval=16851313 TSecr=0 WS=128"
"211","0.573155135","192.168.1.118","209.18.47.62","DNS","84","Standard query 0x9e90 A a.thumbs.redditmedia.com"
"212","0.573200136","192.168.1.118","199.232.37.140","TCP","74","40407 → 443 [SYN] Seq=0 Win=29200 Len=0 MSS=1460 SACK_PERM=1 TSval=16851313 TSecr=0 WS=128"
"213","0.573303815","192.168.1.118","199.232.37.140","TCP","74","40408 → 443 [SYN] Seq=0 Win=29200 Len=0 MSS=1460 SACK_PERM=1 TSval=16851313 TSecr=0 WS=128"
"214","0.573594750","192.168.1.118","209.18.47.62","DNS","84","Standard query 0x6210 A a.thumbs.redditmedia.com"
"215","0.575896006","192.168.1.118","199.232.37.140","TLSv1.2","192","Client Key Exchange, Change Cipher Spec, Encrypted Handshake Message"
"216","0.576420986","192.168.1.118","199.232.37.140","TLSv1.2","295","Application Data"
"217","0.576698984","192.168.1.118","199.232.37.140","TLSv1.2","375","Application Data"
"218","0.576920141","192.168.1.118","199.232.37.140","TLSv1.2","367","Application Data"
"219","0.577136411","192.168.1.118","199.232.37.140","TLSv1.2","368","Application Data"
"220","0.582348031","199.232.37.140","192.168.1.118","TLSv1.2","117","Change Cipher Spec, Encrypted Handshake Message"
"221","0.582434184","192.168.1.118","199.232.37.140","TCP","66","40399 → 443 [ACK] Seq=644 Ack=3418 Win=35968 Len=0 TSval=16851322 TSecr=3118305421"
"222","0.583229137","192.168.1.118","199.232.37.140","TLSv1.2","370","Application Data"
"223","0.590562394","199.232.37.140","192.168.1.118","TLSv1.2","117","Change Cipher Spec, Encrypted Handshake Message"
"224","0.590649147","192.168.1.118","199.232.37.140","TCP","66","40405 → 443 [ACK] Seq=644 Ack=3418 Win=35968 Len=0 TSval=16851331 TSecr=250278061"
"225","0.594312900","192.168.1.118","199.232.37.140","TLSv1.2","380","Application Data"
"226","0.603002854","199.232.37.140","192.168.1.118","TLSv1.2","117","Change Cipher Spec, Encrypted Handshake Message"
"227","0.603082982","192.168.1.118","199.232.37.140","TCP","66","40401 → 443 [ACK] Seq=644 Ack=3300 Win=37376 Len=0 TSval=16851343 TSecr=3209066234"
"228","0.603121333","199.232.37.140","192.168.1.118","TLSv1.2","117","Change Cipher Spec, Encrypted Handshake Message"
"229","0.603142697","192.168.1.118","199.232.37.140","TCP","66","40400 → 443 [ACK] Seq=644 Ack=3418 Win=35968 Len=0 TSval=16851343 TSecr=248732183"
"230","0.603159272","199.232.37.140","192.168.1.118","TLSv1.2","117","Change Cipher Spec, Encrypted Handshake Message"
"231","0.603179548","192.168.1.118","199.232.37.140","TCP","66","40402 → 443 [ACK] Seq=644 Ack=3322 Win=35840 Len=0 TSval=16851343 TSecr=247993112"
"232","0.606245643","192.168.1.118","199.232.37.140","TLSv1.2","341","Application Data"
"233","0.606551116","192.168.1.118","199.232.37.140","TLSv1.2","293","Application Data"
"234","0.606764586","192.168.1.118","199.232.37.140","TLSv1.2","295","Application Data"
"235","0.609539146","209.18.47.62","192.168.1.118","DNS","135","Standard query response 0x9e90 A a.thumbs.redditmedia.com CNAME reddit.map.fastly.net A 199.232.37.140"
"236","0.609734390","192.168.1.118","209.18.47.62","DNS","84","Standard query 0xfa0d AAAA a.thumbs.redditmedia.com"
"237","0.611277469","199.232.37.140","192.168.1.118","TCP","74","443 → 40406 [SYN, ACK] Seq=0 Ack=1 Win=27040 Len=0 MSS=1364 SACK_PERM=1 TSval=1279673465 TSecr=16851313 WS=512"
"238","0.611380948","192.168.1.118","199.232.37.140","TCP","66","40406 → 443 [ACK] Seq=1 Ack=1 Win=29312 Len=0 TSval=16851351 TSecr=1279673465"
"239","0.613992039","199.232.37.140","192.168.1.118","TLSv1.2","117","Change Cipher Spec, Encrypted Handshake Message"
"240","0.614081355","192.168.1.118","199.232.37.140","TCP","66","40403 → 443 [ACK] Seq=644 Ack=3322 Win=37376 Len=0 TSval=16851354 TSecr=2786933702"
"241","0.614161157","199.232.37.140","192.168.1.118","TLSv1.2","5474","Application Data, Application Data, Application Data, Application Data"
"242","0.614191458","192.168.1.118","199.232.37.140","TCP","66","40395 → 443 [ACK] Seq=873 Ack=8730 Win=46592 Len=0 TSval=16851354 TSecr=3118976332"
"243","0.614673775","199.232.37.140","192.168.1.118","TLSv1.2","3965","Application Data, Application Data, Application Data, Application Data"
"244","0.614719027","192.168.1.118","199.232.37.140","TCP","66","40397 → 443 [ACK] Seq=945 Ack=7317 Win=43776 Len=0 TSval=16851355 TSecr=1091422930"
"245","0.614762478","199.232.37.140","192.168.1.118","TLSv1.2","6826","Application Data, Application Data, Application Data, Application Data, Application Data"
"246","0.614786254","192.168.1.118","199.232.37.140","TCP","66","40395 → 443 [ACK] Seq=873 Ack=15490 Win=60160 Len=0 TSval=16851355 TSecr=3118976332"
"247","0.622961353","199.232.37.140","192.168.1.118","TLSv1.2","2300","Application Data, Application Data, Application Data"
"248","0.623047006","192.168.1.118","199.232.37.140","TCP","66","40396 → 443 [ACK] Seq=953 Ack=5652 Win=40448 Len=0 TSval=16851363 TSecr=2788633339"
"249","0.623088782","199.232.37.140","192.168.1.118","TLSv1.2","117","Change Cipher Spec, Encrypted Handshake Message"
"250","0.623113308","199.232.37.140","192.168.1.118","TLSv1.2","1418","Application Data [TCP segment of a reassembled PDU]"
"251","0.623127234","199.232.37.140","192.168.1.118","TLSv1.2","1418","Application Data"
"252","0.623721842","199.232.37.140","192.168.1.118","TLSv1.2","2478","Application Data, Application Data, Application Data"
"253","0.623762831","192.168.1.118","199.232.37.140","TCP","66","40398 → 443 [ACK] Seq=946 Ack=7182 Win=43520 Len=0 TSval=16851364 TSecr=3101147973"
"254","0.623817783","199.232.37.140","192.168.1.118","TCP","74","443 → 40408 [SYN, ACK] Seq=0 Ack=1 Win=27040 Len=0 MSS=1364 SACK_PERM=1 TSval=3118305429 TSecr=16851313 WS=512"
"255","0.623866922","192.168.1.118","199.232.37.140","TCP","66","40408 → 443 [ACK] Seq=1 Ack=1 Win=29312 Len=0 TSval=16851364 TSecr=3118305429"
"256","0.623887435","199.232.37.140","192.168.1.118","TLSv1.2","3844","Application Data, Application Data, Application Data, Application Data"
"257","0.623911436","192.168.1.118","199.232.37.140","TCP","66","40399 → 443 [ACK] Seq=948 Ack=7196 Win=43520 Len=0 TSval=16851364 TSecr=3118305429"
"258","0.623932737","199.232.37.140","192.168.1.118","TCP","74","443 → 40407 [SYN, ACK] Seq=0 Ack=1 Win=27040 Len=0 MSS=1364 SACK_PERM=1 TSval=249467611 TSecr=16851313 WS=512"
"259","0.623957475","192.168.1.118","199.232.37.140","TCP","66","40407 → 443 [ACK] Seq=1 Ack=1 Win=29312 Len=0 TSval=16851364 TSecr=249467611"
"260","0.623979288","209.18.47.62","192.168.1.118","DNS","135","Standard query response 0x6210 A a.thumbs.redditmedia.com CNAME reddit.map.fastly.net A 199.232.37.140"
"261","0.624145357","192.168.1.118","209.18.47.62","DNS","84","Standard query 0x1606 AAAA a.thumbs.redditmedia.com"
"262","0.628242650","199.232.37.140","192.168.1.118","TLSv1.2","5474","Application Data, Application Data, Application Data, Application Data"
"263","0.628335091","192.168.1.118","199.232.37.140","TCP","66","40405 → 443 [ACK] Seq=958 Ack=8826 Win=46848 Len=0 TSval=16851368 TSecr=250278069"
"264","0.628438494","192.168.1.118","192.168.1.102","TCP","176","33923 → 8009 [PSH, ACK] Seq=1 Ack=1 Win=364 Len=110 TSval=16851368 TSecr=4230453 [TCP segment of a reassembled PDU]"
"265","0.628495972","199.232.37.140","192.168.1.118","TLSv1.2","8178","Application Data, Application Data, Application Data, Application Data, Application Data, Application Data"
"266","0.628522185","192.168.1.118","199.232.37.140","TCP","66","40405 → 443 [ACK] Seq=958 Ack=16938 Win=62976 Len=0 TSval=16851369 TSecr=250278069"
"267","0.628533985","199.232.37.140","192.168.1.118","TLSv1.2","2770","Application Data, Application Data"
"268","0.628556311","192.168.1.118","199.232.37.140","TCP","66","40400 → 443 [ACK] Seq=919 Ack=6122 Win=41344 Len=0 TSval=16851369 TSecr=248732191"
"269","0.631595717","199.232.37.140","192.168.1.118","TLSv1.2","10882","Application Data, Application Data, Application Data, Application Data, Application Data, Application Data, Application Data, Application Data"
"270","0.631679395","192.168.1.118","199.232.37.140","TCP","66","40400 → 443 [ACK] Seq=919 Ack=16938 Win=62976 Len=0 TSval=16851372 TSecr=248732191"
"271","0.631712284","199.232.37.140","192.168.1.118","TLSv1.2","2770","Application Data, Application Data"
"272","0.631739810","192.168.1.118","199.232.37.140","TCP","66","40401 → 443 [ACK] Seq=871 Ack=6004 Win=42752 Len=0 TSval=16851372 TSecr=3209066243"
"273","0.634984899","199.232.37.140","192.168.1.118","TLSv1.2","8178","Application Data, Application Data, Application Data, Application Data, Application Data, Application Data"
"274","0.635062764","192.168.1.118","199.232.37.140","TCP","66","40401 → 443 [ACK] Seq=871 Ack=14116 Win=59008 Len=0 TSval=16851375 TSecr=3209066243"
"275","0.637931514","192.168.1.118","199.232.37.140","TLSv1","583","Client Hello"
"276","0.645057701","209.18.47.62","192.168.1.118","DNS","177","Standard query response 0xfa0d AAAA a.thumbs.redditmedia.com CNAME reddit.map.fastly.net SOA ns1.fastly.net"
"277","0.645133966","199.232.37.140","192.168.1.118","TLSv1.2","2770","Application Data, Application Data"
"278","0.645181255","192.168.1.118","199.232.37.140","TCP","66","40401 → 443 [ACK] Seq=871 Ack=16820 Win=64384 Len=0 TSval=16851385 TSecr=3209066243"
"279","0.645217832","199.232.37.140","192.168.1.118","TLSv1.2","2770","Application Data, Application Data"
"280","0.645251308","192.168.1.118","199.232.37.140","TCP","66","40402 → 443 [ACK] Seq=873 Ack=6026 Win=41216 Len=0 TSval=16851385 TSecr=247993121"
"281","0.645335873","199.232.37.140","192.168.1.118","TLSv1.2","10882","Application Data, Application Data, Application Data, Application Data, Application Data, Application Data, Application Data, Application Data"
"282","0.645359012","192.168.1.118","199.232.37.140","TCP","66","40402 → 443 [ACK] Seq=873 Ack=16842 Win=62848 Len=0 TSval=16851385 TSecr=247993121"
"283","0.650555906","199.232.37.140","192.168.1.118","TLSv1.2","5474","Application Data, Application Data, Application Data, Application Data"
"284","0.650639221","192.168.1.118","199.232.37.140","TCP","66","40395 → 443 [ACK] Seq=873 Ack=22250 Win=73600 Len=0 TSval=16851391 TSecr=3118976332"
"285","0.650760526","199.232.37.140","192.168.1.118","TLSv1.2","9530","Application Data, Application Data, Application Data, Application Data, Application Data, Application Data"
"286","0.650787527","192.168.1.118","199.232.37.140","TCP","66","40395 → 443 [ACK] Seq=873 Ack=31714 Win=92544 Len=0 TSval=16851391 TSecr=3118976339"
"287","0.650830316","199.232.37.140","192.168.1.118","TLSv1.2","5474","Application Data, Application Data, Application Data, Application Data"
"288","0.650850816","192.168.1.118","199.232.37.140","TCP","66","40395 → 443 [ACK] Seq=873 Ack=37122 Win=103424 Len=0 TSval=16851391 TSecr=3118976339"
"289","0.655045176","209.18.47.62","192.168.1.118","DNS","177","Standard query response 0x1606 AAAA a.thumbs.redditmedia.com CNAME reddit.map.fastly.net SOA ns1.fastly.net"
"290","0.655126741","199.232.37.140","192.168.1.118","TLSv1.2","2770","Application Data, Application Data"
"291","0.655175568","192.168.1.118","199.232.37.140","TCP","66","40395 → 443 [ACK] Seq=873 Ack=39826 Win=108800 Len=0 TSval=16851395 TSecr=3118976340"
"292","0.655213769","199.232.37.140","192.168.1.118","TLSv1.2","2770","Application Data, Application Data"
"293","0.655242020","192.168.1.118","199.232.37.140","TCP","66","40405 → 443 [ACK] Seq=958 Ack=19642 Win=68480 Len=0 TSval=16851395 TSecr=250278076"
"294","0.656531903","192.168.1.102","192.168.1.118","TCP","176","8009 → 33923 [PSH, ACK] Seq=1 Ack=111 Win=294 Len=110 TSval=4230954 TSecr=16851368 [TCP segment of a reassembled PDU]"
"295","0.656617981","192.168.1.118","192.168.1.102","TCP","66","33923 → 8009 [ACK] Seq=111 Ack=111 Win=364 Len=0 TSval=16851397 TSecr=4230954"
"296","0.662506312","192.168.1.118","199.232.37.140","TCP","66","40404 → 443 [ACK] Seq=644 Ack=3300 Win=37376 Len=0 TSval=16851403 TSecr=3228072575"
"297","0.663206186","199.232.37.140","192.168.1.118","TLSv1.2","1418","Application Data [TCP segment of a reassembled PDU]"
"298","0.665120128","192.168.1.118","199.232.37.140","TLSv1","583","Client Hello"
"299","0.665714687","199.232.37.140","192.168.1.118","TLSv1.2","1418","Application Data [TCP segment of a reassembled PDU]"
"300","0.665793727","192.168.1.118","199.232.37.140","TCP","66","40405 → 443 [ACK] Seq=958 Ack=22346 Win=73856 Len=0 TSval=16851406 TSecr=250278076"
"301","0.665834491","199.232.37.140","192.168.1.118","TLSv1.2","2770","Application Data, Application Data"
"302","0.665861904","192.168.1.118","199.232.37.140","TCP","66","40401 → 443 [ACK] Seq=871 Ack=19524 Win=69760 Len=0 TSval=16851406 TSecr=3209066252"
"303","0.665875055","199.232.37.140","192.168.1.118","TLSv1.2","5474","Application Data, Application Data, Application Data, Application Data"
"304","0.665897631","192.168.1.118","199.232.37.140","TCP","66","40400 → 443 [ACK] Seq=919 Ack=22346 Win=73856 Len=0 TSval=16851406 TSecr=248732201"
"305","0.666366122","199.232.37.140","192.168.1.118","TLSv1.2","4122","Application Data, Application Data"
"306","0.666414236","192.168.1.118","199.232.37.140","TCP","66","40400 → 443 [ACK] Seq=919 Ack=26402 Win=81920 Len=0 TSval=16851406 TSecr=248732201"
"307","0.666437287","199.232.37.140","192.168.1.118","TLSv1.2","8178","Application Data, Application Data, Application Data, Application Data, Application Data, Application Data"
"308","0.666477088","192.168.1.118","199.232.37.140","TCP","66","40401 → 443 [ACK] Seq=871 Ack=27636 Win=86016 Len=0 TSval=16851407 TSecr=3209066252"
"309","0.669726827","199.232.37.140","192.168.1.118","TLSv1.2","5474","Application Data, Application Data, Application Data, Application Data"
"310","0.669810892","192.168.1.118","199.232.37.140","TCP","66","40400 → 443 [ACK] Seq=919 Ack=31810 Win=92800 Len=0 TSval=16851410 TSecr=248732201"
"311","0.669896870","199.232.37.140","192.168.1.118","TCP","1418","443 → 40401 [PSH, ACK] Seq=27636 Ack=871 Win=29184 Len=1352 TSval=3209066252 TSecr=16851385 [TCP segment of a reassembled PDU]"
"312","0.669931159","199.232.37.140","192.168.1.118","TCP","66","443 → 40406 [ACK] Seq=1 Ack=518 Win=28160 Len=0 TSval=1279673516 TSecr=16851378"
"313","0.669979311","199.232.37.140","192.168.1.118","TLSv1.2","3336","Server Hello, Certificate, Server Key Exchange, Server Hello Done"
"314","0.669999399","192.168.1.118","199.232.37.140","TCP","66","40406 → 443 [ACK] Seq=518 Ack=3271 Win=35840 Len=0 TSval=16851410 TSecr=1279673517"
"315","0.670028200","199.232.37.140","192.168.1.118","TLSv1.2","2770","Application Data, Application Data"
"316","0.670047988","192.168.1.118","199.232.37.140","TCP","66","40401 → 443 [ACK] Seq=871 Ack=31692 Win=94208 Len=0 TSval=16851410 TSecr=3209066252"
"317","0.670057489","199.232.37.140","192.168.1.118","TLSv1.2","2770","Application Data, Application Data"
"318","0.670074327","192.168.1.118","199.232.37.140","TCP","66","40400 → 443 [ACK] Seq=919 Ack=34514 Win=98176 Len=0 TSval=16851410 TSecr=248732201"
"319","0.671419336","199.232.37.140","192.168.1.118","TLSv1.2","2770","Application Data, Application Data"
"320","0.671511189","192.168.1.118","199.232.37.140","TCP","66","40401 → 443 [ACK] Seq=871 Ack=34396 Win=99584 Len=0 TSval=16851412 TSecr=3209066252"
"321","0.671545516","199.232.37.140","192.168.1.118","TLSv1.2","1418","Application Data [TCP segment of a reassembled PDU]"
"322","0.675010137","199.232.37.140","192.168.1.118","TLSv1.2","1939","Application Data, Application Data, Application Data"
"323","0.675096240","192.168.1.118","199.232.37.140","TCP","66","40395 → 443 [ACK] Seq=873 Ack=41699 Win=112512 Len=0 TSval=16851415 TSecr=3118976347"
"324","0.675151667","199.232.37.140","192.168.1.118","TLSv1.2","1418","Application Data [TCP segment of a reassembled PDU]"
"325","0.675173630","192.168.1.118","199.232.37.140","TCP","66","40405 → 443 [ACK] Seq=958 Ack=25050 Win=79232 Len=0 TSval=16851415 TSecr=250278076"
"326","0.675186743","199.232.37.140","192.168.1.118","TLSv1.2","2770","Application Data, Application Data"
"327","0.675207219","192.168.1.118","199.232.37.140","TCP","66","40402 → 443 [ACK] Seq=873 Ack=19546 Win=68224 Len=0 TSval=16851415 TSecr=247993131"
"328","0.675264421","199.232.37.140","192.168.1.118","TLSv1.2","4288","Application Data, Application Data, Application Data, Application Data"
"329","0.675286684","192.168.1.118","199.232.37.140","TCP","66","40402 → 443 [ACK] Seq=873 Ack=23768 Win=76672 Len=0 TSval=16851415 TSecr=247993131"
"330","0.675314760","199.232.37.140","192.168.1.118","TLSv1.2","1418","Application Data [TCP segment of a reassembled PDU]"
"331","0.683545111","199.232.37.140","192.168.1.118","TLSv1.2","1418","Application Data [TCP segment of a reassembled PDU]"
"332","0.683625938","192.168.1.118","199.232.37.140","TCP","66","40400 → 443 [ACK] Seq=919 Ack=37218 Win=103552 Len=0 TSval=16851424 TSecr=248732201"
"333","0.683666365","199.232.37.140","192.168.1.118","TLSv1.2","2770","Application Data, Application Data"
"334","0.683694416","192.168.1.118","199.232.37.140","TCP","66","40401 → 443 [ACK] Seq=871 Ack=37100 Win=104960 Len=0 TSval=16851424 TSecr=3209066252"
"335","0.683706916","199.232.37.140","192.168.1.118","TCP","1418","443 → 40405 [ACK] Seq=25050 Ack=958 Win=29184 Len=1352 TSval=250278079 TSecr=16851368 [TCP segment of a reassembled PDU]"
"336","0.683776719","199.232.37.140","192.168.1.118","TLSv1.2","1418","Application Data [TCP segment of a reassembled PDU]"
"337","0.683796732","192.168.1.118","199.232.37.140","TCP","66","40405 → 443 [ACK] Seq=958 Ack=27754 Win=84608 Len=0 TSval=16851424 TSecr=250278079"
"338","0.683807020","199.232.37.140","192.168.1.118","TLSv1.2","2770","Application Data, Application Data"
"339","0.683825270","192.168.1.118","199.232.37.140","TCP","66","40400 → 443 [ACK] Seq=919 Ack=39922 Win=109056 Len=0 TSval=16851424 TSecr=248732202"
"340","0.685365062","199.232.37.140","192.168.1.118","TLSv1.2","2770","Application Data, Application Data"
"341","0.685459578","192.168.1.118","199.232.37.140","TCP","66","40401 → 443 [ACK] Seq=871 Ack=39804 Win=110336 Len=0 TSval=16851425 TSecr=3209066254"
"342","0.685494666","199.232.37.140","192.168.1.118","TLSv1.2","2770","Application Data, Application Data"
"343","0.685518317","192.168.1.118","199.232.37.140","TCP","66","40400 → 443 [ACK] Seq=919 Ack=42626 Win=114432 Len=0 TSval=16851426 TSecr=248732203"
"344","0.686385785","192.168.1.118","199.232.37.140","TLSv1","583","Client Hello"
"345","0.686690996","192.168.1.118","199.232.37.140","TCP","74","40409 → 443 [SYN] Seq=0 Win=29200 Len=0 MSS=1460 SACK_PERM=1 TSval=16851427 TSecr=0 WS=128"
"346","0.687205501","192.168.1.118","199.232.37.140","TLSv1.2","293","Application Data"
"347","0.689898296","199.232.37.140","192.168.1.118","TLSv1.2","1418","Application Data [TCP segment of a reassembled PDU]"
"348","0.689953297","199.232.37.140","192.168.1.118","TLSv1.2","2770","Application Data, Application Data"
"349","0.689996499","192.168.1.118","199.232.37.140","TCP","66","40405 → 443 [ACK] Seq=958 Ack=30458 Win=90112 Len=0 TSval=16851430 TSecr=250278081"
"350","0.690424801","192.168.1.118","199.232.37.140","TLSv1.2","295","Application Data"
"351","0.690689736","192.168.1.118","199.232.37.140","TCP","74","40410 → 443 [SYN] Seq=0 Win=29200 Len=0 MSS=1460 SACK_PERM=1 TSval=16851431 TSecr=0 WS=128"
"352","0.695209581","192.168.1.118","199.232.37.140","TLSv1.2","192","Client Key Exchange, Change Cipher Spec, Encrypted Handshake Message"
"353","0.701895090","192.168.1.118","199.232.37.140","TLSv1.2","369","Application Data"
"354","0.708894998","199.232.37.140","192.168.1.118","TLSv1.2","2770","Application Data, Application Data"
"355","0.708971263","192.168.1.118","199.232.37.140","TCP","66","40401 → 443 [ACK] Seq=871 Ack=42508 Win=115840 Len=0 TSval=16851449 TSecr=3209066255"
"356","0.709020102","199.232.37.140","192.168.1.118","TLSv1.2","1418","Application Data [TCP segment of a reassembled PDU]"
"357","0.709066441","199.232.37.140","192.168.1.118","TCP","66","443 → 40407 [ACK] Seq=1 Ack=518 Win=28160 Len=0 TSval=249467631 TSecr=16851405"
"358","0.709094517","199.232.37.140","192.168.1.118","TLSv1.2","1418","Application Data [TCP segment of a reassembled PDU]"
"359","0.709112268","199.232.37.140","192.168.1.118","TLSv1.2","2770","Application Data, Application Data"
"360","0.709133081","192.168.1.118","199.232.37.140","TCP","66","40401 → 443 [ACK] Seq=871 Ack=46564 Win=116992 Len=0 TSval=16851449 TSecr=3209066257"
"361","0.709152407","199.232.37.140","192.168.1.118","TLSv1.2","5474","Application Data, Application Data, Application Data, Application Data"
"362","0.709176858","199.232.37.140","192.168.1.118","TLSv1.2","3314","Server Hello, Certificate, Server Key Exchange, Server Hello Done"
"363","0.709197171","192.168.1.118","199.232.37.140","TCP","66","40407 → 443 [ACK] Seq=518 Ack=3249 Win=35712 Len=0 TSval=16851449 TSecr=249467632"
"364","0.709214109","199.232.37.140","192.168.1.118","TLSv1.2","2770","Application Data, Application Data"
"365","0.709235447","192.168.1.118","199.232.37.140","TCP","66","40405 → 443 [ACK] Seq=958 Ack=34514 Win=98176 Len=0 TSval=16851449 TSecr=250278083"
"366","0.709263723","199.232.37.140","192.168.1.118","TLSv1.2","2770","Application Data, Application Data"
"367","0.709285174","192.168.1.118","199.232.37.140","TCP","66","40405 → 443 [ACK] Seq=958 Ack=37218 Win=103552 Len=0 TSval=16851449 TSecr=250278085"
"368","0.709296524","199.232.37.140","192.168.1.118","TLSv1.2","2770","Application Data, Application Data"
"369","0.709308450","199.232.37.140","192.168.1.118","TLSv1.2","2770","Application Data, Application Data"
"370","0.710185918","199.232.37.140","192.168.1.118","TLSv1.2","2770","Application Data, Application Data"
"371","0.710221169","199.232.37.140","192.168.1.118","TLSv1.2","1418","Application Data [TCP segment of a reassembled PDU]"
"372","0.711016535","199.232.37.140","192.168.1.118","TLSv1.2","1418","Application Data [TCP segment of a reassembled PDU]"
"373","0.711066436","199.232.37.140","192.168.1.118","TLSv1.2","2770","Application Data, Application Data"
"374","0.711107200","192.168.1.118","199.232.37.140","TCP","66","40405 → 443 [ACK] Seq=958 Ack=39922 Win=109056 Len=0 TSval=16851451 TSecr=250278086"
"375","0.711155527","199.232.37.140","192.168.1.118","TLSv1.2","2770","Application Data, Application Data"
"376","0.711196116","199.232.37.140","192.168.1.118","TLSv1.2","5474","Application Data, Application Data, Application Data, Application Data"
"377","0.711209616","199.232.37.140","192.168.1.118","TLSv1.2","2770","Application Data, Application Data"
"378","0.711227329","192.168.1.118","199.232.37.140","TCP","66","40405 → 443 [ACK] Seq=958 Ack=42626 Win=114432 Len=0 TSval=16851451 TSecr=250278087"
"379","0.711237155","199.232.37.140","192.168.1.118","TLSv1.2","2770","Application Data, Application Data"
"380","0.719099242","199.232.37.140","192.168.1.118","TLSv1.2","2770","Application Data, Application Data"
"381","0.720060726","199.232.37.140","192.168.1.118","TLSv1.2","2770","Application Data [TCP segment of a reassembled PDU]"
"382","0.720118391","192.168.1.118","199.232.37.140","TCP","66","40400 → 443 [ACK] Seq=919 Ack=65610 Win=91520 Len=0 TSval=16851460 TSecr=248732205"
"383","0.720152542","199.232.37.140","192.168.1.118","TLSv1.2","2770","Application Data, Application Data"
"384","0.723103908","192.168.1.118","199.232.37.140","TCP","66","40401 → 443 [ACK] Seq=871 Ack=60084 Win=103552 Len=0 TSval=16851463 TSecr=3209066260"
"385","0.723141459","199.232.37.140","192.168.1.118","TCP","74","443 → 40409 [SYN, ACK] Seq=0 Ack=1 Win=27040 Len=0 MSS=1364 SACK_PERM=1 TSval=2762749431 TSecr=16851427 WS=512"
"386","0.723244425","192.168.1.118","199.232.37.140","TCP","66","40409 → 443 [ACK] Seq=1 Ack=1 Win=29312 Len=0 TSval=16851463 TSecr=2762749431"
"387","0.723317040","199.232.37.140","192.168.1.118","TCP","66","443 → 40408 [ACK] Seq=1 Ack=518 Win=28160 Len=0 TSval=3118305453 TSecr=16851426"
"388","0.723349154","199.232.37.140","192.168.1.118","TLSv1.2","5474","Application Data, Application Data, Application Data, Application Data"
"389","0.723379505","192.168.1.118","199.232.37.140","TCP","66","40404 → 443 [ACK] Seq=871 Ack=8708 Win=48128 Len=0 TSval=16851463 TSecr=3228072599"
"390","0.723437744","199.232.37.140","192.168.1.118","TLSv1.2","2770","Application Data, Application Data"
"391","0.723482196","192.168.1.118","199.232.37.140","TCP","66","40405 → 443 [ACK] Seq=958 Ack=45330 Win=119424 Len=0 TSval=16851464 TSecr=250278088"
"392","0.723494821","199.232.37.140","192.168.1.118","TLSv1.2","2770","Application Data, Application Data"
"393","0.723512034","199.232.37.140","192.168.1.118","TLSv1.2","8178","Application Data, Application Data, Application Data, Application Data, Application Data, Application Data"
"394","0.723532660","192.168.1.118","199.232.37.140","TCP","66","40404 → 443 [ACK] Seq=871 Ack=16820 Win=64384 Len=0 TSval=16851464 TSecr=3228072600"
"395","0.724560796","199.232.37.140","192.168.1.118","TLSv1.2","2770","Application Data, Application Data"
"396","0.724617448","199.232.37.140","192.168.1.118","TLSv1.2","207","Application Data, Application Data"
"397","0.724662612","199.232.37.140","192.168.1.118","TLSv1.2","3336","Server Hello, Certificate, Server Key Exchange, Server Hello Done"
"398","0.724698901","192.168.1.118","199.232.37.140","TCP","66","40408 → 443 [ACK] Seq=518 Ack=3271 Win=35840 Len=0 TSval=16851465 TSecr=3118305454"
"399","0.724732652","199.232.37.140","192.168.1.118","TLSv1.2","2770","Application Data, Application Data"
"400","0.724746828","199.232.37.140","192.168.1.118","TLSv1.2","2770","Application Data, Application Data"
"401","0.726671595","192.168.1.118","199.232.37.140","TLSv1.2","192","Client Key Exchange, Change Cipher Spec, Encrypted Handshake Message"
"402","0.726861952","199.232.37.140","192.168.1.118","TLSv1.2","1418","Application Data [TCP segment of a reassembled PDU]"
"403","0.726937504","199.232.37.140","192.168.1.118","TLSv1.2","2770","Application Data [TCP segment of a reassembled PDU]"
"404","0.726952730","199.232.37.140","192.168.1.118","TLSv1.2","1418","Application Data [TCP segment of a reassembled PDU]"
"405","0.727421784","199.232.37.140","192.168.1.118","TLSv1.2","2770","Application Data, Application Data"
"406","0.727467473","199.232.37.140","192.168.1.118","TLSv1.2","1418","Application Data [TCP segment of a reassembled PDU]"
"407","0.727494774","199.232.37.140","192.168.1.118","TLSv1.2","2770","Application Data, Application Data"
"408","0.727521100","199.232.37.140","192.168.1.118","TLSv1.2","117","Change Cipher Spec, Encrypted Handshake Message"
"409","0.727554788","199.232.37.140","192.168.1.118","TCP","74","443 → 40410 [SYN, ACK] Seq=0 Ack=1 Win=27040 Len=0 MSS=1364 SACK_PERM=1 TSval=3120309536 TSecr=16851431 WS=512"
"410","0.727618366","192.168.1.118","199.232.37.140","TCP","66","40410 → 443 [ACK] Seq=1 Ack=1 Win=29312 Len=0 TSval=16851468 TSecr=3120309536"
"411","0.727659267","199.232.37.140","192.168.1.118","TLSv1.2","2770","Application Data, Application Data"
"412","0.727673530","199.232.37.140","192.168.1.118","TLSv1.2","2770","Application Data, Application Data"
"413","0.727683905","199.232.37.140","192.168.1.118","TLSv1.2","1418","Application Data"
"414","0.727708844","192.168.1.118","199.232.37.140","TCP","66","40403 → 443 [ACK] Seq=873 Ack=4674 Win=40064 Len=0 TSval=16851468 TSecr=2786933730"
"415","0.730554756","199.232.37.140","192.168.1.118","TLSv1.2","1418","Application Data [TCP segment of a reassembled PDU]"
"416","0.730631246","192.168.1.118","199.232.37.140","TCP","66","40403 → 443 [ACK] Seq=873 Ack=6026 Win=42752 Len=0 TSval=16851471 TSecr=2786933730"
"417","0.731357134","199.232.37.140","192.168.1.118","TLSv1.2","4122","Application Data, Application Data, Application Data"
"418","0.731403748","192.168.1.118","199.232.37.140","TCP","66","40403 → 443 [ACK] Seq=873 Ack=10082 Win=50944 Len=0 TSval=16851471 TSecr=2786933730"
"419","0.731421936","199.232.37.140","192.168.1.118","TLSv1.2","104","Application Data"
"420","0.731439224","192.168.1.118","199.232.37.140","TCP","66","40403 → 443 [ACK] Seq=873 Ack=10120 Win=50944 Len=0 TSval=16851471 TSecr=2786933730"
"421","0.731470788","199.232.37.140","192.168.1.118","TLSv1.2","2770","Application Data, Application Data"
"422","0.731494201","199.232.37.140","192.168.1.118","TLSv1.2","4122","Application Data, Application Data, Application Data"
"423","0.731506902","199.232.37.140","192.168.1.118","TLSv1.2","2770","Application Data, Application Data"
"424","0.735179180","192.168.1.118","199.232.37.140","TLSv1.2","192","Client Key Exchange, Change Cipher Spec, Encrypted Handshake Message"
"425","0.739357377","199.232.37.140","192.168.1.118","TLSv1.2","2770","Application Data, Application Data"
"426","0.739419929","199.232.37.140","192.168.1.118","TLSv1.2","2770","Application Data, Application Data"
"427","0.739504044","199.232.37.140","192.168.1.118","TLSv1.2","2770","Application Data [TCP segment of a reassembled PDU]"
"428","0.739517195","199.232.37.140","192.168.1.118","TLSv1.2","2770","Application Data, Application Data"
"429","0.741939042","199.232.37.140","192.168.1.118","TLSv1.2","3649","Application Data, Application Data, Application Data, Application Data"
"430","0.742026870","192.168.1.118","199.232.37.140","TCP","66","40396 → 443 [ACK] Seq=1256 Ack=9235 Win=47616 Len=0 TSval=16851482 TSecr=2788633369"
"431","0.742068071","199.232.37.140","192.168.1.118","TLSv1.2","2770","Application Data, Application Data"
"432","0.742138086","199.232.37.140","192.168.1.118","TLSv1.2","2770","Application Data, Application Data"
"433","0.742173250","199.232.37.140","192.168.1.118","TLSv1.2","5083","Application Data, Application Data, Application Data, Application Data, Application Data"
"434","0.742206464","199.232.37.140","192.168.1.118","TLSv1.2","5474","Application Data, Application Data, Application Data, Application Data"
"435","0.742223514","199.232.37.140","192.168.1.118","TLSv1.2","1418","Application Data [TCP segment of a reassembled PDU]"
"436","0.752318480","199.232.37.140","192.168.1.118","TLSv1.2","4122","Application Data, Application Data, Application Data"
"437","0.754879170","199.232.37.140","192.168.1.118","TLSv1.2","1724","Application Data, Application Data"
"438","0.754956485","192.168.1.118","199.232.37.140","TCP","66","40404 → 443 [ACK] Seq=871 Ack=18478 Win=67712 Len=0 TSval=16851495 TSecr=3228072608"
"439","0.754999511","199.232.37.140","192.168.1.118","TLSv1.2","4122","Application Data, Application Data, Application Data"
"440","0.755029012","192.168.1.118","199.232.37.140","TCP","66","40405 → 443 [ACK] Seq=958 Ack=83186 Win=81664 Len=0 TSval=16851495 TSecr=250278090"
"441","0.755109353","199.232.37.140","192.168.1.118","TLSv1.2","117","Change Cipher Spec, Encrypted Handshake Message"
"442","0.755152292","199.232.37.140","192.168.1.118","TLSv1.2","5474","Application Data, Application Data, Application Data, Application Data"
"443","0.755195281","199.232.37.140","192.168.1.118","TLSv1.2","5474","Application Data, Application Data, Application Data, Application Data"
"444","0.755219232","199.232.37.140","192.168.1.118","TLSv1.2","2770","Application Data, Application Data"
"445","0.758128596","199.232.37.140","192.168.1.118","TLSv1.2","2770","Application Data, Application Data"
"446","0.759174845","199.232.37.140","192.168.1.118","TLSv1.2","117","Change Cipher Spec, Encrypted Handshake Message"
"447","0.763523160","192.168.1.118","199.232.37.140","TCP","66","40400 → 443 [ACK] Seq=919 Ack=68455 Win=88704 Len=0 TSval=16851504 TSecr=248732212"
"448","0.764484181","192.168.1.118","199.232.37.140","TCP","66","40401 → 443 [ACK] Seq=871 Ack=93493 Win=70144 Len=0 TSval=16851505 TSecr=3209066263"
"449","0.767516662","192.168.1.118","199.232.37.140","TCP","66","40406 → 443 [ACK] Seq=644 Ack=3322 Win=35840 Len=0 TSval=16851508 TSecr=1279673576"
"450","0.774483281","199.232.37.140","192.168.1.118","TLSv1.2","1418","Application Data [TCP segment of a reassembled PDU]"
"451","0.775784551","199.232.37.140","192.168.1.118","TLSv1.2","4122","Application Data, Application Data, Application Data"
"452","0.786564441","192.168.1.118","199.232.37.140","TLSv1","583","Client Hello"
"453","0.787878100","192.168.1.118","199.232.37.140","TLSv1.2","373","Application Data"
"454","0.788030843","192.168.1.118","199.232.37.140","TLSv1.2","341","Application Data"
"455","0.788637739","192.168.1.118","199.232.37.140","TLSv1.2","371","Application Data"
"456","0.789282361","192.168.1.118","199.232.37.140","TCP","66","40405 → 443 [ACK] Seq=958 Ack=104818 Win=60032 Len=0 TSval=16851529 TSecr=250278099"
"457","0.793171210","199.232.37.140","192.168.1.118","TLSv1.2","5474","Application Data, Application Data, Application Data"
"458","0.793329790","199.232.37.140","192.168.1.118","TLSv1.2","10882","Application Data, Application Data, Application Data, Application Data, Application Data, Application Data, Application Data, Application Data"
"459","0.793369742","199.232.37.140","192.168.1.118","TLSv1.2","5474","Application Data, Application Data, Application Data, Application Data"
"460","0.794512294","192.168.1.118","199.232.37.140","TCP","66","40407 → 443 [ACK] Seq=644 Ack=3300 Win=35712 Len=0 TSval=16851535 TSecr=249467645"
"461","0.800281884","199.232.37.140","192.168.1.118","TLSv1.2","5474","Application Data, Application Data, Application Data, Application Data"
"462","0.800396650","199.232.37.140","192.168.1.118","TLSv1.2","2770","Application Data, Application Data"
"463","0.803591375","199.232.37.140","192.168.1.118","TLSv1.2","2770","Application Data, Application Data"
"464","0.804502556","192.168.1.118","199.232.37.140","TCP","66","40408 → 443 [ACK] Seq=644 Ack=3322 Win=35840 Len=0 TSval=16851545 TSecr=3118305465"
"465","0.811700208","199.232.37.140","192.168.1.118","TLSv1.2","5474","Application Data, Application Data, Application Data, Application Data"
"466","0.811792624","199.232.37.140","192.168.1.118","TLSv1.2","5474","Application Data, Application Data, Application Data"
"467","0.818584499","199.232.37.140","192.168.1.118","TLSv1.2","5474","Application Data, Application Data, Application Data, Application Data"
"468","0.818663452","199.232.37.140","192.168.1.118","TCP","66","443 → 40409 [ACK] Seq=1 Ack=518 Win=28160 Len=0 TSval=2762749455 TSecr=16851527"
"469","0.818697253","199.232.37.140","192.168.1.118","TLSv1.2","3336","Server Hello, Certificate, Server Key Exchange, Server Hello Done"
"470","0.818734230","192.168.1.118","199.232.37.140","TCP","66","40409 → 443 [ACK] Seq=518 Ack=3271 Win=35840 Len=0 TSval=16851559 TSecr=2762749455"
"471","0.818781206","199.232.37.140","192.168.1.118","TLSv1.2","3323","Application Data, Application Data, Application Data"
"472","0.818808220","192.168.1.118","199.232.37.140","TCP","66","40397 → 443 [ACK] Seq=1252 Ack=10574 Win=50304 Len=0 TSval=16851559 TSecr=1091422979"
"473","0.818848296","199.232.37.140","192.168.1.118","TLSv1.2","10882","Application Data, Application Data, Application Data, Application Data, Application Data, Application Data, Application Data, Application Data"
"474","0.818864834","199.232.37.140","192.168.1.118","TLSv1.2","13586","Application Data, Application Data, Application Data, Application Data, Application Data, Application Data, Application Data, Application Data, Application Data, Application Data"
"475","0.818891960","192.168.1.118","199.232.37.140","TCP","66","40398 → 443 [ACK] Seq=1221 Ack=20702 Win=70528 Len=0 TSval=16851559 TSecr=3101148022"
"476","0.821484751","199.232.37.140","192.168.1.118","TLSv1.2","3531","Application Data, Application Data, Application Data, Application Data"
"477","0.821574054","192.168.1.118","199.232.37.140","TCP","66","40399 → 443 [ACK] Seq=1253 Ack=10661 Win=50432 Len=0 TSval=16851562 TSecr=3118305478"
"478","0.832512712","192.168.1.118","199.232.37.140","TCP","66","40405 → 443 [ACK] Seq=958 Ack=164306 Win=640 Len=0 TSval=16851573 TSecr=250278107"
"479","0.838609250","192.168.1.118","199.232.37.140","TLSv1","583","Client Hello"
"480","0.839003551","192.168.1.118","199.232.37.140","TLSv1.2","295","Application Data"
"481","0.841549041","199.232.37.140","192.168.1.118","TLSv1.2","1418","Application Data [TCP segment of a reassembled PDU]"
"482","0.842546863","192.168.1.118","199.232.37.140","TLSv1.2","348","Application Data"
"483","0.842846623","192.168.1.118","199.232.37.140","TLSv1.2","295","Application Data"
"484","0.843199936","199.232.37.140","192.168.1.118","TLSv1.2","5474","Application Data, Application Data, Application Data, Application Data"
"485","0.843286151","192.168.1.118","199.232.37.140","TCP","66","40398 → 443 [ACK] Seq=1221 Ack=27462 Win=84096 Len=0 TSval=16851583 TSecr=3101148030"
"486","0.843817895","199.232.37.140","192.168.1.118","TLSv1.2","9530","Application Data, Application Data, Application Data, Application Data, Application Data, Application Data"
"487","0.843856759","192.168.1.118","199.232.37.140","TCP","66","40398 → 443 [ACK] Seq=1221 Ack=36926 Win=103040 Len=0 TSval=16851584 TSecr=3101148030"
"488","0.845156879","192.168.1.118","199.232.37.140","TLSv1.2","192","Client Key Exchange, Change Cipher Spec, Encrypted Handshake Message"
"489","0.847906563","192.168.1.118","199.232.37.140","TLSv1.2","370","Application Data"
"490","0.848299352","199.232.37.140","192.168.1.118","TLSv1.2","2770","Application Data, Application Data"
"491","0.848380542","192.168.1.118","199.232.37.140","TCP","66","40398 → 443 [ACK] Seq=1221 Ack=39630 Win=108416 Len=0 TSval=16851588 TSecr=3101148030"
"492","0.854042678","199.232.37.140","192.168.1.118","TLSv1.2","2770","Application Data, Application Data"
"493","0.854120981","192.168.1.118","199.232.37.140","TCP","66","40398 → 443 [ACK] Seq=1221 Ack=42334 Win=113792 Len=0 TSval=16851594 TSecr=3101148030"
"494","0.855677610","199.232.37.140","192.168.1.118","TLSv1.2","2770","Application Data, Application Data"
"495","0.855757625","192.168.1.118","199.232.37.140","TCP","66","40398 → 443 [ACK] Seq=1221 Ack=45038 Win=119296 Len=0 TSval=16851596 TSecr=3101148031"
"496","0.857658167","199.232.37.140","192.168.1.118","TCP","66","443 → 40410 [ACK] Seq=1 Ack=518 Win=28160 Len=0 TSval=3120309570 TSecr=16851579"
"497","0.857731119","199.232.37.140","192.168.1.118","TLSv1.2","2770","Application Data, Application Data"
"498","0.857765058","192.168.1.118","199.232.37.140","TCP","66","40398 → 443 [ACK] Seq=1221 Ack=47742 Win=121472 Len=0 TSval=16851598 TSecr=3101148032"
"499","0.858410493","199.232.37.140","192.168.1.118","TLSv1.2","3336","Server Hello, Certificate, Server Key Exchange, Server Hello Done"
"500","0.858473595","192.168.1.118","199.232.37.140","TCP","66","[TCP Window Update] 40405 → 443 [ACK] Seq=958 Ack=164306 Win=18432 Len=0 TSval=16851598 TSecr=250278107"
"501","0.858514847","192.168.1.118","199.232.37.140","TCP","66","40410 → 443 [ACK] Seq=518 Ack=3271 Win=35840 Len=0 TSval=16851599 TSecr=3120309570"
"502","0.860555618","192.168.1.118","199.232.37.140","TLSv1.2","192","Client Key Exchange, Change Cipher Spec, Encrypted Handshake Message"
"503","0.860874029","199.232.37.140","192.168.1.118","TLSv1.2","1418","Application Data [TCP segment of a reassembled PDU]"
"504","0.863044468","199.232.37.140","192.168.1.118","TLSv1.2","1418","Application Data [TCP segment of a reassembled PDU]"
"505","0.863098395","199.232.37.140","192.168.1.118","TLSv1.2","8178","Application Data, Application Data, Application Data, Application Data, Application Data, Application Data"
"506","0.863152897","192.168.1.118","199.232.37.140","TCP","66","40406 → 443 [ACK] Seq=873 Ack=11434 Win=51968 Len=0 TSval=16851603 TSecr=1279673715"
"507","0.864115168","192.168.1.118","199.232.37.140","TCP","66","40398 → 443 [ACK] Seq=1221 Ack=50446 Win=118784 Len=0 TSval=16851604 TSecr=3101148035"
"508","0.867204113","199.232.37.140","192.168.1.118","TLSv1.2","5474","Application Data, Application Data, Application Data, Application Data"
"509","0.867291529","192.168.1.118","199.232.37.140","TCP","66","40406 → 443 [ACK] Seq=873 Ack=16842 Win=62848 Len=0 TSval=16851607 TSecr=1279673715"
"510","0.867328655","199.232.37.140","192.168.1.118","TLSv1.2","2770","Application Data, Application Data"
"511","0.867355319","192.168.1.118","199.232.37.140","TCP","66","40398 → 443 [ACK] Seq=1221 Ack=53150 Win=130048 Len=0 TSval=16851607 TSecr=3101148035"
"512","0.869319175","199.232.37.140","192.168.1.118","TLSv1.2","2770","Application Data, Application Data"
"513","0.869389177","192.168.1.118","199.232.37.140","TCP","66","40398 → 443 [ACK] Seq=1221 Ack=55854 Win=135424 Len=0 TSval=16851609 TSecr=3101148035"
"514","0.869465968","199.232.37.140","192.168.1.118","TLSv1.2","3880","Application Data, Application Data, Application Data, Application Data"
"515","0.869499369","192.168.1.118","199.232.37.140","TCP","66","40396 → 443 [ACK] Seq=1560 Ack=13049 Win=55296 Len=0 TSval=16851610 TSecr=2788633403"
"516","0.869530107","199.232.37.140","192.168.1.118","TLSv1.2","2770","Application Data, Application Data"
"517","0.869549983","192.168.1.118","199.232.37.140","TCP","66","40398 → 443 [ACK] Seq=1221 Ack=58558 Win=135808 Len=0 TSval=16851610 TSecr=3101148036"
"518","0.869562509","199.232.37.140","192.168.1.118","TLSv1.2","1418","Application Data"
"519","0.869586597","192.168.1.118","199.232.37.140","TCP","66","40407 → 443 [ACK] Seq=926 Ack=4652 Win=38400 Len=0 TSval=16851610 TSecr=249467675"
"520","0.876420661","199.232.37.140","192.168.1.118","TLSv1.2","5474","Application Data, Application Data, Application Data, Application Data"
"521","0.876527777","192.168.1.118","199.232.37.140","TCP","66","40407 → 443 [ACK] Seq=926 Ack=10060 Win=49280 Len=0 TSval=16851617 TSecr=249467675"
"522","0.876566516","199.232.37.140","192.168.1.118","TLSv1.2","133","Application Data"
"523","0.876588829","192.168.1.118","199.232.37.140","TCP","66","40407 → 443 [ACK] Seq=926 Ack=10127 Win=49280 Len=0 TSval=16851617 TSecr=249467675"
"524","0.876615993","199.232.37.140","192.168.1.118","TLSv1.2","2770","Application Data, Application Data"
"525","0.876650444","199.232.37.140","192.168.1.118","TLSv1.2","2770","Application Data, Application Data"
"526","0.876685595","192.168.1.118","199.232.37.140","TCP","66","[TCP Window Update] 40405 → 443 [ACK] Seq=958 Ack=164306 Win=53632 Len=0 TSval=16851617 TSecr=250278107"
"527","0.876842388","192.168.1.118","199.232.37.140","TCP","66","40398 → 443 [ACK] Seq=1221 Ack=63966 Win=130432 Len=0 TSval=16851617 TSecr=3101148037"
"528","0.878639389","199.232.37.140","192.168.1.118","TLSv1.2","2770","Application Data, Application Data"
"529","0.878700866","199.232.37.140","192.168.1.118","TLSv1.2","117","Change Cipher Spec, Encrypted Handshake Message"
"530","0.878794244","199.232.37.140","192.168.1.118","TLSv1.2","2770","Application Data, Application Data"
"531","0.878807732","199.232.37.140","192.168.1.118","TLSv1.2","13586","Application Data, Application Data, Application Data, Application Data, Application Data, Application Data, Application Data, Application Data, Application Data, Application Data"
"532","0.878871722","192.168.1.118","199.232.37.140","TCP","66","40408 → 443 [ACK] Seq=873 Ack=16842 Win=62848 Len=0 TSval=16851619 TSecr=3118305494"
"533","0.881758673","192.168.1.118","199.232.37.140","TLSv1.2","295","Application Data"
"534","0.881888627","192.168.1.118","199.232.37.140","TCP","66","40398 → 443 [ACK] Seq=1221 Ack=69374 Win=125056 Len=0 TSval=16851622 TSecr=3101148037"
"535","0.890223494","199.232.37.140","192.168.1.118","TLSv1.2","5474","Application Data, Application Data, Application Data"
"536","0.890304359","192.168.1.118","199.232.37.140","TCP","66","40398 → 443 [ACK] Seq=1221 Ack=74782 Win=146048 Len=0 TSval=16851630 TSecr=3101148038"
"537","0.890375462","199.232.37.140","192.168.1.118","TLSv1.2","5474","Application Data, Application Data, Application Data, Application Data"
"538","0.890392613","199.232.37.140","192.168.1.118","TLSv1.2","12234","Application Data, Application Data, Application Data, Application Data, Application Data, Application Data, Application Data, Application Data, Application Data"
"539","0.890417951","192.168.1.118","199.232.37.140","TCP","66","40405 → 443 [ACK] Seq=958 Ack=176474 Win=64256 Len=0 TSval=16851630 TSecr=250278133"
"540","0.892027207","192.168.1.118","199.232.37.140","TCP","66","40398 → 443 [ACK] Seq=1221 Ack=80190 Win=140672 Len=0 TSval=16851632 TSecr=3101148039"
"541","0.892221514","199.232.37.140","192.168.1.118","TLSv1.2","558","Application Data"
"542","0.892296304","199.232.37.140","192.168.1.118","TLSv1.2","117","Change Cipher Spec, Encrypted Handshake Message"
"543","0.892330393","199.232.37.140","192.168.1.118","TLSv1.2","2770","Application Data, Application Data"
"544","0.892358256","199.232.37.140","192.168.1.118","TLSv1.2","2770","Application Data, Application Data"
"545","0.892476685","199.232.37.140","192.168.1.118","TLSv1.2","5474","Application Data, Application Data, Application Data, Application Data"
"546","0.892509462","199.232.37.140","192.168.1.118","TLSv1.2","5251","Application Data, Application Data, Application Data, Application Data, Application Data"
"547","0.892544600","199.232.37.140","192.168.1.118","TLSv1.2","2770","Application Data, Application Data"
"548","0.892581252","192.168.1.118","199.232.37.140","TCP","66","40406 → 443 [ACK] Seq=873 Ack=19546 Win=68224 Len=0 TSval=16851633 TSecr=1279673745"
"549","0.894627148","192.168.1.118","199.232.37.140","TLSv1.2","295","Application Data"
"550","0.894786054","192.168.1.118","199.232.37.140","TCP","66","40398 → 443 [ACK] Seq=1221 Ack=96191 Win=124672 Len=0 TSval=16851635 TSecr=3101148039"
"551","0.910071176","199.232.37.140","192.168.1.118","TLSv1.2","12234","Application Data, Application Data, Application Data, Application Data, Application Data, Application Data, Application Data, Application Data"
"552","0.910151604","192.168.1.118","199.232.37.140","TCP","66","40406 → 443 [ACK] Seq=873 Ack=31714 Win=92544 Len=0 TSval=16851650 TSecr=1279673745"
"553","0.910200906","199.232.37.140","192.168.1.118","TLSv1.2","2770","Application Data, Application Data"
"554","0.910223219","192.168.1.118","199.232.37.140","TCP","66","40406 → 443 [ACK] Seq=873 Ack=34418 Win=98048 Len=0 TSval=16851650 TSecr=1279673745"
"555","0.916777386","199.232.37.140","192.168.1.118","TLSv1.2","2770","Application Data, Application Data"
"556","0.916864327","192.168.1.118","199.232.37.140","TCP","66","40406 → 443 [ACK] Seq=873 Ack=37122 Win=103424 Len=0 TSval=16851657 TSecr=1279673745"
"557","0.916903315","199.232.37.140","192.168.1.118","TLSv1.2","5474","Application Data, Application Data, Application Data, Application Data"
"558","0.916928966","192.168.1.118","199.232.37.140","TCP","66","40408 → 443 [ACK] Seq=873 Ack=22250 Win=73600 Len=0 TSval=16851657 TSecr=3118305500"
"559","0.917023557","199.232.37.140","192.168.1.118","TLSv1.2","9530","Application Data, Application Data, Application Data, Application Data, Application Data, Application Data"
"560","0.917049320","192.168.1.118","199.232.37.140","TCP","66","40408 → 443 [ACK] Seq=873 Ack=31714 Win=92544 Len=0 TSval=16851657 TSecr=3118305500"
"561","0.917074646","199.232.37.140","192.168.1.118","TLSv1.2","4122","Application Data, Application Data, Application Data"
"562","0.917104660","192.168.1.118","199.232.37.140","TCP","66","40409 → 443 [ACK] Seq=873 Ack=7378 Win=43904 Len=0 TSval=16851657 TSecr=2762749478"
"563","0.919191620","199.232.37.140","192.168.1.118","TLSv1.2","5991","Application Data, Application Data, Application Data, Application Data, Application Data"
"564","0.919273448","192.168.1.118","199.232.37.140","TCP","66","40409 → 443 [ACK] Seq=873 Ack=13303 Win=55808 Len=0 TSval=16851659 TSecr=2762749478"
"565","0.919386477","199.232.37.140","192.168.1.118","TLSv1.2","2770","Application Data, Application Data"
"566","0.919410603","192.168.1.118","199.232.37.140","TCP","66","40406 → 443 [ACK] Seq=873 Ack=39826 Win=108800 Len=0 TSval=16851659 TSecr=1279673748"
"567","0.919435704","199.232.37.140","192.168.1.118","TLSv1.2","2770","Application Data, Application Data"
"568","0.919472793","192.168.1.118","199.232.37.140","TCP","66","40408 → 443 [ACK] Seq=873 Ack=34418 Win=98048 Len=0 TSval=16851660 TSecr=3118305500"
"569","0.919485106","199.232.37.140","192.168.1.118","TLSv1.2","1418","Application Data [TCP segment of a reassembled PDU]"
"570","0.919503644","192.168.1.118","199.232.37.140","TCP","66","40406 → 443 [ACK] Seq=873 Ack=41178 Win=111488 Len=0 TSval=16851660 TSecr=1279673750"
"571","0.922459847","199.232.37.140","192.168.1.118","TLSv1.2","1418","Application Data [TCP segment of a reassembled PDU]"
"572","0.922532512","192.168.1.118","199.232.37.140","TCP","66","40406 → 443 [ACK] Seq=873 Ack=42530 Win=114176 Len=0 TSval=16851663 TSecr=1279673750"
"573","0.922591764","199.232.37.140","192.168.1.118","TLSv1.2","2770","Application Data, Application Data"
"574","0.922618790","192.168.1.118","199.232.37.140","TCP","66","40408 → 443 [ACK] Seq=873 Ack=37122 Win=103424 Len=0 TSval=16851663 TSecr=3118305500"
"575","0.922648016","199.232.37.140","192.168.1.118","TLSv1.2","1418","Application Data [TCP segment of a reassembled PDU]"
"576","0.922665667","192.168.1.118","199.232.37.140","TCP","66","40406 → 443 [ACK] Seq=873 Ack=43882 Win=116864 Len=0 TSval=16851663 TSecr=1279673753"
"577","0.922675705","199.232.37.140","192.168.1.118","TLSv1.2","2770","Application Data, Application Data"
"578","0.922692518","192.168.1.118","199.232.37.140","TCP","66","40408 → 443 [ACK] Seq=873 Ack=39826 Win=108800 Len=0 TSval=16851663 TSecr=3118305501"
"579","0.925847653","199.232.37.140","192.168.1.118","TLSv1.2","2770","Application Data, Application Data"
"580","0.925932081","192.168.1.118","199.232.37.140","TCP","66","40408 → 443 [ACK] Seq=873 Ack=42530 Win=114176 Len=0 TSval=16851666 TSecr=3118305502"
"581","0.925996934","199.232.37.140","192.168.1.118","TLSv1.2","5474","Application Data, Application Data, Application Data, Application Data"
"582","0.926019547","192.168.1.118","199.232.37.140","TCP","66","40406 → 443 [ACK] Seq=873 Ack=49290 Win=127744 Len=0 TSval=16851666 TSecr=1279673771"
"583","0.926035747","199.232.37.140","192.168.1.118","TLSv1.2","1418","Application Data [TCP segment of a reassembled PDU]"
"584","0.926055811","192.168.1.118","199.232.37.140","TCP","66","40408 → 443 [ACK] Seq=873 Ack=43882 Win=116864 Len=0 TSval=16851666 TSecr=3118305504"
"585","0.930277333","199.232.37.140","192.168.1.118","TLSv1.2","1418","Application Data"
"586","0.931515652","192.168.1.118","199.232.37.140","TCP","66","40405 → 443 [ACK] Seq=958 Ack=176966 Win=119808 Len=0 TSval=16851672 TSecr=250278133"
"587","0.934508794","199.232.37.140","192.168.1.118","TLSv1.2","5474","Application Data, Application Data, Application Data, Application Data"
"588","0.934585047","192.168.1.118","199.232.37.140","TCP","66","40410 → 443 [ACK] Seq=873 Ack=10082 Win=49280 Len=0 TSval=16851675 TSecr=3120309588"
"589","0.934705426","199.232.37.140","192.168.1.118","TLSv1.2","6826","Application Data, Application Data, Application Data, Application Data, Application Data"
"590","0.934734864","192.168.1.118","199.232.37.140","TCP","66","40410 → 443 [ACK] Seq=873 Ack=16842 Win=62848 Len=0 TSval=16851675 TSecr=3120309588"
"591","0.936561378","199.232.37.140","192.168.1.118","TLSv1.2","1418","Application Data [TCP segment of a reassembled PDU]"
"592","0.936635931","192.168.1.118","199.232.37.140","TCP","66","40406 → 443 [ACK] Seq=873 Ack=50642 Win=130432 Len=0 TSval=16851677 TSecr=1279673790"
"593","0.943005741","199.232.37.140","192.168.1.118","TLSv1.2","4122","Application Data, Application Data, Application Data"
"594","0.943085482","192.168.1.118","199.232.37.140","TCP","66","40406 → 443 [ACK] Seq=873 Ack=54698 Win=138496 Len=0 TSval=16851683 TSecr=1279673790"
"595","0.945908506","199.232.37.140","192.168.1.118","TLSv1.2","2770","Application Data, Application Data"
"596","0.945986021","192.168.1.118","199.232.37.140","TCP","66","40406 → 443 [ACK] Seq=873 Ack=57402 Win=144000 Len=0 TSval=16851686 TSecr=1279673790"
"597","0.946039010","199.232.37.140","192.168.1.118","TLSv1.2","2770","Application Data, Application Data"
"598","0.946059961","192.168.1.118","199.232.37.140","TCP","66","40406 → 443 [ACK] Seq=873 Ack=60106 Win=149376 Len=0 TSval=16851686 TSecr=1279673791"
"599","0.946102687","199.232.37.140","192.168.1.118","TLSv1.2","2770","Application Data, Application Data"
"600","0.946122813","192.168.1.118","199.232.37.140","TCP","66","40406 → 443 [ACK] Seq=873 Ack=62810 Win=154752 Len=0 TSval=16851686 TSecr=1279673793"
"601","0.946149639","199.232.37.140","192.168.1.118","TLSv1.2","2770","Application Data, Application Data"
"602","0.946169052","192.168.1.118","199.232.37.140","TCP","66","40406 → 443 [ACK] Seq=873 Ack=65514 Win=160128 Len=0 TSval=16851686 TSecr=1279673794"
"603","0.946203966","199.232.37.140","192.168.1.118","TLSv1.2","5474","Application Data, Application Data, Application Data"
"604","0.946225804","192.168.1.118","199.232.37.140","TCP","66","40406 → 443 [ACK] Seq=873 Ack=70922 Win=158720 Len=0 TSval=16851686 TSecr=1279673795"
"605","0.950559556","199.232.37.140","192.168.1.118","TLSv1.2","2770","Application Data, Application Data"
"606","0.950638209","192.168.1.118","199.232.37.140","TCP","66","40406 → 443 [ACK] Seq=873 Ack=73626 Win=156032 Len=0 TSval=16851691 TSecr=1279673797"
"607","0.950694861","199.232.37.140","192.168.1.118","TLSv1.2","5474","Application Data, Application Data, Application Data, Application Data"
"608","0.950716474","192.168.1.118","199.232.37.140","TCP","66","40408 → 443 [ACK] Seq=873 Ack=49290 Win=127744 Len=0 TSval=16851691 TSecr=3118305512"
"609","0.950735674","199.232.37.140","192.168.1.118","TLSv1.2","2770","Application Data, Application Data"
"610","0.950757775","192.168.1.118","199.232.37.140","TCP","66","40406 → 443 [ACK] Seq=873 Ack=76330 Win=153344 Len=0 TSval=16851691 TSecr=1279673798"
"611","0.950780364","199.232.37.140","192.168.1.118","TLSv1.2","1418","Application Data [TCP segment of a reassembled PDU]"
"612","0.950796864","192.168.1.118","199.232.37.140","TCP","66","40406 → 443 [ACK] Seq=873 Ack=77682 Win=152064 Len=0 TSval=16851691 TSecr=1279673799"
"613","0.964363964","199.232.37.140","192.168.1.118","TLSv1.2","1418","Application Data [TCP segment of a reassembled PDU]"
"614","0.964464742","192.168.1.118","199.232.37.140","TCP","66","40406 → 443 [ACK] Seq=873 Ack=79034 Win=150784 Len=0 TSval=16851704 TSecr=1279673799"
"615","0.964506594","199.232.37.140","192.168.1.118","TLSv1.2","2770","Application Data, Application Data"
"616","0.964531207","192.168.1.118","199.232.37.140","TCP","66","40408 → 443 [ACK] Seq=873 Ack=51994 Win=133120 Len=0 TSval=16851705 TSecr=3118305512"
"617","0.964544070","199.232.37.140","192.168.1.118","TLSv1.2","1418","Application Data [TCP segment of a reassembled PDU]"
"618","0.964568646","192.168.1.118","199.232.37.140","TCP","66","40406 → 443 [ACK] Seq=873 Ack=80386 Win=149504 Len=0 TSval=16851705 TSecr=1279673800"
"619","0.964637661","199.232.37.140","192.168.1.118","TLSv1.2","1418","Application Data [TCP segment of a reassembled PDU]"
"620","0.964680362","199.232.37.140","192.168.1.118","TLSv1.2","2770","Application Data, Application Data"
"621","0.964717439","199.232.37.140","192.168.1.118","TLSv1.2","1697","Application Data, Application Data"
"622","0.964738890","192.168.1.118","199.232.37.140","TCP","66","40410 → 443 [ACK] Seq=873 Ack=18473 Win=66048 Len=0 TSval=16851705 TSecr=3120309593"
"623","0.964758115","199.232.37.140","192.168.1.118","TLSv1.2","2770","Application Data, Application Data"
"624","0.964780378","199.232.37.140","192.168.1.118","TLSv1.2","2770","Application Data, Application Data"
"625","0.964799667","192.168.1.118","199.232.37.140","TCP","66","40408 → 443 [ACK] Seq=873 Ack=54698 Win=138496 Len=0 TSval=16851705 TSecr=3118305512"
"626","0.964820105","199.232.37.140","192.168.1.118","TLSv1.2","2770","Application Data, Application Data"
"627","0.964844318","199.232.37.140","192.168.1.118","TLSv1.2","2770","Application Data, Application Data"
"628","0.964863631","199.232.37.140","192.168.1.118","TLSv1.2","2770","Application Data, Application Data"
"629","0.964882320","199.232.37.140","192.168.1.118","TLSv1.2","5474","Application Data, Application Data, Application Data, Application Data"
"630","0.964902945","192.168.1.118","199.232.37.140","TCP","66","40408 → 443 [ACK] Seq=873 Ack=60106 Win=149376 Len=0 TSval=16851705 TSecr=3118305513"
"631","0.964929609","199.232.37.140","192.168.1.118","TLSv1.2","2770","Application Data, Application Data"
"632","0.964941784","199.232.37.140","192.168.1.118","TLSv1.2","5474","Application Data, Application Data, Application Data, Application Data"
"633","0.964960460","192.168.1.118","199.232.37.140","TCP","66","40408 → 443 [ACK] Seq=873 Ack=65514 Win=158720 Len=0 TSval=16851705 TSecr=3118305514"
"634","0.965033100","192.168.1.118","199.232.37.140","TCP","66","40406 → 443 [ACK] Seq=873 Ack=97962 Win=131968 Len=0 TSval=16851705 TSecr=1279673800"
"635","0.967590202","199.232.37.140","192.168.1.118","TLSv1.2","2770","Application Data, Application Data"
"636","0.967660504","199.232.37.140","192.168.1.118","TLSv1.2","2770","Application Data [TCP segment of a reassembled PDU]"
"637","0.967697281","192.168.1.118","199.232.37.140","TCP","66","40408 → 443 [ACK] Seq=873 Ack=68218 Win=156032 Len=0 TSval=16851708 TSecr=3118305515"
"638","0.967729769","199.232.37.140","192.168.1.118","TLSv1.2","2770","Application Data, Application Data"
"639","0.967807847","199.232.37.140","192.168.1.118","TLSv1.2","2770","Application Data, Application Data"
"640","0.967832560","199.232.37.140","192.168.1.118","TLSv1.2","2770","Application Data [TCP segment of a reassembled PDU]"
"641","0.967865561","199.232.37.140","192.168.1.118","TLSv1.2","5474","Application Data, Application Data, Application Data, Application Data"
"642","0.967884412","192.168.1.118","199.232.37.140","TCP","66","40408 → 443 [ACK] Seq=873 Ack=73626 Win=150656 Len=0 TSval=16851708 TSecr=3118305515"
"643","0.967893850","199.232.37.140","192.168.1.118","TLSv1.2","2770","Application Data, Application Data"
"644","0.977710981","199.232.37.140","192.168.1.118","TLSv1.2","78","Application Data"
"645","0.977803734","199.232.37.140","192.168.1.118","TLSv1.2","5474","Application Data, Application Data, Application Data, Application Data"
"646","0.977852736","192.168.1.118","199.232.37.140","TCP","66","40408 → 443 [ACK] Seq=873 Ack=79034 Win=145280 Len=0 TSval=16851718 TSecr=3118305516"
"647","0.977953390","199.232.37.140","192.168.1.118","TLSv1.2","2770","Application Data, Application Data"
"648","0.977976440","192.168.1.118","199.232.37.140","TCP","66","40408 → 443 [ACK] Seq=873 Ack=81738 Win=142592 Len=0 TSval=16851718 TSecr=3118305516"
"649","0.978016517","199.232.37.140","192.168.1.118","TLSv1.2","5474","Application Data, Application Data, Application Data, Application Data"
"650","0.978038893","192.168.1.118","199.232.37.140","TCP","66","40408 → 443 [ACK] Seq=873 Ack=87146 Win=137216 Len=0 TSval=16851718 TSecr=3118305517"
"651","0.978062081","199.232.37.140","192.168.1.118","TLSv1.2","2770","Application Data, Application Data"
"652","0.978081869","192.168.1.118","199.232.37.140","TCP","66","40406 → 443 [ACK] Seq=873 Ack=111494 Win=118528 Len=0 TSval=16851718 TSecr=1279673808"
"653","0.978127458","192.168.1.118","199.232.37.140","TCP","66","40408 → 443 [ACK] Seq=873 Ack=89850 Win=134528 Len=0 TSval=16851718 TSecr=3118305518"
"654","0.979811905","199.232.37.140","192.168.1.118","TLSv1.2","4122","Application Data, Application Data, Application Data"
"655","0.979910871","192.168.1.118","199.232.37.140","TCP","66","40408 → 443 [ACK] Seq=873 Ack=93906 Win=130560 Len=0 TSval=16851720 TSecr=3118305518"
"656","0.982471085","199.232.37.140","192.168.1.118","TLSv1.2","1418","Application Data [TCP segment of a reassembled PDU]"
"657","0.982541763","199.232.37.140","192.168.1.118","TLSv1.2","2770","Application Data, Application Data"
"658","0.982582277","192.168.1.118","199.232.37.140","TCP","66","40408 → 443 [ACK] Seq=873 Ack=97962 Win=137856 Len=0 TSval=16851723 TSecr=3118305518"
"659","0.997502124","199.232.37.140","192.168.1.118","TLSv1.2","8178","Application Data, Application Data, Application Data, Application Data, Application Data, Application Data"
"660","0.997581439","192.168.1.118","199.232.37.140","TCP","66","40408 → 443 [ACK] Seq=873 Ack=106074 Win=171008 Len=0 TSval=16851738 TSecr=3118305521"
"661","0.997693905","199.232.37.140","192.168.1.118","TLSv1.2","2770","Application Data [TCP segment of a reassembled PDU]"
"662","0.997747632","199.232.37.140","192.168.1.118","TLSv1.2","8178","Application Data, Application Data, Application Data, Application Data, Application Data, Application Data"
"663","0.997772758","199.232.37.140","192.168.1.118","TLSv1.2","2770","Application Data, Application Data"
"664","0.997826773","192.168.1.118","199.232.37.140","TCP","66","40408 → 443 [ACK] Seq=873 Ack=108778 Win=168320 Len=0 TSval=16851738 TSecr=3118305521"
"665","0.997970665","192.168.1.118","199.232.37.140","TCP","66","40408 → 443 [ACK] Seq=873 Ack=119594 Win=157568 Len=0 TSval=16851738 TSecr=3118305524"
"666","1.015423788","199.232.37.140","192.168.1.118","TLSv1.2","2770","Application Data, Application Data"
"667","1.015499229","199.232.37.140","192.168.1.118","TLSv1.2","685","Application Data, Application Data"
"668","1.055518492","192.168.1.118","199.232.37.140","TCP","66","40408 → 443 [ACK] Seq=873 Ack=122917 Win=154368 Len=0 TSval=16851796 TSecr=3118305524"
"669","1.174196295","140.82.114.25","192.168.1.118","TLSv1.2","90","Application Data"
"670","1.174541270","192.168.1.118","140.82.114.25","TLSv1.2","94","Application Data"
"671","1.195474702","140.82.114.25","192.168.1.118","TCP","66","443 → 42032 [ACK] Seq=25 Ack=29 Win=31 Len=0 TSval=2366196484 TSecr=16851915"
"672","1.325626595","192.168.1.118","199.232.37.140","TLSv1.2","249","Application Data"
"673","1.350374386","199.232.37.140","192.168.1.118","TLSv1.2","1151","Application Data, Application Data"
"674","1.350489653","192.168.1.118","199.232.37.140","TCP","66","40392 → 443 [ACK] Seq=1223 Ack=16764 Win=63104 Len=0 TSval=16852091 TSecr=250251895"
"675","2.079528568","192.168.1.100","224.0.0.251","MDNS","491","Standard query 0x0000 PTR _uscan._tcp.local, "QM" question PTR _ippusb._tcp.local, "QM" question PTR _uscans._tcp.local, "QM" question PTR _scanner._tcp.local, "QM" question PTR _ipp._tcp.local, "QM" question PTR _ipps._tcp.local, "QM" question PTR _printer._tcp.local, "QM" question PTR _pdl-datastream._tcp.local, "QM" question PTR _ptp._tcp.local, "QM" question PTR _airplay._tcp.local, "QM" question PTR _raop._tcp.local, "QM" question PTR _airport._tcp.local, "QM" question PTR _rdlink._tcp.local, "QM" question PTR _companion-link._tcp.local, "QM" question PTR _googlecast._tcp.local, "QM" question PTR _apple-mobdev._tcp.local, "QM" question PTR 8ed307c3._sub._apple-mobdev2._tcp.local, "QM" question PTR _apple-pairable._tcp.local, "QM" question TXT Google-Home-Mini-2c3f16b2da5c4b6fd6cfbfba61c12490._googlecast._tcp.local, "QM" question PTR _homekit._tcp.local, "QM" question PTR cjqg._companion-link._tcp.local PTR Google-Home-Mini-2c3f16b2da5c4b6fd6cfbfba61c12490._googlecast._tcp.local OPT"
"676","2.179790190","192.168.1.102","224.0.0.251","MDNS","183","Standard query response 0x0000 SRV, cache flush 0 0 8009 2c3f16b2-da5c-4b6f-d6cf-bfba61c12490.local"
"677","2.998615622","192.168.1.104","255.255.255.255","UDP","217","49154 → 6666 Len=175"
"678","5.660160973","192.168.1.118","192.168.1.102","TCP","176","33923 → 8009 [PSH, ACK] Seq=111 Ack=111 Win=364 Len=110 TSval=16856400 TSecr=4230954 [TCP segment of a reassembled PDU]"
"679","5.680340929","192.168.1.102","192.168.1.118","TCP","176","8009 → 33923 [PSH, ACK] Seq=111 Ack=221 Win=294 Len=110 TSval=4231457 TSecr=16856400 [TCP segment of a reassembled PDU]"
"680","5.680461633","192.168.1.118","192.168.1.102","TCP","66","33923 → 8009 [ACK] Seq=221 Ack=221 Win=364 Len=0 TSval=16856420 TSecr=4231457"
"681","5.968339434","192.168.1.104","255.255.255.255","UDP","217","49154 → 6666 Len=175"
"682","8.938341555","192.168.1.104","255.255.255.255","UDP","217","49154 → 6666 Len=175"
"683","9.099517121","192.168.1.118","23.43.56.209","TCP","66","34874 → 80 [ACK] Seq=1 Ack=1 Win=237 Len=0 TSval=16859840 TSecr=2442911869"
"684","9.118610001","23.43.56.209","192.168.1.118","TCP","66","[TCP ACKed unseen segment] 80 → 34874 [ACK] Seq=1 Ack=2 Win=235 Len=0 TSval=2442921911 TSecr=16749397"
"685","9.131511165","192.168.1.118","23.43.56.209","TCP","66","34873 → 80 [ACK] Seq=1 Ack=1 Win=237 Len=0 TSval=16859872 TSecr=2442911869"
"686","9.149062755","23.43.56.209","192.168.1.118","TCP","66","[TCP ACKed unseen segment] 80 → 34873 [ACK] Seq=1 Ack=2 Win=235 Len=0 TSval=2442921942 TSecr=16749332"
