frame.number,_ws.col.Time,_ws.col.Source,_ws.col.Destination,_ws.col.Protocol,frame.len,_ws.col.Info
"1","0.000000000","35.186.208.48","192.168.1.118","SSL","1484","Continuation Data"
"2","0.000083890","192.168.1.118","35.186.208.48","TCP","94","[TCP ACKed unseen segment] 34550 → 443 [ACK] Seq=1 Ack=11345 Win=4346 Len=0 TSval=17153437 TSecr=3529495451 SLE=35451 SRE=65795 SLE=24107 SRE=34033 SLE=14181 SRE=22689"
"3","0.000129417","35.186.208.48","192.168.1.118","SSL","1484","Continuation Data"
"4","0.000151417","192.168.1.118","35.186.208.48","TCP","86","34551 → 443 [ACK] Seq=1 Ack=1419 Win=4342 Len=0 TSval=17153437 TSecr=3098647149 SLE=7091 SRE=10105 SLE=2837 SRE=5673"
"5","0.000199294","35.186.208.48","192.168.1.118","SSL","1484","Continuation Data"
"6","0.000221745","192.168.1.118","35.186.208.48","TCP","78","[TCP ACKed unseen segment] 34549 → 443 [ACK] Seq=1 Ack=2837 Win=3806 Len=0 TSval=17153437 TSecr=2563783801 SLE=5673 SRE=116242"
"7","0.000232345","35.186.208.48","192.168.1.118","SSL","2902","Continuation Data"
"8","0.000251883","192.168.1.118","35.186.208.48","TCP","78","34548 → 443 [ACK] Seq=1 Ack=4294892143 Win=1347 Len=0 TSval=17153437 TSecr=3556836735 SLE=4294893561 SRE=2837"
"9","0.000260959","35.186.208.48","192.168.1.118","SSL","2902","[TCP Previous segment not captured] , Continuation Data"
"10","0.000279284","192.168.1.118","35.186.208.48","TCP","86","[TCP ACKed unseen segment] 34550 → 443 [ACK] Seq=1 Ack=22689 Win=4317 Len=0 TSval=17153437 TSecr=3529495452 SLE=35451 SRE=65795 SLE=24107 SRE=34033"
"11","0.000287597","35.186.208.48","192.168.1.118","SSL","1484","Continuation Data"
"12","0.000304860","192.168.1.118","35.186.208.48","TCP","78","[TCP ACKed unseen segment] 34551 → 443 [ACK] Seq=1 Ack=5673 Win=4309 Len=0 TSval=17153437 TSecr=3098647150 SLE=7091 SRE=10105"
"13","0.000313061","35.186.208.48","192.168.1.118","SSL","1484","Continuation Data"
"14","0.000331086","192.168.1.118","35.186.208.48","TCP","86","34552 → 443 [ACK] Seq=1 Ack=4294809899 Win=3841 Len=0 TSval=17153437 TSecr=3133544541 SLE=4294816989 SRE=1419 SLE=4294811317 SRE=4294814153"
"15","0.006484127","35.186.208.48","192.168.1.118","SSL","1484","[TCP Previous segment not captured] , Continuation Data"
"16","0.006585755","192.168.1.118","35.186.208.48","TCP","78","[TCP ACKed unseen segment] 34550 → 443 [ACK] Seq=1 Ack=34033 Win=4301 Len=0 TSval=17153444 TSecr=3529495452 SLE=35451 SRE=65795"
"17","0.006629357","35.186.208.48","192.168.1.118","SSL","1484","Continuation Data"
"18","0.006649820","192.168.1.118","35.186.208.48","TCP","86","[TCP Dup ACK 14#1] 34552 → 443 [ACK] Seq=1 Ack=4294809899 Win=3841 Len=0 TSval=17153444 TSecr=3133544541 SLE=4294816989 SRE=2837 SLE=4294811317 SRE=4294814153"
"19","0.006666970","35.186.208.48","192.168.1.118","SSL","1484","Continuation Data"
"20","0.006685684","192.168.1.118","35.186.208.48","TCP","78","[TCP Dup ACK 8#1] 34548 → 443 [ACK] Seq=1 Ack=4294892143 Win=1347 Len=0 TSval=17153444 TSecr=3556836735 SLE=4294893561 SRE=4255"
"21","0.006698434","35.186.208.48","192.168.1.118","TCP","1484","[TCP Out-Of-Order] 443 → 34548 [ACK] Seq=4294892143 Ack=1 Win=252 Len=1418 TSval=3556836749 TSecr=17153355"
"22","0.006718272","35.186.208.48","192.168.1.118","SSL","2902","Continuation Data"
"23","0.006735623","192.168.1.118","35.186.208.48","TCP","86","[TCP Dup ACK 14#2] 34552 → 443 [ACK] Seq=1 Ack=4294809899 Win=3841 Len=0 TSval=17153444 TSecr=3133544541 SLE=4294816989 SRE=5673 SLE=4294811317 SRE=4294814153"
"24","0.006744236","35.186.208.48","192.168.1.118","TLSv1.2","1484","[TCP Fast Retransmission] , Application Data"
"25","0.006767412","192.168.1.118","35.186.208.48","TCP","78","34552 → 443 [ACK] Seq=1 Ack=4294814153 Win=3808 Len=0 TSval=17153444 TSecr=3133544659 SLE=4294816989 SRE=5673"
"26","0.006782862","35.186.208.48","192.168.1.118","TCP","1484","[TCP Out-Of-Order] 443 → 34552 [ACK] Seq=4294814153 Ack=1 Win=257 Len=1418 TSval=3133544660 TSecr=17153349"
"27","0.006799825","192.168.1.118","35.186.208.48","TCP","78","34552 → 443 [ACK] Seq=1 Ack=4294815571 Win=3797 Len=0 TSval=17153444 TSecr=3133544660 SLE=4294816989 SRE=5673"
"28","0.006811913","35.186.208.48","192.168.1.118","TCP","1484","[TCP Out-Of-Order] 443 → 34552 [ACK] Seq=4294815571 Ack=1 Win=257 Len=1418 TSval=3133544661 TSecr=17153358"
"29","0.006849514","192.168.1.118","35.186.208.48","TCP","66","34552 → 443 [ACK] Seq=1 Ack=5673 Win=2568 Len=0 TSval=17153444 TSecr=3133544661"
"30","0.006866352","35.186.208.48","192.168.1.118","TLSv1.2","2902","Ignored Unknown Record"
"31","0.006888828","192.168.1.118","35.186.208.48","TCP","66","34552 → 443 [ACK] Seq=1 Ack=8509 Win=2546 Len=0 TSval=17153444 TSecr=3133544662"
"32","0.006902741","35.186.208.48","192.168.1.118","SSL","1484","Continuation Data"
"33","0.006919554","35.186.208.48","192.168.1.118","TLSv1.2","1484","Ignored Unknown Record"
"34","0.006937042","192.168.1.118","35.186.208.48","TCP","66","34552 → 443 [ACK] Seq=1 Ack=9927 Win=2535 Len=0 TSval=17153444 TSecr=3133544664"
"35","0.006952518","35.186.208.48","192.168.1.118","SSL","2902","Continuation Data"
"36","0.006969206","35.186.208.48","192.168.1.118","TLSv1.2","2902","Ignored Unknown Record"
"37","0.006990444","192.168.1.118","35.186.208.48","TCP","66","34552 → 443 [ACK] Seq=1 Ack=12763 Win=2513 Len=0 TSval=17153444 TSecr=3133544687"
"38","0.007010520","35.186.208.48","192.168.1.118","SSL","2902","Continuation Data"
"39","0.007026633","35.186.208.48","192.168.1.118","TLSv1.2","2902","Ignored Unknown Record"
"40","0.007041821","35.186.208.48","192.168.1.118","TLSv1.2","2902","Ignored Unknown Record"
"41","0.007057472","35.186.208.48","192.168.1.118","SSL","2902","Continuation Data"
"42","0.007072772","35.186.208.48","192.168.1.118","TLSv1.2","2902","Ignored Unknown Record"
"43","0.007092673","35.186.208.48","192.168.1.118","SSL","2902","[TCP Previous segment not captured] , Continuation Data"
"44","0.007116349","192.168.1.118","35.186.208.48","TCP","66","[TCP ACKed unseen segment] 34549 → 443 [ACK] Seq=1 Ack=116242 Win=2921 Len=0 TSval=17153444 TSecr=2563783802"
"45","0.007125412","35.186.208.48","192.168.1.118","SSL","1484","[TCP Previous segment not captured] , Continuation Data"
"46","0.007146025","192.168.1.118","35.186.208.48","TCP","66","[TCP ACKed unseen segment] 34551 → 443 [ACK] Seq=1 Ack=10105 Win=4275 Len=0 TSval=17153444 TSecr=3098647150"
"47","0.007154663","35.186.208.48","192.168.1.118","SSL","1484","[TCP Previous segment not captured] , Continuation Data"
"48","0.007174263","192.168.1.118","35.186.208.48","TCP","66","[TCP ACKed unseen segment] 34550 → 443 [ACK] Seq=1 Ack=65795 Win=4285 Len=0 TSval=17153444 TSecr=3529495452"
"49","0.007183001","35.186.208.48","192.168.1.118","SSL","2902","Continuation Data"
"50","0.007192939","35.186.208.48","192.168.1.118","TLSv1.2","1484","Ignored Unknown Record"
"51","0.009416354","35.186.208.48","192.168.1.118","TLSv1.2","1484","Ignored Unknown Record"
"52","0.009472669","35.186.208.48","192.168.1.118","SSL","2902","Continuation Data"
"53","0.009484732","35.186.208.48","192.168.1.118","TLSv1.2","1484","Ignored Unknown Record"
"54","0.009578760","35.186.208.48","192.168.1.118","TLSv1.2","1484","Ignored Unknown Record"
"55","0.009610549","35.186.208.48","192.168.1.118","SSL","2902","Continuation Data"
"56","0.009635337","35.186.208.48","192.168.1.118","TLSv1.2","2902","Ignored Unknown Record"
"57","0.009658938","35.186.208.48","192.168.1.118","SSL","2902","Continuation Data"
"58","0.009682214","35.186.208.48","192.168.1.118","TLSv1.2","2902","Ignored Unknown Record"
"59","0.009695464","35.186.208.48","192.168.1.118","SSL","2902","Continuation Data"
"60","0.009703939","35.186.208.48","192.168.1.118","TLSv1.2","1484","Ignored Unknown Record"
"61","0.011713310","35.186.208.48","192.168.1.118","TLSv1.2","1484","Ignored Unknown Record"
"62","0.011767011","35.186.208.48","192.168.1.118","SSL","2902","Continuation Data"
"63","0.011783237","35.186.208.48","192.168.1.118","TLSv1.2","1484","Ignored Unknown Record"
"64","0.011861077","35.186.208.48","192.168.1.118","TLSv1.2","1484","Ignored Unknown Record"
"65","0.011895078","35.186.208.48","192.168.1.118","SSL","2902","Continuation Data"
"66","0.011919354","35.186.208.48","192.168.1.118","TLSv1.2","2902","Ignored Unknown Record"
"67","0.011937642","35.186.208.48","192.168.1.118","SSL","2902","Continuation Data"
"68","0.011961481","35.186.208.48","192.168.1.118","TCP","1484","443 → 34552 [ACK] Seq=41123 Ack=1 Win=257 Len=1418 TSval=3133544708 TSecr=17153400"
"69","0.011980069","35.186.208.48","192.168.1.118","SSL","2902","Continuation Data"
"70","0.011988694","35.186.208.48","192.168.1.118","TLSv1.2","2902","Ignored Unknown Record"
"71","0.013869573","35.186.208.48","192.168.1.118","SSL","2902","Continuation Data"
"72","0.013935737","35.186.208.48","192.168.1.118","TLSv1.2","1484","Ignored Unknown Record"
"73","0.013948613","35.186.208.48","192.168.1.118","SSL","1484","Continuation Data"
"74","0.014025453","35.186.208.48","192.168.1.118","SSL","1484","Continuation Data"
"75","0.014057404","35.186.208.48","192.168.1.118","TLSv1.2","2902","Ignored Unknown Record"
"76","0.014082005","35.186.208.48","192.168.1.118","SSL","2902","Continuation Data"
"77","0.014105506","35.186.208.48","192.168.1.118","TLSv1.2","2902","Ignored Unknown Record"
"78","0.014129794","35.186.208.48","192.168.1.118","TCP","2902","443 → 34548 [ACK] Seq=48213 Ack=1 Win=252 Len=2836 TSval=3556836807 TSecr=17153418"
"79","0.014142770","35.186.208.48","192.168.1.118","TLSv1.2","2902","Ignored Unknown Record"
"80","0.014150282","35.186.208.48","192.168.1.118","SSL","1484","Continuation Data"
"81","0.016812738","35.186.208.48","192.168.1.118","SSL","1484","Continuation Data"
"82","0.016878803","35.186.208.48","192.168.1.118","TLSv1.2","2902","Ignored Unknown Record"
"83","0.016897341","35.186.208.48","192.168.1.118","SSL","1484","Continuation Data"
"84","0.017563327","35.186.208.48","192.168.1.118","SSL","1484","Continuation Data"
"85","0.017609353","35.186.208.48","192.168.1.118","SSL","2902","Continuation Data"
"86","0.017635992","35.186.208.48","192.168.1.118","TLSv1.2","2902","Ignored Unknown Record"
"87","0.017661005","35.186.208.48","192.168.1.118","SSL","2902","Continuation Data"
"88","0.017689056","35.186.208.48","192.168.1.118","TLSv1.2","2902","Ignored Unknown Record"
"89","0.017702232","35.186.208.48","192.168.1.118","SSL","2902","Continuation Data"
"90","0.017710470","35.186.208.48","192.168.1.118","TLSv1.2","1484","Ignored Unknown Record"
"91","0.019134732","192.168.1.118","35.186.208.48","TCP","66","34548 → 443 [ACK] Seq=1 Ack=65229 Win=251 Len=0 TSval=17153456 TSecr=3556836749"
"92","0.019145270","35.186.208.48","192.168.1.118","TLSv1.2","1484","Ignored Unknown Record"
"93","0.019218447","35.186.208.48","192.168.1.118","SSL","2902","Continuation Data"
"94","0.019240386","35.186.208.48","192.168.1.118","TLSv1.2","1484","Ignored Unknown Record"
"95","0.019267712","192.168.1.118","35.186.208.48","TCP","66","34548 → 443 [ACK] Seq=1 Ack=68065 Win=229 Len=0 TSval=17153456 TSecr=3556836817"
"96","0.019323826","35.186.208.48","192.168.1.118","TLSv1.2","1484","Ignored Unknown Record"
"97","0.019362565","35.186.208.48","192.168.1.118","SSL","2902","Continuation Data"
"98","0.019388778","192.168.1.118","35.186.208.48","TCP","66","34552 → 443 [ACK] Seq=1 Ack=69483 Win=2070 Len=0 TSval=17153456 TSecr=3133544688"
"99","0.019393853","35.186.208.48","192.168.1.118","TLSv1.2","2902","Ignored Unknown Record"
"100","0.019420617","35.186.208.48","192.168.1.118","TLSv1.2","2902","Ignored Unknown Record"
"101","0.019463181","35.186.208.48","192.168.1.118","SSL","2902","Continuation Data"
"102","0.019465043","192.168.1.118","35.186.208.48","TCP","66","34552 → 443 [ACK] Seq=1 Ack=75155 Win=2026 Len=0 TSval=17153456 TSecr=3133544728"
"103","0.019476919","35.186.208.48","192.168.1.118","TLSv1.2","2902","Ignored Unknown Record"
"104","0.019777567","192.168.1.118","35.186.208.48","TCP","66","34548 → 443 [ACK] Seq=1 Ack=73737 Win=185 Len=0 TSval=17153457 TSecr=3556836818"
"105","0.019870383","192.168.1.118","35.186.208.48","TCP","66","34552 → 443 [ACK] Seq=1 Ack=77991 Win=2004 Len=0 TSval=17153457 TSecr=3133544732"
"106","0.022638817","35.186.208.48","192.168.1.118","SSL","1484","Continuation Data"
"107","0.022731470","35.186.208.48","192.168.1.118","SSL","2902","Continuation Data"
"108","0.022746871","35.186.208.48","192.168.1.118","TLSv1.2","2902","Ignored Unknown Record"
"109","0.023046656","192.168.1.118","35.186.208.48","TCP","66","34548 → 443 [ACK] Seq=1 Ack=77991 Win=152 Len=0 TSval=17153460 TSecr=3556836825"
"110","0.023196912","192.168.1.118","35.186.208.48","TCP","66","34552 → 443 [ACK] Seq=1 Ack=80827 Win=1982 Len=0 TSval=17153460 TSecr=3133544734"
"111","0.023890048","35.186.208.48","192.168.1.118","TLSv1.2","2902","Ignored Unknown Record"
"112","0.023947013","35.186.208.48","192.168.1.118","SSL","2902","Continuation Data"
"113","0.023963801","35.186.208.48","192.168.1.118","TLSv1.2","1484","Ignored Unknown Record"
"114","0.024001652","192.168.1.118","35.186.208.48","TCP","66","34552 → 443 [ACK] Seq=1 Ack=83663 Win=1960 Len=0 TSval=17153461 TSecr=3133544736"
"115","0.024173571","192.168.1.118","35.186.208.48","TCP","66","34548 → 443 [ACK] Seq=1 Ack=80827 Win=130 Len=0 TSval=17153461 TSecr=3556836828"
"116","0.026184291","35.186.208.48","192.168.1.118","TLSv1.2","1484","Ignored Unknown Record"
"117","0.027002420","35.186.208.48","192.168.1.118","TLSv1.2","2902","Ignored Unknown Record"
"118","0.027167538","192.168.1.118","35.186.208.48","TCP","66","34552 → 443 [ACK] Seq=1 Ack=89335 Win=1916 Len=0 TSval=17153464 TSecr=3133544739"
"119","0.027885963","35.186.208.48","192.168.1.118","TLSv1.2","2902","Ignored Unknown Record"
"120","0.028268714","192.168.1.118","35.186.208.48","TCP","66","34552 → 443 [ACK] Seq=1 Ack=92171 Win=1894 Len=0 TSval=17153465 TSecr=3133544743"
"121","0.029797305","192.168.1.118","35.186.208.48","TLSv1.2","334","[TCP ACKed unseen segment] , Application Data"
"122","0.036182566","35.186.208.48","192.168.1.118","TLSv1.2","1484","Ignored Unknown Record"
"123","0.038800758","35.186.208.48","192.168.1.118","TLSv1.2","265","Ignored Unknown Record"
"124","0.038866822","35.186.208.48","192.168.1.118","SSL","1484","Continuation Data"
"125","0.044192334","35.186.208.48","192.168.1.118","SSL","1484","Continuation Data"
"126","0.045653510","35.186.208.48","192.168.1.118","SSL","1484","Continuation Data"
"127","0.045726613","35.186.208.48","192.168.1.118","SSL","2902","Continuation Data"
"128","0.045752838","35.186.208.48","192.168.1.118","SSL","2902","Continuation Data"
"129","0.047243491","35.186.208.48","192.168.1.118","SSL","1484","Continuation Data"
"130","0.048303115","35.186.208.48","192.168.1.118","SSL","1484","Continuation Data"
"131","0.048362492","35.186.208.48","192.168.1.118","SSL","2902","Continuation Data"
"132","0.048561262","192.168.1.118","35.186.208.48","TCP","66","34548 → 443 [ACK] Seq=1 Ack=96425 Win=9 Len=0 TSval=17153485 TSecr=3556836837"
"133","0.048725330","192.168.1.118","35.186.208.48","TCP","66","34552 → 443 [ACK] Seq=1 Ack=93788 Win=1882 Len=0 TSval=17153486 TSecr=3133544745"
"134","0.048860822","192.168.1.118","35.186.208.48","TCP","66","[TCP Window Update] 34548 → 443 [ACK] Seq=1 Ack=96425 Win=243 Len=0 TSval=17153486 TSecr=3556836837"
"135","0.063336204","35.186.208.48","192.168.1.118","TLSv1.2","1484","[TCP Previous segment not captured] , Application Data"
"136","0.065509930","35.186.208.48","192.168.1.118","TLSv1.2","1751","Application Data, Application Data"
"137","0.065618896","192.168.1.118","35.186.208.48","TCP","66","[TCP ACKed unseen segment] 34551 → 443 [ACK] Seq=269 Ack=13208 Win=4530 Len=0 TSval=17153503 TSecr=3098647274"
"138","0.068278764","192.168.1.118","35.186.208.48","TLSv1.2","340","Application Data"
"139","0.070694636","35.186.208.48","192.168.1.118","SSL","1484","Continuation Data"
"140","0.071830114","35.186.208.48","192.168.1.118","SSL","1484","Continuation Data"
"141","0.071875840","35.186.208.48","192.168.1.118","SSL","1484","Continuation Data"
"142","0.072667868","35.186.208.48","192.168.1.118","SSL","1484","Continuation Data"
"143","0.073914237","35.186.208.48","192.168.1.118","SSL","1484","Continuation Data"
"144","0.074576897","192.168.1.118","35.186.208.48","TCP","66","34548 → 443 [ACK] Seq=1 Ack=103515 Win=188 Len=0 TSval=17153511 TSecr=3556836877"
"145","0.077217502","35.186.208.48","192.168.1.118","TCP","1484","[TCP segment of a reassembled PDU]"
"146","0.078388593","35.186.208.48","192.168.1.118","TCP","2902","443 → 34548 [ACK] Seq=104933 Ack=1 Win=252 Len=2836 TSval=3556836882 TSecr=17153486 [TCP segment of a reassembled PDU]"
"147","0.079002415","192.168.1.118","35.186.208.48","TCP","66","34548 → 443 [ACK] Seq=1 Ack=107769 Win=155 Len=0 TSval=17153516 TSecr=3556836880"
"148","0.080044576","192.168.1.118","35.186.208.48","TCP","66","[TCP Window Update] 34548 → 443 [ACK] Seq=1 Ack=107769 Win=374 Len=0 TSval=17153517 TSecr=3556836880"
"149","0.080354887","35.186.208.48","192.168.1.118","TCP","1484","443 → 34548 [ACK] Seq=107769 Ack=1 Win=252 Len=1418 TSval=3556836884 TSecr=17153486 [TCP segment of a reassembled PDU]"
"150","0.082917389","35.186.208.48","192.168.1.118","TCP","1484","443 → 34548 [ACK] Seq=109187 Ack=1 Win=252 Len=1418 TSval=3556836884 TSecr=17153486 [TCP segment of a reassembled PDU]"
"151","0.082986779","35.186.208.48","192.168.1.118","TCP","2902","443 → 34548 [ACK] Seq=110605 Ack=1 Win=252 Len=2836 TSval=3556836886 TSecr=17153486 [TCP segment of a reassembled PDU]"
"152","0.084124344","35.186.208.48","192.168.1.118","TLSv1.2","1484","Application Data"
"153","0.084179796","35.186.208.48","192.168.1.118","TCP","2902","443 → 34548 [ACK] Seq=113441 Ack=1 Win=252 Len=2836 TSval=3556836888 TSecr=17153486 [TCP segment of a reassembled PDU]"
"154","0.085881793","35.186.208.48","192.168.1.118","TLSv1.2","2902","Application Data, Application Data"
"155","0.085951733","192.168.1.118","35.186.208.48","TCP","66","34551 → 443 [ACK] Seq=543 Ack=17462 Win=4530 Len=0 TSval=17153523 TSecr=3098647294"
"156","0.086008685","35.186.208.48","192.168.1.118","TCP","2902","443 → 34548 [ACK] Seq=116277 Ack=1 Win=252 Len=2836 TSval=3556836890 TSecr=17153486 [TCP segment of a reassembled PDU]"
"157","0.086024010","35.186.208.48","192.168.1.118","TLSv1.2","1484","Application Data"
"158","0.087317581","35.186.208.48","192.168.1.118","TLSv1.2","1484","Application Data"
"159","0.087362320","35.186.208.48","192.168.1.118","TLSv1.2","672","Application Data"
"160","0.088336066","35.186.208.48","192.168.1.118","TCP","1484","443 → 34548 [ACK] Seq=119113 Ack=1 Win=252 Len=1418 TSval=3556836892 TSecr=17153486 [TCP segment of a reassembled PDU]"
"161","0.091272007","192.168.1.118","35.186.208.48","TCP","66","34548 → 443 [ACK] Seq=1 Ack=120531 Win=275 Len=0 TSval=17153528 TSecr=3556836884"
"162","0.091448038","35.186.208.48","192.168.1.118","TCP","1484","443 → 34548 [ACK] Seq=120531 Ack=1 Win=252 Len=1418 TSval=3556836892 TSecr=17153486 [TCP segment of a reassembled PDU]"
"163","0.091502027","35.186.208.48","192.168.1.118","TCP","1484","443 → 34548 [ACK] Seq=121949 Ack=1 Win=252 Len=1418 TSval=3556836895 TSecr=17153486 [TCP segment of a reassembled PDU]"
"164","0.091576992","35.186.208.48","192.168.1.118","TCP","1484","443 → 34548 [ACK] Seq=123367 Ack=1 Win=252 Len=1418 TSval=3556836895 TSecr=17153486 [TCP segment of a reassembled PDU]"
"165","0.091758699","192.168.1.118","35.186.208.48","TCP","66","34551 → 443 [ACK] Seq=543 Ack=20904 Win=4504 Len=0 TSval=17153529 TSecr=3098647295"
"166","0.091948693","192.168.1.118","35.186.208.48","TCP","66","34548 → 443 [ACK] Seq=1 Ack=124785 Win=242 Len=0 TSval=17153529 TSecr=3556836892"
"167","0.096422012","35.186.208.48","192.168.1.118","TCP","915","443 → 34548 [PSH, ACK] Seq=124785 Ack=1 Win=252 Len=849 TSval=3556836897 TSecr=17153486 [TCP segment of a reassembled PDU]"
"168","0.111336796","192.168.1.118","35.186.208.48","TLSv1.2","341","Application Data"
"169","0.131598005","35.186.208.48","192.168.1.118","TLSv1.2","1484","Application Data"
"170","0.135611408","192.168.1.118","35.186.208.48","TCP","66","34548 → 443 [ACK] Seq=1 Ack=125634 Win=422 Len=0 TSval=17153573 TSecr=3556836897"
"171","0.137865875","35.186.208.48","192.168.1.118","TLSv1.2","2902","Application Data, Application Data"
"172","0.137934427","192.168.1.118","35.186.208.48","TCP","66","34551 → 443 [ACK] Seq=818 Ack=25158 Win=4530 Len=0 TSval=17153575 TSecr=3098647342"
"173","0.137973154","35.186.208.48","192.168.1.118","TLSv1.2","144","Application Data"
"174","0.140061602","192.168.1.118","35.186.208.48","TLSv1.2","332","[TCP ACKed unseen segment] , Application Data"
"175","0.141066062","192.168.1.118","35.186.208.48","TLSv1.2","343","Application Data"
"176","0.157251253","192.168.1.118","35.186.208.48","TCP","66","[TCP Window Update] 34548 → 443 [ACK] Seq=1 Ack=125634 Win=940 Len=0 TSval=17153594 TSecr=3556836897"
"177","0.163814745","192.168.1.118","35.186.208.48","TLSv1.2","341","[TCP ACKed unseen segment] , Application Data"
"178","0.166259856","35.186.208.48","192.168.1.118","TLSv1.2","1484","[TCP Previous segment not captured] , Application Data"
"179","0.166347147","192.168.1.118","35.186.208.48","TCP","66","[TCP ACKed unseen segment] 34550 → 443 [ACK] Seq=267 Ack=67213 Win=4588 Len=0 TSval=17153603 TSecr=3529495678"
"180","0.169386965","35.186.208.48","192.168.1.118","TLSv1.2","2902","Application Data, Application Data"
"181","0.169461293","192.168.1.118","35.186.208.48","TCP","66","34550 → 443 [ACK] Seq=267 Ack=70049 Win=4632 Len=0 TSval=17153606 TSecr=3529495678"
"182","0.169517333","35.186.208.48","192.168.1.118","TLSv1.2","3214","Application Data, Application Data, Application Data"
"183","0.169558621","192.168.1.118","35.186.208.48","TCP","66","34550 → 443 [ACK] Seq=267 Ack=73197 Win=4681 Len=0 TSval=17153606 TSecr=3529495679"
"184","0.169580272","35.186.208.48","192.168.1.118","TLSv1.2","1484","Application Data"
"185","0.169614586","35.186.208.48","192.168.1.118","TLSv1.2","1484","Application Data"
"186","0.169635649","192.168.1.118","35.186.208.48","TCP","66","34551 → 443 [ACK] Seq=1095 Ack=28072 Win=4530 Len=0 TSval=17153607 TSecr=3098647377"
"187","0.171322808","35.186.208.48","192.168.1.118","TLSv1.2","1484","Application Data"
"188","0.171385310","35.186.208.48","192.168.1.118","TLSv1.2","2155","Application Data, Application Data"
"189","0.171422487","192.168.1.118","35.186.208.48","TCP","66","34551 → 443 [ACK] Seq=1095 Ack=31579 Win=4530 Len=0 TSval=17153608 TSecr=3098647377"
"190","0.173018830","192.168.1.118","35.186.208.48","TLSv1.2","333","Application Data"
"191","0.175028725","192.168.1.118","35.186.208.48","TLSv1.2","343","Application Data"
"192","0.184897583","192.168.1.118","35.186.208.48","TLSv1.2","332","Application Data"
"193","0.186270369","35.186.208.48","192.168.1.118","TLSv1.2","1484","[TCP Previous segment not captured] , Application Data"
"194","0.186363447","192.168.1.118","35.186.208.48","TCP","66","[TCP ACKed unseen segment] 34549 → 443 [ACK] Seq=276 Ack=117660 Win=4031 Len=0 TSval=17153623 TSecr=2563784048"
"195","0.187301355","35.186.208.48","192.168.1.118","TLSv1.2","1794","Application Data, Application Data"
"196","0.187370957","192.168.1.118","35.186.208.48","TCP","66","34549 → 443 [ACK] Seq=276 Ack=119388 Win=4031 Len=0 TSval=17153624 TSecr=2563784048"
"197","0.188595350","192.168.1.118","35.186.208.48","TLSv1.2","343","Application Data"
"198","0.199078030","35.186.208.48","192.168.1.118","TLSv1.2","1484","Application Data"
"199","0.204224297","192.168.1.118","35.186.208.48","TCP","66","[TCP Window Update] 34552 → 443 [ACK] Seq=1 Ack=93788 Win=3844 Len=0 TSval=17153641 TSecr=3133544745"
"200","0.204267711","35.186.208.48","192.168.1.118","TLSv1.2","1484","Application Data"
"201","0.204354239","35.186.208.48","192.168.1.118","TLSv1.2","2902","Application Data, Application Data"
"202","0.204401078","192.168.1.118","35.186.208.48","TCP","66","34551 → 443 [ACK] Seq=1372 Ack=35833 Win=4530 Len=0 TSval=17153641 TSecr=3098647407"
"203","0.204455768","35.186.208.48","192.168.1.118","TLSv1.2","2902","Application Data, Application Data"
"204","0.204477494","192.168.1.118","35.186.208.48","TCP","66","34550 → 443 [ACK] Seq=534 Ack=77451 Win=4748 Len=0 TSval=17153641 TSecr=3529495709"
"205","0.204498982","35.186.208.48","192.168.1.118","TLSv1.2","685","Application Data"
"206","0.204520408","35.186.208.48","192.168.1.118","TLSv1.2","1484","Application Data"
"207","0.204576985","35.186.208.48","192.168.1.118","TLSv1.2","1778","Application Data, Application Data"
"208","0.204770654","192.168.1.118","35.186.208.48","TCP","66","34551 → 443 [ACK] Seq=1372 Ack=38963 Win=4506 Len=0 TSval=17153642 TSecr=3098647408"
"209","0.207953215","35.186.208.48","192.168.1.118","TCP","1484","443 → 34548 [PSH, ACK] Seq=125634 Ack=267 Win=257 Len=1418 TSval=3556837014 TSecr=17153622 [TCP segment of a reassembled PDU]"
"210","0.209570422","35.186.208.48","192.168.1.118","TLSv1.2","1484","Application Data"
"211","0.209665413","35.186.208.48","192.168.1.118","TLSv1.2","2902","Application Data, Application Data"
"212","0.209665463","192.168.1.118","35.186.208.48","TLSv1.2","331","Application Data"
"213","0.209723790","192.168.1.118","35.186.208.48","TCP","66","34549 → 443 [ACK] Seq=553 Ack=123642 Win=4031 Len=0 TSval=17153647 TSecr=2563784070"
"214","0.209776142","35.186.208.48","192.168.1.118","TCP","2902","443 → 34548 [PSH, ACK] Seq=127052 Ack=267 Win=257 Len=2836 TSval=3556837015 TSecr=17153622 [TCP segment of a reassembled PDU]"
"215","0.209798055","192.168.1.118","35.186.208.48","TCP","66","34548 → 443 [ACK] Seq=267 Ack=129888 Win=1424 Len=0 TSval=17153647 TSecr=3556837014"
"216","0.209818831","35.186.208.48","192.168.1.118","TLSv1.2","1315","Application Data"
"217","0.209854782","192.168.1.118","35.186.208.48","TLSv1.2","335","Application Data"
"218","0.210247583","35.186.208.48","192.168.1.118","TCP","542","443 → 34548 [PSH, ACK] Seq=129888 Ack=267 Win=257 Len=476 TSval=3556837017 TSecr=17153622 [TCP segment of a reassembled PDU]"
"219","0.212954690","192.168.1.118","35.186.208.48","TLSv1.2","344","Application Data"
"220","0.213093045","192.168.1.118","35.186.208.48","TCP","66","34548 → 443 [ACK] Seq=267 Ack=130364 Win=1424 Len=0 TSval=17153650 TSecr=3556837017"
"221","0.214436517","192.168.1.118","35.186.208.48","TLSv1.2","338","Application Data"
"222","0.215319123","192.168.1.118","35.186.208.48","TLSv1.2","329","Application Data"
"223","0.230930119","35.186.208.48","192.168.1.118","TLSv1.2","1484","Application Data"
"224","0.234390491","35.186.208.48","192.168.1.118","TLSv1.2","1484","Application Data"
"225","0.234478169","35.186.208.48","192.168.1.118","TLSv1.2","2902","Application Data, Application Data"
"226","0.234525208","192.168.1.118","35.186.208.48","TCP","66","34551 → 443 [ACK] Seq=1641 Ack=43217 Win=4530 Len=0 TSval=17153671 TSecr=3098647440"
"227","0.234587735","35.186.208.48","192.168.1.118","TLSv1.2","1484","Application Data"
"228","0.234610336","192.168.1.118","35.186.208.48","TCP","66","34552 → 443 [ACK] Seq=279 Ack=96624 Win=3865 Len=0 TSval=17153672 TSecr=3133544944"
"229","0.234676075","35.186.208.48","192.168.1.118","TLSv1.2","1484","Application Data"
"230","0.234697339","35.186.208.48","192.168.1.118","TLSv1.2","1484","Application Data"
"231","0.234729652","35.186.208.48","192.168.1.118","TLSv1.2","2902","Application Data, Application Data"
"232","0.234750141","192.168.1.118","35.186.208.48","TCP","66","34550 → 443 [ACK] Seq=799 Ack=82324 Win=4836 Len=0 TSval=17153672 TSecr=3529495742"
"233","0.234785842","35.186.208.48","192.168.1.118","TLSv1.2","2377","Application Data, Application Data"
"234","0.234807343","35.186.208.48","192.168.1.118","TLSv1.2","687","Application Data"
"235","0.234827681","35.186.208.48","192.168.1.118","TLSv1.2","1484","Application Data"
"236","0.234850532","35.186.208.48","192.168.1.118","TCP","1484","443 → 34548 [PSH, ACK] Seq=130364 Ack=539 Win=261 Len=1418 TSval=3556837037 TSecr=17153651 [TCP segment of a reassembled PDU]"
"237","0.234881570","35.186.208.48","192.168.1.118","TLSv1.2","2902","Application Data, Application Data"
"238","0.234902108","192.168.1.118","35.186.208.48","TCP","66","34549 → 443 [ACK] Seq=816 Ack=129145 Win=4031 Len=0 TSval=17153672 TSecr=2563784093"
"239","0.234926622","35.186.208.48","192.168.1.118","TCP","1484","443 → 34548 [ACK] Seq=131782 Ack=539 Win=261 Len=1418 TSval=3556837038 TSecr=17153651 [TCP segment of a reassembled PDU]"
"240","0.234945997","192.168.1.118","35.186.208.48","TCP","66","34548 → 443 [ACK] Seq=539 Ack=133200 Win=1424 Len=0 TSval=17153672 TSecr=3556837037"
"241","0.235286647","192.168.1.118","35.186.208.48","TCP","66","34551 → 443 [ACK] Seq=1641 Ack=45528 Win=4512 Len=0 TSval=17153672 TSecr=3098647441"
"242","0.238273126","192.168.1.118","35.186.208.48","TLSv1.2","332","Application Data"
"243","0.238489584","192.168.1.118","35.186.208.48","TLSv1.2","344","Application Data"
"244","0.240526805","35.186.208.48","192.168.1.118","TCP","1484","443 → 34548 [PSH, ACK] Seq=133200 Ack=539 Win=261 Len=1418 TSval=3556837038 TSecr=17153651 [TCP segment of a reassembled PDU]"
"245","0.240622871","35.186.208.48","192.168.1.118","TLSv1.2","2569","Application Data, Application Data"
"246","0.240664085","192.168.1.118","35.186.208.48","TCP","66","34549 → 443 [ACK] Seq=816 Ack=131648 Win=4031 Len=0 TSval=17153678 TSecr=2563784094"
"247","0.240719412","35.186.208.48","192.168.1.118","TLSv1.2","1484","Application Data"
"248","0.240743613","192.168.1.118","35.186.208.48","TCP","66","34552 → 443 [ACK] Seq=279 Ack=99460 Win=3865 Len=0 TSval=17153678 TSecr=3133544945"
"249","0.241806325","192.168.1.118","35.186.208.48","TLSv1.2","329","Application Data"
"250","0.243592488","35.186.208.48","192.168.1.118","TCP","676","443 → 34548 [PSH, ACK] Seq=134618 Ack=539 Win=261 Len=610 TSval=3556837040 TSecr=17153651 [TCP segment of a reassembled PDU]"
"251","0.243670190","192.168.1.118","35.186.208.48","TCP","66","34548 → 443 [ACK] Seq=539 Ack=135228 Win=1424 Len=0 TSval=17153681 TSecr=3556837038"
"252","0.243718642","35.186.208.48","192.168.1.118","TLSv1.2","1484","Application Data"
"253","0.243735443","35.186.208.48","192.168.1.118","TLSv1.2","1044","Application Data"
"254","0.243756006","192.168.1.118","35.186.208.48","TCP","66","34552 → 443 [ACK] Seq=279 Ack=101856 Win=3865 Len=0 TSval=17153681 TSecr=3133544947"
"255","0.244886570","192.168.1.118","35.186.208.48","TLSv1.2","338","Application Data"
"256","0.245052426","192.168.1.118","35.186.208.48","TLSv1.2","332","Application Data"
"257","0.276812038","35.186.208.48","192.168.1.118","TLSv1.2","1484","Application Data"
"258","0.278584212","35.186.208.48","192.168.1.118","TLSv1.2","1484","Application Data"
"259","0.278668240","35.186.208.48","192.168.1.118","TLSv1.2","2856","Application Data, Application Data"
"260","0.278710804","192.168.1.118","35.186.208.48","TCP","66","34550 → 443 [ACK] Seq=1065 Ack=87153 Win=4924 Len=0 TSval=17153716 TSecr=3529495789"
"261","0.278757293","35.186.208.48","192.168.1.118","TLSv1.2","1484","Application Data"
"262","0.278780019","192.168.1.118","35.186.208.48","TCP","66","34551 → 443 [ACK] Seq=1919 Ack=48364 Win=4530 Len=0 TSval=17153716 TSecr=3098647487"
"263","0.278834596","35.186.208.48","192.168.1.118","TLSv1.2","2902","Application Data, Application Data"
"264","0.278858184","192.168.1.118","35.186.208.48","TCP","66","34551 → 443 [ACK] Seq=1919 Ack=51200 Win=4530 Len=0 TSval=17153716 TSecr=3098647488"
"265","0.283681128","35.186.208.48","192.168.1.118","TLSv1.2","612","Application Data"
"266","0.290027588","35.186.208.48","192.168.1.118","TLSv1.2","1484","Ignored Unknown Record, Ignored Unknown Record"
"267","0.292208664","35.186.208.48","192.168.1.118","TLSv1.2","1484","Application Data"
"268","0.292305167","35.186.208.48","192.168.1.118","TLSv1.2","2902","Application Data, Application Data"
"269","0.292348281","192.168.1.118","35.186.208.48","TCP","66","34549 → 443 [ACK] Seq=1079 Ack=135902 Win=4031 Len=0 TSval=17153729 TSecr=2563784150"
"270","0.292397233","35.186.208.48","192.168.1.118","TLSv1.2","1484","Application Data"
"271","0.292420109","192.168.1.118","35.186.208.48","TCP","66","34548 → 443 [ACK] Seq=811 Ack=138064 Win=1424 Len=0 TSval=17153729 TSecr=3556837094"
"272","0.292465336","35.186.208.48","192.168.1.118","TLSv1.2","1484","Application Data"
"273","0.292485899","35.186.208.48","192.168.1.118","TLSv1.2","1484","Application Data"
"274","0.292507462","35.186.208.48","192.168.1.118","TLSv1.2","1484","Application Data"
"275","0.292533038","35.186.208.48","192.168.1.118","TLSv1.2","867","Application Data"
"276","0.292574027","35.186.208.48","192.168.1.118","TLSv1.2","2902","Application Data, Application Data"
"277","0.292601928","35.186.208.48","192.168.1.118","TLSv1.2","2902","Application Data, Application Data"
"278","0.292624354","192.168.1.118","35.186.208.48","TCP","66","34548 → 443 [ACK] Seq=811 Ack=142318 Win=1424 Len=0 TSval=17153730 TSecr=3556837095"
"279","0.292824486","192.168.1.118","35.186.208.48","TCP","66","34552 → 443 [ACK] Seq=545 Ack=106110 Win=3860 Len=0 TSval=17153730 TSecr=3133545004"
"280","0.292986541","192.168.1.118","35.186.208.48","TCP","66","34549 → 443 [ACK] Seq=1079 Ack=138121 Win=4014 Len=0 TSval=17153730 TSecr=2563784151"
"281","0.294036253","35.186.208.48","192.168.1.118","TLSv1.2","2902","Application Data, Application Data"
"282","0.294114631","192.168.1.118","35.186.208.48","TCP","66","34552 → 443 [ACK] Seq=545 Ack=108946 Win=3865 Len=0 TSval=17153731 TSecr=3133545006"
"283","0.294152507","35.186.208.48","192.168.1.118","TLSv1.2","2902","Application Data, Application Data"
"284","0.294174958","192.168.1.118","35.186.208.48","TCP","66","34548 → 443 [ACK] Seq=811 Ack=145154 Win=1424 Len=0 TSval=17153731 TSecr=3556837099"
"285","0.296140727","35.186.208.48","192.168.1.118","TLSv1.2","2902","Application Data, Application Data"
"286","0.296219842","192.168.1.118","35.186.208.48","TCP","66","34552 → 443 [ACK] Seq=545 Ack=111782 Win=3865 Len=0 TSval=17153733 TSecr=3133545008"
"287","0.296259218","35.186.208.48","192.168.1.118","TLSv1.2","2902","Application Data, Application Data"
"288","0.296281144","192.168.1.118","35.186.208.48","TCP","66","34548 → 443 [ACK] Seq=811 Ack=147990 Win=1424 Len=0 TSval=17153733 TSecr=3556837101"
"289","0.305433364","35.186.208.48","192.168.1.118","TLSv1.2","2902","Application Data, Application Data"
"290","0.305505204","192.168.1.118","35.186.208.48","TCP","66","34552 → 443 [ACK] Seq=545 Ack=114618 Win=3865 Len=0 TSval=17153742 TSecr=3133545010"
"291","0.305556894","35.186.208.48","192.168.1.118","TLSv1.2","2902","Application Data, Application Data"
"292","0.305579057","192.168.1.118","35.186.208.48","TCP","66","34548 → 443 [ACK] Seq=811 Ack=150826 Win=1424 Len=0 TSval=17153743 TSecr=3556837103"
"293","0.305641947","35.186.208.48","192.168.1.118","TLSv1.2","2902","Application Data, Application Data"
"294","0.305673098","35.186.208.48","192.168.1.118","TLSv1.2","2902","Application Data, Application Data"
"295","0.305694299","192.168.1.118","35.186.208.48","TCP","66","34548 → 443 [ACK] Seq=811 Ack=153662 Win=1424 Len=0 TSval=17153743 TSecr=3556837105"
"296","0.305721837","35.186.208.48","192.168.1.118","TLSv1.2","2902","Application Data, Application Data"
"297","0.305752876","35.186.208.48","192.168.1.118","TLSv1.2","2902","Application Data, Application Data"
"298","0.305774964","192.168.1.118","35.186.208.48","TCP","66","34548 → 443 [ACK] Seq=811 Ack=156498 Win=1424 Len=0 TSval=17153743 TSecr=3556837107"
"299","0.305798252","35.186.208.48","192.168.1.118","TLSv1.2","2902","Application Data, Application Data"
"300","0.305811015","35.186.208.48","192.168.1.118","TLSv1.2","2902","Application Data, Application Data"
"301","0.305842566","192.168.1.118","35.186.208.48","TCP","66","34548 → 443 [ACK] Seq=811 Ack=159334 Win=1424 Len=0 TSval=17153743 TSecr=3556837109"
"302","0.306187553","192.168.1.118","35.186.208.48","TCP","66","34552 → 443 [ACK] Seq=545 Ack=123126 Win=3799 Len=0 TSval=17153743 TSecr=3133545012"
"303","0.307273329","35.186.208.48","192.168.1.118","TLSv1.2","2902","Application Data, Application Data"
"304","0.307333168","35.186.208.48","192.168.1.118","TLSv1.2","2902","Application Data, Application Data"
"305","0.307372532","192.168.1.118","35.186.208.48","TCP","66","34548 → 443 [ACK] Seq=811 Ack=162170 Win=1424 Len=0 TSval=17153744 TSecr=3556837111"
"306","0.307612053","192.168.1.118","35.186.208.48","TCP","66","34552 → 443 [ACK] Seq=545 Ack=125962 Win=3777 Len=0 TSval=17153745 TSecr=3133545019"
"307","0.309777491","35.186.208.48","192.168.1.118","TLSv1.2","2902","Application Data, Application Data"
"308","0.309854644","192.168.1.118","35.186.208.48","TCP","66","34552 → 443 [ACK] Seq=545 Ack=128798 Win=3865 Len=0 TSval=17153747 TSecr=3133545021"
"309","0.309906358","35.186.208.48","192.168.1.118","TLSv1.2","2902","Application Data, Application Data"
"310","0.309929597","192.168.1.118","35.186.208.48","TCP","66","34548 → 443 [ACK] Seq=811 Ack=165006 Win=1424 Len=0 TSval=17153747 TSecr=3556837113"
"311","0.309943297","35.186.208.48","192.168.1.118","TLSv1.2","2902","Application Data, Application Data"
"312","0.310435564","192.168.1.118","35.186.208.48","TCP","66","34552 → 443 [ACK] Seq=545 Ack=131634 Win=3844 Len=0 TSval=17153747 TSecr=3133545023"
"313","0.311529078","35.186.208.48","192.168.1.118","TLSv1.2","2902","Application Data, Application Data"
"314","0.311624631","192.168.1.118","35.186.208.48","TCP","66","34548 → 443 [ACK] Seq=811 Ack=167842 Win=1424 Len=0 TSval=17153749 TSecr=3556837116"
"315","0.311662970","35.186.208.48","192.168.1.118","TLSv1.2","2902","Application Data, Application Data"
"316","0.311684796","192.168.1.118","35.186.208.48","TCP","66","34552 → 443 [ACK] Seq=545 Ack=134470 Win=3865 Len=0 TSval=17153749 TSecr=3133545025"
"317","0.313745393","35.186.208.48","192.168.1.118","TLSv1.2","2902","Application Data, Application Data"
"318","0.313830921","192.168.1.118","35.186.208.48","TCP","66","34548 → 443 [ACK] Seq=811 Ack=170678 Win=1424 Len=0 TSval=17153751 TSecr=3556837118"
"319","0.313862547","35.186.208.48","192.168.1.118","TLSv1.2","2902","Application Data, Application Data"
"320","0.313882973","192.168.1.118","35.186.208.48","TCP","66","34552 → 443 [ACK] Seq=545 Ack=137306 Win=3865 Len=0 TSval=17153751 TSecr=3133545027"
"321","0.314754928","35.186.208.48","192.168.1.118","TLSv1.2","2902","Application Data, Application Data"
"322","0.314814305","192.168.1.118","35.186.208.48","TCP","66","34548 → 443 [ACK] Seq=811 Ack=173514 Win=1424 Len=0 TSval=17153752 TSecr=3556837120"
"323","0.314844331","35.186.208.48","192.168.1.118","TLSv1.2","2902","Application Data, Application Data"
"324","0.314865545","192.168.1.118","35.186.208.48","TCP","66","34552 → 443 [ACK] Seq=545 Ack=140142 Win=3865 Len=0 TSval=17153752 TSecr=3133545029"
"325","0.318832483","35.186.208.48","192.168.1.118","TLSv1.2","1484","Application Data [TCP segment of a reassembled PDU]"
"326","0.320423989","35.186.208.48","192.168.1.118","TLSv1.2","2902","Application Data, Application Data"
"327","0.320497529","192.168.1.118","35.186.208.48","TCP","66","34552 → 443 [ACK] Seq=545 Ack=142978 Win=3865 Len=0 TSval=17153757 TSecr=3133545031"
"328","0.320567194","35.186.208.48","192.168.1.118","TLSv1.2","1484","Application Data [TCP segment of a reassembled PDU]"
"329","0.320590695","192.168.1.118","35.186.208.48","TCP","66","34548 → 443 [ACK] Seq=811 Ack=176350 Win=1424 Len=0 TSval=17153758 TSecr=3556837122"
"330","0.320619021","35.186.208.48","192.168.1.118","TLSv1.2","2902","Application Data, Application Data"
"331","0.320635409","35.186.208.48","192.168.1.118","TLSv1.2","2902","Application Data, Application Data"
"332","0.320653860","192.168.1.118","35.186.208.48","TCP","66","34548 → 443 [ACK] Seq=811 Ack=179186 Win=1424 Len=0 TSval=17153758 TSecr=3556837125"
"333","0.320844804","192.168.1.118","35.186.208.48","TCP","66","34552 → 443 [ACK] Seq=545 Ack=145814 Win=3844 Len=0 TSval=17153758 TSecr=3133545033"
"334","0.322062221","35.186.208.48","192.168.1.118","TLSv1.2","2902","Application Data, Application Data"
"335","0.322118686","35.186.208.48","192.168.1.118","TLSv1.2","1484","Application Data [TCP segment of a reassembled PDU]"
"336","0.322580927","192.168.1.118","35.186.208.48","TCP","66","34552 → 443 [ACK] Seq=545 Ack=148650 Win=3822 Len=0 TSval=17153759 TSecr=3133545035"
"337","0.323605700","192.168.1.118","35.186.208.48","TCP","66","34551 → 443 [ACK] Seq=1919 Ack=51746 Win=4530 Len=0 TSval=17153761 TSecr=3098647488"
"338","0.324410866","35.186.208.48","192.168.1.118","TLSv1.2","1484","Application Data [TCP segment of a reassembled PDU]"
"339","0.324473768","192.168.1.118","35.186.208.48","TCP","66","34548 → 443 [ACK] Seq=811 Ack=182022 Win=1424 Len=0 TSval=17153761 TSecr=3556837127"
"340","0.324506669","35.186.208.48","192.168.1.118","TLSv1.2","2902","Application Data, Application Data"
"341","0.324530045","192.168.1.118","35.186.208.48","TCP","66","34552 → 443 [ACK] Seq=545 Ack=151486 Win=3865 Len=0 TSval=17153761 TSecr=3133545037"
"342","0.326771436","35.186.208.48","192.168.1.118","TLSv1.2","2902","Application Data, Application Data"
"343","0.326861077","192.168.1.118","35.186.208.48","TCP","66","34552 → 443 [ACK] Seq=545 Ack=154322 Win=3865 Len=0 TSval=17153764 TSecr=3133545039"
"344","0.326899203","35.186.208.48","192.168.1.118","TLSv1.2","2902","Application Data, Application Data"
"345","0.326921641","192.168.1.118","35.186.208.48","TCP","66","34548 → 443 [ACK] Seq=811 Ack=184858 Win=1424 Len=0 TSval=17153764 TSecr=3556837130"
"346","0.329412979","35.186.208.48","192.168.1.118","TLSv1.2","2902","Application Data, Application Data"
"347","0.329491181","192.168.1.118","35.186.208.48","TCP","66","34552 → 443 [ACK] Seq=545 Ack=157158 Win=3865 Len=0 TSval=17153766 TSecr=3133545041"
"348","0.329529945","35.186.208.48","192.168.1.118","TLSv1.2","1484","Application Data [TCP segment of a reassembled PDU]"
"349","0.330985471","35.186.208.48","192.168.1.118","TLSv1.2","1484","Application Data [TCP segment of a reassembled PDU]"
"350","0.331061611","192.168.1.118","35.186.208.48","TCP","66","34548 → 443 [ACK] Seq=811 Ack=187694 Win=1424 Len=0 TSval=17153768 TSecr=3556837133"
"351","0.331122251","35.186.208.48","192.168.1.118","TLSv1.2","2902","Application Data, Application Data"
"352","0.331144989","192.168.1.118","35.186.208.48","TCP","66","34552 → 443 [ACK] Seq=545 Ack=159994 Win=3865 Len=0 TSval=17153768 TSecr=3133545043"
"353","0.331171140","35.186.208.48","192.168.1.118","TLSv1.2","2902","Application Data, Application Data"
"354","0.331184391","35.186.208.48","192.168.1.118","TLSv1.2","2902","Application Data, Application Data"
"355","0.331254168","192.168.1.118","35.186.208.48","TCP","66","34548 → 443 [ACK] Seq=811 Ack=190530 Win=1424 Len=0 TSval=17153768 TSecr=3556837136"
"356","0.331529328","192.168.1.118","35.186.208.48","TCP","66","34552 → 443 [ACK] Seq=545 Ack=162830 Win=3844 Len=0 TSval=17153768 TSecr=3133545045"
"357","0.333052019","35.186.208.48","192.168.1.118","TLSv1.2","1484","Application Data [TCP segment of a reassembled PDU]"
"358","0.334431229","35.186.208.48","192.168.1.118","TLSv1.2","1484","Application Data [TCP segment of a reassembled PDU]"
"359","0.334509145","192.168.1.118","35.186.208.48","TCP","66","34552 → 443 [ACK] Seq=545 Ack=165666 Win=3865 Len=0 TSval=17153771 TSecr=3133545047"
"360","0.334567059","35.186.208.48","192.168.1.118","TLSv1.2","2902","Application Data, Application Data"
"361","0.334588347","192.168.1.118","35.186.208.48","TCP","66","34548 → 443 [ACK] Seq=811 Ack=193366 Win=1424 Len=0 TSval=17153772 TSecr=3556837138"
"362","0.334598685","35.186.208.48","192.168.1.118","TLSv1.2","1484","Application Data [TCP segment of a reassembled PDU]"
"363","0.336294244","35.186.208.48","192.168.1.118","TLSv1.2","1484","Application Data [TCP segment of a reassembled PDU]"
"364","0.336348709","35.186.208.48","192.168.1.118","TLSv1.2","2902","Application Data, Application Data"
"365","0.336386185","192.168.1.118","35.186.208.48","TCP","66","34548 → 443 [ACK] Seq=811 Ack=196202 Win=1424 Len=0 TSval=17153773 TSecr=3556837141"
"366","0.336664632","192.168.1.118","35.186.208.48","TCP","66","34552 → 443 [ACK] Seq=545 Ack=168502 Win=3860 Len=0 TSval=17153774 TSecr=3133545049"
"367","0.344446005","192.168.1.104","255.255.255.255","UDP","217","49154 → 6666 Len=175"
"368","0.351459388","35.186.208.48","192.168.1.118","TLSv1.2","2902","Application Data, Application Data"
"369","0.351557354","192.168.1.118","35.186.208.48","TCP","66","34552 → 443 [ACK] Seq=545 Ack=171338 Win=3865 Len=0 TSval=17153788 TSecr=3133545051"
"370","0.353652652","35.186.208.48","192.168.1.118","TLSv1.2","2902","Application Data, Application Data"
"371","0.353735880","192.168.1.118","35.186.208.48","TCP","66","34548 → 443 [ACK] Seq=811 Ack=199038 Win=1424 Len=0 TSval=17153791 TSecr=3556837144"
"372","0.353783107","35.186.208.48","192.168.1.118","TLSv1.2","2902","Application Data, Application Data"
"373","0.353807220","192.168.1.118","35.186.208.48","TCP","66","34552 → 443 [ACK] Seq=545 Ack=174174 Win=3865 Len=0 TSval=17153791 TSecr=3133545053"
"374","0.353820920","35.186.208.48","192.168.1.118","TLSv1.2","2902","Application Data, Application Data"
"375","0.353841121","192.168.1.118","35.186.208.48","TCP","66","34548 → 443 [ACK] Seq=811 Ack=201874 Win=1424 Len=0 TSval=17153791 TSecr=3556837146"
"376","0.353926374","35.186.208.48","192.168.1.118","TLSv1.2","2902","Application Data, Application Data"
"377","0.353956188","35.186.208.48","192.168.1.118","TLSv1.2","2902","Application Data, Application Data"
"378","0.353990926","35.186.208.48","192.168.1.118","TLSv1.2","2902","Application Data, Application Data"
"379","0.354012577","192.168.1.118","35.186.208.48","TCP","66","34548 → 443 [ACK] Seq=811 Ack=204710 Win=1424 Len=0 TSval=17153791 TSecr=3556837148"
"380","0.354037103","35.186.208.48","192.168.1.118","TLSv1.2","2902","Application Data, Application Data"
"381","0.354048903","35.186.208.48","192.168.1.118","TLSv1.2","2902","Application Data, Application Data"
"382","0.354066992","192.168.1.118","35.186.208.48","TCP","66","34548 → 443 [ACK] Seq=811 Ack=207546 Win=1424 Len=0 TSval=17153791 TSecr=3556837151"
"383","0.354116068","192.168.1.118","35.186.208.48","TCP","66","34552 → 443 [ACK] Seq=545 Ack=179846 Win=3821 Len=0 TSval=17153791 TSecr=3133545055"
"384","0.354255598","192.168.1.118","35.186.208.48","TCP","66","34552 → 443 [ACK] Seq=545 Ack=182682 Win=3799 Len=0 TSval=17153791 TSecr=3133545059"
"385","0.356038198","35.186.208.48","192.168.1.118","TLSv1.2","2902","Application Data, Application Data"
"386","0.356103588","35.186.208.48","192.168.1.118","TLSv1.2","2902","Application Data, Application Data"
"387","0.356141802","192.168.1.118","35.186.208.48","TCP","66","34548 → 443 [ACK] Seq=811 Ack=210382 Win=1424 Len=0 TSval=17153793 TSecr=3556837154"
"388","0.356178790","35.186.208.48","192.168.1.118","TLSv1.2","2902","Application Data, Application Data"
"389","0.356257181","35.186.208.48","192.168.1.118","TLSv1.2","2902","Application Data, Application Data"
"390","0.356284819","35.186.208.48","192.168.1.118","TLSv1.2","2902","Application Data, Application Data"
"391","0.356307745","192.168.1.118","35.186.208.48","TCP","66","34548 → 443 [ACK] Seq=811 Ack=213218 Win=1424 Len=0 TSval=17153793 TSecr=3556837157"
"392","0.356345034","35.186.208.48","192.168.1.118","TLSv1.2","2902","Application Data, Application Data"
"393","0.356370397","35.186.208.48","192.168.1.118","TLSv1.2","2902","Application Data, Application Data"
"394","0.356379985","192.168.1.118","35.186.208.48","TCP","66","34552 → 443 [ACK] Seq=545 Ack=191190 Win=3733 Len=0 TSval=17153793 TSecr=3133545061"
"395","0.356422274","192.168.1.118","35.186.208.48","TCP","66","34548 → 443 [ACK] Seq=811 Ack=216054 Win=1424 Len=0 TSval=17153793 TSecr=3556837160"
"396","0.356436249","35.186.208.48","192.168.1.118","TLSv1.2","2902","Application Data, Application Data"
"397","0.356474526","192.168.1.118","35.186.208.48","TCP","66","34552 → 443 [ACK] Seq=545 Ack=196862 Win=3689 Len=0 TSval=17153793 TSecr=3133545067"
"398","0.357384745","35.186.208.48","192.168.1.118","TLSv1.2","2902","Application Data, Application Data"
"399","0.357458448","192.168.1.118","35.186.208.48","TCP","66","34548 → 443 [ACK] Seq=811 Ack=218890 Win=1424 Len=0 TSval=17153794 TSecr=3556837162"
"400","0.357492724","35.186.208.48","192.168.1.118","TLSv1.2","2902","Application Data, Application Data"
"401","0.357919339","192.168.1.118","35.186.208.48","TCP","66","34552 → 443 [ACK] Seq=545 Ack=199698 Win=3667 Len=0 TSval=17153795 TSecr=3133545071"
"402","0.358479521","35.186.208.48","192.168.1.118","TLSv1.2","1484","Application Data [TCP segment of a reassembled PDU]"
"403","0.359637511","35.186.208.48","192.168.1.118","TLSv1.2","1484","Application Data [TCP segment of a reassembled PDU]"
"404","0.359684738","35.186.208.48","192.168.1.118","TLSv1.2","2902","Application Data, Application Data"
"405","0.359729840","192.168.1.118","35.186.208.48","TCP","66","34548 → 443 [ACK] Seq=811 Ack=221726 Win=1424 Len=0 TSval=17153797 TSecr=3556837165"
"406","0.359995249","192.168.1.118","35.186.208.48","TCP","66","34552 → 443 [ACK] Seq=545 Ack=202534 Win=3645 Len=0 TSval=17153797 TSecr=3133545073"
"407","0.360512042","35.186.208.48","192.168.1.118","TLSv1.2","1484","Application Data [TCP segment of a reassembled PDU]"
"408","0.361604230","35.186.208.48","192.168.1.118","TLSv1.2","1484","Application Data [TCP segment of a reassembled PDU]"
"409","0.361662845","192.168.1.118","35.186.208.48","TCP","66","34552 → 443 [ACK] Seq=545 Ack=205370 Win=3780 Len=0 TSval=17153799 TSecr=3133545075"
"410","0.362558564","35.186.208.48","192.168.1.118","TLSv1.2","2902","Application Data, Application Data"
"411","0.362609440","192.168.1.118","35.186.208.48","TCP","66","34548 → 443 [ACK] Seq=811 Ack=224562 Win=1424 Len=0 TSval=17153800 TSecr=3556837168"
"412","0.363628889","35.186.208.48","192.168.1.118","TLSv1.2","2902","Application Data, Application Data"
"413","0.363694916","192.168.1.118","35.186.208.48","TCP","66","34552 → 443 [ACK] Seq=545 Ack=208206 Win=3865 Len=0 TSval=17153801 TSecr=3133545077"
"414","0.364585897","35.186.208.48","192.168.1.118","TLSv1.2","2902","Application Data, Application Data"
"415","0.364648412","192.168.1.118","35.186.208.48","TCP","66","34552 → 443 [ACK] Seq=545 Ack=211042 Win=3865 Len=0 TSval=17153802 TSecr=3133545079"
"416","0.367031470","35.186.208.48","192.168.1.118","TLSv1.2","2902","Application Data, Application Data"
"417","0.367110198","192.168.1.118","35.186.208.48","TCP","66","34548 → 443 [ACK] Seq=811 Ack=227398 Win=1424 Len=0 TSval=17153804 TSecr=3556837171"
"418","0.368954975","35.186.208.48","192.168.1.118","TLSv1.2","2902","Application Data, Application Data"
"419","0.369030815","192.168.1.118","35.186.208.48","TCP","66","34552 → 443 [ACK] Seq=545 Ack=213878 Win=3865 Len=0 TSval=17153806 TSecr=3133545081"
"420","0.369068317","35.186.208.48","192.168.1.118","TLSv1.2","1484","Application Data [TCP segment of a reassembled PDU]"
"421","0.370606058","35.186.208.48","192.168.1.118","TLSv1.2","1484","Application Data [TCP segment of a reassembled PDU]"
"422","0.370675398","192.168.1.118","35.186.208.48","TCP","66","34548 → 443 [ACK] Seq=811 Ack=230234 Win=1424 Len=0 TSval=17153808 TSecr=3556837174"
"423","0.370713599","35.186.208.48","192.168.1.118","TLSv1.2","2902","Application Data, Application Data"
"424","0.370735225","192.168.1.118","35.186.208.48","TCP","66","34552 → 443 [ACK] Seq=545 Ack=216714 Win=3865 Len=0 TSval=17153808 TSecr=3133545083"
"425","0.374045666","35.186.208.48","192.168.1.118","TLSv1.2","2902","Application Data, Application Data"
"426","0.374124869","192.168.1.118","35.186.208.48","TCP","66","34548 → 443 [ACK] Seq=811 Ack=233070 Win=1424 Len=0 TSval=17153811 TSecr=3556837177"
"427","0.374164782","35.186.208.48","192.168.1.118","TLSv1.2","2902","Application Data, Application Data"
"428","0.374186871","192.168.1.118","35.186.208.48","TCP","66","34552 → 443 [ACK] Seq=545 Ack=219550 Win=3865 Len=0 TSval=17153811 TSecr=3133545086"
"429","0.376095550","35.186.208.48","192.168.1.118","TLSv1.2","2902","Application Data, Application Data"
"430","0.376172028","192.168.1.118","35.186.208.48","TCP","66","34552 → 443 [ACK] Seq=545 Ack=222386 Win=3865 Len=0 TSval=17153813 TSecr=3133545088"
"431","0.376222579","35.186.208.48","192.168.1.118","TLSv1.2","2902","Application Data, Application Data"
"432","0.376244668","192.168.1.118","35.186.208.48","TCP","66","34548 → 443 [ACK] Seq=811 Ack=235906 Win=1424 Len=0 TSval=17153813 TSecr=3556837180"
"433","0.376258006","35.186.208.48","192.168.1.118","TLSv1.2","2902","Application Data, Application Data"
"434","0.376597443","192.168.1.118","35.186.208.48","TCP","66","34552 → 443 [ACK] Seq=545 Ack=225222 Win=3844 Len=0 TSval=17153813 TSecr=3133545090"
"435","0.377738045","35.186.208.48","192.168.1.118","TLSv1.2","1668","Application Data, Application Data, Application Data"
"436","0.377811885","192.168.1.118","35.186.208.48","TCP","66","34548 → 443 [ACK] Seq=811 Ack=237508 Win=1424 Len=0 TSval=17153815 TSecr=3556837182"
"437","0.377869425","35.186.208.48","192.168.1.118","TLSv1.2","2902","Application Data, Application Data"
"438","0.378074594","192.168.1.118","35.186.208.48","TCP","66","34552 → 443 [ACK] Seq=545 Ack=228058 Win=3822 Len=0 TSval=17153815 TSecr=3133545092"
"439","0.379677400","35.186.208.48","192.168.1.118","TLSv1.2","1484","Application Data [TCP segment of a reassembled PDU]"
"440","0.380629896","35.186.208.48","192.168.1.118","TLSv1.2","1484","Application Data [TCP segment of a reassembled PDU]"
"441","0.380696874","192.168.1.118","35.186.208.48","TCP","66","34552 → 443 [ACK] Seq=545 Ack=230894 Win=3865 Len=0 TSval=17153818 TSecr=3133545094"
"442","0.380740950","35.186.208.48","192.168.1.118","TLSv1.2","1484","Application Data [TCP segment of a reassembled PDU]"
"443","0.381301670","35.186.208.48","192.168.1.118","TLSv1.2","1484","Application Data [TCP segment of a reassembled PDU]"
"444","0.383354229","35.186.208.48","192.168.1.118","TLSv1.2","1484","Application Data [TCP segment of a reassembled PDU]"
"445","0.387552126","35.186.208.48","192.168.1.118","TLSv1.2","1484","Application Data, Application Data"
"446","0.387611841","35.186.208.48","192.168.1.118","TLSv1.2","1484","Application Data [TCP segment of a reassembled PDU]"
"447","0.388800582","35.186.208.48","192.168.1.118","TLSv1.2","1484","Application Data [TCP segment of a reassembled PDU]"
"448","0.388848409","35.186.208.48","192.168.1.118","TLSv1.2","2902","Application Data, Application Data"
"449","0.388875197","35.186.208.48","192.168.1.118","TLSv1.2","2902","Application Data, Application Data"
"450","0.389935634","35.186.208.48","192.168.1.118","TLSv1.2","1484","Application Data [TCP segment of a reassembled PDU]"
"451","0.390911494","35.186.208.48","192.168.1.118","TLSv1.2","1484","Application Data [TCP segment of a reassembled PDU]"
"452","0.392128336","35.186.208.48","192.168.1.118","TLSv1.2","2902","Application Data, Application Data"
"453","0.393417106","35.186.208.48","192.168.1.118","TLSv1.2","1484","Application Data [TCP segment of a reassembled PDU]"
"454","0.395686823","35.186.208.48","192.168.1.118","TLSv1.2","1484","Application Data [TCP segment of a reassembled PDU]"
"455","0.396853051","192.168.1.118","35.186.208.48","TCP","66","34552 → 443 [ACK] Seq=545 Ack=253582 Win=3688 Len=0 TSval=17153834 TSecr=3133545096"
"456","0.399629686","35.186.208.48","192.168.1.118","TLSv1.2","2902","Application Data, Application Data"
"457","0.404726977","35.186.208.48","192.168.1.118","TLSv1.2","1484","Application Data [TCP segment of a reassembled PDU]"
"458","0.408843871","35.186.208.48","192.168.1.118","TLSv1.2","1484","Application Data [TCP segment of a reassembled PDU]"
"459","0.408911786","35.186.208.48","192.168.1.118","TLSv1.2","2902","Application Data, Application Data"
"460","0.408928399","35.186.208.48","192.168.1.118","TLSv1.2","1484","Application Data [TCP segment of a reassembled PDU]"
"461","0.408994976","35.186.208.48","192.168.1.118","TLSv1.2","1484","Application Data [TCP segment of a reassembled PDU]"
"462","0.410499804","35.186.208.48","192.168.1.118","TLSv1.2","2902","Application Data, Application Data"
"463","0.410580582","35.186.208.48","192.168.1.118","TLSv1.2","2902","Application Data, Application Data"
"464","0.410604595","35.186.208.48","192.168.1.118","TLSv1.2","2902","Application Data, Application Data"
"465","0.410626346","35.186.208.48","192.168.1.118","TLSv1.2","2902","Application Data, Application Data"
"466","0.411077199","192.168.1.118","35.186.208.48","TCP","66","34552 → 443 [ACK] Seq=545 Ack=276270 Win=3511 Len=0 TSval=17153848 TSecr=3133545110"
"467","0.411229255","35.186.208.48","192.168.1.118","TLSv1.2","1484","Application Data [TCP segment of a reassembled PDU]"
"468","0.411336533","35.186.208.48","192.168.1.118","TLSv1.2","1484","Application Data [TCP segment of a reassembled PDU]"
"469","0.411735260","192.168.1.118","35.186.208.48","TCP","66","34552 → 443 [ACK] Seq=545 Ack=279106 Win=3489 Len=0 TSval=17153849 TSecr=3133545125"
"470","0.413317690","35.186.208.48","192.168.1.118","TLSv1.2","2902","Application Data, Application Data"
"471","0.413570612","192.168.1.118","35.186.208.48","TCP","66","34552 → 443 [ACK] Seq=545 Ack=281942 Win=3467 Len=0 TSval=17153850 TSecr=3133545127"
"472","0.414178495","35.186.208.48","192.168.1.118","TLSv1.2","2902","Application Data, Application Data"
"473","0.414399603","192.168.1.118","35.186.208.48","TCP","66","34552 → 443 [ACK] Seq=545 Ack=284778 Win=3445 Len=0 TSval=17153851 TSecr=3133545128"
"474","0.417126624","35.186.208.48","192.168.1.118","TLSv1.2","1484","Application Data [TCP segment of a reassembled PDU]"
"475","0.417806897","35.186.208.48","192.168.1.118","TLSv1.2","1484","Application Data [TCP segment of a reassembled PDU]"
"476","0.417851411","35.186.208.48","192.168.1.118","TLSv1.2","2902","Application Data, Application Data"
"477","0.418120521","192.168.1.118","35.186.208.48","TCP","66","34552 → 443 [ACK] Seq=545 Ack=290450 Win=3401 Len=0 TSval=17153855 TSecr=3133545130"
"478","0.419581697","35.186.208.48","192.168.1.118","TLSv1.2","1484","Application Data [TCP segment of a reassembled PDU]"
"479","0.420739162","35.186.208.48","192.168.1.118","TLSv1.2","1484","Application Data [TCP segment of a reassembled PDU]"
"480","0.420813865","192.168.1.118","35.186.208.48","TCP","66","34552 → 443 [ACK] Seq=545 Ack=293286 Win=3441 Len=0 TSval=17153858 TSecr=3133545133"
"481","0.422714394","35.186.208.48","192.168.1.118","TLSv1.2","2902","Application Data, Application Data"
"482","0.422803447","35.186.208.48","192.168.1.118","TLSv1.2","2902","Application Data, Application Data"
"483","0.423295839","35.186.208.48","192.168.1.118","TLSv1.2","2902","Application Data, Application Data"
"484","0.423931924","192.168.1.118","35.186.208.48","TCP","66","34552 → 443 [ACK] Seq=545 Ack=301794 Win=3375 Len=0 TSval=17153861 TSecr=3133545135"
"485","0.424329838","35.186.208.48","192.168.1.118","TLSv1.2","1484","Application Data, Application Data"
"486","0.429318338","35.186.208.48","192.168.1.118","TLSv1.2","1484","Application Data [TCP segment of a reassembled PDU]"
"487","0.429404891","192.168.1.118","35.186.208.48","TCP","66","34552 → 443 [ACK] Seq=545 Ack=304630 Win=3844 Len=0 TSval=17153866 TSecr=3133545139"
"488","0.432769483","35.186.208.48","192.168.1.118","TLSv1.2","2902","Application Data, Application Data"
"489","0.432852224","192.168.1.118","35.186.208.48","TCP","66","34552 → 443 [ACK] Seq=545 Ack=307466 Win=3865 Len=0 TSval=17153870 TSecr=3133545141"
"490","0.432903613","35.186.208.48","192.168.1.118","TLSv1.2","2902","Application Data, Application Data"
"491","0.432964228","35.186.208.48","192.168.1.118","TLSv1.2","2902","Application Data, Application Data"
"492","0.432997091","35.186.208.48","192.168.1.118","TLSv1.2","2902","Application Data, Application Data"
"493","0.433255463","192.168.1.118","35.186.208.48","TCP","66","34552 → 443 [ACK] Seq=545 Ack=315974 Win=3799 Len=0 TSval=17153870 TSecr=3133545142"
"494","0.453448232","35.186.208.48","192.168.1.118","TLSv1.2","2902","Application Data, Application Data"
"495","0.453530598","192.168.1.118","35.186.208.48","TCP","66","34552 → 443 [ACK] Seq=545 Ack=318810 Win=3865 Len=0 TSval=17153890 TSecr=3133545147"
"496","0.453599688","35.186.208.48","192.168.1.118","TLSv1.2","2902","Application Data, Application Data"
"497","0.453763993","192.168.1.118","35.186.208.48","TCP","66","34552 → 443 [ACK] Seq=545 Ack=321646 Win=3844 Len=0 TSval=17153891 TSecr=3133545148"
"498","0.458458308","35.186.208.48","192.168.1.118","TLSv1.2","2902","Application Data, Application Data"
"499","0.458557261","192.168.1.118","35.186.208.48","TCP","66","34552 → 443 [ACK] Seq=545 Ack=324482 Win=3865 Len=0 TSval=17153895 TSecr=3133545149"
"500","0.458607238","35.186.208.48","192.168.1.118","TLSv1.2","2902","Application Data, Application Data"
"501","0.458663852","35.186.208.48","192.168.1.118","TLSv1.2","2902","Application Data, Application Data"
"502","0.458693278","35.186.208.48","192.168.1.118","TLSv1.2","2902","Application Data, Application Data"
"503","0.458719667","35.186.208.48","192.168.1.118","TLSv1.2","2902","Application Data, Application Data"
"504","0.458754243","35.186.208.48","192.168.1.118","TLSv1.2","2902","Application Data, Application Data"
"505","0.458781144","35.186.208.48","192.168.1.118","TLSv1.2","2902","Application Data, Application Data"
"506","0.458804607","35.186.208.48","192.168.1.118","TLSv1.2","2902","Application Data, Application Data"
"507","0.459003814","192.168.1.118","35.186.208.48","TCP","66","34552 → 443 [ACK] Seq=545 Ack=344334 Win=3710 Len=0 TSval=17153896 TSecr=3133545152"
"508","0.461861264","35.186.208.48","192.168.1.118","TLSv1.2","2902","Application Data, Application Data"
"509","0.461934242","35.186.208.48","192.168.1.118","TLSv1.2","2902","Application Data, Application Data"
"510","0.461961593","35.186.208.48","192.168.1.118","TLSv1.2","2902","Application Data, Application Data"
"511","0.461986256","35.186.208.48","192.168.1.118","TLSv1.2","2902","Application Data, Application Data"
"512","0.463953462","192.168.1.118","35.186.208.48","TCP","66","34552 → 443 [ACK] Seq=545 Ack=355678 Win=3622 Len=0 TSval=17153901 TSecr=3133545168"
"513","0.465580132","35.186.208.48","192.168.1.118","TLSv1.2","2902","Application Data, Application Data"
"514","0.465642459","35.186.208.48","192.168.1.118","TLSv1.2","1983","Application Data, Application Data"
"515","0.466085087","192.168.1.118","35.186.208.48","TCP","66","34552 → 443 [ACK] Seq=545 Ack=360431 Win=3585 Len=0 TSval=17153903 TSecr=3133545176"
"516","0.558065719","192.168.1.118","184.87.56.88","TLSv1.2","1303","Application Data"
"517","0.624623698","184.87.56.88","192.168.1.118","TCP","66","443 → 38216 [ACK] Seq=1 Ack=1238 Win=315 Len=0 TSval=3188035210 TSecr=17153995"
"518","0.632478898","184.87.56.88","192.168.1.118","TCP","1514","[TCP segment of a reassembled PDU]"
"519","0.632584077","192.168.1.118","184.87.56.88","TCP","66","38216 → 443 [ACK] Seq=1238 Ack=1449 Win=1073 Len=0 TSval=17154070 TSecr=3188035214"
"520","0.637600515","184.87.56.88","192.168.1.118","TLSv1.2","3051","Application Data"
"521","0.637681455","192.168.1.118","184.87.56.88","TCP","66","38216 → 443 [ACK] Seq=1238 Ack=4434 Win=1120 Len=0 TSval=17154075 TSecr=3188035214"
"522","3.314811051","192.168.1.104","255.255.255.255","UDP","217","49154 → 6666 Len=175"
"523","4.471054618","192.168.1.118","192.168.1.102","TCP","176","33923 → 8009 [PSH, ACK] Seq=1 Ack=1 Win=364 Len=110 TSval=17157908 TSecr=4261105 [TCP segment of a reassembled PDU]"
"524","4.476507696","192.168.1.102","192.168.1.118","TCP","176","8009 → 33923 [PSH, ACK] Seq=1 Ack=111 Win=294 Len=110 TSval=4261607 TSecr=17157908 [TCP segment of a reassembled PDU]"
"525","4.476626200","192.168.1.118","192.168.1.102","TCP","66","33923 → 8009 [ACK] Seq=111 Ack=111 Win=364 Len=0 TSval=17157914 TSecr=4261607"
"526","5.442619234","192.168.1.118","172.217.7.3","TCP","66","42561 → 80 [ACK] Seq=1 Ack=1 Win=229 Len=0 TSval=17158880 TSecr=1678541137"
"527","5.462899069","172.217.7.3","192.168.1.118","TCP","66","[TCP ACKed unseen segment] 80 → 42561 [ACK] Seq=1 Ack=2 Win=265 Len=0 TSval=1678586165 TSecr=17113867"
"528","6.284947202","192.168.1.104","255.255.255.255","UDP","217","49154 → 6666 Len=175"
"529","6.900629087","192.168.1.100","224.0.0.251","MDNS","175","Standard query 0x0000 ANY cjqg._smb._tcp.local, "QM" question ANY cjqg._companion-link._tcp.local, "QM" question SRV 0 0 445 cjqg.local SRV 0 0 53222 cjqg.local OPT"
"530","7.104514135","192.168.1.100","224.0.0.251","MDNS","175","Standard query 0x0000 ANY cjqg._smb._tcp.local, "QM" question ANY cjqg._companion-link._tcp.local, "QM" question SRV 0 0 445 cjqg.local SRV 0 0 53222 cjqg.local OPT"
"531","7.616786477","192.168.1.100","224.0.0.251","MDNS","207","Standard query response 0x0000 PTR _smb._tcp.local TXT OPT"
"532","7.818595590","192.168.1.102","224.0.0.251","MDNS","183","Standard query response 0x0000 SRV, cache flush 0 0 8009 2c3f16b2-da5c-4b6f-d6cf-bfba61c12490.local"
"533","9.252017983","192.168.1.104","255.255.255.255","UDP","217","49154 → 6666 Len=175"
"534","9.478100608","192.168.1.118","192.168.1.102","TCP","176","33923 → 8009 [PSH, ACK] Seq=111 Ack=111 Win=364 Len=110 TSval=17162915 TSecr=4261607 [TCP segment of a reassembled PDU]"
