frame.number,_ws.col.Time,_ws.col.Source,_ws.col.Destination,_ws.col.Protocol,frame.len,_ws.col.Info
"1","0.000000000","199.232.37.224","192.168.1.118","TCP","1418","[TCP segment of a reassembled PDU]"
"2","0.003336913","199.232.37.224","192.168.1.118","TLSv1.2","269","Application Data, Application Data, Application Data, Application Data, Application Data"
"3","0.003473975","192.168.1.118","199.232.37.224","TCP","66","34284 → 443 [ACK] Seq=1 Ack=1556 Win=493 Len=0 TSval=1319208340 TSecr=3139581778"
"4","0.003536163","199.232.37.224","192.168.1.118","TLSv1.2","3116","Application Data, Application Data, Application Data, Application Data, Application Data"
"5","0.003637325","199.232.37.224","192.168.1.118","TLSv1.2","170","Application Data, Application Data, Application Data"
"6","0.003732788","199.232.37.224","192.168.1.118","TLSv1.2","2708","Application Data, Application Data, Application Data, Application Data"
"7","0.003842700","199.232.37.224","192.168.1.118","TLSv1.2","2770","Application Data, Application Data"
"8","0.004827838","192.168.1.118","199.232.37.224","TCP","66","34284 → 443 [ACK] Seq=1 Ack=10056 Win=427 Len=0 TSval=1319208341 TSecr=3139581778"
"9","0.014032688","192.168.1.118","199.232.37.224","TCP","74","34286 → 443 [SYN] Seq=0 Win=64240 Len=0 MSS=1460 SACK_PERM=1 TSval=1319208350 TSecr=0 WS=128"
"10","0.014184125","192.168.1.118","199.232.37.224","TCP","74","34288 → 443 [SYN] Seq=0 Win=64240 Len=0 MSS=1460 SACK_PERM=1 TSval=1319208350 TSecr=0 WS=128"
"11","0.014285463","192.168.1.118","199.232.37.224","TCP","74","34290 → 443 [SYN] Seq=0 Win=64240 Len=0 MSS=1460 SACK_PERM=1 TSval=1319208350 TSecr=0 WS=128"
"12","0.021734163","199.232.37.224","192.168.1.118","TLSv1.2","1418","Application Data [TCP segment of a reassembled PDU]"
"13","0.022014363","192.168.1.118","104.102.89.129","TCP","66","41138 → 80 [FIN, ACK] Seq=1 Ack=1 Win=501 Len=0 TSval=1483289118 TSecr=1678307878"
"14","0.022196800","192.168.1.118","199.232.37.224","TCP","74","34292 → 443 [SYN] Seq=0 Win=64240 Len=0 MSS=1460 SACK_PERM=1 TSval=1319208358 TSecr=0 WS=128"
"15","0.025824325","199.232.37.224","192.168.1.118","TLSv1.2","4122","Application Data, Application Data, Application Data, Application Data, Application Data, Application Data, Application Data, Application Data, Application Data, Application Data, Application Data, Application Data, Application Data, Application Data, Application Data, Application Data, Application Data, Application Data"
"16","0.025951975","192.168.1.118","199.232.37.224","TCP","66","34284 → 443 [ACK] Seq=1 Ack=15464 Win=461 Len=0 TSval=1319208362 TSecr=3139581790"
"17","0.026207563","199.232.37.224","192.168.1.118","TLSv1.2","10882","Application Data, Application Data, Application Data, Application Data, Application Data, Application Data, Application Data, Application Data, Application Data, Application Data, Application Data, Application Data, Application Data, Application Data, Application Data, Application Data, Application Data, Application Data, Application Data, Application Data, Application Data, Application Data, Application Data, Application Data, Application Data, Application Data, Application Data, Application Data"
"18","0.032407325","199.232.37.224","192.168.1.118","TLSv1.2","5474","Application Data, Application Data, Application Data, Application Data, Application Data, Application Data, Application Data, Application Data, Application Data, Application Data, Application Data, Application Data, Application Data, Application Data, Application Data, Application Data, Application Data, Application Data, Application Data, Application Data, Application Data, Application Data, Application Data, Application Data, Application Data, Application Data, Application Data, Application Data, Application Data, Application Data, Application Data, Application Data, Application Data, Application Data"
"19","0.032786263","192.168.1.118","199.232.37.224","TCP","66","34284 → 443 [ACK] Seq=1 Ack=31688 Win=335 Len=0 TSval=1319208369 TSecr=3139581790"
"20","0.039136088","199.232.37.224","192.168.1.118","TLSv1.2","2770","Application Data, Application Data, Application Data, Application Data, Application Data"
"21","0.039192938","199.232.37.224","192.168.1.118","TCP","74","443 → 34286 [SYN, ACK] Seq=0 Ack=1 Win=27040 Len=0 MSS=1364 SACK_PERM=1 TSval=3118415335 TSecr=1319208350 WS=512"
"22","0.039251863","192.168.1.118","199.232.37.224","TCP","66","34286 → 443 [ACK] Seq=1 Ack=1 Win=64256 Len=0 TSval=1319208375 TSecr=3118415335"
"23","0.039286588","199.232.37.224","192.168.1.118","TLSv1.2","2770","Application Data, Application Data"
"24","0.039799050","192.168.1.118","199.232.37.224","TCP","66","34284 → 443 [ACK] Seq=1 Ack=37096 Win=293 Len=0 TSval=1319208376 TSecr=3139581790"
"25","0.043348100","199.232.37.224","192.168.1.118","TCP","74","443 → 34290 [SYN, ACK] Seq=0 Ack=1 Win=27040 Len=0 MSS=1364 SACK_PERM=1 TSval=3243817460 TSecr=1319208350 WS=512"
"26","0.043434675","192.168.1.118","199.232.37.224","TCP","66","34290 → 443 [ACK] Seq=1 Ack=1 Win=64256 Len=0 TSval=1319208380 TSecr=3243817460"
"27","0.053998800","199.232.37.224","192.168.1.118","TCP","74","443 → 34288 [SYN, ACK] Seq=0 Ack=1 Win=27040 Len=0 MSS=1364 SACK_PERM=1 TSval=851228660 TSecr=1319208350 WS=512"
"28","0.054098800","192.168.1.118","199.232.37.224","TCP","66","34288 → 443 [ACK] Seq=1 Ack=1 Win=64256 Len=0 TSval=1319208390 TSecr=851228660"
"29","0.054143313","199.232.37.224","192.168.1.118","TCP","74","443 → 34292 [SYN, ACK] Seq=0 Ack=1 Win=27040 Len=0 MSS=1364 SACK_PERM=1 TSval=268256346 TSecr=1319208358 WS=512"
"30","0.054178750","192.168.1.118","199.232.37.224","TCP","66","34292 → 443 [ACK] Seq=1 Ack=1 Win=64256 Len=0 TSval=1319208390 TSecr=268256346"
"31","0.054202400","104.102.89.129","192.168.1.118","TCP","66","80 → 41138 [FIN, ACK] Seq=1 Ack=2 Win=235 Len=0 TSval=1678308559 TSecr=1483289118"
"32","0.054236750","192.168.1.118","104.102.89.129","TCP","66","41138 → 80 [ACK] Seq=2 Ack=2 Win=501 Len=0 TSval=1483289150 TSecr=1678308559"
"33","0.057100150","192.168.1.118","199.232.37.224","TLSv1","583","Client Hello"
"34","0.073419163","192.168.1.118","199.232.37.224","TLSv1","583","Client Hello"
"35","0.085677938","199.232.37.224","192.168.1.118","TLSv1.2","1418","Application Data, Application Data, Application Data, Application Data"
"36","0.087969038","199.232.37.224","192.168.1.118","TLSv1.2","1418","Application Data, Application Data, Application Data, Application Data, Application Data, Application Data, Application Data, Application Data, Application Data"
"37","0.088135888","199.232.37.224","192.168.1.118","TLSv1.2","4122","Application Data, Application Data, Application Data, Application Data, Application Data, Application Data, Application Data, Application Data"
"38","0.089795413","192.168.1.118","199.232.37.224","TLSv1","583","Client Hello"
"39","0.089935400","199.232.37.224","192.168.1.118","TLSv1.2","5474","Application Data, Application Data, Application Data, Application Data, Application Data, Application Data, Application Data, Application Data, Application Data"
"40","0.094158188","199.232.37.224","192.168.1.118","TLSv1.2","425","Application Data, Application Data"
"41","0.100111025","199.232.37.224","192.168.1.118","TCP","66","443 → 34286 [ACK] Seq=1 Ack=518 Win=28160 Len=0 TSval=3118415351 TSecr=1319208393"
"42","0.102806250","199.232.37.224","192.168.1.118","TLSv1.2","3751","Server Hello, Certificate, Server Key Exchange, Server Hello Done"
"43","0.102937250","192.168.1.118","199.232.37.224","TCP","66","34286 → 443 [ACK] Seq=518 Ack=3686 Win=60672 Len=0 TSval=1319208439 TSecr=3118415352"
"44","0.106111850","192.168.1.118","199.232.37.224","TLSv1","583","Client Hello"
"45","0.106216025","192.168.1.118","199.232.37.224","TCP","66","34284 → 443 [ACK] Seq=1 Ack=49623 Win=196 Len=0 TSval=1319208442 TSecr=3139581806"
"46","0.108174000","192.168.1.118","199.232.37.224","TLSv1.2","192","Client Key Exchange, Change Cipher Spec, Encrypted Handshake Message"
"47","0.118143388","199.232.37.224","192.168.1.118","TCP","66","443 → 34288 [ACK] Seq=1 Ack=518 Win=28160 Len=0 TSval=851228677 TSecr=1319208410"
"48","0.118318463","199.232.37.224","192.168.1.118","TLSv1.2","3751","Server Hello, Certificate, Server Key Exchange, Server Hello Done"
"49","0.118419463","192.168.1.118","199.232.37.224","TCP","66","34288 → 443 [ACK] Seq=518 Ack=3686 Win=60672 Len=0 TSval=1319208455 TSecr=851228677"
"50","0.118554300","199.232.37.224","192.168.1.118","TCP","66","443 → 34290 [ACK] Seq=1 Ack=518 Win=28160 Len=0 TSval=3243817479 TSecr=1319208426"
"51","0.121616163","192.168.1.118","199.232.37.224","TLSv1.2","192","Client Key Exchange, Change Cipher Spec, Encrypted Handshake Message"
"52","0.123477388","199.232.37.224","192.168.1.118","TLSv1.2","3751","Server Hello, Certificate, Server Key Exchange, Server Hello Done"
"53","0.123555950","192.168.1.118","199.232.37.224","TCP","66","34290 → 443 [ACK] Seq=518 Ack=3686 Win=60672 Len=0 TSval=1319208460 TSecr=3243817479"
"54","0.130933225","192.168.1.118","199.232.37.224","TLSv1.2","192","Client Key Exchange, Change Cipher Spec, Encrypted Handshake Message"
"55","0.131928588","192.168.1.118","209.18.47.62","DNS","76","Standard query 0xe324 A i.etsystatic.com"
"56","0.132288550","192.168.1.118","209.18.47.62","DNS","76","Standard query 0x4706 A i.etsystatic.com"
"57","0.138356438","192.168.1.118","209.18.47.62","DNS","76","Standard query 0x2b26 A i.etsystatic.com"
"58","0.149782413","199.232.37.224","192.168.1.118","TCP","66","443 → 34292 [ACK] Seq=1 Ack=518 Win=28160 Len=0 TSval=268256371 TSecr=1319208442"
"59","0.151355225","199.232.37.224","192.168.1.118","TLSv1.2","117","Change Cipher Spec, Encrypted Handshake Message"
"60","0.155899513","199.232.37.224","192.168.1.118","TLSv1.2","3751","Server Hello, Certificate, Server Key Exchange, Server Hello Done"
"61","0.156004238","192.168.1.118","199.232.37.224","TCP","66","34292 → 443 [ACK] Seq=518 Ack=3686 Win=60672 Len=0 TSval=1319208492 TSecr=268256372"
"62","0.156717875","192.168.1.118","199.232.37.224","TLSv1.2","792","Application Data"
"63","0.158641250","192.168.1.118","199.232.37.224","TLSv1.2","192","Client Key Exchange, Change Cipher Spec, Encrypted Handshake Message"
"64","0.159889613","192.168.1.118","209.18.47.62","DNS","76","Standard query 0xe7b7 A i.etsystatic.com"
"65","0.160647500","192.168.1.118","209.18.47.62","DNS","76","Standard query 0xefea A i.etsystatic.com"
"66","0.166443488","209.18.47.62","192.168.1.118","DNS","125","Standard query response 0x4706 A i.etsystatic.com CNAME etsy.map.fastly.net A 199.232.37.224"
"67","0.166760213","192.168.1.118","209.18.47.62","DNS","76","Standard query 0xa7e0 AAAA i.etsystatic.com"
"68","0.176629263","199.232.37.224","192.168.1.118","TCP","66","443 → 34290 [ACK] Seq=3686 Ack=644 Win=28160 Len=0 TSval=3243817491 TSecr=1319208467"
"69","0.177651675","209.18.47.62","192.168.1.118","DNS","125","Standard query response 0x2b26 A i.etsystatic.com CNAME etsy.map.fastly.net A 199.232.37.224"
"70","0.177766325","199.232.37.224","192.168.1.118","TLSv1.2","117","Change Cipher Spec, Encrypted Handshake Message"
"71","0.177835088","209.18.47.62","192.168.1.118","DNS","167","Standard query response 0xe324 A i.etsystatic.com CNAME i.etsystatic.com.edgekey.net CNAME e8634.f.akamaiedge.net A 173.223.57.41"
"72","0.177902863","199.232.37.224","192.168.1.118","TLSv1.2","117","Change Cipher Spec, Encrypted Handshake Message"
"73","0.177972425","199.232.37.224","192.168.1.118","TLSv1.2","117","Change Cipher Spec, Encrypted Handshake Message"
"74","0.178229000","192.168.1.118","209.18.47.62","DNS","76","Standard query 0x772c AAAA i.etsystatic.com"
"75","0.178446438","192.168.1.118","209.18.47.62","DNS","76","Standard query 0x0f2a AAAA i.etsystatic.com"
"76","0.179584100","192.168.1.118","199.232.37.224","TLSv1.2","912","Application Data"
"77","0.179860163","192.168.1.118","199.232.37.224","TLSv1.2","621","Application Data"
"78","0.180111950","192.168.1.118","199.232.37.224","TLSv1.2","664","Application Data"
"79","0.181889750","199.232.37.224","192.168.1.118","TLSv1.2","5474","Application Data, Application Data, Application Data, Application Data"
"80","0.182188125","192.168.1.118","199.232.37.224","TCP","66","34286 → 443 [ACK] Seq=1370 Ack=9145 Win=58752 Len=0 TSval=1319208518 TSecr=3118415371"
"81","0.186225350","199.232.37.224","192.168.1.118","TLSv1.2","8178","Application Data, Application Data, Application Data, Application Data, Application Data, Application Data"
"82","0.186494550","192.168.1.118","199.232.37.224","TCP","66","34286 → 443 [ACK] Seq=1370 Ack=17257 Win=50688 Len=0 TSval=1319208523 TSecr=3118415371"
"83","0.197754013","209.18.47.62","192.168.1.118","DNS","167","Standard query response 0xe7b7 A i.etsystatic.com CNAME i.etsystatic.com.edgekey.net CNAME e8634.f.akamaiedge.net A 173.223.57.41"
"84","0.198107388","192.168.1.118","209.18.47.62","DNS","76","Standard query 0x1f57 AAAA i.etsystatic.com"
"85","0.203938313","209.18.47.62","192.168.1.118","DNS","209","Standard query response 0x772c AAAA i.etsystatic.com CNAME i.etsystatic.com.edgekey.net CNAME e8634.f.akamaiedge.net SOA n0f.akamaiedge.net"
"86","0.205274788","199.232.37.224","192.168.1.118","TLSv1.2","934","Application Data, Application Data"
"87","0.205409813","199.232.37.224","192.168.1.118","TLSv1.2","1418","Application Data [TCP segment of a reassembled PDU]"
"88","0.206203113","192.168.1.118","199.232.37.224","TCP","74","34294 → 443 [SYN] Seq=0 Win=64240 Len=0 MSS=1460 SACK_PERM=1 TSval=1319208542 TSecr=0 WS=128"
"89","0.206309875","192.168.1.118","199.232.37.224","TCP","74","34296 → 443 [SYN] Seq=0 Win=64240 Len=0 MSS=1460 SACK_PERM=1 TSval=1319208542 TSecr=0 WS=128"
"90","0.206381100","192.168.1.118","199.232.37.224","TCP","74","34298 → 443 [SYN] Seq=0 Win=64240 Len=0 MSS=1460 SACK_PERM=1 TSval=1319208543 TSecr=0 WS=128"
"91","0.206697900","192.168.1.118","199.232.37.224","TCP","74","34300 → 443 [SYN] Seq=0 Win=64240 Len=0 MSS=1460 SACK_PERM=1 TSval=1319208543 TSecr=0 WS=128"
"92","0.206806575","192.168.1.118","199.232.37.224","TCP","74","34302 → 443 [SYN] Seq=0 Win=64240 Len=0 MSS=1460 SACK_PERM=1 TSval=1319208543 TSecr=0 WS=128"
"93","0.206866825","199.232.37.224","192.168.1.118","TLSv1.2","1418","Application Data [TCP segment of a reassembled PDU]"
"94","0.206982200","192.168.1.118","199.232.37.224","TCP","66","34286 → 443 [ACK] Seq=1370 Ack=19961 Win=63104 Len=0 TSval=1319208543 TSecr=3118415378"
"95","0.208999875","199.232.37.224","192.168.1.118","TLSv1.2","1418","Application Data [TCP segment of a reassembled PDU]"
"96","0.210436963","199.232.37.224","192.168.1.118","TLSv1.2","1418","Application Data [TCP segment of a reassembled PDU]"
"97","0.210560475","192.168.1.118","199.232.37.224","TCP","66","34286 → 443 [ACK] Seq=1370 Ack=22665 Win=63104 Len=0 TSval=1319208547 TSecr=3118415378"
"98","0.210638975","209.18.47.62","192.168.1.118","DNS","167","Standard query response 0xefea A i.etsystatic.com CNAME i.etsystatic.com.edgekey.net CNAME e8634.f.akamaiedge.net A 173.223.57.41"
"99","0.210746300","209.18.47.62","192.168.1.118","DNS","167","Standard query response 0xa7e0 AAAA i.etsystatic.com CNAME etsy.map.fastly.net SOA ns1.fastly.net"
"100","0.210802300","209.18.47.62","192.168.1.118","DNS","209","Standard query response 0x0f2a AAAA i.etsystatic.com CNAME i.etsystatic.com.edgekey.net CNAME e8634.f.akamaiedge.net SOA n0f.akamaiedge.net"
"101","0.210940725","199.232.37.224","192.168.1.118","TLSv1.2","10882","Application Data, Application Data, Application Data, Application Data, Application Data, Application Data, Application Data"
"102","0.211917063","192.168.1.118","209.18.47.62","DNS","76","Standard query 0x9fb1 AAAA i.etsystatic.com"
"103","0.212826388","199.232.37.224","192.168.1.118","TLSv1.2","2770","Application Data, Application Data"
"104","0.213137663","192.168.1.118","199.232.37.224","TCP","66","34286 → 443 [ACK] Seq=1370 Ack=33481 Win=52352 Len=0 TSval=1319208549 TSecr=3118415378"
"105","0.213298988","192.168.1.118","199.232.37.224","TCP","66","34292 → 443 [ACK] Seq=1242 Ack=6441 Win=61440 Len=0 TSval=1319208549 TSecr=268256385"
"106","0.214856613","199.232.37.224","192.168.1.118","TLSv1.2","5474","Application Data, Application Data, Application Data, Application Data"
"107","0.214929725","199.232.37.224","192.168.1.118","TLSv1.2","1418","Application Data"
"108","0.216612100","199.232.37.224","192.168.1.118","TLSv1.2","5137","Application Data, Application Data, Application Data, Application Data, Application Data"
"109","0.216783513","199.232.37.224","192.168.1.118","TLSv1.2","6826","Application Data, Application Data, Application Data, Application Data, Application Data"
"110","0.219483463","192.168.1.118","199.232.37.224","TCP","66","34288 → 443 [ACK] Seq=1490 Ack=11849 Win=56064 Len=0 TSval=1319208556 TSecr=851228701"
"111","0.219713100","192.168.1.118","199.232.37.224","TCP","66","34292 → 443 [ACK] Seq=1242 Ack=16920 Win=51072 Len=0 TSval=1319208556 TSecr=268256385"
"112","0.219976538","199.232.37.224","192.168.1.118","TLSv1.2","5474","Application Data, Application Data, Application Data, Application Data"
"113","0.220038513","199.232.37.224","192.168.1.118","TLSv1.2","4122","Application Data, Application Data, Application Data"
"114","0.221593838","199.232.37.224","192.168.1.118","TLSv1.2","1418","Application Data [TCP segment of a reassembled PDU]"
"115","0.221683413","209.18.47.62","192.168.1.118","DNS","209","Standard query response 0x1f57 AAAA i.etsystatic.com CNAME i.etsystatic.com.edgekey.net CNAME e8634.f.akamaiedge.net SOA n0f.akamaiedge.net"
"116","0.221738550","199.232.37.224","192.168.1.118","TLSv1.2","2770","Application Data, Application Data"
"117","0.221796950","199.232.37.224","192.168.1.118","TLSv1.2","2770","Application Data, Application Data"
"118","0.239038813","192.168.1.118","199.232.37.224","TCP","66","34286 → 443 [ACK] Seq=1370 Ack=44297 Win=41600 Len=0 TSval=1319208575 TSecr=3118415378"
"119","0.239236513","199.232.37.224","192.168.1.118","TLSv1.2","1418","Application Data [TCP segment of a reassembled PDU]"
"120","0.239376900","199.232.37.224","192.168.1.118","TCP","74","443 → 34294 [SYN, ACK] Seq=0 Ack=1 Win=27040 Len=0 MSS=1364 SACK_PERM=1 TSval=264597453 TSecr=1319208542 WS=512"
"121","0.239529650","192.168.1.118","199.232.37.224","TCP","66","34294 → 443 [ACK] Seq=1 Ack=1 Win=64256 Len=0 TSval=1319208576 TSecr=264597453"
"122","0.239612438","199.232.37.224","192.168.1.118","TCP","74","443 → 34298 [SYN, ACK] Seq=0 Ack=1 Win=27040 Len=0 MSS=1364 SACK_PERM=1 TSval=2805341004 TSecr=1319208543 WS=512"
"123","0.239696550","192.168.1.118","199.232.37.224","TCP","66","34298 → 443 [ACK] Seq=1 Ack=1 Win=64256 Len=0 TSval=1319208576 TSecr=2805341004"
"124","0.239774125","199.232.37.224","192.168.1.118","TCP","74","443 → 34296 [SYN, ACK] Seq=0 Ack=1 Win=27040 Len=0 MSS=1364 SACK_PERM=1 TSval=2969198894 TSecr=1319208542 WS=512"
"125","0.239811763","192.168.1.118","199.232.37.224","TCP","66","34288 → 443 [ACK] Seq=1490 Ack=17257 Win=50688 Len=0 TSval=1319208576 TSecr=851228701"
"126","0.239854625","192.168.1.118","199.232.37.224","TCP","66","34296 → 443 [ACK] Seq=1 Ack=1 Win=64256 Len=0 TSval=1319208576 TSecr=2969198894"
"127","0.239915975","199.232.37.224","192.168.1.118","TCP","74","443 → 34300 [SYN, ACK] Seq=0 Ack=1 Win=27040 Len=0 MSS=1364 SACK_PERM=1 TSval=2807245257 TSecr=1319208543 WS=512"
"128","0.239995650","192.168.1.118","199.232.37.224","TCP","66","34300 → 443 [ACK] Seq=1 Ack=1 Win=64256 Len=0 TSval=1319208576 TSecr=2807245257"
"129","0.240046475","199.232.37.224","192.168.1.118","TLSv1.2","4122","Application Data, Application Data, Application Data"
"130","0.240833238","199.232.37.224","192.168.1.118","TCP","74","443 → 34302 [SYN, ACK] Seq=0 Ack=1 Win=27040 Len=0 MSS=1364 SACK_PERM=1 TSval=3137576920 TSecr=1319208543 WS=512"
"131","0.240884013","192.168.1.118","199.232.37.224","TCP","66","34302 → 443 [ACK] Seq=1 Ack=1 Win=64256 Len=0 TSval=1319208577 TSecr=3137576920"
"132","0.240920150","199.232.37.224","192.168.1.118","TLSv1.2","2770","Application Data, Application Data"
"133","0.241387200","199.232.37.224","192.168.1.118","TLSv1.2","6826","Application Data, Application Data, Application Data, Application Data, Application Data"
"134","0.246885525","192.168.1.118","199.232.37.224","TCP","66","34290 → 443 [ACK] Seq=1199 Ack=4605 Win=64128 Len=0 TSval=1319208583 TSecr=3243817501"
"135","0.251244050","209.18.47.62","192.168.1.118","DNS","209","Standard query response 0x9fb1 AAAA i.etsystatic.com CNAME i.etsystatic.com.edgekey.net CNAME e8634.f.akamaiedge.net SOA n0f.akamaiedge.net"
"136","0.251355638","199.232.37.224","192.168.1.118","TLSv1.2","5474","Application Data, Application Data, Application Data, Application Data"
"137","0.251435350","199.232.37.224","192.168.1.118","TLSv1.2","2770","Application Data [TCP segment of a reassembled PDU]"
"138","0.260055975","199.232.37.224","192.168.1.118","TLSv1.2","5474","Application Data, Application Data, Application Data, Application Data"
"139","0.260148188","199.232.37.224","192.168.1.118","TLSv1.2","2770","Application Data, Application Data"
"140","0.261267225","199.232.37.224","192.168.1.118","TLSv1.2","1418","Application Data [TCP segment of a reassembled PDU]"
"141","0.263009588","192.168.1.118","199.232.37.224","TLSv1","583","Client Hello"
"142","0.263416413","199.232.37.224","192.168.1.118","TLSv1.2","2770","Application Data, Application Data"
"143","0.264941713","199.232.37.224","192.168.1.118","TLSv1.2","8178","Application Data, Application Data, Application Data, Application Data, Application Data"
"144","0.268645863","199.232.37.224","192.168.1.118","TLSv1.2","6826","Application Data, Application Data, Application Data, Application Data, Application Data"
"145","0.268713138","199.232.37.224","192.168.1.118","TLSv1.2","1418","Application Data [TCP segment of a reassembled PDU]"
"146","0.268770225","192.168.1.118","199.232.37.224","TCP","66","34286 → 443 [ACK] Seq=1370 Ack=76745 Win=9216 Len=0 TSval=1319208605 TSecr=3118415385"
"147","0.279339175","192.168.1.118","199.232.37.224","TLSv1","583","Client Hello"
"148","0.282199263","199.232.37.224","192.168.1.118","TLSv1.2","6826","Application Data, Application Data, Application Data, Application Data, Application Data"
"149","0.282288400","199.232.37.224","192.168.1.118","TLSv1.2","2770","Application Data, Application Data"
"150","0.284076400","199.232.37.224","192.168.1.118","TLSv1.2","2770","Application Data, Application Data"
"151","0.284151238","199.232.37.224","192.168.1.118","TLSv1.2","1418","Application Data [TCP segment of a reassembled PDU]"
"152","0.284223825","199.232.37.224","192.168.1.118","TLSv1.2","1418","Application Data [TCP segment of a reassembled PDU]"
"153","0.295702175","192.168.1.118","199.232.37.224","TLSv1","583","Client Hello"
"154","0.303930250","192.168.1.118","199.232.37.224","TCP","66","34288 → 443 [ACK] Seq=1490 Ack=44297 Win=23680 Len=0 TSval=1319208640 TSecr=851228715"
"155","0.311964800","192.168.1.118","199.232.37.224","TLSv1","583","Client Hello"
"156","0.322717663","192.168.1.118","199.232.37.224","TCP","66","34286 → 443 [ACK] Seq=1370 Ack=83505 Win=2560 Len=0 TSval=1319208659 TSecr=3118415393"
"157","0.326901563","199.232.37.224","192.168.1.118","TLSv1.2","1418","Application Data [TCP segment of a reassembled PDU]"
"158","0.331433688","192.168.1.118","199.232.37.224","TLSv1","583","Client Hello"
"159","0.335417588","199.232.37.224","192.168.1.118","TLSv1.2","1170","Application Data [TCP segment of a reassembled PDU]"
"160","0.335461363","199.232.37.224","192.168.1.118","TLSv1.2","1418","Application Data [TCP segment of a reassembled PDU]"
"161","0.335552938","199.232.37.224","192.168.1.118","TLSv1.2","3888","Application Data, Application Data, Application Data, Application Data"
"162","0.335576038","199.232.37.224","192.168.1.118","TCP","66","443 → 34302 [ACK] Seq=1 Ack=518 Win=28160 Len=0 TSval=3137576944 TSecr=1319208615"
"163","0.335856163","192.168.1.118","199.232.37.224","TCP","66","34286 → 443 [ACK] Seq=1370 Ack=85961 Win=128 Len=0 TSval=1319208672 TSecr=3118415409"
"164","0.336167750","192.168.1.118","199.232.37.224","TCP","66","34288 → 443 [ACK] Seq=1490 Ack=49471 Win=18560 Len=0 TSval=1319208672 TSecr=851228732"
"165","0.340412975","199.232.37.224","192.168.1.118","TCP","66","443 → 34294 [ACK] Seq=1 Ack=518 Win=28160 Len=0 TSval=264597477 TSecr=1319208632"
"166","0.340498150","199.232.37.224","192.168.1.118","TLSv1.2","3751","Server Hello, Certificate, Server Key Exchange, Server Hello Done"
"167","0.340556700","192.168.1.118","199.232.37.224","TCP","66","34294 → 443 [ACK] Seq=518 Ack=3686 Win=60672 Len=0 TSval=1319208677 TSecr=264597477"
"168","0.340615675","199.232.37.224","192.168.1.118","TLSv1.2","3751","Server Hello, Certificate, Server Key Exchange, Server Hello Done"
"169","0.340648038","192.168.1.118","199.232.37.224","TCP","66","34302 → 443 [ACK] Seq=518 Ack=3686 Win=60672 Len=0 TSval=1319208677 TSecr=3137576944"
"170","0.341337088","199.232.37.224","192.168.1.118","TCP","66","443 → 34300 [ACK] Seq=1 Ack=518 Win=28160 Len=0 TSval=2807245285 TSecr=1319208599"
"171","0.348595463","199.232.37.224","192.168.1.118","TLSv1.2","1418","Server Hello"
"172","0.348670338","192.168.1.118","199.232.37.224","TCP","66","34300 → 443 [ACK] Seq=518 Ack=1353 Win=63104 Len=0 TSval=1319208685 TSecr=2807245285"
"173","0.351575663","199.232.37.224","192.168.1.118","TLSv1.2","2399","Certificate, Server Key Exchange, Server Hello Done"
"174","0.351678850","192.168.1.118","199.232.37.224","TCP","66","34300 → 443 [ACK] Seq=518 Ack=3686 Win=60800 Len=0 TSval=1319208688 TSecr=2807245285"
"175","0.357701488","192.168.1.118","199.232.37.224","TLSv1.2","192","Client Key Exchange, Change Cipher Spec, Encrypted Handshake Message"
"176","0.359611613","192.168.1.118","199.232.37.224","TLSv1.2","192","Client Key Exchange, Change Cipher Spec, Encrypted Handshake Message"
"177","0.361472100","192.168.1.118","199.232.37.224","TLSv1.2","192","Client Key Exchange, Change Cipher Spec, Encrypted Handshake Message"
"178","0.384772550","192.168.1.118","209.18.47.62","DNS","73","Standard query 0x7bd3 A blog.etsy.com"
"179","0.385451050","192.168.1.118","209.18.47.62","DNS","73","Standard query 0xcfac A blog.etsy.com"
"180","0.386119375","192.168.1.118","209.18.47.62","DNS","73","Standard query 0x8720 A blog.etsy.com"
"181","0.394684038","192.168.1.118","199.232.37.224","TCP","66","[TCP Window Update] 34286 → 443 [ACK] Seq=1370 Ack=85961 Win=29056 Len=0 TSval=1319208731 TSecr=3118415409"
"182","0.399437038","199.232.37.224","192.168.1.118","TCP","66","443 → 34296 [ACK] Seq=1 Ack=518 Win=28160 Len=0 TSval=2969199054 TSecr=1319208648"
"183","0.423164488","199.232.37.224","192.168.1.118","TCP","66","443 → 34300 [ACK] Seq=3686 Ack=644 Win=28160 Len=0 TSval=2807245297 TSecr=1319208694"
"184","0.423213388","199.232.37.224","192.168.1.118","TCP","66","443 → 34302 [ACK] Seq=3686 Ack=644 Win=28160 Len=0 TSval=3137576960 TSecr=1319208696"
"185","0.423229838","199.232.37.224","192.168.1.118","TLSv1.2","117","Change Cipher Spec, Encrypted Handshake Message"
"186","0.423252538","199.232.37.224","192.168.1.118","TLSv1.2","117","Change Cipher Spec, Encrypted Handshake Message"
"187","0.423265250","199.232.37.224","192.168.1.118","TLSv1.2","117","Change Cipher Spec, Encrypted Handshake Message"
"188","0.423277388","199.232.37.224","192.168.1.118","TCP","66","443 → 34298 [ACK] Seq=1 Ack=518 Win=28160 Len=0 TSval=2805341044 TSecr=1319208668"
"189","0.423311663","199.232.37.224","192.168.1.118","TLSv1.2","3751","Server Hello, Certificate, Server Key Exchange, Server Hello Done"
"190","0.423343050","192.168.1.118","199.232.37.224","TCP","66","34298 → 443 [ACK] Seq=518 Ack=3686 Win=60672 Len=0 TSval=1319208759 TSecr=2805341044"
"191","0.423380925","199.232.37.224","192.168.1.118","TLSv1.2","1418","Server Hello"
"192","0.423397275","192.168.1.118","199.232.37.224","TCP","66","34296 → 443 [ACK] Seq=518 Ack=1353 Win=63104 Len=0 TSval=1319208760 TSecr=2969199055"
"193","0.423434900","199.232.37.224","192.168.1.118","TLSv1.2","2399","Certificate, Server Key Exchange, Server Hello Done"
"194","0.423453800","192.168.1.118","199.232.37.224","TCP","66","34296 → 443 [ACK] Seq=518 Ack=3686 Win=60800 Len=0 TSval=1319208760 TSecr=2969199055"
"195","0.432729538","209.18.47.62","192.168.1.118","DNS","89","Standard query response 0x7bd3 A blog.etsy.com A 104.196.190.179"
"196","0.432874163","192.168.1.118","209.18.47.62","DNS","73","Standard query 0xa78d AAAA blog.etsy.com"
"197","0.439628563","192.168.1.118","199.232.37.224","TLSv1.2","305","Application Data"
"198","0.439908825","192.168.1.118","199.232.37.224","TLSv1.2","305","Application Data"
"199","0.440137888","192.168.1.118","199.232.37.224","TLSv1.2","315","Application Data"
"200","0.442039513","192.168.1.118","199.232.37.224","TLSv1.2","192","Client Key Exchange, Change Cipher Spec, Encrypted Handshake Message"
"201","0.444115263","192.168.1.118","199.232.37.224","TLSv1.2","192","Client Key Exchange, Change Cipher Spec, Encrypted Handshake Message"
"202","0.449809713","209.18.47.62","192.168.1.118","DNS","89","Standard query response 0x8720 A blog.etsy.com A 104.196.190.179"
"203","0.450010000","192.168.1.118","209.18.47.62","DNS","73","Standard query 0x9b1e AAAA blog.etsy.com"
"204","0.458851538","199.232.37.224","192.168.1.118","TLSv1.2","665","Application Data"
"205","0.465276613","209.18.47.62","192.168.1.118","DNS","89","Standard query response 0xcfac A blog.etsy.com A 104.196.190.179"
"206","0.465358763","199.232.37.224","192.168.1.118","TLSv1.2","117","Change Cipher Spec, Encrypted Handshake Message"
"207","0.465599088","192.168.1.118","209.18.47.62","DNS","73","Standard query 0x6737 AAAA blog.etsy.com"
"208","0.468371800","199.232.37.224","192.168.1.118","TLSv1.2","8178","Application Data, Application Data, Application Data, Application Data, Application Data, Application Data"
"209","0.470878550","209.18.47.62","192.168.1.118","DNS","138","Standard query response 0xa78d AAAA blog.etsy.com SOA dns1.p03.nsone.net"
"210","0.471034288","199.232.37.224","192.168.1.118","TLSv1.2","5474","Application Data, Application Data, Application Data, Application Data"
"211","0.471091025","199.232.37.224","192.168.1.118","TLSv1.2","6826","Application Data, Application Data, Application Data, Application Data, Application Data"
"212","0.478750975","192.168.1.118","199.232.37.224","TCP","66","34302 → 443 [ACK] Seq=883 Ack=10497 Win=57472 Len=0 TSval=1319208815 TSecr=3137576978"
"213","0.478927475","192.168.1.118","199.232.37.224","TCP","66","34294 → 443 [ACK] Seq=893 Ack=17257 Win=50688 Len=0 TSval=1319208815 TSecr=264597510"
"214","0.479299775","192.168.1.118","199.232.37.224","TLSv1.2","313","Application Data"
"215","0.479467150","192.168.1.118","104.196.190.179","TCP","74","40504 → 443 [SYN] Seq=0 Win=64240 Len=0 MSS=1460 SACK_PERM=1 TSval=3676359307 TSecr=0 WS=128"
"216","0.479569700","192.168.1.118","104.196.190.179","TCP","74","40506 → 443 [SYN] Seq=0 Win=64240 Len=0 MSS=1460 SACK_PERM=1 TSval=3676359307 TSecr=0 WS=128"
"217","0.479642150","192.168.1.118","104.196.190.179","TCP","74","40508 → 443 [SYN] Seq=0 Win=64240 Len=0 MSS=1460 SACK_PERM=1 TSval=3676359307 TSecr=0 WS=128"
"218","0.479912138","192.168.1.118","199.232.37.224","TCP","66","[TCP Window Update] 34288 → 443 [ACK] Seq=1490 Ack=49471 Win=56960 Len=0 TSval=1319208816 TSecr=851228732"
"219","0.481575113","192.168.1.118","199.232.37.224","TCP","66","34286 → 443 [ACK] Seq=1370 Ack=86560 Win=62208 Len=0 TSval=1319208818 TSecr=3118415440"
"220","0.484107188","209.18.47.62","192.168.1.118","DNS","138","Standard query response 0x9b1e AAAA blog.etsy.com SOA dns1.p03.nsone.net"
"221","0.484182838","199.232.37.224","192.168.1.118","TLSv1.2","6826","Application Data, Application Data, Application Data, Application Data, Application Data"
"222","0.484227338","199.232.37.224","192.168.1.118","TLSv1.2","1418","Application Data"
"223","0.486737738","199.232.37.224","192.168.1.118","TLSv1.2","12234","Application Data, Application Data, Application Data, Application Data, Application Data, Application Data, Application Data, Application Data, Application Data"
"224","0.487782038","199.232.37.224","192.168.1.118","TLSv1.2","117","Change Cipher Spec, Encrypted Handshake Message"
"225","0.490473000","209.18.47.62","192.168.1.118","DNS","151","Standard query response 0x6737 AAAA blog.etsy.com SOA ns-162.awsdns-20.com"
"226","0.501413850","192.168.1.118","199.232.37.224","TCP","66","34300 → 443 [ACK] Seq=883 Ack=17257 Win=50688 Len=0 TSval=1319208838 TSecr=2807245317"
"227","0.501605413","192.168.1.118","199.232.37.224","TCP","66","34302 → 443 [ACK] Seq=883 Ack=17257 Win=50816 Len=0 TSval=1319208838 TSecr=3137576978"
"228","0.501985188","192.168.1.118","199.232.37.224","TLSv1.2","310","Application Data"
"229","0.513333963","192.168.1.103","224.0.0.251","IGMPv2","46","Membership Report group 224.0.0.251"
"230","0.515654575","192.168.1.103","224.0.0.251","MDNS","158","Standard query 0x0000 PTR _companion-link._tcp.local, "QM" question PTR _sleep-proxy._udp.local, "QM" question PTR cjqg._companion-link._tcp.local OPT"
"231","0.520327238","199.232.37.224","192.168.1.118","TLSv1.2","1418","Application Data [TCP segment of a reassembled PDU]"
"232","0.525644563","199.232.37.224","192.168.1.118","TLSv1.2","6826","Application Data, Application Data, Application Data, Application Data"
"233","0.525725638","192.168.1.118","199.232.37.224","TCP","66","34294 → 443 [ACK] Seq=893 Ack=25369 Win=52864 Len=0 TSval=1319208862 TSecr=264597521"
"234","0.525771013","199.232.37.224","192.168.1.118","TLSv1.2","2770","Application Data, Application Data"
"235","0.525811463","192.168.1.118","199.232.37.224","TCP","66","34302 → 443 [ACK] Seq=883 Ack=19961 Win=61056 Len=0 TSval=1319208862 TSecr=3137576988"
"236","0.526950925","199.232.37.224","192.168.1.118","TLSv1.2","2770","Application Data, Application Data"
"237","0.528129738","199.232.37.224","192.168.1.118","TLSv1.2","4607","Application Data, Application Data, Application Data, Application Data, Application Data"
"238","0.528215663","199.232.37.224","192.168.1.118","TLSv1.2","4122","Application Data, Application Data"
"239","0.529214175","192.168.1.118","199.232.37.224","TCP","66","34302 → 443 [ACK] Seq=883 Ack=26721 Win=54400 Len=0 TSval=1319208865 TSecr=3137576988"
"240","0.529291775","192.168.1.118","199.232.37.224","TCP","66","34294 → 443 [ACK] Seq=893 Ack=29910 Win=48384 Len=0 TSval=1319208865 TSecr=264597521"
"241","0.533495038","104.196.190.179","192.168.1.118","TCP","66","443 → 40508 [SYN, ACK] Seq=0 Ack=1 Win=28400 Len=0 MSS=1420 SACK_PERM=1 WS=512"
"242","0.533631963","192.168.1.118","104.196.190.179","TCP","54","40508 → 443 [ACK] Seq=1 Ack=1 Win=64256 Len=0"
"243","0.533686538","104.196.190.179","192.168.1.118","TCP","66","443 → 40504 [SYN, ACK] Seq=0 Ack=1 Win=28400 Len=0 MSS=1420 SACK_PERM=1 WS=512"
"244","0.533738800","192.168.1.118","104.196.190.179","TCP","54","40504 → 443 [ACK] Seq=1 Ack=1 Win=64256 Len=0"
"245","0.533774175","104.196.190.179","192.168.1.118","TCP","66","443 → 40506 [SYN, ACK] Seq=0 Ack=1 Win=28400 Len=0 MSS=1420 SACK_PERM=1 WS=512"
"246","0.533823550","192.168.1.118","104.196.190.179","TCP","54","40506 → 443 [ACK] Seq=1 Ack=1 Win=64256 Len=0"
"247","0.533850138","199.232.37.224","192.168.1.118","TLSv1.2","4122","Application Data, Application Data, Application Data"
"248","0.533879675","199.232.37.224","192.168.1.118","TLSv1.2","13586","Application Data, Application Data, Application Data, Application Data, Application Data, Application Data, Application Data, Application Data, Application Data, Application Data"
"249","0.537577088","199.232.37.224","192.168.1.118","TLSv1.2","9530","Application Data, Application Data, Application Data, Application Data, Application Data, Application Data"
"250","0.537678213","192.168.1.118","199.232.37.224","TCP","66","34300 → 443 [ACK] Seq=883 Ack=26721 Win=50816 Len=0 TSval=1319208874 TSecr=2807245331"
"251","0.539109913","199.232.37.224","192.168.1.118","TLSv1.2","1418","Application Data [TCP segment of a reassembled PDU]"
"252","0.539176575","199.232.37.224","192.168.1.118","TLSv1.2","1418","Application Data [TCP segment of a reassembled PDU]"
"253","0.539813425","192.168.1.118","199.232.37.224","TCP","66","34302 → 443 [ACK] Seq=883 Ack=32129 Win=49024 Len=0 TSval=1319208876 TSecr=3137576988"
"254","0.539927800","192.168.1.118","199.232.37.224","TCP","66","34296 → 443 [ACK] Seq=891 Ack=17257 Win=50688 Len=0 TSval=1319208876 TSecr=2969199168"
"255","0.540370075","199.232.37.224","192.168.1.118","TLSv1.2","1418","Application Data [TCP segment of a reassembled PDU]"
"256","0.540439713","199.232.37.224","192.168.1.118","TLSv1.2","5474","Application Data, Application Data, Application Data, Application Data"
"257","0.540476575","199.232.37.224","192.168.1.118","TLSv1.2","2770","Application Data, Application Data"
"258","0.546313225","199.232.37.224","192.168.1.118","TLSv1.2","9530","Application Data, Application Data, Application Data, Application Data, Application Data, Application Data, Application Data"
"259","0.549150450","199.232.37.224","192.168.1.118","TLSv1.2","2770","Application Data, Application Data"
"260","0.549301950","199.232.37.224","192.168.1.118","TLSv1.2","1418","Application Data [TCP segment of a reassembled PDU]"
"261","0.549344138","199.232.37.224","192.168.1.118","TLSv1.2","4122","Application Data, Application Data, Application Data"
"262","0.549377375","199.232.37.224","192.168.1.118","TLSv1.2","2770","Application Data, Application Data"
"263","0.556302763","192.168.1.118","104.196.190.179","TLSv1","571","Client Hello"
"264","0.557017113","199.232.37.224","192.168.1.118","TLSv1.2","1418","Application Data [TCP segment of a reassembled PDU]"
"265","0.562098675","199.232.37.224","192.168.1.118","TLSv1.2","2770","Application Data, Application Data"
"266","0.562238338","199.232.37.224","192.168.1.118","TLSv1.2","2770","Application Data, Application Data"
"267","0.562295950","199.232.37.224","192.168.1.118","TLSv1.2","2770","Application Data, Application Data"
"268","0.562338088","199.232.37.224","192.168.1.118","TLSv1.2","1418","Application Data [TCP segment of a reassembled PDU]"
"269","0.563685613","199.232.37.224","192.168.1.118","TLSv1.2","1418","Application Data [TCP segment of a reassembled PDU]"
"270","0.563868175","199.232.37.224","192.168.1.118","TLSv1.2","4159","Application Data, Application Data, Application Data, Application Data"
"271","0.563941725","199.232.37.224","192.168.1.118","TLSv1.2","1418","Application Data [TCP segment of a reassembled PDU]"
"272","0.565079188","199.232.37.224","192.168.1.118","TLSv1.2","1418","Application Data [TCP segment of a reassembled PDU]"
"273","0.568097075","199.232.37.224","192.168.1.118","TLSv1.2","5800","Application Data, Application Data, Application Data, Application Data, Application Data"
"274","0.568202875","199.232.37.224","192.168.1.118","TLSv1.2","2770","Application Data, Application Data"
"275","0.570646975","199.232.37.224","192.168.1.118","TLSv1.2","2770","Application Data, Application Data"
"276","0.570752075","192.168.1.118","199.232.37.224","TCP","66","34300 → 443 [ACK] Seq=883 Ack=51057 Win=26496 Len=0 TSval=1319208907 TSecr=2807245331"
"277","0.572787188","192.168.1.118","104.196.190.179","TLSv1","571","Client Hello"
"278","0.577868638","199.232.37.224","192.168.1.118","TLSv1.2","2770","Application Data, Application Data"
"279","0.580856363","192.168.1.118","199.232.37.224","TCP","66","34302 → 443 [ACK] Seq=883 Ack=49742 Win=31488 Len=0 TSval=1319208917 TSecr=3137576994"
"280","0.581606088","192.168.1.118","199.232.37.224","TCP","66","34298 → 443 [ACK] Seq=888 Ack=17257 Win=50688 Len=0 TSval=1319208918 TSecr=2805341077"
"281","0.586866825","199.232.37.224","192.168.1.118","TLSv1.2","2770","Application Data, Application Data"
"282","0.586956175","199.232.37.224","192.168.1.118","TLSv1.2","1243","Application Data, Application Data"
"283","0.589111588","192.168.1.118","104.196.190.179","TLSv1","571","Client Hello"
"284","0.589384163","192.168.1.118","199.232.37.224","TCP","66","34300 → 443 [ACK] Seq=883 Ack=57642 Win=19968 Len=0 TSval=1319208926 TSecr=2807245341"
"285","0.589532225","192.168.1.118","199.232.37.224","TCP","66","34296 → 443 [ACK] Seq=891 Ack=22991 Win=45056 Len=0 TSval=1319208926 TSecr=2969199228"
"286","0.592234875","104.196.190.179","192.168.1.118","TCP","54","443 → 40504 [ACK] Seq=1 Ack=518 Win=29696 Len=0"
"287","0.595481375","104.196.190.179","192.168.1.118","TLSv1.2","3189","Server Hello, Certificate, Server Key Exchange, Server Hello Done"
"288","0.595633113","192.168.1.118","104.196.190.179","TCP","54","40504 → 443 [ACK] Seq=518 Ack=3136 Win=61184 Len=0"
"289","0.599218025","192.168.1.118","199.232.37.224","TCP","66","[TCP Window Update] 34284 → 443 [ACK] Seq=1 Ack=49623 Win=501 Len=0 TSval=1319208935 TSecr=3139581806"
"290","0.601403863","192.168.1.118","104.196.190.179","TLSv1.2","180","Client Key Exchange, Change Cipher Spec, Encrypted Handshake Message"
"291","0.605386363","192.168.1.118","199.232.37.224","TLSv1.2","309","Application Data"
"292","0.615991500","199.232.37.224","192.168.1.118","TLSv1.2","1418","Application Data [TCP segment of a reassembled PDU]"
"293","0.616114275","192.168.1.118","199.232.37.224","TCP","66","34298 → 443 [ACK] Seq=888 Ack=18609 Win=63104 Len=0 TSval=1319208952 TSecr=2805341100"
"294","0.618477900","199.232.37.224","192.168.1.118","TLSv1.2","2561","Application Data, Application Data"
"295","0.618647963","192.168.1.118","199.232.37.224","TCP","66","34298 → 443 [ACK] Seq=888 Ack=21104 Win=61056 Len=0 TSval=1319208955 TSecr=2805341100"
"296","0.620989963","192.168.1.118","199.232.37.224","TLSv1.2","309","Application Data"
"297","0.625374863","192.168.1.118","199.232.37.224","TCP","66","[TCP Window Update] 34302 → 443 [ACK] Seq=883 Ack=49742 Win=64128 Len=0 TSval=1319208961 TSecr=3137576994"
"298","0.625621588","192.168.1.118","199.232.37.224","TLSv1.2","309","Application Data"
"299","0.628891038","192.168.1.118","199.232.37.224","TLSv1.2","310","Application Data"
"300","0.631863100","104.196.190.179","192.168.1.118","TCP","54","443 → 40508 [ACK] Seq=1 Ack=518 Win=29696 Len=0"
"301","0.632132613","192.168.1.118","199.232.37.224","TCP","66","[TCP Window Update] 34300 → 443 [ACK] Seq=883 Ack=57642 Win=64128 Len=0 TSval=1319208968 TSecr=2807245341"
"302","0.633496050","104.196.190.179","192.168.1.118","TCP","54","443 → 40506 [ACK] Seq=1 Ack=518 Win=29696 Len=0"
"303","0.635173875","104.196.190.179","192.168.1.118","TLSv1.2","3189","Server Hello, Certificate, Server Key Exchange, Server Hello Done"
"304","0.635282325","192.168.1.118","104.196.190.179","TCP","54","40508 → 443 [ACK] Seq=518 Ack=3136 Win=61184 Len=0"
"305","0.637714000","104.196.190.179","192.168.1.118","TLSv1.2","1474","Server Hello"
"306","0.637830200","192.168.1.118","104.196.190.179","TCP","54","40506 → 443 [ACK] Seq=518 Ack=1421 Win=63104 Len=0"
"307","0.639491200","192.168.1.118","104.196.190.179","TLSv1.2","180","Client Key Exchange, Change Cipher Spec, Encrypted Handshake Message"
"308","0.642026138","104.196.190.179","192.168.1.118","TLSv1.2","1769","Certificate, Server Key Exchange, Server Hello Done"
"309","0.642136225","192.168.1.118","104.196.190.179","TCP","54","40506 → 443 [ACK] Seq=518 Ack=3136 Win=61440 Len=0"
"310","0.644282013","192.168.1.118","104.196.190.179","TLSv1.2","180","Client Key Exchange, Change Cipher Spec, Encrypted Handshake Message"
"311","0.644578300","199.232.37.224","192.168.1.118","TLSv1.2","1418","Application Data"
"312","0.647361913","192.168.1.118","199.232.37.224","TLSv1.2","307","Application Data"
"313","0.647480113","199.232.37.224","192.168.1.118","TLSv1.2","9530","Application Data, Application Data, Application Data, Application Data, Application Data, Application Data, Application Data"
"314","0.647647250","192.168.1.118","199.232.37.224","TCP","66","34296 → 443 [ACK] Seq=1134 Ack=33807 Win=64640 Len=0 TSval=1319208984 TSecr=2969199307"
"315","0.648215950","199.232.37.224","192.168.1.118","TLSv1.2","4122","Application Data, Application Data, Application Data"
"316","0.651061238","192.168.1.118","199.232.37.224","TCP","66","34296 → 443 [ACK] Seq=1134 Ack=37863 Win=60672 Len=0 TSval=1319208987 TSecr=2969199307"
"317","0.651633000","199.232.37.224","192.168.1.118","TLSv1.2","1418","Application Data [TCP segment of a reassembled PDU]"
"318","0.651719900","199.232.37.224","192.168.1.118","TLSv1.2","5474","Application Data, Application Data, Application Data, Application Data"
"319","0.653043213","192.168.1.118","199.232.37.224","TCP","66","34298 → 443 [ACK] Seq=1131 Ack=26512 Win=64128 Len=0 TSval=1319208989 TSecr=2805341107"
"320","0.653638175","199.232.37.224","192.168.1.118","TLSv1.2","9530","Application Data, Application Data, Application Data, Application Data, Application Data, Application Data, Application Data"
"321","0.654557200","199.232.37.224","192.168.1.118","TLSv1.2","5474","Application Data, Application Data, Application Data, Application Data"
"322","0.656540963","192.168.1.118","199.232.37.224","TCP","66","34298 → 443 [ACK] Seq=1131 Ack=41384 Win=49664 Len=0 TSval=1319208993 TSecr=2805341107"
"323","0.680934588","199.232.37.224","192.168.1.118","TLSv1.2","6826","Application Data, Application Data, Application Data, Application Data"
"324","0.681032425","192.168.1.118","199.232.37.224","TCP","66","34298 → 443 [ACK] Seq=1131 Ack=48144 Win=70144 Len=0 TSval=1319209017 TSecr=2805341107"
"325","0.681081200","199.232.37.224","192.168.1.118","TLSv1.2","1418","Application Data"
"326","0.682579375","199.232.37.224","192.168.1.118","TLSv1.2","2770","Application Data, Application Data"
"327","0.683864925","199.232.37.224","192.168.1.118","TLSv1.2","10882","Application Data, Application Data, Application Data, Application Data, Application Data, Application Data, Application Data, Application Data"
"328","0.684659263","192.168.1.118","199.232.37.224","TCP","66","34294 → 443 [ACK] Seq=1136 Ack=44782 Win=49280 Len=0 TSval=1319209021 TSecr=264597556"
"329","0.692799825","192.168.1.118","199.232.37.224","TCP","66","34296 → 443 [ACK] Seq=1134 Ack=39215 Win=64640 Len=0 TSval=1319209029 TSecr=2969199307"
"330","0.699331500","199.232.37.224","192.168.1.118","TLSv1.2","4122","Application Data, Application Data, Application Data"
"331","0.699422975","192.168.1.118","199.232.37.224","TCP","66","34294 → 443 [ACK] Seq=1136 Ack=48838 Win=59008 Len=0 TSval=1319209036 TSecr=264597556"
"332","0.699470225","199.232.37.224","192.168.1.118","TLSv1.2","2770","Application Data, Application Data"
"333","0.699548850","192.168.1.118","199.232.37.224","TCP","66","34296 → 443 [ACK] Seq=1134 Ack=41919 Win=70016 Len=0 TSval=1319209036 TSecr=2969199307"
"334","0.699576963","199.232.37.224","192.168.1.118","TLSv1.2","2770","Application Data, Application Data"
"335","0.699635950","192.168.1.118","199.232.37.224","TCP","66","34302 → 443 [ACK] Seq=1127 Ack=52446 Win=69504 Len=0 TSval=1319209036 TSecr=3137577025"
"336","0.700813013","199.232.37.224","192.168.1.118","TLSv1.2","2770","Application Data, Application Data"
"337","0.700908125","192.168.1.118","199.232.37.224","TCP","66","34302 → 443 [ACK] Seq=1127 Ack=55150 Win=75008 Len=0 TSval=1319209037 TSecr=3137577025"
"338","0.702301663","199.232.37.224","192.168.1.118","TLSv1.2","16290","Application Data, Application Data, Application Data, Application Data, Application Data, Application Data, Application Data, Application Data, Application Data, Application Data, Application Data"
"339","0.702428900","192.168.1.118","199.232.37.224","TCP","66","34302 → 443 [ACK] Seq=1127 Ack=71374 Win=107392 Len=0 TSval=1319209039 TSecr=3137577025"
"340","0.702490088","199.232.37.224","192.168.1.118","TLSv1.2","499","Application Data, Application Data"
"341","0.702588875","192.168.1.118","199.232.37.224","TCP","66","34302 → 443 [ACK] Seq=1127 Ack=71807 Win=110080 Len=0 TSval=1319209039 TSecr=3137577026"
"342","0.702650288","199.232.37.224","192.168.1.118","TLSv1.2","2770","Application Data [TCP segment of a reassembled PDU]"
"343","0.702716525","104.196.190.179","192.168.1.118","TLSv1.2","105","Change Cipher Spec, Encrypted Handshake Message"
"344","0.702780750","199.232.37.224","192.168.1.118","TLSv1.2","2770","Application Data, Application Data"
"345","0.702842413","199.232.37.224","192.168.1.118","TLSv1.2","2770","Application Data [TCP segment of a reassembled PDU]"
"346","0.702912863","192.168.1.118","199.232.37.224","TCP","66","34296 → 443 [ACK] Seq=1134 Ack=44623 Win=70784 Len=0 TSval=1319209039 TSecr=2969199307"
"347","0.702971575","199.232.37.224","192.168.1.118","TLSv1.2","2770","Application Data, Application Data"
"348","0.703010050","199.232.37.224","192.168.1.118","TLSv1.2","1418","Application Data [TCP segment of a reassembled PDU]"
"349","0.703063800","192.168.1.118","199.232.37.224","TCP","66","34296 → 443 [ACK] Seq=1134 Ack=45975 Win=69504 Len=0 TSval=1319209039 TSecr=2969199314"
"350","0.704142275","192.168.1.118","104.196.190.179","TLSv1.2","660","Application Data"
"351","0.704237150","192.168.1.118","199.232.37.224","TCP","66","34294 → 443 [ACK] Seq=1136 Ack=56950 Win=50944 Len=0 TSval=1319209040 TSecr=264597556"
"352","0.715241850","199.232.37.224","192.168.1.118","TLSv1.2","1418","Application Data [TCP segment of a reassembled PDU]"
"353","0.715366713","192.168.1.118","199.232.37.224","TCP","66","34296 → 443 [ACK] Seq=1134 Ack=47327 Win=73472 Len=0 TSval=1319209051 TSecr=2969199314"
"354","0.715483175","199.232.37.224","192.168.1.118","TLSv1.2","2770","Application Data, Application Data"
"355","0.715597763","192.168.1.118","199.232.37.224","TCP","66","34296 → 443 [ACK] Seq=1134 Ack=50031 Win=72832 Len=0 TSval=1319209052 TSecr=2969199320"
"356","0.721874075","192.168.1.118","199.232.37.224","TLSv1.2","310","Application Data"
"357","0.741193950","199.232.37.224","192.168.1.118","TLSv1.2","1418","Application Data [TCP segment of a reassembled PDU]"
"358","0.741319288","192.168.1.118","199.232.37.224","TCP","66","34296 → 443 [ACK] Seq=1134 Ack=51383 Win=76160 Len=0 TSval=1319209077 TSecr=2969199398"
"359","0.746323363","199.232.37.224","192.168.1.118","TLSv1.2","1967","Application Data, Application Data, Application Data"
"360","0.746446550","192.168.1.118","199.232.37.224","TCP","66","34296 → 443 [ACK] Seq=1134 Ack=53284 Win=74880 Len=0 TSval=1319209083 TSecr=2969199398"
"361","0.746867863","199.232.37.224","192.168.1.118","TLSv1.2","18994","Application Data, Application Data, Application Data, Application Data, Application Data, Application Data, Application Data, Application Data, Application Data, Application Data, Application Data, Application Data, Application Data, Application Data"
"362","0.746984663","192.168.1.118","199.232.37.224","TCP","66","34300 → 443 [ACK] Seq=1124 Ack=76570 Win=102016 Len=0 TSval=1319209083 TSecr=2807245383"
"363","0.751767375","199.232.37.224","192.168.1.118","TLSv1.2","1298","Application Data, Application Data"
"364","0.751855100","199.232.37.224","192.168.1.118","TLSv1.2","3352","Application Data, Application Data, Application Data, Application Data"
"365","0.751900100","192.168.1.118","199.232.37.224","TCP","66","34294 → 443 [ACK] Seq=1136 Ack=60236 Win=59008 Len=0 TSval=1319209088 TSecr=264597580"
"366","0.751965488","199.232.37.224","192.168.1.118","TLSv1.2","2770","Application Data [TCP segment of a reassembled PDU]"
"367","0.751998200","192.168.1.118","199.232.37.224","TCP","66","34300 → 443 [ACK] Seq=1124 Ack=79274 Win=107392 Len=0 TSval=1319209088 TSecr=2807245383"
"368","0.752017938","199.232.37.224","192.168.1.118","TLSv1.2","1418","Application Data [TCP segment of a reassembled PDU]"
"369","0.752393025","192.168.1.118","199.232.37.224","TLSv1.2","310","Application Data"
"370","0.752870138","199.232.37.224","192.168.1.118","TLSv1.2","4122","Application Data, Application Data, Application Data"
"371","0.752950450","192.168.1.118","199.232.37.224","TCP","66","34300 → 443 [ACK] Seq=1124 Ack=84682 Win=118272 Len=0 TSval=1319209089 TSecr=2807245384"
"372","0.752986825","199.232.37.224","192.168.1.118","TLSv1.2","949","Application Data, Application Data"
"373","0.755465113","192.168.1.118","199.232.37.224","TLSv1.2","310","Application Data"
"374","0.757713050","192.168.1.118","199.232.37.224","TLSv1.2","317","Application Data"
"375","0.764436688","199.232.37.224","192.168.1.118","TLSv1.2","9530","Application Data, Application Data, Application Data, Application Data, Application Data, Application Data, Application Data"
"376","0.764574363","192.168.1.118","199.232.37.224","TCP","66","34302 → 443 [ACK] Seq=1371 Ack=81271 Win=129024 Len=0 TSval=1319209101 TSecr=3137577049"
"377","0.766112813","199.232.37.224","192.168.1.118","TLSv1.2","1418","Application Data [TCP segment of a reassembled PDU]"
"378","0.766745588","104.196.190.179","192.168.1.118","TLSv1.2","105","Change Cipher Spec, Encrypted Handshake Message"
"379","0.766826038","199.232.37.224","192.168.1.118","TLSv1.2","9530","Application Data, Application Data, Application Data, Application Data, Application Data, Application Data, Application Data"
"380","0.766890900","192.168.1.118","199.232.37.224","TCP","66","34302 → 443 [ACK] Seq=1371 Ack=92087 Win=131968 Len=0 TSval=1319209103 TSecr=3137577049"
"381","0.769017588","192.168.1.118","104.196.190.179","TLSv1.2","658","Application Data"
"382","0.771875125","104.196.190.179","192.168.1.118","TLSv1.2","105","Change Cipher Spec, Encrypted Handshake Message"
"383","0.771964800","199.232.37.224","192.168.1.118","TCP","1418","443 → 34302 [ACK] Seq=92087 Ack=1371 Win=31744 Len=1352 TSval=3137577049 TSecr=1319209058 [TCP segment of a reassembled PDU]"
"384","0.771996138","199.232.37.224","192.168.1.118","TLSv1.2","92","Application Data"
"385","0.772089400","104.196.190.179","192.168.1.118","TCP","7154","[TCP segment of a reassembled PDU]"
"386","0.774109538","104.196.190.179","192.168.1.118","TLSv1.2","9367","Application Data"
"387","0.774215125","104.196.190.179","192.168.1.118","TCP","1474","[TCP segment of a reassembled PDU]"
"388","0.774301438","192.168.1.118","104.196.190.179","TCP","54","40504 → 443 [ACK] Seq=1250 Ack=19600 Win=47744 Len=0"
"389","0.774918250","192.168.1.118","104.196.190.179","TLSv1.2","656","Application Data"
"390","0.775024738","192.168.1.118","199.232.37.224","TCP","66","34302 → 443 [ACK] Seq=1371 Ack=93465 Win=130688 Len=0 TSval=1319209111 TSecr=3137577049"
"391","0.777911613","104.196.190.179","192.168.1.118","TCP","1474","443 → 40504 [ACK] Seq=21020 Ack=1250 Win=30720 Len=1420 [TCP segment of a reassembled PDU]"
"392","0.778015263","192.168.1.118","104.196.190.179","TCP","54","40504 → 443 [ACK] Seq=1250 Ack=22440 Win=63104 Len=0"
"393","0.793951038","192.168.1.118","199.232.37.224","TCP","66","34300 → 443 [ACK] Seq=1124 Ack=85565 Win=120960 Len=0 TSval=1319209130 TSecr=2807245385"
"394","0.801388200","199.232.37.224","192.168.1.118","TLSv1.2","1418","Application Data"
"395","0.804427350","199.232.37.224","192.168.1.118","TLSv1.2","9530","Application Data, Application Data, Application Data, Application Data, Application Data, Application Data, Application Data"
"396","0.805306725","192.168.1.118","199.232.37.224","TCP","66","34296 → 443 [ACK] Seq=1378 Ack=64100 Win=65408 Len=0 TSval=1319209141 TSecr=2969199465"
"397","0.805875588","199.232.37.224","192.168.1.118","TLSv1.2","1418","Application Data [TCP segment of a reassembled PDU]"
"398","0.810310638","199.232.37.224","192.168.1.118","TLSv1.2","4122","Application Data, Application Data, Application Data"
"399","0.810396388","199.232.37.224","192.168.1.118","TLSv1.2","16290","Application Data, Application Data, Application Data, Application Data, Application Data, Application Data, Application Data, Application Data, Application Data, Application Data, Application Data, Application Data"
"400","0.810452788","192.168.1.118","199.232.37.224","TCP","66","34296 → 443 [ACK] Seq=1378 Ack=69508 Win=60032 Len=0 TSval=1319209147 TSecr=2969199465"
"401","0.810550788","192.168.1.118","199.232.37.224","TCP","66","34298 → 443 [ACK] Seq=1375 Ack=65600 Win=105344 Len=0 TSval=1319209147 TSecr=2805341147"
"402","0.818640150","199.232.37.224","192.168.1.118","TLSv1.2","5037","Application Data, Application Data, Application Data, Application Data"
"403","0.818755588","192.168.1.118","199.232.37.224","TCP","66","34298 → 443 [ACK] Seq=1375 Ack=70571 Win=115328 Len=0 TSval=1319209155 TSecr=2805341147"
"404","0.818873288","199.232.37.224","192.168.1.118","TLSv1.2","4122","Application Data, Application Data, Application Data"
"405","0.818951163","192.168.1.118","199.232.37.224","TCP","66","34294 → 443 [ACK] Seq=1387 Ack=64292 Win=72320 Len=0 TSval=1319209155 TSecr=264597596"
"406","0.820253863","199.232.37.224","192.168.1.118","TLSv1.2","1418","Application Data [TCP segment of a reassembled PDU]"
"407","0.834424513","199.232.37.224","192.168.1.118","TLSv1.2","12302","Application Data, Application Data, Application Data, Application Data, Application Data, Application Data, Application Data, Application Data, Application Data, Application Data"
"408","0.834492450","192.168.1.118","199.232.37.224","TCP","66","34294 → 443 [ACK] Seq=1387 Ack=77880 Win=99456 Len=0 TSval=1319209171 TSecr=264597596"
"409","0.834550475","199.232.37.224","192.168.1.118","TLSv1.2","5474","Application Data, Application Data, Application Data"
"410","0.834579000","192.168.1.118","199.232.37.224","TCP","66","34296 → 443 [ACK] Seq=1378 Ack=74916 Win=70784 Len=0 TSval=1319209171 TSecr=2969199465"
"411","0.834597275","199.232.37.224","192.168.1.118","TLSv1.2","2770","Application Data, Application Data"
"412","0.834616850","199.232.37.224","192.168.1.118","TLSv1.2","2770","Application Data, Application Data"
"413","0.834633050","199.232.37.224","192.168.1.118","TLSv1.2","2770","Application Data, Application Data"
"414","0.834642075","199.232.37.224","192.168.1.118","TLSv1.2","493","Application Data, Application Data"
"415","0.834677863","104.196.190.179","192.168.1.118","TLSv1.2","14839","Application Data"
"416","0.834718775","104.196.190.179","192.168.1.118","TCP","2894","443 → 40504 [ACK] Seq=22440 Ack=1250 Win=30720 Len=2840 [TCP segment of a reassembled PDU]"
"417","0.834731350","104.196.190.179","192.168.1.118","TCP","8574","[TCP segment of a reassembled PDU]"
"418","0.837033588","104.196.190.179","192.168.1.118","TLSv1.2","7947","Application Data"
"419","0.837111763","104.196.190.179","192.168.1.118","TCP","1474","443 → 40504 [ACK] Seq=25280 Ack=1250 Win=30720 Len=1420 [TCP segment of a reassembled PDU]"
"420","0.838226913","192.168.1.118","104.196.190.179","TCP","54","40504 → 443 [ACK] Seq=1250 Ack=26700 Win=64128 Len=0"
"421","0.838332375","192.168.1.118","104.196.190.179","TCP","54","40506 → 443 [ACK] Seq=1246 Ack=19600 Win=47744 Len=0"
"422","0.838578413","104.196.190.179","192.168.1.118","TCP","2894","443 → 40504 [ACK] Seq=26700 Ack=1250 Win=30720 Len=2840 [TCP segment of a reassembled PDU]"
"423","0.838598225","104.196.190.179","192.168.1.118","TCP","2894","[TCP segment of a reassembled PDU]"
"424","0.838629988","192.168.1.118","104.196.190.179","TCP","54","40506 → 443 [ACK] Seq=1246 Ack=22440 Win=61056 Len=0"
"425","0.838722463","192.168.1.118","104.196.190.179","TCP","54","40508 → 443 [ACK] Seq=1248 Ack=17972 Win=49408 Len=0"
"426","0.838994075","192.168.1.118","199.232.37.224","TCP","66","34296 → 443 [ACK] Seq=1378 Ack=83455 Win=62336 Len=0 TSval=1319209175 TSecr=2969199467"
"427","0.839152363","192.168.1.118","104.196.190.179","TCP","54","40504 → 443 [ACK] Seq=1250 Ack=29540 Win=64128 Len=0"
"428","0.839906850","104.196.190.179","192.168.1.118","TLSv1.2","7154","Application Data [TCP segment of a reassembled PDU]"
"429","0.842274000","192.168.1.118","104.196.190.179","TCP","54","40504 → 443 [ACK] Seq=1250 Ack=36640 Win=57088 Len=0"
"430","0.851889050","104.196.190.179","192.168.1.118","TCP","8574","443 → 40504 [ACK] Seq=36640 Ack=1250 Win=30720 Len=8520 [TCP segment of a reassembled PDU]"
"431","0.853092300","104.196.190.179","192.168.1.118","TCP","5734","443 → 40504 [ACK] Seq=45160 Ack=1250 Win=30720 Len=5680 [TCP segment of a reassembled PDU]"
"432","0.854007313","192.168.1.118","104.196.190.179","TCP","54","40504 → 443 [ACK] Seq=1250 Ack=50840 Win=64128 Len=0"
"433","0.858398250","104.196.190.179","192.168.1.118","TLSv1.2","2894","Application Data [TCP segment of a reassembled PDU]"
"434","0.860277900","192.168.1.118","104.196.190.179","TCP","54","40504 → 443 [ACK] Seq=1250 Ack=53680 Win=61312 Len=0"
"435","0.887317188","104.196.190.179","192.168.1.118","TCP","1474","443 → 40504 [ACK] Seq=53680 Ack=1250 Win=30720 Len=1420 [TCP segment of a reassembled PDU]"
"436","0.896688400","104.196.190.179","192.168.1.118","TLSv1.2","1859","Application Data"
"437","0.896818025","192.168.1.118","104.196.190.179","TCP","54","40506 → 443 [ACK] Seq=1246 Ack=24245 Win=61056 Len=0"
"438","0.897010050","104.196.190.179","192.168.1.118","TCP","7154","443 → 40504 [ACK] Seq=55100 Ack=1250 Win=30720 Len=7100 [TCP segment of a reassembled PDU]"
"439","0.897208725","104.196.190.179","192.168.1.118","TCP","2894","443 → 40504 [ACK] Seq=62200 Ack=1250 Win=30720 Len=2840 [TCP segment of a reassembled PDU]"
"440","0.897403400","192.168.1.118","104.196.190.179","TCP","54","40504 → 443 [ACK] Seq=1250 Ack=65040 Win=64128 Len=0"
"441","0.903581313","104.196.190.179","192.168.1.118","TLSv1.2","8574","Application Data [TCP segment of a reassembled PDU]"
"442","0.905057975","192.168.1.118","104.196.190.179","TCP","54","40504 → 443 [ACK] Seq=1250 Ack=73560 Win=64128 Len=0"
"443","0.905958775","104.196.190.179","192.168.1.118","TCP","5734","443 → 40504 [ACK] Seq=73560 Ack=1250 Win=30720 Len=5680 [TCP segment of a reassembled PDU]"
"444","0.906088013","192.168.1.118","104.196.190.179","TCP","54","40504 → 443 [ACK] Seq=1250 Ack=79240 Win=75520 Len=0"
"445","0.918557463","104.196.190.179","192.168.1.118","TLSv1.2","1255","Application Data"
"446","0.959840875","192.168.1.118","104.196.190.179","TCP","54","40504 → 443 [ACK] Seq=1250 Ack=80441 Win=78336 Len=0"
"447","1.353213975","192.168.1.118","192.168.1.102","TCP","176","40160 → 8009 [PSH, ACK] Seq=1 Ack=1 Win=501 Len=110 TSval=2234153499 TSecr=2398466 [TCP segment of a reassembled PDU]"
"448","1.533895238","192.168.1.102","192.168.1.118","TCP","176","8009 → 40160 [PSH, ACK] Seq=1 Ack=111 Win=344 Len=110 TSval=2398969 TSecr=2234153499 [TCP segment of a reassembled PDU]"
"449","1.534062800","192.168.1.118","192.168.1.102","TCP","66","40160 → 8009 [ACK] Seq=111 Ack=111 Win=501 Len=0 TSval=2234153680 TSecr=2398969"
"450","1.710466513","192.168.1.118","239.255.255.250","SSDP","218","M-SEARCH * HTTP/1.1 "
"451","1.947168763","192.168.1.104","255.255.255.255","UDP","217","49154 → 6666 Len=175"
"452","2.712772038","192.168.1.118","239.255.255.250","SSDP","218","M-SEARCH * HTTP/1.1 "
"453","3.480877900","192.168.1.103","224.0.0.251","MDNS","158","Standard query 0x0000 PTR _companion-link._tcp.local, "QM" question PTR _sleep-proxy._udp.local, "QM" question PTR cjqg._companion-link._tcp.local OPT"
"454","3.712861975","192.168.1.118","239.255.255.250","SSDP","218","M-SEARCH * HTTP/1.1 "
"455","3.990671800","Cisco-Li_5b:1c:ce","IntelCor_b7:52:73","ARP","42","Who has 192.168.1.118? Tell 192.168.1.1"
"456","3.990735275","IntelCor_b7:52:73","Cisco-Li_5b:1c:ce","ARP","42","192.168.1.118 is at dc:fb:48:b7:52:73"
"457","4.713654813","192.168.1.118","239.255.255.250","SSDP","218","M-SEARCH * HTTP/1.1 "
"458","4.915870600","192.168.1.104","255.255.255.255","UDP","217","49154 → 6666 Len=175"
"459","6.046617163","192.168.1.100","224.0.0.251","MDNS","522","Standard query 0x0000 PTR _airport._tcp.local, "QM" question PTR _googlecast._tcp.local, "QM" question PTR _homekit._tcp.local, "QM" question PTR _raop._tcp.local, "QM" question PTR _airplay._tcp.local, "QM" question PTR _rdlink._tcp.local, "QM" question PTR _uscans._tcp.local, "QM" question PTR _uscan._tcp.local, "QM" question PTR _ippusb._tcp.local, "QM" question PTR _ipp._tcp.local, "QM" question PTR _scanner._tcp.local, "QM" question PTR _ipps._tcp.local, "QM" question PTR _printer._tcp.local, "QM" question PTR _pdl-datastream._tcp.local, "QM" question PTR _ptp._tcp.local, "QM" question PTR _afpovertcp._tcp.local, "QM" question PTR _smb._tcp.local, "QM" question PTR _rfb._tcp.local, "QM" question PTR _adisk._tcp.local, "QM" question PTR _apple-mobdev._tcp.local, "QM" question PTR 8ed307c3._sub._apple-mobdev2._tcp.local, "QM" question PTR _apple-pairable._tcp.local, "QM" question TXT Google-Home-Mini-2c3f16b2da5c4b6fd6cfbfba61c12490._googlecast._tcp.local, "QM" question PTR Google-Home-Mini-2c3f16b2da5c4b6fd6cfbfba61c12490._googlecast._tcp.local PTR cjqg._smb._tcp.local OPT"
"460","6.144385313","192.168.1.102","224.0.0.251","MDNS","183","Standard query response 0x0000 SRV, cache flush 0 0 8009 2c3f16b2-da5c-4b6f-d6cf-bfba61c12490.local"
"461","6.539627163","192.168.1.118","192.168.1.102","TCP","176","40160 → 8009 [PSH, ACK] Seq=111 Ack=111 Win=501 Len=110 TSval=2234158686 TSecr=2398969 [TCP segment of a reassembled PDU]"
"462","6.554936350","192.168.1.102","192.168.1.118","TCP","176","8009 → 40160 [PSH, ACK] Seq=111 Ack=221 Win=344 Len=110 TSval=2399488 TSecr=2234158686 [TCP segment of a reassembled PDU]"
"463","6.555079475","192.168.1.118","192.168.1.102","TCP","66","40160 → 8009 [ACK] Seq=221 Ack=221 Win=501 Len=0 TSval=2234158701 TSecr=2399488"
"464","7.945905863","192.168.1.118","172.253.63.188","TLSv1.2","99","Application Data"
"465","7.988380413","192.168.1.104","255.255.255.255","UDP","217","49154 → 6666 Len=175"
"466","7.988569788","172.253.63.188","192.168.1.118","TCP","66","5228 → 36560 [ACK] Seq=1 Ack=34 Win=248 Len=0 TSval=4174516947 TSecr=2117625933"
"467","7.996203263","172.253.63.188","192.168.1.118","TLSv1.2","99","Application Data"
"468","7.997319438","192.168.1.118","172.253.63.188","TLSv1.2","109","Application Data"
"469","8.039431388","172.253.63.188","192.168.1.118","TCP","66","5228 → 36560 [ACK] Seq=34 Ack=77 Win=248 Len=0 TSval=4174516992 TSecr=2117625984"
