frame.number,_ws.col.Time,_ws.col.Source,_ws.col.Destination,_ws.col.Protocol,frame.len,_ws.col.Info
"1","0.000000000","192.168.1.118","172.253.63.188","TCP","66","36486 → 5228 [ACK] Seq=1 Ack=1 Win=501 Len=0 TSval=2117377754 TSecr=4174223694"
"2","0.024871913","172.253.63.188","192.168.1.118","TCP","66","[TCP ACKed unseen segment] 5228 → 36486 [ACK] Seq=1 Ack=2 Win=253 Len=0 TSval=4174268750 TSecr=2117017353"
"3","0.290449413","192.168.1.118","192.168.1.102","TCP","176","40160 → 8009 [PSH, ACK] Seq=1 Ack=1 Win=501 Len=110 TSval=2233912203 TSecr=2374338 [TCP segment of a reassembled PDU]"
"4","0.294357588","192.168.1.102","192.168.1.118","TCP","176","8009 → 40160 [PSH, ACK] Seq=1 Ack=111 Win=344 Len=110 TSval=2374839 TSecr=2233912203 [TCP segment of a reassembled PDU]"
"5","0.294532388","192.168.1.118","192.168.1.102","TCP","66","40160 → 8009 [ACK] Seq=111 Ack=111 Win=501 Len=0 TSval=2233912207 TSecr=2374839"
"6","1.127095863","199.232.37.140","192.168.1.118","TLSv1.2","1418","Application Data, Application Data"
"7","1.131029450","199.232.37.140","192.168.1.118","TLSv1.2","6072","Application Data, Application Data, Application Data, Application Data, Application Data, Application Data"
"8","1.131222663","199.232.37.140","192.168.1.118","TLSv1.2","5474","Application Data, Application Data, Application Data, Application Data"
"9","1.131333763","192.168.1.118","199.232.37.140","TCP","66","34142 → 443 [ACK] Seq=1 Ack=12767 Win=402 Len=0 TSval=1478527580 TSecr=2779956979"
"10","1.144192800","199.232.37.140","192.168.1.118","TLSv1.2","1418","Application Data, Application Data, Application Data, Application Data"
"11","1.146992500","199.232.37.140","192.168.1.118","TLSv1.2","4139","Application Data, Application Data, Application Data, Application Data, Application Data"
"12","1.147127200","192.168.1.118","199.232.37.140","TCP","66","34142 → 443 [ACK] Seq=1 Ack=18192 Win=439 Len=0 TSval=1478527596 TSecr=2779956987"
"13","1.153045688","199.232.37.140","192.168.1.118","TLSv1.2","1418","Application Data"
"14","1.159608300","199.232.37.140","192.168.1.118","TLSv1.2","8178","Application Data, Application Data, Application Data, Application Data, Application Data, Application Data"
"15","1.159743013","192.168.1.118","199.232.37.140","TCP","66","34142 → 443 [ACK] Seq=1 Ack=27656 Win=452 Len=0 TSval=1478527608 TSecr=2779956990"
"16","1.163138063","199.232.37.140","192.168.1.118","TLSv1.2","3448","Application Data, Application Data, Application Data, Application Data, Application Data"
"17","1.163353800","199.232.37.140","192.168.1.118","TLSv1.2","6826","Application Data, Application Data, Application Data, Application Data, Application Data"
"18","1.163704800","192.168.1.118","199.232.37.140","TCP","66","34142 → 443 [ACK] Seq=1 Ack=37798 Win=373 Len=0 TSval=1478527612 TSecr=2779956990"
"19","1.170818850","192.168.1.118","209.18.47.62","DNS","80","Standard query 0x9cba A www.redditstatic.com"
"20","1.172786675","199.232.37.140","192.168.1.118","TLSv1.2","13586","Application Data, Application Data, Application Data, Application Data, Application Data, Application Data, Application Data, Application Data, Application Data, Application Data, Application Data, Application Data"
"21","1.174053788","192.168.1.118","199.232.37.140","TCP","66","34142 → 443 [ACK] Seq=1 Ack=51318 Win=268 Len=0 TSval=1478527623 TSecr=2779956993"
"22","1.182043013","199.232.37.140","192.168.1.118","TLSv1.2","1418","Application Data [TCP segment of a reassembled PDU]"
"23","1.184532388","199.232.37.140","192.168.1.118","TLSv1.2","16290","Application Data, Application Data, Application Data, Application Data, Application Data, Application Data, Application Data, Application Data, Application Data, Application Data, Application Data, Application Data"
"24","1.184641288","199.232.37.140","192.168.1.118","TLSv1.2","1418","Application Data [TCP segment of a reassembled PDU]"
"25","1.189233863","192.168.1.118","199.232.37.140","TCP","66","34142 → 443 [ACK] Seq=1 Ack=70246 Win=206 Len=0 TSval=1478527638 TSecr=2779956996"
"26","1.192418575","209.18.47.62","192.168.1.118","DNS","131","Standard query response 0x9cba A www.redditstatic.com CNAME reddit.map.fastly.net A 199.232.37.140"
"27","1.192750288","192.168.1.118","209.18.47.62","DNS","80","Standard query 0x1468 AAAA www.redditstatic.com"
"28","1.194469113","199.232.37.140","192.168.1.118","TLSv1.2","1418","Application Data [TCP segment of a reassembled PDU]"
"29","1.196472700","199.232.37.140","192.168.1.118","TLSv1.2","2770","Application Data, Application Data"
"30","1.196629863","192.168.1.118","199.232.37.140","TCP","66","34142 → 443 [ACK] Seq=1 Ack=74302 Win=175 Len=0 TSval=1478527645 TSecr=2779957000"
"31","1.197173750","199.232.37.140","192.168.1.118","TLSv1.2","2770","Application Data, Application Data"
"32","1.197916963","192.168.1.118","199.232.37.140","TCP","66","34142 → 443 [ACK] Seq=1 Ack=77006 Win=154 Len=0 TSval=1478527647 TSecr=2779957000"
"33","1.198325525","199.232.37.140","192.168.1.118","TLSv1.2","2770","Application Data [TCP segment of a reassembled PDU]"
"34","1.201287825","199.232.37.140","192.168.1.118","TLSv1.2","2770","Application Data, Application Data, Application Data, Application Data, Application Data"
"35","1.202298875","199.232.37.140","192.168.1.118","TLSv1.2","1418","Application Data [TCP segment of a reassembled PDU]"
"36","1.202383113","199.232.37.140","192.168.1.118","TLSv1.2","1418","Application Data [TCP segment of a reassembled PDU]"
"37","1.203363550","199.232.37.140","192.168.1.118","TCP","570","443 → 34142 [ACK] Seq=85118 Ack=1 Win=58 Len=504 TSval=2779957001 TSecr=1478527623 [TCP segment of a reassembled PDU]"
"38","1.204266800","192.168.1.118","199.232.37.140","TCP","66","34142 → 443 [ACK] Seq=1 Ack=85622 Win=87 Len=0 TSval=1478527653 TSecr=2779957000"
"39","1.205810288","192.168.1.118","199.232.37.140","TCP","66","[TCP Window Update] 34142 → 443 [ACK] Seq=1 Ack=85622 Win=190 Len=0 TSval=1478527655 TSecr=2779957000"
"40","1.212895950","209.18.47.62","192.168.1.118","DNS","173","Standard query response 0x1468 AAAA www.redditstatic.com CNAME reddit.map.fastly.net SOA ns1.fastly.net"
"41","1.214432700","199.232.37.140","192.168.1.118","TLSv1.2","1418","Application Data [TCP segment of a reassembled PDU]"
"42","1.215123263","192.168.1.118","199.232.37.140","TCP","74","34164 → 443 [SYN] Seq=0 Win=64240 Len=0 MSS=1460 SACK_PERM=1 TSval=1478527664 TSecr=0 WS=128"
"43","1.215806213","199.232.37.140","192.168.1.118","TLSv1.2","5474","Application Data, Application Data, Application Data, Application Data"
"44","1.216527938","192.168.1.118","199.232.37.140","TCP","66","34142 → 443 [ACK] Seq=1 Ack=92382 Win=138 Len=0 TSval=1478527665 TSecr=2779957005"
"45","1.217165288","199.232.37.140","192.168.1.118","TLSv1.2","4122","Application Data, Application Data, Application Data"
"46","1.220993313","192.168.1.118","199.232.37.140","TCP","66","34142 → 443 [ACK] Seq=1 Ack=96438 Win=107 Len=0 TSval=1478527670 TSecr=2779957005"
"47","1.229478800","199.232.37.140","192.168.1.118","TLSv1.2","1418","Application Data [TCP segment of a reassembled PDU]"
"48","1.231452188","199.232.37.140","192.168.1.118","TLSv1.2","3618","Application Data, Application Data"
"49","1.231676175","199.232.37.140","192.168.1.118","TLSv1.2","8666","Application Data, Application Data, Application Data, Application Data, Application Data, Application Data, Application Data"
"50","1.232630363","199.232.37.140","192.168.1.118","TCP","74","443 → 34164 [SYN, ACK] Seq=0 Ack=1 Win=27040 Len=0 MSS=1364 SACK_PERM=1 TSval=3138852979 TSecr=1478527664 WS=512"
"51","1.232795175","192.168.1.118","199.232.37.140","TCP","66","34164 → 443 [ACK] Seq=1 Ack=1 Win=64256 Len=0 TSval=1478527681 TSecr=3138852979"
"52","1.234166663","192.168.1.118","199.232.37.140","TCP","66","34142 → 443 [ACK] Seq=1 Ack=109942 Win=2 Len=0 TSval=1478527683 TSecr=2779957009"
"53","1.250479900","192.168.1.118","199.232.37.140","TLSv1","583","Client Hello"
"54","1.252862850","192.168.1.118","199.232.37.140","TCP","66","[TCP Window Update] 34142 → 443 [ACK] Seq=1 Ack=109942 Win=147 Len=0 TSval=1478527702 TSecr=2779957009"
"55","1.269536975","192.168.1.118","199.232.37.140","TCP","74","34166 → 443 [SYN] Seq=0 Win=64240 Len=0 MSS=1460 SACK_PERM=1 TSval=1478527718 TSecr=0 WS=128"
"56","1.269842675","192.168.1.118","199.232.37.140","TCP","74","34168 → 443 [SYN] Seq=0 Win=64240 Len=0 MSS=1460 SACK_PERM=1 TSval=1478527719 TSecr=0 WS=128"
"57","1.269969288","192.168.1.118","199.232.37.140","TCP","74","34170 → 443 [SYN] Seq=0 Win=64240 Len=0 MSS=1460 SACK_PERM=1 TSval=1478527719 TSecr=0 WS=128"
"58","1.270065488","192.168.1.118","199.232.37.140","TCP","74","34172 → 443 [SYN] Seq=0 Win=64240 Len=0 MSS=1460 SACK_PERM=1 TSval=1478527719 TSecr=0 WS=128"
"59","1.270451150","192.168.1.118","209.18.47.62","DNS","82","Standard query 0x84cf A styles.redditmedia.com"
"60","1.271182525","192.168.1.118","209.18.47.62","DNS","75","Standard query 0x80c4 A preview.redd.it"
"61","1.274868013","199.232.37.140","192.168.1.118","TLSv1.2","1418","Application Data [TCP segment of a reassembled PDU]"
"62","1.277602150","199.232.37.140","192.168.1.118","TCP","66","443 → 34164 [ACK] Seq=1 Ack=518 Win=28160 Len=0 TSval=3138852990 TSecr=1478527699"
"63","1.277819900","199.232.37.140","192.168.1.118","TLSv1.2","8178","Application Data, Application Data, Application Data, Application Data, Application Data"
"64","1.277920563","192.168.1.118","199.232.37.140","TCP","66","34142 → 443 [ACK] Seq=1 Ack=119406 Win=74 Len=0 TSval=1478527727 TSecr=2779957020"
"65","1.285416363","199.232.37.140","192.168.1.118","TLSv1.2","9418","Application Data, Application Data, Application Data, Application Data, Application Data, Application Data, Application Data"
"66","1.285590313","199.232.37.140","192.168.1.118","TLSv1.2","3304","Server Hello, Certificate, Server Key Exchange, Server Hello Done"
"67","1.285687225","192.168.1.118","199.232.37.140","TCP","66","34164 → 443 [ACK] Seq=518 Ack=3239 Win=61056 Len=0 TSval=1478527734 TSecr=3138852990"
"68","1.295362863","199.232.37.140","192.168.1.118","TCP","74","443 → 34166 [SYN, ACK] Seq=0 Ack=1 Win=27040 Len=0 MSS=1364 SACK_PERM=1 TSval=3136844180 TSecr=1478527718 WS=512"
"69","1.295548888","192.168.1.118","199.232.37.140","TCP","66","34166 → 443 [ACK] Seq=1 Ack=1 Win=64256 Len=0 TSval=1478527744 TSecr=3136844180"
"70","1.296531413","192.168.1.118","199.232.37.140","TCP","66","34142 → 443 [ACK] Seq=1 Ack=128758 Win=1 Len=0 TSval=1478527745 TSecr=2779957020"
"71","1.298535663","192.168.1.118","199.232.37.140","TLSv1.2","192","Client Key Exchange, Change Cipher Spec, Encrypted Handshake Message"
"72","1.302435750","209.18.47.62","192.168.1.118","DNS","126","Standard query response 0x80c4 A preview.redd.it CNAME reddit.map.fastly.net A 199.232.37.140"
"73","1.302813988","192.168.1.118","209.18.47.62","DNS","75","Standard query 0xf06c AAAA preview.redd.it"
"74","1.304157950","209.18.47.62","192.168.1.118","DNS","133","Standard query response 0x84cf A styles.redditmedia.com CNAME reddit.map.fastly.net A 199.232.37.140"
"75","1.304494250","192.168.1.118","209.18.47.62","DNS","82","Standard query 0xa88c AAAA styles.redditmedia.com"
"76","1.311263938","199.232.37.140","192.168.1.118","TCP","74","443 → 34170 [SYN, ACK] Seq=0 Ack=1 Win=27040 Len=0 MSS=1364 SACK_PERM=1 TSval=264537663 TSecr=1478527719 WS=512"
"77","1.311390625","192.168.1.118","199.232.37.140","TCP","66","34170 → 443 [ACK] Seq=1 Ack=1 Win=64256 Len=0 TSval=1478527760 TSecr=264537663"
"78","1.311456038","199.232.37.140","192.168.1.118","TCP","74","443 → 34168 [SYN, ACK] Seq=0 Ack=1 Win=27040 Len=0 MSS=1364 SACK_PERM=1 TSval=267459332 TSecr=1478527719 WS=512"
"79","1.311517413","192.168.1.118","199.232.37.140","TCP","66","34168 → 443 [ACK] Seq=1 Ack=1 Win=64256 Len=0 TSval=1478527760 TSecr=267459332"
"80","1.311559525","199.232.37.140","192.168.1.118","TCP","74","443 → 34172 [SYN, ACK] Seq=0 Ack=1 Win=27040 Len=0 MSS=1364 SACK_PERM=1 TSval=2805774991 TSecr=1478527719 WS=512"
"81","1.311619313","192.168.1.118","199.232.37.140","TCP","66","34172 → 443 [ACK] Seq=1 Ack=1 Win=64256 Len=0 TSval=1478527760 TSecr=2805774991"
"82","1.314768488","192.168.1.118","199.232.37.140","TLSv1","583","Client Hello"
"83","1.316106375","199.232.37.140","192.168.1.118","TLSv1.2","117","Change Cipher Spec, Encrypted Handshake Message"
"84","1.324507225","209.18.47.62","192.168.1.118","DNS","171","Standard query response 0xf06c AAAA preview.redd.it CNAME reddit.map.fastly.net SOA ns1.fastly.net"
"85","1.325519963","209.18.47.62","192.168.1.118","DNS","175","Standard query response 0xa88c AAAA styles.redditmedia.com CNAME reddit.map.fastly.net SOA ns1.fastly.net"
"86","1.331496475","192.168.1.118","199.232.37.140","TLSv1","583","Client Hello"
"87","1.340080575","199.232.37.140","192.168.1.118","TCP","66","443 → 34166 [ACK] Seq=1 Ack=518 Win=28160 Len=0 TSval=3136844192 TSecr=1478527763"
"88","1.342271725","199.232.37.140","192.168.1.118","TCP","66","443 → 34168 [ACK] Seq=1 Ack=518 Win=28160 Len=0 TSval=267459341 TSecr=1478527780"
"89","1.344289900","199.232.37.140","192.168.1.118","TLSv1.2","3304","Server Hello, Certificate, Server Key Exchange, Server Hello Done"
"90","1.344421475","192.168.1.118","199.232.37.140","TCP","66","34166 → 443 [ACK] Seq=518 Ack=3239 Win=61056 Len=0 TSval=1478527793 TSecr=3136844192"
"91","1.344576988","199.232.37.140","192.168.1.118","TLSv1.2","3304","Server Hello, Certificate, Server Key Exchange, Server Hello Done"
"92","1.344661025","192.168.1.118","199.232.37.140","TCP","66","34168 → 443 [ACK] Seq=518 Ack=3239 Win=61056 Len=0 TSval=1478527793 TSecr=267459341"
"93","1.347813850","192.168.1.118","199.232.37.140","TLSv1","583","Client Hello"
"94","1.357021175","192.168.1.118","199.232.37.140","TCP","66","34164 → 443 [ACK] Seq=644 Ack=3290 Win=64128 Len=0 TSval=1478527806 TSecr=3138853000"
"95","1.364863000","192.168.1.118","199.232.37.140","TLSv1","583","Client Hello"
"96","1.366379888","192.168.1.118","209.18.47.62","DNS","82","Standard query 0x3c0c A styles.redditmedia.com"
"97","1.366454050","192.168.1.118","199.232.37.140","TLSv1.2","256","Application Data"
"98","1.366638450","192.168.1.118","199.232.37.140","TCP","74","34174 → 443 [SYN] Seq=0 Win=64240 Len=0 MSS=1460 SACK_PERM=1 TSval=1478527815 TSecr=0 WS=128"
"99","1.367213900","192.168.1.118","209.18.47.62","DNS","82","Standard query 0x68a1 A styles.redditmedia.com"
"100","1.367979488","192.168.1.118","209.18.47.62","DNS","84","Standard query 0x9472 A b.thumbs.redditmedia.com"
"101","1.368768425","192.168.1.118","199.232.37.140","TLSv1.2","192","Client Key Exchange, Change Cipher Spec, Encrypted Handshake Message"
"102","1.368893350","192.168.1.118","209.18.47.62","DNS","75","Standard query 0xe893 A preview.redd.it"
"103","1.368994788","192.168.1.118","199.232.37.140","TCP","74","34176 → 443 [SYN] Seq=0 Win=64240 Len=0 MSS=1460 SACK_PERM=1 TSval=1478527818 TSecr=0 WS=128"
"104","1.369296163","199.232.37.140","192.168.1.118","TCP","66","443 → 34170 [ACK] Seq=1 Ack=518 Win=28160 Len=0 TSval=264537679 TSecr=1478527797"
"105","1.370250338","192.168.1.118","209.18.47.62","DNS","75","Standard query 0xd406 A preview.redd.it"
"106","1.370927975","192.168.1.118","199.232.37.140","TLSv1.2","192","Client Key Exchange, Change Cipher Spec, Encrypted Handshake Message"
"107","1.371153038","192.168.1.118","199.232.37.140","TCP","74","34178 → 443 [SYN] Seq=0 Win=64240 Len=0 MSS=1460 SACK_PERM=1 TSval=1478527820 TSecr=0 WS=128"
"108","1.371236788","192.168.1.118","199.232.37.140","TCP","74","34180 → 443 [SYN] Seq=0 Win=64240 Len=0 MSS=1460 SACK_PERM=1 TSval=1478527820 TSecr=0 WS=128"
"109","1.371318500","192.168.1.118","199.232.37.140","TCP","74","34182 → 443 [SYN] Seq=0 Win=64240 Len=0 MSS=1460 SACK_PERM=1 TSval=1478527820 TSecr=0 WS=128"
"110","1.371389475","192.168.1.118","199.232.37.140","TCP","74","34184 → 443 [SYN] Seq=0 Win=64240 Len=0 MSS=1460 SACK_PERM=1 TSval=1478527820 TSecr=0 WS=128"
"111","1.377528113","199.232.37.140","192.168.1.118","TLSv1.2","3304","Server Hello, Certificate, Server Key Exchange, Server Hello Done"
"112","1.377598763","192.168.1.118","199.232.37.140","TCP","66","34170 → 443 [ACK] Seq=518 Ack=3239 Win=61056 Len=0 TSval=1478527826 TSecr=264537679"
"113","1.380670538","192.168.1.118","199.232.37.140","TLSv1.2","192","Client Key Exchange, Change Cipher Spec, Encrypted Handshake Message"
"114","1.381443975","199.232.37.140","192.168.1.118","TCP","66","443 → 34172 [ACK] Seq=1 Ack=518 Win=28160 Len=0 TSval=2805775010 TSecr=1478527814"
"115","1.383614025","199.232.37.140","192.168.1.118","TLSv1.2","3304","Server Hello, Certificate, Server Key Exchange, Server Hello Done"
"116","1.383685663","192.168.1.118","199.232.37.140","TCP","66","34172 → 443 [ACK] Seq=518 Ack=3239 Win=61056 Len=0 TSval=1478527832 TSecr=2805775010"
"117","1.388531313","209.18.47.62","192.168.1.118","DNS","133","Standard query response 0x3c0c A styles.redditmedia.com CNAME reddit.map.fastly.net A 199.232.37.140"
"118","1.388777975","192.168.1.118","209.18.47.62","DNS","82","Standard query 0xcc0b AAAA styles.redditmedia.com"
"119","1.390594725","192.168.1.118","199.232.37.140","TLSv1.2","192","Client Key Exchange, Change Cipher Spec, Encrypted Handshake Message"
"120","1.391913050","192.168.1.118","209.18.47.62","DNS","84","Standard query 0x1ca9 A a.thumbs.redditmedia.com"
"121","1.392787963","192.168.1.118","209.18.47.62","DNS","77","Standard query 0x74ad A s.redditmedia.com"
"122","1.393527850","192.168.1.118","209.18.47.62","DNS","84","Standard query 0xa4f7 A b.thumbs.redditmedia.com"
"123","1.393873650","192.168.1.118","209.18.47.62","DNS","84","Standard query 0x48af A b.thumbs.redditmedia.com"
"124","1.399766775","192.168.1.118","199.232.37.140","TCP","66","[TCP Window Update] 34142 → 443 [ACK] Seq=1 Ack=128758 Win=195 Len=0 TSval=1478527848 TSecr=2779957020"
"125","1.408182475","192.168.1.118","199.232.37.140","TCP","66","[TCP Window Update] 34142 → 443 [ACK] Seq=1 Ack=128758 Win=478 Len=0 TSval=1478527857 TSecr=2779957020"
"126","1.411039113","199.232.37.140","192.168.1.118","TCP","74","443 → 34174 [SYN, ACK] Seq=0 Ack=1 Win=27040 Len=0 MSS=1364 SACK_PERM=1 TSval=655880162 TSecr=1478527815 WS=512"
"127","1.411180413","192.168.1.118","199.232.37.140","TCP","66","34174 → 443 [ACK] Seq=1 Ack=1 Win=64256 Len=0 TSval=1478527860 TSecr=655880162"
"128","1.412728900","199.232.37.140","192.168.1.118","TLSv1.2","8178","Application Data, Application Data, Application Data, Application Data, Application Data, Application Data"
"129","1.412847125","192.168.1.118","199.232.37.140","TCP","66","34164 → 443 [ACK] Seq=834 Ack=11402 Win=56064 Len=0 TSval=1478527862 TSecr=3138853022"
"130","1.412918988","199.232.37.140","192.168.1.118","TLSv1.2","1422","Application Data, Application Data"
"131","1.412996338","192.168.1.118","199.232.37.140","TCP","66","34164 → 443 [ACK] Seq=834 Ack=12758 Win=54784 Len=0 TSval=1478527862 TSecr=3138853023"
"132","1.413046100","199.232.37.140","192.168.1.118","TCP","74","443 → 34176 [SYN, ACK] Seq=0 Ack=1 Win=27040 Len=0 MSS=1364 SACK_PERM=1 TSval=2803975290 TSecr=1478527818 WS=512"
"133","1.413141600","192.168.1.118","199.232.37.140","TCP","66","34176 → 443 [ACK] Seq=1 Ack=1 Win=64256 Len=0 TSval=1478527862 TSecr=2803975290"
"134","1.413191700","199.232.37.140","192.168.1.118","TLSv1.2","117","Change Cipher Spec, Encrypted Handshake Message"
"135","1.414229088","209.18.47.62","192.168.1.118","DNS","126","Standard query response 0xe893 A preview.redd.it CNAME reddit.map.fastly.net A 199.232.37.140"
"136","1.414536188","192.168.1.118","209.18.47.62","DNS","75","Standard query 0x0c10 AAAA preview.redd.it"
"137","1.417808250","209.18.47.62","192.168.1.118","DNS","126","Standard query response 0xd406 A preview.redd.it CNAME reddit.map.fastly.net A 199.232.37.140"
"138","1.418136613","192.168.1.118","209.18.47.62","DNS","75","Standard query 0x2c88 AAAA preview.redd.it"
"139","1.422833875","209.18.47.62","192.168.1.118","DNS","135","Standard query response 0x9472 A b.thumbs.redditmedia.com CNAME reddit.map.fastly.net A 199.232.37.140"
"140","1.422920338","209.18.47.62","192.168.1.118","DNS","133","Standard query response 0x68a1 A styles.redditmedia.com CNAME reddit.map.fastly.net A 199.232.37.140"
"141","1.422986975","199.232.37.140","192.168.1.118","TLSv1.2","117","Change Cipher Spec, Encrypted Handshake Message"
"142","1.423044013","199.232.37.140","192.168.1.118","TCP","74","443 → 34178 [SYN, ACK] Seq=0 Ack=1 Win=27040 Len=0 MSS=1364 SACK_PERM=1 TSval=2805775019 TSecr=1478527820 WS=512"
"143","1.423117038","192.168.1.118","199.232.37.140","TCP","66","34178 → 443 [ACK] Seq=1 Ack=1 Win=64256 Len=0 TSval=1478527872 TSecr=2805775019"
"144","1.423173375","199.232.37.140","192.168.1.118","TCP","74","443 → 34180 [SYN, ACK] Seq=0 Ack=1 Win=27040 Len=0 MSS=1364 SACK_PERM=1 TSval=268232753 TSecr=1478527820 WS=512"
"145","1.423226438","192.168.1.118","199.232.37.140","TCP","66","34180 → 443 [ACK] Seq=1 Ack=1 Win=64256 Len=0 TSval=1478527872 TSecr=268232753"
"146","1.423262088","199.232.37.140","192.168.1.118","TCP","74","443 → 34182 [SYN, ACK] Seq=0 Ack=1 Win=43264 Len=0 MSS=1364 SACK_PERM=1 TSval=2111506545 TSecr=1478527820 WS=512"
"147","1.423312963","192.168.1.118","199.232.37.140","TCP","66","34182 → 443 [ACK] Seq=1 Ack=1 Win=64256 Len=0 TSval=1478527872 TSecr=2111506545"
"148","1.423492513","192.168.1.118","209.18.47.62","DNS","84","Standard query 0xb4cd AAAA b.thumbs.redditmedia.com"
"149","1.423573938","209.18.47.62","192.168.1.118","DNS","175","Standard query response 0xcc0b AAAA styles.redditmedia.com CNAME reddit.map.fastly.net SOA ns1.fastly.net"
"150","1.423930388","192.168.1.118","209.18.47.62","DNS","82","Standard query 0x082a AAAA styles.redditmedia.com"
"151","1.427382188","192.168.1.118","199.232.37.140","TLSv1","583","Client Hello"
"152","1.427725525","192.168.1.118","199.232.37.140","TLSv1.2","276","Application Data"
"153","1.428856413","199.232.37.140","192.168.1.118","TCP","74","443 → 34184 [SYN, ACK] Seq=0 Ack=1 Win=27040 Len=0 MSS=1364 SACK_PERM=1 TSval=4195372097 TSecr=1478527820 WS=512"
"154","1.428993400","192.168.1.118","199.232.37.140","TCP","66","34184 → 443 [ACK] Seq=1 Ack=1 Win=64256 Len=0 TSval=1478527878 TSecr=4195372097"
"155","1.429045950","199.232.37.140","192.168.1.118","TLSv1.2","117","Change Cipher Spec, Encrypted Handshake Message"
"156","1.436643450","199.232.37.140","192.168.1.118","TLSv1.2","117","Change Cipher Spec, Encrypted Handshake Message"
"157","1.438047600","209.18.47.62","192.168.1.118","DNS","135","Standard query response 0xa4f7 A b.thumbs.redditmedia.com CNAME reddit.map.fastly.net A 199.232.37.140"
"158","1.438149013","209.18.47.62","192.168.1.118","DNS","128","Standard query response 0x74ad A s.redditmedia.com CNAME reddit.map.fastly.net A 199.232.37.140"
"159","1.438243088","199.232.37.140","192.168.1.118","TLSv1.2","3746","Application Data, Application Data, Application Data"
"160","1.438313625","192.168.1.118","199.232.37.140","TCP","66","34142 → 443 [ACK] Seq=1 Ack=132438 Win=559 Len=0 TSval=1478527887 TSecr=2779957060"
"161","1.438396938","209.18.47.62","192.168.1.118","DNS","135","Standard query response 0x48af A b.thumbs.redditmedia.com CNAME reddit.map.fastly.net A 199.232.37.140"
"162","1.438450575","209.18.47.62","192.168.1.118","DNS","135","Standard query response 0x1ca9 A a.thumbs.redditmedia.com CNAME reddit.map.fastly.net A 199.232.37.140"
"163","1.438519050","199.232.37.140","192.168.1.118","TLSv1.2","2702","Application Data, Application Data, Application Data"
"164","1.438565613","192.168.1.118","199.232.37.140","TCP","66","34142 → 443 [ACK] Seq=1 Ack=135074 Win=590 Len=0 TSval=1478527887 TSecr=2779957060"
"165","1.438751988","192.168.1.118","209.18.47.62","DNS","77","Standard query 0x4c39 AAAA s.redditmedia.com"
"166","1.438896338","192.168.1.118","209.18.47.62","DNS","84","Standard query 0xb03a AAAA a.thumbs.redditmedia.com"
"167","1.439161888","192.168.1.118","209.18.47.62","DNS","84","Standard query 0x20cd AAAA b.thumbs.redditmedia.com"
"168","1.439316513","192.168.1.118","209.18.47.62","DNS","84","Standard query 0x403c AAAA b.thumbs.redditmedia.com"
"169","1.444023525","209.18.47.62","192.168.1.118","DNS","171","Standard query response 0x0c10 AAAA preview.redd.it CNAME reddit.map.fastly.net SOA ns1.fastly.net"
"170","1.444064375","192.168.1.118","199.232.37.140","TLSv1","583","Client Hello"
"171","1.444417263","192.168.1.118","199.232.37.140","TLSv1.2","272","Application Data"
"172","1.444623850","192.168.1.118","199.232.37.140","TLSv1.2","274","Application Data"
"173","1.444816600","192.168.1.118","199.232.37.140","TLSv1.2","279","Application Data"
"174","1.445594275","209.18.47.62","192.168.1.118","DNS","177","Standard query response 0xb4cd AAAA b.thumbs.redditmedia.com CNAME reddit.map.fastly.net SOA ns1.fastly.net"
"175","1.448039625","209.18.47.62","192.168.1.118","DNS","171","Standard query response 0x2c88 AAAA preview.redd.it CNAME reddit.map.fastly.net SOA ns1.fastly.net"
"176","1.454249075","209.18.47.62","192.168.1.118","DNS","175","Standard query response 0x082a AAAA styles.redditmedia.com CNAME reddit.map.fastly.net SOA ns1.fastly.net"
"177","1.457011813","199.232.37.140","192.168.1.118","TCP","66","443 → 34174 [ACK] Seq=1 Ack=518 Win=28160 Len=0 TSval=655880174 TSecr=1478527876"
"178","1.458271950","199.232.37.140","192.168.1.118","TLSv1.2","1418","Application Data"
"179","1.459323938","199.232.37.140","192.168.1.118","TLSv1.2","1725","Application Data, Application Data"
"180","1.459431125","199.232.37.140","192.168.1.118","TLSv1.2","3314","Server Hello, Certificate, Server Key Exchange, Server Hello Done"
"181","1.459490150","192.168.1.118","199.232.37.140","TCP","66","34174 → 443 [ACK] Seq=518 Ack=3249 Win=61056 Len=0 TSval=1478527908 TSecr=655880175"
"182","1.462156025","192.168.1.118","199.232.37.140","TLSv1","583","Client Hello"
"183","1.463519825","209.18.47.62","192.168.1.118","DNS","170","Standard query response 0x4c39 AAAA s.redditmedia.com CNAME reddit.map.fastly.net SOA ns1.fastly.net"
"184","1.467045025","209.18.47.62","192.168.1.118","DNS","177","Standard query response 0x20cd AAAA b.thumbs.redditmedia.com CNAME reddit.map.fastly.net SOA ns1.fastly.net"
"185","1.467134875","209.18.47.62","192.168.1.118","DNS","177","Standard query response 0xb03a AAAA a.thumbs.redditmedia.com CNAME reddit.map.fastly.net SOA ns1.fastly.net"
"186","1.468199400","209.18.47.62","192.168.1.118","DNS","177","Standard query response 0x403c AAAA b.thumbs.redditmedia.com CNAME reddit.map.fastly.net SOA ns1.fastly.net"
"187","1.468257288","199.232.37.140","192.168.1.118","TCP","66","443 → 34176 [ACK] Seq=1 Ack=518 Win=28160 Len=0 TSval=2803975303 TSecr=1478527893"
"188","1.468357063","199.232.37.140","192.168.1.118","TLSv1.2","2937","Application Data, Application Data, Application Data"
"189","1.468424825","199.232.37.140","192.168.1.118","TLSv1.2","744","Application Data, Application Data"
"190","1.468516650","199.232.37.140","192.168.1.118","TLSv1.2","3432","Server Hello, Certificate, Server Key Exchange, Server Hello Done"
"191","1.468585625","192.168.1.118","199.232.37.140","TCP","66","34176 → 443 [ACK] Seq=518 Ack=3367 Win=60928 Len=0 TSval=1478527917 TSecr=2803975304"
"192","1.470109413","199.232.37.140","192.168.1.118","TLSv1.2","8178","Application Data, Application Data, Application Data, Application Data, Application Data, Application Data"
"193","1.473224125","199.232.37.140","192.168.1.118","TLSv1.2","3874","Application Data, Application Data, Application Data, Application Data"
"194","1.478623250","192.168.1.118","199.232.37.140","TLSv1","583","Client Hello"
"195","1.478825338","192.168.1.118","199.232.37.140","TCP","74","34186 → 443 [SYN] Seq=0 Win=64240 Len=0 MSS=1460 SACK_PERM=1 TSval=1478527928 TSecr=0 WS=128"
"196","1.489279850","199.232.37.140","192.168.1.118","TCP","66","443 → 34178 [ACK] Seq=1 Ack=518 Win=28160 Len=0 TSval=2805775036 TSecr=1478527911"
"197","1.492131813","199.232.37.140","192.168.1.118","TLSv1.2","3314","Server Hello, Certificate, Server Key Exchange, Server Hello Done"
"198","1.492251563","192.168.1.118","199.232.37.140","TCP","66","34178 → 443 [ACK] Seq=518 Ack=3249 Win=61056 Len=0 TSval=1478527941 TSecr=2805775036"
"199","1.495079175","192.168.1.118","199.232.37.140","TLSv1","583","Client Hello"
"200","1.499164050","192.168.1.118","199.232.37.140","TCP","66","34166 → 443 [ACK] Seq=854 Ack=6301 Win=61184 Len=0 TSval=1478527948 TSecr=3136844220"
"201","1.509315875","192.168.1.118","199.232.37.140","TCP","66","34172 → 443 [ACK] Seq=857 Ack=3968 Win=63488 Len=0 TSval=1478527958 TSecr=2805775031"
"202","1.509429275","192.168.1.118","199.232.37.140","TCP","66","34168 → 443 [ACK] Seq=850 Ack=6161 Win=61312 Len=0 TSval=1478527958 TSecr=267459372"
"203","1.511227075","192.168.1.118","199.232.37.140","TCP","66","34170 → 443 [ACK] Seq=852 Ack=15210 Win=52224 Len=0 TSval=1478527960 TSecr=264537704"
"204","1.511562100","192.168.1.118","199.232.37.140","TLSv1","583","Client Hello"
"205","1.511761550","192.168.1.118","199.232.37.140","TCP","74","34188 → 443 [SYN] Seq=0 Win=64240 Len=0 MSS=1460 SACK_PERM=1 TSval=1478527960 TSecr=0 WS=128"
"206","1.511845400","192.168.1.118","199.232.37.140","TCP","74","34190 → 443 [SYN] Seq=0 Win=64240 Len=0 MSS=1460 SACK_PERM=1 TSval=1478527961 TSecr=0 WS=128"
"207","1.511919750","192.168.1.118","199.232.37.140","TCP","74","34192 → 443 [SYN] Seq=0 Win=64240 Len=0 MSS=1460 SACK_PERM=1 TSval=1478527961 TSecr=0 WS=128"
"208","1.512018400","192.168.1.118","199.232.37.140","TCP","74","34194 → 443 [SYN] Seq=0 Win=64240 Len=0 MSS=1460 SACK_PERM=1 TSval=1478527961 TSecr=0 WS=128"
"209","1.514258638","192.168.1.118","199.232.37.140","TLSv1.2","192","Client Key Exchange, Change Cipher Spec, Encrypted Handshake Message"
"210","1.516277563","192.168.1.118","199.232.37.140","TLSv1.2","192","Client Key Exchange, Change Cipher Spec, Encrypted Handshake Message"
"211","1.518455788","192.168.1.118","199.232.37.140","TLSv1.2","192","Client Key Exchange, Change Cipher Spec, Encrypted Handshake Message"
"212","1.521916775","199.232.37.140","192.168.1.118","TCP","66","443 → 34180 [ACK] Seq=1 Ack=518 Win=28160 Len=0 TSval=268232780 TSecr=1478527927"
"213","1.523182225","199.232.37.140","192.168.1.118","TLSv1.2","3314","Server Hello, Certificate, Server Key Exchange, Server Hello Done"
"214","1.523276650","192.168.1.118","199.232.37.140","TCP","66","34180 → 443 [ACK] Seq=518 Ack=3249 Win=61056 Len=0 TSval=1478527972 TSecr=268232780"
"215","1.527139025","192.168.1.118","199.232.37.140","TLSv1.2","192","Client Key Exchange, Change Cipher Spec, Encrypted Handshake Message"
"216","1.529286100","199.232.37.140","192.168.1.118","TCP","74","443 → 34186 [SYN, ACK] Seq=0 Ack=1 Win=27040 Len=0 MSS=1364 SACK_PERM=1 TSval=2779957084 TSecr=1478527928 WS=512"
"217","1.529423688","192.168.1.118","199.232.37.140","TCP","66","34186 → 443 [ACK] Seq=1 Ack=1 Win=64256 Len=0 TSval=1478527978 TSecr=2779957084"
"218","1.531708250","199.232.37.140","192.168.1.118","TCP","66","443 → 34182 [ACK] Seq=1 Ack=518 Win=43008 Len=0 TSval=2111506659 TSecr=1478527944"
"219","1.535987425","199.232.37.140","192.168.1.118","TLSv1.2","3432","Server Hello, Certificate, Server Key Exchange, Server Hello Done"
"220","1.536096000","192.168.1.118","199.232.37.140","TCP","66","34182 → 443 [ACK] Seq=518 Ack=3367 Win=60928 Len=0 TSval=1478527985 TSecr=2111506660"
"221","1.540910300","199.232.37.140","192.168.1.118","TCP","66","443 → 34184 [ACK] Seq=1 Ack=518 Win=28160 Len=0 TSval=4195372126 TSecr=1478527960"
"222","1.541862575","199.232.37.140","192.168.1.118","TLSv1.2","117","Change Cipher Spec, Encrypted Handshake Message"
"223","1.542047300","192.168.1.118","199.232.37.140","TCP","66","34176 → 443 [ACK] Seq=644 Ack=3418 Win=64128 Len=0 TSval=1478527991 TSecr=2803975322"
"224","1.542149350","199.232.37.140","192.168.1.118","TLSv1.2","117","Change Cipher Spec, Encrypted Handshake Message"
"225","1.543089975","199.232.37.140","192.168.1.118","TCP","74","443 → 34190 [SYN, ACK] Seq=0 Ack=1 Win=27040 Len=0 MSS=1364 SACK_PERM=1 TSval=2803989144 TSecr=1478527961 WS=512"
"226","1.543273113","192.168.1.118","199.232.37.140","TCP","66","34190 → 443 [ACK] Seq=1 Ack=1 Win=64256 Len=0 TSval=1478527992 TSecr=2803989144"
"227","1.543371775","199.232.37.140","192.168.1.118","TCP","74","443 → 34188 [SYN, ACK] Seq=0 Ack=1 Win=27040 Len=0 MSS=1364 SACK_PERM=1 TSval=2805841019 TSecr=1478527960 WS=512"
"228","1.543482250","192.168.1.118","199.232.37.140","TCP","66","34188 → 443 [ACK] Seq=1 Ack=1 Win=64256 Len=0 TSval=1478527992 TSecr=2805841019"
"229","1.543559375","199.232.37.140","192.168.1.118","TCP","74","443 → 34192 [SYN, ACK] Seq=0 Ack=1 Win=27040 Len=0 MSS=1364 SACK_PERM=1 TSval=268946772 TSecr=1478527961 WS=512"
"230","1.543666950","192.168.1.118","199.232.37.140","TCP","66","34192 → 443 [ACK] Seq=1 Ack=1 Win=64256 Len=0 TSval=1478527992 TSecr=268946772"
"231","1.543741250","199.232.37.140","192.168.1.118","TCP","74","443 → 34194 [SYN, ACK] Seq=0 Ack=1 Win=27040 Len=0 MSS=1364 SACK_PERM=1 TSval=1348501713 TSecr=1478527961 WS=512"
"232","1.543845275","192.168.1.118","199.232.37.140","TCP","66","34194 → 443 [ACK] Seq=1 Ack=1 Win=64256 Len=0 TSval=1478527993 TSecr=1348501713"
"233","1.543919163","199.232.37.140","192.168.1.118","TLSv1.2","117","Change Cipher Spec, Encrypted Handshake Message"
"234","1.544050013","192.168.1.118","199.232.37.140","TCP","66","34174 → 443 [ACK] Seq=644 Ack=3300 Win=64128 Len=0 TSval=1478527993 TSecr=655880196"
"235","1.545140863","199.232.37.140","192.168.1.118","TLSv1.2","3432","Server Hello, Certificate, Server Key Exchange, Server Hello Done"
"236","1.545271913","192.168.1.118","199.232.37.140","TCP","66","34184 → 443 [ACK] Seq=518 Ack=3367 Win=60928 Len=0 TSval=1478527994 TSecr=4195372126"
"237","1.545482563","192.168.1.118","199.232.37.140","TLSv1","583","Client Hello"
"238","1.547502650","192.168.1.118","199.232.37.140","TLSv1.2","192","Client Key Exchange, Change Cipher Spec, Encrypted Handshake Message"
"239","1.547607600","199.232.37.140","192.168.1.118","TLSv1.2","117","Change Cipher Spec, Encrypted Handshake Message"
"240","1.549394975","192.168.1.118","199.232.37.140","TLSv1.2","192","Client Key Exchange, Change Cipher Spec, Encrypted Handshake Message"
"241","1.568715400","192.168.1.118","199.232.37.140","TLSv1","583","Client Hello"
"242","1.571899800","199.232.37.140","192.168.1.118","TLSv1.2","117","Change Cipher Spec, Encrypted Handshake Message"
"243","1.577622163","199.232.37.140","192.168.1.118","TCP","66","443 → 34186 [ACK] Seq=1 Ack=518 Win=28160 Len=0 TSval=2779957094 TSecr=1478527994"
"244","1.577690388","199.232.37.140","192.168.1.118","TLSv1.2","117","Change Cipher Spec, Encrypted Handshake Message"
"245","1.577738513","199.232.37.140","192.168.1.118","TLSv1.2","1418","Server Hello"
"246","1.577781825","192.168.1.118","199.232.37.140","TCP","66","34186 → 443 [ACK] Seq=518 Ack=1353 Win=63104 Len=0 TSval=1478528026 TSecr=2779957094"
"247","1.583044075","192.168.1.118","199.232.37.140","TCP","66","34178 → 443 [ACK] Seq=644 Ack=3300 Win=64128 Len=0 TSval=1478528032 TSecr=2805775050"
"248","1.586145138","192.168.1.118","199.232.37.140","TLSv1","583","Client Hello"
"249","1.587357913","199.232.37.140","192.168.1.118","TLSv1.2","1984","Certificate, Server Key Exchange, Server Hello Done"
"250","1.587465913","192.168.1.118","199.232.37.140","TCP","66","34186 → 443 [ACK] Seq=518 Ack=3271 Win=61312 Len=0 TSval=1478528036 TSecr=2779957094"
"251","1.592309500","192.168.1.118","199.232.37.140","TCP","66","34180 → 443 [ACK] Seq=644 Ack=3300 Win=64128 Len=0 TSval=1478528041 TSecr=268232786"
"252","1.603161675","192.168.1.118","199.232.37.140","TLSv1","583","Client Hello"
"253","1.609118675","199.232.37.140","192.168.1.118","TCP","66","443 → 34188 [ACK] Seq=1 Ack=518 Win=28160 Len=0 TSval=2805841036 TSecr=1478528017"
"254","1.610865325","199.232.37.140","192.168.1.118","TLSv1.2","1418","Server Hello"
"255","1.611034050","192.168.1.118","199.232.37.140","TCP","66","34188 → 443 [ACK] Seq=518 Ack=1353 Win=63104 Len=0 TSval=1478528060 TSecr=2805841036"
"256","1.616177400","199.232.37.140","192.168.1.118","TLSv1.2","1984","Certificate, Server Key Exchange, Server Hello Done"
"257","1.616316013","192.168.1.118","199.232.37.140","TCP","66","34188 → 443 [ACK] Seq=518 Ack=3271 Win=61312 Len=0 TSval=1478528065 TSecr=2805841036"
"258","1.618255475","192.168.1.118","199.232.37.140","TCP","66","34182 → 443 [ACK] Seq=644 Ack=3418 Win=64128 Len=0 TSval=1478528067 TSecr=2111506700"
"259","1.619559363","192.168.1.118","199.232.37.140","TLSv1","583","Client Hello"
"260","1.619770075","192.168.1.118","199.232.37.140","TLSv1.2","274","Application Data"
"261","1.620239075","192.168.1.118","199.232.37.140","TCP","66","34184 → 443 [ACK] Seq=644 Ack=3418 Win=64128 Len=0 TSval=1478528069 TSecr=4195372133"
"262","1.620359600","192.168.1.118","199.232.37.140","TLSv1.2","293","Application Data"
"263","1.620406363","199.232.37.140","192.168.1.118","TCP","66","443 → 34190 [ACK] Seq=1 Ack=518 Win=28160 Len=0 TSval=2803989163 TSecr=1478528035"
"264","1.620584000","192.168.1.118","199.232.37.140","TLSv1.2","371","Application Data"
"265","1.620821225","192.168.1.118","199.232.37.140","TLSv1.2","348","Application Data"
"266","1.621061988","192.168.1.118","199.232.37.140","TLSv1.2","293","Application Data"
"267","1.621115713","199.232.37.140","192.168.1.118","TLSv1.2","3314","Server Hello, Certificate, Server Key Exchange, Server Hello Done"
"268","1.621206163","192.168.1.118","199.232.37.140","TCP","66","34190 → 443 [ACK] Seq=518 Ack=3249 Win=61056 Len=0 TSval=1478528070 TSecr=2803989163"
"269","1.622946763","192.168.1.118","199.232.37.140","TLSv1.2","192","Client Key Exchange, Change Cipher Spec, Encrypted Handshake Message"
"270","1.623228188","192.168.1.118","199.232.37.140","TLSv1.2","369","Application Data"
"271","1.623435500","192.168.1.118","199.232.37.140","TLSv1.2","341","Application Data"
"272","1.625249238","192.168.1.118","199.232.37.140","TLSv1.2","192","Client Key Exchange, Change Cipher Spec, Encrypted Handshake Message"
"273","1.627056763","192.168.1.118","199.232.37.140","TLSv1.2","192","Client Key Exchange, Change Cipher Spec, Encrypted Handshake Message"
"274","1.631242400","199.232.37.140","192.168.1.118","TCP","66","443 → 34192 [ACK] Seq=1 Ack=518 Win=28160 Len=0 TSval=268946793 TSecr=1478528052"
"275","1.633062775","199.232.37.140","192.168.1.118","TLSv1.2","3336","Server Hello, Certificate, Server Key Exchange, Server Hello Done"
"276","1.633179988","192.168.1.118","199.232.37.140","TCP","66","34192 → 443 [ACK] Seq=518 Ack=3271 Win=61056 Len=0 TSval=1478528082 TSecr=268946793"
"277","1.636722225","192.168.1.118","199.232.37.140","TLSv1.2","192","Client Key Exchange, Change Cipher Spec, Encrypted Handshake Message"
"278","1.656056288","199.232.37.140","192.168.1.118","TLSv1.2","1418","Application Data"
"279","1.656205713","192.168.1.118","199.232.37.140","TCP","66","34178 → 443 [ACK] Seq=926 Ack=4652 Win=63104 Len=0 TSval=1478528105 TSecr=2805775079"
"280","1.657451888","199.232.37.140","192.168.1.118","TLSv1.2","5474","Application Data, Application Data, Application Data, Application Data"
"281","1.657584050","192.168.1.118","199.232.37.140","TCP","66","34178 → 443 [ACK] Seq=926 Ack=10060 Win=57728 Len=0 TSval=1478528106 TSecr=2805775079"
"282","1.659880975","199.232.37.140","192.168.1.118","TLSv1.2","2540","Application Data, Application Data, Application Data"
"283","1.660067650","192.168.1.118","199.232.37.140","TCP","66","34174 → 443 [ACK] Seq=871 Ack=5774 Win=61696 Len=0 TSval=1478528109 TSecr=655880225"
"284","1.660219713","199.232.37.140","192.168.1.118","TLSv1.2","3384","Application Data, Application Data, Application Data"
"285","1.660315538","192.168.1.118","199.232.37.140","TCP","66","34176 → 443 [ACK] Seq=949 Ack=6736 Win=60928 Len=0 TSval=1478528109 TSecr=2803975351"
"286","1.660453313","199.232.37.140","192.168.1.118","TLSv1.2","6826","Application Data, Application Data, Application Data, Application Data, Application Data"
"287","1.660545325","192.168.1.118","199.232.37.140","TCP","66","34178 → 443 [ACK] Seq=926 Ack=16820 Win=51072 Len=0 TSval=1478528109 TSecr=2805775079"
"288","1.660589900","199.232.37.140","192.168.1.118","TLSv1.2","4122","Application Data, Application Data"
"289","1.660672513","192.168.1.118","199.232.37.140","TCP","66","34174 → 443 [ACK] Seq=871 Ack=9830 Win=57728 Len=0 TSval=1478528109 TSecr=655880225"
"290","1.664806175","199.232.37.140","192.168.1.118","TLSv1.2","2532","Application Data, Application Data, Application Data"
"291","1.664915200","192.168.1.118","199.232.37.140","TCP","66","34166 → 443 [ACK] Seq=1062 Ack=8767 Win=61696 Len=0 TSval=1478528114 TSecr=3136844271"
"292","1.664995688","199.232.37.140","192.168.1.118","TCP","66","443 → 34194 [ACK] Seq=1 Ack=518 Win=28160 Len=0 TSval=1348501829 TSecr=1478528068"
"293","1.665078025","199.232.37.140","192.168.1.118","TLSv1.2","3336","Server Hello, Certificate, Server Key Exchange, Server Hello Done"
"294","1.665124938","192.168.1.118","199.232.37.140","TCP","66","34194 → 443 [ACK] Seq=518 Ack=3271 Win=61056 Len=0 TSval=1478528114 TSecr=1348501831"
"295","1.665161150","199.232.37.140","192.168.1.118","TLSv1.2","6826","Application Data, Application Data, Application Data, Application Data, Application Data"
"296","1.665215788","192.168.1.118","199.232.37.140","TCP","66","34174 → 443 [ACK] Seq=871 Ack=16590 Win=51072 Len=0 TSval=1478528114 TSecr=655880225"
"297","1.667050850","199.232.37.140","192.168.1.118","TLSv1.2","117","Change Cipher Spec, Encrypted Handshake Message"
"298","1.667140700","199.232.37.140","192.168.1.118","TLSv1.2","117","Change Cipher Spec, Encrypted Handshake Message"
"299","1.667364875","199.232.37.140","192.168.1.118","TLSv1.2","3768","Application Data, Application Data, Application Data, Application Data"
"300","1.667437338","192.168.1.118","199.232.37.140","TCP","66","34182 → 443 [ACK] Seq=947 Ack=7120 Win=60544 Len=0 TSval=1478528116 TSecr=2111506791"
"301","1.667511150","199.232.37.140","192.168.1.118","TLSv1.2","13586","Application Data, Application Data, Application Data, Application Data, Application Data, Application Data, Application Data, Application Data, Application Data, Application Data"
"302","1.667574725","192.168.1.118","199.232.37.140","TCP","66","34180 → 443 [ACK] Seq=871 Ack=16820 Win=50688 Len=0 TSval=1478528116 TSecr=268232815"
"303","1.667603150","199.232.37.140","192.168.1.118","TLSv1.2","1418","Application Data"
"304","1.667656688","192.168.1.118","199.232.37.140","TCP","66","34184 → 443 [ACK] Seq=919 Ack=4770 Win=63104 Len=0 TSval=1478528116 TSecr=4195372156"
"305","1.667732513","192.168.1.118","199.232.37.140","TLSv1.2","192","Client Key Exchange, Change Cipher Spec, Encrypted Handshake Message"
"306","1.668329625","192.168.1.118","199.232.37.140","TLSv1.2","295","Application Data"
"307","1.668707638","192.168.1.118","199.232.37.140","TLSv1.2","331","Application Data"
"308","1.686199350","199.232.37.140","192.168.1.118","TLSv1.2","117","Change Cipher Spec, Encrypted Handshake Message"
"309","1.686315338","199.232.37.140","192.168.1.118","TLSv1.2","117","Change Cipher Spec, Encrypted Handshake Message"
"310","1.686373713","199.232.37.140","192.168.1.118","TLSv1.2","12234","Application Data, Application Data, Application Data, Application Data, Application Data, Application Data, Application Data, Application Data, Application Data"
"311","1.686464075","192.168.1.118","199.232.37.140","TCP","66","34184 → 443 [ACK] Seq=919 Ack=16938 Win=50944 Len=0 TSval=1478528135 TSecr=4195372156"
"312","1.687236538","199.232.37.140","192.168.1.118","TLSv1.2","1224","Application Data, Application Data"
"313","1.687312300","192.168.1.118","199.232.37.140","TCP","66","34178 → 443 [ACK] Seq=926 Ack=17978 Win=63104 Len=0 TSval=1478528136 TSecr=2805775087"
"314","1.687821475","192.168.1.118","199.232.37.140","TLSv1.2","295","Application Data"
"315","1.688113463","192.168.1.118","199.232.37.140","TLSv1.2","295","Application Data"
"316","1.696189588","199.232.37.140","192.168.1.118","TLSv1.2","1418","Application Data [TCP segment of a reassembled PDU]"
"317","1.696302738","192.168.1.118","199.232.37.140","TCP","66","34180 → 443 [ACK] Seq=871 Ack=18172 Win=63104 Len=0 TSval=1478528145 TSecr=268232823"
"318","1.698349450","199.232.37.140","192.168.1.118","TLSv1.2","6826","Application Data, Application Data, Application Data, Application Data, Application Data"
"319","1.698468013","192.168.1.118","199.232.37.140","TCP","66","34180 → 443 [ACK] Seq=871 Ack=24932 Win=56448 Len=0 TSval=1478528147 TSecr=268232823"
"320","1.701313600","199.232.37.140","192.168.1.118","TLSv1.2","1983","Application Data, Application Data, Application Data"
"321","1.701428525","192.168.1.118","199.232.37.140","TCP","66","34174 → 443 [ACK] Seq=871 Ack=18507 Win=61056 Len=0 TSval=1478528150 TSecr=655880235"
"322","1.701579563","199.232.37.140","192.168.1.118","TLSv1.2","4128","Application Data, Application Data, Application Data"
"323","1.701647488","192.168.1.118","199.232.37.140","TCP","66","34180 → 443 [ACK] Seq=871 Ack=28994 Win=52480 Len=0 TSval=1478528150 TSecr=268232823"
"324","1.706300675","199.232.37.140","192.168.1.118","TLSv1.2","1418","Application Data [TCP segment of a reassembled PDU]"
"325","1.706403913","192.168.1.118","199.232.37.140","TCP","66","34184 → 443 [ACK] Seq=919 Ack=18290 Win=63104 Len=0 TSval=1478528155 TSecr=4195372167"
"326","1.708763375","199.232.37.140","192.168.1.118","TLSv1.2","13586","Application Data, Application Data, Application Data, Application Data, Application Data, Application Data, Application Data, Application Data, Application Data"
"327","1.708859013","192.168.1.118","199.232.37.140","TCP","66","34184 → 443 [ACK] Seq=919 Ack=31810 Win=49664 Len=0 TSval=1478528158 TSecr=4195372167"
"328","1.710376113","199.232.37.140","192.168.1.118","TLSv1.2","5474","Application Data, Application Data, Application Data, Application Data"
"329","1.710464125","192.168.1.118","199.232.37.140","TCP","66","34184 → 443 [ACK] Seq=919 Ack=37218 Win=44288 Len=0 TSval=1478528159 TSecr=4195372167"
"330","1.710636350","199.232.37.140","192.168.1.118","TLSv1.2","117","Change Cipher Spec, Encrypted Handshake Message"
"331","1.710696025","199.232.37.140","192.168.1.118","TLSv1.2","525","Application Data"
"332","1.710789025","199.232.37.140","192.168.1.118","TLSv1.2","97","Encrypted Alert"
"333","1.710846188","199.232.37.140","192.168.1.118","TLSv1.2","4233","Application Data, Application Data, Application Data, Application Data"
"334","1.710888275","199.232.37.140","192.168.1.118","TLSv1.2","6826","Application Data, Application Data, Application Data, Application Data, Application Data"
"335","1.711094625","199.232.37.140","192.168.1.118","TCP","66","443 → 34190 [FIN, ACK] Seq=3790 Ack=909 Win=29184 Len=0 TSval=2803989185 TSecr=1478528117"
"336","1.711322588","192.168.1.118","199.232.37.140","TCP","66","34186 → 443 [ACK] Seq=873 Ack=7489 Win=60032 Len=0 TSval=1478528160 TSecr=2779957128"
"337","1.712022013","192.168.1.118","199.232.37.140","TCP","66","34184 → 443 [ACK] Seq=919 Ack=43978 Win=37632 Len=0 TSval=1478528161 TSecr=4195372167"
"338","1.712475050","192.168.1.118","199.232.37.140","TLSv1.2","97","Encrypted Alert"
"339","1.716755025","192.168.1.118","199.232.37.140","TCP","66","34190 → 443 [RST, ACK] Seq=940 Ack=3791 Win=64128 Len=0 TSval=1478528165 TSecr=2803989185"
"340","1.718186113","192.168.1.118","199.232.37.140","TLSv1.2","295","Application Data"
"341","1.719065325","192.168.1.118","199.232.37.140","TLSv1.2","336","Application Data"
"342","1.722137125","199.232.37.140","192.168.1.118","TLSv1.2","1418","Application Data"
"343","1.723496038","199.232.37.140","192.168.1.118","TLSv1.2","6517","Application Data, Application Data, Application Data, Application Data, Application Data, Application Data"
"344","1.724005188","192.168.1.118","199.232.37.140","TCP","66","34192 → 443 [ACK] Seq=873 Ack=11125 Win=56448 Len=0 TSval=1478528173 TSecr=268946817"
"345","1.724544638","199.232.37.140","192.168.1.118","TLSv1.2","1418","Application Data"
"346","1.726272650","199.232.37.140","192.168.1.118","TLSv1.2","7267","Application Data, Application Data, Application Data, Application Data, Application Data, Application Data"
"347","1.726432863","192.168.1.118","199.232.37.140","TCP","66","34188 → 443 [ACK] Seq=873 Ack=11875 Win=55680 Len=0 TSval=1478528175 TSecr=2805841065"
"348","1.728143950","199.232.37.140","192.168.1.118","TLSv1.2","4122","Application Data, Application Data, Application Data"
"349","1.728565500","192.168.1.118","199.232.37.140","TCP","66","34184 → 443 [ACK] Seq=919 Ack=48034 Win=33664 Len=0 TSval=1478528177 TSecr=4195372172"
"350","1.730356825","199.232.37.140","192.168.1.118","TLSv1.2","5474","Application Data, Application Data, Application Data, Application Data"
"351","1.730498800","199.232.37.140","192.168.1.118","TLSv1.2","13586","Application Data, Application Data, Application Data, Application Data, Application Data, Application Data, Application Data, Application Data, Application Data"
"352","1.730587013","192.168.1.118","199.232.37.140","TCP","66","34184 → 443 [ACK] Seq=919 Ack=66962 Win=14848 Len=0 TSval=1478528179 TSecr=4195372172"
"353","1.735022688","199.232.37.140","192.168.1.118","TLSv1.2","12234","Application Data, Application Data, Application Data, Application Data, Application Data, Application Data, Application Data, Application Data, Application Data"
"354","1.735079113","199.232.37.140","192.168.1.118","TLSv1.2","2546","Application Data, Application Data"
"355","1.735093350","199.232.37.140","192.168.1.118","TCP","54","443 → 34190 [RST] Seq=3791 Win=0 Len=0"
"356","1.736338375","192.168.1.118","199.232.37.140","TCP","66","34184 → 443 [ACK] Seq=919 Ack=81610 Win=256 Len=0 TSval=1478528185 TSecr=4195372172"
"357","1.742027688","199.232.37.140","192.168.1.118","TLSv1.2","1418","Application Data"
"358","1.743607938","199.232.37.140","192.168.1.118","TLSv1.2","6826","Application Data, Application Data, Application Data, Application Data, Application Data"
"359","1.743890138","192.168.1.118","199.232.37.140","TCP","66","[TCP Window Update] 34184 → 443 [ACK] Seq=919 Ack=81610 Win=21760 Len=0 TSval=1478528193 TSecr=4195372172"
"360","1.744004575","192.168.1.118","199.232.37.140","TCP","66","34174 → 443 [ACK] Seq=1141 Ack=26619 Win=56064 Len=0 TSval=1478528193 TSecr=655880246"
"361","1.747376825","199.232.37.140","192.168.1.118","TLSv1.2","5474","Application Data, Application Data, Application Data, Application Data"
"362","1.747525025","199.232.37.140","192.168.1.118","TLSv1.2","6352","Application Data, Application Data, Application Data, Application Data, Application Data"
"363","1.747543200","199.232.37.140","192.168.1.118","TLSv1.2","8178","Application Data, Application Data, Application Data, Application Data, Application Data, Application Data"
"364","1.747851263","192.168.1.118","199.232.37.140","TCP","66","34194 → 443 [ACK] Seq=873 Ack=16842 Win=50688 Len=0 TSval=1478528197 TSecr=1348501914"
"365","1.748031350","192.168.1.118","199.232.37.140","TCP","66","34174 → 443 [ACK] Seq=1141 Ack=32905 Win=49792 Len=0 TSval=1478528197 TSecr=655880246"
"366","1.749964275","192.168.1.118","199.232.37.140","TCP","66","[TCP Window Update] 34184 → 443 [ACK] Seq=919 Ack=81610 Win=64128 Len=0 TSval=1478528199 TSecr=4195372172"
"367","1.756069775","199.232.37.140","192.168.1.118","TLSv1.2","1418","Application Data [TCP segment of a reassembled PDU]"
"368","1.756142825","192.168.1.118","199.232.37.140","TCP","66","34184 → 443 [ACK] Seq=919 Ack=82962 Win=66816 Len=0 TSval=1478528205 TSecr=4195372179"
"369","1.757552138","199.232.37.140","192.168.1.118","TLSv1.2","6826","Application Data, Application Data, Application Data, Application Data, Application Data"
"370","1.757624450","192.168.1.118","199.232.37.140","TCP","66","34184 → 443 [ACK] Seq=919 Ack=89722 Win=80384 Len=0 TSval=1478528206 TSecr=4195372179"
"371","1.759853663","199.232.37.140","192.168.1.118","TLSv1.2","5987","Application Data, Application Data, Application Data, Application Data, Application Data"
"372","1.759968763","192.168.1.118","199.232.37.140","TCP","66","34184 → 443 [ACK] Seq=919 Ack=95643 Win=92160 Len=0 TSval=1478528209 TSecr=4195372179"
"373","1.771184313","199.232.37.140","192.168.1.118","TLSv1.2","1418","Application Data [TCP segment of a reassembled PDU]"
"374","1.775320763","199.232.37.140","192.168.1.118","TLSv1.2","6826","Application Data, Application Data, Application Data, Application Data, Application Data"
"375","1.775420763","192.168.1.118","199.232.37.140","TCP","66","34194 → 443 [ACK] Seq=873 Ack=24954 Win=52864 Len=0 TSval=1478528224 TSecr=1348501943"
"376","1.776431438","199.232.37.140","192.168.1.118","TLSv1.2","8178","Application Data, Application Data, Application Data, Application Data, Application Data"
"377","1.782445100","199.232.37.140","192.168.1.118","TLSv1.2","2770","Application Data, Application Data"
"378","1.786481350","199.232.37.140","192.168.1.118","TLSv1.2","2770","Application Data, Application Data"
"379","1.790629950","199.232.37.140","192.168.1.118","TLSv1.2","2770","Application Data, Application Data"
"380","1.791750213","199.232.37.140","192.168.1.118","TLSv1.2","1418","Application Data [TCP segment of a reassembled PDU]"
"381","1.792772750","199.232.37.140","192.168.1.118","TLSv1.2","1418","Application Data [TCP segment of a reassembled PDU]"
"382","1.796314000","199.232.37.140","192.168.1.118","TLSv1.2","1418","Application Data [TCP segment of a reassembled PDU]"
"383","1.798315000","199.232.37.140","192.168.1.118","TLSv1.2","2770","Application Data, Application Data"
"384","1.800062863","199.232.37.140","192.168.1.118","TLSv1.2","1418","Application Data [TCP segment of a reassembled PDU]"
"385","1.800722700","199.232.37.140","192.168.1.118","TLSv1.2","1418","Application Data [TCP segment of a reassembled PDU]"
"386","1.807047163","199.232.37.140","192.168.1.118","TLSv1.2","1418","Application Data [TCP segment of a reassembled PDU]"
"387","1.807172338","192.168.1.118","199.232.37.140","TCP","66","34194 → 443 [ACK] Seq=873 Ack=51994 Win=25856 Len=0 TSval=1478528256 TSecr=1348501943"
"388","1.813970150","199.232.37.140","192.168.1.118","TLSv1.2","1418","Application Data [TCP segment of a reassembled PDU]"
"389","1.814090200","199.232.37.140","192.168.1.118","TLSv1.2","2770","Application Data, Application Data"
"390","1.817011050","199.232.37.140","192.168.1.118","TLSv1.2","2770","Application Data, Application Data"
"391","1.817110488","199.232.37.140","192.168.1.118","TLSv1.2","1418","Application Data [TCP segment of a reassembled PDU]"
"392","1.824340113","199.232.37.140","192.168.1.118","TLSv1.2","1418","Application Data [TCP segment of a reassembled PDU]"
"393","1.829047400","199.232.37.140","192.168.1.118","TLSv1.2","5023","Application Data, Application Data, Application Data, Application Data"
"394","1.855229438","192.168.1.118","199.232.37.140","TCP","66","34194 → 443 [ACK] Seq=873 Ack=66415 Win=11520 Len=0 TSval=1478528304 TSecr=1348501968"
"395","1.910040075","192.168.1.118","199.232.37.140","TLSv1.2","249","Application Data"
"396","1.915648288","192.168.1.118","199.232.37.140","TCP","66","[TCP Window Update] 34194 → 443 [ACK] Seq=873 Ack=66415 Win=24576 Len=0 TSval=1478528364 TSecr=1348501968"
"397","1.927676475","199.232.37.140","192.168.1.118","TLSv1.2","1151","Application Data, Application Data"
"398","1.927747675","192.168.1.118","199.232.37.140","TCP","66","34164 → 443 [ACK] Seq=1017 Ack=13843 Win=63104 Len=0 TSval=1478528376 TSecr=3138853153"
"399","1.940690638","192.168.1.118","239.255.255.250","SSDP","218","M-SEARCH * HTTP/1.1 "
"400","1.954314125","192.168.1.118","199.232.37.140","TCP","66","[TCP Window Update] 34194 → 443 [ACK] Seq=873 Ack=66415 Win=64128 Len=0 TSval=1478528403 TSecr=1348501968"
"401","2.153248375","192.168.1.104","255.255.255.255","UDP","217","49154 → 6666 Len=175"
"402","2.942282775","192.168.1.118","239.255.255.250","SSDP","218","M-SEARCH * HTTP/1.1 "
"403","3.896881525","192.168.1.100","224.0.0.251","MDNS","522","Standard query 0x0000 PTR _airport._tcp.local, "QM" question PTR _googlecast._tcp.local, "QM" question PTR _homekit._tcp.local, "QM" question PTR _raop._tcp.local, "QM" question PTR _airplay._tcp.local, "QM" question PTR _rdlink._tcp.local, "QM" question PTR _uscans._tcp.local, "QM" question PTR _uscan._tcp.local, "QM" question PTR _ippusb._tcp.local, "QM" question PTR _ipp._tcp.local, "QM" question PTR _scanner._tcp.local, "QM" question PTR _ipps._tcp.local, "QM" question PTR _printer._tcp.local, "QM" question PTR _pdl-datastream._tcp.local, "QM" question PTR _ptp._tcp.local, "QM" question PTR _afpovertcp._tcp.local, "QM" question PTR _smb._tcp.local, "QM" question PTR _rfb._tcp.local, "QM" question PTR _adisk._tcp.local, "QM" question PTR _apple-mobdev._tcp.local, "QM" question PTR 8ed307c3._sub._apple-mobdev2._tcp.local, "QM" question PTR _apple-pairable._tcp.local, "QM" question TXT Google-Home-Mini-2c3f16b2da5c4b6fd6cfbfba61c12490._googlecast._tcp.local, "QM" question PTR Google-Home-Mini-2c3f16b2da5c4b6fd6cfbfba61c12490._googlecast._tcp.local PTR cjqg._smb._tcp.local OPT"
"404","3.942828900","192.168.1.118","239.255.255.250","SSDP","218","M-SEARCH * HTTP/1.1 "
"405","3.995861900","192.168.1.102","224.0.0.251","MDNS","183","Standard query response 0x0000 SRV, cache flush 0 0 8009 2c3f16b2-da5c-4b6f-d6cf-bfba61c12490.local"
"406","4.944845438","192.168.1.118","239.255.255.250","SSDP","218","M-SEARCH * HTTP/1.1 "
"407","5.124100063","192.168.1.104","255.255.255.255","UDP","217","49154 → 6666 Len=175"
"408","5.297862700","192.168.1.118","192.168.1.102","TCP","176","40160 → 8009 [PSH, ACK] Seq=111 Ack=111 Win=501 Len=110 TSval=2233917211 TSecr=2374839 [TCP segment of a reassembled PDU]"
"409","5.303867650","192.168.1.102","192.168.1.118","TCP","176","8009 → 40160 [PSH, ACK] Seq=111 Ack=221 Win=344 Len=110 TSval=2375340 TSecr=2233917211 [TCP segment of a reassembled PDU]"
"410","5.303992075","192.168.1.118","192.168.1.102","TCP","66","40160 → 8009 [ACK] Seq=221 Ack=221 Win=501 Len=0 TSval=2233917217 TSecr=2375340"
"411","7.970537175","192.168.1.118","172.253.63.188","TLSv1.2","99","Application Data"
"412","7.994192800","172.253.63.188","192.168.1.118","TCP","66","5228 → 36560 [ACK] Seq=1 Ack=34 Win=248 Len=0 TSval=4174276717 TSecr=2117385724"
"413","8.006205650","172.253.63.188","192.168.1.118","TLSv1.2","99","Application Data"
"414","8.007181700","192.168.1.118","172.253.63.188","TLSv1.2","109","Application Data"
"415","8.038970450","172.253.63.188","192.168.1.118","TCP","66","5228 → 36560 [ACK] Seq=34 Ack=77 Win=248 Len=0 TSval=4174276761 TSecr=2117385761"
"416","8.195003725","192.168.1.104","255.255.255.255","UDP","217","49154 → 6666 Len=175"
