frame.number,_ws.col.Time,_ws.col.Source,_ws.col.Destination,_ws.col.Protocol,frame.len,_ws.col.Info
"1","0.000000000","192.168.1.118","104.18.211.105","TCP","54","46938 → 443 [ACK] Seq=1 Ack=1 Win=501 Len=0"
"2","0.000532625","192.168.1.118","104.18.211.105","TCP","54","46942 → 443 [ACK] Seq=1 Ack=1 Win=2 Len=0"
"3","0.002608988","192.168.1.118","104.18.211.105","TLSv1.2","389","Application Data"
"4","0.002823625","192.168.1.118","104.18.211.105","TCP","54","46940 → 443 [ACK] Seq=1 Ack=1 Win=323 Len=0"
"5","0.002970938","192.168.1.118","104.18.211.105","TCP","54","46936 → 443 [ACK] Seq=1 Ack=1 Win=99 Len=0"
"6","0.005673550","209.18.47.62","192.168.1.118","DNS","204","Standard query response 0x95db AAAA p.typekit.net CNAME p.typekit.net-v3.edgekey.net CNAME e6653.dscf.akamaiedge.net AAAA 2600:141b:5000:598::19fd AAAA 2600:141b:5000:596::19fd"
"7","0.020377550","104.18.211.105","192.168.1.118","SSL","1514","Continuation Data"
"8","0.023288088","192.168.1.118","173.223.237.94","TCP","74","36832 → 443 [SYN] Seq=0 Win=64240 Len=0 MSS=1460 SACK_PERM=1 TSval=1604849038 TSecr=0 WS=128"
"9","0.023615338","192.168.1.118","104.18.211.105","TCP","54","[TCP Window Update] 46942 → 443 [ACK] Seq=1 Ack=1 Win=179 Len=0"
"10","0.025804800","104.18.211.105","192.168.1.118","SSL","4434","Continuation Data"
"11","0.025904125","192.168.1.118","104.18.211.105","TCP","54","46938 → 443 [ACK] Seq=1 Ack=5841 Win=592 Len=0"
"12","0.029963463","104.18.211.105","192.168.1.118","SSL","11614","Continuation Data"
"13","0.030065838","192.168.1.118","104.18.211.105","TCP","54","46938 → 443 [ACK] Seq=1 Ack=17401 Win=773 Len=0"
"14","0.030245425","104.18.211.105","192.168.1.118","SSL","11734","Continuation Data"
"15","0.030301163","192.168.1.118","104.18.211.105","TCP","54","46938 → 443 [ACK] Seq=1 Ack=29081 Win=955 Len=0"
"16","0.056494113","104.18.211.105","192.168.1.118","SSL","20494","Continuation Data"
"17","0.056660225","192.168.1.118","104.18.211.105","TCP","54","46938 → 443 [ACK] Seq=1 Ack=49521 Win=1275 Len=0"
"18","0.056784625","104.18.211.105","192.168.1.118","SSL","2974","Continuation Data"
"19","0.056849525","192.168.1.118","104.18.211.105","TCP","54","46938 → 443 [ACK] Seq=1 Ack=52441 Win=1320 Len=0"
"20","0.060098488","104.18.211.105","192.168.1.118","SSL","11742","Continuation Data"
"21","0.060216913","192.168.1.118","104.18.211.105","TCP","54","46938 → 443 [ACK] Seq=1 Ack=64129 Win=1503 Len=0"
"22","0.060401438","104.18.211.105","192.168.1.118","SSL","7354","Continuation Data"
"23","0.060551213","104.18.211.105","192.168.1.118","SSL","991","Continuation Data"
"24","0.060647063","104.18.211.105","192.168.1.118","TCP","1514","[TCP segment of a reassembled PDU]"
"25","0.081161138","192.168.1.118","104.18.211.105","TCP","54","46936 → 443 [ACK] Seq=1 Ack=8238 Win=35 Len=0"
"26","0.089972388","104.18.211.105","192.168.1.118","TLSv1.2","2852","Application Data"
"27","0.090097425","192.168.1.118","104.18.211.105","TCP","54","46914 → 443 [ACK] Seq=336 Ack=4259 Win=2040 Len=0"
"28","0.090199238","104.18.211.105","192.168.1.118","TLSv1.2","139","Application Data"
"29","0.090272938","173.223.237.94","192.168.1.118","TCP","74","443 → 36832 [SYN, ACK] Seq=0 Ack=1 Win=28960 Len=0 MSS=1460 SACK_PERM=1 TSval=2250659614 TSecr=1604849038 WS=128"
"30","0.090410363","192.168.1.118","173.223.237.94","TCP","66","36832 → 443 [ACK] Seq=1 Ack=1 Win=64256 Len=0 TSval=1604849105 TSecr=2250659614"
"31","0.090529250","104.18.211.105","192.168.1.118","SSL","2974","Continuation Data"
"32","0.090874313","104.18.211.105","192.168.1.118","SSL","7354","Continuation Data"
"33","0.090960188","104.18.211.105","192.168.1.118","SSL","512","Continuation Data"
"34","0.091100838","104.18.211.105","192.168.1.118","SSL","5894","Continuation Data"
"35","0.091183663","192.168.1.118","104.18.211.105","TCP","54","46938 → 443 [ACK] Seq=1 Ack=69969 Win=1594 Len=0"
"36","0.092716950","104.18.211.105","192.168.1.118","SSL","4434","Continuation Data"
"37","0.092859288","192.168.1.118","104.18.211.105","TCP","54","46938 → 443 [ACK] Seq=1 Ack=74349 Win=1663 Len=0"
"38","0.093868363","104.18.211.105","192.168.1.118","SSL","7346","Continuation Data"
"39","0.094013350","192.168.1.118","104.18.211.105","TCP","54","46938 → 443 [ACK] Seq=1 Ack=81641 Win=1777 Len=0"
"40","0.094256263","104.18.211.105","192.168.1.118","SSL","11734","Continuation Data"
"41","0.094344775","192.168.1.118","104.18.211.105","TCP","54","46938 → 443 [ACK] Seq=1 Ack=93321 Win=1959 Len=0"
"42","0.098385938","104.18.211.105","192.168.1.118","SSL","11734","Continuation Data"
"43","0.098526888","192.168.1.118","104.18.211.105","TCP","54","46938 → 443 [ACK] Seq=1 Ack=105001 Win=2142 Len=0"
"44","0.098829413","104.18.211.105","192.168.1.118","SSL","8814","Continuation Data"
"45","0.098917450","192.168.1.118","104.18.211.105","TCP","54","46938 → 443 [ACK] Seq=1 Ack=113761 Win=2279 Len=0"
"46","0.099035525","104.18.211.105","192.168.1.118","SSL","2974","Continuation Data"
"47","0.099107363","192.168.1.118","104.18.211.105","TCP","54","46938 → 443 [ACK] Seq=1 Ack=116681 Win=2324 Len=0"
"48","0.102066400","104.18.211.105","192.168.1.118","TCP","23414","443 → 46938 [ACK] Seq=116681 Ack=1 Win=67 Len=23360"
"49","0.102137700","192.168.1.118","104.18.211.105","TCP","54","46938 → 443 [ACK] Seq=1 Ack=140041 Win=2396 Len=0"
"50","0.106321850","104.18.211.105","192.168.1.118","SSL","2974","Continuation Data"
"51","0.106857438","104.18.211.105","192.168.1.118","SSL","2974","Continuation Data"
"52","0.106939313","104.18.211.105","192.168.1.118","SSL","17574","Continuation Data"
"53","0.120331813","104.18.211.105","192.168.1.118","SSL","14654","Continuation Data"
"54","0.120413688","104.18.211.105","192.168.1.118","SSL","4434","Continuation Data"
"55","0.130897088","192.168.1.118","104.18.211.105","TCP","54","46942 → 443 [ACK] Seq=1 Ack=10679 Win=96 Len=0"
"56","0.130976175","192.168.1.118","104.18.211.105","TCP","54","46914 → 443 [ACK] Seq=336 Ack=4344 Win=2040 Len=0"
"57","0.135176238","192.168.1.118","104.18.211.105","TCP","54","46938 → 443 [ACK] Seq=1 Ack=182381 Win=2066 Len=0"
"58","0.136318875","192.168.1.118","104.18.211.105","TCP","54","[TCP Window Update] 46942 → 443 [ACK] Seq=1 Ack=10679 Win=501 Len=0"
"59","0.136415575","192.168.1.118","104.18.211.105","TCP","54","[TCP Window Update] 46936 → 443 [ACK] Seq=1 Ack=8238 Win=259 Len=0"
"60","0.137765350","104.18.211.105","192.168.1.118","SSL","27794","Continuation Data"
"61","0.137967013","104.18.211.105","192.168.1.118","SSL","21078","Continuation Data"
"62","0.138056913","104.18.211.105","192.168.1.118","SSL","991","[TCP Spurious Retransmission] , Continuation Data"
"63","0.138139163","192.168.1.118","104.18.211.105","TCP","66","[TCP Dup ACK 25#1] 46936 → 443 [ACK] Seq=1 Ack=8238 Win=259 Len=0 SLE=7301 SRE=8238"
"64","0.152802425","192.168.1.118","173.223.237.94","TLSv1","583","Client Hello"
"65","0.153420500","192.168.1.118","104.18.211.105","TCP","54","46938 → 443 [ACK] Seq=1 Ack=231145 Win=1686 Len=0"
"66","0.155357538","192.168.1.118","104.18.211.105","TLSv1.2","324","Application Data"
"67","0.155494613","192.168.1.118","104.18.211.105","TLSv1.2","323","Application Data"
"68","0.179356588","173.223.237.94","192.168.1.118","TCP","66","443 → 36832 [ACK] Seq=1 Ack=518 Win=30080 Len=0 TSval=2250659735 TSecr=1604849168"
"69","0.181909813","173.223.237.94","192.168.1.118","TLSv1.2","1514","Server Hello"
"70","0.182040938","192.168.1.118","173.223.237.94","TCP","66","36832 → 443 [ACK] Seq=518 Ack=1449 Win=63104 Len=0 TSval=1604849197 TSecr=2250659736"
"71","0.183185725","173.223.237.94","192.168.1.118","TCP","2714","443 → 36832 [PSH, ACK] Seq=1449 Ack=518 Win=30080 Len=2648 TSval=2250659736 TSecr=1604849168 [TCP segment of a reassembled PDU]"
"72","0.183324538","192.168.1.118","173.223.237.94","TCP","66","36832 → 443 [ACK] Seq=518 Ack=4097 Win=60544 Len=0 TSval=1604849198 TSecr=2250659736"
"73","0.183424375","173.223.237.94","192.168.1.118","TLSv1.2","624","Certificate, Server Key Exchange, Server Hello Done"
"74","0.183499488","192.168.1.118","173.223.237.94","TCP","66","36832 → 443 [ACK] Seq=518 Ack=4655 Win=60032 Len=0 TSval=1604849199 TSecr=2250659738"
"75","0.199077100","192.168.1.118","173.223.237.94","TLSv1.2","192","Client Key Exchange, Change Cipher Spec, Encrypted Handshake Message"
"76","0.203288338","104.18.211.105","192.168.1.118","TCP","1514","[TCP segment of a reassembled PDU]"
"77","0.204849088","104.18.211.105","192.168.1.118","TLSv1.2","1721","Application Data"
"78","0.204965725","192.168.1.118","104.18.211.105","TCP","54","46940 → 443 [ACK] Seq=270 Ack=3128 Win=501 Len=0"
"79","0.205060125","104.18.211.105","192.168.1.118","TCP","1514","[TCP segment of a reassembled PDU]"
"80","0.205136513","192.168.1.118","104.18.211.105","TCP","54","46914 → 443 [ACK] Seq=606 Ack=5804 Win=2063 Len=0"
"81","0.208086900","104.18.211.105","192.168.1.118","TLSv1.2","2342","Application Data"
"82","0.208207400","192.168.1.118","104.18.211.105","TCP","54","46914 → 443 [ACK] Seq=606 Ack=8092 Win=2099 Len=0"
"83","0.227370575","192.168.1.118","104.18.211.105","TLSv1.2","324","Application Data"
"84","0.227499275","192.168.1.118","104.18.211.105","TLSv1.2","326","Application Data"
"85","0.227587775","192.168.1.118","104.18.211.105","TLSv1.2","325","Application Data"
"86","0.233756150","173.223.237.94","192.168.1.118","TLSv1.2","117","Change Cipher Spec, Encrypted Handshake Message"
"87","0.250673188","192.168.1.118","173.223.237.94","TLSv1.2","325","Application Data"
"88","0.264717350","104.18.211.105","192.168.1.118","TCP","1514","[TCP segment of a reassembled PDU]"
"89","0.269829288","104.18.211.105","192.168.1.118","TLSv1.2","2852","Application Data"
"90","0.269954688","192.168.1.118","104.18.211.105","TCP","54","46914 → 443 [ACK] Seq=876 Ack=12350 Win=2165 Len=0"
"91","0.270063388","104.18.211.105","192.168.1.118","TLSv1.2","456","Application Data"
"92","0.270144413","173.223.237.94","192.168.1.118","TLSv1.2","459","Application Data"
"93","0.271263950","104.18.211.105","192.168.1.118","TLSv1.2","4312","Application Data"
"94","0.271413863","192.168.1.118","104.18.211.105","TCP","54","46940 → 443 [ACK] Seq=541 Ack=7386 Win=568 Len=0"
"95","0.271511900","104.18.211.105","192.168.1.118","TLSv1.2","885","Application Data"
"96","0.292328738","104.18.211.105","192.168.1.118","TCP","1514","[TCP segment of a reassembled PDU]"
"97","0.292413825","192.168.1.118","104.18.211.105","TCP","54","46936 → 443 [ACK] Seq=273 Ack=9698 Win=524 Len=0"
"98","0.294293175","104.18.211.105","192.168.1.118","TLSv1.2","2852","Application Data"
"99","0.294367250","192.168.1.118","104.18.211.105","TCP","54","46936 → 443 [ACK] Seq=273 Ack=12496 Win=568 Len=0"
"100","0.294423563","104.18.211.105","192.168.1.118","TLSv1.2","924","Application Data"
"101","0.294450113","192.168.1.118","104.18.211.105","TCP","54","46936 → 443 [ACK] Seq=273 Ack=13366 Win=590 Len=0"
"102","0.298440013","192.168.1.118","104.18.211.105","TLSv1.2","323","Application Data"
"103","0.310985188","192.168.1.118","104.18.211.105","TCP","54","46914 → 443 [ACK] Seq=876 Ack=12752 Win=2188 Len=0"
"104","0.311732625","192.168.1.118","104.18.211.105","TCP","54","46940 → 443 [ACK] Seq=541 Ack=8217 Win=590 Len=0"
"105","0.324905300","192.168.1.118","173.223.237.94","TCP","66","36832 → 443 [ACK] Seq=903 Ack=5099 Win=64128 Len=0 TSval=1604849340 TSecr=2250659821"
"106","0.362760875","104.18.211.105","192.168.1.118","TCP","1514","[TCP segment of a reassembled PDU]"
"107","0.362908475","192.168.1.118","104.18.211.105","TCP","54","46942 → 443 [ACK] Seq=270 Ack=12139 Win=524 Len=0"
"108","0.364052863","104.18.211.105","192.168.1.118","TLSv1.2","2413","Application Data"
"109","0.364190313","192.168.1.118","104.18.211.105","TCP","54","46942 → 443 [ACK] Seq=270 Ack=14498 Win=561 Len=0"
"110","0.584369275","192.168.1.118","104.18.211.105","TLSv1.2","321","Application Data"
"111","0.588830263","192.168.1.118","104.18.211.105","TLSv1.2","321","Application Data"
"112","0.631401088","104.18.211.105","192.168.1.118","TCP","1514","[TCP segment of a reassembled PDU]"
"113","0.631537975","192.168.1.118","104.18.211.105","TCP","54","46936 → 443 [ACK] Seq=540 Ack=14826 Win=613 Len=0"
"114","0.640785488","104.18.211.105","192.168.1.118","TLSv1.2","571","Application Data"
"115","0.640910663","192.168.1.118","104.18.211.105","TCP","54","46936 → 443 [ACK] Seq=540 Ack=15343 Win=636 Len=0"
"116","0.644026188","104.18.211.105","192.168.1.118","TLSv1.2","2726","Application Data"
"117","0.644181250","192.168.1.118","104.18.211.105","TCP","54","46914 → 443 [ACK] Seq=1143 Ack=15424 Win=2230 Len=0"
"118","0.723965100","192.168.1.118","104.18.211.105","TLSv1.2","341","Application Data"
"119","0.803047813","104.18.211.105","192.168.1.118","TCP","1514","[TCP segment of a reassembled PDU]"
"120","0.803195200","192.168.1.118","104.18.211.105","TCP","54","46914 → 443 [ACK] Seq=1430 Ack=16884 Win=2252 Len=0"
"121","0.804056588","104.18.211.105","192.168.1.118","TLSv1.2","984","Application Data"
"122","0.804144450","192.168.1.118","104.18.211.105","TCP","54","46914 → 443 [ACK] Seq=1430 Ack=17814 Win=2275 Len=0"
"123","0.809305063","192.168.1.118","104.18.211.105","TLSv1.2","329","Application Data"
"124","0.846108263","104.18.211.105","192.168.1.118","TLSv1.2","1143","Application Data"
"125","0.879310350","IntelCor_b7:52:73","Cisco-Li_5b:1c:ce","ARP","60","Who has 192.168.1.1? Tell 192.168.1.118"
"126","0.883592588","Cisco-Li_5b:1c:ce","IntelCor_b7:52:73","ARP","42","192.168.1.1 is at 58:6d:8f:5b:1c:ce"
"127","0.886826388","192.168.1.118","104.18.211.105","TCP","54","46914 → 443 [ACK] Seq=1705 Ack=18903 Win=2298 Len=0"
"128","1.064541663","192.168.1.118","192.168.1.102","TCP","176","40160 → 8009 [PSH, ACK] Seq=1 Ack=1 Win=501 Len=110 TSval=2234072943 TSecr=2390406 [TCP segment of a reassembled PDU]"
"129","1.068496438","192.168.1.102","192.168.1.118","TCP","176","8009 → 40160 [PSH, ACK] Seq=1 Ack=111 Win=344 Len=110 TSval=2390913 TSecr=2234072943 [TCP segment of a reassembled PDU]"
"130","1.068706125","192.168.1.118","192.168.1.102","TCP","66","40160 → 8009 [ACK] Seq=111 Ack=111 Win=501 Len=0 TSval=2234072947 TSecr=2390913"
"131","1.214829750","192.168.1.104","255.255.255.255","UDP","217","49154 → 6666 Len=175"
"132","3.062575163","192.168.1.100","224.0.0.251","MDNS","225","Standard query response 0x0000 TXT, cache flush NSEC, cache flush cjqg._companion-link._tcp.local OPT"
"133","4.085975650","192.168.1.100","224.0.0.251","MDNS","225","Standard query response 0x0000 TXT, cache flush NSEC, cache flush cjqg._companion-link._tcp.local OPT"
"134","4.185018025","192.168.1.104","255.255.255.255","UDP","217","49154 → 6666 Len=175"
"135","5.625821475","192.168.1.100","224.0.0.251","MDNS","563","Standard query 0x0000 PTR _airport._tcp.local, "QM" question PTR _googlecast._tcp.local, "QM" question PTR _homekit._tcp.local, "QM" question PTR _raop._tcp.local, "QM" question PTR _airplay._tcp.local, "QM" question PTR _rdlink._tcp.local, "QM" question PTR _uscans._tcp.local, "QM" question PTR _uscan._tcp.local, "QM" question PTR _ippusb._tcp.local, "QM" question PTR _ipp._tcp.local, "QM" question PTR _scanner._tcp.local, "QM" question PTR _ipps._tcp.local, "QM" question PTR _printer._tcp.local, "QM" question PTR _pdl-datastream._tcp.local, "QM" question PTR _ptp._tcp.local, "QM" question PTR _afpovertcp._tcp.local, "QM" question PTR _smb._tcp.local, "QM" question PTR _rfb._tcp.local, "QM" question PTR _adisk._tcp.local, "QM" question PTR _companion-link._tcp.local, "QM" question PTR _apple-mobdev._tcp.local, "QM" question PTR 8ed307c3._sub._apple-mobdev2._tcp.local, "QM" question PTR _apple-pairable._tcp.local, "QM" question TXT Google-Home-Mini-2c3f16b2da5c4b6fd6cfbfba61c12490._googlecast._tcp.local, "QM" question PTR Google-Home-Mini-2c3f16b2da5c4b6fd6cfbfba61c12490._googlecast._tcp.local PTR cjqg._smb._tcp.local PTR cjqg._companion-link._tcp.local OPT"
"136","5.720012963","192.168.1.102","224.0.0.251","MDNS","183","Standard query response 0x0000 SRV, cache flush 0 0 8009 2c3f16b2-da5c-4b6f-d6cf-bfba61c12490.local"
"137","6.074367763","192.168.1.118","192.168.1.102","TCP","176","40160 → 8009 [PSH, ACK] Seq=111 Ack=111 Win=501 Len=110 TSval=2234077952 TSecr=2390913 [TCP segment of a reassembled PDU]"
"138","6.085270025","192.168.1.102","192.168.1.118","TCP","176","8009 → 40160 [PSH, ACK] Seq=111 Ack=221 Win=344 Len=110 TSval=2391415 TSecr=2234077952 [TCP segment of a reassembled PDU]"
"139","6.085436463","192.168.1.118","192.168.1.102","TCP","66","40160 → 8009 [ACK] Seq=221 Ack=221 Win=501 Len=0 TSval=2234077963 TSecr=2391415"
"140","6.129788838","192.168.1.100","224.0.0.251","MDNS","225","Standard query response 0x0000 TXT, cache flush NSEC, cache flush cjqg._companion-link._tcp.local OPT"
"141","7.154159050","192.168.1.104","255.255.255.255","UDP","217","49154 → 6666 Len=175"
