frame.number,_ws.col.Time,_ws.col.Source,_ws.col.Destination,_ws.col.Protocol,frame.len,_ws.col.Info
"1","0.000000000","136.147.56.1","192.168.1.118","SSL","195","Continuation Data"
"2","0.000100500","136.147.56.1","192.168.1.118","TCP","6694","[TCP segment of a reassembled PDU]"
"3","0.000131800","136.147.56.1","192.168.1.118","TCP","131","443 → 45224 [PSH, ACK] Seq=6758 Ack=1 Win=4926 Len=65 TSval=591053296 TSecr=771420635 [TCP segment of a reassembled PDU]"
"4","0.000458537","192.168.1.118","136.147.56.1","TCP","66","45224 → 443 [ACK] Seq=1 Ack=6823 Win=55186 Len=0 TSval=771420764 TSecr=591053294"
"5","0.005612950","192.168.1.118","136.147.56.1","TCP","74","45226 → 443 [SYN] Seq=0 Win=64240 Len=0 MSS=1460 SACK_PERM=1 TSval=771420769 TSecr=0 WS=128"
"6","0.059259187","136.147.56.1","192.168.1.118","TLSv1.2","1414","Application Data [TCP segment of a reassembled PDU]"
"7","0.067124200","136.147.56.1","192.168.1.118","TLSv1.2","9457","Application Data, Application Data, Application Data"
"8","0.081274400","192.168.1.118","136.147.56.1","TCP","66","45224 → 443 [ACK] Seq=1 Ack=17562 Win=49876 Len=0 TSval=771420844 TSecr=591053360"
"9","0.082544837","136.147.56.1","192.168.1.118","TCP","74","443 → 45226 [SYN, ACK] Seq=0 Ack=1 Win=4380 Len=0 MSS=1360 TSval=591053385 TSecr=771420769 SACK_PERM=1"
"10","0.082701312","192.168.1.118","136.147.56.1","TCP","66","45226 → 443 [ACK] Seq=1 Ack=1 Win=64240 Len=0 TSval=771420846 TSecr=591053385"
"11","0.082918075","192.168.1.118","209.18.47.62","DNS","77","Standard query 0x1dad A c1.sfdcstatic.com"
"12","0.083969162","192.168.1.118","209.18.47.62","DNS","77","Standard query 0x3567 A c1.sfdcstatic.com"
"13","0.084679725","192.168.1.118","209.18.47.62","DNS","77","Standard query 0x310a A c1.sfdcstatic.com"
"14","0.084837462","192.168.1.118","209.18.47.62","DNS","77","Standard query 0x419b A c1.sfdcstatic.com"
"15","0.085740850","192.168.1.118","209.18.47.62","DNS","77","Standard query 0xed2f A c1.sfdcstatic.com"
"16","0.099116212","192.168.1.118","136.147.56.1","TLSv1","583","Client Hello"
"17","0.109758450","209.18.47.62","192.168.1.118","DNS","168","Standard query response 0x419b A c1.sfdcstatic.com CNAME c.sfdcstatic.com.edgekey.net CNAME e4745.b.akamaiedge.net A 104.107.48.175"
"18","0.110087900","192.168.1.118","209.18.47.62","DNS","77","Standard query 0xcd12 AAAA c1.sfdcstatic.com"
"19","0.115724237","209.18.47.62","192.168.1.118","DNS","168","Standard query response 0x3567 A c1.sfdcstatic.com CNAME c.sfdcstatic.com.edgekey.net CNAME e4745.b.akamaiedge.net A 104.107.48.175"
"20","0.115863087","209.18.47.62","192.168.1.118","DNS","168","Standard query response 0x310a A c1.sfdcstatic.com CNAME c.sfdcstatic.com.edgekey.net CNAME e4745.b.akamaiedge.net A 104.107.48.175"
"21","0.116534225","209.18.47.62","192.168.1.118","DNS","168","Standard query response 0x1dad A c1.sfdcstatic.com CNAME c.sfdcstatic.com.edgekey.net CNAME e4745.b.akamaiedge.net A 104.107.48.175"
"22","0.116673837","209.18.47.62","192.168.1.118","DNS","168","Standard query response 0xed2f A c1.sfdcstatic.com CNAME c.sfdcstatic.com.edgekey.net CNAME e4745.b.akamaiedge.net A 104.107.48.175"
"23","0.118418887","192.168.1.118","209.18.47.62","DNS","77","Standard query 0xd941 AAAA c1.sfdcstatic.com"
"24","0.119185112","192.168.1.118","209.18.47.62","DNS","77","Standard query 0x01aa AAAA c1.sfdcstatic.com"
"25","0.119448925","192.168.1.118","209.18.47.62","DNS","77","Standard query 0xe5ef AAAA c1.sfdcstatic.com"
"26","0.119731650","192.168.1.118","209.18.47.62","DNS","77","Standard query 0x8d3d AAAA c1.sfdcstatic.com"
"27","0.136376825","209.18.47.62","192.168.1.118","DNS","210","Standard query response 0xcd12 AAAA c1.sfdcstatic.com CNAME c.sfdcstatic.com.edgekey.net CNAME e4745.b.akamaiedge.net SOA n0b.akamaiedge.net"
"28","0.136926712","192.168.1.118","104.107.48.175","TCP","74","44244 → 443 [SYN] Seq=0 Win=64240 Len=0 MSS=1460 SACK_PERM=1 TSval=1023883852 TSecr=0 WS=128"
"29","0.137036387","192.168.1.118","104.107.48.175","TCP","74","44246 → 443 [SYN] Seq=0 Win=64240 Len=0 MSS=1460 SACK_PERM=1 TSval=1023883852 TSecr=0 WS=128"
"30","0.137106887","192.168.1.118","104.107.48.175","TCP","74","44248 → 443 [SYN] Seq=0 Win=64240 Len=0 MSS=1460 SACK_PERM=1 TSval=1023883852 TSecr=0 WS=128"
"31","0.138064475","192.168.1.118","104.107.48.175","TCP","74","44250 → 443 [SYN] Seq=0 Win=64240 Len=0 MSS=1460 SACK_PERM=1 TSval=1023883853 TSecr=0 WS=128"
"32","0.138165437","192.168.1.118","104.107.48.175","TCP","74","44252 → 443 [SYN] Seq=0 Win=64240 Len=0 MSS=1460 SACK_PERM=1 TSval=1023883853 TSecr=0 WS=128"
"33","0.144094962","136.147.56.1","192.168.1.118","TCP","1414","443 → 45224 [ACK] Seq=17562 Ack=1 Win=4926 Len=1348 TSval=591053445 TSecr=771420844 [TCP segment of a reassembled PDU]"
"34","0.145735412","136.147.56.1","192.168.1.118","TCP","2762","443 → 45224 [ACK] Seq=18910 Ack=1 Win=4926 Len=2696 TSval=591053445 TSecr=771420844 [TCP segment of a reassembled PDU]"
"35","0.145816412","192.168.1.118","136.147.56.1","TCP","66","45224 → 443 [ACK] Seq=1 Ack=21606 Win=60660 Len=0 TSval=771420909 TSecr=591053445"
"36","0.148867825","136.147.56.1","192.168.1.118","TLSv1.2","1196","Application Data"
"37","0.148942862","209.18.47.62","192.168.1.118","DNS","210","Standard query response 0xd941 AAAA c1.sfdcstatic.com CNAME c.sfdcstatic.com.edgekey.net CNAME e4745.b.akamaiedge.net SOA n0b.akamaiedge.net"
"38","0.149626662","209.18.47.62","192.168.1.118","DNS","210","Standard query response 0x8d3d AAAA c1.sfdcstatic.com CNAME c.sfdcstatic.com.edgekey.net CNAME e4745.b.akamaiedge.net SOA n0b.akamaiedge.net"
"39","0.149668325","209.18.47.62","192.168.1.118","DNS","210","Standard query response 0x01aa AAAA c1.sfdcstatic.com CNAME c.sfdcstatic.com.edgekey.net CNAME e4745.b.akamaiedge.net SOA n0b.akamaiedge.net"
"40","0.151359012","209.18.47.62","192.168.1.118","DNS","210","Standard query response 0xe5ef AAAA c1.sfdcstatic.com CNAME c.sfdcstatic.com.edgekey.net CNAME e4745.b.akamaiedge.net SOA n0b.akamaiedge.net"
"41","0.163411550","104.107.48.175","192.168.1.118","TCP","74","443 → 44244 [SYN, ACK] Seq=0 Ack=1 Win=28960 Len=0 MSS=1460 SACK_PERM=1 TSval=887887509 TSecr=1023883852 WS=128"
"42","0.163525850","192.168.1.118","104.107.48.175","TCP","66","44244 → 443 [ACK] Seq=1 Ack=1 Win=64256 Len=0 TSval=1023883879 TSecr=887887509"
"43","0.170112787","136.147.56.1","192.168.1.118","TCP","66","443 → 45226 [ACK] Seq=1 Ack=518 Win=4597 Len=0 TSval=591053465 TSecr=771420862"
"44","0.170211150","104.107.48.175","192.168.1.118","TCP","74","443 → 44248 [SYN, ACK] Seq=0 Ack=1 Win=28960 Len=0 MSS=1460 SACK_PERM=1 TSval=887887519 TSecr=1023883852 WS=128"
"45","0.170325950","192.168.1.118","104.107.48.175","TCP","66","44248 → 443 [ACK] Seq=1 Ack=1 Win=64256 Len=0 TSval=1023883885 TSecr=887887519"
"46","0.170404337","104.107.48.175","192.168.1.118","TCP","74","443 → 44250 [SYN, ACK] Seq=0 Ack=1 Win=28960 Len=0 MSS=1460 SACK_PERM=1 TSval=887887519 TSecr=1023883853 WS=128"
"47","0.170488537","192.168.1.118","104.107.48.175","TCP","66","44250 → 443 [ACK] Seq=1 Ack=1 Win=64256 Len=0 TSval=1023883886 TSecr=887887519"
"48","0.170545637","104.107.48.175","192.168.1.118","TCP","74","443 → 44246 [SYN, ACK] Seq=0 Ack=1 Win=28960 Len=0 MSS=1460 SACK_PERM=1 TSval=887887519 TSecr=1023883852 WS=128"
"49","0.170647000","192.168.1.118","104.107.48.175","TCP","66","44246 → 443 [ACK] Seq=1 Ack=1 Win=64256 Len=0 TSval=1023883886 TSecr=887887519"
"50","0.170701650","104.107.48.175","192.168.1.118","TCP","74","443 → 44252 [SYN, ACK] Seq=0 Ack=1 Win=28960 Len=0 MSS=1460 SACK_PERM=1 TSval=887887519 TSecr=1023883853 WS=128"
"51","0.170780862","192.168.1.118","104.107.48.175","TCP","66","44252 → 443 [ACK] Seq=1 Ack=1 Win=64256 Len=0 TSval=1023883886 TSecr=887887519"
"52","0.170877387","136.147.56.1","192.168.1.118","TLSv1.2","4110","Server Hello"
"53","0.170938437","192.168.1.118","136.147.56.1","TCP","66","45226 → 443 [ACK] Seq=518 Ack=4045 Win=60196 Len=0 TSval=771420934 TSecr=591053467"
"54","0.184076737","192.168.1.118","104.107.48.175","TLSv1","583","Client Hello"
"55","0.189718212","192.168.1.118","136.147.56.1","TCP","66","45224 → 443 [ACK] Seq=1 Ack=22736 Win=63356 Len=0 TSval=771420953 TSecr=591053445"
"56","0.200345012","192.168.1.118","104.107.48.175","TLSv1","583","Client Hello"
"57","0.205955337","104.107.48.175","192.168.1.118","TCP","66","443 → 44244 [ACK] Seq=1 Ack=518 Win=30080 Len=0 TSval=887887559 TSecr=1023883899"
"58","0.208915800","104.107.48.175","192.168.1.118","TLSv1.2","1514","Server Hello"
"59","0.209046100","192.168.1.118","104.107.48.175","TCP","66","44244 → 443 [ACK] Seq=518 Ack=1449 Win=63104 Len=0 TSval=1023883924 TSecr=887887561"
"60","0.216617012","192.168.1.118","104.107.48.175","TLSv1","583","Client Hello"
"61","0.216773725","104.107.48.175","192.168.1.118","TLSv1.2","1891","Certificate, Server Key Exchange, Server Hello Done"
"62","0.216915150","192.168.1.118","104.107.48.175","TCP","66","44244 → 443 [ACK] Seq=518 Ack=3274 Win=61312 Len=0 TSval=1023883932 TSecr=887887561"
"63","0.226317587","104.107.48.175","192.168.1.118","TCP","66","443 → 44246 [ACK] Seq=1 Ack=518 Win=30080 Len=0 TSval=887887575 TSecr=1023883915"
"64","0.226492050","104.107.48.175","192.168.1.118","TLSv1.2","2962","Server Hello"
"65","0.226623100","192.168.1.118","104.107.48.175","TCP","66","44246 → 443 [ACK] Seq=518 Ack=2897 Win=61440 Len=0 TSval=1023883942 TSecr=887887576"
"66","0.226686925","104.107.48.175","192.168.1.118","TLSv1.2","443","Certificate, Server Key Exchange, Server Hello Done"
"67","0.226758850","192.168.1.118","104.107.48.175","TCP","66","44246 → 443 [ACK] Seq=518 Ack=3274 Win=61184 Len=0 TSval=1023883942 TSecr=887887577"
"68","0.232997137","192.168.1.118","104.107.48.175","TLSv1","583","Client Hello"
"69","0.239694950","192.168.1.104","255.255.255.255","UDP","217","49154 → 6666 Len=175"
"70","0.248692537","136.147.56.1","192.168.1.118","TLSv1.2","1108","Certificate, Server Key Exchange, Server Hello Done"
"71","0.248816737","192.168.1.118","136.147.56.1","TCP","66","45226 → 443 [ACK] Seq=518 Ack=5087 Win=62008 Len=0 TSval=771421012 TSecr=591053550"
"72","0.249868612","192.168.1.118","104.107.48.175","TLSv1","583","Client Hello"
"73","0.251874362","192.168.1.118","104.107.48.175","TLSv1.2","192","Client Key Exchange, Change Cipher Spec, Encrypted Handshake Message"
"74","0.253780587","192.168.1.118","104.107.48.175","TLSv1.2","192","Client Key Exchange, Change Cipher Spec, Encrypted Handshake Message"
"75","0.257447375","192.168.1.118","136.147.56.1","TLSv1.2","192","Client Key Exchange, Change Cipher Spec, Encrypted Handshake Message"
"76","0.269605487","104.107.48.175","192.168.1.118","TCP","66","443 → 44248 [ACK] Seq=1 Ack=518 Win=30080 Len=0 TSval=887887620 TSecr=1023883932"
"77","0.271494400","104.107.48.175","192.168.1.118","TLSv1.2","3339","Server Hello, Certificate, Server Key Exchange, Server Hello Done"
"78","0.271668112","192.168.1.118","104.107.48.175","TCP","66","44248 → 443 [ACK] Seq=518 Ack=3274 Win=61056 Len=0 TSval=1023883987 TSecr=887887622"
"79","0.276402250","104.107.48.175","192.168.1.118","TCP","66","443 → 44250 [ACK] Seq=1 Ack=518 Win=30080 Len=0 TSval=887887630 TSecr=1023883948"
"80","0.278168912","192.168.1.118","104.107.48.175","TLSv1.2","192","Client Key Exchange, Change Cipher Spec, Encrypted Handshake Message"
"81","0.286796062","104.107.48.175","192.168.1.118","TCP","66","443 → 44252 [ACK] Seq=1 Ack=518 Win=30080 Len=0 TSval=887887630 TSecr=1023883965"
"82","0.286888387","104.107.48.175","192.168.1.118","TLSv1.2","117","Change Cipher Spec, Encrypted Handshake Message"
"83","0.286967350","104.107.48.175","192.168.1.118","TLSv1.2","3339","Server Hello, Certificate, Server Key Exchange, Server Hello Done"
"84","0.287027875","192.168.1.118","104.107.48.175","TCP","66","44250 → 443 [ACK] Seq=518 Ack=3274 Win=61056 Len=0 TSval=1023884002 TSecr=887887633"
"85","0.287116037","104.107.48.175","192.168.1.118","TLSv1.2","3339","Server Hello, Certificate, Server Key Exchange, Server Hello Done"
"86","0.287160575","192.168.1.118","104.107.48.175","TCP","66","44252 → 443 [ACK] Seq=518 Ack=3274 Win=61056 Len=0 TSval=1023884002 TSecr=887887634"
"87","0.289423687","192.168.1.118","104.107.48.175","TLSv1.2","192","Client Key Exchange, Change Cipher Spec, Encrypted Handshake Message"
"88","0.291347425","192.168.1.118","104.107.48.175","TLSv1.2","192","Client Key Exchange, Change Cipher Spec, Encrypted Handshake Message"
"89","0.291663300","192.168.1.118","104.107.48.175","TLSv1.2","296","Application Data"
"90","0.293502412","104.107.48.175","192.168.1.118","TLSv1.2","117","Change Cipher Spec, Encrypted Handshake Message"
"91","0.294155237","192.168.1.118","104.107.48.175","TLSv1.2","309","Application Data"
"92","0.301977950","104.107.48.175","192.168.1.118","TLSv1.2","117","Change Cipher Spec, Encrypted Handshake Message"
"93","0.302412650","192.168.1.118","104.107.48.175","TLSv1.2","305","Application Data"
"94","0.311812537","104.107.48.175","192.168.1.118","TLSv1.2","117","Change Cipher Spec, Encrypted Handshake Message"
"95","0.312407137","192.168.1.118","104.107.48.175","TLSv1.2","320","Application Data"
"96","0.322692500","104.107.48.175","192.168.1.118","TCP","1514","[TCP segment of a reassembled PDU]"
"97","0.325537225","104.107.48.175","192.168.1.118","TLSv1.2","2188","Application Data"
"98","0.325672050","104.107.48.175","192.168.1.118","TLSv1.2","117","Change Cipher Spec, Encrypted Handshake Message"
"99","0.325884662","104.107.48.175","192.168.1.118","TCP","10202","[TCP segment of a reassembled PDU]"
"100","0.326173250","192.168.1.118","104.107.48.175","TLSv1.2","336","Application Data"
"101","0.326263750","192.168.1.118","104.107.48.175","TCP","66","44244 → 443 [ACK] Seq=887 Ack=13461 Win=54016 Len=0 TSval=1023884041 TSecr=887887667"
"102","0.326328287","192.168.1.118","104.107.48.175","TCP","66","44246 → 443 [ACK] Seq=874 Ack=6895 Win=64128 Len=0 TSval=1023884041 TSecr=887887666"
"103","0.327019900","104.107.48.175","192.168.1.118","TLSv1.2","7306","Application Data [TCP segment of a reassembled PDU]"
"104","0.327138025","192.168.1.118","104.107.48.175","TCP","66","44244 → 443 [ACK] Seq=887 Ack=20701 Win=54912 Len=0 TSval=1023884042 TSecr=887887667"
"105","0.327208975","104.107.48.175","192.168.1.118","TCP","1514","443 → 44244 [ACK] Seq=20701 Ack=887 Win=31104 Len=1448 TSval=887887668 TSecr=1023884009 [TCP segment of a reassembled PDU]"
"106","0.329817587","192.168.1.118","104.107.48.175","TLSv1.2","307","Application Data"
"107","0.330124700","104.107.48.175","192.168.1.118","TCP","4410","443 → 44244 [ACK] Seq=22149 Ack=887 Win=31104 Len=4344 TSval=887887668 TSecr=1023884009 [TCP segment of a reassembled PDU]"
"108","0.330242887","192.168.1.118","104.107.48.175","TCP","66","44244 → 443 [ACK] Seq=887 Ack=26493 Win=59008 Len=0 TSval=1023884045 TSecr=887887668"
"109","0.330303637","104.107.48.175","192.168.1.118","TCP","2962","[TCP segment of a reassembled PDU]"
"110","0.330588312","104.107.48.175","192.168.1.118","TLSv1.2","3253","Application Data"
"111","0.346198212","136.147.56.1","192.168.1.118","TCP","66","443 → 45226 [ACK] Seq=5087 Ack=644 Win=4723 Len=0 TSval=591053630 TSecr=771421021"
"112","0.346320287","136.147.56.1","192.168.1.118","TLSv1.2","72","Change Cipher Spec"
"113","0.346708562","136.147.56.1","192.168.1.118","TLSv1.2","111","Encrypted Handshake Message"
"114","0.346791662","104.107.48.175","192.168.1.118","TCP","1514","[TCP segment of a reassembled PDU]"
"115","0.348008875","104.107.48.175","192.168.1.118","TCP","2962","443 → 44252 [ACK] Seq=4773 Ack=898 Win=31104 Len=2896 TSval=887887696 TSecr=1023884027 [TCP segment of a reassembled PDU]"
"116","0.350133225","104.107.48.175","192.168.1.118","TCP","2962","443 → 44252 [ACK] Seq=7669 Ack=898 Win=31104 Len=2896 TSval=887887696 TSecr=1023884027 [TCP segment of a reassembled PDU]"
"117","0.352927525","104.107.48.175","192.168.1.118","TLSv1.2","1305","Application Data"
"118","0.353977175","104.107.48.175","192.168.1.118","TCP","2962","443 → 44244 [ACK] Seq=26493 Ack=887 Win=31104 Len=2896 TSval=887887706 TSecr=1023884042 [TCP segment of a reassembled PDU]"
"119","0.355015887","104.107.48.175","192.168.1.118","TCP","2962","443 → 44244 [ACK] Seq=29389 Ack=887 Win=31104 Len=2896 TSval=887887706 TSecr=1023884042 [TCP segment of a reassembled PDU]"
"120","0.355756762","104.107.48.175","192.168.1.118","TCP","2962","443 → 44244 [ACK] Seq=32285 Ack=887 Win=31104 Len=2896 TSval=887887706 TSecr=1023884042 [TCP segment of a reassembled PDU]"
"121","0.356753800","192.168.1.118","136.147.56.1","TCP","66","45226 → 443 [ACK] Seq=644 Ack=5138 Win=63356 Len=0 TSval=771421120 TSecr=591053631"
"122","0.357089025","192.168.1.118","136.147.56.1","TLSv1.2","307","Application Data"
"123","0.357151500","192.168.1.118","104.107.48.175","TCP","66","44252 → 443 [ACK] Seq=898 Ack=11804 Win=55680 Len=0 TSval=1023884072 TSecr=887887696"
"124","0.357558750","104.107.48.175","192.168.1.118","TLSv1.2","2962","Application Data, Application Data"
"125","0.357903137","192.168.1.118","104.107.48.175","TCP","66","44244 → 443 [ACK] Seq=887 Ack=38077 Win=64128 Len=0 TSval=1023884073 TSecr=887887706"
"126","0.359254787","192.168.1.118","104.107.48.175","TCP","66","44248 → 443 [ACK] Seq=883 Ack=9408 Win=58112 Len=0 TSval=1023884074 TSecr=887887678"
"127","0.360334862","192.168.1.118","209.18.47.62","DNS","80","Standard query 0x3917 A fonts.googleapis.com"
"128","0.361754187","104.107.48.175","192.168.1.118","TCP","2962","443 → 44244 [ACK] Seq=38077 Ack=887 Win=31104 Len=2896 TSval=887887706 TSecr=1023884042 [TCP segment of a reassembled PDU]"
"129","0.361841737","192.168.1.118","104.107.48.175","TCP","66","44244 → 443 [ACK] Seq=887 Ack=40973 Win=69888 Len=0 TSval=1023884077 TSecr=887887706"
"130","0.367383425","104.107.48.175","192.168.1.118","TLSv1.2","671","Application Data"
"131","0.367610337","104.107.48.175","192.168.1.118","TCP","11650","443 → 44244 [ACK] Seq=40973 Ack=887 Win=31104 Len=11584 TSval=887887706 TSecr=1023884042 [TCP segment of a reassembled PDU]"
"132","0.367696350","192.168.1.118","104.107.48.175","TCP","66","44244 → 443 [ACK] Seq=887 Ack=52557 Win=93056 Len=0 TSval=1023884083 TSecr=887887706"
"133","0.367798175","104.107.48.175","192.168.1.118","TLSv1.2","2962","Application Data [TCP segment of a reassembled PDU]"
"134","0.367861250","192.168.1.118","104.107.48.175","TCP","66","44244 → 443 [ACK] Seq=887 Ack=55453 Win=98944 Len=0 TSval=1023884083 TSecr=887887708"
"135","0.367941362","104.107.48.175","192.168.1.118","TCP","2962","443 → 44244 [ACK] Seq=55453 Ack=887 Win=31104 Len=2896 TSval=887887709 TSecr=1023884045 [TCP segment of a reassembled PDU]"
"136","0.367995887","192.168.1.118","104.107.48.175","TCP","66","44244 → 443 [ACK] Seq=887 Ack=58349 Win=104704 Len=0 TSval=1023884083 TSecr=887887709"
"137","0.368033000","104.107.48.175","192.168.1.118","TCP","1514","443 → 44244 [ACK] Seq=58349 Ack=887 Win=31104 Len=1448 TSval=887887711 TSecr=1023884045 [TCP segment of a reassembled PDU]"
"138","0.368216687","104.107.48.175","192.168.1.118","TCP","1514","443 → 44244 [ACK] Seq=59797 Ack=887 Win=31104 Len=1448 TSval=887887711 TSecr=1023884045 [TCP segment of a reassembled PDU]"
"139","0.368271387","192.168.1.118","104.107.48.175","TCP","66","44244 → 443 [ACK] Seq=887 Ack=61245 Win=110464 Len=0 TSval=1023884083 TSecr=887887711"
"140","0.368314725","104.107.48.175","192.168.1.118","TCP","1514","443 → 44244 [ACK] Seq=61245 Ack=887 Win=31104 Len=1448 TSval=887887712 TSecr=1023884045 [TCP segment of a reassembled PDU]"
"141","0.374202425","104.107.48.175","192.168.1.118","TCP","1514","443 → 44244 [ACK] Seq=62693 Ack=887 Win=31104 Len=1448 TSval=887887712 TSecr=1023884045 [TCP segment of a reassembled PDU]"
"142","0.374305212","192.168.1.118","104.107.48.175","TCP","66","44244 → 443 [ACK] Seq=887 Ack=64141 Win=116224 Len=0 TSval=1023884089 TSecr=887887712"
"143","0.374413000","104.107.48.175","192.168.1.118","TLSv1.2","2962","Application Data [TCP segment of a reassembled PDU]"
"144","0.374477112","192.168.1.118","104.107.48.175","TCP","66","44244 → 443 [ACK] Seq=887 Ack=67037 Win=122112 Len=0 TSval=1023884090 TSecr=887887714"
"145","0.374631600","104.107.48.175","192.168.1.118","TCP","5858","443 → 44244 [ACK] Seq=67037 Ack=887 Win=31104 Len=5792 TSval=887887716 TSecr=1023884045 [TCP segment of a reassembled PDU]"
"146","0.374694100","192.168.1.118","104.107.48.175","TCP","66","44244 → 443 [ACK] Seq=887 Ack=72829 Win=133632 Len=0 TSval=1023884090 TSecr=887887716"
"147","0.382256287","104.107.48.175","192.168.1.118","TCP","1514","443 → 44244 [ACK] Seq=72829 Ack=887 Win=31104 Len=1448 TSval=887887734 TSecr=1023884073 [TCP segment of a reassembled PDU]"
"148","0.387367375","104.107.48.175","192.168.1.118","TCP","7306","443 → 44244 [ACK] Seq=74277 Ack=887 Win=31104 Len=7240 TSval=887887734 TSecr=1023884073 [TCP segment of a reassembled PDU]"
"149","0.387479650","192.168.1.118","104.107.48.175","TCP","66","44244 → 443 [ACK] Seq=887 Ack=81517 Win=151040 Len=0 TSval=1023884103 TSecr=887887734"
"150","0.387695512","104.107.48.175","192.168.1.118","TLSv1.2","11650","Application Data [TCP segment of a reassembled PDU]"
"151","0.387756050","192.168.1.118","104.107.48.175","TCP","66","44244 → 443 [ACK] Seq=887 Ack=93101 Win=174208 Len=0 TSval=1023884103 TSecr=887887735"
"152","0.387948462","104.107.48.175","192.168.1.118","TCP","4410","443 → 44244 [ACK] Seq=93101 Ack=887 Win=31104 Len=4344 TSval=887887737 TSecr=1023884083 [TCP segment of a reassembled PDU]"
"153","0.388013537","192.168.1.118","104.107.48.175","TCP","66","44244 → 443 [ACK] Seq=887 Ack=97445 Win=182912 Len=0 TSval=1023884103 TSecr=887887737"
"154","0.390658787","104.107.48.175","192.168.1.118","TLSv1.2","4410","Application Data [TCP segment of a reassembled PDU]"
"155","0.390782575","192.168.1.118","104.107.48.175","TCP","66","44244 → 443 [ACK] Seq=887 Ack=101789 Win=191616 Len=0 TSval=1023884106 TSecr=887887737"
"156","0.390928612","104.107.48.175","192.168.1.118","TCP","4410","443 → 44244 [ACK] Seq=101789 Ack=887 Win=31104 Len=4344 TSval=887887738 TSecr=1023884083 [TCP segment of a reassembled PDU]"
"157","0.391001575","192.168.1.118","104.107.48.175","TCP","66","44244 → 443 [ACK] Seq=887 Ack=106133 Win=196864 Len=0 TSval=1023884106 TSecr=887887738"
"158","0.391094175","104.107.48.175","192.168.1.118","TLSv1.2","4410","Application Data [TCP segment of a reassembled PDU]"
"159","0.391174587","104.107.48.175","192.168.1.118","TCP","1514","443 → 44244 [ACK] Seq=110477 Ack=887 Win=31104 Len=1448 TSval=887887741 TSecr=1023884083 [TCP segment of a reassembled PDU]"
"160","0.393420475","104.107.48.175","192.168.1.118","TCP","2962","443 → 44244 [ACK] Seq=111925 Ack=887 Win=31104 Len=2896 TSval=887887741 TSecr=1023884083 [TCP segment of a reassembled PDU]"
"161","0.393601862","104.107.48.175","192.168.1.118","TCP","4410","443 → 44244 [ACK] Seq=114821 Ack=887 Win=31104 Len=4344 TSval=887887742 TSecr=1023884083 [TCP segment of a reassembled PDU]"
"162","0.393722887","104.107.48.175","192.168.1.118","TCP","4410","443 → 44244 [ACK] Seq=119165 Ack=887 Win=31104 Len=4344 TSval=887887743 TSecr=1023884083 [TCP segment of a reassembled PDU]"
"163","0.393760737","104.107.48.175","192.168.1.118","TCP","1514","[TCP segment of a reassembled PDU]"
"164","0.397470612","104.107.48.175","192.168.1.118","TLSv1.2","1243","Application Data"
"165","0.397689512","209.18.47.62","192.168.1.118","DNS","96","Standard query response 0x3917 A fonts.googleapis.com A 172.217.9.234"
"166","0.397799800","104.107.48.175","192.168.1.118","TLSv1.2","4410","Application Data [TCP segment of a reassembled PDU]"
"167","0.397918837","104.107.48.175","192.168.1.118","TLSv1.2","4410","Application Data [TCP segment of a reassembled PDU]"
"168","0.398014487","104.107.48.175","192.168.1.118","TCP","4410","443 → 44244 [ACK] Seq=132197 Ack=887 Win=31104 Len=4344 TSval=887887745 TSecr=1023884083 [TCP segment of a reassembled PDU]"
"169","0.398237650","192.168.1.118","209.18.47.62","DNS","80","Standard query 0x0914 AAAA fonts.googleapis.com"
"170","0.400281075","104.107.48.175","192.168.1.118","TCP","4410","443 → 44244 [ACK] Seq=136541 Ack=887 Win=31104 Len=4344 TSval=887887746 TSecr=1023884090 [TCP segment of a reassembled PDU]"
"171","0.400443412","104.107.48.175","192.168.1.118","TLSv1.2","9379","Application Data, Application Data"
"172","0.407932250","192.168.1.118","104.107.48.175","TCP","66","44246 → 443 [ACK] Seq=1115 Ack=7500 Win=63616 Len=0 TSval=1023884123 TSecr=887887707"
"173","0.418167475","192.168.1.118","104.107.48.175","TCP","66","44250 → 443 [ACK] Seq=914 Ack=5950 Win=61568 Len=0 TSval=1023884133 TSecr=887887745"
"174","0.418486037","192.168.1.118","104.107.48.175","TCP","66","44244 → 443 [ACK] Seq=887 Ack=150198 Win=152832 Len=0 TSval=1023884134 TSecr=887887739"
"175","0.419806375","192.168.1.118","104.107.48.175","TLSv1.2","305","Application Data"
"176","0.419916562","192.168.1.118","104.107.48.175","TLSv1.2","293","Application Data"
"177","0.422797750","209.18.47.62","192.168.1.118","DNS","108","Standard query response 0x0914 AAAA fonts.googleapis.com AAAA 2607:f8b0:4006:801::200a"
"178","0.423790912","136.147.56.1","192.168.1.118","TCP","66","443 → 45226 [ACK] Seq=5138 Ack=885 Win=4964 Len=0 TSval=591053725 TSecr=771421120"
"179","0.443675350","104.107.48.175","192.168.1.118","TCP","1514","[TCP Spurious Retransmission] 443 → 44244 [ACK] Seq=106133 Ack=887 Win=31104 Len=1448 TSval=887887791 TSecr=1023884106[Reassembly error, protocol TCP: New fragment overlaps old data (retransmission?)]"
"180","0.443797900","192.168.1.118","104.107.48.175","TCP","78","[TCP Window Update] 44244 → 443 [ACK] Seq=887 Ack=150198 Win=192768 Len=0 TSval=1023884159 TSecr=887887739 SLE=106133 SRE=107581"
"181","0.445727912","104.107.48.175","192.168.1.118","TLSv1.2","2533","Application Data"
"182","0.455042450","104.107.48.175","192.168.1.118","TCP","1514","[TCP segment of a reassembled PDU]"
"183","0.460534487","104.107.48.175","192.168.1.118","TLSv1.2","3180","Application Data"
"184","0.485513450","192.168.1.118","172.217.9.234","TCP","74","36904 → 443 [SYN] Seq=0 Win=64240 Len=0 MSS=1460 SACK_PERM=1 TSval=73327421 TSecr=0 WS=128"
"185","0.485623675","192.168.1.118","104.107.48.175","TCP","66","44250 → 443 [ACK] Seq=1153 Ack=8417 Win=61696 Len=0 TSval=1023884201 TSecr=887887798"
"186","0.485797700","192.168.1.118","104.107.48.175","TCP","66","44252 → 443 [ACK] Seq=1125 Ack=16366 Win=59648 Len=0 TSval=1023884201 TSecr=887887808"
"187","0.486021612","192.168.1.118","104.107.48.175","TLSv1.2","317","Application Data"
"188","0.486121050","192.168.1.118","104.107.48.175","TLSv1.2","340","Application Data"
"189","0.511062137","172.217.9.234","192.168.1.118","TCP","74","443 → 36904 [SYN, ACK] Seq=0 Ack=1 Win=60192 Len=0 MSS=1380 SACK_PERM=1 TSval=1906808103 TSecr=73327421 WS=256"
"190","0.511154262","192.168.1.118","172.217.9.234","TCP","66","36904 → 443 [ACK] Seq=1 Ack=1 Win=64256 Len=0 TSval=73327446 TSecr=1906808103"
"191","0.515003562","104.107.48.175","192.168.1.118","TCP","5858","[TCP segment of a reassembled PDU]"
"192","0.515459025","104.107.48.175","192.168.1.118","TLSv1.2","871","Application Data"
"193","0.515513937","104.107.48.175","192.168.1.118","TLSv1.2","15994","Application Data [TCP segment of a reassembled PDU]"
"194","0.522579362","104.107.48.175","192.168.1.118","TCP","1514","443 → 44250 [ACK] Seq=30137 Ack=1404 Win=33280 Len=1448 TSval=887887862 TSecr=1023884201 [TCP segment of a reassembled PDU]"
"195","0.522625862","104.107.48.175","192.168.1.118","TCP","1514","443 → 44250 [ACK] Seq=31585 Ack=1404 Win=33280 Len=1448 TSval=887887863 TSecr=1023884201 [TCP segment of a reassembled PDU]"
"196","0.526707350","104.107.48.175","192.168.1.118","TCP","2962","443 → 44250 [ACK] Seq=33033 Ack=1404 Win=33280 Len=2896 TSval=887887863 TSecr=1023884201 [TCP segment of a reassembled PDU]"
"197","0.527817587","104.107.48.175","192.168.1.118","TLSv1.2","1020","Application Data"
"198","0.527876962","136.147.56.1","192.168.1.118","TLSv1.2","1313","Application Data"
"199","0.555664987","192.168.1.118","104.107.48.175","TCP","66","44252 → 443 [ACK] Seq=1399 Ack=17171 Win=63360 Len=0 TSval=1023884271 TSecr=887887862"
"200","0.555772700","192.168.1.118","104.107.48.175","TCP","66","44250 → 443 [ACK] Seq=1404 Ack=36883 Win=35712 Len=0 TSval=1023884271 TSecr=887887862"
"201","0.568845325","192.168.1.118","136.147.56.1","TCP","66","45226 → 443 [ACK] Seq=885 Ack=6385 Win=62109 Len=0 TSval=771421332 TSecr=591053821"
"202","0.586057450","192.168.1.118","172.217.9.234","TLSv1","583","Client Hello"
"203","0.611181525","172.217.9.234","192.168.1.118","TCP","66","443 → 36904 [ACK] Seq=1 Ack=518 Win=61440 Len=0 TSval=1906808207 TSecr=73327521"
"204","0.618818887","172.217.9.234","192.168.1.118","TLSv1.2","1484","Server Hello"
"205","0.618950450","192.168.1.118","172.217.9.234","TCP","66","36904 → 443 [ACK] Seq=518 Ack=1419 Win=63104 Len=0 TSval=73327554 TSecr=1906808213"
"206","0.621442450","172.217.9.234","192.168.1.118","TLSv1.2","1539","Certificate, Server Key Exchange, Server Hello Done"
"207","0.621478562","192.168.1.118","172.217.9.234","TCP","66","36904 → 443 [ACK] Seq=518 Ack=2892 Win=61696 Len=0 TSval=73327557 TSecr=1906808213"
"208","0.646760600","192.168.1.118","172.217.9.234","TLSv1.2","192","Client Key Exchange, Change Cipher Spec, Encrypted Handshake Message"
"209","0.677745375","172.217.9.234","192.168.1.118","TLSv1.2","117","Change Cipher Spec, Encrypted Handshake Message"
"210","0.702363612","192.168.1.118","172.217.9.234","TLSv1.2","338","Application Data"
"211","0.730831275","172.217.9.234","192.168.1.118","TCP","66","443 → 36904 [ACK] Seq=2943 Ack=916 Win=62464 Len=0 TSval=1906808328 TSecr=73327637"
"212","0.742023000","172.217.9.234","192.168.1.118","TLSv1.2","1186","Application Data"
"213","0.743035137","172.217.9.234","192.168.1.118","TLSv1.2","152","Application Data"
"214","0.743088612","172.217.9.234","192.168.1.118","TLSv1.2","100","Application Data"
"215","0.743232075","192.168.1.118","172.217.9.234","TCP","66","36904 → 443 [ACK] Seq=916 Ack=4183 Win=64128 Len=0 TSval=73327678 TSecr=1906808338"
"216","0.765239425","192.168.1.118","209.18.47.62","DNS","82","Standard query 0x75d4 A secure2.sfdcstatic.com"
"217","0.781728912","209.18.47.62","192.168.1.118","DNS","179","Standard query response 0x75d4 A secure2.sfdcstatic.com CNAME secure2.sfdcstatic.com.edgekey.net CNAME e4745.b.akamaiedge.net A 104.107.48.175"
"218","0.782049300","192.168.1.118","209.18.47.62","DNS","82","Standard query 0xd995 AAAA secure2.sfdcstatic.com"
"219","0.807065575","209.18.47.62","192.168.1.118","DNS","221","Standard query response 0xd995 AAAA secure2.sfdcstatic.com CNAME secure2.sfdcstatic.com.edgekey.net CNAME e4745.b.akamaiedge.net SOA n0b.akamaiedge.net"
"220","0.809235987","192.168.1.118","104.107.48.175","TCP","74","44256 → 443 [SYN] Seq=0 Win=64240 Len=0 MSS=1460 SACK_PERM=1 TSval=1023884524 TSecr=0 WS=128"
"221","0.815432575","192.168.1.118","136.147.56.1","TLSv1.2","385","Application Data"
"222","0.824234412","192.168.1.118","104.107.48.175","TLSv1.2","313","Application Data"
"223","0.832677387","104.107.48.175","192.168.1.118","TCP","74","443 → 44256 [SYN, ACK] Seq=0 Ack=1 Win=28960 Len=0 MSS=1460 SACK_PERM=1 TSval=887888185 TSecr=1023884524 WS=128"
"224","0.832863287","192.168.1.118","104.107.48.175","TCP","66","44256 → 443 [ACK] Seq=1 Ack=1 Win=64256 Len=0 TSval=1023884548 TSecr=887888185"
"225","0.849912775","192.168.1.118","104.107.48.175","TLSv1","583","Client Hello"
"226","0.850133462","192.168.1.118","104.107.48.175","TLSv1.2","315","Application Data"
"227","0.856023087","104.107.48.175","192.168.1.118","TLSv1.2","1043","Application Data"
"228","0.856096062","192.168.1.118","104.107.48.175","TCP","66","44250 → 443 [ACK] Seq=1651 Ack=37860 Win=63232 Len=0 TSval=1023884571 TSecr=887888210"
"229","0.860421875","192.168.1.118","104.107.48.175","TLSv1.2","317","Application Data"
"230","0.870887800","104.107.48.175","192.168.1.118","TCP","66","443 → 44256 [ACK] Seq=1 Ack=518 Win=30080 Len=0 TSval=887888223 TSecr=1023884565"
"231","0.870930125","192.168.1.118","104.107.48.175","TLSv1.2","316","Application Data"
"232","0.882417500","192.168.1.118","104.107.48.175","TLSv1.2","316","Application Data"
"233","0.882581462","104.107.48.175","192.168.1.118","TLSv1.2","1093","Application Data"
"234","0.882654725","192.168.1.118","104.107.48.175","TCP","66","44252 → 443 [ACK] Seq=1648 Ack=18198 Win=63104 Len=0 TSval=1023884598 TSecr=887888224"
"235","0.882696225","104.107.48.175","192.168.1.118","TLSv1.2","1514","Server Hello"
"236","0.882714212","192.168.1.118","104.107.48.175","TCP","66","44256 → 443 [ACK] Seq=518 Ack=1449 Win=63104 Len=0 TSval=1023884598 TSecr=887888225"
"237","0.882800487","104.107.48.175","192.168.1.118","TLSv1.2","1891","Certificate, Server Key Exchange, Server Hello Done"
"238","0.882820000","192.168.1.118","104.107.48.175","TCP","66","44256 → 443 [ACK] Seq=518 Ack=3274 Win=61312 Len=0 TSval=1023884598 TSecr=887888225"
"239","0.887317087","104.107.48.175","192.168.1.118","TLSv1.2","1123","Application Data"
"240","0.887375837","136.147.56.1","192.168.1.118","TCP","66","443 → 45224 [ACK] Seq=22736 Ack=320 Win=5245 Len=0 TSval=591054184 TSecr=771421578"
"241","0.887946075","192.168.1.118","104.107.48.175","TLSv1.2","192","Client Key Exchange, Change Cipher Spec, Encrypted Handshake Message"
"242","0.897756887","192.168.1.118","104.107.48.175","TLSv1.2","318","Application Data"
"243","0.914405037","104.107.48.175","192.168.1.118","TLSv1.2","1062","Application Data"
"244","0.914479350","192.168.1.118","104.107.48.175","TCP","66","44244 → 443 [ACK] Seq=1137 Ack=151194 Win=199680 Len=0 TSval=1023884630 TSecr=887888266"
"245","0.922584950","104.107.48.175","192.168.1.118","TCP","66","443 → 44256 [ACK] Seq=3274 Ack=644 Win=30080 Len=0 TSval=887888274 TSecr=1023884603"
"246","0.930180375","104.107.48.175","192.168.1.118","TLSv1.2","904","Application Data"
"247","0.930223662","192.168.1.118","104.107.48.175","TCP","66","44246 → 443 [ACK] Seq=1365 Ack=8338 Win=63360 Len=0 TSval=1023884645 TSecr=887888275"
"248","0.930259587","104.107.48.175","192.168.1.118","TLSv1.2","117","Change Cipher Spec, Encrypted Handshake Message"
"249","0.930896937","192.168.1.118","104.107.48.175","TLSv1.2","305","Application Data"
"250","0.937470150","104.107.48.175","192.168.1.118","TLSv1.2","1051","Application Data"
"251","0.939663737","192.168.1.118","104.107.48.175","TLSv1.2","316","Application Data"
"252","0.939790950","192.168.1.118","104.107.48.175","TLSv1.2","315","Application Data"
"253","0.944697775","192.168.1.118","104.107.48.175","TLSv1.2","316","Application Data"
"254","0.944827650","192.168.1.118","104.107.48.175","TLSv1.2","315","Application Data"
"255","0.946208462","192.168.1.118","192.168.1.102","TCP","176","40160 → 8009 [PSH, ACK] Seq=1 Ack=1 Win=501 Len=110 TSval=2234052807 TSecr=2388396 [TCP segment of a reassembled PDU]"
"256","0.959447975","192.168.1.102","192.168.1.118","TCP","176","8009 → 40160 [PSH, ACK] Seq=1 Ack=111 Win=344 Len=110 TSval=2388901 TSecr=2234052807 [TCP segment of a reassembled PDU]"
"257","0.959523750","192.168.1.118","192.168.1.102","TCP","66","40160 → 8009 [ACK] Seq=111 Ack=111 Win=501 Len=0 TSval=2234052821 TSecr=2388901"
"258","0.968001187","104.107.48.175","192.168.1.118","TLSv1.2","414","Application Data"
"259","0.970165037","192.168.1.118","209.18.47.62","DNS","76","Standard query 0x7d4b A a.sfdcstatic.com"
"260","0.977225862","104.107.48.175","192.168.1.118","TLSv1.2","1017","Application Data"
"261","0.979113700","104.107.48.175","192.168.1.118","TLSv1.2","1100","Application Data"
"262","0.979195925","192.168.1.118","104.107.48.175","TCP","66","44252 → 443 [ACK] Seq=1897 Ack=19232 Win=63104 Len=0 TSval=1023884694 TSecr=887888332"
"263","0.987172500","104.107.48.175","192.168.1.118","TLSv1.2","1061","Application Data"
"264","0.988399575","104.107.48.175","192.168.1.118","TLSv1.2","1056","Application Data"
"265","0.998674962","209.18.47.62","192.168.1.118","DNS","167","Standard query response 0x7d4b A a.sfdcstatic.com CNAME a.sfdcstatic.com.edgekey.net CNAME e4745.b.akamaiedge.net A 104.107.48.175"
"266","0.998958300","192.168.1.118","209.18.47.62","DNS","76","Standard query 0x6977 AAAA a.sfdcstatic.com"
"267","1.008684562","192.168.1.118","104.107.48.175","TCP","66","44256 → 443 [ACK] Seq=883 Ack=3673 Win=64128 Len=0 TSval=1023884724 TSecr=887888322"
"268","1.014473562","136.147.56.1","192.168.1.118","TCP","1414","[TCP segment of a reassembled PDU]"
"269","1.014621475","192.168.1.118","136.147.56.1","TCP","66","45224 → 443 [ACK] Seq=320 Ack=24084 Win=62008 Len=0 TSval=771421778 TSecr=591054311"
"270","1.015266800","136.147.56.1","192.168.1.118","TLSv1.2","123","Application Data"
"271","1.015351075","192.168.1.118","136.147.56.1","TCP","66","45224 → 443 [ACK] Seq=320 Ack=24141 Win=62008 Len=0 TSval=771421778 TSecr=591054311"
"272","1.017603325","192.168.1.118","104.107.48.175","TCP","66","44250 → 443 [ACK] Seq=2404 Ack=40853 Win=72832 Len=0 TSval=1023884733 TSecr=887888329"
"273","1.020463325","209.18.47.62","192.168.1.118","DNS","209","Standard query response 0x6977 AAAA a.sfdcstatic.com CNAME a.sfdcstatic.com.edgekey.net CNAME e4745.b.akamaiedge.net SOA n0b.akamaiedge.net"
"274","1.028616975","192.168.1.118","104.107.48.175","TCP","66","44246 → 443 [ACK] Seq=1614 Ack=9333 Win=64128 Len=0 TSval=1023884744 TSecr=887888340"
"275","1.028661262","192.168.1.118","104.107.48.175","TCP","66","44244 → 443 [ACK] Seq=1387 Ack=152184 Win=202624 Len=0 TSval=1023884744 TSecr=887888342"
"276","1.128651050","192.168.1.118","104.107.48.175","TCP","74","44258 → 443 [SYN] Seq=0 Win=64240 Len=0 MSS=1460 SACK_PERM=1 TSval=1023884844 TSecr=0 WS=128"
"277","1.146945550","104.107.48.175","192.168.1.118","TCP","74","443 → 44258 [SYN, ACK] Seq=0 Ack=1 Win=28960 Len=0 MSS=1460 SACK_PERM=1 TSval=887888501 TSecr=1023884844 WS=128"
"278","1.147035462","192.168.1.118","104.107.48.175","TCP","66","44258 → 443 [ACK] Seq=1 Ack=1 Win=64256 Len=0 TSval=1023884862 TSecr=887888501"
"279","1.186222600","192.168.1.118","104.107.48.175","TLSv1","583","Client Hello"
"280","1.214457450","104.107.48.175","192.168.1.118","TCP","66","443 → 44258 [ACK] Seq=1 Ack=518 Win=30080 Len=0 TSval=887888566 TSecr=1023884901"
"281","1.215775812","104.107.48.175","192.168.1.118","TLSv1.2","1514","Server Hello"
"282","1.215893075","192.168.1.118","104.107.48.175","TCP","66","44258 → 443 [ACK] Seq=518 Ack=1449 Win=63104 Len=0 TSval=1023884931 TSecr=887888568"
"283","1.217818337","104.107.48.175","192.168.1.118","TLSv1.2","1891","Certificate, Server Key Exchange, Server Hello Done"
"284","1.217930925","192.168.1.118","104.107.48.175","TCP","66","44258 → 443 [ACK] Seq=518 Ack=3274 Win=61312 Len=0 TSval=1023884933 TSecr=887888568"
"285","1.219889900","192.168.1.118","104.107.48.175","TLSv1.2","192","Client Key Exchange, Change Cipher Spec, Encrypted Handshake Message"
"286","1.244367150","104.107.48.175","192.168.1.118","TLSv1.2","117","Change Cipher Spec, Encrypted Handshake Message"
"287","1.244849925","192.168.1.118","104.107.48.175","TLSv1.2","327","Application Data"
"288","1.266697250","104.107.48.175","192.168.1.118","TCP","1514","[TCP segment of a reassembled PDU]"
"289","1.269507187","104.107.48.175","192.168.1.118","TLSv1.2","4802","Application Data"
"290","1.269727687","192.168.1.118","104.107.48.175","TCP","66","44258 → 443 [ACK] Seq=905 Ack=9509 Win=64128 Len=0 TSval=1023884985 TSecr=887888619"
"291","3.209539787","192.168.1.104","255.255.255.255","UDP","217","49154 → 6666 Len=175"
"292","3.411771275","192.168.1.118","172.217.3.99","TCP","66","38436 → 80 [ACK] Seq=1 Ack=1 Win=502 Len=0 TSval=4164906239 TSecr=3892000339"
"293","3.431706887","172.217.3.99","192.168.1.118","TCP","66","[TCP ACKed unseen segment] 80 → 38436 [ACK] Seq=1 Ack=2 Win=240 Len=0 TSval=3892045396 TSecr=4164815731"
"294","3.924392650","Cisco-Li_5b:1c:ce","IntelCor_b7:52:73","ARP","42","Who has 192.168.1.118? Tell 192.168.1.1"
"295","3.924457862","IntelCor_b7:52:73","Cisco-Li_5b:1c:ce","ARP","42","192.168.1.118 is at dc:fb:48:b7:52:73"
"296","5.365957400","192.168.1.100","224.0.0.251","MDNS","557","Standard query 0x0000 PTR _airport._tcp.local, "QM" question PTR _googlecast._tcp.local, "QM" question PTR _homekit._tcp.local, "QM" question PTR _raop._tcp.local, "QM" question PTR _airplay._tcp.local, "QM" question PTR _rdlink._tcp.local, "QM" question PTR _uscans._tcp.local, "QM" question PTR _uscan._tcp.local, "QM" question PTR _ippusb._tcp.local, "QM" question PTR _ipp._tcp.local, "QM" question PTR _scanner._tcp.local, "QM" question PTR _ipps._tcp.local, "QM" question PTR _printer._tcp.local, "QM" question PTR _pdl-datastream._tcp.local, "QM" question PTR _ptp._tcp.local, "QM" question PTR _afpovertcp._tcp.local, "QM" question PTR _smb._tcp.local, "QM" question PTR _rfb._tcp.local, "QM" question PTR _adisk._tcp.local, "QM" question PTR _companion-link._tcp.local, "QM" question PTR _apple-mobdev._tcp.local, "QM" question PTR 8ed307c3._sub._apple-mobdev2._tcp.local, "QM" question PTR _apple-pairable._tcp.local, "QM" question PTR Google-Home-Mini-2c3f16b2da5c4b6fd6cfbfba61c12490._googlecast._tcp.local PTR cjqg._smb._tcp.local PTR cjqg._companion-link._tcp.local OPT"
"297","5.963060025","192.168.1.118","192.168.1.102","TCP","176","40160 → 8009 [PSH, ACK] Seq=111 Ack=111 Win=501 Len=110 TSval=2234057824 TSecr=2388901 [TCP segment of a reassembled PDU]"
"298","5.972128487","192.168.1.102","192.168.1.118","TCP","176","8009 → 40160 [PSH, ACK] Seq=111 Ack=221 Win=344 Len=110 TSval=2389401 TSecr=2234057824 [TCP segment of a reassembled PDU]"
"299","5.972312625","192.168.1.118","192.168.1.102","TCP","66","40160 → 8009 [ACK] Seq=221 Ack=221 Win=501 Len=0 TSval=2234057833 TSecr=2389401"
"300","6.180079100","192.168.1.104","255.255.255.255","UDP","217","49154 → 6666 Len=175"
